[I 2023-11-22 20:08:23,799] Trial 197 finished with value: 2.3221009143279607 and parameters: {'model_name': 'SimpleImputer', 'strategy': 'mean'}. Best is trial 6 with value: 2.3221009143279607.
simple fit
simple transform
[I 2023-11-22 20:08:29,908] A new study created in memory with name: no-name-d58eba62-947f-48e6-85a3-40e1b244f378
  0%|          | 0/200 [00:00<?, ?it/s]                                       [W 2023-11-22 20:08:29,918] Trial 2 failed with parameters: {'model_name': 'IterativeImputer', 'estimator': 'Ridge', 'sample_posterior': True, 'initial_strategy': 'constant', 'imputation_order': 'roman'} because of the following error: TypeError("SimpleImputer.__init__() got an unexpected keyword argument 'estimator'").
Traceback (most recent call last):
  File "/home/ketrong/miniconda3/envs/tpot2devenv/lib/python3.10/site-packages/optuna/study/_optimize.py", line 200, in _run_trial
    value_or_values = func(trial)
  File "/common/ketrong/AutoImputeExp/tpot2_imputetest/Impute_Experiments/autoimpute.py", line 57, in obj
    my_model = autoutils.MyModel(random_state = self.random_state, **my_params)
  File "/common/ketrong/AutoImputeExp/tpot2_imputetest/Impute_Experiments/autoutils.py", line 34, in MyModel
    this_model = SimpleImputer(
TypeError: SimpleImputer.__init__() got an unexpected keyword argument 'estimator'
  0%|          | 0/200 [00:00<?, ?it/s]                                       [W 2023-11-22 20:08:29,936] Trial 2 failed with value None.
  0%|          | 0/200 [00:00<?, ?it/s][W 2023-11-22 20:08:30,148] Trial 3 failed with parameters: {'model_name': 'IterativeImputer', 'estimator': 'KNN', 'sample_posterior': True, 'initial_strategy': 'median', 'imputation_order': 'random'} because of the following error: TypeError("SimpleImputer.__init__() got an unexpected keyword argument 'estimator'").
Traceback (most recent call last):
  File "/home/ketrong/miniconda3/envs/tpot2devenv/lib/python3.10/site-packages/optuna/study/_optimize.py", line 200, in _run_trial
    value_or_values = func(trial)
  File "/common/ketrong/AutoImputeExp/tpot2_imputetest/Impute_Experiments/autoimpute.py", line 57, in obj
    my_model = autoutils.MyModel(random_state = self.random_state, **my_params)
  File "/common/ketrong/AutoImputeExp/tpot2_imputetest/Impute_Experiments/autoutils.py", line 34, in MyModel
    this_model = SimpleImputer(
TypeError: SimpleImputer.__init__() got an unexpected keyword argument 'estimator'
                                         0%|          | 0/200 [00:00<?, ?it/s]                                         0%|          | 0/200 [00:00<?, ?it/s][W 2023-11-22 20:08:30,152] Trial 3 failed with value None.
                                       [W 2023-11-22 20:08:30,638] Trial 21 failed with parameters: {'model_name': 'KNNImputer', 'weights': 'uniform', 'keep_empty_features': False} because of the following error: TypeError("SimpleImputer.__init__() got an unexpected keyword argument 'n_neighbors'").
Traceback (most recent call last):
  File "/home/ketrong/miniconda3/envs/tpot2devenv/lib/python3.10/site-packages/optuna/study/_optimize.py", line 200, in _run_trial
    value_or_values = func(trial)
  File "/common/ketrong/AutoImputeExp/tpot2_imputetest/Impute_Experiments/autoimpute.py", line 57, in obj
    my_model = autoutils.MyModel(random_state = self.random_state, **my_params)
  File "/common/ketrong/AutoImputeExp/tpot2_imputetest/Impute_Experiments/autoutils.py", line 34, in MyModel
    this_model = SimpleImputer(
TypeError: SimpleImputer.__init__() got an unexpected keyword argument 'n_neighbors'
  0%|          | 0/200 [00:00<?, ?it/s][W 2023-11-22 20:08:30,643] Trial 21 failed with value None.
                                         0%|          | 0/200 [00:00<?, ?it/s]                                       [W 2023-11-22 20:08:30,839] Trial 14 failed with parameters: {'model_name': 'KNNImputer', 'weights': 'distance', 'keep_empty_features': False} because of the following error: TypeError("SimpleImputer.__init__() got an unexpected keyword argument 'n_neighbors'").
Traceback (most recent call last):
  File "/home/ketrong/miniconda3/envs/tpot2devenv/lib/python3.10/site-packages/optuna/study/_optimize.py", line 200, in _run_trial
    value_or_values = func(trial)
  File "/common/ketrong/AutoImputeExp/tpot2_imputetest/Impute_Experiments/autoimpute.py", line 57, in obj
    my_model = autoutils.MyModel(random_state = self.random_state, **my_params)
  File "/common/ketrong/AutoImputeExp/tpot2_imputetest/Impute_Experiments/autoutils.py", line 34, in MyModel
    this_model = SimpleImputer(
TypeError: SimpleImputer.__init__() got an unexpected keyword argument 'n_neighbors'
  0%|          | 0/200 [00:00<?, ?it/s]                                         0%|          | 0/200 [00:00<?, ?it/s][W 2023-11-22 20:08:30,840] Trial 14 failed with value None.
[W 2023-11-22 20:08:31,029] Trial 9 failed with parameters: {'model_name': 'IterativeImputer', 'estimator': 'KNN', 'sample_posterior': False, 'initial_strategy': 'constant', 'imputation_order': 'random'} because of the following error: TypeError("SimpleImputer.__init__() got an unexpected keyword argument 'estimator'").
Traceback (most recent call last):
  File "/home/ketrong/miniconda3/envs/tpot2devenv/lib/python3.10/site-packages/optuna/study/_optimize.py", line 200, in _run_trial
    value_or_values = func(trial)
  File "/common/ketrong/AutoImputeExp/tpot2_imputetest/Impute_Experiments/autoimpute.py", line 57, in obj
    my_model = autoutils.MyModel(random_state = self.random_state, **my_params)
  File "/common/ketrong/AutoImputeExp/tpot2_imputetest/Impute_Experiments/autoutils.py", line 34, in MyModel
    this_model = SimpleImputer(
TypeError: SimpleImputer.__init__() got an unexpected keyword argument 'estimator'
                                         0%|          | 0/200 [00:01<?, ?it/s]                                       [W 2023-11-22 20:08:31,031] Trial 9 failed with value None.
  0%|          | 0/200 [00:01<?, ?it/s]                                       [W 2023-11-22 20:08:31,269] Trial 43 failed with parameters: {'model_name': 'KNNImputer', 'weights': 'distance', 'keep_empty_features': False} because of the following error: TypeError("SimpleImputer.__init__() got an unexpected keyword argument 'n_neighbors'").
Traceback (most recent call last):
  File "/home/ketrong/miniconda3/envs/tpot2devenv/lib/python3.10/site-packages/optuna/study/_optimize.py", line 200, in _run_trial
    value_or_values = func(trial)
  File "/common/ketrong/AutoImputeExp/tpot2_imputetest/Impute_Experiments/autoimpute.py", line 57, in obj
    my_model = autoutils.MyModel(random_state = self.random_state, **my_params)
  File "/common/ketrong/AutoImputeExp/tpot2_imputetest/Impute_Experiments/autoutils.py", line 34, in MyModel
    this_model = SimpleImputer(
TypeError: SimpleImputer.__init__() got an unexpected keyword argument 'n_neighbors'
  0%|          | 0/200 [00:01<?, ?it/s]                                       [W 2023-11-22 20:08:31,270] Trial 43 failed with value None.
  0%|          | 0/200 [00:01<?, ?it/s]                                       [W 2023-11-22 20:08:31,440] Trial 29 failed with parameters: {'model_name': 'KNNImputer', 'weights': 'distance', 'keep_empty_features': False} because of the following error: TypeError("SimpleImputer.__init__() got an unexpected keyword argument 'n_neighbors'").
Traceback (most recent call last):
  File "/home/ketrong/miniconda3/envs/tpot2devenv/lib/python3.10/site-packages/optuna/study/_optimize.py", line 200, in _run_trial
    value_or_values = func(trial)
  File "/common/ketrong/AutoImputeExp/tpot2_imputetest/Impute_Experiments/autoimpute.py", line 57, in obj
    my_model = autoutils.MyModel(random_state = self.random_state, **my_params)
  File "/common/ketrong/AutoImputeExp/tpot2_imputetest/Impute_Experiments/autoutils.py", line 34, in MyModel
    this_model = SimpleImputer(
TypeError: SimpleImputer.__init__() got an unexpected keyword argument 'n_neighbors'
  0%|          | 0/200 [00:01<?, ?it/s]                                       [W 2023-11-22 20:08:31,444] Trial 29 failed with value None.
  0%|          | 0/200 [00:01<?, ?it/s]                                       [W 2023-11-22 20:08:31,663] Trial 17 failed with parameters: {'model_name': 'KNNImputer', 'weights': 'distance', 'keep_empty_features': False} because of the following error: TypeError("SimpleImputer.__init__() got an unexpected keyword argument 'n_neighbors'").
Traceback (most recent call last):
  File "/home/ketrong/miniconda3/envs/tpot2devenv/lib/python3.10/site-packages/optuna/study/_optimize.py", line 200, in _run_trial
    value_or_values = func(trial)
  File "/common/ketrong/AutoImputeExp/tpot2_imputetest/Impute_Experiments/autoimpute.py", line 57, in obj
    my_model = autoutils.MyModel(random_state = self.random_state, **my_params)
  File "/common/ketrong/AutoImputeExp/tpot2_imputetest/Impute_Experiments/autoutils.py", line 34, in MyModel
    this_model = SimpleImputer(
TypeError: SimpleImputer.__init__() got an unexpected keyword argument 'n_neighbors'
  0%|          | 0/200 [00:01<?, ?it/s]                                       [W 2023-11-22 20:08:31,666] Trial 17 failed with value None.
  0%|          | 0/200 [00:01<?, ?it/s][W 2023-11-22 20:08:31,666] Trial 10 failed with parameters: {'model_name': 'GAIN', 'batch_size': 44, 'hint_rate': 0.3371113115552132, 'alpha': 73, 'iterations': 6666} because of the following error: TypeError("SimpleImputer.__init__() got an unexpected keyword argument 'batch_size'").
Traceback (most recent call last):
  File "/home/ketrong/miniconda3/envs/tpot2devenv/lib/python3.10/site-packages/optuna/study/_optimize.py", line 200, in _run_trial
    value_or_values = func(trial)
  File "/common/ketrong/AutoImputeExp/tpot2_imputetest/Impute_Experiments/autoimpute.py", line 57, in obj
    my_model = autoutils.MyModel(random_state = self.random_state, **my_params)
  File "/common/ketrong/AutoImputeExp/tpot2_imputetest/Impute_Experiments/autoutils.py", line 34, in MyModel
    this_model = SimpleImputer(
TypeError: SimpleImputer.__init__() got an unexpected keyword argument 'batch_size'
                                         0%|          | 0/200 [00:01<?, ?it/s]                                       [W 2023-11-22 20:08:31,862] Trial 10 failed with value None.
  0%|          | 0/200 [00:01<?, ?it/s][W 2023-11-22 20:08:31,683] Trial 15 failed with parameters: {'model_name': 'GAIN', 'batch_size': 344, 'hint_rate': 0.014783430387021838, 'alpha': 76, 'iterations': 45262} because of the following error: TypeError("SimpleImputer.__init__() got an unexpected keyword argument 'batch_size'").
Traceback (most recent call last):
  File "/home/ketrong/miniconda3/envs/tpot2devenv/lib/python3.10/site-packages/optuna/study/_optimize.py", line 200, in _run_trial
    value_or_values = func(trial)
  File "/common/ketrong/AutoImputeExp/tpot2_imputetest/Impute_Experiments/autoimpute.py", line 57, in obj
    my_model = autoutils.MyModel(random_state = self.random_state, **my_params)
  File "/common/ketrong/AutoImputeExp/tpot2_imputetest/Impute_Experiments/autoutils.py", line 34, in MyModel
    this_model = SimpleImputer(
TypeError: SimpleImputer.__init__() got an unexpected keyword argument 'batch_size'
                                         0%|          | 0/200 [00:02<?, ?it/s]                                       [W 2023-11-22 20:08:32,029] Trial 15 failed with value None.
  0%|          | 0/200 [00:02<?, ?it/s][I 2023-11-22 20:08:32,230] Trial 5 finished with value: 2.354732743906972 and parameters: {'model_name': 'SimpleImputer', 'strategy': 'mean'}. Best is trial 5 with value: 2.354732743906972.
                                         0%|          | 0/200 [00:02<?, ?it/s]Best trial: 5. Best value: 2.35473:   0%|          | 0/200 [00:02<?, ?it/s]Best trial: 5. Best value: 2.35473:   0%|          | 1/200 [00:02<08:14,  2.49s/it][I 2023-11-22 20:08:32,418] Trial 20 finished with value: 6.662601810506205 and parameters: {'model_name': 'SimpleImputer', 'strategy': 'constant'}. Best is trial 5 with value: 2.354732743906972.
                                                                                   Best trial: 5. Best value: 2.35473:   0%|          | 1/200 [00:02<08:14,  2.49s/it]Best trial: 5. Best value: 2.35473:   0%|          | 1/200 [00:02<08:14,  2.49s/it]Best trial: 5. Best value: 2.35473:   1%|          | 2/200 [00:02<03:44,  1.14s/it][W 2023-11-22 20:08:32,678] Trial 32 failed with parameters: {'model_name': 'KNNImputer', 'weights': 'distance', 'keep_empty_features': True} because of the following error: TypeError("SimpleImputer.__init__() got an unexpected keyword argument 'n_neighbors'").
Traceback (most recent call last):
  File "/home/ketrong/miniconda3/envs/tpot2devenv/lib/python3.10/site-packages/optuna/study/_optimize.py", line 200, in _run_trial
    value_or_values = func(trial)
  File "/common/ketrong/AutoImputeExp/tpot2_imputetest/Impute_Experiments/autoimpute.py", line 57, in obj
    my_model = autoutils.MyModel(random_state = self.random_state, **my_params)
  File "/common/ketrong/AutoImputeExp/tpot2_imputetest/Impute_Experiments/autoutils.py", line 34, in MyModel
    this_model = SimpleImputer(
TypeError: SimpleImputer.__init__() got an unexpected keyword argument 'n_neighbors'
                                                                                   Best trial: 5. Best value: 2.35473:   1%|          | 2/200 [00:02<03:44,  1.14s/it]                                                                                   Best trial: 5. Best value: 2.35473:   1%|          | 2/200 [00:02<03:44,  1.14s/it][W 2023-11-22 20:08:32,678] Trial 32 failed with value None.
