[I 2023-11-22 20:07:59,243] Trial 87 finished with value: 2.4846447434420242 and parameters: {'model_name': 'SimpleImputer', 'strategy': 'most_frequent'}. Best is trial 6 with value: 2.3221009143279607.
[I 2023-11-22 20:07:59,522] Trial 81 finished with value: 2.4846447434420242 and parameters: {'model_name': 'SimpleImputer', 'strategy': 'most_frequent'}. Best is trial 6 with value: 2.3221009143279607.
[I 2023-11-22 20:07:59,848] Trial 113 finished with value: 2.3221009143279607 and parameters: {'model_name': 'SimpleImputer', 'strategy': 'mean'}. Best is trial 6 with value: 2.3221009143279607.
[I 2023-11-22 20:08:00,108] Trial 118 finished with value: 2.3221009143279607 and parameters: {'model_name': 'SimpleImputer', 'strategy': 'mean'}. Best is trial 6 with value: 2.3221009143279607.
[I 2023-11-22 20:08:00,477] Trial 89 finished with value: 2.4846447434420242 and parameters: {'model_name': 'SimpleImputer', 'strategy': 'most_frequent'}. Best is trial 6 with value: 2.3221009143279607.
[I 2023-11-22 20:08:00,657] Trial 114 finished with value: 2.3221009143279607 and parameters: {'model_name': 'SimpleImputer', 'strategy': 'mean'}. Best is trial 6 with value: 2.3221009143279607.
[I 2023-11-22 20:08:00,924] Trial 90 finished with value: 2.4846447434420242 and parameters: {'model_name': 'SimpleImputer', 'strategy': 'most_frequent'}. Best is trial 6 with value: 2.3221009143279607.
[I 2023-11-22 20:08:01,144] Trial 116 finished with value: 2.3221009143279607 and parameters: {'model_name': 'SimpleImputer', 'strategy': 'mean'}. Best is trial 6 with value: 2.3221009143279607.
[I 2023-11-22 20:08:01,530] Trial 92 finished with value: 2.4846447434420242 and parameters: {'model_name': 'SimpleImputer', 'strategy': 'most_frequent'}. Best is trial 6 with value: 2.3221009143279607.
[I 2023-11-22 20:08:01,745] Trial 119 finished with value: 2.3221009143279607 and parameters: {'model_name': 'SimpleImputer', 'strategy': 'mean'}. Best is trial 6 with value: 2.3221009143279607.
[I 2023-11-22 20:08:01,977] Trial 91 finished with value: 2.4846447434420242 and parameters: {'model_name': 'SimpleImputer', 'strategy': 'most_frequent'}. Best is trial 6 with value: 2.3221009143279607.
[I 2023-11-22 20:08:02,227] Trial 124 finished with value: 2.3221009143279607 and parameters: {'model_name': 'SimpleImputer', 'strategy': 'mean'}. Best is trial 6 with value: 2.3221009143279607.
[I 2023-11-22 20:08:02,501] Trial 120 finished with value: 2.3221009143279607 and parameters: {'model_name': 'SimpleImputer', 'strategy': 'mean'}. Best is trial 6 with value: 2.3221009143279607.
[I 2023-11-22 20:08:02,738] Trial 115 finished with value: 2.3221009143279607 and parameters: {'model_name': 'SimpleImputer', 'strategy': 'mean'}. Best is trial 6 with value: 2.3221009143279607.
[I 2023-11-22 20:08:02,946] Trial 125 finished with value: 2.3221009143279607 and parameters: {'model_name': 'SimpleImputer', 'strategy': 'mean'}. Best is trial 6 with value: 2.3221009143279607.
[I 2023-11-22 20:08:03,183] Trial 117 finished with value: 2.3221009143279607 and parameters: {'model_name': 'SimpleImputer', 'strategy': 'mean'}. Best is trial 6 with value: 2.3221009143279607.
[I 2023-11-22 20:08:03,433] Trial 126 finished with value: 2.3221009143279607 and parameters: {'model_name': 'SimpleImputer', 'strategy': 'mean'}. Best is trial 6 with value: 2.3221009143279607.
[I 2023-11-22 20:08:03,618] Trial 121 finished with value: 2.3221009143279607 and parameters: {'model_name': 'SimpleImputer', 'strategy': 'mean'}. Best is trial 6 with value: 2.3221009143279607.
[I 2023-11-22 20:08:03,863] Trial 123 finished with value: 2.3221009143279607 and parameters: {'model_name': 'SimpleImputer', 'strategy': 'mean'}. Best is trial 6 with value: 2.3221009143279607.
[I 2023-11-22 20:08:04,205] Trial 130 finished with value: 2.3221009143279607 and parameters: {'model_name': 'SimpleImputer', 'strategy': 'mean'}. Best is trial 6 with value: 2.3221009143279607.
[I 2023-11-22 20:08:04,428] Trial 131 finished with value: 2.3221009143279607 and parameters: {'model_name': 'SimpleImputer', 'strategy': 'mean'}. Best is trial 6 with value: 2.3221009143279607.
[I 2023-11-22 20:08:04,642] Trial 127 finished with value: 2.3221009143279607 and parameters: {'model_name': 'SimpleImputer', 'strategy': 'mean'}. Best is trial 6 with value: 2.3221009143279607.
[I 2023-11-22 20:08:04,813] Trial 128 finished with value: 2.3221009143279607 and parameters: {'model_name': 'SimpleImputer', 'strategy': 'mean'}. Best is trial 6 with value: 2.3221009143279607.
[I 2023-11-22 20:08:05,043] Trial 129 finished with value: 2.3221009143279607 and parameters: {'model_name': 'SimpleImputer', 'strategy': 'mean'}. Best is trial 6 with value: 2.3221009143279607.
[I 2023-11-22 20:08:05,321] Trial 122 finished with value: 2.3221009143279607 and parameters: {'model_name': 'SimpleImputer', 'strategy': 'mean'}. Best is trial 6 with value: 2.3221009143279607.
[I 2023-11-22 20:08:05,742] Trial 96 finished with value: 2.4846447434420242 and parameters: {'model_name': 'SimpleImputer', 'strategy': 'most_frequent'}. Best is trial 6 with value: 2.3221009143279607.
[I 2023-11-22 20:08:05,976] Trial 133 finished with value: 2.3221009143279607 and parameters: {'model_name': 'SimpleImputer', 'strategy': 'mean'}. Best is trial 6 with value: 2.3221009143279607.
[I 2023-11-22 20:08:06,239] Trial 134 finished with value: 2.3221009143279607 and parameters: {'model_name': 'SimpleImputer', 'strategy': 'mean'}. Best is trial 6 with value: 2.3221009143279607.
[I 2023-11-22 20:08:06,469] Trial 137 finished with value: 2.3221009143279607 and parameters: {'model_name': 'SimpleImputer', 'strategy': 'mean'}. Best is trial 6 with value: 2.3221009143279607.
[I 2023-11-22 20:08:06,701] Trial 132 finished with value: 2.3221009143279607 and parameters: {'model_name': 'SimpleImputer', 'strategy': 'mean'}. Best is trial 6 with value: 2.3221009143279607.
[I 2023-11-22 20:08:07,048] Trial 99 finished with value: 2.4846447434420242 and parameters: {'model_name': 'SimpleImputer', 'strategy': 'most_frequent'}. Best is trial 6 with value: 2.3221009143279607.
[I 2023-11-22 20:08:07,297] Trial 138 finished with value: 2.3221009143279607 and parameters: {'model_name': 'SimpleImputer', 'strategy': 'mean'}. Best is trial 6 with value: 2.3221009143279607.
[I 2023-11-22 20:08:07,561] Trial 93 finished with value: 2.4846447434420242 and parameters: {'model_name': 'SimpleImputer', 'strategy': 'most_frequent'}. Best is trial 6 with value: 2.3221009143279607.
[I 2023-11-22 20:08:07,889] Trial 97 finished with value: 2.4846447434420242 and parameters: {'model_name': 'SimpleImputer', 'strategy': 'most_frequent'}. Best is trial 6 with value: 2.3221009143279607.
[I 2023-11-22 20:08:08,167] Trial 135 finished with value: 2.3221009143279607 and parameters: {'model_name': 'SimpleImputer', 'strategy': 'mean'}. Best is trial 6 with value: 2.3221009143279607.
[I 2023-11-22 20:08:08,335] Trial 136 finished with value: 2.3221009143279607 and parameters: {'model_name': 'SimpleImputer', 'strategy': 'mean'}. Best is trial 6 with value: 2.3221009143279607.
[I 2023-11-22 20:08:08,778] Trial 144 finished with value: 2.3221009143279607 and parameters: {'model_name': 'SimpleImputer', 'strategy': 'mean'}. Best is trial 6 with value: 2.3221009143279607.
[I 2023-11-22 20:08:09,138] Trial 140 finished with value: 2.3221009143279607 and parameters: {'model_name': 'SimpleImputer', 'strategy': 'mean'}. Best is trial 6 with value: 2.3221009143279607.
[I 2023-11-22 20:08:09,503] Trial 145 finished with value: 2.3221009143279607 and parameters: {'model_name': 'SimpleImputer', 'strategy': 'mean'}. Best is trial 6 with value: 2.3221009143279607.
[I 2023-11-22 20:08:09,748] Trial 152 finished with value: 2.3221009143279607 and parameters: {'model_name': 'SimpleImputer', 'strategy': 'mean'}. Best is trial 6 with value: 2.3221009143279607.
[I 2023-11-22 20:08:09,982] Trial 151 finished with value: 2.3221009143279607 and parameters: {'model_name': 'SimpleImputer', 'strategy': 'mean'}. Best is trial 6 with value: 2.3221009143279607.
[I 2023-11-22 20:08:10,176] Trial 142 finished with value: 2.3221009143279607 and parameters: {'model_name': 'SimpleImputer', 'strategy': 'mean'}. Best is trial 6 with value: 2.3221009143279607.
[I 2023-11-22 20:08:10,421] Trial 149 finished with value: 2.3221009143279607 and parameters: {'model_name': 'SimpleImputer', 'strategy': 'mean'}. Best is trial 6 with value: 2.3221009143279607.
[I 2023-11-22 20:08:10,658] Trial 141 finished with value: 2.3221009143279607 and parameters: {'model_name': 'SimpleImputer', 'strategy': 'mean'}. Best is trial 6 with value: 2.3221009143279607.
[I 2023-11-22 20:08:10,834] Trial 147 finished with value: 2.3221009143279607 and parameters: {'model_name': 'SimpleImputer', 'strategy': 'mean'}. Best is trial 6 with value: 2.3221009143279607.
[I 2023-11-22 20:08:11,067] Trial 143 finished with value: 2.3221009143279607 and parameters: {'model_name': 'SimpleImputer', 'strategy': 'mean'}. Best is trial 6 with value: 2.3221009143279607.
[I 2023-11-22 20:08:11,240] Trial 146 finished with value: 2.3221009143279607 and parameters: {'model_name': 'SimpleImputer', 'strategy': 'mean'}. Best is trial 6 with value: 2.3221009143279607.
[I 2023-11-22 20:08:11,433] Trial 148 finished with value: 2.3221009143279607 and parameters: {'model_name': 'SimpleImputer', 'strategy': 'mean'}. Best is trial 6 with value: 2.3221009143279607.
[I 2023-11-22 20:08:11,654] Trial 139 finished with value: 2.3221009143279607 and parameters: {'model_name': 'SimpleImputer', 'strategy': 'mean'}. Best is trial 6 with value: 2.3221009143279607.
[I 2023-11-22 20:08:11,841] Trial 95 finished with value: 2.4846447434420242 and parameters: {'model_name': 'SimpleImputer', 'strategy': 'most_frequent'}. Best is trial 6 with value: 2.3221009143279607.
[I 2023-11-22 20:08:12,138] Trial 153 finished with value: 2.3221009143279607 and parameters: {'model_name': 'SimpleImputer', 'strategy': 'mean'}. Best is trial 6 with value: 2.3221009143279607.
[I 2023-11-22 20:08:12,359] Trial 98 finished with value: 2.4846447434420242 and parameters: {'model_name': 'SimpleImputer', 'strategy': 'most_frequent'}. Best is trial 6 with value: 2.3221009143279607.
[I 2023-11-22 20:08:12,585] Trial 100 finished with value: 2.4846447434420242 and parameters: {'model_name': 'SimpleImputer', 'strategy': 'most_frequent'}. Best is trial 6 with value: 2.3221009143279607.
[I 2023-11-22 20:08:12,822] Trial 101 finished with value: 2.4846447434420242 and parameters: {'model_name': 'SimpleImputer', 'strategy': 'most_frequent'}. Best is trial 6 with value: 2.3221009143279607.
[I 2023-11-22 20:08:13,062] Trial 154 finished with value: 2.3221009143279607 and parameters: {'model_name': 'SimpleImputer', 'strategy': 'mean'}. Best is trial 6 with value: 2.3221009143279607.
[I 2023-11-22 20:08:13,486] Trial 160 finished with value: 2.3221009143279607 and parameters: {'model_name': 'SimpleImputer', 'strategy': 'mean'}. Best is trial 6 with value: 2.3221009143279607.
[I 2023-11-22 20:08:13,743] Trial 155 finished with value: 2.3221009143279607 and parameters: {'model_name': 'SimpleImputer', 'strategy': 'mean'}. Best is trial 6 with value: 2.3221009143279607.
[I 2023-11-22 20:08:13,962] Trial 150 finished with value: 2.3221009143279607 and parameters: {'model_name': 'SimpleImputer', 'strategy': 'mean'}. Best is trial 6 with value: 2.3221009143279607.
[I 2023-11-22 20:08:14,202] Trial 158 finished with value: 2.3221009143279607 and parameters: {'model_name': 'SimpleImputer', 'strategy': 'mean'}. Best is trial 6 with value: 2.3221009143279607.
[I 2023-11-22 20:08:14,465] Trial 159 finished with value: 2.3221009143279607 and parameters: {'model_name': 'SimpleImputer', 'strategy': 'mean'}. Best is trial 6 with value: 2.3221009143279607.
[I 2023-11-22 20:08:14,690] Trial 157 finished with value: 2.3221009143279607 and parameters: {'model_name': 'SimpleImputer', 'strategy': 'mean'}. Best is trial 6 with value: 2.3221009143279607.
[I 2023-11-22 20:08:14,944] Trial 167 finished with value: 2.3221009143279607 and parameters: {'model_name': 'SimpleImputer', 'strategy': 'mean'}. Best is trial 6 with value: 2.3221009143279607.
[I 2023-11-22 20:08:15,191] Trial 166 finished with value: 2.3221009143279607 and parameters: {'model_name': 'SimpleImputer', 'strategy': 'mean'}. Best is trial 6 with value: 2.3221009143279607.
[I 2023-11-22 20:08:15,392] Trial 161 finished with value: 2.3221009143279607 and parameters: {'model_name': 'SimpleImputer', 'strategy': 'mean'}. Best is trial 6 with value: 2.3221009143279607.
[I 2023-11-22 20:08:15,592] Trial 163 finished with value: 2.3221009143279607 and parameters: {'model_name': 'SimpleImputer', 'strategy': 'mean'}. Best is trial 6 with value: 2.3221009143279607.
[I 2023-11-22 20:08:15,857] Trial 164 finished with value: 2.3221009143279607 and parameters: {'model_name': 'SimpleImputer', 'strategy': 'mean'}. Best is trial 6 with value: 2.3221009143279607.
[I 2023-11-22 20:08:16,039] Trial 156 finished with value: 2.3221009143279607 and parameters: {'model_name': 'SimpleImputer', 'strategy': 'mean'}. Best is trial 6 with value: 2.3221009143279607.
[I 2023-11-22 20:08:16,442] Trial 162 finished with value: 2.3221009143279607 and parameters: {'model_name': 'SimpleImputer', 'strategy': 'mean'}. Best is trial 6 with value: 2.3221009143279607.
[I 2023-11-22 20:08:16,640] Trial 170 finished with value: 2.3221009143279607 and parameters: {'model_name': 'SimpleImputer', 'strategy': 'mean'}. Best is trial 6 with value: 2.3221009143279607.
[I 2023-11-22 20:08:16,857] Trial 165 finished with value: 2.3221009143279607 and parameters: {'model_name': 'SimpleImputer', 'strategy': 'mean'}. Best is trial 6 with value: 2.3221009143279607.
[I 2023-11-22 20:08:17,142] Trial 178 finished with value: 2.3221009143279607 and parameters: {'model_name': 'SimpleImputer', 'strategy': 'mean'}. Best is trial 6 with value: 2.3221009143279607.
[I 2023-11-22 20:08:17,437] Trial 179 finished with value: 2.3221009143279607 and parameters: {'model_name': 'SimpleImputer', 'strategy': 'mean'}. Best is trial 6 with value: 2.3221009143279607.
[I 2023-11-22 20:08:17,657] Trial 171 finished with value: 2.3221009143279607 and parameters: {'model_name': 'SimpleImputer', 'strategy': 'mean'}. Best is trial 6 with value: 2.3221009143279607.
[I 2023-11-22 20:08:17,837] Trial 173 finished with value: 2.3221009143279607 and parameters: {'model_name': 'SimpleImputer', 'strategy': 'mean'}. Best is trial 6 with value: 2.3221009143279607.
[I 2023-11-22 20:08:18,066] Trial 168 finished with value: 2.3221009143279607 and parameters: {'model_name': 'SimpleImputer', 'strategy': 'mean'}. Best is trial 6 with value: 2.3221009143279607.
[I 2023-11-22 20:08:18,258] Trial 169 finished with value: 2.3221009143279607 and parameters: {'model_name': 'SimpleImputer', 'strategy': 'mean'}. Best is trial 6 with value: 2.3221009143279607.
[I 2023-11-22 20:08:18,504] Trial 174 finished with value: 2.3221009143279607 and parameters: {'model_name': 'SimpleImputer', 'strategy': 'mean'}. Best is trial 6 with value: 2.3221009143279607.
[I 2023-11-22 20:08:18,733] Trial 172 finished with value: 2.3221009143279607 and parameters: {'model_name': 'SimpleImputer', 'strategy': 'mean'}. Best is trial 6 with value: 2.3221009143279607.
[I 2023-11-22 20:08:19,037] Trial 181 finished with value: 2.3221009143279607 and parameters: {'model_name': 'SimpleImputer', 'strategy': 'mean'}. Best is trial 6 with value: 2.3221009143279607.
[I 2023-11-22 20:08:19,269] Trial 182 finished with value: 2.3221009143279607 and parameters: {'model_name': 'SimpleImputer', 'strategy': 'mean'}. Best is trial 6 with value: 2.3221009143279607.
[I 2023-11-22 20:08:19,498] Trial 194 finished with value: 6.560269285589084 and parameters: {'model_name': 'SimpleImputer', 'strategy': 'constant'}. Best is trial 6 with value: 2.3221009143279607.
[I 2023-11-22 20:08:19,679] Trial 177 finished with value: 2.3221009143279607 and parameters: {'model_name': 'SimpleImputer', 'strategy': 'mean'}. Best is trial 6 with value: 2.3221009143279607.
[I 2023-11-22 20:08:19,910] Trial 176 finished with value: 2.3221009143279607 and parameters: {'model_name': 'SimpleImputer', 'strategy': 'mean'}. Best is trial 6 with value: 2.3221009143279607.
[I 2023-11-22 20:08:20,109] Trial 189 finished with value: 6.560269285589084 and parameters: {'model_name': 'SimpleImputer', 'strategy': 'constant'}. Best is trial 6 with value: 2.3221009143279607.
[I 2023-11-22 20:08:20,281] Trial 180 finished with value: 2.3221009143279607 and parameters: {'model_name': 'SimpleImputer', 'strategy': 'mean'}. Best is trial 6 with value: 2.3221009143279607.
[I 2023-11-22 20:08:20,478] Trial 186 finished with value: 6.560269285589084 and parameters: {'model_name': 'SimpleImputer', 'strategy': 'constant'}. Best is trial 6 with value: 2.3221009143279607.
[I 2023-11-22 20:08:20,646] Trial 190 finished with value: 6.560269285589084 and parameters: {'model_name': 'SimpleImputer', 'strategy': 'constant'}. Best is trial 6 with value: 2.3221009143279607.
[I 2023-11-22 20:08:20,846] Trial 184 finished with value: 2.3221009143279607 and parameters: {'model_name': 'SimpleImputer', 'strategy': 'mean'}. Best is trial 6 with value: 2.3221009143279607.
[I 2023-11-22 20:08:21,022] Trial 199 finished with value: 6.560269285589084 and parameters: {'model_name': 'SimpleImputer', 'strategy': 'constant'}. Best is trial 6 with value: 2.3221009143279607.
[I 2023-11-22 20:08:21,276] Trial 102 finished with value: 2.4846447434420242 and parameters: {'model_name': 'SimpleImputer', 'strategy': 'most_frequent'}. Best is trial 6 with value: 2.3221009143279607.
[I 2023-11-22 20:08:21,504] Trial 192 finished with value: 6.560269285589084 and parameters: {'model_name': 'SimpleImputer', 'strategy': 'constant'}. Best is trial 6 with value: 2.3221009143279607.
[I 2023-11-22 20:08:21,676] Trial 185 finished with value: 2.3221009143279607 and parameters: {'model_name': 'SimpleImputer', 'strategy': 'mean'}. Best is trial 6 with value: 2.3221009143279607.
[I 2023-11-22 20:08:21,907] Trial 196 finished with value: 6.560269285589084 and parameters: {'model_name': 'SimpleImputer', 'strategy': 'constant'}. Best is trial 6 with value: 2.3221009143279607.
[I 2023-11-22 20:08:22,083] Trial 198 finished with value: 6.560269285589084 and parameters: {'model_name': 'SimpleImputer', 'strategy': 'constant'}. Best is trial 6 with value: 2.3221009143279607.
[I 2023-11-22 20:08:22,325] Trial 188 finished with value: 6.560269285589084 and parameters: {'model_name': 'SimpleImputer', 'strategy': 'constant'}. Best is trial 6 with value: 2.3221009143279607.
[I 2023-11-22 20:08:22,547] Trial 183 finished with value: 2.3221009143279607 and parameters: {'model_name': 'SimpleImputer', 'strategy': 'mean'}. Best is trial 6 with value: 2.3221009143279607.
[I 2023-11-22 20:08:22,765] Trial 191 finished with value: 2.3221009143279607 and parameters: {'model_name': 'SimpleImputer', 'strategy': 'mean'}. Best is trial 6 with value: 2.3221009143279607.
[I 2023-11-22 20:08:22,990] Trial 193 finished with value: 2.3221009143279607 and parameters: {'model_name': 'SimpleImputer', 'strategy': 'mean'}. Best is trial 6 with value: 2.3221009143279607.
[I 2023-11-22 20:08:23,161] Trial 175 finished with value: 2.3221009143279607 and parameters: {'model_name': 'SimpleImputer', 'strategy': 'mean'}. Best is trial 6 with value: 2.3221009143279607.
[I 2023-11-22 20:08:23,399] Trial 195 finished with value: 6.560269285589084 and parameters: {'model_name': 'SimpleImputer', 'strategy': 'constant'}. Best is trial 6 with value: 2.3221009143279607.
[I 2023-11-22 20:08:23,625] Trial 187 finished with value: 2.3221009143279607 and parameters: {'model_name': 'SimpleImputer', 'strategy': 'mean'}. Best is trial 6 with value: 2.3221009143279607.
