Best trial: 3. Best value: 6.60009:   4%|▍         | 9/200 [00:04<01:06,  2.89it/s][I 2023-11-24 15:17:00,416] Trial 17 finished with value: inf and parameters: {'model_name': 'GAIN', 'batch_size': 48, 'hint_rate': 0.7342535348446441, 'alpha': 100, 'iterations': 48}. Best is trial 3 with value: 6.600086592787521.
                                                                                   Best trial: 3. Best value: 6.60009:   4%|▍         | 9/200 [00:04<01:06,  2.89it/s]Best trial: 3. Best value: 6.60009:   4%|▍         | 9/200 [00:04<01:06,  2.89it/s]Best trial: 3. Best value: 6.60009:   5%|▌         | 10/200 [00:04<01:11,  2.67it/s]Best trial: 3. Best value: 6.60009:   6%|▌         | 11/200 [00:04<00:57,  3.29it/s]Best trial: 3. Best value: 6.60009:   6%|▌         | 11/200 [00:04<00:57,  3.29it/s]                                                                                    [I 2023-11-24 15:17:01,317] Trial 37 finished with value: inf and parameters: {'model_name': 'KNNImputer', 'weights': 'uniform', 'keep_empty_features': False}. Best is trial 3 with value: 6.600086592787521.
Best trial: 3. Best value: 6.60009:   6%|▌         | 11/200 [00:04<00:57,  3.29it/s][I 2023-11-24 15:17:01,343] Trial 7 finished with value: inf and parameters: {'model_name': 'RandomForestImputer', 'max_iter': 2, 'decreasing': True, 'min_samples_split': 0.30000000000000004, 'min_samples_leaf': 0.6000000000000001, 'max_features': 0.5, 'bootstrap': False, 'oob_score': False, 'warm_start': False}. Best is trial 3 with value: 6.600086592787521.
                                                                                    Best trial: 3. Best value: 6.60009:   6%|▌         | 11/200 [00:04<00:57,  3.29it/s]Best trial: 0. Best value: 2.31221:   6%|▌         | 11/200 [00:05<00:57,  3.29it/s]Best trial: 0. Best value: 2.31221:   6%|▌         | 12/200 [00:05<01:06,  2.82it/s]Best trial: 0. Best value: 2.31221:   6%|▌         | 12/200 [00:05<01:06,  2.82it/s]                                                                                    [I 2023-11-24 15:17:01,362] Trial 0 finished with value: 2.312212579683814 and parameters: {'model_name': 'SimpleImputer', 'strategy': 'mean'}. Best is trial 0 with value: 2.312212579683814.
Best trial: 0. Best value: 2.31221:   6%|▋         | 13/200 [00:05<01:06,  2.82it/s]Best trial: 0. Best value: 2.31221:   6%|▋         | 13/200 [00:05<01:06,  2.82it/s]Best trial: 0. Best value: 2.31221:   7%|▋         | 14/200 [00:05<00:47,  3.93it/s][I 2023-11-24 15:17:02,049] Trial 38 finished with value: inf and parameters: {'model_name': 'KNNImputer', 'weights': 'uniform', 'keep_empty_features': False}. Best is trial 0 with value: 2.312212579683814.
                                                                                    Best trial: 0. Best value: 2.31221:   7%|▋         | 14/200 [00:05<00:47,  3.93it/s]Best trial: 0. Best value: 2.31221:   7%|▋         | 14/200 [00:05<00:47,  3.93it/s]Best trial: 0. Best value: 2.31221:   8%|▊         | 15/200 [00:05<00:45,  4.03it/s]                                                                                    [I 2023-11-24 15:17:02,308] Trial 31 finished with value: inf and parameters: {'model_name': 'KNNImputer', 'weights': 'uniform', 'keep_empty_features': False}. Best is trial 0 with value: 2.312212579683814.
Best trial: 0. Best value: 2.31221:   8%|▊         | 15/200 [00:05<00:45,  4.03it/s]Best trial: 0. Best value: 2.31221:   8%|▊         | 15/200 [00:05<00:45,  4.03it/s]Best trial: 0. Best value: 2.31221:   8%|▊         | 16/200 [00:05<00:46,  3.92it/s]                                                                                    [I 2023-11-24 15:17:02,555] Trial 33 finished with value: inf and parameters: {'model_name': 'KNNImputer', 'weights': 'distance', 'keep_empty_features': False}. Best is trial 0 with value: 2.312212579683814.
Best trial: 0. Best value: 2.31221:   8%|▊         | 16/200 [00:05<00:46,  3.92it/s][I 2023-11-24 15:17:02,580] Trial 32 finished with value: inf and parameters: {'model_name': 'GAIN', 'batch_size': 10, 'hint_rate': 0.5132971222765399, 'alpha': 60, 'iterations': 19}. Best is trial 0 with value: 2.312212579683814.
                                                                                    Best trial: 0. Best value: 2.31221:   8%|▊         | 16/200 [00:06<00:46,  3.92it/s]Best trial: 0. Best value: 2.31221:   8%|▊         | 16/200 [00:06<00:46,  3.92it/s]Best trial: 0. Best value: 2.31221:   8%|▊         | 17/200 [00:06<00:57,  3.16it/s]Best trial: 0. Best value: 2.31221:   8%|▊         | 17/200 [00:06<00:57,  3.16it/s]                                                                                    [I 2023-11-24 15:17:03,086] Trial 25 finished with value: inf and parameters: {'model_name': 'GAIN', 'batch_size': 19, 'hint_rate': 0.03652903840645321, 'alpha': 10, 'iterations': 55796}. Best is trial 0 with value: 2.312212579683814.
Best trial: 0. Best value: 2.31221:   9%|▉         | 18/200 [00:06<00:57,  3.16it/s]                                                                                    [I 2023-11-24 15:17:03,321] Trial 28 finished with value: inf and parameters: {'model_name': 'GAIN', 'batch_size': 1, 'hint_rate': 0.0010274997448586893, 'alpha': 70, 'iterations': 2316}. Best is trial 0 with value: 2.312212579683814.
Best trial: 0. Best value: 2.31221:   9%|▉         | 18/200 [00:06<00:57,  3.16it/s]Best trial: 0. Best value: 2.31221:   9%|▉         | 18/200 [00:06<00:57,  3.16it/s]Best trial: 0. Best value: 2.31221:  10%|▉         | 19/200 [00:06<00:52,  3.42it/s]Best trial: 0. Best value: 2.31221:  10%|▉         | 19/200 [00:06<00:52,  3.42it/s]                                                                                    [I 2023-11-24 15:17:03,326] Trial 47 finished with value: inf and parameters: {'model_name': 'GAIN', 'batch_size': 1, 'hint_rate': 0.5854719231984743, 'alpha': 47, 'iterations': 491}. Best is trial 0 with value: 2.312212579683814.
Best trial: 0. Best value: 2.31221:  10%|█         | 20/200 [00:06<00:52,  3.42it/s]Best trial: 0. Best value: 2.31221:  10%|█         | 20/200 [00:07<00:52,  3.42it/s]                                                                                    [I 2023-11-24 15:17:03,562] Trial 34 finished with value: inf and parameters: {'model_name': 'GAIN', 'batch_size': 93, 'hint_rate': 0.01137688890830161, 'alpha': 50, 'iterations': 2}. Best is trial 0 with value: 2.312212579683814.
Best trial: 0. Best value: 2.31221:  10%|█         | 21/200 [00:07<00:41,  4.34it/s]Best trial: 0. Best value: 2.31221:  10%|█         | 21/200 [00:07<00:41,  4.34it/s]Best trial: 0. Best value: 2.31221:  10%|█         | 21/200 [00:07<00:41,  4.34it/s]Best trial: 0. Best value: 2.31221:  11%|█         | 22/200 [00:07<00:42,  4.22it/s]                                                                                    [I 2023-11-24 15:17:04,074] Trial 41 finished with value: inf and parameters: {'model_name': 'GAIN', 'batch_size': 17, 'hint_rate': 0.0040525245326422255, 'alpha': 25, 'iterations': 53}. Best is trial 0 with value: 2.312212579683814.
Best trial: 0. Best value: 2.31221:  11%|█         | 22/200 [00:07<00:42,  4.22it/s]Best trial: 0. Best value: 2.31221:  11%|█         | 22/200 [00:07<00:42,  4.22it/s]Best trial: 0. Best value: 2.31221:  12%|█▏        | 23/200 [00:07<00:41,  4.21it/s]                                                                                    [I 2023-11-24 15:17:04,378] Trial 12 finished with value: inf and parameters: {'model_name': 'RandomForestImputer', 'max_iter': 96, 'decreasing': False, 'min_samples_split': 0.4, 'min_samples_leaf': 0.1, 'max_features': 0.4, 'bootstrap': True, 'oob_score': True, 'warm_start': True}. Best is trial 0 with value: 2.312212579683814.
Best trial: 0. Best value: 2.31221:  12%|█▏        | 23/200 [00:07<00:41,  4.21it/s]Best trial: 0. Best value: 2.31221:  12%|█▏        | 23/200 [00:07<00:41,  4.21it/s]Best trial: 0. Best value: 2.31221:  12%|█▏        | 24/200 [00:07<00:45,  3.84it/s]                                                                                    [I 2023-11-24 15:17:04,648] Trial 46 finished with value: inf and parameters: {'model_name': 'RandomForestImputer', 'max_iter': 2, 'decreasing': True, 'min_samples_split': 0.30000000000000004, 'min_samples_leaf': 0.5, 'max_features': 0.8, 'bootstrap': False, 'oob_score': False, 'warm_start': True}. Best is trial 0 with value: 2.312212579683814.
Best trial: 0. Best value: 2.31221:  12%|█▏        | 24/200 [00:07<00:45,  3.84it/s]Best trial: 0. Best value: 2.31221:  12%|█▏        | 24/200 [00:08<00:45,  3.84it/s]Best trial: 0. Best value: 2.31221:  12%|█▎        | 25/200 [00:08<00:45,  3.89it/s]                                                                                    [I 2023-11-24 15:17:04,649] Trial 14 finished with value: inf and parameters: {'model_name': 'RandomForestImputer', 'max_iter': 5, 'decreasing': True, 'min_samples_split': 0.1, 'min_samples_leaf': 0.6000000000000001, 'max_features': 0.30000000000000004, 'bootstrap': True, 'oob_score': True, 'warm_start': True}. Best is trial 0 with value: 2.312212579683814.
Best trial: 0. Best value: 2.31221:  12%|█▎        | 25/200 [00:08<00:45,  3.89it/s]                                                                                    [I 2023-11-24 15:17:05,116] Trial 16 finished with value: inf and parameters: {'model_name': 'RandomForestImputer', 'max_iter': 1, 'decreasing': False, 'min_samples_split': 1.0, 'min_samples_leaf': 0.8, 'max_features': 1.0, 'bootstrap': False, 'oob_score': True, 'warm_start': True}. Best is trial 0 with value: 2.312212579683814.
Best trial: 0. Best value: 2.31221:  12%|█▎        | 25/200 [00:08<00:45,  3.89it/s]Best trial: 0. Best value: 2.31221:  12%|█▎        | 25/200 [00:08<00:45,  3.89it/s]Best trial: 0. Best value: 2.31221:  13%|█▎        | 26/200 [00:08<00:55,  3.14it/s]Best trial: 0. Best value: 2.31221:  13%|█▎        | 26/200 [00:08<00:55,  3.14it/s]                                                                                    [I 2023-11-24 15:17:05,376] Trial 15 finished with value: inf and parameters: {'model_name': 'RandomForestImputer', 'max_iter': 2, 'decreasing': False, 'min_samples_split': 0.4, 'min_samples_leaf': 0.6000000000000001, 'max_features': 0.8, 'bootstrap': True, 'oob_score': False, 'warm_start': False}. Best is trial 0 with value: 2.312212579683814.
Best trial: 0. Best value: 2.31221:  14%|█▎        | 27/200 [00:08<00:55,  3.14it/s][I 2023-11-24 15:17:05,383] Trial 40 finished with value: inf and parameters: {'model_name': 'RandomForestImputer', 'max_iter': 3, 'decreasing': False, 'min_samples_split': 0.5, 'min_samples_leaf': 0.6000000000000001, 'max_features': 1.0, 'bootstrap': True, 'oob_score': True, 'warm_start': False}. Best is trial 0 with value: 2.312212579683814.
                                                                                    Best trial: 0. Best value: 2.31221:  14%|█▎        | 27/200 [00:08<00:55,  3.14it/s]Best trial: 0. Best value: 2.31221:  14%|█▎        | 27/200 [00:09<00:55,  3.14it/s]Best trial: 0. Best value: 2.31221:  14%|█▍        | 28/200 [00:09<00:50,  3.44it/s]Best trial: 0. Best value: 2.31221:  14%|█▍        | 28/200 [00:09<00:50,  3.44it/s]                                                                                    [I 2023-11-24 15:17:05,401] Trial 30 finished with value: inf and parameters: {'model_name': 'RandomForestImputer', 'max_iter': 1, 'decreasing': True, 'min_samples_split': 0.6000000000000001, 'min_samples_leaf': 0.0, 'max_features': 0.8, 'bootstrap': False, 'oob_score': True, 'warm_start': False}. Best is trial 0 with value: 2.312212579683814.
Best trial: 0. Best value: 2.31221:  14%|█▍        | 29/200 [00:09<00:49,  3.44it/s]                                                                                    [I 2023-11-24 15:17:05,888] Trial 35 finished with value: inf and parameters: {'model_name': 'RandomForestImputer', 'max_iter': 9, 'decreasing': False, 'min_samples_split': 0.0, 'min_samples_leaf': 1.0, 'max_features': 0.0, 'bootstrap': True, 'oob_score': True, 'warm_start': False}. Best is trial 0 with value: 2.312212579683814.
Best trial: 0. Best value: 2.31221:  14%|█▍        | 29/200 [00:09<00:49,  3.44it/s]Best trial: 0. Best value: 2.31221:  14%|█▍        | 29/200 [00:09<00:49,  3.44it/s]Best trial: 0. Best value: 2.31221:  15%|█▌        | 30/200 [00:09<00:47,  3.59it/s]Best trial: 0. Best value: 2.31221:  15%|█▌        | 30/200 [00:09<00:47,  3.59it/s]                                                                                    [I 2023-11-24 15:17:05,891] Trial 43 finished with value: inf and parameters: {'model_name': 'RandomForestImputer', 'max_iter': 92, 'decreasing': False, 'min_samples_split': 0.9, 'min_samples_leaf': 0.5, 'max_features': 0.4, 'bootstrap': False, 'oob_score': False, 'warm_start': False}. Best is trial 0 with value: 2.312212579683814.
Best trial: 0. Best value: 2.31221:  16%|█▌        | 31/200 [00:09<00:47,  3.59it/s]Best trial: 0. Best value: 2.31221:  16%|█▌        | 31/200 [00:09<00:47,  3.59it/s]Best trial: 0. Best value: 2.31221:  16%|█▌        | 32/200 [00:09<00:36,  4.66it/s][I 2023-11-24 15:17:06,155] Trial 21 finished with value: inf and parameters: {'model_name': 'RandomForestImputer', 'max_iter': 10, 'decreasing': True, 'min_samples_split': 0.4, 'min_samples_leaf': 0.7000000000000001, 'max_features': 0.4, 'bootstrap': False, 'oob_score': True, 'warm_start': False}. Best is trial 0 with value: 2.312212579683814.
                                                                                    Best trial: 0. Best value: 2.31221:  16%|█▌        | 32/200 [00:09<00:36,  4.66it/s]Best trial: 0. Best value: 2.31221:  16%|█▌        | 32/200 [00:10<00:36,  4.66it/s]Best trial: 0. Best value: 2.31221:  16%|█▋        | 33/200 [00:10<00:36,  4.57it/s]                                                                                    [I 2023-11-24 15:17:06,852] Trial 45 finished with value: inf and parameters: {'model_name': 'RandomForestImputer', 'max_iter': 1, 'decreasing': False, 'min_samples_split': 0.9, 'min_samples_leaf': 0.4, 'max_features': 0.2, 'bootstrap': False, 'oob_score': False, 'warm_start': False}. Best is trial 0 with value: 2.312212579683814.
Best trial: 0. Best value: 2.31221:  16%|█▋        | 33/200 [00:10<00:36,  4.57it/s]Best trial: 0. Best value: 2.31221:  16%|█▋        | 33/200 [00:10<00:36,  4.57it/s]Best trial: 0. Best value: 2.31221:  17%|█▋        | 34/200 [00:10<00:35,  4.66it/s][I 2023-11-24 15:17:07,068] Trial 5 finished with value: 2.3411604294580033 and parameters: {'model_name': 'SimpleImputer', 'strategy': 'median'}. Best is trial 0 with value: 2.312212579683814.
                                                                                    Best trial: 0. Best value: 2.31221:  17%|█▋        | 34/200 [00:10<00:35,  4.66it/s]Best trial: 0. Best value: 2.31221:  17%|█▋        | 34/200 [00:10<00:35,  4.66it/s]Best trial: 0. Best value: 2.31221:  18%|█▊        | 35/200 [00:10<00:38,  4.27it/s]                                                                                    [I 2023-11-24 15:17:07,334] Trial 22 finished with value: 6.600086592787521 and parameters: {'model_name': 'SimpleImputer', 'strategy': 'constant'}. Best is trial 0 with value: 2.312212579683814.
Best trial: 0. Best value: 2.31221:  18%|█▊        | 35/200 [00:10<00:38,  4.27it/s]Best trial: 0. Best value: 2.31221:  18%|█▊        | 35/200 [00:10<00:38,  4.27it/s]Best trial: 0. Best value: 2.31221:  18%|█▊        | 36/200 [00:10<00:39,  4.11it/s]                                                                                    [I 2023-11-24 15:17:07,784] Trial 44 finished with value: 6.600086592787521 and parameters: {'model_name': 'SimpleImputer', 'strategy': 'constant'}. Best is trial 0 with value: 2.312212579683814.
Best trial: 0. Best value: 2.31221:  18%|█▊        | 36/200 [00:11<00:39,  4.11it/s]Best trial: 0. Best value: 2.31221:  18%|█▊        | 36/200 [00:11<00:39,  4.11it/s]Best trial: 0. Best value: 2.31221:  18%|█▊        | 37/200 [00:11<00:49,  3.32it/s]                                                                                    [I 2023-11-24 15:17:08,162] Trial 26 finished with value: 2.3411604294580033 and parameters: {'model_name': 'SimpleImputer', 'strategy': 'median'}. Best is trial 0 with value: 2.312212579683814.
Best trial: 0. Best value: 2.31221:  18%|█▊        | 37/200 [00:11<00:49,  3.32it/s]Best trial: 0. Best value: 2.31221:  18%|█▊        | 37/200 [00:11<00:49,  3.32it/s]Best trial: 0. Best value: 2.31221:  19%|█▉        | 38/200 [00:11<00:49,  3.24it/s]                                                                                    [I 2023-11-24 15:17:08,415] Trial 27 finished with value: 2.5028747850307886 and parameters: {'model_name': 'SimpleImputer', 'strategy': 'most_frequent'}. Best is trial 0 with value: 2.312212579683814.
Best trial: 0. Best value: 2.31221:  19%|█▉        | 38/200 [00:11<00:49,  3.24it/s]Best trial: 0. Best value: 2.31221:  19%|█▉        | 38/200 [00:11<00:49,  3.24it/s]Best trial: 0. Best value: 2.31221:  20%|█▉        | 39/200 [00:11<00:45,  3.58it/s]                                                                                    [I 2023-11-24 15:17:08,655] Trial 39 finished with value: 2.5028747850307886 and parameters: {'model_name': 'SimpleImputer', 'strategy': 'most_frequent'}. Best is trial 0 with value: 2.312212579683814.
