                                                                                    Best trial: 7. Best value: 2.16144:  42%|████▏     | 83/200 [00:31<00:33,  3.49it/s]Best trial: 7. Best value: 2.16144:  42%|████▏     | 83/200 [00:31<00:33,  3.49it/s]Best trial: 7. Best value: 2.16144:  42%|████▏     | 84/200 [00:31<00:37,  3.07it/s][I 2023-11-21 17:10:44,731] Trial 86 finished with value: 2.1614446043307978 and parameters: {'model_name': 'SimpleImputer', 'strategy': 'most_frequent'}. Best is trial 7 with value: 2.1614446043307978.
                                                                                    Best trial: 7. Best value: 2.16144:  42%|████▏     | 84/200 [00:31<00:37,  3.07it/s]Best trial: 7. Best value: 2.16144:  42%|████▏     | 84/200 [00:32<00:37,  3.07it/s]Best trial: 7. Best value: 2.16144:  42%|████▎     | 85/200 [00:32<00:41,  2.78it/s][I 2023-11-21 17:10:45,029] Trial 74 finished with value: 2.1614446043307978 and parameters: {'model_name': 'SimpleImputer', 'strategy': 'most_frequent'}. Best is trial 7 with value: 2.1614446043307978.
                                                                                    Best trial: 7. Best value: 2.16144:  42%|████▎     | 85/200 [00:32<00:41,  2.78it/s]Best trial: 7. Best value: 2.16144:  42%|████▎     | 85/200 [00:32<00:41,  2.78it/s]Best trial: 7. Best value: 2.16144:  43%|████▎     | 86/200 [00:32<00:38,  2.97it/s][I 2023-11-21 17:10:45,399] Trial 92 finished with value: 2.1614446043307978 and parameters: {'model_name': 'SimpleImputer', 'strategy': 'most_frequent'}. Best is trial 7 with value: 2.1614446043307978.
                                                                                    Best trial: 7. Best value: 2.16144:  43%|████▎     | 86/200 [00:32<00:38,  2.97it/s]Best trial: 7. Best value: 2.16144:  43%|████▎     | 86/200 [00:32<00:38,  2.97it/s]Best trial: 7. Best value: 2.16144:  44%|████▎     | 87/200 [00:32<00:39,  2.87it/s][I 2023-11-21 17:10:45,722] Trial 77 finished with value: 2.1614446043307978 and parameters: {'model_name': 'SimpleImputer', 'strategy': 'most_frequent'}. Best is trial 7 with value: 2.1614446043307978.
                                                                                    Best trial: 7. Best value: 2.16144:  44%|████▎     | 87/200 [00:32<00:39,  2.87it/s]Best trial: 7. Best value: 2.16144:  44%|████▎     | 87/200 [00:33<00:39,  2.87it/s]Best trial: 7. Best value: 2.16144:  44%|████▍     | 88/200 [00:33<00:38,  2.94it/s][I 2023-11-21 17:10:46,001] Trial 87 finished with value: 2.1614446043307978 and parameters: {'model_name': 'SimpleImputer', 'strategy': 'most_frequent'}. Best is trial 7 with value: 2.1614446043307978.
                                                                                    Best trial: 7. Best value: 2.16144:  44%|████▍     | 88/200 [00:33<00:38,  2.94it/s]Best trial: 7. Best value: 2.16144:  44%|████▍     | 88/200 [00:33<00:38,  2.94it/s]Best trial: 7. Best value: 2.16144:  44%|████▍     | 89/200 [00:33<00:36,  3.04it/s]                                                                                    [I 2023-11-21 17:10:47,104] Trial 84 finished with value: 2.1614446043307978 and parameters: {'model_name': 'SimpleImputer', 'strategy': 'most_frequent'}. Best is trial 7 with value: 2.1614446043307978.
Best trial: 7. Best value: 2.16144:  44%|████▍     | 89/200 [00:34<00:36,  3.04it/s]Best trial: 7. Best value: 2.16144:  44%|████▍     | 89/200 [00:34<00:36,  3.04it/s]Best trial: 7. Best value: 2.16144:  45%|████▌     | 90/200 [00:34<01:02,  1.75it/s][I 2023-11-21 17:10:47,403] Trial 89 finished with value: 2.1614446043307978 and parameters: {'model_name': 'SimpleImputer', 'strategy': 'most_frequent'}. Best is trial 7 with value: 2.1614446043307978.
                                                                                    Best trial: 7. Best value: 2.16144:  45%|████▌     | 90/200 [00:34<01:02,  1.75it/s]Best trial: 7. Best value: 2.16144:  45%|████▌     | 90/200 [00:34<01:02,  1.75it/s]Best trial: 7. Best value: 2.16144:  46%|████▌     | 91/200 [00:34<00:52,  2.09it/s][I 2023-11-21 17:10:47,656] Trial 90 finished with value: 2.1614446043307978 and parameters: {'model_name': 'SimpleImputer', 'strategy': 'most_frequent'}. Best is trial 7 with value: 2.1614446043307978.
                                                                                    Best trial: 7. Best value: 2.16144:  46%|████▌     | 91/200 [00:34<00:52,  2.09it/s]Best trial: 7. Best value: 2.16144:  46%|████▌     | 91/200 [00:35<00:52,  2.09it/s]Best trial: 7. Best value: 2.16144:  46%|████▌     | 92/200 [00:35<00:43,  2.47it/s][I 2023-11-21 17:10:48,092] Trial 94 finished with value: 2.1614446043307978 and parameters: {'model_name': 'SimpleImputer', 'strategy': 'most_frequent'}. Best is trial 7 with value: 2.1614446043307978.
                                                                                    Best trial: 7. Best value: 2.16144:  46%|████▌     | 92/200 [00:35<00:43,  2.47it/s]Best trial: 7. Best value: 2.16144:  46%|████▌     | 92/200 [00:35<00:43,  2.47it/s]Best trial: 7. Best value: 2.16144:  46%|████▋     | 93/200 [00:35<00:44,  2.41it/s][I 2023-11-21 17:10:48,717] Trial 91 finished with value: 2.1614446043307978 and parameters: {'model_name': 'SimpleImputer', 'strategy': 'most_frequent'}. Best is trial 7 with value: 2.1614446043307978.
                                                                                    Best trial: 7. Best value: 2.16144:  46%|████▋     | 93/200 [00:35<00:44,  2.41it/s]Best trial: 7. Best value: 2.16144:  46%|████▋     | 93/200 [00:36<00:44,  2.41it/s]Best trial: 7. Best value: 2.16144:  47%|████▋     | 94/200 [00:36<00:50,  2.08it/s][I 2023-11-21 17:10:49,080] Trial 93 finished with value: 2.1614446043307978 and parameters: {'model_name': 'SimpleImputer', 'strategy': 'most_frequent'}. Best is trial 7 with value: 2.1614446043307978.
                                                                                    Best trial: 7. Best value: 2.16144:  47%|████▋     | 94/200 [00:36<00:50,  2.08it/s]Best trial: 7. Best value: 2.16144:  47%|████▋     | 94/200 [00:36<00:50,  2.08it/s]Best trial: 7. Best value: 2.16144:  48%|████▊     | 95/200 [00:36<00:46,  2.28it/s][I 2023-11-21 17:10:49,788] Trial 95 finished with value: 2.1614446043307978 and parameters: {'model_name': 'SimpleImputer', 'strategy': 'most_frequent'}. Best is trial 7 with value: 2.1614446043307978.
                                                                                    Best trial: 7. Best value: 2.16144:  48%|████▊     | 95/200 [00:36<00:46,  2.28it/s]Best trial: 7. Best value: 2.16144:  48%|████▊     | 95/200 [00:37<00:46,  2.28it/s]Best trial: 7. Best value: 2.16144:  48%|████▊     | 96/200 [00:37<00:54,  1.92it/s][I 2023-11-21 17:10:50,282] Trial 97 finished with value: 2.1614446043307978 and parameters: {'model_name': 'SimpleImputer', 'strategy': 'most_frequent'}. Best is trial 7 with value: 2.1614446043307978.
                                                                                    Best trial: 7. Best value: 2.16144:  48%|████▊     | 96/200 [00:37<00:54,  1.92it/s]Best trial: 7. Best value: 2.16144:  48%|████▊     | 96/200 [00:37<00:54,  1.92it/s]Best trial: 7. Best value: 2.16144:  48%|████▊     | 97/200 [00:37<00:54,  1.91it/s][I 2023-11-21 17:10:50,553] Trial 98 finished with value: 2.1614446043307978 and parameters: {'model_name': 'SimpleImputer', 'strategy': 'most_frequent'}. Best is trial 7 with value: 2.1614446043307978.
                                                                                    Best trial: 7. Best value: 2.16144:  48%|████▊     | 97/200 [00:37<00:54,  1.91it/s]Best trial: 7. Best value: 2.16144:  48%|████▊     | 97/200 [00:37<00:54,  1.91it/s]Best trial: 7. Best value: 2.16144:  49%|████▉     | 98/200 [00:37<00:44,  2.29it/s][I 2023-11-21 17:10:51,015] Trial 96 finished with value: 2.1614446043307978 and parameters: {'model_name': 'SimpleImputer', 'strategy': 'most_frequent'}. Best is trial 7 with value: 2.1614446043307978.
                                                                                    Best trial: 7. Best value: 2.16144:  49%|████▉     | 98/200 [00:38<00:44,  2.29it/s]Best trial: 7. Best value: 2.16144:  49%|████▉     | 98/200 [00:38<00:44,  2.29it/s]Best trial: 7. Best value: 2.16144:  50%|████▉     | 99/200 [00:38<00:45,  2.20it/s][I 2023-11-21 17:10:51,702] Trial 103 finished with value: 2.1614446043307978 and parameters: {'model_name': 'SimpleImputer', 'strategy': 'most_frequent'}. Best is trial 7 with value: 2.1614446043307978.
                                                                                    Best trial: 7. Best value: 2.16144:  50%|████▉     | 99/200 [00:38<00:45,  2.20it/s]Best trial: 7. Best value: 2.16144:  50%|████▉     | 99/200 [00:39<00:45,  2.20it/s]Best trial: 7. Best value: 2.16144:  50%|█████     | 100/200 [00:39<00:51,  1.95it/s][I 2023-11-21 17:10:52,075] Trial 99 finished with value: 2.1614446043307978 and parameters: {'model_name': 'SimpleImputer', 'strategy': 'most_frequent'}. Best is trial 7 with value: 2.1614446043307978.
                                                                                     Best trial: 7. Best value: 2.16144:  50%|█████     | 100/200 [00:39<00:51,  1.95it/s]Best trial: 7. Best value: 2.16144:  50%|█████     | 100/200 [00:39<00:51,  1.95it/s]Best trial: 7. Best value: 2.16144:  50%|█████     | 101/200 [00:39<00:46,  2.13it/s][I 2023-11-21 17:10:52,593] Trial 102 finished with value: 2.1614446043307978 and parameters: {'model_name': 'SimpleImputer', 'strategy': 'most_frequent'}. Best is trial 7 with value: 2.1614446043307978.
                                                                                     Best trial: 7. Best value: 2.16144:  50%|█████     | 101/200 [00:39<00:46,  2.13it/s][I 2023-11-21 17:10:52,827] Trial 100 finished with value: 2.1614446043307978 and parameters: {'model_name': 'SimpleImputer', 'strategy': 'most_frequent'}. Best is trial 7 with value: 2.1614446043307978.
                                                                                     Best trial: 7. Best value: 2.16144:  50%|█████     | 101/200 [00:39<00:46,  2.13it/s]Best trial: 7. Best value: 2.16144:  50%|█████     | 101/200 [00:40<00:46,  2.13it/s]Best trial: 7. Best value: 2.16144:  51%|█████     | 102/200 [00:40<00:54,  1.79it/s]Best trial: 7. Best value: 2.16144:  51%|█████     | 102/200 [00:40<00:54,  1.79it/s][I 2023-11-21 17:10:53,088] Trial 101 finished with value: 2.1614446043307978 and parameters: {'model_name': 'SimpleImputer', 'strategy': 'most_frequent'}. Best is trial 7 with value: 2.1614446043307978.
                                                                                     Best trial: 7. Best value: 2.16144:  52%|█████▏    | 103/200 [00:40<00:54,  1.79it/s]Best trial: 7. Best value: 2.16144:  52%|█████▏    | 103/200 [00:40<00:54,  1.79it/s]Best trial: 7. Best value: 2.16144:  52%|█████▏    | 104/200 [00:40<00:35,  2.73it/s][I 2023-11-21 17:10:53,700] Trial 105 finished with value: 2.1614446043307978 and parameters: {'model_name': 'SimpleImputer', 'strategy': 'most_frequent'}. Best is trial 7 with value: 2.1614446043307978.
                                                                                     Best trial: 7. Best value: 2.16144:  52%|█████▏    | 104/200 [00:40<00:35,  2.73it/s]Best trial: 7. Best value: 2.16144:  52%|█████▏    | 104/200 [00:41<00:35,  2.73it/s]Best trial: 7. Best value: 2.16144:  52%|█████▎    | 105/200 [00:41<00:40,  2.35it/s][I 2023-11-21 17:10:54,543] Trial 106 finished with value: 2.1614446043307978 and parameters: {'model_name': 'SimpleImputer', 'strategy': 'most_frequent'}. Best is trial 7 with value: 2.1614446043307978.
                                                                                     Best trial: 7. Best value: 2.16144:  52%|█████▎    | 105/200 [00:41<00:40,  2.35it/s]Best trial: 7. Best value: 2.16144:  52%|█████▎    | 105/200 [00:41<00:40,  2.35it/s]Best trial: 7. Best value: 2.16144:  53%|█████▎    | 106/200 [00:41<00:49,  1.89it/s][I 2023-11-21 17:10:55,162] Trial 104 finished with value: 2.1614446043307978 and parameters: {'model_name': 'SimpleImputer', 'strategy': 'most_frequent'}. Best is trial 7 with value: 2.1614446043307978.
                                                                                     Best trial: 7. Best value: 2.16144:  53%|█████▎    | 106/200 [00:42<00:49,  1.89it/s]Best trial: 7. Best value: 2.16144:  53%|█████▎    | 106/200 [00:42<00:49,  1.89it/s]Best trial: 7. Best value: 2.16144:  54%|█████▎    | 107/200 [00:42<00:51,  1.81it/s][I 2023-11-21 17:10:55,467] Trial 107 finished with value: 2.1614446043307978 and parameters: {'model_name': 'SimpleImputer', 'strategy': 'most_frequent'}. Best is trial 7 with value: 2.1614446043307978.
                                                                                     Best trial: 7. Best value: 2.16144:  54%|█████▎    | 107/200 [00:42<00:51,  1.81it/s]Best trial: 7. Best value: 2.16144:  54%|█████▎    | 107/200 [00:42<00:51,  1.81it/s]Best trial: 7. Best value: 2.16144:  54%|█████▍    | 108/200 [00:42<00:44,  2.08it/s][I 2023-11-21 17:10:55,877] Trial 110 finished with value: 2.1614446043307978 and parameters: {'model_name': 'SimpleImputer', 'strategy': 'most_frequent'}. Best is trial 7 with value: 2.1614446043307978.
                                                                                     Best trial: 7. Best value: 2.16144:  54%|█████▍    | 108/200 [00:43<00:44,  2.08it/s]Best trial: 7. Best value: 2.16144:  54%|█████▍    | 108/200 [00:43<00:44,  2.08it/s]Best trial: 7. Best value: 2.16144:  55%|█████▍    | 109/200 [00:43<00:42,  2.14it/s][I 2023-11-21 17:10:56,402] Trial 113 finished with value: 2.1614446043307978 and parameters: {'model_name': 'SimpleImputer', 'strategy': 'most_frequent'}. Best is trial 7 with value: 2.1614446043307978.
                                                                                     Best trial: 7. Best value: 2.16144:  55%|█████▍    | 109/200 [00:43<00:42,  2.14it/s]Best trial: 7. Best value: 2.16144:  55%|█████▍    | 109/200 [00:43<00:42,  2.14it/s]Best trial: 7. Best value: 2.16144:  55%|█████▌    | 110/200 [00:43<00:43,  2.07it/s][I 2023-11-21 17:10:56,661] Trial 111 finished with value: 2.1614446043307978 and parameters: {'model_name': 'SimpleImputer', 'strategy': 'most_frequent'}. Best is trial 7 with value: 2.1614446043307978.
                                                                                     Best trial: 7. Best value: 2.16144:  55%|█████▌    | 110/200 [00:43<00:43,  2.07it/s]Best trial: 7. Best value: 2.16144:  55%|█████▌    | 110/200 [00:44<00:43,  2.07it/s]Best trial: 7. Best value: 2.16144:  56%|█████▌    | 111/200 [00:44<00:36,  2.41it/s][I 2023-11-21 17:10:57,004] Trial 124 finished with value: 2.1614446043307978 and parameters: {'model_name': 'SimpleImputer', 'strategy': 'most_frequent'}. Best is trial 7 with value: 2.1614446043307978.
                                                                                     Best trial: 7. Best value: 2.16144:  56%|█████▌    | 111/200 [00:44<00:36,  2.41it/s]Best trial: 7. Best value: 2.16144:  56%|█████▌    | 111/200 [00:44<00:36,  2.41it/s]Best trial: 7. Best value: 2.16144:  56%|█████▌    | 112/200 [00:44<00:34,  2.52it/s][I 2023-11-21 17:10:57,370] Trial 117 finished with value: 2.1614446043307978 and parameters: {'model_name': 'SimpleImputer', 'strategy': 'most_frequent'}. Best is trial 7 with value: 2.1614446043307978.
                                                                                     Best trial: 7. Best value: 2.16144:  56%|█████▌    | 112/200 [00:44<00:34,  2.52it/s]Best trial: 7. Best value: 2.16144:  56%|█████▌    | 112/200 [00:44<00:34,  2.52it/s]Best trial: 7. Best value: 2.16144:  56%|█████▋    | 113/200 [00:44<00:33,  2.57it/s][I 2023-11-21 17:10:57,715] Trial 114 finished with value: 2.1614446043307978 and parameters: {'model_name': 'SimpleImputer', 'strategy': 'most_frequent'}. Best is trial 7 with value: 2.1614446043307978.
                                                                                     Best trial: 7. Best value: 2.16144:  56%|█████▋    | 113/200 [00:44<00:33,  2.57it/s]Best trial: 7. Best value: 2.16144:  56%|█████▋    | 113/200 [00:45<00:33,  2.57it/s]Best trial: 7. Best value: 2.16144:  57%|█████▋    | 114/200 [00:45<00:32,  2.67it/s][I 2023-11-21 17:10:58,012] Trial 115 finished with value: 2.1614446043307978 and parameters: {'model_name': 'SimpleImputer', 'strategy': 'most_frequent'}. Best is trial 7 with value: 2.1614446043307978.
                                                                                     Best trial: 7. Best value: 2.16144:  57%|█████▋    | 114/200 [00:45<00:32,  2.67it/s]Best trial: 7. Best value: 2.16144:  57%|█████▋    | 114/200 [00:45<00:32,  2.67it/s]Best trial: 7. Best value: 2.16144:  57%|█████▊    | 115/200 [00:45<00:29,  2.87it/s]                                                                                     [I 2023-11-21 17:10:58,259] Trial 109 finished with value: 2.1614446043307978 and parameters: {'model_name': 'SimpleImputer', 'strategy': 'most_frequent'}. Best is trial 7 with value: 2.1614446043307978.
Best trial: 7. Best value: 2.16144:  57%|█████▊    | 115/200 [00:45<00:29,  2.87it/s]Best trial: 7. Best value: 2.16144:  57%|█████▊    | 115/200 [00:45<00:29,  2.87it/s]Best trial: 7. Best value: 2.16144:  58%|█████▊    | 116/200 [00:45<00:26,  3.12it/s]                                                                                     [I 2023-11-21 17:10:58,455] Trial 108 finished with value: 2.1614446043307978 and parameters: {'model_name': 'SimpleImputer', 'strategy': 'most_frequent'}. Best is trial 7 with value: 2.1614446043307978.
Best trial: 7. Best value: 2.16144:  58%|█████▊    | 116/200 [00:45<00:26,  3.12it/s]Best trial: 7. Best value: 2.16144:  58%|█████▊    | 116/200 [00:45<00:26,  3.12it/s]Best trial: 7. Best value: 2.16144:  58%|█████▊    | 117/200 [00:45<00:23,  3.54it/s][I 2023-11-21 17:10:58,472] Trial 112 finished with value: 2.1614446043307978 and parameters: {'model_name': 'SimpleImputer', 'strategy': 'most_frequent'}. Best is trial 7 with value: 2.1614446043307978.
                                                                                     Best trial: 7. Best value: 2.16144:  58%|█████▊    | 117/200 [00:45<00:23,  3.54it/s]Best trial: 7. Best value: 2.16144:  58%|█████▊    | 117/200 [00:46<00:23,  3.54it/s]Best trial: 7. Best value: 2.16144:  59%|█████▉    | 118/200 [00:46<00:21,  3.87it/s][I 2023-11-21 17:10:58,876] Trial 123 finished with value: 2.1614446043307978 and parameters: {'model_name': 'SimpleImputer', 'strategy': 'most_frequent'}. Best is trial 7 with value: 2.1614446043307978.
                                                                                     Best trial: 7. Best value: 2.16144:  59%|█████▉    | 118/200 [00:46<00:21,  3.87it/s]Best trial: 7. Best value: 2.16144:  59%|█████▉    | 118/200 [00:46<00:21,  3.87it/s]Best trial: 7. Best value: 2.16144:  60%|█████▉    | 119/200 [00:46<00:20,  4.04it/s]                                                                                     [I 2023-11-21 17:10:59,150] Trial 116 finished with value: 2.1614446043307978 and parameters: {'model_name': 'SimpleImputer', 'strategy': 'most_frequent'}. Best is trial 7 with value: 2.1614446043307978.
Best trial: 7. Best value: 2.16144:  60%|█████▉    | 119/200 [00:46<00:20,  4.04it/s]Best trial: 7. Best value: 2.16144:  60%|█████▉    | 119/200 [00:46<00:20,  4.04it/s]Best trial: 7. Best value: 2.16144:  60%|██████    | 120/200 [00:46<00:20,  3.93it/s][I 2023-11-21 17:10:59,445] Trial 118 finished with value: 2.1614446043307978 and parameters: {'model_name': 'SimpleImputer', 'strategy': 'most_frequent'}. Best is trial 7 with value: 2.1614446043307978.
                                                                                     Best trial: 7. Best value: 2.16144:  60%|██████    | 120/200 [00:46<00:20,  3.93it/s]Best trial: 7. Best value: 2.16144:  60%|██████    | 120/200 [00:46<00:20,  3.93it/s]Best trial: 7. Best value: 2.16144:  60%|██████    | 121/200 [00:46<00:20,  3.79it/s][I 2023-11-21 17:10:59,866] Trial 126 finished with value: 2.1614446043307978 and parameters: {'model_name': 'SimpleImputer', 'strategy': 'most_frequent'}. Best is trial 7 with value: 2.1614446043307978.
                                                                                     Best trial: 7. Best value: 2.16144:  60%|██████    | 121/200 [00:47<00:20,  3.79it/s]Best trial: 7. Best value: 2.16144:  60%|██████    | 121/200 [00:47<00:20,  3.79it/s]Best trial: 7. Best value: 2.16144:  61%|██████    | 122/200 [00:47<00:24,  3.14it/s][I 2023-11-21 17:11:00,133] Trial 122 finished with value: 2.1614446043307978 and parameters: {'model_name': 'SimpleImputer', 'strategy': 'most_frequent'}. Best is trial 7 with value: 2.1614446043307978.
                                                                                     Best trial: 7. Best value: 2.16144:  61%|██████    | 122/200 [00:47<00:24,  3.14it/s]Best trial: 7. Best value: 2.16144:  61%|██████    | 122/200 [00:47<00:24,  3.14it/s]Best trial: 7. Best value: 2.16144:  62%|██████▏   | 123/200 [00:47<00:24,  3.18it/s][I 2023-11-21 17:11:01,136] Trial 121 finished with value: 2.1614446043307978 and parameters: {'model_name': 'SimpleImputer', 'strategy': 'most_frequent'}. Best is trial 7 with value: 2.1614446043307978.
