[I 2023-11-24 15:15:33,439] Trial 84 finished with value: 2.6704290380940447 and parameters: {'model_name': 'SimpleImputer', 'strategy': 'most_frequent'}. Best is trial 4 with value: 2.3532479924463887.
[I 2023-11-24 15:15:33,670] Trial 110 finished with value: 2.3532479924463887 and parameters: {'model_name': 'SimpleImputer', 'strategy': 'mean'}. Best is trial 4 with value: 2.3532479924463887.
[I 2023-11-24 15:15:33,943] Trial 112 finished with value: 2.3532479924463887 and parameters: {'model_name': 'SimpleImputer', 'strategy': 'mean'}. Best is trial 4 with value: 2.3532479924463887.
[I 2023-11-24 15:15:34,173] Trial 111 finished with value: 2.3532479924463887 and parameters: {'model_name': 'SimpleImputer', 'strategy': 'mean'}. Best is trial 4 with value: 2.3532479924463887.
[I 2023-11-24 15:15:34,397] Trial 83 finished with value: 2.6704290380940447 and parameters: {'model_name': 'SimpleImputer', 'strategy': 'most_frequent'}. Best is trial 4 with value: 2.3532479924463887.
[I 2023-11-24 15:15:34,655] Trial 114 finished with value: 2.3532479924463887 and parameters: {'model_name': 'SimpleImputer', 'strategy': 'mean'}. Best is trial 4 with value: 2.3532479924463887.
[I 2023-11-24 15:15:34,940] Trial 75 finished with value: 2.6704290380940447 and parameters: {'model_name': 'SimpleImputer', 'strategy': 'most_frequent'}. Best is trial 4 with value: 2.3532479924463887.
[I 2023-11-24 15:15:35,228] Trial 92 finished with value: 2.6704290380940447 and parameters: {'model_name': 'SimpleImputer', 'strategy': 'most_frequent'}. Best is trial 4 with value: 2.3532479924463887.
[I 2023-11-24 15:15:35,562] Trial 115 finished with value: 2.3532479924463887 and parameters: {'model_name': 'SimpleImputer', 'strategy': 'mean'}. Best is trial 4 with value: 2.3532479924463887.
[I 2023-11-24 15:15:35,837] Trial 120 finished with value: 2.3532479924463887 and parameters: {'model_name': 'SimpleImputer', 'strategy': 'mean'}. Best is trial 4 with value: 2.3532479924463887.
[I 2023-11-24 15:15:36,094] Trial 116 finished with value: 2.3532479924463887 and parameters: {'model_name': 'SimpleImputer', 'strategy': 'mean'}. Best is trial 4 with value: 2.3532479924463887.
[I 2023-11-24 15:15:36,422] Trial 117 finished with value: 2.3532479924463887 and parameters: {'model_name': 'SimpleImputer', 'strategy': 'mean'}. Best is trial 4 with value: 2.3532479924463887.
[I 2023-11-24 15:15:36,636] Trial 91 finished with value: 2.6704290380940447 and parameters: {'model_name': 'SimpleImputer', 'strategy': 'most_frequent'}. Best is trial 4 with value: 2.3532479924463887.
[I 2023-11-24 15:15:36,844] Trial 89 finished with value: 2.6704290380940447 and parameters: {'model_name': 'SimpleImputer', 'strategy': 'most_frequent'}. Best is trial 4 with value: 2.3532479924463887.
[I 2023-11-24 15:15:37,289] Trial 93 finished with value: 2.6704290380940447 and parameters: {'model_name': 'SimpleImputer', 'strategy': 'most_frequent'}. Best is trial 4 with value: 2.3532479924463887.
[I 2023-11-24 15:15:37,798] Trial 119 finished with value: 2.3532479924463887 and parameters: {'model_name': 'SimpleImputer', 'strategy': 'mean'}. Best is trial 4 with value: 2.3532479924463887.
[I 2023-11-24 15:15:38,010] Trial 118 finished with value: 2.3532479924463887 and parameters: {'model_name': 'SimpleImputer', 'strategy': 'mean'}. Best is trial 4 with value: 2.3532479924463887.
[I 2023-11-24 15:15:38,387] Trial 121 finished with value: 2.3532479924463887 and parameters: {'model_name': 'SimpleImputer', 'strategy': 'mean'}. Best is trial 4 with value: 2.3532479924463887.
[I 2023-11-24 15:15:38,694] Trial 122 finished with value: 2.3532479924463887 and parameters: {'model_name': 'SimpleImputer', 'strategy': 'mean'}. Best is trial 4 with value: 2.3532479924463887.
[I 2023-11-24 15:15:38,902] Trial 126 finished with value: 2.3532479924463887 and parameters: {'model_name': 'SimpleImputer', 'strategy': 'mean'}. Best is trial 4 with value: 2.3532479924463887.
[I 2023-11-24 15:15:39,193] Trial 95 finished with value: 2.6704290380940447 and parameters: {'model_name': 'SimpleImputer', 'strategy': 'most_frequent'}. Best is trial 4 with value: 2.3532479924463887.
[I 2023-11-24 15:15:39,548] Trial 134 finished with value: 2.3532479924463887 and parameters: {'model_name': 'SimpleImputer', 'strategy': 'mean'}. Best is trial 4 with value: 2.3532479924463887.
[I 2023-11-24 15:15:39,952] Trial 132 finished with value: 2.3532479924463887 and parameters: {'model_name': 'SimpleImputer', 'strategy': 'mean'}. Best is trial 4 with value: 2.3532479924463887.
[I 2023-11-24 15:15:40,198] Trial 123 finished with value: 2.3532479924463887 and parameters: {'model_name': 'SimpleImputer', 'strategy': 'mean'}. Best is trial 4 with value: 2.3532479924463887.
[I 2023-11-24 15:15:40,436] Trial 125 finished with value: 2.3532479924463887 and parameters: {'model_name': 'SimpleImputer', 'strategy': 'mean'}. Best is trial 4 with value: 2.3532479924463887.
[I 2023-11-24 15:15:40,665] Trial 98 finished with value: 2.6704290380940447 and parameters: {'model_name': 'SimpleImputer', 'strategy': 'most_frequent'}. Best is trial 4 with value: 2.3532479924463887.
[I 2023-11-24 15:15:40,989] Trial 124 finished with value: 2.3532479924463887 and parameters: {'model_name': 'SimpleImputer', 'strategy': 'mean'}. Best is trial 4 with value: 2.3532479924463887.
[I 2023-11-24 15:15:41,236] Trial 129 finished with value: 2.3532479924463887 and parameters: {'model_name': 'SimpleImputer', 'strategy': 'mean'}. Best is trial 4 with value: 2.3532479924463887.
[I 2023-11-24 15:15:41,525] Trial 128 finished with value: 2.3532479924463887 and parameters: {'model_name': 'SimpleImputer', 'strategy': 'mean'}. Best is trial 4 with value: 2.3532479924463887.
[I 2023-11-24 15:15:41,797] Trial 131 finished with value: 2.3532479924463887 and parameters: {'model_name': 'SimpleImputer', 'strategy': 'mean'}. Best is trial 4 with value: 2.3532479924463887.
[I 2023-11-24 15:15:42,067] Trial 127 finished with value: 2.3532479924463887 and parameters: {'model_name': 'SimpleImputer', 'strategy': 'mean'}. Best is trial 4 with value: 2.3532479924463887.
[I 2023-11-24 15:15:42,355] Trial 137 finished with value: 2.3532479924463887 and parameters: {'model_name': 'SimpleImputer', 'strategy': 'mean'}. Best is trial 4 with value: 2.3532479924463887.
[I 2023-11-24 15:15:42,593] Trial 142 finished with value: 2.3532479924463887 and parameters: {'model_name': 'SimpleImputer', 'strategy': 'mean'}. Best is trial 4 with value: 2.3532479924463887.
[I 2023-11-24 15:15:42,809] Trial 136 finished with value: 2.3532479924463887 and parameters: {'model_name': 'SimpleImputer', 'strategy': 'mean'}. Best is trial 4 with value: 2.3532479924463887.
[I 2023-11-24 15:15:43,013] Trial 135 finished with value: 2.3532479924463887 and parameters: {'model_name': 'SimpleImputer', 'strategy': 'mean'}. Best is trial 4 with value: 2.3532479924463887.
[I 2023-11-24 15:15:43,202] Trial 141 finished with value: 2.3532479924463887 and parameters: {'model_name': 'SimpleImputer', 'strategy': 'mean'}. Best is trial 4 with value: 2.3532479924463887.
[I 2023-11-24 15:15:43,424] Trial 139 finished with value: 2.3532479924463887 and parameters: {'model_name': 'SimpleImputer', 'strategy': 'mean'}. Best is trial 4 with value: 2.3532479924463887.
[I 2023-11-24 15:15:43,667] Trial 143 finished with value: 2.3532479924463887 and parameters: {'model_name': 'SimpleImputer', 'strategy': 'mean'}. Best is trial 4 with value: 2.3532479924463887.
[I 2023-11-24 15:15:43,879] Trial 130 finished with value: 2.3532479924463887 and parameters: {'model_name': 'SimpleImputer', 'strategy': 'mean'}. Best is trial 4 with value: 2.3532479924463887.
[I 2023-11-24 15:15:44,071] Trial 99 finished with value: 2.6704290380940447 and parameters: {'model_name': 'SimpleImputer', 'strategy': 'most_frequent'}. Best is trial 4 with value: 2.3532479924463887.
[I 2023-11-24 15:15:44,464] Trial 96 finished with value: 2.6704290380940447 and parameters: {'model_name': 'SimpleImputer', 'strategy': 'most_frequent'}. Best is trial 4 with value: 2.3532479924463887.
[I 2023-11-24 15:15:44,704] Trial 138 finished with value: 2.3532479924463887 and parameters: {'model_name': 'SimpleImputer', 'strategy': 'mean'}. Best is trial 4 with value: 2.3532479924463887.
[I 2023-11-24 15:15:45,015] Trial 145 finished with value: 2.3532479924463887 and parameters: {'model_name': 'SimpleImputer', 'strategy': 'mean'}. Best is trial 4 with value: 2.3532479924463887.
[I 2023-11-24 15:15:45,221] Trial 144 finished with value: 2.3532479924463887 and parameters: {'model_name': 'SimpleImputer', 'strategy': 'mean'}. Best is trial 4 with value: 2.3532479924463887.
[I 2023-11-24 15:15:45,434] Trial 155 finished with value: 2.3532479924463887 and parameters: {'model_name': 'SimpleImputer', 'strategy': 'mean'}. Best is trial 4 with value: 2.3532479924463887.
[I 2023-11-24 15:15:45,684] Trial 147 finished with value: 2.3532479924463887 and parameters: {'model_name': 'SimpleImputer', 'strategy': 'mean'}. Best is trial 4 with value: 2.3532479924463887.
[I 2023-11-24 15:15:45,928] Trial 133 finished with value: 2.3532479924463887 and parameters: {'model_name': 'SimpleImputer', 'strategy': 'mean'}. Best is trial 4 with value: 2.3532479924463887.
[I 2023-11-24 15:15:46,193] Trial 150 finished with value: 2.3532479924463887 and parameters: {'model_name': 'SimpleImputer', 'strategy': 'mean'}. Best is trial 4 with value: 2.3532479924463887.
[I 2023-11-24 15:15:46,474] Trial 140 finished with value: 2.3532479924463887 and parameters: {'model_name': 'SimpleImputer', 'strategy': 'mean'}. Best is trial 4 with value: 2.3532479924463887.
[I 2023-11-24 15:15:46,750] Trial 146 finished with value: 2.3532479924463887 and parameters: {'model_name': 'SimpleImputer', 'strategy': 'mean'}. Best is trial 4 with value: 2.3532479924463887.
[I 2023-11-24 15:15:46,960] Trial 97 finished with value: 2.6704290380940447 and parameters: {'model_name': 'SimpleImputer', 'strategy': 'most_frequent'}. Best is trial 4 with value: 2.3532479924463887.
[I 2023-11-24 15:15:47,184] Trial 154 finished with value: 2.3532479924463887 and parameters: {'model_name': 'SimpleImputer', 'strategy': 'mean'}. Best is trial 4 with value: 2.3532479924463887.
[I 2023-11-24 15:15:47,463] Trial 151 finished with value: 2.3532479924463887 and parameters: {'model_name': 'SimpleImputer', 'strategy': 'mean'}. Best is trial 4 with value: 2.3532479924463887.
[I 2023-11-24 15:15:47,777] Trial 100 finished with value: 2.6704290380940447 and parameters: {'model_name': 'SimpleImputer', 'strategy': 'most_frequent'}. Best is trial 4 with value: 2.3532479924463887.
[I 2023-11-24 15:15:48,022] Trial 149 finished with value: 2.3532479924463887 and parameters: {'model_name': 'SimpleImputer', 'strategy': 'mean'}. Best is trial 4 with value: 2.3532479924463887.
[I 2023-11-24 15:15:48,364] Trial 152 finished with value: 2.3532479924463887 and parameters: {'model_name': 'SimpleImputer', 'strategy': 'mean'}. Best is trial 4 with value: 2.3532479924463887.
[I 2023-11-24 15:15:48,608] Trial 156 finished with value: 2.3532479924463887 and parameters: {'model_name': 'SimpleImputer', 'strategy': 'mean'}. Best is trial 4 with value: 2.3532479924463887.
[I 2023-11-24 15:15:48,815] Trial 160 finished with value: 2.3532479924463887 and parameters: {'model_name': 'SimpleImputer', 'strategy': 'mean'}. Best is trial 4 with value: 2.3532479924463887.
[I 2023-11-24 15:15:49,068] Trial 159 finished with value: 2.3532479924463887 and parameters: {'model_name': 'SimpleImputer', 'strategy': 'mean'}. Best is trial 4 with value: 2.3532479924463887.
[I 2023-11-24 15:15:49,273] Trial 148 finished with value: 2.3532479924463887 and parameters: {'model_name': 'SimpleImputer', 'strategy': 'mean'}. Best is trial 4 with value: 2.3532479924463887.
[I 2023-11-24 15:15:49,499] Trial 153 finished with value: 2.3532479924463887 and parameters: {'model_name': 'SimpleImputer', 'strategy': 'mean'}. Best is trial 4 with value: 2.3532479924463887.
[I 2023-11-24 15:15:49,771] Trial 157 finished with value: 2.3532479924463887 and parameters: {'model_name': 'SimpleImputer', 'strategy': 'mean'}. Best is trial 4 with value: 2.3532479924463887.
[I 2023-11-24 15:15:49,985] Trial 162 finished with value: 2.3532479924463887 and parameters: {'model_name': 'SimpleImputer', 'strategy': 'mean'}. Best is trial 4 with value: 2.3532479924463887.
[I 2023-11-24 15:15:50,267] Trial 161 finished with value: 2.3532479924463887 and parameters: {'model_name': 'SimpleImputer', 'strategy': 'mean'}. Best is trial 4 with value: 2.3532479924463887.
[I 2023-11-24 15:15:50,525] Trial 158 finished with value: 2.3532479924463887 and parameters: {'model_name': 'SimpleImputer', 'strategy': 'mean'}. Best is trial 4 with value: 2.3532479924463887.
[I 2023-11-24 15:15:50,848] Trial 164 finished with value: 2.3532479924463887 and parameters: {'model_name': 'SimpleImputer', 'strategy': 'mean'}. Best is trial 4 with value: 2.3532479924463887.
[I 2023-11-24 15:15:51,102] Trial 171 finished with value: 2.3532479924463887 and parameters: {'model_name': 'SimpleImputer', 'strategy': 'mean'}. Best is trial 4 with value: 2.3532479924463887.
[I 2023-11-24 15:15:51,311] Trial 166 finished with value: 2.3532479924463887 and parameters: {'model_name': 'SimpleImputer', 'strategy': 'mean'}. Best is trial 4 with value: 2.3532479924463887.
[I 2023-11-24 15:15:51,552] Trial 174 finished with value: 2.3532479924463887 and parameters: {'model_name': 'SimpleImputer', 'strategy': 'mean'}. Best is trial 4 with value: 2.3532479924463887.
[I 2023-11-24 15:15:51,752] Trial 168 finished with value: 2.3532479924463887 and parameters: {'model_name': 'SimpleImputer', 'strategy': 'mean'}. Best is trial 4 with value: 2.3532479924463887.
[I 2023-11-24 15:15:51,982] Trial 167 finished with value: 2.3532479924463887 and parameters: {'model_name': 'SimpleImputer', 'strategy': 'mean'}. Best is trial 4 with value: 2.3532479924463887.
[I 2023-11-24 15:15:52,196] Trial 163 finished with value: 2.3532479924463887 and parameters: {'model_name': 'SimpleImputer', 'strategy': 'mean'}. Best is trial 4 with value: 2.3532479924463887.
[I 2023-11-24 15:15:52,417] Trial 165 finished with value: 2.3532479924463887 and parameters: {'model_name': 'SimpleImputer', 'strategy': 'mean'}. Best is trial 4 with value: 2.3532479924463887.
[I 2023-11-24 15:15:52,776] Trial 172 finished with value: 2.3532479924463887 and parameters: {'model_name': 'SimpleImputer', 'strategy': 'mean'}. Best is trial 4 with value: 2.3532479924463887.
[I 2023-11-24 15:15:53,001] Trial 179 finished with value: 2.3532479924463887 and parameters: {'model_name': 'SimpleImputer', 'strategy': 'mean'}. Best is trial 4 with value: 2.3532479924463887.
[I 2023-11-24 15:15:53,256] Trial 170 finished with value: 2.3532479924463887 and parameters: {'model_name': 'SimpleImputer', 'strategy': 'mean'}. Best is trial 4 with value: 2.3532479924463887.
[I 2023-11-24 15:15:53,500] Trial 173 finished with value: 2.3532479924463887 and parameters: {'model_name': 'SimpleImputer', 'strategy': 'mean'}. Best is trial 4 with value: 2.3532479924463887.
[I 2023-11-24 15:15:53,704] Trial 178 finished with value: 2.3532479924463887 and parameters: {'model_name': 'SimpleImputer', 'strategy': 'mean'}. Best is trial 4 with value: 2.3532479924463887.
[I 2023-11-24 15:15:53,955] Trial 169 finished with value: 2.3532479924463887 and parameters: {'model_name': 'SimpleImputer', 'strategy': 'mean'}. Best is trial 4 with value: 2.3532479924463887.
[I 2023-11-24 15:15:54,267] Trial 188 finished with value: 2.3532479924463887 and parameters: {'model_name': 'SimpleImputer', 'strategy': 'mean'}. Best is trial 4 with value: 2.3532479924463887.
[I 2023-11-24 15:15:54,505] Trial 176 finished with value: 2.3532479924463887 and parameters: {'model_name': 'SimpleImputer', 'strategy': 'mean'}. Best is trial 4 with value: 2.3532479924463887.
[I 2023-11-24 15:15:54,755] Trial 181 finished with value: 2.3532479924463887 and parameters: {'model_name': 'SimpleImputer', 'strategy': 'mean'}. Best is trial 4 with value: 2.3532479924463887.
[I 2023-11-24 15:15:55,026] Trial 180 finished with value: 2.3532479924463887 and parameters: {'model_name': 'SimpleImputer', 'strategy': 'mean'}. Best is trial 4 with value: 2.3532479924463887.
[I 2023-11-24 15:15:55,217] Trial 183 finished with value: 2.3532479924463887 and parameters: {'model_name': 'SimpleImputer', 'strategy': 'mean'}. Best is trial 4 with value: 2.3532479924463887.
[I 2023-11-24 15:15:55,410] Trial 182 finished with value: 2.3532479924463887 and parameters: {'model_name': 'SimpleImputer', 'strategy': 'mean'}. Best is trial 4 with value: 2.3532479924463887.
[I 2023-11-24 15:15:55,590] Trial 187 finished with value: 2.3532479924463887 and parameters: {'model_name': 'SimpleImputer', 'strategy': 'mean'}. Best is trial 4 with value: 2.3532479924463887.
[I 2023-11-24 15:15:55,837] Trial 196 finished with value: 2.3532479924463887 and parameters: {'model_name': 'SimpleImputer', 'strategy': 'mean'}. Best is trial 4 with value: 2.3532479924463887.
[I 2023-11-24 15:15:56,060] Trial 195 finished with value: 2.3532479924463887 and parameters: {'model_name': 'SimpleImputer', 'strategy': 'mean'}. Best is trial 4 with value: 2.3532479924463887.
[I 2023-11-24 15:15:56,231] Trial 175 finished with value: 2.3532479924463887 and parameters: {'model_name': 'SimpleImputer', 'strategy': 'mean'}. Best is trial 4 with value: 2.3532479924463887.
[I 2023-11-24 15:15:56,386] Trial 189 finished with value: 2.3532479924463887 and parameters: {'model_name': 'SimpleImputer', 'strategy': 'mean'}. Best is trial 4 with value: 2.3532479924463887.
[I 2023-11-24 15:15:56,629] Trial 186 finished with value: 2.3532479924463887 and parameters: {'model_name': 'SimpleImputer', 'strategy': 'mean'}. Best is trial 4 with value: 2.3532479924463887.
[I 2023-11-24 15:15:56,867] Trial 191 finished with value: 2.3532479924463887 and parameters: {'model_name': 'SimpleImputer', 'strategy': 'mean'}. Best is trial 4 with value: 2.3532479924463887.
[I 2023-11-24 15:15:57,120] Trial 192 finished with value: 2.3532479924463887 and parameters: {'model_name': 'SimpleImputer', 'strategy': 'mean'}. Best is trial 4 with value: 2.3532479924463887.
[I 2023-11-24 15:15:57,315] Trial 177 finished with value: 2.3532479924463887 and parameters: {'model_name': 'SimpleImputer', 'strategy': 'mean'}. Best is trial 4 with value: 2.3532479924463887.
[I 2023-11-24 15:15:57,567] Trial 198 finished with value: 2.3532479924463887 and parameters: {'model_name': 'SimpleImputer', 'strategy': 'mean'}. Best is trial 4 with value: 2.3532479924463887.
[I 2023-11-24 15:15:57,772] Trial 184 finished with value: 2.3532479924463887 and parameters: {'model_name': 'SimpleImputer', 'strategy': 'mean'}. Best is trial 4 with value: 2.3532479924463887.
[I 2023-11-24 15:15:58,001] Trial 185 finished with value: 2.3532479924463887 and parameters: {'model_name': 'SimpleImputer', 'strategy': 'mean'}. Best is trial 4 with value: 2.3532479924463887.
[I 2023-11-24 15:15:58,212] Trial 190 finished with value: 2.3532479924463887 and parameters: {'model_name': 'SimpleImputer', 'strategy': 'mean'}. Best is trial 4 with value: 2.3532479924463887.
[I 2023-11-24 15:15:58,398] Trial 197 finished with value: 2.3532479924463887 and parameters: {'model_name': 'SimpleImputer', 'strategy': 'mean'}. Best is trial 4 with value: 2.3532479924463887.
[I 2023-11-24 15:15:58,629] Trial 193 finished with value: 2.3532479924463887 and parameters: {'model_name': 'SimpleImputer', 'strategy': 'mean'}. Best is trial 4 with value: 2.3532479924463887.
[I 2023-11-24 15:15:58,842] Trial 194 finished with value: 2.3532479924463887 and parameters: {'model_name': 'SimpleImputer', 'strategy': 'mean'}. Best is trial 4 with value: 2.3532479924463887.
[I 2023-11-24 15:15:59,052] Trial 199 finished with value: 2.3532479924463887 and parameters: {'model_name': 'SimpleImputer', 'strategy': 'mean'}. Best is trial 4 with value: 2.3532479924463887.
simple fit
simple transform
[I 2023-11-24 15:16:05,323] A new study created in memory with name: no-name-a97c92f2-640c-4a40-8e05-29b2d608f66f
  0%|          | 0/200 [00:00<?, ?it/s][I 2023-11-24 15:16:05,337] Trial 0 finished with value: inf and parameters: {'model_name': 'GAIN', 'batch_size': 208, 'hint_rate': 0.004324151613338109, 'alpha': 55, 'iterations': 4375}. Best is trial 0 with value: inf.
                                         0%|          | 0/200 [00:00<?, ?it/s]Best trial: 0. Best value: inf:   0%|          | 0/200 [00:00<?, ?it/s]Best trial: 0. Best value: inf:   0%|          | 1/200 [00:00<00:46,  4.25it/s]                                                                               [I 2023-11-24 15:16:05,620] Trial 7 finished with value: inf and parameters: {'model_name': 'GAIN', 'batch_size': 46, 'hint_rate': 0.009421621926179638, 'alpha': 48, 'iterations': 257}. Best is trial 0 with value: inf.
Best trial: 0. Best value: inf:   0%|          | 1/200 [00:00<00:46,  4.25it/s]Best trial: 0. Best value: inf:   0%|          | 1/200 [00:00<00:46,  4.25it/s]Best trial: 0. Best value: inf:   1%|          | 2/200 [00:00<00:45,  4.33it/s]                                                                               [I 2023-11-24 15:16:05,804] Trial 1 finished with value: inf and parameters: {'model_name': 'RandomForestImputer', 'max_iter': 1, 'decreasing': False, 'min_samples_split': 0.7000000000000001, 'min_samples_leaf': 0.6000000000000001, 'max_features': 0.7000000000000001, 'bootstrap': False, 'oob_score': True, 'warm_start': False}. Best is trial 0 with value: inf.
