[I 2023-11-21 09:59:18,904] Trial 126 finished with value: 2.4182368457038192 and parameters: {'model_name': 'IterativeImputer', 'estimator': 'Bayesian', 'sample_posterior': False, 'initial_strategy': 'median', 'imputation_order': 'arabic'}. Best is trial 122 with value: 2.2926978761938797.
[I 2023-11-21 09:59:25,215] Trial 131 finished with value: 2.4031459796934556 and parameters: {'model_name': 'IterativeImputer', 'estimator': 'Bayesian', 'sample_posterior': False, 'initial_strategy': 'median', 'imputation_order': 'descending'}. Best is trial 122 with value: 2.2926978761938797.
[I 2023-11-21 09:59:25,892] Trial 124 finished with value: 2.3512103253701007 and parameters: {'model_name': 'IterativeImputer', 'estimator': 'Bayesian', 'sample_posterior': False, 'initial_strategy': 'median', 'imputation_order': 'random'}. Best is trial 122 with value: 2.2926978761938797.
[I 2023-11-21 09:59:26,983] Trial 139 finished with value: 2.4031459796934556 and parameters: {'model_name': 'IterativeImputer', 'estimator': 'Bayesian', 'sample_posterior': False, 'initial_strategy': 'median', 'imputation_order': 'descending'}. Best is trial 122 with value: 2.2926978761938797.
[I 2023-11-21 09:59:27,501] Trial 125 finished with value: 2.4182368457038192 and parameters: {'model_name': 'IterativeImputer', 'estimator': 'Bayesian', 'sample_posterior': False, 'initial_strategy': 'median', 'imputation_order': 'arabic'}. Best is trial 122 with value: 2.2926978761938797.
[I 2023-11-21 09:59:28,432] Trial 134 finished with value: 2.4031459796934556 and parameters: {'model_name': 'IterativeImputer', 'estimator': 'Bayesian', 'sample_posterior': False, 'initial_strategy': 'median', 'imputation_order': 'descending'}. Best is trial 122 with value: 2.2926978761938797.
[I 2023-11-21 09:59:28,866] Trial 130 finished with value: 2.4182368457038192 and parameters: {'model_name': 'IterativeImputer', 'estimator': 'Bayesian', 'sample_posterior': False, 'initial_strategy': 'median', 'imputation_order': 'arabic'}. Best is trial 122 with value: 2.2926978761938797.
[I 2023-11-21 09:59:31,537] Trial 140 finished with value: 2.4031459796934556 and parameters: {'model_name': 'IterativeImputer', 'estimator': 'Bayesian', 'sample_posterior': False, 'initial_strategy': 'median', 'imputation_order': 'descending'}. Best is trial 122 with value: 2.2926978761938797.
[I 2023-11-21 09:59:33,616] Trial 132 finished with value: 2.4182368457038192 and parameters: {'model_name': 'IterativeImputer', 'estimator': 'Bayesian', 'sample_posterior': False, 'initial_strategy': 'median', 'imputation_order': 'arabic'}. Best is trial 122 with value: 2.2926978761938797.
[I 2023-11-21 09:59:37,456] Trial 145 finished with value: 2.4182368457038192 and parameters: {'model_name': 'IterativeImputer', 'estimator': 'Bayesian', 'sample_posterior': False, 'initial_strategy': 'median', 'imputation_order': 'arabic'}. Best is trial 122 with value: 2.2926978761938797.
[I 2023-11-21 09:59:37,883] Trial 150 finished with value: 2.4182368457038192 and parameters: {'model_name': 'IterativeImputer', 'estimator': 'Bayesian', 'sample_posterior': False, 'initial_strategy': 'median', 'imputation_order': 'arabic'}. Best is trial 122 with value: 2.2926978761938797.
[I 2023-11-21 09:59:42,334] Trial 146 finished with value: 2.4031459796934556 and parameters: {'model_name': 'IterativeImputer', 'estimator': 'Bayesian', 'sample_posterior': False, 'initial_strategy': 'median', 'imputation_order': 'descending'}. Best is trial 122 with value: 2.2926978761938797.
[I 2023-11-21 09:59:43,888] Trial 142 finished with value: 2.2708230054977387 and parameters: {'model_name': 'IterativeImputer', 'estimator': 'Bayesian', 'sample_posterior': False, 'initial_strategy': 'median', 'imputation_order': 'random'}. Best is trial 142 with value: 2.2708230054977387.
[I 2023-11-21 09:59:45,834] Trial 147 finished with value: 2.260085898966539 and parameters: {'model_name': 'IterativeImputer', 'estimator': 'Bayesian', 'sample_posterior': False, 'initial_strategy': 'median', 'imputation_order': 'random'}. Best is trial 147 with value: 2.260085898966539.
[I 2023-11-21 09:59:46,280] Trial 143 finished with value: 2.2585933773868407 and parameters: {'model_name': 'IterativeImputer', 'estimator': 'Bayesian', 'sample_posterior': False, 'initial_strategy': 'median', 'imputation_order': 'random'}. Best is trial 143 with value: 2.2585933773868407.
[I 2023-11-21 09:59:46,876] Trial 138 finished with value: 2.233807474509549 and parameters: {'model_name': 'IterativeImputer', 'estimator': 'Bayesian', 'sample_posterior': False, 'initial_strategy': 'median', 'imputation_order': 'random'}. Best is trial 138 with value: 2.233807474509549.
[I 2023-11-21 09:59:47,215] Trial 157 finished with value: 2.2469389903857477 and parameters: {'model_name': 'IterativeImputer', 'estimator': 'Bayesian', 'sample_posterior': False, 'initial_strategy': 'median', 'imputation_order': 'random'}. Best is trial 138 with value: 2.233807474509549.
[I 2023-11-21 09:59:48,398] Trial 154 finished with value: 2.267983963304916 and parameters: {'model_name': 'IterativeImputer', 'estimator': 'Bayesian', 'sample_posterior': False, 'initial_strategy': 'median', 'imputation_order': 'random'}. Best is trial 138 with value: 2.233807474509549.
[I 2023-11-21 09:59:53,156] Trial 158 finished with value: 2.39189368690678 and parameters: {'model_name': 'IterativeImputer', 'estimator': 'Bayesian', 'sample_posterior': False, 'initial_strategy': 'mean', 'imputation_order': 'arabic'}. Best is trial 138 with value: 2.233807474509549.
[I 2023-11-21 10:00:06,356] Trial 151 finished with value: 2.2690024023515907 and parameters: {'model_name': 'IterativeImputer', 'estimator': 'Bayesian', 'sample_posterior': False, 'initial_strategy': 'median', 'imputation_order': 'random'}. Best is trial 138 with value: 2.233807474509549.
[I 2023-11-21 10:01:13,519] Trial 159 finished with value: 2.2233405868776464 and parameters: {'model_name': 'IterativeImputer', 'estimator': 'Bayesian', 'sample_posterior': False, 'initial_strategy': 'median', 'imputation_order': 'random'}. Best is trial 159 with value: 2.2233405868776464.
[I 2023-11-21 10:01:29,378] Trial 160 finished with value: 2.282569459655412 and parameters: {'model_name': 'IterativeImputer', 'estimator': 'Bayesian', 'sample_posterior': False, 'initial_strategy': 'mean', 'imputation_order': 'random'}. Best is trial 159 with value: 2.2233405868776464.
[I 2023-11-21 10:02:36,390] Trial 12 finished with value: 2.1837922907694534 and parameters: {'model_name': 'IterativeImputer', 'estimator': 'Ridge', 'sample_posterior': False, 'initial_strategy': 'median', 'imputation_order': 'arabic'}. Best is trial 12 with value: 2.1837922907694534.
[I 2023-11-21 10:03:57,093] Trial 167 finished with value: 2.4031459796934556 and parameters: {'model_name': 'IterativeImputer', 'estimator': 'Bayesian', 'sample_posterior': False, 'initial_strategy': 'median', 'imputation_order': 'descending'}. Best is trial 12 with value: 2.1837922907694534.
[I 2023-11-21 10:03:59,088] Trial 163 finished with value: 2.2936585008043453 and parameters: {'model_name': 'IterativeImputer', 'estimator': 'Bayesian', 'sample_posterior': False, 'initial_strategy': 'median', 'imputation_order': 'random'}. Best is trial 12 with value: 2.1837922907694534.
[I 2023-11-21 10:04:01,646] Trial 166 finished with value: 2.4031459796934556 and parameters: {'model_name': 'IterativeImputer', 'estimator': 'Bayesian', 'sample_posterior': False, 'initial_strategy': 'median', 'imputation_order': 'descending'}. Best is trial 12 with value: 2.1837922907694534.
[I 2023-11-21 10:04:04,930] Trial 164 finished with value: 2.4031459796934556 and parameters: {'model_name': 'IterativeImputer', 'estimator': 'Bayesian', 'sample_posterior': False, 'initial_strategy': 'median', 'imputation_order': 'descending'}. Best is trial 12 with value: 2.1837922907694534.
[I 2023-11-21 10:04:06,943] Trial 179 finished with value: 2.286244170543958 and parameters: {'model_name': 'IterativeImputer', 'estimator': 'Bayesian', 'sample_posterior': False, 'initial_strategy': 'median', 'imputation_order': 'random'}. Best is trial 12 with value: 2.1837922907694534.
[I 2023-11-21 10:04:07,286] Trial 161 finished with value: 2.2982363946107456 and parameters: {'model_name': 'IterativeImputer', 'estimator': 'Bayesian', 'sample_posterior': False, 'initial_strategy': 'median', 'imputation_order': 'random'}. Best is trial 12 with value: 2.1837922907694534.
[I 2023-11-21 10:04:08,954] Trial 171 finished with value: 2.4031459796934556 and parameters: {'model_name': 'IterativeImputer', 'estimator': 'Bayesian', 'sample_posterior': False, 'initial_strategy': 'median', 'imputation_order': 'descending'}. Best is trial 12 with value: 2.1837922907694534.
[I 2023-11-21 10:04:09,421] Trial 168 finished with value: 2.4031459796934556 and parameters: {'model_name': 'IterativeImputer', 'estimator': 'Bayesian', 'sample_posterior': False, 'initial_strategy': 'median', 'imputation_order': 'descending'}. Best is trial 12 with value: 2.1837922907694534.
[I 2023-11-21 10:04:10,016] Trial 169 finished with value: 2.4031459796934556 and parameters: {'model_name': 'IterativeImputer', 'estimator': 'Bayesian', 'sample_posterior': False, 'initial_strategy': 'median', 'imputation_order': 'descending'}. Best is trial 12 with value: 2.1837922907694534.
[I 2023-11-21 10:04:14,773] Trial 176 finished with value: 2.4031459796934556 and parameters: {'model_name': 'IterativeImputer', 'estimator': 'Bayesian', 'sample_posterior': False, 'initial_strategy': 'median', 'imputation_order': 'descending'}. Best is trial 12 with value: 2.1837922907694534.
[I 2023-11-21 10:04:15,335] Trial 170 finished with value: 2.4031459796934556 and parameters: {'model_name': 'IterativeImputer', 'estimator': 'Bayesian', 'sample_posterior': False, 'initial_strategy': 'median', 'imputation_order': 'descending'}. Best is trial 12 with value: 2.1837922907694534.
[I 2023-11-21 10:04:17,379] Trial 175 finished with value: 2.4031459796934556 and parameters: {'model_name': 'IterativeImputer', 'estimator': 'Bayesian', 'sample_posterior': False, 'initial_strategy': 'median', 'imputation_order': 'descending'}. Best is trial 12 with value: 2.1837922907694534.
[I 2023-11-21 10:04:18,957] Trial 162 finished with value: 2.245137898416572 and parameters: {'model_name': 'IterativeImputer', 'estimator': 'Bayesian', 'sample_posterior': False, 'initial_strategy': 'median', 'imputation_order': 'random'}. Best is trial 12 with value: 2.1837922907694534.
[I 2023-11-21 10:04:21,132] Trial 172 finished with value: 2.4031459796934556 and parameters: {'model_name': 'IterativeImputer', 'estimator': 'Bayesian', 'sample_posterior': False, 'initial_strategy': 'median', 'imputation_order': 'descending'}. Best is trial 12 with value: 2.1837922907694534.
[I 2023-11-21 10:04:23,199] Trial 173 finished with value: 2.4182368457038192 and parameters: {'model_name': 'IterativeImputer', 'estimator': 'Bayesian', 'sample_posterior': False, 'initial_strategy': 'median', 'imputation_order': 'arabic'}. Best is trial 12 with value: 2.1837922907694534.
[I 2023-11-21 10:04:23,946] Trial 174 finished with value: 2.4031459796934556 and parameters: {'model_name': 'IterativeImputer', 'estimator': 'Bayesian', 'sample_posterior': False, 'initial_strategy': 'median', 'imputation_order': 'descending'}. Best is trial 12 with value: 2.1837922907694534.
[I 2023-11-21 10:04:24,689] Trial 165 finished with value: 2.2952077121684864 and parameters: {'model_name': 'IterativeImputer', 'estimator': 'Bayesian', 'sample_posterior': False, 'initial_strategy': 'median', 'imputation_order': 'random'}. Best is trial 12 with value: 2.1837922907694534.
[I 2023-11-21 10:04:26,778] Trial 177 finished with value: 2.4031459796934556 and parameters: {'model_name': 'IterativeImputer', 'estimator': 'Bayesian', 'sample_posterior': False, 'initial_strategy': 'median', 'imputation_order': 'descending'}. Best is trial 12 with value: 2.1837922907694534.
[I 2023-11-21 10:04:29,650] Trial 178 finished with value: 2.2830660939384293 and parameters: {'model_name': 'IterativeImputer', 'estimator': 'Bayesian', 'sample_posterior': False, 'initial_strategy': 'median', 'imputation_order': 'random'}. Best is trial 12 with value: 2.1837922907694534.
[I 2023-11-21 10:04:43,657] Trial 181 finished with value: 2.192361735948383 and parameters: {'model_name': 'IterativeImputer', 'estimator': 'Bayesian', 'sample_posterior': False, 'initial_strategy': 'median', 'imputation_order': 'random'}. Best is trial 12 with value: 2.1837922907694534.
[I 2023-11-21 10:04:44,005] Trial 180 finished with value: 2.2582798242712747 and parameters: {'model_name': 'IterativeImputer', 'estimator': 'Bayesian', 'sample_posterior': False, 'initial_strategy': 'median', 'imputation_order': 'random'}. Best is trial 12 with value: 2.1837922907694534.
[I 2023-11-21 10:05:04,274] Trial 182 finished with value: 2.2899101724545825 and parameters: {'model_name': 'IterativeImputer', 'estimator': 'Bayesian', 'sample_posterior': False, 'initial_strategy': 'median', 'imputation_order': 'random'}. Best is trial 12 with value: 2.1837922907694534.
[I 2023-11-21 10:05:20,680] Trial 183 finished with value: 2.2968527910771357 and parameters: {'model_name': 'IterativeImputer', 'estimator': 'Bayesian', 'sample_posterior': False, 'initial_strategy': 'median', 'imputation_order': 'random'}. Best is trial 12 with value: 2.1837922907694534.
[I 2023-11-21 10:05:56,795] Trial 184 finished with value: 2.368269433000242 and parameters: {'model_name': 'IterativeImputer', 'estimator': 'Bayesian', 'sample_posterior': False, 'initial_strategy': 'mean', 'imputation_order': 'random'}. Best is trial 12 with value: 2.1837922907694534.
[I 2023-11-21 10:07:16,227] Trial 185 finished with value: 2.235852880169264 and parameters: {'model_name': 'IterativeImputer', 'estimator': 'Bayesian', 'sample_posterior': False, 'initial_strategy': 'mean', 'imputation_order': 'random'}. Best is trial 12 with value: 2.1837922907694534.
[I 2023-11-21 10:07:54,546] Trial 187 finished with value: 2.3449319545439633 and parameters: {'model_name': 'IterativeImputer', 'estimator': 'Bayesian', 'sample_posterior': False, 'initial_strategy': 'mean', 'imputation_order': 'random'}. Best is trial 12 with value: 2.1837922907694534.
[I 2023-11-21 10:08:06,366] Trial 189 finished with value: 2.2354773203754297 and parameters: {'model_name': 'IterativeImputer', 'estimator': 'Bayesian', 'sample_posterior': False, 'initial_strategy': 'mean', 'imputation_order': 'random'}. Best is trial 12 with value: 2.1837922907694534.
[I 2023-11-21 10:08:11,390] Trial 191 finished with value: 2.3348250474661425 and parameters: {'model_name': 'IterativeImputer', 'estimator': 'Bayesian', 'sample_posterior': False, 'initial_strategy': 'median', 'imputation_order': 'random'}. Best is trial 12 with value: 2.1837922907694534.
[I 2023-11-21 10:08:12,022] Trial 186 finished with value: 2.264295883901119 and parameters: {'model_name': 'IterativeImputer', 'estimator': 'Bayesian', 'sample_posterior': False, 'initial_strategy': 'mean', 'imputation_order': 'random'}. Best is trial 12 with value: 2.1837922907694534.
[I 2023-11-21 10:08:16,562] Trial 192 finished with value: 2.291986622142192 and parameters: {'model_name': 'IterativeImputer', 'estimator': 'Bayesian', 'sample_posterior': False, 'initial_strategy': 'median', 'imputation_order': 'random'}. Best is trial 12 with value: 2.1837922907694534.
[I 2023-11-21 10:08:17,751] Trial 188 finished with value: 2.241693199092454 and parameters: {'model_name': 'IterativeImputer', 'estimator': 'Bayesian', 'sample_posterior': False, 'initial_strategy': 'mean', 'imputation_order': 'random'}. Best is trial 12 with value: 2.1837922907694534.
[I 2023-11-21 10:08:20,822] Trial 196 finished with value: 2.1962994575712433 and parameters: {'model_name': 'IterativeImputer', 'estimator': 'Bayesian', 'sample_posterior': False, 'initial_strategy': 'mean', 'imputation_order': 'random'}. Best is trial 12 with value: 2.1837922907694534.
[I 2023-11-21 10:08:21,641] Trial 193 finished with value: 2.2603714965391597 and parameters: {'model_name': 'IterativeImputer', 'estimator': 'Bayesian', 'sample_posterior': False, 'initial_strategy': 'median', 'imputation_order': 'random'}. Best is trial 12 with value: 2.1837922907694534.
