[I 2023-11-21 09:57:36,493] Trial 154 finished with value: 2.3116467514175336 and parameters: {'model_name': 'SimpleImputer', 'strategy': 'mean'}. Best is trial 83 with value: 2.294988702700148.
[I 2023-11-21 09:57:36,843] Trial 98 finished with value: 2.3130270612936434 and parameters: {'model_name': 'IterativeImputer', 'estimator': 'Bayesian', 'sample_posterior': False, 'initial_strategy': 'mean', 'imputation_order': 'ascending'}. Best is trial 83 with value: 2.294988702700148.
[I 2023-11-21 09:57:37,597] Trial 108 finished with value: 2.3130270612936434 and parameters: {'model_name': 'IterativeImputer', 'estimator': 'Bayesian', 'sample_posterior': False, 'initial_strategy': 'mean', 'imputation_order': 'ascending'}. Best is trial 83 with value: 2.294988702700148.
[I 2023-11-21 09:57:38,671] Trial 155 finished with value: 2.3116467514175336 and parameters: {'model_name': 'SimpleImputer', 'strategy': 'mean'}. Best is trial 83 with value: 2.294988702700148.
[I 2023-11-21 09:57:40,119] Trial 156 finished with value: 2.3116467514175336 and parameters: {'model_name': 'SimpleImputer', 'strategy': 'mean'}. Best is trial 83 with value: 2.294988702700148.
[I 2023-11-21 09:57:40,363] Trial 158 finished with value: 2.3116467514175336 and parameters: {'model_name': 'SimpleImputer', 'strategy': 'mean'}. Best is trial 83 with value: 2.294988702700148.
[I 2023-11-21 09:57:40,971] Trial 159 finished with value: 2.3116467514175336 and parameters: {'model_name': 'SimpleImputer', 'strategy': 'mean'}. Best is trial 83 with value: 2.294988702700148.
[I 2023-11-21 09:57:41,505] Trial 157 finished with value: 2.355581371804523 and parameters: {'model_name': 'SimpleImputer', 'strategy': 'median'}. Best is trial 83 with value: 2.294988702700148.
[I 2023-11-21 09:57:42,215] Trial 160 finished with value: 2.3116467514175336 and parameters: {'model_name': 'SimpleImputer', 'strategy': 'mean'}. Best is trial 83 with value: 2.294988702700148.
[I 2023-11-21 09:57:44,361] Trial 161 finished with value: 2.355581371804523 and parameters: {'model_name': 'SimpleImputer', 'strategy': 'median'}. Best is trial 83 with value: 2.294988702700148.
[I 2023-11-21 09:57:44,797] Trial 162 finished with value: 2.355581371804523 and parameters: {'model_name': 'SimpleImputer', 'strategy': 'median'}. Best is trial 83 with value: 2.294988702700148.
[I 2023-11-21 09:57:45,037] Trial 165 finished with value: 2.3116467514175336 and parameters: {'model_name': 'SimpleImputer', 'strategy': 'mean'}. Best is trial 83 with value: 2.294988702700148.
[I 2023-11-21 09:57:45,245] Trial 164 finished with value: 2.3116467514175336 and parameters: {'model_name': 'SimpleImputer', 'strategy': 'mean'}. Best is trial 83 with value: 2.294988702700148.
[I 2023-11-21 09:57:45,621] Trial 167 finished with value: inf and parameters: {'model_name': 'GAIN', 'batch_size': 105, 'hint_rate': 0.047386412465457696, 'alpha': 99, 'iterations': 31}. Best is trial 83 with value: 2.294988702700148.
[I 2023-11-21 09:57:45,970] Trial 166 finished with value: inf and parameters: {'model_name': 'GAIN', 'batch_size': 163, 'hint_rate': 0.03610728842501612, 'alpha': 64, 'iterations': 45}. Best is trial 83 with value: 2.294988702700148.
[I 2023-11-21 09:57:46,501] Trial 163 finished with value: 2.355581371804523 and parameters: {'model_name': 'SimpleImputer', 'strategy': 'median'}. Best is trial 83 with value: 2.294988702700148.
[I 2023-11-21 09:57:46,751] Trial 115 finished with value: 2.3130270612936434 and parameters: {'model_name': 'IterativeImputer', 'estimator': 'Bayesian', 'sample_posterior': False, 'initial_strategy': 'mean', 'imputation_order': 'ascending'}. Best is trial 83 with value: 2.294988702700148.
[I 2023-11-21 09:57:47,948] Trial 168 finished with value: 2.3116467514175336 and parameters: {'model_name': 'SimpleImputer', 'strategy': 'mean'}. Best is trial 83 with value: 2.294988702700148.
[I 2023-11-21 09:57:48,266] Trial 169 finished with value: 2.3116467514175336 and parameters: {'model_name': 'SimpleImputer', 'strategy': 'mean'}. Best is trial 83 with value: 2.294988702700148.
[I 2023-11-21 09:57:48,693] Trial 170 finished with value: 2.3116467514175336 and parameters: {'model_name': 'SimpleImputer', 'strategy': 'mean'}. Best is trial 83 with value: 2.294988702700148.
[I 2023-11-21 09:57:49,374] Trial 173 finished with value: 2.3116467514175336 and parameters: {'model_name': 'SimpleImputer', 'strategy': 'mean'}. Best is trial 83 with value: 2.294988702700148.
[I 2023-11-21 09:57:49,384] Trial 171 finished with value: 2.3116467514175336 and parameters: {'model_name': 'SimpleImputer', 'strategy': 'mean'}. Best is trial 83 with value: 2.294988702700148.
[I 2023-11-21 09:57:50,110] Trial 172 finished with value: 2.3116467514175336 and parameters: {'model_name': 'SimpleImputer', 'strategy': 'mean'}. Best is trial 83 with value: 2.294988702700148.
[I 2023-11-21 09:57:51,587] Trial 174 finished with value: 2.3116467514175336 and parameters: {'model_name': 'SimpleImputer', 'strategy': 'mean'}. Best is trial 83 with value: 2.294988702700148.
[I 2023-11-21 09:57:52,035] Trial 175 finished with value: 2.3116467514175336 and parameters: {'model_name': 'SimpleImputer', 'strategy': 'mean'}. Best is trial 83 with value: 2.294988702700148.
[I 2023-11-21 09:57:52,300] Trial 176 finished with value: 2.3116467514175336 and parameters: {'model_name': 'SimpleImputer', 'strategy': 'mean'}. Best is trial 83 with value: 2.294988702700148.
[I 2023-11-21 09:57:52,960] Trial 177 finished with value: 2.3116467514175336 and parameters: {'model_name': 'SimpleImputer', 'strategy': 'mean'}. Best is trial 83 with value: 2.294988702700148.
[I 2023-11-21 09:57:52,965] Trial 119 finished with value: 2.3130270612936434 and parameters: {'model_name': 'IterativeImputer', 'estimator': 'Bayesian', 'sample_posterior': False, 'initial_strategy': 'mean', 'imputation_order': 'ascending'}. Best is trial 83 with value: 2.294988702700148.
[I 2023-11-21 09:57:53,454] Trial 178 finished with value: 2.3116467514175336 and parameters: {'model_name': 'SimpleImputer', 'strategy': 'mean'}. Best is trial 83 with value: 2.294988702700148.
[I 2023-11-21 09:57:53,915] Trial 184 finished with value: inf and parameters: {'model_name': 'KNNImputer', 'weights': 'distance', 'keep_empty_features': False}. Best is trial 83 with value: 2.294988702700148.
[I 2023-11-21 09:57:54,481] Trial 185 finished with value: inf and parameters: {'model_name': 'KNNImputer', 'weights': 'distance', 'keep_empty_features': False}. Best is trial 83 with value: 2.294988702700148.
[I 2023-11-21 09:57:54,932] Trial 179 finished with value: 2.3116467514175336 and parameters: {'model_name': 'SimpleImputer', 'strategy': 'mean'}. Best is trial 83 with value: 2.294988702700148.
[I 2023-11-21 09:57:56,281] Trial 180 finished with value: 2.3116467514175336 and parameters: {'model_name': 'SimpleImputer', 'strategy': 'mean'}. Best is trial 83 with value: 2.294988702700148.
[I 2023-11-21 09:57:56,851] Trial 182 finished with value: 2.3116467514175336 and parameters: {'model_name': 'SimpleImputer', 'strategy': 'mean'}. Best is trial 83 with value: 2.294988702700148.
[I 2023-11-21 09:57:57,243] Trial 181 finished with value: 2.3116467514175336 and parameters: {'model_name': 'SimpleImputer', 'strategy': 'mean'}. Best is trial 83 with value: 2.294988702700148.
[I 2023-11-21 09:57:57,839] Trial 183 finished with value: 2.3116467514175336 and parameters: {'model_name': 'SimpleImputer', 'strategy': 'mean'}. Best is trial 83 with value: 2.294988702700148.
[I 2023-11-21 09:57:58,694] Trial 187 finished with value: 2.3116467514175336 and parameters: {'model_name': 'SimpleImputer', 'strategy': 'mean'}. Best is trial 83 with value: 2.294988702700148.
[I 2023-11-21 09:57:58,974] Trial 186 finished with value: 2.3116467514175336 and parameters: {'model_name': 'SimpleImputer', 'strategy': 'mean'}. Best is trial 83 with value: 2.294988702700148.
[I 2023-11-21 09:57:59,237] Trial 188 finished with value: 2.3116467514175336 and parameters: {'model_name': 'SimpleImputer', 'strategy': 'mean'}. Best is trial 83 with value: 2.294988702700148.
[I 2023-11-21 09:58:00,451] Trial 189 finished with value: 2.3116467514175336 and parameters: {'model_name': 'SimpleImputer', 'strategy': 'mean'}. Best is trial 83 with value: 2.294988702700148.
[I 2023-11-21 09:58:01,382] Trial 191 finished with value: 2.3116467514175336 and parameters: {'model_name': 'SimpleImputer', 'strategy': 'mean'}. Best is trial 83 with value: 2.294988702700148.
[I 2023-11-21 09:58:01,914] Trial 190 finished with value: 2.3116467514175336 and parameters: {'model_name': 'SimpleImputer', 'strategy': 'mean'}. Best is trial 83 with value: 2.294988702700148.
[I 2023-11-21 09:58:02,452] Trial 193 finished with value: 2.3116467514175336 and parameters: {'model_name': 'SimpleImputer', 'strategy': 'mean'}. Best is trial 83 with value: 2.294988702700148.
[I 2023-11-21 09:58:02,909] Trial 192 finished with value: 2.3116467514175336 and parameters: {'model_name': 'SimpleImputer', 'strategy': 'mean'}. Best is trial 83 with value: 2.294988702700148.
[I 2023-11-21 09:58:03,484] Trial 195 finished with value: 2.3116467514175336 and parameters: {'model_name': 'SimpleImputer', 'strategy': 'mean'}. Best is trial 83 with value: 2.294988702700148.
[I 2023-11-21 09:58:04,677] Trial 194 finished with value: 2.3116467514175336 and parameters: {'model_name': 'SimpleImputer', 'strategy': 'mean'}. Best is trial 83 with value: 2.294988702700148.
[I 2023-11-21 09:58:05,349] Trial 196 finished with value: 2.3116467514175336 and parameters: {'model_name': 'SimpleImputer', 'strategy': 'mean'}. Best is trial 83 with value: 2.294988702700148.
[I 2023-11-21 09:58:05,915] Trial 197 finished with value: 2.3116467514175336 and parameters: {'model_name': 'SimpleImputer', 'strategy': 'mean'}. Best is trial 83 with value: 2.294988702700148.
[I 2023-11-21 09:58:06,782] Trial 199 finished with value: 2.3116467514175336 and parameters: {'model_name': 'SimpleImputer', 'strategy': 'mean'}. Best is trial 83 with value: 2.294988702700148.
[I 2023-11-21 09:58:06,998] Trial 198 finished with value: 2.3116467514175336 and parameters: {'model_name': 'SimpleImputer', 'strategy': 'mean'}. Best is trial 83 with value: 2.294988702700148.
[I 2023-11-21 09:58:13,241] Trial 76 finished with value: 2.417102566183017 and parameters: {'model_name': 'IterativeImputer', 'estimator': 'Bayesian', 'sample_posterior': False, 'initial_strategy': 'most_frequent', 'imputation_order': 'ascending'}. Best is trial 83 with value: 2.294988702700148.
[I 2023-11-21 09:58:17,321] Trial 94 finished with value: 2.417102566183017 and parameters: {'model_name': 'IterativeImputer', 'estimator': 'Bayesian', 'sample_posterior': False, 'initial_strategy': 'most_frequent', 'imputation_order': 'ascending'}. Best is trial 83 with value: 2.294988702700148.
[I 2023-11-21 09:58:19,514] Trial 116 finished with value: 2.417102566183017 and parameters: {'model_name': 'IterativeImputer', 'estimator': 'Bayesian', 'sample_posterior': False, 'initial_strategy': 'most_frequent', 'imputation_order': 'ascending'}. Best is trial 83 with value: 2.294988702700148.
[I 2023-11-21 09:58:23,371] Trial 124 finished with value: 2.417102566183017 and parameters: {'model_name': 'IterativeImputer', 'estimator': 'Bayesian', 'sample_posterior': False, 'initial_strategy': 'most_frequent', 'imputation_order': 'ascending'}. Best is trial 83 with value: 2.294988702700148.
[I 2023-11-21 09:59:17,048] Trial 129 finished with value: 2.4258647033405283 and parameters: {'model_name': 'IterativeImputer', 'estimator': 'Bayesian', 'sample_posterior': False, 'initial_strategy': 'most_frequent', 'imputation_order': 'roman'}. Best is trial 83 with value: 2.294988702700148.
[I 2023-11-21 09:59:18,213] Trial 131 finished with value: 2.4258647033405283 and parameters: {'model_name': 'IterativeImputer', 'estimator': 'Bayesian', 'sample_posterior': False, 'initial_strategy': 'most_frequent', 'imputation_order': 'roman'}. Best is trial 83 with value: 2.294988702700148.
[I 2023-11-21 09:59:19,506] Trial 132 finished with value: 2.294988702700148 and parameters: {'model_name': 'IterativeImputer', 'estimator': 'Bayesian', 'sample_posterior': False, 'initial_strategy': 'mean', 'imputation_order': 'roman'}. Best is trial 83 with value: 2.294988702700148.
[I 2023-11-21 10:00:11,203] Trial 0 finished with value: 3.4505916341433442 and parameters: {'model_name': 'IterativeImputer', 'estimator': 'Ridge', 'sample_posterior': False, 'initial_strategy': 'constant', 'imputation_order': 'ascending'}. Best is trial 83 with value: 2.294988702700148.
[I 2023-11-21 10:00:15,251] Trial 4 finished with value: 2.9464350068044456 and parameters: {'model_name': 'IterativeImputer', 'estimator': 'Ridge', 'sample_posterior': False, 'initial_strategy': 'constant', 'imputation_order': 'roman'}. Best is trial 83 with value: 2.294988702700148.
[I 2023-11-21 10:06:38,616] Trial 12 finished with value: 2.4792819040893637 and parameters: {'model_name': 'IterativeImputer', 'estimator': 'KNN', 'sample_posterior': False, 'initial_strategy': 'mean', 'imputation_order': 'random'}. Best is trial 83 with value: 2.294988702700148.
[I 2023-11-21 10:07:02,631] Trial 133 finished with value: 2.4620067029045645 and parameters: {'model_name': 'IterativeImputer', 'estimator': 'KNN', 'sample_posterior': False, 'initial_strategy': 'most_frequent', 'imputation_order': 'roman'}. Best is trial 83 with value: 2.294988702700148.
[I 2023-11-21 10:07:24,853] Trial 142 finished with value: 2.4889367742688355 and parameters: {'model_name': 'IterativeImputer', 'estimator': 'KNN', 'sample_posterior': False, 'initial_strategy': 'mean', 'imputation_order': 'descending'}. Best is trial 83 with value: 2.294988702700148.
[I 2023-11-21 10:07:32,728] Trial 138 finished with value: 2.5164694167135395 and parameters: {'model_name': 'IterativeImputer', 'estimator': 'KNN', 'sample_posterior': False, 'initial_strategy': 'mean', 'imputation_order': 'random'}. Best is trial 83 with value: 2.294988702700148.
[I 2023-11-21 10:07:36,936] Trial 141 finished with value: 2.4835636671613366 and parameters: {'model_name': 'IterativeImputer', 'estimator': 'KNN', 'sample_posterior': False, 'initial_strategy': 'mean', 'imputation_order': 'random'}. Best is trial 83 with value: 2.294988702700148.
