                                                                                     Best trial: 7. Best value: 2.16144:  62%|██████▏   | 123/200 [00:48<00:24,  3.18it/s]Best trial: 7. Best value: 2.16144:  62%|██████▏   | 123/200 [00:48<00:24,  3.18it/s]Best trial: 7. Best value: 2.16144:  62%|██████▏   | 124/200 [00:48<00:39,  1.94it/s][I 2023-11-21 17:11:01,432] Trial 130 finished with value: 2.1614446043307978 and parameters: {'model_name': 'SimpleImputer', 'strategy': 'most_frequent'}. Best is trial 7 with value: 2.1614446043307978.
                                                                                     Best trial: 7. Best value: 2.16144:  62%|██████▏   | 124/200 [00:48<00:39,  1.94it/s]Best trial: 7. Best value: 2.16144:  62%|██████▏   | 124/200 [00:48<00:39,  1.94it/s]Best trial: 7. Best value: 2.16144:  62%|██████▎   | 125/200 [00:48<00:32,  2.29it/s][I 2023-11-21 17:11:01,653] Trial 120 finished with value: 2.1614446043307978 and parameters: {'model_name': 'SimpleImputer', 'strategy': 'most_frequent'}. Best is trial 7 with value: 2.1614446043307978.
                                                                                     Best trial: 7. Best value: 2.16144:  62%|██████▎   | 125/200 [00:48<00:32,  2.29it/s]Best trial: 7. Best value: 2.16144:  62%|██████▎   | 125/200 [00:49<00:32,  2.29it/s]Best trial: 7. Best value: 2.16144:  63%|██████▎   | 126/200 [00:49<00:27,  2.71it/s][I 2023-11-21 17:11:01,880] Trial 131 finished with value: 2.1614446043307978 and parameters: {'model_name': 'SimpleImputer', 'strategy': 'most_frequent'}. Best is trial 7 with value: 2.1614446043307978.
                                                                                     Best trial: 7. Best value: 2.16144:  63%|██████▎   | 126/200 [00:49<00:27,  2.71it/s]Best trial: 7. Best value: 2.16144:  63%|██████▎   | 126/200 [00:49<00:27,  2.71it/s]Best trial: 7. Best value: 2.16144:  64%|██████▎   | 127/200 [00:49<00:24,  3.01it/s][I 2023-11-21 17:11:02,149] Trial 129 finished with value: 2.1614446043307978 and parameters: {'model_name': 'SimpleImputer', 'strategy': 'most_frequent'}. Best is trial 7 with value: 2.1614446043307978.
                                                                                     Best trial: 7. Best value: 2.16144:  64%|██████▎   | 127/200 [00:49<00:24,  3.01it/s]Best trial: 7. Best value: 2.16144:  64%|██████▎   | 127/200 [00:49<00:24,  3.01it/s]Best trial: 7. Best value: 2.16144:  64%|██████▍   | 128/200 [00:49<00:22,  3.23it/s][I 2023-11-21 17:11:02,362] Trial 119 finished with value: 2.1614446043307978 and parameters: {'model_name': 'SimpleImputer', 'strategy': 'most_frequent'}. Best is trial 7 with value: 2.1614446043307978.
                                                                                     Best trial: 7. Best value: 2.16144:  64%|██████▍   | 128/200 [00:49<00:22,  3.23it/s]Best trial: 7. Best value: 2.16144:  64%|██████▍   | 128/200 [00:49<00:22,  3.23it/s]Best trial: 7. Best value: 2.16144:  64%|██████▍   | 129/200 [00:49<00:19,  3.62it/s][I 2023-11-21 17:11:02,567] Trial 134 finished with value: 2.1614446043307978 and parameters: {'model_name': 'SimpleImputer', 'strategy': 'most_frequent'}. Best is trial 7 with value: 2.1614446043307978.
                                                                                     Best trial: 7. Best value: 2.16144:  64%|██████▍   | 129/200 [00:49<00:19,  3.62it/s]Best trial: 7. Best value: 2.16144:  64%|██████▍   | 129/200 [00:49<00:19,  3.62it/s]Best trial: 7. Best value: 2.16144:  65%|██████▌   | 130/200 [00:49<00:18,  3.76it/s][I 2023-11-21 17:11:02,942] Trial 127 finished with value: 2.1614446043307978 and parameters: {'model_name': 'SimpleImputer', 'strategy': 'most_frequent'}. Best is trial 7 with value: 2.1614446043307978.
                                                                                     Best trial: 7. Best value: 2.16144:  65%|██████▌   | 130/200 [00:50<00:18,  3.76it/s]Best trial: 7. Best value: 2.16144:  65%|██████▌   | 130/200 [00:50<00:18,  3.76it/s]Best trial: 7. Best value: 2.16144:  66%|██████▌   | 131/200 [00:50<00:20,  3.37it/s][I 2023-11-21 17:11:03,383] Trial 166 finished with value: 6.079391227877255 and parameters: {'model_name': 'SimpleImputer', 'strategy': 'constant'}. Best is trial 7 with value: 2.1614446043307978.
                                                                                     Best trial: 7. Best value: 2.16144:  66%|██████▌   | 131/200 [00:50<00:20,  3.37it/s]Best trial: 7. Best value: 2.16144:  66%|██████▌   | 131/200 [00:50<00:20,  3.37it/s]Best trial: 7. Best value: 2.16144:  66%|██████▌   | 132/200 [00:50<00:23,  2.95it/s][I 2023-11-21 17:11:03,651] Trial 163 finished with value: 6.079391227877255 and parameters: {'model_name': 'SimpleImputer', 'strategy': 'constant'}. Best is trial 7 with value: 2.1614446043307978.
                                                                                     Best trial: 7. Best value: 2.16144:  66%|██████▌   | 132/200 [00:50<00:23,  2.95it/s]Best trial: 7. Best value: 2.16144:  66%|██████▌   | 132/200 [00:51<00:23,  2.95it/s]Best trial: 7. Best value: 2.16144:  66%|██████▋   | 133/200 [00:51<00:21,  3.19it/s][I 2023-11-21 17:11:03,953] Trial 136 finished with value: 2.1614446043307978 and parameters: {'model_name': 'SimpleImputer', 'strategy': 'most_frequent'}. Best is trial 7 with value: 2.1614446043307978.
                                                                                     Best trial: 7. Best value: 2.16144:  66%|██████▋   | 133/200 [00:51<00:21,  3.19it/s]Best trial: 7. Best value: 2.16144:  66%|██████▋   | 133/200 [00:51<00:21,  3.19it/s]Best trial: 7. Best value: 2.16144:  67%|██████▋   | 134/200 [00:51<00:21,  3.03it/s][I 2023-11-21 17:11:04,232] Trial 128 finished with value: 2.1614446043307978 and parameters: {'model_name': 'SimpleImputer', 'strategy': 'most_frequent'}. Best is trial 7 with value: 2.1614446043307978.
                                                                                     Best trial: 7. Best value: 2.16144:  67%|██████▋   | 134/200 [00:51<00:21,  3.03it/s][I 2023-11-21 17:11:04,464] Trial 125 finished with value: 2.1614446043307978 and parameters: {'model_name': 'SimpleImputer', 'strategy': 'most_frequent'}. Best is trial 7 with value: 2.1614446043307978.
                                                                                     Best trial: 7. Best value: 2.16144:  67%|██████▋   | 134/200 [00:51<00:21,  3.03it/s]Best trial: 7. Best value: 2.16144:  67%|██████▋   | 134/200 [00:51<00:21,  3.03it/s]Best trial: 7. Best value: 2.16144:  68%|██████▊   | 135/200 [00:51<00:24,  2.65it/s]Best trial: 7. Best value: 2.16144:  68%|██████▊   | 135/200 [00:51<00:24,  2.65it/s][I 2023-11-21 17:11:04,749] Trial 167 finished with value: 6.079391227877255 and parameters: {'model_name': 'SimpleImputer', 'strategy': 'constant'}. Best is trial 7 with value: 2.1614446043307978.
                                                                                     Best trial: 7. Best value: 2.16144:  68%|██████▊   | 136/200 [00:51<00:24,  2.65it/s]Best trial: 7. Best value: 2.16144:  68%|██████▊   | 136/200 [00:52<00:24,  2.65it/s]Best trial: 7. Best value: 2.16144:  68%|██████▊   | 137/200 [00:52<00:16,  3.81it/s][I 2023-11-21 17:11:05,227] Trial 135 finished with value: 2.1614446043307978 and parameters: {'model_name': 'SimpleImputer', 'strategy': 'most_frequent'}. Best is trial 7 with value: 2.1614446043307978.
                                                                                     Best trial: 7. Best value: 2.16144:  68%|██████▊   | 137/200 [00:52<00:16,  3.81it/s]Best trial: 7. Best value: 2.16144:  68%|██████▊   | 137/200 [00:52<00:16,  3.81it/s]Best trial: 7. Best value: 2.16144:  69%|██████▉   | 138/200 [00:52<00:19,  3.14it/s]                                                                                     [I 2023-11-21 17:11:05,462] Trial 165 finished with value: 6.079391227877255 and parameters: {'model_name': 'SimpleImputer', 'strategy': 'constant'}. Best is trial 7 with value: 2.1614446043307978.
Best trial: 7. Best value: 2.16144:  69%|██████▉   | 138/200 [00:52<00:19,  3.14it/s]Best trial: 7. Best value: 2.16144:  69%|██████▉   | 138/200 [00:52<00:19,  3.14it/s]Best trial: 7. Best value: 2.16144:  70%|██████▉   | 139/200 [00:52<00:17,  3.39it/s][I 2023-11-21 17:11:05,704] Trial 168 finished with value: 6.079391227877255 and parameters: {'model_name': 'SimpleImputer', 'strategy': 'constant'}. Best is trial 7 with value: 2.1614446043307978.
                                                                                     Best trial: 7. Best value: 2.16144:  70%|██████▉   | 139/200 [00:52<00:17,  3.39it/s]Best trial: 7. Best value: 2.16144:  70%|██████▉   | 139/200 [00:53<00:17,  3.39it/s]Best trial: 7. Best value: 2.16144:  70%|███████   | 140/200 [00:53<00:16,  3.64it/s][I 2023-11-21 17:11:05,966] Trial 164 finished with value: 6.079391227877255 and parameters: {'model_name': 'SimpleImputer', 'strategy': 'constant'}. Best is trial 7 with value: 2.1614446043307978.
                                                                                     Best trial: 7. Best value: 2.16144:  70%|███████   | 140/200 [00:53<00:16,  3.64it/s]Best trial: 7. Best value: 2.16144:  70%|███████   | 140/200 [00:53<00:16,  3.64it/s]Best trial: 7. Best value: 2.16144:  70%|███████   | 141/200 [00:53<00:15,  3.69it/s][I 2023-11-21 17:11:06,454] Trial 132 finished with value: 2.1614446043307978 and parameters: {'model_name': 'SimpleImputer', 'strategy': 'most_frequent'}. Best is trial 7 with value: 2.1614446043307978.
                                                                                     Best trial: 7. Best value: 2.16144:  70%|███████   | 141/200 [00:53<00:15,  3.69it/s]Best trial: 7. Best value: 2.16144:  70%|███████   | 141/200 [00:53<00:15,  3.69it/s]Best trial: 7. Best value: 2.16144:  71%|███████   | 142/200 [00:53<00:19,  2.97it/s][I 2023-11-21 17:11:06,757] Trial 140 finished with value: 2.1614446043307978 and parameters: {'model_name': 'SimpleImputer', 'strategy': 'most_frequent'}. Best is trial 7 with value: 2.1614446043307978.
                                                                                     Best trial: 7. Best value: 2.16144:  71%|███████   | 142/200 [00:53<00:19,  2.97it/s]Best trial: 7. Best value: 2.16144:  71%|███████   | 142/200 [00:54<00:19,  2.97it/s]Best trial: 7. Best value: 2.16144:  72%|███████▏  | 143/200 [00:54<00:18,  3.02it/s][I 2023-11-21 17:11:07,067] Trial 170 finished with value: 6.079391227877255 and parameters: {'model_name': 'SimpleImputer', 'strategy': 'constant'}. Best is trial 7 with value: 2.1614446043307978.
                                                                                     Best trial: 7. Best value: 2.16144:  72%|███████▏  | 143/200 [00:54<00:18,  3.02it/s]Best trial: 7. Best value: 2.16144:  72%|███████▏  | 143/200 [00:54<00:18,  3.02it/s]Best trial: 7. Best value: 2.16144:  72%|███████▏  | 144/200 [00:54<00:17,  3.14it/s][I 2023-11-21 17:11:07,428] Trial 178 finished with value: 6.079391227877255 and parameters: {'model_name': 'SimpleImputer', 'strategy': 'constant'}. Best is trial 7 with value: 2.1614446043307978.
                                                                                     Best trial: 7. Best value: 2.16144:  72%|███████▏  | 144/200 [00:54<00:17,  3.14it/s]Best trial: 7. Best value: 2.16144:  72%|███████▏  | 144/200 [00:54<00:17,  3.14it/s]Best trial: 7. Best value: 2.16144:  72%|███████▎  | 145/200 [00:54<00:18,  2.92it/s][I 2023-11-21 17:11:07,763] Trial 133 finished with value: 2.1614446043307978 and parameters: {'model_name': 'SimpleImputer', 'strategy': 'most_frequent'}. Best is trial 7 with value: 2.1614446043307978.
                                                                                     Best trial: 7. Best value: 2.16144:  72%|███████▎  | 145/200 [00:54<00:18,  2.92it/s][I 2023-11-21 17:11:07,986] Trial 171 finished with value: 6.079391227877255 and parameters: {'model_name': 'SimpleImputer', 'strategy': 'constant'}. Best is trial 7 with value: 2.1614446043307978.
                                                                                     Best trial: 7. Best value: 2.16144:  72%|███████▎  | 145/200 [00:55<00:18,  2.92it/s]Best trial: 7. Best value: 2.16144:  72%|███████▎  | 145/200 [00:55<00:18,  2.92it/s]Best trial: 7. Best value: 2.16144:  73%|███████▎  | 146/200 [00:55<00:21,  2.54it/s]Best trial: 7. Best value: 2.16144:  73%|███████▎  | 146/200 [00:55<00:21,  2.54it/s][I 2023-11-21 17:11:08,381] Trial 173 finished with value: 6.079391227877255 and parameters: {'model_name': 'SimpleImputer', 'strategy': 'constant'}. Best is trial 7 with value: 2.1614446043307978.
                                                                                     Best trial: 7. Best value: 2.16144:  74%|███████▎  | 147/200 [00:55<00:20,  2.54it/s]Best trial: 7. Best value: 2.16144:  74%|███████▎  | 147/200 [00:55<00:20,  2.54it/s]Best trial: 7. Best value: 2.16144:  74%|███████▍  | 148/200 [00:55<00:15,  3.26it/s][I 2023-11-21 17:11:08,686] Trial 172 finished with value: 6.079391227877255 and parameters: {'model_name': 'SimpleImputer', 'strategy': 'constant'}. Best is trial 7 with value: 2.1614446043307978.
                                                                                     Best trial: 7. Best value: 2.16144:  74%|███████▍  | 148/200 [00:55<00:15,  3.26it/s]Best trial: 7. Best value: 2.16144:  74%|███████▍  | 148/200 [00:56<00:15,  3.26it/s]Best trial: 7. Best value: 2.16144:  74%|███████▍  | 149/200 [00:56<00:16,  3.14it/s][I 2023-11-21 17:11:08,966] Trial 174 finished with value: 6.079391227877255 and parameters: {'model_name': 'SimpleImputer', 'strategy': 'constant'}. Best is trial 7 with value: 2.1614446043307978.
                                                                                     Best trial: 7. Best value: 2.16144:  74%|███████▍  | 149/200 [00:56<00:16,  3.14it/s]Best trial: 7. Best value: 2.16144:  74%|███████▍  | 149/200 [00:56<00:16,  3.14it/s]Best trial: 7. Best value: 2.16144:  75%|███████▌  | 150/200 [00:56<00:14,  3.36it/s][I 2023-11-21 17:11:09,288] Trial 139 finished with value: 2.1614446043307978 and parameters: {'model_name': 'SimpleImputer', 'strategy': 'most_frequent'}. Best is trial 7 with value: 2.1614446043307978.
                                                                                     Best trial: 7. Best value: 2.16144:  75%|███████▌  | 150/200 [00:56<00:14,  3.36it/s]Best trial: 7. Best value: 2.16144:  75%|███████▌  | 150/200 [00:56<00:14,  3.36it/s]Best trial: 7. Best value: 2.16144:  76%|███████▌  | 151/200 [00:56<00:14,  3.28it/s][I 2023-11-21 17:11:09,555] Trial 137 finished with value: 2.1614446043307978 and parameters: {'model_name': 'SimpleImputer', 'strategy': 'most_frequent'}. Best is trial 7 with value: 2.1614446043307978.
                                                                                     Best trial: 7. Best value: 2.16144:  76%|███████▌  | 151/200 [00:56<00:14,  3.28it/s]Best trial: 7. Best value: 2.16144:  76%|███████▌  | 151/200 [00:56<00:14,  3.28it/s]Best trial: 7. Best value: 2.16144:  76%|███████▌  | 152/200 [00:56<00:13,  3.48it/s][I 2023-11-21 17:11:09,878] Trial 138 finished with value: 2.1614446043307978 and parameters: {'model_name': 'SimpleImputer', 'strategy': 'most_frequent'}. Best is trial 7 with value: 2.1614446043307978.
                                                                                     Best trial: 7. Best value: 2.16144:  76%|███████▌  | 152/200 [00:57<00:13,  3.48it/s]Best trial: 7. Best value: 2.16144:  76%|███████▌  | 152/200 [00:57<00:13,  3.48it/s]Best trial: 7. Best value: 2.16144:  76%|███████▋  | 153/200 [00:57<00:14,  3.25it/s][I 2023-11-21 17:11:10,141] Trial 142 finished with value: 2.1614446043307978 and parameters: {'model_name': 'SimpleImputer', 'strategy': 'most_frequent'}. Best is trial 7 with value: 2.1614446043307978.
                                                                                     Best trial: 7. Best value: 2.16144:  76%|███████▋  | 153/200 [00:57<00:14,  3.25it/s]Best trial: 7. Best value: 2.16144:  76%|███████▋  | 153/200 [00:57<00:14,  3.25it/s]Best trial: 7. Best value: 2.16144:  77%|███████▋  | 154/200 [00:57<00:13,  3.49it/s][I 2023-11-21 17:11:10,362] Trial 144 finished with value: 2.1614446043307978 and parameters: {'model_name': 'SimpleImputer', 'strategy': 'most_frequent'}. Best is trial 7 with value: 2.1614446043307978.
                                                                                     Best trial: 7. Best value: 2.16144:  77%|███████▋  | 154/200 [00:57<00:13,  3.49it/s]Best trial: 7. Best value: 2.16144:  77%|███████▋  | 154/200 [00:57<00:13,  3.49it/s]Best trial: 7. Best value: 2.16144:  78%|███████▊  | 155/200 [00:57<00:11,  3.76it/s][I 2023-11-21 17:11:10,680] Trial 141 finished with value: 2.1614446043307978 and parameters: {'model_name': 'SimpleImputer', 'strategy': 'most_frequent'}. Best is trial 7 with value: 2.1614446043307978.
                                                                                     Best trial: 7. Best value: 2.16144:  78%|███████▊  | 155/200 [00:57<00:11,  3.76it/s]Best trial: 7. Best value: 2.16144:  78%|███████▊  | 155/200 [00:58<00:11,  3.76it/s]Best trial: 7. Best value: 2.16144:  78%|███████▊  | 156/200 [00:58<00:12,  3.52it/s][I 2023-11-21 17:11:10,905] Trial 176 finished with value: 6.079391227877255 and parameters: {'model_name': 'SimpleImputer', 'strategy': 'constant'}. Best is trial 7 with value: 2.1614446043307978.
                                                                                     Best trial: 7. Best value: 2.16144:  78%|███████▊  | 156/200 [00:58<00:12,  3.52it/s]Best trial: 7. Best value: 2.16144:  78%|███████▊  | 156/200 [00:58<00:12,  3.52it/s]Best trial: 7. Best value: 2.16144:  78%|███████▊  | 157/200 [00:58<00:11,  3.80it/s][I 2023-11-21 17:11:11,367] Trial 145 finished with value: 2.1614446043307978 and parameters: {'model_name': 'SimpleImputer', 'strategy': 'most_frequent'}. Best is trial 7 with value: 2.1614446043307978.
                                                                                     Best trial: 7. Best value: 2.16144:  78%|███████▊  | 157/200 [00:58<00:11,  3.80it/s]Best trial: 7. Best value: 2.16144:  78%|███████▊  | 157/200 [00:58<00:11,  3.80it/s]Best trial: 7. Best value: 2.16144:  79%|███████▉  | 158/200 [00:58<00:13,  3.04it/s][I 2023-11-21 17:11:12,329] Trial 146 finished with value: 2.1614446043307978 and parameters: {'model_name': 'SimpleImputer', 'strategy': 'most_frequent'}. Best is trial 7 with value: 2.1614446043307978.
                                                                                     Best trial: 7. Best value: 2.16144:  79%|███████▉  | 158/200 [00:59<00:13,  3.04it/s]Best trial: 7. Best value: 2.16144:  79%|███████▉  | 158/200 [00:59<00:13,  3.04it/s]Best trial: 7. Best value: 2.16144:  80%|███████▉  | 159/200 [00:59<00:21,  1.92it/s][I 2023-11-21 17:11:12,638] Trial 147 finished with value: 2.1614446043307978 and parameters: {'model_name': 'SimpleImputer', 'strategy': 'most_frequent'}. Best is trial 7 with value: 2.1614446043307978.
                                                                                     Best trial: 7. Best value: 2.16144:  80%|███████▉  | 159/200 [00:59<00:21,  1.92it/s]Best trial: 7. Best value: 2.16144:  80%|███████▉  | 159/200 [01:00<00:21,  1.92it/s]Best trial: 7. Best value: 2.16144:  80%|████████  | 160/200 [01:00<00:18,  2.16it/s][I 2023-11-21 17:11:13,199] Trial 143 finished with value: 2.1614446043307978 and parameters: {'model_name': 'SimpleImputer', 'strategy': 'most_frequent'}. Best is trial 7 with value: 2.1614446043307978.
                                                                                     Best trial: 7. Best value: 2.16144:  80%|████████  | 160/200 [01:00<00:18,  2.16it/s]Best trial: 7. Best value: 2.16144:  80%|████████  | 160/200 [01:00<00:18,  2.16it/s]Best trial: 7. Best value: 2.16144:  80%|████████  | 161/200 [01:00<00:18,  2.08it/s]                                                                                     [I 2023-11-21 17:11:13,771] Trial 148 finished with value: 2.1614446043307978 and parameters: {'model_name': 'SimpleImputer', 'strategy': 'most_frequent'}. Best is trial 7 with value: 2.1614446043307978.
Best trial: 7. Best value: 2.16144:  80%|████████  | 161/200 [01:00<00:18,  2.08it/s]Best trial: 7. Best value: 2.16144:  80%|████████  | 161/200 [01:01<00:18,  2.08it/s]Best trial: 7. Best value: 2.16144:  81%|████████  | 162/200 [01:01<00:19,  1.96it/s][I 2023-11-21 17:11:14,019] Trial 151 finished with value: 2.1614446043307978 and parameters: {'model_name': 'SimpleImputer', 'strategy': 'most_frequent'}. Best is trial 7 with value: 2.1614446043307978.
                                                                                     Best trial: 7. Best value: 2.16144:  81%|████████  | 162/200 [01:01<00:19,  1.96it/s]Best trial: 7. Best value: 2.16144:  81%|████████  | 162/200 [01:01<00:19,  1.96it/s]Best trial: 7. Best value: 2.16144:  82%|████████▏ | 163/200 [01:01<00:15,  2.32it/s][I 2023-11-21 17:11:14,428] Trial 149 finished with value: 2.1614446043307978 and parameters: {'model_name': 'SimpleImputer', 'strategy': 'most_frequent'}. Best is trial 7 with value: 2.1614446043307978.
