                                                                                    Best trial: 4. Best value: 2.17575:  22%|██▏       | 43/200 [00:15<01:09,  2.25it/s]Best trial: 4. Best value: 2.17575:  22%|██▏       | 43/200 [00:15<01:09,  2.25it/s]Best trial: 4. Best value: 2.17575:  22%|██▏       | 44/200 [00:15<01:03,  2.47it/s][I 2023-11-21 17:10:28,939] Trial 58 finished with value: 2.190195188535638 and parameters: {'model_name': 'SimpleImputer', 'strategy': 'median'}. Best is trial 4 with value: 2.175751596440891.
                                                                                    Best trial: 4. Best value: 2.17575:  22%|██▏       | 44/200 [00:16<01:03,  2.47it/s]Best trial: 4. Best value: 2.17575:  22%|██▏       | 44/200 [00:16<01:03,  2.47it/s]Best trial: 4. Best value: 2.17575:  22%|██▎       | 45/200 [00:16<01:02,  2.46it/s][I 2023-11-21 17:10:29,216] Trial 81 finished with value: 2.175751596440891 and parameters: {'model_name': 'SimpleImputer', 'strategy': 'mean'}. Best is trial 4 with value: 2.175751596440891.
                                                                                    Best trial: 4. Best value: 2.17575:  22%|██▎       | 45/200 [00:16<01:02,  2.46it/s]Best trial: 4. Best value: 2.17575:  22%|██▎       | 45/200 [00:16<01:02,  2.46it/s]Best trial: 4. Best value: 2.17575:  23%|██▎       | 46/200 [00:16<00:55,  2.77it/s][I 2023-11-21 17:10:29,559] Trial 66 finished with value: 2.190195188535638 and parameters: {'model_name': 'SimpleImputer', 'strategy': 'median'}. Best is trial 4 with value: 2.175751596440891.
                                                                                    Best trial: 4. Best value: 2.17575:  23%|██▎       | 46/200 [00:16<00:55,  2.77it/s]Best trial: 4. Best value: 2.17575:  23%|██▎       | 46/200 [00:16<00:55,  2.77it/s]Best trial: 4. Best value: 2.17575:  24%|██▎       | 47/200 [00:16<00:57,  2.65it/s][I 2023-11-21 17:10:29,841] Trial 61 finished with value: 2.190195188535638 and parameters: {'model_name': 'SimpleImputer', 'strategy': 'median'}. Best is trial 4 with value: 2.175751596440891.
                                                                                    Best trial: 4. Best value: 2.17575:  24%|██▎       | 47/200 [00:17<00:57,  2.65it/s]Best trial: 4. Best value: 2.17575:  24%|██▎       | 47/200 [00:17<00:57,  2.65it/s]Best trial: 4. Best value: 2.17575:  24%|██▍       | 48/200 [00:17<00:52,  2.90it/s][I 2023-11-21 17:10:31,385] Trial 7 finished with value: 2.1614446043307978 and parameters: {'model_name': 'SimpleImputer', 'strategy': 'most_frequent'}. Best is trial 7 with value: 2.1614446043307978.
                                                                                    Best trial: 4. Best value: 2.17575:  24%|██▍       | 48/200 [00:18<00:52,  2.90it/s]Best trial: 7. Best value: 2.16144:  24%|██▍       | 48/200 [00:18<00:52,  2.90it/s]Best trial: 7. Best value: 2.16144:  24%|██▍       | 49/200 [00:18<01:44,  1.45it/s][I 2023-11-21 17:10:31,950] Trial 0 finished with value: 2.1614446043307978 and parameters: {'model_name': 'SimpleImputer', 'strategy': 'most_frequent'}. Best is trial 7 with value: 2.1614446043307978.
                                                                                    Best trial: 7. Best value: 2.16144:  24%|██▍       | 49/200 [00:19<01:44,  1.45it/s]Best trial: 7. Best value: 2.16144:  24%|██▍       | 49/200 [00:19<01:44,  1.45it/s]Best trial: 7. Best value: 2.16144:  25%|██▌       | 50/200 [00:19<01:38,  1.52it/s][I 2023-11-21 17:10:32,310] Trial 12 finished with value: 2.1614446043307978 and parameters: {'model_name': 'SimpleImputer', 'strategy': 'most_frequent'}. Best is trial 7 with value: 2.1614446043307978.
                                                                                    Best trial: 7. Best value: 2.16144:  25%|██▌       | 50/200 [00:19<01:38,  1.52it/s]Best trial: 7. Best value: 2.16144:  25%|██▌       | 50/200 [00:19<01:38,  1.52it/s]Best trial: 7. Best value: 2.16144:  26%|██▌       | 51/200 [00:19<01:25,  1.74it/s][I 2023-11-21 17:10:32,628] Trial 11 finished with value: 2.1614446043307978 and parameters: {'model_name': 'SimpleImputer', 'strategy': 'most_frequent'}. Best is trial 7 with value: 2.1614446043307978.
                                                                                    Best trial: 7. Best value: 2.16144:  26%|██▌       | 51/200 [00:19<01:25,  1.74it/s]Best trial: 7. Best value: 2.16144:  26%|██▌       | 51/200 [00:20<01:25,  1.74it/s]Best trial: 7. Best value: 2.16144:  26%|██▌       | 52/200 [00:20<01:13,  2.01it/s][I 2023-11-21 17:10:32,998] Trial 88 finished with value: 2.175751596440891 and parameters: {'model_name': 'SimpleImputer', 'strategy': 'mean'}. Best is trial 7 with value: 2.1614446043307978.
                                                                                    Best trial: 7. Best value: 2.16144:  26%|██▌       | 52/200 [00:20<01:13,  2.01it/s]Best trial: 7. Best value: 2.16144:  26%|██▌       | 52/200 [00:20<01:13,  2.01it/s]Best trial: 7. Best value: 2.16144:  26%|██▋       | 53/200 [00:20<01:05,  2.23it/s]                                                                                    [I 2023-11-21 17:10:33,324] Trial 1 finished with value: 2.1614446043307978 and parameters: {'model_name': 'SimpleImputer', 'strategy': 'most_frequent'}. Best is trial 7 with value: 2.1614446043307978.
Best trial: 7. Best value: 2.16144:  26%|██▋       | 53/200 [00:20<01:05,  2.23it/s]Best trial: 7. Best value: 2.16144:  26%|██▋       | 53/200 [00:20<01:05,  2.23it/s]Best trial: 7. Best value: 2.16144:  27%|██▋       | 54/200 [00:20<00:59,  2.44it/s][I 2023-11-21 17:10:33,638] Trial 2 finished with value: 2.1614446043307978 and parameters: {'model_name': 'SimpleImputer', 'strategy': 'most_frequent'}. Best is trial 7 with value: 2.1614446043307978.
                                                                                    Best trial: 7. Best value: 2.16144:  27%|██▋       | 54/200 [00:20<00:59,  2.44it/s]Best trial: 7. Best value: 2.16144:  27%|██▋       | 54/200 [00:21<00:59,  2.44it/s]Best trial: 7. Best value: 2.16144:  28%|██▊       | 55/200 [00:21<00:55,  2.62it/s][I 2023-11-21 17:10:33,997] Trial 13 finished with value: 2.1614446043307978 and parameters: {'model_name': 'SimpleImputer', 'strategy': 'most_frequent'}. Best is trial 7 with value: 2.1614446043307978.
                                                                                    Best trial: 7. Best value: 2.16144:  28%|██▊       | 55/200 [00:21<00:55,  2.62it/s]Best trial: 7. Best value: 2.16144:  28%|██▊       | 55/200 [00:21<00:55,  2.62it/s]Best trial: 7. Best value: 2.16144:  28%|██▊       | 56/200 [00:21<00:55,  2.59it/s][I 2023-11-21 17:10:34,734] Trial 46 finished with value: 2.1614446043307978 and parameters: {'model_name': 'SimpleImputer', 'strategy': 'most_frequent'}. Best is trial 7 with value: 2.1614446043307978.
                                                                                    Best trial: 7. Best value: 2.16144:  28%|██▊       | 56/200 [00:21<00:55,  2.59it/s][I 2023-11-21 17:10:34,933] Trial 30 finished with value: 2.1614446043307978 and parameters: {'model_name': 'SimpleImputer', 'strategy': 'most_frequent'}. Best is trial 7 with value: 2.1614446043307978.
                                                                                    Best trial: 7. Best value: 2.16144:  28%|██▊       | 56/200 [00:22<00:55,  2.59it/s]Best trial: 7. Best value: 2.16144:  28%|██▊       | 56/200 [00:22<00:55,  2.59it/s]Best trial: 7. Best value: 2.16144:  28%|██▊       | 57/200 [00:22<01:17,  1.84it/s]Best trial: 7. Best value: 2.16144:  28%|██▊       | 57/200 [00:22<01:17,  1.84it/s]                                                                                    [I 2023-11-21 17:10:35,209] Trial 29 finished with value: 2.1614446043307978 and parameters: {'model_name': 'SimpleImputer', 'strategy': 'most_frequent'}. Best is trial 7 with value: 2.1614446043307978.
Best trial: 7. Best value: 2.16144:  29%|██▉       | 58/200 [00:22<01:17,  1.84it/s]Best trial: 7. Best value: 2.16144:  29%|██▉       | 58/200 [00:22<01:17,  1.84it/s]Best trial: 7. Best value: 2.16144:  30%|██▉       | 59/200 [00:22<00:50,  2.81it/s][I 2023-11-21 17:10:35,501] Trial 36 finished with value: 2.1614446043307978 and parameters: {'model_name': 'SimpleImputer', 'strategy': 'most_frequent'}. Best is trial 7 with value: 2.1614446043307978.
                                                                                    Best trial: 7. Best value: 2.16144:  30%|██▉       | 59/200 [00:22<00:50,  2.81it/s]Best trial: 7. Best value: 2.16144:  30%|██▉       | 59/200 [00:22<00:50,  2.81it/s]Best trial: 7. Best value: 2.16144:  30%|███       | 60/200 [00:22<00:47,  2.94it/s][I 2023-11-21 17:10:36,356] Trial 42 finished with value: 2.1614446043307978 and parameters: {'model_name': 'SimpleImputer', 'strategy': 'most_frequent'}. Best is trial 7 with value: 2.1614446043307978.
                                                                                    Best trial: 7. Best value: 2.16144:  30%|███       | 60/200 [00:23<00:47,  2.94it/s]Best trial: 7. Best value: 2.16144:  30%|███       | 60/200 [00:23<00:47,  2.94it/s]Best trial: 7. Best value: 2.16144:  30%|███       | 61/200 [00:23<01:07,  2.05it/s][I 2023-11-21 17:10:36,625] Trial 49 finished with value: 2.1614446043307978 and parameters: {'model_name': 'SimpleImputer', 'strategy': 'most_frequent'}. Best is trial 7 with value: 2.1614446043307978.
                                                                                    Best trial: 7. Best value: 2.16144:  30%|███       | 61/200 [00:23<01:07,  2.05it/s]Best trial: 7. Best value: 2.16144:  30%|███       | 61/200 [00:24<01:07,  2.05it/s]Best trial: 7. Best value: 2.16144:  31%|███       | 62/200 [00:24<00:57,  2.40it/s][I 2023-11-21 17:10:37,166] Trial 56 finished with value: 2.1614446043307978 and parameters: {'model_name': 'SimpleImputer', 'strategy': 'most_frequent'}. Best is trial 7 with value: 2.1614446043307978.
                                                                                    Best trial: 7. Best value: 2.16144:  31%|███       | 62/200 [00:24<00:57,  2.40it/s]Best trial: 7. Best value: 2.16144:  31%|███       | 62/200 [00:24<00:57,  2.40it/s]Best trial: 7. Best value: 2.16144:  32%|███▏      | 63/200 [00:24<01:02,  2.18it/s][I 2023-11-21 17:10:37,626] Trial 38 finished with value: 2.1614446043307978 and parameters: {'model_name': 'SimpleImputer', 'strategy': 'most_frequent'}. Best is trial 7 with value: 2.1614446043307978.
                                                                                    Best trial: 7. Best value: 2.16144:  32%|███▏      | 63/200 [00:24<01:02,  2.18it/s]Best trial: 7. Best value: 2.16144:  32%|███▏      | 63/200 [00:24<01:02,  2.18it/s]Best trial: 7. Best value: 2.16144:  32%|███▏      | 64/200 [00:24<01:00,  2.25it/s][I 2023-11-21 17:10:38,061] Trial 67 finished with value: 2.1614446043307978 and parameters: {'model_name': 'SimpleImputer', 'strategy': 'most_frequent'}. Best is trial 7 with value: 2.1614446043307978.
                                                                                    Best trial: 7. Best value: 2.16144:  32%|███▏      | 64/200 [00:25<01:00,  2.25it/s]Best trial: 7. Best value: 2.16144:  32%|███▏      | 64/200 [00:25<01:00,  2.25it/s]Best trial: 7. Best value: 2.16144:  32%|███▎      | 65/200 [00:25<00:59,  2.26it/s][I 2023-11-21 17:10:38,420] Trial 57 finished with value: 2.1614446043307978 and parameters: {'model_name': 'SimpleImputer', 'strategy': 'most_frequent'}. Best is trial 7 with value: 2.1614446043307978.
                                                                                    Best trial: 7. Best value: 2.16144:  32%|███▎      | 65/200 [00:25<00:59,  2.26it/s]Best trial: 7. Best value: 2.16144:  32%|███▎      | 65/200 [00:25<00:59,  2.26it/s]Best trial: 7. Best value: 2.16144:  33%|███▎      | 66/200 [00:25<00:56,  2.39it/s][I 2023-11-21 17:10:38,797] Trial 71 finished with value: 2.1614446043307978 and parameters: {'model_name': 'SimpleImputer', 'strategy': 'most_frequent'}. Best is trial 7 with value: 2.1614446043307978.
                                                                                    Best trial: 7. Best value: 2.16144:  33%|███▎      | 66/200 [00:25<00:56,  2.39it/s]Best trial: 7. Best value: 2.16144:  33%|███▎      | 66/200 [00:26<00:56,  2.39it/s]Best trial: 7. Best value: 2.16144:  34%|███▎      | 67/200 [00:26<00:56,  2.35it/s][I 2023-11-21 17:10:39,177] Trial 70 finished with value: 2.1614446043307978 and parameters: {'model_name': 'SimpleImputer', 'strategy': 'most_frequent'}. Best is trial 7 with value: 2.1614446043307978.
                                                                                    Best trial: 7. Best value: 2.16144:  34%|███▎      | 67/200 [00:26<00:56,  2.35it/s]Best trial: 7. Best value: 2.16144:  34%|███▎      | 67/200 [00:26<00:56,  2.35it/s]Best trial: 7. Best value: 2.16144:  34%|███▍      | 68/200 [00:26<00:52,  2.52it/s][I 2023-11-21 17:10:39,427] Trial 68 finished with value: 2.1614446043307978 and parameters: {'model_name': 'SimpleImputer', 'strategy': 'most_frequent'}. Best is trial 7 with value: 2.1614446043307978.
                                                                                    Best trial: 7. Best value: 2.16144:  34%|███▍      | 68/200 [00:26<00:52,  2.52it/s][I 2023-11-21 17:10:39,631] Trial 62 finished with value: 2.1614446043307978 and parameters: {'model_name': 'SimpleImputer', 'strategy': 'most_frequent'}. Best is trial 7 with value: 2.1614446043307978.
                                                                                    Best trial: 7. Best value: 2.16144:  34%|███▍      | 68/200 [00:26<00:52,  2.52it/s]Best trial: 7. Best value: 2.16144:  34%|███▍      | 68/200 [00:26<00:52,  2.52it/s]Best trial: 7. Best value: 2.16144:  34%|███▍      | 69/200 [00:26<00:52,  2.47it/s]Best trial: 7. Best value: 2.16144:  34%|███▍      | 69/200 [00:26<00:52,  2.47it/s][I 2023-11-21 17:10:39,988] Trial 76 finished with value: 2.1614446043307978 and parameters: {'model_name': 'SimpleImputer', 'strategy': 'most_frequent'}. Best is trial 7 with value: 2.1614446043307978.
                                                                                    Best trial: 7. Best value: 2.16144:  35%|███▌      | 70/200 [00:27<00:52,  2.47it/s]Best trial: 7. Best value: 2.16144:  35%|███▌      | 70/200 [00:27<00:52,  2.47it/s]Best trial: 7. Best value: 2.16144:  36%|███▌      | 71/200 [00:27<00:41,  3.12it/s][I 2023-11-21 17:10:40,370] Trial 63 finished with value: 2.1614446043307978 and parameters: {'model_name': 'SimpleImputer', 'strategy': 'most_frequent'}. Best is trial 7 with value: 2.1614446043307978.
                                                                                    Best trial: 7. Best value: 2.16144:  36%|███▌      | 71/200 [00:27<00:41,  3.12it/s]Best trial: 7. Best value: 2.16144:  36%|███▌      | 71/200 [00:27<00:41,  3.12it/s]Best trial: 7. Best value: 2.16144:  36%|███▌      | 72/200 [00:27<00:41,  3.06it/s][I 2023-11-21 17:10:40,693] Trial 79 finished with value: 2.1614446043307978 and parameters: {'model_name': 'SimpleImputer', 'strategy': 'most_frequent'}. Best is trial 7 with value: 2.1614446043307978.
                                                                                    Best trial: 7. Best value: 2.16144:  36%|███▌      | 72/200 [00:27<00:41,  3.06it/s]Best trial: 7. Best value: 2.16144:  36%|███▌      | 72/200 [00:28<00:41,  3.06it/s]Best trial: 7. Best value: 2.16144:  36%|███▋      | 73/200 [00:28<00:40,  3.11it/s][I 2023-11-21 17:10:40,929] Trial 64 finished with value: 2.1614446043307978 and parameters: {'model_name': 'SimpleImputer', 'strategy': 'most_frequent'}. Best is trial 7 with value: 2.1614446043307978.
                                                                                    Best trial: 7. Best value: 2.16144:  36%|███▋      | 73/200 [00:28<00:40,  3.11it/s]Best trial: 7. Best value: 2.16144:  36%|███▋      | 73/200 [00:28<00:40,  3.11it/s]Best trial: 7. Best value: 2.16144:  37%|███▋      | 74/200 [00:28<00:37,  3.36it/s][I 2023-11-21 17:10:41,213] Trial 69 finished with value: 2.1614446043307978 and parameters: {'model_name': 'SimpleImputer', 'strategy': 'most_frequent'}. Best is trial 7 with value: 2.1614446043307978.
                                                                                    Best trial: 7. Best value: 2.16144:  37%|███▋      | 74/200 [00:28<00:37,  3.36it/s]Best trial: 7. Best value: 2.16144:  37%|███▋      | 74/200 [00:28<00:37,  3.36it/s]Best trial: 7. Best value: 2.16144:  38%|███▊      | 75/200 [00:28<00:36,  3.41it/s][I 2023-11-21 17:10:41,430] Trial 85 finished with value: 2.1614446043307978 and parameters: {'model_name': 'SimpleImputer', 'strategy': 'most_frequent'}. Best is trial 7 with value: 2.1614446043307978.
                                                                                    Best trial: 7. Best value: 2.16144:  38%|███▊      | 75/200 [00:28<00:36,  3.41it/s]Best trial: 7. Best value: 2.16144:  38%|███▊      | 75/200 [00:28<00:36,  3.41it/s]Best trial: 7. Best value: 2.16144:  38%|███▊      | 76/200 [00:28<00:33,  3.70it/s][I 2023-11-21 17:10:42,254] Trial 82 finished with value: 2.1614446043307978 and parameters: {'model_name': 'SimpleImputer', 'strategy': 'most_frequent'}. Best is trial 7 with value: 2.1614446043307978.
                                                                                    Best trial: 7. Best value: 2.16144:  38%|███▊      | 76/200 [00:29<00:33,  3.70it/s]Best trial: 7. Best value: 2.16144:  38%|███▊      | 76/200 [00:29<00:33,  3.70it/s]Best trial: 7. Best value: 2.16144:  38%|███▊      | 77/200 [00:29<00:52,  2.32it/s][I 2023-11-21 17:10:42,507] Trial 73 finished with value: 2.1614446043307978 and parameters: {'model_name': 'SimpleImputer', 'strategy': 'most_frequent'}. Best is trial 7 with value: 2.1614446043307978.
                                                                                    Best trial: 7. Best value: 2.16144:  38%|███▊      | 77/200 [00:29<00:52,  2.32it/s]Best trial: 7. Best value: 2.16144:  38%|███▊      | 77/200 [00:29<00:52,  2.32it/s]Best trial: 7. Best value: 2.16144:  39%|███▉      | 78/200 [00:29<00:46,  2.60it/s][I 2023-11-21 17:10:42,773] Trial 72 finished with value: 2.1614446043307978 and parameters: {'model_name': 'SimpleImputer', 'strategy': 'most_frequent'}. Best is trial 7 with value: 2.1614446043307978.
                                                                                    Best trial: 7. Best value: 2.16144:  39%|███▉      | 78/200 [00:29<00:46,  2.60it/s]Best trial: 7. Best value: 2.16144:  39%|███▉      | 78/200 [00:30<00:46,  2.60it/s]Best trial: 7. Best value: 2.16144:  40%|███▉      | 79/200 [00:30<00:41,  2.94it/s][I 2023-11-21 17:10:43,166] Trial 78 finished with value: 2.1614446043307978 and parameters: {'model_name': 'SimpleImputer', 'strategy': 'most_frequent'}. Best is trial 7 with value: 2.1614446043307978.
                                                                                    Best trial: 7. Best value: 2.16144:  40%|███▉      | 79/200 [00:30<00:41,  2.94it/s]Best trial: 7. Best value: 2.16144:  40%|███▉      | 79/200 [00:30<00:41,  2.94it/s]Best trial: 7. Best value: 2.16144:  40%|████      | 80/200 [00:30<00:42,  2.80it/s][I 2023-11-21 17:10:43,374] Trial 75 finished with value: 2.1614446043307978 and parameters: {'model_name': 'SimpleImputer', 'strategy': 'most_frequent'}. Best is trial 7 with value: 2.1614446043307978.
                                                                                    Best trial: 7. Best value: 2.16144:  40%|████      | 80/200 [00:30<00:42,  2.80it/s]Best trial: 7. Best value: 2.16144:  40%|████      | 80/200 [00:30<00:42,  2.80it/s]Best trial: 7. Best value: 2.16144:  40%|████      | 81/200 [00:30<00:37,  3.16it/s][I 2023-11-21 17:10:43,619] Trial 65 finished with value: 2.1614446043307978 and parameters: {'model_name': 'SimpleImputer', 'strategy': 'most_frequent'}. Best is trial 7 with value: 2.1614446043307978.
                                                                                    Best trial: 7. Best value: 2.16144:  40%|████      | 81/200 [00:30<00:37,  3.16it/s]Best trial: 7. Best value: 2.16144:  40%|████      | 81/200 [00:31<00:37,  3.16it/s]Best trial: 7. Best value: 2.16144:  41%|████      | 82/200 [00:31<00:34,  3.38it/s][I 2023-11-21 17:10:43,854] Trial 80 finished with value: 2.1614446043307978 and parameters: {'model_name': 'SimpleImputer', 'strategy': 'most_frequent'}. Best is trial 7 with value: 2.1614446043307978.
                                                                                    Best trial: 7. Best value: 2.16144:  41%|████      | 82/200 [00:31<00:34,  3.38it/s]Best trial: 7. Best value: 2.16144:  41%|████      | 82/200 [00:31<00:34,  3.38it/s]Best trial: 7. Best value: 2.16144:  42%|████▏     | 83/200 [00:31<00:33,  3.49it/s][I 2023-11-21 17:10:44,251] Trial 83 finished with value: 2.1614446043307978 and parameters: {'model_name': 'SimpleImputer', 'strategy': 'most_frequent'}. Best is trial 7 with value: 2.1614446043307978.
