                                                                                   Best trial: 4. Best value: 2.17575:   1%|          | 2/200 [00:02<03:00,  1.10it/s]Best trial: 4. Best value: 2.17575:   1%|          | 2/200 [00:02<03:00,  1.10it/s]Best trial: 4. Best value: 2.17575:   2%|▏         | 3/200 [00:02<02:27,  1.34it/s][I 2023-11-21 17:10:15,515] Trial 8 finished with value: 2.175751596440891 and parameters: {'model_name': 'SimpleImputer', 'strategy': 'mean'}. Best is trial 4 with value: 2.175751596440891.
                                                                                   Best trial: 4. Best value: 2.17575:   2%|▏         | 3/200 [00:02<02:27,  1.34it/s]Best trial: 4. Best value: 2.17575:   2%|▏         | 3/200 [00:02<02:27,  1.34it/s]Best trial: 4. Best value: 2.17575:   2%|▏         | 4/200 [00:02<01:49,  1.79it/s][I 2023-11-21 17:10:15,789] Trial 10 finished with value: 2.175751596440891 and parameters: {'model_name': 'SimpleImputer', 'strategy': 'mean'}. Best is trial 4 with value: 2.175751596440891.
                                                                                   Best trial: 4. Best value: 2.17575:   2%|▏         | 4/200 [00:02<01:49,  1.79it/s]Best trial: 4. Best value: 2.17575:   2%|▏         | 4/200 [00:03<01:49,  1.79it/s]Best trial: 4. Best value: 2.17575:   2%|▎         | 5/200 [00:03<01:28,  2.20it/s][I 2023-11-21 17:10:16,084] Trial 17 finished with value: 2.175751596440891 and parameters: {'model_name': 'SimpleImputer', 'strategy': 'mean'}. Best is trial 4 with value: 2.175751596440891.
                                                                                   Best trial: 4. Best value: 2.17575:   2%|▎         | 5/200 [00:03<01:28,  2.20it/s]Best trial: 4. Best value: 2.17575:   2%|▎         | 5/200 [00:03<01:28,  2.20it/s]Best trial: 4. Best value: 2.17575:   3%|▎         | 6/200 [00:03<01:18,  2.47it/s][I 2023-11-21 17:10:16,349] Trial 14 finished with value: 2.175751596440891 and parameters: {'model_name': 'SimpleImputer', 'strategy': 'mean'}. Best is trial 4 with value: 2.175751596440891.
                                                                                   Best trial: 4. Best value: 2.17575:   3%|▎         | 6/200 [00:03<01:18,  2.47it/s]Best trial: 4. Best value: 2.17575:   3%|▎         | 6/200 [00:03<01:18,  2.47it/s]Best trial: 4. Best value: 2.17575:   4%|▎         | 7/200 [00:03<01:07,  2.86it/s][I 2023-11-21 17:10:16,786] Trial 20 finished with value: 2.175751596440891 and parameters: {'model_name': 'SimpleImputer', 'strategy': 'mean'}. Best is trial 4 with value: 2.175751596440891.
                                                                                   Best trial: 4. Best value: 2.17575:   4%|▎         | 7/200 [00:03<01:07,  2.86it/s]                                                                                   [I 2023-11-21 17:10:16,972] Trial 27 finished with value: 6.079391227877255 and parameters: {'model_name': 'SimpleImputer', 'strategy': 'constant'}. Best is trial 4 with value: 2.175751596440891.
Best trial: 4. Best value: 2.17575:   4%|▎         | 7/200 [00:04<01:07,  2.86it/s]Best trial: 4. Best value: 2.17575:   4%|▎         | 7/200 [00:04<01:07,  2.86it/s]Best trial: 4. Best value: 2.17575:   4%|▍         | 8/200 [00:04<01:21,  2.36it/s]Best trial: 4. Best value: 2.17575:   4%|▍         | 8/200 [00:04<01:21,  2.36it/s][I 2023-11-21 17:10:17,234] Trial 22 finished with value: 6.079391227877255 and parameters: {'model_name': 'SimpleImputer', 'strategy': 'constant'}. Best is trial 4 with value: 2.175751596440891.
                                                                                   Best trial: 4. Best value: 2.17575:   4%|▍         | 9/200 [00:04<01:20,  2.36it/s]Best trial: 4. Best value: 2.17575:   4%|▍         | 9/200 [00:04<01:20,  2.36it/s]Best trial: 4. Best value: 2.17575:   5%|▌         | 10/200 [00:04<00:56,  3.35it/s][I 2023-11-21 17:10:17,621] Trial 19 finished with value: 2.175751596440891 and parameters: {'model_name': 'SimpleImputer', 'strategy': 'mean'}. Best is trial 4 with value: 2.175751596440891.
                                                                                    Best trial: 4. Best value: 2.17575:   5%|▌         | 10/200 [00:04<00:56,  3.35it/s]Best trial: 4. Best value: 2.17575:   5%|▌         | 10/200 [00:05<00:56,  3.35it/s]Best trial: 4. Best value: 2.17575:   6%|▌         | 11/200 [00:05<01:00,  3.12it/s][I 2023-11-21 17:10:17,871] Trial 32 finished with value: 6.079391227877255 and parameters: {'model_name': 'SimpleImputer', 'strategy': 'constant'}. Best is trial 4 with value: 2.175751596440891.
                                                                                    Best trial: 4. Best value: 2.17575:   6%|▌         | 11/200 [00:05<01:00,  3.12it/s]Best trial: 4. Best value: 2.17575:   6%|▌         | 11/200 [00:05<01:00,  3.12it/s]Best trial: 4. Best value: 2.17575:   6%|▌         | 12/200 [00:05<00:55,  3.41it/s]                                                                                    [I 2023-11-21 17:10:18,066] Trial 39 finished with value: 6.079391227877255 and parameters: {'model_name': 'SimpleImputer', 'strategy': 'constant'}. Best is trial 4 with value: 2.175751596440891.
Best trial: 4. Best value: 2.17575:   6%|▌         | 12/200 [00:05<00:55,  3.41it/s]Best trial: 4. Best value: 2.17575:   6%|▌         | 12/200 [00:05<00:55,  3.41it/s]Best trial: 4. Best value: 2.17575:   6%|▋         | 13/200 [00:05<00:53,  3.49it/s][I 2023-11-21 17:10:18,097] Trial 25 finished with value: 2.175751596440891 and parameters: {'model_name': 'SimpleImputer', 'strategy': 'mean'}. Best is trial 4 with value: 2.175751596440891.
                                                                                    Best trial: 4. Best value: 2.17575:   6%|▋         | 13/200 [00:05<00:53,  3.49it/s]Best trial: 4. Best value: 2.17575:   6%|▋         | 13/200 [00:05<00:53,  3.49it/s]Best trial: 4. Best value: 2.17575:   7%|▋         | 14/200 [00:05<00:48,  3.85it/s][I 2023-11-21 17:10:18,667] Trial 23 finished with value: 2.175751596440891 and parameters: {'model_name': 'SimpleImputer', 'strategy': 'mean'}. Best is trial 4 with value: 2.175751596440891.
                                                                                    Best trial: 4. Best value: 2.17575:   7%|▋         | 14/200 [00:05<00:48,  3.85it/s]Best trial: 4. Best value: 2.17575:   7%|▋         | 14/200 [00:06<00:48,  3.85it/s]Best trial: 4. Best value: 2.17575:   8%|▊         | 15/200 [00:06<00:54,  3.39it/s][I 2023-11-21 17:10:18,932] Trial 16 finished with value: 2.175751596440891 and parameters: {'model_name': 'SimpleImputer', 'strategy': 'mean'}. Best is trial 4 with value: 2.175751596440891.
                                                                                    Best trial: 4. Best value: 2.17575:   8%|▊         | 15/200 [00:06<00:54,  3.39it/s]Best trial: 4. Best value: 2.17575:   8%|▊         | 15/200 [00:06<00:54,  3.39it/s]Best trial: 4. Best value: 2.17575:   8%|▊         | 16/200 [00:06<00:53,  3.43it/s][I 2023-11-21 17:10:19,325] Trial 24 finished with value: 2.175751596440891 and parameters: {'model_name': 'SimpleImputer', 'strategy': 'mean'}. Best is trial 4 with value: 2.175751596440891.
                                                                                    Best trial: 4. Best value: 2.17575:   8%|▊         | 16/200 [00:06<00:53,  3.43it/s][I 2023-11-21 17:10:19,525] Trial 37 finished with value: 6.079391227877255 and parameters: {'model_name': 'SimpleImputer', 'strategy': 'constant'}. Best is trial 4 with value: 2.175751596440891.
                                                                                    Best trial: 4. Best value: 2.17575:   8%|▊         | 16/200 [00:06<00:53,  3.43it/s]Best trial: 4. Best value: 2.17575:   8%|▊         | 16/200 [00:06<00:53,  3.43it/s]Best trial: 4. Best value: 2.17575:   8%|▊         | 17/200 [00:06<01:05,  2.81it/s]Best trial: 4. Best value: 2.17575:   8%|▊         | 17/200 [00:06<01:05,  2.81it/s][I 2023-11-21 17:10:19,793] Trial 35 finished with value: 2.175751596440891 and parameters: {'model_name': 'SimpleImputer', 'strategy': 'mean'}. Best is trial 4 with value: 2.175751596440891.
                                                                                    Best trial: 4. Best value: 2.17575:   9%|▉         | 18/200 [00:06<01:04,  2.81it/s]Best trial: 4. Best value: 2.17575:   9%|▉         | 18/200 [00:07<01:04,  2.81it/s]Best trial: 4. Best value: 2.17575:  10%|▉         | 19/200 [00:07<00:47,  3.79it/s][I 2023-11-21 17:10:20,038] Trial 41 finished with value: 6.079391227877255 and parameters: {'model_name': 'SimpleImputer', 'strategy': 'constant'}. Best is trial 4 with value: 2.175751596440891.
                                                                                    Best trial: 4. Best value: 2.17575:  10%|▉         | 19/200 [00:07<00:47,  3.79it/s]Best trial: 4. Best value: 2.17575:  10%|▉         | 19/200 [00:07<00:47,  3.79it/s]Best trial: 4. Best value: 2.17575:  10%|█         | 20/200 [00:07<00:46,  3.90it/s][I 2023-11-21 17:10:20,340] Trial 3 finished with value: 2.190195188535638 and parameters: {'model_name': 'SimpleImputer', 'strategy': 'median'}. Best is trial 4 with value: 2.175751596440891.
                                                                                    Best trial: 4. Best value: 2.17575:  10%|█         | 20/200 [00:07<00:46,  3.90it/s]Best trial: 4. Best value: 2.17575:  10%|█         | 20/200 [00:07<00:46,  3.90it/s]Best trial: 4. Best value: 2.17575:  10%|█         | 21/200 [00:07<00:48,  3.66it/s][I 2023-11-21 17:10:20,626] Trial 45 finished with value: 6.079391227877255 and parameters: {'model_name': 'SimpleImputer', 'strategy': 'constant'}. Best is trial 4 with value: 2.175751596440891.
                                                                                    Best trial: 4. Best value: 2.17575:  10%|█         | 21/200 [00:07<00:48,  3.66it/s]Best trial: 4. Best value: 2.17575:  10%|█         | 21/200 [00:08<00:48,  3.66it/s]Best trial: 4. Best value: 2.17575:  11%|█         | 22/200 [00:08<00:50,  3.50it/s][I 2023-11-21 17:10:20,896] Trial 5 finished with value: 2.190195188535638 and parameters: {'model_name': 'SimpleImputer', 'strategy': 'median'}. Best is trial 4 with value: 2.175751596440891.
                                                                                    Best trial: 4. Best value: 2.17575:  11%|█         | 22/200 [00:08<00:50,  3.50it/s]Best trial: 4. Best value: 2.17575:  11%|█         | 22/200 [00:08<00:50,  3.50it/s]Best trial: 4. Best value: 2.17575:  12%|█▏        | 23/200 [00:08<00:45,  3.89it/s][I 2023-11-21 17:10:21,110] Trial 31 finished with value: 2.175751596440891 and parameters: {'model_name': 'SimpleImputer', 'strategy': 'mean'}. Best is trial 4 with value: 2.175751596440891.
                                                                                    Best trial: 4. Best value: 2.17575:  12%|█▏        | 23/200 [00:08<00:45,  3.89it/s]Best trial: 4. Best value: 2.17575:  12%|█▏        | 23/200 [00:08<00:45,  3.89it/s]Best trial: 4. Best value: 2.17575:  12%|█▏        | 24/200 [00:08<00:42,  4.12it/s][I 2023-11-21 17:10:21,577] Trial 47 finished with value: 2.175751596440891 and parameters: {'model_name': 'SimpleImputer', 'strategy': 'mean'}. Best is trial 4 with value: 2.175751596440891.
                                                                                    Best trial: 4. Best value: 2.17575:  12%|█▏        | 24/200 [00:08<00:42,  4.12it/s]Best trial: 4. Best value: 2.17575:  12%|█▏        | 24/200 [00:09<00:42,  4.12it/s]Best trial: 4. Best value: 2.17575:  12%|█▎        | 25/200 [00:09<00:58,  3.02it/s][I 2023-11-21 17:10:21,896] Trial 48 finished with value: 6.079391227877255 and parameters: {'model_name': 'SimpleImputer', 'strategy': 'constant'}. Best is trial 4 with value: 2.175751596440891.
                                                                                    Best trial: 4. Best value: 2.17575:  12%|█▎        | 25/200 [00:09<00:58,  3.02it/s]Best trial: 4. Best value: 2.17575:  12%|█▎        | 25/200 [00:09<00:58,  3.02it/s]Best trial: 4. Best value: 2.17575:  13%|█▎        | 26/200 [00:09<00:56,  3.08it/s]                                                                                    [I 2023-11-21 17:10:22,146] Trial 43 finished with value: 2.175751596440891 and parameters: {'model_name': 'SimpleImputer', 'strategy': 'mean'}. Best is trial 4 with value: 2.175751596440891.
Best trial: 4. Best value: 2.17575:  13%|█▎        | 26/200 [00:09<00:56,  3.08it/s]Best trial: 4. Best value: 2.17575:  13%|█▎        | 26/200 [00:09<00:56,  3.08it/s]Best trial: 4. Best value: 2.17575:  14%|█▎        | 27/200 [00:09<00:51,  3.38it/s][I 2023-11-21 17:10:22,432] Trial 18 finished with value: 2.190195188535638 and parameters: {'model_name': 'SimpleImputer', 'strategy': 'median'}. Best is trial 4 with value: 2.175751596440891.
                                                                                    Best trial: 4. Best value: 2.17575:  14%|█▎        | 27/200 [00:09<00:51,  3.38it/s][I 2023-11-21 17:10:22,690] Trial 15 finished with value: 2.190195188535638 and parameters: {'model_name': 'SimpleImputer', 'strategy': 'median'}. Best is trial 4 with value: 2.175751596440891.
                                                                                    Best trial: 4. Best value: 2.17575:  14%|█▎        | 27/200 [00:09<00:51,  3.38it/s]Best trial: 4. Best value: 2.17575:  14%|█▎        | 27/200 [00:10<00:51,  3.38it/s]Best trial: 4. Best value: 2.17575:  14%|█▍        | 28/200 [00:10<01:00,  2.86it/s]Best trial: 4. Best value: 2.17575:  14%|█▍        | 28/200 [00:10<01:00,  2.86it/s][I 2023-11-21 17:10:23,003] Trial 40 finished with value: 2.175751596440891 and parameters: {'model_name': 'SimpleImputer', 'strategy': 'mean'}. Best is trial 4 with value: 2.175751596440891.
                                                                                    Best trial: 4. Best value: 2.17575:  14%|█▍        | 29/200 [00:10<00:59,  2.86it/s]Best trial: 4. Best value: 2.17575:  14%|█▍        | 29/200 [00:10<00:59,  2.86it/s]Best trial: 4. Best value: 2.17575:  15%|█▌        | 30/200 [00:10<00:48,  3.52it/s][I 2023-11-21 17:10:23,288] Trial 21 finished with value: 2.190195188535638 and parameters: {'model_name': 'SimpleImputer', 'strategy': 'median'}. Best is trial 4 with value: 2.175751596440891.
                                                                                    Best trial: 4. Best value: 2.17575:  15%|█▌        | 30/200 [00:10<00:48,  3.52it/s]Best trial: 4. Best value: 2.17575:  15%|█▌        | 30/200 [00:10<00:48,  3.52it/s]Best trial: 4. Best value: 2.17575:  16%|█▌        | 31/200 [00:10<00:44,  3.81it/s][I 2023-11-21 17:10:23,481] Trial 26 finished with value: 2.190195188535638 and parameters: {'model_name': 'SimpleImputer', 'strategy': 'median'}. Best is trial 4 with value: 2.175751596440891.
                                                                                    Best trial: 4. Best value: 2.17575:  16%|█▌        | 31/200 [00:10<00:44,  3.81it/s]Best trial: 4. Best value: 2.17575:  16%|█▌        | 31/200 [00:10<00:44,  3.81it/s]Best trial: 4. Best value: 2.17575:  16%|█▌        | 32/200 [00:10<00:44,  3.80it/s][I 2023-11-21 17:10:23,787] Trial 54 finished with value: 6.079391227877255 and parameters: {'model_name': 'SimpleImputer', 'strategy': 'constant'}. Best is trial 4 with value: 2.175751596440891.
                                                                                    Best trial: 4. Best value: 2.17575:  16%|█▌        | 32/200 [00:10<00:44,  3.80it/s]Best trial: 4. Best value: 2.17575:  16%|█▌        | 32/200 [00:11<00:44,  3.80it/s]Best trial: 4. Best value: 2.17575:  16%|█▋        | 33/200 [00:11<00:47,  3.52it/s][I 2023-11-21 17:10:24,150] Trial 28 finished with value: 2.190195188535638 and parameters: {'model_name': 'SimpleImputer', 'strategy': 'median'}. Best is trial 4 with value: 2.175751596440891.
                                                                                    Best trial: 4. Best value: 2.17575:  16%|█▋        | 33/200 [00:11<00:47,  3.52it/s][I 2023-11-21 17:10:24,395] Trial 33 finished with value: 2.190195188535638 and parameters: {'model_name': 'SimpleImputer', 'strategy': 'median'}. Best is trial 4 with value: 2.175751596440891.
                                                                                    Best trial: 4. Best value: 2.17575:  16%|█▋        | 33/200 [00:11<00:47,  3.52it/s]Best trial: 4. Best value: 2.17575:  16%|█▋        | 33/200 [00:11<00:47,  3.52it/s]Best trial: 4. Best value: 2.17575:  17%|█▋        | 34/200 [00:11<00:58,  2.84it/s]                                                                                    [I 2023-11-21 17:10:24,397] Trial 53 finished with value: 2.175751596440891 and parameters: {'model_name': 'SimpleImputer', 'strategy': 'mean'}. Best is trial 4 with value: 2.175751596440891.
Best trial: 4. Best value: 2.17575:  17%|█▋        | 34/200 [00:11<00:58,  2.84it/s]Best trial: 4. Best value: 2.17575:  17%|█▋        | 34/200 [00:12<00:58,  2.84it/s]Best trial: 4. Best value: 2.17575:  18%|█▊        | 35/200 [00:12<00:55,  2.98it/s]Best trial: 4. Best value: 2.17575:  18%|█▊        | 35/200 [00:12<00:55,  2.98it/s][I 2023-11-21 17:10:24,885] Trial 50 finished with value: 6.079391227877255 and parameters: {'model_name': 'SimpleImputer', 'strategy': 'constant'}. Best is trial 4 with value: 2.175751596440891.
                                                                                    Best trial: 4. Best value: 2.17575:  18%|█▊        | 36/200 [00:12<00:55,  2.98it/s]Best trial: 4. Best value: 2.17575:  18%|█▊        | 36/200 [00:12<00:55,  2.98it/s]Best trial: 4. Best value: 2.17575:  18%|█▊        | 37/200 [00:12<00:37,  4.39it/s][I 2023-11-21 17:10:25,257] Trial 34 finished with value: 2.190195188535638 and parameters: {'model_name': 'SimpleImputer', 'strategy': 'median'}. Best is trial 4 with value: 2.175751596440891.
                                                                                    Best trial: 4. Best value: 2.17575:  18%|█▊        | 37/200 [00:12<00:37,  4.39it/s]Best trial: 4. Best value: 2.17575:  18%|█▊        | 37/200 [00:12<00:37,  4.39it/s]Best trial: 4. Best value: 2.17575:  19%|█▉        | 38/200 [00:12<00:46,  3.47it/s][I 2023-11-21 17:10:26,021] Trial 44 finished with value: 2.190195188535638 and parameters: {'model_name': 'SimpleImputer', 'strategy': 'median'}. Best is trial 4 with value: 2.175751596440891.
                                                                                    Best trial: 4. Best value: 2.17575:  19%|█▉        | 38/200 [00:13<00:46,  3.47it/s]Best trial: 4. Best value: 2.17575:  19%|█▉        | 38/200 [00:13<00:46,  3.47it/s]Best trial: 4. Best value: 2.17575:  20%|█▉        | 39/200 [00:13<01:02,  2.58it/s][I 2023-11-21 17:10:26,909] Trial 51 finished with value: 2.190195188535638 and parameters: {'model_name': 'SimpleImputer', 'strategy': 'median'}. Best is trial 4 with value: 2.175751596440891.
                                                                                    Best trial: 4. Best value: 2.17575:  20%|█▉        | 39/200 [00:14<01:02,  2.58it/s]Best trial: 4. Best value: 2.17575:  20%|█▉        | 39/200 [00:14<01:02,  2.58it/s]Best trial: 4. Best value: 2.17575:  20%|██        | 40/200 [00:14<01:26,  1.84it/s][I 2023-11-21 17:10:27,509] Trial 52 finished with value: 2.190195188535638 and parameters: {'model_name': 'SimpleImputer', 'strategy': 'median'}. Best is trial 4 with value: 2.175751596440891.
                                                                                    Best trial: 4. Best value: 2.17575:  20%|██        | 40/200 [00:14<01:26,  1.84it/s]Best trial: 4. Best value: 2.17575:  20%|██        | 40/200 [00:14<01:26,  1.84it/s]Best trial: 4. Best value: 2.17575:  20%|██        | 41/200 [00:14<01:27,  1.81it/s][I 2023-11-21 17:10:27,905] Trial 59 finished with value: 2.190195188535638 and parameters: {'model_name': 'SimpleImputer', 'strategy': 'median'}. Best is trial 4 with value: 2.175751596440891.
                                                                                    Best trial: 4. Best value: 2.17575:  20%|██        | 41/200 [00:15<01:27,  1.81it/s]Best trial: 4. Best value: 2.17575:  20%|██        | 41/200 [00:15<01:27,  1.81it/s]Best trial: 4. Best value: 2.17575:  21%|██        | 42/200 [00:15<01:18,  2.02it/s][I 2023-11-21 17:10:28,203] Trial 60 finished with value: 2.190195188535638 and parameters: {'model_name': 'SimpleImputer', 'strategy': 'median'}. Best is trial 4 with value: 2.175751596440891.
                                                                                    Best trial: 4. Best value: 2.17575:  21%|██        | 42/200 [00:15<01:18,  2.02it/s]Best trial: 4. Best value: 2.17575:  21%|██        | 42/200 [00:15<01:18,  2.02it/s]Best trial: 4. Best value: 2.17575:  22%|██▏       | 43/200 [00:15<01:09,  2.25it/s][I 2023-11-21 17:10:28,532] Trial 55 finished with value: 2.190195188535638 and parameters: {'model_name': 'SimpleImputer', 'strategy': 'median'}. Best is trial 4 with value: 2.175751596440891.
