                                                                                     Best trial: 7. Best value: 2.16144:  82%|████████▏ | 163/200 [01:01<00:15,  2.32it/s]Best trial: 7. Best value: 2.16144:  82%|████████▏ | 163/200 [01:01<00:15,  2.32it/s]Best trial: 7. Best value: 2.16144:  82%|████████▏ | 164/200 [01:01<00:15,  2.35it/s][I 2023-11-21 17:11:14,708] Trial 152 finished with value: 2.1614446043307978 and parameters: {'model_name': 'SimpleImputer', 'strategy': 'most_frequent'}. Best is trial 7 with value: 2.1614446043307978.
                                                                                     Best trial: 7. Best value: 2.16144:  82%|████████▏ | 164/200 [01:01<00:15,  2.35it/s]Best trial: 7. Best value: 2.16144:  82%|████████▏ | 164/200 [01:02<00:15,  2.35it/s]Best trial: 7. Best value: 2.16144:  82%|████████▎ | 165/200 [01:02<00:13,  2.50it/s][I 2023-11-21 17:11:15,173] Trial 150 finished with value: 2.1614446043307978 and parameters: {'model_name': 'SimpleImputer', 'strategy': 'most_frequent'}. Best is trial 7 with value: 2.1614446043307978.
                                                                                     Best trial: 7. Best value: 2.16144:  82%|████████▎ | 165/200 [01:02<00:13,  2.50it/s]Best trial: 7. Best value: 2.16144:  82%|████████▎ | 165/200 [01:02<00:13,  2.50it/s]Best trial: 7. Best value: 2.16144:  83%|████████▎ | 166/200 [01:02<00:13,  2.48it/s][I 2023-11-21 17:11:15,527] Trial 154 finished with value: 2.1614446043307978 and parameters: {'model_name': 'SimpleImputer', 'strategy': 'most_frequent'}. Best is trial 7 with value: 2.1614446043307978.
                                                                                     Best trial: 7. Best value: 2.16144:  83%|████████▎ | 166/200 [01:02<00:13,  2.48it/s]Best trial: 7. Best value: 2.16144:  83%|████████▎ | 166/200 [01:02<00:13,  2.48it/s]Best trial: 7. Best value: 2.16144:  84%|████████▎ | 167/200 [01:02<00:12,  2.63it/s][I 2023-11-21 17:11:16,109] Trial 159 finished with value: 2.1614446043307978 and parameters: {'model_name': 'SimpleImputer', 'strategy': 'most_frequent'}. Best is trial 7 with value: 2.1614446043307978.
                                                                                     Best trial: 7. Best value: 2.16144:  84%|████████▎ | 167/200 [01:03<00:12,  2.63it/s]Best trial: 7. Best value: 2.16144:  84%|████████▎ | 167/200 [01:03<00:12,  2.63it/s]Best trial: 7. Best value: 2.16144:  84%|████████▍ | 168/200 [01:03<00:14,  2.24it/s][I 2023-11-21 17:11:16,404] Trial 155 finished with value: 2.1614446043307978 and parameters: {'model_name': 'SimpleImputer', 'strategy': 'most_frequent'}. Best is trial 7 with value: 2.1614446043307978.
                                                                                     Best trial: 7. Best value: 2.16144:  84%|████████▍ | 168/200 [01:03<00:14,  2.24it/s]Best trial: 7. Best value: 2.16144:  84%|████████▍ | 168/200 [01:03<00:14,  2.24it/s]Best trial: 7. Best value: 2.16144:  84%|████████▍ | 169/200 [01:03<00:12,  2.52it/s][I 2023-11-21 17:11:16,834] Trial 160 finished with value: 2.1614446043307978 and parameters: {'model_name': 'SimpleImputer', 'strategy': 'most_frequent'}. Best is trial 7 with value: 2.1614446043307978.
                                                                                     Best trial: 7. Best value: 2.16144:  84%|████████▍ | 169/200 [01:04<00:12,  2.52it/s]Best trial: 7. Best value: 2.16144:  84%|████████▍ | 169/200 [01:04<00:12,  2.52it/s]Best trial: 7. Best value: 2.16144:  85%|████████▌ | 170/200 [01:04<00:12,  2.41it/s]                                                                                     [I 2023-11-21 17:11:17,107] Trial 161 finished with value: 2.1614446043307978 and parameters: {'model_name': 'SimpleImputer', 'strategy': 'most_frequent'}. Best is trial 7 with value: 2.1614446043307978.
Best trial: 7. Best value: 2.16144:  85%|████████▌ | 170/200 [01:04<00:12,  2.41it/s]Best trial: 7. Best value: 2.16144:  85%|████████▌ | 170/200 [01:04<00:12,  2.41it/s]Best trial: 7. Best value: 2.16144:  86%|████████▌ | 171/200 [01:04<00:10,  2.72it/s][I 2023-11-21 17:11:17,656] Trial 153 finished with value: 2.1614446043307978 and parameters: {'model_name': 'SimpleImputer', 'strategy': 'most_frequent'}. Best is trial 7 with value: 2.1614446043307978.
                                                                                     Best trial: 7. Best value: 2.16144:  86%|████████▌ | 171/200 [01:04<00:10,  2.72it/s]Best trial: 7. Best value: 2.16144:  86%|████████▌ | 171/200 [01:05<00:10,  2.72it/s]Best trial: 7. Best value: 2.16144:  86%|████████▌ | 172/200 [01:05<00:11,  2.39it/s][I 2023-11-21 17:11:18,060] Trial 156 finished with value: 2.1614446043307978 and parameters: {'model_name': 'SimpleImputer', 'strategy': 'most_frequent'}. Best is trial 7 with value: 2.1614446043307978.
                                                                                     Best trial: 7. Best value: 2.16144:  86%|████████▌ | 172/200 [01:05<00:11,  2.39it/s]Best trial: 7. Best value: 2.16144:  86%|████████▌ | 172/200 [01:05<00:11,  2.39it/s]Best trial: 7. Best value: 2.16144:  86%|████████▋ | 173/200 [01:05<00:11,  2.41it/s][I 2023-11-21 17:11:18,382] Trial 157 finished with value: 2.1614446043307978 and parameters: {'model_name': 'SimpleImputer', 'strategy': 'most_frequent'}. Best is trial 7 with value: 2.1614446043307978.
                                                                                     Best trial: 7. Best value: 2.16144:  86%|████████▋ | 173/200 [01:05<00:11,  2.41it/s][I 2023-11-21 17:11:18,607] Trial 177 finished with value: 2.1614446043307978 and parameters: {'model_name': 'SimpleImputer', 'strategy': 'most_frequent'}. Best is trial 7 with value: 2.1614446043307978.
                                                                                     Best trial: 7. Best value: 2.16144:  86%|████████▋ | 173/200 [01:05<00:11,  2.41it/s]Best trial: 7. Best value: 2.16144:  86%|████████▋ | 173/200 [01:05<00:11,  2.41it/s]Best trial: 7. Best value: 2.16144:  87%|████████▋ | 174/200 [01:05<00:11,  2.19it/s]Best trial: 7. Best value: 2.16144:  87%|████████▋ | 174/200 [01:05<00:11,  2.19it/s][I 2023-11-21 17:11:19,018] Trial 158 finished with value: 2.1614446043307978 and parameters: {'model_name': 'SimpleImputer', 'strategy': 'most_frequent'}. Best is trial 7 with value: 2.1614446043307978.
                                                                                     Best trial: 7. Best value: 2.16144:  88%|████████▊ | 175/200 [01:06<00:11,  2.19it/s]Best trial: 7. Best value: 2.16144:  88%|████████▊ | 175/200 [01:06<00:11,  2.19it/s]Best trial: 7. Best value: 2.16144:  88%|████████▊ | 176/200 [01:06<00:08,  2.96it/s][I 2023-11-21 17:11:19,225] Trial 162 finished with value: 2.1614446043307978 and parameters: {'model_name': 'SimpleImputer', 'strategy': 'most_frequent'}. Best is trial 7 with value: 2.1614446043307978.
                                                                                     Best trial: 7. Best value: 2.16144:  88%|████████▊ | 176/200 [01:06<00:08,  2.96it/s]Best trial: 7. Best value: 2.16144:  88%|████████▊ | 176/200 [01:06<00:08,  2.96it/s]Best trial: 7. Best value: 2.16144:  88%|████████▊ | 177/200 [01:06<00:07,  3.27it/s]                                                                                     [I 2023-11-21 17:11:19,912] Trial 175 finished with value: 2.1614446043307978 and parameters: {'model_name': 'SimpleImputer', 'strategy': 'most_frequent'}. Best is trial 7 with value: 2.1614446043307978.
Best trial: 7. Best value: 2.16144:  88%|████████▊ | 177/200 [01:07<00:07,  3.27it/s][I 2023-11-21 17:11:20,125] Trial 179 finished with value: 2.1614446043307978 and parameters: {'model_name': 'SimpleImputer', 'strategy': 'most_frequent'}. Best is trial 7 with value: 2.1614446043307978.
                                                                                     Best trial: 7. Best value: 2.16144:  88%|████████▊ | 177/200 [01:07<00:07,  3.27it/s]Best trial: 7. Best value: 2.16144:  88%|████████▊ | 177/200 [01:07<00:07,  3.27it/s]Best trial: 7. Best value: 2.16144:  89%|████████▉ | 178/200 [01:07<00:10,  2.17it/s]Best trial: 7. Best value: 2.16144:  89%|████████▉ | 178/200 [01:07<00:10,  2.17it/s][I 2023-11-21 17:11:20,409] Trial 184 finished with value: 2.1614446043307978 and parameters: {'model_name': 'SimpleImputer', 'strategy': 'most_frequent'}. Best is trial 7 with value: 2.1614446043307978.
                                                                                     Best trial: 7. Best value: 2.16144:  90%|████████▉ | 179/200 [01:07<00:09,  2.17it/s]Best trial: 7. Best value: 2.16144:  90%|████████▉ | 179/200 [01:07<00:09,  2.17it/s]Best trial: 7. Best value: 2.16144:  90%|█████████ | 180/200 [01:07<00:06,  3.06it/s][I 2023-11-21 17:11:20,667] Trial 169 finished with value: 2.1614446043307978 and parameters: {'model_name': 'SimpleImputer', 'strategy': 'most_frequent'}. Best is trial 7 with value: 2.1614446043307978.
                                                                                     Best trial: 7. Best value: 2.16144:  90%|█████████ | 180/200 [01:07<00:06,  3.06it/s]Best trial: 7. Best value: 2.16144:  90%|█████████ | 180/200 [01:08<00:06,  3.06it/s]Best trial: 7. Best value: 2.16144:  90%|█████████ | 181/200 [01:08<00:05,  3.24it/s]                                                                                     [I 2023-11-21 17:11:20,871] Trial 182 finished with value: 2.1614446043307978 and parameters: {'model_name': 'SimpleImputer', 'strategy': 'most_frequent'}. Best is trial 7 with value: 2.1614446043307978.
Best trial: 7. Best value: 2.16144:  90%|█████████ | 181/200 [01:08<00:05,  3.24it/s]Best trial: 7. Best value: 2.16144:  90%|█████████ | 181/200 [01:08<00:05,  3.24it/s]Best trial: 7. Best value: 2.16144:  91%|█████████ | 182/200 [01:08<00:05,  3.46it/s]                                                                                     [I 2023-11-21 17:11:21,168] Trial 188 finished with value: 2.1614446043307978 and parameters: {'model_name': 'SimpleImputer', 'strategy': 'most_frequent'}. Best is trial 7 with value: 2.1614446043307978.
Best trial: 7. Best value: 2.16144:  91%|█████████ | 182/200 [01:08<00:05,  3.46it/s]Best trial: 7. Best value: 2.16144:  91%|█████████ | 182/200 [01:08<00:05,  3.46it/s]Best trial: 7. Best value: 2.16144:  92%|█████████▏| 183/200 [01:08<00:04,  3.52it/s][I 2023-11-21 17:11:21,457] Trial 183 finished with value: 2.1614446043307978 and parameters: {'model_name': 'SimpleImputer', 'strategy': 'most_frequent'}. Best is trial 7 with value: 2.1614446043307978.
                                                                                     Best trial: 7. Best value: 2.16144:  92%|█████████▏| 183/200 [01:08<00:04,  3.52it/s]Best trial: 7. Best value: 2.16144:  92%|█████████▏| 183/200 [01:08<00:04,  3.52it/s]Best trial: 7. Best value: 2.16144:  92%|█████████▏| 184/200 [01:08<00:04,  3.47it/s][I 2023-11-21 17:11:21,710] Trial 194 finished with value: 2.1614446043307978 and parameters: {'model_name': 'SimpleImputer', 'strategy': 'most_frequent'}. Best is trial 7 with value: 2.1614446043307978.
                                                                                     Best trial: 7. Best value: 2.16144:  92%|█████████▏| 184/200 [01:08<00:04,  3.47it/s]Best trial: 7. Best value: 2.16144:  92%|█████████▏| 184/200 [01:09<00:04,  3.47it/s]Best trial: 7. Best value: 2.16144:  92%|█████████▎| 185/200 [01:09<00:04,  3.60it/s][I 2023-11-21 17:11:22,044] Trial 181 finished with value: 2.1614446043307978 and parameters: {'model_name': 'SimpleImputer', 'strategy': 'most_frequent'}. Best is trial 7 with value: 2.1614446043307978.
                                                                                     Best trial: 7. Best value: 2.16144:  92%|█████████▎| 185/200 [01:09<00:04,  3.60it/s]Best trial: 7. Best value: 2.16144:  92%|█████████▎| 185/200 [01:09<00:04,  3.60it/s]Best trial: 7. Best value: 2.16144:  93%|█████████▎| 186/200 [01:09<00:04,  3.41it/s][I 2023-11-21 17:11:22,302] Trial 187 finished with value: 2.1614446043307978 and parameters: {'model_name': 'SimpleImputer', 'strategy': 'most_frequent'}. Best is trial 7 with value: 2.1614446043307978.
                                                                                     Best trial: 7. Best value: 2.16144:  93%|█████████▎| 186/200 [01:09<00:04,  3.41it/s]Best trial: 7. Best value: 2.16144:  93%|█████████▎| 186/200 [01:09<00:04,  3.41it/s]Best trial: 7. Best value: 2.16144:  94%|█████████▎| 187/200 [01:09<00:03,  3.49it/s][I 2023-11-21 17:11:22,532] Trial 180 finished with value: 2.1614446043307978 and parameters: {'model_name': 'SimpleImputer', 'strategy': 'most_frequent'}. Best is trial 7 with value: 2.1614446043307978.
                                                                                     Best trial: 7. Best value: 2.16144:  94%|█████████▎| 187/200 [01:09<00:03,  3.49it/s]Best trial: 7. Best value: 2.16144:  94%|█████████▎| 187/200 [01:09<00:03,  3.49it/s]Best trial: 7. Best value: 2.16144:  94%|█████████▍| 188/200 [01:09<00:03,  3.84it/s][I 2023-11-21 17:11:22,726] Trial 185 finished with value: 2.1614446043307978 and parameters: {'model_name': 'SimpleImputer', 'strategy': 'most_frequent'}. Best is trial 7 with value: 2.1614446043307978.
                                                                                     Best trial: 7. Best value: 2.16144:  94%|█████████▍| 188/200 [01:09<00:03,  3.84it/s]Best trial: 7. Best value: 2.16144:  94%|█████████▍| 188/200 [01:10<00:03,  3.84it/s]Best trial: 7. Best value: 2.16144:  94%|█████████▍| 189/200 [01:10<00:02,  3.93it/s][I 2023-11-21 17:11:22,981] Trial 197 finished with value: 2.1614446043307978 and parameters: {'model_name': 'SimpleImputer', 'strategy': 'most_frequent'}. Best is trial 7 with value: 2.1614446043307978.
                                                                                     Best trial: 7. Best value: 2.16144:  94%|█████████▍| 189/200 [01:10<00:02,  3.93it/s]Best trial: 7. Best value: 2.16144:  94%|█████████▍| 189/200 [01:10<00:02,  3.93it/s]Best trial: 7. Best value: 2.16144:  95%|█████████▌| 190/200 [01:10<00:02,  4.04it/s][I 2023-11-21 17:11:23,259] Trial 189 finished with value: 2.1614446043307978 and parameters: {'model_name': 'SimpleImputer', 'strategy': 'most_frequent'}. Best is trial 7 with value: 2.1614446043307978.
                                                                                     Best trial: 7. Best value: 2.16144:  95%|█████████▌| 190/200 [01:10<00:02,  4.04it/s]Best trial: 7. Best value: 2.16144:  95%|█████████▌| 190/200 [01:10<00:02,  4.04it/s]Best trial: 7. Best value: 2.16144:  96%|█████████▌| 191/200 [01:10<00:02,  3.77it/s][I 2023-11-21 17:11:23,521] Trial 192 finished with value: 2.1614446043307978 and parameters: {'model_name': 'SimpleImputer', 'strategy': 'most_frequent'}. Best is trial 7 with value: 2.1614446043307978.
                                                                                     Best trial: 7. Best value: 2.16144:  96%|█████████▌| 191/200 [01:10<00:02,  3.77it/s]Best trial: 7. Best value: 2.16144:  96%|█████████▌| 191/200 [01:10<00:02,  3.77it/s]Best trial: 7. Best value: 2.16144:  96%|█████████▌| 192/200 [01:10<00:02,  3.99it/s][I 2023-11-21 17:11:23,728] Trial 191 finished with value: 2.1614446043307978 and parameters: {'model_name': 'SimpleImputer', 'strategy': 'most_frequent'}. Best is trial 7 with value: 2.1614446043307978.
                                                                                     Best trial: 7. Best value: 2.16144:  96%|█████████▌| 192/200 [01:10<00:02,  3.99it/s]Best trial: 7. Best value: 2.16144:  96%|█████████▌| 192/200 [01:11<00:02,  3.99it/s]Best trial: 7. Best value: 2.16144:  96%|█████████▋| 193/200 [01:11<00:01,  4.09it/s][I 2023-11-21 17:11:23,729] Trial 186 finished with value: 2.1614446043307978 and parameters: {'model_name': 'SimpleImputer', 'strategy': 'most_frequent'}. Best is trial 7 with value: 2.1614446043307978.
                                                                                     Best trial: 7. Best value: 2.16144:  96%|█████████▋| 193/200 [01:11<00:01,  4.09it/s]                                                                                     [I 2023-11-21 17:11:24,150] Trial 198 finished with value: 2.1614446043307978 and parameters: {'model_name': 'SimpleImputer', 'strategy': 'most_frequent'}. Best is trial 7 with value: 2.1614446043307978.
Best trial: 7. Best value: 2.16144:  96%|█████████▋| 193/200 [01:11<00:01,  4.09it/s]Best trial: 7. Best value: 2.16144:  96%|█████████▋| 193/200 [01:11<00:01,  4.09it/s]Best trial: 7. Best value: 2.16144:  97%|█████████▋| 194/200 [01:11<00:01,  3.42it/s]Best trial: 7. Best value: 2.16144:  97%|█████████▋| 194/200 [01:11<00:01,  3.42it/s]                                                                                     [I 2023-11-21 17:11:24,373] Trial 193 finished with value: 2.1614446043307978 and parameters: {'model_name': 'SimpleImputer', 'strategy': 'most_frequent'}. Best is trial 7 with value: 2.1614446043307978.
Best trial: 7. Best value: 2.16144:  98%|█████████▊| 195/200 [01:11<00:01,  3.42it/s]Best trial: 7. Best value: 2.16144:  98%|█████████▊| 195/200 [01:11<00:01,  3.42it/s]Best trial: 7. Best value: 2.16144:  98%|█████████▊| 196/200 [01:11<00:00,  4.69it/s][I 2023-11-21 17:11:24,612] Trial 190 finished with value: 2.1614446043307978 and parameters: {'model_name': 'SimpleImputer', 'strategy': 'most_frequent'}. Best is trial 7 with value: 2.1614446043307978.
                                                                                     Best trial: 7. Best value: 2.16144:  98%|█████████▊| 196/200 [01:11<00:00,  4.69it/s]Best trial: 7. Best value: 2.16144:  98%|█████████▊| 196/200 [01:11<00:00,  4.69it/s]Best trial: 7. Best value: 2.16144:  98%|█████████▊| 197/200 [01:11<00:00,  4.66it/s][I 2023-11-21 17:11:24,820] Trial 196 finished with value: 2.1614446043307978 and parameters: {'model_name': 'SimpleImputer', 'strategy': 'most_frequent'}. Best is trial 7 with value: 2.1614446043307978.
                                                                                     Best trial: 7. Best value: 2.16144:  98%|█████████▊| 197/200 [01:11<00:00,  4.66it/s]Best trial: 7. Best value: 2.16144:  98%|█████████▊| 197/200 [01:12<00:00,  4.66it/s]Best trial: 7. Best value: 2.16144:  99%|█████████▉| 198/200 [01:12<00:00,  4.59it/s][I 2023-11-21 17:11:25,040] Trial 195 finished with value: 2.1614446043307978 and parameters: {'model_name': 'SimpleImputer', 'strategy': 'most_frequent'}. Best is trial 7 with value: 2.1614446043307978.
