[I 2023-11-21 09:55:11,980] Trial 8 finished with value: inf and parameters: {'model_name': 'IterativeImputer', 'estimator': 'KNN', 'sample_posterior': True, 'initial_strategy': 'constant', 'imputation_order': 'random'}. Best is trial 2 with value: inf.
[I 2023-11-21 09:55:12,236] Trial 1 finished with value: inf and parameters: {'model_name': 'IterativeImputer', 'estimator': 'Ridge', 'sample_posterior': True, 'initial_strategy': 'constant', 'imputation_order': 'arabic'}. Best is trial 2 with value: inf.
[I 2023-11-21 09:55:12,617] Trial 14 finished with value: inf and parameters: {'model_name': 'GAIN', 'batch_size': 367, 'hint_rate': 0.2914711771038763, 'alpha': 17, 'iterations': 14068}. Best is trial 2 with value: inf.
[I 2023-11-21 09:55:12,938] Trial 19 finished with value: inf and parameters: {'model_name': 'KNNImputer', 'weights': 'distance', 'keep_empty_features': True}. Best is trial 2 with value: inf.
[I 2023-11-21 09:55:12,940] Trial 16 finished with value: inf and parameters: {'model_name': 'GAIN', 'batch_size': 2, 'hint_rate': 0.009269504030980173, 'alpha': 20, 'iterations': 340}. Best is trial 2 with value: inf.
[I 2023-11-21 09:55:13,713] Trial 25 finished with value: inf and parameters: {'model_name': 'KNNImputer', 'weights': 'distance', 'keep_empty_features': False}. Best is trial 2 with value: inf.
[I 2023-11-21 09:55:14,035] Trial 27 finished with value: inf and parameters: {'model_name': 'GAIN', 'batch_size': 1, 'hint_rate': 0.1899875929519025, 'alpha': 35, 'iterations': 78}. Best is trial 2 with value: inf.
[I 2023-11-21 09:55:14,336] Trial 23 finished with value: inf and parameters: {'model_name': 'GAIN', 'batch_size': 34, 'hint_rate': 0.057253975650922447, 'alpha': 28, 'iterations': 1977}. Best is trial 2 with value: inf.
[I 2023-11-21 09:55:15,179] Trial 11 finished with value: 6.598155936791512 and parameters: {'model_name': 'SimpleImputer', 'strategy': 'constant'}. Best is trial 11 with value: 6.598155936791512.
[I 2023-11-21 09:55:16,335] Trial 31 finished with value: 6.598155936791512 and parameters: {'model_name': 'SimpleImputer', 'strategy': 'constant'}. Best is trial 11 with value: 6.598155936791512.
[I 2023-11-21 09:55:17,008] Trial 17 finished with value: 2.3116467514175336 and parameters: {'model_name': 'SimpleImputer', 'strategy': 'mean'}. Best is trial 17 with value: 2.3116467514175336.
[I 2023-11-21 09:55:17,425] Trial 35 finished with value: 6.598155936791512 and parameters: {'model_name': 'SimpleImputer', 'strategy': 'constant'}. Best is trial 17 with value: 2.3116467514175336.
[I 2023-11-21 09:55:18,251] Trial 36 finished with value: 6.598155936791512 and parameters: {'model_name': 'SimpleImputer', 'strategy': 'constant'}. Best is trial 17 with value: 2.3116467514175336.
[I 2023-11-21 09:55:18,915] Trial 32 finished with value: 2.3116467514175336 and parameters: {'model_name': 'SimpleImputer', 'strategy': 'mean'}. Best is trial 17 with value: 2.3116467514175336.
[I 2023-11-21 09:55:19,182] Trial 22 finished with value: 2.3116467514175336 and parameters: {'model_name': 'SimpleImputer', 'strategy': 'mean'}. Best is trial 17 with value: 2.3116467514175336.
[I 2023-11-21 09:55:19,722] Trial 28 finished with value: 2.3116467514175336 and parameters: {'model_name': 'SimpleImputer', 'strategy': 'mean'}. Best is trial 17 with value: 2.3116467514175336.
[I 2023-11-21 09:55:19,767] Trial 18 finished with value: 2.355581371804523 and parameters: {'model_name': 'SimpleImputer', 'strategy': 'median'}. Best is trial 17 with value: 2.3116467514175336.
[I 2023-11-21 09:55:20,238] Trial 59 finished with value: 6.598155936791512 and parameters: {'model_name': 'SimpleImputer', 'strategy': 'constant'}. Best is trial 17 with value: 2.3116467514175336.
[I 2023-11-21 09:55:20,825] Trial 45 finished with value: 2.3116467514175336 and parameters: {'model_name': 'SimpleImputer', 'strategy': 'mean'}. Best is trial 17 with value: 2.3116467514175336.
[I 2023-11-21 09:55:21,183] Trial 54 finished with value: 6.598155936791512 and parameters: {'model_name': 'SimpleImputer', 'strategy': 'constant'}. Best is trial 17 with value: 2.3116467514175336.
[I 2023-11-21 09:55:21,490] Trial 41 finished with value: 2.3116467514175336 and parameters: {'model_name': 'SimpleImputer', 'strategy': 'mean'}. Best is trial 17 with value: 2.3116467514175336.
[I 2023-11-21 09:55:21,931] Trial 58 finished with value: 6.598155936791512 and parameters: {'model_name': 'SimpleImputer', 'strategy': 'constant'}. Best is trial 17 with value: 2.3116467514175336.
[I 2023-11-21 09:55:22,210] Trial 64 finished with value: 6.598155936791512 and parameters: {'model_name': 'SimpleImputer', 'strategy': 'constant'}. Best is trial 17 with value: 2.3116467514175336.
[I 2023-11-21 09:55:22,470] Trial 55 finished with value: 6.598155936791512 and parameters: {'model_name': 'SimpleImputer', 'strategy': 'constant'}. Best is trial 17 with value: 2.3116467514175336.
[I 2023-11-21 09:55:22,767] Trial 52 finished with value: 2.3116467514175336 and parameters: {'model_name': 'SimpleImputer', 'strategy': 'mean'}. Best is trial 17 with value: 2.3116467514175336.
[I 2023-11-21 09:55:22,776] Trial 51 finished with value: 6.598155936791512 and parameters: {'model_name': 'SimpleImputer', 'strategy': 'constant'}. Best is trial 17 with value: 2.3116467514175336.
[I 2023-11-21 09:55:23,238] Trial 43 finished with value: 2.3116467514175336 and parameters: {'model_name': 'SimpleImputer', 'strategy': 'mean'}. Best is trial 17 with value: 2.3116467514175336.
[I 2023-11-21 09:55:23,489] Trial 29 finished with value: 2.355581371804523 and parameters: {'model_name': 'SimpleImputer', 'strategy': 'median'}. Best is trial 17 with value: 2.3116467514175336.
[I 2023-11-21 09:55:24,007] Trial 26 finished with value: 2.355581371804523 and parameters: {'model_name': 'SimpleImputer', 'strategy': 'median'}. Best is trial 17 with value: 2.3116467514175336.
[I 2023-11-21 09:55:24,438] Trial 37 finished with value: 2.355581371804523 and parameters: {'model_name': 'SimpleImputer', 'strategy': 'median'}. Best is trial 17 with value: 2.3116467514175336.
[I 2023-11-21 09:55:24,970] Trial 65 finished with value: 6.598155936791512 and parameters: {'model_name': 'SimpleImputer', 'strategy': 'constant'}. Best is trial 17 with value: 2.3116467514175336.
[I 2023-11-21 09:55:25,495] Trial 34 finished with value: 2.355581371804523 and parameters: {'model_name': 'SimpleImputer', 'strategy': 'median'}. Best is trial 17 with value: 2.3116467514175336.
[I 2023-11-21 09:55:26,003] Trial 42 finished with value: 2.355581371804523 and parameters: {'model_name': 'SimpleImputer', 'strategy': 'median'}. Best is trial 17 with value: 2.3116467514175336.
[I 2023-11-21 09:55:26,721] Trial 66 finished with value: 2.3116467514175336 and parameters: {'model_name': 'SimpleImputer', 'strategy': 'mean'}. Best is trial 17 with value: 2.3116467514175336.
[I 2023-11-21 09:55:27,149] Trial 47 finished with value: 2.355581371804523 and parameters: {'model_name': 'SimpleImputer', 'strategy': 'median'}. Best is trial 17 with value: 2.3116467514175336.
[I 2023-11-21 09:55:27,677] Trial 68 finished with value: 2.3116467514175336 and parameters: {'model_name': 'SimpleImputer', 'strategy': 'mean'}. Best is trial 17 with value: 2.3116467514175336.
[I 2023-11-21 09:55:28,084] Trial 69 finished with value: 2.3116467514175336 and parameters: {'model_name': 'SimpleImputer', 'strategy': 'mean'}. Best is trial 17 with value: 2.3116467514175336.
[I 2023-11-21 09:55:28,350] Trial 67 finished with value: 2.3116467514175336 and parameters: {'model_name': 'SimpleImputer', 'strategy': 'mean'}. Best is trial 17 with value: 2.3116467514175336.
[I 2023-11-21 09:55:28,714] Trial 71 finished with value: 2.3116467514175336 and parameters: {'model_name': 'SimpleImputer', 'strategy': 'mean'}. Best is trial 17 with value: 2.3116467514175336.
[I 2023-11-21 09:55:28,960] Trial 73 finished with value: 2.3116467514175336 and parameters: {'model_name': 'SimpleImputer', 'strategy': 'mean'}. Best is trial 17 with value: 2.3116467514175336.
[I 2023-11-21 09:55:29,359] Trial 72 finished with value: 2.3116467514175336 and parameters: {'model_name': 'SimpleImputer', 'strategy': 'mean'}. Best is trial 17 with value: 2.3116467514175336.
[I 2023-11-21 09:55:29,656] Trial 70 finished with value: 2.3116467514175336 and parameters: {'model_name': 'SimpleImputer', 'strategy': 'mean'}. Best is trial 17 with value: 2.3116467514175336.
[I 2023-11-21 09:55:29,914] Trial 77 finished with value: 2.3116467514175336 and parameters: {'model_name': 'SimpleImputer', 'strategy': 'mean'}. Best is trial 17 with value: 2.3116467514175336.
[I 2023-11-21 09:55:30,246] Trial 74 finished with value: 2.3116467514175336 and parameters: {'model_name': 'SimpleImputer', 'strategy': 'mean'}. Best is trial 17 with value: 2.3116467514175336.
[I 2023-11-21 09:55:30,593] Trial 78 finished with value: 2.3116467514175336 and parameters: {'model_name': 'SimpleImputer', 'strategy': 'mean'}. Best is trial 17 with value: 2.3116467514175336.
[I 2023-11-21 09:55:30,922] Trial 96 finished with value: inf and parameters: {'model_name': 'KNNImputer', 'weights': 'uniform', 'keep_empty_features': False}. Best is trial 17 with value: 2.3116467514175336.
[I 2023-11-21 09:55:31,554] Trial 100 finished with value: inf and parameters: {'model_name': 'KNNImputer', 'weights': 'uniform', 'keep_empty_features': False}. Best is trial 17 with value: 2.3116467514175336.
[I 2023-11-21 09:55:32,214] Trial 85 finished with value: 2.3116467514175336 and parameters: {'model_name': 'SimpleImputer', 'strategy': 'mean'}. Best is trial 17 with value: 2.3116467514175336.
[I 2023-11-21 09:55:33,080] Trial 89 finished with value: 2.3116467514175336 and parameters: {'model_name': 'SimpleImputer', 'strategy': 'mean'}. Best is trial 17 with value: 2.3116467514175336.
[I 2023-11-21 09:55:34,300] Trial 24 finished with value: 2.466338903037594 and parameters: {'model_name': 'SimpleImputer', 'strategy': 'most_frequent'}. Best is trial 17 with value: 2.3116467514175336.
[I 2023-11-21 09:55:35,306] Trial 30 finished with value: 2.466338903037594 and parameters: {'model_name': 'SimpleImputer', 'strategy': 'most_frequent'}. Best is trial 17 with value: 2.3116467514175336.
[I 2023-11-21 09:55:35,804] Trial 39 finished with value: 2.466338903037594 and parameters: {'model_name': 'SimpleImputer', 'strategy': 'most_frequent'}. Best is trial 17 with value: 2.3116467514175336.
[I 2023-11-21 09:55:36,069] Trial 44 finished with value: 2.466338903037594 and parameters: {'model_name': 'SimpleImputer', 'strategy': 'most_frequent'}. Best is trial 17 with value: 2.3116467514175336.
[I 2023-11-21 09:55:36,547] Trial 48 finished with value: 2.466338903037594 and parameters: {'model_name': 'SimpleImputer', 'strategy': 'most_frequent'}. Best is trial 17 with value: 2.3116467514175336.
[I 2023-11-21 09:55:36,797] Trial 46 finished with value: 2.466338903037594 and parameters: {'model_name': 'SimpleImputer', 'strategy': 'most_frequent'}. Best is trial 17 with value: 2.3116467514175336.
[I 2023-11-21 09:55:37,077] Trial 60 finished with value: 2.466338903037594 and parameters: {'model_name': 'SimpleImputer', 'strategy': 'most_frequent'}. Best is trial 17 with value: 2.3116467514175336.
[I 2023-11-21 09:55:37,426] Trial 56 finished with value: 2.466338903037594 and parameters: {'model_name': 'SimpleImputer', 'strategy': 'most_frequent'}. Best is trial 17 with value: 2.3116467514175336.
[I 2023-11-21 09:55:37,700] Trial 62 finished with value: 2.466338903037594 and parameters: {'model_name': 'SimpleImputer', 'strategy': 'most_frequent'}. Best is trial 17 with value: 2.3116467514175336.
[I 2023-11-21 09:55:37,937] Trial 109 finished with value: inf and parameters: {'model_name': 'GAIN', 'batch_size': 6, 'hint_rate': 0.0010594545336676073, 'alpha': 95, 'iterations': 28875}. Best is trial 17 with value: 2.3116467514175336.
[I 2023-11-21 09:55:38,290] Trial 63 finished with value: 2.466338903037594 and parameters: {'model_name': 'SimpleImputer', 'strategy': 'most_frequent'}. Best is trial 17 with value: 2.3116467514175336.
[I 2023-11-21 09:55:38,647] Trial 53 finished with value: 2.466338903037594 and parameters: {'model_name': 'SimpleImputer', 'strategy': 'most_frequent'}. Best is trial 17 with value: 2.3116467514175336.
[I 2023-11-21 09:55:38,938] Trial 61 finished with value: 2.466338903037594 and parameters: {'model_name': 'SimpleImputer', 'strategy': 'most_frequent'}. Best is trial 17 with value: 2.3116467514175336.
[I 2023-11-21 09:55:39,232] Trial 33 finished with value: 2.466338903037594 and parameters: {'model_name': 'SimpleImputer', 'strategy': 'most_frequent'}. Best is trial 17 with value: 2.3116467514175336.
[I 2023-11-21 09:55:39,481] Trial 49 finished with value: 2.466338903037594 and parameters: {'model_name': 'SimpleImputer', 'strategy': 'most_frequent'}. Best is trial 17 with value: 2.3116467514175336.
[I 2023-11-21 09:55:39,814] Trial 40 finished with value: 2.466338903037594 and parameters: {'model_name': 'SimpleImputer', 'strategy': 'most_frequent'}. Best is trial 17 with value: 2.3116467514175336.
[I 2023-11-21 09:55:40,065] Trial 38 finished with value: 2.466338903037594 and parameters: {'model_name': 'SimpleImputer', 'strategy': 'most_frequent'}. Best is trial 17 with value: 2.3116467514175336.
[I 2023-11-21 09:55:40,362] Trial 57 finished with value: 2.466338903037594 and parameters: {'model_name': 'SimpleImputer', 'strategy': 'most_frequent'}. Best is trial 17 with value: 2.3116467514175336.
[I 2023-11-21 09:55:41,122] Trial 118 finished with value: inf and parameters: {'model_name': 'GAIN', 'batch_size': 9, 'hint_rate': 0.5463601846967305, 'alpha': 68, 'iterations': 73094}. Best is trial 17 with value: 2.3116467514175336.
[I 2023-11-21 09:55:41,421] Trial 117 finished with value: inf and parameters: {'model_name': 'GAIN', 'batch_size': 8, 'hint_rate': 0.7970237515574612, 'alpha': 72, 'iterations': 95036}. Best is trial 17 with value: 2.3116467514175336.
[I 2023-11-21 09:55:41,919] Trial 50 finished with value: 2.466338903037594 and parameters: {'model_name': 'SimpleImputer', 'strategy': 'most_frequent'}. Best is trial 17 with value: 2.3116467514175336.
[I 2023-11-21 09:55:43,270] Trial 81 finished with value: 2.466338903037594 and parameters: {'model_name': 'SimpleImputer', 'strategy': 'most_frequent'}. Best is trial 17 with value: 2.3116467514175336.
[I 2023-11-21 09:55:48,558] Trial 21 finished with value: inf and parameters: {'model_name': 'IterativeImputer', 'estimator': 'RFR', 'sample_posterior': True, 'initial_strategy': 'mean', 'imputation_order': 'arabic'}. Best is trial 17 with value: 2.3116467514175336.
[I 2023-11-21 09:55:48,861] Trial 127 finished with value: inf and parameters: {'model_name': 'KNNImputer', 'weights': 'uniform', 'keep_empty_features': True}. Best is trial 17 with value: 2.3116467514175336.
[I 2023-11-21 09:57:04,374] Trial 20 finished with value: 2.356927855993877 and parameters: {'model_name': 'IterativeImputer', 'estimator': 'Bayesian', 'sample_posterior': False, 'initial_strategy': 'median', 'imputation_order': 'ascending'}. Best is trial 17 with value: 2.3116467514175336.
[I 2023-11-21 09:57:05,266] Trial 79 finished with value: 2.356927855993877 and parameters: {'model_name': 'IterativeImputer', 'estimator': 'Bayesian', 'sample_posterior': False, 'initial_strategy': 'median', 'imputation_order': 'ascending'}. Best is trial 17 with value: 2.3116467514175336.
[I 2023-11-21 09:57:06,851] Trial 83 finished with value: 2.294988702700148 and parameters: {'model_name': 'IterativeImputer', 'estimator': 'Bayesian', 'sample_posterior': False, 'initial_strategy': 'mean', 'imputation_order': 'roman'}. Best is trial 83 with value: 2.294988702700148.
[I 2023-11-21 09:57:07,806] Trial 130 finished with value: 2.3116467514175336 and parameters: {'model_name': 'SimpleImputer', 'strategy': 'mean'}. Best is trial 83 with value: 2.294988702700148.
[I 2023-11-21 09:57:11,268] Trial 105 finished with value: 2.339943147658576 and parameters: {'model_name': 'IterativeImputer', 'estimator': 'Bayesian', 'sample_posterior': False, 'initial_strategy': 'median', 'imputation_order': 'roman'}. Best is trial 83 with value: 2.294988702700148.
[I 2023-11-21 09:57:11,552] Trial 107 finished with value: 2.339943147658576 and parameters: {'model_name': 'IterativeImputer', 'estimator': 'Bayesian', 'sample_posterior': False, 'initial_strategy': 'median', 'imputation_order': 'roman'}. Best is trial 83 with value: 2.294988702700148.
[I 2023-11-21 09:57:11,993] Trial 122 finished with value: 2.339943147658576 and parameters: {'model_name': 'IterativeImputer', 'estimator': 'Bayesian', 'sample_posterior': False, 'initial_strategy': 'median', 'imputation_order': 'roman'}. Best is trial 83 with value: 2.294988702700148.
[I 2023-11-21 09:57:12,616] Trial 93 finished with value: 2.4258647033405283 and parameters: {'model_name': 'IterativeImputer', 'estimator': 'Bayesian', 'sample_posterior': False, 'initial_strategy': 'most_frequent', 'imputation_order': 'roman'}. Best is trial 83 with value: 2.294988702700148.
[I 2023-11-21 09:57:12,822] Trial 112 finished with value: 2.294988702700148 and parameters: {'model_name': 'IterativeImputer', 'estimator': 'Bayesian', 'sample_posterior': False, 'initial_strategy': 'mean', 'imputation_order': 'roman'}. Best is trial 83 with value: 2.294988702700148.
[I 2023-11-21 09:57:14,805] Trial 103 finished with value: 2.4258647033405283 and parameters: {'model_name': 'IterativeImputer', 'estimator': 'Bayesian', 'sample_posterior': False, 'initial_strategy': 'most_frequent', 'imputation_order': 'roman'}. Best is trial 83 with value: 2.294988702700148.
[I 2023-11-21 09:57:15,429] Trial 110 finished with value: 2.339943147658576 and parameters: {'model_name': 'IterativeImputer', 'estimator': 'Bayesian', 'sample_posterior': False, 'initial_strategy': 'median', 'imputation_order': 'roman'}. Best is trial 83 with value: 2.294988702700148.
[I 2023-11-21 09:57:17,024] Trial 101 finished with value: 2.4258647033405283 and parameters: {'model_name': 'IterativeImputer', 'estimator': 'Bayesian', 'sample_posterior': False, 'initial_strategy': 'most_frequent', 'imputation_order': 'roman'}. Best is trial 83 with value: 2.294988702700148.
[I 2023-11-21 09:57:17,435] Trial 120 finished with value: 2.339943147658576 and parameters: {'model_name': 'IterativeImputer', 'estimator': 'Bayesian', 'sample_posterior': False, 'initial_strategy': 'median', 'imputation_order': 'roman'}. Best is trial 83 with value: 2.294988702700148.
[I 2023-11-21 09:57:17,723] Trial 87 finished with value: 2.4258647033405283 and parameters: {'model_name': 'IterativeImputer', 'estimator': 'Bayesian', 'sample_posterior': False, 'initial_strategy': 'most_frequent', 'imputation_order': 'roman'}. Best is trial 83 with value: 2.294988702700148.
[I 2023-11-21 09:57:18,159] Trial 114 finished with value: 2.4258647033405283 and parameters: {'model_name': 'IterativeImputer', 'estimator': 'Bayesian', 'sample_posterior': False, 'initial_strategy': 'most_frequent', 'imputation_order': 'roman'}. Best is trial 83 with value: 2.294988702700148.
[I 2023-11-21 09:57:19,227] Trial 104 finished with value: 2.4258647033405283 and parameters: {'model_name': 'IterativeImputer', 'estimator': 'Bayesian', 'sample_posterior': False, 'initial_strategy': 'most_frequent', 'imputation_order': 'roman'}. Best is trial 83 with value: 2.294988702700148.
[I 2023-11-21 09:57:21,867] Trial 144 finished with value: 2.3116467514175336 and parameters: {'model_name': 'SimpleImputer', 'strategy': 'mean'}. Best is trial 83 with value: 2.294988702700148.
[I 2023-11-21 09:57:24,105] Trial 145 finished with value: 2.3116467514175336 and parameters: {'model_name': 'SimpleImputer', 'strategy': 'mean'}. Best is trial 83 with value: 2.294988702700148.
[I 2023-11-21 09:57:24,644] Trial 146 finished with value: inf and parameters: {'model_name': 'KNNImputer', 'weights': 'uniform', 'keep_empty_features': True}. Best is trial 83 with value: 2.294988702700148.
[I 2023-11-21 09:57:25,531] Trial 128 finished with value: 2.339943147658576 and parameters: {'model_name': 'IterativeImputer', 'estimator': 'Bayesian', 'sample_posterior': False, 'initial_strategy': 'median', 'imputation_order': 'roman'}. Best is trial 83 with value: 2.294988702700148.
[I 2023-11-21 09:57:26,904] Trial 147 finished with value: 2.3116467514175336 and parameters: {'model_name': 'SimpleImputer', 'strategy': 'mean'}. Best is trial 83 with value: 2.294988702700148.
[I 2023-11-21 09:57:27,822] Trial 148 finished with value: 2.3116467514175336 and parameters: {'model_name': 'SimpleImputer', 'strategy': 'mean'}. Best is trial 83 with value: 2.294988702700148.
[I 2023-11-21 09:57:29,176] Trial 149 finished with value: 2.3116467514175336 and parameters: {'model_name': 'SimpleImputer', 'strategy': 'mean'}. Best is trial 83 with value: 2.294988702700148.
[I 2023-11-21 09:57:30,311] Trial 150 finished with value: 2.3116467514175336 and parameters: {'model_name': 'SimpleImputer', 'strategy': 'mean'}. Best is trial 83 with value: 2.294988702700148.
[I 2023-11-21 09:57:31,958] Trial 151 finished with value: 2.3116467514175336 and parameters: {'model_name': 'SimpleImputer', 'strategy': 'mean'}. Best is trial 83 with value: 2.294988702700148.
[I 2023-11-21 09:57:33,479] Trial 152 finished with value: 2.3116467514175336 and parameters: {'model_name': 'SimpleImputer', 'strategy': 'mean'}. Best is trial 83 with value: 2.294988702700148.
[I 2023-11-21 09:57:35,051] Trial 153 finished with value: 2.3116467514175336 and parameters: {'model_name': 'SimpleImputer', 'strategy': 'mean'}. Best is trial 83 with value: 2.294988702700148.
[I 2023-11-21 09:57:35,817] Trial 143 finished with value: inf and parameters: {'model_name': 'IterativeImputer', 'estimator': 'RFR', 'sample_posterior': True, 'initial_strategy': 'mean', 'imputation_order': 'descending'}. Best is trial 83 with value: 2.294988702700148.
