[I 2023-11-21 09:54:48,834] Trial 86 finished with value: 2.68682185611586 and parameters: {'model_name': 'SimpleImputer', 'strategy': 'most_frequent'}. Best is trial 4 with value: 2.3129557692904745.
[I 2023-11-21 09:54:49,053] Trial 115 finished with value: 2.3129557692904745 and parameters: {'model_name': 'SimpleImputer', 'strategy': 'mean'}. Best is trial 4 with value: 2.3129557692904745.
[I 2023-11-21 09:54:49,424] Trial 111 finished with value: 2.3129557692904745 and parameters: {'model_name': 'SimpleImputer', 'strategy': 'mean'}. Best is trial 4 with value: 2.3129557692904745.
[I 2023-11-21 09:54:49,617] Trial 79 finished with value: 2.68682185611586 and parameters: {'model_name': 'SimpleImputer', 'strategy': 'most_frequent'}. Best is trial 4 with value: 2.3129557692904745.
[I 2023-11-21 09:54:49,818] Trial 114 finished with value: 2.3129557692904745 and parameters: {'model_name': 'SimpleImputer', 'strategy': 'mean'}. Best is trial 4 with value: 2.3129557692904745.
[I 2023-11-21 09:54:50,039] Trial 119 finished with value: 2.3129557692904745 and parameters: {'model_name': 'SimpleImputer', 'strategy': 'mean'}. Best is trial 4 with value: 2.3129557692904745.
[I 2023-11-21 09:54:50,272] Trial 90 finished with value: 2.68682185611586 and parameters: {'model_name': 'SimpleImputer', 'strategy': 'most_frequent'}. Best is trial 4 with value: 2.3129557692904745.
[I 2023-11-21 09:54:50,487] Trial 76 finished with value: 2.68682185611586 and parameters: {'model_name': 'SimpleImputer', 'strategy': 'most_frequent'}. Best is trial 4 with value: 2.3129557692904745.
[I 2023-11-21 09:54:50,763] Trial 77 finished with value: 2.68682185611586 and parameters: {'model_name': 'SimpleImputer', 'strategy': 'most_frequent'}. Best is trial 4 with value: 2.3129557692904745.
[I 2023-11-21 09:54:51,005] Trial 120 finished with value: 2.3129557692904745 and parameters: {'model_name': 'SimpleImputer', 'strategy': 'mean'}. Best is trial 4 with value: 2.3129557692904745.
[I 2023-11-21 09:54:51,405] Trial 118 finished with value: 2.3129557692904745 and parameters: {'model_name': 'SimpleImputer', 'strategy': 'mean'}. Best is trial 4 with value: 2.3129557692904745.
[I 2023-11-21 09:54:51,640] Trial 113 finished with value: 2.3129557692904745 and parameters: {'model_name': 'SimpleImputer', 'strategy': 'mean'}. Best is trial 4 with value: 2.3129557692904745.
[I 2023-11-21 09:54:51,837] Trial 128 finished with value: 2.3129557692904745 and parameters: {'model_name': 'SimpleImputer', 'strategy': 'mean'}. Best is trial 4 with value: 2.3129557692904745.
[I 2023-11-21 09:54:52,012] Trial 122 finished with value: 2.3129557692904745 and parameters: {'model_name': 'SimpleImputer', 'strategy': 'mean'}. Best is trial 4 with value: 2.3129557692904745.
[I 2023-11-21 09:54:52,238] Trial 116 finished with value: 2.3129557692904745 and parameters: {'model_name': 'SimpleImputer', 'strategy': 'mean'}. Best is trial 4 with value: 2.3129557692904745.
[I 2023-11-21 09:54:52,458] Trial 117 finished with value: 2.3129557692904745 and parameters: {'model_name': 'SimpleImputer', 'strategy': 'mean'}. Best is trial 4 with value: 2.3129557692904745.
[I 2023-11-21 09:54:52,670] Trial 85 finished with value: 2.68682185611586 and parameters: {'model_name': 'SimpleImputer', 'strategy': 'most_frequent'}. Best is trial 4 with value: 2.3129557692904745.
[I 2023-11-21 09:54:52,888] Trial 81 finished with value: 2.68682185611586 and parameters: {'model_name': 'SimpleImputer', 'strategy': 'most_frequent'}. Best is trial 4 with value: 2.3129557692904745.
[I 2023-11-21 09:54:53,113] Trial 87 finished with value: 2.68682185611586 and parameters: {'model_name': 'SimpleImputer', 'strategy': 'most_frequent'}. Best is trial 4 with value: 2.3129557692904745.
[I 2023-11-21 09:54:53,351] Trial 88 finished with value: 2.68682185611586 and parameters: {'model_name': 'SimpleImputer', 'strategy': 'most_frequent'}. Best is trial 4 with value: 2.3129557692904745.
[I 2023-11-21 09:54:53,601] Trial 84 finished with value: 2.68682185611586 and parameters: {'model_name': 'SimpleImputer', 'strategy': 'most_frequent'}. Best is trial 4 with value: 2.3129557692904745.
[I 2023-11-21 09:54:53,849] Trial 123 finished with value: 2.3129557692904745 and parameters: {'model_name': 'SimpleImputer', 'strategy': 'mean'}. Best is trial 4 with value: 2.3129557692904745.
[I 2023-11-21 09:54:54,114] Trial 126 finished with value: 2.3129557692904745 and parameters: {'model_name': 'SimpleImputer', 'strategy': 'mean'}. Best is trial 4 with value: 2.3129557692904745.
[I 2023-11-21 09:54:54,352] Trial 125 finished with value: 2.3129557692904745 and parameters: {'model_name': 'SimpleImputer', 'strategy': 'mean'}. Best is trial 4 with value: 2.3129557692904745.
[I 2023-11-21 09:54:54,795] Trial 127 finished with value: 2.3129557692904745 and parameters: {'model_name': 'SimpleImputer', 'strategy': 'mean'}. Best is trial 4 with value: 2.3129557692904745.
[I 2023-11-21 09:54:55,002] Trial 121 finished with value: 2.3129557692904745 and parameters: {'model_name': 'SimpleImputer', 'strategy': 'mean'}. Best is trial 4 with value: 2.3129557692904745.
[I 2023-11-21 09:54:55,210] Trial 124 finished with value: 2.3129557692904745 and parameters: {'model_name': 'SimpleImputer', 'strategy': 'mean'}. Best is trial 4 with value: 2.3129557692904745.
[I 2023-11-21 09:54:55,465] Trial 131 finished with value: 2.3129557692904745 and parameters: {'model_name': 'SimpleImputer', 'strategy': 'mean'}. Best is trial 4 with value: 2.3129557692904745.
[I 2023-11-21 09:54:55,750] Trial 129 finished with value: 2.3129557692904745 and parameters: {'model_name': 'SimpleImputer', 'strategy': 'mean'}. Best is trial 4 with value: 2.3129557692904745.
[I 2023-11-21 09:54:56,050] Trial 132 finished with value: 2.3129557692904745 and parameters: {'model_name': 'SimpleImputer', 'strategy': 'mean'}. Best is trial 4 with value: 2.3129557692904745.
[I 2023-11-21 09:54:56,290] Trial 134 finished with value: 2.3129557692904745 and parameters: {'model_name': 'SimpleImputer', 'strategy': 'mean'}. Best is trial 4 with value: 2.3129557692904745.
[I 2023-11-21 09:54:56,658] Trial 130 finished with value: 2.3129557692904745 and parameters: {'model_name': 'SimpleImputer', 'strategy': 'mean'}. Best is trial 4 with value: 2.3129557692904745.
[I 2023-11-21 09:54:56,906] Trial 136 finished with value: 2.3129557692904745 and parameters: {'model_name': 'SimpleImputer', 'strategy': 'mean'}. Best is trial 4 with value: 2.3129557692904745.
[I 2023-11-21 09:54:57,382] Trial 91 finished with value: 2.68682185611586 and parameters: {'model_name': 'SimpleImputer', 'strategy': 'most_frequent'}. Best is trial 4 with value: 2.3129557692904745.
[I 2023-11-21 09:54:57,580] Trial 137 finished with value: 2.3129557692904745 and parameters: {'model_name': 'SimpleImputer', 'strategy': 'mean'}. Best is trial 4 with value: 2.3129557692904745.
[I 2023-11-21 09:54:57,993] Trial 139 finished with value: 2.3129557692904745 and parameters: {'model_name': 'SimpleImputer', 'strategy': 'mean'}. Best is trial 4 with value: 2.3129557692904745.
[I 2023-11-21 09:54:58,190] Trial 133 finished with value: 2.3129557692904745 and parameters: {'model_name': 'SimpleImputer', 'strategy': 'mean'}. Best is trial 4 with value: 2.3129557692904745.
[I 2023-11-21 09:54:58,441] Trial 89 finished with value: 2.68682185611586 and parameters: {'model_name': 'SimpleImputer', 'strategy': 'most_frequent'}. Best is trial 4 with value: 2.3129557692904745.
[I 2023-11-21 09:54:58,660] Trial 138 finished with value: 2.3129557692904745 and parameters: {'model_name': 'SimpleImputer', 'strategy': 'mean'}. Best is trial 4 with value: 2.3129557692904745.
[I 2023-11-21 09:54:58,882] Trial 135 finished with value: 2.3129557692904745 and parameters: {'model_name': 'SimpleImputer', 'strategy': 'mean'}. Best is trial 4 with value: 2.3129557692904745.
[I 2023-11-21 09:54:59,571] Trial 141 finished with value: 2.3129557692904745 and parameters: {'model_name': 'SimpleImputer', 'strategy': 'mean'}. Best is trial 4 with value: 2.3129557692904745.
[I 2023-11-21 09:54:59,852] Trial 142 finished with value: 2.3129557692904745 and parameters: {'model_name': 'SimpleImputer', 'strategy': 'mean'}. Best is trial 4 with value: 2.3129557692904745.
[I 2023-11-21 09:55:00,113] Trial 144 finished with value: 2.3129557692904745 and parameters: {'model_name': 'SimpleImputer', 'strategy': 'mean'}. Best is trial 4 with value: 2.3129557692904745.
[I 2023-11-21 09:55:00,430] Trial 93 finished with value: 2.68682185611586 and parameters: {'model_name': 'SimpleImputer', 'strategy': 'most_frequent'}. Best is trial 4 with value: 2.3129557692904745.
[I 2023-11-21 09:55:00,672] Trial 146 finished with value: 2.3129557692904745 and parameters: {'model_name': 'SimpleImputer', 'strategy': 'mean'}. Best is trial 4 with value: 2.3129557692904745.
[I 2023-11-21 09:55:00,927] Trial 143 finished with value: 2.3129557692904745 and parameters: {'model_name': 'SimpleImputer', 'strategy': 'mean'}. Best is trial 4 with value: 2.3129557692904745.
[I 2023-11-21 09:55:01,147] Trial 145 finished with value: 2.3129557692904745 and parameters: {'model_name': 'SimpleImputer', 'strategy': 'mean'}. Best is trial 4 with value: 2.3129557692904745.
[I 2023-11-21 09:55:01,392] Trial 92 finished with value: 2.68682185611586 and parameters: {'model_name': 'SimpleImputer', 'strategy': 'most_frequent'}. Best is trial 4 with value: 2.3129557692904745.
[I 2023-11-21 09:55:01,640] Trial 140 finished with value: 2.3129557692904745 and parameters: {'model_name': 'SimpleImputer', 'strategy': 'mean'}. Best is trial 4 with value: 2.3129557692904745.
[I 2023-11-21 09:55:01,957] Trial 156 finished with value: 2.3129557692904745 and parameters: {'model_name': 'SimpleImputer', 'strategy': 'mean'}. Best is trial 4 with value: 2.3129557692904745.
[I 2023-11-21 09:55:02,187] Trial 158 finished with value: 2.3129557692904745 and parameters: {'model_name': 'SimpleImputer', 'strategy': 'mean'}. Best is trial 4 with value: 2.3129557692904745.
[I 2023-11-21 09:55:02,410] Trial 160 finished with value: 2.3129557692904745 and parameters: {'model_name': 'SimpleImputer', 'strategy': 'mean'}. Best is trial 4 with value: 2.3129557692904745.
[I 2023-11-21 09:55:02,640] Trial 153 finished with value: 2.3129557692904745 and parameters: {'model_name': 'SimpleImputer', 'strategy': 'mean'}. Best is trial 4 with value: 2.3129557692904745.
[I 2023-11-21 09:55:03,004] Trial 147 finished with value: 2.3129557692904745 and parameters: {'model_name': 'SimpleImputer', 'strategy': 'mean'}. Best is trial 4 with value: 2.3129557692904745.
[I 2023-11-21 09:55:03,267] Trial 148 finished with value: 2.3129557692904745 and parameters: {'model_name': 'SimpleImputer', 'strategy': 'mean'}. Best is trial 4 with value: 2.3129557692904745.
[I 2023-11-21 09:55:03,459] Trial 161 finished with value: 2.3129557692904745 and parameters: {'model_name': 'SimpleImputer', 'strategy': 'mean'}. Best is trial 4 with value: 2.3129557692904745.
[I 2023-11-21 09:55:03,660] Trial 159 finished with value: 2.3129557692904745 and parameters: {'model_name': 'SimpleImputer', 'strategy': 'mean'}. Best is trial 4 with value: 2.3129557692904745.
[I 2023-11-21 09:55:03,976] Trial 165 finished with value: 2.3129557692904745 and parameters: {'model_name': 'SimpleImputer', 'strategy': 'mean'}. Best is trial 4 with value: 2.3129557692904745.
[I 2023-11-21 09:55:04,241] Trial 150 finished with value: 2.3129557692904745 and parameters: {'model_name': 'SimpleImputer', 'strategy': 'mean'}. Best is trial 4 with value: 2.3129557692904745.
[I 2023-11-21 09:55:04,440] Trial 166 finished with value: 2.3129557692904745 and parameters: {'model_name': 'SimpleImputer', 'strategy': 'mean'}. Best is trial 4 with value: 2.3129557692904745.
[I 2023-11-21 09:55:04,667] Trial 157 finished with value: 2.3129557692904745 and parameters: {'model_name': 'SimpleImputer', 'strategy': 'mean'}. Best is trial 4 with value: 2.3129557692904745.
[I 2023-11-21 09:55:04,917] Trial 152 finished with value: 2.3129557692904745 and parameters: {'model_name': 'SimpleImputer', 'strategy': 'mean'}. Best is trial 4 with value: 2.3129557692904745.
[I 2023-11-21 09:55:05,177] Trial 168 finished with value: 2.3129557692904745 and parameters: {'model_name': 'SimpleImputer', 'strategy': 'mean'}. Best is trial 4 with value: 2.3129557692904745.
[I 2023-11-21 09:55:05,396] Trial 162 finished with value: 2.3129557692904745 and parameters: {'model_name': 'SimpleImputer', 'strategy': 'mean'}. Best is trial 4 with value: 2.3129557692904745.
[I 2023-11-21 09:55:05,602] Trial 155 finished with value: 2.3129557692904745 and parameters: {'model_name': 'SimpleImputer', 'strategy': 'mean'}. Best is trial 4 with value: 2.3129557692904745.
[I 2023-11-21 09:55:05,819] Trial 151 finished with value: 2.3129557692904745 and parameters: {'model_name': 'SimpleImputer', 'strategy': 'mean'}. Best is trial 4 with value: 2.3129557692904745.
[I 2023-11-21 09:55:06,062] Trial 154 finished with value: 2.3129557692904745 and parameters: {'model_name': 'SimpleImputer', 'strategy': 'mean'}. Best is trial 4 with value: 2.3129557692904745.
[I 2023-11-21 09:55:06,307] Trial 149 finished with value: 2.3129557692904745 and parameters: {'model_name': 'SimpleImputer', 'strategy': 'mean'}. Best is trial 4 with value: 2.3129557692904745.
[I 2023-11-21 09:55:06,581] Trial 167 finished with value: 2.3129557692904745 and parameters: {'model_name': 'SimpleImputer', 'strategy': 'mean'}. Best is trial 4 with value: 2.3129557692904745.
[I 2023-11-21 09:55:06,829] Trial 171 finished with value: 2.3129557692904745 and parameters: {'model_name': 'SimpleImputer', 'strategy': 'mean'}. Best is trial 4 with value: 2.3129557692904745.
[I 2023-11-21 09:55:07,029] Trial 175 finished with value: 2.3129557692904745 and parameters: {'model_name': 'SimpleImputer', 'strategy': 'mean'}. Best is trial 4 with value: 2.3129557692904745.
[I 2023-11-21 09:55:07,214] Trial 174 finished with value: 2.3129557692904745 and parameters: {'model_name': 'SimpleImputer', 'strategy': 'mean'}. Best is trial 4 with value: 2.3129557692904745.
[I 2023-11-21 09:55:07,434] Trial 178 finished with value: 2.3129557692904745 and parameters: {'model_name': 'SimpleImputer', 'strategy': 'mean'}. Best is trial 4 with value: 2.3129557692904745.
[I 2023-11-21 09:55:07,657] Trial 164 finished with value: 2.3129557692904745 and parameters: {'model_name': 'SimpleImputer', 'strategy': 'mean'}. Best is trial 4 with value: 2.3129557692904745.
[I 2023-11-21 09:55:07,869] Trial 163 finished with value: 2.3129557692904745 and parameters: {'model_name': 'SimpleImputer', 'strategy': 'mean'}. Best is trial 4 with value: 2.3129557692904745.
[I 2023-11-21 09:55:08,136] Trial 169 finished with value: 2.3129557692904745 and parameters: {'model_name': 'SimpleImputer', 'strategy': 'mean'}. Best is trial 4 with value: 2.3129557692904745.
[I 2023-11-21 09:55:08,359] Trial 184 finished with value: 6.7605067906254686 and parameters: {'model_name': 'SimpleImputer', 'strategy': 'constant'}. Best is trial 4 with value: 2.3129557692904745.
[I 2023-11-21 09:55:08,586] Trial 170 finished with value: 2.3129557692904745 and parameters: {'model_name': 'SimpleImputer', 'strategy': 'mean'}. Best is trial 4 with value: 2.3129557692904745.
[I 2023-11-21 09:55:08,793] Trial 181 finished with value: 6.7605067906254686 and parameters: {'model_name': 'SimpleImputer', 'strategy': 'constant'}. Best is trial 4 with value: 2.3129557692904745.
[I 2023-11-21 09:55:09,026] Trial 180 finished with value: 2.3129557692904745 and parameters: {'model_name': 'SimpleImputer', 'strategy': 'mean'}. Best is trial 4 with value: 2.3129557692904745.
[I 2023-11-21 09:55:09,235] Trial 172 finished with value: 2.3129557692904745 and parameters: {'model_name': 'SimpleImputer', 'strategy': 'mean'}. Best is trial 4 with value: 2.3129557692904745.
[I 2023-11-21 09:55:09,428] Trial 176 finished with value: 2.3129557692904745 and parameters: {'model_name': 'SimpleImputer', 'strategy': 'mean'}. Best is trial 4 with value: 2.3129557692904745.
[I 2023-11-21 09:55:09,646] Trial 177 finished with value: 2.3129557692904745 and parameters: {'model_name': 'SimpleImputer', 'strategy': 'mean'}. Best is trial 4 with value: 2.3129557692904745.
[I 2023-11-21 09:55:09,860] Trial 173 finished with value: 2.3129557692904745 and parameters: {'model_name': 'SimpleImputer', 'strategy': 'mean'}. Best is trial 4 with value: 2.3129557692904745.
[I 2023-11-21 09:55:10,209] Trial 183 finished with value: 6.7605067906254686 and parameters: {'model_name': 'SimpleImputer', 'strategy': 'constant'}. Best is trial 4 with value: 2.3129557692904745.
[I 2023-11-21 09:55:10,471] Trial 182 finished with value: 6.7605067906254686 and parameters: {'model_name': 'SimpleImputer', 'strategy': 'constant'}. Best is trial 4 with value: 2.3129557692904745.
[I 2023-11-21 09:55:10,657] Trial 186 finished with value: 6.7605067906254686 and parameters: {'model_name': 'SimpleImputer', 'strategy': 'constant'}. Best is trial 4 with value: 2.3129557692904745.
[I 2023-11-21 09:55:10,897] Trial 185 finished with value: 6.7605067906254686 and parameters: {'model_name': 'SimpleImputer', 'strategy': 'constant'}. Best is trial 4 with value: 2.3129557692904745.
[I 2023-11-21 09:55:11,114] Trial 188 finished with value: 6.7605067906254686 and parameters: {'model_name': 'SimpleImputer', 'strategy': 'constant'}. Best is trial 4 with value: 2.3129557692904745.
[I 2023-11-21 09:55:11,311] Trial 196 finished with value: 6.7605067906254686 and parameters: {'model_name': 'SimpleImputer', 'strategy': 'constant'}. Best is trial 4 with value: 2.3129557692904745.
[I 2023-11-21 09:55:11,534] Trial 179 finished with value: 2.3129557692904745 and parameters: {'model_name': 'SimpleImputer', 'strategy': 'mean'}. Best is trial 4 with value: 2.3129557692904745.
[I 2023-11-21 09:55:11,720] Trial 192 finished with value: 6.7605067906254686 and parameters: {'model_name': 'SimpleImputer', 'strategy': 'constant'}. Best is trial 4 with value: 2.3129557692904745.
[I 2023-11-21 09:55:11,989] Trial 193 finished with value: 2.3129557692904745 and parameters: {'model_name': 'SimpleImputer', 'strategy': 'mean'}. Best is trial 4 with value: 2.3129557692904745.
[I 2023-11-21 09:55:12,221] Trial 198 finished with value: 6.7605067906254686 and parameters: {'model_name': 'SimpleImputer', 'strategy': 'constant'}. Best is trial 4 with value: 2.3129557692904745.
[I 2023-11-21 09:55:12,448] Trial 189 finished with value: 6.7605067906254686 and parameters: {'model_name': 'SimpleImputer', 'strategy': 'constant'}. Best is trial 4 with value: 2.3129557692904745.
[I 2023-11-21 09:55:12,661] Trial 190 finished with value: 6.7605067906254686 and parameters: {'model_name': 'SimpleImputer', 'strategy': 'constant'}. Best is trial 4 with value: 2.3129557692904745.
[I 2023-11-21 09:55:12,849] Trial 199 finished with value: 6.7605067906254686 and parameters: {'model_name': 'SimpleImputer', 'strategy': 'constant'}. Best is trial 4 with value: 2.3129557692904745.
[I 2023-11-21 09:55:13,065] Trial 197 finished with value: 6.7605067906254686 and parameters: {'model_name': 'SimpleImputer', 'strategy': 'constant'}. Best is trial 4 with value: 2.3129557692904745.
[I 2023-11-21 09:55:13,282] Trial 187 finished with value: 2.3129557692904745 and parameters: {'model_name': 'SimpleImputer', 'strategy': 'mean'}. Best is trial 4 with value: 2.3129557692904745.
[I 2023-11-21 09:55:13,489] Trial 191 finished with value: 6.7605067906254686 and parameters: {'model_name': 'SimpleImputer', 'strategy': 'constant'}. Best is trial 4 with value: 2.3129557692904745.
[I 2023-11-21 09:55:13,678] Trial 194 finished with value: 2.3129557692904745 and parameters: {'model_name': 'SimpleImputer', 'strategy': 'mean'}. Best is trial 4 with value: 2.3129557692904745.
[I 2023-11-21 09:55:13,860] Trial 195 finished with value: 2.3129557692904745 and parameters: {'model_name': 'SimpleImputer', 'strategy': 'mean'}. Best is trial 4 with value: 2.3129557692904745.
[I 2023-11-21 09:55:20,084] A new study created in memory with name: no-name-d6caff06-d13a-4b95-961b-e9395545cb31
[I 2023-11-21 09:55:20,100] Trial 0 finished with value: inf and parameters: {'model_name': 'KNNImputer', 'weights': 'distance', 'keep_empty_features': True}. Best is trial 0 with value: inf.
[I 2023-11-21 09:55:20,106] Trial 2 finished with value: inf and parameters: {'model_name': 'KNNImputer', 'weights': 'distance', 'keep_empty_features': True}. Best is trial 0 with value: inf.
[I 2023-11-21 09:55:20,442] Trial 7 finished with value: inf and parameters: {'model_name': 'KNNImputer', 'weights': 'uniform', 'keep_empty_features': True}. Best is trial 0 with value: inf.
[I 2023-11-21 09:55:20,665] Trial 9 finished with value: inf and parameters: {'model_name': 'KNNImputer', 'weights': 'distance', 'keep_empty_features': True}. Best is trial 0 with value: inf.
[I 2023-11-21 09:55:20,903] Trial 8 finished with value: inf and parameters: {'model_name': 'GAIN', 'batch_size': 775, 'hint_rate': 0.0195340153789745, 'alpha': 79, 'iterations': 7}. Best is trial 0 with value: inf.
[I 2023-11-21 09:55:21,241] Trial 6 finished with value: inf and parameters: {'model_name': 'GAIN', 'batch_size': 2, 'hint_rate': 0.19845818258975428, 'alpha': 30, 'iterations': 33374}. Best is trial 0 with value: inf.
[I 2023-11-21 09:55:21,572] Trial 15 finished with value: inf and parameters: {'model_name': 'GAIN', 'batch_size': 25, 'hint_rate': 0.014514964362235051, 'alpha': 51, 'iterations': 292}. Best is trial 0 with value: inf.
[I 2023-11-21 09:55:21,865] Trial 26 finished with value: inf and parameters: {'model_name': 'GAIN', 'batch_size': 67, 'hint_rate': 0.27187760278656486, 'alpha': 99, 'iterations': 3}. Best is trial 0 with value: inf.
[I 2023-11-21 09:55:22,159] Trial 34 finished with value: inf and parameters: {'model_name': 'KNNImputer', 'weights': 'uniform', 'keep_empty_features': False}. Best is trial 0 with value: inf.
