/cm/local/apps/slurm/var/spool/job412636/slurm_script: line 19: /common/ketrong/minconda3/etc/profile.d/conda.sh: No such file or directory
/cm/local/apps/slurm/var/spool/job412636/slurm_script: line 22: $'\nconda create --name tpot2devenv -c conda-forge python=3.10\n': command not found
/cm/local/apps/slurm/var/spool/job412636/slurm_script: line 27: $'\npip install -r requirements.txt\n': command not found
RunStart
2023-11-24 15:10:10.360269: I tensorflow/core/util/port.cc:113] oneDNN custom operations are on. You may see slightly different numerical results due to floating-point round-off errors from different computation orders. To turn them off, set the environment variable `TF_ENABLE_ONEDNN_OPTS=0`.
2023-11-24 15:10:10.396118: E external/local_xla/xla/stream_executor/cuda/cuda_dnn.cc:9261] Unable to register cuDNN factory: Attempting to register factory for plugin cuDNN when one has already been registered
2023-11-24 15:10:10.396143: E external/local_xla/xla/stream_executor/cuda/cuda_fft.cc:607] Unable to register cuFFT factory: Attempting to register factory for plugin cuFFT when one has already been registered
2023-11-24 15:10:10.397514: E external/local_xla/xla/stream_executor/cuda/cuda_blas.cc:1515] Unable to register cuBLAS factory: Attempting to register factory for plugin cuBLAS when one has already been registered
2023-11-24 15:10:10.403568: I tensorflow/core/platform/cpu_feature_guard.cc:182] This TensorFlow binary is optimized to use available CPU instructions in performance-critical operations.
To enable the following instructions: AVX2 AVX512F AVX512_VNNI FMA, in other operations, rebuild TensorFlow with the appropriate compiler flags.
2023-11-24 15:10:22.352663: W tensorflow/compiler/tf2tensorrt/utils/py_utils.cc:38] TF-TRT Warning: Could not find TensorRT
WARNING:tensorflow:From /home/ketrong/miniconda3/envs/tpot2devenv/lib/python3.10/site-packages/tensorflow/python/compat/v2_compat.py:108: disable_resource_variables (from tensorflow.python.ops.variable_scope) is deprecated and will be removed in a future version.
Instructions for updating:
non-resource variables are not supported in the long term
working on 
tpot2_imputetest/Impute_Experiments/logs//tpot2_base_normal_6_0.9_MCAR_3
loading data
tpot2_imputetest/Impute_Experiments/data/6_True.pkl
running experiment 1/3 - Does large hyperparameter space improve reconstruction accuracy over simple
[I 2023-11-24 15:15:45,889] A new study created in memory with name: no-name-bd684b37-8513-4f0b-92df-03039ac882c6
[I 2023-11-24 15:15:47,690] Trial 5 finished with value: 6.599436619685216 and parameters: {'model_name': 'SimpleImputer', 'strategy': 'constant'}. Best is trial 5 with value: 6.599436619685216.
[I 2023-11-24 15:15:48,008] Trial 6 finished with value: 6.599436619685216 and parameters: {'model_name': 'SimpleImputer', 'strategy': 'constant'}. Best is trial 5 with value: 6.599436619685216.
[I 2023-11-24 15:15:48,281] Trial 10 finished with value: 6.599436619685216 and parameters: {'model_name': 'SimpleImputer', 'strategy': 'constant'}. Best is trial 5 with value: 6.599436619685216.
[I 2023-11-24 15:15:48,661] Trial 1 finished with value: 6.599436619685216 and parameters: {'model_name': 'SimpleImputer', 'strategy': 'constant'}. Best is trial 5 with value: 6.599436619685216.
[I 2023-11-24 15:15:48,825] Trial 14 finished with value: 6.599436619685216 and parameters: {'model_name': 'SimpleImputer', 'strategy': 'constant'}. Best is trial 5 with value: 6.599436619685216.
[I 2023-11-24 15:15:49,308] Trial 17 finished with value: 6.599436619685216 and parameters: {'model_name': 'SimpleImputer', 'strategy': 'constant'}. Best is trial 5 with value: 6.599436619685216.
[I 2023-11-24 15:15:49,505] Trial 7 finished with value: 2.311724990311883 and parameters: {'model_name': 'SimpleImputer', 'strategy': 'mean'}. Best is trial 7 with value: 2.311724990311883.
[I 2023-11-24 15:15:50,175] Trial 13 finished with value: 2.311724990311883 and parameters: {'model_name': 'SimpleImputer', 'strategy': 'mean'}. Best is trial 7 with value: 2.311724990311883.
[I 2023-11-24 15:15:50,476] Trial 12 finished with value: 2.311724990311883 and parameters: {'model_name': 'SimpleImputer', 'strategy': 'mean'}. Best is trial 7 with value: 2.311724990311883.
[I 2023-11-24 15:15:50,811] Trial 23 finished with value: 6.599436619685216 and parameters: {'model_name': 'SimpleImputer', 'strategy': 'constant'}. Best is trial 7 with value: 2.311724990311883.
[I 2023-11-24 15:15:51,077] Trial 22 finished with value: 6.599436619685216 and parameters: {'model_name': 'SimpleImputer', 'strategy': 'constant'}. Best is trial 7 with value: 2.311724990311883.
[I 2023-11-24 15:15:51,462] Trial 24 finished with value: 6.599436619685216 and parameters: {'model_name': 'SimpleImputer', 'strategy': 'constant'}. Best is trial 7 with value: 2.311724990311883.
[I 2023-11-24 15:15:52,088] Trial 28 finished with value: 6.599436619685216 and parameters: {'model_name': 'SimpleImputer', 'strategy': 'constant'}. Best is trial 7 with value: 2.311724990311883.
[I 2023-11-24 15:15:52,289] Trial 44 finished with value: 6.599436619685216 and parameters: {'model_name': 'SimpleImputer', 'strategy': 'constant'}. Best is trial 7 with value: 2.311724990311883.
[I 2023-11-24 15:15:52,669] Trial 40 finished with value: 6.599436619685216 and parameters: {'model_name': 'SimpleImputer', 'strategy': 'constant'}. Best is trial 7 with value: 2.311724990311883.
[I 2023-11-24 15:15:52,982] Trial 0 finished with value: 2.360319027114439 and parameters: {'model_name': 'SimpleImputer', 'strategy': 'median'}. Best is trial 7 with value: 2.311724990311883.
[I 2023-11-24 15:15:53,226] Trial 34 finished with value: 2.311724990311883 and parameters: {'model_name': 'SimpleImputer', 'strategy': 'mean'}. Best is trial 7 with value: 2.311724990311883.
[I 2023-11-24 15:15:53,427] Trial 45 finished with value: 6.599436619685216 and parameters: {'model_name': 'SimpleImputer', 'strategy': 'constant'}. Best is trial 7 with value: 2.311724990311883.
[I 2023-11-24 15:15:53,620] Trial 50 finished with value: 6.599436619685216 and parameters: {'model_name': 'SimpleImputer', 'strategy': 'constant'}. Best is trial 7 with value: 2.311724990311883.
[I 2023-11-24 15:15:53,998] Trial 27 finished with value: 2.311724990311883 and parameters: {'model_name': 'SimpleImputer', 'strategy': 'mean'}. Best is trial 7 with value: 2.311724990311883.
[I 2023-11-24 15:15:54,476] Trial 9 finished with value: 2.360319027114439 and parameters: {'model_name': 'SimpleImputer', 'strategy': 'median'}. Best is trial 7 with value: 2.311724990311883.
[I 2023-11-24 15:15:54,888] Trial 32 finished with value: 2.311724990311883 and parameters: {'model_name': 'SimpleImputer', 'strategy': 'mean'}. Best is trial 7 with value: 2.311724990311883.
[I 2023-11-24 15:15:55,074] Trial 2 finished with value: 2.360319027114439 and parameters: {'model_name': 'SimpleImputer', 'strategy': 'median'}. Best is trial 7 with value: 2.311724990311883.
[I 2023-11-24 15:15:55,367] Trial 36 finished with value: 2.311724990311883 and parameters: {'model_name': 'SimpleImputer', 'strategy': 'mean'}. Best is trial 7 with value: 2.311724990311883.
[I 2023-11-24 15:15:55,751] Trial 33 finished with value: 2.311724990311883 and parameters: {'model_name': 'SimpleImputer', 'strategy': 'mean'}. Best is trial 7 with value: 2.311724990311883.
[I 2023-11-24 15:15:56,151] Trial 21 finished with value: 2.360319027114439 and parameters: {'model_name': 'SimpleImputer', 'strategy': 'median'}. Best is trial 7 with value: 2.311724990311883.
[I 2023-11-24 15:15:56,310] Trial 15 finished with value: 2.360319027114439 and parameters: {'model_name': 'SimpleImputer', 'strategy': 'median'}. Best is trial 7 with value: 2.311724990311883.
[I 2023-11-24 15:15:56,693] Trial 53 finished with value: 6.599436619685216 and parameters: {'model_name': 'SimpleImputer', 'strategy': 'constant'}. Best is trial 7 with value: 2.311724990311883.
[I 2023-11-24 15:15:56,724] Trial 4 finished with value: 2.360319027114439 and parameters: {'model_name': 'SimpleImputer', 'strategy': 'median'}. Best is trial 7 with value: 2.311724990311883.
[I 2023-11-24 15:15:56,980] Trial 47 finished with value: 2.311724990311883 and parameters: {'model_name': 'SimpleImputer', 'strategy': 'mean'}. Best is trial 7 with value: 2.311724990311883.
[I 2023-11-24 15:15:57,226] Trial 46 finished with value: 2.311724990311883 and parameters: {'model_name': 'SimpleImputer', 'strategy': 'mean'}. Best is trial 7 with value: 2.311724990311883.
[I 2023-11-24 15:15:57,685] Trial 48 finished with value: 2.311724990311883 and parameters: {'model_name': 'SimpleImputer', 'strategy': 'mean'}. Best is trial 7 with value: 2.311724990311883.
[I 2023-11-24 15:15:58,131] Trial 19 finished with value: 2.360319027114439 and parameters: {'model_name': 'SimpleImputer', 'strategy': 'median'}. Best is trial 7 with value: 2.311724990311883.
[I 2023-11-24 15:15:58,647] Trial 51 finished with value: 2.311724990311883 and parameters: {'model_name': 'SimpleImputer', 'strategy': 'mean'}. Best is trial 7 with value: 2.311724990311883.
[I 2023-11-24 15:15:58,978] Trial 26 finished with value: 2.360319027114439 and parameters: {'model_name': 'SimpleImputer', 'strategy': 'median'}. Best is trial 7 with value: 2.311724990311883.
[I 2023-11-24 15:15:59,481] Trial 35 finished with value: 2.360319027114439 and parameters: {'model_name': 'SimpleImputer', 'strategy': 'median'}. Best is trial 7 with value: 2.311724990311883.
[I 2023-11-24 15:16:00,029] Trial 43 finished with value: 2.360319027114439 and parameters: {'model_name': 'SimpleImputer', 'strategy': 'median'}. Best is trial 7 with value: 2.311724990311883.
[I 2023-11-24 15:16:00,545] Trial 58 finished with value: 2.311724990311883 and parameters: {'model_name': 'SimpleImputer', 'strategy': 'mean'}. Best is trial 7 with value: 2.311724990311883.
[I 2023-11-24 15:16:00,975] Trial 55 finished with value: 2.311724990311883 and parameters: {'model_name': 'SimpleImputer', 'strategy': 'mean'}. Best is trial 7 with value: 2.311724990311883.
[I 2023-11-24 15:16:01,164] Trial 56 finished with value: 2.311724990311883 and parameters: {'model_name': 'SimpleImputer', 'strategy': 'mean'}. Best is trial 7 with value: 2.311724990311883.
[I 2023-11-24 15:16:01,444] Trial 41 finished with value: 2.360319027114439 and parameters: {'model_name': 'SimpleImputer', 'strategy': 'median'}. Best is trial 7 with value: 2.311724990311883.
[I 2023-11-24 15:16:01,715] Trial 39 finished with value: 2.360319027114439 and parameters: {'model_name': 'SimpleImputer', 'strategy': 'median'}. Best is trial 7 with value: 2.311724990311883.
[I 2023-11-24 15:16:01,934] Trial 59 finished with value: 2.311724990311883 and parameters: {'model_name': 'SimpleImputer', 'strategy': 'mean'}. Best is trial 7 with value: 2.311724990311883.
[I 2023-11-24 15:16:02,181] Trial 49 finished with value: 2.360319027114439 and parameters: {'model_name': 'SimpleImputer', 'strategy': 'median'}. Best is trial 7 with value: 2.311724990311883.
[I 2023-11-24 15:16:02,462] Trial 61 finished with value: 2.311724990311883 and parameters: {'model_name': 'SimpleImputer', 'strategy': 'mean'}. Best is trial 7 with value: 2.311724990311883.
[I 2023-11-24 15:16:02,755] Trial 11 finished with value: 2.50775392462567 and parameters: {'model_name': 'SimpleImputer', 'strategy': 'most_frequent'}. Best is trial 7 with value: 2.311724990311883.
[I 2023-11-24 15:16:03,160] Trial 3 finished with value: 2.50775392462567 and parameters: {'model_name': 'SimpleImputer', 'strategy': 'most_frequent'}. Best is trial 7 with value: 2.311724990311883.
[I 2023-11-24 15:16:03,350] Trial 63 finished with value: 2.311724990311883 and parameters: {'model_name': 'SimpleImputer', 'strategy': 'mean'}. Best is trial 7 with value: 2.311724990311883.
[I 2023-11-24 15:16:04,034] Trial 60 finished with value: 2.311724990311883 and parameters: {'model_name': 'SimpleImputer', 'strategy': 'mean'}. Best is trial 7 with value: 2.311724990311883.
[I 2023-11-24 15:16:04,423] Trial 62 finished with value: 2.311724990311883 and parameters: {'model_name': 'SimpleImputer', 'strategy': 'mean'}. Best is trial 7 with value: 2.311724990311883.
[I 2023-11-24 15:16:05,293] Trial 68 finished with value: 2.311724990311883 and parameters: {'model_name': 'SimpleImputer', 'strategy': 'mean'}. Best is trial 7 with value: 2.311724990311883.
[I 2023-11-24 15:16:05,523] Trial 64 finished with value: 2.311724990311883 and parameters: {'model_name': 'SimpleImputer', 'strategy': 'mean'}. Best is trial 7 with value: 2.311724990311883.
[I 2023-11-24 15:16:05,772] Trial 20 finished with value: 2.50775392462567 and parameters: {'model_name': 'SimpleImputer', 'strategy': 'most_frequent'}. Best is trial 7 with value: 2.311724990311883.
[I 2023-11-24 15:16:06,191] Trial 75 finished with value: 2.311724990311883 and parameters: {'model_name': 'SimpleImputer', 'strategy': 'mean'}. Best is trial 7 with value: 2.311724990311883.
[I 2023-11-24 15:16:06,395] Trial 8 finished with value: 2.50775392462567 and parameters: {'model_name': 'SimpleImputer', 'strategy': 'most_frequent'}. Best is trial 7 with value: 2.311724990311883.
[I 2023-11-24 15:16:07,353] Trial 16 finished with value: 2.50775392462567 and parameters: {'model_name': 'SimpleImputer', 'strategy': 'most_frequent'}. Best is trial 7 with value: 2.311724990311883.
[I 2023-11-24 15:16:07,790] Trial 69 finished with value: 2.311724990311883 and parameters: {'model_name': 'SimpleImputer', 'strategy': 'mean'}. Best is trial 7 with value: 2.311724990311883.
[I 2023-11-24 15:16:08,314] Trial 18 finished with value: 2.50775392462567 and parameters: {'model_name': 'SimpleImputer', 'strategy': 'most_frequent'}. Best is trial 7 with value: 2.311724990311883.
[I 2023-11-24 15:16:09,530] Trial 25 finished with value: 2.50775392462567 and parameters: {'model_name': 'SimpleImputer', 'strategy': 'most_frequent'}. Best is trial 7 with value: 2.311724990311883.
[I 2023-11-24 15:16:10,006] Trial 29 finished with value: 2.50775392462567 and parameters: {'model_name': 'SimpleImputer', 'strategy': 'most_frequent'}. Best is trial 7 with value: 2.311724990311883.
[I 2023-11-24 15:16:10,233] Trial 37 finished with value: 2.50775392462567 and parameters: {'model_name': 'SimpleImputer', 'strategy': 'most_frequent'}. Best is trial 7 with value: 2.311724990311883.
[I 2023-11-24 15:16:10,848] Trial 31 finished with value: 2.50775392462567 and parameters: {'model_name': 'SimpleImputer', 'strategy': 'most_frequent'}. Best is trial 7 with value: 2.311724990311883.
[I 2023-11-24 15:16:11,512] Trial 30 finished with value: 2.50775392462567 and parameters: {'model_name': 'SimpleImputer', 'strategy': 'most_frequent'}. Best is trial 7 with value: 2.311724990311883.
[I 2023-11-24 15:16:11,799] Trial 38 finished with value: 2.50775392462567 and parameters: {'model_name': 'SimpleImputer', 'strategy': 'most_frequent'}. Best is trial 7 with value: 2.311724990311883.
[I 2023-11-24 15:16:12,004] Trial 42 finished with value: 2.50775392462567 and parameters: {'model_name': 'SimpleImputer', 'strategy': 'most_frequent'}. Best is trial 7 with value: 2.311724990311883.
[I 2023-11-24 15:16:12,382] Trial 52 finished with value: 2.50775392462567 and parameters: {'model_name': 'SimpleImputer', 'strategy': 'most_frequent'}. Best is trial 7 with value: 2.311724990311883.
[I 2023-11-24 15:16:12,905] Trial 90 finished with value: 2.311724990311883 and parameters: {'model_name': 'SimpleImputer', 'strategy': 'mean'}. Best is trial 7 with value: 2.311724990311883.
[I 2023-11-24 15:16:13,847] Trial 54 finished with value: 2.50775392462567 and parameters: {'model_name': 'SimpleImputer', 'strategy': 'most_frequent'}. Best is trial 7 with value: 2.311724990311883.
[I 2023-11-24 15:16:14,524] Trial 103 finished with value: 2.311724990311883 and parameters: {'model_name': 'SimpleImputer', 'strategy': 'mean'}. Best is trial 7 with value: 2.311724990311883.
[I 2023-11-24 15:16:15,296] Trial 57 finished with value: 2.50775392462567 and parameters: {'model_name': 'SimpleImputer', 'strategy': 'most_frequent'}. Best is trial 7 with value: 2.311724990311883.
[I 2023-11-24 15:16:15,703] Trial 105 finished with value: 2.311724990311883 and parameters: {'model_name': 'SimpleImputer', 'strategy': 'mean'}. Best is trial 7 with value: 2.311724990311883.
[I 2023-11-24 15:16:16,376] Trial 67 finished with value: 2.50775392462567 and parameters: {'model_name': 'SimpleImputer', 'strategy': 'most_frequent'}. Best is trial 7 with value: 2.311724990311883.
[I 2023-11-24 15:16:17,021] Trial 106 finished with value: 2.311724990311883 and parameters: {'model_name': 'SimpleImputer', 'strategy': 'mean'}. Best is trial 7 with value: 2.311724990311883.
[I 2023-11-24 15:16:17,493] Trial 74 finished with value: 2.50775392462567 and parameters: {'model_name': 'SimpleImputer', 'strategy': 'most_frequent'}. Best is trial 7 with value: 2.311724990311883.
[I 2023-11-24 15:16:17,750] Trial 108 finished with value: 2.311724990311883 and parameters: {'model_name': 'SimpleImputer', 'strategy': 'mean'}. Best is trial 7 with value: 2.311724990311883.
[I 2023-11-24 15:16:17,981] Trial 107 finished with value: 2.311724990311883 and parameters: {'model_name': 'SimpleImputer', 'strategy': 'mean'}. Best is trial 7 with value: 2.311724990311883.
[I 2023-11-24 15:16:18,556] Trial 111 finished with value: 2.311724990311883 and parameters: {'model_name': 'SimpleImputer', 'strategy': 'mean'}. Best is trial 7 with value: 2.311724990311883.
[I 2023-11-24 15:16:18,955] Trial 109 finished with value: 2.311724990311883 and parameters: {'model_name': 'SimpleImputer', 'strategy': 'mean'}. Best is trial 7 with value: 2.311724990311883.
[I 2023-11-24 15:16:19,243] Trial 71 finished with value: 2.50775392462567 and parameters: {'model_name': 'SimpleImputer', 'strategy': 'most_frequent'}. Best is trial 7 with value: 2.311724990311883.
[I 2023-11-24 15:16:19,471] Trial 65 finished with value: 2.50775392462567 and parameters: {'model_name': 'SimpleImputer', 'strategy': 'most_frequent'}. Best is trial 7 with value: 2.311724990311883.
[I 2023-11-24 15:16:19,994] Trial 112 finished with value: 2.311724990311883 and parameters: {'model_name': 'SimpleImputer', 'strategy': 'mean'}. Best is trial 7 with value: 2.311724990311883.
[I 2023-11-24 15:16:20,335] Trial 110 finished with value: 2.311724990311883 and parameters: {'model_name': 'SimpleImputer', 'strategy': 'mean'}. Best is trial 7 with value: 2.311724990311883.
[I 2023-11-24 15:16:20,534] Trial 84 finished with value: 2.50775392462567 and parameters: {'model_name': 'SimpleImputer', 'strategy': 'most_frequent'}. Best is trial 7 with value: 2.311724990311883.
[I 2023-11-24 15:16:20,710] Trial 80 finished with value: 2.50775392462567 and parameters: {'model_name': 'SimpleImputer', 'strategy': 'most_frequent'}. Best is trial 7 with value: 2.311724990311883.
[I 2023-11-24 15:16:20,879] Trial 66 finished with value: 2.50775392462567 and parameters: {'model_name': 'SimpleImputer', 'strategy': 'most_frequent'}. Best is trial 7 with value: 2.311724990311883.
[I 2023-11-24 15:16:21,111] Trial 73 finished with value: 2.50775392462567 and parameters: {'model_name': 'SimpleImputer', 'strategy': 'most_frequent'}. Best is trial 7 with value: 2.311724990311883.
[I 2023-11-24 15:16:21,628] Trial 113 finished with value: 2.311724990311883 and parameters: {'model_name': 'SimpleImputer', 'strategy': 'mean'}. Best is trial 7 with value: 2.311724990311883.
[I 2023-11-24 15:16:21,972] Trial 76 finished with value: 2.50775392462567 and parameters: {'model_name': 'SimpleImputer', 'strategy': 'most_frequent'}. Best is trial 7 with value: 2.311724990311883.
[I 2023-11-24 15:16:22,223] Trial 114 finished with value: 2.311724990311883 and parameters: {'model_name': 'SimpleImputer', 'strategy': 'mean'}. Best is trial 7 with value: 2.311724990311883.
[I 2023-11-24 15:16:22,570] Trial 78 finished with value: 2.50775392462567 and parameters: {'model_name': 'SimpleImputer', 'strategy': 'most_frequent'}. Best is trial 7 with value: 2.311724990311883.
[I 2023-11-24 15:16:22,823] Trial 70 finished with value: 2.50775392462567 and parameters: {'model_name': 'SimpleImputer', 'strategy': 'most_frequent'}. Best is trial 7 with value: 2.311724990311883.
[I 2023-11-24 15:16:23,003] Trial 79 finished with value: 2.50775392462567 and parameters: {'model_name': 'SimpleImputer', 'strategy': 'most_frequent'}. Best is trial 7 with value: 2.311724990311883.
[I 2023-11-24 15:16:23,361] Trial 115 finished with value: 2.311724990311883 and parameters: {'model_name': 'SimpleImputer', 'strategy': 'mean'}. Best is trial 7 with value: 2.311724990311883.
[I 2023-11-24 15:16:23,623] Trial 82 finished with value: 2.50775392462567 and parameters: {'model_name': 'SimpleImputer', 'strategy': 'most_frequent'}. Best is trial 7 with value: 2.311724990311883.
[I 2023-11-24 15:16:24,063] Trial 83 finished with value: 2.50775392462567 and parameters: {'model_name': 'SimpleImputer', 'strategy': 'most_frequent'}. Best is trial 7 with value: 2.311724990311883.
[I 2023-11-24 15:16:24,455] Trial 77 finished with value: 2.50775392462567 and parameters: {'model_name': 'SimpleImputer', 'strategy': 'most_frequent'}. Best is trial 7 with value: 2.311724990311883.
[I 2023-11-24 15:16:24,808] Trial 85 finished with value: 2.50775392462567 and parameters: {'model_name': 'SimpleImputer', 'strategy': 'most_frequent'}. Best is trial 7 with value: 2.311724990311883.
[I 2023-11-24 15:16:25,069] Trial 72 finished with value: 2.50775392462567 and parameters: {'model_name': 'SimpleImputer', 'strategy': 'most_frequent'}. Best is trial 7 with value: 2.311724990311883.
[I 2023-11-24 15:16:25,291] Trial 95 finished with value: 2.50775392462567 and parameters: {'model_name': 'SimpleImputer', 'strategy': 'most_frequent'}. Best is trial 7 with value: 2.311724990311883.
