Best trial: 0. Best value: 2.31221:  20%|█▉        | 39/200 [00:11<00:45,  3.58it/s]Best trial: 0. Best value: 2.31221:  20%|█▉        | 39/200 [00:12<00:45,  3.58it/s]Best trial: 0. Best value: 2.31221:  20%|██        | 40/200 [00:12<00:43,  3.71it/s]                                                                                    [I 2023-11-24 15:17:10,358] Trial 4 finished with value: 2.463684399751726 and parameters: {'model_name': 'IterativeImputer', 'estimator': BayesianRidge(), 'sample_posterior': False, 'initial_strategy': 'most_frequent', 'imputation_order': 'random'}. Best is trial 0 with value: 2.312212579683814.
Best trial: 0. Best value: 2.31221:  20%|██        | 40/200 [00:13<00:43,  3.71it/s]Best trial: 0. Best value: 2.31221:  20%|██        | 40/200 [00:13<00:43,  3.71it/s]Best trial: 0. Best value: 2.31221:  20%|██        | 41/200 [00:13<01:48,  1.46it/s]Best trial: 0. Best value: 2.31221:  20%|██        | 41/200 [00:13<00:53,  2.96it/s]
failed on 
tpot2_imputetest/Impute_Experiments/logs//tpot2_base_normal_6_0.9_MCAR_3
CategoricalDistribution does not support dynamic value space.
Traceback (most recent call last):
  File "/common/ketrong/AutoImputeExp/tpot2_imputetest/Impute_Experiments/utils.py", line 178, in loop_through_tasks
    AutoImputeSpace.fit(X_train_pandas)
  File "/common/ketrong/AutoImputeExp/tpot2_imputetest/Impute_Experiments/autoimpute.py", line 60, in fit
    self.study.optimize(obj, n_trials=self.n_trials, n_jobs=self.n_jobs, show_progress_bar=self.show_progress, gc_after_trial=self.garbage_collect)
  File "/home/ketrong/miniconda3/envs/tpot2devenv/lib/python3.10/site-packages/optuna/study/study.py", line 451, in optimize
    _optimize(
  File "/home/ketrong/miniconda3/envs/tpot2devenv/lib/python3.10/site-packages/optuna/study/_optimize.py", line 103, in _optimize
    f.result()
  File "/home/ketrong/miniconda3/envs/tpot2devenv/lib/python3.10/concurrent/futures/_base.py", line 451, in result
    return self.__get_result()
  File "/home/ketrong/miniconda3/envs/tpot2devenv/lib/python3.10/concurrent/futures/_base.py", line 403, in __get_result
    raise self._exception
  File "/home/ketrong/miniconda3/envs/tpot2devenv/lib/python3.10/concurrent/futures/thread.py", line 58, in run
    result = self.fn(*self.args, **self.kwargs)
  File "/home/ketrong/miniconda3/envs/tpot2devenv/lib/python3.10/site-packages/optuna/study/_optimize.py", line 163, in _optimize_sequential
    frozen_trial = _run_trial(study, func, catch)
  File "/home/ketrong/miniconda3/envs/tpot2devenv/lib/python3.10/site-packages/optuna/study/_optimize.py", line 251, in _run_trial
    raise func_err
  File "/home/ketrong/miniconda3/envs/tpot2devenv/lib/python3.10/site-packages/optuna/study/_optimize.py", line 200, in _run_trial
    value_or_values = func(trial)
  File "/common/ketrong/AutoImputeExp/tpot2_imputetest/Impute_Experiments/autoimpute.py", line 56, in obj
    my_params = autoutils.trial_suggestion(trial, self.model_names, column_len=len(X.columns), random_state=self.random_state)
  File "/common/ketrong/AutoImputeExp/tpot2_imputetest/Impute_Experiments/autoutils.py", line 20, in trial_suggestion
    my_params = params_IterativeImpute(trial,model_name) #Uses the dependence between columns in the data set to predict for the one column. Predictions occur through a variety of strategies.
  File "/common/ketrong/AutoImputeExp/tpot2_imputetest/Impute_Experiments/param_grids.py", line 20, in params_IterativeImpute
    params['estimator'] = trial.suggest_categorical('estimator', [Bayes, RFR, Ridge, KNN])
  File "/home/ketrong/miniconda3/envs/tpot2devenv/lib/python3.10/site-packages/optuna/trial/_trial.py", line 405, in suggest_categorical
    return self._suggest(name, CategoricalDistribution(choices=choices))
  File "/home/ketrong/miniconda3/envs/tpot2devenv/lib/python3.10/site-packages/optuna/trial/_trial.py", line 636, in _suggest
    storage.set_trial_param(trial_id, name, param_value_in_internal_repr, distribution)
  File "/home/ketrong/miniconda3/envs/tpot2devenv/lib/python3.10/site-packages/optuna/storages/_in_memory.py", line 187, in set_trial_param
    distributions.check_distribution_compatibility(
  File "/home/ketrong/miniconda3/envs/tpot2devenv/lib/python3.10/site-packages/optuna/distributions.py", line 670, in check_distribution_compatibility
    raise ValueError(
ValueError: CategoricalDistribution does not support dynamic value space.

DONE
