Best trial: 5. Best value: 2.35473:   2%|▏         | 3/200 [00:06<02:50,  1.15it/s][I 2023-11-22 20:08:36,292] Trial 16 finished with value: 6.662601810506205 and parameters: {'model_name': 'SimpleImputer', 'strategy': 'constant'}. Best is trial 5 with value: 2.354732743906972.
                                                                                   Best trial: 5. Best value: 2.35473:   2%|▏         | 3/200 [00:06<02:50,  1.15it/s]Best trial: 5. Best value: 2.35473:   2%|▏         | 3/200 [00:06<02:50,  1.15it/s]Best trial: 5. Best value: 2.35473:   2%|▏         | 4/200 [00:06<05:59,  1.84s/it]                                                                                   [W 2023-11-22 20:08:36,470] Trial 12 failed with parameters: {'model_name': 'RandomForestImputer', 'max_iter': 14, 'decreasing': True, 'min_samples_split': 0.0, 'min_samples_leaf': 0.7000000000000001, 'max_features': 0.6000000000000001, 'bootstrap': False, 'oob_score': False, 'warm_start': False} because of the following error: TypeError("SimpleImputer.__init__() got an unexpected keyword argument 'max_iter'").
Traceback (most recent call last):
  File "/home/ketrong/miniconda3/envs/tpot2devenv/lib/python3.10/site-packages/optuna/study/_optimize.py", line 200, in _run_trial
    value_or_values = func(trial)
  File "/common/ketrong/AutoImputeExp/tpot2_imputetest/Impute_Experiments/autoimpute.py", line 57, in obj
    my_model = autoutils.MyModel(random_state = self.random_state, **my_params)
  File "/common/ketrong/AutoImputeExp/tpot2_imputetest/Impute_Experiments/autoutils.py", line 34, in MyModel
    this_model = SimpleImputer(
TypeError: SimpleImputer.__init__() got an unexpected keyword argument 'max_iter'
Best trial: 5. Best value: 2.35473:   2%|▏         | 4/200 [00:06<05:59,  1.84s/it]                                                                                   Best trial: 5. Best value: 2.35473:   2%|▏         | 4/200 [00:06<05:59,  1.84s/it][W 2023-11-22 20:08:36,470] Trial 12 failed with value None.
[W 2023-11-22 20:08:36,733] Trial 34 failed with parameters: {'model_name': 'RandomForestImputer', 'max_iter': 1, 'decreasing': True, 'min_samples_split': 0.4, 'min_samples_leaf': 0.8, 'max_features': 0.1, 'bootstrap': False, 'oob_score': False, 'warm_start': True} because of the following error: TypeError("SimpleImputer.__init__() got an unexpected keyword argument 'max_iter'").
Traceback (most recent call last):
  File "/home/ketrong/miniconda3/envs/tpot2devenv/lib/python3.10/site-packages/optuna/study/_optimize.py", line 200, in _run_trial
    value_or_values = func(trial)
  File "/common/ketrong/AutoImputeExp/tpot2_imputetest/Impute_Experiments/autoimpute.py", line 57, in obj
    my_model = autoutils.MyModel(random_state = self.random_state, **my_params)
  File "/common/ketrong/AutoImputeExp/tpot2_imputetest/Impute_Experiments/autoutils.py", line 34, in MyModel
    this_model = SimpleImputer(
TypeError: SimpleImputer.__init__() got an unexpected keyword argument 'max_iter'
                                                                                   Best trial: 5. Best value: 2.35473:   2%|▏         | 4/200 [00:06<05:59,  1.84s/it]                                                                                   Best trial: 5. Best value: 2.35473:   2%|▏         | 4/200 [00:06<05:59,  1.84s/it][W 2023-11-22 20:08:36,734] Trial 34 failed with value None.
                                                                                   [W 2023-11-22 20:08:36,952] Trial 40 failed with parameters: {'model_name': 'RandomForestImputer', 'max_iter': 35, 'decreasing': False, 'min_samples_split': 0.7000000000000001, 'min_samples_leaf': 0.6000000000000001, 'max_features': 0.6000000000000001, 'bootstrap': True, 'oob_score': False, 'warm_start': True} because of the following error: TypeError("SimpleImputer.__init__() got an unexpected keyword argument 'max_iter'").
Traceback (most recent call last):
  File "/home/ketrong/miniconda3/envs/tpot2devenv/lib/python3.10/site-packages/optuna/study/_optimize.py", line 200, in _run_trial
    value_or_values = func(trial)
  File "/common/ketrong/AutoImputeExp/tpot2_imputetest/Impute_Experiments/autoimpute.py", line 57, in obj
    my_model = autoutils.MyModel(random_state = self.random_state, **my_params)
  File "/common/ketrong/AutoImputeExp/tpot2_imputetest/Impute_Experiments/autoutils.py", line 34, in MyModel
    this_model = SimpleImputer(
TypeError: SimpleImputer.__init__() got an unexpected keyword argument 'max_iter'
Best trial: 5. Best value: 2.35473:   2%|▏         | 4/200 [00:07<05:59,  1.84s/it]                                                                                   [W 2023-11-22 20:08:36,962] Trial 40 failed with value None.
Best trial: 5. Best value: 2.35473:   2%|▏         | 4/200 [00:07<05:59,  1.84s/it][W 2023-11-22 20:08:36,960] Trial 27 failed with parameters: {'model_name': 'RandomForestImputer', 'max_iter': 36, 'decreasing': True, 'min_samples_split': 0.6000000000000001, 'min_samples_leaf': 0.8, 'max_features': 0.6000000000000001, 'bootstrap': True, 'oob_score': False, 'warm_start': False} because of the following error: TypeError("SimpleImputer.__init__() got an unexpected keyword argument 'max_iter'").
Traceback (most recent call last):
  File "/home/ketrong/miniconda3/envs/tpot2devenv/lib/python3.10/site-packages/optuna/study/_optimize.py", line 200, in _run_trial
    value_or_values = func(trial)
  File "/common/ketrong/AutoImputeExp/tpot2_imputetest/Impute_Experiments/autoimpute.py", line 57, in obj
    my_model = autoutils.MyModel(random_state = self.random_state, **my_params)
  File "/common/ketrong/AutoImputeExp/tpot2_imputetest/Impute_Experiments/autoutils.py", line 34, in MyModel
    this_model = SimpleImputer(
TypeError: SimpleImputer.__init__() got an unexpected keyword argument 'max_iter'
                                                                                   Best trial: 5. Best value: 2.35473:   2%|▏         | 4/200 [00:07<05:59,  1.84s/it][W 2023-11-22 20:08:37,140] Trial 27 failed with value None.
                                                                                   Best trial: 5. Best value: 2.35473:   2%|▏         | 4/200 [00:07<05:59,  1.84s/it][W 2023-11-22 20:08:36,953] Trial 30 failed with parameters: {'model_name': 'RandomForestImputer', 'max_iter': 1, 'decreasing': True, 'min_samples_split': 0.9, 'min_samples_leaf': 0.9, 'max_features': 0.1, 'bootstrap': True, 'oob_score': True, 'warm_start': False} because of the following error: TypeError("SimpleImputer.__init__() got an unexpected keyword argument 'max_iter'").
Traceback (most recent call last):
  File "/home/ketrong/miniconda3/envs/tpot2devenv/lib/python3.10/site-packages/optuna/study/_optimize.py", line 200, in _run_trial
    value_or_values = func(trial)
  File "/common/ketrong/AutoImputeExp/tpot2_imputetest/Impute_Experiments/autoimpute.py", line 57, in obj
    my_model = autoutils.MyModel(random_state = self.random_state, **my_params)
  File "/common/ketrong/AutoImputeExp/tpot2_imputetest/Impute_Experiments/autoutils.py", line 34, in MyModel
    this_model = SimpleImputer(
TypeError: SimpleImputer.__init__() got an unexpected keyword argument 'max_iter'
                                                                                   Best trial: 5. Best value: 2.35473:   2%|▏         | 4/200 [00:07<05:59,  1.84s/it]                                                                                   [W 2023-11-22 20:08:37,335] Trial 30 failed with value None.
Best trial: 5. Best value: 2.35473:   2%|▏         | 4/200 [00:07<05:59,  1.84s/it]                                                                                   [I 2023-11-22 20:08:36,961] Trial 19 finished with value: 6.662601810506205 and parameters: {'model_name': 'SimpleImputer', 'strategy': 'constant'}. Best is trial 5 with value: 2.354732743906972.
Best trial: 5. Best value: 2.35473:   2%|▏         | 4/200 [00:07<05:59,  1.84s/it]Best trial: 5. Best value: 2.35473:   2%|▏         | 4/200 [00:07<05:59,  1.84s/it]Best trial: 5. Best value: 2.35473:   2%|▎         | 5/200 [00:07<05:19,  1.64s/it]                                                                                   [I 2023-11-22 20:08:37,765] Trial 6 finished with value: 2.4101540057212274 and parameters: {'model_name': 'SimpleImputer', 'strategy': 'median'}. Best is trial 5 with value: 2.354732743906972.
Best trial: 5. Best value: 2.35473:   2%|▎         | 5/200 [00:07<05:19,  1.64s/it]Best trial: 5. Best value: 2.35473:   2%|▎         | 5/200 [00:08<05:19,  1.64s/it]Best trial: 5. Best value: 2.35473:   3%|▎         | 6/200 [00:08<03:42,  1.15s/it]                                                                                   [I 2023-11-22 20:08:38,006] Trial 1 finished with value: 2.4101540057212274 and parameters: {'model_name': 'SimpleImputer', 'strategy': 'median'}. Best is trial 5 with value: 2.354732743906972.
Best trial: 5. Best value: 2.35473:   3%|▎         | 6/200 [00:08<03:42,  1.15s/it]Best trial: 5. Best value: 2.35473:   3%|▎         | 6/200 [00:08<03:42,  1.15s/it]Best trial: 5. Best value: 2.35473:   4%|▎         | 7/200 [00:08<02:45,  1.17it/s][I 2023-11-22 20:08:38,210] Trial 28 finished with value: 2.354732743906972 and parameters: {'model_name': 'SimpleImputer', 'strategy': 'mean'}. Best is trial 5 with value: 2.354732743906972.
                                                                                   Best trial: 5. Best value: 2.35473:   4%|▎         | 7/200 [00:08<02:45,  1.17it/s]Best trial: 5. Best value: 2.35473:   4%|▎         | 7/200 [00:08<02:45,  1.17it/s]Best trial: 5. Best value: 2.35473:   4%|▍         | 8/200 [00:08<02:03,  1.55it/s]                                                                                   [I 2023-11-22 20:08:38,438] Trial 11 finished with value: 2.354732743906972 and parameters: {'model_name': 'SimpleImputer', 'strategy': 'mean'}. Best is trial 5 with value: 2.354732743906972.
Best trial: 5. Best value: 2.35473:   4%|▍         | 8/200 [00:08<02:03,  1.55it/s]Best trial: 5. Best value: 2.35473:   4%|▍         | 8/200 [00:08<02:03,  1.55it/s]Best trial: 5. Best value: 2.35473:   4%|▍         | 9/200 [00:08<01:38,  1.94it/s]                                                                                   [I 2023-11-22 20:08:38,642] Trial 24 finished with value: 6.662601810506205 and parameters: {'model_name': 'SimpleImputer', 'strategy': 'constant'}. Best is trial 5 with value: 2.354732743906972.
Best trial: 5. Best value: 2.35473:   4%|▍         | 9/200 [00:08<01:38,  1.94it/s]Best trial: 5. Best value: 2.35473:   4%|▍         | 9/200 [00:08<01:38,  1.94it/s]Best trial: 5. Best value: 2.35473:   5%|▌         | 10/200 [00:08<01:22,  2.30it/s]                                                                                    [I 2023-11-22 20:08:38,894] Trial 13 finished with value: 2.4101540057212274 and parameters: {'model_name': 'SimpleImputer', 'strategy': 'median'}. Best is trial 5 with value: 2.354732743906972.
Best trial: 5. Best value: 2.35473:   5%|▌         | 10/200 [00:08<01:22,  2.30it/s]Best trial: 5. Best value: 2.35473:   5%|▌         | 10/200 [00:09<01:22,  2.30it/s]Best trial: 5. Best value: 2.35473:   6%|▌         | 11/200 [00:09<01:09,  2.73it/s][I 2023-11-22 20:08:39,082] Trial 22 finished with value: 2.4101540057212274 and parameters: {'model_name': 'SimpleImputer', 'strategy': 'median'}. Best is trial 5 with value: 2.354732743906972.
                                                                                    Best trial: 5. Best value: 2.35473:   6%|▌         | 11/200 [00:09<01:09,  2.73it/s]Best trial: 5. Best value: 2.35473:   6%|▌         | 11/200 [00:09<01:09,  2.73it/s]Best trial: 5. Best value: 2.35473:   6%|▌         | 12/200 [00:09<00:57,  3.26it/s]                                                                                    [I 2023-11-22 20:08:39,337] Trial 42 finished with value: 2.4101540057212274 and parameters: {'model_name': 'SimpleImputer', 'strategy': 'median'}. Best is trial 5 with value: 2.354732743906972.
Best trial: 5. Best value: 2.35473:   6%|▌         | 12/200 [00:09<00:57,  3.26it/s]Best trial: 5. Best value: 2.35473:   6%|▌         | 12/200 [00:09<00:57,  3.26it/s]Best trial: 5. Best value: 2.35473:   6%|▋         | 13/200 [00:09<00:54,  3.41it/s][I 2023-11-22 20:08:39,639] Trial 37 finished with value: 2.5244349412715206 and parameters: {'model_name': 'SimpleImputer', 'strategy': 'most_frequent'}. Best is trial 5 with value: 2.354732743906972.
                                                                                    Best trial: 5. Best value: 2.35473:   6%|▋         | 13/200 [00:09<00:54,  3.41it/s]Best trial: 5. Best value: 2.35473:   6%|▋         | 13/200 [00:09<00:54,  3.41it/s]Best trial: 5. Best value: 2.35473:   7%|▋         | 14/200 [00:09<00:55,  3.34it/s][I 2023-11-22 20:08:39,834] Trial 26 finished with value: 2.5244349412715206 and parameters: {'model_name': 'SimpleImputer', 'strategy': 'most_frequent'}. Best is trial 5 with value: 2.354732743906972.
                                                                                    Best trial: 5. Best value: 2.35473:   7%|▋         | 14/200 [00:09<00:55,  3.34it/s]Best trial: 5. Best value: 2.35473:   7%|▋         | 14/200 [00:10<00:55,  3.34it/s]Best trial: 5. Best value: 2.35473:   8%|▊         | 15/200 [00:10<00:48,  3.82it/s][I 2023-11-22 20:08:40,015] Trial 46 finished with value: 2.5244349412715206 and parameters: {'model_name': 'SimpleImputer', 'strategy': 'most_frequent'}. Best is trial 5 with value: 2.354732743906972.
                                                                                    Best trial: 5. Best value: 2.35473:   8%|▊         | 15/200 [00:10<00:48,  3.82it/s]Best trial: 5. Best value: 2.35473:   8%|▊         | 15/200 [00:10<00:48,  3.82it/s]Best trial: 5. Best value: 2.35473:   8%|▊         | 16/200 [00:10<00:43,  4.21it/s]Best trial: 5. Best value: 2.35473:   8%|▊         | 16/200 [00:10<01:58,  1.56it/s]
failed on 
tpot2_imputetest/Impute_Experiments/logs//tpot2_base_normal_6_0.3_MNAR_3
SimpleImputer.__init__() got an unexpected keyword argument 'estimator'
Traceback (most recent call last):
  File "/common/ketrong/AutoImputeExp/tpot2_imputetest/Impute_Experiments/utils.py", line 178, in loop_through_tasks
    AutoImputeSpace.fit(X_train_pandas)
  File "/common/ketrong/AutoImputeExp/tpot2_imputetest/Impute_Experiments/autoimpute.py", line 60, in fit
    self.study.optimize(obj, n_trials=self.n_trials, n_jobs=self.n_jobs, show_progress_bar=self.show_progress, gc_after_trial=self.garbage_collect)
  File "/home/ketrong/miniconda3/envs/tpot2devenv/lib/python3.10/site-packages/optuna/study/study.py", line 451, in optimize
    _optimize(
  File "/home/ketrong/miniconda3/envs/tpot2devenv/lib/python3.10/site-packages/optuna/study/_optimize.py", line 103, in _optimize
    f.result()
  File "/home/ketrong/miniconda3/envs/tpot2devenv/lib/python3.10/concurrent/futures/_base.py", line 451, in result
    return self.__get_result()
  File "/home/ketrong/miniconda3/envs/tpot2devenv/lib/python3.10/concurrent/futures/_base.py", line 403, in __get_result
    raise self._exception
  File "/home/ketrong/miniconda3/envs/tpot2devenv/lib/python3.10/concurrent/futures/thread.py", line 58, in run
    result = self.fn(*self.args, **self.kwargs)
  File "/home/ketrong/miniconda3/envs/tpot2devenv/lib/python3.10/site-packages/optuna/study/_optimize.py", line 163, in _optimize_sequential
    frozen_trial = _run_trial(study, func, catch)
  File "/home/ketrong/miniconda3/envs/tpot2devenv/lib/python3.10/site-packages/optuna/study/_optimize.py", line 251, in _run_trial
    raise func_err
  File "/home/ketrong/miniconda3/envs/tpot2devenv/lib/python3.10/site-packages/optuna/study/_optimize.py", line 200, in _run_trial
    value_or_values = func(trial)
  File "/common/ketrong/AutoImputeExp/tpot2_imputetest/Impute_Experiments/autoimpute.py", line 57, in obj
    my_model = autoutils.MyModel(random_state = self.random_state, **my_params)
  File "/common/ketrong/AutoImputeExp/tpot2_imputetest/Impute_Experiments/autoutils.py", line 34, in MyModel
    this_model = SimpleImputer(
TypeError: SimpleImputer.__init__() got an unexpected keyword argument 'estimator'

DONE
