[I 2023-11-21 09:55:22,392] Trial 20 finished with value: inf and parameters: {'model_name': 'KNNImputer', 'weights': 'distance', 'keep_empty_features': False}. Best is trial 0 with value: inf.
[I 2023-11-21 09:55:22,664] Trial 24 finished with value: inf and parameters: {'model_name': 'KNNImputer', 'weights': 'uniform', 'keep_empty_features': True}. Best is trial 0 with value: inf.
[I 2023-11-21 09:55:22,892] Trial 11 finished with value: inf and parameters: {'model_name': 'GAIN', 'batch_size': 841, 'hint_rate': 0.004013782092512062, 'alpha': 90, 'iterations': 83081}. Best is trial 0 with value: inf.
[I 2023-11-21 09:55:23,104] Trial 23 finished with value: inf and parameters: {'model_name': 'KNNImputer', 'weights': 'uniform', 'keep_empty_features': True}. Best is trial 0 with value: inf.
[I 2023-11-21 09:55:23,451] Trial 47 finished with value: inf and parameters: {'model_name': 'KNNImputer', 'weights': 'uniform', 'keep_empty_features': True}. Best is trial 0 with value: inf.
[I 2023-11-21 09:55:23,701] Trial 35 finished with value: inf and parameters: {'model_name': 'KNNImputer', 'weights': 'uniform', 'keep_empty_features': False}. Best is trial 0 with value: inf.
[I 2023-11-21 09:55:23,933] Trial 19 finished with value: inf and parameters: {'model_name': 'GAIN', 'batch_size': 4, 'hint_rate': 0.2564300304503402, 'alpha': 80, 'iterations': 53086}. Best is trial 0 with value: inf.
[I 2023-11-21 09:55:24,188] Trial 33 finished with value: inf and parameters: {'model_name': 'KNNImputer', 'weights': 'uniform', 'keep_empty_features': True}. Best is trial 0 with value: inf.
[I 2023-11-21 09:55:24,424] Trial 41 finished with value: inf and parameters: {'model_name': 'KNNImputer', 'weights': 'distance', 'keep_empty_features': True}. Best is trial 0 with value: inf.
[I 2023-11-21 09:55:24,670] Trial 37 finished with value: inf and parameters: {'model_name': 'KNNImputer', 'weights': 'distance', 'keep_empty_features': False}. Best is trial 0 with value: inf.
[I 2023-11-21 09:55:24,935] Trial 25 finished with value: inf and parameters: {'model_name': 'GAIN', 'batch_size': 124, 'hint_rate': 0.037012618284224995, 'alpha': 97, 'iterations': 8526}. Best is trial 0 with value: inf.
[I 2023-11-21 09:55:25,167] Trial 18 finished with value: inf and parameters: {'model_name': 'GAIN', 'batch_size': 17, 'hint_rate': 0.004005077485381599, 'alpha': 98, 'iterations': 2085}. Best is trial 0 with value: inf.
[I 2023-11-21 09:55:25,404] Trial 39 finished with value: inf and parameters: {'model_name': 'KNNImputer', 'weights': 'distance', 'keep_empty_features': False}. Best is trial 0 with value: inf.
[I 2023-11-21 09:55:25,653] Trial 17 finished with value: inf and parameters: {'model_name': 'GAIN', 'batch_size': 29, 'hint_rate': 0.05360676623295205, 'alpha': 43, 'iterations': 746}. Best is trial 0 with value: inf.
[I 2023-11-21 09:55:25,874] Trial 27 finished with value: inf and parameters: {'model_name': 'GAIN', 'batch_size': 371, 'hint_rate': 0.24401431063159842, 'alpha': 28, 'iterations': 70157}. Best is trial 0 with value: inf.
[I 2023-11-21 09:55:26,104] Trial 3 finished with value: 2.4377653592222113 and parameters: {'model_name': 'SimpleImputer', 'strategy': 'mean'}. Best is trial 3 with value: 2.4377653592222113.
[I 2023-11-21 09:55:26,343] Trial 38 finished with value: inf and parameters: {'model_name': 'KNNImputer', 'weights': 'distance', 'keep_empty_features': True}. Best is trial 3 with value: 2.4377653592222113.
[I 2023-11-21 09:55:26,601] Trial 40 finished with value: inf and parameters: {'model_name': 'GAIN', 'batch_size': 434, 'hint_rate': 0.014492331585691994, 'alpha': 45, 'iterations': 2911}. Best is trial 3 with value: 2.4377653592222113.
[I 2023-11-21 09:55:27,006] Trial 45 finished with value: inf and parameters: {'model_name': 'KNNImputer', 'weights': 'distance', 'keep_empty_features': False}. Best is trial 3 with value: 2.4377653592222113.
[I 2023-11-21 09:55:27,498] Trial 44 finished with value: inf and parameters: {'model_name': 'GAIN', 'batch_size': 461, 'hint_rate': 0.7420416256216246, 'alpha': 3, 'iterations': 60}. Best is trial 3 with value: 2.4377653592222113.
[I 2023-11-21 09:55:27,792] Trial 36 finished with value: inf and parameters: {'model_name': 'GAIN', 'batch_size': 3, 'hint_rate': 0.46308905554208696, 'alpha': 82, 'iterations': 149}. Best is trial 3 with value: 2.4377653592222113.
[I 2023-11-21 09:55:28,225] Trial 28 finished with value: inf and parameters: {'model_name': 'GAIN', 'batch_size': 1, 'hint_rate': 0.49534352807333415, 'alpha': 79, 'iterations': 81236}. Best is trial 3 with value: 2.4377653592222113.
[I 2023-11-21 09:55:28,624] Trial 48 finished with value: inf and parameters: {'model_name': 'KNNImputer', 'weights': 'uniform', 'keep_empty_features': True}. Best is trial 3 with value: 2.4377653592222113.
[I 2023-11-21 09:55:28,884] Trial 49 finished with value: inf and parameters: {'model_name': 'GAIN', 'batch_size': 3, 'hint_rate': 0.6923006145762236, 'alpha': 93, 'iterations': 221}. Best is trial 3 with value: 2.4377653592222113.
[I 2023-11-21 09:55:29,421] Trial 21 finished with value: inf and parameters: {'model_name': 'IterativeImputer', 'estimator': 'KNN', 'sample_posterior': True, 'initial_strategy': 'mean', 'imputation_order': 'ascending'}. Best is trial 3 with value: 2.4377653592222113.
[I 2023-11-21 09:55:29,753] Trial 51 finished with value: inf and parameters: {'model_name': 'IterativeImputer', 'estimator': 'Ridge', 'sample_posterior': True, 'initial_strategy': 'constant', 'imputation_order': 'roman'}. Best is trial 3 with value: 2.4377653592222113.
[I 2023-11-21 09:55:30,073] Trial 30 finished with value: 5.560524773767352 and parameters: {'model_name': 'SimpleImputer', 'strategy': 'constant'}. Best is trial 3 with value: 2.4377653592222113.
[I 2023-11-21 09:55:30,643] Trial 10 finished with value: 2.4829332831926276 and parameters: {'model_name': 'SimpleImputer', 'strategy': 'median'}. Best is trial 3 with value: 2.4377653592222113.
[I 2023-11-21 09:55:30,949] Trial 1 finished with value: 2.4829332831926276 and parameters: {'model_name': 'SimpleImputer', 'strategy': 'median'}. Best is trial 3 with value: 2.4377653592222113.
[I 2023-11-21 09:55:31,364] Trial 50 finished with value: inf and parameters: {'model_name': 'IterativeImputer', 'estimator': 'Ridge', 'sample_posterior': True, 'initial_strategy': 'most_frequent', 'imputation_order': 'roman'}. Best is trial 3 with value: 2.4377653592222113.
[I 2023-11-21 09:55:31,617] Trial 16 finished with value: 5.560524773767352 and parameters: {'model_name': 'SimpleImputer', 'strategy': 'constant'}. Best is trial 3 with value: 2.4377653592222113.
[I 2023-11-21 09:55:32,027] Trial 22 finished with value: 2.4377653592222113 and parameters: {'model_name': 'SimpleImputer', 'strategy': 'mean'}. Best is trial 3 with value: 2.4377653592222113.
[I 2023-11-21 09:55:32,557] Trial 43 finished with value: 2.4377653592222113 and parameters: {'model_name': 'SimpleImputer', 'strategy': 'mean'}. Best is trial 3 with value: 2.4377653592222113.
[I 2023-11-21 09:55:33,022] Trial 31 finished with value: inf and parameters: {'model_name': 'IterativeImputer', 'estimator': 'KNN', 'sample_posterior': True, 'initial_strategy': 'most_frequent', 'imputation_order': 'ascending'}. Best is trial 3 with value: 2.4377653592222113.
[I 2023-11-21 09:55:33,601] Trial 61 finished with value: 2.4377653592222113 and parameters: {'model_name': 'SimpleImputer', 'strategy': 'mean'}. Best is trial 3 with value: 2.4377653592222113.
[I 2023-11-21 09:55:33,803] Trial 65 finished with value: 2.4377653592222113 and parameters: {'model_name': 'SimpleImputer', 'strategy': 'mean'}. Best is trial 3 with value: 2.4377653592222113.
[I 2023-11-21 09:55:34,279] Trial 64 finished with value: 2.4377653592222113 and parameters: {'model_name': 'SimpleImputer', 'strategy': 'mean'}. Best is trial 3 with value: 2.4377653592222113.
[I 2023-11-21 09:55:34,561] Trial 68 finished with value: 2.4377653592222113 and parameters: {'model_name': 'SimpleImputer', 'strategy': 'mean'}. Best is trial 3 with value: 2.4377653592222113.
[I 2023-11-21 09:55:34,792] Trial 60 finished with value: 2.4377653592222113 and parameters: {'model_name': 'SimpleImputer', 'strategy': 'mean'}. Best is trial 3 with value: 2.4377653592222113.
[I 2023-11-21 09:55:35,074] Trial 70 finished with value: 2.4377653592222113 and parameters: {'model_name': 'SimpleImputer', 'strategy': 'mean'}. Best is trial 3 with value: 2.4377653592222113.
[I 2023-11-21 09:55:35,282] Trial 62 finished with value: 2.4377653592222113 and parameters: {'model_name': 'SimpleImputer', 'strategy': 'mean'}. Best is trial 3 with value: 2.4377653592222113.
[I 2023-11-21 09:55:35,569] Trial 63 finished with value: 2.4377653592222113 and parameters: {'model_name': 'SimpleImputer', 'strategy': 'mean'}. Best is trial 3 with value: 2.4377653592222113.
[I 2023-11-21 09:55:35,834] Trial 54 finished with value: 2.4377653592222113 and parameters: {'model_name': 'SimpleImputer', 'strategy': 'mean'}. Best is trial 3 with value: 2.4377653592222113.
[I 2023-11-21 09:55:36,191] Trial 66 finished with value: 2.4377653592222113 and parameters: {'model_name': 'SimpleImputer', 'strategy': 'mean'}. Best is trial 3 with value: 2.4377653592222113.
[I 2023-11-21 09:55:36,645] Trial 72 finished with value: 2.4377653592222113 and parameters: {'model_name': 'SimpleImputer', 'strategy': 'mean'}. Best is trial 3 with value: 2.4377653592222113.
[I 2023-11-21 09:55:36,842] Trial 73 finished with value: 2.4377653592222113 and parameters: {'model_name': 'SimpleImputer', 'strategy': 'mean'}. Best is trial 3 with value: 2.4377653592222113.
[I 2023-11-21 09:55:37,027] Trial 67 finished with value: 2.4377653592222113 and parameters: {'model_name': 'SimpleImputer', 'strategy': 'mean'}. Best is trial 3 with value: 2.4377653592222113.
[I 2023-11-21 09:55:37,345] Trial 75 finished with value: 2.4377653592222113 and parameters: {'model_name': 'SimpleImputer', 'strategy': 'mean'}. Best is trial 3 with value: 2.4377653592222113.
[I 2023-11-21 09:55:37,706] Trial 74 finished with value: 2.4377653592222113 and parameters: {'model_name': 'SimpleImputer', 'strategy': 'mean'}. Best is trial 3 with value: 2.4377653592222113.
[I 2023-11-21 09:55:38,044] Trial 71 finished with value: 2.4377653592222113 and parameters: {'model_name': 'SimpleImputer', 'strategy': 'mean'}. Best is trial 3 with value: 2.4377653592222113.
[I 2023-11-21 09:55:38,409] Trial 69 finished with value: 2.4377653592222113 and parameters: {'model_name': 'SimpleImputer', 'strategy': 'mean'}. Best is trial 3 with value: 2.4377653592222113.
[I 2023-11-21 09:55:38,696] Trial 78 finished with value: 2.4377653592222113 and parameters: {'model_name': 'SimpleImputer', 'strategy': 'mean'}. Best is trial 3 with value: 2.4377653592222113.
[I 2023-11-21 09:55:38,993] Trial 80 finished with value: 2.4377653592222113 and parameters: {'model_name': 'SimpleImputer', 'strategy': 'mean'}. Best is trial 3 with value: 2.4377653592222113.
[I 2023-11-21 09:55:39,216] Trial 83 finished with value: 2.4377653592222113 and parameters: {'model_name': 'SimpleImputer', 'strategy': 'mean'}. Best is trial 3 with value: 2.4377653592222113.
[I 2023-11-21 09:55:39,453] Trial 76 finished with value: 2.4377653592222113 and parameters: {'model_name': 'SimpleImputer', 'strategy': 'mean'}. Best is trial 3 with value: 2.4377653592222113.
[I 2023-11-21 09:55:39,730] Trial 77 finished with value: 2.4377653592222113 and parameters: {'model_name': 'SimpleImputer', 'strategy': 'mean'}. Best is trial 3 with value: 2.4377653592222113.
[I 2023-11-21 09:55:40,152] Trial 79 finished with value: 2.4377653592222113 and parameters: {'model_name': 'SimpleImputer', 'strategy': 'mean'}. Best is trial 3 with value: 2.4377653592222113.
[I 2023-11-21 09:55:40,481] Trial 82 finished with value: 2.4377653592222113 and parameters: {'model_name': 'SimpleImputer', 'strategy': 'mean'}. Best is trial 3 with value: 2.4377653592222113.
[I 2023-11-21 09:55:40,782] Trial 81 finished with value: 2.4377653592222113 and parameters: {'model_name': 'SimpleImputer', 'strategy': 'mean'}. Best is trial 3 with value: 2.4377653592222113.
[I 2023-11-21 09:55:41,917] Trial 89 finished with value: 2.4377653592222113 and parameters: {'model_name': 'SimpleImputer', 'strategy': 'mean'}. Best is trial 3 with value: 2.4377653592222113.
[I 2023-11-21 09:55:42,307] Trial 90 finished with value: 2.4377653592222113 and parameters: {'model_name': 'SimpleImputer', 'strategy': 'mean'}. Best is trial 3 with value: 2.4377653592222113.
[I 2023-11-21 09:55:42,827] Trial 86 finished with value: 2.4829332831926276 and parameters: {'model_name': 'SimpleImputer', 'strategy': 'median'}. Best is trial 3 with value: 2.4377653592222113.
[I 2023-11-21 09:55:43,042] Trial 92 finished with value: 2.4377653592222113 and parameters: {'model_name': 'SimpleImputer', 'strategy': 'mean'}. Best is trial 3 with value: 2.4377653592222113.
[I 2023-11-21 09:55:43,412] Trial 87 finished with value: 2.4829332831926276 and parameters: {'model_name': 'SimpleImputer', 'strategy': 'median'}. Best is trial 3 with value: 2.4377653592222113.
[I 2023-11-21 09:55:43,653] Trial 91 finished with value: 2.4377653592222113 and parameters: {'model_name': 'SimpleImputer', 'strategy': 'mean'}. Best is trial 3 with value: 2.4377653592222113.
[I 2023-11-21 09:55:44,030] Trial 93 finished with value: 2.4377653592222113 and parameters: {'model_name': 'SimpleImputer', 'strategy': 'mean'}. Best is trial 3 with value: 2.4377653592222113.
[I 2023-11-21 09:55:44,459] Trial 95 finished with value: 2.4377653592222113 and parameters: {'model_name': 'SimpleImputer', 'strategy': 'mean'}. Best is trial 3 with value: 2.4377653592222113.
[I 2023-11-21 09:55:44,460] Trial 85 finished with value: 2.4829332831926276 and parameters: {'model_name': 'SimpleImputer', 'strategy': 'median'}. Best is trial 3 with value: 2.4377653592222113.
[I 2023-11-21 09:55:45,138] Trial 97 finished with value: 2.4377653592222113 and parameters: {'model_name': 'SimpleImputer', 'strategy': 'mean'}. Best is trial 3 with value: 2.4377653592222113.
[I 2023-11-21 09:55:45,380] Trial 88 finished with value: 2.4829332831926276 and parameters: {'model_name': 'SimpleImputer', 'strategy': 'median'}. Best is trial 3 with value: 2.4377653592222113.
[I 2023-11-21 09:55:45,627] Trial 96 finished with value: 2.4377653592222113 and parameters: {'model_name': 'SimpleImputer', 'strategy': 'mean'}. Best is trial 3 with value: 2.4377653592222113.
[I 2023-11-21 09:55:46,011] Trial 94 finished with value: 2.4377653592222113 and parameters: {'model_name': 'SimpleImputer', 'strategy': 'mean'}. Best is trial 3 with value: 2.4377653592222113.
[I 2023-11-21 09:55:46,266] Trial 84 finished with value: 2.4829332831926276 and parameters: {'model_name': 'SimpleImputer', 'strategy': 'median'}. Best is trial 3 with value: 2.4377653592222113.
[I 2023-11-21 09:55:49,204] Trial 29 finished with value: 2.6155244430074847 and parameters: {'model_name': 'SimpleImputer', 'strategy': 'most_frequent'}. Best is trial 3 with value: 2.4377653592222113.
[I 2023-11-21 09:55:49,915] Trial 55 finished with value: 2.6155244430074847 and parameters: {'model_name': 'SimpleImputer', 'strategy': 'most_frequent'}. Best is trial 3 with value: 2.4377653592222113.
[I 2023-11-21 09:55:50,263] Trial 53 finished with value: 2.6155244430074847 and parameters: {'model_name': 'SimpleImputer', 'strategy': 'most_frequent'}. Best is trial 3 with value: 2.4377653592222113.
[I 2023-11-21 09:55:50,525] Trial 52 finished with value: 2.6155244430074847 and parameters: {'model_name': 'SimpleImputer', 'strategy': 'most_frequent'}. Best is trial 3 with value: 2.4377653592222113.
[I 2023-11-21 09:55:51,933] Trial 58 finished with value: 2.6155244430074847 and parameters: {'model_name': 'SimpleImputer', 'strategy': 'most_frequent'}. Best is trial 3 with value: 2.4377653592222113.
[I 2023-11-21 09:55:54,804] Trial 100 finished with value: 2.6155244430074847 and parameters: {'model_name': 'SimpleImputer', 'strategy': 'most_frequent'}. Best is trial 3 with value: 2.4377653592222113.
[I 2023-11-21 09:55:55,988] Trial 115 finished with value: 2.6155244430074847 and parameters: {'model_name': 'SimpleImputer', 'strategy': 'most_frequent'}. Best is trial 3 with value: 2.4377653592222113.
[I 2023-11-21 09:55:56,169] Trial 98 finished with value: 2.6155244430074847 and parameters: {'model_name': 'SimpleImputer', 'strategy': 'most_frequent'}. Best is trial 3 with value: 2.4377653592222113.
[I 2023-11-21 09:55:56,829] Trial 114 finished with value: 2.6155244430074847 and parameters: {'model_name': 'SimpleImputer', 'strategy': 'most_frequent'}. Best is trial 3 with value: 2.4377653592222113.
[I 2023-11-21 09:55:57,113] Trial 108 finished with value: 2.6155244430074847 and parameters: {'model_name': 'SimpleImputer', 'strategy': 'most_frequent'}. Best is trial 3 with value: 2.4377653592222113.
[I 2023-11-21 09:55:57,554] Trial 101 finished with value: 2.6155244430074847 and parameters: {'model_name': 'SimpleImputer', 'strategy': 'most_frequent'}. Best is trial 3 with value: 2.4377653592222113.
[I 2023-11-21 09:55:58,320] Trial 102 finished with value: 2.6155244430074847 and parameters: {'model_name': 'SimpleImputer', 'strategy': 'most_frequent'}. Best is trial 3 with value: 2.4377653592222113.
[I 2023-11-21 09:55:58,877] Trial 110 finished with value: 2.6155244430074847 and parameters: {'model_name': 'SimpleImputer', 'strategy': 'most_frequent'}. Best is trial 3 with value: 2.4377653592222113.
[I 2023-11-21 09:55:59,160] Trial 104 finished with value: 2.6155244430074847 and parameters: {'model_name': 'SimpleImputer', 'strategy': 'most_frequent'}. Best is trial 3 with value: 2.4377653592222113.
[I 2023-11-21 09:55:59,519] Trial 105 finished with value: 2.6155244430074847 and parameters: {'model_name': 'SimpleImputer', 'strategy': 'most_frequent'}. Best is trial 3 with value: 2.4377653592222113.
[I 2023-11-21 09:55:59,787] Trial 103 finished with value: 2.6155244430074847 and parameters: {'model_name': 'SimpleImputer', 'strategy': 'most_frequent'}. Best is trial 3 with value: 2.4377653592222113.
[I 2023-11-21 09:55:59,999] Trial 111 finished with value: 2.6155244430074847 and parameters: {'model_name': 'SimpleImputer', 'strategy': 'most_frequent'}. Best is trial 3 with value: 2.4377653592222113.
[I 2023-11-21 09:56:00,269] Trial 99 finished with value: 2.6155244430074847 and parameters: {'model_name': 'SimpleImputer', 'strategy': 'most_frequent'}. Best is trial 3 with value: 2.4377653592222113.
[I 2023-11-21 09:56:00,534] Trial 112 finished with value: 2.6155244430074847 and parameters: {'model_name': 'SimpleImputer', 'strategy': 'most_frequent'}. Best is trial 3 with value: 2.4377653592222113.
[I 2023-11-21 09:56:00,921] Trial 106 finished with value: 2.6155244430074847 and parameters: {'model_name': 'SimpleImputer', 'strategy': 'most_frequent'}. Best is trial 3 with value: 2.4377653592222113.
[I 2023-11-21 09:56:01,420] Trial 113 finished with value: 2.6155244430074847 and parameters: {'model_name': 'SimpleImputer', 'strategy': 'most_frequent'}. Best is trial 3 with value: 2.4377653592222113.
[I 2023-11-21 09:56:01,422] Trial 107 finished with value: 2.6155244430074847 and parameters: {'model_name': 'SimpleImputer', 'strategy': 'most_frequent'}. Best is trial 3 with value: 2.4377653592222113.
[I 2023-11-21 09:56:02,063] Trial 109 finished with value: 2.6155244430074847 and parameters: {'model_name': 'SimpleImputer', 'strategy': 'most_frequent'}. Best is trial 3 with value: 2.4377653592222113.
[I 2023-11-21 09:56:02,638] Trial 116 finished with value: 2.6155244430074847 and parameters: {'model_name': 'SimpleImputer', 'strategy': 'most_frequent'}. Best is trial 3 with value: 2.4377653592222113.
[I 2023-11-21 09:56:03,009] Trial 120 finished with value: 2.6155244430074847 and parameters: {'model_name': 'SimpleImputer', 'strategy': 'most_frequent'}. Best is trial 3 with value: 2.4377653592222113.
[I 2023-11-21 09:56:03,209] Trial 119 finished with value: 2.6155244430074847 and parameters: {'model_name': 'SimpleImputer', 'strategy': 'most_frequent'}. Best is trial 3 with value: 2.4377653592222113.
[I 2023-11-21 09:56:03,968] Trial 118 finished with value: 2.6155244430074847 and parameters: {'model_name': 'SimpleImputer', 'strategy': 'most_frequent'}. Best is trial 3 with value: 2.4377653592222113.
[I 2023-11-21 09:56:04,734] Trial 117 finished with value: 2.6155244430074847 and parameters: {'model_name': 'SimpleImputer', 'strategy': 'most_frequent'}. Best is trial 3 with value: 2.4377653592222113.
[I 2023-11-21 09:56:11,559] Trial 14 finished with value: inf and parameters: {'model_name': 'IterativeImputer', 'estimator': 'RFR', 'sample_posterior': True, 'initial_strategy': 'median', 'imputation_order': 'descending'}. Best is trial 3 with value: 2.4377653592222113.
[I 2023-11-21 09:56:55,113] Trial 59 finished with value: inf and parameters: {'model_name': 'IterativeImputer', 'estimator': 'RFR', 'sample_posterior': True, 'initial_strategy': 'constant', 'imputation_order': 'arabic'}. Best is trial 3 with value: 2.4377653592222113.
[I 2023-11-21 09:57:45,927] Trial 46 finished with value: inf and parameters: {'model_name': 'IterativeImputer', 'estimator': 'RFR', 'sample_posterior': True, 'initial_strategy': 'median', 'imputation_order': 'random'}. Best is trial 3 with value: 2.4377653592222113.
[I 2023-11-21 09:59:14,708] Trial 122 finished with value: 2.2926978761938797 and parameters: {'model_name': 'IterativeImputer', 'estimator': 'Bayesian', 'sample_posterior': False, 'initial_strategy': 'median', 'imputation_order': 'random'}. Best is trial 122 with value: 2.2926978761938797.
[I 2023-11-21 09:59:17,303] Trial 121 finished with value: 2.4031459796934556 and parameters: {'model_name': 'IterativeImputer', 'estimator': 'Bayesian', 'sample_posterior': False, 'initial_strategy': 'median', 'imputation_order': 'descending'}. Best is trial 122 with value: 2.2926978761938797.
