Run: 7
/cm/local/apps/slurm/var/spool/job437561/slurm_script: line 23: /common/ketrong/minconda3/etc/profile.d/conda.sh: No such file or directory
/cm/local/apps/slurm/var/spool/job437561/slurm_script: line 26: $'\nconda create --name tpot2devenv -c conda-forge python=3.10\n': command not found
/cm/local/apps/slurm/var/spool/job437561/slurm_script: line 31: $'\npip install -r requirements.txt\n': command not found
RunStart
2023-12-07 16:14:14.127230: I tensorflow/core/util/port.cc:113] oneDNN custom operations are on. You may see slightly different numerical results due to floating-point round-off errors from different computation orders. To turn them off, set the environment variable `TF_ENABLE_ONEDNN_OPTS=0`.
2023-12-07 16:14:14.161798: E external/local_xla/xla/stream_executor/cuda/cuda_dnn.cc:9261] Unable to register cuDNN factory: Attempting to register factory for plugin cuDNN when one has already been registered
2023-12-07 16:14:14.161823: E external/local_xla/xla/stream_executor/cuda/cuda_fft.cc:607] Unable to register cuFFT factory: Attempting to register factory for plugin cuFFT when one has already been registered
2023-12-07 16:14:14.162960: E external/local_xla/xla/stream_executor/cuda/cuda_blas.cc:1515] Unable to register cuBLAS factory: Attempting to register factory for plugin cuBLAS when one has already been registered
2023-12-07 16:14:14.168492: I tensorflow/core/platform/cpu_feature_guard.cc:182] This TensorFlow binary is optimized to use available CPU instructions in performance-critical operations.
To enable the following instructions: AVX2 AVX512F AVX512_VNNI FMA, in other operations, rebuild TensorFlow with the appropriate compiler flags.
2023-12-07 16:14:17.433602: W tensorflow/compiler/tf2tensorrt/utils/py_utils.cc:38] TF-TRT Warning: Could not find TensorRT
WARNING:tensorflow:From /home/ketrong/miniconda3/envs/tpot2devenv/lib/python3.10/site-packages/tensorflow/python/compat/v2_compat.py:108: disable_resource_variables (from tensorflow.python.ops.variable_scope) is deprecated and will be removed in a future version.
Instructions for updating:
non-resource variables are not supported in the long term
starting loops
loc 1
loc2
loc4
loc5
loc6
working on 
tpot2_imputetest/Impute_Experiments/logs/tpot2_base_normal_30_0.1_MAR
1.3069441318511963
loading data
tpot2_imputetest/Impute_Experiments/data/30_True.pkl
running experiment 1/3 - Does large hyperparameter space improve reconstruction accuracy over simple
[I 2023-12-07 16:14:33,571] A new study created in memory with name: no-name-a4bece7e-942f-4a28-a99a-c1924be30bd7
[I 2023-12-07 16:14:33,587] Trial 0 finished with value: 365.05676727608045 and parameters: {'model_name': 'SimpleImputer', 'strategy': 'constant'}. Best is trial 0 with value: 365.05676727608045.
[I 2023-12-07 16:14:33,901] Trial 2 finished with value: 353.47606649057724 and parameters: {'model_name': 'SimpleImputer', 'strategy': 'mean'}. Best is trial 2 with value: 353.47606649057724.
[I 2023-12-07 16:14:34,168] Trial 1 finished with value: 319.8489387027031 and parameters: {'model_name': 'SimpleImputer', 'strategy': 'median'}. Best is trial 1 with value: 319.8489387027031.
[I 2023-12-07 16:14:34,400] Trial 10 finished with value: 365.05676727608045 and parameters: {'model_name': 'SimpleImputer', 'strategy': 'constant'}. Best is trial 1 with value: 319.8489387027031.
[I 2023-12-07 16:14:34,624] Trial 5 finished with value: 319.8489387027031 and parameters: {'model_name': 'SimpleImputer', 'strategy': 'median'}. Best is trial 1 with value: 319.8489387027031.
[I 2023-12-07 16:14:34,867] Trial 15 finished with value: 365.05676727608045 and parameters: {'model_name': 'SimpleImputer', 'strategy': 'constant'}. Best is trial 1 with value: 319.8489387027031.
[I 2023-12-07 16:14:35,088] Trial 7 finished with value: 353.47606649057724 and parameters: {'model_name': 'SimpleImputer', 'strategy': 'mean'}. Best is trial 1 with value: 319.8489387027031.
[I 2023-12-07 16:14:35,303] Trial 3 finished with value: 319.8489387027031 and parameters: {'model_name': 'SimpleImputer', 'strategy': 'median'}. Best is trial 1 with value: 319.8489387027031.
[I 2023-12-07 16:14:35,308] Trial 9 finished with value: 353.47606649057724 and parameters: {'model_name': 'SimpleImputer', 'strategy': 'mean'}. Best is trial 1 with value: 319.8489387027031.
[I 2023-12-07 16:14:35,530] Trial 13 finished with value: 365.05676727608045 and parameters: {'model_name': 'SimpleImputer', 'strategy': 'constant'}. Best is trial 1 with value: 319.8489387027031.
[I 2023-12-07 16:14:35,532] Trial 4 finished with value: 319.8489387027031 and parameters: {'model_name': 'SimpleImputer', 'strategy': 'median'}. Best is trial 1 with value: 319.8489387027031.
[I 2023-12-07 16:14:35,541] Trial 17 finished with value: 365.05676727608045 and parameters: {'model_name': 'SimpleImputer', 'strategy': 'constant'}. Best is trial 1 with value: 319.8489387027031.
[I 2023-12-07 16:14:35,541] Trial 6 finished with value: 319.8489387027031 and parameters: {'model_name': 'SimpleImputer', 'strategy': 'median'}. Best is trial 1 with value: 319.8489387027031.
[I 2023-12-07 16:14:35,542] Trial 22 finished with value: 365.05676727608045 and parameters: {'model_name': 'SimpleImputer', 'strategy': 'constant'}. Best is trial 1 with value: 319.8489387027031.
[I 2023-12-07 16:14:35,550] Trial 8 finished with value: 363.15048628092006 and parameters: {'model_name': 'SimpleImputer', 'strategy': 'most_frequent'}. Best is trial 1 with value: 319.8489387027031.
[I 2023-12-07 16:14:35,552] Trial 21 finished with value: 353.47606649057724 and parameters: {'model_name': 'SimpleImputer', 'strategy': 'mean'}. Best is trial 1 with value: 319.8489387027031.
[I 2023-12-07 16:14:36,210] Trial 14 finished with value: 319.8489387027031 and parameters: {'model_name': 'SimpleImputer', 'strategy': 'median'}. Best is trial 1 with value: 319.8489387027031.
[I 2023-12-07 16:14:36,217] Trial 20 finished with value: 353.47606649057724 and parameters: {'model_name': 'SimpleImputer', 'strategy': 'mean'}. Best is trial 1 with value: 319.8489387027031.
[I 2023-12-07 16:14:36,217] Trial 16 finished with value: 365.05676727608045 and parameters: {'model_name': 'SimpleImputer', 'strategy': 'constant'}. Best is trial 1 with value: 319.8489387027031.
[I 2023-12-07 16:14:36,460] Trial 19 finished with value: 319.8489387027031 and parameters: {'model_name': 'SimpleImputer', 'strategy': 'median'}. Best is trial 1 with value: 319.8489387027031.
[I 2023-12-07 16:14:36,466] Trial 12 finished with value: 363.15048628092006 and parameters: {'model_name': 'SimpleImputer', 'strategy': 'most_frequent'}. Best is trial 1 with value: 319.8489387027031.
[I 2023-12-07 16:14:36,695] Trial 23 finished with value: 319.8489387027031 and parameters: {'model_name': 'SimpleImputer', 'strategy': 'median'}. Best is trial 1 with value: 319.8489387027031.
[I 2023-12-07 16:14:36,908] Trial 25 finished with value: 319.8489387027031 and parameters: {'model_name': 'SimpleImputer', 'strategy': 'median'}. Best is trial 1 with value: 319.8489387027031.
[I 2023-12-07 16:14:37,547] Trial 18 finished with value: 363.15048628092006 and parameters: {'model_name': 'SimpleImputer', 'strategy': 'most_frequent'}. Best is trial 1 with value: 319.8489387027031.
[I 2023-12-07 16:14:37,550] Trial 11 finished with value: 363.15048628092006 and parameters: {'model_name': 'SimpleImputer', 'strategy': 'most_frequent'}. Best is trial 1 with value: 319.8489387027031.
[I 2023-12-07 16:14:39,053] Trial 27 finished with value: 319.8489387027031 and parameters: {'model_name': 'SimpleImputer', 'strategy': 'median'}. Best is trial 1 with value: 319.8489387027031.
[I 2023-12-07 16:14:39,493] Trial 24 finished with value: 363.15048628092006 and parameters: {'model_name': 'SimpleImputer', 'strategy': 'most_frequent'}. Best is trial 1 with value: 319.8489387027031.
[I 2023-12-07 16:14:39,734] Trial 29 finished with value: 319.8489387027031 and parameters: {'model_name': 'SimpleImputer', 'strategy': 'median'}. Best is trial 1 with value: 319.8489387027031.
[I 2023-12-07 16:14:39,956] Trial 28 finished with value: 319.8489387027031 and parameters: {'model_name': 'SimpleImputer', 'strategy': 'median'}. Best is trial 1 with value: 319.8489387027031.
[I 2023-12-07 16:14:40,169] Trial 30 finished with value: 319.8489387027031 and parameters: {'model_name': 'SimpleImputer', 'strategy': 'median'}. Best is trial 1 with value: 319.8489387027031.
[I 2023-12-07 16:14:40,448] Trial 35 finished with value: 319.8489387027031 and parameters: {'model_name': 'SimpleImputer', 'strategy': 'median'}. Best is trial 1 with value: 319.8489387027031.
[I 2023-12-07 16:14:40,674] Trial 26 finished with value: 319.8489387027031 and parameters: {'model_name': 'SimpleImputer', 'strategy': 'median'}. Best is trial 1 with value: 319.8489387027031.
[I 2023-12-07 16:14:40,898] Trial 34 finished with value: 319.8489387027031 and parameters: {'model_name': 'SimpleImputer', 'strategy': 'median'}. Best is trial 1 with value: 319.8489387027031.
[I 2023-12-07 16:14:41,114] Trial 37 finished with value: 319.8489387027031 and parameters: {'model_name': 'SimpleImputer', 'strategy': 'median'}. Best is trial 1 with value: 319.8489387027031.
[I 2023-12-07 16:14:41,334] Trial 31 finished with value: 319.8489387027031 and parameters: {'model_name': 'SimpleImputer', 'strategy': 'median'}. Best is trial 1 with value: 319.8489387027031.
[I 2023-12-07 16:14:41,574] Trial 32 finished with value: 319.8489387027031 and parameters: {'model_name': 'SimpleImputer', 'strategy': 'median'}. Best is trial 1 with value: 319.8489387027031.
[I 2023-12-07 16:14:41,794] Trial 39 finished with value: 319.8489387027031 and parameters: {'model_name': 'SimpleImputer', 'strategy': 'median'}. Best is trial 1 with value: 319.8489387027031.
[I 2023-12-07 16:14:42,017] Trial 40 finished with value: 319.8489387027031 and parameters: {'model_name': 'SimpleImputer', 'strategy': 'median'}. Best is trial 1 with value: 319.8489387027031.
[I 2023-12-07 16:14:42,241] Trial 43 finished with value: 319.8489387027031 and parameters: {'model_name': 'SimpleImputer', 'strategy': 'median'}. Best is trial 1 with value: 319.8489387027031.
[I 2023-12-07 16:14:42,465] Trial 45 finished with value: 319.8489387027031 and parameters: {'model_name': 'SimpleImputer', 'strategy': 'median'}. Best is trial 1 with value: 319.8489387027031.
[I 2023-12-07 16:14:42,688] Trial 44 finished with value: 319.8489387027031 and parameters: {'model_name': 'SimpleImputer', 'strategy': 'median'}. Best is trial 1 with value: 319.8489387027031.
[I 2023-12-07 16:14:42,915] Trial 33 finished with value: 319.8489387027031 and parameters: {'model_name': 'SimpleImputer', 'strategy': 'median'}. Best is trial 1 with value: 319.8489387027031.
[I 2023-12-07 16:14:43,150] Trial 50 finished with value: 319.8489387027031 and parameters: {'model_name': 'SimpleImputer', 'strategy': 'median'}. Best is trial 1 with value: 319.8489387027031.
[I 2023-12-07 16:14:43,370] Trial 46 finished with value: 319.8489387027031 and parameters: {'model_name': 'SimpleImputer', 'strategy': 'median'}. Best is trial 1 with value: 319.8489387027031.
[I 2023-12-07 16:14:43,603] Trial 36 finished with value: 319.8489387027031 and parameters: {'model_name': 'SimpleImputer', 'strategy': 'median'}. Best is trial 1 with value: 319.8489387027031.
[I 2023-12-07 16:14:43,821] Trial 52 finished with value: 319.8489387027031 and parameters: {'model_name': 'SimpleImputer', 'strategy': 'median'}. Best is trial 1 with value: 319.8489387027031.
[I 2023-12-07 16:14:44,035] Trial 54 finished with value: 319.8489387027031 and parameters: {'model_name': 'SimpleImputer', 'strategy': 'median'}. Best is trial 1 with value: 319.8489387027031.
[I 2023-12-07 16:14:44,251] Trial 56 finished with value: 319.8489387027031 and parameters: {'model_name': 'SimpleImputer', 'strategy': 'median'}. Best is trial 1 with value: 319.8489387027031.
[I 2023-12-07 16:14:44,466] Trial 55 finished with value: 319.8489387027031 and parameters: {'model_name': 'SimpleImputer', 'strategy': 'median'}. Best is trial 1 with value: 319.8489387027031.
[I 2023-12-07 16:14:44,692] Trial 61 finished with value: 319.8489387027031 and parameters: {'model_name': 'SimpleImputer', 'strategy': 'median'}. Best is trial 1 with value: 319.8489387027031.
[I 2023-12-07 16:14:44,913] Trial 42 finished with value: 319.8489387027031 and parameters: {'model_name': 'SimpleImputer', 'strategy': 'median'}. Best is trial 1 with value: 319.8489387027031.
[I 2023-12-07 16:14:45,138] Trial 41 finished with value: 319.8489387027031 and parameters: {'model_name': 'SimpleImputer', 'strategy': 'median'}. Best is trial 1 with value: 319.8489387027031.
[I 2023-12-07 16:14:45,371] Trial 66 finished with value: 319.8489387027031 and parameters: {'model_name': 'SimpleImputer', 'strategy': 'median'}. Best is trial 1 with value: 319.8489387027031.
[I 2023-12-07 16:14:45,603] Trial 51 finished with value: 319.8489387027031 and parameters: {'model_name': 'SimpleImputer', 'strategy': 'median'}. Best is trial 1 with value: 319.8489387027031.
[I 2023-12-07 16:14:45,831] Trial 71 finished with value: 353.47606649057724 and parameters: {'model_name': 'SimpleImputer', 'strategy': 'mean'}. Best is trial 1 with value: 319.8489387027031.
[I 2023-12-07 16:14:46,072] Trial 69 finished with value: 319.8489387027031 and parameters: {'model_name': 'SimpleImputer', 'strategy': 'median'}. Best is trial 1 with value: 319.8489387027031.
[I 2023-12-07 16:14:46,312] Trial 38 finished with value: 319.8489387027031 and parameters: {'model_name': 'SimpleImputer', 'strategy': 'median'}. Best is trial 1 with value: 319.8489387027031.
[I 2023-12-07 16:14:46,539] Trial 57 finished with value: 319.8489387027031 and parameters: {'model_name': 'SimpleImputer', 'strategy': 'median'}. Best is trial 1 with value: 319.8489387027031.
[I 2023-12-07 16:14:46,765] Trial 59 finished with value: 319.8489387027031 and parameters: {'model_name': 'SimpleImputer', 'strategy': 'median'}. Best is trial 1 with value: 319.8489387027031.
[I 2023-12-07 16:14:47,009] Trial 58 finished with value: 319.8489387027031 and parameters: {'model_name': 'SimpleImputer', 'strategy': 'median'}. Best is trial 1 with value: 319.8489387027031.
[I 2023-12-07 16:14:47,281] Trial 63 finished with value: 319.8489387027031 and parameters: {'model_name': 'SimpleImputer', 'strategy': 'median'}. Best is trial 1 with value: 319.8489387027031.
[I 2023-12-07 16:14:47,514] Trial 60 finished with value: 319.8489387027031 and parameters: {'model_name': 'SimpleImputer', 'strategy': 'median'}. Best is trial 1 with value: 319.8489387027031.
[I 2023-12-07 16:14:47,681] Trial 65 finished with value: 319.8489387027031 and parameters: {'model_name': 'SimpleImputer', 'strategy': 'median'}. Best is trial 1 with value: 319.8489387027031.
[I 2023-12-07 16:14:47,917] Trial 64 finished with value: 319.8489387027031 and parameters: {'model_name': 'SimpleImputer', 'strategy': 'median'}. Best is trial 1 with value: 319.8489387027031.
[I 2023-12-07 16:14:48,140] Trial 80 finished with value: 353.47606649057724 and parameters: {'model_name': 'SimpleImputer', 'strategy': 'mean'}. Best is trial 1 with value: 319.8489387027031.
[I 2023-12-07 16:14:48,363] Trial 74 finished with value: 353.47606649057724 and parameters: {'model_name': 'SimpleImputer', 'strategy': 'mean'}. Best is trial 1 with value: 319.8489387027031.
[I 2023-12-07 16:14:48,544] Trial 70 finished with value: 353.47606649057724 and parameters: {'model_name': 'SimpleImputer', 'strategy': 'mean'}. Best is trial 1 with value: 319.8489387027031.
[I 2023-12-07 16:14:48,776] Trial 47 finished with value: 319.8489387027031 and parameters: {'model_name': 'SimpleImputer', 'strategy': 'median'}. Best is trial 1 with value: 319.8489387027031.
[I 2023-12-07 16:14:48,997] Trial 85 finished with value: 353.47606649057724 and parameters: {'model_name': 'SimpleImputer', 'strategy': 'mean'}. Best is trial 1 with value: 319.8489387027031.
[I 2023-12-07 16:14:49,224] Trial 78 finished with value: 353.47606649057724 and parameters: {'model_name': 'SimpleImputer', 'strategy': 'mean'}. Best is trial 1 with value: 319.8489387027031.
[I 2023-12-07 16:14:49,447] Trial 86 finished with value: 353.47606649057724 and parameters: {'model_name': 'SimpleImputer', 'strategy': 'mean'}. Best is trial 1 with value: 319.8489387027031.
[I 2023-12-07 16:14:49,675] Trial 49 finished with value: 319.8489387027031 and parameters: {'model_name': 'SimpleImputer', 'strategy': 'median'}. Best is trial 1 with value: 319.8489387027031.
[I 2023-12-07 16:14:49,677] Trial 67 finished with value: 319.8489387027031 and parameters: {'model_name': 'SimpleImputer', 'strategy': 'median'}. Best is trial 1 with value: 319.8489387027031.
[I 2023-12-07 16:14:50,141] Trial 53 finished with value: 319.8489387027031 and parameters: {'model_name': 'SimpleImputer', 'strategy': 'median'}. Best is trial 1 with value: 319.8489387027031.
[I 2023-12-07 16:14:50,397] Trial 48 finished with value: 319.8489387027031 and parameters: {'model_name': 'SimpleImputer', 'strategy': 'median'}. Best is trial 1 with value: 319.8489387027031.
[I 2023-12-07 16:14:50,620] Trial 62 finished with value: 319.8489387027031 and parameters: {'model_name': 'SimpleImputer', 'strategy': 'median'}. Best is trial 1 with value: 319.8489387027031.
[I 2023-12-07 16:14:50,898] Trial 84 finished with value: 353.47606649057724 and parameters: {'model_name': 'SimpleImputer', 'strategy': 'mean'}. Best is trial 1 with value: 319.8489387027031.
[I 2023-12-07 16:14:51,128] Trial 81 finished with value: 353.47606649057724 and parameters: {'model_name': 'SimpleImputer', 'strategy': 'mean'}. Best is trial 1 with value: 319.8489387027031.
[I 2023-12-07 16:14:51,349] Trial 77 finished with value: 353.47606649057724 and parameters: {'model_name': 'SimpleImputer', 'strategy': 'mean'}. Best is trial 1 with value: 319.8489387027031.
[I 2023-12-07 16:14:51,591] Trial 91 finished with value: 363.15048628092006 and parameters: {'model_name': 'SimpleImputer', 'strategy': 'most_frequent'}. Best is trial 1 with value: 319.8489387027031.
[I 2023-12-07 16:14:51,592] Trial 73 finished with value: 353.47606649057724 and parameters: {'model_name': 'SimpleImputer', 'strategy': 'mean'}. Best is trial 1 with value: 319.8489387027031.
[I 2023-12-07 16:14:52,075] Trial 92 finished with value: 363.15048628092006 and parameters: {'model_name': 'SimpleImputer', 'strategy': 'most_frequent'}. Best is trial 1 with value: 319.8489387027031.
[I 2023-12-07 16:14:52,302] Trial 93 finished with value: 363.15048628092006 and parameters: {'model_name': 'SimpleImputer', 'strategy': 'most_frequent'}. Best is trial 1 with value: 319.8489387027031.
[I 2023-12-07 16:14:52,531] Trial 79 finished with value: 353.47606649057724 and parameters: {'model_name': 'SimpleImputer', 'strategy': 'mean'}. Best is trial 1 with value: 319.8489387027031.
[I 2023-12-07 16:14:52,753] Trial 83 finished with value: 353.47606649057724 and parameters: {'model_name': 'SimpleImputer', 'strategy': 'mean'}. Best is trial 1 with value: 319.8489387027031.
[I 2023-12-07 16:14:52,982] Trial 88 finished with value: 363.15048628092006 and parameters: {'model_name': 'SimpleImputer', 'strategy': 'most_frequent'}. Best is trial 1 with value: 319.8489387027031.
[I 2023-12-07 16:14:53,250] Trial 72 finished with value: 353.47606649057724 and parameters: {'model_name': 'SimpleImputer', 'strategy': 'mean'}. Best is trial 1 with value: 319.8489387027031.
[I 2023-12-07 16:14:53,429] Trial 87 finished with value: 353.47606649057724 and parameters: {'model_name': 'SimpleImputer', 'strategy': 'mean'}. Best is trial 1 with value: 319.8489387027031.
[I 2023-12-07 16:14:53,666] Trial 99 finished with value: 365.05676727608045 and parameters: {'model_name': 'SimpleImputer', 'strategy': 'constant'}. Best is trial 1 with value: 319.8489387027031.
[I 2023-12-07 16:14:53,901] Trial 68 finished with value: 319.8489387027031 and parameters: {'model_name': 'SimpleImputer', 'strategy': 'median'}. Best is trial 1 with value: 319.8489387027031.
[I 2023-12-07 16:14:54,088] Trial 97 finished with value: 363.15048628092006 and parameters: {'model_name': 'SimpleImputer', 'strategy': 'most_frequent'}. Best is trial 1 with value: 319.8489387027031.
[I 2023-12-07 16:14:54,317] Trial 98 finished with value: 363.15048628092006 and parameters: {'model_name': 'SimpleImputer', 'strategy': 'most_frequent'}. Best is trial 1 with value: 319.8489387027031.
[I 2023-12-07 16:14:54,502] Trial 95 finished with value: 363.15048628092006 and parameters: {'model_name': 'SimpleImputer', 'strategy': 'most_frequent'}. Best is trial 1 with value: 319.8489387027031.
[I 2023-12-07 16:14:54,744] Trial 76 finished with value: 353.47606649057724 and parameters: {'model_name': 'SimpleImputer', 'strategy': 'mean'}. Best is trial 1 with value: 319.8489387027031.
[I 2023-12-07 16:14:54,976] Trial 75 finished with value: 353.47606649057724 and parameters: {'model_name': 'SimpleImputer', 'strategy': 'mean'}. Best is trial 1 with value: 319.8489387027031.
[I 2023-12-07 16:14:55,222] Trial 82 finished with value: 353.47606649057724 and parameters: {'model_name': 'SimpleImputer', 'strategy': 'mean'}. Best is trial 1 with value: 319.8489387027031.
[I 2023-12-07 16:14:55,488] Trial 90 finished with value: 363.15048628092006 and parameters: {'model_name': 'SimpleImputer', 'strategy': 'most_frequent'}. Best is trial 1 with value: 319.8489387027031.
[I 2023-12-07 16:14:55,681] Trial 94 finished with value: 363.15048628092006 and parameters: {'model_name': 'SimpleImputer', 'strategy': 'most_frequent'}. Best is trial 1 with value: 319.8489387027031.
[I 2023-12-07 16:14:55,937] Trial 111 finished with value: 365.05676727608045 and parameters: {'model_name': 'SimpleImputer', 'strategy': 'constant'}. Best is trial 1 with value: 319.8489387027031.
