[I 2023-11-21 09:54:39,034] Trial 108 finished with value: 2.3100467071965363 and parameters: {'model_name': 'SimpleImputer', 'strategy': 'mean'}. Best is trial 0 with value: 2.3100467071965363.
[I 2023-11-21 09:54:39,324] Trial 107 finished with value: 2.3100467071965363 and parameters: {'model_name': 'SimpleImputer', 'strategy': 'mean'}. Best is trial 0 with value: 2.3100467071965363.
[I 2023-11-21 09:54:39,739] Trial 94 finished with value: 2.53293523662698 and parameters: {'model_name': 'SimpleImputer', 'strategy': 'most_frequent'}. Best is trial 0 with value: 2.3100467071965363.
[I 2023-11-21 09:54:40,152] Trial 111 finished with value: 2.3100467071965363 and parameters: {'model_name': 'SimpleImputer', 'strategy': 'mean'}. Best is trial 0 with value: 2.3100467071965363.
[I 2023-11-21 09:54:40,617] Trial 88 finished with value: 2.53293523662698 and parameters: {'model_name': 'SimpleImputer', 'strategy': 'most_frequent'}. Best is trial 0 with value: 2.3100467071965363.
[I 2023-11-21 09:54:40,809] Trial 112 finished with value: 2.3100467071965363 and parameters: {'model_name': 'SimpleImputer', 'strategy': 'mean'}. Best is trial 0 with value: 2.3100467071965363.
[I 2023-11-21 09:54:41,020] Trial 90 finished with value: 2.53293523662698 and parameters: {'model_name': 'SimpleImputer', 'strategy': 'most_frequent'}. Best is trial 0 with value: 2.3100467071965363.
[I 2023-11-21 09:54:41,319] Trial 89 finished with value: 2.53293523662698 and parameters: {'model_name': 'SimpleImputer', 'strategy': 'most_frequent'}. Best is trial 0 with value: 2.3100467071965363.
[I 2023-11-21 09:54:41,729] Trial 110 finished with value: 2.3100467071965363 and parameters: {'model_name': 'SimpleImputer', 'strategy': 'mean'}. Best is trial 0 with value: 2.3100467071965363.
[I 2023-11-21 09:54:41,989] Trial 113 finished with value: 2.3100467071965363 and parameters: {'model_name': 'SimpleImputer', 'strategy': 'mean'}. Best is trial 0 with value: 2.3100467071965363.
[I 2023-11-21 09:54:42,413] Trial 87 finished with value: 2.53293523662698 and parameters: {'model_name': 'SimpleImputer', 'strategy': 'most_frequent'}. Best is trial 0 with value: 2.3100467071965363.
[I 2023-11-21 09:54:42,659] Trial 91 finished with value: 2.53293523662698 and parameters: {'model_name': 'SimpleImputer', 'strategy': 'most_frequent'}. Best is trial 0 with value: 2.3100467071965363.
[I 2023-11-21 09:54:43,130] Trial 116 finished with value: 2.3100467071965363 and parameters: {'model_name': 'SimpleImputer', 'strategy': 'mean'}. Best is trial 0 with value: 2.3100467071965363.
[I 2023-11-21 09:54:43,441] Trial 125 finished with value: 2.3100467071965363 and parameters: {'model_name': 'SimpleImputer', 'strategy': 'mean'}. Best is trial 0 with value: 2.3100467071965363.
[I 2023-11-21 09:54:43,936] Trial 119 finished with value: 2.3100467071965363 and parameters: {'model_name': 'SimpleImputer', 'strategy': 'mean'}. Best is trial 0 with value: 2.3100467071965363.
[I 2023-11-21 09:54:44,284] Trial 115 finished with value: 2.3100467071965363 and parameters: {'model_name': 'SimpleImputer', 'strategy': 'mean'}. Best is trial 0 with value: 2.3100467071965363.
[I 2023-11-21 09:54:44,577] Trial 120 finished with value: 2.3100467071965363 and parameters: {'model_name': 'SimpleImputer', 'strategy': 'mean'}. Best is trial 0 with value: 2.3100467071965363.
[I 2023-11-21 09:54:44,914] Trial 122 finished with value: 2.3100467071965363 and parameters: {'model_name': 'SimpleImputer', 'strategy': 'mean'}. Best is trial 0 with value: 2.3100467071965363.
[I 2023-11-21 09:54:45,351] Trial 96 finished with value: 2.53293523662698 and parameters: {'model_name': 'SimpleImputer', 'strategy': 'most_frequent'}. Best is trial 0 with value: 2.3100467071965363.
[I 2023-11-21 09:54:45,615] Trial 118 finished with value: 2.3100467071965363 and parameters: {'model_name': 'SimpleImputer', 'strategy': 'mean'}. Best is trial 0 with value: 2.3100467071965363.
[I 2023-11-21 09:54:45,860] Trial 117 finished with value: 2.3100467071965363 and parameters: {'model_name': 'SimpleImputer', 'strategy': 'mean'}. Best is trial 0 with value: 2.3100467071965363.
[I 2023-11-21 09:54:46,300] Trial 128 finished with value: 2.3100467071965363 and parameters: {'model_name': 'SimpleImputer', 'strategy': 'mean'}. Best is trial 0 with value: 2.3100467071965363.
[I 2023-11-21 09:54:46,686] Trial 93 finished with value: 2.53293523662698 and parameters: {'model_name': 'SimpleImputer', 'strategy': 'most_frequent'}. Best is trial 0 with value: 2.3100467071965363.
[I 2023-11-21 09:54:46,860] Trial 114 finished with value: 2.3100467071965363 and parameters: {'model_name': 'SimpleImputer', 'strategy': 'mean'}. Best is trial 0 with value: 2.3100467071965363.
[I 2023-11-21 09:54:47,433] Trial 127 finished with value: 2.3100467071965363 and parameters: {'model_name': 'SimpleImputer', 'strategy': 'mean'}. Best is trial 0 with value: 2.3100467071965363.
[I 2023-11-21 09:54:47,689] Trial 121 finished with value: 2.3100467071965363 and parameters: {'model_name': 'SimpleImputer', 'strategy': 'mean'}. Best is trial 0 with value: 2.3100467071965363.
[I 2023-11-21 09:54:48,059] Trial 126 finished with value: 2.3100467071965363 and parameters: {'model_name': 'SimpleImputer', 'strategy': 'mean'}. Best is trial 0 with value: 2.3100467071965363.
[I 2023-11-21 09:54:48,250] Trial 124 finished with value: 2.3100467071965363 and parameters: {'model_name': 'SimpleImputer', 'strategy': 'mean'}. Best is trial 0 with value: 2.3100467071965363.
[I 2023-11-21 09:54:48,445] Trial 95 finished with value: 2.53293523662698 and parameters: {'model_name': 'SimpleImputer', 'strategy': 'most_frequent'}. Best is trial 0 with value: 2.3100467071965363.
[I 2023-11-21 09:54:48,796] Trial 92 finished with value: 2.53293523662698 and parameters: {'model_name': 'SimpleImputer', 'strategy': 'most_frequent'}. Best is trial 0 with value: 2.3100467071965363.
[I 2023-11-21 09:54:49,119] Trial 130 finished with value: 2.3100467071965363 and parameters: {'model_name': 'SimpleImputer', 'strategy': 'mean'}. Best is trial 0 with value: 2.3100467071965363.
[I 2023-11-21 09:54:49,422] Trial 129 finished with value: 2.3100467071965363 and parameters: {'model_name': 'SimpleImputer', 'strategy': 'mean'}. Best is trial 0 with value: 2.3100467071965363.
[I 2023-11-21 09:54:49,471] Trial 135 finished with value: 2.3100467071965363 and parameters: {'model_name': 'SimpleImputer', 'strategy': 'mean'}. Best is trial 0 with value: 2.3100467071965363.
[I 2023-11-21 09:54:49,926] Trial 131 finished with value: 2.3100467071965363 and parameters: {'model_name': 'SimpleImputer', 'strategy': 'mean'}. Best is trial 0 with value: 2.3100467071965363.
[I 2023-11-21 09:54:50,308] Trial 140 finished with value: 2.3100467071965363 and parameters: {'model_name': 'SimpleImputer', 'strategy': 'mean'}. Best is trial 0 with value: 2.3100467071965363.
[I 2023-11-21 09:54:50,638] Trial 133 finished with value: 2.3100467071965363 and parameters: {'model_name': 'SimpleImputer', 'strategy': 'mean'}. Best is trial 0 with value: 2.3100467071965363.
[I 2023-11-21 09:54:51,000] Trial 137 finished with value: 2.3100467071965363 and parameters: {'model_name': 'SimpleImputer', 'strategy': 'mean'}. Best is trial 0 with value: 2.3100467071965363.
[I 2023-11-21 09:54:51,270] Trial 123 finished with value: 2.3100467071965363 and parameters: {'model_name': 'SimpleImputer', 'strategy': 'mean'}. Best is trial 0 with value: 2.3100467071965363.
[I 2023-11-21 09:54:51,447] Trial 136 finished with value: 2.3100467071965363 and parameters: {'model_name': 'SimpleImputer', 'strategy': 'mean'}. Best is trial 0 with value: 2.3100467071965363.
[I 2023-11-21 09:54:51,729] Trial 138 finished with value: 2.3100467071965363 and parameters: {'model_name': 'SimpleImputer', 'strategy': 'mean'}. Best is trial 0 with value: 2.3100467071965363.
[I 2023-11-21 09:54:51,984] Trial 139 finished with value: 2.3100467071965363 and parameters: {'model_name': 'SimpleImputer', 'strategy': 'mean'}. Best is trial 0 with value: 2.3100467071965363.
[I 2023-11-21 09:54:52,249] Trial 134 finished with value: 2.3100467071965363 and parameters: {'model_name': 'SimpleImputer', 'strategy': 'mean'}. Best is trial 0 with value: 2.3100467071965363.
[I 2023-11-21 09:54:52,497] Trial 132 finished with value: 2.3100467071965363 and parameters: {'model_name': 'SimpleImputer', 'strategy': 'mean'}. Best is trial 0 with value: 2.3100467071965363.
[I 2023-11-21 09:54:52,698] Trial 141 finished with value: 2.3100467071965363 and parameters: {'model_name': 'SimpleImputer', 'strategy': 'mean'}. Best is trial 0 with value: 2.3100467071965363.
[I 2023-11-21 09:54:53,148] Trial 143 finished with value: 2.3100467071965363 and parameters: {'model_name': 'SimpleImputer', 'strategy': 'mean'}. Best is trial 0 with value: 2.3100467071965363.
[I 2023-11-21 09:54:53,633] Trial 142 finished with value: 2.3100467071965363 and parameters: {'model_name': 'SimpleImputer', 'strategy': 'mean'}. Best is trial 0 with value: 2.3100467071965363.
[I 2023-11-21 09:54:53,927] Trial 144 finished with value: 2.3100467071965363 and parameters: {'model_name': 'SimpleImputer', 'strategy': 'mean'}. Best is trial 0 with value: 2.3100467071965363.
[I 2023-11-21 09:54:54,282] Trial 149 finished with value: 2.3100467071965363 and parameters: {'model_name': 'SimpleImputer', 'strategy': 'mean'}. Best is trial 0 with value: 2.3100467071965363.
[I 2023-11-21 09:54:54,467] Trial 145 finished with value: 2.3100467071965363 and parameters: {'model_name': 'SimpleImputer', 'strategy': 'mean'}. Best is trial 0 with value: 2.3100467071965363.
[I 2023-11-21 09:54:54,837] Trial 146 finished with value: 2.3100467071965363 and parameters: {'model_name': 'SimpleImputer', 'strategy': 'mean'}. Best is trial 0 with value: 2.3100467071965363.
[I 2023-11-21 09:54:55,306] Trial 148 finished with value: 2.3100467071965363 and parameters: {'model_name': 'SimpleImputer', 'strategy': 'mean'}. Best is trial 0 with value: 2.3100467071965363.
[I 2023-11-21 09:54:55,942] Trial 153 finished with value: 2.3100467071965363 and parameters: {'model_name': 'SimpleImputer', 'strategy': 'mean'}. Best is trial 0 with value: 2.3100467071965363.
[I 2023-11-21 09:54:56,403] Trial 147 finished with value: 2.3100467071965363 and parameters: {'model_name': 'SimpleImputer', 'strategy': 'mean'}. Best is trial 0 with value: 2.3100467071965363.
[I 2023-11-21 09:54:56,697] Trial 152 finished with value: 2.3100467071965363 and parameters: {'model_name': 'SimpleImputer', 'strategy': 'mean'}. Best is trial 0 with value: 2.3100467071965363.
[I 2023-11-21 09:54:57,007] Trial 163 finished with value: 2.3100467071965363 and parameters: {'model_name': 'SimpleImputer', 'strategy': 'mean'}. Best is trial 0 with value: 2.3100467071965363.
[I 2023-11-21 09:54:57,676] Trial 161 finished with value: 2.3100467071965363 and parameters: {'model_name': 'SimpleImputer', 'strategy': 'mean'}. Best is trial 0 with value: 2.3100467071965363.
[I 2023-11-21 09:54:57,985] Trial 150 finished with value: 2.3100467071965363 and parameters: {'model_name': 'SimpleImputer', 'strategy': 'mean'}. Best is trial 0 with value: 2.3100467071965363.
[I 2023-11-21 09:54:58,306] Trial 157 finished with value: 2.3100467071965363 and parameters: {'model_name': 'SimpleImputer', 'strategy': 'mean'}. Best is trial 0 with value: 2.3100467071965363.
[I 2023-11-21 09:54:58,607] Trial 151 finished with value: 2.3100467071965363 and parameters: {'model_name': 'SimpleImputer', 'strategy': 'mean'}. Best is trial 0 with value: 2.3100467071965363.
[I 2023-11-21 09:54:58,898] Trial 156 finished with value: 2.3100467071965363 and parameters: {'model_name': 'SimpleImputer', 'strategy': 'mean'}. Best is trial 0 with value: 2.3100467071965363.
[I 2023-11-21 09:54:59,095] Trial 158 finished with value: 2.3100467071965363 and parameters: {'model_name': 'SimpleImputer', 'strategy': 'mean'}. Best is trial 0 with value: 2.3100467071965363.
[I 2023-11-21 09:54:59,434] Trial 154 finished with value: 2.3100467071965363 and parameters: {'model_name': 'SimpleImputer', 'strategy': 'mean'}. Best is trial 0 with value: 2.3100467071965363.
[I 2023-11-21 09:54:59,703] Trial 165 finished with value: 2.3100467071965363 and parameters: {'model_name': 'SimpleImputer', 'strategy': 'mean'}. Best is trial 0 with value: 2.3100467071965363.
[I 2023-11-21 09:54:59,720] Trial 155 finished with value: 2.3100467071965363 and parameters: {'model_name': 'SimpleImputer', 'strategy': 'mean'}. Best is trial 0 with value: 2.3100467071965363.
[I 2023-11-21 09:55:00,273] Trial 159 finished with value: 2.3100467071965363 and parameters: {'model_name': 'SimpleImputer', 'strategy': 'mean'}. Best is trial 0 with value: 2.3100467071965363.
[I 2023-11-21 09:55:00,597] Trial 162 finished with value: 2.3100467071965363 and parameters: {'model_name': 'SimpleImputer', 'strategy': 'mean'}. Best is trial 0 with value: 2.3100467071965363.
[I 2023-11-21 09:55:00,854] Trial 160 finished with value: 2.3100467071965363 and parameters: {'model_name': 'SimpleImputer', 'strategy': 'mean'}. Best is trial 0 with value: 2.3100467071965363.
[I 2023-11-21 09:55:01,201] Trial 166 finished with value: 2.3100467071965363 and parameters: {'model_name': 'SimpleImputer', 'strategy': 'mean'}. Best is trial 0 with value: 2.3100467071965363.
[I 2023-11-21 09:55:01,634] Trial 164 finished with value: 2.3100467071965363 and parameters: {'model_name': 'SimpleImputer', 'strategy': 'mean'}. Best is trial 0 with value: 2.3100467071965363.
[I 2023-11-21 09:55:02,057] Trial 168 finished with value: 2.3100467071965363 and parameters: {'model_name': 'SimpleImputer', 'strategy': 'mean'}. Best is trial 0 with value: 2.3100467071965363.
[I 2023-11-21 09:55:02,349] Trial 188 finished with value: 6.597828830338306 and parameters: {'model_name': 'SimpleImputer', 'strategy': 'constant'}. Best is trial 0 with value: 2.3100467071965363.
[I 2023-11-21 09:55:02,619] Trial 186 finished with value: 6.597828830338306 and parameters: {'model_name': 'SimpleImputer', 'strategy': 'constant'}. Best is trial 0 with value: 2.3100467071965363.
[I 2023-11-21 09:55:02,838] Trial 187 finished with value: 6.597828830338306 and parameters: {'model_name': 'SimpleImputer', 'strategy': 'constant'}. Best is trial 0 with value: 2.3100467071965363.
[I 2023-11-21 09:55:03,178] Trial 170 finished with value: 2.3100467071965363 and parameters: {'model_name': 'SimpleImputer', 'strategy': 'mean'}. Best is trial 0 with value: 2.3100467071965363.
[I 2023-11-21 09:55:03,359] Trial 181 finished with value: 2.3100467071965363 and parameters: {'model_name': 'SimpleImputer', 'strategy': 'mean'}. Best is trial 0 with value: 2.3100467071965363.
[I 2023-11-21 09:55:03,618] Trial 167 finished with value: 2.3100467071965363 and parameters: {'model_name': 'SimpleImputer', 'strategy': 'mean'}. Best is trial 0 with value: 2.3100467071965363.
[I 2023-11-21 09:55:03,809] Trial 169 finished with value: 2.3100467071965363 and parameters: {'model_name': 'SimpleImputer', 'strategy': 'mean'}. Best is trial 0 with value: 2.3100467071965363.
[I 2023-11-21 09:55:03,992] Trial 175 finished with value: 2.3100467071965363 and parameters: {'model_name': 'SimpleImputer', 'strategy': 'mean'}. Best is trial 0 with value: 2.3100467071965363.
[I 2023-11-21 09:55:04,338] Trial 173 finished with value: 2.3100467071965363 and parameters: {'model_name': 'SimpleImputer', 'strategy': 'mean'}. Best is trial 0 with value: 2.3100467071965363.
[I 2023-11-21 09:55:04,520] Trial 172 finished with value: 2.3100467071965363 and parameters: {'model_name': 'SimpleImputer', 'strategy': 'mean'}. Best is trial 0 with value: 2.3100467071965363.
[I 2023-11-21 09:55:04,759] Trial 171 finished with value: 2.3100467071965363 and parameters: {'model_name': 'SimpleImputer', 'strategy': 'mean'}. Best is trial 0 with value: 2.3100467071965363.
[I 2023-11-21 09:55:05,037] Trial 174 finished with value: 2.3100467071965363 and parameters: {'model_name': 'SimpleImputer', 'strategy': 'mean'}. Best is trial 0 with value: 2.3100467071965363.
[I 2023-11-21 09:55:05,317] Trial 178 finished with value: 2.3100467071965363 and parameters: {'model_name': 'SimpleImputer', 'strategy': 'mean'}. Best is trial 0 with value: 2.3100467071965363.
[I 2023-11-21 09:55:05,561] Trial 179 finished with value: 2.3100467071965363 and parameters: {'model_name': 'SimpleImputer', 'strategy': 'mean'}. Best is trial 0 with value: 2.3100467071965363.
[I 2023-11-21 09:55:05,792] Trial 176 finished with value: 2.3100467071965363 and parameters: {'model_name': 'SimpleImputer', 'strategy': 'mean'}. Best is trial 0 with value: 2.3100467071965363.
[I 2023-11-21 09:55:06,057] Trial 189 finished with value: 2.3100467071965363 and parameters: {'model_name': 'SimpleImputer', 'strategy': 'mean'}. Best is trial 0 with value: 2.3100467071965363.
[I 2023-11-21 09:55:06,247] Trial 177 finished with value: 2.3100467071965363 and parameters: {'model_name': 'SimpleImputer', 'strategy': 'mean'}. Best is trial 0 with value: 2.3100467071965363.
[I 2023-11-21 09:55:06,442] Trial 185 finished with value: 2.3100467071965363 and parameters: {'model_name': 'SimpleImputer', 'strategy': 'mean'}. Best is trial 0 with value: 2.3100467071965363.
[I 2023-11-21 09:55:06,621] Trial 195 finished with value: 6.597828830338306 and parameters: {'model_name': 'SimpleImputer', 'strategy': 'constant'}. Best is trial 0 with value: 2.3100467071965363.
[I 2023-11-21 09:55:06,880] Trial 180 finished with value: 2.3100467071965363 and parameters: {'model_name': 'SimpleImputer', 'strategy': 'mean'}. Best is trial 0 with value: 2.3100467071965363.
[I 2023-11-21 09:55:07,127] Trial 184 finished with value: 6.597828830338306 and parameters: {'model_name': 'SimpleImputer', 'strategy': 'constant'}. Best is trial 0 with value: 2.3100467071965363.
[I 2023-11-21 09:55:07,313] Trial 192 finished with value: 6.597828830338306 and parameters: {'model_name': 'SimpleImputer', 'strategy': 'constant'}. Best is trial 0 with value: 2.3100467071965363.
[I 2023-11-21 09:55:07,559] Trial 191 finished with value: 6.597828830338306 and parameters: {'model_name': 'SimpleImputer', 'strategy': 'constant'}. Best is trial 0 with value: 2.3100467071965363.
[I 2023-11-21 09:55:07,788] Trial 182 finished with value: 2.3100467071965363 and parameters: {'model_name': 'SimpleImputer', 'strategy': 'mean'}. Best is trial 0 with value: 2.3100467071965363.
[I 2023-11-21 09:55:07,981] Trial 193 finished with value: 2.3100467071965363 and parameters: {'model_name': 'SimpleImputer', 'strategy': 'mean'}. Best is trial 0 with value: 2.3100467071965363.
[I 2023-11-21 09:55:08,166] Trial 190 finished with value: 2.3100467071965363 and parameters: {'model_name': 'SimpleImputer', 'strategy': 'mean'}. Best is trial 0 with value: 2.3100467071965363.
[I 2023-11-21 09:55:08,421] Trial 194 finished with value: 6.597828830338306 and parameters: {'model_name': 'SimpleImputer', 'strategy': 'constant'}. Best is trial 0 with value: 2.3100467071965363.
[I 2023-11-21 09:55:08,619] Trial 183 finished with value: 2.3100467071965363 and parameters: {'model_name': 'SimpleImputer', 'strategy': 'mean'}. Best is trial 0 with value: 2.3100467071965363.
[I 2023-11-21 09:55:08,837] Trial 196 finished with value: 2.3100467071965363 and parameters: {'model_name': 'SimpleImputer', 'strategy': 'mean'}. Best is trial 0 with value: 2.3100467071965363.
[I 2023-11-21 09:55:09,129] Trial 197 finished with value: 2.3100467071965363 and parameters: {'model_name': 'SimpleImputer', 'strategy': 'mean'}. Best is trial 0 with value: 2.3100467071965363.
[I 2023-11-21 09:55:09,310] Trial 198 finished with value: 2.3100467071965363 and parameters: {'model_name': 'SimpleImputer', 'strategy': 'mean'}. Best is trial 0 with value: 2.3100467071965363.
[I 2023-11-21 09:55:09,472] Trial 199 finished with value: 2.3100467071965363 and parameters: {'model_name': 'SimpleImputer', 'strategy': 'mean'}. Best is trial 0 with value: 2.3100467071965363.
[I 2023-11-21 09:55:09,787] A new study created in memory with name: no-name-5df340ab-3617-4645-9202-77be5bdd5b0c
[I 2023-11-21 09:55:09,824] Trial 2 finished with value: inf and parameters: {'model_name': 'GAIN', 'batch_size': 853, 'hint_rate': 0.010646778626877905, 'alpha': 25, 'iterations': 799}. Best is trial 2 with value: inf.
[I 2023-11-21 09:55:10,092] Trial 5 finished with value: inf and parameters: {'model_name': 'GAIN', 'batch_size': 707, 'hint_rate': 0.1439540954951203, 'alpha': 9, 'iterations': 2989}. Best is trial 2 with value: inf.
[I 2023-11-21 09:55:10,337] Trial 7 finished with value: inf and parameters: {'model_name': 'KNNImputer', 'weights': 'distance', 'keep_empty_features': False}. Best is trial 2 with value: inf.
[I 2023-11-21 09:55:10,564] Trial 10 finished with value: inf and parameters: {'model_name': 'KNNImputer', 'weights': 'distance', 'keep_empty_features': True}. Best is trial 2 with value: inf.
[I 2023-11-21 09:55:10,804] Trial 13 finished with value: inf and parameters: {'model_name': 'KNNImputer', 'weights': 'distance', 'keep_empty_features': True}. Best is trial 2 with value: inf.
[I 2023-11-21 09:55:11,043] Trial 6 finished with value: inf and parameters: {'model_name': 'GAIN', 'batch_size': 82, 'hint_rate': 0.0027568242275400395, 'alpha': 44, 'iterations': 1}. Best is trial 2 with value: inf.
[I 2023-11-21 09:55:11,501] Trial 3 finished with value: inf and parameters: {'model_name': 'IterativeImputer', 'estimator': 'Ridge', 'sample_posterior': True, 'initial_strategy': 'constant', 'imputation_order': 'descending'}. Best is trial 2 with value: inf.
[I 2023-11-21 09:55:11,737] Trial 15 finished with value: inf and parameters: {'model_name': 'KNNImputer', 'weights': 'uniform', 'keep_empty_features': False}. Best is trial 2 with value: inf.
