[I 2023-12-07 17:07:12,047] Trial 112 finished with value: 909.3780859453343 and parameters: {'model_name': 'IterativeImputer', 'estimator': 'Bayesian', 'sample_posterior': False, 'initial_strategy': 'median', 'imputation_order': 'roman'}. Best is trial 46 with value: 909.3780859453343.
[I 2023-12-07 17:07:12,361] Trial 115 finished with value: 909.3780859453343 and parameters: {'model_name': 'IterativeImputer', 'estimator': 'Bayesian', 'sample_posterior': False, 'initial_strategy': 'median', 'imputation_order': 'roman'}. Best is trial 46 with value: 909.3780859453343.
[I 2023-12-07 17:07:12,714] Trial 110 finished with value: 909.3780859453343 and parameters: {'model_name': 'IterativeImputer', 'estimator': 'Bayesian', 'sample_posterior': False, 'initial_strategy': 'median', 'imputation_order': 'roman'}. Best is trial 46 with value: 909.3780859453343.
[I 2023-12-07 17:07:13,255] Trial 113 finished with value: 909.3780859453343 and parameters: {'model_name': 'IterativeImputer', 'estimator': 'Bayesian', 'sample_posterior': False, 'initial_strategy': 'median', 'imputation_order': 'roman'}. Best is trial 46 with value: 909.3780859453343.
[I 2023-12-07 17:07:13,788] Trial 114 finished with value: 909.3780859453343 and parameters: {'model_name': 'IterativeImputer', 'estimator': 'Bayesian', 'sample_posterior': False, 'initial_strategy': 'median', 'imputation_order': 'roman'}. Best is trial 46 with value: 909.3780859453343.
[I 2023-12-07 17:07:14,130] Trial 118 finished with value: 909.3780859453343 and parameters: {'model_name': 'IterativeImputer', 'estimator': 'Bayesian', 'sample_posterior': False, 'initial_strategy': 'median', 'imputation_order': 'roman'}. Best is trial 46 with value: 909.3780859453343.
[I 2023-12-07 17:07:14,949] Trial 119 finished with value: 909.3780859453343 and parameters: {'model_name': 'IterativeImputer', 'estimator': 'Bayesian', 'sample_posterior': False, 'initial_strategy': 'median', 'imputation_order': 'roman'}. Best is trial 46 with value: 909.3780859453343.
[I 2023-12-07 17:07:15,258] Trial 116 finished with value: 909.3780859453343 and parameters: {'model_name': 'IterativeImputer', 'estimator': 'Bayesian', 'sample_posterior': False, 'initial_strategy': 'median', 'imputation_order': 'roman'}. Best is trial 46 with value: 909.3780859453343.
[I 2023-12-07 17:07:16,239] Trial 78 finished with value: 2095.963850968657 and parameters: {'model_name': 'RandomForestImputer', 'max_iter': 8, 'decreasing': False, 'min_samples_split': 0.4, 'min_samples_leaf': 0.4, 'max_features': 0.7000000000000001, 'warm_start': False}. Best is trial 46 with value: 909.3780859453343.
[I 2023-12-07 17:07:16,750] Trial 120 finished with value: 909.3780859453343 and parameters: {'model_name': 'IterativeImputer', 'estimator': 'Bayesian', 'sample_posterior': False, 'initial_strategy': 'median', 'imputation_order': 'roman'}. Best is trial 46 with value: 909.3780859453343.
[I 2023-12-07 17:07:17,738] Trial 11 finished with value: 2095.784488856175 and parameters: {'model_name': 'RandomForestImputer', 'max_iter': 28, 'decreasing': True, 'min_samples_split': 0.5, 'min_samples_leaf': 0.5, 'max_features': 0.4, 'warm_start': False}. Best is trial 46 with value: 909.3780859453343.
[I 2023-12-07 17:07:20,175] Trial 121 finished with value: 909.8210855766386 and parameters: {'model_name': 'IterativeImputer', 'estimator': 'Bayesian', 'sample_posterior': False, 'initial_strategy': 'median', 'imputation_order': 'random'}. Best is trial 46 with value: 909.3780859453343.
[I 2023-12-07 17:07:20,831] Trial 117 finished with value: 909.8183251188432 and parameters: {'model_name': 'IterativeImputer', 'estimator': 'Bayesian', 'sample_posterior': False, 'initial_strategy': 'median', 'imputation_order': 'random'}. Best is trial 46 with value: 909.3780859453343.
[I 2023-12-07 17:07:22,165] Trial 123 finished with value: 909.060953829046 and parameters: {'model_name': 'IterativeImputer', 'estimator': 'Bayesian', 'sample_posterior': False, 'initial_strategy': 'median', 'imputation_order': 'random'}. Best is trial 123 with value: 909.060953829046.
[I 2023-12-07 17:07:23,885] Trial 129 finished with value: 909.3780859453343 and parameters: {'model_name': 'IterativeImputer', 'estimator': 'Bayesian', 'sample_posterior': False, 'initial_strategy': 'median', 'imputation_order': 'roman'}. Best is trial 123 with value: 909.060953829046.
[I 2023-12-07 17:07:24,371] Trial 126 finished with value: 909.3780859453343 and parameters: {'model_name': 'IterativeImputer', 'estimator': 'Bayesian', 'sample_posterior': False, 'initial_strategy': 'median', 'imputation_order': 'roman'}. Best is trial 123 with value: 909.060953829046.
[I 2023-12-07 17:07:24,793] Trial 146 finished with value: 2149.998048842172 and parameters: {'model_name': 'SimpleImputer', 'strategy': 'median'}. Best is trial 123 with value: 909.060953829046.
[I 2023-12-07 17:07:25,233] Trial 125 finished with value: 909.3314273118393 and parameters: {'model_name': 'IterativeImputer', 'estimator': 'Bayesian', 'sample_posterior': False, 'initial_strategy': 'median', 'imputation_order': 'random'}. Best is trial 123 with value: 909.060953829046.
[I 2023-12-07 17:07:25,583] Trial 131 finished with value: 909.3780859453343 and parameters: {'model_name': 'IterativeImputer', 'estimator': 'Bayesian', 'sample_posterior': False, 'initial_strategy': 'median', 'imputation_order': 'roman'}. Best is trial 123 with value: 909.060953829046.
[I 2023-12-07 17:07:25,964] Trial 128 finished with value: 910.5757333114292 and parameters: {'model_name': 'IterativeImputer', 'estimator': 'Bayesian', 'sample_posterior': False, 'initial_strategy': 'median', 'imputation_order': 'random'}. Best is trial 123 with value: 909.060953829046.
[I 2023-12-07 17:07:26,429] Trial 122 finished with value: 909.7221566149171 and parameters: {'model_name': 'IterativeImputer', 'estimator': 'Bayesian', 'sample_posterior': False, 'initial_strategy': 'median', 'imputation_order': 'random'}. Best is trial 123 with value: 909.060953829046.
[I 2023-12-07 17:07:27,056] Trial 130 finished with value: 909.3780859453343 and parameters: {'model_name': 'IterativeImputer', 'estimator': 'Bayesian', 'sample_posterior': False, 'initial_strategy': 'median', 'imputation_order': 'roman'}. Best is trial 123 with value: 909.060953829046.
[I 2023-12-07 17:07:27,918] Trial 132 finished with value: 909.3780859453343 and parameters: {'model_name': 'IterativeImputer', 'estimator': 'Bayesian', 'sample_posterior': False, 'initial_strategy': 'median', 'imputation_order': 'roman'}. Best is trial 123 with value: 909.060953829046.
[I 2023-12-07 17:07:29,371] Trial 124 finished with value: 910.5935503300838 and parameters: {'model_name': 'IterativeImputer', 'estimator': 'Bayesian', 'sample_posterior': False, 'initial_strategy': 'median', 'imputation_order': 'random'}. Best is trial 123 with value: 909.060953829046.
[I 2023-12-07 17:07:29,966] Trial 154 finished with value: inf and parameters: {'model_name': 'IterativeImputer', 'estimator': 'KNN', 'sample_posterior': True, 'initial_strategy': 'mean', 'imputation_order': 'arabic'}. Best is trial 123 with value: 909.060953829046.
[I 2023-12-07 17:07:30,902] Trial 127 finished with value: 909.8557148377411 and parameters: {'model_name': 'IterativeImputer', 'estimator': 'Bayesian', 'sample_posterior': False, 'initial_strategy': 'median', 'imputation_order': 'random'}. Best is trial 123 with value: 909.060953829046.
[I 2023-12-07 17:07:35,917] Trial 49 finished with value: 2200.614278878405 and parameters: {'model_name': 'GAIN', 'batch_size': 4, 'hint_rate': 0.23, 'alpha': 63, 'iterations': 111}. Best is trial 123 with value: 909.060953829046.
[I 2023-12-07 17:07:38,161] Trial 71 finished with value: 2066.767714776632 and parameters: {'model_name': 'GAIN', 'batch_size': 67, 'hint_rate': 0.23, 'alpha': 63, 'iterations': 117}. Best is trial 123 with value: 909.060953829046.
[I 2023-12-07 17:07:44,392] Trial 50 finished with value: 1964.0068171071562 and parameters: {'model_name': 'RandomForestImputer', 'max_iter': 16, 'decreasing': True, 'min_samples_split': 0.0, 'min_samples_leaf': 0.2, 'max_features': 0.5, 'warm_start': False}. Best is trial 123 with value: 909.060953829046.
[I 2023-12-07 17:07:46,599] Trial 141 finished with value: inf and parameters: {'model_name': 'IterativeImputer', 'estimator': 'RFR', 'sample_posterior': True, 'initial_strategy': 'median', 'imputation_order': 'roman'}. Best is trial 123 with value: 909.060953829046.
[I 2023-12-07 17:07:50,066] Trial 140 finished with value: inf and parameters: {'model_name': 'IterativeImputer', 'estimator': 'RFR', 'sample_posterior': True, 'initial_strategy': 'median', 'imputation_order': 'roman'}. Best is trial 123 with value: 909.060953829046.
[I 2023-12-07 17:07:56,907] Trial 144 finished with value: inf and parameters: {'model_name': 'IterativeImputer', 'estimator': 'RFR', 'sample_posterior': True, 'initial_strategy': 'median', 'imputation_order': 'roman'}. Best is trial 123 with value: 909.060953829046.
[I 2023-12-07 17:07:57,560] Trial 145 finished with value: inf and parameters: {'model_name': 'IterativeImputer', 'estimator': 'RFR', 'sample_posterior': True, 'initial_strategy': 'mean', 'imputation_order': 'roman'}. Best is trial 123 with value: 909.060953829046.
[I 2023-12-07 17:07:59,740] Trial 143 finished with value: inf and parameters: {'model_name': 'IterativeImputer', 'estimator': 'RFR', 'sample_posterior': True, 'initial_strategy': 'median', 'imputation_order': 'roman'}. Best is trial 123 with value: 909.060953829046.
[I 2023-12-07 17:08:00,208] Trial 142 finished with value: inf and parameters: {'model_name': 'IterativeImputer', 'estimator': 'RFR', 'sample_posterior': True, 'initial_strategy': 'median', 'imputation_order': 'roman'}. Best is trial 123 with value: 909.060953829046.
[I 2023-12-07 17:08:00,754] Trial 165 finished with value: 2149.998048842172 and parameters: {'model_name': 'SimpleImputer', 'strategy': 'median'}. Best is trial 123 with value: 909.060953829046.
[I 2023-12-07 17:08:09,678] Trial 161 finished with value: 909.8831152799668 and parameters: {'model_name': 'IterativeImputer', 'estimator': 'Bayesian', 'sample_posterior': False, 'initial_strategy': 'median', 'imputation_order': 'ascending'}. Best is trial 123 with value: 909.060953829046.
[I 2023-12-07 17:08:10,068] Trial 62 finished with value: 1989.283004053459 and parameters: {'model_name': 'RandomForestImputer', 'max_iter': 17, 'decreasing': False, 'min_samples_split': 1.0, 'min_samples_leaf': 0.2, 'max_features': 0.30000000000000004, 'warm_start': False}. Best is trial 123 with value: 909.060953829046.
[I 2023-12-07 17:08:13,302] Trial 164 finished with value: 909.3780859453343 and parameters: {'model_name': 'IterativeImputer', 'estimator': 'Bayesian', 'sample_posterior': False, 'initial_strategy': 'median', 'imputation_order': 'roman'}. Best is trial 123 with value: 909.060953829046.
[I 2023-12-07 17:08:14,179] Trial 163 finished with value: 909.8880816720255 and parameters: {'model_name': 'IterativeImputer', 'estimator': 'Bayesian', 'sample_posterior': False, 'initial_strategy': 'most_frequent', 'imputation_order': 'ascending'}. Best is trial 123 with value: 909.060953829046.
[I 2023-12-07 17:08:14,612] Trial 162 finished with value: 909.8880816720255 and parameters: {'model_name': 'IterativeImputer', 'estimator': 'Bayesian', 'sample_posterior': False, 'initial_strategy': 'most_frequent', 'imputation_order': 'ascending'}. Best is trial 123 with value: 909.060953829046.
[I 2023-12-07 17:08:16,880] Trial 166 finished with value: 909.8880816720255 and parameters: {'model_name': 'IterativeImputer', 'estimator': 'Bayesian', 'sample_posterior': False, 'initial_strategy': 'most_frequent', 'imputation_order': 'ascending'}. Best is trial 123 with value: 909.060953829046.
[I 2023-12-07 17:08:18,683] Trial 134 finished with value: 977.7931203706567 and parameters: {'model_name': 'IterativeImputer', 'estimator': 'Bayesian', 'sample_posterior': True, 'initial_strategy': 'median', 'imputation_order': 'roman'}. Best is trial 123 with value: 909.060953829046.
[I 2023-12-07 17:08:19,324] Trial 139 finished with value: 976.8229159986636 and parameters: {'model_name': 'IterativeImputer', 'estimator': 'Bayesian', 'sample_posterior': True, 'initial_strategy': 'median', 'imputation_order': 'roman'}. Best is trial 123 with value: 909.060953829046.
[I 2023-12-07 17:08:20,296] Trial 135 finished with value: 970.686338321617 and parameters: {'model_name': 'IterativeImputer', 'estimator': 'Bayesian', 'sample_posterior': True, 'initial_strategy': 'median', 'imputation_order': 'roman'}. Best is trial 123 with value: 909.060953829046.
[I 2023-12-07 17:08:21,127] Trial 133 finished with value: 980.8616012078778 and parameters: {'model_name': 'IterativeImputer', 'estimator': 'Bayesian', 'sample_posterior': True, 'initial_strategy': 'median', 'imputation_order': 'roman'}. Best is trial 123 with value: 909.060953829046.
[I 2023-12-07 17:08:22,363] Trial 137 finished with value: 987.3737896756459 and parameters: {'model_name': 'IterativeImputer', 'estimator': 'Bayesian', 'sample_posterior': True, 'initial_strategy': 'median', 'imputation_order': 'roman'}. Best is trial 123 with value: 909.060953829046.
[I 2023-12-07 17:08:22,876] Trial 136 finished with value: 973.8287465103903 and parameters: {'model_name': 'IterativeImputer', 'estimator': 'Bayesian', 'sample_posterior': True, 'initial_strategy': 'median', 'imputation_order': 'roman'}. Best is trial 123 with value: 909.060953829046.
[I 2023-12-07 17:08:25,126] Trial 41 finished with value: 2096.2666061768214 and parameters: {'model_name': 'RandomForestImputer', 'max_iter': 87, 'decreasing': True, 'min_samples_split': 0.30000000000000004, 'min_samples_leaf': 0.7000000000000001, 'max_features': 0.30000000000000004, 'warm_start': False}. Best is trial 123 with value: 909.060953829046.
[I 2023-12-07 17:08:26,145] Trial 138 finished with value: 975.5006111215955 and parameters: {'model_name': 'IterativeImputer', 'estimator': 'Bayesian', 'sample_posterior': True, 'initial_strategy': 'median', 'imputation_order': 'roman'}. Best is trial 123 with value: 909.060953829046.
[I 2023-12-07 17:08:27,445] Trial 177 finished with value: 1320.4467004491296 and parameters: {'model_name': 'IterativeImputer', 'estimator': 'KNN', 'sample_posterior': False, 'initial_strategy': 'median', 'imputation_order': 'arabic'}. Best is trial 123 with value: 909.060953829046.
[I 2023-12-07 17:08:30,359] Trial 180 finished with value: 1320.4467004491296 and parameters: {'model_name': 'IterativeImputer', 'estimator': 'KNN', 'sample_posterior': False, 'initial_strategy': 'median', 'imputation_order': 'arabic'}. Best is trial 123 with value: 909.060953829046.
[I 2023-12-07 17:08:32,238] Trial 167 finished with value: 909.7813356812551 and parameters: {'model_name': 'IterativeImputer', 'estimator': 'Bayesian', 'sample_posterior': False, 'initial_strategy': 'most_frequent', 'imputation_order': 'roman'}. Best is trial 123 with value: 909.060953829046.
[I 2023-12-07 17:08:33,064] Trial 168 finished with value: 909.7813356812551 and parameters: {'model_name': 'IterativeImputer', 'estimator': 'Bayesian', 'sample_posterior': False, 'initial_strategy': 'most_frequent', 'imputation_order': 'roman'}. Best is trial 123 with value: 909.060953829046.
[I 2023-12-07 17:08:33,465] Trial 170 finished with value: 909.3780859453343 and parameters: {'model_name': 'IterativeImputer', 'estimator': 'Bayesian', 'sample_posterior': False, 'initial_strategy': 'median', 'imputation_order': 'roman'}. Best is trial 123 with value: 909.060953829046.
[I 2023-12-07 17:08:34,053] Trial 171 finished with value: 909.3780859453343 and parameters: {'model_name': 'IterativeImputer', 'estimator': 'Bayesian', 'sample_posterior': False, 'initial_strategy': 'median', 'imputation_order': 'roman'}. Best is trial 123 with value: 909.060953829046.
[I 2023-12-07 17:08:35,035] Trial 172 finished with value: 909.3780859453343 and parameters: {'model_name': 'IterativeImputer', 'estimator': 'Bayesian', 'sample_posterior': False, 'initial_strategy': 'median', 'imputation_order': 'roman'}. Best is trial 123 with value: 909.060953829046.
[I 2023-12-07 17:08:36,475] Trial 169 finished with value: 909.7813356812551 and parameters: {'model_name': 'IterativeImputer', 'estimator': 'Bayesian', 'sample_posterior': False, 'initial_strategy': 'most_frequent', 'imputation_order': 'roman'}. Best is trial 123 with value: 909.060953829046.
[I 2023-12-07 17:08:37,889] Trial 173 finished with value: 909.3780859453343 and parameters: {'model_name': 'IterativeImputer', 'estimator': 'Bayesian', 'sample_posterior': False, 'initial_strategy': 'median', 'imputation_order': 'roman'}. Best is trial 123 with value: 909.060953829046.
[I 2023-12-07 17:08:40,366] Trial 174 finished with value: 909.3780859453343 and parameters: {'model_name': 'IterativeImputer', 'estimator': 'Bayesian', 'sample_posterior': False, 'initial_strategy': 'median', 'imputation_order': 'roman'}. Best is trial 123 with value: 909.060953829046.
[I 2023-12-07 17:08:40,750] Trial 176 finished with value: 909.3780859453343 and parameters: {'model_name': 'IterativeImputer', 'estimator': 'Bayesian', 'sample_posterior': False, 'initial_strategy': 'median', 'imputation_order': 'roman'}. Best is trial 123 with value: 909.060953829046.
[I 2023-12-07 17:08:41,550] Trial 175 finished with value: 909.3780859453343 and parameters: {'model_name': 'IterativeImputer', 'estimator': 'Bayesian', 'sample_posterior': False, 'initial_strategy': 'median', 'imputation_order': 'roman'}. Best is trial 123 with value: 909.060953829046.
[I 2023-12-07 17:08:43,692] Trial 178 finished with value: 909.3780859453343 and parameters: {'model_name': 'IterativeImputer', 'estimator': 'Bayesian', 'sample_posterior': False, 'initial_strategy': 'median', 'imputation_order': 'roman'}. Best is trial 123 with value: 909.060953829046.
[I 2023-12-07 17:08:45,260] Trial 80 finished with value: 1865.7351581933087 and parameters: {'model_name': 'RandomForestImputer', 'max_iter': 36, 'decreasing': False, 'min_samples_split': 0.2, 'min_samples_leaf': 0.1, 'max_features': 0.7000000000000001, 'warm_start': False}. Best is trial 123 with value: 909.060953829046.
[I 2023-12-07 17:08:46,387] Trial 179 finished with value: 909.3780859453343 and parameters: {'model_name': 'IterativeImputer', 'estimator': 'Bayesian', 'sample_posterior': False, 'initial_strategy': 'median', 'imputation_order': 'roman'}. Best is trial 123 with value: 909.060953829046.
[I 2023-12-07 17:08:46,934] Trial 195 finished with value: 2096.1610027502606 and parameters: {'model_name': 'SimpleImputer', 'strategy': 'mean'}. Best is trial 123 with value: 909.060953829046.
[I 2023-12-07 17:08:47,926] Trial 181 finished with value: 909.3780859453343 and parameters: {'model_name': 'IterativeImputer', 'estimator': 'Bayesian', 'sample_posterior': False, 'initial_strategy': 'median', 'imputation_order': 'roman'}. Best is trial 123 with value: 909.060953829046.
[I 2023-12-07 17:08:50,654] Trial 182 finished with value: 909.3780859453343 and parameters: {'model_name': 'IterativeImputer', 'estimator': 'Bayesian', 'sample_posterior': False, 'initial_strategy': 'median', 'imputation_order': 'roman'}. Best is trial 123 with value: 909.060953829046.
[I 2023-12-07 17:08:53,332] Trial 159 finished with value: 952.0693665693051 and parameters: {'model_name': 'IterativeImputer', 'estimator': 'Bayesian', 'sample_posterior': True, 'initial_strategy': 'most_frequent', 'imputation_order': 'ascending'}. Best is trial 123 with value: 909.060953829046.
[I 2023-12-07 17:08:53,842] Trial 184 finished with value: 909.3780859453343 and parameters: {'model_name': 'IterativeImputer', 'estimator': 'Bayesian', 'sample_posterior': False, 'initial_strategy': 'median', 'imputation_order': 'roman'}. Best is trial 123 with value: 909.060953829046.
[I 2023-12-07 17:08:54,370] Trial 183 finished with value: 909.3780859453343 and parameters: {'model_name': 'IterativeImputer', 'estimator': 'Bayesian', 'sample_posterior': False, 'initial_strategy': 'median', 'imputation_order': 'roman'}. Best is trial 123 with value: 909.060953829046.
[I 2023-12-07 17:08:55,338] Trial 185 finished with value: 911.1017277544743 and parameters: {'model_name': 'IterativeImputer', 'estimator': 'Bayesian', 'sample_posterior': False, 'initial_strategy': 'median', 'imputation_order': 'random'}. Best is trial 123 with value: 909.060953829046.
[I 2023-12-07 17:08:56,051] Trial 68 finished with value: 2096.34426352419 and parameters: {'model_name': 'RandomForestImputer', 'max_iter': 66, 'decreasing': False, 'min_samples_split': 0.8, 'min_samples_leaf': 0.5, 'max_features': 0.30000000000000004, 'warm_start': False}. Best is trial 123 with value: 909.060953829046.
[I 2023-12-07 17:08:57,912] Trial 160 finished with value: 984.1616283947683 and parameters: {'model_name': 'IterativeImputer', 'estimator': 'Bayesian', 'sample_posterior': True, 'initial_strategy': 'most_frequent', 'imputation_order': 'ascending'}. Best is trial 123 with value: 909.060953829046.
[I 2023-12-07 17:08:59,201] Trial 196 finished with value: 909.284182683654 and parameters: {'model_name': 'IterativeImputer', 'estimator': 'Bayesian', 'sample_posterior': False, 'initial_strategy': 'median', 'imputation_order': 'random'}. Best is trial 123 with value: 909.060953829046.
[I 2023-12-07 17:08:59,647] Trial 186 finished with value: 909.7662402033784 and parameters: {'model_name': 'IterativeImputer', 'estimator': 'Bayesian', 'sample_posterior': False, 'initial_strategy': 'median', 'imputation_order': 'random'}. Best is trial 123 with value: 909.060953829046.
[I 2023-12-07 17:09:00,356] Trial 191 finished with value: 909.5394442678404 and parameters: {'model_name': 'IterativeImputer', 'estimator': 'Bayesian', 'sample_posterior': False, 'initial_strategy': 'median', 'imputation_order': 'random'}. Best is trial 123 with value: 909.060953829046.
