  0%|          | 0/200 [00:00<?, ?it/s]                                       [I 2023-11-24 15:16:56,738] Trial 1 finished with value: inf and parameters: {'model_name': 'GAIN', 'batch_size': 73, 'hint_rate': 0.15377588539726855, 'alpha': 29, 'iterations': 6348}. Best is trial 1 with value: inf.
  0%|          | 0/200 [00:00<?, ?it/s]Best trial: 1. Best value: inf:   0%|          | 0/200 [00:00<?, ?it/s]Best trial: 1. Best value: inf:   0%|          | 1/200 [00:00<00:56,  3.53it/s][W 2023-11-24 15:16:56,972] Trial 6 failed with parameters: {'model_name': 'IterativeImputer'} because of the following error: ValueError('CategoricalDistribution does not support dynamic value space.').
Traceback (most recent call last):
  File "/home/ketrong/miniconda3/envs/tpot2devenv/lib/python3.10/site-packages/optuna/study/_optimize.py", line 200, in _run_trial
    value_or_values = func(trial)
  File "/common/ketrong/AutoImputeExp/tpot2_imputetest/Impute_Experiments/autoimpute.py", line 56, in obj
    my_params = autoutils.trial_suggestion(trial, self.model_names, column_len=len(X.columns), random_state=self.random_state)
  File "/common/ketrong/AutoImputeExp/tpot2_imputetest/Impute_Experiments/autoutils.py", line 20, in trial_suggestion
    my_params = params_IterativeImpute(trial,model_name) #Uses the dependence between columns in the data set to predict for the one column. Predictions occur through a variety of strategies.
  File "/common/ketrong/AutoImputeExp/tpot2_imputetest/Impute_Experiments/param_grids.py", line 20, in params_IterativeImpute
    params['estimator'] = trial.suggest_categorical('estimator', [Bayes, RFR, Ridge, KNN])
  File "/home/ketrong/miniconda3/envs/tpot2devenv/lib/python3.10/site-packages/optuna/trial/_trial.py", line 405, in suggest_categorical
    return self._suggest(name, CategoricalDistribution(choices=choices))
  File "/home/ketrong/miniconda3/envs/tpot2devenv/lib/python3.10/site-packages/optuna/trial/_trial.py", line 636, in _suggest
    storage.set_trial_param(trial_id, name, param_value_in_internal_repr, distribution)
  File "/home/ketrong/miniconda3/envs/tpot2devenv/lib/python3.10/site-packages/optuna/storages/_in_memory.py", line 187, in set_trial_param
    distributions.check_distribution_compatibility(
  File "/home/ketrong/miniconda3/envs/tpot2devenv/lib/python3.10/site-packages/optuna/distributions.py", line 670, in check_distribution_compatibility
    raise ValueError(
ValueError: CategoricalDistribution does not support dynamic value space.
                                                                               Best trial: 1. Best value: inf:   0%|          | 1/200 [00:00<00:56,  3.53it/s][W 2023-11-24 15:16:57,038] Trial 6 failed with value None.
                                                                               Best trial: 1. Best value: inf:   0%|          | 1/200 [00:00<00:56,  3.53it/s]                                                                               [W 2023-11-24 15:16:57,015] Trial 9 failed with parameters: {'model_name': 'IterativeImputer'} because of the following error: ValueError('CategoricalDistribution does not support dynamic value space.').
Traceback (most recent call last):
  File "/home/ketrong/miniconda3/envs/tpot2devenv/lib/python3.10/site-packages/optuna/study/_optimize.py", line 200, in _run_trial
    value_or_values = func(trial)
  File "/common/ketrong/AutoImputeExp/tpot2_imputetest/Impute_Experiments/autoimpute.py", line 56, in obj
    my_params = autoutils.trial_suggestion(trial, self.model_names, column_len=len(X.columns), random_state=self.random_state)
  File "/common/ketrong/AutoImputeExp/tpot2_imputetest/Impute_Experiments/autoutils.py", line 20, in trial_suggestion
    my_params = params_IterativeImpute(trial,model_name) #Uses the dependence between columns in the data set to predict for the one column. Predictions occur through a variety of strategies.
  File "/common/ketrong/AutoImputeExp/tpot2_imputetest/Impute_Experiments/param_grids.py", line 20, in params_IterativeImpute
    params['estimator'] = trial.suggest_categorical('estimator', [Bayes, RFR, Ridge, KNN])
  File "/home/ketrong/miniconda3/envs/tpot2devenv/lib/python3.10/site-packages/optuna/trial/_trial.py", line 405, in suggest_categorical
    return self._suggest(name, CategoricalDistribution(choices=choices))
  File "/home/ketrong/miniconda3/envs/tpot2devenv/lib/python3.10/site-packages/optuna/trial/_trial.py", line 636, in _suggest
    storage.set_trial_param(trial_id, name, param_value_in_internal_repr, distribution)
  File "/home/ketrong/miniconda3/envs/tpot2devenv/lib/python3.10/site-packages/optuna/storages/_in_memory.py", line 187, in set_trial_param
    distributions.check_distribution_compatibility(
  File "/home/ketrong/miniconda3/envs/tpot2devenv/lib/python3.10/site-packages/optuna/distributions.py", line 670, in check_distribution_compatibility
    raise ValueError(
ValueError: CategoricalDistribution does not support dynamic value space.
Best trial: 1. Best value: inf:   0%|          | 1/200 [00:00<00:56,  3.53it/s]                                                                               [W 2023-11-24 15:16:57,279] Trial 9 failed with value None.
Best trial: 1. Best value: inf:   0%|          | 1/200 [00:00<00:56,  3.53it/s][W 2023-11-24 15:16:57,001] Trial 8 failed with parameters: {'model_name': 'IterativeImputer'} because of the following error: ValueError('CategoricalDistribution does not support dynamic value space.').
Traceback (most recent call last):
  File "/home/ketrong/miniconda3/envs/tpot2devenv/lib/python3.10/site-packages/optuna/study/_optimize.py", line 200, in _run_trial
    value_or_values = func(trial)
  File "/common/ketrong/AutoImputeExp/tpot2_imputetest/Impute_Experiments/autoimpute.py", line 56, in obj
    my_params = autoutils.trial_suggestion(trial, self.model_names, column_len=len(X.columns), random_state=self.random_state)
  File "/common/ketrong/AutoImputeExp/tpot2_imputetest/Impute_Experiments/autoutils.py", line 20, in trial_suggestion
    my_params = params_IterativeImpute(trial,model_name) #Uses the dependence between columns in the data set to predict for the one column. Predictions occur through a variety of strategies.
  File "/common/ketrong/AutoImputeExp/tpot2_imputetest/Impute_Experiments/param_grids.py", line 20, in params_IterativeImpute
    params['estimator'] = trial.suggest_categorical('estimator', [Bayes, RFR, Ridge, KNN])
  File "/home/ketrong/miniconda3/envs/tpot2devenv/lib/python3.10/site-packages/optuna/trial/_trial.py", line 405, in suggest_categorical
    return self._suggest(name, CategoricalDistribution(choices=choices))
  File "/home/ketrong/miniconda3/envs/tpot2devenv/lib/python3.10/site-packages/optuna/trial/_trial.py", line 636, in _suggest
    storage.set_trial_param(trial_id, name, param_value_in_internal_repr, distribution)
  File "/home/ketrong/miniconda3/envs/tpot2devenv/lib/python3.10/site-packages/optuna/storages/_in_memory.py", line 187, in set_trial_param
    distributions.check_distribution_compatibility(
  File "/home/ketrong/miniconda3/envs/tpot2devenv/lib/python3.10/site-packages/optuna/distributions.py", line 670, in check_distribution_compatibility
    raise ValueError(
ValueError: CategoricalDistribution does not support dynamic value space.
                                                                               Best trial: 1. Best value: inf:   0%|          | 1/200 [00:00<00:56,  3.53it/s]                                                                               [W 2023-11-24 15:16:57,498] Trial 8 failed with value None.
Best trial: 1. Best value: inf:   0%|          | 1/200 [00:00<00:56,  3.53it/s][I 2023-11-24 15:16:57,822] Trial 10 finished with value: inf and parameters: {'model_name': 'KNNImputer', 'weights': 'distance', 'keep_empty_features': False}. Best is trial 1 with value: inf.
                                                                               Best trial: 1. Best value: inf:   0%|          | 1/200 [00:01<00:56,  3.53it/s][I 2023-11-24 15:16:58,055] Trial 11 finished with value: inf and parameters: {'model_name': 'KNNImputer', 'weights': 'distance', 'keep_empty_features': False}. Best is trial 1 with value: inf.
                                                                               Best trial: 1. Best value: inf:   0%|          | 1/200 [00:01<00:56,  3.53it/s]Best trial: 1. Best value: inf:   0%|          | 1/200 [00:01<00:56,  3.53it/s]Best trial: 1. Best value: inf:   1%|          | 2/200 [00:01<02:54,  1.14it/s]Best trial: 1. Best value: inf:   1%|          | 2/200 [00:01<02:54,  1.14it/s]                                                                               [W 2023-11-24 15:16:58,377] Trial 18 failed with parameters: {'model_name': 'IterativeImputer'} because of the following error: ValueError('CategoricalDistribution does not support dynamic value space.').
Traceback (most recent call last):
  File "/home/ketrong/miniconda3/envs/tpot2devenv/lib/python3.10/site-packages/optuna/study/_optimize.py", line 200, in _run_trial
    value_or_values = func(trial)
  File "/common/ketrong/AutoImputeExp/tpot2_imputetest/Impute_Experiments/autoimpute.py", line 56, in obj
    my_params = autoutils.trial_suggestion(trial, self.model_names, column_len=len(X.columns), random_state=self.random_state)
  File "/common/ketrong/AutoImputeExp/tpot2_imputetest/Impute_Experiments/autoutils.py", line 20, in trial_suggestion
    my_params = params_IterativeImpute(trial,model_name) #Uses the dependence between columns in the data set to predict for the one column. Predictions occur through a variety of strategies.
  File "/common/ketrong/AutoImputeExp/tpot2_imputetest/Impute_Experiments/param_grids.py", line 20, in params_IterativeImpute
    params['estimator'] = trial.suggest_categorical('estimator', [Bayes, RFR, Ridge, KNN])
  File "/home/ketrong/miniconda3/envs/tpot2devenv/lib/python3.10/site-packages/optuna/trial/_trial.py", line 405, in suggest_categorical
    return self._suggest(name, CategoricalDistribution(choices=choices))
  File "/home/ketrong/miniconda3/envs/tpot2devenv/lib/python3.10/site-packages/optuna/trial/_trial.py", line 636, in _suggest
    storage.set_trial_param(trial_id, name, param_value_in_internal_repr, distribution)
  File "/home/ketrong/miniconda3/envs/tpot2devenv/lib/python3.10/site-packages/optuna/storages/_in_memory.py", line 187, in set_trial_param
    distributions.check_distribution_compatibility(
  File "/home/ketrong/miniconda3/envs/tpot2devenv/lib/python3.10/site-packages/optuna/distributions.py", line 670, in check_distribution_compatibility
    raise ValueError(
ValueError: CategoricalDistribution does not support dynamic value space.
Best trial: 1. Best value: inf:   2%|▏         | 3/200 [00:01<02:53,  1.14it/s]                                                                               [W 2023-11-24 15:16:58,380] Trial 18 failed with value None.
Best trial: 1. Best value: inf:   2%|▏         | 3/200 [00:01<02:53,  1.14it/s]                                                                               [W 2023-11-24 15:16:58,625] Trial 20 failed with parameters: {'model_name': 'IterativeImputer'} because of the following error: ValueError('CategoricalDistribution does not support dynamic value space.').
Traceback (most recent call last):
  File "/home/ketrong/miniconda3/envs/tpot2devenv/lib/python3.10/site-packages/optuna/study/_optimize.py", line 200, in _run_trial
    value_or_values = func(trial)
  File "/common/ketrong/AutoImputeExp/tpot2_imputetest/Impute_Experiments/autoimpute.py", line 56, in obj
    my_params = autoutils.trial_suggestion(trial, self.model_names, column_len=len(X.columns), random_state=self.random_state)
  File "/common/ketrong/AutoImputeExp/tpot2_imputetest/Impute_Experiments/autoutils.py", line 20, in trial_suggestion
    my_params = params_IterativeImpute(trial,model_name) #Uses the dependence between columns in the data set to predict for the one column. Predictions occur through a variety of strategies.
  File "/common/ketrong/AutoImputeExp/tpot2_imputetest/Impute_Experiments/param_grids.py", line 20, in params_IterativeImpute
    params['estimator'] = trial.suggest_categorical('estimator', [Bayes, RFR, Ridge, KNN])
  File "/home/ketrong/miniconda3/envs/tpot2devenv/lib/python3.10/site-packages/optuna/trial/_trial.py", line 405, in suggest_categorical
    return self._suggest(name, CategoricalDistribution(choices=choices))
  File "/home/ketrong/miniconda3/envs/tpot2devenv/lib/python3.10/site-packages/optuna/trial/_trial.py", line 636, in _suggest
    storage.set_trial_param(trial_id, name, param_value_in_internal_repr, distribution)
  File "/home/ketrong/miniconda3/envs/tpot2devenv/lib/python3.10/site-packages/optuna/storages/_in_memory.py", line 187, in set_trial_param
    distributions.check_distribution_compatibility(
  File "/home/ketrong/miniconda3/envs/tpot2devenv/lib/python3.10/site-packages/optuna/distributions.py", line 670, in check_distribution_compatibility
    raise ValueError(
ValueError: CategoricalDistribution does not support dynamic value space.
Best trial: 1. Best value: inf:   2%|▏         | 3/200 [00:01<02:53,  1.14it/s][W 2023-11-24 15:16:58,644] Trial 20 failed with value None.
                                                                               Best trial: 1. Best value: inf:   2%|▏         | 3/200 [00:01<02:53,  1.14it/s][I 2023-11-24 15:16:58,638] Trial 13 finished with value: inf and parameters: {'model_name': 'KNNImputer', 'weights': 'distance', 'keep_empty_features': False}. Best is trial 1 with value: inf.
                                                                               Best trial: 1. Best value: inf:   2%|▏         | 3/200 [00:02<02:53,  1.14it/s]Best trial: 1. Best value: inf:   2%|▏         | 3/200 [00:02<02:53,  1.14it/s]Best trial: 1. Best value: inf:   2%|▏         | 4/200 [00:02<01:55,  1.70it/s]                                                                               [W 2023-11-24 15:16:59,103] Trial 24 failed with parameters: {'model_name': 'IterativeImputer'} because of the following error: ValueError('CategoricalDistribution does not support dynamic value space.').
Traceback (most recent call last):
  File "/home/ketrong/miniconda3/envs/tpot2devenv/lib/python3.10/site-packages/optuna/study/_optimize.py", line 200, in _run_trial
    value_or_values = func(trial)
  File "/common/ketrong/AutoImputeExp/tpot2_imputetest/Impute_Experiments/autoimpute.py", line 56, in obj
    my_params = autoutils.trial_suggestion(trial, self.model_names, column_len=len(X.columns), random_state=self.random_state)
  File "/common/ketrong/AutoImputeExp/tpot2_imputetest/Impute_Experiments/autoutils.py", line 20, in trial_suggestion
    my_params = params_IterativeImpute(trial,model_name) #Uses the dependence between columns in the data set to predict for the one column. Predictions occur through a variety of strategies.
  File "/common/ketrong/AutoImputeExp/tpot2_imputetest/Impute_Experiments/param_grids.py", line 20, in params_IterativeImpute
    params['estimator'] = trial.suggest_categorical('estimator', [Bayes, RFR, Ridge, KNN])
  File "/home/ketrong/miniconda3/envs/tpot2devenv/lib/python3.10/site-packages/optuna/trial/_trial.py", line 405, in suggest_categorical
    return self._suggest(name, CategoricalDistribution(choices=choices))
  File "/home/ketrong/miniconda3/envs/tpot2devenv/lib/python3.10/site-packages/optuna/trial/_trial.py", line 636, in _suggest
    storage.set_trial_param(trial_id, name, param_value_in_internal_repr, distribution)
  File "/home/ketrong/miniconda3/envs/tpot2devenv/lib/python3.10/site-packages/optuna/storages/_in_memory.py", line 187, in set_trial_param
    distributions.check_distribution_compatibility(
  File "/home/ketrong/miniconda3/envs/tpot2devenv/lib/python3.10/site-packages/optuna/distributions.py", line 670, in check_distribution_compatibility
    raise ValueError(
ValueError: CategoricalDistribution does not support dynamic value space.
Best trial: 1. Best value: inf:   2%|▏         | 4/200 [00:02<01:55,  1.70it/s]                                                                               [W 2023-11-24 15:16:59,108] Trial 24 failed with value None.
Best trial: 1. Best value: inf:   2%|▏         | 4/200 [00:02<01:55,  1.70it/s]                                                                               [I 2023-11-24 15:16:59,360] Trial 3 finished with value: 6.600086592787521 and parameters: {'model_name': 'SimpleImputer', 'strategy': 'constant'}. Best is trial 3 with value: 6.600086592787521.
Best trial: 1. Best value: inf:   2%|▏         | 4/200 [00:02<01:55,  1.70it/s]Best trial: 3. Best value: 6.60009:   2%|▏         | 4/200 [00:02<01:55,  1.70it/s]Best trial: 3. Best value: 6.60009:   2%|▎         | 5/200 [00:02<01:48,  1.79it/s]                                                                                   [W 2023-11-24 15:16:59,660] Trial 36 failed with parameters: {'model_name': 'IterativeImputer'} because of the following error: ValueError('CategoricalDistribution does not support dynamic value space.').
Traceback (most recent call last):
  File "/home/ketrong/miniconda3/envs/tpot2devenv/lib/python3.10/site-packages/optuna/study/_optimize.py", line 200, in _run_trial
    value_or_values = func(trial)
  File "/common/ketrong/AutoImputeExp/tpot2_imputetest/Impute_Experiments/autoimpute.py", line 56, in obj
    my_params = autoutils.trial_suggestion(trial, self.model_names, column_len=len(X.columns), random_state=self.random_state)
  File "/common/ketrong/AutoImputeExp/tpot2_imputetest/Impute_Experiments/autoutils.py", line 20, in trial_suggestion
    my_params = params_IterativeImpute(trial,model_name) #Uses the dependence between columns in the data set to predict for the one column. Predictions occur through a variety of strategies.
  File "/common/ketrong/AutoImputeExp/tpot2_imputetest/Impute_Experiments/param_grids.py", line 20, in params_IterativeImpute
    params['estimator'] = trial.suggest_categorical('estimator', [Bayes, RFR, Ridge, KNN])
  File "/home/ketrong/miniconda3/envs/tpot2devenv/lib/python3.10/site-packages/optuna/trial/_trial.py", line 405, in suggest_categorical
    return self._suggest(name, CategoricalDistribution(choices=choices))
  File "/home/ketrong/miniconda3/envs/tpot2devenv/lib/python3.10/site-packages/optuna/trial/_trial.py", line 636, in _suggest
    storage.set_trial_param(trial_id, name, param_value_in_internal_repr, distribution)
  File "/home/ketrong/miniconda3/envs/tpot2devenv/lib/python3.10/site-packages/optuna/storages/_in_memory.py", line 187, in set_trial_param
    distributions.check_distribution_compatibility(
  File "/home/ketrong/miniconda3/envs/tpot2devenv/lib/python3.10/site-packages/optuna/distributions.py", line 670, in check_distribution_compatibility
    raise ValueError(
ValueError: CategoricalDistribution does not support dynamic value space.
Best trial: 3. Best value: 6.60009:   2%|▎         | 5/200 [00:02<01:48,  1.79it/s]                                                                                   [W 2023-11-24 15:16:59,662] Trial 36 failed with value None.
Best trial: 3. Best value: 6.60009:   2%|▎         | 5/200 [00:02<01:48,  1.79it/s][I 2023-11-24 15:16:59,662] Trial 19 finished with value: inf and parameters: {'model_name': 'KNNImputer', 'weights': 'distance', 'keep_empty_features': True}. Best is trial 3 with value: 6.600086592787521.
                                                                                   Best trial: 3. Best value: 6.60009:   2%|▎         | 5/200 [00:03<01:48,  1.79it/s]Best trial: 3. Best value: 6.60009:   2%|▎         | 5/200 [00:03<01:48,  1.79it/s]Best trial: 3. Best value: 6.60009:   3%|▎         | 6/200 [00:03<01:46,  1.83it/s]                                                                                   [I 2023-11-24 15:17:00,157] Trial 42 finished with value: inf and parameters: {'model_name': 'KNNImputer', 'weights': 'distance', 'keep_empty_features': True}. Best is trial 3 with value: 6.600086592787521.
Best trial: 3. Best value: 6.60009:   3%|▎         | 6/200 [00:03<01:46,  1.83it/s]Best trial: 3. Best value: 6.60009:   3%|▎         | 6/200 [00:03<01:46,  1.83it/s]Best trial: 3. Best value: 6.60009:   4%|▎         | 7/200 [00:03<01:31,  2.12it/s]                                                                                   [I 2023-11-24 15:17:00,164] Trial 23 finished with value: inf and parameters: {'model_name': 'KNNImputer', 'weights': 'uniform', 'keep_empty_features': False}. Best is trial 3 with value: 6.600086592787521.
Best trial: 3. Best value: 6.60009:   4%|▎         | 7/200 [00:03<01:31,  2.12it/s]Best trial: 3. Best value: 6.60009:   4%|▎         | 7/200 [00:03<01:31,  2.12it/s]Best trial: 3. Best value: 6.60009:   4%|▍         | 8/200 [00:03<01:16,  2.51it/s]                                                                                   [I 2023-11-24 15:17:00,169] Trial 2 finished with value: inf and parameters: {'model_name': 'RandomForestImputer', 'max_iter': 9, 'decreasing': True, 'min_samples_split': 0.30000000000000004, 'min_samples_leaf': 0.6000000000000001, 'max_features': 0.5, 'bootstrap': False, 'oob_score': True, 'warm_start': False}. Best is trial 3 with value: 6.600086592787521.
Best trial: 3. Best value: 6.60009:   4%|▍         | 8/200 [00:03<01:16,  2.51it/s]Best trial: 3. Best value: 6.60009:   4%|▍         | 8/200 [00:04<01:16,  2.51it/s]Best trial: 3. Best value: 6.60009:   4%|▍         | 9/200 [00:04<01:06,  2.89it/s]                                                                                   [I 2023-11-24 15:17:00,407] Trial 29 finished with value: inf and parameters: {'model_name': 'KNNImputer', 'weights': 'uniform', 'keep_empty_features': False}. Best is trial 3 with value: 6.600086592787521.
