Best trial: 0. Best value: inf:   1%|          | 2/200 [00:00<00:45,  4.33it/s]Best trial: 0. Best value: inf:   1%|          | 2/200 [00:00<00:45,  4.33it/s]Best trial: 0. Best value: inf:   2%|▏         | 3/200 [00:00<00:41,  4.80it/s][I 2023-11-24 15:16:05,979] Trial 5 finished with value: inf and parameters: {'model_name': 'RandomForestImputer', 'max_iter': 2, 'decreasing': False, 'min_samples_split': 0.8, 'min_samples_leaf': 0.30000000000000004, 'max_features': 0.8, 'bootstrap': False, 'oob_score': True, 'warm_start': True}. Best is trial 0 with value: inf.
                                                                               Best trial: 0. Best value: inf:   2%|▏         | 3/200 [00:00<00:41,  4.80it/s]Best trial: 0. Best value: inf:   2%|▏         | 3/200 [00:00<00:41,  4.80it/s]Best trial: 0. Best value: inf:   2%|▏         | 4/200 [00:00<00:37,  5.16it/s]                                                                               [I 2023-11-24 15:16:06,156] Trial 10 finished with value: inf and parameters: {'model_name': 'KNNImputer', 'weights': 'uniform', 'keep_empty_features': False}. Best is trial 0 with value: inf.
Best trial: 0. Best value: inf:   2%|▏         | 4/200 [00:00<00:37,  5.16it/s]Best trial: 0. Best value: inf:   2%|▏         | 4/200 [00:00<00:37,  5.16it/s]Best trial: 0. Best value: inf:   2%|▎         | 5/200 [00:00<00:36,  5.34it/s][W 2023-11-24 15:16:06,337] Trial 12 failed with parameters: {'model_name': 'IterativeImputer'} because of the following error: ValueError('CategoricalDistribution does not support dynamic value space.').
Traceback (most recent call last):
  File "/home/ketrong/miniconda3/envs/tpot2devenv/lib/python3.10/site-packages/optuna/study/_optimize.py", line 200, in _run_trial
    value_or_values = func(trial)
  File "/common/ketrong/AutoImputeExp/tpot2_imputetest/Impute_Experiments/autoimpute.py", line 56, in obj
    my_params = autoutils.trial_suggestion(trial, self.model_names, column_len=len(X.columns), random_state=self.random_state)
  File "/common/ketrong/AutoImputeExp/tpot2_imputetest/Impute_Experiments/autoutils.py", line 20, in trial_suggestion
    my_params = params_IterativeImpute(trial,model_name) #Uses the dependence between columns in the data set to predict for the one column. Predictions occur through a variety of strategies.
  File "/common/ketrong/AutoImputeExp/tpot2_imputetest/Impute_Experiments/param_grids.py", line 20, in params_IterativeImpute
    params['estimator'] = trial.suggest_categorical('estimator', [Bayes, RFR, Ridge, KNN])
  File "/home/ketrong/miniconda3/envs/tpot2devenv/lib/python3.10/site-packages/optuna/trial/_trial.py", line 405, in suggest_categorical
    return self._suggest(name, CategoricalDistribution(choices=choices))
  File "/home/ketrong/miniconda3/envs/tpot2devenv/lib/python3.10/site-packages/optuna/trial/_trial.py", line 636, in _suggest
    storage.set_trial_param(trial_id, name, param_value_in_internal_repr, distribution)
  File "/home/ketrong/miniconda3/envs/tpot2devenv/lib/python3.10/site-packages/optuna/storages/_in_memory.py", line 187, in set_trial_param
    distributions.check_distribution_compatibility(
  File "/home/ketrong/miniconda3/envs/tpot2devenv/lib/python3.10/site-packages/optuna/distributions.py", line 670, in check_distribution_compatibility
    raise ValueError(
ValueError: CategoricalDistribution does not support dynamic value space.
                                                                               Best trial: 0. Best value: inf:   2%|▎         | 5/200 [00:01<00:36,  5.34it/s]                                                                               Best trial: 0. Best value: inf:   2%|▎         | 5/200 [00:01<00:36,  5.34it/s][W 2023-11-24 15:16:06,424] Trial 12 failed with value None.
[I 2023-11-24 15:16:06,369] Trial 17 finished with value: inf and parameters: {'model_name': 'KNNImputer', 'weights': 'uniform', 'keep_empty_features': True}. Best is trial 0 with value: inf.
                                                                               Best trial: 0. Best value: inf:   2%|▎         | 5/200 [00:01<00:36,  5.34it/s]Best trial: 0. Best value: inf:   2%|▎         | 5/200 [00:01<00:36,  5.34it/s]Best trial: 0. Best value: inf:   3%|▎         | 6/200 [00:01<00:53,  3.63it/s][W 2023-11-24 15:16:06,370] Trial 14 failed with parameters: {'model_name': 'IterativeImputer'} because of the following error: ValueError('CategoricalDistribution does not support dynamic value space.').
Traceback (most recent call last):
  File "/home/ketrong/miniconda3/envs/tpot2devenv/lib/python3.10/site-packages/optuna/study/_optimize.py", line 200, in _run_trial
    value_or_values = func(trial)
  File "/common/ketrong/AutoImputeExp/tpot2_imputetest/Impute_Experiments/autoimpute.py", line 56, in obj
    my_params = autoutils.trial_suggestion(trial, self.model_names, column_len=len(X.columns), random_state=self.random_state)
  File "/common/ketrong/AutoImputeExp/tpot2_imputetest/Impute_Experiments/autoutils.py", line 20, in trial_suggestion
    my_params = params_IterativeImpute(trial,model_name) #Uses the dependence between columns in the data set to predict for the one column. Predictions occur through a variety of strategies.
  File "/common/ketrong/AutoImputeExp/tpot2_imputetest/Impute_Experiments/param_grids.py", line 20, in params_IterativeImpute
    params['estimator'] = trial.suggest_categorical('estimator', [Bayes, RFR, Ridge, KNN])
  File "/home/ketrong/miniconda3/envs/tpot2devenv/lib/python3.10/site-packages/optuna/trial/_trial.py", line 405, in suggest_categorical
    return self._suggest(name, CategoricalDistribution(choices=choices))
  File "/home/ketrong/miniconda3/envs/tpot2devenv/lib/python3.10/site-packages/optuna/trial/_trial.py", line 636, in _suggest
    storage.set_trial_param(trial_id, name, param_value_in_internal_repr, distribution)
  File "/home/ketrong/miniconda3/envs/tpot2devenv/lib/python3.10/site-packages/optuna/storages/_in_memory.py", line 187, in set_trial_param
    distributions.check_distribution_compatibility(
  File "/home/ketrong/miniconda3/envs/tpot2devenv/lib/python3.10/site-packages/optuna/distributions.py", line 670, in check_distribution_compatibility
    raise ValueError(
ValueError: CategoricalDistribution does not support dynamic value space.
                                                                               Best trial: 0. Best value: inf:   3%|▎         | 6/200 [00:01<00:53,  3.63it/s]                                                                               [W 2023-11-24 15:16:06,773] Trial 14 failed with value None.
Best trial: 0. Best value: inf:   3%|▎         | 6/200 [00:01<00:53,  3.63it/s]                                                                               [I 2023-11-24 15:16:06,348] Trial 6 finished with value: inf and parameters: {'model_name': 'RandomForestImputer', 'max_iter': 17, 'decreasing': True, 'min_samples_split': 0.30000000000000004, 'min_samples_leaf': 0.5, 'max_features': 0.1, 'bootstrap': True, 'oob_score': False, 'warm_start': True}. Best is trial 0 with value: inf.
Best trial: 0. Best value: inf:   3%|▎         | 6/200 [00:01<00:53,  3.63it/s]Best trial: 0. Best value: inf:   3%|▎         | 6/200 [00:01<00:53,  3.63it/s]Best trial: 0. Best value: inf:   4%|▎         | 7/200 [00:01<00:57,  3.39it/s]                                                                               [I 2023-11-24 15:16:06,411] Trial 8 finished with value: inf and parameters: {'model_name': 'GAIN', 'batch_size': 699, 'hint_rate': 0.006401827706857687, 'alpha': 10, 'iterations': 423}. Best is trial 0 with value: inf.
Best trial: 0. Best value: inf:   4%|▎         | 7/200 [00:01<00:57,  3.39it/s]Best trial: 0. Best value: inf:   4%|▎         | 7/200 [00:01<00:57,  3.39it/s]Best trial: 0. Best value: inf:   4%|▍         | 8/200 [00:01<00:48,  3.96it/s][I 2023-11-24 15:16:07,283] Trial 13 finished with value: inf and parameters: {'model_name': 'KNNImputer', 'weights': 'distance', 'keep_empty_features': True}. Best is trial 0 with value: inf.
