/cm/local/apps/slurm/var/spool/job405545/slurm_script: line 19: /common/ketrong/minconda3/etc/profile.d/conda.sh: No such file or directory
/cm/local/apps/slurm/var/spool/job405545/slurm_script: line 22: $'\nconda create --name tpot2devenv -c conda-forge python=3.10\n': command not found
/cm/local/apps/slurm/var/spool/job405545/slurm_script: line 27: $'\npip install -r requirements.txt\n': command not found
RunStart
2023-11-22 20:02:31.125843: I tensorflow/core/util/port.cc:113] oneDNN custom operations are on. You may see slightly different numerical results due to floating-point round-off errors from different computation orders. To turn them off, set the environment variable `TF_ENABLE_ONEDNN_OPTS=0`.
2023-11-22 20:02:31.161712: E external/local_xla/xla/stream_executor/cuda/cuda_dnn.cc:9261] Unable to register cuDNN factory: Attempting to register factory for plugin cuDNN when one has already been registered
2023-11-22 20:02:31.161736: E external/local_xla/xla/stream_executor/cuda/cuda_fft.cc:607] Unable to register cuFFT factory: Attempting to register factory for plugin cuFFT when one has already been registered
2023-11-22 20:02:31.163106: E external/local_xla/xla/stream_executor/cuda/cuda_blas.cc:1515] Unable to register cuBLAS factory: Attempting to register factory for plugin cuBLAS when one has already been registered
2023-11-22 20:02:31.169208: I tensorflow/core/platform/cpu_feature_guard.cc:182] This TensorFlow binary is optimized to use available CPU instructions in performance-critical operations.
To enable the following instructions: AVX2 AVX512F AVX512_VNNI FMA, in other operations, rebuild TensorFlow with the appropriate compiler flags.
2023-11-22 20:02:34.249355: W tensorflow/compiler/tf2tensorrt/utils/py_utils.cc:38] TF-TRT Warning: Could not find TensorRT
WARNING:tensorflow:From /home/ketrong/miniconda3/envs/tpot2devenv/lib/python3.10/site-packages/tensorflow/python/compat/v2_compat.py:108: disable_resource_variables (from tensorflow.python.ops.variable_scope) is deprecated and will be removed in a future version.
Instructions for updating:
non-resource variables are not supported in the long term
working on 
tpot2_imputetest/Impute_Experiments/logs//tpot2_base_normal_6_0.3_MNAR_3
loading data
tpot2_imputetest/Impute_Experiments/data/6_True.pkl
running experiment 1/3 - Does large hyperparameter space improve reconstruction accuracy over simple
[I 2023-11-22 20:07:25,758] A new study created in memory with name: no-name-0a1e7154-c543-40a7-a306-e5828097bd13
[I 2023-11-22 20:07:26,829] Trial 4 finished with value: 6.560269285589084 and parameters: {'model_name': 'SimpleImputer', 'strategy': 'constant'}. Best is trial 4 with value: 6.560269285589084.
[I 2023-11-22 20:07:27,468] Trial 2 finished with value: 6.560269285589084 and parameters: {'model_name': 'SimpleImputer', 'strategy': 'constant'}. Best is trial 4 with value: 6.560269285589084.
[I 2023-11-22 20:07:27,880] Trial 7 finished with value: 6.560269285589084 and parameters: {'model_name': 'SimpleImputer', 'strategy': 'constant'}. Best is trial 4 with value: 6.560269285589084.
[I 2023-11-22 20:07:28,426] Trial 6 finished with value: 2.3221009143279607 and parameters: {'model_name': 'SimpleImputer', 'strategy': 'mean'}. Best is trial 6 with value: 2.3221009143279607.
[I 2023-11-22 20:07:28,622] Trial 8 finished with value: 6.560269285589084 and parameters: {'model_name': 'SimpleImputer', 'strategy': 'constant'}. Best is trial 6 with value: 2.3221009143279607.
[I 2023-11-22 20:07:28,918] Trial 1 finished with value: 2.3221009143279607 and parameters: {'model_name': 'SimpleImputer', 'strategy': 'mean'}. Best is trial 6 with value: 2.3221009143279607.
[I 2023-11-22 20:07:29,159] Trial 0 finished with value: 2.3221009143279607 and parameters: {'model_name': 'SimpleImputer', 'strategy': 'mean'}. Best is trial 6 with value: 2.3221009143279607.
[I 2023-11-22 20:07:29,327] Trial 25 finished with value: 6.560269285589084 and parameters: {'model_name': 'SimpleImputer', 'strategy': 'constant'}. Best is trial 6 with value: 2.3221009143279607.
[I 2023-11-22 20:07:29,741] Trial 5 finished with value: 2.3221009143279607 and parameters: {'model_name': 'SimpleImputer', 'strategy': 'mean'}. Best is trial 6 with value: 2.3221009143279607.
[I 2023-11-22 20:07:30,017] Trial 11 finished with value: 2.3221009143279607 and parameters: {'model_name': 'SimpleImputer', 'strategy': 'mean'}. Best is trial 6 with value: 2.3221009143279607.
[I 2023-11-22 20:07:30,418] Trial 15 finished with value: 2.3221009143279607 and parameters: {'model_name': 'SimpleImputer', 'strategy': 'mean'}. Best is trial 6 with value: 2.3221009143279607.
[I 2023-11-22 20:07:30,673] Trial 43 finished with value: 6.560269285589084 and parameters: {'model_name': 'SimpleImputer', 'strategy': 'constant'}. Best is trial 6 with value: 2.3221009143279607.
[I 2023-11-22 20:07:30,938] Trial 9 finished with value: 2.3221009143279607 and parameters: {'model_name': 'SimpleImputer', 'strategy': 'mean'}. Best is trial 6 with value: 2.3221009143279607.
[I 2023-11-22 20:07:31,222] Trial 30 finished with value: 2.3221009143279607 and parameters: {'model_name': 'SimpleImputer', 'strategy': 'mean'}. Best is trial 6 with value: 2.3221009143279607.
[I 2023-11-22 20:07:31,421] Trial 32 finished with value: 6.560269285589084 and parameters: {'model_name': 'SimpleImputer', 'strategy': 'constant'}. Best is trial 6 with value: 2.3221009143279607.
[I 2023-11-22 20:07:31,630] Trial 40 finished with value: 6.560269285589084 and parameters: {'model_name': 'SimpleImputer', 'strategy': 'constant'}. Best is trial 6 with value: 2.3221009143279607.
[I 2023-11-22 20:07:31,889] Trial 16 finished with value: 2.3221009143279607 and parameters: {'model_name': 'SimpleImputer', 'strategy': 'mean'}. Best is trial 6 with value: 2.3221009143279607.
[I 2023-11-22 20:07:32,086] Trial 19 finished with value: 2.3221009143279607 and parameters: {'model_name': 'SimpleImputer', 'strategy': 'mean'}. Best is trial 6 with value: 2.3221009143279607.
[I 2023-11-22 20:07:32,331] Trial 44 finished with value: 6.560269285589084 and parameters: {'model_name': 'SimpleImputer', 'strategy': 'constant'}. Best is trial 6 with value: 2.3221009143279607.
[I 2023-11-22 20:07:32,541] Trial 20 finished with value: 2.3221009143279607 and parameters: {'model_name': 'SimpleImputer', 'strategy': 'mean'}. Best is trial 6 with value: 2.3221009143279607.
[I 2023-11-22 20:07:32,751] Trial 27 finished with value: 2.3221009143279607 and parameters: {'model_name': 'SimpleImputer', 'strategy': 'mean'}. Best is trial 6 with value: 2.3221009143279607.
[I 2023-11-22 20:07:32,972] Trial 34 finished with value: 6.560269285589084 and parameters: {'model_name': 'SimpleImputer', 'strategy': 'constant'}. Best is trial 6 with value: 2.3221009143279607.
[I 2023-11-22 20:07:33,181] Trial 18 finished with value: 2.3221009143279607 and parameters: {'model_name': 'SimpleImputer', 'strategy': 'mean'}. Best is trial 6 with value: 2.3221009143279607.
[I 2023-11-22 20:07:33,426] Trial 46 finished with value: 6.560269285589084 and parameters: {'model_name': 'SimpleImputer', 'strategy': 'constant'}. Best is trial 6 with value: 2.3221009143279607.
[I 2023-11-22 20:07:33,715] Trial 10 finished with value: 2.3221009143279607 and parameters: {'model_name': 'SimpleImputer', 'strategy': 'mean'}. Best is trial 6 with value: 2.3221009143279607.
[I 2023-11-22 20:07:34,171] Trial 48 finished with value: 6.560269285589084 and parameters: {'model_name': 'SimpleImputer', 'strategy': 'constant'}. Best is trial 6 with value: 2.3221009143279607.
[I 2023-11-22 20:07:34,576] Trial 36 finished with value: 2.3221009143279607 and parameters: {'model_name': 'SimpleImputer', 'strategy': 'mean'}. Best is trial 6 with value: 2.3221009143279607.
[I 2023-11-22 20:07:34,798] Trial 37 finished with value: 2.3221009143279607 and parameters: {'model_name': 'SimpleImputer', 'strategy': 'mean'}. Best is trial 6 with value: 2.3221009143279607.
[I 2023-11-22 20:07:35,002] Trial 13 finished with value: 2.3923393086349485 and parameters: {'model_name': 'SimpleImputer', 'strategy': 'median'}. Best is trial 6 with value: 2.3221009143279607.
[I 2023-11-22 20:07:35,254] Trial 35 finished with value: 2.3221009143279607 and parameters: {'model_name': 'SimpleImputer', 'strategy': 'mean'}. Best is trial 6 with value: 2.3221009143279607.
[I 2023-11-22 20:07:35,587] Trial 50 finished with value: 6.560269285589084 and parameters: {'model_name': 'SimpleImputer', 'strategy': 'constant'}. Best is trial 6 with value: 2.3221009143279607.
[I 2023-11-22 20:07:35,871] Trial 3 finished with value: 2.3923393086349485 and parameters: {'model_name': 'SimpleImputer', 'strategy': 'median'}. Best is trial 6 with value: 2.3221009143279607.
[I 2023-11-22 20:07:36,213] Trial 28 finished with value: 2.3221009143279607 and parameters: {'model_name': 'SimpleImputer', 'strategy': 'mean'}. Best is trial 6 with value: 2.3221009143279607.
[I 2023-11-22 20:07:36,501] Trial 47 finished with value: 2.3221009143279607 and parameters: {'model_name': 'SimpleImputer', 'strategy': 'mean'}. Best is trial 6 with value: 2.3221009143279607.
[I 2023-11-22 20:07:36,780] Trial 24 finished with value: 2.3923393086349485 and parameters: {'model_name': 'SimpleImputer', 'strategy': 'median'}. Best is trial 6 with value: 2.3221009143279607.
[I 2023-11-22 20:07:37,129] Trial 54 finished with value: 6.560269285589084 and parameters: {'model_name': 'SimpleImputer', 'strategy': 'constant'}. Best is trial 6 with value: 2.3221009143279607.
[I 2023-11-22 20:07:37,556] Trial 21 finished with value: 2.3923393086349485 and parameters: {'model_name': 'SimpleImputer', 'strategy': 'median'}. Best is trial 6 with value: 2.3221009143279607.
[I 2023-11-22 20:07:37,850] Trial 29 finished with value: 2.3923393086349485 and parameters: {'model_name': 'SimpleImputer', 'strategy': 'median'}. Best is trial 6 with value: 2.3221009143279607.
[I 2023-11-22 20:07:38,119] Trial 42 finished with value: 2.3923393086349485 and parameters: {'model_name': 'SimpleImputer', 'strategy': 'median'}. Best is trial 6 with value: 2.3221009143279607.
[I 2023-11-22 20:07:38,466] Trial 22 finished with value: 2.3923393086349485 and parameters: {'model_name': 'SimpleImputer', 'strategy': 'median'}. Best is trial 6 with value: 2.3221009143279607.
[I 2023-11-22 20:07:38,674] Trial 26 finished with value: 2.3923393086349485 and parameters: {'model_name': 'SimpleImputer', 'strategy': 'median'}. Best is trial 6 with value: 2.3221009143279607.
[I 2023-11-22 20:07:38,986] Trial 45 finished with value: 2.3923393086349485 and parameters: {'model_name': 'SimpleImputer', 'strategy': 'median'}. Best is trial 6 with value: 2.3221009143279607.
[I 2023-11-22 20:07:39,360] Trial 52 finished with value: 2.3221009143279607 and parameters: {'model_name': 'SimpleImputer', 'strategy': 'mean'}. Best is trial 6 with value: 2.3221009143279607.
[I 2023-11-22 20:07:39,743] Trial 51 finished with value: 2.3221009143279607 and parameters: {'model_name': 'SimpleImputer', 'strategy': 'mean'}. Best is trial 6 with value: 2.3221009143279607.
[I 2023-11-22 20:07:40,349] Trial 55 finished with value: 2.3923393086349485 and parameters: {'model_name': 'SimpleImputer', 'strategy': 'median'}. Best is trial 6 with value: 2.3221009143279607.
[I 2023-11-22 20:07:41,231] Trial 53 finished with value: 2.3923393086349485 and parameters: {'model_name': 'SimpleImputer', 'strategy': 'median'}. Best is trial 6 with value: 2.3221009143279607.
[I 2023-11-22 20:07:41,637] Trial 62 finished with value: 2.3923393086349485 and parameters: {'model_name': 'SimpleImputer', 'strategy': 'median'}. Best is trial 6 with value: 2.3221009143279607.
[I 2023-11-22 20:07:42,063] Trial 57 finished with value: 2.3923393086349485 and parameters: {'model_name': 'SimpleImputer', 'strategy': 'median'}. Best is trial 6 with value: 2.3221009143279607.
[I 2023-11-22 20:07:42,576] Trial 69 finished with value: 2.3923393086349485 and parameters: {'model_name': 'SimpleImputer', 'strategy': 'median'}. Best is trial 6 with value: 2.3221009143279607.
[I 2023-11-22 20:07:42,864] Trial 65 finished with value: 2.3923393086349485 and parameters: {'model_name': 'SimpleImputer', 'strategy': 'median'}. Best is trial 6 with value: 2.3221009143279607.
[I 2023-11-22 20:07:43,387] Trial 71 finished with value: 2.3923393086349485 and parameters: {'model_name': 'SimpleImputer', 'strategy': 'median'}. Best is trial 6 with value: 2.3221009143279607.
[I 2023-11-22 20:07:43,638] Trial 70 finished with value: 2.3923393086349485 and parameters: {'model_name': 'SimpleImputer', 'strategy': 'median'}. Best is trial 6 with value: 2.3221009143279607.
[I 2023-11-22 20:07:43,919] Trial 63 finished with value: 2.3923393086349485 and parameters: {'model_name': 'SimpleImputer', 'strategy': 'median'}. Best is trial 6 with value: 2.3221009143279607.
[I 2023-11-22 20:07:44,380] Trial 66 finished with value: 2.3923393086349485 and parameters: {'model_name': 'SimpleImputer', 'strategy': 'median'}. Best is trial 6 with value: 2.3221009143279607.
[I 2023-11-22 20:07:45,569] Trial 12 finished with value: 2.4846447434420242 and parameters: {'model_name': 'SimpleImputer', 'strategy': 'most_frequent'}. Best is trial 6 with value: 2.3221009143279607.
[I 2023-11-22 20:07:45,834] Trial 39 finished with value: 2.4846447434420242 and parameters: {'model_name': 'SimpleImputer', 'strategy': 'most_frequent'}. Best is trial 6 with value: 2.3221009143279607.
[I 2023-11-22 20:07:46,178] Trial 17 finished with value: 2.4846447434420242 and parameters: {'model_name': 'SimpleImputer', 'strategy': 'most_frequent'}. Best is trial 6 with value: 2.3221009143279607.
[I 2023-11-22 20:07:46,837] Trial 31 finished with value: 2.4846447434420242 and parameters: {'model_name': 'SimpleImputer', 'strategy': 'most_frequent'}. Best is trial 6 with value: 2.3221009143279607.
[I 2023-11-22 20:07:47,086] Trial 14 finished with value: 2.4846447434420242 and parameters: {'model_name': 'SimpleImputer', 'strategy': 'most_frequent'}. Best is trial 6 with value: 2.3221009143279607.
[I 2023-11-22 20:07:47,521] Trial 94 finished with value: 2.3221009143279607 and parameters: {'model_name': 'SimpleImputer', 'strategy': 'mean'}. Best is trial 6 with value: 2.3221009143279607.
[I 2023-11-22 20:07:47,890] Trial 41 finished with value: 2.4846447434420242 and parameters: {'model_name': 'SimpleImputer', 'strategy': 'most_frequent'}. Best is trial 6 with value: 2.3221009143279607.
[I 2023-11-22 20:07:48,248] Trial 33 finished with value: 2.4846447434420242 and parameters: {'model_name': 'SimpleImputer', 'strategy': 'most_frequent'}. Best is trial 6 with value: 2.3221009143279607.
[I 2023-11-22 20:07:48,813] Trial 38 finished with value: 2.4846447434420242 and parameters: {'model_name': 'SimpleImputer', 'strategy': 'most_frequent'}. Best is trial 6 with value: 2.3221009143279607.
[I 2023-11-22 20:07:49,084] Trial 49 finished with value: 2.4846447434420242 and parameters: {'model_name': 'SimpleImputer', 'strategy': 'most_frequent'}. Best is trial 6 with value: 2.3221009143279607.
[I 2023-11-22 20:07:49,373] Trial 23 finished with value: 2.4846447434420242 and parameters: {'model_name': 'SimpleImputer', 'strategy': 'most_frequent'}. Best is trial 6 with value: 2.3221009143279607.
[I 2023-11-22 20:07:50,594] Trial 56 finished with value: 2.4846447434420242 and parameters: {'model_name': 'SimpleImputer', 'strategy': 'most_frequent'}. Best is trial 6 with value: 2.3221009143279607.
[I 2023-11-22 20:07:51,010] Trial 104 finished with value: 2.3221009143279607 and parameters: {'model_name': 'SimpleImputer', 'strategy': 'mean'}. Best is trial 6 with value: 2.3221009143279607.
[I 2023-11-22 20:07:51,225] Trial 103 finished with value: 2.3221009143279607 and parameters: {'model_name': 'SimpleImputer', 'strategy': 'mean'}. Best is trial 6 with value: 2.3221009143279607.
[I 2023-11-22 20:07:51,519] Trial 75 finished with value: 2.4846447434420242 and parameters: {'model_name': 'SimpleImputer', 'strategy': 'most_frequent'}. Best is trial 6 with value: 2.3221009143279607.
[I 2023-11-22 20:07:51,686] Trial 68 finished with value: 2.4846447434420242 and parameters: {'model_name': 'SimpleImputer', 'strategy': 'most_frequent'}. Best is trial 6 with value: 2.3221009143279607.
[I 2023-11-22 20:07:51,935] Trial 72 finished with value: 2.4846447434420242 and parameters: {'model_name': 'SimpleImputer', 'strategy': 'most_frequent'}. Best is trial 6 with value: 2.3221009143279607.
[I 2023-11-22 20:07:52,256] Trial 58 finished with value: 2.4846447434420242 and parameters: {'model_name': 'SimpleImputer', 'strategy': 'most_frequent'}. Best is trial 6 with value: 2.3221009143279607.
[I 2023-11-22 20:07:52,484] Trial 61 finished with value: 2.4846447434420242 and parameters: {'model_name': 'SimpleImputer', 'strategy': 'most_frequent'}. Best is trial 6 with value: 2.3221009143279607.
[I 2023-11-22 20:07:52,702] Trial 73 finished with value: 2.4846447434420242 and parameters: {'model_name': 'SimpleImputer', 'strategy': 'most_frequent'}. Best is trial 6 with value: 2.3221009143279607.
[I 2023-11-22 20:07:52,901] Trial 59 finished with value: 2.4846447434420242 and parameters: {'model_name': 'SimpleImputer', 'strategy': 'most_frequent'}. Best is trial 6 with value: 2.3221009143279607.
[I 2023-11-22 20:07:53,218] Trial 60 finished with value: 2.4846447434420242 and parameters: {'model_name': 'SimpleImputer', 'strategy': 'most_frequent'}. Best is trial 6 with value: 2.3221009143279607.
[I 2023-11-22 20:07:53,523] Trial 67 finished with value: 2.4846447434420242 and parameters: {'model_name': 'SimpleImputer', 'strategy': 'most_frequent'}. Best is trial 6 with value: 2.3221009143279607.
[I 2023-11-22 20:07:53,811] Trial 105 finished with value: 2.3221009143279607 and parameters: {'model_name': 'SimpleImputer', 'strategy': 'mean'}. Best is trial 6 with value: 2.3221009143279607.
[I 2023-11-22 20:07:54,090] Trial 106 finished with value: 2.3221009143279607 and parameters: {'model_name': 'SimpleImputer', 'strategy': 'mean'}. Best is trial 6 with value: 2.3221009143279607.
[I 2023-11-22 20:07:54,354] Trial 78 finished with value: 2.4846447434420242 and parameters: {'model_name': 'SimpleImputer', 'strategy': 'most_frequent'}. Best is trial 6 with value: 2.3221009143279607.
[I 2023-11-22 20:07:54,609] Trial 74 finished with value: 2.4846447434420242 and parameters: {'model_name': 'SimpleImputer', 'strategy': 'most_frequent'}. Best is trial 6 with value: 2.3221009143279607.
[I 2023-11-22 20:07:54,808] Trial 79 finished with value: 2.4846447434420242 and parameters: {'model_name': 'SimpleImputer', 'strategy': 'most_frequent'}. Best is trial 6 with value: 2.3221009143279607.
[I 2023-11-22 20:07:54,996] Trial 109 finished with value: 2.3221009143279607 and parameters: {'model_name': 'SimpleImputer', 'strategy': 'mean'}. Best is trial 6 with value: 2.3221009143279607.
[I 2023-11-22 20:07:55,164] Trial 107 finished with value: 2.3221009143279607 and parameters: {'model_name': 'SimpleImputer', 'strategy': 'mean'}. Best is trial 6 with value: 2.3221009143279607.
[I 2023-11-22 20:07:55,419] Trial 64 finished with value: 2.4846447434420242 and parameters: {'model_name': 'SimpleImputer', 'strategy': 'most_frequent'}. Best is trial 6 with value: 2.3221009143279607.
[I 2023-11-22 20:07:55,755] Trial 86 finished with value: 2.4846447434420242 and parameters: {'model_name': 'SimpleImputer', 'strategy': 'most_frequent'}. Best is trial 6 with value: 2.3221009143279607.
[I 2023-11-22 20:07:55,979] Trial 108 finished with value: 2.3221009143279607 and parameters: {'model_name': 'SimpleImputer', 'strategy': 'mean'}. Best is trial 6 with value: 2.3221009143279607.
[I 2023-11-22 20:07:56,248] Trial 82 finished with value: 2.4846447434420242 and parameters: {'model_name': 'SimpleImputer', 'strategy': 'most_frequent'}. Best is trial 6 with value: 2.3221009143279607.
[I 2023-11-22 20:07:56,522] Trial 111 finished with value: 2.3221009143279607 and parameters: {'model_name': 'SimpleImputer', 'strategy': 'mean'}. Best is trial 6 with value: 2.3221009143279607.
[I 2023-11-22 20:07:56,787] Trial 76 finished with value: 2.4846447434420242 and parameters: {'model_name': 'SimpleImputer', 'strategy': 'most_frequent'}. Best is trial 6 with value: 2.3221009143279607.
[I 2023-11-22 20:07:57,080] Trial 83 finished with value: 2.4846447434420242 and parameters: {'model_name': 'SimpleImputer', 'strategy': 'most_frequent'}. Best is trial 6 with value: 2.3221009143279607.
[I 2023-11-22 20:07:57,622] Trial 80 finished with value: 2.4846447434420242 and parameters: {'model_name': 'SimpleImputer', 'strategy': 'most_frequent'}. Best is trial 6 with value: 2.3221009143279607.
[I 2023-11-22 20:07:57,794] Trial 112 finished with value: 2.3221009143279607 and parameters: {'model_name': 'SimpleImputer', 'strategy': 'mean'}. Best is trial 6 with value: 2.3221009143279607.
[I 2023-11-22 20:07:58,048] Trial 77 finished with value: 2.4846447434420242 and parameters: {'model_name': 'SimpleImputer', 'strategy': 'most_frequent'}. Best is trial 6 with value: 2.3221009143279607.
[I 2023-11-22 20:07:58,320] Trial 85 finished with value: 2.4846447434420242 and parameters: {'model_name': 'SimpleImputer', 'strategy': 'most_frequent'}. Best is trial 6 with value: 2.3221009143279607.
[I 2023-11-22 20:07:58,503] Trial 110 finished with value: 2.3221009143279607 and parameters: {'model_name': 'SimpleImputer', 'strategy': 'mean'}. Best is trial 6 with value: 2.3221009143279607.
[I 2023-11-22 20:07:58,763] Trial 84 finished with value: 2.4846447434420242 and parameters: {'model_name': 'SimpleImputer', 'strategy': 'most_frequent'}. Best is trial 6 with value: 2.3221009143279607.
[I 2023-11-22 20:07:59,068] Trial 88 finished with value: 2.4846447434420242 and parameters: {'model_name': 'SimpleImputer', 'strategy': 'most_frequent'}. Best is trial 6 with value: 2.3221009143279607.
