[I 2023-11-21 17:09:40,657] Trial 83 finished with value: 2.746013173634784 and parameters: {'model_name': 'SimpleImputer', 'strategy': 'most_frequent'}. Best is trial 17 with value: 2.571443158313177.
[I 2023-11-21 17:09:40,952] Trial 88 finished with value: 2.746013173634784 and parameters: {'model_name': 'SimpleImputer', 'strategy': 'most_frequent'}. Best is trial 17 with value: 2.571443158313177.
[I 2023-11-21 17:09:41,512] Trial 119 finished with value: 2.571443158313177 and parameters: {'model_name': 'SimpleImputer', 'strategy': 'median'}. Best is trial 17 with value: 2.571443158313177.
[I 2023-11-21 17:09:41,870] Trial 89 finished with value: 2.746013173634784 and parameters: {'model_name': 'SimpleImputer', 'strategy': 'most_frequent'}. Best is trial 17 with value: 2.571443158313177.
[I 2023-11-21 17:09:42,235] Trial 91 finished with value: 2.746013173634784 and parameters: {'model_name': 'SimpleImputer', 'strategy': 'most_frequent'}. Best is trial 17 with value: 2.571443158313177.
[I 2023-11-21 17:09:42,785] Trial 123 finished with value: 2.571443158313177 and parameters: {'model_name': 'SimpleImputer', 'strategy': 'median'}. Best is trial 17 with value: 2.571443158313177.
[I 2023-11-21 17:09:43,095] Trial 97 finished with value: 2.746013173634784 and parameters: {'model_name': 'SimpleImputer', 'strategy': 'most_frequent'}. Best is trial 17 with value: 2.571443158313177.
[I 2023-11-21 17:09:43,369] Trial 90 finished with value: 2.746013173634784 and parameters: {'model_name': 'SimpleImputer', 'strategy': 'most_frequent'}. Best is trial 17 with value: 2.571443158313177.
[I 2023-11-21 17:09:43,640] Trial 120 finished with value: 2.571443158313177 and parameters: {'model_name': 'SimpleImputer', 'strategy': 'median'}. Best is trial 17 with value: 2.571443158313177.
[I 2023-11-21 17:09:43,901] Trial 96 finished with value: 2.746013173634784 and parameters: {'model_name': 'SimpleImputer', 'strategy': 'most_frequent'}. Best is trial 17 with value: 2.571443158313177.
[I 2023-11-21 17:09:44,133] Trial 124 finished with value: 2.571443158313177 and parameters: {'model_name': 'SimpleImputer', 'strategy': 'median'}. Best is trial 17 with value: 2.571443158313177.
[I 2023-11-21 17:09:44,377] Trial 126 finished with value: 2.571443158313177 and parameters: {'model_name': 'SimpleImputer', 'strategy': 'median'}. Best is trial 17 with value: 2.571443158313177.
[I 2023-11-21 17:09:44,709] Trial 121 finished with value: 2.571443158313177 and parameters: {'model_name': 'SimpleImputer', 'strategy': 'median'}. Best is trial 17 with value: 2.571443158313177.
[I 2023-11-21 17:09:44,936] Trial 95 finished with value: 2.746013173634784 and parameters: {'model_name': 'SimpleImputer', 'strategy': 'most_frequent'}. Best is trial 17 with value: 2.571443158313177.
[I 2023-11-21 17:09:45,209] Trial 128 finished with value: 2.571443158313177 and parameters: {'model_name': 'SimpleImputer', 'strategy': 'median'}. Best is trial 17 with value: 2.571443158313177.
[I 2023-11-21 17:09:45,396] Trial 122 finished with value: 2.571443158313177 and parameters: {'model_name': 'SimpleImputer', 'strategy': 'median'}. Best is trial 17 with value: 2.571443158313177.
[I 2023-11-21 17:09:45,563] Trial 129 finished with value: 2.571443158313177 and parameters: {'model_name': 'SimpleImputer', 'strategy': 'median'}. Best is trial 17 with value: 2.571443158313177.
[I 2023-11-21 17:09:45,839] Trial 102 finished with value: 2.746013173634784 and parameters: {'model_name': 'SimpleImputer', 'strategy': 'most_frequent'}. Best is trial 17 with value: 2.571443158313177.
[I 2023-11-21 17:09:46,007] Trial 98 finished with value: 2.746013173634784 and parameters: {'model_name': 'SimpleImputer', 'strategy': 'most_frequent'}. Best is trial 17 with value: 2.571443158313177.
[I 2023-11-21 17:09:46,302] Trial 125 finished with value: 2.571443158313177 and parameters: {'model_name': 'SimpleImputer', 'strategy': 'median'}. Best is trial 17 with value: 2.571443158313177.
[I 2023-11-21 17:09:46,489] Trial 101 finished with value: 2.746013173634784 and parameters: {'model_name': 'SimpleImputer', 'strategy': 'most_frequent'}. Best is trial 17 with value: 2.571443158313177.
[I 2023-11-21 17:09:46,773] Trial 127 finished with value: 2.571443158313177 and parameters: {'model_name': 'SimpleImputer', 'strategy': 'median'}. Best is trial 17 with value: 2.571443158313177.
[I 2023-11-21 17:09:47,029] Trial 93 finished with value: 2.746013173634784 and parameters: {'model_name': 'SimpleImputer', 'strategy': 'most_frequent'}. Best is trial 17 with value: 2.571443158313177.
[I 2023-11-21 17:09:47,345] Trial 92 finished with value: 2.746013173634784 and parameters: {'model_name': 'SimpleImputer', 'strategy': 'most_frequent'}. Best is trial 17 with value: 2.571443158313177.
[I 2023-11-21 17:09:47,673] Trial 132 finished with value: 2.571443158313177 and parameters: {'model_name': 'SimpleImputer', 'strategy': 'median'}. Best is trial 17 with value: 2.571443158313177.
[I 2023-11-21 17:09:47,991] Trial 99 finished with value: 2.746013173634784 and parameters: {'model_name': 'SimpleImputer', 'strategy': 'most_frequent'}. Best is trial 17 with value: 2.571443158313177.
[I 2023-11-21 17:09:48,253] Trial 137 finished with value: 2.571443158313177 and parameters: {'model_name': 'SimpleImputer', 'strategy': 'median'}. Best is trial 17 with value: 2.571443158313177.
[I 2023-11-21 17:09:48,496] Trial 94 finished with value: 2.746013173634784 and parameters: {'model_name': 'SimpleImputer', 'strategy': 'most_frequent'}. Best is trial 17 with value: 2.571443158313177.
[I 2023-11-21 17:09:48,758] Trial 133 finished with value: 2.571443158313177 and parameters: {'model_name': 'SimpleImputer', 'strategy': 'median'}. Best is trial 17 with value: 2.571443158313177.
[I 2023-11-21 17:09:49,041] Trial 135 finished with value: 2.571443158313177 and parameters: {'model_name': 'SimpleImputer', 'strategy': 'median'}. Best is trial 17 with value: 2.571443158313177.
[I 2023-11-21 17:09:49,231] Trial 134 finished with value: 2.571443158313177 and parameters: {'model_name': 'SimpleImputer', 'strategy': 'median'}. Best is trial 17 with value: 2.571443158313177.
[I 2023-11-21 17:09:49,472] Trial 131 finished with value: 2.571443158313177 and parameters: {'model_name': 'SimpleImputer', 'strategy': 'median'}. Best is trial 17 with value: 2.571443158313177.
[I 2023-11-21 17:09:49,651] Trial 106 finished with value: 2.746013173634784 and parameters: {'model_name': 'SimpleImputer', 'strategy': 'most_frequent'}. Best is trial 17 with value: 2.571443158313177.
[I 2023-11-21 17:09:49,907] Trial 100 finished with value: 2.746013173634784 and parameters: {'model_name': 'SimpleImputer', 'strategy': 'most_frequent'}. Best is trial 17 with value: 2.571443158313177.
[I 2023-11-21 17:09:50,147] Trial 104 finished with value: 2.746013173634784 and parameters: {'model_name': 'SimpleImputer', 'strategy': 'most_frequent'}. Best is trial 17 with value: 2.571443158313177.
[I 2023-11-21 17:09:50,405] Trial 130 finished with value: 2.571443158313177 and parameters: {'model_name': 'SimpleImputer', 'strategy': 'median'}. Best is trial 17 with value: 2.571443158313177.
[I 2023-11-21 17:09:50,693] Trial 138 finished with value: 2.571443158313177 and parameters: {'model_name': 'SimpleImputer', 'strategy': 'median'}. Best is trial 17 with value: 2.571443158313177.
[I 2023-11-21 17:09:50,990] Trial 139 finished with value: 2.571443158313177 and parameters: {'model_name': 'SimpleImputer', 'strategy': 'median'}. Best is trial 17 with value: 2.571443158313177.
[I 2023-11-21 17:09:51,233] Trial 105 finished with value: 2.746013173634784 and parameters: {'model_name': 'SimpleImputer', 'strategy': 'most_frequent'}. Best is trial 17 with value: 2.571443158313177.
[I 2023-11-21 17:09:51,526] Trial 136 finished with value: 2.571443158313177 and parameters: {'model_name': 'SimpleImputer', 'strategy': 'median'}. Best is trial 17 with value: 2.571443158313177.
[I 2023-11-21 17:09:51,747] Trial 103 finished with value: 2.746013173634784 and parameters: {'model_name': 'SimpleImputer', 'strategy': 'most_frequent'}. Best is trial 17 with value: 2.571443158313177.
[I 2023-11-21 17:09:51,998] Trial 140 finished with value: 2.571443158313177 and parameters: {'model_name': 'SimpleImputer', 'strategy': 'median'}. Best is trial 17 with value: 2.571443158313177.
[I 2023-11-21 17:09:52,361] Trial 142 finished with value: 2.571443158313177 and parameters: {'model_name': 'SimpleImputer', 'strategy': 'median'}. Best is trial 17 with value: 2.571443158313177.
[I 2023-11-21 17:09:52,545] Trial 143 finished with value: 2.571443158313177 and parameters: {'model_name': 'SimpleImputer', 'strategy': 'median'}. Best is trial 17 with value: 2.571443158313177.
[I 2023-11-21 17:09:52,722] Trial 141 finished with value: 2.571443158313177 and parameters: {'model_name': 'SimpleImputer', 'strategy': 'median'}. Best is trial 17 with value: 2.571443158313177.
[I 2023-11-21 17:09:52,936] Trial 107 finished with value: 2.746013173634784 and parameters: {'model_name': 'SimpleImputer', 'strategy': 'most_frequent'}. Best is trial 17 with value: 2.571443158313177.
[I 2023-11-21 17:09:53,368] Trial 146 finished with value: 2.571443158313177 and parameters: {'model_name': 'SimpleImputer', 'strategy': 'median'}. Best is trial 17 with value: 2.571443158313177.
[I 2023-11-21 17:09:53,659] Trial 145 finished with value: 2.571443158313177 and parameters: {'model_name': 'SimpleImputer', 'strategy': 'median'}. Best is trial 17 with value: 2.571443158313177.
[I 2023-11-21 17:09:54,053] Trial 147 finished with value: 2.571443158313177 and parameters: {'model_name': 'SimpleImputer', 'strategy': 'median'}. Best is trial 17 with value: 2.571443158313177.
[I 2023-11-21 17:09:54,327] Trial 144 finished with value: 2.571443158313177 and parameters: {'model_name': 'SimpleImputer', 'strategy': 'median'}. Best is trial 17 with value: 2.571443158313177.
[I 2023-11-21 17:09:54,675] Trial 148 finished with value: 2.571443158313177 and parameters: {'model_name': 'SimpleImputer', 'strategy': 'median'}. Best is trial 17 with value: 2.571443158313177.
[I 2023-11-21 17:09:54,930] Trial 149 finished with value: 2.571443158313177 and parameters: {'model_name': 'SimpleImputer', 'strategy': 'median'}. Best is trial 17 with value: 2.571443158313177.
[I 2023-11-21 17:09:55,101] Trial 150 finished with value: 2.571443158313177 and parameters: {'model_name': 'SimpleImputer', 'strategy': 'median'}. Best is trial 17 with value: 2.571443158313177.
[I 2023-11-21 17:09:55,889] Trial 161 finished with value: 2.571443158313177 and parameters: {'model_name': 'SimpleImputer', 'strategy': 'median'}. Best is trial 17 with value: 2.571443158313177.
[I 2023-11-21 17:09:56,122] Trial 152 finished with value: 2.571443158313177 and parameters: {'model_name': 'SimpleImputer', 'strategy': 'median'}. Best is trial 17 with value: 2.571443158313177.
[I 2023-11-21 17:09:56,333] Trial 151 finished with value: 2.571443158313177 and parameters: {'model_name': 'SimpleImputer', 'strategy': 'median'}. Best is trial 17 with value: 2.571443158313177.
[I 2023-11-21 17:09:56,518] Trial 159 finished with value: 2.571443158313177 and parameters: {'model_name': 'SimpleImputer', 'strategy': 'median'}. Best is trial 17 with value: 2.571443158313177.
[I 2023-11-21 17:09:56,861] Trial 157 finished with value: 2.571443158313177 and parameters: {'model_name': 'SimpleImputer', 'strategy': 'median'}. Best is trial 17 with value: 2.571443158313177.
[I 2023-11-21 17:09:57,184] Trial 163 finished with value: 2.571443158313177 and parameters: {'model_name': 'SimpleImputer', 'strategy': 'median'}. Best is trial 17 with value: 2.571443158313177.
[I 2023-11-21 17:09:57,377] Trial 153 finished with value: 2.571443158313177 and parameters: {'model_name': 'SimpleImputer', 'strategy': 'median'}. Best is trial 17 with value: 2.571443158313177.
[I 2023-11-21 17:09:57,632] Trial 156 finished with value: 2.571443158313177 and parameters: {'model_name': 'SimpleImputer', 'strategy': 'median'}. Best is trial 17 with value: 2.571443158313177.
[I 2023-11-21 17:09:57,814] Trial 154 finished with value: 2.571443158313177 and parameters: {'model_name': 'SimpleImputer', 'strategy': 'median'}. Best is trial 17 with value: 2.571443158313177.
[I 2023-11-21 17:09:58,064] Trial 162 finished with value: 2.571443158313177 and parameters: {'model_name': 'SimpleImputer', 'strategy': 'median'}. Best is trial 17 with value: 2.571443158313177.
[I 2023-11-21 17:09:58,257] Trial 158 finished with value: 2.571443158313177 and parameters: {'model_name': 'SimpleImputer', 'strategy': 'median'}. Best is trial 17 with value: 2.571443158313177.
[I 2023-11-21 17:09:58,445] Trial 160 finished with value: 2.571443158313177 and parameters: {'model_name': 'SimpleImputer', 'strategy': 'median'}. Best is trial 17 with value: 2.571443158313177.
[I 2023-11-21 17:09:58,611] Trial 166 finished with value: 2.571443158313177 and parameters: {'model_name': 'SimpleImputer', 'strategy': 'median'}. Best is trial 17 with value: 2.571443158313177.
[I 2023-11-21 17:09:58,881] Trial 155 finished with value: 2.571443158313177 and parameters: {'model_name': 'SimpleImputer', 'strategy': 'median'}. Best is trial 17 with value: 2.571443158313177.
[I 2023-11-21 17:09:59,054] Trial 170 finished with value: 2.571443158313177 and parameters: {'model_name': 'SimpleImputer', 'strategy': 'median'}. Best is trial 17 with value: 2.571443158313177.
[I 2023-11-21 17:09:59,313] Trial 165 finished with value: 2.571443158313177 and parameters: {'model_name': 'SimpleImputer', 'strategy': 'median'}. Best is trial 17 with value: 2.571443158313177.
[I 2023-11-21 17:09:59,493] Trial 168 finished with value: 2.571443158313177 and parameters: {'model_name': 'SimpleImputer', 'strategy': 'median'}. Best is trial 17 with value: 2.571443158313177.
[I 2023-11-21 17:09:59,760] Trial 192 finished with value: 6.241202960058521 and parameters: {'model_name': 'SimpleImputer', 'strategy': 'constant'}. Best is trial 17 with value: 2.571443158313177.
[I 2023-11-21 17:10:00,036] Trial 195 finished with value: 6.241202960058521 and parameters: {'model_name': 'SimpleImputer', 'strategy': 'constant'}. Best is trial 17 with value: 2.571443158313177.
[I 2023-11-21 17:10:00,226] Trial 194 finished with value: 6.241202960058521 and parameters: {'model_name': 'SimpleImputer', 'strategy': 'constant'}. Best is trial 17 with value: 2.571443158313177.
[I 2023-11-21 17:10:00,452] Trial 178 finished with value: 2.571443158313177 and parameters: {'model_name': 'SimpleImputer', 'strategy': 'median'}. Best is trial 17 with value: 2.571443158313177.
[I 2023-11-21 17:10:00,796] Trial 167 finished with value: 2.571443158313177 and parameters: {'model_name': 'SimpleImputer', 'strategy': 'median'}. Best is trial 17 with value: 2.571443158313177.
[I 2023-11-21 17:10:01,056] Trial 179 finished with value: 2.571443158313177 and parameters: {'model_name': 'SimpleImputer', 'strategy': 'median'}. Best is trial 17 with value: 2.571443158313177.
[I 2023-11-21 17:10:01,324] Trial 174 finished with value: 2.571443158313177 and parameters: {'model_name': 'SimpleImputer', 'strategy': 'median'}. Best is trial 17 with value: 2.571443158313177.
[I 2023-11-21 17:10:01,519] Trial 164 finished with value: 2.571443158313177 and parameters: {'model_name': 'SimpleImputer', 'strategy': 'median'}. Best is trial 17 with value: 2.571443158313177.
[I 2023-11-21 17:10:01,688] Trial 181 finished with value: 2.571443158313177 and parameters: {'model_name': 'SimpleImputer', 'strategy': 'median'}. Best is trial 17 with value: 2.571443158313177.
[I 2023-11-21 17:10:01,914] Trial 198 finished with value: 6.241202960058521 and parameters: {'model_name': 'SimpleImputer', 'strategy': 'constant'}. Best is trial 17 with value: 2.571443158313177.
[I 2023-11-21 17:10:02,131] Trial 175 finished with value: 2.571443158313177 and parameters: {'model_name': 'SimpleImputer', 'strategy': 'median'}. Best is trial 17 with value: 2.571443158313177.
[I 2023-11-21 17:10:02,404] Trial 173 finished with value: 2.571443158313177 and parameters: {'model_name': 'SimpleImputer', 'strategy': 'median'}. Best is trial 17 with value: 2.571443158313177.
[I 2023-11-21 17:10:02,599] Trial 171 finished with value: 2.571443158313177 and parameters: {'model_name': 'SimpleImputer', 'strategy': 'median'}. Best is trial 17 with value: 2.571443158313177.
[I 2023-11-21 17:10:02,775] Trial 172 finished with value: 2.571443158313177 and parameters: {'model_name': 'SimpleImputer', 'strategy': 'median'}. Best is trial 17 with value: 2.571443158313177.
[I 2023-11-21 17:10:02,980] Trial 169 finished with value: 2.571443158313177 and parameters: {'model_name': 'SimpleImputer', 'strategy': 'median'}. Best is trial 17 with value: 2.571443158313177.
[I 2023-11-21 17:10:03,222] Trial 196 finished with value: 6.241202960058521 and parameters: {'model_name': 'SimpleImputer', 'strategy': 'constant'}. Best is trial 17 with value: 2.571443158313177.
[I 2023-11-21 17:10:03,490] Trial 187 finished with value: 2.571443158313177 and parameters: {'model_name': 'SimpleImputer', 'strategy': 'median'}. Best is trial 17 with value: 2.571443158313177.
[I 2023-11-21 17:10:03,723] Trial 197 finished with value: 6.241202960058521 and parameters: {'model_name': 'SimpleImputer', 'strategy': 'constant'}. Best is trial 17 with value: 2.571443158313177.
[I 2023-11-21 17:10:03,928] Trial 180 finished with value: 2.571443158313177 and parameters: {'model_name': 'SimpleImputer', 'strategy': 'median'}. Best is trial 17 with value: 2.571443158313177.
[I 2023-11-21 17:10:04,103] Trial 176 finished with value: 2.571443158313177 and parameters: {'model_name': 'SimpleImputer', 'strategy': 'median'}. Best is trial 17 with value: 2.571443158313177.
[I 2023-11-21 17:10:04,340] Trial 177 finished with value: 2.571443158313177 and parameters: {'model_name': 'SimpleImputer', 'strategy': 'median'}. Best is trial 17 with value: 2.571443158313177.
[I 2023-11-21 17:10:04,569] Trial 182 finished with value: 2.571443158313177 and parameters: {'model_name': 'SimpleImputer', 'strategy': 'median'}. Best is trial 17 with value: 2.571443158313177.
[I 2023-11-21 17:10:04,785] Trial 184 finished with value: 2.571443158313177 and parameters: {'model_name': 'SimpleImputer', 'strategy': 'median'}. Best is trial 17 with value: 2.571443158313177.
[I 2023-11-21 17:10:04,974] Trial 199 finished with value: 6.241202960058521 and parameters: {'model_name': 'SimpleImputer', 'strategy': 'constant'}. Best is trial 17 with value: 2.571443158313177.
[I 2023-11-21 17:10:05,219] Trial 183 finished with value: 2.571443158313177 and parameters: {'model_name': 'SimpleImputer', 'strategy': 'median'}. Best is trial 17 with value: 2.571443158313177.
[I 2023-11-21 17:10:05,437] Trial 190 finished with value: 2.571443158313177 and parameters: {'model_name': 'SimpleImputer', 'strategy': 'median'}. Best is trial 17 with value: 2.571443158313177.
[I 2023-11-21 17:10:05,669] Trial 185 finished with value: 2.571443158313177 and parameters: {'model_name': 'SimpleImputer', 'strategy': 'median'}. Best is trial 17 with value: 2.571443158313177.
[I 2023-11-21 17:10:05,860] Trial 193 finished with value: 2.571443158313177 and parameters: {'model_name': 'SimpleImputer', 'strategy': 'median'}. Best is trial 17 with value: 2.571443158313177.
[I 2023-11-21 17:10:06,037] Trial 188 finished with value: 2.571443158313177 and parameters: {'model_name': 'SimpleImputer', 'strategy': 'median'}. Best is trial 17 with value: 2.571443158313177.
[I 2023-11-21 17:10:06,274] Trial 189 finished with value: 2.571443158313177 and parameters: {'model_name': 'SimpleImputer', 'strategy': 'median'}. Best is trial 17 with value: 2.571443158313177.
[I 2023-11-21 17:10:06,492] Trial 186 finished with value: 2.571443158313177 and parameters: {'model_name': 'SimpleImputer', 'strategy': 'median'}. Best is trial 17 with value: 2.571443158313177.
[I 2023-11-21 17:10:06,672] Trial 191 finished with value: 2.571443158313177 and parameters: {'model_name': 'SimpleImputer', 'strategy': 'median'}. Best is trial 17 with value: 2.571443158313177.
simple fit
simple transform
[I 2023-11-21 17:10:12,832] A new study created in memory with name: no-name-8046165b-35eb-4521-abbb-f52a0dbb2e19
  0%|          | 0/200 [00:00<?, ?it/s][I 2023-11-21 17:10:14,378] Trial 9 finished with value: 6.079391227877255 and parameters: {'model_name': 'SimpleImputer', 'strategy': 'constant'}. Best is trial 9 with value: 6.079391227877255.
                                         0%|          | 0/200 [00:01<?, ?it/s]Best trial: 9. Best value: 6.07939:   0%|          | 0/200 [00:01<?, ?it/s]Best trial: 9. Best value: 6.07939:   0%|          | 1/200 [00:01<06:05,  1.84s/it][I 2023-11-21 17:10:14,706] Trial 4 finished with value: 2.175751596440891 and parameters: {'model_name': 'SimpleImputer', 'strategy': 'mean'}. Best is trial 4 with value: 2.175751596440891.
                                                                                   Best trial: 9. Best value: 6.07939:   0%|          | 1/200 [00:01<06:05,  1.84s/it]Best trial: 4. Best value: 2.17575:   0%|          | 1/200 [00:02<06:05,  1.84s/it]Best trial: 4. Best value: 2.17575:   1%|          | 2/200 [00:02<03:00,  1.10it/s][I 2023-11-21 17:10:15,297] Trial 6 finished with value: 2.175751596440891 and parameters: {'model_name': 'SimpleImputer', 'strategy': 'mean'}. Best is trial 4 with value: 2.175751596440891.
