[I 2023-12-07 16:14:56,214] Trial 118 finished with value: 365.05676727608045 and parameters: {'model_name': 'SimpleImputer', 'strategy': 'constant'}. Best is trial 1 with value: 319.8489387027031.
[I 2023-12-07 16:14:56,469] Trial 113 finished with value: 365.05676727608045 and parameters: {'model_name': 'SimpleImputer', 'strategy': 'constant'}. Best is trial 1 with value: 319.8489387027031.
[I 2023-12-07 16:14:56,683] Trial 121 finished with value: 365.05676727608045 and parameters: {'model_name': 'SimpleImputer', 'strategy': 'constant'}. Best is trial 1 with value: 319.8489387027031.
[I 2023-12-07 16:14:56,989] Trial 106 finished with value: 363.15048628092006 and parameters: {'model_name': 'SimpleImputer', 'strategy': 'most_frequent'}. Best is trial 1 with value: 319.8489387027031.
[I 2023-12-07 16:14:57,212] Trial 115 finished with value: 319.8489387027031 and parameters: {'model_name': 'SimpleImputer', 'strategy': 'median'}. Best is trial 1 with value: 319.8489387027031.
[I 2023-12-07 16:14:57,460] Trial 123 finished with value: 365.05676727608045 and parameters: {'model_name': 'SimpleImputer', 'strategy': 'constant'}. Best is trial 1 with value: 319.8489387027031.
[I 2023-12-07 16:14:57,680] Trial 128 finished with value: 365.05676727608045 and parameters: {'model_name': 'SimpleImputer', 'strategy': 'constant'}. Best is trial 1 with value: 319.8489387027031.
[I 2023-12-07 16:14:57,887] Trial 89 finished with value: 363.15048628092006 and parameters: {'model_name': 'SimpleImputer', 'strategy': 'most_frequent'}. Best is trial 1 with value: 319.8489387027031.
[I 2023-12-07 16:14:58,098] Trial 126 finished with value: 365.05676727608045 and parameters: {'model_name': 'SimpleImputer', 'strategy': 'constant'}. Best is trial 1 with value: 319.8489387027031.
[I 2023-12-07 16:14:58,326] Trial 96 finished with value: 363.15048628092006 and parameters: {'model_name': 'SimpleImputer', 'strategy': 'most_frequent'}. Best is trial 1 with value: 319.8489387027031.
[I 2023-12-07 16:14:58,529] Trial 110 finished with value: 365.05676727608045 and parameters: {'model_name': 'SimpleImputer', 'strategy': 'constant'}. Best is trial 1 with value: 319.8489387027031.
[I 2023-12-07 16:14:58,754] Trial 103 finished with value: 363.15048628092006 and parameters: {'model_name': 'SimpleImputer', 'strategy': 'most_frequent'}. Best is trial 1 with value: 319.8489387027031.
[I 2023-12-07 16:14:58,981] Trial 131 finished with value: 365.05676727608045 and parameters: {'model_name': 'SimpleImputer', 'strategy': 'constant'}. Best is trial 1 with value: 319.8489387027031.
[I 2023-12-07 16:14:59,235] Trial 105 finished with value: 363.15048628092006 and parameters: {'model_name': 'SimpleImputer', 'strategy': 'most_frequent'}. Best is trial 1 with value: 319.8489387027031.
[I 2023-12-07 16:14:59,419] Trial 116 finished with value: 365.05676727608045 and parameters: {'model_name': 'SimpleImputer', 'strategy': 'constant'}. Best is trial 1 with value: 319.8489387027031.
[I 2023-12-07 16:14:59,651] Trial 109 finished with value: 363.15048628092006 and parameters: {'model_name': 'SimpleImputer', 'strategy': 'most_frequent'}. Best is trial 1 with value: 319.8489387027031.
[I 2023-12-07 16:14:59,834] Trial 107 finished with value: 363.15048628092006 and parameters: {'model_name': 'SimpleImputer', 'strategy': 'most_frequent'}. Best is trial 1 with value: 319.8489387027031.
[I 2023-12-07 16:15:00,055] Trial 114 finished with value: 319.8489387027031 and parameters: {'model_name': 'SimpleImputer', 'strategy': 'median'}. Best is trial 1 with value: 319.8489387027031.
[I 2023-12-07 16:15:00,269] Trial 119 finished with value: 365.05676727608045 and parameters: {'model_name': 'SimpleImputer', 'strategy': 'constant'}. Best is trial 1 with value: 319.8489387027031.
[I 2023-12-07 16:15:00,460] Trial 102 finished with value: 363.15048628092006 and parameters: {'model_name': 'SimpleImputer', 'strategy': 'most_frequent'}. Best is trial 1 with value: 319.8489387027031.
[I 2023-12-07 16:15:00,696] Trial 120 finished with value: 365.05676727608045 and parameters: {'model_name': 'SimpleImputer', 'strategy': 'constant'}. Best is trial 1 with value: 319.8489387027031.
[I 2023-12-07 16:15:00,878] Trial 108 finished with value: 363.15048628092006 and parameters: {'model_name': 'SimpleImputer', 'strategy': 'most_frequent'}. Best is trial 1 with value: 319.8489387027031.
[I 2023-12-07 16:15:01,048] Trial 122 finished with value: 365.05676727608045 and parameters: {'model_name': 'SimpleImputer', 'strategy': 'constant'}. Best is trial 1 with value: 319.8489387027031.
[I 2023-12-07 16:15:01,229] Trial 135 finished with value: 319.8489387027031 and parameters: {'model_name': 'SimpleImputer', 'strategy': 'median'}. Best is trial 1 with value: 319.8489387027031.
[I 2023-12-07 16:15:01,493] Trial 134 finished with value: 319.8489387027031 and parameters: {'model_name': 'SimpleImputer', 'strategy': 'median'}. Best is trial 1 with value: 319.8489387027031.
[I 2023-12-07 16:15:01,701] Trial 129 finished with value: 365.05676727608045 and parameters: {'model_name': 'SimpleImputer', 'strategy': 'constant'}. Best is trial 1 with value: 319.8489387027031.
[I 2023-12-07 16:15:01,943] Trial 140 finished with value: 319.8489387027031 and parameters: {'model_name': 'SimpleImputer', 'strategy': 'median'}. Best is trial 1 with value: 319.8489387027031.
[I 2023-12-07 16:15:02,185] Trial 130 finished with value: 365.05676727608045 and parameters: {'model_name': 'SimpleImputer', 'strategy': 'constant'}. Best is trial 1 with value: 319.8489387027031.
[I 2023-12-07 16:15:02,381] Trial 138 finished with value: 319.8489387027031 and parameters: {'model_name': 'SimpleImputer', 'strategy': 'median'}. Best is trial 1 with value: 319.8489387027031.
[I 2023-12-07 16:15:02,576] Trial 127 finished with value: 319.8489387027031 and parameters: {'model_name': 'SimpleImputer', 'strategy': 'median'}. Best is trial 1 with value: 319.8489387027031.
[I 2023-12-07 16:15:02,784] Trial 133 finished with value: 365.05676727608045 and parameters: {'model_name': 'SimpleImputer', 'strategy': 'constant'}. Best is trial 1 with value: 319.8489387027031.
[I 2023-12-07 16:15:02,991] Trial 132 finished with value: 365.05676727608045 and parameters: {'model_name': 'SimpleImputer', 'strategy': 'constant'}. Best is trial 1 with value: 319.8489387027031.
[I 2023-12-07 16:15:03,222] Trial 117 finished with value: 365.05676727608045 and parameters: {'model_name': 'SimpleImputer', 'strategy': 'constant'}. Best is trial 1 with value: 319.8489387027031.
[I 2023-12-07 16:15:03,440] Trial 112 finished with value: 319.8489387027031 and parameters: {'model_name': 'SimpleImputer', 'strategy': 'median'}. Best is trial 1 with value: 319.8489387027031.
[I 2023-12-07 16:15:03,645] Trial 136 finished with value: 319.8489387027031 and parameters: {'model_name': 'SimpleImputer', 'strategy': 'median'}. Best is trial 1 with value: 319.8489387027031.
[I 2023-12-07 16:15:03,860] Trial 101 finished with value: 363.15048628092006 and parameters: {'model_name': 'SimpleImputer', 'strategy': 'most_frequent'}. Best is trial 1 with value: 319.8489387027031.
[I 2023-12-07 16:15:04,066] Trial 124 finished with value: 319.8489387027031 and parameters: {'model_name': 'SimpleImputer', 'strategy': 'median'}. Best is trial 1 with value: 319.8489387027031.
[I 2023-12-07 16:15:04,262] Trial 137 finished with value: 319.8489387027031 and parameters: {'model_name': 'SimpleImputer', 'strategy': 'median'}. Best is trial 1 with value: 319.8489387027031.
[I 2023-12-07 16:15:04,453] Trial 141 finished with value: 319.8489387027031 and parameters: {'model_name': 'SimpleImputer', 'strategy': 'median'}. Best is trial 1 with value: 319.8489387027031.
[I 2023-12-07 16:15:04,654] Trial 104 finished with value: 365.05676727608045 and parameters: {'model_name': 'SimpleImputer', 'strategy': 'constant'}. Best is trial 1 with value: 319.8489387027031.
[I 2023-12-07 16:15:04,887] Trial 100 finished with value: 365.05676727608045 and parameters: {'model_name': 'SimpleImputer', 'strategy': 'constant'}. Best is trial 1 with value: 319.8489387027031.
[I 2023-12-07 16:15:05,086] Trial 125 finished with value: 319.8489387027031 and parameters: {'model_name': 'SimpleImputer', 'strategy': 'median'}. Best is trial 1 with value: 319.8489387027031.
[I 2023-12-07 16:15:05,291] Trial 150 finished with value: 319.8489387027031 and parameters: {'model_name': 'SimpleImputer', 'strategy': 'median'}. Best is trial 1 with value: 319.8489387027031.
[I 2023-12-07 16:15:05,491] Trial 139 finished with value: 319.8489387027031 and parameters: {'model_name': 'SimpleImputer', 'strategy': 'median'}. Best is trial 1 with value: 319.8489387027031.
[I 2023-12-07 16:15:05,685] Trial 142 finished with value: 319.8489387027031 and parameters: {'model_name': 'SimpleImputer', 'strategy': 'median'}. Best is trial 1 with value: 319.8489387027031.
[I 2023-12-07 16:15:05,874] Trial 146 finished with value: 319.8489387027031 and parameters: {'model_name': 'SimpleImputer', 'strategy': 'median'}. Best is trial 1 with value: 319.8489387027031.
[I 2023-12-07 16:15:06,080] Trial 149 finished with value: 319.8489387027031 and parameters: {'model_name': 'SimpleImputer', 'strategy': 'median'}. Best is trial 1 with value: 319.8489387027031.
[I 2023-12-07 16:15:06,328] Trial 147 finished with value: 319.8489387027031 and parameters: {'model_name': 'SimpleImputer', 'strategy': 'median'}. Best is trial 1 with value: 319.8489387027031.
[I 2023-12-07 16:15:06,546] Trial 157 finished with value: 319.8489387027031 and parameters: {'model_name': 'SimpleImputer', 'strategy': 'median'}. Best is trial 1 with value: 319.8489387027031.
[I 2023-12-07 16:15:06,748] Trial 161 finished with value: 319.8489387027031 and parameters: {'model_name': 'SimpleImputer', 'strategy': 'median'}. Best is trial 1 with value: 319.8489387027031.
[I 2023-12-07 16:15:06,980] Trial 145 finished with value: 319.8489387027031 and parameters: {'model_name': 'SimpleImputer', 'strategy': 'median'}. Best is trial 1 with value: 319.8489387027031.
[I 2023-12-07 16:15:07,190] Trial 151 finished with value: 319.8489387027031 and parameters: {'model_name': 'SimpleImputer', 'strategy': 'median'}. Best is trial 1 with value: 319.8489387027031.
[I 2023-12-07 16:15:07,391] Trial 164 finished with value: 319.8489387027031 and parameters: {'model_name': 'SimpleImputer', 'strategy': 'median'}. Best is trial 1 with value: 319.8489387027031.
[I 2023-12-07 16:15:07,584] Trial 152 finished with value: 319.8489387027031 and parameters: {'model_name': 'SimpleImputer', 'strategy': 'median'}. Best is trial 1 with value: 319.8489387027031.
[I 2023-12-07 16:15:07,778] Trial 153 finished with value: 319.8489387027031 and parameters: {'model_name': 'SimpleImputer', 'strategy': 'median'}. Best is trial 1 with value: 319.8489387027031.
[I 2023-12-07 16:15:07,967] Trial 143 finished with value: 319.8489387027031 and parameters: {'model_name': 'SimpleImputer', 'strategy': 'median'}. Best is trial 1 with value: 319.8489387027031.
[I 2023-12-07 16:15:08,195] Trial 156 finished with value: 319.8489387027031 and parameters: {'model_name': 'SimpleImputer', 'strategy': 'median'}. Best is trial 1 with value: 319.8489387027031.
[I 2023-12-07 16:15:08,390] Trial 154 finished with value: 319.8489387027031 and parameters: {'model_name': 'SimpleImputer', 'strategy': 'median'}. Best is trial 1 with value: 319.8489387027031.
[I 2023-12-07 16:15:08,598] Trial 155 finished with value: 319.8489387027031 and parameters: {'model_name': 'SimpleImputer', 'strategy': 'median'}. Best is trial 1 with value: 319.8489387027031.
[I 2023-12-07 16:15:08,829] Trial 158 finished with value: 319.8489387027031 and parameters: {'model_name': 'SimpleImputer', 'strategy': 'median'}. Best is trial 1 with value: 319.8489387027031.
[I 2023-12-07 16:15:08,837] Trial 168 finished with value: 319.8489387027031 and parameters: {'model_name': 'SimpleImputer', 'strategy': 'median'}. Best is trial 1 with value: 319.8489387027031.
[I 2023-12-07 16:15:09,242] Trial 173 finished with value: 319.8489387027031 and parameters: {'model_name': 'SimpleImputer', 'strategy': 'median'}. Best is trial 1 with value: 319.8489387027031.
[I 2023-12-07 16:15:09,446] Trial 144 finished with value: 319.8489387027031 and parameters: {'model_name': 'SimpleImputer', 'strategy': 'median'}. Best is trial 1 with value: 319.8489387027031.
[I 2023-12-07 16:15:09,665] Trial 175 finished with value: 319.8489387027031 and parameters: {'model_name': 'SimpleImputer', 'strategy': 'median'}. Best is trial 1 with value: 319.8489387027031.
[I 2023-12-07 16:15:09,891] Trial 171 finished with value: 319.8489387027031 and parameters: {'model_name': 'SimpleImputer', 'strategy': 'median'}. Best is trial 1 with value: 319.8489387027031.
[I 2023-12-07 16:15:10,122] Trial 172 finished with value: 319.8489387027031 and parameters: {'model_name': 'SimpleImputer', 'strategy': 'median'}. Best is trial 1 with value: 319.8489387027031.
[I 2023-12-07 16:15:10,355] Trial 185 finished with value: 319.8489387027031 and parameters: {'model_name': 'SimpleImputer', 'strategy': 'median'}. Best is trial 1 with value: 319.8489387027031.
[I 2023-12-07 16:15:10,569] Trial 176 finished with value: 319.8489387027031 and parameters: {'model_name': 'SimpleImputer', 'strategy': 'median'}. Best is trial 1 with value: 319.8489387027031.
[I 2023-12-07 16:15:10,772] Trial 159 finished with value: 319.8489387027031 and parameters: {'model_name': 'SimpleImputer', 'strategy': 'median'}. Best is trial 1 with value: 319.8489387027031.
[I 2023-12-07 16:15:10,988] Trial 187 finished with value: 319.8489387027031 and parameters: {'model_name': 'SimpleImputer', 'strategy': 'median'}. Best is trial 1 with value: 319.8489387027031.
[I 2023-12-07 16:15:11,209] Trial 169 finished with value: 319.8489387027031 and parameters: {'model_name': 'SimpleImputer', 'strategy': 'median'}. Best is trial 1 with value: 319.8489387027031.
[I 2023-12-07 16:15:11,406] Trial 165 finished with value: 319.8489387027031 and parameters: {'model_name': 'SimpleImputer', 'strategy': 'median'}. Best is trial 1 with value: 319.8489387027031.
[I 2023-12-07 16:15:11,603] Trial 166 finished with value: 319.8489387027031 and parameters: {'model_name': 'SimpleImputer', 'strategy': 'median'}. Best is trial 1 with value: 319.8489387027031.
[I 2023-12-07 16:15:11,814] Trial 170 finished with value: 319.8489387027031 and parameters: {'model_name': 'SimpleImputer', 'strategy': 'median'}. Best is trial 1 with value: 319.8489387027031.
[I 2023-12-07 16:15:12,035] Trial 181 finished with value: 319.8489387027031 and parameters: {'model_name': 'SimpleImputer', 'strategy': 'median'}. Best is trial 1 with value: 319.8489387027031.
[I 2023-12-07 16:15:12,242] Trial 174 finished with value: 319.8489387027031 and parameters: {'model_name': 'SimpleImputer', 'strategy': 'median'}. Best is trial 1 with value: 319.8489387027031.
[I 2023-12-07 16:15:12,457] Trial 160 finished with value: 319.8489387027031 and parameters: {'model_name': 'SimpleImputer', 'strategy': 'median'}. Best is trial 1 with value: 319.8489387027031.
[I 2023-12-07 16:15:12,664] Trial 179 finished with value: 319.8489387027031 and parameters: {'model_name': 'SimpleImputer', 'strategy': 'median'}. Best is trial 1 with value: 319.8489387027031.
[I 2023-12-07 16:15:12,860] Trial 162 finished with value: 319.8489387027031 and parameters: {'model_name': 'SimpleImputer', 'strategy': 'median'}. Best is trial 1 with value: 319.8489387027031.
[I 2023-12-07 16:15:13,068] Trial 180 finished with value: 319.8489387027031 and parameters: {'model_name': 'SimpleImputer', 'strategy': 'median'}. Best is trial 1 with value: 319.8489387027031.
[I 2023-12-07 16:15:13,271] Trial 163 finished with value: 319.8489387027031 and parameters: {'model_name': 'SimpleImputer', 'strategy': 'median'}. Best is trial 1 with value: 319.8489387027031.
[I 2023-12-07 16:15:13,471] Trial 194 finished with value: 319.8489387027031 and parameters: {'model_name': 'SimpleImputer', 'strategy': 'median'}. Best is trial 1 with value: 319.8489387027031.
[I 2023-12-07 16:15:13,674] Trial 184 finished with value: 319.8489387027031 and parameters: {'model_name': 'SimpleImputer', 'strategy': 'median'}. Best is trial 1 with value: 319.8489387027031.
[I 2023-12-07 16:15:13,871] Trial 190 finished with value: 319.8489387027031 and parameters: {'model_name': 'SimpleImputer', 'strategy': 'median'}. Best is trial 1 with value: 319.8489387027031.
[I 2023-12-07 16:15:14,085] Trial 195 finished with value: 319.8489387027031 and parameters: {'model_name': 'SimpleImputer', 'strategy': 'median'}. Best is trial 1 with value: 319.8489387027031.
[I 2023-12-07 16:15:14,295] Trial 188 finished with value: 319.8489387027031 and parameters: {'model_name': 'SimpleImputer', 'strategy': 'median'}. Best is trial 1 with value: 319.8489387027031.
[I 2023-12-07 16:15:14,497] Trial 193 finished with value: 319.8489387027031 and parameters: {'model_name': 'SimpleImputer', 'strategy': 'median'}. Best is trial 1 with value: 319.8489387027031.
[I 2023-12-07 16:15:14,703] Trial 183 finished with value: 319.8489387027031 and parameters: {'model_name': 'SimpleImputer', 'strategy': 'median'}. Best is trial 1 with value: 319.8489387027031.
[I 2023-12-07 16:15:14,904] Trial 167 finished with value: 319.8489387027031 and parameters: {'model_name': 'SimpleImputer', 'strategy': 'median'}. Best is trial 1 with value: 319.8489387027031.
[I 2023-12-07 16:15:15,096] Trial 178 finished with value: 319.8489387027031 and parameters: {'model_name': 'SimpleImputer', 'strategy': 'median'}. Best is trial 1 with value: 319.8489387027031.
[I 2023-12-07 16:15:15,285] Trial 186 finished with value: 319.8489387027031 and parameters: {'model_name': 'SimpleImputer', 'strategy': 'median'}. Best is trial 1 with value: 319.8489387027031.
[I 2023-12-07 16:15:15,479] Trial 192 finished with value: 319.8489387027031 and parameters: {'model_name': 'SimpleImputer', 'strategy': 'median'}. Best is trial 1 with value: 319.8489387027031.
[I 2023-12-07 16:15:15,666] Trial 182 finished with value: 319.8489387027031 and parameters: {'model_name': 'SimpleImputer', 'strategy': 'median'}. Best is trial 1 with value: 319.8489387027031.
[I 2023-12-07 16:15:15,853] Trial 177 finished with value: 319.8489387027031 and parameters: {'model_name': 'SimpleImputer', 'strategy': 'median'}. Best is trial 1 with value: 319.8489387027031.
[I 2023-12-07 16:15:16,040] Trial 148 finished with value: 319.8489387027031 and parameters: {'model_name': 'SimpleImputer', 'strategy': 'median'}. Best is trial 1 with value: 319.8489387027031.
[I 2023-12-07 16:15:16,233] Trial 189 finished with value: 319.8489387027031 and parameters: {'model_name': 'SimpleImputer', 'strategy': 'median'}. Best is trial 1 with value: 319.8489387027031.
[I 2023-12-07 16:15:16,444] Trial 196 finished with value: 319.8489387027031 and parameters: {'model_name': 'SimpleImputer', 'strategy': 'median'}. Best is trial 1 with value: 319.8489387027031.
[I 2023-12-07 16:15:16,638] Trial 199 finished with value: 319.8489387027031 and parameters: {'model_name': 'SimpleImputer', 'strategy': 'median'}. Best is trial 1 with value: 319.8489387027031.
[I 2023-12-07 16:15:16,833] Trial 198 finished with value: 319.8489387027031 and parameters: {'model_name': 'SimpleImputer', 'strategy': 'median'}. Best is trial 1 with value: 319.8489387027031.
[I 2023-12-07 16:15:17,026] Trial 191 finished with value: 319.8489387027031 and parameters: {'model_name': 'SimpleImputer', 'strategy': 'median'}. Best is trial 1 with value: 319.8489387027031.
