                                                                               Best trial: 0. Best value: inf:   4%|▍         | 8/200 [00:01<00:48,  3.96it/s]Best trial: 0. Best value: inf:   4%|▍         | 8/200 [00:02<00:48,  3.96it/s]Best trial: 0. Best value: inf:   4%|▍         | 9/200 [00:02<00:44,  4.29it/s][I 2023-11-24 15:16:07,456] Trial 20 finished with value: inf and parameters: {'model_name': 'KNNImputer', 'weights': 'uniform', 'keep_empty_features': False}. Best is trial 0 with value: inf.
                                                                               Best trial: 0. Best value: inf:   4%|▍         | 9/200 [00:02<00:44,  4.29it/s]Best trial: 0. Best value: inf:   4%|▍         | 9/200 [00:02<00:44,  4.29it/s]Best trial: 0. Best value: inf:   5%|▌         | 10/200 [00:02<00:40,  4.66it/s][W 2023-11-24 15:16:07,622] Trial 36 failed with parameters: {'model_name': 'IterativeImputer'} because of the following error: ValueError('CategoricalDistribution does not support dynamic value space.').
Traceback (most recent call last):
  File "/home/ketrong/miniconda3/envs/tpot2devenv/lib/python3.10/site-packages/optuna/study/_optimize.py", line 200, in _run_trial
    value_or_values = func(trial)
  File "/common/ketrong/AutoImputeExp/tpot2_imputetest/Impute_Experiments/autoimpute.py", line 56, in obj
    my_params = autoutils.trial_suggestion(trial, self.model_names, column_len=len(X.columns), random_state=self.random_state)
  File "/common/ketrong/AutoImputeExp/tpot2_imputetest/Impute_Experiments/autoutils.py", line 20, in trial_suggestion
    my_params = params_IterativeImpute(trial,model_name) #Uses the dependence between columns in the data set to predict for the one column. Predictions occur through a variety of strategies.
  File "/common/ketrong/AutoImputeExp/tpot2_imputetest/Impute_Experiments/param_grids.py", line 20, in params_IterativeImpute
    params['estimator'] = trial.suggest_categorical('estimator', [Bayes, RFR, Ridge, KNN])
  File "/home/ketrong/miniconda3/envs/tpot2devenv/lib/python3.10/site-packages/optuna/trial/_trial.py", line 405, in suggest_categorical
    return self._suggest(name, CategoricalDistribution(choices=choices))
  File "/home/ketrong/miniconda3/envs/tpot2devenv/lib/python3.10/site-packages/optuna/trial/_trial.py", line 636, in _suggest
    storage.set_trial_param(trial_id, name, param_value_in_internal_repr, distribution)
  File "/home/ketrong/miniconda3/envs/tpot2devenv/lib/python3.10/site-packages/optuna/storages/_in_memory.py", line 187, in set_trial_param
    distributions.check_distribution_compatibility(
  File "/home/ketrong/miniconda3/envs/tpot2devenv/lib/python3.10/site-packages/optuna/distributions.py", line 670, in check_distribution_compatibility
    raise ValueError(
ValueError: CategoricalDistribution does not support dynamic value space.
                                                                                Best trial: 0. Best value: inf:   5%|▌         | 10/200 [00:02<00:40,  4.66it/s]                                                                                [W 2023-11-24 15:16:07,630] Trial 36 failed with value None.
Best trial: 0. Best value: inf:   5%|▌         | 10/200 [00:02<00:40,  4.66it/s][W 2023-11-24 15:16:07,803] Trial 40 failed with parameters: {'model_name': 'IterativeImputer'} because of the following error: ValueError('CategoricalDistribution does not support dynamic value space.').
Traceback (most recent call last):
  File "/home/ketrong/miniconda3/envs/tpot2devenv/lib/python3.10/site-packages/optuna/study/_optimize.py", line 200, in _run_trial
    value_or_values = func(trial)
  File "/common/ketrong/AutoImputeExp/tpot2_imputetest/Impute_Experiments/autoimpute.py", line 56, in obj
    my_params = autoutils.trial_suggestion(trial, self.model_names, column_len=len(X.columns), random_state=self.random_state)
  File "/common/ketrong/AutoImputeExp/tpot2_imputetest/Impute_Experiments/autoutils.py", line 20, in trial_suggestion
    my_params = params_IterativeImpute(trial,model_name) #Uses the dependence between columns in the data set to predict for the one column. Predictions occur through a variety of strategies.
  File "/common/ketrong/AutoImputeExp/tpot2_imputetest/Impute_Experiments/param_grids.py", line 20, in params_IterativeImpute
    params['estimator'] = trial.suggest_categorical('estimator', [Bayes, RFR, Ridge, KNN])
  File "/home/ketrong/miniconda3/envs/tpot2devenv/lib/python3.10/site-packages/optuna/trial/_trial.py", line 405, in suggest_categorical
    return self._suggest(name, CategoricalDistribution(choices=choices))
  File "/home/ketrong/miniconda3/envs/tpot2devenv/lib/python3.10/site-packages/optuna/trial/_trial.py", line 636, in _suggest
    storage.set_trial_param(trial_id, name, param_value_in_internal_repr, distribution)
  File "/home/ketrong/miniconda3/envs/tpot2devenv/lib/python3.10/site-packages/optuna/storages/_in_memory.py", line 187, in set_trial_param
    distributions.check_distribution_compatibility(
  File "/home/ketrong/miniconda3/envs/tpot2devenv/lib/python3.10/site-packages/optuna/distributions.py", line 670, in check_distribution_compatibility
    raise ValueError(
ValueError: CategoricalDistribution does not support dynamic value space.
                                                                                Best trial: 0. Best value: inf:   5%|▌         | 10/200 [00:02<00:40,  4.66it/s]                                                                                [W 2023-11-24 15:16:07,806] Trial 40 failed with value None.
Best trial: 0. Best value: inf:   5%|▌         | 10/200 [00:02<00:40,  4.66it/s]                                                                                [W 2023-11-24 15:16:08,020] Trial 43 failed with parameters: {'model_name': 'IterativeImputer'} because of the following error: ValueError('CategoricalDistribution does not support dynamic value space.').
Traceback (most recent call last):
  File "/home/ketrong/miniconda3/envs/tpot2devenv/lib/python3.10/site-packages/optuna/study/_optimize.py", line 200, in _run_trial
    value_or_values = func(trial)
  File "/common/ketrong/AutoImputeExp/tpot2_imputetest/Impute_Experiments/autoimpute.py", line 56, in obj
    my_params = autoutils.trial_suggestion(trial, self.model_names, column_len=len(X.columns), random_state=self.random_state)
  File "/common/ketrong/AutoImputeExp/tpot2_imputetest/Impute_Experiments/autoutils.py", line 20, in trial_suggestion
    my_params = params_IterativeImpute(trial,model_name) #Uses the dependence between columns in the data set to predict for the one column. Predictions occur through a variety of strategies.
  File "/common/ketrong/AutoImputeExp/tpot2_imputetest/Impute_Experiments/param_grids.py", line 20, in params_IterativeImpute
    params['estimator'] = trial.suggest_categorical('estimator', [Bayes, RFR, Ridge, KNN])
  File "/home/ketrong/miniconda3/envs/tpot2devenv/lib/python3.10/site-packages/optuna/trial/_trial.py", line 405, in suggest_categorical
    return self._suggest(name, CategoricalDistribution(choices=choices))
  File "/home/ketrong/miniconda3/envs/tpot2devenv/lib/python3.10/site-packages/optuna/trial/_trial.py", line 636, in _suggest
    storage.set_trial_param(trial_id, name, param_value_in_internal_repr, distribution)
  File "/home/ketrong/miniconda3/envs/tpot2devenv/lib/python3.10/site-packages/optuna/storages/_in_memory.py", line 187, in set_trial_param
    distributions.check_distribution_compatibility(
  File "/home/ketrong/miniconda3/envs/tpot2devenv/lib/python3.10/site-packages/optuna/distributions.py", line 670, in check_distribution_compatibility
    raise ValueError(
ValueError: CategoricalDistribution does not support dynamic value space.
Best trial: 0. Best value: inf:   5%|▌         | 10/200 [00:02<00:40,  4.66it/s]                                                                                [W 2023-11-24 15:16:08,031] Trial 43 failed with value None.
Best trial: 0. Best value: inf:   5%|▌         | 10/200 [00:02<00:40,  4.66it/s][W 2023-11-24 15:16:08,204] Trial 44 failed with parameters: {'model_name': 'IterativeImputer'} because of the following error: ValueError('CategoricalDistribution does not support dynamic value space.').
Traceback (most recent call last):
  File "/home/ketrong/miniconda3/envs/tpot2devenv/lib/python3.10/site-packages/optuna/study/_optimize.py", line 200, in _run_trial
    value_or_values = func(trial)
  File "/common/ketrong/AutoImputeExp/tpot2_imputetest/Impute_Experiments/autoimpute.py", line 56, in obj
    my_params = autoutils.trial_suggestion(trial, self.model_names, column_len=len(X.columns), random_state=self.random_state)
  File "/common/ketrong/AutoImputeExp/tpot2_imputetest/Impute_Experiments/autoutils.py", line 20, in trial_suggestion
    my_params = params_IterativeImpute(trial,model_name) #Uses the dependence between columns in the data set to predict for the one column. Predictions occur through a variety of strategies.
  File "/common/ketrong/AutoImputeExp/tpot2_imputetest/Impute_Experiments/param_grids.py", line 20, in params_IterativeImpute
    params['estimator'] = trial.suggest_categorical('estimator', [Bayes, RFR, Ridge, KNN])
  File "/home/ketrong/miniconda3/envs/tpot2devenv/lib/python3.10/site-packages/optuna/trial/_trial.py", line 405, in suggest_categorical
    return self._suggest(name, CategoricalDistribution(choices=choices))
  File "/home/ketrong/miniconda3/envs/tpot2devenv/lib/python3.10/site-packages/optuna/trial/_trial.py", line 636, in _suggest
    storage.set_trial_param(trial_id, name, param_value_in_internal_repr, distribution)
  File "/home/ketrong/miniconda3/envs/tpot2devenv/lib/python3.10/site-packages/optuna/storages/_in_memory.py", line 187, in set_trial_param
    distributions.check_distribution_compatibility(
  File "/home/ketrong/miniconda3/envs/tpot2devenv/lib/python3.10/site-packages/optuna/distributions.py", line 670, in check_distribution_compatibility
    raise ValueError(
ValueError: CategoricalDistribution does not support dynamic value space.
                                                                                Best trial: 0. Best value: inf:   5%|▌         | 10/200 [00:02<00:40,  4.66it/s]                                                                                [W 2023-11-24 15:16:08,205] Trial 44 failed with value None.
Best trial: 0. Best value: inf:   5%|▌         | 10/200 [00:02<00:40,  4.66it/s][W 2023-11-24 15:16:08,383] Trial 45 failed with parameters: {'model_name': 'IterativeImputer'} because of the following error: ValueError('CategoricalDistribution does not support dynamic value space.').
Traceback (most recent call last):
  File "/home/ketrong/miniconda3/envs/tpot2devenv/lib/python3.10/site-packages/optuna/study/_optimize.py", line 200, in _run_trial
    value_or_values = func(trial)
  File "/common/ketrong/AutoImputeExp/tpot2_imputetest/Impute_Experiments/autoimpute.py", line 56, in obj
    my_params = autoutils.trial_suggestion(trial, self.model_names, column_len=len(X.columns), random_state=self.random_state)
  File "/common/ketrong/AutoImputeExp/tpot2_imputetest/Impute_Experiments/autoutils.py", line 20, in trial_suggestion
    my_params = params_IterativeImpute(trial,model_name) #Uses the dependence between columns in the data set to predict for the one column. Predictions occur through a variety of strategies.
  File "/common/ketrong/AutoImputeExp/tpot2_imputetest/Impute_Experiments/param_grids.py", line 20, in params_IterativeImpute
    params['estimator'] = trial.suggest_categorical('estimator', [Bayes, RFR, Ridge, KNN])
  File "/home/ketrong/miniconda3/envs/tpot2devenv/lib/python3.10/site-packages/optuna/trial/_trial.py", line 405, in suggest_categorical
    return self._suggest(name, CategoricalDistribution(choices=choices))
  File "/home/ketrong/miniconda3/envs/tpot2devenv/lib/python3.10/site-packages/optuna/trial/_trial.py", line 636, in _suggest
    storage.set_trial_param(trial_id, name, param_value_in_internal_repr, distribution)
  File "/home/ketrong/miniconda3/envs/tpot2devenv/lib/python3.10/site-packages/optuna/storages/_in_memory.py", line 187, in set_trial_param
    distributions.check_distribution_compatibility(
  File "/home/ketrong/miniconda3/envs/tpot2devenv/lib/python3.10/site-packages/optuna/distributions.py", line 670, in check_distribution_compatibility
    raise ValueError(
ValueError: CategoricalDistribution does not support dynamic value space.
                                                                                Best trial: 0. Best value: inf:   5%|▌         | 10/200 [00:03<00:40,  4.66it/s]                                                                                [W 2023-11-24 15:16:08,418] Trial 45 failed with value None.
Best trial: 0. Best value: inf:   5%|▌         | 10/200 [00:03<00:40,  4.66it/s]                                                                                [W 2023-11-24 15:16:08,403] Trial 46 failed with parameters: {'model_name': 'IterativeImputer'} because of the following error: ValueError('CategoricalDistribution does not support dynamic value space.').
Traceback (most recent call last):
  File "/home/ketrong/miniconda3/envs/tpot2devenv/lib/python3.10/site-packages/optuna/study/_optimize.py", line 200, in _run_trial
    value_or_values = func(trial)
  File "/common/ketrong/AutoImputeExp/tpot2_imputetest/Impute_Experiments/autoimpute.py", line 56, in obj
    my_params = autoutils.trial_suggestion(trial, self.model_names, column_len=len(X.columns), random_state=self.random_state)
  File "/common/ketrong/AutoImputeExp/tpot2_imputetest/Impute_Experiments/autoutils.py", line 20, in trial_suggestion
    my_params = params_IterativeImpute(trial,model_name) #Uses the dependence between columns in the data set to predict for the one column. Predictions occur through a variety of strategies.
  File "/common/ketrong/AutoImputeExp/tpot2_imputetest/Impute_Experiments/param_grids.py", line 20, in params_IterativeImpute
    params['estimator'] = trial.suggest_categorical('estimator', [Bayes, RFR, Ridge, KNN])
  File "/home/ketrong/miniconda3/envs/tpot2devenv/lib/python3.10/site-packages/optuna/trial/_trial.py", line 405, in suggest_categorical
    return self._suggest(name, CategoricalDistribution(choices=choices))
  File "/home/ketrong/miniconda3/envs/tpot2devenv/lib/python3.10/site-packages/optuna/trial/_trial.py", line 636, in _suggest
    storage.set_trial_param(trial_id, name, param_value_in_internal_repr, distribution)
  File "/home/ketrong/miniconda3/envs/tpot2devenv/lib/python3.10/site-packages/optuna/storages/_in_memory.py", line 187, in set_trial_param
    distributions.check_distribution_compatibility(
  File "/home/ketrong/miniconda3/envs/tpot2devenv/lib/python3.10/site-packages/optuna/distributions.py", line 670, in check_distribution_compatibility
    raise ValueError(
ValueError: CategoricalDistribution does not support dynamic value space.
Best trial: 0. Best value: inf:   5%|▌         | 10/200 [00:03<00:40,  4.66it/s]                                                                                [W 2023-11-24 15:16:08,593] Trial 46 failed with value None.
Best trial: 0. Best value: inf:   5%|▌         | 10/200 [00:03<00:40,  4.66it/s]                                                                                [I 2023-11-24 15:16:08,386] Trial 18 finished with value: inf and parameters: {'model_name': 'KNNImputer', 'weights': 'distance', 'keep_empty_features': False}. Best is trial 0 with value: inf.
Best trial: 0. Best value: inf:   5%|▌         | 10/200 [00:03<00:40,  4.66it/s]Best trial: 0. Best value: inf:   5%|▌         | 10/200 [00:03<00:40,  4.66it/s]Best trial: 0. Best value: inf:   6%|▌         | 11/200 [00:03<01:43,  1.82it/s]                                                                                [W 2023-11-24 15:16:08,404] Trial 23 failed with parameters: {'model_name': 'IterativeImputer'} because of the following error: ValueError('CategoricalDistribution does not support dynamic value space.').
Traceback (most recent call last):
  File "/home/ketrong/miniconda3/envs/tpot2devenv/lib/python3.10/site-packages/optuna/study/_optimize.py", line 200, in _run_trial
    value_or_values = func(trial)
  File "/common/ketrong/AutoImputeExp/tpot2_imputetest/Impute_Experiments/autoimpute.py", line 56, in obj
    my_params = autoutils.trial_suggestion(trial, self.model_names, column_len=len(X.columns), random_state=self.random_state)
  File "/common/ketrong/AutoImputeExp/tpot2_imputetest/Impute_Experiments/autoutils.py", line 20, in trial_suggestion
    my_params = params_IterativeImpute(trial,model_name) #Uses the dependence between columns in the data set to predict for the one column. Predictions occur through a variety of strategies.
  File "/common/ketrong/AutoImputeExp/tpot2_imputetest/Impute_Experiments/param_grids.py", line 20, in params_IterativeImpute
    params['estimator'] = trial.suggest_categorical('estimator', [Bayes, RFR, Ridge, KNN])
  File "/home/ketrong/miniconda3/envs/tpot2devenv/lib/python3.10/site-packages/optuna/trial/_trial.py", line 405, in suggest_categorical
    return self._suggest(name, CategoricalDistribution(choices=choices))
  File "/home/ketrong/miniconda3/envs/tpot2devenv/lib/python3.10/site-packages/optuna/trial/_trial.py", line 636, in _suggest
    storage.set_trial_param(trial_id, name, param_value_in_internal_repr, distribution)
  File "/home/ketrong/miniconda3/envs/tpot2devenv/lib/python3.10/site-packages/optuna/storages/_in_memory.py", line 187, in set_trial_param
    distributions.check_distribution_compatibility(
  File "/home/ketrong/miniconda3/envs/tpot2devenv/lib/python3.10/site-packages/optuna/distributions.py", line 670, in check_distribution_compatibility
    raise ValueError(
ValueError: CategoricalDistribution does not support dynamic value space.
Best trial: 0. Best value: inf:   6%|▌         | 11/200 [00:03<01:43,  1.82it/s]                                                                                [W 2023-11-24 15:16:08,939] Trial 23 failed with value None.
Best trial: 0. Best value: inf:   6%|▌         | 11/200 [00:03<01:43,  1.82it/s]                                                                                [I 2023-11-24 15:16:09,195] Trial 4 finished with value: 6.598447978562055 and parameters: {'model_name': 'SimpleImputer', 'strategy': 'constant'}. Best is trial 4 with value: 6.598447978562055.
Best trial: 0. Best value: inf:   6%|▌         | 11/200 [00:03<01:43,  1.82it/s]Best trial: 4. Best value: 6.59845:   6%|▌         | 11/200 [00:04<01:43,  1.82it/s]Best trial: 4. Best value: 6.59845:   6%|▌         | 12/200 [00:04<01:37,  1.92it/s][I 2023-11-24 15:16:09,215] Trial 29 finished with value: inf and parameters: {'model_name': 'KNNImputer', 'weights': 'uniform', 'keep_empty_features': False}. Best is trial 4 with value: 6.598447978562055.
                                                                                    Best trial: 4. Best value: 6.59845:   6%|▌         | 12/200 [00:04<01:37,  1.92it/s][I 2023-11-24 15:16:09,391] Trial 21 finished with value: inf and parameters: {'model_name': 'KNNImputer', 'weights': 'uniform', 'keep_empty_features': True}. Best is trial 4 with value: 6.598447978562055.
