[I 2023-12-07 17:06:12,544] Trial 1 finished with value: 2193.076877603077 and parameters: {'model_name': 'SimpleImputer', 'strategy': 'constant'}. Best is trial 1 with value: 2193.076877603077.
[I 2023-12-07 17:06:12,914] Trial 3 finished with value: 2096.1610027502606 and parameters: {'model_name': 'SimpleImputer', 'strategy': 'mean'}. Best is trial 3 with value: 2096.1610027502606.
[I 2023-12-07 17:06:13,255] Trial 5 finished with value: 2179.586457202838 and parameters: {'model_name': 'SimpleImputer', 'strategy': 'most_frequent'}. Best is trial 3 with value: 2096.1610027502606.
[I 2023-12-07 17:06:13,841] Trial 26 finished with value: 2179.586457202838 and parameters: {'model_name': 'SimpleImputer', 'strategy': 'most_frequent'}. Best is trial 3 with value: 2096.1610027502606.
[I 2023-12-07 17:06:14,259] Trial 18 finished with value: 2179.586457202838 and parameters: {'model_name': 'SimpleImputer', 'strategy': 'most_frequent'}. Best is trial 3 with value: 2096.1610027502606.
[I 2023-12-07 17:06:14,775] Trial 27 finished with value: 2193.076877603077 and parameters: {'model_name': 'SimpleImputer', 'strategy': 'constant'}. Best is trial 3 with value: 2096.1610027502606.
[I 2023-12-07 17:06:15,135] Trial 19 finished with value: 2179.586457202838 and parameters: {'model_name': 'SimpleImputer', 'strategy': 'most_frequent'}. Best is trial 3 with value: 2096.1610027502606.
[I 2023-12-07 17:06:15,445] Trial 28 finished with value: 2193.076877603077 and parameters: {'model_name': 'SimpleImputer', 'strategy': 'constant'}. Best is trial 3 with value: 2096.1610027502606.
[I 2023-12-07 17:06:15,854] Trial 33 finished with value: 2096.1610027502606 and parameters: {'model_name': 'SimpleImputer', 'strategy': 'mean'}. Best is trial 3 with value: 2096.1610027502606.
[I 2023-12-07 17:06:16,390] Trial 6 finished with value: inf and parameters: {'model_name': 'IterativeImputer', 'estimator': 'Ridge', 'sample_posterior': True, 'initial_strategy': 'most_frequent', 'imputation_order': 'roman'}. Best is trial 3 with value: 2096.1610027502606.
[I 2023-12-07 17:06:17,238] Trial 35 finished with value: 2179.586457202838 and parameters: {'model_name': 'SimpleImputer', 'strategy': 'most_frequent'}. Best is trial 3 with value: 2096.1610027502606.
[I 2023-12-07 17:06:17,602] Trial 9 finished with value: 1319.6474007607105 and parameters: {'model_name': 'KNNImputer', 'weights': 'uniform', 'keep_empty_features': False}. Best is trial 9 with value: 1319.6474007607105.
[I 2023-12-07 17:06:17,933] Trial 12 finished with value: 1319.6474007607105 and parameters: {'model_name': 'KNNImputer', 'weights': 'uniform', 'keep_empty_features': False}. Best is trial 9 with value: 1319.6474007607105.
[I 2023-12-07 17:06:18,656] Trial 16 finished with value: 1319.6474007607105 and parameters: {'model_name': 'KNNImputer', 'weights': 'uniform', 'keep_empty_features': False}. Best is trial 9 with value: 1319.6474007607105.
[I 2023-12-07 17:06:19,430] Trial 23 finished with value: inf and parameters: {'model_name': 'IterativeImputer', 'estimator': 'Ridge', 'sample_posterior': True, 'initial_strategy': 'most_frequent', 'imputation_order': 'arabic'}. Best is trial 9 with value: 1319.6474007607105.
[I 2023-12-07 17:06:19,803] Trial 15 finished with value: 1291.7561251970908 and parameters: {'model_name': 'KNNImputer', 'weights': 'distance', 'keep_empty_features': False}. Best is trial 15 with value: 1291.7561251970908.
[I 2023-12-07 17:06:20,270] Trial 22 finished with value: 1291.7561251970908 and parameters: {'model_name': 'KNNImputer', 'weights': 'distance', 'keep_empty_features': False}. Best is trial 15 with value: 1291.7561251970908.
[I 2023-12-07 17:06:21,195] Trial 32 finished with value: 1291.7561251970908 and parameters: {'model_name': 'KNNImputer', 'weights': 'distance', 'keep_empty_features': False}. Best is trial 15 with value: 1291.7561251970908.
[I 2023-12-07 17:06:21,913] Trial 36 finished with value: 1319.6474007607105 and parameters: {'model_name': 'KNNImputer', 'weights': 'uniform', 'keep_empty_features': False}. Best is trial 15 with value: 1291.7561251970908.
[I 2023-12-07 17:06:22,250] Trial 40 finished with value: 1291.7561251970908 and parameters: {'model_name': 'KNNImputer', 'weights': 'distance', 'keep_empty_features': False}. Best is trial 15 with value: 1291.7561251970908.
[I 2023-12-07 17:06:22,547] Trial 31 finished with value: 1291.7561251970908 and parameters: {'model_name': 'KNNImputer', 'weights': 'distance', 'keep_empty_features': False}. Best is trial 15 with value: 1291.7561251970908.
[I 2023-12-07 17:06:22,847] Trial 37 finished with value: 1291.7561251970908 and parameters: {'model_name': 'KNNImputer', 'weights': 'distance', 'keep_empty_features': False}. Best is trial 15 with value: 1291.7561251970908.
[I 2023-12-07 17:06:23,105] Trial 48 finished with value: 1319.6474007607105 and parameters: {'model_name': 'KNNImputer', 'weights': 'uniform', 'keep_empty_features': False}. Best is trial 15 with value: 1291.7561251970908.
[I 2023-12-07 17:06:23,394] Trial 39 finished with value: 1291.7561251970908 and parameters: {'model_name': 'KNNImputer', 'weights': 'distance', 'keep_empty_features': False}. Best is trial 15 with value: 1291.7561251970908.
[I 2023-12-07 17:06:23,915] Trial 43 finished with value: 1291.7561251970908 and parameters: {'model_name': 'KNNImputer', 'weights': 'distance', 'keep_empty_features': False}. Best is trial 15 with value: 1291.7561251970908.
[I 2023-12-07 17:06:24,496] Trial 55 finished with value: 1319.6474007607105 and parameters: {'model_name': 'KNNImputer', 'weights': 'uniform', 'keep_empty_features': False}. Best is trial 15 with value: 1291.7561251970908.
[I 2023-12-07 17:06:25,218] Trial 56 finished with value: 1319.6474007607105 and parameters: {'model_name': 'KNNImputer', 'weights': 'uniform', 'keep_empty_features': False}. Best is trial 15 with value: 1291.7561251970908.
[I 2023-12-07 17:06:25,606] Trial 57 finished with value: 1319.6474007607105 and parameters: {'model_name': 'KNNImputer', 'weights': 'uniform', 'keep_empty_features': False}. Best is trial 15 with value: 1291.7561251970908.
[I 2023-12-07 17:06:26,029] Trial 58 finished with value: 1319.6474007607105 and parameters: {'model_name': 'KNNImputer', 'weights': 'uniform', 'keep_empty_features': False}. Best is trial 15 with value: 1291.7561251970908.
[I 2023-12-07 17:06:26,390] Trial 60 finished with value: 1291.7561251970908 and parameters: {'model_name': 'KNNImputer', 'weights': 'distance', 'keep_empty_features': False}. Best is trial 15 with value: 1291.7561251970908.
2023-12-07 17:06:26.790364: E external/local_xla/xla/stream_executor/cuda/cuda_driver.cc:274] failed call to cuInit: CUDA_ERROR_NO_DEVICE: no CUDA-capable device is detected
[I 2023-12-07 17:06:26,813] Trial 44 finished with value: 1291.7561251970908 and parameters: {'model_name': 'KNNImputer', 'weights': 'distance', 'keep_empty_features': False}. Best is trial 15 with value: 1291.7561251970908.
[I 2023-12-07 17:06:27,132] Trial 47 finished with value: 1319.6474007607105 and parameters: {'model_name': 'KNNImputer', 'weights': 'uniform', 'keep_empty_features': False}. Best is trial 15 with value: 1291.7561251970908.
2023-12-07 17:06:27.584453: I tensorflow/compiler/mlir/mlir_graph_optimization_pass.cc:388] MLIR V1 optimization pass is not enabled
[I 2023-12-07 17:06:27,585] Trial 59 finished with value: 1291.7561251970908 and parameters: {'model_name': 'KNNImputer', 'weights': 'distance', 'keep_empty_features': False}. Best is trial 15 with value: 1291.7561251970908.
[I 2023-12-07 17:06:28,530] Trial 61 finished with value: 2096.1610027502606 and parameters: {'model_name': 'RandomForestImputer', 'max_iter': 1, 'decreasing': True, 'min_samples_split': 0.2, 'min_samples_leaf': 0.8, 'max_features': 0.1, 'warm_start': True}. Best is trial 15 with value: 1291.7561251970908.
[I 2023-12-07 17:06:32,153] Trial 74 finished with value: 2096.1610027502606 and parameters: {'model_name': 'RandomForestImputer', 'max_iter': 1, 'decreasing': False, 'min_samples_split': 0.30000000000000004, 'min_samples_leaf': 0.4, 'max_features': 0.7000000000000001, 'warm_start': True}. Best is trial 15 with value: 1291.7561251970908.
[I 2023-12-07 17:06:34,475] Trial 13 finished with value: 916.639015591275 and parameters: {'model_name': 'IterativeImputer', 'estimator': 'Ridge', 'sample_posterior': False, 'initial_strategy': 'most_frequent', 'imputation_order': 'roman'}. Best is trial 13 with value: 916.639015591275.
[I 2023-12-07 17:06:34,815] Trial 21 finished with value: 917.2371202205624 and parameters: {'model_name': 'IterativeImputer', 'estimator': 'Ridge', 'sample_posterior': False, 'initial_strategy': 'constant', 'imputation_order': 'descending'}. Best is trial 13 with value: 916.639015591275.
[I 2023-12-07 17:06:35,442] Trial 34 finished with value: 2096.1610027502606 and parameters: {'model_name': 'RandomForestImputer', 'max_iter': 1, 'decreasing': True, 'min_samples_split': 0.5, 'min_samples_leaf': 0.9, 'max_features': 0.30000000000000004, 'warm_start': False}. Best is trial 13 with value: 916.639015591275.
[I 2023-12-07 17:06:37,731] Trial 7 finished with value: 3967.1217013305154 and parameters: {'model_name': 'GAIN', 'batch_size': 356, 'hint_rate': 0.24000000000000002, 'alpha': 78, 'iterations': 11}. Best is trial 13 with value: 916.639015591275.
[I 2023-12-07 17:06:38,097] Trial 45 finished with value: 2943.874390992511 and parameters: {'model_name': 'GAIN', 'batch_size': 3, 'hint_rate': 0.6, 'alpha': 76, 'iterations': 1}. Best is trial 13 with value: 916.639015591275.
[I 2023-12-07 17:06:38,544] Trial 73 finished with value: 2096.1610027502606 and parameters: {'model_name': 'RandomForestImputer', 'max_iter': 1, 'decreasing': False, 'min_samples_split': 0.5, 'min_samples_leaf': 0.9, 'max_features': 0.1, 'warm_start': False}. Best is trial 13 with value: 916.639015591275.
[I 2023-12-07 17:06:39,579] Trial 65 finished with value: 2172.753224254856 and parameters: {'model_name': 'RandomForestImputer', 'max_iter': 8, 'decreasing': False, 'min_samples_split': 0.8, 'min_samples_leaf': 0.5, 'max_features': 0.9, 'warm_start': True}. Best is trial 13 with value: 916.639015591275.
[I 2023-12-07 17:06:40,035] Trial 42 finished with value: 2385.3637081889765 and parameters: {'model_name': 'GAIN', 'batch_size': 968, 'hint_rate': 0.42000000000000004, 'alpha': 52, 'iterations': 6}. Best is trial 13 with value: 916.639015591275.
[I 2023-12-07 17:06:40,684] Trial 29 finished with value: 2896.9646023053865 and parameters: {'model_name': 'GAIN', 'batch_size': 564, 'hint_rate': 0.17, 'alpha': 13, 'iterations': 4}. Best is trial 13 with value: 916.639015591275.
[I 2023-12-07 17:06:41,307] Trial 20 finished with value: 2149.1038982016958 and parameters: {'model_name': 'RandomForestImputer', 'max_iter': 10, 'decreasing': True, 'min_samples_split': 0.0, 'min_samples_leaf': 0.6, 'max_features': 0.30000000000000004, 'warm_start': True}. Best is trial 13 with value: 916.639015591275.
[I 2023-12-07 17:06:42,619] Trial 79 finished with value: 2361.4790482606513 and parameters: {'model_name': 'GAIN', 'batch_size': 154, 'hint_rate': 0.29000000000000004, 'alpha': 97, 'iterations': 3}. Best is trial 13 with value: 916.639015591275.
[I 2023-12-07 17:06:43,113] Trial 72 finished with value: 2794.9350966373577 and parameters: {'model_name': 'GAIN', 'batch_size': 2, 'hint_rate': 0.73, 'alpha': 68, 'iterations': 1}. Best is trial 13 with value: 916.639015591275.
[I 2023-12-07 17:06:43,928] Trial 85 finished with value: 917.2371202205624 and parameters: {'model_name': 'IterativeImputer', 'estimator': 'Ridge', 'sample_posterior': False, 'initial_strategy': 'constant', 'imputation_order': 'descending'}. Best is trial 13 with value: 916.639015591275.
[I 2023-12-07 17:06:44,593] Trial 0 finished with value: 2097.1356968712594 and parameters: {'model_name': 'RandomForestImputer', 'max_iter': 2, 'decreasing': True, 'min_samples_split': 0.9, 'min_samples_leaf': 0.4, 'max_features': 0.30000000000000004, 'warm_start': False}. Best is trial 13 with value: 916.639015591275.
[I 2023-12-07 17:06:45,452] Trial 87 finished with value: 1320.4392497752713 and parameters: {'model_name': 'IterativeImputer', 'estimator': 'KNN', 'sample_posterior': False, 'initial_strategy': 'constant', 'imputation_order': 'descending'}. Best is trial 13 with value: 916.639015591275.
[I 2023-12-07 17:06:45,946] Trial 25 finished with value: 2190.7119217137615 and parameters: {'model_name': 'GAIN', 'batch_size': 16, 'hint_rate': 0.39, 'alpha': 66, 'iterations': 14}. Best is trial 13 with value: 916.639015591275.
[I 2023-12-07 17:06:46,541] Trial 54 finished with value: 2202.501543160037 and parameters: {'model_name': 'GAIN', 'batch_size': 2, 'hint_rate': 0.43, 'alpha': 27, 'iterations': 14}. Best is trial 13 with value: 916.639015591275.
[I 2023-12-07 17:06:47,440] Trial 86 finished with value: 917.2371202205624 and parameters: {'model_name': 'IterativeImputer', 'estimator': 'Ridge', 'sample_posterior': False, 'initial_strategy': 'constant', 'imputation_order': 'descending'}. Best is trial 13 with value: 916.639015591275.
[I 2023-12-07 17:06:48,117] Trial 90 finished with value: 917.2371202205624 and parameters: {'model_name': 'IterativeImputer', 'estimator': 'Ridge', 'sample_posterior': False, 'initial_strategy': 'constant', 'imputation_order': 'descending'}. Best is trial 13 with value: 916.639015591275.
[I 2023-12-07 17:06:48,867] Trial 66 finished with value: 2148.900809121978 and parameters: {'model_name': 'RandomForestImputer', 'max_iter': 15, 'decreasing': True, 'min_samples_split': 0.6000000000000001, 'min_samples_leaf': 0.7000000000000001, 'max_features': 0.5, 'warm_start': True}. Best is trial 13 with value: 916.639015591275.
[I 2023-12-07 17:06:49,249] Trial 17 finished with value: 2095.6064685969263 and parameters: {'model_name': 'RandomForestImputer', 'max_iter': 2, 'decreasing': False, 'min_samples_split': 0.7000000000000001, 'min_samples_leaf': 0.4, 'max_features': 0.4, 'warm_start': False}. Best is trial 13 with value: 916.639015591275.
[I 2023-12-07 17:06:49,643] Trial 92 finished with value: 917.2371202205624 and parameters: {'model_name': 'IterativeImputer', 'estimator': 'Ridge', 'sample_posterior': False, 'initial_strategy': 'constant', 'imputation_order': 'descending'}. Best is trial 13 with value: 916.639015591275.
[I 2023-12-07 17:06:50,676] Trial 93 finished with value: 917.2371202205624 and parameters: {'model_name': 'IterativeImputer', 'estimator': 'Ridge', 'sample_posterior': False, 'initial_strategy': 'constant', 'imputation_order': 'descending'}. Best is trial 13 with value: 916.639015591275.
[I 2023-12-07 17:06:51,785] Trial 46 finished with value: 909.3780859453343 and parameters: {'model_name': 'IterativeImputer', 'estimator': 'Bayesian', 'sample_posterior': False, 'initial_strategy': 'median', 'imputation_order': 'roman'}. Best is trial 46 with value: 909.3780859453343.
[I 2023-12-07 17:06:52,481] Trial 95 finished with value: 917.2371202205624 and parameters: {'model_name': 'IterativeImputer', 'estimator': 'Ridge', 'sample_posterior': False, 'initial_strategy': 'constant', 'imputation_order': 'descending'}. Best is trial 46 with value: 909.3780859453343.
[I 2023-12-07 17:06:53,068] Trial 96 finished with value: 917.2371202205624 and parameters: {'model_name': 'IterativeImputer', 'estimator': 'Ridge', 'sample_posterior': False, 'initial_strategy': 'constant', 'imputation_order': 'descending'}. Best is trial 46 with value: 909.3780859453343.
[I 2023-12-07 17:06:53,687] Trial 98 finished with value: 917.2371202205624 and parameters: {'model_name': 'IterativeImputer', 'estimator': 'Ridge', 'sample_posterior': False, 'initial_strategy': 'constant', 'imputation_order': 'descending'}. Best is trial 46 with value: 909.3780859453343.
[I 2023-12-07 17:06:54,172] Trial 97 finished with value: 917.2371202205624 and parameters: {'model_name': 'IterativeImputer', 'estimator': 'Ridge', 'sample_posterior': False, 'initial_strategy': 'constant', 'imputation_order': 'descending'}. Best is trial 46 with value: 909.3780859453343.
[I 2023-12-07 17:06:54,944] Trial 99 finished with value: 917.2371202205624 and parameters: {'model_name': 'IterativeImputer', 'estimator': 'Ridge', 'sample_posterior': False, 'initial_strategy': 'constant', 'imputation_order': 'descending'}. Best is trial 46 with value: 909.3780859453343.
[I 2023-12-07 17:06:55,604] Trial 100 finished with value: 917.2371202205624 and parameters: {'model_name': 'IterativeImputer', 'estimator': 'Ridge', 'sample_posterior': False, 'initial_strategy': 'constant', 'imputation_order': 'descending'}. Best is trial 46 with value: 909.3780859453343.
[I 2023-12-07 17:06:56,552] Trial 101 finished with value: 917.2371202205624 and parameters: {'model_name': 'IterativeImputer', 'estimator': 'Ridge', 'sample_posterior': False, 'initial_strategy': 'constant', 'imputation_order': 'descending'}. Best is trial 46 with value: 909.3780859453343.
[I 2023-12-07 17:06:56,943] Trial 104 finished with value: 917.2371202205624 and parameters: {'model_name': 'IterativeImputer', 'estimator': 'Ridge', 'sample_posterior': False, 'initial_strategy': 'constant', 'imputation_order': 'descending'}. Best is trial 46 with value: 909.3780859453343.
[I 2023-12-07 17:06:57,436] Trial 103 finished with value: 917.2371202205624 and parameters: {'model_name': 'IterativeImputer', 'estimator': 'Ridge', 'sample_posterior': False, 'initial_strategy': 'constant', 'imputation_order': 'descending'}. Best is trial 46 with value: 909.3780859453343.
[I 2023-12-07 17:06:57,796] Trial 14 finished with value: 2149.0210282476373 and parameters: {'model_name': 'RandomForestImputer', 'max_iter': 94, 'decreasing': True, 'min_samples_split': 0.1, 'min_samples_leaf': 0.4, 'max_features': 0.7000000000000001, 'warm_start': True}. Best is trial 46 with value: 909.3780859453343.
[I 2023-12-07 17:06:58,159] Trial 102 finished with value: 917.2371202205624 and parameters: {'model_name': 'IterativeImputer', 'estimator': 'Ridge', 'sample_posterior': False, 'initial_strategy': 'constant', 'imputation_order': 'descending'}. Best is trial 46 with value: 909.3780859453343.
[I 2023-12-07 17:06:58,629] Trial 30 finished with value: 910.4162749088199 and parameters: {'model_name': 'IterativeImputer', 'estimator': 'Bayesian', 'sample_posterior': False, 'initial_strategy': 'constant', 'imputation_order': 'descending'}. Best is trial 46 with value: 909.3780859453343.
[I 2023-12-07 17:06:59,045] Trial 105 finished with value: 917.2371202205624 and parameters: {'model_name': 'IterativeImputer', 'estimator': 'Ridge', 'sample_posterior': False, 'initial_strategy': 'constant', 'imputation_order': 'descending'}. Best is trial 46 with value: 909.3780859453343.
[I 2023-12-07 17:06:59,920] Trial 70 finished with value: 2714.962233797134 and parameters: {'model_name': 'GAIN', 'batch_size': 17, 'hint_rate': 0.15000000000000002, 'alpha': 57, 'iterations': 23}. Best is trial 46 with value: 909.3780859453343.
[I 2023-12-07 17:07:00,333] Trial 51 finished with value: 909.640763049781 and parameters: {'model_name': 'IterativeImputer', 'estimator': 'Bayesian', 'sample_posterior': False, 'initial_strategy': 'constant', 'imputation_order': 'random'}. Best is trial 46 with value: 909.3780859453343.
[I 2023-12-07 17:07:04,658] Trial 76 finished with value: 2065.0311468212312 and parameters: {'model_name': 'RandomForestImputer', 'max_iter': 56, 'decreasing': True, 'min_samples_split': 1.0, 'min_samples_leaf': 0.30000000000000004, 'max_features': 0.9, 'warm_start': True}. Best is trial 46 with value: 909.3780859453343.
[I 2023-12-07 17:07:05,327] Trial 88 finished with value: 910.4162749088199 and parameters: {'model_name': 'IterativeImputer', 'estimator': 'Bayesian', 'sample_posterior': False, 'initial_strategy': 'constant', 'imputation_order': 'descending'}. Best is trial 46 with value: 909.3780859453343.
[I 2023-12-07 17:07:05,946] Trial 89 finished with value: 910.4162749088199 and parameters: {'model_name': 'IterativeImputer', 'estimator': 'Bayesian', 'sample_posterior': False, 'initial_strategy': 'constant', 'imputation_order': 'descending'}. Best is trial 46 with value: 909.3780859453343.
[I 2023-12-07 17:07:06,420] Trial 91 finished with value: 910.4162749088199 and parameters: {'model_name': 'IterativeImputer', 'estimator': 'Bayesian', 'sample_posterior': False, 'initial_strategy': 'constant', 'imputation_order': 'descending'}. Best is trial 46 with value: 909.3780859453343.
[I 2023-12-07 17:07:08,645] Trial 107 finished with value: 909.3780859453343 and parameters: {'model_name': 'IterativeImputer', 'estimator': 'Bayesian', 'sample_posterior': False, 'initial_strategy': 'median', 'imputation_order': 'roman'}. Best is trial 46 with value: 909.3780859453343.
[I 2023-12-07 17:07:09,040] Trial 106 finished with value: 909.3780859453343 and parameters: {'model_name': 'IterativeImputer', 'estimator': 'Bayesian', 'sample_posterior': False, 'initial_strategy': 'median', 'imputation_order': 'roman'}. Best is trial 46 with value: 909.3780859453343.
[I 2023-12-07 17:07:09,355] Trial 108 finished with value: 909.3780859453343 and parameters: {'model_name': 'IterativeImputer', 'estimator': 'Bayesian', 'sample_posterior': False, 'initial_strategy': 'median', 'imputation_order': 'roman'}. Best is trial 46 with value: 909.3780859453343.
[I 2023-12-07 17:07:09,893] Trial 109 finished with value: 909.3780859453343 and parameters: {'model_name': 'IterativeImputer', 'estimator': 'Bayesian', 'sample_posterior': False, 'initial_strategy': 'median', 'imputation_order': 'roman'}. Best is trial 46 with value: 909.3780859453343.
[I 2023-12-07 17:07:11,568] Trial 111 finished with value: 909.3780859453343 and parameters: {'model_name': 'IterativeImputer', 'estimator': 'Bayesian', 'sample_posterior': False, 'initial_strategy': 'median', 'imputation_order': 'roman'}. Best is trial 46 with value: 909.3780859453343.
