/cm/local/apps/slurm/var/spool/job403254/slurm_script: line 19: /common/ketrong/minconda3/etc/profile.d/conda.sh: No such file or directory
/cm/local/apps/slurm/var/spool/job403254/slurm_script: line 22: $'\nconda create --name tpot2devenv -c conda-forge python=3.10\n': command not found
/cm/local/apps/slurm/var/spool/job403254/slurm_script: line 27: $'\npip install -r requirements.txt\n': command not found
RunStart
2023-11-21 17:05:31.704480: I tensorflow/core/util/port.cc:113] oneDNN custom operations are on. You may see slightly different numerical results due to floating-point round-off errors from different computation orders. To turn them off, set the environment variable `TF_ENABLE_ONEDNN_OPTS=0`.
2023-11-21 17:05:31.738942: E external/local_xla/xla/stream_executor/cuda/cuda_dnn.cc:9261] Unable to register cuDNN factory: Attempting to register factory for plugin cuDNN when one has already been registered
2023-11-21 17:05:31.738968: E external/local_xla/xla/stream_executor/cuda/cuda_fft.cc:607] Unable to register cuFFT factory: Attempting to register factory for plugin cuFFT when one has already been registered
2023-11-21 17:05:31.740089: E external/local_xla/xla/stream_executor/cuda/cuda_blas.cc:1515] Unable to register cuBLAS factory: Attempting to register factory for plugin cuBLAS when one has already been registered
2023-11-21 17:05:31.745597: I tensorflow/core/platform/cpu_feature_guard.cc:182] This TensorFlow binary is optimized to use available CPU instructions in performance-critical operations.
To enable the following instructions: AVX2 AVX512F AVX512_VNNI FMA, in other operations, rebuild TensorFlow with the appropriate compiler flags.
2023-11-21 17:05:33.419805: W tensorflow/compiler/tf2tensorrt/utils/py_utils.cc:38] TF-TRT Warning: Could not find TensorRT
WARNING:tensorflow:From /home/ketrong/miniconda3/envs/tpot2devenv/lib/python3.10/site-packages/tensorflow/python/compat/v2_compat.py:108: disable_resource_variables (from tensorflow.python.ops.variable_scope) is deprecated and will be removed in a future version.
Instructions for updating:
non-resource variables are not supported in the long term
working on 
tpot2_imputetest/Impute_Experiments/logs//tpot2_base_imputation_6_0.01_MAR_3
loading data
tpot2_imputetest/Impute_Experiments/data/6_True.pkl
running experiment 1/3 - Does large hyperparameter space improve reconstruction accuracy over simple
[I 2023-11-21 17:09:05,788] A new study created in memory with name: no-name-0165c28f-a181-43c4-aadd-2a6a1ceb062c
[I 2023-11-21 17:09:07,313] Trial 1 finished with value: 6.241202960058521 and parameters: {'model_name': 'SimpleImputer', 'strategy': 'constant'}. Best is trial 1 with value: 6.241202960058521.
[I 2023-11-21 17:09:07,638] Trial 2 finished with value: 6.241202960058521 and parameters: {'model_name': 'SimpleImputer', 'strategy': 'constant'}. Best is trial 1 with value: 6.241202960058521.
[I 2023-11-21 17:09:07,922] Trial 6 finished with value: 6.241202960058521 and parameters: {'model_name': 'SimpleImputer', 'strategy': 'constant'}. Best is trial 1 with value: 6.241202960058521.
[I 2023-11-21 17:09:08,105] Trial 3 finished with value: 6.241202960058521 and parameters: {'model_name': 'SimpleImputer', 'strategy': 'constant'}. Best is trial 1 with value: 6.241202960058521.
[I 2023-11-21 17:09:08,320] Trial 8 finished with value: 6.241202960058521 and parameters: {'model_name': 'SimpleImputer', 'strategy': 'constant'}. Best is trial 1 with value: 6.241202960058521.
[I 2023-11-21 17:09:09,011] Trial 12 finished with value: 6.241202960058521 and parameters: {'model_name': 'SimpleImputer', 'strategy': 'constant'}. Best is trial 1 with value: 6.241202960058521.
[I 2023-11-21 17:09:09,350] Trial 13 finished with value: 2.5814239256540668 and parameters: {'model_name': 'SimpleImputer', 'strategy': 'mean'}. Best is trial 13 with value: 2.5814239256540668.
[I 2023-11-21 17:09:09,720] Trial 20 finished with value: 2.5814239256540668 and parameters: {'model_name': 'SimpleImputer', 'strategy': 'mean'}. Best is trial 13 with value: 2.5814239256540668.
[I 2023-11-21 17:09:09,960] Trial 28 finished with value: 6.241202960058521 and parameters: {'model_name': 'SimpleImputer', 'strategy': 'constant'}. Best is trial 13 with value: 2.5814239256540668.
[I 2023-11-21 17:09:10,135] Trial 29 finished with value: 2.5814239256540668 and parameters: {'model_name': 'SimpleImputer', 'strategy': 'mean'}. Best is trial 13 with value: 2.5814239256540668.
[I 2023-11-21 17:09:10,517] Trial 27 finished with value: 2.5814239256540668 and parameters: {'model_name': 'SimpleImputer', 'strategy': 'mean'}. Best is trial 13 with value: 2.5814239256540668.
[I 2023-11-21 17:09:10,719] Trial 19 finished with value: 6.241202960058521 and parameters: {'model_name': 'SimpleImputer', 'strategy': 'constant'}. Best is trial 13 with value: 2.5814239256540668.
[I 2023-11-21 17:09:10,926] Trial 37 finished with value: 6.241202960058521 and parameters: {'model_name': 'SimpleImputer', 'strategy': 'constant'}. Best is trial 13 with value: 2.5814239256540668.
[I 2023-11-21 17:09:11,118] Trial 26 finished with value: 2.5814239256540668 and parameters: {'model_name': 'SimpleImputer', 'strategy': 'mean'}. Best is trial 13 with value: 2.5814239256540668.
[I 2023-11-21 17:09:11,376] Trial 22 finished with value: 2.5814239256540668 and parameters: {'model_name': 'SimpleImputer', 'strategy': 'mean'}. Best is trial 13 with value: 2.5814239256540668.
[I 2023-11-21 17:09:11,575] Trial 7 finished with value: 2.5814239256540668 and parameters: {'model_name': 'SimpleImputer', 'strategy': 'mean'}. Best is trial 13 with value: 2.5814239256540668.
[I 2023-11-21 17:09:11,844] Trial 32 finished with value: 2.5814239256540668 and parameters: {'model_name': 'SimpleImputer', 'strategy': 'mean'}. Best is trial 13 with value: 2.5814239256540668.
[I 2023-11-21 17:09:12,181] Trial 33 finished with value: 2.5814239256540668 and parameters: {'model_name': 'SimpleImputer', 'strategy': 'mean'}. Best is trial 13 with value: 2.5814239256540668.
[I 2023-11-21 17:09:12,432] Trial 40 finished with value: 6.241202960058521 and parameters: {'model_name': 'SimpleImputer', 'strategy': 'constant'}. Best is trial 13 with value: 2.5814239256540668.
[I 2023-11-21 17:09:12,760] Trial 45 finished with value: 2.5814239256540668 and parameters: {'model_name': 'SimpleImputer', 'strategy': 'mean'}. Best is trial 13 with value: 2.5814239256540668.
[I 2023-11-21 17:09:12,947] Trial 17 finished with value: 2.571443158313177 and parameters: {'model_name': 'SimpleImputer', 'strategy': 'median'}. Best is trial 17 with value: 2.571443158313177.
[I 2023-11-21 17:09:13,202] Trial 4 finished with value: 2.571443158313177 and parameters: {'model_name': 'SimpleImputer', 'strategy': 'median'}. Best is trial 17 with value: 2.571443158313177.
[I 2023-11-21 17:09:13,453] Trial 47 finished with value: 6.241202960058521 and parameters: {'model_name': 'SimpleImputer', 'strategy': 'constant'}. Best is trial 17 with value: 2.571443158313177.
[I 2023-11-21 17:09:13,634] Trial 21 finished with value: 2.571443158313177 and parameters: {'model_name': 'SimpleImputer', 'strategy': 'median'}. Best is trial 17 with value: 2.571443158313177.
[I 2023-11-21 17:09:14,041] Trial 11 finished with value: 2.571443158313177 and parameters: {'model_name': 'SimpleImputer', 'strategy': 'median'}. Best is trial 17 with value: 2.571443158313177.
[I 2023-11-21 17:09:14,323] Trial 42 finished with value: 2.5814239256540668 and parameters: {'model_name': 'SimpleImputer', 'strategy': 'mean'}. Best is trial 17 with value: 2.571443158313177.
[I 2023-11-21 17:09:14,737] Trial 16 finished with value: 2.571443158313177 and parameters: {'model_name': 'SimpleImputer', 'strategy': 'median'}. Best is trial 17 with value: 2.571443158313177.
[I 2023-11-21 17:09:14,971] Trial 25 finished with value: 2.571443158313177 and parameters: {'model_name': 'SimpleImputer', 'strategy': 'median'}. Best is trial 17 with value: 2.571443158313177.
[I 2023-11-21 17:09:15,272] Trial 49 finished with value: 2.5814239256540668 and parameters: {'model_name': 'SimpleImputer', 'strategy': 'mean'}. Best is trial 17 with value: 2.571443158313177.
[I 2023-11-21 17:09:15,598] Trial 48 finished with value: 2.5814239256540668 and parameters: {'model_name': 'SimpleImputer', 'strategy': 'mean'}. Best is trial 17 with value: 2.571443158313177.
[I 2023-11-21 17:09:15,824] Trial 51 finished with value: 2.5814239256540668 and parameters: {'model_name': 'SimpleImputer', 'strategy': 'mean'}. Best is trial 17 with value: 2.571443158313177.
[I 2023-11-21 17:09:16,090] Trial 50 finished with value: 2.5814239256540668 and parameters: {'model_name': 'SimpleImputer', 'strategy': 'mean'}. Best is trial 17 with value: 2.571443158313177.
[I 2023-11-21 17:09:16,339] Trial 52 finished with value: 2.5814239256540668 and parameters: {'model_name': 'SimpleImputer', 'strategy': 'mean'}. Best is trial 17 with value: 2.571443158313177.
[I 2023-11-21 17:09:16,536] Trial 30 finished with value: 2.571443158313177 and parameters: {'model_name': 'SimpleImputer', 'strategy': 'median'}. Best is trial 17 with value: 2.571443158313177.
[I 2023-11-21 17:09:16,784] Trial 54 finished with value: 6.241202960058521 and parameters: {'model_name': 'SimpleImputer', 'strategy': 'constant'}. Best is trial 17 with value: 2.571443158313177.
[I 2023-11-21 17:09:17,131] Trial 24 finished with value: 2.571443158313177 and parameters: {'model_name': 'SimpleImputer', 'strategy': 'median'}. Best is trial 17 with value: 2.571443158313177.
[I 2023-11-21 17:09:17,498] Trial 55 finished with value: 6.241202960058521 and parameters: {'model_name': 'SimpleImputer', 'strategy': 'constant'}. Best is trial 17 with value: 2.571443158313177.
[I 2023-11-21 17:09:17,981] Trial 46 finished with value: 2.571443158313177 and parameters: {'model_name': 'SimpleImputer', 'strategy': 'median'}. Best is trial 17 with value: 2.571443158313177.
[I 2023-11-21 17:09:18,498] Trial 39 finished with value: 2.571443158313177 and parameters: {'model_name': 'SimpleImputer', 'strategy': 'median'}. Best is trial 17 with value: 2.571443158313177.
[I 2023-11-21 17:09:19,029] Trial 41 finished with value: 2.571443158313177 and parameters: {'model_name': 'SimpleImputer', 'strategy': 'median'}. Best is trial 17 with value: 2.571443158313177.
[I 2023-11-21 17:09:19,623] Trial 53 finished with value: 2.571443158313177 and parameters: {'model_name': 'SimpleImputer', 'strategy': 'median'}. Best is trial 17 with value: 2.571443158313177.
[I 2023-11-21 17:09:20,678] Trial 65 finished with value: 2.571443158313177 and parameters: {'model_name': 'SimpleImputer', 'strategy': 'median'}. Best is trial 17 with value: 2.571443158313177.
[I 2023-11-21 17:09:21,204] Trial 58 finished with value: 2.571443158313177 and parameters: {'model_name': 'SimpleImputer', 'strategy': 'median'}. Best is trial 17 with value: 2.571443158313177.
[I 2023-11-21 17:09:21,386] Trial 63 finished with value: 2.571443158313177 and parameters: {'model_name': 'SimpleImputer', 'strategy': 'median'}. Best is trial 17 with value: 2.571443158313177.
[I 2023-11-21 17:09:21,636] Trial 71 finished with value: 2.571443158313177 and parameters: {'model_name': 'SimpleImputer', 'strategy': 'median'}. Best is trial 17 with value: 2.571443158313177.
[I 2023-11-21 17:09:22,153] Trial 70 finished with value: 2.571443158313177 and parameters: {'model_name': 'SimpleImputer', 'strategy': 'median'}. Best is trial 17 with value: 2.571443158313177.
[I 2023-11-21 17:09:22,331] Trial 69 finished with value: 2.571443158313177 and parameters: {'model_name': 'SimpleImputer', 'strategy': 'median'}. Best is trial 17 with value: 2.571443158313177.
[I 2023-11-21 17:09:22,594] Trial 67 finished with value: 2.571443158313177 and parameters: {'model_name': 'SimpleImputer', 'strategy': 'median'}. Best is trial 17 with value: 2.571443158313177.
[I 2023-11-21 17:09:22,833] Trial 68 finished with value: 2.571443158313177 and parameters: {'model_name': 'SimpleImputer', 'strategy': 'median'}. Best is trial 17 with value: 2.571443158313177.
[I 2023-11-21 17:09:23,101] Trial 78 finished with value: 2.571443158313177 and parameters: {'model_name': 'SimpleImputer', 'strategy': 'median'}. Best is trial 17 with value: 2.571443158313177.
[I 2023-11-21 17:09:23,432] Trial 0 finished with value: 2.746013173634784 and parameters: {'model_name': 'SimpleImputer', 'strategy': 'most_frequent'}. Best is trial 17 with value: 2.571443158313177.
[I 2023-11-21 17:09:23,669] Trial 72 finished with value: 2.571443158313177 and parameters: {'model_name': 'SimpleImputer', 'strategy': 'median'}. Best is trial 17 with value: 2.571443158313177.
[I 2023-11-21 17:09:23,881] Trial 73 finished with value: 2.571443158313177 and parameters: {'model_name': 'SimpleImputer', 'strategy': 'median'}. Best is trial 17 with value: 2.571443158313177.
[I 2023-11-21 17:09:24,303] Trial 81 finished with value: 2.571443158313177 and parameters: {'model_name': 'SimpleImputer', 'strategy': 'median'}. Best is trial 17 with value: 2.571443158313177.
[I 2023-11-21 17:09:24,479] Trial 79 finished with value: 2.571443158313177 and parameters: {'model_name': 'SimpleImputer', 'strategy': 'median'}. Best is trial 17 with value: 2.571443158313177.
[I 2023-11-21 17:09:25,157] Trial 80 finished with value: 2.571443158313177 and parameters: {'model_name': 'SimpleImputer', 'strategy': 'median'}. Best is trial 17 with value: 2.571443158313177.
[I 2023-11-21 17:09:25,382] Trial 23 finished with value: 2.746013173634784 and parameters: {'model_name': 'SimpleImputer', 'strategy': 'most_frequent'}. Best is trial 17 with value: 2.571443158313177.
[I 2023-11-21 17:09:25,789] Trial 9 finished with value: 2.746013173634784 and parameters: {'model_name': 'SimpleImputer', 'strategy': 'most_frequent'}. Best is trial 17 with value: 2.571443158313177.
[I 2023-11-21 17:09:26,075] Trial 10 finished with value: 2.746013173634784 and parameters: {'model_name': 'SimpleImputer', 'strategy': 'most_frequent'}. Best is trial 17 with value: 2.571443158313177.
[I 2023-11-21 17:09:26,636] Trial 35 finished with value: 2.746013173634784 and parameters: {'model_name': 'SimpleImputer', 'strategy': 'most_frequent'}. Best is trial 17 with value: 2.571443158313177.
[I 2023-11-21 17:09:27,014] Trial 14 finished with value: 2.746013173634784 and parameters: {'model_name': 'SimpleImputer', 'strategy': 'most_frequent'}. Best is trial 17 with value: 2.571443158313177.
[I 2023-11-21 17:09:27,341] Trial 34 finished with value: 2.746013173634784 and parameters: {'model_name': 'SimpleImputer', 'strategy': 'most_frequent'}. Best is trial 17 with value: 2.571443158313177.
[I 2023-11-21 17:09:27,609] Trial 15 finished with value: 2.746013173634784 and parameters: {'model_name': 'SimpleImputer', 'strategy': 'most_frequent'}. Best is trial 17 with value: 2.571443158313177.
[I 2023-11-21 17:09:28,149] Trial 43 finished with value: 2.746013173634784 and parameters: {'model_name': 'SimpleImputer', 'strategy': 'most_frequent'}. Best is trial 17 with value: 2.571443158313177.
[I 2023-11-21 17:09:28,571] Trial 5 finished with value: 2.746013173634784 and parameters: {'model_name': 'SimpleImputer', 'strategy': 'most_frequent'}. Best is trial 17 with value: 2.571443158313177.
[I 2023-11-21 17:09:28,918] Trial 18 finished with value: 2.746013173634784 and parameters: {'model_name': 'SimpleImputer', 'strategy': 'most_frequent'}. Best is trial 17 with value: 2.571443158313177.
[I 2023-11-21 17:09:29,545] Trial 36 finished with value: 2.746013173634784 and parameters: {'model_name': 'SimpleImputer', 'strategy': 'most_frequent'}. Best is trial 17 with value: 2.571443158313177.
[I 2023-11-21 17:09:29,985] Trial 38 finished with value: 2.746013173634784 and parameters: {'model_name': 'SimpleImputer', 'strategy': 'most_frequent'}. Best is trial 17 with value: 2.571443158313177.
[I 2023-11-21 17:09:30,236] Trial 31 finished with value: 2.746013173634784 and parameters: {'model_name': 'SimpleImputer', 'strategy': 'most_frequent'}. Best is trial 17 with value: 2.571443158313177.
[I 2023-11-21 17:09:30,502] Trial 44 finished with value: 2.746013173634784 and parameters: {'model_name': 'SimpleImputer', 'strategy': 'most_frequent'}. Best is trial 17 with value: 2.571443158313177.
[I 2023-11-21 17:09:31,492] Trial 66 finished with value: 2.746013173634784 and parameters: {'model_name': 'SimpleImputer', 'strategy': 'most_frequent'}. Best is trial 17 with value: 2.571443158313177.
[I 2023-11-21 17:09:31,887] Trial 59 finished with value: 2.746013173634784 and parameters: {'model_name': 'SimpleImputer', 'strategy': 'most_frequent'}. Best is trial 17 with value: 2.571443158313177.
[I 2023-11-21 17:09:32,604] Trial 61 finished with value: 2.746013173634784 and parameters: {'model_name': 'SimpleImputer', 'strategy': 'most_frequent'}. Best is trial 17 with value: 2.571443158313177.
[I 2023-11-21 17:09:32,899] Trial 57 finished with value: 2.746013173634784 and parameters: {'model_name': 'SimpleImputer', 'strategy': 'most_frequent'}. Best is trial 17 with value: 2.571443158313177.
[I 2023-11-21 17:09:33,397] Trial 62 finished with value: 2.746013173634784 and parameters: {'model_name': 'SimpleImputer', 'strategy': 'most_frequent'}. Best is trial 17 with value: 2.571443158313177.
[I 2023-11-21 17:09:33,604] Trial 64 finished with value: 2.746013173634784 and parameters: {'model_name': 'SimpleImputer', 'strategy': 'most_frequent'}. Best is trial 17 with value: 2.571443158313177.
[I 2023-11-21 17:09:33,929] Trial 60 finished with value: 2.746013173634784 and parameters: {'model_name': 'SimpleImputer', 'strategy': 'most_frequent'}. Best is trial 17 with value: 2.571443158313177.
[I 2023-11-21 17:09:34,232] Trial 75 finished with value: 2.746013173634784 and parameters: {'model_name': 'SimpleImputer', 'strategy': 'most_frequent'}. Best is trial 17 with value: 2.571443158313177.
[I 2023-11-21 17:09:34,494] Trial 110 finished with value: 2.571443158313177 and parameters: {'model_name': 'SimpleImputer', 'strategy': 'median'}. Best is trial 17 with value: 2.571443158313177.
[I 2023-11-21 17:09:34,720] Trial 82 finished with value: 2.746013173634784 and parameters: {'model_name': 'SimpleImputer', 'strategy': 'most_frequent'}. Best is trial 17 with value: 2.571443158313177.
[I 2023-11-21 17:09:34,885] Trial 108 finished with value: 2.571443158313177 and parameters: {'model_name': 'SimpleImputer', 'strategy': 'median'}. Best is trial 17 with value: 2.571443158313177.
[I 2023-11-21 17:09:35,140] Trial 56 finished with value: 2.746013173634784 and parameters: {'model_name': 'SimpleImputer', 'strategy': 'most_frequent'}. Best is trial 17 with value: 2.571443158313177.
[I 2023-11-21 17:09:35,507] Trial 111 finished with value: 2.571443158313177 and parameters: {'model_name': 'SimpleImputer', 'strategy': 'median'}. Best is trial 17 with value: 2.571443158313177.
[I 2023-11-21 17:09:35,727] Trial 74 finished with value: 2.746013173634784 and parameters: {'model_name': 'SimpleImputer', 'strategy': 'most_frequent'}. Best is trial 17 with value: 2.571443158313177.
[I 2023-11-21 17:09:36,077] Trial 109 finished with value: 2.571443158313177 and parameters: {'model_name': 'SimpleImputer', 'strategy': 'median'}. Best is trial 17 with value: 2.571443158313177.
[I 2023-11-21 17:09:36,435] Trial 84 finished with value: 2.746013173634784 and parameters: {'model_name': 'SimpleImputer', 'strategy': 'most_frequent'}. Best is trial 17 with value: 2.571443158313177.
[I 2023-11-21 17:09:36,800] Trial 77 finished with value: 2.746013173634784 and parameters: {'model_name': 'SimpleImputer', 'strategy': 'most_frequent'}. Best is trial 17 with value: 2.571443158313177.
[I 2023-11-21 17:09:37,252] Trial 85 finished with value: 2.746013173634784 and parameters: {'model_name': 'SimpleImputer', 'strategy': 'most_frequent'}. Best is trial 17 with value: 2.571443158313177.
[I 2023-11-21 17:09:37,521] Trial 112 finished with value: 2.571443158313177 and parameters: {'model_name': 'SimpleImputer', 'strategy': 'median'}. Best is trial 17 with value: 2.571443158313177.
[I 2023-11-21 17:09:37,783] Trial 86 finished with value: 2.746013173634784 and parameters: {'model_name': 'SimpleImputer', 'strategy': 'most_frequent'}. Best is trial 17 with value: 2.571443158313177.
[I 2023-11-21 17:09:38,171] Trial 76 finished with value: 2.746013173634784 and parameters: {'model_name': 'SimpleImputer', 'strategy': 'most_frequent'}. Best is trial 17 with value: 2.571443158313177.
[I 2023-11-21 17:09:38,357] Trial 87 finished with value: 2.746013173634784 and parameters: {'model_name': 'SimpleImputer', 'strategy': 'most_frequent'}. Best is trial 17 with value: 2.571443158313177.
[I 2023-11-21 17:09:38,642] Trial 113 finished with value: 2.571443158313177 and parameters: {'model_name': 'SimpleImputer', 'strategy': 'median'}. Best is trial 17 with value: 2.571443158313177.
[I 2023-11-21 17:09:38,937] Trial 116 finished with value: 2.571443158313177 and parameters: {'model_name': 'SimpleImputer', 'strategy': 'median'}. Best is trial 17 with value: 2.571443158313177.
[I 2023-11-21 17:09:39,305] Trial 114 finished with value: 2.571443158313177 and parameters: {'model_name': 'SimpleImputer', 'strategy': 'median'}. Best is trial 17 with value: 2.571443158313177.
[I 2023-11-21 17:09:39,563] Trial 115 finished with value: 2.571443158313177 and parameters: {'model_name': 'SimpleImputer', 'strategy': 'median'}. Best is trial 17 with value: 2.571443158313177.
[I 2023-11-21 17:09:40,164] Trial 118 finished with value: 2.571443158313177 and parameters: {'model_name': 'SimpleImputer', 'strategy': 'median'}. Best is trial 17 with value: 2.571443158313177.
[I 2023-11-21 17:09:40,368] Trial 117 finished with value: 2.571443158313177 and parameters: {'model_name': 'SimpleImputer', 'strategy': 'median'}. Best is trial 17 with value: 2.571443158313177.
