[I 2023-11-24 15:16:25,460] Trial 116 finished with value: 2.311724990311883 and parameters: {'model_name': 'SimpleImputer', 'strategy': 'mean'}. Best is trial 7 with value: 2.311724990311883.
[I 2023-11-24 15:16:25,792] Trial 118 finished with value: 2.311724990311883 and parameters: {'model_name': 'SimpleImputer', 'strategy': 'mean'}. Best is trial 7 with value: 2.311724990311883.
[I 2023-11-24 15:16:26,381] Trial 88 finished with value: 2.50775392462567 and parameters: {'model_name': 'SimpleImputer', 'strategy': 'most_frequent'}. Best is trial 7 with value: 2.311724990311883.
[I 2023-11-24 15:16:26,740] Trial 117 finished with value: 2.311724990311883 and parameters: {'model_name': 'SimpleImputer', 'strategy': 'mean'}. Best is trial 7 with value: 2.311724990311883.
[I 2023-11-24 15:16:27,488] Trial 94 finished with value: 2.50775392462567 and parameters: {'model_name': 'SimpleImputer', 'strategy': 'most_frequent'}. Best is trial 7 with value: 2.311724990311883.
[I 2023-11-24 15:16:27,920] Trial 123 finished with value: 2.311724990311883 and parameters: {'model_name': 'SimpleImputer', 'strategy': 'mean'}. Best is trial 7 with value: 2.311724990311883.
[I 2023-11-24 15:16:28,293] Trial 122 finished with value: 2.311724990311883 and parameters: {'model_name': 'SimpleImputer', 'strategy': 'mean'}. Best is trial 7 with value: 2.311724990311883.
[I 2023-11-24 15:16:28,695] Trial 89 finished with value: 2.50775392462567 and parameters: {'model_name': 'SimpleImputer', 'strategy': 'most_frequent'}. Best is trial 7 with value: 2.311724990311883.
[I 2023-11-24 15:16:28,992] Trial 86 finished with value: 2.50775392462567 and parameters: {'model_name': 'SimpleImputer', 'strategy': 'most_frequent'}. Best is trial 7 with value: 2.311724990311883.
[I 2023-11-24 15:16:29,292] Trial 120 finished with value: 2.311724990311883 and parameters: {'model_name': 'SimpleImputer', 'strategy': 'mean'}. Best is trial 7 with value: 2.311724990311883.
[I 2023-11-24 15:16:29,529] Trial 92 finished with value: 2.50775392462567 and parameters: {'model_name': 'SimpleImputer', 'strategy': 'most_frequent'}. Best is trial 7 with value: 2.311724990311883.
[I 2023-11-24 15:16:29,764] Trial 87 finished with value: 2.50775392462567 and parameters: {'model_name': 'SimpleImputer', 'strategy': 'most_frequent'}. Best is trial 7 with value: 2.311724990311883.
[I 2023-11-24 15:16:30,098] Trial 91 finished with value: 2.50775392462567 and parameters: {'model_name': 'SimpleImputer', 'strategy': 'most_frequent'}. Best is trial 7 with value: 2.311724990311883.
[I 2023-11-24 15:16:30,387] Trial 96 finished with value: 2.50775392462567 and parameters: {'model_name': 'SimpleImputer', 'strategy': 'most_frequent'}. Best is trial 7 with value: 2.311724990311883.
[I 2023-11-24 15:16:30,669] Trial 119 finished with value: 2.311724990311883 and parameters: {'model_name': 'SimpleImputer', 'strategy': 'mean'}. Best is trial 7 with value: 2.311724990311883.
[I 2023-11-24 15:16:30,879] Trial 93 finished with value: 2.50775392462567 and parameters: {'model_name': 'SimpleImputer', 'strategy': 'most_frequent'}. Best is trial 7 with value: 2.311724990311883.
[I 2023-11-24 15:16:31,289] Trial 121 finished with value: 2.311724990311883 and parameters: {'model_name': 'SimpleImputer', 'strategy': 'mean'}. Best is trial 7 with value: 2.311724990311883.
[I 2023-11-24 15:16:31,690] Trial 100 finished with value: 2.50775392462567 and parameters: {'model_name': 'SimpleImputer', 'strategy': 'most_frequent'}. Best is trial 7 with value: 2.311724990311883.
[I 2023-11-24 15:16:31,935] Trial 97 finished with value: 2.50775392462567 and parameters: {'model_name': 'SimpleImputer', 'strategy': 'most_frequent'}. Best is trial 7 with value: 2.311724990311883.
[I 2023-11-24 15:16:32,273] Trial 101 finished with value: 2.50775392462567 and parameters: {'model_name': 'SimpleImputer', 'strategy': 'most_frequent'}. Best is trial 7 with value: 2.311724990311883.
[I 2023-11-24 15:16:32,519] Trial 130 finished with value: 2.311724990311883 and parameters: {'model_name': 'SimpleImputer', 'strategy': 'mean'}. Best is trial 7 with value: 2.311724990311883.
[I 2023-11-24 15:16:32,749] Trial 124 finished with value: 2.311724990311883 and parameters: {'model_name': 'SimpleImputer', 'strategy': 'mean'}. Best is trial 7 with value: 2.311724990311883.
[I 2023-11-24 15:16:33,335] Trial 98 finished with value: 2.50775392462567 and parameters: {'model_name': 'SimpleImputer', 'strategy': 'most_frequent'}. Best is trial 7 with value: 2.311724990311883.
[I 2023-11-24 15:16:33,702] Trial 126 finished with value: 2.311724990311883 and parameters: {'model_name': 'SimpleImputer', 'strategy': 'mean'}. Best is trial 7 with value: 2.311724990311883.
[I 2023-11-24 15:16:33,926] Trial 99 finished with value: 2.50775392462567 and parameters: {'model_name': 'SimpleImputer', 'strategy': 'most_frequent'}. Best is trial 7 with value: 2.311724990311883.
[I 2023-11-24 15:16:34,259] Trial 127 finished with value: 2.311724990311883 and parameters: {'model_name': 'SimpleImputer', 'strategy': 'mean'}. Best is trial 7 with value: 2.311724990311883.
[I 2023-11-24 15:16:34,459] Trial 81 finished with value: 2.50775392462567 and parameters: {'model_name': 'SimpleImputer', 'strategy': 'most_frequent'}. Best is trial 7 with value: 2.311724990311883.
[I 2023-11-24 15:16:34,663] Trial 134 finished with value: 2.311724990311883 and parameters: {'model_name': 'SimpleImputer', 'strategy': 'mean'}. Best is trial 7 with value: 2.311724990311883.
[I 2023-11-24 15:16:34,904] Trial 128 finished with value: 2.311724990311883 and parameters: {'model_name': 'SimpleImputer', 'strategy': 'mean'}. Best is trial 7 with value: 2.311724990311883.
[I 2023-11-24 15:16:35,121] Trial 135 finished with value: 2.311724990311883 and parameters: {'model_name': 'SimpleImputer', 'strategy': 'mean'}. Best is trial 7 with value: 2.311724990311883.
[I 2023-11-24 15:16:35,396] Trial 131 finished with value: 2.311724990311883 and parameters: {'model_name': 'SimpleImputer', 'strategy': 'mean'}. Best is trial 7 with value: 2.311724990311883.
[I 2023-11-24 15:16:35,737] Trial 125 finished with value: 2.311724990311883 and parameters: {'model_name': 'SimpleImputer', 'strategy': 'mean'}. Best is trial 7 with value: 2.311724990311883.
[I 2023-11-24 15:16:35,990] Trial 138 finished with value: 2.311724990311883 and parameters: {'model_name': 'SimpleImputer', 'strategy': 'mean'}. Best is trial 7 with value: 2.311724990311883.
[I 2023-11-24 15:16:36,278] Trial 102 finished with value: 2.50775392462567 and parameters: {'model_name': 'SimpleImputer', 'strategy': 'most_frequent'}. Best is trial 7 with value: 2.311724990311883.
[I 2023-11-24 15:16:36,605] Trial 136 finished with value: 2.311724990311883 and parameters: {'model_name': 'SimpleImputer', 'strategy': 'mean'}. Best is trial 7 with value: 2.311724990311883.
[I 2023-11-24 15:16:37,053] Trial 137 finished with value: 2.311724990311883 and parameters: {'model_name': 'SimpleImputer', 'strategy': 'mean'}. Best is trial 7 with value: 2.311724990311883.
[I 2023-11-24 15:16:37,292] Trial 129 finished with value: 2.311724990311883 and parameters: {'model_name': 'SimpleImputer', 'strategy': 'mean'}. Best is trial 7 with value: 2.311724990311883.
[I 2023-11-24 15:16:37,684] Trial 132 finished with value: 2.311724990311883 and parameters: {'model_name': 'SimpleImputer', 'strategy': 'mean'}. Best is trial 7 with value: 2.311724990311883.
[I 2023-11-24 15:16:38,117] Trial 104 finished with value: 2.50775392462567 and parameters: {'model_name': 'SimpleImputer', 'strategy': 'most_frequent'}. Best is trial 7 with value: 2.311724990311883.
[I 2023-11-24 15:16:38,352] Trial 140 finished with value: 2.311724990311883 and parameters: {'model_name': 'SimpleImputer', 'strategy': 'mean'}. Best is trial 7 with value: 2.311724990311883.
[I 2023-11-24 15:16:38,581] Trial 142 finished with value: 2.311724990311883 and parameters: {'model_name': 'SimpleImputer', 'strategy': 'mean'}. Best is trial 7 with value: 2.311724990311883.
[I 2023-11-24 15:16:38,851] Trial 141 finished with value: 2.311724990311883 and parameters: {'model_name': 'SimpleImputer', 'strategy': 'mean'}. Best is trial 7 with value: 2.311724990311883.
[I 2023-11-24 15:16:39,108] Trial 146 finished with value: 2.311724990311883 and parameters: {'model_name': 'SimpleImputer', 'strategy': 'mean'}. Best is trial 7 with value: 2.311724990311883.
[I 2023-11-24 15:16:39,328] Trial 143 finished with value: 2.311724990311883 and parameters: {'model_name': 'SimpleImputer', 'strategy': 'mean'}. Best is trial 7 with value: 2.311724990311883.
[I 2023-11-24 15:16:39,665] Trial 144 finished with value: 2.311724990311883 and parameters: {'model_name': 'SimpleImputer', 'strategy': 'mean'}. Best is trial 7 with value: 2.311724990311883.
[I 2023-11-24 15:16:39,989] Trial 139 finished with value: 2.311724990311883 and parameters: {'model_name': 'SimpleImputer', 'strategy': 'mean'}. Best is trial 7 with value: 2.311724990311883.
[I 2023-11-24 15:16:40,196] Trial 148 finished with value: 2.311724990311883 and parameters: {'model_name': 'SimpleImputer', 'strategy': 'mean'}. Best is trial 7 with value: 2.311724990311883.
[I 2023-11-24 15:16:40,426] Trial 149 finished with value: 2.311724990311883 and parameters: {'model_name': 'SimpleImputer', 'strategy': 'mean'}. Best is trial 7 with value: 2.311724990311883.
[I 2023-11-24 15:16:40,834] Trial 147 finished with value: 2.311724990311883 and parameters: {'model_name': 'SimpleImputer', 'strategy': 'mean'}. Best is trial 7 with value: 2.311724990311883.
[I 2023-11-24 15:16:41,178] Trial 133 finished with value: 2.311724990311883 and parameters: {'model_name': 'SimpleImputer', 'strategy': 'mean'}. Best is trial 7 with value: 2.311724990311883.
[I 2023-11-24 15:16:41,818] Trial 150 finished with value: 2.311724990311883 and parameters: {'model_name': 'SimpleImputer', 'strategy': 'mean'}. Best is trial 7 with value: 2.311724990311883.
[I 2023-11-24 15:16:42,306] Trial 145 finished with value: 2.311724990311883 and parameters: {'model_name': 'SimpleImputer', 'strategy': 'mean'}. Best is trial 7 with value: 2.311724990311883.
[I 2023-11-24 15:16:42,948] Trial 151 finished with value: 2.311724990311883 and parameters: {'model_name': 'SimpleImputer', 'strategy': 'mean'}. Best is trial 7 with value: 2.311724990311883.
[I 2023-11-24 15:16:43,205] Trial 158 finished with value: 2.311724990311883 and parameters: {'model_name': 'SimpleImputer', 'strategy': 'mean'}. Best is trial 7 with value: 2.311724990311883.
[I 2023-11-24 15:16:43,447] Trial 152 finished with value: 2.311724990311883 and parameters: {'model_name': 'SimpleImputer', 'strategy': 'mean'}. Best is trial 7 with value: 2.311724990311883.
[I 2023-11-24 15:16:43,815] Trial 154 finished with value: 2.311724990311883 and parameters: {'model_name': 'SimpleImputer', 'strategy': 'mean'}. Best is trial 7 with value: 2.311724990311883.
[I 2023-11-24 15:16:44,076] Trial 153 finished with value: 2.311724990311883 and parameters: {'model_name': 'SimpleImputer', 'strategy': 'mean'}. Best is trial 7 with value: 2.311724990311883.
[I 2023-11-24 15:16:44,586] Trial 157 finished with value: 2.311724990311883 and parameters: {'model_name': 'SimpleImputer', 'strategy': 'mean'}. Best is trial 7 with value: 2.311724990311883.
[I 2023-11-24 15:16:44,951] Trial 162 finished with value: 2.311724990311883 and parameters: {'model_name': 'SimpleImputer', 'strategy': 'mean'}. Best is trial 7 with value: 2.311724990311883.
[I 2023-11-24 15:16:45,227] Trial 155 finished with value: 2.311724990311883 and parameters: {'model_name': 'SimpleImputer', 'strategy': 'mean'}. Best is trial 7 with value: 2.311724990311883.
[I 2023-11-24 15:16:45,552] Trial 161 finished with value: 2.311724990311883 and parameters: {'model_name': 'SimpleImputer', 'strategy': 'mean'}. Best is trial 7 with value: 2.311724990311883.
[I 2023-11-24 15:16:45,933] Trial 156 finished with value: 2.311724990311883 and parameters: {'model_name': 'SimpleImputer', 'strategy': 'mean'}. Best is trial 7 with value: 2.311724990311883.
[I 2023-11-24 15:16:46,165] Trial 165 finished with value: 2.311724990311883 and parameters: {'model_name': 'SimpleImputer', 'strategy': 'mean'}. Best is trial 7 with value: 2.311724990311883.
[I 2023-11-24 15:16:46,428] Trial 166 finished with value: 2.311724990311883 and parameters: {'model_name': 'SimpleImputer', 'strategy': 'mean'}. Best is trial 7 with value: 2.311724990311883.
[I 2023-11-24 15:16:46,626] Trial 159 finished with value: 2.311724990311883 and parameters: {'model_name': 'SimpleImputer', 'strategy': 'mean'}. Best is trial 7 with value: 2.311724990311883.
[I 2023-11-24 15:16:47,103] Trial 164 finished with value: 2.311724990311883 and parameters: {'model_name': 'SimpleImputer', 'strategy': 'mean'}. Best is trial 7 with value: 2.311724990311883.
[I 2023-11-24 15:16:47,322] Trial 167 finished with value: 2.311724990311883 and parameters: {'model_name': 'SimpleImputer', 'strategy': 'mean'}. Best is trial 7 with value: 2.311724990311883.
[I 2023-11-24 15:16:47,532] Trial 163 finished with value: 2.311724990311883 and parameters: {'model_name': 'SimpleImputer', 'strategy': 'mean'}. Best is trial 7 with value: 2.311724990311883.
[I 2023-11-24 15:16:47,555] Trial 160 finished with value: 2.311724990311883 and parameters: {'model_name': 'SimpleImputer', 'strategy': 'mean'}. Best is trial 7 with value: 2.311724990311883.
[I 2023-11-24 15:16:48,005] Trial 168 finished with value: 2.311724990311883 and parameters: {'model_name': 'SimpleImputer', 'strategy': 'mean'}. Best is trial 7 with value: 2.311724990311883.
[I 2023-11-24 15:16:48,414] Trial 172 finished with value: 2.311724990311883 and parameters: {'model_name': 'SimpleImputer', 'strategy': 'mean'}. Best is trial 7 with value: 2.311724990311883.
[I 2023-11-24 15:16:48,817] Trial 170 finished with value: 2.311724990311883 and parameters: {'model_name': 'SimpleImputer', 'strategy': 'mean'}. Best is trial 7 with value: 2.311724990311883.
[I 2023-11-24 15:16:49,012] Trial 173 finished with value: 2.311724990311883 and parameters: {'model_name': 'SimpleImputer', 'strategy': 'mean'}. Best is trial 7 with value: 2.311724990311883.
[I 2023-11-24 15:16:49,486] Trial 169 finished with value: 2.311724990311883 and parameters: {'model_name': 'SimpleImputer', 'strategy': 'mean'}. Best is trial 7 with value: 2.311724990311883.
[I 2023-11-24 15:16:49,859] Trial 171 finished with value: 2.311724990311883 and parameters: {'model_name': 'SimpleImputer', 'strategy': 'mean'}. Best is trial 7 with value: 2.311724990311883.
[I 2023-11-24 15:16:50,192] Trial 181 finished with value: 2.311724990311883 and parameters: {'model_name': 'SimpleImputer', 'strategy': 'mean'}. Best is trial 7 with value: 2.311724990311883.
[I 2023-11-24 15:16:50,377] Trial 179 finished with value: 2.311724990311883 and parameters: {'model_name': 'SimpleImputer', 'strategy': 'mean'}. Best is trial 7 with value: 2.311724990311883.
[I 2023-11-24 15:16:50,653] Trial 174 finished with value: 2.311724990311883 and parameters: {'model_name': 'SimpleImputer', 'strategy': 'mean'}. Best is trial 7 with value: 2.311724990311883.
[I 2023-11-24 15:16:50,905] Trial 178 finished with value: 2.311724990311883 and parameters: {'model_name': 'SimpleImputer', 'strategy': 'mean'}. Best is trial 7 with value: 2.311724990311883.
[I 2023-11-24 15:16:51,103] Trial 176 finished with value: 2.311724990311883 and parameters: {'model_name': 'SimpleImputer', 'strategy': 'mean'}. Best is trial 7 with value: 2.311724990311883.
[I 2023-11-24 15:16:51,344] Trial 177 finished with value: 2.311724990311883 and parameters: {'model_name': 'SimpleImputer', 'strategy': 'mean'}. Best is trial 7 with value: 2.311724990311883.
[I 2023-11-24 15:16:51,550] Trial 192 finished with value: 2.311724990311883 and parameters: {'model_name': 'SimpleImputer', 'strategy': 'mean'}. Best is trial 7 with value: 2.311724990311883.
[I 2023-11-24 15:16:51,842] Trial 175 finished with value: 2.311724990311883 and parameters: {'model_name': 'SimpleImputer', 'strategy': 'mean'}. Best is trial 7 with value: 2.311724990311883.
[I 2023-11-24 15:16:52,210] Trial 183 finished with value: 2.311724990311883 and parameters: {'model_name': 'SimpleImputer', 'strategy': 'mean'}. Best is trial 7 with value: 2.311724990311883.
[I 2023-11-24 15:16:52,426] Trial 180 finished with value: 2.311724990311883 and parameters: {'model_name': 'SimpleImputer', 'strategy': 'mean'}. Best is trial 7 with value: 2.311724990311883.
[I 2023-11-24 15:16:52,711] Trial 182 finished with value: 2.311724990311883 and parameters: {'model_name': 'SimpleImputer', 'strategy': 'mean'}. Best is trial 7 with value: 2.311724990311883.
[I 2023-11-24 15:16:52,937] Trial 184 finished with value: 2.311724990311883 and parameters: {'model_name': 'SimpleImputer', 'strategy': 'mean'}. Best is trial 7 with value: 2.311724990311883.
[I 2023-11-24 15:16:53,153] Trial 190 finished with value: 2.311724990311883 and parameters: {'model_name': 'SimpleImputer', 'strategy': 'mean'}. Best is trial 7 with value: 2.311724990311883.
[I 2023-11-24 15:16:53,525] Trial 196 finished with value: 2.311724990311883 and parameters: {'model_name': 'SimpleImputer', 'strategy': 'mean'}. Best is trial 7 with value: 2.311724990311883.
[I 2023-11-24 15:16:53,844] Trial 194 finished with value: 2.311724990311883 and parameters: {'model_name': 'SimpleImputer', 'strategy': 'mean'}. Best is trial 7 with value: 2.311724990311883.
[I 2023-11-24 15:16:54,112] Trial 188 finished with value: 2.360319027114439 and parameters: {'model_name': 'SimpleImputer', 'strategy': 'median'}. Best is trial 7 with value: 2.311724990311883.
[I 2023-11-24 15:16:54,345] Trial 186 finished with value: 2.360319027114439 and parameters: {'model_name': 'SimpleImputer', 'strategy': 'median'}. Best is trial 7 with value: 2.311724990311883.
[I 2023-11-24 15:16:54,583] Trial 189 finished with value: 2.360319027114439 and parameters: {'model_name': 'SimpleImputer', 'strategy': 'median'}. Best is trial 7 with value: 2.311724990311883.
[I 2023-11-24 15:16:54,854] Trial 185 finished with value: 2.360319027114439 and parameters: {'model_name': 'SimpleImputer', 'strategy': 'median'}. Best is trial 7 with value: 2.311724990311883.
[I 2023-11-24 15:16:55,190] Trial 198 finished with value: 2.360319027114439 and parameters: {'model_name': 'SimpleImputer', 'strategy': 'median'}. Best is trial 7 with value: 2.311724990311883.
[I 2023-11-24 15:16:55,368] Trial 187 finished with value: 2.360319027114439 and parameters: {'model_name': 'SimpleImputer', 'strategy': 'median'}. Best is trial 7 with value: 2.311724990311883.
[I 2023-11-24 15:16:55,547] Trial 195 finished with value: 2.360319027114439 and parameters: {'model_name': 'SimpleImputer', 'strategy': 'median'}. Best is trial 7 with value: 2.311724990311883.
[I 2023-11-24 15:16:55,780] Trial 197 finished with value: 2.360319027114439 and parameters: {'model_name': 'SimpleImputer', 'strategy': 'median'}. Best is trial 7 with value: 2.311724990311883.
[I 2023-11-24 15:16:56,002] Trial 191 finished with value: 2.360319027114439 and parameters: {'model_name': 'SimpleImputer', 'strategy': 'median'}. Best is trial 7 with value: 2.311724990311883.
[I 2023-11-24 15:16:56,196] Trial 199 finished with value: 2.360319027114439 and parameters: {'model_name': 'SimpleImputer', 'strategy': 'median'}. Best is trial 7 with value: 2.311724990311883.
[I 2023-11-24 15:16:56,432] Trial 193 finished with value: 2.360319027114439 and parameters: {'model_name': 'SimpleImputer', 'strategy': 'median'}. Best is trial 7 with value: 2.311724990311883.
simple fit
simple transform
[I 2023-11-24 15:16:56,685] A new study created in memory with name: no-name-81feeb6e-a3a7-42c0-a762-2941305dd61e
