[I 2023-12-07 17:09:01,587] Trial 189 finished with value: 909.5233937206566 and parameters: {'model_name': 'IterativeImputer', 'estimator': 'Bayesian', 'sample_posterior': False, 'initial_strategy': 'median', 'imputation_order': 'random'}. Best is trial 123 with value: 909.060953829046.
[I 2023-12-07 17:09:02,117] Trial 187 finished with value: 909.5242184174665 and parameters: {'model_name': 'IterativeImputer', 'estimator': 'Bayesian', 'sample_posterior': False, 'initial_strategy': 'median', 'imputation_order': 'random'}. Best is trial 123 with value: 909.060953829046.
[I 2023-12-07 17:09:02,466] Trial 188 finished with value: 909.6615745283477 and parameters: {'model_name': 'IterativeImputer', 'estimator': 'Bayesian', 'sample_posterior': False, 'initial_strategy': 'median', 'imputation_order': 'random'}. Best is trial 123 with value: 909.060953829046.
[I 2023-12-07 17:09:03,738] Trial 190 finished with value: 909.6791326424964 and parameters: {'model_name': 'IterativeImputer', 'estimator': 'Bayesian', 'sample_posterior': False, 'initial_strategy': 'median', 'imputation_order': 'random'}. Best is trial 123 with value: 909.060953829046.
[I 2023-12-07 17:09:04,615] Trial 193 finished with value: 909.8296344842827 and parameters: {'model_name': 'IterativeImputer', 'estimator': 'Bayesian', 'sample_posterior': False, 'initial_strategy': 'median', 'imputation_order': 'random'}. Best is trial 123 with value: 909.060953829046.
[I 2023-12-07 17:09:06,154] Trial 192 finished with value: 909.7043665668839 and parameters: {'model_name': 'IterativeImputer', 'estimator': 'Bayesian', 'sample_posterior': False, 'initial_strategy': 'median', 'imputation_order': 'random'}. Best is trial 123 with value: 909.060953829046.
[I 2023-12-07 17:09:09,813] Trial 194 finished with value: 912.0287513876426 and parameters: {'model_name': 'IterativeImputer', 'estimator': 'Bayesian', 'sample_posterior': False, 'initial_strategy': 'median', 'imputation_order': 'random'}. Best is trial 123 with value: 909.060953829046.
[I 2023-12-07 17:09:10,428] Trial 198 finished with value: 909.540119979704 and parameters: {'model_name': 'IterativeImputer', 'estimator': 'Bayesian', 'sample_posterior': False, 'initial_strategy': 'median', 'imputation_order': 'random'}. Best is trial 123 with value: 909.060953829046.
[I 2023-12-07 17:09:11,246] Trial 197 finished with value: 910.4739247812125 and parameters: {'model_name': 'IterativeImputer', 'estimator': 'Bayesian', 'sample_posterior': False, 'initial_strategy': 'median', 'imputation_order': 'random'}. Best is trial 123 with value: 909.060953829046.
[I 2023-12-07 17:09:12,760] Trial 199 finished with value: 909.2343518635737 and parameters: {'model_name': 'IterativeImputer', 'estimator': 'Bayesian', 'sample_posterior': False, 'initial_strategy': 'median', 'imputation_order': 'random'}. Best is trial 123 with value: 909.060953829046.
[I 2023-12-07 17:09:16,100] Trial 4 finished with value: 2141.798167982427 and parameters: {'model_name': 'GAIN', 'batch_size': 491, 'hint_rate': 0.19, 'alpha': 89, 'iterations': 362}. Best is trial 123 with value: 909.060953829046.
[I 2023-12-07 17:09:25,467] Trial 2 finished with value: 2085.240304965771 and parameters: {'model_name': 'GAIN', 'batch_size': 272, 'hint_rate': 0.35000000000000003, 'alpha': 90, 'iterations': 550}. Best is trial 123 with value: 909.060953829046.
[I 2023-12-07 17:09:29,007] Trial 10 finished with value: 2030.4619815840474 and parameters: {'model_name': 'GAIN', 'batch_size': 1, 'hint_rate': 0.02, 'alpha': 59, 'iterations': 685}. Best is trial 123 with value: 909.060953829046.
[I 2023-12-07 17:09:30,880] Trial 67 finished with value: 2016.0647465450631 and parameters: {'model_name': 'RandomForestImputer', 'max_iter': 82, 'decreasing': True, 'min_samples_split': 0.8, 'min_samples_leaf': 0.30000000000000004, 'max_features': 0.6, 'warm_start': False}. Best is trial 123 with value: 909.060953829046.
[I 2023-12-07 17:09:31,483] Trial 52 finished with value: inf and parameters: {'model_name': 'IterativeImputer', 'estimator': 'RFR', 'sample_posterior': True, 'initial_strategy': 'mean', 'imputation_order': 'ascending'}. Best is trial 123 with value: 909.060953829046.
[I 2023-12-07 17:09:31,829] Trial 75 finished with value: 2147.5870018249334 and parameters: {'model_name': 'GAIN', 'batch_size': 3, 'hint_rate': 0.7100000000000001, 'alpha': 88, 'iterations': 707}. Best is trial 123 with value: 909.060953829046.
[I 2023-12-07 17:09:35,682] Trial 63 finished with value: 1975.8935639424078 and parameters: {'model_name': 'GAIN', 'batch_size': 22, 'hint_rate': 0.05, 'alpha': 43, 'iterations': 774}. Best is trial 123 with value: 909.060953829046.
[I 2023-12-07 17:09:42,869] Trial 147 finished with value: inf and parameters: {'model_name': 'IterativeImputer', 'estimator': 'RFR', 'sample_posterior': True, 'initial_strategy': 'mean', 'imputation_order': 'ascending'}. Best is trial 123 with value: 909.060953829046.
[I 2023-12-07 17:09:43,239] Trial 148 finished with value: inf and parameters: {'model_name': 'IterativeImputer', 'estimator': 'RFR', 'sample_posterior': True, 'initial_strategy': 'mean', 'imputation_order': 'ascending'}. Best is trial 123 with value: 909.060953829046.
[I 2023-12-07 17:09:43,553] Trial 151 finished with value: inf and parameters: {'model_name': 'IterativeImputer', 'estimator': 'RFR', 'sample_posterior': True, 'initial_strategy': 'mean', 'imputation_order': 'ascending'}. Best is trial 123 with value: 909.060953829046.
[I 2023-12-07 17:09:44,469] Trial 152 finished with value: inf and parameters: {'model_name': 'IterativeImputer', 'estimator': 'RFR', 'sample_posterior': True, 'initial_strategy': 'mean', 'imputation_order': 'ascending'}. Best is trial 123 with value: 909.060953829046.
[I 2023-12-07 17:09:44,766] Trial 150 finished with value: inf and parameters: {'model_name': 'IterativeImputer', 'estimator': 'RFR', 'sample_posterior': True, 'initial_strategy': 'median', 'imputation_order': 'ascending'}. Best is trial 123 with value: 909.060953829046.
[I 2023-12-07 17:09:45,856] Trial 156 finished with value: inf and parameters: {'model_name': 'IterativeImputer', 'estimator': 'RFR', 'sample_posterior': True, 'initial_strategy': 'most_frequent', 'imputation_order': 'ascending'}. Best is trial 123 with value: 909.060953829046.
[I 2023-12-07 17:09:46,344] Trial 153 finished with value: inf and parameters: {'model_name': 'IterativeImputer', 'estimator': 'RFR', 'sample_posterior': True, 'initial_strategy': 'mean', 'imputation_order': 'ascending'}. Best is trial 123 with value: 909.060953829046.
[I 2023-12-07 17:09:46,700] Trial 149 finished with value: inf and parameters: {'model_name': 'IterativeImputer', 'estimator': 'RFR', 'sample_posterior': True, 'initial_strategy': 'mean', 'imputation_order': 'ascending'}. Best is trial 123 with value: 909.060953829046.
[I 2023-12-07 17:09:47,657] Trial 155 finished with value: inf and parameters: {'model_name': 'IterativeImputer', 'estimator': 'RFR', 'sample_posterior': True, 'initial_strategy': 'median', 'imputation_order': 'ascending'}. Best is trial 123 with value: 909.060953829046.
[I 2023-12-07 17:09:48,253] Trial 158 finished with value: inf and parameters: {'model_name': 'IterativeImputer', 'estimator': 'RFR', 'sample_posterior': True, 'initial_strategy': 'most_frequent', 'imputation_order': 'ascending'}. Best is trial 123 with value: 909.060953829046.
[I 2023-12-07 17:09:48,662] Trial 157 finished with value: inf and parameters: {'model_name': 'IterativeImputer', 'estimator': 'RFR', 'sample_posterior': True, 'initial_strategy': 'most_frequent', 'imputation_order': 'ascending'}. Best is trial 123 with value: 909.060953829046.
[I 2023-12-07 17:10:15,367] Trial 82 finished with value: inf and parameters: {'model_name': 'GAIN', 'batch_size': 8, 'hint_rate': 0.7000000000000001, 'alpha': 70, 'iterations': 2903}. Best is trial 123 with value: 909.060953829046.
[I 2023-12-07 17:10:36,356] Trial 69 finished with value: 1527.6001636423027 and parameters: {'model_name': 'GAIN', 'batch_size': 3, 'hint_rate': 0.01, 'alpha': 25, 'iterations': 4441}. Best is trial 123 with value: 909.060953829046.
[I 2023-12-07 17:11:22,802] Trial 53 finished with value: inf and parameters: {'model_name': 'GAIN', 'batch_size': 159, 'hint_rate': 0.77, 'alpha': 37, 'iterations': 7138}. Best is trial 123 with value: 909.060953829046.
[I 2023-12-07 17:13:21,322] Trial 81 finished with value: inf and parameters: {'model_name': 'GAIN', 'batch_size': 1, 'hint_rate': 0.33, 'alpha': 34, 'iterations': 22106}. Best is trial 123 with value: 909.060953829046.
[I 2023-12-07 17:14:09,260] Trial 24 finished with value: inf and parameters: {'model_name': 'GAIN', 'batch_size': 1, 'hint_rate': 0.62, 'alpha': 96, 'iterations': 29624}. Best is trial 123 with value: 909.060953829046.
[I 2023-12-07 17:15:22,461] Trial 8 finished with value: inf and parameters: {'model_name': 'GAIN', 'batch_size': 8, 'hint_rate': 0.81, 'alpha': 51, 'iterations': 46115}. Best is trial 123 with value: 909.060953829046.
[I 2023-12-07 17:16:01,134] Trial 77 finished with value: inf and parameters: {'model_name': 'GAIN', 'batch_size': 553, 'hint_rate': 0.13, 'alpha': 72, 'iterations': 38237}. Best is trial 123 with value: 909.060953829046.
[I 2023-12-07 17:16:11,287] Trial 64 finished with value: inf and parameters: {'model_name': 'GAIN', 'batch_size': 25, 'hint_rate': 0.51, 'alpha': 57, 'iterations': 64998}. Best is trial 123 with value: 909.060953829046.
[I 2023-12-07 17:16:56,851] Trial 38 finished with value: 1201.2430772159817 and parameters: {'model_name': 'IterativeImputer', 'estimator': 'RFR', 'sample_posterior': False, 'initial_strategy': 'median', 'imputation_order': 'descending'}. Best is trial 123 with value: 909.060953829046.
[I 2023-12-07 17:16:58,195] Trial 83 finished with value: 1195.476538757047 and parameters: {'model_name': 'IterativeImputer', 'estimator': 'RFR', 'sample_posterior': False, 'initial_strategy': 'constant', 'imputation_order': 'descending'}. Best is trial 123 with value: 909.060953829046.
[I 2023-12-07 17:16:59,466] Trial 84 finished with value: 1177.2875004578798 and parameters: {'model_name': 'IterativeImputer', 'estimator': 'RFR', 'sample_posterior': False, 'initial_strategy': 'constant', 'imputation_order': 'descending'}. Best is trial 123 with value: 909.060953829046.
