Run: 4
/cm/local/apps/slurm/var/spool/job826363/slurm_script: line 23: /common/ketrong/minconda3/etc/profile.d/conda.sh: No such file or directory
/cm/local/apps/slurm/var/spool/job826363/slurm_script: line 26: $'\nconda create --name tpot2devenv -c conda-forge python=3.10\n': command not found
/cm/local/apps/slurm/var/spool/job826363/slurm_script: line 31: $'\npip install -r requirements.txt\n': command not found
RunStart
2024-04-15 16:16:43.939836: I tensorflow/core/util/port.cc:113] oneDNN custom operations are on. You may see slightly different numerical results due to floating-point round-off errors from different computation orders. To turn them off, set the environment variable `TF_ENABLE_ONEDNN_OPTS=0`.
2024-04-15 16:16:43.973121: E external/local_xla/xla/stream_executor/cuda/cuda_dnn.cc:9261] Unable to register cuDNN factory: Attempting to register factory for plugin cuDNN when one has already been registered
2024-04-15 16:16:43.973142: E external/local_xla/xla/stream_executor/cuda/cuda_fft.cc:607] Unable to register cuFFT factory: Attempting to register factory for plugin cuFFT when one has already been registered
2024-04-15 16:16:43.974109: E external/local_xla/xla/stream_executor/cuda/cuda_blas.cc:1515] Unable to register cuBLAS factory: Attempting to register factory for plugin cuBLAS when one has already been registered
2024-04-15 16:16:43.979169: I tensorflow/core/platform/cpu_feature_guard.cc:182] This TensorFlow binary is optimized to use available CPU instructions in performance-critical operations.
To enable the following instructions: AVX2 AVX512F AVX512_VNNI FMA, in other operations, rebuild TensorFlow with the appropriate compiler flags.
2024-04-15 16:16:45.542432: W tensorflow/compiler/tf2tensorrt/utils/py_utils.cc:38] TF-TRT Warning: Could not find TensorRT
WARNING:tensorflow:From /home/ketrong/miniconda3/envs/tpot2devenv/lib/python3.10/site-packages/tensorflow/python/compat/v2_compat.py:108: disable_resource_variables (from tensorflow.python.ops.variable_scope) is deprecated and will be removed in a future version.
Instructions for updating:
non-resource variables are not supported in the long term
starting loops
working on 
logs/145681/tpot2_base_normal_MCAR_0.5
4.040489912033081
loading data
logs/145681/tpot2_base_normal_MCAR_0.5/data/145681_True.pkl
[3 3 3 ... 1 0 0]
       0   ...    10
0     6.3  ...   9.5
1     7.8  ...  11.7
2     7.7  ...  11.8
3     7.0  ...  10.5
4     6.0  ...   8.9
...   ...  ...   ...
4403  7.2  ...   8.6
4404  8.1  ...   9.0
4405  7.3  ...  10.7
4406  6.1  ...  10.1
4407  8.3  ...  12.4

[4408 rows x 11 columns]
      0   ...    10
0    8.1  ...  11.1
1    7.6  ...  11.4
2    6.6  ...  10.8
3    6.3  ...   9.8
4    8.5  ...  10.6
..   ...  ...   ...
485  7.0  ...  10.6
486  7.6  ...  11.4
487  7.9  ...   9.0
488  7.6  ...  10.4
489  7.1  ...  11.5

[490 rows x 11 columns]
running experiment 1/3 - Does large hyperparameter space improve reconstruction accuracy over simple
[I 2024-04-15 16:16:56,551] A new study created in memory with name: no-name-84531bcf-7aa9-4e2b-9a55-9406dc3e9705
[I 2024-04-15 16:16:56,755] Trial 0 finished with value: 30.65496405069941 and parameters: {'model_name': 'SimpleImputer', 'strategy': 'constant'}. Best is trial 0 with value: 30.65496405069941.
[I 2024-04-15 16:16:57,107] Trial 2 finished with value: 30.65496405069941 and parameters: {'model_name': 'SimpleImputer', 'strategy': 'constant'}. Best is trial 0 with value: 30.65496405069941.
[I 2024-04-15 16:16:57,363] Trial 4 finished with value: 30.65496405069941 and parameters: {'model_name': 'SimpleImputer', 'strategy': 'constant'}. Best is trial 0 with value: 30.65496405069941.
[I 2024-04-15 16:16:57,730] Trial 6 finished with value: 30.65496405069941 and parameters: {'model_name': 'SimpleImputer', 'strategy': 'constant'}. Best is trial 0 with value: 30.65496405069941.
[I 2024-04-15 16:16:58,154] Trial 5 finished with value: 18.074323157523278 and parameters: {'model_name': 'SimpleImputer', 'strategy': 'mean'}. Best is trial 5 with value: 18.074323157523278.
[I 2024-04-15 16:16:58,358] Trial 12 finished with value: 30.65496405069941 and parameters: {'model_name': 'SimpleImputer', 'strategy': 'constant'}. Best is trial 5 with value: 18.074323157523278.
[I 2024-04-15 16:16:58,563] Trial 15 finished with value: 30.65496405069941 and parameters: {'model_name': 'SimpleImputer', 'strategy': 'constant'}. Best is trial 5 with value: 18.074323157523278.
[I 2024-04-15 16:16:58,872] Trial 14 finished with value: 30.65496405069941 and parameters: {'model_name': 'SimpleImputer', 'strategy': 'constant'}. Best is trial 5 with value: 18.074323157523278.
[I 2024-04-15 16:16:59,236] Trial 19 finished with value: 30.65496405069941 and parameters: {'model_name': 'SimpleImputer', 'strategy': 'constant'}. Best is trial 5 with value: 18.074323157523278.
[I 2024-04-15 16:16:59,438] Trial 23 finished with value: 30.65496405069941 and parameters: {'model_name': 'SimpleImputer', 'strategy': 'constant'}. Best is trial 5 with value: 18.074323157523278.
[I 2024-04-15 16:16:59,619] Trial 9 finished with value: 18.074323157523278 and parameters: {'model_name': 'SimpleImputer', 'strategy': 'mean'}. Best is trial 5 with value: 18.074323157523278.
[I 2024-04-15 16:16:59,802] Trial 1 finished with value: 30.63437189150185 and parameters: {'model_name': 'SimpleImputer', 'strategy': 'median'}. Best is trial 5 with value: 18.074323157523278.
[I 2024-04-15 16:17:00,097] Trial 8 finished with value: 18.074323157523278 and parameters: {'model_name': 'SimpleImputer', 'strategy': 'mean'}. Best is trial 5 with value: 18.074323157523278.
[I 2024-04-15 16:17:00,336] Trial 20 finished with value: 30.65496405069941 and parameters: {'model_name': 'SimpleImputer', 'strategy': 'constant'}. Best is trial 5 with value: 18.074323157523278.
[I 2024-04-15 16:17:00,698] Trial 25 finished with value: 30.65496405069941 and parameters: {'model_name': 'SimpleImputer', 'strategy': 'constant'}. Best is trial 5 with value: 18.074323157523278.
[I 2024-04-15 16:17:00,929] Trial 27 finished with value: 30.65496405069941 and parameters: {'model_name': 'SimpleImputer', 'strategy': 'constant'}. Best is trial 5 with value: 18.074323157523278.
[I 2024-04-15 16:17:01,129] Trial 26 finished with value: 30.65496405069941 and parameters: {'model_name': 'SimpleImputer', 'strategy': 'constant'}. Best is trial 5 with value: 18.074323157523278.
[I 2024-04-15 16:17:01,353] Trial 22 finished with value: 18.074323157523278 and parameters: {'model_name': 'SimpleImputer', 'strategy': 'mean'}. Best is trial 5 with value: 18.074323157523278.
[I 2024-04-15 16:17:01,606] Trial 16 finished with value: 18.074323157523278 and parameters: {'model_name': 'SimpleImputer', 'strategy': 'mean'}. Best is trial 5 with value: 18.074323157523278.
[I 2024-04-15 16:17:02,049] Trial 33 finished with value: 30.65496405069941 and parameters: {'model_name': 'SimpleImputer', 'strategy': 'constant'}. Best is trial 5 with value: 18.074323157523278.
[I 2024-04-15 16:17:02,457] Trial 28 finished with value: 30.65496405069941 and parameters: {'model_name': 'SimpleImputer', 'strategy': 'constant'}. Best is trial 5 with value: 18.074323157523278.
[I 2024-04-15 16:17:02,665] Trial 35 finished with value: 30.65496405069941 and parameters: {'model_name': 'SimpleImputer', 'strategy': 'constant'}. Best is trial 5 with value: 18.074323157523278.
[I 2024-04-15 16:17:03,023] Trial 11 finished with value: 30.63437189150185 and parameters: {'model_name': 'SimpleImputer', 'strategy': 'median'}. Best is trial 5 with value: 18.074323157523278.
[I 2024-04-15 16:17:03,340] Trial 40 finished with value: 30.65496405069941 and parameters: {'model_name': 'SimpleImputer', 'strategy': 'constant'}. Best is trial 5 with value: 18.074323157523278.
[I 2024-04-15 16:17:03,694] Trial 30 finished with value: 18.074323157523278 and parameters: {'model_name': 'SimpleImputer', 'strategy': 'mean'}. Best is trial 5 with value: 18.074323157523278.
[I 2024-04-15 16:17:03,948] Trial 43 finished with value: 30.65496405069941 and parameters: {'model_name': 'SimpleImputer', 'strategy': 'constant'}. Best is trial 5 with value: 18.074323157523278.
[I 2024-04-15 16:17:04,160] Trial 10 finished with value: 30.63437189150185 and parameters: {'model_name': 'SimpleImputer', 'strategy': 'median'}. Best is trial 5 with value: 18.074323157523278.
[I 2024-04-15 16:17:04,394] Trial 38 finished with value: 30.65496405069941 and parameters: {'model_name': 'SimpleImputer', 'strategy': 'constant'}. Best is trial 5 with value: 18.074323157523278.
[I 2024-04-15 16:17:04,773] Trial 42 finished with value: 18.074323157523278 and parameters: {'model_name': 'SimpleImputer', 'strategy': 'mean'}. Best is trial 5 with value: 18.074323157523278.
[I 2024-04-15 16:17:05,052] Trial 29 finished with value: 18.074323157523278 and parameters: {'model_name': 'SimpleImputer', 'strategy': 'mean'}. Best is trial 5 with value: 18.074323157523278.
[I 2024-04-15 16:17:05,287] Trial 44 finished with value: 30.65496405069941 and parameters: {'model_name': 'SimpleImputer', 'strategy': 'constant'}. Best is trial 5 with value: 18.074323157523278.
[I 2024-04-15 16:17:05,495] Trial 31 finished with value: 18.074323157523278 and parameters: {'model_name': 'SimpleImputer', 'strategy': 'mean'}. Best is trial 5 with value: 18.074323157523278.
[I 2024-04-15 16:17:05,681] Trial 21 finished with value: 30.63437189150185 and parameters: {'model_name': 'SimpleImputer', 'strategy': 'median'}. Best is trial 5 with value: 18.074323157523278.
[I 2024-04-15 16:17:05,878] Trial 13 finished with value: 30.63437189150185 and parameters: {'model_name': 'SimpleImputer', 'strategy': 'median'}. Best is trial 5 with value: 18.074323157523278.
[I 2024-04-15 16:17:06,059] Trial 49 finished with value: 30.65496405069941 and parameters: {'model_name': 'SimpleImputer', 'strategy': 'constant'}. Best is trial 5 with value: 18.074323157523278.
[I 2024-04-15 16:17:06,239] Trial 53 finished with value: 18.074323157523278 and parameters: {'model_name': 'SimpleImputer', 'strategy': 'mean'}. Best is trial 5 with value: 18.074323157523278.
[I 2024-04-15 16:17:06,468] Trial 34 finished with value: 18.074323157523278 and parameters: {'model_name': 'SimpleImputer', 'strategy': 'mean'}. Best is trial 5 with value: 18.074323157523278.
[I 2024-04-15 16:17:07,011] Trial 7 finished with value: 30.63437189150185 and parameters: {'model_name': 'SimpleImputer', 'strategy': 'median'}. Best is trial 5 with value: 18.074323157523278.
[I 2024-04-15 16:17:07,261] Trial 52 finished with value: 18.074323157523278 and parameters: {'model_name': 'SimpleImputer', 'strategy': 'mean'}. Best is trial 5 with value: 18.074323157523278.
[I 2024-04-15 16:17:07,691] Trial 67 finished with value: 18.074323157523278 and parameters: {'model_name': 'SimpleImputer', 'strategy': 'mean'}. Best is trial 5 with value: 18.074323157523278.
[I 2024-04-15 16:17:07,920] Trial 66 finished with value: 18.074323157523278 and parameters: {'model_name': 'SimpleImputer', 'strategy': 'mean'}. Best is trial 5 with value: 18.074323157523278.
[I 2024-04-15 16:17:08,296] Trial 47 finished with value: 18.074323157523278 and parameters: {'model_name': 'SimpleImputer', 'strategy': 'mean'}. Best is trial 5 with value: 18.074323157523278.
[I 2024-04-15 16:17:08,619] Trial 68 finished with value: 18.074323157523278 and parameters: {'model_name': 'SimpleImputer', 'strategy': 'mean'}. Best is trial 5 with value: 18.074323157523278.
[I 2024-04-15 16:17:08,893] Trial 71 finished with value: 18.074323157523278 and parameters: {'model_name': 'SimpleImputer', 'strategy': 'mean'}. Best is trial 5 with value: 18.074323157523278.
[I 2024-04-15 16:17:09,206] Trial 70 finished with value: 18.074323157523278 and parameters: {'model_name': 'SimpleImputer', 'strategy': 'mean'}. Best is trial 5 with value: 18.074323157523278.
[I 2024-04-15 16:17:09,505] Trial 69 finished with value: 18.074323157523278 and parameters: {'model_name': 'SimpleImputer', 'strategy': 'mean'}. Best is trial 5 with value: 18.074323157523278.
[I 2024-04-15 16:17:09,740] Trial 24 finished with value: 30.63437189150185 and parameters: {'model_name': 'SimpleImputer', 'strategy': 'median'}. Best is trial 5 with value: 18.074323157523278.
[I 2024-04-15 16:17:10,102] Trial 39 finished with value: 30.63437189150185 and parameters: {'model_name': 'SimpleImputer', 'strategy': 'median'}. Best is trial 5 with value: 18.074323157523278.
[I 2024-04-15 16:17:10,427] Trial 37 finished with value: 30.63437189150185 and parameters: {'model_name': 'SimpleImputer', 'strategy': 'median'}. Best is trial 5 with value: 18.074323157523278.
[I 2024-04-15 16:17:10,735] Trial 72 finished with value: 18.074323157523278 and parameters: {'model_name': 'SimpleImputer', 'strategy': 'mean'}. Best is trial 5 with value: 18.074323157523278.
[I 2024-04-15 16:17:11,317] Trial 3 finished with value: 30.65496405069941 and parameters: {'model_name': 'SimpleImputer', 'strategy': 'most_frequent'}. Best is trial 5 with value: 18.074323157523278.
[I 2024-04-15 16:17:12,328] Trial 17 finished with value: 30.65496405069941 and parameters: {'model_name': 'SimpleImputer', 'strategy': 'most_frequent'}. Best is trial 5 with value: 18.074323157523278.
[I 2024-04-15 16:17:12,934] Trial 18 finished with value: 30.65496405069941 and parameters: {'model_name': 'SimpleImputer', 'strategy': 'most_frequent'}. Best is trial 5 with value: 18.074323157523278.
[I 2024-04-15 16:17:14,197] Trial 32 finished with value: 30.65496405069941 and parameters: {'model_name': 'SimpleImputer', 'strategy': 'most_frequent'}. Best is trial 5 with value: 18.074323157523278.
[I 2024-04-15 16:17:14,475] Trial 41 finished with value: 30.65496405069941 and parameters: {'model_name': 'SimpleImputer', 'strategy': 'most_frequent'}. Best is trial 5 with value: 18.074323157523278.
[I 2024-04-15 16:17:14,695] Trial 62 finished with value: 30.65496405069941 and parameters: {'model_name': 'SimpleImputer', 'strategy': 'most_frequent'}. Best is trial 5 with value: 18.074323157523278.
[I 2024-04-15 16:17:14,891] Trial 56 finished with value: 30.65496405069941 and parameters: {'model_name': 'SimpleImputer', 'strategy': 'most_frequent'}. Best is trial 5 with value: 18.074323157523278.
[I 2024-04-15 16:17:15,064] Trial 99 finished with value: 18.074323157523278 and parameters: {'model_name': 'SimpleImputer', 'strategy': 'mean'}. Best is trial 5 with value: 18.074323157523278.
[I 2024-04-15 16:17:15,244] Trial 36 finished with value: 30.65496405069941 and parameters: {'model_name': 'SimpleImputer', 'strategy': 'most_frequent'}. Best is trial 5 with value: 18.074323157523278.
[I 2024-04-15 16:17:15,524] Trial 57 finished with value: 30.65496405069941 and parameters: {'model_name': 'SimpleImputer', 'strategy': 'most_frequent'}. Best is trial 5 with value: 18.074323157523278.
[I 2024-04-15 16:17:15,864] Trial 63 finished with value: 30.65496405069941 and parameters: {'model_name': 'SimpleImputer', 'strategy': 'most_frequent'}. Best is trial 5 with value: 18.074323157523278.
[I 2024-04-15 16:17:16,366] Trial 51 finished with value: 30.65496405069941 and parameters: {'model_name': 'SimpleImputer', 'strategy': 'most_frequent'}. Best is trial 5 with value: 18.074323157523278.
[I 2024-04-15 16:17:16,621] Trial 54 finished with value: 30.65496405069941 and parameters: {'model_name': 'SimpleImputer', 'strategy': 'most_frequent'}. Best is trial 5 with value: 18.074323157523278.
[I 2024-04-15 16:17:16,984] Trial 61 finished with value: 30.65496405069941 and parameters: {'model_name': 'SimpleImputer', 'strategy': 'most_frequent'}. Best is trial 5 with value: 18.074323157523278.
[I 2024-04-15 16:17:17,267] Trial 50 finished with value: 30.65496405069941 and parameters: {'model_name': 'SimpleImputer', 'strategy': 'most_frequent'}. Best is trial 5 with value: 18.074323157523278.
[I 2024-04-15 16:17:17,524] Trial 65 finished with value: 30.65496405069941 and parameters: {'model_name': 'SimpleImputer', 'strategy': 'most_frequent'}. Best is trial 5 with value: 18.074323157523278.
[I 2024-04-15 16:17:17,733] Trial 45 finished with value: 30.65496405069941 and parameters: {'model_name': 'SimpleImputer', 'strategy': 'most_frequent'}. Best is trial 5 with value: 18.074323157523278.
[I 2024-04-15 16:17:17,927] Trial 60 finished with value: 30.65496405069941 and parameters: {'model_name': 'SimpleImputer', 'strategy': 'most_frequent'}. Best is trial 5 with value: 18.074323157523278.
[I 2024-04-15 16:17:18,187] Trial 79 finished with value: 30.65496405069941 and parameters: {'model_name': 'SimpleImputer', 'strategy': 'most_frequent'}. Best is trial 5 with value: 18.074323157523278.
[I 2024-04-15 16:17:18,486] Trial 48 finished with value: 30.65496405069941 and parameters: {'model_name': 'SimpleImputer', 'strategy': 'most_frequent'}. Best is trial 5 with value: 18.074323157523278.
[I 2024-04-15 16:17:18,745] Trial 55 finished with value: 30.65496405069941 and parameters: {'model_name': 'SimpleImputer', 'strategy': 'most_frequent'}. Best is trial 5 with value: 18.074323157523278.
[I 2024-04-15 16:17:19,164] Trial 46 finished with value: 30.65496405069941 and parameters: {'model_name': 'SimpleImputer', 'strategy': 'most_frequent'}. Best is trial 5 with value: 18.074323157523278.
[I 2024-04-15 16:17:19,410] Trial 59 finished with value: 30.65496405069941 and parameters: {'model_name': 'SimpleImputer', 'strategy': 'most_frequent'}. Best is trial 5 with value: 18.074323157523278.
[I 2024-04-15 16:17:19,592] Trial 80 finished with value: 30.65496405069941 and parameters: {'model_name': 'SimpleImputer', 'strategy': 'most_frequent'}. Best is trial 5 with value: 18.074323157523278.
[I 2024-04-15 16:17:19,806] Trial 102 finished with value: 18.074323157523278 and parameters: {'model_name': 'SimpleImputer', 'strategy': 'mean'}. Best is trial 5 with value: 18.074323157523278.
[I 2024-04-15 16:17:20,038] Trial 73 finished with value: 30.65496405069941 and parameters: {'model_name': 'SimpleImputer', 'strategy': 'most_frequent'}. Best is trial 5 with value: 18.074323157523278.
[I 2024-04-15 16:17:20,300] Trial 101 finished with value: 18.074323157523278 and parameters: {'model_name': 'SimpleImputer', 'strategy': 'mean'}. Best is trial 5 with value: 18.074323157523278.
[I 2024-04-15 16:17:20,577] Trial 64 finished with value: 30.65496405069941 and parameters: {'model_name': 'SimpleImputer', 'strategy': 'most_frequent'}. Best is trial 5 with value: 18.074323157523278.
[I 2024-04-15 16:17:20,907] Trial 58 finished with value: 30.65496405069941 and parameters: {'model_name': 'SimpleImputer', 'strategy': 'most_frequent'}. Best is trial 5 with value: 18.074323157523278.
[I 2024-04-15 16:17:21,114] Trial 81 finished with value: 30.65496405069941 and parameters: {'model_name': 'SimpleImputer', 'strategy': 'most_frequent'}. Best is trial 5 with value: 18.074323157523278.
[I 2024-04-15 16:17:21,410] Trial 75 finished with value: 30.65496405069941 and parameters: {'model_name': 'SimpleImputer', 'strategy': 'most_frequent'}. Best is trial 5 with value: 18.074323157523278.
[I 2024-04-15 16:17:21,622] Trial 74 finished with value: 30.65496405069941 and parameters: {'model_name': 'SimpleImputer', 'strategy': 'most_frequent'}. Best is trial 5 with value: 18.074323157523278.
[I 2024-04-15 16:17:21,966] Trial 84 finished with value: 30.65496405069941 and parameters: {'model_name': 'SimpleImputer', 'strategy': 'most_frequent'}. Best is trial 5 with value: 18.074323157523278.
[I 2024-04-15 16:17:22,156] Trial 91 finished with value: 30.65496405069941 and parameters: {'model_name': 'SimpleImputer', 'strategy': 'most_frequent'}. Best is trial 5 with value: 18.074323157523278.
[I 2024-04-15 16:17:22,335] Trial 105 finished with value: 18.074323157523278 and parameters: {'model_name': 'SimpleImputer', 'strategy': 'mean'}. Best is trial 5 with value: 18.074323157523278.
[I 2024-04-15 16:17:22,602] Trial 85 finished with value: 30.65496405069941 and parameters: {'model_name': 'SimpleImputer', 'strategy': 'most_frequent'}. Best is trial 5 with value: 18.074323157523278.
[I 2024-04-15 16:17:22,888] Trial 83 finished with value: 30.65496405069941 and parameters: {'model_name': 'SimpleImputer', 'strategy': 'most_frequent'}. Best is trial 5 with value: 18.074323157523278.
[I 2024-04-15 16:17:23,090] Trial 88 finished with value: 30.65496405069941 and parameters: {'model_name': 'SimpleImputer', 'strategy': 'most_frequent'}. Best is trial 5 with value: 18.074323157523278.
[I 2024-04-15 16:17:23,285] Trial 114 finished with value: 18.074323157523278 and parameters: {'model_name': 'SimpleImputer', 'strategy': 'mean'}. Best is trial 5 with value: 18.074323157523278.
[I 2024-04-15 16:17:23,480] Trial 103 finished with value: 18.074323157523278 and parameters: {'model_name': 'SimpleImputer', 'strategy': 'mean'}. Best is trial 5 with value: 18.074323157523278.
[I 2024-04-15 16:17:23,704] Trial 108 finished with value: 18.074323157523278 and parameters: {'model_name': 'SimpleImputer', 'strategy': 'mean'}. Best is trial 5 with value: 18.074323157523278.
[I 2024-04-15 16:17:23,978] Trial 110 finished with value: 18.074323157523278 and parameters: {'model_name': 'SimpleImputer', 'strategy': 'mean'}. Best is trial 5 with value: 18.074323157523278.
[I 2024-04-15 16:17:24,199] Trial 86 finished with value: 30.65496405069941 and parameters: {'model_name': 'SimpleImputer', 'strategy': 'most_frequent'}. Best is trial 5 with value: 18.074323157523278.
[I 2024-04-15 16:17:24,482] Trial 104 finished with value: 18.074323157523278 and parameters: {'model_name': 'SimpleImputer', 'strategy': 'mean'}. Best is trial 5 with value: 18.074323157523278.
[I 2024-04-15 16:17:24,720] Trial 87 finished with value: 30.65496405069941 and parameters: {'model_name': 'SimpleImputer', 'strategy': 'most_frequent'}. Best is trial 5 with value: 18.074323157523278.
