Run: 5
/cm/local/apps/slurm/var/spool/job691896/slurm_script: line 23: /common/ketrong/minconda3/etc/profile.d/conda.sh: No such file or directory
/cm/local/apps/slurm/var/spool/job691896/slurm_script: line 26: $'\nconda create --name tpot2devenv -c conda-forge python=3.10\n': command not found
/cm/local/apps/slurm/var/spool/job691896/slurm_script: line 31: $'\npip install -r requirements.txt\n': command not found
RunStart
2024-02-28 19:44:32.190252: I tensorflow/core/util/port.cc:113] oneDNN custom operations are on. You may see slightly different numerical results due to floating-point round-off errors from different computation orders. To turn them off, set the environment variable `TF_ENABLE_ONEDNN_OPTS=0`.
2024-02-28 19:44:32.224237: E external/local_xla/xla/stream_executor/cuda/cuda_dnn.cc:9261] Unable to register cuDNN factory: Attempting to register factory for plugin cuDNN when one has already been registered
2024-02-28 19:44:32.224256: E external/local_xla/xla/stream_executor/cuda/cuda_fft.cc:607] Unable to register cuFFT factory: Attempting to register factory for plugin cuFFT when one has already been registered
2024-02-28 19:44:32.225365: E external/local_xla/xla/stream_executor/cuda/cuda_blas.cc:1515] Unable to register cuBLAS factory: Attempting to register factory for plugin cuBLAS when one has already been registered
2024-02-28 19:44:32.230766: I tensorflow/core/platform/cpu_feature_guard.cc:182] This TensorFlow binary is optimized to use available CPU instructions in performance-critical operations.
To enable the following instructions: AVX2 AVX512F AVX512_VNNI FMA, in other operations, rebuild TensorFlow with the appropriate compiler flags.
2024-02-28 19:44:35.131206: W tensorflow/compiler/tf2tensorrt/utils/py_utils.cc:38] TF-TRT Warning: Could not find TensorRT
WARNING:tensorflow:From /home/ketrong/miniconda3/envs/tpot2devenv/lib/python3.10/site-packages/tensorflow/python/compat/v2_compat.py:108: disable_resource_variables (from tensorflow.python.ops.variable_scope) is deprecated and will be removed in a future version.
Instructions for updating:
non-resource variables are not supported in the long term
starting loops
working on 
logs/2289/tpot2_base_normal_MCAR_0.9
1.1277081966400146
loading data
logs/2289/tpot2_base_normal_MCAR_0.9/data/2289_True.pkl
[14 14 13 ... 16 12 14]
         0  ...     5
0      4.4  ...  0.00
1      6.2  ...  0.00
2     -3.9  ...  0.00
3     -5.7  ...  0.00
4      3.4  ...  0.00
...    ...  ...   ...
8560   3.1  ...  0.00
8561   3.5  ...  0.00
8562   4.4  ...  0.00
8563 -10.0  ... -0.02
8564   7.9  ...  0.00

[8565 rows x 6 columns]
       0  ...     5
0   -1.8  ...  0.00
1   -2.9  ...  0.00
2    2.9  ...  0.00
3   -6.3  ...  0.01
4   -1.5  ...  0.00
..   ...  ...   ...
947  2.7  ...  0.00
948 -0.5  ...  0.00
949 -2.5  ...  0.00
950 -5.3  ...  0.00
951 -7.2  ...  0.00

[952 rows x 6 columns]
running experiment 1/3 - Does large hyperparameter space improve reconstruction accuracy over simple
[I 2024-02-28 19:44:45,080] A new study created in memory with name: no-name-822dfaaa-6e78-4521-9969-61ff64989ae9
[I 2024-02-28 19:44:45,388] Trial 0 finished with value: 3.561945701033614 and parameters: {'model_name': 'SimpleImputer', 'strategy': 'constant'}. Best is trial 0 with value: 3.561945701033614.
[I 2024-02-28 19:44:45,675] Trial 11 finished with value: 3.561945701033614 and parameters: {'model_name': 'SimpleImputer', 'strategy': 'constant'}. Best is trial 0 with value: 3.561945701033614.
[I 2024-02-28 19:44:46,099] Trial 10 finished with value: 3.561945701033614 and parameters: {'model_name': 'SimpleImputer', 'strategy': 'constant'}. Best is trial 0 with value: 3.561945701033614.
[I 2024-02-28 19:44:46,434] Trial 2 finished with value: 3.504923261731958 and parameters: {'model_name': 'SimpleImputer', 'strategy': 'mean'}. Best is trial 2 with value: 3.504923261731958.
[I 2024-02-28 19:44:46,718] Trial 1 finished with value: 3.504923261731958 and parameters: {'model_name': 'SimpleImputer', 'strategy': 'mean'}. Best is trial 2 with value: 3.504923261731958.
[I 2024-02-28 19:44:47,018] Trial 5 finished with value: 3.504923261731958 and parameters: {'model_name': 'SimpleImputer', 'strategy': 'mean'}. Best is trial 2 with value: 3.504923261731958.
[I 2024-02-28 19:44:47,392] Trial 15 finished with value: 3.504923261731958 and parameters: {'model_name': 'SimpleImputer', 'strategy': 'mean'}. Best is trial 2 with value: 3.504923261731958.
[I 2024-02-28 19:44:47,854] Trial 13 finished with value: 3.561945701033614 and parameters: {'model_name': 'SimpleImputer', 'strategy': 'constant'}. Best is trial 2 with value: 3.504923261731958.
[I 2024-02-28 19:44:48,140] Trial 22 finished with value: 3.561945701033614 and parameters: {'model_name': 'SimpleImputer', 'strategy': 'constant'}. Best is trial 2 with value: 3.504923261731958.
[I 2024-02-28 19:44:48,470] Trial 18 finished with value: 3.504923261731958 and parameters: {'model_name': 'SimpleImputer', 'strategy': 'mean'}. Best is trial 2 with value: 3.504923261731958.
[I 2024-02-28 19:44:48,726] Trial 8 finished with value: 3.504923261731958 and parameters: {'model_name': 'SimpleImputer', 'strategy': 'mean'}. Best is trial 2 with value: 3.504923261731958.
[I 2024-02-28 19:44:49,088] Trial 23 finished with value: 3.561945701033614 and parameters: {'model_name': 'SimpleImputer', 'strategy': 'constant'}. Best is trial 2 with value: 3.504923261731958.
[I 2024-02-28 19:44:49,291] Trial 27 finished with value: 3.561945701033614 and parameters: {'model_name': 'SimpleImputer', 'strategy': 'constant'}. Best is trial 2 with value: 3.504923261731958.
[I 2024-02-28 19:44:49,445] Trial 36 finished with value: 3.561945701033614 and parameters: {'model_name': 'SimpleImputer', 'strategy': 'constant'}. Best is trial 2 with value: 3.504923261731958.
[I 2024-02-28 19:44:49,670] Trial 4 finished with value: 3.561945701033614 and parameters: {'model_name': 'SimpleImputer', 'strategy': 'median'}. Best is trial 2 with value: 3.504923261731958.
[I 2024-02-28 19:44:49,881] Trial 19 finished with value: 3.504923261731958 and parameters: {'model_name': 'SimpleImputer', 'strategy': 'mean'}. Best is trial 2 with value: 3.504923261731958.
[I 2024-02-28 19:44:50,099] Trial 21 finished with value: 3.504923261731958 and parameters: {'model_name': 'SimpleImputer', 'strategy': 'mean'}. Best is trial 2 with value: 3.504923261731958.
[I 2024-02-28 19:44:50,655] Trial 44 finished with value: 3.561945701033614 and parameters: {'model_name': 'SimpleImputer', 'strategy': 'constant'}. Best is trial 2 with value: 3.504923261731958.
[I 2024-02-28 19:44:50,838] Trial 47 finished with value: 3.504923261731958 and parameters: {'model_name': 'SimpleImputer', 'strategy': 'mean'}. Best is trial 2 with value: 3.504923261731958.
[I 2024-02-28 19:44:51,054] Trial 37 finished with value: 3.504923261731958 and parameters: {'model_name': 'SimpleImputer', 'strategy': 'mean'}. Best is trial 2 with value: 3.504923261731958.
[I 2024-02-28 19:44:51,261] Trial 20 finished with value: 3.504923261731958 and parameters: {'model_name': 'SimpleImputer', 'strategy': 'mean'}. Best is trial 2 with value: 3.504923261731958.
[I 2024-02-28 19:44:51,445] Trial 39 finished with value: 3.561945701033614 and parameters: {'model_name': 'SimpleImputer', 'strategy': 'constant'}. Best is trial 2 with value: 3.504923261731958.
[I 2024-02-28 19:44:51,614] Trial 28 finished with value: 3.504923261731958 and parameters: {'model_name': 'SimpleImputer', 'strategy': 'mean'}. Best is trial 2 with value: 3.504923261731958.
[I 2024-02-28 19:44:51,849] Trial 45 finished with value: 3.561945701033614 and parameters: {'model_name': 'SimpleImputer', 'strategy': 'constant'}. Best is trial 2 with value: 3.504923261731958.
[I 2024-02-28 19:44:52,120] Trial 42 finished with value: 3.561945701033614 and parameters: {'model_name': 'SimpleImputer', 'strategy': 'constant'}. Best is trial 2 with value: 3.504923261731958.
[I 2024-02-28 19:44:52,339] Trial 26 finished with value: 3.504923261731958 and parameters: {'model_name': 'SimpleImputer', 'strategy': 'mean'}. Best is trial 2 with value: 3.504923261731958.
[I 2024-02-28 19:44:52,623] Trial 34 finished with value: 3.504923261731958 and parameters: {'model_name': 'SimpleImputer', 'strategy': 'mean'}. Best is trial 2 with value: 3.504923261731958.
[I 2024-02-28 19:44:52,944] Trial 49 finished with value: 3.504923261731958 and parameters: {'model_name': 'SimpleImputer', 'strategy': 'mean'}. Best is trial 2 with value: 3.504923261731958.
[I 2024-02-28 19:44:53,284] Trial 54 finished with value: 3.504923261731958 and parameters: {'model_name': 'SimpleImputer', 'strategy': 'mean'}. Best is trial 2 with value: 3.504923261731958.
[I 2024-02-28 19:44:53,589] Trial 53 finished with value: 3.504923261731958 and parameters: {'model_name': 'SimpleImputer', 'strategy': 'mean'}. Best is trial 2 with value: 3.504923261731958.
[I 2024-02-28 19:44:53,885] Trial 52 finished with value: 3.504923261731958 and parameters: {'model_name': 'SimpleImputer', 'strategy': 'mean'}. Best is trial 2 with value: 3.504923261731958.
[I 2024-02-28 19:44:54,289] Trial 16 finished with value: 3.561945701033614 and parameters: {'model_name': 'SimpleImputer', 'strategy': 'median'}. Best is trial 2 with value: 3.504923261731958.
[I 2024-02-28 19:44:54,649] Trial 41 finished with value: 3.504923261731958 and parameters: {'model_name': 'SimpleImputer', 'strategy': 'mean'}. Best is trial 2 with value: 3.504923261731958.
[I 2024-02-28 19:44:54,950] Trial 56 finished with value: 3.561945701033614 and parameters: {'model_name': 'SimpleImputer', 'strategy': 'constant'}. Best is trial 2 with value: 3.504923261731958.
[I 2024-02-28 19:44:55,162] Trial 6 finished with value: 3.561945701033614 and parameters: {'model_name': 'SimpleImputer', 'strategy': 'median'}. Best is trial 2 with value: 3.504923261731958.
[I 2024-02-28 19:44:55,380] Trial 43 finished with value: 3.504923261731958 and parameters: {'model_name': 'SimpleImputer', 'strategy': 'mean'}. Best is trial 2 with value: 3.504923261731958.
[I 2024-02-28 19:44:55,783] Trial 14 finished with value: 3.561945701033614 and parameters: {'model_name': 'SimpleImputer', 'strategy': 'median'}. Best is trial 2 with value: 3.504923261731958.
[I 2024-02-28 19:44:56,273] Trial 9 finished with value: 3.561945701033614 and parameters: {'model_name': 'SimpleImputer', 'strategy': 'median'}. Best is trial 2 with value: 3.504923261731958.
[I 2024-02-28 19:44:56,598] Trial 51 finished with value: 3.561945701033614 and parameters: {'model_name': 'SimpleImputer', 'strategy': 'median'}. Best is trial 2 with value: 3.504923261731958.
[I 2024-02-28 19:44:56,888] Trial 7 finished with value: 3.561945701033614 and parameters: {'model_name': 'SimpleImputer', 'strategy': 'most_frequent'}. Best is trial 2 with value: 3.504923261731958.
[I 2024-02-28 19:44:57,373] Trial 3 finished with value: 3.561945701033614 and parameters: {'model_name': 'SimpleImputer', 'strategy': 'most_frequent'}. Best is trial 2 with value: 3.504923261731958.
[I 2024-02-28 19:44:57,607] Trial 55 finished with value: 3.561945701033614 and parameters: {'model_name': 'SimpleImputer', 'strategy': 'median'}. Best is trial 2 with value: 3.504923261731958.
[I 2024-02-28 19:44:57,906] Trial 25 finished with value: 3.561945701033614 and parameters: {'model_name': 'SimpleImputer', 'strategy': 'most_frequent'}. Best is trial 2 with value: 3.504923261731958.
[I 2024-02-28 19:44:58,237] Trial 12 finished with value: 3.561945701033614 and parameters: {'model_name': 'SimpleImputer', 'strategy': 'most_frequent'}. Best is trial 2 with value: 3.504923261731958.
[I 2024-02-28 19:44:58,674] Trial 58 finished with value: 3.561945701033614 and parameters: {'model_name': 'SimpleImputer', 'strategy': 'median'}. Best is trial 2 with value: 3.504923261731958.
[I 2024-02-28 19:44:59,012] Trial 48 finished with value: 3.561945701033614 and parameters: {'model_name': 'SimpleImputer', 'strategy': 'median'}. Best is trial 2 with value: 3.504923261731958.
[I 2024-02-28 19:44:59,201] Trial 24 finished with value: 3.561945701033614 and parameters: {'model_name': 'SimpleImputer', 'strategy': 'most_frequent'}. Best is trial 2 with value: 3.504923261731958.
[I 2024-02-28 19:44:59,437] Trial 60 finished with value: 3.561945701033614 and parameters: {'model_name': 'SimpleImputer', 'strategy': 'median'}. Best is trial 2 with value: 3.504923261731958.
[I 2024-02-28 19:44:59,698] Trial 35 finished with value: 3.561945701033614 and parameters: {'model_name': 'SimpleImputer', 'strategy': 'most_frequent'}. Best is trial 2 with value: 3.504923261731958.
[I 2024-02-28 19:45:00,067] Trial 50 finished with value: 3.561945701033614 and parameters: {'model_name': 'SimpleImputer', 'strategy': 'most_frequent'}. Best is trial 2 with value: 3.504923261731958.
[I 2024-02-28 19:45:00,304] Trial 32 finished with value: 3.561945701033614 and parameters: {'model_name': 'SimpleImputer', 'strategy': 'most_frequent'}. Best is trial 2 with value: 3.504923261731958.
[I 2024-02-28 19:45:00,525] Trial 33 finished with value: 3.561945701033614 and parameters: {'model_name': 'SimpleImputer', 'strategy': 'most_frequent'}. Best is trial 2 with value: 3.504923261731958.
[I 2024-02-28 19:45:00,748] Trial 61 finished with value: 3.561945701033614 and parameters: {'model_name': 'SimpleImputer', 'strategy': 'median'}. Best is trial 2 with value: 3.504923261731958.
[I 2024-02-28 19:45:01,002] Trial 17 finished with value: 3.561945701033614 and parameters: {'model_name': 'SimpleImputer', 'strategy': 'most_frequent'}. Best is trial 2 with value: 3.504923261731958.
[I 2024-02-28 19:45:01,401] Trial 29 finished with value: 3.561945701033614 and parameters: {'model_name': 'SimpleImputer', 'strategy': 'most_frequent'}. Best is trial 2 with value: 3.504923261731958.
[I 2024-02-28 19:45:01,657] Trial 46 finished with value: 3.561945701033614 and parameters: {'model_name': 'SimpleImputer', 'strategy': 'most_frequent'}. Best is trial 2 with value: 3.504923261731958.
[I 2024-02-28 19:45:01,969] Trial 30 finished with value: 3.561945701033614 and parameters: {'model_name': 'SimpleImputer', 'strategy': 'most_frequent'}. Best is trial 2 with value: 3.504923261731958.
[I 2024-02-28 19:45:02,268] Trial 40 finished with value: 3.561945701033614 and parameters: {'model_name': 'SimpleImputer', 'strategy': 'most_frequent'}. Best is trial 2 with value: 3.504923261731958.
[I 2024-02-28 19:45:02,646] Trial 38 finished with value: 3.561945701033614 and parameters: {'model_name': 'SimpleImputer', 'strategy': 'most_frequent'}. Best is trial 2 with value: 3.504923261731958.
[I 2024-02-28 19:45:02,935] Trial 63 finished with value: 3.561945701033614 and parameters: {'model_name': 'SimpleImputer', 'strategy': 'most_frequent'}. Best is trial 2 with value: 3.504923261731958.
[I 2024-02-28 19:45:03,218] Trial 31 finished with value: 3.561945701033614 and parameters: {'model_name': 'SimpleImputer', 'strategy': 'most_frequent'}. Best is trial 2 with value: 3.504923261731958.
[I 2024-02-28 19:45:03,542] Trial 59 finished with value: 3.561945701033614 and parameters: {'model_name': 'SimpleImputer', 'strategy': 'most_frequent'}. Best is trial 2 with value: 3.504923261731958.
[I 2024-02-28 19:45:03,889] Trial 62 finished with value: 3.561945701033614 and parameters: {'model_name': 'SimpleImputer', 'strategy': 'most_frequent'}. Best is trial 2 with value: 3.504923261731958.
[I 2024-02-28 19:45:04,132] Trial 82 finished with value: 3.561945701033614 and parameters: {'model_name': 'SimpleImputer', 'strategy': 'median'}. Best is trial 2 with value: 3.504923261731958.
[I 2024-02-28 19:45:04,716] Trial 66 finished with value: 3.561945701033614 and parameters: {'model_name': 'SimpleImputer', 'strategy': 'most_frequent'}. Best is trial 2 with value: 3.504923261731958.
[I 2024-02-28 19:45:05,001] Trial 64 finished with value: 3.561945701033614 and parameters: {'model_name': 'SimpleImputer', 'strategy': 'most_frequent'}. Best is trial 2 with value: 3.504923261731958.
[I 2024-02-28 19:45:05,225] Trial 97 finished with value: 3.504923261731958 and parameters: {'model_name': 'SimpleImputer', 'strategy': 'mean'}. Best is trial 2 with value: 3.504923261731958.
[I 2024-02-28 19:45:05,434] Trial 95 finished with value: 3.504923261731958 and parameters: {'model_name': 'SimpleImputer', 'strategy': 'mean'}. Best is trial 2 with value: 3.504923261731958.
[I 2024-02-28 19:45:05,698] Trial 74 finished with value: 3.561945701033614 and parameters: {'model_name': 'SimpleImputer', 'strategy': 'most_frequent'}. Best is trial 2 with value: 3.504923261731958.
[I 2024-02-28 19:45:06,030] Trial 68 finished with value: 3.561945701033614 and parameters: {'model_name': 'SimpleImputer', 'strategy': 'most_frequent'}. Best is trial 2 with value: 3.504923261731958.
[I 2024-02-28 19:45:06,338] Trial 93 finished with value: 3.504923261731958 and parameters: {'model_name': 'SimpleImputer', 'strategy': 'mean'}. Best is trial 2 with value: 3.504923261731958.
[I 2024-02-28 19:45:06,595] Trial 76 finished with value: 3.561945701033614 and parameters: {'model_name': 'SimpleImputer', 'strategy': 'most_frequent'}. Best is trial 2 with value: 3.504923261731958.
[I 2024-02-28 19:45:06,782] Trial 96 finished with value: 3.504923261731958 and parameters: {'model_name': 'SimpleImputer', 'strategy': 'mean'}. Best is trial 2 with value: 3.504923261731958.
[I 2024-02-28 19:45:07,013] Trial 69 finished with value: 3.561945701033614 and parameters: {'model_name': 'SimpleImputer', 'strategy': 'most_frequent'}. Best is trial 2 with value: 3.504923261731958.
[I 2024-02-28 19:45:07,239] Trial 103 finished with value: 3.504923261731958 and parameters: {'model_name': 'SimpleImputer', 'strategy': 'mean'}. Best is trial 2 with value: 3.504923261731958.
[I 2024-02-28 19:45:07,486] Trial 98 finished with value: 3.504923261731958 and parameters: {'model_name': 'SimpleImputer', 'strategy': 'mean'}. Best is trial 2 with value: 3.504923261731958.
[I 2024-02-28 19:45:07,722] Trial 99 finished with value: 3.504923261731958 and parameters: {'model_name': 'SimpleImputer', 'strategy': 'mean'}. Best is trial 2 with value: 3.504923261731958.
[I 2024-02-28 19:45:07,935] Trial 67 finished with value: 3.561945701033614 and parameters: {'model_name': 'SimpleImputer', 'strategy': 'most_frequent'}. Best is trial 2 with value: 3.504923261731958.
[I 2024-02-28 19:45:08,143] Trial 57 finished with value: 3.561945701033614 and parameters: {'model_name': 'SimpleImputer', 'strategy': 'most_frequent'}. Best is trial 2 with value: 3.504923261731958.
[I 2024-02-28 19:45:08,354] Trial 70 finished with value: 3.561945701033614 and parameters: {'model_name': 'SimpleImputer', 'strategy': 'most_frequent'}. Best is trial 2 with value: 3.504923261731958.
[I 2024-02-28 19:45:08,540] Trial 94 finished with value: 3.504923261731958 and parameters: {'model_name': 'SimpleImputer', 'strategy': 'mean'}. Best is trial 2 with value: 3.504923261731958.
[I 2024-02-28 19:45:08,813] Trial 100 finished with value: 3.504923261731958 and parameters: {'model_name': 'SimpleImputer', 'strategy': 'mean'}. Best is trial 2 with value: 3.504923261731958.
[I 2024-02-28 19:45:09,172] Trial 101 finished with value: 3.504923261731958 and parameters: {'model_name': 'SimpleImputer', 'strategy': 'mean'}. Best is trial 2 with value: 3.504923261731958.
[I 2024-02-28 19:45:09,393] Trial 65 finished with value: 3.561945701033614 and parameters: {'model_name': 'SimpleImputer', 'strategy': 'most_frequent'}. Best is trial 2 with value: 3.504923261731958.
[I 2024-02-28 19:45:09,577] Trial 78 finished with value: 3.561945701033614 and parameters: {'model_name': 'SimpleImputer', 'strategy': 'most_frequent'}. Best is trial 2 with value: 3.504923261731958.
[I 2024-02-28 19:45:09,758] Trial 75 finished with value: 3.561945701033614 and parameters: {'model_name': 'SimpleImputer', 'strategy': 'most_frequent'}. Best is trial 2 with value: 3.504923261731958.
[I 2024-02-28 19:45:10,018] Trial 79 finished with value: 3.561945701033614 and parameters: {'model_name': 'SimpleImputer', 'strategy': 'most_frequent'}. Best is trial 2 with value: 3.504923261731958.
[I 2024-02-28 19:45:10,235] Trial 105 finished with value: 3.504923261731958 and parameters: {'model_name': 'SimpleImputer', 'strategy': 'mean'}. Best is trial 2 with value: 3.504923261731958.
[I 2024-02-28 19:45:10,483] Trial 73 finished with value: 3.561945701033614 and parameters: {'model_name': 'SimpleImputer', 'strategy': 'most_frequent'}. Best is trial 2 with value: 3.504923261731958.
[I 2024-02-28 19:45:10,703] Trial 104 finished with value: 3.504923261731958 and parameters: {'model_name': 'SimpleImputer', 'strategy': 'mean'}. Best is trial 2 with value: 3.504923261731958.
[I 2024-02-28 19:45:10,917] Trial 77 finished with value: 3.561945701033614 and parameters: {'model_name': 'SimpleImputer', 'strategy': 'most_frequent'}. Best is trial 2 with value: 3.504923261731958.
[I 2024-02-28 19:45:11,123] Trial 109 finished with value: 3.504923261731958 and parameters: {'model_name': 'SimpleImputer', 'strategy': 'mean'}. Best is trial 2 with value: 3.504923261731958.
[I 2024-02-28 19:45:11,316] Trial 102 finished with value: 3.504923261731958 and parameters: {'model_name': 'SimpleImputer', 'strategy': 'mean'}. Best is trial 2 with value: 3.504923261731958.
[I 2024-02-28 19:45:11,566] Trial 80 finished with value: 3.561945701033614 and parameters: {'model_name': 'SimpleImputer', 'strategy': 'most_frequent'}. Best is trial 2 with value: 3.504923261731958.
[I 2024-02-28 19:45:11,883] Trial 72 finished with value: 3.561945701033614 and parameters: {'model_name': 'SimpleImputer', 'strategy': 'most_frequent'}. Best is trial 2 with value: 3.504923261731958.
[I 2024-02-28 19:45:12,141] Trial 86 finished with value: 3.561945701033614 and parameters: {'model_name': 'SimpleImputer', 'strategy': 'most_frequent'}. Best is trial 2 with value: 3.504923261731958.
