[I 2024-03-02 12:49:46,195] Trial 139 finished with value: 907.2753632256799 and parameters: {'model_name': 'KNNImputer', 'weights': 'distance', 'keep_empty_features': False}. Best is trial 2 with value: 907.2753632256799.
[I 2024-03-02 12:50:07,911] Trial 140 finished with value: 907.2753632256799 and parameters: {'model_name': 'KNNImputer', 'weights': 'distance', 'keep_empty_features': False}. Best is trial 2 with value: 907.2753632256799.
[I 2024-03-02 12:50:12,185] Trial 141 finished with value: 907.2753632256799 and parameters: {'model_name': 'KNNImputer', 'weights': 'distance', 'keep_empty_features': False}. Best is trial 2 with value: 907.2753632256799.
[I 2024-03-02 12:50:34,003] Trial 142 finished with value: 911.8818524959719 and parameters: {'model_name': 'KNNImputer', 'weights': 'uniform', 'keep_empty_features': False}. Best is trial 2 with value: 907.2753632256799.
[I 2024-03-02 12:50:38,490] Trial 143 finished with value: 911.8818524959719 and parameters: {'model_name': 'KNNImputer', 'weights': 'uniform', 'keep_empty_features': False}. Best is trial 2 with value: 907.2753632256799.
[I 2024-03-02 12:50:58,570] Trial 144 finished with value: 907.2753632256799 and parameters: {'model_name': 'KNNImputer', 'weights': 'distance', 'keep_empty_features': False}. Best is trial 2 with value: 907.2753632256799.
[I 2024-03-02 12:51:28,847] Trial 75 finished with value: 1059.6356516615544 and parameters: {'model_name': 'RandomForestImputer', 'max_iter': 62, 'decreasing': True, 'min_samples_split': 1.0, 'min_samples_leaf': 0.6, 'max_features': 0.9, 'warm_start': True}. Best is trial 2 with value: 907.2753632256799.
[I 2024-03-02 12:51:45,492] Trial 59 finished with value: inf and parameters: {'model_name': 'GAIN', 'batch_size': 10, 'hint_rate': 0.74, 'alpha': 31, 'iterations': 2494}. Best is trial 2 with value: 907.2753632256799.
[I 2024-03-02 12:51:50,792] Trial 147 finished with value: 907.2753632256799 and parameters: {'model_name': 'KNNImputer', 'weights': 'distance', 'keep_empty_features': False}. Best is trial 2 with value: 907.2753632256799.
[I 2024-03-02 12:52:10,534] Trial 148 finished with value: 907.2753632256799 and parameters: {'model_name': 'KNNImputer', 'weights': 'distance', 'keep_empty_features': False}. Best is trial 2 with value: 907.2753632256799.
[I 2024-03-02 12:52:13,567] Trial 42 finished with value: 968.5952226890629 and parameters: {'model_name': 'RandomForestImputer', 'max_iter': 3, 'decreasing': True, 'min_samples_split': 0.5, 'min_samples_leaf': 0.30000000000000004, 'max_features': 0.7000000000000001, 'warm_start': False}. Best is trial 2 with value: 907.2753632256799.
[I 2024-03-02 12:52:17,635] Trial 149 finished with value: 907.2753632256799 and parameters: {'model_name': 'KNNImputer', 'weights': 'distance', 'keep_empty_features': False}. Best is trial 2 with value: 907.2753632256799.
[I 2024-03-02 12:52:39,567] Trial 150 finished with value: 907.2753632256799 and parameters: {'model_name': 'KNNImputer', 'weights': 'distance', 'keep_empty_features': False}. Best is trial 2 with value: 907.2753632256799.
[I 2024-03-02 12:52:43,098] Trial 151 finished with value: 907.2753632256799 and parameters: {'model_name': 'KNNImputer', 'weights': 'distance', 'keep_empty_features': False}. Best is trial 2 with value: 907.2753632256799.
[I 2024-03-02 12:52:47,460] Trial 152 finished with value: 907.2753632256799 and parameters: {'model_name': 'KNNImputer', 'weights': 'distance', 'keep_empty_features': False}. Best is trial 2 with value: 907.2753632256799.
[I 2024-03-02 12:53:09,472] Trial 153 finished with value: 907.2753632256799 and parameters: {'model_name': 'KNNImputer', 'weights': 'distance', 'keep_empty_features': False}. Best is trial 2 with value: 907.2753632256799.
[I 2024-03-02 12:53:13,807] Trial 154 finished with value: 907.2753632256799 and parameters: {'model_name': 'KNNImputer', 'weights': 'distance', 'keep_empty_features': False}. Best is trial 2 with value: 907.2753632256799.
[I 2024-03-02 12:53:16,893] Trial 155 finished with value: 907.2753632256799 and parameters: {'model_name': 'KNNImputer', 'weights': 'distance', 'keep_empty_features': False}. Best is trial 2 with value: 907.2753632256799.
[I 2024-03-02 12:53:38,553] Trial 156 finished with value: 907.2753632256799 and parameters: {'model_name': 'KNNImputer', 'weights': 'distance', 'keep_empty_features': False}. Best is trial 2 with value: 907.2753632256799.
[I 2024-03-02 12:53:43,031] Trial 157 finished with value: 907.2753632256799 and parameters: {'model_name': 'KNNImputer', 'weights': 'distance', 'keep_empty_features': False}. Best is trial 2 with value: 907.2753632256799.
[I 2024-03-02 12:53:46,374] Trial 158 finished with value: 907.2753632256799 and parameters: {'model_name': 'KNNImputer', 'weights': 'distance', 'keep_empty_features': False}. Best is trial 2 with value: 907.2753632256799.
[I 2024-03-02 12:54:07,612] Trial 159 finished with value: 907.2753632256799 and parameters: {'model_name': 'KNNImputer', 'weights': 'distance', 'keep_empty_features': False}. Best is trial 2 with value: 907.2753632256799.
[I 2024-03-02 12:54:11,948] Trial 160 finished with value: 907.2753632256799 and parameters: {'model_name': 'KNNImputer', 'weights': 'distance', 'keep_empty_features': False}. Best is trial 2 with value: 907.2753632256799.
[I 2024-03-02 12:54:14,597] Trial 161 finished with value: 907.2753632256799 and parameters: {'model_name': 'KNNImputer', 'weights': 'distance', 'keep_empty_features': False}. Best is trial 2 with value: 907.2753632256799.
[I 2024-03-02 12:54:32,228] Trial 162 finished with value: 907.2753632256799 and parameters: {'model_name': 'KNNImputer', 'weights': 'distance', 'keep_empty_features': False}. Best is trial 2 with value: 907.2753632256799.
[I 2024-03-02 12:55:24,760] Trial 145 finished with value: 960.444142850132 and parameters: {'model_name': 'RandomForestImputer', 'max_iter': 1, 'decreasing': True, 'min_samples_split': 0.6000000000000001, 'min_samples_leaf': 0.30000000000000004, 'max_features': 0.1, 'warm_start': False}. Best is trial 2 with value: 907.2753632256799.
[I 2024-03-02 12:55:27,075] Trial 166 finished with value: 1060.3241540227564 and parameters: {'model_name': 'SimpleImputer', 'strategy': 'constant'}. Best is trial 2 with value: 907.2753632256799.
[I 2024-03-02 12:55:46,349] Trial 146 finished with value: 960.444142850132 and parameters: {'model_name': 'RandomForestImputer', 'max_iter': 1, 'decreasing': True, 'min_samples_split': 0.5, 'min_samples_leaf': 0.30000000000000004, 'max_features': 0.1, 'warm_start': False}. Best is trial 2 with value: 907.2753632256799.
[I 2024-03-02 12:55:49,821] Trial 167 finished with value: 907.2753632256799 and parameters: {'model_name': 'KNNImputer', 'weights': 'distance', 'keep_empty_features': False}. Best is trial 2 with value: 907.2753632256799.
[I 2024-03-02 12:56:10,064] Trial 168 finished with value: 907.2753632256799 and parameters: {'model_name': 'KNNImputer', 'weights': 'distance', 'keep_empty_features': False}. Best is trial 2 with value: 907.2753632256799.
[I 2024-03-02 12:56:12,675] Trial 169 finished with value: 907.2753632256799 and parameters: {'model_name': 'KNNImputer', 'weights': 'distance', 'keep_empty_features': False}. Best is trial 2 with value: 907.2753632256799.
[I 2024-03-02 12:56:35,429] Trial 170 finished with value: 907.2753632256799 and parameters: {'model_name': 'KNNImputer', 'weights': 'distance', 'keep_empty_features': False}. Best is trial 2 with value: 907.2753632256799.
[I 2024-03-02 12:56:39,258] Trial 171 finished with value: 907.2753632256799 and parameters: {'model_name': 'KNNImputer', 'weights': 'distance', 'keep_empty_features': False}. Best is trial 2 with value: 907.2753632256799.
[I 2024-03-02 12:57:02,798] Trial 172 finished with value: 907.2753632256799 and parameters: {'model_name': 'KNNImputer', 'weights': 'distance', 'keep_empty_features': False}. Best is trial 2 with value: 907.2753632256799.
[I 2024-03-02 12:57:05,766] Trial 173 finished with value: 907.2753632256799 and parameters: {'model_name': 'KNNImputer', 'weights': 'distance', 'keep_empty_features': False}. Best is trial 2 with value: 907.2753632256799.
[I 2024-03-02 12:57:29,374] Trial 174 finished with value: 911.8818524959719 and parameters: {'model_name': 'KNNImputer', 'weights': 'uniform', 'keep_empty_features': False}. Best is trial 2 with value: 907.2753632256799.
[I 2024-03-02 12:57:31,881] Trial 175 finished with value: 911.8818524959719 and parameters: {'model_name': 'KNNImputer', 'weights': 'uniform', 'keep_empty_features': False}. Best is trial 2 with value: 907.2753632256799.
[I 2024-03-02 12:57:34,915] Trial 9 finished with value: inf and parameters: {'model_name': 'GAIN', 'batch_size': 4, 'hint_rate': 0.39, 'alpha': 65, 'iterations': 541}. Best is trial 2 with value: 907.2753632256799.
[I 2024-03-02 12:57:59,350] Trial 176 finished with value: 907.2753632256799 and parameters: {'model_name': 'KNNImputer', 'weights': 'distance', 'keep_empty_features': False}. Best is trial 2 with value: 907.2753632256799.
[I 2024-03-02 12:58:02,827] Trial 177 finished with value: 907.2753632256799 and parameters: {'model_name': 'KNNImputer', 'weights': 'distance', 'keep_empty_features': False}. Best is trial 2 with value: 907.2753632256799.
[I 2024-03-02 12:58:05,122] Trial 178 finished with value: 907.2753632256799 and parameters: {'model_name': 'KNNImputer', 'weights': 'distance', 'keep_empty_features': False}. Best is trial 2 with value: 907.2753632256799.
[I 2024-03-02 12:58:08,270] Trial 71 finished with value: 942.5276499081535 and parameters: {'model_name': 'RandomForestImputer', 'max_iter': 7, 'decreasing': False, 'min_samples_split': 0.1, 'min_samples_leaf': 0.30000000000000004, 'max_features': 0.5, 'warm_start': False}. Best is trial 2 with value: 907.2753632256799.
[I 2024-03-02 12:58:30,326] Trial 179 finished with value: 907.2753632256799 and parameters: {'model_name': 'KNNImputer', 'weights': 'distance', 'keep_empty_features': False}. Best is trial 2 with value: 907.2753632256799.
[I 2024-03-02 12:58:33,650] Trial 180 finished with value: 907.2753632256799 and parameters: {'model_name': 'KNNImputer', 'weights': 'distance', 'keep_empty_features': False}. Best is trial 2 with value: 907.2753632256799.
[I 2024-03-02 12:58:34,769] Trial 181 finished with value: 907.2753632256799 and parameters: {'model_name': 'KNNImputer', 'weights': 'distance', 'keep_empty_features': False}. Best is trial 2 with value: 907.2753632256799.
[I 2024-03-02 12:58:37,749] Trial 182 finished with value: 907.2753632256799 and parameters: {'model_name': 'KNNImputer', 'weights': 'distance', 'keep_empty_features': False}. Best is trial 2 with value: 907.2753632256799.
[I 2024-03-02 12:59:00,217] Trial 183 finished with value: 907.2753632256799 and parameters: {'model_name': 'KNNImputer', 'weights': 'distance', 'keep_empty_features': False}. Best is trial 2 with value: 907.2753632256799.
[I 2024-03-02 12:59:02,182] Trial 184 finished with value: 907.2753632256799 and parameters: {'model_name': 'KNNImputer', 'weights': 'distance', 'keep_empty_features': False}. Best is trial 2 with value: 907.2753632256799.
[I 2024-03-02 12:59:03,926] Trial 164 finished with value: 960.444142850132 and parameters: {'model_name': 'RandomForestImputer', 'max_iter': 1, 'decreasing': True, 'min_samples_split': 0.7000000000000001, 'min_samples_leaf': 0.4, 'max_features': 0.1, 'warm_start': False}. Best is trial 2 with value: 907.2753632256799.
[I 2024-03-02 12:59:05,584] Trial 185 finished with value: 907.2753632256799 and parameters: {'model_name': 'KNNImputer', 'weights': 'distance', 'keep_empty_features': False}. Best is trial 2 with value: 907.2753632256799.
[I 2024-03-02 12:59:07,749] Trial 186 finished with value: 907.2753632256799 and parameters: {'model_name': 'KNNImputer', 'weights': 'distance', 'keep_empty_features': False}. Best is trial 2 with value: 907.2753632256799.
[I 2024-03-02 12:59:30,515] Trial 165 finished with value: 960.444142850132 and parameters: {'model_name': 'RandomForestImputer', 'max_iter': 1, 'decreasing': True, 'min_samples_split': 0.7000000000000001, 'min_samples_leaf': 0.4, 'max_features': 0.30000000000000004, 'warm_start': False}. Best is trial 2 with value: 907.2753632256799.
[I 2024-03-02 12:59:33,121] Trial 187 finished with value: 907.2753632256799 and parameters: {'model_name': 'KNNImputer', 'weights': 'distance', 'keep_empty_features': False}. Best is trial 2 with value: 907.2753632256799.
[I 2024-03-02 12:59:35,585] Trial 189 finished with value: 907.2753632256799 and parameters: {'model_name': 'KNNImputer', 'weights': 'distance', 'keep_empty_features': False}. Best is trial 2 with value: 907.2753632256799.
[I 2024-03-02 12:59:36,561] Trial 188 finished with value: 907.2753632256799 and parameters: {'model_name': 'KNNImputer', 'weights': 'distance', 'keep_empty_features': False}. Best is trial 2 with value: 907.2753632256799.
[I 2024-03-02 12:59:37,941] Trial 190 finished with value: 907.2753632256799 and parameters: {'model_name': 'KNNImputer', 'weights': 'distance', 'keep_empty_features': False}. Best is trial 2 with value: 907.2753632256799.
[I 2024-03-02 12:59:39,760] Trial 191 finished with value: 907.2753632256799 and parameters: {'model_name': 'KNNImputer', 'weights': 'distance', 'keep_empty_features': False}. Best is trial 2 with value: 907.2753632256799.
[I 2024-03-02 12:59:52,145] Trial 196 finished with value: inf and parameters: {'model_name': 'GAIN', 'batch_size': 986, 'hint_rate': 0.01, 'alpha': 75, 'iterations': 94638}. Best is trial 2 with value: 907.2753632256799.
[I 2024-03-02 13:00:00,498] Trial 197 finished with value: 1060.293551440942 and parameters: {'model_name': 'SimpleImputer', 'strategy': 'most_frequent'}. Best is trial 2 with value: 907.2753632256799.
[I 2024-03-02 13:00:05,247] Trial 192 finished with value: 907.2753632256799 and parameters: {'model_name': 'KNNImputer', 'weights': 'distance', 'keep_empty_features': False}. Best is trial 2 with value: 907.2753632256799.
[I 2024-03-02 13:00:08,587] Trial 193 finished with value: 907.2753632256799 and parameters: {'model_name': 'KNNImputer', 'weights': 'distance', 'keep_empty_features': False}. Best is trial 2 with value: 907.2753632256799.
[I 2024-03-02 13:00:10,670] Trial 194 finished with value: 907.2753632256799 and parameters: {'model_name': 'KNNImputer', 'weights': 'distance', 'keep_empty_features': False}. Best is trial 2 with value: 907.2753632256799.
[I 2024-03-02 13:00:11,507] Trial 195 finished with value: 907.2753632256799 and parameters: {'model_name': 'KNNImputer', 'weights': 'distance', 'keep_empty_features': False}. Best is trial 2 with value: 907.2753632256799.
[I 2024-03-02 13:00:23,951] Trial 198 finished with value: 907.2753632256799 and parameters: {'model_name': 'KNNImputer', 'weights': 'distance', 'keep_empty_features': False}. Best is trial 2 with value: 907.2753632256799.
[I 2024-03-02 13:00:31,115] Trial 199 finished with value: 907.2753632256799 and parameters: {'model_name': 'KNNImputer', 'weights': 'distance', 'keep_empty_features': False}. Best is trial 2 with value: 907.2753632256799.
[I 2024-03-02 13:02:21,301] Trial 77 finished with value: inf and parameters: {'model_name': 'GAIN', 'batch_size': 4, 'hint_rate': 0.32, 'alpha': 30, 'iterations': 4099}. Best is trial 2 with value: 907.2753632256799.
[I 2024-03-02 13:03:16,300] Trial 83 finished with value: inf and parameters: {'model_name': 'GAIN', 'batch_size': 44, 'hint_rate': 0.97, 'alpha': 36, 'iterations': 3337}. Best is trial 2 with value: 907.2753632256799.
[I 2024-03-02 13:05:00,390] Trial 69 finished with value: 971.4055282867648 and parameters: {'model_name': 'RandomForestImputer', 'max_iter': 8, 'decreasing': False, 'min_samples_split': 0.5, 'min_samples_leaf': 0.5, 'max_features': 0.7000000000000001, 'warm_start': False}. Best is trial 2 with value: 907.2753632256799.
[I 2024-03-02 13:09:33,098] Trial 73 finished with value: 952.3986295220059 and parameters: {'model_name': 'RandomForestImputer', 'max_iter': 10, 'decreasing': False, 'min_samples_split': 0.30000000000000004, 'min_samples_leaf': 0.2, 'max_features': 0.30000000000000004, 'warm_start': False}. Best is trial 2 with value: 907.2753632256799.
[I 2024-03-02 13:15:03,978] Trial 31 finished with value: 3939.4253616469955 and parameters: {'model_name': 'IterativeImputer', 'sample_posterior': True, 'initial_strategy': 'median', 'imputation_order': 'roman'}. Best is trial 2 with value: 907.2753632256799.
[I 2024-03-02 13:15:16,235] Trial 22 finished with value: 3714.391266962169 and parameters: {'model_name': 'IterativeImputer', 'sample_posterior': True, 'initial_strategy': 'constant', 'imputation_order': 'roman'}. Best is trial 2 with value: 907.2753632256799.
[I 2024-03-02 13:15:22,133] Trial 3 finished with value: 3871.709066969718 and parameters: {'model_name': 'IterativeImputer', 'sample_posterior': True, 'initial_strategy': 'constant', 'imputation_order': 'ascending'}. Best is trial 2 with value: 907.2753632256799.
[I 2024-03-02 13:15:31,069] Trial 12 finished with value: 3736.1889519076076 and parameters: {'model_name': 'IterativeImputer', 'sample_posterior': True, 'initial_strategy': 'median', 'imputation_order': 'roman'}. Best is trial 2 with value: 907.2753632256799.
[I 2024-03-02 13:15:44,843] Trial 17 finished with value: 3893.2640307859792 and parameters: {'model_name': 'IterativeImputer', 'sample_posterior': True, 'initial_strategy': 'constant', 'imputation_order': 'descending'}. Best is trial 2 with value: 907.2753632256799.
[I 2024-03-02 13:16:04,907] Trial 76 finished with value: 3997.5186743578365 and parameters: {'model_name': 'IterativeImputer', 'sample_posterior': True, 'initial_strategy': 'constant', 'imputation_order': 'arabic'}. Best is trial 2 with value: 907.2753632256799.
[I 2024-03-02 13:16:06,368] Trial 25 finished with value: 3653.819969462105 and parameters: {'model_name': 'IterativeImputer', 'sample_posterior': True, 'initial_strategy': 'most_frequent', 'imputation_order': 'arabic'}. Best is trial 2 with value: 907.2753632256799.
[I 2024-03-02 13:16:39,661] Trial 78 finished with value: 3842.884199309173 and parameters: {'model_name': 'IterativeImputer', 'sample_posterior': True, 'initial_strategy': 'most_frequent', 'imputation_order': 'arabic'}. Best is trial 2 with value: 907.2753632256799.
[I 2024-03-02 13:17:05,965] Trial 85 finished with value: 3785.36723036682 and parameters: {'model_name': 'IterativeImputer', 'sample_posterior': True, 'initial_strategy': 'median', 'imputation_order': 'ascending'}. Best is trial 2 with value: 907.2753632256799.
[I 2024-03-02 13:17:25,980] Trial 86 finished with value: 3719.1042700092803 and parameters: {'model_name': 'IterativeImputer', 'sample_posterior': True, 'initial_strategy': 'most_frequent', 'imputation_order': 'arabic'}. Best is trial 2 with value: 907.2753632256799.
[I 2024-03-02 13:17:27,552] Trial 84 finished with value: 3648.7057445360865 and parameters: {'model_name': 'IterativeImputer', 'sample_posterior': True, 'initial_strategy': 'median', 'imputation_order': 'random'}. Best is trial 2 with value: 907.2753632256799.
[I 2024-03-02 13:17:31,297] Trial 88 finished with value: 3631.3042172622327 and parameters: {'model_name': 'IterativeImputer', 'sample_posterior': True, 'initial_strategy': 'median', 'imputation_order': 'ascending'}. Best is trial 2 with value: 907.2753632256799.
[I 2024-03-02 13:17:43,509] Trial 90 finished with value: 3794.2948285222096 and parameters: {'model_name': 'IterativeImputer', 'sample_posterior': True, 'initial_strategy': 'mean', 'imputation_order': 'arabic'}. Best is trial 2 with value: 907.2753632256799.
[I 2024-03-02 13:17:53,762] Trial 92 finished with value: 3821.3438929169774 and parameters: {'model_name': 'IterativeImputer', 'sample_posterior': True, 'initial_strategy': 'constant', 'imputation_order': 'random'}. Best is trial 2 with value: 907.2753632256799.
[I 2024-03-02 13:18:02,551] Trial 93 finished with value: 3841.9313297629233 and parameters: {'model_name': 'IterativeImputer', 'sample_posterior': True, 'initial_strategy': 'constant', 'imputation_order': 'descending'}. Best is trial 2 with value: 907.2753632256799.
[I 2024-03-02 13:19:02,565] Trial 94 finished with value: 3774.0818542910565 and parameters: {'model_name': 'IterativeImputer', 'sample_posterior': True, 'initial_strategy': 'median', 'imputation_order': 'ascending'}. Best is trial 2 with value: 907.2753632256799.
[I 2024-03-02 13:19:30,346] Trial 163 finished with value: 977.712217844279 and parameters: {'model_name': 'RandomForestImputer', 'max_iter': 12, 'decreasing': True, 'min_samples_split': 0.7000000000000001, 'min_samples_leaf': 0.4, 'max_features': 0.1, 'warm_start': False}. Best is trial 2 with value: 907.2753632256799.
[I 2024-03-02 13:19:48,036] Trial 97 finished with value: 3609.508070532525 and parameters: {'model_name': 'IterativeImputer', 'sample_posterior': True, 'initial_strategy': 'median', 'imputation_order': 'random'}. Best is trial 2 with value: 907.2753632256799.
[I 2024-03-02 13:21:59,780] Trial 26 finished with value: 969.9687007595514 and parameters: {'model_name': 'RandomForestImputer', 'max_iter': 23, 'decreasing': True, 'min_samples_split': 0.4, 'min_samples_leaf': 0.2, 'max_features': 0.7000000000000001, 'warm_start': False}. Best is trial 2 with value: 907.2753632256799.
[I 2024-03-02 13:30:49,715] Trial 123 finished with value: 946.1027298817886 and parameters: {'model_name': 'RandomForestImputer', 'max_iter': 43, 'decreasing': True, 'min_samples_split': 0.8, 'min_samples_leaf': 0.1, 'max_features': 0.1, 'warm_start': False}. Best is trial 2 with value: 907.2753632256799.
