[I 2023-12-12 16:25:15,724] Trial 196 finished with value: inf and parameters: {'model_name': 'GAIN', 'batch_size': 1, 'hint_rate': 0.060000000000000005, 'alpha': 68, 'iterations': 78360}. Best is trial 7 with value: 1318.834857175494.
[I 2023-12-12 16:25:34,778] Trial 94 finished with value: inf and parameters: {'model_name': 'GAIN', 'batch_size': 1, 'hint_rate': 0.9600000000000001, 'alpha': 98, 'iterations': 81064}. Best is trial 7 with value: 1318.834857175494.
[I 2023-12-12 16:25:42,557] Trial 92 finished with value: inf and parameters: {'model_name': 'GAIN', 'batch_size': 1, 'hint_rate': 0.98, 'alpha': 100, 'iterations': 82246}. Best is trial 7 with value: 1318.834857175494.
[I 2023-12-12 16:25:55,371] Trial 96 finished with value: inf and parameters: {'model_name': 'GAIN', 'batch_size': 1, 'hint_rate': 0.97, 'alpha': 3, 'iterations': 85292}. Best is trial 7 with value: 1318.834857175494.
slurmstepd: error: *** STEP 549711.0 ON esplhpc-cp010 CANCELLED AT 2023-12-12T16:46:38 ***
slurmstepd: error: *** JOB 549711 ON esplhpc-cp010 CANCELLED AT 2023-12-12T16:46:38 ***
