Run: 7
/cm/local/apps/slurm/var/spool/job839682/slurm_script: line 23: /common/ketrong/minconda3/etc/profile.d/conda.sh: No such file or directory
/cm/local/apps/slurm/var/spool/job839682/slurm_script: line 26: $'\nconda create --name tpot2devenv -c conda-forge python=3.10\n': command not found
/cm/local/apps/slurm/var/spool/job839682/slurm_script: line 31: $'\npip install -r requirements.txt\n': command not found
RunStart
2024-04-25 03:04:38.327283: I tensorflow/core/util/port.cc:113] oneDNN custom operations are on. You may see slightly different numerical results due to floating-point round-off errors from different computation orders. To turn them off, set the environment variable `TF_ENABLE_ONEDNN_OPTS=0`.
2024-04-25 03:04:38.362348: E external/local_xla/xla/stream_executor/cuda/cuda_dnn.cc:9261] Unable to register cuDNN factory: Attempting to register factory for plugin cuDNN when one has already been registered
2024-04-25 03:04:38.362368: E external/local_xla/xla/stream_executor/cuda/cuda_fft.cc:607] Unable to register cuFFT factory: Attempting to register factory for plugin cuFFT when one has already been registered
2024-04-25 03:04:38.363568: E external/local_xla/xla/stream_executor/cuda/cuda_blas.cc:1515] Unable to register cuBLAS factory: Attempting to register factory for plugin cuBLAS when one has already been registered
2024-04-25 03:04:38.369406: I tensorflow/core/platform/cpu_feature_guard.cc:182] This TensorFlow binary is optimized to use available CPU instructions in performance-critical operations.
To enable the following instructions: AVX2 AVX512F AVX512_VNNI FMA, in other operations, rebuild TensorFlow with the appropriate compiler flags.
2024-04-25 03:04:41.095400: W tensorflow/compiler/tf2tensorrt/utils/py_utils.cc:38] TF-TRT Warning: Could not find TensorRT
WARNING:tensorflow:From /home/ketrong/miniconda3/envs/tpot2devenv/lib/python3.10/site-packages/tensorflow/python/compat/v2_compat.py:108: disable_resource_variables (from tensorflow.python.ops.variable_scope) is deprecated and will be removed in a future version.
Instructions for updating:
non-resource variables are not supported in the long term
starting loops
working on 
logs/34539/tpot2_base_normal_MAR_0.1
0.04755806922912598
loading data
logs/34539/tpot2_base_normal_MAR_0.1/data/34539_True.pkl
[1 1 1 ... 0 0 0]
       0     ...  1053
0       0.0  ...   0.0
1       0.0  ...   0.0
2       0.0  ...   0.0
3       0.0  ...   0.0
4       0.0  ...   0.0
...     ...  ...   ...
29487   0.0  ...   0.0
29488   0.0  ...   0.0
29489   0.0  ...   0.0
29490   0.0  ...   0.0
29491   0.0  ...   0.0

[29492 rows x 1054 columns]
      0     ...  1053
0      0.0  ...   0.0
1      0.0  ...   0.0
2      0.0  ...   0.0
3      0.0  ...   0.0
4      0.0  ...   0.0
...    ...  ...   ...
3272   0.0  ...   0.0
3273   0.0  ...   0.0
3274   0.0  ...   0.0
3275   0.0  ...   0.0
3276   0.0  ...   0.0

[3277 rows x 1054 columns]
running experiment 1/3 - Does large hyperparameter space improve reconstruction accuracy over simple
[I 2024-04-25 03:08:57,032] A new study created in memory with name: no-name-e84cbd94-1b27-4434-a347-740e7f8716b9
[I 2024-04-25 03:09:40,909] Trial 3 finished with value: 0.08690461389449172 and parameters: {'model_name': 'SimpleImputer', 'strategy': 'constant'}. Best is trial 3 with value: 0.08690461389449172.
[I 2024-04-25 03:09:41,536] Trial 32 finished with value: 0.08690461389449172 and parameters: {'model_name': 'SimpleImputer', 'strategy': 'constant'}. Best is trial 3 with value: 0.08690461389449172.
[I 2024-04-25 03:09:41,711] Trial 15 finished with value: 0.08690461389449172 and parameters: {'model_name': 'SimpleImputer', 'strategy': 'constant'}. Best is trial 3 with value: 0.08690461389449172.
[I 2024-04-25 03:09:42,073] Trial 4 finished with value: 0.08690461389449172 and parameters: {'model_name': 'SimpleImputer', 'strategy': 'constant'}. Best is trial 3 with value: 0.08690461389449172.
[I 2024-04-25 03:09:46,001] Trial 14 finished with value: 0.08690461389449172 and parameters: {'model_name': 'SimpleImputer', 'strategy': 'constant'}. Best is trial 3 with value: 0.08690461389449172.
[I 2024-04-25 03:09:46,038] Trial 25 finished with value: 0.08690461389449172 and parameters: {'model_name': 'SimpleImputer', 'strategy': 'constant'}. Best is trial 3 with value: 0.08690461389449172.
[I 2024-04-25 03:09:47,023] Trial 26 finished with value: 0.08690461389449172 and parameters: {'model_name': 'SimpleImputer', 'strategy': 'constant'}. Best is trial 3 with value: 0.08690461389449172.
[I 2024-04-25 03:09:48,138] Trial 43 finished with value: 0.08690461389449172 and parameters: {'model_name': 'SimpleImputer', 'strategy': 'constant'}. Best is trial 3 with value: 0.08690461389449172.
[I 2024-04-25 03:09:48,825] Trial 36 finished with value: 0.08690461389449172 and parameters: {'model_name': 'SimpleImputer', 'strategy': 'constant'}. Best is trial 3 with value: 0.08690461389449172.
[I 2024-04-25 03:09:49,160] Trial 0 finished with value: 0.07835155461994266 and parameters: {'model_name': 'SimpleImputer', 'strategy': 'mean'}. Best is trial 0 with value: 0.07835155461994266.
[I 2024-04-25 03:09:49,494] Trial 42 finished with value: 0.08690461389449172 and parameters: {'model_name': 'SimpleImputer', 'strategy': 'constant'}. Best is trial 0 with value: 0.07835155461994266.
[I 2024-04-25 03:09:50,288] Trial 33 finished with value: 0.08690461389449172 and parameters: {'model_name': 'SimpleImputer', 'strategy': 'constant'}. Best is trial 0 with value: 0.07835155461994266.
[I 2024-04-25 03:09:50,876] Trial 38 finished with value: 0.08690461389449172 and parameters: {'model_name': 'SimpleImputer', 'strategy': 'constant'}. Best is trial 0 with value: 0.07835155461994266.
[I 2024-04-25 03:09:52,037] Trial 47 finished with value: 0.08690461389449172 and parameters: {'model_name': 'SimpleImputer', 'strategy': 'constant'}. Best is trial 0 with value: 0.07835155461994266.
[I 2024-04-25 03:09:52,909] Trial 13 finished with value: 0.07835155461994266 and parameters: {'model_name': 'SimpleImputer', 'strategy': 'mean'}. Best is trial 0 with value: 0.07835155461994266.
[I 2024-04-25 03:09:54,082] Trial 1 finished with value: 0.07835155461994266 and parameters: {'model_name': 'SimpleImputer', 'strategy': 'mean'}. Best is trial 0 with value: 0.07835155461994266.
[I 2024-04-25 03:09:54,639] Trial 19 finished with value: 0.07835155461994266 and parameters: {'model_name': 'SimpleImputer', 'strategy': 'mean'}. Best is trial 0 with value: 0.07835155461994266.
[I 2024-04-25 03:09:55,039] Trial 2 finished with value: 0.07835155461994266 and parameters: {'model_name': 'SimpleImputer', 'strategy': 'mean'}. Best is trial 0 with value: 0.07835155461994266.
[I 2024-04-25 03:09:55,447] Trial 10 finished with value: 0.07835155461994266 and parameters: {'model_name': 'SimpleImputer', 'strategy': 'mean'}. Best is trial 0 with value: 0.07835155461994266.
[I 2024-04-25 03:09:57,646] Trial 22 finished with value: 0.07835155461994266 and parameters: {'model_name': 'SimpleImputer', 'strategy': 'mean'}. Best is trial 0 with value: 0.07835155461994266.
[I 2024-04-25 03:09:58,814] Trial 6 finished with value: 0.07835155461994266 and parameters: {'model_name': 'SimpleImputer', 'strategy': 'mean'}. Best is trial 0 with value: 0.07835155461994266.
[I 2024-04-25 03:09:59,322] Trial 20 finished with value: 0.07835155461994266 and parameters: {'model_name': 'SimpleImputer', 'strategy': 'mean'}. Best is trial 0 with value: 0.07835155461994266.
[I 2024-04-25 03:10:00,264] Trial 27 finished with value: 0.07835155461994266 and parameters: {'model_name': 'SimpleImputer', 'strategy': 'mean'}. Best is trial 0 with value: 0.07835155461994266.
[I 2024-04-25 03:10:01,323] Trial 24 finished with value: 0.07835155461994266 and parameters: {'model_name': 'SimpleImputer', 'strategy': 'mean'}. Best is trial 0 with value: 0.07835155461994266.
[I 2024-04-25 03:10:02,869] Trial 30 finished with value: 0.07835155461994266 and parameters: {'model_name': 'SimpleImputer', 'strategy': 'mean'}. Best is trial 0 with value: 0.07835155461994266.
[I 2024-04-25 03:10:03,900] Trial 37 finished with value: 0.07835155461994266 and parameters: {'model_name': 'SimpleImputer', 'strategy': 'mean'}. Best is trial 0 with value: 0.07835155461994266.
[I 2024-04-25 03:10:05,116] Trial 46 finished with value: 0.07835155461994266 and parameters: {'model_name': 'SimpleImputer', 'strategy': 'mean'}. Best is trial 0 with value: 0.07835155461994266.
[I 2024-04-25 03:10:22,261] Trial 8 finished with value: 0.08027220246173179 and parameters: {'model_name': 'SimpleImputer', 'strategy': 'median'}. Best is trial 0 with value: 0.07835155461994266.
[I 2024-04-25 03:10:22,943] Trial 48 finished with value: 0.08690461389449172 and parameters: {'model_name': 'SimpleImputer', 'strategy': 'constant'}. Best is trial 0 with value: 0.07835155461994266.
[I 2024-04-25 03:10:24,635] Trial 9 finished with value: 0.08027220246173179 and parameters: {'model_name': 'SimpleImputer', 'strategy': 'median'}. Best is trial 0 with value: 0.07835155461994266.
[I 2024-04-25 03:10:24,826] Trial 5 finished with value: 0.08027220246173179 and parameters: {'model_name': 'SimpleImputer', 'strategy': 'median'}. Best is trial 0 with value: 0.07835155461994266.
[I 2024-04-25 03:10:25,148] Trial 17 finished with value: 0.08027220246173179 and parameters: {'model_name': 'SimpleImputer', 'strategy': 'median'}. Best is trial 0 with value: 0.07835155461994266.
[I 2024-04-25 03:10:25,413] Trial 49 finished with value: 0.08690461389449172 and parameters: {'model_name': 'SimpleImputer', 'strategy': 'constant'}. Best is trial 0 with value: 0.07835155461994266.
[I 2024-04-25 03:10:26,391] Trial 52 finished with value: 0.08690461389449172 and parameters: {'model_name': 'SimpleImputer', 'strategy': 'constant'}. Best is trial 0 with value: 0.07835155461994266.
[I 2024-04-25 03:10:26,887] Trial 23 finished with value: 0.08027220246173179 and parameters: {'model_name': 'SimpleImputer', 'strategy': 'median'}. Best is trial 0 with value: 0.07835155461994266.
[I 2024-04-25 03:10:27,444] Trial 40 finished with value: 0.08027220246173179 and parameters: {'model_name': 'SimpleImputer', 'strategy': 'median'}. Best is trial 0 with value: 0.07835155461994266.
[I 2024-04-25 03:10:28,310] Trial 18 finished with value: 0.08027220246173179 and parameters: {'model_name': 'SimpleImputer', 'strategy': 'median'}. Best is trial 0 with value: 0.07835155461994266.
[I 2024-04-25 03:10:29,940] Trial 34 finished with value: 0.08027220246173179 and parameters: {'model_name': 'SimpleImputer', 'strategy': 'median'}. Best is trial 0 with value: 0.07835155461994266.
[I 2024-04-25 03:10:30,161] Trial 7 finished with value: 0.08027220246173179 and parameters: {'model_name': 'SimpleImputer', 'strategy': 'median'}. Best is trial 0 with value: 0.07835155461994266.
[I 2024-04-25 03:10:30,517] Trial 16 finished with value: 0.08027220246173179 and parameters: {'model_name': 'SimpleImputer', 'strategy': 'median'}. Best is trial 0 with value: 0.07835155461994266.
[I 2024-04-25 03:10:30,960] Trial 41 finished with value: 0.08027220246173179 and parameters: {'model_name': 'SimpleImputer', 'strategy': 'median'}. Best is trial 0 with value: 0.07835155461994266.
[I 2024-04-25 03:10:31,484] Trial 35 finished with value: 0.08027220246173179 and parameters: {'model_name': 'SimpleImputer', 'strategy': 'median'}. Best is trial 0 with value: 0.07835155461994266.
[I 2024-04-25 03:10:31,598] Trial 29 finished with value: 0.08027220246173179 and parameters: {'model_name': 'SimpleImputer', 'strategy': 'median'}. Best is trial 0 with value: 0.07835155461994266.
[I 2024-04-25 03:10:32,613] Trial 54 finished with value: 0.08690461389449172 and parameters: {'model_name': 'SimpleImputer', 'strategy': 'constant'}. Best is trial 0 with value: 0.07835155461994266.
[I 2024-04-25 03:10:35,950] Trial 50 finished with value: 0.07835155461994266 and parameters: {'model_name': 'SimpleImputer', 'strategy': 'mean'}. Best is trial 0 with value: 0.07835155461994266.
[I 2024-04-25 03:10:38,121] Trial 60 finished with value: 0.07835155461994266 and parameters: {'model_name': 'SimpleImputer', 'strategy': 'mean'}. Best is trial 0 with value: 0.07835155461994266.
[I 2024-04-25 03:10:38,814] Trial 56 finished with value: 0.07835155461994266 and parameters: {'model_name': 'SimpleImputer', 'strategy': 'mean'}. Best is trial 0 with value: 0.07835155461994266.
[I 2024-04-25 03:10:39,135] Trial 64 finished with value: 0.07835155461994266 and parameters: {'model_name': 'SimpleImputer', 'strategy': 'mean'}. Best is trial 0 with value: 0.07835155461994266.
[I 2024-04-25 03:10:39,423] Trial 59 finished with value: 0.07835155461994266 and parameters: {'model_name': 'SimpleImputer', 'strategy': 'mean'}. Best is trial 0 with value: 0.07835155461994266.
[I 2024-04-25 03:10:39,730] Trial 63 finished with value: 0.07835155461994266 and parameters: {'model_name': 'SimpleImputer', 'strategy': 'mean'}. Best is trial 0 with value: 0.07835155461994266.
[I 2024-04-25 03:10:40,137] Trial 57 finished with value: 0.07835155461994266 and parameters: {'model_name': 'SimpleImputer', 'strategy': 'mean'}. Best is trial 0 with value: 0.07835155461994266.
[I 2024-04-25 03:10:40,830] Trial 58 finished with value: 0.07835155461994266 and parameters: {'model_name': 'SimpleImputer', 'strategy': 'mean'}. Best is trial 0 with value: 0.07835155461994266.
[I 2024-04-25 03:10:42,071] Trial 61 finished with value: 0.07835155461994266 and parameters: {'model_name': 'SimpleImputer', 'strategy': 'mean'}. Best is trial 0 with value: 0.07835155461994266.
[I 2024-04-25 03:10:42,596] Trial 62 finished with value: 0.07835155461994266 and parameters: {'model_name': 'SimpleImputer', 'strategy': 'mean'}. Best is trial 0 with value: 0.07835155461994266.
[I 2024-04-25 03:10:50,146] Trial 84 finished with value: 0.07835155461994266 and parameters: {'model_name': 'SimpleImputer', 'strategy': 'mean'}. Best is trial 0 with value: 0.07835155461994266.
[I 2024-04-25 03:10:52,666] Trial 51 finished with value: 0.08027220246173179 and parameters: {'model_name': 'SimpleImputer', 'strategy': 'median'}. Best is trial 0 with value: 0.07835155461994266.
[I 2024-04-25 03:10:56,548] Trial 65 finished with value: 0.08027220246173179 and parameters: {'model_name': 'SimpleImputer', 'strategy': 'median'}. Best is trial 0 with value: 0.07835155461994266.
[I 2024-04-25 03:10:57,045] Trial 69 finished with value: 0.08027220246173179 and parameters: {'model_name': 'SimpleImputer', 'strategy': 'median'}. Best is trial 0 with value: 0.07835155461994266.
[I 2024-04-25 03:10:57,917] Trial 72 finished with value: 0.08027220246173179 and parameters: {'model_name': 'SimpleImputer', 'strategy': 'median'}. Best is trial 0 with value: 0.07835155461994266.
[I 2024-04-25 03:10:58,280] Trial 68 finished with value: 0.08027220246173179 and parameters: {'model_name': 'SimpleImputer', 'strategy': 'median'}. Best is trial 0 with value: 0.07835155461994266.
[I 2024-04-25 03:10:58,556] Trial 70 finished with value: 0.08027220246173179 and parameters: {'model_name': 'SimpleImputer', 'strategy': 'median'}. Best is trial 0 with value: 0.07835155461994266.
[I 2024-04-25 03:10:59,477] Trial 71 finished with value: 0.08027220246173179 and parameters: {'model_name': 'SimpleImputer', 'strategy': 'median'}. Best is trial 0 with value: 0.07835155461994266.
[I 2024-04-25 03:10:59,759] Trial 73 finished with value: 0.08027220246173179 and parameters: {'model_name': 'SimpleImputer', 'strategy': 'median'}. Best is trial 0 with value: 0.07835155461994266.
[I 2024-04-25 03:11:00,498] Trial 74 finished with value: 0.08027220246173179 and parameters: {'model_name': 'SimpleImputer', 'strategy': 'median'}. Best is trial 0 with value: 0.07835155461994266.
[I 2024-04-25 03:11:03,111] Trial 102 finished with value: 0.07835155461994266 and parameters: {'model_name': 'SimpleImputer', 'strategy': 'mean'}. Best is trial 0 with value: 0.07835155461994266.
[I 2024-04-25 03:18:17,580] Trial 75 finished with value: 0.08027220246173179 and parameters: {'model_name': 'SimpleImputer', 'strategy': 'most_frequent'}. Best is trial 0 with value: 0.07835155461994266.
[I 2024-04-25 03:18:21,994] Trial 11 finished with value: 0.08027220246173179 and parameters: {'model_name': 'SimpleImputer', 'strategy': 'most_frequent'}. Best is trial 0 with value: 0.07835155461994266.
[I 2024-04-25 03:18:22,792] Trial 87 finished with value: 0.08027220246173179 and parameters: {'model_name': 'SimpleImputer', 'strategy': 'most_frequent'}. Best is trial 0 with value: 0.07835155461994266.
[I 2024-04-25 03:18:25,463] Trial 100 finished with value: 0.08027220246173179 and parameters: {'model_name': 'SimpleImputer', 'strategy': 'most_frequent'}. Best is trial 0 with value: 0.07835155461994266.
[I 2024-04-25 03:18:28,368] Trial 88 finished with value: 0.08027220246173179 and parameters: {'model_name': 'SimpleImputer', 'strategy': 'most_frequent'}. Best is trial 0 with value: 0.07835155461994266.
[I 2024-04-25 03:18:30,605] Trial 104 finished with value: 0.08027220246173179 and parameters: {'model_name': 'SimpleImputer', 'strategy': 'most_frequent'}. Best is trial 0 with value: 0.07835155461994266.
[I 2024-04-25 03:18:31,505] Trial 31 finished with value: 0.08027220246173179 and parameters: {'model_name': 'SimpleImputer', 'strategy': 'most_frequent'}. Best is trial 0 with value: 0.07835155461994266.
[I 2024-04-25 03:18:33,069] Trial 78 finished with value: 0.08027220246173179 and parameters: {'model_name': 'SimpleImputer', 'strategy': 'most_frequent'}. Best is trial 0 with value: 0.07835155461994266.
[I 2024-04-25 03:18:33,402] Trial 115 finished with value: 0.07835155461994266 and parameters: {'model_name': 'SimpleImputer', 'strategy': 'mean'}. Best is trial 0 with value: 0.07835155461994266.
[I 2024-04-25 03:18:34,842] Trial 55 finished with value: 0.08027220246173179 and parameters: {'model_name': 'SimpleImputer', 'strategy': 'most_frequent'}. Best is trial 0 with value: 0.07835155461994266.
[I 2024-04-25 03:18:38,303] Trial 77 finished with value: 0.08027220246173179 and parameters: {'model_name': 'SimpleImputer', 'strategy': 'most_frequent'}. Best is trial 0 with value: 0.07835155461994266.
[I 2024-04-25 03:18:39,163] Trial 116 finished with value: 0.07835155461994266 and parameters: {'model_name': 'SimpleImputer', 'strategy': 'mean'}. Best is trial 0 with value: 0.07835155461994266.
[I 2024-04-25 03:18:40,484] Trial 82 finished with value: 0.08027220246173179 and parameters: {'model_name': 'SimpleImputer', 'strategy': 'most_frequent'}. Best is trial 0 with value: 0.07835155461994266.
[I 2024-04-25 03:18:42,526] Trial 99 finished with value: 0.08027220246173179 and parameters: {'model_name': 'SimpleImputer', 'strategy': 'most_frequent'}. Best is trial 0 with value: 0.07835155461994266.
[I 2024-04-25 03:18:44,635] Trial 45 finished with value: 0.08027220246173179 and parameters: {'model_name': 'SimpleImputer', 'strategy': 'most_frequent'}. Best is trial 0 with value: 0.07835155461994266.
[I 2024-04-25 03:18:45,008] Trial 21 finished with value: 0.08027220246173179 and parameters: {'model_name': 'SimpleImputer', 'strategy': 'most_frequent'}. Best is trial 0 with value: 0.07835155461994266.
[I 2024-04-25 03:18:45,358] Trial 117 finished with value: 0.07835155461994266 and parameters: {'model_name': 'SimpleImputer', 'strategy': 'mean'}. Best is trial 0 with value: 0.07835155461994266.
[I 2024-04-25 03:18:49,978] Trial 119 finished with value: 0.07835155461994266 and parameters: {'model_name': 'SimpleImputer', 'strategy': 'mean'}. Best is trial 0 with value: 0.07835155461994266.
[I 2024-04-25 03:18:50,828] Trial 118 finished with value: 0.07835155461994266 and parameters: {'model_name': 'SimpleImputer', 'strategy': 'mean'}. Best is trial 0 with value: 0.07835155461994266.
[I 2024-04-25 03:18:51,176] Trial 86 finished with value: 0.08027220246173179 and parameters: {'model_name': 'SimpleImputer', 'strategy': 'most_frequent'}. Best is trial 0 with value: 0.07835155461994266.
[I 2024-04-25 03:18:54,051] Trial 121 finished with value: 0.07835155461994266 and parameters: {'model_name': 'SimpleImputer', 'strategy': 'mean'}. Best is trial 0 with value: 0.07835155461994266.
[I 2024-04-25 03:18:54,850] Trial 120 finished with value: 0.07835155461994266 and parameters: {'model_name': 'SimpleImputer', 'strategy': 'mean'}. Best is trial 0 with value: 0.07835155461994266.
[I 2024-04-25 03:18:56,080] Trial 122 finished with value: 0.07835155461994266 and parameters: {'model_name': 'SimpleImputer', 'strategy': 'mean'}. Best is trial 0 with value: 0.07835155461994266.
[I 2024-04-25 03:19:00,272] Trial 123 finished with value: 0.07835155461994266 and parameters: {'model_name': 'SimpleImputer', 'strategy': 'mean'}. Best is trial 0 with value: 0.07835155461994266.
[I 2024-04-25 03:19:01,054] Trial 111 finished with value: 0.08027220246173179 and parameters: {'model_name': 'SimpleImputer', 'strategy': 'most_frequent'}. Best is trial 0 with value: 0.07835155461994266.
[I 2024-04-25 03:19:02,102] Trial 124 finished with value: 0.07835155461994266 and parameters: {'model_name': 'SimpleImputer', 'strategy': 'mean'}. Best is trial 0 with value: 0.07835155461994266.
[I 2024-04-25 03:19:05,764] Trial 125 finished with value: 0.07835155461994266 and parameters: {'model_name': 'SimpleImputer', 'strategy': 'mean'}. Best is trial 0 with value: 0.07835155461994266.
[I 2024-04-25 03:19:07,562] Trial 126 finished with value: 0.07835155461994266 and parameters: {'model_name': 'SimpleImputer', 'strategy': 'mean'}. Best is trial 0 with value: 0.07835155461994266.
[I 2024-04-25 03:19:08,976] Trial 127 finished with value: 0.07835155461994266 and parameters: {'model_name': 'SimpleImputer', 'strategy': 'mean'}. Best is trial 0 with value: 0.07835155461994266.
