[I 2024-01-04 22:54:44,377] Trial 92 finished with value: 51.12108757968804 and parameters: {'model_name': 'SimpleImputer', 'strategy': 'most_frequent'}. Best is trial 4 with value: 50.82902870259025.
[I 2024-01-04 22:54:44,701] Trial 117 finished with value: 50.82902870259025 and parameters: {'model_name': 'SimpleImputer', 'strategy': 'median'}. Best is trial 4 with value: 50.82902870259025.
[I 2024-01-04 22:54:45,140] Trial 97 finished with value: 51.12108757968804 and parameters: {'model_name': 'SimpleImputer', 'strategy': 'most_frequent'}. Best is trial 4 with value: 50.82902870259025.
[I 2024-01-04 22:54:45,435] Trial 89 finished with value: 51.12108757968804 and parameters: {'model_name': 'SimpleImputer', 'strategy': 'most_frequent'}. Best is trial 4 with value: 50.82902870259025.
[I 2024-01-04 22:54:45,645] Trial 118 finished with value: 50.82902870259025 and parameters: {'model_name': 'SimpleImputer', 'strategy': 'median'}. Best is trial 4 with value: 50.82902870259025.
[I 2024-01-04 22:54:46,155] Trial 91 finished with value: 51.12108757968804 and parameters: {'model_name': 'SimpleImputer', 'strategy': 'most_frequent'}. Best is trial 4 with value: 50.82902870259025.
[I 2024-01-04 22:54:46,416] Trial 94 finished with value: 51.12108757968804 and parameters: {'model_name': 'SimpleImputer', 'strategy': 'most_frequent'}. Best is trial 4 with value: 50.82902870259025.
[I 2024-01-04 22:54:46,654] Trial 93 finished with value: 51.12108757968804 and parameters: {'model_name': 'SimpleImputer', 'strategy': 'most_frequent'}. Best is trial 4 with value: 50.82902870259025.
[I 2024-01-04 22:54:46,927] Trial 119 finished with value: 50.82902870259025 and parameters: {'model_name': 'SimpleImputer', 'strategy': 'median'}. Best is trial 4 with value: 50.82902870259025.
[I 2024-01-04 22:54:47,134] Trial 90 finished with value: 51.12108757968804 and parameters: {'model_name': 'SimpleImputer', 'strategy': 'most_frequent'}. Best is trial 4 with value: 50.82902870259025.
[I 2024-01-04 22:54:47,461] Trial 121 finished with value: 50.82902870259025 and parameters: {'model_name': 'SimpleImputer', 'strategy': 'median'}. Best is trial 4 with value: 50.82902870259025.
[I 2024-01-04 22:54:47,669] Trial 120 finished with value: 50.82902870259025 and parameters: {'model_name': 'SimpleImputer', 'strategy': 'median'}. Best is trial 4 with value: 50.82902870259025.
[I 2024-01-04 22:54:48,024] Trial 122 finished with value: 50.82902870259025 and parameters: {'model_name': 'SimpleImputer', 'strategy': 'median'}. Best is trial 4 with value: 50.82902870259025.
[I 2024-01-04 22:54:48,252] Trial 99 finished with value: 51.12108757968804 and parameters: {'model_name': 'SimpleImputer', 'strategy': 'most_frequent'}. Best is trial 4 with value: 50.82902870259025.
[I 2024-01-04 22:54:48,458] Trial 96 finished with value: 51.12108757968804 and parameters: {'model_name': 'SimpleImputer', 'strategy': 'most_frequent'}. Best is trial 4 with value: 50.82902870259025.
[I 2024-01-04 22:54:48,760] Trial 98 finished with value: 51.12108757968804 and parameters: {'model_name': 'SimpleImputer', 'strategy': 'most_frequent'}. Best is trial 4 with value: 50.82902870259025.
[I 2024-01-04 22:54:49,018] Trial 95 finished with value: 51.12108757968804 and parameters: {'model_name': 'SimpleImputer', 'strategy': 'most_frequent'}. Best is trial 4 with value: 50.82902870259025.
[I 2024-01-04 22:54:49,322] Trial 126 finished with value: 50.82902870259025 and parameters: {'model_name': 'SimpleImputer', 'strategy': 'median'}. Best is trial 4 with value: 50.82902870259025.
[I 2024-01-04 22:54:49,614] Trial 102 finished with value: 51.12108757968804 and parameters: {'model_name': 'SimpleImputer', 'strategy': 'most_frequent'}. Best is trial 4 with value: 50.82902870259025.
[I 2024-01-04 22:54:50,062] Trial 125 finished with value: 50.82902870259025 and parameters: {'model_name': 'SimpleImputer', 'strategy': 'median'}. Best is trial 4 with value: 50.82902870259025.
[I 2024-01-04 22:54:50,282] Trial 123 finished with value: 50.82902870259025 and parameters: {'model_name': 'SimpleImputer', 'strategy': 'median'}. Best is trial 4 with value: 50.82902870259025.
[I 2024-01-04 22:54:50,528] Trial 100 finished with value: 51.12108757968804 and parameters: {'model_name': 'SimpleImputer', 'strategy': 'most_frequent'}. Best is trial 4 with value: 50.82902870259025.
[I 2024-01-04 22:54:50,740] Trial 124 finished with value: 50.82902870259025 and parameters: {'model_name': 'SimpleImputer', 'strategy': 'median'}. Best is trial 4 with value: 50.82902870259025.
[I 2024-01-04 22:54:50,995] Trial 133 finished with value: 50.82902870259025 and parameters: {'model_name': 'SimpleImputer', 'strategy': 'median'}. Best is trial 4 with value: 50.82902870259025.
[I 2024-01-04 22:54:51,347] Trial 127 finished with value: 50.82902870259025 and parameters: {'model_name': 'SimpleImputer', 'strategy': 'median'}. Best is trial 4 with value: 50.82902870259025.
[I 2024-01-04 22:54:51,637] Trial 129 finished with value: 50.82902870259025 and parameters: {'model_name': 'SimpleImputer', 'strategy': 'median'}. Best is trial 4 with value: 50.82902870259025.
[I 2024-01-04 22:54:51,933] Trial 130 finished with value: 50.82902870259025 and parameters: {'model_name': 'SimpleImputer', 'strategy': 'median'}. Best is trial 4 with value: 50.82902870259025.
[I 2024-01-04 22:54:52,180] Trial 135 finished with value: 50.82902870259025 and parameters: {'model_name': 'SimpleImputer', 'strategy': 'median'}. Best is trial 4 with value: 50.82902870259025.
[I 2024-01-04 22:54:52,501] Trial 131 finished with value: 50.82902870259025 and parameters: {'model_name': 'SimpleImputer', 'strategy': 'median'}. Best is trial 4 with value: 50.82902870259025.
[I 2024-01-04 22:54:52,716] Trial 128 finished with value: 50.82902870259025 and parameters: {'model_name': 'SimpleImputer', 'strategy': 'median'}. Best is trial 4 with value: 50.82902870259025.
[I 2024-01-04 22:54:52,919] Trial 101 finished with value: 51.12108757968804 and parameters: {'model_name': 'SimpleImputer', 'strategy': 'most_frequent'}. Best is trial 4 with value: 50.82902870259025.
[I 2024-01-04 22:54:53,182] Trial 138 finished with value: 50.82902870259025 and parameters: {'model_name': 'SimpleImputer', 'strategy': 'median'}. Best is trial 4 with value: 50.82902870259025.
[I 2024-01-04 22:54:53,479] Trial 132 finished with value: 50.82902870259025 and parameters: {'model_name': 'SimpleImputer', 'strategy': 'median'}. Best is trial 4 with value: 50.82902870259025.
[I 2024-01-04 22:54:53,704] Trial 137 finished with value: 50.82902870259025 and parameters: {'model_name': 'SimpleImputer', 'strategy': 'median'}. Best is trial 4 with value: 50.82902870259025.
[I 2024-01-04 22:54:53,986] Trial 103 finished with value: 51.12108757968804 and parameters: {'model_name': 'SimpleImputer', 'strategy': 'most_frequent'}. Best is trial 4 with value: 50.82902870259025.
[I 2024-01-04 22:54:54,207] Trial 107 finished with value: 51.12108757968804 and parameters: {'model_name': 'SimpleImputer', 'strategy': 'most_frequent'}. Best is trial 4 with value: 50.82902870259025.
[I 2024-01-04 22:54:54,456] Trial 140 finished with value: 50.82902870259025 and parameters: {'model_name': 'SimpleImputer', 'strategy': 'median'}. Best is trial 4 with value: 50.82902870259025.
[I 2024-01-04 22:54:54,665] Trial 108 finished with value: 51.12108757968804 and parameters: {'model_name': 'SimpleImputer', 'strategy': 'most_frequent'}. Best is trial 4 with value: 50.82902870259025.
[I 2024-01-04 22:54:54,888] Trial 142 finished with value: 50.82902870259025 and parameters: {'model_name': 'SimpleImputer', 'strategy': 'median'}. Best is trial 4 with value: 50.82902870259025.
[I 2024-01-04 22:54:55,117] Trial 139 finished with value: 50.82902870259025 and parameters: {'model_name': 'SimpleImputer', 'strategy': 'median'}. Best is trial 4 with value: 50.82902870259025.
[I 2024-01-04 22:54:55,338] Trial 157 finished with value: 4351.102398221441 and parameters: {'model_name': 'SimpleImputer', 'strategy': 'constant'}. Best is trial 4 with value: 50.82902870259025.
[I 2024-01-04 22:54:55,614] Trial 136 finished with value: 50.82902870259025 and parameters: {'model_name': 'SimpleImputer', 'strategy': 'median'}. Best is trial 4 with value: 50.82902870259025.
[I 2024-01-04 22:54:55,853] Trial 163 finished with value: 4351.102398221441 and parameters: {'model_name': 'SimpleImputer', 'strategy': 'constant'}. Best is trial 4 with value: 50.82902870259025.
[I 2024-01-04 22:54:56,146] Trial 143 finished with value: 50.82902870259025 and parameters: {'model_name': 'SimpleImputer', 'strategy': 'median'}. Best is trial 4 with value: 50.82902870259025.
[I 2024-01-04 22:54:56,356] Trial 141 finished with value: 50.82902870259025 and parameters: {'model_name': 'SimpleImputer', 'strategy': 'median'}. Best is trial 4 with value: 50.82902870259025.
[I 2024-01-04 22:54:56,585] Trial 164 finished with value: 4351.102398221441 and parameters: {'model_name': 'SimpleImputer', 'strategy': 'constant'}. Best is trial 4 with value: 50.82902870259025.
[I 2024-01-04 22:54:56,945] Trial 134 finished with value: 50.82902870259025 and parameters: {'model_name': 'SimpleImputer', 'strategy': 'median'}. Best is trial 4 with value: 50.82902870259025.
[I 2024-01-04 22:54:57,174] Trial 145 finished with value: 50.82902870259025 and parameters: {'model_name': 'SimpleImputer', 'strategy': 'median'}. Best is trial 4 with value: 50.82902870259025.
[I 2024-01-04 22:54:57,537] Trial 147 finished with value: 50.82902870259025 and parameters: {'model_name': 'SimpleImputer', 'strategy': 'median'}. Best is trial 4 with value: 50.82902870259025.
[I 2024-01-04 22:54:57,749] Trial 162 finished with value: 4351.102398221441 and parameters: {'model_name': 'SimpleImputer', 'strategy': 'constant'}. Best is trial 4 with value: 50.82902870259025.
[I 2024-01-04 22:54:58,006] Trial 106 finished with value: 51.12108757968804 and parameters: {'model_name': 'SimpleImputer', 'strategy': 'most_frequent'}. Best is trial 4 with value: 50.82902870259025.
[I 2024-01-04 22:54:58,241] Trial 166 finished with value: 4351.102398221441 and parameters: {'model_name': 'SimpleImputer', 'strategy': 'constant'}. Best is trial 4 with value: 50.82902870259025.
[I 2024-01-04 22:54:58,565] Trial 144 finished with value: 50.82902870259025 and parameters: {'model_name': 'SimpleImputer', 'strategy': 'median'}. Best is trial 4 with value: 50.82902870259025.
[I 2024-01-04 22:54:58,783] Trial 151 finished with value: 50.82902870259025 and parameters: {'model_name': 'SimpleImputer', 'strategy': 'median'}. Best is trial 4 with value: 50.82902870259025.
[I 2024-01-04 22:54:58,998] Trial 146 finished with value: 50.82902870259025 and parameters: {'model_name': 'SimpleImputer', 'strategy': 'median'}. Best is trial 4 with value: 50.82902870259025.
[I 2024-01-04 22:54:59,346] Trial 168 finished with value: 4351.102398221441 and parameters: {'model_name': 'SimpleImputer', 'strategy': 'constant'}. Best is trial 4 with value: 50.82902870259025.
[I 2024-01-04 22:54:59,726] Trial 149 finished with value: 50.82902870259025 and parameters: {'model_name': 'SimpleImputer', 'strategy': 'median'}. Best is trial 4 with value: 50.82902870259025.
[I 2024-01-04 22:54:59,952] Trial 148 finished with value: 50.82902870259025 and parameters: {'model_name': 'SimpleImputer', 'strategy': 'median'}. Best is trial 4 with value: 50.82902870259025.
[I 2024-01-04 22:55:00,170] Trial 169 finished with value: 4351.102398221441 and parameters: {'model_name': 'SimpleImputer', 'strategy': 'constant'}. Best is trial 4 with value: 50.82902870259025.
[I 2024-01-04 22:55:00,565] Trial 155 finished with value: 50.82902870259025 and parameters: {'model_name': 'SimpleImputer', 'strategy': 'median'}. Best is trial 4 with value: 50.82902870259025.
[I 2024-01-04 22:55:00,832] Trial 171 finished with value: 4351.102398221441 and parameters: {'model_name': 'SimpleImputer', 'strategy': 'constant'}. Best is trial 4 with value: 50.82902870259025.
[I 2024-01-04 22:55:01,095] Trial 178 finished with value: 4351.102398221441 and parameters: {'model_name': 'SimpleImputer', 'strategy': 'constant'}. Best is trial 4 with value: 50.82902870259025.
[I 2024-01-04 22:55:01,330] Trial 150 finished with value: 50.82902870259025 and parameters: {'model_name': 'SimpleImputer', 'strategy': 'median'}. Best is trial 4 with value: 50.82902870259025.
[I 2024-01-04 22:55:01,549] Trial 159 finished with value: 50.82902870259025 and parameters: {'model_name': 'SimpleImputer', 'strategy': 'median'}. Best is trial 4 with value: 50.82902870259025.
[I 2024-01-04 22:55:01,765] Trial 175 finished with value: 4351.102398221441 and parameters: {'model_name': 'SimpleImputer', 'strategy': 'constant'}. Best is trial 4 with value: 50.82902870259025.
[I 2024-01-04 22:55:02,007] Trial 177 finished with value: 4351.102398221441 and parameters: {'model_name': 'SimpleImputer', 'strategy': 'constant'}. Best is trial 4 with value: 50.82902870259025.
[I 2024-01-04 22:55:02,218] Trial 152 finished with value: 50.82902870259025 and parameters: {'model_name': 'SimpleImputer', 'strategy': 'median'}. Best is trial 4 with value: 50.82902870259025.
[I 2024-01-04 22:55:02,452] Trial 176 finished with value: 4351.102398221441 and parameters: {'model_name': 'SimpleImputer', 'strategy': 'constant'}. Best is trial 4 with value: 50.82902870259025.
[I 2024-01-04 22:55:02,791] Trial 156 finished with value: 50.82902870259025 and parameters: {'model_name': 'SimpleImputer', 'strategy': 'median'}. Best is trial 4 with value: 50.82902870259025.
[I 2024-01-04 22:55:03,064] Trial 158 finished with value: 50.82902870259025 and parameters: {'model_name': 'SimpleImputer', 'strategy': 'median'}. Best is trial 4 with value: 50.82902870259025.
[I 2024-01-04 22:55:03,262] Trial 183 finished with value: 4351.102398221441 and parameters: {'model_name': 'SimpleImputer', 'strategy': 'constant'}. Best is trial 4 with value: 50.82902870259025.
[I 2024-01-04 22:55:03,458] Trial 170 finished with value: 4351.102398221441 and parameters: {'model_name': 'SimpleImputer', 'strategy': 'constant'}. Best is trial 4 with value: 50.82902870259025.
[I 2024-01-04 22:55:03,668] Trial 154 finished with value: 50.82902870259025 and parameters: {'model_name': 'SimpleImputer', 'strategy': 'median'}. Best is trial 4 with value: 50.82902870259025.
[I 2024-01-04 22:55:03,884] Trial 179 finished with value: 4351.102398221441 and parameters: {'model_name': 'SimpleImputer', 'strategy': 'constant'}. Best is trial 4 with value: 50.82902870259025.
[I 2024-01-04 22:55:04,168] Trial 181 finished with value: 4351.102398221441 and parameters: {'model_name': 'SimpleImputer', 'strategy': 'constant'}. Best is trial 4 with value: 50.82902870259025.
[I 2024-01-04 22:55:04,396] Trial 153 finished with value: 50.82902870259025 and parameters: {'model_name': 'SimpleImputer', 'strategy': 'median'}. Best is trial 4 with value: 50.82902870259025.
[I 2024-01-04 22:55:04,603] Trial 165 finished with value: 50.82902870259025 and parameters: {'model_name': 'SimpleImputer', 'strategy': 'median'}. Best is trial 4 with value: 50.82902870259025.
[I 2024-01-04 22:55:04,830] Trial 182 finished with value: 4351.102398221441 and parameters: {'model_name': 'SimpleImputer', 'strategy': 'constant'}. Best is trial 4 with value: 50.82902870259025.
[I 2024-01-04 22:55:05,029] Trial 161 finished with value: 50.82902870259025 and parameters: {'model_name': 'SimpleImputer', 'strategy': 'median'}. Best is trial 4 with value: 50.82902870259025.
[I 2024-01-04 22:55:05,268] Trial 184 finished with value: 4351.102398221441 and parameters: {'model_name': 'SimpleImputer', 'strategy': 'constant'}. Best is trial 4 with value: 50.82902870259025.
[I 2024-01-04 22:55:05,533] Trial 160 finished with value: 50.82902870259025 and parameters: {'model_name': 'SimpleImputer', 'strategy': 'median'}. Best is trial 4 with value: 50.82902870259025.
[I 2024-01-04 22:55:05,805] Trial 185 finished with value: 4351.102398221441 and parameters: {'model_name': 'SimpleImputer', 'strategy': 'constant'}. Best is trial 4 with value: 50.82902870259025.
[I 2024-01-04 22:55:06,067] Trial 167 finished with value: 50.82902870259025 and parameters: {'model_name': 'SimpleImputer', 'strategy': 'median'}. Best is trial 4 with value: 50.82902870259025.
[I 2024-01-04 22:55:06,394] Trial 197 finished with value: 63.376948276324015 and parameters: {'model_name': 'SimpleImputer', 'strategy': 'mean'}. Best is trial 4 with value: 50.82902870259025.
[I 2024-01-04 22:55:06,647] Trial 180 finished with value: 50.82902870259025 and parameters: {'model_name': 'SimpleImputer', 'strategy': 'median'}. Best is trial 4 with value: 50.82902870259025.
[I 2024-01-04 22:55:06,861] Trial 196 finished with value: 63.376948276324015 and parameters: {'model_name': 'SimpleImputer', 'strategy': 'mean'}. Best is trial 4 with value: 50.82902870259025.
[I 2024-01-04 22:55:07,074] Trial 174 finished with value: 50.82902870259025 and parameters: {'model_name': 'SimpleImputer', 'strategy': 'median'}. Best is trial 4 with value: 50.82902870259025.
[I 2024-01-04 22:55:07,291] Trial 194 finished with value: 63.376948276324015 and parameters: {'model_name': 'SimpleImputer', 'strategy': 'mean'}. Best is trial 4 with value: 50.82902870259025.
[I 2024-01-04 22:55:07,507] Trial 195 finished with value: 63.376948276324015 and parameters: {'model_name': 'SimpleImputer', 'strategy': 'mean'}. Best is trial 4 with value: 50.82902870259025.
[I 2024-01-04 22:55:07,741] Trial 172 finished with value: 50.82902870259025 and parameters: {'model_name': 'SimpleImputer', 'strategy': 'median'}. Best is trial 4 with value: 50.82902870259025.
[I 2024-01-04 22:55:08,007] Trial 186 finished with value: 50.82902870259025 and parameters: {'model_name': 'SimpleImputer', 'strategy': 'median'}. Best is trial 4 with value: 50.82902870259025.
[I 2024-01-04 22:55:08,234] Trial 173 finished with value: 50.82902870259025 and parameters: {'model_name': 'SimpleImputer', 'strategy': 'median'}. Best is trial 4 with value: 50.82902870259025.
[I 2024-01-04 22:55:08,445] Trial 188 finished with value: 50.82902870259025 and parameters: {'model_name': 'SimpleImputer', 'strategy': 'median'}. Best is trial 4 with value: 50.82902870259025.
[I 2024-01-04 22:55:08,679] Trial 192 finished with value: 50.82902870259025 and parameters: {'model_name': 'SimpleImputer', 'strategy': 'median'}. Best is trial 4 with value: 50.82902870259025.
[I 2024-01-04 22:55:08,973] Trial 187 finished with value: 50.82902870259025 and parameters: {'model_name': 'SimpleImputer', 'strategy': 'median'}. Best is trial 4 with value: 50.82902870259025.
[I 2024-01-04 22:55:09,206] Trial 189 finished with value: 50.82902870259025 and parameters: {'model_name': 'SimpleImputer', 'strategy': 'median'}. Best is trial 4 with value: 50.82902870259025.
[I 2024-01-04 22:55:09,399] Trial 198 finished with value: 50.82902870259025 and parameters: {'model_name': 'SimpleImputer', 'strategy': 'median'}. Best is trial 4 with value: 50.82902870259025.
[I 2024-01-04 22:55:09,579] Trial 190 finished with value: 50.82902870259025 and parameters: {'model_name': 'SimpleImputer', 'strategy': 'median'}. Best is trial 4 with value: 50.82902870259025.
[I 2024-01-04 22:55:09,811] Trial 193 finished with value: 50.82902870259025 and parameters: {'model_name': 'SimpleImputer', 'strategy': 'median'}. Best is trial 4 with value: 50.82902870259025.
[I 2024-01-04 22:55:09,995] Trial 191 finished with value: 50.82902870259025 and parameters: {'model_name': 'SimpleImputer', 'strategy': 'median'}. Best is trial 4 with value: 50.82902870259025.
