[I 2024-02-27 14:12:36,559] Trial 2 finished with value: 0.7940648831696957 and parameters: {'model_name': 'SimpleImputer', 'strategy': 'constant'}. Best is trial 2 with value: 0.7940648831696957.
[I 2024-02-27 14:12:38,011] Trial 18 finished with value: 0.7940648831696957 and parameters: {'model_name': 'SimpleImputer', 'strategy': 'constant'}. Best is trial 2 with value: 0.7940648831696957.
[I 2024-02-27 14:12:39,076] Trial 0 finished with value: 0.7940695283789797 and parameters: {'model_name': 'SimpleImputer', 'strategy': 'mean'}. Best is trial 2 with value: 0.7940648831696957.
[I 2024-02-27 14:12:41,966] Trial 39 finished with value: 0.7940695283789797 and parameters: {'model_name': 'SimpleImputer', 'strategy': 'mean'}. Best is trial 2 with value: 0.7940648831696957.
[I 2024-02-27 14:12:43,127] Trial 15 finished with value: 0.7940648831696957 and parameters: {'model_name': 'SimpleImputer', 'strategy': 'median'}. Best is trial 2 with value: 0.7940648831696957.
[I 2024-02-27 14:12:44,320] Trial 46 finished with value: 0.7940695283789797 and parameters: {'model_name': 'SimpleImputer', 'strategy': 'mean'}. Best is trial 2 with value: 0.7940648831696957.
[I 2024-02-27 14:12:45,334] Trial 43 finished with value: 0.7940695283789797 and parameters: {'model_name': 'SimpleImputer', 'strategy': 'mean'}. Best is trial 2 with value: 0.7940648831696957.
[I 2024-02-27 14:12:49,453] Trial 34 finished with value: 0.7940648831696957 and parameters: {'model_name': 'SimpleImputer', 'strategy': 'median'}. Best is trial 2 with value: 0.7940648831696957.
[I 2024-02-27 14:12:50,193] Trial 37 finished with value: 0.7940648831696957 and parameters: {'model_name': 'SimpleImputer', 'strategy': 'median'}. Best is trial 2 with value: 0.7940648831696957.
2024-02-27 14:12:55.268325: E external/local_xla/xla/stream_executor/cuda/cuda_driver.cc:274] failed call to cuInit: CUDA_ERROR_NO_DEVICE: no CUDA-capable device is detected
2024-02-27 14:12:56.323471: I tensorflow/compiler/mlir/mlir_graph_optimization_pass.cc:388] MLIR V1 optimization pass is not enabled
[I 2024-02-27 14:12:59,916] Trial 55 finished with value: 0.7940695283789797 and parameters: {'model_name': 'SimpleImputer', 'strategy': 'mean'}. Best is trial 2 with value: 0.7940648831696957.
[I 2024-02-27 14:13:00,653] Trial 54 finished with value: 0.7940648831696957 and parameters: {'model_name': 'SimpleImputer', 'strategy': 'median'}. Best is trial 2 with value: 0.7940648831696957.
[I 2024-02-27 14:13:02,592] Trial 10 finished with value: 0.8430457073102863 and parameters: {'model_name': 'SimpleImputer', 'strategy': 'most_frequent'}. Best is trial 2 with value: 0.7940648831696957.
[I 2024-02-27 14:13:06,178] Trial 56 finished with value: 0.7940648831696957 and parameters: {'model_name': 'SimpleImputer', 'strategy': 'median'}. Best is trial 2 with value: 0.7940648831696957.
[I 2024-02-27 14:14:01,168] Trial 6 finished with value: 0.7940695283789797 and parameters: {'model_name': 'RandomForestImputer', 'max_iter': 1, 'decreasing': True, 'min_samples_split': 0.4, 'min_samples_leaf': 0.1, 'max_features': 0.8, 'warm_start': True}. Best is trial 2 with value: 0.7940648831696957.
[I 2024-02-27 14:14:06,767] Trial 52 finished with value: 0.7940695283789797 and parameters: {'model_name': 'RandomForestImputer', 'max_iter': 1, 'decreasing': False, 'min_samples_split': 0.7000000000000001, 'min_samples_leaf': 0.7000000000000001, 'max_features': 0.8, 'warm_start': True}. Best is trial 2 with value: 0.7940648831696957.
[I 2024-02-27 14:14:19,715] Trial 4 finished with value: 0.8615876003044736 and parameters: {'model_name': 'KNNImputer', 'weights': 'uniform', 'keep_empty_features': False}. Best is trial 2 with value: 0.7940648831696957.
[I 2024-02-27 14:14:21,214] Trial 40 finished with value: 0.8615876003044736 and parameters: {'model_name': 'KNNImputer', 'weights': 'uniform', 'keep_empty_features': False}. Best is trial 2 with value: 0.7940648831696957.
[I 2024-02-27 14:14:22,608] Trial 33 finished with value: 0.8615876003044736 and parameters: {'model_name': 'KNNImputer', 'weights': 'uniform', 'keep_empty_features': False}. Best is trial 2 with value: 0.7940648831696957.
[I 2024-02-27 14:14:24,029] Trial 27 finished with value: 0.8615876003044736 and parameters: {'model_name': 'KNNImputer', 'weights': 'uniform', 'keep_empty_features': False}. Best is trial 2 with value: 0.7940648831696957.
[I 2024-02-27 14:14:26,139] Trial 12 finished with value: 0.887008199133018 and parameters: {'model_name': 'KNNImputer', 'weights': 'distance', 'keep_empty_features': False}. Best is trial 2 with value: 0.7940648831696957.
[I 2024-02-27 14:14:27,005] Trial 22 finished with value: 0.8615876003044736 and parameters: {'model_name': 'KNNImputer', 'weights': 'uniform', 'keep_empty_features': False}. Best is trial 2 with value: 0.7940648831696957.
[I 2024-02-27 14:14:28,780] Trial 28 finished with value: 0.887008199133018 and parameters: {'model_name': 'KNNImputer', 'weights': 'distance', 'keep_empty_features': False}. Best is trial 2 with value: 0.7940648831696957.
[I 2024-02-27 14:14:29,673] Trial 26 finished with value: 0.887008199133018 and parameters: {'model_name': 'KNNImputer', 'weights': 'distance', 'keep_empty_features': False}. Best is trial 2 with value: 0.7940648831696957.
[I 2024-02-27 14:14:30,528] Trial 16 finished with value: 0.887008199133018 and parameters: {'model_name': 'KNNImputer', 'weights': 'distance', 'keep_empty_features': False}. Best is trial 2 with value: 0.7940648831696957.
[I 2024-02-27 14:14:31,390] Trial 38 finished with value: 0.887008199133018 and parameters: {'model_name': 'KNNImputer', 'weights': 'distance', 'keep_empty_features': False}. Best is trial 2 with value: 0.7940648831696957.
[I 2024-02-27 14:14:32,283] Trial 35 finished with value: 0.887008199133018 and parameters: {'model_name': 'KNNImputer', 'weights': 'distance', 'keep_empty_features': False}. Best is trial 2 with value: 0.7940648831696957.
[I 2024-02-27 14:14:33,377] Trial 49 finished with value: 0.8615876003044736 and parameters: {'model_name': 'KNNImputer', 'weights': 'uniform', 'keep_empty_features': False}. Best is trial 2 with value: 0.7940648831696957.
[I 2024-02-27 14:14:34,371] Trial 47 finished with value: 0.887008199133018 and parameters: {'model_name': 'KNNImputer', 'weights': 'distance', 'keep_empty_features': False}. Best is trial 2 with value: 0.7940648831696957.
[I 2024-02-27 14:14:34,961] Trial 24 finished with value: 0.887008199133018 and parameters: {'model_name': 'KNNImputer', 'weights': 'distance', 'keep_empty_features': False}. Best is trial 2 with value: 0.7940648831696957.
[I 2024-02-27 14:14:36,602] Trial 41 finished with value: 0.887008199133018 and parameters: {'model_name': 'KNNImputer', 'weights': 'distance', 'keep_empty_features': False}. Best is trial 2 with value: 0.7940648831696957.
[I 2024-02-27 14:14:42,373] Trial 53 finished with value: 0.887008199133018 and parameters: {'model_name': 'KNNImputer', 'weights': 'distance', 'keep_empty_features': False}. Best is trial 2 with value: 0.7940648831696957.
[I 2024-02-27 14:15:12,523] Trial 48 finished with value: 0.7946182838598844 and parameters: {'model_name': 'RandomForestImputer', 'max_iter': 2, 'decreasing': False, 'min_samples_split': 0.4, 'min_samples_leaf': 0.2, 'max_features': 0.5, 'warm_start': True}. Best is trial 2 with value: 0.7940648831696957.
[I 2024-02-27 14:15:22,835] Trial 7 finished with value: 0.7940748699985416 and parameters: {'model_name': 'IterativeImputer', 'sample_posterior': False, 'initial_strategy': 'mean', 'imputation_order': 'ascending'}. Best is trial 2 with value: 0.7940648831696957.
[I 2024-02-27 14:15:24,403] Trial 61 finished with value: 0.8615876003044736 and parameters: {'model_name': 'KNNImputer', 'weights': 'uniform', 'keep_empty_features': False}. Best is trial 2 with value: 0.7940648831696957.
[I 2024-02-27 14:15:25,341] Trial 19 finished with value: 0.7940748700358276 and parameters: {'model_name': 'IterativeImputer', 'sample_posterior': False, 'initial_strategy': 'median', 'imputation_order': 'ascending'}. Best is trial 2 with value: 0.7940648831696957.
[I 2024-02-27 14:15:26,467] Trial 42 finished with value: 0.7940748720869829 and parameters: {'model_name': 'IterativeImputer', 'sample_posterior': False, 'initial_strategy': 'constant', 'imputation_order': 'descending'}. Best is trial 2 with value: 0.7940648831696957.
[I 2024-02-27 14:15:45,861] Trial 67 finished with value: 0.7940748720869829 and parameters: {'model_name': 'IterativeImputer', 'sample_posterior': False, 'initial_strategy': 'median', 'imputation_order': 'descending'}. Best is trial 2 with value: 0.7940648831696957.
[I 2024-02-27 14:15:47,784] Trial 5 finished with value: 0.7941235479372735 and parameters: {'model_name': 'RandomForestImputer', 'max_iter': 5, 'decreasing': True, 'min_samples_split': 0.5, 'min_samples_leaf': 0.4, 'max_features': 0.1, 'warm_start': True}. Best is trial 2 with value: 0.7940648831696957.
[I 2024-02-27 14:15:49,474] Trial 66 finished with value: 0.7940748680937617 and parameters: {'model_name': 'IterativeImputer', 'sample_posterior': False, 'initial_strategy': 'median', 'imputation_order': 'random'}. Best is trial 2 with value: 0.7940648831696957.
[I 2024-02-27 14:15:50,585] Trial 62 finished with value: 0.9232689006943275 and parameters: {'model_name': 'GAIN', 'batch_size': 1, 'hint_rate': 0.9600000000000001, 'alpha': 98, 'iterations': 1}. Best is trial 2 with value: 0.7940648831696957.
[I 2024-02-27 14:15:52,868] Trial 87 finished with value: 0.7940648831696957 and parameters: {'model_name': 'SimpleImputer', 'strategy': 'constant'}. Best is trial 2 with value: 0.7940648831696957.
[I 2024-02-27 14:15:54,868] Trial 68 finished with value: 0.8792451420472341 and parameters: {'model_name': 'GAIN', 'batch_size': 2, 'hint_rate': 0.08, 'alpha': 49, 'iterations': 1}. Best is trial 2 with value: 0.7940648831696957.
[I 2024-02-27 14:15:55,843] Trial 88 finished with value: 0.7940648831696957 and parameters: {'model_name': 'SimpleImputer', 'strategy': 'constant'}. Best is trial 2 with value: 0.7940648831696957.
[I 2024-02-27 14:15:57,605] Trial 89 finished with value: 0.7940648831696957 and parameters: {'model_name': 'SimpleImputer', 'strategy': 'constant'}. Best is trial 2 with value: 0.7940648831696957.
[I 2024-02-27 14:15:59,446] Trial 90 finished with value: 0.7940648831696957 and parameters: {'model_name': 'SimpleImputer', 'strategy': 'median'}. Best is trial 2 with value: 0.7940648831696957.
[I 2024-02-27 14:16:01,107] Trial 91 finished with value: 0.7940648831696957 and parameters: {'model_name': 'SimpleImputer', 'strategy': 'median'}. Best is trial 2 with value: 0.7940648831696957.
[I 2024-02-27 14:16:02,921] Trial 92 finished with value: 0.7940648831696957 and parameters: {'model_name': 'SimpleImputer', 'strategy': 'median'}. Best is trial 2 with value: 0.7940648831696957.
[I 2024-02-27 14:16:04,640] Trial 74 finished with value: 0.9377170950542736 and parameters: {'model_name': 'GAIN', 'batch_size': 33, 'hint_rate': 0.8200000000000001, 'alpha': 27, 'iterations': 3}. Best is trial 2 with value: 0.7940648831696957.
[I 2024-02-27 14:16:05,507] Trial 93 finished with value: 0.7940648831696957 and parameters: {'model_name': 'SimpleImputer', 'strategy': 'median'}. Best is trial 2 with value: 0.7940648831696957.
[I 2024-02-27 14:16:06,563] Trial 94 finished with value: 0.7940648831696957 and parameters: {'model_name': 'SimpleImputer', 'strategy': 'constant'}. Best is trial 2 with value: 0.7940648831696957.
[I 2024-02-27 14:16:08,341] Trial 95 finished with value: 0.7940648831696957 and parameters: {'model_name': 'SimpleImputer', 'strategy': 'constant'}. Best is trial 2 with value: 0.7940648831696957.
[I 2024-02-27 14:16:09,502] Trial 96 finished with value: 0.7940648831696957 and parameters: {'model_name': 'SimpleImputer', 'strategy': 'constant'}. Best is trial 2 with value: 0.7940648831696957.
[I 2024-02-27 14:16:10,384] Trial 97 finished with value: 0.7940648831696957 and parameters: {'model_name': 'SimpleImputer', 'strategy': 'constant'}. Best is trial 2 with value: 0.7940648831696957.
[I 2024-02-27 14:16:11,894] Trial 44 finished with value: 0.7940695283789797 and parameters: {'model_name': 'RandomForestImputer', 'max_iter': 1, 'decreasing': True, 'min_samples_split': 1.0, 'min_samples_leaf': 0.30000000000000004, 'max_features': 0.8, 'warm_start': False}. Best is trial 2 with value: 0.7940648831696957.
[I 2024-02-27 14:16:14,037] Trial 98 finished with value: 0.7940648831696957 and parameters: {'model_name': 'SimpleImputer', 'strategy': 'median'}. Best is trial 2 with value: 0.7940648831696957.
[I 2024-02-27 14:16:15,188] Trial 25 finished with value: 0.7940695283789797 and parameters: {'model_name': 'RandomForestImputer', 'max_iter': 1, 'decreasing': False, 'min_samples_split': 0.6000000000000001, 'min_samples_leaf': 0.1, 'max_features': 0.2, 'warm_start': False}. Best is trial 2 with value: 0.7940648831696957.
[I 2024-02-27 14:16:16,223] Trial 99 finished with value: 0.7940648831696957 and parameters: {'model_name': 'SimpleImputer', 'strategy': 'median'}. Best is trial 2 with value: 0.7940648831696957.
[I 2024-02-27 14:16:16,967] Trial 100 finished with value: 0.7940648831696957 and parameters: {'model_name': 'SimpleImputer', 'strategy': 'median'}. Best is trial 2 with value: 0.7940648831696957.
[I 2024-02-27 14:16:18,510] Trial 101 finished with value: 0.7940648831696957 and parameters: {'model_name': 'SimpleImputer', 'strategy': 'median'}. Best is trial 2 with value: 0.7940648831696957.
[I 2024-02-27 14:16:20,400] Trial 105 finished with value: 0.7940648831696957 and parameters: {'model_name': 'SimpleImputer', 'strategy': 'median'}. Best is trial 2 with value: 0.7940648831696957.
[I 2024-02-27 14:16:21,467] Trial 102 finished with value: 0.7940648831696957 and parameters: {'model_name': 'SimpleImputer', 'strategy': 'median'}. Best is trial 2 with value: 0.7940648831696957.
[I 2024-02-27 14:16:22,397] Trial 104 finished with value: 0.7940648831696957 and parameters: {'model_name': 'SimpleImputer', 'strategy': 'median'}. Best is trial 2 with value: 0.7940648831696957.
[I 2024-02-27 14:16:22,400] Trial 103 finished with value: 0.7940648831696957 and parameters: {'model_name': 'SimpleImputer', 'strategy': 'median'}. Best is trial 2 with value: 0.7940648831696957.
[I 2024-02-27 14:16:25,662] Trial 108 finished with value: 0.7940648831696957 and parameters: {'model_name': 'SimpleImputer', 'strategy': 'median'}. Best is trial 2 with value: 0.7940648831696957.
[I 2024-02-27 14:16:26,391] Trial 107 finished with value: 0.7940648831696957 and parameters: {'model_name': 'SimpleImputer', 'strategy': 'median'}. Best is trial 2 with value: 0.7940648831696957.
[I 2024-02-27 14:16:28,271] Trial 106 finished with value: 0.8430457073102863 and parameters: {'model_name': 'SimpleImputer', 'strategy': 'most_frequent'}. Best is trial 2 with value: 0.7940648831696957.
[I 2024-02-27 14:16:29,700] Trial 36 finished with value: 0.9168903684236767 and parameters: {'model_name': 'GAIN', 'batch_size': 1, 'hint_rate': 0.87, 'alpha': 17, 'iterations': 12}. Best is trial 2 with value: 0.7940648831696957.
[I 2024-02-27 14:16:31,299] Trial 109 finished with value: 0.8430457073102863 and parameters: {'model_name': 'SimpleImputer', 'strategy': 'most_frequent'}. Best is trial 2 with value: 0.7940648831696957.
[I 2024-02-27 14:16:32,088] Trial 110 finished with value: 0.8430457073102863 and parameters: {'model_name': 'SimpleImputer', 'strategy': 'most_frequent'}. Best is trial 2 with value: 0.7940648831696957.
[I 2024-02-27 14:16:33,839] Trial 112 finished with value: 0.8430457073102863 and parameters: {'model_name': 'SimpleImputer', 'strategy': 'most_frequent'}. Best is trial 2 with value: 0.7940648831696957.
[I 2024-02-27 14:16:35,024] Trial 111 finished with value: 0.8430457073102863 and parameters: {'model_name': 'SimpleImputer', 'strategy': 'most_frequent'}. Best is trial 2 with value: 0.7940648831696957.
[I 2024-02-27 14:16:36,204] Trial 70 finished with value: 0.7940748707606333 and parameters: {'model_name': 'IterativeImputer', 'sample_posterior': False, 'initial_strategy': 'most_frequent', 'imputation_order': 'ascending'}. Best is trial 2 with value: 0.7940648831696957.
[I 2024-02-27 14:16:41,855] Trial 79 finished with value: 0.7940748678399059 and parameters: {'model_name': 'IterativeImputer', 'sample_posterior': False, 'initial_strategy': 'median', 'imputation_order': 'roman'}. Best is trial 2 with value: 0.7940648831696957.
[I 2024-02-27 14:16:43,055] Trial 31 finished with value: 0.7941791876414782 and parameters: {'model_name': 'RandomForestImputer', 'max_iter': 7, 'decreasing': True, 'min_samples_split': 0.4, 'min_samples_leaf': 0.8, 'max_features': 0.6, 'warm_start': True}. Best is trial 2 with value: 0.7940648831696957.
[I 2024-02-27 14:16:44,391] Trial 14 finished with value: 0.7940917709088665 and parameters: {'model_name': 'RandomForestImputer', 'max_iter': 7, 'decreasing': False, 'min_samples_split': 1.0, 'min_samples_leaf': 0.4, 'max_features': 0.1, 'warm_start': True}. Best is trial 2 with value: 0.7940648831696957.
[I 2024-02-27 14:16:45,225] Trial 121 finished with value: 0.7940648831696957 and parameters: {'model_name': 'SimpleImputer', 'strategy': 'constant'}. Best is trial 2 with value: 0.7940648831696957.
[I 2024-02-27 14:16:46,609] Trial 122 finished with value: 0.7940648831696957 and parameters: {'model_name': 'SimpleImputer', 'strategy': 'constant'}. Best is trial 2 with value: 0.7940648831696957.
[I 2024-02-27 14:16:47,701] Trial 123 finished with value: 0.7940648831696957 and parameters: {'model_name': 'SimpleImputer', 'strategy': 'constant'}. Best is trial 2 with value: 0.7940648831696957.
[I 2024-02-27 14:17:02,391] Trial 1 finished with value: 0.8318554733985104 and parameters: {'model_name': 'GAIN', 'batch_size': 30, 'hint_rate': 0.13, 'alpha': 66, 'iterations': 25}. Best is trial 2 with value: 0.7940648831696957.
[I 2024-02-27 14:17:14,954] Trial 63 finished with value: 0.9161374375393592 and parameters: {'model_name': 'GAIN', 'batch_size': 9, 'hint_rate': 0.92, 'alpha': 0, 'iterations': 22}. Best is trial 2 with value: 0.7940648831696957.
[I 2024-02-27 14:17:31,535] Trial 76 finished with value: 0.8269373832135025 and parameters: {'model_name': 'GAIN', 'batch_size': 9, 'hint_rate': 0.09, 'alpha': 35, 'iterations': 27}. Best is trial 2 with value: 0.7940648831696957.
[I 2024-02-27 14:17:32,926] Trial 128 finished with value: 0.7940648831696957 and parameters: {'model_name': 'SimpleImputer', 'strategy': 'constant'}. Best is trial 2 with value: 0.7940648831696957.
[I 2024-02-27 14:17:34,683] Trial 129 finished with value: 0.7940648831696957 and parameters: {'model_name': 'SimpleImputer', 'strategy': 'constant'}. Best is trial 2 with value: 0.7940648831696957.
[I 2024-02-27 14:17:53,238] Trial 65 finished with value: 0.8348892300477816 and parameters: {'model_name': 'GAIN', 'batch_size': 830, 'hint_rate': 0.08, 'alpha': 40, 'iterations': 32}. Best is trial 2 with value: 0.7940648831696957.
[I 2024-02-27 14:19:20,050] Trial 17 finished with value: 0.8132949516989288 and parameters: {'model_name': 'GAIN', 'batch_size': 223, 'hint_rate': 0.23, 'alpha': 57, 'iterations': 73}. Best is trial 2 with value: 0.7940648831696957.
[I 2024-02-27 14:19:21,718] Trial 57 finished with value: 0.7941817357691326 and parameters: {'model_name': 'RandomForestImputer', 'max_iter': 57, 'decreasing': True, 'min_samples_split': 0.7000000000000001, 'min_samples_leaf': 0.5, 'max_features': 0.9, 'warm_start': True}. Best is trial 2 with value: 0.7940648831696957.
[I 2024-02-27 14:19:23,399] Trial 133 finished with value: 0.7940648831696957 and parameters: {'model_name': 'SimpleImputer', 'strategy': 'constant'}. Best is trial 2 with value: 0.7940648831696957.
[I 2024-02-27 14:19:25,177] Trial 134 finished with value: 0.7940695283789797 and parameters: {'model_name': 'SimpleImputer', 'strategy': 'mean'}. Best is trial 2 with value: 0.7940648831696957.
[I 2024-02-27 14:19:26,409] Trial 135 finished with value: 0.7940648831696957 and parameters: {'model_name': 'SimpleImputer', 'strategy': 'constant'}. Best is trial 2 with value: 0.7940648831696957.
[I 2024-02-27 14:19:28,350] Trial 136 finished with value: 0.7940648831696957 and parameters: {'model_name': 'SimpleImputer', 'strategy': 'median'}. Best is trial 2 with value: 0.7940648831696957.
[I 2024-02-27 14:19:40,858] Trial 77 finished with value: 0.8230200638170928 and parameters: {'model_name': 'GAIN', 'batch_size': 1, 'hint_rate': 0.19, 'alpha': 26, 'iterations': 82}. Best is trial 2 with value: 0.7940648831696957.
[I 2024-02-27 14:19:42,372] Trial 138 finished with value: 0.7940648831696957 and parameters: {'model_name': 'SimpleImputer', 'strategy': 'constant'}. Best is trial 2 with value: 0.7940648831696957.
[I 2024-02-27 14:19:43,958] Trial 139 finished with value: 0.7940648831696957 and parameters: {'model_name': 'SimpleImputer', 'strategy': 'constant'}. Best is trial 2 with value: 0.7940648831696957.
[I 2024-02-27 14:19:45,927] Trial 140 finished with value: 0.7940648831696957 and parameters: {'model_name': 'SimpleImputer', 'strategy': 'constant'}. Best is trial 2 with value: 0.7940648831696957.
[I 2024-02-27 14:20:19,833] Trial 83 finished with value: 0.8028662758342208 and parameters: {'model_name': 'GAIN', 'batch_size': 10, 'hint_rate': 0.25, 'alpha': 62, 'iterations': 82}. Best is trial 2 with value: 0.7940648831696957.
[I 2024-02-27 14:21:25,122] Trial 51 finished with value: 0.807950201939879 and parameters: {'model_name': 'GAIN', 'batch_size': 76, 'hint_rate': 0.87, 'alpha': 57, 'iterations': 119}. Best is trial 2 with value: 0.7940648831696957.
[I 2024-02-27 14:21:27,289] Trial 143 finished with value: 0.7940648831696957 and parameters: {'model_name': 'SimpleImputer', 'strategy': 'median'}. Best is trial 2 with value: 0.7940648831696957.
