[I 2024-02-29 07:59:46,147] Trial 114 finished with value: 7.601655084135051 and parameters: {'model_name': 'GAIN', 'batch_size': 1, 'hint_rate': 0.66, 'alpha': 100, 'iterations': 3}. Best is trial 105 with value: 6.005065678267085.
[I 2024-02-29 07:59:48,469] Trial 111 finished with value: 6.322051915304139 and parameters: {'model_name': 'GAIN', 'batch_size': 1, 'hint_rate': 0.09, 'alpha': 100, 'iterations': 5}. Best is trial 105 with value: 6.005065678267085.
[I 2024-02-29 07:59:54,051] Trial 107 finished with value: 7.793695015993029 and parameters: {'model_name': 'GAIN', 'batch_size': 1, 'hint_rate': 0.13, 'alpha': 98, 'iterations': 3}. Best is trial 105 with value: 6.005065678267085.
[I 2024-02-29 08:00:01,733] Trial 112 finished with value: 7.103303972097104 and parameters: {'model_name': 'GAIN', 'batch_size': 1, 'hint_rate': 0.09999999999999999, 'alpha': 96, 'iterations': 4}. Best is trial 105 with value: 6.005065678267085.
[I 2024-02-29 08:00:05,206] Trial 116 finished with value: 7.812517692523888 and parameters: {'model_name': 'GAIN', 'batch_size': 1, 'hint_rate': 0.62, 'alpha': 6, 'iterations': 3}. Best is trial 105 with value: 6.005065678267085.
[I 2024-02-29 08:00:10,386] Trial 77 finished with value: 12.211152825252004 and parameters: {'model_name': 'RandomForestImputer', 'max_iter': 28, 'decreasing': True, 'min_samples_split': 0.2, 'min_samples_leaf': 0.4, 'max_features': 0.1, 'warm_start': True}. Best is trial 105 with value: 6.005065678267085.
[I 2024-02-29 08:00:16,463] Trial 117 finished with value: 8.65599026791382 and parameters: {'model_name': 'GAIN', 'batch_size': 1, 'hint_rate': 0.11, 'alpha': 3, 'iterations': 2}. Best is trial 105 with value: 6.005065678267085.
[I 2024-02-29 08:00:18,649] Trial 115 finished with value: 6.187630452718078 and parameters: {'model_name': 'GAIN', 'batch_size': 1, 'hint_rate': 0.65, 'alpha': 1, 'iterations': 3}. Best is trial 105 with value: 6.005065678267085.
[I 2024-02-29 08:00:21,307] Trial 119 finished with value: 7.611773731079465 and parameters: {'model_name': 'GAIN', 'batch_size': 1, 'hint_rate': 0.06999999999999999, 'alpha': 0, 'iterations': 2}. Best is trial 105 with value: 6.005065678267085.
[I 2024-02-29 08:00:23,414] Trial 118 finished with value: 7.489101263579367 and parameters: {'model_name': 'GAIN', 'batch_size': 1, 'hint_rate': 0.08, 'alpha': 3, 'iterations': 2}. Best is trial 105 with value: 6.005065678267085.
[I 2024-02-29 08:00:27,365] Trial 120 finished with value: 6.652571119028525 and parameters: {'model_name': 'GAIN', 'batch_size': 1, 'hint_rate': 0.14, 'alpha': 97, 'iterations': 2}. Best is trial 105 with value: 6.005065678267085.
[I 2024-02-29 08:00:31,764] Trial 121 finished with value: 7.265959896609031 and parameters: {'model_name': 'GAIN', 'batch_size': 1, 'hint_rate': 0.98, 'alpha': 92, 'iterations': 3}. Best is trial 105 with value: 6.005065678267085.
[I 2024-02-29 08:00:36,524] Trial 122 finished with value: 6.221453520872033 and parameters: {'model_name': 'GAIN', 'batch_size': 1, 'hint_rate': 0.9400000000000001, 'alpha': 100, 'iterations': 3}. Best is trial 105 with value: 6.005065678267085.
[I 2024-02-29 08:00:47,496] Trial 67 finished with value: 11.323119506237642 and parameters: {'model_name': 'RandomForestImputer', 'max_iter': 2, 'decreasing': False, 'min_samples_split': 0.9, 'min_samples_leaf': 0.2, 'max_features': 0.30000000000000004, 'warm_start': False}. Best is trial 105 with value: 6.005065678267085.
[I 2024-02-29 08:00:49,664] Trial 123 finished with value: 8.25907515468288 and parameters: {'model_name': 'GAIN', 'batch_size': 1, 'hint_rate': 0.93, 'alpha': 96, 'iterations': 5}. Best is trial 105 with value: 6.005065678267085.
[I 2024-02-29 08:01:30,392] Trial 5 finished with value: 12.255932442663415 and parameters: {'model_name': 'RandomForestImputer', 'max_iter': 35, 'decreasing': False, 'min_samples_split': 0.6000000000000001, 'min_samples_leaf': 0.2, 'max_features': 0.6, 'warm_start': True}. Best is trial 105 with value: 6.005065678267085.
[I 2024-02-29 08:01:38,234] Trial 125 finished with value: 6.15770484309205 and parameters: {'model_name': 'GAIN', 'batch_size': 1, 'hint_rate': 0.99, 'alpha': 95, 'iterations': 17}. Best is trial 105 with value: 6.005065678267085.
[I 2024-02-29 08:01:41,219] Trial 124 finished with value: 6.770285375501112 and parameters: {'model_name': 'GAIN', 'batch_size': 1, 'hint_rate': 0.9, 'alpha': 100, 'iterations': 17}. Best is trial 105 with value: 6.005065678267085.
[I 2024-02-29 08:01:51,665] Trial 127 finished with value: 8.372048843109852 and parameters: {'model_name': 'GAIN', 'batch_size': 4, 'hint_rate': 0.33, 'alpha': 93, 'iterations': 19}. Best is trial 105 with value: 6.005065678267085.
[I 2024-02-29 08:02:01,436] Trial 129 finished with value: 7.720421870062421 and parameters: {'model_name': 'GAIN', 'batch_size': 1, 'hint_rate': 0.89, 'alpha': 100, 'iterations': 14}. Best is trial 105 with value: 6.005065678267085.
[I 2024-02-29 08:02:04,539] Trial 126 finished with value: 7.6119014039861215 and parameters: {'model_name': 'GAIN', 'batch_size': 1, 'hint_rate': 0.86, 'alpha': 80, 'iterations': 20}. Best is trial 105 with value: 6.005065678267085.
[I 2024-02-29 08:02:14,022] Trial 128 finished with value: 6.769425477771539 and parameters: {'model_name': 'GAIN', 'batch_size': 1, 'hint_rate': 0.98, 'alpha': 97, 'iterations': 17}. Best is trial 105 with value: 6.005065678267085.
[I 2024-02-29 08:02:18,296] Trial 134 finished with value: 6.492846641382286 and parameters: {'model_name': 'GAIN', 'batch_size': 5, 'hint_rate': 0.72, 'alpha': 76, 'iterations': 12}. Best is trial 105 with value: 6.005065678267085.
[I 2024-02-29 08:02:22,270] Trial 132 finished with value: 8.094433155342523 and parameters: {'model_name': 'GAIN', 'batch_size': 4, 'hint_rate': 0.8400000000000001, 'alpha': 21, 'iterations': 13}. Best is trial 105 with value: 6.005065678267085.
[I 2024-02-29 08:02:27,998] Trial 133 finished with value: 7.976030924068835 and parameters: {'model_name': 'GAIN', 'batch_size': 6, 'hint_rate': 0.8200000000000001, 'alpha': 84, 'iterations': 13}. Best is trial 105 with value: 6.005065678267085.
[I 2024-02-29 08:02:36,142] Trial 137 finished with value: 6.585581601852799 and parameters: {'model_name': 'GAIN', 'batch_size': 4, 'hint_rate': 0.8400000000000001, 'alpha': 86, 'iterations': 12}. Best is trial 105 with value: 6.005065678267085.
[I 2024-02-29 08:02:41,920] Trial 131 finished with value: 7.859571487621499 and parameters: {'model_name': 'GAIN', 'batch_size': 1, 'hint_rate': 0.8400000000000001, 'alpha': 90, 'iterations': 15}. Best is trial 105 with value: 6.005065678267085.
[I 2024-02-29 08:02:45,949] Trial 136 finished with value: 5.922020727013899 and parameters: {'model_name': 'GAIN', 'batch_size': 4, 'hint_rate': 0.79, 'alpha': 17, 'iterations': 12}. Best is trial 136 with value: 5.922020727013899.
[I 2024-02-29 08:02:55,805] Trial 135 finished with value: 7.594633462074694 and parameters: {'model_name': 'GAIN', 'batch_size': 5, 'hint_rate': 0.8200000000000001, 'alpha': 83, 'iterations': 13}. Best is trial 136 with value: 5.922020727013899.
[I 2024-02-29 08:02:59,027] Trial 141 finished with value: 6.7174492475808965 and parameters: {'model_name': 'GAIN', 'batch_size': 4, 'hint_rate': 0.8, 'alpha': 83, 'iterations': 15}. Best is trial 136 with value: 5.922020727013899.
[I 2024-02-29 08:03:06,918] Trial 149 finished with value: 6.558109400953287 and parameters: {'model_name': 'GAIN', 'batch_size': 4, 'hint_rate': 0.91, 'alpha': 89, 'iterations': 10}. Best is trial 136 with value: 5.922020727013899.
[I 2024-02-29 08:03:10,010] Trial 138 finished with value: 8.395687976422042 and parameters: {'model_name': 'GAIN', 'batch_size': 4, 'hint_rate': 0.8300000000000001, 'alpha': 87, 'iterations': 12}. Best is trial 136 with value: 5.922020727013899.
[I 2024-02-29 08:03:12,568] Trial 139 finished with value: 7.291217043774213 and parameters: {'model_name': 'GAIN', 'batch_size': 3, 'hint_rate': 0.81, 'alpha': 16, 'iterations': 10}. Best is trial 136 with value: 5.922020727013899.
[I 2024-02-29 08:03:16,650] Trial 166 finished with value: 12.317067352561567 and parameters: {'model_name': 'SimpleImputer', 'strategy': 'median'}. Best is trial 136 with value: 5.922020727013899.
[I 2024-02-29 08:03:19,198] Trial 130 finished with value: 7.162270662775251 and parameters: {'model_name': 'GAIN', 'batch_size': 4, 'hint_rate': 0.89, 'alpha': 24, 'iterations': 16}. Best is trial 136 with value: 5.922020727013899.
[I 2024-02-29 08:03:23,680] Trial 29 finished with value: 12.257243164581075 and parameters: {'model_name': 'RandomForestImputer', 'max_iter': 56, 'decreasing': False, 'min_samples_split': 1.0, 'min_samples_leaf': 0.30000000000000004, 'max_features': 0.9, 'warm_start': True}. Best is trial 136 with value: 5.922020727013899.
[I 2024-02-29 08:03:34,471] Trial 144 finished with value: 6.67275310275532 and parameters: {'model_name': 'GAIN', 'batch_size': 3, 'hint_rate': 0.8400000000000001, 'alpha': 86, 'iterations': 9}. Best is trial 136 with value: 5.922020727013899.
[I 2024-02-29 08:03:41,268] Trial 140 finished with value: 5.747553034785658 and parameters: {'model_name': 'GAIN', 'batch_size': 4, 'hint_rate': 0.89, 'alpha': 80, 'iterations': 11}. Best is trial 140 with value: 5.747553034785658.
[I 2024-02-29 08:03:54,595] Trial 143 finished with value: 6.910538489007943 and parameters: {'model_name': 'GAIN', 'batch_size': 4, 'hint_rate': 0.79, 'alpha': 85, 'iterations': 11}. Best is trial 140 with value: 5.747553034785658.
[I 2024-02-29 08:03:57,358] Trial 142 finished with value: 7.043740130382555 and parameters: {'model_name': 'GAIN', 'batch_size': 4, 'hint_rate': 0.38, 'alpha': 87, 'iterations': 11}. Best is trial 140 with value: 5.747553034785658.
[I 2024-02-29 08:04:01,382] Trial 147 finished with value: 7.307996306370809 and parameters: {'model_name': 'GAIN', 'batch_size': 4, 'hint_rate': 0.74, 'alpha': 84, 'iterations': 10}. Best is trial 140 with value: 5.747553034785658.
[I 2024-02-29 08:04:05,336] Trial 21 finished with value: 12.256797092673374 and parameters: {'model_name': 'RandomForestImputer', 'max_iter': 97, 'decreasing': False, 'min_samples_split': 0.6000000000000001, 'min_samples_leaf': 0.4, 'max_features': 0.8, 'warm_start': True}. Best is trial 140 with value: 5.747553034785658.
[I 2024-02-29 08:04:08,466] Trial 145 finished with value: 6.977639132497342 and parameters: {'model_name': 'GAIN', 'batch_size': 7, 'hint_rate': 0.77, 'alpha': 17, 'iterations': 13}. Best is trial 140 with value: 5.747553034785658.
[I 2024-02-29 08:04:12,750] Trial 148 finished with value: 6.205583834686491 and parameters: {'model_name': 'GAIN', 'batch_size': 4, 'hint_rate': 0.9400000000000001, 'alpha': 85, 'iterations': 9}. Best is trial 140 with value: 5.747553034785658.
[I 2024-02-29 08:04:18,585] Trial 150 finished with value: 7.590988406633412 and parameters: {'model_name': 'GAIN', 'batch_size': 3, 'hint_rate': 0.74, 'alpha': 84, 'iterations': 11}. Best is trial 140 with value: 5.747553034785658.
[I 2024-02-29 08:04:34,741] Trial 48 finished with value: 8.284295284232757 and parameters: {'model_name': 'GAIN', 'batch_size': 21, 'hint_rate': 0.28, 'alpha': 65, 'iterations': 130}. Best is trial 140 with value: 5.747553034785658.
[I 2024-02-29 08:04:42,403] Trial 146 finished with value: 6.369003080109974 and parameters: {'model_name': 'GAIN', 'batch_size': 3, 'hint_rate': 0.8300000000000001, 'alpha': 87, 'iterations': 17}. Best is trial 140 with value: 5.747553034785658.
[I 2024-02-29 08:04:45,999] Trial 151 finished with value: 6.393891434081285 and parameters: {'model_name': 'GAIN', 'batch_size': 4, 'hint_rate': 0.85, 'alpha': 86, 'iterations': 12}. Best is trial 140 with value: 5.747553034785658.
[I 2024-02-29 08:04:53,368] Trial 154 finished with value: 7.5495869924556285 and parameters: {'model_name': 'GAIN', 'batch_size': 34, 'hint_rate': 0.72, 'alpha': 83, 'iterations': 1}. Best is trial 140 with value: 5.747553034785658.
[I 2024-02-29 08:05:06,582] Trial 155 finished with value: 6.309101205399318 and parameters: {'model_name': 'GAIN', 'batch_size': 13, 'hint_rate': 0.72, 'alpha': 82, 'iterations': 1}. Best is trial 140 with value: 5.747553034785658.
[I 2024-02-29 08:05:23,193] Trial 153 finished with value: 6.734151679324077 and parameters: {'model_name': 'GAIN', 'batch_size': 9, 'hint_rate': 0.44, 'alpha': 87, 'iterations': 9}. Best is trial 140 with value: 5.747553034785658.
[I 2024-02-29 08:05:27,953] Trial 152 finished with value: 6.795259079175689 and parameters: {'model_name': 'GAIN', 'batch_size': 4, 'hint_rate': 0.8400000000000001, 'alpha': 81, 'iterations': 11}. Best is trial 140 with value: 5.747553034785658.
[I 2024-02-29 08:05:37,445] Trial 159 finished with value: 7.119736838844977 and parameters: {'model_name': 'GAIN', 'batch_size': 41, 'hint_rate': 0.6900000000000001, 'alpha': 87, 'iterations': 1}. Best is trial 140 with value: 5.747553034785658.
[I 2024-02-29 08:05:41,832] Trial 158 finished with value: 6.667624433182292 and parameters: {'model_name': 'GAIN', 'batch_size': 29, 'hint_rate': 0.7100000000000001, 'alpha': 13, 'iterations': 1}. Best is trial 140 with value: 5.747553034785658.
[I 2024-02-29 08:05:45,643] Trial 160 finished with value: 8.630801417231783 and parameters: {'model_name': 'GAIN', 'batch_size': 38, 'hint_rate': 0.7100000000000001, 'alpha': 14, 'iterations': 1}. Best is trial 140 with value: 5.747553034785658.
[I 2024-02-29 08:05:51,227] Trial 70 finished with value: 12.25640235307628 and parameters: {'model_name': 'RandomForestImputer', 'max_iter': 69, 'decreasing': False, 'min_samples_split': 0.5, 'min_samples_leaf': 0.2, 'max_features': 0.2, 'warm_start': True}. Best is trial 140 with value: 5.747553034785658.
[I 2024-02-29 08:05:56,493] Trial 156 finished with value: 6.666400558512831 and parameters: {'model_name': 'GAIN', 'batch_size': 64, 'hint_rate': 0.76, 'alpha': 15, 'iterations': 1}. Best is trial 140 with value: 5.747553034785658.
[I 2024-02-29 08:06:02,281] Trial 162 finished with value: 6.772190689070956 and parameters: {'model_name': 'GAIN', 'batch_size': 7, 'hint_rate': 0.01, 'alpha': 15, 'iterations': 1}. Best is trial 140 with value: 5.747553034785658.
[I 2024-02-29 08:06:07,893] Trial 193 finished with value: 12.317067352561567 and parameters: {'model_name': 'SimpleImputer', 'strategy': 'median'}. Best is trial 140 with value: 5.747553034785658.
[I 2024-02-29 08:06:13,881] Trial 171 finished with value: 6.749306161920425 and parameters: {'model_name': 'GAIN', 'batch_size': 7, 'hint_rate': 0.19, 'alpha': 43, 'iterations': 8}. Best is trial 140 with value: 5.747553034785658.
[I 2024-02-29 08:06:18,789] Trial 157 finished with value: 6.705296480860182 and parameters: {'model_name': 'GAIN', 'batch_size': 57, 'hint_rate': 0.76, 'alpha': 14, 'iterations': 1}. Best is trial 140 with value: 5.747553034785658.
[I 2024-02-29 08:06:26,491] Trial 30 finished with value: 11.398703499653575 and parameters: {'model_name': 'RandomForestImputer', 'max_iter': 4, 'decreasing': False, 'min_samples_split': 0.9, 'min_samples_leaf': 0.8, 'max_features': 0.30000000000000004, 'warm_start': False}. Best is trial 140 with value: 5.747553034785658.
[I 2024-02-29 08:06:30,822] Trial 165 finished with value: 6.254945170113429 and parameters: {'model_name': 'GAIN', 'batch_size': 34, 'hint_rate': 0.75, 'alpha': 12, 'iterations': 7}. Best is trial 140 with value: 5.747553034785658.
[I 2024-02-29 08:06:36,390] Trial 169 finished with value: 6.831880030427807 and parameters: {'model_name': 'GAIN', 'batch_size': 7, 'hint_rate': 0.74, 'alpha': 70, 'iterations': 7}. Best is trial 140 with value: 5.747553034785658.
[I 2024-02-29 08:06:48,095] Trial 161 finished with value: 8.299003568580744 and parameters: {'model_name': 'GAIN', 'batch_size': 6, 'hint_rate': 0.75, 'alpha': 63, 'iterations': 8}. Best is trial 140 with value: 5.747553034785658.
[I 2024-02-29 08:06:52,058] Trial 163 finished with value: 7.612679776021413 and parameters: {'model_name': 'GAIN', 'batch_size': 6, 'hint_rate': 0.76, 'alpha': 66, 'iterations': 7}. Best is trial 140 with value: 5.747553034785658.
[I 2024-02-29 08:06:55,324] Trial 177 finished with value: 6.875807711673573 and parameters: {'model_name': 'GAIN', 'batch_size': 7, 'hint_rate': 0.01, 'alpha': 75, 'iterations': 7}. Best is trial 140 with value: 5.747553034785658.
[I 2024-02-29 08:07:09,560] Trial 164 finished with value: 6.671348810829555 and parameters: {'model_name': 'GAIN', 'batch_size': 37, 'hint_rate': 0.74, 'alpha': 69, 'iterations': 9}. Best is trial 140 with value: 5.747553034785658.
[I 2024-02-29 08:07:23,882] Trial 167 finished with value: 7.905949485014996 and parameters: {'model_name': 'GAIN', 'batch_size': 8, 'hint_rate': 0.74, 'alpha': 12, 'iterations': 7}. Best is trial 140 with value: 5.747553034785658.
[I 2024-02-29 08:07:27,193] Trial 172 finished with value: 8.664668944319537 and parameters: {'model_name': 'GAIN', 'batch_size': 7, 'hint_rate': 0.73, 'alpha': 11, 'iterations': 1}. Best is trial 140 with value: 5.747553034785658.
[I 2024-02-29 08:07:31,412] Trial 170 finished with value: 8.09892316234513 and parameters: {'model_name': 'GAIN', 'batch_size': 7, 'hint_rate': 0.75, 'alpha': 12, 'iterations': 7}. Best is trial 140 with value: 5.747553034785658.
[I 2024-02-29 08:07:35,396] Trial 168 finished with value: 6.683980058225868 and parameters: {'model_name': 'GAIN', 'batch_size': 8, 'hint_rate': 0.74, 'alpha': 75, 'iterations': 7}. Best is trial 140 with value: 5.747553034785658.
[I 2024-02-29 08:07:49,560] Trial 181 finished with value: 6.761172141425273 and parameters: {'model_name': 'GAIN', 'batch_size': 8, 'hint_rate': 0.9400000000000001, 'alpha': 52, 'iterations': 7}. Best is trial 140 with value: 5.747553034785658.
[I 2024-02-29 08:07:58,150] Trial 173 finished with value: 7.655719480486193 and parameters: {'model_name': 'GAIN', 'batch_size': 8, 'hint_rate': 0.75, 'alpha': 63, 'iterations': 7}. Best is trial 140 with value: 5.747553034785658.
[I 2024-02-29 08:08:01,661] Trial 183 finished with value: 7.863702756502744 and parameters: {'model_name': 'GAIN', 'batch_size': 66, 'hint_rate': 0.9500000000000001, 'alpha': 76, 'iterations': 6}. Best is trial 140 with value: 5.747553034785658.
[I 2024-02-29 08:08:09,807] Trial 178 finished with value: 6.645114551715229 and parameters: {'model_name': 'GAIN', 'batch_size': 8, 'hint_rate': 0.01, 'alpha': 55, 'iterations': 7}. Best is trial 140 with value: 5.747553034785658.
[I 2024-02-29 08:08:14,155] Trial 191 finished with value: 6.132526566712943 and parameters: {'model_name': 'GAIN', 'batch_size': 6, 'hint_rate': 0.9500000000000001, 'alpha': 76, 'iterations': 6}. Best is trial 140 with value: 5.747553034785658.
[I 2024-02-29 08:08:17,451] Trial 176 finished with value: 7.102345185393014 and parameters: {'model_name': 'GAIN', 'batch_size': 7, 'hint_rate': 0.7100000000000001, 'alpha': 55, 'iterations': 7}. Best is trial 140 with value: 5.747553034785658.
[I 2024-02-29 08:08:20,927] Trial 40 finished with value: 11.329539241208053 and parameters: {'model_name': 'RandomForestImputer', 'max_iter': 7, 'decreasing': False, 'min_samples_split': 0.30000000000000004, 'min_samples_leaf': 0.8, 'max_features': 0.30000000000000004, 'warm_start': False}. Best is trial 140 with value: 5.747553034785658.
[I 2024-02-29 08:08:24,458] Trial 179 finished with value: 7.998032377565193 and parameters: {'model_name': 'GAIN', 'batch_size': 55, 'hint_rate': 0.9400000000000001, 'alpha': 76, 'iterations': 7}. Best is trial 140 with value: 5.747553034785658.
[I 2024-02-29 08:08:27,215] Trial 180 finished with value: 7.850788668253638 and parameters: {'model_name': 'GAIN', 'batch_size': 67, 'hint_rate': 0.03, 'alpha': 77, 'iterations': 7}. Best is trial 140 with value: 5.747553034785658.
[I 2024-02-29 08:08:47,751] Trial 182 finished with value: 7.138803273796702 and parameters: {'model_name': 'GAIN', 'batch_size': 8, 'hint_rate': 0.9500000000000001, 'alpha': 74, 'iterations': 7}. Best is trial 140 with value: 5.747553034785658.
[I 2024-02-29 08:08:51,807] Trial 185 finished with value: 7.522569364768271 and parameters: {'model_name': 'GAIN', 'batch_size': 9, 'hint_rate': 0.67, 'alpha': 75, 'iterations': 6}. Best is trial 140 with value: 5.747553034785658.
[I 2024-02-29 08:08:58,059] Trial 186 finished with value: 7.775582375138657 and parameters: {'model_name': 'GAIN', 'batch_size': 13, 'hint_rate': 0.9500000000000001, 'alpha': 77, 'iterations': 6}. Best is trial 140 with value: 5.747553034785658.
[I 2024-02-29 08:09:02,033] Trial 187 finished with value: 7.220904782226208 and parameters: {'model_name': 'GAIN', 'batch_size': 11, 'hint_rate': 0.04, 'alpha': 76, 'iterations': 6}. Best is trial 140 with value: 5.747553034785658.
[I 2024-02-29 08:09:06,036] Trial 188 finished with value: 6.340575506903539 and parameters: {'model_name': 'GAIN', 'batch_size': 9, 'hint_rate': 0.01, 'alpha': 77, 'iterations': 6}. Best is trial 140 with value: 5.747553034785658.
[I 2024-02-29 08:09:11,558] Trial 190 finished with value: 8.549810639245749 and parameters: {'model_name': 'GAIN', 'batch_size': 6, 'hint_rate': 0.04, 'alpha': 77, 'iterations': 6}. Best is trial 140 with value: 5.747553034785658.
[I 2024-02-29 08:09:14,087] Trial 175 finished with value: 7.0715189598363235 and parameters: {'model_name': 'GAIN', 'batch_size': 7, 'hint_rate': 0.02, 'alpha': 73, 'iterations': 33}. Best is trial 140 with value: 5.747553034785658.
[I 2024-02-29 08:09:17,858] Trial 197 finished with value: 5.9461122202917025 and parameters: {'model_name': 'GAIN', 'batch_size': 2, 'hint_rate': 0.9400000000000001, 'alpha': 77, 'iterations': 28}. Best is trial 140 with value: 5.747553034785658.
[I 2024-02-29 08:09:23,469] Trial 195 finished with value: 6.0505755992838335 and parameters: {'model_name': 'GAIN', 'batch_size': 2, 'hint_rate': 0.9600000000000001, 'alpha': 76, 'iterations': 26}. Best is trial 140 with value: 5.747553034785658.
