[I 2024-02-27 20:33:58,126] Trial 145 finished with value: 0.8332076637888477 and parameters: {'model_name': 'RandomForestImputer', 'max_iter': 99, 'decreasing': False, 'min_samples_split': 0.0, 'min_samples_leaf': 0.9, 'max_features': 0.7000000000000001, 'warm_start': False}. Best is trial 7 with value: 0.8331656159922487.
[I 2024-02-27 20:34:15,726] Trial 144 finished with value: 0.8332208374751444 and parameters: {'model_name': 'RandomForestImputer', 'max_iter': 87, 'decreasing': False, 'min_samples_split': 1.0, 'min_samples_leaf': 0.9, 'max_features': 0.7000000000000001, 'warm_start': False}. Best is trial 7 with value: 0.8331656159922487.
[I 2024-02-27 20:35:04,670] Trial 59 finished with value: inf and parameters: {'model_name': 'GAIN', 'batch_size': 25, 'hint_rate': 0.52, 'alpha': 41, 'iterations': 22808}. Best is trial 7 with value: 0.8331656159922487.
[I 2024-02-27 20:35:46,208] Trial 104 finished with value: inf and parameters: {'model_name': 'GAIN', 'batch_size': 1, 'hint_rate': 0.99, 'alpha': 0, 'iterations': 26921}. Best is trial 7 with value: 0.8331656159922487.
[I 2024-02-27 20:36:44,521] Trial 69 finished with value: inf and parameters: {'model_name': 'GAIN', 'batch_size': 2, 'hint_rate': 0.99, 'alpha': 23, 'iterations': 32311}. Best is trial 7 with value: 0.8331656159922487.
[I 2024-02-27 20:36:59,907] Trial 71 finished with value: inf and parameters: {'model_name': 'GAIN', 'batch_size': 60, 'hint_rate': 0.9, 'alpha': 91, 'iterations': 29493}. Best is trial 7 with value: 0.8331656159922487.
[I 2024-02-27 20:37:36,335] Trial 62 finished with value: inf and parameters: {'model_name': 'GAIN', 'batch_size': 18, 'hint_rate': 0.18000000000000002, 'alpha': 10, 'iterations': 36552}. Best is trial 7 with value: 0.8331656159922487.
[I 2024-02-27 20:39:25,774] Trial 26 finished with value: 1.076320490068705 and parameters: {'model_name': 'GAIN', 'batch_size': 20, 'hint_rate': 0.27, 'alpha': 44, 'iterations': 5146}. Best is trial 7 with value: 0.8331656159922487.
[I 2024-02-27 20:40:10,191] Trial 65 finished with value: 1.0817374847539298 and parameters: {'model_name': 'GAIN', 'batch_size': 10, 'hint_rate': 0.9500000000000001, 'alpha': 25, 'iterations': 6239}. Best is trial 7 with value: 0.8331656159922487.
[I 2024-02-27 20:41:00,241] Trial 102 finished with value: inf and parameters: {'model_name': 'GAIN', 'batch_size': 1, 'hint_rate': 0.9400000000000001, 'alpha': 100, 'iterations': 85710}. Best is trial 7 with value: 0.8331656159922487.
[I 2024-02-27 20:41:12,594] Trial 2 finished with value: inf and parameters: {'model_name': 'GAIN', 'batch_size': 212, 'hint_rate': 0.7100000000000001, 'alpha': 80, 'iterations': 68205}. Best is trial 7 with value: 0.8331656159922487.
