Run: 4
/cm/local/apps/slurm/var/spool/job612206/slurm_script: line 23: /common/ketrong/minconda3/etc/profile.d/conda.sh: No such file or directory
/cm/local/apps/slurm/var/spool/job612206/slurm_script: line 26: $'\nconda create --name tpot2devenv -c conda-forge python=3.10\n': command not found
/cm/local/apps/slurm/var/spool/job612206/slurm_script: line 31: $'\npip install -r requirements.txt\n': command not found
RunStart
2024-01-16 01:47:18.447859: I tensorflow/core/util/port.cc:113] oneDNN custom operations are on. You may see slightly different numerical results due to floating-point round-off errors from different computation orders. To turn them off, set the environment variable `TF_ENABLE_ONEDNN_OPTS=0`.
2024-01-16 01:47:18.482250: E external/local_xla/xla/stream_executor/cuda/cuda_dnn.cc:9261] Unable to register cuDNN factory: Attempting to register factory for plugin cuDNN when one has already been registered
2024-01-16 01:47:18.482274: E external/local_xla/xla/stream_executor/cuda/cuda_fft.cc:607] Unable to register cuFFT factory: Attempting to register factory for plugin cuFFT when one has already been registered
2024-01-16 01:47:18.483396: E external/local_xla/xla/stream_executor/cuda/cuda_blas.cc:1515] Unable to register cuBLAS factory: Attempting to register factory for plugin cuBLAS when one has already been registered
2024-01-16 01:47:18.488893: I tensorflow/core/platform/cpu_feature_guard.cc:182] This TensorFlow binary is optimized to use available CPU instructions in performance-critical operations.
To enable the following instructions: AVX2 AVX512F AVX512_VNNI FMA, in other operations, rebuild TensorFlow with the appropriate compiler flags.
2024-01-16 01:47:20.485588: W tensorflow/compiler/tf2tensorrt/utils/py_utils.cc:38] TF-TRT Warning: Could not find TensorRT
WARNING:tensorflow:From /home/ketrong/miniconda3/envs/tpot2devenv/lib/python3.10/site-packages/tensorflow/python/compat/v2_compat.py:108: disable_resource_variables (from tensorflow.python.ops.variable_scope) is deprecated and will be removed in a future version.
Instructions for updating:
non-resource variables are not supported in the long term
starting loops
working on 
logs/146204/tpot2_base_normal_MCAR_0.5
4.066897392272949
loading data
logs/146204/tpot2_base_normal_MCAR_0.5/data/146204_True.pkl
running experiment 1/3 - Does large hyperparameter space improve reconstruction accuracy over simple
[I 2024-01-16 01:47:32,240] A new study created in memory with name: no-name-142ee57e-d3f6-4f7a-901c-03b89e3f0734
[I 2024-01-16 01:47:33,381] Trial 1 finished with value: 0.3886297388727028 and parameters: {'model_name': 'SimpleImputer', 'strategy': 'mean'}. Best is trial 1 with value: 0.3886297388727028.
[I 2024-01-16 01:47:33,596] Trial 15 finished with value: 0.497699821965148 and parameters: {'model_name': 'SimpleImputer', 'strategy': 'constant'}. Best is trial 1 with value: 0.3886297388727028.
[I 2024-01-16 01:47:33,778] Trial 20 finished with value: 0.497699821965148 and parameters: {'model_name': 'SimpleImputer', 'strategy': 'constant'}. Best is trial 1 with value: 0.3886297388727028.
[I 2024-01-16 01:47:34,014] Trial 7 finished with value: 0.497699821965148 and parameters: {'model_name': 'SimpleImputer', 'strategy': 'constant'}. Best is trial 1 with value: 0.3886297388727028.
[I 2024-01-16 01:47:34,172] Trial 11 finished with value: 0.497699821965148 and parameters: {'model_name': 'SimpleImputer', 'strategy': 'constant'}. Best is trial 1 with value: 0.3886297388727028.
[I 2024-01-16 01:47:34,460] Trial 6 finished with value: 0.3886297388727028 and parameters: {'model_name': 'SimpleImputer', 'strategy': 'mean'}. Best is trial 1 with value: 0.3886297388727028.
[I 2024-01-16 01:47:34,790] Trial 21 finished with value: 0.497699821965148 and parameters: {'model_name': 'SimpleImputer', 'strategy': 'constant'}. Best is trial 1 with value: 0.3886297388727028.
[I 2024-01-16 01:47:35,202] Trial 24 finished with value: 0.497699821965148 and parameters: {'model_name': 'SimpleImputer', 'strategy': 'constant'}. Best is trial 1 with value: 0.3886297388727028.
[I 2024-01-16 01:47:35,404] Trial 3 finished with value: 0.3886297388727028 and parameters: {'model_name': 'SimpleImputer', 'strategy': 'mean'}. Best is trial 1 with value: 0.3886297388727028.
[I 2024-01-16 01:47:35,674] Trial 2 finished with value: 0.3886297388727028 and parameters: {'model_name': 'SimpleImputer', 'strategy': 'mean'}. Best is trial 1 with value: 0.3886297388727028.
[I 2024-01-16 01:47:35,898] Trial 28 finished with value: 0.497699821965148 and parameters: {'model_name': 'SimpleImputer', 'strategy': 'constant'}. Best is trial 1 with value: 0.3886297388727028.
[I 2024-01-16 01:47:36,081] Trial 10 finished with value: 0.3886297388727028 and parameters: {'model_name': 'SimpleImputer', 'strategy': 'mean'}. Best is trial 1 with value: 0.3886297388727028.
[I 2024-01-16 01:47:36,399] Trial 35 finished with value: 0.497699821965148 and parameters: {'model_name': 'SimpleImputer', 'strategy': 'constant'}. Best is trial 1 with value: 0.3886297388727028.
[I 2024-01-16 01:47:36,568] Trial 29 finished with value: 0.497699821965148 and parameters: {'model_name': 'SimpleImputer', 'strategy': 'constant'}. Best is trial 1 with value: 0.3886297388727028.
[I 2024-01-16 01:47:36,867] Trial 26 finished with value: 0.497699821965148 and parameters: {'model_name': 'SimpleImputer', 'strategy': 'constant'}. Best is trial 1 with value: 0.3886297388727028.
[I 2024-01-16 01:47:37,197] Trial 19 finished with value: 0.3886297388727028 and parameters: {'model_name': 'SimpleImputer', 'strategy': 'mean'}. Best is trial 1 with value: 0.3886297388727028.
[I 2024-01-16 01:47:37,359] Trial 4 finished with value: 0.3886297388727028 and parameters: {'model_name': 'SimpleImputer', 'strategy': 'mean'}. Best is trial 1 with value: 0.3886297388727028.
[I 2024-01-16 01:47:37,671] Trial 18 finished with value: 0.3886297388727028 and parameters: {'model_name': 'SimpleImputer', 'strategy': 'mean'}. Best is trial 1 with value: 0.3886297388727028.
[I 2024-01-16 01:47:37,927] Trial 34 finished with value: 0.497699821965148 and parameters: {'model_name': 'SimpleImputer', 'strategy': 'constant'}. Best is trial 1 with value: 0.3886297388727028.
[I 2024-01-16 01:47:38,129] Trial 43 finished with value: 0.497699821965148 and parameters: {'model_name': 'SimpleImputer', 'strategy': 'constant'}. Best is trial 1 with value: 0.3886297388727028.
[I 2024-01-16 01:47:38,291] Trial 23 finished with value: 0.3886297388727028 and parameters: {'model_name': 'SimpleImputer', 'strategy': 'mean'}. Best is trial 1 with value: 0.3886297388727028.
[I 2024-01-16 01:47:38,702] Trial 41 finished with value: 0.497699821965148 and parameters: {'model_name': 'SimpleImputer', 'strategy': 'constant'}. Best is trial 1 with value: 0.3886297388727028.
[I 2024-01-16 01:47:39,070] Trial 36 finished with value: 0.3886297388727028 and parameters: {'model_name': 'SimpleImputer', 'strategy': 'mean'}. Best is trial 1 with value: 0.3886297388727028.
[I 2024-01-16 01:47:39,246] Trial 5 finished with value: 0.497699821965148 and parameters: {'model_name': 'SimpleImputer', 'strategy': 'median'}. Best is trial 1 with value: 0.3886297388727028.
[I 2024-01-16 01:47:39,550] Trial 42 finished with value: 0.497699821965148 and parameters: {'model_name': 'SimpleImputer', 'strategy': 'constant'}. Best is trial 1 with value: 0.3886297388727028.
[I 2024-01-16 01:47:39,845] Trial 50 finished with value: 0.497699821965148 and parameters: {'model_name': 'SimpleImputer', 'strategy': 'constant'}. Best is trial 1 with value: 0.3886297388727028.
[I 2024-01-16 01:47:40,360] Trial 52 finished with value: 0.497699821965148 and parameters: {'model_name': 'SimpleImputer', 'strategy': 'constant'}. Best is trial 1 with value: 0.3886297388727028.
[I 2024-01-16 01:47:40,650] Trial 54 finished with value: 0.497699821965148 and parameters: {'model_name': 'SimpleImputer', 'strategy': 'constant'}. Best is trial 1 with value: 0.3886297388727028.
[I 2024-01-16 01:47:40,973] Trial 49 finished with value: 0.3886297388727028 and parameters: {'model_name': 'SimpleImputer', 'strategy': 'mean'}. Best is trial 1 with value: 0.3886297388727028.
[I 2024-01-16 01:47:41,302] Trial 44 finished with value: 0.3886297388727028 and parameters: {'model_name': 'SimpleImputer', 'strategy': 'mean'}. Best is trial 1 with value: 0.3886297388727028.
[I 2024-01-16 01:47:41,493] Trial 51 finished with value: 0.3886297388727028 and parameters: {'model_name': 'SimpleImputer', 'strategy': 'mean'}. Best is trial 1 with value: 0.3886297388727028.
[I 2024-01-16 01:47:41,658] Trial 0 finished with value: 0.497699821965148 and parameters: {'model_name': 'SimpleImputer', 'strategy': 'median'}. Best is trial 1 with value: 0.3886297388727028.
[I 2024-01-16 01:47:42,024] Trial 53 finished with value: 0.3886297388727028 and parameters: {'model_name': 'SimpleImputer', 'strategy': 'mean'}. Best is trial 1 with value: 0.3886297388727028.
[I 2024-01-16 01:47:42,323] Trial 13 finished with value: 0.497699821965148 and parameters: {'model_name': 'SimpleImputer', 'strategy': 'median'}. Best is trial 1 with value: 0.3886297388727028.
[I 2024-01-16 01:47:42,717] Trial 9 finished with value: 0.497699821965148 and parameters: {'model_name': 'SimpleImputer', 'strategy': 'median'}. Best is trial 1 with value: 0.3886297388727028.
[I 2024-01-16 01:47:43,431] Trial 31 finished with value: 0.497699821965148 and parameters: {'model_name': 'SimpleImputer', 'strategy': 'median'}. Best is trial 1 with value: 0.3886297388727028.
[I 2024-01-16 01:47:43,758] Trial 25 finished with value: 0.497699821965148 and parameters: {'model_name': 'SimpleImputer', 'strategy': 'median'}. Best is trial 1 with value: 0.3886297388727028.
[I 2024-01-16 01:47:43,976] Trial 46 finished with value: 0.497699821965148 and parameters: {'model_name': 'SimpleImputer', 'strategy': 'median'}. Best is trial 1 with value: 0.3886297388727028.
[I 2024-01-16 01:47:44,478] Trial 30 finished with value: 0.497699821965148 and parameters: {'model_name': 'SimpleImputer', 'strategy': 'median'}. Best is trial 1 with value: 0.3886297388727028.
[I 2024-01-16 01:47:44,936] Trial 48 finished with value: 0.497699821965148 and parameters: {'model_name': 'SimpleImputer', 'strategy': 'median'}. Best is trial 1 with value: 0.3886297388727028.
[I 2024-01-16 01:47:45,352] Trial 39 finished with value: 0.497699821965148 and parameters: {'model_name': 'SimpleImputer', 'strategy': 'median'}. Best is trial 1 with value: 0.3886297388727028.
[I 2024-01-16 01:47:46,158] Trial 58 finished with value: 0.497699821965148 and parameters: {'model_name': 'SimpleImputer', 'strategy': 'median'}. Best is trial 1 with value: 0.3886297388727028.
[I 2024-01-16 01:47:46,931] Trial 60 finished with value: 0.497699821965148 and parameters: {'model_name': 'SimpleImputer', 'strategy': 'median'}. Best is trial 1 with value: 0.3886297388727028.
[I 2024-01-16 01:47:47,690] Trial 67 finished with value: 0.497699821965148 and parameters: {'model_name': 'SimpleImputer', 'strategy': 'median'}. Best is trial 1 with value: 0.3886297388727028.
[I 2024-01-16 01:47:48,335] Trial 84 finished with value: 0.3886297388727028 and parameters: {'model_name': 'SimpleImputer', 'strategy': 'mean'}. Best is trial 1 with value: 0.3886297388727028.
[I 2024-01-16 01:47:48,681] Trial 69 finished with value: 0.497699821965148 and parameters: {'model_name': 'SimpleImputer', 'strategy': 'median'}. Best is trial 1 with value: 0.3886297388727028.
[I 2024-01-16 01:47:59,321] Trial 33 finished with value: 0.497699821965148 and parameters: {'model_name': 'SimpleImputer', 'strategy': 'most_frequent'}. Best is trial 1 with value: 0.3886297388727028.
[I 2024-01-16 01:47:59,950] Trial 37 finished with value: 0.497699821965148 and parameters: {'model_name': 'SimpleImputer', 'strategy': 'most_frequent'}. Best is trial 1 with value: 0.3886297388727028.
[I 2024-01-16 01:48:00,449] Trial 16 finished with value: 0.497699821965148 and parameters: {'model_name': 'SimpleImputer', 'strategy': 'most_frequent'}. Best is trial 1 with value: 0.3886297388727028.
[I 2024-01-16 01:48:01,091] Trial 40 finished with value: 0.497699821965148 and parameters: {'model_name': 'SimpleImputer', 'strategy': 'most_frequent'}. Best is trial 1 with value: 0.3886297388727028.
[I 2024-01-16 01:48:01,354] Trial 38 finished with value: 0.497699821965148 and parameters: {'model_name': 'SimpleImputer', 'strategy': 'most_frequent'}. Best is trial 1 with value: 0.3886297388727028.
[I 2024-01-16 01:48:01,750] Trial 8 finished with value: 0.497699821965148 and parameters: {'model_name': 'SimpleImputer', 'strategy': 'most_frequent'}. Best is trial 1 with value: 0.3886297388727028.
[I 2024-01-16 01:48:02,068] Trial 47 finished with value: 0.497699821965148 and parameters: {'model_name': 'SimpleImputer', 'strategy': 'most_frequent'}. Best is trial 1 with value: 0.3886297388727028.
[I 2024-01-16 01:48:02,515] Trial 17 finished with value: 0.497699821965148 and parameters: {'model_name': 'SimpleImputer', 'strategy': 'most_frequent'}. Best is trial 1 with value: 0.3886297388727028.
[I 2024-01-16 01:48:02,810] Trial 22 finished with value: 0.497699821965148 and parameters: {'model_name': 'SimpleImputer', 'strategy': 'most_frequent'}. Best is trial 1 with value: 0.3886297388727028.
[I 2024-01-16 01:48:03,109] Trial 14 finished with value: 0.497699821965148 and parameters: {'model_name': 'SimpleImputer', 'strategy': 'most_frequent'}. Best is trial 1 with value: 0.3886297388727028.
[I 2024-01-16 01:48:03,363] Trial 32 finished with value: 0.497699821965148 and parameters: {'model_name': 'SimpleImputer', 'strategy': 'most_frequent'}. Best is trial 1 with value: 0.3886297388727028.
[I 2024-01-16 01:48:03,590] Trial 27 finished with value: 0.497699821965148 and parameters: {'model_name': 'SimpleImputer', 'strategy': 'most_frequent'}. Best is trial 1 with value: 0.3886297388727028.
[I 2024-01-16 01:48:04,201] Trial 45 finished with value: 0.497699821965148 and parameters: {'model_name': 'SimpleImputer', 'strategy': 'most_frequent'}. Best is trial 1 with value: 0.3886297388727028.
[I 2024-01-16 01:48:04,500] Trial 94 finished with value: 0.3886297388727028 and parameters: {'model_name': 'SimpleImputer', 'strategy': 'mean'}. Best is trial 1 with value: 0.3886297388727028.
[I 2024-01-16 01:48:04,766] Trial 12 finished with value: 0.497699821965148 and parameters: {'model_name': 'SimpleImputer', 'strategy': 'most_frequent'}. Best is trial 1 with value: 0.3886297388727028.
[I 2024-01-16 01:48:05,646] Trial 59 finished with value: 0.497699821965148 and parameters: {'model_name': 'SimpleImputer', 'strategy': 'most_frequent'}. Best is trial 1 with value: 0.3886297388727028.
[I 2024-01-16 01:48:05,911] Trial 65 finished with value: 0.497699821965148 and parameters: {'model_name': 'SimpleImputer', 'strategy': 'most_frequent'}. Best is trial 1 with value: 0.3886297388727028.
[I 2024-01-16 01:48:06,270] Trial 95 finished with value: 0.3886297388727028 and parameters: {'model_name': 'SimpleImputer', 'strategy': 'mean'}. Best is trial 1 with value: 0.3886297388727028.
[I 2024-01-16 01:48:06,516] Trial 97 finished with value: 0.3886297388727028 and parameters: {'model_name': 'SimpleImputer', 'strategy': 'mean'}. Best is trial 1 with value: 0.3886297388727028.
[I 2024-01-16 01:48:06,941] Trial 55 finished with value: 0.497699821965148 and parameters: {'model_name': 'SimpleImputer', 'strategy': 'most_frequent'}. Best is trial 1 with value: 0.3886297388727028.
[I 2024-01-16 01:48:07,206] Trial 61 finished with value: 0.497699821965148 and parameters: {'model_name': 'SimpleImputer', 'strategy': 'most_frequent'}. Best is trial 1 with value: 0.3886297388727028.
[I 2024-01-16 01:48:07,459] Trial 96 finished with value: 0.3886297388727028 and parameters: {'model_name': 'SimpleImputer', 'strategy': 'mean'}. Best is trial 1 with value: 0.3886297388727028.
[I 2024-01-16 01:48:07,687] Trial 68 finished with value: 0.497699821965148 and parameters: {'model_name': 'SimpleImputer', 'strategy': 'most_frequent'}. Best is trial 1 with value: 0.3886297388727028.
[I 2024-01-16 01:48:07,894] Trial 72 finished with value: 0.497699821965148 and parameters: {'model_name': 'SimpleImputer', 'strategy': 'most_frequent'}. Best is trial 1 with value: 0.3886297388727028.
[I 2024-01-16 01:48:08,135] Trial 99 finished with value: 0.3886297388727028 and parameters: {'model_name': 'SimpleImputer', 'strategy': 'mean'}. Best is trial 1 with value: 0.3886297388727028.
[I 2024-01-16 01:48:08,355] Trial 57 finished with value: 0.497699821965148 and parameters: {'model_name': 'SimpleImputer', 'strategy': 'most_frequent'}. Best is trial 1 with value: 0.3886297388727028.
[I 2024-01-16 01:48:08,543] Trial 101 finished with value: 0.3886297388727028 and parameters: {'model_name': 'SimpleImputer', 'strategy': 'mean'}. Best is trial 1 with value: 0.3886297388727028.
[I 2024-01-16 01:48:08,938] Trial 100 finished with value: 0.3886297388727028 and parameters: {'model_name': 'SimpleImputer', 'strategy': 'mean'}. Best is trial 1 with value: 0.3886297388727028.
[I 2024-01-16 01:48:09,159] Trial 98 finished with value: 0.3886297388727028 and parameters: {'model_name': 'SimpleImputer', 'strategy': 'mean'}. Best is trial 1 with value: 0.3886297388727028.
[I 2024-01-16 01:48:09,413] Trial 104 finished with value: 0.3886297388727028 and parameters: {'model_name': 'SimpleImputer', 'strategy': 'mean'}. Best is trial 1 with value: 0.3886297388727028.
[I 2024-01-16 01:48:09,414] Trial 64 finished with value: 0.497699821965148 and parameters: {'model_name': 'SimpleImputer', 'strategy': 'most_frequent'}. Best is trial 1 with value: 0.3886297388727028.
[I 2024-01-16 01:48:09,420] Trial 76 finished with value: 0.497699821965148 and parameters: {'model_name': 'SimpleImputer', 'strategy': 'most_frequent'}. Best is trial 1 with value: 0.3886297388727028.
[I 2024-01-16 01:48:09,658] Trial 105 finished with value: 0.3886297388727028 and parameters: {'model_name': 'SimpleImputer', 'strategy': 'mean'}. Best is trial 1 with value: 0.3886297388727028.
[I 2024-01-16 01:48:10,073] Trial 63 finished with value: 0.497699821965148 and parameters: {'model_name': 'SimpleImputer', 'strategy': 'most_frequent'}. Best is trial 1 with value: 0.3886297388727028.
[I 2024-01-16 01:48:10,116] Trial 102 finished with value: 0.3886297388727028 and parameters: {'model_name': 'SimpleImputer', 'strategy': 'mean'}. Best is trial 1 with value: 0.3886297388727028.
[I 2024-01-16 01:48:10,838] Trial 70 finished with value: 0.497699821965148 and parameters: {'model_name': 'SimpleImputer', 'strategy': 'most_frequent'}. Best is trial 1 with value: 0.3886297388727028.
[I 2024-01-16 01:48:11,130] Trial 56 finished with value: 0.497699821965148 and parameters: {'model_name': 'SimpleImputer', 'strategy': 'most_frequent'}. Best is trial 1 with value: 0.3886297388727028.
[I 2024-01-16 01:48:11,448] Trial 80 finished with value: 0.497699821965148 and parameters: {'model_name': 'SimpleImputer', 'strategy': 'most_frequent'}. Best is trial 1 with value: 0.3886297388727028.
[I 2024-01-16 01:48:11,706] Trial 77 finished with value: 0.497699821965148 and parameters: {'model_name': 'SimpleImputer', 'strategy': 'most_frequent'}. Best is trial 1 with value: 0.3886297388727028.
[I 2024-01-16 01:48:11,961] Trial 103 finished with value: 0.3886297388727028 and parameters: {'model_name': 'SimpleImputer', 'strategy': 'mean'}. Best is trial 1 with value: 0.3886297388727028.
[I 2024-01-16 01:48:12,220] Trial 66 finished with value: 0.497699821965148 and parameters: {'model_name': 'SimpleImputer', 'strategy': 'most_frequent'}. Best is trial 1 with value: 0.3886297388727028.
[I 2024-01-16 01:48:12,778] Trial 74 finished with value: 0.497699821965148 and parameters: {'model_name': 'SimpleImputer', 'strategy': 'most_frequent'}. Best is trial 1 with value: 0.3886297388727028.
[I 2024-01-16 01:48:13,109] Trial 107 finished with value: 0.3886297388727028 and parameters: {'model_name': 'SimpleImputer', 'strategy': 'mean'}. Best is trial 1 with value: 0.3886297388727028.
[I 2024-01-16 01:48:13,416] Trial 106 finished with value: 0.3886297388727028 and parameters: {'model_name': 'SimpleImputer', 'strategy': 'mean'}. Best is trial 1 with value: 0.3886297388727028.
[I 2024-01-16 01:48:13,687] Trial 62 finished with value: 0.497699821965148 and parameters: {'model_name': 'SimpleImputer', 'strategy': 'most_frequent'}. Best is trial 1 with value: 0.3886297388727028.
[I 2024-01-16 01:48:13,915] Trial 73 finished with value: 0.497699821965148 and parameters: {'model_name': 'SimpleImputer', 'strategy': 'most_frequent'}. Best is trial 1 with value: 0.3886297388727028.
[I 2024-01-16 01:48:14,343] Trial 71 finished with value: 0.497699821965148 and parameters: {'model_name': 'SimpleImputer', 'strategy': 'most_frequent'}. Best is trial 1 with value: 0.3886297388727028.
[I 2024-01-16 01:48:14,683] Trial 108 finished with value: 0.3886297388727028 and parameters: {'model_name': 'SimpleImputer', 'strategy': 'mean'}. Best is trial 1 with value: 0.3886297388727028.
[I 2024-01-16 01:48:15,078] Trial 110 finished with value: 0.3886297388727028 and parameters: {'model_name': 'SimpleImputer', 'strategy': 'mean'}. Best is trial 1 with value: 0.3886297388727028.
[I 2024-01-16 01:48:15,335] Trial 109 finished with value: 0.3886297388727028 and parameters: {'model_name': 'SimpleImputer', 'strategy': 'mean'}. Best is trial 1 with value: 0.3886297388727028.
[I 2024-01-16 01:48:15,580] Trial 88 finished with value: 0.497699821965148 and parameters: {'model_name': 'SimpleImputer', 'strategy': 'most_frequent'}. Best is trial 1 with value: 0.3886297388727028.
[I 2024-01-16 01:48:15,833] Trial 82 finished with value: 0.497699821965148 and parameters: {'model_name': 'SimpleImputer', 'strategy': 'most_frequent'}. Best is trial 1 with value: 0.3886297388727028.
