[I 2024-04-02 05:01:14,216] Trial 75 finished with value: 7572.248298071492 and parameters: {'model_name': 'GAIN', 'batch_size': 3, 'hint_rate': 0.66, 'alpha': 9, 'iterations': 52221}. Best is trial 4 with value: 6240.367438135623.
[I 2024-04-02 05:04:16,871] Trial 133 finished with value: 7663.728888438107 and parameters: {'model_name': 'GAIN', 'batch_size': 1, 'hint_rate': 0.23, 'alpha': 3, 'iterations': 53667}. Best is trial 4 with value: 6240.367438135623.
[I 2024-04-02 05:06:11,574] Trial 138 finished with value: 9288.205494085461 and parameters: {'model_name': 'GAIN', 'batch_size': 1, 'hint_rate': 0.23, 'alpha': 0, 'iterations': 55202}. Best is trial 4 with value: 6240.367438135623.
[I 2024-04-02 05:14:11,304] Trial 149 finished with value: 7001.882368985454 and parameters: {'model_name': 'GAIN', 'batch_size': 1, 'hint_rate': 0.25, 'alpha': 9, 'iterations': 57001}. Best is trial 4 with value: 6240.367438135623.
[I 2024-04-02 05:22:58,327] Trial 134 finished with value: 10475.792291946585 and parameters: {'model_name': 'GAIN', 'batch_size': 1, 'hint_rate': 0.25, 'alpha': 0, 'iterations': 60767}. Best is trial 4 with value: 6240.367438135623.
[I 2024-04-02 05:24:27,185] Trial 126 finished with value: 7288.287691346601 and parameters: {'model_name': 'GAIN', 'batch_size': 1, 'hint_rate': 0.27, 'alpha': 2, 'iterations': 60233}. Best is trial 4 with value: 6240.367438135623.
[I 2024-04-02 05:27:24,894] Trial 141 finished with value: 29042.053147312232 and parameters: {'model_name': 'GAIN', 'batch_size': 1, 'hint_rate': 0.2, 'alpha': 0, 'iterations': 61831}. Best is trial 4 with value: 6240.367438135623.
[I 2024-04-02 05:31:14,447] Trial 145 finished with value: inf and parameters: {'model_name': 'GAIN', 'batch_size': 1, 'hint_rate': 0.24000000000000002, 'alpha': 2, 'iterations': 89853}. Best is trial 4 with value: 6240.367438135623.
[I 2024-04-02 05:38:37,609] Trial 137 finished with value: 9298.67530913746 and parameters: {'model_name': 'GAIN', 'batch_size': 1, 'hint_rate': 0.24000000000000002, 'alpha': 0, 'iterations': 68077}. Best is trial 4 with value: 6240.367438135623.
[I 2024-04-02 05:40:12,655] Trial 151 finished with value: 7603.509015931949 and parameters: {'model_name': 'GAIN', 'batch_size': 1, 'hint_rate': 0.26, 'alpha': 1, 'iterations': 67785}. Best is trial 4 with value: 6240.367438135623.
[I 2024-04-02 05:51:19,322] Trial 122 finished with value: 7362.227041904938 and parameters: {'model_name': 'GAIN', 'batch_size': 1, 'hint_rate': 0.22, 'alpha': 4, 'iterations': 77547}. Best is trial 4 with value: 6240.367438135623.
[I 2024-04-02 05:51:24,921] Trial 123 finished with value: 7771.270266161259 and parameters: {'model_name': 'GAIN', 'batch_size': 1, 'hint_rate': 0.25, 'alpha': 3, 'iterations': 77167}. Best is trial 4 with value: 6240.367438135623.
[I 2024-04-02 05:51:48,858] Trial 127 finished with value: inf and parameters: {'model_name': 'GAIN', 'batch_size': 1, 'hint_rate': 0.24000000000000002, 'alpha': 1, 'iterations': 97934}. Best is trial 4 with value: 6240.367438135623.
[I 2024-04-02 05:55:00,872] Trial 129 finished with value: 7893.70156101069 and parameters: {'model_name': 'GAIN', 'batch_size': 1, 'hint_rate': 0.25, 'alpha': 1, 'iterations': 86132}. Best is trial 4 with value: 6240.367438135623.
[I 2024-04-02 05:55:51,764] Trial 154 finished with value: 7258.870499932091 and parameters: {'model_name': 'GAIN', 'batch_size': 1, 'hint_rate': 0.26, 'alpha': 8, 'iterations': 89618}. Best is trial 4 with value: 6240.367438135623.
