[I 2023-12-26 20:04:47,952] Trial 82 finished with value: 0.24821798751598623 and parameters: {'model_name': 'IterativeImputer', 'sample_posterior': True, 'initial_strategy': 'constant', 'imputation_order': 'descending'}. Best is trial 0 with value: 0.16753998470228798.
[I 2023-12-26 20:05:26,775] Trial 81 finished with value: 0.2478592734200277 and parameters: {'model_name': 'IterativeImputer', 'sample_posterior': True, 'initial_strategy': 'most_frequent', 'imputation_order': 'descending'}. Best is trial 0 with value: 0.16753998470228798.
[I 2023-12-26 20:10:01,569] Trial 94 finished with value: 0.16753998470228798 and parameters: {'model_name': 'IterativeImputer', 'sample_posterior': False, 'initial_strategy': 'median', 'imputation_order': 'roman'}. Best is trial 0 with value: 0.16753998470228798.
[I 2023-12-26 20:10:02,641] Trial 95 finished with value: 0.16753998470228798 and parameters: {'model_name': 'IterativeImputer', 'sample_posterior': False, 'initial_strategy': 'median', 'imputation_order': 'roman'}. Best is trial 0 with value: 0.16753998470228798.
[I 2023-12-26 20:10:17,201] Trial 96 finished with value: 0.16753998470228798 and parameters: {'model_name': 'IterativeImputer', 'sample_posterior': False, 'initial_strategy': 'median', 'imputation_order': 'roman'}. Best is trial 0 with value: 0.16753998470228798.
[I 2023-12-26 20:11:11,297] Trial 98 finished with value: 0.16799297919704076 and parameters: {'model_name': 'IterativeImputer', 'sample_posterior': False, 'initial_strategy': 'median', 'imputation_order': 'random'}. Best is trial 0 with value: 0.16753998470228798.
[I 2023-12-26 20:11:18,693] Trial 85 finished with value: 0.24729447028335913 and parameters: {'model_name': 'IterativeImputer', 'sample_posterior': True, 'initial_strategy': 'median', 'imputation_order': 'ascending'}. Best is trial 0 with value: 0.16753998470228798.
[I 2023-12-26 20:11:20,625] Trial 99 finished with value: 0.16766973744256375 and parameters: {'model_name': 'IterativeImputer', 'sample_posterior': False, 'initial_strategy': 'median', 'imputation_order': 'random'}. Best is trial 0 with value: 0.16753998470228798.
[I 2023-12-26 20:11:31,333] Trial 102 finished with value: 0.16753998470228798 and parameters: {'model_name': 'IterativeImputer', 'sample_posterior': False, 'initial_strategy': 'constant', 'imputation_order': 'roman'}. Best is trial 0 with value: 0.16753998470228798.
[I 2023-12-26 20:11:32,715] Trial 97 finished with value: 0.16763852876256635 and parameters: {'model_name': 'IterativeImputer', 'sample_posterior': False, 'initial_strategy': 'median', 'imputation_order': 'random'}. Best is trial 0 with value: 0.16753998470228798.
[I 2023-12-26 20:11:41,274] Trial 100 finished with value: 0.1675575104660703 and parameters: {'model_name': 'IterativeImputer', 'sample_posterior': False, 'initial_strategy': 'mean', 'imputation_order': 'roman'}. Best is trial 0 with value: 0.16753998470228798.
[I 2023-12-26 20:12:25,650] Trial 101 finished with value: 0.16753998470228798 and parameters: {'model_name': 'IterativeImputer', 'sample_posterior': False, 'initial_strategy': 'most_frequent', 'imputation_order': 'roman'}. Best is trial 0 with value: 0.16753998470228798.
[I 2023-12-26 20:12:27,974] Trial 103 finished with value: 0.16753998470228798 and parameters: {'model_name': 'IterativeImputer', 'sample_posterior': False, 'initial_strategy': 'constant', 'imputation_order': 'roman'}. Best is trial 0 with value: 0.16753998470228798.
[I 2023-12-26 20:15:40,005] Trial 87 finished with value: 0.24815969066997426 and parameters: {'model_name': 'IterativeImputer', 'sample_posterior': True, 'initial_strategy': 'most_frequent', 'imputation_order': 'descending'}. Best is trial 0 with value: 0.16753998470228798.
[I 2023-12-26 20:15:52,296] Trial 86 finished with value: 0.24892215658353217 and parameters: {'model_name': 'IterativeImputer', 'sample_posterior': True, 'initial_strategy': 'most_frequent', 'imputation_order': 'ascending'}. Best is trial 0 with value: 0.16753998470228798.
[I 2023-12-26 20:16:11,780] Trial 88 finished with value: 0.24658346353713556 and parameters: {'model_name': 'IterativeImputer', 'sample_posterior': True, 'initial_strategy': 'most_frequent', 'imputation_order': 'random'}. Best is trial 0 with value: 0.16753998470228798.
[I 2023-12-26 20:16:26,628] Trial 104 finished with value: 0.16753998470228798 and parameters: {'model_name': 'IterativeImputer', 'sample_posterior': False, 'initial_strategy': 'constant', 'imputation_order': 'roman'}. Best is trial 0 with value: 0.16753998470228798.
[I 2023-12-26 20:17:04,503] Trial 105 finished with value: 0.16753998470228798 and parameters: {'model_name': 'IterativeImputer', 'sample_posterior': False, 'initial_strategy': 'constant', 'imputation_order': 'roman'}. Best is trial 0 with value: 0.16753998470228798.
[I 2023-12-26 20:17:51,961] Trial 106 finished with value: 0.16753998470228798 and parameters: {'model_name': 'IterativeImputer', 'sample_posterior': False, 'initial_strategy': 'constant', 'imputation_order': 'roman'}. Best is trial 0 with value: 0.16753998470228798.
[I 2023-12-26 20:20:56,695] Trial 108 finished with value: 0.16753998470228798 and parameters: {'model_name': 'IterativeImputer', 'sample_posterior': False, 'initial_strategy': 'constant', 'imputation_order': 'roman'}. Best is trial 0 with value: 0.16753998470228798.
[I 2023-12-26 20:25:24,249] Trial 91 finished with value: 0.24659080375819764 and parameters: {'model_name': 'IterativeImputer', 'sample_posterior': True, 'initial_strategy': 'constant', 'imputation_order': 'descending'}. Best is trial 0 with value: 0.16753998470228798.
[I 2023-12-26 20:37:07,443] Trial 54 finished with value: 0.30481323120977316 and parameters: {'model_name': 'RandomForestImputer', 'max_iter': 46, 'decreasing': True, 'min_samples_split': 1.0, 'min_samples_leaf': 0.2, 'max_features': 0.9, 'warm_start': False}. Best is trial 0 with value: 0.16753998470228798.
[I 2023-12-26 20:47:57,562] Trial 15 finished with value: inf and parameters: {'model_name': 'GAIN', 'batch_size': 483, 'hint_rate': 0.7000000000000001, 'alpha': 3, 'iterations': 15754}. Best is trial 0 with value: 0.16753998470228798.
[I 2023-12-26 20:50:37,125] Trial 119 finished with value: 0.16753998470228798 and parameters: {'model_name': 'IterativeImputer', 'sample_posterior': False, 'initial_strategy': 'constant', 'imputation_order': 'roman'}. Best is trial 0 with value: 0.16753998470228798.
[I 2023-12-26 20:53:21,548] Trial 120 finished with value: 0.16753998470228798 and parameters: {'model_name': 'IterativeImputer', 'sample_posterior': False, 'initial_strategy': 'most_frequent', 'imputation_order': 'roman'}. Best is trial 0 with value: 0.16753998470228798.
[I 2023-12-26 20:53:52,704] Trial 107 finished with value: 0.24619122652171782 and parameters: {'model_name': 'IterativeImputer', 'sample_posterior': True, 'initial_strategy': 'constant', 'imputation_order': 'roman'}. Best is trial 0 with value: 0.16753998470228798.
[I 2023-12-26 20:54:51,364] Trial 125 finished with value: 0.16753998470228798 and parameters: {'model_name': 'IterativeImputer', 'sample_posterior': False, 'initial_strategy': 'median', 'imputation_order': 'roman'}. Best is trial 0 with value: 0.16753998470228798.
[I 2023-12-26 20:55:23,301] Trial 121 finished with value: 0.16753998470228798 and parameters: {'model_name': 'IterativeImputer', 'sample_posterior': False, 'initial_strategy': 'most_frequent', 'imputation_order': 'roman'}. Best is trial 0 with value: 0.16753998470228798.
[I 2023-12-26 20:55:28,078] Trial 127 finished with value: 0.16753998470228798 and parameters: {'model_name': 'IterativeImputer', 'sample_posterior': False, 'initial_strategy': 'median', 'imputation_order': 'roman'}. Best is trial 0 with value: 0.16753998470228798.
[I 2023-12-26 20:55:30,262] Trial 126 finished with value: 0.16753998470228798 and parameters: {'model_name': 'IterativeImputer', 'sample_posterior': False, 'initial_strategy': 'median', 'imputation_order': 'roman'}. Best is trial 0 with value: 0.16753998470228798.
[I 2023-12-26 20:55:31,580] Trial 123 finished with value: 0.16753998470228798 and parameters: {'model_name': 'IterativeImputer', 'sample_posterior': False, 'initial_strategy': 'most_frequent', 'imputation_order': 'roman'}. Best is trial 0 with value: 0.16753998470228798.
[I 2023-12-26 20:55:44,170] Trial 122 finished with value: 0.16753998470228798 and parameters: {'model_name': 'IterativeImputer', 'sample_posterior': False, 'initial_strategy': 'most_frequent', 'imputation_order': 'roman'}. Best is trial 0 with value: 0.16753998470228798.
[I 2023-12-26 20:55:52,173] Trial 124 finished with value: 0.16753998470228798 and parameters: {'model_name': 'IterativeImputer', 'sample_posterior': False, 'initial_strategy': 'most_frequent', 'imputation_order': 'roman'}. Best is trial 0 with value: 0.16753998470228798.
[I 2023-12-26 20:56:31,436] Trial 128 finished with value: 0.16753998470228798 and parameters: {'model_name': 'IterativeImputer', 'sample_posterior': False, 'initial_strategy': 'median', 'imputation_order': 'roman'}. Best is trial 0 with value: 0.16753998470228798.
[I 2023-12-26 20:56:55,260] Trial 129 finished with value: 0.16753998470228798 and parameters: {'model_name': 'IterativeImputer', 'sample_posterior': False, 'initial_strategy': 'median', 'imputation_order': 'roman'}. Best is trial 0 with value: 0.16753998470228798.
[I 2023-12-26 20:57:21,914] Trial 130 finished with value: 0.16753998470228798 and parameters: {'model_name': 'IterativeImputer', 'sample_posterior': False, 'initial_strategy': 'median', 'imputation_order': 'roman'}. Best is trial 0 with value: 0.16753998470228798.
[I 2023-12-26 20:57:43,049] Trial 109 finished with value: 0.24543492022687916 and parameters: {'model_name': 'IterativeImputer', 'sample_posterior': True, 'initial_strategy': 'constant', 'imputation_order': 'roman'}. Best is trial 0 with value: 0.16753998470228798.
[I 2023-12-26 20:59:31,510] Trial 110 finished with value: 0.24753126587183605 and parameters: {'model_name': 'IterativeImputer', 'sample_posterior': True, 'initial_strategy': 'constant', 'imputation_order': 'roman'}. Best is trial 0 with value: 0.16753998470228798.
[I 2023-12-26 21:00:24,752] Trial 112 finished with value: 0.24915732635904994 and parameters: {'model_name': 'IterativeImputer', 'sample_posterior': True, 'initial_strategy': 'constant', 'imputation_order': 'roman'}. Best is trial 0 with value: 0.16753998470228798.
[I 2023-12-26 21:00:30,379] Trial 111 finished with value: 0.2480748593239459 and parameters: {'model_name': 'IterativeImputer', 'sample_posterior': True, 'initial_strategy': 'constant', 'imputation_order': 'roman'}. Best is trial 0 with value: 0.16753998470228798.
[I 2023-12-26 21:02:00,348] Trial 113 finished with value: 0.2489757108294403 and parameters: {'model_name': 'IterativeImputer', 'sample_posterior': True, 'initial_strategy': 'constant', 'imputation_order': 'roman'}. Best is trial 0 with value: 0.16753998470228798.
[I 2023-12-26 21:06:03,164] Trial 131 finished with value: 0.16753998470228798 and parameters: {'model_name': 'IterativeImputer', 'sample_posterior': False, 'initial_strategy': 'median', 'imputation_order': 'roman'}. Best is trial 0 with value: 0.16753998470228798.
[I 2023-12-26 21:06:48,910] Trial 132 finished with value: 0.16753998470228798 and parameters: {'model_name': 'IterativeImputer', 'sample_posterior': False, 'initial_strategy': 'median', 'imputation_order': 'roman'}. Best is trial 0 with value: 0.16753998470228798.
[I 2023-12-26 21:11:38,424] Trial 115 finished with value: 0.2482749901017008 and parameters: {'model_name': 'IterativeImputer', 'sample_posterior': True, 'initial_strategy': 'constant', 'imputation_order': 'roman'}. Best is trial 0 with value: 0.16753998470228798.
[I 2023-12-26 21:11:40,745] Trial 114 finished with value: 0.24707045225690938 and parameters: {'model_name': 'IterativeImputer', 'sample_posterior': True, 'initial_strategy': 'constant', 'imputation_order': 'roman'}. Best is trial 0 with value: 0.16753998470228798.
[I 2023-12-26 21:12:45,134] Trial 133 finished with value: 0.16753998470228798 and parameters: {'model_name': 'IterativeImputer', 'sample_posterior': False, 'initial_strategy': 'median', 'imputation_order': 'roman'}. Best is trial 0 with value: 0.16753998470228798.
[I 2023-12-26 21:12:57,775] Trial 134 finished with value: 0.16753998470228798 and parameters: {'model_name': 'IterativeImputer', 'sample_posterior': False, 'initial_strategy': 'median', 'imputation_order': 'roman'}. Best is trial 0 with value: 0.16753998470228798.
[I 2023-12-26 21:13:04,213] Trial 135 finished with value: 0.16753998470228798 and parameters: {'model_name': 'IterativeImputer', 'sample_posterior': False, 'initial_strategy': 'median', 'imputation_order': 'roman'}. Best is trial 0 with value: 0.16753998470228798.
[I 2023-12-26 21:13:18,544] Trial 137 finished with value: 0.16753998470228798 and parameters: {'model_name': 'IterativeImputer', 'sample_posterior': False, 'initial_strategy': 'median', 'imputation_order': 'roman'}. Best is trial 0 with value: 0.16753998470228798.
[I 2023-12-26 21:13:46,018] Trial 138 finished with value: 0.16753998470228798 and parameters: {'model_name': 'IterativeImputer', 'sample_posterior': False, 'initial_strategy': 'median', 'imputation_order': 'roman'}. Best is trial 0 with value: 0.16753998470228798.
[I 2023-12-26 21:13:51,891] Trial 136 finished with value: 0.16753998470228798 and parameters: {'model_name': 'IterativeImputer', 'sample_posterior': False, 'initial_strategy': 'median', 'imputation_order': 'roman'}. Best is trial 0 with value: 0.16753998470228798.
[I 2023-12-26 21:14:00,675] Trial 139 finished with value: 0.16753998470228798 and parameters: {'model_name': 'IterativeImputer', 'sample_posterior': False, 'initial_strategy': 'median', 'imputation_order': 'roman'}. Best is trial 0 with value: 0.16753998470228798.
[I 2023-12-26 21:14:09,671] Trial 63 finished with value: inf and parameters: {'model_name': 'GAIN', 'batch_size': 109, 'hint_rate': 0.73, 'alpha': 16, 'iterations': 20901}. Best is trial 0 with value: 0.16753998470228798.
[I 2023-12-26 21:14:18,811] Trial 183 finished with value: 0.3109374229950041 and parameters: {'model_name': 'SimpleImputer', 'strategy': 'mean'}. Best is trial 0 with value: 0.16753998470228798.
[I 2023-12-26 21:14:21,861] Trial 140 finished with value: 0.16753998470228798 and parameters: {'model_name': 'IterativeImputer', 'sample_posterior': False, 'initial_strategy': 'constant', 'imputation_order': 'roman'}. Best is trial 0 with value: 0.16753998470228798.
[I 2023-12-26 21:14:30,116] Trial 141 finished with value: 0.16753998470228798 and parameters: {'model_name': 'IterativeImputer', 'sample_posterior': False, 'initial_strategy': 'constant', 'imputation_order': 'roman'}. Best is trial 0 with value: 0.16753998470228798.
[I 2023-12-26 21:15:08,783] Trial 116 finished with value: 0.2467835676468242 and parameters: {'model_name': 'IterativeImputer', 'sample_posterior': True, 'initial_strategy': 'constant', 'imputation_order': 'roman'}. Best is trial 0 with value: 0.16753998470228798.
[I 2023-12-26 21:15:13,773] Trial 142 finished with value: 0.16753998470228798 and parameters: {'model_name': 'IterativeImputer', 'sample_posterior': False, 'initial_strategy': 'constant', 'imputation_order': 'roman'}. Best is trial 0 with value: 0.16753998470228798.
[I 2023-12-26 21:15:39,682] Trial 143 finished with value: 0.16753998470228798 and parameters: {'model_name': 'IterativeImputer', 'sample_posterior': False, 'initial_strategy': 'constant', 'imputation_order': 'roman'}. Best is trial 0 with value: 0.16753998470228798.
[I 2023-12-26 21:15:45,394] Trial 117 finished with value: 0.249134628679276 and parameters: {'model_name': 'IterativeImputer', 'sample_posterior': True, 'initial_strategy': 'constant', 'imputation_order': 'roman'}. Best is trial 0 with value: 0.16753998470228798.
[I 2023-12-26 21:15:56,868] Trial 118 finished with value: 0.24703848133071826 and parameters: {'model_name': 'IterativeImputer', 'sample_posterior': True, 'initial_strategy': 'constant', 'imputation_order': 'roman'}. Best is trial 0 with value: 0.16753998470228798.
[I 2023-12-26 21:18:57,960] Trial 146 finished with value: 0.16753998470228798 and parameters: {'model_name': 'IterativeImputer', 'sample_posterior': False, 'initial_strategy': 'constant', 'imputation_order': 'roman'}. Best is trial 0 with value: 0.16753998470228798.
[I 2023-12-26 21:19:10,785] Trial 144 finished with value: 0.16753998470228798 and parameters: {'model_name': 'IterativeImputer', 'sample_posterior': False, 'initial_strategy': 'constant', 'imputation_order': 'roman'}. Best is trial 0 with value: 0.16753998470228798.
[I 2023-12-26 21:19:12,054] Trial 145 finished with value: 0.16753998470228798 and parameters: {'model_name': 'IterativeImputer', 'sample_posterior': False, 'initial_strategy': 'constant', 'imputation_order': 'roman'}. Best is trial 0 with value: 0.16753998470228798.
[I 2023-12-26 21:19:19,296] Trial 147 finished with value: 0.16753998470228798 and parameters: {'model_name': 'IterativeImputer', 'sample_posterior': False, 'initial_strategy': 'constant', 'imputation_order': 'roman'}. Best is trial 0 with value: 0.16753998470228798.
[I 2023-12-26 21:20:29,312] Trial 148 finished with value: 0.16753998470228798 and parameters: {'model_name': 'IterativeImputer', 'sample_posterior': False, 'initial_strategy': 'constant', 'imputation_order': 'roman'}. Best is trial 0 with value: 0.16753998470228798.
[I 2023-12-26 21:21:10,060] Trial 149 finished with value: 0.16753998470228798 and parameters: {'model_name': 'IterativeImputer', 'sample_posterior': False, 'initial_strategy': 'constant', 'imputation_order': 'roman'}. Best is trial 0 with value: 0.16753998470228798.
[I 2023-12-26 21:24:52,734] Trial 150 finished with value: 0.16753998470228798 and parameters: {'model_name': 'IterativeImputer', 'sample_posterior': False, 'initial_strategy': 'constant', 'imputation_order': 'roman'}. Best is trial 0 with value: 0.16753998470228798.
[I 2023-12-26 21:25:27,822] Trial 195 finished with value: 0.6564030935469009 and parameters: {'model_name': 'GAIN', 'batch_size': 4, 'hint_rate': 0.31, 'alpha': 25, 'iterations': 1}. Best is trial 0 with value: 0.16753998470228798.
[I 2023-12-26 21:27:49,438] Trial 197 finished with value: 0.6724532832304152 and parameters: {'model_name': 'GAIN', 'batch_size': 10, 'hint_rate': 0.3, 'alpha': 30, 'iterations': 1}. Best is trial 0 with value: 0.16753998470228798.
[I 2023-12-26 21:29:52,837] Trial 151 finished with value: 0.16753998470228798 and parameters: {'model_name': 'IterativeImputer', 'sample_posterior': False, 'initial_strategy': 'constant', 'imputation_order': 'roman'}. Best is trial 0 with value: 0.16753998470228798.
[I 2023-12-26 21:43:04,252] Trial 152 finished with value: 0.16753998470228798 and parameters: {'model_name': 'IterativeImputer', 'sample_posterior': False, 'initial_strategy': 'constant', 'imputation_order': 'roman'}. Best is trial 0 with value: 0.16753998470228798.
[I 2023-12-26 21:55:32,466] Trial 153 finished with value: 0.16753998470228798 and parameters: {'model_name': 'IterativeImputer', 'sample_posterior': False, 'initial_strategy': 'constant', 'imputation_order': 'roman'}. Best is trial 0 with value: 0.16753998470228798.
[I 2023-12-26 21:57:22,714] Trial 154 finished with value: 0.16753998470228798 and parameters: {'model_name': 'IterativeImputer', 'sample_posterior': False, 'initial_strategy': 'constant', 'imputation_order': 'roman'}. Best is trial 0 with value: 0.16753998470228798.
[I 2023-12-26 22:00:55,618] Trial 156 finished with value: 0.16753998470228798 and parameters: {'model_name': 'IterativeImputer', 'sample_posterior': False, 'initial_strategy': 'constant', 'imputation_order': 'roman'}. Best is trial 0 with value: 0.16753998470228798.
[I 2023-12-26 22:00:59,298] Trial 155 finished with value: 0.16753998470228798 and parameters: {'model_name': 'IterativeImputer', 'sample_posterior': False, 'initial_strategy': 'constant', 'imputation_order': 'roman'}. Best is trial 0 with value: 0.16753998470228798.
[I 2023-12-26 22:01:39,031] Trial 157 finished with value: 0.16753998470228798 and parameters: {'model_name': 'IterativeImputer', 'sample_posterior': False, 'initial_strategy': 'constant', 'imputation_order': 'roman'}. Best is trial 0 with value: 0.16753998470228798.
[I 2023-12-26 22:02:17,998] Trial 161 finished with value: 0.16753998470228798 and parameters: {'model_name': 'IterativeImputer', 'sample_posterior': False, 'initial_strategy': 'constant', 'imputation_order': 'roman'}. Best is trial 0 with value: 0.16753998470228798.
[I 2023-12-26 22:02:30,295] Trial 158 finished with value: 0.16753998470228798 and parameters: {'model_name': 'IterativeImputer', 'sample_posterior': False, 'initial_strategy': 'constant', 'imputation_order': 'roman'}. Best is trial 0 with value: 0.16753998470228798.
[I 2023-12-26 22:02:46,198] Trial 160 finished with value: 0.16753998470228798 and parameters: {'model_name': 'IterativeImputer', 'sample_posterior': False, 'initial_strategy': 'constant', 'imputation_order': 'roman'}. Best is trial 0 with value: 0.16753998470228798.
[I 2023-12-26 22:02:52,069] Trial 159 finished with value: 0.16753998470228798 and parameters: {'model_name': 'IterativeImputer', 'sample_posterior': False, 'initial_strategy': 'constant', 'imputation_order': 'roman'}. Best is trial 0 with value: 0.16753998470228798.
[I 2023-12-26 22:03:00,568] Trial 162 finished with value: 0.16753998470228798 and parameters: {'model_name': 'IterativeImputer', 'sample_posterior': False, 'initial_strategy': 'constant', 'imputation_order': 'roman'}. Best is trial 0 with value: 0.16753998470228798.
