[I 2024-01-16 03:54:09,265] Trial 192 finished with value: 0.36122543286820663 and parameters: {'model_name': 'IterativeImputer', 'sample_posterior': False, 'initial_strategy': 'constant', 'imputation_order': 'roman'}. Best is trial 128 with value: 0.36122529342171705.
[I 2024-01-16 03:54:22,066] Trial 120 finished with value: 0.47201121225989445 and parameters: {'model_name': 'IterativeImputer', 'sample_posterior': True, 'initial_strategy': 'most_frequent', 'imputation_order': 'random'}. Best is trial 128 with value: 0.36122529342171705.
[I 2024-01-16 03:54:30,354] Trial 121 finished with value: 0.46324373948936104 and parameters: {'model_name': 'IterativeImputer', 'sample_posterior': True, 'initial_strategy': 'most_frequent', 'imputation_order': 'random'}. Best is trial 128 with value: 0.36122529342171705.
[I 2024-01-16 03:55:30,637] Trial 122 finished with value: 0.46914616972461676 and parameters: {'model_name': 'IterativeImputer', 'sample_posterior': True, 'initial_strategy': 'most_frequent', 'imputation_order': 'random'}. Best is trial 128 with value: 0.36122529342171705.
[I 2024-01-16 03:55:37,975] Trial 123 finished with value: 0.4617986162815507 and parameters: {'model_name': 'IterativeImputer', 'sample_posterior': True, 'initial_strategy': 'most_frequent', 'imputation_order': 'random'}. Best is trial 128 with value: 0.36122529342171705.
[I 2024-01-16 03:55:39,299] Trial 124 finished with value: 0.46223514224702705 and parameters: {'model_name': 'IterativeImputer', 'sample_posterior': True, 'initial_strategy': 'most_frequent', 'imputation_order': 'random'}. Best is trial 128 with value: 0.36122529342171705.
[I 2024-01-16 04:00:34,282] Trial 56 finished with value: inf and parameters: {'model_name': 'GAIN', 'batch_size': 6, 'hint_rate': 0.16, 'alpha': 48, 'iterations': 22797}. Best is trial 128 with value: 0.36122529342171705.
[I 2024-01-16 04:10:02,925] Trial 194 finished with value: inf and parameters: {'model_name': 'GAIN', 'batch_size': 5, 'hint_rate': 0.9500000000000001, 'alpha': 93, 'iterations': 24111}. Best is trial 128 with value: 0.36122529342171705.
[I 2024-01-16 04:10:42,613] Trial 172 finished with value: inf and parameters: {'model_name': 'GAIN', 'batch_size': 5, 'hint_rate': 0.9400000000000001, 'alpha': 87, 'iterations': 25706}. Best is trial 128 with value: 0.36122529342171705.
[I 2024-01-16 04:16:26,531] Trial 193 finished with value: inf and parameters: {'model_name': 'GAIN', 'batch_size': 6, 'hint_rate': 0.9, 'alpha': 98, 'iterations': 33811}. Best is trial 128 with value: 0.36122529342171705.
[I 2024-01-16 04:18:44,631] Trial 188 finished with value: inf and parameters: {'model_name': 'GAIN', 'batch_size': 7, 'hint_rate': 0.85, 'alpha': 98, 'iterations': 37593}. Best is trial 128 with value: 0.36122529342171705.
[I 2024-01-16 04:20:35,931] Trial 186 finished with value: inf and parameters: {'model_name': 'GAIN', 'batch_size': 6, 'hint_rate': 0.99, 'alpha': 100, 'iterations': 40500}. Best is trial 128 with value: 0.36122529342171705.
[I 2024-01-16 04:20:50,559] Trial 178 finished with value: inf and parameters: {'model_name': 'GAIN', 'batch_size': 7, 'hint_rate': 0.99, 'alpha': 100, 'iterations': 41201}. Best is trial 128 with value: 0.36122529342171705.
[I 2024-01-16 04:21:33,312] Trial 182 finished with value: inf and parameters: {'model_name': 'GAIN', 'batch_size': 5, 'hint_rate': 0.89, 'alpha': 93, 'iterations': 42646}. Best is trial 128 with value: 0.36122529342171705.
[I 2024-01-16 04:22:07,465] Trial 177 finished with value: inf and parameters: {'model_name': 'GAIN', 'batch_size': 8, 'hint_rate': 0.97, 'alpha': 99, 'iterations': 43211}. Best is trial 128 with value: 0.36122529342171705.
[I 2024-01-16 04:24:14,085] Trial 191 finished with value: inf and parameters: {'model_name': 'GAIN', 'batch_size': 6, 'hint_rate': 0.87, 'alpha': 100, 'iterations': 47278}. Best is trial 128 with value: 0.36122529342171705.
[I 2024-01-16 04:24:39,836] Trial 38 finished with value: 0.3967156140015916 and parameters: {'model_name': 'RandomForestImputer', 'max_iter': 66, 'decreasing': True, 'min_samples_split': 0.7000000000000001, 'min_samples_leaf': 0.8, 'max_features': 0.4, 'warm_start': False}. Best is trial 128 with value: 0.36122529342171705.
[I 2024-01-16 04:26:39,155] Trial 170 finished with value: inf and parameters: {'model_name': 'GAIN', 'batch_size': 8, 'hint_rate': 0.98, 'alpha': 99, 'iterations': 52894}. Best is trial 128 with value: 0.36122529342171705.
[I 2024-01-16 04:27:41,284] Trial 162 finished with value: inf and parameters: {'model_name': 'GAIN', 'batch_size': 5, 'hint_rate': 0.98, 'alpha': 99, 'iterations': 56434}. Best is trial 128 with value: 0.36122529342171705.
[I 2024-01-16 04:31:43,307] Trial 176 finished with value: inf and parameters: {'model_name': 'GAIN', 'batch_size': 6, 'hint_rate': 0.99, 'alpha': 99, 'iterations': 66192}. Best is trial 128 with value: 0.36122529342171705.
[I 2024-01-16 04:31:53,586] Trial 190 finished with value: inf and parameters: {'model_name': 'GAIN', 'batch_size': 5, 'hint_rate': 0.97, 'alpha': 96, 'iterations': 66336}. Best is trial 128 with value: 0.36122529342171705.
[I 2024-01-16 04:32:02,093] Trial 173 finished with value: inf and parameters: {'model_name': 'GAIN', 'batch_size': 6, 'hint_rate': 0.92, 'alpha': 99, 'iterations': 66762}. Best is trial 128 with value: 0.36122529342171705.
[I 2024-01-16 04:32:28,843] Trial 167 finished with value: inf and parameters: {'model_name': 'GAIN', 'batch_size': 5, 'hint_rate': 0.99, 'alpha': 97, 'iterations': 68642}. Best is trial 128 with value: 0.36122529342171705.
[I 2024-01-16 04:33:14,255] Trial 175 finished with value: inf and parameters: {'model_name': 'GAIN', 'batch_size': 5, 'hint_rate': 0.99, 'alpha': 99, 'iterations': 71724}. Best is trial 128 with value: 0.36122529342171705.
[I 2024-01-16 04:34:05,106] Trial 163 finished with value: inf and parameters: {'model_name': 'GAIN', 'batch_size': 5, 'hint_rate': 0.99, 'alpha': 98, 'iterations': 74697}. Best is trial 128 with value: 0.36122529342171705.
[I 2024-01-16 04:34:45,950] Trial 180 finished with value: inf and parameters: {'model_name': 'GAIN', 'batch_size': 7, 'hint_rate': 0.97, 'alpha': 96, 'iterations': 76254}. Best is trial 128 with value: 0.36122529342171705.
[I 2024-01-16 04:36:03,982] Trial 179 finished with value: inf and parameters: {'model_name': 'GAIN', 'batch_size': 5, 'hint_rate': 0.99, 'alpha': 85, 'iterations': 82874}. Best is trial 128 with value: 0.36122529342171705.
[I 2024-01-16 04:36:12,029] Trial 196 finished with value: inf and parameters: {'model_name': 'GAIN', 'batch_size': 6, 'hint_rate': 0.93, 'alpha': 100, 'iterations': 82864}. Best is trial 128 with value: 0.36122529342171705.
[I 2024-01-16 04:36:16,006] Trial 12 finished with value: inf and parameters: {'model_name': 'GAIN', 'batch_size': 53, 'hint_rate': 0.61, 'alpha': 64, 'iterations': 83823}. Best is trial 128 with value: 0.36122529342171705.
[I 2024-01-16 04:36:35,057] Trial 165 finished with value: inf and parameters: {'model_name': 'GAIN', 'batch_size': 5, 'hint_rate': 0.97, 'alpha': 99, 'iterations': 87276}. Best is trial 128 with value: 0.36122529342171705.
[I 2024-01-16 04:36:46,023] Trial 185 finished with value: inf and parameters: {'model_name': 'GAIN', 'batch_size': 4, 'hint_rate': 0.93, 'alpha': 99, 'iterations': 87906}. Best is trial 128 with value: 0.36122529342171705.
[I 2024-01-16 04:37:11,836] Trial 168 finished with value: inf and parameters: {'model_name': 'GAIN', 'batch_size': 6, 'hint_rate': 0.97, 'alpha': 99, 'iterations': 93705}. Best is trial 128 with value: 0.36122529342171705.
[I 2024-01-16 04:37:14,262] Trial 164 finished with value: inf and parameters: {'model_name': 'GAIN', 'batch_size': 8, 'hint_rate': 0.81, 'alpha': 97, 'iterations': 94549}. Best is trial 128 with value: 0.36122529342171705.
[I 2024-01-16 04:37:24,411] Trial 161 finished with value: inf and parameters: {'model_name': 'GAIN', 'batch_size': 6, 'hint_rate': 0.9400000000000001, 'alpha': 99, 'iterations': 99325}. Best is trial 128 with value: 0.36122529342171705.
