[I 2024-04-23 17:06:08,160] Trial 129 finished with value: 1.7084387879689786 and parameters: {'model_name': 'SimpleImputer', 'strategy': 'mean'}. Best is trial 3 with value: 1.7084387879689786.
[I 2024-04-23 17:06:08,581] Trial 127 finished with value: 1.7084387879689786 and parameters: {'model_name': 'SimpleImputer', 'strategy': 'mean'}. Best is trial 3 with value: 1.7084387879689786.
[I 2024-04-23 17:06:08,810] Trial 92 finished with value: 1.855965394019735 and parameters: {'model_name': 'SimpleImputer', 'strategy': 'most_frequent'}. Best is trial 3 with value: 1.7084387879689786.
[I 2024-04-23 17:06:09,327] Trial 131 finished with value: 1.7084387879689786 and parameters: {'model_name': 'SimpleImputer', 'strategy': 'mean'}. Best is trial 3 with value: 1.7084387879689786.
[I 2024-04-23 17:06:09,808] Trial 66 finished with value: 1.855965394019735 and parameters: {'model_name': 'SimpleImputer', 'strategy': 'most_frequent'}. Best is trial 3 with value: 1.7084387879689786.
[I 2024-04-23 17:06:10,441] Trial 98 finished with value: 1.855965394019735 and parameters: {'model_name': 'SimpleImputer', 'strategy': 'most_frequent'}. Best is trial 3 with value: 1.7084387879689786.
[I 2024-04-23 17:06:10,630] Trial 102 finished with value: 1.855965394019735 and parameters: {'model_name': 'SimpleImputer', 'strategy': 'most_frequent'}. Best is trial 3 with value: 1.7084387879689786.
[I 2024-04-23 17:06:10,886] Trial 100 finished with value: 1.855965394019735 and parameters: {'model_name': 'SimpleImputer', 'strategy': 'most_frequent'}. Best is trial 3 with value: 1.7084387879689786.
[I 2024-04-23 17:06:11,142] Trial 132 finished with value: 1.7084387879689786 and parameters: {'model_name': 'SimpleImputer', 'strategy': 'mean'}. Best is trial 3 with value: 1.7084387879689786.
[I 2024-04-23 17:06:11,977] Trial 91 finished with value: 1.855965394019735 and parameters: {'model_name': 'SimpleImputer', 'strategy': 'most_frequent'}. Best is trial 3 with value: 1.7084387879689786.
[I 2024-04-23 17:06:12,237] Trial 93 finished with value: 1.855965394019735 and parameters: {'model_name': 'SimpleImputer', 'strategy': 'most_frequent'}. Best is trial 3 with value: 1.7084387879689786.
[I 2024-04-23 17:06:12,403] Trial 134 finished with value: 1.7084387879689786 and parameters: {'model_name': 'SimpleImputer', 'strategy': 'mean'}. Best is trial 3 with value: 1.7084387879689786.
[I 2024-04-23 17:06:12,719] Trial 112 finished with value: 1.855965394019735 and parameters: {'model_name': 'SimpleImputer', 'strategy': 'most_frequent'}. Best is trial 3 with value: 1.7084387879689786.
[I 2024-04-23 17:06:13,160] Trial 133 finished with value: 1.7084387879689786 and parameters: {'model_name': 'SimpleImputer', 'strategy': 'mean'}. Best is trial 3 with value: 1.7084387879689786.
[I 2024-04-23 17:06:13,591] Trial 89 finished with value: 1.855965394019735 and parameters: {'model_name': 'SimpleImputer', 'strategy': 'most_frequent'}. Best is trial 3 with value: 1.7084387879689786.
[I 2024-04-23 17:06:13,879] Trial 136 finished with value: 1.7084387879689786 and parameters: {'model_name': 'SimpleImputer', 'strategy': 'mean'}. Best is trial 3 with value: 1.7084387879689786.
[I 2024-04-23 17:06:14,190] Trial 105 finished with value: 1.855965394019735 and parameters: {'model_name': 'SimpleImputer', 'strategy': 'most_frequent'}. Best is trial 3 with value: 1.7084387879689786.
[I 2024-04-23 17:06:14,931] Trial 137 finished with value: 1.7084387879689786 and parameters: {'model_name': 'SimpleImputer', 'strategy': 'mean'}. Best is trial 3 with value: 1.7084387879689786.
[I 2024-04-23 17:06:15,278] Trial 142 finished with value: 1.7084387879689786 and parameters: {'model_name': 'SimpleImputer', 'strategy': 'mean'}. Best is trial 3 with value: 1.7084387879689786.
[I 2024-04-23 17:06:15,472] Trial 135 finished with value: 1.7084387879689786 and parameters: {'model_name': 'SimpleImputer', 'strategy': 'mean'}. Best is trial 3 with value: 1.7084387879689786.
[I 2024-04-23 17:06:15,746] Trial 138 finished with value: 1.7084387879689786 and parameters: {'model_name': 'SimpleImputer', 'strategy': 'mean'}. Best is trial 3 with value: 1.7084387879689786.
[I 2024-04-23 17:06:16,108] Trial 139 finished with value: 1.7084387879689786 and parameters: {'model_name': 'SimpleImputer', 'strategy': 'mean'}. Best is trial 3 with value: 1.7084387879689786.
[I 2024-04-23 17:06:16,386] Trial 140 finished with value: 1.7084387879689786 and parameters: {'model_name': 'SimpleImputer', 'strategy': 'mean'}. Best is trial 3 with value: 1.7084387879689786.
[I 2024-04-23 17:06:16,731] Trial 141 finished with value: 1.7084387879689786 and parameters: {'model_name': 'SimpleImputer', 'strategy': 'mean'}. Best is trial 3 with value: 1.7084387879689786.
[I 2024-04-23 17:06:17,107] Trial 108 finished with value: 1.855965394019735 and parameters: {'model_name': 'SimpleImputer', 'strategy': 'most_frequent'}. Best is trial 3 with value: 1.7084387879689786.
[I 2024-04-23 17:06:17,428] Trial 87 finished with value: 1.855965394019735 and parameters: {'model_name': 'SimpleImputer', 'strategy': 'most_frequent'}. Best is trial 3 with value: 1.7084387879689786.
[I 2024-04-23 17:06:17,805] Trial 144 finished with value: 1.7084387879689786 and parameters: {'model_name': 'SimpleImputer', 'strategy': 'mean'}. Best is trial 3 with value: 1.7084387879689786.
[I 2024-04-23 17:06:18,017] Trial 143 finished with value: 1.7084387879689786 and parameters: {'model_name': 'SimpleImputer', 'strategy': 'mean'}. Best is trial 3 with value: 1.7084387879689786.
[I 2024-04-23 17:06:18,457] Trial 101 finished with value: 1.855965394019735 and parameters: {'model_name': 'SimpleImputer', 'strategy': 'most_frequent'}. Best is trial 3 with value: 1.7084387879689786.
[I 2024-04-23 17:06:18,631] Trial 150 finished with value: 1.7084387879689786 and parameters: {'model_name': 'SimpleImputer', 'strategy': 'mean'}. Best is trial 3 with value: 1.7084387879689786.
[I 2024-04-23 17:06:18,810] Trial 145 finished with value: 1.7084387879689786 and parameters: {'model_name': 'SimpleImputer', 'strategy': 'mean'}. Best is trial 3 with value: 1.7084387879689786.
[I 2024-04-23 17:06:19,069] Trial 147 finished with value: 1.7084387879689786 and parameters: {'model_name': 'SimpleImputer', 'strategy': 'mean'}. Best is trial 3 with value: 1.7084387879689786.
[I 2024-04-23 17:06:19,246] Trial 96 finished with value: 1.855965394019735 and parameters: {'model_name': 'SimpleImputer', 'strategy': 'most_frequent'}. Best is trial 3 with value: 1.7084387879689786.
[I 2024-04-23 17:06:19,502] Trial 95 finished with value: 1.855965394019735 and parameters: {'model_name': 'SimpleImputer', 'strategy': 'most_frequent'}. Best is trial 3 with value: 1.7084387879689786.
[I 2024-04-23 17:06:19,689] Trial 149 finished with value: 1.7084387879689786 and parameters: {'model_name': 'SimpleImputer', 'strategy': 'mean'}. Best is trial 3 with value: 1.7084387879689786.
[I 2024-04-23 17:06:19,962] Trial 148 finished with value: 1.7084387879689786 and parameters: {'model_name': 'SimpleImputer', 'strategy': 'mean'}. Best is trial 3 with value: 1.7084387879689786.
[I 2024-04-23 17:06:20,183] Trial 94 finished with value: 1.855965394019735 and parameters: {'model_name': 'SimpleImputer', 'strategy': 'most_frequent'}. Best is trial 3 with value: 1.7084387879689786.
[I 2024-04-23 17:06:20,942] Trial 146 finished with value: 1.7084387879689786 and parameters: {'model_name': 'SimpleImputer', 'strategy': 'mean'}. Best is trial 3 with value: 1.7084387879689786.
[I 2024-04-23 17:06:21,376] Trial 116 finished with value: 1.855965394019735 and parameters: {'model_name': 'SimpleImputer', 'strategy': 'most_frequent'}. Best is trial 3 with value: 1.7084387879689786.
[I 2024-04-23 17:06:21,650] Trial 154 finished with value: 1.7084387879689786 and parameters: {'model_name': 'SimpleImputer', 'strategy': 'mean'}. Best is trial 3 with value: 1.7084387879689786.
[I 2024-04-23 17:06:21,843] Trial 152 finished with value: 1.7084387879689786 and parameters: {'model_name': 'SimpleImputer', 'strategy': 'mean'}. Best is trial 3 with value: 1.7084387879689786.
[I 2024-04-23 17:06:22,008] Trial 151 finished with value: 1.7084387879689786 and parameters: {'model_name': 'SimpleImputer', 'strategy': 'mean'}. Best is trial 3 with value: 1.7084387879689786.
[I 2024-04-23 17:06:22,508] Trial 103 finished with value: 1.855965394019735 and parameters: {'model_name': 'SimpleImputer', 'strategy': 'most_frequent'}. Best is trial 3 with value: 1.7084387879689786.
[I 2024-04-23 17:06:22,760] Trial 157 finished with value: 1.7084387879689786 and parameters: {'model_name': 'SimpleImputer', 'strategy': 'mean'}. Best is trial 3 with value: 1.7084387879689786.
[I 2024-04-23 17:06:22,933] Trial 155 finished with value: 1.7084387879689786 and parameters: {'model_name': 'SimpleImputer', 'strategy': 'mean'}. Best is trial 3 with value: 1.7084387879689786.
[I 2024-04-23 17:06:23,134] Trial 153 finished with value: 1.7084387879689786 and parameters: {'model_name': 'SimpleImputer', 'strategy': 'mean'}. Best is trial 3 with value: 1.7084387879689786.
[I 2024-04-23 17:06:23,554] Trial 107 finished with value: 1.855965394019735 and parameters: {'model_name': 'SimpleImputer', 'strategy': 'most_frequent'}. Best is trial 3 with value: 1.7084387879689786.
[I 2024-04-23 17:06:23,915] Trial 158 finished with value: 1.7084387879689786 and parameters: {'model_name': 'SimpleImputer', 'strategy': 'mean'}. Best is trial 3 with value: 1.7084387879689786.
[I 2024-04-23 17:06:24,453] Trial 161 finished with value: 1.7084387879689786 and parameters: {'model_name': 'SimpleImputer', 'strategy': 'mean'}. Best is trial 3 with value: 1.7084387879689786.
[I 2024-04-23 17:06:24,641] Trial 156 finished with value: 1.7084387879689786 and parameters: {'model_name': 'SimpleImputer', 'strategy': 'mean'}. Best is trial 3 with value: 1.7084387879689786.
[I 2024-04-23 17:06:25,006] Trial 162 finished with value: 1.7084387879689786 and parameters: {'model_name': 'SimpleImputer', 'strategy': 'mean'}. Best is trial 3 with value: 1.7084387879689786.
[I 2024-04-23 17:06:25,199] Trial 159 finished with value: 1.7084387879689786 and parameters: {'model_name': 'SimpleImputer', 'strategy': 'mean'}. Best is trial 3 with value: 1.7084387879689786.
[I 2024-04-23 17:06:25,577] Trial 110 finished with value: 1.855965394019735 and parameters: {'model_name': 'SimpleImputer', 'strategy': 'most_frequent'}. Best is trial 3 with value: 1.7084387879689786.
[I 2024-04-23 17:06:25,902] Trial 115 finished with value: 1.855965394019735 and parameters: {'model_name': 'SimpleImputer', 'strategy': 'most_frequent'}. Best is trial 3 with value: 1.7084387879689786.
[I 2024-04-23 17:06:26,316] Trial 114 finished with value: 1.855965394019735 and parameters: {'model_name': 'SimpleImputer', 'strategy': 'most_frequent'}. Best is trial 3 with value: 1.7084387879689786.
[I 2024-04-23 17:06:26,561] Trial 163 finished with value: 1.7084387879689786 and parameters: {'model_name': 'SimpleImputer', 'strategy': 'mean'}. Best is trial 3 with value: 1.7084387879689786.
[I 2024-04-23 17:06:26,869] Trial 160 finished with value: 1.7084387879689786 and parameters: {'model_name': 'SimpleImputer', 'strategy': 'mean'}. Best is trial 3 with value: 1.7084387879689786.
[I 2024-04-23 17:06:27,170] Trial 109 finished with value: 1.855965394019735 and parameters: {'model_name': 'SimpleImputer', 'strategy': 'most_frequent'}. Best is trial 3 with value: 1.7084387879689786.
[I 2024-04-23 17:06:27,338] Trial 164 finished with value: 1.7084387879689786 and parameters: {'model_name': 'SimpleImputer', 'strategy': 'mean'}. Best is trial 3 with value: 1.7084387879689786.
[I 2024-04-23 17:06:27,759] Trial 168 finished with value: 1.7084387879689786 and parameters: {'model_name': 'SimpleImputer', 'strategy': 'mean'}. Best is trial 3 with value: 1.7084387879689786.
[I 2024-04-23 17:06:28,206] Trial 117 finished with value: 1.855965394019735 and parameters: {'model_name': 'SimpleImputer', 'strategy': 'most_frequent'}. Best is trial 3 with value: 1.7084387879689786.
[I 2024-04-23 17:06:28,389] Trial 169 finished with value: 1.7084387879689786 and parameters: {'model_name': 'SimpleImputer', 'strategy': 'mean'}. Best is trial 3 with value: 1.7084387879689786.
[I 2024-04-23 17:06:28,676] Trial 166 finished with value: 1.7084387879689786 and parameters: {'model_name': 'SimpleImputer', 'strategy': 'mean'}. Best is trial 3 with value: 1.7084387879689786.
[I 2024-04-23 17:06:29,017] Trial 167 finished with value: 1.7084387879689786 and parameters: {'model_name': 'SimpleImputer', 'strategy': 'mean'}. Best is trial 3 with value: 1.7084387879689786.
[I 2024-04-23 17:06:29,220] Trial 165 finished with value: 1.7084387879689786 and parameters: {'model_name': 'SimpleImputer', 'strategy': 'mean'}. Best is trial 3 with value: 1.7084387879689786.
[I 2024-04-23 17:06:29,408] Trial 174 finished with value: 1.7084387879689786 and parameters: {'model_name': 'SimpleImputer', 'strategy': 'mean'}. Best is trial 3 with value: 1.7084387879689786.
[I 2024-04-23 17:06:29,695] Trial 171 finished with value: 1.7084387879689786 and parameters: {'model_name': 'SimpleImputer', 'strategy': 'mean'}. Best is trial 3 with value: 1.7084387879689786.
[I 2024-04-23 17:06:30,115] Trial 175 finished with value: 1.7084387879689786 and parameters: {'model_name': 'SimpleImputer', 'strategy': 'mean'}. Best is trial 3 with value: 1.7084387879689786.
[I 2024-04-23 17:06:30,428] Trial 178 finished with value: 1.7084387879689786 and parameters: {'model_name': 'SimpleImputer', 'strategy': 'mean'}. Best is trial 3 with value: 1.7084387879689786.
[I 2024-04-23 17:06:30,649] Trial 106 finished with value: 1.855965394019735 and parameters: {'model_name': 'SimpleImputer', 'strategy': 'most_frequent'}. Best is trial 3 with value: 1.7084387879689786.
[I 2024-04-23 17:06:30,901] Trial 170 finished with value: 1.7084387879689786 and parameters: {'model_name': 'SimpleImputer', 'strategy': 'mean'}. Best is trial 3 with value: 1.7084387879689786.
[I 2024-04-23 17:06:31,071] Trial 183 finished with value: 1.7084387879689786 and parameters: {'model_name': 'SimpleImputer', 'strategy': 'mean'}. Best is trial 3 with value: 1.7084387879689786.
[I 2024-04-23 17:06:31,251] Trial 173 finished with value: 1.7084387879689786 and parameters: {'model_name': 'SimpleImputer', 'strategy': 'mean'}. Best is trial 3 with value: 1.7084387879689786.
[I 2024-04-23 17:06:31,414] Trial 180 finished with value: 1.7084387879689786 and parameters: {'model_name': 'SimpleImputer', 'strategy': 'mean'}. Best is trial 3 with value: 1.7084387879689786.
[I 2024-04-23 17:06:31,677] Trial 172 finished with value: 1.7084387879689786 and parameters: {'model_name': 'SimpleImputer', 'strategy': 'mean'}. Best is trial 3 with value: 1.7084387879689786.
[I 2024-04-23 17:06:31,935] Trial 182 finished with value: 1.7084387879689786 and parameters: {'model_name': 'SimpleImputer', 'strategy': 'mean'}. Best is trial 3 with value: 1.7084387879689786.
[I 2024-04-23 17:06:32,148] Trial 97 finished with value: 1.855965394019735 and parameters: {'model_name': 'SimpleImputer', 'strategy': 'most_frequent'}. Best is trial 3 with value: 1.7084387879689786.
[I 2024-04-23 17:06:32,388] Trial 113 finished with value: 1.855965394019735 and parameters: {'model_name': 'SimpleImputer', 'strategy': 'most_frequent'}. Best is trial 3 with value: 1.7084387879689786.
[I 2024-04-23 17:06:32,625] Trial 177 finished with value: 1.7084387879689786 and parameters: {'model_name': 'SimpleImputer', 'strategy': 'mean'}. Best is trial 3 with value: 1.7084387879689786.
[I 2024-04-23 17:06:32,927] Trial 179 finished with value: 1.7084387879689786 and parameters: {'model_name': 'SimpleImputer', 'strategy': 'mean'}. Best is trial 3 with value: 1.7084387879689786.
[I 2024-04-23 17:06:33,364] Trial 176 finished with value: 1.7084387879689786 and parameters: {'model_name': 'SimpleImputer', 'strategy': 'mean'}. Best is trial 3 with value: 1.7084387879689786.
[I 2024-04-23 17:06:33,627] Trial 181 finished with value: 1.7084387879689786 and parameters: {'model_name': 'SimpleImputer', 'strategy': 'mean'}. Best is trial 3 with value: 1.7084387879689786.
[I 2024-04-23 17:06:33,902] Trial 184 finished with value: 1.7084387879689786 and parameters: {'model_name': 'SimpleImputer', 'strategy': 'mean'}. Best is trial 3 with value: 1.7084387879689786.
[I 2024-04-23 17:06:34,279] Trial 191 finished with value: 1.7084387879689786 and parameters: {'model_name': 'SimpleImputer', 'strategy': 'mean'}. Best is trial 3 with value: 1.7084387879689786.
[I 2024-04-23 17:06:34,518] Trial 188 finished with value: 1.7084387879689786 and parameters: {'model_name': 'SimpleImputer', 'strategy': 'mean'}. Best is trial 3 with value: 1.7084387879689786.
[I 2024-04-23 17:06:34,855] Trial 189 finished with value: 1.7084387879689786 and parameters: {'model_name': 'SimpleImputer', 'strategy': 'mean'}. Best is trial 3 with value: 1.7084387879689786.
[I 2024-04-23 17:06:35,153] Trial 190 finished with value: 1.7084387879689786 and parameters: {'model_name': 'SimpleImputer', 'strategy': 'mean'}. Best is trial 3 with value: 1.7084387879689786.
[I 2024-04-23 17:06:35,438] Trial 185 finished with value: 1.855965394019735 and parameters: {'model_name': 'SimpleImputer', 'strategy': 'median'}. Best is trial 3 with value: 1.7084387879689786.
[I 2024-04-23 17:06:35,710] Trial 194 finished with value: 1.7084387879689786 and parameters: {'model_name': 'SimpleImputer', 'strategy': 'mean'}. Best is trial 3 with value: 1.7084387879689786.
[I 2024-04-23 17:06:36,011] Trial 186 finished with value: 1.855965394019735 and parameters: {'model_name': 'SimpleImputer', 'strategy': 'median'}. Best is trial 3 with value: 1.7084387879689786.
[I 2024-04-23 17:06:36,540] Trial 187 finished with value: 1.855965394019735 and parameters: {'model_name': 'SimpleImputer', 'strategy': 'median'}. Best is trial 3 with value: 1.7084387879689786.
[I 2024-04-23 17:06:36,889] Trial 197 finished with value: 1.855965394019735 and parameters: {'model_name': 'SimpleImputer', 'strategy': 'median'}. Best is trial 3 with value: 1.7084387879689786.
[I 2024-04-23 17:06:37,062] Trial 193 finished with value: 1.855965394019735 and parameters: {'model_name': 'SimpleImputer', 'strategy': 'median'}. Best is trial 3 with value: 1.7084387879689786.
[I 2024-04-23 17:06:37,322] Trial 198 finished with value: 1.855965394019735 and parameters: {'model_name': 'SimpleImputer', 'strategy': 'median'}. Best is trial 3 with value: 1.7084387879689786.
[I 2024-04-23 17:06:37,522] Trial 192 finished with value: 1.855965394019735 and parameters: {'model_name': 'SimpleImputer', 'strategy': 'median'}. Best is trial 3 with value: 1.7084387879689786.
[I 2024-04-23 17:06:37,795] Trial 195 finished with value: 1.855965394019735 and parameters: {'model_name': 'SimpleImputer', 'strategy': 'median'}. Best is trial 3 with value: 1.7084387879689786.
[I 2024-04-23 17:06:38,207] Trial 196 finished with value: 1.855965394019735 and parameters: {'model_name': 'SimpleImputer', 'strategy': 'median'}. Best is trial 3 with value: 1.7084387879689786.
[I 2024-04-23 17:06:38,589] Trial 199 finished with value: 1.855965394019735 and parameters: {'model_name': 'SimpleImputer', 'strategy': 'median'}. Best is trial 3 with value: 1.7084387879689786.
[I 2024-04-23 17:06:42,908] Trial 119 finished with value: 1.855965394019735 and parameters: {'model_name': 'SimpleImputer', 'strategy': 'most_frequent'}. Best is trial 3 with value: 1.7084387879689786.
[I 2024-04-23 17:06:43,383] Trial 120 finished with value: 1.855965394019735 and parameters: {'model_name': 'SimpleImputer', 'strategy': 'most_frequent'}. Best is trial 3 with value: 1.7084387879689786.
[I 2024-04-23 17:06:43,577] Trial 123 finished with value: 1.855965394019735 and parameters: {'model_name': 'SimpleImputer', 'strategy': 'most_frequent'}. Best is trial 3 with value: 1.7084387879689786.
[I 2024-04-23 17:06:43,799] Trial 121 finished with value: 1.855965394019735 and parameters: {'model_name': 'SimpleImputer', 'strategy': 'most_frequent'}. Best is trial 3 with value: 1.7084387879689786.
[I 2024-04-23 17:06:44,341] Trial 122 finished with value: 1.855965394019735 and parameters: {'model_name': 'SimpleImputer', 'strategy': 'most_frequent'}. Best is trial 3 with value: 1.7084387879689786.
[I 2024-04-23 17:06:44,608] Trial 125 finished with value: 1.855965394019735 and parameters: {'model_name': 'SimpleImputer', 'strategy': 'most_frequent'}. Best is trial 3 with value: 1.7084387879689786.
[I 2024-04-23 17:06:44,796] Trial 118 finished with value: 1.855965394019735 and parameters: {'model_name': 'SimpleImputer', 'strategy': 'most_frequent'}. Best is trial 3 with value: 1.7084387879689786.
