[I 2024-01-06 17:59:56,541] Trial 0 finished with value: 1309.5662779773697 and parameters: {'model_name': 'SimpleImputer', 'strategy': 'mean'}. Best is trial 0 with value: 1309.5662779773697.
[I 2024-01-06 17:59:59,092] Trial 2 finished with value: 1318.737490769386 and parameters: {'model_name': 'SimpleImputer', 'strategy': 'median'}. Best is trial 0 with value: 1309.5662779773697.
[I 2024-01-06 18:00:00,112] Trial 34 finished with value: 1318.737490769386 and parameters: {'model_name': 'SimpleImputer', 'strategy': 'constant'}. Best is trial 0 with value: 1309.5662779773697.
[I 2024-01-06 18:00:00,842] Trial 40 finished with value: 1318.737490769386 and parameters: {'model_name': 'SimpleImputer', 'strategy': 'constant'}. Best is trial 0 with value: 1309.5662779773697.
[I 2024-01-06 18:00:01,842] Trial 39 finished with value: 1318.737490769386 and parameters: {'model_name': 'SimpleImputer', 'strategy': 'constant'}. Best is trial 0 with value: 1309.5662779773697.
[I 2024-01-06 18:00:02,341] Trial 45 finished with value: 1309.5662779773697 and parameters: {'model_name': 'SimpleImputer', 'strategy': 'mean'}. Best is trial 0 with value: 1309.5662779773697.
2024-01-06 18:00:06.740301: E external/local_xla/xla/stream_executor/cuda/cuda_driver.cc:274] failed call to cuInit: CUDA_ERROR_NO_DEVICE: no CUDA-capable device is detected
2024-01-06 18:00:06.871737: I tensorflow/compiler/mlir/mlir_graph_optimization_pass.cc:388] MLIR V1 optimization pass is not enabled
[I 2024-01-06 18:00:09,154] Trial 8 finished with value: inf and parameters: {'model_name': 'GAIN', 'batch_size': 752, 'hint_rate': 0.88, 'alpha': 30, 'iterations': 11735}. Best is trial 0 with value: 1309.5662779773697.
[I 2024-01-06 18:00:18,446] Trial 49 finished with value: 1318.737490769386 and parameters: {'model_name': 'SimpleImputer', 'strategy': 'most_frequent'}. Best is trial 0 with value: 1309.5662779773697.
[I 2024-01-06 18:00:22,508] Trial 12 finished with value: 1363.2811338199656 and parameters: {'model_name': 'KNNImputer', 'weights': 'distance', 'keep_empty_features': False}. Best is trial 0 with value: 1309.5662779773697.
[I 2024-01-06 18:00:23,054] Trial 15 finished with value: 1363.2811338199656 and parameters: {'model_name': 'KNNImputer', 'weights': 'distance', 'keep_empty_features': False}. Best is trial 0 with value: 1309.5662779773697.
[I 2024-01-06 18:00:23,755] Trial 6 finished with value: 1362.22940932785 and parameters: {'model_name': 'KNNImputer', 'weights': 'uniform', 'keep_empty_features': False}. Best is trial 0 with value: 1309.5662779773697.
[I 2024-01-06 18:00:24,577] Trial 29 finished with value: 1363.2811338199656 and parameters: {'model_name': 'KNNImputer', 'weights': 'distance', 'keep_empty_features': False}. Best is trial 0 with value: 1309.5662779773697.
[I 2024-01-06 18:00:25,461] Trial 16 finished with value: 1362.22940932785 and parameters: {'model_name': 'KNNImputer', 'weights': 'uniform', 'keep_empty_features': False}. Best is trial 0 with value: 1309.5662779773697.
[I 2024-01-06 18:00:26,316] Trial 43 finished with value: 1362.22940932785 and parameters: {'model_name': 'KNNImputer', 'weights': 'uniform', 'keep_empty_features': False}. Best is trial 0 with value: 1309.5662779773697.
[I 2024-01-06 18:00:27,041] Trial 37 finished with value: 1362.22940932785 and parameters: {'model_name': 'KNNImputer', 'weights': 'uniform', 'keep_empty_features': False}. Best is trial 0 with value: 1309.5662779773697.
[I 2024-01-06 18:00:27,632] Trial 42 finished with value: 1363.2811338199656 and parameters: {'model_name': 'KNNImputer', 'weights': 'distance', 'keep_empty_features': False}. Best is trial 0 with value: 1309.5662779773697.
[I 2024-01-06 18:00:28,168] Trial 22 finished with value: 1363.2811338199656 and parameters: {'model_name': 'KNNImputer', 'weights': 'distance', 'keep_empty_features': False}. Best is trial 0 with value: 1309.5662779773697.
[I 2024-01-06 18:00:29,166] Trial 23 finished with value: 1362.22940932785 and parameters: {'model_name': 'KNNImputer', 'weights': 'uniform', 'keep_empty_features': False}. Best is trial 0 with value: 1309.5662779773697.
[I 2024-01-06 18:00:29,642] Trial 44 finished with value: 1362.22940932785 and parameters: {'model_name': 'KNNImputer', 'weights': 'uniform', 'keep_empty_features': False}. Best is trial 0 with value: 1309.5662779773697.
[I 2024-01-06 18:00:30,585] Trial 33 finished with value: 1362.22940932785 and parameters: {'model_name': 'KNNImputer', 'weights': 'uniform', 'keep_empty_features': False}. Best is trial 0 with value: 1309.5662779773697.
[I 2024-01-06 18:00:31,572] Trial 52 finished with value: 1363.2811338199656 and parameters: {'model_name': 'KNNImputer', 'weights': 'distance', 'keep_empty_features': False}. Best is trial 0 with value: 1309.5662779773697.
[I 2024-01-06 18:00:40,313] Trial 5 finished with value: 1309.5662779773697 and parameters: {'model_name': 'RandomForestImputer', 'max_iter': 1, 'decreasing': True, 'min_samples_split': 0.2, 'min_samples_leaf': 0.8, 'max_features': 0.2, 'warm_start': True}. Best is trial 0 with value: 1309.5662779773697.
[I 2024-01-06 18:01:10,810] Trial 69 finished with value: 1309.5662779773697 and parameters: {'model_name': 'RandomForestImputer', 'max_iter': 1, 'decreasing': True, 'min_samples_split': 0.2, 'min_samples_leaf': 0.8, 'max_features': 0.2, 'warm_start': True}. Best is trial 0 with value: 1309.5662779773697.
[I 2024-01-06 18:01:50,720] Trial 35 finished with value: 2196.9492495842596 and parameters: {'model_name': 'GAIN', 'batch_size': 1, 'hint_rate': 0.55, 'alpha': 78, 'iterations': 3}. Best is trial 0 with value: 1309.5662779773697.
[I 2024-01-06 18:01:58,388] Trial 4 finished with value: 2001.3631383703953 and parameters: {'model_name': 'GAIN', 'batch_size': 32, 'hint_rate': 0.12, 'alpha': 7, 'iterations': 7}. Best is trial 0 with value: 1309.5662779773697.
[I 2024-01-06 18:02:15,829] Trial 59 finished with value: 1309.8520003086592 and parameters: {'model_name': 'RandomForestImputer', 'max_iter': 2, 'decreasing': True, 'min_samples_split': 0.4, 'min_samples_leaf': 0.5, 'max_features': 0.4, 'warm_start': True}. Best is trial 0 with value: 1309.5662779773697.
[I 2024-01-06 18:02:18,900] Trial 68 finished with value: 1309.9121617129765 and parameters: {'model_name': 'RandomForestImputer', 'max_iter': 2, 'decreasing': False, 'min_samples_split': 0.4, 'min_samples_leaf': 0.5, 'max_features': 0.6, 'warm_start': True}. Best is trial 0 with value: 1309.5662779773697.
[I 2024-01-06 18:02:29,270] Trial 1 finished with value: 1685.7269012767028 and parameters: {'model_name': 'GAIN', 'batch_size': 66, 'hint_rate': 0.7100000000000001, 'alpha': 90, 'iterations': 18}. Best is trial 0 with value: 1309.5662779773697.
[I 2024-01-06 18:02:44,539] Trial 17 finished with value: 1596.14245502256 and parameters: {'model_name': 'GAIN', 'batch_size': 2, 'hint_rate': 0.85, 'alpha': 41, 'iterations': 26}. Best is trial 0 with value: 1309.5662779773697.
[I 2024-01-06 18:02:55,276] Trial 27 finished with value: 1309.6220817005778 and parameters: {'model_name': 'RandomForestImputer', 'max_iter': 3, 'decreasing': False, 'min_samples_split': 0.4, 'min_samples_leaf': 0.6, 'max_features': 0.5, 'warm_start': True}. Best is trial 0 with value: 1309.5662779773697.
[I 2024-01-06 18:03:09,243] Trial 48 finished with value: 1538.6572687953662 and parameters: {'model_name': 'GAIN', 'batch_size': 1, 'hint_rate': 0.9500000000000001, 'alpha': 81, 'iterations': 35}. Best is trial 0 with value: 1309.5662779773697.
[I 2024-01-06 18:03:11,629] Trial 57 finished with value: 1309.9959839777498 and parameters: {'model_name': 'RandomForestImputer', 'max_iter': 3, 'decreasing': False, 'min_samples_split': 0.1, 'min_samples_leaf': 0.9, 'max_features': 0.8, 'warm_start': True}. Best is trial 0 with value: 1309.5662779773697.
[I 2024-01-06 18:03:21,205] Trial 18 finished with value: 1309.852631146477 and parameters: {'model_name': 'RandomForestImputer', 'max_iter': 4, 'decreasing': False, 'min_samples_split': 0.0, 'min_samples_leaf': 0.5, 'max_features': 0.1, 'warm_start': True}. Best is trial 0 with value: 1309.5662779773697.
[I 2024-01-06 18:03:51,884] Trial 7 finished with value: 1309.2347085680437 and parameters: {'model_name': 'IterativeImputer', 'sample_posterior': False, 'initial_strategy': 'median', 'imputation_order': 'descending'}. Best is trial 7 with value: 1309.2347085680437.
[I 2024-01-06 18:03:52,706] Trial 20 finished with value: 1309.234724193899 and parameters: {'model_name': 'IterativeImputer', 'sample_posterior': False, 'initial_strategy': 'mean', 'imputation_order': 'ascending'}. Best is trial 7 with value: 1309.2347085680437.
[I 2024-01-06 18:03:56,463] Trial 13 finished with value: 1309.2345898731091 and parameters: {'model_name': 'IterativeImputer', 'sample_posterior': False, 'initial_strategy': 'mean', 'imputation_order': 'random'}. Best is trial 13 with value: 1309.2345898731091.
[I 2024-01-06 18:04:01,320] Trial 41 finished with value: 1309.2346946333917 and parameters: {'model_name': 'IterativeImputer', 'sample_posterior': False, 'initial_strategy': 'most_frequent', 'imputation_order': 'roman'}. Best is trial 13 with value: 1309.2345898731091.
[I 2024-01-06 18:04:04,139] Trial 65 finished with value: 1309.2346966159344 and parameters: {'model_name': 'IterativeImputer', 'sample_posterior': False, 'initial_strategy': 'mean', 'imputation_order': 'roman'}. Best is trial 13 with value: 1309.2345898731091.
[I 2024-01-06 18:04:09,784] Trial 47 finished with value: 1309.5662779773697 and parameters: {'model_name': 'RandomForestImputer', 'max_iter': 1, 'decreasing': True, 'min_samples_split': 0.9, 'min_samples_leaf': 0.9, 'max_features': 0.30000000000000004, 'warm_start': False}. Best is trial 13 with value: 1309.2345898731091.
[I 2024-01-06 18:04:13,620] Trial 60 finished with value: 1309.2345534623455 and parameters: {'model_name': 'IterativeImputer', 'sample_posterior': False, 'initial_strategy': 'median', 'imputation_order': 'random'}. Best is trial 60 with value: 1309.2345534623455.
[I 2024-01-06 18:04:14,872] Trial 28 finished with value: 1309.5662779773697 and parameters: {'model_name': 'RandomForestImputer', 'max_iter': 1, 'decreasing': True, 'min_samples_split': 1.0, 'min_samples_leaf': 0.6, 'max_features': 0.1, 'warm_start': False}. Best is trial 60 with value: 1309.2345534623455.
[I 2024-01-06 18:04:29,902] Trial 56 finished with value: 1309.5662779773697 and parameters: {'model_name': 'RandomForestImputer', 'max_iter': 1, 'decreasing': True, 'min_samples_split': 0.9, 'min_samples_leaf': 0.5, 'max_features': 0.1, 'warm_start': False}. Best is trial 60 with value: 1309.2345534623455.
[I 2024-01-06 18:04:41,279] Trial 70 finished with value: 1309.2347199483927 and parameters: {'model_name': 'IterativeImputer', 'sample_posterior': False, 'initial_strategy': 'median', 'imputation_order': 'arabic'}. Best is trial 60 with value: 1309.2345534623455.
[I 2024-01-06 18:04:55,666] Trial 51 finished with value: 1309.5191005504478 and parameters: {'model_name': 'RandomForestImputer', 'max_iter': 9, 'decreasing': True, 'min_samples_split': 0.2, 'min_samples_leaf': 0.7000000000000001, 'max_features': 0.4, 'warm_start': True}. Best is trial 60 with value: 1309.2345534623455.
[I 2024-01-06 18:05:11,181] Trial 71 finished with value: 1310.1533719608146 and parameters: {'model_name': 'RandomForestImputer', 'max_iter': 5, 'decreasing': True, 'min_samples_split': 0.1, 'min_samples_leaf': 0.8, 'max_features': 0.7000000000000001, 'warm_start': True}. Best is trial 60 with value: 1309.2345534623455.
[I 2024-01-06 18:05:17,108] Trial 64 finished with value: 1309.8834577686416 and parameters: {'model_name': 'RandomForestImputer', 'max_iter': 10, 'decreasing': False, 'min_samples_split': 0.5, 'min_samples_leaf': 0.8, 'max_features': 0.6, 'warm_start': True}. Best is trial 60 with value: 1309.2345534623455.
[I 2024-01-06 18:05:34,443] Trial 72 finished with value: 1309.2346591697237 and parameters: {'model_name': 'IterativeImputer', 'sample_posterior': False, 'initial_strategy': 'mean', 'imputation_order': 'random'}. Best is trial 60 with value: 1309.2345534623455.
[I 2024-01-06 18:05:48,478] Trial 73 finished with value: 1309.2347199483927 and parameters: {'model_name': 'IterativeImputer', 'sample_posterior': False, 'initial_strategy': 'constant', 'imputation_order': 'arabic'}. Best is trial 60 with value: 1309.2345534623455.
[I 2024-01-06 18:06:44,288] Trial 30 finished with value: 1309.9097559473057 and parameters: {'model_name': 'RandomForestImputer', 'max_iter': 15, 'decreasing': False, 'min_samples_split': 0.7000000000000001, 'min_samples_leaf': 0.6, 'max_features': 0.30000000000000004, 'warm_start': True}. Best is trial 60 with value: 1309.2345534623455.
[I 2024-01-06 18:06:48,899] Trial 78 finished with value: 1309.2346848825302 and parameters: {'model_name': 'IterativeImputer', 'sample_posterior': False, 'initial_strategy': 'mean', 'imputation_order': 'random'}. Best is trial 60 with value: 1309.2345534623455.
[I 2024-01-06 18:06:55,512] Trial 80 finished with value: 1309.2346966159344 and parameters: {'model_name': 'IterativeImputer', 'sample_posterior': False, 'initial_strategy': 'mean', 'imputation_order': 'roman'}. Best is trial 60 with value: 1309.2345534623455.
[I 2024-01-06 18:07:25,540] Trial 82 finished with value: 1309.2347112046104 and parameters: {'model_name': 'IterativeImputer', 'sample_posterior': False, 'initial_strategy': 'mean', 'imputation_order': 'descending'}. Best is trial 60 with value: 1309.2345534623455.
[I 2024-01-06 18:07:32,260] Trial 81 finished with value: 1309.2347085680437 and parameters: {'model_name': 'IterativeImputer', 'sample_posterior': False, 'initial_strategy': 'median', 'imputation_order': 'descending'}. Best is trial 60 with value: 1309.2345534623455.
[I 2024-01-06 18:07:43,848] Trial 83 finished with value: 1309.234450888718 and parameters: {'model_name': 'IterativeImputer', 'sample_posterior': False, 'initial_strategy': 'mean', 'imputation_order': 'random'}. Best is trial 83 with value: 1309.234450888718.
[I 2024-01-06 18:07:44,993] Trial 84 finished with value: 1309.234724193899 and parameters: {'model_name': 'IterativeImputer', 'sample_posterior': False, 'initial_strategy': 'mean', 'imputation_order': 'ascending'}. Best is trial 83 with value: 1309.234450888718.
[I 2024-01-06 18:07:50,152] Trial 85 finished with value: 1309.2346946333917 and parameters: {'model_name': 'IterativeImputer', 'sample_posterior': False, 'initial_strategy': 'median', 'imputation_order': 'roman'}. Best is trial 83 with value: 1309.234450888718.
[I 2024-01-06 18:07:58,785] Trial 88 finished with value: 1309.2346946333917 and parameters: {'model_name': 'IterativeImputer', 'sample_posterior': False, 'initial_strategy': 'median', 'imputation_order': 'roman'}. Best is trial 83 with value: 1309.234450888718.
[I 2024-01-06 18:08:00,929] Trial 86 finished with value: 1309.2346946333917 and parameters: {'model_name': 'IterativeImputer', 'sample_posterior': False, 'initial_strategy': 'most_frequent', 'imputation_order': 'roman'}. Best is trial 83 with value: 1309.234450888718.
[I 2024-01-06 18:08:12,012] Trial 87 finished with value: 1309.2346189442972 and parameters: {'model_name': 'IterativeImputer', 'sample_posterior': False, 'initial_strategy': 'most_frequent', 'imputation_order': 'random'}. Best is trial 83 with value: 1309.234450888718.
[I 2024-01-06 18:08:16,144] Trial 89 finished with value: 1309.2346946333917 and parameters: {'model_name': 'IterativeImputer', 'sample_posterior': False, 'initial_strategy': 'median', 'imputation_order': 'roman'}. Best is trial 83 with value: 1309.234450888718.
[I 2024-01-06 18:08:19,548] Trial 24 finished with value: 1309.8648148771633 and parameters: {'model_name': 'RandomForestImputer', 'max_iter': 24, 'decreasing': False, 'min_samples_split': 0.4, 'min_samples_leaf': 0.4, 'max_features': 0.1, 'warm_start': True}. Best is trial 83 with value: 1309.234450888718.
[I 2024-01-06 18:08:33,639] Trial 90 finished with value: 1309.2346946333917 and parameters: {'model_name': 'IterativeImputer', 'sample_posterior': False, 'initial_strategy': 'most_frequent', 'imputation_order': 'roman'}. Best is trial 83 with value: 1309.234450888718.
[I 2024-01-06 18:08:47,270] Trial 46 finished with value: 1401.5658643667443 and parameters: {'model_name': 'GAIN', 'batch_size': 1, 'hint_rate': 0.78, 'alpha': 39, 'iterations': 162}. Best is trial 83 with value: 1309.234450888718.
[I 2024-01-06 18:08:51,016] Trial 91 finished with value: 1309.2346946333917 and parameters: {'model_name': 'IterativeImputer', 'sample_posterior': False, 'initial_strategy': 'most_frequent', 'imputation_order': 'roman'}. Best is trial 83 with value: 1309.234450888718.
[I 2024-01-06 18:09:08,516] Trial 92 finished with value: 1309.2346346830147 and parameters: {'model_name': 'IterativeImputer', 'sample_posterior': False, 'initial_strategy': 'most_frequent', 'imputation_order': 'random'}. Best is trial 83 with value: 1309.234450888718.
[I 2024-01-06 18:09:11,614] Trial 93 finished with value: 1309.234590651139 and parameters: {'model_name': 'IterativeImputer', 'sample_posterior': False, 'initial_strategy': 'most_frequent', 'imputation_order': 'random'}. Best is trial 83 with value: 1309.234450888718.
[I 2024-01-06 18:09:19,983] Trial 94 finished with value: 1309.234683982511 and parameters: {'model_name': 'IterativeImputer', 'sample_posterior': False, 'initial_strategy': 'mean', 'imputation_order': 'random'}. Best is trial 83 with value: 1309.234450888718.
[I 2024-01-06 18:09:31,863] Trial 95 finished with value: 1309.2347924439762 and parameters: {'model_name': 'IterativeImputer', 'sample_posterior': False, 'initial_strategy': 'mean', 'imputation_order': 'random'}. Best is trial 83 with value: 1309.234450888718.
[I 2024-01-06 18:09:46,177] Trial 25 finished with value: 1377.6461685384684 and parameters: {'model_name': 'GAIN', 'batch_size': 1, 'hint_rate': 0.38, 'alpha': 22, 'iterations': 178}. Best is trial 83 with value: 1309.234450888718.
[I 2024-01-06 18:09:53,017] Trial 9 finished with value: 1310.663515156329 and parameters: {'model_name': 'RandomForestImputer', 'max_iter': 2, 'decreasing': True, 'min_samples_split': 0.0, 'min_samples_leaf': 0.7000000000000001, 'max_features': 0.2, 'warm_start': False}. Best is trial 83 with value: 1309.234450888718.
[I 2024-01-06 18:10:20,123] Trial 96 finished with value: 1309.2346557592748 and parameters: {'model_name': 'IterativeImputer', 'sample_posterior': False, 'initial_strategy': 'mean', 'imputation_order': 'random'}. Best is trial 83 with value: 1309.234450888718.
[I 2024-01-06 18:10:30,127] Trial 97 finished with value: 1309.2345057843036 and parameters: {'model_name': 'IterativeImputer', 'sample_posterior': False, 'initial_strategy': 'most_frequent', 'imputation_order': 'random'}. Best is trial 83 with value: 1309.234450888718.
[I 2024-01-06 18:10:36,211] Trial 98 finished with value: 1309.234842164321 and parameters: {'model_name': 'IterativeImputer', 'sample_posterior': False, 'initial_strategy': 'most_frequent', 'imputation_order': 'random'}. Best is trial 83 with value: 1309.234450888718.
[I 2024-01-06 18:10:56,056] Trial 99 finished with value: 1309.234690405566 and parameters: {'model_name': 'IterativeImputer', 'sample_posterior': False, 'initial_strategy': 'most_frequent', 'imputation_order': 'random'}. Best is trial 83 with value: 1309.234450888718.
[I 2024-01-06 18:12:03,999] Trial 58 finished with value: 1310.232306069564 and parameters: {'model_name': 'RandomForestImputer', 'max_iter': 3, 'decreasing': False, 'min_samples_split': 1.0, 'min_samples_leaf': 0.2, 'max_features': 0.4, 'warm_start': False}. Best is trial 83 with value: 1309.234450888718.
[I 2024-01-06 18:14:30,787] Trial 10 finished with value: 1309.3572418428068 and parameters: {'model_name': 'RandomForestImputer', 'max_iter': 82, 'decreasing': True, 'min_samples_split': 0.8, 'min_samples_leaf': 0.6, 'max_features': 0.30000000000000004, 'warm_start': True}. Best is trial 83 with value: 1309.234450888718.
[I 2024-01-06 18:15:52,581] Trial 67 finished with value: 1308.4125163406825 and parameters: {'model_name': 'RandomForestImputer', 'max_iter': 42, 'decreasing': False, 'min_samples_split': 1.0, 'min_samples_leaf': 0.1, 'max_features': 0.2, 'warm_start': True}. Best is trial 67 with value: 1308.4125163406825.
[I 2024-01-06 18:16:41,800] Trial 11 finished with value: 1309.5028296409007 and parameters: {'model_name': 'RandomForestImputer', 'max_iter': 55, 'decreasing': True, 'min_samples_split': 0.1, 'min_samples_leaf': 0.2, 'max_features': 0.8, 'warm_start': True}. Best is trial 67 with value: 1308.4125163406825.
[I 2024-01-06 18:19:11,583] Trial 26 finished with value: 1670.6465318172745 and parameters: {'model_name': 'IterativeImputer', 'sample_posterior': True, 'initial_strategy': 'mean', 'imputation_order': 'descending'}. Best is trial 67 with value: 1308.4125163406825.
[I 2024-01-06 18:19:18,274] Trial 36 finished with value: 1663.9447310908229 and parameters: {'model_name': 'IterativeImputer', 'sample_posterior': True, 'initial_strategy': 'median', 'imputation_order': 'roman'}. Best is trial 67 with value: 1308.4125163406825.
[I 2024-01-06 18:19:19,105] Trial 14 finished with value: 1675.6492657646304 and parameters: {'model_name': 'IterativeImputer', 'sample_posterior': True, 'initial_strategy': 'median', 'imputation_order': 'arabic'}. Best is trial 67 with value: 1308.4125163406825.
[I 2024-01-06 18:19:22,150] Trial 31 finished with value: 1686.9139193964202 and parameters: {'model_name': 'IterativeImputer', 'sample_posterior': True, 'initial_strategy': 'median', 'imputation_order': 'arabic'}. Best is trial 67 with value: 1308.4125163406825.
