[I 2024-04-25 03:19:09,383] Trial 128 finished with value: 0.07835155461994266 and parameters: {'model_name': 'SimpleImputer', 'strategy': 'mean'}. Best is trial 0 with value: 0.07835155461994266.
[I 2024-04-25 03:19:10,158] Trial 67 finished with value: 0.08027220246173179 and parameters: {'model_name': 'SimpleImputer', 'strategy': 'most_frequent'}. Best is trial 0 with value: 0.07835155461994266.
[I 2024-04-25 03:19:10,495] Trial 129 finished with value: 0.07835155461994266 and parameters: {'model_name': 'SimpleImputer', 'strategy': 'mean'}. Best is trial 0 with value: 0.07835155461994266.
[I 2024-04-25 03:19:11,734] Trial 85 finished with value: 0.08027220246173179 and parameters: {'model_name': 'SimpleImputer', 'strategy': 'most_frequent'}. Best is trial 0 with value: 0.07835155461994266.
[I 2024-04-25 03:19:12,956] Trial 97 finished with value: 0.08027220246173179 and parameters: {'model_name': 'SimpleImputer', 'strategy': 'most_frequent'}. Best is trial 0 with value: 0.07835155461994266.
[I 2024-04-25 03:19:15,609] Trial 130 finished with value: 0.07835155461994266 and parameters: {'model_name': 'SimpleImputer', 'strategy': 'mean'}. Best is trial 0 with value: 0.07835155461994266.
[I 2024-04-25 03:19:17,967] Trial 131 finished with value: 0.07835155461994266 and parameters: {'model_name': 'SimpleImputer', 'strategy': 'mean'}. Best is trial 0 with value: 0.07835155461994266.
[I 2024-04-25 03:19:20,222] Trial 132 finished with value: 0.07835155461994266 and parameters: {'model_name': 'SimpleImputer', 'strategy': 'mean'}. Best is trial 0 with value: 0.07835155461994266.
[I 2024-04-25 03:19:21,425] Trial 133 finished with value: 0.07835155461994266 and parameters: {'model_name': 'SimpleImputer', 'strategy': 'mean'}. Best is trial 0 with value: 0.07835155461994266.
[I 2024-04-25 03:19:22,036] Trial 134 finished with value: 0.07835155461994266 and parameters: {'model_name': 'SimpleImputer', 'strategy': 'mean'}. Best is trial 0 with value: 0.07835155461994266.
[I 2024-04-25 03:19:24,011] Trial 135 finished with value: 0.07835155461994266 and parameters: {'model_name': 'SimpleImputer', 'strategy': 'mean'}. Best is trial 0 with value: 0.07835155461994266.
[I 2024-04-25 03:19:24,925] Trial 92 finished with value: 0.08027220246173179 and parameters: {'model_name': 'SimpleImputer', 'strategy': 'most_frequent'}. Best is trial 0 with value: 0.07835155461994266.
[I 2024-04-25 03:19:27,018] Trial 89 finished with value: 0.08027220246173179 and parameters: {'model_name': 'SimpleImputer', 'strategy': 'most_frequent'}. Best is trial 0 with value: 0.07835155461994266.
[I 2024-04-25 03:19:27,356] Trial 95 finished with value: 0.08027220246173179 and parameters: {'model_name': 'SimpleImputer', 'strategy': 'most_frequent'}. Best is trial 0 with value: 0.07835155461994266.
[I 2024-04-25 03:19:28,281] Trial 136 finished with value: 0.07835155461994266 and parameters: {'model_name': 'SimpleImputer', 'strategy': 'mean'}. Best is trial 0 with value: 0.07835155461994266.
[I 2024-04-25 03:19:28,556] Trial 137 finished with value: 0.07835155461994266 and parameters: {'model_name': 'SimpleImputer', 'strategy': 'mean'}. Best is trial 0 with value: 0.07835155461994266.
[I 2024-04-25 03:19:31,799] Trial 83 finished with value: 0.08027220246173179 and parameters: {'model_name': 'SimpleImputer', 'strategy': 'most_frequent'}. Best is trial 0 with value: 0.07835155461994266.
[I 2024-04-25 03:19:32,641] Trial 138 finished with value: 0.07835155461994266 and parameters: {'model_name': 'SimpleImputer', 'strategy': 'mean'}. Best is trial 0 with value: 0.07835155461994266.
[I 2024-04-25 03:19:36,091] Trial 80 finished with value: 0.08027220246173179 and parameters: {'model_name': 'SimpleImputer', 'strategy': 'most_frequent'}. Best is trial 0 with value: 0.07835155461994266.
[I 2024-04-25 03:19:37,012] Trial 140 finished with value: 0.07835155461994266 and parameters: {'model_name': 'SimpleImputer', 'strategy': 'mean'}. Best is trial 0 with value: 0.07835155461994266.
[I 2024-04-25 03:19:37,087] Trial 139 finished with value: 0.07835155461994266 and parameters: {'model_name': 'SimpleImputer', 'strategy': 'mean'}. Best is trial 0 with value: 0.07835155461994266.
[I 2024-04-25 03:19:40,433] Trial 141 finished with value: 0.07835155461994266 and parameters: {'model_name': 'SimpleImputer', 'strategy': 'mean'}. Best is trial 0 with value: 0.07835155461994266.
[I 2024-04-25 03:19:40,751] Trial 90 finished with value: 0.08027220246173179 and parameters: {'model_name': 'SimpleImputer', 'strategy': 'most_frequent'}. Best is trial 0 with value: 0.07835155461994266.
[I 2024-04-25 03:19:42,497] Trial 39 finished with value: 0.08027220246173179 and parameters: {'model_name': 'SimpleImputer', 'strategy': 'most_frequent'}. Best is trial 0 with value: 0.07835155461994266.
[I 2024-04-25 03:19:43,067] Trial 144 finished with value: 0.07835155461994266 and parameters: {'model_name': 'SimpleImputer', 'strategy': 'mean'}. Best is trial 0 with value: 0.07835155461994266.
[I 2024-04-25 03:19:43,692] Trial 53 finished with value: 0.08027220246173179 and parameters: {'model_name': 'SimpleImputer', 'strategy': 'most_frequent'}. Best is trial 0 with value: 0.07835155461994266.
[I 2024-04-25 03:19:45,323] Trial 143 finished with value: 0.07835155461994266 and parameters: {'model_name': 'SimpleImputer', 'strategy': 'mean'}. Best is trial 0 with value: 0.07835155461994266.
[I 2024-04-25 03:19:45,760] Trial 145 finished with value: 0.07835155461994266 and parameters: {'model_name': 'SimpleImputer', 'strategy': 'mean'}. Best is trial 0 with value: 0.07835155461994266.
[I 2024-04-25 03:19:46,485] Trial 142 finished with value: 0.07835155461994266 and parameters: {'model_name': 'SimpleImputer', 'strategy': 'mean'}. Best is trial 0 with value: 0.07835155461994266.
[I 2024-04-25 03:19:49,077] Trial 28 finished with value: 0.08027220246173179 and parameters: {'model_name': 'SimpleImputer', 'strategy': 'most_frequent'}. Best is trial 0 with value: 0.07835155461994266.
[I 2024-04-25 03:19:49,692] Trial 98 finished with value: 0.08027220246173179 and parameters: {'model_name': 'SimpleImputer', 'strategy': 'most_frequent'}. Best is trial 0 with value: 0.07835155461994266.
[I 2024-04-25 03:19:50,488] Trial 146 finished with value: 0.07835155461994266 and parameters: {'model_name': 'SimpleImputer', 'strategy': 'mean'}. Best is trial 0 with value: 0.07835155461994266.
[I 2024-04-25 03:19:50,663] Trial 148 finished with value: 0.07835155461994266 and parameters: {'model_name': 'SimpleImputer', 'strategy': 'mean'}. Best is trial 0 with value: 0.07835155461994266.
[I 2024-04-25 03:19:53,000] Trial 96 finished with value: 0.08027220246173179 and parameters: {'model_name': 'SimpleImputer', 'strategy': 'most_frequent'}. Best is trial 0 with value: 0.07835155461994266.
[I 2024-04-25 03:19:53,550] Trial 44 finished with value: 0.08027220246173179 and parameters: {'model_name': 'SimpleImputer', 'strategy': 'most_frequent'}. Best is trial 0 with value: 0.07835155461994266.
[I 2024-04-25 03:19:54,110] Trial 147 finished with value: 0.07835155461994266 and parameters: {'model_name': 'SimpleImputer', 'strategy': 'mean'}. Best is trial 0 with value: 0.07835155461994266.
[I 2024-04-25 03:19:55,203] Trial 79 finished with value: 0.08027220246173179 and parameters: {'model_name': 'SimpleImputer', 'strategy': 'most_frequent'}. Best is trial 0 with value: 0.07835155461994266.
[I 2024-04-25 03:20:01,177] Trial 150 finished with value: 0.07835155461994266 and parameters: {'model_name': 'SimpleImputer', 'strategy': 'mean'}. Best is trial 0 with value: 0.07835155461994266.
[I 2024-04-25 03:20:01,437] Trial 149 finished with value: 0.07835155461994266 and parameters: {'model_name': 'SimpleImputer', 'strategy': 'mean'}. Best is trial 0 with value: 0.07835155461994266.
[I 2024-04-25 03:20:04,075] Trial 151 finished with value: 0.07835155461994266 and parameters: {'model_name': 'SimpleImputer', 'strategy': 'mean'}. Best is trial 0 with value: 0.07835155461994266.
[I 2024-04-25 03:20:07,319] Trial 155 finished with value: 0.07835155461994266 and parameters: {'model_name': 'SimpleImputer', 'strategy': 'mean'}. Best is trial 0 with value: 0.07835155461994266.
[I 2024-04-25 03:20:10,094] Trial 157 finished with value: 0.07835155461994266 and parameters: {'model_name': 'SimpleImputer', 'strategy': 'mean'}. Best is trial 0 with value: 0.07835155461994266.
[I 2024-04-25 03:20:10,373] Trial 152 finished with value: 0.07835155461994266 and parameters: {'model_name': 'SimpleImputer', 'strategy': 'mean'}. Best is trial 0 with value: 0.07835155461994266.
[I 2024-04-25 03:20:11,451] Trial 153 finished with value: 0.07835155461994266 and parameters: {'model_name': 'SimpleImputer', 'strategy': 'mean'}. Best is trial 0 with value: 0.07835155461994266.
[I 2024-04-25 03:20:11,808] Trial 156 finished with value: 0.07835155461994266 and parameters: {'model_name': 'SimpleImputer', 'strategy': 'mean'}. Best is trial 0 with value: 0.07835155461994266.
[I 2024-04-25 03:20:12,984] Trial 66 finished with value: 0.08027220246173179 and parameters: {'model_name': 'SimpleImputer', 'strategy': 'most_frequent'}. Best is trial 0 with value: 0.07835155461994266.
[I 2024-04-25 03:20:14,652] Trial 154 finished with value: 0.07835155461994266 and parameters: {'model_name': 'SimpleImputer', 'strategy': 'mean'}. Best is trial 0 with value: 0.07835155461994266.
[I 2024-04-25 03:20:15,636] Trial 159 finished with value: 0.07835155461994266 and parameters: {'model_name': 'SimpleImputer', 'strategy': 'mean'}. Best is trial 0 with value: 0.07835155461994266.
[I 2024-04-25 03:20:16,689] Trial 158 finished with value: 0.07835155461994266 and parameters: {'model_name': 'SimpleImputer', 'strategy': 'mean'}. Best is trial 0 with value: 0.07835155461994266.
[I 2024-04-25 03:20:17,574] Trial 107 finished with value: 0.08027220246173179 and parameters: {'model_name': 'SimpleImputer', 'strategy': 'most_frequent'}. Best is trial 0 with value: 0.07835155461994266.
[I 2024-04-25 03:20:17,868] Trial 94 finished with value: 0.08027220246173179 and parameters: {'model_name': 'SimpleImputer', 'strategy': 'most_frequent'}. Best is trial 0 with value: 0.07835155461994266.
[I 2024-04-25 03:20:21,180] Trial 76 finished with value: 0.08027220246173179 and parameters: {'model_name': 'SimpleImputer', 'strategy': 'most_frequent'}. Best is trial 0 with value: 0.07835155461994266.
[I 2024-04-25 03:20:23,100] Trial 162 finished with value: 0.07835155461994266 and parameters: {'model_name': 'SimpleImputer', 'strategy': 'mean'}. Best is trial 0 with value: 0.07835155461994266.
[I 2024-04-25 03:20:25,670] Trial 160 finished with value: 0.07835155461994266 and parameters: {'model_name': 'SimpleImputer', 'strategy': 'mean'}. Best is trial 0 with value: 0.07835155461994266.
[I 2024-04-25 03:20:27,658] Trial 161 finished with value: 0.07835155461994266 and parameters: {'model_name': 'SimpleImputer', 'strategy': 'mean'}. Best is trial 0 with value: 0.07835155461994266.
[I 2024-04-25 03:20:27,902] Trial 163 finished with value: 0.07835155461994266 and parameters: {'model_name': 'SimpleImputer', 'strategy': 'mean'}. Best is trial 0 with value: 0.07835155461994266.
[I 2024-04-25 03:20:28,442] Trial 164 finished with value: 0.07835155461994266 and parameters: {'model_name': 'SimpleImputer', 'strategy': 'mean'}. Best is trial 0 with value: 0.07835155461994266.
[I 2024-04-25 03:20:30,971] Trial 170 finished with value: 0.07835155461994266 and parameters: {'model_name': 'SimpleImputer', 'strategy': 'mean'}. Best is trial 0 with value: 0.07835155461994266.
[I 2024-04-25 03:20:32,512] Trial 108 finished with value: 0.08027220246173179 and parameters: {'model_name': 'SimpleImputer', 'strategy': 'most_frequent'}. Best is trial 0 with value: 0.07835155461994266.
[I 2024-04-25 03:20:33,828] Trial 169 finished with value: 0.07835155461994266 and parameters: {'model_name': 'SimpleImputer', 'strategy': 'mean'}. Best is trial 0 with value: 0.07835155461994266.
[I 2024-04-25 03:20:34,350] Trial 167 finished with value: 0.07835155461994266 and parameters: {'model_name': 'SimpleImputer', 'strategy': 'mean'}. Best is trial 0 with value: 0.07835155461994266.
[I 2024-04-25 03:20:34,735] Trial 168 finished with value: 0.07835155461994266 and parameters: {'model_name': 'SimpleImputer', 'strategy': 'mean'}. Best is trial 0 with value: 0.07835155461994266.
[I 2024-04-25 03:20:35,544] Trial 165 finished with value: 0.07835155461994266 and parameters: {'model_name': 'SimpleImputer', 'strategy': 'mean'}. Best is trial 0 with value: 0.07835155461994266.
[I 2024-04-25 03:20:36,931] Trial 166 finished with value: 0.07835155461994266 and parameters: {'model_name': 'SimpleImputer', 'strategy': 'mean'}. Best is trial 0 with value: 0.07835155461994266.
[I 2024-04-25 03:20:40,849] Trial 176 finished with value: 0.07835155461994266 and parameters: {'model_name': 'SimpleImputer', 'strategy': 'mean'}. Best is trial 0 with value: 0.07835155461994266.
[I 2024-04-25 03:20:41,489] Trial 172 finished with value: 0.07835155461994266 and parameters: {'model_name': 'SimpleImputer', 'strategy': 'mean'}. Best is trial 0 with value: 0.07835155461994266.
[I 2024-04-25 03:20:41,776] Trial 171 finished with value: 0.07835155461994266 and parameters: {'model_name': 'SimpleImputer', 'strategy': 'mean'}. Best is trial 0 with value: 0.07835155461994266.
[I 2024-04-25 03:20:42,902] Trial 173 finished with value: 0.07835155461994266 and parameters: {'model_name': 'SimpleImputer', 'strategy': 'mean'}. Best is trial 0 with value: 0.07835155461994266.
[I 2024-04-25 03:20:43,492] Trial 175 finished with value: 0.07835155461994266 and parameters: {'model_name': 'SimpleImputer', 'strategy': 'mean'}. Best is trial 0 with value: 0.07835155461994266.
[I 2024-04-25 03:20:43,670] Trial 174 finished with value: 0.07835155461994266 and parameters: {'model_name': 'SimpleImputer', 'strategy': 'mean'}. Best is trial 0 with value: 0.07835155461994266.
[I 2024-04-25 03:20:44,601] Trial 178 finished with value: 0.07835155461994266 and parameters: {'model_name': 'SimpleImputer', 'strategy': 'mean'}. Best is trial 0 with value: 0.07835155461994266.
[I 2024-04-25 03:20:45,145] Trial 177 finished with value: 0.07835155461994266 and parameters: {'model_name': 'SimpleImputer', 'strategy': 'mean'}. Best is trial 0 with value: 0.07835155461994266.
[I 2024-04-25 03:20:45,383] Trial 93 finished with value: 0.08027220246173179 and parameters: {'model_name': 'SimpleImputer', 'strategy': 'most_frequent'}. Best is trial 0 with value: 0.07835155461994266.
[I 2024-04-25 03:20:48,399] Trial 180 finished with value: 0.07835155461994266 and parameters: {'model_name': 'SimpleImputer', 'strategy': 'mean'}. Best is trial 0 with value: 0.07835155461994266.
[I 2024-04-25 03:20:49,146] Trial 181 finished with value: 0.07835155461994266 and parameters: {'model_name': 'SimpleImputer', 'strategy': 'mean'}. Best is trial 0 with value: 0.07835155461994266.
[I 2024-04-25 03:20:49,463] Trial 179 finished with value: 0.07835155461994266 and parameters: {'model_name': 'SimpleImputer', 'strategy': 'mean'}. Best is trial 0 with value: 0.07835155461994266.
[I 2024-04-25 03:20:53,413] Trial 182 finished with value: 0.07835155461994266 and parameters: {'model_name': 'SimpleImputer', 'strategy': 'mean'}. Best is trial 0 with value: 0.07835155461994266.
[I 2024-04-25 03:20:54,023] Trial 184 finished with value: 0.07835155461994266 and parameters: {'model_name': 'SimpleImputer', 'strategy': 'mean'}. Best is trial 0 with value: 0.07835155461994266.
[I 2024-04-25 03:20:55,278] Trial 186 finished with value: 0.07835155461994266 and parameters: {'model_name': 'SimpleImputer', 'strategy': 'mean'}. Best is trial 0 with value: 0.07835155461994266.
[I 2024-04-25 03:20:55,925] Trial 187 finished with value: 0.07835155461994266 and parameters: {'model_name': 'SimpleImputer', 'strategy': 'mean'}. Best is trial 0 with value: 0.07835155461994266.
[I 2024-04-25 03:20:56,324] Trial 183 finished with value: 0.07835155461994266 and parameters: {'model_name': 'SimpleImputer', 'strategy': 'mean'}. Best is trial 0 with value: 0.07835155461994266.
[I 2024-04-25 03:20:56,631] Trial 12 finished with value: 0.08027220246173179 and parameters: {'model_name': 'SimpleImputer', 'strategy': 'most_frequent'}. Best is trial 0 with value: 0.07835155461994266.
[I 2024-04-25 03:20:56,919] Trial 192 finished with value: 0.07835155461994266 and parameters: {'model_name': 'SimpleImputer', 'strategy': 'mean'}. Best is trial 0 with value: 0.07835155461994266.
[I 2024-04-25 03:20:57,263] Trial 188 finished with value: 0.07835155461994266 and parameters: {'model_name': 'SimpleImputer', 'strategy': 'mean'}. Best is trial 0 with value: 0.07835155461994266.
[I 2024-04-25 03:20:57,883] Trial 185 finished with value: 0.07835155461994266 and parameters: {'model_name': 'SimpleImputer', 'strategy': 'mean'}. Best is trial 0 with value: 0.07835155461994266.
[I 2024-04-25 03:20:58,955] Trial 191 finished with value: 0.07835155461994266 and parameters: {'model_name': 'SimpleImputer', 'strategy': 'mean'}. Best is trial 0 with value: 0.07835155461994266.
[I 2024-04-25 03:20:59,301] Trial 195 finished with value: 0.07835155461994266 and parameters: {'model_name': 'SimpleImputer', 'strategy': 'mean'}. Best is trial 0 with value: 0.07835155461994266.
[I 2024-04-25 03:20:59,664] Trial 190 finished with value: 0.07835155461994266 and parameters: {'model_name': 'SimpleImputer', 'strategy': 'mean'}. Best is trial 0 with value: 0.07835155461994266.
[I 2024-04-25 03:21:00,301] Trial 189 finished with value: 0.07835155461994266 and parameters: {'model_name': 'SimpleImputer', 'strategy': 'mean'}. Best is trial 0 with value: 0.07835155461994266.
[I 2024-04-25 03:21:00,580] Trial 194 finished with value: 0.07835155461994266 and parameters: {'model_name': 'SimpleImputer', 'strategy': 'mean'}. Best is trial 0 with value: 0.07835155461994266.
[I 2024-04-25 03:21:01,048] Trial 106 finished with value: 0.08027220246173179 and parameters: {'model_name': 'SimpleImputer', 'strategy': 'most_frequent'}. Best is trial 0 with value: 0.07835155461994266.
[I 2024-04-25 03:21:01,374] Trial 196 finished with value: 0.07835155461994266 and parameters: {'model_name': 'SimpleImputer', 'strategy': 'mean'}. Best is trial 0 with value: 0.07835155461994266.
[I 2024-04-25 03:21:02,148] Trial 193 finished with value: 0.07835155461994266 and parameters: {'model_name': 'SimpleImputer', 'strategy': 'mean'}. Best is trial 0 with value: 0.07835155461994266.
[I 2024-04-25 03:21:02,603] Trial 198 finished with value: 0.07835155461994266 and parameters: {'model_name': 'SimpleImputer', 'strategy': 'mean'}. Best is trial 0 with value: 0.07835155461994266.
[I 2024-04-25 03:21:02,901] Trial 197 finished with value: 0.07835155461994266 and parameters: {'model_name': 'SimpleImputer', 'strategy': 'mean'}. Best is trial 0 with value: 0.07835155461994266.
[I 2024-04-25 03:21:03,290] Trial 199 finished with value: 0.07835155461994266 and parameters: {'model_name': 'SimpleImputer', 'strategy': 'mean'}. Best is trial 0 with value: 0.07835155461994266.
[I 2024-04-25 03:21:03,661] Trial 109 finished with value: 0.08027220246173179 and parameters: {'model_name': 'SimpleImputer', 'strategy': 'most_frequent'}. Best is trial 0 with value: 0.07835155461994266.
[I 2024-04-25 03:21:04,056] Trial 110 finished with value: 0.08027220246173179 and parameters: {'model_name': 'SimpleImputer', 'strategy': 'most_frequent'}. Best is trial 0 with value: 0.07835155461994266.
[I 2024-04-25 03:21:04,696] Trial 103 finished with value: 0.08027220246173179 and parameters: {'model_name': 'SimpleImputer', 'strategy': 'most_frequent'}. Best is trial 0 with value: 0.07835155461994266.
[I 2024-04-25 03:21:05,104] Trial 81 finished with value: 0.08027220246173179 and parameters: {'model_name': 'SimpleImputer', 'strategy': 'most_frequent'}. Best is trial 0 with value: 0.07835155461994266.
[I 2024-04-25 03:21:05,280] Trial 112 finished with value: 0.08027220246173179 and parameters: {'model_name': 'SimpleImputer', 'strategy': 'most_frequent'}. Best is trial 0 with value: 0.07835155461994266.
[I 2024-04-25 03:21:05,536] Trial 101 finished with value: 0.08027220246173179 and parameters: {'model_name': 'SimpleImputer', 'strategy': 'most_frequent'}. Best is trial 0 with value: 0.07835155461994266.
[I 2024-04-25 03:21:05,820] Trial 91 finished with value: 0.08027220246173179 and parameters: {'model_name': 'SimpleImputer', 'strategy': 'most_frequent'}. Best is trial 0 with value: 0.07835155461994266.
[I 2024-04-25 03:21:06,248] Trial 105 finished with value: 0.08027220246173179 and parameters: {'model_name': 'SimpleImputer', 'strategy': 'most_frequent'}. Best is trial 0 with value: 0.07835155461994266.
[I 2024-04-25 03:21:16,847] Trial 113 finished with value: 0.08027220246173179 and parameters: {'model_name': 'SimpleImputer', 'strategy': 'most_frequent'}. Best is trial 0 with value: 0.07835155461994266.
