Run: 7
/cm/local/apps/slurm/var/spool/job549394/slurm_script: line 23: /common/ketrong/minconda3/etc/profile.d/conda.sh: No such file or directory
/cm/local/apps/slurm/var/spool/job549394/slurm_script: line 26: $'\nconda create --name tpot2devenv -c conda-forge python=3.10\n': command not found
/cm/local/apps/slurm/var/spool/job549394/slurm_script: line 31: $'\npip install -r requirements.txt\n': command not found
RunStart
2023-12-12 14:51:00.175648: I tensorflow/core/util/port.cc:113] oneDNN custom operations are on. You may see slightly different numerical results due to floating-point round-off errors from different computation orders. To turn them off, set the environment variable `TF_ENABLE_ONEDNN_OPTS=0`.
2023-12-12 14:51:00.210235: E external/local_xla/xla/stream_executor/cuda/cuda_dnn.cc:9261] Unable to register cuDNN factory: Attempting to register factory for plugin cuDNN when one has already been registered
2023-12-12 14:51:00.210258: E external/local_xla/xla/stream_executor/cuda/cuda_fft.cc:607] Unable to register cuFFT factory: Attempting to register factory for plugin cuFFT when one has already been registered
2023-12-12 14:51:00.211176: E external/local_xla/xla/stream_executor/cuda/cuda_blas.cc:1515] Unable to register cuBLAS factory: Attempting to register factory for plugin cuBLAS when one has already been registered
2023-12-12 14:51:00.216393: I tensorflow/core/platform/cpu_feature_guard.cc:182] This TensorFlow binary is optimized to use available CPU instructions in performance-critical operations.
To enable the following instructions: AVX2 AVX512F AVX512_VNNI FMA, in other operations, rebuild TensorFlow with the appropriate compiler flags.
2023-12-12 14:51:02.075339: W tensorflow/compiler/tf2tensorrt/utils/py_utils.cc:38] TF-TRT Warning: Could not find TensorRT
WARNING:tensorflow:From /home/ketrong/miniconda3/envs/tpot2devenv/lib/python3.10/site-packages/tensorflow/python/compat/v2_compat.py:108: disable_resource_variables (from tensorflow.python.ops.variable_scope) is deprecated and will be removed in a future version.
Instructions for updating:
non-resource variables are not supported in the long term
starting loops
working on 
logs/30/tpot2_base_normal_MAR_0.1
4.072497367858887
loading data
data/30_True.pkl
running experiment 1/3 - Does large hyperparameter space improve reconstruction accuracy over simple
[I 2023-12-12 14:51:14,660] A new study created in memory with name: no-name-54f52727-e14e-42fa-9647-19c72214a221
[I 2023-12-12 14:51:15,139] Trial 10 finished with value: 7602.121809036444 and parameters: {'model_name': 'SimpleImputer', 'strategy': 'constant'}. Best is trial 10 with value: 7602.121809036444.
[I 2023-12-12 14:51:15,394] Trial 6 finished with value: 7602.121809036444 and parameters: {'model_name': 'SimpleImputer', 'strategy': 'constant'}. Best is trial 10 with value: 7602.121809036444.
[I 2023-12-12 14:51:15,573] Trial 2 finished with value: 7430.862593009512 and parameters: {'model_name': 'SimpleImputer', 'strategy': 'mean'}. Best is trial 2 with value: 7430.862593009512.
[I 2023-12-12 14:51:15,778] Trial 4 finished with value: 7602.121809036444 and parameters: {'model_name': 'SimpleImputer', 'strategy': 'constant'}. Best is trial 2 with value: 7430.862593009512.
[I 2023-12-12 14:51:16,407] Trial 17 finished with value: 7602.121809036444 and parameters: {'model_name': 'SimpleImputer', 'strategy': 'constant'}. Best is trial 2 with value: 7430.862593009512.
[I 2023-12-12 14:51:16,617] Trial 8 finished with value: 7602.121809036444 and parameters: {'model_name': 'SimpleImputer', 'strategy': 'constant'}. Best is trial 2 with value: 7430.862593009512.
[I 2023-12-12 14:51:16,973] Trial 33 finished with value: 7602.121809036444 and parameters: {'model_name': 'SimpleImputer', 'strategy': 'constant'}. Best is trial 2 with value: 7430.862593009512.
[I 2023-12-12 14:51:17,188] Trial 32 finished with value: 7602.121809036444 and parameters: {'model_name': 'SimpleImputer', 'strategy': 'constant'}. Best is trial 2 with value: 7430.862593009512.
[I 2023-12-12 14:51:17,340] Trial 13 finished with value: 7602.121809036444 and parameters: {'model_name': 'SimpleImputer', 'strategy': 'constant'}. Best is trial 2 with value: 7430.862593009512.
[I 2023-12-12 14:51:17,594] Trial 16 finished with value: 7602.121809036444 and parameters: {'model_name': 'SimpleImputer', 'strategy': 'constant'}. Best is trial 2 with value: 7430.862593009512.
[I 2023-12-12 14:51:17,833] Trial 29 finished with value: 7602.121809036444 and parameters: {'model_name': 'SimpleImputer', 'strategy': 'constant'}. Best is trial 2 with value: 7430.862593009512.
[I 2023-12-12 14:51:18,165] Trial 7 finished with value: 7545.6175712229215 and parameters: {'model_name': 'SimpleImputer', 'strategy': 'median'}. Best is trial 2 with value: 7430.862593009512.
[I 2023-12-12 14:51:18,351] Trial 19 finished with value: 7430.862593009512 and parameters: {'model_name': 'SimpleImputer', 'strategy': 'mean'}. Best is trial 2 with value: 7430.862593009512.
[I 2023-12-12 14:51:18,651] Trial 39 finished with value: 7602.121809036444 and parameters: {'model_name': 'SimpleImputer', 'strategy': 'constant'}. Best is trial 2 with value: 7430.862593009512.
[I 2023-12-12 14:51:18,813] Trial 27 finished with value: 7602.121809036444 and parameters: {'model_name': 'SimpleImputer', 'strategy': 'constant'}. Best is trial 2 with value: 7430.862593009512.
[I 2023-12-12 14:51:19,358] Trial 44 finished with value: 7602.121809036444 and parameters: {'model_name': 'SimpleImputer', 'strategy': 'constant'}. Best is trial 2 with value: 7430.862593009512.
[I 2023-12-12 14:51:19,586] Trial 22 finished with value: 7430.862593009512 and parameters: {'model_name': 'SimpleImputer', 'strategy': 'mean'}. Best is trial 2 with value: 7430.862593009512.
[I 2023-12-12 14:51:20,011] Trial 26 finished with value: 7430.862593009512 and parameters: {'model_name': 'SimpleImputer', 'strategy': 'mean'}. Best is trial 2 with value: 7430.862593009512.
[I 2023-12-12 14:51:20,390] Trial 42 finished with value: 7602.121809036444 and parameters: {'model_name': 'SimpleImputer', 'strategy': 'constant'}. Best is trial 2 with value: 7430.862593009512.
[I 2023-12-12 14:51:20,623] Trial 36 finished with value: 7430.862593009512 and parameters: {'model_name': 'SimpleImputer', 'strategy': 'mean'}. Best is trial 2 with value: 7430.862593009512.
[I 2023-12-12 14:51:20,806] Trial 43 finished with value: 7430.862593009512 and parameters: {'model_name': 'SimpleImputer', 'strategy': 'mean'}. Best is trial 2 with value: 7430.862593009512.
[I 2023-12-12 14:51:21,149] Trial 14 finished with value: 7545.6175712229215 and parameters: {'model_name': 'SimpleImputer', 'strategy': 'median'}. Best is trial 2 with value: 7430.862593009512.
[I 2023-12-12 14:51:21,385] Trial 55 finished with value: 7430.862593009512 and parameters: {'model_name': 'SimpleImputer', 'strategy': 'mean'}. Best is trial 2 with value: 7430.862593009512.
[I 2023-12-12 14:51:21,616] Trial 56 finished with value: 7430.862593009512 and parameters: {'model_name': 'SimpleImputer', 'strategy': 'mean'}. Best is trial 2 with value: 7430.862593009512.
[I 2023-12-12 14:51:21,928] Trial 51 finished with value: 7602.121809036444 and parameters: {'model_name': 'SimpleImputer', 'strategy': 'constant'}. Best is trial 2 with value: 7430.862593009512.
[I 2023-12-12 14:51:22,313] Trial 54 finished with value: 7430.862593009512 and parameters: {'model_name': 'SimpleImputer', 'strategy': 'mean'}. Best is trial 2 with value: 7430.862593009512.
[I 2023-12-12 14:51:22,533] Trial 49 finished with value: 7430.862593009512 and parameters: {'model_name': 'SimpleImputer', 'strategy': 'mean'}. Best is trial 2 with value: 7430.862593009512.
[I 2023-12-12 14:51:22,794] Trial 59 finished with value: 7430.862593009512 and parameters: {'model_name': 'SimpleImputer', 'strategy': 'mean'}. Best is trial 2 with value: 7430.862593009512.
[I 2023-12-12 14:51:23,028] Trial 60 finished with value: 7430.862593009512 and parameters: {'model_name': 'SimpleImputer', 'strategy': 'mean'}. Best is trial 2 with value: 7430.862593009512.
[I 2023-12-12 14:51:23,226] Trial 30 finished with value: 7545.6175712229215 and parameters: {'model_name': 'SimpleImputer', 'strategy': 'median'}. Best is trial 2 with value: 7430.862593009512.
[I 2023-12-12 14:51:23,450] Trial 23 finished with value: 7545.6175712229215 and parameters: {'model_name': 'SimpleImputer', 'strategy': 'median'}. Best is trial 2 with value: 7430.862593009512.
[I 2023-12-12 14:51:23,638] Trial 53 finished with value: 7430.862593009512 and parameters: {'model_name': 'SimpleImputer', 'strategy': 'mean'}. Best is trial 2 with value: 7430.862593009512.
[I 2023-12-12 14:51:23,912] Trial 34 finished with value: 7545.6175712229215 and parameters: {'model_name': 'SimpleImputer', 'strategy': 'median'}. Best is trial 2 with value: 7430.862593009512.
[I 2023-12-12 14:51:24,183] Trial 12 finished with value: 7545.6175712229215 and parameters: {'model_name': 'SimpleImputer', 'strategy': 'median'}. Best is trial 2 with value: 7430.862593009512.
[I 2023-12-12 14:51:24,398] Trial 18 finished with value: 7545.6175712229215 and parameters: {'model_name': 'SimpleImputer', 'strategy': 'median'}. Best is trial 2 with value: 7430.862593009512.
[I 2023-12-12 14:51:24,735] Trial 31 finished with value: 7545.6175712229215 and parameters: {'model_name': 'SimpleImputer', 'strategy': 'median'}. Best is trial 2 with value: 7430.862593009512.
[I 2023-12-12 14:51:25,061] Trial 58 finished with value: 7430.862593009512 and parameters: {'model_name': 'SimpleImputer', 'strategy': 'mean'}. Best is trial 2 with value: 7430.862593009512.
[I 2023-12-12 14:51:25,302] Trial 62 finished with value: 7430.862593009512 and parameters: {'model_name': 'SimpleImputer', 'strategy': 'mean'}. Best is trial 2 with value: 7430.862593009512.
[I 2023-12-12 14:51:25,550] Trial 61 finished with value: 7430.862593009512 and parameters: {'model_name': 'SimpleImputer', 'strategy': 'mean'}. Best is trial 2 with value: 7430.862593009512.
[I 2023-12-12 14:51:25,747] Trial 63 finished with value: 7430.862593009512 and parameters: {'model_name': 'SimpleImputer', 'strategy': 'mean'}. Best is trial 2 with value: 7430.862593009512.
[I 2023-12-12 14:51:25,922] Trial 15 finished with value: 7545.6175712229215 and parameters: {'model_name': 'SimpleImputer', 'strategy': 'median'}. Best is trial 2 with value: 7430.862593009512.
[I 2023-12-12 14:51:26,194] Trial 28 finished with value: 7545.6175712229215 and parameters: {'model_name': 'SimpleImputer', 'strategy': 'median'}. Best is trial 2 with value: 7430.862593009512.
[I 2023-12-12 14:51:26,422] Trial 35 finished with value: 7545.6175712229215 and parameters: {'model_name': 'SimpleImputer', 'strategy': 'median'}. Best is trial 2 with value: 7430.862593009512.
[I 2023-12-12 14:51:26,703] Trial 41 finished with value: 7545.6175712229215 and parameters: {'model_name': 'SimpleImputer', 'strategy': 'median'}. Best is trial 2 with value: 7430.862593009512.
[I 2023-12-12 14:51:27,107] Trial 25 finished with value: 7545.6175712229215 and parameters: {'model_name': 'SimpleImputer', 'strategy': 'median'}. Best is trial 2 with value: 7430.862593009512.
[I 2023-12-12 14:51:27,295] Trial 24 finished with value: 7545.6175712229215 and parameters: {'model_name': 'SimpleImputer', 'strategy': 'median'}. Best is trial 2 with value: 7430.862593009512.
[I 2023-12-12 14:51:27,713] Trial 45 finished with value: 7545.6175712229215 and parameters: {'model_name': 'SimpleImputer', 'strategy': 'median'}. Best is trial 2 with value: 7430.862593009512.
[I 2023-12-12 14:51:27,944] Trial 46 finished with value: 7545.6175712229215 and parameters: {'model_name': 'SimpleImputer', 'strategy': 'median'}. Best is trial 2 with value: 7430.862593009512.
[I 2023-12-12 14:51:28,476] Trial 52 finished with value: 7545.6175712229215 and parameters: {'model_name': 'SimpleImputer', 'strategy': 'median'}. Best is trial 2 with value: 7430.862593009512.
[I 2023-12-12 14:51:28,753] Trial 57 finished with value: 7545.6175712229215 and parameters: {'model_name': 'SimpleImputer', 'strategy': 'median'}. Best is trial 2 with value: 7430.862593009512.
[I 2023-12-12 14:51:29,047] Trial 84 finished with value: 7430.862593009512 and parameters: {'model_name': 'SimpleImputer', 'strategy': 'mean'}. Best is trial 2 with value: 7430.862593009512.
[I 2023-12-12 14:51:29,701] Trial 90 finished with value: 7430.862593009512 and parameters: {'model_name': 'SimpleImputer', 'strategy': 'mean'}. Best is trial 2 with value: 7430.862593009512.
[I 2023-12-12 14:51:29,902] Trial 1 finished with value: 7601.564978055251 and parameters: {'model_name': 'SimpleImputer', 'strategy': 'most_frequent'}. Best is trial 2 with value: 7430.862593009512.
[I 2023-12-12 14:51:30,148] Trial 9 finished with value: 7601.564978055251 and parameters: {'model_name': 'SimpleImputer', 'strategy': 'most_frequent'}. Best is trial 2 with value: 7430.862593009512.
[I 2023-12-12 14:51:30,409] Trial 5 finished with value: 7601.564978055251 and parameters: {'model_name': 'SimpleImputer', 'strategy': 'most_frequent'}. Best is trial 2 with value: 7430.862593009512.
[I 2023-12-12 14:51:30,855] Trial 3 finished with value: 7601.564978055251 and parameters: {'model_name': 'SimpleImputer', 'strategy': 'most_frequent'}. Best is trial 2 with value: 7430.862593009512.
[I 2023-12-12 14:51:31,307] Trial 0 finished with value: 7601.564978055251 and parameters: {'model_name': 'SimpleImputer', 'strategy': 'most_frequent'}. Best is trial 2 with value: 7430.862593009512.
[I 2023-12-12 14:51:32,089] Trial 11 finished with value: 7601.564978055251 and parameters: {'model_name': 'SimpleImputer', 'strategy': 'most_frequent'}. Best is trial 2 with value: 7430.862593009512.
[I 2023-12-12 14:51:32,472] Trial 20 finished with value: 7601.564978055251 and parameters: {'model_name': 'SimpleImputer', 'strategy': 'most_frequent'}. Best is trial 2 with value: 7430.862593009512.
[I 2023-12-12 14:51:32,804] Trial 21 finished with value: 7601.564978055251 and parameters: {'model_name': 'SimpleImputer', 'strategy': 'most_frequent'}. Best is trial 2 with value: 7430.862593009512.
[I 2023-12-12 14:51:33,491] Trial 40 finished with value: 7601.564978055251 and parameters: {'model_name': 'SimpleImputer', 'strategy': 'most_frequent'}. Best is trial 2 with value: 7430.862593009512.
[I 2023-12-12 14:51:34,073] Trial 47 finished with value: 7601.564978055251 and parameters: {'model_name': 'SimpleImputer', 'strategy': 'most_frequent'}. Best is trial 2 with value: 7430.862593009512.
[I 2023-12-12 14:51:34,479] Trial 37 finished with value: 7601.564978055251 and parameters: {'model_name': 'SimpleImputer', 'strategy': 'most_frequent'}. Best is trial 2 with value: 7430.862593009512.
[I 2023-12-12 14:51:34,692] Trial 106 finished with value: 7430.862593009512 and parameters: {'model_name': 'SimpleImputer', 'strategy': 'mean'}. Best is trial 2 with value: 7430.862593009512.
[I 2023-12-12 14:51:35,181] Trial 50 finished with value: 7601.564978055251 and parameters: {'model_name': 'SimpleImputer', 'strategy': 'most_frequent'}. Best is trial 2 with value: 7430.862593009512.
[I 2023-12-12 14:51:35,684] Trial 108 finished with value: 7430.862593009512 and parameters: {'model_name': 'SimpleImputer', 'strategy': 'mean'}. Best is trial 2 with value: 7430.862593009512.
[I 2023-12-12 14:51:35,859] Trial 72 finished with value: 7601.564978055251 and parameters: {'model_name': 'SimpleImputer', 'strategy': 'most_frequent'}. Best is trial 2 with value: 7430.862593009512.
[I 2023-12-12 14:51:36,028] Trial 38 finished with value: 7601.564978055251 and parameters: {'model_name': 'SimpleImputer', 'strategy': 'most_frequent'}. Best is trial 2 with value: 7430.862593009512.
[I 2023-12-12 14:51:36,352] Trial 107 finished with value: 7430.862593009512 and parameters: {'model_name': 'SimpleImputer', 'strategy': 'mean'}. Best is trial 2 with value: 7430.862593009512.
[I 2023-12-12 14:51:36,614] Trial 48 finished with value: 7601.564978055251 and parameters: {'model_name': 'SimpleImputer', 'strategy': 'most_frequent'}. Best is trial 2 with value: 7430.862593009512.
[I 2023-12-12 14:51:36,920] Trial 64 finished with value: 7601.564978055251 and parameters: {'model_name': 'SimpleImputer', 'strategy': 'most_frequent'}. Best is trial 2 with value: 7430.862593009512.
[I 2023-12-12 14:51:37,237] Trial 69 finished with value: 7601.564978055251 and parameters: {'model_name': 'SimpleImputer', 'strategy': 'most_frequent'}. Best is trial 2 with value: 7430.862593009512.
[I 2023-12-12 14:51:37,767] Trial 109 finished with value: 7430.862593009512 and parameters: {'model_name': 'SimpleImputer', 'strategy': 'mean'}. Best is trial 2 with value: 7430.862593009512.
[I 2023-12-12 14:51:38,048] Trial 66 finished with value: 7601.564978055251 and parameters: {'model_name': 'SimpleImputer', 'strategy': 'most_frequent'}. Best is trial 2 with value: 7430.862593009512.
[I 2023-12-12 14:51:38,403] Trial 65 finished with value: 7601.564978055251 and parameters: {'model_name': 'SimpleImputer', 'strategy': 'most_frequent'}. Best is trial 2 with value: 7430.862593009512.
[I 2023-12-12 14:51:38,661] Trial 67 finished with value: 7601.564978055251 and parameters: {'model_name': 'SimpleImputer', 'strategy': 'most_frequent'}. Best is trial 2 with value: 7430.862593009512.
[I 2023-12-12 14:51:38,903] Trial 82 finished with value: 7601.564978055251 and parameters: {'model_name': 'SimpleImputer', 'strategy': 'most_frequent'}. Best is trial 2 with value: 7430.862593009512.
[I 2023-12-12 14:51:39,128] Trial 75 finished with value: 7601.564978055251 and parameters: {'model_name': 'SimpleImputer', 'strategy': 'most_frequent'}. Best is trial 2 with value: 7430.862593009512.
[I 2023-12-12 14:51:39,332] Trial 77 finished with value: 7601.564978055251 and parameters: {'model_name': 'SimpleImputer', 'strategy': 'most_frequent'}. Best is trial 2 with value: 7430.862593009512.
[I 2023-12-12 14:51:39,513] Trial 68 finished with value: 7601.564978055251 and parameters: {'model_name': 'SimpleImputer', 'strategy': 'most_frequent'}. Best is trial 2 with value: 7430.862593009512.
[I 2023-12-12 14:51:39,762] Trial 80 finished with value: 7601.564978055251 and parameters: {'model_name': 'SimpleImputer', 'strategy': 'most_frequent'}. Best is trial 2 with value: 7430.862593009512.
[I 2023-12-12 14:51:39,953] Trial 89 finished with value: 7601.564978055251 and parameters: {'model_name': 'SimpleImputer', 'strategy': 'most_frequent'}. Best is trial 2 with value: 7430.862593009512.
[I 2023-12-12 14:51:40,174] Trial 76 finished with value: 7601.564978055251 and parameters: {'model_name': 'SimpleImputer', 'strategy': 'most_frequent'}. Best is trial 2 with value: 7430.862593009512.
[I 2023-12-12 14:51:40,336] Trial 73 finished with value: 7601.564978055251 and parameters: {'model_name': 'SimpleImputer', 'strategy': 'most_frequent'}. Best is trial 2 with value: 7430.862593009512.
[I 2023-12-12 14:51:40,506] Trial 112 finished with value: 7430.862593009512 and parameters: {'model_name': 'SimpleImputer', 'strategy': 'mean'}. Best is trial 2 with value: 7430.862593009512.
[I 2023-12-12 14:51:40,874] Trial 71 finished with value: 7601.564978055251 and parameters: {'model_name': 'SimpleImputer', 'strategy': 'most_frequent'}. Best is trial 2 with value: 7430.862593009512.
[I 2023-12-12 14:51:41,122] Trial 70 finished with value: 7601.564978055251 and parameters: {'model_name': 'SimpleImputer', 'strategy': 'most_frequent'}. Best is trial 2 with value: 7430.862593009512.
[I 2023-12-12 14:51:41,337] Trial 81 finished with value: 7601.564978055251 and parameters: {'model_name': 'SimpleImputer', 'strategy': 'most_frequent'}. Best is trial 2 with value: 7430.862593009512.
[I 2023-12-12 14:51:41,513] Trial 110 finished with value: 7430.862593009512 and parameters: {'model_name': 'SimpleImputer', 'strategy': 'mean'}. Best is trial 2 with value: 7430.862593009512.
[I 2023-12-12 14:51:41,757] Trial 91 finished with value: 7601.564978055251 and parameters: {'model_name': 'SimpleImputer', 'strategy': 'most_frequent'}. Best is trial 2 with value: 7430.862593009512.
[I 2023-12-12 14:51:41,930] Trial 78 finished with value: 7601.564978055251 and parameters: {'model_name': 'SimpleImputer', 'strategy': 'most_frequent'}. Best is trial 2 with value: 7430.862593009512.
[I 2023-12-12 14:51:42,176] Trial 111 finished with value: 7430.862593009512 and parameters: {'model_name': 'SimpleImputer', 'strategy': 'mean'}. Best is trial 2 with value: 7430.862593009512.
[I 2023-12-12 14:51:42,386] Trial 114 finished with value: 7430.862593009512 and parameters: {'model_name': 'SimpleImputer', 'strategy': 'mean'}. Best is trial 2 with value: 7430.862593009512.
[I 2023-12-12 14:51:42,636] Trial 92 finished with value: 7601.564978055251 and parameters: {'model_name': 'SimpleImputer', 'strategy': 'most_frequent'}. Best is trial 2 with value: 7430.862593009512.
[I 2023-12-12 14:51:42,965] Trial 113 finished with value: 7430.862593009512 and parameters: {'model_name': 'SimpleImputer', 'strategy': 'mean'}. Best is trial 2 with value: 7430.862593009512.
[I 2023-12-12 14:51:43,189] Trial 83 finished with value: 7601.564978055251 and parameters: {'model_name': 'SimpleImputer', 'strategy': 'most_frequent'}. Best is trial 2 with value: 7430.862593009512.
[I 2023-12-12 14:51:43,458] Trial 87 finished with value: 7601.564978055251 and parameters: {'model_name': 'SimpleImputer', 'strategy': 'most_frequent'}. Best is trial 2 with value: 7430.862593009512.
[I 2023-12-12 14:51:43,721] Trial 86 finished with value: 7601.564978055251 and parameters: {'model_name': 'SimpleImputer', 'strategy': 'most_frequent'}. Best is trial 2 with value: 7430.862593009512.
[I 2023-12-12 14:51:44,066] Trial 119 finished with value: 7430.862593009512 and parameters: {'model_name': 'SimpleImputer', 'strategy': 'mean'}. Best is trial 2 with value: 7430.862593009512.
