[I 2023-12-27 13:38:11,427] Trial 81 finished with value: inf and parameters: {'model_name': 'GAIN', 'batch_size': 313, 'hint_rate': 0.05, 'alpha': 91, 'iterations': 10420}. Best is trial 6 with value: 0.7540843946554675.
[I 2023-12-27 13:38:51,386] Trial 38 finished with value: inf and parameters: {'model_name': 'GAIN', 'batch_size': 275, 'hint_rate': 0.21000000000000002, 'alpha': 100, 'iterations': 12070}. Best is trial 6 with value: 0.7540843946554675.
[I 2023-12-27 13:39:33,328] Trial 49 finished with value: inf and parameters: {'model_name': 'GAIN', 'batch_size': 12, 'hint_rate': 0.41000000000000003, 'alpha': 70, 'iterations': 17184}. Best is trial 6 with value: 0.7540843946554675.
[I 2023-12-27 13:46:49,146] Trial 30 finished with value: inf and parameters: {'model_name': 'GAIN', 'batch_size': 109, 'hint_rate': 0.66, 'alpha': 70, 'iterations': 35953}. Best is trial 6 with value: 0.7540843946554675.
[I 2023-12-27 13:47:26,255] Trial 77 finished with value: inf and parameters: {'model_name': 'GAIN', 'batch_size': 178, 'hint_rate': 0.09, 'alpha': 88, 'iterations': 36267}. Best is trial 6 with value: 0.7540843946554675.
[I 2023-12-27 13:47:48,948] Trial 14 finished with value: inf and parameters: {'model_name': 'GAIN', 'batch_size': 1, 'hint_rate': 0.8200000000000001, 'alpha': 50, 'iterations': 45598}. Best is trial 6 with value: 0.7540843946554675.
[I 2023-12-27 13:49:31,121] Trial 33 finished with value: inf and parameters: {'model_name': 'GAIN', 'batch_size': 300, 'hint_rate': 0.48000000000000004, 'alpha': 69, 'iterations': 42023}. Best is trial 6 with value: 0.7540843946554675.
[I 2023-12-27 13:54:41,179] Trial 179 finished with value: inf and parameters: {'model_name': 'GAIN', 'batch_size': 880, 'hint_rate': 0.97, 'alpha': 3, 'iterations': 53351}. Best is trial 6 with value: 0.7540843946554675.
[I 2023-12-27 13:54:52,764] Trial 132 finished with value: inf and parameters: {'model_name': 'GAIN', 'batch_size': 60, 'hint_rate': 0.01, 'alpha': 0, 'iterations': 69415}. Best is trial 6 with value: 0.7540843946554675.
[I 2023-12-27 13:55:12,086] Trial 186 finished with value: inf and parameters: {'model_name': 'GAIN', 'batch_size': 735, 'hint_rate': 0.99, 'alpha': 0, 'iterations': 57439}. Best is trial 6 with value: 0.7540843946554675.
[I 2023-12-27 13:56:06,771] Trial 187 finished with value: inf and parameters: {'model_name': 'GAIN', 'batch_size': 86, 'hint_rate': 0.97, 'alpha': 5, 'iterations': 72018}. Best is trial 6 with value: 0.7540843946554675.
[I 2023-12-27 13:59:12,211] Trial 181 finished with value: inf and parameters: {'model_name': 'GAIN', 'batch_size': 95, 'hint_rate': 0.97, 'alpha': 5, 'iterations': 91709}. Best is trial 6 with value: 0.7540843946554675.
[I 2023-12-27 14:00:17,935] Trial 183 finished with value: inf and parameters: {'model_name': 'GAIN', 'batch_size': 726, 'hint_rate': 0.93, 'alpha': 0, 'iterations': 82747}. Best is trial 6 with value: 0.7540843946554675.
[I 2023-12-27 14:01:05,412] Trial 182 finished with value: inf and parameters: {'model_name': 'GAIN', 'batch_size': 779, 'hint_rate': 0.88, 'alpha': 0, 'iterations': 87674}. Best is trial 6 with value: 0.7540843946554675.
[I 2023-12-27 14:01:06,121] Trial 180 finished with value: inf and parameters: {'model_name': 'GAIN', 'batch_size': 783, 'hint_rate': 0.9400000000000001, 'alpha': 0, 'iterations': 87459}. Best is trial 6 with value: 0.7540843946554675.
[I 2023-12-27 14:01:16,088] Trial 184 finished with value: inf and parameters: {'model_name': 'GAIN', 'batch_size': 879, 'hint_rate': 0.97, 'alpha': 82, 'iterations': 87774}. Best is trial 6 with value: 0.7540843946554675.
[I 2023-12-27 14:01:24,880] Trial 176 finished with value: inf and parameters: {'model_name': 'GAIN', 'batch_size': 892, 'hint_rate': 0.9400000000000001, 'alpha': 79, 'iterations': 91648}. Best is trial 6 with value: 0.7540843946554675.
[I 2023-12-27 14:01:27,667] Trial 117 finished with value: inf and parameters: {'model_name': 'GAIN', 'batch_size': 786, 'hint_rate': 0.09, 'alpha': 7, 'iterations': 93338}. Best is trial 6 with value: 0.7540843946554675.
