[I 2023-12-22 01:59:38,330] Trial 169 finished with value: inf and parameters: {'model_name': 'GAIN', 'batch_size': 984, 'hint_rate': 0.11, 'alpha': 93, 'iterations': 48427}. Best is trial 25 with value: 0.15813713564186543.
[I 2023-12-22 02:01:59,626] Trial 193 finished with value: inf and parameters: {'model_name': 'GAIN', 'batch_size': 599, 'hint_rate': 0.01, 'alpha': 90, 'iterations': 50969}. Best is trial 25 with value: 0.15813713564186543.
[I 2023-12-22 02:03:13,655] Trial 170 finished with value: inf and parameters: {'model_name': 'GAIN', 'batch_size': 743, 'hint_rate': 0.06999999999999999, 'alpha': 99, 'iterations': 51960}. Best is trial 25 with value: 0.15813713564186543.
[I 2023-12-22 02:05:49,082] Trial 186 finished with value: inf and parameters: {'model_name': 'GAIN', 'batch_size': 766, 'hint_rate': 0.05, 'alpha': 92, 'iterations': 53731}. Best is trial 25 with value: 0.15813713564186543.
[I 2023-12-22 02:07:04,754] Trial 184 finished with value: inf and parameters: {'model_name': 'GAIN', 'batch_size': 922, 'hint_rate': 0.09999999999999999, 'alpha': 95, 'iterations': 54459}. Best is trial 25 with value: 0.15813713564186543.
[I 2023-12-22 02:09:21,745] Trial 195 finished with value: inf and parameters: {'model_name': 'GAIN', 'batch_size': 910, 'hint_rate': 0.02, 'alpha': 95, 'iterations': 55514}. Best is trial 25 with value: 0.15813713564186543.
[I 2023-12-22 02:09:25,497] Trial 173 finished with value: inf and parameters: {'model_name': 'GAIN', 'batch_size': 991, 'hint_rate': 0.04, 'alpha': 97, 'iterations': 56733}. Best is trial 25 with value: 0.15813713564186543.
[I 2023-12-22 02:13:15,707] Trial 163 finished with value: inf and parameters: {'model_name': 'GAIN', 'batch_size': 946, 'hint_rate': 0.04, 'alpha': 100, 'iterations': 60714}. Best is trial 25 with value: 0.15813713564186543.
[I 2023-12-22 02:13:31,456] Trial 167 finished with value: inf and parameters: {'model_name': 'GAIN', 'batch_size': 875, 'hint_rate': 0.05, 'alpha': 96, 'iterations': 61400}. Best is trial 25 with value: 0.15813713564186543.
[I 2023-12-22 02:14:00,039] Trial 181 finished with value: inf and parameters: {'model_name': 'GAIN', 'batch_size': 947, 'hint_rate': 0.05, 'alpha': 97, 'iterations': 61252}. Best is trial 25 with value: 0.15813713564186543.
[I 2023-12-22 02:14:35,183] Trial 149 finished with value: inf and parameters: {'model_name': 'GAIN', 'batch_size': 1, 'hint_rate': 0.01, 'alpha': 96, 'iterations': 44799}. Best is trial 25 with value: 0.15813713564186543.
[I 2023-12-22 02:15:57,518] Trial 172 finished with value: inf and parameters: {'model_name': 'GAIN', 'batch_size': 1, 'hint_rate': 0.01, 'alpha': 92, 'iterations': 91284}. Best is trial 25 with value: 0.15813713564186543.
[I 2023-12-22 02:18:16,044] Trial 199 finished with value: inf and parameters: {'model_name': 'GAIN', 'batch_size': 1, 'hint_rate': 0.04, 'alpha': 21, 'iterations': 87515}. Best is trial 25 with value: 0.15813713564186543.
[I 2023-12-22 02:18:19,485] Trial 166 finished with value: inf and parameters: {'model_name': 'GAIN', 'batch_size': 1, 'hint_rate': 0.05, 'alpha': 95, 'iterations': 95276}. Best is trial 25 with value: 0.15813713564186543.
[I 2023-12-22 02:19:24,402] Trial 146 finished with value: inf and parameters: {'model_name': 'GAIN', 'batch_size': 1, 'hint_rate': 0.01, 'alpha': 97, 'iterations': 98985}. Best is trial 25 with value: 0.15813713564186543.
[I 2023-12-22 02:22:22,346] Trial 156 finished with value: inf and parameters: {'model_name': 'GAIN', 'batch_size': 673, 'hint_rate': 0.02, 'alpha': 92, 'iterations': 75136}. Best is trial 25 with value: 0.15813713564186543.
[I 2023-12-22 02:24:09,052] Trial 188 finished with value: inf and parameters: {'model_name': 'GAIN', 'batch_size': 934, 'hint_rate': 0.09, 'alpha': 95, 'iterations': 75186}. Best is trial 25 with value: 0.15813713564186543.
[I 2023-12-22 02:26:04,313] Trial 148 finished with value: 0.30432289807873747 and parameters: {'model_name': 'GAIN', 'batch_size': 1, 'hint_rate': 0.01, 'alpha': 99, 'iterations': 11468}. Best is trial 25 with value: 0.15813713564186543.
[I 2023-12-22 02:26:29,923] Trial 189 finished with value: inf and parameters: {'model_name': 'GAIN', 'batch_size': 965, 'hint_rate': 0.04, 'alpha': 97, 'iterations': 78505}. Best is trial 25 with value: 0.15813713564186543.
[I 2023-12-22 02:29:45,727] Trial 197 finished with value: inf and parameters: {'model_name': 'GAIN', 'batch_size': 980, 'hint_rate': 0.06999999999999999, 'alpha': 100, 'iterations': 83615}. Best is trial 25 with value: 0.15813713564186543.
[I 2023-12-22 02:32:03,357] Trial 152 finished with value: inf and parameters: {'model_name': 'GAIN', 'batch_size': 989, 'hint_rate': 0.01, 'alpha': 99, 'iterations': 90673}. Best is trial 25 with value: 0.15813713564186543.
[I 2023-12-22 02:33:23,315] Trial 175 finished with value: inf and parameters: {'model_name': 'GAIN', 'batch_size': 977, 'hint_rate': 0.03, 'alpha': 85, 'iterations': 92636}. Best is trial 25 with value: 0.15813713564186543.
[I 2023-12-22 02:33:50,770] Trial 150 finished with value: inf and parameters: {'model_name': 'GAIN', 'batch_size': 914, 'hint_rate': 0.17, 'alpha': 99, 'iterations': 94856}. Best is trial 25 with value: 0.15813713564186543.
[I 2023-12-22 02:35:25,319] Trial 144 finished with value: inf and parameters: {'model_name': 'GAIN', 'batch_size': 972, 'hint_rate': 0.09999999999999999, 'alpha': 97, 'iterations': 97427}. Best is trial 25 with value: 0.15813713564186543.
[I 2023-12-22 02:35:45,800] Trial 196 finished with value: inf and parameters: {'model_name': 'GAIN', 'batch_size': 920, 'hint_rate': 0.02, 'alpha': 95, 'iterations': 97718}. Best is trial 25 with value: 0.15813713564186543.
[I 2023-12-22 02:36:14,605] Trial 182 finished with value: inf and parameters: {'model_name': 'GAIN', 'batch_size': 951, 'hint_rate': 0.03, 'alpha': 98, 'iterations': 99921}. Best is trial 25 with value: 0.15813713564186543.
[I 2023-12-22 02:43:33,507] Trial 15 finished with value: 0.3042240155221703 and parameters: {'model_name': 'GAIN', 'batch_size': 1, 'hint_rate': 0.38, 'alpha': 47, 'iterations': 19274}. Best is trial 25 with value: 0.15813713564186543.
[I 2023-12-22 02:55:44,185] Trial 174 finished with value: inf and parameters: {'model_name': 'GAIN', 'batch_size': 1, 'hint_rate': 0.04, 'alpha': 99, 'iterations': 87913}. Best is trial 25 with value: 0.15813713564186543.
[I 2023-12-22 02:57:55,788] Trial 145 finished with value: 0.30434790589644517 and parameters: {'model_name': 'GAIN', 'batch_size': 1, 'hint_rate': 0.08, 'alpha': 97, 'iterations': 27926}. Best is trial 25 with value: 0.15813713564186543.
[I 2023-12-22 03:03:20,624] Trial 187 finished with value: 0.2977489770103797 and parameters: {'model_name': 'GAIN', 'batch_size': 1, 'hint_rate': 0.16, 'alpha': 98, 'iterations': 35060}. Best is trial 25 with value: 0.15813713564186543.
[I 2023-12-22 03:09:22,805] Trial 176 finished with value: inf and parameters: {'model_name': 'GAIN', 'batch_size': 1, 'hint_rate': 0.04, 'alpha': 97, 'iterations': 54191}. Best is trial 25 with value: 0.15813713564186543.
[I 2023-12-22 03:10:02,265] Trial 161 finished with value: 0.29776590742528114 and parameters: {'model_name': 'GAIN', 'batch_size': 1, 'hint_rate': 0.04, 'alpha': 92, 'iterations': 50538}. Best is trial 25 with value: 0.15813713564186543.
