[I 2024-02-11 04:51:16,880] Trial 5 finished with value: 7.747123617780067 and parameters: {'model_name': 'SimpleImputer', 'strategy': 'constant'}. Best is trial 5 with value: 7.747123617780067.
[I 2024-02-11 04:51:18,810] Trial 19 finished with value: 6.682950669963486 and parameters: {'model_name': 'SimpleImputer', 'strategy': 'mean'}. Best is trial 19 with value: 6.682950669963486.
[I 2024-02-11 04:51:19,334] Trial 8 finished with value: 7.747123617780067 and parameters: {'model_name': 'SimpleImputer', 'strategy': 'constant'}. Best is trial 19 with value: 6.682950669963486.
[I 2024-02-11 04:51:20,674] Trial 29 finished with value: 6.682950669963486 and parameters: {'model_name': 'SimpleImputer', 'strategy': 'mean'}. Best is trial 19 with value: 6.682950669963486.
[I 2024-02-11 04:51:22,781] Trial 40 finished with value: 7.747123617780067 and parameters: {'model_name': 'SimpleImputer', 'strategy': 'constant'}. Best is trial 19 with value: 6.682950669963486.
[I 2024-02-11 04:51:23,493] Trial 4 finished with value: 7.243577639520876 and parameters: {'model_name': 'SimpleImputer', 'strategy': 'median'}. Best is trial 19 with value: 6.682950669963486.
[I 2024-02-11 04:51:24,055] Trial 18 finished with value: 7.243577639520876 and parameters: {'model_name': 'SimpleImputer', 'strategy': 'median'}. Best is trial 19 with value: 6.682950669963486.
[I 2024-02-11 04:51:24,655] Trial 0 finished with value: 7.243577639520876 and parameters: {'model_name': 'SimpleImputer', 'strategy': 'median'}. Best is trial 19 with value: 6.682950669963486.
[I 2024-02-11 04:51:25,576] Trial 24 finished with value: 7.243577639520876 and parameters: {'model_name': 'SimpleImputer', 'strategy': 'median'}. Best is trial 19 with value: 6.682950669963486.
[I 2024-02-11 04:51:26,283] Trial 22 finished with value: 7.243577639520876 and parameters: {'model_name': 'SimpleImputer', 'strategy': 'median'}. Best is trial 19 with value: 6.682950669963486.
[I 2024-02-11 04:51:28,201] Trial 41 finished with value: 7.243577639520876 and parameters: {'model_name': 'SimpleImputer', 'strategy': 'median'}. Best is trial 19 with value: 6.682950669963486.
2024-02-11 04:51:37.329024: E external/local_xla/xla/stream_executor/cuda/cuda_driver.cc:274] failed call to cuInit: CUDA_ERROR_NO_DEVICE: no CUDA-capable device is detected
2024-02-11 04:51:37.859814: I tensorflow/compiler/mlir/mlir_graph_optimization_pass.cc:388] MLIR V1 optimization pass is not enabled
[I 2024-02-11 04:51:47,609] Trial 7 finished with value: 7.363916558581691 and parameters: {'model_name': 'SimpleImputer', 'strategy': 'most_frequent'}. Best is trial 19 with value: 6.682950669963486.
[I 2024-02-11 04:51:59,036] Trial 6 finished with value: 2.2054181460847433 and parameters: {'model_name': 'KNNImputer', 'weights': 'uniform', 'keep_empty_features': False}. Best is trial 6 with value: 2.2054181460847433.
[I 2024-02-11 04:52:00,780] Trial 2 finished with value: 2.1739120973465194 and parameters: {'model_name': 'KNNImputer', 'weights': 'distance', 'keep_empty_features': False}. Best is trial 2 with value: 2.1739120973465194.
[I 2024-02-11 04:52:01,541] Trial 30 finished with value: 2.1739120973465194 and parameters: {'model_name': 'KNNImputer', 'weights': 'distance', 'keep_empty_features': False}. Best is trial 2 with value: 2.1739120973465194.
[I 2024-02-11 04:52:02,432] Trial 31 finished with value: 2.2054181460847433 and parameters: {'model_name': 'KNNImputer', 'weights': 'uniform', 'keep_empty_features': False}. Best is trial 2 with value: 2.1739120973465194.
[I 2024-02-11 04:52:03,405] Trial 15 finished with value: 2.2054181460847433 and parameters: {'model_name': 'KNNImputer', 'weights': 'uniform', 'keep_empty_features': False}. Best is trial 2 with value: 2.1739120973465194.
[I 2024-02-11 04:52:04,241] Trial 47 finished with value: 2.2054181460847433 and parameters: {'model_name': 'KNNImputer', 'weights': 'uniform', 'keep_empty_features': False}. Best is trial 2 with value: 2.1739120973465194.
[I 2024-02-11 04:52:04,966] Trial 17 finished with value: 2.1739120973465194 and parameters: {'model_name': 'KNNImputer', 'weights': 'distance', 'keep_empty_features': False}. Best is trial 2 with value: 2.1739120973465194.
[I 2024-02-11 04:52:05,976] Trial 38 finished with value: 2.1739120973465194 and parameters: {'model_name': 'KNNImputer', 'weights': 'distance', 'keep_empty_features': False}. Best is trial 2 with value: 2.1739120973465194.
[I 2024-02-11 04:52:06,805] Trial 34 finished with value: 2.2054181460847433 and parameters: {'model_name': 'KNNImputer', 'weights': 'uniform', 'keep_empty_features': False}. Best is trial 2 with value: 2.1739120973465194.
[I 2024-02-11 04:52:07,694] Trial 42 finished with value: 2.1739120973465194 and parameters: {'model_name': 'KNNImputer', 'weights': 'distance', 'keep_empty_features': False}. Best is trial 2 with value: 2.1739120973465194.
[I 2024-02-11 04:52:16,505] Trial 21 finished with value: 6.682950669963486 and parameters: {'model_name': 'RandomForestImputer', 'max_iter': 1, 'decreasing': True, 'min_samples_split': 0.6000000000000001, 'min_samples_leaf': 0.9, 'max_features': 0.9, 'warm_start': True}. Best is trial 2 with value: 2.1739120973465194.
[I 2024-02-11 04:52:18,187] Trial 14 finished with value: 6.682950669963486 and parameters: {'model_name': 'RandomForestImputer', 'max_iter': 1, 'decreasing': False, 'min_samples_split': 0.5, 'min_samples_leaf': 0.6, 'max_features': 0.1, 'warm_start': True}. Best is trial 2 with value: 2.1739120973465194.
[I 2024-02-11 04:52:30,006] Trial 59 finished with value: 2.1739120973465194 and parameters: {'model_name': 'KNNImputer', 'weights': 'distance', 'keep_empty_features': False}. Best is trial 2 with value: 2.1739120973465194.
[I 2024-02-11 04:52:37,631] Trial 60 finished with value: 2.2054181460847433 and parameters: {'model_name': 'KNNImputer', 'weights': 'uniform', 'keep_empty_features': False}. Best is trial 2 with value: 2.1739120973465194.
[I 2024-02-11 04:52:38,393] Trial 62 finished with value: 2.1739120973465194 and parameters: {'model_name': 'KNNImputer', 'weights': 'distance', 'keep_empty_features': False}. Best is trial 2 with value: 2.1739120973465194.
[I 2024-02-11 04:52:39,359] Trial 63 finished with value: 2.1739120973465194 and parameters: {'model_name': 'KNNImputer', 'weights': 'distance', 'keep_empty_features': False}. Best is trial 2 with value: 2.1739120973465194.
[I 2024-02-11 04:52:40,200] Trial 61 finished with value: 2.1739120973465194 and parameters: {'model_name': 'KNNImputer', 'weights': 'distance', 'keep_empty_features': False}. Best is trial 2 with value: 2.1739120973465194.
[I 2024-02-11 04:53:41,159] Trial 37 finished with value: 6.825060016971993 and parameters: {'model_name': 'RandomForestImputer', 'max_iter': 3, 'decreasing': False, 'min_samples_split': 0.6000000000000001, 'min_samples_leaf': 0.8, 'max_features': 0.2, 'warm_start': True}. Best is trial 2 with value: 2.1739120973465194.
[I 2024-02-11 04:53:45,012] Trial 54 finished with value: 6.810833073864468 and parameters: {'model_name': 'RandomForestImputer', 'max_iter': 3, 'decreasing': False, 'min_samples_split': 0.8, 'min_samples_leaf': 0.4, 'max_features': 0.7000000000000001, 'warm_start': True}. Best is trial 2 with value: 2.1739120973465194.
[I 2024-02-11 04:53:52,828] Trial 52 finished with value: 8.88859024308513 and parameters: {'model_name': 'GAIN', 'batch_size': 1, 'hint_rate': 0.59, 'alpha': 54, 'iterations': 2}. Best is trial 2 with value: 2.1739120973465194.
[I 2024-02-11 04:54:02,469] Trial 66 finished with value: 9.440060006571738 and parameters: {'model_name': 'GAIN', 'batch_size': 164, 'hint_rate': 0.97, 'alpha': 12, 'iterations': 1}. Best is trial 2 with value: 2.1739120973465194.
[I 2024-02-11 04:54:05,369] Trial 9 finished with value: 6.682950669963486 and parameters: {'model_name': 'RandomForestImputer', 'max_iter': 1, 'decreasing': False, 'min_samples_split': 0.8, 'min_samples_leaf': 0.4, 'max_features': 0.30000000000000004, 'warm_start': False}. Best is trial 2 with value: 2.1739120973465194.
[I 2024-02-11 04:54:08,769] Trial 53 finished with value: 6.682950669963486 and parameters: {'model_name': 'RandomForestImputer', 'max_iter': 1, 'decreasing': False, 'min_samples_split': 0.30000000000000004, 'min_samples_leaf': 0.7000000000000001, 'max_features': 0.2, 'warm_start': False}. Best is trial 2 with value: 2.1739120973465194.
[I 2024-02-11 04:54:11,640] Trial 10 finished with value: 6.682950669963486 and parameters: {'model_name': 'RandomForestImputer', 'max_iter': 1, 'decreasing': False, 'min_samples_split': 0.30000000000000004, 'min_samples_leaf': 0.2, 'max_features': 0.8, 'warm_start': False}. Best is trial 2 with value: 2.1739120973465194.
[I 2024-02-11 04:54:51,443] Trial 25 finished with value: 8.145536868792048 and parameters: {'model_name': 'GAIN', 'batch_size': 23, 'hint_rate': 0.31, 'alpha': 96, 'iterations': 17}. Best is trial 2 with value: 2.1739120973465194.
[I 2024-02-11 04:55:25,527] Trial 58 finished with value: 6.711409093536936 and parameters: {'model_name': 'RandomForestImputer', 'max_iter': 11, 'decreasing': True, 'min_samples_split': 0.1, 'min_samples_leaf': 0.30000000000000004, 'max_features': 0.6, 'warm_start': True}. Best is trial 2 with value: 2.1739120973465194.
[I 2024-02-11 04:55:37,426] Trial 78 finished with value: 8.888983294930194 and parameters: {'model_name': 'GAIN', 'batch_size': 837, 'hint_rate': 0.51, 'alpha': 34, 'iterations': 2}. Best is trial 2 with value: 2.1739120973465194.
[I 2024-02-11 04:55:40,725] Trial 20 finished with value: 6.761112904298021 and parameters: {'model_name': 'RandomForestImputer', 'max_iter': 17, 'decreasing': True, 'min_samples_split': 0.6000000000000001, 'min_samples_leaf': 0.5, 'max_features': 0.5, 'warm_start': True}. Best is trial 2 with value: 2.1739120973465194.
[I 2024-02-11 04:56:05,318] Trial 39 finished with value: 1.8352694185708014 and parameters: {'model_name': 'IterativeImputer', 'sample_posterior': False, 'initial_strategy': 'mean', 'imputation_order': 'arabic'}. Best is trial 39 with value: 1.8352694185708014.
[I 2024-02-11 04:56:06,842] Trial 23 finished with value: 1.8352706092244886 and parameters: {'model_name': 'IterativeImputer', 'sample_posterior': False, 'initial_strategy': 'median', 'imputation_order': 'ascending'}. Best is trial 39 with value: 1.8352694185708014.
[I 2024-02-11 04:56:16,595] Trial 26 finished with value: 1.8352704225144456 and parameters: {'model_name': 'IterativeImputer', 'sample_posterior': False, 'initial_strategy': 'most_frequent', 'imputation_order': 'arabic'}. Best is trial 39 with value: 1.8352694185708014.
[I 2024-02-11 04:56:19,152] Trial 50 finished with value: 1.8352705996204624 and parameters: {'model_name': 'IterativeImputer', 'sample_posterior': False, 'initial_strategy': 'most_frequent', 'imputation_order': 'ascending'}. Best is trial 39 with value: 1.8352694185708014.
[I 2024-02-11 04:56:34,328] Trial 65 finished with value: 1.8352705996204624 and parameters: {'model_name': 'IterativeImputer', 'sample_posterior': False, 'initial_strategy': 'most_frequent', 'imputation_order': 'ascending'}. Best is trial 39 with value: 1.8352694185708014.
[I 2024-02-11 04:56:52,392] Trial 12 finished with value: 6.755416301256751 and parameters: {'model_name': 'RandomForestImputer', 'max_iter': 21, 'decreasing': True, 'min_samples_split': 0.30000000000000004, 'min_samples_leaf': 0.8, 'max_features': 0.5, 'warm_start': True}. Best is trial 39 with value: 1.8352694185708014.
[I 2024-02-11 04:56:59,981] Trial 45 finished with value: 7.446436343507104 and parameters: {'model_name': 'GAIN', 'batch_size': 434, 'hint_rate': 0.43, 'alpha': 70, 'iterations': 42}. Best is trial 39 with value: 1.8352694185708014.
[I 2024-02-11 04:57:14,439] Trial 33 finished with value: 6.789577699067335 and parameters: {'model_name': 'RandomForestImputer', 'max_iter': 18, 'decreasing': False, 'min_samples_split': 0.7000000000000001, 'min_samples_leaf': 0.30000000000000004, 'max_features': 0.2, 'warm_start': True}. Best is trial 39 with value: 1.8352694185708014.
[I 2024-02-11 04:57:28,664] Trial 28 finished with value: 1.8352705572260288 and parameters: {'model_name': 'IterativeImputer', 'sample_posterior': False, 'initial_strategy': 'most_frequent', 'imputation_order': 'random'}. Best is trial 39 with value: 1.8352694185708014.
[I 2024-02-11 04:57:30,468] Trial 51 finished with value: 1.8352705383178773 and parameters: {'model_name': 'IterativeImputer', 'sample_posterior': False, 'initial_strategy': 'most_frequent', 'imputation_order': 'random'}. Best is trial 39 with value: 1.8352694185708014.
[I 2024-02-11 04:57:35,090] Trial 75 finished with value: 1.8352708107742934 and parameters: {'model_name': 'IterativeImputer', 'sample_posterior': False, 'initial_strategy': 'median', 'imputation_order': 'descending'}. Best is trial 39 with value: 1.8352694185708014.
[I 2024-02-11 04:59:05,076] Trial 84 finished with value: 1.8352696616578434 and parameters: {'model_name': 'IterativeImputer', 'sample_posterior': False, 'initial_strategy': 'mean', 'imputation_order': 'roman'}. Best is trial 39 with value: 1.8352694185708014.
[I 2024-02-11 04:59:17,365] Trial 82 finished with value: 1.835269707930062 and parameters: {'model_name': 'IterativeImputer', 'sample_posterior': False, 'initial_strategy': 'constant', 'imputation_order': 'arabic'}. Best is trial 39 with value: 1.8352694185708014.
[I 2024-02-11 04:59:18,709] Trial 83 finished with value: 1.8352708215762898 and parameters: {'model_name': 'IterativeImputer', 'sample_posterior': False, 'initial_strategy': 'most_frequent', 'imputation_order': 'descending'}. Best is trial 39 with value: 1.8352694185708014.
[I 2024-02-11 04:59:48,343] Trial 67 finished with value: 6.4711634196152925 and parameters: {'model_name': 'GAIN', 'batch_size': 249, 'hint_rate': 0.51, 'alpha': 36, 'iterations': 71}. Best is trial 39 with value: 1.8352694185708014.
[I 2024-02-11 05:00:02,396] Trial 86 finished with value: 1.835271011267435 and parameters: {'model_name': 'IterativeImputer', 'sample_posterior': False, 'initial_strategy': 'most_frequent', 'imputation_order': 'roman'}. Best is trial 39 with value: 1.8352694185708014.
[I 2024-02-11 05:00:26,322] Trial 88 finished with value: 1.8352694185708014 and parameters: {'model_name': 'IterativeImputer', 'sample_posterior': False, 'initial_strategy': 'mean', 'imputation_order': 'arabic'}. Best is trial 39 with value: 1.8352694185708014.
[I 2024-02-11 05:00:29,181] Trial 3 finished with value: 6.759650603074502 and parameters: {'model_name': 'RandomForestImputer', 'max_iter': 99, 'decreasing': True, 'min_samples_split': 0.6000000000000001, 'min_samples_leaf': 0.9, 'max_features': 0.5, 'warm_start': True}. Best is trial 39 with value: 1.8352694185708014.
[I 2024-02-11 05:00:31,045] Trial 89 finished with value: 1.8352694185708014 and parameters: {'model_name': 'IterativeImputer', 'sample_posterior': False, 'initial_strategy': 'mean', 'imputation_order': 'arabic'}. Best is trial 39 with value: 1.8352694185708014.
[I 2024-02-11 05:00:39,975] Trial 90 finished with value: 1.8352704897162426 and parameters: {'model_name': 'IterativeImputer', 'sample_posterior': False, 'initial_strategy': 'median', 'imputation_order': 'arabic'}. Best is trial 39 with value: 1.8352694185708014.
[I 2024-02-11 05:00:51,023] Trial 91 finished with value: 1.8352704225144456 and parameters: {'model_name': 'IterativeImputer', 'sample_posterior': False, 'initial_strategy': 'most_frequent', 'imputation_order': 'arabic'}. Best is trial 39 with value: 1.8352694185708014.
[I 2024-02-11 05:01:05,350] Trial 92 finished with value: 1.8352705996204624 and parameters: {'model_name': 'IterativeImputer', 'sample_posterior': False, 'initial_strategy': 'most_frequent', 'imputation_order': 'ascending'}. Best is trial 39 with value: 1.8352694185708014.
[I 2024-02-11 05:01:12,496] Trial 87 finished with value: 1.8352698311912978 and parameters: {'model_name': 'IterativeImputer', 'sample_posterior': False, 'initial_strategy': 'constant', 'imputation_order': 'random'}. Best is trial 39 with value: 1.8352694185708014.
[I 2024-02-11 05:01:23,766] Trial 93 finished with value: 1.8352705996204624 and parameters: {'model_name': 'IterativeImputer', 'sample_posterior': False, 'initial_strategy': 'most_frequent', 'imputation_order': 'ascending'}. Best is trial 39 with value: 1.8352694185708014.
[I 2024-02-11 05:01:31,886] Trial 94 finished with value: 1.8352705996204624 and parameters: {'model_name': 'IterativeImputer', 'sample_posterior': False, 'initial_strategy': 'most_frequent', 'imputation_order': 'ascending'}. Best is trial 39 with value: 1.8352694185708014.
[I 2024-02-11 05:01:41,337] Trial 95 finished with value: 1.8352705996204624 and parameters: {'model_name': 'IterativeImputer', 'sample_posterior': False, 'initial_strategy': 'most_frequent', 'imputation_order': 'ascending'}. Best is trial 39 with value: 1.8352694185708014.
[I 2024-02-11 05:01:53,021] Trial 96 finished with value: 1.8352704225144456 and parameters: {'model_name': 'IterativeImputer', 'sample_posterior': False, 'initial_strategy': 'most_frequent', 'imputation_order': 'arabic'}. Best is trial 39 with value: 1.8352694185708014.
[I 2024-02-11 05:01:56,088] Trial 97 finished with value: 1.8352704225144456 and parameters: {'model_name': 'IterativeImputer', 'sample_posterior': False, 'initial_strategy': 'most_frequent', 'imputation_order': 'arabic'}. Best is trial 39 with value: 1.8352694185708014.
[I 2024-02-11 05:02:08,538] Trial 73 finished with value: 6.342759814173702 and parameters: {'model_name': 'GAIN', 'batch_size': 10, 'hint_rate': 0.72, 'alpha': 77, 'iterations': 108}. Best is trial 39 with value: 1.8352694185708014.
[I 2024-02-11 05:02:11,085] Trial 76 finished with value: 6.551838322132822 and parameters: {'model_name': 'GAIN', 'batch_size': 150, 'hint_rate': 0.5, 'alpha': 59, 'iterations': 93}. Best is trial 39 with value: 1.8352694185708014.
[I 2024-02-11 05:02:55,700] Trial 98 finished with value: 1.8352726923866964 and parameters: {'model_name': 'IterativeImputer', 'sample_posterior': False, 'initial_strategy': 'most_frequent', 'imputation_order': 'random'}. Best is trial 39 with value: 1.8352694185708014.
[I 2024-02-11 05:03:10,770] Trial 99 finished with value: 1.8352694185708014 and parameters: {'model_name': 'IterativeImputer', 'sample_posterior': False, 'initial_strategy': 'mean', 'imputation_order': 'arabic'}. Best is trial 39 with value: 1.8352694185708014.
[I 2024-02-11 05:03:23,065] Trial 100 finished with value: 1.8352694185708014 and parameters: {'model_name': 'IterativeImputer', 'sample_posterior': False, 'initial_strategy': 'mean', 'imputation_order': 'arabic'}. Best is trial 39 with value: 1.8352694185708014.
[I 2024-02-11 05:03:24,193] Trial 101 finished with value: 1.8352694185708014 and parameters: {'model_name': 'IterativeImputer', 'sample_posterior': False, 'initial_strategy': 'mean', 'imputation_order': 'arabic'}. Best is trial 39 with value: 1.8352694185708014.
[I 2024-02-11 05:03:46,133] Trial 102 finished with value: 1.8352694185708014 and parameters: {'model_name': 'IterativeImputer', 'sample_posterior': False, 'initial_strategy': 'mean', 'imputation_order': 'arabic'}. Best is trial 39 with value: 1.8352694185708014.
[I 2024-02-11 05:03:57,596] Trial 103 finished with value: 1.8352694185708014 and parameters: {'model_name': 'IterativeImputer', 'sample_posterior': False, 'initial_strategy': 'mean', 'imputation_order': 'arabic'}. Best is trial 39 with value: 1.8352694185708014.
[I 2024-02-11 05:04:23,625] Trial 56 finished with value: inf and parameters: {'model_name': 'GAIN', 'batch_size': 46, 'hint_rate': 0.13, 'alpha': 67, 'iterations': 1596}. Best is trial 39 with value: 1.8352694185708014.
[I 2024-02-11 05:06:29,639] Trial 119 finished with value: 1.8352694185708014 and parameters: {'model_name': 'IterativeImputer', 'sample_posterior': False, 'initial_strategy': 'mean', 'imputation_order': 'arabic'}. Best is trial 39 with value: 1.8352694185708014.
[I 2024-02-11 05:07:53,641] Trial 57 finished with value: inf and parameters: {'model_name': 'GAIN', 'batch_size': 812, 'hint_rate': 0.43, 'alpha': 28, 'iterations': 1965}. Best is trial 39 with value: 1.8352694185708014.
[I 2024-02-11 05:09:45,263] Trial 125 finished with value: 1.8352694185708014 and parameters: {'model_name': 'IterativeImputer', 'sample_posterior': False, 'initial_strategy': 'mean', 'imputation_order': 'arabic'}. Best is trial 39 with value: 1.8352694185708014.
[I 2024-02-11 05:10:20,071] Trial 1 finished with value: 2.489425219846097 and parameters: {'model_name': 'IterativeImputer', 'sample_posterior': True, 'initial_strategy': 'median', 'imputation_order': 'descending'}. Best is trial 39 with value: 1.8352694185708014.
[I 2024-02-11 05:10:21,387] Trial 11 finished with value: 2.5527493412176208 and parameters: {'model_name': 'IterativeImputer', 'sample_posterior': True, 'initial_strategy': 'mean', 'imputation_order': 'ascending'}. Best is trial 39 with value: 1.8352694185708014.
[I 2024-02-11 05:10:23,546] Trial 48 finished with value: 2.5185353372910404 and parameters: {'model_name': 'IterativeImputer', 'sample_posterior': True, 'initial_strategy': 'mean', 'imputation_order': 'arabic'}. Best is trial 39 with value: 1.8352694185708014.
[I 2024-02-11 05:10:27,680] Trial 35 finished with value: 2.5191901740988403 and parameters: {'model_name': 'IterativeImputer', 'sample_posterior': True, 'initial_strategy': 'median', 'imputation_order': 'arabic'}. Best is trial 39 with value: 1.8352694185708014.
[I 2024-02-11 05:10:29,113] Trial 27 finished with value: 2.5285127030394077 and parameters: {'model_name': 'IterativeImputer', 'sample_posterior': True, 'initial_strategy': 'median', 'imputation_order': 'descending'}. Best is trial 39 with value: 1.8352694185708014.
