[I 2024-03-01 08:51:04,465] Trial 88 finished with value: 6.258536136518293 and parameters: {'model_name': 'SimpleImputer', 'strategy': 'most_frequent'}. Best is trial 3 with value: 5.635667338061099.
[I 2024-03-01 08:51:04,993] Trial 85 finished with value: 6.258536136518293 and parameters: {'model_name': 'SimpleImputer', 'strategy': 'most_frequent'}. Best is trial 3 with value: 5.635667338061099.
[I 2024-03-01 08:51:05,230] Trial 114 finished with value: 5.635667338061099 and parameters: {'model_name': 'SimpleImputer', 'strategy': 'mean'}. Best is trial 3 with value: 5.635667338061099.
[I 2024-03-01 08:51:05,582] Trial 111 finished with value: 5.635667338061099 and parameters: {'model_name': 'SimpleImputer', 'strategy': 'mean'}. Best is trial 3 with value: 5.635667338061099.
[I 2024-03-01 08:51:05,804] Trial 90 finished with value: 6.258536136518293 and parameters: {'model_name': 'SimpleImputer', 'strategy': 'most_frequent'}. Best is trial 3 with value: 5.635667338061099.
[I 2024-03-01 08:51:06,135] Trial 113 finished with value: 5.635667338061099 and parameters: {'model_name': 'SimpleImputer', 'strategy': 'mean'}. Best is trial 3 with value: 5.635667338061099.
[I 2024-03-01 08:51:06,345] Trial 115 finished with value: 5.635667338061099 and parameters: {'model_name': 'SimpleImputer', 'strategy': 'mean'}. Best is trial 3 with value: 5.635667338061099.
[I 2024-03-01 08:51:06,541] Trial 116 finished with value: 5.635667338061099 and parameters: {'model_name': 'SimpleImputer', 'strategy': 'mean'}. Best is trial 3 with value: 5.635667338061099.
[I 2024-03-01 08:51:06,782] Trial 112 finished with value: 5.635667338061099 and parameters: {'model_name': 'SimpleImputer', 'strategy': 'mean'}. Best is trial 3 with value: 5.635667338061099.
[I 2024-03-01 08:51:07,197] Trial 92 finished with value: 6.258536136518293 and parameters: {'model_name': 'SimpleImputer', 'strategy': 'most_frequent'}. Best is trial 3 with value: 5.635667338061099.
[I 2024-03-01 08:51:07,547] Trial 120 finished with value: 5.635667338061099 and parameters: {'model_name': 'SimpleImputer', 'strategy': 'mean'}. Best is trial 3 with value: 5.635667338061099.
[I 2024-03-01 08:51:07,751] Trial 119 finished with value: 5.635667338061099 and parameters: {'model_name': 'SimpleImputer', 'strategy': 'mean'}. Best is trial 3 with value: 5.635667338061099.
[I 2024-03-01 08:51:07,951] Trial 117 finished with value: 5.635667338061099 and parameters: {'model_name': 'SimpleImputer', 'strategy': 'mean'}. Best is trial 3 with value: 5.635667338061099.
[I 2024-03-01 08:51:08,317] Trial 121 finished with value: 5.635667338061099 and parameters: {'model_name': 'SimpleImputer', 'strategy': 'mean'}. Best is trial 3 with value: 5.635667338061099.
[I 2024-03-01 08:51:08,646] Trial 125 finished with value: 5.635667338061099 and parameters: {'model_name': 'SimpleImputer', 'strategy': 'mean'}. Best is trial 3 with value: 5.635667338061099.
[I 2024-03-01 08:51:08,884] Trial 94 finished with value: 6.258536136518293 and parameters: {'model_name': 'SimpleImputer', 'strategy': 'most_frequent'}. Best is trial 3 with value: 5.635667338061099.
[I 2024-03-01 08:51:09,140] Trial 96 finished with value: 6.258536136518293 and parameters: {'model_name': 'SimpleImputer', 'strategy': 'most_frequent'}. Best is trial 3 with value: 5.635667338061099.
[I 2024-03-01 08:51:09,371] Trial 123 finished with value: 5.635667338061099 and parameters: {'model_name': 'SimpleImputer', 'strategy': 'mean'}. Best is trial 3 with value: 5.635667338061099.
[I 2024-03-01 08:51:09,602] Trial 118 finished with value: 5.635667338061099 and parameters: {'model_name': 'SimpleImputer', 'strategy': 'mean'}. Best is trial 3 with value: 5.635667338061099.
[I 2024-03-01 08:51:09,989] Trial 93 finished with value: 6.258536136518293 and parameters: {'model_name': 'SimpleImputer', 'strategy': 'most_frequent'}. Best is trial 3 with value: 5.635667338061099.
[I 2024-03-01 08:51:10,214] Trial 127 finished with value: 5.635667338061099 and parameters: {'model_name': 'SimpleImputer', 'strategy': 'mean'}. Best is trial 3 with value: 5.635667338061099.
[I 2024-03-01 08:51:10,452] Trial 122 finished with value: 5.635667338061099 and parameters: {'model_name': 'SimpleImputer', 'strategy': 'mean'}. Best is trial 3 with value: 5.635667338061099.
[I 2024-03-01 08:51:10,689] Trial 97 finished with value: 6.258536136518293 and parameters: {'model_name': 'SimpleImputer', 'strategy': 'most_frequent'}. Best is trial 3 with value: 5.635667338061099.
[I 2024-03-01 08:51:10,884] Trial 95 finished with value: 6.258536136518293 and parameters: {'model_name': 'SimpleImputer', 'strategy': 'most_frequent'}. Best is trial 3 with value: 5.635667338061099.
[I 2024-03-01 08:51:11,196] Trial 126 finished with value: 5.635667338061099 and parameters: {'model_name': 'SimpleImputer', 'strategy': 'mean'}. Best is trial 3 with value: 5.635667338061099.
[I 2024-03-01 08:51:11,467] Trial 100 finished with value: 6.258536136518293 and parameters: {'model_name': 'SimpleImputer', 'strategy': 'most_frequent'}. Best is trial 3 with value: 5.635667338061099.
[I 2024-03-01 08:51:11,684] Trial 124 finished with value: 5.635667338061099 and parameters: {'model_name': 'SimpleImputer', 'strategy': 'mean'}. Best is trial 3 with value: 5.635667338061099.
[I 2024-03-01 08:51:11,907] Trial 129 finished with value: 5.635667338061099 and parameters: {'model_name': 'SimpleImputer', 'strategy': 'mean'}. Best is trial 3 with value: 5.635667338061099.
[I 2024-03-01 08:51:12,178] Trial 128 finished with value: 5.635667338061099 and parameters: {'model_name': 'SimpleImputer', 'strategy': 'mean'}. Best is trial 3 with value: 5.635667338061099.
[I 2024-03-01 08:51:12,435] Trial 98 finished with value: 6.258536136518293 and parameters: {'model_name': 'SimpleImputer', 'strategy': 'most_frequent'}. Best is trial 3 with value: 5.635667338061099.
[I 2024-03-01 08:51:12,629] Trial 102 finished with value: 6.258536136518293 and parameters: {'model_name': 'SimpleImputer', 'strategy': 'most_frequent'}. Best is trial 3 with value: 5.635667338061099.
[I 2024-03-01 08:51:12,965] Trial 137 finished with value: 5.635667338061099 and parameters: {'model_name': 'SimpleImputer', 'strategy': 'mean'}. Best is trial 3 with value: 5.635667338061099.
[I 2024-03-01 08:51:13,164] Trial 135 finished with value: 5.635667338061099 and parameters: {'model_name': 'SimpleImputer', 'strategy': 'mean'}. Best is trial 3 with value: 5.635667338061099.
[I 2024-03-01 08:51:13,416] Trial 133 finished with value: 5.635667338061099 and parameters: {'model_name': 'SimpleImputer', 'strategy': 'mean'}. Best is trial 3 with value: 5.635667338061099.
[I 2024-03-01 08:51:13,654] Trial 141 finished with value: 5.635667338061099 and parameters: {'model_name': 'SimpleImputer', 'strategy': 'mean'}. Best is trial 3 with value: 5.635667338061099.
[I 2024-03-01 08:51:14,006] Trial 101 finished with value: 6.258536136518293 and parameters: {'model_name': 'SimpleImputer', 'strategy': 'most_frequent'}. Best is trial 3 with value: 5.635667338061099.
[I 2024-03-01 08:51:14,240] Trial 131 finished with value: 5.635667338061099 and parameters: {'model_name': 'SimpleImputer', 'strategy': 'mean'}. Best is trial 3 with value: 5.635667338061099.
[I 2024-03-01 08:51:14,474] Trial 132 finished with value: 5.635667338061099 and parameters: {'model_name': 'SimpleImputer', 'strategy': 'mean'}. Best is trial 3 with value: 5.635667338061099.
[I 2024-03-01 08:51:14,766] Trial 103 finished with value: 6.258536136518293 and parameters: {'model_name': 'SimpleImputer', 'strategy': 'most_frequent'}. Best is trial 3 with value: 5.635667338061099.
[I 2024-03-01 08:51:14,993] Trial 99 finished with value: 6.258536136518293 and parameters: {'model_name': 'SimpleImputer', 'strategy': 'most_frequent'}. Best is trial 3 with value: 5.635667338061099.
[I 2024-03-01 08:51:15,226] Trial 140 finished with value: 5.635667338061099 and parameters: {'model_name': 'SimpleImputer', 'strategy': 'mean'}. Best is trial 3 with value: 5.635667338061099.
[I 2024-03-01 08:51:15,446] Trial 136 finished with value: 5.635667338061099 and parameters: {'model_name': 'SimpleImputer', 'strategy': 'mean'}. Best is trial 3 with value: 5.635667338061099.
[I 2024-03-01 08:51:15,656] Trial 130 finished with value: 5.635667338061099 and parameters: {'model_name': 'SimpleImputer', 'strategy': 'mean'}. Best is trial 3 with value: 5.635667338061099.
[I 2024-03-01 08:51:15,952] Trial 104 finished with value: 6.258536136518293 and parameters: {'model_name': 'SimpleImputer', 'strategy': 'most_frequent'}. Best is trial 3 with value: 5.635667338061099.
[I 2024-03-01 08:51:16,178] Trial 134 finished with value: 5.635667338061099 and parameters: {'model_name': 'SimpleImputer', 'strategy': 'mean'}. Best is trial 3 with value: 5.635667338061099.
[I 2024-03-01 08:51:16,468] Trial 144 finished with value: 5.635667338061099 and parameters: {'model_name': 'SimpleImputer', 'strategy': 'mean'}. Best is trial 3 with value: 5.635667338061099.
[I 2024-03-01 08:51:16,759] Trial 139 finished with value: 5.635667338061099 and parameters: {'model_name': 'SimpleImputer', 'strategy': 'mean'}. Best is trial 3 with value: 5.635667338061099.
[I 2024-03-01 08:51:17,015] Trial 142 finished with value: 5.635667338061099 and parameters: {'model_name': 'SimpleImputer', 'strategy': 'mean'}. Best is trial 3 with value: 5.635667338061099.
[I 2024-03-01 08:51:17,231] Trial 151 finished with value: 5.635667338061099 and parameters: {'model_name': 'SimpleImputer', 'strategy': 'mean'}. Best is trial 3 with value: 5.635667338061099.
[I 2024-03-01 08:51:17,559] Trial 143 finished with value: 5.635667338061099 and parameters: {'model_name': 'SimpleImputer', 'strategy': 'mean'}. Best is trial 3 with value: 5.635667338061099.
[I 2024-03-01 08:51:17,846] Trial 150 finished with value: 5.635667338061099 and parameters: {'model_name': 'SimpleImputer', 'strategy': 'mean'}. Best is trial 3 with value: 5.635667338061099.
[I 2024-03-01 08:51:18,147] Trial 138 finished with value: 5.635667338061099 and parameters: {'model_name': 'SimpleImputer', 'strategy': 'mean'}. Best is trial 3 with value: 5.635667338061099.
[I 2024-03-01 08:51:18,395] Trial 146 finished with value: 5.635667338061099 and parameters: {'model_name': 'SimpleImputer', 'strategy': 'mean'}. Best is trial 3 with value: 5.635667338061099.
[I 2024-03-01 08:51:18,787] Trial 147 finished with value: 5.635667338061099 and parameters: {'model_name': 'SimpleImputer', 'strategy': 'mean'}. Best is trial 3 with value: 5.635667338061099.
[I 2024-03-01 08:51:19,039] Trial 149 finished with value: 5.635667338061099 and parameters: {'model_name': 'SimpleImputer', 'strategy': 'mean'}. Best is trial 3 with value: 5.635667338061099.
[I 2024-03-01 08:51:19,278] Trial 145 finished with value: 5.635667338061099 and parameters: {'model_name': 'SimpleImputer', 'strategy': 'mean'}. Best is trial 3 with value: 5.635667338061099.
[I 2024-03-01 08:51:19,511] Trial 148 finished with value: 5.635667338061099 and parameters: {'model_name': 'SimpleImputer', 'strategy': 'mean'}. Best is trial 3 with value: 5.635667338061099.
[I 2024-03-01 08:51:19,768] Trial 153 finished with value: 5.635667338061099 and parameters: {'model_name': 'SimpleImputer', 'strategy': 'mean'}. Best is trial 3 with value: 5.635667338061099.
[I 2024-03-01 08:51:19,970] Trial 152 finished with value: 5.635667338061099 and parameters: {'model_name': 'SimpleImputer', 'strategy': 'mean'}. Best is trial 3 with value: 5.635667338061099.
[I 2024-03-01 08:51:20,360] Trial 155 finished with value: 5.635667338061099 and parameters: {'model_name': 'SimpleImputer', 'strategy': 'mean'}. Best is trial 3 with value: 5.635667338061099.
[I 2024-03-01 08:51:20,710] Trial 162 finished with value: 5.635667338061099 and parameters: {'model_name': 'SimpleImputer', 'strategy': 'mean'}. Best is trial 3 with value: 5.635667338061099.
[I 2024-03-01 08:51:20,951] Trial 158 finished with value: 5.635667338061099 and parameters: {'model_name': 'SimpleImputer', 'strategy': 'mean'}. Best is trial 3 with value: 5.635667338061099.
[I 2024-03-01 08:51:21,170] Trial 154 finished with value: 5.635667338061099 and parameters: {'model_name': 'SimpleImputer', 'strategy': 'mean'}. Best is trial 3 with value: 5.635667338061099.
[I 2024-03-01 08:51:21,463] Trial 157 finished with value: 5.635667338061099 and parameters: {'model_name': 'SimpleImputer', 'strategy': 'mean'}. Best is trial 3 with value: 5.635667338061099.
[I 2024-03-01 08:51:21,741] Trial 156 finished with value: 5.635667338061099 and parameters: {'model_name': 'SimpleImputer', 'strategy': 'mean'}. Best is trial 3 with value: 5.635667338061099.
[I 2024-03-01 08:51:22,025] Trial 160 finished with value: 5.635667338061099 and parameters: {'model_name': 'SimpleImputer', 'strategy': 'mean'}. Best is trial 3 with value: 5.635667338061099.
[I 2024-03-01 08:51:22,302] Trial 165 finished with value: 5.635667338061099 and parameters: {'model_name': 'SimpleImputer', 'strategy': 'mean'}. Best is trial 3 with value: 5.635667338061099.
[I 2024-03-01 08:51:22,674] Trial 159 finished with value: 5.635667338061099 and parameters: {'model_name': 'SimpleImputer', 'strategy': 'mean'}. Best is trial 3 with value: 5.635667338061099.
[I 2024-03-01 08:51:22,892] Trial 163 finished with value: 5.635667338061099 and parameters: {'model_name': 'SimpleImputer', 'strategy': 'mean'}. Best is trial 3 with value: 5.635667338061099.
[I 2024-03-01 08:51:23,138] Trial 105 finished with value: 6.258536136518293 and parameters: {'model_name': 'SimpleImputer', 'strategy': 'most_frequent'}. Best is trial 3 with value: 5.635667338061099.
[I 2024-03-01 08:51:23,386] Trial 167 finished with value: 5.635667338061099 and parameters: {'model_name': 'SimpleImputer', 'strategy': 'mean'}. Best is trial 3 with value: 5.635667338061099.
[I 2024-03-01 08:51:23,601] Trial 164 finished with value: 5.635667338061099 and parameters: {'model_name': 'SimpleImputer', 'strategy': 'mean'}. Best is trial 3 with value: 5.635667338061099.
[I 2024-03-01 08:51:23,829] Trial 161 finished with value: 5.635667338061099 and parameters: {'model_name': 'SimpleImputer', 'strategy': 'mean'}. Best is trial 3 with value: 5.635667338061099.
[I 2024-03-01 08:51:24,057] Trial 172 finished with value: 5.635667338061099 and parameters: {'model_name': 'SimpleImputer', 'strategy': 'mean'}. Best is trial 3 with value: 5.635667338061099.
[I 2024-03-01 08:51:24,260] Trial 173 finished with value: 5.635667338061099 and parameters: {'model_name': 'SimpleImputer', 'strategy': 'mean'}. Best is trial 3 with value: 5.635667338061099.
[I 2024-03-01 08:51:24,439] Trial 169 finished with value: 5.635667338061099 and parameters: {'model_name': 'SimpleImputer', 'strategy': 'mean'}. Best is trial 3 with value: 5.635667338061099.
[I 2024-03-01 08:51:24,615] Trial 170 finished with value: 5.635667338061099 and parameters: {'model_name': 'SimpleImputer', 'strategy': 'mean'}. Best is trial 3 with value: 5.635667338061099.
[I 2024-03-01 08:51:24,902] Trial 168 finished with value: 5.635667338061099 and parameters: {'model_name': 'SimpleImputer', 'strategy': 'mean'}. Best is trial 3 with value: 5.635667338061099.
[I 2024-03-01 08:51:25,116] Trial 176 finished with value: 5.635667338061099 and parameters: {'model_name': 'SimpleImputer', 'strategy': 'mean'}. Best is trial 3 with value: 5.635667338061099.
[I 2024-03-01 08:51:25,351] Trial 192 finished with value: 6.258536136518293 and parameters: {'model_name': 'SimpleImputer', 'strategy': 'constant'}. Best is trial 3 with value: 5.635667338061099.
[I 2024-03-01 08:51:25,610] Trial 174 finished with value: 5.635667338061099 and parameters: {'model_name': 'SimpleImputer', 'strategy': 'mean'}. Best is trial 3 with value: 5.635667338061099.
[I 2024-03-01 08:51:25,843] Trial 171 finished with value: 5.635667338061099 and parameters: {'model_name': 'SimpleImputer', 'strategy': 'mean'}. Best is trial 3 with value: 5.635667338061099.
[I 2024-03-01 08:51:26,065] Trial 177 finished with value: 5.635667338061099 and parameters: {'model_name': 'SimpleImputer', 'strategy': 'mean'}. Best is trial 3 with value: 5.635667338061099.
[I 2024-03-01 08:51:26,279] Trial 182 finished with value: 5.635667338061099 and parameters: {'model_name': 'SimpleImputer', 'strategy': 'mean'}. Best is trial 3 with value: 5.635667338061099.
[I 2024-03-01 08:51:26,534] Trial 193 finished with value: 6.258536136518293 and parameters: {'model_name': 'SimpleImputer', 'strategy': 'constant'}. Best is trial 3 with value: 5.635667338061099.
[I 2024-03-01 08:51:26,756] Trial 180 finished with value: 5.635667338061099 and parameters: {'model_name': 'SimpleImputer', 'strategy': 'mean'}. Best is trial 3 with value: 5.635667338061099.
[I 2024-03-01 08:51:26,973] Trial 183 finished with value: 5.635667338061099 and parameters: {'model_name': 'SimpleImputer', 'strategy': 'mean'}. Best is trial 3 with value: 5.635667338061099.
[I 2024-03-01 08:51:27,190] Trial 175 finished with value: 5.635667338061099 and parameters: {'model_name': 'SimpleImputer', 'strategy': 'mean'}. Best is trial 3 with value: 5.635667338061099.
[I 2024-03-01 08:51:27,439] Trial 185 finished with value: 5.635667338061099 and parameters: {'model_name': 'SimpleImputer', 'strategy': 'mean'}. Best is trial 3 with value: 5.635667338061099.
[I 2024-03-01 08:51:27,644] Trial 181 finished with value: 5.635667338061099 and parameters: {'model_name': 'SimpleImputer', 'strategy': 'mean'}. Best is trial 3 with value: 5.635667338061099.
[I 2024-03-01 08:51:27,844] Trial 194 finished with value: 6.258536136518293 and parameters: {'model_name': 'SimpleImputer', 'strategy': 'constant'}. Best is trial 3 with value: 5.635667338061099.
[I 2024-03-01 08:51:28,035] Trial 184 finished with value: 5.635667338061099 and parameters: {'model_name': 'SimpleImputer', 'strategy': 'mean'}. Best is trial 3 with value: 5.635667338061099.
[I 2024-03-01 08:51:28,213] Trial 179 finished with value: 5.635667338061099 and parameters: {'model_name': 'SimpleImputer', 'strategy': 'mean'}. Best is trial 3 with value: 5.635667338061099.
[I 2024-03-01 08:51:28,447] Trial 178 finished with value: 5.635667338061099 and parameters: {'model_name': 'SimpleImputer', 'strategy': 'mean'}. Best is trial 3 with value: 5.635667338061099.
[I 2024-03-01 08:51:28,453] Trial 195 finished with value: 6.258536136518293 and parameters: {'model_name': 'SimpleImputer', 'strategy': 'constant'}. Best is trial 3 with value: 5.635667338061099.
[I 2024-03-01 08:51:28,828] Trial 166 finished with value: 5.635667338061099 and parameters: {'model_name': 'SimpleImputer', 'strategy': 'mean'}. Best is trial 3 with value: 5.635667338061099.
[I 2024-03-01 08:51:29,054] Trial 198 finished with value: 6.258536136518293 and parameters: {'model_name': 'SimpleImputer', 'strategy': 'constant'}. Best is trial 3 with value: 5.635667338061099.
[I 2024-03-01 08:51:29,248] Trial 197 finished with value: 6.258536136518293 and parameters: {'model_name': 'SimpleImputer', 'strategy': 'constant'}. Best is trial 3 with value: 5.635667338061099.
[I 2024-03-01 08:51:29,458] Trial 199 finished with value: 6.258536136518293 and parameters: {'model_name': 'SimpleImputer', 'strategy': 'constant'}. Best is trial 3 with value: 5.635667338061099.
[I 2024-03-01 08:51:29,666] Trial 196 finished with value: 6.258536136518293 and parameters: {'model_name': 'SimpleImputer', 'strategy': 'constant'}. Best is trial 3 with value: 5.635667338061099.
[I 2024-03-01 08:51:29,857] Trial 187 finished with value: 5.635667338061099 and parameters: {'model_name': 'SimpleImputer', 'strategy': 'mean'}. Best is trial 3 with value: 5.635667338061099.
[I 2024-03-01 08:51:30,070] Trial 188 finished with value: 5.635667338061099 and parameters: {'model_name': 'SimpleImputer', 'strategy': 'mean'}. Best is trial 3 with value: 5.635667338061099.
[I 2024-03-01 08:51:30,277] Trial 191 finished with value: 5.635667338061099 and parameters: {'model_name': 'SimpleImputer', 'strategy': 'mean'}. Best is trial 3 with value: 5.635667338061099.
[I 2024-03-01 08:51:30,485] Trial 189 finished with value: 5.635667338061099 and parameters: {'model_name': 'SimpleImputer', 'strategy': 'mean'}. Best is trial 3 with value: 5.635667338061099.
[I 2024-03-01 08:51:30,703] Trial 186 finished with value: 5.635667338061099 and parameters: {'model_name': 'SimpleImputer', 'strategy': 'mean'}. Best is trial 3 with value: 5.635667338061099.
