Run: 11
/cm/local/apps/slurm/var/spool/job691174/slurm_script: line 23: /common/ketrong/minconda3/etc/profile.d/conda.sh: No such file or directory
/cm/local/apps/slurm/var/spool/job691174/slurm_script: line 26: $'\nconda create --name tpot2devenv -c conda-forge python=3.10\n': command not found
/cm/local/apps/slurm/var/spool/job691174/slurm_script: line 31: $'\npip install -r requirements.txt\n': command not found
RunStart
2024-02-27 19:00:24.102673: I tensorflow/core/util/port.cc:113] oneDNN custom operations are on. You may see slightly different numerical results due to floating-point round-off errors from different computation orders. To turn them off, set the environment variable `TF_ENABLE_ONEDNN_OPTS=0`.
2024-02-27 19:00:24.138339: E external/local_xla/xla/stream_executor/cuda/cuda_dnn.cc:9261] Unable to register cuDNN factory: Attempting to register factory for plugin cuDNN when one has already been registered
2024-02-27 19:00:24.138360: E external/local_xla/xla/stream_executor/cuda/cuda_fft.cc:607] Unable to register cuFFT factory: Attempting to register factory for plugin cuFFT when one has already been registered
2024-02-27 19:00:24.139738: E external/local_xla/xla/stream_executor/cuda/cuda_blas.cc:1515] Unable to register cuBLAS factory: Attempting to register factory for plugin cuBLAS when one has already been registered
2024-02-27 19:00:24.145760: I tensorflow/core/platform/cpu_feature_guard.cc:182] This TensorFlow binary is optimized to use available CPU instructions in performance-critical operations.
To enable the following instructions: AVX2 AVX512F AVX512_VNNI FMA, in other operations, rebuild TensorFlow with the appropriate compiler flags.
2024-02-27 19:00:25.564361: W tensorflow/compiler/tf2tensorrt/utils/py_utils.cc:38] TF-TRT Warning: Could not find TensorRT
WARNING:tensorflow:From /home/ketrong/miniconda3/envs/tpot2devenv/lib/python3.10/site-packages/tensorflow/python/compat/v2_compat.py:108: disable_resource_variables (from tensorflow.python.ops.variable_scope) is deprecated and will be removed in a future version.
Instructions for updating:
non-resource variables are not supported in the long term
starting loops
working on 
logs/2306/tpot2_base_normal_MNAR_0.01
4.015673398971558
loading data
logs/2306/tpot2_base_normal_MNAR_0.01/data/2306_True.pkl
1023    -2.003580
23445   -3.403820
19181    0.983905
12770    0.087103
1153     5.747320
           ...   
29159   -0.421956
817      4.715940
2043     1.415070
33649    3.253480
10288   -0.104876
Name: y, Length: 36691, dtype: float64
         0  ...    9
0     -1.0  ...  1.0
1     -1.0  ... -1.0
2      1.0  ...  1.0
3     -1.0  ... -1.0
4      1.0  ...  0.0
...    ...  ...  ...
36686 -1.0  ...  0.0
36687  1.0  ...  1.0
36688 -1.0  ...  1.0
36689  1.0  ...  0.0
36690  1.0  ...  1.0

[36691 rows x 10 columns]
        0  ...    9
0    -1.0  ... -1.0
1    -1.0  ...  0.0
2    -1.0  ... -1.0
3    -1.0  ...  1.0
4     1.0  ... -1.0
...   ...  ...  ...
4072  1.0  ...  0.0
4073  1.0  ...  1.0
4074 -1.0  ...  0.0
4075  1.0  ...  1.0
4076 -1.0  ...  1.0

[4077 rows x 10 columns]
running experiment 1/3 - Does large hyperparameter space improve reconstruction accuracy over simple
[I 2024-02-27 19:00:36,562] A new study created in memory with name: no-name-232e08e6-3e98-4c92-8794-e77ca076d5f4
[I 2024-02-27 19:00:38,104] Trial 11 finished with value: 0.8324242327103157 and parameters: {'model_name': 'SimpleImputer', 'strategy': 'constant'}. Best is trial 11 with value: 0.8324242327103157.
[I 2024-02-27 19:00:38,315] Trial 10 finished with value: 0.8324242327103157 and parameters: {'model_name': 'SimpleImputer', 'strategy': 'constant'}. Best is trial 11 with value: 0.8324242327103157.
[I 2024-02-27 19:00:38,544] Trial 3 finished with value: 0.8324242327103157 and parameters: {'model_name': 'SimpleImputer', 'strategy': 'constant'}. Best is trial 11 with value: 0.8324242327103157.
[I 2024-02-27 19:00:38,710] Trial 2 finished with value: 0.8324242327103157 and parameters: {'model_name': 'SimpleImputer', 'strategy': 'constant'}. Best is trial 11 with value: 0.8324242327103157.
[I 2024-02-27 19:00:39,093] Trial 4 finished with value: 0.8324242327103157 and parameters: {'model_name': 'SimpleImputer', 'strategy': 'constant'}. Best is trial 11 with value: 0.8324242327103157.
[I 2024-02-27 19:00:39,492] Trial 17 finished with value: 0.8324242327103157 and parameters: {'model_name': 'SimpleImputer', 'strategy': 'constant'}. Best is trial 11 with value: 0.8324242327103157.
[I 2024-02-27 19:00:39,843] Trial 8 finished with value: 0.8323997979150299 and parameters: {'model_name': 'SimpleImputer', 'strategy': 'mean'}. Best is trial 8 with value: 0.8323997979150299.
[I 2024-02-27 19:00:40,130] Trial 1 finished with value: 0.8323997979150299 and parameters: {'model_name': 'SimpleImputer', 'strategy': 'mean'}. Best is trial 8 with value: 0.8323997979150299.
[I 2024-02-27 19:00:40,470] Trial 18 finished with value: 0.8324242327103157 and parameters: {'model_name': 'SimpleImputer', 'strategy': 'constant'}. Best is trial 8 with value: 0.8323997979150299.
[I 2024-02-27 19:00:40,707] Trial 20 finished with value: 0.8324242327103157 and parameters: {'model_name': 'SimpleImputer', 'strategy': 'constant'}. Best is trial 8 with value: 0.8323997979150299.
[I 2024-02-27 19:00:40,920] Trial 7 finished with value: 0.8323997979150299 and parameters: {'model_name': 'SimpleImputer', 'strategy': 'mean'}. Best is trial 8 with value: 0.8323997979150299.
[I 2024-02-27 19:00:41,349] Trial 22 finished with value: 0.8324242327103157 and parameters: {'model_name': 'SimpleImputer', 'strategy': 'constant'}. Best is trial 8 with value: 0.8323997979150299.
[I 2024-02-27 19:00:41,550] Trial 21 finished with value: 0.8324242327103157 and parameters: {'model_name': 'SimpleImputer', 'strategy': 'constant'}. Best is trial 8 with value: 0.8323997979150299.
[I 2024-02-27 19:00:41,841] Trial 31 finished with value: 0.8324242327103157 and parameters: {'model_name': 'SimpleImputer', 'strategy': 'constant'}. Best is trial 8 with value: 0.8323997979150299.
[I 2024-02-27 19:00:42,118] Trial 28 finished with value: 0.8324242327103157 and parameters: {'model_name': 'SimpleImputer', 'strategy': 'constant'}. Best is trial 8 with value: 0.8323997979150299.
[I 2024-02-27 19:00:42,344] Trial 23 finished with value: 0.8324242327103157 and parameters: {'model_name': 'SimpleImputer', 'strategy': 'constant'}. Best is trial 8 with value: 0.8323997979150299.
[I 2024-02-27 19:00:42,566] Trial 30 finished with value: 0.8324242327103157 and parameters: {'model_name': 'SimpleImputer', 'strategy': 'constant'}. Best is trial 8 with value: 0.8323997979150299.
[I 2024-02-27 19:00:42,922] Trial 46 finished with value: 0.8324242327103157 and parameters: {'model_name': 'SimpleImputer', 'strategy': 'constant'}. Best is trial 8 with value: 0.8323997979150299.
[I 2024-02-27 19:00:43,228] Trial 19 finished with value: 0.8323997979150299 and parameters: {'model_name': 'SimpleImputer', 'strategy': 'mean'}. Best is trial 8 with value: 0.8323997979150299.
[I 2024-02-27 19:00:43,521] Trial 29 finished with value: 0.8324242327103157 and parameters: {'model_name': 'SimpleImputer', 'strategy': 'constant'}. Best is trial 8 with value: 0.8323997979150299.
[I 2024-02-27 19:00:43,761] Trial 40 finished with value: 0.8324242327103157 and parameters: {'model_name': 'SimpleImputer', 'strategy': 'constant'}. Best is trial 8 with value: 0.8323997979150299.
[I 2024-02-27 19:00:44,025] Trial 44 finished with value: 0.8324242327103157 and parameters: {'model_name': 'SimpleImputer', 'strategy': 'constant'}. Best is trial 8 with value: 0.8323997979150299.
[I 2024-02-27 19:00:44,308] Trial 33 finished with value: 0.8324242327103157 and parameters: {'model_name': 'SimpleImputer', 'strategy': 'constant'}. Best is trial 8 with value: 0.8323997979150299.
[I 2024-02-27 19:00:44,583] Trial 14 finished with value: 0.8545689773247614 and parameters: {'model_name': 'SimpleImputer', 'strategy': 'median'}. Best is trial 8 with value: 0.8323997979150299.
[I 2024-02-27 19:00:44,784] Trial 16 finished with value: 0.8323997979150299 and parameters: {'model_name': 'SimpleImputer', 'strategy': 'mean'}. Best is trial 8 with value: 0.8323997979150299.
[I 2024-02-27 19:00:44,975] Trial 13 finished with value: 0.8323997979150299 and parameters: {'model_name': 'SimpleImputer', 'strategy': 'mean'}. Best is trial 8 with value: 0.8323997979150299.
[I 2024-02-27 19:00:45,341] Trial 25 finished with value: 0.8323997979150299 and parameters: {'model_name': 'SimpleImputer', 'strategy': 'mean'}. Best is trial 8 with value: 0.8323997979150299.
[I 2024-02-27 19:00:45,629] Trial 39 finished with value: 0.8323997979150299 and parameters: {'model_name': 'SimpleImputer', 'strategy': 'mean'}. Best is trial 8 with value: 0.8323997979150299.
[I 2024-02-27 19:00:45,901] Trial 5 finished with value: 0.8545689773247614 and parameters: {'model_name': 'SimpleImputer', 'strategy': 'median'}. Best is trial 8 with value: 0.8323997979150299.
[I 2024-02-27 19:00:46,125] Trial 6 finished with value: 0.8545689773247614 and parameters: {'model_name': 'SimpleImputer', 'strategy': 'median'}. Best is trial 8 with value: 0.8323997979150299.
[I 2024-02-27 19:00:46,708] Trial 42 finished with value: 0.8323997979150299 and parameters: {'model_name': 'SimpleImputer', 'strategy': 'mean'}. Best is trial 8 with value: 0.8323997979150299.
[I 2024-02-27 19:00:47,305] Trial 26 finished with value: 0.8545689773247614 and parameters: {'model_name': 'SimpleImputer', 'strategy': 'median'}. Best is trial 8 with value: 0.8323997979150299.
[I 2024-02-27 19:00:47,502] Trial 0 finished with value: 0.8545689773247614 and parameters: {'model_name': 'SimpleImputer', 'strategy': 'median'}. Best is trial 8 with value: 0.8323997979150299.
[I 2024-02-27 19:00:47,847] Trial 53 finished with value: 0.8324242327103157 and parameters: {'model_name': 'SimpleImputer', 'strategy': 'constant'}. Best is trial 8 with value: 0.8323997979150299.
[I 2024-02-27 19:00:48,075] Trial 34 finished with value: 0.8545689773247614 and parameters: {'model_name': 'SimpleImputer', 'strategy': 'median'}. Best is trial 8 with value: 0.8323997979150299.
[I 2024-02-27 19:00:48,356] Trial 55 finished with value: 0.8324242327103157 and parameters: {'model_name': 'SimpleImputer', 'strategy': 'constant'}. Best is trial 8 with value: 0.8323997979150299.
[I 2024-02-27 19:00:48,861] Trial 32 finished with value: 0.8545689773247614 and parameters: {'model_name': 'SimpleImputer', 'strategy': 'median'}. Best is trial 8 with value: 0.8323997979150299.
[I 2024-02-27 19:00:49,084] Trial 59 finished with value: 0.8323997979150299 and parameters: {'model_name': 'SimpleImputer', 'strategy': 'mean'}. Best is trial 8 with value: 0.8323997979150299.
[I 2024-02-27 19:00:49,269] Trial 58 finished with value: 0.8323997979150299 and parameters: {'model_name': 'SimpleImputer', 'strategy': 'mean'}. Best is trial 8 with value: 0.8323997979150299.
[I 2024-02-27 19:00:49,620] Trial 48 finished with value: 0.8323997979150299 and parameters: {'model_name': 'SimpleImputer', 'strategy': 'mean'}. Best is trial 8 with value: 0.8323997979150299.
[I 2024-02-27 19:00:49,817] Trial 56 finished with value: 0.8323997979150299 and parameters: {'model_name': 'SimpleImputer', 'strategy': 'mean'}. Best is trial 8 with value: 0.8323997979150299.
[I 2024-02-27 19:00:50,208] Trial 57 finished with value: 0.8323997979150299 and parameters: {'model_name': 'SimpleImputer', 'strategy': 'mean'}. Best is trial 8 with value: 0.8323997979150299.
[I 2024-02-27 19:00:50,671] Trial 60 finished with value: 0.8323997979150299 and parameters: {'model_name': 'SimpleImputer', 'strategy': 'mean'}. Best is trial 8 with value: 0.8323997979150299.
[I 2024-02-27 19:00:50,892] Trial 47 finished with value: 0.8545689773247614 and parameters: {'model_name': 'SimpleImputer', 'strategy': 'median'}. Best is trial 8 with value: 0.8323997979150299.
[I 2024-02-27 19:00:51,172] Trial 45 finished with value: 0.8545689773247614 and parameters: {'model_name': 'SimpleImputer', 'strategy': 'median'}. Best is trial 8 with value: 0.8323997979150299.
[I 2024-02-27 19:00:51,626] Trial 63 finished with value: 0.8323997979150299 and parameters: {'model_name': 'SimpleImputer', 'strategy': 'mean'}. Best is trial 8 with value: 0.8323997979150299.
[I 2024-02-27 19:00:51,924] Trial 65 finished with value: 0.8323997979150299 and parameters: {'model_name': 'SimpleImputer', 'strategy': 'mean'}. Best is trial 8 with value: 0.8323997979150299.
[I 2024-02-27 19:00:52,262] Trial 68 finished with value: 0.8323997979150299 and parameters: {'model_name': 'SimpleImputer', 'strategy': 'mean'}. Best is trial 8 with value: 0.8323997979150299.
[I 2024-02-27 19:00:52,513] Trial 62 finished with value: 0.8323997979150299 and parameters: {'model_name': 'SimpleImputer', 'strategy': 'mean'}. Best is trial 8 with value: 0.8323997979150299.
[I 2024-02-27 19:00:52,728] Trial 64 finished with value: 0.8323997979150299 and parameters: {'model_name': 'SimpleImputer', 'strategy': 'mean'}. Best is trial 8 with value: 0.8323997979150299.
[I 2024-02-27 19:00:52,919] Trial 67 finished with value: 0.8323997979150299 and parameters: {'model_name': 'SimpleImputer', 'strategy': 'mean'}. Best is trial 8 with value: 0.8323997979150299.
[I 2024-02-27 19:00:53,121] Trial 69 finished with value: 0.8323997979150299 and parameters: {'model_name': 'SimpleImputer', 'strategy': 'mean'}. Best is trial 8 with value: 0.8323997979150299.
[I 2024-02-27 19:00:53,421] Trial 61 finished with value: 0.8323997979150299 and parameters: {'model_name': 'SimpleImputer', 'strategy': 'mean'}. Best is trial 8 with value: 0.8323997979150299.
[I 2024-02-27 19:00:53,741] Trial 70 finished with value: 0.8323997979150299 and parameters: {'model_name': 'SimpleImputer', 'strategy': 'mean'}. Best is trial 8 with value: 0.8323997979150299.
[I 2024-02-27 19:00:53,970] Trial 66 finished with value: 0.8323997979150299 and parameters: {'model_name': 'SimpleImputer', 'strategy': 'mean'}. Best is trial 8 with value: 0.8323997979150299.
[I 2024-02-27 19:00:54,194] Trial 54 finished with value: 0.8545689773247614 and parameters: {'model_name': 'SimpleImputer', 'strategy': 'median'}. Best is trial 8 with value: 0.8323997979150299.
[I 2024-02-27 19:00:55,088] Trial 12 finished with value: 0.9068354521668288 and parameters: {'model_name': 'SimpleImputer', 'strategy': 'most_frequent'}. Best is trial 8 with value: 0.8323997979150299.
[I 2024-02-27 19:00:55,554] Trial 9 finished with value: 0.9068354521668288 and parameters: {'model_name': 'SimpleImputer', 'strategy': 'most_frequent'}. Best is trial 8 with value: 0.8323997979150299.
[I 2024-02-27 19:00:56,097] Trial 24 finished with value: 0.9068354521668288 and parameters: {'model_name': 'SimpleImputer', 'strategy': 'most_frequent'}. Best is trial 8 with value: 0.8323997979150299.
[I 2024-02-27 19:00:56,326] Trial 15 finished with value: 0.9068354521668288 and parameters: {'model_name': 'SimpleImputer', 'strategy': 'most_frequent'}. Best is trial 8 with value: 0.8323997979150299.
[I 2024-02-27 19:00:56,579] Trial 27 finished with value: 0.9068354521668288 and parameters: {'model_name': 'SimpleImputer', 'strategy': 'most_frequent'}. Best is trial 8 with value: 0.8323997979150299.
[I 2024-02-27 19:00:57,092] Trial 36 finished with value: 0.9068354521668288 and parameters: {'model_name': 'SimpleImputer', 'strategy': 'most_frequent'}. Best is trial 8 with value: 0.8323997979150299.
[I 2024-02-27 19:00:57,461] Trial 41 finished with value: 0.9068354521668288 and parameters: {'model_name': 'SimpleImputer', 'strategy': 'most_frequent'}. Best is trial 8 with value: 0.8323997979150299.
[I 2024-02-27 19:00:57,898] Trial 35 finished with value: 0.9068354521668288 and parameters: {'model_name': 'SimpleImputer', 'strategy': 'most_frequent'}. Best is trial 8 with value: 0.8323997979150299.
[I 2024-02-27 19:00:58,224] Trial 37 finished with value: 0.9068354521668288 and parameters: {'model_name': 'SimpleImputer', 'strategy': 'most_frequent'}. Best is trial 8 with value: 0.8323997979150299.
[I 2024-02-27 19:00:58,613] Trial 38 finished with value: 0.9068354521668288 and parameters: {'model_name': 'SimpleImputer', 'strategy': 'most_frequent'}. Best is trial 8 with value: 0.8323997979150299.
[I 2024-02-27 19:00:58,863] Trial 43 finished with value: 0.9068354521668288 and parameters: {'model_name': 'SimpleImputer', 'strategy': 'most_frequent'}. Best is trial 8 with value: 0.8323997979150299.
[I 2024-02-27 19:00:59,269] Trial 51 finished with value: 0.9068354521668288 and parameters: {'model_name': 'SimpleImputer', 'strategy': 'most_frequent'}. Best is trial 8 with value: 0.8323997979150299.
[I 2024-02-27 19:00:59,673] Trial 52 finished with value: 0.9068354521668288 and parameters: {'model_name': 'SimpleImputer', 'strategy': 'most_frequent'}. Best is trial 8 with value: 0.8323997979150299.
[I 2024-02-27 19:01:00,169] Trial 95 finished with value: 0.8323997979150299 and parameters: {'model_name': 'SimpleImputer', 'strategy': 'mean'}. Best is trial 8 with value: 0.8323997979150299.
[I 2024-02-27 19:01:00,484] Trial 101 finished with value: 0.8323997979150299 and parameters: {'model_name': 'SimpleImputer', 'strategy': 'mean'}. Best is trial 8 with value: 0.8323997979150299.
[I 2024-02-27 19:01:00,870] Trial 50 finished with value: 0.9068354521668288 and parameters: {'model_name': 'SimpleImputer', 'strategy': 'most_frequent'}. Best is trial 8 with value: 0.8323997979150299.
[I 2024-02-27 19:01:01,099] Trial 49 finished with value: 0.9068354521668288 and parameters: {'model_name': 'SimpleImputer', 'strategy': 'most_frequent'}. Best is trial 8 with value: 0.8323997979150299.
[I 2024-02-27 19:01:02,056] Trial 108 finished with value: 0.8323997979150299 and parameters: {'model_name': 'SimpleImputer', 'strategy': 'mean'}. Best is trial 8 with value: 0.8323997979150299.
[I 2024-02-27 19:01:02,284] Trial 71 finished with value: 0.9068354521668288 and parameters: {'model_name': 'SimpleImputer', 'strategy': 'most_frequent'}. Best is trial 8 with value: 0.8323997979150299.
[I 2024-02-27 19:01:02,799] Trial 74 finished with value: 0.9068354521668288 and parameters: {'model_name': 'SimpleImputer', 'strategy': 'most_frequent'}. Best is trial 8 with value: 0.8323997979150299.
[I 2024-02-27 19:01:03,012] Trial 75 finished with value: 0.9068354521668288 and parameters: {'model_name': 'SimpleImputer', 'strategy': 'most_frequent'}. Best is trial 8 with value: 0.8323997979150299.
[I 2024-02-27 19:01:03,334] Trial 72 finished with value: 0.9068354521668288 and parameters: {'model_name': 'SimpleImputer', 'strategy': 'most_frequent'}. Best is trial 8 with value: 0.8323997979150299.
[I 2024-02-27 19:01:03,601] Trial 110 finished with value: 0.8323997979150299 and parameters: {'model_name': 'SimpleImputer', 'strategy': 'mean'}. Best is trial 8 with value: 0.8323997979150299.
[I 2024-02-27 19:01:03,886] Trial 73 finished with value: 0.9068354521668288 and parameters: {'model_name': 'SimpleImputer', 'strategy': 'most_frequent'}. Best is trial 8 with value: 0.8323997979150299.
[I 2024-02-27 19:01:04,094] Trial 109 finished with value: 0.8323997979150299 and parameters: {'model_name': 'SimpleImputer', 'strategy': 'mean'}. Best is trial 8 with value: 0.8323997979150299.
[I 2024-02-27 19:01:04,465] Trial 113 finished with value: 0.8323997979150299 and parameters: {'model_name': 'SimpleImputer', 'strategy': 'mean'}. Best is trial 8 with value: 0.8323997979150299.
[I 2024-02-27 19:01:04,705] Trial 77 finished with value: 0.9068354521668288 and parameters: {'model_name': 'SimpleImputer', 'strategy': 'most_frequent'}. Best is trial 8 with value: 0.8323997979150299.
[I 2024-02-27 19:01:05,065] Trial 79 finished with value: 0.9068354521668288 and parameters: {'model_name': 'SimpleImputer', 'strategy': 'most_frequent'}. Best is trial 8 with value: 0.8323997979150299.
[I 2024-02-27 19:01:05,444] Trial 112 finished with value: 0.8323997979150299 and parameters: {'model_name': 'SimpleImputer', 'strategy': 'mean'}. Best is trial 8 with value: 0.8323997979150299.
[I 2024-02-27 19:01:05,818] Trial 82 finished with value: 0.9068354521668288 and parameters: {'model_name': 'SimpleImputer', 'strategy': 'most_frequent'}. Best is trial 8 with value: 0.8323997979150299.
[I 2024-02-27 19:01:06,030] Trial 111 finished with value: 0.8323997979150299 and parameters: {'model_name': 'SimpleImputer', 'strategy': 'mean'}. Best is trial 8 with value: 0.8323997979150299.
[I 2024-02-27 19:01:06,242] Trial 80 finished with value: 0.9068354521668288 and parameters: {'model_name': 'SimpleImputer', 'strategy': 'most_frequent'}. Best is trial 8 with value: 0.8323997979150299.
[I 2024-02-27 19:01:06,595] Trial 76 finished with value: 0.9068354521668288 and parameters: {'model_name': 'SimpleImputer', 'strategy': 'most_frequent'}. Best is trial 8 with value: 0.8323997979150299.
[I 2024-02-27 19:01:06,801] Trial 81 finished with value: 0.9068354521668288 and parameters: {'model_name': 'SimpleImputer', 'strategy': 'most_frequent'}. Best is trial 8 with value: 0.8323997979150299.
[I 2024-02-27 19:01:07,081] Trial 84 finished with value: 0.9068354521668288 and parameters: {'model_name': 'SimpleImputer', 'strategy': 'most_frequent'}. Best is trial 8 with value: 0.8323997979150299.
[I 2024-02-27 19:01:07,304] Trial 115 finished with value: 0.8323997979150299 and parameters: {'model_name': 'SimpleImputer', 'strategy': 'mean'}. Best is trial 8 with value: 0.8323997979150299.
[I 2024-02-27 19:01:07,622] Trial 78 finished with value: 0.9068354521668288 and parameters: {'model_name': 'SimpleImputer', 'strategy': 'most_frequent'}. Best is trial 8 with value: 0.8323997979150299.
[I 2024-02-27 19:01:07,881] Trial 114 finished with value: 0.8323997979150299 and parameters: {'model_name': 'SimpleImputer', 'strategy': 'mean'}. Best is trial 8 with value: 0.8323997979150299.
