[I 2024-02-28 02:40:05,350] Trial 163 finished with value: inf and parameters: {'model_name': 'GAIN', 'batch_size': 1, 'hint_rate': 0.04, 'alpha': 71, 'iterations': 41859}. Best is trial 4 with value: 2414.4818445410287.
[I 2024-02-28 02:40:45,623] Trial 131 finished with value: inf and parameters: {'model_name': 'GAIN', 'batch_size': 1, 'hint_rate': 0.97, 'alpha': 94, 'iterations': 88687}. Best is trial 4 with value: 2414.4818445410287.
[I 2024-02-28 02:41:19,024] Trial 116 finished with value: inf and parameters: {'model_name': 'GAIN', 'batch_size': 1, 'hint_rate': 0.060000000000000005, 'alpha': 100, 'iterations': 90149}. Best is trial 4 with value: 2414.4818445410287.
[I 2024-02-28 02:41:33,406] Trial 128 finished with value: inf and parameters: {'model_name': 'GAIN', 'batch_size': 1, 'hint_rate': 0.02, 'alpha': 84, 'iterations': 91378}. Best is trial 4 with value: 2414.4818445410287.
[I 2024-02-28 02:43:03,825] Trial 112 finished with value: inf and parameters: {'model_name': 'GAIN', 'batch_size': 2, 'hint_rate': 0.05, 'alpha': 96, 'iterations': 96347}. Best is trial 4 with value: 2414.4818445410287.
[I 2024-02-28 02:43:06,871] Trial 111 finished with value: inf and parameters: {'model_name': 'GAIN', 'batch_size': 1, 'hint_rate': 0.02, 'alpha': 94, 'iterations': 48354}. Best is trial 4 with value: 2414.4818445410287.
[I 2024-02-28 02:43:12,663] Trial 114 finished with value: inf and parameters: {'model_name': 'GAIN', 'batch_size': 1, 'hint_rate': 0.01, 'alpha': 94, 'iterations': 96328}. Best is trial 4 with value: 2414.4818445410287.
[I 2024-02-28 02:43:14,451] Trial 119 finished with value: inf and parameters: {'model_name': 'GAIN', 'batch_size': 1, 'hint_rate': 0.06999999999999999, 'alpha': 97, 'iterations': 97761}. Best is trial 4 with value: 2414.4818445410287.
[I 2024-02-28 02:43:37,560] Trial 166 finished with value: inf and parameters: {'model_name': 'GAIN', 'batch_size': 1, 'hint_rate': 0.060000000000000005, 'alpha': 73, 'iterations': 96744}. Best is trial 4 with value: 2414.4818445410287.
[I 2024-02-28 02:45:28,143] Trial 137 finished with value: inf and parameters: {'model_name': 'GAIN', 'batch_size': 1, 'hint_rate': 0.04, 'alpha': 88, 'iterations': 53937}. Best is trial 4 with value: 2414.4818445410287.
[I 2024-02-28 02:45:36,158] Trial 113 finished with value: inf and parameters: {'model_name': 'GAIN', 'batch_size': 1, 'hint_rate': 0.01, 'alpha': 99, 'iterations': 54832}. Best is trial 4 with value: 2414.4818445410287.
[I 2024-02-28 02:46:24,606] Trial 196 finished with value: inf and parameters: {'model_name': 'GAIN', 'batch_size': 959, 'hint_rate': 0.05, 'alpha': 66, 'iterations': 70945}. Best is trial 4 with value: 2414.4818445410287.
[I 2024-02-28 02:46:28,765] Trial 194 finished with value: inf and parameters: {'model_name': 'GAIN', 'batch_size': 664, 'hint_rate': 0.09, 'alpha': 72, 'iterations': 77403}. Best is trial 4 with value: 2414.4818445410287.
[I 2024-02-28 02:49:07,655] Trial 135 finished with value: 3284.8250450783808 and parameters: {'model_name': 'GAIN', 'batch_size': 1, 'hint_rate': 0.01, 'alpha': 90, 'iterations': 14227}. Best is trial 4 with value: 2414.4818445410287.
[I 2024-02-28 02:49:47,586] Trial 162 finished with value: inf and parameters: {'model_name': 'GAIN', 'batch_size': 1, 'hint_rate': 0.01, 'alpha': 69, 'iterations': 76668}. Best is trial 4 with value: 2414.4818445410287.
[I 2024-02-28 02:50:27,547] Trial 171 finished with value: inf and parameters: {'model_name': 'GAIN', 'batch_size': 950, 'hint_rate': 0.05, 'alpha': 71, 'iterations': 99494}. Best is trial 4 with value: 2414.4818445410287.
[I 2024-02-28 02:52:51,684] Trial 115 finished with value: 2697.786382148218 and parameters: {'model_name': 'GAIN', 'batch_size': 1, 'hint_rate': 0.060000000000000005, 'alpha': 96, 'iterations': 26334}. Best is trial 4 with value: 2414.4818445410287.
