[I 2024-02-28 19:45:12,354] Trial 71 finished with value: 3.561945701033614 and parameters: {'model_name': 'SimpleImputer', 'strategy': 'most_frequent'}. Best is trial 2 with value: 3.504923261731958.
[I 2024-02-28 19:45:12,580] Trial 107 finished with value: 3.504923261731958 and parameters: {'model_name': 'SimpleImputer', 'strategy': 'mean'}. Best is trial 2 with value: 3.504923261731958.
[I 2024-02-28 19:45:12,773] Trial 85 finished with value: 3.561945701033614 and parameters: {'model_name': 'SimpleImputer', 'strategy': 'most_frequent'}. Best is trial 2 with value: 3.504923261731958.
[I 2024-02-28 19:45:12,997] Trial 81 finished with value: 3.561945701033614 and parameters: {'model_name': 'SimpleImputer', 'strategy': 'most_frequent'}. Best is trial 2 with value: 3.504923261731958.
[I 2024-02-28 19:45:13,257] Trial 112 finished with value: 3.504923261731958 and parameters: {'model_name': 'SimpleImputer', 'strategy': 'mean'}. Best is trial 2 with value: 3.504923261731958.
[I 2024-02-28 19:45:13,476] Trial 87 finished with value: 3.561945701033614 and parameters: {'model_name': 'SimpleImputer', 'strategy': 'most_frequent'}. Best is trial 2 with value: 3.504923261731958.
[I 2024-02-28 19:45:13,707] Trial 108 finished with value: 3.504923261731958 and parameters: {'model_name': 'SimpleImputer', 'strategy': 'mean'}. Best is trial 2 with value: 3.504923261731958.
[I 2024-02-28 19:45:13,918] Trial 84 finished with value: 3.561945701033614 and parameters: {'model_name': 'SimpleImputer', 'strategy': 'most_frequent'}. Best is trial 2 with value: 3.504923261731958.
[I 2024-02-28 19:45:14,143] Trial 110 finished with value: 3.504923261731958 and parameters: {'model_name': 'SimpleImputer', 'strategy': 'mean'}. Best is trial 2 with value: 3.504923261731958.
[I 2024-02-28 19:45:14,402] Trial 83 finished with value: 3.561945701033614 and parameters: {'model_name': 'SimpleImputer', 'strategy': 'most_frequent'}. Best is trial 2 with value: 3.504923261731958.
[I 2024-02-28 19:45:14,657] Trial 106 finished with value: 3.504923261731958 and parameters: {'model_name': 'SimpleImputer', 'strategy': 'mean'}. Best is trial 2 with value: 3.504923261731958.
[I 2024-02-28 19:45:14,887] Trial 113 finished with value: 3.504923261731958 and parameters: {'model_name': 'SimpleImputer', 'strategy': 'mean'}. Best is trial 2 with value: 3.504923261731958.
[I 2024-02-28 19:45:15,140] Trial 111 finished with value: 3.504923261731958 and parameters: {'model_name': 'SimpleImputer', 'strategy': 'mean'}. Best is trial 2 with value: 3.504923261731958.
[I 2024-02-28 19:45:15,508] Trial 92 finished with value: 3.561945701033614 and parameters: {'model_name': 'SimpleImputer', 'strategy': 'most_frequent'}. Best is trial 2 with value: 3.504923261731958.
[I 2024-02-28 19:45:15,830] Trial 117 finished with value: 3.504923261731958 and parameters: {'model_name': 'SimpleImputer', 'strategy': 'mean'}. Best is trial 2 with value: 3.504923261731958.
[I 2024-02-28 19:45:16,035] Trial 115 finished with value: 3.504923261731958 and parameters: {'model_name': 'SimpleImputer', 'strategy': 'mean'}. Best is trial 2 with value: 3.504923261731958.
[I 2024-02-28 19:45:16,273] Trial 116 finished with value: 3.504923261731958 and parameters: {'model_name': 'SimpleImputer', 'strategy': 'mean'}. Best is trial 2 with value: 3.504923261731958.
[I 2024-02-28 19:45:16,525] Trial 114 finished with value: 3.504923261731958 and parameters: {'model_name': 'SimpleImputer', 'strategy': 'mean'}. Best is trial 2 with value: 3.504923261731958.
[I 2024-02-28 19:45:16,846] Trial 90 finished with value: 3.561945701033614 and parameters: {'model_name': 'SimpleImputer', 'strategy': 'most_frequent'}. Best is trial 2 with value: 3.504923261731958.
[I 2024-02-28 19:45:17,207] Trial 119 finished with value: 3.504923261731958 and parameters: {'model_name': 'SimpleImputer', 'strategy': 'mean'}. Best is trial 2 with value: 3.504923261731958.
[I 2024-02-28 19:45:17,486] Trial 88 finished with value: 3.561945701033614 and parameters: {'model_name': 'SimpleImputer', 'strategy': 'most_frequent'}. Best is trial 2 with value: 3.504923261731958.
[I 2024-02-28 19:45:17,725] Trial 121 finished with value: 3.504923261731958 and parameters: {'model_name': 'SimpleImputer', 'strategy': 'mean'}. Best is trial 2 with value: 3.504923261731958.
[I 2024-02-28 19:45:18,026] Trial 89 finished with value: 3.561945701033614 and parameters: {'model_name': 'SimpleImputer', 'strategy': 'most_frequent'}. Best is trial 2 with value: 3.504923261731958.
[I 2024-02-28 19:45:18,256] Trial 118 finished with value: 3.504923261731958 and parameters: {'model_name': 'SimpleImputer', 'strategy': 'mean'}. Best is trial 2 with value: 3.504923261731958.
[I 2024-02-28 19:45:18,534] Trial 122 finished with value: 3.504923261731958 and parameters: {'model_name': 'SimpleImputer', 'strategy': 'mean'}. Best is trial 2 with value: 3.504923261731958.
[I 2024-02-28 19:45:18,776] Trial 128 finished with value: 3.504923261731958 and parameters: {'model_name': 'SimpleImputer', 'strategy': 'mean'}. Best is trial 2 with value: 3.504923261731958.
[I 2024-02-28 19:45:19,098] Trial 123 finished with value: 3.504923261731958 and parameters: {'model_name': 'SimpleImputer', 'strategy': 'mean'}. Best is trial 2 with value: 3.504923261731958.
[I 2024-02-28 19:45:19,367] Trial 91 finished with value: 3.561945701033614 and parameters: {'model_name': 'SimpleImputer', 'strategy': 'most_frequent'}. Best is trial 2 with value: 3.504923261731958.
[I 2024-02-28 19:45:19,587] Trial 130 finished with value: 3.504923261731958 and parameters: {'model_name': 'SimpleImputer', 'strategy': 'mean'}. Best is trial 2 with value: 3.504923261731958.
[I 2024-02-28 19:45:19,821] Trial 129 finished with value: 3.504923261731958 and parameters: {'model_name': 'SimpleImputer', 'strategy': 'mean'}. Best is trial 2 with value: 3.504923261731958.
[I 2024-02-28 19:45:20,062] Trial 120 finished with value: 3.504923261731958 and parameters: {'model_name': 'SimpleImputer', 'strategy': 'mean'}. Best is trial 2 with value: 3.504923261731958.
[I 2024-02-28 19:45:20,335] Trial 133 finished with value: 3.504923261731958 and parameters: {'model_name': 'SimpleImputer', 'strategy': 'mean'}. Best is trial 2 with value: 3.504923261731958.
[I 2024-02-28 19:45:20,586] Trial 136 finished with value: 3.504923261731958 and parameters: {'model_name': 'SimpleImputer', 'strategy': 'mean'}. Best is trial 2 with value: 3.504923261731958.
[I 2024-02-28 19:45:20,837] Trial 139 finished with value: 3.504923261731958 and parameters: {'model_name': 'SimpleImputer', 'strategy': 'mean'}. Best is trial 2 with value: 3.504923261731958.
[I 2024-02-28 19:45:21,031] Trial 125 finished with value: 3.504923261731958 and parameters: {'model_name': 'SimpleImputer', 'strategy': 'mean'}. Best is trial 2 with value: 3.504923261731958.
[I 2024-02-28 19:45:21,255] Trial 141 finished with value: 3.504923261731958 and parameters: {'model_name': 'SimpleImputer', 'strategy': 'mean'}. Best is trial 2 with value: 3.504923261731958.
[I 2024-02-28 19:45:21,443] Trial 143 finished with value: 3.504923261731958 and parameters: {'model_name': 'SimpleImputer', 'strategy': 'mean'}. Best is trial 2 with value: 3.504923261731958.
[I 2024-02-28 19:45:21,636] Trial 132 finished with value: 3.504923261731958 and parameters: {'model_name': 'SimpleImputer', 'strategy': 'mean'}. Best is trial 2 with value: 3.504923261731958.
[I 2024-02-28 19:45:21,921] Trial 131 finished with value: 3.504923261731958 and parameters: {'model_name': 'SimpleImputer', 'strategy': 'mean'}. Best is trial 2 with value: 3.504923261731958.
[I 2024-02-28 19:45:22,147] Trial 124 finished with value: 3.504923261731958 and parameters: {'model_name': 'SimpleImputer', 'strategy': 'mean'}. Best is trial 2 with value: 3.504923261731958.
[I 2024-02-28 19:45:22,477] Trial 126 finished with value: 3.504923261731958 and parameters: {'model_name': 'SimpleImputer', 'strategy': 'mean'}. Best is trial 2 with value: 3.504923261731958.
[I 2024-02-28 19:45:22,706] Trial 137 finished with value: 3.504923261731958 and parameters: {'model_name': 'SimpleImputer', 'strategy': 'mean'}. Best is trial 2 with value: 3.504923261731958.
[I 2024-02-28 19:45:22,982] Trial 144 finished with value: 3.504923261731958 and parameters: {'model_name': 'SimpleImputer', 'strategy': 'mean'}. Best is trial 2 with value: 3.504923261731958.
[I 2024-02-28 19:45:23,220] Trial 134 finished with value: 3.504923261731958 and parameters: {'model_name': 'SimpleImputer', 'strategy': 'mean'}. Best is trial 2 with value: 3.504923261731958.
[I 2024-02-28 19:45:23,471] Trial 135 finished with value: 3.504923261731958 and parameters: {'model_name': 'SimpleImputer', 'strategy': 'mean'}. Best is trial 2 with value: 3.504923261731958.
[I 2024-02-28 19:45:23,719] Trial 142 finished with value: 3.504923261731958 and parameters: {'model_name': 'SimpleImputer', 'strategy': 'mean'}. Best is trial 2 with value: 3.504923261731958.
[I 2024-02-28 19:45:23,926] Trial 147 finished with value: 3.504923261731958 and parameters: {'model_name': 'SimpleImputer', 'strategy': 'mean'}. Best is trial 2 with value: 3.504923261731958.
[I 2024-02-28 19:45:24,248] Trial 162 finished with value: 3.504923261731958 and parameters: {'model_name': 'SimpleImputer', 'strategy': 'mean'}. Best is trial 2 with value: 3.504923261731958.
[I 2024-02-28 19:45:24,615] Trial 149 finished with value: 3.504923261731958 and parameters: {'model_name': 'SimpleImputer', 'strategy': 'mean'}. Best is trial 2 with value: 3.504923261731958.
[I 2024-02-28 19:45:24,815] Trial 156 finished with value: 3.504923261731958 and parameters: {'model_name': 'SimpleImputer', 'strategy': 'mean'}. Best is trial 2 with value: 3.504923261731958.
[I 2024-02-28 19:45:25,020] Trial 145 finished with value: 3.504923261731958 and parameters: {'model_name': 'SimpleImputer', 'strategy': 'mean'}. Best is trial 2 with value: 3.504923261731958.
[I 2024-02-28 19:45:25,251] Trial 148 finished with value: 3.504923261731958 and parameters: {'model_name': 'SimpleImputer', 'strategy': 'mean'}. Best is trial 2 with value: 3.504923261731958.
[I 2024-02-28 19:45:25,495] Trial 151 finished with value: 3.504923261731958 and parameters: {'model_name': 'SimpleImputer', 'strategy': 'mean'}. Best is trial 2 with value: 3.504923261731958.
[I 2024-02-28 19:45:25,710] Trial 159 finished with value: 3.504923261731958 and parameters: {'model_name': 'SimpleImputer', 'strategy': 'mean'}. Best is trial 2 with value: 3.504923261731958.
[I 2024-02-28 19:45:25,904] Trial 150 finished with value: 3.504923261731958 and parameters: {'model_name': 'SimpleImputer', 'strategy': 'mean'}. Best is trial 2 with value: 3.504923261731958.
[I 2024-02-28 19:45:26,153] Trial 140 finished with value: 3.504923261731958 and parameters: {'model_name': 'SimpleImputer', 'strategy': 'mean'}. Best is trial 2 with value: 3.504923261731958.
[I 2024-02-28 19:45:26,371] Trial 160 finished with value: 3.504923261731958 and parameters: {'model_name': 'SimpleImputer', 'strategy': 'mean'}. Best is trial 2 with value: 3.504923261731958.
[I 2024-02-28 19:45:26,647] Trial 152 finished with value: 3.504923261731958 and parameters: {'model_name': 'SimpleImputer', 'strategy': 'mean'}. Best is trial 2 with value: 3.504923261731958.
[I 2024-02-28 19:45:26,901] Trial 158 finished with value: 3.504923261731958 and parameters: {'model_name': 'SimpleImputer', 'strategy': 'mean'}. Best is trial 2 with value: 3.504923261731958.
[I 2024-02-28 19:45:27,124] Trial 155 finished with value: 3.504923261731958 and parameters: {'model_name': 'SimpleImputer', 'strategy': 'mean'}. Best is trial 2 with value: 3.504923261731958.
[I 2024-02-28 19:45:27,377] Trial 138 finished with value: 3.504923261731958 and parameters: {'model_name': 'SimpleImputer', 'strategy': 'mean'}. Best is trial 2 with value: 3.504923261731958.
[I 2024-02-28 19:45:27,689] Trial 154 finished with value: 3.504923261731958 and parameters: {'model_name': 'SimpleImputer', 'strategy': 'mean'}. Best is trial 2 with value: 3.504923261731958.
[I 2024-02-28 19:45:27,922] Trial 161 finished with value: 3.504923261731958 and parameters: {'model_name': 'SimpleImputer', 'strategy': 'mean'}. Best is trial 2 with value: 3.504923261731958.
[I 2024-02-28 19:45:28,115] Trial 157 finished with value: 3.504923261731958 and parameters: {'model_name': 'SimpleImputer', 'strategy': 'mean'}. Best is trial 2 with value: 3.504923261731958.
[I 2024-02-28 19:45:28,627] Trial 166 finished with value: 3.504923261731958 and parameters: {'model_name': 'SimpleImputer', 'strategy': 'mean'}. Best is trial 2 with value: 3.504923261731958.
[I 2024-02-28 19:45:28,894] Trial 163 finished with value: 3.504923261731958 and parameters: {'model_name': 'SimpleImputer', 'strategy': 'mean'}. Best is trial 2 with value: 3.504923261731958.
[I 2024-02-28 19:45:29,121] Trial 153 finished with value: 3.504923261731958 and parameters: {'model_name': 'SimpleImputer', 'strategy': 'mean'}. Best is trial 2 with value: 3.504923261731958.
[I 2024-02-28 19:45:29,330] Trial 146 finished with value: 3.504923261731958 and parameters: {'model_name': 'SimpleImputer', 'strategy': 'mean'}. Best is trial 2 with value: 3.504923261731958.
[I 2024-02-28 19:45:29,557] Trial 184 finished with value: 3.561945701033614 and parameters: {'model_name': 'SimpleImputer', 'strategy': 'constant'}. Best is trial 2 with value: 3.504923261731958.
[I 2024-02-28 19:45:29,780] Trial 127 finished with value: 3.504923261731958 and parameters: {'model_name': 'SimpleImputer', 'strategy': 'mean'}. Best is trial 2 with value: 3.504923261731958.
[I 2024-02-28 19:45:30,052] Trial 168 finished with value: 3.504923261731958 and parameters: {'model_name': 'SimpleImputer', 'strategy': 'mean'}. Best is trial 2 with value: 3.504923261731958.
[I 2024-02-28 19:45:30,290] Trial 169 finished with value: 3.504923261731958 and parameters: {'model_name': 'SimpleImputer', 'strategy': 'mean'}. Best is trial 2 with value: 3.504923261731958.
[I 2024-02-28 19:45:30,529] Trial 173 finished with value: 3.561945701033614 and parameters: {'model_name': 'SimpleImputer', 'strategy': 'constant'}. Best is trial 2 with value: 3.504923261731958.
[I 2024-02-28 19:45:30,771] Trial 179 finished with value: 3.561945701033614 and parameters: {'model_name': 'SimpleImputer', 'strategy': 'constant'}. Best is trial 2 with value: 3.504923261731958.
[I 2024-02-28 19:45:31,041] Trial 178 finished with value: 3.561945701033614 and parameters: {'model_name': 'SimpleImputer', 'strategy': 'constant'}. Best is trial 2 with value: 3.504923261731958.
[I 2024-02-28 19:45:31,230] Trial 183 finished with value: 3.561945701033614 and parameters: {'model_name': 'SimpleImputer', 'strategy': 'constant'}. Best is trial 2 with value: 3.504923261731958.
[I 2024-02-28 19:45:31,462] Trial 170 finished with value: 3.504923261731958 and parameters: {'model_name': 'SimpleImputer', 'strategy': 'mean'}. Best is trial 2 with value: 3.504923261731958.
[I 2024-02-28 19:45:31,788] Trial 174 finished with value: 3.504923261731958 and parameters: {'model_name': 'SimpleImputer', 'strategy': 'mean'}. Best is trial 2 with value: 3.504923261731958.
[I 2024-02-28 19:45:31,998] Trial 172 finished with value: 3.561945701033614 and parameters: {'model_name': 'SimpleImputer', 'strategy': 'constant'}. Best is trial 2 with value: 3.504923261731958.
[I 2024-02-28 19:45:32,179] Trial 180 finished with value: 3.561945701033614 and parameters: {'model_name': 'SimpleImputer', 'strategy': 'constant'}. Best is trial 2 with value: 3.504923261731958.
[I 2024-02-28 19:45:32,418] Trial 175 finished with value: 3.561945701033614 and parameters: {'model_name': 'SimpleImputer', 'strategy': 'constant'}. Best is trial 2 with value: 3.504923261731958.
[I 2024-02-28 19:45:32,610] Trial 176 finished with value: 3.561945701033614 and parameters: {'model_name': 'SimpleImputer', 'strategy': 'constant'}. Best is trial 2 with value: 3.504923261731958.
[I 2024-02-28 19:45:32,797] Trial 177 finished with value: 3.561945701033614 and parameters: {'model_name': 'SimpleImputer', 'strategy': 'constant'}. Best is trial 2 with value: 3.504923261731958.
[I 2024-02-28 19:45:33,037] Trial 167 finished with value: 3.504923261731958 and parameters: {'model_name': 'SimpleImputer', 'strategy': 'mean'}. Best is trial 2 with value: 3.504923261731958.
[I 2024-02-28 19:45:33,313] Trial 182 finished with value: 3.561945701033614 and parameters: {'model_name': 'SimpleImputer', 'strategy': 'constant'}. Best is trial 2 with value: 3.504923261731958.
[I 2024-02-28 19:45:33,521] Trial 190 finished with value: 3.561945701033614 and parameters: {'model_name': 'SimpleImputer', 'strategy': 'constant'}. Best is trial 2 with value: 3.504923261731958.
[I 2024-02-28 19:45:33,701] Trial 186 finished with value: 3.561945701033614 and parameters: {'model_name': 'SimpleImputer', 'strategy': 'constant'}. Best is trial 2 with value: 3.504923261731958.
[I 2024-02-28 19:45:33,895] Trial 188 finished with value: 3.504923261731958 and parameters: {'model_name': 'SimpleImputer', 'strategy': 'mean'}. Best is trial 2 with value: 3.504923261731958.
[I 2024-02-28 19:45:34,106] Trial 165 finished with value: 3.504923261731958 and parameters: {'model_name': 'SimpleImputer', 'strategy': 'mean'}. Best is trial 2 with value: 3.504923261731958.
[I 2024-02-28 19:45:34,369] Trial 185 finished with value: 3.561945701033614 and parameters: {'model_name': 'SimpleImputer', 'strategy': 'constant'}. Best is trial 2 with value: 3.504923261731958.
[I 2024-02-28 19:45:34,560] Trial 171 finished with value: 3.504923261731958 and parameters: {'model_name': 'SimpleImputer', 'strategy': 'mean'}. Best is trial 2 with value: 3.504923261731958.
[I 2024-02-28 19:45:34,764] Trial 164 finished with value: 3.504923261731958 and parameters: {'model_name': 'SimpleImputer', 'strategy': 'mean'}. Best is trial 2 with value: 3.504923261731958.
[I 2024-02-28 19:45:34,993] Trial 195 finished with value: 3.561945701033614 and parameters: {'model_name': 'SimpleImputer', 'strategy': 'constant'}. Best is trial 2 with value: 3.504923261731958.
[I 2024-02-28 19:45:35,213] Trial 193 finished with value: 3.561945701033614 and parameters: {'model_name': 'SimpleImputer', 'strategy': 'constant'}. Best is trial 2 with value: 3.504923261731958.
[I 2024-02-28 19:45:35,413] Trial 181 finished with value: 3.561945701033614 and parameters: {'model_name': 'SimpleImputer', 'strategy': 'constant'}. Best is trial 2 with value: 3.504923261731958.
[I 2024-02-28 19:45:35,656] Trial 197 finished with value: 3.561945701033614 and parameters: {'model_name': 'SimpleImputer', 'strategy': 'constant'}. Best is trial 2 with value: 3.504923261731958.
[I 2024-02-28 19:45:35,897] Trial 189 finished with value: 3.504923261731958 and parameters: {'model_name': 'SimpleImputer', 'strategy': 'mean'}. Best is trial 2 with value: 3.504923261731958.
[I 2024-02-28 19:45:36,092] Trial 198 finished with value: 3.561945701033614 and parameters: {'model_name': 'SimpleImputer', 'strategy': 'constant'}. Best is trial 2 with value: 3.504923261731958.
[I 2024-02-28 19:45:36,279] Trial 196 finished with value: 3.561945701033614 and parameters: {'model_name': 'SimpleImputer', 'strategy': 'constant'}. Best is trial 2 with value: 3.504923261731958.
[I 2024-02-28 19:45:36,462] Trial 187 finished with value: 3.561945701033614 and parameters: {'model_name': 'SimpleImputer', 'strategy': 'constant'}. Best is trial 2 with value: 3.504923261731958.
[I 2024-02-28 19:45:36,689] Trial 192 finished with value: 3.561945701033614 and parameters: {'model_name': 'SimpleImputer', 'strategy': 'constant'}. Best is trial 2 with value: 3.504923261731958.
[I 2024-02-28 19:45:36,901] Trial 194 finished with value: 3.561945701033614 and parameters: {'model_name': 'SimpleImputer', 'strategy': 'constant'}. Best is trial 2 with value: 3.504923261731958.
[I 2024-02-28 19:45:37,129] Trial 191 finished with value: 3.504923261731958 and parameters: {'model_name': 'SimpleImputer', 'strategy': 'mean'}. Best is trial 2 with value: 3.504923261731958.
