[I 2024-01-04 05:42:13,684] Trial 66 finished with value: 4202814.190911388 and parameters: {'model_name': 'IterativeImputer', 'sample_posterior': True, 'initial_strategy': 'most_frequent', 'imputation_order': 'ascending'}. Best is trial 82 with value: 2886281.1610404705.
[I 2024-01-04 05:42:19,539] Trial 68 finished with value: 4254435.440754304 and parameters: {'model_name': 'IterativeImputer', 'sample_posterior': True, 'initial_strategy': 'most_frequent', 'imputation_order': 'arabic'}. Best is trial 82 with value: 2886281.1610404705.
[I 2024-01-04 05:42:27,388] Trial 61 finished with value: 2855477.6919910638 and parameters: {'model_name': 'RandomForestImputer', 'max_iter': 9, 'decreasing': False, 'min_samples_split': 0.5, 'min_samples_leaf': 0.30000000000000004, 'max_features': 0.7000000000000001, 'warm_start': False}. Best is trial 61 with value: 2855477.6919910638.
[I 2024-01-04 05:42:53,499] Trial 77 finished with value: 4284084.936445593 and parameters: {'model_name': 'IterativeImputer', 'sample_posterior': True, 'initial_strategy': 'constant', 'imputation_order': 'roman'}. Best is trial 61 with value: 2855477.6919910638.
[I 2024-01-04 05:42:55,191] Trial 32 finished with value: 3523890.491594772 and parameters: {'model_name': 'GAIN', 'batch_size': 1, 'hint_rate': 0.8200000000000001, 'alpha': 18, 'iterations': 232}. Best is trial 61 with value: 2855477.6919910638.
[I 2024-01-04 05:43:05,387] Trial 76 finished with value: 4209058.266894003 and parameters: {'model_name': 'IterativeImputer', 'sample_posterior': True, 'initial_strategy': 'most_frequent', 'imputation_order': 'descending'}. Best is trial 61 with value: 2855477.6919910638.
[I 2024-01-04 05:43:14,876] Trial 79 finished with value: 4247686.21189079 and parameters: {'model_name': 'IterativeImputer', 'sample_posterior': True, 'initial_strategy': 'mean', 'imputation_order': 'descending'}. Best is trial 61 with value: 2855477.6919910638.
[I 2024-01-04 05:43:19,133] Trial 75 finished with value: 4245146.496878082 and parameters: {'model_name': 'IterativeImputer', 'sample_posterior': True, 'initial_strategy': 'most_frequent', 'imputation_order': 'random'}. Best is trial 61 with value: 2855477.6919910638.
[I 2024-01-04 05:43:22,649] Trial 80 finished with value: 4263873.90197357 and parameters: {'model_name': 'IterativeImputer', 'sample_posterior': True, 'initial_strategy': 'constant', 'imputation_order': 'ascending'}. Best is trial 61 with value: 2855477.6919910638.
[I 2024-01-04 05:44:10,885] Trial 9 finished with value: 3384798.1228008247 and parameters: {'model_name': 'GAIN', 'batch_size': 2, 'hint_rate': 0.32, 'alpha': 84, 'iterations': 250}. Best is trial 61 with value: 2855477.6919910638.
[I 2024-01-04 05:44:16,979] Trial 133 finished with value: 2886281.6426797123 and parameters: {'model_name': 'IterativeImputer', 'sample_posterior': False, 'initial_strategy': 'median', 'imputation_order': 'roman'}. Best is trial 61 with value: 2855477.6919910638.
[I 2024-01-04 05:44:24,081] Trial 134 finished with value: 2886281.6426797123 and parameters: {'model_name': 'IterativeImputer', 'sample_posterior': False, 'initial_strategy': 'median', 'imputation_order': 'roman'}. Best is trial 61 with value: 2855477.6919910638.
[I 2024-01-04 05:44:28,772] Trial 131 finished with value: 2886281.702495599 and parameters: {'model_name': 'IterativeImputer', 'sample_posterior': False, 'initial_strategy': 'median', 'imputation_order': 'random'}. Best is trial 61 with value: 2855477.6919910638.
[I 2024-01-04 05:44:31,071] Trial 132 finished with value: 2886281.809402517 and parameters: {'model_name': 'IterativeImputer', 'sample_posterior': False, 'initial_strategy': 'median', 'imputation_order': 'random'}. Best is trial 61 with value: 2855477.6919910638.
[I 2024-01-04 05:44:35,706] Trial 135 finished with value: 2886281.6426797123 and parameters: {'model_name': 'IterativeImputer', 'sample_posterior': False, 'initial_strategy': 'median', 'imputation_order': 'roman'}. Best is trial 61 with value: 2855477.6919910638.
[I 2024-01-04 05:45:29,714] Trial 138 finished with value: 2886281.8216385553 and parameters: {'model_name': 'IterativeImputer', 'sample_posterior': False, 'initial_strategy': 'median', 'imputation_order': 'random'}. Best is trial 61 with value: 2855477.6919910638.
[I 2024-01-04 05:45:52,321] Trial 101 finished with value: 4201334.435916146 and parameters: {'model_name': 'IterativeImputer', 'sample_posterior': True, 'initial_strategy': 'mean', 'imputation_order': 'descending'}. Best is trial 61 with value: 2855477.6919910638.
[I 2024-01-04 05:46:13,494] Trial 104 finished with value: 4229700.371093649 and parameters: {'model_name': 'IterativeImputer', 'sample_posterior': True, 'initial_strategy': 'median', 'imputation_order': 'descending'}. Best is trial 61 with value: 2855477.6919910638.
[I 2024-01-04 05:46:18,167] Trial 143 finished with value: 2886281.6426797123 and parameters: {'model_name': 'IterativeImputer', 'sample_posterior': False, 'initial_strategy': 'median', 'imputation_order': 'roman'}. Best is trial 61 with value: 2855477.6919910638.
[I 2024-01-04 05:46:19,367] Trial 103 finished with value: 4213287.012044697 and parameters: {'model_name': 'IterativeImputer', 'sample_posterior': True, 'initial_strategy': 'median', 'imputation_order': 'descending'}. Best is trial 61 with value: 2855477.6919910638.
[I 2024-01-04 05:46:41,517] Trial 105 finished with value: 4318007.141227082 and parameters: {'model_name': 'IterativeImputer', 'sample_posterior': True, 'initial_strategy': 'median', 'imputation_order': 'random'}. Best is trial 61 with value: 2855477.6919910638.
[I 2024-01-04 05:46:46,075] Trial 108 finished with value: 4259708.666084616 and parameters: {'model_name': 'IterativeImputer', 'sample_posterior': True, 'initial_strategy': 'mean', 'imputation_order': 'descending'}. Best is trial 61 with value: 2855477.6919910638.
[I 2024-01-04 05:46:53,525] Trial 110 finished with value: 4250383.148030185 and parameters: {'model_name': 'IterativeImputer', 'sample_posterior': True, 'initial_strategy': 'median', 'imputation_order': 'descending'}. Best is trial 61 with value: 2855477.6919910638.
[I 2024-01-04 05:46:57,265] Trial 109 finished with value: 4204985.456763215 and parameters: {'model_name': 'IterativeImputer', 'sample_posterior': True, 'initial_strategy': 'median', 'imputation_order': 'descending'}. Best is trial 61 with value: 2855477.6919910638.
[I 2024-01-04 05:47:01,343] Trial 107 finished with value: 4227986.776702973 and parameters: {'model_name': 'IterativeImputer', 'sample_posterior': True, 'initial_strategy': 'median', 'imputation_order': 'random'}. Best is trial 61 with value: 2855477.6919910638.
[I 2024-01-04 05:47:06,312] Trial 112 finished with value: 4209018.428105244 and parameters: {'model_name': 'IterativeImputer', 'sample_posterior': True, 'initial_strategy': 'median', 'imputation_order': 'random'}. Best is trial 61 with value: 2855477.6919910638.
[I 2024-01-04 05:47:07,915] Trial 106 finished with value: 4191656.034849266 and parameters: {'model_name': 'IterativeImputer', 'sample_posterior': True, 'initial_strategy': 'median', 'imputation_order': 'random'}. Best is trial 61 with value: 2855477.6919910638.
[I 2024-01-04 05:47:13,837] Trial 116 finished with value: 4222353.824862631 and parameters: {'model_name': 'IterativeImputer', 'sample_posterior': True, 'initial_strategy': 'median', 'imputation_order': 'random'}. Best is trial 61 with value: 2855477.6919910638.
[I 2024-01-04 05:47:15,051] Trial 113 finished with value: 4231795.024521838 and parameters: {'model_name': 'IterativeImputer', 'sample_posterior': True, 'initial_strategy': 'median', 'imputation_order': 'random'}. Best is trial 61 with value: 2855477.6919910638.
[I 2024-01-04 05:47:19,779] Trial 115 finished with value: 4281366.787818119 and parameters: {'model_name': 'IterativeImputer', 'sample_posterior': True, 'initial_strategy': 'median', 'imputation_order': 'random'}. Best is trial 61 with value: 2855477.6919910638.
[I 2024-01-04 05:47:24,647] Trial 114 finished with value: 4297633.214604416 and parameters: {'model_name': 'IterativeImputer', 'sample_posterior': True, 'initial_strategy': 'median', 'imputation_order': 'random'}. Best is trial 61 with value: 2855477.6919910638.
[I 2024-01-04 05:47:26,562] Trial 117 finished with value: 4299040.155121289 and parameters: {'model_name': 'IterativeImputer', 'sample_posterior': True, 'initial_strategy': 'median', 'imputation_order': 'random'}. Best is trial 61 with value: 2855477.6919910638.
[I 2024-01-04 05:47:45,306] Trial 118 finished with value: 4349916.953422266 and parameters: {'model_name': 'IterativeImputer', 'sample_posterior': True, 'initial_strategy': 'median', 'imputation_order': 'random'}. Best is trial 61 with value: 2855477.6919910638.
[I 2024-01-04 05:47:57,216] Trial 158 finished with value: 3238678.2928885138 and parameters: {'model_name': 'KNNImputer', 'weights': 'distance', 'keep_empty_features': False}. Best is trial 61 with value: 2855477.6919910638.
[I 2024-01-04 05:48:09,654] Trial 120 finished with value: 4322107.008630053 and parameters: {'model_name': 'IterativeImputer', 'sample_posterior': True, 'initial_strategy': 'median', 'imputation_order': 'random'}. Best is trial 61 with value: 2855477.6919910638.
[I 2024-01-04 05:48:25,003] Trial 121 finished with value: 4262956.571708305 and parameters: {'model_name': 'IterativeImputer', 'sample_posterior': True, 'initial_strategy': 'median', 'imputation_order': 'random'}. Best is trial 61 with value: 2855477.6919910638.
[I 2024-01-04 05:48:26,646] Trial 119 finished with value: 4201889.1266673235 and parameters: {'model_name': 'IterativeImputer', 'sample_posterior': True, 'initial_strategy': 'median', 'imputation_order': 'random'}. Best is trial 61 with value: 2855477.6919910638.
[I 2024-01-04 05:48:30,287] Trial 122 finished with value: 4292754.400737275 and parameters: {'model_name': 'IterativeImputer', 'sample_posterior': True, 'initial_strategy': 'median', 'imputation_order': 'random'}. Best is trial 61 with value: 2855477.6919910638.
[I 2024-01-04 05:48:35,209] Trial 15 finished with value: 3331553.506402966 and parameters: {'model_name': 'GAIN', 'batch_size': 1, 'hint_rate': 0.8400000000000001, 'alpha': 14, 'iterations': 334}. Best is trial 61 with value: 2855477.6919910638.
[I 2024-01-04 05:48:48,124] Trial 123 finished with value: 4251980.294360138 and parameters: {'model_name': 'IterativeImputer', 'sample_posterior': True, 'initial_strategy': 'median', 'imputation_order': 'random'}. Best is trial 61 with value: 2855477.6919910638.
[I 2024-01-04 05:48:59,010] Trial 124 finished with value: 4315975.149055861 and parameters: {'model_name': 'IterativeImputer', 'sample_posterior': True, 'initial_strategy': 'median', 'imputation_order': 'random'}. Best is trial 61 with value: 2855477.6919910638.
[I 2024-01-04 05:50:09,545] Trial 125 finished with value: 4142918.3332364433 and parameters: {'model_name': 'IterativeImputer', 'sample_posterior': True, 'initial_strategy': 'median', 'imputation_order': 'random'}. Best is trial 61 with value: 2855477.6919910638.
[I 2024-01-04 05:51:00,748] Trial 126 finished with value: 4331279.799179777 and parameters: {'model_name': 'IterativeImputer', 'sample_posterior': True, 'initial_strategy': 'median', 'imputation_order': 'random'}. Best is trial 61 with value: 2855477.6919910638.
[I 2024-01-04 05:51:35,273] Trial 128 finished with value: 4212362.681751246 and parameters: {'model_name': 'IterativeImputer', 'sample_posterior': True, 'initial_strategy': 'median', 'imputation_order': 'random'}. Best is trial 61 with value: 2855477.6919910638.
[I 2024-01-04 05:51:40,119] Trial 127 finished with value: 4208945.188791075 and parameters: {'model_name': 'IterativeImputer', 'sample_posterior': True, 'initial_strategy': 'median', 'imputation_order': 'random'}. Best is trial 61 with value: 2855477.6919910638.
[I 2024-01-04 05:51:43,713] Trial 129 finished with value: 4185661.0589398528 and parameters: {'model_name': 'IterativeImputer', 'sample_posterior': True, 'initial_strategy': 'median', 'imputation_order': 'random'}. Best is trial 61 with value: 2855477.6919910638.
[I 2024-01-04 05:51:45,404] Trial 130 finished with value: 4344765.1728411475 and parameters: {'model_name': 'IterativeImputer', 'sample_posterior': True, 'initial_strategy': 'median', 'imputation_order': 'random'}. Best is trial 61 with value: 2855477.6919910638.
[I 2024-01-04 05:55:52,138] Trial 56 finished with value: 2975981.3972277287 and parameters: {'model_name': 'RandomForestImputer', 'max_iter': 58, 'decreasing': False, 'min_samples_split': 0.2, 'min_samples_leaf': 0.4, 'max_features': 0.30000000000000004, 'warm_start': False}. Best is trial 61 with value: 2855477.6919910638.
[I 2024-01-04 06:01:26,480] Trial 26 finished with value: 3200545.059038273 and parameters: {'model_name': 'GAIN', 'batch_size': 1, 'hint_rate': 0.8400000000000001, 'alpha': 29, 'iterations': 763}. Best is trial 61 with value: 2855477.6919910638.
[I 2024-01-04 06:07:43,626] Trial 63 finished with value: 2974632.9236593302 and parameters: {'model_name': 'RandomForestImputer', 'max_iter': 61, 'decreasing': True, 'min_samples_split': 0.7000000000000001, 'min_samples_leaf': 0.7000000000000001, 'max_features': 0.6, 'warm_start': False}. Best is trial 61 with value: 2855477.6919910638.
[I 2024-01-04 06:08:36,852] Trial 164 finished with value: 2975459.475705433 and parameters: {'model_name': 'RandomForestImputer', 'max_iter': 40, 'decreasing': False, 'min_samples_split': 0.2, 'min_samples_leaf': 0.7000000000000001, 'max_features': 0.4, 'warm_start': False}. Best is trial 61 with value: 2855477.6919910638.
[I 2024-01-04 06:10:56,168] Trial 145 finished with value: 2974655.911088756 and parameters: {'model_name': 'RandomForestImputer', 'max_iter': 55, 'decreasing': False, 'min_samples_split': 0.1, 'min_samples_leaf': 0.8, 'max_features': 0.5, 'warm_start': False}. Best is trial 61 with value: 2855477.6919910638.
[I 2024-01-04 06:14:02,359] Trial 167 finished with value: 2975515.409093618 and parameters: {'model_name': 'RandomForestImputer', 'max_iter': 45, 'decreasing': False, 'min_samples_split': 0.2, 'min_samples_leaf': 0.7000000000000001, 'max_features': 0.4, 'warm_start': False}. Best is trial 61 with value: 2855477.6919910638.
[I 2024-01-04 06:14:30,762] Trial 186 finished with value: 3238678.2928885138 and parameters: {'model_name': 'KNNImputer', 'weights': 'distance', 'keep_empty_features': False}. Best is trial 61 with value: 2855477.6919910638.
[I 2024-01-04 06:14:32,891] Trial 187 finished with value: 6050886.082787235 and parameters: {'model_name': 'SimpleImputer', 'strategy': 'most_frequent'}. Best is trial 61 with value: 2855477.6919910638.
[I 2024-01-04 06:16:12,909] Trial 173 finished with value: 2974714.3106411183 and parameters: {'model_name': 'RandomForestImputer', 'max_iter': 45, 'decreasing': False, 'min_samples_split': 0.2, 'min_samples_leaf': 0.7000000000000001, 'max_features': 0.4, 'warm_start': False}. Best is trial 61 with value: 2855477.6919910638.
[I 2024-01-04 06:16:57,805] Trial 188 finished with value: 2886281.534197254 and parameters: {'model_name': 'IterativeImputer', 'sample_posterior': False, 'initial_strategy': 'mean', 'imputation_order': 'roman'}. Best is trial 61 with value: 2855477.6919910638.
[I 2024-01-04 06:18:00,795] Trial 161 finished with value: 2975023.885970702 and parameters: {'model_name': 'RandomForestImputer', 'max_iter': 53, 'decreasing': False, 'min_samples_split': 0.2, 'min_samples_leaf': 0.8, 'max_features': 0.4, 'warm_start': False}. Best is trial 61 with value: 2855477.6919910638.
[I 2024-01-04 06:18:52,646] Trial 189 finished with value: 2886281.534197254 and parameters: {'model_name': 'IterativeImputer', 'sample_posterior': False, 'initial_strategy': 'mean', 'imputation_order': 'roman'}. Best is trial 61 with value: 2855477.6919910638.
[I 2024-01-04 06:18:57,821] Trial 140 finished with value: 2974587.928281203 and parameters: {'model_name': 'RandomForestImputer', 'max_iter': 63, 'decreasing': False, 'min_samples_split': 0.2, 'min_samples_leaf': 0.7000000000000001, 'max_features': 0.4, 'warm_start': False}. Best is trial 61 with value: 2855477.6919910638.
[I 2024-01-04 06:19:10,128] Trial 144 finished with value: 2974966.8009345722 and parameters: {'model_name': 'RandomForestImputer', 'max_iter': 76, 'decreasing': False, 'min_samples_split': 0.2, 'min_samples_leaf': 0.7000000000000001, 'max_features': 0.4, 'warm_start': False}. Best is trial 61 with value: 2855477.6919910638.
[I 2024-01-04 06:19:40,257] Trial 190 finished with value: 2886281.534197254 and parameters: {'model_name': 'IterativeImputer', 'sample_posterior': False, 'initial_strategy': 'mean', 'imputation_order': 'roman'}. Best is trial 61 with value: 2855477.6919910638.
[I 2024-01-04 06:20:31,087] Trial 151 finished with value: 2975000.1892612176 and parameters: {'model_name': 'RandomForestImputer', 'max_iter': 60, 'decreasing': False, 'min_samples_split': 0.2, 'min_samples_leaf': 0.7000000000000001, 'max_features': 0.4, 'warm_start': False}. Best is trial 61 with value: 2855477.6919910638.
[I 2024-01-04 06:20:51,570] Trial 191 finished with value: 2886281.534197254 and parameters: {'model_name': 'IterativeImputer', 'sample_posterior': False, 'initial_strategy': 'mean', 'imputation_order': 'roman'}. Best is trial 61 with value: 2855477.6919910638.
[I 2024-01-04 06:21:04,741] Trial 148 finished with value: 2975097.5129446913 and parameters: {'model_name': 'RandomForestImputer', 'max_iter': 80, 'decreasing': False, 'min_samples_split': 0.0, 'min_samples_leaf': 0.7000000000000001, 'max_features': 0.4, 'warm_start': False}. Best is trial 61 with value: 2855477.6919910638.
[I 2024-01-04 06:21:16,141] Trial 165 finished with value: 2974461.934194011 and parameters: {'model_name': 'RandomForestImputer', 'max_iter': 62, 'decreasing': False, 'min_samples_split': 0.2, 'min_samples_leaf': 0.7000000000000001, 'max_features': 0.4, 'warm_start': False}. Best is trial 61 with value: 2855477.6919910638.
[I 2024-01-04 06:21:47,867] Trial 192 finished with value: 2886281.534197254 and parameters: {'model_name': 'IterativeImputer', 'sample_posterior': False, 'initial_strategy': 'mean', 'imputation_order': 'roman'}. Best is trial 61 with value: 2855477.6919910638.
[I 2024-01-04 06:21:51,985] Trial 163 finished with value: 2974819.9920635563 and parameters: {'model_name': 'RandomForestImputer', 'max_iter': 61, 'decreasing': False, 'min_samples_split': 0.2, 'min_samples_leaf': 0.7000000000000001, 'max_features': 0.5, 'warm_start': False}. Best is trial 61 with value: 2855477.6919910638.
[I 2024-01-04 06:21:53,621] Trial 193 finished with value: 2886281.534197254 and parameters: {'model_name': 'IterativeImputer', 'sample_posterior': False, 'initial_strategy': 'mean', 'imputation_order': 'roman'}. Best is trial 61 with value: 2855477.6919910638.
[I 2024-01-04 06:22:05,447] Trial 194 finished with value: 2886281.534197254 and parameters: {'model_name': 'IterativeImputer', 'sample_posterior': False, 'initial_strategy': 'mean', 'imputation_order': 'roman'}. Best is trial 61 with value: 2855477.6919910638.
[I 2024-01-04 06:22:08,201] Trial 155 finished with value: 2974860.006059038 and parameters: {'model_name': 'RandomForestImputer', 'max_iter': 67, 'decreasing': False, 'min_samples_split': 0.2, 'min_samples_leaf': 0.7000000000000001, 'max_features': 0.4, 'warm_start': False}. Best is trial 61 with value: 2855477.6919910638.
[I 2024-01-04 06:22:11,261] Trial 142 finished with value: 2974370.9711887524 and parameters: {'model_name': 'RandomForestImputer', 'max_iter': 70, 'decreasing': False, 'min_samples_split': 0.2, 'min_samples_leaf': 0.7000000000000001, 'max_features': 0.4, 'warm_start': False}. Best is trial 61 with value: 2855477.6919910638.
[I 2024-01-04 06:22:14,728] Trial 146 finished with value: 2974687.5494452487 and parameters: {'model_name': 'RandomForestImputer', 'max_iter': 75, 'decreasing': False, 'min_samples_split': 0.2, 'min_samples_leaf': 0.8, 'max_features': 0.4, 'warm_start': False}. Best is trial 61 with value: 2855477.6919910638.
[I 2024-01-04 06:22:39,615] Trial 195 finished with value: 2886281.534197254 and parameters: {'model_name': 'IterativeImputer', 'sample_posterior': False, 'initial_strategy': 'mean', 'imputation_order': 'roman'}. Best is trial 61 with value: 2855477.6919910638.
[I 2024-01-04 06:22:41,561] Trial 176 finished with value: 2974409.4961226834 and parameters: {'model_name': 'RandomForestImputer', 'max_iter': 49, 'decreasing': False, 'min_samples_split': 0.2, 'min_samples_leaf': 0.7000000000000001, 'max_features': 0.4, 'warm_start': False}. Best is trial 61 with value: 2855477.6919910638.
[I 2024-01-04 06:22:50,784] Trial 170 finished with value: 2974306.970134389 and parameters: {'model_name': 'RandomForestImputer', 'max_iter': 58, 'decreasing': False, 'min_samples_split': 0.2, 'min_samples_leaf': 0.7000000000000001, 'max_features': 0.4, 'warm_start': False}. Best is trial 61 with value: 2855477.6919910638.
[I 2024-01-04 06:23:03,619] Trial 149 finished with value: 2975127.6698384257 and parameters: {'model_name': 'RandomForestImputer', 'max_iter': 74, 'decreasing': False, 'min_samples_split': 0.2, 'min_samples_leaf': 0.7000000000000001, 'max_features': 0.4, 'warm_start': False}. Best is trial 61 with value: 2855477.6919910638.
[I 2024-01-04 06:23:10,911] Trial 136 finished with value: 2975099.546166689 and parameters: {'model_name': 'RandomForestImputer', 'max_iter': 75, 'decreasing': False, 'min_samples_split': 0.2, 'min_samples_leaf': 0.7000000000000001, 'max_features': 0.4, 'warm_start': False}. Best is trial 61 with value: 2855477.6919910638.
[I 2024-01-04 06:23:28,363] Trial 196 finished with value: 2886281.534197254 and parameters: {'model_name': 'IterativeImputer', 'sample_posterior': False, 'initial_strategy': 'mean', 'imputation_order': 'roman'}. Best is trial 61 with value: 2855477.6919910638.
