Run: 2
/cm/local/apps/slurm/var/spool/job577022/slurm_script: line 23: /common/ketrong/minconda3/etc/profile.d/conda.sh: No such file or directory
/cm/local/apps/slurm/var/spool/job577022/slurm_script: line 26: $'\nconda create --name tpot2devenv -c conda-forge python=3.10\n': command not found
/cm/local/apps/slurm/var/spool/job577022/slurm_script: line 31: $'\npip install -r requirements.txt\n': command not found
RunStart
2024-01-04 01:49:56.515633: I tensorflow/core/util/port.cc:113] oneDNN custom operations are on. You may see slightly different numerical results due to floating-point round-off errors from different computation orders. To turn them off, set the environment variable `TF_ENABLE_ONEDNN_OPTS=0`.
2024-01-04 01:49:56.552714: E external/local_xla/xla/stream_executor/cuda/cuda_dnn.cc:9261] Unable to register cuDNN factory: Attempting to register factory for plugin cuDNN when one has already been registered
2024-01-04 01:49:56.552738: E external/local_xla/xla/stream_executor/cuda/cuda_fft.cc:607] Unable to register cuFFT factory: Attempting to register factory for plugin cuFFT when one has already been registered
2024-01-04 01:49:56.554100: E external/local_xla/xla/stream_executor/cuda/cuda_blas.cc:1515] Unable to register cuBLAS factory: Attempting to register factory for plugin cuBLAS when one has already been registered
2024-01-04 01:49:56.560214: I tensorflow/core/platform/cpu_feature_guard.cc:182] This TensorFlow binary is optimized to use available CPU instructions in performance-critical operations.
To enable the following instructions: AVX2 AVX512F AVX512_VNNI FMA, in other operations, rebuild TensorFlow with the appropriate compiler flags.
2024-01-04 01:49:58.217718: W tensorflow/compiler/tf2tensorrt/utils/py_utils.cc:38] TF-TRT Warning: Could not find TensorRT
WARNING:tensorflow:From /home/ketrong/miniconda3/envs/tpot2devenv/lib/python3.10/site-packages/tensorflow/python/compat/v2_compat.py:108: disable_resource_variables (from tensorflow.python.ops.variable_scope) is deprecated and will be removed in a future version.
Instructions for updating:
non-resource variables are not supported in the long term
starting loops
working on 
logs/7295/tpot2_base_normal_MCAR_0.1
1.159665584564209
loading data
logs/7295/tpot2_base_normal_MCAR_0.1/data/7295_True.pkl
running experiment 1/3 - Does large hyperparameter space improve reconstruction accuracy over simple
[I 2024-01-04 01:50:10,714] A new study created in memory with name: no-name-e501a3b5-e95c-4e15-a9c4-ddd9d99951dd
[I 2024-01-04 01:50:12,238] Trial 6 finished with value: 5947238.951130865 and parameters: {'model_name': 'SimpleImputer', 'strategy': 'constant'}. Best is trial 6 with value: 5947238.951130865.
[I 2024-01-04 01:50:12,991] Trial 22 finished with value: 5947238.951130865 and parameters: {'model_name': 'SimpleImputer', 'strategy': 'constant'}. Best is trial 6 with value: 5947238.951130865.
[I 2024-01-04 01:50:13,363] Trial 5 finished with value: 5947238.951130865 and parameters: {'model_name': 'SimpleImputer', 'strategy': 'constant'}. Best is trial 6 with value: 5947238.951130865.
[I 2024-01-04 01:50:13,633] Trial 7 finished with value: 2926408.6707950537 and parameters: {'model_name': 'SimpleImputer', 'strategy': 'mean'}. Best is trial 7 with value: 2926408.6707950537.
[I 2024-01-04 01:50:13,798] Trial 9 finished with value: 2926408.6707950537 and parameters: {'model_name': 'SimpleImputer', 'strategy': 'mean'}. Best is trial 7 with value: 2926408.6707950537.
[I 2024-01-04 01:50:14,041] Trial 8 finished with value: 2926408.6707950537 and parameters: {'model_name': 'SimpleImputer', 'strategy': 'mean'}. Best is trial 7 with value: 2926408.6707950537.
[I 2024-01-04 01:50:14,335] Trial 32 finished with value: 5947238.951130865 and parameters: {'model_name': 'SimpleImputer', 'strategy': 'constant'}. Best is trial 7 with value: 2926408.6707950537.
[I 2024-01-04 01:50:14,552] Trial 28 finished with value: 5947238.951130865 and parameters: {'model_name': 'SimpleImputer', 'strategy': 'constant'}. Best is trial 7 with value: 2926408.6707950537.
[I 2024-01-04 01:50:14,832] Trial 19 finished with value: 5947238.951130865 and parameters: {'model_name': 'SimpleImputer', 'strategy': 'constant'}. Best is trial 7 with value: 2926408.6707950537.
[I 2024-01-04 01:50:15,031] Trial 3 finished with value: 2926408.6707950537 and parameters: {'model_name': 'SimpleImputer', 'strategy': 'mean'}. Best is trial 7 with value: 2926408.6707950537.
[I 2024-01-04 01:50:15,286] Trial 4 finished with value: 2926408.6707950537 and parameters: {'model_name': 'SimpleImputer', 'strategy': 'mean'}. Best is trial 7 with value: 2926408.6707950537.
[I 2024-01-04 01:50:15,576] Trial 33 finished with value: 5947238.951130865 and parameters: {'model_name': 'SimpleImputer', 'strategy': 'constant'}. Best is trial 7 with value: 2926408.6707950537.
[I 2024-01-04 01:50:15,850] Trial 2 finished with value: 2926408.6707950537 and parameters: {'model_name': 'SimpleImputer', 'strategy': 'mean'}. Best is trial 7 with value: 2926408.6707950537.
[I 2024-01-04 01:50:16,117] Trial 16 finished with value: 2926408.6707950537 and parameters: {'model_name': 'SimpleImputer', 'strategy': 'mean'}. Best is trial 7 with value: 2926408.6707950537.
[I 2024-01-04 01:50:16,491] Trial 17 finished with value: 2926408.6707950537 and parameters: {'model_name': 'SimpleImputer', 'strategy': 'mean'}. Best is trial 7 with value: 2926408.6707950537.
[I 2024-01-04 01:50:16,780] Trial 23 finished with value: 2926408.6707950537 and parameters: {'model_name': 'SimpleImputer', 'strategy': 'mean'}. Best is trial 7 with value: 2926408.6707950537.
[I 2024-01-04 01:50:17,077] Trial 14 finished with value: 2926408.6707950537 and parameters: {'model_name': 'SimpleImputer', 'strategy': 'mean'}. Best is trial 7 with value: 2926408.6707950537.
[I 2024-01-04 01:50:17,274] Trial 45 finished with value: 5947238.951130865 and parameters: {'model_name': 'SimpleImputer', 'strategy': 'constant'}. Best is trial 7 with value: 2926408.6707950537.
[I 2024-01-04 01:50:17,707] Trial 44 finished with value: 2926408.6707950537 and parameters: {'model_name': 'SimpleImputer', 'strategy': 'mean'}. Best is trial 7 with value: 2926408.6707950537.
[I 2024-01-04 01:50:18,170] Trial 39 finished with value: 2926408.6707950537 and parameters: {'model_name': 'SimpleImputer', 'strategy': 'mean'}. Best is trial 7 with value: 2926408.6707950537.
[I 2024-01-04 01:50:18,713] Trial 43 finished with value: 2926408.6707950537 and parameters: {'model_name': 'SimpleImputer', 'strategy': 'mean'}. Best is trial 7 with value: 2926408.6707950537.
[I 2024-01-04 01:50:18,918] Trial 1 finished with value: 3319146.156972658 and parameters: {'model_name': 'SimpleImputer', 'strategy': 'median'}. Best is trial 7 with value: 2926408.6707950537.
[I 2024-01-04 01:50:19,207] Trial 13 finished with value: 3319146.156972658 and parameters: {'model_name': 'SimpleImputer', 'strategy': 'median'}. Best is trial 7 with value: 2926408.6707950537.
[I 2024-01-04 01:50:19,419] Trial 10 finished with value: 3319146.156972658 and parameters: {'model_name': 'SimpleImputer', 'strategy': 'median'}. Best is trial 7 with value: 2926408.6707950537.
[I 2024-01-04 01:50:19,615] Trial 38 finished with value: 2926408.6707950537 and parameters: {'model_name': 'SimpleImputer', 'strategy': 'mean'}. Best is trial 7 with value: 2926408.6707950537.
[I 2024-01-04 01:50:19,803] Trial 21 finished with value: 3319146.156972658 and parameters: {'model_name': 'SimpleImputer', 'strategy': 'median'}. Best is trial 7 with value: 2926408.6707950537.
[I 2024-01-04 01:50:20,114] Trial 18 finished with value: 3319146.156972658 and parameters: {'model_name': 'SimpleImputer', 'strategy': 'median'}. Best is trial 7 with value: 2926408.6707950537.
[I 2024-01-04 01:50:20,624] Trial 31 finished with value: 3319146.156972658 and parameters: {'model_name': 'SimpleImputer', 'strategy': 'median'}. Best is trial 7 with value: 2926408.6707950537.
[I 2024-01-04 01:50:20,855] Trial 25 finished with value: 3319146.156972658 and parameters: {'model_name': 'SimpleImputer', 'strategy': 'median'}. Best is trial 7 with value: 2926408.6707950537.
[I 2024-01-04 01:50:21,096] Trial 40 finished with value: 3319146.156972658 and parameters: {'model_name': 'SimpleImputer', 'strategy': 'median'}. Best is trial 7 with value: 2926408.6707950537.
[I 2024-01-04 01:50:21,377] Trial 46 finished with value: 3319146.156972658 and parameters: {'model_name': 'SimpleImputer', 'strategy': 'median'}. Best is trial 7 with value: 2926408.6707950537.
[I 2024-01-04 01:50:21,631] Trial 27 finished with value: 3319146.156972658 and parameters: {'model_name': 'SimpleImputer', 'strategy': 'median'}. Best is trial 7 with value: 2926408.6707950537.
[I 2024-01-04 01:50:21,859] Trial 37 finished with value: 3319146.156972658 and parameters: {'model_name': 'SimpleImputer', 'strategy': 'median'}. Best is trial 7 with value: 2926408.6707950537.
[I 2024-01-04 01:50:22,142] Trial 50 finished with value: 5947238.951130865 and parameters: {'model_name': 'SimpleImputer', 'strategy': 'constant'}. Best is trial 7 with value: 2926408.6707950537.
[I 2024-01-04 01:50:22,537] Trial 52 finished with value: 5947238.951130865 and parameters: {'model_name': 'SimpleImputer', 'strategy': 'constant'}. Best is trial 7 with value: 2926408.6707950537.
[I 2024-01-04 01:50:22,721] Trial 42 finished with value: 3319146.156972658 and parameters: {'model_name': 'SimpleImputer', 'strategy': 'median'}. Best is trial 7 with value: 2926408.6707950537.
[I 2024-01-04 01:50:23,127] Trial 54 finished with value: 5947238.951130865 and parameters: {'model_name': 'SimpleImputer', 'strategy': 'constant'}. Best is trial 7 with value: 2926408.6707950537.
[I 2024-01-04 01:50:23,597] Trial 56 finished with value: 2926408.6707950537 and parameters: {'model_name': 'SimpleImputer', 'strategy': 'mean'}. Best is trial 7 with value: 2926408.6707950537.
[I 2024-01-04 01:50:24,343] Trial 58 finished with value: 3319146.156972658 and parameters: {'model_name': 'SimpleImputer', 'strategy': 'median'}. Best is trial 7 with value: 2926408.6707950537.
[I 2024-01-04 01:50:24,629] Trial 63 finished with value: 3319146.156972658 and parameters: {'model_name': 'SimpleImputer', 'strategy': 'median'}. Best is trial 7 with value: 2926408.6707950537.
[I 2024-01-04 01:50:25,080] Trial 53 finished with value: 3319146.156972658 and parameters: {'model_name': 'SimpleImputer', 'strategy': 'median'}. Best is trial 7 with value: 2926408.6707950537.
[I 2024-01-04 01:50:25,488] Trial 61 finished with value: 3319146.156972658 and parameters: {'model_name': 'SimpleImputer', 'strategy': 'median'}. Best is trial 7 with value: 2926408.6707950537.
[I 2024-01-04 01:50:25,727] Trial 62 finished with value: 3319146.156972658 and parameters: {'model_name': 'SimpleImputer', 'strategy': 'median'}. Best is trial 7 with value: 2926408.6707950537.
[I 2024-01-04 01:50:25,986] Trial 57 finished with value: 3319146.156972658 and parameters: {'model_name': 'SimpleImputer', 'strategy': 'median'}. Best is trial 7 with value: 2926408.6707950537.
[I 2024-01-04 01:50:26,316] Trial 65 finished with value: 3319146.156972658 and parameters: {'model_name': 'SimpleImputer', 'strategy': 'median'}. Best is trial 7 with value: 2926408.6707950537.
[I 2024-01-04 01:50:26,544] Trial 64 finished with value: 3319146.156972658 and parameters: {'model_name': 'SimpleImputer', 'strategy': 'median'}. Best is trial 7 with value: 2926408.6707950537.
[I 2024-01-04 01:50:27,268] Trial 68 finished with value: 3319146.156972658 and parameters: {'model_name': 'SimpleImputer', 'strategy': 'median'}. Best is trial 7 with value: 2926408.6707950537.
[I 2024-01-04 01:50:27,828] Trial 11 finished with value: 5947238.951130796 and parameters: {'model_name': 'SimpleImputer', 'strategy': 'most_frequent'}. Best is trial 7 with value: 2926408.6707950537.
[I 2024-01-04 01:50:28,156] Trial 15 finished with value: 5947238.951130796 and parameters: {'model_name': 'SimpleImputer', 'strategy': 'most_frequent'}. Best is trial 7 with value: 2926408.6707950537.
[I 2024-01-04 01:50:28,369] Trial 29 finished with value: 5947238.951130796 and parameters: {'model_name': 'SimpleImputer', 'strategy': 'most_frequent'}. Best is trial 7 with value: 2926408.6707950537.
[I 2024-01-04 01:50:28,692] Trial 12 finished with value: 5947238.951130796 and parameters: {'model_name': 'SimpleImputer', 'strategy': 'most_frequent'}. Best is trial 7 with value: 2926408.6707950537.
[I 2024-01-04 01:50:28,905] Trial 67 finished with value: 3319146.156972658 and parameters: {'model_name': 'SimpleImputer', 'strategy': 'median'}. Best is trial 7 with value: 2926408.6707950537.
[I 2024-01-04 01:50:29,162] Trial 20 finished with value: 5947238.951130796 and parameters: {'model_name': 'SimpleImputer', 'strategy': 'most_frequent'}. Best is trial 7 with value: 2926408.6707950537.
[I 2024-01-04 01:50:29,487] Trial 24 finished with value: 5947238.951130796 and parameters: {'model_name': 'SimpleImputer', 'strategy': 'most_frequent'}. Best is trial 7 with value: 2926408.6707950537.
[I 2024-01-04 01:50:29,683] Trial 0 finished with value: 5947238.951130796 and parameters: {'model_name': 'SimpleImputer', 'strategy': 'most_frequent'}. Best is trial 7 with value: 2926408.6707950537.
[I 2024-01-04 01:50:29,998] Trial 41 finished with value: 5947238.951130796 and parameters: {'model_name': 'SimpleImputer', 'strategy': 'most_frequent'}. Best is trial 7 with value: 2926408.6707950537.
[I 2024-01-04 01:50:30,315] Trial 26 finished with value: 5947238.951130796 and parameters: {'model_name': 'SimpleImputer', 'strategy': 'most_frequent'}. Best is trial 7 with value: 2926408.6707950537.
[I 2024-01-04 01:50:30,841] Trial 34 finished with value: 5947238.951130796 and parameters: {'model_name': 'SimpleImputer', 'strategy': 'most_frequent'}. Best is trial 7 with value: 2926408.6707950537.
[I 2024-01-04 01:50:31,300] Trial 30 finished with value: 5947238.951130796 and parameters: {'model_name': 'SimpleImputer', 'strategy': 'most_frequent'}. Best is trial 7 with value: 2926408.6707950537.
[I 2024-01-04 01:50:31,626] Trial 47 finished with value: 5947238.951130796 and parameters: {'model_name': 'SimpleImputer', 'strategy': 'most_frequent'}. Best is trial 7 with value: 2926408.6707950537.
[I 2024-01-04 01:50:31,829] Trial 36 finished with value: 5947238.951130796 and parameters: {'model_name': 'SimpleImputer', 'strategy': 'most_frequent'}. Best is trial 7 with value: 2926408.6707950537.
[I 2024-01-04 01:50:32,247] Trial 35 finished with value: 5947238.951130796 and parameters: {'model_name': 'SimpleImputer', 'strategy': 'most_frequent'}. Best is trial 7 with value: 2926408.6707950537.
[I 2024-01-04 01:50:32,820] Trial 49 finished with value: 5947238.951130796 and parameters: {'model_name': 'SimpleImputer', 'strategy': 'most_frequent'}. Best is trial 7 with value: 2926408.6707950537.
[I 2024-01-04 01:50:33,078] Trial 48 finished with value: 5947238.951130796 and parameters: {'model_name': 'SimpleImputer', 'strategy': 'most_frequent'}. Best is trial 7 with value: 2926408.6707950537.
[I 2024-01-04 01:50:33,466] Trial 60 finished with value: 5947238.951130796 and parameters: {'model_name': 'SimpleImputer', 'strategy': 'most_frequent'}. Best is trial 7 with value: 2926408.6707950537.
[I 2024-01-04 01:50:34,069] Trial 59 finished with value: 5947238.951130796 and parameters: {'model_name': 'SimpleImputer', 'strategy': 'most_frequent'}. Best is trial 7 with value: 2926408.6707950537.
[I 2024-01-04 01:50:34,365] Trial 96 finished with value: 2926408.6707950537 and parameters: {'model_name': 'SimpleImputer', 'strategy': 'mean'}. Best is trial 7 with value: 2926408.6707950537.
[I 2024-01-04 01:50:34,842] Trial 51 finished with value: 5947238.951130796 and parameters: {'model_name': 'SimpleImputer', 'strategy': 'most_frequent'}. Best is trial 7 with value: 2926408.6707950537.
[I 2024-01-04 01:50:35,259] Trial 99 finished with value: 2926408.6707950537 and parameters: {'model_name': 'SimpleImputer', 'strategy': 'mean'}. Best is trial 7 with value: 2926408.6707950537.
[I 2024-01-04 01:50:35,501] Trial 98 finished with value: 2926408.6707950537 and parameters: {'model_name': 'SimpleImputer', 'strategy': 'mean'}. Best is trial 7 with value: 2926408.6707950537.
[I 2024-01-04 01:50:35,882] Trial 100 finished with value: 2926408.6707950537 and parameters: {'model_name': 'SimpleImputer', 'strategy': 'mean'}. Best is trial 7 with value: 2926408.6707950537.
[I 2024-01-04 01:50:36,260] Trial 102 finished with value: 2926408.6707950537 and parameters: {'model_name': 'SimpleImputer', 'strategy': 'mean'}. Best is trial 7 with value: 2926408.6707950537.
[I 2024-01-04 01:50:36,518] Trial 97 finished with value: 2926408.6707950537 and parameters: {'model_name': 'SimpleImputer', 'strategy': 'mean'}. Best is trial 7 with value: 2926408.6707950537.
[I 2024-01-04 01:50:36,753] Trial 104 finished with value: 2926408.6707950537 and parameters: {'model_name': 'SimpleImputer', 'strategy': 'mean'}. Best is trial 7 with value: 2926408.6707950537.
[I 2024-01-04 01:50:36,940] Trial 101 finished with value: 2926408.6707950537 and parameters: {'model_name': 'SimpleImputer', 'strategy': 'mean'}. Best is trial 7 with value: 2926408.6707950537.
[I 2024-01-04 01:50:37,220] Trial 55 finished with value: 5947238.951130796 and parameters: {'model_name': 'SimpleImputer', 'strategy': 'most_frequent'}. Best is trial 7 with value: 2926408.6707950537.
[I 2024-01-04 01:50:37,615] Trial 103 finished with value: 2926408.6707950537 and parameters: {'model_name': 'SimpleImputer', 'strategy': 'mean'}. Best is trial 7 with value: 2926408.6707950537.
[I 2024-01-04 01:50:38,257] Trial 105 finished with value: 2926408.6707950537 and parameters: {'model_name': 'SimpleImputer', 'strategy': 'mean'}. Best is trial 7 with value: 2926408.6707950537.
[I 2024-01-04 01:50:38,655] Trial 66 finished with value: 5947238.951130796 and parameters: {'model_name': 'SimpleImputer', 'strategy': 'most_frequent'}. Best is trial 7 with value: 2926408.6707950537.
[I 2024-01-04 01:50:38,911] Trial 106 finished with value: 2926408.6707950537 and parameters: {'model_name': 'SimpleImputer', 'strategy': 'mean'}. Best is trial 7 with value: 2926408.6707950537.
[I 2024-01-04 01:50:39,259] Trial 69 finished with value: 5947238.951130796 and parameters: {'model_name': 'SimpleImputer', 'strategy': 'most_frequent'}. Best is trial 7 with value: 2926408.6707950537.
[I 2024-01-04 01:50:39,573] Trial 71 finished with value: 5947238.951130796 and parameters: {'model_name': 'SimpleImputer', 'strategy': 'most_frequent'}. Best is trial 7 with value: 2926408.6707950537.
[I 2024-01-04 01:50:39,780] Trial 108 finished with value: 2926408.6707950537 and parameters: {'model_name': 'SimpleImputer', 'strategy': 'mean'}. Best is trial 7 with value: 2926408.6707950537.
[I 2024-01-04 01:50:39,959] Trial 107 finished with value: 2926408.6707950537 and parameters: {'model_name': 'SimpleImputer', 'strategy': 'mean'}. Best is trial 7 with value: 2926408.6707950537.
[I 2024-01-04 01:50:40,250] Trial 77 finished with value: 5947238.951130796 and parameters: {'model_name': 'SimpleImputer', 'strategy': 'most_frequent'}. Best is trial 7 with value: 2926408.6707950537.
[I 2024-01-04 01:50:40,646] Trial 110 finished with value: 2926408.6707950537 and parameters: {'model_name': 'SimpleImputer', 'strategy': 'mean'}. Best is trial 7 with value: 2926408.6707950537.
[I 2024-01-04 01:50:40,843] Trial 76 finished with value: 5947238.951130796 and parameters: {'model_name': 'SimpleImputer', 'strategy': 'most_frequent'}. Best is trial 7 with value: 2926408.6707950537.
[I 2024-01-04 01:50:41,133] Trial 109 finished with value: 2926408.6707950537 and parameters: {'model_name': 'SimpleImputer', 'strategy': 'mean'}. Best is trial 7 with value: 2926408.6707950537.
[I 2024-01-04 01:50:41,416] Trial 72 finished with value: 5947238.951130796 and parameters: {'model_name': 'SimpleImputer', 'strategy': 'most_frequent'}. Best is trial 7 with value: 2926408.6707950537.
[I 2024-01-04 01:50:41,719] Trial 70 finished with value: 5947238.951130796 and parameters: {'model_name': 'SimpleImputer', 'strategy': 'most_frequent'}. Best is trial 7 with value: 2926408.6707950537.
[I 2024-01-04 01:50:42,028] Trial 75 finished with value: 5947238.951130796 and parameters: {'model_name': 'SimpleImputer', 'strategy': 'most_frequent'}. Best is trial 7 with value: 2926408.6707950537.
[I 2024-01-04 01:50:42,281] Trial 112 finished with value: 2926408.6707950537 and parameters: {'model_name': 'SimpleImputer', 'strategy': 'mean'}. Best is trial 7 with value: 2926408.6707950537.
[I 2024-01-04 01:50:42,487] Trial 79 finished with value: 5947238.951130796 and parameters: {'model_name': 'SimpleImputer', 'strategy': 'most_frequent'}. Best is trial 7 with value: 2926408.6707950537.
[I 2024-01-04 01:50:42,764] Trial 78 finished with value: 5947238.951130796 and parameters: {'model_name': 'SimpleImputer', 'strategy': 'most_frequent'}. Best is trial 7 with value: 2926408.6707950537.
[I 2024-01-04 01:50:43,013] Trial 73 finished with value: 5947238.951130796 and parameters: {'model_name': 'SimpleImputer', 'strategy': 'most_frequent'}. Best is trial 7 with value: 2926408.6707950537.
[I 2024-01-04 01:50:43,302] Trial 74 finished with value: 5947238.951130796 and parameters: {'model_name': 'SimpleImputer', 'strategy': 'most_frequent'}. Best is trial 7 with value: 2926408.6707950537.
[I 2024-01-04 01:50:43,504] Trial 111 finished with value: 2926408.6707950537 and parameters: {'model_name': 'SimpleImputer', 'strategy': 'mean'}. Best is trial 7 with value: 2926408.6707950537.
[I 2024-01-04 01:50:43,702] Trial 84 finished with value: 5947238.951130796 and parameters: {'model_name': 'SimpleImputer', 'strategy': 'most_frequent'}. Best is trial 7 with value: 2926408.6707950537.
