[I 2024-04-21 21:52:02,145] Trial 14 finished with value: 387.90878634745684 and parameters: {'model_name': 'IterativeImputer', 'sample_posterior': True, 'initial_strategy': 'mean', 'imputation_order': 'ascending'}. Best is trial 94 with value: 232.46295110349757.
[I 2024-04-21 21:52:05,851] Trial 18 finished with value: 387.09429959179545 and parameters: {'model_name': 'IterativeImputer', 'sample_posterior': True, 'initial_strategy': 'most_frequent', 'imputation_order': 'ascending'}. Best is trial 94 with value: 232.46295110349757.
[I 2024-04-21 21:52:08,111] Trial 30 finished with value: 395.9627940000667 and parameters: {'model_name': 'IterativeImputer', 'sample_posterior': True, 'initial_strategy': 'median', 'imputation_order': 'arabic'}. Best is trial 94 with value: 232.46295110349757.
[I 2024-04-21 21:52:10,213] Trial 128 finished with value: 250.85906863045594 and parameters: {'model_name': 'GAIN', 'batch_size': 78, 'hint_rate': 0.62, 'alpha': 57, 'iterations': 10}. Best is trial 94 with value: 232.46295110349757.
[I 2024-04-21 21:52:13,500] Trial 117 finished with value: 257.2843323643981 and parameters: {'model_name': 'GAIN', 'batch_size': 535, 'hint_rate': 0.55, 'alpha': 98, 'iterations': 17}. Best is trial 94 with value: 232.46295110349757.
[I 2024-04-21 21:52:17,654] Trial 127 finished with value: 241.32765606498901 and parameters: {'model_name': 'GAIN', 'batch_size': 83, 'hint_rate': 0.6, 'alpha': 16, 'iterations': 10}. Best is trial 94 with value: 232.46295110349757.
[I 2024-04-21 21:52:22,307] Trial 53 finished with value: 397.5964537803266 and parameters: {'model_name': 'IterativeImputer', 'sample_posterior': True, 'initial_strategy': 'most_frequent', 'imputation_order': 'ascending'}. Best is trial 94 with value: 232.46295110349757.
[I 2024-04-21 21:52:24,329] Trial 121 finished with value: 249.08190104489003 and parameters: {'model_name': 'GAIN', 'batch_size': 656, 'hint_rate': 0.56, 'alpha': 97, 'iterations': 14}. Best is trial 94 with value: 232.46295110349757.
[I 2024-04-21 21:52:26,494] Trial 120 finished with value: 243.81454909596437 and parameters: {'model_name': 'GAIN', 'batch_size': 889, 'hint_rate': 0.54, 'alpha': 97, 'iterations': 17}. Best is trial 94 with value: 232.46295110349757.
[I 2024-04-21 21:52:32,068] Trial 126 finished with value: 265.90208747314307 and parameters: {'model_name': 'GAIN', 'batch_size': 104, 'hint_rate': 0.64, 'alpha': 58, 'iterations': 13}. Best is trial 94 with value: 232.46295110349757.
[I 2024-04-21 21:52:35,954] Trial 122 finished with value: 233.56063859388024 and parameters: {'model_name': 'GAIN', 'batch_size': 868, 'hint_rate': 0.56, 'alpha': 94, 'iterations': 13}. Best is trial 94 with value: 232.46295110349757.
[I 2024-04-21 21:52:39,064] Trial 119 finished with value: 240.27090325301265 and parameters: {'model_name': 'GAIN', 'batch_size': 861, 'hint_rate': 0.54, 'alpha': 98, 'iterations': 14}. Best is trial 94 with value: 232.46295110349757.
[I 2024-04-21 21:52:41,037] Trial 63 finished with value: 385.33113152884414 and parameters: {'model_name': 'IterativeImputer', 'sample_posterior': True, 'initial_strategy': 'most_frequent', 'imputation_order': 'arabic'}. Best is trial 94 with value: 232.46295110349757.
[I 2024-04-21 21:52:53,615] Trial 129 finished with value: 245.23761195807134 and parameters: {'model_name': 'GAIN', 'batch_size': 77, 'hint_rate': 0.59, 'alpha': 52, 'iterations': 8}. Best is trial 94 with value: 232.46295110349757.
[I 2024-04-21 21:52:55,572] Trial 67 finished with value: 392.99008762431356 and parameters: {'model_name': 'IterativeImputer', 'sample_posterior': True, 'initial_strategy': 'mean', 'imputation_order': 'arabic'}. Best is trial 94 with value: 232.46295110349757.
[I 2024-04-21 21:53:04,803] Trial 118 finished with value: 244.46344436438525 and parameters: {'model_name': 'GAIN', 'batch_size': 874, 'hint_rate': 0.52, 'alpha': 95, 'iterations': 23}. Best is trial 94 with value: 232.46295110349757.
[I 2024-04-21 21:53:06,996] Trial 130 finished with value: 235.50059790034192 and parameters: {'model_name': 'GAIN', 'batch_size': 86, 'hint_rate': 0.62, 'alpha': 54, 'iterations': 9}. Best is trial 94 with value: 232.46295110349757.
[I 2024-04-21 21:53:21,555] Trial 64 finished with value: 395.54537545113425 and parameters: {'model_name': 'IterativeImputer', 'sample_posterior': True, 'initial_strategy': 'mean', 'imputation_order': 'random'}. Best is trial 94 with value: 232.46295110349757.
[I 2024-04-21 21:53:30,122] Trial 60 finished with value: 380.9831818243926 and parameters: {'model_name': 'IterativeImputer', 'sample_posterior': True, 'initial_strategy': 'most_frequent', 'imputation_order': 'random'}. Best is trial 94 with value: 232.46295110349757.
[I 2024-04-21 21:53:34,623] Trial 141 finished with value: 260.7673345830913 and parameters: {'model_name': 'GAIN', 'batch_size': 2, 'hint_rate': 0.05, 'alpha': 84, 'iterations': 3}. Best is trial 94 with value: 232.46295110349757.
[I 2024-04-21 21:53:51,210] Trial 147 finished with value: 253.16839210262143 and parameters: {'model_name': 'GAIN', 'batch_size': 2, 'hint_rate': 0.01, 'alpha': 81, 'iterations': 3}. Best is trial 94 with value: 232.46295110349757.
[I 2024-04-21 21:53:54,825] Trial 155 finished with value: 398.5331653832154 and parameters: {'model_name': 'SimpleImputer', 'strategy': 'constant'}. Best is trial 94 with value: 232.46295110349757.
[I 2024-04-21 21:53:57,483] Trial 149 finished with value: 237.81268987994827 and parameters: {'model_name': 'GAIN', 'batch_size': 2, 'hint_rate': 0.060000000000000005, 'alpha': 89, 'iterations': 3}. Best is trial 94 with value: 232.46295110349757.
[I 2024-04-21 21:54:03,202] Trial 131 finished with value: 252.42202694749767 and parameters: {'model_name': 'GAIN', 'batch_size': 989, 'hint_rate': 0.61, 'alpha': 80, 'iterations': 6}. Best is trial 94 with value: 232.46295110349757.
[I 2024-04-21 21:54:05,965] Trial 133 finished with value: 246.0682286183557 and parameters: {'model_name': 'GAIN', 'batch_size': 67, 'hint_rate': 0.59, 'alpha': 79, 'iterations': 8}. Best is trial 94 with value: 232.46295110349757.
[I 2024-04-21 21:54:10,547] Trial 140 finished with value: 257.4018958515811 and parameters: {'model_name': 'GAIN', 'batch_size': 2, 'hint_rate': 0.03, 'alpha': 84, 'iterations': 3}. Best is trial 94 with value: 232.46295110349757.
[I 2024-04-21 21:54:13,220] Trial 142 finished with value: 262.4487479343429 and parameters: {'model_name': 'GAIN', 'batch_size': 2, 'hint_rate': 0.01, 'alpha': 84, 'iterations': 3}. Best is trial 94 with value: 232.46295110349757.
[I 2024-04-21 21:54:18,153] Trial 143 finished with value: 252.45190671120594 and parameters: {'model_name': 'GAIN', 'batch_size': 2, 'hint_rate': 0.05, 'alpha': 82, 'iterations': 4}. Best is trial 94 with value: 232.46295110349757.
[I 2024-04-21 21:54:24,381] Trial 139 finished with value: 249.44567094649784 and parameters: {'model_name': 'GAIN', 'batch_size': 2, 'hint_rate': 0.64, 'alpha': 84, 'iterations': 4}. Best is trial 94 with value: 232.46295110349757.
[I 2024-04-21 21:54:29,103] Trial 144 finished with value: 241.17063951163513 and parameters: {'model_name': 'GAIN', 'batch_size': 2, 'hint_rate': 0.23, 'alpha': 85, 'iterations': 3}. Best is trial 94 with value: 232.46295110349757.
[I 2024-04-21 21:54:33,540] Trial 146 finished with value: 247.01077615550943 and parameters: {'model_name': 'GAIN', 'batch_size': 2, 'hint_rate': 0.04, 'alpha': 85, 'iterations': 3}. Best is trial 94 with value: 232.46295110349757.
[I 2024-04-21 21:54:37,411] Trial 145 finished with value: 254.51061071728174 and parameters: {'model_name': 'GAIN', 'batch_size': 2, 'hint_rate': 0.05, 'alpha': 86, 'iterations': 3}. Best is trial 94 with value: 232.46295110349757.
[I 2024-04-21 21:54:41,752] Trial 152 finished with value: 253.79714863204316 and parameters: {'model_name': 'GAIN', 'batch_size': 55, 'hint_rate': 0.67, 'alpha': 80, 'iterations': 3}. Best is trial 94 with value: 232.46295110349757.
[I 2024-04-21 21:54:45,624] Trial 116 finished with value: 255.84262835628738 and parameters: {'model_name': 'GAIN', 'batch_size': 237, 'hint_rate': 0.55, 'alpha': 94, 'iterations': 34}. Best is trial 94 with value: 232.46295110349757.
[I 2024-04-21 21:54:51,030] Trial 125 finished with value: 226.62681345885875 and parameters: {'model_name': 'GAIN', 'batch_size': 68, 'hint_rate': 0.5800000000000001, 'alpha': 55, 'iterations': 30}. Best is trial 125 with value: 226.62681345885875.
[I 2024-04-21 21:54:55,984] Trial 153 finished with value: 234.5327117790686 and parameters: {'model_name': 'GAIN', 'batch_size': 54, 'hint_rate': 0.68, 'alpha': 86, 'iterations': 3}. Best is trial 125 with value: 226.62681345885875.
[I 2024-04-21 21:54:59,817] Trial 132 finished with value: 279.18431101837353 and parameters: {'model_name': 'GAIN', 'batch_size': 73, 'hint_rate': 0.61, 'alpha': 61, 'iterations': 9}. Best is trial 125 with value: 226.62681345885875.
[I 2024-04-21 21:55:07,601] Trial 150 finished with value: 231.00910494058476 and parameters: {'model_name': 'GAIN', 'batch_size': 2, 'hint_rate': 0.6900000000000001, 'alpha': 88, 'iterations': 3}. Best is trial 125 with value: 226.62681345885875.
[I 2024-04-21 21:55:11,693] Trial 148 finished with value: 244.60250248001822 and parameters: {'model_name': 'GAIN', 'batch_size': 3, 'hint_rate': 0.06999999999999999, 'alpha': 84, 'iterations': 3}. Best is trial 125 with value: 226.62681345885875.
[I 2024-04-21 21:55:14,754] Trial 172 finished with value: 398.5331653832154 and parameters: {'model_name': 'SimpleImputer', 'strategy': 'most_frequent'}. Best is trial 125 with value: 226.62681345885875.
[I 2024-04-21 21:55:19,321] Trial 173 finished with value: 398.5331653832154 and parameters: {'model_name': 'SimpleImputer', 'strategy': 'most_frequent'}. Best is trial 125 with value: 226.62681345885875.
[I 2024-04-21 21:55:22,456] Trial 154 finished with value: 237.62688842105734 and parameters: {'model_name': 'GAIN', 'batch_size': 51, 'hint_rate': 0.6900000000000001, 'alpha': 43, 'iterations': 4}. Best is trial 125 with value: 226.62681345885875.
[I 2024-04-21 21:55:33,734] Trial 93 finished with value: 235.9479891121674 and parameters: {'model_name': 'GAIN', 'batch_size': 60, 'hint_rate': 0.37, 'alpha': 18, 'iterations': 64}. Best is trial 125 with value: 226.62681345885875.
[I 2024-04-21 21:55:37,428] Trial 135 finished with value: 232.5802342049813 and parameters: {'model_name': 'GAIN', 'batch_size': 64, 'hint_rate': 0.61, 'alpha': 55, 'iterations': 18}. Best is trial 125 with value: 226.62681345885875.
[I 2024-04-21 21:55:41,336] Trial 137 finished with value: 238.18172993831095 and parameters: {'model_name': 'GAIN', 'batch_size': 79, 'hint_rate': 0.61, 'alpha': 56, 'iterations': 17}. Best is trial 125 with value: 226.62681345885875.
[I 2024-04-21 21:55:44,670] Trial 159 finished with value: 227.79234200958734 and parameters: {'model_name': 'GAIN', 'batch_size': 53, 'hint_rate': 0.68, 'alpha': 42, 'iterations': 3}. Best is trial 125 with value: 226.62681345885875.
[I 2024-04-21 21:55:47,018] Trial 151 finished with value: 264.1194496777416 and parameters: {'model_name': 'GAIN', 'batch_size': 58, 'hint_rate': 0.060000000000000005, 'alpha': 85, 'iterations': 4}. Best is trial 125 with value: 226.62681345885875.
[I 2024-04-21 21:55:54,654] Trial 156 finished with value: 238.7681482448094 and parameters: {'model_name': 'GAIN', 'batch_size': 55, 'hint_rate': 0.68, 'alpha': 45, 'iterations': 5}. Best is trial 125 with value: 226.62681345885875.
[I 2024-04-21 21:55:57,823] Trial 157 finished with value: 272.9285840183426 and parameters: {'model_name': 'GAIN', 'batch_size': 52, 'hint_rate': 0.6900000000000001, 'alpha': 86, 'iterations': 6}. Best is trial 125 with value: 226.62681345885875.
[I 2024-04-21 21:56:00,331] Trial 136 finished with value: 244.90362988493501 and parameters: {'model_name': 'GAIN', 'batch_size': 68, 'hint_rate': 0.5800000000000001, 'alpha': 54, 'iterations': 20}. Best is trial 125 with value: 226.62681345885875.
[I 2024-04-21 21:56:04,150] Trial 158 finished with value: 232.24576321306773 and parameters: {'model_name': 'GAIN', 'batch_size': 52, 'hint_rate': 0.67, 'alpha': 48, 'iterations': 4}. Best is trial 125 with value: 226.62681345885875.
[I 2024-04-21 21:56:17,033] Trial 87 finished with value: 237.87093193094648 and parameters: {'model_name': 'GAIN', 'batch_size': 300, 'hint_rate': 0.77, 'alpha': 10, 'iterations': 66}. Best is trial 125 with value: 226.62681345885875.
[I 2024-04-21 21:56:26,019] Trial 168 finished with value: 245.87362603454253 and parameters: {'model_name': 'GAIN', 'batch_size': 46, 'hint_rate': 0.11, 'alpha': 35, 'iterations': 2}. Best is trial 125 with value: 226.62681345885875.
[I 2024-04-21 21:56:29,851] Trial 166 finished with value: 235.4939657077704 and parameters: {'model_name': 'GAIN', 'batch_size': 54, 'hint_rate': 0.7000000000000001, 'alpha': 43, 'iterations': 2}. Best is trial 125 with value: 226.62681345885875.
[I 2024-04-21 21:56:38,582] Trial 138 finished with value: 255.5040611150715 and parameters: {'model_name': 'GAIN', 'batch_size': 71, 'hint_rate': 0.62, 'alpha': 85, 'iterations': 26}. Best is trial 125 with value: 226.62681345885875.
[I 2024-04-21 21:56:42,882] Trial 8 finished with value: 367.1400302687824 and parameters: {'model_name': 'RandomForestImputer', 'max_iter': 16, 'decreasing': False, 'min_samples_split': 1.0, 'min_samples_leaf': 0.5, 'max_features': 0.8, 'warm_start': False}. Best is trial 125 with value: 226.62681345885875.
[I 2024-04-21 21:56:50,140] Trial 176 finished with value: 254.98173273508337 and parameters: {'model_name': 'GAIN', 'batch_size': 52, 'hint_rate': 0.7100000000000001, 'alpha': 46, 'iterations': 6}. Best is trial 125 with value: 226.62681345885875.
[I 2024-04-21 21:57:09,074] Trial 134 finished with value: 232.02912117088917 and parameters: {'model_name': 'GAIN', 'batch_size': 946, 'hint_rate': 0.62, 'alpha': 59, 'iterations': 26}. Best is trial 125 with value: 226.62681345885875.
[I 2024-04-21 21:57:26,555] Trial 91 finished with value: 241.1802725934333 and parameters: {'model_name': 'GAIN', 'batch_size': 6, 'hint_rate': 0.55, 'alpha': 32, 'iterations': 104}. Best is trial 125 with value: 226.62681345885875.
[I 2024-04-21 21:57:47,740] Trial 177 finished with value: 236.99733076419966 and parameters: {'model_name': 'GAIN', 'batch_size': 46, 'hint_rate': 0.7100000000000001, 'alpha': 48, 'iterations': 28}. Best is trial 125 with value: 226.62681345885875.
[I 2024-04-21 21:57:55,371] Trial 169 finished with value: 260.6517825652214 and parameters: {'model_name': 'GAIN', 'batch_size': 50, 'hint_rate': 0.47000000000000003, 'alpha': 44, 'iterations': 30}. Best is trial 125 with value: 226.62681345885875.
[I 2024-04-21 21:58:05,175] Trial 160 finished with value: 254.71077820621386 and parameters: {'model_name': 'GAIN', 'batch_size': 61, 'hint_rate': 0.6900000000000001, 'alpha': 43, 'iterations': 33}. Best is trial 125 with value: 226.62681345885875.
[I 2024-04-21 21:58:11,700] Trial 161 finished with value: 232.68921985551174 and parameters: {'model_name': 'GAIN', 'batch_size': 52, 'hint_rate': 0.6900000000000001, 'alpha': 44, 'iterations': 37}. Best is trial 125 with value: 226.62681345885875.
[I 2024-04-21 21:58:14,768] Trial 178 finished with value: 244.22954576524162 and parameters: {'model_name': 'GAIN', 'batch_size': 46, 'hint_rate': 0.7000000000000001, 'alpha': 49, 'iterations': 38}. Best is trial 125 with value: 226.62681345885875.
[I 2024-04-21 21:58:20,579] Trial 167 finished with value: 239.8332243552568 and parameters: {'model_name': 'GAIN', 'batch_size': 47, 'hint_rate': 0.46, 'alpha': 42, 'iterations': 44}. Best is trial 125 with value: 226.62681345885875.
[I 2024-04-21 21:58:23,614] Trial 163 finished with value: 275.4878130142787 and parameters: {'model_name': 'GAIN', 'batch_size': 56, 'hint_rate': 0.7000000000000001, 'alpha': 45, 'iterations': 36}. Best is trial 125 with value: 226.62681345885875.
[I 2024-04-21 21:58:31,084] Trial 96 finished with value: 235.3967026948241 and parameters: {'model_name': 'GAIN', 'batch_size': 3, 'hint_rate': 0.88, 'alpha': 23, 'iterations': 128}. Best is trial 125 with value: 226.62681345885875.
[I 2024-04-21 21:58:35,355] Trial 165 finished with value: 257.9811583902101 and parameters: {'model_name': 'GAIN', 'batch_size': 53, 'hint_rate': 0.68, 'alpha': 45, 'iterations': 40}. Best is trial 125 with value: 226.62681345885875.
[I 2024-04-21 21:58:42,796] Trial 164 finished with value: 243.7633632660711 and parameters: {'model_name': 'GAIN', 'batch_size': 49, 'hint_rate': 0.46, 'alpha': 43, 'iterations': 40}. Best is trial 125 with value: 226.62681345885875.
[I 2024-04-21 21:58:47,657] Trial 171 finished with value: 268.96612376011205 and parameters: {'model_name': 'GAIN', 'batch_size': 49, 'hint_rate': 0.46, 'alpha': 8, 'iterations': 41}. Best is trial 125 with value: 226.62681345885875.
[I 2024-04-21 21:59:03,922] Trial 179 finished with value: 276.2294089010656 and parameters: {'model_name': 'GAIN', 'batch_size': 46, 'hint_rate': 0.73, 'alpha': 48, 'iterations': 54}. Best is trial 125 with value: 226.62681345885875.
[I 2024-04-21 21:59:06,971] Trial 162 finished with value: 239.77319822329096 and parameters: {'model_name': 'GAIN', 'batch_size': 48, 'hint_rate': 0.66, 'alpha': 41, 'iterations': 58}. Best is trial 125 with value: 226.62681345885875.
[I 2024-04-21 21:59:11,279] Trial 180 finished with value: 255.06395964559997 and parameters: {'model_name': 'GAIN', 'batch_size': 47, 'hint_rate': 0.7100000000000001, 'alpha': 47, 'iterations': 51}. Best is trial 125 with value: 226.62681345885875.
[I 2024-04-21 21:59:15,318] Trial 191 finished with value: 249.3629670850718 and parameters: {'model_name': 'GAIN', 'batch_size': 44, 'hint_rate': 0.48000000000000004, 'alpha': 30, 'iterations': 36}. Best is trial 125 with value: 226.62681345885875.
[I 2024-04-21 21:59:22,758] Trial 174 finished with value: 263.050642768638 and parameters: {'model_name': 'GAIN', 'batch_size': 47, 'hint_rate': 0.6900000000000001, 'alpha': 15, 'iterations': 57}. Best is trial 125 with value: 226.62681345885875.
[I 2024-04-21 21:59:26,545] Trial 170 finished with value: 251.01911617800184 and parameters: {'model_name': 'GAIN', 'batch_size': 48, 'hint_rate': 0.72, 'alpha': 15, 'iterations': 67}. Best is trial 125 with value: 226.62681345885875.
[I 2024-04-21 21:59:35,250] Trial 175 finished with value: 259.4082465231964 and parameters: {'model_name': 'GAIN', 'batch_size': 47, 'hint_rate': 0.7000000000000001, 'alpha': 16, 'iterations': 58}. Best is trial 125 with value: 226.62681345885875.
[I 2024-04-21 21:59:53,053] Trial 192 finished with value: 238.82005522324334 and parameters: {'model_name': 'GAIN', 'batch_size': 40, 'hint_rate': 0.34, 'alpha': 50, 'iterations': 50}. Best is trial 125 with value: 226.62681345885875.
[I 2024-04-21 22:00:24,771] Trial 199 finished with value: 241.9232814103475 and parameters: {'model_name': 'GAIN', 'batch_size': 36, 'hint_rate': 0.35000000000000003, 'alpha': 63, 'iterations': 55}. Best is trial 125 with value: 226.62681345885875.
[I 2024-04-21 22:01:05,431] Trial 181 finished with value: 367.3089316109059 and parameters: {'model_name': 'RandomForestImputer', 'max_iter': 15, 'decreasing': False, 'min_samples_split': 1.0, 'min_samples_leaf': 0.1, 'max_features': 0.4, 'warm_start': False}. Best is trial 125 with value: 226.62681345885875.
[I 2024-04-21 22:01:11,293] Trial 182 finished with value: 367.08757706328436 and parameters: {'model_name': 'RandomForestImputer', 'max_iter': 17, 'decreasing': False, 'min_samples_split': 1.0, 'min_samples_leaf': 0.1, 'max_features': 0.4, 'warm_start': False}. Best is trial 125 with value: 226.62681345885875.
[I 2024-04-21 22:01:29,409] Trial 184 finished with value: 367.0384771961631 and parameters: {'model_name': 'RandomForestImputer', 'max_iter': 17, 'decreasing': False, 'min_samples_split': 1.0, 'min_samples_leaf': 0.1, 'max_features': 0.4, 'warm_start': False}. Best is trial 125 with value: 226.62681345885875.
[I 2024-04-21 22:01:41,412] Trial 68 finished with value: 367.17137209900704 and parameters: {'model_name': 'RandomForestImputer', 'max_iter': 33, 'decreasing': False, 'min_samples_split': 0.9, 'min_samples_leaf': 0.1, 'max_features': 0.1, 'warm_start': False}. Best is trial 125 with value: 226.62681345885875.
[I 2024-04-21 22:02:21,950] Trial 33 finished with value: 296.75410133466767 and parameters: {'model_name': 'GAIN', 'batch_size': 19, 'hint_rate': 0.33, 'alpha': 14, 'iterations': 360}. Best is trial 125 with value: 226.62681345885875.
[I 2024-04-21 22:02:34,885] Trial 44 finished with value: 286.03966017196456 and parameters: {'model_name': 'GAIN', 'batch_size': 19, 'hint_rate': 0.9600000000000001, 'alpha': 28, 'iterations': 373}. Best is trial 125 with value: 226.62681345885875.
[I 2024-04-21 22:04:24,237] Trial 92 finished with value: 316.6679832704779 and parameters: {'model_name': 'GAIN', 'batch_size': 116, 'hint_rate': 0.8, 'alpha': 17, 'iterations': 466}. Best is trial 125 with value: 226.62681345885875.
[I 2024-04-21 22:06:44,372] Trial 198 finished with value: 367.2036145958098 and parameters: {'model_name': 'RandomForestImputer', 'max_iter': 63, 'decreasing': False, 'min_samples_split': 0.0, 'min_samples_leaf': 0.1, 'max_features': 0.4, 'warm_start': False}. Best is trial 125 with value: 226.62681345885875.
[I 2024-04-21 22:07:15,976] Trial 189 finished with value: 367.24826452807343 and parameters: {'model_name': 'RandomForestImputer', 'max_iter': 72, 'decreasing': False, 'min_samples_split': 1.0, 'min_samples_leaf': 0.1, 'max_features': 0.4, 'warm_start': False}. Best is trial 125 with value: 226.62681345885875.
[I 2024-04-21 22:07:52,006] Trial 41 finished with value: 320.341481867529 and parameters: {'model_name': 'GAIN', 'batch_size': 19, 'hint_rate': 0.26, 'alpha': 78, 'iterations': 861}. Best is trial 125 with value: 226.62681345885875.
