[I 2024-04-21 21:46:04,092] Trial 2 finished with value: 367.220002766516 and parameters: {'model_name': 'SimpleImputer', 'strategy': 'mean'}. Best is trial 2 with value: 367.220002766516.
[I 2024-04-21 21:46:04,964] Trial 1 finished with value: 367.220002766516 and parameters: {'model_name': 'SimpleImputer', 'strategy': 'mean'}. Best is trial 2 with value: 367.220002766516.
[I 2024-04-21 21:46:07,244] Trial 19 finished with value: 398.5331653832154 and parameters: {'model_name': 'SimpleImputer', 'strategy': 'constant'}. Best is trial 2 with value: 367.220002766516.
[I 2024-04-21 21:46:09,677] Trial 10 finished with value: 398.5331653832154 and parameters: {'model_name': 'SimpleImputer', 'strategy': 'median'}. Best is trial 2 with value: 367.220002766516.
[I 2024-04-21 21:46:11,047] Trial 22 finished with value: 398.5331653832154 and parameters: {'model_name': 'SimpleImputer', 'strategy': 'median'}. Best is trial 2 with value: 367.220002766516.
[I 2024-04-21 21:46:13,930] Trial 34 finished with value: 398.5331653832154 and parameters: {'model_name': 'SimpleImputer', 'strategy': 'median'}. Best is trial 2 with value: 367.220002766516.
[I 2024-04-21 21:46:15,838] Trial 5 finished with value: 398.5331653832154 and parameters: {'model_name': 'SimpleImputer', 'strategy': 'most_frequent'}. Best is trial 2 with value: 367.220002766516.
[I 2024-04-21 21:46:16,577] Trial 50 finished with value: 367.220002766516 and parameters: {'model_name': 'SimpleImputer', 'strategy': 'mean'}. Best is trial 2 with value: 367.220002766516.
2024-04-21 21:46:18.815069: E external/local_xla/xla/stream_executor/cuda/cuda_driver.cc:274] failed call to cuInit: CUDA_ERROR_NO_DEVICE: no CUDA-capable device is detected
2024-04-21 21:46:19.789808: I tensorflow/compiler/mlir/mlir_graph_optimization_pass.cc:388] MLIR V1 optimization pass is not enabled
[I 2024-04-21 21:46:19,868] Trial 31 finished with value: 398.5331653832154 and parameters: {'model_name': 'SimpleImputer', 'strategy': 'most_frequent'}. Best is trial 2 with value: 367.220002766516.
[I 2024-04-21 21:46:57,104] Trial 11 finished with value: 367.220002766516 and parameters: {'model_name': 'RandomForestImputer', 'max_iter': 1, 'decreasing': True, 'min_samples_split': 0.7000000000000001, 'min_samples_leaf': 0.30000000000000004, 'max_features': 0.2, 'warm_start': True}. Best is trial 2 with value: 367.220002766516.
[I 2024-04-21 21:47:00,439] Trial 26 finished with value: 367.220002766516 and parameters: {'model_name': 'RandomForestImputer', 'max_iter': 1, 'decreasing': True, 'min_samples_split': 0.1, 'min_samples_leaf': 0.6, 'max_features': 0.8, 'warm_start': True}. Best is trial 2 with value: 367.220002766516.
[I 2024-04-21 21:47:13,776] Trial 16 finished with value: 371.23600840253215 and parameters: {'model_name': 'KNNImputer', 'weights': 'uniform', 'keep_empty_features': False}. Best is trial 2 with value: 367.220002766516.
[I 2024-04-21 21:47:16,290] Trial 46 finished with value: 371.23600840253215 and parameters: {'model_name': 'KNNImputer', 'weights': 'uniform', 'keep_empty_features': False}. Best is trial 2 with value: 367.220002766516.
[I 2024-04-21 21:47:17,895] Trial 40 finished with value: 371.23600840253215 and parameters: {'model_name': 'KNNImputer', 'weights': 'uniform', 'keep_empty_features': False}. Best is trial 2 with value: 367.220002766516.
[I 2024-04-21 21:47:18,569] Trial 23 finished with value: 371.23600840253215 and parameters: {'model_name': 'KNNImputer', 'weights': 'uniform', 'keep_empty_features': False}. Best is trial 2 with value: 367.220002766516.
[I 2024-04-21 21:47:19,180] Trial 3 finished with value: 371.23600840253215 and parameters: {'model_name': 'KNNImputer', 'weights': 'distance', 'keep_empty_features': False}. Best is trial 2 with value: 367.220002766516.
[I 2024-04-21 21:47:20,323] Trial 35 finished with value: 371.23600840253215 and parameters: {'model_name': 'KNNImputer', 'weights': 'distance', 'keep_empty_features': False}. Best is trial 2 with value: 367.220002766516.
[I 2024-04-21 21:47:21,384] Trial 37 finished with value: 371.23600840253215 and parameters: {'model_name': 'KNNImputer', 'weights': 'distance', 'keep_empty_features': False}. Best is trial 2 with value: 367.220002766516.
[I 2024-04-21 21:47:21,959] Trial 20 finished with value: 371.23600840253215 and parameters: {'model_name': 'KNNImputer', 'weights': 'distance', 'keep_empty_features': False}. Best is trial 2 with value: 367.220002766516.
[I 2024-04-21 21:47:22,713] Trial 24 finished with value: 371.23600840253215 and parameters: {'model_name': 'KNNImputer', 'weights': 'uniform', 'keep_empty_features': False}. Best is trial 2 with value: 367.220002766516.
[I 2024-04-21 21:47:23,938] Trial 48 finished with value: 371.23600840253215 and parameters: {'model_name': 'KNNImputer', 'weights': 'distance', 'keep_empty_features': False}. Best is trial 2 with value: 367.220002766516.
[I 2024-04-21 21:47:27,162] Trial 28 finished with value: 367.17077434262876 and parameters: {'model_name': 'IterativeImputer', 'sample_posterior': False, 'initial_strategy': 'mean', 'imputation_order': 'arabic'}. Best is trial 28 with value: 367.17077434262876.
[I 2024-04-21 21:47:31,476] Trial 56 finished with value: 371.23600840253215 and parameters: {'model_name': 'KNNImputer', 'weights': 'uniform', 'keep_empty_features': False}. Best is trial 28 with value: 367.17077434262876.
[I 2024-04-21 21:47:34,114] Trial 27 finished with value: 393.47961884105246 and parameters: {'model_name': 'RandomForestImputer', 'max_iter': 2, 'decreasing': True, 'min_samples_split': 1.0, 'min_samples_leaf': 0.6, 'max_features': 0.4, 'warm_start': True}. Best is trial 28 with value: 367.17077434262876.
[I 2024-04-21 21:47:34,897] Trial 7 finished with value: 367.1708068602795 and parameters: {'model_name': 'IterativeImputer', 'sample_posterior': False, 'initial_strategy': 'constant', 'imputation_order': 'roman'}. Best is trial 28 with value: 367.17077434262876.
[I 2024-04-21 21:47:36,648] Trial 13 finished with value: 367.1708068602795 and parameters: {'model_name': 'IterativeImputer', 'sample_posterior': False, 'initial_strategy': 'median', 'imputation_order': 'roman'}. Best is trial 28 with value: 367.17077434262876.
[I 2024-04-21 21:47:38,399] Trial 39 finished with value: 367.1708804866088 and parameters: {'model_name': 'IterativeImputer', 'sample_posterior': False, 'initial_strategy': 'median', 'imputation_order': 'random'}. Best is trial 28 with value: 367.17077434262876.
[I 2024-04-21 21:47:39,695] Trial 55 finished with value: 393.2969182407236 and parameters: {'model_name': 'RandomForestImputer', 'max_iter': 2, 'decreasing': True, 'min_samples_split': 0.1, 'min_samples_leaf': 0.7000000000000001, 'max_features': 0.9, 'warm_start': True}. Best is trial 28 with value: 367.17077434262876.
[I 2024-04-21 21:47:42,255] Trial 21 finished with value: 367.1707996395413 and parameters: {'model_name': 'IterativeImputer', 'sample_posterior': False, 'initial_strategy': 'most_frequent', 'imputation_order': 'ascending'}. Best is trial 28 with value: 367.17077434262876.
[I 2024-04-21 21:47:48,104] Trial 0 finished with value: 393.51195852460035 and parameters: {'model_name': 'RandomForestImputer', 'max_iter': 3, 'decreasing': True, 'min_samples_split': 0.2, 'min_samples_leaf': 0.2, 'max_features': 0.9, 'warm_start': True}. Best is trial 28 with value: 367.17077434262876.
[I 2024-04-21 21:47:50,242] Trial 36 finished with value: 367.220002766516 and parameters: {'model_name': 'RandomForestImputer', 'max_iter': 1, 'decreasing': True, 'min_samples_split': 0.30000000000000004, 'min_samples_leaf': 0.9, 'max_features': 0.9, 'warm_start': False}. Best is trial 28 with value: 367.17077434262876.
[I 2024-04-21 21:47:52,024] Trial 52 finished with value: 367.220002766516 and parameters: {'model_name': 'RandomForestImputer', 'max_iter': 1, 'decreasing': False, 'min_samples_split': 0.7000000000000001, 'min_samples_leaf': 0.6, 'max_features': 0.8, 'warm_start': False}. Best is trial 28 with value: 367.17077434262876.
[I 2024-04-21 21:47:52,988] Trial 66 finished with value: 367.17077434262876 and parameters: {'model_name': 'IterativeImputer', 'sample_posterior': False, 'initial_strategy': 'mean', 'imputation_order': 'arabic'}. Best is trial 28 with value: 367.17077434262876.
[I 2024-04-21 21:47:54,803] Trial 62 finished with value: 367.17080048603674 and parameters: {'model_name': 'IterativeImputer', 'sample_posterior': False, 'initial_strategy': 'constant', 'imputation_order': 'descending'}. Best is trial 28 with value: 367.17077434262876.
[I 2024-04-21 21:47:56,145] Trial 57 finished with value: 371.23600840253215 and parameters: {'model_name': 'KNNImputer', 'weights': 'distance', 'keep_empty_features': False}. Best is trial 28 with value: 367.17077434262876.
[I 2024-04-21 21:47:57,802] Trial 69 finished with value: 367.17077434262876 and parameters: {'model_name': 'IterativeImputer', 'sample_posterior': False, 'initial_strategy': 'mean', 'imputation_order': 'arabic'}. Best is trial 28 with value: 367.17077434262876.
[I 2024-04-21 21:47:59,419] Trial 29 finished with value: 393.3178413784176 and parameters: {'model_name': 'RandomForestImputer', 'max_iter': 5, 'decreasing': True, 'min_samples_split': 0.4, 'min_samples_leaf': 0.30000000000000004, 'max_features': 0.2, 'warm_start': True}. Best is trial 28 with value: 367.17077434262876.
[I 2024-04-21 21:48:01,337] Trial 70 finished with value: 367.17077434262876 and parameters: {'model_name': 'IterativeImputer', 'sample_posterior': False, 'initial_strategy': 'mean', 'imputation_order': 'arabic'}. Best is trial 28 with value: 367.17077434262876.
[I 2024-04-21 21:48:02,865] Trial 59 finished with value: 367.1708068602795 and parameters: {'model_name': 'IterativeImputer', 'sample_posterior': False, 'initial_strategy': 'most_frequent', 'imputation_order': 'roman'}. Best is trial 28 with value: 367.17077434262876.
[I 2024-04-21 21:48:04,099] Trial 71 finished with value: 367.17077434262876 and parameters: {'model_name': 'IterativeImputer', 'sample_posterior': False, 'initial_strategy': 'mean', 'imputation_order': 'arabic'}. Best is trial 28 with value: 367.17077434262876.
[I 2024-04-21 21:48:08,175] Trial 17 finished with value: 393.429506039843 and parameters: {'model_name': 'RandomForestImputer', 'max_iter': 9, 'decreasing': True, 'min_samples_split': 0.7000000000000001, 'min_samples_leaf': 0.4, 'max_features': 0.5, 'warm_start': True}. Best is trial 28 with value: 367.17077434262876.
[I 2024-04-21 21:48:10,993] Trial 76 finished with value: 367.17077434262876 and parameters: {'model_name': 'IterativeImputer', 'sample_posterior': False, 'initial_strategy': 'mean', 'imputation_order': 'arabic'}. Best is trial 28 with value: 367.17077434262876.
[I 2024-04-21 21:48:13,496] Trial 72 finished with value: 367.1708068602795 and parameters: {'model_name': 'IterativeImputer', 'sample_posterior': False, 'initial_strategy': 'constant', 'imputation_order': 'roman'}. Best is trial 28 with value: 367.17077434262876.
[I 2024-04-21 21:48:14,872] Trial 74 finished with value: 367.1707266521976 and parameters: {'model_name': 'IterativeImputer', 'sample_posterior': False, 'initial_strategy': 'mean', 'imputation_order': 'roman'}. Best is trial 74 with value: 367.1707266521976.
[I 2024-04-21 21:48:16,382] Trial 73 finished with value: 367.1708068602795 and parameters: {'model_name': 'IterativeImputer', 'sample_posterior': False, 'initial_strategy': 'constant', 'imputation_order': 'roman'}. Best is trial 74 with value: 367.1707266521976.
[I 2024-04-21 21:48:17,192] Trial 75 finished with value: 367.1707266521976 and parameters: {'model_name': 'IterativeImputer', 'sample_posterior': False, 'initial_strategy': 'mean', 'imputation_order': 'roman'}. Best is trial 74 with value: 367.1707266521976.
[I 2024-04-21 21:48:19,953] Trial 43 finished with value: 393.40242007302834 and parameters: {'model_name': 'RandomForestImputer', 'max_iter': 7, 'decreasing': True, 'min_samples_split': 0.7000000000000001, 'min_samples_leaf': 0.4, 'max_features': 0.2, 'warm_start': True}. Best is trial 74 with value: 367.1707266521976.
[I 2024-04-21 21:48:22,889] Trial 80 finished with value: 367.17077434262876 and parameters: {'model_name': 'IterativeImputer', 'sample_posterior': False, 'initial_strategy': 'mean', 'imputation_order': 'arabic'}. Best is trial 74 with value: 367.1707266521976.
[I 2024-04-21 21:48:24,440] Trial 77 finished with value: 367.1708027218413 and parameters: {'model_name': 'IterativeImputer', 'sample_posterior': False, 'initial_strategy': 'constant', 'imputation_order': 'arabic'}. Best is trial 74 with value: 367.1707266521976.
[I 2024-04-21 21:48:27,150] Trial 81 finished with value: 367.17077434262876 and parameters: {'model_name': 'IterativeImputer', 'sample_posterior': False, 'initial_strategy': 'mean', 'imputation_order': 'arabic'}. Best is trial 74 with value: 367.1707266521976.
[I 2024-04-21 21:48:27,871] Trial 82 finished with value: 367.17077434262876 and parameters: {'model_name': 'IterativeImputer', 'sample_posterior': False, 'initial_strategy': 'mean', 'imputation_order': 'arabic'}. Best is trial 74 with value: 367.1707266521976.
[I 2024-04-21 21:48:29,157] Trial 12 finished with value: 276.1720647136975 and parameters: {'model_name': 'GAIN', 'batch_size': 30, 'hint_rate': 0.75, 'alpha': 10, 'iterations': 1}. Best is trial 12 with value: 276.1720647136975.
[I 2024-04-21 21:48:32,299] Trial 78 finished with value: 367.1708068602795 and parameters: {'model_name': 'IterativeImputer', 'sample_posterior': False, 'initial_strategy': 'constant', 'imputation_order': 'roman'}. Best is trial 12 with value: 276.1720647136975.
[I 2024-04-21 21:48:33,632] Trial 79 finished with value: 367.1708068602795 and parameters: {'model_name': 'IterativeImputer', 'sample_posterior': False, 'initial_strategy': 'constant', 'imputation_order': 'roman'}. Best is trial 12 with value: 276.1720647136975.
[I 2024-04-21 21:48:35,445] Trial 51 finished with value: 238.26778031734094 and parameters: {'model_name': 'GAIN', 'batch_size': 130, 'hint_rate': 0.2, 'alpha': 24, 'iterations': 2}. Best is trial 51 with value: 238.26778031734094.
[I 2024-04-21 21:48:37,945] Trial 25 finished with value: 257.3279869558972 and parameters: {'model_name': 'GAIN', 'batch_size': 6, 'hint_rate': 0.4, 'alpha': 36, 'iterations': 6}. Best is trial 51 with value: 238.26778031734094.
[I 2024-04-21 21:48:41,633] Trial 45 finished with value: 249.24680554349666 and parameters: {'model_name': 'GAIN', 'batch_size': 334, 'hint_rate': 0.87, 'alpha': 45, 'iterations': 4}. Best is trial 51 with value: 238.26778031734094.
[I 2024-04-21 21:48:43,890] Trial 65 finished with value: 233.00534651329758 and parameters: {'model_name': 'GAIN', 'batch_size': 1, 'hint_rate': 0.55, 'alpha': 94, 'iterations': 1}. Best is trial 65 with value: 233.00534651329758.
[I 2024-04-21 21:49:06,474] Trial 85 finished with value: 252.0218598971982 and parameters: {'model_name': 'GAIN', 'batch_size': 35, 'hint_rate': 0.15000000000000002, 'alpha': 72, 'iterations': 1}. Best is trial 65 with value: 233.00534651329758.
[I 2024-04-21 21:49:08,965] Trial 86 finished with value: 246.54148126547298 and parameters: {'model_name': 'GAIN', 'batch_size': 1, 'hint_rate': 0.92, 'alpha': 40, 'iterations': 1}. Best is trial 65 with value: 233.00534651329758.
[I 2024-04-21 21:49:13,922] Trial 89 finished with value: 238.55422128887864 and parameters: {'model_name': 'GAIN', 'batch_size': 16, 'hint_rate': 0.21000000000000002, 'alpha': 83, 'iterations': 1}. Best is trial 65 with value: 233.00534651329758.
[I 2024-04-21 21:49:17,470] Trial 94 finished with value: 232.46295110349757 and parameters: {'model_name': 'GAIN', 'batch_size': 606, 'hint_rate': 0.41000000000000003, 'alpha': 31, 'iterations': 1}. Best is trial 94 with value: 232.46295110349757.
[I 2024-04-21 21:49:18,851] Trial 4 finished with value: 234.91923009657563 and parameters: {'model_name': 'GAIN', 'batch_size': 39, 'hint_rate': 0.44, 'alpha': 49, 'iterations': 16}. Best is trial 94 with value: 232.46295110349757.
[I 2024-04-21 21:49:22,471] Trial 9 finished with value: 383.1660127869848 and parameters: {'model_name': 'RandomForestImputer', 'max_iter': 25, 'decreasing': False, 'min_samples_split': 0.6000000000000001, 'min_samples_leaf': 0.9, 'max_features': 0.6, 'warm_start': True}. Best is trial 94 with value: 232.46295110349757.
[I 2024-04-21 21:49:25,830] Trial 101 finished with value: 244.37086505555368 and parameters: {'model_name': 'GAIN', 'batch_size': 31, 'hint_rate': 0.79, 'alpha': 3, 'iterations': 1}. Best is trial 94 with value: 232.46295110349757.
[I 2024-04-21 21:49:27,702] Trial 100 finished with value: 248.89624900775524 and parameters: {'model_name': 'GAIN', 'batch_size': 35, 'hint_rate': 0.78, 'alpha': 1, 'iterations': 1}. Best is trial 94 with value: 232.46295110349757.
[I 2024-04-21 21:49:40,437] Trial 99 finished with value: 280.0185642703536 and parameters: {'model_name': 'GAIN', 'batch_size': 35, 'hint_rate': 0.78, 'alpha': 3, 'iterations': 1}. Best is trial 94 with value: 232.46295110349757.
[I 2024-04-21 21:49:42,011] Trial 102 finished with value: 235.3869202854515 and parameters: {'model_name': 'GAIN', 'batch_size': 65, 'hint_rate': 0.65, 'alpha': 12, 'iterations': 1}. Best is trial 94 with value: 232.46295110349757.
[I 2024-04-21 21:49:46,942] Trial 103 finished with value: 273.60421300233594 and parameters: {'model_name': 'GAIN', 'batch_size': 32, 'hint_rate': 0.27, 'alpha': 22, 'iterations': 1}. Best is trial 94 with value: 232.46295110349757.
[I 2024-04-21 21:49:54,315] Trial 104 finished with value: 245.16883977545496 and parameters: {'model_name': 'GAIN', 'batch_size': 147, 'hint_rate': 0.85, 'alpha': 22, 'iterations': 2}. Best is trial 94 with value: 232.46295110349757.
[I 2024-04-21 21:50:01,311] Trial 105 finished with value: 259.5058778840966 and parameters: {'model_name': 'GAIN', 'batch_size': 143, 'hint_rate': 0.85, 'alpha': 26, 'iterations': 2}. Best is trial 94 with value: 232.46295110349757.
[I 2024-04-21 21:50:16,954] Trial 106 finished with value: 264.9465940472205 and parameters: {'model_name': 'GAIN', 'batch_size': 32, 'hint_rate': 0.19, 'alpha': 34, 'iterations': 1}. Best is trial 94 with value: 232.46295110349757.
[I 2024-04-21 21:50:18,995] Trial 111 finished with value: 242.03601499221813 and parameters: {'model_name': 'GAIN', 'batch_size': 575, 'hint_rate': 0.97, 'alpha': 94, 'iterations': 1}. Best is trial 94 with value: 232.46295110349757.
[I 2024-04-21 21:50:21,210] Trial 108 finished with value: 239.52870977805782 and parameters: {'model_name': 'GAIN', 'batch_size': 1, 'hint_rate': 0.18000000000000002, 'alpha': 91, 'iterations': 1}. Best is trial 94 with value: 232.46295110349757.
[I 2024-04-21 21:50:25,496] Trial 109 finished with value: 257.189640284148 and parameters: {'model_name': 'GAIN', 'batch_size': 472, 'hint_rate': 0.15000000000000002, 'alpha': 93, 'iterations': 1}. Best is trial 94 with value: 232.46295110349757.
[I 2024-04-21 21:50:27,055] Trial 107 finished with value: 239.2260525002893 and parameters: {'model_name': 'GAIN', 'batch_size': 1, 'hint_rate': 0.15000000000000002, 'alpha': 40, 'iterations': 2}. Best is trial 94 with value: 232.46295110349757.
[I 2024-04-21 21:50:31,369] Trial 42 finished with value: 237.87718140967786 and parameters: {'model_name': 'GAIN', 'batch_size': 49, 'hint_rate': 0.5800000000000001, 'alpha': 19, 'iterations': 31}. Best is trial 94 with value: 232.46295110349757.
[I 2024-04-21 21:50:32,877] Trial 110 finished with value: 242.5501142300381 and parameters: {'model_name': 'GAIN', 'batch_size': 474, 'hint_rate': 0.93, 'alpha': 99, 'iterations': 1}. Best is trial 94 with value: 232.46295110349757.
[I 2024-04-21 21:50:35,040] Trial 112 finished with value: 261.933068424743 and parameters: {'model_name': 'GAIN', 'batch_size': 1, 'hint_rate': 0.41000000000000003, 'alpha': 95, 'iterations': 1}. Best is trial 94 with value: 232.46295110349757.
[I 2024-04-21 21:50:40,284] Trial 113 finished with value: 247.59703063181058 and parameters: {'model_name': 'GAIN', 'batch_size': 1, 'hint_rate': 0.39, 'alpha': 97, 'iterations': 1}. Best is trial 94 with value: 232.46295110349757.
[I 2024-04-21 21:50:55,461] Trial 6 finished with value: 393.47172843098224 and parameters: {'model_name': 'RandomForestImputer', 'max_iter': 73, 'decreasing': True, 'min_samples_split': 0.8, 'min_samples_leaf': 0.6, 'max_features': 0.2, 'warm_start': True}. Best is trial 94 with value: 232.46295110349757.
[I 2024-04-21 21:51:00,647] Trial 114 finished with value: 254.6545466783998 and parameters: {'model_name': 'GAIN', 'batch_size': 1, 'hint_rate': 0.4, 'alpha': 100, 'iterations': 1}. Best is trial 94 with value: 232.46295110349757.
[I 2024-04-21 21:51:03,241] Trial 115 finished with value: 258.94359858656486 and parameters: {'model_name': 'GAIN', 'batch_size': 265, 'hint_rate': 0.49, 'alpha': 99, 'iterations': 1}. Best is trial 94 with value: 232.46295110349757.
[I 2024-04-21 21:51:50,601] Trial 90 finished with value: 264.4835922952184 and parameters: {'model_name': 'GAIN', 'batch_size': 119, 'hint_rate': 0.38, 'alpha': 25, 'iterations': 38}. Best is trial 94 with value: 232.46295110349757.
[I 2024-04-21 21:51:53,979] Trial 123 finished with value: 236.43122813942472 and parameters: {'model_name': 'GAIN', 'batch_size': 1, 'hint_rate': 0.5700000000000001, 'alpha': 58, 'iterations': 9}. Best is trial 94 with value: 232.46295110349757.
[I 2024-04-21 21:51:57,976] Trial 49 finished with value: 384.6210796406564 and parameters: {'model_name': 'IterativeImputer', 'sample_posterior': True, 'initial_strategy': 'mean', 'imputation_order': 'descending'}. Best is trial 94 with value: 232.46295110349757.
[I 2024-04-21 21:51:59,662] Trial 124 finished with value: 251.661846005984 and parameters: {'model_name': 'GAIN', 'batch_size': 91, 'hint_rate': 0.56, 'alpha': 57, 'iterations': 12}. Best is trial 94 with value: 232.46295110349757.
