[I 2024-04-01 22:59:20,723] Trial 20 finished with value: 7116.895248504645 and parameters: {'model_name': 'SimpleImputer', 'strategy': 'constant'}. Best is trial 20 with value: 7116.895248504645.
[I 2024-04-01 22:59:21,843] Trial 22 finished with value: 7116.895248504645 and parameters: {'model_name': 'SimpleImputer', 'strategy': 'constant'}. Best is trial 20 with value: 7116.895248504645.
[I 2024-04-01 22:59:22,888] Trial 13 finished with value: 6907.958308626808 and parameters: {'model_name': 'SimpleImputer', 'strategy': 'mean'}. Best is trial 13 with value: 6907.958308626808.
[I 2024-04-01 22:59:23,954] Trial 30 finished with value: 6907.958308626808 and parameters: {'model_name': 'SimpleImputer', 'strategy': 'mean'}. Best is trial 13 with value: 6907.958308626808.
[I 2024-04-01 22:59:24,445] Trial 11 finished with value: 7021.371575737801 and parameters: {'model_name': 'SimpleImputer', 'strategy': 'median'}. Best is trial 13 with value: 6907.958308626808.
[I 2024-04-01 22:59:25,191] Trial 29 finished with value: 6907.958308626808 and parameters: {'model_name': 'SimpleImputer', 'strategy': 'mean'}. Best is trial 13 with value: 6907.958308626808.
[I 2024-04-01 22:59:25,716] Trial 45 finished with value: 6907.958308626808 and parameters: {'model_name': 'SimpleImputer', 'strategy': 'mean'}. Best is trial 13 with value: 6907.958308626808.
[I 2024-04-01 22:59:27,183] Trial 16 finished with value: 7021.371575737801 and parameters: {'model_name': 'SimpleImputer', 'strategy': 'median'}. Best is trial 13 with value: 6907.958308626808.
2024-04-01 22:59:32.754405: E external/local_xla/xla/stream_executor/cuda/cuda_driver.cc:274] failed call to cuInit: CUDA_ERROR_NO_DEVICE: no CUDA-capable device is detected
[I 2024-04-01 22:59:33,028] Trial 49 finished with value: 7021.371575737801 and parameters: {'model_name': 'SimpleImputer', 'strategy': 'median'}. Best is trial 13 with value: 6907.958308626808.
[I 2024-04-01 22:59:33,587] Trial 48 finished with value: 7021.371575737801 and parameters: {'model_name': 'SimpleImputer', 'strategy': 'median'}. Best is trial 13 with value: 6907.958308626808.
2024-04-01 22:59:34.573178: I tensorflow/compiler/mlir/mlir_graph_optimization_pass.cc:388] MLIR V1 optimization pass is not enabled
[I 2024-04-01 22:59:48,276] Trial 9 finished with value: 7116.895240271873 and parameters: {'model_name': 'SimpleImputer', 'strategy': 'most_frequent'}. Best is trial 13 with value: 6907.958308626808.
[I 2024-04-01 22:59:50,416] Trial 39 finished with value: 7116.895240271873 and parameters: {'model_name': 'SimpleImputer', 'strategy': 'most_frequent'}. Best is trial 13 with value: 6907.958308626808.
[I 2024-04-01 23:00:26,083] Trial 4 finished with value: 6240.367438135623 and parameters: {'model_name': 'KNNImputer', 'weights': 'uniform', 'keep_empty_features': False}. Best is trial 4 with value: 6240.367438135623.
[I 2024-04-01 23:00:28,171] Trial 31 finished with value: 6240.367438135623 and parameters: {'model_name': 'KNNImputer', 'weights': 'uniform', 'keep_empty_features': False}. Best is trial 4 with value: 6240.367438135623.
[I 2024-04-01 23:00:29,107] Trial 12 finished with value: 6242.2708725488 and parameters: {'model_name': 'KNNImputer', 'weights': 'distance', 'keep_empty_features': False}. Best is trial 4 with value: 6240.367438135623.
[I 2024-04-01 23:00:29,745] Trial 33 finished with value: 6240.367438135623 and parameters: {'model_name': 'KNNImputer', 'weights': 'uniform', 'keep_empty_features': False}. Best is trial 4 with value: 6240.367438135623.
[I 2024-04-01 23:00:30,276] Trial 8 finished with value: 6240.367438135623 and parameters: {'model_name': 'KNNImputer', 'weights': 'uniform', 'keep_empty_features': False}. Best is trial 4 with value: 6240.367438135623.
[I 2024-04-01 23:00:32,193] Trial 26 finished with value: 6240.367438135623 and parameters: {'model_name': 'KNNImputer', 'weights': 'uniform', 'keep_empty_features': False}. Best is trial 4 with value: 6240.367438135623.
[I 2024-04-01 23:00:33,369] Trial 46 finished with value: 6240.367438135623 and parameters: {'model_name': 'KNNImputer', 'weights': 'uniform', 'keep_empty_features': False}. Best is trial 4 with value: 6240.367438135623.
[I 2024-04-01 23:00:34,243] Trial 36 finished with value: 6240.367438135623 and parameters: {'model_name': 'KNNImputer', 'weights': 'uniform', 'keep_empty_features': False}. Best is trial 4 with value: 6240.367438135623.
[I 2024-04-01 23:00:34,875] Trial 24 finished with value: 6242.2708725488 and parameters: {'model_name': 'KNNImputer', 'weights': 'distance', 'keep_empty_features': False}. Best is trial 4 with value: 6240.367438135623.
[I 2024-04-01 23:00:35,494] Trial 40 finished with value: 6242.2708725488 and parameters: {'model_name': 'KNNImputer', 'weights': 'distance', 'keep_empty_features': False}. Best is trial 4 with value: 6240.367438135623.
[I 2024-04-01 23:00:36,586] Trial 37 finished with value: 6240.367438135623 and parameters: {'model_name': 'KNNImputer', 'weights': 'uniform', 'keep_empty_features': False}. Best is trial 4 with value: 6240.367438135623.
[I 2024-04-01 23:00:38,078] Trial 52 finished with value: 6240.367438135623 and parameters: {'model_name': 'KNNImputer', 'weights': 'uniform', 'keep_empty_features': False}. Best is trial 4 with value: 6240.367438135623.
[I 2024-04-01 23:00:38,892] Trial 54 finished with value: 6242.2708725488 and parameters: {'model_name': 'KNNImputer', 'weights': 'distance', 'keep_empty_features': False}. Best is trial 4 with value: 6240.367438135623.
[I 2024-04-01 23:00:50,155] Trial 59 finished with value: 6240.367438135623 and parameters: {'model_name': 'KNNImputer', 'weights': 'uniform', 'keep_empty_features': False}. Best is trial 4 with value: 6240.367438135623.
[I 2024-04-01 23:01:12,200] Trial 60 finished with value: 6240.367438135623 and parameters: {'model_name': 'KNNImputer', 'weights': 'uniform', 'keep_empty_features': False}. Best is trial 4 with value: 6240.367438135623.
[I 2024-04-01 23:01:15,000] Trial 61 finished with value: 6240.367438135623 and parameters: {'model_name': 'KNNImputer', 'weights': 'uniform', 'keep_empty_features': False}. Best is trial 4 with value: 6240.367438135623.
[I 2024-04-01 23:01:16,145] Trial 62 finished with value: 6240.367438135623 and parameters: {'model_name': 'KNNImputer', 'weights': 'uniform', 'keep_empty_features': False}. Best is trial 4 with value: 6240.367438135623.
[I 2024-04-01 23:01:20,622] Trial 73 finished with value: 6907.958308626808 and parameters: {'model_name': 'RandomForestImputer', 'max_iter': 1, 'decreasing': True, 'min_samples_split': 0.8, 'min_samples_leaf': 0.6, 'max_features': 0.2, 'warm_start': True}. Best is trial 4 with value: 6240.367438135623.
[I 2024-04-01 23:01:41,839] Trial 2 finished with value: 248489.0396675637 and parameters: {'model_name': 'GAIN', 'batch_size': 100, 'hint_rate': 0.85, 'alpha': 2, 'iterations': 1}. Best is trial 4 with value: 6240.367438135623.
[I 2024-04-01 23:01:44,477] Trial 34 finished with value: 7116.8860766062035 and parameters: {'model_name': 'RandomForestImputer', 'max_iter': 2, 'decreasing': True, 'min_samples_split': 0.5, 'min_samples_leaf': 0.4, 'max_features': 0.1, 'warm_start': True}. Best is trial 4 with value: 6240.367438135623.
[I 2024-04-01 23:01:52,606] Trial 43 finished with value: 305988.986309461 and parameters: {'model_name': 'GAIN', 'batch_size': 4, 'hint_rate': 0.7100000000000001, 'alpha': 98, 'iterations': 4}. Best is trial 4 with value: 6240.367438135623.
[I 2024-04-01 23:02:02,341] Trial 64 finished with value: 311830.9537889691 and parameters: {'model_name': 'GAIN', 'batch_size': 9, 'hint_rate': 0.67, 'alpha': 100, 'iterations': 1}. Best is trial 4 with value: 6240.367438135623.
[I 2024-04-01 23:02:04,615] Trial 66 finished with value: 330860.6766129324 and parameters: {'model_name': 'GAIN', 'batch_size': 555, 'hint_rate': 0.01, 'alpha': 95, 'iterations': 1}. Best is trial 4 with value: 6240.367438135623.
[I 2024-04-01 23:02:43,231] Trial 35 finished with value: 7116.886096569838 and parameters: {'model_name': 'RandomForestImputer', 'max_iter': 6, 'decreasing': True, 'min_samples_split': 0.4, 'min_samples_leaf': 0.7000000000000001, 'max_features': 0.2, 'warm_start': True}. Best is trial 4 with value: 6240.367438135623.
[I 2024-04-01 23:02:59,845] Trial 42 finished with value: 6907.958308626808 and parameters: {'model_name': 'RandomForestImputer', 'max_iter': 1, 'decreasing': False, 'min_samples_split': 0.7000000000000001, 'min_samples_leaf': 0.7000000000000001, 'max_features': 0.2, 'warm_start': False}. Best is trial 4 with value: 6240.367438135623.
[I 2024-04-01 23:03:01,497] Trial 38 finished with value: 6907.958308626808 and parameters: {'model_name': 'RandomForestImputer', 'max_iter': 1, 'decreasing': True, 'min_samples_split': 1.0, 'min_samples_leaf': 0.7000000000000001, 'max_features': 0.8, 'warm_start': False}. Best is trial 4 with value: 6240.367438135623.
[I 2024-04-01 23:03:02,187] Trial 28 finished with value: 6907.958308626808 and parameters: {'model_name': 'RandomForestImputer', 'max_iter': 1, 'decreasing': False, 'min_samples_split': 0.30000000000000004, 'min_samples_leaf': 0.5, 'max_features': 0.9, 'warm_start': False}. Best is trial 4 with value: 6240.367438135623.
[I 2024-04-01 23:03:04,843] Trial 15 finished with value: 7410.9201337891045 and parameters: {'model_name': 'IterativeImputer', 'sample_posterior': False, 'initial_strategy': 'median', 'imputation_order': 'descending'}. Best is trial 4 with value: 6240.367438135623.
[I 2024-04-01 23:03:06,612] Trial 19 finished with value: 7410.8574663867275 and parameters: {'model_name': 'IterativeImputer', 'sample_posterior': False, 'initial_strategy': 'mean', 'imputation_order': 'descending'}. Best is trial 4 with value: 6240.367438135623.
[I 2024-04-01 23:03:08,547] Trial 51 finished with value: 7419.216711830719 and parameters: {'model_name': 'IterativeImputer', 'sample_posterior': False, 'initial_strategy': 'most_frequent', 'imputation_order': 'arabic'}. Best is trial 4 with value: 6240.367438135623.
[I 2024-04-01 23:03:10,471] Trial 57 finished with value: 7410.9201337891045 and parameters: {'model_name': 'IterativeImputer', 'sample_posterior': False, 'initial_strategy': 'median', 'imputation_order': 'descending'}. Best is trial 4 with value: 6240.367438135623.
[I 2024-04-01 23:03:18,664] Trial 63 finished with value: 7920.751182394316 and parameters: {'model_name': 'RandomForestImputer', 'max_iter': 4, 'decreasing': False, 'min_samples_split': 0.30000000000000004, 'min_samples_leaf': 0.1, 'max_features': 0.4, 'warm_start': True}. Best is trial 4 with value: 6240.367438135623.
[I 2024-04-01 23:03:25,078] Trial 58 finished with value: 243480.41786546918 and parameters: {'model_name': 'GAIN', 'batch_size': 758, 'hint_rate': 0.64, 'alpha': 63, 'iterations': 27}. Best is trial 4 with value: 6240.367438135623.
[I 2024-04-01 23:03:47,267] Trial 89 finished with value: 6240.367438135623 and parameters: {'model_name': 'KNNImputer', 'weights': 'uniform', 'keep_empty_features': False}. Best is trial 4 with value: 6240.367438135623.
[I 2024-04-01 23:03:49,326] Trial 90 finished with value: 6240.367438135623 and parameters: {'model_name': 'KNNImputer', 'weights': 'uniform', 'keep_empty_features': False}. Best is trial 4 with value: 6240.367438135623.
[I 2024-04-01 23:03:57,155] Trial 3 finished with value: 7418.169429828663 and parameters: {'model_name': 'IterativeImputer', 'sample_posterior': False, 'initial_strategy': 'constant', 'imputation_order': 'ascending'}. Best is trial 4 with value: 6240.367438135623.
[I 2024-04-01 23:04:00,392] Trial 91 finished with value: 6240.367438135623 and parameters: {'model_name': 'KNNImputer', 'weights': 'uniform', 'keep_empty_features': False}. Best is trial 4 with value: 6240.367438135623.
[I 2024-04-01 23:04:08,001] Trial 92 finished with value: 6240.367438135623 and parameters: {'model_name': 'KNNImputer', 'weights': 'uniform', 'keep_empty_features': False}. Best is trial 4 with value: 6240.367438135623.
[I 2024-04-01 23:04:27,594] Trial 93 finished with value: 6240.367438135623 and parameters: {'model_name': 'KNNImputer', 'weights': 'uniform', 'keep_empty_features': False}. Best is trial 4 with value: 6240.367438135623.
[I 2024-04-01 23:04:31,716] Trial 94 finished with value: 6240.367438135623 and parameters: {'model_name': 'KNNImputer', 'weights': 'uniform', 'keep_empty_features': False}. Best is trial 4 with value: 6240.367438135623.
[I 2024-04-01 23:04:37,495] Trial 70 finished with value: 7418.192335151914 and parameters: {'model_name': 'IterativeImputer', 'sample_posterior': False, 'initial_strategy': 'most_frequent', 'imputation_order': 'ascending'}. Best is trial 4 with value: 6240.367438135623.
[I 2024-04-01 23:04:40,093] Trial 95 finished with value: 6240.367438135623 and parameters: {'model_name': 'KNNImputer', 'weights': 'uniform', 'keep_empty_features': False}. Best is trial 4 with value: 6240.367438135623.
[I 2024-04-01 23:04:44,838] Trial 96 finished with value: 6240.367438135623 and parameters: {'model_name': 'KNNImputer', 'weights': 'uniform', 'keep_empty_features': False}. Best is trial 4 with value: 6240.367438135623.
[I 2024-04-01 23:04:52,796] Trial 97 finished with value: 6240.367438135623 and parameters: {'model_name': 'KNNImputer', 'weights': 'uniform', 'keep_empty_features': False}. Best is trial 4 with value: 6240.367438135623.
[I 2024-04-01 23:05:08,326] Trial 76 finished with value: 7347.73073528074 and parameters: {'model_name': 'IterativeImputer', 'sample_posterior': False, 'initial_strategy': 'most_frequent', 'imputation_order': 'random'}. Best is trial 4 with value: 6240.367438135623.
[I 2024-04-01 23:05:15,744] Trial 98 finished with value: 6240.367438135623 and parameters: {'model_name': 'KNNImputer', 'weights': 'uniform', 'keep_empty_features': False}. Best is trial 4 with value: 6240.367438135623.
[I 2024-04-01 23:05:21,222] Trial 99 finished with value: 6240.367438135623 and parameters: {'model_name': 'KNNImputer', 'weights': 'uniform', 'keep_empty_features': False}. Best is trial 4 with value: 6240.367438135623.
[I 2024-04-01 23:05:26,199] Trial 100 finished with value: 6240.367438135623 and parameters: {'model_name': 'KNNImputer', 'weights': 'uniform', 'keep_empty_features': False}. Best is trial 4 with value: 6240.367438135623.
[I 2024-04-01 23:05:28,529] Trial 101 finished with value: 6240.367438135623 and parameters: {'model_name': 'KNNImputer', 'weights': 'uniform', 'keep_empty_features': False}. Best is trial 4 with value: 6240.367438135623.
[I 2024-04-01 23:05:32,035] Trial 82 finished with value: 7410.9201337891045 and parameters: {'model_name': 'IterativeImputer', 'sample_posterior': False, 'initial_strategy': 'median', 'imputation_order': 'descending'}. Best is trial 4 with value: 6240.367438135623.
[I 2024-04-01 23:05:35,796] Trial 102 finished with value: 6240.367438135623 and parameters: {'model_name': 'KNNImputer', 'weights': 'uniform', 'keep_empty_features': False}. Best is trial 4 with value: 6240.367438135623.
[I 2024-04-01 23:05:43,033] Trial 103 finished with value: 6240.367438135623 and parameters: {'model_name': 'KNNImputer', 'weights': 'uniform', 'keep_empty_features': False}. Best is trial 4 with value: 6240.367438135623.
[I 2024-04-01 23:05:58,161] Trial 104 finished with value: 6240.367438135623 and parameters: {'model_name': 'KNNImputer', 'weights': 'uniform', 'keep_empty_features': False}. Best is trial 4 with value: 6240.367438135623.
[I 2024-04-01 23:06:05,112] Trial 105 finished with value: 6240.367438135623 and parameters: {'model_name': 'KNNImputer', 'weights': 'uniform', 'keep_empty_features': False}. Best is trial 4 with value: 6240.367438135623.
[I 2024-04-01 23:06:10,602] Trial 106 finished with value: 6240.367438135623 and parameters: {'model_name': 'KNNImputer', 'weights': 'uniform', 'keep_empty_features': False}. Best is trial 4 with value: 6240.367438135623.
[I 2024-04-01 23:06:15,748] Trial 107 finished with value: 6240.367438135623 and parameters: {'model_name': 'KNNImputer', 'weights': 'uniform', 'keep_empty_features': False}. Best is trial 4 with value: 6240.367438135623.
[I 2024-04-01 23:06:18,449] Trial 108 finished with value: 6240.367438135623 and parameters: {'model_name': 'KNNImputer', 'weights': 'uniform', 'keep_empty_features': False}. Best is trial 4 with value: 6240.367438135623.
[I 2024-04-01 23:06:22,544] Trial 109 finished with value: 6240.367438135623 and parameters: {'model_name': 'KNNImputer', 'weights': 'uniform', 'keep_empty_features': False}. Best is trial 4 with value: 6240.367438135623.
[I 2024-04-01 23:06:26,274] Trial 110 finished with value: 6240.367438135623 and parameters: {'model_name': 'KNNImputer', 'weights': 'uniform', 'keep_empty_features': False}. Best is trial 4 with value: 6240.367438135623.
[I 2024-04-01 23:06:32,777] Trial 111 finished with value: 6240.367438135623 and parameters: {'model_name': 'KNNImputer', 'weights': 'uniform', 'keep_empty_features': False}. Best is trial 4 with value: 6240.367438135623.
[I 2024-04-01 23:06:49,328] Trial 112 finished with value: 6240.367438135623 and parameters: {'model_name': 'KNNImputer', 'weights': 'uniform', 'keep_empty_features': False}. Best is trial 4 with value: 6240.367438135623.
[I 2024-04-01 23:06:55,688] Trial 69 finished with value: 7116.885576291124 and parameters: {'model_name': 'RandomForestImputer', 'max_iter': 12, 'decreasing': True, 'min_samples_split': 0.8, 'min_samples_leaf': 0.2, 'max_features': 0.30000000000000004, 'warm_start': True}. Best is trial 4 with value: 6240.367438135623.
[I 2024-04-01 23:06:56,495] Trial 113 finished with value: 6240.367438135623 and parameters: {'model_name': 'KNNImputer', 'weights': 'uniform', 'keep_empty_features': False}. Best is trial 4 with value: 6240.367438135623.
[I 2024-04-01 23:07:02,914] Trial 114 finished with value: 6242.2708725488 and parameters: {'model_name': 'KNNImputer', 'weights': 'distance', 'keep_empty_features': False}. Best is trial 4 with value: 6240.367438135623.
[I 2024-04-01 23:07:08,932] Trial 115 finished with value: 6242.2708725488 and parameters: {'model_name': 'KNNImputer', 'weights': 'distance', 'keep_empty_features': False}. Best is trial 4 with value: 6240.367438135623.
[I 2024-04-01 23:07:09,915] Trial 116 finished with value: 6242.2708725488 and parameters: {'model_name': 'KNNImputer', 'weights': 'distance', 'keep_empty_features': False}. Best is trial 4 with value: 6240.367438135623.
[I 2024-04-01 23:07:15,987] Trial 117 finished with value: 6242.2708725488 and parameters: {'model_name': 'KNNImputer', 'weights': 'distance', 'keep_empty_features': False}. Best is trial 4 with value: 6240.367438135623.
[I 2024-04-01 23:07:18,176] Trial 118 finished with value: 6242.2708725488 and parameters: {'model_name': 'KNNImputer', 'weights': 'distance', 'keep_empty_features': False}. Best is trial 4 with value: 6240.367438135623.
[I 2024-04-01 23:07:22,995] Trial 119 finished with value: 6242.2708725488 and parameters: {'model_name': 'KNNImputer', 'weights': 'distance', 'keep_empty_features': False}. Best is trial 4 with value: 6240.367438135623.
[I 2024-04-01 23:07:35,139] Trial 120 finished with value: 6242.2708725488 and parameters: {'model_name': 'KNNImputer', 'weights': 'distance', 'keep_empty_features': False}. Best is trial 4 with value: 6240.367438135623.
[I 2024-04-01 23:07:39,635] Trial 121 finished with value: 6242.2708725488 and parameters: {'model_name': 'KNNImputer', 'weights': 'distance', 'keep_empty_features': False}. Best is trial 4 with value: 6240.367438135623.
[I 2024-04-01 23:07:46,783] Trial 125 finished with value: 6240.367438135623 and parameters: {'model_name': 'KNNImputer', 'weights': 'uniform', 'keep_empty_features': False}. Best is trial 4 with value: 6240.367438135623.
[I 2024-04-01 23:07:51,264] Trial 85 finished with value: 7373.423675828919 and parameters: {'model_name': 'IterativeImputer', 'sample_posterior': False, 'initial_strategy': 'median', 'imputation_order': 'random'}. Best is trial 4 with value: 6240.367438135623.
[I 2024-04-01 23:07:58,518] Trial 86 finished with value: 7418.192335151914 and parameters: {'model_name': 'IterativeImputer', 'sample_posterior': False, 'initial_strategy': 'most_frequent', 'imputation_order': 'ascending'}. Best is trial 4 with value: 6240.367438135623.
[I 2024-04-01 23:08:33,369] Trial 27 finished with value: 7116.886102045185 and parameters: {'model_name': 'RandomForestImputer', 'max_iter': 32, 'decreasing': True, 'min_samples_split': 0.6000000000000001, 'min_samples_leaf': 0.8, 'max_features': 0.30000000000000004, 'warm_start': True}. Best is trial 4 with value: 6240.367438135623.
[I 2024-04-01 23:09:54,673] Trial 21 finished with value: 7587.57666023988 and parameters: {'model_name': 'RandomForestImputer', 'max_iter': 87, 'decreasing': False, 'min_samples_split': 0.2, 'min_samples_leaf': 0.5, 'max_features': 0.1, 'warm_start': True}. Best is trial 4 with value: 6240.367438135623.
[I 2024-04-01 23:11:07,614] Trial 68 finished with value: 7116.885346228681 and parameters: {'model_name': 'RandomForestImputer', 'max_iter': 96, 'decreasing': True, 'min_samples_split': 0.8, 'min_samples_leaf': 0.30000000000000004, 'max_features': 0.4, 'warm_start': True}. Best is trial 4 with value: 6240.367438135623.
[I 2024-04-01 23:11:34,360] Trial 1 finished with value: 6699.137109585757 and parameters: {'model_name': 'RandomForestImputer', 'max_iter': 4, 'decreasing': False, 'min_samples_split': 0.8, 'min_samples_leaf': 0.30000000000000004, 'max_features': 0.7000000000000001, 'warm_start': False}. Best is trial 4 with value: 6240.367438135623.
[I 2024-04-01 23:11:37,565] Trial 65 finished with value: 6646.255477689818 and parameters: {'model_name': 'RandomForestImputer', 'max_iter': 4, 'decreasing': True, 'min_samples_split': 0.30000000000000004, 'min_samples_leaf': 0.2, 'max_features': 0.5, 'warm_start': False}. Best is trial 4 with value: 6240.367438135623.
