Run: 11
/cm/local/apps/slurm/var/spool/job675329/slurm_script: line 23: /common/ketrong/minconda3/etc/profile.d/conda.sh: No such file or directory
/cm/local/apps/slurm/var/spool/job675329/slurm_script: line 26: $'\nconda create --name tpot2devenv -c conda-forge python=3.10\n': command not found
/cm/local/apps/slurm/var/spool/job675329/slurm_script: line 31: $'\npip install -r requirements.txt\n': command not found
RunStart
2024-02-23 07:21:13.031370: I tensorflow/core/util/port.cc:113] oneDNN custom operations are on. You may see slightly different numerical results due to floating-point round-off errors from different computation orders. To turn them off, set the environment variable `TF_ENABLE_ONEDNN_OPTS=0`.
2024-02-23 07:21:13.065662: E external/local_xla/xla/stream_executor/cuda/cuda_dnn.cc:9261] Unable to register cuDNN factory: Attempting to register factory for plugin cuDNN when one has already been registered
2024-02-23 07:21:13.065683: E external/local_xla/xla/stream_executor/cuda/cuda_fft.cc:607] Unable to register cuFFT factory: Attempting to register factory for plugin cuFFT when one has already been registered
2024-02-23 07:21:13.066809: E external/local_xla/xla/stream_executor/cuda/cuda_blas.cc:1515] Unable to register cuBLAS factory: Attempting to register factory for plugin cuBLAS when one has already been registered
2024-02-23 07:21:13.072360: I tensorflow/core/platform/cpu_feature_guard.cc:182] This TensorFlow binary is optimized to use available CPU instructions in performance-critical operations.
To enable the following instructions: AVX2 AVX512F AVX512_VNNI FMA, in other operations, rebuild TensorFlow with the appropriate compiler flags.
2024-02-23 07:21:15.113667: W tensorflow/compiler/tf2tensorrt/utils/py_utils.cc:38] TF-TRT Warning: Could not find TensorRT
WARNING:tensorflow:From /home/ketrong/miniconda3/envs/tpot2devenv/lib/python3.10/site-packages/tensorflow/python/compat/v2_compat.py:108: disable_resource_variables (from tensorflow.python.ops.variable_scope) is deprecated and will be removed in a future version.
Instructions for updating:
non-resource variables are not supported in the long term
starting loops
working on 
logs/2307/tpot2_base_normal_MNAR_0.01
0.3048412799835205
loading data
logs/2307/tpot2_base_normal_MNAR_0.01/data/2307_True.pkl
6856     0.017
7671     0.027
2579     0.017
6768     0.017
9881     0.017
         ...  
4940     0.017
10883    0.018
16195    0.016
9294     0.023
7128     0.018
Name: Goal, Length: 14939, dtype: float64
          0   ...      17
0      -46.0  ... -0.0006
1      -96.0  ... -0.0009
2     -474.0  ... -0.0010
3      180.0  ... -0.0004
4      207.0  ... -0.0002
...      ...  ...     ...
14934 -378.0  ... -0.0006
14935  116.0  ... -0.0004
14936  -71.0  ... -0.0005
14937 -479.0  ... -0.0007
14938   44.0  ... -0.0005

[14939 rows x 18 columns]
         0   ...      17
0      57.0  ... -0.0003
1    -252.0  ... -0.0008
2     349.0  ... -0.0004
3    -123.0  ... -0.0003
4      27.0  ... -0.0004
...     ...  ...     ...
1655 -311.0  ... -0.0010
1656   32.0  ... -0.0010
1657 -711.0  ... -0.0012
1658 -121.0  ... -0.0011
1659  477.0  ... -0.0010

[1660 rows x 18 columns]
running experiment 1/3 - Does large hyperparameter space improve reconstruction accuracy over simple
[I 2024-02-23 07:21:31,517] A new study created in memory with name: no-name-ce468d00-ee17-4f74-932e-f1f81c41dd27
[I 2024-02-23 07:21:32,717] Trial 2 finished with value: 68.18390502235356 and parameters: {'model_name': 'SimpleImputer', 'strategy': 'constant'}. Best is trial 2 with value: 68.18390502235356.
[I 2024-02-23 07:21:33,363] Trial 6 finished with value: 68.18390502235356 and parameters: {'model_name': 'SimpleImputer', 'strategy': 'constant'}. Best is trial 2 with value: 68.18390502235356.
[I 2024-02-23 07:21:33,873] Trial 10 finished with value: 67.9161037524623 and parameters: {'model_name': 'SimpleImputer', 'strategy': 'mean'}. Best is trial 10 with value: 67.9161037524623.
[I 2024-02-23 07:21:34,155] Trial 16 finished with value: 68.18390502235356 and parameters: {'model_name': 'SimpleImputer', 'strategy': 'constant'}. Best is trial 10 with value: 67.9161037524623.
[I 2024-02-23 07:21:34,456] Trial 18 finished with value: 68.18390502235356 and parameters: {'model_name': 'SimpleImputer', 'strategy': 'constant'}. Best is trial 10 with value: 67.9161037524623.
[I 2024-02-23 07:21:34,730] Trial 4 finished with value: 67.9161037524623 and parameters: {'model_name': 'SimpleImputer', 'strategy': 'mean'}. Best is trial 10 with value: 67.9161037524623.
[I 2024-02-23 07:21:34,912] Trial 15 finished with value: 68.18390502235356 and parameters: {'model_name': 'SimpleImputer', 'strategy': 'constant'}. Best is trial 10 with value: 67.9161037524623.
[I 2024-02-23 07:21:35,269] Trial 5 finished with value: 67.9161037524623 and parameters: {'model_name': 'SimpleImputer', 'strategy': 'mean'}. Best is trial 10 with value: 67.9161037524623.
[I 2024-02-23 07:21:35,681] Trial 9 finished with value: 67.9161037524623 and parameters: {'model_name': 'SimpleImputer', 'strategy': 'mean'}. Best is trial 10 with value: 67.9161037524623.
[I 2024-02-23 07:21:36,043] Trial 3 finished with value: 67.9161037524623 and parameters: {'model_name': 'SimpleImputer', 'strategy': 'mean'}. Best is trial 10 with value: 67.9161037524623.
[I 2024-02-23 07:21:36,278] Trial 36 finished with value: 68.18390502235356 and parameters: {'model_name': 'SimpleImputer', 'strategy': 'constant'}. Best is trial 10 with value: 67.9161037524623.
[I 2024-02-23 07:21:36,489] Trial 33 finished with value: 68.18390502235356 and parameters: {'model_name': 'SimpleImputer', 'strategy': 'constant'}. Best is trial 10 with value: 67.9161037524623.
[I 2024-02-23 07:21:36,669] Trial 11 finished with value: 67.9161037524623 and parameters: {'model_name': 'SimpleImputer', 'strategy': 'mean'}. Best is trial 10 with value: 67.9161037524623.
[I 2024-02-23 07:21:37,053] Trial 32 finished with value: 68.18390502235356 and parameters: {'model_name': 'SimpleImputer', 'strategy': 'constant'}. Best is trial 10 with value: 67.9161037524623.
[I 2024-02-23 07:21:37,316] Trial 44 finished with value: 68.18390502235356 and parameters: {'model_name': 'SimpleImputer', 'strategy': 'constant'}. Best is trial 10 with value: 67.9161037524623.
[I 2024-02-23 07:21:37,511] Trial 42 finished with value: 68.18390502235356 and parameters: {'model_name': 'SimpleImputer', 'strategy': 'constant'}. Best is trial 10 with value: 67.9161037524623.
[I 2024-02-23 07:21:37,902] Trial 43 finished with value: 68.18390502235356 and parameters: {'model_name': 'SimpleImputer', 'strategy': 'constant'}. Best is trial 10 with value: 67.9161037524623.
[I 2024-02-23 07:21:38,160] Trial 41 finished with value: 68.18390502235356 and parameters: {'model_name': 'SimpleImputer', 'strategy': 'constant'}. Best is trial 10 with value: 67.9161037524623.
[I 2024-02-23 07:21:38,365] Trial 20 finished with value: 67.9161037524623 and parameters: {'model_name': 'SimpleImputer', 'strategy': 'mean'}. Best is trial 10 with value: 67.9161037524623.
[I 2024-02-23 07:21:38,738] Trial 47 finished with value: 68.18390502235356 and parameters: {'model_name': 'SimpleImputer', 'strategy': 'constant'}. Best is trial 10 with value: 67.9161037524623.
[I 2024-02-23 07:21:38,973] Trial 21 finished with value: 67.9161037524623 and parameters: {'model_name': 'SimpleImputer', 'strategy': 'mean'}. Best is trial 10 with value: 67.9161037524623.
[I 2024-02-23 07:21:39,227] Trial 12 finished with value: 67.8595062041787 and parameters: {'model_name': 'SimpleImputer', 'strategy': 'median'}. Best is trial 12 with value: 67.8595062041787.
[I 2024-02-23 07:21:39,465] Trial 28 finished with value: 67.9161037524623 and parameters: {'model_name': 'SimpleImputer', 'strategy': 'mean'}. Best is trial 12 with value: 67.8595062041787.
[I 2024-02-23 07:21:39,743] Trial 7 finished with value: 67.8595062041787 and parameters: {'model_name': 'SimpleImputer', 'strategy': 'median'}. Best is trial 12 with value: 67.8595062041787.
[I 2024-02-23 07:21:40,159] Trial 1 finished with value: 67.8595062041787 and parameters: {'model_name': 'SimpleImputer', 'strategy': 'median'}. Best is trial 12 with value: 67.8595062041787.
[I 2024-02-23 07:21:40,449] Trial 8 finished with value: 67.8595062041787 and parameters: {'model_name': 'SimpleImputer', 'strategy': 'median'}. Best is trial 12 with value: 67.8595062041787.
[I 2024-02-23 07:21:41,115] Trial 30 finished with value: 67.8595062041787 and parameters: {'model_name': 'SimpleImputer', 'strategy': 'median'}. Best is trial 12 with value: 67.8595062041787.
[I 2024-02-23 07:21:41,410] Trial 50 finished with value: 68.18390502235356 and parameters: {'model_name': 'SimpleImputer', 'strategy': 'constant'}. Best is trial 12 with value: 67.8595062041787.
[I 2024-02-23 07:21:41,666] Trial 25 finished with value: 67.8595062041787 and parameters: {'model_name': 'SimpleImputer', 'strategy': 'median'}. Best is trial 12 with value: 67.8595062041787.
[I 2024-02-23 07:21:41,863] Trial 23 finished with value: 67.8595062041787 and parameters: {'model_name': 'SimpleImputer', 'strategy': 'median'}. Best is trial 12 with value: 67.8595062041787.
[I 2024-02-23 07:21:42,072] Trial 22 finished with value: 67.8595062041787 and parameters: {'model_name': 'SimpleImputer', 'strategy': 'median'}. Best is trial 12 with value: 67.8595062041787.
[I 2024-02-23 07:21:42,257] Trial 35 finished with value: 67.8595062041787 and parameters: {'model_name': 'SimpleImputer', 'strategy': 'median'}. Best is trial 12 with value: 67.8595062041787.
[I 2024-02-23 07:21:42,521] Trial 27 finished with value: 67.8595062041787 and parameters: {'model_name': 'SimpleImputer', 'strategy': 'median'}. Best is trial 12 with value: 67.8595062041787.
[I 2024-02-23 07:21:42,768] Trial 48 finished with value: 67.9161037524623 and parameters: {'model_name': 'SimpleImputer', 'strategy': 'mean'}. Best is trial 12 with value: 67.8595062041787.
[I 2024-02-23 07:21:43,010] Trial 17 finished with value: 67.8595062041787 and parameters: {'model_name': 'SimpleImputer', 'strategy': 'median'}. Best is trial 12 with value: 67.8595062041787.
[I 2024-02-23 07:21:43,301] Trial 31 finished with value: 67.8595062041787 and parameters: {'model_name': 'SimpleImputer', 'strategy': 'median'}. Best is trial 12 with value: 67.8595062041787.
[I 2024-02-23 07:21:43,589] Trial 40 finished with value: 67.8595062041787 and parameters: {'model_name': 'SimpleImputer', 'strategy': 'median'}. Best is trial 12 with value: 67.8595062041787.
[I 2024-02-23 07:21:43,869] Trial 26 finished with value: 67.8595062041787 and parameters: {'model_name': 'SimpleImputer', 'strategy': 'median'}. Best is trial 12 with value: 67.8595062041787.
[I 2024-02-23 07:21:44,295] Trial 45 finished with value: 67.8595062041787 and parameters: {'model_name': 'SimpleImputer', 'strategy': 'median'}. Best is trial 12 with value: 67.8595062041787.
[I 2024-02-23 07:21:44,580] Trial 52 finished with value: 67.9161037524623 and parameters: {'model_name': 'SimpleImputer', 'strategy': 'mean'}. Best is trial 12 with value: 67.8595062041787.
[I 2024-02-23 07:21:44,892] Trial 38 finished with value: 67.8595062041787 and parameters: {'model_name': 'SimpleImputer', 'strategy': 'median'}. Best is trial 12 with value: 67.8595062041787.
[I 2024-02-23 07:21:45,501] Trial 39 finished with value: 67.8595062041787 and parameters: {'model_name': 'SimpleImputer', 'strategy': 'median'}. Best is trial 12 with value: 67.8595062041787.
[I 2024-02-23 07:21:46,069] Trial 54 finished with value: 67.8595062041787 and parameters: {'model_name': 'SimpleImputer', 'strategy': 'median'}. Best is trial 12 with value: 67.8595062041787.
[I 2024-02-23 07:21:46,283] Trial 55 finished with value: 67.8595062041787 and parameters: {'model_name': 'SimpleImputer', 'strategy': 'median'}. Best is trial 12 with value: 67.8595062041787.
[I 2024-02-23 07:21:47,083] Trial 56 finished with value: 67.8595062041787 and parameters: {'model_name': 'SimpleImputer', 'strategy': 'median'}. Best is trial 12 with value: 67.8595062041787.
[I 2024-02-23 07:21:47,558] Trial 62 finished with value: 67.8595062041787 and parameters: {'model_name': 'SimpleImputer', 'strategy': 'median'}. Best is trial 12 with value: 67.8595062041787.
[I 2024-02-23 07:21:47,841] Trial 58 finished with value: 67.8595062041787 and parameters: {'model_name': 'SimpleImputer', 'strategy': 'median'}. Best is trial 12 with value: 67.8595062041787.
[I 2024-02-23 07:21:48,135] Trial 63 finished with value: 67.8595062041787 and parameters: {'model_name': 'SimpleImputer', 'strategy': 'median'}. Best is trial 12 with value: 67.8595062041787.
[I 2024-02-23 07:21:48,345] Trial 71 finished with value: 67.8595062041787 and parameters: {'model_name': 'SimpleImputer', 'strategy': 'median'}. Best is trial 12 with value: 67.8595062041787.
[I 2024-02-23 07:21:48,701] Trial 67 finished with value: 67.8595062041787 and parameters: {'model_name': 'SimpleImputer', 'strategy': 'median'}. Best is trial 12 with value: 67.8595062041787.
[I 2024-02-23 07:21:48,980] Trial 70 finished with value: 67.8595062041787 and parameters: {'model_name': 'SimpleImputer', 'strategy': 'median'}. Best is trial 12 with value: 67.8595062041787.
[I 2024-02-23 07:21:49,434] Trial 69 finished with value: 67.8595062041787 and parameters: {'model_name': 'SimpleImputer', 'strategy': 'median'}. Best is trial 12 with value: 67.8595062041787.
[I 2024-02-23 07:21:50,011] Trial 73 finished with value: 67.8595062041787 and parameters: {'model_name': 'SimpleImputer', 'strategy': 'median'}. Best is trial 12 with value: 67.8595062041787.
[I 2024-02-23 07:21:50,288] Trial 72 finished with value: 67.8595062041787 and parameters: {'model_name': 'SimpleImputer', 'strategy': 'median'}. Best is trial 12 with value: 67.8595062041787.
[I 2024-02-23 07:21:50,832] Trial 74 finished with value: 67.8595062041787 and parameters: {'model_name': 'SimpleImputer', 'strategy': 'median'}. Best is trial 12 with value: 67.8595062041787.
[I 2024-02-23 07:21:51,178] Trial 75 finished with value: 67.8595062041787 and parameters: {'model_name': 'SimpleImputer', 'strategy': 'median'}. Best is trial 12 with value: 67.8595062041787.
[I 2024-02-23 07:21:51,998] Trial 0 finished with value: 68.08236340261064 and parameters: {'model_name': 'SimpleImputer', 'strategy': 'most_frequent'}. Best is trial 12 with value: 67.8595062041787.
[I 2024-02-23 07:21:53,041] Trial 29 finished with value: 68.08236340261064 and parameters: {'model_name': 'SimpleImputer', 'strategy': 'most_frequent'}. Best is trial 12 with value: 67.8595062041787.
[I 2024-02-23 07:21:53,252] Trial 13 finished with value: 68.08236340261064 and parameters: {'model_name': 'SimpleImputer', 'strategy': 'most_frequent'}. Best is trial 12 with value: 67.8595062041787.
[I 2024-02-23 07:21:53,536] Trial 34 finished with value: 68.08236340261064 and parameters: {'model_name': 'SimpleImputer', 'strategy': 'most_frequent'}. Best is trial 12 with value: 67.8595062041787.
[I 2024-02-23 07:21:53,845] Trial 14 finished with value: 68.08236340261064 and parameters: {'model_name': 'SimpleImputer', 'strategy': 'most_frequent'}. Best is trial 12 with value: 67.8595062041787.
[I 2024-02-23 07:21:54,169] Trial 24 finished with value: 68.08236340261064 and parameters: {'model_name': 'SimpleImputer', 'strategy': 'most_frequent'}. Best is trial 12 with value: 67.8595062041787.
[I 2024-02-23 07:21:55,034] Trial 19 finished with value: 68.08236340261064 and parameters: {'model_name': 'SimpleImputer', 'strategy': 'most_frequent'}. Best is trial 12 with value: 67.8595062041787.
[I 2024-02-23 07:21:55,343] Trial 46 finished with value: 68.08236340261064 and parameters: {'model_name': 'SimpleImputer', 'strategy': 'most_frequent'}. Best is trial 12 with value: 67.8595062041787.
[I 2024-02-23 07:21:56,168] Trial 37 finished with value: 68.08236340261064 and parameters: {'model_name': 'SimpleImputer', 'strategy': 'most_frequent'}. Best is trial 12 with value: 67.8595062041787.
[I 2024-02-23 07:21:56,671] Trial 51 finished with value: 68.08236340261064 and parameters: {'model_name': 'SimpleImputer', 'strategy': 'most_frequent'}. Best is trial 12 with value: 67.8595062041787.
[I 2024-02-23 07:21:56,964] Trial 53 finished with value: 68.08236340261064 and parameters: {'model_name': 'SimpleImputer', 'strategy': 'most_frequent'}. Best is trial 12 with value: 67.8595062041787.
[I 2024-02-23 07:21:57,294] Trial 49 finished with value: 68.08236340261064 and parameters: {'model_name': 'SimpleImputer', 'strategy': 'most_frequent'}. Best is trial 12 with value: 67.8595062041787.
[I 2024-02-23 07:21:57,969] Trial 59 finished with value: 68.08236340261064 and parameters: {'model_name': 'SimpleImputer', 'strategy': 'most_frequent'}. Best is trial 12 with value: 67.8595062041787.
[I 2024-02-23 07:21:58,235] Trial 68 finished with value: 68.08236340261064 and parameters: {'model_name': 'SimpleImputer', 'strategy': 'most_frequent'}. Best is trial 12 with value: 67.8595062041787.
[I 2024-02-23 07:21:58,632] Trial 61 finished with value: 68.08236340261064 and parameters: {'model_name': 'SimpleImputer', 'strategy': 'most_frequent'}. Best is trial 12 with value: 67.8595062041787.
[I 2024-02-23 07:21:58,830] Trial 64 finished with value: 68.08236340261064 and parameters: {'model_name': 'SimpleImputer', 'strategy': 'most_frequent'}. Best is trial 12 with value: 67.8595062041787.
[I 2024-02-23 07:21:59,099] Trial 104 finished with value: 67.8595062041787 and parameters: {'model_name': 'SimpleImputer', 'strategy': 'median'}. Best is trial 12 with value: 67.8595062041787.
[I 2024-02-23 07:21:59,110] Trial 77 finished with value: 68.08236340261064 and parameters: {'model_name': 'SimpleImputer', 'strategy': 'most_frequent'}. Best is trial 12 with value: 67.8595062041787.
[I 2024-02-23 07:21:59,587] Trial 60 finished with value: 68.08236340261064 and parameters: {'model_name': 'SimpleImputer', 'strategy': 'most_frequent'}. Best is trial 12 with value: 67.8595062041787.
[I 2024-02-23 07:21:59,845] Trial 57 finished with value: 68.08236340261064 and parameters: {'model_name': 'SimpleImputer', 'strategy': 'most_frequent'}. Best is trial 12 with value: 67.8595062041787.
[I 2024-02-23 07:22:00,105] Trial 66 finished with value: 68.08236340261064 and parameters: {'model_name': 'SimpleImputer', 'strategy': 'most_frequent'}. Best is trial 12 with value: 67.8595062041787.
[I 2024-02-23 07:22:00,833] Trial 80 finished with value: 68.08236340261064 and parameters: {'model_name': 'SimpleImputer', 'strategy': 'most_frequent'}. Best is trial 12 with value: 67.8595062041787.
[I 2024-02-23 07:22:01,261] Trial 82 finished with value: 68.08236340261064 and parameters: {'model_name': 'SimpleImputer', 'strategy': 'most_frequent'}. Best is trial 12 with value: 67.8595062041787.
[I 2024-02-23 07:22:01,778] Trial 65 finished with value: 68.08236340261064 and parameters: {'model_name': 'SimpleImputer', 'strategy': 'most_frequent'}. Best is trial 12 with value: 67.8595062041787.
[I 2024-02-23 07:22:02,038] Trial 76 finished with value: 68.08236340261064 and parameters: {'model_name': 'SimpleImputer', 'strategy': 'most_frequent'}. Best is trial 12 with value: 67.8595062041787.
[I 2024-02-23 07:22:02,263] Trial 109 finished with value: 67.8595062041787 and parameters: {'model_name': 'SimpleImputer', 'strategy': 'median'}. Best is trial 12 with value: 67.8595062041787.
[I 2024-02-23 07:22:02,552] Trial 81 finished with value: 68.08236340261064 and parameters: {'model_name': 'SimpleImputer', 'strategy': 'most_frequent'}. Best is trial 12 with value: 67.8595062041787.
[I 2024-02-23 07:22:02,949] Trial 84 finished with value: 68.08236340261064 and parameters: {'model_name': 'SimpleImputer', 'strategy': 'most_frequent'}. Best is trial 12 with value: 67.8595062041787.
[I 2024-02-23 07:22:03,130] Trial 85 finished with value: 68.08236340261064 and parameters: {'model_name': 'SimpleImputer', 'strategy': 'most_frequent'}. Best is trial 12 with value: 67.8595062041787.
[I 2024-02-23 07:22:03,557] Trial 79 finished with value: 68.08236340261064 and parameters: {'model_name': 'SimpleImputer', 'strategy': 'most_frequent'}. Best is trial 12 with value: 67.8595062041787.
[I 2024-02-23 07:22:03,775] Trial 111 finished with value: 67.8595062041787 and parameters: {'model_name': 'SimpleImputer', 'strategy': 'median'}. Best is trial 12 with value: 67.8595062041787.
[I 2024-02-23 07:22:04,025] Trial 78 finished with value: 68.08236340261064 and parameters: {'model_name': 'SimpleImputer', 'strategy': 'most_frequent'}. Best is trial 12 with value: 67.8595062041787.
[I 2024-02-23 07:22:04,291] Trial 83 finished with value: 68.08236340261064 and parameters: {'model_name': 'SimpleImputer', 'strategy': 'most_frequent'}. Best is trial 12 with value: 67.8595062041787.
[I 2024-02-23 07:22:04,672] Trial 110 finished with value: 67.8595062041787 and parameters: {'model_name': 'SimpleImputer', 'strategy': 'median'}. Best is trial 12 with value: 67.8595062041787.
[I 2024-02-23 07:22:05,027] Trial 87 finished with value: 68.08236340261064 and parameters: {'model_name': 'SimpleImputer', 'strategy': 'most_frequent'}. Best is trial 12 with value: 67.8595062041787.
[I 2024-02-23 07:22:05,282] Trial 86 finished with value: 68.08236340261064 and parameters: {'model_name': 'SimpleImputer', 'strategy': 'most_frequent'}. Best is trial 12 with value: 67.8595062041787.
[I 2024-02-23 07:22:05,625] Trial 112 finished with value: 67.8595062041787 and parameters: {'model_name': 'SimpleImputer', 'strategy': 'median'}. Best is trial 12 with value: 67.8595062041787.
[I 2024-02-23 07:22:06,143] Trial 88 finished with value: 68.08236340261064 and parameters: {'model_name': 'SimpleImputer', 'strategy': 'most_frequent'}. Best is trial 12 with value: 67.8595062041787.
