[I 2024-04-28 15:49:51,440] Trial 187 finished with value: 13.167983522633211 and parameters: {'model_name': 'IterativeImputer', 'sample_posterior': False, 'initial_strategy': 'median', 'imputation_order': 'ascending'}. Best is trial 29 with value: 13.165073069554925.
[I 2024-04-28 15:49:53,781] Trial 54 finished with value: 16.71868413525635 and parameters: {'model_name': 'GAIN', 'batch_size': 1, 'hint_rate': 0.79, 'alpha': 17, 'iterations': 140}. Best is trial 29 with value: 13.165073069554925.
[I 2024-04-28 15:49:54,800] Trial 112 finished with value: 17.778505367185005 and parameters: {'model_name': 'IterativeImputer', 'sample_posterior': True, 'initial_strategy': 'mean', 'imputation_order': 'random'}. Best is trial 29 with value: 13.165073069554925.
[I 2024-04-28 15:49:55,883] Trial 181 finished with value: 13.167942322123462 and parameters: {'model_name': 'IterativeImputer', 'sample_posterior': False, 'initial_strategy': 'most_frequent', 'imputation_order': 'ascending'}. Best is trial 29 with value: 13.165073069554925.
[I 2024-04-28 15:49:57,315] Trial 182 finished with value: 13.167942322123462 and parameters: {'model_name': 'IterativeImputer', 'sample_posterior': False, 'initial_strategy': 'most_frequent', 'imputation_order': 'ascending'}. Best is trial 29 with value: 13.165073069554925.
[I 2024-04-28 15:49:58,526] Trial 189 finished with value: 13.168057342098924 and parameters: {'model_name': 'IterativeImputer', 'sample_posterior': False, 'initial_strategy': 'median', 'imputation_order': 'arabic'}. Best is trial 29 with value: 13.165073069554925.
[I 2024-04-28 15:49:59,758] Trial 176 finished with value: 13.168038979058673 and parameters: {'model_name': 'IterativeImputer', 'sample_posterior': False, 'initial_strategy': 'most_frequent', 'imputation_order': 'arabic'}. Best is trial 29 with value: 13.165073069554925.
[I 2024-04-28 15:50:02,151] Trial 177 finished with value: 13.168038979058673 and parameters: {'model_name': 'IterativeImputer', 'sample_posterior': False, 'initial_strategy': 'most_frequent', 'imputation_order': 'arabic'}. Best is trial 29 with value: 13.165073069554925.
[I 2024-04-28 15:50:03,224] Trial 180 finished with value: 13.168038979058673 and parameters: {'model_name': 'IterativeImputer', 'sample_posterior': False, 'initial_strategy': 'most_frequent', 'imputation_order': 'arabic'}. Best is trial 29 with value: 13.165073069554925.
[I 2024-04-28 15:50:14,910] Trial 113 finished with value: 18.550874437986856 and parameters: {'model_name': 'IterativeImputer', 'sample_posterior': True, 'initial_strategy': 'mean', 'imputation_order': 'random'}. Best is trial 29 with value: 13.165073069554925.
[I 2024-04-28 15:50:29,801] Trial 20 finished with value: 15.45160776161861 and parameters: {'model_name': 'GAIN', 'batch_size': 552, 'hint_rate': 0.02, 'alpha': 14, 'iterations': 157}. Best is trial 29 with value: 13.165073069554925.
[I 2024-04-28 15:51:14,826] Trial 61 finished with value: 16.68136258644474 and parameters: {'model_name': 'GAIN', 'batch_size': 349, 'hint_rate': 0.65, 'alpha': 30, 'iterations': 209}. Best is trial 29 with value: 13.165073069554925.
[I 2024-04-28 15:51:18,997] Trial 185 finished with value: 13.944679471793041 and parameters: {'model_name': 'RandomForestImputer', 'max_iter': 11, 'decreasing': True, 'min_samples_split': 0.30000000000000004, 'min_samples_leaf': 0.7000000000000001, 'max_features': 0.1, 'warm_start': False}. Best is trial 29 with value: 13.165073069554925.
[I 2024-04-28 15:51:29,054] Trial 199 finished with value: 13.656196418600041 and parameters: {'model_name': 'RandomForestImputer', 'max_iter': 12, 'decreasing': True, 'min_samples_split': 0.30000000000000004, 'min_samples_leaf': 0.30000000000000004, 'max_features': 0.1, 'warm_start': False}. Best is trial 29 with value: 13.165073069554925.
[I 2024-04-28 15:51:30,157] Trial 184 finished with value: 13.944525054755278 and parameters: {'model_name': 'RandomForestImputer', 'max_iter': 10, 'decreasing': True, 'min_samples_split': 0.30000000000000004, 'min_samples_leaf': 0.7000000000000001, 'max_features': 0.1, 'warm_start': False}. Best is trial 29 with value: 13.165073069554925.
[I 2024-04-28 15:51:35,813] Trial 190 finished with value: 13.707172776100979 and parameters: {'model_name': 'RandomForestImputer', 'max_iter': 15, 'decreasing': True, 'min_samples_split': 0.30000000000000004, 'min_samples_leaf': 0.30000000000000004, 'max_features': 0.1, 'warm_start': False}. Best is trial 29 with value: 13.165073069554925.
[I 2024-04-28 15:51:42,563] Trial 186 finished with value: 13.943443357763755 and parameters: {'model_name': 'RandomForestImputer', 'max_iter': 11, 'decreasing': True, 'min_samples_split': 0.4, 'min_samples_leaf': 0.7000000000000001, 'max_features': 0.1, 'warm_start': False}. Best is trial 29 with value: 13.165073069554925.
[I 2024-04-28 15:51:43,563] Trial 191 finished with value: 13.939221422695955 and parameters: {'model_name': 'RandomForestImputer', 'max_iter': 13, 'decreasing': True, 'min_samples_split': 0.30000000000000004, 'min_samples_leaf': 0.7000000000000001, 'max_features': 0.1, 'warm_start': False}. Best is trial 29 with value: 13.165073069554925.
[I 2024-04-28 15:51:46,868] Trial 198 finished with value: 13.939228281885931 and parameters: {'model_name': 'RandomForestImputer', 'max_iter': 11, 'decreasing': True, 'min_samples_split': 0.30000000000000004, 'min_samples_leaf': 0.7000000000000001, 'max_features': 0.1, 'warm_start': False}. Best is trial 29 with value: 13.165073069554925.
[I 2024-04-28 15:51:50,595] Trial 183 finished with value: 13.942373824853874 and parameters: {'model_name': 'RandomForestImputer', 'max_iter': 13, 'decreasing': True, 'min_samples_split': 0.30000000000000004, 'min_samples_leaf': 0.7000000000000001, 'max_features': 0.1, 'warm_start': False}. Best is trial 29 with value: 13.165073069554925.
[I 2024-04-28 15:51:53,783] Trial 193 finished with value: 13.94964112568864 and parameters: {'model_name': 'RandomForestImputer', 'max_iter': 14, 'decreasing': True, 'min_samples_split': 0.30000000000000004, 'min_samples_leaf': 0.7000000000000001, 'max_features': 0.1, 'warm_start': False}. Best is trial 29 with value: 13.165073069554925.
[I 2024-04-28 15:51:57,014] Trial 192 finished with value: 13.94247566449694 and parameters: {'model_name': 'RandomForestImputer', 'max_iter': 14, 'decreasing': True, 'min_samples_split': 0.30000000000000004, 'min_samples_leaf': 0.7000000000000001, 'max_features': 0.1, 'warm_start': False}. Best is trial 29 with value: 13.165073069554925.
[I 2024-04-28 15:51:58,261] Trial 188 finished with value: 13.948903840441517 and parameters: {'model_name': 'RandomForestImputer', 'max_iter': 16, 'decreasing': True, 'min_samples_split': 0.30000000000000004, 'min_samples_leaf': 0.7000000000000001, 'max_features': 0.1, 'warm_start': False}. Best is trial 29 with value: 13.165073069554925.
[I 2024-04-28 15:52:01,898] Trial 197 finished with value: 13.948148035180319 and parameters: {'model_name': 'RandomForestImputer', 'max_iter': 14, 'decreasing': True, 'min_samples_split': 0.30000000000000004, 'min_samples_leaf': 0.7000000000000001, 'max_features': 0.1, 'warm_start': False}. Best is trial 29 with value: 13.165073069554925.
[I 2024-04-28 15:52:02,585] Trial 195 finished with value: 13.95583655956192 and parameters: {'model_name': 'RandomForestImputer', 'max_iter': 14, 'decreasing': True, 'min_samples_split': 0.30000000000000004, 'min_samples_leaf': 0.7000000000000001, 'max_features': 0.1, 'warm_start': False}. Best is trial 29 with value: 13.165073069554925.
[I 2024-04-28 15:52:49,210] Trial 10 finished with value: 15.43082622249543 and parameters: {'model_name': 'GAIN', 'batch_size': 96, 'hint_rate': 0.27, 'alpha': 77, 'iterations': 804}. Best is trial 29 with value: 13.165073069554925.
[I 2024-04-28 15:53:17,127] Trial 35 finished with value: 13.717868111631512 and parameters: {'model_name': 'GAIN', 'batch_size': 283, 'hint_rate': 0.51, 'alpha': 14, 'iterations': 1017}. Best is trial 29 with value: 13.165073069554925.
[I 2024-04-28 15:53:32,763] Trial 59 finished with value: 14.797803636801229 and parameters: {'model_name': 'GAIN', 'batch_size': 23, 'hint_rate': 0.74, 'alpha': 13, 'iterations': 1733}. Best is trial 29 with value: 13.165073069554925.
[I 2024-04-28 15:53:33,884] Trial 55 finished with value: 14.512034414070524 and parameters: {'model_name': 'GAIN', 'batch_size': 160, 'hint_rate': 0.39, 'alpha': 43, 'iterations': 1357}. Best is trial 29 with value: 13.165073069554925.
[I 2024-04-28 15:54:12,088] Trial 38 finished with value: 14.920764868057939 and parameters: {'model_name': 'GAIN', 'batch_size': 37, 'hint_rate': 0.36000000000000004, 'alpha': 39, 'iterations': 3680}. Best is trial 29 with value: 13.165073069554925.
