[I 2024-02-27 19:01:08,119] Trial 116 finished with value: 0.8323997979150299 and parameters: {'model_name': 'SimpleImputer', 'strategy': 'mean'}. Best is trial 8 with value: 0.8323997979150299.
[I 2024-02-27 19:01:08,385] Trial 88 finished with value: 0.9068354521668288 and parameters: {'model_name': 'SimpleImputer', 'strategy': 'most_frequent'}. Best is trial 8 with value: 0.8323997979150299.
[I 2024-02-27 19:01:08,603] Trial 83 finished with value: 0.9068354521668288 and parameters: {'model_name': 'SimpleImputer', 'strategy': 'most_frequent'}. Best is trial 8 with value: 0.8323997979150299.
[I 2024-02-27 19:01:09,030] Trial 118 finished with value: 0.8323997979150299 and parameters: {'model_name': 'SimpleImputer', 'strategy': 'mean'}. Best is trial 8 with value: 0.8323997979150299.
[I 2024-02-27 19:01:09,270] Trial 87 finished with value: 0.9068354521668288 and parameters: {'model_name': 'SimpleImputer', 'strategy': 'most_frequent'}. Best is trial 8 with value: 0.8323997979150299.
[I 2024-02-27 19:01:09,596] Trial 117 finished with value: 0.8323997979150299 and parameters: {'model_name': 'SimpleImputer', 'strategy': 'mean'}. Best is trial 8 with value: 0.8323997979150299.
[I 2024-02-27 19:01:09,940] Trial 120 finished with value: 0.8323997979150299 and parameters: {'model_name': 'SimpleImputer', 'strategy': 'mean'}. Best is trial 8 with value: 0.8323997979150299.
[I 2024-02-27 19:01:10,170] Trial 93 finished with value: 0.9068354521668288 and parameters: {'model_name': 'SimpleImputer', 'strategy': 'most_frequent'}. Best is trial 8 with value: 0.8323997979150299.
[I 2024-02-27 19:01:10,420] Trial 85 finished with value: 0.9068354521668288 and parameters: {'model_name': 'SimpleImputer', 'strategy': 'most_frequent'}. Best is trial 8 with value: 0.8323997979150299.
[I 2024-02-27 19:01:10,718] Trial 119 finished with value: 0.8323997979150299 and parameters: {'model_name': 'SimpleImputer', 'strategy': 'mean'}. Best is trial 8 with value: 0.8323997979150299.
[I 2024-02-27 19:01:11,107] Trial 89 finished with value: 0.9068354521668288 and parameters: {'model_name': 'SimpleImputer', 'strategy': 'most_frequent'}. Best is trial 8 with value: 0.8323997979150299.
[I 2024-02-27 19:01:11,349] Trial 91 finished with value: 0.9068354521668288 and parameters: {'model_name': 'SimpleImputer', 'strategy': 'most_frequent'}. Best is trial 8 with value: 0.8323997979150299.
[I 2024-02-27 19:01:11,568] Trial 86 finished with value: 0.9068354521668288 and parameters: {'model_name': 'SimpleImputer', 'strategy': 'most_frequent'}. Best is trial 8 with value: 0.8323997979150299.
[I 2024-02-27 19:01:11,844] Trial 122 finished with value: 0.8323997979150299 and parameters: {'model_name': 'SimpleImputer', 'strategy': 'mean'}. Best is trial 8 with value: 0.8323997979150299.
[I 2024-02-27 19:01:12,120] Trial 92 finished with value: 0.9068354521668288 and parameters: {'model_name': 'SimpleImputer', 'strategy': 'most_frequent'}. Best is trial 8 with value: 0.8323997979150299.
[I 2024-02-27 19:01:12,335] Trial 99 finished with value: 0.9068354521668288 and parameters: {'model_name': 'SimpleImputer', 'strategy': 'most_frequent'}. Best is trial 8 with value: 0.8323997979150299.
[I 2024-02-27 19:01:12,592] Trial 90 finished with value: 0.9068354521668288 and parameters: {'model_name': 'SimpleImputer', 'strategy': 'most_frequent'}. Best is trial 8 with value: 0.8323997979150299.
[I 2024-02-27 19:01:13,043] Trial 94 finished with value: 0.9068354521668288 and parameters: {'model_name': 'SimpleImputer', 'strategy': 'most_frequent'}. Best is trial 8 with value: 0.8323997979150299.
[I 2024-02-27 19:01:13,384] Trial 121 finished with value: 0.8323997979150299 and parameters: {'model_name': 'SimpleImputer', 'strategy': 'mean'}. Best is trial 8 with value: 0.8323997979150299.
[I 2024-02-27 19:01:13,772] Trial 124 finished with value: 0.8323997979150299 and parameters: {'model_name': 'SimpleImputer', 'strategy': 'mean'}. Best is trial 8 with value: 0.8323997979150299.
[I 2024-02-27 19:01:14,124] Trial 125 finished with value: 0.8323997979150299 and parameters: {'model_name': 'SimpleImputer', 'strategy': 'mean'}. Best is trial 8 with value: 0.8323997979150299.
[I 2024-02-27 19:01:14,336] Trial 123 finished with value: 0.8323997979150299 and parameters: {'model_name': 'SimpleImputer', 'strategy': 'mean'}. Best is trial 8 with value: 0.8323997979150299.
[I 2024-02-27 19:01:14,593] Trial 128 finished with value: 0.8323997979150299 and parameters: {'model_name': 'SimpleImputer', 'strategy': 'mean'}. Best is trial 8 with value: 0.8323997979150299.
[I 2024-02-27 19:01:14,886] Trial 98 finished with value: 0.9068354521668288 and parameters: {'model_name': 'SimpleImputer', 'strategy': 'most_frequent'}. Best is trial 8 with value: 0.8323997979150299.
[I 2024-02-27 19:01:15,155] Trial 127 finished with value: 0.8323997979150299 and parameters: {'model_name': 'SimpleImputer', 'strategy': 'mean'}. Best is trial 8 with value: 0.8323997979150299.
[I 2024-02-27 19:01:15,367] Trial 126 finished with value: 0.8323997979150299 and parameters: {'model_name': 'SimpleImputer', 'strategy': 'mean'}. Best is trial 8 with value: 0.8323997979150299.
[I 2024-02-27 19:01:15,715] Trial 129 finished with value: 0.8323997979150299 and parameters: {'model_name': 'SimpleImputer', 'strategy': 'mean'}. Best is trial 8 with value: 0.8323997979150299.
[I 2024-02-27 19:01:15,963] Trial 130 finished with value: 0.8323997979150299 and parameters: {'model_name': 'SimpleImputer', 'strategy': 'mean'}. Best is trial 8 with value: 0.8323997979150299.
[I 2024-02-27 19:01:16,168] Trial 97 finished with value: 0.9068354521668288 and parameters: {'model_name': 'SimpleImputer', 'strategy': 'most_frequent'}. Best is trial 8 with value: 0.8323997979150299.
[I 2024-02-27 19:01:16,423] Trial 133 finished with value: 0.8323997979150299 and parameters: {'model_name': 'SimpleImputer', 'strategy': 'mean'}. Best is trial 8 with value: 0.8323997979150299.
[I 2024-02-27 19:01:16,641] Trial 103 finished with value: 0.9068354521668288 and parameters: {'model_name': 'SimpleImputer', 'strategy': 'most_frequent'}. Best is trial 8 with value: 0.8323997979150299.
[I 2024-02-27 19:01:16,858] Trial 100 finished with value: 0.9068354521668288 and parameters: {'model_name': 'SimpleImputer', 'strategy': 'most_frequent'}. Best is trial 8 with value: 0.8323997979150299.
[I 2024-02-27 19:01:17,093] Trial 105 finished with value: 0.9068354521668288 and parameters: {'model_name': 'SimpleImputer', 'strategy': 'most_frequent'}. Best is trial 8 with value: 0.8323997979150299.
[I 2024-02-27 19:01:17,307] Trial 132 finished with value: 0.8323997979150299 and parameters: {'model_name': 'SimpleImputer', 'strategy': 'mean'}. Best is trial 8 with value: 0.8323997979150299.
[I 2024-02-27 19:01:17,536] Trial 134 finished with value: 0.8323997979150299 and parameters: {'model_name': 'SimpleImputer', 'strategy': 'mean'}. Best is trial 8 with value: 0.8323997979150299.
[I 2024-02-27 19:01:17,782] Trial 102 finished with value: 0.9068354521668288 and parameters: {'model_name': 'SimpleImputer', 'strategy': 'most_frequent'}. Best is trial 8 with value: 0.8323997979150299.
[I 2024-02-27 19:01:17,998] Trial 96 finished with value: 0.9068354521668288 and parameters: {'model_name': 'SimpleImputer', 'strategy': 'most_frequent'}. Best is trial 8 with value: 0.8323997979150299.
[I 2024-02-27 19:01:18,258] Trial 131 finished with value: 0.8323997979150299 and parameters: {'model_name': 'SimpleImputer', 'strategy': 'mean'}. Best is trial 8 with value: 0.8323997979150299.
[I 2024-02-27 19:01:18,650] Trial 140 finished with value: 0.8323997979150299 and parameters: {'model_name': 'SimpleImputer', 'strategy': 'mean'}. Best is trial 8 with value: 0.8323997979150299.
[I 2024-02-27 19:01:18,998] Trial 135 finished with value: 0.8323997979150299 and parameters: {'model_name': 'SimpleImputer', 'strategy': 'mean'}. Best is trial 8 with value: 0.8323997979150299.
[I 2024-02-27 19:01:19,337] Trial 137 finished with value: 0.8323997979150299 and parameters: {'model_name': 'SimpleImputer', 'strategy': 'mean'}. Best is trial 8 with value: 0.8323997979150299.
[I 2024-02-27 19:01:19,669] Trial 106 finished with value: 0.9068354521668288 and parameters: {'model_name': 'SimpleImputer', 'strategy': 'most_frequent'}. Best is trial 8 with value: 0.8323997979150299.
[I 2024-02-27 19:01:19,926] Trial 144 finished with value: 0.8323997979150299 and parameters: {'model_name': 'SimpleImputer', 'strategy': 'mean'}. Best is trial 8 with value: 0.8323997979150299.
[I 2024-02-27 19:01:20,164] Trial 138 finished with value: 0.8323997979150299 and parameters: {'model_name': 'SimpleImputer', 'strategy': 'mean'}. Best is trial 8 with value: 0.8323997979150299.
[I 2024-02-27 19:01:20,412] Trial 142 finished with value: 0.8323997979150299 and parameters: {'model_name': 'SimpleImputer', 'strategy': 'mean'}. Best is trial 8 with value: 0.8323997979150299.
[I 2024-02-27 19:01:20,672] Trial 136 finished with value: 0.8323997979150299 and parameters: {'model_name': 'SimpleImputer', 'strategy': 'mean'}. Best is trial 8 with value: 0.8323997979150299.
[I 2024-02-27 19:01:20,907] Trial 141 finished with value: 0.8323997979150299 and parameters: {'model_name': 'SimpleImputer', 'strategy': 'mean'}. Best is trial 8 with value: 0.8323997979150299.
[I 2024-02-27 19:01:21,111] Trial 143 finished with value: 0.8323997979150299 and parameters: {'model_name': 'SimpleImputer', 'strategy': 'mean'}. Best is trial 8 with value: 0.8323997979150299.
[I 2024-02-27 19:01:21,480] Trial 104 finished with value: 0.9068354521668288 and parameters: {'model_name': 'SimpleImputer', 'strategy': 'most_frequent'}. Best is trial 8 with value: 0.8323997979150299.
[I 2024-02-27 19:01:21,699] Trial 145 finished with value: 0.8323997979150299 and parameters: {'model_name': 'SimpleImputer', 'strategy': 'mean'}. Best is trial 8 with value: 0.8323997979150299.
[I 2024-02-27 19:01:21,987] Trial 147 finished with value: 0.8323997979150299 and parameters: {'model_name': 'SimpleImputer', 'strategy': 'mean'}. Best is trial 8 with value: 0.8323997979150299.
[I 2024-02-27 19:01:22,226] Trial 148 finished with value: 0.8323997979150299 and parameters: {'model_name': 'SimpleImputer', 'strategy': 'mean'}. Best is trial 8 with value: 0.8323997979150299.
[I 2024-02-27 19:01:22,529] Trial 150 finished with value: 0.8323997979150299 and parameters: {'model_name': 'SimpleImputer', 'strategy': 'mean'}. Best is trial 8 with value: 0.8323997979150299.
[I 2024-02-27 19:01:22,813] Trial 153 finished with value: 0.8323997979150299 and parameters: {'model_name': 'SimpleImputer', 'strategy': 'mean'}. Best is trial 8 with value: 0.8323997979150299.
[I 2024-02-27 19:01:23,031] Trial 146 finished with value: 0.8323997979150299 and parameters: {'model_name': 'SimpleImputer', 'strategy': 'mean'}. Best is trial 8 with value: 0.8323997979150299.
[I 2024-02-27 19:01:23,328] Trial 152 finished with value: 0.8323997979150299 and parameters: {'model_name': 'SimpleImputer', 'strategy': 'mean'}. Best is trial 8 with value: 0.8323997979150299.
[I 2024-02-27 19:01:23,634] Trial 149 finished with value: 0.8323997979150299 and parameters: {'model_name': 'SimpleImputer', 'strategy': 'mean'}. Best is trial 8 with value: 0.8323997979150299.
[I 2024-02-27 19:01:23,859] Trial 139 finished with value: 0.8323997979150299 and parameters: {'model_name': 'SimpleImputer', 'strategy': 'mean'}. Best is trial 8 with value: 0.8323997979150299.
[I 2024-02-27 19:01:24,077] Trial 156 finished with value: 0.8323997979150299 and parameters: {'model_name': 'SimpleImputer', 'strategy': 'mean'}. Best is trial 8 with value: 0.8323997979150299.
[I 2024-02-27 19:01:24,319] Trial 154 finished with value: 0.8323997979150299 and parameters: {'model_name': 'SimpleImputer', 'strategy': 'mean'}. Best is trial 8 with value: 0.8323997979150299.
[I 2024-02-27 19:01:24,593] Trial 157 finished with value: 0.8323997979150299 and parameters: {'model_name': 'SimpleImputer', 'strategy': 'mean'}. Best is trial 8 with value: 0.8323997979150299.
[I 2024-02-27 19:01:24,834] Trial 107 finished with value: 0.9068354521668288 and parameters: {'model_name': 'SimpleImputer', 'strategy': 'most_frequent'}. Best is trial 8 with value: 0.8323997979150299.
[I 2024-02-27 19:01:25,094] Trial 159 finished with value: 0.8323997979150299 and parameters: {'model_name': 'SimpleImputer', 'strategy': 'mean'}. Best is trial 8 with value: 0.8323997979150299.
[I 2024-02-27 19:01:25,354] Trial 158 finished with value: 0.8323997979150299 and parameters: {'model_name': 'SimpleImputer', 'strategy': 'mean'}. Best is trial 8 with value: 0.8323997979150299.
[I 2024-02-27 19:01:25,560] Trial 151 finished with value: 0.8323997979150299 and parameters: {'model_name': 'SimpleImputer', 'strategy': 'mean'}. Best is trial 8 with value: 0.8323997979150299.
[I 2024-02-27 19:01:25,780] Trial 155 finished with value: 0.8323997979150299 and parameters: {'model_name': 'SimpleImputer', 'strategy': 'mean'}. Best is trial 8 with value: 0.8323997979150299.
[I 2024-02-27 19:01:26,368] Trial 161 finished with value: 0.8323997979150299 and parameters: {'model_name': 'SimpleImputer', 'strategy': 'mean'}. Best is trial 8 with value: 0.8323997979150299.
[I 2024-02-27 19:01:26,652] Trial 163 finished with value: 0.8323997979150299 and parameters: {'model_name': 'SimpleImputer', 'strategy': 'mean'}. Best is trial 8 with value: 0.8323997979150299.
[I 2024-02-27 19:01:26,937] Trial 160 finished with value: 0.8323997979150299 and parameters: {'model_name': 'SimpleImputer', 'strategy': 'mean'}. Best is trial 8 with value: 0.8323997979150299.
[I 2024-02-27 19:01:27,182] Trial 164 finished with value: 0.8323997979150299 and parameters: {'model_name': 'SimpleImputer', 'strategy': 'mean'}. Best is trial 8 with value: 0.8323997979150299.
[I 2024-02-27 19:01:27,457] Trial 162 finished with value: 0.8323997979150299 and parameters: {'model_name': 'SimpleImputer', 'strategy': 'mean'}. Best is trial 8 with value: 0.8323997979150299.
[I 2024-02-27 19:01:27,683] Trial 176 finished with value: 0.8323997979150299 and parameters: {'model_name': 'SimpleImputer', 'strategy': 'mean'}. Best is trial 8 with value: 0.8323997979150299.
[I 2024-02-27 19:01:27,964] Trial 173 finished with value: 0.8323997979150299 and parameters: {'model_name': 'SimpleImputer', 'strategy': 'mean'}. Best is trial 8 with value: 0.8323997979150299.
[I 2024-02-27 19:01:28,193] Trial 166 finished with value: 0.8323997979150299 and parameters: {'model_name': 'SimpleImputer', 'strategy': 'mean'}. Best is trial 8 with value: 0.8323997979150299.
[I 2024-02-27 19:01:28,505] Trial 178 finished with value: 0.8323997979150299 and parameters: {'model_name': 'SimpleImputer', 'strategy': 'mean'}. Best is trial 8 with value: 0.8323997979150299.
[I 2024-02-27 19:01:28,735] Trial 168 finished with value: 0.8323997979150299 and parameters: {'model_name': 'SimpleImputer', 'strategy': 'mean'}. Best is trial 8 with value: 0.8323997979150299.
[I 2024-02-27 19:01:28,961] Trial 169 finished with value: 0.8323997979150299 and parameters: {'model_name': 'SimpleImputer', 'strategy': 'mean'}. Best is trial 8 with value: 0.8323997979150299.
[I 2024-02-27 19:01:29,162] Trial 171 finished with value: 0.8323997979150299 and parameters: {'model_name': 'SimpleImputer', 'strategy': 'mean'}. Best is trial 8 with value: 0.8323997979150299.
[I 2024-02-27 19:01:29,390] Trial 167 finished with value: 0.8323997979150299 and parameters: {'model_name': 'SimpleImputer', 'strategy': 'mean'}. Best is trial 8 with value: 0.8323997979150299.
[I 2024-02-27 19:01:29,617] Trial 179 finished with value: 0.8323997979150299 and parameters: {'model_name': 'SimpleImputer', 'strategy': 'mean'}. Best is trial 8 with value: 0.8323997979150299.
[I 2024-02-27 19:01:29,848] Trial 177 finished with value: 0.8323997979150299 and parameters: {'model_name': 'SimpleImputer', 'strategy': 'mean'}. Best is trial 8 with value: 0.8323997979150299.
[I 2024-02-27 19:01:30,069] Trial 165 finished with value: 0.8323997979150299 and parameters: {'model_name': 'SimpleImputer', 'strategy': 'mean'}. Best is trial 8 with value: 0.8323997979150299.
[I 2024-02-27 19:01:30,281] Trial 180 finished with value: 0.8323997979150299 and parameters: {'model_name': 'SimpleImputer', 'strategy': 'mean'}. Best is trial 8 with value: 0.8323997979150299.
[I 2024-02-27 19:01:30,510] Trial 170 finished with value: 0.8323997979150299 and parameters: {'model_name': 'SimpleImputer', 'strategy': 'mean'}. Best is trial 8 with value: 0.8323997979150299.
[I 2024-02-27 19:01:30,725] Trial 174 finished with value: 0.8323997979150299 and parameters: {'model_name': 'SimpleImputer', 'strategy': 'mean'}. Best is trial 8 with value: 0.8323997979150299.
[I 2024-02-27 19:01:30,947] Trial 182 finished with value: 0.8323997979150299 and parameters: {'model_name': 'SimpleImputer', 'strategy': 'mean'}. Best is trial 8 with value: 0.8323997979150299.
[I 2024-02-27 19:01:31,158] Trial 181 finished with value: 0.8323997979150299 and parameters: {'model_name': 'SimpleImputer', 'strategy': 'mean'}. Best is trial 8 with value: 0.8323997979150299.
[I 2024-02-27 19:01:31,366] Trial 175 finished with value: 0.8323997979150299 and parameters: {'model_name': 'SimpleImputer', 'strategy': 'mean'}. Best is trial 8 with value: 0.8323997979150299.
[I 2024-02-27 19:01:31,656] Trial 172 finished with value: 0.8323997979150299 and parameters: {'model_name': 'SimpleImputer', 'strategy': 'mean'}. Best is trial 8 with value: 0.8323997979150299.
[I 2024-02-27 19:01:31,899] Trial 191 finished with value: 0.8323997979150299 and parameters: {'model_name': 'SimpleImputer', 'strategy': 'mean'}. Best is trial 8 with value: 0.8323997979150299.
[I 2024-02-27 19:01:32,144] Trial 185 finished with value: 0.8323997979150299 and parameters: {'model_name': 'SimpleImputer', 'strategy': 'mean'}. Best is trial 8 with value: 0.8323997979150299.
[I 2024-02-27 19:01:32,356] Trial 190 finished with value: 0.8323997979150299 and parameters: {'model_name': 'SimpleImputer', 'strategy': 'mean'}. Best is trial 8 with value: 0.8323997979150299.
[I 2024-02-27 19:01:32,640] Trial 192 finished with value: 0.8323997979150299 and parameters: {'model_name': 'SimpleImputer', 'strategy': 'mean'}. Best is trial 8 with value: 0.8323997979150299.
[I 2024-02-27 19:01:32,884] Trial 197 finished with value: 0.8323997979150299 and parameters: {'model_name': 'SimpleImputer', 'strategy': 'mean'}. Best is trial 8 with value: 0.8323997979150299.
[I 2024-02-27 19:01:33,213] Trial 189 finished with value: 0.8545689773247614 and parameters: {'model_name': 'SimpleImputer', 'strategy': 'median'}. Best is trial 8 with value: 0.8323997979150299.
[I 2024-02-27 19:01:33,429] Trial 184 finished with value: 0.8545689773247614 and parameters: {'model_name': 'SimpleImputer', 'strategy': 'median'}. Best is trial 8 with value: 0.8323997979150299.
[I 2024-02-27 19:01:33,620] Trial 183 finished with value: 0.8545689773247614 and parameters: {'model_name': 'SimpleImputer', 'strategy': 'median'}. Best is trial 8 with value: 0.8323997979150299.
[I 2024-02-27 19:01:33,833] Trial 186 finished with value: 0.8545689773247614 and parameters: {'model_name': 'SimpleImputer', 'strategy': 'median'}. Best is trial 8 with value: 0.8323997979150299.
[I 2024-02-27 19:01:34,068] Trial 193 finished with value: 0.8545689773247614 and parameters: {'model_name': 'SimpleImputer', 'strategy': 'median'}. Best is trial 8 with value: 0.8323997979150299.
[I 2024-02-27 19:01:34,294] Trial 198 finished with value: 0.8545689773247614 and parameters: {'model_name': 'SimpleImputer', 'strategy': 'median'}. Best is trial 8 with value: 0.8323997979150299.
[I 2024-02-27 19:01:34,509] Trial 188 finished with value: 0.8545689773247614 and parameters: {'model_name': 'SimpleImputer', 'strategy': 'median'}. Best is trial 8 with value: 0.8323997979150299.
[I 2024-02-27 19:01:34,707] Trial 199 finished with value: 0.8545689773247614 and parameters: {'model_name': 'SimpleImputer', 'strategy': 'median'}. Best is trial 8 with value: 0.8323997979150299.
[I 2024-02-27 19:01:34,906] Trial 194 finished with value: 0.8545689773247614 and parameters: {'model_name': 'SimpleImputer', 'strategy': 'median'}. Best is trial 8 with value: 0.8323997979150299.
[I 2024-02-27 19:01:35,106] Trial 187 finished with value: 0.8545689773247614 and parameters: {'model_name': 'SimpleImputer', 'strategy': 'median'}. Best is trial 8 with value: 0.8323997979150299.
[I 2024-02-27 19:01:35,312] Trial 196 finished with value: 0.8545689773247614 and parameters: {'model_name': 'SimpleImputer', 'strategy': 'median'}. Best is trial 8 with value: 0.8323997979150299.
