[I 2024-04-01 19:53:53,783] Trial 9 finished with value: 79.06369375326895 and parameters: {'model_name': 'SimpleImputer', 'strategy': 'mean'}. Best is trial 9 with value: 79.06369375326895.
[I 2024-04-01 19:53:55,270] Trial 19 finished with value: 79.06369375326895 and parameters: {'model_name': 'SimpleImputer', 'strategy': 'mean'}. Best is trial 9 with value: 79.06369375326895.
[I 2024-04-01 19:53:56,029] Trial 10 finished with value: 87.98617849996862 and parameters: {'model_name': 'SimpleImputer', 'strategy': 'constant'}. Best is trial 9 with value: 79.06369375326895.
[I 2024-04-01 19:53:56,830] Trial 30 finished with value: 87.98617849996862 and parameters: {'model_name': 'SimpleImputer', 'strategy': 'constant'}. Best is trial 9 with value: 79.06369375326895.
[I 2024-04-01 19:53:57,533] Trial 46 finished with value: 87.98617849996862 and parameters: {'model_name': 'SimpleImputer', 'strategy': 'constant'}. Best is trial 9 with value: 79.06369375326895.
[I 2024-04-01 19:53:58,719] Trial 38 finished with value: 79.06369375326895 and parameters: {'model_name': 'SimpleImputer', 'strategy': 'mean'}. Best is trial 9 with value: 79.06369375326895.
[I 2024-04-01 19:53:59,823] Trial 43 finished with value: 79.06369375326895 and parameters: {'model_name': 'SimpleImputer', 'strategy': 'mean'}. Best is trial 9 with value: 79.06369375326895.
[I 2024-04-01 19:54:00,395] Trial 0 finished with value: 87.98617849996862 and parameters: {'model_name': 'SimpleImputer', 'strategy': 'median'}. Best is trial 9 with value: 79.06369375326895.
[I 2024-04-01 19:54:01,726] Trial 33 finished with value: 87.98617849996862 and parameters: {'model_name': 'SimpleImputer', 'strategy': 'median'}. Best is trial 9 with value: 79.06369375326895.
[I 2024-04-01 19:54:03,857] Trial 47 finished with value: 87.98617849996862 and parameters: {'model_name': 'SimpleImputer', 'strategy': 'median'}. Best is trial 9 with value: 79.06369375326895.
[I 2024-04-01 19:54:06,617] Trial 56 finished with value: 87.98617849996862 and parameters: {'model_name': 'SimpleImputer', 'strategy': 'constant'}. Best is trial 9 with value: 79.06369375326895.
2024-04-01 19:54:07.493178: E external/local_xla/xla/stream_executor/cuda/cuda_driver.cc:274] failed call to cuInit: CUDA_ERROR_NO_DEVICE: no CUDA-capable device is detected
2024-04-01 19:54:08.383757: I tensorflow/compiler/mlir/mlir_graph_optimization_pass.cc:388] MLIR V1 optimization pass is not enabled
[I 2024-04-01 19:54:09,684] Trial 49 finished with value: 87.98617849996862 and parameters: {'model_name': 'SimpleImputer', 'strategy': 'median'}. Best is trial 9 with value: 79.06369375326895.
[I 2024-04-01 19:54:10,933] Trial 54 finished with value: 87.98617849996862 and parameters: {'model_name': 'SimpleImputer', 'strategy': 'median'}. Best is trial 9 with value: 79.06369375326895.
[I 2024-04-01 19:54:16,539] Trial 25 finished with value: 87.98617849996862 and parameters: {'model_name': 'SimpleImputer', 'strategy': 'most_frequent'}. Best is trial 9 with value: 79.06369375326895.
[I 2024-04-01 19:54:17,513] Trial 20 finished with value: 87.98617849996862 and parameters: {'model_name': 'SimpleImputer', 'strategy': 'most_frequent'}. Best is trial 9 with value: 79.06369375326895.
[I 2024-04-01 19:54:18,272] Trial 7 finished with value: 87.98617849996862 and parameters: {'model_name': 'SimpleImputer', 'strategy': 'most_frequent'}. Best is trial 9 with value: 79.06369375326895.
[I 2024-04-01 19:54:48,167] Trial 1 finished with value: 79.06369375326895 and parameters: {'model_name': 'RandomForestImputer', 'max_iter': 1, 'decreasing': False, 'min_samples_split': 1.0, 'min_samples_leaf': 0.8, 'max_features': 0.7000000000000001, 'warm_start': True}. Best is trial 9 with value: 79.06369375326895.
[I 2024-04-01 19:55:37,979] Trial 64 finished with value: 79.06369375326895 and parameters: {'model_name': 'RandomForestImputer', 'max_iter': 1, 'decreasing': False, 'min_samples_split': 1.0, 'min_samples_leaf': 0.8, 'max_features': 0.7000000000000001, 'warm_start': True}. Best is trial 9 with value: 79.06369375326895.
[I 2024-04-01 19:55:41,701] Trial 32 finished with value: 74.28609217217914 and parameters: {'model_name': 'KNNImputer', 'weights': 'uniform', 'keep_empty_features': False}. Best is trial 32 with value: 74.28609217217914.
[I 2024-04-01 19:55:43,919] Trial 13 finished with value: 74.00104380749715 and parameters: {'model_name': 'KNNImputer', 'weights': 'distance', 'keep_empty_features': False}. Best is trial 13 with value: 74.00104380749715.
[I 2024-04-01 19:55:46,642] Trial 45 finished with value: 74.00104380749715 and parameters: {'model_name': 'KNNImputer', 'weights': 'distance', 'keep_empty_features': False}. Best is trial 13 with value: 74.00104380749715.
[I 2024-04-01 19:55:47,563] Trial 28 finished with value: 74.00104380749715 and parameters: {'model_name': 'KNNImputer', 'weights': 'distance', 'keep_empty_features': False}. Best is trial 13 with value: 74.00104380749715.
[I 2024-04-01 19:55:50,226] Trial 52 finished with value: 74.00104380749715 and parameters: {'model_name': 'KNNImputer', 'weights': 'distance', 'keep_empty_features': False}. Best is trial 13 with value: 74.00104380749715.
[I 2024-04-01 19:55:53,119] Trial 53 finished with value: 74.00104380749715 and parameters: {'model_name': 'KNNImputer', 'weights': 'distance', 'keep_empty_features': False}. Best is trial 13 with value: 74.00104380749715.
[I 2024-04-01 19:56:02,513] Trial 63 finished with value: 74.28609217217914 and parameters: {'model_name': 'KNNImputer', 'weights': 'uniform', 'keep_empty_features': False}. Best is trial 13 with value: 74.00104380749715.
[I 2024-04-01 19:56:42,699] Trial 27 finished with value: 44.719063672566215 and parameters: {'model_name': 'GAIN', 'batch_size': 9, 'hint_rate': 0.49, 'alpha': 41, 'iterations': 2}. Best is trial 27 with value: 44.719063672566215.
[I 2024-04-01 19:57:23,205] Trial 66 finished with value: 74.28609217217914 and parameters: {'model_name': 'KNNImputer', 'weights': 'uniform', 'keep_empty_features': False}. Best is trial 27 with value: 44.719063672566215.
[I 2024-04-01 19:57:27,681] Trial 67 finished with value: 74.28609217217914 and parameters: {'model_name': 'KNNImputer', 'weights': 'uniform', 'keep_empty_features': False}. Best is trial 27 with value: 44.719063672566215.
[I 2024-04-01 19:57:30,077] Trial 68 finished with value: 74.00104380749715 and parameters: {'model_name': 'KNNImputer', 'weights': 'distance', 'keep_empty_features': False}. Best is trial 27 with value: 44.719063672566215.
[I 2024-04-01 19:57:33,182] Trial 70 finished with value: 74.00104380749715 and parameters: {'model_name': 'KNNImputer', 'weights': 'distance', 'keep_empty_features': False}. Best is trial 27 with value: 44.719063672566215.
[I 2024-04-01 19:57:34,990] Trial 69 finished with value: 74.00104380749715 and parameters: {'model_name': 'KNNImputer', 'weights': 'distance', 'keep_empty_features': False}. Best is trial 27 with value: 44.719063672566215.
[I 2024-04-01 19:57:37,093] Trial 71 finished with value: 74.00104380749715 and parameters: {'model_name': 'KNNImputer', 'weights': 'distance', 'keep_empty_features': False}. Best is trial 27 with value: 44.719063672566215.
[I 2024-04-01 19:57:52,811] Trial 39 finished with value: 87.74594458100128 and parameters: {'model_name': 'RandomForestImputer', 'max_iter': 4, 'decreasing': False, 'min_samples_split': 0.1, 'min_samples_leaf': 0.2, 'max_features': 0.4, 'warm_start': True}. Best is trial 27 with value: 44.719063672566215.
[I 2024-04-01 19:57:59,286] Trial 55 finished with value: 87.73677616843307 and parameters: {'model_name': 'RandomForestImputer', 'max_iter': 4, 'decreasing': True, 'min_samples_split': 0.1, 'min_samples_leaf': 0.30000000000000004, 'max_features': 0.9, 'warm_start': True}. Best is trial 27 with value: 44.719063672566215.
[I 2024-04-01 19:58:01,338] Trial 65 finished with value: 45.01818672542987 and parameters: {'model_name': 'GAIN', 'batch_size': 114, 'hint_rate': 0.47000000000000003, 'alpha': 47, 'iterations': 3}. Best is trial 27 with value: 44.719063672566215.
[I 2024-04-01 19:58:17,650] Trial 22 finished with value: 79.06369375326895 and parameters: {'model_name': 'RandomForestImputer', 'max_iter': 1, 'decreasing': True, 'min_samples_split': 0.0, 'min_samples_leaf': 0.1, 'max_features': 0.30000000000000004, 'warm_start': False}. Best is trial 27 with value: 44.719063672566215.
[I 2024-04-01 19:58:19,237] Trial 12 finished with value: 79.06369375326895 and parameters: {'model_name': 'RandomForestImputer', 'max_iter': 1, 'decreasing': True, 'min_samples_split': 0.2, 'min_samples_leaf': 0.7000000000000001, 'max_features': 0.2, 'warm_start': False}. Best is trial 27 with value: 44.719063672566215.
[I 2024-04-01 19:58:59,717] Trial 73 finished with value: 45.96830310523252 and parameters: {'model_name': 'GAIN', 'batch_size': 8, 'hint_rate': 0.48000000000000004, 'alpha': 41, 'iterations': 1}. Best is trial 27 with value: 44.719063672566215.
[I 2024-04-01 19:59:10,539] Trial 74 finished with value: 41.842272327396515 and parameters: {'model_name': 'GAIN', 'batch_size': 9, 'hint_rate': 0.5, 'alpha': 41, 'iterations': 1}. Best is trial 74 with value: 41.842272327396515.
[I 2024-04-01 19:59:13,571] Trial 75 finished with value: 45.72130322879383 and parameters: {'model_name': 'GAIN', 'batch_size': 9, 'hint_rate': 0.49, 'alpha': 40, 'iterations': 1}. Best is trial 74 with value: 41.842272327396515.
[I 2024-04-01 19:59:16,021] Trial 76 finished with value: 46.35900963331634 and parameters: {'model_name': 'GAIN', 'batch_size': 8, 'hint_rate': 0.46, 'alpha': 43, 'iterations': 1}. Best is trial 74 with value: 41.842272327396515.
[I 2024-04-01 19:59:18,474] Trial 77 finished with value: 38.994777093085176 and parameters: {'model_name': 'GAIN', 'batch_size': 9, 'hint_rate': 0.52, 'alpha': 40, 'iterations': 1}. Best is trial 77 with value: 38.994777093085176.
[I 2024-04-01 19:59:19,565] Trial 14 finished with value: 87.7290941252383 and parameters: {'model_name': 'RandomForestImputer', 'max_iter': 10, 'decreasing': False, 'min_samples_split': 0.6000000000000001, 'min_samples_leaf': 0.7000000000000001, 'max_features': 0.5, 'warm_start': True}. Best is trial 77 with value: 38.994777093085176.
[I 2024-04-01 19:59:21,924] Trial 78 finished with value: 33.98298487252292 and parameters: {'model_name': 'GAIN', 'batch_size': 8, 'hint_rate': 0.45, 'alpha': 39, 'iterations': 1}. Best is trial 78 with value: 33.98298487252292.
[I 2024-04-01 19:59:24,688] Trial 79 finished with value: 39.6730977053356 and parameters: {'model_name': 'GAIN', 'batch_size': 10, 'hint_rate': 0.48000000000000004, 'alpha': 40, 'iterations': 1}. Best is trial 78 with value: 33.98298487252292.
[I 2024-04-01 19:59:29,356] Trial 6 finished with value: 78.1314500707234 and parameters: {'model_name': 'IterativeImputer', 'sample_posterior': False, 'initial_strategy': 'most_frequent', 'imputation_order': 'roman'}. Best is trial 78 with value: 33.98298487252292.
[I 2024-04-01 19:59:49,271] Trial 80 finished with value: 50.48668019185721 and parameters: {'model_name': 'GAIN', 'batch_size': 8, 'hint_rate': 0.43, 'alpha': 44, 'iterations': 1}. Best is trial 78 with value: 33.98298487252292.
[I 2024-04-01 19:59:55,384] Trial 81 finished with value: 38.44224097794518 and parameters: {'model_name': 'GAIN', 'batch_size': 12, 'hint_rate': 0.48000000000000004, 'alpha': 37, 'iterations': 1}. Best is trial 78 with value: 33.98298487252292.
[I 2024-04-01 19:59:56,978] Trial 16 finished with value: 49.85932072240903 and parameters: {'model_name': 'GAIN', 'batch_size': 4, 'hint_rate': 0.28, 'alpha': 58, 'iterations': 56}. Best is trial 78 with value: 33.98298487252292.
[I 2024-04-01 20:00:14,075] Trial 84 finished with value: 40.52264615010981 and parameters: {'model_name': 'GAIN', 'batch_size': 20, 'hint_rate': 0.5, 'alpha': 43, 'iterations': 2}. Best is trial 78 with value: 33.98298487252292.
[I 2024-04-01 20:00:17,527] Trial 83 finished with value: 41.34417061547909 and parameters: {'model_name': 'GAIN', 'batch_size': 33, 'hint_rate': 0.49, 'alpha': 44, 'iterations': 2}. Best is trial 78 with value: 33.98298487252292.
[I 2024-04-01 20:00:26,330] Trial 82 finished with value: 52.46394866917386 and parameters: {'model_name': 'GAIN', 'batch_size': 37, 'hint_rate': 0.48000000000000004, 'alpha': 44, 'iterations': 2}. Best is trial 78 with value: 33.98298487252292.
[I 2024-04-01 20:00:27,845] Trial 36 finished with value: 78.13142045420045 and parameters: {'model_name': 'IterativeImputer', 'sample_posterior': False, 'initial_strategy': 'median', 'imputation_order': 'descending'}. Best is trial 78 with value: 33.98298487252292.
[I 2024-04-01 20:00:29,074] Trial 24 finished with value: 78.13190275905292 and parameters: {'model_name': 'IterativeImputer', 'sample_posterior': False, 'initial_strategy': 'most_frequent', 'imputation_order': 'random'}. Best is trial 78 with value: 33.98298487252292.
[I 2024-04-01 20:00:32,072] Trial 61 finished with value: 87.72732647472223 and parameters: {'model_name': 'RandomForestImputer', 'max_iter': 15, 'decreasing': True, 'min_samples_split': 0.30000000000000004, 'min_samples_leaf': 0.30000000000000004, 'max_features': 0.30000000000000004, 'warm_start': True}. Best is trial 78 with value: 33.98298487252292.
[I 2024-04-01 20:00:37,383] Trial 11 finished with value: 78.13142045420045 and parameters: {'model_name': 'IterativeImputer', 'sample_posterior': False, 'initial_strategy': 'most_frequent', 'imputation_order': 'descending'}. Best is trial 78 with value: 33.98298487252292.
[I 2024-04-01 20:00:43,847] Trial 4 finished with value: 78.13144995109134 and parameters: {'model_name': 'IterativeImputer', 'sample_posterior': False, 'initial_strategy': 'median', 'imputation_order': 'random'}. Best is trial 78 with value: 33.98298487252292.
[I 2024-04-01 20:00:46,180] Trial 15 finished with value: 78.13142203154969 and parameters: {'model_name': 'IterativeImputer', 'sample_posterior': False, 'initial_strategy': 'median', 'imputation_order': 'arabic'}. Best is trial 78 with value: 33.98298487252292.
[I 2024-04-01 20:00:52,705] Trial 57 finished with value: 78.13142203154969 and parameters: {'model_name': 'IterativeImputer', 'sample_posterior': False, 'initial_strategy': 'median', 'imputation_order': 'arabic'}. Best is trial 78 with value: 33.98298487252292.
[I 2024-04-01 20:00:54,923] Trial 29 finished with value: 78.13142272180693 and parameters: {'model_name': 'IterativeImputer', 'sample_posterior': False, 'initial_strategy': 'most_frequent', 'imputation_order': 'ascending'}. Best is trial 78 with value: 33.98298487252292.
[I 2024-04-01 20:00:57,759] Trial 48 finished with value: 78.13142272180693 and parameters: {'model_name': 'IterativeImputer', 'sample_posterior': False, 'initial_strategy': 'most_frequent', 'imputation_order': 'ascending'}. Best is trial 78 with value: 33.98298487252292.
[I 2024-04-01 20:01:06,600] Trial 34 finished with value: 44.73174182200133 and parameters: {'model_name': 'GAIN', 'batch_size': 1, 'hint_rate': 0.9500000000000001, 'alpha': 75, 'iterations': 72}. Best is trial 78 with value: 33.98298487252292.
[I 2024-04-01 20:01:12,728] Trial 90 finished with value: 50.93313389676298 and parameters: {'model_name': 'GAIN', 'batch_size': 11, 'hint_rate': 0.5, 'alpha': 41, 'iterations': 1}. Best is trial 78 with value: 33.98298487252292.
[I 2024-04-01 20:01:21,343] Trial 93 finished with value: 39.46151461493527 and parameters: {'model_name': 'GAIN', 'batch_size': 9, 'hint_rate': 0.53, 'alpha': 34, 'iterations': 1}. Best is trial 78 with value: 33.98298487252292.
[I 2024-04-01 20:01:32,138] Trial 87 finished with value: 38.429702785613514 and parameters: {'model_name': 'GAIN', 'batch_size': 11, 'hint_rate': 0.5, 'alpha': 42, 'iterations': 1}. Best is trial 78 with value: 33.98298487252292.
[I 2024-04-01 20:01:36,010] Trial 88 finished with value: 47.32776934811996 and parameters: {'model_name': 'GAIN', 'batch_size': 9, 'hint_rate': 0.49, 'alpha': 43, 'iterations': 1}. Best is trial 78 with value: 33.98298487252292.
[I 2024-04-01 20:01:38,019] Trial 72 finished with value: 78.13160306570663 and parameters: {'model_name': 'IterativeImputer', 'sample_posterior': False, 'initial_strategy': 'constant', 'imputation_order': 'random'}. Best is trial 78 with value: 33.98298487252292.
[I 2024-04-01 20:01:39,828] Trial 86 finished with value: 46.49846944710582 and parameters: {'model_name': 'GAIN', 'batch_size': 10, 'hint_rate': 0.48000000000000004, 'alpha': 45, 'iterations': 1}. Best is trial 78 with value: 33.98298487252292.
[I 2024-04-01 20:01:42,337] Trial 89 finished with value: 33.85535447775671 and parameters: {'model_name': 'GAIN', 'batch_size': 10, 'hint_rate': 0.5, 'alpha': 42, 'iterations': 1}. Best is trial 89 with value: 33.85535447775671.
[I 2024-04-01 20:01:47,432] Trial 91 finished with value: 42.03852866655721 and parameters: {'model_name': 'GAIN', 'batch_size': 352, 'hint_rate': 0.5, 'alpha': 41, 'iterations': 1}. Best is trial 89 with value: 33.85535447775671.
[I 2024-04-01 20:01:52,499] Trial 92 finished with value: 31.971075408059654 and parameters: {'model_name': 'GAIN', 'batch_size': 8, 'hint_rate': 0.51, 'alpha': 33, 'iterations': 1}. Best is trial 92 with value: 31.971075408059654.
[I 2024-04-01 20:02:00,862] Trial 85 finished with value: 39.79100523193488 and parameters: {'model_name': 'GAIN', 'batch_size': 13, 'hint_rate': 0.49, 'alpha': 46, 'iterations': 1}. Best is trial 92 with value: 31.971075408059654.
[I 2024-04-01 20:02:41,358] Trial 108 finished with value: 37.399355119713405 and parameters: {'model_name': 'GAIN', 'batch_size': 24, 'hint_rate': 0.67, 'alpha': 23, 'iterations': 1}. Best is trial 92 with value: 31.971075408059654.
[I 2024-04-01 20:02:55,389] Trial 100 finished with value: 40.99185259119831 and parameters: {'model_name': 'GAIN', 'batch_size': 30, 'hint_rate': 0.73, 'alpha': 17, 'iterations': 10}. Best is trial 92 with value: 31.971075408059654.
[I 2024-04-01 20:03:00,290] Trial 101 finished with value: 42.28962107499084 and parameters: {'model_name': 'GAIN', 'batch_size': 30, 'hint_rate': 0.73, 'alpha': 11, 'iterations': 11}. Best is trial 92 with value: 31.971075408059654.
[I 2024-04-01 20:03:04,852] Trial 105 finished with value: 36.48536675894087 and parameters: {'model_name': 'GAIN', 'batch_size': 27, 'hint_rate': 0.68, 'alpha': 14, 'iterations': 8}. Best is trial 92 with value: 31.971075408059654.
[I 2024-04-01 20:03:06,944] Trial 104 finished with value: 42.641259268674006 and parameters: {'model_name': 'GAIN', 'batch_size': 32, 'hint_rate': 0.73, 'alpha': 16, 'iterations': 10}. Best is trial 92 with value: 31.971075408059654.
[I 2024-04-01 20:03:08,765] Trial 109 finished with value: 37.85559728245322 and parameters: {'model_name': 'GAIN', 'batch_size': 24, 'hint_rate': 0.65, 'alpha': 20, 'iterations': 1}. Best is trial 92 with value: 31.971075408059654.
[I 2024-04-01 20:03:15,188] Trial 102 finished with value: 41.94459691733654 and parameters: {'model_name': 'GAIN', 'batch_size': 35, 'hint_rate': 0.75, 'alpha': 18, 'iterations': 13}. Best is trial 92 with value: 31.971075408059654.
[I 2024-04-01 20:03:18,372] Trial 103 finished with value: 41.28019224289326 and parameters: {'model_name': 'GAIN', 'batch_size': 29, 'hint_rate': 0.7100000000000001, 'alpha': 16, 'iterations': 12}. Best is trial 92 with value: 31.971075408059654.
[I 2024-04-01 20:03:25,066] Trial 106 finished with value: 40.86165065235185 and parameters: {'model_name': 'GAIN', 'batch_size': 35, 'hint_rate': 0.68, 'alpha': 27, 'iterations': 12}. Best is trial 92 with value: 31.971075408059654.
[I 2024-04-01 20:03:36,536] Trial 110 finished with value: 37.82294105807036 and parameters: {'model_name': 'GAIN', 'batch_size': 28, 'hint_rate': 0.64, 'alpha': 17, 'iterations': 6}. Best is trial 92 with value: 31.971075408059654.
[I 2024-04-01 20:03:41,529] Trial 114 finished with value: 38.32670586453764 and parameters: {'model_name': 'GAIN', 'batch_size': 19, 'hint_rate': 0.66, 'alpha': 19, 'iterations': 7}. Best is trial 92 with value: 31.971075408059654.
[I 2024-04-01 20:03:45,567] Trial 107 finished with value: 43.02593411104628 and parameters: {'model_name': 'GAIN', 'batch_size': 31, 'hint_rate': 0.67, 'alpha': 15, 'iterations': 15}. Best is trial 92 with value: 31.971075408059654.
[I 2024-04-01 20:03:49,495] Trial 111 finished with value: 41.47822129869946 and parameters: {'model_name': 'GAIN', 'batch_size': 29, 'hint_rate': 0.67, 'alpha': 10, 'iterations': 7}. Best is trial 92 with value: 31.971075408059654.
[I 2024-04-01 20:04:24,588] Trial 112 finished with value: 31.799285554427126 and parameters: {'model_name': 'GAIN', 'batch_size': 29, 'hint_rate': 0.66, 'alpha': 20, 'iterations': 7}. Best is trial 112 with value: 31.799285554427126.
[I 2024-04-01 20:04:27,959] Trial 116 finished with value: 52.02009252581507 and parameters: {'model_name': 'GAIN', 'batch_size': 4, 'hint_rate': 0.68, 'alpha': 21, 'iterations': 7}. Best is trial 112 with value: 31.799285554427126.
[I 2024-04-01 20:04:39,821] Trial 118 finished with value: 41.951214577424835 and parameters: {'model_name': 'GAIN', 'batch_size': 4, 'hint_rate': 0.63, 'alpha': 21, 'iterations': 7}. Best is trial 112 with value: 31.799285554427126.
[I 2024-04-01 20:04:42,966] Trial 115 finished with value: 33.44313733498622 and parameters: {'model_name': 'GAIN', 'batch_size': 21, 'hint_rate': 0.66, 'alpha': 19, 'iterations': 8}. Best is trial 112 with value: 31.799285554427126.
[I 2024-04-01 20:04:45,735] Trial 117 finished with value: 48.38647595397202 and parameters: {'model_name': 'GAIN', 'batch_size': 4, 'hint_rate': 0.64, 'alpha': 22, 'iterations': 7}. Best is trial 112 with value: 31.799285554427126.
[I 2024-04-01 20:04:49,425] Trial 113 finished with value: 40.75204959285611 and parameters: {'model_name': 'GAIN', 'batch_size': 23, 'hint_rate': 0.68, 'alpha': 23, 'iterations': 7}. Best is trial 112 with value: 31.799285554427126.
