[I 2024-03-02 03:49:16,896] Trial 112 finished with value: 739.4409984702843 and parameters: {'model_name': 'SimpleImputer', 'strategy': 'mean'}. Best is trial 13 with value: 739.4409984702843.
[I 2024-03-02 03:49:17,200] Trial 80 finished with value: 1129.5616861959 and parameters: {'model_name': 'SimpleImputer', 'strategy': 'most_frequent'}. Best is trial 13 with value: 739.4409984702843.
[I 2024-03-02 03:49:17,408] Trial 88 finished with value: 1129.5616861959 and parameters: {'model_name': 'SimpleImputer', 'strategy': 'most_frequent'}. Best is trial 13 with value: 739.4409984702843.
[I 2024-03-02 03:49:17,629] Trial 81 finished with value: 1129.5616861959 and parameters: {'model_name': 'SimpleImputer', 'strategy': 'most_frequent'}. Best is trial 13 with value: 739.4409984702843.
[I 2024-03-02 03:49:17,882] Trial 117 finished with value: 739.4409984702843 and parameters: {'model_name': 'SimpleImputer', 'strategy': 'mean'}. Best is trial 13 with value: 739.4409984702843.
[I 2024-03-02 03:49:18,062] Trial 85 finished with value: 1129.5616861959 and parameters: {'model_name': 'SimpleImputer', 'strategy': 'most_frequent'}. Best is trial 13 with value: 739.4409984702843.
[I 2024-03-02 03:49:18,370] Trial 84 finished with value: 1129.5616861959 and parameters: {'model_name': 'SimpleImputer', 'strategy': 'most_frequent'}. Best is trial 13 with value: 739.4409984702843.
[I 2024-03-02 03:49:18,636] Trial 121 finished with value: 739.4409984702843 and parameters: {'model_name': 'SimpleImputer', 'strategy': 'mean'}. Best is trial 13 with value: 739.4409984702843.
[I 2024-03-02 03:49:18,870] Trial 87 finished with value: 1129.5616861959 and parameters: {'model_name': 'SimpleImputer', 'strategy': 'most_frequent'}. Best is trial 13 with value: 739.4409984702843.
[I 2024-03-02 03:49:19,119] Trial 119 finished with value: 739.4409984702843 and parameters: {'model_name': 'SimpleImputer', 'strategy': 'mean'}. Best is trial 13 with value: 739.4409984702843.
[I 2024-03-02 03:49:19,406] Trial 116 finished with value: 739.4409984702843 and parameters: {'model_name': 'SimpleImputer', 'strategy': 'mean'}. Best is trial 13 with value: 739.4409984702843.
[I 2024-03-02 03:49:19,647] Trial 122 finished with value: 739.4409984702843 and parameters: {'model_name': 'SimpleImputer', 'strategy': 'mean'}. Best is trial 13 with value: 739.4409984702843.
[I 2024-03-02 03:49:19,875] Trial 114 finished with value: 739.4409984702843 and parameters: {'model_name': 'SimpleImputer', 'strategy': 'mean'}. Best is trial 13 with value: 739.4409984702843.
[I 2024-03-02 03:49:20,100] Trial 118 finished with value: 739.4409984702843 and parameters: {'model_name': 'SimpleImputer', 'strategy': 'mean'}. Best is trial 13 with value: 739.4409984702843.
[I 2024-03-02 03:49:20,457] Trial 113 finished with value: 739.4409984702843 and parameters: {'model_name': 'SimpleImputer', 'strategy': 'mean'}. Best is trial 13 with value: 739.4409984702843.
[I 2024-03-02 03:49:20,719] Trial 86 finished with value: 1129.5616861959 and parameters: {'model_name': 'SimpleImputer', 'strategy': 'most_frequent'}. Best is trial 13 with value: 739.4409984702843.
[I 2024-03-02 03:49:20,961] Trial 120 finished with value: 739.4409984702843 and parameters: {'model_name': 'SimpleImputer', 'strategy': 'mean'}. Best is trial 13 with value: 739.4409984702843.
[I 2024-03-02 03:49:21,176] Trial 123 finished with value: 739.4409984702843 and parameters: {'model_name': 'SimpleImputer', 'strategy': 'mean'}. Best is trial 13 with value: 739.4409984702843.
[I 2024-03-02 03:49:21,405] Trial 92 finished with value: 1129.5616861959 and parameters: {'model_name': 'SimpleImputer', 'strategy': 'most_frequent'}. Best is trial 13 with value: 739.4409984702843.
[I 2024-03-02 03:49:21,648] Trial 126 finished with value: 739.4409984702843 and parameters: {'model_name': 'SimpleImputer', 'strategy': 'mean'}. Best is trial 13 with value: 739.4409984702843.
[I 2024-03-02 03:49:21,878] Trial 127 finished with value: 739.4409984702843 and parameters: {'model_name': 'SimpleImputer', 'strategy': 'mean'}. Best is trial 13 with value: 739.4409984702843.
[I 2024-03-02 03:49:22,121] Trial 128 finished with value: 739.4409984702843 and parameters: {'model_name': 'SimpleImputer', 'strategy': 'mean'}. Best is trial 13 with value: 739.4409984702843.
[I 2024-03-02 03:49:22,323] Trial 93 finished with value: 1129.5616861959 and parameters: {'model_name': 'SimpleImputer', 'strategy': 'most_frequent'}. Best is trial 13 with value: 739.4409984702843.
[I 2024-03-02 03:49:22,643] Trial 130 finished with value: 739.4409984702843 and parameters: {'model_name': 'SimpleImputer', 'strategy': 'mean'}. Best is trial 13 with value: 739.4409984702843.
[I 2024-03-02 03:49:23,054] Trial 124 finished with value: 739.4409984702843 and parameters: {'model_name': 'SimpleImputer', 'strategy': 'mean'}. Best is trial 13 with value: 739.4409984702843.
[I 2024-03-02 03:49:23,420] Trial 125 finished with value: 739.4409984702843 and parameters: {'model_name': 'SimpleImputer', 'strategy': 'mean'}. Best is trial 13 with value: 739.4409984702843.
[I 2024-03-02 03:49:23,845] Trial 129 finished with value: 739.4409984702843 and parameters: {'model_name': 'SimpleImputer', 'strategy': 'mean'}. Best is trial 13 with value: 739.4409984702843.
[I 2024-03-02 03:49:24,155] Trial 90 finished with value: 1129.5616861959 and parameters: {'model_name': 'SimpleImputer', 'strategy': 'most_frequent'}. Best is trial 13 with value: 739.4409984702843.
[I 2024-03-02 03:49:24,544] Trial 89 finished with value: 1129.5616861959 and parameters: {'model_name': 'SimpleImputer', 'strategy': 'most_frequent'}. Best is trial 13 with value: 739.4409984702843.
[I 2024-03-02 03:49:24,777] Trial 78 finished with value: 1129.5616861959 and parameters: {'model_name': 'SimpleImputer', 'strategy': 'most_frequent'}. Best is trial 13 with value: 739.4409984702843.
[I 2024-03-02 03:49:25,115] Trial 131 finished with value: 739.4409984702843 and parameters: {'model_name': 'SimpleImputer', 'strategy': 'mean'}. Best is trial 13 with value: 739.4409984702843.
[I 2024-03-02 03:49:25,481] Trial 134 finished with value: 739.4409984702843 and parameters: {'model_name': 'SimpleImputer', 'strategy': 'mean'}. Best is trial 13 with value: 739.4409984702843.
[I 2024-03-02 03:49:25,915] Trial 91 finished with value: 1129.5616861959 and parameters: {'model_name': 'SimpleImputer', 'strategy': 'most_frequent'}. Best is trial 13 with value: 739.4409984702843.
[I 2024-03-02 03:49:26,204] Trial 132 finished with value: 739.4409984702843 and parameters: {'model_name': 'SimpleImputer', 'strategy': 'mean'}. Best is trial 13 with value: 739.4409984702843.
[I 2024-03-02 03:49:26,453] Trial 135 finished with value: 739.4409984702843 and parameters: {'model_name': 'SimpleImputer', 'strategy': 'mean'}. Best is trial 13 with value: 739.4409984702843.
[I 2024-03-02 03:49:26,720] Trial 139 finished with value: 739.4409984702843 and parameters: {'model_name': 'SimpleImputer', 'strategy': 'mean'}. Best is trial 13 with value: 739.4409984702843.
[I 2024-03-02 03:49:26,981] Trial 133 finished with value: 739.4409984702843 and parameters: {'model_name': 'SimpleImputer', 'strategy': 'mean'}. Best is trial 13 with value: 739.4409984702843.
[I 2024-03-02 03:49:27,257] Trial 94 finished with value: 1129.5616861959 and parameters: {'model_name': 'SimpleImputer', 'strategy': 'most_frequent'}. Best is trial 13 with value: 739.4409984702843.
[I 2024-03-02 03:49:27,436] Trial 95 finished with value: 1129.5616861959 and parameters: {'model_name': 'SimpleImputer', 'strategy': 'most_frequent'}. Best is trial 13 with value: 739.4409984702843.
[I 2024-03-02 03:49:27,617] Trial 138 finished with value: 739.4409984702843 and parameters: {'model_name': 'SimpleImputer', 'strategy': 'mean'}. Best is trial 13 with value: 739.4409984702843.
[I 2024-03-02 03:49:27,883] Trial 137 finished with value: 739.4409984702843 and parameters: {'model_name': 'SimpleImputer', 'strategy': 'mean'}. Best is trial 13 with value: 739.4409984702843.
[I 2024-03-02 03:49:28,209] Trial 147 finished with value: 739.4409984702843 and parameters: {'model_name': 'SimpleImputer', 'strategy': 'mean'}. Best is trial 13 with value: 739.4409984702843.
[I 2024-03-02 03:49:28,392] Trial 136 finished with value: 739.4409984702843 and parameters: {'model_name': 'SimpleImputer', 'strategy': 'mean'}. Best is trial 13 with value: 739.4409984702843.
[I 2024-03-02 03:49:28,778] Trial 141 finished with value: 739.4409984702843 and parameters: {'model_name': 'SimpleImputer', 'strategy': 'mean'}. Best is trial 13 with value: 739.4409984702843.
[I 2024-03-02 03:49:29,029] Trial 140 finished with value: 739.4409984702843 and parameters: {'model_name': 'SimpleImputer', 'strategy': 'mean'}. Best is trial 13 with value: 739.4409984702843.
[I 2024-03-02 03:49:29,355] Trial 149 finished with value: 739.4409984702843 and parameters: {'model_name': 'SimpleImputer', 'strategy': 'mean'}. Best is trial 13 with value: 739.4409984702843.
[I 2024-03-02 03:49:29,617] Trial 154 finished with value: 739.4409984702843 and parameters: {'model_name': 'SimpleImputer', 'strategy': 'mean'}. Best is trial 13 with value: 739.4409984702843.
[I 2024-03-02 03:49:29,870] Trial 142 finished with value: 739.4409984702843 and parameters: {'model_name': 'SimpleImputer', 'strategy': 'mean'}. Best is trial 13 with value: 739.4409984702843.
[I 2024-03-02 03:49:30,063] Trial 146 finished with value: 739.4409984702843 and parameters: {'model_name': 'SimpleImputer', 'strategy': 'mean'}. Best is trial 13 with value: 739.4409984702843.
[I 2024-03-02 03:49:30,242] Trial 143 finished with value: 739.4409984702843 and parameters: {'model_name': 'SimpleImputer', 'strategy': 'mean'}. Best is trial 13 with value: 739.4409984702843.
[I 2024-03-02 03:49:30,448] Trial 155 finished with value: 739.4409984702843 and parameters: {'model_name': 'SimpleImputer', 'strategy': 'mean'}. Best is trial 13 with value: 739.4409984702843.
[I 2024-03-02 03:49:30,770] Trial 152 finished with value: 739.4409984702843 and parameters: {'model_name': 'SimpleImputer', 'strategy': 'mean'}. Best is trial 13 with value: 739.4409984702843.
[I 2024-03-02 03:49:31,101] Trial 145 finished with value: 739.4409984702843 and parameters: {'model_name': 'SimpleImputer', 'strategy': 'mean'}. Best is trial 13 with value: 739.4409984702843.
[I 2024-03-02 03:49:31,457] Trial 144 finished with value: 739.4409984702843 and parameters: {'model_name': 'SimpleImputer', 'strategy': 'mean'}. Best is trial 13 with value: 739.4409984702843.
[I 2024-03-02 03:49:31,734] Trial 151 finished with value: 739.4409984702843 and parameters: {'model_name': 'SimpleImputer', 'strategy': 'mean'}. Best is trial 13 with value: 739.4409984702843.
[I 2024-03-02 03:49:31,929] Trial 150 finished with value: 739.4409984702843 and parameters: {'model_name': 'SimpleImputer', 'strategy': 'mean'}. Best is trial 13 with value: 739.4409984702843.
[I 2024-03-02 03:49:32,209] Trial 156 finished with value: 739.4409984702843 and parameters: {'model_name': 'SimpleImputer', 'strategy': 'mean'}. Best is trial 13 with value: 739.4409984702843.
[I 2024-03-02 03:49:32,405] Trial 148 finished with value: 739.4409984702843 and parameters: {'model_name': 'SimpleImputer', 'strategy': 'mean'}. Best is trial 13 with value: 739.4409984702843.
[I 2024-03-02 03:49:32,731] Trial 157 finished with value: 739.4409984702843 and parameters: {'model_name': 'SimpleImputer', 'strategy': 'mean'}. Best is trial 13 with value: 739.4409984702843.
[I 2024-03-02 03:49:33,013] Trial 158 finished with value: 739.4409984702843 and parameters: {'model_name': 'SimpleImputer', 'strategy': 'mean'}. Best is trial 13 with value: 739.4409984702843.
[I 2024-03-02 03:49:33,315] Trial 160 finished with value: 739.4409984702843 and parameters: {'model_name': 'SimpleImputer', 'strategy': 'mean'}. Best is trial 13 with value: 739.4409984702843.
[I 2024-03-02 03:49:33,563] Trial 153 finished with value: 739.4409984702843 and parameters: {'model_name': 'SimpleImputer', 'strategy': 'mean'}. Best is trial 13 with value: 739.4409984702843.
[I 2024-03-02 03:49:33,750] Trial 159 finished with value: 739.4409984702843 and parameters: {'model_name': 'SimpleImputer', 'strategy': 'mean'}. Best is trial 13 with value: 739.4409984702843.
[I 2024-03-02 03:49:34,026] Trial 168 finished with value: 739.4409984702843 and parameters: {'model_name': 'SimpleImputer', 'strategy': 'mean'}. Best is trial 13 with value: 739.4409984702843.
[I 2024-03-02 03:49:34,295] Trial 166 finished with value: 739.4409984702843 and parameters: {'model_name': 'SimpleImputer', 'strategy': 'mean'}. Best is trial 13 with value: 739.4409984702843.
[I 2024-03-02 03:49:34,552] Trial 164 finished with value: 739.4409984702843 and parameters: {'model_name': 'SimpleImputer', 'strategy': 'mean'}. Best is trial 13 with value: 739.4409984702843.
[I 2024-03-02 03:49:34,822] Trial 161 finished with value: 739.4409984702843 and parameters: {'model_name': 'SimpleImputer', 'strategy': 'mean'}. Best is trial 13 with value: 739.4409984702843.
[I 2024-03-02 03:49:35,179] Trial 169 finished with value: 739.4409984702843 and parameters: {'model_name': 'SimpleImputer', 'strategy': 'mean'}. Best is trial 13 with value: 739.4409984702843.
[I 2024-03-02 03:49:35,479] Trial 162 finished with value: 739.4409984702843 and parameters: {'model_name': 'SimpleImputer', 'strategy': 'mean'}. Best is trial 13 with value: 739.4409984702843.
[I 2024-03-02 03:49:35,669] Trial 167 finished with value: 739.4409984702843 and parameters: {'model_name': 'SimpleImputer', 'strategy': 'mean'}. Best is trial 13 with value: 739.4409984702843.
[I 2024-03-02 03:49:35,868] Trial 170 finished with value: 739.4409984702843 and parameters: {'model_name': 'SimpleImputer', 'strategy': 'mean'}. Best is trial 13 with value: 739.4409984702843.
[I 2024-03-02 03:49:36,158] Trial 165 finished with value: 739.4409984702843 and parameters: {'model_name': 'SimpleImputer', 'strategy': 'mean'}. Best is trial 13 with value: 739.4409984702843.
[I 2024-03-02 03:49:36,358] Trial 163 finished with value: 739.4409984702843 and parameters: {'model_name': 'SimpleImputer', 'strategy': 'mean'}. Best is trial 13 with value: 739.4409984702843.
[I 2024-03-02 03:49:36,534] Trial 171 finished with value: 739.4409984702843 and parameters: {'model_name': 'SimpleImputer', 'strategy': 'mean'}. Best is trial 13 with value: 739.4409984702843.
[I 2024-03-02 03:49:36,720] Trial 173 finished with value: 739.4409984702843 and parameters: {'model_name': 'SimpleImputer', 'strategy': 'mean'}. Best is trial 13 with value: 739.4409984702843.
[I 2024-03-02 03:49:37,077] Trial 175 finished with value: 739.4409984702843 and parameters: {'model_name': 'SimpleImputer', 'strategy': 'mean'}. Best is trial 13 with value: 739.4409984702843.
[I 2024-03-02 03:49:37,315] Trial 178 finished with value: 739.4409984702843 and parameters: {'model_name': 'SimpleImputer', 'strategy': 'mean'}. Best is trial 13 with value: 739.4409984702843.
[I 2024-03-02 03:49:37,727] Trial 172 finished with value: 739.4409984702843 and parameters: {'model_name': 'SimpleImputer', 'strategy': 'mean'}. Best is trial 13 with value: 739.4409984702843.
[I 2024-03-02 03:49:38,005] Trial 179 finished with value: 739.4409984702843 and parameters: {'model_name': 'SimpleImputer', 'strategy': 'mean'}. Best is trial 13 with value: 739.4409984702843.
[I 2024-03-02 03:49:38,261] Trial 189 finished with value: 1129.561760456969 and parameters: {'model_name': 'SimpleImputer', 'strategy': 'constant'}. Best is trial 13 with value: 739.4409984702843.
[I 2024-03-02 03:49:38,436] Trial 174 finished with value: 739.4409984702843 and parameters: {'model_name': 'SimpleImputer', 'strategy': 'mean'}. Best is trial 13 with value: 739.4409984702843.
[I 2024-03-02 03:49:38,637] Trial 186 finished with value: 1129.561760456969 and parameters: {'model_name': 'SimpleImputer', 'strategy': 'constant'}. Best is trial 13 with value: 739.4409984702843.
[I 2024-03-02 03:49:38,832] Trial 180 finished with value: 739.4409984702843 and parameters: {'model_name': 'SimpleImputer', 'strategy': 'mean'}. Best is trial 13 with value: 739.4409984702843.
[I 2024-03-02 03:49:39,006] Trial 187 finished with value: 1129.561760456969 and parameters: {'model_name': 'SimpleImputer', 'strategy': 'constant'}. Best is trial 13 with value: 739.4409984702843.
[I 2024-03-02 03:49:39,241] Trial 183 finished with value: 739.4409984702843 and parameters: {'model_name': 'SimpleImputer', 'strategy': 'mean'}. Best is trial 13 with value: 739.4409984702843.
[I 2024-03-02 03:49:39,446] Trial 181 finished with value: 739.4409984702843 and parameters: {'model_name': 'SimpleImputer', 'strategy': 'mean'}. Best is trial 13 with value: 739.4409984702843.
[I 2024-03-02 03:49:39,619] Trial 196 finished with value: 1129.561760456969 and parameters: {'model_name': 'SimpleImputer', 'strategy': 'constant'}. Best is trial 13 with value: 739.4409984702843.
[I 2024-03-02 03:49:39,802] Trial 184 finished with value: 739.4409984702843 and parameters: {'model_name': 'SimpleImputer', 'strategy': 'mean'}. Best is trial 13 with value: 739.4409984702843.
[I 2024-03-02 03:49:39,970] Trial 176 finished with value: 739.4409984702843 and parameters: {'model_name': 'SimpleImputer', 'strategy': 'mean'}. Best is trial 13 with value: 739.4409984702843.
[I 2024-03-02 03:49:40,140] Trial 190 finished with value: 1129.561760456969 and parameters: {'model_name': 'SimpleImputer', 'strategy': 'constant'}. Best is trial 13 with value: 739.4409984702843.
[I 2024-03-02 03:49:40,416] Trial 195 finished with value: 1129.561760456969 and parameters: {'model_name': 'SimpleImputer', 'strategy': 'constant'}. Best is trial 13 with value: 739.4409984702843.
[I 2024-03-02 03:49:40,604] Trial 185 finished with value: 739.4409984702843 and parameters: {'model_name': 'SimpleImputer', 'strategy': 'mean'}. Best is trial 13 with value: 739.4409984702843.
[I 2024-03-02 03:49:40,842] Trial 177 finished with value: 739.4409984702843 and parameters: {'model_name': 'SimpleImputer', 'strategy': 'mean'}. Best is trial 13 with value: 739.4409984702843.
[I 2024-03-02 03:49:41,066] Trial 191 finished with value: 1129.561760456969 and parameters: {'model_name': 'SimpleImputer', 'strategy': 'constant'}. Best is trial 13 with value: 739.4409984702843.
[I 2024-03-02 03:49:41,249] Trial 194 finished with value: 1129.561760456969 and parameters: {'model_name': 'SimpleImputer', 'strategy': 'constant'}. Best is trial 13 with value: 739.4409984702843.
[I 2024-03-02 03:49:41,483] Trial 182 finished with value: 739.4409984702843 and parameters: {'model_name': 'SimpleImputer', 'strategy': 'mean'}. Best is trial 13 with value: 739.4409984702843.
[I 2024-03-02 03:49:41,744] Trial 193 finished with value: 1129.561760456969 and parameters: {'model_name': 'SimpleImputer', 'strategy': 'constant'}. Best is trial 13 with value: 739.4409984702843.
[I 2024-03-02 03:49:42,007] Trial 197 finished with value: 1129.561760456969 and parameters: {'model_name': 'SimpleImputer', 'strategy': 'constant'}. Best is trial 13 with value: 739.4409984702843.
[I 2024-03-02 03:49:42,187] Trial 192 finished with value: 739.4409984702843 and parameters: {'model_name': 'SimpleImputer', 'strategy': 'mean'}. Best is trial 13 with value: 739.4409984702843.
[I 2024-03-02 03:49:42,403] Trial 188 finished with value: 739.4409984702843 and parameters: {'model_name': 'SimpleImputer', 'strategy': 'mean'}. Best is trial 13 with value: 739.4409984702843.
[I 2024-03-02 03:49:42,660] Trial 198 finished with value: 739.4409984702843 and parameters: {'model_name': 'SimpleImputer', 'strategy': 'mean'}. Best is trial 13 with value: 739.4409984702843.
[I 2024-03-02 03:49:43,036] Trial 199 finished with value: 817.2897438128127 and parameters: {'model_name': 'SimpleImputer', 'strategy': 'median'}. Best is trial 13 with value: 739.4409984702843.
[I 2024-03-02 03:49:43,307] Trial 96 finished with value: 1129.5616861959 and parameters: {'model_name': 'SimpleImputer', 'strategy': 'most_frequent'}. Best is trial 13 with value: 739.4409984702843.
[I 2024-03-02 03:49:43,519] Trial 98 finished with value: 1129.5616861959 and parameters: {'model_name': 'SimpleImputer', 'strategy': 'most_frequent'}. Best is trial 13 with value: 739.4409984702843.
