[I 2024-01-05 00:11:14,619] Trial 137 finished with value: 3196.254628138776 and parameters: {'model_name': 'SimpleImputer', 'strategy': 'median'}. Best is trial 19 with value: 3196.254628138776.
[I 2024-01-05 00:11:15,331] Trial 128 finished with value: 3289.841686561131 and parameters: {'model_name': 'KNNImputer', 'weights': 'uniform', 'keep_empty_features': False}. Best is trial 19 with value: 3196.254628138776.
[I 2024-01-05 00:11:16,302] Trial 142 finished with value: 3206.0108649033655 and parameters: {'model_name': 'SimpleImputer', 'strategy': 'mean'}. Best is trial 19 with value: 3196.254628138776.
[I 2024-01-05 00:11:17,130] Trial 138 finished with value: 3196.254628138776 and parameters: {'model_name': 'SimpleImputer', 'strategy': 'median'}. Best is trial 19 with value: 3196.254628138776.
[I 2024-01-05 00:11:18,043] Trial 140 finished with value: 3196.254628138776 and parameters: {'model_name': 'SimpleImputer', 'strategy': 'median'}. Best is trial 19 with value: 3196.254628138776.
[I 2024-01-05 00:11:19,163] Trial 141 finished with value: 3196.254628138776 and parameters: {'model_name': 'SimpleImputer', 'strategy': 'median'}. Best is trial 19 with value: 3196.254628138776.
[I 2024-01-05 00:11:20,340] Trial 139 finished with value: 3196.254628138776 and parameters: {'model_name': 'SimpleImputer', 'strategy': 'median'}. Best is trial 19 with value: 3196.254628138776.
[I 2024-01-05 00:11:21,207] Trial 143 finished with value: 3206.0108649033655 and parameters: {'model_name': 'SimpleImputer', 'strategy': 'mean'}. Best is trial 19 with value: 3196.254628138776.
[I 2024-01-05 00:11:22,181] Trial 55 finished with value: 3404.609333208704 and parameters: {'model_name': 'RandomForestImputer', 'max_iter': 75, 'decreasing': False, 'min_samples_split': 0.4, 'min_samples_leaf': 0.7000000000000001, 'max_features': 0.1, 'warm_start': True}. Best is trial 19 with value: 3196.254628138776.
[I 2024-01-05 00:11:26,401] Trial 20 finished with value: 3716.498363041329 and parameters: {'model_name': 'IterativeImputer', 'sample_posterior': False, 'initial_strategy': 'constant', 'imputation_order': 'arabic'}. Best is trial 19 with value: 3196.254628138776.
[I 2024-01-05 00:11:28,295] Trial 148 finished with value: 3196.437230863756 and parameters: {'model_name': 'SimpleImputer', 'strategy': 'most_frequent'}. Best is trial 19 with value: 3196.254628138776.
[I 2024-01-05 00:11:29,267] Trial 146 finished with value: 3196.437230863756 and parameters: {'model_name': 'SimpleImputer', 'strategy': 'most_frequent'}. Best is trial 19 with value: 3196.254628138776.
[I 2024-01-05 00:11:31,607] Trial 152 finished with value: 3196.437230863756 and parameters: {'model_name': 'SimpleImputer', 'strategy': 'most_frequent'}. Best is trial 19 with value: 3196.254628138776.
[I 2024-01-05 00:11:36,072] Trial 17 finished with value: 3416.354849416617 and parameters: {'model_name': 'RandomForestImputer', 'max_iter': 95, 'decreasing': True, 'min_samples_split': 0.4, 'min_samples_leaf': 0.5, 'max_features': 0.7000000000000001, 'warm_start': True}. Best is trial 19 with value: 3196.254628138776.
[I 2024-01-05 00:11:40,064] Trial 35 finished with value: 3716.004226713017 and parameters: {'model_name': 'IterativeImputer', 'sample_posterior': False, 'initial_strategy': 'most_frequent', 'imputation_order': 'random'}. Best is trial 19 with value: 3196.254628138776.
[I 2024-01-05 00:11:40,982] Trial 68 finished with value: 10320.125331848187 and parameters: {'model_name': 'GAIN', 'batch_size': 27, 'hint_rate': 0.13, 'alpha': 16, 'iterations': 80}. Best is trial 19 with value: 3196.254628138776.
[I 2024-01-05 00:11:41,937] Trial 0 finished with value: 3717.037882437461 and parameters: {'model_name': 'IterativeImputer', 'sample_posterior': False, 'initial_strategy': 'most_frequent', 'imputation_order': 'random'}. Best is trial 19 with value: 3196.254628138776.
[I 2024-01-05 00:11:44,256] Trial 158 finished with value: 3196.254628138776 and parameters: {'model_name': 'SimpleImputer', 'strategy': 'median'}. Best is trial 19 with value: 3196.254628138776.
[I 2024-01-05 00:11:45,178] Trial 159 finished with value: 3196.254628138776 and parameters: {'model_name': 'SimpleImputer', 'strategy': 'median'}. Best is trial 19 with value: 3196.254628138776.
[I 2024-01-05 00:11:46,045] Trial 160 finished with value: 3196.254628138776 and parameters: {'model_name': 'SimpleImputer', 'strategy': 'median'}. Best is trial 19 with value: 3196.254628138776.
[I 2024-01-05 00:11:48,425] Trial 162 finished with value: 3196.254628138776 and parameters: {'model_name': 'SimpleImputer', 'strategy': 'median'}. Best is trial 19 with value: 3196.254628138776.
[I 2024-01-05 00:11:49,251] Trial 161 finished with value: 3196.254628138776 and parameters: {'model_name': 'SimpleImputer', 'strategy': 'median'}. Best is trial 19 with value: 3196.254628138776.
[I 2024-01-05 00:11:50,132] Trial 163 finished with value: 3196.254628138776 and parameters: {'model_name': 'SimpleImputer', 'strategy': 'median'}. Best is trial 19 with value: 3196.254628138776.
[I 2024-01-05 00:11:52,266] Trial 164 finished with value: 3196.254628138776 and parameters: {'model_name': 'SimpleImputer', 'strategy': 'median'}. Best is trial 19 with value: 3196.254628138776.
[I 2024-01-05 00:12:10,786] Trial 78 finished with value: 3713.9247182127415 and parameters: {'model_name': 'IterativeImputer', 'sample_posterior': False, 'initial_strategy': 'most_frequent', 'imputation_order': 'random'}. Best is trial 19 with value: 3196.254628138776.
[I 2024-01-05 00:12:13,696] Trial 168 finished with value: 3196.254628138776 and parameters: {'model_name': 'SimpleImputer', 'strategy': 'median'}. Best is trial 19 with value: 3196.254628138776.
[I 2024-01-05 00:12:16,320] Trial 169 finished with value: 3196.254628138776 and parameters: {'model_name': 'SimpleImputer', 'strategy': 'median'}. Best is trial 19 with value: 3196.254628138776.
[I 2024-01-05 00:12:18,870] Trial 170 finished with value: 3196.254628138776 and parameters: {'model_name': 'SimpleImputer', 'strategy': 'median'}. Best is trial 19 with value: 3196.254628138776.
[I 2024-01-05 00:12:21,524] Trial 171 finished with value: 3196.254628138776 and parameters: {'model_name': 'SimpleImputer', 'strategy': 'median'}. Best is trial 19 with value: 3196.254628138776.
[I 2024-01-05 00:12:25,321] Trial 72 finished with value: 3716.166374285664 and parameters: {'model_name': 'IterativeImputer', 'sample_posterior': False, 'initial_strategy': 'median', 'imputation_order': 'random'}. Best is trial 19 with value: 3196.254628138776.
[I 2024-01-05 00:12:34,842] Trial 76 finished with value: 3715.7103180463973 and parameters: {'model_name': 'IterativeImputer', 'sample_posterior': False, 'initial_strategy': 'mean', 'imputation_order': 'random'}. Best is trial 19 with value: 3196.254628138776.
[I 2024-01-05 00:12:43,812] Trial 75 finished with value: 3716.498363041329 and parameters: {'model_name': 'IterativeImputer', 'sample_posterior': False, 'initial_strategy': 'constant', 'imputation_order': 'arabic'}. Best is trial 19 with value: 3196.254628138776.
[I 2024-01-05 00:12:51,171] Trial 77 finished with value: 3717.2898204109324 and parameters: {'model_name': 'IterativeImputer', 'sample_posterior': False, 'initial_strategy': 'most_frequent', 'imputation_order': 'ascending'}. Best is trial 19 with value: 3196.254628138776.
[I 2024-01-05 00:13:03,520] Trial 83 finished with value: 3717.2939465840927 and parameters: {'model_name': 'IterativeImputer', 'sample_posterior': False, 'initial_strategy': 'median', 'imputation_order': 'ascending'}. Best is trial 19 with value: 3196.254628138776.
[I 2024-01-05 00:13:07,650] Trial 59 finished with value: 3210.9270199367643 and parameters: {'model_name': 'RandomForestImputer', 'max_iter': 7, 'decreasing': False, 'min_samples_split': 0.5, 'min_samples_leaf': 0.6, 'max_features': 0.6, 'warm_start': False}. Best is trial 19 with value: 3196.254628138776.
[I 2024-01-05 00:13:09,819] Trial 178 finished with value: 3196.254628138776 and parameters: {'model_name': 'SimpleImputer', 'strategy': 'median'}. Best is trial 19 with value: 3196.254628138776.
[I 2024-01-05 00:13:12,157] Trial 179 finished with value: 3196.254628138776 and parameters: {'model_name': 'SimpleImputer', 'strategy': 'median'}. Best is trial 19 with value: 3196.254628138776.
[I 2024-01-05 00:13:35,742] Trial 88 finished with value: 3714.5865952058475 and parameters: {'model_name': 'IterativeImputer', 'sample_posterior': False, 'initial_strategy': 'median', 'imputation_order': 'roman'}. Best is trial 19 with value: 3196.254628138776.
[I 2024-01-05 00:13:55,025] Trial 89 finished with value: 3717.2984910508267 and parameters: {'model_name': 'IterativeImputer', 'sample_posterior': False, 'initial_strategy': 'mean', 'imputation_order': 'ascending'}. Best is trial 19 with value: 3196.254628138776.
[I 2024-01-05 00:15:07,799] Trial 32 finished with value: 4174.25627411469 and parameters: {'model_name': 'GAIN', 'batch_size': 11, 'hint_rate': 0.76, 'alpha': 50, 'iterations': 178}. Best is trial 19 with value: 3196.254628138776.
[I 2024-01-05 00:15:09,855] Trial 183 finished with value: 3196.254628138776 and parameters: {'model_name': 'SimpleImputer', 'strategy': 'median'}. Best is trial 19 with value: 3196.254628138776.
[I 2024-01-05 00:15:11,781] Trial 184 finished with value: 3196.254628138776 and parameters: {'model_name': 'SimpleImputer', 'strategy': 'median'}. Best is trial 19 with value: 3196.254628138776.
[I 2024-01-05 00:15:45,028] Trial 23 finished with value: inf and parameters: {'model_name': 'GAIN', 'batch_size': 192, 'hint_rate': 0.63, 'alpha': 55, 'iterations': 1902}. Best is trial 19 with value: 3196.254628138776.
[I 2024-01-05 00:15:47,134] Trial 186 finished with value: 3196.254628138776 and parameters: {'model_name': 'SimpleImputer', 'strategy': 'median'}. Best is trial 19 with value: 3196.254628138776.
[I 2024-01-05 00:15:49,117] Trial 187 finished with value: 3196.254628138776 and parameters: {'model_name': 'SimpleImputer', 'strategy': 'median'}. Best is trial 19 with value: 3196.254628138776.
[I 2024-01-05 00:15:51,261] Trial 188 finished with value: 3196.254628138776 and parameters: {'model_name': 'SimpleImputer', 'strategy': 'median'}. Best is trial 19 with value: 3196.254628138776.
[I 2024-01-05 00:15:53,568] Trial 189 finished with value: 3196.254628138776 and parameters: {'model_name': 'SimpleImputer', 'strategy': 'median'}. Best is trial 19 with value: 3196.254628138776.
[I 2024-01-05 00:15:55,861] Trial 190 finished with value: 3196.254628138776 and parameters: {'model_name': 'SimpleImputer', 'strategy': 'median'}. Best is trial 19 with value: 3196.254628138776.
[I 2024-01-05 00:15:57,939] Trial 191 finished with value: 7023.0385611637 and parameters: {'model_name': 'SimpleImputer', 'strategy': 'constant'}. Best is trial 19 with value: 3196.254628138776.
[I 2024-01-05 00:16:56,337] Trial 11 finished with value: 3192.9168124033044 and parameters: {'model_name': 'IterativeImputer', 'sample_posterior': True, 'initial_strategy': 'median', 'imputation_order': 'arabic'}. Best is trial 11 with value: 3192.9168124033044.
[I 2024-01-05 00:16:58,498] Trial 43 finished with value: 3036.890478534986 and parameters: {'model_name': 'IterativeImputer', 'sample_posterior': True, 'initial_strategy': 'constant', 'imputation_order': 'descending'}. Best is trial 43 with value: 3036.890478534986.
[I 2024-01-05 00:17:00,541] Trial 51 finished with value: 3315.365294090636 and parameters: {'model_name': 'IterativeImputer', 'sample_posterior': True, 'initial_strategy': 'mean', 'imputation_order': 'ascending'}. Best is trial 43 with value: 3036.890478534986.
[I 2024-01-05 00:17:06,754] Trial 7 finished with value: 3238.96602140943 and parameters: {'model_name': 'IterativeImputer', 'sample_posterior': True, 'initial_strategy': 'most_frequent', 'imputation_order': 'ascending'}. Best is trial 43 with value: 3036.890478534986.
[I 2024-01-05 00:17:09,179] Trial 60 finished with value: 3057.24545343547 and parameters: {'model_name': 'IterativeImputer', 'sample_posterior': True, 'initial_strategy': 'constant', 'imputation_order': 'random'}. Best is trial 43 with value: 3036.890478534986.
[I 2024-01-05 00:17:10,110] Trial 26 finished with value: 3131.777268532743 and parameters: {'model_name': 'IterativeImputer', 'sample_posterior': True, 'initial_strategy': 'mean', 'imputation_order': 'random'}. Best is trial 43 with value: 3036.890478534986.
[I 2024-01-05 00:17:12,927] Trial 70 finished with value: 3229.5025525646347 and parameters: {'model_name': 'IterativeImputer', 'sample_posterior': True, 'initial_strategy': 'mean', 'imputation_order': 'arabic'}. Best is trial 43 with value: 3036.890478534986.
[I 2024-01-05 00:17:15,497] Trial 44 finished with value: 4207.767457714124 and parameters: {'model_name': 'GAIN', 'batch_size': 343, 'hint_rate': 0.64, 'alpha': 23, 'iterations': 195}. Best is trial 43 with value: 3036.890478534986.
[I 2024-01-05 00:17:53,597] Trial 74 finished with value: 3231.6567189548086 and parameters: {'model_name': 'IterativeImputer', 'sample_posterior': True, 'initial_strategy': 'mean', 'imputation_order': 'ascending'}. Best is trial 43 with value: 3036.890478534986.
[I 2024-01-05 00:17:59,786] Trial 79 finished with value: 3118.850793559399 and parameters: {'model_name': 'IterativeImputer', 'sample_posterior': True, 'initial_strategy': 'median', 'imputation_order': 'arabic'}. Best is trial 43 with value: 3036.890478534986.
[I 2024-01-05 00:18:01,676] Trial 81 finished with value: 3125.9473282488593 and parameters: {'model_name': 'IterativeImputer', 'sample_posterior': True, 'initial_strategy': 'constant', 'imputation_order': 'descending'}. Best is trial 43 with value: 3036.890478534986.
[I 2024-01-05 00:18:03,469] Trial 84 finished with value: 3032.4568310975906 and parameters: {'model_name': 'IterativeImputer', 'sample_posterior': True, 'initial_strategy': 'most_frequent', 'imputation_order': 'roman'}. Best is trial 84 with value: 3032.4568310975906.
[I 2024-01-05 00:18:09,385] Trial 65 finished with value: 3210.4836365703222 and parameters: {'model_name': 'RandomForestImputer', 'max_iter': 22, 'decreasing': True, 'min_samples_split': 0.6000000000000001, 'min_samples_leaf': 0.5, 'max_features': 0.1, 'warm_start': False}. Best is trial 84 with value: 3032.4568310975906.
[I 2024-01-05 00:18:27,172] Trial 85 finished with value: 3060.44652293113 and parameters: {'model_name': 'IterativeImputer', 'sample_posterior': True, 'initial_strategy': 'median', 'imputation_order': 'descending'}. Best is trial 84 with value: 3032.4568310975906.
[I 2024-01-05 00:18:28,813] Trial 86 finished with value: 3076.3030457268114 and parameters: {'model_name': 'IterativeImputer', 'sample_posterior': True, 'initial_strategy': 'constant', 'imputation_order': 'ascending'}. Best is trial 84 with value: 3032.4568310975906.
[I 2024-01-05 00:18:35,566] Trial 67 finished with value: 3384.063302376573 and parameters: {'model_name': 'GAIN', 'batch_size': 21, 'hint_rate': 0.88, 'alpha': 28, 'iterations': 255}. Best is trial 84 with value: 3032.4568310975906.
[I 2024-01-05 00:18:41,103] Trial 87 finished with value: 3020.751969376152 and parameters: {'model_name': 'IterativeImputer', 'sample_posterior': True, 'initial_strategy': 'median', 'imputation_order': 'arabic'}. Best is trial 87 with value: 3020.751969376152.
[I 2024-01-05 00:19:21,103] Trial 54 finished with value: 3209.704001148689 and parameters: {'model_name': 'RandomForestImputer', 'max_iter': 37, 'decreasing': False, 'min_samples_split': 0.4, 'min_samples_leaf': 0.4, 'max_features': 0.1, 'warm_start': False}. Best is trial 87 with value: 3020.751969376152.
[I 2024-01-05 00:19:22,893] Trial 90 finished with value: 3192.188451097773 and parameters: {'model_name': 'IterativeImputer', 'sample_posterior': True, 'initial_strategy': 'most_frequent', 'imputation_order': 'roman'}. Best is trial 87 with value: 3020.751969376152.
[I 2024-01-05 00:19:34,784] Trial 149 finished with value: 3217.2400058956555 and parameters: {'model_name': 'IterativeImputer', 'sample_posterior': True, 'initial_strategy': 'constant', 'imputation_order': 'ascending'}. Best is trial 87 with value: 3020.751969376152.
[I 2024-01-05 00:19:37,062] Trial 147 finished with value: 3093.5713983943892 and parameters: {'model_name': 'IterativeImputer', 'sample_posterior': True, 'initial_strategy': 'constant', 'imputation_order': 'ascending'}. Best is trial 87 with value: 3020.751969376152.
[I 2024-01-05 00:19:42,697] Trial 155 finished with value: 3056.4409456490553 and parameters: {'model_name': 'IterativeImputer', 'sample_posterior': True, 'initial_strategy': 'mean', 'imputation_order': 'ascending'}. Best is trial 87 with value: 3020.751969376152.
[I 2024-01-05 00:19:44,041] Trial 167 finished with value: 3019.0452400398754 and parameters: {'model_name': 'IterativeImputer', 'sample_posterior': True, 'initial_strategy': 'constant', 'imputation_order': 'ascending'}. Best is trial 167 with value: 3019.0452400398754.
[I 2024-01-05 00:19:44,842] Trial 145 finished with value: 3017.189925069949 and parameters: {'model_name': 'IterativeImputer', 'sample_posterior': True, 'initial_strategy': 'constant', 'imputation_order': 'random'}. Best is trial 145 with value: 3017.189925069949.
[I 2024-01-05 00:19:46,254] Trial 64 finished with value: 3209.816254406647 and parameters: {'model_name': 'RandomForestImputer', 'max_iter': 35, 'decreasing': True, 'min_samples_split': 0.5, 'min_samples_leaf': 0.8, 'max_features': 0.1, 'warm_start': False}. Best is trial 145 with value: 3017.189925069949.
[I 2024-01-05 00:19:47,377] Trial 151 finished with value: 3067.00036382396 and parameters: {'model_name': 'IterativeImputer', 'sample_posterior': True, 'initial_strategy': 'constant', 'imputation_order': 'random'}. Best is trial 145 with value: 3017.189925069949.
[I 2024-01-05 00:19:48,485] Trial 153 finished with value: 3257.5593123589115 and parameters: {'model_name': 'IterativeImputer', 'sample_posterior': True, 'initial_strategy': 'mean', 'imputation_order': 'ascending'}. Best is trial 145 with value: 3017.189925069949.
[I 2024-01-05 00:19:49,233] Trial 150 finished with value: 3080.5227769904914 and parameters: {'model_name': 'IterativeImputer', 'sample_posterior': True, 'initial_strategy': 'constant', 'imputation_order': 'random'}. Best is trial 145 with value: 3017.189925069949.
[I 2024-01-05 00:19:50,176] Trial 156 finished with value: 3140.74787291795 and parameters: {'model_name': 'IterativeImputer', 'sample_posterior': True, 'initial_strategy': 'median', 'imputation_order': 'ascending'}. Best is trial 145 with value: 3017.189925069949.
[I 2024-01-05 00:19:51,188] Trial 166 finished with value: 3230.2934922752966 and parameters: {'model_name': 'IterativeImputer', 'sample_posterior': True, 'initial_strategy': 'constant', 'imputation_order': 'ascending'}. Best is trial 145 with value: 3017.189925069949.
[I 2024-01-05 00:19:51,792] Trial 144 finished with value: 3031.307193172721 and parameters: {'model_name': 'IterativeImputer', 'sample_posterior': True, 'initial_strategy': 'constant', 'imputation_order': 'random'}. Best is trial 145 with value: 3017.189925069949.
[I 2024-01-05 00:19:53,887] Trial 157 finished with value: 3007.837814071319 and parameters: {'model_name': 'IterativeImputer', 'sample_posterior': True, 'initial_strategy': 'mean', 'imputation_order': 'random'}. Best is trial 157 with value: 3007.837814071319.
[I 2024-01-05 00:19:54,616] Trial 165 finished with value: 3122.46859406967 and parameters: {'model_name': 'IterativeImputer', 'sample_posterior': True, 'initial_strategy': 'median', 'imputation_order': 'ascending'}. Best is trial 157 with value: 3007.837814071319.
[I 2024-01-05 00:21:15,404] Trial 194 finished with value: 3015.559843397509 and parameters: {'model_name': 'IterativeImputer', 'sample_posterior': True, 'initial_strategy': 'constant', 'imputation_order': 'descending'}. Best is trial 157 with value: 3007.837814071319.
[I 2024-01-05 00:21:16,420] Trial 193 finished with value: 3064.1073429310577 and parameters: {'model_name': 'IterativeImputer', 'sample_posterior': True, 'initial_strategy': 'median', 'imputation_order': 'descending'}. Best is trial 157 with value: 3007.837814071319.
[I 2024-01-05 00:21:17,337] Trial 195 finished with value: 3049.102363088682 and parameters: {'model_name': 'IterativeImputer', 'sample_posterior': True, 'initial_strategy': 'constant', 'imputation_order': 'descending'}. Best is trial 157 with value: 3007.837814071319.
[I 2024-01-05 00:21:19,230] Trial 198 finished with value: 3162.72996856155 and parameters: {'model_name': 'IterativeImputer', 'sample_posterior': True, 'initial_strategy': 'constant', 'imputation_order': 'descending'}. Best is trial 157 with value: 3007.837814071319.
[I 2024-01-05 00:21:20,956] Trial 196 finished with value: 3327.6545784188334 and parameters: {'model_name': 'IterativeImputer', 'sample_posterior': True, 'initial_strategy': 'constant', 'imputation_order': 'descending'}. Best is trial 157 with value: 3007.837814071319.
[I 2024-01-05 00:21:21,663] Trial 197 finished with value: 3053.3443833041956 and parameters: {'model_name': 'IterativeImputer', 'sample_posterior': True, 'initial_strategy': 'constant', 'imputation_order': 'descending'}. Best is trial 157 with value: 3007.837814071319.
[I 2024-01-05 00:21:23,409] Trial 199 finished with value: 3081.8422964189917 and parameters: {'model_name': 'IterativeImputer', 'sample_posterior': True, 'initial_strategy': 'constant', 'imputation_order': 'descending'}. Best is trial 157 with value: 3007.837814071319.
[I 2024-01-05 00:26:51,481] Trial 172 finished with value: inf and parameters: {'model_name': 'GAIN', 'batch_size': 7, 'hint_rate': 0.36000000000000004, 'alpha': 43, 'iterations': 20479}. Best is trial 157 with value: 3007.837814071319.
