[I 2024-04-23 01:22:38,253] Trial 66 finished with value: 1420.311467174776 and parameters: {'model_name': 'SimpleImputer', 'strategy': 'most_frequent'}. Best is trial 0 with value: 800.7415124315072.
[I 2024-04-23 01:22:38,531] Trial 107 finished with value: 800.7415124315072 and parameters: {'model_name': 'SimpleImputer', 'strategy': 'mean'}. Best is trial 0 with value: 800.7415124315072.
[I 2024-04-23 01:22:38,936] Trial 92 finished with value: 1420.311467174776 and parameters: {'model_name': 'SimpleImputer', 'strategy': 'most_frequent'}. Best is trial 0 with value: 800.7415124315072.
[I 2024-04-23 01:22:39,186] Trial 110 finished with value: 800.7415124315072 and parameters: {'model_name': 'SimpleImputer', 'strategy': 'mean'}. Best is trial 0 with value: 800.7415124315072.
[I 2024-04-23 01:22:39,479] Trial 114 finished with value: 800.7415124315072 and parameters: {'model_name': 'SimpleImputer', 'strategy': 'mean'}. Best is trial 0 with value: 800.7415124315072.
[I 2024-04-23 01:22:39,763] Trial 79 finished with value: 1420.311467174776 and parameters: {'model_name': 'SimpleImputer', 'strategy': 'most_frequent'}. Best is trial 0 with value: 800.7415124315072.
[I 2024-04-23 01:22:39,982] Trial 75 finished with value: 1420.311467174776 and parameters: {'model_name': 'SimpleImputer', 'strategy': 'most_frequent'}. Best is trial 0 with value: 800.7415124315072.
[I 2024-04-23 01:22:40,155] Trial 113 finished with value: 800.7415124315072 and parameters: {'model_name': 'SimpleImputer', 'strategy': 'mean'}. Best is trial 0 with value: 800.7415124315072.
[I 2024-04-23 01:22:40,378] Trial 90 finished with value: 1420.311467174776 and parameters: {'model_name': 'SimpleImputer', 'strategy': 'most_frequent'}. Best is trial 0 with value: 800.7415124315072.
[I 2024-04-23 01:22:40,636] Trial 74 finished with value: 1420.311467174776 and parameters: {'model_name': 'SimpleImputer', 'strategy': 'most_frequent'}. Best is trial 0 with value: 800.7415124315072.
[I 2024-04-23 01:22:40,821] Trial 112 finished with value: 800.7415124315072 and parameters: {'model_name': 'SimpleImputer', 'strategy': 'mean'}. Best is trial 0 with value: 800.7415124315072.
[I 2024-04-23 01:22:41,053] Trial 119 finished with value: 800.7415124315072 and parameters: {'model_name': 'SimpleImputer', 'strategy': 'mean'}. Best is trial 0 with value: 800.7415124315072.
[I 2024-04-23 01:22:41,298] Trial 121 finished with value: 800.7415124315072 and parameters: {'model_name': 'SimpleImputer', 'strategy': 'mean'}. Best is trial 0 with value: 800.7415124315072.
[I 2024-04-23 01:22:41,535] Trial 109 finished with value: 800.7415124315072 and parameters: {'model_name': 'SimpleImputer', 'strategy': 'mean'}. Best is trial 0 with value: 800.7415124315072.
[I 2024-04-23 01:22:41,728] Trial 117 finished with value: 800.7415124315072 and parameters: {'model_name': 'SimpleImputer', 'strategy': 'mean'}. Best is trial 0 with value: 800.7415124315072.
[I 2024-04-23 01:22:41,949] Trial 85 finished with value: 1420.311467174776 and parameters: {'model_name': 'SimpleImputer', 'strategy': 'most_frequent'}. Best is trial 0 with value: 800.7415124315072.
[I 2024-04-23 01:22:42,202] Trial 115 finished with value: 800.7415124315072 and parameters: {'model_name': 'SimpleImputer', 'strategy': 'mean'}. Best is trial 0 with value: 800.7415124315072.
[I 2024-04-23 01:22:42,491] Trial 93 finished with value: 1420.311467174776 and parameters: {'model_name': 'SimpleImputer', 'strategy': 'most_frequent'}. Best is trial 0 with value: 800.7415124315072.
[I 2024-04-23 01:22:42,719] Trial 88 finished with value: 1420.311467174776 and parameters: {'model_name': 'SimpleImputer', 'strategy': 'most_frequent'}. Best is trial 0 with value: 800.7415124315072.
[I 2024-04-23 01:22:43,045] Trial 120 finished with value: 800.7415124315072 and parameters: {'model_name': 'SimpleImputer', 'strategy': 'mean'}. Best is trial 0 with value: 800.7415124315072.
[I 2024-04-23 01:22:43,358] Trial 116 finished with value: 800.7415124315072 and parameters: {'model_name': 'SimpleImputer', 'strategy': 'mean'}. Best is trial 0 with value: 800.7415124315072.
[I 2024-04-23 01:22:43,608] Trial 124 finished with value: 800.7415124315072 and parameters: {'model_name': 'SimpleImputer', 'strategy': 'mean'}. Best is trial 0 with value: 800.7415124315072.
[I 2024-04-23 01:22:43,958] Trial 132 finished with value: 800.7415124315072 and parameters: {'model_name': 'SimpleImputer', 'strategy': 'mean'}. Best is trial 0 with value: 800.7415124315072.
[I 2024-04-23 01:22:44,225] Trial 129 finished with value: 800.7415124315072 and parameters: {'model_name': 'SimpleImputer', 'strategy': 'mean'}. Best is trial 0 with value: 800.7415124315072.
[I 2024-04-23 01:22:44,472] Trial 95 finished with value: 1420.311467174776 and parameters: {'model_name': 'SimpleImputer', 'strategy': 'most_frequent'}. Best is trial 0 with value: 800.7415124315072.
[I 2024-04-23 01:22:44,687] Trial 123 finished with value: 800.7415124315072 and parameters: {'model_name': 'SimpleImputer', 'strategy': 'mean'}. Best is trial 0 with value: 800.7415124315072.
[I 2024-04-23 01:22:44,907] Trial 91 finished with value: 1420.311467174776 and parameters: {'model_name': 'SimpleImputer', 'strategy': 'most_frequent'}. Best is trial 0 with value: 800.7415124315072.
[I 2024-04-23 01:22:45,099] Trial 89 finished with value: 1420.311467174776 and parameters: {'model_name': 'SimpleImputer', 'strategy': 'most_frequent'}. Best is trial 0 with value: 800.7415124315072.
[I 2024-04-23 01:22:45,387] Trial 136 finished with value: 800.7415124315072 and parameters: {'model_name': 'SimpleImputer', 'strategy': 'mean'}. Best is trial 0 with value: 800.7415124315072.
[I 2024-04-23 01:22:45,620] Trial 122 finished with value: 800.7415124315072 and parameters: {'model_name': 'SimpleImputer', 'strategy': 'mean'}. Best is trial 0 with value: 800.7415124315072.
[I 2024-04-23 01:22:45,806] Trial 138 finished with value: 800.7415124315072 and parameters: {'model_name': 'SimpleImputer', 'strategy': 'mean'}. Best is trial 0 with value: 800.7415124315072.
[I 2024-04-23 01:22:46,052] Trial 125 finished with value: 800.7415124315072 and parameters: {'model_name': 'SimpleImputer', 'strategy': 'mean'}. Best is trial 0 with value: 800.7415124315072.
[I 2024-04-23 01:22:46,287] Trial 130 finished with value: 800.7415124315072 and parameters: {'model_name': 'SimpleImputer', 'strategy': 'mean'}. Best is trial 0 with value: 800.7415124315072.
[I 2024-04-23 01:22:46,552] Trial 131 finished with value: 800.7415124315072 and parameters: {'model_name': 'SimpleImputer', 'strategy': 'mean'}. Best is trial 0 with value: 800.7415124315072.
[I 2024-04-23 01:22:46,786] Trial 134 finished with value: 800.7415124315072 and parameters: {'model_name': 'SimpleImputer', 'strategy': 'mean'}. Best is trial 0 with value: 800.7415124315072.
[I 2024-04-23 01:22:47,018] Trial 135 finished with value: 800.7415124315072 and parameters: {'model_name': 'SimpleImputer', 'strategy': 'mean'}. Best is trial 0 with value: 800.7415124315072.
[I 2024-04-23 01:22:47,211] Trial 127 finished with value: 800.7415124315072 and parameters: {'model_name': 'SimpleImputer', 'strategy': 'mean'}. Best is trial 0 with value: 800.7415124315072.
[I 2024-04-23 01:22:47,434] Trial 137 finished with value: 800.7415124315072 and parameters: {'model_name': 'SimpleImputer', 'strategy': 'mean'}. Best is trial 0 with value: 800.7415124315072.
[I 2024-04-23 01:22:47,694] Trial 126 finished with value: 800.7415124315072 and parameters: {'model_name': 'SimpleImputer', 'strategy': 'mean'}. Best is trial 0 with value: 800.7415124315072.
[I 2024-04-23 01:22:47,919] Trial 118 finished with value: 800.7415124315072 and parameters: {'model_name': 'SimpleImputer', 'strategy': 'mean'}. Best is trial 0 with value: 800.7415124315072.
[I 2024-04-23 01:22:48,260] Trial 144 finished with value: 800.7415124315072 and parameters: {'model_name': 'SimpleImputer', 'strategy': 'mean'}. Best is trial 0 with value: 800.7415124315072.
[I 2024-04-23 01:22:48,467] Trial 133 finished with value: 800.7415124315072 and parameters: {'model_name': 'SimpleImputer', 'strategy': 'mean'}. Best is trial 0 with value: 800.7415124315072.
[I 2024-04-23 01:22:48,708] Trial 128 finished with value: 800.7415124315072 and parameters: {'model_name': 'SimpleImputer', 'strategy': 'mean'}. Best is trial 0 with value: 800.7415124315072.
[I 2024-04-23 01:22:48,957] Trial 139 finished with value: 800.7415124315072 and parameters: {'model_name': 'SimpleImputer', 'strategy': 'mean'}. Best is trial 0 with value: 800.7415124315072.
[I 2024-04-23 01:22:49,135] Trial 142 finished with value: 800.7415124315072 and parameters: {'model_name': 'SimpleImputer', 'strategy': 'mean'}. Best is trial 0 with value: 800.7415124315072.
[I 2024-04-23 01:22:49,370] Trial 141 finished with value: 800.7415124315072 and parameters: {'model_name': 'SimpleImputer', 'strategy': 'mean'}. Best is trial 0 with value: 800.7415124315072.
[I 2024-04-23 01:22:49,573] Trial 145 finished with value: 800.7415124315072 and parameters: {'model_name': 'SimpleImputer', 'strategy': 'mean'}. Best is trial 0 with value: 800.7415124315072.
[I 2024-04-23 01:22:49,745] Trial 150 finished with value: 800.7415124315072 and parameters: {'model_name': 'SimpleImputer', 'strategy': 'mean'}. Best is trial 0 with value: 800.7415124315072.
[I 2024-04-23 01:22:50,005] Trial 154 finished with value: 800.7415124315072 and parameters: {'model_name': 'SimpleImputer', 'strategy': 'mean'}. Best is trial 0 with value: 800.7415124315072.
[I 2024-04-23 01:22:50,374] Trial 143 finished with value: 800.7415124315072 and parameters: {'model_name': 'SimpleImputer', 'strategy': 'mean'}. Best is trial 0 with value: 800.7415124315072.
[I 2024-04-23 01:22:50,627] Trial 149 finished with value: 800.7415124315072 and parameters: {'model_name': 'SimpleImputer', 'strategy': 'mean'}. Best is trial 0 with value: 800.7415124315072.
[I 2024-04-23 01:22:50,795] Trial 156 finished with value: 800.7415124315072 and parameters: {'model_name': 'SimpleImputer', 'strategy': 'mean'}. Best is trial 0 with value: 800.7415124315072.
[I 2024-04-23 01:22:51,070] Trial 140 finished with value: 800.7415124315072 and parameters: {'model_name': 'SimpleImputer', 'strategy': 'mean'}. Best is trial 0 with value: 800.7415124315072.
[I 2024-04-23 01:22:51,353] Trial 160 finished with value: 800.7415124315072 and parameters: {'model_name': 'SimpleImputer', 'strategy': 'mean'}. Best is trial 0 with value: 800.7415124315072.
[I 2024-04-23 01:22:51,598] Trial 151 finished with value: 800.7415124315072 and parameters: {'model_name': 'SimpleImputer', 'strategy': 'mean'}. Best is trial 0 with value: 800.7415124315072.
[I 2024-04-23 01:22:51,838] Trial 155 finished with value: 800.7415124315072 and parameters: {'model_name': 'SimpleImputer', 'strategy': 'mean'}. Best is trial 0 with value: 800.7415124315072.
[I 2024-04-23 01:22:52,059] Trial 152 finished with value: 800.7415124315072 and parameters: {'model_name': 'SimpleImputer', 'strategy': 'mean'}. Best is trial 0 with value: 800.7415124315072.
[I 2024-04-23 01:22:52,353] Trial 148 finished with value: 800.7415124315072 and parameters: {'model_name': 'SimpleImputer', 'strategy': 'mean'}. Best is trial 0 with value: 800.7415124315072.
[I 2024-04-23 01:22:52,615] Trial 153 finished with value: 800.7415124315072 and parameters: {'model_name': 'SimpleImputer', 'strategy': 'mean'}. Best is trial 0 with value: 800.7415124315072.
[I 2024-04-23 01:22:52,791] Trial 172 finished with value: 800.7415124315072 and parameters: {'model_name': 'SimpleImputer', 'strategy': 'mean'}. Best is trial 0 with value: 800.7415124315072.
[I 2024-04-23 01:22:53,037] Trial 158 finished with value: 800.7415124315072 and parameters: {'model_name': 'SimpleImputer', 'strategy': 'mean'}. Best is trial 0 with value: 800.7415124315072.
[I 2024-04-23 01:22:53,291] Trial 146 finished with value: 800.7415124315072 and parameters: {'model_name': 'SimpleImputer', 'strategy': 'mean'}. Best is trial 0 with value: 800.7415124315072.
[I 2024-04-23 01:22:53,468] Trial 147 finished with value: 800.7415124315072 and parameters: {'model_name': 'SimpleImputer', 'strategy': 'mean'}. Best is trial 0 with value: 800.7415124315072.
[I 2024-04-23 01:22:53,710] Trial 159 finished with value: 800.7415124315072 and parameters: {'model_name': 'SimpleImputer', 'strategy': 'mean'}. Best is trial 0 with value: 800.7415124315072.
[I 2024-04-23 01:22:53,987] Trial 162 finished with value: 800.7415124315072 and parameters: {'model_name': 'SimpleImputer', 'strategy': 'mean'}. Best is trial 0 with value: 800.7415124315072.
[I 2024-04-23 01:22:54,224] Trial 161 finished with value: 800.7415124315072 and parameters: {'model_name': 'SimpleImputer', 'strategy': 'mean'}. Best is trial 0 with value: 800.7415124315072.
[I 2024-04-23 01:22:54,466] Trial 165 finished with value: 800.7415124315072 and parameters: {'model_name': 'SimpleImputer', 'strategy': 'mean'}. Best is trial 0 with value: 800.7415124315072.
[I 2024-04-23 01:22:54,715] Trial 168 finished with value: 800.7415124315072 and parameters: {'model_name': 'SimpleImputer', 'strategy': 'mean'}. Best is trial 0 with value: 800.7415124315072.
[I 2024-04-23 01:22:54,953] Trial 167 finished with value: 800.7415124315072 and parameters: {'model_name': 'SimpleImputer', 'strategy': 'mean'}. Best is trial 0 with value: 800.7415124315072.
[I 2024-04-23 01:22:55,340] Trial 164 finished with value: 800.7415124315072 and parameters: {'model_name': 'SimpleImputer', 'strategy': 'mean'}. Best is trial 0 with value: 800.7415124315072.
[I 2024-04-23 01:22:55,583] Trial 157 finished with value: 800.7415124315072 and parameters: {'model_name': 'SimpleImputer', 'strategy': 'mean'}. Best is trial 0 with value: 800.7415124315072.
[I 2024-04-23 01:22:55,763] Trial 163 finished with value: 800.7415124315072 and parameters: {'model_name': 'SimpleImputer', 'strategy': 'mean'}. Best is trial 0 with value: 800.7415124315072.
[I 2024-04-23 01:22:55,998] Trial 169 finished with value: 800.7415124315072 and parameters: {'model_name': 'SimpleImputer', 'strategy': 'mean'}. Best is trial 0 with value: 800.7415124315072.
[I 2024-04-23 01:22:56,179] Trial 170 finished with value: 800.7415124315072 and parameters: {'model_name': 'SimpleImputer', 'strategy': 'mean'}. Best is trial 0 with value: 800.7415124315072.
[I 2024-04-23 01:22:56,591] Trial 178 finished with value: 800.7415124315072 and parameters: {'model_name': 'SimpleImputer', 'strategy': 'mean'}. Best is trial 0 with value: 800.7415124315072.
[I 2024-04-23 01:22:56,969] Trial 166 finished with value: 800.7415124315072 and parameters: {'model_name': 'SimpleImputer', 'strategy': 'mean'}. Best is trial 0 with value: 800.7415124315072.
[I 2024-04-23 01:22:57,144] Trial 173 finished with value: 800.7415124315072 and parameters: {'model_name': 'SimpleImputer', 'strategy': 'mean'}. Best is trial 0 with value: 800.7415124315072.
[I 2024-04-23 01:22:57,330] Trial 175 finished with value: 800.7415124315072 and parameters: {'model_name': 'SimpleImputer', 'strategy': 'mean'}. Best is trial 0 with value: 800.7415124315072.
[I 2024-04-23 01:22:57,561] Trial 186 finished with value: 800.7415124315072 and parameters: {'model_name': 'SimpleImputer', 'strategy': 'mean'}. Best is trial 0 with value: 800.7415124315072.
[I 2024-04-23 01:22:57,820] Trial 179 finished with value: 800.7415124315072 and parameters: {'model_name': 'SimpleImputer', 'strategy': 'mean'}. Best is trial 0 with value: 800.7415124315072.
[I 2024-04-23 01:22:58,023] Trial 181 finished with value: 800.7415124315072 and parameters: {'model_name': 'SimpleImputer', 'strategy': 'mean'}. Best is trial 0 with value: 800.7415124315072.
[I 2024-04-23 01:22:58,195] Trial 188 finished with value: 800.7415124315072 and parameters: {'model_name': 'SimpleImputer', 'strategy': 'mean'}. Best is trial 0 with value: 800.7415124315072.
[I 2024-04-23 01:22:58,368] Trial 184 finished with value: 800.7415124315072 and parameters: {'model_name': 'SimpleImputer', 'strategy': 'mean'}. Best is trial 0 with value: 800.7415124315072.
[I 2024-04-23 01:22:58,525] Trial 171 finished with value: 800.7415124315072 and parameters: {'model_name': 'SimpleImputer', 'strategy': 'mean'}. Best is trial 0 with value: 800.7415124315072.
[I 2024-04-23 01:22:58,683] Trial 176 finished with value: 800.7415124315072 and parameters: {'model_name': 'SimpleImputer', 'strategy': 'mean'}. Best is trial 0 with value: 800.7415124315072.
[I 2024-04-23 01:22:58,891] Trial 174 finished with value: 800.7415124315072 and parameters: {'model_name': 'SimpleImputer', 'strategy': 'mean'}. Best is trial 0 with value: 800.7415124315072.
[I 2024-04-23 01:22:59,066] Trial 185 finished with value: 800.7415124315072 and parameters: {'model_name': 'SimpleImputer', 'strategy': 'mean'}. Best is trial 0 with value: 800.7415124315072.
[I 2024-04-23 01:22:59,235] Trial 177 finished with value: 800.7415124315072 and parameters: {'model_name': 'SimpleImputer', 'strategy': 'mean'}. Best is trial 0 with value: 800.7415124315072.
[I 2024-04-23 01:22:59,416] Trial 198 finished with value: 800.7415124315072 and parameters: {'model_name': 'SimpleImputer', 'strategy': 'mean'}. Best is trial 0 with value: 800.7415124315072.
[I 2024-04-23 01:22:59,661] Trial 187 finished with value: 800.7415124315072 and parameters: {'model_name': 'SimpleImputer', 'strategy': 'mean'}. Best is trial 0 with value: 800.7415124315072.
[I 2024-04-23 01:22:59,888] Trial 182 finished with value: 800.7415124315072 and parameters: {'model_name': 'SimpleImputer', 'strategy': 'mean'}. Best is trial 0 with value: 800.7415124315072.
[I 2024-04-23 01:23:00,135] Trial 191 finished with value: 800.7415124315072 and parameters: {'model_name': 'SimpleImputer', 'strategy': 'mean'}. Best is trial 0 with value: 800.7415124315072.
[I 2024-04-23 01:23:00,363] Trial 183 finished with value: 800.7415124315072 and parameters: {'model_name': 'SimpleImputer', 'strategy': 'mean'}. Best is trial 0 with value: 800.7415124315072.
[I 2024-04-23 01:23:00,529] Trial 194 finished with value: 800.7415124315072 and parameters: {'model_name': 'SimpleImputer', 'strategy': 'mean'}. Best is trial 0 with value: 800.7415124315072.
[I 2024-04-23 01:23:00,690] Trial 180 finished with value: 800.7415124315072 and parameters: {'model_name': 'SimpleImputer', 'strategy': 'mean'}. Best is trial 0 with value: 800.7415124315072.
[I 2024-04-23 01:23:00,906] Trial 193 finished with value: 800.7415124315072 and parameters: {'model_name': 'SimpleImputer', 'strategy': 'mean'}. Best is trial 0 with value: 800.7415124315072.
[I 2024-04-23 01:23:01,158] Trial 196 finished with value: 800.7415124315072 and parameters: {'model_name': 'SimpleImputer', 'strategy': 'mean'}. Best is trial 0 with value: 800.7415124315072.
[I 2024-04-23 01:23:01,405] Trial 192 finished with value: 800.7415124315072 and parameters: {'model_name': 'SimpleImputer', 'strategy': 'mean'}. Best is trial 0 with value: 800.7415124315072.
[I 2024-04-23 01:23:01,408] Trial 190 finished with value: 800.7415124315072 and parameters: {'model_name': 'SimpleImputer', 'strategy': 'mean'}. Best is trial 0 with value: 800.7415124315072.
[I 2024-04-23 01:23:01,583] Trial 195 finished with value: 800.7415124315072 and parameters: {'model_name': 'SimpleImputer', 'strategy': 'mean'}. Best is trial 0 with value: 800.7415124315072.
[I 2024-04-23 01:23:02,004] Trial 189 finished with value: 800.7415124315072 and parameters: {'model_name': 'SimpleImputer', 'strategy': 'mean'}. Best is trial 0 with value: 800.7415124315072.
[I 2024-04-23 01:23:02,179] Trial 197 finished with value: 800.7415124315072 and parameters: {'model_name': 'SimpleImputer', 'strategy': 'mean'}. Best is trial 0 with value: 800.7415124315072.
[I 2024-04-23 01:23:02,434] Trial 199 finished with value: 800.7415124315072 and parameters: {'model_name': 'SimpleImputer', 'strategy': 'mean'}. Best is trial 0 with value: 800.7415124315072.
[I 2024-04-23 01:23:02,619] Trial 97 finished with value: 1420.311467174776 and parameters: {'model_name': 'SimpleImputer', 'strategy': 'most_frequent'}. Best is trial 0 with value: 800.7415124315072.
