Run: 12
/cm/local/apps/slurm/var/spool/job797486/slurm_script: line 23: /common/ketrong/minconda3/etc/profile.d/conda.sh: No such file or directory
/cm/local/apps/slurm/var/spool/job797486/slurm_script: line 26: $'\nconda create --name tpot2devenv -c conda-forge python=3.10\n': command not found
/cm/local/apps/slurm/var/spool/job797486/slurm_script: line 31: $'\npip install -r requirements.txt\n': command not found
RunStart
2024-04-02 07:52:57.321344: I tensorflow/core/util/port.cc:113] oneDNN custom operations are on. You may see slightly different numerical results due to floating-point round-off errors from different computation orders. To turn them off, set the environment variable `TF_ENABLE_ONEDNN_OPTS=0`.
2024-04-02 07:52:57.356154: E external/local_xla/xla/stream_executor/cuda/cuda_dnn.cc:9261] Unable to register cuDNN factory: Attempting to register factory for plugin cuDNN when one has already been registered
2024-04-02 07:52:57.356175: E external/local_xla/xla/stream_executor/cuda/cuda_fft.cc:607] Unable to register cuFFT factory: Attempting to register factory for plugin cuFFT when one has already been registered
2024-04-02 07:52:57.357317: E external/local_xla/xla/stream_executor/cuda/cuda_blas.cc:1515] Unable to register cuBLAS factory: Attempting to register factory for plugin cuBLAS when one has already been registered
2024-04-02 07:52:57.362825: I tensorflow/core/platform/cpu_feature_guard.cc:182] This TensorFlow binary is optimized to use available CPU instructions in performance-critical operations.
To enable the following instructions: AVX2 AVX512F AVX512_VNNI FMA, in other operations, rebuild TensorFlow with the appropriate compiler flags.
2024-04-02 07:52:59.970721: W tensorflow/compiler/tf2tensorrt/utils/py_utils.cc:38] TF-TRT Warning: Could not find TensorRT
WARNING:tensorflow:From /home/ketrong/miniconda3/envs/tpot2devenv/lib/python3.10/site-packages/tensorflow/python/compat/v2_compat.py:108: disable_resource_variables (from tensorflow.python.ops.variable_scope) is deprecated and will be removed in a future version.
Instructions for updating:
non-resource variables are not supported in the long term
starting loops
working on 
logs/359952/tpot2_base_normal_MNAR_0.1
4.362482786178589
loading data
logs/359952/tpot2_base_normal_MNAR_0.1/data/359952_True.pkl
12783     16100.0
20118     42800.0
20745     15000.0
8610      28300.0
12579    194200.0
           ...   
16095     26400.0
49       169500.0
11743    142200.0
2238     500001.0
14896     74800.0
Name: price, Length: 20505, dtype: float64
            0   ...        15
0        384.0  ...  0.666667
1        397.0  ...  1.000000
2         96.0  ...  1.000000
3      11859.0  ...  0.596491
4       6193.0  ...  0.500000
...        ...  ...       ...
20500    264.0  ...  0.000000
20501   1825.0  ...  0.222222
20502   1094.0  ...  0.812500
20503   7514.0  ...  0.282051
20504  15982.0  ...  0.285714

[20505 rows x 16 columns]
          0   ...        15
0      410.0  ...  1.000000
1      236.0  ...  0.500000
2      330.0  ...  1.000000
3     4861.0  ...  0.428571
4     1251.0  ...  0.250000
...      ...  ...       ...
2274  2676.0  ...  0.538462
2275   454.0  ...  0.875000
2276  2490.0  ...  1.000000
2277   358.0  ...  0.000000
2278  1136.0  ...  0.777778

[2279 rows x 16 columns]
running experiment 1/3 - Does large hyperparameter space improve reconstruction accuracy over simple
[I 2024-04-02 07:53:17,954] A new study created in memory with name: no-name-4e91762f-7de4-4f86-9abf-447f65e45544
[I 2024-04-02 07:53:19,022] Trial 2 finished with value: 6672.22813448261 and parameters: {'model_name': 'SimpleImputer', 'strategy': 'constant'}. Best is trial 2 with value: 6672.22813448261.
[I 2024-04-02 07:53:19,784] Trial 3 finished with value: 6672.22813448261 and parameters: {'model_name': 'SimpleImputer', 'strategy': 'constant'}. Best is trial 2 with value: 6672.22813448261.
[I 2024-04-02 07:53:20,084] Trial 10 finished with value: 6672.22813448261 and parameters: {'model_name': 'SimpleImputer', 'strategy': 'constant'}. Best is trial 2 with value: 6672.22813448261.
[I 2024-04-02 07:53:20,488] Trial 4 finished with value: 6672.22813448261 and parameters: {'model_name': 'SimpleImputer', 'strategy': 'constant'}. Best is trial 2 with value: 6672.22813448261.
[I 2024-04-02 07:53:20,793] Trial 15 finished with value: 6672.22813448261 and parameters: {'model_name': 'SimpleImputer', 'strategy': 'constant'}. Best is trial 2 with value: 6672.22813448261.
[I 2024-04-02 07:53:21,201] Trial 36 finished with value: 6672.22813448261 and parameters: {'model_name': 'SimpleImputer', 'strategy': 'constant'}. Best is trial 2 with value: 6672.22813448261.
[I 2024-04-02 07:53:21,376] Trial 9 finished with value: 6388.823491131825 and parameters: {'model_name': 'SimpleImputer', 'strategy': 'mean'}. Best is trial 9 with value: 6388.823491131825.
[I 2024-04-02 07:53:21,657] Trial 22 finished with value: 6672.22813448261 and parameters: {'model_name': 'SimpleImputer', 'strategy': 'constant'}. Best is trial 9 with value: 6388.823491131825.
[I 2024-04-02 07:53:21,886] Trial 14 finished with value: 6672.22813448261 and parameters: {'model_name': 'SimpleImputer', 'strategy': 'constant'}. Best is trial 9 with value: 6388.823491131825.
[I 2024-04-02 07:53:22,239] Trial 21 finished with value: 6672.22813448261 and parameters: {'model_name': 'SimpleImputer', 'strategy': 'constant'}. Best is trial 9 with value: 6388.823491131825.
[I 2024-04-02 07:53:22,491] Trial 17 finished with value: 6672.22813448261 and parameters: {'model_name': 'SimpleImputer', 'strategy': 'constant'}. Best is trial 9 with value: 6388.823491131825.
[I 2024-04-02 07:53:22,814] Trial 27 finished with value: 6672.22813448261 and parameters: {'model_name': 'SimpleImputer', 'strategy': 'constant'}. Best is trial 9 with value: 6388.823491131825.
[I 2024-04-02 07:53:22,985] Trial 11 finished with value: 6388.823491131825 and parameters: {'model_name': 'SimpleImputer', 'strategy': 'mean'}. Best is trial 9 with value: 6388.823491131825.
[I 2024-04-02 07:53:23,154] Trial 13 finished with value: 6388.823491131825 and parameters: {'model_name': 'SimpleImputer', 'strategy': 'mean'}. Best is trial 9 with value: 6388.823491131825.
[I 2024-04-02 07:53:23,429] Trial 8 finished with value: 6388.823491131825 and parameters: {'model_name': 'SimpleImputer', 'strategy': 'mean'}. Best is trial 9 with value: 6388.823491131825.
[I 2024-04-02 07:53:23,681] Trial 45 finished with value: 6672.22813448261 and parameters: {'model_name': 'SimpleImputer', 'strategy': 'constant'}. Best is trial 9 with value: 6388.823491131825.
[I 2024-04-02 07:53:23,960] Trial 39 finished with value: 6672.22813448261 and parameters: {'model_name': 'SimpleImputer', 'strategy': 'constant'}. Best is trial 9 with value: 6388.823491131825.
[I 2024-04-02 07:53:24,363] Trial 20 finished with value: 6388.823491131825 and parameters: {'model_name': 'SimpleImputer', 'strategy': 'mean'}. Best is trial 9 with value: 6388.823491131825.
[I 2024-04-02 07:53:24,760] Trial 30 finished with value: 6388.823491131825 and parameters: {'model_name': 'SimpleImputer', 'strategy': 'mean'}. Best is trial 9 with value: 6388.823491131825.
[I 2024-04-02 07:53:24,930] Trial 43 finished with value: 6672.22813448261 and parameters: {'model_name': 'SimpleImputer', 'strategy': 'constant'}. Best is trial 9 with value: 6388.823491131825.
[I 2024-04-02 07:53:25,269] Trial 32 finished with value: 6388.823491131825 and parameters: {'model_name': 'SimpleImputer', 'strategy': 'mean'}. Best is trial 9 with value: 6388.823491131825.
[I 2024-04-02 07:53:25,445] Trial 29 finished with value: 6388.823491131825 and parameters: {'model_name': 'SimpleImputer', 'strategy': 'mean'}. Best is trial 9 with value: 6388.823491131825.
[I 2024-04-02 07:53:25,449] Trial 44 finished with value: 6388.823491131825 and parameters: {'model_name': 'SimpleImputer', 'strategy': 'mean'}. Best is trial 9 with value: 6388.823491131825.
[I 2024-04-02 07:53:26,038] Trial 46 finished with value: 6388.823491131825 and parameters: {'model_name': 'SimpleImputer', 'strategy': 'mean'}. Best is trial 9 with value: 6388.823491131825.
[I 2024-04-02 07:53:26,492] Trial 41 finished with value: 6388.823491131825 and parameters: {'model_name': 'SimpleImputer', 'strategy': 'mean'}. Best is trial 9 with value: 6388.823491131825.
[I 2024-04-02 07:53:26,728] Trial 24 finished with value: 6388.823491131825 and parameters: {'model_name': 'SimpleImputer', 'strategy': 'mean'}. Best is trial 9 with value: 6388.823491131825.
[I 2024-04-02 07:53:26,903] Trial 7 finished with value: 6585.448875819314 and parameters: {'model_name': 'SimpleImputer', 'strategy': 'median'}. Best is trial 9 with value: 6388.823491131825.
[I 2024-04-02 07:53:27,067] Trial 47 finished with value: 6388.823491131825 and parameters: {'model_name': 'SimpleImputer', 'strategy': 'mean'}. Best is trial 9 with value: 6388.823491131825.
[I 2024-04-02 07:53:27,344] Trial 0 finished with value: 6585.448875819314 and parameters: {'model_name': 'SimpleImputer', 'strategy': 'median'}. Best is trial 9 with value: 6388.823491131825.
[I 2024-04-02 07:53:27,597] Trial 5 finished with value: 6585.448875819314 and parameters: {'model_name': 'SimpleImputer', 'strategy': 'median'}. Best is trial 9 with value: 6388.823491131825.
[I 2024-04-02 07:53:27,822] Trial 38 finished with value: 6388.823491131825 and parameters: {'model_name': 'SimpleImputer', 'strategy': 'mean'}. Best is trial 9 with value: 6388.823491131825.
[I 2024-04-02 07:53:28,383] Trial 19 finished with value: 6585.448875819314 and parameters: {'model_name': 'SimpleImputer', 'strategy': 'median'}. Best is trial 9 with value: 6388.823491131825.
[I 2024-04-02 07:53:29,086] Trial 16 finished with value: 6585.448875819314 and parameters: {'model_name': 'SimpleImputer', 'strategy': 'median'}. Best is trial 9 with value: 6388.823491131825.
[I 2024-04-02 07:53:29,448] Trial 26 finished with value: 6585.448875819314 and parameters: {'model_name': 'SimpleImputer', 'strategy': 'median'}. Best is trial 9 with value: 6388.823491131825.
[I 2024-04-02 07:53:29,715] Trial 28 finished with value: 6585.448875819314 and parameters: {'model_name': 'SimpleImputer', 'strategy': 'median'}. Best is trial 9 with value: 6388.823491131825.
[I 2024-04-02 07:53:29,952] Trial 54 finished with value: 6672.22813448261 and parameters: {'model_name': 'SimpleImputer', 'strategy': 'constant'}. Best is trial 9 with value: 6388.823491131825.
[I 2024-04-02 07:53:30,178] Trial 34 finished with value: 6585.448875819314 and parameters: {'model_name': 'SimpleImputer', 'strategy': 'median'}. Best is trial 9 with value: 6388.823491131825.
[I 2024-04-02 07:53:30,388] Trial 33 finished with value: 6585.448875819314 and parameters: {'model_name': 'SimpleImputer', 'strategy': 'median'}. Best is trial 9 with value: 6388.823491131825.
[I 2024-04-02 07:53:30,691] Trial 40 finished with value: 6585.448875819314 and parameters: {'model_name': 'SimpleImputer', 'strategy': 'median'}. Best is trial 9 with value: 6388.823491131825.
[I 2024-04-02 07:53:30,872] Trial 56 finished with value: 6672.22813448261 and parameters: {'model_name': 'SimpleImputer', 'strategy': 'constant'}. Best is trial 9 with value: 6388.823491131825.
[I 2024-04-02 07:53:31,042] Trial 37 finished with value: 6585.448875819314 and parameters: {'model_name': 'SimpleImputer', 'strategy': 'median'}. Best is trial 9 with value: 6388.823491131825.
[I 2024-04-02 07:53:31,505] Trial 42 finished with value: 6585.448875819314 and parameters: {'model_name': 'SimpleImputer', 'strategy': 'median'}. Best is trial 9 with value: 6388.823491131825.
[I 2024-04-02 07:53:31,809] Trial 59 finished with value: 6388.823491131825 and parameters: {'model_name': 'SimpleImputer', 'strategy': 'mean'}. Best is trial 9 with value: 6388.823491131825.
[I 2024-04-02 07:53:32,073] Trial 51 finished with value: 6388.823491131825 and parameters: {'model_name': 'SimpleImputer', 'strategy': 'mean'}. Best is trial 9 with value: 6388.823491131825.
[I 2024-04-02 07:53:32,496] Trial 64 finished with value: 6388.823491131825 and parameters: {'model_name': 'SimpleImputer', 'strategy': 'mean'}. Best is trial 9 with value: 6388.823491131825.
[I 2024-04-02 07:53:32,689] Trial 58 finished with value: 6388.823491131825 and parameters: {'model_name': 'SimpleImputer', 'strategy': 'mean'}. Best is trial 9 with value: 6388.823491131825.
[I 2024-04-02 07:53:32,882] Trial 57 finished with value: 6388.823491131825 and parameters: {'model_name': 'SimpleImputer', 'strategy': 'mean'}. Best is trial 9 with value: 6388.823491131825.
[I 2024-04-02 07:53:33,056] Trial 61 finished with value: 6388.823491131825 and parameters: {'model_name': 'SimpleImputer', 'strategy': 'mean'}. Best is trial 9 with value: 6388.823491131825.
[I 2024-04-02 07:53:33,353] Trial 60 finished with value: 6388.823491131825 and parameters: {'model_name': 'SimpleImputer', 'strategy': 'mean'}. Best is trial 9 with value: 6388.823491131825.
[I 2024-04-02 07:53:33,785] Trial 50 finished with value: 6585.448875819314 and parameters: {'model_name': 'SimpleImputer', 'strategy': 'median'}. Best is trial 9 with value: 6388.823491131825.
[I 2024-04-02 07:53:34,253] Trial 52 finished with value: 6585.448875819314 and parameters: {'model_name': 'SimpleImputer', 'strategy': 'median'}. Best is trial 9 with value: 6388.823491131825.
[I 2024-04-02 07:53:34,782] Trial 55 finished with value: 6585.448875819314 and parameters: {'model_name': 'SimpleImputer', 'strategy': 'median'}. Best is trial 9 with value: 6388.823491131825.
[I 2024-04-02 07:53:35,118] Trial 69 finished with value: 6585.448875819314 and parameters: {'model_name': 'SimpleImputer', 'strategy': 'median'}. Best is trial 9 with value: 6388.823491131825.
[I 2024-04-02 07:53:35,442] Trial 66 finished with value: 6585.448875819314 and parameters: {'model_name': 'SimpleImputer', 'strategy': 'median'}. Best is trial 9 with value: 6388.823491131825.
[I 2024-04-02 07:53:35,722] Trial 62 finished with value: 6585.448875819314 and parameters: {'model_name': 'SimpleImputer', 'strategy': 'median'}. Best is trial 9 with value: 6388.823491131825.
[I 2024-04-02 07:53:36,238] Trial 68 finished with value: 6585.448875819314 and parameters: {'model_name': 'SimpleImputer', 'strategy': 'median'}. Best is trial 9 with value: 6388.823491131825.
[I 2024-04-02 07:53:36,536] Trial 65 finished with value: 6585.448875819314 and parameters: {'model_name': 'SimpleImputer', 'strategy': 'median'}. Best is trial 9 with value: 6388.823491131825.
[I 2024-04-02 07:53:37,027] Trial 72 finished with value: 6585.448875819314 and parameters: {'model_name': 'SimpleImputer', 'strategy': 'median'}. Best is trial 9 with value: 6388.823491131825.
[I 2024-04-02 07:53:37,320] Trial 71 finished with value: 6585.448875819314 and parameters: {'model_name': 'SimpleImputer', 'strategy': 'median'}. Best is trial 9 with value: 6388.823491131825.
[I 2024-04-02 07:53:39,398] Trial 104 finished with value: 6388.823491131825 and parameters: {'model_name': 'SimpleImputer', 'strategy': 'mean'}. Best is trial 9 with value: 6388.823491131825.
[I 2024-04-02 07:53:40,920] Trial 1 finished with value: 6672.228128510523 and parameters: {'model_name': 'SimpleImputer', 'strategy': 'most_frequent'}. Best is trial 9 with value: 6388.823491131825.
[I 2024-04-02 07:53:41,982] Trial 18 finished with value: 6672.228128510523 and parameters: {'model_name': 'SimpleImputer', 'strategy': 'most_frequent'}. Best is trial 9 with value: 6388.823491131825.
[I 2024-04-02 07:53:42,319] Trial 48 finished with value: 6672.228128510523 and parameters: {'model_name': 'SimpleImputer', 'strategy': 'most_frequent'}. Best is trial 9 with value: 6388.823491131825.
[I 2024-04-02 07:53:42,563] Trial 6 finished with value: 6672.228128510523 and parameters: {'model_name': 'SimpleImputer', 'strategy': 'most_frequent'}. Best is trial 9 with value: 6388.823491131825.
[I 2024-04-02 07:53:42,826] Trial 107 finished with value: 6388.823491131825 and parameters: {'model_name': 'SimpleImputer', 'strategy': 'mean'}. Best is trial 9 with value: 6388.823491131825.
[I 2024-04-02 07:53:43,184] Trial 12 finished with value: 6672.228128510523 and parameters: {'model_name': 'SimpleImputer', 'strategy': 'most_frequent'}. Best is trial 9 with value: 6388.823491131825.
[I 2024-04-02 07:53:43,684] Trial 31 finished with value: 6672.228128510523 and parameters: {'model_name': 'SimpleImputer', 'strategy': 'most_frequent'}. Best is trial 9 with value: 6388.823491131825.
[I 2024-04-02 07:53:44,067] Trial 23 finished with value: 6672.228128510523 and parameters: {'model_name': 'SimpleImputer', 'strategy': 'most_frequent'}. Best is trial 9 with value: 6388.823491131825.
[I 2024-04-02 07:53:44,491] Trial 25 finished with value: 6672.228128510523 and parameters: {'model_name': 'SimpleImputer', 'strategy': 'most_frequent'}. Best is trial 9 with value: 6388.823491131825.
[I 2024-04-02 07:53:45,335] Trial 35 finished with value: 6672.228128510523 and parameters: {'model_name': 'SimpleImputer', 'strategy': 'most_frequent'}. Best is trial 9 with value: 6388.823491131825.
[I 2024-04-02 07:53:45,809] Trial 63 finished with value: 6672.228128510523 and parameters: {'model_name': 'SimpleImputer', 'strategy': 'most_frequent'}. Best is trial 9 with value: 6388.823491131825.
[I 2024-04-02 07:53:46,118] Trial 49 finished with value: 6672.228128510523 and parameters: {'model_name': 'SimpleImputer', 'strategy': 'most_frequent'}. Best is trial 9 with value: 6388.823491131825.
[I 2024-04-02 07:53:46,345] Trial 53 finished with value: 6672.228128510523 and parameters: {'model_name': 'SimpleImputer', 'strategy': 'most_frequent'}. Best is trial 9 with value: 6388.823491131825.
[I 2024-04-02 07:53:46,769] Trial 110 finished with value: 6388.823491131825 and parameters: {'model_name': 'SimpleImputer', 'strategy': 'mean'}. Best is trial 9 with value: 6388.823491131825.
[I 2024-04-02 07:53:46,996] Trial 112 finished with value: 6388.823491131825 and parameters: {'model_name': 'SimpleImputer', 'strategy': 'mean'}. Best is trial 9 with value: 6388.823491131825.
[I 2024-04-02 07:53:47,334] Trial 111 finished with value: 6388.823491131825 and parameters: {'model_name': 'SimpleImputer', 'strategy': 'mean'}. Best is trial 9 with value: 6388.823491131825.
[I 2024-04-02 07:53:47,627] Trial 113 finished with value: 6388.823491131825 and parameters: {'model_name': 'SimpleImputer', 'strategy': 'mean'}. Best is trial 9 with value: 6388.823491131825.
[I 2024-04-02 07:53:47,848] Trial 73 finished with value: 6672.228128510523 and parameters: {'model_name': 'SimpleImputer', 'strategy': 'most_frequent'}. Best is trial 9 with value: 6388.823491131825.
[I 2024-04-02 07:53:48,278] Trial 115 finished with value: 6388.823491131825 and parameters: {'model_name': 'SimpleImputer', 'strategy': 'mean'}. Best is trial 9 with value: 6388.823491131825.
[I 2024-04-02 07:53:48,537] Trial 114 finished with value: 6388.823491131825 and parameters: {'model_name': 'SimpleImputer', 'strategy': 'mean'}. Best is trial 9 with value: 6388.823491131825.
[I 2024-04-02 07:53:48,831] Trial 76 finished with value: 6672.228128510523 and parameters: {'model_name': 'SimpleImputer', 'strategy': 'most_frequent'}. Best is trial 9 with value: 6388.823491131825.
[I 2024-04-02 07:53:49,055] Trial 67 finished with value: 6672.228128510523 and parameters: {'model_name': 'SimpleImputer', 'strategy': 'most_frequent'}. Best is trial 9 with value: 6388.823491131825.
[I 2024-04-02 07:53:49,272] Trial 74 finished with value: 6672.228128510523 and parameters: {'model_name': 'SimpleImputer', 'strategy': 'most_frequent'}. Best is trial 9 with value: 6388.823491131825.
[I 2024-04-02 07:53:49,545] Trial 77 finished with value: 6672.228128510523 and parameters: {'model_name': 'SimpleImputer', 'strategy': 'most_frequent'}. Best is trial 9 with value: 6388.823491131825.
[I 2024-04-02 07:53:49,827] Trial 70 finished with value: 6672.228128510523 and parameters: {'model_name': 'SimpleImputer', 'strategy': 'most_frequent'}. Best is trial 9 with value: 6388.823491131825.
[I 2024-04-02 07:53:50,123] Trial 116 finished with value: 6388.823491131825 and parameters: {'model_name': 'SimpleImputer', 'strategy': 'mean'}. Best is trial 9 with value: 6388.823491131825.
[I 2024-04-02 07:53:50,369] Trial 78 finished with value: 6672.228128510523 and parameters: {'model_name': 'SimpleImputer', 'strategy': 'most_frequent'}. Best is trial 9 with value: 6388.823491131825.
[I 2024-04-02 07:53:50,588] Trial 83 finished with value: 6672.228128510523 and parameters: {'model_name': 'SimpleImputer', 'strategy': 'most_frequent'}. Best is trial 9 with value: 6388.823491131825.
[I 2024-04-02 07:53:50,881] Trial 95 finished with value: 6672.228128510523 and parameters: {'model_name': 'SimpleImputer', 'strategy': 'most_frequent'}. Best is trial 9 with value: 6388.823491131825.
[I 2024-04-02 07:53:51,107] Trial 79 finished with value: 6672.228128510523 and parameters: {'model_name': 'SimpleImputer', 'strategy': 'most_frequent'}. Best is trial 9 with value: 6388.823491131825.
[I 2024-04-02 07:53:51,533] Trial 86 finished with value: 6672.228128510523 and parameters: {'model_name': 'SimpleImputer', 'strategy': 'most_frequent'}. Best is trial 9 with value: 6388.823491131825.
[I 2024-04-02 07:53:52,061] Trial 80 finished with value: 6672.228128510523 and parameters: {'model_name': 'SimpleImputer', 'strategy': 'most_frequent'}. Best is trial 9 with value: 6388.823491131825.
[I 2024-04-02 07:53:52,346] Trial 82 finished with value: 6672.228128510523 and parameters: {'model_name': 'SimpleImputer', 'strategy': 'most_frequent'}. Best is trial 9 with value: 6388.823491131825.
[I 2024-04-02 07:53:52,610] Trial 75 finished with value: 6672.228128510523 and parameters: {'model_name': 'SimpleImputer', 'strategy': 'most_frequent'}. Best is trial 9 with value: 6388.823491131825.
