Run: 15
/cm/local/apps/slurm/var/spool/job832864/slurm_script: line 23: /common/ketrong/minconda3/etc/profile.d/conda.sh: No such file or directory
/cm/local/apps/slurm/var/spool/job832864/slurm_script: line 26: $'\nconda create --name tpot2devenv -c conda-forge python=3.10\n': command not found
/cm/local/apps/slurm/var/spool/job832864/slurm_script: line 31: $'\npip install -r requirements.txt\n': command not found
RunStart
2024-04-23 17:04:16.657871: I tensorflow/core/util/port.cc:113] oneDNN custom operations are on. You may see slightly different numerical results due to floating-point round-off errors from different computation orders. To turn them off, set the environment variable `TF_ENABLE_ONEDNN_OPTS=0`.
2024-04-23 17:04:16.693698: E external/local_xla/xla/stream_executor/cuda/cuda_dnn.cc:9261] Unable to register cuDNN factory: Attempting to register factory for plugin cuDNN when one has already been registered
2024-04-23 17:04:16.693719: E external/local_xla/xla/stream_executor/cuda/cuda_fft.cc:607] Unable to register cuFFT factory: Attempting to register factory for plugin cuFFT when one has already been registered
2024-04-23 17:04:16.694880: E external/local_xla/xla/stream_executor/cuda/cuda_blas.cc:1515] Unable to register cuBLAS factory: Attempting to register factory for plugin cuBLAS when one has already been registered
2024-04-23 17:04:16.700409: I tensorflow/core/platform/cpu_feature_guard.cc:182] This TensorFlow binary is optimized to use available CPU instructions in performance-critical operations.
To enable the following instructions: AVX2 AVX512F AVX512_VNNI FMA, in other operations, rebuild TensorFlow with the appropriate compiler flags.
2024-04-23 17:04:19.529751: W tensorflow/compiler/tf2tensorrt/utils/py_utils.cc:38] TF-TRT Warning: Could not find TensorRT
WARNING:tensorflow:From /home/ketrong/miniconda3/envs/tpot2devenv/lib/python3.10/site-packages/tensorflow/python/compat/v2_compat.py:108: disable_resource_variables (from tensorflow.python.ops.variable_scope) is deprecated and will be removed in a future version.
Instructions for updating:
non-resource variables are not supported in the long term
starting loops
working on 
logs/14953/tpot2_base_normal_MNAR_0.9
3.577564001083374
loading data
logs/14953/tpot2_base_normal_MNAR_0.9/data/14953_True.pkl
3495      E_M
5204      E_M
5181      E_M
1321      E_M
4329      E_M
        ...  
4295      D#M
1187     A_m4
1227     D_M6
2969     G_M4
5159     D#d6
Name: V17, Length: 5098, dtype: category
Categories (102, object): [' A#d' < ' A#d7' < ' A_d' < ' A_m' ... ' G_m6' < ' G_M6' < ' G_m7' < ' G_M7']
        0    ...  102
0      80.0  ...  0.0
1      31.0  ...  0.0
2       8.0  ...  1.0
3     124.0  ...  0.0
4      72.0  ...  0.0
...     ...  ...  ...
5093   38.0  ...  0.0
5094   76.0  ...  0.0
5095   30.0  ...  0.0
5096   78.0  ...  0.0
5097   40.0  ...  0.0

[5098 rows x 103 columns]
       0    ...  102
0      6.0  ...  1.0
1     89.0  ...  1.0
2    108.0  ...  0.0
3     96.0  ...  0.0
4     35.0  ...  0.0
..     ...  ...  ...
562   79.0  ...  0.0
563   82.0  ...  0.0
564    8.0  ...  0.0
565  122.0  ...  0.0
566   11.0  ...  0.0

[567 rows x 103 columns]
running experiment 1/3 - Does large hyperparameter space improve reconstruction accuracy over simple
[I 2024-04-23 17:05:01,283] A new study created in memory with name: no-name-e73f9ac2-f796-4efb-9119-25e36232dc8c
[I 2024-04-23 17:05:03,601] Trial 9 finished with value: 1.855965394019735 and parameters: {'model_name': 'SimpleImputer', 'strategy': 'constant'}. Best is trial 9 with value: 1.855965394019735.
[I 2024-04-23 17:05:03,969] Trial 12 finished with value: 1.855965394019735 and parameters: {'model_name': 'SimpleImputer', 'strategy': 'constant'}. Best is trial 9 with value: 1.855965394019735.
[I 2024-04-23 17:05:04,264] Trial 13 finished with value: 1.855965394019735 and parameters: {'model_name': 'SimpleImputer', 'strategy': 'constant'}. Best is trial 9 with value: 1.855965394019735.
[I 2024-04-23 17:05:04,755] Trial 23 finished with value: 1.855965394019735 and parameters: {'model_name': 'SimpleImputer', 'strategy': 'constant'}. Best is trial 9 with value: 1.855965394019735.
[I 2024-04-23 17:05:05,117] Trial 3 finished with value: 1.7084387879689786 and parameters: {'model_name': 'SimpleImputer', 'strategy': 'mean'}. Best is trial 3 with value: 1.7084387879689786.
[I 2024-04-23 17:05:05,393] Trial 21 finished with value: 1.855965394019735 and parameters: {'model_name': 'SimpleImputer', 'strategy': 'constant'}. Best is trial 3 with value: 1.7084387879689786.
[I 2024-04-23 17:05:05,637] Trial 27 finished with value: 1.855965394019735 and parameters: {'model_name': 'SimpleImputer', 'strategy': 'constant'}. Best is trial 3 with value: 1.7084387879689786.
[I 2024-04-23 17:05:05,920] Trial 15 finished with value: 1.855965394019735 and parameters: {'model_name': 'SimpleImputer', 'strategy': 'constant'}. Best is trial 3 with value: 1.7084387879689786.
[I 2024-04-23 17:05:06,315] Trial 26 finished with value: 1.855965394019735 and parameters: {'model_name': 'SimpleImputer', 'strategy': 'constant'}. Best is trial 3 with value: 1.7084387879689786.
[I 2024-04-23 17:05:06,610] Trial 30 finished with value: 1.855965394019735 and parameters: {'model_name': 'SimpleImputer', 'strategy': 'constant'}. Best is trial 3 with value: 1.7084387879689786.
[I 2024-04-23 17:05:06,926] Trial 14 finished with value: 1.7084387879689786 and parameters: {'model_name': 'SimpleImputer', 'strategy': 'mean'}. Best is trial 3 with value: 1.7084387879689786.
[I 2024-04-23 17:05:07,266] Trial 6 finished with value: 1.7084387879689786 and parameters: {'model_name': 'SimpleImputer', 'strategy': 'mean'}. Best is trial 3 with value: 1.7084387879689786.
[I 2024-04-23 17:05:07,271] Trial 24 finished with value: 1.855965394019735 and parameters: {'model_name': 'SimpleImputer', 'strategy': 'constant'}. Best is trial 3 with value: 1.7084387879689786.
[I 2024-04-23 17:05:07,753] Trial 33 finished with value: 1.855965394019735 and parameters: {'model_name': 'SimpleImputer', 'strategy': 'constant'}. Best is trial 3 with value: 1.7084387879689786.
[I 2024-04-23 17:05:07,949] Trial 34 finished with value: 1.855965394019735 and parameters: {'model_name': 'SimpleImputer', 'strategy': 'constant'}. Best is trial 3 with value: 1.7084387879689786.
[I 2024-04-23 17:05:08,234] Trial 10 finished with value: 1.7084387879689786 and parameters: {'model_name': 'SimpleImputer', 'strategy': 'mean'}. Best is trial 3 with value: 1.7084387879689786.
[I 2024-04-23 17:05:08,562] Trial 39 finished with value: 1.855965394019735 and parameters: {'model_name': 'SimpleImputer', 'strategy': 'constant'}. Best is trial 3 with value: 1.7084387879689786.
[I 2024-04-23 17:05:08,765] Trial 35 finished with value: 1.855965394019735 and parameters: {'model_name': 'SimpleImputer', 'strategy': 'constant'}. Best is trial 3 with value: 1.7084387879689786.
[I 2024-04-23 17:05:09,110] Trial 31 finished with value: 1.855965394019735 and parameters: {'model_name': 'SimpleImputer', 'strategy': 'constant'}. Best is trial 3 with value: 1.7084387879689786.
[I 2024-04-23 17:05:09,321] Trial 46 finished with value: 1.855965394019735 and parameters: {'model_name': 'SimpleImputer', 'strategy': 'constant'}. Best is trial 3 with value: 1.7084387879689786.
[I 2024-04-23 17:05:09,719] Trial 41 finished with value: 1.855965394019735 and parameters: {'model_name': 'SimpleImputer', 'strategy': 'constant'}. Best is trial 3 with value: 1.7084387879689786.
[I 2024-04-23 17:05:10,068] Trial 40 finished with value: 1.855965394019735 and parameters: {'model_name': 'SimpleImputer', 'strategy': 'constant'}. Best is trial 3 with value: 1.7084387879689786.
[I 2024-04-23 17:05:10,322] Trial 43 finished with value: 1.7084387879689786 and parameters: {'model_name': 'SimpleImputer', 'strategy': 'mean'}. Best is trial 3 with value: 1.7084387879689786.
[I 2024-04-23 17:05:10,959] Trial 11 finished with value: 1.855965394019735 and parameters: {'model_name': 'SimpleImputer', 'strategy': 'median'}. Best is trial 3 with value: 1.7084387879689786.
[I 2024-04-23 17:05:11,321] Trial 2 finished with value: 1.855965394019735 and parameters: {'model_name': 'SimpleImputer', 'strategy': 'median'}. Best is trial 3 with value: 1.7084387879689786.
[I 2024-04-23 17:05:11,817] Trial 22 finished with value: 1.855965394019735 and parameters: {'model_name': 'SimpleImputer', 'strategy': 'median'}. Best is trial 3 with value: 1.7084387879689786.
[I 2024-04-23 17:05:12,079] Trial 17 finished with value: 1.855965394019735 and parameters: {'model_name': 'SimpleImputer', 'strategy': 'median'}. Best is trial 3 with value: 1.7084387879689786.
[I 2024-04-23 17:05:12,325] Trial 1 finished with value: 1.855965394019735 and parameters: {'model_name': 'SimpleImputer', 'strategy': 'median'}. Best is trial 3 with value: 1.7084387879689786.
[I 2024-04-23 17:05:12,771] Trial 51 finished with value: 1.855965394019735 and parameters: {'model_name': 'SimpleImputer', 'strategy': 'constant'}. Best is trial 3 with value: 1.7084387879689786.
[I 2024-04-23 17:05:13,132] Trial 25 finished with value: 1.855965394019735 and parameters: {'model_name': 'SimpleImputer', 'strategy': 'median'}. Best is trial 3 with value: 1.7084387879689786.
[I 2024-04-23 17:05:13,496] Trial 52 finished with value: 1.855965394019735 and parameters: {'model_name': 'SimpleImputer', 'strategy': 'constant'}. Best is trial 3 with value: 1.7084387879689786.
[I 2024-04-23 17:05:13,708] Trial 50 finished with value: 1.7084387879689786 and parameters: {'model_name': 'SimpleImputer', 'strategy': 'mean'}. Best is trial 3 with value: 1.7084387879689786.
[I 2024-04-23 17:05:13,957] Trial 53 finished with value: 1.855965394019735 and parameters: {'model_name': 'SimpleImputer', 'strategy': 'constant'}. Best is trial 3 with value: 1.7084387879689786.
[I 2024-04-23 17:05:14,222] Trial 18 finished with value: 1.855965394019735 and parameters: {'model_name': 'SimpleImputer', 'strategy': 'median'}. Best is trial 3 with value: 1.7084387879689786.
[I 2024-04-23 17:05:14,634] Trial 49 finished with value: 1.7084387879689786 and parameters: {'model_name': 'SimpleImputer', 'strategy': 'mean'}. Best is trial 3 with value: 1.7084387879689786.
[I 2024-04-23 17:05:14,889] Trial 55 finished with value: 1.855965394019735 and parameters: {'model_name': 'SimpleImputer', 'strategy': 'constant'}. Best is trial 3 with value: 1.7084387879689786.
[I 2024-04-23 17:05:15,238] Trial 44 finished with value: 1.855965394019735 and parameters: {'model_name': 'SimpleImputer', 'strategy': 'median'}. Best is trial 3 with value: 1.7084387879689786.
[I 2024-04-23 17:05:15,737] Trial 38 finished with value: 1.855965394019735 and parameters: {'model_name': 'SimpleImputer', 'strategy': 'median'}. Best is trial 3 with value: 1.7084387879689786.
[I 2024-04-23 17:05:16,065] Trial 58 finished with value: 1.7084387879689786 and parameters: {'model_name': 'SimpleImputer', 'strategy': 'mean'}. Best is trial 3 with value: 1.7084387879689786.
[I 2024-04-23 17:05:16,318] Trial 45 finished with value: 1.855965394019735 and parameters: {'model_name': 'SimpleImputer', 'strategy': 'median'}. Best is trial 3 with value: 1.7084387879689786.
[I 2024-04-23 17:05:16,780] Trial 60 finished with value: 1.7084387879689786 and parameters: {'model_name': 'SimpleImputer', 'strategy': 'mean'}. Best is trial 3 with value: 1.7084387879689786.
[I 2024-04-23 17:05:17,072] Trial 56 finished with value: 1.7084387879689786 and parameters: {'model_name': 'SimpleImputer', 'strategy': 'mean'}. Best is trial 3 with value: 1.7084387879689786.
[I 2024-04-23 17:05:17,272] Trial 64 finished with value: 1.7084387879689786 and parameters: {'model_name': 'SimpleImputer', 'strategy': 'mean'}. Best is trial 3 with value: 1.7084387879689786.
[I 2024-04-23 17:05:17,711] Trial 59 finished with value: 1.7084387879689786 and parameters: {'model_name': 'SimpleImputer', 'strategy': 'mean'}. Best is trial 3 with value: 1.7084387879689786.
[I 2024-04-23 17:05:18,072] Trial 63 finished with value: 1.7084387879689786 and parameters: {'model_name': 'SimpleImputer', 'strategy': 'mean'}. Best is trial 3 with value: 1.7084387879689786.
[I 2024-04-23 17:05:18,243] Trial 57 finished with value: 1.7084387879689786 and parameters: {'model_name': 'SimpleImputer', 'strategy': 'mean'}. Best is trial 3 with value: 1.7084387879689786.
[I 2024-04-23 17:05:18,605] Trial 69 finished with value: 1.7084387879689786 and parameters: {'model_name': 'SimpleImputer', 'strategy': 'mean'}. Best is trial 3 with value: 1.7084387879689786.
[I 2024-04-23 17:05:18,925] Trial 61 finished with value: 1.7084387879689786 and parameters: {'model_name': 'SimpleImputer', 'strategy': 'mean'}. Best is trial 3 with value: 1.7084387879689786.
[I 2024-04-23 17:05:19,099] Trial 48 finished with value: 1.855965394019735 and parameters: {'model_name': 'SimpleImputer', 'strategy': 'median'}. Best is trial 3 with value: 1.7084387879689786.
[I 2024-04-23 17:05:19,414] Trial 70 finished with value: 1.7084387879689786 and parameters: {'model_name': 'SimpleImputer', 'strategy': 'mean'}. Best is trial 3 with value: 1.7084387879689786.
[I 2024-04-23 17:05:19,749] Trial 68 finished with value: 1.7084387879689786 and parameters: {'model_name': 'SimpleImputer', 'strategy': 'mean'}. Best is trial 3 with value: 1.7084387879689786.
[I 2024-04-23 17:05:20,035] Trial 71 finished with value: 1.7084387879689786 and parameters: {'model_name': 'SimpleImputer', 'strategy': 'mean'}. Best is trial 3 with value: 1.7084387879689786.
[I 2024-04-23 17:05:20,568] Trial 80 finished with value: 1.7084387879689786 and parameters: {'model_name': 'SimpleImputer', 'strategy': 'mean'}. Best is trial 3 with value: 1.7084387879689786.
[I 2024-04-23 17:05:21,005] Trial 72 finished with value: 1.7084387879689786 and parameters: {'model_name': 'SimpleImputer', 'strategy': 'mean'}. Best is trial 3 with value: 1.7084387879689786.
[I 2024-04-23 17:05:21,234] Trial 77 finished with value: 1.7084387879689786 and parameters: {'model_name': 'SimpleImputer', 'strategy': 'mean'}. Best is trial 3 with value: 1.7084387879689786.
[I 2024-04-23 17:05:21,525] Trial 65 finished with value: 1.855965394019735 and parameters: {'model_name': 'SimpleImputer', 'strategy': 'median'}. Best is trial 3 with value: 1.7084387879689786.
[I 2024-04-23 17:05:21,884] Trial 73 finished with value: 1.7084387879689786 and parameters: {'model_name': 'SimpleImputer', 'strategy': 'mean'}. Best is trial 3 with value: 1.7084387879689786.
[I 2024-04-23 17:05:22,251] Trial 76 finished with value: 1.7084387879689786 and parameters: {'model_name': 'SimpleImputer', 'strategy': 'mean'}. Best is trial 3 with value: 1.7084387879689786.
[I 2024-04-23 17:05:22,486] Trial 74 finished with value: 1.7084387879689786 and parameters: {'model_name': 'SimpleImputer', 'strategy': 'mean'}. Best is trial 3 with value: 1.7084387879689786.
[I 2024-04-23 17:05:22,773] Trial 79 finished with value: 1.7084387879689786 and parameters: {'model_name': 'SimpleImputer', 'strategy': 'mean'}. Best is trial 3 with value: 1.7084387879689786.
[I 2024-04-23 17:05:23,076] Trial 75 finished with value: 1.7084387879689786 and parameters: {'model_name': 'SimpleImputer', 'strategy': 'mean'}. Best is trial 3 with value: 1.7084387879689786.
[I 2024-04-23 17:05:23,273] Trial 81 finished with value: 1.7084387879689786 and parameters: {'model_name': 'SimpleImputer', 'strategy': 'mean'}. Best is trial 3 with value: 1.7084387879689786.
[I 2024-04-23 17:05:23,740] Trial 82 finished with value: 1.7084387879689786 and parameters: {'model_name': 'SimpleImputer', 'strategy': 'mean'}. Best is trial 3 with value: 1.7084387879689786.
[I 2024-04-23 17:05:24,029] Trial 78 finished with value: 1.7084387879689786 and parameters: {'model_name': 'SimpleImputer', 'strategy': 'mean'}. Best is trial 3 with value: 1.7084387879689786.
[I 2024-04-23 17:05:24,459] Trial 84 finished with value: 1.7084387879689786 and parameters: {'model_name': 'SimpleImputer', 'strategy': 'mean'}. Best is trial 3 with value: 1.7084387879689786.
[I 2024-04-23 17:05:24,745] Trial 85 finished with value: 1.7084387879689786 and parameters: {'model_name': 'SimpleImputer', 'strategy': 'mean'}. Best is trial 3 with value: 1.7084387879689786.
[I 2024-04-23 17:05:25,576] Trial 83 finished with value: 1.7084387879689786 and parameters: {'model_name': 'SimpleImputer', 'strategy': 'mean'}. Best is trial 3 with value: 1.7084387879689786.
[I 2024-04-23 17:05:26,041] Trial 88 finished with value: 1.7084387879689786 and parameters: {'model_name': 'SimpleImputer', 'strategy': 'mean'}. Best is trial 3 with value: 1.7084387879689786.
[I 2024-04-23 17:05:27,207] Trial 99 finished with value: 1.7084387879689786 and parameters: {'model_name': 'SimpleImputer', 'strategy': 'mean'}. Best is trial 3 with value: 1.7084387879689786.
[I 2024-04-23 17:05:28,222] Trial 111 finished with value: 1.7084387879689786 and parameters: {'model_name': 'SimpleImputer', 'strategy': 'mean'}. Best is trial 3 with value: 1.7084387879689786.
[I 2024-04-23 17:05:55,852] Trial 20 finished with value: 1.855965394019735 and parameters: {'model_name': 'SimpleImputer', 'strategy': 'most_frequent'}. Best is trial 3 with value: 1.7084387879689786.
[I 2024-04-23 17:05:57,124] Trial 8 finished with value: 1.855965394019735 and parameters: {'model_name': 'SimpleImputer', 'strategy': 'most_frequent'}. Best is trial 3 with value: 1.7084387879689786.
[I 2024-04-23 17:05:57,497] Trial 16 finished with value: 1.855965394019735 and parameters: {'model_name': 'SimpleImputer', 'strategy': 'most_frequent'}. Best is trial 3 with value: 1.7084387879689786.
[I 2024-04-23 17:05:57,765] Trial 4 finished with value: 1.855965394019735 and parameters: {'model_name': 'SimpleImputer', 'strategy': 'most_frequent'}. Best is trial 3 with value: 1.7084387879689786.
[I 2024-04-23 17:05:57,927] Trial 5 finished with value: 1.855965394019735 and parameters: {'model_name': 'SimpleImputer', 'strategy': 'most_frequent'}. Best is trial 3 with value: 1.7084387879689786.
[I 2024-04-23 17:05:59,101] Trial 19 finished with value: 1.855965394019735 and parameters: {'model_name': 'SimpleImputer', 'strategy': 'most_frequent'}. Best is trial 3 with value: 1.7084387879689786.
[I 2024-04-23 17:05:59,977] Trial 0 finished with value: 1.855965394019735 and parameters: {'model_name': 'SimpleImputer', 'strategy': 'most_frequent'}. Best is trial 3 with value: 1.7084387879689786.
[I 2024-04-23 17:06:00,673] Trial 67 finished with value: 1.855965394019735 and parameters: {'model_name': 'SimpleImputer', 'strategy': 'most_frequent'}. Best is trial 3 with value: 1.7084387879689786.
[I 2024-04-23 17:06:01,151] Trial 47 finished with value: 1.855965394019735 and parameters: {'model_name': 'SimpleImputer', 'strategy': 'most_frequent'}. Best is trial 3 with value: 1.7084387879689786.
[I 2024-04-23 17:06:01,410] Trial 36 finished with value: 1.855965394019735 and parameters: {'model_name': 'SimpleImputer', 'strategy': 'most_frequent'}. Best is trial 3 with value: 1.7084387879689786.
[I 2024-04-23 17:06:01,705] Trial 7 finished with value: 1.855965394019735 and parameters: {'model_name': 'SimpleImputer', 'strategy': 'most_frequent'}. Best is trial 3 with value: 1.7084387879689786.
[I 2024-04-23 17:06:02,226] Trial 28 finished with value: 1.855965394019735 and parameters: {'model_name': 'SimpleImputer', 'strategy': 'most_frequent'}. Best is trial 3 with value: 1.7084387879689786.
[I 2024-04-23 17:06:02,489] Trial 42 finished with value: 1.855965394019735 and parameters: {'model_name': 'SimpleImputer', 'strategy': 'most_frequent'}. Best is trial 3 with value: 1.7084387879689786.
[I 2024-04-23 17:06:02,915] Trial 37 finished with value: 1.855965394019735 and parameters: {'model_name': 'SimpleImputer', 'strategy': 'most_frequent'}. Best is trial 3 with value: 1.7084387879689786.
[I 2024-04-23 17:06:03,941] Trial 54 finished with value: 1.855965394019735 and parameters: {'model_name': 'SimpleImputer', 'strategy': 'most_frequent'}. Best is trial 3 with value: 1.7084387879689786.
[I 2024-04-23 17:06:05,013] Trial 29 finished with value: 1.855965394019735 and parameters: {'model_name': 'SimpleImputer', 'strategy': 'most_frequent'}. Best is trial 3 with value: 1.7084387879689786.
[I 2024-04-23 17:06:05,662] Trial 90 finished with value: 1.855965394019735 and parameters: {'model_name': 'SimpleImputer', 'strategy': 'most_frequent'}. Best is trial 3 with value: 1.7084387879689786.
[I 2024-04-23 17:06:06,224] Trial 62 finished with value: 1.855965394019735 and parameters: {'model_name': 'SimpleImputer', 'strategy': 'most_frequent'}. Best is trial 3 with value: 1.7084387879689786.
[I 2024-04-23 17:06:06,591] Trial 86 finished with value: 1.855965394019735 and parameters: {'model_name': 'SimpleImputer', 'strategy': 'most_frequent'}. Best is trial 3 with value: 1.7084387879689786.
[I 2024-04-23 17:06:06,913] Trial 104 finished with value: 1.855965394019735 and parameters: {'model_name': 'SimpleImputer', 'strategy': 'most_frequent'}. Best is trial 3 with value: 1.7084387879689786.
[I 2024-04-23 17:06:07,152] Trial 130 finished with value: 1.7084387879689786 and parameters: {'model_name': 'SimpleImputer', 'strategy': 'mean'}. Best is trial 3 with value: 1.7084387879689786.
[I 2024-04-23 17:06:07,411] Trial 126 finished with value: 1.7084387879689786 and parameters: {'model_name': 'SimpleImputer', 'strategy': 'mean'}. Best is trial 3 with value: 1.7084387879689786.
[I 2024-04-23 17:06:07,682] Trial 128 finished with value: 1.7084387879689786 and parameters: {'model_name': 'SimpleImputer', 'strategy': 'mean'}. Best is trial 3 with value: 1.7084387879689786.
[I 2024-04-23 17:06:07,946] Trial 32 finished with value: 1.855965394019735 and parameters: {'model_name': 'SimpleImputer', 'strategy': 'most_frequent'}. Best is trial 3 with value: 1.7084387879689786.
