[I 2024-02-11 05:10:31,579] Trial 16 finished with value: 2.499277654586258 and parameters: {'model_name': 'IterativeImputer', 'sample_posterior': True, 'initial_strategy': 'constant', 'imputation_order': 'arabic'}. Best is trial 39 with value: 1.8352694185708014.
[I 2024-02-11 05:10:38,911] Trial 49 finished with value: 2.4791546284690176 and parameters: {'model_name': 'IterativeImputer', 'sample_posterior': True, 'initial_strategy': 'median', 'imputation_order': 'descending'}. Best is trial 39 with value: 1.8352694185708014.
[I 2024-02-11 05:10:52,726] Trial 36 finished with value: 2.491633083106085 and parameters: {'model_name': 'IterativeImputer', 'sample_posterior': True, 'initial_strategy': 'mean', 'imputation_order': 'random'}. Best is trial 39 with value: 1.8352694185708014.
[I 2024-02-11 05:10:59,911] Trial 71 finished with value: 2.499221710208338 and parameters: {'model_name': 'IterativeImputer', 'sample_posterior': True, 'initial_strategy': 'most_frequent', 'imputation_order': 'roman'}. Best is trial 39 with value: 1.8352694185708014.
[I 2024-02-11 05:11:03,679] Trial 70 finished with value: 2.573121364180898 and parameters: {'model_name': 'IterativeImputer', 'sample_posterior': True, 'initial_strategy': 'mean', 'imputation_order': 'roman'}. Best is trial 39 with value: 1.8352694185708014.
[I 2024-02-11 05:11:04,674] Trial 69 finished with value: 2.4999789862472834 and parameters: {'model_name': 'IterativeImputer', 'sample_posterior': True, 'initial_strategy': 'most_frequent', 'imputation_order': 'arabic'}. Best is trial 39 with value: 1.8352694185708014.
[I 2024-02-11 05:11:10,070] Trial 64 finished with value: 2.5531514297790197 and parameters: {'model_name': 'IterativeImputer', 'sample_posterior': True, 'initial_strategy': 'mean', 'imputation_order': 'random'}. Best is trial 39 with value: 1.8352694185708014.
[I 2024-02-11 05:11:17,874] Trial 72 finished with value: 2.519935317401107 and parameters: {'model_name': 'IterativeImputer', 'sample_posterior': True, 'initial_strategy': 'mean', 'imputation_order': 'random'}. Best is trial 39 with value: 1.8352694185708014.
[I 2024-02-11 05:12:25,110] Trial 32 finished with value: 6.606809481018582 and parameters: {'model_name': 'RandomForestImputer', 'max_iter': 13, 'decreasing': True, 'min_samples_split': 0.1, 'min_samples_leaf': 0.30000000000000004, 'max_features': 0.1, 'warm_start': False}. Best is trial 39 with value: 1.8352694185708014.
[I 2024-02-11 05:12:45,259] Trial 80 finished with value: 2.578850513554901 and parameters: {'model_name': 'IterativeImputer', 'sample_posterior': True, 'initial_strategy': 'constant', 'imputation_order': 'arabic'}. Best is trial 39 with value: 1.8352694185708014.
[I 2024-02-11 05:12:50,531] Trial 81 finished with value: 2.490207193803793 and parameters: {'model_name': 'IterativeImputer', 'sample_posterior': True, 'initial_strategy': 'median', 'imputation_order': 'ascending'}. Best is trial 39 with value: 1.8352694185708014.
[I 2024-02-11 05:13:01,027] Trial 79 finished with value: 2.526842035964048 and parameters: {'model_name': 'IterativeImputer', 'sample_posterior': True, 'initial_strategy': 'most_frequent', 'imputation_order': 'descending'}. Best is trial 39 with value: 1.8352694185708014.
[I 2024-02-11 05:14:02,806] Trial 85 finished with value: 2.5010591483423585 and parameters: {'model_name': 'IterativeImputer', 'sample_posterior': True, 'initial_strategy': 'most_frequent', 'imputation_order': 'random'}. Best is trial 39 with value: 1.8352694185708014.
[I 2024-02-11 05:14:50,702] Trial 129 finished with value: 1.8352694185708014 and parameters: {'model_name': 'IterativeImputer', 'sample_posterior': False, 'initial_strategy': 'mean', 'imputation_order': 'arabic'}. Best is trial 39 with value: 1.8352694185708014.
[I 2024-02-11 05:14:56,699] Trial 130 finished with value: 1.8352694185708014 and parameters: {'model_name': 'IterativeImputer', 'sample_posterior': False, 'initial_strategy': 'mean', 'imputation_order': 'arabic'}. Best is trial 39 with value: 1.8352694185708014.
[I 2024-02-11 05:15:01,689] Trial 131 finished with value: 1.8352694185708014 and parameters: {'model_name': 'IterativeImputer', 'sample_posterior': False, 'initial_strategy': 'mean', 'imputation_order': 'arabic'}. Best is trial 39 with value: 1.8352694185708014.
[I 2024-02-11 05:15:02,931] Trial 132 finished with value: 1.8352694185708014 and parameters: {'model_name': 'IterativeImputer', 'sample_posterior': False, 'initial_strategy': 'mean', 'imputation_order': 'arabic'}. Best is trial 39 with value: 1.8352694185708014.
[I 2024-02-11 05:15:07,618] Trial 133 finished with value: 1.8352694185708014 and parameters: {'model_name': 'IterativeImputer', 'sample_posterior': False, 'initial_strategy': 'mean', 'imputation_order': 'arabic'}. Best is trial 39 with value: 1.8352694185708014.
[I 2024-02-11 05:15:16,292] Trial 134 finished with value: 1.8352694185708014 and parameters: {'model_name': 'IterativeImputer', 'sample_posterior': False, 'initial_strategy': 'mean', 'imputation_order': 'arabic'}. Best is trial 39 with value: 1.8352694185708014.
[I 2024-02-11 05:15:32,521] Trial 135 finished with value: 1.8352694185708014 and parameters: {'model_name': 'IterativeImputer', 'sample_posterior': False, 'initial_strategy': 'mean', 'imputation_order': 'arabic'}. Best is trial 39 with value: 1.8352694185708014.
[I 2024-02-11 05:15:41,758] Trial 136 finished with value: 1.8352694185708014 and parameters: {'model_name': 'IterativeImputer', 'sample_posterior': False, 'initial_strategy': 'mean', 'imputation_order': 'arabic'}. Best is trial 39 with value: 1.8352694185708014.
[I 2024-02-11 05:15:47,078] Trial 137 finished with value: 1.8352694185708014 and parameters: {'model_name': 'IterativeImputer', 'sample_posterior': False, 'initial_strategy': 'mean', 'imputation_order': 'arabic'}. Best is trial 39 with value: 1.8352694185708014.
[I 2024-02-11 05:15:48,373] Trial 138 finished with value: 1.8352694185708014 and parameters: {'model_name': 'IterativeImputer', 'sample_posterior': False, 'initial_strategy': 'mean', 'imputation_order': 'arabic'}. Best is trial 39 with value: 1.8352694185708014.
[I 2024-02-11 05:15:56,657] Trial 139 finished with value: 1.8352694185708014 and parameters: {'model_name': 'IterativeImputer', 'sample_posterior': False, 'initial_strategy': 'mean', 'imputation_order': 'arabic'}. Best is trial 39 with value: 1.8352694185708014.
[I 2024-02-11 05:16:06,229] Trial 155 finished with value: 7.363916558581691 and parameters: {'model_name': 'SimpleImputer', 'strategy': 'most_frequent'}. Best is trial 39 with value: 1.8352694185708014.
[I 2024-02-11 05:16:10,174] Trial 140 finished with value: 1.8352694185708014 and parameters: {'model_name': 'IterativeImputer', 'sample_posterior': False, 'initial_strategy': 'mean', 'imputation_order': 'arabic'}. Best is trial 39 with value: 1.8352694185708014.
[I 2024-02-11 05:16:14,907] Trial 156 finished with value: 7.363916558581691 and parameters: {'model_name': 'SimpleImputer', 'strategy': 'most_frequent'}. Best is trial 39 with value: 1.8352694185708014.
[I 2024-02-11 05:17:20,197] Trial 141 finished with value: 1.8352694185708014 and parameters: {'model_name': 'IterativeImputer', 'sample_posterior': False, 'initial_strategy': 'mean', 'imputation_order': 'arabic'}. Best is trial 39 with value: 1.8352694185708014.
[I 2024-02-11 05:17:39,865] Trial 142 finished with value: 1.8352694185708014 and parameters: {'model_name': 'IterativeImputer', 'sample_posterior': False, 'initial_strategy': 'mean', 'imputation_order': 'arabic'}. Best is trial 39 with value: 1.8352694185708014.
[I 2024-02-11 05:17:47,540] Trial 143 finished with value: 1.8352694185708014 and parameters: {'model_name': 'IterativeImputer', 'sample_posterior': False, 'initial_strategy': 'mean', 'imputation_order': 'arabic'}. Best is trial 39 with value: 1.8352694185708014.
[I 2024-02-11 05:17:54,843] Trial 144 finished with value: 1.8352694185708014 and parameters: {'model_name': 'IterativeImputer', 'sample_posterior': False, 'initial_strategy': 'mean', 'imputation_order': 'arabic'}. Best is trial 39 with value: 1.8352694185708014.
[I 2024-02-11 05:19:04,707] Trial 145 finished with value: 1.8352694185708014 and parameters: {'model_name': 'IterativeImputer', 'sample_posterior': False, 'initial_strategy': 'mean', 'imputation_order': 'arabic'}. Best is trial 39 with value: 1.8352694185708014.
[I 2024-02-11 05:19:41,207] Trial 105 finished with value: 2.494352845425193 and parameters: {'model_name': 'IterativeImputer', 'sample_posterior': True, 'initial_strategy': 'mean', 'imputation_order': 'arabic'}. Best is trial 39 with value: 1.8352694185708014.
[I 2024-02-11 05:19:43,320] Trial 104 finished with value: 2.4858543555638386 and parameters: {'model_name': 'IterativeImputer', 'sample_posterior': True, 'initial_strategy': 'mean', 'imputation_order': 'arabic'}. Best is trial 39 with value: 1.8352694185708014.
[I 2024-02-11 05:19:52,325] Trial 146 finished with value: 1.8352694185708014 and parameters: {'model_name': 'IterativeImputer', 'sample_posterior': False, 'initial_strategy': 'mean', 'imputation_order': 'arabic'}. Best is trial 39 with value: 1.8352694185708014.
[I 2024-02-11 05:19:54,630] Trial 147 finished with value: 1.8352694185708014 and parameters: {'model_name': 'IterativeImputer', 'sample_posterior': False, 'initial_strategy': 'mean', 'imputation_order': 'arabic'}. Best is trial 39 with value: 1.8352694185708014.
[I 2024-02-11 05:19:57,735] Trial 106 finished with value: 2.4881939733059215 and parameters: {'model_name': 'IterativeImputer', 'sample_posterior': True, 'initial_strategy': 'mean', 'imputation_order': 'arabic'}. Best is trial 39 with value: 1.8352694185708014.
[I 2024-02-11 05:19:58,964] Trial 149 finished with value: 1.8352694185708014 and parameters: {'model_name': 'IterativeImputer', 'sample_posterior': False, 'initial_strategy': 'mean', 'imputation_order': 'arabic'}. Best is trial 39 with value: 1.8352694185708014.
[I 2024-02-11 05:20:00,933] Trial 107 finished with value: 2.571823229888103 and parameters: {'model_name': 'IterativeImputer', 'sample_posterior': True, 'initial_strategy': 'mean', 'imputation_order': 'arabic'}. Best is trial 39 with value: 1.8352694185708014.
[I 2024-02-11 05:20:02,821] Trial 148 finished with value: 1.8352694185708014 and parameters: {'model_name': 'IterativeImputer', 'sample_posterior': False, 'initial_strategy': 'mean', 'imputation_order': 'arabic'}. Best is trial 39 with value: 1.8352694185708014.
[I 2024-02-11 05:20:08,804] Trial 108 finished with value: 2.4511213133976755 and parameters: {'model_name': 'IterativeImputer', 'sample_posterior': True, 'initial_strategy': 'mean', 'imputation_order': 'arabic'}. Best is trial 39 with value: 1.8352694185708014.
[I 2024-02-11 05:20:12,297] Trial 150 finished with value: 1.8352694185708014 and parameters: {'model_name': 'IterativeImputer', 'sample_posterior': False, 'initial_strategy': 'mean', 'imputation_order': 'arabic'}. Best is trial 39 with value: 1.8352694185708014.
[I 2024-02-11 05:20:14,711] Trial 110 finished with value: 2.5078232702540095 and parameters: {'model_name': 'IterativeImputer', 'sample_posterior': True, 'initial_strategy': 'mean', 'imputation_order': 'arabic'}. Best is trial 39 with value: 1.8352694185708014.
[I 2024-02-11 05:20:18,588] Trial 151 finished with value: 1.8352694185708014 and parameters: {'model_name': 'IterativeImputer', 'sample_posterior': False, 'initial_strategy': 'mean', 'imputation_order': 'arabic'}. Best is trial 39 with value: 1.8352694185708014.
[I 2024-02-11 05:20:24,221] Trial 109 finished with value: 2.566901398349313 and parameters: {'model_name': 'IterativeImputer', 'sample_posterior': True, 'initial_strategy': 'mean', 'imputation_order': 'arabic'}. Best is trial 39 with value: 1.8352694185708014.
[I 2024-02-11 05:20:26,303] Trial 111 finished with value: 2.5583212277535408 and parameters: {'model_name': 'IterativeImputer', 'sample_posterior': True, 'initial_strategy': 'mean', 'imputation_order': 'arabic'}. Best is trial 39 with value: 1.8352694185708014.
[I 2024-02-11 05:20:35,215] Trial 152 finished with value: 1.8352694185708014 and parameters: {'model_name': 'IterativeImputer', 'sample_posterior': False, 'initial_strategy': 'mean', 'imputation_order': 'arabic'}. Best is trial 39 with value: 1.8352694185708014.
[I 2024-02-11 05:20:40,905] Trial 112 finished with value: 2.4578433192488105 and parameters: {'model_name': 'IterativeImputer', 'sample_posterior': True, 'initial_strategy': 'mean', 'imputation_order': 'arabic'}. Best is trial 39 with value: 1.8352694185708014.
[I 2024-02-11 05:20:50,598] Trial 153 finished with value: 1.8352694185708014 and parameters: {'model_name': 'IterativeImputer', 'sample_posterior': False, 'initial_strategy': 'mean', 'imputation_order': 'arabic'}. Best is trial 39 with value: 1.8352694185708014.
[I 2024-02-11 05:20:54,089] Trial 154 finished with value: 1.8352694185708014 and parameters: {'model_name': 'IterativeImputer', 'sample_posterior': False, 'initial_strategy': 'mean', 'imputation_order': 'arabic'}. Best is trial 39 with value: 1.8352694185708014.
[I 2024-02-11 05:20:58,292] Trial 113 finished with value: 2.5029487941204325 and parameters: {'model_name': 'IterativeImputer', 'sample_posterior': True, 'initial_strategy': 'mean', 'imputation_order': 'arabic'}. Best is trial 39 with value: 1.8352694185708014.
[I 2024-02-11 05:21:12,285] Trial 157 finished with value: 1.8352694185708014 and parameters: {'model_name': 'IterativeImputer', 'sample_posterior': False, 'initial_strategy': 'mean', 'imputation_order': 'arabic'}. Best is trial 39 with value: 1.8352694185708014.
[I 2024-02-11 05:21:18,491] Trial 158 finished with value: 1.8352694185708014 and parameters: {'model_name': 'IterativeImputer', 'sample_posterior': False, 'initial_strategy': 'mean', 'imputation_order': 'arabic'}. Best is trial 39 with value: 1.8352694185708014.
[I 2024-02-11 05:21:21,967] Trial 159 finished with value: 1.8352694185708014 and parameters: {'model_name': 'IterativeImputer', 'sample_posterior': False, 'initial_strategy': 'mean', 'imputation_order': 'arabic'}. Best is trial 39 with value: 1.8352694185708014.
[I 2024-02-11 05:21:34,621] Trial 114 finished with value: 2.5301514537425662 and parameters: {'model_name': 'IterativeImputer', 'sample_posterior': True, 'initial_strategy': 'mean', 'imputation_order': 'arabic'}. Best is trial 39 with value: 1.8352694185708014.
[I 2024-02-11 05:21:35,523] Trial 116 finished with value: 2.504051675913336 and parameters: {'model_name': 'IterativeImputer', 'sample_posterior': True, 'initial_strategy': 'mean', 'imputation_order': 'arabic'}. Best is trial 39 with value: 1.8352694185708014.
[I 2024-02-11 05:21:39,180] Trial 115 finished with value: 2.495554330372429 and parameters: {'model_name': 'IterativeImputer', 'sample_posterior': True, 'initial_strategy': 'mean', 'imputation_order': 'arabic'}. Best is trial 39 with value: 1.8352694185708014.
[I 2024-02-11 05:21:53,031] Trial 117 finished with value: 2.5536986771378545 and parameters: {'model_name': 'IterativeImputer', 'sample_posterior': True, 'initial_strategy': 'mean', 'imputation_order': 'arabic'}. Best is trial 39 with value: 1.8352694185708014.
[I 2024-02-11 05:22:30,634] Trial 160 finished with value: 1.8352694185708014 and parameters: {'model_name': 'IterativeImputer', 'sample_posterior': False, 'initial_strategy': 'mean', 'imputation_order': 'arabic'}. Best is trial 39 with value: 1.8352694185708014.
[I 2024-02-11 05:22:37,631] Trial 118 finished with value: 2.4789136403294285 and parameters: {'model_name': 'IterativeImputer', 'sample_posterior': True, 'initial_strategy': 'mean', 'imputation_order': 'arabic'}. Best is trial 39 with value: 1.8352694185708014.
[I 2024-02-11 05:22:50,240] Trial 161 finished with value: 1.8352694185708014 and parameters: {'model_name': 'IterativeImputer', 'sample_posterior': False, 'initial_strategy': 'mean', 'imputation_order': 'arabic'}. Best is trial 39 with value: 1.8352694185708014.
[I 2024-02-11 05:22:57,611] Trial 162 finished with value: 1.8352694185708014 and parameters: {'model_name': 'IterativeImputer', 'sample_posterior': False, 'initial_strategy': 'mean', 'imputation_order': 'arabic'}. Best is trial 39 with value: 1.8352694185708014.
[I 2024-02-11 05:23:02,683] Trial 120 finished with value: 2.499187719347977 and parameters: {'model_name': 'IterativeImputer', 'sample_posterior': True, 'initial_strategy': 'mean', 'imputation_order': 'arabic'}. Best is trial 39 with value: 1.8352694185708014.
[I 2024-02-11 05:23:06,818] Trial 121 finished with value: 2.5472120913027623 and parameters: {'model_name': 'IterativeImputer', 'sample_posterior': True, 'initial_strategy': 'mean', 'imputation_order': 'arabic'}. Best is trial 39 with value: 1.8352694185708014.
[I 2024-02-11 05:23:08,044] Trial 163 finished with value: 1.8352694185708014 and parameters: {'model_name': 'IterativeImputer', 'sample_posterior': False, 'initial_strategy': 'mean', 'imputation_order': 'arabic'}. Best is trial 39 with value: 1.8352694185708014.
[I 2024-02-11 05:23:23,914] Trial 122 finished with value: 2.482800486189263 and parameters: {'model_name': 'IterativeImputer', 'sample_posterior': True, 'initial_strategy': 'mean', 'imputation_order': 'arabic'}. Best is trial 39 with value: 1.8352694185708014.
[I 2024-02-11 05:23:40,491] Trial 123 finished with value: 2.5082469285272686 and parameters: {'model_name': 'IterativeImputer', 'sample_posterior': True, 'initial_strategy': 'mean', 'imputation_order': 'arabic'}. Best is trial 39 with value: 1.8352694185708014.
[I 2024-02-11 05:24:19,227] Trial 164 finished with value: 1.8352694185708014 and parameters: {'model_name': 'IterativeImputer', 'sample_posterior': False, 'initial_strategy': 'mean', 'imputation_order': 'arabic'}. Best is trial 39 with value: 1.8352694185708014.
[I 2024-02-11 05:24:39,759] Trial 124 finished with value: 2.4729488947552385 and parameters: {'model_name': 'IterativeImputer', 'sample_posterior': True, 'initial_strategy': 'mean', 'imputation_order': 'arabic'}. Best is trial 39 with value: 1.8352694185708014.
[I 2024-02-11 05:24:53,818] Trial 165 finished with value: 1.8352694185708014 and parameters: {'model_name': 'IterativeImputer', 'sample_posterior': False, 'initial_strategy': 'mean', 'imputation_order': 'arabic'}. Best is trial 39 with value: 1.8352694185708014.
[I 2024-02-11 05:24:55,982] Trial 166 finished with value: 1.8352694185708014 and parameters: {'model_name': 'IterativeImputer', 'sample_posterior': False, 'initial_strategy': 'mean', 'imputation_order': 'arabic'}. Best is trial 39 with value: 1.8352694185708014.
[I 2024-02-11 05:25:03,202] Trial 168 finished with value: 1.8352694185708014 and parameters: {'model_name': 'IterativeImputer', 'sample_posterior': False, 'initial_strategy': 'mean', 'imputation_order': 'arabic'}. Best is trial 39 with value: 1.8352694185708014.
[I 2024-02-11 05:25:06,464] Trial 167 finished with value: 1.8352694185708014 and parameters: {'model_name': 'IterativeImputer', 'sample_posterior': False, 'initial_strategy': 'mean', 'imputation_order': 'arabic'}. Best is trial 39 with value: 1.8352694185708014.
[I 2024-02-11 05:25:08,513] Trial 172 finished with value: 1.8352694185708014 and parameters: {'model_name': 'IterativeImputer', 'sample_posterior': False, 'initial_strategy': 'mean', 'imputation_order': 'arabic'}. Best is trial 39 with value: 1.8352694185708014.
[I 2024-02-11 05:25:10,340] Trial 169 finished with value: 1.8352694185708014 and parameters: {'model_name': 'IterativeImputer', 'sample_posterior': False, 'initial_strategy': 'mean', 'imputation_order': 'arabic'}. Best is trial 39 with value: 1.8352694185708014.
[I 2024-02-11 05:25:11,483] Trial 170 finished with value: 1.8352694185708014 and parameters: {'model_name': 'IterativeImputer', 'sample_posterior': False, 'initial_strategy': 'mean', 'imputation_order': 'arabic'}. Best is trial 39 with value: 1.8352694185708014.
[I 2024-02-11 05:25:12,232] Trial 171 finished with value: 1.8352694185708014 and parameters: {'model_name': 'IterativeImputer', 'sample_posterior': False, 'initial_strategy': 'mean', 'imputation_order': 'arabic'}. Best is trial 39 with value: 1.8352694185708014.
[I 2024-02-11 05:25:19,716] Trial 173 finished with value: 1.8352694185708014 and parameters: {'model_name': 'IterativeImputer', 'sample_posterior': False, 'initial_strategy': 'mean', 'imputation_order': 'arabic'}. Best is trial 39 with value: 1.8352694185708014.
[I 2024-02-11 05:25:21,395] Trial 174 finished with value: 1.8352694185708014 and parameters: {'model_name': 'IterativeImputer', 'sample_posterior': False, 'initial_strategy': 'mean', 'imputation_order': 'arabic'}. Best is trial 39 with value: 1.8352694185708014.
[I 2024-02-11 05:25:23,393] Trial 175 finished with value: 1.8352694185708014 and parameters: {'model_name': 'IterativeImputer', 'sample_posterior': False, 'initial_strategy': 'mean', 'imputation_order': 'arabic'}. Best is trial 39 with value: 1.8352694185708014.
[I 2024-02-11 05:25:27,765] Trial 176 finished with value: 1.8352694185708014 and parameters: {'model_name': 'IterativeImputer', 'sample_posterior': False, 'initial_strategy': 'mean', 'imputation_order': 'arabic'}. Best is trial 39 with value: 1.8352694185708014.
[I 2024-02-11 05:25:29,384] Trial 177 finished with value: 1.8352694185708014 and parameters: {'model_name': 'IterativeImputer', 'sample_posterior': False, 'initial_strategy': 'mean', 'imputation_order': 'arabic'}. Best is trial 39 with value: 1.8352694185708014.
[I 2024-02-11 05:25:32,756] Trial 178 finished with value: 1.8352694185708014 and parameters: {'model_name': 'IterativeImputer', 'sample_posterior': False, 'initial_strategy': 'mean', 'imputation_order': 'arabic'}. Best is trial 39 with value: 1.8352694185708014.
