[I 2024-01-06 18:30:38,237] Trial 170 finished with value: 1309.2347220565925 and parameters: {'model_name': 'IterativeImputer', 'sample_posterior': False, 'initial_strategy': 'constant', 'imputation_order': 'ascending'}. Best is trial 67 with value: 1308.4125163406825.
[I 2024-01-06 18:30:55,578] Trial 172 finished with value: 1309.2347220565925 and parameters: {'model_name': 'IterativeImputer', 'sample_posterior': False, 'initial_strategy': 'constant', 'imputation_order': 'ascending'}. Best is trial 67 with value: 1308.4125163406825.
[I 2024-01-06 18:30:59,117] Trial 171 finished with value: 1309.2347220565925 and parameters: {'model_name': 'IterativeImputer', 'sample_posterior': False, 'initial_strategy': 'most_frequent', 'imputation_order': 'ascending'}. Best is trial 67 with value: 1308.4125163406825.
[I 2024-01-06 18:31:05,477] Trial 174 finished with value: 1309.2347220565925 and parameters: {'model_name': 'IterativeImputer', 'sample_posterior': False, 'initial_strategy': 'constant', 'imputation_order': 'ascending'}. Best is trial 67 with value: 1308.4125163406825.
[I 2024-01-06 18:31:07,020] Trial 173 finished with value: 1309.2347220565925 and parameters: {'model_name': 'IterativeImputer', 'sample_posterior': False, 'initial_strategy': 'constant', 'imputation_order': 'ascending'}. Best is trial 67 with value: 1308.4125163406825.
[I 2024-01-06 18:31:13,313] Trial 175 finished with value: 1309.2347220565925 and parameters: {'model_name': 'IterativeImputer', 'sample_posterior': False, 'initial_strategy': 'constant', 'imputation_order': 'ascending'}. Best is trial 67 with value: 1308.4125163406825.
[I 2024-01-06 18:31:16,798] Trial 177 finished with value: 1309.2347220565925 and parameters: {'model_name': 'IterativeImputer', 'sample_posterior': False, 'initial_strategy': 'constant', 'imputation_order': 'ascending'}. Best is trial 67 with value: 1308.4125163406825.
[I 2024-01-06 18:31:24,629] Trial 178 finished with value: 1309.2347220565925 and parameters: {'model_name': 'IterativeImputer', 'sample_posterior': False, 'initial_strategy': 'constant', 'imputation_order': 'ascending'}. Best is trial 67 with value: 1308.4125163406825.
[I 2024-01-06 18:31:27,265] Trial 179 finished with value: 1309.2347220565925 and parameters: {'model_name': 'IterativeImputer', 'sample_posterior': False, 'initial_strategy': 'constant', 'imputation_order': 'ascending'}. Best is trial 67 with value: 1308.4125163406825.
[I 2024-01-06 18:31:28,987] Trial 180 finished with value: 1309.2347220565925 and parameters: {'model_name': 'IterativeImputer', 'sample_posterior': False, 'initial_strategy': 'constant', 'imputation_order': 'ascending'}. Best is trial 67 with value: 1308.4125163406825.
[I 2024-01-06 18:31:29,716] Trial 181 finished with value: 1309.2347220565925 and parameters: {'model_name': 'IterativeImputer', 'sample_posterior': False, 'initial_strategy': 'constant', 'imputation_order': 'ascending'}. Best is trial 67 with value: 1308.4125163406825.
[I 2024-01-06 18:31:33,033] Trial 182 finished with value: 1309.2347220565925 and parameters: {'model_name': 'IterativeImputer', 'sample_posterior': False, 'initial_strategy': 'constant', 'imputation_order': 'ascending'}. Best is trial 67 with value: 1308.4125163406825.
[I 2024-01-06 18:31:35,359] Trial 183 finished with value: 1309.2347220565925 and parameters: {'model_name': 'IterativeImputer', 'sample_posterior': False, 'initial_strategy': 'constant', 'imputation_order': 'ascending'}. Best is trial 67 with value: 1308.4125163406825.
[I 2024-01-06 18:31:37,677] Trial 184 finished with value: 1309.2347421926625 and parameters: {'model_name': 'IterativeImputer', 'sample_posterior': False, 'initial_strategy': 'constant', 'imputation_order': 'random'}. Best is trial 67 with value: 1308.4125163406825.
[I 2024-01-06 18:31:43,472] Trial 185 finished with value: 1309.2347220565925 and parameters: {'model_name': 'IterativeImputer', 'sample_posterior': False, 'initial_strategy': 'constant', 'imputation_order': 'ascending'}. Best is trial 67 with value: 1308.4125163406825.
[I 2024-01-06 18:31:48,215] Trial 21 finished with value: 1310.638968482135 and parameters: {'model_name': 'RandomForestImputer', 'max_iter': 21, 'decreasing': False, 'min_samples_split': 1.0, 'min_samples_leaf': 0.6, 'max_features': 0.4, 'warm_start': False}. Best is trial 67 with value: 1308.4125163406825.
[I 2024-01-06 18:31:49,081] Trial 189 finished with value: 1309.2347220565925 and parameters: {'model_name': 'IterativeImputer', 'sample_posterior': False, 'initial_strategy': 'constant', 'imputation_order': 'ascending'}. Best is trial 67 with value: 1308.4125163406825.
[I 2024-01-06 18:31:49,878] Trial 188 finished with value: 1309.2347199483927 and parameters: {'model_name': 'IterativeImputer', 'sample_posterior': False, 'initial_strategy': 'median', 'imputation_order': 'arabic'}. Best is trial 67 with value: 1308.4125163406825.
[I 2024-01-06 18:31:52,436] Trial 190 finished with value: 1309.2347220565925 and parameters: {'model_name': 'IterativeImputer', 'sample_posterior': False, 'initial_strategy': 'constant', 'imputation_order': 'ascending'}. Best is trial 67 with value: 1308.4125163406825.
[I 2024-01-06 18:31:53,897] Trial 191 finished with value: 1309.2347220565925 and parameters: {'model_name': 'IterativeImputer', 'sample_posterior': False, 'initial_strategy': 'median', 'imputation_order': 'ascending'}. Best is trial 67 with value: 1308.4125163406825.
[I 2024-01-06 18:31:55,818] Trial 123 finished with value: 1659.3832061684413 and parameters: {'model_name': 'IterativeImputer', 'sample_posterior': True, 'initial_strategy': 'most_frequent', 'imputation_order': 'random'}. Best is trial 67 with value: 1308.4125163406825.
[I 2024-01-06 18:31:58,227] Trial 192 finished with value: 1309.2347220565925 and parameters: {'model_name': 'IterativeImputer', 'sample_posterior': False, 'initial_strategy': 'constant', 'imputation_order': 'ascending'}. Best is trial 67 with value: 1308.4125163406825.
[I 2024-01-06 18:32:05,118] Trial 193 finished with value: 1309.2347220565925 and parameters: {'model_name': 'IterativeImputer', 'sample_posterior': False, 'initial_strategy': 'constant', 'imputation_order': 'ascending'}. Best is trial 67 with value: 1308.4125163406825.
[I 2024-01-06 18:32:05,896] Trial 194 finished with value: 1309.2347220565925 and parameters: {'model_name': 'IterativeImputer', 'sample_posterior': False, 'initial_strategy': 'constant', 'imputation_order': 'ascending'}. Best is trial 67 with value: 1308.4125163406825.
[I 2024-01-06 18:32:12,970] Trial 198 finished with value: 1309.2347220565925 and parameters: {'model_name': 'IterativeImputer', 'sample_posterior': False, 'initial_strategy': 'constant', 'imputation_order': 'ascending'}. Best is trial 67 with value: 1308.4125163406825.
[I 2024-01-06 18:32:14,664] Trial 199 finished with value: 1309.2347220565925 and parameters: {'model_name': 'IterativeImputer', 'sample_posterior': False, 'initial_strategy': 'median', 'imputation_order': 'ascending'}. Best is trial 67 with value: 1308.4125163406825.
[I 2024-01-06 18:32:19,293] Trial 124 finished with value: 1664.2337396975586 and parameters: {'model_name': 'IterativeImputer', 'sample_posterior': True, 'initial_strategy': 'most_frequent', 'imputation_order': 'random'}. Best is trial 67 with value: 1308.4125163406825.
[I 2024-01-06 18:32:25,563] Trial 125 finished with value: 1666.8198417951287 and parameters: {'model_name': 'IterativeImputer', 'sample_posterior': True, 'initial_strategy': 'most_frequent', 'imputation_order': 'random'}. Best is trial 67 with value: 1308.4125163406825.
[I 2024-01-06 18:32:54,740] Trial 126 finished with value: 1659.4098663341254 and parameters: {'model_name': 'IterativeImputer', 'sample_posterior': True, 'initial_strategy': 'most_frequent', 'imputation_order': 'random'}. Best is trial 67 with value: 1308.4125163406825.
[I 2024-01-06 18:32:57,048] Trial 127 finished with value: 1692.5355325127966 and parameters: {'model_name': 'IterativeImputer', 'sample_posterior': True, 'initial_strategy': 'most_frequent', 'imputation_order': 'random'}. Best is trial 67 with value: 1308.4125163406825.
[I 2024-01-06 18:34:27,725] Trial 197 finished with value: 1310.370085581609 and parameters: {'model_name': 'RandomForestImputer', 'max_iter': 28, 'decreasing': False, 'min_samples_split': 0.7000000000000001, 'min_samples_leaf': 0.1, 'max_features': 0.9, 'warm_start': True}. Best is trial 67 with value: 1308.4125163406825.
[I 2024-01-06 18:34:34,120] Trial 50 finished with value: 1305.5043377007273 and parameters: {'model_name': 'RandomForestImputer', 'max_iter': 34, 'decreasing': True, 'min_samples_split': 0.30000000000000004, 'min_samples_leaf': 0.1, 'max_features': 0.6, 'warm_start': False}. Best is trial 50 with value: 1305.5043377007273.
[I 2024-01-06 18:35:10,633] Trial 3 finished with value: inf and parameters: {'model_name': 'GAIN', 'batch_size': 65, 'hint_rate': 0.24000000000000002, 'alpha': 46, 'iterations': 25549}. Best is trial 50 with value: 1305.5043377007273.
[I 2024-01-06 18:35:41,459] Trial 54 finished with value: 1310.5992968880437 and parameters: {'model_name': 'RandomForestImputer', 'max_iter': 75, 'decreasing': True, 'min_samples_split': 1.0, 'min_samples_leaf': 0.8, 'max_features': 0.30000000000000004, 'warm_start': False}. Best is trial 50 with value: 1305.5043377007273.
[I 2024-01-06 18:35:43,218] Trial 32 finished with value: inf and parameters: {'model_name': 'GAIN', 'batch_size': 16, 'hint_rate': 0.92, 'alpha': 55, 'iterations': 38810}. Best is trial 50 with value: 1305.5043377007273.
