[I 2024-01-11 02:43:04,429] Trial 11 finished with value: 0.1043006041887267 and parameters: {'model_name': 'SimpleImputer', 'strategy': 'constant'}. Best is trial 11 with value: 0.1043006041887267.
[I 2024-01-11 02:43:05,145] Trial 12 finished with value: 0.1043006041887267 and parameters: {'model_name': 'SimpleImputer', 'strategy': 'constant'}. Best is trial 11 with value: 0.1043006041887267.
[I 2024-01-11 02:43:19,628] Trial 0 finished with value: 0.08649322078031683 and parameters: {'model_name': 'SimpleImputer', 'strategy': 'mean'}. Best is trial 0 with value: 0.08649322078031683.
[I 2024-01-11 02:44:02,672] Trial 48 finished with value: 0.1043006041887267 and parameters: {'model_name': 'SimpleImputer', 'strategy': 'constant'}. Best is trial 0 with value: 0.08649322078031683.
[I 2024-01-11 02:44:34,450] Trial 49 finished with value: 0.08649322078031683 and parameters: {'model_name': 'SimpleImputer', 'strategy': 'mean'}. Best is trial 0 with value: 0.08649322078031683.
[I 2024-01-11 02:45:06,729] Trial 4 finished with value: 0.09227876017372268 and parameters: {'model_name': 'SimpleImputer', 'strategy': 'median'}. Best is trial 0 with value: 0.08649322078031683.
[I 2024-01-11 02:45:49,367] Trial 40 finished with value: 0.09227876017372268 and parameters: {'model_name': 'SimpleImputer', 'strategy': 'median'}. Best is trial 0 with value: 0.08649322078031683.
2024-01-11 02:46:51.814226: E external/local_xla/xla/stream_executor/cuda/cuda_driver.cc:274] failed call to cuInit: CUDA_ERROR_NO_DEVICE: no CUDA-capable device is detected
2024-01-11 02:46:53.180083: I tensorflow/compiler/mlir/mlir_graph_optimization_pass.cc:388] MLIR V1 optimization pass is not enabled
[I 2024-01-11 02:47:41,107] Trial 53 finished with value: 0.09227876017372268 and parameters: {'model_name': 'SimpleImputer', 'strategy': 'median'}. Best is trial 0 with value: 0.08649322078031683.
[I 2024-01-11 02:50:56,005] Trial 34 finished with value: inf and parameters: {'model_name': 'GAIN', 'batch_size': 316, 'hint_rate': 0.13, 'alpha': 40, 'iterations': 37}. Best is trial 0 with value: 0.08649322078031683.
[I 2024-01-11 02:51:56,961] Trial 56 finished with value: 0.1043006041887267 and parameters: {'model_name': 'SimpleImputer', 'strategy': 'constant'}. Best is trial 0 with value: 0.08649322078031683.
[I 2024-01-11 02:54:44,779] Trial 46 finished with value: inf and parameters: {'model_name': 'GAIN', 'batch_size': 4, 'hint_rate': 0.54, 'alpha': 86, 'iterations': 93}. Best is trial 0 with value: 0.08649322078031683.
[I 2024-01-11 03:33:42,064] Trial 8 finished with value: inf and parameters: {'model_name': 'GAIN', 'batch_size': 192, 'hint_rate': 0.29000000000000004, 'alpha': 14, 'iterations': 620}. Best is trial 0 with value: 0.08649322078031683.
[I 2024-01-11 03:51:34,870] Trial 27 finished with value: inf and parameters: {'model_name': 'GAIN', 'batch_size': 36, 'hint_rate': 0.85, 'alpha': 71, 'iterations': 1033}. Best is trial 0 with value: 0.08649322078031683.
[I 2024-01-11 03:58:46,924] Trial 6 finished with value: inf and parameters: {'model_name': 'GAIN', 'batch_size': 82, 'hint_rate': 0.74, 'alpha': 98, 'iterations': 1255}. Best is trial 0 with value: 0.08649322078031683.
[I 2024-01-11 04:01:51,448] Trial 19 finished with value: inf and parameters: {'model_name': 'GAIN', 'batch_size': 221, 'hint_rate': 0.14, 'alpha': 74, 'iterations': 1214}. Best is trial 0 with value: 0.08649322078031683.
[I 2024-01-11 04:19:13,994] Trial 14 finished with value: 0.09227876017372268 and parameters: {'model_name': 'SimpleImputer', 'strategy': 'most_frequent'}. Best is trial 0 with value: 0.08649322078031683.
[I 2024-01-11 04:20:23,409] Trial 25 finished with value: 0.09227876017372268 and parameters: {'model_name': 'SimpleImputer', 'strategy': 'most_frequent'}. Best is trial 0 with value: 0.08649322078031683.
[I 2024-01-11 04:20:37,949] Trial 36 finished with value: 0.09227876017372268 and parameters: {'model_name': 'SimpleImputer', 'strategy': 'most_frequent'}. Best is trial 0 with value: 0.08649322078031683.
[I 2024-01-11 04:20:53,132] Trial 32 finished with value: 0.09227876017372268 and parameters: {'model_name': 'SimpleImputer', 'strategy': 'most_frequent'}. Best is trial 0 with value: 0.08649322078031683.
[I 2024-01-11 04:21:03,944] Trial 47 finished with value: 0.09227876017372268 and parameters: {'model_name': 'SimpleImputer', 'strategy': 'most_frequent'}. Best is trial 0 with value: 0.08649322078031683.
[I 2024-01-11 04:38:39,569] Trial 5 finished with value: 0.3212836696966924 and parameters: {'model_name': 'GAIN', 'batch_size': 7, 'hint_rate': 0.97, 'alpha': 14, 'iterations': 2}. Best is trial 0 with value: 0.08649322078031683.
[I 2024-01-11 04:43:44,339] Trial 2 finished with value: 0.4617375143151591 and parameters: {'model_name': 'GAIN', 'batch_size': 236, 'hint_rate': 0.41000000000000003, 'alpha': 20, 'iterations': 1}. Best is trial 0 with value: 0.08649322078031683.
[I 2024-01-11 04:45:21,702] Trial 41 finished with value: 0.36341089535291715 and parameters: {'model_name': 'GAIN', 'batch_size': 1, 'hint_rate': 0.5800000000000001, 'alpha': 100, 'iterations': 2}. Best is trial 0 with value: 0.08649322078031683.
[I 2024-01-11 04:46:47,834] Trial 3 finished with value: 0.46966274561377813 and parameters: {'model_name': 'GAIN', 'batch_size': 426, 'hint_rate': 0.41000000000000003, 'alpha': 9, 'iterations': 1}. Best is trial 0 with value: 0.08649322078031683.
[I 2024-01-11 04:47:05,247] Trial 54 finished with value: 0.31938511503749056 and parameters: {'model_name': 'GAIN', 'batch_size': 5, 'hint_rate': 0.08, 'alpha': 68, 'iterations': 2}. Best is trial 0 with value: 0.08649322078031683.
[I 2024-01-11 04:49:42,185] Trial 10 finished with value: 0.12202832485445443 and parameters: {'model_name': 'GAIN', 'batch_size': 87, 'hint_rate': 0.81, 'alpha': 89, 'iterations': 4}. Best is trial 0 with value: 0.08649322078031683.
[I 2024-01-11 05:20:24,791] Trial 38 finished with value: inf and parameters: {'model_name': 'GAIN', 'batch_size': 169, 'hint_rate': 0.67, 'alpha': 19, 'iterations': 2999}. Best is trial 0 with value: 0.08649322078031683.
[I 2024-01-11 05:23:37,983] Trial 28 finished with value: inf and parameters: {'model_name': 'GAIN', 'batch_size': 668, 'hint_rate': 0.74, 'alpha': 83, 'iterations': 2483}. Best is trial 0 with value: 0.08649322078031683.
[I 2024-01-11 06:55:39,427] Trial 18 finished with value: 0.04175254704239064 and parameters: {'model_name': 'KNNImputer', 'weights': 'uniform', 'keep_empty_features': False}. Best is trial 18 with value: 0.04175254704239064.
[I 2024-01-11 06:57:14,812] Trial 9 finished with value: 0.04175254704239064 and parameters: {'model_name': 'KNNImputer', 'weights': 'uniform', 'keep_empty_features': False}. Best is trial 18 with value: 0.04175254704239064.
[I 2024-01-11 06:57:45,097] Trial 44 finished with value: 0.04175254704239064 and parameters: {'model_name': 'KNNImputer', 'weights': 'uniform', 'keep_empty_features': False}. Best is trial 18 with value: 0.04175254704239064.
[I 2024-01-11 07:05:26,383] Trial 50 finished with value: 0.04175254704239064 and parameters: {'model_name': 'KNNImputer', 'weights': 'uniform', 'keep_empty_features': False}. Best is trial 18 with value: 0.04175254704239064.
[I 2024-01-11 07:20:10,729] Trial 26 finished with value: 0.039803903949116225 and parameters: {'model_name': 'KNNImputer', 'weights': 'distance', 'keep_empty_features': False}. Best is trial 26 with value: 0.039803903949116225.
[I 2024-01-11 07:21:07,918] Trial 42 finished with value: 0.039803903949116225 and parameters: {'model_name': 'KNNImputer', 'weights': 'distance', 'keep_empty_features': False}. Best is trial 26 with value: 0.039803903949116225.
[I 2024-01-11 07:22:02,538] Trial 29 finished with value: 0.039803903949116225 and parameters: {'model_name': 'KNNImputer', 'weights': 'distance', 'keep_empty_features': False}. Best is trial 26 with value: 0.039803903949116225.
[I 2024-01-11 07:23:18,904] Trial 22 finished with value: 0.039803903949116225 and parameters: {'model_name': 'KNNImputer', 'weights': 'distance', 'keep_empty_features': False}. Best is trial 26 with value: 0.039803903949116225.
[I 2024-01-11 07:24:46,216] Trial 15 finished with value: 0.039803903949116225 and parameters: {'model_name': 'KNNImputer', 'weights': 'distance', 'keep_empty_features': False}. Best is trial 26 with value: 0.039803903949116225.
[I 2024-01-11 07:39:08,552] Trial 55 finished with value: 0.039803903949116225 and parameters: {'model_name': 'KNNImputer', 'weights': 'distance', 'keep_empty_features': False}. Best is trial 26 with value: 0.039803903949116225.
[I 2024-01-11 07:55:53,991] Trial 60 finished with value: 0.08649322078031683 and parameters: {'model_name': 'RandomForestImputer', 'max_iter': 1, 'decreasing': True, 'min_samples_split': 0.7000000000000001, 'min_samples_leaf': 0.4, 'max_features': 0.5, 'warm_start': True}. Best is trial 26 with value: 0.039803903949116225.
[I 2024-01-11 09:52:19,438] Trial 63 finished with value: 0.039803903949116225 and parameters: {'model_name': 'KNNImputer', 'weights': 'distance', 'keep_empty_features': False}. Best is trial 26 with value: 0.039803903949116225.
[I 2024-01-11 10:00:22,745] Trial 73 finished with value: 0.04175254704239064 and parameters: {'model_name': 'KNNImputer', 'weights': 'uniform', 'keep_empty_features': False}. Best is trial 26 with value: 0.039803903949116225.
[I 2024-01-11 10:07:43,143] Trial 65 finished with value: 0.039803903949116225 and parameters: {'model_name': 'KNNImputer', 'weights': 'distance', 'keep_empty_features': False}. Best is trial 26 with value: 0.039803903949116225.
[I 2024-01-11 10:37:05,933] Trial 69 finished with value: 0.039803903949116225 and parameters: {'model_name': 'KNNImputer', 'weights': 'distance', 'keep_empty_features': False}. Best is trial 26 with value: 0.039803903949116225.
[I 2024-01-11 11:19:05,456] Trial 75 finished with value: 0.039803903949116225 and parameters: {'model_name': 'KNNImputer', 'weights': 'distance', 'keep_empty_features': False}. Best is trial 26 with value: 0.039803903949116225.
[I 2024-01-11 12:37:20,432] Trial 77 finished with value: 0.04175254704239064 and parameters: {'model_name': 'KNNImputer', 'weights': 'uniform', 'keep_empty_features': False}. Best is trial 26 with value: 0.039803903949116225.
[I 2024-01-11 12:37:44,705] Trial 76 finished with value: 0.04175254704239064 and parameters: {'model_name': 'KNNImputer', 'weights': 'uniform', 'keep_empty_features': False}. Best is trial 26 with value: 0.039803903949116225.
[I 2024-01-11 12:46:19,217] Trial 78 finished with value: 0.04175254704239064 and parameters: {'model_name': 'KNNImputer', 'weights': 'uniform', 'keep_empty_features': False}. Best is trial 26 with value: 0.039803903949116225.
[I 2024-01-11 12:57:52,330] Trial 79 finished with value: 0.04175254704239064 and parameters: {'model_name': 'KNNImputer', 'weights': 'uniform', 'keep_empty_features': False}. Best is trial 26 with value: 0.039803903949116225.
[I 2024-01-11 13:05:16,201] Trial 80 finished with value: 0.04175254704239064 and parameters: {'model_name': 'KNNImputer', 'weights': 'uniform', 'keep_empty_features': False}. Best is trial 26 with value: 0.039803903949116225.
[I 2024-01-11 13:43:55,573] Trial 82 finished with value: 0.039803903949116225 and parameters: {'model_name': 'KNNImputer', 'weights': 'distance', 'keep_empty_features': False}. Best is trial 26 with value: 0.039803903949116225.
[I 2024-01-11 13:48:18,256] Trial 81 finished with value: 0.039803903949116225 and parameters: {'model_name': 'KNNImputer', 'weights': 'distance', 'keep_empty_features': False}. Best is trial 26 with value: 0.039803903949116225.
[I 2024-01-11 14:08:16,418] Trial 1 finished with value: inf and parameters: {'model_name': 'GAIN', 'batch_size': 551, 'hint_rate': 0.8300000000000001, 'alpha': 99, 'iterations': 11135}. Best is trial 26 with value: 0.039803903949116225.
[I 2024-01-12 02:04:21,402] Trial 39 finished with value: inf and parameters: {'model_name': 'GAIN', 'batch_size': 4, 'hint_rate': 0.060000000000000005, 'alpha': 52, 'iterations': 34208}. Best is trial 26 with value: 0.039803903949116225.
srun: error: esplhpc-cp008: task 0: Killed
srun: Force Terminated StepId=598469.0
