[I 2024-04-01 20:05:09,525] Trial 120 finished with value: 44.24102829818031 and parameters: {'model_name': 'GAIN', 'batch_size': 4, 'hint_rate': 0.66, 'alpha': 24, 'iterations': 6}. Best is trial 112 with value: 31.799285554427126.
[I 2024-04-01 20:05:22,865] Trial 119 finished with value: 48.051969137614016 and parameters: {'model_name': 'GAIN', 'batch_size': 5, 'hint_rate': 0.68, 'alpha': 23, 'iterations': 7}. Best is trial 112 with value: 31.799285554427126.
[I 2024-04-01 20:05:26,626] Trial 122 finished with value: 49.410296167743596 and parameters: {'model_name': 'GAIN', 'batch_size': 4, 'hint_rate': 0.64, 'alpha': 25, 'iterations': 4}. Best is trial 112 with value: 31.799285554427126.
[I 2024-04-01 20:05:30,344] Trial 121 finished with value: 41.50112753168651 and parameters: {'model_name': 'GAIN', 'batch_size': 4, 'hint_rate': 0.63, 'alpha': 24, 'iterations': 6}. Best is trial 112 with value: 31.799285554427126.
[I 2024-04-01 20:05:35,108] Trial 123 finished with value: 51.16877290018324 and parameters: {'model_name': 'GAIN', 'batch_size': 18, 'hint_rate': 0.65, 'alpha': 26, 'iterations': 5}. Best is trial 112 with value: 31.799285554427126.
[I 2024-04-01 20:05:39,680] Trial 126 finished with value: 43.295213761353125 and parameters: {'model_name': 'GAIN', 'batch_size': 17, 'hint_rate': 0.62, 'alpha': 27, 'iterations': 3}. Best is trial 112 with value: 31.799285554427126.
[I 2024-04-01 20:05:46,258] Trial 124 finished with value: 43.858313378803025 and parameters: {'model_name': 'GAIN', 'batch_size': 4, 'hint_rate': 0.64, 'alpha': 28, 'iterations': 6}. Best is trial 112 with value: 31.799285554427126.
[I 2024-04-01 20:05:50,212] Trial 127 finished with value: 38.65384759595173 and parameters: {'model_name': 'GAIN', 'batch_size': 19, 'hint_rate': 0.61, 'alpha': 28, 'iterations': 4}. Best is trial 112 with value: 31.799285554427126.
[I 2024-04-01 20:05:58,395] Trial 128 finished with value: 46.25989165470819 and parameters: {'model_name': 'GAIN', 'batch_size': 16, 'hint_rate': 0.62, 'alpha': 29, 'iterations': 3}. Best is trial 112 with value: 31.799285554427126.
[I 2024-04-01 20:06:10,387] Trial 125 finished with value: 38.227092165262455 and parameters: {'model_name': 'GAIN', 'batch_size': 20, 'hint_rate': 0.65, 'alpha': 27, 'iterations': 4}. Best is trial 112 with value: 31.799285554427126.
[I 2024-04-01 20:06:15,476] Trial 130 finished with value: 35.86555221688649 and parameters: {'model_name': 'GAIN', 'batch_size': 18, 'hint_rate': 0.62, 'alpha': 27, 'iterations': 4}. Best is trial 112 with value: 31.799285554427126.
[I 2024-04-01 20:06:19,711] Trial 131 finished with value: 38.15318101553852 and parameters: {'model_name': 'GAIN', 'batch_size': 18, 'hint_rate': 0.61, 'alpha': 27, 'iterations': 4}. Best is trial 112 with value: 31.799285554427126.
[I 2024-04-01 20:06:33,224] Trial 129 finished with value: 37.29688937960977 and parameters: {'model_name': 'GAIN', 'batch_size': 17, 'hint_rate': 0.62, 'alpha': 27, 'iterations': 4}. Best is trial 112 with value: 31.799285554427126.
[I 2024-04-01 20:06:43,337] Trial 132 finished with value: 38.24969790702075 and parameters: {'model_name': 'GAIN', 'batch_size': 19, 'hint_rate': 0.61, 'alpha': 0, 'iterations': 4}. Best is trial 112 with value: 31.799285554427126.
[I 2024-04-01 20:07:34,471] Trial 133 finished with value: 44.16390749422699 and parameters: {'model_name': 'GAIN', 'batch_size': 18, 'hint_rate': 0.6, 'alpha': 26, 'iterations': 4}. Best is trial 112 with value: 31.799285554427126.
[I 2024-04-01 20:07:42,404] Trial 134 finished with value: 45.19083992874907 and parameters: {'model_name': 'GAIN', 'batch_size': 22, 'hint_rate': 0.61, 'alpha': 3, 'iterations': 4}. Best is trial 112 with value: 31.799285554427126.
[I 2024-04-01 20:07:44,771] Trial 139 finished with value: 33.98878612325236 and parameters: {'model_name': 'GAIN', 'batch_size': 20, 'hint_rate': 0.6, 'alpha': 0, 'iterations': 4}. Best is trial 112 with value: 31.799285554427126.
[I 2024-04-01 20:07:48,430] Trial 136 finished with value: 46.83371069586047 and parameters: {'model_name': 'GAIN', 'batch_size': 53, 'hint_rate': 0.59, 'alpha': 29, 'iterations': 3}. Best is trial 112 with value: 31.799285554427126.
[I 2024-04-01 20:07:51,400] Trial 138 finished with value: 43.43690030530944 and parameters: {'model_name': 'GAIN', 'batch_size': 18, 'hint_rate': 0.6, 'alpha': 31, 'iterations': 3}. Best is trial 112 with value: 31.799285554427126.
[I 2024-04-01 20:07:54,630] Trial 135 finished with value: 43.59718975624337 and parameters: {'model_name': 'GAIN', 'batch_size': 18, 'hint_rate': 0.5800000000000001, 'alpha': 29, 'iterations': 4}. Best is trial 112 with value: 31.799285554427126.
[I 2024-04-01 20:07:57,321] Trial 137 finished with value: 42.03164446967183 and parameters: {'model_name': 'GAIN', 'batch_size': 55, 'hint_rate': 0.8200000000000001, 'alpha': 30, 'iterations': 3}. Best is trial 112 with value: 31.799285554427126.
[I 2024-04-01 20:08:02,195] Trial 142 finished with value: 41.73176725617312 and parameters: {'model_name': 'GAIN', 'batch_size': 17, 'hint_rate': 0.5800000000000001, 'alpha': 31, 'iterations': 3}. Best is trial 112 with value: 31.799285554427126.
[I 2024-04-01 20:08:06,513] Trial 141 finished with value: 43.695297542477746 and parameters: {'model_name': 'GAIN', 'batch_size': 18, 'hint_rate': 0.5700000000000001, 'alpha': 5, 'iterations': 3}. Best is trial 112 with value: 31.799285554427126.
[I 2024-04-01 20:08:38,124] Trial 140 finished with value: 33.921838159320075 and parameters: {'model_name': 'GAIN', 'batch_size': 17, 'hint_rate': 0.59, 'alpha': 1, 'iterations': 3}. Best is trial 112 with value: 31.799285554427126.
[I 2024-04-01 20:10:58,042] Trial 18 finished with value: 79.09972374688972 and parameters: {'model_name': 'RandomForestImputer', 'max_iter': 8, 'decreasing': True, 'min_samples_split': 0.8, 'min_samples_leaf': 0.2, 'max_features': 0.9, 'warm_start': False}. Best is trial 112 with value: 31.799285554427126.
[I 2024-04-01 20:16:44,533] Trial 37 finished with value: 83.76052614338563 and parameters: {'model_name': 'IterativeImputer', 'sample_posterior': True, 'initial_strategy': 'constant', 'imputation_order': 'roman'}. Best is trial 112 with value: 31.799285554427126.
[I 2024-04-01 20:16:49,541] Trial 21 finished with value: 85.14556034589685 and parameters: {'model_name': 'IterativeImputer', 'sample_posterior': True, 'initial_strategy': 'median', 'imputation_order': 'random'}. Best is trial 112 with value: 31.799285554427126.
[I 2024-04-01 20:16:52,464] Trial 23 finished with value: 85.82439062787745 and parameters: {'model_name': 'IterativeImputer', 'sample_posterior': True, 'initial_strategy': 'mean', 'imputation_order': 'random'}. Best is trial 112 with value: 31.799285554427126.
[I 2024-04-01 20:16:58,200] Trial 31 finished with value: 82.11142248245862 and parameters: {'model_name': 'IterativeImputer', 'sample_posterior': True, 'initial_strategy': 'constant', 'imputation_order': 'descending'}. Best is trial 112 with value: 31.799285554427126.
[I 2024-04-01 20:17:01,411] Trial 59 finished with value: 80.49086642364509 and parameters: {'model_name': 'IterativeImputer', 'sample_posterior': True, 'initial_strategy': 'most_frequent', 'imputation_order': 'ascending'}. Best is trial 112 with value: 31.799285554427126.
[I 2024-04-01 20:17:04,534] Trial 40 finished with value: 78.28699764481539 and parameters: {'model_name': 'IterativeImputer', 'sample_posterior': True, 'initial_strategy': 'median', 'imputation_order': 'descending'}. Best is trial 112 with value: 31.799285554427126.
[I 2024-04-01 20:17:07,541] Trial 60 finished with value: 80.90302586040964 and parameters: {'model_name': 'IterativeImputer', 'sample_posterior': True, 'initial_strategy': 'most_frequent', 'imputation_order': 'roman'}. Best is trial 112 with value: 31.799285554427126.
[I 2024-04-01 20:17:12,615] Trial 3 finished with value: 84.51047513545504 and parameters: {'model_name': 'IterativeImputer', 'sample_posterior': True, 'initial_strategy': 'mean', 'imputation_order': 'arabic'}. Best is trial 112 with value: 31.799285554427126.
[I 2024-04-01 20:17:15,287] Trial 58 finished with value: 84.32333305242582 and parameters: {'model_name': 'IterativeImputer', 'sample_posterior': True, 'initial_strategy': 'constant', 'imputation_order': 'ascending'}. Best is trial 112 with value: 31.799285554427126.
[I 2024-04-01 20:17:18,442] Trial 51 finished with value: 81.2004000813504 and parameters: {'model_name': 'IterativeImputer', 'sample_posterior': True, 'initial_strategy': 'mean', 'imputation_order': 'arabic'}. Best is trial 112 with value: 31.799285554427126.
[I 2024-04-01 20:17:21,630] Trial 50 finished with value: 83.22363529956554 and parameters: {'model_name': 'IterativeImputer', 'sample_posterior': True, 'initial_strategy': 'constant', 'imputation_order': 'roman'}. Best is trial 112 with value: 31.799285554427126.
[I 2024-04-01 20:18:19,449] Trial 171 finished with value: 47.38996302981495 and parameters: {'model_name': 'GAIN', 'batch_size': 14, 'hint_rate': 0.39, 'alpha': 51, 'iterations': 2}. Best is trial 112 with value: 31.799285554427126.
[I 2024-04-01 20:18:25,612] Trial 174 finished with value: 41.19800107102202 and parameters: {'model_name': 'GAIN', 'batch_size': 13, 'hint_rate': 0.39, 'alpha': 35, 'iterations': 2}. Best is trial 112 with value: 31.799285554427126.
[I 2024-04-01 20:19:18,794] Trial 41 finished with value: 79.0194604311653 and parameters: {'model_name': 'RandomForestImputer', 'max_iter': 20, 'decreasing': False, 'min_samples_split': 0.9, 'min_samples_leaf': 0.9, 'max_features': 0.1, 'warm_start': False}. Best is trial 112 with value: 31.799285554427126.
[I 2024-04-01 20:19:52,134] Trial 96 finished with value: 83.78414806994074 and parameters: {'model_name': 'IterativeImputer', 'sample_posterior': True, 'initial_strategy': 'median', 'imputation_order': 'descending'}. Best is trial 112 with value: 31.799285554427126.
[I 2024-04-01 20:20:10,476] Trial 94 finished with value: 84.05656788823109 and parameters: {'model_name': 'IterativeImputer', 'sample_posterior': True, 'initial_strategy': 'median', 'imputation_order': 'ascending'}. Best is trial 112 with value: 31.799285554427126.
[I 2024-04-01 20:20:18,412] Trial 95 finished with value: 84.36047540384783 and parameters: {'model_name': 'IterativeImputer', 'sample_posterior': True, 'initial_strategy': 'mean', 'imputation_order': 'ascending'}. Best is trial 112 with value: 31.799285554427126.
[I 2024-04-01 20:20:21,956] Trial 99 finished with value: 82.21422560877657 and parameters: {'model_name': 'IterativeImputer', 'sample_posterior': True, 'initial_strategy': 'mean', 'imputation_order': 'arabic'}. Best is trial 112 with value: 31.799285554427126.
[I 2024-04-01 20:20:37,180] Trial 97 finished with value: 84.85929872728786 and parameters: {'model_name': 'IterativeImputer', 'sample_posterior': True, 'initial_strategy': 'mean', 'imputation_order': 'ascending'}. Best is trial 112 with value: 31.799285554427126.
[I 2024-04-01 20:20:40,559] Trial 98 finished with value: 84.22336317455348 and parameters: {'model_name': 'IterativeImputer', 'sample_posterior': True, 'initial_strategy': 'median', 'imputation_order': 'arabic'}. Best is trial 112 with value: 31.799285554427126.
[I 2024-04-01 20:21:33,779] Trial 182 finished with value: 45.268263638547964 and parameters: {'model_name': 'GAIN', 'batch_size': 25, 'hint_rate': 0.54, 'alpha': 11, 'iterations': 2}. Best is trial 112 with value: 31.799285554427126.
[I 2024-04-01 20:22:26,816] Trial 184 finished with value: 45.12803759017476 and parameters: {'model_name': 'GAIN', 'batch_size': 13, 'hint_rate': 0.54, 'alpha': 37, 'iterations': 2}. Best is trial 112 with value: 31.799285554427126.
[I 2024-04-01 20:23:10,011] Trial 147 finished with value: 83.81063262161084 and parameters: {'model_name': 'IterativeImputer', 'sample_posterior': True, 'initial_strategy': 'mean', 'imputation_order': 'roman'}. Best is trial 112 with value: 31.799285554427126.
[I 2024-04-01 20:24:37,111] Trial 162 finished with value: 86.87056449325215 and parameters: {'model_name': 'IterativeImputer', 'sample_posterior': True, 'initial_strategy': 'mean', 'imputation_order': 'roman'}. Best is trial 112 with value: 31.799285554427126.
[I 2024-04-01 20:25:06,978] Trial 42 finished with value: 71.16035785565884 and parameters: {'model_name': 'GAIN', 'batch_size': 101, 'hint_rate': 0.98, 'alpha': 42, 'iterations': 467}. Best is trial 112 with value: 31.799285554427126.
[I 2024-04-01 20:26:03,654] Trial 188 finished with value: 51.96546546762871 and parameters: {'model_name': 'GAIN', 'batch_size': 24, 'hint_rate': 0.42000000000000004, 'alpha': 34, 'iterations': 21}. Best is trial 112 with value: 31.799285554427126.
[I 2024-04-01 20:26:36,775] Trial 189 finished with value: 45.65043804096329 and parameters: {'model_name': 'GAIN', 'batch_size': 7, 'hint_rate': 0.55, 'alpha': 82, 'iterations': 2}. Best is trial 112 with value: 31.799285554427126.
[I 2024-04-01 20:34:34,441] Trial 35 finished with value: 70.44401482576842 and parameters: {'model_name': 'GAIN', 'batch_size': 2, 'hint_rate': 0.68, 'alpha': 0, 'iterations': 884}. Best is trial 112 with value: 31.799285554427126.
[I 2024-04-01 20:43:52,161] Trial 144 finished with value: 79.05951896330538 and parameters: {'model_name': 'RandomForestImputer', 'max_iter': 46, 'decreasing': False, 'min_samples_split': 0.6000000000000001, 'min_samples_leaf': 0.5, 'max_features': 0.1, 'warm_start': False}. Best is trial 112 with value: 31.799285554427126.
[I 2024-04-01 20:49:01,208] Trial 192 finished with value: 71.79653259608277 and parameters: {'model_name': 'GAIN', 'batch_size': 23, 'hint_rate': 0.09, 'alpha': 14, 'iterations': 158}. Best is trial 112 with value: 31.799285554427126.
[I 2024-04-01 20:50:04,317] Trial 193 finished with value: 46.576331994478224 and parameters: {'model_name': 'GAIN', 'batch_size': 14, 'hint_rate': 0.7000000000000001, 'alpha': 8, 'iterations': 19}. Best is trial 112 with value: 31.799285554427126.
[I 2024-04-01 20:50:51,624] Trial 194 finished with value: 43.48977530256107 and parameters: {'model_name': 'GAIN', 'batch_size': 24, 'hint_rate': 0.45, 'alpha': 20, 'iterations': 1}. Best is trial 112 with value: 31.799285554427126.
[I 2024-04-01 20:51:44,298] Trial 195 finished with value: 48.942931215773854 and parameters: {'model_name': 'GAIN', 'batch_size': 11, 'hint_rate': 0.77, 'alpha': 3, 'iterations': 2}. Best is trial 112 with value: 31.799285554427126.
[I 2024-04-01 20:52:12,751] Trial 62 finished with value: 79.04009062084853 and parameters: {'model_name': 'RandomForestImputer', 'max_iter': 68, 'decreasing': False, 'min_samples_split': 0.2, 'min_samples_leaf': 0.7000000000000001, 'max_features': 0.6, 'warm_start': False}. Best is trial 112 with value: 31.799285554427126.
[I 2024-04-01 20:52:46,937] Trial 197 finished with value: 43.331916552078425 and parameters: {'model_name': 'GAIN', 'batch_size': 26, 'hint_rate': 0.7000000000000001, 'alpha': 65, 'iterations': 10}. Best is trial 112 with value: 31.799285554427126.
[I 2024-04-01 20:53:08,313] Trial 196 finished with value: 48.0803487215529 and parameters: {'model_name': 'GAIN', 'batch_size': 26, 'hint_rate': 0.7000000000000001, 'alpha': 50, 'iterations': 10}. Best is trial 112 with value: 31.799285554427126.
[I 2024-04-01 20:53:20,875] Trial 198 finished with value: 40.45970777167677 and parameters: {'model_name': 'GAIN', 'batch_size': 15, 'hint_rate': 0.5700000000000001, 'alpha': 0, 'iterations': 5}. Best is trial 112 with value: 31.799285554427126.
[I 2024-04-01 20:53:38,120] Trial 163 finished with value: 79.0622007187117 and parameters: {'model_name': 'RandomForestImputer', 'max_iter': 56, 'decreasing': False, 'min_samples_split': 0.5, 'min_samples_leaf': 0.5, 'max_features': 0.1, 'warm_start': False}. Best is trial 112 with value: 31.799285554427126.
[I 2024-04-01 20:54:25,732] Trial 199 finished with value: 39.905407177683074 and parameters: {'model_name': 'GAIN', 'batch_size': 22, 'hint_rate': 0.56, 'alpha': 4, 'iterations': 5}. Best is trial 112 with value: 31.799285554427126.
[I 2024-04-01 20:55:32,787] Trial 170 finished with value: 79.03266666046692 and parameters: {'model_name': 'RandomForestImputer', 'max_iter': 50, 'decreasing': False, 'min_samples_split': 0.5, 'min_samples_leaf': 0.5, 'max_features': 0.1, 'warm_start': False}. Best is trial 112 with value: 31.799285554427126.
[I 2024-04-01 20:55:52,406] Trial 2 finished with value: 79.05426086104953 and parameters: {'model_name': 'RandomForestImputer', 'max_iter': 73, 'decreasing': False, 'min_samples_split': 0.4, 'min_samples_leaf': 0.6, 'max_features': 0.30000000000000004, 'warm_start': False}. Best is trial 112 with value: 31.799285554427126.
[I 2024-04-01 20:57:17,549] Trial 146 finished with value: 79.04693209480232 and parameters: {'model_name': 'RandomForestImputer', 'max_iter': 63, 'decreasing': False, 'min_samples_split': 0.6000000000000001, 'min_samples_leaf': 0.5, 'max_features': 0.1, 'warm_start': False}. Best is trial 112 with value: 31.799285554427126.
[I 2024-04-01 21:01:45,183] Trial 17 finished with value: 79.07450717216538 and parameters: {'model_name': 'RandomForestImputer', 'max_iter': 85, 'decreasing': False, 'min_samples_split': 0.30000000000000004, 'min_samples_leaf': 0.2, 'max_features': 0.6, 'warm_start': False}. Best is trial 112 with value: 31.799285554427126.
[I 2024-04-01 21:02:05,485] Trial 145 finished with value: 79.06946737153856 and parameters: {'model_name': 'RandomForestImputer', 'max_iter': 73, 'decreasing': True, 'min_samples_split': 0.6000000000000001, 'min_samples_leaf': 0.5, 'max_features': 0.1, 'warm_start': False}. Best is trial 112 with value: 31.799285554427126.
[I 2024-04-01 21:05:59,401] Trial 167 finished with value: 79.04649827811234 and parameters: {'model_name': 'RandomForestImputer', 'max_iter': 50, 'decreasing': False, 'min_samples_split': 0.5, 'min_samples_leaf': 0.5, 'max_features': 0.1, 'warm_start': False}. Best is trial 112 with value: 31.799285554427126.
[I 2024-04-01 21:06:06,810] Trial 161 finished with value: 79.047825336895 and parameters: {'model_name': 'RandomForestImputer', 'max_iter': 80, 'decreasing': True, 'min_samples_split': 0.7000000000000001, 'min_samples_leaf': 0.5, 'max_features': 0.1, 'warm_start': False}. Best is trial 112 with value: 31.799285554427126.
[I 2024-04-01 21:07:49,566] Trial 155 finished with value: 79.06059196717885 and parameters: {'model_name': 'RandomForestImputer', 'max_iter': 88, 'decreasing': False, 'min_samples_split': 0.6000000000000001, 'min_samples_leaf': 0.5, 'max_features': 0.1, 'warm_start': False}. Best is trial 112 with value: 31.799285554427126.
[I 2024-04-01 21:08:03,988] Trial 181 finished with value: 79.04283862475893 and parameters: {'model_name': 'RandomForestImputer', 'max_iter': 53, 'decreasing': False, 'min_samples_split': 0.5, 'min_samples_leaf': 0.5, 'max_features': 0.7000000000000001, 'warm_start': False}. Best is trial 112 with value: 31.799285554427126.
[I 2024-04-01 21:08:53,169] Trial 150 finished with value: 79.07307907093241 and parameters: {'model_name': 'RandomForestImputer', 'max_iter': 89, 'decreasing': True, 'min_samples_split': 0.6000000000000001, 'min_samples_leaf': 0.5, 'max_features': 0.1, 'warm_start': False}. Best is trial 112 with value: 31.799285554427126.
[I 2024-04-01 21:09:00,118] Trial 187 finished with value: 79.04001071828802 and parameters: {'model_name': 'RandomForestImputer', 'max_iter': 51, 'decreasing': False, 'min_samples_split': 0.4, 'min_samples_leaf': 0.5, 'max_features': 0.7000000000000001, 'warm_start': False}. Best is trial 112 with value: 31.799285554427126.
[I 2024-04-01 21:09:23,059] Trial 168 finished with value: 79.05258280936818 and parameters: {'model_name': 'RandomForestImputer', 'max_iter': 65, 'decreasing': False, 'min_samples_split': 0.5, 'min_samples_leaf': 0.6, 'max_features': 0.1, 'warm_start': False}. Best is trial 112 with value: 31.799285554427126.
[I 2024-04-01 21:09:56,930] Trial 151 finished with value: 79.05020598395409 and parameters: {'model_name': 'RandomForestImputer', 'max_iter': 86, 'decreasing': True, 'min_samples_split': 0.6000000000000001, 'min_samples_leaf': 0.5, 'max_features': 0.9, 'warm_start': False}. Best is trial 112 with value: 31.799285554427126.
[I 2024-04-01 21:11:46,540] Trial 149 finished with value: 79.05082165283582 and parameters: {'model_name': 'RandomForestImputer', 'max_iter': 87, 'decreasing': False, 'min_samples_split': 0.6000000000000001, 'min_samples_leaf': 0.5, 'max_features': 0.1, 'warm_start': False}. Best is trial 112 with value: 31.799285554427126.
[I 2024-04-01 21:12:53,702] Trial 143 finished with value: 79.06445436152221 and parameters: {'model_name': 'RandomForestImputer', 'max_iter': 87, 'decreasing': True, 'min_samples_split': 0.6000000000000001, 'min_samples_leaf': 0.4, 'max_features': 0.1, 'warm_start': False}. Best is trial 112 with value: 31.799285554427126.
[I 2024-04-01 21:13:29,909] Trial 160 finished with value: 79.04287612848479 and parameters: {'model_name': 'RandomForestImputer', 'max_iter': 88, 'decreasing': False, 'min_samples_split': 0.6000000000000001, 'min_samples_leaf': 0.5, 'max_features': 0.1, 'warm_start': False}. Best is trial 112 with value: 31.799285554427126.
[I 2024-04-01 21:14:07,076] Trial 165 finished with value: 79.03025017891828 and parameters: {'model_name': 'RandomForestImputer', 'max_iter': 68, 'decreasing': False, 'min_samples_split': 0.5, 'min_samples_leaf': 0.5, 'max_features': 0.1, 'warm_start': False}. Best is trial 112 with value: 31.799285554427126.
[I 2024-04-01 21:14:10,792] Trial 152 finished with value: 79.06233487310044 and parameters: {'model_name': 'RandomForestImputer', 'max_iter': 93, 'decreasing': False, 'min_samples_split': 0.6000000000000001, 'min_samples_leaf': 0.5, 'max_features': 0.1, 'warm_start': False}. Best is trial 112 with value: 31.799285554427126.
