Run: 7
/cm/local/apps/slurm/var/spool/job567027/slurm_script: line 23: /common/ketrong/minconda3/etc/profile.d/conda.sh: No such file or directory
/cm/local/apps/slurm/var/spool/job567027/slurm_script: line 26: $'\nconda create --name tpot2devenv -c conda-forge python=3.10\n': command not found
/cm/local/apps/slurm/var/spool/job567027/slurm_script: line 31: $'\npip install -r requirements.txt\n': command not found
RunStart
2023-12-26 14:17:29.810534: I tensorflow/core/util/port.cc:113] oneDNN custom operations are on. You may see slightly different numerical results due to floating-point round-off errors from different computation orders. To turn them off, set the environment variable `TF_ENABLE_ONEDNN_OPTS=0`.
2023-12-26 14:17:29.845229: E external/local_xla/xla/stream_executor/cuda/cuda_dnn.cc:9261] Unable to register cuDNN factory: Attempting to register factory for plugin cuDNN when one has already been registered
2023-12-26 14:17:29.845252: E external/local_xla/xla/stream_executor/cuda/cuda_fft.cc:607] Unable to register cuFFT factory: Attempting to register factory for plugin cuFFT when one has already been registered
2023-12-26 14:17:29.846357: E external/local_xla/xla/stream_executor/cuda/cuda_blas.cc:1515] Unable to register cuBLAS factory: Attempting to register factory for plugin cuBLAS when one has already been registered
2023-12-26 14:17:29.852015: I tensorflow/core/platform/cpu_feature_guard.cc:182] This TensorFlow binary is optimized to use available CPU instructions in performance-critical operations.
To enable the following instructions: AVX2 AVX512F AVX512_VNNI FMA, in other operations, rebuild TensorFlow with the appropriate compiler flags.
2023-12-26 14:17:31.253179: W tensorflow/compiler/tf2tensorrt/utils/py_utils.cc:38] TF-TRT Warning: Could not find TensorRT
WARNING:tensorflow:From /home/ketrong/miniconda3/envs/tpot2devenv/lib/python3.10/site-packages/tensorflow/python/compat/v2_compat.py:108: disable_resource_variables (from tensorflow.python.ops.variable_scope) is deprecated and will be removed in a future version.
Instructions for updating:
non-resource variables are not supported in the long term
starting loops
working on 
logs/2076/tpot2_base_normal_MAR_0.1
0.8030552864074707
loading data
logs/2076/tpot2_base_normal_MAR_0.1/data/2076_True.pkl
running experiment 1/3 - Does large hyperparameter space improve reconstruction accuracy over simple
[I 2023-12-26 14:17:47,410] A new study created in memory with name: no-name-f591a9e3-e99d-44bd-bdb7-4767a5a60dc1
[I 2023-12-26 14:17:49,993] Trial 1 finished with value: 0.394221832884478 and parameters: {'model_name': 'SimpleImputer', 'strategy': 'constant'}. Best is trial 1 with value: 0.394221832884478.
[I 2023-12-26 14:17:50,297] Trial 14 finished with value: 0.394221832884478 and parameters: {'model_name': 'SimpleImputer', 'strategy': 'constant'}. Best is trial 1 with value: 0.394221832884478.
[I 2023-12-26 14:17:50,633] Trial 6 finished with value: 0.394221832884478 and parameters: {'model_name': 'SimpleImputer', 'strategy': 'constant'}. Best is trial 1 with value: 0.394221832884478.
[I 2023-12-26 14:17:50,891] Trial 5 finished with value: 0.394221832884478 and parameters: {'model_name': 'SimpleImputer', 'strategy': 'constant'}. Best is trial 1 with value: 0.394221832884478.
[I 2023-12-26 14:17:51,319] Trial 7 finished with value: 0.394221832884478 and parameters: {'model_name': 'SimpleImputer', 'strategy': 'constant'}. Best is trial 1 with value: 0.394221832884478.
[I 2023-12-26 14:17:51,918] Trial 25 finished with value: 0.394221832884478 and parameters: {'model_name': 'SimpleImputer', 'strategy': 'constant'}. Best is trial 1 with value: 0.394221832884478.
[I 2023-12-26 14:17:52,435] Trial 11 finished with value: 0.34377440611189525 and parameters: {'model_name': 'SimpleImputer', 'strategy': 'mean'}. Best is trial 11 with value: 0.34377440611189525.
[I 2023-12-26 14:17:52,705] Trial 0 finished with value: 0.34377440611189525 and parameters: {'model_name': 'SimpleImputer', 'strategy': 'mean'}. Best is trial 11 with value: 0.34377440611189525.
[I 2023-12-26 14:17:52,909] Trial 2 finished with value: 0.34377440611189525 and parameters: {'model_name': 'SimpleImputer', 'strategy': 'mean'}. Best is trial 11 with value: 0.34377440611189525.
[I 2023-12-26 14:17:53,118] Trial 15 finished with value: 0.394221832884478 and parameters: {'model_name': 'SimpleImputer', 'strategy': 'constant'}. Best is trial 11 with value: 0.34377440611189525.
[I 2023-12-26 14:17:53,392] Trial 13 finished with value: 0.34377440611189525 and parameters: {'model_name': 'SimpleImputer', 'strategy': 'mean'}. Best is trial 11 with value: 0.34377440611189525.
[I 2023-12-26 14:17:53,700] Trial 29 finished with value: 0.34377440611189525 and parameters: {'model_name': 'SimpleImputer', 'strategy': 'mean'}. Best is trial 11 with value: 0.34377440611189525.
[I 2023-12-26 14:17:53,894] Trial 28 finished with value: 0.394221832884478 and parameters: {'model_name': 'SimpleImputer', 'strategy': 'constant'}. Best is trial 11 with value: 0.34377440611189525.
[I 2023-12-26 14:17:54,101] Trial 39 finished with value: 0.394221832884478 and parameters: {'model_name': 'SimpleImputer', 'strategy': 'constant'}. Best is trial 11 with value: 0.34377440611189525.
[I 2023-12-26 14:17:54,385] Trial 9 finished with value: 0.34377440611189525 and parameters: {'model_name': 'SimpleImputer', 'strategy': 'mean'}. Best is trial 11 with value: 0.34377440611189525.
[I 2023-12-26 14:17:54,805] Trial 42 finished with value: 0.394221832884478 and parameters: {'model_name': 'SimpleImputer', 'strategy': 'constant'}. Best is trial 11 with value: 0.34377440611189525.
[I 2023-12-26 14:17:55,108] Trial 41 finished with value: 0.394221832884478 and parameters: {'model_name': 'SimpleImputer', 'strategy': 'constant'}. Best is trial 11 with value: 0.34377440611189525.
[I 2023-12-26 14:17:55,540] Trial 31 finished with value: 0.34377440611189525 and parameters: {'model_name': 'SimpleImputer', 'strategy': 'mean'}. Best is trial 11 with value: 0.34377440611189525.
[I 2023-12-26 14:17:55,822] Trial 37 finished with value: 0.34377440611189525 and parameters: {'model_name': 'SimpleImputer', 'strategy': 'mean'}. Best is trial 11 with value: 0.34377440611189525.
[I 2023-12-26 14:17:56,258] Trial 30 finished with value: 0.34377440611189525 and parameters: {'model_name': 'SimpleImputer', 'strategy': 'mean'}. Best is trial 11 with value: 0.34377440611189525.
[I 2023-12-26 14:17:56,565] Trial 44 finished with value: 0.34377440611189525 and parameters: {'model_name': 'SimpleImputer', 'strategy': 'mean'}. Best is trial 11 with value: 0.34377440611189525.
[I 2023-12-26 14:17:56,734] Trial 47 finished with value: 0.34377440611189525 and parameters: {'model_name': 'SimpleImputer', 'strategy': 'mean'}. Best is trial 11 with value: 0.34377440611189525.
[I 2023-12-26 14:17:57,042] Trial 45 finished with value: 0.34377440611189525 and parameters: {'model_name': 'SimpleImputer', 'strategy': 'mean'}. Best is trial 11 with value: 0.34377440611189525.
[I 2023-12-26 14:17:57,255] Trial 43 finished with value: 0.34377440611189525 and parameters: {'model_name': 'SimpleImputer', 'strategy': 'mean'}. Best is trial 11 with value: 0.34377440611189525.
[I 2023-12-26 14:17:57,669] Trial 18 finished with value: 0.394221832884478 and parameters: {'model_name': 'SimpleImputer', 'strategy': 'median'}. Best is trial 11 with value: 0.34377440611189525.
[I 2023-12-26 14:17:57,997] Trial 23 finished with value: 0.394221832884478 and parameters: {'model_name': 'SimpleImputer', 'strategy': 'median'}. Best is trial 11 with value: 0.34377440611189525.
[I 2023-12-26 14:17:58,322] Trial 3 finished with value: 0.394221832884478 and parameters: {'model_name': 'SimpleImputer', 'strategy': 'median'}. Best is trial 11 with value: 0.34377440611189525.
[I 2023-12-26 14:17:58,584] Trial 12 finished with value: 0.394221832884478 and parameters: {'model_name': 'SimpleImputer', 'strategy': 'median'}. Best is trial 11 with value: 0.34377440611189525.
[I 2023-12-26 14:17:58,832] Trial 26 finished with value: 0.394221832884478 and parameters: {'model_name': 'SimpleImputer', 'strategy': 'median'}. Best is trial 11 with value: 0.34377440611189525.
[I 2023-12-26 14:17:59,050] Trial 4 finished with value: 0.394221832884478 and parameters: {'model_name': 'SimpleImputer', 'strategy': 'median'}. Best is trial 11 with value: 0.34377440611189525.
[I 2023-12-26 14:17:59,222] Trial 10 finished with value: 0.394221832884478 and parameters: {'model_name': 'SimpleImputer', 'strategy': 'median'}. Best is trial 11 with value: 0.34377440611189525.
[I 2023-12-26 14:17:59,762] Trial 48 finished with value: 0.394221832884478 and parameters: {'model_name': 'SimpleImputer', 'strategy': 'constant'}. Best is trial 11 with value: 0.34377440611189525.
[I 2023-12-26 14:17:59,946] Trial 27 finished with value: 0.394221832884478 and parameters: {'model_name': 'SimpleImputer', 'strategy': 'median'}. Best is trial 11 with value: 0.34377440611189525.
[I 2023-12-26 14:18:00,200] Trial 34 finished with value: 0.394221832884478 and parameters: {'model_name': 'SimpleImputer', 'strategy': 'median'}. Best is trial 11 with value: 0.34377440611189525.
[I 2023-12-26 14:18:00,527] Trial 21 finished with value: 0.394221832884478 and parameters: {'model_name': 'SimpleImputer', 'strategy': 'median'}. Best is trial 11 with value: 0.34377440611189525.
[I 2023-12-26 14:18:00,790] Trial 52 finished with value: 0.394221832884478 and parameters: {'model_name': 'SimpleImputer', 'strategy': 'constant'}. Best is trial 11 with value: 0.34377440611189525.
[I 2023-12-26 14:18:01,093] Trial 17 finished with value: 0.394221832884478 and parameters: {'model_name': 'SimpleImputer', 'strategy': 'median'}. Best is trial 11 with value: 0.34377440611189525.
[I 2023-12-26 14:18:01,348] Trial 20 finished with value: 0.394221832884478 and parameters: {'model_name': 'SimpleImputer', 'strategy': 'median'}. Best is trial 11 with value: 0.34377440611189525.
[I 2023-12-26 14:18:01,525] Trial 40 finished with value: 0.394221832884478 and parameters: {'model_name': 'SimpleImputer', 'strategy': 'median'}. Best is trial 11 with value: 0.34377440611189525.
[I 2023-12-26 14:18:01,954] Trial 33 finished with value: 0.394221832884478 and parameters: {'model_name': 'SimpleImputer', 'strategy': 'median'}. Best is trial 11 with value: 0.34377440611189525.
[I 2023-12-26 14:18:02,217] Trial 38 finished with value: 0.394221832884478 and parameters: {'model_name': 'SimpleImputer', 'strategy': 'median'}. Best is trial 11 with value: 0.34377440611189525.
[I 2023-12-26 14:18:02,670] Trial 55 finished with value: 0.394221832884478 and parameters: {'model_name': 'SimpleImputer', 'strategy': 'constant'}. Best is trial 11 with value: 0.34377440611189525.
[I 2023-12-26 14:18:03,211] Trial 49 finished with value: 0.34377440611189525 and parameters: {'model_name': 'SimpleImputer', 'strategy': 'mean'}. Best is trial 11 with value: 0.34377440611189525.
[I 2023-12-26 14:18:04,123] Trial 57 finished with value: 0.34377440611189525 and parameters: {'model_name': 'SimpleImputer', 'strategy': 'mean'}. Best is trial 11 with value: 0.34377440611189525.
[I 2023-12-26 14:18:04,803] Trial 58 finished with value: 0.34377440611189525 and parameters: {'model_name': 'SimpleImputer', 'strategy': 'mean'}. Best is trial 11 with value: 0.34377440611189525.
[I 2023-12-26 14:18:05,176] Trial 50 finished with value: 0.394221832884478 and parameters: {'model_name': 'SimpleImputer', 'strategy': 'median'}. Best is trial 11 with value: 0.34377440611189525.
[I 2023-12-26 14:18:06,371] Trial 61 finished with value: 0.394221832884478 and parameters: {'model_name': 'SimpleImputer', 'strategy': 'median'}. Best is trial 11 with value: 0.34377440611189525.
[I 2023-12-26 14:18:06,674] Trial 63 finished with value: 0.394221832884478 and parameters: {'model_name': 'SimpleImputer', 'strategy': 'median'}. Best is trial 11 with value: 0.34377440611189525.
[I 2023-12-26 14:18:06,882] Trial 60 finished with value: 0.394221832884478 and parameters: {'model_name': 'SimpleImputer', 'strategy': 'median'}. Best is trial 11 with value: 0.34377440611189525.
[I 2023-12-26 14:18:07,187] Trial 62 finished with value: 0.394221832884478 and parameters: {'model_name': 'SimpleImputer', 'strategy': 'median'}. Best is trial 11 with value: 0.34377440611189525.
[I 2023-12-26 14:18:07,556] Trial 66 finished with value: 0.394221832884478 and parameters: {'model_name': 'SimpleImputer', 'strategy': 'median'}. Best is trial 11 with value: 0.34377440611189525.
[I 2023-12-26 14:18:07,980] Trial 65 finished with value: 0.394221832884478 and parameters: {'model_name': 'SimpleImputer', 'strategy': 'median'}. Best is trial 11 with value: 0.34377440611189525.
[I 2023-12-26 14:18:08,332] Trial 71 finished with value: 0.394221832884478 and parameters: {'model_name': 'SimpleImputer', 'strategy': 'median'}. Best is trial 11 with value: 0.34377440611189525.
[I 2023-12-26 14:18:08,768] Trial 69 finished with value: 0.394221832884478 and parameters: {'model_name': 'SimpleImputer', 'strategy': 'median'}. Best is trial 11 with value: 0.34377440611189525.
[I 2023-12-26 14:18:09,607] Trial 70 finished with value: 0.394221832884478 and parameters: {'model_name': 'SimpleImputer', 'strategy': 'median'}. Best is trial 11 with value: 0.34377440611189525.
[I 2023-12-26 14:18:19,468] Trial 22 finished with value: 0.394221832884478 and parameters: {'model_name': 'SimpleImputer', 'strategy': 'most_frequent'}. Best is trial 11 with value: 0.34377440611189525.
[I 2023-12-26 14:18:20,507] Trial 35 finished with value: 0.394221832884478 and parameters: {'model_name': 'SimpleImputer', 'strategy': 'most_frequent'}. Best is trial 11 with value: 0.34377440611189525.
[I 2023-12-26 14:18:20,784] Trial 8 finished with value: 0.394221832884478 and parameters: {'model_name': 'SimpleImputer', 'strategy': 'most_frequent'}. Best is trial 11 with value: 0.34377440611189525.
[I 2023-12-26 14:18:21,317] Trial 24 finished with value: 0.394221832884478 and parameters: {'model_name': 'SimpleImputer', 'strategy': 'most_frequent'}. Best is trial 11 with value: 0.34377440611189525.
[I 2023-12-26 14:18:21,981] Trial 19 finished with value: 0.394221832884478 and parameters: {'model_name': 'SimpleImputer', 'strategy': 'most_frequent'}. Best is trial 11 with value: 0.34377440611189525.
[I 2023-12-26 14:18:22,239] Trial 36 finished with value: 0.394221832884478 and parameters: {'model_name': 'SimpleImputer', 'strategy': 'most_frequent'}. Best is trial 11 with value: 0.34377440611189525.
[I 2023-12-26 14:18:22,498] Trial 16 finished with value: 0.394221832884478 and parameters: {'model_name': 'SimpleImputer', 'strategy': 'most_frequent'}. Best is trial 11 with value: 0.34377440611189525.
[I 2023-12-26 14:18:23,035] Trial 32 finished with value: 0.394221832884478 and parameters: {'model_name': 'SimpleImputer', 'strategy': 'most_frequent'}. Best is trial 11 with value: 0.34377440611189525.
[I 2023-12-26 14:18:24,849] Trial 46 finished with value: 0.394221832884478 and parameters: {'model_name': 'SimpleImputer', 'strategy': 'most_frequent'}. Best is trial 11 with value: 0.34377440611189525.
[I 2023-12-26 14:18:25,105] Trial 51 finished with value: 0.394221832884478 and parameters: {'model_name': 'SimpleImputer', 'strategy': 'most_frequent'}. Best is trial 11 with value: 0.34377440611189525.
[I 2023-12-26 14:18:25,421] Trial 54 finished with value: 0.394221832884478 and parameters: {'model_name': 'SimpleImputer', 'strategy': 'most_frequent'}. Best is trial 11 with value: 0.34377440611189525.
[I 2023-12-26 14:18:25,631] Trial 104 finished with value: 0.34377440611189525 and parameters: {'model_name': 'SimpleImputer', 'strategy': 'mean'}. Best is trial 11 with value: 0.34377440611189525.
[I 2023-12-26 14:18:26,842] Trial 56 finished with value: 0.394221832884478 and parameters: {'model_name': 'SimpleImputer', 'strategy': 'most_frequent'}. Best is trial 11 with value: 0.34377440611189525.
[I 2023-12-26 14:18:27,279] Trial 83 finished with value: 0.394221832884478 and parameters: {'model_name': 'SimpleImputer', 'strategy': 'most_frequent'}. Best is trial 11 with value: 0.34377440611189525.
[I 2023-12-26 14:18:27,472] Trial 59 finished with value: 0.394221832884478 and parameters: {'model_name': 'SimpleImputer', 'strategy': 'most_frequent'}. Best is trial 11 with value: 0.34377440611189525.
[I 2023-12-26 14:18:27,754] Trial 105 finished with value: 0.34377440611189525 and parameters: {'model_name': 'SimpleImputer', 'strategy': 'mean'}. Best is trial 11 with value: 0.34377440611189525.
[I 2023-12-26 14:18:27,997] Trial 106 finished with value: 0.34377440611189525 and parameters: {'model_name': 'SimpleImputer', 'strategy': 'mean'}. Best is trial 11 with value: 0.34377440611189525.
[I 2023-12-26 14:18:28,355] Trial 68 finished with value: 0.394221832884478 and parameters: {'model_name': 'SimpleImputer', 'strategy': 'most_frequent'}. Best is trial 11 with value: 0.34377440611189525.
[I 2023-12-26 14:18:28,598] Trial 108 finished with value: 0.34377440611189525 and parameters: {'model_name': 'SimpleImputer', 'strategy': 'mean'}. Best is trial 11 with value: 0.34377440611189525.
[I 2023-12-26 14:18:28,871] Trial 80 finished with value: 0.394221832884478 and parameters: {'model_name': 'SimpleImputer', 'strategy': 'most_frequent'}. Best is trial 11 with value: 0.34377440611189525.
[I 2023-12-26 14:18:29,089] Trial 67 finished with value: 0.394221832884478 and parameters: {'model_name': 'SimpleImputer', 'strategy': 'most_frequent'}. Best is trial 11 with value: 0.34377440611189525.
[I 2023-12-26 14:18:29,426] Trial 75 finished with value: 0.394221832884478 and parameters: {'model_name': 'SimpleImputer', 'strategy': 'most_frequent'}. Best is trial 11 with value: 0.34377440611189525.
[I 2023-12-26 14:18:29,711] Trial 110 finished with value: 0.34377440611189525 and parameters: {'model_name': 'SimpleImputer', 'strategy': 'mean'}. Best is trial 11 with value: 0.34377440611189525.
[I 2023-12-26 14:18:30,086] Trial 107 finished with value: 0.34377440611189525 and parameters: {'model_name': 'SimpleImputer', 'strategy': 'mean'}. Best is trial 11 with value: 0.34377440611189525.
[I 2023-12-26 14:18:30,378] Trial 87 finished with value: 0.394221832884478 and parameters: {'model_name': 'SimpleImputer', 'strategy': 'most_frequent'}. Best is trial 11 with value: 0.34377440611189525.
[I 2023-12-26 14:18:30,728] Trial 72 finished with value: 0.394221832884478 and parameters: {'model_name': 'SimpleImputer', 'strategy': 'most_frequent'}. Best is trial 11 with value: 0.34377440611189525.
[I 2023-12-26 14:18:31,077] Trial 73 finished with value: 0.394221832884478 and parameters: {'model_name': 'SimpleImputer', 'strategy': 'most_frequent'}. Best is trial 11 with value: 0.34377440611189525.
[I 2023-12-26 14:18:31,388] Trial 53 finished with value: 0.394221832884478 and parameters: {'model_name': 'SimpleImputer', 'strategy': 'most_frequent'}. Best is trial 11 with value: 0.34377440611189525.
[I 2023-12-26 14:18:31,571] Trial 76 finished with value: 0.394221832884478 and parameters: {'model_name': 'SimpleImputer', 'strategy': 'most_frequent'}. Best is trial 11 with value: 0.34377440611189525.
[I 2023-12-26 14:18:31,817] Trial 89 finished with value: 0.394221832884478 and parameters: {'model_name': 'SimpleImputer', 'strategy': 'most_frequent'}. Best is trial 11 with value: 0.34377440611189525.
[I 2023-12-26 14:18:32,067] Trial 109 finished with value: 0.34377440611189525 and parameters: {'model_name': 'SimpleImputer', 'strategy': 'mean'}. Best is trial 11 with value: 0.34377440611189525.
[I 2023-12-26 14:18:32,537] Trial 82 finished with value: 0.394221832884478 and parameters: {'model_name': 'SimpleImputer', 'strategy': 'most_frequent'}. Best is trial 11 with value: 0.34377440611189525.
[I 2023-12-26 14:18:32,877] Trial 86 finished with value: 0.394221832884478 and parameters: {'model_name': 'SimpleImputer', 'strategy': 'most_frequent'}. Best is trial 11 with value: 0.34377440611189525.
[I 2023-12-26 14:18:33,179] Trial 64 finished with value: 0.394221832884478 and parameters: {'model_name': 'SimpleImputer', 'strategy': 'most_frequent'}. Best is trial 11 with value: 0.34377440611189525.
[I 2023-12-26 14:18:33,612] Trial 77 finished with value: 0.394221832884478 and parameters: {'model_name': 'SimpleImputer', 'strategy': 'most_frequent'}. Best is trial 11 with value: 0.34377440611189525.
[I 2023-12-26 14:18:33,878] Trial 79 finished with value: 0.394221832884478 and parameters: {'model_name': 'SimpleImputer', 'strategy': 'most_frequent'}. Best is trial 11 with value: 0.34377440611189525.
[I 2023-12-26 14:18:34,067] Trial 78 finished with value: 0.394221832884478 and parameters: {'model_name': 'SimpleImputer', 'strategy': 'most_frequent'}. Best is trial 11 with value: 0.34377440611189525.
[I 2023-12-26 14:18:34,374] Trial 88 finished with value: 0.394221832884478 and parameters: {'model_name': 'SimpleImputer', 'strategy': 'most_frequent'}. Best is trial 11 with value: 0.34377440611189525.
[I 2023-12-26 14:18:34,610] Trial 84 finished with value: 0.394221832884478 and parameters: {'model_name': 'SimpleImputer', 'strategy': 'most_frequent'}. Best is trial 11 with value: 0.34377440611189525.
[I 2023-12-26 14:18:35,033] Trial 74 finished with value: 0.394221832884478 and parameters: {'model_name': 'SimpleImputer', 'strategy': 'most_frequent'}. Best is trial 11 with value: 0.34377440611189525.
[I 2023-12-26 14:18:35,332] Trial 81 finished with value: 0.394221832884478 and parameters: {'model_name': 'SimpleImputer', 'strategy': 'most_frequent'}. Best is trial 11 with value: 0.34377440611189525.
[I 2023-12-26 14:18:35,533] Trial 113 finished with value: 0.34377440611189525 and parameters: {'model_name': 'SimpleImputer', 'strategy': 'mean'}. Best is trial 11 with value: 0.34377440611189525.
