[I 2023-12-26 18:30:15,976] Trial 34 finished with value: 0.3109374229950041 and parameters: {'model_name': 'SimpleImputer', 'strategy': 'mean'}. Best is trial 34 with value: 0.3109374229950041.
[I 2023-12-26 18:30:17,015] Trial 16 finished with value: 0.3307536886571361 and parameters: {'model_name': 'SimpleImputer', 'strategy': 'median'}. Best is trial 34 with value: 0.3109374229950041.
[I 2023-12-26 18:30:20,009] Trial 43 finished with value: 0.3307536886571361 and parameters: {'model_name': 'SimpleImputer', 'strategy': 'median'}. Best is trial 34 with value: 0.3109374229950041.
[I 2023-12-26 18:30:21,010] Trial 32 finished with value: 0.3307536886571361 and parameters: {'model_name': 'SimpleImputer', 'strategy': 'median'}. Best is trial 34 with value: 0.3109374229950041.
2023-12-26 18:30:30.605501: E external/local_xla/xla/stream_executor/cuda/cuda_driver.cc:274] failed call to cuInit: CUDA_ERROR_NO_DEVICE: no CUDA-capable device is detected
2023-12-26 18:30:31.281563: I tensorflow/compiler/mlir/mlir_graph_optimization_pass.cc:388] MLIR V1 optimization pass is not enabled
[I 2023-12-26 18:31:07,487] Trial 3 finished with value: 0.3307536886571361 and parameters: {'model_name': 'SimpleImputer', 'strategy': 'most_frequent'}. Best is trial 34 with value: 0.3109374229950041.
[I 2023-12-26 18:31:10,977] Trial 1 finished with value: 0.3307536886571361 and parameters: {'model_name': 'SimpleImputer', 'strategy': 'most_frequent'}. Best is trial 34 with value: 0.3109374229950041.
[I 2023-12-26 18:31:15,538] Trial 52 finished with value: 0.3307536886571361 and parameters: {'model_name': 'SimpleImputer', 'strategy': 'constant'}. Best is trial 34 with value: 0.3109374229950041.
[I 2023-12-26 18:31:33,481] Trial 49 finished with value: 0.3307536886571361 and parameters: {'model_name': 'SimpleImputer', 'strategy': 'most_frequent'}. Best is trial 34 with value: 0.3109374229950041.
[I 2023-12-26 18:31:46,243] Trial 55 finished with value: 0.3307536886571361 and parameters: {'model_name': 'SimpleImputer', 'strategy': 'median'}. Best is trial 34 with value: 0.3109374229950041.
[I 2023-12-26 18:31:53,613] Trial 56 finished with value: 0.3307536886571361 and parameters: {'model_name': 'SimpleImputer', 'strategy': 'constant'}. Best is trial 34 with value: 0.3109374229950041.
[I 2023-12-26 18:32:31,390] Trial 22 finished with value: 0.28880438097397604 and parameters: {'model_name': 'KNNImputer', 'weights': 'uniform', 'keep_empty_features': False}. Best is trial 22 with value: 0.28880438097397604.
[I 2023-12-26 18:32:32,672] Trial 7 finished with value: 0.28880438097397604 and parameters: {'model_name': 'KNNImputer', 'weights': 'uniform', 'keep_empty_features': False}. Best is trial 22 with value: 0.28880438097397604.
[I 2023-12-26 18:32:37,284] Trial 23 finished with value: 0.28880438097397604 and parameters: {'model_name': 'KNNImputer', 'weights': 'uniform', 'keep_empty_features': False}. Best is trial 22 with value: 0.28880438097397604.
[I 2023-12-26 18:32:37,959] Trial 30 finished with value: 0.3279330724155375 and parameters: {'model_name': 'KNNImputer', 'weights': 'distance', 'keep_empty_features': False}. Best is trial 22 with value: 0.28880438097397604.
[I 2023-12-26 18:32:38,684] Trial 37 finished with value: 0.28880438097397604 and parameters: {'model_name': 'KNNImputer', 'weights': 'uniform', 'keep_empty_features': False}. Best is trial 22 with value: 0.28880438097397604.
[I 2023-12-26 18:32:43,417] Trial 8 finished with value: 0.3279330724155375 and parameters: {'model_name': 'KNNImputer', 'weights': 'distance', 'keep_empty_features': False}. Best is trial 22 with value: 0.28880438097397604.
[I 2023-12-26 18:32:44,218] Trial 31 finished with value: 0.28880438097397604 and parameters: {'model_name': 'KNNImputer', 'weights': 'uniform', 'keep_empty_features': False}. Best is trial 22 with value: 0.28880438097397604.
[I 2023-12-26 18:32:44,671] Trial 6 finished with value: 0.3279330724155375 and parameters: {'model_name': 'KNNImputer', 'weights': 'distance', 'keep_empty_features': False}. Best is trial 22 with value: 0.28880438097397604.
[I 2023-12-26 18:32:45,125] Trial 10 finished with value: 0.3279330724155375 and parameters: {'model_name': 'KNNImputer', 'weights': 'distance', 'keep_empty_features': False}. Best is trial 22 with value: 0.28880438097397604.
[I 2023-12-26 18:32:49,947] Trial 2 finished with value: 0.3279330724155375 and parameters: {'model_name': 'KNNImputer', 'weights': 'distance', 'keep_empty_features': False}. Best is trial 22 with value: 0.28880438097397604.
[I 2023-12-26 18:32:50,837] Trial 18 finished with value: 0.3279330724155375 and parameters: {'model_name': 'KNNImputer', 'weights': 'distance', 'keep_empty_features': False}. Best is trial 22 with value: 0.28880438097397604.
[I 2023-12-26 18:32:52,505] Trial 46 finished with value: 0.3279330724155375 and parameters: {'model_name': 'KNNImputer', 'weights': 'distance', 'keep_empty_features': False}. Best is trial 22 with value: 0.28880438097397604.
[I 2023-12-26 18:32:54,418] Trial 41 finished with value: 0.3279330724155375 and parameters: {'model_name': 'KNNImputer', 'weights': 'distance', 'keep_empty_features': False}. Best is trial 22 with value: 0.28880438097397604.
[I 2023-12-26 18:32:56,242] Trial 48 finished with value: 0.3279330724155375 and parameters: {'model_name': 'KNNImputer', 'weights': 'distance', 'keep_empty_features': False}. Best is trial 22 with value: 0.28880438097397604.
[I 2023-12-26 18:33:32,761] Trial 53 finished with value: 0.3279330724155375 and parameters: {'model_name': 'KNNImputer', 'weights': 'distance', 'keep_empty_features': False}. Best is trial 22 with value: 0.28880438097397604.
[I 2023-12-26 18:34:23,743] Trial 58 finished with value: 0.28880438097397604 and parameters: {'model_name': 'KNNImputer', 'weights': 'uniform', 'keep_empty_features': False}. Best is trial 22 with value: 0.28880438097397604.
[I 2023-12-26 18:34:26,804] Trial 59 finished with value: 0.28880438097397604 and parameters: {'model_name': 'KNNImputer', 'weights': 'uniform', 'keep_empty_features': False}. Best is trial 22 with value: 0.28880438097397604.
[I 2023-12-26 18:35:20,045] Trial 36 finished with value: 0.6549392870959434 and parameters: {'model_name': 'GAIN', 'batch_size': 1, 'hint_rate': 0.26, 'alpha': 65, 'iterations': 3}. Best is trial 22 with value: 0.28880438097397604.
[I 2023-12-26 18:36:20,349] Trial 75 finished with value: 0.3109374229950041 and parameters: {'model_name': 'RandomForestImputer', 'max_iter': 1, 'decreasing': True, 'min_samples_split': 0.8, 'min_samples_leaf': 0.5, 'max_features': 0.9, 'warm_start': True}. Best is trial 22 with value: 0.28880438097397604.
[I 2023-12-26 18:36:59,730] Trial 29 finished with value: 0.5143440188716617 and parameters: {'model_name': 'GAIN', 'batch_size': 194, 'hint_rate': 0.85, 'alpha': 91, 'iterations': 18}. Best is trial 22 with value: 0.28880438097397604.
[I 2023-12-26 18:38:12,307] Trial 45 finished with value: 0.31590635212232376 and parameters: {'model_name': 'RandomForestImputer', 'max_iter': 5, 'decreasing': False, 'min_samples_split': 0.4, 'min_samples_leaf': 0.6, 'max_features': 0.2, 'warm_start': True}. Best is trial 22 with value: 0.28880438097397604.
[I 2023-12-26 18:38:45,891] Trial 14 finished with value: 0.3109374229950041 and parameters: {'model_name': 'RandomForestImputer', 'max_iter': 1, 'decreasing': False, 'min_samples_split': 0.7000000000000001, 'min_samples_leaf': 0.9, 'max_features': 0.7000000000000001, 'warm_start': False}. Best is trial 22 with value: 0.28880438097397604.
[I 2023-12-26 18:39:11,330] Trial 50 finished with value: 0.3109374229950041 and parameters: {'model_name': 'RandomForestImputer', 'max_iter': 1, 'decreasing': False, 'min_samples_split': 0.7000000000000001, 'min_samples_leaf': 0.1, 'max_features': 0.6, 'warm_start': False}. Best is trial 22 with value: 0.28880438097397604.
[I 2023-12-26 18:39:22,826] Trial 57 finished with value: 0.31183861503851346 and parameters: {'model_name': 'RandomForestImputer', 'max_iter': 6, 'decreasing': True, 'min_samples_split': 0.7000000000000001, 'min_samples_leaf': 0.6, 'max_features': 0.9, 'warm_start': True}. Best is trial 22 with value: 0.28880438097397604.
[I 2023-12-26 18:39:47,934] Trial 44 finished with value: 0.31592982174932516 and parameters: {'model_name': 'RandomForestImputer', 'max_iter': 6, 'decreasing': False, 'min_samples_split': 0.4, 'min_samples_leaf': 0.8, 'max_features': 0.2, 'warm_start': True}. Best is trial 22 with value: 0.28880438097397604.
[I 2023-12-26 18:40:31,931] Trial 67 finished with value: 0.3109374229950041 and parameters: {'model_name': 'RandomForestImputer', 'max_iter': 1, 'decreasing': True, 'min_samples_split': 0.30000000000000004, 'min_samples_leaf': 0.2, 'max_features': 0.9, 'warm_start': False}. Best is trial 22 with value: 0.28880438097397604.
[I 2023-12-26 18:41:14,798] Trial 60 finished with value: inf and parameters: {'model_name': 'GAIN', 'batch_size': 57, 'hint_rate': 0.55, 'alpha': 62, 'iterations': 223}. Best is trial 22 with value: 0.28880438097397604.
[I 2023-12-26 18:45:45,390] Trial 65 finished with value: 0.7208595804766814 and parameters: {'model_name': 'GAIN', 'batch_size': 635, 'hint_rate': 0.52, 'alpha': 0, 'iterations': 77}. Best is trial 22 with value: 0.28880438097397604.
[I 2023-12-26 18:47:49,899] Trial 64 finished with value: inf and parameters: {'model_name': 'GAIN', 'batch_size': 75, 'hint_rate': 0.16, 'alpha': 82, 'iterations': 627}. Best is trial 22 with value: 0.28880438097397604.
[I 2023-12-26 18:49:12,097] Trial 74 finished with value: inf and parameters: {'model_name': 'GAIN', 'batch_size': 520, 'hint_rate': 0.9600000000000001, 'alpha': 7, 'iterations': 389}. Best is trial 22 with value: 0.28880438097397604.
[I 2023-12-26 18:50:12,753] Trial 9 finished with value: 0.3109927824556902 and parameters: {'model_name': 'RandomForestImputer', 'max_iter': 2, 'decreasing': False, 'min_samples_split': 0.30000000000000004, 'min_samples_leaf': 0.4, 'max_features': 0.30000000000000004, 'warm_start': False}. Best is trial 22 with value: 0.28880438097397604.
[I 2023-12-26 18:51:13,016] Trial 38 finished with value: 0.31189272155902226 and parameters: {'model_name': 'RandomForestImputer', 'max_iter': 33, 'decreasing': True, 'min_samples_split': 0.9, 'min_samples_leaf': 0.4, 'max_features': 0.5, 'warm_start': True}. Best is trial 22 with value: 0.28880438097397604.
[I 2023-12-26 18:53:47,209] Trial 73 finished with value: 0.31091391964756193 and parameters: {'model_name': 'RandomForestImputer', 'max_iter': 2, 'decreasing': False, 'min_samples_split': 0.30000000000000004, 'min_samples_leaf': 0.7000000000000001, 'max_features': 0.6, 'warm_start': False}. Best is trial 22 with value: 0.28880438097397604.
[I 2023-12-26 19:00:16,719] Trial 70 finished with value: 0.31569922566148484 and parameters: {'model_name': 'RandomForestImputer', 'max_iter': 50, 'decreasing': False, 'min_samples_split': 0.1, 'min_samples_leaf': 0.8, 'max_features': 0.4, 'warm_start': True}. Best is trial 22 with value: 0.28880438097397604.
[I 2023-12-26 19:03:25,327] Trial 25 finished with value: 0.3109165747866724 and parameters: {'model_name': 'RandomForestImputer', 'max_iter': 3, 'decreasing': True, 'min_samples_split': 0.30000000000000004, 'min_samples_leaf': 0.4, 'max_features': 0.2, 'warm_start': False}. Best is trial 22 with value: 0.28880438097397604.
[I 2023-12-26 19:03:46,307] Trial 4 finished with value: inf and parameters: {'model_name': 'GAIN', 'batch_size': 57, 'hint_rate': 0.060000000000000005, 'alpha': 81, 'iterations': 406}. Best is trial 22 with value: 0.28880438097397604.
[I 2023-12-26 19:17:47,380] Trial 0 finished with value: 0.16753998470228798 and parameters: {'model_name': 'IterativeImputer', 'sample_posterior': False, 'initial_strategy': 'median', 'imputation_order': 'roman'}. Best is trial 0 with value: 0.16753998470228798.
[I 2023-12-26 19:17:51,273] Trial 42 finished with value: 0.1675575104660703 and parameters: {'model_name': 'IterativeImputer', 'sample_posterior': False, 'initial_strategy': 'mean', 'imputation_order': 'roman'}. Best is trial 0 with value: 0.16753998470228798.
[I 2023-12-26 19:18:15,380] Trial 26 finished with value: 0.1678558548841339 and parameters: {'model_name': 'IterativeImputer', 'sample_posterior': False, 'initial_strategy': 'median', 'imputation_order': 'random'}. Best is trial 0 with value: 0.16753998470228798.
[I 2023-12-26 19:18:19,858] Trial 40 finished with value: 0.16756898336351153 and parameters: {'model_name': 'IterativeImputer', 'sample_posterior': False, 'initial_strategy': 'median', 'imputation_order': 'random'}. Best is trial 0 with value: 0.16753998470228798.
[I 2023-12-26 19:18:22,466] Trial 51 finished with value: 0.16781883496125743 and parameters: {'model_name': 'IterativeImputer', 'sample_posterior': False, 'initial_strategy': 'mean', 'imputation_order': 'random'}. Best is trial 0 with value: 0.16753998470228798.
[I 2023-12-26 19:18:28,168] Trial 20 finished with value: 0.16760817609991935 and parameters: {'model_name': 'IterativeImputer', 'sample_posterior': False, 'initial_strategy': 'most_frequent', 'imputation_order': 'ascending'}. Best is trial 0 with value: 0.16753998470228798.
[I 2023-12-26 19:18:58,865] Trial 17 finished with value: 0.16780014000415572 and parameters: {'model_name': 'IterativeImputer', 'sample_posterior': False, 'initial_strategy': 'most_frequent', 'imputation_order': 'random'}. Best is trial 0 with value: 0.16753998470228798.
[I 2023-12-26 19:18:59,578] Trial 62 finished with value: 0.16753998470228798 and parameters: {'model_name': 'IterativeImputer', 'sample_posterior': False, 'initial_strategy': 'constant', 'imputation_order': 'roman'}. Best is trial 0 with value: 0.16753998470228798.
[I 2023-12-26 19:19:15,568] Trial 66 finished with value: 0.16761212210538637 and parameters: {'model_name': 'IterativeImputer', 'sample_posterior': False, 'initial_strategy': 'mean', 'imputation_order': 'ascending'}. Best is trial 0 with value: 0.16753998470228798.
[I 2023-12-26 19:19:46,325] Trial 61 finished with value: 0.1676081275293718 and parameters: {'model_name': 'IterativeImputer', 'sample_posterior': False, 'initial_strategy': 'mean', 'imputation_order': 'random'}. Best is trial 0 with value: 0.16753998470228798.
[I 2023-12-26 19:23:14,311] Trial 19 finished with value: 0.30023409553678937 and parameters: {'model_name': 'RandomForestImputer', 'max_iter': 6, 'decreasing': False, 'min_samples_split': 1.0, 'min_samples_leaf': 0.1, 'max_features': 0.4, 'warm_start': False}. Best is trial 0 with value: 0.16753998470228798.
[I 2023-12-26 19:23:47,534] Trial 76 finished with value: 0.16760817609991935 and parameters: {'model_name': 'IterativeImputer', 'sample_posterior': False, 'initial_strategy': 'median', 'imputation_order': 'ascending'}. Best is trial 0 with value: 0.16753998470228798.
[I 2023-12-26 19:24:50,212] Trial 77 finished with value: 0.16784599996511887 and parameters: {'model_name': 'IterativeImputer', 'sample_posterior': False, 'initial_strategy': 'mean', 'imputation_order': 'random'}. Best is trial 0 with value: 0.16753998470228798.
[I 2023-12-26 19:26:42,557] Trial 78 finished with value: 0.16770391592331496 and parameters: {'model_name': 'IterativeImputer', 'sample_posterior': False, 'initial_strategy': 'mean', 'imputation_order': 'arabic'}. Best is trial 0 with value: 0.16753998470228798.
[I 2023-12-26 19:27:32,502] Trial 79 finished with value: 0.16763357283372665 and parameters: {'model_name': 'IterativeImputer', 'sample_posterior': False, 'initial_strategy': 'median', 'imputation_order': 'descending'}. Best is trial 0 with value: 0.16753998470228798.
[I 2023-12-26 19:28:30,740] Trial 80 finished with value: 0.16760817609991935 and parameters: {'model_name': 'IterativeImputer', 'sample_posterior': False, 'initial_strategy': 'most_frequent', 'imputation_order': 'ascending'}. Best is trial 0 with value: 0.16753998470228798.
[I 2023-12-26 19:30:00,516] Trial 72 finished with value: 0.3109535492154566 and parameters: {'model_name': 'RandomForestImputer', 'max_iter': 8, 'decreasing': True, 'min_samples_split': 1.0, 'min_samples_leaf': 0.9, 'max_features': 0.9, 'warm_start': False}. Best is trial 0 with value: 0.16753998470228798.
[I 2023-12-26 19:30:13,683] Trial 84 finished with value: 0.16763357283372665 and parameters: {'model_name': 'IterativeImputer', 'sample_posterior': False, 'initial_strategy': 'median', 'imputation_order': 'descending'}. Best is trial 0 with value: 0.16753998470228798.
[I 2023-12-26 19:30:15,755] Trial 83 finished with value: 0.167665658950866 and parameters: {'model_name': 'IterativeImputer', 'sample_posterior': False, 'initial_strategy': 'median', 'imputation_order': 'random'}. Best is trial 0 with value: 0.16753998470228798.
[I 2023-12-26 19:33:08,688] Trial 11 finished with value: 0.31091174559751267 and parameters: {'model_name': 'RandomForestImputer', 'max_iter': 17, 'decreasing': False, 'min_samples_split': 0.1, 'min_samples_leaf': 0.6, 'max_features': 0.8, 'warm_start': False}. Best is trial 0 with value: 0.16753998470228798.
[I 2023-12-26 19:41:15,221] Trial 89 finished with value: 0.16763357283372665 and parameters: {'model_name': 'IterativeImputer', 'sample_posterior': False, 'initial_strategy': 'constant', 'imputation_order': 'descending'}. Best is trial 0 with value: 0.16753998470228798.
[I 2023-12-26 19:42:22,526] Trial 33 finished with value: 0.3109121344806574 and parameters: {'model_name': 'RandomForestImputer', 'max_iter': 18, 'decreasing': True, 'min_samples_split': 0.9, 'min_samples_leaf': 0.8, 'max_features': 0.5, 'warm_start': False}. Best is trial 0 with value: 0.16753998470228798.
[I 2023-12-26 19:44:51,139] Trial 12 finished with value: 0.31092300346939516 and parameters: {'model_name': 'RandomForestImputer', 'max_iter': 16, 'decreasing': True, 'min_samples_split': 0.2, 'min_samples_leaf': 0.6, 'max_features': 0.6, 'warm_start': False}. Best is trial 0 with value: 0.16753998470228798.
[I 2023-12-26 19:45:22,037] Trial 90 finished with value: 0.16774362418633065 and parameters: {'model_name': 'IterativeImputer', 'sample_posterior': False, 'initial_strategy': 'most_frequent', 'imputation_order': 'arabic'}. Best is trial 0 with value: 0.16753998470228798.
[I 2023-12-26 19:45:37,751] Trial 28 finished with value: 0.31092231022619576 and parameters: {'model_name': 'RandomForestImputer', 'max_iter': 22, 'decreasing': False, 'min_samples_split': 0.1, 'min_samples_leaf': 0.7000000000000001, 'max_features': 0.1, 'warm_start': False}. Best is trial 0 with value: 0.16753998470228798.
[I 2023-12-26 19:51:53,209] Trial 47 finished with value: 0.24625256422119413 and parameters: {'model_name': 'IterativeImputer', 'sample_posterior': True, 'initial_strategy': 'mean', 'imputation_order': 'ascending'}. Best is trial 0 with value: 0.16753998470228798.
[I 2023-12-26 19:52:46,264] Trial 39 finished with value: 0.24835260213138546 and parameters: {'model_name': 'IterativeImputer', 'sample_posterior': True, 'initial_strategy': 'constant', 'imputation_order': 'roman'}. Best is trial 0 with value: 0.16753998470228798.
[I 2023-12-26 19:54:11,897] Trial 5 finished with value: 0.2491035363442829 and parameters: {'model_name': 'IterativeImputer', 'sample_posterior': True, 'initial_strategy': 'mean', 'imputation_order': 'random'}. Best is trial 0 with value: 0.16753998470228798.
[I 2023-12-26 19:54:40,477] Trial 21 finished with value: 0.24812591423450558 and parameters: {'model_name': 'IterativeImputer', 'sample_posterior': True, 'initial_strategy': 'mean', 'imputation_order': 'arabic'}. Best is trial 0 with value: 0.16753998470228798.
[I 2023-12-26 19:54:44,905] Trial 93 finished with value: 0.16770391592331496 and parameters: {'model_name': 'IterativeImputer', 'sample_posterior': False, 'initial_strategy': 'mean', 'imputation_order': 'arabic'}. Best is trial 0 with value: 0.16753998470228798.
[I 2023-12-26 19:54:47,368] Trial 27 finished with value: 0.2471995424233116 and parameters: {'model_name': 'IterativeImputer', 'sample_posterior': True, 'initial_strategy': 'constant', 'imputation_order': 'arabic'}. Best is trial 0 with value: 0.16753998470228798.
[I 2023-12-26 19:54:52,531] Trial 92 finished with value: 0.16753998470228798 and parameters: {'model_name': 'IterativeImputer', 'sample_posterior': False, 'initial_strategy': 'most_frequent', 'imputation_order': 'roman'}. Best is trial 0 with value: 0.16753998470228798.
[I 2023-12-26 19:55:02,542] Trial 13 finished with value: 0.24744496253598464 and parameters: {'model_name': 'IterativeImputer', 'sample_posterior': True, 'initial_strategy': 'most_frequent', 'imputation_order': 'descending'}. Best is trial 0 with value: 0.16753998470228798.
[I 2023-12-26 19:55:03,925] Trial 24 finished with value: 0.24841846442542667 and parameters: {'model_name': 'IterativeImputer', 'sample_posterior': True, 'initial_strategy': 'most_frequent', 'imputation_order': 'arabic'}. Best is trial 0 with value: 0.16753998470228798.
[I 2023-12-26 19:56:12,500] Trial 68 finished with value: 0.24702161337865952 and parameters: {'model_name': 'IterativeImputer', 'sample_posterior': True, 'initial_strategy': 'most_frequent', 'imputation_order': 'descending'}. Best is trial 0 with value: 0.16753998470228798.
[I 2023-12-26 19:56:21,513] Trial 71 finished with value: 0.24933416389268087 and parameters: {'model_name': 'IterativeImputer', 'sample_posterior': True, 'initial_strategy': 'mean', 'imputation_order': 'random'}. Best is trial 0 with value: 0.16753998470228798.
[I 2023-12-26 19:56:44,808] Trial 69 finished with value: 0.2494457315682029 and parameters: {'model_name': 'IterativeImputer', 'sample_posterior': True, 'initial_strategy': 'most_frequent', 'imputation_order': 'descending'}. Best is trial 0 with value: 0.16753998470228798.
