[I 2024-02-07 11:40:54,119] Trial 68 finished with value: 773.0278506808357 and parameters: {'model_name': 'SimpleImputer', 'strategy': 'most_frequent'}. Best is trial 1 with value: 374.0710532986248.
[I 2024-02-07 11:40:54,395] Trial 71 finished with value: 773.0278506808357 and parameters: {'model_name': 'SimpleImputer', 'strategy': 'most_frequent'}. Best is trial 1 with value: 374.0710532986248.
[I 2024-02-07 11:40:56,785] Trial 106 finished with value: 773.0278506808357 and parameters: {'model_name': 'SimpleImputer', 'strategy': 'most_frequent'}. Best is trial 1 with value: 374.0710532986248.
[I 2024-02-07 11:40:57,243] Trial 102 finished with value: 773.0278506808357 and parameters: {'model_name': 'SimpleImputer', 'strategy': 'most_frequent'}. Best is trial 1 with value: 374.0710532986248.
[I 2024-02-07 11:40:58,158] Trial 103 finished with value: 773.0278506808357 and parameters: {'model_name': 'SimpleImputer', 'strategy': 'most_frequent'}. Best is trial 1 with value: 374.0710532986248.
[I 2024-02-07 11:40:58,515] Trial 105 finished with value: 773.0278506808357 and parameters: {'model_name': 'SimpleImputer', 'strategy': 'most_frequent'}. Best is trial 1 with value: 374.0710532986248.
[I 2024-02-07 11:40:58,802] Trial 109 finished with value: 773.0278506808357 and parameters: {'model_name': 'SimpleImputer', 'strategy': 'most_frequent'}. Best is trial 1 with value: 374.0710532986248.
[I 2024-02-07 11:40:58,976] Trial 100 finished with value: 773.0278506808357 and parameters: {'model_name': 'SimpleImputer', 'strategy': 'most_frequent'}. Best is trial 1 with value: 374.0710532986248.
[I 2024-02-07 11:40:59,268] Trial 148 finished with value: 374.0710532986248 and parameters: {'model_name': 'SimpleImputer', 'strategy': 'median'}. Best is trial 1 with value: 374.0710532986248.
[I 2024-02-07 11:40:59,593] Trial 108 finished with value: 773.0278506808357 and parameters: {'model_name': 'SimpleImputer', 'strategy': 'most_frequent'}. Best is trial 1 with value: 374.0710532986248.
[I 2024-02-07 11:40:59,781] Trial 146 finished with value: 374.0710532986248 and parameters: {'model_name': 'SimpleImputer', 'strategy': 'median'}. Best is trial 1 with value: 374.0710532986248.
[I 2024-02-07 11:40:59,960] Trial 101 finished with value: 773.0278506808357 and parameters: {'model_name': 'SimpleImputer', 'strategy': 'most_frequent'}. Best is trial 1 with value: 374.0710532986248.
[I 2024-02-07 11:41:00,203] Trial 104 finished with value: 773.0278506808357 and parameters: {'model_name': 'SimpleImputer', 'strategy': 'most_frequent'}. Best is trial 1 with value: 374.0710532986248.
[I 2024-02-07 11:41:00,649] Trial 114 finished with value: 773.0278506808357 and parameters: {'model_name': 'SimpleImputer', 'strategy': 'most_frequent'}. Best is trial 1 with value: 374.0710532986248.
[I 2024-02-07 11:41:00,905] Trial 107 finished with value: 773.0278506808357 and parameters: {'model_name': 'SimpleImputer', 'strategy': 'most_frequent'}. Best is trial 1 with value: 374.0710532986248.
[I 2024-02-07 11:41:01,082] Trial 127 finished with value: 773.0278506808357 and parameters: {'model_name': 'SimpleImputer', 'strategy': 'most_frequent'}. Best is trial 1 with value: 374.0710532986248.
[I 2024-02-07 11:41:01,284] Trial 120 finished with value: 773.0278506808357 and parameters: {'model_name': 'SimpleImputer', 'strategy': 'most_frequent'}. Best is trial 1 with value: 374.0710532986248.
[I 2024-02-07 11:41:01,598] Trial 147 finished with value: 374.0710532986248 and parameters: {'model_name': 'SimpleImputer', 'strategy': 'median'}. Best is trial 1 with value: 374.0710532986248.
[I 2024-02-07 11:41:01,917] Trial 130 finished with value: 773.0278506808357 and parameters: {'model_name': 'SimpleImputer', 'strategy': 'most_frequent'}. Best is trial 1 with value: 374.0710532986248.
[I 2024-02-07 11:41:02,440] Trial 115 finished with value: 773.0278506808357 and parameters: {'model_name': 'SimpleImputer', 'strategy': 'most_frequent'}. Best is trial 1 with value: 374.0710532986248.
[I 2024-02-07 11:41:02,674] Trial 110 finished with value: 773.0278506808357 and parameters: {'model_name': 'SimpleImputer', 'strategy': 'most_frequent'}. Best is trial 1 with value: 374.0710532986248.
[I 2024-02-07 11:41:02,947] Trial 131 finished with value: 773.0278506808357 and parameters: {'model_name': 'SimpleImputer', 'strategy': 'most_frequent'}. Best is trial 1 with value: 374.0710532986248.
[I 2024-02-07 11:41:03,198] Trial 112 finished with value: 773.0278506808357 and parameters: {'model_name': 'SimpleImputer', 'strategy': 'most_frequent'}. Best is trial 1 with value: 374.0710532986248.
[I 2024-02-07 11:41:03,433] Trial 128 finished with value: 773.0278506808357 and parameters: {'model_name': 'SimpleImputer', 'strategy': 'most_frequent'}. Best is trial 1 with value: 374.0710532986248.
[I 2024-02-07 11:41:03,618] Trial 117 finished with value: 773.0278506808357 and parameters: {'model_name': 'SimpleImputer', 'strategy': 'most_frequent'}. Best is trial 1 with value: 374.0710532986248.
[I 2024-02-07 11:41:03,879] Trial 118 finished with value: 773.0278506808357 and parameters: {'model_name': 'SimpleImputer', 'strategy': 'most_frequent'}. Best is trial 1 with value: 374.0710532986248.
[I 2024-02-07 11:41:04,162] Trial 121 finished with value: 773.0278506808357 and parameters: {'model_name': 'SimpleImputer', 'strategy': 'most_frequent'}. Best is trial 1 with value: 374.0710532986248.
[I 2024-02-07 11:41:04,366] Trial 123 finished with value: 773.0278506808357 and parameters: {'model_name': 'SimpleImputer', 'strategy': 'most_frequent'}. Best is trial 1 with value: 374.0710532986248.
[I 2024-02-07 11:41:04,570] Trial 125 finished with value: 773.0278506808357 and parameters: {'model_name': 'SimpleImputer', 'strategy': 'most_frequent'}. Best is trial 1 with value: 374.0710532986248.
[I 2024-02-07 11:41:04,840] Trial 124 finished with value: 773.0278506808357 and parameters: {'model_name': 'SimpleImputer', 'strategy': 'most_frequent'}. Best is trial 1 with value: 374.0710532986248.
[I 2024-02-07 11:41:05,249] Trial 122 finished with value: 773.0278506808357 and parameters: {'model_name': 'SimpleImputer', 'strategy': 'most_frequent'}. Best is trial 1 with value: 374.0710532986248.
[I 2024-02-07 11:41:05,533] Trial 111 finished with value: 773.0278506808357 and parameters: {'model_name': 'SimpleImputer', 'strategy': 'most_frequent'}. Best is trial 1 with value: 374.0710532986248.
[I 2024-02-07 11:41:05,782] Trial 119 finished with value: 773.0278506808357 and parameters: {'model_name': 'SimpleImputer', 'strategy': 'most_frequent'}. Best is trial 1 with value: 374.0710532986248.
[I 2024-02-07 11:41:06,065] Trial 126 finished with value: 773.0278506808357 and parameters: {'model_name': 'SimpleImputer', 'strategy': 'most_frequent'}. Best is trial 1 with value: 374.0710532986248.
[I 2024-02-07 11:41:06,478] Trial 116 finished with value: 773.0278506808357 and parameters: {'model_name': 'SimpleImputer', 'strategy': 'most_frequent'}. Best is trial 1 with value: 374.0710532986248.
[I 2024-02-07 11:41:06,795] Trial 149 finished with value: 374.0710532986248 and parameters: {'model_name': 'SimpleImputer', 'strategy': 'median'}. Best is trial 1 with value: 374.0710532986248.
[I 2024-02-07 11:41:07,097] Trial 150 finished with value: 374.0710532986248 and parameters: {'model_name': 'SimpleImputer', 'strategy': 'median'}. Best is trial 1 with value: 374.0710532986248.
[I 2024-02-07 11:41:07,520] Trial 129 finished with value: 773.0278506808357 and parameters: {'model_name': 'SimpleImputer', 'strategy': 'most_frequent'}. Best is trial 1 with value: 374.0710532986248.
[I 2024-02-07 11:41:07,904] Trial 133 finished with value: 773.0278506808357 and parameters: {'model_name': 'SimpleImputer', 'strategy': 'most_frequent'}. Best is trial 1 with value: 374.0710532986248.
[I 2024-02-07 11:41:08,682] Trial 134 finished with value: 773.0278506808357 and parameters: {'model_name': 'SimpleImputer', 'strategy': 'most_frequent'}. Best is trial 1 with value: 374.0710532986248.
[I 2024-02-07 11:41:09,137] Trial 155 finished with value: 374.0710532986248 and parameters: {'model_name': 'SimpleImputer', 'strategy': 'median'}. Best is trial 1 with value: 374.0710532986248.
[I 2024-02-07 11:41:09,338] Trial 157 finished with value: 374.0710532986248 and parameters: {'model_name': 'SimpleImputer', 'strategy': 'median'}. Best is trial 1 with value: 374.0710532986248.
[I 2024-02-07 11:41:09,607] Trial 153 finished with value: 374.0710532986248 and parameters: {'model_name': 'SimpleImputer', 'strategy': 'median'}. Best is trial 1 with value: 374.0710532986248.
[I 2024-02-07 11:41:09,906] Trial 151 finished with value: 374.0710532986248 and parameters: {'model_name': 'SimpleImputer', 'strategy': 'median'}. Best is trial 1 with value: 374.0710532986248.
[I 2024-02-07 11:41:10,099] Trial 158 finished with value: 374.0710532986248 and parameters: {'model_name': 'SimpleImputer', 'strategy': 'median'}. Best is trial 1 with value: 374.0710532986248.
[I 2024-02-07 11:41:10,348] Trial 154 finished with value: 374.0710532986248 and parameters: {'model_name': 'SimpleImputer', 'strategy': 'median'}. Best is trial 1 with value: 374.0710532986248.
[I 2024-02-07 11:41:10,602] Trial 152 finished with value: 374.0710532986248 and parameters: {'model_name': 'SimpleImputer', 'strategy': 'median'}. Best is trial 1 with value: 374.0710532986248.
[I 2024-02-07 11:41:10,823] Trial 160 finished with value: 374.0710532986248 and parameters: {'model_name': 'SimpleImputer', 'strategy': 'median'}. Best is trial 1 with value: 374.0710532986248.
[I 2024-02-07 11:41:11,122] Trial 163 finished with value: 374.0710532986248 and parameters: {'model_name': 'SimpleImputer', 'strategy': 'median'}. Best is trial 1 with value: 374.0710532986248.
[I 2024-02-07 11:41:11,502] Trial 162 finished with value: 374.0710532986248 and parameters: {'model_name': 'SimpleImputer', 'strategy': 'median'}. Best is trial 1 with value: 374.0710532986248.
[I 2024-02-07 11:41:11,747] Trial 132 finished with value: 773.0278506808357 and parameters: {'model_name': 'SimpleImputer', 'strategy': 'most_frequent'}. Best is trial 1 with value: 374.0710532986248.
[I 2024-02-07 11:41:11,937] Trial 156 finished with value: 374.0710532986248 and parameters: {'model_name': 'SimpleImputer', 'strategy': 'median'}. Best is trial 1 with value: 374.0710532986248.
[I 2024-02-07 11:41:12,332] Trial 159 finished with value: 374.0710532986248 and parameters: {'model_name': 'SimpleImputer', 'strategy': 'median'}. Best is trial 1 with value: 374.0710532986248.
[I 2024-02-07 11:41:12,518] Trial 161 finished with value: 374.0710532986248 and parameters: {'model_name': 'SimpleImputer', 'strategy': 'median'}. Best is trial 1 with value: 374.0710532986248.
[I 2024-02-07 11:41:12,799] Trial 135 finished with value: 773.0278506808357 and parameters: {'model_name': 'SimpleImputer', 'strategy': 'most_frequent'}. Best is trial 1 with value: 374.0710532986248.
[I 2024-02-07 11:41:13,068] Trial 166 finished with value: 374.0710532986248 and parameters: {'model_name': 'SimpleImputer', 'strategy': 'median'}. Best is trial 1 with value: 374.0710532986248.
[I 2024-02-07 11:41:13,316] Trial 164 finished with value: 374.0710532986248 and parameters: {'model_name': 'SimpleImputer', 'strategy': 'median'}. Best is trial 1 with value: 374.0710532986248.
[I 2024-02-07 11:41:13,529] Trial 136 finished with value: 773.0278506808357 and parameters: {'model_name': 'SimpleImputer', 'strategy': 'most_frequent'}. Best is trial 1 with value: 374.0710532986248.
[I 2024-02-07 11:41:13,790] Trial 173 finished with value: 374.0710532986248 and parameters: {'model_name': 'SimpleImputer', 'strategy': 'median'}. Best is trial 1 with value: 374.0710532986248.
[I 2024-02-07 11:41:14,147] Trial 170 finished with value: 374.0710532986248 and parameters: {'model_name': 'SimpleImputer', 'strategy': 'median'}. Best is trial 1 with value: 374.0710532986248.
[I 2024-02-07 11:41:14,415] Trial 167 finished with value: 374.0710532986248 and parameters: {'model_name': 'SimpleImputer', 'strategy': 'median'}. Best is trial 1 with value: 374.0710532986248.
[I 2024-02-07 11:41:14,705] Trial 165 finished with value: 374.0710532986248 and parameters: {'model_name': 'SimpleImputer', 'strategy': 'median'}. Best is trial 1 with value: 374.0710532986248.
[I 2024-02-07 11:41:14,954] Trial 180 finished with value: 374.0710532986248 and parameters: {'model_name': 'SimpleImputer', 'strategy': 'median'}. Best is trial 1 with value: 374.0710532986248.
[I 2024-02-07 11:41:15,142] Trial 172 finished with value: 374.0710532986248 and parameters: {'model_name': 'SimpleImputer', 'strategy': 'median'}. Best is trial 1 with value: 374.0710532986248.
[I 2024-02-07 11:41:15,389] Trial 169 finished with value: 374.0710532986248 and parameters: {'model_name': 'SimpleImputer', 'strategy': 'median'}. Best is trial 1 with value: 374.0710532986248.
[I 2024-02-07 11:41:15,587] Trial 171 finished with value: 374.0710532986248 and parameters: {'model_name': 'SimpleImputer', 'strategy': 'median'}. Best is trial 1 with value: 374.0710532986248.
[I 2024-02-07 11:41:15,825] Trial 174 finished with value: 374.0710532986248 and parameters: {'model_name': 'SimpleImputer', 'strategy': 'median'}. Best is trial 1 with value: 374.0710532986248.
[I 2024-02-07 11:41:15,999] Trial 175 finished with value: 374.0710532986248 and parameters: {'model_name': 'SimpleImputer', 'strategy': 'median'}. Best is trial 1 with value: 374.0710532986248.
[I 2024-02-07 11:41:16,287] Trial 168 finished with value: 374.0710532986248 and parameters: {'model_name': 'SimpleImputer', 'strategy': 'median'}. Best is trial 1 with value: 374.0710532986248.
[I 2024-02-07 11:41:16,484] Trial 179 finished with value: 374.0710532986248 and parameters: {'model_name': 'SimpleImputer', 'strategy': 'median'}. Best is trial 1 with value: 374.0710532986248.
[I 2024-02-07 11:41:16,762] Trial 182 finished with value: 374.0710532986248 and parameters: {'model_name': 'SimpleImputer', 'strategy': 'median'}. Best is trial 1 with value: 374.0710532986248.
[I 2024-02-07 11:41:17,071] Trial 176 finished with value: 374.0710532986248 and parameters: {'model_name': 'SimpleImputer', 'strategy': 'median'}. Best is trial 1 with value: 374.0710532986248.
[I 2024-02-07 11:41:17,344] Trial 177 finished with value: 374.0710532986248 and parameters: {'model_name': 'SimpleImputer', 'strategy': 'median'}. Best is trial 1 with value: 374.0710532986248.
[I 2024-02-07 11:41:17,615] Trial 178 finished with value: 374.0710532986248 and parameters: {'model_name': 'SimpleImputer', 'strategy': 'median'}. Best is trial 1 with value: 374.0710532986248.
[I 2024-02-07 11:41:17,849] Trial 184 finished with value: 374.0710532986248 and parameters: {'model_name': 'SimpleImputer', 'strategy': 'median'}. Best is trial 1 with value: 374.0710532986248.
[I 2024-02-07 11:41:18,364] Trial 183 finished with value: 374.0710532986248 and parameters: {'model_name': 'SimpleImputer', 'strategy': 'median'}. Best is trial 1 with value: 374.0710532986248.
[I 2024-02-07 11:41:18,664] Trial 181 finished with value: 374.0710532986248 and parameters: {'model_name': 'SimpleImputer', 'strategy': 'median'}. Best is trial 1 with value: 374.0710532986248.
[I 2024-02-07 11:41:18,915] Trial 185 finished with value: 374.0710532986248 and parameters: {'model_name': 'SimpleImputer', 'strategy': 'median'}. Best is trial 1 with value: 374.0710532986248.
[I 2024-02-07 11:41:19,205] Trial 137 finished with value: 773.0278506808357 and parameters: {'model_name': 'SimpleImputer', 'strategy': 'most_frequent'}. Best is trial 1 with value: 374.0710532986248.
[I 2024-02-07 11:41:19,587] Trial 189 finished with value: 374.0710532986248 and parameters: {'model_name': 'SimpleImputer', 'strategy': 'median'}. Best is trial 1 with value: 374.0710532986248.
[I 2024-02-07 11:41:19,966] Trial 194 finished with value: 374.0710532986248 and parameters: {'model_name': 'SimpleImputer', 'strategy': 'median'}. Best is trial 1 with value: 374.0710532986248.
[I 2024-02-07 11:41:20,231] Trial 191 finished with value: 374.0710532986248 and parameters: {'model_name': 'SimpleImputer', 'strategy': 'median'}. Best is trial 1 with value: 374.0710532986248.
[I 2024-02-07 11:41:20,506] Trial 187 finished with value: 374.0710532986248 and parameters: {'model_name': 'SimpleImputer', 'strategy': 'median'}. Best is trial 1 with value: 374.0710532986248.
[I 2024-02-07 11:41:20,716] Trial 192 finished with value: 374.0710532986248 and parameters: {'model_name': 'SimpleImputer', 'strategy': 'median'}. Best is trial 1 with value: 374.0710532986248.
[I 2024-02-07 11:41:20,955] Trial 141 finished with value: 773.0278506808357 and parameters: {'model_name': 'SimpleImputer', 'strategy': 'most_frequent'}. Best is trial 1 with value: 374.0710532986248.
[I 2024-02-07 11:41:21,208] Trial 186 finished with value: 374.0710532986248 and parameters: {'model_name': 'SimpleImputer', 'strategy': 'median'}. Best is trial 1 with value: 374.0710532986248.
[I 2024-02-07 11:41:21,407] Trial 193 finished with value: 374.0710532986248 and parameters: {'model_name': 'SimpleImputer', 'strategy': 'median'}. Best is trial 1 with value: 374.0710532986248.
[I 2024-02-07 11:41:21,663] Trial 139 finished with value: 773.0278506808357 and parameters: {'model_name': 'SimpleImputer', 'strategy': 'most_frequent'}. Best is trial 1 with value: 374.0710532986248.
[I 2024-02-07 11:41:21,866] Trial 188 finished with value: 374.0710532986248 and parameters: {'model_name': 'SimpleImputer', 'strategy': 'median'}. Best is trial 1 with value: 374.0710532986248.
[I 2024-02-07 11:41:22,059] Trial 190 finished with value: 374.0710532986248 and parameters: {'model_name': 'SimpleImputer', 'strategy': 'median'}. Best is trial 1 with value: 374.0710532986248.
[I 2024-02-07 11:41:22,231] Trial 197 finished with value: 374.0710532986248 and parameters: {'model_name': 'SimpleImputer', 'strategy': 'median'}. Best is trial 1 with value: 374.0710532986248.
[I 2024-02-07 11:41:22,494] Trial 198 finished with value: 374.0710532986248 and parameters: {'model_name': 'SimpleImputer', 'strategy': 'median'}. Best is trial 1 with value: 374.0710532986248.
[I 2024-02-07 11:41:22,743] Trial 138 finished with value: 773.0278506808357 and parameters: {'model_name': 'SimpleImputer', 'strategy': 'most_frequent'}. Best is trial 1 with value: 374.0710532986248.
[I 2024-02-07 11:41:22,986] Trial 140 finished with value: 773.0278506808357 and parameters: {'model_name': 'SimpleImputer', 'strategy': 'most_frequent'}. Best is trial 1 with value: 374.0710532986248.
[I 2024-02-07 11:41:23,179] Trial 195 finished with value: 374.0710532986248 and parameters: {'model_name': 'SimpleImputer', 'strategy': 'median'}. Best is trial 1 with value: 374.0710532986248.
[I 2024-02-07 11:41:23,394] Trial 199 finished with value: 374.0710532986248 and parameters: {'model_name': 'SimpleImputer', 'strategy': 'median'}. Best is trial 1 with value: 374.0710532986248.
[I 2024-02-07 11:41:23,610] Trial 142 finished with value: 773.0278506808357 and parameters: {'model_name': 'SimpleImputer', 'strategy': 'most_frequent'}. Best is trial 1 with value: 374.0710532986248.
[I 2024-02-07 11:41:23,786] Trial 196 finished with value: 374.0710532986248 and parameters: {'model_name': 'SimpleImputer', 'strategy': 'median'}. Best is trial 1 with value: 374.0710532986248.
[I 2024-02-07 11:41:23,948] Trial 144 finished with value: 773.0278506808357 and parameters: {'model_name': 'SimpleImputer', 'strategy': 'most_frequent'}. Best is trial 1 with value: 374.0710532986248.
[I 2024-02-07 11:41:24,123] Trial 145 finished with value: 773.0278506808357 and parameters: {'model_name': 'SimpleImputer', 'strategy': 'most_frequent'}. Best is trial 1 with value: 374.0710532986248.
