[I 2024-04-15 16:52:30,568] Trial 110 finished with value: 16.76452624175606 and parameters: {'model_name': 'GAIN', 'batch_size': 1, 'hint_rate': 0.43, 'alpha': 64, 'iterations': 4}. Best is trial 68 with value: 11.864780781668479.
[I 2024-04-15 16:52:33,062] Trial 108 finished with value: 16.438653095544264 and parameters: {'model_name': 'GAIN', 'batch_size': 1, 'hint_rate': 0.37, 'alpha': 63, 'iterations': 5}. Best is trial 68 with value: 11.864780781668479.
[I 2024-04-15 16:52:35,160] Trial 109 finished with value: 20.299057998798485 and parameters: {'model_name': 'GAIN', 'batch_size': 7, 'hint_rate': 0.45, 'alpha': 64, 'iterations': 4}. Best is trial 68 with value: 11.864780781668479.
[I 2024-04-15 16:52:37,597] Trial 135 finished with value: 33.32040274660817 and parameters: {'model_name': 'SimpleImputer', 'strategy': 'constant'}. Best is trial 68 with value: 11.864780781668479.
[I 2024-04-15 16:52:39,743] Trial 136 finished with value: 33.32040274660817 and parameters: {'model_name': 'SimpleImputer', 'strategy': 'constant'}. Best is trial 68 with value: 11.864780781668479.
[I 2024-04-15 16:53:07,187] Trial 13 finished with value: 32.7748577982724 and parameters: {'model_name': 'RandomForestImputer', 'max_iter': 61, 'decreasing': True, 'min_samples_split': 0.2, 'min_samples_leaf': 0.8, 'max_features': 0.7000000000000001, 'warm_start': True}. Best is trial 68 with value: 11.864780781668479.
[I 2024-04-15 16:53:43,652] Trial 124 finished with value: 16.878867637682497 and parameters: {'model_name': 'GAIN', 'batch_size': 5, 'hint_rate': 0.39, 'alpha': 68, 'iterations': 20}. Best is trial 68 with value: 11.864780781668479.
[I 2024-04-15 16:53:50,438] Trial 119 finished with value: 15.993285371152663 and parameters: {'model_name': 'GAIN', 'batch_size': 5, 'hint_rate': 0.41000000000000003, 'alpha': 65, 'iterations': 31}. Best is trial 68 with value: 11.864780781668479.
[I 2024-04-15 16:54:05,174] Trial 123 finished with value: 16.51534689380395 and parameters: {'model_name': 'GAIN', 'batch_size': 5, 'hint_rate': 0.39, 'alpha': 66, 'iterations': 32}. Best is trial 68 with value: 11.864780781668479.
[I 2024-04-15 16:54:13,508] Trial 125 finished with value: 15.52210879334877 and parameters: {'model_name': 'GAIN', 'batch_size': 5, 'hint_rate': 0.44, 'alpha': 70, 'iterations': 32}. Best is trial 68 with value: 11.864780781668479.
[I 2024-04-15 16:54:22,580] Trial 126 finished with value: 14.389172655583167 and parameters: {'model_name': 'GAIN', 'batch_size': 5, 'hint_rate': 0.37, 'alpha': 67, 'iterations': 38}. Best is trial 68 with value: 11.864780781668479.
[I 2024-04-15 16:54:27,512] Trial 115 finished with value: 14.624700378202562 and parameters: {'model_name': 'GAIN', 'batch_size': 5, 'hint_rate': 0.42000000000000004, 'alpha': 67, 'iterations': 43}. Best is trial 68 with value: 11.864780781668479.
[I 2024-04-15 16:54:34,731] Trial 147 finished with value: 20.50033201344364 and parameters: {'model_name': 'KNNImputer', 'weights': 'uniform', 'keep_empty_features': False}. Best is trial 68 with value: 11.864780781668479.
[I 2024-04-15 16:54:48,674] Trial 117 finished with value: 14.19460152559275 and parameters: {'model_name': 'GAIN', 'batch_size': 5, 'hint_rate': 0.41000000000000003, 'alpha': 69, 'iterations': 54}. Best is trial 68 with value: 11.864780781668479.
[I 2024-04-15 16:55:00,072] Trial 120 finished with value: 15.205255129499571 and parameters: {'model_name': 'GAIN', 'batch_size': 5, 'hint_rate': 0.3, 'alpha': 65, 'iterations': 49}. Best is trial 68 with value: 11.864780781668479.
[I 2024-04-15 16:55:09,724] Trial 132 finished with value: 13.998563839042557 and parameters: {'model_name': 'GAIN', 'batch_size': 4, 'hint_rate': 0.4, 'alpha': 70, 'iterations': 44}. Best is trial 68 with value: 11.864780781668479.
[I 2024-04-15 16:55:15,363] Trial 118 finished with value: 15.750062368619297 and parameters: {'model_name': 'GAIN', 'batch_size': 4, 'hint_rate': 0.42000000000000004, 'alpha': 65, 'iterations': 58}. Best is trial 68 with value: 11.864780781668479.
[I 2024-04-15 16:55:24,026] Trial 112 finished with value: 16.801857605349667 and parameters: {'model_name': 'GAIN', 'batch_size': 5, 'hint_rate': 0.39, 'alpha': 69, 'iterations': 62}. Best is trial 68 with value: 11.864780781668479.
[I 2024-04-15 16:55:34,824] Trial 113 finished with value: 14.70400560485103 and parameters: {'model_name': 'GAIN', 'batch_size': 6, 'hint_rate': 0.4, 'alpha': 67, 'iterations': 65}. Best is trial 68 with value: 11.864780781668479.
[I 2024-04-15 16:55:39,102] Trial 139 finished with value: 16.65025158438551 and parameters: {'model_name': 'GAIN', 'batch_size': 4, 'hint_rate': 0.76, 'alpha': 70, 'iterations': 47}. Best is trial 68 with value: 11.864780781668479.
[I 2024-04-15 16:55:44,476] Trial 11 finished with value: 25.761886158724412 and parameters: {'model_name': 'IterativeImputer', 'sample_posterior': True, 'initial_strategy': 'median', 'imputation_order': 'ascending'}. Best is trial 68 with value: 11.864780781668479.
[I 2024-04-15 16:55:48,877] Trial 122 finished with value: 15.126355078437205 and parameters: {'model_name': 'GAIN', 'batch_size': 5, 'hint_rate': 0.4, 'alpha': 69, 'iterations': 65}. Best is trial 68 with value: 11.864780781668479.
[I 2024-04-15 16:55:53,945] Trial 3 finished with value: 26.05745658089707 and parameters: {'model_name': 'IterativeImputer', 'sample_posterior': True, 'initial_strategy': 'most_frequent', 'imputation_order': 'roman'}. Best is trial 68 with value: 11.864780781668479.
[I 2024-04-15 16:56:00,501] Trial 128 finished with value: 13.866256865329044 and parameters: {'model_name': 'GAIN', 'batch_size': 6, 'hint_rate': 0.42000000000000004, 'alpha': 65, 'iterations': 56}. Best is trial 68 with value: 11.864780781668479.
[I 2024-04-15 16:56:03,269] Trial 36 finished with value: 27.569521272631214 and parameters: {'model_name': 'IterativeImputer', 'sample_posterior': True, 'initial_strategy': 'mean', 'imputation_order': 'ascending'}. Best is trial 68 with value: 11.864780781668479.
[I 2024-04-15 16:56:07,634] Trial 129 finished with value: 12.731943232487096 and parameters: {'model_name': 'GAIN', 'batch_size': 5, 'hint_rate': 0.38, 'alpha': 74, 'iterations': 60}. Best is trial 68 with value: 11.864780781668479.
[I 2024-04-15 16:56:10,486] Trial 38 finished with value: 27.0660073326683 and parameters: {'model_name': 'IterativeImputer', 'sample_posterior': True, 'initial_strategy': 'most_frequent', 'imputation_order': 'ascending'}. Best is trial 68 with value: 11.864780781668479.
[I 2024-04-15 16:56:16,102] Trial 21 finished with value: 26.10553705635241 and parameters: {'model_name': 'IterativeImputer', 'sample_posterior': True, 'initial_strategy': 'mean', 'imputation_order': 'arabic'}. Best is trial 68 with value: 11.864780781668479.
[I 2024-04-15 16:56:22,153] Trial 17 finished with value: 22.725469354869368 and parameters: {'model_name': 'IterativeImputer', 'sample_posterior': True, 'initial_strategy': 'constant', 'imputation_order': 'ascending'}. Best is trial 68 with value: 11.864780781668479.
[I 2024-04-15 16:56:26,260] Trial 58 finished with value: 26.42798418628408 and parameters: {'model_name': 'IterativeImputer', 'sample_posterior': True, 'initial_strategy': 'mean', 'imputation_order': 'arabic'}. Best is trial 68 with value: 11.864780781668479.
[I 2024-04-15 16:56:31,989] Trial 32 finished with value: 26.190978138778895 and parameters: {'model_name': 'IterativeImputer', 'sample_posterior': True, 'initial_strategy': 'most_frequent', 'imputation_order': 'arabic'}. Best is trial 68 with value: 11.864780781668479.
[I 2024-04-15 16:56:37,061] Trial 12 finished with value: 24.467947523301962 and parameters: {'model_name': 'IterativeImputer', 'sample_posterior': True, 'initial_strategy': 'mean', 'imputation_order': 'random'}. Best is trial 68 with value: 11.864780781668479.
[I 2024-04-15 16:56:45,100] Trial 53 finished with value: 24.919257226415457 and parameters: {'model_name': 'IterativeImputer', 'sample_posterior': True, 'initial_strategy': 'most_frequent', 'imputation_order': 'random'}. Best is trial 68 with value: 11.864780781668479.
[I 2024-04-15 16:56:48,304] Trial 35 finished with value: 25.14237049892468 and parameters: {'model_name': 'IterativeImputer', 'sample_posterior': True, 'initial_strategy': 'median', 'imputation_order': 'random'}. Best is trial 68 with value: 11.864780781668479.
[I 2024-04-15 16:56:52,893] Trial 49 finished with value: 19.06308232561161 and parameters: {'model_name': 'RandomForestImputer', 'max_iter': 7, 'decreasing': False, 'min_samples_split': 0.9, 'min_samples_leaf': 0.4, 'max_features': 0.4, 'warm_start': False}. Best is trial 68 with value: 11.864780781668479.
[I 2024-04-15 16:56:56,241] Trial 141 finished with value: 16.381778019424157 and parameters: {'model_name': 'GAIN', 'batch_size': 4, 'hint_rate': 0.32, 'alpha': 44, 'iterations': 52}. Best is trial 68 with value: 11.864780781668479.
[I 2024-04-15 16:57:08,414] Trial 114 finished with value: 14.37182499349095 and parameters: {'model_name': 'GAIN', 'batch_size': 5, 'hint_rate': 0.42000000000000004, 'alpha': 59, 'iterations': 83}. Best is trial 68 with value: 11.864780781668479.
[I 2024-04-15 16:57:12,810] Trial 145 finished with value: 16.14185669205882 and parameters: {'model_name': 'GAIN', 'batch_size': 3, 'hint_rate': 0.91, 'alpha': 11, 'iterations': 15}. Best is trial 68 with value: 11.864780781668479.
[I 2024-04-15 16:57:16,282] Trial 140 finished with value: 12.84536302864583 and parameters: {'model_name': 'GAIN', 'batch_size': 3, 'hint_rate': 0.76, 'alpha': 71, 'iterations': 57}. Best is trial 68 with value: 11.864780781668479.
[I 2024-04-15 16:57:21,941] Trial 64 finished with value: 24.215663746222518 and parameters: {'model_name': 'IterativeImputer', 'sample_posterior': True, 'initial_strategy': 'most_frequent', 'imputation_order': 'ascending'}. Best is trial 68 with value: 11.864780781668479.
[I 2024-04-15 16:57:25,436] Trial 146 finished with value: 17.965582587286946 and parameters: {'model_name': 'GAIN', 'batch_size': 3, 'hint_rate': 0.9, 'alpha': 15, 'iterations': 16}. Best is trial 68 with value: 11.864780781668479.
[I 2024-04-15 16:57:32,666] Trial 153 finished with value: 32.74070258634523 and parameters: {'model_name': 'RandomForestImputer', 'max_iter': 4, 'decreasing': True, 'min_samples_split': 0.5, 'min_samples_leaf': 0.1, 'max_features': 0.9, 'warm_start': True}. Best is trial 68 with value: 11.864780781668479.
[I 2024-04-15 16:57:35,787] Trial 138 finished with value: 13.932817989129921 and parameters: {'model_name': 'GAIN', 'batch_size': 4, 'hint_rate': 0.75, 'alpha': 70, 'iterations': 56}. Best is trial 68 with value: 11.864780781668479.
[I 2024-04-15 16:57:43,931] Trial 116 finished with value: 15.356014808655967 and parameters: {'model_name': 'GAIN', 'batch_size': 5, 'hint_rate': 0.41000000000000003, 'alpha': 67, 'iterations': 89}. Best is trial 68 with value: 11.864780781668479.
[I 2024-04-15 16:57:53,709] Trial 137 finished with value: 14.979318745469438 and parameters: {'model_name': 'GAIN', 'batch_size': 5, 'hint_rate': 0.9, 'alpha': 73, 'iterations': 63}. Best is trial 68 with value: 11.864780781668479.
[I 2024-04-15 16:58:00,701] Trial 150 finished with value: 14.065382964161875 and parameters: {'model_name': 'GAIN', 'batch_size': 3, 'hint_rate': 0.73, 'alpha': 14, 'iterations': 13}. Best is trial 68 with value: 11.864780781668479.
[I 2024-04-15 16:58:06,789] Trial 155 finished with value: 32.77531855371795 and parameters: {'model_name': 'RandomForestImputer', 'max_iter': 5, 'decreasing': True, 'min_samples_split': 0.5, 'min_samples_leaf': 0.2, 'max_features': 0.9, 'warm_start': True}. Best is trial 68 with value: 11.864780781668479.
[I 2024-04-15 16:58:10,365] Trial 154 finished with value: 32.758442443202156 and parameters: {'model_name': 'RandomForestImputer', 'max_iter': 5, 'decreasing': True, 'min_samples_split': 0.5, 'min_samples_leaf': 0.1, 'max_features': 0.9, 'warm_start': True}. Best is trial 68 with value: 11.864780781668479.
[I 2024-04-15 16:58:17,646] Trial 157 finished with value: 32.73514655479979 and parameters: {'model_name': 'RandomForestImputer', 'max_iter': 5, 'decreasing': True, 'min_samples_split': 0.5, 'min_samples_leaf': 0.1, 'max_features': 0.9, 'warm_start': True}. Best is trial 68 with value: 11.864780781668479.
[I 2024-04-15 16:58:23,745] Trial 65 finished with value: 25.307295663972376 and parameters: {'model_name': 'IterativeImputer', 'sample_posterior': True, 'initial_strategy': 'mean', 'imputation_order': 'ascending'}. Best is trial 68 with value: 11.864780781668479.
[I 2024-04-15 16:58:30,138] Trial 159 finished with value: 32.766377209480645 and parameters: {'model_name': 'RandomForestImputer', 'max_iter': 5, 'decreasing': True, 'min_samples_split': 0.5, 'min_samples_leaf': 0.1, 'max_features': 0.9, 'warm_start': True}. Best is trial 68 with value: 11.864780781668479.
[I 2024-04-15 16:58:41,910] Trial 171 finished with value: 16.050755841861594 and parameters: {'model_name': 'GAIN', 'batch_size': 10, 'hint_rate': 0.5800000000000001, 'alpha': 78, 'iterations': 12}. Best is trial 68 with value: 11.864780781668479.
[I 2024-04-15 16:58:46,094] Trial 133 finished with value: 13.376925249305467 and parameters: {'model_name': 'GAIN', 'batch_size': 5, 'hint_rate': 0.42000000000000004, 'alpha': 72, 'iterations': 74}. Best is trial 68 with value: 11.864780781668479.
[I 2024-04-15 16:58:56,170] Trial 175 finished with value: 15.46370281365444 and parameters: {'model_name': 'GAIN', 'batch_size': 10, 'hint_rate': 0.73, 'alpha': 76, 'iterations': 13}. Best is trial 68 with value: 11.864780781668479.
[I 2024-04-15 16:59:10,630] Trial 143 finished with value: 12.685699818893877 and parameters: {'model_name': 'GAIN', 'batch_size': 4, 'hint_rate': 0.9, 'alpha': 15, 'iterations': 51}. Best is trial 68 with value: 11.864780781668479.
[I 2024-04-15 16:59:34,442] Trial 173 finished with value: 16.20487652669477 and parameters: {'model_name': 'GAIN', 'batch_size': 10, 'hint_rate': 0.75, 'alpha': 75, 'iterations': 13}. Best is trial 68 with value: 11.864780781668479.
[I 2024-04-15 16:59:41,518] Trial 144 finished with value: 16.511494965932457 and parameters: {'model_name': 'GAIN', 'batch_size': 3, 'hint_rate': 0.7100000000000001, 'alpha': 13, 'iterations': 58}. Best is trial 68 with value: 11.864780781668479.
[I 2024-04-15 16:59:52,020] Trial 184 finished with value: 16.434269693486346 and parameters: {'model_name': 'GAIN', 'batch_size': 3, 'hint_rate': 0.72, 'alpha': 83, 'iterations': 12}. Best is trial 68 with value: 11.864780781668479.
[I 2024-04-15 16:59:59,968] Trial 131 finished with value: 15.396890883328783 and parameters: {'model_name': 'GAIN', 'batch_size': 5, 'hint_rate': 0.39, 'alpha': 72, 'iterations': 110}. Best is trial 68 with value: 11.864780781668479.
[I 2024-04-15 17:00:05,125] Trial 134 finished with value: 32.73673740838343 and parameters: {'model_name': 'RandomForestImputer', 'max_iter': 78, 'decreasing': True, 'min_samples_split': 1.0, 'min_samples_leaf': 0.1, 'max_features': 0.9, 'warm_start': True}. Best is trial 68 with value: 11.864780781668479.
[I 2024-04-15 17:00:09,107] Trial 142 finished with value: 14.256757028315144 and parameters: {'model_name': 'GAIN', 'batch_size': 4, 'hint_rate': 0.89, 'alpha': 14, 'iterations': 72}. Best is trial 68 with value: 11.864780781668479.
[I 2024-04-15 17:00:40,237] Trial 149 finished with value: 14.211761317921372 and parameters: {'model_name': 'GAIN', 'batch_size': 3, 'hint_rate': 0.75, 'alpha': 77, 'iterations': 71}. Best is trial 68 with value: 11.864780781668479.
[I 2024-04-15 17:00:57,635] Trial 148 finished with value: 14.455640093294145 and parameters: {'model_name': 'GAIN', 'batch_size': 3, 'hint_rate': 0.33, 'alpha': 14, 'iterations': 77}. Best is trial 68 with value: 11.864780781668479.
[I 2024-04-15 17:01:07,817] Trial 151 finished with value: 14.320021548551384 and parameters: {'model_name': 'GAIN', 'batch_size': 3, 'hint_rate': 0.76, 'alpha': 13, 'iterations': 74}. Best is trial 68 with value: 11.864780781668479.
[I 2024-04-15 17:01:25,275] Trial 127 finished with value: 16.613078770258173 and parameters: {'model_name': 'GAIN', 'batch_size': 5, 'hint_rate': 0.36000000000000004, 'alpha': 70, 'iterations': 158}. Best is trial 68 with value: 11.864780781668479.
[I 2024-04-15 17:01:46,442] Trial 166 finished with value: 11.99880097784643 and parameters: {'model_name': 'GAIN', 'batch_size': 8, 'hint_rate': 0.87, 'alpha': 83, 'iterations': 78}. Best is trial 68 with value: 11.864780781668479.
[I 2024-04-15 17:02:06,156] Trial 169 finished with value: 15.432912981613413 and parameters: {'model_name': 'GAIN', 'batch_size': 3, 'hint_rate': 0.89, 'alpha': 75, 'iterations': 85}. Best is trial 68 with value: 11.864780781668479.
[I 2024-04-15 17:02:15,696] Trial 196 finished with value: 14.70393028510173 and parameters: {'model_name': 'GAIN', 'batch_size': 3, 'hint_rate': 0.66, 'alpha': 6, 'iterations': 24}. Best is trial 68 with value: 11.864780781668479.
[I 2024-04-15 17:02:34,026] Trial 158 finished with value: 15.752005294399439 and parameters: {'model_name': 'GAIN', 'batch_size': 3, 'hint_rate': 0.9, 'alpha': 15, 'iterations': 108}. Best is trial 68 with value: 11.864780781668479.
[I 2024-04-15 17:02:44,612] Trial 160 finished with value: 16.036362361527633 and parameters: {'model_name': 'GAIN', 'batch_size': 3, 'hint_rate': 0.5800000000000001, 'alpha': 14, 'iterations': 108}. Best is trial 68 with value: 11.864780781668479.
[I 2024-04-15 17:02:53,106] Trial 165 finished with value: 16.20682697301028 and parameters: {'model_name': 'GAIN', 'batch_size': 13, 'hint_rate': 0.87, 'alpha': 80, 'iterations': 100}. Best is trial 68 with value: 11.864780781668479.
[I 2024-04-15 17:03:03,242] Trial 198 finished with value: 15.641459239666506 and parameters: {'model_name': 'GAIN', 'batch_size': 2, 'hint_rate': 0.79, 'alpha': 55, 'iterations': 26}. Best is trial 68 with value: 11.864780781668479.
[I 2024-04-15 17:03:08,760] Trial 199 finished with value: 13.626532939615611 and parameters: {'model_name': 'GAIN', 'batch_size': 2, 'hint_rate': 0.65, 'alpha': 5, 'iterations': 26}. Best is trial 68 with value: 11.864780781668479.
[I 2024-04-15 17:03:14,167] Trial 170 finished with value: 14.428498390208237 and parameters: {'model_name': 'GAIN', 'batch_size': 3, 'hint_rate': 0.34, 'alpha': 79, 'iterations': 106}. Best is trial 68 with value: 11.864780781668479.
[I 2024-04-15 17:03:23,875] Trial 163 finished with value: 16.092904327778065 and parameters: {'model_name': 'GAIN', 'batch_size': 10, 'hint_rate': 0.91, 'alpha': 79, 'iterations': 112}. Best is trial 68 with value: 11.864780781668479.
[I 2024-04-15 17:03:27,808] Trial 167 finished with value: 15.143904809306552 and parameters: {'model_name': 'GAIN', 'batch_size': 8, 'hint_rate': 0.88, 'alpha': 76, 'iterations': 108}. Best is trial 68 with value: 11.864780781668479.
[I 2024-04-15 17:03:35,304] Trial 176 finished with value: 15.423360064613046 and parameters: {'model_name': 'GAIN', 'batch_size': 8, 'hint_rate': 0.77, 'alpha': 83, 'iterations': 94}. Best is trial 68 with value: 11.864780781668479.
[I 2024-04-15 17:03:40,241] Trial 168 finished with value: 12.514321070432084 and parameters: {'model_name': 'GAIN', 'batch_size': 3, 'hint_rate': 0.9, 'alpha': 79, 'iterations': 119}. Best is trial 68 with value: 11.864780781668479.
[I 2024-04-15 17:03:45,234] Trial 177 finished with value: 14.804213040701935 and parameters: {'model_name': 'GAIN', 'batch_size': 3, 'hint_rate': 0.75, 'alpha': 79, 'iterations': 99}. Best is trial 68 with value: 11.864780781668479.
[I 2024-04-15 17:03:48,878] Trial 161 finished with value: 13.894956496556649 and parameters: {'model_name': 'GAIN', 'batch_size': 3, 'hint_rate': 0.88, 'alpha': 80, 'iterations': 110}. Best is trial 68 with value: 11.864780781668479.
[I 2024-04-15 17:03:54,959] Trial 172 finished with value: 12.926953292740347 and parameters: {'model_name': 'GAIN', 'batch_size': 3, 'hint_rate': 0.88, 'alpha': 11, 'iterations': 105}. Best is trial 68 with value: 11.864780781668479.
[I 2024-04-15 17:04:00,118] Trial 178 finished with value: 14.382421113700525 and parameters: {'model_name': 'GAIN', 'batch_size': 9, 'hint_rate': 0.72, 'alpha': 77, 'iterations': 100}. Best is trial 68 with value: 11.864780781668479.
[I 2024-04-15 17:04:08,059] Trial 46 finished with value: 17.363799247141532 and parameters: {'model_name': 'GAIN', 'batch_size': 1, 'hint_rate': 0.13, 'alpha': 55, 'iterations': 323}. Best is trial 68 with value: 11.864780781668479.
[I 2024-04-15 17:04:11,653] Trial 182 finished with value: 15.842143727175955 and parameters: {'model_name': 'GAIN', 'batch_size': 3, 'hint_rate': 0.72, 'alpha': 90, 'iterations': 108}. Best is trial 68 with value: 11.864780781668479.
[I 2024-04-15 17:04:16,119] Trial 156 finished with value: 19.2203042432899 and parameters: {'model_name': 'RandomForestImputer', 'max_iter': 4, 'decreasing': True, 'min_samples_split': 0.5, 'min_samples_leaf': 0.1, 'max_features': 0.9, 'warm_start': False}. Best is trial 68 with value: 11.864780781668479.
[I 2024-04-15 17:04:22,111] Trial 185 finished with value: 13.490294385292064 and parameters: {'model_name': 'GAIN', 'batch_size': 3, 'hint_rate': 0.7100000000000001, 'alpha': 81, 'iterations': 109}. Best is trial 68 with value: 11.864780781668479.
[I 2024-04-15 17:04:32,194] Trial 187 finished with value: 14.135133125117477 and parameters: {'model_name': 'GAIN', 'batch_size': 3, 'hint_rate': 0.72, 'alpha': 55, 'iterations': 108}. Best is trial 68 with value: 11.864780781668479.
[I 2024-04-15 17:04:35,177] Trial 179 finished with value: 13.742531396413245 and parameters: {'model_name': 'GAIN', 'batch_size': 3, 'hint_rate': 0.76, 'alpha': 80, 'iterations': 113}. Best is trial 68 with value: 11.864780781668479.
