[I 2024-02-29 15:06:47,928] Trial 21 finished with value: 23.03335997279356 and parameters: {'model_name': 'SimpleImputer', 'strategy': 'constant'}. Best is trial 21 with value: 23.03335997279356.
[I 2024-02-29 15:06:49,059] Trial 14 finished with value: 23.03335997279356 and parameters: {'model_name': 'SimpleImputer', 'strategy': 'constant'}. Best is trial 21 with value: 23.03335997279356.
[I 2024-02-29 15:06:49,785] Trial 23 finished with value: 23.03335997279356 and parameters: {'model_name': 'SimpleImputer', 'strategy': 'constant'}. Best is trial 21 with value: 23.03335997279356.
[I 2024-02-29 15:06:50,493] Trial 18 finished with value: 23.03335997279356 and parameters: {'model_name': 'SimpleImputer', 'strategy': 'constant'}. Best is trial 21 with value: 23.03335997279356.
[I 2024-02-29 15:06:52,658] Trial 7 finished with value: 6.105847551979725 and parameters: {'model_name': 'SimpleImputer', 'strategy': 'median'}. Best is trial 7 with value: 6.105847551979725.
[I 2024-02-29 15:06:54,515] Trial 44 finished with value: 8.605524315720954 and parameters: {'model_name': 'SimpleImputer', 'strategy': 'mean'}. Best is trial 7 with value: 6.105847551979725.
[I 2024-02-29 15:06:55,276] Trial 28 finished with value: 6.105847551979725 and parameters: {'model_name': 'SimpleImputer', 'strategy': 'median'}. Best is trial 7 with value: 6.105847551979725.
[I 2024-02-29 15:06:56,685] Trial 26 finished with value: 6.105847551979725 and parameters: {'model_name': 'SimpleImputer', 'strategy': 'median'}. Best is trial 7 with value: 6.105847551979725.
[I 2024-02-29 15:06:58,186] Trial 24 finished with value: 6.105847551979725 and parameters: {'model_name': 'SimpleImputer', 'strategy': 'median'}. Best is trial 7 with value: 6.105847551979725.
2024-02-29 15:07:03.455425: E external/local_xla/xla/stream_executor/cuda/cuda_driver.cc:274] failed call to cuInit: CUDA_ERROR_NO_DEVICE: no CUDA-capable device is detected
2024-02-29 15:07:03.863349: I tensorflow/compiler/mlir/mlir_graph_optimization_pass.cc:388] MLIR V1 optimization pass is not enabled
[I 2024-02-29 15:07:20,004] Trial 8 finished with value: 23.03195297873517 and parameters: {'model_name': 'SimpleImputer', 'strategy': 'most_frequent'}. Best is trial 7 with value: 6.105847551979725.
[I 2024-02-29 15:07:22,704] Trial 5 finished with value: 23.03195297873517 and parameters: {'model_name': 'SimpleImputer', 'strategy': 'most_frequent'}. Best is trial 7 with value: 6.105847551979725.
[I 2024-02-29 15:07:26,566] Trial 43 finished with value: 23.03195297873517 and parameters: {'model_name': 'SimpleImputer', 'strategy': 'most_frequent'}. Best is trial 7 with value: 6.105847551979725.
[I 2024-02-29 15:08:55,949] Trial 29 finished with value: 9.979182623997636 and parameters: {'model_name': 'KNNImputer', 'weights': 'uniform', 'keep_empty_features': False}. Best is trial 7 with value: 6.105847551979725.
[I 2024-02-29 15:08:58,258] Trial 2 finished with value: 9.979182623997636 and parameters: {'model_name': 'KNNImputer', 'weights': 'uniform', 'keep_empty_features': False}. Best is trial 7 with value: 6.105847551979725.
[I 2024-02-29 15:09:00,564] Trial 33 finished with value: 9.979182623997636 and parameters: {'model_name': 'KNNImputer', 'weights': 'uniform', 'keep_empty_features': False}. Best is trial 7 with value: 6.105847551979725.
[I 2024-02-29 15:09:05,302] Trial 10 finished with value: 10.936836699356046 and parameters: {'model_name': 'KNNImputer', 'weights': 'distance', 'keep_empty_features': False}. Best is trial 7 with value: 6.105847551979725.
[I 2024-02-29 15:09:06,357] Trial 17 finished with value: 10.936836699356046 and parameters: {'model_name': 'KNNImputer', 'weights': 'distance', 'keep_empty_features': False}. Best is trial 7 with value: 6.105847551979725.
[I 2024-02-29 15:09:07,775] Trial 35 finished with value: 10.936836699356046 and parameters: {'model_name': 'KNNImputer', 'weights': 'distance', 'keep_empty_features': False}. Best is trial 7 with value: 6.105847551979725.
[I 2024-02-29 15:09:09,787] Trial 31 finished with value: 10.936836699356046 and parameters: {'model_name': 'KNNImputer', 'weights': 'distance', 'keep_empty_features': False}. Best is trial 7 with value: 6.105847551979725.
[I 2024-02-29 15:09:11,336] Trial 55 finished with value: 9.979182623997636 and parameters: {'model_name': 'KNNImputer', 'weights': 'uniform', 'keep_empty_features': False}. Best is trial 7 with value: 6.105847551979725.
[I 2024-02-29 15:09:14,867] Trial 42 finished with value: 10.936836699356046 and parameters: {'model_name': 'KNNImputer', 'weights': 'distance', 'keep_empty_features': False}. Best is trial 7 with value: 6.105847551979725.
[I 2024-02-29 15:09:37,373] Trial 58 finished with value: 10.936836699356046 and parameters: {'model_name': 'KNNImputer', 'weights': 'distance', 'keep_empty_features': False}. Best is trial 7 with value: 6.105847551979725.
[I 2024-02-29 15:10:09,649] Trial 50 finished with value: 9.975575292930467 and parameters: {'model_name': 'GAIN', 'batch_size': 1, 'hint_rate': 0.9500000000000001, 'alpha': 68, 'iterations': 1}. Best is trial 7 with value: 6.105847551979725.
[I 2024-02-29 15:10:11,731] Trial 30 finished with value: 8.912507092666992 and parameters: {'model_name': 'GAIN', 'batch_size': 12, 'hint_rate': 0.3, 'alpha': 55, 'iterations': 2}. Best is trial 7 with value: 6.105847551979725.
[I 2024-02-29 15:10:20,858] Trial 49 finished with value: 10.92610833579083 and parameters: {'model_name': 'GAIN', 'batch_size': 1, 'hint_rate': 0.2, 'alpha': 14, 'iterations': 2}. Best is trial 7 with value: 6.105847551979725.
[I 2024-02-29 15:10:22,588] Trial 1 finished with value: 9.114116553571098 and parameters: {'model_name': 'GAIN', 'batch_size': 249, 'hint_rate': 0.29000000000000004, 'alpha': 76, 'iterations': 3}. Best is trial 7 with value: 6.105847551979725.
[I 2024-02-29 15:10:26,236] Trial 13 finished with value: 8.981961637961756 and parameters: {'model_name': 'GAIN', 'batch_size': 3, 'hint_rate': 0.65, 'alpha': 17, 'iterations': 5}. Best is trial 7 with value: 6.105847551979725.
[I 2024-02-29 15:10:37,831] Trial 59 finished with value: 9.63457916753167 and parameters: {'model_name': 'GAIN', 'batch_size': 4, 'hint_rate': 0.68, 'alpha': 76, 'iterations': 2}. Best is trial 7 with value: 6.105847551979725.
[I 2024-02-29 15:10:50,267] Trial 19 finished with value: 9.551032305845023 and parameters: {'model_name': 'GAIN', 'batch_size': 3, 'hint_rate': 0.91, 'alpha': 7, 'iterations': 13}. Best is trial 7 with value: 6.105847551979725.
[I 2024-02-29 15:11:12,921] Trial 57 finished with value: 9.272161117606371 and parameters: {'model_name': 'GAIN', 'batch_size': 18, 'hint_rate': 0.46, 'alpha': 74, 'iterations': 11}. Best is trial 7 with value: 6.105847551979725.
[I 2024-02-29 15:12:47,112] Trial 32 finished with value: 8.585789337207904 and parameters: {'model_name': 'IterativeImputer', 'sample_posterior': False, 'initial_strategy': 'mean', 'imputation_order': 'descending'}. Best is trial 7 with value: 6.105847551979725.
[I 2024-02-29 15:12:49,766] Trial 45 finished with value: 8.585789337207904 and parameters: {'model_name': 'IterativeImputer', 'sample_posterior': False, 'initial_strategy': 'mean', 'imputation_order': 'descending'}. Best is trial 7 with value: 6.105847551979725.
[I 2024-02-29 15:13:00,822] Trial 39 finished with value: 8.585787397496068 and parameters: {'model_name': 'IterativeImputer', 'sample_posterior': False, 'initial_strategy': 'mean', 'imputation_order': 'ascending'}. Best is trial 7 with value: 6.105847551979725.
[I 2024-02-29 15:13:04,128] Trial 48 finished with value: 8.585792532201904 and parameters: {'model_name': 'IterativeImputer', 'sample_posterior': False, 'initial_strategy': 'mean', 'imputation_order': 'random'}. Best is trial 7 with value: 6.105847551979725.
[I 2024-02-29 15:13:06,578] Trial 80 finished with value: 6.105847551979725 and parameters: {'model_name': 'SimpleImputer', 'strategy': 'median'}. Best is trial 7 with value: 6.105847551979725.
[I 2024-02-29 15:13:49,316] Trial 12 finished with value: 8.605524315720954 and parameters: {'model_name': 'RandomForestImputer', 'max_iter': 1, 'decreasing': True, 'min_samples_split': 0.1, 'min_samples_leaf': 0.1, 'max_features': 0.5, 'warm_start': False}. Best is trial 7 with value: 6.105847551979725.
[I 2024-02-29 15:13:54,609] Trial 51 finished with value: 27.71754235199745 and parameters: {'model_name': 'RandomForestImputer', 'max_iter': 4, 'decreasing': True, 'min_samples_split': 0.4, 'min_samples_leaf': 0.1, 'max_features': 0.8, 'warm_start': True}. Best is trial 7 with value: 6.105847551979725.
[I 2024-02-29 15:13:59,519] Trial 84 finished with value: 6.105847551979725 and parameters: {'model_name': 'SimpleImputer', 'strategy': 'median'}. Best is trial 7 with value: 6.105847551979725.
[I 2024-02-29 15:14:04,364] Trial 85 finished with value: 6.105847551979725 and parameters: {'model_name': 'SimpleImputer', 'strategy': 'median'}. Best is trial 7 with value: 6.105847551979725.
[I 2024-02-29 15:14:08,900] Trial 86 finished with value: 6.105847551979725 and parameters: {'model_name': 'SimpleImputer', 'strategy': 'median'}. Best is trial 7 with value: 6.105847551979725.
[I 2024-02-29 15:14:16,702] Trial 69 finished with value: 8.585789337207904 and parameters: {'model_name': 'IterativeImputer', 'sample_posterior': False, 'initial_strategy': 'mean', 'imputation_order': 'descending'}. Best is trial 7 with value: 6.105847551979725.
[I 2024-02-29 15:14:21,061] Trial 88 finished with value: 6.105847551979725 and parameters: {'model_name': 'SimpleImputer', 'strategy': 'median'}. Best is trial 7 with value: 6.105847551979725.
[I 2024-02-29 15:14:22,896] Trial 25 finished with value: 8.58581326159895 and parameters: {'model_name': 'IterativeImputer', 'sample_posterior': False, 'initial_strategy': 'constant', 'imputation_order': 'ascending'}. Best is trial 7 with value: 6.105847551979725.
[I 2024-02-29 15:14:26,852] Trial 89 finished with value: 6.105847551979725 and parameters: {'model_name': 'SimpleImputer', 'strategy': 'median'}. Best is trial 7 with value: 6.105847551979725.
[I 2024-02-29 15:14:28,693] Trial 90 finished with value: 6.105847551979725 and parameters: {'model_name': 'SimpleImputer', 'strategy': 'median'}. Best is trial 7 with value: 6.105847551979725.
[I 2024-02-29 15:14:31,750] Trial 56 finished with value: 8.585817998015319 and parameters: {'model_name': 'IterativeImputer', 'sample_posterior': False, 'initial_strategy': 'median', 'imputation_order': 'random'}. Best is trial 7 with value: 6.105847551979725.
[I 2024-02-29 15:14:33,278] Trial 91 finished with value: 6.105847551979725 and parameters: {'model_name': 'SimpleImputer', 'strategy': 'median'}. Best is trial 7 with value: 6.105847551979725.
[I 2024-02-29 15:14:34,826] Trial 15 finished with value: 8.585804912134602 and parameters: {'model_name': 'IterativeImputer', 'sample_posterior': False, 'initial_strategy': 'most_frequent', 'imputation_order': 'ascending'}. Best is trial 7 with value: 6.105847551979725.
[I 2024-02-29 15:14:36,511] Trial 92 finished with value: 6.105847551979725 and parameters: {'model_name': 'SimpleImputer', 'strategy': 'median'}. Best is trial 7 with value: 6.105847551979725.
[I 2024-02-29 15:14:39,585] Trial 93 finished with value: 6.105847551979725 and parameters: {'model_name': 'SimpleImputer', 'strategy': 'median'}. Best is trial 7 with value: 6.105847551979725.
[I 2024-02-29 15:15:03,258] Trial 74 finished with value: 8.585789337207904 and parameters: {'model_name': 'IterativeImputer', 'sample_posterior': False, 'initial_strategy': 'mean', 'imputation_order': 'descending'}. Best is trial 7 with value: 6.105847551979725.
[I 2024-02-29 15:15:07,291] Trial 98 finished with value: 6.105847551979725 and parameters: {'model_name': 'SimpleImputer', 'strategy': 'median'}. Best is trial 7 with value: 6.105847551979725.
[I 2024-02-29 15:15:24,767] Trial 60 finished with value: 8.585778301487915 and parameters: {'model_name': 'IterativeImputer', 'sample_posterior': False, 'initial_strategy': 'constant', 'imputation_order': 'roman'}. Best is trial 7 with value: 6.105847551979725.
[I 2024-02-29 15:15:57,889] Trial 72 finished with value: 8.585797991392093 and parameters: {'model_name': 'IterativeImputer', 'sample_posterior': False, 'initial_strategy': 'most_frequent', 'imputation_order': 'descending'}. Best is trial 7 with value: 6.105847551979725.
[I 2024-02-29 15:16:01,892] Trial 101 finished with value: 6.105847551979725 and parameters: {'model_name': 'SimpleImputer', 'strategy': 'median'}. Best is trial 7 with value: 6.105847551979725.
[I 2024-02-29 15:16:12,518] Trial 70 finished with value: 8.585775192599268 and parameters: {'model_name': 'IterativeImputer', 'sample_posterior': False, 'initial_strategy': 'median', 'imputation_order': 'roman'}. Best is trial 7 with value: 6.105847551979725.
[I 2024-02-29 15:16:16,715] Trial 103 finished with value: 6.105847551979725 and parameters: {'model_name': 'SimpleImputer', 'strategy': 'median'}. Best is trial 7 with value: 6.105847551979725.
[I 2024-02-29 15:16:20,277] Trial 104 finished with value: 6.105847551979725 and parameters: {'model_name': 'SimpleImputer', 'strategy': 'median'}. Best is trial 7 with value: 6.105847551979725.
[I 2024-02-29 15:16:30,877] Trial 75 finished with value: 8.585778301487915 and parameters: {'model_name': 'IterativeImputer', 'sample_posterior': False, 'initial_strategy': 'constant', 'imputation_order': 'roman'}. Best is trial 7 with value: 6.105847551979725.
[I 2024-02-29 15:16:33,014] Trial 20 finished with value: 27.681950725586184 and parameters: {'model_name': 'RandomForestImputer', 'max_iter': 10, 'decreasing': True, 'min_samples_split': 0.30000000000000004, 'min_samples_leaf': 0.30000000000000004, 'max_features': 0.6, 'warm_start': True}. Best is trial 7 with value: 6.105847551979725.
[I 2024-02-29 15:17:52,163] Trial 79 finished with value: 8.605524315720954 and parameters: {'model_name': 'RandomForestImputer', 'max_iter': 1, 'decreasing': True, 'min_samples_split': 0.1, 'min_samples_leaf': 0.9, 'max_features': 0.1, 'warm_start': False}. Best is trial 7 with value: 6.105847551979725.
[I 2024-02-29 15:17:56,690] Trial 108 finished with value: 6.105847551979725 and parameters: {'model_name': 'SimpleImputer', 'strategy': 'median'}. Best is trial 7 with value: 6.105847551979725.
[I 2024-02-29 15:18:01,336] Trial 109 finished with value: 6.105847551979725 and parameters: {'model_name': 'SimpleImputer', 'strategy': 'median'}. Best is trial 7 with value: 6.105847551979725.
[I 2024-02-29 15:18:05,076] Trial 110 finished with value: 6.105847551979725 and parameters: {'model_name': 'SimpleImputer', 'strategy': 'median'}. Best is trial 7 with value: 6.105847551979725.
[I 2024-02-29 15:18:08,421] Trial 111 finished with value: 8.605524315720954 and parameters: {'model_name': 'SimpleImputer', 'strategy': 'mean'}. Best is trial 7 with value: 6.105847551979725.
[I 2024-02-29 15:18:11,945] Trial 112 finished with value: 6.105847551979725 and parameters: {'model_name': 'SimpleImputer', 'strategy': 'median'}. Best is trial 7 with value: 6.105847551979725.
[I 2024-02-29 15:18:15,577] Trial 113 finished with value: 6.105847551979725 and parameters: {'model_name': 'SimpleImputer', 'strategy': 'median'}. Best is trial 7 with value: 6.105847551979725.
[I 2024-02-29 15:18:19,017] Trial 114 finished with value: 6.105847551979725 and parameters: {'model_name': 'SimpleImputer', 'strategy': 'median'}. Best is trial 7 with value: 6.105847551979725.
[I 2024-02-29 15:18:22,941] Trial 115 finished with value: 6.105847551979725 and parameters: {'model_name': 'SimpleImputer', 'strategy': 'median'}. Best is trial 7 with value: 6.105847551979725.
[I 2024-02-29 15:21:31,266] Trial 54 finished with value: 27.64719141584758 and parameters: {'model_name': 'RandomForestImputer', 'max_iter': 41, 'decreasing': True, 'min_samples_split': 0.5, 'min_samples_leaf': 0.4, 'max_features': 0.5, 'warm_start': True}. Best is trial 7 with value: 6.105847551979725.
[I 2024-02-29 15:21:34,794] Trial 117 finished with value: 6.105847551979725 and parameters: {'model_name': 'SimpleImputer', 'strategy': 'median'}. Best is trial 7 with value: 6.105847551979725.
[I 2024-02-29 15:21:38,434] Trial 118 finished with value: 6.105847551979725 and parameters: {'model_name': 'SimpleImputer', 'strategy': 'median'}. Best is trial 7 with value: 6.105847551979725.
[I 2024-02-29 15:21:41,723] Trial 119 finished with value: 6.105847551979725 and parameters: {'model_name': 'SimpleImputer', 'strategy': 'median'}. Best is trial 7 with value: 6.105847551979725.
[I 2024-02-29 15:21:50,346] Trial 120 finished with value: 23.03195297873517 and parameters: {'model_name': 'SimpleImputer', 'strategy': 'most_frequent'}. Best is trial 7 with value: 6.105847551979725.
[I 2024-02-29 15:21:53,704] Trial 121 finished with value: 6.105847551979725 and parameters: {'model_name': 'SimpleImputer', 'strategy': 'median'}. Best is trial 7 with value: 6.105847551979725.
[I 2024-02-29 15:21:57,138] Trial 122 finished with value: 6.105847551979725 and parameters: {'model_name': 'SimpleImputer', 'strategy': 'median'}. Best is trial 7 with value: 6.105847551979725.
[I 2024-02-29 15:22:00,580] Trial 123 finished with value: 6.105847551979725 and parameters: {'model_name': 'SimpleImputer', 'strategy': 'median'}. Best is trial 7 with value: 6.105847551979725.
[I 2024-02-29 15:22:02,948] Trial 124 finished with value: 8.605524315720954 and parameters: {'model_name': 'SimpleImputer', 'strategy': 'mean'}. Best is trial 7 with value: 6.105847551979725.
[I 2024-02-29 15:24:56,175] Trial 61 finished with value: 27.645493488552574 and parameters: {'model_name': 'RandomForestImputer', 'max_iter': 78, 'decreasing': True, 'min_samples_split': 0.30000000000000004, 'min_samples_leaf': 0.9, 'max_features': 0.2, 'warm_start': True}. Best is trial 7 with value: 6.105847551979725.
[I 2024-02-29 15:24:58,274] Trial 126 finished with value: 23.03335997279356 and parameters: {'model_name': 'SimpleImputer', 'strategy': 'constant'}. Best is trial 7 with value: 6.105847551979725.
[I 2024-02-29 15:25:07,977] Trial 127 finished with value: 23.03195297873517 and parameters: {'model_name': 'SimpleImputer', 'strategy': 'most_frequent'}. Best is trial 7 with value: 6.105847551979725.
[I 2024-02-29 15:25:10,770] Trial 128 finished with value: 6.105847551979725 and parameters: {'model_name': 'SimpleImputer', 'strategy': 'median'}. Best is trial 7 with value: 6.105847551979725.
[I 2024-02-29 15:25:14,337] Trial 129 finished with value: 6.105847551979725 and parameters: {'model_name': 'SimpleImputer', 'strategy': 'median'}. Best is trial 7 with value: 6.105847551979725.
[I 2024-02-29 15:25:17,631] Trial 130 finished with value: 6.105847551979725 and parameters: {'model_name': 'SimpleImputer', 'strategy': 'median'}. Best is trial 7 with value: 6.105847551979725.
[I 2024-02-29 15:25:20,862] Trial 131 finished with value: 6.105847551979725 and parameters: {'model_name': 'SimpleImputer', 'strategy': 'median'}. Best is trial 7 with value: 6.105847551979725.
[I 2024-02-29 15:25:24,954] Trial 132 finished with value: 6.105847551979725 and parameters: {'model_name': 'SimpleImputer', 'strategy': 'median'}. Best is trial 7 with value: 6.105847551979725.
[I 2024-02-29 15:26:47,975] Trial 52 finished with value: 8.660276166787792 and parameters: {'model_name': 'RandomForestImputer', 'max_iter': 5, 'decreasing': True, 'min_samples_split': 0.9, 'min_samples_leaf': 0.4, 'max_features': 0.9, 'warm_start': False}. Best is trial 7 with value: 6.105847551979725.
[I 2024-02-29 15:26:50,270] Trial 134 finished with value: 23.03335997279356 and parameters: {'model_name': 'SimpleImputer', 'strategy': 'constant'}. Best is trial 7 with value: 6.105847551979725.
[I 2024-02-29 15:27:27,631] Trial 82 finished with value: 27.650002934584798 and parameters: {'model_name': 'RandomForestImputer', 'max_iter': 80, 'decreasing': True, 'min_samples_split': 0.5, 'min_samples_leaf': 0.7000000000000001, 'max_features': 0.8, 'warm_start': True}. Best is trial 7 with value: 6.105847551979725.
[I 2024-02-29 15:28:03,815] Trial 77 finished with value: 27.63811203903549 and parameters: {'model_name': 'RandomForestImputer', 'max_iter': 84, 'decreasing': True, 'min_samples_split': 0.2, 'min_samples_leaf': 0.4, 'max_features': 0.9, 'warm_start': True}. Best is trial 7 with value: 6.105847551979725.
[I 2024-02-29 15:28:40,066] Trial 96 finished with value: 28.456172121104704 and parameters: {'model_name': 'RandomForestImputer', 'max_iter': 83, 'decreasing': False, 'min_samples_split': 1.0, 'min_samples_leaf': 0.9, 'max_features': 0.1, 'warm_start': True}. Best is trial 7 with value: 6.105847551979725.
[I 2024-02-29 15:28:43,272] Trial 138 finished with value: 6.105847551979725 and parameters: {'model_name': 'SimpleImputer', 'strategy': 'median'}. Best is trial 7 with value: 6.105847551979725.
[I 2024-02-29 15:28:46,755] Trial 139 finished with value: 6.105847551979725 and parameters: {'model_name': 'SimpleImputer', 'strategy': 'median'}. Best is trial 7 with value: 6.105847551979725.
[I 2024-02-29 15:29:03,698] Trial 99 finished with value: 28.473745320750663 and parameters: {'model_name': 'RandomForestImputer', 'max_iter': 83, 'decreasing': False, 'min_samples_split': 1.0, 'min_samples_leaf': 0.9, 'max_features': 0.2, 'warm_start': True}. Best is trial 7 with value: 6.105847551979725.
[I 2024-02-29 15:29:20,325] Trial 81 finished with value: 27.659206294678626 and parameters: {'model_name': 'RandomForestImputer', 'max_iter': 38, 'decreasing': True, 'min_samples_split': 1.0, 'min_samples_leaf': 0.30000000000000004, 'max_features': 0.2, 'warm_start': True}. Best is trial 7 with value: 6.105847551979725.
