[I 2024-01-04 01:50:44,056] Trial 80 finished with value: 5947238.951130796 and parameters: {'model_name': 'SimpleImputer', 'strategy': 'most_frequent'}. Best is trial 7 with value: 2926408.6707950537.
[I 2024-01-04 01:50:44,450] Trial 113 finished with value: 2926408.6707950537 and parameters: {'model_name': 'SimpleImputer', 'strategy': 'mean'}. Best is trial 7 with value: 2926408.6707950537.
[I 2024-01-04 01:50:44,955] Trial 87 finished with value: 5947238.951130796 and parameters: {'model_name': 'SimpleImputer', 'strategy': 'most_frequent'}. Best is trial 7 with value: 2926408.6707950537.
[I 2024-01-04 01:50:45,134] Trial 114 finished with value: 2926408.6707950537 and parameters: {'model_name': 'SimpleImputer', 'strategy': 'mean'}. Best is trial 7 with value: 2926408.6707950537.
[I 2024-01-04 01:50:45,434] Trial 83 finished with value: 5947238.951130796 and parameters: {'model_name': 'SimpleImputer', 'strategy': 'most_frequent'}. Best is trial 7 with value: 2926408.6707950537.
[I 2024-01-04 01:50:45,731] Trial 116 finished with value: 2926408.6707950537 and parameters: {'model_name': 'SimpleImputer', 'strategy': 'mean'}. Best is trial 7 with value: 2926408.6707950537.
[I 2024-01-04 01:50:45,947] Trial 115 finished with value: 2926408.6707950537 and parameters: {'model_name': 'SimpleImputer', 'strategy': 'mean'}. Best is trial 7 with value: 2926408.6707950537.
[I 2024-01-04 01:50:46,223] Trial 82 finished with value: 5947238.951130796 and parameters: {'model_name': 'SimpleImputer', 'strategy': 'most_frequent'}. Best is trial 7 with value: 2926408.6707950537.
[I 2024-01-04 01:50:46,595] Trial 81 finished with value: 5947238.951130796 and parameters: {'model_name': 'SimpleImputer', 'strategy': 'most_frequent'}. Best is trial 7 with value: 2926408.6707950537.
[I 2024-01-04 01:50:47,165] Trial 118 finished with value: 2926408.6707950537 and parameters: {'model_name': 'SimpleImputer', 'strategy': 'mean'}. Best is trial 7 with value: 2926408.6707950537.
[I 2024-01-04 01:50:47,349] Trial 117 finished with value: 2926408.6707950537 and parameters: {'model_name': 'SimpleImputer', 'strategy': 'mean'}. Best is trial 7 with value: 2926408.6707950537.
[I 2024-01-04 01:50:47,615] Trial 120 finished with value: 2926408.6707950537 and parameters: {'model_name': 'SimpleImputer', 'strategy': 'mean'}. Best is trial 7 with value: 2926408.6707950537.
[I 2024-01-04 01:50:47,926] Trial 85 finished with value: 5947238.951130796 and parameters: {'model_name': 'SimpleImputer', 'strategy': 'most_frequent'}. Best is trial 7 with value: 2926408.6707950537.
[I 2024-01-04 01:50:48,201] Trial 121 finished with value: 2926408.6707950537 and parameters: {'model_name': 'SimpleImputer', 'strategy': 'mean'}. Best is trial 7 with value: 2926408.6707950537.
[I 2024-01-04 01:50:48,466] Trial 119 finished with value: 2926408.6707950537 and parameters: {'model_name': 'SimpleImputer', 'strategy': 'mean'}. Best is trial 7 with value: 2926408.6707950537.
[I 2024-01-04 01:50:48,735] Trial 90 finished with value: 5947238.951130796 and parameters: {'model_name': 'SimpleImputer', 'strategy': 'most_frequent'}. Best is trial 7 with value: 2926408.6707950537.
[I 2024-01-04 01:50:49,000] Trial 123 finished with value: 2926408.6707950537 and parameters: {'model_name': 'SimpleImputer', 'strategy': 'mean'}. Best is trial 7 with value: 2926408.6707950537.
[I 2024-01-04 01:50:49,253] Trial 124 finished with value: 2926408.6707950537 and parameters: {'model_name': 'SimpleImputer', 'strategy': 'mean'}. Best is trial 7 with value: 2926408.6707950537.
[I 2024-01-04 01:50:49,504] Trial 125 finished with value: 2926408.6707950537 and parameters: {'model_name': 'SimpleImputer', 'strategy': 'mean'}. Best is trial 7 with value: 2926408.6707950537.
[I 2024-01-04 01:50:49,879] Trial 126 finished with value: 2926408.6707950537 and parameters: {'model_name': 'SimpleImputer', 'strategy': 'mean'}. Best is trial 7 with value: 2926408.6707950537.
[I 2024-01-04 01:50:50,061] Trial 88 finished with value: 5947238.951130796 and parameters: {'model_name': 'SimpleImputer', 'strategy': 'most_frequent'}. Best is trial 7 with value: 2926408.6707950537.
[I 2024-01-04 01:50:50,349] Trial 86 finished with value: 5947238.951130796 and parameters: {'model_name': 'SimpleImputer', 'strategy': 'most_frequent'}. Best is trial 7 with value: 2926408.6707950537.
[I 2024-01-04 01:50:50,606] Trial 122 finished with value: 2926408.6707950537 and parameters: {'model_name': 'SimpleImputer', 'strategy': 'mean'}. Best is trial 7 with value: 2926408.6707950537.
[I 2024-01-04 01:50:50,871] Trial 129 finished with value: 2926408.6707950537 and parameters: {'model_name': 'SimpleImputer', 'strategy': 'mean'}. Best is trial 7 with value: 2926408.6707950537.
[I 2024-01-04 01:50:51,177] Trial 127 finished with value: 2926408.6707950537 and parameters: {'model_name': 'SimpleImputer', 'strategy': 'mean'}. Best is trial 7 with value: 2926408.6707950537.
[I 2024-01-04 01:50:51,623] Trial 132 finished with value: 2926408.6707950537 and parameters: {'model_name': 'SimpleImputer', 'strategy': 'mean'}. Best is trial 7 with value: 2926408.6707950537.
[I 2024-01-04 01:50:51,821] Trial 128 finished with value: 2926408.6707950537 and parameters: {'model_name': 'SimpleImputer', 'strategy': 'mean'}. Best is trial 7 with value: 2926408.6707950537.
[I 2024-01-04 01:50:52,153] Trial 131 finished with value: 2926408.6707950537 and parameters: {'model_name': 'SimpleImputer', 'strategy': 'mean'}. Best is trial 7 with value: 2926408.6707950537.
[I 2024-01-04 01:50:52,424] Trial 130 finished with value: 2926408.6707950537 and parameters: {'model_name': 'SimpleImputer', 'strategy': 'mean'}. Best is trial 7 with value: 2926408.6707950537.
[I 2024-01-04 01:50:52,703] Trial 91 finished with value: 5947238.951130796 and parameters: {'model_name': 'SimpleImputer', 'strategy': 'most_frequent'}. Best is trial 7 with value: 2926408.6707950537.
[I 2024-01-04 01:50:52,938] Trial 137 finished with value: 2926408.6707950537 and parameters: {'model_name': 'SimpleImputer', 'strategy': 'mean'}. Best is trial 7 with value: 2926408.6707950537.
[I 2024-01-04 01:50:53,270] Trial 135 finished with value: 2926408.6707950537 and parameters: {'model_name': 'SimpleImputer', 'strategy': 'mean'}. Best is trial 7 with value: 2926408.6707950537.
[I 2024-01-04 01:50:53,461] Trial 134 finished with value: 2926408.6707950537 and parameters: {'model_name': 'SimpleImputer', 'strategy': 'mean'}. Best is trial 7 with value: 2926408.6707950537.
[I 2024-01-04 01:50:53,662] Trial 139 finished with value: 2926408.6707950537 and parameters: {'model_name': 'SimpleImputer', 'strategy': 'mean'}. Best is trial 7 with value: 2926408.6707950537.
[I 2024-01-04 01:50:53,888] Trial 89 finished with value: 5947238.951130796 and parameters: {'model_name': 'SimpleImputer', 'strategy': 'most_frequent'}. Best is trial 7 with value: 2926408.6707950537.
[I 2024-01-04 01:50:54,131] Trial 92 finished with value: 5947238.951130796 and parameters: {'model_name': 'SimpleImputer', 'strategy': 'most_frequent'}. Best is trial 7 with value: 2926408.6707950537.
[I 2024-01-04 01:50:54,325] Trial 143 finished with value: 2926408.6707950537 and parameters: {'model_name': 'SimpleImputer', 'strategy': 'mean'}. Best is trial 7 with value: 2926408.6707950537.
[I 2024-01-04 01:50:54,490] Trial 140 finished with value: 2926408.6707950537 and parameters: {'model_name': 'SimpleImputer', 'strategy': 'mean'}. Best is trial 7 with value: 2926408.6707950537.
[I 2024-01-04 01:50:54,749] Trial 133 finished with value: 2926408.6707950537 and parameters: {'model_name': 'SimpleImputer', 'strategy': 'mean'}. Best is trial 7 with value: 2926408.6707950537.
[I 2024-01-04 01:50:55,178] Trial 144 finished with value: 2926408.6707950537 and parameters: {'model_name': 'SimpleImputer', 'strategy': 'mean'}. Best is trial 7 with value: 2926408.6707950537.
[I 2024-01-04 01:50:55,357] Trial 142 finished with value: 2926408.6707950537 and parameters: {'model_name': 'SimpleImputer', 'strategy': 'mean'}. Best is trial 7 with value: 2926408.6707950537.
[I 2024-01-04 01:50:55,624] Trial 136 finished with value: 2926408.6707950537 and parameters: {'model_name': 'SimpleImputer', 'strategy': 'mean'}. Best is trial 7 with value: 2926408.6707950537.
[I 2024-01-04 01:50:55,979] Trial 141 finished with value: 2926408.6707950537 and parameters: {'model_name': 'SimpleImputer', 'strategy': 'mean'}. Best is trial 7 with value: 2926408.6707950537.
[I 2024-01-04 01:50:56,224] Trial 138 finished with value: 2926408.6707950537 and parameters: {'model_name': 'SimpleImputer', 'strategy': 'mean'}. Best is trial 7 with value: 2926408.6707950537.
[I 2024-01-04 01:50:56,483] Trial 93 finished with value: 5947238.951130796 and parameters: {'model_name': 'SimpleImputer', 'strategy': 'most_frequent'}. Best is trial 7 with value: 2926408.6707950537.
[I 2024-01-04 01:50:56,749] Trial 145 finished with value: 2926408.6707950537 and parameters: {'model_name': 'SimpleImputer', 'strategy': 'mean'}. Best is trial 7 with value: 2926408.6707950537.
[I 2024-01-04 01:50:56,997] Trial 95 finished with value: 5947238.951130796 and parameters: {'model_name': 'SimpleImputer', 'strategy': 'most_frequent'}. Best is trial 7 with value: 2926408.6707950537.
[I 2024-01-04 01:50:57,397] Trial 152 finished with value: 2926408.6707950537 and parameters: {'model_name': 'SimpleImputer', 'strategy': 'mean'}. Best is trial 7 with value: 2926408.6707950537.
[I 2024-01-04 01:50:57,606] Trial 148 finished with value: 2926408.6707950537 and parameters: {'model_name': 'SimpleImputer', 'strategy': 'mean'}. Best is trial 7 with value: 2926408.6707950537.
[I 2024-01-04 01:50:57,800] Trial 149 finished with value: 2926408.6707950537 and parameters: {'model_name': 'SimpleImputer', 'strategy': 'mean'}. Best is trial 7 with value: 2926408.6707950537.
[I 2024-01-04 01:50:58,091] Trial 94 finished with value: 5947238.951130796 and parameters: {'model_name': 'SimpleImputer', 'strategy': 'most_frequent'}. Best is trial 7 with value: 2926408.6707950537.
[I 2024-01-04 01:50:58,283] Trial 150 finished with value: 2926408.6707950537 and parameters: {'model_name': 'SimpleImputer', 'strategy': 'mean'}. Best is trial 7 with value: 2926408.6707950537.
[I 2024-01-04 01:50:58,536] Trial 147 finished with value: 2926408.6707950537 and parameters: {'model_name': 'SimpleImputer', 'strategy': 'mean'}. Best is trial 7 with value: 2926408.6707950537.
[I 2024-01-04 01:50:58,795] Trial 151 finished with value: 2926408.6707950537 and parameters: {'model_name': 'SimpleImputer', 'strategy': 'mean'}. Best is trial 7 with value: 2926408.6707950537.
[I 2024-01-04 01:50:59,114] Trial 146 finished with value: 2926408.6707950537 and parameters: {'model_name': 'SimpleImputer', 'strategy': 'mean'}. Best is trial 7 with value: 2926408.6707950537.
[I 2024-01-04 01:50:59,581] Trial 153 finished with value: 2926408.6707950537 and parameters: {'model_name': 'SimpleImputer', 'strategy': 'mean'}. Best is trial 7 with value: 2926408.6707950537.
[I 2024-01-04 01:50:59,829] Trial 160 finished with value: 2926408.6707950537 and parameters: {'model_name': 'SimpleImputer', 'strategy': 'mean'}. Best is trial 7 with value: 2926408.6707950537.
[I 2024-01-04 01:51:00,000] Trial 154 finished with value: 2926408.6707950537 and parameters: {'model_name': 'SimpleImputer', 'strategy': 'mean'}. Best is trial 7 with value: 2926408.6707950537.
[I 2024-01-04 01:51:00,208] Trial 157 finished with value: 2926408.6707950537 and parameters: {'model_name': 'SimpleImputer', 'strategy': 'mean'}. Best is trial 7 with value: 2926408.6707950537.
[I 2024-01-04 01:51:00,475] Trial 156 finished with value: 2926408.6707950537 and parameters: {'model_name': 'SimpleImputer', 'strategy': 'mean'}. Best is trial 7 with value: 2926408.6707950537.
[I 2024-01-04 01:51:00,846] Trial 155 finished with value: 2926408.6707950537 and parameters: {'model_name': 'SimpleImputer', 'strategy': 'mean'}. Best is trial 7 with value: 2926408.6707950537.
[I 2024-01-04 01:51:01,361] Trial 158 finished with value: 2926408.6707950537 and parameters: {'model_name': 'SimpleImputer', 'strategy': 'mean'}. Best is trial 7 with value: 2926408.6707950537.
[I 2024-01-04 01:51:01,540] Trial 163 finished with value: 2926408.6707950537 and parameters: {'model_name': 'SimpleImputer', 'strategy': 'mean'}. Best is trial 7 with value: 2926408.6707950537.
[I 2024-01-04 01:51:01,822] Trial 166 finished with value: 2926408.6707950537 and parameters: {'model_name': 'SimpleImputer', 'strategy': 'mean'}. Best is trial 7 with value: 2926408.6707950537.
[I 2024-01-04 01:51:02,364] Trial 161 finished with value: 2926408.6707950537 and parameters: {'model_name': 'SimpleImputer', 'strategy': 'mean'}. Best is trial 7 with value: 2926408.6707950537.
[I 2024-01-04 01:51:02,544] Trial 164 finished with value: 2926408.6707950537 and parameters: {'model_name': 'SimpleImputer', 'strategy': 'mean'}. Best is trial 7 with value: 2926408.6707950537.
[I 2024-01-04 01:51:02,780] Trial 159 finished with value: 2926408.6707950537 and parameters: {'model_name': 'SimpleImputer', 'strategy': 'mean'}. Best is trial 7 with value: 2926408.6707950537.
[I 2024-01-04 01:51:02,959] Trial 167 finished with value: 2926408.6707950537 and parameters: {'model_name': 'SimpleImputer', 'strategy': 'mean'}. Best is trial 7 with value: 2926408.6707950537.
[I 2024-01-04 01:51:03,172] Trial 181 finished with value: 5947238.951130865 and parameters: {'model_name': 'SimpleImputer', 'strategy': 'constant'}. Best is trial 7 with value: 2926408.6707950537.
[I 2024-01-04 01:51:03,357] Trial 162 finished with value: 2926408.6707950537 and parameters: {'model_name': 'SimpleImputer', 'strategy': 'mean'}. Best is trial 7 with value: 2926408.6707950537.
[I 2024-01-04 01:51:03,597] Trial 169 finished with value: 2926408.6707950537 and parameters: {'model_name': 'SimpleImputer', 'strategy': 'mean'}. Best is trial 7 with value: 2926408.6707950537.
[I 2024-01-04 01:51:03,771] Trial 171 finished with value: 2926408.6707950537 and parameters: {'model_name': 'SimpleImputer', 'strategy': 'mean'}. Best is trial 7 with value: 2926408.6707950537.
[I 2024-01-04 01:51:03,933] Trial 165 finished with value: 2926408.6707950537 and parameters: {'model_name': 'SimpleImputer', 'strategy': 'mean'}. Best is trial 7 with value: 2926408.6707950537.
[I 2024-01-04 01:51:04,186] Trial 172 finished with value: 2926408.6707950537 and parameters: {'model_name': 'SimpleImputer', 'strategy': 'mean'}. Best is trial 7 with value: 2926408.6707950537.
[I 2024-01-04 01:51:04,453] Trial 173 finished with value: 2926408.6707950537 and parameters: {'model_name': 'SimpleImputer', 'strategy': 'mean'}. Best is trial 7 with value: 2926408.6707950537.
[I 2024-01-04 01:51:04,641] Trial 168 finished with value: 2926408.6707950537 and parameters: {'model_name': 'SimpleImputer', 'strategy': 'mean'}. Best is trial 7 with value: 2926408.6707950537.
[I 2024-01-04 01:51:04,962] Trial 184 finished with value: 5947238.951130865 and parameters: {'model_name': 'SimpleImputer', 'strategy': 'constant'}. Best is trial 7 with value: 2926408.6707950537.
[I 2024-01-04 01:51:05,158] Trial 192 finished with value: 5947238.951130865 and parameters: {'model_name': 'SimpleImputer', 'strategy': 'constant'}. Best is trial 7 with value: 2926408.6707950537.
[I 2024-01-04 01:51:05,356] Trial 183 finished with value: 5947238.951130865 and parameters: {'model_name': 'SimpleImputer', 'strategy': 'constant'}. Best is trial 7 with value: 2926408.6707950537.
[I 2024-01-04 01:51:05,523] Trial 179 finished with value: 2926408.6707950537 and parameters: {'model_name': 'SimpleImputer', 'strategy': 'mean'}. Best is trial 7 with value: 2926408.6707950537.
[I 2024-01-04 01:51:05,686] Trial 186 finished with value: 5947238.951130865 and parameters: {'model_name': 'SimpleImputer', 'strategy': 'constant'}. Best is trial 7 with value: 2926408.6707950537.
[I 2024-01-04 01:51:05,948] Trial 185 finished with value: 5947238.951130865 and parameters: {'model_name': 'SimpleImputer', 'strategy': 'constant'}. Best is trial 7 with value: 2926408.6707950537.
[I 2024-01-04 01:51:06,195] Trial 198 finished with value: 5947238.951130865 and parameters: {'model_name': 'SimpleImputer', 'strategy': 'constant'}. Best is trial 7 with value: 2926408.6707950537.
[I 2024-01-04 01:51:06,434] Trial 195 finished with value: 5947238.951130865 and parameters: {'model_name': 'SimpleImputer', 'strategy': 'constant'}. Best is trial 7 with value: 2926408.6707950537.
[I 2024-01-04 01:51:06,674] Trial 180 finished with value: 5947238.951130865 and parameters: {'model_name': 'SimpleImputer', 'strategy': 'constant'}. Best is trial 7 with value: 2926408.6707950537.
[I 2024-01-04 01:51:06,888] Trial 175 finished with value: 2926408.6707950537 and parameters: {'model_name': 'SimpleImputer', 'strategy': 'mean'}. Best is trial 7 with value: 2926408.6707950537.
[I 2024-01-04 01:51:07,076] Trial 188 finished with value: 5947238.951130865 and parameters: {'model_name': 'SimpleImputer', 'strategy': 'constant'}. Best is trial 7 with value: 2926408.6707950537.
[I 2024-01-04 01:51:07,259] Trial 170 finished with value: 2926408.6707950537 and parameters: {'model_name': 'SimpleImputer', 'strategy': 'mean'}. Best is trial 7 with value: 2926408.6707950537.
[I 2024-01-04 01:51:07,507] Trial 176 finished with value: 2926408.6707950537 and parameters: {'model_name': 'SimpleImputer', 'strategy': 'mean'}. Best is trial 7 with value: 2926408.6707950537.
[I 2024-01-04 01:51:07,736] Trial 191 finished with value: 5947238.951130865 and parameters: {'model_name': 'SimpleImputer', 'strategy': 'constant'}. Best is trial 7 with value: 2926408.6707950537.
[I 2024-01-04 01:51:07,960] Trial 193 finished with value: 5947238.951130865 and parameters: {'model_name': 'SimpleImputer', 'strategy': 'constant'}. Best is trial 7 with value: 2926408.6707950537.
[I 2024-01-04 01:51:08,150] Trial 187 finished with value: 5947238.951130865 and parameters: {'model_name': 'SimpleImputer', 'strategy': 'constant'}. Best is trial 7 with value: 2926408.6707950537.
[I 2024-01-04 01:51:08,457] Trial 174 finished with value: 2926408.6707950537 and parameters: {'model_name': 'SimpleImputer', 'strategy': 'mean'}. Best is trial 7 with value: 2926408.6707950537.
[I 2024-01-04 01:51:08,675] Trial 190 finished with value: 2926408.6707950537 and parameters: {'model_name': 'SimpleImputer', 'strategy': 'mean'}. Best is trial 7 with value: 2926408.6707950537.
[I 2024-01-04 01:51:08,886] Trial 199 finished with value: 5947238.951130865 and parameters: {'model_name': 'SimpleImputer', 'strategy': 'constant'}. Best is trial 7 with value: 2926408.6707950537.
[I 2024-01-04 01:51:09,091] Trial 177 finished with value: 2926408.6707950537 and parameters: {'model_name': 'SimpleImputer', 'strategy': 'mean'}. Best is trial 7 with value: 2926408.6707950537.
[I 2024-01-04 01:51:09,281] Trial 178 finished with value: 2926408.6707950537 and parameters: {'model_name': 'SimpleImputer', 'strategy': 'mean'}. Best is trial 7 with value: 2926408.6707950537.
[I 2024-01-04 01:51:09,486] Trial 196 finished with value: 5947238.951130865 and parameters: {'model_name': 'SimpleImputer', 'strategy': 'constant'}. Best is trial 7 with value: 2926408.6707950537.
[I 2024-01-04 01:51:09,706] Trial 194 finished with value: 2926408.6707950537 and parameters: {'model_name': 'SimpleImputer', 'strategy': 'mean'}. Best is trial 7 with value: 2926408.6707950537.
[I 2024-01-04 01:51:09,903] Trial 189 finished with value: 2926408.6707950537 and parameters: {'model_name': 'SimpleImputer', 'strategy': 'mean'}. Best is trial 7 with value: 2926408.6707950537.
[I 2024-01-04 01:51:10,108] Trial 182 finished with value: 2926408.6707950537 and parameters: {'model_name': 'SimpleImputer', 'strategy': 'mean'}. Best is trial 7 with value: 2926408.6707950537.
