[I 2024-02-29 08:09:25,663] Trial 34 finished with value: 10.229822934408949 and parameters: {'model_name': 'GAIN', 'batch_size': 3, 'hint_rate': 0.09999999999999999, 'alpha': 84, 'iterations': 268}. Best is trial 140 with value: 5.747553034785658.
[I 2024-02-29 08:09:28,389] Trial 194 finished with value: 6.107225433653462 and parameters: {'model_name': 'GAIN', 'batch_size': 9, 'hint_rate': 0.9500000000000001, 'alpha': 75, 'iterations': 6}. Best is trial 140 with value: 5.747553034785658.
[I 2024-02-29 08:09:30,970] Trial 174 finished with value: 7.353784171853141 and parameters: {'model_name': 'GAIN', 'batch_size': 9, 'hint_rate': 0.01, 'alpha': 77, 'iterations': 35}. Best is trial 140 with value: 5.747553034785658.
[I 2024-02-29 08:09:33,356] Trial 192 finished with value: 7.496915127958158 and parameters: {'model_name': 'GAIN', 'batch_size': 6, 'hint_rate': 0.9500000000000001, 'alpha': 78, 'iterations': 6}. Best is trial 140 with value: 5.747553034785658.
[I 2024-02-29 08:09:35,087] Trial 47 finished with value: 12.170724675200589 and parameters: {'model_name': 'IterativeImputer', 'sample_posterior': True, 'initial_strategy': 'mean', 'imputation_order': 'descending'}. Best is trial 140 with value: 5.747553034785658.
[I 2024-02-29 08:09:36,878] Trial 26 finished with value: 12.70781001562195 and parameters: {'model_name': 'IterativeImputer', 'sample_posterior': True, 'initial_strategy': 'most_frequent', 'imputation_order': 'arabic'}. Best is trial 140 with value: 5.747553034785658.
[I 2024-02-29 08:09:40,873] Trial 28 finished with value: 12.979953450196973 and parameters: {'model_name': 'IterativeImputer', 'sample_posterior': True, 'initial_strategy': 'median', 'imputation_order': 'random'}. Best is trial 140 with value: 5.747553034785658.
[I 2024-02-29 08:09:43,200] Trial 184 finished with value: 6.004212563331617 and parameters: {'model_name': 'GAIN', 'batch_size': 7, 'hint_rate': 0.04, 'alpha': 75, 'iterations': 29}. Best is trial 140 with value: 5.747553034785658.
[I 2024-02-29 08:09:44,294] Trial 198 finished with value: 7.355344597666597 and parameters: {'model_name': 'GAIN', 'batch_size': 2, 'hint_rate': 0.9600000000000001, 'alpha': 8, 'iterations': 25}. Best is trial 140 with value: 5.747553034785658.
[I 2024-02-29 08:09:45,780] Trial 189 finished with value: 7.273154601815373 and parameters: {'model_name': 'GAIN', 'batch_size': 6, 'hint_rate': 0.9500000000000001, 'alpha': 74, 'iterations': 27}. Best is trial 140 with value: 5.747553034785658.
[I 2024-02-29 08:09:47,029] Trial 196 finished with value: 7.046291156458035 and parameters: {'model_name': 'GAIN', 'batch_size': 2, 'hint_rate': 0.9500000000000001, 'alpha': 76, 'iterations': 6}. Best is trial 140 with value: 5.747553034785658.
[I 2024-02-29 08:09:48,354] Trial 61 finished with value: 11.574438412368528 and parameters: {'model_name': 'IterativeImputer', 'sample_posterior': True, 'initial_strategy': 'most_frequent', 'imputation_order': 'arabic'}. Best is trial 140 with value: 5.747553034785658.
[I 2024-02-29 08:09:50,372] Trial 64 finished with value: 10.830590428462312 and parameters: {'model_name': 'IterativeImputer', 'sample_posterior': True, 'initial_strategy': 'most_frequent', 'imputation_order': 'random'}. Best is trial 140 with value: 5.747553034785658.
[I 2024-02-29 08:09:51,213] Trial 63 finished with value: 12.294483143241273 and parameters: {'model_name': 'IterativeImputer', 'sample_posterior': True, 'initial_strategy': 'median', 'imputation_order': 'ascending'}. Best is trial 140 with value: 5.747553034785658.
[I 2024-02-29 08:09:52,337] Trial 25 finished with value: 12.263486603786557 and parameters: {'model_name': 'IterativeImputer', 'sample_posterior': True, 'initial_strategy': 'most_frequent', 'imputation_order': 'random'}. Best is trial 140 with value: 5.747553034785658.
[I 2024-02-29 08:09:53,213] Trial 51 finished with value: 11.851033082840805 and parameters: {'model_name': 'IterativeImputer', 'sample_posterior': True, 'initial_strategy': 'mean', 'imputation_order': 'random'}. Best is trial 140 with value: 5.747553034785658.
[I 2024-02-29 08:09:54,118] Trial 199 finished with value: 6.810683071790838 and parameters: {'model_name': 'GAIN', 'batch_size': 2, 'hint_rate': 0.9600000000000001, 'alpha': 79, 'iterations': 27}. Best is trial 140 with value: 5.747553034785658.
[I 2024-02-29 08:10:18,887] Trial 72 finished with value: 11.327788796498888 and parameters: {'model_name': 'RandomForestImputer', 'max_iter': 11, 'decreasing': False, 'min_samples_split': 0.2, 'min_samples_leaf': 0.1, 'max_features': 0.4, 'warm_start': False}. Best is trial 140 with value: 5.747553034785658.
[I 2024-02-29 08:10:37,990] Trial 11 finished with value: 11.329700818285328 and parameters: {'model_name': 'RandomForestImputer', 'max_iter': 34, 'decreasing': False, 'min_samples_split': 0.4, 'min_samples_leaf': 0.4, 'max_features': 0.7000000000000001, 'warm_start': False}. Best is trial 140 with value: 5.747553034785658.
[I 2024-02-29 08:10:40,566] Trial 52 finished with value: 11.330224917628698 and parameters: {'model_name': 'RandomForestImputer', 'max_iter': 26, 'decreasing': False, 'min_samples_split': 0.9, 'min_samples_leaf': 0.30000000000000004, 'max_features': 0.1, 'warm_start': False}. Best is trial 140 with value: 5.747553034785658.
[I 2024-02-29 08:11:11,059] Trial 2 finished with value: inf and parameters: {'model_name': 'GAIN', 'batch_size': 577, 'hint_rate': 0.93, 'alpha': 13, 'iterations': 14383}. Best is trial 140 with value: 5.747553034785658.
