[I 2024-01-04 06:23:31,551] Trial 141 finished with value: 2974373.0114329983 and parameters: {'model_name': 'RandomForestImputer', 'max_iter': 87, 'decreasing': False, 'min_samples_split': 0.2, 'min_samples_leaf': 0.7000000000000001, 'max_features': 0.4, 'warm_start': False}. Best is trial 61 with value: 2855477.6919910638.
[I 2024-01-04 06:23:42,454] Trial 183 finished with value: 2974422.2434298373 and parameters: {'model_name': 'RandomForestImputer', 'max_iter': 24, 'decreasing': False, 'min_samples_split': 0.8, 'min_samples_leaf': 0.7000000000000001, 'max_features': 0.5, 'warm_start': False}. Best is trial 61 with value: 2855477.6919910638.
[I 2024-01-04 06:23:48,717] Trial 197 finished with value: 2886281.534197254 and parameters: {'model_name': 'IterativeImputer', 'sample_posterior': False, 'initial_strategy': 'mean', 'imputation_order': 'roman'}. Best is trial 61 with value: 2855477.6919910638.
[I 2024-01-04 06:23:56,084] Trial 198 finished with value: 2886281.534197254 and parameters: {'model_name': 'IterativeImputer', 'sample_posterior': False, 'initial_strategy': 'mean', 'imputation_order': 'roman'}. Best is trial 61 with value: 2855477.6919910638.
[I 2024-01-04 06:24:02,076] Trial 139 finished with value: 2974677.350801285 and parameters: {'model_name': 'RandomForestImputer', 'max_iter': 85, 'decreasing': False, 'min_samples_split': 0.2, 'min_samples_leaf': 0.7000000000000001, 'max_features': 0.4, 'warm_start': False}. Best is trial 61 with value: 2855477.6919910638.
[I 2024-01-04 06:24:04,003] Trial 199 finished with value: 2886281.534197254 and parameters: {'model_name': 'IterativeImputer', 'sample_posterior': False, 'initial_strategy': 'mean', 'imputation_order': 'roman'}. Best is trial 61 with value: 2855477.6919910638.
[I 2024-01-04 06:24:52,721] Trial 179 finished with value: 2975731.177609037 and parameters: {'model_name': 'RandomForestImputer', 'max_iter': 59, 'decreasing': False, 'min_samples_split': 0.2, 'min_samples_leaf': 0.7000000000000001, 'max_features': 0.4, 'warm_start': False}. Best is trial 61 with value: 2855477.6919910638.
[I 2024-01-04 06:24:57,001] Trial 184 finished with value: 2784888.999200805 and parameters: {'model_name': 'RandomForestImputer', 'max_iter': 27, 'decreasing': False, 'min_samples_split': 0.8, 'min_samples_leaf': 0.1, 'max_features': 0.5, 'warm_start': False}. Best is trial 184 with value: 2784888.999200805.
[I 2024-01-04 06:25:06,080] Trial 154 finished with value: 2974472.795818408 and parameters: {'model_name': 'RandomForestImputer', 'max_iter': 71, 'decreasing': False, 'min_samples_split': 0.2, 'min_samples_leaf': 0.7000000000000001, 'max_features': 0.4, 'warm_start': False}. Best is trial 184 with value: 2784888.999200805.
[I 2024-01-04 06:25:35,406] Trial 168 finished with value: 2974744.018103456 and parameters: {'model_name': 'RandomForestImputer', 'max_iter': 80, 'decreasing': False, 'min_samples_split': 0.1, 'min_samples_leaf': 0.7000000000000001, 'max_features': 0.4, 'warm_start': False}. Best is trial 184 with value: 2784888.999200805.
[I 2024-01-04 06:25:55,832] Trial 147 finished with value: 2974399.1003170367 and parameters: {'model_name': 'RandomForestImputer', 'max_iter': 82, 'decreasing': False, 'min_samples_split': 0.2, 'min_samples_leaf': 0.7000000000000001, 'max_features': 0.4, 'warm_start': False}. Best is trial 184 with value: 2784888.999200805.
[I 2024-01-04 06:26:04,463] Trial 156 finished with value: 2974335.427980232 and parameters: {'model_name': 'RandomForestImputer', 'max_iter': 78, 'decreasing': False, 'min_samples_split': 0.1, 'min_samples_leaf': 0.7000000000000001, 'max_features': 0.4, 'warm_start': False}. Best is trial 184 with value: 2784888.999200805.
[I 2024-01-04 06:26:07,605] Trial 166 finished with value: 2974195.684329225 and parameters: {'model_name': 'RandomForestImputer', 'max_iter': 67, 'decreasing': False, 'min_samples_split': 0.2, 'min_samples_leaf': 0.7000000000000001, 'max_features': 0.4, 'warm_start': False}. Best is trial 184 with value: 2784888.999200805.
[I 2024-01-04 06:26:09,143] Trial 178 finished with value: 2974438.788850985 and parameters: {'model_name': 'RandomForestImputer', 'max_iter': 68, 'decreasing': False, 'min_samples_split': 0.2, 'min_samples_leaf': 0.7000000000000001, 'max_features': 0.4, 'warm_start': False}. Best is trial 184 with value: 2784888.999200805.
[I 2024-01-04 06:26:23,257] Trial 185 finished with value: 2793886.5969979977 and parameters: {'model_name': 'RandomForestImputer', 'max_iter': 25, 'decreasing': False, 'min_samples_split': 0.8, 'min_samples_leaf': 0.1, 'max_features': 0.5, 'warm_start': False}. Best is trial 184 with value: 2784888.999200805.
[I 2024-01-04 06:26:36,355] Trial 162 finished with value: 2974766.258045758 and parameters: {'model_name': 'RandomForestImputer', 'max_iter': 83, 'decreasing': False, 'min_samples_split': 0.2, 'min_samples_leaf': 0.7000000000000001, 'max_features': 0.4, 'warm_start': False}. Best is trial 184 with value: 2784888.999200805.
[I 2024-01-04 06:26:54,641] Trial 153 finished with value: 2974744.715862789 and parameters: {'model_name': 'RandomForestImputer', 'max_iter': 78, 'decreasing': False, 'min_samples_split': 0.1, 'min_samples_leaf': 0.7000000000000001, 'max_features': 0.4, 'warm_start': False}. Best is trial 184 with value: 2784888.999200805.
[I 2024-01-04 06:27:07,832] Trial 157 finished with value: 2974387.194306732 and parameters: {'model_name': 'RandomForestImputer', 'max_iter': 84, 'decreasing': False, 'min_samples_split': 0.2, 'min_samples_leaf': 0.7000000000000001, 'max_features': 0.4, 'warm_start': False}. Best is trial 184 with value: 2784888.999200805.
[I 2024-01-04 06:27:10,700] Trial 180 finished with value: 2975031.936891676 and parameters: {'model_name': 'RandomForestImputer', 'max_iter': 82, 'decreasing': False, 'min_samples_split': 0.2, 'min_samples_leaf': 0.7000000000000001, 'max_features': 0.4, 'warm_start': False}. Best is trial 184 with value: 2784888.999200805.
[I 2024-01-04 06:28:29,772] Trial 150 finished with value: 2974193.9588899156 and parameters: {'model_name': 'RandomForestImputer', 'max_iter': 87, 'decreasing': False, 'min_samples_split': 0.2, 'min_samples_leaf': 0.7000000000000001, 'max_features': 0.4, 'warm_start': False}. Best is trial 184 with value: 2784888.999200805.
[I 2024-01-04 06:28:44,529] Trial 159 finished with value: 2974520.2753710947 and parameters: {'model_name': 'RandomForestImputer', 'max_iter': 90, 'decreasing': False, 'min_samples_split': 0.2, 'min_samples_leaf': 0.7000000000000001, 'max_features': 0.4, 'warm_start': False}. Best is trial 184 with value: 2784888.999200805.
[I 2024-01-04 06:28:50,053] Trial 137 finished with value: 2974507.5395853994 and parameters: {'model_name': 'RandomForestImputer', 'max_iter': 96, 'decreasing': False, 'min_samples_split': 0.2, 'min_samples_leaf': 0.7000000000000001, 'max_features': 0.4, 'warm_start': False}. Best is trial 184 with value: 2784888.999200805.
[I 2024-01-04 06:29:04,358] Trial 171 finished with value: 2974753.262929666 and parameters: {'model_name': 'RandomForestImputer', 'max_iter': 84, 'decreasing': False, 'min_samples_split': 0.2, 'min_samples_leaf': 0.7000000000000001, 'max_features': 0.4, 'warm_start': False}. Best is trial 184 with value: 2784888.999200805.
[I 2024-01-04 06:29:15,134] Trial 172 finished with value: 2974611.576784685 and parameters: {'model_name': 'RandomForestImputer', 'max_iter': 88, 'decreasing': False, 'min_samples_split': 0.2, 'min_samples_leaf': 0.7000000000000001, 'max_features': 0.4, 'warm_start': False}. Best is trial 184 with value: 2784888.999200805.
[I 2024-01-04 06:29:32,735] Trial 160 finished with value: 2975016.801712515 and parameters: {'model_name': 'RandomForestImputer', 'max_iter': 92, 'decreasing': False, 'min_samples_split': 0.2, 'min_samples_leaf': 0.7000000000000001, 'max_features': 0.4, 'warm_start': False}. Best is trial 184 with value: 2784888.999200805.
[I 2024-01-04 06:29:40,575] Trial 174 finished with value: 2974343.3565606982 and parameters: {'model_name': 'RandomForestImputer', 'max_iter': 89, 'decreasing': False, 'min_samples_split': 0.2, 'min_samples_leaf': 0.7000000000000001, 'max_features': 0.4, 'warm_start': False}. Best is trial 184 with value: 2784888.999200805.
[I 2024-01-04 06:29:47,306] Trial 169 finished with value: 2974922.180346797 and parameters: {'model_name': 'RandomForestImputer', 'max_iter': 77, 'decreasing': False, 'min_samples_split': 0.2, 'min_samples_leaf': 0.7000000000000001, 'max_features': 0.4, 'warm_start': False}. Best is trial 184 with value: 2784888.999200805.
[I 2024-01-04 06:29:50,693] Trial 181 finished with value: 2975590.128659837 and parameters: {'model_name': 'RandomForestImputer', 'max_iter': 77, 'decreasing': False, 'min_samples_split': 0.8, 'min_samples_leaf': 0.7000000000000001, 'max_features': 0.5, 'warm_start': False}. Best is trial 184 with value: 2784888.999200805.
[I 2024-01-04 06:29:58,025] Trial 177 finished with value: 2974924.544372431 and parameters: {'model_name': 'RandomForestImputer', 'max_iter': 86, 'decreasing': False, 'min_samples_split': 0.2, 'min_samples_leaf': 0.7000000000000001, 'max_features': 0.4, 'warm_start': False}. Best is trial 184 with value: 2784888.999200805.
[I 2024-01-04 06:30:01,126] Trial 152 finished with value: 2974748.3561978294 and parameters: {'model_name': 'RandomForestImputer', 'max_iter': 96, 'decreasing': False, 'min_samples_split': 0.2, 'min_samples_leaf': 0.7000000000000001, 'max_features': 0.4, 'warm_start': False}. Best is trial 184 with value: 2784888.999200805.
[I 2024-01-04 06:30:02,199] Trial 175 finished with value: 2974761.9443093305 and parameters: {'model_name': 'RandomForestImputer', 'max_iter': 88, 'decreasing': False, 'min_samples_split': 0.1, 'min_samples_leaf': 0.7000000000000001, 'max_features': 0.4, 'warm_start': False}. Best is trial 184 with value: 2784888.999200805.
[I 2024-01-04 06:30:37,129] Trial 182 finished with value: 2974999.982706379 and parameters: {'model_name': 'RandomForestImputer', 'max_iter': 90, 'decreasing': False, 'min_samples_split': 0.7000000000000001, 'min_samples_leaf': 0.7000000000000001, 'max_features': 0.5, 'warm_start': False}. Best is trial 184 with value: 2784888.999200805.
[I 2024-01-04 06:31:29,034] Trial 67 finished with value: inf and parameters: {'model_name': 'GAIN', 'batch_size': 10, 'hint_rate': 0.14, 'alpha': 75, 'iterations': 44626}. Best is trial 184 with value: 2784888.999200805.
[I 2024-01-04 06:31:52,123] Trial 4 finished with value: 4452243.973722288 and parameters: {'model_name': 'GAIN', 'batch_size': 3, 'hint_rate': 0.33, 'alpha': 59, 'iterations': 5233}. Best is trial 184 with value: 2784888.999200805.
