[I 2023-12-28 12:46:13,319] Trial 110 finished with value: 2.056163400693783 and parameters: {'model_name': 'RandomForestImputer', 'max_iter': 2, 'decreasing': False, 'min_samples_split': 0.7000000000000001, 'min_samples_leaf': 0.9, 'max_features': 0.8, 'warm_start': False}. Best is trial 97 with value: 2.0558319838055903.
[I 2023-12-28 12:46:17,894] Trial 111 finished with value: 2.0608213564905453 and parameters: {'model_name': 'RandomForestImputer', 'max_iter': 2, 'decreasing': False, 'min_samples_split': 0.7000000000000001, 'min_samples_leaf': 0.9, 'max_features': 0.8, 'warm_start': False}. Best is trial 97 with value: 2.0558319838055903.
[I 2023-12-28 12:46:19,581] Trial 105 finished with value: 2.060013624909632 and parameters: {'model_name': 'RandomForestImputer', 'max_iter': 3, 'decreasing': True, 'min_samples_split': 0.9, 'min_samples_leaf': 0.5, 'max_features': 0.8, 'warm_start': False}. Best is trial 97 with value: 2.0558319838055903.
[I 2023-12-28 12:46:23,860] Trial 104 finished with value: 2.057443805043512 and parameters: {'model_name': 'RandomForestImputer', 'max_iter': 3, 'decreasing': True, 'min_samples_split': 0.9, 'min_samples_leaf': 0.5, 'max_features': 0.7000000000000001, 'warm_start': False}. Best is trial 97 with value: 2.0558319838055903.
[I 2023-12-28 12:46:27,126] Trial 112 finished with value: 2.057626635706918 and parameters: {'model_name': 'RandomForestImputer', 'max_iter': 2, 'decreasing': False, 'min_samples_split': 0.6000000000000001, 'min_samples_leaf': 0.9, 'max_features': 0.8, 'warm_start': False}. Best is trial 97 with value: 2.0558319838055903.
[I 2023-12-28 12:46:28,200] Trial 87 finished with value: 2.0556845127467946 and parameters: {'model_name': 'RandomForestImputer', 'max_iter': 8, 'decreasing': True, 'min_samples_split': 0.4, 'min_samples_leaf': 0.9, 'max_features': 0.1, 'warm_start': False}. Best is trial 87 with value: 2.0556845127467946.
[I 2023-12-28 12:46:29,803] Trial 133 finished with value: 2.0571795589257134 and parameters: {'model_name': 'SimpleImputer', 'strategy': 'mean'}. Best is trial 87 with value: 2.0556845127467946.
[I 2023-12-28 12:46:34,154] Trial 113 finished with value: 2.0573926952482386 and parameters: {'model_name': 'RandomForestImputer', 'max_iter': 2, 'decreasing': True, 'min_samples_split': 0.6000000000000001, 'min_samples_leaf': 0.9, 'max_features': 0.8, 'warm_start': False}. Best is trial 87 with value: 2.0556845127467946.
[I 2023-12-28 12:46:37,799] Trial 107 finished with value: 2.0765153831488226 and parameters: {'model_name': 'RandomForestImputer', 'max_iter': 3, 'decreasing': False, 'min_samples_split': 0.8, 'min_samples_leaf': 0.1, 'max_features': 0.8, 'warm_start': False}. Best is trial 87 with value: 2.0556845127467946.
[I 2023-12-28 12:46:41,820] Trial 114 finished with value: 2.0580220376181244 and parameters: {'model_name': 'RandomForestImputer', 'max_iter': 2, 'decreasing': True, 'min_samples_split': 0.5, 'min_samples_leaf': 0.8, 'max_features': 0.7000000000000001, 'warm_start': False}. Best is trial 87 with value: 2.0556845127467946.
[I 2023-12-28 12:46:43,088] Trial 116 finished with value: 2.057219137319307 and parameters: {'model_name': 'RandomForestImputer', 'max_iter': 2, 'decreasing': False, 'min_samples_split': 0.5, 'min_samples_leaf': 0.8, 'max_features': 0.7000000000000001, 'warm_start': False}. Best is trial 87 with value: 2.0556845127467946.
[I 2023-12-28 12:46:44,830] Trial 115 finished with value: 2.0578098843224275 and parameters: {'model_name': 'RandomForestImputer', 'max_iter': 2, 'decreasing': False, 'min_samples_split': 0.6000000000000001, 'min_samples_leaf': 0.8, 'max_features': 0.7000000000000001, 'warm_start': False}. Best is trial 87 with value: 2.0556845127467946.
[I 2023-12-28 12:46:45,626] Trial 86 finished with value: 2.0605353204457146 and parameters: {'model_name': 'RandomForestImputer', 'max_iter': 7, 'decreasing': True, 'min_samples_split': 0.4, 'min_samples_leaf': 0.1, 'max_features': 0.1, 'warm_start': False}. Best is trial 87 with value: 2.0556845127467946.
[I 2023-12-28 12:46:47,669] Trial 84 finished with value: 2.057161509820629 and parameters: {'model_name': 'RandomForestImputer', 'max_iter': 8, 'decreasing': True, 'min_samples_split': 0.4, 'min_samples_leaf': 0.1, 'max_features': 0.1, 'warm_start': False}. Best is trial 87 with value: 2.0556845127467946.
[I 2023-12-28 12:46:54,538] Trial 85 finished with value: 2.0572541700203018 and parameters: {'model_name': 'RandomForestImputer', 'max_iter': 8, 'decreasing': True, 'min_samples_split': 0.4, 'min_samples_leaf': 0.9, 'max_features': 0.1, 'warm_start': False}. Best is trial 87 with value: 2.0556845127467946.
[I 2023-12-28 12:46:57,822] Trial 142 finished with value: 2.908476244236307 and parameters: {'model_name': 'SimpleImputer', 'strategy': 'most_frequent'}. Best is trial 87 with value: 2.0556845127467946.
[I 2023-12-28 12:47:02,413] Trial 34 finished with value: 2.7358549803287713 and parameters: {'model_name': 'IterativeImputer', 'sample_posterior': True, 'initial_strategy': 'constant', 'imputation_order': 'ascending'}. Best is trial 87 with value: 2.0556845127467946.
[I 2023-12-28 12:47:05,242] Trial 118 finished with value: 2.058369067274221 and parameters: {'model_name': 'RandomForestImputer', 'max_iter': 2, 'decreasing': True, 'min_samples_split': 0.5, 'min_samples_leaf': 0.8, 'max_features': 0.7000000000000001, 'warm_start': False}. Best is trial 87 with value: 2.0556845127467946.
[I 2023-12-28 12:47:07,104] Trial 119 finished with value: 2.0573245416520884 and parameters: {'model_name': 'RandomForestImputer', 'max_iter': 2, 'decreasing': True, 'min_samples_split': 1.0, 'min_samples_leaf': 0.8, 'max_features': 0.7000000000000001, 'warm_start': False}. Best is trial 87 with value: 2.0556845127467946.
[I 2023-12-28 12:47:08,953] Trial 49 finished with value: 2.846233101249947 and parameters: {'model_name': 'IterativeImputer', 'sample_posterior': True, 'initial_strategy': 'most_frequent', 'imputation_order': 'roman'}. Best is trial 87 with value: 2.0556845127467946.
[I 2023-12-28 12:47:10,604] Trial 122 finished with value: 2.0588081089009247 and parameters: {'model_name': 'RandomForestImputer', 'max_iter': 2, 'decreasing': False, 'min_samples_split': 1.0, 'min_samples_leaf': 0.8, 'max_features': 0.7000000000000001, 'warm_start': False}. Best is trial 87 with value: 2.0556845127467946.
[I 2023-12-28 12:47:12,097] Trial 55 finished with value: 2.058381470210685 and parameters: {'model_name': 'RandomForestImputer', 'max_iter': 17, 'decreasing': False, 'min_samples_split': 1.0, 'min_samples_leaf': 0.5, 'max_features': 0.1, 'warm_start': False}. Best is trial 87 with value: 2.0556845127467946.
[I 2023-12-28 12:47:12,866] Trial 83 finished with value: 2.053319977993059 and parameters: {'model_name': 'RandomForestImputer', 'max_iter': 13, 'decreasing': True, 'min_samples_split': 0.4, 'min_samples_leaf': 0.1, 'max_features': 0.1, 'warm_start': False}. Best is trial 83 with value: 2.053319977993059.
[I 2023-12-28 12:47:14,247] Trial 28 finished with value: 2.883803730155174 and parameters: {'model_name': 'IterativeImputer', 'sample_posterior': True, 'initial_strategy': 'mean', 'imputation_order': 'descending'}. Best is trial 83 with value: 2.053319977993059.
[I 2023-12-28 12:47:15,150] Trial 42 finished with value: 2.9298193290642973 and parameters: {'model_name': 'IterativeImputer', 'sample_posterior': True, 'initial_strategy': 'median', 'imputation_order': 'arabic'}. Best is trial 83 with value: 2.053319977993059.
[I 2023-12-28 12:47:16,043] Trial 73 finished with value: 2.9452229371291008 and parameters: {'model_name': 'IterativeImputer', 'sample_posterior': True, 'initial_strategy': 'most_frequent', 'imputation_order': 'arabic'}. Best is trial 83 with value: 2.053319977993059.
[I 2023-12-28 12:47:17,507] Trial 54 finished with value: 2.814216519100853 and parameters: {'model_name': 'IterativeImputer', 'sample_posterior': True, 'initial_strategy': 'most_frequent', 'imputation_order': 'ascending'}. Best is trial 83 with value: 2.053319977993059.
[I 2023-12-28 12:47:19,468] Trial 123 finished with value: 2.0587717902794602 and parameters: {'model_name': 'RandomForestImputer', 'max_iter': 2, 'decreasing': False, 'min_samples_split': 1.0, 'min_samples_leaf': 0.8, 'max_features': 0.7000000000000001, 'warm_start': False}. Best is trial 83 with value: 2.053319977993059.
[I 2023-12-28 12:47:20,772] Trial 65 finished with value: 2.9129648994392072 and parameters: {'model_name': 'IterativeImputer', 'sample_posterior': True, 'initial_strategy': 'constant', 'imputation_order': 'descending'}. Best is trial 83 with value: 2.053319977993059.
[I 2023-12-28 12:47:24,959] Trial 9 finished with value: 2.9472073472419167 and parameters: {'model_name': 'IterativeImputer', 'sample_posterior': True, 'initial_strategy': 'mean', 'imputation_order': 'random'}. Best is trial 83 with value: 2.053319977993059.
[I 2023-12-28 12:47:34,661] Trial 50 finished with value: 2.0580683021870287 and parameters: {'model_name': 'RandomForestImputer', 'max_iter': 14, 'decreasing': False, 'min_samples_split': 0.30000000000000004, 'min_samples_leaf': 0.5, 'max_features': 0.1, 'warm_start': False}. Best is trial 83 with value: 2.053319977993059.
[I 2023-12-28 12:47:41,683] Trial 121 finished with value: 2.055988740546401 and parameters: {'model_name': 'RandomForestImputer', 'max_iter': 3, 'decreasing': False, 'min_samples_split': 0.5, 'min_samples_leaf': 0.8, 'max_features': 0.7000000000000001, 'warm_start': False}. Best is trial 83 with value: 2.053319977993059.
[I 2023-12-28 12:47:44,788] Trial 120 finished with value: 2.057036892470912 and parameters: {'model_name': 'RandomForestImputer', 'max_iter': 3, 'decreasing': False, 'min_samples_split': 0.5, 'min_samples_leaf': 0.8, 'max_features': 0.7000000000000001, 'warm_start': False}. Best is trial 83 with value: 2.053319977993059.
[I 2023-12-28 12:47:55,517] Trial 124 finished with value: 2.0589293123666126 and parameters: {'model_name': 'RandomForestImputer', 'max_iter': 3, 'decreasing': False, 'min_samples_split': 0.4, 'min_samples_leaf': 0.8, 'max_features': 0.7000000000000001, 'warm_start': False}. Best is trial 83 with value: 2.053319977993059.
[I 2023-12-28 12:47:58,202] Trial 82 finished with value: 2.90639509920347 and parameters: {'model_name': 'IterativeImputer', 'sample_posterior': True, 'initial_strategy': 'most_frequent', 'imputation_order': 'random'}. Best is trial 83 with value: 2.053319977993059.
[I 2023-12-28 12:48:00,966] Trial 129 finished with value: 2.0597846760844933 and parameters: {'model_name': 'RandomForestImputer', 'max_iter': 3, 'decreasing': False, 'min_samples_split': 1.0, 'min_samples_leaf': 0.8, 'max_features': 0.7000000000000001, 'warm_start': False}. Best is trial 83 with value: 2.053319977993059.
[I 2023-12-28 12:48:02,428] Trial 125 finished with value: 2.0582659472736045 and parameters: {'model_name': 'RandomForestImputer', 'max_iter': 3, 'decreasing': False, 'min_samples_split': 1.0, 'min_samples_leaf': 0.8, 'max_features': 0.7000000000000001, 'warm_start': False}. Best is trial 83 with value: 2.053319977993059.
[I 2023-12-28 12:48:04,248] Trial 127 finished with value: 2.056303079524252 and parameters: {'model_name': 'RandomForestImputer', 'max_iter': 3, 'decreasing': True, 'min_samples_split': 1.0, 'min_samples_leaf': 0.8, 'max_features': 0.7000000000000001, 'warm_start': False}. Best is trial 83 with value: 2.053319977993059.
[I 2023-12-28 12:48:05,739] Trial 33 finished with value: 4.39705205935742 and parameters: {'model_name': 'GAIN', 'batch_size': 492, 'hint_rate': 0.74, 'alpha': 52, 'iterations': 90}. Best is trial 83 with value: 2.053319977993059.
[I 2023-12-28 12:48:15,305] Trial 128 finished with value: 2.0595914365364205 and parameters: {'model_name': 'RandomForestImputer', 'max_iter': 3, 'decreasing': False, 'min_samples_split': 0.9, 'min_samples_leaf': 0.8, 'max_features': 0.7000000000000001, 'warm_start': False}. Best is trial 83 with value: 2.053319977993059.
[I 2023-12-28 12:48:19,683] Trial 130 finished with value: 2.0582906207981986 and parameters: {'model_name': 'RandomForestImputer', 'max_iter': 3, 'decreasing': False, 'min_samples_split': 0.5, 'min_samples_leaf': 0.8, 'max_features': 0.7000000000000001, 'warm_start': False}. Best is trial 83 with value: 2.053319977993059.
[I 2023-12-28 12:48:37,811] Trial 64 finished with value: 4.5248123808528025 and parameters: {'model_name': 'GAIN', 'batch_size': 1, 'hint_rate': 0.78, 'alpha': 28, 'iterations': 129}. Best is trial 83 with value: 2.053319977993059.
[I 2023-12-28 12:48:40,965] Trial 131 finished with value: 2.058025777964831 and parameters: {'model_name': 'RandomForestImputer', 'max_iter': 4, 'decreasing': False, 'min_samples_split': 0.5, 'min_samples_leaf': 0.8, 'max_features': 0.7000000000000001, 'warm_start': False}. Best is trial 83 with value: 2.053319977993059.
[I 2023-12-28 12:49:14,162] Trial 146 finished with value: 2.056278651515781 and parameters: {'model_name': 'RandomForestImputer', 'max_iter': 3, 'decreasing': True, 'min_samples_split': 0.4, 'min_samples_leaf': 0.7000000000000001, 'max_features': 0.4, 'warm_start': False}. Best is trial 83 with value: 2.053319977993059.
[I 2023-12-28 12:49:19,939] Trial 135 finished with value: 2.058694324889388 and parameters: {'model_name': 'RandomForestImputer', 'max_iter': 4, 'decreasing': False, 'min_samples_split': 0.4, 'min_samples_leaf': 0.8, 'max_features': 0.7000000000000001, 'warm_start': False}. Best is trial 83 with value: 2.053319977993059.
[I 2023-12-28 12:49:20,901] Trial 137 finished with value: 2.0575518843474105 and parameters: {'model_name': 'RandomForestImputer', 'max_iter': 4, 'decreasing': False, 'min_samples_split': 0.4, 'min_samples_leaf': 0.8, 'max_features': 0.7000000000000001, 'warm_start': False}. Best is trial 83 with value: 2.053319977993059.
[I 2023-12-28 12:49:23,097] Trial 132 finished with value: 2.0579754322264985 and parameters: {'model_name': 'RandomForestImputer', 'max_iter': 4, 'decreasing': False, 'min_samples_split': 0.4, 'min_samples_leaf': 0.8, 'max_features': 0.7000000000000001, 'warm_start': False}. Best is trial 83 with value: 2.053319977993059.
[I 2023-12-28 12:49:31,888] Trial 155 finished with value: 2.054505309266316 and parameters: {'model_name': 'RandomForestImputer', 'max_iter': 4, 'decreasing': True, 'min_samples_split': 0.4, 'min_samples_leaf': 0.2, 'max_features': 0.2, 'warm_start': False}. Best is trial 83 with value: 2.053319977993059.
[I 2023-12-28 12:49:35,510] Trial 154 finished with value: 2.0514688286176983 and parameters: {'model_name': 'RandomForestImputer', 'max_iter': 4, 'decreasing': True, 'min_samples_split': 0.4, 'min_samples_leaf': 0.2, 'max_features': 0.2, 'warm_start': False}. Best is trial 154 with value: 2.0514688286176983.
[I 2023-12-28 12:49:45,433] Trial 147 finished with value: 2.058277704018556 and parameters: {'model_name': 'RandomForestImputer', 'max_iter': 4, 'decreasing': True, 'min_samples_split': 0.4, 'min_samples_leaf': 0.7000000000000001, 'max_features': 0.4, 'warm_start': False}. Best is trial 154 with value: 2.0514688286176983.
[I 2023-12-28 12:49:48,833] Trial 140 finished with value: 2.0571609542684555 and parameters: {'model_name': 'RandomForestImputer', 'max_iter': 5, 'decreasing': True, 'min_samples_split': 0.4, 'min_samples_leaf': 0.9, 'max_features': 0.2, 'warm_start': False}. Best is trial 154 with value: 2.0514688286176983.
[I 2023-12-28 12:49:50,389] Trial 152 finished with value: 2.0566497500284155 and parameters: {'model_name': 'RandomForestImputer', 'max_iter': 5, 'decreasing': True, 'min_samples_split': 0.4, 'min_samples_leaf': 0.2, 'max_features': 0.2, 'warm_start': False}. Best is trial 154 with value: 2.0514688286176983.
[I 2023-12-28 12:49:57,128] Trial 136 finished with value: 2.057079224857219 and parameters: {'model_name': 'RandomForestImputer', 'max_iter': 5, 'decreasing': False, 'min_samples_split': 0.4, 'min_samples_leaf': 0.8, 'max_features': 0.7000000000000001, 'warm_start': False}. Best is trial 154 with value: 2.0514688286176983.
[I 2023-12-28 12:49:59,851] Trial 153 finished with value: 2.056909363405012 and parameters: {'model_name': 'RandomForestImputer', 'max_iter': 5, 'decreasing': True, 'min_samples_split': 0.4, 'min_samples_leaf': 0.7000000000000001, 'max_features': 0.2, 'warm_start': False}. Best is trial 154 with value: 2.0514688286176983.
[I 2023-12-28 12:50:03,270] Trial 134 finished with value: 2.0587241041978404 and parameters: {'model_name': 'RandomForestImputer', 'max_iter': 6, 'decreasing': False, 'min_samples_split': 0.4, 'min_samples_leaf': 0.8, 'max_features': 0.7000000000000001, 'warm_start': False}. Best is trial 154 with value: 2.0514688286176983.
[I 2023-12-28 12:50:04,806] Trial 151 finished with value: 2.056228740894989 and parameters: {'model_name': 'RandomForestImputer', 'max_iter': 5, 'decreasing': True, 'min_samples_split': 0.4, 'min_samples_leaf': 0.2, 'max_features': 0.2, 'warm_start': False}. Best is trial 154 with value: 2.0514688286176983.
[I 2023-12-28 12:50:06,241] Trial 160 finished with value: 2.0591121026534935 and parameters: {'model_name': 'RandomForestImputer', 'max_iter': 4, 'decreasing': False, 'min_samples_split': 0.4, 'min_samples_leaf': 0.2, 'max_features': 0.2, 'warm_start': False}. Best is trial 154 with value: 2.0514688286176983.
[I 2023-12-28 12:50:07,593] Trial 138 finished with value: 2.05824017257159 and parameters: {'model_name': 'RandomForestImputer', 'max_iter': 5, 'decreasing': True, 'min_samples_split': 0.4, 'min_samples_leaf': 0.8, 'max_features': 0.30000000000000004, 'warm_start': False}. Best is trial 154 with value: 2.0514688286176983.
[I 2023-12-28 12:50:09,639] Trial 62 finished with value: 3.942307344120028 and parameters: {'model_name': 'GAIN', 'batch_size': 1, 'hint_rate': 0.01, 'alpha': 44, 'iterations': 156}. Best is trial 154 with value: 2.0514688286176983.
[I 2023-12-28 12:50:12,539] Trial 185 finished with value: 2.2621947337526542 and parameters: {'model_name': 'KNNImputer', 'weights': 'distance', 'keep_empty_features': False}. Best is trial 154 with value: 2.0514688286176983.
[I 2023-12-28 12:50:14,501] Trial 149 finished with value: 2.050266675816185 and parameters: {'model_name': 'RandomForestImputer', 'max_iter': 5, 'decreasing': True, 'min_samples_split': 0.4, 'min_samples_leaf': 0.2, 'max_features': 0.2, 'warm_start': False}. Best is trial 149 with value: 2.050266675816185.
[I 2023-12-28 12:50:15,634] Trial 141 finished with value: 2.0577565148017767 and parameters: {'model_name': 'RandomForestImputer', 'max_iter': 5, 'decreasing': True, 'min_samples_split': 0.4, 'min_samples_leaf': 0.9, 'max_features': 0.4, 'warm_start': False}. Best is trial 149 with value: 2.050266675816185.
[I 2023-12-28 12:50:16,607] Trial 186 finished with value: 2.2621947337526542 and parameters: {'model_name': 'KNNImputer', 'weights': 'distance', 'keep_empty_features': False}. Best is trial 149 with value: 2.050266675816185.
[I 2023-12-28 12:50:18,591] Trial 139 finished with value: 2.0567897699418234 and parameters: {'model_name': 'RandomForestImputer', 'max_iter': 5, 'decreasing': True, 'min_samples_split': 0.4, 'min_samples_leaf': 0.9, 'max_features': 0.30000000000000004, 'warm_start': False}. Best is trial 149 with value: 2.050266675816185.
[I 2023-12-28 12:50:20,457] Trial 148 finished with value: 2.059192747089175 and parameters: {'model_name': 'RandomForestImputer', 'max_iter': 5, 'decreasing': True, 'min_samples_split': 0.4, 'min_samples_leaf': 0.4, 'max_features': 0.2, 'warm_start': False}. Best is trial 149 with value: 2.050266675816185.
[I 2023-12-28 12:50:29,385] Trial 166 finished with value: 2.0578913493623228 and parameters: {'model_name': 'RandomForestImputer', 'max_iter': 4, 'decreasing': True, 'min_samples_split': 0.4, 'min_samples_leaf': 0.2, 'max_features': 0.2, 'warm_start': False}. Best is trial 149 with value: 2.050266675816185.
[I 2023-12-28 12:50:33,745] Trial 165 finished with value: 2.048734215142962 and parameters: {'model_name': 'RandomForestImputer', 'max_iter': 4, 'decreasing': True, 'min_samples_split': 0.4, 'min_samples_leaf': 0.2, 'max_features': 0.2, 'warm_start': False}. Best is trial 165 with value: 2.048734215142962.
[I 2023-12-28 12:50:37,093] Trial 143 finished with value: 2.0574252877033006 and parameters: {'model_name': 'RandomForestImputer', 'max_iter': 5, 'decreasing': True, 'min_samples_split': 0.4, 'min_samples_leaf': 0.8, 'max_features': 0.5, 'warm_start': False}. Best is trial 165 with value: 2.048734215142962.
[I 2023-12-28 12:50:38,034] Trial 144 finished with value: 2.058670867228767 and parameters: {'model_name': 'RandomForestImputer', 'max_iter': 5, 'decreasing': True, 'min_samples_split': 0.4, 'min_samples_leaf': 0.8, 'max_features': 0.2, 'warm_start': False}. Best is trial 165 with value: 2.048734215142962.
[I 2023-12-28 12:50:39,717] Trial 162 finished with value: 2.0549490985996894 and parameters: {'model_name': 'RandomForestImputer', 'max_iter': 4, 'decreasing': False, 'min_samples_split': 0.4, 'min_samples_leaf': 0.2, 'max_features': 0.2, 'warm_start': False}. Best is trial 165 with value: 2.048734215142962.
[I 2023-12-28 12:50:40,788] Trial 150 finished with value: 2.0586361575996373 and parameters: {'model_name': 'RandomForestImputer', 'max_iter': 5, 'decreasing': True, 'min_samples_split': 0.4, 'min_samples_leaf': 0.7000000000000001, 'max_features': 0.2, 'warm_start': False}. Best is trial 165 with value: 2.048734215142962.
[I 2023-12-28 12:50:42,219] Trial 163 finished with value: 2.0605535007734788 and parameters: {'model_name': 'RandomForestImputer', 'max_iter': 4, 'decreasing': True, 'min_samples_split': 0.4, 'min_samples_leaf': 0.2, 'max_features': 0.2, 'warm_start': False}. Best is trial 165 with value: 2.048734215142962.
