[I 2024-01-05 00:05:12,724] Trial 16 finished with value: 7023.0385611637 and parameters: {'model_name': 'SimpleImputer', 'strategy': 'constant'}. Best is trial 16 with value: 7023.0385611637.
[I 2024-01-05 00:05:13,976] Trial 14 finished with value: 3206.0108649033655 and parameters: {'model_name': 'SimpleImputer', 'strategy': 'mean'}. Best is trial 14 with value: 3206.0108649033655.
[I 2024-01-05 00:05:14,755] Trial 4 finished with value: 3206.0108649033655 and parameters: {'model_name': 'SimpleImputer', 'strategy': 'mean'}. Best is trial 14 with value: 3206.0108649033655.
[I 2024-01-05 00:05:15,692] Trial 24 finished with value: 7023.0385611637 and parameters: {'model_name': 'SimpleImputer', 'strategy': 'constant'}. Best is trial 14 with value: 3206.0108649033655.
[I 2024-01-05 00:05:16,497] Trial 18 finished with value: 3206.0108649033655 and parameters: {'model_name': 'SimpleImputer', 'strategy': 'mean'}. Best is trial 14 with value: 3206.0108649033655.
[I 2024-01-05 00:05:17,102] Trial 19 finished with value: 3196.254628138776 and parameters: {'model_name': 'SimpleImputer', 'strategy': 'median'}. Best is trial 19 with value: 3196.254628138776.
[I 2024-01-05 00:05:18,159] Trial 34 finished with value: 3206.0108649033655 and parameters: {'model_name': 'SimpleImputer', 'strategy': 'mean'}. Best is trial 19 with value: 3196.254628138776.
[I 2024-01-05 00:05:18,851] Trial 28 finished with value: 3196.254628138776 and parameters: {'model_name': 'SimpleImputer', 'strategy': 'median'}. Best is trial 19 with value: 3196.254628138776.
[I 2024-01-05 00:05:20,331] Trial 50 finished with value: 3206.0108649033655 and parameters: {'model_name': 'SimpleImputer', 'strategy': 'mean'}. Best is trial 19 with value: 3196.254628138776.
[I 2024-01-05 00:05:22,814] Trial 52 finished with value: 3206.0108649033655 and parameters: {'model_name': 'SimpleImputer', 'strategy': 'mean'}. Best is trial 19 with value: 3196.254628138776.
2024-01-05 00:05:24.636460: E external/local_xla/xla/stream_executor/cuda/cuda_driver.cc:274] failed call to cuInit: CUDA_ERROR_NO_DEVICE: no CUDA-capable device is detected
2024-01-05 00:05:25.225382: I tensorflow/compiler/mlir/mlir_graph_optimization_pass.cc:388] MLIR V1 optimization pass is not enabled
[I 2024-01-05 00:05:28,356] Trial 21 finished with value: 3196.437230863756 and parameters: {'model_name': 'SimpleImputer', 'strategy': 'most_frequent'}. Best is trial 19 with value: 3196.254628138776.
[I 2024-01-05 00:05:29,449] Trial 27 finished with value: 3196.437230863756 and parameters: {'model_name': 'SimpleImputer', 'strategy': 'most_frequent'}. Best is trial 19 with value: 3196.254628138776.
[I 2024-01-05 00:05:30,072] Trial 31 finished with value: 3196.437230863756 and parameters: {'model_name': 'SimpleImputer', 'strategy': 'most_frequent'}. Best is trial 19 with value: 3196.254628138776.
[I 2024-01-05 00:05:31,879] Trial 37 finished with value: 3196.437230863756 and parameters: {'model_name': 'SimpleImputer', 'strategy': 'most_frequent'}. Best is trial 19 with value: 3196.254628138776.
[I 2024-01-05 00:05:32,702] Trial 49 finished with value: 3196.437230863756 and parameters: {'model_name': 'SimpleImputer', 'strategy': 'most_frequent'}. Best is trial 19 with value: 3196.254628138776.
[I 2024-01-05 00:05:34,602] Trial 5 finished with value: 3291.8694904701842 and parameters: {'model_name': 'KNNImputer', 'weights': 'distance', 'keep_empty_features': False}. Best is trial 19 with value: 3196.254628138776.
[I 2024-01-05 00:05:35,396] Trial 3 finished with value: 3291.8694904701842 and parameters: {'model_name': 'KNNImputer', 'weights': 'distance', 'keep_empty_features': False}. Best is trial 19 with value: 3196.254628138776.
[I 2024-01-05 00:05:36,172] Trial 29 finished with value: 3291.8694904701842 and parameters: {'model_name': 'KNNImputer', 'weights': 'distance', 'keep_empty_features': False}. Best is trial 19 with value: 3196.254628138776.
[I 2024-01-05 00:05:37,508] Trial 38 finished with value: 3291.8694904701842 and parameters: {'model_name': 'KNNImputer', 'weights': 'distance', 'keep_empty_features': False}. Best is trial 19 with value: 3196.254628138776.
[I 2024-01-05 00:05:38,366] Trial 39 finished with value: 3291.8694904701842 and parameters: {'model_name': 'KNNImputer', 'weights': 'distance', 'keep_empty_features': False}. Best is trial 19 with value: 3196.254628138776.
[I 2024-01-05 00:05:46,455] Trial 42 finished with value: 3206.0108649033655 and parameters: {'model_name': 'RandomForestImputer', 'max_iter': 1, 'decreasing': True, 'min_samples_split': 0.0, 'min_samples_leaf': 0.4, 'max_features': 0.8, 'warm_start': True}. Best is trial 19 with value: 3196.254628138776.
[I 2024-01-05 00:05:48,180] Trial 33 finished with value: 3206.0108649033655 and parameters: {'model_name': 'RandomForestImputer', 'max_iter': 1, 'decreasing': True, 'min_samples_split': 0.1, 'min_samples_leaf': 0.9, 'max_features': 0.8, 'warm_start': True}. Best is trial 19 with value: 3196.254628138776.
[I 2024-01-05 00:05:49,849] Trial 62 finished with value: 3289.841686561131 and parameters: {'model_name': 'KNNImputer', 'weights': 'uniform', 'keep_empty_features': False}. Best is trial 19 with value: 3196.254628138776.
[I 2024-01-05 00:05:51,826] Trial 56 finished with value: 3206.0108649033655 and parameters: {'model_name': 'RandomForestImputer', 'max_iter': 1, 'decreasing': True, 'min_samples_split': 0.6000000000000001, 'min_samples_leaf': 0.9, 'max_features': 0.8, 'warm_start': True}. Best is trial 19 with value: 3196.254628138776.
[I 2024-01-05 00:06:17,001] Trial 30 finished with value: 3421.902661648586 and parameters: {'model_name': 'RandomForestImputer', 'max_iter': 2, 'decreasing': True, 'min_samples_split': 0.30000000000000004, 'min_samples_leaf': 0.30000000000000004, 'max_features': 0.7000000000000001, 'warm_start': True}. Best is trial 19 with value: 3196.254628138776.
[I 2024-01-05 00:06:54,307] Trial 53 finished with value: 3206.0108649033655 and parameters: {'model_name': 'RandomForestImputer', 'max_iter': 1, 'decreasing': False, 'min_samples_split': 0.9, 'min_samples_leaf': 0.2, 'max_features': 0.2, 'warm_start': False}. Best is trial 19 with value: 3196.254628138776.
[I 2024-01-05 00:06:56,736] Trial 25 finished with value: 7425.00249145651 and parameters: {'model_name': 'GAIN', 'batch_size': 793, 'hint_rate': 0.27, 'alpha': 75, 'iterations': 1}. Best is trial 19 with value: 3196.254628138776.
[I 2024-01-05 00:07:00,026] Trial 10 finished with value: 6398.0477583592165 and parameters: {'model_name': 'GAIN', 'batch_size': 1, 'hint_rate': 0.52, 'alpha': 13, 'iterations': 3}. Best is trial 19 with value: 3196.254628138776.
[I 2024-01-05 00:07:02,860] Trial 61 finished with value: 3206.0108649033655 and parameters: {'model_name': 'RandomForestImputer', 'max_iter': 1, 'decreasing': False, 'min_samples_split': 0.1, 'min_samples_leaf': 0.1, 'max_features': 0.2, 'warm_start': False}. Best is trial 19 with value: 3196.254628138776.
[I 2024-01-05 00:07:03,771] Trial 2 finished with value: 8829.140037612493 and parameters: {'model_name': 'GAIN', 'batch_size': 52, 'hint_rate': 0.21000000000000002, 'alpha': 0, 'iterations': 4}. Best is trial 19 with value: 3196.254628138776.
[I 2024-01-05 00:07:06,013] Trial 15 finished with value: 7876.08437563405 and parameters: {'model_name': 'GAIN', 'batch_size': 221, 'hint_rate': 0.7000000000000001, 'alpha': 0, 'iterations': 4}. Best is trial 19 with value: 3196.254628138776.
[I 2024-01-05 00:07:19,528] Trial 6 finished with value: 13829.599463230383 and parameters: {'model_name': 'GAIN', 'batch_size': 314, 'hint_rate': 0.5800000000000001, 'alpha': 57, 'iterations': 8}. Best is trial 19 with value: 3196.254628138776.
[I 2024-01-05 00:07:23,104] Trial 63 finished with value: 3417.6272255790304 and parameters: {'model_name': 'RandomForestImputer', 'max_iter': 8, 'decreasing': True, 'min_samples_split': 0.4, 'min_samples_leaf': 0.5, 'max_features': 0.7000000000000001, 'warm_start': True}. Best is trial 19 with value: 3196.254628138776.
[I 2024-01-05 00:07:24,116] Trial 69 finished with value: 9193.427181070578 and parameters: {'model_name': 'GAIN', 'batch_size': 8, 'hint_rate': 0.8400000000000001, 'alpha': 80, 'iterations': 3}. Best is trial 19 with value: 3196.254628138776.
[I 2024-01-05 00:07:27,201] Trial 80 finished with value: 3196.254628138776 and parameters: {'model_name': 'SimpleImputer', 'strategy': 'median'}. Best is trial 19 with value: 3196.254628138776.
[I 2024-01-05 00:07:30,327] Trial 82 finished with value: 3196.254628138776 and parameters: {'model_name': 'SimpleImputer', 'strategy': 'median'}. Best is trial 19 with value: 3196.254628138776.
[I 2024-01-05 00:07:31,053] Trial 47 finished with value: 3404.655981956009 and parameters: {'model_name': 'RandomForestImputer', 'max_iter': 11, 'decreasing': False, 'min_samples_split': 0.1, 'min_samples_leaf': 0.7000000000000001, 'max_features': 0.30000000000000004, 'warm_start': True}. Best is trial 19 with value: 3196.254628138776.
[I 2024-01-05 00:08:04,506] Trial 71 finished with value: 8781.996098434522 and parameters: {'model_name': 'GAIN', 'batch_size': 1, 'hint_rate': 0.6, 'alpha': 11, 'iterations': 18}. Best is trial 19 with value: 3196.254628138776.
[I 2024-01-05 00:08:06,737] Trial 58 finished with value: 3404.5108711817643 and parameters: {'model_name': 'RandomForestImputer', 'max_iter': 17, 'decreasing': False, 'min_samples_split': 0.8, 'min_samples_leaf': 0.9, 'max_features': 0.6, 'warm_start': True}. Best is trial 19 with value: 3196.254628138776.
[I 2024-01-05 00:08:30,520] Trial 48 finished with value: 3417.447655598473 and parameters: {'model_name': 'RandomForestImputer', 'max_iter': 24, 'decreasing': True, 'min_samples_split': 0.9, 'min_samples_leaf': 0.6, 'max_features': 0.9, 'warm_start': True}. Best is trial 19 with value: 3196.254628138776.
[I 2024-01-05 00:08:45,806] Trial 73 finished with value: 8120.4336482747 and parameters: {'model_name': 'GAIN', 'batch_size': 1, 'hint_rate': 0.98, 'alpha': 29, 'iterations': 10}. Best is trial 19 with value: 3196.254628138776.
[I 2024-01-05 00:08:56,654] Trial 36 finished with value: 9101.086523162285 and parameters: {'model_name': 'GAIN', 'batch_size': 52, 'hint_rate': 0.9, 'alpha': 94, 'iterations': 41}. Best is trial 19 with value: 3196.254628138776.
[I 2024-01-05 00:09:56,875] Trial 57 finished with value: 3716.2876268644386 and parameters: {'model_name': 'IterativeImputer', 'sample_posterior': False, 'initial_strategy': 'mean', 'imputation_order': 'arabic'}. Best is trial 19 with value: 3196.254628138776.
[I 2024-01-05 00:09:58,563] Trial 46 finished with value: 3716.2875916510056 and parameters: {'model_name': 'IterativeImputer', 'sample_posterior': False, 'initial_strategy': 'most_frequent', 'imputation_order': 'arabic'}. Best is trial 19 with value: 3196.254628138776.
[I 2024-01-05 00:10:01,231] Trial 45 finished with value: 3716.4781935605906 and parameters: {'model_name': 'IterativeImputer', 'sample_posterior': False, 'initial_strategy': 'most_frequent', 'imputation_order': 'descending'}. Best is trial 19 with value: 3196.254628138776.
[I 2024-01-05 00:10:02,219] Trial 8 finished with value: 3714.5865952058475 and parameters: {'model_name': 'IterativeImputer', 'sample_posterior': False, 'initial_strategy': 'median', 'imputation_order': 'roman'}. Best is trial 19 with value: 3196.254628138776.
[I 2024-01-05 00:10:03,094] Trial 91 finished with value: 3196.254628138776 and parameters: {'model_name': 'SimpleImputer', 'strategy': 'median'}. Best is trial 19 with value: 3196.254628138776.
[I 2024-01-05 00:10:03,975] Trial 41 finished with value: 3716.2875916510056 and parameters: {'model_name': 'IterativeImputer', 'sample_posterior': False, 'initial_strategy': 'most_frequent', 'imputation_order': 'arabic'}. Best is trial 19 with value: 3196.254628138776.
[I 2024-01-05 00:10:06,847] Trial 13 finished with value: 3714.5844806040964 and parameters: {'model_name': 'IterativeImputer', 'sample_posterior': False, 'initial_strategy': 'most_frequent', 'imputation_order': 'roman'}. Best is trial 19 with value: 3196.254628138776.
[I 2024-01-05 00:10:07,599] Trial 92 finished with value: 3196.254628138776 and parameters: {'model_name': 'SimpleImputer', 'strategy': 'median'}. Best is trial 19 with value: 3196.254628138776.
[I 2024-01-05 00:10:08,474] Trial 94 finished with value: 3196.254628138776 and parameters: {'model_name': 'SimpleImputer', 'strategy': 'median'}. Best is trial 19 with value: 3196.254628138776.
[I 2024-01-05 00:10:09,174] Trial 93 finished with value: 3196.254628138776 and parameters: {'model_name': 'SimpleImputer', 'strategy': 'median'}. Best is trial 19 with value: 3196.254628138776.
[I 2024-01-05 00:10:10,013] Trial 95 finished with value: 3196.254628138776 and parameters: {'model_name': 'SimpleImputer', 'strategy': 'median'}. Best is trial 19 with value: 3196.254628138776.
[I 2024-01-05 00:10:12,612] Trial 96 finished with value: 3196.254628138776 and parameters: {'model_name': 'SimpleImputer', 'strategy': 'median'}. Best is trial 19 with value: 3196.254628138776.
[I 2024-01-05 00:10:13,629] Trial 97 finished with value: 3196.254628138776 and parameters: {'model_name': 'SimpleImputer', 'strategy': 'median'}. Best is trial 19 with value: 3196.254628138776.
[I 2024-01-05 00:10:14,310] Trial 98 finished with value: 3196.254628138776 and parameters: {'model_name': 'SimpleImputer', 'strategy': 'median'}. Best is trial 19 with value: 3196.254628138776.
[I 2024-01-05 00:10:15,363] Trial 99 finished with value: 3196.254628138776 and parameters: {'model_name': 'SimpleImputer', 'strategy': 'median'}. Best is trial 19 with value: 3196.254628138776.
[I 2024-01-05 00:10:16,615] Trial 100 finished with value: 3196.254628138776 and parameters: {'model_name': 'SimpleImputer', 'strategy': 'median'}. Best is trial 19 with value: 3196.254628138776.
[I 2024-01-05 00:10:19,180] Trial 102 finished with value: 3196.254628138776 and parameters: {'model_name': 'SimpleImputer', 'strategy': 'median'}. Best is trial 19 with value: 3196.254628138776.
[I 2024-01-05 00:10:19,987] Trial 103 finished with value: 3196.254628138776 and parameters: {'model_name': 'SimpleImputer', 'strategy': 'median'}. Best is trial 19 with value: 3196.254628138776.
[I 2024-01-05 00:10:20,741] Trial 101 finished with value: 3196.254628138776 and parameters: {'model_name': 'SimpleImputer', 'strategy': 'median'}. Best is trial 19 with value: 3196.254628138776.
[I 2024-01-05 00:10:21,592] Trial 105 finished with value: 3196.254628138776 and parameters: {'model_name': 'SimpleImputer', 'strategy': 'median'}. Best is trial 19 with value: 3196.254628138776.
[I 2024-01-05 00:10:22,539] Trial 104 finished with value: 3196.254628138776 and parameters: {'model_name': 'SimpleImputer', 'strategy': 'median'}. Best is trial 19 with value: 3196.254628138776.
[I 2024-01-05 00:10:25,089] Trial 106 finished with value: 3196.254628138776 and parameters: {'model_name': 'SimpleImputer', 'strategy': 'median'}. Best is trial 19 with value: 3196.254628138776.
[I 2024-01-05 00:10:26,009] Trial 107 finished with value: 3196.254628138776 and parameters: {'model_name': 'SimpleImputer', 'strategy': 'median'}. Best is trial 19 with value: 3196.254628138776.
[I 2024-01-05 00:10:26,794] Trial 109 finished with value: 3196.254628138776 and parameters: {'model_name': 'SimpleImputer', 'strategy': 'median'}. Best is trial 19 with value: 3196.254628138776.
[I 2024-01-05 00:10:27,560] Trial 108 finished with value: 3196.254628138776 and parameters: {'model_name': 'SimpleImputer', 'strategy': 'median'}. Best is trial 19 with value: 3196.254628138776.
[I 2024-01-05 00:10:28,626] Trial 66 finished with value: 3716.2875916510056 and parameters: {'model_name': 'IterativeImputer', 'sample_posterior': False, 'initial_strategy': 'most_frequent', 'imputation_order': 'arabic'}. Best is trial 19 with value: 3196.254628138776.
[I 2024-01-05 00:10:29,403] Trial 110 finished with value: 3196.254628138776 and parameters: {'model_name': 'SimpleImputer', 'strategy': 'median'}. Best is trial 19 with value: 3196.254628138776.
[I 2024-01-05 00:10:31,523] Trial 111 finished with value: 3196.254628138776 and parameters: {'model_name': 'SimpleImputer', 'strategy': 'median'}. Best is trial 19 with value: 3196.254628138776.
[I 2024-01-05 00:10:32,515] Trial 113 finished with value: 3196.254628138776 and parameters: {'model_name': 'SimpleImputer', 'strategy': 'median'}. Best is trial 19 with value: 3196.254628138776.
[I 2024-01-05 00:10:33,248] Trial 116 finished with value: 7023.0385611637 and parameters: {'model_name': 'SimpleImputer', 'strategy': 'constant'}. Best is trial 19 with value: 3196.254628138776.
[I 2024-01-05 00:10:33,910] Trial 114 finished with value: 3196.254628138776 and parameters: {'model_name': 'SimpleImputer', 'strategy': 'median'}. Best is trial 19 with value: 3196.254628138776.
[I 2024-01-05 00:10:35,001] Trial 112 finished with value: 3196.254628138776 and parameters: {'model_name': 'SimpleImputer', 'strategy': 'median'}. Best is trial 19 with value: 3196.254628138776.
[I 2024-01-05 00:10:36,191] Trial 115 finished with value: 3196.254628138776 and parameters: {'model_name': 'SimpleImputer', 'strategy': 'median'}. Best is trial 19 with value: 3196.254628138776.
[I 2024-01-05 00:10:37,954] Trial 117 finished with value: 7023.0385611637 and parameters: {'model_name': 'SimpleImputer', 'strategy': 'constant'}. Best is trial 19 with value: 3196.254628138776.
[I 2024-01-05 00:10:38,698] Trial 118 finished with value: 7023.0385611637 and parameters: {'model_name': 'SimpleImputer', 'strategy': 'constant'}. Best is trial 19 with value: 3196.254628138776.
[I 2024-01-05 00:10:40,421] Trial 119 finished with value: 3196.254628138776 and parameters: {'model_name': 'SimpleImputer', 'strategy': 'median'}. Best is trial 19 with value: 3196.254628138776.
[I 2024-01-05 00:10:41,208] Trial 120 finished with value: 3196.254628138776 and parameters: {'model_name': 'SimpleImputer', 'strategy': 'median'}. Best is trial 19 with value: 3196.254628138776.
[I 2024-01-05 00:10:45,842] Trial 12 finished with value: 3208.0849545602487 and parameters: {'model_name': 'RandomForestImputer', 'max_iter': 3, 'decreasing': True, 'min_samples_split': 0.2, 'min_samples_leaf': 0.6, 'max_features': 0.30000000000000004, 'warm_start': False}. Best is trial 19 with value: 3196.254628138776.
[I 2024-01-05 00:10:48,173] Trial 1 finished with value: 3209.049280050754 and parameters: {'model_name': 'RandomForestImputer', 'max_iter': 3, 'decreasing': False, 'min_samples_split': 0.8, 'min_samples_leaf': 0.8, 'max_features': 0.2, 'warm_start': False}. Best is trial 19 with value: 3196.254628138776.
[I 2024-01-05 00:10:56,653] Trial 121 finished with value: 3289.841686561131 and parameters: {'model_name': 'KNNImputer', 'weights': 'uniform', 'keep_empty_features': False}. Best is trial 19 with value: 3196.254628138776.
[I 2024-01-05 00:10:58,934] Trial 122 finished with value: 3289.841686561131 and parameters: {'model_name': 'KNNImputer', 'weights': 'uniform', 'keep_empty_features': False}. Best is trial 19 with value: 3196.254628138776.
[I 2024-01-05 00:11:00,111] Trial 123 finished with value: 3289.841686561131 and parameters: {'model_name': 'KNNImputer', 'weights': 'uniform', 'keep_empty_features': False}. Best is trial 19 with value: 3196.254628138776.
[I 2024-01-05 00:11:01,186] Trial 124 finished with value: 3289.841686561131 and parameters: {'model_name': 'KNNImputer', 'weights': 'uniform', 'keep_empty_features': False}. Best is trial 19 with value: 3196.254628138776.
[I 2024-01-05 00:11:02,362] Trial 125 finished with value: 3289.841686561131 and parameters: {'model_name': 'KNNImputer', 'weights': 'uniform', 'keep_empty_features': False}. Best is trial 19 with value: 3196.254628138776.
[I 2024-01-05 00:11:03,251] Trial 126 finished with value: 3289.841686561131 and parameters: {'model_name': 'KNNImputer', 'weights': 'uniform', 'keep_empty_features': False}. Best is trial 19 with value: 3196.254628138776.
[I 2024-01-05 00:11:04,104] Trial 129 finished with value: 3196.254628138776 and parameters: {'model_name': 'SimpleImputer', 'strategy': 'median'}. Best is trial 19 with value: 3196.254628138776.
[I 2024-01-05 00:11:05,844] Trial 130 finished with value: 3196.254628138776 and parameters: {'model_name': 'SimpleImputer', 'strategy': 'median'}. Best is trial 19 with value: 3196.254628138776.
[I 2024-01-05 00:11:07,152] Trial 131 finished with value: 3196.254628138776 and parameters: {'model_name': 'SimpleImputer', 'strategy': 'median'}. Best is trial 19 with value: 3196.254628138776.
[I 2024-01-05 00:11:08,439] Trial 132 finished with value: 3196.254628138776 and parameters: {'model_name': 'SimpleImputer', 'strategy': 'median'}. Best is trial 19 with value: 3196.254628138776.
[I 2024-01-05 00:11:09,675] Trial 134 finished with value: 3196.254628138776 and parameters: {'model_name': 'SimpleImputer', 'strategy': 'median'}. Best is trial 19 with value: 3196.254628138776.
[I 2024-01-05 00:11:10,399] Trial 135 finished with value: 3196.254628138776 and parameters: {'model_name': 'SimpleImputer', 'strategy': 'median'}. Best is trial 19 with value: 3196.254628138776.
[I 2024-01-05 00:11:11,062] Trial 127 finished with value: 3289.841686561131 and parameters: {'model_name': 'KNNImputer', 'weights': 'uniform', 'keep_empty_features': False}. Best is trial 19 with value: 3196.254628138776.
[I 2024-01-05 00:11:11,763] Trial 133 finished with value: 3196.254628138776 and parameters: {'model_name': 'SimpleImputer', 'strategy': 'median'}. Best is trial 19 with value: 3196.254628138776.
[I 2024-01-05 00:11:13,620] Trial 136 finished with value: 3196.254628138776 and parameters: {'model_name': 'SimpleImputer', 'strategy': 'median'}. Best is trial 19 with value: 3196.254628138776.
