[I 2023-12-12 15:36:00,355] Trial 9 finished with value: 2630.336044267721 and parameters: {'model_name': 'SimpleImputer', 'strategy': 'mean'}. Best is trial 9 with value: 2630.336044267721.
[I 2023-12-12 15:36:00,636] Trial 1 finished with value: 2630.336044267721 and parameters: {'model_name': 'SimpleImputer', 'strategy': 'mean'}. Best is trial 9 with value: 2630.336044267721.
[I 2023-12-12 15:36:01,476] Trial 14 finished with value: 2740.4678018735967 and parameters: {'model_name': 'SimpleImputer', 'strategy': 'constant'}. Best is trial 9 with value: 2630.336044267721.
[I 2023-12-12 15:36:01,909] Trial 48 finished with value: inf and parameters: {'model_name': 'IterativeImputer', 'estimator': 'KNN', 'sample_posterior': True, 'initial_strategy': 'constant', 'imputation_order': 'arabic'}. Best is trial 9 with value: 2630.336044267721.
[I 2023-12-12 15:36:02,612] Trial 17 finished with value: 2740.4678018735967 and parameters: {'model_name': 'SimpleImputer', 'strategy': 'constant'}. Best is trial 9 with value: 2630.336044267721.
[I 2023-12-12 15:36:03,057] Trial 29 finished with value: inf and parameters: {'model_name': 'IterativeImputer', 'estimator': 'Ridge', 'sample_posterior': True, 'initial_strategy': 'constant', 'imputation_order': 'random'}. Best is trial 9 with value: 2630.336044267721.
[I 2023-12-12 15:36:03,342] Trial 49 finished with value: inf and parameters: {'model_name': 'IterativeImputer', 'estimator': 'Ridge', 'sample_posterior': True, 'initial_strategy': 'mean', 'imputation_order': 'ascending'}. Best is trial 9 with value: 2630.336044267721.
[I 2023-12-12 15:36:03,636] Trial 16 finished with value: 2695.765084532545 and parameters: {'model_name': 'SimpleImputer', 'strategy': 'median'}. Best is trial 9 with value: 2630.336044267721.
[I 2023-12-12 15:36:04,148] Trial 40 finished with value: 2740.4678018735967 and parameters: {'model_name': 'SimpleImputer', 'strategy': 'constant'}. Best is trial 9 with value: 2630.336044267721.
[I 2023-12-12 15:36:04,498] Trial 28 finished with value: 2740.4678018735967 and parameters: {'model_name': 'SimpleImputer', 'strategy': 'constant'}. Best is trial 9 with value: 2630.336044267721.
[I 2023-12-12 15:36:05,019] Trial 43 finished with value: 2740.4678018735967 and parameters: {'model_name': 'SimpleImputer', 'strategy': 'constant'}. Best is trial 9 with value: 2630.336044267721.
[I 2023-12-12 15:36:05,462] Trial 47 finished with value: 2740.4678018735967 and parameters: {'model_name': 'SimpleImputer', 'strategy': 'constant'}. Best is trial 9 with value: 2630.336044267721.
[I 2023-12-12 15:36:06,485] Trial 51 finished with value: 2630.336044267721 and parameters: {'model_name': 'SimpleImputer', 'strategy': 'mean'}. Best is trial 9 with value: 2630.336044267721.
[I 2023-12-12 15:36:07,356] Trial 18 finished with value: 2695.765084532545 and parameters: {'model_name': 'SimpleImputer', 'strategy': 'median'}. Best is trial 9 with value: 2630.336044267721.
[I 2023-12-12 15:36:07,808] Trial 55 finished with value: 2740.4678018735967 and parameters: {'model_name': 'SimpleImputer', 'strategy': 'constant'}. Best is trial 9 with value: 2630.336044267721.
[I 2023-12-12 15:36:09,291] Trial 54 finished with value: 2695.765084532545 and parameters: {'model_name': 'SimpleImputer', 'strategy': 'median'}. Best is trial 9 with value: 2630.336044267721.
[I 2023-12-12 15:36:11,557] Trial 10 finished with value: 1341.8961467367287 and parameters: {'model_name': 'KNNImputer', 'weights': 'distance', 'keep_empty_features': False}. Best is trial 10 with value: 1341.8961467367287.
[I 2023-12-12 15:36:12,239] Trial 2 finished with value: 1341.8961467367287 and parameters: {'model_name': 'KNNImputer', 'weights': 'distance', 'keep_empty_features': False}. Best is trial 10 with value: 1341.8961467367287.
[I 2023-12-12 15:36:12,654] Trial 7 finished with value: 1318.834857175494 and parameters: {'model_name': 'KNNImputer', 'weights': 'uniform', 'keep_empty_features': False}. Best is trial 7 with value: 1318.834857175494.
[I 2023-12-12 15:36:13,141] Trial 5 finished with value: 1341.8961467367287 and parameters: {'model_name': 'KNNImputer', 'weights': 'distance', 'keep_empty_features': False}. Best is trial 7 with value: 1318.834857175494.
[I 2023-12-12 15:36:13,486] Trial 3 finished with value: 1318.834857175494 and parameters: {'model_name': 'KNNImputer', 'weights': 'uniform', 'keep_empty_features': False}. Best is trial 7 with value: 1318.834857175494.
2023-12-12 15:36:14.483563: E external/local_xla/xla/stream_executor/cuda/cuda_driver.cc:274] failed call to cuInit: CUDA_ERROR_NO_DEVICE: no CUDA-capable device is detected
[I 2023-12-12 15:36:14,488] Trial 4 finished with value: 1318.834857175494 and parameters: {'model_name': 'KNNImputer', 'weights': 'uniform', 'keep_empty_features': False}. Best is trial 7 with value: 1318.834857175494.
2023-12-12 15:36:15.049770: I tensorflow/compiler/mlir/mlir_graph_optimization_pass.cc:388] MLIR V1 optimization pass is not enabled
[I 2023-12-12 15:36:15,158] Trial 23 finished with value: 1341.8961467367287 and parameters: {'model_name': 'KNNImputer', 'weights': 'distance', 'keep_empty_features': False}. Best is trial 7 with value: 1318.834857175494.
[I 2023-12-12 15:36:15,523] Trial 21 finished with value: 1318.834857175494 and parameters: {'model_name': 'KNNImputer', 'weights': 'uniform', 'keep_empty_features': False}. Best is trial 7 with value: 1318.834857175494.
[I 2023-12-12 15:36:15,830] Trial 15 finished with value: 1341.8961467367287 and parameters: {'model_name': 'KNNImputer', 'weights': 'distance', 'keep_empty_features': False}. Best is trial 7 with value: 1318.834857175494.
[I 2023-12-12 15:36:16,497] Trial 35 finished with value: 1341.8961467367287 and parameters: {'model_name': 'KNNImputer', 'weights': 'distance', 'keep_empty_features': False}. Best is trial 7 with value: 1318.834857175494.
[I 2023-12-12 15:36:17,084] Trial 27 finished with value: 1341.8961467367287 and parameters: {'model_name': 'KNNImputer', 'weights': 'distance', 'keep_empty_features': False}. Best is trial 7 with value: 1318.834857175494.
[I 2023-12-12 15:36:17,619] Trial 34 finished with value: 1318.834857175494 and parameters: {'model_name': 'KNNImputer', 'weights': 'uniform', 'keep_empty_features': False}. Best is trial 7 with value: 1318.834857175494.
[I 2023-12-12 15:36:18,551] Trial 31 finished with value: 1318.834857175494 and parameters: {'model_name': 'KNNImputer', 'weights': 'uniform', 'keep_empty_features': False}. Best is trial 7 with value: 1318.834857175494.
[I 2023-12-12 15:36:19,414] Trial 57 finished with value: 1318.834857175494 and parameters: {'model_name': 'KNNImputer', 'weights': 'uniform', 'keep_empty_features': False}. Best is trial 7 with value: 1318.834857175494.
[I 2023-12-12 15:36:19,878] Trial 56 finished with value: 1341.8961467367287 and parameters: {'model_name': 'KNNImputer', 'weights': 'distance', 'keep_empty_features': False}. Best is trial 7 with value: 1318.834857175494.
[I 2023-12-12 15:36:20,832] Trial 58 finished with value: 1318.834857175494 and parameters: {'model_name': 'KNNImputer', 'weights': 'uniform', 'keep_empty_features': False}. Best is trial 7 with value: 1318.834857175494.
[I 2023-12-12 15:36:21,481] Trial 61 finished with value: 1341.8961467367287 and parameters: {'model_name': 'KNNImputer', 'weights': 'distance', 'keep_empty_features': False}. Best is trial 7 with value: 1318.834857175494.
[I 2023-12-12 15:36:21,925] Trial 62 finished with value: 1318.834857175494 and parameters: {'model_name': 'KNNImputer', 'weights': 'uniform', 'keep_empty_features': False}. Best is trial 7 with value: 1318.834857175494.
[I 2023-12-12 15:36:23,580] Trial 63 finished with value: 1341.8961467367287 and parameters: {'model_name': 'KNNImputer', 'weights': 'distance', 'keep_empty_features': False}. Best is trial 7 with value: 1318.834857175494.
[I 2023-12-12 15:36:24,999] Trial 64 finished with value: 1341.8961467367287 and parameters: {'model_name': 'KNNImputer', 'weights': 'distance', 'keep_empty_features': False}. Best is trial 7 with value: 1318.834857175494.
[I 2023-12-12 15:36:25,396] Trial 66 finished with value: 1318.834857175494 and parameters: {'model_name': 'KNNImputer', 'weights': 'uniform', 'keep_empty_features': False}. Best is trial 7 with value: 1318.834857175494.
[I 2023-12-12 15:36:25,878] Trial 65 finished with value: 1318.834857175494 and parameters: {'model_name': 'KNNImputer', 'weights': 'uniform', 'keep_empty_features': False}. Best is trial 7 with value: 1318.834857175494.
[I 2023-12-12 15:36:26,480] Trial 68 finished with value: 1318.834857175494 and parameters: {'model_name': 'KNNImputer', 'weights': 'uniform', 'keep_empty_features': False}. Best is trial 7 with value: 1318.834857175494.
[I 2023-12-12 15:36:26,483] Trial 69 finished with value: 1318.834857175494 and parameters: {'model_name': 'KNNImputer', 'weights': 'uniform', 'keep_empty_features': False}. Best is trial 7 with value: 1318.834857175494.
[I 2023-12-12 15:36:27,226] Trial 67 finished with value: 1318.834857175494 and parameters: {'model_name': 'KNNImputer', 'weights': 'uniform', 'keep_empty_features': False}. Best is trial 7 with value: 1318.834857175494.
[I 2023-12-12 15:36:30,345] Trial 36 finished with value: 2630.336044267721 and parameters: {'model_name': 'RandomForestImputer', 'max_iter': 1, 'decreasing': False, 'min_samples_split': 0.1, 'min_samples_leaf': 0.1, 'max_features': 0.8, 'warm_start': True}. Best is trial 7 with value: 1318.834857175494.
[I 2023-12-12 15:36:31,071] Trial 41 finished with value: 2630.336044267721 and parameters: {'model_name': 'RandomForestImputer', 'max_iter': 1, 'decreasing': False, 'min_samples_split': 0.30000000000000004, 'min_samples_leaf': 0.7000000000000001, 'max_features': 0.4, 'warm_start': True}. Best is trial 7 with value: 1318.834857175494.
[I 2023-12-12 15:36:36,825] Trial 90 finished with value: inf and parameters: {'model_name': 'GAIN', 'batch_size': 867, 'hint_rate': 0.41000000000000003, 'alpha': 49, 'iterations': 25}. Best is trial 7 with value: 1318.834857175494.
[I 2023-12-12 15:36:51,332] Trial 71 finished with value: 2700.8582794787935 and parameters: {'model_name': 'RandomForestImputer', 'max_iter': 2, 'decreasing': True, 'min_samples_split': 0.0, 'min_samples_leaf': 0.7000000000000001, 'max_features': 0.30000000000000004, 'warm_start': True}. Best is trial 7 with value: 1318.834857175494.
[I 2023-12-12 15:36:58,271] Trial 32 finished with value: 3168.2294955167017 and parameters: {'model_name': 'IterativeImputer', 'estimator': 'Ridge', 'sample_posterior': False, 'initial_strategy': 'mean', 'imputation_order': 'random'}. Best is trial 7 with value: 1318.834857175494.
[I 2023-12-12 15:37:04,603] Trial 26 finished with value: 2630.336044267721 and parameters: {'model_name': 'RandomForestImputer', 'max_iter': 1, 'decreasing': True, 'min_samples_split': 1.0, 'min_samples_leaf': 0.30000000000000004, 'max_features': 0.30000000000000004, 'warm_start': False}. Best is trial 7 with value: 1318.834857175494.
[I 2023-12-12 15:37:09,635] Trial 84 finished with value: 2700.939488330766 and parameters: {'model_name': 'RandomForestImputer', 'max_iter': 4, 'decreasing': True, 'min_samples_split': 0.4, 'min_samples_leaf': 0.6, 'max_features': 0.5, 'warm_start': True}. Best is trial 7 with value: 1318.834857175494.
[I 2023-12-12 15:37:13,308] Trial 78 finished with value: 2729.7555640978417 and parameters: {'model_name': 'RandomForestImputer', 'max_iter': 6, 'decreasing': False, 'min_samples_split': 0.30000000000000004, 'min_samples_leaf': 0.9, 'max_features': 0.5, 'warm_start': True}. Best is trial 7 with value: 1318.834857175494.
[I 2023-12-12 15:37:17,277] Trial 82 finished with value: 2711.654232364219 and parameters: {'model_name': 'RandomForestImputer', 'max_iter': 4, 'decreasing': False, 'min_samples_split': 0.5, 'min_samples_leaf': 0.1, 'max_features': 0.5, 'warm_start': True}. Best is trial 7 with value: 1318.834857175494.
[I 2023-12-12 15:37:21,879] Trial 86 finished with value: 2729.167404375954 and parameters: {'model_name': 'RandomForestImputer', 'max_iter': 8, 'decreasing': False, 'min_samples_split': 0.6000000000000001, 'min_samples_leaf': 0.7000000000000001, 'max_features': 0.7000000000000001, 'warm_start': True}. Best is trial 7 with value: 1318.834857175494.
[I 2023-12-12 15:37:22,728] Trial 52 finished with value: 2701.3519200336355 and parameters: {'model_name': 'RandomForestImputer', 'max_iter': 9, 'decreasing': True, 'min_samples_split': 0.2, 'min_samples_leaf': 0.4, 'max_features': 0.6, 'warm_start': True}. Best is trial 7 with value: 1318.834857175494.
[I 2023-12-12 15:37:27,774] Trial 99 finished with value: 1318.834857175494 and parameters: {'model_name': 'KNNImputer', 'weights': 'uniform', 'keep_empty_features': False}. Best is trial 7 with value: 1318.834857175494.
[I 2023-12-12 15:37:30,984] Trial 39 finished with value: 3695.451417794825 and parameters: {'model_name': 'GAIN', 'batch_size': 20, 'hint_rate': 0.23, 'alpha': 63, 'iterations': 2}. Best is trial 7 with value: 1318.834857175494.
[I 2023-12-12 15:37:32,216] Trial 22 finished with value: 3533.3153557446894 and parameters: {'model_name': 'GAIN', 'batch_size': 160, 'hint_rate': 0.51, 'alpha': 10, 'iterations': 2}. Best is trial 7 with value: 1318.834857175494.
[I 2023-12-12 15:37:34,072] Trial 73 finished with value: 2699.518045236039 and parameters: {'model_name': 'RandomForestImputer', 'max_iter': 14, 'decreasing': True, 'min_samples_split': 0.1, 'min_samples_leaf': 0.7000000000000001, 'max_features': 0.2, 'warm_start': True}. Best is trial 7 with value: 1318.834857175494.
[I 2023-12-12 15:37:35,254] Trial 53 finished with value: 3944.654120592728 and parameters: {'model_name': 'GAIN', 'batch_size': 1, 'hint_rate': 0.79, 'alpha': 13, 'iterations': 3}. Best is trial 7 with value: 1318.834857175494.
[I 2023-12-12 15:37:36,772] Trial 101 finished with value: 1318.834857175494 and parameters: {'model_name': 'KNNImputer', 'weights': 'uniform', 'keep_empty_features': False}. Best is trial 7 with value: 1318.834857175494.
[I 2023-12-12 15:37:38,269] Trial 102 finished with value: 1318.834857175494 and parameters: {'model_name': 'KNNImputer', 'weights': 'uniform', 'keep_empty_features': False}. Best is trial 7 with value: 1318.834857175494.
[I 2023-12-12 15:37:39,969] Trial 103 finished with value: 1318.834857175494 and parameters: {'model_name': 'KNNImputer', 'weights': 'uniform', 'keep_empty_features': False}. Best is trial 7 with value: 1318.834857175494.
[I 2023-12-12 15:37:41,591] Trial 104 finished with value: 1318.834857175494 and parameters: {'model_name': 'KNNImputer', 'weights': 'uniform', 'keep_empty_features': False}. Best is trial 7 with value: 1318.834857175494.
[I 2023-12-12 15:37:42,350] Trial 79 finished with value: 3509.116206839267 and parameters: {'model_name': 'GAIN', 'batch_size': 282, 'hint_rate': 0.19, 'alpha': 32, 'iterations': 3}. Best is trial 7 with value: 1318.834857175494.
[I 2023-12-12 15:37:43,056] Trial 105 finished with value: 1318.834857175494 and parameters: {'model_name': 'KNNImputer', 'weights': 'uniform', 'keep_empty_features': False}. Best is trial 7 with value: 1318.834857175494.
[I 2023-12-12 15:37:44,451] Trial 106 finished with value: 1318.834857175494 and parameters: {'model_name': 'KNNImputer', 'weights': 'uniform', 'keep_empty_features': False}. Best is trial 7 with value: 1318.834857175494.
[I 2023-12-12 15:37:46,010] Trial 107 finished with value: 1318.834857175494 and parameters: {'model_name': 'KNNImputer', 'weights': 'uniform', 'keep_empty_features': False}. Best is trial 7 with value: 1318.834857175494.
[I 2023-12-12 15:37:47,304] Trial 108 finished with value: 1318.834857175494 and parameters: {'model_name': 'KNNImputer', 'weights': 'uniform', 'keep_empty_features': False}. Best is trial 7 with value: 1318.834857175494.
[I 2023-12-12 15:37:48,258] Trial 109 finished with value: 1318.834857175494 and parameters: {'model_name': 'KNNImputer', 'weights': 'uniform', 'keep_empty_features': False}. Best is trial 7 with value: 1318.834857175494.
[I 2023-12-12 15:37:48,940] Trial 110 finished with value: 1318.834857175494 and parameters: {'model_name': 'KNNImputer', 'weights': 'uniform', 'keep_empty_features': False}. Best is trial 7 with value: 1318.834857175494.
[I 2023-12-12 15:37:50,064] Trial 111 finished with value: 1318.834857175494 and parameters: {'model_name': 'KNNImputer', 'weights': 'uniform', 'keep_empty_features': False}. Best is trial 7 with value: 1318.834857175494.
[I 2023-12-12 15:37:50,956] Trial 42 finished with value: 3383.2606610065754 and parameters: {'model_name': 'GAIN', 'batch_size': 2, 'hint_rate': 0.99, 'alpha': 78, 'iterations': 6}. Best is trial 7 with value: 1318.834857175494.
[I 2023-12-12 15:37:51,785] Trial 70 finished with value: 2699.792757580367 and parameters: {'model_name': 'RandomForestImputer', 'max_iter': 18, 'decreasing': True, 'min_samples_split': 0.7000000000000001, 'min_samples_leaf': 0.6, 'max_features': 0.1, 'warm_start': True}. Best is trial 7 with value: 1318.834857175494.
[I 2023-12-12 15:37:52,548] Trial 112 finished with value: 1318.834857175494 and parameters: {'model_name': 'KNNImputer', 'weights': 'uniform', 'keep_empty_features': False}. Best is trial 7 with value: 1318.834857175494.
[I 2023-12-12 15:37:53,830] Trial 89 finished with value: 3707.1138585709064 and parameters: {'model_name': 'GAIN', 'batch_size': 4, 'hint_rate': 0.66, 'alpha': 47, 'iterations': 4}. Best is trial 7 with value: 1318.834857175494.
[I 2023-12-12 15:37:54,875] Trial 37 finished with value: 3178.4914804453065 and parameters: {'model_name': 'IterativeImputer', 'estimator': 'Bayesian', 'sample_posterior': False, 'initial_strategy': 'mean', 'imputation_order': 'arabic'}. Best is trial 7 with value: 1318.834857175494.
[I 2023-12-12 15:37:55,472] Trial 113 finished with value: 1318.834857175494 and parameters: {'model_name': 'KNNImputer', 'weights': 'uniform', 'keep_empty_features': False}. Best is trial 7 with value: 1318.834857175494.
[I 2023-12-12 15:37:57,961] Trial 118 finished with value: 1318.834857175494 and parameters: {'model_name': 'KNNImputer', 'weights': 'uniform', 'keep_empty_features': False}. Best is trial 7 with value: 1318.834857175494.
[I 2023-12-12 15:37:59,942] Trial 59 finished with value: 3233.226478633341 and parameters: {'model_name': 'GAIN', 'batch_size': 152, 'hint_rate': 0.79, 'alpha': 86, 'iterations': 7}. Best is trial 7 with value: 1318.834857175494.
[I 2023-12-12 15:38:00,707] Trial 121 finished with value: 1318.834857175494 and parameters: {'model_name': 'KNNImputer', 'weights': 'uniform', 'keep_empty_features': False}. Best is trial 7 with value: 1318.834857175494.
[I 2023-12-12 15:38:01,448] Trial 122 finished with value: 1318.834857175494 and parameters: {'model_name': 'KNNImputer', 'weights': 'uniform', 'keep_empty_features': False}. Best is trial 7 with value: 1318.834857175494.
[I 2023-12-12 15:38:03,962] Trial 123 finished with value: 1318.834857175494 and parameters: {'model_name': 'KNNImputer', 'weights': 'uniform', 'keep_empty_features': False}. Best is trial 7 with value: 1318.834857175494.
[I 2023-12-12 15:38:06,303] Trial 126 finished with value: 1318.834857175494 and parameters: {'model_name': 'KNNImputer', 'weights': 'uniform', 'keep_empty_features': False}. Best is trial 7 with value: 1318.834857175494.
[I 2023-12-12 15:38:07,217] Trial 125 finished with value: 1318.834857175494 and parameters: {'model_name': 'KNNImputer', 'weights': 'uniform', 'keep_empty_features': False}. Best is trial 7 with value: 1318.834857175494.
[I 2023-12-12 15:38:11,132] Trial 128 finished with value: 1318.834857175494 and parameters: {'model_name': 'KNNImputer', 'weights': 'uniform', 'keep_empty_features': False}. Best is trial 7 with value: 1318.834857175494.
[I 2023-12-12 15:38:11,814] Trial 129 finished with value: 1318.834857175494 and parameters: {'model_name': 'KNNImputer', 'weights': 'uniform', 'keep_empty_features': False}. Best is trial 7 with value: 1318.834857175494.
[I 2023-12-12 15:38:14,105] Trial 87 finished with value: 3686.1268374090855 and parameters: {'model_name': 'GAIN', 'batch_size': 48, 'hint_rate': 0.26, 'alpha': 6, 'iterations': 9}. Best is trial 7 with value: 1318.834857175494.
[I 2023-12-12 15:38:19,835] Trial 33 finished with value: 2630.9201793361285 and parameters: {'model_name': 'RandomForestImputer', 'max_iter': 2, 'decreasing': False, 'min_samples_split': 0.5, 'min_samples_leaf': 0.8, 'max_features': 0.9, 'warm_start': False}. Best is trial 7 with value: 1318.834857175494.
[I 2023-12-12 15:38:20,478] Trial 13 finished with value: 2628.9458983429126 and parameters: {'model_name': 'RandomForestImputer', 'max_iter': 2, 'decreasing': True, 'min_samples_split': 0.4, 'min_samples_leaf': 0.8, 'max_features': 0.8, 'warm_start': False}. Best is trial 7 with value: 1318.834857175494.
[I 2023-12-12 15:38:23,495] Trial 76 finished with value: 2627.621228551817 and parameters: {'model_name': 'RandomForestImputer', 'max_iter': 2, 'decreasing': False, 'min_samples_split': 0.1, 'min_samples_leaf': 0.4, 'max_features': 0.9, 'warm_start': False}. Best is trial 7 with value: 1318.834857175494.
[I 2023-12-12 15:38:24,247] Trial 75 finished with value: 2629.141486821599 and parameters: {'model_name': 'RandomForestImputer', 'max_iter': 2, 'decreasing': False, 'min_samples_split': 0.4, 'min_samples_leaf': 0.8, 'max_features': 0.7000000000000001, 'warm_start': False}. Best is trial 7 with value: 1318.834857175494.
[I 2023-12-12 15:38:51,257] Trial 74 finished with value: 3138.5833892457276 and parameters: {'model_name': 'GAIN', 'batch_size': 7, 'hint_rate': 0.37, 'alpha': 30, 'iterations': 23}. Best is trial 7 with value: 1318.834857175494.
