Run: 11
/cm/local/apps/slurm/var/spool/job565924/slurm_script: line 23: /common/ketrong/minconda3/etc/profile.d/conda.sh: No such file or directory
/cm/local/apps/slurm/var/spool/job565924/slurm_script: line 26: $'\nconda create --name tpot2devenv -c conda-forge python=3.10\n': command not found
/cm/local/apps/slurm/var/spool/job565924/slurm_script: line 31: $'\npip install -r requirements.txt\n': command not found
RunStart
2023-12-21 20:29:20.631613: I tensorflow/core/util/port.cc:113] oneDNN custom operations are on. You may see slightly different numerical results due to floating-point round-off errors from different computation orders. To turn them off, set the environment variable `TF_ENABLE_ONEDNN_OPTS=0`.
2023-12-21 20:29:20.665110: E external/local_xla/xla/stream_executor/cuda/cuda_dnn.cc:9261] Unable to register cuDNN factory: Attempting to register factory for plugin cuDNN when one has already been registered
2023-12-21 20:29:20.665132: E external/local_xla/xla/stream_executor/cuda/cuda_fft.cc:607] Unable to register cuFFT factory: Attempting to register factory for plugin cuFFT when one has already been registered
2023-12-21 20:29:20.665947: E external/local_xla/xla/stream_executor/cuda/cuda_blas.cc:1515] Unable to register cuBLAS factory: Attempting to register factory for plugin cuBLAS when one has already been registered
2023-12-21 20:29:20.670884: I tensorflow/core/platform/cpu_feature_guard.cc:182] This TensorFlow binary is optimized to use available CPU instructions in performance-critical operations.
To enable the following instructions: AVX2 AVX512F AVX512_VNNI FMA, in other operations, rebuild TensorFlow with the appropriate compiler flags.
2023-12-21 20:29:23.768752: W tensorflow/compiler/tf2tensorrt/utils/py_utils.cc:38] TF-TRT Warning: Could not find TensorRT
WARNING:tensorflow:From /home/ketrong/miniconda3/envs/tpot2devenv/lib/python3.10/site-packages/tensorflow/python/compat/v2_compat.py:108: disable_resource_variables (from tensorflow.python.ops.variable_scope) is deprecated and will be removed in a future version.
Instructions for updating:
non-resource variables are not supported in the long term
starting loops
working on 
logs/219/tpot2_base_normal_MNAR_0.01
3.1697134971618652
loading data
logs/219/tpot2_base_normal_MNAR_0.01/data/219_True.pkl
running experiment 1/3 - Does large hyperparameter space improve reconstruction accuracy over simple
[I 2023-12-21 20:29:41,055] A new study created in memory with name: no-name-809de585-c7a5-46d2-9e1a-55304500a520
[I 2023-12-21 20:29:43,293] Trial 2 finished with value: 0.40380440999919526 and parameters: {'model_name': 'SimpleImputer', 'strategy': 'constant'}. Best is trial 2 with value: 0.40380440999919526.
[I 2023-12-21 20:29:43,822] Trial 10 finished with value: 0.40380440999919526 and parameters: {'model_name': 'SimpleImputer', 'strategy': 'constant'}. Best is trial 2 with value: 0.40380440999919526.
[I 2023-12-21 20:29:44,101] Trial 12 finished with value: 0.40380440999919526 and parameters: {'model_name': 'SimpleImputer', 'strategy': 'constant'}. Best is trial 2 with value: 0.40380440999919526.
[I 2023-12-21 20:29:44,374] Trial 5 finished with value: 0.40380440999919526 and parameters: {'model_name': 'SimpleImputer', 'strategy': 'constant'}. Best is trial 2 with value: 0.40380440999919526.
[I 2023-12-21 20:29:44,970] Trial 8 finished with value: 0.27178497952509645 and parameters: {'model_name': 'SimpleImputer', 'strategy': 'mean'}. Best is trial 8 with value: 0.27178497952509645.
[I 2023-12-21 20:29:45,291] Trial 16 finished with value: 0.40380440999919526 and parameters: {'model_name': 'SimpleImputer', 'strategy': 'constant'}. Best is trial 8 with value: 0.27178497952509645.
[I 2023-12-21 20:29:45,506] Trial 21 finished with value: 0.27178497952509645 and parameters: {'model_name': 'SimpleImputer', 'strategy': 'mean'}. Best is trial 8 with value: 0.27178497952509645.
[I 2023-12-21 20:29:45,757] Trial 19 finished with value: 0.40380440999919526 and parameters: {'model_name': 'SimpleImputer', 'strategy': 'constant'}. Best is trial 8 with value: 0.27178497952509645.
[I 2023-12-21 20:29:46,032] Trial 23 finished with value: 0.40380440999919526 and parameters: {'model_name': 'SimpleImputer', 'strategy': 'constant'}. Best is trial 8 with value: 0.27178497952509645.
[I 2023-12-21 20:29:46,329] Trial 32 finished with value: 0.40380440999919526 and parameters: {'model_name': 'SimpleImputer', 'strategy': 'constant'}. Best is trial 8 with value: 0.27178497952509645.
[I 2023-12-21 20:29:46,577] Trial 24 finished with value: 0.40380440999919526 and parameters: {'model_name': 'SimpleImputer', 'strategy': 'constant'}. Best is trial 8 with value: 0.27178497952509645.
[I 2023-12-21 20:29:46,794] Trial 14 finished with value: 0.27178497952509645 and parameters: {'model_name': 'SimpleImputer', 'strategy': 'mean'}. Best is trial 8 with value: 0.27178497952509645.
[I 2023-12-21 20:29:47,117] Trial 15 finished with value: 0.27178497952509645 and parameters: {'model_name': 'SimpleImputer', 'strategy': 'mean'}. Best is trial 8 with value: 0.27178497952509645.
[I 2023-12-21 20:29:47,436] Trial 13 finished with value: 0.27178497952509645 and parameters: {'model_name': 'SimpleImputer', 'strategy': 'mean'}. Best is trial 8 with value: 0.27178497952509645.
[I 2023-12-21 20:29:47,679] Trial 4 finished with value: 0.27178497952509645 and parameters: {'model_name': 'SimpleImputer', 'strategy': 'mean'}. Best is trial 8 with value: 0.27178497952509645.
[I 2023-12-21 20:29:47,881] Trial 42 finished with value: 0.40380440999919526 and parameters: {'model_name': 'SimpleImputer', 'strategy': 'constant'}. Best is trial 8 with value: 0.27178497952509645.
[I 2023-12-21 20:29:48,127] Trial 47 finished with value: 0.40380440999919526 and parameters: {'model_name': 'SimpleImputer', 'strategy': 'constant'}. Best is trial 8 with value: 0.27178497952509645.
[I 2023-12-21 20:29:48,477] Trial 25 finished with value: 0.27178497952509645 and parameters: {'model_name': 'SimpleImputer', 'strategy': 'mean'}. Best is trial 8 with value: 0.27178497952509645.
[I 2023-12-21 20:29:48,765] Trial 39 finished with value: 0.40380440999919526 and parameters: {'model_name': 'SimpleImputer', 'strategy': 'constant'}. Best is trial 8 with value: 0.27178497952509645.
[I 2023-12-21 20:29:49,013] Trial 36 finished with value: 0.27178497952509645 and parameters: {'model_name': 'SimpleImputer', 'strategy': 'mean'}. Best is trial 8 with value: 0.27178497952509645.
[I 2023-12-21 20:29:49,255] Trial 0 finished with value: 0.27178497952509645 and parameters: {'model_name': 'SimpleImputer', 'strategy': 'mean'}. Best is trial 8 with value: 0.27178497952509645.
[I 2023-12-21 20:29:49,500] Trial 43 finished with value: 0.40380440999919526 and parameters: {'model_name': 'SimpleImputer', 'strategy': 'constant'}. Best is trial 8 with value: 0.27178497952509645.
[I 2023-12-21 20:29:49,725] Trial 26 finished with value: 0.27178497952509645 and parameters: {'model_name': 'SimpleImputer', 'strategy': 'mean'}. Best is trial 8 with value: 0.27178497952509645.
[I 2023-12-21 20:29:49,900] Trial 41 finished with value: 0.27178497952509645 and parameters: {'model_name': 'SimpleImputer', 'strategy': 'mean'}. Best is trial 8 with value: 0.27178497952509645.
[I 2023-12-21 20:29:50,143] Trial 28 finished with value: 0.27178497952509645 and parameters: {'model_name': 'SimpleImputer', 'strategy': 'mean'}. Best is trial 8 with value: 0.27178497952509645.
[I 2023-12-21 20:29:50,402] Trial 44 finished with value: 0.40380440999919526 and parameters: {'model_name': 'SimpleImputer', 'strategy': 'constant'}. Best is trial 8 with value: 0.27178497952509645.
[I 2023-12-21 20:29:50,611] Trial 40 finished with value: 0.27178497952509645 and parameters: {'model_name': 'SimpleImputer', 'strategy': 'mean'}. Best is trial 8 with value: 0.27178497952509645.
[I 2023-12-21 20:29:50,823] Trial 34 finished with value: 0.27178497952509645 and parameters: {'model_name': 'SimpleImputer', 'strategy': 'mean'}. Best is trial 8 with value: 0.27178497952509645.
[I 2023-12-21 20:29:51,168] Trial 45 finished with value: 0.27178497952509645 and parameters: {'model_name': 'SimpleImputer', 'strategy': 'mean'}. Best is trial 8 with value: 0.27178497952509645.
[I 2023-12-21 20:29:51,444] Trial 46 finished with value: 0.27178497952509645 and parameters: {'model_name': 'SimpleImputer', 'strategy': 'mean'}. Best is trial 8 with value: 0.27178497952509645.
[I 2023-12-21 20:29:51,843] Trial 31 finished with value: 0.27178497952509645 and parameters: {'model_name': 'SimpleImputer', 'strategy': 'mean'}. Best is trial 8 with value: 0.27178497952509645.
[I 2023-12-21 20:29:52,245] Trial 1 finished with value: 0.2869071320380002 and parameters: {'model_name': 'SimpleImputer', 'strategy': 'median'}. Best is trial 8 with value: 0.27178497952509645.
[I 2023-12-21 20:29:52,584] Trial 7 finished with value: 0.2869071320380002 and parameters: {'model_name': 'SimpleImputer', 'strategy': 'median'}. Best is trial 8 with value: 0.27178497952509645.
[I 2023-12-21 20:29:52,825] Trial 9 finished with value: 0.2869071320380002 and parameters: {'model_name': 'SimpleImputer', 'strategy': 'median'}. Best is trial 8 with value: 0.27178497952509645.
[I 2023-12-21 20:29:53,224] Trial 17 finished with value: 0.2869071320380002 and parameters: {'model_name': 'SimpleImputer', 'strategy': 'median'}. Best is trial 8 with value: 0.27178497952509645.
[I 2023-12-21 20:29:53,460] Trial 11 finished with value: 0.2869071320380002 and parameters: {'model_name': 'SimpleImputer', 'strategy': 'median'}. Best is trial 8 with value: 0.27178497952509645.
[I 2023-12-21 20:29:53,908] Trial 22 finished with value: 0.2869071320380002 and parameters: {'model_name': 'SimpleImputer', 'strategy': 'median'}. Best is trial 8 with value: 0.27178497952509645.
[I 2023-12-21 20:29:54,088] Trial 20 finished with value: 0.2869071320380002 and parameters: {'model_name': 'SimpleImputer', 'strategy': 'median'}. Best is trial 8 with value: 0.27178497952509645.
[I 2023-12-21 20:29:54,270] Trial 27 finished with value: 0.2869071320380002 and parameters: {'model_name': 'SimpleImputer', 'strategy': 'median'}. Best is trial 8 with value: 0.27178497952509645.
[I 2023-12-21 20:29:54,531] Trial 30 finished with value: 0.2869071320380002 and parameters: {'model_name': 'SimpleImputer', 'strategy': 'median'}. Best is trial 8 with value: 0.27178497952509645.
[I 2023-12-21 20:29:54,842] Trial 33 finished with value: 0.2869071320380002 and parameters: {'model_name': 'SimpleImputer', 'strategy': 'median'}. Best is trial 8 with value: 0.27178497952509645.
[I 2023-12-21 20:29:55,157] Trial 38 finished with value: 0.2869071320380002 and parameters: {'model_name': 'SimpleImputer', 'strategy': 'median'}. Best is trial 8 with value: 0.27178497952509645.
[I 2023-12-21 20:29:56,366] Trial 58 finished with value: 0.27178497952509645 and parameters: {'model_name': 'SimpleImputer', 'strategy': 'mean'}. Best is trial 8 with value: 0.27178497952509645.
[I 2023-12-21 20:29:56,867] Trial 56 finished with value: 0.27178497952509645 and parameters: {'model_name': 'SimpleImputer', 'strategy': 'mean'}. Best is trial 8 with value: 0.27178497952509645.
[I 2023-12-21 20:29:57,501] Trial 49 finished with value: 0.2869071320380002 and parameters: {'model_name': 'SimpleImputer', 'strategy': 'median'}. Best is trial 8 with value: 0.27178497952509645.
[I 2023-12-21 20:29:57,689] Trial 57 finished with value: 0.27178497952509645 and parameters: {'model_name': 'SimpleImputer', 'strategy': 'mean'}. Best is trial 8 with value: 0.27178497952509645.
[I 2023-12-21 20:29:57,963] Trial 51 finished with value: 0.2869071320380002 and parameters: {'model_name': 'SimpleImputer', 'strategy': 'median'}. Best is trial 8 with value: 0.27178497952509645.
[I 2023-12-21 20:29:58,585] Trial 54 finished with value: 0.2869071320380002 and parameters: {'model_name': 'SimpleImputer', 'strategy': 'median'}. Best is trial 8 with value: 0.27178497952509645.
[I 2023-12-21 20:29:59,213] Trial 67 finished with value: 0.2869071320380002 and parameters: {'model_name': 'SimpleImputer', 'strategy': 'median'}. Best is trial 8 with value: 0.27178497952509645.
[I 2023-12-21 20:29:59,495] Trial 53 finished with value: 0.2869071320380002 and parameters: {'model_name': 'SimpleImputer', 'strategy': 'median'}. Best is trial 8 with value: 0.27178497952509645.
[I 2023-12-21 20:29:59,809] Trial 62 finished with value: 0.2869071320380002 and parameters: {'model_name': 'SimpleImputer', 'strategy': 'median'}. Best is trial 8 with value: 0.27178497952509645.
[I 2023-12-21 20:30:00,226] Trial 63 finished with value: 0.2869071320380002 and parameters: {'model_name': 'SimpleImputer', 'strategy': 'median'}. Best is trial 8 with value: 0.27178497952509645.
[I 2023-12-21 20:30:00,555] Trial 70 finished with value: 0.2869071320380002 and parameters: {'model_name': 'SimpleImputer', 'strategy': 'median'}. Best is trial 8 with value: 0.27178497952509645.
[I 2023-12-21 20:30:00,835] Trial 61 finished with value: 0.2869071320380002 and parameters: {'model_name': 'SimpleImputer', 'strategy': 'median'}. Best is trial 8 with value: 0.27178497952509645.
[I 2023-12-21 20:30:01,093] Trial 76 finished with value: 0.2869071320380002 and parameters: {'model_name': 'SimpleImputer', 'strategy': 'median'}. Best is trial 8 with value: 0.27178497952509645.
[I 2023-12-21 20:30:01,425] Trial 64 finished with value: 0.2869071320380002 and parameters: {'model_name': 'SimpleImputer', 'strategy': 'median'}. Best is trial 8 with value: 0.27178497952509645.
[I 2023-12-21 20:30:01,867] Trial 73 finished with value: 0.2869071320380002 and parameters: {'model_name': 'SimpleImputer', 'strategy': 'median'}. Best is trial 8 with value: 0.27178497952509645.
[I 2023-12-21 20:30:02,173] Trial 77 finished with value: 0.2869071320380002 and parameters: {'model_name': 'SimpleImputer', 'strategy': 'median'}. Best is trial 8 with value: 0.27178497952509645.
[I 2023-12-21 20:30:03,735] Trial 6 finished with value: 0.36235917245763943 and parameters: {'model_name': 'SimpleImputer', 'strategy': 'most_frequent'}. Best is trial 8 with value: 0.27178497952509645.
[I 2023-12-21 20:30:04,127] Trial 3 finished with value: 0.36235917245763943 and parameters: {'model_name': 'SimpleImputer', 'strategy': 'most_frequent'}. Best is trial 8 with value: 0.27178497952509645.
[I 2023-12-21 20:30:04,797] Trial 18 finished with value: 0.36235917245763943 and parameters: {'model_name': 'SimpleImputer', 'strategy': 'most_frequent'}. Best is trial 8 with value: 0.27178497952509645.
[I 2023-12-21 20:30:05,768] Trial 35 finished with value: 0.36235917245763943 and parameters: {'model_name': 'SimpleImputer', 'strategy': 'most_frequent'}. Best is trial 8 with value: 0.27178497952509645.
[I 2023-12-21 20:30:06,085] Trial 37 finished with value: 0.36235917245763943 and parameters: {'model_name': 'SimpleImputer', 'strategy': 'most_frequent'}. Best is trial 8 with value: 0.27178497952509645.
[I 2023-12-21 20:30:06,442] Trial 29 finished with value: 0.36235917245763943 and parameters: {'model_name': 'SimpleImputer', 'strategy': 'most_frequent'}. Best is trial 8 with value: 0.27178497952509645.
[I 2023-12-21 20:30:06,847] Trial 48 finished with value: 0.36235917245763943 and parameters: {'model_name': 'SimpleImputer', 'strategy': 'most_frequent'}. Best is trial 8 with value: 0.27178497952509645.
[I 2023-12-21 20:30:07,730] Trial 52 finished with value: 0.36235917245763943 and parameters: {'model_name': 'SimpleImputer', 'strategy': 'most_frequent'}. Best is trial 8 with value: 0.27178497952509645.
[I 2023-12-21 20:30:08,380] Trial 60 finished with value: 0.36235917245763943 and parameters: {'model_name': 'SimpleImputer', 'strategy': 'most_frequent'}. Best is trial 8 with value: 0.27178497952509645.
[I 2023-12-21 20:30:08,659] Trial 66 finished with value: 0.36235917245763943 and parameters: {'model_name': 'SimpleImputer', 'strategy': 'most_frequent'}. Best is trial 8 with value: 0.27178497952509645.
[I 2023-12-21 20:30:08,971] Trial 65 finished with value: 0.36235917245763943 and parameters: {'model_name': 'SimpleImputer', 'strategy': 'most_frequent'}. Best is trial 8 with value: 0.27178497952509645.
[I 2023-12-21 20:30:09,235] Trial 50 finished with value: 0.36235917245763943 and parameters: {'model_name': 'SimpleImputer', 'strategy': 'most_frequent'}. Best is trial 8 with value: 0.27178497952509645.
[I 2023-12-21 20:30:09,896] Trial 55 finished with value: 0.36235917245763943 and parameters: {'model_name': 'SimpleImputer', 'strategy': 'most_frequent'}. Best is trial 8 with value: 0.27178497952509645.
[I 2023-12-21 20:30:10,544] Trial 74 finished with value: 0.36235917245763943 and parameters: {'model_name': 'SimpleImputer', 'strategy': 'most_frequent'}. Best is trial 8 with value: 0.27178497952509645.
[I 2023-12-21 20:30:10,874] Trial 111 finished with value: 0.27178497952509645 and parameters: {'model_name': 'SimpleImputer', 'strategy': 'mean'}. Best is trial 8 with value: 0.27178497952509645.
[I 2023-12-21 20:30:11,128] Trial 68 finished with value: 0.36235917245763943 and parameters: {'model_name': 'SimpleImputer', 'strategy': 'most_frequent'}. Best is trial 8 with value: 0.27178497952509645.
[I 2023-12-21 20:30:11,490] Trial 109 finished with value: 0.27178497952509645 and parameters: {'model_name': 'SimpleImputer', 'strategy': 'mean'}. Best is trial 8 with value: 0.27178497952509645.
[I 2023-12-21 20:30:11,736] Trial 112 finished with value: 0.27178497952509645 and parameters: {'model_name': 'SimpleImputer', 'strategy': 'mean'}. Best is trial 8 with value: 0.27178497952509645.
[I 2023-12-21 20:30:11,925] Trial 72 finished with value: 0.36235917245763943 and parameters: {'model_name': 'SimpleImputer', 'strategy': 'most_frequent'}. Best is trial 8 with value: 0.27178497952509645.
[I 2023-12-21 20:30:12,165] Trial 59 finished with value: 0.36235917245763943 and parameters: {'model_name': 'SimpleImputer', 'strategy': 'most_frequent'}. Best is trial 8 with value: 0.27178497952509645.
[I 2023-12-21 20:30:12,470] Trial 86 finished with value: 0.36235917245763943 and parameters: {'model_name': 'SimpleImputer', 'strategy': 'most_frequent'}. Best is trial 8 with value: 0.27178497952509645.
[I 2023-12-21 20:30:12,735] Trial 81 finished with value: 0.36235917245763943 and parameters: {'model_name': 'SimpleImputer', 'strategy': 'most_frequent'}. Best is trial 8 with value: 0.27178497952509645.
[I 2023-12-21 20:30:12,971] Trial 85 finished with value: 0.36235917245763943 and parameters: {'model_name': 'SimpleImputer', 'strategy': 'most_frequent'}. Best is trial 8 with value: 0.27178497952509645.
[I 2023-12-21 20:30:13,167] Trial 110 finished with value: 0.27178497952509645 and parameters: {'model_name': 'SimpleImputer', 'strategy': 'mean'}. Best is trial 8 with value: 0.27178497952509645.
[I 2023-12-21 20:30:13,496] Trial 84 finished with value: 0.36235917245763943 and parameters: {'model_name': 'SimpleImputer', 'strategy': 'most_frequent'}. Best is trial 8 with value: 0.27178497952509645.
[I 2023-12-21 20:30:13,757] Trial 69 finished with value: 0.36235917245763943 and parameters: {'model_name': 'SimpleImputer', 'strategy': 'most_frequent'}. Best is trial 8 with value: 0.27178497952509645.
[I 2023-12-21 20:30:13,980] Trial 83 finished with value: 0.36235917245763943 and parameters: {'model_name': 'SimpleImputer', 'strategy': 'most_frequent'}. Best is trial 8 with value: 0.27178497952509645.
[I 2023-12-21 20:30:14,211] Trial 75 finished with value: 0.36235917245763943 and parameters: {'model_name': 'SimpleImputer', 'strategy': 'most_frequent'}. Best is trial 8 with value: 0.27178497952509645.
[I 2023-12-21 20:30:14,486] Trial 82 finished with value: 0.36235917245763943 and parameters: {'model_name': 'SimpleImputer', 'strategy': 'most_frequent'}. Best is trial 8 with value: 0.27178497952509645.
[I 2023-12-21 20:30:14,729] Trial 80 finished with value: 0.36235917245763943 and parameters: {'model_name': 'SimpleImputer', 'strategy': 'most_frequent'}. Best is trial 8 with value: 0.27178497952509645.
[I 2023-12-21 20:30:14,904] Trial 87 finished with value: 0.36235917245763943 and parameters: {'model_name': 'SimpleImputer', 'strategy': 'most_frequent'}. Best is trial 8 with value: 0.27178497952509645.
[I 2023-12-21 20:30:15,060] Trial 71 finished with value: 0.36235917245763943 and parameters: {'model_name': 'SimpleImputer', 'strategy': 'most_frequent'}. Best is trial 8 with value: 0.27178497952509645.
[I 2023-12-21 20:30:15,422] Trial 79 finished with value: 0.36235917245763943 and parameters: {'model_name': 'SimpleImputer', 'strategy': 'most_frequent'}. Best is trial 8 with value: 0.27178497952509645.
[I 2023-12-21 20:30:15,836] Trial 78 finished with value: 0.36235917245763943 and parameters: {'model_name': 'SimpleImputer', 'strategy': 'most_frequent'}. Best is trial 8 with value: 0.27178497952509645.
[I 2023-12-21 20:30:16,401] Trial 88 finished with value: 0.36235917245763943 and parameters: {'model_name': 'SimpleImputer', 'strategy': 'most_frequent'}. Best is trial 8 with value: 0.27178497952509645.
[I 2023-12-21 20:30:16,708] Trial 115 finished with value: 0.27178497952509645 and parameters: {'model_name': 'SimpleImputer', 'strategy': 'mean'}. Best is trial 8 with value: 0.27178497952509645.
[I 2023-12-21 20:30:17,104] Trial 116 finished with value: 0.27178497952509645 and parameters: {'model_name': 'SimpleImputer', 'strategy': 'mean'}. Best is trial 8 with value: 0.27178497952509645.
[I 2023-12-21 20:30:17,514] Trial 89 finished with value: 0.36235917245763943 and parameters: {'model_name': 'SimpleImputer', 'strategy': 'most_frequent'}. Best is trial 8 with value: 0.27178497952509645.
[I 2023-12-21 20:30:17,835] Trial 113 finished with value: 0.27178497952509645 and parameters: {'model_name': 'SimpleImputer', 'strategy': 'mean'}. Best is trial 8 with value: 0.27178497952509645.
