[I 2024-02-07 12:39:12,802] Trial 120 finished with value: 5.383979865172554 and parameters: {'model_name': 'IterativeImputer', 'sample_posterior': False, 'initial_strategy': 'median', 'imputation_order': 'roman'}. Best is trial 74 with value: 5.382502185293559.
[I 2024-02-07 12:39:50,216] Trial 121 finished with value: 5.383980294957166 and parameters: {'model_name': 'IterativeImputer', 'sample_posterior': False, 'initial_strategy': 'most_frequent', 'imputation_order': 'roman'}. Best is trial 74 with value: 5.382502185293559.
[I 2024-02-07 12:40:03,908] Trial 122 finished with value: 5.383980294957166 and parameters: {'model_name': 'IterativeImputer', 'sample_posterior': False, 'initial_strategy': 'most_frequent', 'imputation_order': 'roman'}. Best is trial 74 with value: 5.382502185293559.
[I 2024-02-07 12:42:25,511] Trial 68 finished with value: 14.338033501709607 and parameters: {'model_name': 'RandomForestImputer', 'max_iter': 11, 'decreasing': True, 'min_samples_split': 0.30000000000000004, 'min_samples_leaf': 0.6, 'max_features': 0.8, 'warm_start': False}. Best is trial 74 with value: 5.382502185293559.
[I 2024-02-07 12:43:48,353] Trial 135 finished with value: 5.382502185293559 and parameters: {'model_name': 'IterativeImputer', 'sample_posterior': False, 'initial_strategy': 'median', 'imputation_order': 'arabic'}. Best is trial 74 with value: 5.382502185293559.
[I 2024-02-07 12:45:40,486] Trial 34 finished with value: 9.143295258845951 and parameters: {'model_name': 'IterativeImputer', 'sample_posterior': True, 'initial_strategy': 'constant', 'imputation_order': 'roman'}. Best is trial 74 with value: 5.382502185293559.
[I 2024-02-07 12:45:48,272] Trial 36 finished with value: 8.889389982836686 and parameters: {'model_name': 'IterativeImputer', 'sample_posterior': True, 'initial_strategy': 'median', 'imputation_order': 'descending'}. Best is trial 74 with value: 5.382502185293559.
[I 2024-02-07 12:46:12,117] Trial 16 finished with value: 9.154285037699788 and parameters: {'model_name': 'IterativeImputer', 'sample_posterior': True, 'initial_strategy': 'constant', 'imputation_order': 'roman'}. Best is trial 74 with value: 5.382502185293559.
[I 2024-02-07 12:46:21,786] Trial 69 finished with value: 9.420062570786142 and parameters: {'model_name': 'IterativeImputer', 'sample_posterior': True, 'initial_strategy': 'mean', 'imputation_order': 'roman'}. Best is trial 74 with value: 5.382502185293559.
[I 2024-02-07 12:46:39,995] Trial 58 finished with value: 9.530298825234386 and parameters: {'model_name': 'IterativeImputer', 'sample_posterior': True, 'initial_strategy': 'constant', 'imputation_order': 'random'}. Best is trial 74 with value: 5.382502185293559.
[I 2024-02-07 12:46:49,084] Trial 76 finished with value: 8.92503563647008 and parameters: {'model_name': 'IterativeImputer', 'sample_posterior': True, 'initial_strategy': 'mean', 'imputation_order': 'descending'}. Best is trial 74 with value: 5.382502185293559.
[I 2024-02-07 12:46:51,639] Trial 55 finished with value: 9.031994388658191 and parameters: {'model_name': 'IterativeImputer', 'sample_posterior': True, 'initial_strategy': 'mean', 'imputation_order': 'arabic'}. Best is trial 74 with value: 5.382502185293559.
[I 2024-02-07 12:46:53,543] Trial 77 finished with value: 8.78222419406949 and parameters: {'model_name': 'IterativeImputer', 'sample_posterior': True, 'initial_strategy': 'mean', 'imputation_order': 'ascending'}. Best is trial 74 with value: 5.382502185293559.
[I 2024-02-07 12:46:54,593] Trial 67 finished with value: 9.315687602315805 and parameters: {'model_name': 'IterativeImputer', 'sample_posterior': True, 'initial_strategy': 'median', 'imputation_order': 'ascending'}. Best is trial 74 with value: 5.382502185293559.
[I 2024-02-07 12:46:56,882] Trial 78 finished with value: 8.950634653609313 and parameters: {'model_name': 'IterativeImputer', 'sample_posterior': True, 'initial_strategy': 'constant', 'imputation_order': 'roman'}. Best is trial 74 with value: 5.382502185293559.
[I 2024-02-07 12:47:07,826] Trial 82 finished with value: 9.226841722009139 and parameters: {'model_name': 'IterativeImputer', 'sample_posterior': True, 'initial_strategy': 'median', 'imputation_order': 'descending'}. Best is trial 74 with value: 5.382502185293559.
[I 2024-02-07 12:47:09,606] Trial 66 finished with value: 8.82927415715594 and parameters: {'model_name': 'IterativeImputer', 'sample_posterior': True, 'initial_strategy': 'constant', 'imputation_order': 'random'}. Best is trial 74 with value: 5.382502185293559.
[I 2024-02-07 12:47:10,802] Trial 81 finished with value: 9.047690468953112 and parameters: {'model_name': 'IterativeImputer', 'sample_posterior': True, 'initial_strategy': 'mean', 'imputation_order': 'roman'}. Best is trial 74 with value: 5.382502185293559.
[I 2024-02-07 12:47:11,565] Trial 83 finished with value: 9.433379981724112 and parameters: {'model_name': 'IterativeImputer', 'sample_posterior': True, 'initial_strategy': 'constant', 'imputation_order': 'ascending'}. Best is trial 74 with value: 5.382502185293559.
[I 2024-02-07 12:47:12,635] Trial 14 finished with value: 9.172376515186397 and parameters: {'model_name': 'IterativeImputer', 'sample_posterior': True, 'initial_strategy': 'most_frequent', 'imputation_order': 'ascending'}. Best is trial 74 with value: 5.382502185293559.
[I 2024-02-07 12:47:14,523] Trial 85 finished with value: 8.70408356946031 and parameters: {'model_name': 'IterativeImputer', 'sample_posterior': True, 'initial_strategy': 'median', 'imputation_order': 'roman'}. Best is trial 74 with value: 5.382502185293559.
[I 2024-02-07 12:47:17,377] Trial 86 finished with value: 9.40132688950013 and parameters: {'model_name': 'IterativeImputer', 'sample_posterior': True, 'initial_strategy': 'mean', 'imputation_order': 'descending'}. Best is trial 74 with value: 5.382502185293559.
[I 2024-02-07 12:47:19,955] Trial 23 finished with value: 8.995608251102102 and parameters: {'model_name': 'IterativeImputer', 'sample_posterior': True, 'initial_strategy': 'most_frequent', 'imputation_order': 'random'}. Best is trial 74 with value: 5.382502185293559.
[I 2024-02-07 12:47:21,139] Trial 84 finished with value: 8.942558619837571 and parameters: {'model_name': 'IterativeImputer', 'sample_posterior': True, 'initial_strategy': 'constant', 'imputation_order': 'ascending'}. Best is trial 74 with value: 5.382502185293559.
[I 2024-02-07 12:47:25,476] Trial 93 finished with value: 8.495548149313503 and parameters: {'model_name': 'IterativeImputer', 'sample_posterior': True, 'initial_strategy': 'mean', 'imputation_order': 'descending'}. Best is trial 74 with value: 5.382502185293559.
[I 2024-02-07 12:47:27,149] Trial 91 finished with value: 9.106911260096714 and parameters: {'model_name': 'IterativeImputer', 'sample_posterior': True, 'initial_strategy': 'mean', 'imputation_order': 'ascending'}. Best is trial 74 with value: 5.382502185293559.
[I 2024-02-07 12:47:29,650] Trial 89 finished with value: 9.02578354990159 and parameters: {'model_name': 'IterativeImputer', 'sample_posterior': True, 'initial_strategy': 'most_frequent', 'imputation_order': 'arabic'}. Best is trial 74 with value: 5.382502185293559.
[I 2024-02-07 12:47:30,864] Trial 88 finished with value: 8.834750584268397 and parameters: {'model_name': 'IterativeImputer', 'sample_posterior': True, 'initial_strategy': 'constant', 'imputation_order': 'random'}. Best is trial 74 with value: 5.382502185293559.
[I 2024-02-07 12:49:32,528] Trial 98 finished with value: 8.530191942414783 and parameters: {'model_name': 'IterativeImputer', 'sample_posterior': True, 'initial_strategy': 'constant', 'imputation_order': 'arabic'}. Best is trial 74 with value: 5.382502185293559.
[I 2024-02-07 12:49:34,697] Trial 96 finished with value: 9.162545064486197 and parameters: {'model_name': 'IterativeImputer', 'sample_posterior': True, 'initial_strategy': 'median', 'imputation_order': 'random'}. Best is trial 74 with value: 5.382502185293559.
[I 2024-02-07 12:49:40,267] Trial 97 finished with value: 9.093413741668105 and parameters: {'model_name': 'IterativeImputer', 'sample_posterior': True, 'initial_strategy': 'constant', 'imputation_order': 'random'}. Best is trial 74 with value: 5.382502185293559.
[I 2024-02-07 12:49:51,338] Trial 100 finished with value: 8.649524973628862 and parameters: {'model_name': 'IterativeImputer', 'sample_posterior': True, 'initial_strategy': 'constant', 'imputation_order': 'roman'}. Best is trial 74 with value: 5.382502185293559.
[I 2024-02-07 12:50:57,867] Trial 5 finished with value: inf and parameters: {'model_name': 'GAIN', 'batch_size': 5, 'hint_rate': 0.21000000000000002, 'alpha': 79, 'iterations': 1220}. Best is trial 74 with value: 5.382502185293559.
[I 2024-02-07 12:51:09,990] Trial 140 finished with value: 5.382502185293559 and parameters: {'model_name': 'IterativeImputer', 'sample_posterior': False, 'initial_strategy': 'median', 'imputation_order': 'arabic'}. Best is trial 74 with value: 5.382502185293559.
[I 2024-02-07 12:51:35,350] Trial 141 finished with value: 5.382502185293559 and parameters: {'model_name': 'IterativeImputer', 'sample_posterior': False, 'initial_strategy': 'median', 'imputation_order': 'arabic'}. Best is trial 74 with value: 5.382502185293559.
[I 2024-02-07 12:51:44,890] Trial 142 finished with value: 5.382502185293559 and parameters: {'model_name': 'IterativeImputer', 'sample_posterior': False, 'initial_strategy': 'median', 'imputation_order': 'arabic'}. Best is trial 74 with value: 5.382502185293559.
[I 2024-02-07 12:52:08,561] Trial 143 finished with value: 5.382502185293559 and parameters: {'model_name': 'IterativeImputer', 'sample_posterior': False, 'initial_strategy': 'median', 'imputation_order': 'arabic'}. Best is trial 74 with value: 5.382502185293559.
[I 2024-02-07 12:52:09,906] Trial 160 finished with value: 5.383744478084052 and parameters: {'model_name': 'IterativeImputer', 'sample_posterior': False, 'initial_strategy': 'median', 'imputation_order': 'random'}. Best is trial 74 with value: 5.382502185293559.
[I 2024-02-07 12:52:20,974] Trial 144 finished with value: 5.382502185293559 and parameters: {'model_name': 'IterativeImputer', 'sample_posterior': False, 'initial_strategy': 'median', 'imputation_order': 'arabic'}. Best is trial 74 with value: 5.382502185293559.
[I 2024-02-07 12:52:24,532] Trial 145 finished with value: 5.382502185293559 and parameters: {'model_name': 'IterativeImputer', 'sample_posterior': False, 'initial_strategy': 'median', 'imputation_order': 'arabic'}. Best is trial 74 with value: 5.382502185293559.
[I 2024-02-07 12:52:27,191] Trial 146 finished with value: 5.382502185293559 and parameters: {'model_name': 'IterativeImputer', 'sample_posterior': False, 'initial_strategy': 'median', 'imputation_order': 'arabic'}. Best is trial 74 with value: 5.382502185293559.
[I 2024-02-07 12:52:33,186] Trial 147 finished with value: 5.382502185293559 and parameters: {'model_name': 'IterativeImputer', 'sample_posterior': False, 'initial_strategy': 'median', 'imputation_order': 'arabic'}. Best is trial 74 with value: 5.382502185293559.
[I 2024-02-07 12:52:41,382] Trial 148 finished with value: 5.382483647366905 and parameters: {'model_name': 'IterativeImputer', 'sample_posterior': False, 'initial_strategy': 'most_frequent', 'imputation_order': 'arabic'}. Best is trial 148 with value: 5.382483647366905.
[I 2024-02-07 12:52:56,142] Trial 154 finished with value: 5.382483647366905 and parameters: {'model_name': 'IterativeImputer', 'sample_posterior': False, 'initial_strategy': 'most_frequent', 'imputation_order': 'arabic'}. Best is trial 148 with value: 5.382483647366905.
[I 2024-02-07 12:52:57,133] Trial 149 finished with value: 5.382483647366905 and parameters: {'model_name': 'IterativeImputer', 'sample_posterior': False, 'initial_strategy': 'most_frequent', 'imputation_order': 'arabic'}. Best is trial 148 with value: 5.382483647366905.
[I 2024-02-07 12:52:57,954] Trial 152 finished with value: 5.382483647366905 and parameters: {'model_name': 'IterativeImputer', 'sample_posterior': False, 'initial_strategy': 'most_frequent', 'imputation_order': 'arabic'}. Best is trial 148 with value: 5.382483647366905.
[I 2024-02-07 12:52:58,695] Trial 158 finished with value: 5.382502185293559 and parameters: {'model_name': 'IterativeImputer', 'sample_posterior': False, 'initial_strategy': 'median', 'imputation_order': 'arabic'}. Best is trial 148 with value: 5.382483647366905.
[I 2024-02-07 12:52:59,676] Trial 150 finished with value: 5.382483647366905 and parameters: {'model_name': 'IterativeImputer', 'sample_posterior': False, 'initial_strategy': 'most_frequent', 'imputation_order': 'arabic'}. Best is trial 148 with value: 5.382483647366905.
[I 2024-02-07 12:53:00,728] Trial 153 finished with value: 5.382483647366905 and parameters: {'model_name': 'IterativeImputer', 'sample_posterior': False, 'initial_strategy': 'most_frequent', 'imputation_order': 'arabic'}. Best is trial 148 with value: 5.382483647366905.
[I 2024-02-07 12:53:03,470] Trial 151 finished with value: 5.382483647366905 and parameters: {'model_name': 'IterativeImputer', 'sample_posterior': False, 'initial_strategy': 'most_frequent', 'imputation_order': 'arabic'}. Best is trial 148 with value: 5.382483647366905.
[I 2024-02-07 12:53:04,314] Trial 159 finished with value: 5.382502185293559 and parameters: {'model_name': 'IterativeImputer', 'sample_posterior': False, 'initial_strategy': 'median', 'imputation_order': 'arabic'}. Best is trial 148 with value: 5.382483647366905.
[I 2024-02-07 12:53:06,169] Trial 161 finished with value: 5.382502185293559 and parameters: {'model_name': 'IterativeImputer', 'sample_posterior': False, 'initial_strategy': 'median', 'imputation_order': 'arabic'}. Best is trial 148 with value: 5.382483647366905.
[I 2024-02-07 12:53:07,456] Trial 155 finished with value: 5.382483647366905 and parameters: {'model_name': 'IterativeImputer', 'sample_posterior': False, 'initial_strategy': 'most_frequent', 'imputation_order': 'arabic'}. Best is trial 148 with value: 5.382483647366905.
[I 2024-02-07 12:53:09,437] Trial 157 finished with value: 5.382483647366905 and parameters: {'model_name': 'IterativeImputer', 'sample_posterior': False, 'initial_strategy': 'most_frequent', 'imputation_order': 'arabic'}. Best is trial 148 with value: 5.382483647366905.
[I 2024-02-07 12:53:12,265] Trial 156 finished with value: 5.382483647366905 and parameters: {'model_name': 'IterativeImputer', 'sample_posterior': False, 'initial_strategy': 'most_frequent', 'imputation_order': 'arabic'}. Best is trial 148 with value: 5.382483647366905.
[I 2024-02-07 12:53:27,127] Trial 162 finished with value: 5.384167246490792 and parameters: {'model_name': 'IterativeImputer', 'sample_posterior': False, 'initial_strategy': 'median', 'imputation_order': 'random'}. Best is trial 148 with value: 5.382483647366905.
[I 2024-02-07 12:53:29,284] Trial 189 finished with value: 14.40110701111231 and parameters: {'model_name': 'SimpleImputer', 'strategy': 'median'}. Best is trial 148 with value: 5.382483647366905.
[I 2024-02-07 12:54:02,039] Trial 163 finished with value: 5.384105306563326 and parameters: {'model_name': 'IterativeImputer', 'sample_posterior': False, 'initial_strategy': 'most_frequent', 'imputation_order': 'random'}. Best is trial 148 with value: 5.382483647366905.
[I 2024-02-07 12:55:12,955] Trial 168 finished with value: 5.382502185293559 and parameters: {'model_name': 'IterativeImputer', 'sample_posterior': False, 'initial_strategy': 'median', 'imputation_order': 'arabic'}. Best is trial 148 with value: 5.382483647366905.
[I 2024-02-07 12:55:20,051] Trial 169 finished with value: 5.382502185293559 and parameters: {'model_name': 'IterativeImputer', 'sample_posterior': False, 'initial_strategy': 'median', 'imputation_order': 'arabic'}. Best is trial 148 with value: 5.382483647366905.
[I 2024-02-07 12:55:40,707] Trial 175 finished with value: 5.382502185293559 and parameters: {'model_name': 'IterativeImputer', 'sample_posterior': False, 'initial_strategy': 'median', 'imputation_order': 'arabic'}. Best is trial 148 with value: 5.382483647366905.
[I 2024-02-07 12:55:52,168] Trial 181 finished with value: 5.382502185293559 and parameters: {'model_name': 'IterativeImputer', 'sample_posterior': False, 'initial_strategy': 'median', 'imputation_order': 'arabic'}. Best is trial 148 with value: 5.382483647366905.
[I 2024-02-07 12:55:53,845] Trial 182 finished with value: 5.382502185293559 and parameters: {'model_name': 'IterativeImputer', 'sample_posterior': False, 'initial_strategy': 'median', 'imputation_order': 'arabic'}. Best is trial 148 with value: 5.382483647366905.
[I 2024-02-07 12:55:56,614] Trial 26 finished with value: 14.331925158940956 and parameters: {'model_name': 'RandomForestImputer', 'max_iter': 27, 'decreasing': False, 'min_samples_split': 0.9, 'min_samples_leaf': 0.4, 'max_features': 0.5, 'warm_start': False}. Best is trial 148 with value: 5.382483647366905.
[I 2024-02-07 12:55:57,983] Trial 184 finished with value: 5.382483647366905 and parameters: {'model_name': 'IterativeImputer', 'sample_posterior': False, 'initial_strategy': 'most_frequent', 'imputation_order': 'arabic'}. Best is trial 148 with value: 5.382483647366905.
[I 2024-02-07 12:56:15,542] Trial 123 finished with value: 9.110306474909304 and parameters: {'model_name': 'IterativeImputer', 'sample_posterior': True, 'initial_strategy': 'median', 'imputation_order': 'roman'}. Best is trial 148 with value: 5.382483647366905.
[I 2024-02-07 12:56:45,484] Trial 124 finished with value: 8.988778585106163 and parameters: {'model_name': 'IterativeImputer', 'sample_posterior': True, 'initial_strategy': 'median', 'imputation_order': 'arabic'}. Best is trial 148 with value: 5.382483647366905.
[I 2024-02-07 12:56:47,138] Trial 126 finished with value: 8.872498424633793 and parameters: {'model_name': 'IterativeImputer', 'sample_posterior': True, 'initial_strategy': 'median', 'imputation_order': 'arabic'}. Best is trial 148 with value: 5.382483647366905.
[I 2024-02-07 12:56:51,594] Trial 125 finished with value: 9.055257326017243 and parameters: {'model_name': 'IterativeImputer', 'sample_posterior': True, 'initial_strategy': 'median', 'imputation_order': 'arabic'}. Best is trial 148 with value: 5.382483647366905.
[I 2024-02-07 12:56:53,413] Trial 127 finished with value: 9.478608947918328 and parameters: {'model_name': 'IterativeImputer', 'sample_posterior': True, 'initial_strategy': 'median', 'imputation_order': 'arabic'}. Best is trial 148 with value: 5.382483647366905.
[I 2024-02-07 12:57:00,940] Trial 128 finished with value: 8.900438833182212 and parameters: {'model_name': 'IterativeImputer', 'sample_posterior': True, 'initial_strategy': 'median', 'imputation_order': 'arabic'}. Best is trial 148 with value: 5.382483647366905.
[I 2024-02-07 12:57:02,834] Trial 72 finished with value: 14.331640224888918 and parameters: {'model_name': 'RandomForestImputer', 'max_iter': 35, 'decreasing': True, 'min_samples_split': 0.2, 'min_samples_leaf': 0.6, 'max_features': 0.7000000000000001, 'warm_start': False}. Best is trial 148 with value: 5.382483647366905.
[I 2024-02-07 12:57:04,892] Trial 129 finished with value: 9.323380954487316 and parameters: {'model_name': 'IterativeImputer', 'sample_posterior': True, 'initial_strategy': 'median', 'imputation_order': 'arabic'}. Best is trial 148 with value: 5.382483647366905.
[I 2024-02-07 12:57:13,038] Trial 130 finished with value: 9.210496454936857 and parameters: {'model_name': 'IterativeImputer', 'sample_posterior': True, 'initial_strategy': 'median', 'imputation_order': 'arabic'}. Best is trial 148 with value: 5.382483647366905.
[I 2024-02-07 12:57:16,794] Trial 132 finished with value: 9.052974030852054 and parameters: {'model_name': 'IterativeImputer', 'sample_posterior': True, 'initial_strategy': 'median', 'imputation_order': 'arabic'}. Best is trial 148 with value: 5.382483647366905.
[I 2024-02-07 12:57:18,076] Trial 131 finished with value: 9.05149046496706 and parameters: {'model_name': 'IterativeImputer', 'sample_posterior': True, 'initial_strategy': 'median', 'imputation_order': 'arabic'}. Best is trial 148 with value: 5.382483647366905.
[I 2024-02-07 12:57:19,654] Trial 133 finished with value: 8.913450517272226 and parameters: {'model_name': 'IterativeImputer', 'sample_posterior': True, 'initial_strategy': 'median', 'imputation_order': 'arabic'}. Best is trial 148 with value: 5.382483647366905.
[I 2024-02-07 12:57:22,302] Trial 192 finished with value: 5.382483647366905 and parameters: {'model_name': 'IterativeImputer', 'sample_posterior': False, 'initial_strategy': 'most_frequent', 'imputation_order': 'arabic'}. Best is trial 148 with value: 5.382483647366905.
[I 2024-02-07 12:57:31,282] Trial 134 finished with value: 8.931532195958955 and parameters: {'model_name': 'IterativeImputer', 'sample_posterior': True, 'initial_strategy': 'median', 'imputation_order': 'arabic'}. Best is trial 148 with value: 5.382483647366905.
[I 2024-02-07 12:57:36,252] Trial 136 finished with value: 9.06581464916634 and parameters: {'model_name': 'IterativeImputer', 'sample_posterior': True, 'initial_strategy': 'median', 'imputation_order': 'arabic'}. Best is trial 148 with value: 5.382483647366905.
[I 2024-02-07 12:58:06,333] Trial 137 finished with value: 9.028236051719215 and parameters: {'model_name': 'IterativeImputer', 'sample_posterior': True, 'initial_strategy': 'median', 'imputation_order': 'arabic'}. Best is trial 148 with value: 5.382483647366905.
[I 2024-02-07 12:58:18,511] Trial 138 finished with value: 8.563599729913935 and parameters: {'model_name': 'IterativeImputer', 'sample_posterior': True, 'initial_strategy': 'median', 'imputation_order': 'arabic'}. Best is trial 148 with value: 5.382483647366905.
