Run: 9
/cm/local/apps/slurm/var/spool/job653822/slurm_script: line 23: /common/ketrong/minconda3/etc/profile.d/conda.sh: No such file or directory
/cm/local/apps/slurm/var/spool/job653822/slurm_script: line 26: $'\nconda create --name tpot2devenv -c conda-forge python=3.10\n': command not found
/cm/local/apps/slurm/var/spool/job653822/slurm_script: line 31: $'\npip install -r requirements.txt\n': command not found
RunStart
2024-02-11 01:00:11.712571: I tensorflow/core/util/port.cc:113] oneDNN custom operations are on. You may see slightly different numerical results due to floating-point round-off errors from different computation orders. To turn them off, set the environment variable `TF_ENABLE_ONEDNN_OPTS=0`.
2024-02-11 01:00:11.747102: E external/local_xla/xla/stream_executor/cuda/cuda_dnn.cc:9261] Unable to register cuDNN factory: Attempting to register factory for plugin cuDNN when one has already been registered
2024-02-11 01:00:11.747123: E external/local_xla/xla/stream_executor/cuda/cuda_fft.cc:607] Unable to register cuFFT factory: Attempting to register factory for plugin cuFFT when one has already been registered
2024-02-11 01:00:11.748248: E external/local_xla/xla/stream_executor/cuda/cuda_blas.cc:1515] Unable to register cuBLAS factory: Attempting to register factory for plugin cuBLAS when one has already been registered
2024-02-11 01:00:11.753833: I tensorflow/core/platform/cpu_feature_guard.cc:182] This TensorFlow binary is optimized to use available CPU instructions in performance-critical operations.
To enable the following instructions: AVX2 AVX512F AVX512_VNNI FMA, in other operations, rebuild TensorFlow with the appropriate compiler flags.
2024-02-11 01:00:13.287913: W tensorflow/compiler/tf2tensorrt/utils/py_utils.cc:38] TF-TRT Warning: Could not find TensorRT
WARNING:tensorflow:From /home/ketrong/miniconda3/envs/tpot2devenv/lib/python3.10/site-packages/tensorflow/python/compat/v2_compat.py:108: disable_resource_variables (from tensorflow.python.ops.variable_scope) is deprecated and will be removed in a future version.
Instructions for updating:
non-resource variables are not supported in the long term
starting loops
working on 
logs/189773/tpot2_base_normal_MAR_0.5
2.1328628063201904
loading data
logs/189773/tpot2_base_normal_MAR_0.5/data/189773_True.pkl
running experiment 1/3 - Does large hyperparameter space improve reconstruction accuracy over simple
[I 2024-02-11 01:00:24,325] A new study created in memory with name: no-name-f32c0354-9997-4ebe-a3a0-e0db1d37e7f9
[I 2024-02-11 01:00:25,789] Trial 2 finished with value: 5.323008900990046 and parameters: {'model_name': 'SimpleImputer', 'strategy': 'constant'}. Best is trial 2 with value: 5.323008900990046.
[I 2024-02-11 01:00:26,131] Trial 1 finished with value: 5.323008900990046 and parameters: {'model_name': 'SimpleImputer', 'strategy': 'constant'}. Best is trial 2 with value: 5.323008900990046.
[I 2024-02-11 01:00:26,343] Trial 3 finished with value: 5.323008900990046 and parameters: {'model_name': 'SimpleImputer', 'strategy': 'constant'}. Best is trial 2 with value: 5.323008900990046.
[I 2024-02-11 01:00:26,559] Trial 8 finished with value: 5.323008900990046 and parameters: {'model_name': 'SimpleImputer', 'strategy': 'constant'}. Best is trial 2 with value: 5.323008900990046.
[I 2024-02-11 01:00:26,807] Trial 4 finished with value: 4.018858933540362 and parameters: {'model_name': 'SimpleImputer', 'strategy': 'mean'}. Best is trial 4 with value: 4.018858933540362.
[I 2024-02-11 01:00:27,485] Trial 19 finished with value: 5.323008900990046 and parameters: {'model_name': 'SimpleImputer', 'strategy': 'constant'}. Best is trial 4 with value: 4.018858933540362.
[I 2024-02-11 01:00:27,715] Trial 18 finished with value: 5.323008900990046 and parameters: {'model_name': 'SimpleImputer', 'strategy': 'constant'}. Best is trial 4 with value: 4.018858933540362.
[I 2024-02-11 01:00:28,161] Trial 21 finished with value: 5.323008900990046 and parameters: {'model_name': 'SimpleImputer', 'strategy': 'constant'}. Best is trial 4 with value: 4.018858933540362.
[I 2024-02-11 01:00:28,440] Trial 6 finished with value: 4.018858933540362 and parameters: {'model_name': 'SimpleImputer', 'strategy': 'mean'}. Best is trial 4 with value: 4.018858933540362.
[I 2024-02-11 01:00:28,682] Trial 26 finished with value: 5.323008900990046 and parameters: {'model_name': 'SimpleImputer', 'strategy': 'constant'}. Best is trial 4 with value: 4.018858933540362.
[I 2024-02-11 01:00:29,223] Trial 12 finished with value: 4.018858933540362 and parameters: {'model_name': 'SimpleImputer', 'strategy': 'mean'}. Best is trial 4 with value: 4.018858933540362.
[I 2024-02-11 01:00:29,569] Trial 32 finished with value: 5.323008900990046 and parameters: {'model_name': 'SimpleImputer', 'strategy': 'constant'}. Best is trial 4 with value: 4.018858933540362.
[I 2024-02-11 01:00:29,854] Trial 36 finished with value: 5.323008900990046 and parameters: {'model_name': 'SimpleImputer', 'strategy': 'constant'}. Best is trial 4 with value: 4.018858933540362.
[I 2024-02-11 01:00:30,057] Trial 34 finished with value: 5.323008900990046 and parameters: {'model_name': 'SimpleImputer', 'strategy': 'constant'}. Best is trial 4 with value: 4.018858933540362.
[I 2024-02-11 01:00:30,283] Trial 14 finished with value: 4.018858933540362 and parameters: {'model_name': 'SimpleImputer', 'strategy': 'mean'}. Best is trial 4 with value: 4.018858933540362.
[I 2024-02-11 01:00:30,484] Trial 23 finished with value: 4.018858933540362 and parameters: {'model_name': 'SimpleImputer', 'strategy': 'mean'}. Best is trial 4 with value: 4.018858933540362.
[I 2024-02-11 01:00:30,712] Trial 31 finished with value: 5.323008900990046 and parameters: {'model_name': 'SimpleImputer', 'strategy': 'constant'}. Best is trial 4 with value: 4.018858933540362.
[I 2024-02-11 01:00:31,036] Trial 0 finished with value: 4.337778051235877 and parameters: {'model_name': 'SimpleImputer', 'strategy': 'median'}. Best is trial 4 with value: 4.018858933540362.
[I 2024-02-11 01:00:31,369] Trial 47 finished with value: 5.323008900990046 and parameters: {'model_name': 'SimpleImputer', 'strategy': 'constant'}. Best is trial 4 with value: 4.018858933540362.
[I 2024-02-11 01:00:31,543] Trial 40 finished with value: 5.323008900990046 and parameters: {'model_name': 'SimpleImputer', 'strategy': 'constant'}. Best is trial 4 with value: 4.018858933540362.
[I 2024-02-11 01:00:31,749] Trial 41 finished with value: 5.323008900990046 and parameters: {'model_name': 'SimpleImputer', 'strategy': 'constant'}. Best is trial 4 with value: 4.018858933540362.
[I 2024-02-11 01:00:31,917] Trial 25 finished with value: 4.018858933540362 and parameters: {'model_name': 'SimpleImputer', 'strategy': 'mean'}. Best is trial 4 with value: 4.018858933540362.
[I 2024-02-11 01:00:32,079] Trial 38 finished with value: 5.323008900990046 and parameters: {'model_name': 'SimpleImputer', 'strategy': 'constant'}. Best is trial 4 with value: 4.018858933540362.
[I 2024-02-11 01:00:32,347] Trial 39 finished with value: 5.323008900990046 and parameters: {'model_name': 'SimpleImputer', 'strategy': 'constant'}. Best is trial 4 with value: 4.018858933540362.
[I 2024-02-11 01:00:32,618] Trial 33 finished with value: 4.018858933540362 and parameters: {'model_name': 'SimpleImputer', 'strategy': 'mean'}. Best is trial 4 with value: 4.018858933540362.
[I 2024-02-11 01:00:33,148] Trial 35 finished with value: 4.018858933540362 and parameters: {'model_name': 'SimpleImputer', 'strategy': 'mean'}. Best is trial 4 with value: 4.018858933540362.
[I 2024-02-11 01:00:33,389] Trial 10 finished with value: 4.337778051235877 and parameters: {'model_name': 'SimpleImputer', 'strategy': 'median'}. Best is trial 4 with value: 4.018858933540362.
[I 2024-02-11 01:00:33,652] Trial 13 finished with value: 4.337778051235877 and parameters: {'model_name': 'SimpleImputer', 'strategy': 'median'}. Best is trial 4 with value: 4.018858933540362.
[I 2024-02-11 01:00:33,954] Trial 44 finished with value: 4.018858933540362 and parameters: {'model_name': 'SimpleImputer', 'strategy': 'mean'}. Best is trial 4 with value: 4.018858933540362.
[I 2024-02-11 01:00:34,376] Trial 20 finished with value: 4.337778051235877 and parameters: {'model_name': 'SimpleImputer', 'strategy': 'median'}. Best is trial 4 with value: 4.018858933540362.
[I 2024-02-11 01:00:34,661] Trial 46 finished with value: 4.018858933540362 and parameters: {'model_name': 'SimpleImputer', 'strategy': 'mean'}. Best is trial 4 with value: 4.018858933540362.
[I 2024-02-11 01:00:35,186] Trial 54 finished with value: 5.323008900990046 and parameters: {'model_name': 'SimpleImputer', 'strategy': 'constant'}. Best is trial 4 with value: 4.018858933540362.
[I 2024-02-11 01:00:35,518] Trial 50 finished with value: 4.018858933540362 and parameters: {'model_name': 'SimpleImputer', 'strategy': 'mean'}. Best is trial 4 with value: 4.018858933540362.
[I 2024-02-11 01:00:35,772] Trial 24 finished with value: 4.337778051235877 and parameters: {'model_name': 'SimpleImputer', 'strategy': 'median'}. Best is trial 4 with value: 4.018858933540362.
[I 2024-02-11 01:00:36,144] Trial 42 finished with value: 4.337778051235877 and parameters: {'model_name': 'SimpleImputer', 'strategy': 'median'}. Best is trial 4 with value: 4.018858933540362.
[I 2024-02-11 01:00:36,570] Trial 37 finished with value: 4.337778051235877 and parameters: {'model_name': 'SimpleImputer', 'strategy': 'median'}. Best is trial 4 with value: 4.018858933540362.
[I 2024-02-11 01:00:37,069] Trial 55 finished with value: 4.018858933540362 and parameters: {'model_name': 'SimpleImputer', 'strategy': 'mean'}. Best is trial 4 with value: 4.018858933540362.
[I 2024-02-11 01:00:37,312] Trial 59 finished with value: 4.018858933540362 and parameters: {'model_name': 'SimpleImputer', 'strategy': 'mean'}. Best is trial 4 with value: 4.018858933540362.
[I 2024-02-11 01:00:37,646] Trial 57 finished with value: 4.018858933540362 and parameters: {'model_name': 'SimpleImputer', 'strategy': 'mean'}. Best is trial 4 with value: 4.018858933540362.
[I 2024-02-11 01:00:37,946] Trial 56 finished with value: 4.018858933540362 and parameters: {'model_name': 'SimpleImputer', 'strategy': 'mean'}. Best is trial 4 with value: 4.018858933540362.
[I 2024-02-11 01:00:38,321] Trial 61 finished with value: 4.018858933540362 and parameters: {'model_name': 'SimpleImputer', 'strategy': 'mean'}. Best is trial 4 with value: 4.018858933540362.
[I 2024-02-11 01:00:38,495] Trial 58 finished with value: 4.018858933540362 and parameters: {'model_name': 'SimpleImputer', 'strategy': 'mean'}. Best is trial 4 with value: 4.018858933540362.
[I 2024-02-11 01:00:38,729] Trial 51 finished with value: 4.337778051235877 and parameters: {'model_name': 'SimpleImputer', 'strategy': 'median'}. Best is trial 4 with value: 4.018858933540362.
[I 2024-02-11 01:00:39,379] Trial 67 finished with value: 4.018858933540362 and parameters: {'model_name': 'SimpleImputer', 'strategy': 'mean'}. Best is trial 4 with value: 4.018858933540362.
[I 2024-02-11 01:00:39,660] Trial 60 finished with value: 4.018858933540362 and parameters: {'model_name': 'SimpleImputer', 'strategy': 'mean'}. Best is trial 4 with value: 4.018858933540362.
[I 2024-02-11 01:00:40,292] Trial 62 finished with value: 4.337778051235877 and parameters: {'model_name': 'SimpleImputer', 'strategy': 'median'}. Best is trial 4 with value: 4.018858933540362.
[I 2024-02-11 01:00:40,787] Trial 63 finished with value: 4.337778051235877 and parameters: {'model_name': 'SimpleImputer', 'strategy': 'median'}. Best is trial 4 with value: 4.018858933540362.
[I 2024-02-11 01:00:44,548] Trial 17 finished with value: 4.551095295035358 and parameters: {'model_name': 'SimpleImputer', 'strategy': 'most_frequent'}. Best is trial 4 with value: 4.018858933540362.
[I 2024-02-11 01:00:44,990] Trial 9 finished with value: 4.551095295035358 and parameters: {'model_name': 'SimpleImputer', 'strategy': 'most_frequent'}. Best is trial 4 with value: 4.018858933540362.
[I 2024-02-11 01:00:45,983] Trial 11 finished with value: 4.551095295035358 and parameters: {'model_name': 'SimpleImputer', 'strategy': 'most_frequent'}. Best is trial 4 with value: 4.018858933540362.
[I 2024-02-11 01:00:46,387] Trial 15 finished with value: 4.551095295035358 and parameters: {'model_name': 'SimpleImputer', 'strategy': 'most_frequent'}. Best is trial 4 with value: 4.018858933540362.
[I 2024-02-11 01:00:46,732] Trial 7 finished with value: 4.551095295035358 and parameters: {'model_name': 'SimpleImputer', 'strategy': 'most_frequent'}. Best is trial 4 with value: 4.018858933540362.
[I 2024-02-11 01:00:46,899] Trial 16 finished with value: 4.551095295035358 and parameters: {'model_name': 'SimpleImputer', 'strategy': 'most_frequent'}. Best is trial 4 with value: 4.018858933540362.
[I 2024-02-11 01:00:47,245] Trial 5 finished with value: 4.551095295035358 and parameters: {'model_name': 'SimpleImputer', 'strategy': 'most_frequent'}. Best is trial 4 with value: 4.018858933540362.
[I 2024-02-11 01:00:47,946] Trial 43 finished with value: 4.551095295035358 and parameters: {'model_name': 'SimpleImputer', 'strategy': 'most_frequent'}. Best is trial 4 with value: 4.018858933540362.
[I 2024-02-11 01:00:48,494] Trial 27 finished with value: 4.551095295035358 and parameters: {'model_name': 'SimpleImputer', 'strategy': 'most_frequent'}. Best is trial 4 with value: 4.018858933540362.
[I 2024-02-11 01:00:48,795] Trial 22 finished with value: 4.551095295035358 and parameters: {'model_name': 'SimpleImputer', 'strategy': 'most_frequent'}. Best is trial 4 with value: 4.018858933540362.
[I 2024-02-11 01:00:49,017] Trial 29 finished with value: 4.551095295035358 and parameters: {'model_name': 'SimpleImputer', 'strategy': 'most_frequent'}. Best is trial 4 with value: 4.018858933540362.
[I 2024-02-11 01:00:49,390] Trial 49 finished with value: 4.551095295035358 and parameters: {'model_name': 'SimpleImputer', 'strategy': 'most_frequent'}. Best is trial 4 with value: 4.018858933540362.
[I 2024-02-11 01:00:49,641] Trial 45 finished with value: 4.551095295035358 and parameters: {'model_name': 'SimpleImputer', 'strategy': 'most_frequent'}. Best is trial 4 with value: 4.018858933540362.
[I 2024-02-11 01:00:49,914] Trial 28 finished with value: 4.551095295035358 and parameters: {'model_name': 'SimpleImputer', 'strategy': 'most_frequent'}. Best is trial 4 with value: 4.018858933540362.
[I 2024-02-11 01:00:50,181] Trial 53 finished with value: 4.551095295035358 and parameters: {'model_name': 'SimpleImputer', 'strategy': 'most_frequent'}. Best is trial 4 with value: 4.018858933540362.
[I 2024-02-11 01:00:50,432] Trial 30 finished with value: 4.551095295035358 and parameters: {'model_name': 'SimpleImputer', 'strategy': 'most_frequent'}. Best is trial 4 with value: 4.018858933540362.
[I 2024-02-11 01:00:50,758] Trial 52 finished with value: 4.551095295035358 and parameters: {'model_name': 'SimpleImputer', 'strategy': 'most_frequent'}. Best is trial 4 with value: 4.018858933540362.
[I 2024-02-11 01:00:51,472] Trial 98 finished with value: 4.018858933540362 and parameters: {'model_name': 'SimpleImputer', 'strategy': 'mean'}. Best is trial 4 with value: 4.018858933540362.
[I 2024-02-11 01:00:51,949] Trial 48 finished with value: 4.551095295035358 and parameters: {'model_name': 'SimpleImputer', 'strategy': 'most_frequent'}. Best is trial 4 with value: 4.018858933540362.
[I 2024-02-11 01:00:52,205] Trial 100 finished with value: 4.018858933540362 and parameters: {'model_name': 'SimpleImputer', 'strategy': 'mean'}. Best is trial 4 with value: 4.018858933540362.
[I 2024-02-11 01:00:52,946] Trial 101 finished with value: 4.018858933540362 and parameters: {'model_name': 'SimpleImputer', 'strategy': 'mean'}. Best is trial 4 with value: 4.018858933540362.
[I 2024-02-11 01:00:53,332] Trial 99 finished with value: 4.018858933540362 and parameters: {'model_name': 'SimpleImputer', 'strategy': 'mean'}. Best is trial 4 with value: 4.018858933540362.
[I 2024-02-11 01:00:53,560] Trial 66 finished with value: 4.551095295035358 and parameters: {'model_name': 'SimpleImputer', 'strategy': 'most_frequent'}. Best is trial 4 with value: 4.018858933540362.
[I 2024-02-11 01:00:53,815] Trial 78 finished with value: 4.551095295035358 and parameters: {'model_name': 'SimpleImputer', 'strategy': 'most_frequent'}. Best is trial 4 with value: 4.018858933540362.
[I 2024-02-11 01:00:54,052] Trial 75 finished with value: 4.551095295035358 and parameters: {'model_name': 'SimpleImputer', 'strategy': 'most_frequent'}. Best is trial 4 with value: 4.018858933540362.
[I 2024-02-11 01:00:54,450] Trial 77 finished with value: 4.551095295035358 and parameters: {'model_name': 'SimpleImputer', 'strategy': 'most_frequent'}. Best is trial 4 with value: 4.018858933540362.
[I 2024-02-11 01:00:54,702] Trial 64 finished with value: 4.551095295035358 and parameters: {'model_name': 'SimpleImputer', 'strategy': 'most_frequent'}. Best is trial 4 with value: 4.018858933540362.
[I 2024-02-11 01:00:55,114] Trial 69 finished with value: 4.551095295035358 and parameters: {'model_name': 'SimpleImputer', 'strategy': 'most_frequent'}. Best is trial 4 with value: 4.018858933540362.
[I 2024-02-11 01:00:55,351] Trial 102 finished with value: 4.018858933540362 and parameters: {'model_name': 'SimpleImputer', 'strategy': 'mean'}. Best is trial 4 with value: 4.018858933540362.
[I 2024-02-11 01:00:55,664] Trial 70 finished with value: 4.551095295035358 and parameters: {'model_name': 'SimpleImputer', 'strategy': 'most_frequent'}. Best is trial 4 with value: 4.018858933540362.
[I 2024-02-11 01:00:56,007] Trial 103 finished with value: 4.018858933540362 and parameters: {'model_name': 'SimpleImputer', 'strategy': 'mean'}. Best is trial 4 with value: 4.018858933540362.
[I 2024-02-11 01:00:56,274] Trial 68 finished with value: 4.551095295035358 and parameters: {'model_name': 'SimpleImputer', 'strategy': 'most_frequent'}. Best is trial 4 with value: 4.018858933540362.
[I 2024-02-11 01:00:56,689] Trial 106 finished with value: 4.018858933540362 and parameters: {'model_name': 'SimpleImputer', 'strategy': 'mean'}. Best is trial 4 with value: 4.018858933540362.
[I 2024-02-11 01:00:56,954] Trial 81 finished with value: 4.551095295035358 and parameters: {'model_name': 'SimpleImputer', 'strategy': 'most_frequent'}. Best is trial 4 with value: 4.018858933540362.
[I 2024-02-11 01:00:57,239] Trial 74 finished with value: 4.551095295035358 and parameters: {'model_name': 'SimpleImputer', 'strategy': 'most_frequent'}. Best is trial 4 with value: 4.018858933540362.
[I 2024-02-11 01:00:57,481] Trial 72 finished with value: 4.551095295035358 and parameters: {'model_name': 'SimpleImputer', 'strategy': 'most_frequent'}. Best is trial 4 with value: 4.018858933540362.
[I 2024-02-11 01:00:57,816] Trial 107 finished with value: 4.018858933540362 and parameters: {'model_name': 'SimpleImputer', 'strategy': 'mean'}. Best is trial 4 with value: 4.018858933540362.
[I 2024-02-11 01:00:58,056] Trial 111 finished with value: 4.018858933540362 and parameters: {'model_name': 'SimpleImputer', 'strategy': 'mean'}. Best is trial 4 with value: 4.018858933540362.
[I 2024-02-11 01:00:58,271] Trial 82 finished with value: 4.551095295035358 and parameters: {'model_name': 'SimpleImputer', 'strategy': 'most_frequent'}. Best is trial 4 with value: 4.018858933540362.
[I 2024-02-11 01:00:58,499] Trial 105 finished with value: 4.018858933540362 and parameters: {'model_name': 'SimpleImputer', 'strategy': 'mean'}. Best is trial 4 with value: 4.018858933540362.
[I 2024-02-11 01:00:58,734] Trial 109 finished with value: 4.018858933540362 and parameters: {'model_name': 'SimpleImputer', 'strategy': 'mean'}. Best is trial 4 with value: 4.018858933540362.
[I 2024-02-11 01:00:58,952] Trial 110 finished with value: 4.018858933540362 and parameters: {'model_name': 'SimpleImputer', 'strategy': 'mean'}. Best is trial 4 with value: 4.018858933540362.
[I 2024-02-11 01:00:59,195] Trial 108 finished with value: 4.018858933540362 and parameters: {'model_name': 'SimpleImputer', 'strategy': 'mean'}. Best is trial 4 with value: 4.018858933540362.
[I 2024-02-11 01:00:59,425] Trial 104 finished with value: 4.018858933540362 and parameters: {'model_name': 'SimpleImputer', 'strategy': 'mean'}. Best is trial 4 with value: 4.018858933540362.
[I 2024-02-11 01:00:59,913] Trial 73 finished with value: 4.551095295035358 and parameters: {'model_name': 'SimpleImputer', 'strategy': 'most_frequent'}. Best is trial 4 with value: 4.018858933540362.
[I 2024-02-11 01:01:00,132] Trial 71 finished with value: 4.551095295035358 and parameters: {'model_name': 'SimpleImputer', 'strategy': 'most_frequent'}. Best is trial 4 with value: 4.018858933540362.
[I 2024-02-11 01:01:00,359] Trial 85 finished with value: 4.551095295035358 and parameters: {'model_name': 'SimpleImputer', 'strategy': 'most_frequent'}. Best is trial 4 with value: 4.018858933540362.
[I 2024-02-11 01:01:00,584] Trial 112 finished with value: 4.018858933540362 and parameters: {'model_name': 'SimpleImputer', 'strategy': 'mean'}. Best is trial 4 with value: 4.018858933540362.
[I 2024-02-11 01:01:00,849] Trial 65 finished with value: 4.551095295035358 and parameters: {'model_name': 'SimpleImputer', 'strategy': 'most_frequent'}. Best is trial 4 with value: 4.018858933540362.
[I 2024-02-11 01:01:01,094] Trial 86 finished with value: 4.551095295035358 and parameters: {'model_name': 'SimpleImputer', 'strategy': 'most_frequent'}. Best is trial 4 with value: 4.018858933540362.
[I 2024-02-11 01:01:01,300] Trial 113 finished with value: 4.018858933540362 and parameters: {'model_name': 'SimpleImputer', 'strategy': 'mean'}. Best is trial 4 with value: 4.018858933540362.
[I 2024-02-11 01:01:01,708] Trial 90 finished with value: 4.551095295035358 and parameters: {'model_name': 'SimpleImputer', 'strategy': 'most_frequent'}. Best is trial 4 with value: 4.018858933540362.
