Run: 13
/cm/local/apps/slurm/var/spool/job549695/slurm_script: line 23: /common/ketrong/minconda3/etc/profile.d/conda.sh: No such file or directory
/cm/local/apps/slurm/var/spool/job549695/slurm_script: line 26: $'\nconda create --name tpot2devenv -c conda-forge python=3.10\n': command not found
/cm/local/apps/slurm/var/spool/job549695/slurm_script: line 31: $'\npip install -r requirements.txt\n': command not found
RunStart
2023-12-12 15:24:50.011329: I tensorflow/core/util/port.cc:113] oneDNN custom operations are on. You may see slightly different numerical results due to floating-point round-off errors from different computation orders. To turn them off, set the environment variable `TF_ENABLE_ONEDNN_OPTS=0`.
2023-12-12 15:24:50.046629: E external/local_xla/xla/stream_executor/cuda/cuda_dnn.cc:9261] Unable to register cuDNN factory: Attempting to register factory for plugin cuDNN when one has already been registered
2023-12-12 15:24:50.046654: E external/local_xla/xla/stream_executor/cuda/cuda_fft.cc:607] Unable to register cuFFT factory: Attempting to register factory for plugin cuFFT when one has already been registered
2023-12-12 15:24:50.047780: E external/local_xla/xla/stream_executor/cuda/cuda_blas.cc:1515] Unable to register cuBLAS factory: Attempting to register factory for plugin cuBLAS when one has already been registered
2023-12-12 15:24:50.053292: I tensorflow/core/platform/cpu_feature_guard.cc:182] This TensorFlow binary is optimized to use available CPU instructions in performance-critical operations.
To enable the following instructions: AVX2 AVX512F AVX512_VNNI FMA, in other operations, rebuild TensorFlow with the appropriate compiler flags.
2023-12-12 15:24:52.135879: W tensorflow/compiler/tf2tensorrt/utils/py_utils.cc:38] TF-TRT Warning: Could not find TensorRT
WARNING:tensorflow:From /home/ketrong/miniconda3/envs/tpot2devenv/lib/python3.10/site-packages/tensorflow/python/compat/v2_compat.py:108: disable_resource_variables (from tensorflow.python.ops.variable_scope) is deprecated and will be removed in a future version.
Instructions for updating:
non-resource variables are not supported in the long term
starting loops
working on 
logs/30/tpot2_base_normal_MNAR_0.3
4.465662956237793
loading data
data/30_True.pkl
running experiment 1/3 - Does large hyperparameter space improve reconstruction accuracy over simple
[I 2023-12-12 15:25:13,783] A new study created in memory with name: no-name-ddd1e753-147e-4599-93ac-52adc2d14294
[I 2023-12-12 15:25:14,403] Trial 3 finished with value: 738.4426738830927 and parameters: {'model_name': 'SimpleImputer', 'strategy': 'mean'}. Best is trial 3 with value: 738.4426738830927.
[I 2023-12-12 15:25:14,834] Trial 9 finished with value: 825.8409106294924 and parameters: {'model_name': 'SimpleImputer', 'strategy': 'constant'}. Best is trial 3 with value: 738.4426738830927.
[I 2023-12-12 15:25:15,045] Trial 8 finished with value: 738.4426738830927 and parameters: {'model_name': 'SimpleImputer', 'strategy': 'mean'}. Best is trial 3 with value: 738.4426738830927.
[I 2023-12-12 15:25:15,221] Trial 5 finished with value: 738.4426738830927 and parameters: {'model_name': 'SimpleImputer', 'strategy': 'mean'}. Best is trial 3 with value: 738.4426738830927.
[I 2023-12-12 15:25:15,386] Trial 10 finished with value: 825.8409106294924 and parameters: {'model_name': 'SimpleImputer', 'strategy': 'constant'}. Best is trial 3 with value: 738.4426738830927.
[I 2023-12-12 15:25:15,686] Trial 0 finished with value: 738.4426738830927 and parameters: {'model_name': 'SimpleImputer', 'strategy': 'mean'}. Best is trial 3 with value: 738.4426738830927.
[I 2023-12-12 15:25:15,971] Trial 13 finished with value: 738.4426738830927 and parameters: {'model_name': 'SimpleImputer', 'strategy': 'mean'}. Best is trial 3 with value: 738.4426738830927.
[I 2023-12-12 15:25:16,149] Trial 18 finished with value: 825.8409106294924 and parameters: {'model_name': 'SimpleImputer', 'strategy': 'constant'}. Best is trial 3 with value: 738.4426738830927.
[I 2023-12-12 15:25:16,424] Trial 21 finished with value: 825.8409106294924 and parameters: {'model_name': 'SimpleImputer', 'strategy': 'constant'}. Best is trial 3 with value: 738.4426738830927.
[I 2023-12-12 15:25:16,608] Trial 1 finished with value: 738.4426738830927 and parameters: {'model_name': 'SimpleImputer', 'strategy': 'mean'}. Best is trial 3 with value: 738.4426738830927.
[I 2023-12-12 15:25:16,923] Trial 11 finished with value: 738.4426738830927 and parameters: {'model_name': 'SimpleImputer', 'strategy': 'mean'}. Best is trial 3 with value: 738.4426738830927.
[I 2023-12-12 15:25:17,202] Trial 32 finished with value: 825.8409106294924 and parameters: {'model_name': 'SimpleImputer', 'strategy': 'constant'}. Best is trial 3 with value: 738.4426738830927.
[I 2023-12-12 15:25:17,393] Trial 30 finished with value: 825.8409106294924 and parameters: {'model_name': 'SimpleImputer', 'strategy': 'constant'}. Best is trial 3 with value: 738.4426738830927.
[I 2023-12-12 15:25:17,794] Trial 33 finished with value: 825.8409106294924 and parameters: {'model_name': 'SimpleImputer', 'strategy': 'constant'}. Best is trial 3 with value: 738.4426738830927.
[I 2023-12-12 15:25:18,108] Trial 29 finished with value: 825.8409106294924 and parameters: {'model_name': 'SimpleImputer', 'strategy': 'constant'}. Best is trial 3 with value: 738.4426738830927.
[I 2023-12-12 15:25:18,408] Trial 22 finished with value: 825.8409106294924 and parameters: {'model_name': 'SimpleImputer', 'strategy': 'constant'}. Best is trial 3 with value: 738.4426738830927.
[I 2023-12-12 15:25:18,635] Trial 17 finished with value: 738.4426738830927 and parameters: {'model_name': 'SimpleImputer', 'strategy': 'mean'}. Best is trial 3 with value: 738.4426738830927.
[I 2023-12-12 15:25:18,974] Trial 27 finished with value: 825.8409106294924 and parameters: {'model_name': 'SimpleImputer', 'strategy': 'constant'}. Best is trial 3 with value: 738.4426738830927.
[I 2023-12-12 15:25:19,250] Trial 28 finished with value: 738.4426738830927 and parameters: {'model_name': 'SimpleImputer', 'strategy': 'mean'}. Best is trial 3 with value: 738.4426738830927.
[I 2023-12-12 15:25:19,489] Trial 2 finished with value: 802.2568270066806 and parameters: {'model_name': 'SimpleImputer', 'strategy': 'median'}. Best is trial 3 with value: 738.4426738830927.
[I 2023-12-12 15:25:19,718] Trial 25 finished with value: 738.4426738830927 and parameters: {'model_name': 'SimpleImputer', 'strategy': 'mean'}. Best is trial 3 with value: 738.4426738830927.
[I 2023-12-12 15:25:20,224] Trial 31 finished with value: 738.4426738830927 and parameters: {'model_name': 'SimpleImputer', 'strategy': 'mean'}. Best is trial 3 with value: 738.4426738830927.
[I 2023-12-12 15:25:20,546] Trial 34 finished with value: 738.4426738830927 and parameters: {'model_name': 'SimpleImputer', 'strategy': 'mean'}. Best is trial 3 with value: 738.4426738830927.
[I 2023-12-12 15:25:20,854] Trial 35 finished with value: 738.4426738830927 and parameters: {'model_name': 'SimpleImputer', 'strategy': 'mean'}. Best is trial 3 with value: 738.4426738830927.
[I 2023-12-12 15:25:21,138] Trial 36 finished with value: 825.8409106294924 and parameters: {'model_name': 'SimpleImputer', 'strategy': 'constant'}. Best is trial 3 with value: 738.4426738830927.
[I 2023-12-12 15:25:21,474] Trial 15 finished with value: 802.2568270066806 and parameters: {'model_name': 'SimpleImputer', 'strategy': 'median'}. Best is trial 3 with value: 738.4426738830927.
[I 2023-12-12 15:25:21,762] Trial 41 finished with value: 825.8409106294924 and parameters: {'model_name': 'SimpleImputer', 'strategy': 'constant'}. Best is trial 3 with value: 738.4426738830927.
[I 2023-12-12 15:25:22,310] Trial 37 finished with value: 738.4426738830927 and parameters: {'model_name': 'SimpleImputer', 'strategy': 'mean'}. Best is trial 3 with value: 738.4426738830927.
[I 2023-12-12 15:25:22,553] Trial 19 finished with value: 802.2568270066806 and parameters: {'model_name': 'SimpleImputer', 'strategy': 'median'}. Best is trial 3 with value: 738.4426738830927.
[I 2023-12-12 15:25:22,761] Trial 20 finished with value: 802.2568270066806 and parameters: {'model_name': 'SimpleImputer', 'strategy': 'median'}. Best is trial 3 with value: 738.4426738830927.
[I 2023-12-12 15:25:23,081] Trial 12 finished with value: 802.2568270066806 and parameters: {'model_name': 'SimpleImputer', 'strategy': 'median'}. Best is trial 3 with value: 738.4426738830927.
[I 2023-12-12 15:25:23,418] Trial 23 finished with value: 802.2568270066806 and parameters: {'model_name': 'SimpleImputer', 'strategy': 'median'}. Best is trial 3 with value: 738.4426738830927.
[I 2023-12-12 15:25:23,790] Trial 40 finished with value: 738.4426738830927 and parameters: {'model_name': 'SimpleImputer', 'strategy': 'mean'}. Best is trial 3 with value: 738.4426738830927.
[I 2023-12-12 15:25:23,982] Trial 38 finished with value: 738.4426738830927 and parameters: {'model_name': 'SimpleImputer', 'strategy': 'mean'}. Best is trial 3 with value: 738.4426738830927.
[I 2023-12-12 15:25:24,351] Trial 26 finished with value: 802.2568270066806 and parameters: {'model_name': 'SimpleImputer', 'strategy': 'median'}. Best is trial 3 with value: 738.4426738830927.
[I 2023-12-12 15:25:24,660] Trial 24 finished with value: 802.2568270066806 and parameters: {'model_name': 'SimpleImputer', 'strategy': 'median'}. Best is trial 3 with value: 738.4426738830927.
[I 2023-12-12 15:25:24,866] Trial 42 finished with value: 802.2568270066806 and parameters: {'model_name': 'SimpleImputer', 'strategy': 'median'}. Best is trial 3 with value: 738.4426738830927.
[I 2023-12-12 15:25:25,400] Trial 62 finished with value: 802.2568270066806 and parameters: {'model_name': 'SimpleImputer', 'strategy': 'median'}. Best is trial 3 with value: 738.4426738830927.
[I 2023-12-12 15:25:25,683] Trial 50 finished with value: 802.2568270066806 and parameters: {'model_name': 'SimpleImputer', 'strategy': 'median'}. Best is trial 3 with value: 738.4426738830927.
[I 2023-12-12 15:25:25,942] Trial 51 finished with value: 802.2568270066806 and parameters: {'model_name': 'SimpleImputer', 'strategy': 'median'}. Best is trial 3 with value: 738.4426738830927.
[I 2023-12-12 15:25:26,227] Trial 39 finished with value: 802.2568270066806 and parameters: {'model_name': 'SimpleImputer', 'strategy': 'median'}. Best is trial 3 with value: 738.4426738830927.
[I 2023-12-12 15:25:26,559] Trial 65 finished with value: 802.2568270066806 and parameters: {'model_name': 'SimpleImputer', 'strategy': 'median'}. Best is trial 3 with value: 738.4426738830927.
[I 2023-12-12 15:25:26,797] Trial 49 finished with value: 802.2568270066806 and parameters: {'model_name': 'SimpleImputer', 'strategy': 'median'}. Best is trial 3 with value: 738.4426738830927.
[I 2023-12-12 15:25:27,086] Trial 56 finished with value: 802.2568270066806 and parameters: {'model_name': 'SimpleImputer', 'strategy': 'median'}. Best is trial 3 with value: 738.4426738830927.
[I 2023-12-12 15:25:27,428] Trial 63 finished with value: 802.2568270066806 and parameters: {'model_name': 'SimpleImputer', 'strategy': 'median'}. Best is trial 3 with value: 738.4426738830927.
[I 2023-12-12 15:25:27,685] Trial 54 finished with value: 802.2568270066806 and parameters: {'model_name': 'SimpleImputer', 'strategy': 'median'}. Best is trial 3 with value: 738.4426738830927.
[I 2023-12-12 15:25:28,036] Trial 61 finished with value: 802.2568270066806 and parameters: {'model_name': 'SimpleImputer', 'strategy': 'median'}. Best is trial 3 with value: 738.4426738830927.
[I 2023-12-12 15:25:28,575] Trial 55 finished with value: 802.2568270066806 and parameters: {'model_name': 'SimpleImputer', 'strategy': 'median'}. Best is trial 3 with value: 738.4426738830927.
[I 2023-12-12 15:25:29,239] Trial 7 finished with value: 825.8409106294924 and parameters: {'model_name': 'SimpleImputer', 'strategy': 'most_frequent'}. Best is trial 3 with value: 738.4426738830927.
[I 2023-12-12 15:25:29,538] Trial 4 finished with value: 825.8409106294924 and parameters: {'model_name': 'SimpleImputer', 'strategy': 'most_frequent'}. Best is trial 3 with value: 738.4426738830927.
[I 2023-12-12 15:25:29,963] Trial 92 finished with value: 738.4426738830927 and parameters: {'model_name': 'SimpleImputer', 'strategy': 'mean'}. Best is trial 3 with value: 738.4426738830927.
[I 2023-12-12 15:25:30,252] Trial 14 finished with value: 825.8409106294924 and parameters: {'model_name': 'SimpleImputer', 'strategy': 'most_frequent'}. Best is trial 3 with value: 738.4426738830927.
[I 2023-12-12 15:25:30,563] Trial 45 finished with value: 825.8409106294924 and parameters: {'model_name': 'SimpleImputer', 'strategy': 'most_frequent'}. Best is trial 3 with value: 738.4426738830927.
[I 2023-12-12 15:25:30,976] Trial 16 finished with value: 825.8409106294924 and parameters: {'model_name': 'SimpleImputer', 'strategy': 'most_frequent'}. Best is trial 3 with value: 738.4426738830927.
[I 2023-12-12 15:25:31,481] Trial 44 finished with value: 825.8409106294924 and parameters: {'model_name': 'SimpleImputer', 'strategy': 'most_frequent'}. Best is trial 3 with value: 738.4426738830927.
[I 2023-12-12 15:25:31,707] Trial 6 finished with value: 825.8409106294924 and parameters: {'model_name': 'SimpleImputer', 'strategy': 'most_frequent'}. Best is trial 3 with value: 738.4426738830927.
[I 2023-12-12 15:25:32,500] Trial 53 finished with value: 825.8409106294924 and parameters: {'model_name': 'SimpleImputer', 'strategy': 'most_frequent'}. Best is trial 3 with value: 738.4426738830927.
[I 2023-12-12 15:25:32,828] Trial 43 finished with value: 825.8409106294924 and parameters: {'model_name': 'SimpleImputer', 'strategy': 'most_frequent'}. Best is trial 3 with value: 738.4426738830927.
[I 2023-12-12 15:25:33,129] Trial 48 finished with value: 825.8409106294924 and parameters: {'model_name': 'SimpleImputer', 'strategy': 'most_frequent'}. Best is trial 3 with value: 738.4426738830927.
[I 2023-12-12 15:25:33,415] Trial 99 finished with value: 738.4426738830927 and parameters: {'model_name': 'SimpleImputer', 'strategy': 'mean'}. Best is trial 3 with value: 738.4426738830927.
[I 2023-12-12 15:25:33,737] Trial 66 finished with value: 825.8409106294924 and parameters: {'model_name': 'SimpleImputer', 'strategy': 'most_frequent'}. Best is trial 3 with value: 738.4426738830927.
[I 2023-12-12 15:25:33,963] Trial 47 finished with value: 825.8409106294924 and parameters: {'model_name': 'SimpleImputer', 'strategy': 'most_frequent'}. Best is trial 3 with value: 738.4426738830927.
[I 2023-12-12 15:25:34,247] Trial 100 finished with value: 738.4426738830927 and parameters: {'model_name': 'SimpleImputer', 'strategy': 'mean'}. Best is trial 3 with value: 738.4426738830927.
[I 2023-12-12 15:25:34,751] Trial 102 finished with value: 738.4426738830927 and parameters: {'model_name': 'SimpleImputer', 'strategy': 'mean'}. Best is trial 3 with value: 738.4426738830927.
[I 2023-12-12 15:25:34,995] Trial 58 finished with value: 825.8409106294924 and parameters: {'model_name': 'SimpleImputer', 'strategy': 'most_frequent'}. Best is trial 3 with value: 738.4426738830927.
[I 2023-12-12 15:25:35,235] Trial 74 finished with value: 825.8409106294924 and parameters: {'model_name': 'SimpleImputer', 'strategy': 'most_frequent'}. Best is trial 3 with value: 738.4426738830927.
[I 2023-12-12 15:25:35,501] Trial 60 finished with value: 825.8409106294924 and parameters: {'model_name': 'SimpleImputer', 'strategy': 'most_frequent'}. Best is trial 3 with value: 738.4426738830927.
[I 2023-12-12 15:25:35,724] Trial 52 finished with value: 825.8409106294924 and parameters: {'model_name': 'SimpleImputer', 'strategy': 'most_frequent'}. Best is trial 3 with value: 738.4426738830927.
[I 2023-12-12 15:25:35,960] Trial 69 finished with value: 825.8409106294924 and parameters: {'model_name': 'SimpleImputer', 'strategy': 'most_frequent'}. Best is trial 3 with value: 738.4426738830927.
[I 2023-12-12 15:25:36,182] Trial 101 finished with value: 738.4426738830927 and parameters: {'model_name': 'SimpleImputer', 'strategy': 'mean'}. Best is trial 3 with value: 738.4426738830927.
[I 2023-12-12 15:25:36,409] Trial 57 finished with value: 825.8409106294924 and parameters: {'model_name': 'SimpleImputer', 'strategy': 'most_frequent'}. Best is trial 3 with value: 738.4426738830927.
[I 2023-12-12 15:25:36,586] Trial 46 finished with value: 825.8409106294924 and parameters: {'model_name': 'SimpleImputer', 'strategy': 'most_frequent'}. Best is trial 3 with value: 738.4426738830927.
slurmstepd: error: *** JOB 549695 ON esplhpc-cp005 CANCELLED AT 2023-12-12T15:25:36 ***
slurmstepd: error: *** STEP 549695.0 ON esplhpc-cp005 CANCELLED AT 2023-12-12T15:25:36 ***
