[I 2023-12-27 13:27:00,556] Trial 10 finished with value: 0.9402557235982929 and parameters: {'model_name': 'SimpleImputer', 'strategy': 'constant'}. Best is trial 10 with value: 0.9402557235982929.
[I 2023-12-27 13:27:01,425] Trial 11 finished with value: 0.9432562910901344 and parameters: {'model_name': 'SimpleImputer', 'strategy': 'mean'}. Best is trial 10 with value: 0.9402557235982929.
[I 2023-12-27 13:27:04,130] Trial 36 finished with value: 0.9402557235982929 and parameters: {'model_name': 'SimpleImputer', 'strategy': 'constant'}. Best is trial 10 with value: 0.9402557235982929.
[I 2023-12-27 13:27:06,633] Trial 37 finished with value: 1.0050916458457855 and parameters: {'model_name': 'SimpleImputer', 'strategy': 'median'}. Best is trial 10 with value: 0.9402557235982929.
2023-12-27 13:27:10.328578: E external/local_xla/xla/stream_executor/cuda/cuda_driver.cc:274] failed call to cuInit: CUDA_ERROR_NO_DEVICE: no CUDA-capable device is detected
2023-12-27 13:27:10.562480: I tensorflow/compiler/mlir/mlir_graph_optimization_pass.cc:388] MLIR V1 optimization pass is not enabled
[I 2023-12-27 13:27:10,783] Trial 6 finished with value: 0.7540843946554675 and parameters: {'model_name': 'KNNImputer', 'weights': 'uniform', 'keep_empty_features': False}. Best is trial 6 with value: 0.7540843946554675.
[I 2023-12-27 13:27:11,321] Trial 1 finished with value: 0.7613040782803697 and parameters: {'model_name': 'KNNImputer', 'weights': 'distance', 'keep_empty_features': False}. Best is trial 6 with value: 0.7540843946554675.
[I 2023-12-27 13:27:12,303] Trial 5 finished with value: 0.7613040782803697 and parameters: {'model_name': 'KNNImputer', 'weights': 'distance', 'keep_empty_features': False}. Best is trial 6 with value: 0.7540843946554675.
[I 2023-12-27 13:27:12,857] Trial 8 finished with value: 0.7613040782803697 and parameters: {'model_name': 'KNNImputer', 'weights': 'distance', 'keep_empty_features': False}. Best is trial 6 with value: 0.7540843946554675.
[I 2023-12-27 13:27:13,470] Trial 2 finished with value: 0.7613040782803697 and parameters: {'model_name': 'KNNImputer', 'weights': 'distance', 'keep_empty_features': False}. Best is trial 6 with value: 0.7540843946554675.
[I 2023-12-27 13:27:14,352] Trial 24 finished with value: 0.7613040782803697 and parameters: {'model_name': 'KNNImputer', 'weights': 'distance', 'keep_empty_features': False}. Best is trial 6 with value: 0.7540843946554675.
[I 2023-12-27 13:27:14,945] Trial 23 finished with value: 0.7540843946554675 and parameters: {'model_name': 'KNNImputer', 'weights': 'uniform', 'keep_empty_features': False}. Best is trial 6 with value: 0.7540843946554675.
[I 2023-12-27 13:27:15,479] Trial 21 finished with value: 0.7540843946554675 and parameters: {'model_name': 'KNNImputer', 'weights': 'uniform', 'keep_empty_features': False}. Best is trial 6 with value: 0.7540843946554675.
[I 2023-12-27 13:27:15,482] Trial 19 finished with value: 0.7540843946554675 and parameters: {'model_name': 'KNNImputer', 'weights': 'uniform', 'keep_empty_features': False}. Best is trial 6 with value: 0.7540843946554675.
[I 2023-12-27 13:27:16,912] Trial 17 finished with value: 0.7613040782803697 and parameters: {'model_name': 'KNNImputer', 'weights': 'distance', 'keep_empty_features': False}. Best is trial 6 with value: 0.7540843946554675.
[I 2023-12-27 13:27:17,710] Trial 26 finished with value: 0.7540843946554675 and parameters: {'model_name': 'KNNImputer', 'weights': 'uniform', 'keep_empty_features': False}. Best is trial 6 with value: 0.7540843946554675.
[I 2023-12-27 13:27:18,455] Trial 45 finished with value: 0.7613040782803697 and parameters: {'model_name': 'KNNImputer', 'weights': 'distance', 'keep_empty_features': False}. Best is trial 6 with value: 0.7540843946554675.
[I 2023-12-27 13:27:19,156] Trial 48 finished with value: 0.7540843946554675 and parameters: {'model_name': 'KNNImputer', 'weights': 'uniform', 'keep_empty_features': False}. Best is trial 6 with value: 0.7540843946554675.
[I 2023-12-27 13:27:20,031] Trial 43 finished with value: 0.7613040782803697 and parameters: {'model_name': 'KNNImputer', 'weights': 'distance', 'keep_empty_features': False}. Best is trial 6 with value: 0.7540843946554675.
[I 2023-12-27 13:27:22,020] Trial 55 finished with value: 1.0105966031654008 and parameters: {'model_name': 'SimpleImputer', 'strategy': 'most_frequent'}. Best is trial 6 with value: 0.7540843946554675.
[I 2023-12-27 13:27:22,619] Trial 52 finished with value: 1.0105966031654008 and parameters: {'model_name': 'SimpleImputer', 'strategy': 'most_frequent'}. Best is trial 6 with value: 0.7540843946554675.
[I 2023-12-27 13:27:25,071] Trial 53 finished with value: 0.7540843946554675 and parameters: {'model_name': 'KNNImputer', 'weights': 'uniform', 'keep_empty_features': False}. Best is trial 6 with value: 0.7540843946554675.
[I 2023-12-27 13:27:28,739] Trial 47 finished with value: 0.9432562910901344 and parameters: {'model_name': 'RandomForestImputer', 'max_iter': 1, 'decreasing': True, 'min_samples_split': 0.8, 'min_samples_leaf': 0.1, 'max_features': 0.9, 'warm_start': True}. Best is trial 6 with value: 0.7540843946554675.
[I 2023-12-27 13:27:42,086] Trial 13 finished with value: 0.9432562910901344 and parameters: {'model_name': 'RandomForestImputer', 'max_iter': 1, 'decreasing': False, 'min_samples_split': 0.4, 'min_samples_leaf': 0.2, 'max_features': 0.5, 'warm_start': False}. Best is trial 6 with value: 0.7540843946554675.
[I 2023-12-27 13:27:47,496] Trial 44 finished with value: 0.8427857791007043 and parameters: {'model_name': 'IterativeImputer', 'sample_posterior': False, 'initial_strategy': 'constant', 'imputation_order': 'descending'}. Best is trial 6 with value: 0.7540843946554675.
[I 2023-12-27 13:27:48,190] Trial 34 finished with value: 0.8427857879554542 and parameters: {'model_name': 'IterativeImputer', 'sample_posterior': False, 'initial_strategy': 'mean', 'imputation_order': 'descending'}. Best is trial 6 with value: 0.7540843946554675.
[I 2023-12-27 13:27:49,100] Trial 0 finished with value: 0.8427855167113698 and parameters: {'model_name': 'IterativeImputer', 'sample_posterior': False, 'initial_strategy': 'median', 'imputation_order': 'ascending'}. Best is trial 6 with value: 0.7540843946554675.
[I 2023-12-27 13:27:50,535] Trial 39 finished with value: 0.8427859654052561 and parameters: {'model_name': 'IterativeImputer', 'sample_posterior': False, 'initial_strategy': 'mean', 'imputation_order': 'ascending'}. Best is trial 6 with value: 0.7540843946554675.
[I 2023-12-27 13:27:51,458] Trial 25 finished with value: 0.842785479189631 and parameters: {'model_name': 'IterativeImputer', 'sample_posterior': False, 'initial_strategy': 'most_frequent', 'imputation_order': 'descending'}. Best is trial 6 with value: 0.7540843946554675.
[I 2023-12-27 13:27:52,080] Trial 66 finished with value: 0.9432562910901344 and parameters: {'model_name': 'RandomForestImputer', 'max_iter': 1, 'decreasing': True, 'min_samples_split': 1.0, 'min_samples_leaf': 0.2, 'max_features': 0.30000000000000004, 'warm_start': False}. Best is trial 6 with value: 0.7540843946554675.
[I 2023-12-27 13:27:55,487] Trial 4 finished with value: 0.9420549679314517 and parameters: {'model_name': 'RandomForestImputer', 'max_iter': 8, 'decreasing': False, 'min_samples_split': 0.9, 'min_samples_leaf': 0.7000000000000001, 'max_features': 0.30000000000000004, 'warm_start': True}. Best is trial 6 with value: 0.7540843946554675.
[I 2023-12-27 13:27:56,146] Trial 64 finished with value: 0.8427858306799421 and parameters: {'model_name': 'IterativeImputer', 'sample_posterior': False, 'initial_strategy': 'constant', 'imputation_order': 'arabic'}. Best is trial 6 with value: 0.7540843946554675.
[I 2023-12-27 13:27:56,789] Trial 31 finished with value: 0.8750298952258376 and parameters: {'model_name': 'RandomForestImputer', 'max_iter': 6, 'decreasing': True, 'min_samples_split': 0.5, 'min_samples_leaf': 0.1, 'max_features': 0.6, 'warm_start': True}. Best is trial 6 with value: 0.7540843946554675.
[I 2023-12-27 13:28:02,426] Trial 46 finished with value: 0.9187883956377559 and parameters: {'model_name': 'RandomForestImputer', 'max_iter': 7, 'decreasing': True, 'min_samples_split': 0.0, 'min_samples_leaf': 0.30000000000000004, 'max_features': 0.9, 'warm_start': True}. Best is trial 6 with value: 0.7540843946554675.
[I 2023-12-27 13:28:05,649] Trial 61 finished with value: 0.842782345484139 and parameters: {'model_name': 'IterativeImputer', 'sample_posterior': False, 'initial_strategy': 'most_frequent', 'imputation_order': 'random'}. Best is trial 6 with value: 0.7540843946554675.
[I 2023-12-27 13:28:15,512] Trial 32 finished with value: 3.0823480149261355 and parameters: {'model_name': 'GAIN', 'batch_size': 23, 'hint_rate': 0.53, 'alpha': 99, 'iterations': 1}. Best is trial 6 with value: 0.7540843946554675.
[I 2023-12-27 13:28:20,756] Trial 67 finished with value: 2.733571901857743 and parameters: {'model_name': 'GAIN', 'batch_size': 8, 'hint_rate': 0.6, 'alpha': 73, 'iterations': 1}. Best is trial 6 with value: 0.7540843946554675.
[I 2023-12-27 13:28:23,218] Trial 65 finished with value: 0.9442024505413693 and parameters: {'model_name': 'RandomForestImputer', 'max_iter': 17, 'decreasing': True, 'min_samples_split': 0.9, 'min_samples_leaf': 0.4, 'max_features': 0.2, 'warm_start': True}. Best is trial 6 with value: 0.7540843946554675.
[I 2023-12-27 13:28:25,840] Trial 83 finished with value: 0.7540843946554675 and parameters: {'model_name': 'KNNImputer', 'weights': 'uniform', 'keep_empty_features': False}. Best is trial 6 with value: 0.7540843946554675.
[I 2023-12-27 13:28:28,145] Trial 84 finished with value: 0.7540843946554675 and parameters: {'model_name': 'KNNImputer', 'weights': 'uniform', 'keep_empty_features': False}. Best is trial 6 with value: 0.7540843946554675.
[I 2023-12-27 13:28:31,020] Trial 85 finished with value: 0.7540843946554675 and parameters: {'model_name': 'KNNImputer', 'weights': 'uniform', 'keep_empty_features': False}. Best is trial 6 with value: 0.7540843946554675.
[I 2023-12-27 13:28:32,310] Trial 22 finished with value: 0.9416905506539888 and parameters: {'model_name': 'RandomForestImputer', 'max_iter': 24, 'decreasing': False, 'min_samples_split': 0.1, 'min_samples_leaf': 0.4, 'max_features': 0.30000000000000004, 'warm_start': True}. Best is trial 6 with value: 0.7540843946554675.
[I 2023-12-27 13:28:34,119] Trial 63 finished with value: 0.9455508009143061 and parameters: {'model_name': 'RandomForestImputer', 'max_iter': 23, 'decreasing': True, 'min_samples_split': 0.7000000000000001, 'min_samples_leaf': 0.7000000000000001, 'max_features': 0.5, 'warm_start': True}. Best is trial 6 with value: 0.7540843946554675.
[I 2023-12-27 13:28:35,272] Trial 86 finished with value: 0.7540843946554675 and parameters: {'model_name': 'KNNImputer', 'weights': 'uniform', 'keep_empty_features': False}. Best is trial 6 with value: 0.7540843946554675.
[I 2023-12-27 13:28:37,934] Trial 28 finished with value: 2.514996652492152 and parameters: {'model_name': 'GAIN', 'batch_size': 2, 'hint_rate': 0.27, 'alpha': 16, 'iterations': 6}. Best is trial 6 with value: 0.7540843946554675.
[I 2023-12-27 13:28:39,099] Trial 87 finished with value: 0.7540843946554675 and parameters: {'model_name': 'KNNImputer', 'weights': 'uniform', 'keep_empty_features': False}. Best is trial 6 with value: 0.7540843946554675.
[I 2023-12-27 13:28:40,486] Trial 88 finished with value: 0.7540843946554675 and parameters: {'model_name': 'KNNImputer', 'weights': 'uniform', 'keep_empty_features': False}. Best is trial 6 with value: 0.7540843946554675.
[I 2023-12-27 13:28:42,199] Trial 89 finished with value: 0.7540843946554675 and parameters: {'model_name': 'KNNImputer', 'weights': 'uniform', 'keep_empty_features': False}. Best is trial 6 with value: 0.7540843946554675.
[I 2023-12-27 13:28:43,640] Trial 90 finished with value: 0.7540843946554675 and parameters: {'model_name': 'KNNImputer', 'weights': 'uniform', 'keep_empty_features': False}. Best is trial 6 with value: 0.7540843946554675.
[I 2023-12-27 13:28:45,760] Trial 59 finished with value: 2.278095284205363 and parameters: {'model_name': 'GAIN', 'batch_size': 356, 'hint_rate': 0.78, 'alpha': 29, 'iterations': 7}. Best is trial 6 with value: 0.7540843946554675.
[I 2023-12-27 13:28:47,046] Trial 91 finished with value: 0.7540843946554675 and parameters: {'model_name': 'KNNImputer', 'weights': 'uniform', 'keep_empty_features': False}. Best is trial 6 with value: 0.7540843946554675.
[I 2023-12-27 13:28:48,188] Trial 92 finished with value: 0.7540843946554675 and parameters: {'model_name': 'KNNImputer', 'weights': 'uniform', 'keep_empty_features': False}. Best is trial 6 with value: 0.7540843946554675.
[I 2023-12-27 13:28:49,401] Trial 93 finished with value: 0.7540843946554675 and parameters: {'model_name': 'KNNImputer', 'weights': 'uniform', 'keep_empty_features': False}. Best is trial 6 with value: 0.7540843946554675.
[I 2023-12-27 13:28:50,671] Trial 40 finished with value: 0.8902882040408476 and parameters: {'model_name': 'RandomForestImputer', 'max_iter': 23, 'decreasing': True, 'min_samples_split': 0.1, 'min_samples_leaf': 0.2, 'max_features': 0.9, 'warm_start': True}. Best is trial 6 with value: 0.7540843946554675.
[I 2023-12-27 13:28:52,011] Trial 94 finished with value: 0.7540843946554675 and parameters: {'model_name': 'KNNImputer', 'weights': 'uniform', 'keep_empty_features': False}. Best is trial 6 with value: 0.7540843946554675.
[I 2023-12-27 13:28:54,548] Trial 95 finished with value: 0.7540843946554675 and parameters: {'model_name': 'KNNImputer', 'weights': 'uniform', 'keep_empty_features': False}. Best is trial 6 with value: 0.7540843946554675.
[I 2023-12-27 13:28:56,224] Trial 96 finished with value: 0.7540843946554675 and parameters: {'model_name': 'KNNImputer', 'weights': 'uniform', 'keep_empty_features': False}. Best is trial 6 with value: 0.7540843946554675.
[I 2023-12-27 13:28:57,749] Trial 97 finished with value: 0.7540843946554675 and parameters: {'model_name': 'KNNImputer', 'weights': 'uniform', 'keep_empty_features': False}. Best is trial 6 with value: 0.7540843946554675.
[I 2023-12-27 13:28:58,871] Trial 98 finished with value: 0.7540843946554675 and parameters: {'model_name': 'KNNImputer', 'weights': 'uniform', 'keep_empty_features': False}. Best is trial 6 with value: 0.7540843946554675.
[I 2023-12-27 13:29:00,690] Trial 99 finished with value: 0.7540843946554675 and parameters: {'model_name': 'KNNImputer', 'weights': 'uniform', 'keep_empty_features': False}. Best is trial 6 with value: 0.7540843946554675.
[I 2023-12-27 13:29:01,975] Trial 100 finished with value: 0.7540843946554675 and parameters: {'model_name': 'KNNImputer', 'weights': 'uniform', 'keep_empty_features': False}. Best is trial 6 with value: 0.7540843946554675.
[I 2023-12-27 13:29:03,413] Trial 101 finished with value: 0.7540843946554675 and parameters: {'model_name': 'KNNImputer', 'weights': 'uniform', 'keep_empty_features': False}. Best is trial 6 with value: 0.7540843946554675.
[I 2023-12-27 13:29:05,539] Trial 102 finished with value: 0.7540843946554675 and parameters: {'model_name': 'KNNImputer', 'weights': 'uniform', 'keep_empty_features': False}. Best is trial 6 with value: 0.7540843946554675.
[I 2023-12-27 13:29:07,268] Trial 103 finished with value: 0.7540843946554675 and parameters: {'model_name': 'KNNImputer', 'weights': 'uniform', 'keep_empty_features': False}. Best is trial 6 with value: 0.7540843946554675.
[I 2023-12-27 13:29:08,244] Trial 104 finished with value: 0.7540843946554675 and parameters: {'model_name': 'KNNImputer', 'weights': 'uniform', 'keep_empty_features': False}. Best is trial 6 with value: 0.7540843946554675.
[I 2023-12-27 13:29:09,689] Trial 42 finished with value: 2.5429258624328392 and parameters: {'model_name': 'GAIN', 'batch_size': 1, 'hint_rate': 0.53, 'alpha': 66, 'iterations': 10}. Best is trial 6 with value: 0.7540843946554675.
[I 2023-12-27 13:29:10,658] Trial 105 finished with value: 0.7540843946554675 and parameters: {'model_name': 'KNNImputer', 'weights': 'uniform', 'keep_empty_features': False}. Best is trial 6 with value: 0.7540843946554675.
[I 2023-12-27 13:29:11,715] Trial 106 finished with value: 0.7540843946554675 and parameters: {'model_name': 'KNNImputer', 'weights': 'uniform', 'keep_empty_features': False}. Best is trial 6 with value: 0.7540843946554675.
[I 2023-12-27 13:29:13,038] Trial 107 finished with value: 0.7540843946554675 and parameters: {'model_name': 'KNNImputer', 'weights': 'uniform', 'keep_empty_features': False}. Best is trial 6 with value: 0.7540843946554675.
[I 2023-12-27 13:29:14,494] Trial 108 finished with value: 0.7540843946554675 and parameters: {'model_name': 'KNNImputer', 'weights': 'uniform', 'keep_empty_features': False}. Best is trial 6 with value: 0.7540843946554675.
[I 2023-12-27 13:29:15,904] Trial 115 finished with value: 1.0050916458457855 and parameters: {'model_name': 'SimpleImputer', 'strategy': 'median'}. Best is trial 6 with value: 0.7540843946554675.
[I 2023-12-27 13:29:17,278] Trial 116 finished with value: 1.0050916458457855 and parameters: {'model_name': 'SimpleImputer', 'strategy': 'median'}. Best is trial 6 with value: 0.7540843946554675.
[I 2023-12-27 13:29:18,735] Trial 109 finished with value: 0.7540843946554675 and parameters: {'model_name': 'KNNImputer', 'weights': 'uniform', 'keep_empty_features': False}. Best is trial 6 with value: 0.7540843946554675.
[I 2023-12-27 13:29:19,652] Trial 74 finished with value: 2.656175679627883 and parameters: {'model_name': 'GAIN', 'batch_size': 274, 'hint_rate': 0.22, 'alpha': 30, 'iterations': 2}. Best is trial 6 with value: 0.7540843946554675.
[I 2023-12-27 13:29:20,560] Trial 111 finished with value: 0.7540843946554675 and parameters: {'model_name': 'KNNImputer', 'weights': 'uniform', 'keep_empty_features': False}. Best is trial 6 with value: 0.7540843946554675.
[I 2023-12-27 13:29:21,790] Trial 110 finished with value: 0.7540843946554675 and parameters: {'model_name': 'KNNImputer', 'weights': 'uniform', 'keep_empty_features': False}. Best is trial 6 with value: 0.7540843946554675.
[I 2023-12-27 13:29:23,027] Trial 112 finished with value: 0.7540843946554675 and parameters: {'model_name': 'KNNImputer', 'weights': 'uniform', 'keep_empty_features': False}. Best is trial 6 with value: 0.7540843946554675.
[I 2023-12-27 13:29:23,984] Trial 113 finished with value: 0.7540843946554675 and parameters: {'model_name': 'KNNImputer', 'weights': 'uniform', 'keep_empty_features': False}. Best is trial 6 with value: 0.7540843946554675.
[I 2023-12-27 13:29:25,152] Trial 114 finished with value: 0.7540843946554675 and parameters: {'model_name': 'KNNImputer', 'weights': 'uniform', 'keep_empty_features': False}. Best is trial 6 with value: 0.7540843946554675.
[I 2023-12-27 13:29:27,782] Trial 118 finished with value: 0.7540843946554675 and parameters: {'model_name': 'KNNImputer', 'weights': 'uniform', 'keep_empty_features': False}. Best is trial 6 with value: 0.7540843946554675.
[I 2023-12-27 13:29:28,942] Trial 119 finished with value: 0.7540843946554675 and parameters: {'model_name': 'KNNImputer', 'weights': 'uniform', 'keep_empty_features': False}. Best is trial 6 with value: 0.7540843946554675.
[I 2023-12-27 13:29:30,052] Trial 120 finished with value: 0.7540843946554675 and parameters: {'model_name': 'KNNImputer', 'weights': 'uniform', 'keep_empty_features': False}. Best is trial 6 with value: 0.7540843946554675.
[I 2023-12-27 13:29:31,309] Trial 121 finished with value: 0.7540843946554675 and parameters: {'model_name': 'KNNImputer', 'weights': 'uniform', 'keep_empty_features': False}. Best is trial 6 with value: 0.7540843946554675.
[I 2023-12-27 13:29:32,653] Trial 122 finished with value: 0.7613040782803697 and parameters: {'model_name': 'KNNImputer', 'weights': 'distance', 'keep_empty_features': False}. Best is trial 6 with value: 0.7540843946554675.
[I 2023-12-27 13:29:33,927] Trial 123 finished with value: 0.7613040782803697 and parameters: {'model_name': 'KNNImputer', 'weights': 'distance', 'keep_empty_features': False}. Best is trial 6 with value: 0.7540843946554675.
[I 2023-12-27 13:29:39,372] Trial 16 finished with value: 2.66682038641913 and parameters: {'model_name': 'GAIN', 'batch_size': 1, 'hint_rate': 0.33, 'alpha': 36, 'iterations': 18}. Best is trial 6 with value: 0.7540843946554675.
[I 2023-12-27 13:29:40,521] Trial 3 finished with value: 2.3596199272565586 and parameters: {'model_name': 'GAIN', 'batch_size': 15, 'hint_rate': 0.21000000000000002, 'alpha': 57, 'iterations': 17}. Best is trial 6 with value: 0.7540843946554675.
[I 2023-12-27 13:29:42,589] Trial 51 finished with value: 0.94361490718187 and parameters: {'model_name': 'RandomForestImputer', 'max_iter': 4, 'decreasing': True, 'min_samples_split': 0.30000000000000004, 'min_samples_leaf': 0.7000000000000001, 'max_features': 0.9, 'warm_start': False}. Best is trial 6 with value: 0.7540843946554675.
[I 2023-12-27 13:29:52,592] Trial 78 finished with value: 2.9635369628587354 and parameters: {'model_name': 'GAIN', 'batch_size': 2, 'hint_rate': 0.5700000000000001, 'alpha': 19, 'iterations': 10}. Best is trial 6 with value: 0.7540843946554675.
[I 2023-12-27 13:30:00,099] Trial 12 finished with value: 0.9449608911459336 and parameters: {'model_name': 'RandomForestImputer', 'max_iter': 7, 'decreasing': False, 'min_samples_split': 1.0, 'min_samples_leaf': 0.8, 'max_features': 0.5, 'warm_start': False}. Best is trial 6 with value: 0.7540843946554675.
[I 2023-12-27 13:30:04,416] Trial 58 finished with value: 0.9449043929886656 and parameters: {'model_name': 'RandomForestImputer', 'max_iter': 5, 'decreasing': True, 'min_samples_split': 0.9, 'min_samples_leaf': 0.7000000000000001, 'max_features': 0.30000000000000004, 'warm_start': False}. Best is trial 6 with value: 0.7540843946554675.
