[I 2024-04-25 16:22:19,749] Trial 0 finished with value: 0.09970898949936441 and parameters: {'model_name': 'SimpleImputer', 'strategy': 'constant'}. Best is trial 0 with value: 0.09970898949936441.
[I 2024-04-25 16:22:20,903] Trial 13 finished with value: 0.09970898949936441 and parameters: {'model_name': 'SimpleImputer', 'strategy': 'constant'}. Best is trial 0 with value: 0.09970898949936441.
[I 2024-04-25 16:22:37,130] Trial 30 finished with value: 0.09970898949936441 and parameters: {'model_name': 'SimpleImputer', 'strategy': 'constant'}. Best is trial 0 with value: 0.09970898949936441.
[I 2024-04-25 16:22:54,477] Trial 4 finished with value: 0.08424537407328078 and parameters: {'model_name': 'SimpleImputer', 'strategy': 'mean'}. Best is trial 4 with value: 0.08424537407328078.
[I 2024-04-25 16:22:57,099] Trial 27 finished with value: 0.08424537407328078 and parameters: {'model_name': 'SimpleImputer', 'strategy': 'mean'}. Best is trial 4 with value: 0.08424537407328078.
[I 2024-04-25 16:24:40,362] Trial 9 finished with value: 0.08953794428570531 and parameters: {'model_name': 'SimpleImputer', 'strategy': 'median'}. Best is trial 4 with value: 0.08424537407328078.
[I 2024-04-25 16:24:56,439] Trial 15 finished with value: 0.08953794428570531 and parameters: {'model_name': 'SimpleImputer', 'strategy': 'median'}. Best is trial 4 with value: 0.08424537407328078.
[I 2024-04-25 16:25:12,961] Trial 33 finished with value: 0.08953794428570531 and parameters: {'model_name': 'SimpleImputer', 'strategy': 'median'}. Best is trial 4 with value: 0.08424537407328078.
[I 2024-04-25 16:25:17,121] Trial 38 finished with value: 0.08953794428570531 and parameters: {'model_name': 'SimpleImputer', 'strategy': 'median'}. Best is trial 4 with value: 0.08424537407328078.
[I 2024-04-25 16:25:18,690] Trial 42 finished with value: 0.08953794428570531 and parameters: {'model_name': 'SimpleImputer', 'strategy': 'median'}. Best is trial 4 with value: 0.08424537407328078.
2024-04-25 16:26:15.303693: E external/local_xla/xla/stream_executor/cuda/cuda_driver.cc:274] failed call to cuInit: CUDA_ERROR_NO_DEVICE: no CUDA-capable device is detected
2024-04-25 16:26:17.402267: I tensorflow/compiler/mlir/mlir_graph_optimization_pass.cc:388] MLIR V1 optimization pass is not enabled
[I 2024-04-25 16:26:26,683] Trial 55 finished with value: 0.09970898949936441 and parameters: {'model_name': 'SimpleImputer', 'strategy': 'constant'}. Best is trial 4 with value: 0.08424537407328078.
[I 2024-04-25 16:31:44,099] Trial 20 finished with value: inf and parameters: {'model_name': 'GAIN', 'batch_size': 49, 'hint_rate': 0.48000000000000004, 'alpha': 49, 'iterations': 78}. Best is trial 4 with value: 0.08424537407328078.
[I 2024-04-25 16:35:19,441] Trial 35 finished with value: inf and parameters: {'model_name': 'GAIN', 'batch_size': 209, 'hint_rate': 0.03, 'alpha': 79, 'iterations': 104}. Best is trial 4 with value: 0.08424537407328078.
[I 2024-04-25 16:58:36,306] Trial 10 finished with value: inf and parameters: {'model_name': 'GAIN', 'batch_size': 273, 'hint_rate': 0.46, 'alpha': 9, 'iterations': 499}. Best is trial 4 with value: 0.08424537407328078.
[I 2024-04-25 18:14:18,272] Trial 21 finished with value: inf and parameters: {'model_name': 'GAIN', 'batch_size': 1, 'hint_rate': 0.92, 'alpha': 38, 'iterations': 2888}. Best is trial 4 with value: 0.08424537407328078.
[I 2024-04-25 18:23:47,919] Trial 12 finished with value: 0.4934323634850136 and parameters: {'model_name': 'GAIN', 'batch_size': 1, 'hint_rate': 0.13, 'alpha': 71, 'iterations': 1}. Best is trial 4 with value: 0.08424537407328078.
[I 2024-04-25 18:24:22,708] Trial 36 finished with value: 0.08953794428570531 and parameters: {'model_name': 'SimpleImputer', 'strategy': 'most_frequent'}. Best is trial 4 with value: 0.08424537407328078.
[I 2024-04-25 18:27:04,626] Trial 29 finished with value: 0.08953794428570531 and parameters: {'model_name': 'SimpleImputer', 'strategy': 'most_frequent'}. Best is trial 4 with value: 0.08424537407328078.
[I 2024-04-25 18:29:30,907] Trial 52 finished with value: 0.08953794428570531 and parameters: {'model_name': 'SimpleImputer', 'strategy': 'most_frequent'}. Best is trial 4 with value: 0.08424537407328078.
[I 2024-04-25 18:35:28,117] Trial 48 finished with value: 0.28867098315162487 and parameters: {'model_name': 'GAIN', 'batch_size': 358, 'hint_rate': 0.98, 'alpha': 45, 'iterations': 2}. Best is trial 4 with value: 0.08424537407328078.
[I 2024-04-25 18:41:54,452] Trial 11 finished with value: 0.19928532632322649 and parameters: {'model_name': 'GAIN', 'batch_size': 28, 'hint_rate': 0.91, 'alpha': 97, 'iterations': 3}. Best is trial 4 with value: 0.08424537407328078.
[I 2024-04-25 18:48:35,510] Trial 18 finished with value: 0.10703708730808707 and parameters: {'model_name': 'GAIN', 'batch_size': 23, 'hint_rate': 0.18000000000000002, 'alpha': 90, 'iterations': 5}. Best is trial 4 with value: 0.08424537407328078.
[I 2024-04-25 20:24:38,797] Trial 17 finished with value: 0.08424537407328078 and parameters: {'model_name': 'RandomForestImputer', 'max_iter': 1, 'decreasing': False, 'min_samples_split': 1.0, 'min_samples_leaf': 0.4, 'max_features': 0.30000000000000004, 'warm_start': True}. Best is trial 4 with value: 0.08424537407328078.
[I 2024-04-25 20:25:10,511] Trial 7 finished with value: 0.08424537407328078 and parameters: {'model_name': 'RandomForestImputer', 'max_iter': 1, 'decreasing': True, 'min_samples_split': 0.5, 'min_samples_leaf': 0.9, 'max_features': 0.5, 'warm_start': True}. Best is trial 4 with value: 0.08424537407328078.
[I 2024-04-25 21:01:14,717] Trial 16 finished with value: 0.0451684946666375 and parameters: {'model_name': 'KNNImputer', 'weights': 'uniform', 'keep_empty_features': False}. Best is trial 16 with value: 0.0451684946666375.
[I 2024-04-25 21:04:36,425] Trial 26 finished with value: 0.0451684946666375 and parameters: {'model_name': 'KNNImputer', 'weights': 'uniform', 'keep_empty_features': False}. Best is trial 16 with value: 0.0451684946666375.
[I 2024-04-25 21:05:57,809] Trial 3 finished with value: 0.0451684946666375 and parameters: {'model_name': 'KNNImputer', 'weights': 'uniform', 'keep_empty_features': False}. Best is trial 16 with value: 0.0451684946666375.
[I 2024-04-25 21:13:13,504] Trial 24 finished with value: 0.0451684946666375 and parameters: {'model_name': 'KNNImputer', 'weights': 'uniform', 'keep_empty_features': False}. Best is trial 16 with value: 0.0451684946666375.
[I 2024-04-25 21:17:05,128] Trial 56 finished with value: 0.0451684946666375 and parameters: {'model_name': 'KNNImputer', 'weights': 'uniform', 'keep_empty_features': False}. Best is trial 16 with value: 0.0451684946666375.
[I 2024-04-25 21:19:32,701] Trial 44 finished with value: 0.0451684946666375 and parameters: {'model_name': 'KNNImputer', 'weights': 'uniform', 'keep_empty_features': False}. Best is trial 16 with value: 0.0451684946666375.
[I 2024-04-25 21:25:48,551] Trial 59 finished with value: 0.0451684946666375 and parameters: {'model_name': 'KNNImputer', 'weights': 'uniform', 'keep_empty_features': False}. Best is trial 16 with value: 0.0451684946666375.
[I 2024-04-25 21:33:30,112] Trial 40 finished with value: 0.04310533992773617 and parameters: {'model_name': 'KNNImputer', 'weights': 'distance', 'keep_empty_features': False}. Best is trial 40 with value: 0.04310533992773617.
[I 2024-04-25 21:33:33,984] Trial 50 finished with value: 0.04310533992773617 and parameters: {'model_name': 'KNNImputer', 'weights': 'distance', 'keep_empty_features': False}. Best is trial 40 with value: 0.04310533992773617.
[I 2024-04-25 21:34:03,056] Trial 39 finished with value: 0.04310533992773617 and parameters: {'model_name': 'KNNImputer', 'weights': 'distance', 'keep_empty_features': False}. Best is trial 40 with value: 0.04310533992773617.
[I 2024-04-25 21:41:19,168] Trial 57 finished with value: 0.04310533992773617 and parameters: {'model_name': 'KNNImputer', 'weights': 'distance', 'keep_empty_features': False}. Best is trial 40 with value: 0.04310533992773617.
[I 2024-04-25 21:42:51,809] Trial 51 finished with value: 0.04310533992773617 and parameters: {'model_name': 'KNNImputer', 'weights': 'distance', 'keep_empty_features': False}. Best is trial 40 with value: 0.04310533992773617.
[I 2024-04-25 21:51:17,818] Trial 58 finished with value: 0.04310533992773617 and parameters: {'model_name': 'KNNImputer', 'weights': 'distance', 'keep_empty_features': False}. Best is trial 40 with value: 0.04310533992773617.
[I 2024-04-25 22:10:38,211] Trial 41 finished with value: inf and parameters: {'model_name': 'GAIN', 'batch_size': 1, 'hint_rate': 0.13, 'alpha': 84, 'iterations': 10409}. Best is trial 40 with value: 0.04310533992773617.
[I 2024-04-25 23:55:23,227] Trial 66 finished with value: 0.0451684946666375 and parameters: {'model_name': 'KNNImputer', 'weights': 'uniform', 'keep_empty_features': False}. Best is trial 40 with value: 0.04310533992773617.
[I 2024-04-26 00:02:09,242] Trial 67 finished with value: 0.0451684946666375 and parameters: {'model_name': 'KNNImputer', 'weights': 'uniform', 'keep_empty_features': False}. Best is trial 40 with value: 0.04310533992773617.
[I 2024-04-26 00:50:20,763] Trial 69 finished with value: 0.04310533992773617 and parameters: {'model_name': 'KNNImputer', 'weights': 'distance', 'keep_empty_features': False}. Best is trial 40 with value: 0.04310533992773617.
[I 2024-04-26 01:34:19,836] Trial 71 finished with value: 0.08424537407328078 and parameters: {'model_name': 'RandomForestImputer', 'max_iter': 1, 'decreasing': True, 'min_samples_split': 0.6000000000000001, 'min_samples_leaf': 0.5, 'max_features': 0.4, 'warm_start': True}. Best is trial 40 with value: 0.04310533992773617.
[I 2024-04-26 01:44:22,791] Trial 70 finished with value: 0.08424537407328078 and parameters: {'model_name': 'RandomForestImputer', 'max_iter': 1, 'decreasing': False, 'min_samples_split': 1.0, 'min_samples_leaf': 0.4, 'max_features': 0.30000000000000004, 'warm_start': True}. Best is trial 40 with value: 0.04310533992773617.
[I 2024-04-26 03:01:43,226] Trial 72 finished with value: 0.0451684946666375 and parameters: {'model_name': 'KNNImputer', 'weights': 'uniform', 'keep_empty_features': False}. Best is trial 40 with value: 0.04310533992773617.
[I 2024-04-26 03:06:25,374] Trial 73 finished with value: 0.0451684946666375 and parameters: {'model_name': 'KNNImputer', 'weights': 'uniform', 'keep_empty_features': False}. Best is trial 40 with value: 0.04310533992773617.
[I 2024-04-26 03:07:43,082] Trial 74 finished with value: 0.0451684946666375 and parameters: {'model_name': 'KNNImputer', 'weights': 'uniform', 'keep_empty_features': False}. Best is trial 40 with value: 0.04310533992773617.
[I 2024-04-26 03:13:41,597] Trial 75 finished with value: 0.0451684946666375 and parameters: {'model_name': 'KNNImputer', 'weights': 'uniform', 'keep_empty_features': False}. Best is trial 40 with value: 0.04310533992773617.
[I 2024-04-26 03:30:10,222] Trial 76 finished with value: 0.0451684946666375 and parameters: {'model_name': 'KNNImputer', 'weights': 'uniform', 'keep_empty_features': False}. Best is trial 40 with value: 0.04310533992773617.
[I 2024-04-26 03:46:01,095] Trial 78 finished with value: 0.0451684946666375 and parameters: {'model_name': 'KNNImputer', 'weights': 'uniform', 'keep_empty_features': False}. Best is trial 40 with value: 0.04310533992773617.
srun: error: esplhpc-cp006: task 0: Killed
srun: Force Terminated StepId=839682.0
