[I 2024-02-29 11:47:05,316] Trial 82 finished with value: 23.645870844555127 and parameters: {'model_name': 'SimpleImputer', 'strategy': 'most_frequent'}. Best is trial 13 with value: 6.028764025243425.
[I 2024-02-29 11:47:05,702] Trial 87 finished with value: 23.645870844555127 and parameters: {'model_name': 'SimpleImputer', 'strategy': 'most_frequent'}. Best is trial 13 with value: 6.028764025243425.
[I 2024-02-29 11:47:05,959] Trial 76 finished with value: 23.645870844555127 and parameters: {'model_name': 'SimpleImputer', 'strategy': 'most_frequent'}. Best is trial 13 with value: 6.028764025243425.
[I 2024-02-29 11:47:06,706] Trial 96 finished with value: 23.645870844555127 and parameters: {'model_name': 'SimpleImputer', 'strategy': 'most_frequent'}. Best is trial 13 with value: 6.028764025243425.
[I 2024-02-29 11:47:07,595] Trial 92 finished with value: 23.645870844555127 and parameters: {'model_name': 'SimpleImputer', 'strategy': 'most_frequent'}. Best is trial 13 with value: 6.028764025243425.
[I 2024-02-29 11:47:07,840] Trial 116 finished with value: 6.028764025243425 and parameters: {'model_name': 'SimpleImputer', 'strategy': 'median'}. Best is trial 13 with value: 6.028764025243425.
[I 2024-02-29 11:47:08,121] Trial 90 finished with value: 23.645870844555127 and parameters: {'model_name': 'SimpleImputer', 'strategy': 'most_frequent'}. Best is trial 13 with value: 6.028764025243425.
[I 2024-02-29 11:47:08,529] Trial 89 finished with value: 23.645870844555127 and parameters: {'model_name': 'SimpleImputer', 'strategy': 'most_frequent'}. Best is trial 13 with value: 6.028764025243425.
[I 2024-02-29 11:47:08,981] Trial 93 finished with value: 23.645870844555127 and parameters: {'model_name': 'SimpleImputer', 'strategy': 'most_frequent'}. Best is trial 13 with value: 6.028764025243425.
[I 2024-02-29 11:47:09,229] Trial 91 finished with value: 23.645870844555127 and parameters: {'model_name': 'SimpleImputer', 'strategy': 'most_frequent'}. Best is trial 13 with value: 6.028764025243425.
[I 2024-02-29 11:47:09,711] Trial 94 finished with value: 23.645870844555127 and parameters: {'model_name': 'SimpleImputer', 'strategy': 'most_frequent'}. Best is trial 13 with value: 6.028764025243425.
[I 2024-02-29 11:47:09,905] Trial 100 finished with value: 23.645870844555127 and parameters: {'model_name': 'SimpleImputer', 'strategy': 'most_frequent'}. Best is trial 13 with value: 6.028764025243425.
[I 2024-02-29 11:47:10,271] Trial 97 finished with value: 23.645870844555127 and parameters: {'model_name': 'SimpleImputer', 'strategy': 'most_frequent'}. Best is trial 13 with value: 6.028764025243425.
[I 2024-02-29 11:47:10,560] Trial 99 finished with value: 23.645870844555127 and parameters: {'model_name': 'SimpleImputer', 'strategy': 'most_frequent'}. Best is trial 13 with value: 6.028764025243425.
[I 2024-02-29 11:47:10,900] Trial 118 finished with value: 6.028764025243425 and parameters: {'model_name': 'SimpleImputer', 'strategy': 'median'}. Best is trial 13 with value: 6.028764025243425.
[I 2024-02-29 11:47:11,182] Trial 95 finished with value: 23.645870844555127 and parameters: {'model_name': 'SimpleImputer', 'strategy': 'most_frequent'}. Best is trial 13 with value: 6.028764025243425.
[I 2024-02-29 11:47:11,423] Trial 98 finished with value: 23.645870844555127 and parameters: {'model_name': 'SimpleImputer', 'strategy': 'most_frequent'}. Best is trial 13 with value: 6.028764025243425.
[I 2024-02-29 11:47:11,878] Trial 121 finished with value: 6.028764025243425 and parameters: {'model_name': 'SimpleImputer', 'strategy': 'median'}. Best is trial 13 with value: 6.028764025243425.
[I 2024-02-29 11:47:12,228] Trial 120 finished with value: 6.028764025243425 and parameters: {'model_name': 'SimpleImputer', 'strategy': 'median'}. Best is trial 13 with value: 6.028764025243425.
[I 2024-02-29 11:47:12,469] Trial 119 finished with value: 6.028764025243425 and parameters: {'model_name': 'SimpleImputer', 'strategy': 'median'}. Best is trial 13 with value: 6.028764025243425.
[I 2024-02-29 11:47:12,677] Trial 117 finished with value: 6.028764025243425 and parameters: {'model_name': 'SimpleImputer', 'strategy': 'median'}. Best is trial 13 with value: 6.028764025243425.
[I 2024-02-29 11:47:12,961] Trial 122 finished with value: 6.028764025243425 and parameters: {'model_name': 'SimpleImputer', 'strategy': 'median'}. Best is trial 13 with value: 6.028764025243425.
[I 2024-02-29 11:47:13,206] Trial 123 finished with value: 6.028764025243425 and parameters: {'model_name': 'SimpleImputer', 'strategy': 'median'}. Best is trial 13 with value: 6.028764025243425.
[I 2024-02-29 11:47:13,497] Trial 129 finished with value: 6.028764025243425 and parameters: {'model_name': 'SimpleImputer', 'strategy': 'median'}. Best is trial 13 with value: 6.028764025243425.
[I 2024-02-29 11:47:13,749] Trial 125 finished with value: 6.028764025243425 and parameters: {'model_name': 'SimpleImputer', 'strategy': 'median'}. Best is trial 13 with value: 6.028764025243425.
[I 2024-02-29 11:47:14,025] Trial 128 finished with value: 6.028764025243425 and parameters: {'model_name': 'SimpleImputer', 'strategy': 'median'}. Best is trial 13 with value: 6.028764025243425.
[I 2024-02-29 11:47:14,360] Trial 127 finished with value: 6.028764025243425 and parameters: {'model_name': 'SimpleImputer', 'strategy': 'median'}. Best is trial 13 with value: 6.028764025243425.
[I 2024-02-29 11:47:14,702] Trial 130 finished with value: 6.028764025243425 and parameters: {'model_name': 'SimpleImputer', 'strategy': 'median'}. Best is trial 13 with value: 6.028764025243425.
[I 2024-02-29 11:47:14,928] Trial 124 finished with value: 6.028764025243425 and parameters: {'model_name': 'SimpleImputer', 'strategy': 'median'}. Best is trial 13 with value: 6.028764025243425.
[I 2024-02-29 11:47:15,206] Trial 126 finished with value: 6.028764025243425 and parameters: {'model_name': 'SimpleImputer', 'strategy': 'median'}. Best is trial 13 with value: 6.028764025243425.
[I 2024-02-29 11:47:15,579] Trial 134 finished with value: 6.028764025243425 and parameters: {'model_name': 'SimpleImputer', 'strategy': 'median'}. Best is trial 13 with value: 6.028764025243425.
[I 2024-02-29 11:47:15,839] Trial 101 finished with value: 23.645870844555127 and parameters: {'model_name': 'SimpleImputer', 'strategy': 'most_frequent'}. Best is trial 13 with value: 6.028764025243425.
[I 2024-02-29 11:47:16,140] Trial 132 finished with value: 6.028764025243425 and parameters: {'model_name': 'SimpleImputer', 'strategy': 'median'}. Best is trial 13 with value: 6.028764025243425.
[I 2024-02-29 11:47:16,440] Trial 135 finished with value: 6.028764025243425 and parameters: {'model_name': 'SimpleImputer', 'strategy': 'median'}. Best is trial 13 with value: 6.028764025243425.
[I 2024-02-29 11:47:16,719] Trial 133 finished with value: 6.028764025243425 and parameters: {'model_name': 'SimpleImputer', 'strategy': 'median'}. Best is trial 13 with value: 6.028764025243425.
[I 2024-02-29 11:47:17,044] Trial 131 finished with value: 6.028764025243425 and parameters: {'model_name': 'SimpleImputer', 'strategy': 'median'}. Best is trial 13 with value: 6.028764025243425.
[I 2024-02-29 11:47:17,322] Trial 140 finished with value: 6.028764025243425 and parameters: {'model_name': 'SimpleImputer', 'strategy': 'median'}. Best is trial 13 with value: 6.028764025243425.
[I 2024-02-29 11:47:17,605] Trial 136 finished with value: 6.028764025243425 and parameters: {'model_name': 'SimpleImputer', 'strategy': 'median'}. Best is trial 13 with value: 6.028764025243425.
[I 2024-02-29 11:47:17,940] Trial 141 finished with value: 6.028764025243425 and parameters: {'model_name': 'SimpleImputer', 'strategy': 'median'}. Best is trial 13 with value: 6.028764025243425.
[I 2024-02-29 11:47:18,211] Trial 139 finished with value: 6.028764025243425 and parameters: {'model_name': 'SimpleImputer', 'strategy': 'median'}. Best is trial 13 with value: 6.028764025243425.
[I 2024-02-29 11:47:18,439] Trial 137 finished with value: 6.028764025243425 and parameters: {'model_name': 'SimpleImputer', 'strategy': 'median'}. Best is trial 13 with value: 6.028764025243425.
[I 2024-02-29 11:47:18,706] Trial 143 finished with value: 6.028764025243425 and parameters: {'model_name': 'SimpleImputer', 'strategy': 'median'}. Best is trial 13 with value: 6.028764025243425.
[I 2024-02-29 11:47:19,051] Trial 138 finished with value: 6.028764025243425 and parameters: {'model_name': 'SimpleImputer', 'strategy': 'median'}. Best is trial 13 with value: 6.028764025243425.
[I 2024-02-29 11:47:19,506] Trial 142 finished with value: 6.028764025243425 and parameters: {'model_name': 'SimpleImputer', 'strategy': 'median'}. Best is trial 13 with value: 6.028764025243425.
[I 2024-02-29 11:47:19,931] Trial 144 finished with value: 6.028764025243425 and parameters: {'model_name': 'SimpleImputer', 'strategy': 'median'}. Best is trial 13 with value: 6.028764025243425.
[I 2024-02-29 11:47:20,459] Trial 146 finished with value: 6.028764025243425 and parameters: {'model_name': 'SimpleImputer', 'strategy': 'median'}. Best is trial 13 with value: 6.028764025243425.
[I 2024-02-29 11:47:21,187] Trial 148 finished with value: 6.028764025243425 and parameters: {'model_name': 'SimpleImputer', 'strategy': 'median'}. Best is trial 13 with value: 6.028764025243425.
[I 2024-02-29 11:47:21,442] Trial 147 finished with value: 6.028764025243425 and parameters: {'model_name': 'SimpleImputer', 'strategy': 'median'}. Best is trial 13 with value: 6.028764025243425.
[I 2024-02-29 11:47:21,762] Trial 145 finished with value: 6.028764025243425 and parameters: {'model_name': 'SimpleImputer', 'strategy': 'median'}. Best is trial 13 with value: 6.028764025243425.
[I 2024-02-29 11:47:22,370] Trial 151 finished with value: 6.028764025243425 and parameters: {'model_name': 'SimpleImputer', 'strategy': 'median'}. Best is trial 13 with value: 6.028764025243425.
[I 2024-02-29 11:47:22,777] Trial 150 finished with value: 6.028764025243425 and parameters: {'model_name': 'SimpleImputer', 'strategy': 'median'}. Best is trial 13 with value: 6.028764025243425.
[I 2024-02-29 11:47:23,107] Trial 153 finished with value: 6.028764025243425 and parameters: {'model_name': 'SimpleImputer', 'strategy': 'median'}. Best is trial 13 with value: 6.028764025243425.
[I 2024-02-29 11:47:23,400] Trial 152 finished with value: 6.028764025243425 and parameters: {'model_name': 'SimpleImputer', 'strategy': 'median'}. Best is trial 13 with value: 6.028764025243425.
[I 2024-02-29 11:47:23,703] Trial 102 finished with value: 23.645870844555127 and parameters: {'model_name': 'SimpleImputer', 'strategy': 'most_frequent'}. Best is trial 13 with value: 6.028764025243425.
[I 2024-02-29 11:47:24,024] Trial 154 finished with value: 6.028764025243425 and parameters: {'model_name': 'SimpleImputer', 'strategy': 'median'}. Best is trial 13 with value: 6.028764025243425.
[I 2024-02-29 11:47:24,235] Trial 149 finished with value: 6.028764025243425 and parameters: {'model_name': 'SimpleImputer', 'strategy': 'median'}. Best is trial 13 with value: 6.028764025243425.
[I 2024-02-29 11:47:24,457] Trial 104 finished with value: 23.645870844555127 and parameters: {'model_name': 'SimpleImputer', 'strategy': 'most_frequent'}. Best is trial 13 with value: 6.028764025243425.
[I 2024-02-29 11:47:24,928] Trial 103 finished with value: 23.645870844555127 and parameters: {'model_name': 'SimpleImputer', 'strategy': 'most_frequent'}. Best is trial 13 with value: 6.028764025243425.
[I 2024-02-29 11:47:25,165] Trial 157 finished with value: 6.028764025243425 and parameters: {'model_name': 'SimpleImputer', 'strategy': 'median'}. Best is trial 13 with value: 6.028764025243425.
[I 2024-02-29 11:47:25,481] Trial 155 finished with value: 6.028764025243425 and parameters: {'model_name': 'SimpleImputer', 'strategy': 'median'}. Best is trial 13 with value: 6.028764025243425.
[I 2024-02-29 11:47:25,819] Trial 159 finished with value: 6.028764025243425 and parameters: {'model_name': 'SimpleImputer', 'strategy': 'median'}. Best is trial 13 with value: 6.028764025243425.
[I 2024-02-29 11:47:26,144] Trial 156 finished with value: 6.028764025243425 and parameters: {'model_name': 'SimpleImputer', 'strategy': 'median'}. Best is trial 13 with value: 6.028764025243425.
[I 2024-02-29 11:47:26,347] Trial 160 finished with value: 6.028764025243425 and parameters: {'model_name': 'SimpleImputer', 'strategy': 'median'}. Best is trial 13 with value: 6.028764025243425.
[I 2024-02-29 11:47:26,655] Trial 164 finished with value: 6.028764025243425 and parameters: {'model_name': 'SimpleImputer', 'strategy': 'median'}. Best is trial 13 with value: 6.028764025243425.
[I 2024-02-29 11:47:26,852] Trial 167 finished with value: 6.028764025243425 and parameters: {'model_name': 'SimpleImputer', 'strategy': 'median'}. Best is trial 13 with value: 6.028764025243425.
[I 2024-02-29 11:47:27,078] Trial 158 finished with value: 6.028764025243425 and parameters: {'model_name': 'SimpleImputer', 'strategy': 'median'}. Best is trial 13 with value: 6.028764025243425.
[I 2024-02-29 11:47:27,275] Trial 185 finished with value: 23.64724339271243 and parameters: {'model_name': 'SimpleImputer', 'strategy': 'constant'}. Best is trial 13 with value: 6.028764025243425.
[I 2024-02-29 11:47:27,501] Trial 184 finished with value: 23.64724339271243 and parameters: {'model_name': 'SimpleImputer', 'strategy': 'constant'}. Best is trial 13 with value: 6.028764025243425.
[I 2024-02-29 11:47:27,725] Trial 166 finished with value: 6.028764025243425 and parameters: {'model_name': 'SimpleImputer', 'strategy': 'median'}. Best is trial 13 with value: 6.028764025243425.
[I 2024-02-29 11:47:28,024] Trial 106 finished with value: 23.645870844555127 and parameters: {'model_name': 'SimpleImputer', 'strategy': 'most_frequent'}. Best is trial 13 with value: 6.028764025243425.
[I 2024-02-29 11:47:28,422] Trial 169 finished with value: 6.028764025243425 and parameters: {'model_name': 'SimpleImputer', 'strategy': 'median'}. Best is trial 13 with value: 6.028764025243425.
[I 2024-02-29 11:47:28,626] Trial 161 finished with value: 6.028764025243425 and parameters: {'model_name': 'SimpleImputer', 'strategy': 'median'}. Best is trial 13 with value: 6.028764025243425.
[I 2024-02-29 11:47:28,875] Trial 186 finished with value: 23.64724339271243 and parameters: {'model_name': 'SimpleImputer', 'strategy': 'constant'}. Best is trial 13 with value: 6.028764025243425.
[I 2024-02-29 11:47:29,102] Trial 168 finished with value: 6.028764025243425 and parameters: {'model_name': 'SimpleImputer', 'strategy': 'median'}. Best is trial 13 with value: 6.028764025243425.
[I 2024-02-29 11:47:29,295] Trial 163 finished with value: 6.028764025243425 and parameters: {'model_name': 'SimpleImputer', 'strategy': 'median'}. Best is trial 13 with value: 6.028764025243425.
[I 2024-02-29 11:47:29,495] Trial 165 finished with value: 6.028764025243425 and parameters: {'model_name': 'SimpleImputer', 'strategy': 'median'}. Best is trial 13 with value: 6.028764025243425.
[I 2024-02-29 11:47:29,711] Trial 162 finished with value: 6.028764025243425 and parameters: {'model_name': 'SimpleImputer', 'strategy': 'median'}. Best is trial 13 with value: 6.028764025243425.
[I 2024-02-29 11:47:29,995] Trial 170 finished with value: 6.028764025243425 and parameters: {'model_name': 'SimpleImputer', 'strategy': 'median'}. Best is trial 13 with value: 6.028764025243425.
[I 2024-02-29 11:47:30,226] Trial 107 finished with value: 23.645870844555127 and parameters: {'model_name': 'SimpleImputer', 'strategy': 'most_frequent'}. Best is trial 13 with value: 6.028764025243425.
[I 2024-02-29 11:47:30,499] Trial 105 finished with value: 23.645870844555127 and parameters: {'model_name': 'SimpleImputer', 'strategy': 'most_frequent'}. Best is trial 13 with value: 6.028764025243425.
[I 2024-02-29 11:47:30,846] Trial 171 finished with value: 6.028764025243425 and parameters: {'model_name': 'SimpleImputer', 'strategy': 'median'}. Best is trial 13 with value: 6.028764025243425.
[I 2024-02-29 11:47:31,036] Trial 174 finished with value: 6.028764025243425 and parameters: {'model_name': 'SimpleImputer', 'strategy': 'median'}. Best is trial 13 with value: 6.028764025243425.
[I 2024-02-29 11:47:31,301] Trial 175 finished with value: 6.028764025243425 and parameters: {'model_name': 'SimpleImputer', 'strategy': 'median'}. Best is trial 13 with value: 6.028764025243425.
[I 2024-02-29 11:47:31,538] Trial 178 finished with value: 6.028764025243425 and parameters: {'model_name': 'SimpleImputer', 'strategy': 'median'}. Best is trial 13 with value: 6.028764025243425.
[I 2024-02-29 11:47:31,795] Trial 173 finished with value: 6.028764025243425 and parameters: {'model_name': 'SimpleImputer', 'strategy': 'median'}. Best is trial 13 with value: 6.028764025243425.
[I 2024-02-29 11:47:32,034] Trial 189 finished with value: 23.64724339271243 and parameters: {'model_name': 'SimpleImputer', 'strategy': 'constant'}. Best is trial 13 with value: 6.028764025243425.
[I 2024-02-29 11:47:32,237] Trial 192 finished with value: 23.64724339271243 and parameters: {'model_name': 'SimpleImputer', 'strategy': 'constant'}. Best is trial 13 with value: 6.028764025243425.
[I 2024-02-29 11:47:32,418] Trial 108 finished with value: 23.645870844555127 and parameters: {'model_name': 'SimpleImputer', 'strategy': 'most_frequent'}. Best is trial 13 with value: 6.028764025243425.
[I 2024-02-29 11:47:32,651] Trial 191 finished with value: 23.64724339271243 and parameters: {'model_name': 'SimpleImputer', 'strategy': 'constant'}. Best is trial 13 with value: 6.028764025243425.
[I 2024-02-29 11:47:32,935] Trial 181 finished with value: 6.028764025243425 and parameters: {'model_name': 'SimpleImputer', 'strategy': 'median'}. Best is trial 13 with value: 6.028764025243425.
[I 2024-02-29 11:47:33,168] Trial 172 finished with value: 6.028764025243425 and parameters: {'model_name': 'SimpleImputer', 'strategy': 'median'}. Best is trial 13 with value: 6.028764025243425.
[I 2024-02-29 11:47:33,358] Trial 182 finished with value: 6.028764025243425 and parameters: {'model_name': 'SimpleImputer', 'strategy': 'median'}. Best is trial 13 with value: 6.028764025243425.
[I 2024-02-29 11:47:33,599] Trial 190 finished with value: 23.64724339271243 and parameters: {'model_name': 'SimpleImputer', 'strategy': 'constant'}. Best is trial 13 with value: 6.028764025243425.
[I 2024-02-29 11:47:33,789] Trial 183 finished with value: 6.028764025243425 and parameters: {'model_name': 'SimpleImputer', 'strategy': 'median'}. Best is trial 13 with value: 6.028764025243425.
[I 2024-02-29 11:47:34,013] Trial 177 finished with value: 6.028764025243425 and parameters: {'model_name': 'SimpleImputer', 'strategy': 'median'}. Best is trial 13 with value: 6.028764025243425.
[I 2024-02-29 11:47:34,208] Trial 194 finished with value: 23.64724339271243 and parameters: {'model_name': 'SimpleImputer', 'strategy': 'constant'}. Best is trial 13 with value: 6.028764025243425.
[I 2024-02-29 11:47:34,443] Trial 176 finished with value: 6.028764025243425 and parameters: {'model_name': 'SimpleImputer', 'strategy': 'median'}. Best is trial 13 with value: 6.028764025243425.
[I 2024-02-29 11:47:34,651] Trial 180 finished with value: 6.028764025243425 and parameters: {'model_name': 'SimpleImputer', 'strategy': 'median'}. Best is trial 13 with value: 6.028764025243425.
[I 2024-02-29 11:47:34,848] Trial 193 finished with value: 23.64724339271243 and parameters: {'model_name': 'SimpleImputer', 'strategy': 'constant'}. Best is trial 13 with value: 6.028764025243425.
[I 2024-02-29 11:47:35,071] Trial 198 finished with value: 23.64724339271243 and parameters: {'model_name': 'SimpleImputer', 'strategy': 'constant'}. Best is trial 13 with value: 6.028764025243425.
[I 2024-02-29 11:47:35,269] Trial 179 finished with value: 6.028764025243425 and parameters: {'model_name': 'SimpleImputer', 'strategy': 'median'}. Best is trial 13 with value: 6.028764025243425.
[I 2024-02-29 11:47:35,498] Trial 197 finished with value: 23.64724339271243 and parameters: {'model_name': 'SimpleImputer', 'strategy': 'constant'}. Best is trial 13 with value: 6.028764025243425.
[I 2024-02-29 11:47:35,697] Trial 195 finished with value: 23.64724339271243 and parameters: {'model_name': 'SimpleImputer', 'strategy': 'constant'}. Best is trial 13 with value: 6.028764025243425.
[I 2024-02-29 11:47:35,900] Trial 199 finished with value: 23.64724339271243 and parameters: {'model_name': 'SimpleImputer', 'strategy': 'constant'}. Best is trial 13 with value: 6.028764025243425.
[I 2024-02-29 11:47:36,093] Trial 196 finished with value: 8.611631446315494 and parameters: {'model_name': 'SimpleImputer', 'strategy': 'mean'}. Best is trial 13 with value: 6.028764025243425.
[I 2024-02-29 11:47:36,317] Trial 188 finished with value: 6.028764025243425 and parameters: {'model_name': 'SimpleImputer', 'strategy': 'median'}. Best is trial 13 with value: 6.028764025243425.
