[I 2024-02-27 14:23:08,069] Trial 58 finished with value: 0.7951574938454515 and parameters: {'model_name': 'RandomForestImputer', 'max_iter': 8, 'decreasing': False, 'min_samples_split': 0.5, 'min_samples_leaf': 0.1, 'max_features': 0.5, 'warm_start': False}. Best is trial 2 with value: 0.7940648831696957.
[I 2024-02-27 14:23:10,183] Trial 145 finished with value: 0.7940648831696957 and parameters: {'model_name': 'SimpleImputer', 'strategy': 'constant'}. Best is trial 2 with value: 0.7940648831696957.
[I 2024-02-27 14:23:12,777] Trial 146 finished with value: 0.7940648831696957 and parameters: {'model_name': 'SimpleImputer', 'strategy': 'median'}. Best is trial 2 with value: 0.7940648831696957.
[I 2024-02-27 14:23:14,937] Trial 147 finished with value: 0.7940695283789797 and parameters: {'model_name': 'SimpleImputer', 'strategy': 'mean'}. Best is trial 2 with value: 0.7940648831696957.
[I 2024-02-27 14:23:17,432] Trial 148 finished with value: 0.7940648831696957 and parameters: {'model_name': 'SimpleImputer', 'strategy': 'median'}. Best is trial 2 with value: 0.7940648831696957.
[I 2024-02-27 14:23:20,037] Trial 149 finished with value: 0.7940648831696957 and parameters: {'model_name': 'SimpleImputer', 'strategy': 'median'}. Best is trial 2 with value: 0.7940648831696957.
[I 2024-02-27 14:23:22,462] Trial 150 finished with value: 0.7940648831696957 and parameters: {'model_name': 'SimpleImputer', 'strategy': 'median'}. Best is trial 2 with value: 0.7940648831696957.
[I 2024-02-27 14:23:24,183] Trial 151 finished with value: 0.7940648831696957 and parameters: {'model_name': 'SimpleImputer', 'strategy': 'constant'}. Best is trial 2 with value: 0.7940648831696957.
[I 2024-02-27 14:23:29,252] Trial 32 finished with value: 0.7941618378678703 and parameters: {'model_name': 'RandomForestImputer', 'max_iter': 11, 'decreasing': False, 'min_samples_split': 0.0, 'min_samples_leaf': 0.9, 'max_features': 0.7000000000000001, 'warm_start': False}. Best is trial 2 with value: 0.7940648831696957.
[I 2024-02-27 14:23:31,864] Trial 153 finished with value: 0.7940648831696957 and parameters: {'model_name': 'SimpleImputer', 'strategy': 'median'}. Best is trial 2 with value: 0.7940648831696957.
[I 2024-02-27 14:23:44,045] Trial 13 finished with value: 1.0937461390630496 and parameters: {'model_name': 'IterativeImputer', 'sample_posterior': True, 'initial_strategy': 'median', 'imputation_order': 'arabic'}. Best is trial 2 with value: 0.7940648831696957.
[I 2024-02-27 14:23:45,811] Trial 3 finished with value: 1.094325920208615 and parameters: {'model_name': 'IterativeImputer', 'sample_posterior': True, 'initial_strategy': 'most_frequent', 'imputation_order': 'roman'}. Best is trial 2 with value: 0.7940648831696957.
[I 2024-02-27 14:23:47,668] Trial 155 finished with value: 0.7940648831696957 and parameters: {'model_name': 'SimpleImputer', 'strategy': 'median'}. Best is trial 2 with value: 0.7940648831696957.
[I 2024-02-27 14:23:49,238] Trial 157 finished with value: 0.7940648831696957 and parameters: {'model_name': 'SimpleImputer', 'strategy': 'constant'}. Best is trial 2 with value: 0.7940648831696957.
[I 2024-02-27 14:23:50,590] Trial 156 finished with value: 0.7940648831696957 and parameters: {'model_name': 'SimpleImputer', 'strategy': 'median'}. Best is trial 2 with value: 0.7940648831696957.
[I 2024-02-27 14:23:52,524] Trial 60 finished with value: 1.1032736889488222 and parameters: {'model_name': 'IterativeImputer', 'sample_posterior': True, 'initial_strategy': 'median', 'imputation_order': 'arabic'}. Best is trial 2 with value: 0.7940648831696957.
[I 2024-02-27 14:23:53,660] Trial 158 finished with value: 0.7940648831696957 and parameters: {'model_name': 'SimpleImputer', 'strategy': 'median'}. Best is trial 2 with value: 0.7940648831696957.
[I 2024-02-27 14:23:54,599] Trial 159 finished with value: 0.7940648831696957 and parameters: {'model_name': 'SimpleImputer', 'strategy': 'median'}. Best is trial 2 with value: 0.7940648831696957.
[I 2024-02-27 14:23:56,673] Trial 160 finished with value: 0.7940648831696957 and parameters: {'model_name': 'SimpleImputer', 'strategy': 'median'}. Best is trial 2 with value: 0.7940648831696957.
[I 2024-02-27 14:23:58,381] Trial 161 finished with value: 0.7940648831696957 and parameters: {'model_name': 'SimpleImputer', 'strategy': 'median'}. Best is trial 2 with value: 0.7940648831696957.
[I 2024-02-27 14:23:59,801] Trial 162 finished with value: 0.7940648831696957 and parameters: {'model_name': 'SimpleImputer', 'strategy': 'median'}. Best is trial 2 with value: 0.7940648831696957.
[I 2024-02-27 14:24:04,603] Trial 45 finished with value: 1.0968159992922406 and parameters: {'model_name': 'IterativeImputer', 'sample_posterior': True, 'initial_strategy': 'most_frequent', 'imputation_order': 'random'}. Best is trial 2 with value: 0.7940648831696957.
[I 2024-02-27 14:24:06,283] Trial 21 finished with value: 1.0988561653310547 and parameters: {'model_name': 'IterativeImputer', 'sample_posterior': True, 'initial_strategy': 'constant', 'imputation_order': 'random'}. Best is trial 2 with value: 0.7940648831696957.
[I 2024-02-27 14:24:07,628] Trial 167 finished with value: 0.7940648831696957 and parameters: {'model_name': 'SimpleImputer', 'strategy': 'constant'}. Best is trial 2 with value: 0.7940648831696957.
[I 2024-02-27 14:24:10,210] Trial 73 finished with value: 1.1030841447556745 and parameters: {'model_name': 'IterativeImputer', 'sample_posterior': True, 'initial_strategy': 'most_frequent', 'imputation_order': 'arabic'}. Best is trial 2 with value: 0.7940648831696957.
[I 2024-02-27 14:24:11,508] Trial 168 finished with value: 0.7940648831696957 and parameters: {'model_name': 'SimpleImputer', 'strategy': 'median'}. Best is trial 2 with value: 0.7940648831696957.
[I 2024-02-27 14:24:13,698] Trial 72 finished with value: 1.095609379276089 and parameters: {'model_name': 'IterativeImputer', 'sample_posterior': True, 'initial_strategy': 'mean', 'imputation_order': 'roman'}. Best is trial 2 with value: 0.7940648831696957.
[I 2024-02-27 14:24:14,669] Trial 169 finished with value: 0.7940648831696957 and parameters: {'model_name': 'SimpleImputer', 'strategy': 'median'}. Best is trial 2 with value: 0.7940648831696957.
[I 2024-02-27 14:24:15,494] Trial 170 finished with value: 0.7940648831696957 and parameters: {'model_name': 'SimpleImputer', 'strategy': 'median'}. Best is trial 2 with value: 0.7940648831696957.
[I 2024-02-27 14:24:17,690] Trial 171 finished with value: 0.7940648831696957 and parameters: {'model_name': 'SimpleImputer', 'strategy': 'median'}. Best is trial 2 with value: 0.7940648831696957.
[I 2024-02-27 14:24:21,271] Trial 71 finished with value: 1.0866807035946895 and parameters: {'model_name': 'IterativeImputer', 'sample_posterior': True, 'initial_strategy': 'median', 'imputation_order': 'descending'}. Best is trial 2 with value: 0.7940648831696957.
[I 2024-02-27 14:24:22,979] Trial 78 finished with value: 1.0957866213401501 and parameters: {'model_name': 'IterativeImputer', 'sample_posterior': True, 'initial_strategy': 'median', 'imputation_order': 'roman'}. Best is trial 2 with value: 0.7940648831696957.
[I 2024-02-27 14:24:24,316] Trial 176 finished with value: 0.7940648831696957 and parameters: {'model_name': 'SimpleImputer', 'strategy': 'constant'}. Best is trial 2 with value: 0.7940648831696957.
[I 2024-02-27 14:24:27,524] Trial 75 finished with value: 1.0929731339820121 and parameters: {'model_name': 'IterativeImputer', 'sample_posterior': True, 'initial_strategy': 'mean', 'imputation_order': 'roman'}. Best is trial 2 with value: 0.7940648831696957.
[I 2024-02-27 14:24:32,257] Trial 69 finished with value: 1.0837545048116075 and parameters: {'model_name': 'IterativeImputer', 'sample_posterior': True, 'initial_strategy': 'median', 'imputation_order': 'random'}. Best is trial 2 with value: 0.7940648831696957.
[I 2024-02-27 14:24:34,311] Trial 179 finished with value: 0.7940648831696957 and parameters: {'model_name': 'SimpleImputer', 'strategy': 'median'}. Best is trial 2 with value: 0.7940648831696957.
[I 2024-02-27 14:24:35,863] Trial 180 finished with value: 0.7940648831696957 and parameters: {'model_name': 'SimpleImputer', 'strategy': 'median'}. Best is trial 2 with value: 0.7940648831696957.
[I 2024-02-27 14:26:11,079] Trial 86 finished with value: 0.8165780810130323 and parameters: {'model_name': 'GAIN', 'batch_size': 21, 'hint_rate': 0.48000000000000004, 'alpha': 39, 'iterations': 201}. Best is trial 2 with value: 0.7940648831696957.
[I 2024-02-27 14:27:11,273] Trial 9 finished with value: 0.8368983849657974 and parameters: {'model_name': 'GAIN', 'batch_size': 82, 'hint_rate': 0.8300000000000001, 'alpha': 93, 'iterations': 243}. Best is trial 2 with value: 0.7940648831696957.
[I 2024-02-27 14:31:26,590] Trial 152 finished with value: 1.0948321619173595 and parameters: {'model_name': 'IterativeImputer', 'sample_posterior': True, 'initial_strategy': 'most_frequent', 'imputation_order': 'arabic'}. Best is trial 2 with value: 0.7940648831696957.
[I 2024-02-27 14:31:36,937] Trial 154 finished with value: 1.096855692421703 and parameters: {'model_name': 'IterativeImputer', 'sample_posterior': True, 'initial_strategy': 'constant', 'imputation_order': 'arabic'}. Best is trial 2 with value: 0.7940648831696957.
[I 2024-02-27 14:39:10,686] Trial 119 finished with value: 0.7941442313001223 and parameters: {'model_name': 'RandomForestImputer', 'max_iter': 38, 'decreasing': True, 'min_samples_split': 0.1, 'min_samples_leaf': 0.9, 'max_features': 0.4, 'warm_start': False}. Best is trial 2 with value: 0.7940648831696957.
[I 2024-02-27 14:39:12,432] Trial 186 finished with value: 0.7940648831696957 and parameters: {'model_name': 'SimpleImputer', 'strategy': 'constant'}. Best is trial 2 with value: 0.7940648831696957.
[I 2024-02-27 14:39:14,499] Trial 187 finished with value: 0.7940648831696957 and parameters: {'model_name': 'SimpleImputer', 'strategy': 'median'}. Best is trial 2 with value: 0.7940648831696957.
[I 2024-02-27 14:39:16,207] Trial 188 finished with value: 0.7940648831696957 and parameters: {'model_name': 'SimpleImputer', 'strategy': 'constant'}. Best is trial 2 with value: 0.7940648831696957.
[I 2024-02-27 14:39:17,655] Trial 189 finished with value: 0.7940648831696957 and parameters: {'model_name': 'SimpleImputer', 'strategy': 'constant'}. Best is trial 2 with value: 0.7940648831696957.
[I 2024-02-27 14:39:18,811] Trial 190 finished with value: 0.7940648831696957 and parameters: {'model_name': 'SimpleImputer', 'strategy': 'constant'}. Best is trial 2 with value: 0.7940648831696957.
[I 2024-02-27 14:39:20,582] Trial 191 finished with value: 0.7940648831696957 and parameters: {'model_name': 'SimpleImputer', 'strategy': 'median'}. Best is trial 2 with value: 0.7940648831696957.
[I 2024-02-27 14:39:22,029] Trial 192 finished with value: 0.7940648831696957 and parameters: {'model_name': 'SimpleImputer', 'strategy': 'constant'}. Best is trial 2 with value: 0.7940648831696957.
[I 2024-02-27 14:39:23,754] Trial 193 finished with value: 0.7940695283789797 and parameters: {'model_name': 'SimpleImputer', 'strategy': 'mean'}. Best is trial 2 with value: 0.7940648831696957.
[I 2024-02-27 14:39:25,781] Trial 194 finished with value: 0.7940648831696957 and parameters: {'model_name': 'SimpleImputer', 'strategy': 'median'}. Best is trial 2 with value: 0.7940648831696957.
[I 2024-02-27 14:40:30,319] Trial 50 finished with value: 0.7942046903082636 and parameters: {'model_name': 'RandomForestImputer', 'max_iter': 42, 'decreasing': True, 'min_samples_split': 0.4, 'min_samples_leaf': 0.2, 'max_features': 0.1, 'warm_start': False}. Best is trial 2 with value: 0.7940648831696957.
[I 2024-02-27 14:40:31,852] Trial 196 finished with value: 0.7940648831696957 and parameters: {'model_name': 'SimpleImputer', 'strategy': 'constant'}. Best is trial 2 with value: 0.7940648831696957.
[I 2024-02-27 14:40:34,110] Trial 197 finished with value: 0.7940648831696957 and parameters: {'model_name': 'SimpleImputer', 'strategy': 'median'}. Best is trial 2 with value: 0.7940648831696957.
[I 2024-02-27 14:40:35,330] Trial 198 finished with value: 0.7940648831696957 and parameters: {'model_name': 'SimpleImputer', 'strategy': 'constant'}. Best is trial 2 with value: 0.7940648831696957.
[I 2024-02-27 14:40:36,991] Trial 199 finished with value: 0.7940648831696957 and parameters: {'model_name': 'SimpleImputer', 'strategy': 'constant'}. Best is trial 2 with value: 0.7940648831696957.
[I 2024-02-27 14:41:48,129] Trial 141 finished with value: 0.7941472959516094 and parameters: {'model_name': 'RandomForestImputer', 'max_iter': 38, 'decreasing': False, 'min_samples_split': 0.0, 'min_samples_leaf': 0.9, 'max_features': 0.30000000000000004, 'warm_start': False}. Best is trial 2 with value: 0.7940648831696957.
[I 2024-02-27 14:41:58,723] Trial 142 finished with value: 0.7941478328210043 and parameters: {'model_name': 'RandomForestImputer', 'max_iter': 41, 'decreasing': False, 'min_samples_split': 0.0, 'min_samples_leaf': 0.9, 'max_features': 0.4, 'warm_start': False}. Best is trial 2 with value: 0.7940648831696957.
[I 2024-02-27 14:42:06,665] Trial 144 finished with value: 0.7941421872019734 and parameters: {'model_name': 'RandomForestImputer', 'max_iter': 36, 'decreasing': False, 'min_samples_split': 0.0, 'min_samples_leaf': 0.9, 'max_features': 0.4, 'warm_start': False}. Best is trial 2 with value: 0.7940648831696957.
[I 2024-02-27 14:47:03,337] Trial 117 finished with value: 0.7941306807382853 and parameters: {'model_name': 'RandomForestImputer', 'max_iter': 69, 'decreasing': True, 'min_samples_split': 0.1, 'min_samples_leaf': 0.9, 'max_features': 0.4, 'warm_start': False}. Best is trial 2 with value: 0.7940648831696957.
[I 2024-02-27 14:49:08,527] Trial 137 finished with value: 0.7941326071963973 and parameters: {'model_name': 'RandomForestImputer', 'max_iter': 48, 'decreasing': False, 'min_samples_split': 0.0, 'min_samples_leaf': 0.9, 'max_features': 0.4, 'warm_start': False}. Best is trial 2 with value: 0.7940648831696957.
[I 2024-02-27 14:50:20,431] Trial 113 finished with value: 0.7941331483655533 and parameters: {'model_name': 'RandomForestImputer', 'max_iter': 77, 'decreasing': True, 'min_samples_split': 0.0, 'min_samples_leaf': 0.9, 'max_features': 0.30000000000000004, 'warm_start': False}. Best is trial 2 with value: 0.7940648831696957.
[I 2024-02-27 14:52:22,663] Trial 80 finished with value: 1.0327472120128456 and parameters: {'model_name': 'GAIN', 'batch_size': 27, 'hint_rate': 0.44, 'alpha': 48, 'iterations': 1197}. Best is trial 2 with value: 0.7940648831696957.
[I 2024-02-27 14:52:35,159] Trial 8 finished with value: 0.837445657605827 and parameters: {'model_name': 'GAIN', 'batch_size': 1, 'hint_rate': 0.62, 'alpha': 71, 'iterations': 1302}. Best is trial 2 with value: 0.7940648831696957.
[I 2024-02-27 14:53:25,655] Trial 125 finished with value: 0.7941617057296713 and parameters: {'model_name': 'RandomForestImputer', 'max_iter': 68, 'decreasing': False, 'min_samples_split': 0.0, 'min_samples_leaf': 0.6, 'max_features': 0.4, 'warm_start': False}. Best is trial 2 with value: 0.7940648831696957.
[I 2024-02-27 14:57:26,424] Trial 165 finished with value: 0.7941436252966414 and parameters: {'model_name': 'RandomForestImputer', 'max_iter': 66, 'decreasing': True, 'min_samples_split': 0.0, 'min_samples_leaf': 0.7000000000000001, 'max_features': 0.30000000000000004, 'warm_start': False}. Best is trial 2 with value: 0.7940648831696957.
[I 2024-02-27 14:58:47,903] Trial 124 finished with value: 0.7941538470442058 and parameters: {'model_name': 'RandomForestImputer', 'max_iter': 91, 'decreasing': False, 'min_samples_split': 0.0, 'min_samples_leaf': 0.6, 'max_features': 0.4, 'warm_start': False}. Best is trial 2 with value: 0.7940648831696957.
[I 2024-02-27 15:00:12,810] Trial 59 finished with value: 0.7941803088496336 and parameters: {'model_name': 'RandomForestImputer', 'max_iter': 91, 'decreasing': False, 'min_samples_split': 0.1, 'min_samples_leaf': 0.30000000000000004, 'max_features': 0.30000000000000004, 'warm_start': False}. Best is trial 2 with value: 0.7940648831696957.
[I 2024-02-27 15:01:22,240] Trial 173 finished with value: 0.794137961992552 and parameters: {'model_name': 'RandomForestImputer', 'max_iter': 80, 'decreasing': True, 'min_samples_split': 0.0, 'min_samples_leaf': 0.6, 'max_features': 0.30000000000000004, 'warm_start': False}. Best is trial 2 with value: 0.7940648831696957.
[I 2024-02-27 15:01:49,418] Trial 118 finished with value: 0.7941670624181667 and parameters: {'model_name': 'RandomForestImputer', 'max_iter': 88, 'decreasing': False, 'min_samples_split': 0.0, 'min_samples_leaf': 0.9, 'max_features': 0.4, 'warm_start': False}. Best is trial 2 with value: 0.7940648831696957.
[I 2024-02-27 15:02:18,758] Trial 131 finished with value: 0.7941561035030543 and parameters: {'model_name': 'RandomForestImputer', 'max_iter': 97, 'decreasing': False, 'min_samples_split': 0.0, 'min_samples_leaf': 0.6, 'max_features': 0.4, 'warm_start': False}. Best is trial 2 with value: 0.7940648831696957.
[I 2024-02-27 15:02:20,370] Trial 126 finished with value: 0.7941266024333099 and parameters: {'model_name': 'RandomForestImputer', 'max_iter': 100, 'decreasing': False, 'min_samples_split': 0.1, 'min_samples_leaf': 0.6, 'max_features': 0.4, 'warm_start': False}. Best is trial 2 with value: 0.7940648831696957.
[I 2024-02-27 15:03:11,321] Trial 130 finished with value: 0.794127364412637 and parameters: {'model_name': 'RandomForestImputer', 'max_iter': 92, 'decreasing': True, 'min_samples_split': 0.0, 'min_samples_leaf': 0.6, 'max_features': 0.4, 'warm_start': False}. Best is trial 2 with value: 0.7940648831696957.
[I 2024-02-27 15:03:22,104] Trial 183 finished with value: 0.7941182120960172 and parameters: {'model_name': 'RandomForestImputer', 'max_iter': 67, 'decreasing': True, 'min_samples_split': 0.0, 'min_samples_leaf': 0.6, 'max_features': 0.30000000000000004, 'warm_start': False}. Best is trial 2 with value: 0.7940648831696957.
[I 2024-02-27 15:03:32,503] Trial 82 finished with value: 1.0009013902757462 and parameters: {'model_name': 'GAIN', 'batch_size': 78, 'hint_rate': 0.19, 'alpha': 77, 'iterations': 1706}. Best is trial 2 with value: 0.7940648831696957.
[I 2024-02-27 15:03:44,780] Trial 178 finished with value: 0.7941472706399394 and parameters: {'model_name': 'RandomForestImputer', 'max_iter': 84, 'decreasing': True, 'min_samples_split': 0.0, 'min_samples_leaf': 0.6, 'max_features': 0.30000000000000004, 'warm_start': False}. Best is trial 2 with value: 0.7940648831696957.
[I 2024-02-27 15:03:49,495] Trial 120 finished with value: 0.7941345192597441 and parameters: {'model_name': 'RandomForestImputer', 'max_iter': 100, 'decreasing': False, 'min_samples_split': 0.0, 'min_samples_leaf': 0.9, 'max_features': 0.4, 'warm_start': False}. Best is trial 2 with value: 0.7940648831696957.
[I 2024-02-27 15:03:54,347] Trial 127 finished with value: 0.7941405137589485 and parameters: {'model_name': 'RandomForestImputer', 'max_iter': 95, 'decreasing': True, 'min_samples_split': 0.2, 'min_samples_leaf': 0.6, 'max_features': 0.4, 'warm_start': False}. Best is trial 2 with value: 0.7940648831696957.
[I 2024-02-27 15:04:00,620] Trial 116 finished with value: 0.7941447210046402 and parameters: {'model_name': 'RandomForestImputer', 'max_iter': 94, 'decreasing': True, 'min_samples_split': 0.0, 'min_samples_leaf': 0.9, 'max_features': 0.4, 'warm_start': False}. Best is trial 2 with value: 0.7940648831696957.
[I 2024-02-27 15:04:34,756] Trial 20 finished with value: 1.0252927105837712 and parameters: {'model_name': 'GAIN', 'batch_size': 18, 'hint_rate': 0.44, 'alpha': 40, 'iterations': 1952}. Best is trial 2 with value: 0.7940648831696957.
[I 2024-02-27 15:05:12,042] Trial 182 finished with value: 0.7941384884760198 and parameters: {'model_name': 'RandomForestImputer', 'max_iter': 83, 'decreasing': True, 'min_samples_split': 0.0, 'min_samples_leaf': 0.6, 'max_features': 0.30000000000000004, 'warm_start': False}. Best is trial 2 with value: 0.7940648831696957.
[I 2024-02-27 15:05:14,477] Trial 115 finished with value: 0.7941412532091682 and parameters: {'model_name': 'RandomForestImputer', 'max_iter': 97, 'decreasing': False, 'min_samples_split': 0.0, 'min_samples_leaf': 0.9, 'max_features': 0.4, 'warm_start': False}. Best is trial 2 with value: 0.7940648831696957.
[I 2024-02-27 15:05:15,909] Trial 175 finished with value: 0.7941472299546254 and parameters: {'model_name': 'RandomForestImputer', 'max_iter': 91, 'decreasing': True, 'min_samples_split': 0.0, 'min_samples_leaf': 0.6, 'max_features': 0.30000000000000004, 'warm_start': False}. Best is trial 2 with value: 0.7940648831696957.
[I 2024-02-27 15:05:18,498] Trial 177 finished with value: 0.7941489862863864 and parameters: {'model_name': 'RandomForestImputer', 'max_iter': 79, 'decreasing': True, 'min_samples_split': 0.0, 'min_samples_leaf': 0.6, 'max_features': 0.30000000000000004, 'warm_start': False}. Best is trial 2 with value: 0.7940648831696957.
[I 2024-02-27 15:05:21,513] Trial 166 finished with value: 0.7941583588744744 and parameters: {'model_name': 'RandomForestImputer', 'max_iter': 89, 'decreasing': True, 'min_samples_split': 0.0, 'min_samples_leaf': 0.6, 'max_features': 0.30000000000000004, 'warm_start': False}. Best is trial 2 with value: 0.7940648831696957.
[I 2024-02-27 15:05:28,362] Trial 174 finished with value: 0.7941533265889149 and parameters: {'model_name': 'RandomForestImputer', 'max_iter': 89, 'decreasing': True, 'min_samples_split': 0.0, 'min_samples_leaf': 0.6, 'max_features': 0.30000000000000004, 'warm_start': False}. Best is trial 2 with value: 0.7940648831696957.
