[I 2024-04-14 23:48:44,615] Trial 113 finished with value: 0.4162577240416847 and parameters: {'model_name': 'SimpleImputer', 'strategy': 'mean'}. Best is trial 0 with value: 0.4162577240416847.
[I 2024-04-14 23:48:44,841] Trial 110 finished with value: 0.4162577240416847 and parameters: {'model_name': 'SimpleImputer', 'strategy': 'mean'}. Best is trial 0 with value: 0.4162577240416847.
[I 2024-04-14 23:48:45,075] Trial 117 finished with value: 0.4162577240416847 and parameters: {'model_name': 'SimpleImputer', 'strategy': 'mean'}. Best is trial 0 with value: 0.4162577240416847.
[I 2024-04-14 23:48:45,370] Trial 115 finished with value: 0.4162577240416847 and parameters: {'model_name': 'SimpleImputer', 'strategy': 'mean'}. Best is trial 0 with value: 0.4162577240416847.
[I 2024-04-14 23:48:45,703] Trial 83 finished with value: 0.5089812918549482 and parameters: {'model_name': 'SimpleImputer', 'strategy': 'most_frequent'}. Best is trial 0 with value: 0.4162577240416847.
[I 2024-04-14 23:48:45,943] Trial 79 finished with value: 0.5089812918549482 and parameters: {'model_name': 'SimpleImputer', 'strategy': 'most_frequent'}. Best is trial 0 with value: 0.4162577240416847.
[I 2024-04-14 23:48:46,217] Trial 114 finished with value: 0.4162577240416847 and parameters: {'model_name': 'SimpleImputer', 'strategy': 'mean'}. Best is trial 0 with value: 0.4162577240416847.
[I 2024-04-14 23:48:46,640] Trial 78 finished with value: 0.5089812918549482 and parameters: {'model_name': 'SimpleImputer', 'strategy': 'most_frequent'}. Best is trial 0 with value: 0.4162577240416847.
[I 2024-04-14 23:48:46,865] Trial 112 finished with value: 0.4162577240416847 and parameters: {'model_name': 'SimpleImputer', 'strategy': 'mean'}. Best is trial 0 with value: 0.4162577240416847.
[I 2024-04-14 23:48:47,251] Trial 120 finished with value: 0.4162577240416847 and parameters: {'model_name': 'SimpleImputer', 'strategy': 'mean'}. Best is trial 0 with value: 0.4162577240416847.
[I 2024-04-14 23:48:47,437] Trial 116 finished with value: 0.4162577240416847 and parameters: {'model_name': 'SimpleImputer', 'strategy': 'mean'}. Best is trial 0 with value: 0.4162577240416847.
[I 2024-04-14 23:48:47,801] Trial 118 finished with value: 0.4162577240416847 and parameters: {'model_name': 'SimpleImputer', 'strategy': 'mean'}. Best is trial 0 with value: 0.4162577240416847.
[I 2024-04-14 23:48:48,354] Trial 128 finished with value: 0.4162577240416847 and parameters: {'model_name': 'SimpleImputer', 'strategy': 'mean'}. Best is trial 0 with value: 0.4162577240416847.
[I 2024-04-14 23:48:48,578] Trial 119 finished with value: 0.4162577240416847 and parameters: {'model_name': 'SimpleImputer', 'strategy': 'mean'}. Best is trial 0 with value: 0.4162577240416847.
[I 2024-04-14 23:48:48,817] Trial 122 finished with value: 0.4162577240416847 and parameters: {'model_name': 'SimpleImputer', 'strategy': 'mean'}. Best is trial 0 with value: 0.4162577240416847.
[I 2024-04-14 23:48:49,051] Trial 95 finished with value: 0.5089812918549482 and parameters: {'model_name': 'SimpleImputer', 'strategy': 'most_frequent'}. Best is trial 0 with value: 0.4162577240416847.
[I 2024-04-14 23:48:49,330] Trial 123 finished with value: 0.4162577240416847 and parameters: {'model_name': 'SimpleImputer', 'strategy': 'mean'}. Best is trial 0 with value: 0.4162577240416847.
[I 2024-04-14 23:48:49,593] Trial 90 finished with value: 0.5089812918549482 and parameters: {'model_name': 'SimpleImputer', 'strategy': 'most_frequent'}. Best is trial 0 with value: 0.4162577240416847.
[I 2024-04-14 23:48:49,815] Trial 87 finished with value: 0.5089812918549482 and parameters: {'model_name': 'SimpleImputer', 'strategy': 'most_frequent'}. Best is trial 0 with value: 0.4162577240416847.
[I 2024-04-14 23:48:50,062] Trial 129 finished with value: 0.4162577240416847 and parameters: {'model_name': 'SimpleImputer', 'strategy': 'mean'}. Best is trial 0 with value: 0.4162577240416847.
[I 2024-04-14 23:48:50,301] Trial 121 finished with value: 0.4162577240416847 and parameters: {'model_name': 'SimpleImputer', 'strategy': 'mean'}. Best is trial 0 with value: 0.4162577240416847.
[I 2024-04-14 23:48:50,537] Trial 127 finished with value: 0.4162577240416847 and parameters: {'model_name': 'SimpleImputer', 'strategy': 'mean'}. Best is trial 0 with value: 0.4162577240416847.
[I 2024-04-14 23:48:50,776] Trial 133 finished with value: 0.4162577240416847 and parameters: {'model_name': 'SimpleImputer', 'strategy': 'mean'}. Best is trial 0 with value: 0.4162577240416847.
[I 2024-04-14 23:48:51,068] Trial 124 finished with value: 0.4162577240416847 and parameters: {'model_name': 'SimpleImputer', 'strategy': 'mean'}. Best is trial 0 with value: 0.4162577240416847.
[I 2024-04-14 23:48:51,295] Trial 91 finished with value: 0.5089812918549482 and parameters: {'model_name': 'SimpleImputer', 'strategy': 'most_frequent'}. Best is trial 0 with value: 0.4162577240416847.
[I 2024-04-14 23:48:51,484] Trial 92 finished with value: 0.5089812918549482 and parameters: {'model_name': 'SimpleImputer', 'strategy': 'most_frequent'}. Best is trial 0 with value: 0.4162577240416847.
[I 2024-04-14 23:48:51,738] Trial 130 finished with value: 0.4162577240416847 and parameters: {'model_name': 'SimpleImputer', 'strategy': 'mean'}. Best is trial 0 with value: 0.4162577240416847.
[I 2024-04-14 23:48:51,932] Trial 125 finished with value: 0.4162577240416847 and parameters: {'model_name': 'SimpleImputer', 'strategy': 'mean'}. Best is trial 0 with value: 0.4162577240416847.
[I 2024-04-14 23:48:52,164] Trial 126 finished with value: 0.4162577240416847 and parameters: {'model_name': 'SimpleImputer', 'strategy': 'mean'}. Best is trial 0 with value: 0.4162577240416847.
[I 2024-04-14 23:48:52,435] Trial 131 finished with value: 0.4162577240416847 and parameters: {'model_name': 'SimpleImputer', 'strategy': 'mean'}. Best is trial 0 with value: 0.4162577240416847.
[I 2024-04-14 23:48:52,674] Trial 132 finished with value: 0.4162577240416847 and parameters: {'model_name': 'SimpleImputer', 'strategy': 'mean'}. Best is trial 0 with value: 0.4162577240416847.
[I 2024-04-14 23:48:52,966] Trial 135 finished with value: 0.4162577240416847 and parameters: {'model_name': 'SimpleImputer', 'strategy': 'mean'}. Best is trial 0 with value: 0.4162577240416847.
[I 2024-04-14 23:48:53,164] Trial 93 finished with value: 0.5089812918549482 and parameters: {'model_name': 'SimpleImputer', 'strategy': 'most_frequent'}. Best is trial 0 with value: 0.4162577240416847.
[I 2024-04-14 23:48:53,428] Trial 88 finished with value: 0.5089812918549482 and parameters: {'model_name': 'SimpleImputer', 'strategy': 'most_frequent'}. Best is trial 0 with value: 0.4162577240416847.
[I 2024-04-14 23:48:53,746] Trial 136 finished with value: 0.4162577240416847 and parameters: {'model_name': 'SimpleImputer', 'strategy': 'mean'}. Best is trial 0 with value: 0.4162577240416847.
[I 2024-04-14 23:48:54,006] Trial 137 finished with value: 0.4162577240416847 and parameters: {'model_name': 'SimpleImputer', 'strategy': 'mean'}. Best is trial 0 with value: 0.4162577240416847.
[I 2024-04-14 23:48:54,366] Trial 140 finished with value: 0.4162577240416847 and parameters: {'model_name': 'SimpleImputer', 'strategy': 'mean'}. Best is trial 0 with value: 0.4162577240416847.
[I 2024-04-14 23:48:54,714] Trial 141 finished with value: 0.4162577240416847 and parameters: {'model_name': 'SimpleImputer', 'strategy': 'mean'}. Best is trial 0 with value: 0.4162577240416847.
[I 2024-04-14 23:48:54,992] Trial 89 finished with value: 0.5089812918549482 and parameters: {'model_name': 'SimpleImputer', 'strategy': 'most_frequent'}. Best is trial 0 with value: 0.4162577240416847.
[I 2024-04-14 23:48:55,233] Trial 134 finished with value: 0.4162577240416847 and parameters: {'model_name': 'SimpleImputer', 'strategy': 'mean'}. Best is trial 0 with value: 0.4162577240416847.
[I 2024-04-14 23:48:55,459] Trial 138 finished with value: 0.4162577240416847 and parameters: {'model_name': 'SimpleImputer', 'strategy': 'mean'}. Best is trial 0 with value: 0.4162577240416847.
[I 2024-04-14 23:48:55,657] Trial 96 finished with value: 0.5089812918549482 and parameters: {'model_name': 'SimpleImputer', 'strategy': 'most_frequent'}. Best is trial 0 with value: 0.4162577240416847.
[I 2024-04-14 23:48:55,975] Trial 139 finished with value: 0.4162577240416847 and parameters: {'model_name': 'SimpleImputer', 'strategy': 'mean'}. Best is trial 0 with value: 0.4162577240416847.
[I 2024-04-14 23:48:56,383] Trial 143 finished with value: 0.4162577240416847 and parameters: {'model_name': 'SimpleImputer', 'strategy': 'mean'}. Best is trial 0 with value: 0.4162577240416847.
[I 2024-04-14 23:48:56,629] Trial 142 finished with value: 0.4162577240416847 and parameters: {'model_name': 'SimpleImputer', 'strategy': 'mean'}. Best is trial 0 with value: 0.4162577240416847.
[I 2024-04-14 23:48:56,932] Trial 94 finished with value: 0.5089812918549482 and parameters: {'model_name': 'SimpleImputer', 'strategy': 'most_frequent'}. Best is trial 0 with value: 0.4162577240416847.
[I 2024-04-14 23:48:57,209] Trial 148 finished with value: 0.4162577240416847 and parameters: {'model_name': 'SimpleImputer', 'strategy': 'mean'}. Best is trial 0 with value: 0.4162577240416847.
[I 2024-04-14 23:48:57,452] Trial 145 finished with value: 0.4162577240416847 and parameters: {'model_name': 'SimpleImputer', 'strategy': 'mean'}. Best is trial 0 with value: 0.4162577240416847.
[I 2024-04-14 23:48:57,783] Trial 146 finished with value: 0.4162577240416847 and parameters: {'model_name': 'SimpleImputer', 'strategy': 'mean'}. Best is trial 0 with value: 0.4162577240416847.
[I 2024-04-14 23:48:58,131] Trial 147 finished with value: 0.4162577240416847 and parameters: {'model_name': 'SimpleImputer', 'strategy': 'mean'}. Best is trial 0 with value: 0.4162577240416847.
[I 2024-04-14 23:48:58,363] Trial 151 finished with value: 0.4162577240416847 and parameters: {'model_name': 'SimpleImputer', 'strategy': 'mean'}. Best is trial 0 with value: 0.4162577240416847.
[I 2024-04-14 23:48:58,554] Trial 144 finished with value: 0.4162577240416847 and parameters: {'model_name': 'SimpleImputer', 'strategy': 'mean'}. Best is trial 0 with value: 0.4162577240416847.
[I 2024-04-14 23:48:58,772] Trial 150 finished with value: 0.4162577240416847 and parameters: {'model_name': 'SimpleImputer', 'strategy': 'mean'}. Best is trial 0 with value: 0.4162577240416847.
[I 2024-04-14 23:48:59,189] Trial 149 finished with value: 0.4162577240416847 and parameters: {'model_name': 'SimpleImputer', 'strategy': 'mean'}. Best is trial 0 with value: 0.4162577240416847.
[I 2024-04-14 23:48:59,532] Trial 154 finished with value: 0.4162577240416847 and parameters: {'model_name': 'SimpleImputer', 'strategy': 'mean'}. Best is trial 0 with value: 0.4162577240416847.
[I 2024-04-14 23:48:59,734] Trial 153 finished with value: 0.4162577240416847 and parameters: {'model_name': 'SimpleImputer', 'strategy': 'mean'}. Best is trial 0 with value: 0.4162577240416847.
[I 2024-04-14 23:49:00,147] Trial 155 finished with value: 0.4162577240416847 and parameters: {'model_name': 'SimpleImputer', 'strategy': 'mean'}. Best is trial 0 with value: 0.4162577240416847.
[I 2024-04-14 23:49:00,406] Trial 152 finished with value: 0.4162577240416847 and parameters: {'model_name': 'SimpleImputer', 'strategy': 'mean'}. Best is trial 0 with value: 0.4162577240416847.
[I 2024-04-14 23:49:00,614] Trial 97 finished with value: 0.5089812918549482 and parameters: {'model_name': 'SimpleImputer', 'strategy': 'most_frequent'}. Best is trial 0 with value: 0.4162577240416847.
[I 2024-04-14 23:49:00,888] Trial 156 finished with value: 0.4162577240416847 and parameters: {'model_name': 'SimpleImputer', 'strategy': 'mean'}. Best is trial 0 with value: 0.4162577240416847.
[I 2024-04-14 23:49:01,256] Trial 158 finished with value: 0.4162577240416847 and parameters: {'model_name': 'SimpleImputer', 'strategy': 'mean'}. Best is trial 0 with value: 0.4162577240416847.
[I 2024-04-14 23:49:01,669] Trial 170 finished with value: 0.4162577240416847 and parameters: {'model_name': 'SimpleImputer', 'strategy': 'mean'}. Best is trial 0 with value: 0.4162577240416847.
[I 2024-04-14 23:49:01,901] Trial 164 finished with value: 0.4162577240416847 and parameters: {'model_name': 'SimpleImputer', 'strategy': 'mean'}. Best is trial 0 with value: 0.4162577240416847.
[I 2024-04-14 23:49:02,171] Trial 167 finished with value: 0.4162577240416847 and parameters: {'model_name': 'SimpleImputer', 'strategy': 'mean'}. Best is trial 0 with value: 0.4162577240416847.
[I 2024-04-14 23:49:02,412] Trial 159 finished with value: 0.4162577240416847 and parameters: {'model_name': 'SimpleImputer', 'strategy': 'mean'}. Best is trial 0 with value: 0.4162577240416847.
[I 2024-04-14 23:49:02,634] Trial 163 finished with value: 0.4162577240416847 and parameters: {'model_name': 'SimpleImputer', 'strategy': 'mean'}. Best is trial 0 with value: 0.4162577240416847.
[I 2024-04-14 23:49:02,843] Trial 160 finished with value: 0.4162577240416847 and parameters: {'model_name': 'SimpleImputer', 'strategy': 'mean'}. Best is trial 0 with value: 0.4162577240416847.
[I 2024-04-14 23:49:03,054] Trial 162 finished with value: 0.4162577240416847 and parameters: {'model_name': 'SimpleImputer', 'strategy': 'mean'}. Best is trial 0 with value: 0.4162577240416847.
[I 2024-04-14 23:49:03,297] Trial 157 finished with value: 0.4162577240416847 and parameters: {'model_name': 'SimpleImputer', 'strategy': 'mean'}. Best is trial 0 with value: 0.4162577240416847.
[I 2024-04-14 23:49:03,581] Trial 176 finished with value: 0.4162577240416847 and parameters: {'model_name': 'SimpleImputer', 'strategy': 'mean'}. Best is trial 0 with value: 0.4162577240416847.
[I 2024-04-14 23:49:03,777] Trial 165 finished with value: 0.4162577240416847 and parameters: {'model_name': 'SimpleImputer', 'strategy': 'mean'}. Best is trial 0 with value: 0.4162577240416847.
[I 2024-04-14 23:49:04,040] Trial 172 finished with value: 0.4162577240416847 and parameters: {'model_name': 'SimpleImputer', 'strategy': 'mean'}. Best is trial 0 with value: 0.4162577240416847.
[I 2024-04-14 23:49:04,268] Trial 166 finished with value: 0.4162577240416847 and parameters: {'model_name': 'SimpleImputer', 'strategy': 'mean'}. Best is trial 0 with value: 0.4162577240416847.
[I 2024-04-14 23:49:04,494] Trial 168 finished with value: 0.4162577240416847 and parameters: {'model_name': 'SimpleImputer', 'strategy': 'mean'}. Best is trial 0 with value: 0.4162577240416847.
[I 2024-04-14 23:49:04,692] Trial 161 finished with value: 0.4162577240416847 and parameters: {'model_name': 'SimpleImputer', 'strategy': 'mean'}. Best is trial 0 with value: 0.4162577240416847.
[I 2024-04-14 23:49:04,944] Trial 173 finished with value: 0.4162577240416847 and parameters: {'model_name': 'SimpleImputer', 'strategy': 'mean'}. Best is trial 0 with value: 0.4162577240416847.
[I 2024-04-14 23:49:05,208] Trial 174 finished with value: 0.4162577240416847 and parameters: {'model_name': 'SimpleImputer', 'strategy': 'mean'}. Best is trial 0 with value: 0.4162577240416847.
[I 2024-04-14 23:49:05,432] Trial 169 finished with value: 0.4162577240416847 and parameters: {'model_name': 'SimpleImputer', 'strategy': 'mean'}. Best is trial 0 with value: 0.4162577240416847.
[I 2024-04-14 23:49:05,661] Trial 182 finished with value: 0.4162577240416847 and parameters: {'model_name': 'SimpleImputer', 'strategy': 'mean'}. Best is trial 0 with value: 0.4162577240416847.
[I 2024-04-14 23:49:05,877] Trial 175 finished with value: 0.4162577240416847 and parameters: {'model_name': 'SimpleImputer', 'strategy': 'mean'}. Best is trial 0 with value: 0.4162577240416847.
[I 2024-04-14 23:49:06,093] Trial 171 finished with value: 0.4162577240416847 and parameters: {'model_name': 'SimpleImputer', 'strategy': 'mean'}. Best is trial 0 with value: 0.4162577240416847.
[I 2024-04-14 23:49:06,385] Trial 178 finished with value: 0.4162577240416847 and parameters: {'model_name': 'SimpleImputer', 'strategy': 'mean'}. Best is trial 0 with value: 0.4162577240416847.
[I 2024-04-14 23:49:06,720] Trial 177 finished with value: 0.4162577240416847 and parameters: {'model_name': 'SimpleImputer', 'strategy': 'mean'}. Best is trial 0 with value: 0.4162577240416847.
[I 2024-04-14 23:49:07,064] Trial 179 finished with value: 0.4162577240416847 and parameters: {'model_name': 'SimpleImputer', 'strategy': 'mean'}. Best is trial 0 with value: 0.4162577240416847.
[I 2024-04-14 23:49:07,353] Trial 183 finished with value: 0.4162577240416847 and parameters: {'model_name': 'SimpleImputer', 'strategy': 'mean'}. Best is trial 0 with value: 0.4162577240416847.
[I 2024-04-14 23:49:07,596] Trial 180 finished with value: 0.4162577240416847 and parameters: {'model_name': 'SimpleImputer', 'strategy': 'mean'}. Best is trial 0 with value: 0.4162577240416847.
[I 2024-04-14 23:49:07,790] Trial 191 finished with value: 0.5096994433352348 and parameters: {'model_name': 'SimpleImputer', 'strategy': 'constant'}. Best is trial 0 with value: 0.4162577240416847.
[I 2024-04-14 23:49:07,977] Trial 184 finished with value: 0.4162577240416847 and parameters: {'model_name': 'SimpleImputer', 'strategy': 'mean'}. Best is trial 0 with value: 0.4162577240416847.
[I 2024-04-14 23:49:08,146] Trial 187 finished with value: 0.4162577240416847 and parameters: {'model_name': 'SimpleImputer', 'strategy': 'mean'}. Best is trial 0 with value: 0.4162577240416847.
[I 2024-04-14 23:49:08,380] Trial 185 finished with value: 0.4162577240416847 and parameters: {'model_name': 'SimpleImputer', 'strategy': 'mean'}. Best is trial 0 with value: 0.4162577240416847.
[I 2024-04-14 23:49:08,573] Trial 188 finished with value: 0.4162577240416847 and parameters: {'model_name': 'SimpleImputer', 'strategy': 'mean'}. Best is trial 0 with value: 0.4162577240416847.
[I 2024-04-14 23:49:08,840] Trial 192 finished with value: 0.5096994433352348 and parameters: {'model_name': 'SimpleImputer', 'strategy': 'constant'}. Best is trial 0 with value: 0.4162577240416847.
[I 2024-04-14 23:49:09,082] Trial 190 finished with value: 0.4162577240416847 and parameters: {'model_name': 'SimpleImputer', 'strategy': 'mean'}. Best is trial 0 with value: 0.4162577240416847.
[I 2024-04-14 23:49:09,273] Trial 195 finished with value: 0.5096994433352348 and parameters: {'model_name': 'SimpleImputer', 'strategy': 'constant'}. Best is trial 0 with value: 0.4162577240416847.
[I 2024-04-14 23:49:09,519] Trial 194 finished with value: 0.5096994433352348 and parameters: {'model_name': 'SimpleImputer', 'strategy': 'constant'}. Best is trial 0 with value: 0.4162577240416847.
[I 2024-04-14 23:49:09,747] Trial 189 finished with value: 0.4162577240416847 and parameters: {'model_name': 'SimpleImputer', 'strategy': 'mean'}. Best is trial 0 with value: 0.4162577240416847.
[I 2024-04-14 23:49:09,960] Trial 181 finished with value: 0.4162577240416847 and parameters: {'model_name': 'SimpleImputer', 'strategy': 'mean'}. Best is trial 0 with value: 0.4162577240416847.
[I 2024-04-14 23:49:10,215] Trial 186 finished with value: 0.4162577240416847 and parameters: {'model_name': 'SimpleImputer', 'strategy': 'mean'}. Best is trial 0 with value: 0.4162577240416847.
[I 2024-04-14 23:49:10,409] Trial 98 finished with value: 0.5089812918549482 and parameters: {'model_name': 'SimpleImputer', 'strategy': 'most_frequent'}. Best is trial 0 with value: 0.4162577240416847.
[I 2024-04-14 23:49:10,601] Trial 197 finished with value: 0.5096994433352348 and parameters: {'model_name': 'SimpleImputer', 'strategy': 'constant'}. Best is trial 0 with value: 0.4162577240416847.
[I 2024-04-14 23:49:10,829] Trial 196 finished with value: 0.5096994433352348 and parameters: {'model_name': 'SimpleImputer', 'strategy': 'constant'}. Best is trial 0 with value: 0.4162577240416847.
[I 2024-04-14 23:49:11,071] Trial 199 finished with value: 0.5096994433352348 and parameters: {'model_name': 'SimpleImputer', 'strategy': 'constant'}. Best is trial 0 with value: 0.4162577240416847.
[I 2024-04-14 23:49:11,249] Trial 198 finished with value: 0.5096994433352348 and parameters: {'model_name': 'SimpleImputer', 'strategy': 'constant'}. Best is trial 0 with value: 0.4162577240416847.
[I 2024-04-14 23:49:11,420] Trial 193 finished with value: 0.4162577240416847 and parameters: {'model_name': 'SimpleImputer', 'strategy': 'mean'}. Best is trial 0 with value: 0.4162577240416847.
