Run: 7
/cm/local/apps/slurm/var/spool/job598469/slurm_script: line 23: /common/ketrong/minconda3/etc/profile.d/conda.sh: No such file or directory
/cm/local/apps/slurm/var/spool/job598469/slurm_script: line 26: $'\nconda create --name tpot2devenv -c conda-forge python=3.10\n': command not found
/cm/local/apps/slurm/var/spool/job598469/slurm_script: line 31: $'\npip install -r requirements.txt\n': command not found
RunStart
2024-01-10 14:20:02.117758: I tensorflow/core/util/port.cc:113] oneDNN custom operations are on. You may see slightly different numerical results due to floating-point round-off errors from different computation orders. To turn them off, set the environment variable `TF_ENABLE_ONEDNN_OPTS=0`.
2024-01-10 14:20:02.151965: E external/local_xla/xla/stream_executor/cuda/cuda_dnn.cc:9261] Unable to register cuDNN factory: Attempting to register factory for plugin cuDNN when one has already been registered
2024-01-10 14:20:02.151988: E external/local_xla/xla/stream_executor/cuda/cuda_fft.cc:607] Unable to register cuFFT factory: Attempting to register factory for plugin cuFFT when one has already been registered
2024-01-10 14:20:02.152919: E external/local_xla/xla/stream_executor/cuda/cuda_blas.cc:1515] Unable to register cuBLAS factory: Attempting to register factory for plugin cuBLAS when one has already been registered
2024-01-10 14:20:02.158273: I tensorflow/core/platform/cpu_feature_guard.cc:182] This TensorFlow binary is optimized to use available CPU instructions in performance-critical operations.
To enable the following instructions: AVX2 AVX512F AVX512_VNNI FMA, in other operations, rebuild TensorFlow with the appropriate compiler flags.
2024-01-10 14:20:05.937586: W tensorflow/compiler/tf2tensorrt/utils/py_utils.cc:38] TF-TRT Warning: Could not find TensorRT
WARNING:tensorflow:From /home/ketrong/miniconda3/envs/tpot2devenv/lib/python3.10/site-packages/tensorflow/python/compat/v2_compat.py:108: disable_resource_variables (from tensorflow.python.ops.variable_scope) is deprecated and will be removed in a future version.
Instructions for updating:
non-resource variables are not supported in the long term
starting loops
working on 
logs/34539/tpot2_base_normal_MAR_0.1
4.629125356674194
loading data
logs/34539/tpot2_base_normal_MAR_0.1/data/34539_True.pkl
running experiment 1/3 - Does large hyperparameter space improve reconstruction accuracy over simple
[I 2024-01-10 14:24:23,283] A new study created in memory with name: no-name-a387d16a-3d3a-484e-b9fb-c19baf43282e
[I 2024-01-10 14:25:04,327] Trial 9 finished with value: 0.0958683975035266 and parameters: {'model_name': 'SimpleImputer', 'strategy': 'constant'}. Best is trial 9 with value: 0.0958683975035266.
[I 2024-01-10 14:25:05,054] Trial 5 finished with value: 0.0958683975035266 and parameters: {'model_name': 'SimpleImputer', 'strategy': 'constant'}. Best is trial 9 with value: 0.0958683975035266.
[I 2024-01-10 14:25:06,083] Trial 26 finished with value: 0.0958683975035266 and parameters: {'model_name': 'SimpleImputer', 'strategy': 'constant'}. Best is trial 9 with value: 0.0958683975035266.
[I 2024-01-10 14:25:07,374] Trial 6 finished with value: 0.0958683975035266 and parameters: {'model_name': 'SimpleImputer', 'strategy': 'constant'}. Best is trial 9 with value: 0.0958683975035266.
[I 2024-01-10 14:25:09,323] Trial 10 finished with value: 0.0958683975035266 and parameters: {'model_name': 'SimpleImputer', 'strategy': 'constant'}. Best is trial 9 with value: 0.0958683975035266.
[I 2024-01-10 14:25:09,833] Trial 31 finished with value: 0.0958683975035266 and parameters: {'model_name': 'SimpleImputer', 'strategy': 'constant'}. Best is trial 9 with value: 0.0958683975035266.
[I 2024-01-10 14:25:10,358] Trial 8 finished with value: 0.0958683975035266 and parameters: {'model_name': 'SimpleImputer', 'strategy': 'constant'}. Best is trial 9 with value: 0.0958683975035266.
[I 2024-01-10 14:25:10,858] Trial 38 finished with value: 0.0958683975035266 and parameters: {'model_name': 'SimpleImputer', 'strategy': 'constant'}. Best is trial 9 with value: 0.0958683975035266.
[I 2024-01-10 14:25:12,499] Trial 3 finished with value: 0.0958683975035266 and parameters: {'model_name': 'SimpleImputer', 'strategy': 'constant'}. Best is trial 9 with value: 0.0958683975035266.
[I 2024-01-10 14:25:13,628] Trial 18 finished with value: 0.0958683975035266 and parameters: {'model_name': 'SimpleImputer', 'strategy': 'constant'}. Best is trial 9 with value: 0.0958683975035266.
[I 2024-01-10 14:25:16,366] Trial 46 finished with value: 0.0958683975035266 and parameters: {'model_name': 'SimpleImputer', 'strategy': 'constant'}. Best is trial 9 with value: 0.0958683975035266.
[I 2024-01-10 14:25:17,722] Trial 20 finished with value: 0.08376317521793836 and parameters: {'model_name': 'SimpleImputer', 'strategy': 'mean'}. Best is trial 20 with value: 0.08376317521793836.
[I 2024-01-10 14:25:18,114] Trial 11 finished with value: 0.08376317521793836 and parameters: {'model_name': 'SimpleImputer', 'strategy': 'mean'}. Best is trial 20 with value: 0.08376317521793836.
[I 2024-01-10 14:25:18,595] Trial 44 finished with value: 0.0958683975035266 and parameters: {'model_name': 'SimpleImputer', 'strategy': 'constant'}. Best is trial 20 with value: 0.08376317521793836.
[I 2024-01-10 14:25:19,570] Trial 24 finished with value: 0.08376317521793836 and parameters: {'model_name': 'SimpleImputer', 'strategy': 'mean'}. Best is trial 20 with value: 0.08376317521793836.
[I 2024-01-10 14:25:20,220] Trial 13 finished with value: 0.08376317521793836 and parameters: {'model_name': 'SimpleImputer', 'strategy': 'mean'}. Best is trial 20 with value: 0.08376317521793836.
[I 2024-01-10 14:25:20,480] Trial 25 finished with value: 0.08376317521793836 and parameters: {'model_name': 'SimpleImputer', 'strategy': 'mean'}. Best is trial 20 with value: 0.08376317521793836.
[I 2024-01-10 14:25:21,084] Trial 15 finished with value: 0.08376317521793836 and parameters: {'model_name': 'SimpleImputer', 'strategy': 'mean'}. Best is trial 20 with value: 0.08376317521793836.
[I 2024-01-10 14:25:21,498] Trial 39 finished with value: 0.08376317521793836 and parameters: {'model_name': 'SimpleImputer', 'strategy': 'mean'}. Best is trial 20 with value: 0.08376317521793836.
[I 2024-01-10 14:25:24,925] Trial 1 finished with value: 0.08376317521793836 and parameters: {'model_name': 'SimpleImputer', 'strategy': 'mean'}. Best is trial 20 with value: 0.08376317521793836.
[I 2024-01-10 14:25:25,349] Trial 0 finished with value: 0.08376317521793836 and parameters: {'model_name': 'SimpleImputer', 'strategy': 'mean'}. Best is trial 20 with value: 0.08376317521793836.
[I 2024-01-10 14:25:26,969] Trial 2 finished with value: 0.08376317521793836 and parameters: {'model_name': 'SimpleImputer', 'strategy': 'mean'}. Best is trial 20 with value: 0.08376317521793836.
[I 2024-01-10 14:25:27,416] Trial 43 finished with value: 0.08376317521793836 and parameters: {'model_name': 'SimpleImputer', 'strategy': 'mean'}. Best is trial 20 with value: 0.08376317521793836.
[I 2024-01-10 14:25:27,913] Trial 42 finished with value: 0.08376317521793836 and parameters: {'model_name': 'SimpleImputer', 'strategy': 'mean'}. Best is trial 20 with value: 0.08376317521793836.
[I 2024-01-10 14:25:28,559] Trial 47 finished with value: 0.08376317521793836 and parameters: {'model_name': 'SimpleImputer', 'strategy': 'mean'}. Best is trial 20 with value: 0.08376317521793836.
[I 2024-01-10 14:25:43,415] Trial 12 finished with value: 0.08818808926959634 and parameters: {'model_name': 'SimpleImputer', 'strategy': 'median'}. Best is trial 20 with value: 0.08376317521793836.
[I 2024-01-10 14:25:45,610] Trial 16 finished with value: 0.08818808926959634 and parameters: {'model_name': 'SimpleImputer', 'strategy': 'median'}. Best is trial 20 with value: 0.08376317521793836.
[I 2024-01-10 14:25:45,897] Trial 36 finished with value: 0.08818808926959634 and parameters: {'model_name': 'SimpleImputer', 'strategy': 'median'}. Best is trial 20 with value: 0.08376317521793836.
[I 2024-01-10 14:25:46,164] Trial 21 finished with value: 0.08818808926959634 and parameters: {'model_name': 'SimpleImputer', 'strategy': 'median'}. Best is trial 20 with value: 0.08376317521793836.
[I 2024-01-10 14:25:46,754] Trial 29 finished with value: 0.08818808926959634 and parameters: {'model_name': 'SimpleImputer', 'strategy': 'median'}. Best is trial 20 with value: 0.08376317521793836.
[I 2024-01-10 14:25:47,154] Trial 4 finished with value: 0.08818808926959634 and parameters: {'model_name': 'SimpleImputer', 'strategy': 'median'}. Best is trial 20 with value: 0.08376317521793836.
[I 2024-01-10 14:25:47,985] Trial 27 finished with value: 0.08818808926959634 and parameters: {'model_name': 'SimpleImputer', 'strategy': 'median'}. Best is trial 20 with value: 0.08376317521793836.
[I 2024-01-10 14:25:49,585] Trial 32 finished with value: 0.08818808926959634 and parameters: {'model_name': 'SimpleImputer', 'strategy': 'median'}. Best is trial 20 with value: 0.08376317521793836.
[I 2024-01-10 14:25:49,933] Trial 50 finished with value: 0.08376317521793836 and parameters: {'model_name': 'SimpleImputer', 'strategy': 'mean'}. Best is trial 20 with value: 0.08376317521793836.
[I 2024-01-10 14:25:50,271] Trial 52 finished with value: 0.0958683975035266 and parameters: {'model_name': 'SimpleImputer', 'strategy': 'constant'}. Best is trial 20 with value: 0.08376317521793836.
[I 2024-01-10 14:25:51,259] Trial 35 finished with value: 0.08818808926959634 and parameters: {'model_name': 'SimpleImputer', 'strategy': 'median'}. Best is trial 20 with value: 0.08376317521793836.
[I 2024-01-10 14:25:51,561] Trial 28 finished with value: 0.08818808926959634 and parameters: {'model_name': 'SimpleImputer', 'strategy': 'median'}. Best is trial 20 with value: 0.08376317521793836.
[I 2024-01-10 14:25:51,820] Trial 33 finished with value: 0.08818808926959634 and parameters: {'model_name': 'SimpleImputer', 'strategy': 'median'}. Best is trial 20 with value: 0.08376317521793836.
[I 2024-01-10 14:25:52,103] Trial 22 finished with value: 0.08818808926959634 and parameters: {'model_name': 'SimpleImputer', 'strategy': 'median'}. Best is trial 20 with value: 0.08376317521793836.
[I 2024-01-10 14:25:52,353] Trial 45 finished with value: 0.08818808926959634 and parameters: {'model_name': 'SimpleImputer', 'strategy': 'median'}. Best is trial 20 with value: 0.08376317521793836.
[I 2024-01-10 14:25:54,050] Trial 41 finished with value: 0.08818808926959634 and parameters: {'model_name': 'SimpleImputer', 'strategy': 'median'}. Best is trial 20 with value: 0.08376317521793836.
[I 2024-01-10 14:25:54,365] Trial 48 finished with value: 0.08376317521793836 and parameters: {'model_name': 'SimpleImputer', 'strategy': 'mean'}. Best is trial 20 with value: 0.08376317521793836.
[I 2024-01-10 14:25:55,188] Trial 51 finished with value: 0.08376317521793836 and parameters: {'model_name': 'SimpleImputer', 'strategy': 'mean'}. Best is trial 20 with value: 0.08376317521793836.
[I 2024-01-10 14:25:56,149] Trial 54 finished with value: 0.08376317521793836 and parameters: {'model_name': 'SimpleImputer', 'strategy': 'mean'}. Best is trial 20 with value: 0.08376317521793836.
[I 2024-01-10 14:25:57,237] Trial 60 finished with value: 0.08376317521793836 and parameters: {'model_name': 'SimpleImputer', 'strategy': 'mean'}. Best is trial 20 with value: 0.08376317521793836.
[I 2024-01-10 14:25:57,742] Trial 62 finished with value: 0.08376317521793836 and parameters: {'model_name': 'SimpleImputer', 'strategy': 'mean'}. Best is trial 20 with value: 0.08376317521793836.
[I 2024-01-10 14:25:58,505] Trial 61 finished with value: 0.08376317521793836 and parameters: {'model_name': 'SimpleImputer', 'strategy': 'mean'}. Best is trial 20 with value: 0.08376317521793836.
[I 2024-01-10 14:25:58,865] Trial 59 finished with value: 0.08376317521793836 and parameters: {'model_name': 'SimpleImputer', 'strategy': 'mean'}. Best is trial 20 with value: 0.08376317521793836.
[I 2024-01-10 14:26:05,804] Trial 49 finished with value: 0.08818808926959634 and parameters: {'model_name': 'SimpleImputer', 'strategy': 'median'}. Best is trial 20 with value: 0.08376317521793836.
[I 2024-01-10 14:26:07,065] Trial 55 finished with value: 0.08818808926959634 and parameters: {'model_name': 'SimpleImputer', 'strategy': 'median'}. Best is trial 20 with value: 0.08376317521793836.
[I 2024-01-10 14:26:07,920] Trial 53 finished with value: 0.08818808926959634 and parameters: {'model_name': 'SimpleImputer', 'strategy': 'median'}. Best is trial 20 with value: 0.08376317521793836.
[I 2024-01-10 14:26:11,370] Trial 65 finished with value: 0.08818808926959634 and parameters: {'model_name': 'SimpleImputer', 'strategy': 'median'}. Best is trial 20 with value: 0.08376317521793836.
[I 2024-01-10 14:26:12,440] Trial 66 finished with value: 0.08818808926959634 and parameters: {'model_name': 'SimpleImputer', 'strategy': 'median'}. Best is trial 20 with value: 0.08376317521793836.
[I 2024-01-10 14:26:13,789] Trial 71 finished with value: 0.08818808926959634 and parameters: {'model_name': 'SimpleImputer', 'strategy': 'median'}. Best is trial 20 with value: 0.08376317521793836.
[I 2024-01-10 14:33:26,329] Trial 34 finished with value: 0.08818808926959634 and parameters: {'model_name': 'SimpleImputer', 'strategy': 'most_frequent'}. Best is trial 20 with value: 0.08376317521793836.
[I 2024-01-10 14:33:27,019] Trial 86 finished with value: 0.08818808926959634 and parameters: {'model_name': 'SimpleImputer', 'strategy': 'most_frequent'}. Best is trial 20 with value: 0.08376317521793836.
[I 2024-01-10 14:33:32,886] Trial 72 finished with value: 0.08818808926959634 and parameters: {'model_name': 'SimpleImputer', 'strategy': 'most_frequent'}. Best is trial 20 with value: 0.08376317521793836.
[I 2024-01-10 14:33:34,661] Trial 23 finished with value: 0.08818808926959634 and parameters: {'model_name': 'SimpleImputer', 'strategy': 'most_frequent'}. Best is trial 20 with value: 0.08376317521793836.
[I 2024-01-10 14:33:35,361] Trial 103 finished with value: 0.08376317521793836 and parameters: {'model_name': 'SimpleImputer', 'strategy': 'mean'}. Best is trial 20 with value: 0.08376317521793836.
[I 2024-01-10 14:33:35,750] Trial 81 finished with value: 0.08818808926959634 and parameters: {'model_name': 'SimpleImputer', 'strategy': 'most_frequent'}. Best is trial 20 with value: 0.08376317521793836.
[I 2024-01-10 14:33:44,041] Trial 95 finished with value: 0.08818808926959634 and parameters: {'model_name': 'SimpleImputer', 'strategy': 'most_frequent'}. Best is trial 20 with value: 0.08376317521793836.
[I 2024-01-10 14:33:44,322] Trial 69 finished with value: 0.08818808926959634 and parameters: {'model_name': 'SimpleImputer', 'strategy': 'most_frequent'}. Best is trial 20 with value: 0.08376317521793836.
[I 2024-01-10 14:33:45,593] Trial 104 finished with value: 0.08376317521793836 and parameters: {'model_name': 'SimpleImputer', 'strategy': 'mean'}. Best is trial 20 with value: 0.08376317521793836.
[I 2024-01-10 14:33:46,799] Trial 106 finished with value: 0.08376317521793836 and parameters: {'model_name': 'SimpleImputer', 'strategy': 'mean'}. Best is trial 20 with value: 0.08376317521793836.
[I 2024-01-10 14:33:47,767] Trial 105 finished with value: 0.08376317521793836 and parameters: {'model_name': 'SimpleImputer', 'strategy': 'mean'}. Best is trial 20 with value: 0.08376317521793836.
[I 2024-01-10 14:33:48,646] Trial 107 finished with value: 0.08376317521793836 and parameters: {'model_name': 'SimpleImputer', 'strategy': 'mean'}. Best is trial 20 with value: 0.08376317521793836.
[I 2024-01-10 14:33:49,741] Trial 74 finished with value: 0.08818808926959634 and parameters: {'model_name': 'SimpleImputer', 'strategy': 'most_frequent'}. Best is trial 20 with value: 0.08376317521793836.
[I 2024-01-10 14:33:54,538] Trial 17 finished with value: 0.08818808926959634 and parameters: {'model_name': 'SimpleImputer', 'strategy': 'most_frequent'}. Best is trial 20 with value: 0.08376317521793836.
[I 2024-01-10 14:33:55,034] Trial 37 finished with value: 0.08818808926959634 and parameters: {'model_name': 'SimpleImputer', 'strategy': 'most_frequent'}. Best is trial 20 with value: 0.08376317521793836.
[I 2024-01-10 14:33:57,984] Trial 93 finished with value: 0.08818808926959634 and parameters: {'model_name': 'SimpleImputer', 'strategy': 'most_frequent'}. Best is trial 20 with value: 0.08376317521793836.
[I 2024-01-10 14:33:58,815] Trial 91 finished with value: 0.08818808926959634 and parameters: {'model_name': 'SimpleImputer', 'strategy': 'most_frequent'}. Best is trial 20 with value: 0.08376317521793836.
[I 2024-01-10 14:33:59,418] Trial 30 finished with value: 0.08818808926959634 and parameters: {'model_name': 'SimpleImputer', 'strategy': 'most_frequent'}. Best is trial 20 with value: 0.08376317521793836.
[I 2024-01-10 14:34:02,084] Trial 109 finished with value: 0.08376317521793836 and parameters: {'model_name': 'SimpleImputer', 'strategy': 'mean'}. Best is trial 20 with value: 0.08376317521793836.
[I 2024-01-10 14:34:02,266] Trial 108 finished with value: 0.08376317521793836 and parameters: {'model_name': 'SimpleImputer', 'strategy': 'mean'}. Best is trial 20 with value: 0.08376317521793836.
[I 2024-01-10 14:34:03,784] Trial 111 finished with value: 0.08376317521793836 and parameters: {'model_name': 'SimpleImputer', 'strategy': 'mean'}. Best is trial 20 with value: 0.08376317521793836.
[I 2024-01-10 14:34:04,286] Trial 110 finished with value: 0.08376317521793836 and parameters: {'model_name': 'SimpleImputer', 'strategy': 'mean'}. Best is trial 20 with value: 0.08376317521793836.
[I 2024-01-10 14:34:06,684] Trial 83 finished with value: 0.08818808926959634 and parameters: {'model_name': 'SimpleImputer', 'strategy': 'most_frequent'}. Best is trial 20 with value: 0.08376317521793836.
[I 2024-01-10 14:34:07,192] Trial 87 finished with value: 0.08818808926959634 and parameters: {'model_name': 'SimpleImputer', 'strategy': 'most_frequent'}. Best is trial 20 with value: 0.08376317521793836.
[I 2024-01-10 14:34:08,559] Trial 112 finished with value: 0.08376317521793836 and parameters: {'model_name': 'SimpleImputer', 'strategy': 'mean'}. Best is trial 20 with value: 0.08376317521793836.
[I 2024-01-10 14:34:09,025] Trial 113 finished with value: 0.08376317521793836 and parameters: {'model_name': 'SimpleImputer', 'strategy': 'mean'}. Best is trial 20 with value: 0.08376317521793836.
[I 2024-01-10 14:34:09,587] Trial 114 finished with value: 0.08376317521793836 and parameters: {'model_name': 'SimpleImputer', 'strategy': 'mean'}. Best is trial 20 with value: 0.08376317521793836.
[I 2024-01-10 14:34:10,125] Trial 58 finished with value: 0.08818808926959634 and parameters: {'model_name': 'SimpleImputer', 'strategy': 'most_frequent'}. Best is trial 20 with value: 0.08376317521793836.
[I 2024-01-10 14:34:11,492] Trial 78 finished with value: 0.08818808926959634 and parameters: {'model_name': 'SimpleImputer', 'strategy': 'most_frequent'}. Best is trial 20 with value: 0.08376317521793836.
[I 2024-01-10 14:34:14,095] Trial 64 finished with value: 0.08818808926959634 and parameters: {'model_name': 'SimpleImputer', 'strategy': 'most_frequent'}. Best is trial 20 with value: 0.08376317521793836.
[I 2024-01-10 14:34:14,536] Trial 75 finished with value: 0.08818808926959634 and parameters: {'model_name': 'SimpleImputer', 'strategy': 'most_frequent'}. Best is trial 20 with value: 0.08376317521793836.
[I 2024-01-10 14:34:18,820] Trial 57 finished with value: 0.08818808926959634 and parameters: {'model_name': 'SimpleImputer', 'strategy': 'most_frequent'}. Best is trial 20 with value: 0.08376317521793836.
[I 2024-01-10 14:34:19,226] Trial 70 finished with value: 0.08818808926959634 and parameters: {'model_name': 'SimpleImputer', 'strategy': 'most_frequent'}. Best is trial 20 with value: 0.08376317521793836.
[I 2024-01-10 14:34:19,616] Trial 68 finished with value: 0.08818808926959634 and parameters: {'model_name': 'SimpleImputer', 'strategy': 'most_frequent'}. Best is trial 20 with value: 0.08376317521793836.
[I 2024-01-10 14:34:21,443] Trial 116 finished with value: 0.08376317521793836 and parameters: {'model_name': 'SimpleImputer', 'strategy': 'mean'}. Best is trial 20 with value: 0.08376317521793836.
[I 2024-01-10 14:34:23,150] Trial 88 finished with value: 0.08818808926959634 and parameters: {'model_name': 'SimpleImputer', 'strategy': 'most_frequent'}. Best is trial 20 with value: 0.08376317521793836.
[I 2024-01-10 14:34:23,375] Trial 115 finished with value: 0.08376317521793836 and parameters: {'model_name': 'SimpleImputer', 'strategy': 'mean'}. Best is trial 20 with value: 0.08376317521793836.
[I 2024-01-10 14:34:25,040] Trial 40 finished with value: 0.08818808926959634 and parameters: {'model_name': 'SimpleImputer', 'strategy': 'most_frequent'}. Best is trial 20 with value: 0.08376317521793836.
[I 2024-01-10 14:34:26,000] Trial 97 finished with value: 0.08818808926959634 and parameters: {'model_name': 'SimpleImputer', 'strategy': 'most_frequent'}. Best is trial 20 with value: 0.08376317521793836.
[I 2024-01-10 14:34:28,760] Trial 117 finished with value: 0.08376317521793836 and parameters: {'model_name': 'SimpleImputer', 'strategy': 'mean'}. Best is trial 20 with value: 0.08376317521793836.
[I 2024-01-10 14:34:29,679] Trial 118 finished with value: 0.08376317521793836 and parameters: {'model_name': 'SimpleImputer', 'strategy': 'mean'}. Best is trial 20 with value: 0.08376317521793836.
[I 2024-01-10 14:34:32,192] Trial 119 finished with value: 0.08376317521793836 and parameters: {'model_name': 'SimpleImputer', 'strategy': 'mean'}. Best is trial 20 with value: 0.08376317521793836.
[I 2024-01-10 14:34:34,676] Trial 120 finished with value: 0.08376317521793836 and parameters: {'model_name': 'SimpleImputer', 'strategy': 'mean'}. Best is trial 20 with value: 0.08376317521793836.
