[I 2024-02-28 20:01:19,082] Trial 5 finished with value: 4.534446891355696 and parameters: {'model_name': 'SimpleImputer', 'strategy': 'mean'}. Best is trial 5 with value: 4.534446891355696.
[I 2024-02-28 20:01:20,280] Trial 9 finished with value: 4.534446891355696 and parameters: {'model_name': 'SimpleImputer', 'strategy': 'mean'}. Best is trial 5 with value: 4.534446891355696.
[I 2024-02-28 20:01:21,054] Trial 8 finished with value: 4.620551813891361 and parameters: {'model_name': 'SimpleImputer', 'strategy': 'median'}. Best is trial 5 with value: 4.534446891355696.
[I 2024-02-28 20:01:21,574] Trial 18 finished with value: 4.620551813891361 and parameters: {'model_name': 'SimpleImputer', 'strategy': 'constant'}. Best is trial 5 with value: 4.534446891355696.
[I 2024-02-28 20:01:22,431] Trial 6 finished with value: 4.620551813891361 and parameters: {'model_name': 'SimpleImputer', 'strategy': 'most_frequent'}. Best is trial 5 with value: 4.534446891355696.
[I 2024-02-28 20:01:23,594] Trial 23 finished with value: 4.620551813891361 and parameters: {'model_name': 'SimpleImputer', 'strategy': 'constant'}. Best is trial 5 with value: 4.534446891355696.
[I 2024-02-28 20:01:24,453] Trial 39 finished with value: 4.534446891355696 and parameters: {'model_name': 'SimpleImputer', 'strategy': 'mean'}. Best is trial 5 with value: 4.534446891355696.
[I 2024-02-28 20:01:25,337] Trial 48 finished with value: 4.534446891355696 and parameters: {'model_name': 'SimpleImputer', 'strategy': 'mean'}. Best is trial 5 with value: 4.534446891355696.
[I 2024-02-28 20:01:25,830] Trial 43 finished with value: 4.534446891355696 and parameters: {'model_name': 'SimpleImputer', 'strategy': 'mean'}. Best is trial 5 with value: 4.534446891355696.
2024-02-28 20:01:26.726118: E external/local_xla/xla/stream_executor/cuda/cuda_driver.cc:274] failed call to cuInit: CUDA_ERROR_NO_DEVICE: no CUDA-capable device is detected
2024-02-28 20:01:27.075681: I tensorflow/compiler/mlir/mlir_graph_optimization_pass.cc:388] MLIR V1 optimization pass is not enabled
[I 2024-02-28 20:01:27,461] Trial 42 finished with value: 4.620551813891361 and parameters: {'model_name': 'SimpleImputer', 'strategy': 'median'}. Best is trial 5 with value: 4.534446891355696.
[I 2024-02-28 20:01:28,711] Trial 47 finished with value: 4.620551813891361 and parameters: {'model_name': 'SimpleImputer', 'strategy': 'median'}. Best is trial 5 with value: 4.534446891355696.
[I 2024-02-28 20:01:29,578] Trial 55 finished with value: 4.620551813891361 and parameters: {'model_name': 'SimpleImputer', 'strategy': 'constant'}. Best is trial 5 with value: 4.534446891355696.
[I 2024-02-28 20:01:31,149] Trial 26 finished with value: 4.620551813891361 and parameters: {'model_name': 'SimpleImputer', 'strategy': 'most_frequent'}. Best is trial 5 with value: 4.534446891355696.
[I 2024-02-28 20:01:32,485] Trial 40 finished with value: 4.620551813891361 and parameters: {'model_name': 'SimpleImputer', 'strategy': 'most_frequent'}. Best is trial 5 with value: 4.534446891355696.
[I 2024-02-28 20:01:32,486] Trial 31 finished with value: 4.620551813891361 and parameters: {'model_name': 'SimpleImputer', 'strategy': 'most_frequent'}. Best is trial 5 with value: 4.534446891355696.
[I 2024-02-28 20:01:35,980] Trial 3 finished with value: 4.5723608200052634 and parameters: {'model_name': 'KNNImputer', 'weights': 'uniform', 'keep_empty_features': False}. Best is trial 5 with value: 4.534446891355696.
[I 2024-02-28 20:01:37,074] Trial 0 finished with value: 4.5723608200052634 and parameters: {'model_name': 'KNNImputer', 'weights': 'distance', 'keep_empty_features': False}. Best is trial 5 with value: 4.534446891355696.
[I 2024-02-28 20:01:38,136] Trial 17 finished with value: 4.5723608200052634 and parameters: {'model_name': 'KNNImputer', 'weights': 'uniform', 'keep_empty_features': False}. Best is trial 5 with value: 4.534446891355696.
[I 2024-02-28 20:01:39,256] Trial 19 finished with value: 4.5723608200052634 and parameters: {'model_name': 'KNNImputer', 'weights': 'uniform', 'keep_empty_features': False}. Best is trial 5 with value: 4.534446891355696.
[I 2024-02-28 20:01:40,375] Trial 28 finished with value: 4.5723608200052634 and parameters: {'model_name': 'KNNImputer', 'weights': 'uniform', 'keep_empty_features': False}. Best is trial 5 with value: 4.534446891355696.
[I 2024-02-28 20:01:41,171] Trial 38 finished with value: 4.5723608200052634 and parameters: {'model_name': 'KNNImputer', 'weights': 'distance', 'keep_empty_features': False}. Best is trial 5 with value: 4.534446891355696.
[I 2024-02-28 20:01:41,944] Trial 25 finished with value: 4.5723608200052634 and parameters: {'model_name': 'KNNImputer', 'weights': 'distance', 'keep_empty_features': False}. Best is trial 5 with value: 4.534446891355696.
[I 2024-02-28 20:01:42,741] Trial 24 finished with value: 4.5723608200052634 and parameters: {'model_name': 'KNNImputer', 'weights': 'distance', 'keep_empty_features': False}. Best is trial 5 with value: 4.534446891355696.
[I 2024-02-28 20:01:43,845] Trial 52 finished with value: 4.5723608200052634 and parameters: {'model_name': 'KNNImputer', 'weights': 'distance', 'keep_empty_features': False}. Best is trial 5 with value: 4.534446891355696.
[I 2024-02-28 20:01:45,598] Trial 58 finished with value: 4.5723608200052634 and parameters: {'model_name': 'KNNImputer', 'weights': 'distance', 'keep_empty_features': False}. Best is trial 5 with value: 4.534446891355696.
[I 2024-02-28 20:01:46,777] Trial 60 finished with value: 4.5723608200052634 and parameters: {'model_name': 'KNNImputer', 'weights': 'distance', 'keep_empty_features': False}. Best is trial 5 with value: 4.534446891355696.
[I 2024-02-28 20:01:47,680] Trial 61 finished with value: 4.5723608200052634 and parameters: {'model_name': 'KNNImputer', 'weights': 'uniform', 'keep_empty_features': False}. Best is trial 5 with value: 4.534446891355696.
[I 2024-02-28 20:01:51,880] Trial 57 finished with value: 4.534446891355696 and parameters: {'model_name': 'RandomForestImputer', 'max_iter': 1, 'decreasing': False, 'min_samples_split': 0.6000000000000001, 'min_samples_leaf': 0.7000000000000001, 'max_features': 0.9, 'warm_start': True}. Best is trial 5 with value: 4.534446891355696.
[I 2024-02-28 20:01:54,580] Trial 63 finished with value: 4.534446891355696 and parameters: {'model_name': 'RandomForestImputer', 'max_iter': 1, 'decreasing': False, 'min_samples_split': 0.5, 'min_samples_leaf': 0.4, 'max_features': 0.6, 'warm_start': True}. Best is trial 5 with value: 4.534446891355696.
[I 2024-02-28 20:02:03,274] Trial 20 finished with value: 4.606672870070075 and parameters: {'model_name': 'RandomForestImputer', 'max_iter': 2, 'decreasing': False, 'min_samples_split': 0.6000000000000001, 'min_samples_leaf': 0.5, 'max_features': 0.8, 'warm_start': True}. Best is trial 5 with value: 4.534446891355696.
[I 2024-02-28 20:02:15,051] Trial 37 finished with value: 4.5346977318521775 and parameters: {'model_name': 'IterativeImputer', 'sample_posterior': False, 'initial_strategy': 'constant', 'imputation_order': 'random'}. Best is trial 5 with value: 4.534446891355696.
[I 2024-02-28 20:02:16,185] Trial 16 finished with value: 4.534446891355696 and parameters: {'model_name': 'RandomForestImputer', 'max_iter': 1, 'decreasing': False, 'min_samples_split': 0.2, 'min_samples_leaf': 0.9, 'max_features': 0.4, 'warm_start': False}. Best is trial 5 with value: 4.534446891355696.
[I 2024-02-28 20:02:16,930] Trial 22 finished with value: 4.534446891355696 and parameters: {'model_name': 'RandomForestImputer', 'max_iter': 1, 'decreasing': True, 'min_samples_split': 0.8, 'min_samples_leaf': 0.7000000000000001, 'max_features': 0.1, 'warm_start': False}. Best is trial 5 with value: 4.534446891355696.
[I 2024-02-28 20:02:17,991] Trial 33 finished with value: 4.534446891355696 and parameters: {'model_name': 'RandomForestImputer', 'max_iter': 1, 'decreasing': False, 'min_samples_split': 1.0, 'min_samples_leaf': 0.9, 'max_features': 0.2, 'warm_start': False}. Best is trial 5 with value: 4.534446891355696.
[I 2024-02-28 20:02:18,846] Trial 15 finished with value: 4.534697322705533 and parameters: {'model_name': 'IterativeImputer', 'sample_posterior': False, 'initial_strategy': 'mean', 'imputation_order': 'random'}. Best is trial 5 with value: 4.534446891355696.
[I 2024-02-28 20:02:19,408] Trial 46 finished with value: 4.595877747980245 and parameters: {'model_name': 'RandomForestImputer', 'max_iter': 6, 'decreasing': True, 'min_samples_split': 0.30000000000000004, 'min_samples_leaf': 0.7000000000000001, 'max_features': 0.30000000000000004, 'warm_start': True}. Best is trial 5 with value: 4.534446891355696.
[I 2024-02-28 20:02:22,829] Trial 66 finished with value: 4.53469807100608 and parameters: {'model_name': 'IterativeImputer', 'sample_posterior': False, 'initial_strategy': 'constant', 'imputation_order': 'random'}. Best is trial 5 with value: 4.534446891355696.
[I 2024-02-28 20:02:25,492] Trial 35 finished with value: 4.534697305118547 and parameters: {'model_name': 'IterativeImputer', 'sample_posterior': False, 'initial_strategy': 'median', 'imputation_order': 'roman'}. Best is trial 5 with value: 4.534446891355696.
[I 2024-02-28 20:02:26,261] Trial 74 finished with value: 4.534446891355696 and parameters: {'model_name': 'RandomForestImputer', 'max_iter': 1, 'decreasing': True, 'min_samples_split': 0.7000000000000001, 'min_samples_leaf': 0.2, 'max_features': 0.30000000000000004, 'warm_start': False}. Best is trial 5 with value: 4.534446891355696.
[I 2024-02-28 20:02:27,098] Trial 65 finished with value: 4.607926480926734 and parameters: {'model_name': 'RandomForestImputer', 'max_iter': 7, 'decreasing': False, 'min_samples_split': 0.6000000000000001, 'min_samples_leaf': 0.8, 'max_features': 0.30000000000000004, 'warm_start': True}. Best is trial 5 with value: 4.534446891355696.
[I 2024-02-28 20:02:29,642] Trial 69 finished with value: 4.534695933451804 and parameters: {'model_name': 'IterativeImputer', 'sample_posterior': False, 'initial_strategy': 'median', 'imputation_order': 'random'}. Best is trial 5 with value: 4.534446891355696.
[I 2024-02-28 20:02:33,447] Trial 41 finished with value: 4.927138451287783 and parameters: {'model_name': 'GAIN', 'batch_size': 97, 'hint_rate': 0.64, 'alpha': 2, 'iterations': 2}. Best is trial 5 with value: 4.534446891355696.
[I 2024-02-28 20:02:43,878] Trial 13 finished with value: 5.196825847571738 and parameters: {'model_name': 'GAIN', 'batch_size': 21, 'hint_rate': 0.21000000000000002, 'alpha': 11, 'iterations': 9}. Best is trial 5 with value: 4.534446891355696.
[I 2024-02-28 20:02:54,826] Trial 87 finished with value: 4.960401775532548 and parameters: {'model_name': 'GAIN', 'batch_size': 24, 'hint_rate': 0.09999999999999999, 'alpha': 80, 'iterations': 1}. Best is trial 5 with value: 4.534446891355696.
[I 2024-02-28 20:02:58,181] Trial 10 finished with value: 4.607786169182002 and parameters: {'model_name': 'RandomForestImputer', 'max_iter': 25, 'decreasing': False, 'min_samples_split': 0.2, 'min_samples_leaf': 0.1, 'max_features': 0.30000000000000004, 'warm_start': True}. Best is trial 5 with value: 4.534446891355696.
[I 2024-02-28 20:03:05,412] Trial 56 finished with value: 4.527402366109708 and parameters: {'model_name': 'GAIN', 'batch_size': 845, 'hint_rate': 0.9400000000000001, 'alpha': 54, 'iterations': 14}. Best is trial 56 with value: 4.527402366109708.
[I 2024-02-28 20:03:06,537] Trial 4 finished with value: 4.543672602506401 and parameters: {'model_name': 'RandomForestImputer', 'max_iter': 2, 'decreasing': True, 'min_samples_split': 0.4, 'min_samples_leaf': 0.4, 'max_features': 0.2, 'warm_start': False}. Best is trial 56 with value: 4.527402366109708.
[I 2024-02-28 20:03:09,161] Trial 49 finished with value: 4.546804554642588 and parameters: {'model_name': 'RandomForestImputer', 'max_iter': 2, 'decreasing': False, 'min_samples_split': 0.1, 'min_samples_leaf': 0.6, 'max_features': 0.5, 'warm_start': False}. Best is trial 56 with value: 4.527402366109708.
[I 2024-02-28 20:03:10,858] Trial 93 finished with value: inf and parameters: {'model_name': 'GAIN', 'batch_size': 952, 'hint_rate': 0.97, 'alpha': 53, 'iterations': 2898}. Best is trial 56 with value: 4.527402366109708.
[I 2024-02-28 20:03:12,176] Trial 64 finished with value: 4.598335121130582 and parameters: {'model_name': 'RandomForestImputer', 'max_iter': 30, 'decreasing': True, 'min_samples_split': 0.4, 'min_samples_leaf': 0.4, 'max_features': 0.9, 'warm_start': True}. Best is trial 56 with value: 4.527402366109708.
[I 2024-02-28 20:03:14,418] Trial 95 finished with value: inf and parameters: {'model_name': 'GAIN', 'batch_size': 909, 'hint_rate': 0.98, 'alpha': 56, 'iterations': 3675}. Best is trial 56 with value: 4.527402366109708.
[I 2024-02-28 20:03:16,042] Trial 81 finished with value: 5.09840713429794 and parameters: {'model_name': 'GAIN', 'batch_size': 75, 'hint_rate': 0.4, 'alpha': 45, 'iterations': 9}. Best is trial 56 with value: 4.527402366109708.
[I 2024-02-28 20:03:20,782] Trial 76 finished with value: 4.37523880488338 and parameters: {'model_name': 'GAIN', 'batch_size': 2, 'hint_rate': 0.27, 'alpha': 70, 'iterations': 19}. Best is trial 76 with value: 4.37523880488338.
[I 2024-02-28 20:03:21,836] Trial 45 finished with value: 4.296109586296536 and parameters: {'model_name': 'GAIN', 'batch_size': 97, 'hint_rate': 0.9500000000000001, 'alpha': 35, 'iterations': 22}. Best is trial 45 with value: 4.296109586296536.
[I 2024-02-28 20:03:36,886] Trial 98 finished with value: 4.534446891355696 and parameters: {'model_name': 'RandomForestImputer', 'max_iter': 1, 'decreasing': False, 'min_samples_split': 1.0, 'min_samples_leaf': 0.9, 'max_features': 0.1, 'warm_start': False}. Best is trial 45 with value: 4.296109586296536.
[I 2024-02-28 20:03:38,511] Trial 99 finished with value: 4.534446891355696 and parameters: {'model_name': 'RandomForestImputer', 'max_iter': 1, 'decreasing': False, 'min_samples_split': 1.0, 'min_samples_leaf': 0.9, 'max_features': 0.1, 'warm_start': False}. Best is trial 45 with value: 4.296109586296536.
[I 2024-02-28 20:03:47,094] Trial 32 finished with value: 4.598544684377561 and parameters: {'model_name': 'RandomForestImputer', 'max_iter': 75, 'decreasing': True, 'min_samples_split': 0.4, 'min_samples_leaf': 0.7000000000000001, 'max_features': 0.4, 'warm_start': True}. Best is trial 45 with value: 4.296109586296536.
[I 2024-02-28 20:04:02,226] Trial 92 finished with value: 4.533451112104427 and parameters: {'model_name': 'RandomForestImputer', 'max_iter': 2, 'decreasing': True, 'min_samples_split': 1.0, 'min_samples_leaf': 0.9, 'max_features': 0.1, 'warm_start': False}. Best is trial 45 with value: 4.296109586296536.
[I 2024-02-28 20:04:17,551] Trial 78 finished with value: 4.6560182381222495 and parameters: {'model_name': 'GAIN', 'batch_size': 1, 'hint_rate': 0.3, 'alpha': 41, 'iterations': 45}. Best is trial 45 with value: 4.296109586296536.
[I 2024-02-28 20:04:24,410] Trial 62 finished with value: 4.538803016304503 and parameters: {'model_name': 'RandomForestImputer', 'max_iter': 6, 'decreasing': False, 'min_samples_split': 0.2, 'min_samples_leaf': 0.1, 'max_features': 0.9, 'warm_start': False}. Best is trial 45 with value: 4.296109586296536.
[I 2024-02-28 20:04:45,865] Trial 86 finished with value: 4.376817582237531 and parameters: {'model_name': 'GAIN', 'batch_size': 2, 'hint_rate': 0.66, 'alpha': 61, 'iterations': 64}. Best is trial 45 with value: 4.296109586296536.
[I 2024-02-28 20:04:48,640] Trial 71 finished with value: 4.539722774911769 and parameters: {'model_name': 'RandomForestImputer', 'max_iter': 8, 'decreasing': False, 'min_samples_split': 0.7000000000000001, 'min_samples_leaf': 0.4, 'max_features': 0.7000000000000001, 'warm_start': False}. Best is trial 45 with value: 4.296109586296536.
[I 2024-02-28 20:05:13,811] Trial 12 finished with value: 4.955280292713516 and parameters: {'model_name': 'IterativeImputer', 'sample_posterior': True, 'initial_strategy': 'median', 'imputation_order': 'ascending'}. Best is trial 45 with value: 4.296109586296536.
[I 2024-02-28 20:05:17,387] Trial 53 finished with value: 4.638096316517176 and parameters: {'model_name': 'IterativeImputer', 'sample_posterior': True, 'initial_strategy': 'constant', 'imputation_order': 'arabic'}. Best is trial 45 with value: 4.296109586296536.
[I 2024-02-28 20:05:21,207] Trial 44 finished with value: 4.581667254438162 and parameters: {'model_name': 'IterativeImputer', 'sample_posterior': True, 'initial_strategy': 'mean', 'imputation_order': 'arabic'}. Best is trial 45 with value: 4.296109586296536.
[I 2024-02-28 20:05:27,374] Trial 101 finished with value: 4.315361321338155 and parameters: {'model_name': 'GAIN', 'batch_size': 1, 'hint_rate': 0.74, 'alpha': 35, 'iterations': 66}. Best is trial 45 with value: 4.296109586296536.
[I 2024-02-28 20:05:32,175] Trial 102 finished with value: 4.285792843444668 and parameters: {'model_name': 'GAIN', 'batch_size': 1, 'hint_rate': 0.73, 'alpha': 71, 'iterations': 58}. Best is trial 102 with value: 4.285792843444668.
[I 2024-02-28 20:05:37,100] Trial 104 finished with value: 4.496488097037229 and parameters: {'model_name': 'GAIN', 'batch_size': 1, 'hint_rate': 0.7100000000000001, 'alpha': 73, 'iterations': 58}. Best is trial 102 with value: 4.285792843444668.
[I 2024-02-28 20:06:00,144] Trial 75 finished with value: 4.2907873224487325 and parameters: {'model_name': 'GAIN', 'batch_size': 4, 'hint_rate': 0.01, 'alpha': 72, 'iterations': 120}. Best is trial 102 with value: 4.285792843444668.
[I 2024-02-28 20:06:19,087] Trial 105 finished with value: 4.601455544706446 and parameters: {'model_name': 'GAIN', 'batch_size': 2, 'hint_rate': 0.73, 'alpha': 36, 'iterations': 78}. Best is trial 102 with value: 4.285792843444668.
[I 2024-02-28 20:06:20,635] Trial 100 finished with value: 4.577801715117813 and parameters: {'model_name': 'GAIN', 'batch_size': 1, 'hint_rate': 0.62, 'alpha': 89, 'iterations': 95}. Best is trial 102 with value: 4.285792843444668.
[I 2024-02-28 20:06:23,380] Trial 103 finished with value: 4.272587844056359 and parameters: {'model_name': 'GAIN', 'batch_size': 1, 'hint_rate': 0.7000000000000001, 'alpha': 35, 'iterations': 82}. Best is trial 103 with value: 4.272587844056359.
[I 2024-02-28 20:06:41,521] Trial 107 finished with value: 4.069146850012111 and parameters: {'model_name': 'GAIN', 'batch_size': 1, 'hint_rate': 0.7100000000000001, 'alpha': 76, 'iterations': 76}. Best is trial 107 with value: 4.069146850012111.
[I 2024-02-28 20:07:00,523] Trial 59 finished with value: 4.24010280208832 and parameters: {'model_name': 'GAIN', 'batch_size': 1, 'hint_rate': 0.74, 'alpha': 1, 'iterations': 163}. Best is trial 107 with value: 4.069146850012111.
[I 2024-02-28 20:07:11,803] Trial 108 finished with value: 4.5025259395042685 and parameters: {'model_name': 'GAIN', 'batch_size': 2, 'hint_rate': 0.72, 'alpha': 72, 'iterations': 75}. Best is trial 107 with value: 4.069146850012111.
[I 2024-02-28 20:07:22,267] Trial 68 finished with value: 4.046287952335215 and parameters: {'model_name': 'GAIN', 'batch_size': 1, 'hint_rate': 0.39, 'alpha': 77, 'iterations': 173}. Best is trial 68 with value: 4.046287952335215.
[I 2024-02-28 20:07:25,682] Trial 115 finished with value: 4.322802849572185 and parameters: {'model_name': 'GAIN', 'batch_size': 1, 'hint_rate': 0.67, 'alpha': 74, 'iterations': 55}. Best is trial 68 with value: 4.046287952335215.
[I 2024-02-28 20:07:28,859] Trial 77 finished with value: 4.52133462868534 and parameters: {'model_name': 'GAIN', 'batch_size': 480, 'hint_rate': 0.9400000000000001, 'alpha': 30, 'iterations': 134}. Best is trial 68 with value: 4.046287952335215.
[I 2024-02-28 20:07:32,135] Trial 106 finished with value: 4.543841722596783 and parameters: {'model_name': 'GAIN', 'batch_size': 1, 'hint_rate': 0.7000000000000001, 'alpha': 78, 'iterations': 104}. Best is trial 68 with value: 4.046287952335215.
[I 2024-02-28 20:07:34,340] Trial 113 finished with value: 4.044652783611778 and parameters: {'model_name': 'GAIN', 'batch_size': 1, 'hint_rate': 0.73, 'alpha': 71, 'iterations': 56}. Best is trial 113 with value: 4.044652783611778.
[I 2024-02-28 20:07:38,962] Trial 111 finished with value: 4.374052120558161 and parameters: {'model_name': 'GAIN', 'batch_size': 2, 'hint_rate': 0.73, 'alpha': 74, 'iterations': 69}. Best is trial 113 with value: 4.044652783611778.
[I 2024-02-28 20:07:41,380] Trial 109 finished with value: 4.3138196251022745 and parameters: {'model_name': 'GAIN', 'batch_size': 2, 'hint_rate': 0.72, 'alpha': 73, 'iterations': 90}. Best is trial 113 with value: 4.044652783611778.
[I 2024-02-28 20:07:47,810] Trial 97 finished with value: 4.625224364854105 and parameters: {'model_name': 'GAIN', 'batch_size': 2, 'hint_rate': 0.99, 'alpha': 100, 'iterations': 153}. Best is trial 113 with value: 4.044652783611778.
[I 2024-02-28 20:07:51,864] Trial 114 finished with value: 4.4065212523252155 and parameters: {'model_name': 'GAIN', 'batch_size': 1, 'hint_rate': 0.7100000000000001, 'alpha': 73, 'iterations': 65}. Best is trial 113 with value: 4.044652783611778.
[I 2024-02-28 20:07:58,572] Trial 112 finished with value: 4.162639209538836 and parameters: {'model_name': 'GAIN', 'batch_size': 2, 'hint_rate': 0.6900000000000001, 'alpha': 72, 'iterations': 80}. Best is trial 113 with value: 4.044652783611778.
[I 2024-02-28 20:08:05,029] Trial 118 finished with value: 4.887187748189307 and parameters: {'model_name': 'GAIN', 'batch_size': 2, 'hint_rate': 0.8200000000000001, 'alpha': 70, 'iterations': 39}. Best is trial 113 with value: 4.044652783611778.
[I 2024-02-28 20:08:06,756] Trial 82 finished with value: 4.247463805821929 and parameters: {'model_name': 'GAIN', 'batch_size': 2, 'hint_rate': 0.61, 'alpha': 34, 'iterations': 185}. Best is trial 113 with value: 4.044652783611778.
