Run: 1
/cm/local/apps/slurm/var/spool/job844256/slurm_script: line 23: /common/ketrong/minconda3/etc/profile.d/conda.sh: No such file or directory
/cm/local/apps/slurm/var/spool/job844256/slurm_script: line 26: $'\nconda create --name tpot2devenv -c conda-forge python=3.10\n': command not found
/cm/local/apps/slurm/var/spool/job844256/slurm_script: line 31: $'\npip install -r requirements.txt\n': command not found
RunStart
2024-04-28 15:17:08.900496: I tensorflow/core/util/port.cc:113] oneDNN custom operations are on. You may see slightly different numerical results due to floating-point round-off errors from different computation orders. To turn them off, set the environment variable `TF_ENABLE_ONEDNN_OPTS=0`.
2024-04-28 15:17:08.938521: E external/local_xla/xla/stream_executor/cuda/cuda_dnn.cc:9261] Unable to register cuDNN factory: Attempting to register factory for plugin cuDNN when one has already been registered
2024-04-28 15:17:08.938547: E external/local_xla/xla/stream_executor/cuda/cuda_fft.cc:607] Unable to register cuFFT factory: Attempting to register factory for plugin cuFFT when one has already been registered
2024-04-28 15:17:08.939668: E external/local_xla/xla/stream_executor/cuda/cuda_blas.cc:1515] Unable to register cuBLAS factory: Attempting to register factory for plugin cuBLAS when one has already been registered
2024-04-28 15:17:08.945324: I tensorflow/core/platform/cpu_feature_guard.cc:182] This TensorFlow binary is optimized to use available CPU instructions in performance-critical operations.
To enable the following instructions: AVX2 AVX512F AVX512_VNNI FMA, in other operations, rebuild TensorFlow with the appropriate compiler flags.
2024-04-28 15:17:13.654664: W tensorflow/compiler/tf2tensorrt/utils/py_utils.cc:38] TF-TRT Warning: Could not find TensorRT
WARNING:tensorflow:From /home/ketrong/miniconda3/envs/tpot2devenv/lib/python3.10/site-packages/tensorflow/python/compat/v2_compat.py:108: disable_resource_variables (from tensorflow.python.ops.variable_scope) is deprecated and will be removed in a future version.
Instructions for updating:
non-resource variables are not supported in the long term
starting loops
working on 
logs/3786/tpot2_base_normal_MCAR_0.01
3.3844993114471436
loading data
logs/3786/tpot2_base_normal_MCAR_0.01/data/3786_True.pkl
[0 0 0 ... 1 1 1]
           0  ...    4
0     1.8131  ...  0.0
1     2.0978  ...  0.0
2     3.1098  ...  0.0
3     2.2134  ...  0.0
4     3.7071  ...  0.0
...      ...  ...  ...
7771  0.3056  ...  0.0
7772  1.1120  ...  0.0
7773  3.2771  ...  1.0
7774  3.3650  ...  1.0
7775  2.3815  ...  1.0

[7776 rows x 5 columns]
          0  ...    4
0    2.0023  ...  0.0
1    3.1106  ...  0.0
2    2.3031  ...  0.0
3    3.0267  ...  0.0
4    1.6069  ...  0.0
..      ...  ...  ...
860  0.7427  ...  1.0
861  1.4953  ...  0.0
862  3.2823  ...  1.0
863  0.2958  ...  0.0
864  0.0142  ...  0.0

[865 rows x 5 columns]
running experiment 1/3 - Does large hyperparameter space improve reconstruction accuracy over simple
[I 2024-04-28 15:17:28,745] A new study created in memory with name: no-name-7f30660b-e5ec-4f06-9043-07344328a25e
[I 2024-04-28 15:17:29,029] Trial 0 finished with value: 25.954326732873625 and parameters: {'model_name': 'SimpleImputer', 'strategy': 'constant'}. Best is trial 0 with value: 25.954326732873625.
[I 2024-04-28 15:17:29,374] Trial 2 finished with value: 25.954326732873625 and parameters: {'model_name': 'SimpleImputer', 'strategy': 'constant'}. Best is trial 0 with value: 25.954326732873625.
[I 2024-04-28 15:17:29,670] Trial 1 finished with value: 12.864139892484474 and parameters: {'model_name': 'SimpleImputer', 'strategy': 'mean'}. Best is trial 1 with value: 12.864139892484474.
[I 2024-04-28 15:17:29,960] Trial 6 finished with value: 12.864139892484474 and parameters: {'model_name': 'SimpleImputer', 'strategy': 'mean'}. Best is trial 1 with value: 12.864139892484474.
[I 2024-04-28 15:17:30,184] Trial 5 finished with value: 12.864139892484474 and parameters: {'model_name': 'SimpleImputer', 'strategy': 'mean'}. Best is trial 1 with value: 12.864139892484474.
[I 2024-04-28 15:17:30,682] Trial 16 finished with value: 25.954326732873625 and parameters: {'model_name': 'SimpleImputer', 'strategy': 'constant'}. Best is trial 1 with value: 12.864139892484474.
[I 2024-04-28 15:17:30,877] Trial 11 finished with value: 12.864139892484474 and parameters: {'model_name': 'SimpleImputer', 'strategy': 'mean'}. Best is trial 1 with value: 12.864139892484474.
[I 2024-04-28 15:17:31,166] Trial 19 finished with value: 25.954326732873625 and parameters: {'model_name': 'SimpleImputer', 'strategy': 'constant'}. Best is trial 1 with value: 12.864139892484474.
[I 2024-04-28 15:17:31,553] Trial 9 finished with value: 12.944650994501867 and parameters: {'model_name': 'SimpleImputer', 'strategy': 'median'}. Best is trial 1 with value: 12.864139892484474.
[I 2024-04-28 15:17:31,992] Trial 4 finished with value: 12.944650994501867 and parameters: {'model_name': 'SimpleImputer', 'strategy': 'median'}. Best is trial 1 with value: 12.864139892484474.
[I 2024-04-28 15:17:32,410] Trial 36 finished with value: 25.954326732873625 and parameters: {'model_name': 'SimpleImputer', 'strategy': 'constant'}. Best is trial 1 with value: 12.864139892484474.
[I 2024-04-28 15:17:32,571] Trial 42 finished with value: 25.954326732873625 and parameters: {'model_name': 'SimpleImputer', 'strategy': 'constant'}. Best is trial 1 with value: 12.864139892484474.
[I 2024-04-28 15:17:32,731] Trial 3 finished with value: 12.944650994501867 and parameters: {'model_name': 'SimpleImputer', 'strategy': 'median'}. Best is trial 1 with value: 12.864139892484474.
[I 2024-04-28 15:17:33,034] Trial 22 finished with value: 12.864139892484474 and parameters: {'model_name': 'SimpleImputer', 'strategy': 'mean'}. Best is trial 1 with value: 12.864139892484474.
[I 2024-04-28 15:17:33,504] Trial 21 finished with value: 12.864139892484474 and parameters: {'model_name': 'SimpleImputer', 'strategy': 'mean'}. Best is trial 1 with value: 12.864139892484474.
[I 2024-04-28 15:17:33,709] Trial 41 finished with value: 25.954326732873625 and parameters: {'model_name': 'SimpleImputer', 'strategy': 'constant'}. Best is trial 1 with value: 12.864139892484474.
[I 2024-04-28 15:17:34,086] Trial 48 finished with value: 25.954326732873625 and parameters: {'model_name': 'SimpleImputer', 'strategy': 'constant'}. Best is trial 1 with value: 12.864139892484474.
[I 2024-04-28 15:17:34,580] Trial 18 finished with value: 12.944650994501867 and parameters: {'model_name': 'SimpleImputer', 'strategy': 'median'}. Best is trial 1 with value: 12.864139892484474.
[I 2024-04-28 15:17:34,758] Trial 31 finished with value: 12.864139892484474 and parameters: {'model_name': 'SimpleImputer', 'strategy': 'mean'}. Best is trial 1 with value: 12.864139892484474.
[I 2024-04-28 15:17:35,077] Trial 53 finished with value: 12.864139892484474 and parameters: {'model_name': 'SimpleImputer', 'strategy': 'mean'}. Best is trial 1 with value: 12.864139892484474.
[I 2024-04-28 15:17:35,257] Trial 10 finished with value: 12.944650994501867 and parameters: {'model_name': 'SimpleImputer', 'strategy': 'median'}. Best is trial 1 with value: 12.864139892484474.
[I 2024-04-28 15:17:35,426] Trial 12 finished with value: 12.944650994501867 and parameters: {'model_name': 'SimpleImputer', 'strategy': 'median'}. Best is trial 1 with value: 12.864139892484474.
[I 2024-04-28 15:17:35,658] Trial 24 finished with value: 12.944650994501867 and parameters: {'model_name': 'SimpleImputer', 'strategy': 'median'}. Best is trial 1 with value: 12.864139892484474.
[I 2024-04-28 15:17:35,836] Trial 13 finished with value: 12.944650994501867 and parameters: {'model_name': 'SimpleImputer', 'strategy': 'median'}. Best is trial 1 with value: 12.864139892484474.
[I 2024-04-28 15:17:36,017] Trial 20 finished with value: 12.944650994501867 and parameters: {'model_name': 'SimpleImputer', 'strategy': 'median'}. Best is trial 1 with value: 12.864139892484474.
[I 2024-04-28 15:17:36,218] Trial 47 finished with value: 12.864139892484474 and parameters: {'model_name': 'SimpleImputer', 'strategy': 'mean'}. Best is trial 1 with value: 12.864139892484474.
[I 2024-04-28 15:17:36,433] Trial 26 finished with value: 12.944650994501867 and parameters: {'model_name': 'SimpleImputer', 'strategy': 'median'}. Best is trial 1 with value: 12.864139892484474.
[I 2024-04-28 15:17:36,712] Trial 44 finished with value: 12.864139892484474 and parameters: {'model_name': 'SimpleImputer', 'strategy': 'mean'}. Best is trial 1 with value: 12.864139892484474.
[I 2024-04-28 15:17:36,937] Trial 46 finished with value: 12.864139892484474 and parameters: {'model_name': 'SimpleImputer', 'strategy': 'mean'}. Best is trial 1 with value: 12.864139892484474.
[I 2024-04-28 15:17:37,219] Trial 25 finished with value: 12.944650994501867 and parameters: {'model_name': 'SimpleImputer', 'strategy': 'median'}. Best is trial 1 with value: 12.864139892484474.
[I 2024-04-28 15:17:37,427] Trial 23 finished with value: 12.944650994501867 and parameters: {'model_name': 'SimpleImputer', 'strategy': 'median'}. Best is trial 1 with value: 12.864139892484474.
[I 2024-04-28 15:17:37,597] Trial 51 finished with value: 12.864139892484474 and parameters: {'model_name': 'SimpleImputer', 'strategy': 'mean'}. Best is trial 1 with value: 12.864139892484474.
[I 2024-04-28 15:17:37,915] Trial 14 finished with value: 12.944650994501867 and parameters: {'model_name': 'SimpleImputer', 'strategy': 'median'}. Best is trial 1 with value: 12.864139892484474.
[I 2024-04-28 15:17:38,205] Trial 7 finished with value: 25.947024521149785 and parameters: {'model_name': 'SimpleImputer', 'strategy': 'most_frequent'}. Best is trial 1 with value: 12.864139892484474.
[I 2024-04-28 15:17:38,475] Trial 27 finished with value: 12.944650994501867 and parameters: {'model_name': 'SimpleImputer', 'strategy': 'median'}. Best is trial 1 with value: 12.864139892484474.
[I 2024-04-28 15:17:38,658] Trial 8 finished with value: 25.947024521149785 and parameters: {'model_name': 'SimpleImputer', 'strategy': 'most_frequent'}. Best is trial 1 with value: 12.864139892484474.
[I 2024-04-28 15:17:38,975] Trial 29 finished with value: 12.944650994501867 and parameters: {'model_name': 'SimpleImputer', 'strategy': 'median'}. Best is trial 1 with value: 12.864139892484474.
[I 2024-04-28 15:17:39,237] Trial 32 finished with value: 12.944650994501867 and parameters: {'model_name': 'SimpleImputer', 'strategy': 'median'}. Best is trial 1 with value: 12.864139892484474.
[I 2024-04-28 15:17:39,433] Trial 17 finished with value: 25.947024521149785 and parameters: {'model_name': 'SimpleImputer', 'strategy': 'most_frequent'}. Best is trial 1 with value: 12.864139892484474.
[I 2024-04-28 15:17:39,703] Trial 54 finished with value: 12.944650994501867 and parameters: {'model_name': 'SimpleImputer', 'strategy': 'median'}. Best is trial 1 with value: 12.864139892484474.
[I 2024-04-28 15:17:39,962] Trial 34 finished with value: 12.944650994501867 and parameters: {'model_name': 'SimpleImputer', 'strategy': 'median'}. Best is trial 1 with value: 12.864139892484474.
[I 2024-04-28 15:17:40,153] Trial 43 finished with value: 12.944650994501867 and parameters: {'model_name': 'SimpleImputer', 'strategy': 'median'}. Best is trial 1 with value: 12.864139892484474.
[I 2024-04-28 15:17:40,361] Trial 38 finished with value: 12.944650994501867 and parameters: {'model_name': 'SimpleImputer', 'strategy': 'median'}. Best is trial 1 with value: 12.864139892484474.
[I 2024-04-28 15:17:40,540] Trial 15 finished with value: 25.947024521149785 and parameters: {'model_name': 'SimpleImputer', 'strategy': 'most_frequent'}. Best is trial 1 with value: 12.864139892484474.
[I 2024-04-28 15:17:40,869] Trial 40 finished with value: 12.944650994501867 and parameters: {'model_name': 'SimpleImputer', 'strategy': 'median'}. Best is trial 1 with value: 12.864139892484474.
[I 2024-04-28 15:17:41,153] Trial 55 finished with value: 12.944650994501867 and parameters: {'model_name': 'SimpleImputer', 'strategy': 'median'}. Best is trial 1 with value: 12.864139892484474.
[I 2024-04-28 15:17:41,453] Trial 52 finished with value: 12.944650994501867 and parameters: {'model_name': 'SimpleImputer', 'strategy': 'median'}. Best is trial 1 with value: 12.864139892484474.
[I 2024-04-28 15:17:42,111] Trial 35 finished with value: 25.947024521149785 and parameters: {'model_name': 'SimpleImputer', 'strategy': 'most_frequent'}. Best is trial 1 with value: 12.864139892484474.
[I 2024-04-28 15:17:42,450] Trial 28 finished with value: 25.947024521149785 and parameters: {'model_name': 'SimpleImputer', 'strategy': 'most_frequent'}. Best is trial 1 with value: 12.864139892484474.
[I 2024-04-28 15:17:42,770] Trial 49 finished with value: 12.944650994501867 and parameters: {'model_name': 'SimpleImputer', 'strategy': 'median'}. Best is trial 1 with value: 12.864139892484474.
[I 2024-04-28 15:17:43,280] Trial 30 finished with value: 25.947024521149785 and parameters: {'model_name': 'SimpleImputer', 'strategy': 'most_frequent'}. Best is trial 1 with value: 12.864139892484474.
[I 2024-04-28 15:17:43,572] Trial 81 finished with value: 12.864139892484474 and parameters: {'model_name': 'SimpleImputer', 'strategy': 'mean'}. Best is trial 1 with value: 12.864139892484474.
[I 2024-04-28 15:17:43,820] Trial 82 finished with value: 12.864139892484474 and parameters: {'model_name': 'SimpleImputer', 'strategy': 'mean'}. Best is trial 1 with value: 12.864139892484474.
[I 2024-04-28 15:17:44,034] Trial 57 finished with value: 25.947024521149785 and parameters: {'model_name': 'SimpleImputer', 'strategy': 'most_frequent'}. Best is trial 1 with value: 12.864139892484474.
[I 2024-04-28 15:17:44,367] Trial 79 finished with value: 12.864139892484474 and parameters: {'model_name': 'SimpleImputer', 'strategy': 'mean'}. Best is trial 1 with value: 12.864139892484474.
[I 2024-04-28 15:17:44,669] Trial 56 finished with value: 25.947024521149785 and parameters: {'model_name': 'SimpleImputer', 'strategy': 'most_frequent'}. Best is trial 1 with value: 12.864139892484474.
[I 2024-04-28 15:17:44,903] Trial 80 finished with value: 12.864139892484474 and parameters: {'model_name': 'SimpleImputer', 'strategy': 'mean'}. Best is trial 1 with value: 12.864139892484474.
[I 2024-04-28 15:17:45,110] Trial 39 finished with value: 25.947024521149785 and parameters: {'model_name': 'SimpleImputer', 'strategy': 'most_frequent'}. Best is trial 1 with value: 12.864139892484474.
[I 2024-04-28 15:17:45,407] Trial 91 finished with value: 12.864139892484474 and parameters: {'model_name': 'SimpleImputer', 'strategy': 'mean'}. Best is trial 1 with value: 12.864139892484474.
[I 2024-04-28 15:17:45,628] Trial 50 finished with value: 25.947024521149785 and parameters: {'model_name': 'SimpleImputer', 'strategy': 'most_frequent'}. Best is trial 1 with value: 12.864139892484474.
[I 2024-04-28 15:17:45,795] Trial 84 finished with value: 12.864139892484474 and parameters: {'model_name': 'SimpleImputer', 'strategy': 'mean'}. Best is trial 1 with value: 12.864139892484474.
[I 2024-04-28 15:17:46,104] Trial 83 finished with value: 12.864139892484474 and parameters: {'model_name': 'SimpleImputer', 'strategy': 'mean'}. Best is trial 1 with value: 12.864139892484474.
[I 2024-04-28 15:17:46,304] Trial 86 finished with value: 12.864139892484474 and parameters: {'model_name': 'SimpleImputer', 'strategy': 'mean'}. Best is trial 1 with value: 12.864139892484474.
[I 2024-04-28 15:17:46,485] Trial 87 finished with value: 12.864139892484474 and parameters: {'model_name': 'SimpleImputer', 'strategy': 'mean'}. Best is trial 1 with value: 12.864139892484474.
[I 2024-04-28 15:17:46,739] Trial 45 finished with value: 25.947024521149785 and parameters: {'model_name': 'SimpleImputer', 'strategy': 'most_frequent'}. Best is trial 1 with value: 12.864139892484474.
[I 2024-04-28 15:17:46,967] Trial 33 finished with value: 25.947024521149785 and parameters: {'model_name': 'SimpleImputer', 'strategy': 'most_frequent'}. Best is trial 1 with value: 12.864139892484474.
[I 2024-04-28 15:17:47,220] Trial 60 finished with value: 25.947024521149785 and parameters: {'model_name': 'SimpleImputer', 'strategy': 'most_frequent'}. Best is trial 1 with value: 12.864139892484474.
[I 2024-04-28 15:17:47,467] Trial 92 finished with value: 12.864139892484474 and parameters: {'model_name': 'SimpleImputer', 'strategy': 'mean'}. Best is trial 1 with value: 12.864139892484474.
[I 2024-04-28 15:17:47,749] Trial 94 finished with value: 12.864139892484474 and parameters: {'model_name': 'SimpleImputer', 'strategy': 'mean'}. Best is trial 1 with value: 12.864139892484474.
[I 2024-04-28 15:17:48,027] Trial 93 finished with value: 12.864139892484474 and parameters: {'model_name': 'SimpleImputer', 'strategy': 'mean'}. Best is trial 1 with value: 12.864139892484474.
[I 2024-04-28 15:17:48,257] Trial 61 finished with value: 25.947024521149785 and parameters: {'model_name': 'SimpleImputer', 'strategy': 'most_frequent'}. Best is trial 1 with value: 12.864139892484474.
[I 2024-04-28 15:17:48,519] Trial 58 finished with value: 25.947024521149785 and parameters: {'model_name': 'SimpleImputer', 'strategy': 'most_frequent'}. Best is trial 1 with value: 12.864139892484474.
[I 2024-04-28 15:17:48,694] Trial 37 finished with value: 25.947024521149785 and parameters: {'model_name': 'SimpleImputer', 'strategy': 'most_frequent'}. Best is trial 1 with value: 12.864139892484474.
[I 2024-04-28 15:17:48,902] Trial 88 finished with value: 12.864139892484474 and parameters: {'model_name': 'SimpleImputer', 'strategy': 'mean'}. Best is trial 1 with value: 12.864139892484474.
[I 2024-04-28 15:17:49,065] Trial 96 finished with value: 12.864139892484474 and parameters: {'model_name': 'SimpleImputer', 'strategy': 'mean'}. Best is trial 1 with value: 12.864139892484474.
[I 2024-04-28 15:17:49,378] Trial 89 finished with value: 12.864139892484474 and parameters: {'model_name': 'SimpleImputer', 'strategy': 'mean'}. Best is trial 1 with value: 12.864139892484474.
[I 2024-04-28 15:17:49,565] Trial 59 finished with value: 25.947024521149785 and parameters: {'model_name': 'SimpleImputer', 'strategy': 'most_frequent'}. Best is trial 1 with value: 12.864139892484474.
[I 2024-04-28 15:17:49,750] Trial 90 finished with value: 12.864139892484474 and parameters: {'model_name': 'SimpleImputer', 'strategy': 'mean'}. Best is trial 1 with value: 12.864139892484474.
[I 2024-04-28 15:17:50,112] Trial 63 finished with value: 25.947024521149785 and parameters: {'model_name': 'SimpleImputer', 'strategy': 'most_frequent'}. Best is trial 1 with value: 12.864139892484474.
[I 2024-04-28 15:17:50,295] Trial 78 finished with value: 12.864139892484474 and parameters: {'model_name': 'SimpleImputer', 'strategy': 'mean'}. Best is trial 1 with value: 12.864139892484474.
[I 2024-04-28 15:17:50,557] Trial 85 finished with value: 12.864139892484474 and parameters: {'model_name': 'SimpleImputer', 'strategy': 'mean'}. Best is trial 1 with value: 12.864139892484474.
[I 2024-04-28 15:17:50,854] Trial 100 finished with value: 12.864139892484474 and parameters: {'model_name': 'SimpleImputer', 'strategy': 'mean'}. Best is trial 1 with value: 12.864139892484474.
[I 2024-04-28 15:17:51,053] Trial 62 finished with value: 25.947024521149785 and parameters: {'model_name': 'SimpleImputer', 'strategy': 'most_frequent'}. Best is trial 1 with value: 12.864139892484474.
[I 2024-04-28 15:17:51,226] Trial 65 finished with value: 25.947024521149785 and parameters: {'model_name': 'SimpleImputer', 'strategy': 'most_frequent'}. Best is trial 1 with value: 12.864139892484474.
[I 2024-04-28 15:17:51,587] Trial 95 finished with value: 12.864139892484474 and parameters: {'model_name': 'SimpleImputer', 'strategy': 'mean'}. Best is trial 1 with value: 12.864139892484474.
[I 2024-04-28 15:17:51,773] Trial 97 finished with value: 12.864139892484474 and parameters: {'model_name': 'SimpleImputer', 'strategy': 'mean'}. Best is trial 1 with value: 12.864139892484474.
[I 2024-04-28 15:17:52,086] Trial 98 finished with value: 12.864139892484474 and parameters: {'model_name': 'SimpleImputer', 'strategy': 'mean'}. Best is trial 1 with value: 12.864139892484474.
[I 2024-04-28 15:17:52,350] Trial 64 finished with value: 25.947024521149785 and parameters: {'model_name': 'SimpleImputer', 'strategy': 'most_frequent'}. Best is trial 1 with value: 12.864139892484474.
[I 2024-04-28 15:17:52,526] Trial 99 finished with value: 12.864139892484474 and parameters: {'model_name': 'SimpleImputer', 'strategy': 'mean'}. Best is trial 1 with value: 12.864139892484474.
[I 2024-04-28 15:17:52,764] Trial 66 finished with value: 25.947024521149785 and parameters: {'model_name': 'SimpleImputer', 'strategy': 'most_frequent'}. Best is trial 1 with value: 12.864139892484474.
[I 2024-04-28 15:17:53,150] Trial 103 finished with value: 12.864139892484474 and parameters: {'model_name': 'SimpleImputer', 'strategy': 'mean'}. Best is trial 1 with value: 12.864139892484474.
[I 2024-04-28 15:17:53,354] Trial 69 finished with value: 25.947024521149785 and parameters: {'model_name': 'SimpleImputer', 'strategy': 'most_frequent'}. Best is trial 1 with value: 12.864139892484474.
[I 2024-04-28 15:17:53,602] Trial 102 finished with value: 12.864139892484474 and parameters: {'model_name': 'SimpleImputer', 'strategy': 'mean'}. Best is trial 1 with value: 12.864139892484474.
[I 2024-04-28 15:17:53,783] Trial 104 finished with value: 12.864139892484474 and parameters: {'model_name': 'SimpleImputer', 'strategy': 'mean'}. Best is trial 1 with value: 12.864139892484474.
[I 2024-04-28 15:17:53,959] Trial 101 finished with value: 12.864139892484474 and parameters: {'model_name': 'SimpleImputer', 'strategy': 'mean'}. Best is trial 1 with value: 12.864139892484474.
