[I 2024-04-28 15:17:54,206] Trial 106 finished with value: 12.864139892484474 and parameters: {'model_name': 'SimpleImputer', 'strategy': 'mean'}. Best is trial 1 with value: 12.864139892484474.
[I 2024-04-28 15:17:54,410] Trial 71 finished with value: 25.947024521149785 and parameters: {'model_name': 'SimpleImputer', 'strategy': 'most_frequent'}. Best is trial 1 with value: 12.864139892484474.
[I 2024-04-28 15:17:54,680] Trial 72 finished with value: 25.947024521149785 and parameters: {'model_name': 'SimpleImputer', 'strategy': 'most_frequent'}. Best is trial 1 with value: 12.864139892484474.
[I 2024-04-28 15:17:54,915] Trial 67 finished with value: 25.947024521149785 and parameters: {'model_name': 'SimpleImputer', 'strategy': 'most_frequent'}. Best is trial 1 with value: 12.864139892484474.
[I 2024-04-28 15:17:55,113] Trial 107 finished with value: 12.864139892484474 and parameters: {'model_name': 'SimpleImputer', 'strategy': 'mean'}. Best is trial 1 with value: 12.864139892484474.
[I 2024-04-28 15:17:55,356] Trial 110 finished with value: 12.864139892484474 and parameters: {'model_name': 'SimpleImputer', 'strategy': 'mean'}. Best is trial 1 with value: 12.864139892484474.
[I 2024-04-28 15:17:55,657] Trial 111 finished with value: 12.864139892484474 and parameters: {'model_name': 'SimpleImputer', 'strategy': 'mean'}. Best is trial 1 with value: 12.864139892484474.
[I 2024-04-28 15:17:55,661] Trial 113 finished with value: 12.864139892484474 and parameters: {'model_name': 'SimpleImputer', 'strategy': 'mean'}. Best is trial 1 with value: 12.864139892484474.
[I 2024-04-28 15:17:55,664] Trial 73 finished with value: 25.947024521149785 and parameters: {'model_name': 'SimpleImputer', 'strategy': 'most_frequent'}. Best is trial 1 with value: 12.864139892484474.
[I 2024-04-28 15:17:55,666] Trial 108 finished with value: 12.864139892484474 and parameters: {'model_name': 'SimpleImputer', 'strategy': 'mean'}. Best is trial 1 with value: 12.864139892484474.
[I 2024-04-28 15:17:55,908] Trial 109 finished with value: 12.864139892484474 and parameters: {'model_name': 'SimpleImputer', 'strategy': 'mean'}. Best is trial 1 with value: 12.864139892484474.
[I 2024-04-28 15:17:56,162] Trial 68 finished with value: 25.947024521149785 and parameters: {'model_name': 'SimpleImputer', 'strategy': 'most_frequent'}. Best is trial 1 with value: 12.864139892484474.
[I 2024-04-28 15:17:56,164] Trial 105 finished with value: 12.864139892484474 and parameters: {'model_name': 'SimpleImputer', 'strategy': 'mean'}. Best is trial 1 with value: 12.864139892484474.
[I 2024-04-28 15:17:56,428] Trial 118 finished with value: 12.864139892484474 and parameters: {'model_name': 'SimpleImputer', 'strategy': 'mean'}. Best is trial 1 with value: 12.864139892484474.
[I 2024-04-28 15:17:57,139] Trial 112 finished with value: 12.864139892484474 and parameters: {'model_name': 'SimpleImputer', 'strategy': 'mean'}. Best is trial 1 with value: 12.864139892484474.
[I 2024-04-28 15:17:57,624] Trial 116 finished with value: 12.864139892484474 and parameters: {'model_name': 'SimpleImputer', 'strategy': 'mean'}. Best is trial 1 with value: 12.864139892484474.
[I 2024-04-28 15:17:58,127] Trial 76 finished with value: 25.947024521149785 and parameters: {'model_name': 'SimpleImputer', 'strategy': 'most_frequent'}. Best is trial 1 with value: 12.864139892484474.
[I 2024-04-28 15:17:58,372] Trial 70 finished with value: 25.947024521149785 and parameters: {'model_name': 'SimpleImputer', 'strategy': 'most_frequent'}. Best is trial 1 with value: 12.864139892484474.
[I 2024-04-28 15:17:58,561] Trial 120 finished with value: 12.864139892484474 and parameters: {'model_name': 'SimpleImputer', 'strategy': 'mean'}. Best is trial 1 with value: 12.864139892484474.
[I 2024-04-28 15:17:58,813] Trial 114 finished with value: 12.864139892484474 and parameters: {'model_name': 'SimpleImputer', 'strategy': 'mean'}. Best is trial 1 with value: 12.864139892484474.
[I 2024-04-28 15:17:59,092] Trial 117 finished with value: 12.864139892484474 and parameters: {'model_name': 'SimpleImputer', 'strategy': 'mean'}. Best is trial 1 with value: 12.864139892484474.
[I 2024-04-28 15:17:59,362] Trial 74 finished with value: 25.947024521149785 and parameters: {'model_name': 'SimpleImputer', 'strategy': 'most_frequent'}. Best is trial 1 with value: 12.864139892484474.
[I 2024-04-28 15:17:59,696] Trial 121 finished with value: 12.864139892484474 and parameters: {'model_name': 'SimpleImputer', 'strategy': 'mean'}. Best is trial 1 with value: 12.864139892484474.
[I 2024-04-28 15:17:59,921] Trial 123 finished with value: 12.864139892484474 and parameters: {'model_name': 'SimpleImputer', 'strategy': 'mean'}. Best is trial 1 with value: 12.864139892484474.
[I 2024-04-28 15:18:00,259] Trial 77 finished with value: 25.947024521149785 and parameters: {'model_name': 'SimpleImputer', 'strategy': 'most_frequent'}. Best is trial 1 with value: 12.864139892484474.
[I 2024-04-28 15:18:00,573] Trial 115 finished with value: 12.864139892484474 and parameters: {'model_name': 'SimpleImputer', 'strategy': 'mean'}. Best is trial 1 with value: 12.864139892484474.
[I 2024-04-28 15:18:00,877] Trial 125 finished with value: 12.864139892484474 and parameters: {'model_name': 'SimpleImputer', 'strategy': 'mean'}. Best is trial 1 with value: 12.864139892484474.
[I 2024-04-28 15:18:01,146] Trial 122 finished with value: 12.864139892484474 and parameters: {'model_name': 'SimpleImputer', 'strategy': 'mean'}. Best is trial 1 with value: 12.864139892484474.
[I 2024-04-28 15:18:01,420] Trial 119 finished with value: 12.864139892484474 and parameters: {'model_name': 'SimpleImputer', 'strategy': 'mean'}. Best is trial 1 with value: 12.864139892484474.
[I 2024-04-28 15:18:01,630] Trial 130 finished with value: 12.864139892484474 and parameters: {'model_name': 'SimpleImputer', 'strategy': 'mean'}. Best is trial 1 with value: 12.864139892484474.
[I 2024-04-28 15:18:01,802] Trial 129 finished with value: 12.864139892484474 and parameters: {'model_name': 'SimpleImputer', 'strategy': 'mean'}. Best is trial 1 with value: 12.864139892484474.
[I 2024-04-28 15:18:02,025] Trial 127 finished with value: 12.864139892484474 and parameters: {'model_name': 'SimpleImputer', 'strategy': 'mean'}. Best is trial 1 with value: 12.864139892484474.
[I 2024-04-28 15:18:02,198] Trial 142 finished with value: 25.954326732873625 and parameters: {'model_name': 'SimpleImputer', 'strategy': 'constant'}. Best is trial 1 with value: 12.864139892484474.
[I 2024-04-28 15:18:02,445] Trial 126 finished with value: 12.864139892484474 and parameters: {'model_name': 'SimpleImputer', 'strategy': 'mean'}. Best is trial 1 with value: 12.864139892484474.
[I 2024-04-28 15:18:02,901] Trial 128 finished with value: 12.864139892484474 and parameters: {'model_name': 'SimpleImputer', 'strategy': 'mean'}. Best is trial 1 with value: 12.864139892484474.
[I 2024-04-28 15:18:03,115] Trial 124 finished with value: 12.864139892484474 and parameters: {'model_name': 'SimpleImputer', 'strategy': 'mean'}. Best is trial 1 with value: 12.864139892484474.
[I 2024-04-28 15:18:03,366] Trial 137 finished with value: 12.864139892484474 and parameters: {'model_name': 'SimpleImputer', 'strategy': 'mean'}. Best is trial 1 with value: 12.864139892484474.
[I 2024-04-28 15:18:03,658] Trial 75 finished with value: 25.947024521149785 and parameters: {'model_name': 'SimpleImputer', 'strategy': 'most_frequent'}. Best is trial 1 with value: 12.864139892484474.
[I 2024-04-28 15:18:03,827] Trial 132 finished with value: 12.864139892484474 and parameters: {'model_name': 'SimpleImputer', 'strategy': 'mean'}. Best is trial 1 with value: 12.864139892484474.
[I 2024-04-28 15:18:04,145] Trial 133 finished with value: 12.864139892484474 and parameters: {'model_name': 'SimpleImputer', 'strategy': 'mean'}. Best is trial 1 with value: 12.864139892484474.
[I 2024-04-28 15:18:04,365] Trial 131 finished with value: 12.864139892484474 and parameters: {'model_name': 'SimpleImputer', 'strategy': 'mean'}. Best is trial 1 with value: 12.864139892484474.
[I 2024-04-28 15:18:04,546] Trial 148 finished with value: 25.954326732873625 and parameters: {'model_name': 'SimpleImputer', 'strategy': 'constant'}. Best is trial 1 with value: 12.864139892484474.
[I 2024-04-28 15:18:04,727] Trial 147 finished with value: 25.954326732873625 and parameters: {'model_name': 'SimpleImputer', 'strategy': 'constant'}. Best is trial 1 with value: 12.864139892484474.
[I 2024-04-28 15:18:04,988] Trial 140 finished with value: 25.954326732873625 and parameters: {'model_name': 'SimpleImputer', 'strategy': 'constant'}. Best is trial 1 with value: 12.864139892484474.
[I 2024-04-28 15:18:05,162] Trial 135 finished with value: 12.864139892484474 and parameters: {'model_name': 'SimpleImputer', 'strategy': 'mean'}. Best is trial 1 with value: 12.864139892484474.
[I 2024-04-28 15:18:05,323] Trial 134 finished with value: 12.864139892484474 and parameters: {'model_name': 'SimpleImputer', 'strategy': 'mean'}. Best is trial 1 with value: 12.864139892484474.
[I 2024-04-28 15:18:05,620] Trial 153 finished with value: 25.954326732873625 and parameters: {'model_name': 'SimpleImputer', 'strategy': 'constant'}. Best is trial 1 with value: 12.864139892484474.
[I 2024-04-28 15:18:05,853] Trial 141 finished with value: 25.954326732873625 and parameters: {'model_name': 'SimpleImputer', 'strategy': 'constant'}. Best is trial 1 with value: 12.864139892484474.
[I 2024-04-28 15:18:06,071] Trial 136 finished with value: 12.864139892484474 and parameters: {'model_name': 'SimpleImputer', 'strategy': 'mean'}. Best is trial 1 with value: 12.864139892484474.
[I 2024-04-28 15:18:06,350] Trial 160 finished with value: 25.954326732873625 and parameters: {'model_name': 'SimpleImputer', 'strategy': 'constant'}. Best is trial 1 with value: 12.864139892484474.
[I 2024-04-28 15:18:06,664] Trial 155 finished with value: 25.954326732873625 and parameters: {'model_name': 'SimpleImputer', 'strategy': 'constant'}. Best is trial 1 with value: 12.864139892484474.
[I 2024-04-28 15:18:06,912] Trial 162 finished with value: 25.954326732873625 and parameters: {'model_name': 'SimpleImputer', 'strategy': 'constant'}. Best is trial 1 with value: 12.864139892484474.
[I 2024-04-28 15:18:07,170] Trial 151 finished with value: 25.954326732873625 and parameters: {'model_name': 'SimpleImputer', 'strategy': 'constant'}. Best is trial 1 with value: 12.864139892484474.
[I 2024-04-28 15:18:07,420] Trial 150 finished with value: 25.954326732873625 and parameters: {'model_name': 'SimpleImputer', 'strategy': 'constant'}. Best is trial 1 with value: 12.864139892484474.
[I 2024-04-28 15:18:07,755] Trial 143 finished with value: 25.954326732873625 and parameters: {'model_name': 'SimpleImputer', 'strategy': 'constant'}. Best is trial 1 with value: 12.864139892484474.
[I 2024-04-28 15:18:08,056] Trial 152 finished with value: 25.954326732873625 and parameters: {'model_name': 'SimpleImputer', 'strategy': 'constant'}. Best is trial 1 with value: 12.864139892484474.
[I 2024-04-28 15:18:08,329] Trial 145 finished with value: 25.954326732873625 and parameters: {'model_name': 'SimpleImputer', 'strategy': 'constant'}. Best is trial 1 with value: 12.864139892484474.
[I 2024-04-28 15:18:08,501] Trial 158 finished with value: 25.954326732873625 and parameters: {'model_name': 'SimpleImputer', 'strategy': 'constant'}. Best is trial 1 with value: 12.864139892484474.
[I 2024-04-28 15:18:08,799] Trial 159 finished with value: 25.954326732873625 and parameters: {'model_name': 'SimpleImputer', 'strategy': 'constant'}. Best is trial 1 with value: 12.864139892484474.
[I 2024-04-28 15:18:08,988] Trial 161 finished with value: 25.954326732873625 and parameters: {'model_name': 'SimpleImputer', 'strategy': 'constant'}. Best is trial 1 with value: 12.864139892484474.
[I 2024-04-28 15:18:09,249] Trial 157 finished with value: 25.954326732873625 and parameters: {'model_name': 'SimpleImputer', 'strategy': 'constant'}. Best is trial 1 with value: 12.864139892484474.
[I 2024-04-28 15:18:09,478] Trial 154 finished with value: 25.954326732873625 and parameters: {'model_name': 'SimpleImputer', 'strategy': 'constant'}. Best is trial 1 with value: 12.864139892484474.
[I 2024-04-28 15:18:09,714] Trial 165 finished with value: 25.954326732873625 and parameters: {'model_name': 'SimpleImputer', 'strategy': 'constant'}. Best is trial 1 with value: 12.864139892484474.
[I 2024-04-28 15:18:09,953] Trial 144 finished with value: 12.864139892484474 and parameters: {'model_name': 'SimpleImputer', 'strategy': 'mean'}. Best is trial 1 with value: 12.864139892484474.
[I 2024-04-28 15:18:10,178] Trial 167 finished with value: 25.954326732873625 and parameters: {'model_name': 'SimpleImputer', 'strategy': 'constant'}. Best is trial 1 with value: 12.864139892484474.
[I 2024-04-28 15:18:10,433] Trial 163 finished with value: 25.954326732873625 and parameters: {'model_name': 'SimpleImputer', 'strategy': 'constant'}. Best is trial 1 with value: 12.864139892484474.
[I 2024-04-28 15:18:10,658] Trial 171 finished with value: 25.954326732873625 and parameters: {'model_name': 'SimpleImputer', 'strategy': 'constant'}. Best is trial 1 with value: 12.864139892484474.
[I 2024-04-28 15:18:10,892] Trial 149 finished with value: 12.864139892484474 and parameters: {'model_name': 'SimpleImputer', 'strategy': 'mean'}. Best is trial 1 with value: 12.864139892484474.
[I 2024-04-28 15:18:11,125] Trial 175 finished with value: 25.954326732873625 and parameters: {'model_name': 'SimpleImputer', 'strategy': 'constant'}. Best is trial 1 with value: 12.864139892484474.
[I 2024-04-28 15:18:11,377] Trial 139 finished with value: 12.864139892484474 and parameters: {'model_name': 'SimpleImputer', 'strategy': 'mean'}. Best is trial 1 with value: 12.864139892484474.
[I 2024-04-28 15:18:11,636] Trial 138 finished with value: 12.864139892484474 and parameters: {'model_name': 'SimpleImputer', 'strategy': 'mean'}. Best is trial 1 with value: 12.864139892484474.
[I 2024-04-28 15:18:11,897] Trial 164 finished with value: 25.954326732873625 and parameters: {'model_name': 'SimpleImputer', 'strategy': 'constant'}. Best is trial 1 with value: 12.864139892484474.
[I 2024-04-28 15:18:12,094] Trial 166 finished with value: 25.954326732873625 and parameters: {'model_name': 'SimpleImputer', 'strategy': 'constant'}. Best is trial 1 with value: 12.864139892484474.
[I 2024-04-28 15:18:12,283] Trial 173 finished with value: 25.954326732873625 and parameters: {'model_name': 'SimpleImputer', 'strategy': 'constant'}. Best is trial 1 with value: 12.864139892484474.
[I 2024-04-28 15:18:12,460] Trial 146 finished with value: 12.864139892484474 and parameters: {'model_name': 'SimpleImputer', 'strategy': 'mean'}. Best is trial 1 with value: 12.864139892484474.
[I 2024-04-28 15:18:12,666] Trial 169 finished with value: 25.954326732873625 and parameters: {'model_name': 'SimpleImputer', 'strategy': 'constant'}. Best is trial 1 with value: 12.864139892484474.
[I 2024-04-28 15:18:12,828] Trial 172 finished with value: 25.954326732873625 and parameters: {'model_name': 'SimpleImputer', 'strategy': 'constant'}. Best is trial 1 with value: 12.864139892484474.
[I 2024-04-28 15:18:13,010] Trial 170 finished with value: 25.954326732873625 and parameters: {'model_name': 'SimpleImputer', 'strategy': 'constant'}. Best is trial 1 with value: 12.864139892484474.
[I 2024-04-28 15:18:13,176] Trial 176 finished with value: 25.954326732873625 and parameters: {'model_name': 'SimpleImputer', 'strategy': 'constant'}. Best is trial 1 with value: 12.864139892484474.
[I 2024-04-28 15:18:13,335] Trial 174 finished with value: 25.954326732873625 and parameters: {'model_name': 'SimpleImputer', 'strategy': 'constant'}. Best is trial 1 with value: 12.864139892484474.
[I 2024-04-28 15:18:13,564] Trial 178 finished with value: 25.954326732873625 and parameters: {'model_name': 'SimpleImputer', 'strategy': 'constant'}. Best is trial 1 with value: 12.864139892484474.
[I 2024-04-28 15:18:13,882] Trial 156 finished with value: 12.864139892484474 and parameters: {'model_name': 'SimpleImputer', 'strategy': 'mean'}. Best is trial 1 with value: 12.864139892484474.
[I 2024-04-28 15:18:14,226] Trial 168 finished with value: 12.864139892484474 and parameters: {'model_name': 'SimpleImputer', 'strategy': 'mean'}. Best is trial 1 with value: 12.864139892484474.
[I 2024-04-28 15:18:14,630] Trial 182 finished with value: 12.864139892484474 and parameters: {'model_name': 'SimpleImputer', 'strategy': 'mean'}. Best is trial 1 with value: 12.864139892484474.
[I 2024-04-28 15:18:14,907] Trial 189 finished with value: 12.864139892484474 and parameters: {'model_name': 'SimpleImputer', 'strategy': 'mean'}. Best is trial 1 with value: 12.864139892484474.
[I 2024-04-28 15:18:15,112] Trial 183 finished with value: 12.864139892484474 and parameters: {'model_name': 'SimpleImputer', 'strategy': 'mean'}. Best is trial 1 with value: 12.864139892484474.
[I 2024-04-28 15:18:15,300] Trial 177 finished with value: 12.864139892484474 and parameters: {'model_name': 'SimpleImputer', 'strategy': 'mean'}. Best is trial 1 with value: 12.864139892484474.
[I 2024-04-28 15:18:15,482] Trial 185 finished with value: 12.864139892484474 and parameters: {'model_name': 'SimpleImputer', 'strategy': 'mean'}. Best is trial 1 with value: 12.864139892484474.
[I 2024-04-28 15:18:15,795] Trial 191 finished with value: 12.864139892484474 and parameters: {'model_name': 'SimpleImputer', 'strategy': 'mean'}. Best is trial 1 with value: 12.864139892484474.
[I 2024-04-28 15:18:16,093] Trial 188 finished with value: 12.864139892484474 and parameters: {'model_name': 'SimpleImputer', 'strategy': 'mean'}. Best is trial 1 with value: 12.864139892484474.
[I 2024-04-28 15:18:16,372] Trial 193 finished with value: 12.864139892484474 and parameters: {'model_name': 'SimpleImputer', 'strategy': 'mean'}. Best is trial 1 with value: 12.864139892484474.
[I 2024-04-28 15:18:16,598] Trial 179 finished with value: 12.864139892484474 and parameters: {'model_name': 'SimpleImputer', 'strategy': 'mean'}. Best is trial 1 with value: 12.864139892484474.
[I 2024-04-28 15:18:16,813] Trial 195 finished with value: 12.864139892484474 and parameters: {'model_name': 'SimpleImputer', 'strategy': 'mean'}. Best is trial 1 with value: 12.864139892484474.
[I 2024-04-28 15:18:17,061] Trial 194 finished with value: 12.864139892484474 and parameters: {'model_name': 'SimpleImputer', 'strategy': 'mean'}. Best is trial 1 with value: 12.864139892484474.
[I 2024-04-28 15:18:17,291] Trial 190 finished with value: 12.864139892484474 and parameters: {'model_name': 'SimpleImputer', 'strategy': 'mean'}. Best is trial 1 with value: 12.864139892484474.
[I 2024-04-28 15:18:17,499] Trial 181 finished with value: 12.864139892484474 and parameters: {'model_name': 'SimpleImputer', 'strategy': 'mean'}. Best is trial 1 with value: 12.864139892484474.
[I 2024-04-28 15:18:17,669] Trial 186 finished with value: 12.864139892484474 and parameters: {'model_name': 'SimpleImputer', 'strategy': 'mean'}. Best is trial 1 with value: 12.864139892484474.
[I 2024-04-28 15:18:17,840] Trial 196 finished with value: 12.864139892484474 and parameters: {'model_name': 'SimpleImputer', 'strategy': 'mean'}. Best is trial 1 with value: 12.864139892484474.
[I 2024-04-28 15:18:18,091] Trial 192 finished with value: 12.864139892484474 and parameters: {'model_name': 'SimpleImputer', 'strategy': 'mean'}. Best is trial 1 with value: 12.864139892484474.
[I 2024-04-28 15:18:18,315] Trial 187 finished with value: 12.864139892484474 and parameters: {'model_name': 'SimpleImputer', 'strategy': 'mean'}. Best is trial 1 with value: 12.864139892484474.
[I 2024-04-28 15:18:18,523] Trial 198 finished with value: 12.864139892484474 and parameters: {'model_name': 'SimpleImputer', 'strategy': 'mean'}. Best is trial 1 with value: 12.864139892484474.
[I 2024-04-28 15:18:18,763] Trial 184 finished with value: 12.864139892484474 and parameters: {'model_name': 'SimpleImputer', 'strategy': 'mean'}. Best is trial 1 with value: 12.864139892484474.
[I 2024-04-28 15:18:18,970] Trial 197 finished with value: 12.864139892484474 and parameters: {'model_name': 'SimpleImputer', 'strategy': 'mean'}. Best is trial 1 with value: 12.864139892484474.
[I 2024-04-28 15:18:19,171] Trial 199 finished with value: 12.864139892484474 and parameters: {'model_name': 'SimpleImputer', 'strategy': 'mean'}. Best is trial 1 with value: 12.864139892484474.
