[I 2024-02-23 07:22:06,379] Trial 90 finished with value: 68.08236340261064 and parameters: {'model_name': 'SimpleImputer', 'strategy': 'most_frequent'}. Best is trial 12 with value: 67.8595062041787.
[I 2024-02-23 07:22:06,673] Trial 91 finished with value: 68.08236340261064 and parameters: {'model_name': 'SimpleImputer', 'strategy': 'most_frequent'}. Best is trial 12 with value: 67.8595062041787.
[I 2024-02-23 07:22:06,870] Trial 89 finished with value: 68.08236340261064 and parameters: {'model_name': 'SimpleImputer', 'strategy': 'most_frequent'}. Best is trial 12 with value: 67.8595062041787.
[I 2024-02-23 07:22:07,243] Trial 114 finished with value: 67.8595062041787 and parameters: {'model_name': 'SimpleImputer', 'strategy': 'median'}. Best is trial 12 with value: 67.8595062041787.
[I 2024-02-23 07:22:07,491] Trial 93 finished with value: 68.08236340261064 and parameters: {'model_name': 'SimpleImputer', 'strategy': 'most_frequent'}. Best is trial 12 with value: 67.8595062041787.
[I 2024-02-23 07:22:07,710] Trial 113 finished with value: 67.8595062041787 and parameters: {'model_name': 'SimpleImputer', 'strategy': 'median'}. Best is trial 12 with value: 67.8595062041787.
[I 2024-02-23 07:22:08,099] Trial 115 finished with value: 67.8595062041787 and parameters: {'model_name': 'SimpleImputer', 'strategy': 'median'}. Best is trial 12 with value: 67.8595062041787.
[I 2024-02-23 07:22:08,563] Trial 117 finished with value: 67.8595062041787 and parameters: {'model_name': 'SimpleImputer', 'strategy': 'median'}. Best is trial 12 with value: 67.8595062041787.
[I 2024-02-23 07:22:08,750] Trial 124 finished with value: 67.8595062041787 and parameters: {'model_name': 'SimpleImputer', 'strategy': 'median'}. Best is trial 12 with value: 67.8595062041787.
[I 2024-02-23 07:22:09,062] Trial 123 finished with value: 67.8595062041787 and parameters: {'model_name': 'SimpleImputer', 'strategy': 'median'}. Best is trial 12 with value: 67.8595062041787.
[I 2024-02-23 07:22:09,376] Trial 120 finished with value: 67.8595062041787 and parameters: {'model_name': 'SimpleImputer', 'strategy': 'median'}. Best is trial 12 with value: 67.8595062041787.
[I 2024-02-23 07:22:09,681] Trial 122 finished with value: 67.8595062041787 and parameters: {'model_name': 'SimpleImputer', 'strategy': 'median'}. Best is trial 12 with value: 67.8595062041787.
[I 2024-02-23 07:22:09,992] Trial 121 finished with value: 67.8595062041787 and parameters: {'model_name': 'SimpleImputer', 'strategy': 'median'}. Best is trial 12 with value: 67.8595062041787.
[I 2024-02-23 07:22:10,178] Trial 119 finished with value: 67.8595062041787 and parameters: {'model_name': 'SimpleImputer', 'strategy': 'median'}. Best is trial 12 with value: 67.8595062041787.
[I 2024-02-23 07:22:10,441] Trial 96 finished with value: 68.08236340261064 and parameters: {'model_name': 'SimpleImputer', 'strategy': 'most_frequent'}. Best is trial 12 with value: 67.8595062041787.
[I 2024-02-23 07:22:10,687] Trial 118 finished with value: 67.8595062041787 and parameters: {'model_name': 'SimpleImputer', 'strategy': 'median'}. Best is trial 12 with value: 67.8595062041787.
[I 2024-02-23 07:22:10,959] Trial 92 finished with value: 68.08236340261064 and parameters: {'model_name': 'SimpleImputer', 'strategy': 'most_frequent'}. Best is trial 12 with value: 67.8595062041787.
[I 2024-02-23 07:22:11,266] Trial 95 finished with value: 68.08236340261064 and parameters: {'model_name': 'SimpleImputer', 'strategy': 'most_frequent'}. Best is trial 12 with value: 67.8595062041787.
[I 2024-02-23 07:22:11,807] Trial 97 finished with value: 68.08236340261064 and parameters: {'model_name': 'SimpleImputer', 'strategy': 'most_frequent'}. Best is trial 12 with value: 67.8595062041787.
[I 2024-02-23 07:22:12,022] Trial 116 finished with value: 67.8595062041787 and parameters: {'model_name': 'SimpleImputer', 'strategy': 'median'}. Best is trial 12 with value: 67.8595062041787.
[I 2024-02-23 07:22:12,366] Trial 126 finished with value: 67.8595062041787 and parameters: {'model_name': 'SimpleImputer', 'strategy': 'median'}. Best is trial 12 with value: 67.8595062041787.
[I 2024-02-23 07:22:12,609] Trial 125 finished with value: 67.8595062041787 and parameters: {'model_name': 'SimpleImputer', 'strategy': 'median'}. Best is trial 12 with value: 67.8595062041787.
[I 2024-02-23 07:22:12,879] Trial 98 finished with value: 68.08236340261064 and parameters: {'model_name': 'SimpleImputer', 'strategy': 'most_frequent'}. Best is trial 12 with value: 67.8595062041787.
[I 2024-02-23 07:22:13,179] Trial 129 finished with value: 67.8595062041787 and parameters: {'model_name': 'SimpleImputer', 'strategy': 'median'}. Best is trial 12 with value: 67.8595062041787.
[I 2024-02-23 07:22:13,363] Trial 99 finished with value: 68.08236340261064 and parameters: {'model_name': 'SimpleImputer', 'strategy': 'most_frequent'}. Best is trial 12 with value: 67.8595062041787.
[I 2024-02-23 07:22:13,548] Trial 127 finished with value: 67.8595062041787 and parameters: {'model_name': 'SimpleImputer', 'strategy': 'median'}. Best is trial 12 with value: 67.8595062041787.
[I 2024-02-23 07:22:13,955] Trial 94 finished with value: 68.08236340261064 and parameters: {'model_name': 'SimpleImputer', 'strategy': 'most_frequent'}. Best is trial 12 with value: 67.8595062041787.
[I 2024-02-23 07:22:14,186] Trial 101 finished with value: 68.08236340261064 and parameters: {'model_name': 'SimpleImputer', 'strategy': 'most_frequent'}. Best is trial 12 with value: 67.8595062041787.
[I 2024-02-23 07:22:14,431] Trial 102 finished with value: 68.08236340261064 and parameters: {'model_name': 'SimpleImputer', 'strategy': 'most_frequent'}. Best is trial 12 with value: 67.8595062041787.
[I 2024-02-23 07:22:14,771] Trial 100 finished with value: 68.08236340261064 and parameters: {'model_name': 'SimpleImputer', 'strategy': 'most_frequent'}. Best is trial 12 with value: 67.8595062041787.
[I 2024-02-23 07:22:15,078] Trial 130 finished with value: 67.8595062041787 and parameters: {'model_name': 'SimpleImputer', 'strategy': 'median'}. Best is trial 12 with value: 67.8595062041787.
[I 2024-02-23 07:22:15,436] Trial 133 finished with value: 67.8595062041787 and parameters: {'model_name': 'SimpleImputer', 'strategy': 'median'}. Best is trial 12 with value: 67.8595062041787.
[I 2024-02-23 07:22:15,847] Trial 131 finished with value: 67.8595062041787 and parameters: {'model_name': 'SimpleImputer', 'strategy': 'median'}. Best is trial 12 with value: 67.8595062041787.
[I 2024-02-23 07:22:16,102] Trial 128 finished with value: 67.8595062041787 and parameters: {'model_name': 'SimpleImputer', 'strategy': 'median'}. Best is trial 12 with value: 67.8595062041787.
[I 2024-02-23 07:22:16,463] Trial 132 finished with value: 67.8595062041787 and parameters: {'model_name': 'SimpleImputer', 'strategy': 'median'}. Best is trial 12 with value: 67.8595062041787.
[I 2024-02-23 07:22:16,695] Trial 138 finished with value: 67.8595062041787 and parameters: {'model_name': 'SimpleImputer', 'strategy': 'median'}. Best is trial 12 with value: 67.8595062041787.
[I 2024-02-23 07:22:16,922] Trial 136 finished with value: 67.8595062041787 and parameters: {'model_name': 'SimpleImputer', 'strategy': 'median'}. Best is trial 12 with value: 67.8595062041787.
[I 2024-02-23 07:22:17,138] Trial 103 finished with value: 68.08236340261064 and parameters: {'model_name': 'SimpleImputer', 'strategy': 'most_frequent'}. Best is trial 12 with value: 67.8595062041787.
[I 2024-02-23 07:22:17,507] Trial 135 finished with value: 67.8595062041787 and parameters: {'model_name': 'SimpleImputer', 'strategy': 'median'}. Best is trial 12 with value: 67.8595062041787.
[I 2024-02-23 07:22:17,740] Trial 134 finished with value: 67.8595062041787 and parameters: {'model_name': 'SimpleImputer', 'strategy': 'median'}. Best is trial 12 with value: 67.8595062041787.
[I 2024-02-23 07:22:17,976] Trial 105 finished with value: 68.08236340261064 and parameters: {'model_name': 'SimpleImputer', 'strategy': 'most_frequent'}. Best is trial 12 with value: 67.8595062041787.
[I 2024-02-23 07:22:18,282] Trial 140 finished with value: 67.8595062041787 and parameters: {'model_name': 'SimpleImputer', 'strategy': 'median'}. Best is trial 12 with value: 67.8595062041787.
[I 2024-02-23 07:22:18,599] Trial 106 finished with value: 68.08236340261064 and parameters: {'model_name': 'SimpleImputer', 'strategy': 'most_frequent'}. Best is trial 12 with value: 67.8595062041787.
[I 2024-02-23 07:22:18,874] Trial 139 finished with value: 67.8595062041787 and parameters: {'model_name': 'SimpleImputer', 'strategy': 'median'}. Best is trial 12 with value: 67.8595062041787.
[I 2024-02-23 07:22:19,098] Trial 142 finished with value: 67.8595062041787 and parameters: {'model_name': 'SimpleImputer', 'strategy': 'median'}. Best is trial 12 with value: 67.8595062041787.
[I 2024-02-23 07:22:19,291] Trial 137 finished with value: 67.8595062041787 and parameters: {'model_name': 'SimpleImputer', 'strategy': 'median'}. Best is trial 12 with value: 67.8595062041787.
[I 2024-02-23 07:22:19,663] Trial 147 finished with value: 67.8595062041787 and parameters: {'model_name': 'SimpleImputer', 'strategy': 'median'}. Best is trial 12 with value: 67.8595062041787.
[I 2024-02-23 07:22:19,886] Trial 144 finished with value: 67.8595062041787 and parameters: {'model_name': 'SimpleImputer', 'strategy': 'median'}. Best is trial 12 with value: 67.8595062041787.
[I 2024-02-23 07:22:20,088] Trial 143 finished with value: 67.8595062041787 and parameters: {'model_name': 'SimpleImputer', 'strategy': 'median'}. Best is trial 12 with value: 67.8595062041787.
[I 2024-02-23 07:22:20,695] Trial 141 finished with value: 67.8595062041787 and parameters: {'model_name': 'SimpleImputer', 'strategy': 'median'}. Best is trial 12 with value: 67.8595062041787.
[I 2024-02-23 07:22:20,953] Trial 145 finished with value: 67.8595062041787 and parameters: {'model_name': 'SimpleImputer', 'strategy': 'median'}. Best is trial 12 with value: 67.8595062041787.
[I 2024-02-23 07:22:21,249] Trial 163 finished with value: 67.9161037524623 and parameters: {'model_name': 'SimpleImputer', 'strategy': 'mean'}. Best is trial 12 with value: 67.8595062041787.
[I 2024-02-23 07:22:21,487] Trial 153 finished with value: 67.8595062041787 and parameters: {'model_name': 'SimpleImputer', 'strategy': 'median'}. Best is trial 12 with value: 67.8595062041787.
[I 2024-02-23 07:22:21,749] Trial 166 finished with value: 67.9161037524623 and parameters: {'model_name': 'SimpleImputer', 'strategy': 'mean'}. Best is trial 12 with value: 67.8595062041787.
[I 2024-02-23 07:22:22,014] Trial 150 finished with value: 67.8595062041787 and parameters: {'model_name': 'SimpleImputer', 'strategy': 'median'}. Best is trial 12 with value: 67.8595062041787.
[I 2024-02-23 07:22:22,298] Trial 155 finished with value: 67.8595062041787 and parameters: {'model_name': 'SimpleImputer', 'strategy': 'median'}. Best is trial 12 with value: 67.8595062041787.
[I 2024-02-23 07:22:22,542] Trial 157 finished with value: 67.8595062041787 and parameters: {'model_name': 'SimpleImputer', 'strategy': 'median'}. Best is trial 12 with value: 67.8595062041787.
[I 2024-02-23 07:22:22,767] Trial 107 finished with value: 68.08236340261064 and parameters: {'model_name': 'SimpleImputer', 'strategy': 'most_frequent'}. Best is trial 12 with value: 67.8595062041787.
[I 2024-02-23 07:22:23,017] Trial 146 finished with value: 67.8595062041787 and parameters: {'model_name': 'SimpleImputer', 'strategy': 'median'}. Best is trial 12 with value: 67.8595062041787.
[I 2024-02-23 07:22:23,217] Trial 148 finished with value: 67.8595062041787 and parameters: {'model_name': 'SimpleImputer', 'strategy': 'median'}. Best is trial 12 with value: 67.8595062041787.
[I 2024-02-23 07:22:23,418] Trial 165 finished with value: 67.9161037524623 and parameters: {'model_name': 'SimpleImputer', 'strategy': 'mean'}. Best is trial 12 with value: 67.8595062041787.
[I 2024-02-23 07:22:23,685] Trial 151 finished with value: 67.8595062041787 and parameters: {'model_name': 'SimpleImputer', 'strategy': 'median'}. Best is trial 12 with value: 67.8595062041787.
[I 2024-02-23 07:22:23,896] Trial 108 finished with value: 68.08236340261064 and parameters: {'model_name': 'SimpleImputer', 'strategy': 'most_frequent'}. Best is trial 12 with value: 67.8595062041787.
[I 2024-02-23 07:22:24,138] Trial 158 finished with value: 67.8595062041787 and parameters: {'model_name': 'SimpleImputer', 'strategy': 'median'}. Best is trial 12 with value: 67.8595062041787.
[I 2024-02-23 07:22:24,370] Trial 149 finished with value: 67.8595062041787 and parameters: {'model_name': 'SimpleImputer', 'strategy': 'median'}. Best is trial 12 with value: 67.8595062041787.
[I 2024-02-23 07:22:24,680] Trial 154 finished with value: 67.8595062041787 and parameters: {'model_name': 'SimpleImputer', 'strategy': 'median'}. Best is trial 12 with value: 67.8595062041787.
[I 2024-02-23 07:22:24,899] Trial 152 finished with value: 67.8595062041787 and parameters: {'model_name': 'SimpleImputer', 'strategy': 'median'}. Best is trial 12 with value: 67.8595062041787.
[I 2024-02-23 07:22:25,279] Trial 164 finished with value: 67.9161037524623 and parameters: {'model_name': 'SimpleImputer', 'strategy': 'mean'}. Best is trial 12 with value: 67.8595062041787.
[I 2024-02-23 07:22:25,549] Trial 170 finished with value: 67.9161037524623 and parameters: {'model_name': 'SimpleImputer', 'strategy': 'mean'}. Best is trial 12 with value: 67.8595062041787.
[I 2024-02-23 07:22:25,792] Trial 172 finished with value: 67.9161037524623 and parameters: {'model_name': 'SimpleImputer', 'strategy': 'mean'}. Best is trial 12 with value: 67.8595062041787.
[I 2024-02-23 07:22:25,963] Trial 171 finished with value: 67.9161037524623 and parameters: {'model_name': 'SimpleImputer', 'strategy': 'mean'}. Best is trial 12 with value: 67.8595062041787.
[I 2024-02-23 07:22:26,205] Trial 174 finished with value: 67.9161037524623 and parameters: {'model_name': 'SimpleImputer', 'strategy': 'mean'}. Best is trial 12 with value: 67.8595062041787.
[I 2024-02-23 07:22:26,406] Trial 169 finished with value: 67.9161037524623 and parameters: {'model_name': 'SimpleImputer', 'strategy': 'mean'}. Best is trial 12 with value: 67.8595062041787.
[I 2024-02-23 07:22:26,654] Trial 175 finished with value: 67.9161037524623 and parameters: {'model_name': 'SimpleImputer', 'strategy': 'mean'}. Best is trial 12 with value: 67.8595062041787.
[I 2024-02-23 07:22:26,876] Trial 167 finished with value: 67.9161037524623 and parameters: {'model_name': 'SimpleImputer', 'strategy': 'mean'}. Best is trial 12 with value: 67.8595062041787.
[I 2024-02-23 07:22:27,071] Trial 159 finished with value: 67.8595062041787 and parameters: {'model_name': 'SimpleImputer', 'strategy': 'median'}. Best is trial 12 with value: 67.8595062041787.
[I 2024-02-23 07:22:27,402] Trial 160 finished with value: 67.8595062041787 and parameters: {'model_name': 'SimpleImputer', 'strategy': 'median'}. Best is trial 12 with value: 67.8595062041787.
[I 2024-02-23 07:22:27,600] Trial 173 finished with value: 67.9161037524623 and parameters: {'model_name': 'SimpleImputer', 'strategy': 'mean'}. Best is trial 12 with value: 67.8595062041787.
[I 2024-02-23 07:22:27,846] Trial 156 finished with value: 67.8595062041787 and parameters: {'model_name': 'SimpleImputer', 'strategy': 'median'}. Best is trial 12 with value: 67.8595062041787.
[I 2024-02-23 07:22:28,078] Trial 161 finished with value: 67.8595062041787 and parameters: {'model_name': 'SimpleImputer', 'strategy': 'median'}. Best is trial 12 with value: 67.8595062041787.
[I 2024-02-23 07:22:28,339] Trial 180 finished with value: 67.9161037524623 and parameters: {'model_name': 'SimpleImputer', 'strategy': 'mean'}. Best is trial 12 with value: 67.8595062041787.
[I 2024-02-23 07:22:28,502] Trial 162 finished with value: 67.8595062041787 and parameters: {'model_name': 'SimpleImputer', 'strategy': 'median'}. Best is trial 12 with value: 67.8595062041787.
[I 2024-02-23 07:22:28,792] Trial 178 finished with value: 67.9161037524623 and parameters: {'model_name': 'SimpleImputer', 'strategy': 'mean'}. Best is trial 12 with value: 67.8595062041787.
[I 2024-02-23 07:22:29,033] Trial 176 finished with value: 67.9161037524623 and parameters: {'model_name': 'SimpleImputer', 'strategy': 'mean'}. Best is trial 12 with value: 67.8595062041787.
[I 2024-02-23 07:22:29,224] Trial 182 finished with value: 67.9161037524623 and parameters: {'model_name': 'SimpleImputer', 'strategy': 'mean'}. Best is trial 12 with value: 67.8595062041787.
[I 2024-02-23 07:22:29,459] Trial 181 finished with value: 67.9161037524623 and parameters: {'model_name': 'SimpleImputer', 'strategy': 'mean'}. Best is trial 12 with value: 67.8595062041787.
[I 2024-02-23 07:22:29,664] Trial 177 finished with value: 67.9161037524623 and parameters: {'model_name': 'SimpleImputer', 'strategy': 'mean'}. Best is trial 12 with value: 67.8595062041787.
[I 2024-02-23 07:22:29,919] Trial 179 finished with value: 67.9161037524623 and parameters: {'model_name': 'SimpleImputer', 'strategy': 'mean'}. Best is trial 12 with value: 67.8595062041787.
[I 2024-02-23 07:22:30,162] Trial 168 finished with value: 67.8595062041787 and parameters: {'model_name': 'SimpleImputer', 'strategy': 'median'}. Best is trial 12 with value: 67.8595062041787.
[I 2024-02-23 07:22:30,517] Trial 184 finished with value: 67.9161037524623 and parameters: {'model_name': 'SimpleImputer', 'strategy': 'mean'}. Best is trial 12 with value: 67.8595062041787.
[I 2024-02-23 07:22:30,777] Trial 196 finished with value: 68.18390502235356 and parameters: {'model_name': 'SimpleImputer', 'strategy': 'constant'}. Best is trial 12 with value: 67.8595062041787.
[I 2024-02-23 07:22:30,969] Trial 189 finished with value: 67.9161037524623 and parameters: {'model_name': 'SimpleImputer', 'strategy': 'mean'}. Best is trial 12 with value: 67.8595062041787.
[I 2024-02-23 07:22:31,228] Trial 194 finished with value: 67.9161037524623 and parameters: {'model_name': 'SimpleImputer', 'strategy': 'mean'}. Best is trial 12 with value: 67.8595062041787.
[I 2024-02-23 07:22:31,416] Trial 187 finished with value: 67.9161037524623 and parameters: {'model_name': 'SimpleImputer', 'strategy': 'mean'}. Best is trial 12 with value: 67.8595062041787.
[I 2024-02-23 07:22:31,577] Trial 188 finished with value: 67.9161037524623 and parameters: {'model_name': 'SimpleImputer', 'strategy': 'mean'}. Best is trial 12 with value: 67.8595062041787.
[I 2024-02-23 07:22:31,840] Trial 186 finished with value: 67.9161037524623 and parameters: {'model_name': 'SimpleImputer', 'strategy': 'mean'}. Best is trial 12 with value: 67.8595062041787.
[I 2024-02-23 07:22:32,022] Trial 197 finished with value: 68.18390502235356 and parameters: {'model_name': 'SimpleImputer', 'strategy': 'constant'}. Best is trial 12 with value: 67.8595062041787.
[I 2024-02-23 07:22:32,182] Trial 199 finished with value: 68.18390502235356 and parameters: {'model_name': 'SimpleImputer', 'strategy': 'constant'}. Best is trial 12 with value: 67.8595062041787.
[I 2024-02-23 07:22:32,359] Trial 190 finished with value: 67.9161037524623 and parameters: {'model_name': 'SimpleImputer', 'strategy': 'mean'}. Best is trial 12 with value: 67.8595062041787.
[I 2024-02-23 07:22:32,605] Trial 198 finished with value: 68.18390502235356 and parameters: {'model_name': 'SimpleImputer', 'strategy': 'constant'}. Best is trial 12 with value: 67.8595062041787.
[I 2024-02-23 07:22:32,841] Trial 192 finished with value: 67.9161037524623 and parameters: {'model_name': 'SimpleImputer', 'strategy': 'mean'}. Best is trial 12 with value: 67.8595062041787.
[I 2024-02-23 07:22:33,051] Trial 185 finished with value: 67.8595062041787 and parameters: {'model_name': 'SimpleImputer', 'strategy': 'median'}. Best is trial 12 with value: 67.8595062041787.
[I 2024-02-23 07:22:33,306] Trial 183 finished with value: 67.8595062041787 and parameters: {'model_name': 'SimpleImputer', 'strategy': 'median'}. Best is trial 12 with value: 67.8595062041787.
[I 2024-02-23 07:22:33,571] Trial 191 finished with value: 67.8595062041787 and parameters: {'model_name': 'SimpleImputer', 'strategy': 'median'}. Best is trial 12 with value: 67.8595062041787.
[I 2024-02-23 07:22:33,748] Trial 195 finished with value: 67.8595062041787 and parameters: {'model_name': 'SimpleImputer', 'strategy': 'median'}. Best is trial 12 with value: 67.8595062041787.
