[I 2024-02-07 12:23:41,304] Trial 10 finished with value: 53.650899926288204 and parameters: {'model_name': 'SimpleImputer', 'strategy': 'constant'}. Best is trial 10 with value: 53.650899926288204.
[I 2024-02-07 12:23:42,149] Trial 8 finished with value: 53.650899926288204 and parameters: {'model_name': 'SimpleImputer', 'strategy': 'constant'}. Best is trial 10 with value: 53.650899926288204.
[I 2024-02-07 12:23:42,800] Trial 15 finished with value: 14.294336030690548 and parameters: {'model_name': 'SimpleImputer', 'strategy': 'mean'}. Best is trial 15 with value: 14.294336030690548.
[I 2024-02-07 12:23:43,726] Trial 7 finished with value: 14.294336030690548 and parameters: {'model_name': 'SimpleImputer', 'strategy': 'mean'}. Best is trial 15 with value: 14.294336030690548.
[I 2024-02-07 12:23:45,499] Trial 27 finished with value: 14.40110701111231 and parameters: {'model_name': 'SimpleImputer', 'strategy': 'median'}. Best is trial 15 with value: 14.294336030690548.
[I 2024-02-07 12:23:46,282] Trial 40 finished with value: 53.650899926288204 and parameters: {'model_name': 'SimpleImputer', 'strategy': 'constant'}. Best is trial 15 with value: 14.294336030690548.
[I 2024-02-07 12:23:47,351] Trial 44 finished with value: 14.40110701111231 and parameters: {'model_name': 'SimpleImputer', 'strategy': 'median'}. Best is trial 15 with value: 14.294336030690548.
[I 2024-02-07 12:23:47,967] Trial 48 finished with value: 14.294336030690548 and parameters: {'model_name': 'SimpleImputer', 'strategy': 'mean'}. Best is trial 15 with value: 14.294336030690548.
[I 2024-02-07 12:23:48,490] Trial 39 finished with value: 14.40110701111231 and parameters: {'model_name': 'SimpleImputer', 'strategy': 'median'}. Best is trial 15 with value: 14.294336030690548.
2024-02-07 12:23:53.299136: E external/local_xla/xla/stream_executor/cuda/cuda_driver.cc:274] failed call to cuInit: CUDA_ERROR_NO_DEVICE: no CUDA-capable device is detected
2024-02-07 12:23:53.504343: I tensorflow/compiler/mlir/mlir_graph_optimization_pass.cc:388] MLIR V1 optimization pass is not enabled
[I 2024-02-07 12:23:55,614] Trial 42 finished with value: inf and parameters: {'model_name': 'GAIN', 'batch_size': 455, 'hint_rate': 0.72, 'alpha': 96, 'iterations': 1}. Best is trial 15 with value: 14.294336030690548.
[I 2024-02-07 12:23:56,408] Trial 28 finished with value: inf and parameters: {'model_name': 'GAIN', 'batch_size': 531, 'hint_rate': 0.66, 'alpha': 0, 'iterations': 4}. Best is trial 15 with value: 14.294336030690548.
[I 2024-02-07 12:23:59,163] Trial 53 finished with value: inf and parameters: {'model_name': 'GAIN', 'batch_size': 551, 'hint_rate': 0.09, 'alpha': 82, 'iterations': 11069}. Best is trial 15 with value: 14.294336030690548.
[I 2024-02-07 12:24:01,379] Trial 2 finished with value: 14.015712985344866 and parameters: {'model_name': 'KNNImputer', 'weights': 'uniform', 'keep_empty_features': False}. Best is trial 2 with value: 14.015712985344866.
[I 2024-02-07 12:24:02,444] Trial 6 finished with value: 14.015712985344866 and parameters: {'model_name': 'KNNImputer', 'weights': 'uniform', 'keep_empty_features': False}. Best is trial 2 with value: 14.015712985344866.
[I 2024-02-07 12:24:03,553] Trial 0 finished with value: 14.015712985344866 and parameters: {'model_name': 'KNNImputer', 'weights': 'uniform', 'keep_empty_features': False}. Best is trial 2 with value: 14.015712985344866.
[I 2024-02-07 12:24:04,802] Trial 22 finished with value: 14.020091315742395 and parameters: {'model_name': 'KNNImputer', 'weights': 'distance', 'keep_empty_features': False}. Best is trial 2 with value: 14.015712985344866.
[I 2024-02-07 12:24:05,625] Trial 20 finished with value: 14.020091315742395 and parameters: {'model_name': 'KNNImputer', 'weights': 'distance', 'keep_empty_features': False}. Best is trial 2 with value: 14.015712985344866.
[I 2024-02-07 12:24:06,134] Trial 3 finished with value: 14.020091315742395 and parameters: {'model_name': 'KNNImputer', 'weights': 'distance', 'keep_empty_features': False}. Best is trial 2 with value: 14.015712985344866.
[I 2024-02-07 12:24:06,705] Trial 9 finished with value: 14.015712985344866 and parameters: {'model_name': 'KNNImputer', 'weights': 'uniform', 'keep_empty_features': False}. Best is trial 2 with value: 14.015712985344866.
[I 2024-02-07 12:24:07,234] Trial 35 finished with value: 14.020091315742395 and parameters: {'model_name': 'KNNImputer', 'weights': 'distance', 'keep_empty_features': False}. Best is trial 2 with value: 14.015712985344866.
[I 2024-02-07 12:24:07,821] Trial 19 finished with value: 14.015712985344866 and parameters: {'model_name': 'KNNImputer', 'weights': 'uniform', 'keep_empty_features': False}. Best is trial 2 with value: 14.015712985344866.
[I 2024-02-07 12:24:08,375] Trial 43 finished with value: 14.020091315742395 and parameters: {'model_name': 'KNNImputer', 'weights': 'distance', 'keep_empty_features': False}. Best is trial 2 with value: 14.015712985344866.
[I 2024-02-07 12:24:08,375] Trial 33 finished with value: 14.020091315742395 and parameters: {'model_name': 'KNNImputer', 'weights': 'distance', 'keep_empty_features': False}. Best is trial 2 with value: 14.015712985344866.
[I 2024-02-07 12:24:09,473] Trial 24 finished with value: 14.020091315742395 and parameters: {'model_name': 'KNNImputer', 'weights': 'distance', 'keep_empty_features': False}. Best is trial 2 with value: 14.015712985344866.
[I 2024-02-07 12:24:10,167] Trial 29 finished with value: 14.015712985344866 and parameters: {'model_name': 'KNNImputer', 'weights': 'uniform', 'keep_empty_features': False}. Best is trial 2 with value: 14.015712985344866.
[I 2024-02-07 12:24:10,867] Trial 31 finished with value: 14.015712985344866 and parameters: {'model_name': 'KNNImputer', 'weights': 'uniform', 'keep_empty_features': False}. Best is trial 2 with value: 14.015712985344866.
[I 2024-02-07 12:24:11,912] Trial 45 finished with value: 14.020091315742395 and parameters: {'model_name': 'KNNImputer', 'weights': 'distance', 'keep_empty_features': False}. Best is trial 2 with value: 14.015712985344866.
[I 2024-02-07 12:24:13,075] Trial 51 finished with value: 14.020091315742395 and parameters: {'model_name': 'KNNImputer', 'weights': 'distance', 'keep_empty_features': False}. Best is trial 2 with value: 14.015712985344866.
[I 2024-02-07 12:24:13,648] Trial 46 finished with value: 15.823266014405755 and parameters: {'model_name': 'SimpleImputer', 'strategy': 'most_frequent'}. Best is trial 2 with value: 14.015712985344866.
[I 2024-02-07 12:24:14,347] Trial 50 finished with value: 15.823266014405755 and parameters: {'model_name': 'SimpleImputer', 'strategy': 'most_frequent'}. Best is trial 2 with value: 14.015712985344866.
[I 2024-02-07 12:24:15,897] Trial 56 finished with value: 14.015712985344866 and parameters: {'model_name': 'KNNImputer', 'weights': 'uniform', 'keep_empty_features': False}. Best is trial 2 with value: 14.015712985344866.
[I 2024-02-07 12:24:23,208] Trial 59 finished with value: 14.020091315742395 and parameters: {'model_name': 'KNNImputer', 'weights': 'distance', 'keep_empty_features': False}. Best is trial 2 with value: 14.015712985344866.
[I 2024-02-07 12:24:26,141] Trial 60 finished with value: 14.015712985344866 and parameters: {'model_name': 'KNNImputer', 'weights': 'uniform', 'keep_empty_features': False}. Best is trial 2 with value: 14.015712985344866.
[I 2024-02-07 12:24:27,196] Trial 61 finished with value: 14.015712985344866 and parameters: {'model_name': 'KNNImputer', 'weights': 'uniform', 'keep_empty_features': False}. Best is trial 2 with value: 14.015712985344866.
[I 2024-02-07 12:24:28,189] Trial 62 finished with value: 14.015712985344866 and parameters: {'model_name': 'KNNImputer', 'weights': 'uniform', 'keep_empty_features': False}. Best is trial 2 with value: 14.015712985344866.
[I 2024-02-07 12:24:28,973] Trial 63 finished with value: 14.015712985344866 and parameters: {'model_name': 'KNNImputer', 'weights': 'uniform', 'keep_empty_features': False}. Best is trial 2 with value: 14.015712985344866.
[I 2024-02-07 12:24:44,081] Trial 71 finished with value: 14.294336030690548 and parameters: {'model_name': 'RandomForestImputer', 'max_iter': 1, 'decreasing': False, 'min_samples_split': 1.0, 'min_samples_leaf': 0.9, 'max_features': 0.30000000000000004, 'warm_start': True}. Best is trial 2 with value: 14.015712985344866.
[I 2024-02-07 12:24:45,636] Trial 70 finished with value: 14.294336030690548 and parameters: {'model_name': 'RandomForestImputer', 'max_iter': 1, 'decreasing': True, 'min_samples_split': 1.0, 'min_samples_leaf': 0.2, 'max_features': 0.6, 'warm_start': True}. Best is trial 2 with value: 14.015712985344866.
[I 2024-02-07 12:24:47,682] Trial 75 finished with value: 14.294336030690548 and parameters: {'model_name': 'RandomForestImputer', 'max_iter': 1, 'decreasing': False, 'min_samples_split': 0.5, 'min_samples_leaf': 0.4, 'max_features': 0.4, 'warm_start': True}. Best is trial 2 with value: 14.015712985344866.
[I 2024-02-07 12:24:56,979] Trial 80 finished with value: 14.294336030690548 and parameters: {'model_name': 'RandomForestImputer', 'max_iter': 1, 'decreasing': False, 'min_samples_split': 0.0, 'min_samples_leaf': 0.2, 'max_features': 0.7000000000000001, 'warm_start': True}. Best is trial 2 with value: 14.015712985344866.
[I 2024-02-07 12:25:42,092] Trial 47 finished with value: 57.13240331878673 and parameters: {'model_name': 'RandomForestImputer', 'max_iter': 2, 'decreasing': False, 'min_samples_split': 0.1, 'min_samples_leaf': 0.6, 'max_features': 0.30000000000000004, 'warm_start': True}. Best is trial 2 with value: 14.015712985344866.
[I 2024-02-07 12:25:50,772] Trial 49 finished with value: 22.275436418605175 and parameters: {'model_name': 'GAIN', 'batch_size': 3, 'hint_rate': 0.33, 'alpha': 26, 'iterations': 2}. Best is trial 2 with value: 14.015712985344866.
[I 2024-02-07 12:25:51,501] Trial 13 finished with value: 22.51042507660339 and parameters: {'model_name': 'GAIN', 'batch_size': 107, 'hint_rate': 0.45, 'alpha': 19, 'iterations': 1}. Best is trial 2 with value: 14.015712985344866.
[I 2024-02-07 12:25:54,775] Trial 4 finished with value: 19.697363079011147 and parameters: {'model_name': 'GAIN', 'batch_size': 2, 'hint_rate': 0.77, 'alpha': 9, 'iterations': 6}. Best is trial 2 with value: 14.015712985344866.
[I 2024-02-07 12:26:06,984] Trial 90 finished with value: 14.015712985344866 and parameters: {'model_name': 'KNNImputer', 'weights': 'uniform', 'keep_empty_features': False}. Best is trial 2 with value: 14.015712985344866.
[I 2024-02-07 12:26:20,709] Trial 92 finished with value: 14.015712985344866 and parameters: {'model_name': 'KNNImputer', 'weights': 'uniform', 'keep_empty_features': False}. Best is trial 2 with value: 14.015712985344866.
[I 2024-02-07 12:26:59,075] Trial 1 finished with value: 57.15410433529165 and parameters: {'model_name': 'RandomForestImputer', 'max_iter': 5, 'decreasing': False, 'min_samples_split': 0.9, 'min_samples_leaf': 0.4, 'max_features': 0.8, 'warm_start': True}. Best is trial 2 with value: 14.015712985344866.
[I 2024-02-07 12:27:10,441] Trial 94 finished with value: 14.015712985344866 and parameters: {'model_name': 'KNNImputer', 'weights': 'uniform', 'keep_empty_features': False}. Best is trial 2 with value: 14.015712985344866.
[I 2024-02-07 12:27:16,811] Trial 32 finished with value: 14.294336030690548 and parameters: {'model_name': 'RandomForestImputer', 'max_iter': 1, 'decreasing': False, 'min_samples_split': 0.1, 'min_samples_leaf': 0.6, 'max_features': 0.8, 'warm_start': False}. Best is trial 2 with value: 14.015712985344866.
[I 2024-02-07 12:27:26,156] Trial 95 finished with value: 14.015712985344866 and parameters: {'model_name': 'KNNImputer', 'weights': 'uniform', 'keep_empty_features': False}. Best is trial 2 with value: 14.015712985344866.
[I 2024-02-07 12:27:31,794] Trial 12 finished with value: 16.213105599137926 and parameters: {'model_name': 'GAIN', 'batch_size': 4, 'hint_rate': 0.4, 'alpha': 22, 'iterations': 44}. Best is trial 2 with value: 14.015712985344866.
[I 2024-02-07 12:27:34,447] Trial 73 finished with value: 14.294336030690548 and parameters: {'model_name': 'RandomForestImputer', 'max_iter': 1, 'decreasing': False, 'min_samples_split': 0.30000000000000004, 'min_samples_leaf': 0.7000000000000001, 'max_features': 0.2, 'warm_start': False}. Best is trial 2 with value: 14.015712985344866.
[I 2024-02-07 12:28:17,100] Trial 11 finished with value: 57.19546577381582 and parameters: {'model_name': 'RandomForestImputer', 'max_iter': 9, 'decreasing': False, 'min_samples_split': 0.30000000000000004, 'min_samples_leaf': 0.2, 'max_features': 0.30000000000000004, 'warm_start': True}. Best is trial 2 with value: 14.015712985344866.
[I 2024-02-07 12:29:15,642] Trial 37 finished with value: 67.41291429941444 and parameters: {'model_name': 'RandomForestImputer', 'max_iter': 12, 'decreasing': True, 'min_samples_split': 0.8, 'min_samples_leaf': 0.1, 'max_features': 0.4, 'warm_start': True}. Best is trial 2 with value: 14.015712985344866.
[I 2024-02-07 12:29:21,767] Trial 79 finished with value: 5.384129319781594 and parameters: {'model_name': 'IterativeImputer', 'sample_posterior': False, 'initial_strategy': 'mean', 'imputation_order': 'ascending'}. Best is trial 79 with value: 5.384129319781594.
[I 2024-02-07 12:29:23,434] Trial 57 finished with value: 5.384429380318737 and parameters: {'model_name': 'IterativeImputer', 'sample_posterior': False, 'initial_strategy': 'constant', 'imputation_order': 'random'}. Best is trial 79 with value: 5.384129319781594.
[I 2024-02-07 12:29:25,430] Trial 18 finished with value: 15.6320930783647 and parameters: {'model_name': 'GAIN', 'batch_size': 11, 'hint_rate': 0.49, 'alpha': 52, 'iterations': 85}. Best is trial 79 with value: 5.384129319781594.
[I 2024-02-07 12:29:39,453] Trial 17 finished with value: 5.385148553021528 and parameters: {'model_name': 'IterativeImputer', 'sample_posterior': False, 'initial_strategy': 'most_frequent', 'imputation_order': 'random'}. Best is trial 79 with value: 5.384129319781594.
[I 2024-02-07 12:29:50,395] Trial 74 finished with value: 5.382502185293559 and parameters: {'model_name': 'IterativeImputer', 'sample_posterior': False, 'initial_strategy': 'median', 'imputation_order': 'arabic'}. Best is trial 74 with value: 5.382502185293559.
[I 2024-02-07 12:29:58,311] Trial 64 finished with value: 5.383980294957166 and parameters: {'model_name': 'IterativeImputer', 'sample_posterior': False, 'initial_strategy': 'most_frequent', 'imputation_order': 'roman'}. Best is trial 74 with value: 5.382502185293559.
[I 2024-02-07 12:30:04,233] Trial 87 finished with value: 5.382814208970731 and parameters: {'model_name': 'IterativeImputer', 'sample_posterior': False, 'initial_strategy': 'most_frequent', 'imputation_order': 'random'}. Best is trial 74 with value: 5.382502185293559.
[I 2024-02-07 12:31:22,149] Trial 99 finished with value: 5.384270813698193 and parameters: {'model_name': 'IterativeImputer', 'sample_posterior': False, 'initial_strategy': 'mean', 'imputation_order': 'random'}. Best is trial 74 with value: 5.382502185293559.
[I 2024-02-07 12:31:36,224] Trial 21 finished with value: 14.3665112891271 and parameters: {'model_name': 'RandomForestImputer', 'max_iter': 2, 'decreasing': True, 'min_samples_split': 0.0, 'min_samples_leaf': 0.7000000000000001, 'max_features': 0.6, 'warm_start': False}. Best is trial 74 with value: 5.382502185293559.
[I 2024-02-07 12:32:26,105] Trial 52 finished with value: 63.551859496723374 and parameters: {'model_name': 'RandomForestImputer', 'max_iter': 38, 'decreasing': True, 'min_samples_split': 0.1, 'min_samples_leaf': 0.5, 'max_features': 0.1, 'warm_start': True}. Best is trial 74 with value: 5.382502185293559.
[I 2024-02-07 12:32:45,484] Trial 41 finished with value: 63.64059351264831 and parameters: {'model_name': 'RandomForestImputer', 'max_iter': 36, 'decreasing': True, 'min_samples_split': 0.5, 'min_samples_leaf': 0.8, 'max_features': 0.30000000000000004, 'warm_start': True}. Best is trial 74 with value: 5.382502185293559.
[I 2024-02-07 12:33:23,445] Trial 103 finished with value: 5.38502859859013 and parameters: {'model_name': 'IterativeImputer', 'sample_posterior': False, 'initial_strategy': 'mean', 'imputation_order': 'random'}. Best is trial 74 with value: 5.382502185293559.
[I 2024-02-07 12:33:59,570] Trial 30 finished with value: 13.51839187441153 and parameters: {'model_name': 'RandomForestImputer', 'max_iter': 4, 'decreasing': False, 'min_samples_split': 0.7000000000000001, 'min_samples_leaf': 0.30000000000000004, 'max_features': 0.1, 'warm_start': False}. Best is trial 74 with value: 5.382502185293559.
[I 2024-02-07 12:34:04,996] Trial 105 finished with value: 5.389987403183802 and parameters: {'model_name': 'IterativeImputer', 'sample_posterior': False, 'initial_strategy': 'constant', 'imputation_order': 'random'}. Best is trial 74 with value: 5.382502185293559.
[I 2024-02-07 12:34:05,915] Trial 104 finished with value: 5.384458106043121 and parameters: {'model_name': 'IterativeImputer', 'sample_posterior': False, 'initial_strategy': 'constant', 'imputation_order': 'random'}. Best is trial 74 with value: 5.382502185293559.
[I 2024-02-07 12:34:07,586] Trial 102 finished with value: 5.384129319781594 and parameters: {'model_name': 'IterativeImputer', 'sample_posterior': False, 'initial_strategy': 'mean', 'imputation_order': 'ascending'}. Best is trial 74 with value: 5.382502185293559.
[I 2024-02-07 12:34:11,948] Trial 108 finished with value: 5.383819162214409 and parameters: {'model_name': 'IterativeImputer', 'sample_posterior': False, 'initial_strategy': 'most_frequent', 'imputation_order': 'random'}. Best is trial 74 with value: 5.382502185293559.
[I 2024-02-07 12:34:26,507] Trial 106 finished with value: 5.383272676699866 and parameters: {'model_name': 'IterativeImputer', 'sample_posterior': False, 'initial_strategy': 'median', 'imputation_order': 'random'}. Best is trial 74 with value: 5.382502185293559.
[I 2024-02-07 12:34:35,843] Trial 101 finished with value: 5.383980294957166 and parameters: {'model_name': 'IterativeImputer', 'sample_posterior': False, 'initial_strategy': 'most_frequent', 'imputation_order': 'roman'}. Best is trial 74 with value: 5.382502185293559.
[I 2024-02-07 12:35:00,936] Trial 107 finished with value: 5.383831515455606 and parameters: {'model_name': 'IterativeImputer', 'sample_posterior': False, 'initial_strategy': 'most_frequent', 'imputation_order': 'random'}. Best is trial 74 with value: 5.382502185293559.
[I 2024-02-07 12:35:25,340] Trial 109 finished with value: 5.38377115876038 and parameters: {'model_name': 'IterativeImputer', 'sample_posterior': False, 'initial_strategy': 'most_frequent', 'imputation_order': 'random'}. Best is trial 74 with value: 5.382502185293559.
[I 2024-02-07 12:36:21,454] Trial 110 finished with value: 5.383986761995031 and parameters: {'model_name': 'IterativeImputer', 'sample_posterior': False, 'initial_strategy': 'most_frequent', 'imputation_order': 'random'}. Best is trial 74 with value: 5.382502185293559.
[I 2024-02-07 12:37:02,387] Trial 111 finished with value: 5.383833505493821 and parameters: {'model_name': 'IterativeImputer', 'sample_posterior': False, 'initial_strategy': 'most_frequent', 'imputation_order': 'random'}. Best is trial 74 with value: 5.382502185293559.
[I 2024-02-07 12:37:07,768] Trial 112 finished with value: 5.383938243625419 and parameters: {'model_name': 'IterativeImputer', 'sample_posterior': False, 'initial_strategy': 'most_frequent', 'imputation_order': 'random'}. Best is trial 74 with value: 5.382502185293559.
[I 2024-02-07 12:37:13,466] Trial 65 finished with value: 57.12625300131167 and parameters: {'model_name': 'RandomForestImputer', 'max_iter': 71, 'decreasing': False, 'min_samples_split': 0.7000000000000001, 'min_samples_leaf': 0.6, 'max_features': 0.7000000000000001, 'warm_start': True}. Best is trial 74 with value: 5.382502185293559.
[I 2024-02-07 12:37:55,208] Trial 113 finished with value: 5.384843123463658 and parameters: {'model_name': 'IterativeImputer', 'sample_posterior': False, 'initial_strategy': 'mean', 'imputation_order': 'random'}. Best is trial 74 with value: 5.382502185293559.
[I 2024-02-07 12:38:10,394] Trial 114 finished with value: 5.3839298325483815 and parameters: {'model_name': 'IterativeImputer', 'sample_posterior': False, 'initial_strategy': 'mean', 'imputation_order': 'random'}. Best is trial 74 with value: 5.382502185293559.
[I 2024-02-07 12:38:27,910] Trial 117 finished with value: 5.384129319781594 and parameters: {'model_name': 'IterativeImputer', 'sample_posterior': False, 'initial_strategy': 'mean', 'imputation_order': 'ascending'}. Best is trial 74 with value: 5.382502185293559.
[I 2024-02-07 12:38:34,032] Trial 118 finished with value: 5.384129319781594 and parameters: {'model_name': 'IterativeImputer', 'sample_posterior': False, 'initial_strategy': 'mean', 'imputation_order': 'ascending'}. Best is trial 74 with value: 5.382502185293559.
[I 2024-02-07 12:38:44,040] Trial 119 finished with value: 5.3828614176185585 and parameters: {'model_name': 'IterativeImputer', 'sample_posterior': False, 'initial_strategy': 'median', 'imputation_order': 'ascending'}. Best is trial 74 with value: 5.382502185293559.
[I 2024-02-07 12:38:46,813] Trial 116 finished with value: 5.383979865172554 and parameters: {'model_name': 'IterativeImputer', 'sample_posterior': False, 'initial_strategy': 'median', 'imputation_order': 'roman'}. Best is trial 74 with value: 5.382502185293559.
[I 2024-02-07 12:38:51,338] Trial 115 finished with value: 5.384092422731925 and parameters: {'model_name': 'IterativeImputer', 'sample_posterior': False, 'initial_strategy': 'mean', 'imputation_order': 'arabic'}. Best is trial 74 with value: 5.382502185293559.
