Run: 7
/cm/local/apps/slurm/var/spool/job694945/slurm_script: line 23: /common/ketrong/minconda3/etc/profile.d/conda.sh: No such file or directory
/cm/local/apps/slurm/var/spool/job694945/slurm_script: line 26: $'\nconda create --name tpot2devenv -c conda-forge python=3.10\n': command not found
/cm/local/apps/slurm/var/spool/job694945/slurm_script: line 31: $'\npip install -r requirements.txt\n': command not found
RunStart
2024-03-02 03:48:02.444636: I tensorflow/core/util/port.cc:113] oneDNN custom operations are on. You may see slightly different numerical results due to floating-point round-off errors from different computation orders. To turn them off, set the environment variable `TF_ENABLE_ONEDNN_OPTS=0`.
2024-03-02 03:48:02.480546: E external/local_xla/xla/stream_executor/cuda/cuda_dnn.cc:9261] Unable to register cuDNN factory: Attempting to register factory for plugin cuDNN when one has already been registered
2024-03-02 03:48:02.480567: E external/local_xla/xla/stream_executor/cuda/cuda_fft.cc:607] Unable to register cuFFT factory: Attempting to register factory for plugin cuFFT when one has already been registered
2024-03-02 03:48:02.481975: E external/local_xla/xla/stream_executor/cuda/cuda_blas.cc:1515] Unable to register cuBLAS factory: Attempting to register factory for plugin cuBLAS when one has already been registered
2024-03-02 03:48:02.488084: I tensorflow/core/platform/cpu_feature_guard.cc:182] This TensorFlow binary is optimized to use available CPU instructions in performance-critical operations.
To enable the following instructions: AVX2 AVX512F AVX512_VNNI FMA, in other operations, rebuild TensorFlow with the appropriate compiler flags.
2024-03-02 03:48:05.273326: W tensorflow/compiler/tf2tensorrt/utils/py_utils.cc:38] TF-TRT Warning: Could not find TensorRT
WARNING:tensorflow:From /home/ketrong/miniconda3/envs/tpot2devenv/lib/python3.10/site-packages/tensorflow/python/compat/v2_compat.py:108: disable_resource_variables (from tensorflow.python.ops.variable_scope) is deprecated and will be removed in a future version.
Instructions for updating:
non-resource variables are not supported in the long term
starting loops
working on 
logs/359938/tpot2_base_normal_MAR_0.1
2.3983521461486816
loading data
logs/359938/tpot2_base_normal_MAR_0.1/data/359938_True.pkl
7259     1801
4348    14720
653     12370
1595     2468
1858     4763
        ...  
9979     5783
3845     4829
7229     7686
2038     1524
6072     4249
Name: total_(BRL), Length: 9622, dtype: int64
         0   ...   44
0      45.0  ...  1.0
1     278.0  ...  1.0
2     280.0  ...  0.0
3      90.0  ...  1.0
4      80.0  ...  1.0
...     ...  ...  ...
9617  284.0  ...  1.0
9618  105.0  ...  1.0
9619  115.0  ...  0.0
9620   75.0  ...  1.0
9621   84.0  ...  1.0

[9622 rows x 45 columns]
         0   ...   44
0      76.0  ...  0.0
1      70.0  ...  1.0
2      92.0  ...  0.0
3      48.0  ...  1.0
4      62.0  ...  1.0
...     ...  ...  ...
1065  350.0  ...  0.0
1066   40.0  ...  0.0
1067  240.0  ...  0.0
1068  236.0  ...  1.0
1069   65.0  ...  0.0

[1070 rows x 45 columns]
running experiment 1/3 - Does large hyperparameter space improve reconstruction accuracy over simple
[I 2024-03-02 03:48:30,435] A new study created in memory with name: no-name-1ae52b3e-5da7-47e8-91e1-f091dfc765e1
[I 2024-03-02 03:48:32,210] Trial 3 finished with value: 1129.561760456969 and parameters: {'model_name': 'SimpleImputer', 'strategy': 'constant'}. Best is trial 3 with value: 1129.561760456969.
[I 2024-03-02 03:48:32,608] Trial 0 finished with value: 1129.561760456969 and parameters: {'model_name': 'SimpleImputer', 'strategy': 'constant'}. Best is trial 3 with value: 1129.561760456969.
[I 2024-03-02 03:48:32,893] Trial 7 finished with value: 1129.561760456969 and parameters: {'model_name': 'SimpleImputer', 'strategy': 'constant'}. Best is trial 3 with value: 1129.561760456969.
[I 2024-03-02 03:48:33,114] Trial 18 finished with value: 1129.561760456969 and parameters: {'model_name': 'SimpleImputer', 'strategy': 'constant'}. Best is trial 3 with value: 1129.561760456969.
[I 2024-03-02 03:48:33,355] Trial 5 finished with value: 1129.561760456969 and parameters: {'model_name': 'SimpleImputer', 'strategy': 'constant'}. Best is trial 3 with value: 1129.561760456969.
[I 2024-03-02 03:48:33,668] Trial 6 finished with value: 1129.561760456969 and parameters: {'model_name': 'SimpleImputer', 'strategy': 'constant'}. Best is trial 3 with value: 1129.561760456969.
[I 2024-03-02 03:48:34,229] Trial 26 finished with value: 1129.561760456969 and parameters: {'model_name': 'SimpleImputer', 'strategy': 'constant'}. Best is trial 3 with value: 1129.561760456969.
[I 2024-03-02 03:48:34,636] Trial 13 finished with value: 739.4409984702843 and parameters: {'model_name': 'SimpleImputer', 'strategy': 'mean'}. Best is trial 13 with value: 739.4409984702843.
[I 2024-03-02 03:48:34,991] Trial 24 finished with value: 1129.561760456969 and parameters: {'model_name': 'SimpleImputer', 'strategy': 'constant'}. Best is trial 13 with value: 739.4409984702843.
[I 2024-03-02 03:48:35,259] Trial 1 finished with value: 739.4409984702843 and parameters: {'model_name': 'SimpleImputer', 'strategy': 'mean'}. Best is trial 13 with value: 739.4409984702843.
[I 2024-03-02 03:48:35,653] Trial 4 finished with value: 739.4409984702843 and parameters: {'model_name': 'SimpleImputer', 'strategy': 'mean'}. Best is trial 13 with value: 739.4409984702843.
[I 2024-03-02 03:48:36,080] Trial 22 finished with value: 1129.561760456969 and parameters: {'model_name': 'SimpleImputer', 'strategy': 'constant'}. Best is trial 13 with value: 739.4409984702843.
[I 2024-03-02 03:48:36,359] Trial 41 finished with value: 1129.561760456969 and parameters: {'model_name': 'SimpleImputer', 'strategy': 'constant'}. Best is trial 13 with value: 739.4409984702843.
[I 2024-03-02 03:48:36,655] Trial 29 finished with value: 739.4409984702843 and parameters: {'model_name': 'SimpleImputer', 'strategy': 'mean'}. Best is trial 13 with value: 739.4409984702843.
[I 2024-03-02 03:48:36,933] Trial 17 finished with value: 739.4409984702843 and parameters: {'model_name': 'SimpleImputer', 'strategy': 'mean'}. Best is trial 13 with value: 739.4409984702843.
[I 2024-03-02 03:48:37,220] Trial 12 finished with value: 739.4409984702843 and parameters: {'model_name': 'SimpleImputer', 'strategy': 'mean'}. Best is trial 13 with value: 739.4409984702843.
[I 2024-03-02 03:48:37,442] Trial 21 finished with value: 739.4409984702843 and parameters: {'model_name': 'SimpleImputer', 'strategy': 'mean'}. Best is trial 13 with value: 739.4409984702843.
[I 2024-03-02 03:48:37,725] Trial 19 finished with value: 739.4409984702843 and parameters: {'model_name': 'SimpleImputer', 'strategy': 'mean'}. Best is trial 13 with value: 739.4409984702843.
[I 2024-03-02 03:48:37,977] Trial 35 finished with value: 1129.561760456969 and parameters: {'model_name': 'SimpleImputer', 'strategy': 'constant'}. Best is trial 13 with value: 739.4409984702843.
[I 2024-03-02 03:48:38,198] Trial 30 finished with value: 739.4409984702843 and parameters: {'model_name': 'SimpleImputer', 'strategy': 'mean'}. Best is trial 13 with value: 739.4409984702843.
[I 2024-03-02 03:48:38,571] Trial 37 finished with value: 1129.561760456969 and parameters: {'model_name': 'SimpleImputer', 'strategy': 'constant'}. Best is trial 13 with value: 739.4409984702843.
[I 2024-03-02 03:48:38,919] Trial 36 finished with value: 739.4409984702843 and parameters: {'model_name': 'SimpleImputer', 'strategy': 'mean'}. Best is trial 13 with value: 739.4409984702843.
[I 2024-03-02 03:48:39,245] Trial 46 finished with value: 1129.561760456969 and parameters: {'model_name': 'SimpleImputer', 'strategy': 'constant'}. Best is trial 13 with value: 739.4409984702843.
[I 2024-03-02 03:48:39,591] Trial 42 finished with value: 739.4409984702843 and parameters: {'model_name': 'SimpleImputer', 'strategy': 'mean'}. Best is trial 13 with value: 739.4409984702843.
[I 2024-03-02 03:48:39,847] Trial 9 finished with value: 817.2897438128127 and parameters: {'model_name': 'SimpleImputer', 'strategy': 'median'}. Best is trial 13 with value: 739.4409984702843.
[I 2024-03-02 03:48:40,068] Trial 43 finished with value: 739.4409984702843 and parameters: {'model_name': 'SimpleImputer', 'strategy': 'mean'}. Best is trial 13 with value: 739.4409984702843.
[I 2024-03-02 03:48:40,269] Trial 8 finished with value: 817.2897438128127 and parameters: {'model_name': 'SimpleImputer', 'strategy': 'median'}. Best is trial 13 with value: 739.4409984702843.
[I 2024-03-02 03:48:40,472] Trial 47 finished with value: 739.4409984702843 and parameters: {'model_name': 'SimpleImputer', 'strategy': 'mean'}. Best is trial 13 with value: 739.4409984702843.
[I 2024-03-02 03:48:41,063] Trial 38 finished with value: 739.4409984702843 and parameters: {'model_name': 'SimpleImputer', 'strategy': 'mean'}. Best is trial 13 with value: 739.4409984702843.
[I 2024-03-02 03:48:41,307] Trial 16 finished with value: 817.2897438128127 and parameters: {'model_name': 'SimpleImputer', 'strategy': 'median'}. Best is trial 13 with value: 739.4409984702843.
[I 2024-03-02 03:48:41,712] Trial 40 finished with value: 739.4409984702843 and parameters: {'model_name': 'SimpleImputer', 'strategy': 'mean'}. Best is trial 13 with value: 739.4409984702843.
[I 2024-03-02 03:48:42,042] Trial 55 finished with value: 1129.561760456969 and parameters: {'model_name': 'SimpleImputer', 'strategy': 'constant'}. Best is trial 13 with value: 739.4409984702843.
[I 2024-03-02 03:48:42,358] Trial 23 finished with value: 817.2897438128127 and parameters: {'model_name': 'SimpleImputer', 'strategy': 'median'}. Best is trial 13 with value: 739.4409984702843.
[I 2024-03-02 03:48:42,659] Trial 51 finished with value: 739.4409984702843 and parameters: {'model_name': 'SimpleImputer', 'strategy': 'mean'}. Best is trial 13 with value: 739.4409984702843.
[I 2024-03-02 03:48:42,916] Trial 34 finished with value: 817.2897438128127 and parameters: {'model_name': 'SimpleImputer', 'strategy': 'median'}. Best is trial 13 with value: 739.4409984702843.
[I 2024-03-02 03:48:43,226] Trial 54 finished with value: 1129.561760456969 and parameters: {'model_name': 'SimpleImputer', 'strategy': 'constant'}. Best is trial 13 with value: 739.4409984702843.
[I 2024-03-02 03:48:43,751] Trial 45 finished with value: 817.2897438128127 and parameters: {'model_name': 'SimpleImputer', 'strategy': 'median'}. Best is trial 13 with value: 739.4409984702843.
[I 2024-03-02 03:48:44,125] Trial 39 finished with value: 817.2897438128127 and parameters: {'model_name': 'SimpleImputer', 'strategy': 'median'}. Best is trial 13 with value: 739.4409984702843.
[I 2024-03-02 03:48:44,554] Trial 57 finished with value: 739.4409984702843 and parameters: {'model_name': 'SimpleImputer', 'strategy': 'mean'}. Best is trial 13 with value: 739.4409984702843.
[I 2024-03-02 03:48:45,003] Trial 58 finished with value: 739.4409984702843 and parameters: {'model_name': 'SimpleImputer', 'strategy': 'mean'}. Best is trial 13 with value: 739.4409984702843.
[I 2024-03-02 03:48:45,334] Trial 60 finished with value: 739.4409984702843 and parameters: {'model_name': 'SimpleImputer', 'strategy': 'mean'}. Best is trial 13 with value: 739.4409984702843.
[I 2024-03-02 03:48:45,524] Trial 59 finished with value: 739.4409984702843 and parameters: {'model_name': 'SimpleImputer', 'strategy': 'mean'}. Best is trial 13 with value: 739.4409984702843.
[I 2024-03-02 03:48:45,942] Trial 48 finished with value: 817.2897438128127 and parameters: {'model_name': 'SimpleImputer', 'strategy': 'median'}. Best is trial 13 with value: 739.4409984702843.
[I 2024-03-02 03:48:46,309] Trial 56 finished with value: 739.4409984702843 and parameters: {'model_name': 'SimpleImputer', 'strategy': 'mean'}. Best is trial 13 with value: 739.4409984702843.
[I 2024-03-02 03:48:46,829] Trial 53 finished with value: 817.2897438128127 and parameters: {'model_name': 'SimpleImputer', 'strategy': 'median'}. Best is trial 13 with value: 739.4409984702843.
[I 2024-03-02 03:48:47,311] Trial 49 finished with value: 817.2897438128127 and parameters: {'model_name': 'SimpleImputer', 'strategy': 'median'}. Best is trial 13 with value: 739.4409984702843.
[I 2024-03-02 03:48:48,872] Trial 71 finished with value: 817.2897438128127 and parameters: {'model_name': 'SimpleImputer', 'strategy': 'median'}. Best is trial 13 with value: 739.4409984702843.
[I 2024-03-02 03:48:49,256] Trial 65 finished with value: 817.2897438128127 and parameters: {'model_name': 'SimpleImputer', 'strategy': 'median'}. Best is trial 13 with value: 739.4409984702843.
[I 2024-03-02 03:48:59,610] Trial 2 finished with value: 1129.5616861959 and parameters: {'model_name': 'SimpleImputer', 'strategy': 'most_frequent'}. Best is trial 13 with value: 739.4409984702843.
[I 2024-03-02 03:49:00,990] Trial 32 finished with value: 1129.5616861959 and parameters: {'model_name': 'SimpleImputer', 'strategy': 'most_frequent'}. Best is trial 13 with value: 739.4409984702843.
[I 2024-03-02 03:49:01,264] Trial 20 finished with value: 1129.5616861959 and parameters: {'model_name': 'SimpleImputer', 'strategy': 'most_frequent'}. Best is trial 13 with value: 739.4409984702843.
[I 2024-03-02 03:49:01,578] Trial 10 finished with value: 1129.5616861959 and parameters: {'model_name': 'SimpleImputer', 'strategy': 'most_frequent'}. Best is trial 13 with value: 739.4409984702843.
[I 2024-03-02 03:49:01,788] Trial 15 finished with value: 1129.5616861959 and parameters: {'model_name': 'SimpleImputer', 'strategy': 'most_frequent'}. Best is trial 13 with value: 739.4409984702843.
[I 2024-03-02 03:49:02,460] Trial 31 finished with value: 1129.5616861959 and parameters: {'model_name': 'SimpleImputer', 'strategy': 'most_frequent'}. Best is trial 13 with value: 739.4409984702843.
[I 2024-03-02 03:49:02,760] Trial 27 finished with value: 1129.5616861959 and parameters: {'model_name': 'SimpleImputer', 'strategy': 'most_frequent'}. Best is trial 13 with value: 739.4409984702843.
[I 2024-03-02 03:49:03,155] Trial 28 finished with value: 1129.5616861959 and parameters: {'model_name': 'SimpleImputer', 'strategy': 'most_frequent'}. Best is trial 13 with value: 739.4409984702843.
[I 2024-03-02 03:49:03,458] Trial 14 finished with value: 1129.5616861959 and parameters: {'model_name': 'SimpleImputer', 'strategy': 'most_frequent'}. Best is trial 13 with value: 739.4409984702843.
[I 2024-03-02 03:49:03,920] Trial 44 finished with value: 1129.5616861959 and parameters: {'model_name': 'SimpleImputer', 'strategy': 'most_frequent'}. Best is trial 13 with value: 739.4409984702843.
[I 2024-03-02 03:49:04,295] Trial 25 finished with value: 1129.5616861959 and parameters: {'model_name': 'SimpleImputer', 'strategy': 'most_frequent'}. Best is trial 13 with value: 739.4409984702843.
[I 2024-03-02 03:49:04,707] Trial 11 finished with value: 1129.5616861959 and parameters: {'model_name': 'SimpleImputer', 'strategy': 'most_frequent'}. Best is trial 13 with value: 739.4409984702843.
[I 2024-03-02 03:49:05,869] Trial 33 finished with value: 1129.5616861959 and parameters: {'model_name': 'SimpleImputer', 'strategy': 'most_frequent'}. Best is trial 13 with value: 739.4409984702843.
[I 2024-03-02 03:49:06,248] Trial 63 finished with value: 1129.5616861959 and parameters: {'model_name': 'SimpleImputer', 'strategy': 'most_frequent'}. Best is trial 13 with value: 739.4409984702843.
[I 2024-03-02 03:49:06,541] Trial 99 finished with value: 739.4409984702843 and parameters: {'model_name': 'SimpleImputer', 'strategy': 'mean'}. Best is trial 13 with value: 739.4409984702843.
[I 2024-03-02 03:49:07,072] Trial 101 finished with value: 739.4409984702843 and parameters: {'model_name': 'SimpleImputer', 'strategy': 'mean'}. Best is trial 13 with value: 739.4409984702843.
[I 2024-03-02 03:49:07,291] Trial 72 finished with value: 1129.5616861959 and parameters: {'model_name': 'SimpleImputer', 'strategy': 'most_frequent'}. Best is trial 13 with value: 739.4409984702843.
[I 2024-03-02 03:49:07,603] Trial 100 finished with value: 739.4409984702843 and parameters: {'model_name': 'SimpleImputer', 'strategy': 'mean'}. Best is trial 13 with value: 739.4409984702843.
[I 2024-03-02 03:49:07,901] Trial 73 finished with value: 1129.5616861959 and parameters: {'model_name': 'SimpleImputer', 'strategy': 'most_frequent'}. Best is trial 13 with value: 739.4409984702843.
[I 2024-03-02 03:49:08,210] Trial 61 finished with value: 1129.5616861959 and parameters: {'model_name': 'SimpleImputer', 'strategy': 'most_frequent'}. Best is trial 13 with value: 739.4409984702843.
[I 2024-03-02 03:49:08,411] Trial 75 finished with value: 1129.5616861959 and parameters: {'model_name': 'SimpleImputer', 'strategy': 'most_frequent'}. Best is trial 13 with value: 739.4409984702843.
[I 2024-03-02 03:49:08,588] Trial 102 finished with value: 739.4409984702843 and parameters: {'model_name': 'SimpleImputer', 'strategy': 'mean'}. Best is trial 13 with value: 739.4409984702843.
[I 2024-03-02 03:49:08,819] Trial 69 finished with value: 1129.5616861959 and parameters: {'model_name': 'SimpleImputer', 'strategy': 'most_frequent'}. Best is trial 13 with value: 739.4409984702843.
[I 2024-03-02 03:49:09,036] Trial 62 finished with value: 1129.5616861959 and parameters: {'model_name': 'SimpleImputer', 'strategy': 'most_frequent'}. Best is trial 13 with value: 739.4409984702843.
[I 2024-03-02 03:49:09,299] Trial 50 finished with value: 1129.5616861959 and parameters: {'model_name': 'SimpleImputer', 'strategy': 'most_frequent'}. Best is trial 13 with value: 739.4409984702843.
[I 2024-03-02 03:49:09,651] Trial 103 finished with value: 739.4409984702843 and parameters: {'model_name': 'SimpleImputer', 'strategy': 'mean'}. Best is trial 13 with value: 739.4409984702843.
[I 2024-03-02 03:49:10,000] Trial 105 finished with value: 739.4409984702843 and parameters: {'model_name': 'SimpleImputer', 'strategy': 'mean'}. Best is trial 13 with value: 739.4409984702843.
[I 2024-03-02 03:49:10,276] Trial 67 finished with value: 1129.5616861959 and parameters: {'model_name': 'SimpleImputer', 'strategy': 'most_frequent'}. Best is trial 13 with value: 739.4409984702843.
[I 2024-03-02 03:49:10,770] Trial 106 finished with value: 739.4409984702843 and parameters: {'model_name': 'SimpleImputer', 'strategy': 'mean'}. Best is trial 13 with value: 739.4409984702843.
[I 2024-03-02 03:49:11,081] Trial 104 finished with value: 739.4409984702843 and parameters: {'model_name': 'SimpleImputer', 'strategy': 'mean'}. Best is trial 13 with value: 739.4409984702843.
[I 2024-03-02 03:49:11,255] Trial 107 finished with value: 739.4409984702843 and parameters: {'model_name': 'SimpleImputer', 'strategy': 'mean'}. Best is trial 13 with value: 739.4409984702843.
[I 2024-03-02 03:49:11,472] Trial 76 finished with value: 1129.5616861959 and parameters: {'model_name': 'SimpleImputer', 'strategy': 'most_frequent'}. Best is trial 13 with value: 739.4409984702843.
[I 2024-03-02 03:49:11,777] Trial 52 finished with value: 1129.5616861959 and parameters: {'model_name': 'SimpleImputer', 'strategy': 'most_frequent'}. Best is trial 13 with value: 739.4409984702843.
[I 2024-03-02 03:49:12,169] Trial 64 finished with value: 1129.5616861959 and parameters: {'model_name': 'SimpleImputer', 'strategy': 'most_frequent'}. Best is trial 13 with value: 739.4409984702843.
[I 2024-03-02 03:49:12,445] Trial 77 finished with value: 1129.5616861959 and parameters: {'model_name': 'SimpleImputer', 'strategy': 'most_frequent'}. Best is trial 13 with value: 739.4409984702843.
[I 2024-03-02 03:49:13,437] Trial 109 finished with value: 739.4409984702843 and parameters: {'model_name': 'SimpleImputer', 'strategy': 'mean'}. Best is trial 13 with value: 739.4409984702843.
[I 2024-03-02 03:49:13,726] Trial 82 finished with value: 1129.5616861959 and parameters: {'model_name': 'SimpleImputer', 'strategy': 'most_frequent'}. Best is trial 13 with value: 739.4409984702843.
[I 2024-03-02 03:49:14,085] Trial 68 finished with value: 1129.5616861959 and parameters: {'model_name': 'SimpleImputer', 'strategy': 'most_frequent'}. Best is trial 13 with value: 739.4409984702843.
[I 2024-03-02 03:49:14,472] Trial 74 finished with value: 1129.5616861959 and parameters: {'model_name': 'SimpleImputer', 'strategy': 'most_frequent'}. Best is trial 13 with value: 739.4409984702843.
[I 2024-03-02 03:49:14,661] Trial 66 finished with value: 1129.5616861959 and parameters: {'model_name': 'SimpleImputer', 'strategy': 'most_frequent'}. Best is trial 13 with value: 739.4409984702843.
[I 2024-03-02 03:49:15,011] Trial 70 finished with value: 1129.5616861959 and parameters: {'model_name': 'SimpleImputer', 'strategy': 'most_frequent'}. Best is trial 13 with value: 739.4409984702843.
[I 2024-03-02 03:49:15,232] Trial 108 finished with value: 739.4409984702843 and parameters: {'model_name': 'SimpleImputer', 'strategy': 'mean'}. Best is trial 13 with value: 739.4409984702843.
[I 2024-03-02 03:49:15,703] Trial 111 finished with value: 739.4409984702843 and parameters: {'model_name': 'SimpleImputer', 'strategy': 'mean'}. Best is trial 13 with value: 739.4409984702843.
[I 2024-03-02 03:49:15,943] Trial 83 finished with value: 1129.5616861959 and parameters: {'model_name': 'SimpleImputer', 'strategy': 'most_frequent'}. Best is trial 13 with value: 739.4409984702843.
[I 2024-03-02 03:49:16,138] Trial 110 finished with value: 739.4409984702843 and parameters: {'model_name': 'SimpleImputer', 'strategy': 'mean'}. Best is trial 13 with value: 739.4409984702843.
[I 2024-03-02 03:49:16,328] Trial 79 finished with value: 1129.5616861959 and parameters: {'model_name': 'SimpleImputer', 'strategy': 'most_frequent'}. Best is trial 13 with value: 739.4409984702843.
[I 2024-03-02 03:49:16,619] Trial 115 finished with value: 739.4409984702843 and parameters: {'model_name': 'SimpleImputer', 'strategy': 'mean'}. Best is trial 13 with value: 739.4409984702843.
