Run: 2
/cm/local/apps/slurm/var/spool/job690841/slurm_script: line 23: /common/ketrong/minconda3/etc/profile.d/conda.sh: No such file or directory
/cm/local/apps/slurm/var/spool/job690841/slurm_script: line 26: $'\nconda create --name tpot2devenv -c conda-forge python=3.10\n': command not found
/cm/local/apps/slurm/var/spool/job690841/slurm_script: line 31: $'\npip install -r requirements.txt\n': command not found
RunStart
2024-02-27 13:10:47.613440: I tensorflow/core/util/port.cc:113] oneDNN custom operations are on. You may see slightly different numerical results due to floating-point round-off errors from different computation orders. To turn them off, set the environment variable `TF_ENABLE_ONEDNN_OPTS=0`.
2024-02-27 13:10:47.649390: E external/local_xla/xla/stream_executor/cuda/cuda_dnn.cc:9261] Unable to register cuDNN factory: Attempting to register factory for plugin cuDNN when one has already been registered
2024-02-27 13:10:47.649412: E external/local_xla/xla/stream_executor/cuda/cuda_fft.cc:607] Unable to register cuFFT factory: Attempting to register factory for plugin cuFFT when one has already been registered
2024-02-27 13:10:47.650808: E external/local_xla/xla/stream_executor/cuda/cuda_blas.cc:1515] Unable to register cuBLAS factory: Attempting to register factory for plugin cuBLAS when one has already been registered
2024-02-27 13:10:47.656932: I tensorflow/core/platform/cpu_feature_guard.cc:182] This TensorFlow binary is optimized to use available CPU instructions in performance-critical operations.
To enable the following instructions: AVX2 AVX512F AVX512_VNNI FMA, in other operations, rebuild TensorFlow with the appropriate compiler flags.
2024-02-27 13:10:49.391033: W tensorflow/compiler/tf2tensorrt/utils/py_utils.cc:38] TF-TRT Warning: Could not find TensorRT
WARNING:tensorflow:From /home/ketrong/miniconda3/envs/tpot2devenv/lib/python3.10/site-packages/tensorflow/python/compat/v2_compat.py:108: disable_resource_variables (from tensorflow.python.ops.variable_scope) is deprecated and will be removed in a future version.
Instructions for updating:
non-resource variables are not supported in the long term
starting loops
working on 
logs/2306/tpot2_base_normal_MCAR_0.1
3.6801552772521973
loading data
logs/2306/tpot2_base_normal_MCAR_0.1/data/2306_True.pkl
1023    -2.003580
23445   -3.403820
19181    0.983905
12770    0.087103
1153     5.747320
           ...   
29159   -0.421956
817      4.715940
2043     1.415070
33649    3.253480
10288   -0.104876
Name: y, Length: 36691, dtype: float64
         0  ...    9
0     -1.0  ...  1.0
1     -1.0  ... -1.0
2      1.0  ...  1.0
3     -1.0  ... -1.0
4      1.0  ...  0.0
...    ...  ...  ...
36686 -1.0  ...  0.0
36687  1.0  ...  1.0
36688 -1.0  ...  1.0
36689  1.0  ...  0.0
36690  1.0  ...  1.0

[36691 rows x 10 columns]
        0  ...    9
0    -1.0  ... -1.0
1    -1.0  ...  0.0
2    -1.0  ... -1.0
3    -1.0  ...  1.0
4     1.0  ... -1.0
...   ...  ...  ...
4072  1.0  ...  0.0
4073  1.0  ...  1.0
4074 -1.0  ...  0.0
4075  1.0  ...  1.0
4076 -1.0  ...  1.0

[4077 rows x 10 columns]
running experiment 1/3 - Does large hyperparameter space improve reconstruction accuracy over simple
[I 2024-02-27 13:10:56,120] A new study created in memory with name: no-name-359f3a7e-55b1-4362-afab-590e0d039a51
[I 2024-02-27 13:10:58,217] Trial 6 finished with value: 0.7948219008558837 and parameters: {'model_name': 'SimpleImputer', 'strategy': 'constant'}. Best is trial 6 with value: 0.7948219008558837.
[I 2024-02-27 13:10:58,485] Trial 10 finished with value: 0.7948219008558837 and parameters: {'model_name': 'SimpleImputer', 'strategy': 'constant'}. Best is trial 6 with value: 0.7948219008558837.
[I 2024-02-27 13:10:58,752] Trial 4 finished with value: 0.7948219008558837 and parameters: {'model_name': 'SimpleImputer', 'strategy': 'constant'}. Best is trial 6 with value: 0.7948219008558837.
[I 2024-02-27 13:10:59,045] Trial 5 finished with value: 0.7948219008558837 and parameters: {'model_name': 'SimpleImputer', 'strategy': 'constant'}. Best is trial 6 with value: 0.7948219008558837.
[I 2024-02-27 13:10:59,449] Trial 21 finished with value: 0.7948219008558837 and parameters: {'model_name': 'SimpleImputer', 'strategy': 'constant'}. Best is trial 6 with value: 0.7948219008558837.
[I 2024-02-27 13:10:59,751] Trial 9 finished with value: 0.794840084422301 and parameters: {'model_name': 'SimpleImputer', 'strategy': 'mean'}. Best is trial 6 with value: 0.7948219008558837.
[I 2024-02-27 13:10:59,997] Trial 7 finished with value: 0.794840084422301 and parameters: {'model_name': 'SimpleImputer', 'strategy': 'mean'}. Best is trial 6 with value: 0.7948219008558837.
[I 2024-02-27 13:11:00,252] Trial 30 finished with value: 0.7948219008558837 and parameters: {'model_name': 'SimpleImputer', 'strategy': 'constant'}. Best is trial 6 with value: 0.7948219008558837.
[I 2024-02-27 13:11:00,570] Trial 24 finished with value: 0.7948219008558837 and parameters: {'model_name': 'SimpleImputer', 'strategy': 'constant'}. Best is trial 6 with value: 0.7948219008558837.
[I 2024-02-27 13:11:00,849] Trial 0 finished with value: 0.794840084422301 and parameters: {'model_name': 'SimpleImputer', 'strategy': 'mean'}. Best is trial 6 with value: 0.7948219008558837.
[I 2024-02-27 13:11:01,076] Trial 3 finished with value: 0.794840084422301 and parameters: {'model_name': 'SimpleImputer', 'strategy': 'mean'}. Best is trial 6 with value: 0.7948219008558837.
[I 2024-02-27 13:11:01,296] Trial 17 finished with value: 0.794840084422301 and parameters: {'model_name': 'SimpleImputer', 'strategy': 'mean'}. Best is trial 6 with value: 0.7948219008558837.
[I 2024-02-27 13:11:01,523] Trial 14 finished with value: 0.794840084422301 and parameters: {'model_name': 'SimpleImputer', 'strategy': 'mean'}. Best is trial 6 with value: 0.7948219008558837.
[I 2024-02-27 13:11:01,697] Trial 13 finished with value: 0.794840084422301 and parameters: {'model_name': 'SimpleImputer', 'strategy': 'mean'}. Best is trial 6 with value: 0.7948219008558837.
[I 2024-02-27 13:11:01,917] Trial 39 finished with value: 0.7948219008558837 and parameters: {'model_name': 'SimpleImputer', 'strategy': 'constant'}. Best is trial 6 with value: 0.7948219008558837.
[I 2024-02-27 13:11:02,186] Trial 19 finished with value: 0.7948219008558837 and parameters: {'model_name': 'SimpleImputer', 'strategy': 'constant'}. Best is trial 6 with value: 0.7948219008558837.
[I 2024-02-27 13:11:02,446] Trial 18 finished with value: 0.794840084422301 and parameters: {'model_name': 'SimpleImputer', 'strategy': 'mean'}. Best is trial 6 with value: 0.7948219008558837.
[I 2024-02-27 13:11:02,733] Trial 47 finished with value: 0.7948219008558837 and parameters: {'model_name': 'SimpleImputer', 'strategy': 'constant'}. Best is trial 6 with value: 0.7948219008558837.
[I 2024-02-27 13:11:03,029] Trial 23 finished with value: 0.794840084422301 and parameters: {'model_name': 'SimpleImputer', 'strategy': 'mean'}. Best is trial 6 with value: 0.7948219008558837.
[I 2024-02-27 13:11:03,218] Trial 34 finished with value: 0.7948219008558837 and parameters: {'model_name': 'SimpleImputer', 'strategy': 'constant'}. Best is trial 6 with value: 0.7948219008558837.
[I 2024-02-27 13:11:03,485] Trial 35 finished with value: 0.794840084422301 and parameters: {'model_name': 'SimpleImputer', 'strategy': 'mean'}. Best is trial 6 with value: 0.7948219008558837.
[I 2024-02-27 13:11:03,743] Trial 36 finished with value: 0.794840084422301 and parameters: {'model_name': 'SimpleImputer', 'strategy': 'mean'}. Best is trial 6 with value: 0.7948219008558837.
[I 2024-02-27 13:11:03,932] Trial 41 finished with value: 0.7948219008558837 and parameters: {'model_name': 'SimpleImputer', 'strategy': 'constant'}. Best is trial 6 with value: 0.7948219008558837.
[I 2024-02-27 13:11:04,175] Trial 28 finished with value: 0.794840084422301 and parameters: {'model_name': 'SimpleImputer', 'strategy': 'mean'}. Best is trial 6 with value: 0.7948219008558837.
[I 2024-02-27 13:11:04,412] Trial 25 finished with value: 0.794840084422301 and parameters: {'model_name': 'SimpleImputer', 'strategy': 'mean'}. Best is trial 6 with value: 0.7948219008558837.
[I 2024-02-27 13:11:04,789] Trial 31 finished with value: 0.794840084422301 and parameters: {'model_name': 'SimpleImputer', 'strategy': 'mean'}. Best is trial 6 with value: 0.7948219008558837.
[I 2024-02-27 13:11:05,322] Trial 8 finished with value: 0.7948219008558837 and parameters: {'model_name': 'SimpleImputer', 'strategy': 'median'}. Best is trial 6 with value: 0.7948219008558837.
[I 2024-02-27 13:11:05,616] Trial 38 finished with value: 0.794840084422301 and parameters: {'model_name': 'SimpleImputer', 'strategy': 'mean'}. Best is trial 6 with value: 0.7948219008558837.
[I 2024-02-27 13:11:05,901] Trial 20 finished with value: 0.7948219008558837 and parameters: {'model_name': 'SimpleImputer', 'strategy': 'median'}. Best is trial 6 with value: 0.7948219008558837.
[I 2024-02-27 13:11:06,261] Trial 16 finished with value: 0.7948219008558837 and parameters: {'model_name': 'SimpleImputer', 'strategy': 'median'}. Best is trial 6 with value: 0.7948219008558837.
[I 2024-02-27 13:11:07,001] Trial 22 finished with value: 0.7948219008558837 and parameters: {'model_name': 'SimpleImputer', 'strategy': 'median'}. Best is trial 6 with value: 0.7948219008558837.
[I 2024-02-27 13:11:07,459] Trial 44 finished with value: 0.7948219008558837 and parameters: {'model_name': 'SimpleImputer', 'strategy': 'median'}. Best is trial 6 with value: 0.7948219008558837.
[I 2024-02-27 13:11:07,679] Trial 32 finished with value: 0.7948219008558837 and parameters: {'model_name': 'SimpleImputer', 'strategy': 'median'}. Best is trial 6 with value: 0.7948219008558837.
[I 2024-02-27 13:11:07,871] Trial 52 finished with value: 0.7948219008558837 and parameters: {'model_name': 'SimpleImputer', 'strategy': 'constant'}. Best is trial 6 with value: 0.7948219008558837.
[I 2024-02-27 13:11:08,238] Trial 26 finished with value: 0.7948219008558837 and parameters: {'model_name': 'SimpleImputer', 'strategy': 'median'}. Best is trial 6 with value: 0.7948219008558837.
[I 2024-02-27 13:11:08,500] Trial 37 finished with value: 0.7948219008558837 and parameters: {'model_name': 'SimpleImputer', 'strategy': 'median'}. Best is trial 6 with value: 0.7948219008558837.
[I 2024-02-27 13:11:08,957] Trial 46 finished with value: 0.7948219008558837 and parameters: {'model_name': 'SimpleImputer', 'strategy': 'median'}. Best is trial 6 with value: 0.7948219008558837.
[I 2024-02-27 13:11:09,642] Trial 56 finished with value: 0.794840084422301 and parameters: {'model_name': 'SimpleImputer', 'strategy': 'mean'}. Best is trial 6 with value: 0.7948219008558837.
[I 2024-02-27 13:11:10,493] Trial 54 finished with value: 0.7948219008558837 and parameters: {'model_name': 'SimpleImputer', 'strategy': 'median'}. Best is trial 6 with value: 0.7948219008558837.
[I 2024-02-27 13:11:10,824] Trial 50 finished with value: 0.7948219008558837 and parameters: {'model_name': 'SimpleImputer', 'strategy': 'median'}. Best is trial 6 with value: 0.7948219008558837.
[I 2024-02-27 13:11:11,122] Trial 55 finished with value: 0.7948219008558837 and parameters: {'model_name': 'SimpleImputer', 'strategy': 'median'}. Best is trial 6 with value: 0.7948219008558837.
[I 2024-02-27 13:11:11,533] Trial 57 finished with value: 0.7948219008558837 and parameters: {'model_name': 'SimpleImputer', 'strategy': 'median'}. Best is trial 6 with value: 0.7948219008558837.
[I 2024-02-27 13:11:11,815] Trial 15 finished with value: 0.8499937091954006 and parameters: {'model_name': 'SimpleImputer', 'strategy': 'most_frequent'}. Best is trial 6 with value: 0.7948219008558837.
[I 2024-02-27 13:11:12,145] Trial 67 finished with value: 0.7948219008558837 and parameters: {'model_name': 'SimpleImputer', 'strategy': 'median'}. Best is trial 6 with value: 0.7948219008558837.
[I 2024-02-27 13:11:12,340] Trial 12 finished with value: 0.8499937091954006 and parameters: {'model_name': 'SimpleImputer', 'strategy': 'most_frequent'}. Best is trial 6 with value: 0.7948219008558837.
[I 2024-02-27 13:11:12,592] Trial 53 finished with value: 0.7948219008558837 and parameters: {'model_name': 'SimpleImputer', 'strategy': 'median'}. Best is trial 6 with value: 0.7948219008558837.
[I 2024-02-27 13:11:12,857] Trial 63 finished with value: 0.7948219008558837 and parameters: {'model_name': 'SimpleImputer', 'strategy': 'median'}. Best is trial 6 with value: 0.7948219008558837.
[I 2024-02-27 13:11:13,103] Trial 2 finished with value: 0.8499937091954006 and parameters: {'model_name': 'SimpleImputer', 'strategy': 'most_frequent'}. Best is trial 6 with value: 0.7948219008558837.
[I 2024-02-27 13:11:13,430] Trial 64 finished with value: 0.7948219008558837 and parameters: {'model_name': 'SimpleImputer', 'strategy': 'median'}. Best is trial 6 with value: 0.7948219008558837.
[I 2024-02-27 13:11:13,628] Trial 69 finished with value: 0.7948219008558837 and parameters: {'model_name': 'SimpleImputer', 'strategy': 'median'}. Best is trial 6 with value: 0.7948219008558837.
[I 2024-02-27 13:11:14,020] Trial 58 finished with value: 0.7948219008558837 and parameters: {'model_name': 'SimpleImputer', 'strategy': 'median'}. Best is trial 6 with value: 0.7948219008558837.
[I 2024-02-27 13:11:14,338] Trial 11 finished with value: 0.8499937091954006 and parameters: {'model_name': 'SimpleImputer', 'strategy': 'most_frequent'}. Best is trial 6 with value: 0.7948219008558837.
[I 2024-02-27 13:11:14,657] Trial 70 finished with value: 0.7948219008558837 and parameters: {'model_name': 'SimpleImputer', 'strategy': 'median'}. Best is trial 6 with value: 0.7948219008558837.
[I 2024-02-27 13:11:14,889] Trial 73 finished with value: 0.7948219008558837 and parameters: {'model_name': 'SimpleImputer', 'strategy': 'median'}. Best is trial 6 with value: 0.7948219008558837.
[I 2024-02-27 13:11:15,256] Trial 29 finished with value: 0.8499937091954006 and parameters: {'model_name': 'SimpleImputer', 'strategy': 'most_frequent'}. Best is trial 6 with value: 0.7948219008558837.
[I 2024-02-27 13:11:15,616] Trial 1 finished with value: 0.8499937091954006 and parameters: {'model_name': 'SimpleImputer', 'strategy': 'most_frequent'}. Best is trial 6 with value: 0.7948219008558837.
[I 2024-02-27 13:11:15,883] Trial 27 finished with value: 0.8499937091954006 and parameters: {'model_name': 'SimpleImputer', 'strategy': 'most_frequent'}. Best is trial 6 with value: 0.7948219008558837.
[I 2024-02-27 13:11:16,163] Trial 42 finished with value: 0.8499937091954006 and parameters: {'model_name': 'SimpleImputer', 'strategy': 'most_frequent'}. Best is trial 6 with value: 0.7948219008558837.
[I 2024-02-27 13:11:16,392] Trial 40 finished with value: 0.8499937091954006 and parameters: {'model_name': 'SimpleImputer', 'strategy': 'most_frequent'}. Best is trial 6 with value: 0.7948219008558837.
[I 2024-02-27 13:11:16,712] Trial 33 finished with value: 0.8499937091954006 and parameters: {'model_name': 'SimpleImputer', 'strategy': 'most_frequent'}. Best is trial 6 with value: 0.7948219008558837.
[I 2024-02-27 13:11:17,273] Trial 43 finished with value: 0.8499937091954006 and parameters: {'model_name': 'SimpleImputer', 'strategy': 'most_frequent'}. Best is trial 6 with value: 0.7948219008558837.
[I 2024-02-27 13:11:17,664] Trial 45 finished with value: 0.8499937091954006 and parameters: {'model_name': 'SimpleImputer', 'strategy': 'most_frequent'}. Best is trial 6 with value: 0.7948219008558837.
[I 2024-02-27 13:11:18,508] Trial 48 finished with value: 0.8499937091954006 and parameters: {'model_name': 'SimpleImputer', 'strategy': 'most_frequent'}. Best is trial 6 with value: 0.7948219008558837.
[I 2024-02-27 13:11:18,965] Trial 51 finished with value: 0.8499937091954006 and parameters: {'model_name': 'SimpleImputer', 'strategy': 'most_frequent'}. Best is trial 6 with value: 0.7948219008558837.
[I 2024-02-27 13:11:19,527] Trial 49 finished with value: 0.8499937091954006 and parameters: {'model_name': 'SimpleImputer', 'strategy': 'most_frequent'}. Best is trial 6 with value: 0.7948219008558837.
[I 2024-02-27 13:11:19,786] Trial 106 finished with value: 0.7948219008558837 and parameters: {'model_name': 'SimpleImputer', 'strategy': 'constant'}. Best is trial 6 with value: 0.7948219008558837.
[I 2024-02-27 13:11:20,039] Trial 66 finished with value: 0.8499937091954006 and parameters: {'model_name': 'SimpleImputer', 'strategy': 'most_frequent'}. Best is trial 6 with value: 0.7948219008558837.
[I 2024-02-27 13:11:20,505] Trial 103 finished with value: 0.7948219008558837 and parameters: {'model_name': 'SimpleImputer', 'strategy': 'constant'}. Best is trial 6 with value: 0.7948219008558837.
[I 2024-02-27 13:11:20,689] Trial 102 finished with value: 0.7948219008558837 and parameters: {'model_name': 'SimpleImputer', 'strategy': 'constant'}. Best is trial 6 with value: 0.7948219008558837.
[I 2024-02-27 13:11:20,926] Trial 62 finished with value: 0.8499937091954006 and parameters: {'model_name': 'SimpleImputer', 'strategy': 'most_frequent'}. Best is trial 6 with value: 0.7948219008558837.
[I 2024-02-27 13:11:21,105] Trial 107 finished with value: 0.7948219008558837 and parameters: {'model_name': 'SimpleImputer', 'strategy': 'constant'}. Best is trial 6 with value: 0.7948219008558837.
[I 2024-02-27 13:11:21,492] Trial 105 finished with value: 0.7948219008558837 and parameters: {'model_name': 'SimpleImputer', 'strategy': 'constant'}. Best is trial 6 with value: 0.7948219008558837.
[I 2024-02-27 13:11:21,776] Trial 104 finished with value: 0.7948219008558837 and parameters: {'model_name': 'SimpleImputer', 'strategy': 'constant'}. Best is trial 6 with value: 0.7948219008558837.
[I 2024-02-27 13:11:21,983] Trial 77 finished with value: 0.8499937091954006 and parameters: {'model_name': 'SimpleImputer', 'strategy': 'most_frequent'}. Best is trial 6 with value: 0.7948219008558837.
[I 2024-02-27 13:11:22,263] Trial 72 finished with value: 0.8499937091954006 and parameters: {'model_name': 'SimpleImputer', 'strategy': 'most_frequent'}. Best is trial 6 with value: 0.7948219008558837.
[I 2024-02-27 13:11:22,491] Trial 65 finished with value: 0.8499937091954006 and parameters: {'model_name': 'SimpleImputer', 'strategy': 'most_frequent'}. Best is trial 6 with value: 0.7948219008558837.
[I 2024-02-27 13:11:22,794] Trial 68 finished with value: 0.8499937091954006 and parameters: {'model_name': 'SimpleImputer', 'strategy': 'most_frequent'}. Best is trial 6 with value: 0.7948219008558837.
[I 2024-02-27 13:11:23,088] Trial 108 finished with value: 0.7948219008558837 and parameters: {'model_name': 'SimpleImputer', 'strategy': 'constant'}. Best is trial 6 with value: 0.7948219008558837.
[I 2024-02-27 13:11:23,422] Trial 61 finished with value: 0.8499937091954006 and parameters: {'model_name': 'SimpleImputer', 'strategy': 'most_frequent'}. Best is trial 6 with value: 0.7948219008558837.
[I 2024-02-27 13:11:23,771] Trial 109 finished with value: 0.7948219008558837 and parameters: {'model_name': 'SimpleImputer', 'strategy': 'constant'}. Best is trial 6 with value: 0.7948219008558837.
[I 2024-02-27 13:11:24,036] Trial 59 finished with value: 0.8499937091954006 and parameters: {'model_name': 'SimpleImputer', 'strategy': 'most_frequent'}. Best is trial 6 with value: 0.7948219008558837.
[I 2024-02-27 13:11:24,299] Trial 60 finished with value: 0.8499937091954006 and parameters: {'model_name': 'SimpleImputer', 'strategy': 'most_frequent'}. Best is trial 6 with value: 0.7948219008558837.
[I 2024-02-27 13:11:24,746] Trial 71 finished with value: 0.8499937091954006 and parameters: {'model_name': 'SimpleImputer', 'strategy': 'most_frequent'}. Best is trial 6 with value: 0.7948219008558837.
[I 2024-02-27 13:11:25,041] Trial 74 finished with value: 0.8499937091954006 and parameters: {'model_name': 'SimpleImputer', 'strategy': 'most_frequent'}. Best is trial 6 with value: 0.7948219008558837.
[I 2024-02-27 13:11:25,307] Trial 110 finished with value: 0.7948219008558837 and parameters: {'model_name': 'SimpleImputer', 'strategy': 'constant'}. Best is trial 6 with value: 0.7948219008558837.
[I 2024-02-27 13:11:25,645] Trial 76 finished with value: 0.8499937091954006 and parameters: {'model_name': 'SimpleImputer', 'strategy': 'most_frequent'}. Best is trial 6 with value: 0.7948219008558837.
[I 2024-02-27 13:11:26,042] Trial 79 finished with value: 0.8499937091954006 and parameters: {'model_name': 'SimpleImputer', 'strategy': 'most_frequent'}. Best is trial 6 with value: 0.7948219008558837.
[I 2024-02-27 13:11:26,227] Trial 82 finished with value: 0.8499937091954006 and parameters: {'model_name': 'SimpleImputer', 'strategy': 'most_frequent'}. Best is trial 6 with value: 0.7948219008558837.
[I 2024-02-27 13:11:26,431] Trial 75 finished with value: 0.8499937091954006 and parameters: {'model_name': 'SimpleImputer', 'strategy': 'most_frequent'}. Best is trial 6 with value: 0.7948219008558837.
[I 2024-02-27 13:11:26,812] Trial 113 finished with value: 0.7948219008558837 and parameters: {'model_name': 'SimpleImputer', 'strategy': 'constant'}. Best is trial 6 with value: 0.7948219008558837.
[I 2024-02-27 13:11:27,028] Trial 112 finished with value: 0.7948219008558837 and parameters: {'model_name': 'SimpleImputer', 'strategy': 'constant'}. Best is trial 6 with value: 0.7948219008558837.
[I 2024-02-27 13:11:27,486] Trial 111 finished with value: 0.7948219008558837 and parameters: {'model_name': 'SimpleImputer', 'strategy': 'constant'}. Best is trial 6 with value: 0.7948219008558837.
[I 2024-02-27 13:11:27,956] Trial 117 finished with value: 0.7948219008558837 and parameters: {'model_name': 'SimpleImputer', 'strategy': 'constant'}. Best is trial 6 with value: 0.7948219008558837.
[I 2024-02-27 13:11:28,221] Trial 80 finished with value: 0.8499937091954006 and parameters: {'model_name': 'SimpleImputer', 'strategy': 'most_frequent'}. Best is trial 6 with value: 0.7948219008558837.
