[I 2024-03-01 07:18:36,295] Trial 134 finished with value: 4.15507044270351 and parameters: {'model_name': 'SimpleImputer', 'strategy': 'median'}. Best is trial 17 with value: 4.15507044270351.
[I 2024-03-01 07:18:37,085] Trial 133 finished with value: 4.15507044270351 and parameters: {'model_name': 'SimpleImputer', 'strategy': 'median'}. Best is trial 17 with value: 4.15507044270351.
[I 2024-03-01 07:18:38,336] Trial 135 finished with value: 4.15507044270351 and parameters: {'model_name': 'SimpleImputer', 'strategy': 'median'}. Best is trial 17 with value: 4.15507044270351.
[I 2024-03-01 07:18:39,542] Trial 136 finished with value: 4.15507044270351 and parameters: {'model_name': 'SimpleImputer', 'strategy': 'median'}. Best is trial 17 with value: 4.15507044270351.
[I 2024-03-01 07:18:41,117] Trial 137 finished with value: 4.15507044270351 and parameters: {'model_name': 'SimpleImputer', 'strategy': 'median'}. Best is trial 17 with value: 4.15507044270351.
[I 2024-03-01 07:18:41,907] Trial 138 finished with value: 4.15507044270351 and parameters: {'model_name': 'SimpleImputer', 'strategy': 'median'}. Best is trial 17 with value: 4.15507044270351.
[I 2024-03-01 07:18:43,114] Trial 139 finished with value: 4.15507044270351 and parameters: {'model_name': 'SimpleImputer', 'strategy': 'median'}. Best is trial 17 with value: 4.15507044270351.
[I 2024-03-01 07:18:44,627] Trial 140 finished with value: 4.15507044270351 and parameters: {'model_name': 'SimpleImputer', 'strategy': 'median'}. Best is trial 17 with value: 4.15507044270351.
[I 2024-03-01 07:18:46,397] Trial 141 finished with value: 4.15507044270351 and parameters: {'model_name': 'SimpleImputer', 'strategy': 'median'}. Best is trial 17 with value: 4.15507044270351.
[I 2024-03-01 07:18:47,271] Trial 142 finished with value: 4.15507044270351 and parameters: {'model_name': 'SimpleImputer', 'strategy': 'median'}. Best is trial 17 with value: 4.15507044270351.
[I 2024-03-01 07:18:48,237] Trial 143 finished with value: 4.15507044270351 and parameters: {'model_name': 'SimpleImputer', 'strategy': 'median'}. Best is trial 17 with value: 4.15507044270351.
[I 2024-03-01 07:18:49,758] Trial 144 finished with value: 4.15507044270351 and parameters: {'model_name': 'SimpleImputer', 'strategy': 'median'}. Best is trial 17 with value: 4.15507044270351.
[I 2024-03-01 07:18:51,090] Trial 145 finished with value: 4.15507044270351 and parameters: {'model_name': 'SimpleImputer', 'strategy': 'median'}. Best is trial 17 with value: 4.15507044270351.
[I 2024-03-01 07:18:52,116] Trial 146 finished with value: 4.15507044270351 and parameters: {'model_name': 'SimpleImputer', 'strategy': 'median'}. Best is trial 17 with value: 4.15507044270351.
[I 2024-03-01 07:18:52,909] Trial 147 finished with value: 4.15507044270351 and parameters: {'model_name': 'SimpleImputer', 'strategy': 'median'}. Best is trial 17 with value: 4.15507044270351.
[I 2024-03-01 07:18:54,636] Trial 148 finished with value: 4.15507044270351 and parameters: {'model_name': 'SimpleImputer', 'strategy': 'median'}. Best is trial 17 with value: 4.15507044270351.
[I 2024-03-01 07:18:56,336] Trial 149 finished with value: 4.15507044270351 and parameters: {'model_name': 'SimpleImputer', 'strategy': 'median'}. Best is trial 17 with value: 4.15507044270351.
[I 2024-03-01 07:18:58,183] Trial 153 finished with value: 7.7198746616678475 and parameters: {'model_name': 'SimpleImputer', 'strategy': 'mean'}. Best is trial 17 with value: 4.15507044270351.
[I 2024-03-01 07:19:00,658] Trial 150 finished with value: 21.936194553989335 and parameters: {'model_name': 'SimpleImputer', 'strategy': 'most_frequent'}. Best is trial 17 with value: 4.15507044270351.
[I 2024-03-01 07:19:02,022] Trial 151 finished with value: 21.936194553989335 and parameters: {'model_name': 'SimpleImputer', 'strategy': 'most_frequent'}. Best is trial 17 with value: 4.15507044270351.
[I 2024-03-01 07:19:03,287] Trial 152 finished with value: 21.936194553989335 and parameters: {'model_name': 'SimpleImputer', 'strategy': 'most_frequent'}. Best is trial 17 with value: 4.15507044270351.
[I 2024-03-01 07:19:04,949] Trial 155 finished with value: 4.15507044270351 and parameters: {'model_name': 'SimpleImputer', 'strategy': 'median'}. Best is trial 17 with value: 4.15507044270351.
[I 2024-03-01 07:19:06,332] Trial 156 finished with value: 4.15507044270351 and parameters: {'model_name': 'SimpleImputer', 'strategy': 'median'}. Best is trial 17 with value: 4.15507044270351.
[I 2024-03-01 07:19:07,705] Trial 157 finished with value: 4.15507044270351 and parameters: {'model_name': 'SimpleImputer', 'strategy': 'median'}. Best is trial 17 with value: 4.15507044270351.
[I 2024-03-01 07:19:09,285] Trial 154 finished with value: 21.936194553989335 and parameters: {'model_name': 'SimpleImputer', 'strategy': 'most_frequent'}. Best is trial 17 with value: 4.15507044270351.
[I 2024-03-01 07:19:10,235] Trial 158 finished with value: 4.15507044270351 and parameters: {'model_name': 'SimpleImputer', 'strategy': 'median'}. Best is trial 17 with value: 4.15507044270351.
[I 2024-03-01 07:19:11,551] Trial 159 finished with value: 4.15507044270351 and parameters: {'model_name': 'SimpleImputer', 'strategy': 'median'}. Best is trial 17 with value: 4.15507044270351.
[I 2024-03-01 07:19:12,708] Trial 160 finished with value: 4.15507044270351 and parameters: {'model_name': 'SimpleImputer', 'strategy': 'median'}. Best is trial 17 with value: 4.15507044270351.
[I 2024-03-01 07:19:14,021] Trial 161 finished with value: 4.15507044270351 and parameters: {'model_name': 'SimpleImputer', 'strategy': 'median'}. Best is trial 17 with value: 4.15507044270351.
[I 2024-03-01 07:19:15,505] Trial 162 finished with value: 4.15507044270351 and parameters: {'model_name': 'SimpleImputer', 'strategy': 'median'}. Best is trial 17 with value: 4.15507044270351.
[I 2024-03-01 07:19:17,002] Trial 163 finished with value: 4.15507044270351 and parameters: {'model_name': 'SimpleImputer', 'strategy': 'median'}. Best is trial 17 with value: 4.15507044270351.
[I 2024-03-01 07:19:18,503] Trial 165 finished with value: 7.7198746616678475 and parameters: {'model_name': 'SimpleImputer', 'strategy': 'mean'}. Best is trial 17 with value: 4.15507044270351.
[I 2024-03-01 07:19:21,075] Trial 167 finished with value: 4.15507044270351 and parameters: {'model_name': 'SimpleImputer', 'strategy': 'median'}. Best is trial 17 with value: 4.15507044270351.
[I 2024-03-01 07:19:22,284] Trial 168 finished with value: 4.15507044270351 and parameters: {'model_name': 'SimpleImputer', 'strategy': 'median'}. Best is trial 17 with value: 4.15507044270351.
[I 2024-03-01 07:19:25,679] Trial 96 finished with value: 6.810130308157218 and parameters: {'model_name': 'IterativeImputer', 'sample_posterior': False, 'initial_strategy': 'mean', 'imputation_order': 'random'}. Best is trial 17 with value: 4.15507044270351.
[I 2024-03-01 07:20:21,355] Trial 112 finished with value: 6.810172385500119 and parameters: {'model_name': 'IterativeImputer', 'sample_posterior': False, 'initial_strategy': 'median', 'imputation_order': 'ascending'}. Best is trial 17 with value: 4.15507044270351.
[I 2024-03-01 07:20:23,972] Trial 172 finished with value: 4.15507044270351 and parameters: {'model_name': 'SimpleImputer', 'strategy': 'median'}. Best is trial 17 with value: 4.15507044270351.
[I 2024-03-01 07:20:49,254] Trial 22 finished with value: 7.733705277102205 and parameters: {'model_name': 'RandomForestImputer', 'max_iter': 18, 'decreasing': True, 'min_samples_split': 1.0, 'min_samples_leaf': 0.6, 'max_features': 0.8, 'warm_start': False}. Best is trial 17 with value: 4.15507044270351.
[I 2024-03-01 07:21:01,283] Trial 23 finished with value: 11.628099448777386 and parameters: {'model_name': 'IterativeImputer', 'sample_posterior': True, 'initial_strategy': 'median', 'imputation_order': 'ascending'}. Best is trial 17 with value: 4.15507044270351.
[I 2024-03-01 07:21:02,475] Trial 69 finished with value: 8.059540137563172 and parameters: {'model_name': 'GAIN', 'batch_size': 3, 'hint_rate': 0.86, 'alpha': 70, 'iterations': 141}. Best is trial 17 with value: 4.15507044270351.
[I 2024-03-01 07:21:04,693] Trial 176 finished with value: 4.15507044270351 and parameters: {'model_name': 'SimpleImputer', 'strategy': 'median'}. Best is trial 17 with value: 4.15507044270351.
[I 2024-03-01 07:21:05,724] Trial 54 finished with value: 11.44026113572653 and parameters: {'model_name': 'IterativeImputer', 'sample_posterior': True, 'initial_strategy': 'mean', 'imputation_order': 'roman'}. Best is trial 17 with value: 4.15507044270351.
[I 2024-03-01 07:21:07,043] Trial 33 finished with value: 11.71642630172968 and parameters: {'model_name': 'IterativeImputer', 'sample_posterior': True, 'initial_strategy': 'median', 'imputation_order': 'roman'}. Best is trial 17 with value: 4.15507044270351.
[I 2024-03-01 07:21:08,362] Trial 28 finished with value: 11.753750150015312 and parameters: {'model_name': 'IterativeImputer', 'sample_posterior': True, 'initial_strategy': 'mean', 'imputation_order': 'arabic'}. Best is trial 17 with value: 4.15507044270351.
[I 2024-03-01 07:21:09,553] Trial 178 finished with value: 4.15507044270351 and parameters: {'model_name': 'SimpleImputer', 'strategy': 'median'}. Best is trial 17 with value: 4.15507044270351.
[I 2024-03-01 07:21:10,987] Trial 179 finished with value: 4.15507044270351 and parameters: {'model_name': 'SimpleImputer', 'strategy': 'median'}. Best is trial 17 with value: 4.15507044270351.
[I 2024-03-01 07:21:12,382] Trial 180 finished with value: 4.15507044270351 and parameters: {'model_name': 'SimpleImputer', 'strategy': 'median'}. Best is trial 17 with value: 4.15507044270351.
[I 2024-03-01 07:21:13,322] Trial 62 finished with value: 11.53207061188798 and parameters: {'model_name': 'IterativeImputer', 'sample_posterior': True, 'initial_strategy': 'median', 'imputation_order': 'roman'}. Best is trial 17 with value: 4.15507044270351.
[I 2024-03-01 07:21:14,400] Trial 181 finished with value: 4.15507044270351 and parameters: {'model_name': 'SimpleImputer', 'strategy': 'median'}. Best is trial 17 with value: 4.15507044270351.
[I 2024-03-01 07:21:15,764] Trial 182 finished with value: 4.15507044270351 and parameters: {'model_name': 'SimpleImputer', 'strategy': 'median'}. Best is trial 17 with value: 4.15507044270351.
[I 2024-03-01 07:21:16,659] Trial 183 finished with value: 22.814197108057588 and parameters: {'model_name': 'SimpleImputer', 'strategy': 'constant'}. Best is trial 17 with value: 4.15507044270351.
[I 2024-03-01 07:21:17,749] Trial 184 finished with value: 22.814197108057588 and parameters: {'model_name': 'SimpleImputer', 'strategy': 'constant'}. Best is trial 17 with value: 4.15507044270351.
[I 2024-03-01 07:21:19,025] Trial 68 finished with value: 11.372359364931658 and parameters: {'model_name': 'IterativeImputer', 'sample_posterior': True, 'initial_strategy': 'mean', 'imputation_order': 'roman'}. Best is trial 17 with value: 4.15507044270351.
[I 2024-03-01 07:21:20,714] Trial 24 finished with value: 11.351206839583117 and parameters: {'model_name': 'IterativeImputer', 'sample_posterior': True, 'initial_strategy': 'median', 'imputation_order': 'descending'}. Best is trial 17 with value: 4.15507044270351.
[I 2024-03-01 07:21:21,482] Trial 188 finished with value: 4.15507044270351 and parameters: {'model_name': 'SimpleImputer', 'strategy': 'median'}. Best is trial 17 with value: 4.15507044270351.
[I 2024-03-01 07:21:22,854] Trial 189 finished with value: 4.15507044270351 and parameters: {'model_name': 'SimpleImputer', 'strategy': 'median'}. Best is trial 17 with value: 4.15507044270351.
[I 2024-03-01 07:21:24,638] Trial 190 finished with value: 4.15507044270351 and parameters: {'model_name': 'SimpleImputer', 'strategy': 'median'}. Best is trial 17 with value: 4.15507044270351.
[I 2024-03-01 07:21:26,247] Trial 32 finished with value: 11.211602071918076 and parameters: {'model_name': 'IterativeImputer', 'sample_posterior': True, 'initial_strategy': 'most_frequent', 'imputation_order': 'descending'}. Best is trial 17 with value: 4.15507044270351.
[I 2024-03-01 07:21:30,069] Trial 73 finished with value: 11.76395797454159 and parameters: {'model_name': 'IterativeImputer', 'sample_posterior': True, 'initial_strategy': 'mean', 'imputation_order': 'arabic'}. Best is trial 17 with value: 4.15507044270351.
[I 2024-03-01 07:21:37,608] Trial 38 finished with value: 7.702807107956009 and parameters: {'model_name': 'RandomForestImputer', 'max_iter': 23, 'decreasing': False, 'min_samples_split': 0.8, 'min_samples_leaf': 0.5, 'max_features': 0.9, 'warm_start': False}. Best is trial 17 with value: 4.15507044270351.
[I 2024-03-01 07:21:44,927] Trial 64 finished with value: 7.702294576900114 and parameters: {'model_name': 'RandomForestImputer', 'max_iter': 20, 'decreasing': True, 'min_samples_split': 0.6000000000000001, 'min_samples_leaf': 0.8, 'max_features': 0.30000000000000004, 'warm_start': False}. Best is trial 17 with value: 4.15507044270351.
[I 2024-03-01 07:21:53,048] Trial 77 finished with value: 11.564248931620616 and parameters: {'model_name': 'IterativeImputer', 'sample_posterior': True, 'initial_strategy': 'mean', 'imputation_order': 'ascending'}. Best is trial 17 with value: 4.15507044270351.
[I 2024-03-01 07:21:54,371] Trial 198 finished with value: 4.15507044270351 and parameters: {'model_name': 'SimpleImputer', 'strategy': 'median'}. Best is trial 17 with value: 4.15507044270351.
[I 2024-03-01 07:22:14,998] Trial 84 finished with value: 11.816594001803677 and parameters: {'model_name': 'IterativeImputer', 'sample_posterior': True, 'initial_strategy': 'median', 'imputation_order': 'roman'}. Best is trial 17 with value: 4.15507044270351.
[I 2024-03-01 07:22:16,884] Trial 89 finished with value: 11.453374643445773 and parameters: {'model_name': 'IterativeImputer', 'sample_posterior': True, 'initial_strategy': 'median', 'imputation_order': 'arabic'}. Best is trial 17 with value: 4.15507044270351.
[I 2024-03-01 07:22:18,583] Trial 88 finished with value: 10.964549176775833 and parameters: {'model_name': 'IterativeImputer', 'sample_posterior': True, 'initial_strategy': 'mean', 'imputation_order': 'descending'}. Best is trial 17 with value: 4.15507044270351.
[I 2024-03-01 07:22:53,311] Trial 100 finished with value: 11.722483504185842 and parameters: {'model_name': 'IterativeImputer', 'sample_posterior': True, 'initial_strategy': 'mean', 'imputation_order': 'descending'}. Best is trial 17 with value: 4.15507044270351.
[I 2024-03-01 07:23:00,731] Trial 102 finished with value: 12.467250005571705 and parameters: {'model_name': 'IterativeImputer', 'sample_posterior': True, 'initial_strategy': 'mean', 'imputation_order': 'descending'}. Best is trial 17 with value: 4.15507044270351.
[I 2024-03-01 07:23:01,767] Trial 101 finished with value: 11.484108181992433 and parameters: {'model_name': 'IterativeImputer', 'sample_posterior': True, 'initial_strategy': 'mean', 'imputation_order': 'descending'}. Best is trial 17 with value: 4.15507044270351.
[I 2024-03-01 07:23:03,531] Trial 103 finished with value: 11.769435408866991 and parameters: {'model_name': 'IterativeImputer', 'sample_posterior': True, 'initial_strategy': 'mean', 'imputation_order': 'descending'}. Best is trial 17 with value: 4.15507044270351.
[I 2024-03-01 07:23:06,217] Trial 104 finished with value: 11.944282155517039 and parameters: {'model_name': 'IterativeImputer', 'sample_posterior': True, 'initial_strategy': 'mean', 'imputation_order': 'ascending'}. Best is trial 17 with value: 4.15507044270351.
[I 2024-03-01 07:23:07,660] Trial 105 finished with value: 12.112603199878297 and parameters: {'model_name': 'IterativeImputer', 'sample_posterior': True, 'initial_strategy': 'median', 'imputation_order': 'ascending'}. Best is trial 17 with value: 4.15507044270351.
[I 2024-03-01 07:23:15,937] Trial 106 finished with value: 12.237374396584228 and parameters: {'model_name': 'IterativeImputer', 'sample_posterior': True, 'initial_strategy': 'median', 'imputation_order': 'ascending'}. Best is trial 17 with value: 4.15507044270351.
[I 2024-03-01 07:23:17,787] Trial 108 finished with value: 12.112813798922902 and parameters: {'model_name': 'IterativeImputer', 'sample_posterior': True, 'initial_strategy': 'mean', 'imputation_order': 'descending'}. Best is trial 17 with value: 4.15507044270351.
[I 2024-03-01 07:23:19,262] Trial 107 finished with value: 11.19823969814813 and parameters: {'model_name': 'IterativeImputer', 'sample_posterior': True, 'initial_strategy': 'median', 'imputation_order': 'ascending'}. Best is trial 17 with value: 4.15507044270351.
[I 2024-03-01 07:23:20,328] Trial 109 finished with value: 11.226119007565256 and parameters: {'model_name': 'IterativeImputer', 'sample_posterior': True, 'initial_strategy': 'median', 'imputation_order': 'descending'}. Best is trial 17 with value: 4.15507044270351.
[I 2024-03-01 07:23:22,063] Trial 111 finished with value: 12.085994935253312 and parameters: {'model_name': 'IterativeImputer', 'sample_posterior': True, 'initial_strategy': 'median', 'imputation_order': 'ascending'}. Best is trial 17 with value: 4.15507044270351.
[I 2024-03-01 07:23:23,962] Trial 110 finished with value: 11.510799859188703 and parameters: {'model_name': 'IterativeImputer', 'sample_posterior': True, 'initial_strategy': 'median', 'imputation_order': 'ascending'}. Best is trial 17 with value: 4.15507044270351.
[I 2024-03-01 07:23:25,267] Trial 113 finished with value: 11.273771473507658 and parameters: {'model_name': 'IterativeImputer', 'sample_posterior': True, 'initial_strategy': 'median', 'imputation_order': 'ascending'}. Best is trial 17 with value: 4.15507044270351.
[I 2024-03-01 07:23:30,561] Trial 114 finished with value: 11.125641102342737 and parameters: {'model_name': 'IterativeImputer', 'sample_posterior': True, 'initial_strategy': 'median', 'imputation_order': 'ascending'}. Best is trial 17 with value: 4.15507044270351.
[I 2024-03-01 07:23:32,126] Trial 115 finished with value: 11.93940941590699 and parameters: {'model_name': 'IterativeImputer', 'sample_posterior': True, 'initial_strategy': 'median', 'imputation_order': 'ascending'}. Best is trial 17 with value: 4.15507044270351.
[I 2024-03-01 07:23:33,624] Trial 116 finished with value: 11.185344436401156 and parameters: {'model_name': 'IterativeImputer', 'sample_posterior': True, 'initial_strategy': 'median', 'imputation_order': 'ascending'}. Best is trial 17 with value: 4.15507044270351.
[I 2024-03-01 07:23:58,489] Trial 7 finished with value: inf and parameters: {'model_name': 'GAIN', 'batch_size': 25, 'hint_rate': 0.6, 'alpha': 82, 'iterations': 3153}. Best is trial 17 with value: 4.15507044270351.
[I 2024-03-01 07:24:12,297] Trial 72 finished with value: inf and parameters: {'model_name': 'GAIN', 'batch_size': 42, 'hint_rate': 0.9400000000000001, 'alpha': 30, 'iterations': 788}. Best is trial 17 with value: 4.15507044270351.
[I 2024-03-01 07:24:32,884] Trial 11 finished with value: inf and parameters: {'model_name': 'GAIN', 'batch_size': 13, 'hint_rate': 0.06999999999999999, 'alpha': 23, 'iterations': 4302}. Best is trial 17 with value: 4.15507044270351.
[I 2024-03-01 07:26:26,191] Trial 59 finished with value: 7.733197824232741 and parameters: {'model_name': 'RandomForestImputer', 'max_iter': 74, 'decreasing': False, 'min_samples_split': 0.2, 'min_samples_leaf': 0.7000000000000001, 'max_features': 0.4, 'warm_start': False}. Best is trial 17 with value: 4.15507044270351.
[I 2024-03-01 07:27:49,662] Trial 74 finished with value: inf and parameters: {'model_name': 'GAIN', 'batch_size': 1, 'hint_rate': 0.5700000000000001, 'alpha': 5, 'iterations': 9531}. Best is trial 17 with value: 4.15507044270351.
[I 2024-03-01 07:28:24,291] Trial 4 finished with value: 6.8866446553960685 and parameters: {'model_name': 'RandomForestImputer', 'max_iter': 70, 'decreasing': False, 'min_samples_split': 0.0, 'min_samples_leaf': 0.1, 'max_features': 0.9, 'warm_start': False}. Best is trial 17 with value: 4.15507044270351.
[I 2024-03-01 07:28:39,153] Trial 70 finished with value: inf and parameters: {'model_name': 'GAIN', 'batch_size': 1, 'hint_rate': 0.17, 'alpha': 75, 'iterations': 10905}. Best is trial 17 with value: 4.15507044270351.
[I 2024-03-01 07:31:16,879] Trial 199 finished with value: inf and parameters: {'model_name': 'GAIN', 'batch_size': 8, 'hint_rate': 0.04, 'alpha': 2, 'iterations': 15082}. Best is trial 17 with value: 4.15507044270351.
[I 2024-03-01 07:41:00,022] Trial 170 finished with value: inf and parameters: {'model_name': 'GAIN', 'batch_size': 5, 'hint_rate': 0.09, 'alpha': 2, 'iterations': 38829}. Best is trial 17 with value: 4.15507044270351.
[I 2024-03-01 07:42:03,292] Trial 175 finished with value: inf and parameters: {'model_name': 'GAIN', 'batch_size': 5, 'hint_rate': 0.03, 'alpha': 0, 'iterations': 40100}. Best is trial 17 with value: 4.15507044270351.
[I 2024-03-01 07:42:08,105] Trial 80 finished with value: inf and parameters: {'model_name': 'GAIN', 'batch_size': 2, 'hint_rate': 0.46, 'alpha': 37, 'iterations': 41455}. Best is trial 17 with value: 4.15507044270351.
[I 2024-03-01 07:44:24,934] Trial 166 finished with value: inf and parameters: {'model_name': 'GAIN', 'batch_size': 5, 'hint_rate': 0.04, 'alpha': 6, 'iterations': 47634}. Best is trial 17 with value: 4.15507044270351.
[I 2024-03-01 07:44:54,049] Trial 171 finished with value: inf and parameters: {'model_name': 'GAIN', 'batch_size': 5, 'hint_rate': 0.03, 'alpha': 4, 'iterations': 48307}. Best is trial 17 with value: 4.15507044270351.
[I 2024-03-01 07:45:36,561] Trial 187 finished with value: inf and parameters: {'model_name': 'GAIN', 'batch_size': 8, 'hint_rate': 0.08, 'alpha': 8, 'iterations': 50704}. Best is trial 17 with value: 4.15507044270351.
