[I 2023-12-26 18:38:08,430] Trial 15 finished with value: 0.32900208348770965 and parameters: {'model_name': 'SimpleImputer', 'strategy': 'mean'}. Best is trial 15 with value: 0.32900208348770965.
[I 2023-12-26 18:38:11,689] Trial 4 finished with value: 0.3661633671023722 and parameters: {'model_name': 'SimpleImputer', 'strategy': 'median'}. Best is trial 15 with value: 0.32900208348770965.
[I 2023-12-26 18:38:12,668] Trial 3 finished with value: 0.3661633671023722 and parameters: {'model_name': 'SimpleImputer', 'strategy': 'median'}. Best is trial 15 with value: 0.32900208348770965.
[I 2023-12-26 18:38:14,119] Trial 25 finished with value: 0.3661633671023722 and parameters: {'model_name': 'SimpleImputer', 'strategy': 'median'}. Best is trial 15 with value: 0.32900208348770965.
[I 2023-12-26 18:38:14,705] Trial 29 finished with value: 0.3661633671023722 and parameters: {'model_name': 'SimpleImputer', 'strategy': 'median'}. Best is trial 15 with value: 0.32900208348770965.
[I 2023-12-26 18:38:17,092] Trial 46 finished with value: 0.3661633671023722 and parameters: {'model_name': 'SimpleImputer', 'strategy': 'median'}. Best is trial 15 with value: 0.32900208348770965.
2023-12-26 18:38:24.195050: E external/local_xla/xla/stream_executor/cuda/cuda_driver.cc:274] failed call to cuInit: CUDA_ERROR_NO_DEVICE: no CUDA-capable device is detected
2023-12-26 18:38:25.110273: I tensorflow/compiler/mlir/mlir_graph_optimization_pass.cc:388] MLIR V1 optimization pass is not enabled
[I 2023-12-26 18:39:02,762] Trial 41 finished with value: 0.3661633671023722 and parameters: {'model_name': 'SimpleImputer', 'strategy': 'most_frequent'}. Best is trial 15 with value: 0.32900208348770965.
[I 2023-12-26 18:40:31,328] Trial 24 finished with value: 0.32900208348770965 and parameters: {'model_name': 'RandomForestImputer', 'max_iter': 1, 'decreasing': True, 'min_samples_split': 0.6000000000000001, 'min_samples_leaf': 0.4, 'max_features': 0.6, 'warm_start': True}. Best is trial 15 with value: 0.32900208348770965.
[I 2023-12-26 18:40:36,848] Trial 36 finished with value: 0.32900208348770965 and parameters: {'model_name': 'RandomForestImputer', 'max_iter': 1, 'decreasing': False, 'min_samples_split': 0.7000000000000001, 'min_samples_leaf': 0.2, 'max_features': 0.5, 'warm_start': True}. Best is trial 15 with value: 0.32900208348770965.
[I 2023-12-26 18:40:43,629] Trial 52 finished with value: 0.32900208348770965 and parameters: {'model_name': 'RandomForestImputer', 'max_iter': 1, 'decreasing': False, 'min_samples_split': 0.5, 'min_samples_leaf': 0.8, 'max_features': 0.9, 'warm_start': True}. Best is trial 15 with value: 0.32900208348770965.
[I 2023-12-26 18:41:27,410] Trial 5 finished with value: 0.3058561900769813 and parameters: {'model_name': 'KNNImputer', 'weights': 'uniform', 'keep_empty_features': False}. Best is trial 5 with value: 0.3058561900769813.
[I 2023-12-26 18:41:32,132] Trial 6 finished with value: 0.3058561900769813 and parameters: {'model_name': 'KNNImputer', 'weights': 'uniform', 'keep_empty_features': False}. Best is trial 5 with value: 0.3058561900769813.
[I 2023-12-26 18:41:33,192] Trial 10 finished with value: 0.3058561900769813 and parameters: {'model_name': 'KNNImputer', 'weights': 'uniform', 'keep_empty_features': False}. Best is trial 5 with value: 0.3058561900769813.
[I 2023-12-26 18:41:33,916] Trial 14 finished with value: 0.3058561900769813 and parameters: {'model_name': 'KNNImputer', 'weights': 'uniform', 'keep_empty_features': False}. Best is trial 5 with value: 0.3058561900769813.
[I 2023-12-26 18:41:37,584] Trial 37 finished with value: 0.3058561900769813 and parameters: {'model_name': 'KNNImputer', 'weights': 'uniform', 'keep_empty_features': False}. Best is trial 5 with value: 0.3058561900769813.
[I 2023-12-26 18:41:45,174] Trial 53 finished with value: 0.3058561900769813 and parameters: {'model_name': 'KNNImputer', 'weights': 'uniform', 'keep_empty_features': False}. Best is trial 5 with value: 0.3058561900769813.
[I 2023-12-26 18:41:46,592] Trial 1 finished with value: 0.35254704104986134 and parameters: {'model_name': 'KNNImputer', 'weights': 'distance', 'keep_empty_features': False}. Best is trial 5 with value: 0.3058561900769813.
[I 2023-12-26 18:41:48,112] Trial 43 finished with value: 0.35254704104986134 and parameters: {'model_name': 'KNNImputer', 'weights': 'distance', 'keep_empty_features': False}. Best is trial 5 with value: 0.3058561900769813.
[I 2023-12-26 18:41:50,287] Trial 47 finished with value: 0.35254704104986134 and parameters: {'model_name': 'KNNImputer', 'weights': 'distance', 'keep_empty_features': False}. Best is trial 5 with value: 0.3058561900769813.
[I 2023-12-26 18:41:53,758] Trial 9 finished with value: 0.35254704104986134 and parameters: {'model_name': 'KNNImputer', 'weights': 'distance', 'keep_empty_features': False}. Best is trial 5 with value: 0.3058561900769813.
[I 2023-12-26 18:41:55,168] Trial 34 finished with value: 0.35254704104986134 and parameters: {'model_name': 'KNNImputer', 'weights': 'distance', 'keep_empty_features': False}. Best is trial 5 with value: 0.3058561900769813.
[I 2023-12-26 18:41:57,816] Trial 28 finished with value: 0.35254704104986134 and parameters: {'model_name': 'KNNImputer', 'weights': 'distance', 'keep_empty_features': False}. Best is trial 5 with value: 0.3058561900769813.
[I 2023-12-26 18:42:03,200] Trial 45 finished with value: 0.35254704104986134 and parameters: {'model_name': 'KNNImputer', 'weights': 'distance', 'keep_empty_features': False}. Best is trial 5 with value: 0.3058561900769813.
[I 2023-12-26 18:43:40,482] Trial 55 finished with value: 0.3058561900769813 and parameters: {'model_name': 'KNNImputer', 'weights': 'uniform', 'keep_empty_features': False}. Best is trial 5 with value: 0.3058561900769813.
[I 2023-12-26 18:43:43,990] Trial 57 finished with value: 0.3058561900769813 and parameters: {'model_name': 'KNNImputer', 'weights': 'uniform', 'keep_empty_features': False}. Best is trial 5 with value: 0.3058561900769813.
[I 2023-12-26 18:44:14,496] Trial 58 finished with value: 0.3058561900769813 and parameters: {'model_name': 'KNNImputer', 'weights': 'uniform', 'keep_empty_features': False}. Best is trial 5 with value: 0.3058561900769813.
[I 2023-12-26 18:44:20,660] Trial 59 finished with value: 0.3058561900769813 and parameters: {'model_name': 'KNNImputer', 'weights': 'uniform', 'keep_empty_features': False}. Best is trial 5 with value: 0.3058561900769813.
[I 2023-12-26 18:44:25,817] Trial 60 finished with value: 0.3058561900769813 and parameters: {'model_name': 'KNNImputer', 'weights': 'uniform', 'keep_empty_features': False}. Best is trial 5 with value: 0.3058561900769813.
[I 2023-12-26 18:44:31,698] Trial 61 finished with value: 0.35254704104986134 and parameters: {'model_name': 'KNNImputer', 'weights': 'distance', 'keep_empty_features': False}. Best is trial 5 with value: 0.3058561900769813.
[I 2023-12-26 18:46:49,751] Trial 35 finished with value: 0.4259808180666663 and parameters: {'model_name': 'GAIN', 'batch_size': 7, 'hint_rate': 0.26, 'alpha': 100, 'iterations': 44}. Best is trial 5 with value: 0.3058561900769813.
[I 2023-12-26 18:47:06,106] Trial 74 finished with value: 0.6589459542405269 and parameters: {'model_name': 'GAIN', 'batch_size': 39, 'hint_rate': 0.97, 'alpha': 71, 'iterations': 1}. Best is trial 5 with value: 0.3058561900769813.
[I 2023-12-26 18:47:50,906] Trial 65 finished with value: 0.47684552567242144 and parameters: {'model_name': 'GAIN', 'batch_size': 77, 'hint_rate': 0.77, 'alpha': 53, 'iterations': 27}. Best is trial 5 with value: 0.3058561900769813.
[I 2023-12-26 18:48:03,233] Trial 22 finished with value: 0.44008909883160197 and parameters: {'model_name': 'GAIN', 'batch_size': 1, 'hint_rate': 0.98, 'alpha': 10, 'iterations': 60}. Best is trial 5 with value: 0.3058561900769813.
[I 2023-12-26 18:48:18,732] Trial 39 finished with value: 0.3512917264220845 and parameters: {'model_name': 'RandomForestImputer', 'max_iter': 3, 'decreasing': False, 'min_samples_split': 0.7000000000000001, 'min_samples_leaf': 0.8, 'max_features': 0.30000000000000004, 'warm_start': True}. Best is trial 5 with value: 0.3058561900769813.
[I 2023-12-26 18:51:49,434] Trial 54 finished with value: 0.35234544083372227 and parameters: {'model_name': 'RandomForestImputer', 'max_iter': 6, 'decreasing': False, 'min_samples_split': 0.2, 'min_samples_leaf': 0.5, 'max_features': 0.2, 'warm_start': True}. Best is trial 5 with value: 0.3058561900769813.
[I 2023-12-26 18:51:53,827] Trial 20 finished with value: 0.32900208348770965 and parameters: {'model_name': 'RandomForestImputer', 'max_iter': 1, 'decreasing': True, 'min_samples_split': 0.7000000000000001, 'min_samples_leaf': 0.9, 'max_features': 0.2, 'warm_start': False}. Best is trial 5 with value: 0.3058561900769813.
[I 2023-12-26 18:55:50,697] Trial 30 finished with value: 0.3624306241567187 and parameters: {'model_name': 'GAIN', 'batch_size': 146, 'hint_rate': 0.09999999999999999, 'alpha': 28, 'iterations': 120}. Best is trial 5 with value: 0.3058561900769813.
[I 2023-12-26 18:56:37,891] Trial 16 finished with value: 0.3396764390433427 and parameters: {'model_name': 'RandomForestImputer', 'max_iter': 17, 'decreasing': True, 'min_samples_split': 0.9, 'min_samples_leaf': 0.8, 'max_features': 0.4, 'warm_start': True}. Best is trial 5 with value: 0.3058561900769813.
[I 2023-12-26 18:57:51,960] Trial 42 finished with value: 0.339718897993946 and parameters: {'model_name': 'RandomForestImputer', 'max_iter': 17, 'decreasing': True, 'min_samples_split': 0.8, 'min_samples_leaf': 0.30000000000000004, 'max_features': 0.5, 'warm_start': True}. Best is trial 5 with value: 0.3058561900769813.
[I 2023-12-26 19:00:20,169] Trial 86 finished with value: 0.3058561900769813 and parameters: {'model_name': 'KNNImputer', 'weights': 'uniform', 'keep_empty_features': False}. Best is trial 5 with value: 0.3058561900769813.
[I 2023-12-26 19:00:37,263] Trial 69 finished with value: 0.36629755256854823 and parameters: {'model_name': 'GAIN', 'batch_size': 1, 'hint_rate': 0.060000000000000005, 'alpha': 46, 'iterations': 146}. Best is trial 5 with value: 0.3058561900769813.
[I 2023-12-26 19:02:58,212] Trial 32 finished with value: 0.3396680131696333 and parameters: {'model_name': 'RandomForestImputer', 'max_iter': 15, 'decreasing': True, 'min_samples_split': 0.4, 'min_samples_leaf': 0.1, 'max_features': 0.1, 'warm_start': True}. Best is trial 5 with value: 0.3058561900769813.
[I 2023-12-26 19:09:04,721] Trial 2 finished with value: 0.32905873708785655 and parameters: {'model_name': 'RandomForestImputer', 'max_iter': 2, 'decreasing': True, 'min_samples_split': 0.1, 'min_samples_leaf': 0.7000000000000001, 'max_features': 0.7000000000000001, 'warm_start': False}. Best is trial 5 with value: 0.3058561900769813.
[I 2023-12-26 19:09:21,029] Trial 26 finished with value: 0.3290990712660577 and parameters: {'model_name': 'RandomForestImputer', 'max_iter': 2, 'decreasing': False, 'min_samples_split': 0.8, 'min_samples_leaf': 0.30000000000000004, 'max_features': 0.6, 'warm_start': False}. Best is trial 5 with value: 0.3058561900769813.
[I 2023-12-26 19:13:32,043] Trial 38 finished with value: 0.23093022788568723 and parameters: {'model_name': 'IterativeImputer', 'sample_posterior': False, 'initial_strategy': 'mean', 'imputation_order': 'roman'}. Best is trial 38 with value: 0.23093022788568723.
[I 2023-12-26 19:13:34,218] Trial 13 finished with value: 0.23092990848082473 and parameters: {'model_name': 'IterativeImputer', 'sample_posterior': False, 'initial_strategy': 'constant', 'imputation_order': 'ascending'}. Best is trial 13 with value: 0.23092990848082473.
[I 2023-12-26 19:13:53,593] Trial 27 finished with value: 0.23092835656850458 and parameters: {'model_name': 'IterativeImputer', 'sample_posterior': False, 'initial_strategy': 'most_frequent', 'imputation_order': 'descending'}. Best is trial 27 with value: 0.23092835656850458.
[I 2023-12-26 19:13:54,483] Trial 40 finished with value: 0.2309290969960242 and parameters: {'model_name': 'IterativeImputer', 'sample_posterior': False, 'initial_strategy': 'mean', 'imputation_order': 'random'}. Best is trial 27 with value: 0.23092835656850458.
[I 2023-12-26 19:15:06,795] Trial 68 finished with value: 0.23092759240829114 and parameters: {'model_name': 'IterativeImputer', 'sample_posterior': False, 'initial_strategy': 'constant', 'imputation_order': 'arabic'}. Best is trial 68 with value: 0.23092759240829114.
[I 2023-12-26 19:15:09,009] Trial 66 finished with value: 0.23092759240829114 and parameters: {'model_name': 'IterativeImputer', 'sample_posterior': False, 'initial_strategy': 'constant', 'imputation_order': 'arabic'}. Best is trial 68 with value: 0.23092759240829114.
[I 2023-12-26 19:16:06,259] Trial 71 finished with value: 0.23092835656850458 and parameters: {'model_name': 'IterativeImputer', 'sample_posterior': False, 'initial_strategy': 'constant', 'imputation_order': 'descending'}. Best is trial 68 with value: 0.23092759240829114.
[I 2023-12-26 19:16:36,172] Trial 73 finished with value: 0.23093022788568723 and parameters: {'model_name': 'IterativeImputer', 'sample_posterior': False, 'initial_strategy': 'mean', 'imputation_order': 'roman'}. Best is trial 68 with value: 0.23092759240829114.
[I 2023-12-26 19:16:55,296] Trial 75 finished with value: 0.23093252450636648 and parameters: {'model_name': 'IterativeImputer', 'sample_posterior': False, 'initial_strategy': 'median', 'imputation_order': 'roman'}. Best is trial 68 with value: 0.23092759240829114.
[I 2023-12-26 19:29:21,011] Trial 84 finished with value: 0.23092156937785976 and parameters: {'model_name': 'IterativeImputer', 'sample_posterior': False, 'initial_strategy': 'constant', 'imputation_order': 'random'}. Best is trial 84 with value: 0.23092156937785976.
[I 2023-12-26 19:30:58,207] Trial 48 finished with value: 0.3290846335827601 and parameters: {'model_name': 'RandomForestImputer', 'max_iter': 3, 'decreasing': True, 'min_samples_split': 0.7000000000000001, 'min_samples_leaf': 0.5, 'max_features': 0.7000000000000001, 'warm_start': False}. Best is trial 84 with value: 0.23092156937785976.
[I 2023-12-26 19:42:52,310] Trial 91 finished with value: 0.23092963395354568 and parameters: {'model_name': 'IterativeImputer', 'sample_posterior': False, 'initial_strategy': 'mean', 'imputation_order': 'ascending'}. Best is trial 84 with value: 0.23092156937785976.
[I 2023-12-26 19:46:47,731] Trial 92 finished with value: 0.23093022788568723 and parameters: {'model_name': 'IterativeImputer', 'sample_posterior': False, 'initial_strategy': 'mean', 'imputation_order': 'roman'}. Best is trial 84 with value: 0.23092156937785976.
[I 2023-12-26 19:46:54,899] Trial 93 finished with value: 0.23093252450636648 and parameters: {'model_name': 'IterativeImputer', 'sample_posterior': False, 'initial_strategy': 'constant', 'imputation_order': 'roman'}. Best is trial 84 with value: 0.23092156937785976.
[I 2023-12-26 19:47:13,467] Trial 95 finished with value: 0.23092963395354568 and parameters: {'model_name': 'IterativeImputer', 'sample_posterior': False, 'initial_strategy': 'mean', 'imputation_order': 'ascending'}. Best is trial 84 with value: 0.23092156937785976.
[I 2023-12-26 19:47:39,371] Trial 94 finished with value: 0.23093252450636648 and parameters: {'model_name': 'IterativeImputer', 'sample_posterior': False, 'initial_strategy': 'most_frequent', 'imputation_order': 'roman'}. Best is trial 84 with value: 0.23092156937785976.
[I 2023-12-26 19:48:15,395] Trial 97 finished with value: 0.23092759240829114 and parameters: {'model_name': 'IterativeImputer', 'sample_posterior': False, 'initial_strategy': 'constant', 'imputation_order': 'arabic'}. Best is trial 84 with value: 0.23092156937785976.
[I 2023-12-26 19:48:23,450] Trial 96 finished with value: 0.23092759240829114 and parameters: {'model_name': 'IterativeImputer', 'sample_posterior': False, 'initial_strategy': 'constant', 'imputation_order': 'arabic'}. Best is trial 84 with value: 0.23092156937785976.
[I 2023-12-26 19:49:44,870] Trial 98 finished with value: 0.23092835656850458 and parameters: {'model_name': 'IterativeImputer', 'sample_posterior': False, 'initial_strategy': 'constant', 'imputation_order': 'descending'}. Best is trial 84 with value: 0.23092156937785976.
[I 2023-12-26 19:50:12,768] Trial 99 finished with value: 0.23092835656850458 and parameters: {'model_name': 'IterativeImputer', 'sample_posterior': False, 'initial_strategy': 'constant', 'imputation_order': 'descending'}. Best is trial 84 with value: 0.23092156937785976.
[I 2023-12-26 19:50:40,656] Trial 100 finished with value: 0.23092759240829114 and parameters: {'model_name': 'IterativeImputer', 'sample_posterior': False, 'initial_strategy': 'constant', 'imputation_order': 'arabic'}. Best is trial 84 with value: 0.23092156937785976.
[I 2023-12-26 20:00:52,551] Trial 101 finished with value: 0.23092835656850458 and parameters: {'model_name': 'IterativeImputer', 'sample_posterior': False, 'initial_strategy': 'constant', 'imputation_order': 'descending'}. Best is trial 84 with value: 0.23092156937785976.
[I 2023-12-26 20:02:51,340] Trial 102 finished with value: 0.23092807395825227 and parameters: {'model_name': 'IterativeImputer', 'sample_posterior': False, 'initial_strategy': 'constant', 'imputation_order': 'random'}. Best is trial 84 with value: 0.23092156937785976.
[I 2023-12-26 20:10:23,849] Trial 21 finished with value: 0.329515056399747 and parameters: {'model_name': 'IterativeImputer', 'sample_posterior': True, 'initial_strategy': 'median', 'imputation_order': 'ascending'}. Best is trial 84 with value: 0.23092156937785976.
[I 2023-12-26 20:10:52,611] Trial 19 finished with value: 0.3296466094147449 and parameters: {'model_name': 'IterativeImputer', 'sample_posterior': True, 'initial_strategy': 'mean', 'imputation_order': 'arabic'}. Best is trial 84 with value: 0.23092156937785976.
[I 2023-12-26 20:11:11,107] Trial 103 finished with value: 0.2309391646944976 and parameters: {'model_name': 'IterativeImputer', 'sample_posterior': False, 'initial_strategy': 'constant', 'imputation_order': 'random'}. Best is trial 84 with value: 0.23092156937785976.
[I 2023-12-26 20:11:18,525] Trial 12 finished with value: 0.3285586750464852 and parameters: {'model_name': 'IterativeImputer', 'sample_posterior': True, 'initial_strategy': 'median', 'imputation_order': 'arabic'}. Best is trial 84 with value: 0.23092156937785976.
[I 2023-12-26 20:11:26,392] Trial 18 finished with value: 0.3310258476311125 and parameters: {'model_name': 'IterativeImputer', 'sample_posterior': True, 'initial_strategy': 'mean', 'imputation_order': 'ascending'}. Best is trial 84 with value: 0.23092156937785976.
[I 2023-12-26 20:11:31,048] Trial 7 finished with value: 0.32939091307137464 and parameters: {'model_name': 'IterativeImputer', 'sample_posterior': True, 'initial_strategy': 'mean', 'imputation_order': 'arabic'}. Best is trial 84 with value: 0.23092156937785976.
[I 2023-12-26 20:11:36,286] Trial 11 finished with value: 0.32926349570672186 and parameters: {'model_name': 'IterativeImputer', 'sample_posterior': True, 'initial_strategy': 'mean', 'imputation_order': 'ascending'}. Best is trial 84 with value: 0.23092156937785976.
[I 2023-12-26 20:11:39,781] Trial 44 finished with value: 0.3285224506576784 and parameters: {'model_name': 'IterativeImputer', 'sample_posterior': True, 'initial_strategy': 'most_frequent', 'imputation_order': 'arabic'}. Best is trial 84 with value: 0.23092156937785976.
[I 2023-12-26 20:11:45,812] Trial 49 finished with value: 0.3291381336903646 and parameters: {'model_name': 'IterativeImputer', 'sample_posterior': True, 'initial_strategy': 'median', 'imputation_order': 'descending'}. Best is trial 84 with value: 0.23092156937785976.
[I 2023-12-26 20:12:03,969] Trial 51 finished with value: 0.3295585379748524 and parameters: {'model_name': 'IterativeImputer', 'sample_posterior': True, 'initial_strategy': 'median', 'imputation_order': 'random'}. Best is trial 84 with value: 0.23092156937785976.
[I 2023-12-26 20:12:06,761] Trial 0 finished with value: 0.32815779691015845 and parameters: {'model_name': 'IterativeImputer', 'sample_posterior': True, 'initial_strategy': 'mean', 'imputation_order': 'random'}. Best is trial 84 with value: 0.23092156937785976.
[I 2023-12-26 20:12:17,947] Trial 17 finished with value: 0.33093902764526933 and parameters: {'model_name': 'IterativeImputer', 'sample_posterior': True, 'initial_strategy': 'median', 'imputation_order': 'random'}. Best is trial 84 with value: 0.23092156937785976.
[I 2023-12-26 20:13:35,706] Trial 72 finished with value: 0.3290286214017378 and parameters: {'model_name': 'IterativeImputer', 'sample_posterior': True, 'initial_strategy': 'most_frequent', 'imputation_order': 'ascending'}. Best is trial 84 with value: 0.23092156937785976.
[I 2023-12-26 20:14:05,703] Trial 76 finished with value: 0.3308775194935317 and parameters: {'model_name': 'IterativeImputer', 'sample_posterior': True, 'initial_strategy': 'constant', 'imputation_order': 'arabic'}. Best is trial 84 with value: 0.23092156937785976.
[I 2023-12-26 20:14:44,836] Trial 104 finished with value: 0.23092759240829114 and parameters: {'model_name': 'IterativeImputer', 'sample_posterior': False, 'initial_strategy': 'constant', 'imputation_order': 'arabic'}. Best is trial 84 with value: 0.23092156937785976.
[I 2023-12-26 20:15:10,986] Trial 77 finished with value: 0.3294805037772143 and parameters: {'model_name': 'IterativeImputer', 'sample_posterior': True, 'initial_strategy': 'median', 'imputation_order': 'random'}. Best is trial 84 with value: 0.23092156937785976.
[I 2023-12-26 20:15:24,593] Trial 78 finished with value: 0.3306994912547508 and parameters: {'model_name': 'IterativeImputer', 'sample_posterior': True, 'initial_strategy': 'constant', 'imputation_order': 'arabic'}. Best is trial 84 with value: 0.23092156937785976.
