Run: 6
/cm/local/apps/slurm/var/spool/job833602/slurm_script: line 23: /common/ketrong/minconda3/etc/profile.d/conda.sh: No such file or directory
/cm/local/apps/slurm/var/spool/job833602/slurm_script: line 26: $'\nconda create --name tpot2devenv -c conda-forge python=3.10\n': command not found
/cm/local/apps/slurm/var/spool/job833602/slurm_script: line 31: $'\npip install -r requirements.txt\n': command not found
RunStart
2024-04-23 01:21:24.668606: I tensorflow/core/util/port.cc:113] oneDNN custom operations are on. You may see slightly different numerical results due to floating-point round-off errors from different computation orders. To turn them off, set the environment variable `TF_ENABLE_ONEDNN_OPTS=0`.
2024-04-23 01:21:24.705809: E external/local_xla/xla/stream_executor/cuda/cuda_dnn.cc:9261] Unable to register cuDNN factory: Attempting to register factory for plugin cuDNN when one has already been registered
2024-04-23 01:21:24.705828: E external/local_xla/xla/stream_executor/cuda/cuda_fft.cc:607] Unable to register cuFFT factory: Attempting to register factory for plugin cuFFT when one has already been registered
2024-04-23 01:21:24.707215: E external/local_xla/xla/stream_executor/cuda/cuda_blas.cc:1515] Unable to register cuBLAS factory: Attempting to register factory for plugin cuBLAS when one has already been registered
2024-04-23 01:21:24.713366: I tensorflow/core/platform/cpu_feature_guard.cc:182] This TensorFlow binary is optimized to use available CPU instructions in performance-critical operations.
To enable the following instructions: AVX2 AVX512F AVX512_VNNI FMA, in other operations, rebuild TensorFlow with the appropriate compiler flags.
2024-04-23 01:21:29.590252: W tensorflow/compiler/tf2tensorrt/utils/py_utils.cc:38] TF-TRT Warning: Could not find TensorRT
WARNING:tensorflow:From /home/ketrong/miniconda3/envs/tpot2devenv/lib/python3.10/site-packages/tensorflow/python/compat/v2_compat.py:108: disable_resource_variables (from tensorflow.python.ops.variable_scope) is deprecated and will be removed in a future version.
Instructions for updating:
non-resource variables are not supported in the long term
starting loops
working on 
logs/189865/tpot2_base_normal_MAR_0.01
3.9348268508911133
loading data
logs/189865/tpot2_base_normal_MAR_0.01/data/189865_True.pkl
[1 1 1 ... 1 1 0]
         0   ...     19
0     231.0  ...  144.0
1     225.0  ...  129.0
2     182.0  ...  158.0
3     229.0  ...  135.0
4     215.0  ...  148.0
...     ...  ...    ...
3429  224.0  ...   91.0
3430  171.0  ...  194.0
3431  251.0  ...  157.0
3432  178.0  ...  118.0
3433  221.0  ...  222.0

[3434 rows x 20 columns]
         0   ...     19
0     203.0  ...   95.0
1     243.0  ...  155.0
2     229.0  ...  146.0
3     206.0  ...  125.0
4     236.0  ...  169.0
...     ...  ...    ...
1685  242.0  ...  144.0
1686  223.0  ...  110.0
1687  215.0  ...  187.0
1688  242.0  ...  156.0
1689  210.0  ...   59.0

[1690 rows x 20 columns]
running experiment 1/3 - Does large hyperparameter space improve reconstruction accuracy over simple
[I 2024-04-23 01:22:05,483] A new study created in memory with name: no-name-046a561b-8eec-4b01-88a9-6f964a26ea56
[I 2024-04-23 01:22:05,812] Trial 5 finished with value: 1527.0597515236516 and parameters: {'model_name': 'SimpleImputer', 'strategy': 'constant'}. Best is trial 5 with value: 1527.0597515236516.
[I 2024-04-23 01:22:06,242] Trial 0 finished with value: 800.7415124315072 and parameters: {'model_name': 'SimpleImputer', 'strategy': 'mean'}. Best is trial 0 with value: 800.7415124315072.
[I 2024-04-23 01:22:06,533] Trial 14 finished with value: 1527.0597515236516 and parameters: {'model_name': 'SimpleImputer', 'strategy': 'constant'}. Best is trial 0 with value: 800.7415124315072.
[I 2024-04-23 01:22:06,835] Trial 3 finished with value: 800.7415124315072 and parameters: {'model_name': 'SimpleImputer', 'strategy': 'mean'}. Best is trial 0 with value: 800.7415124315072.
[I 2024-04-23 01:22:06,994] Trial 4 finished with value: 800.7415124315072 and parameters: {'model_name': 'SimpleImputer', 'strategy': 'mean'}. Best is trial 0 with value: 800.7415124315072.
[I 2024-04-23 01:22:07,249] Trial 11 finished with value: 800.7415124315072 and parameters: {'model_name': 'SimpleImputer', 'strategy': 'mean'}. Best is trial 0 with value: 800.7415124315072.
[I 2024-04-23 01:22:07,417] Trial 17 finished with value: 1527.0597515236516 and parameters: {'model_name': 'SimpleImputer', 'strategy': 'constant'}. Best is trial 0 with value: 800.7415124315072.
[I 2024-04-23 01:22:07,748] Trial 18 finished with value: 1527.0597515236516 and parameters: {'model_name': 'SimpleImputer', 'strategy': 'constant'}. Best is trial 0 with value: 800.7415124315072.
[I 2024-04-23 01:22:07,959] Trial 8 finished with value: 800.7415124315072 and parameters: {'model_name': 'SimpleImputer', 'strategy': 'mean'}. Best is trial 0 with value: 800.7415124315072.
[I 2024-04-23 01:22:08,439] Trial 22 finished with value: 1527.0597515236516 and parameters: {'model_name': 'SimpleImputer', 'strategy': 'constant'}. Best is trial 0 with value: 800.7415124315072.
[I 2024-04-23 01:22:08,682] Trial 16 finished with value: 800.7415124315072 and parameters: {'model_name': 'SimpleImputer', 'strategy': 'mean'}. Best is trial 0 with value: 800.7415124315072.
[I 2024-04-23 01:22:09,014] Trial 27 finished with value: 1527.0597515236516 and parameters: {'model_name': 'SimpleImputer', 'strategy': 'constant'}. Best is trial 0 with value: 800.7415124315072.
[I 2024-04-23 01:22:09,367] Trial 34 finished with value: 1527.0597515236516 and parameters: {'model_name': 'SimpleImputer', 'strategy': 'constant'}. Best is trial 0 with value: 800.7415124315072.
[I 2024-04-23 01:22:09,744] Trial 28 finished with value: 800.7415124315072 and parameters: {'model_name': 'SimpleImputer', 'strategy': 'mean'}. Best is trial 0 with value: 800.7415124315072.
[I 2024-04-23 01:22:09,945] Trial 2 finished with value: 820.2256829826541 and parameters: {'model_name': 'SimpleImputer', 'strategy': 'median'}. Best is trial 0 with value: 800.7415124315072.
[I 2024-04-23 01:22:10,385] Trial 1 finished with value: 820.2256829826541 and parameters: {'model_name': 'SimpleImputer', 'strategy': 'median'}. Best is trial 0 with value: 800.7415124315072.
[I 2024-04-23 01:22:10,723] Trial 30 finished with value: 1527.0597515236516 and parameters: {'model_name': 'SimpleImputer', 'strategy': 'constant'}. Best is trial 0 with value: 800.7415124315072.
[I 2024-04-23 01:22:11,044] Trial 33 finished with value: 800.7415124315072 and parameters: {'model_name': 'SimpleImputer', 'strategy': 'mean'}. Best is trial 0 with value: 800.7415124315072.
[I 2024-04-23 01:22:11,359] Trial 10 finished with value: 820.2256829826541 and parameters: {'model_name': 'SimpleImputer', 'strategy': 'median'}. Best is trial 0 with value: 800.7415124315072.
[I 2024-04-23 01:22:11,746] Trial 6 finished with value: 820.2256829826541 and parameters: {'model_name': 'SimpleImputer', 'strategy': 'median'}. Best is trial 0 with value: 800.7415124315072.
[I 2024-04-23 01:22:11,947] Trial 39 finished with value: 1527.0597515236516 and parameters: {'model_name': 'SimpleImputer', 'strategy': 'constant'}. Best is trial 0 with value: 800.7415124315072.
[I 2024-04-23 01:22:12,146] Trial 42 finished with value: 1527.0597515236516 and parameters: {'model_name': 'SimpleImputer', 'strategy': 'constant'}. Best is trial 0 with value: 800.7415124315072.
[I 2024-04-23 01:22:12,345] Trial 35 finished with value: 800.7415124315072 and parameters: {'model_name': 'SimpleImputer', 'strategy': 'mean'}. Best is trial 0 with value: 800.7415124315072.
[I 2024-04-23 01:22:12,701] Trial 9 finished with value: 820.2256829826541 and parameters: {'model_name': 'SimpleImputer', 'strategy': 'median'}. Best is trial 0 with value: 800.7415124315072.
[I 2024-04-23 01:22:12,893] Trial 47 finished with value: 1527.0597515236516 and parameters: {'model_name': 'SimpleImputer', 'strategy': 'constant'}. Best is trial 0 with value: 800.7415124315072.
[I 2024-04-23 01:22:13,081] Trial 49 finished with value: 1527.0597515236516 and parameters: {'model_name': 'SimpleImputer', 'strategy': 'constant'}. Best is trial 0 with value: 800.7415124315072.
[I 2024-04-23 01:22:13,341] Trial 53 finished with value: 1527.0597515236516 and parameters: {'model_name': 'SimpleImputer', 'strategy': 'constant'}. Best is trial 0 with value: 800.7415124315072.
[I 2024-04-23 01:22:13,548] Trial 41 finished with value: 800.7415124315072 and parameters: {'model_name': 'SimpleImputer', 'strategy': 'mean'}. Best is trial 0 with value: 800.7415124315072.
[I 2024-04-23 01:22:13,746] Trial 48 finished with value: 1527.0597515236516 and parameters: {'model_name': 'SimpleImputer', 'strategy': 'constant'}. Best is trial 0 with value: 800.7415124315072.
[I 2024-04-23 01:22:14,007] Trial 51 finished with value: 1527.0597515236516 and parameters: {'model_name': 'SimpleImputer', 'strategy': 'constant'}. Best is trial 0 with value: 800.7415124315072.
[I 2024-04-23 01:22:14,509] Trial 13 finished with value: 820.2256829826541 and parameters: {'model_name': 'SimpleImputer', 'strategy': 'median'}. Best is trial 0 with value: 800.7415124315072.
[I 2024-04-23 01:22:14,692] Trial 37 finished with value: 800.7415124315072 and parameters: {'model_name': 'SimpleImputer', 'strategy': 'mean'}. Best is trial 0 with value: 800.7415124315072.
[I 2024-04-23 01:22:15,111] Trial 40 finished with value: 800.7415124315072 and parameters: {'model_name': 'SimpleImputer', 'strategy': 'mean'}. Best is trial 0 with value: 800.7415124315072.
[I 2024-04-23 01:22:15,291] Trial 52 finished with value: 800.7415124315072 and parameters: {'model_name': 'SimpleImputer', 'strategy': 'mean'}. Best is trial 0 with value: 800.7415124315072.
[I 2024-04-23 01:22:15,468] Trial 19 finished with value: 820.2256829826541 and parameters: {'model_name': 'SimpleImputer', 'strategy': 'median'}. Best is trial 0 with value: 800.7415124315072.
[I 2024-04-23 01:22:15,815] Trial 15 finished with value: 820.2256829826541 and parameters: {'model_name': 'SimpleImputer', 'strategy': 'median'}. Best is trial 0 with value: 800.7415124315072.
[I 2024-04-23 01:22:16,099] Trial 21 finished with value: 820.2256829826541 and parameters: {'model_name': 'SimpleImputer', 'strategy': 'median'}. Best is trial 0 with value: 800.7415124315072.
[I 2024-04-23 01:22:16,323] Trial 25 finished with value: 820.2256829826541 and parameters: {'model_name': 'SimpleImputer', 'strategy': 'median'}. Best is trial 0 with value: 800.7415124315072.
[I 2024-04-23 01:22:16,681] Trial 23 finished with value: 820.2256829826541 and parameters: {'model_name': 'SimpleImputer', 'strategy': 'median'}. Best is trial 0 with value: 800.7415124315072.
[I 2024-04-23 01:22:17,369] Trial 20 finished with value: 820.2256829826541 and parameters: {'model_name': 'SimpleImputer', 'strategy': 'median'}. Best is trial 0 with value: 800.7415124315072.
[I 2024-04-23 01:22:17,704] Trial 31 finished with value: 820.2256829826541 and parameters: {'model_name': 'SimpleImputer', 'strategy': 'median'}. Best is trial 0 with value: 800.7415124315072.
[I 2024-04-23 01:22:18,148] Trial 32 finished with value: 820.2256829826541 and parameters: {'model_name': 'SimpleImputer', 'strategy': 'median'}. Best is trial 0 with value: 800.7415124315072.
[I 2024-04-23 01:22:18,396] Trial 55 finished with value: 820.2256829826541 and parameters: {'model_name': 'SimpleImputer', 'strategy': 'median'}. Best is trial 0 with value: 800.7415124315072.
[I 2024-04-23 01:22:18,585] Trial 38 finished with value: 820.2256829826541 and parameters: {'model_name': 'SimpleImputer', 'strategy': 'median'}. Best is trial 0 with value: 800.7415124315072.
[I 2024-04-23 01:22:18,766] Trial 43 finished with value: 820.2256829826541 and parameters: {'model_name': 'SimpleImputer', 'strategy': 'median'}. Best is trial 0 with value: 800.7415124315072.
[I 2024-04-23 01:22:19,093] Trial 54 finished with value: 820.2256829826541 and parameters: {'model_name': 'SimpleImputer', 'strategy': 'median'}. Best is trial 0 with value: 800.7415124315072.
[I 2024-04-23 01:22:19,283] Trial 50 finished with value: 820.2256829826541 and parameters: {'model_name': 'SimpleImputer', 'strategy': 'median'}. Best is trial 0 with value: 800.7415124315072.
[I 2024-04-23 01:22:19,605] Trial 45 finished with value: 820.2256829826541 and parameters: {'model_name': 'SimpleImputer', 'strategy': 'median'}. Best is trial 0 with value: 800.7415124315072.
[I 2024-04-23 01:22:23,646] Trial 12 finished with value: 1420.311467174776 and parameters: {'model_name': 'SimpleImputer', 'strategy': 'most_frequent'}. Best is trial 0 with value: 800.7415124315072.
[I 2024-04-23 01:22:24,974] Trial 7 finished with value: 1420.311467174776 and parameters: {'model_name': 'SimpleImputer', 'strategy': 'most_frequent'}. Best is trial 0 with value: 800.7415124315072.
[I 2024-04-23 01:22:25,658] Trial 24 finished with value: 1420.311467174776 and parameters: {'model_name': 'SimpleImputer', 'strategy': 'most_frequent'}. Best is trial 0 with value: 800.7415124315072.
[I 2024-04-23 01:22:26,038] Trial 26 finished with value: 1420.311467174776 and parameters: {'model_name': 'SimpleImputer', 'strategy': 'most_frequent'}. Best is trial 0 with value: 800.7415124315072.
[I 2024-04-23 01:22:26,863] Trial 29 finished with value: 1420.311467174776 and parameters: {'model_name': 'SimpleImputer', 'strategy': 'most_frequent'}. Best is trial 0 with value: 800.7415124315072.
[I 2024-04-23 01:22:27,179] Trial 63 finished with value: 1420.311467174776 and parameters: {'model_name': 'SimpleImputer', 'strategy': 'most_frequent'}. Best is trial 0 with value: 800.7415124315072.
[I 2024-04-23 01:22:27,467] Trial 62 finished with value: 1420.311467174776 and parameters: {'model_name': 'SimpleImputer', 'strategy': 'most_frequent'}. Best is trial 0 with value: 800.7415124315072.
[I 2024-04-23 01:22:27,731] Trial 44 finished with value: 1420.311467174776 and parameters: {'model_name': 'SimpleImputer', 'strategy': 'most_frequent'}. Best is trial 0 with value: 800.7415124315072.
[I 2024-04-23 01:22:28,203] Trial 60 finished with value: 1420.311467174776 and parameters: {'model_name': 'SimpleImputer', 'strategy': 'most_frequent'}. Best is trial 0 with value: 800.7415124315072.
[I 2024-04-23 01:22:28,478] Trial 36 finished with value: 1420.311467174776 and parameters: {'model_name': 'SimpleImputer', 'strategy': 'most_frequent'}. Best is trial 0 with value: 800.7415124315072.
[I 2024-04-23 01:22:28,757] Trial 76 finished with value: 1420.311467174776 and parameters: {'model_name': 'SimpleImputer', 'strategy': 'most_frequent'}. Best is trial 0 with value: 800.7415124315072.
[I 2024-04-23 01:22:29,060] Trial 98 finished with value: 800.7415124315072 and parameters: {'model_name': 'SimpleImputer', 'strategy': 'mean'}. Best is trial 0 with value: 800.7415124315072.
[I 2024-04-23 01:22:29,468] Trial 99 finished with value: 800.7415124315072 and parameters: {'model_name': 'SimpleImputer', 'strategy': 'mean'}. Best is trial 0 with value: 800.7415124315072.
[I 2024-04-23 01:22:29,749] Trial 46 finished with value: 1420.311467174776 and parameters: {'model_name': 'SimpleImputer', 'strategy': 'most_frequent'}. Best is trial 0 with value: 800.7415124315072.
[I 2024-04-23 01:22:29,983] Trial 65 finished with value: 1420.311467174776 and parameters: {'model_name': 'SimpleImputer', 'strategy': 'most_frequent'}. Best is trial 0 with value: 800.7415124315072.
[I 2024-04-23 01:22:30,246] Trial 69 finished with value: 1420.311467174776 and parameters: {'model_name': 'SimpleImputer', 'strategy': 'most_frequent'}. Best is trial 0 with value: 800.7415124315072.
[I 2024-04-23 01:22:30,521] Trial 82 finished with value: 1420.311467174776 and parameters: {'model_name': 'SimpleImputer', 'strategy': 'most_frequent'}. Best is trial 0 with value: 800.7415124315072.
[I 2024-04-23 01:22:30,737] Trial 56 finished with value: 1420.311467174776 and parameters: {'model_name': 'SimpleImputer', 'strategy': 'most_frequent'}. Best is trial 0 with value: 800.7415124315072.
[I 2024-04-23 01:22:31,035] Trial 67 finished with value: 1420.311467174776 and parameters: {'model_name': 'SimpleImputer', 'strategy': 'most_frequent'}. Best is trial 0 with value: 800.7415124315072.
[I 2024-04-23 01:22:31,313] Trial 77 finished with value: 1420.311467174776 and parameters: {'model_name': 'SimpleImputer', 'strategy': 'most_frequent'}. Best is trial 0 with value: 800.7415124315072.
[I 2024-04-23 01:22:31,571] Trial 68 finished with value: 1420.311467174776 and parameters: {'model_name': 'SimpleImputer', 'strategy': 'most_frequent'}. Best is trial 0 with value: 800.7415124315072.
[I 2024-04-23 01:22:31,824] Trial 58 finished with value: 1420.311467174776 and parameters: {'model_name': 'SimpleImputer', 'strategy': 'most_frequent'}. Best is trial 0 with value: 800.7415124315072.
[I 2024-04-23 01:22:32,035] Trial 61 finished with value: 1420.311467174776 and parameters: {'model_name': 'SimpleImputer', 'strategy': 'most_frequent'}. Best is trial 0 with value: 800.7415124315072.
[I 2024-04-23 01:22:32,272] Trial 64 finished with value: 1420.311467174776 and parameters: {'model_name': 'SimpleImputer', 'strategy': 'most_frequent'}. Best is trial 0 with value: 800.7415124315072.
[I 2024-04-23 01:22:32,551] Trial 83 finished with value: 1420.311467174776 and parameters: {'model_name': 'SimpleImputer', 'strategy': 'most_frequent'}. Best is trial 0 with value: 800.7415124315072.
[I 2024-04-23 01:22:32,784] Trial 81 finished with value: 1420.311467174776 and parameters: {'model_name': 'SimpleImputer', 'strategy': 'most_frequent'}. Best is trial 0 with value: 800.7415124315072.
[I 2024-04-23 01:22:33,082] Trial 57 finished with value: 1420.311467174776 and parameters: {'model_name': 'SimpleImputer', 'strategy': 'most_frequent'}. Best is trial 0 with value: 800.7415124315072.
[I 2024-04-23 01:22:33,357] Trial 84 finished with value: 1420.311467174776 and parameters: {'model_name': 'SimpleImputer', 'strategy': 'most_frequent'}. Best is trial 0 with value: 800.7415124315072.
[I 2024-04-23 01:22:33,547] Trial 59 finished with value: 1420.311467174776 and parameters: {'model_name': 'SimpleImputer', 'strategy': 'most_frequent'}. Best is trial 0 with value: 800.7415124315072.
[I 2024-04-23 01:22:33,819] Trial 103 finished with value: 800.7415124315072 and parameters: {'model_name': 'SimpleImputer', 'strategy': 'mean'}. Best is trial 0 with value: 800.7415124315072.
[I 2024-04-23 01:22:34,119] Trial 100 finished with value: 800.7415124315072 and parameters: {'model_name': 'SimpleImputer', 'strategy': 'mean'}. Best is trial 0 with value: 800.7415124315072.
[I 2024-04-23 01:22:34,361] Trial 80 finished with value: 1420.311467174776 and parameters: {'model_name': 'SimpleImputer', 'strategy': 'most_frequent'}. Best is trial 0 with value: 800.7415124315072.
[I 2024-04-23 01:22:34,760] Trial 101 finished with value: 800.7415124315072 and parameters: {'model_name': 'SimpleImputer', 'strategy': 'mean'}. Best is trial 0 with value: 800.7415124315072.
[I 2024-04-23 01:22:35,035] Trial 104 finished with value: 800.7415124315072 and parameters: {'model_name': 'SimpleImputer', 'strategy': 'mean'}. Best is trial 0 with value: 800.7415124315072.
[I 2024-04-23 01:22:35,260] Trial 72 finished with value: 1420.311467174776 and parameters: {'model_name': 'SimpleImputer', 'strategy': 'most_frequent'}. Best is trial 0 with value: 800.7415124315072.
[I 2024-04-23 01:22:35,509] Trial 86 finished with value: 1420.311467174776 and parameters: {'model_name': 'SimpleImputer', 'strategy': 'most_frequent'}. Best is trial 0 with value: 800.7415124315072.
[I 2024-04-23 01:22:35,723] Trial 106 finished with value: 800.7415124315072 and parameters: {'model_name': 'SimpleImputer', 'strategy': 'mean'}. Best is trial 0 with value: 800.7415124315072.
[I 2024-04-23 01:22:35,972] Trial 70 finished with value: 1420.311467174776 and parameters: {'model_name': 'SimpleImputer', 'strategy': 'most_frequent'}. Best is trial 0 with value: 800.7415124315072.
[I 2024-04-23 01:22:36,161] Trial 78 finished with value: 1420.311467174776 and parameters: {'model_name': 'SimpleImputer', 'strategy': 'most_frequent'}. Best is trial 0 with value: 800.7415124315072.
[I 2024-04-23 01:22:36,425] Trial 105 finished with value: 800.7415124315072 and parameters: {'model_name': 'SimpleImputer', 'strategy': 'mean'}. Best is trial 0 with value: 800.7415124315072.
[I 2024-04-23 01:22:36,678] Trial 71 finished with value: 1420.311467174776 and parameters: {'model_name': 'SimpleImputer', 'strategy': 'most_frequent'}. Best is trial 0 with value: 800.7415124315072.
[I 2024-04-23 01:22:36,896] Trial 87 finished with value: 1420.311467174776 and parameters: {'model_name': 'SimpleImputer', 'strategy': 'most_frequent'}. Best is trial 0 with value: 800.7415124315072.
[I 2024-04-23 01:22:37,183] Trial 94 finished with value: 1420.311467174776 and parameters: {'model_name': 'SimpleImputer', 'strategy': 'most_frequent'}. Best is trial 0 with value: 800.7415124315072.
[I 2024-04-23 01:22:37,467] Trial 108 finished with value: 800.7415124315072 and parameters: {'model_name': 'SimpleImputer', 'strategy': 'mean'}. Best is trial 0 with value: 800.7415124315072.
[I 2024-04-23 01:22:37,657] Trial 73 finished with value: 1420.311467174776 and parameters: {'model_name': 'SimpleImputer', 'strategy': 'most_frequent'}. Best is trial 0 with value: 800.7415124315072.
[I 2024-04-23 01:22:37,827] Trial 102 finished with value: 800.7415124315072 and parameters: {'model_name': 'SimpleImputer', 'strategy': 'mean'}. Best is trial 0 with value: 800.7415124315072.
[I 2024-04-23 01:22:38,058] Trial 111 finished with value: 800.7415124315072 and parameters: {'model_name': 'SimpleImputer', 'strategy': 'mean'}. Best is trial 0 with value: 800.7415124315072.
