[I 2024-03-01 10:35:37,583] Trial 14 finished with value: 5.550293052235664 and parameters: {'model_name': 'SimpleImputer', 'strategy': 'mean'}. Best is trial 14 with value: 5.550293052235664.
[I 2024-03-01 10:35:39,712] Trial 17 finished with value: 5.550293052235664 and parameters: {'model_name': 'SimpleImputer', 'strategy': 'mean'}. Best is trial 14 with value: 5.550293052235664.
[I 2024-03-01 10:35:40,516] Trial 26 finished with value: 6.148972038878128 and parameters: {'model_name': 'SimpleImputer', 'strategy': 'constant'}. Best is trial 14 with value: 5.550293052235664.
[I 2024-03-01 10:35:41,706] Trial 37 finished with value: 5.550293052235664 and parameters: {'model_name': 'SimpleImputer', 'strategy': 'mean'}. Best is trial 14 with value: 5.550293052235664.
[I 2024-03-01 10:35:42,366] Trial 39 finished with value: 5.550293052235664 and parameters: {'model_name': 'SimpleImputer', 'strategy': 'mean'}. Best is trial 14 with value: 5.550293052235664.
[I 2024-03-01 10:35:44,089] Trial 22 finished with value: 6.148972038878128 and parameters: {'model_name': 'SimpleImputer', 'strategy': 'median'}. Best is trial 14 with value: 5.550293052235664.
[I 2024-03-01 10:35:46,103] Trial 49 finished with value: 6.148972038878128 and parameters: {'model_name': 'SimpleImputer', 'strategy': 'constant'}. Best is trial 14 with value: 5.550293052235664.
2024-03-01 10:35:51.384510: E external/local_xla/xla/stream_executor/cuda/cuda_driver.cc:274] failed call to cuInit: CUDA_ERROR_NO_DEVICE: no CUDA-capable device is detected
2024-03-01 10:35:51.588139: I tensorflow/compiler/mlir/mlir_graph_optimization_pass.cc:388] MLIR V1 optimization pass is not enabled
[I 2024-03-01 10:35:54,549] Trial 36 finished with value: 6.148972038878128 and parameters: {'model_name': 'SimpleImputer', 'strategy': 'most_frequent'}. Best is trial 14 with value: 5.550293052235664.
[I 2024-03-01 10:35:55,610] Trial 35 finished with value: 6.148972038878128 and parameters: {'model_name': 'SimpleImputer', 'strategy': 'most_frequent'}. Best is trial 14 with value: 5.550293052235664.
[I 2024-03-01 10:35:57,686] Trial 44 finished with value: 6.148972038878128 and parameters: {'model_name': 'SimpleImputer', 'strategy': 'most_frequent'}. Best is trial 14 with value: 5.550293052235664.
[I 2024-03-01 10:36:14,223] Trial 5 finished with value: 5.521316918510751 and parameters: {'model_name': 'KNNImputer', 'weights': 'uniform', 'keep_empty_features': False}. Best is trial 5 with value: 5.521316918510751.
[I 2024-03-01 10:36:15,073] Trial 11 finished with value: 5.521316918510751 and parameters: {'model_name': 'KNNImputer', 'weights': 'uniform', 'keep_empty_features': False}. Best is trial 5 with value: 5.521316918510751.
[I 2024-03-01 10:36:16,231] Trial 8 finished with value: 5.521316918510751 and parameters: {'model_name': 'KNNImputer', 'weights': 'uniform', 'keep_empty_features': False}. Best is trial 5 with value: 5.521316918510751.
[I 2024-03-01 10:36:17,682] Trial 1 finished with value: 5.532332287045605 and parameters: {'model_name': 'KNNImputer', 'weights': 'distance', 'keep_empty_features': False}. Best is trial 5 with value: 5.521316918510751.
[I 2024-03-01 10:36:18,533] Trial 4 finished with value: 5.521316918510751 and parameters: {'model_name': 'KNNImputer', 'weights': 'uniform', 'keep_empty_features': False}. Best is trial 5 with value: 5.521316918510751.
[I 2024-03-01 10:36:18,546] Trial 13 finished with value: 5.521316918510751 and parameters: {'model_name': 'KNNImputer', 'weights': 'uniform', 'keep_empty_features': False}. Best is trial 5 with value: 5.521316918510751.
[I 2024-03-01 10:36:19,676] Trial 25 finished with value: 5.521316918510751 and parameters: {'model_name': 'KNNImputer', 'weights': 'uniform', 'keep_empty_features': False}. Best is trial 5 with value: 5.521316918510751.
[I 2024-03-01 10:36:20,421] Trial 32 finished with value: 5.521316918510751 and parameters: {'model_name': 'KNNImputer', 'weights': 'uniform', 'keep_empty_features': False}. Best is trial 5 with value: 5.521316918510751.
[I 2024-03-01 10:36:21,155] Trial 27 finished with value: 5.532332287045605 and parameters: {'model_name': 'KNNImputer', 'weights': 'distance', 'keep_empty_features': False}. Best is trial 5 with value: 5.521316918510751.
[I 2024-03-01 10:36:22,884] Trial 19 finished with value: 5.532332287045605 and parameters: {'model_name': 'KNNImputer', 'weights': 'distance', 'keep_empty_features': False}. Best is trial 5 with value: 5.521316918510751.
[I 2024-03-01 10:36:28,687] Trial 54 finished with value: 5.532332287045605 and parameters: {'model_name': 'KNNImputer', 'weights': 'distance', 'keep_empty_features': False}. Best is trial 5 with value: 5.521316918510751.
[I 2024-03-01 10:36:33,459] Trial 38 finished with value: 5.550293052235664 and parameters: {'model_name': 'RandomForestImputer', 'max_iter': 1, 'decreasing': True, 'min_samples_split': 0.7000000000000001, 'min_samples_leaf': 0.8, 'max_features': 0.6, 'warm_start': True}. Best is trial 5 with value: 5.521316918510751.
[I 2024-03-01 10:36:46,899] Trial 58 finished with value: 5.521316918510751 and parameters: {'model_name': 'KNNImputer', 'weights': 'uniform', 'keep_empty_features': False}. Best is trial 5 with value: 5.521316918510751.
[I 2024-03-01 10:36:47,838] Trial 60 finished with value: 5.521316918510751 and parameters: {'model_name': 'KNNImputer', 'weights': 'uniform', 'keep_empty_features': False}. Best is trial 5 with value: 5.521316918510751.
[I 2024-03-01 10:36:49,035] Trial 59 finished with value: 5.521316918510751 and parameters: {'model_name': 'KNNImputer', 'weights': 'uniform', 'keep_empty_features': False}. Best is trial 5 with value: 5.521316918510751.
[I 2024-03-01 10:36:51,157] Trial 61 finished with value: 5.521316918510751 and parameters: {'model_name': 'KNNImputer', 'weights': 'uniform', 'keep_empty_features': False}. Best is trial 5 with value: 5.521316918510751.
[I 2024-03-01 10:36:54,757] Trial 62 finished with value: 5.550293052235664 and parameters: {'model_name': 'RandomForestImputer', 'max_iter': 1, 'decreasing': True, 'min_samples_split': 0.8, 'min_samples_leaf': 0.4, 'max_features': 0.8, 'warm_start': True}. Best is trial 5 with value: 5.521316918510751.
[I 2024-03-01 10:37:20,871] Trial 12 finished with value: 5.935033837754042 and parameters: {'model_name': 'RandomForestImputer', 'max_iter': 2, 'decreasing': True, 'min_samples_split': 0.1, 'min_samples_leaf': 0.1, 'max_features': 0.4, 'warm_start': True}. Best is trial 5 with value: 5.521316918510751.
[I 2024-03-01 10:37:21,752] Trial 9 finished with value: 6.08639249939486 and parameters: {'model_name': 'RandomForestImputer', 'max_iter': 2, 'decreasing': False, 'min_samples_split': 0.5, 'min_samples_leaf': 0.6, 'max_features': 0.8, 'warm_start': True}. Best is trial 5 with value: 5.521316918510751.
[I 2024-03-01 10:37:22,576] Trial 34 finished with value: 6.088363781498801 and parameters: {'model_name': 'RandomForestImputer', 'max_iter': 2, 'decreasing': False, 'min_samples_split': 0.7000000000000001, 'min_samples_leaf': 0.5, 'max_features': 0.5, 'warm_start': True}. Best is trial 5 with value: 5.521316918510751.
[I 2024-03-01 10:37:42,611] Trial 55 finished with value: 2.690465059353148 and parameters: {'model_name': 'GAIN', 'batch_size': 619, 'hint_rate': 0.4, 'alpha': 39, 'iterations': 2}. Best is trial 55 with value: 2.690465059353148.
[I 2024-03-01 10:37:43,440] Trial 48 finished with value: 2.2837654513333328 and parameters: {'model_name': 'GAIN', 'batch_size': 28, 'hint_rate': 0.5700000000000001, 'alpha': 30, 'iterations': 2}. Best is trial 48 with value: 2.2837654513333328.
[I 2024-03-01 10:37:56,869] Trial 7 finished with value: 5.936150456478632 and parameters: {'model_name': 'RandomForestImputer', 'max_iter': 4, 'decreasing': True, 'min_samples_split': 0.6000000000000001, 'min_samples_leaf': 0.4, 'max_features': 0.6, 'warm_start': True}. Best is trial 48 with value: 2.2837654513333328.
[I 2024-03-01 10:37:58,120] Trial 50 finished with value: 3.6703234170235057 and parameters: {'model_name': 'GAIN', 'batch_size': 4, 'hint_rate': 0.06999999999999999, 'alpha': 86, 'iterations': 10}. Best is trial 48 with value: 2.2837654513333328.
[I 2024-03-01 10:38:02,907] Trial 56 finished with value: 5.563048479728963 and parameters: {'model_name': 'IterativeImputer', 'sample_posterior': False, 'initial_strategy': 'mean', 'imputation_order': 'arabic'}. Best is trial 48 with value: 2.2837654513333328.
[I 2024-03-01 10:38:09,879] Trial 63 finished with value: 2.5381625377334873 and parameters: {'model_name': 'GAIN', 'batch_size': 621, 'hint_rate': 0.51, 'alpha': 37, 'iterations': 6}. Best is trial 48 with value: 2.2837654513333328.
[I 2024-03-01 10:38:25,299] Trial 70 finished with value: 3.094184058292467 and parameters: {'model_name': 'GAIN', 'batch_size': 297, 'hint_rate': 0.9500000000000001, 'alpha': 75, 'iterations': 7}. Best is trial 48 with value: 2.2837654513333328.
[I 2024-03-01 10:38:28,278] Trial 10 finished with value: 5.550293052235664 and parameters: {'model_name': 'RandomForestImputer', 'max_iter': 1, 'decreasing': False, 'min_samples_split': 1.0, 'min_samples_leaf': 0.6, 'max_features': 0.1, 'warm_start': False}. Best is trial 48 with value: 2.2837654513333328.
[I 2024-03-01 10:38:30,954] Trial 53 finished with value: 5.550293052235664 and parameters: {'model_name': 'RandomForestImputer', 'max_iter': 1, 'decreasing': False, 'min_samples_split': 0.0, 'min_samples_leaf': 0.4, 'max_features': 0.30000000000000004, 'warm_start': False}. Best is trial 48 with value: 2.2837654513333328.
[I 2024-03-01 10:38:34,191] Trial 24 finished with value: 5.934011276545386 and parameters: {'model_name': 'RandomForestImputer', 'max_iter': 8, 'decreasing': True, 'min_samples_split': 1.0, 'min_samples_leaf': 0.30000000000000004, 'max_features': 0.4, 'warm_start': True}. Best is trial 48 with value: 2.2837654513333328.
[I 2024-03-01 10:38:39,989] Trial 69 finished with value: 3.0062476279363266 and parameters: {'model_name': 'GAIN', 'batch_size': 3, 'hint_rate': 0.66, 'alpha': 25, 'iterations': 13}. Best is trial 48 with value: 2.2837654513333328.
[I 2024-03-01 10:38:47,369] Trial 6 finished with value: 5.56305223330124 and parameters: {'model_name': 'IterativeImputer', 'sample_posterior': False, 'initial_strategy': 'mean', 'imputation_order': 'ascending'}. Best is trial 48 with value: 2.2837654513333328.
[I 2024-03-01 10:38:48,750] Trial 40 finished with value: 6.0886388743518305 and parameters: {'model_name': 'RandomForestImputer', 'max_iter': 6, 'decreasing': False, 'min_samples_split': 0.1, 'min_samples_leaf': 0.1, 'max_features': 0.4, 'warm_start': True}. Best is trial 48 with value: 2.2837654513333328.
[I 2024-03-01 10:38:50,953] Trial 76 finished with value: 2.4480667981455553 and parameters: {'model_name': 'GAIN', 'batch_size': 841, 'hint_rate': 0.72, 'alpha': 31, 'iterations': 4}. Best is trial 48 with value: 2.2837654513333328.
[I 2024-03-01 10:39:02,741] Trial 45 finished with value: 5.563047800942061 and parameters: {'model_name': 'IterativeImputer', 'sample_posterior': False, 'initial_strategy': 'median', 'imputation_order': 'random'}. Best is trial 48 with value: 2.2837654513333328.
[I 2024-03-01 10:39:20,166] Trial 80 finished with value: 2.595880888683369 and parameters: {'model_name': 'GAIN', 'batch_size': 372, 'hint_rate': 0.51, 'alpha': 34, 'iterations': 1}. Best is trial 48 with value: 2.2837654513333328.
[I 2024-03-01 10:39:24,163] Trial 79 finished with value: 2.377169395227367 and parameters: {'model_name': 'GAIN', 'batch_size': 271, 'hint_rate': 0.49, 'alpha': 31, 'iterations': 1}. Best is trial 48 with value: 2.2837654513333328.
[I 2024-03-01 10:39:25,681] Trial 78 finished with value: 2.838216597447416 and parameters: {'model_name': 'GAIN', 'batch_size': 700, 'hint_rate': 0.38, 'alpha': 38, 'iterations': 1}. Best is trial 48 with value: 2.2837654513333328.
[I 2024-03-01 10:39:30,097] Trial 82 finished with value: 2.2899597685574156 and parameters: {'model_name': 'GAIN', 'batch_size': 17, 'hint_rate': 0.47000000000000003, 'alpha': 37, 'iterations': 2}. Best is trial 48 with value: 2.2837654513333328.
[I 2024-03-01 10:39:35,874] Trial 18 finished with value: 5.936537685036697 and parameters: {'model_name': 'RandomForestImputer', 'max_iter': 13, 'decreasing': True, 'min_samples_split': 0.2, 'min_samples_leaf': 0.4, 'max_features': 0.2, 'warm_start': True}. Best is trial 48 with value: 2.2837654513333328.
[I 2024-03-01 10:39:44,231] Trial 81 finished with value: 2.628585554363034 and parameters: {'model_name': 'GAIN', 'batch_size': 19, 'hint_rate': 0.48000000000000004, 'alpha': 37, 'iterations': 2}. Best is trial 48 with value: 2.2837654513333328.
[I 2024-03-01 10:39:53,067] Trial 85 finished with value: 3.1517795330524807 and parameters: {'model_name': 'GAIN', 'batch_size': 688, 'hint_rate': 0.54, 'alpha': 30, 'iterations': 2}. Best is trial 48 with value: 2.2837654513333328.
[I 2024-03-01 10:39:56,837] Trial 83 finished with value: 2.6233512865639366 and parameters: {'model_name': 'GAIN', 'batch_size': 558, 'hint_rate': 0.5, 'alpha': 38, 'iterations': 3}. Best is trial 48 with value: 2.2837654513333328.
[I 2024-03-01 10:40:01,304] Trial 87 finished with value: 3.1950640852803 and parameters: {'model_name': 'GAIN', 'batch_size': 648, 'hint_rate': 0.53, 'alpha': 32, 'iterations': 2}. Best is trial 48 with value: 2.2837654513333328.
[I 2024-03-01 10:40:03,065] Trial 86 finished with value: 3.0931342864373144 and parameters: {'model_name': 'GAIN', 'batch_size': 678, 'hint_rate': 0.55, 'alpha': 31, 'iterations': 2}. Best is trial 48 with value: 2.2837654513333328.
[I 2024-03-01 10:40:07,713] Trial 75 finished with value: 5.563053099840363 and parameters: {'model_name': 'IterativeImputer', 'sample_posterior': False, 'initial_strategy': 'most_frequent', 'imputation_order': 'roman'}. Best is trial 48 with value: 2.2837654513333328.
[I 2024-03-01 10:40:17,110] Trial 84 finished with value: 2.620706677827819 and parameters: {'model_name': 'GAIN', 'batch_size': 586, 'hint_rate': 0.54, 'alpha': 29, 'iterations': 3}. Best is trial 48 with value: 2.2837654513333328.
[I 2024-03-01 10:40:20,743] Trial 64 finished with value: 2.5392903168143595 and parameters: {'model_name': 'GAIN', 'batch_size': 744, 'hint_rate': 0.6900000000000001, 'alpha': 65, 'iterations': 34}. Best is trial 48 with value: 2.2837654513333328.
[I 2024-03-01 10:40:24,809] Trial 89 finished with value: 2.807615595087282 and parameters: {'model_name': 'GAIN', 'batch_size': 633, 'hint_rate': 0.56, 'alpha': 30, 'iterations': 3}. Best is trial 48 with value: 2.2837654513333328.
[I 2024-03-01 10:40:29,582] Trial 90 finished with value: 3.205531039014821 and parameters: {'model_name': 'GAIN', 'batch_size': 722, 'hint_rate': 0.5800000000000001, 'alpha': 34, 'iterations': 4}. Best is trial 48 with value: 2.2837654513333328.
[I 2024-03-01 10:40:32,996] Trial 88 finished with value: 2.7638040766070398 and parameters: {'model_name': 'GAIN', 'batch_size': 722, 'hint_rate': 0.5800000000000001, 'alpha': 27, 'iterations': 3}. Best is trial 48 with value: 2.2837654513333328.
[I 2024-03-01 10:40:36,323] Trial 92 finished with value: 2.5092165536912057 and parameters: {'model_name': 'GAIN', 'batch_size': 923, 'hint_rate': 0.5700000000000001, 'alpha': 26, 'iterations': 3}. Best is trial 48 with value: 2.2837654513333328.
[I 2024-03-01 10:40:46,427] Trial 91 finished with value: 3.4003500754668132 and parameters: {'model_name': 'GAIN', 'batch_size': 755, 'hint_rate': 0.5800000000000001, 'alpha': 25, 'iterations': 3}. Best is trial 48 with value: 2.2837654513333328.
[I 2024-03-01 10:40:55,238] Trial 93 finished with value: 2.6838501255670404 and parameters: {'model_name': 'GAIN', 'batch_size': 623, 'hint_rate': 0.49, 'alpha': 32, 'iterations': 1}. Best is trial 48 with value: 2.2837654513333328.
[I 2024-03-01 10:41:12,792] Trial 95 finished with value: 3.3236201411133934 and parameters: {'model_name': 'GAIN', 'batch_size': 242, 'hint_rate': 0.59, 'alpha': 25, 'iterations': 1}. Best is trial 48 with value: 2.2837654513333328.
[I 2024-03-01 10:41:14,673] Trial 94 finished with value: 2.5514811065456726 and parameters: {'model_name': 'GAIN', 'batch_size': 546, 'hint_rate': 0.53, 'alpha': 31, 'iterations': 1}. Best is trial 48 with value: 2.2837654513333328.
[I 2024-03-01 10:41:19,417] Trial 99 finished with value: 2.604609842180684 and parameters: {'model_name': 'GAIN', 'batch_size': 139, 'hint_rate': 0.61, 'alpha': 13, 'iterations': 1}. Best is trial 48 with value: 2.2837654513333328.
[I 2024-03-01 10:41:25,771] Trial 98 finished with value: 2.5766663126802105 and parameters: {'model_name': 'GAIN', 'batch_size': 307, 'hint_rate': 0.59, 'alpha': 24, 'iterations': 1}. Best is trial 48 with value: 2.2837654513333328.
[I 2024-03-01 10:41:31,706] Trial 31 finished with value: 6.089080519026041 and parameters: {'model_name': 'RandomForestImputer', 'max_iter': 29, 'decreasing': False, 'min_samples_split': 0.7000000000000001, 'min_samples_leaf': 0.8, 'max_features': 0.8, 'warm_start': True}. Best is trial 48 with value: 2.2837654513333328.
[I 2024-03-01 10:41:33,188] Trial 100 finished with value: 2.60355070514139 and parameters: {'model_name': 'GAIN', 'batch_size': 106, 'hint_rate': 0.7000000000000001, 'alpha': 18, 'iterations': 1}. Best is trial 48 with value: 2.2837654513333328.
[I 2024-03-01 10:41:55,837] Trial 67 finished with value: 5.558317047189363 and parameters: {'model_name': 'RandomForestImputer', 'max_iter': 2, 'decreasing': False, 'min_samples_split': 0.9, 'min_samples_leaf': 0.7000000000000001, 'max_features': 0.4, 'warm_start': False}. Best is trial 48 with value: 2.2837654513333328.
[I 2024-03-01 10:43:03,554] Trial 111 finished with value: 3.4253469381606143 and parameters: {'model_name': 'GAIN', 'batch_size': 186, 'hint_rate': 0.73, 'alpha': 9, 'iterations': 17}. Best is trial 48 with value: 2.2837654513333328.
[I 2024-03-01 10:43:11,573] Trial 114 finished with value: 3.17996358006268 and parameters: {'model_name': 'GAIN', 'batch_size': 195, 'hint_rate': 0.72, 'alpha': 51, 'iterations': 15}. Best is trial 48 with value: 2.2837654513333328.
[I 2024-03-01 10:43:24,406] Trial 118 finished with value: 2.519696077183089 and parameters: {'model_name': 'GAIN', 'batch_size': 16, 'hint_rate': 0.81, 'alpha': 50, 'iterations': 16}. Best is trial 48 with value: 2.2837654513333328.
[I 2024-03-01 10:43:28,342] Trial 105 finished with value: 2.7115947986170816 and parameters: {'model_name': 'GAIN', 'batch_size': 147, 'hint_rate': 0.73, 'alpha': 10, 'iterations': 36}. Best is trial 48 with value: 2.2837654513333328.
[I 2024-03-01 10:43:30,900] Trial 107 finished with value: 2.8580943111489394 and parameters: {'model_name': 'GAIN', 'batch_size': 160, 'hint_rate': 0.74, 'alpha': 8, 'iterations': 33}. Best is trial 48 with value: 2.2837654513333328.
[I 2024-03-01 10:43:35,470] Trial 113 finished with value: 2.504566486472084 and parameters: {'model_name': 'GAIN', 'batch_size': 194, 'hint_rate': 0.75, 'alpha': 9, 'iterations': 21}. Best is trial 48 with value: 2.2837654513333328.
[I 2024-03-01 10:43:48,575] Trial 116 finished with value: 3.003545852009254 and parameters: {'model_name': 'GAIN', 'batch_size': 108, 'hint_rate': 0.72, 'alpha': 53, 'iterations': 28}. Best is trial 48 with value: 2.2837654513333328.
[I 2024-03-01 10:43:57,706] Trial 112 finished with value: 2.741865503266954 and parameters: {'model_name': 'GAIN', 'batch_size': 161, 'hint_rate': 0.74, 'alpha': 5, 'iterations': 26}. Best is trial 48 with value: 2.2837654513333328.
[I 2024-03-01 10:44:03,888] Trial 68 finished with value: 5.557917436835061 and parameters: {'model_name': 'RandomForestImputer', 'max_iter': 4, 'decreasing': False, 'min_samples_split': 0.5, 'min_samples_leaf': 0.4, 'max_features': 0.6, 'warm_start': False}. Best is trial 48 with value: 2.2837654513333328.
[I 2024-03-01 10:44:09,343] Trial 115 finished with value: 2.8274960016089388 and parameters: {'model_name': 'GAIN', 'batch_size': 131, 'hint_rate': 0.73, 'alpha': 61, 'iterations': 23}. Best is trial 48 with value: 2.2837654513333328.
[I 2024-03-01 10:44:11,404] Trial 108 finished with value: 3.2832747089935284 and parameters: {'model_name': 'GAIN', 'batch_size': 184, 'hint_rate': 0.73, 'alpha': 57, 'iterations': 40}. Best is trial 48 with value: 2.2837654513333328.
[I 2024-03-01 10:44:17,127] Trial 109 finished with value: 3.5429182211924433 and parameters: {'model_name': 'GAIN', 'batch_size': 188, 'hint_rate': 0.72, 'alpha': 9, 'iterations': 45}. Best is trial 48 with value: 2.2837654513333328.
[I 2024-03-01 10:44:23,300] Trial 117 finished with value: 3.006053435446751 and parameters: {'model_name': 'GAIN', 'batch_size': 24, 'hint_rate': 0.76, 'alpha': 50, 'iterations': 26}. Best is trial 48 with value: 2.2837654513333328.
[I 2024-03-01 10:44:31,080] Trial 104 finished with value: 3.303358828422149 and parameters: {'model_name': 'GAIN', 'batch_size': 139, 'hint_rate': 0.7100000000000001, 'alpha': 11, 'iterations': 49}. Best is trial 48 with value: 2.2837654513333328.
[I 2024-03-01 10:44:55,944] Trial 103 finished with value: 3.3685707231708713 and parameters: {'model_name': 'GAIN', 'batch_size': 149, 'hint_rate': 0.67, 'alpha': 9, 'iterations': 65}. Best is trial 48 with value: 2.2837654513333328.
[I 2024-03-01 10:44:59,210] Trial 47 finished with value: 5.541384790668992 and parameters: {'model_name': 'RandomForestImputer', 'max_iter': 4, 'decreasing': True, 'min_samples_split': 1.0, 'min_samples_leaf': 0.4, 'max_features': 0.30000000000000004, 'warm_start': False}. Best is trial 48 with value: 2.2837654513333328.
[I 2024-03-01 10:45:05,388] Trial 110 finished with value: 3.707472575806372 and parameters: {'model_name': 'GAIN', 'batch_size': 217, 'hint_rate': 0.72, 'alpha': 13, 'iterations': 48}. Best is trial 48 with value: 2.2837654513333328.
