[I 2024-02-27 20:05:58,250] Trial 7 finished with value: 0.8331656159922487 and parameters: {'model_name': 'SimpleImputer', 'strategy': 'constant'}. Best is trial 7 with value: 0.8331656159922487.
[I 2024-02-27 20:05:59,032] Trial 3 finished with value: 0.8331656159922487 and parameters: {'model_name': 'SimpleImputer', 'strategy': 'constant'}. Best is trial 7 with value: 0.8331656159922487.
[I 2024-02-27 20:06:00,517] Trial 18 finished with value: 0.8331751761172604 and parameters: {'model_name': 'SimpleImputer', 'strategy': 'mean'}. Best is trial 7 with value: 0.8331656159922487.
[I 2024-02-27 20:06:02,400] Trial 24 finished with value: 0.8331751761172604 and parameters: {'model_name': 'SimpleImputer', 'strategy': 'mean'}. Best is trial 7 with value: 0.8331656159922487.
[I 2024-02-27 20:06:03,128] Trial 6 finished with value: 0.8331656159922487 and parameters: {'model_name': 'SimpleImputer', 'strategy': 'median'}. Best is trial 7 with value: 0.8331656159922487.
[I 2024-02-27 20:06:05,254] Trial 44 finished with value: 0.8331751761172604 and parameters: {'model_name': 'SimpleImputer', 'strategy': 'mean'}. Best is trial 7 with value: 0.8331656159922487.
[I 2024-02-27 20:06:09,577] Trial 50 finished with value: 0.8331751761172604 and parameters: {'model_name': 'SimpleImputer', 'strategy': 'mean'}. Best is trial 7 with value: 0.8331656159922487.
2024-02-27 20:06:15.290989: E external/local_xla/xla/stream_executor/cuda/cuda_driver.cc:274] failed call to cuInit: CUDA_ERROR_NO_DEVICE: no CUDA-capable device is detected
2024-02-27 20:06:15.875810: I tensorflow/compiler/mlir/mlir_graph_optimization_pass.cc:388] MLIR V1 optimization pass is not enabled
[I 2024-02-27 20:06:19,487] Trial 36 finished with value: 0.8893017234080496 and parameters: {'model_name': 'SimpleImputer', 'strategy': 'most_frequent'}. Best is trial 7 with value: 0.8331656159922487.
[I 2024-02-27 20:07:04,843] Trial 5 finished with value: 0.8331751761172604 and parameters: {'model_name': 'RandomForestImputer', 'max_iter': 1, 'decreasing': True, 'min_samples_split': 0.8, 'min_samples_leaf': 0.1, 'max_features': 0.6, 'warm_start': True}. Best is trial 7 with value: 0.8331656159922487.
[I 2024-02-27 20:07:30,892] Trial 12 finished with value: 0.9144053781474852 and parameters: {'model_name': 'KNNImputer', 'weights': 'uniform', 'keep_empty_features': False}. Best is trial 7 with value: 0.8331656159922487.
[I 2024-02-27 20:07:32,512] Trial 14 finished with value: 0.9144053781474852 and parameters: {'model_name': 'KNNImputer', 'weights': 'uniform', 'keep_empty_features': False}. Best is trial 7 with value: 0.8331656159922487.
[I 2024-02-27 20:07:33,943] Trial 1 finished with value: 0.9144053781474852 and parameters: {'model_name': 'KNNImputer', 'weights': 'uniform', 'keep_empty_features': False}. Best is trial 7 with value: 0.8331656159922487.
[I 2024-02-27 20:07:35,377] Trial 46 finished with value: 0.9144053781474852 and parameters: {'model_name': 'KNNImputer', 'weights': 'uniform', 'keep_empty_features': False}. Best is trial 7 with value: 0.8331656159922487.
[I 2024-02-27 20:07:38,195] Trial 25 finished with value: 0.9380700676355993 and parameters: {'model_name': 'KNNImputer', 'weights': 'distance', 'keep_empty_features': False}. Best is trial 7 with value: 0.8331656159922487.
[I 2024-02-27 20:07:40,019] Trial 42 finished with value: 0.9380700676355993 and parameters: {'model_name': 'KNNImputer', 'weights': 'distance', 'keep_empty_features': False}. Best is trial 7 with value: 0.8331656159922487.
[I 2024-02-27 20:07:41,114] Trial 38 finished with value: 0.9144053781474852 and parameters: {'model_name': 'KNNImputer', 'weights': 'uniform', 'keep_empty_features': False}. Best is trial 7 with value: 0.8331656159922487.
[I 2024-02-27 20:07:41,890] Trial 48 finished with value: 0.9144053781474852 and parameters: {'model_name': 'KNNImputer', 'weights': 'uniform', 'keep_empty_features': False}. Best is trial 7 with value: 0.8331656159922487.
[I 2024-02-27 20:07:42,573] Trial 39 finished with value: 0.9144053781474852 and parameters: {'model_name': 'KNNImputer', 'weights': 'uniform', 'keep_empty_features': False}. Best is trial 7 with value: 0.8331656159922487.
[I 2024-02-27 20:07:43,209] Trial 11 finished with value: 0.9380700676355993 and parameters: {'model_name': 'KNNImputer', 'weights': 'distance', 'keep_empty_features': False}. Best is trial 7 with value: 0.8331656159922487.
[I 2024-02-27 20:07:47,451] Trial 51 finished with value: 0.9380700676355993 and parameters: {'model_name': 'KNNImputer', 'weights': 'distance', 'keep_empty_features': False}. Best is trial 7 with value: 0.8331656159922487.
[I 2024-02-27 20:07:54,359] Trial 55 finished with value: 0.9144053781474852 and parameters: {'model_name': 'KNNImputer', 'weights': 'uniform', 'keep_empty_features': False}. Best is trial 7 with value: 0.8331656159922487.
[I 2024-02-27 20:08:33,539] Trial 37 finished with value: 0.8332146313969592 and parameters: {'model_name': 'IterativeImputer', 'sample_posterior': False, 'initial_strategy': 'most_frequent', 'imputation_order': 'roman'}. Best is trial 7 with value: 0.8331656159922487.
[I 2024-02-27 20:08:36,563] Trial 29 finished with value: 0.8332146325849109 and parameters: {'model_name': 'IterativeImputer', 'sample_posterior': False, 'initial_strategy': 'median', 'imputation_order': 'ascending'}. Best is trial 7 with value: 0.8331656159922487.
[I 2024-02-27 20:08:42,709] Trial 8 finished with value: 0.8332146368639574 and parameters: {'model_name': 'IterativeImputer', 'sample_posterior': False, 'initial_strategy': 'mean', 'imputation_order': 'arabic'}. Best is trial 7 with value: 0.8331656159922487.
[I 2024-02-27 20:08:43,452] Trial 27 finished with value: 0.8332146046447312 and parameters: {'model_name': 'IterativeImputer', 'sample_posterior': False, 'initial_strategy': 'constant', 'imputation_order': 'random'}. Best is trial 7 with value: 0.8331656159922487.
[I 2024-02-27 20:08:44,229] Trial 4 finished with value: 0.8332146368639574 and parameters: {'model_name': 'IterativeImputer', 'sample_posterior': False, 'initial_strategy': 'mean', 'imputation_order': 'arabic'}. Best is trial 7 with value: 0.8331656159922487.
[I 2024-02-27 20:08:45,639] Trial 21 finished with value: 0.8332146311391174 and parameters: {'model_name': 'IterativeImputer', 'sample_posterior': False, 'initial_strategy': 'mean', 'imputation_order': 'descending'}. Best is trial 7 with value: 0.8331656159922487.
[I 2024-02-27 20:08:46,380] Trial 22 finished with value: 0.8332146368639574 and parameters: {'model_name': 'IterativeImputer', 'sample_posterior': False, 'initial_strategy': 'mean', 'imputation_order': 'arabic'}. Best is trial 7 with value: 0.8331656159922487.
[I 2024-02-27 20:08:48,060] Trial 45 finished with value: 0.833214630946788 and parameters: {'model_name': 'IterativeImputer', 'sample_posterior': False, 'initial_strategy': 'median', 'imputation_order': 'descending'}. Best is trial 7 with value: 0.8331656159922487.
[I 2024-02-27 20:08:50,597] Trial 28 finished with value: 0.8332146292814382 and parameters: {'model_name': 'IterativeImputer', 'sample_posterior': False, 'initial_strategy': 'mean', 'imputation_order': 'random'}. Best is trial 7 with value: 0.8331656159922487.
[I 2024-02-27 20:08:52,292] Trial 17 finished with value: 0.8332146309467966 and parameters: {'model_name': 'IterativeImputer', 'sample_posterior': False, 'initial_strategy': 'most_frequent', 'imputation_order': 'descending'}. Best is trial 7 with value: 0.8331656159922487.
[I 2024-02-27 20:09:04,588] Trial 0 finished with value: 0.8331751761172604 and parameters: {'model_name': 'RandomForestImputer', 'max_iter': 1, 'decreasing': False, 'min_samples_split': 0.5, 'min_samples_leaf': 0.30000000000000004, 'max_features': 0.1, 'warm_start': False}. Best is trial 7 with value: 0.8331656159922487.
[I 2024-02-27 20:09:08,228] Trial 60 finished with value: 0.8332146325849109 and parameters: {'model_name': 'IterativeImputer', 'sample_posterior': False, 'initial_strategy': 'median', 'imputation_order': 'ascending'}. Best is trial 7 with value: 0.8331656159922487.
[I 2024-02-27 20:09:09,844] Trial 66 finished with value: 0.9839078232975698 and parameters: {'model_name': 'GAIN', 'batch_size': 116, 'hint_rate': 0.47000000000000003, 'alpha': 55, 'iterations': 1}. Best is trial 7 with value: 0.8331656159922487.
[I 2024-02-27 20:09:11,859] Trial 78 finished with value: 0.8331751761172604 and parameters: {'model_name': 'RandomForestImputer', 'max_iter': 1, 'decreasing': True, 'min_samples_split': 0.8, 'min_samples_leaf': 0.1, 'max_features': 0.6, 'warm_start': True}. Best is trial 7 with value: 0.8331656159922487.
[I 2024-02-27 20:09:21,818] Trial 61 finished with value: 0.9159849203985356 and parameters: {'model_name': 'GAIN', 'batch_size': 42, 'hint_rate': 0.38, 'alpha': 52, 'iterations': 5}. Best is trial 7 with value: 0.8331656159922487.
[I 2024-02-27 20:09:26,237] Trial 56 finished with value: 0.8331751761172604 and parameters: {'model_name': 'RandomForestImputer', 'max_iter': 1, 'decreasing': True, 'min_samples_split': 0.1, 'min_samples_leaf': 0.30000000000000004, 'max_features': 0.8, 'warm_start': False}. Best is trial 7 with value: 0.8331656159922487.
[I 2024-02-27 20:09:28,247] Trial 84 finished with value: 0.8331656159922487 and parameters: {'model_name': 'SimpleImputer', 'strategy': 'constant'}. Best is trial 7 with value: 0.8331656159922487.
[I 2024-02-27 20:09:30,103] Trial 85 finished with value: 0.8331656159922487 and parameters: {'model_name': 'SimpleImputer', 'strategy': 'constant'}. Best is trial 7 with value: 0.8331656159922487.
[I 2024-02-27 20:09:31,916] Trial 86 finished with value: 0.8331656159922487 and parameters: {'model_name': 'SimpleImputer', 'strategy': 'constant'}. Best is trial 7 with value: 0.8331656159922487.
[I 2024-02-27 20:09:34,662] Trial 87 finished with value: 0.8331656159922487 and parameters: {'model_name': 'SimpleImputer', 'strategy': 'median'}. Best is trial 7 with value: 0.8331656159922487.
[I 2024-02-27 20:09:36,904] Trial 88 finished with value: 0.8331656159922487 and parameters: {'model_name': 'SimpleImputer', 'strategy': 'constant'}. Best is trial 7 with value: 0.8331656159922487.
[I 2024-02-27 20:09:39,036] Trial 89 finished with value: 0.8331656159922487 and parameters: {'model_name': 'SimpleImputer', 'strategy': 'constant'}. Best is trial 7 with value: 0.8331656159922487.
[I 2024-02-27 20:09:40,666] Trial 90 finished with value: 0.8331656159922487 and parameters: {'model_name': 'SimpleImputer', 'strategy': 'constant'}. Best is trial 7 with value: 0.8331656159922487.
[I 2024-02-27 20:09:42,414] Trial 91 finished with value: 0.8331656159922487 and parameters: {'model_name': 'SimpleImputer', 'strategy': 'constant'}. Best is trial 7 with value: 0.8331656159922487.
[I 2024-02-27 20:09:43,379] Trial 64 finished with value: 0.8332146387742083 and parameters: {'model_name': 'IterativeImputer', 'sample_posterior': False, 'initial_strategy': 'most_frequent', 'imputation_order': 'ascending'}. Best is trial 7 with value: 0.8331656159922487.
[I 2024-02-27 20:09:45,631] Trial 92 finished with value: 0.8331656159922487 and parameters: {'model_name': 'SimpleImputer', 'strategy': 'median'}. Best is trial 7 with value: 0.8331656159922487.
[I 2024-02-27 20:09:46,609] Trial 93 finished with value: 0.8331656159922487 and parameters: {'model_name': 'SimpleImputer', 'strategy': 'median'}. Best is trial 7 with value: 0.8331656159922487.
[I 2024-02-27 20:09:48,335] Trial 95 finished with value: 0.8331656159922487 and parameters: {'model_name': 'SimpleImputer', 'strategy': 'constant'}. Best is trial 7 with value: 0.8331656159922487.
[I 2024-02-27 20:09:49,079] Trial 94 finished with value: 0.8331656159922487 and parameters: {'model_name': 'SimpleImputer', 'strategy': 'constant'}. Best is trial 7 with value: 0.8331656159922487.
[I 2024-02-27 20:09:51,156] Trial 97 finished with value: 0.8331656159922487 and parameters: {'model_name': 'SimpleImputer', 'strategy': 'constant'}. Best is trial 7 with value: 0.8331656159922487.
[I 2024-02-27 20:09:52,240] Trial 96 finished with value: 0.8331656159922487 and parameters: {'model_name': 'SimpleImputer', 'strategy': 'constant'}. Best is trial 7 with value: 0.8331656159922487.
[I 2024-02-27 20:09:54,208] Trial 98 finished with value: 0.8331656159922487 and parameters: {'model_name': 'SimpleImputer', 'strategy': 'constant'}. Best is trial 7 with value: 0.8331656159922487.
[I 2024-02-27 20:09:55,145] Trial 99 finished with value: 0.8331656159922487 and parameters: {'model_name': 'SimpleImputer', 'strategy': 'constant'}. Best is trial 7 with value: 0.8331656159922487.
[I 2024-02-27 20:09:56,971] Trial 100 finished with value: 0.8331656159922487 and parameters: {'model_name': 'SimpleImputer', 'strategy': 'constant'}. Best is trial 7 with value: 0.8331656159922487.
[I 2024-02-27 20:09:57,756] Trial 101 finished with value: 0.8331656159922487 and parameters: {'model_name': 'SimpleImputer', 'strategy': 'constant'}. Best is trial 7 with value: 0.8331656159922487.
[I 2024-02-27 20:09:58,935] Trial 54 finished with value: 0.8335599118990169 and parameters: {'model_name': 'RandomForestImputer', 'max_iter': 12, 'decreasing': True, 'min_samples_split': 0.5, 'min_samples_leaf': 0.8, 'max_features': 0.30000000000000004, 'warm_start': True}. Best is trial 7 with value: 0.8331656159922487.
[I 2024-02-27 20:10:01,023] Trial 74 finished with value: 0.9050074743700789 and parameters: {'model_name': 'GAIN', 'batch_size': 687, 'hint_rate': 0.7000000000000001, 'alpha': 86, 'iterations': 1}. Best is trial 7 with value: 0.8331656159922487.
[I 2024-02-27 20:10:04,669] Trial 105 finished with value: 0.8893017234080496 and parameters: {'model_name': 'SimpleImputer', 'strategy': 'most_frequent'}. Best is trial 7 with value: 0.8331656159922487.
[I 2024-02-27 20:10:06,275] Trial 72 finished with value: 0.9866406143365948 and parameters: {'model_name': 'GAIN', 'batch_size': 1, 'hint_rate': 0.9400000000000001, 'alpha': 38, 'iterations': 2}. Best is trial 7 with value: 0.8331656159922487.
[I 2024-02-27 20:10:07,925] Trial 106 finished with value: 0.8331656159922487 and parameters: {'model_name': 'SimpleImputer', 'strategy': 'median'}. Best is trial 7 with value: 0.8331656159922487.
[I 2024-02-27 20:10:09,446] Trial 107 finished with value: 0.8331656159922487 and parameters: {'model_name': 'SimpleImputer', 'strategy': 'median'}. Best is trial 7 with value: 0.8331656159922487.
[I 2024-02-27 20:10:11,234] Trial 108 finished with value: 0.8331656159922487 and parameters: {'model_name': 'SimpleImputer', 'strategy': 'median'}. Best is trial 7 with value: 0.8331656159922487.
[I 2024-02-27 20:10:12,265] Trial 16 finished with value: 0.9116897963257597 and parameters: {'model_name': 'GAIN', 'batch_size': 24, 'hint_rate': 0.8, 'alpha': 27, 'iterations': 27}. Best is trial 7 with value: 0.8331656159922487.
[I 2024-02-27 20:10:13,887] Trial 109 finished with value: 0.8331656159922487 and parameters: {'model_name': 'SimpleImputer', 'strategy': 'median'}. Best is trial 7 with value: 0.8331656159922487.
[I 2024-02-27 20:10:15,634] Trial 110 finished with value: 0.8331656159922487 and parameters: {'model_name': 'SimpleImputer', 'strategy': 'median'}. Best is trial 7 with value: 0.8331656159922487.
[I 2024-02-27 20:10:16,752] Trial 112 finished with value: 0.8331656159922487 and parameters: {'model_name': 'SimpleImputer', 'strategy': 'constant'}. Best is trial 7 with value: 0.8331656159922487.
[I 2024-02-27 20:10:17,885] Trial 111 finished with value: 0.8331656159922487 and parameters: {'model_name': 'SimpleImputer', 'strategy': 'median'}. Best is trial 7 with value: 0.8331656159922487.
[I 2024-02-27 20:10:19,628] Trial 113 finished with value: 0.8331656159922487 and parameters: {'model_name': 'SimpleImputer', 'strategy': 'constant'}. Best is trial 7 with value: 0.8331656159922487.
[I 2024-02-27 20:10:20,794] Trial 114 finished with value: 0.8331656159922487 and parameters: {'model_name': 'SimpleImputer', 'strategy': 'constant'}. Best is trial 7 with value: 0.8331656159922487.
[I 2024-02-27 20:10:21,641] Trial 115 finished with value: 0.8331656159922487 and parameters: {'model_name': 'SimpleImputer', 'strategy': 'constant'}. Best is trial 7 with value: 0.8331656159922487.
[I 2024-02-27 20:10:23,449] Trial 118 finished with value: 0.8331656159922487 and parameters: {'model_name': 'SimpleImputer', 'strategy': 'constant'}. Best is trial 7 with value: 0.8331656159922487.
[I 2024-02-27 20:10:27,132] Trial 49 finished with value: 0.8341285601034898 and parameters: {'model_name': 'RandomForestImputer', 'max_iter': 8, 'decreasing': True, 'min_samples_split': 0.8, 'min_samples_leaf': 0.1, 'max_features': 0.9, 'warm_start': True}. Best is trial 7 with value: 0.8331656159922487.
[I 2024-02-27 20:10:28,697] Trial 119 finished with value: 0.8893017234080496 and parameters: {'model_name': 'SimpleImputer', 'strategy': 'most_frequent'}. Best is trial 7 with value: 0.8331656159922487.
[I 2024-02-27 20:10:30,939] Trial 121 finished with value: 0.8331751761172604 and parameters: {'model_name': 'SimpleImputer', 'strategy': 'mean'}. Best is trial 7 with value: 0.8331656159922487.
[I 2024-02-27 20:10:32,372] Trial 122 finished with value: 0.8331656159922487 and parameters: {'model_name': 'SimpleImputer', 'strategy': 'constant'}. Best is trial 7 with value: 0.8331656159922487.
[I 2024-02-27 20:10:33,614] Trial 120 finished with value: 0.8893017234080496 and parameters: {'model_name': 'SimpleImputer', 'strategy': 'most_frequent'}. Best is trial 7 with value: 0.8331656159922487.
[I 2024-02-27 20:10:34,829] Trial 123 finished with value: 0.8331656159922487 and parameters: {'model_name': 'SimpleImputer', 'strategy': 'constant'}. Best is trial 7 with value: 0.8331656159922487.
[I 2024-02-27 20:10:43,353] Trial 34 finished with value: 0.833402061039421 and parameters: {'model_name': 'RandomForestImputer', 'max_iter': 18, 'decreasing': True, 'min_samples_split': 0.30000000000000004, 'min_samples_leaf': 0.6, 'max_features': 0.4, 'warm_start': True}. Best is trial 7 with value: 0.8331656159922487.
[I 2024-02-27 20:10:44,904] Trial 126 finished with value: 0.8331751761172604 and parameters: {'model_name': 'SimpleImputer', 'strategy': 'mean'}. Best is trial 7 with value: 0.8331656159922487.
[I 2024-02-27 20:10:54,636] Trial 41 finished with value: 0.8635709256162729 and parameters: {'model_name': 'GAIN', 'batch_size': 3, 'hint_rate': 0.42000000000000004, 'alpha': 34, 'iterations': 40}. Best is trial 7 with value: 0.8331656159922487.
[I 2024-02-27 20:10:56,074] Trial 128 finished with value: 0.8331656159922487 and parameters: {'model_name': 'SimpleImputer', 'strategy': 'constant'}. Best is trial 7 with value: 0.8331656159922487.
[I 2024-02-27 20:10:57,874] Trial 73 finished with value: 0.8829848718535558 and parameters: {'model_name': 'GAIN', 'batch_size': 43, 'hint_rate': 0.56, 'alpha': 92, 'iterations': 13}. Best is trial 7 with value: 0.8331656159922487.
[I 2024-02-27 20:10:58,916] Trial 129 finished with value: 0.8331656159922487 and parameters: {'model_name': 'SimpleImputer', 'strategy': 'constant'}. Best is trial 7 with value: 0.8331656159922487.
[I 2024-02-27 20:11:00,673] Trial 130 finished with value: 0.8331656159922487 and parameters: {'model_name': 'SimpleImputer', 'strategy': 'constant'}. Best is trial 7 with value: 0.8331656159922487.
[I 2024-02-27 20:11:01,948] Trial 131 finished with value: 0.8331656159922487 and parameters: {'model_name': 'SimpleImputer', 'strategy': 'constant'}. Best is trial 7 with value: 0.8331656159922487.
[I 2024-02-27 20:11:03,456] Trial 132 finished with value: 0.8331656159922487 and parameters: {'model_name': 'SimpleImputer', 'strategy': 'constant'}. Best is trial 7 with value: 0.8331656159922487.
[I 2024-02-27 20:11:05,166] Trial 81 finished with value: 0.8331751761172604 and parameters: {'model_name': 'RandomForestImputer', 'max_iter': 1, 'decreasing': False, 'min_samples_split': 0.2, 'min_samples_leaf': 0.5, 'max_features': 0.1, 'warm_start': False}. Best is trial 7 with value: 0.8331656159922487.
[I 2024-02-27 20:11:07,657] Trial 135 finished with value: 0.8331656159922487 and parameters: {'model_name': 'SimpleImputer', 'strategy': 'median'}. Best is trial 7 with value: 0.8331656159922487.
[I 2024-02-27 20:11:09,616] Trial 136 finished with value: 0.8331656159922487 and parameters: {'model_name': 'SimpleImputer', 'strategy': 'constant'}. Best is trial 7 with value: 0.8331656159922487.
[I 2024-02-27 20:11:11,215] Trial 137 finished with value: 0.8331656159922487 and parameters: {'model_name': 'SimpleImputer', 'strategy': 'constant'}. Best is trial 7 with value: 0.8331656159922487.
[I 2024-02-27 20:11:12,618] Trial 138 finished with value: 0.8331656159922487 and parameters: {'model_name': 'SimpleImputer', 'strategy': 'constant'}. Best is trial 7 with value: 0.8331656159922487.
[I 2024-02-27 20:11:14,559] Trial 139 finished with value: 0.8331656159922487 and parameters: {'model_name': 'SimpleImputer', 'strategy': 'constant'}. Best is trial 7 with value: 0.8331656159922487.
[I 2024-02-27 20:11:16,193] Trial 140 finished with value: 0.8331656159922487 and parameters: {'model_name': 'SimpleImputer', 'strategy': 'constant'}. Best is trial 7 with value: 0.8331656159922487.
[I 2024-02-27 20:11:17,945] Trial 141 finished with value: 0.8331656159922487 and parameters: {'model_name': 'SimpleImputer', 'strategy': 'constant'}. Best is trial 7 with value: 0.8331656159922487.
[I 2024-02-27 20:11:29,669] Trial 75 finished with value: 0.9222498910970456 and parameters: {'model_name': 'GAIN', 'batch_size': 1, 'hint_rate': 0.97, 'alpha': 35, 'iterations': 25}. Best is trial 7 with value: 0.8331656159922487.
[I 2024-02-27 20:11:31,824] Trial 143 finished with value: 0.8331656159922487 and parameters: {'model_name': 'SimpleImputer', 'strategy': 'median'}. Best is trial 7 with value: 0.8331656159922487.
