[I 2024-04-15 16:17:24,986] Trial 117 finished with value: 18.074323157523278 and parameters: {'model_name': 'SimpleImputer', 'strategy': 'mean'}. Best is trial 5 with value: 18.074323157523278.
[I 2024-04-15 16:17:25,188] Trial 106 finished with value: 18.074323157523278 and parameters: {'model_name': 'SimpleImputer', 'strategy': 'mean'}. Best is trial 5 with value: 18.074323157523278.
[I 2024-04-15 16:17:25,407] Trial 113 finished with value: 18.074323157523278 and parameters: {'model_name': 'SimpleImputer', 'strategy': 'mean'}. Best is trial 5 with value: 18.074323157523278.
[I 2024-04-15 16:17:25,609] Trial 78 finished with value: 30.65496405069941 and parameters: {'model_name': 'SimpleImputer', 'strategy': 'most_frequent'}. Best is trial 5 with value: 18.074323157523278.
[I 2024-04-15 16:17:25,790] Trial 109 finished with value: 18.074323157523278 and parameters: {'model_name': 'SimpleImputer', 'strategy': 'mean'}. Best is trial 5 with value: 18.074323157523278.
[I 2024-04-15 16:17:25,957] Trial 93 finished with value: 30.65496405069941 and parameters: {'model_name': 'SimpleImputer', 'strategy': 'most_frequent'}. Best is trial 5 with value: 18.074323157523278.
[I 2024-04-15 16:17:26,149] Trial 118 finished with value: 18.074323157523278 and parameters: {'model_name': 'SimpleImputer', 'strategy': 'mean'}. Best is trial 5 with value: 18.074323157523278.
[I 2024-04-15 16:17:26,340] Trial 107 finished with value: 18.074323157523278 and parameters: {'model_name': 'SimpleImputer', 'strategy': 'mean'}. Best is trial 5 with value: 18.074323157523278.
[I 2024-04-15 16:17:26,605] Trial 112 finished with value: 18.074323157523278 and parameters: {'model_name': 'SimpleImputer', 'strategy': 'mean'}. Best is trial 5 with value: 18.074323157523278.
[I 2024-04-15 16:17:26,852] Trial 111 finished with value: 18.074323157523278 and parameters: {'model_name': 'SimpleImputer', 'strategy': 'mean'}. Best is trial 5 with value: 18.074323157523278.
[I 2024-04-15 16:17:27,061] Trial 76 finished with value: 30.65496405069941 and parameters: {'model_name': 'SimpleImputer', 'strategy': 'most_frequent'}. Best is trial 5 with value: 18.074323157523278.
[I 2024-04-15 16:17:27,236] Trial 115 finished with value: 18.074323157523278 and parameters: {'model_name': 'SimpleImputer', 'strategy': 'mean'}. Best is trial 5 with value: 18.074323157523278.
[I 2024-04-15 16:17:27,401] Trial 92 finished with value: 30.65496405069941 and parameters: {'model_name': 'SimpleImputer', 'strategy': 'most_frequent'}. Best is trial 5 with value: 18.074323157523278.
[I 2024-04-15 16:17:27,692] Trial 116 finished with value: 18.074323157523278 and parameters: {'model_name': 'SimpleImputer', 'strategy': 'mean'}. Best is trial 5 with value: 18.074323157523278.
[I 2024-04-15 16:17:27,913] Trial 124 finished with value: 18.074323157523278 and parameters: {'model_name': 'SimpleImputer', 'strategy': 'mean'}. Best is trial 5 with value: 18.074323157523278.
[I 2024-04-15 16:17:28,200] Trial 77 finished with value: 30.65496405069941 and parameters: {'model_name': 'SimpleImputer', 'strategy': 'most_frequent'}. Best is trial 5 with value: 18.074323157523278.
[I 2024-04-15 16:17:28,452] Trial 122 finished with value: 18.074323157523278 and parameters: {'model_name': 'SimpleImputer', 'strategy': 'mean'}. Best is trial 5 with value: 18.074323157523278.
[I 2024-04-15 16:17:28,709] Trial 120 finished with value: 18.074323157523278 and parameters: {'model_name': 'SimpleImputer', 'strategy': 'mean'}. Best is trial 5 with value: 18.074323157523278.
[I 2024-04-15 16:17:29,004] Trial 90 finished with value: 30.65496405069941 and parameters: {'model_name': 'SimpleImputer', 'strategy': 'most_frequent'}. Best is trial 5 with value: 18.074323157523278.
[I 2024-04-15 16:17:29,321] Trial 89 finished with value: 30.65496405069941 and parameters: {'model_name': 'SimpleImputer', 'strategy': 'most_frequent'}. Best is trial 5 with value: 18.074323157523278.
[I 2024-04-15 16:17:29,574] Trial 95 finished with value: 30.65496405069941 and parameters: {'model_name': 'SimpleImputer', 'strategy': 'most_frequent'}. Best is trial 5 with value: 18.074323157523278.
[I 2024-04-15 16:17:29,810] Trial 128 finished with value: 18.074323157523278 and parameters: {'model_name': 'SimpleImputer', 'strategy': 'mean'}. Best is trial 5 with value: 18.074323157523278.
[I 2024-04-15 16:17:30,009] Trial 96 finished with value: 30.65496405069941 and parameters: {'model_name': 'SimpleImputer', 'strategy': 'most_frequent'}. Best is trial 5 with value: 18.074323157523278.
[I 2024-04-15 16:17:30,269] Trial 121 finished with value: 18.074323157523278 and parameters: {'model_name': 'SimpleImputer', 'strategy': 'mean'}. Best is trial 5 with value: 18.074323157523278.
[I 2024-04-15 16:17:30,479] Trial 82 finished with value: 30.65496405069941 and parameters: {'model_name': 'SimpleImputer', 'strategy': 'most_frequent'}. Best is trial 5 with value: 18.074323157523278.
[I 2024-04-15 16:17:30,760] Trial 94 finished with value: 30.65496405069941 and parameters: {'model_name': 'SimpleImputer', 'strategy': 'most_frequent'}. Best is trial 5 with value: 18.074323157523278.
[I 2024-04-15 16:17:31,096] Trial 129 finished with value: 18.074323157523278 and parameters: {'model_name': 'SimpleImputer', 'strategy': 'mean'}. Best is trial 5 with value: 18.074323157523278.
[I 2024-04-15 16:17:31,276] Trial 126 finished with value: 18.074323157523278 and parameters: {'model_name': 'SimpleImputer', 'strategy': 'mean'}. Best is trial 5 with value: 18.074323157523278.
[I 2024-04-15 16:17:31,563] Trial 125 finished with value: 18.074323157523278 and parameters: {'model_name': 'SimpleImputer', 'strategy': 'mean'}. Best is trial 5 with value: 18.074323157523278.
[I 2024-04-15 16:17:31,797] Trial 119 finished with value: 18.074323157523278 and parameters: {'model_name': 'SimpleImputer', 'strategy': 'mean'}. Best is trial 5 with value: 18.074323157523278.
[I 2024-04-15 16:17:32,020] Trial 130 finished with value: 18.074323157523278 and parameters: {'model_name': 'SimpleImputer', 'strategy': 'mean'}. Best is trial 5 with value: 18.074323157523278.
[I 2024-04-15 16:17:32,253] Trial 134 finished with value: 18.074323157523278 and parameters: {'model_name': 'SimpleImputer', 'strategy': 'mean'}. Best is trial 5 with value: 18.074323157523278.
[I 2024-04-15 16:17:32,453] Trial 137 finished with value: 18.074323157523278 and parameters: {'model_name': 'SimpleImputer', 'strategy': 'mean'}. Best is trial 5 with value: 18.074323157523278.
[I 2024-04-15 16:17:32,629] Trial 97 finished with value: 30.65496405069941 and parameters: {'model_name': 'SimpleImputer', 'strategy': 'most_frequent'}. Best is trial 5 with value: 18.074323157523278.
[I 2024-04-15 16:17:32,931] Trial 123 finished with value: 18.074323157523278 and parameters: {'model_name': 'SimpleImputer', 'strategy': 'mean'}. Best is trial 5 with value: 18.074323157523278.
[I 2024-04-15 16:17:33,190] Trial 140 finished with value: 18.074323157523278 and parameters: {'model_name': 'SimpleImputer', 'strategy': 'mean'}. Best is trial 5 with value: 18.074323157523278.
[I 2024-04-15 16:17:33,425] Trial 135 finished with value: 18.074323157523278 and parameters: {'model_name': 'SimpleImputer', 'strategy': 'mean'}. Best is trial 5 with value: 18.074323157523278.
[I 2024-04-15 16:17:33,708] Trial 131 finished with value: 18.074323157523278 and parameters: {'model_name': 'SimpleImputer', 'strategy': 'mean'}. Best is trial 5 with value: 18.074323157523278.
[I 2024-04-15 16:17:33,926] Trial 127 finished with value: 18.074323157523278 and parameters: {'model_name': 'SimpleImputer', 'strategy': 'mean'}. Best is trial 5 with value: 18.074323157523278.
[I 2024-04-15 16:17:34,145] Trial 143 finished with value: 18.074323157523278 and parameters: {'model_name': 'SimpleImputer', 'strategy': 'mean'}. Best is trial 5 with value: 18.074323157523278.
[I 2024-04-15 16:17:34,383] Trial 132 finished with value: 18.074323157523278 and parameters: {'model_name': 'SimpleImputer', 'strategy': 'mean'}. Best is trial 5 with value: 18.074323157523278.
[I 2024-04-15 16:17:34,570] Trial 136 finished with value: 18.074323157523278 and parameters: {'model_name': 'SimpleImputer', 'strategy': 'mean'}. Best is trial 5 with value: 18.074323157523278.
[I 2024-04-15 16:17:34,754] Trial 133 finished with value: 18.074323157523278 and parameters: {'model_name': 'SimpleImputer', 'strategy': 'mean'}. Best is trial 5 with value: 18.074323157523278.
[I 2024-04-15 16:17:35,076] Trial 138 finished with value: 18.074323157523278 and parameters: {'model_name': 'SimpleImputer', 'strategy': 'mean'}. Best is trial 5 with value: 18.074323157523278.
[I 2024-04-15 16:17:35,381] Trial 141 finished with value: 18.074323157523278 and parameters: {'model_name': 'SimpleImputer', 'strategy': 'mean'}. Best is trial 5 with value: 18.074323157523278.
[I 2024-04-15 16:17:35,608] Trial 98 finished with value: 30.65496405069941 and parameters: {'model_name': 'SimpleImputer', 'strategy': 'most_frequent'}. Best is trial 5 with value: 18.074323157523278.
[I 2024-04-15 16:17:35,832] Trial 144 finished with value: 18.074323157523278 and parameters: {'model_name': 'SimpleImputer', 'strategy': 'mean'}. Best is trial 5 with value: 18.074323157523278.
[I 2024-04-15 16:17:36,062] Trial 139 finished with value: 18.074323157523278 and parameters: {'model_name': 'SimpleImputer', 'strategy': 'mean'}. Best is trial 5 with value: 18.074323157523278.
[I 2024-04-15 16:17:36,258] Trial 148 finished with value: 18.074323157523278 and parameters: {'model_name': 'SimpleImputer', 'strategy': 'mean'}. Best is trial 5 with value: 18.074323157523278.
[I 2024-04-15 16:17:36,571] Trial 142 finished with value: 18.074323157523278 and parameters: {'model_name': 'SimpleImputer', 'strategy': 'mean'}. Best is trial 5 with value: 18.074323157523278.
[I 2024-04-15 16:17:36,831] Trial 146 finished with value: 18.074323157523278 and parameters: {'model_name': 'SimpleImputer', 'strategy': 'mean'}. Best is trial 5 with value: 18.074323157523278.
[I 2024-04-15 16:17:37,034] Trial 100 finished with value: 30.65496405069941 and parameters: {'model_name': 'SimpleImputer', 'strategy': 'most_frequent'}. Best is trial 5 with value: 18.074323157523278.
[I 2024-04-15 16:17:37,473] Trial 150 finished with value: 18.074323157523278 and parameters: {'model_name': 'SimpleImputer', 'strategy': 'mean'}. Best is trial 5 with value: 18.074323157523278.
[I 2024-04-15 16:17:37,817] Trial 154 finished with value: 18.074323157523278 and parameters: {'model_name': 'SimpleImputer', 'strategy': 'mean'}. Best is trial 5 with value: 18.074323157523278.
[I 2024-04-15 16:17:38,035] Trial 145 finished with value: 18.074323157523278 and parameters: {'model_name': 'SimpleImputer', 'strategy': 'mean'}. Best is trial 5 with value: 18.074323157523278.
[I 2024-04-15 16:17:38,308] Trial 149 finished with value: 18.074323157523278 and parameters: {'model_name': 'SimpleImputer', 'strategy': 'mean'}. Best is trial 5 with value: 18.074323157523278.
[I 2024-04-15 16:17:38,663] Trial 147 finished with value: 18.074323157523278 and parameters: {'model_name': 'SimpleImputer', 'strategy': 'mean'}. Best is trial 5 with value: 18.074323157523278.
[I 2024-04-15 16:17:38,878] Trial 167 finished with value: 18.074323157523278 and parameters: {'model_name': 'SimpleImputer', 'strategy': 'mean'}. Best is trial 5 with value: 18.074323157523278.
[I 2024-04-15 16:17:39,412] Trial 151 finished with value: 30.63437189150185 and parameters: {'model_name': 'SimpleImputer', 'strategy': 'median'}. Best is trial 5 with value: 18.074323157523278.
[I 2024-04-15 16:17:39,766] Trial 161 finished with value: 18.074323157523278 and parameters: {'model_name': 'SimpleImputer', 'strategy': 'mean'}. Best is trial 5 with value: 18.074323157523278.
[I 2024-04-15 16:17:40,225] Trial 152 finished with value: 30.63437189150185 and parameters: {'model_name': 'SimpleImputer', 'strategy': 'median'}. Best is trial 5 with value: 18.074323157523278.
[I 2024-04-15 16:17:40,401] Trial 166 finished with value: 18.074323157523278 and parameters: {'model_name': 'SimpleImputer', 'strategy': 'mean'}. Best is trial 5 with value: 18.074323157523278.
[I 2024-04-15 16:17:40,600] Trial 157 finished with value: 30.63437189150185 and parameters: {'model_name': 'SimpleImputer', 'strategy': 'median'}. Best is trial 5 with value: 18.074323157523278.
[I 2024-04-15 16:17:41,017] Trial 165 finished with value: 30.63437189150185 and parameters: {'model_name': 'SimpleImputer', 'strategy': 'median'}. Best is trial 5 with value: 18.074323157523278.
[I 2024-04-15 16:17:41,276] Trial 160 finished with value: 30.63437189150185 and parameters: {'model_name': 'SimpleImputer', 'strategy': 'median'}. Best is trial 5 with value: 18.074323157523278.
[I 2024-04-15 16:17:41,471] Trial 177 finished with value: 18.074323157523278 and parameters: {'model_name': 'SimpleImputer', 'strategy': 'mean'}. Best is trial 5 with value: 18.074323157523278.
[I 2024-04-15 16:17:41,674] Trial 164 finished with value: 30.63437189150185 and parameters: {'model_name': 'SimpleImputer', 'strategy': 'median'}. Best is trial 5 with value: 18.074323157523278.
[I 2024-04-15 16:17:41,875] Trial 174 finished with value: 18.074323157523278 and parameters: {'model_name': 'SimpleImputer', 'strategy': 'mean'}. Best is trial 5 with value: 18.074323157523278.
[I 2024-04-15 16:17:42,062] Trial 158 finished with value: 30.63437189150185 and parameters: {'model_name': 'SimpleImputer', 'strategy': 'median'}. Best is trial 5 with value: 18.074323157523278.
[I 2024-04-15 16:17:42,299] Trial 180 finished with value: 18.074323157523278 and parameters: {'model_name': 'SimpleImputer', 'strategy': 'mean'}. Best is trial 5 with value: 18.074323157523278.
[I 2024-04-15 16:17:42,542] Trial 155 finished with value: 30.63437189150185 and parameters: {'model_name': 'SimpleImputer', 'strategy': 'median'}. Best is trial 5 with value: 18.074323157523278.
[I 2024-04-15 16:17:42,739] Trial 194 finished with value: 18.074323157523278 and parameters: {'model_name': 'SimpleImputer', 'strategy': 'mean'}. Best is trial 5 with value: 18.074323157523278.
[I 2024-04-15 16:17:42,917] Trial 156 finished with value: 30.63437189150185 and parameters: {'model_name': 'SimpleImputer', 'strategy': 'median'}. Best is trial 5 with value: 18.074323157523278.
[I 2024-04-15 16:17:43,211] Trial 163 finished with value: 30.63437189150185 and parameters: {'model_name': 'SimpleImputer', 'strategy': 'median'}. Best is trial 5 with value: 18.074323157523278.
[I 2024-04-15 16:17:43,412] Trial 192 finished with value: 18.074323157523278 and parameters: {'model_name': 'SimpleImputer', 'strategy': 'mean'}. Best is trial 5 with value: 18.074323157523278.
[I 2024-04-15 16:17:43,633] Trial 162 finished with value: 30.63437189150185 and parameters: {'model_name': 'SimpleImputer', 'strategy': 'median'}. Best is trial 5 with value: 18.074323157523278.
[I 2024-04-15 16:17:43,804] Trial 171 finished with value: 30.63437189150185 and parameters: {'model_name': 'SimpleImputer', 'strategy': 'median'}. Best is trial 5 with value: 18.074323157523278.
[I 2024-04-15 16:17:44,044] Trial 179 finished with value: 18.074323157523278 and parameters: {'model_name': 'SimpleImputer', 'strategy': 'mean'}. Best is trial 5 with value: 18.074323157523278.
[I 2024-04-15 16:17:44,292] Trial 181 finished with value: 30.63437189150185 and parameters: {'model_name': 'SimpleImputer', 'strategy': 'median'}. Best is trial 5 with value: 18.074323157523278.
[I 2024-04-15 16:17:44,539] Trial 173 finished with value: 30.63437189150185 and parameters: {'model_name': 'SimpleImputer', 'strategy': 'median'}. Best is trial 5 with value: 18.074323157523278.
[I 2024-04-15 16:17:44,802] Trial 153 finished with value: 30.63437189150185 and parameters: {'model_name': 'SimpleImputer', 'strategy': 'median'}. Best is trial 5 with value: 18.074323157523278.
[I 2024-04-15 16:17:45,006] Trial 184 finished with value: 30.63437189150185 and parameters: {'model_name': 'SimpleImputer', 'strategy': 'median'}. Best is trial 5 with value: 18.074323157523278.
[I 2024-04-15 16:17:45,237] Trial 189 finished with value: 18.074323157523278 and parameters: {'model_name': 'SimpleImputer', 'strategy': 'mean'}. Best is trial 5 with value: 18.074323157523278.
[I 2024-04-15 16:17:45,465] Trial 159 finished with value: 30.63437189150185 and parameters: {'model_name': 'SimpleImputer', 'strategy': 'median'}. Best is trial 5 with value: 18.074323157523278.
[I 2024-04-15 16:17:45,778] Trial 187 finished with value: 30.63437189150185 and parameters: {'model_name': 'SimpleImputer', 'strategy': 'median'}. Best is trial 5 with value: 18.074323157523278.
[I 2024-04-15 16:17:46,006] Trial 191 finished with value: 30.63437189150185 and parameters: {'model_name': 'SimpleImputer', 'strategy': 'median'}. Best is trial 5 with value: 18.074323157523278.
[I 2024-04-15 16:17:46,237] Trial 169 finished with value: 30.63437189150185 and parameters: {'model_name': 'SimpleImputer', 'strategy': 'median'}. Best is trial 5 with value: 18.074323157523278.
[I 2024-04-15 16:17:46,473] Trial 175 finished with value: 30.63437189150185 and parameters: {'model_name': 'SimpleImputer', 'strategy': 'median'}. Best is trial 5 with value: 18.074323157523278.
[I 2024-04-15 16:17:46,660] Trial 172 finished with value: 30.63437189150185 and parameters: {'model_name': 'SimpleImputer', 'strategy': 'median'}. Best is trial 5 with value: 18.074323157523278.
[I 2024-04-15 16:17:46,859] Trial 178 finished with value: 30.63437189150185 and parameters: {'model_name': 'SimpleImputer', 'strategy': 'median'}. Best is trial 5 with value: 18.074323157523278.
[I 2024-04-15 16:17:47,034] Trial 190 finished with value: 30.63437189150185 and parameters: {'model_name': 'SimpleImputer', 'strategy': 'median'}. Best is trial 5 with value: 18.074323157523278.
[I 2024-04-15 16:17:47,257] Trial 188 finished with value: 30.63437189150185 and parameters: {'model_name': 'SimpleImputer', 'strategy': 'median'}. Best is trial 5 with value: 18.074323157523278.
[I 2024-04-15 16:17:47,485] Trial 176 finished with value: 30.63437189150185 and parameters: {'model_name': 'SimpleImputer', 'strategy': 'median'}. Best is trial 5 with value: 18.074323157523278.
[I 2024-04-15 16:17:47,673] Trial 185 finished with value: 30.63437189150185 and parameters: {'model_name': 'SimpleImputer', 'strategy': 'median'}. Best is trial 5 with value: 18.074323157523278.
[I 2024-04-15 16:17:47,883] Trial 199 finished with value: 30.63437189150185 and parameters: {'model_name': 'SimpleImputer', 'strategy': 'median'}. Best is trial 5 with value: 18.074323157523278.
[I 2024-04-15 16:17:48,066] Trial 195 finished with value: 30.63437189150185 and parameters: {'model_name': 'SimpleImputer', 'strategy': 'median'}. Best is trial 5 with value: 18.074323157523278.
[I 2024-04-15 16:17:48,290] Trial 170 finished with value: 30.63437189150185 and parameters: {'model_name': 'SimpleImputer', 'strategy': 'median'}. Best is trial 5 with value: 18.074323157523278.
[I 2024-04-15 16:17:48,485] Trial 183 finished with value: 30.63437189150185 and parameters: {'model_name': 'SimpleImputer', 'strategy': 'median'}. Best is trial 5 with value: 18.074323157523278.
[I 2024-04-15 16:17:48,709] Trial 193 finished with value: 30.63437189150185 and parameters: {'model_name': 'SimpleImputer', 'strategy': 'median'}. Best is trial 5 with value: 18.074323157523278.
[I 2024-04-15 16:17:48,926] Trial 186 finished with value: 30.63437189150185 and parameters: {'model_name': 'SimpleImputer', 'strategy': 'median'}. Best is trial 5 with value: 18.074323157523278.
[I 2024-04-15 16:17:49,141] Trial 182 finished with value: 30.63437189150185 and parameters: {'model_name': 'SimpleImputer', 'strategy': 'median'}. Best is trial 5 with value: 18.074323157523278.
[I 2024-04-15 16:17:49,322] Trial 168 finished with value: 30.63437189150185 and parameters: {'model_name': 'SimpleImputer', 'strategy': 'median'}. Best is trial 5 with value: 18.074323157523278.
[I 2024-04-15 16:17:49,493] Trial 198 finished with value: 30.63437189150185 and parameters: {'model_name': 'SimpleImputer', 'strategy': 'median'}. Best is trial 5 with value: 18.074323157523278.
[I 2024-04-15 16:17:49,664] Trial 196 finished with value: 30.63437189150185 and parameters: {'model_name': 'SimpleImputer', 'strategy': 'median'}. Best is trial 5 with value: 18.074323157523278.
