[I 2024-04-04 09:46:43,025] Trial 190 finished with value: 0.22494547059611056 and parameters: {'model_name': 'RandomForestImputer', 'max_iter': 7, 'decreasing': False, 'min_samples_split': 0.8, 'min_samples_leaf': 0.8, 'max_features': 0.2, 'warm_start': False}. Best is trial 0 with value: 0.22432439804144194.
[I 2024-04-04 09:48:53,115] Trial 193 finished with value: 0.2248101796021933 and parameters: {'model_name': 'RandomForestImputer', 'max_iter': 7, 'decreasing': False, 'min_samples_split': 0.8, 'min_samples_leaf': 0.8, 'max_features': 0.2, 'warm_start': False}. Best is trial 0 with value: 0.22432439804144194.
[I 2024-04-04 09:49:17,561] Trial 191 finished with value: 0.22479312684576652 and parameters: {'model_name': 'RandomForestImputer', 'max_iter': 7, 'decreasing': False, 'min_samples_split': 0.8, 'min_samples_leaf': 0.8, 'max_features': 0.2, 'warm_start': False}. Best is trial 0 with value: 0.22432439804144194.
[I 2024-04-04 09:49:21,547] Trial 194 finished with value: 0.22460238844499059 and parameters: {'model_name': 'RandomForestImputer', 'max_iter': 7, 'decreasing': False, 'min_samples_split': 0.8, 'min_samples_leaf': 0.8, 'max_features': 0.2, 'warm_start': False}. Best is trial 0 with value: 0.22432439804144194.
[I 2024-04-04 09:49:28,133] Trial 197 finished with value: 0.2248207455390127 and parameters: {'model_name': 'RandomForestImputer', 'max_iter': 7, 'decreasing': False, 'min_samples_split': 0.8, 'min_samples_leaf': 0.8, 'max_features': 0.2, 'warm_start': False}. Best is trial 0 with value: 0.22432439804144194.
[I 2024-04-04 09:49:47,363] Trial 181 finished with value: 0.2248469178728108 and parameters: {'model_name': 'RandomForestImputer', 'max_iter': 16, 'decreasing': False, 'min_samples_split': 0.8, 'min_samples_leaf': 0.8, 'max_features': 0.2, 'warm_start': False}. Best is trial 0 with value: 0.22432439804144194.
[I 2024-04-04 09:49:49,826] Trial 180 finished with value: 0.22490878377491205 and parameters: {'model_name': 'RandomForestImputer', 'max_iter': 15, 'decreasing': False, 'min_samples_split': 0.8, 'min_samples_leaf': 0.8, 'max_features': 0.2, 'warm_start': False}. Best is trial 0 with value: 0.22432439804144194.
[I 2024-04-04 09:49:52,069] Trial 198 finished with value: 0.22470384327348297 and parameters: {'model_name': 'RandomForestImputer', 'max_iter': 7, 'decreasing': False, 'min_samples_split': 0.6000000000000001, 'min_samples_leaf': 0.8, 'max_features': 0.2, 'warm_start': False}. Best is trial 0 with value: 0.22432439804144194.
[I 2024-04-04 09:49:59,016] Trial 192 finished with value: 0.22463350697460874 and parameters: {'model_name': 'RandomForestImputer', 'max_iter': 7, 'decreasing': False, 'min_samples_split': 0.8, 'min_samples_leaf': 0.8, 'max_features': 0.2, 'warm_start': False}. Best is trial 0 with value: 0.22432439804144194.
[I 2024-04-04 09:50:02,879] Trial 195 finished with value: 0.22512792832544268 and parameters: {'model_name': 'RandomForestImputer', 'max_iter': 7, 'decreasing': False, 'min_samples_split': 0.8, 'min_samples_leaf': 0.8, 'max_features': 0.2, 'warm_start': False}. Best is trial 0 with value: 0.22432439804144194.
[I 2024-04-04 09:50:11,842] Trial 199 finished with value: 0.2246220337600649 and parameters: {'model_name': 'RandomForestImputer', 'max_iter': 7, 'decreasing': False, 'min_samples_split': 0.6000000000000001, 'min_samples_leaf': 0.8, 'max_features': 0.4, 'warm_start': False}. Best is trial 0 with value: 0.22432439804144194.
[I 2024-04-04 09:50:32,519] Trial 196 finished with value: 0.22501001014901484 and parameters: {'model_name': 'RandomForestImputer', 'max_iter': 8, 'decreasing': False, 'min_samples_split': 0.8, 'min_samples_leaf': 0.8, 'max_features': 0.2, 'warm_start': False}. Best is trial 0 with value: 0.22432439804144194.
[I 2024-04-04 09:53:02,622] Trial 112 finished with value: inf and parameters: {'model_name': 'GAIN', 'batch_size': 1, 'hint_rate': 0.98, 'alpha': 0, 'iterations': 20136}. Best is trial 0 with value: 0.22432439804144194.
[I 2024-04-04 09:55:20,645] Trial 144 finished with value: 0.22475906101473112 and parameters: {'model_name': 'RandomForestImputer', 'max_iter': 53, 'decreasing': False, 'min_samples_split': 0.7000000000000001, 'min_samples_leaf': 0.9, 'max_features': 0.30000000000000004, 'warm_start': False}. Best is trial 0 with value: 0.22432439804144194.
[I 2024-04-04 09:55:26,400] Trial 134 finished with value: 0.22479539246050995 and parameters: {'model_name': 'RandomForestImputer', 'max_iter': 55, 'decreasing': False, 'min_samples_split': 0.7000000000000001, 'min_samples_leaf': 0.8, 'max_features': 0.30000000000000004, 'warm_start': False}. Best is trial 0 with value: 0.22432439804144194.
[I 2024-04-04 09:57:33,458] Trial 136 finished with value: 0.22479971918733882 and parameters: {'model_name': 'RandomForestImputer', 'max_iter': 70, 'decreasing': False, 'min_samples_split': 0.7000000000000001, 'min_samples_leaf': 0.9, 'max_features': 0.30000000000000004, 'warm_start': False}. Best is trial 0 with value: 0.22432439804144194.
[I 2024-04-04 09:57:52,425] Trial 19 finished with value: 0.2240176214010788 and parameters: {'model_name': 'RandomForestImputer', 'max_iter': 89, 'decreasing': True, 'min_samples_split': 0.0, 'min_samples_leaf': 0.1, 'max_features': 0.8, 'warm_start': False}. Best is trial 19 with value: 0.2240176214010788.
[I 2024-04-04 09:58:26,104] Trial 135 finished with value: 0.22481935870001463 and parameters: {'model_name': 'RandomForestImputer', 'max_iter': 82, 'decreasing': False, 'min_samples_split': 0.7000000000000001, 'min_samples_leaf': 0.9, 'max_features': 0.30000000000000004, 'warm_start': False}. Best is trial 19 with value: 0.2240176214010788.
[I 2024-04-04 10:00:20,411] Trial 139 finished with value: 0.2248268590221117 and parameters: {'model_name': 'RandomForestImputer', 'max_iter': 86, 'decreasing': False, 'min_samples_split': 0.7000000000000001, 'min_samples_leaf': 0.9, 'max_features': 0.30000000000000004, 'warm_start': False}. Best is trial 19 with value: 0.2240176214010788.
[I 2024-04-04 10:00:27,472] Trial 138 finished with value: 0.22476499409089334 and parameters: {'model_name': 'RandomForestImputer', 'max_iter': 90, 'decreasing': False, 'min_samples_split': 0.7000000000000001, 'min_samples_leaf': 0.9, 'max_features': 0.30000000000000004, 'warm_start': False}. Best is trial 19 with value: 0.2240176214010788.
[I 2024-04-04 10:01:22,439] Trial 137 finished with value: 0.22477521203441117 and parameters: {'model_name': 'RandomForestImputer', 'max_iter': 91, 'decreasing': False, 'min_samples_split': 0.7000000000000001, 'min_samples_leaf': 0.9, 'max_features': 0.30000000000000004, 'warm_start': False}. Best is trial 19 with value: 0.2240176214010788.
[I 2024-04-04 10:02:17,510] Trial 143 finished with value: 0.22489044493002633 and parameters: {'model_name': 'RandomForestImputer', 'max_iter': 96, 'decreasing': False, 'min_samples_split': 0.7000000000000001, 'min_samples_leaf': 0.9, 'max_features': 0.30000000000000004, 'warm_start': False}. Best is trial 19 with value: 0.2240176214010788.
[I 2024-04-04 10:02:37,447] Trial 154 finished with value: 0.2248088067397215 and parameters: {'model_name': 'RandomForestImputer', 'max_iter': 96, 'decreasing': False, 'min_samples_split': 0.7000000000000001, 'min_samples_leaf': 0.9, 'max_features': 0.30000000000000004, 'warm_start': False}. Best is trial 19 with value: 0.2240176214010788.
[I 2024-04-04 10:06:08,024] Trial 151 finished with value: 0.2247783484090628 and parameters: {'model_name': 'RandomForestImputer', 'max_iter': 97, 'decreasing': False, 'min_samples_split': 0.7000000000000001, 'min_samples_leaf': 0.8, 'max_features': 0.30000000000000004, 'warm_start': False}. Best is trial 19 with value: 0.2240176214010788.
[I 2024-04-04 10:06:24,132] Trial 33 finished with value: inf and parameters: {'model_name': 'GAIN', 'batch_size': 161, 'hint_rate': 0.92, 'alpha': 71, 'iterations': 34553}. Best is trial 19 with value: 0.2240176214010788.
[I 2024-04-04 10:08:17,371] Trial 106 finished with value: inf and parameters: {'model_name': 'GAIN', 'batch_size': 1, 'hint_rate': 0.9500000000000001, 'alpha': 3, 'iterations': 22551}. Best is trial 19 with value: 0.2240176214010788.
[I 2024-04-04 10:09:01,616] Trial 122 finished with value: inf and parameters: {'model_name': 'GAIN', 'batch_size': 1, 'hint_rate': 0.99, 'alpha': 98, 'iterations': 46952}. Best is trial 19 with value: 0.2240176214010788.
[I 2024-04-04 10:09:07,986] Trial 123 finished with value: inf and parameters: {'model_name': 'GAIN', 'batch_size': 1, 'hint_rate': 0.9500000000000001, 'alpha': 2, 'iterations': 46986}. Best is trial 19 with value: 0.2240176214010788.
[I 2024-04-04 10:09:22,692] Trial 70 finished with value: inf and parameters: {'model_name': 'GAIN', 'batch_size': 6, 'hint_rate': 0.6, 'alpha': 8, 'iterations': 48454}. Best is trial 19 with value: 0.2240176214010788.
[I 2024-04-04 10:14:27,165] Trial 107 finished with value: inf and parameters: {'model_name': 'GAIN', 'batch_size': 1, 'hint_rate': 0.93, 'alpha': 5, 'iterations': 65461}. Best is trial 19 with value: 0.2240176214010788.
[I 2024-04-04 10:14:40,948] Trial 111 finished with value: inf and parameters: {'model_name': 'GAIN', 'batch_size': 1, 'hint_rate': 0.99, 'alpha': 5, 'iterations': 66065}. Best is trial 19 with value: 0.2240176214010788.
[I 2024-04-04 10:15:35,228] Trial 31 finished with value: inf and parameters: {'model_name': 'GAIN', 'batch_size': 154, 'hint_rate': 0.86, 'alpha': 3, 'iterations': 58216}. Best is trial 19 with value: 0.2240176214010788.
[I 2024-04-04 10:16:44,859] Trial 121 finished with value: inf and parameters: {'model_name': 'GAIN', 'batch_size': 1, 'hint_rate': 0.9400000000000001, 'alpha': 100, 'iterations': 74024}. Best is trial 19 with value: 0.2240176214010788.
[I 2024-04-04 10:16:54,511] Trial 114 finished with value: inf and parameters: {'model_name': 'GAIN', 'batch_size': 1, 'hint_rate': 0.93, 'alpha': 1, 'iterations': 74924}. Best is trial 19 with value: 0.2240176214010788.
[I 2024-04-04 10:17:17,238] Trial 125 finished with value: inf and parameters: {'model_name': 'GAIN', 'batch_size': 1, 'hint_rate': 0.04, 'alpha': 99, 'iterations': 25669}. Best is trial 19 with value: 0.2240176214010788.
[I 2024-04-04 10:19:02,653] Trial 126 finished with value: inf and parameters: {'model_name': 'GAIN', 'batch_size': 1, 'hint_rate': 0.01, 'alpha': 100, 'iterations': 87093}. Best is trial 19 with value: 0.2240176214010788.
[I 2024-04-04 10:19:22,484] Trial 124 finished with value: inf and parameters: {'model_name': 'GAIN', 'batch_size': 1, 'hint_rate': 0.99, 'alpha': 97, 'iterations': 91530}. Best is trial 19 with value: 0.2240176214010788.
[I 2024-04-04 10:19:24,915] Trial 113 finished with value: inf and parameters: {'model_name': 'GAIN', 'batch_size': 1, 'hint_rate': 0.98, 'alpha': 4, 'iterations': 91698}. Best is trial 19 with value: 0.2240176214010788.
[I 2024-04-04 10:19:28,351] Trial 133 finished with value: inf and parameters: {'model_name': 'GAIN', 'batch_size': 1, 'hint_rate': 0.88, 'alpha': 98, 'iterations': 90683}. Best is trial 19 with value: 0.2240176214010788.
[I 2024-04-04 10:19:29,211] Trial 110 finished with value: inf and parameters: {'model_name': 'GAIN', 'batch_size': 1, 'hint_rate': 0.98, 'alpha': 6, 'iterations': 93081}. Best is trial 19 with value: 0.2240176214010788.
