[I 2023-12-27 13:30:08,945] Trial 56 finished with value: 0.9438647532918937 and parameters: {'model_name': 'RandomForestImputer', 'max_iter': 7, 'decreasing': True, 'min_samples_split': 0.4, 'min_samples_leaf': 0.4, 'max_features': 0.5, 'warm_start': False}. Best is trial 6 with value: 0.7540843946554675.
[I 2023-12-27 13:30:25,390] Trial 15 finished with value: 1.1912104304252522 and parameters: {'model_name': 'IterativeImputer', 'sample_posterior': True, 'initial_strategy': 'mean', 'imputation_order': 'ascending'}. Best is trial 6 with value: 0.7540843946554675.
[I 2023-12-27 13:30:29,453] Trial 20 finished with value: 1.1619304693939878 and parameters: {'model_name': 'IterativeImputer', 'sample_posterior': True, 'initial_strategy': 'median', 'imputation_order': 'ascending'}. Best is trial 6 with value: 0.7540843946554675.
[I 2023-12-27 13:30:30,508] Trial 139 finished with value: 0.7540843946554675 and parameters: {'model_name': 'KNNImputer', 'weights': 'uniform', 'keep_empty_features': False}. Best is trial 6 with value: 0.7540843946554675.
[I 2023-12-27 13:30:32,942] Trial 54 finished with value: 1.168431034117037 and parameters: {'model_name': 'IterativeImputer', 'sample_posterior': True, 'initial_strategy': 'median', 'imputation_order': 'arabic'}. Best is trial 6 with value: 0.7540843946554675.
[I 2023-12-27 13:30:34,252] Trial 57 finished with value: 1.1335275985755067 and parameters: {'model_name': 'IterativeImputer', 'sample_posterior': True, 'initial_strategy': 'constant', 'imputation_order': 'arabic'}. Best is trial 6 with value: 0.7540843946554675.
[I 2023-12-27 13:30:36,063] Trial 7 finished with value: 1.1638447458567076 and parameters: {'model_name': 'IterativeImputer', 'sample_posterior': True, 'initial_strategy': 'most_frequent', 'imputation_order': 'roman'}. Best is trial 6 with value: 0.7540843946554675.
[I 2023-12-27 13:30:37,650] Trial 141 finished with value: 0.7540843946554675 and parameters: {'model_name': 'KNNImputer', 'weights': 'uniform', 'keep_empty_features': False}. Best is trial 6 with value: 0.7540843946554675.
[I 2023-12-27 13:30:38,717] Trial 140 finished with value: 0.7540843946554675 and parameters: {'model_name': 'KNNImputer', 'weights': 'uniform', 'keep_empty_features': False}. Best is trial 6 with value: 0.7540843946554675.
[I 2023-12-27 13:30:39,721] Trial 71 finished with value: 2.414875277377638 and parameters: {'model_name': 'GAIN', 'batch_size': 19, 'hint_rate': 0.02, 'alpha': 95, 'iterations': 31}. Best is trial 6 with value: 0.7540843946554675.
[I 2023-12-27 13:30:42,360] Trial 142 finished with value: 0.7540843946554675 and parameters: {'model_name': 'KNNImputer', 'weights': 'uniform', 'keep_empty_features': False}. Best is trial 6 with value: 0.7540843946554675.
[I 2023-12-27 13:30:44,130] Trial 143 finished with value: 0.7540843946554675 and parameters: {'model_name': 'KNNImputer', 'weights': 'uniform', 'keep_empty_features': False}. Best is trial 6 with value: 0.7540843946554675.
[I 2023-12-27 13:30:45,423] Trial 62 finished with value: 1.1736179981449175 and parameters: {'model_name': 'IterativeImputer', 'sample_posterior': True, 'initial_strategy': 'constant', 'imputation_order': 'ascending'}. Best is trial 6 with value: 0.7540843946554675.
[I 2023-12-27 13:30:46,871] Trial 144 finished with value: 0.7540843946554675 and parameters: {'model_name': 'KNNImputer', 'weights': 'uniform', 'keep_empty_features': False}. Best is trial 6 with value: 0.7540843946554675.
[I 2023-12-27 13:30:48,531] Trial 145 finished with value: 0.7540843946554675 and parameters: {'model_name': 'KNNImputer', 'weights': 'uniform', 'keep_empty_features': False}. Best is trial 6 with value: 0.7540843946554675.
[I 2023-12-27 13:30:49,798] Trial 146 finished with value: 0.7540843946554675 and parameters: {'model_name': 'KNNImputer', 'weights': 'uniform', 'keep_empty_features': False}. Best is trial 6 with value: 0.7540843946554675.
[I 2023-12-27 13:30:50,931] Trial 147 finished with value: 0.7540843946554675 and parameters: {'model_name': 'KNNImputer', 'weights': 'uniform', 'keep_empty_features': False}. Best is trial 6 with value: 0.7540843946554675.
[I 2023-12-27 13:30:53,479] Trial 148 finished with value: 0.7540843946554675 and parameters: {'model_name': 'KNNImputer', 'weights': 'uniform', 'keep_empty_features': False}. Best is trial 6 with value: 0.7540843946554675.
[I 2023-12-27 13:30:54,777] Trial 73 finished with value: 0.9450404479974607 and parameters: {'model_name': 'RandomForestImputer', 'max_iter': 93, 'decreasing': True, 'min_samples_split': 0.0, 'min_samples_leaf': 0.9, 'max_features': 0.1, 'warm_start': True}. Best is trial 6 with value: 0.7540843946554675.
[I 2023-12-27 13:30:56,124] Trial 149 finished with value: 0.7540843946554675 and parameters: {'model_name': 'KNNImputer', 'weights': 'uniform', 'keep_empty_features': False}. Best is trial 6 with value: 0.7540843946554675.
[I 2023-12-27 13:30:57,596] Trial 150 finished with value: 0.7540843946554675 and parameters: {'model_name': 'KNNImputer', 'weights': 'uniform', 'keep_empty_features': False}. Best is trial 6 with value: 0.7540843946554675.
[I 2023-12-27 13:30:59,124] Trial 151 finished with value: 0.7540843946554675 and parameters: {'model_name': 'KNNImputer', 'weights': 'uniform', 'keep_empty_features': False}. Best is trial 6 with value: 0.7540843946554675.
[I 2023-12-27 13:31:00,257] Trial 152 finished with value: 0.7540843946554675 and parameters: {'model_name': 'KNNImputer', 'weights': 'uniform', 'keep_empty_features': False}. Best is trial 6 with value: 0.7540843946554675.
[I 2023-12-27 13:31:01,884] Trial 153 finished with value: 0.7540843946554675 and parameters: {'model_name': 'KNNImputer', 'weights': 'uniform', 'keep_empty_features': False}. Best is trial 6 with value: 0.7540843946554675.
[I 2023-12-27 13:31:03,006] Trial 154 finished with value: 0.7540843946554675 and parameters: {'model_name': 'KNNImputer', 'weights': 'uniform', 'keep_empty_features': False}. Best is trial 6 with value: 0.7540843946554675.
[I 2023-12-27 13:31:06,169] Trial 155 finished with value: 0.7540843946554675 and parameters: {'model_name': 'KNNImputer', 'weights': 'uniform', 'keep_empty_features': False}. Best is trial 6 with value: 0.7540843946554675.
[I 2023-12-27 13:31:07,016] Trial 156 finished with value: 0.7540843946554675 and parameters: {'model_name': 'KNNImputer', 'weights': 'uniform', 'keep_empty_features': False}. Best is trial 6 with value: 0.7540843946554675.
[I 2023-12-27 13:31:08,366] Trial 157 finished with value: 0.7613040782803697 and parameters: {'model_name': 'KNNImputer', 'weights': 'distance', 'keep_empty_features': False}. Best is trial 6 with value: 0.7540843946554675.
[I 2023-12-27 13:31:09,576] Trial 158 finished with value: 0.7540843946554675 and parameters: {'model_name': 'KNNImputer', 'weights': 'uniform', 'keep_empty_features': False}. Best is trial 6 with value: 0.7540843946554675.
[I 2023-12-27 13:31:10,862] Trial 29 finished with value: 1.1520136772788674 and parameters: {'model_name': 'IterativeImputer', 'sample_posterior': True, 'initial_strategy': 'mean', 'imputation_order': 'random'}. Best is trial 6 with value: 0.7540843946554675.
[I 2023-12-27 13:31:12,160] Trial 166 finished with value: 0.9432562910901344 and parameters: {'model_name': 'SimpleImputer', 'strategy': 'mean'}. Best is trial 6 with value: 0.7540843946554675.
[I 2023-12-27 13:31:13,080] Trial 159 finished with value: 0.7540843946554675 and parameters: {'model_name': 'KNNImputer', 'weights': 'uniform', 'keep_empty_features': False}. Best is trial 6 with value: 0.7540843946554675.
[I 2023-12-27 13:31:14,005] Trial 160 finished with value: 0.7540843946554675 and parameters: {'model_name': 'KNNImputer', 'weights': 'uniform', 'keep_empty_features': False}. Best is trial 6 with value: 0.7540843946554675.
[I 2023-12-27 13:31:15,473] Trial 161 finished with value: 0.7613040782803697 and parameters: {'model_name': 'KNNImputer', 'weights': 'distance', 'keep_empty_features': False}. Best is trial 6 with value: 0.7540843946554675.
[I 2023-12-27 13:31:16,623] Trial 162 finished with value: 0.7613040782803697 and parameters: {'model_name': 'KNNImputer', 'weights': 'distance', 'keep_empty_features': False}. Best is trial 6 with value: 0.7540843946554675.
[I 2023-12-27 13:31:17,869] Trial 60 finished with value: 1.1843824400291325 and parameters: {'model_name': 'IterativeImputer', 'sample_posterior': True, 'initial_strategy': 'constant', 'imputation_order': 'random'}. Best is trial 6 with value: 0.7540843946554675.
[I 2023-12-27 13:31:21,169] Trial 164 finished with value: 0.7540843946554675 and parameters: {'model_name': 'KNNImputer', 'weights': 'uniform', 'keep_empty_features': False}. Best is trial 6 with value: 0.7540843946554675.
[I 2023-12-27 13:31:22,008] Trial 165 finished with value: 0.7540843946554675 and parameters: {'model_name': 'KNNImputer', 'weights': 'uniform', 'keep_empty_features': False}. Best is trial 6 with value: 0.7540843946554675.
[I 2023-12-27 13:31:23,328] Trial 163 finished with value: 0.7613040782803697 and parameters: {'model_name': 'KNNImputer', 'weights': 'distance', 'keep_empty_features': False}. Best is trial 6 with value: 0.7540843946554675.
[I 2023-12-27 13:31:24,562] Trial 167 finished with value: 0.7540843946554675 and parameters: {'model_name': 'KNNImputer', 'weights': 'uniform', 'keep_empty_features': False}. Best is trial 6 with value: 0.7540843946554675.
[I 2023-12-27 13:31:26,148] Trial 170 finished with value: 0.7540843946554675 and parameters: {'model_name': 'KNNImputer', 'weights': 'uniform', 'keep_empty_features': False}. Best is trial 6 with value: 0.7540843946554675.
[I 2023-12-27 13:31:27,121] Trial 169 finished with value: 0.7540843946554675 and parameters: {'model_name': 'KNNImputer', 'weights': 'uniform', 'keep_empty_features': False}. Best is trial 6 with value: 0.7540843946554675.
[I 2023-12-27 13:31:27,964] Trial 168 finished with value: 0.7540843946554675 and parameters: {'model_name': 'KNNImputer', 'weights': 'uniform', 'keep_empty_features': False}. Best is trial 6 with value: 0.7540843946554675.
[I 2023-12-27 13:31:29,307] Trial 171 finished with value: 0.7540843946554675 and parameters: {'model_name': 'KNNImputer', 'weights': 'uniform', 'keep_empty_features': False}. Best is trial 6 with value: 0.7540843946554675.
[I 2023-12-27 13:31:31,188] Trial 173 finished with value: 0.7540843946554675 and parameters: {'model_name': 'KNNImputer', 'weights': 'uniform', 'keep_empty_features': False}. Best is trial 6 with value: 0.7540843946554675.
[I 2023-12-27 13:31:32,049] Trial 172 finished with value: 0.7540843946554675 and parameters: {'model_name': 'KNNImputer', 'weights': 'uniform', 'keep_empty_features': False}. Best is trial 6 with value: 0.7540843946554675.
[I 2023-12-27 13:31:35,200] Trial 175 finished with value: 0.7540843946554675 and parameters: {'model_name': 'KNNImputer', 'weights': 'uniform', 'keep_empty_features': False}. Best is trial 6 with value: 0.7540843946554675.
[I 2023-12-27 13:31:36,051] Trial 174 finished with value: 0.7540843946554675 and parameters: {'model_name': 'KNNImputer', 'weights': 'uniform', 'keep_empty_features': False}. Best is trial 6 with value: 0.7540843946554675.
[I 2023-12-27 13:31:37,563] Trial 177 finished with value: 0.7540843946554675 and parameters: {'model_name': 'KNNImputer', 'weights': 'uniform', 'keep_empty_features': False}. Best is trial 6 with value: 0.7540843946554675.
[I 2023-12-27 13:31:39,179] Trial 178 finished with value: 0.7540843946554675 and parameters: {'model_name': 'KNNImputer', 'weights': 'uniform', 'keep_empty_features': False}. Best is trial 6 with value: 0.7540843946554675.
[I 2023-12-27 13:31:40,098] Trial 72 finished with value: 2.590790117388495 and parameters: {'model_name': 'GAIN', 'batch_size': 123, 'hint_rate': 0.56, 'alpha': 48, 'iterations': 37}. Best is trial 6 with value: 0.7540843946554675.
[I 2023-12-27 13:31:41,967] Trial 70 finished with value: 2.4346714916879426 and parameters: {'model_name': 'GAIN', 'batch_size': 261, 'hint_rate': 0.09, 'alpha': 43, 'iterations': 37}. Best is trial 6 with value: 0.7540843946554675.
[I 2023-12-27 13:31:43,971] Trial 185 finished with value: 0.7540843946554675 and parameters: {'model_name': 'KNNImputer', 'weights': 'uniform', 'keep_empty_features': False}. Best is trial 6 with value: 0.7540843946554675.
[I 2023-12-27 13:31:46,103] Trial 188 finished with value: 0.7540843946554675 and parameters: {'model_name': 'KNNImputer', 'weights': 'uniform', 'keep_empty_features': False}. Best is trial 6 with value: 0.7540843946554675.
[I 2023-12-27 13:31:47,929] Trial 189 finished with value: 0.7540843946554675 and parameters: {'model_name': 'KNNImputer', 'weights': 'uniform', 'keep_empty_features': False}. Best is trial 6 with value: 0.7540843946554675.
[I 2023-12-27 13:31:49,835] Trial 190 finished with value: 0.7540843946554675 and parameters: {'model_name': 'KNNImputer', 'weights': 'uniform', 'keep_empty_features': False}. Best is trial 6 with value: 0.7540843946554675.
[I 2023-12-27 13:31:52,478] Trial 191 finished with value: 0.7540843946554675 and parameters: {'model_name': 'KNNImputer', 'weights': 'uniform', 'keep_empty_features': False}. Best is trial 6 with value: 0.7540843946554675.
[I 2023-12-27 13:31:54,749] Trial 192 finished with value: 0.7540843946554675 and parameters: {'model_name': 'KNNImputer', 'weights': 'uniform', 'keep_empty_features': False}. Best is trial 6 with value: 0.7540843946554675.
[I 2023-12-27 13:31:55,843] Trial 193 finished with value: 0.7540843946554675 and parameters: {'model_name': 'KNNImputer', 'weights': 'uniform', 'keep_empty_features': False}. Best is trial 6 with value: 0.7540843946554675.
[I 2023-12-27 13:32:08,176] Trial 194 finished with value: 0.8427854726638199 and parameters: {'model_name': 'IterativeImputer', 'sample_posterior': False, 'initial_strategy': 'most_frequent', 'imputation_order': 'roman'}. Best is trial 6 with value: 0.7540843946554675.
[I 2023-12-27 13:32:10,262] Trial 195 finished with value: 0.8427854726638199 and parameters: {'model_name': 'IterativeImputer', 'sample_posterior': False, 'initial_strategy': 'most_frequent', 'imputation_order': 'roman'}. Best is trial 6 with value: 0.7540843946554675.
[I 2023-12-27 13:32:11,464] Trial 196 finished with value: 0.8427854726638199 and parameters: {'model_name': 'IterativeImputer', 'sample_posterior': False, 'initial_strategy': 'median', 'imputation_order': 'roman'}. Best is trial 6 with value: 0.7540843946554675.
[I 2023-12-27 13:32:14,434] Trial 197 finished with value: 0.7540843946554675 and parameters: {'model_name': 'KNNImputer', 'weights': 'uniform', 'keep_empty_features': False}. Best is trial 6 with value: 0.7540843946554675.
[I 2023-12-27 13:32:16,333] Trial 198 finished with value: 0.7540843946554675 and parameters: {'model_name': 'KNNImputer', 'weights': 'uniform', 'keep_empty_features': False}. Best is trial 6 with value: 0.7540843946554675.
[I 2023-12-27 13:32:17,873] Trial 199 finished with value: 0.7540843946554675 and parameters: {'model_name': 'KNNImputer', 'weights': 'uniform', 'keep_empty_features': False}. Best is trial 6 with value: 0.7540843946554675.
[I 2023-12-27 13:32:20,010] Trial 127 finished with value: 1.1466171323738914 and parameters: {'model_name': 'IterativeImputer', 'sample_posterior': True, 'initial_strategy': 'median', 'imputation_order': 'roman'}. Best is trial 6 with value: 0.7540843946554675.
[I 2023-12-27 13:32:21,682] Trial 124 finished with value: 1.15963987882953 and parameters: {'model_name': 'IterativeImputer', 'sample_posterior': True, 'initial_strategy': 'median', 'imputation_order': 'roman'}. Best is trial 6 with value: 0.7540843946554675.
[I 2023-12-27 13:32:23,228] Trial 131 finished with value: 1.1681428318723592 and parameters: {'model_name': 'IterativeImputer', 'sample_posterior': True, 'initial_strategy': 'median', 'imputation_order': 'roman'}. Best is trial 6 with value: 0.7540843946554675.
[I 2023-12-27 13:32:24,178] Trial 125 finished with value: 1.172421581837657 and parameters: {'model_name': 'IterativeImputer', 'sample_posterior': True, 'initial_strategy': 'median', 'imputation_order': 'roman'}. Best is trial 6 with value: 0.7540843946554675.
[I 2023-12-27 13:32:25,096] Trial 126 finished with value: 1.18134916871394 and parameters: {'model_name': 'IterativeImputer', 'sample_posterior': True, 'initial_strategy': 'median', 'imputation_order': 'roman'}. Best is trial 6 with value: 0.7540843946554675.
[I 2023-12-27 13:32:25,901] Trial 128 finished with value: 1.1515662560934004 and parameters: {'model_name': 'IterativeImputer', 'sample_posterior': True, 'initial_strategy': 'median', 'imputation_order': 'roman'}. Best is trial 6 with value: 0.7540843946554675.
[I 2023-12-27 13:32:26,664] Trial 129 finished with value: 1.1384627110604653 and parameters: {'model_name': 'IterativeImputer', 'sample_posterior': True, 'initial_strategy': 'median', 'imputation_order': 'roman'}. Best is trial 6 with value: 0.7540843946554675.
[I 2023-12-27 13:32:27,758] Trial 130 finished with value: 1.1487413519056917 and parameters: {'model_name': 'IterativeImputer', 'sample_posterior': True, 'initial_strategy': 'median', 'imputation_order': 'roman'}. Best is trial 6 with value: 0.7540843946554675.
[I 2023-12-27 13:32:30,674] Trial 134 finished with value: 1.2244302985276918 and parameters: {'model_name': 'IterativeImputer', 'sample_posterior': True, 'initial_strategy': 'median', 'imputation_order': 'roman'}. Best is trial 6 with value: 0.7540843946554675.
[I 2023-12-27 13:32:31,921] Trial 133 finished with value: 1.1872542685018947 and parameters: {'model_name': 'IterativeImputer', 'sample_posterior': True, 'initial_strategy': 'median', 'imputation_order': 'roman'}. Best is trial 6 with value: 0.7540843946554675.
[I 2023-12-27 13:32:36,392] Trial 135 finished with value: 1.1468714372621873 and parameters: {'model_name': 'IterativeImputer', 'sample_posterior': True, 'initial_strategy': 'median', 'imputation_order': 'roman'}. Best is trial 6 with value: 0.7540843946554675.
[I 2023-12-27 13:32:38,817] Trial 136 finished with value: 1.1717926287969704 and parameters: {'model_name': 'IterativeImputer', 'sample_posterior': True, 'initial_strategy': 'median', 'imputation_order': 'roman'}. Best is trial 6 with value: 0.7540843946554675.
[I 2023-12-27 13:32:41,433] Trial 137 finished with value: 1.1637671881568823 and parameters: {'model_name': 'IterativeImputer', 'sample_posterior': True, 'initial_strategy': 'median', 'imputation_order': 'roman'}. Best is trial 6 with value: 0.7540843946554675.
[I 2023-12-27 13:32:43,390] Trial 35 finished with value: inf and parameters: {'model_name': 'GAIN', 'batch_size': 442, 'hint_rate': 0.06999999999999999, 'alpha': 45, 'iterations': 961}. Best is trial 6 with value: 0.7540843946554675.
[I 2023-12-27 13:32:44,408] Trial 138 finished with value: 1.1588149195300381 and parameters: {'model_name': 'IterativeImputer', 'sample_posterior': True, 'initial_strategy': 'median', 'imputation_order': 'roman'}. Best is trial 6 with value: 0.7540843946554675.
[I 2023-12-27 13:32:46,260] Trial 80 finished with value: 2.420145470563292 and parameters: {'model_name': 'GAIN', 'batch_size': 164, 'hint_rate': 0.21000000000000002, 'alpha': 95, 'iterations': 69}. Best is trial 6 with value: 0.7540843946554675.
[I 2023-12-27 13:32:48,861] Trial 79 finished with value: inf and parameters: {'model_name': 'GAIN', 'batch_size': 72, 'hint_rate': 0.19, 'alpha': 48, 'iterations': 452}. Best is trial 6 with value: 0.7540843946554675.
[I 2023-12-27 13:32:51,181] Trial 69 finished with value: 2.196092741347721 and parameters: {'model_name': 'GAIN', 'batch_size': 51, 'hint_rate': 0.9500000000000001, 'alpha': 91, 'iterations': 87}. Best is trial 6 with value: 0.7540843946554675.
[I 2023-12-27 13:33:03,604] Trial 41 finished with value: 0.944397508161655 and parameters: {'model_name': 'RandomForestImputer', 'max_iter': 34, 'decreasing': False, 'min_samples_split': 0.7000000000000001, 'min_samples_leaf': 0.8, 'max_features': 0.5, 'warm_start': False}. Best is trial 6 with value: 0.7540843946554675.
[I 2023-12-27 13:33:28,076] Trial 75 finished with value: 1.720096369130872 and parameters: {'model_name': 'GAIN', 'batch_size': 19, 'hint_rate': 0.08, 'alpha': 78, 'iterations': 174}. Best is trial 6 with value: 0.7540843946554675.
[I 2023-12-27 13:34:01,163] Trial 9 finished with value: 0.9443272840891043 and parameters: {'model_name': 'RandomForestImputer', 'max_iter': 63, 'decreasing': False, 'min_samples_split': 0.30000000000000004, 'min_samples_leaf': 0.9, 'max_features': 0.5, 'warm_start': False}. Best is trial 6 with value: 0.7540843946554675.
[I 2023-12-27 13:34:22,172] Trial 68 finished with value: 1.3652478528110348 and parameters: {'model_name': 'GAIN', 'batch_size': 2, 'hint_rate': 0.13, 'alpha': 19, 'iterations': 365}. Best is trial 6 with value: 0.7540843946554675.
[I 2023-12-27 13:35:40,074] Trial 76 finished with value: 1.2268322505258766 and parameters: {'model_name': 'GAIN', 'batch_size': 8, 'hint_rate': 0.8, 'alpha': 38, 'iterations': 628}. Best is trial 6 with value: 0.7540843946554675.
[I 2023-12-27 13:36:22,466] Trial 27 finished with value: inf and parameters: {'model_name': 'GAIN', 'batch_size': 698, 'hint_rate': 0.55, 'alpha': 85, 'iterations': 6344}. Best is trial 6 with value: 0.7540843946554675.
[I 2023-12-27 13:37:37,872] Trial 50 finished with value: inf and parameters: {'model_name': 'GAIN', 'batch_size': 1, 'hint_rate': 0.52, 'alpha': 20, 'iterations': 11407}. Best is trial 6 with value: 0.7540843946554675.
[I 2023-12-27 13:38:02,453] Trial 18 finished with value: inf and parameters: {'model_name': 'GAIN', 'batch_size': 22, 'hint_rate': 0.88, 'alpha': 38, 'iterations': 1360}. Best is trial 6 with value: 0.7540843946554675.
