[I 2024-04-21 22:08:22,586] Trial 187 finished with value: 367.25065012376893 and parameters: {'model_name': 'RandomForestImputer', 'max_iter': 78, 'decreasing': False, 'min_samples_split': 1.0, 'min_samples_leaf': 0.1, 'max_features': 0.4, 'warm_start': False}. Best is trial 125 with value: 226.62681345885875.
[I 2024-04-21 22:08:27,351] Trial 193 finished with value: 367.21960346780656 and parameters: {'model_name': 'RandomForestImputer', 'max_iter': 86, 'decreasing': False, 'min_samples_split': 0.0, 'min_samples_leaf': 0.8, 'max_features': 0.4, 'warm_start': False}. Best is trial 125 with value: 226.62681345885875.
[I 2024-04-21 22:09:01,233] Trial 197 finished with value: 367.20497140628675 and parameters: {'model_name': 'RandomForestImputer', 'max_iter': 74, 'decreasing': False, 'min_samples_split': 0.0, 'min_samples_leaf': 0.1, 'max_features': 0.4, 'warm_start': False}. Best is trial 125 with value: 226.62681345885875.
[I 2024-04-21 22:09:08,645] Trial 194 finished with value: 367.2404765210905 and parameters: {'model_name': 'RandomForestImputer', 'max_iter': 77, 'decreasing': False, 'min_samples_split': 0.5, 'min_samples_leaf': 0.1, 'max_features': 0.4, 'warm_start': False}. Best is trial 125 with value: 226.62681345885875.
[I 2024-04-21 22:09:10,967] Trial 186 finished with value: 367.2649166646323 and parameters: {'model_name': 'RandomForestImputer', 'max_iter': 92, 'decreasing': False, 'min_samples_split': 0.0, 'min_samples_leaf': 0.1, 'max_features': 0.4, 'warm_start': False}. Best is trial 125 with value: 226.62681345885875.
[I 2024-04-21 22:09:14,550] Trial 190 finished with value: 367.2038723872835 and parameters: {'model_name': 'RandomForestImputer', 'max_iter': 88, 'decreasing': False, 'min_samples_split': 0.0, 'min_samples_leaf': 0.1, 'max_features': 0.4, 'warm_start': False}. Best is trial 125 with value: 226.62681345885875.
[I 2024-04-21 22:09:22,994] Trial 195 finished with value: 367.1692958026657 and parameters: {'model_name': 'RandomForestImputer', 'max_iter': 86, 'decreasing': False, 'min_samples_split': 0.0, 'min_samples_leaf': 0.1, 'max_features': 0.4, 'warm_start': False}. Best is trial 125 with value: 226.62681345885875.
[I 2024-04-21 22:09:24,905] Trial 183 finished with value: 367.1861822621151 and parameters: {'model_name': 'RandomForestImputer', 'max_iter': 97, 'decreasing': False, 'min_samples_split': 1.0, 'min_samples_leaf': 0.1, 'max_features': 0.4, 'warm_start': False}. Best is trial 125 with value: 226.62681345885875.
[I 2024-04-21 22:09:29,337] Trial 185 finished with value: 367.1756786710551 and parameters: {'model_name': 'RandomForestImputer', 'max_iter': 78, 'decreasing': False, 'min_samples_split': 0.0, 'min_samples_leaf': 0.1, 'max_features': 0.4, 'warm_start': False}. Best is trial 125 with value: 226.62681345885875.
[I 2024-04-21 22:09:30,996] Trial 188 finished with value: 367.15155723412494 and parameters: {'model_name': 'RandomForestImputer', 'max_iter': 93, 'decreasing': False, 'min_samples_split': 0.0, 'min_samples_leaf': 0.1, 'max_features': 0.4, 'warm_start': False}. Best is trial 125 with value: 226.62681345885875.
[I 2024-04-21 22:10:03,241] Trial 83 finished with value: 349.7448987318615 and parameters: {'model_name': 'GAIN', 'batch_size': 5, 'hint_rate': 0.6900000000000001, 'alpha': 94, 'iterations': 1217}. Best is trial 125 with value: 226.62681345885875.
[I 2024-04-21 22:10:18,244] Trial 196 finished with value: 367.20460752043243 and parameters: {'model_name': 'RandomForestImputer', 'max_iter': 95, 'decreasing': False, 'min_samples_split': 0.0, 'min_samples_leaf': 0.1, 'max_features': 0.4, 'warm_start': False}. Best is trial 125 with value: 226.62681345885875.
[I 2024-04-21 22:10:25,784] Trial 84 finished with value: 330.71331683097276 and parameters: {'model_name': 'GAIN', 'batch_size': 2, 'hint_rate': 0.79, 'alpha': 77, 'iterations': 1313}. Best is trial 125 with value: 226.62681345885875.
[I 2024-04-21 22:10:45,908] Trial 15 finished with value: 346.5068167266124 and parameters: {'model_name': 'GAIN', 'batch_size': 49, 'hint_rate': 0.8400000000000001, 'alpha': 95, 'iterations': 1295}. Best is trial 125 with value: 226.62681345885875.
[I 2024-04-21 22:13:11,607] Trial 54 finished with value: 365.27552816841944 and parameters: {'model_name': 'GAIN', 'batch_size': 72, 'hint_rate': 0.91, 'alpha': 81, 'iterations': 2231}. Best is trial 125 with value: 226.62681345885875.
[I 2024-04-21 22:13:12,841] Trial 98 finished with value: inf and parameters: {'model_name': 'GAIN', 'batch_size': 118, 'hint_rate': 0.34, 'alpha': 80, 'iterations': 5522}. Best is trial 125 with value: 226.62681345885875.
[I 2024-04-21 22:13:17,988] Trial 61 finished with value: 335.2004475885932 and parameters: {'model_name': 'GAIN', 'batch_size': 10, 'hint_rate': 0.29000000000000004, 'alpha': 77, 'iterations': 2608}. Best is trial 125 with value: 226.62681345885875.
[I 2024-04-21 22:15:08,265] Trial 32 finished with value: inf and parameters: {'model_name': 'GAIN', 'batch_size': 4, 'hint_rate': 0.56, 'alpha': 57, 'iterations': 38982}. Best is trial 125 with value: 226.62681345885875.
[I 2024-04-21 22:16:27,604] Trial 47 finished with value: inf and parameters: {'model_name': 'GAIN', 'batch_size': 63, 'hint_rate': 0.06999999999999999, 'alpha': 61, 'iterations': 15365}. Best is trial 125 with value: 226.62681345885875.
[I 2024-04-21 22:18:01,530] Trial 58 finished with value: 336.1481841773048 and parameters: {'model_name': 'GAIN', 'batch_size': 3, 'hint_rate': 0.09999999999999999, 'alpha': 22, 'iterations': 6447}. Best is trial 125 with value: 226.62681345885875.
[I 2024-04-21 22:19:59,284] Trial 97 finished with value: inf and parameters: {'model_name': 'GAIN', 'batch_size': 866, 'hint_rate': 0.8400000000000001, 'alpha': 48, 'iterations': 55565}. Best is trial 125 with value: 226.62681345885875.
[I 2024-04-21 22:20:27,255] Trial 88 finished with value: inf and parameters: {'model_name': 'GAIN', 'batch_size': 8, 'hint_rate': 0.8400000000000001, 'alpha': 35, 'iterations': 22212}. Best is trial 125 with value: 226.62681345885875.
[I 2024-04-21 22:20:50,724] Trial 95 finished with value: 364.9127687325264 and parameters: {'model_name': 'GAIN', 'batch_size': 17, 'hint_rate': 0.42000000000000004, 'alpha': 13, 'iterations': 11974}. Best is trial 125 with value: 226.62681345885875.
