[I 2023-12-28 08:54:47,092] Trial 184 finished with value: 1.4056518446594208 and parameters: {'model_name': 'IterativeImputer', 'sample_posterior': False, 'initial_strategy': 'most_frequent', 'imputation_order': 'roman'}. Best is trial 19 with value: 1.4056518446594208.
[I 2023-12-28 08:54:47,940] Trial 134 finished with value: 2.1934161660807754 and parameters: {'model_name': 'IterativeImputer', 'sample_posterior': True, 'initial_strategy': 'mean', 'imputation_order': 'roman'}. Best is trial 19 with value: 1.4056518446594208.
[I 2023-12-28 08:54:48,598] Trial 179 finished with value: 1.4056536068679288 and parameters: {'model_name': 'IterativeImputer', 'sample_posterior': False, 'initial_strategy': 'most_frequent', 'imputation_order': 'ascending'}. Best is trial 19 with value: 1.4056518446594208.
[I 2023-12-28 08:54:51,719] Trial 180 finished with value: 1.4056532571569218 and parameters: {'model_name': 'IterativeImputer', 'sample_posterior': False, 'initial_strategy': 'most_frequent', 'imputation_order': 'random'}. Best is trial 19 with value: 1.4056518446594208.
[I 2023-12-28 08:54:52,686] Trial 185 finished with value: 1.4056518446594208 and parameters: {'model_name': 'IterativeImputer', 'sample_posterior': False, 'initial_strategy': 'most_frequent', 'imputation_order': 'roman'}. Best is trial 19 with value: 1.4056518446594208.
[I 2023-12-28 08:54:53,360] Trial 188 finished with value: 1.4056518446594208 and parameters: {'model_name': 'IterativeImputer', 'sample_posterior': False, 'initial_strategy': 'most_frequent', 'imputation_order': 'roman'}. Best is trial 19 with value: 1.4056518446594208.
[I 2023-12-28 08:54:54,100] Trial 181 finished with value: 1.4056550969382575 and parameters: {'model_name': 'IterativeImputer', 'sample_posterior': False, 'initial_strategy': 'most_frequent', 'imputation_order': 'random'}. Best is trial 19 with value: 1.4056518446594208.
[I 2023-12-28 08:54:55,304] Trial 182 finished with value: 1.4056536068679288 and parameters: {'model_name': 'IterativeImputer', 'sample_posterior': False, 'initial_strategy': 'most_frequent', 'imputation_order': 'ascending'}. Best is trial 19 with value: 1.4056518446594208.
[I 2023-12-28 08:54:56,077] Trial 183 finished with value: 1.4056538708623474 and parameters: {'model_name': 'IterativeImputer', 'sample_posterior': False, 'initial_strategy': 'most_frequent', 'imputation_order': 'random'}. Best is trial 19 with value: 1.4056518446594208.
[I 2023-12-28 08:54:57,560] Trial 135 finished with value: 2.2266681032276616 and parameters: {'model_name': 'IterativeImputer', 'sample_posterior': True, 'initial_strategy': 'mean', 'imputation_order': 'roman'}. Best is trial 19 with value: 1.4056518446594208.
[I 2023-12-28 08:54:59,409] Trial 191 finished with value: 1.4056518446594208 and parameters: {'model_name': 'IterativeImputer', 'sample_posterior': False, 'initial_strategy': 'most_frequent', 'imputation_order': 'roman'}. Best is trial 19 with value: 1.4056518446594208.
[I 2023-12-28 08:55:00,144] Trial 186 finished with value: 1.4056540956703363 and parameters: {'model_name': 'IterativeImputer', 'sample_posterior': False, 'initial_strategy': 'most_frequent', 'imputation_order': 'random'}. Best is trial 19 with value: 1.4056518446594208.
[I 2023-12-28 08:55:00,908] Trial 190 finished with value: 1.4056527484465717 and parameters: {'model_name': 'IterativeImputer', 'sample_posterior': False, 'initial_strategy': 'most_frequent', 'imputation_order': 'random'}. Best is trial 19 with value: 1.4056518446594208.
[I 2023-12-28 08:55:01,646] Trial 192 finished with value: 1.4056518446594208 and parameters: {'model_name': 'IterativeImputer', 'sample_posterior': False, 'initial_strategy': 'most_frequent', 'imputation_order': 'roman'}. Best is trial 19 with value: 1.4056518446594208.
[I 2023-12-28 08:55:02,371] Trial 187 finished with value: 1.4056527881822436 and parameters: {'model_name': 'IterativeImputer', 'sample_posterior': False, 'initial_strategy': 'most_frequent', 'imputation_order': 'random'}. Best is trial 19 with value: 1.4056518446594208.
[I 2023-12-28 08:55:03,729] Trial 64 finished with value: 1.4135387322623507 and parameters: {'model_name': 'RandomForestImputer', 'max_iter': 12, 'decreasing': True, 'min_samples_split': 0.30000000000000004, 'min_samples_leaf': 0.4, 'max_features': 0.30000000000000004, 'warm_start': False}. Best is trial 19 with value: 1.4056518446594208.
[I 2023-12-28 08:55:04,412] Trial 189 finished with value: 1.405654227938788 and parameters: {'model_name': 'IterativeImputer', 'sample_posterior': False, 'initial_strategy': 'most_frequent', 'imputation_order': 'random'}. Best is trial 19 with value: 1.4056518446594208.
[I 2023-12-28 08:55:05,996] Trial 193 finished with value: 1.4056528573840235 and parameters: {'model_name': 'IterativeImputer', 'sample_posterior': False, 'initial_strategy': 'constant', 'imputation_order': 'random'}. Best is trial 19 with value: 1.4056518446594208.
[I 2023-12-28 08:55:07,099] Trial 196 finished with value: 1.405652880321094 and parameters: {'model_name': 'IterativeImputer', 'sample_posterior': False, 'initial_strategy': 'most_frequent', 'imputation_order': 'random'}. Best is trial 19 with value: 1.4056518446594208.
[I 2023-12-28 08:55:08,396] Trial 59 finished with value: 1.4119714779944053 and parameters: {'model_name': 'RandomForestImputer', 'max_iter': 18, 'decreasing': False, 'min_samples_split': 0.4, 'min_samples_leaf': 0.7000000000000001, 'max_features': 0.2, 'warm_start': False}. Best is trial 19 with value: 1.4056518446594208.
[I 2023-12-28 08:55:09,255] Trial 194 finished with value: 1.405653539159811 and parameters: {'model_name': 'IterativeImputer', 'sample_posterior': False, 'initial_strategy': 'constant', 'imputation_order': 'random'}. Best is trial 19 with value: 1.4056518446594208.
[I 2023-12-28 08:55:09,915] Trial 199 finished with value: 1.4056531969893853 and parameters: {'model_name': 'IterativeImputer', 'sample_posterior': False, 'initial_strategy': 'most_frequent', 'imputation_order': 'random'}. Best is trial 19 with value: 1.4056518446594208.
[I 2023-12-28 08:55:10,542] Trial 136 finished with value: 2.2229508199685197 and parameters: {'model_name': 'IterativeImputer', 'sample_posterior': True, 'initial_strategy': 'most_frequent', 'imputation_order': 'roman'}. Best is trial 19 with value: 1.4056518446594208.
[I 2023-12-28 08:55:11,114] Trial 195 finished with value: 1.4056535769551632 and parameters: {'model_name': 'IterativeImputer', 'sample_posterior': False, 'initial_strategy': 'constant', 'imputation_order': 'roman'}. Best is trial 19 with value: 1.4056518446594208.
[I 2023-12-28 08:55:12,064] Trial 198 finished with value: 1.4056535769551632 and parameters: {'model_name': 'IterativeImputer', 'sample_posterior': False, 'initial_strategy': 'constant', 'imputation_order': 'roman'}. Best is trial 19 with value: 1.4056518446594208.
[I 2023-12-28 08:55:16,280] Trial 69 finished with value: 2.1916112404207126 and parameters: {'model_name': 'GAIN', 'batch_size': 6, 'hint_rate': 0.6, 'alpha': 62, 'iterations': 255}. Best is trial 19 with value: 1.4056518446594208.
[I 2023-12-28 08:55:16,861] Trial 63 finished with value: 2.941093673975402 and parameters: {'model_name': 'GAIN', 'batch_size': 1, 'hint_rate': 0.8300000000000001, 'alpha': 1, 'iterations': 257}. Best is trial 19 with value: 1.4056518446594208.
[I 2023-12-28 08:55:25,396] Trial 137 finished with value: 2.1663259389678307 and parameters: {'model_name': 'IterativeImputer', 'sample_posterior': True, 'initial_strategy': 'mean', 'imputation_order': 'roman'}. Best is trial 19 with value: 1.4056518446594208.
[I 2023-12-28 08:55:26,292] Trial 138 finished with value: 2.1965251718355505 and parameters: {'model_name': 'IterativeImputer', 'sample_posterior': True, 'initial_strategy': 'mean', 'imputation_order': 'roman'}. Best is trial 19 with value: 1.4056518446594208.
[I 2023-12-28 08:55:28,690] Trial 140 finished with value: 2.1584595335613366 and parameters: {'model_name': 'IterativeImputer', 'sample_posterior': True, 'initial_strategy': 'mean', 'imputation_order': 'roman'}. Best is trial 19 with value: 1.4056518446594208.
[I 2023-12-28 08:55:29,180] Trial 139 finished with value: 2.194264115694702 and parameters: {'model_name': 'IterativeImputer', 'sample_posterior': True, 'initial_strategy': 'mean', 'imputation_order': 'roman'}. Best is trial 19 with value: 1.4056518446594208.
[I 2023-12-28 08:56:18,917] Trial 68 finished with value: inf and parameters: {'model_name': 'GAIN', 'batch_size': 640, 'hint_rate': 0.88, 'alpha': 20, 'iterations': 6886}. Best is trial 19 with value: 1.4056518446594208.
[I 2023-12-28 08:56:44,366] Trial 34 finished with value: 1.637194300979973 and parameters: {'model_name': 'GAIN', 'batch_size': 1, 'hint_rate': 0.09, 'alpha': 11, 'iterations': 1658}. Best is trial 19 with value: 1.4056518446594208.
[I 2023-12-28 08:56:45,710] Trial 70 finished with value: 1.4128372742776532 and parameters: {'model_name': 'RandomForestImputer', 'max_iter': 87, 'decreasing': False, 'min_samples_split': 0.4, 'min_samples_leaf': 0.1, 'max_features': 0.1, 'warm_start': False}. Best is trial 19 with value: 1.4056518446594208.
