[I 2024-02-28 20:08:08,443] Trial 96 finished with value: 4.576578667747333 and parameters: {'model_name': 'GAIN', 'batch_size': 1, 'hint_rate': 0.99, 'alpha': 98, 'iterations': 163}. Best is trial 113 with value: 4.044652783611778.
[I 2024-02-28 20:08:13,146] Trial 110 finished with value: 4.70836631624063 and parameters: {'model_name': 'GAIN', 'batch_size': 2, 'hint_rate': 0.77, 'alpha': 74, 'iterations': 91}. Best is trial 113 with value: 4.044652783611778.
[I 2024-02-28 20:09:04,584] Trial 80 finished with value: 4.1373167266773665 and parameters: {'model_name': 'GAIN', 'batch_size': 19, 'hint_rate': 0.53, 'alpha': 23, 'iterations': 218}. Best is trial 113 with value: 4.044652783611778.
[I 2024-02-28 20:09:07,477] Trial 116 finished with value: 4.653867606296087 and parameters: {'model_name': 'GAIN', 'batch_size': 1, 'hint_rate': 0.7000000000000001, 'alpha': 72, 'iterations': 101}. Best is trial 113 with value: 4.044652783611778.
[I 2024-02-28 20:09:09,814] Trial 119 finished with value: 4.336153319443506 and parameters: {'model_name': 'GAIN', 'batch_size': 1, 'hint_rate': 0.75, 'alpha': 71, 'iterations': 87}. Best is trial 113 with value: 4.044652783611778.
[I 2024-02-28 20:09:13,945] Trial 117 finished with value: 4.34486821494285 and parameters: {'model_name': 'GAIN', 'batch_size': 1, 'hint_rate': 0.68, 'alpha': 77, 'iterations': 92}. Best is trial 113 with value: 4.044652783611778.
[I 2024-02-28 20:11:00,270] Trial 73 finished with value: 4.535808146147236 and parameters: {'model_name': 'RandomForestImputer', 'max_iter': 26, 'decreasing': True, 'min_samples_split': 0.30000000000000004, 'min_samples_leaf': 0.5, 'max_features': 0.1, 'warm_start': False}. Best is trial 113 with value: 4.044652783611778.
[I 2024-02-28 20:11:59,894] Trial 120 finished with value: 4.394803644814361 and parameters: {'model_name': 'GAIN', 'batch_size': 2, 'hint_rate': 0.8, 'alpha': 70, 'iterations': 241}. Best is trial 113 with value: 4.044652783611778.
[I 2024-02-28 20:12:11,491] Trial 27 finished with value: 4.537226941435017 and parameters: {'model_name': 'RandomForestImputer', 'max_iter': 33, 'decreasing': False, 'min_samples_split': 1.0, 'min_samples_leaf': 0.6, 'max_features': 0.4, 'warm_start': False}. Best is trial 113 with value: 4.044652783611778.
[I 2024-02-28 20:12:31,660] Trial 126 finished with value: 4.181426793353835 and parameters: {'model_name': 'GAIN', 'batch_size': 1, 'hint_rate': 0.8300000000000001, 'alpha': 22, 'iterations': 234}. Best is trial 113 with value: 4.044652783611778.
[I 2024-02-28 20:12:50,074] Trial 34 finished with value: 4.538562397250646 and parameters: {'model_name': 'RandomForestImputer', 'max_iter': 32, 'decreasing': True, 'min_samples_split': 0.30000000000000004, 'min_samples_leaf': 0.9, 'max_features': 0.7000000000000001, 'warm_start': False}. Best is trial 113 with value: 4.044652783611778.
[I 2024-02-28 20:12:53,195] Trial 11 finished with value: 4.537547204871701 and parameters: {'model_name': 'RandomForestImputer', 'max_iter': 42, 'decreasing': True, 'min_samples_split': 0.0, 'min_samples_leaf': 0.5, 'max_features': 0.6, 'warm_start': False}. Best is trial 113 with value: 4.044652783611778.
[I 2024-02-28 20:13:02,790] Trial 128 finished with value: 4.115677685524636 and parameters: {'model_name': 'GAIN', 'batch_size': 1, 'hint_rate': 0.8400000000000001, 'alpha': 21, 'iterations': 261}. Best is trial 113 with value: 4.044652783611778.
[I 2024-02-28 20:13:14,004] Trial 122 finished with value: 4.2510554597600985 and parameters: {'model_name': 'GAIN', 'batch_size': 1, 'hint_rate': 0.8400000000000001, 'alpha': 27, 'iterations': 272}. Best is trial 113 with value: 4.044652783611778.
[I 2024-02-28 20:13:25,141] Trial 133 finished with value: 4.109282765450005 and parameters: {'model_name': 'GAIN', 'batch_size': 1, 'hint_rate': 0.81, 'alpha': 85, 'iterations': 250}. Best is trial 113 with value: 4.044652783611778.
[I 2024-02-28 20:13:30,431] Trial 89 finished with value: 4.538581827266003 and parameters: {'model_name': 'RandomForestImputer', 'max_iter': 29, 'decreasing': True, 'min_samples_split': 1.0, 'min_samples_leaf': 0.9, 'max_features': 0.1, 'warm_start': False}. Best is trial 113 with value: 4.044652783611778.
[I 2024-02-28 20:13:35,049] Trial 124 finished with value: 4.323061366348383 and parameters: {'model_name': 'GAIN', 'batch_size': 1, 'hint_rate': 0.8300000000000001, 'alpha': 28, 'iterations': 279}. Best is trial 113 with value: 4.044652783611778.
[I 2024-02-28 20:13:44,359] Trial 94 finished with value: inf and parameters: {'model_name': 'GAIN', 'batch_size': 828, 'hint_rate': 0.9600000000000001, 'alpha': 57, 'iterations': 3490}. Best is trial 113 with value: 4.044652783611778.
[I 2024-02-28 20:13:47,823] Trial 121 finished with value: 4.042831244100165 and parameters: {'model_name': 'GAIN', 'batch_size': 1, 'hint_rate': 0.8200000000000001, 'alpha': 27, 'iterations': 305}. Best is trial 121 with value: 4.042831244100165.
[I 2024-02-28 20:13:53,899] Trial 134 finished with value: 4.330027614330745 and parameters: {'model_name': 'GAIN', 'batch_size': 1, 'hint_rate': 0.55, 'alpha': 24, 'iterations': 283}. Best is trial 121 with value: 4.042831244100165.
[I 2024-02-28 20:14:07,727] Trial 125 finished with value: 4.520828814793198 and parameters: {'model_name': 'GAIN', 'batch_size': 1, 'hint_rate': 0.81, 'alpha': 26, 'iterations': 311}. Best is trial 121 with value: 4.042831244100165.
[I 2024-02-28 20:14:28,478] Trial 123 finished with value: 4.50440799561059 and parameters: {'model_name': 'GAIN', 'batch_size': 1, 'hint_rate': 0.8200000000000001, 'alpha': 27, 'iterations': 329}. Best is trial 121 with value: 4.042831244100165.
[I 2024-02-28 20:14:54,284] Trial 127 finished with value: 4.252912244547194 and parameters: {'model_name': 'GAIN', 'batch_size': 2, 'hint_rate': 0.8300000000000001, 'alpha': 24, 'iterations': 345}. Best is trial 121 with value: 4.042831244100165.
[I 2024-02-28 20:14:57,658] Trial 129 finished with value: 4.1650579723432255 and parameters: {'model_name': 'GAIN', 'batch_size': 1, 'hint_rate': 0.8300000000000001, 'alpha': 23, 'iterations': 349}. Best is trial 121 with value: 4.042831244100165.
[I 2024-02-28 20:15:04,822] Trial 136 finished with value: 4.229831695267537 and parameters: {'model_name': 'GAIN', 'batch_size': 4, 'hint_rate': 0.55, 'alpha': 21, 'iterations': 338}. Best is trial 121 with value: 4.042831244100165.
[I 2024-02-28 20:15:12,168] Trial 79 finished with value: 4.40875734800921 and parameters: {'model_name': 'GAIN', 'batch_size': 28, 'hint_rate': 0.41000000000000003, 'alpha': 88, 'iterations': 499}. Best is trial 121 with value: 4.042831244100165.
[I 2024-02-28 20:15:38,830] Trial 132 finished with value: 4.432847253386277 and parameters: {'model_name': 'GAIN', 'batch_size': 1, 'hint_rate': 0.85, 'alpha': 64, 'iterations': 380}. Best is trial 121 with value: 4.042831244100165.
[I 2024-02-28 20:15:41,895] Trial 139 finished with value: 4.427209041720125 and parameters: {'model_name': 'GAIN', 'batch_size': 5, 'hint_rate': 0.55, 'alpha': 21, 'iterations': 308}. Best is trial 121 with value: 4.042831244100165.
[I 2024-02-28 20:15:47,333] Trial 130 finished with value: 4.524735139371493 and parameters: {'model_name': 'GAIN', 'batch_size': 1, 'hint_rate': 0.8300000000000001, 'alpha': 22, 'iterations': 385}. Best is trial 121 with value: 4.042831244100165.
[I 2024-02-28 20:16:03,685] Trial 72 finished with value: 4.530429498775805 and parameters: {'model_name': 'GAIN', 'batch_size': 658, 'hint_rate': 0.9400000000000001, 'alpha': 41, 'iterations': 456}. Best is trial 121 with value: 4.042831244100165.
[I 2024-02-28 20:16:11,651] Trial 140 finished with value: 4.291105942557144 and parameters: {'model_name': 'GAIN', 'batch_size': 4, 'hint_rate': 0.5700000000000001, 'alpha': 23, 'iterations': 339}. Best is trial 121 with value: 4.042831244100165.
[I 2024-02-28 20:16:25,848] Trial 135 finished with value: 4.350268373263657 and parameters: {'model_name': 'GAIN', 'batch_size': 4, 'hint_rate': 0.54, 'alpha': 21, 'iterations': 404}. Best is trial 121 with value: 4.042831244100165.
[I 2024-02-28 20:16:39,849] Trial 138 finished with value: 4.283163395505893 and parameters: {'model_name': 'GAIN', 'batch_size': 4, 'hint_rate': 0.52, 'alpha': 22, 'iterations': 364}. Best is trial 121 with value: 4.042831244100165.
[I 2024-02-28 20:16:48,799] Trial 131 finished with value: 4.416379890088534 and parameters: {'model_name': 'GAIN', 'batch_size': 1, 'hint_rate': 0.8200000000000001, 'alpha': 22, 'iterations': 432}. Best is trial 121 with value: 4.042831244100165.
[I 2024-02-28 20:17:30,754] Trial 14 finished with value: 4.536754160601719 and parameters: {'model_name': 'RandomForestImputer', 'max_iter': 45, 'decreasing': False, 'min_samples_split': 0.9, 'min_samples_leaf': 0.7000000000000001, 'max_features': 0.5, 'warm_start': False}. Best is trial 121 with value: 4.042831244100165.
[I 2024-02-28 20:17:37,346] Trial 91 finished with value: 4.538340281958418 and parameters: {'model_name': 'RandomForestImputer', 'max_iter': 46, 'decreasing': True, 'min_samples_split': 1.0, 'min_samples_leaf': 0.9, 'max_features': 0.1, 'warm_start': False}. Best is trial 121 with value: 4.042831244100165.
[I 2024-02-28 20:17:46,057] Trial 142 finished with value: 4.235540435925441 and parameters: {'model_name': 'GAIN', 'batch_size': 4, 'hint_rate': 0.54, 'alpha': 13, 'iterations': 269}. Best is trial 121 with value: 4.042831244100165.
[I 2024-02-28 20:18:01,617] Trial 141 finished with value: 4.50649651731008 and parameters: {'model_name': 'GAIN', 'batch_size': 11, 'hint_rate': 0.56, 'alpha': 18, 'iterations': 353}. Best is trial 121 with value: 4.042831244100165.
[I 2024-02-28 20:18:22,781] Trial 143 finished with value: 4.48036241692129 and parameters: {'model_name': 'GAIN', 'batch_size': 3, 'hint_rate': 0.5700000000000001, 'alpha': 23, 'iterations': 307}. Best is trial 121 with value: 4.042831244100165.
[I 2024-02-28 20:18:57,967] Trial 137 finished with value: 4.676661906340579 and parameters: {'model_name': 'GAIN', 'batch_size': 4, 'hint_rate': 0.52, 'alpha': 20, 'iterations': 506}. Best is trial 121 with value: 4.042831244100165.
[I 2024-02-28 20:19:13,906] Trial 146 finished with value: 4.59049684604642 and parameters: {'model_name': 'GAIN', 'batch_size': 4, 'hint_rate': 0.5800000000000001, 'alpha': 20, 'iterations': 312}. Best is trial 121 with value: 4.042831244100165.
[I 2024-02-28 20:19:16,617] Trial 154 finished with value: 4.210913660013559 and parameters: {'model_name': 'GAIN', 'batch_size': 5, 'hint_rate': 0.87, 'alpha': 19, 'iterations': 273}. Best is trial 121 with value: 4.042831244100165.
[I 2024-02-28 20:19:21,534] Trial 148 finished with value: 4.210490777272 and parameters: {'model_name': 'GAIN', 'batch_size': 5, 'hint_rate': 0.54, 'alpha': 21, 'iterations': 284}. Best is trial 121 with value: 4.042831244100165.
[I 2024-02-28 20:19:30,406] Trial 145 finished with value: 4.499781789988914 and parameters: {'model_name': 'GAIN', 'batch_size': 4, 'hint_rate': 0.5700000000000001, 'alpha': 20, 'iterations': 335}. Best is trial 121 with value: 4.042831244100165.
[I 2024-02-28 20:19:40,060] Trial 150 finished with value: 4.231991548547056 and parameters: {'model_name': 'GAIN', 'batch_size': 3, 'hint_rate': 0.86, 'alpha': 20, 'iterations': 311}. Best is trial 121 with value: 4.042831244100165.
[I 2024-02-28 20:19:44,868] Trial 144 finished with value: 4.490901613092925 and parameters: {'model_name': 'GAIN', 'batch_size': 3, 'hint_rate': 0.86, 'alpha': 22, 'iterations': 342}. Best is trial 121 with value: 4.042831244100165.
[I 2024-02-28 20:19:48,462] Trial 147 finished with value: 4.308188048128107 and parameters: {'model_name': 'GAIN', 'batch_size': 4, 'hint_rate': 0.5700000000000001, 'alpha': 17, 'iterations': 327}. Best is trial 121 with value: 4.042831244100165.
[I 2024-02-28 20:20:03,779] Trial 29 finished with value: 4.5366856701966345 and parameters: {'model_name': 'RandomForestImputer', 'max_iter': 82, 'decreasing': False, 'min_samples_split': 0.7000000000000001, 'min_samples_leaf': 0.5, 'max_features': 0.4, 'warm_start': False}. Best is trial 121 with value: 4.042831244100165.
[I 2024-02-28 20:20:09,437] Trial 90 finished with value: 4.53669815518389 and parameters: {'model_name': 'RandomForestImputer', 'max_iter': 73, 'decreasing': True, 'min_samples_split': 1.0, 'min_samples_leaf': 0.9, 'max_features': 0.1, 'warm_start': False}. Best is trial 121 with value: 4.042831244100165.
[I 2024-02-28 20:20:13,682] Trial 168 finished with value: 4.466405513044384 and parameters: {'model_name': 'GAIN', 'batch_size': 11, 'hint_rate': 0.59, 'alpha': 15, 'iterations': 157}. Best is trial 121 with value: 4.042831244100165.
[I 2024-02-28 20:20:21,043] Trial 149 finished with value: 4.342660893666739 and parameters: {'model_name': 'GAIN', 'batch_size': 7, 'hint_rate': 0.86, 'alpha': 17, 'iterations': 320}. Best is trial 121 with value: 4.042831244100165.
[I 2024-02-28 20:20:34,246] Trial 152 finished with value: 4.399781595285999 and parameters: {'model_name': 'GAIN', 'batch_size': 4, 'hint_rate': 0.5700000000000001, 'alpha': 17, 'iterations': 361}. Best is trial 121 with value: 4.042831244100165.
[I 2024-02-28 20:20:57,364] Trial 169 finished with value: 4.292998400065038 and parameters: {'model_name': 'GAIN', 'batch_size': 14, 'hint_rate': 0.46, 'alpha': 13, 'iterations': 178}. Best is trial 121 with value: 4.042831244100165.
[I 2024-02-28 20:21:07,852] Trial 174 finished with value: 4.666627654102053 and parameters: {'model_name': 'IterativeImputer', 'sample_posterior': True, 'initial_strategy': 'most_frequent', 'imputation_order': 'descending'}. Best is trial 121 with value: 4.042831244100165.
[I 2024-02-28 20:21:12,648] Trial 151 finished with value: 4.426800484293417 and parameters: {'model_name': 'GAIN', 'batch_size': 4, 'hint_rate': 0.6, 'alpha': 21, 'iterations': 381}. Best is trial 121 with value: 4.042831244100165.
[I 2024-02-28 20:21:20,705] Trial 171 finished with value: 4.295613600968444 and parameters: {'model_name': 'GAIN', 'batch_size': 11, 'hint_rate': 0.47000000000000003, 'alpha': 14, 'iterations': 166}. Best is trial 121 with value: 4.042831244100165.
[I 2024-02-28 20:21:24,292] Trial 175 finished with value: 4.850360975678033 and parameters: {'model_name': 'IterativeImputer', 'sample_posterior': True, 'initial_strategy': 'most_frequent', 'imputation_order': 'descending'}. Best is trial 121 with value: 4.042831244100165.
[I 2024-02-28 20:21:27,462] Trial 176 finished with value: 4.794643422602305 and parameters: {'model_name': 'IterativeImputer', 'sample_posterior': True, 'initial_strategy': 'most_frequent', 'imputation_order': 'descending'}. Best is trial 121 with value: 4.042831244100165.
[I 2024-02-28 20:21:31,609] Trial 190 finished with value: 4.5723608200052634 and parameters: {'model_name': 'KNNImputer', 'weights': 'uniform', 'keep_empty_features': False}. Best is trial 121 with value: 4.042831244100165.
[I 2024-02-28 20:21:35,404] Trial 177 finished with value: 4.760650840871187 and parameters: {'model_name': 'IterativeImputer', 'sample_posterior': True, 'initial_strategy': 'most_frequent', 'imputation_order': 'descending'}. Best is trial 121 with value: 4.042831244100165.
[I 2024-02-28 20:21:38,514] Trial 192 finished with value: 4.5723608200052634 and parameters: {'model_name': 'KNNImputer', 'weights': 'uniform', 'keep_empty_features': False}. Best is trial 121 with value: 4.042831244100165.
[I 2024-02-28 20:21:46,864] Trial 170 finished with value: 4.272949872262015 and parameters: {'model_name': 'GAIN', 'batch_size': 16, 'hint_rate': 0.9, 'alpha': 2, 'iterations': 196}. Best is trial 121 with value: 4.042831244100165.
[I 2024-02-28 20:21:49,476] Trial 178 finished with value: 4.569576860451322 and parameters: {'model_name': 'IterativeImputer', 'sample_posterior': True, 'initial_strategy': 'most_frequent', 'imputation_order': 'descending'}. Best is trial 121 with value: 4.042831244100165.
[I 2024-02-28 20:21:56,415] Trial 172 finished with value: 4.482349697927323 and parameters: {'model_name': 'GAIN', 'batch_size': 3, 'hint_rate': 0.89, 'alpha': 2, 'iterations': 180}. Best is trial 121 with value: 4.042831244100165.
[I 2024-02-28 20:22:01,332] Trial 173 finished with value: 4.305563470342361 and parameters: {'model_name': 'GAIN', 'batch_size': 9, 'hint_rate': 0.89, 'alpha': 6, 'iterations': 168}. Best is trial 121 with value: 4.042831244100165.
[I 2024-02-28 20:22:08,589] Trial 180 finished with value: 4.763035703662337 and parameters: {'model_name': 'IterativeImputer', 'sample_posterior': True, 'initial_strategy': 'most_frequent', 'imputation_order': 'descending'}. Best is trial 121 with value: 4.042831244100165.
[I 2024-02-28 20:22:11,370] Trial 181 finished with value: 4.611970831581284 and parameters: {'model_name': 'IterativeImputer', 'sample_posterior': True, 'initial_strategy': 'most_frequent', 'imputation_order': 'descending'}. Best is trial 121 with value: 4.042831244100165.
[I 2024-02-28 20:22:25,307] Trial 183 finished with value: 4.909837951302807 and parameters: {'model_name': 'IterativeImputer', 'sample_posterior': True, 'initial_strategy': 'most_frequent', 'imputation_order': 'descending'}. Best is trial 121 with value: 4.042831244100165.
[I 2024-02-28 20:22:29,613] Trial 184 finished with value: 4.656955486763359 and parameters: {'model_name': 'IterativeImputer', 'sample_posterior': True, 'initial_strategy': 'most_frequent', 'imputation_order': 'descending'}. Best is trial 121 with value: 4.042831244100165.
[I 2024-02-28 20:22:32,460] Trial 153 finished with value: 4.386451555997075 and parameters: {'model_name': 'GAIN', 'batch_size': 4, 'hint_rate': 0.5800000000000001, 'alpha': 18, 'iterations': 455}. Best is trial 121 with value: 4.042831244100165.
[I 2024-02-28 20:22:37,356] Trial 185 finished with value: 4.7735759048970205 and parameters: {'model_name': 'IterativeImputer', 'sample_posterior': True, 'initial_strategy': 'most_frequent', 'imputation_order': 'descending'}. Best is trial 121 with value: 4.042831244100165.
[I 2024-02-28 20:22:48,443] Trial 186 finished with value: 4.399042305062439 and parameters: {'model_name': 'IterativeImputer', 'sample_posterior': True, 'initial_strategy': 'most_frequent', 'imputation_order': 'descending'}. Best is trial 121 with value: 4.042831244100165.
[I 2024-02-28 20:23:06,290] Trial 179 finished with value: 4.409217523711699 and parameters: {'model_name': 'GAIN', 'batch_size': 6, 'hint_rate': 0.9, 'alpha': 15, 'iterations': 172}. Best is trial 121 with value: 4.042831244100165.
[I 2024-02-28 20:23:16,867] Trial 182 finished with value: 4.114667080199257 and parameters: {'model_name': 'GAIN', 'batch_size': 6, 'hint_rate': 0.88, 'alpha': 85, 'iterations': 181}. Best is trial 121 with value: 4.042831244100165.
[I 2024-02-28 20:23:20,311] Trial 187 finished with value: 4.507703144563385 and parameters: {'model_name': 'IterativeImputer', 'sample_posterior': True, 'initial_strategy': 'most_frequent', 'imputation_order': 'descending'}. Best is trial 121 with value: 4.042831244100165.
[I 2024-02-28 20:23:43,514] Trial 155 finished with value: 4.293808678494161 and parameters: {'model_name': 'GAIN', 'batch_size': 7, 'hint_rate': 0.89, 'alpha': 18, 'iterations': 532}. Best is trial 121 with value: 4.042831244100165.
[I 2024-02-28 20:24:01,977] Trial 156 finished with value: 4.272852641825327 and parameters: {'model_name': 'GAIN', 'batch_size': 3, 'hint_rate': 0.89, 'alpha': 11, 'iterations': 539}. Best is trial 121 with value: 4.042831244100165.
[I 2024-02-28 20:24:21,811] Trial 191 finished with value: 4.456636709645344 and parameters: {'model_name': 'GAIN', 'batch_size': 6, 'hint_rate': 0.9, 'alpha': 9, 'iterations': 191}. Best is trial 121 with value: 4.042831244100165.
[I 2024-02-28 20:24:44,044] Trial 159 finished with value: 4.330682186243024 and parameters: {'model_name': 'GAIN', 'batch_size': 5, 'hint_rate': 0.42000000000000004, 'alpha': 18, 'iterations': 576}. Best is trial 121 with value: 4.042831244100165.
[I 2024-02-28 20:24:55,241] Trial 157 finished with value: 4.222869369474889 and parameters: {'model_name': 'GAIN', 'batch_size': 3, 'hint_rate': 0.89, 'alpha': 16, 'iterations': 582}. Best is trial 121 with value: 4.042831244100165.
[I 2024-02-28 20:25:12,736] Trial 164 finished with value: 4.452824504922349 and parameters: {'model_name': 'GAIN', 'batch_size': 3, 'hint_rate': 0.89, 'alpha': 16, 'iterations': 573}. Best is trial 121 with value: 4.042831244100165.
[I 2024-02-28 20:25:27,710] Trial 158 finished with value: 4.40227026478797 and parameters: {'model_name': 'GAIN', 'batch_size': 5, 'hint_rate': 0.9, 'alpha': 18, 'iterations': 649}. Best is trial 121 with value: 4.042831244100165.
[I 2024-02-28 20:25:47,934] Trial 163 finished with value: 4.430040806790059 and parameters: {'model_name': 'GAIN', 'batch_size': 3, 'hint_rate': 0.88, 'alpha': 13, 'iterations': 659}. Best is trial 121 with value: 4.042831244100165.
[I 2024-02-28 20:26:01,743] Trial 161 finished with value: 4.878269880160396 and parameters: {'model_name': 'GAIN', 'batch_size': 5, 'hint_rate': 0.89, 'alpha': 15, 'iterations': 676}. Best is trial 121 with value: 4.042831244100165.
[I 2024-02-28 20:26:10,139] Trial 165 finished with value: 4.384623900867238 and parameters: {'model_name': 'GAIN', 'batch_size': 3, 'hint_rate': 0.88, 'alpha': 13, 'iterations': 660}. Best is trial 121 with value: 4.042831244100165.
[I 2024-02-28 20:26:17,167] Trial 162 finished with value: 4.48458059641135 and parameters: {'model_name': 'GAIN', 'batch_size': 3, 'hint_rate': 0.89, 'alpha': 14, 'iterations': 686}. Best is trial 121 with value: 4.042831244100165.
[I 2024-02-28 20:26:30,748] Trial 160 finished with value: 4.59778551988005 and parameters: {'model_name': 'GAIN', 'batch_size': 6, 'hint_rate': 0.9, 'alpha': 17, 'iterations': 770}. Best is trial 121 with value: 4.042831244100165.
