[I 2024-02-07 12:58:43,942] Trial 139 finished with value: 8.829476337728345 and parameters: {'model_name': 'IterativeImputer', 'sample_posterior': True, 'initial_strategy': 'median', 'imputation_order': 'arabic'}. Best is trial 148 with value: 5.382483647366905.
[I 2024-02-07 12:58:58,571] Trial 54 finished with value: inf and parameters: {'model_name': 'GAIN', 'batch_size': 26, 'hint_rate': 0.35000000000000003, 'alpha': 59, 'iterations': 9971}. Best is trial 148 with value: 5.382483647366905.
[I 2024-02-07 13:05:46,287] Trial 25 finished with value: 14.328263391086669 and parameters: {'model_name': 'RandomForestImputer', 'max_iter': 66, 'decreasing': True, 'min_samples_split': 0.0, 'min_samples_leaf': 0.8, 'max_features': 0.2, 'warm_start': False}. Best is trial 148 with value: 5.382483647366905.
[I 2024-02-07 13:13:44,097] Trial 38 finished with value: inf and parameters: {'model_name': 'GAIN', 'batch_size': 439, 'hint_rate': 0.97, 'alpha': 62, 'iterations': 23705}. Best is trial 148 with value: 5.382483647366905.
[I 2024-02-07 13:18:02,214] Trial 187 finished with value: inf and parameters: {'model_name': 'GAIN', 'batch_size': 1, 'hint_rate': 0.91, 'alpha': 49, 'iterations': 30075}. Best is trial 148 with value: 5.382483647366905.
[I 2024-02-07 13:25:24,801] Trial 188 finished with value: inf and parameters: {'model_name': 'GAIN', 'batch_size': 1, 'hint_rate': 0.97, 'alpha': 49, 'iterations': 40754}. Best is trial 148 with value: 5.382483647366905.
[I 2024-02-07 13:25:42,226] Trial 174 finished with value: inf and parameters: {'model_name': 'GAIN', 'batch_size': 1, 'hint_rate': 0.9, 'alpha': 48, 'iterations': 41944}. Best is trial 148 with value: 5.382483647366905.
[I 2024-02-07 13:27:10,404] Trial 186 finished with value: inf and parameters: {'model_name': 'GAIN', 'batch_size': 1, 'hint_rate': 0.9600000000000001, 'alpha': 49, 'iterations': 43693}. Best is trial 148 with value: 5.382483647366905.
[I 2024-02-07 13:27:51,530] Trial 193 finished with value: inf and parameters: {'model_name': 'GAIN', 'batch_size': 1, 'hint_rate': 0.9600000000000001, 'alpha': 53, 'iterations': 44133}. Best is trial 148 with value: 5.382483647366905.
[I 2024-02-07 13:31:13,352] Trial 166 finished with value: inf and parameters: {'model_name': 'GAIN', 'batch_size': 1, 'hint_rate': 0.9600000000000001, 'alpha': 46, 'iterations': 51819}. Best is trial 148 with value: 5.382483647366905.
[I 2024-02-07 13:31:50,403] Trial 178 finished with value: inf and parameters: {'model_name': 'GAIN', 'batch_size': 1, 'hint_rate': 0.9500000000000001, 'alpha': 49, 'iterations': 51702}. Best is trial 148 with value: 5.382483647366905.
[I 2024-02-07 13:32:32,494] Trial 176 finished with value: inf and parameters: {'model_name': 'GAIN', 'batch_size': 1, 'hint_rate': 0.9400000000000001, 'alpha': 47, 'iterations': 53219}. Best is trial 148 with value: 5.382483647366905.
[I 2024-02-07 13:34:32,584] Trial 191 finished with value: inf and parameters: {'model_name': 'GAIN', 'batch_size': 1, 'hint_rate': 0.93, 'alpha': 52, 'iterations': 57182}. Best is trial 148 with value: 5.382483647366905.
[I 2024-02-07 13:34:49,557] Trial 185 finished with value: inf and parameters: {'model_name': 'GAIN', 'batch_size': 1, 'hint_rate': 0.99, 'alpha': 49, 'iterations': 58266}. Best is trial 148 with value: 5.382483647366905.
[I 2024-02-07 13:35:43,011] Trial 170 finished with value: inf and parameters: {'model_name': 'GAIN', 'batch_size': 1, 'hint_rate': 0.97, 'alpha': 46, 'iterations': 59981}. Best is trial 148 with value: 5.382483647366905.
[I 2024-02-07 13:35:57,219] Trial 172 finished with value: inf and parameters: {'model_name': 'GAIN', 'batch_size': 1, 'hint_rate': 0.97, 'alpha': 48, 'iterations': 60393}. Best is trial 148 with value: 5.382483647366905.
[I 2024-02-07 13:36:36,815] Trial 196 finished with value: inf and parameters: {'model_name': 'GAIN', 'batch_size': 1, 'hint_rate': 0.9, 'alpha': 54, 'iterations': 61440}. Best is trial 148 with value: 5.382483647366905.
[I 2024-02-07 13:37:57,359] Trial 179 finished with value: inf and parameters: {'model_name': 'GAIN', 'batch_size': 1, 'hint_rate': 0.87, 'alpha': 52, 'iterations': 65816}. Best is trial 148 with value: 5.382483647366905.
[I 2024-02-07 13:38:06,742] Trial 198 finished with value: inf and parameters: {'model_name': 'GAIN', 'batch_size': 1, 'hint_rate': 0.97, 'alpha': 49, 'iterations': 65998}. Best is trial 148 with value: 5.382483647366905.
[I 2024-02-07 13:38:41,723] Trial 197 finished with value: inf and parameters: {'model_name': 'GAIN', 'batch_size': 1, 'hint_rate': 0.92, 'alpha': 49, 'iterations': 66900}. Best is trial 148 with value: 5.382483647366905.
[I 2024-02-07 13:42:38,870] Trial 199 finished with value: inf and parameters: {'model_name': 'GAIN', 'batch_size': 1, 'hint_rate': 0.92, 'alpha': 50, 'iterations': 80974}. Best is trial 148 with value: 5.382483647366905.
[I 2024-02-07 13:42:51,979] Trial 190 finished with value: inf and parameters: {'model_name': 'GAIN', 'batch_size': 1, 'hint_rate': 0.99, 'alpha': 50, 'iterations': 81518}. Best is trial 148 with value: 5.382483647366905.
[I 2024-02-07 13:43:04,106] Trial 195 finished with value: inf and parameters: {'model_name': 'GAIN', 'batch_size': 1, 'hint_rate': 0.9500000000000001, 'alpha': 51, 'iterations': 82435}. Best is trial 148 with value: 5.382483647366905.
[I 2024-02-07 13:43:05,642] Trial 194 finished with value: inf and parameters: {'model_name': 'GAIN', 'batch_size': 1, 'hint_rate': 0.88, 'alpha': 49, 'iterations': 82231}. Best is trial 148 with value: 5.382483647366905.
[I 2024-02-07 13:43:20,541] Trial 183 finished with value: inf and parameters: {'model_name': 'GAIN', 'batch_size': 1, 'hint_rate': 0.99, 'alpha': 49, 'iterations': 83862}. Best is trial 148 with value: 5.382483647366905.
[I 2024-02-07 13:43:46,680] Trial 171 finished with value: inf and parameters: {'model_name': 'GAIN', 'batch_size': 1, 'hint_rate': 0.98, 'alpha': 58, 'iterations': 86389}. Best is trial 148 with value: 5.382483647366905.
[I 2024-02-07 13:44:06,336] Trial 164 finished with value: inf and parameters: {'model_name': 'GAIN', 'batch_size': 1, 'hint_rate': 0.98, 'alpha': 59, 'iterations': 89617}. Best is trial 148 with value: 5.382483647366905.
[I 2024-02-07 13:44:17,449] Trial 165 finished with value: inf and parameters: {'model_name': 'GAIN', 'batch_size': 1, 'hint_rate': 0.93, 'alpha': 64, 'iterations': 90875}. Best is trial 148 with value: 5.382483647366905.
[I 2024-02-07 13:44:39,388] Trial 177 finished with value: inf and parameters: {'model_name': 'GAIN', 'batch_size': 1, 'hint_rate': 0.99, 'alpha': 47, 'iterations': 96104}. Best is trial 148 with value: 5.382483647366905.
[I 2024-02-07 13:44:41,851] Trial 180 finished with value: inf and parameters: {'model_name': 'GAIN', 'batch_size': 1, 'hint_rate': 0.9400000000000001, 'alpha': 50, 'iterations': 96227}. Best is trial 148 with value: 5.382483647366905.
[I 2024-02-07 13:44:44,474] Trial 167 finished with value: inf and parameters: {'model_name': 'GAIN', 'batch_size': 1, 'hint_rate': 0.91, 'alpha': 50, 'iterations': 97910}. Best is trial 148 with value: 5.382483647366905.
