Run: 8
/cm/local/apps/slurm/var/spool/job664133/slurm_script: line 23: /common/ketrong/minconda3/etc/profile.d/conda.sh: No such file or directory
/cm/local/apps/slurm/var/spool/job664133/slurm_script: line 26: $'\nconda create --name tpot2devenv -c conda-forge python=3.10\n': command not found
/cm/local/apps/slurm/var/spool/job664133/slurm_script: line 31: $'\npip install -r requirements.txt\n': command not found
RunStart
2024-02-21 11:23:17.610103: I tensorflow/core/util/port.cc:113] oneDNN custom operations are on. You may see slightly different numerical results due to floating-point round-off errors from different computation orders. To turn them off, set the environment variable `TF_ENABLE_ONEDNN_OPTS=0`.
2024-02-21 11:23:17.645906: E external/local_xla/xla/stream_executor/cuda/cuda_dnn.cc:9261] Unable to register cuDNN factory: Attempting to register factory for plugin cuDNN when one has already been registered
2024-02-21 11:23:17.645928: E external/local_xla/xla/stream_executor/cuda/cuda_fft.cc:607] Unable to register cuFFT factory: Attempting to register factory for plugin cuFFT when one has already been registered
2024-02-21 11:23:17.647329: E external/local_xla/xla/stream_executor/cuda/cuda_blas.cc:1515] Unable to register cuBLAS factory: Attempting to register factory for plugin cuBLAS when one has already been registered
2024-02-21 11:23:17.653438: I tensorflow/core/platform/cpu_feature_guard.cc:182] This TensorFlow binary is optimized to use available CPU instructions in performance-critical operations.
To enable the following instructions: AVX2 AVX512F AVX512_VNNI FMA, in other operations, rebuild TensorFlow with the appropriate compiler flags.
2024-02-21 11:23:19.148980: W tensorflow/compiler/tf2tensorrt/utils/py_utils.cc:38] TF-TRT Warning: Could not find TensorRT
WARNING:tensorflow:From /home/ketrong/miniconda3/envs/tpot2devenv/lib/python3.10/site-packages/tensorflow/python/compat/v2_compat.py:108: disable_resource_variables (from tensorflow.python.ops.variable_scope) is deprecated and will be removed in a future version.
Instructions for updating:
non-resource variables are not supported in the long term
starting loops
working on 
logs/2289/tpot2_base_normal_MAR_0.3
4.596411466598511
loading data
logs/2289/tpot2_base_normal_MAR_0.3/data/2289_True.pkl
running experiment 1/3 - Does large hyperparameter space improve reconstruction accuracy over simple
[I 2024-02-21 11:23:31,886] A new study created in memory with name: no-name-ae1e58d0-79c8-4877-ac88-2ddd76b98143
[I 2024-02-21 11:23:32,694] Trial 3 finished with value: 16.80540838563573 and parameters: {'model_name': 'SimpleImputer', 'strategy': 'constant'}. Best is trial 3 with value: 16.80540838563573.
[I 2024-02-21 11:23:33,053] Trial 0 finished with value: 15.091139551681518 and parameters: {'model_name': 'SimpleImputer', 'strategy': 'mean'}. Best is trial 0 with value: 15.091139551681518.
[I 2024-02-21 11:23:33,294] Trial 12 finished with value: 16.80540838563573 and parameters: {'model_name': 'SimpleImputer', 'strategy': 'constant'}. Best is trial 0 with value: 15.091139551681518.
[I 2024-02-21 11:23:33,588] Trial 17 finished with value: 16.80540838563573 and parameters: {'model_name': 'SimpleImputer', 'strategy': 'constant'}. Best is trial 0 with value: 15.091139551681518.
[I 2024-02-21 11:23:34,062] Trial 4 finished with value: 15.091139551681518 and parameters: {'model_name': 'SimpleImputer', 'strategy': 'mean'}. Best is trial 0 with value: 15.091139551681518.
[I 2024-02-21 11:23:34,299] Trial 2 finished with value: 15.091139551681518 and parameters: {'model_name': 'SimpleImputer', 'strategy': 'mean'}. Best is trial 0 with value: 15.091139551681518.
[I 2024-02-21 11:23:34,742] Trial 1 finished with value: 15.091139551681518 and parameters: {'model_name': 'SimpleImputer', 'strategy': 'mean'}. Best is trial 0 with value: 15.091139551681518.
[I 2024-02-21 11:23:35,179] Trial 37 finished with value: 16.80540838563573 and parameters: {'model_name': 'SimpleImputer', 'strategy': 'constant'}. Best is trial 0 with value: 15.091139551681518.
[I 2024-02-21 11:23:35,468] Trial 18 finished with value: 15.091139551681518 and parameters: {'model_name': 'SimpleImputer', 'strategy': 'mean'}. Best is trial 0 with value: 15.091139551681518.
[I 2024-02-21 11:23:35,762] Trial 30 finished with value: 15.091139551681518 and parameters: {'model_name': 'SimpleImputer', 'strategy': 'mean'}. Best is trial 0 with value: 15.091139551681518.
[I 2024-02-21 11:23:36,154] Trial 43 finished with value: 16.80540838563573 and parameters: {'model_name': 'SimpleImputer', 'strategy': 'constant'}. Best is trial 0 with value: 15.091139551681518.
[I 2024-02-21 11:23:36,427] Trial 15 finished with value: 15.091139551681518 and parameters: {'model_name': 'SimpleImputer', 'strategy': 'mean'}. Best is trial 0 with value: 15.091139551681518.
[I 2024-02-21 11:23:36,683] Trial 44 finished with value: 16.80540838563573 and parameters: {'model_name': 'SimpleImputer', 'strategy': 'constant'}. Best is trial 0 with value: 15.091139551681518.
[I 2024-02-21 11:23:36,863] Trial 40 finished with value: 16.80540838563573 and parameters: {'model_name': 'SimpleImputer', 'strategy': 'constant'}. Best is trial 0 with value: 15.091139551681518.
[I 2024-02-21 11:23:37,133] Trial 51 finished with value: 16.80540838563573 and parameters: {'model_name': 'SimpleImputer', 'strategy': 'constant'}. Best is trial 0 with value: 15.091139551681518.
[I 2024-02-21 11:23:37,489] Trial 31 finished with value: 15.091139551681518 and parameters: {'model_name': 'SimpleImputer', 'strategy': 'mean'}. Best is trial 0 with value: 15.091139551681518.
[I 2024-02-21 11:23:37,798] Trial 23 finished with value: 15.091139551681518 and parameters: {'model_name': 'SimpleImputer', 'strategy': 'mean'}. Best is trial 0 with value: 15.091139551681518.
[I 2024-02-21 11:23:37,976] Trial 9 finished with value: 15.178555530624598 and parameters: {'model_name': 'SimpleImputer', 'strategy': 'median'}. Best is trial 0 with value: 15.091139551681518.
[I 2024-02-21 11:23:38,177] Trial 36 finished with value: 15.091139551681518 and parameters: {'model_name': 'SimpleImputer', 'strategy': 'mean'}. Best is trial 0 with value: 15.091139551681518.
[I 2024-02-21 11:23:38,447] Trial 24 finished with value: 15.091139551681518 and parameters: {'model_name': 'SimpleImputer', 'strategy': 'mean'}. Best is trial 0 with value: 15.091139551681518.
[I 2024-02-21 11:23:38,804] Trial 16 finished with value: 15.178555530624598 and parameters: {'model_name': 'SimpleImputer', 'strategy': 'median'}. Best is trial 0 with value: 15.091139551681518.
[I 2024-02-21 11:23:39,019] Trial 54 finished with value: 16.80540838563573 and parameters: {'model_name': 'SimpleImputer', 'strategy': 'constant'}. Best is trial 0 with value: 15.091139551681518.
[I 2024-02-21 11:23:39,288] Trial 25 finished with value: 15.091139551681518 and parameters: {'model_name': 'SimpleImputer', 'strategy': 'mean'}. Best is trial 0 with value: 15.091139551681518.
[I 2024-02-21 11:23:39,621] Trial 49 finished with value: 15.091139551681518 and parameters: {'model_name': 'SimpleImputer', 'strategy': 'mean'}. Best is trial 0 with value: 15.091139551681518.
[I 2024-02-21 11:23:39,881] Trial 14 finished with value: 15.091139551681518 and parameters: {'model_name': 'SimpleImputer', 'strategy': 'mean'}. Best is trial 0 with value: 15.091139551681518.
[I 2024-02-21 11:23:40,283] Trial 26 finished with value: 15.178555530624598 and parameters: {'model_name': 'SimpleImputer', 'strategy': 'median'}. Best is trial 0 with value: 15.091139551681518.
[I 2024-02-21 11:23:40,559] Trial 13 finished with value: 15.178555530624598 and parameters: {'model_name': 'SimpleImputer', 'strategy': 'median'}. Best is trial 0 with value: 15.091139551681518.
[I 2024-02-21 11:23:41,150] Trial 32 finished with value: 15.178555530624598 and parameters: {'model_name': 'SimpleImputer', 'strategy': 'median'}. Best is trial 0 with value: 15.091139551681518.
[I 2024-02-21 11:23:41,411] Trial 47 finished with value: 15.178555530624598 and parameters: {'model_name': 'SimpleImputer', 'strategy': 'median'}. Best is trial 0 with value: 15.091139551681518.
[I 2024-02-21 11:23:41,658] Trial 35 finished with value: 15.178555530624598 and parameters: {'model_name': 'SimpleImputer', 'strategy': 'median'}. Best is trial 0 with value: 15.091139551681518.
[I 2024-02-21 11:23:41,938] Trial 11 finished with value: 15.178555530624598 and parameters: {'model_name': 'SimpleImputer', 'strategy': 'median'}. Best is trial 0 with value: 15.091139551681518.
[I 2024-02-21 11:23:42,119] Trial 5 finished with value: 15.178555530624598 and parameters: {'model_name': 'SimpleImputer', 'strategy': 'most_frequent'}. Best is trial 0 with value: 15.091139551681518.
[I 2024-02-21 11:23:42,539] Trial 28 finished with value: 15.178555530624598 and parameters: {'model_name': 'SimpleImputer', 'strategy': 'median'}. Best is trial 0 with value: 15.091139551681518.
[I 2024-02-21 11:23:42,749] Trial 38 finished with value: 15.178555530624598 and parameters: {'model_name': 'SimpleImputer', 'strategy': 'median'}. Best is trial 0 with value: 15.091139551681518.
[I 2024-02-21 11:23:42,980] Trial 39 finished with value: 15.178555530624598 and parameters: {'model_name': 'SimpleImputer', 'strategy': 'median'}. Best is trial 0 with value: 15.091139551681518.
[I 2024-02-21 11:23:43,223] Trial 21 finished with value: 15.178555530624598 and parameters: {'model_name': 'SimpleImputer', 'strategy': 'median'}. Best is trial 0 with value: 15.091139551681518.
[I 2024-02-21 11:23:43,478] Trial 53 finished with value: 15.178555530624598 and parameters: {'model_name': 'SimpleImputer', 'strategy': 'median'}. Best is trial 0 with value: 15.091139551681518.
[I 2024-02-21 11:23:43,672] Trial 6 finished with value: 15.178555530624598 and parameters: {'model_name': 'SimpleImputer', 'strategy': 'most_frequent'}. Best is trial 0 with value: 15.091139551681518.
[I 2024-02-21 11:23:43,877] Trial 41 finished with value: 15.178555530624598 and parameters: {'model_name': 'SimpleImputer', 'strategy': 'median'}. Best is trial 0 with value: 15.091139551681518.
[I 2024-02-21 11:23:44,237] Trial 42 finished with value: 15.178555530624598 and parameters: {'model_name': 'SimpleImputer', 'strategy': 'median'}. Best is trial 0 with value: 15.091139551681518.
[I 2024-02-21 11:23:44,480] Trial 33 finished with value: 15.178555530624598 and parameters: {'model_name': 'SimpleImputer', 'strategy': 'median'}. Best is trial 0 with value: 15.091139551681518.
[I 2024-02-21 11:23:44,859] Trial 34 finished with value: 15.178555530624598 and parameters: {'model_name': 'SimpleImputer', 'strategy': 'median'}. Best is trial 0 with value: 15.091139551681518.
[I 2024-02-21 11:23:45,056] Trial 19 finished with value: 15.178555530624598 and parameters: {'model_name': 'SimpleImputer', 'strategy': 'most_frequent'}. Best is trial 0 with value: 15.091139551681518.
[I 2024-02-21 11:23:45,251] Trial 27 finished with value: 15.178555530624598 and parameters: {'model_name': 'SimpleImputer', 'strategy': 'most_frequent'}. Best is trial 0 with value: 15.091139551681518.
[I 2024-02-21 11:23:45,498] Trial 29 finished with value: 15.178555530624598 and parameters: {'model_name': 'SimpleImputer', 'strategy': 'most_frequent'}. Best is trial 0 with value: 15.091139551681518.
[I 2024-02-21 11:23:45,717] Trial 8 finished with value: 15.178555530624598 and parameters: {'model_name': 'SimpleImputer', 'strategy': 'most_frequent'}. Best is trial 0 with value: 15.091139551681518.
[I 2024-02-21 11:23:45,959] Trial 7 finished with value: 15.178555530624598 and parameters: {'model_name': 'SimpleImputer', 'strategy': 'most_frequent'}. Best is trial 0 with value: 15.091139551681518.
[I 2024-02-21 11:23:46,223] Trial 22 finished with value: 15.178555530624598 and parameters: {'model_name': 'SimpleImputer', 'strategy': 'most_frequent'}. Best is trial 0 with value: 15.091139551681518.
[I 2024-02-21 11:23:46,481] Trial 10 finished with value: 15.178555530624598 and parameters: {'model_name': 'SimpleImputer', 'strategy': 'most_frequent'}. Best is trial 0 with value: 15.091139551681518.
[I 2024-02-21 11:23:46,658] Trial 52 finished with value: 15.178555530624598 and parameters: {'model_name': 'SimpleImputer', 'strategy': 'median'}. Best is trial 0 with value: 15.091139551681518.
[I 2024-02-21 11:23:47,018] Trial 55 finished with value: 15.178555530624598 and parameters: {'model_name': 'SimpleImputer', 'strategy': 'median'}. Best is trial 0 with value: 15.091139551681518.
[I 2024-02-21 11:23:47,328] Trial 50 finished with value: 15.178555530624598 and parameters: {'model_name': 'SimpleImputer', 'strategy': 'median'}. Best is trial 0 with value: 15.091139551681518.
[I 2024-02-21 11:23:47,795] Trial 57 finished with value: 15.178555530624598 and parameters: {'model_name': 'SimpleImputer', 'strategy': 'median'}. Best is trial 0 with value: 15.091139551681518.
[I 2024-02-21 11:23:48,023] Trial 20 finished with value: 15.178555530624598 and parameters: {'model_name': 'SimpleImputer', 'strategy': 'most_frequent'}. Best is trial 0 with value: 15.091139551681518.
[I 2024-02-21 11:23:48,597] Trial 48 finished with value: 15.178555530624598 and parameters: {'model_name': 'SimpleImputer', 'strategy': 'most_frequent'}. Best is trial 0 with value: 15.091139551681518.
[I 2024-02-21 11:23:48,856] Trial 45 finished with value: 15.178555530624598 and parameters: {'model_name': 'SimpleImputer', 'strategy': 'most_frequent'}. Best is trial 0 with value: 15.091139551681518.
[I 2024-02-21 11:23:49,115] Trial 62 finished with value: 15.178555530624598 and parameters: {'model_name': 'SimpleImputer', 'strategy': 'median'}. Best is trial 0 with value: 15.091139551681518.
[I 2024-02-21 11:23:49,335] Trial 58 finished with value: 15.178555530624598 and parameters: {'model_name': 'SimpleImputer', 'strategy': 'median'}. Best is trial 0 with value: 15.091139551681518.
[I 2024-02-21 11:23:49,573] Trial 46 finished with value: 15.178555530624598 and parameters: {'model_name': 'SimpleImputer', 'strategy': 'most_frequent'}. Best is trial 0 with value: 15.091139551681518.
[I 2024-02-21 11:23:49,972] Trial 61 finished with value: 15.178555530624598 and parameters: {'model_name': 'SimpleImputer', 'strategy': 'median'}. Best is trial 0 with value: 15.091139551681518.
[I 2024-02-21 11:23:50,367] Trial 83 finished with value: 15.091139551681518 and parameters: {'model_name': 'SimpleImputer', 'strategy': 'mean'}. Best is trial 0 with value: 15.091139551681518.
[I 2024-02-21 11:23:50,774] Trial 97 finished with value: 15.091139551681518 and parameters: {'model_name': 'SimpleImputer', 'strategy': 'mean'}. Best is trial 0 with value: 15.091139551681518.
[I 2024-02-21 11:23:50,972] Trial 95 finished with value: 15.091139551681518 and parameters: {'model_name': 'SimpleImputer', 'strategy': 'mean'}. Best is trial 0 with value: 15.091139551681518.
[I 2024-02-21 11:23:51,308] Trial 90 finished with value: 15.091139551681518 and parameters: {'model_name': 'SimpleImputer', 'strategy': 'mean'}. Best is trial 0 with value: 15.091139551681518.
[I 2024-02-21 11:23:51,505] Trial 60 finished with value: 15.178555530624598 and parameters: {'model_name': 'SimpleImputer', 'strategy': 'most_frequent'}. Best is trial 0 with value: 15.091139551681518.
[I 2024-02-21 11:23:51,696] Trial 89 finished with value: 15.091139551681518 and parameters: {'model_name': 'SimpleImputer', 'strategy': 'mean'}. Best is trial 0 with value: 15.091139551681518.
[I 2024-02-21 11:23:51,952] Trial 92 finished with value: 15.091139551681518 and parameters: {'model_name': 'SimpleImputer', 'strategy': 'mean'}. Best is trial 0 with value: 15.091139551681518.
[I 2024-02-21 11:23:52,132] Trial 56 finished with value: 15.178555530624598 and parameters: {'model_name': 'SimpleImputer', 'strategy': 'most_frequent'}. Best is trial 0 with value: 15.091139551681518.
[I 2024-02-21 11:23:52,332] Trial 91 finished with value: 15.091139551681518 and parameters: {'model_name': 'SimpleImputer', 'strategy': 'mean'}. Best is trial 0 with value: 15.091139551681518.
[I 2024-02-21 11:23:52,596] Trial 59 finished with value: 15.178555530624598 and parameters: {'model_name': 'SimpleImputer', 'strategy': 'most_frequent'}. Best is trial 0 with value: 15.091139551681518.
[I 2024-02-21 11:23:52,872] Trial 94 finished with value: 15.091139551681518 and parameters: {'model_name': 'SimpleImputer', 'strategy': 'mean'}. Best is trial 0 with value: 15.091139551681518.
[I 2024-02-21 11:23:53,147] Trial 93 finished with value: 15.091139551681518 and parameters: {'model_name': 'SimpleImputer', 'strategy': 'mean'}. Best is trial 0 with value: 15.091139551681518.
[I 2024-02-21 11:23:53,387] Trial 100 finished with value: 15.091139551681518 and parameters: {'model_name': 'SimpleImputer', 'strategy': 'mean'}. Best is trial 0 with value: 15.091139551681518.
[I 2024-02-21 11:23:53,588] Trial 96 finished with value: 15.091139551681518 and parameters: {'model_name': 'SimpleImputer', 'strategy': 'mean'}. Best is trial 0 with value: 15.091139551681518.
[I 2024-02-21 11:23:53,772] Trial 98 finished with value: 15.091139551681518 and parameters: {'model_name': 'SimpleImputer', 'strategy': 'mean'}. Best is trial 0 with value: 15.091139551681518.
[I 2024-02-21 11:23:54,107] Trial 67 finished with value: 15.178555530624598 and parameters: {'model_name': 'SimpleImputer', 'strategy': 'most_frequent'}. Best is trial 0 with value: 15.091139551681518.
[I 2024-02-21 11:23:54,411] Trial 64 finished with value: 15.178555530624598 and parameters: {'model_name': 'SimpleImputer', 'strategy': 'most_frequent'}. Best is trial 0 with value: 15.091139551681518.
[I 2024-02-21 11:23:54,664] Trial 99 finished with value: 15.091139551681518 and parameters: {'model_name': 'SimpleImputer', 'strategy': 'mean'}. Best is trial 0 with value: 15.091139551681518.
[I 2024-02-21 11:23:54,898] Trial 101 finished with value: 15.091139551681518 and parameters: {'model_name': 'SimpleImputer', 'strategy': 'mean'}. Best is trial 0 with value: 15.091139551681518.
[I 2024-02-21 11:23:55,160] Trial 85 finished with value: 15.178555530624598 and parameters: {'model_name': 'SimpleImputer', 'strategy': 'most_frequent'}. Best is trial 0 with value: 15.091139551681518.
[I 2024-02-21 11:23:55,390] Trial 63 finished with value: 15.178555530624598 and parameters: {'model_name': 'SimpleImputer', 'strategy': 'most_frequent'}. Best is trial 0 with value: 15.091139551681518.
[I 2024-02-21 11:23:55,682] Trial 66 finished with value: 15.178555530624598 and parameters: {'model_name': 'SimpleImputer', 'strategy': 'most_frequent'}. Best is trial 0 with value: 15.091139551681518.
[I 2024-02-21 11:23:55,991] Trial 69 finished with value: 15.178555530624598 and parameters: {'model_name': 'SimpleImputer', 'strategy': 'most_frequent'}. Best is trial 0 with value: 15.091139551681518.
[I 2024-02-21 11:23:56,369] Trial 105 finished with value: 15.091139551681518 and parameters: {'model_name': 'SimpleImputer', 'strategy': 'mean'}. Best is trial 0 with value: 15.091139551681518.
[I 2024-02-21 11:23:56,729] Trial 102 finished with value: 15.091139551681518 and parameters: {'model_name': 'SimpleImputer', 'strategy': 'mean'}. Best is trial 0 with value: 15.091139551681518.
[I 2024-02-21 11:23:56,961] Trial 73 finished with value: 15.178555530624598 and parameters: {'model_name': 'SimpleImputer', 'strategy': 'most_frequent'}. Best is trial 0 with value: 15.091139551681518.
[I 2024-02-21 11:23:57,170] Trial 70 finished with value: 15.178555530624598 and parameters: {'model_name': 'SimpleImputer', 'strategy': 'most_frequent'}. Best is trial 0 with value: 15.091139551681518.
[I 2024-02-21 11:23:57,368] Trial 72 finished with value: 15.178555530624598 and parameters: {'model_name': 'SimpleImputer', 'strategy': 'most_frequent'}. Best is trial 0 with value: 15.091139551681518.
[I 2024-02-21 11:23:57,651] Trial 71 finished with value: 15.178555530624598 and parameters: {'model_name': 'SimpleImputer', 'strategy': 'most_frequent'}. Best is trial 0 with value: 15.091139551681518.
[I 2024-02-21 11:23:57,950] Trial 88 finished with value: 15.178555530624598 and parameters: {'model_name': 'SimpleImputer', 'strategy': 'most_frequent'}. Best is trial 0 with value: 15.091139551681518.
[I 2024-02-21 11:23:58,249] Trial 65 finished with value: 15.178555530624598 and parameters: {'model_name': 'SimpleImputer', 'strategy': 'most_frequent'}. Best is trial 0 with value: 15.091139551681518.
[I 2024-02-21 11:23:58,487] Trial 68 finished with value: 15.178555530624598 and parameters: {'model_name': 'SimpleImputer', 'strategy': 'most_frequent'}. Best is trial 0 with value: 15.091139551681518.
[I 2024-02-21 11:23:58,699] Trial 76 finished with value: 15.178555530624598 and parameters: {'model_name': 'SimpleImputer', 'strategy': 'most_frequent'}. Best is trial 0 with value: 15.091139551681518.
[I 2024-02-21 11:23:58,964] Trial 75 finished with value: 15.178555530624598 and parameters: {'model_name': 'SimpleImputer', 'strategy': 'most_frequent'}. Best is trial 0 with value: 15.091139551681518.
[I 2024-02-21 11:23:59,201] Trial 84 finished with value: 15.178555530624598 and parameters: {'model_name': 'SimpleImputer', 'strategy': 'most_frequent'}. Best is trial 0 with value: 15.091139551681518.
[I 2024-02-21 11:23:59,423] Trial 110 finished with value: 15.091139551681518 and parameters: {'model_name': 'SimpleImputer', 'strategy': 'mean'}. Best is trial 0 with value: 15.091139551681518.
[I 2024-02-21 11:23:59,637] Trial 107 finished with value: 15.091139551681518 and parameters: {'model_name': 'SimpleImputer', 'strategy': 'mean'}. Best is trial 0 with value: 15.091139551681518.
[I 2024-02-21 11:23:59,821] Trial 104 finished with value: 15.091139551681518 and parameters: {'model_name': 'SimpleImputer', 'strategy': 'mean'}. Best is trial 0 with value: 15.091139551681518.
