[I 2024-04-01 19:05:23,505] Trial 81 finished with value: 6053.876996385362 and parameters: {'model_name': 'SimpleImputer', 'strategy': 'most_frequent'}. Best is trial 15 with value: 5816.547000242607.
[I 2024-04-01 19:05:23,846] Trial 84 finished with value: 6053.876996385362 and parameters: {'model_name': 'SimpleImputer', 'strategy': 'most_frequent'}. Best is trial 15 with value: 5816.547000242607.
[I 2024-04-01 19:05:24,067] Trial 79 finished with value: 6053.876996385362 and parameters: {'model_name': 'SimpleImputer', 'strategy': 'most_frequent'}. Best is trial 15 with value: 5816.547000242607.
[I 2024-04-01 19:05:24,363] Trial 108 finished with value: 5816.547000242607 and parameters: {'model_name': 'SimpleImputer', 'strategy': 'mean'}. Best is trial 15 with value: 5816.547000242607.
[I 2024-04-01 19:05:24,585] Trial 109 finished with value: 5816.547000242607 and parameters: {'model_name': 'SimpleImputer', 'strategy': 'mean'}. Best is trial 15 with value: 5816.547000242607.
[I 2024-04-01 19:05:24,946] Trial 77 finished with value: 6053.876996385362 and parameters: {'model_name': 'SimpleImputer', 'strategy': 'most_frequent'}. Best is trial 15 with value: 5816.547000242607.
[I 2024-04-01 19:05:25,227] Trial 114 finished with value: 5816.547000242607 and parameters: {'model_name': 'SimpleImputer', 'strategy': 'mean'}. Best is trial 15 with value: 5816.547000242607.
[I 2024-04-01 19:05:25,587] Trial 75 finished with value: 6053.876996385362 and parameters: {'model_name': 'SimpleImputer', 'strategy': 'most_frequent'}. Best is trial 15 with value: 5816.547000242607.
[I 2024-04-01 19:05:25,844] Trial 111 finished with value: 5816.547000242607 and parameters: {'model_name': 'SimpleImputer', 'strategy': 'mean'}. Best is trial 15 with value: 5816.547000242607.
[I 2024-04-01 19:05:26,050] Trial 69 finished with value: 6053.876996385362 and parameters: {'model_name': 'SimpleImputer', 'strategy': 'most_frequent'}. Best is trial 15 with value: 5816.547000242607.
[I 2024-04-01 19:05:26,259] Trial 116 finished with value: 5816.547000242607 and parameters: {'model_name': 'SimpleImputer', 'strategy': 'mean'}. Best is trial 15 with value: 5816.547000242607.
[I 2024-04-01 19:05:26,521] Trial 112 finished with value: 5816.547000242607 and parameters: {'model_name': 'SimpleImputer', 'strategy': 'mean'}. Best is trial 15 with value: 5816.547000242607.
[I 2024-04-01 19:05:26,843] Trial 110 finished with value: 5816.547000242607 and parameters: {'model_name': 'SimpleImputer', 'strategy': 'mean'}. Best is trial 15 with value: 5816.547000242607.
[I 2024-04-01 19:05:27,195] Trial 117 finished with value: 5816.547000242607 and parameters: {'model_name': 'SimpleImputer', 'strategy': 'mean'}. Best is trial 15 with value: 5816.547000242607.
[I 2024-04-01 19:05:27,423] Trial 121 finished with value: 5816.547000242607 and parameters: {'model_name': 'SimpleImputer', 'strategy': 'mean'}. Best is trial 15 with value: 5816.547000242607.
[I 2024-04-01 19:05:27,624] Trial 124 finished with value: 5816.547000242607 and parameters: {'model_name': 'SimpleImputer', 'strategy': 'mean'}. Best is trial 15 with value: 5816.547000242607.
[I 2024-04-01 19:05:27,858] Trial 115 finished with value: 5816.547000242607 and parameters: {'model_name': 'SimpleImputer', 'strategy': 'mean'}. Best is trial 15 with value: 5816.547000242607.
[I 2024-04-01 19:05:28,088] Trial 125 finished with value: 5816.547000242607 and parameters: {'model_name': 'SimpleImputer', 'strategy': 'mean'}. Best is trial 15 with value: 5816.547000242607.
[I 2024-04-01 19:05:28,428] Trial 85 finished with value: 6053.876996385362 and parameters: {'model_name': 'SimpleImputer', 'strategy': 'most_frequent'}. Best is trial 15 with value: 5816.547000242607.
[I 2024-04-01 19:05:28,663] Trial 118 finished with value: 5816.547000242607 and parameters: {'model_name': 'SimpleImputer', 'strategy': 'mean'}. Best is trial 15 with value: 5816.547000242607.
[I 2024-04-01 19:05:28,952] Trial 113 finished with value: 5816.547000242607 and parameters: {'model_name': 'SimpleImputer', 'strategy': 'mean'}. Best is trial 15 with value: 5816.547000242607.
[I 2024-04-01 19:05:29,183] Trial 122 finished with value: 5816.547000242607 and parameters: {'model_name': 'SimpleImputer', 'strategy': 'mean'}. Best is trial 15 with value: 5816.547000242607.
[I 2024-04-01 19:05:29,558] Trial 123 finished with value: 5816.547000242607 and parameters: {'model_name': 'SimpleImputer', 'strategy': 'mean'}. Best is trial 15 with value: 5816.547000242607.
[I 2024-04-01 19:05:29,767] Trial 119 finished with value: 5816.547000242607 and parameters: {'model_name': 'SimpleImputer', 'strategy': 'mean'}. Best is trial 15 with value: 5816.547000242607.
[I 2024-04-01 19:05:30,061] Trial 82 finished with value: 6053.876996385362 and parameters: {'model_name': 'SimpleImputer', 'strategy': 'most_frequent'}. Best is trial 15 with value: 5816.547000242607.
[I 2024-04-01 19:05:30,330] Trial 120 finished with value: 5816.547000242607 and parameters: {'model_name': 'SimpleImputer', 'strategy': 'mean'}. Best is trial 15 with value: 5816.547000242607.
[I 2024-04-01 19:05:30,590] Trial 128 finished with value: 5816.547000242607 and parameters: {'model_name': 'SimpleImputer', 'strategy': 'mean'}. Best is trial 15 with value: 5816.547000242607.
[I 2024-04-01 19:05:30,839] Trial 126 finished with value: 5816.547000242607 and parameters: {'model_name': 'SimpleImputer', 'strategy': 'mean'}. Best is trial 15 with value: 5816.547000242607.
[I 2024-04-01 19:05:31,050] Trial 129 finished with value: 5816.547000242607 and parameters: {'model_name': 'SimpleImputer', 'strategy': 'mean'}. Best is trial 15 with value: 5816.547000242607.
[I 2024-04-01 19:05:31,325] Trial 130 finished with value: 5816.547000242607 and parameters: {'model_name': 'SimpleImputer', 'strategy': 'mean'}. Best is trial 15 with value: 5816.547000242607.
[I 2024-04-01 19:05:31,662] Trial 127 finished with value: 5816.547000242607 and parameters: {'model_name': 'SimpleImputer', 'strategy': 'mean'}. Best is trial 15 with value: 5816.547000242607.
[I 2024-04-01 19:05:31,930] Trial 83 finished with value: 6053.876996385362 and parameters: {'model_name': 'SimpleImputer', 'strategy': 'most_frequent'}. Best is trial 15 with value: 5816.547000242607.
[I 2024-04-01 19:05:32,269] Trial 132 finished with value: 5816.547000242607 and parameters: {'model_name': 'SimpleImputer', 'strategy': 'mean'}. Best is trial 15 with value: 5816.547000242607.
[I 2024-04-01 19:05:32,638] Trial 131 finished with value: 5816.547000242607 and parameters: {'model_name': 'SimpleImputer', 'strategy': 'mean'}. Best is trial 15 with value: 5816.547000242607.
[I 2024-04-01 19:05:32,973] Trial 133 finished with value: 5816.547000242607 and parameters: {'model_name': 'SimpleImputer', 'strategy': 'mean'}. Best is trial 15 with value: 5816.547000242607.
[I 2024-04-01 19:05:33,226] Trial 87 finished with value: 6053.876996385362 and parameters: {'model_name': 'SimpleImputer', 'strategy': 'most_frequent'}. Best is trial 15 with value: 5816.547000242607.
[I 2024-04-01 19:05:33,504] Trial 134 finished with value: 5816.547000242607 and parameters: {'model_name': 'SimpleImputer', 'strategy': 'mean'}. Best is trial 15 with value: 5816.547000242607.
[I 2024-04-01 19:05:33,875] Trial 135 finished with value: 5816.547000242607 and parameters: {'model_name': 'SimpleImputer', 'strategy': 'mean'}. Best is trial 15 with value: 5816.547000242607.
[I 2024-04-01 19:05:34,094] Trial 88 finished with value: 6053.876996385362 and parameters: {'model_name': 'SimpleImputer', 'strategy': 'most_frequent'}. Best is trial 15 with value: 5816.547000242607.
[I 2024-04-01 19:05:34,311] Trial 139 finished with value: 5816.547000242607 and parameters: {'model_name': 'SimpleImputer', 'strategy': 'mean'}. Best is trial 15 with value: 5816.547000242607.
[I 2024-04-01 19:05:34,664] Trial 142 finished with value: 5816.547000242607 and parameters: {'model_name': 'SimpleImputer', 'strategy': 'mean'}. Best is trial 15 with value: 5816.547000242607.
[I 2024-04-01 19:05:34,903] Trial 136 finished with value: 5816.547000242607 and parameters: {'model_name': 'SimpleImputer', 'strategy': 'mean'}. Best is trial 15 with value: 5816.547000242607.
[I 2024-04-01 19:05:35,147] Trial 90 finished with value: 6053.876996385362 and parameters: {'model_name': 'SimpleImputer', 'strategy': 'most_frequent'}. Best is trial 15 with value: 5816.547000242607.
[I 2024-04-01 19:05:35,356] Trial 144 finished with value: 5816.547000242607 and parameters: {'model_name': 'SimpleImputer', 'strategy': 'mean'}. Best is trial 15 with value: 5816.547000242607.
[I 2024-04-01 19:05:35,581] Trial 86 finished with value: 6053.876996385362 and parameters: {'model_name': 'SimpleImputer', 'strategy': 'most_frequent'}. Best is trial 15 with value: 5816.547000242607.
[I 2024-04-01 19:05:35,814] Trial 146 finished with value: 5816.547000242607 and parameters: {'model_name': 'SimpleImputer', 'strategy': 'mean'}. Best is trial 15 with value: 5816.547000242607.
[I 2024-04-01 19:05:36,033] Trial 140 finished with value: 5816.547000242607 and parameters: {'model_name': 'SimpleImputer', 'strategy': 'mean'}. Best is trial 15 with value: 5816.547000242607.
[I 2024-04-01 19:05:36,244] Trial 137 finished with value: 5816.547000242607 and parameters: {'model_name': 'SimpleImputer', 'strategy': 'mean'}. Best is trial 15 with value: 5816.547000242607.
[I 2024-04-01 19:05:36,485] Trial 147 finished with value: 5816.547000242607 and parameters: {'model_name': 'SimpleImputer', 'strategy': 'mean'}. Best is trial 15 with value: 5816.547000242607.
[I 2024-04-01 19:05:36,738] Trial 145 finished with value: 5816.547000242607 and parameters: {'model_name': 'SimpleImputer', 'strategy': 'mean'}. Best is trial 15 with value: 5816.547000242607.
[I 2024-04-01 19:05:36,962] Trial 151 finished with value: 5816.547000242607 and parameters: {'model_name': 'SimpleImputer', 'strategy': 'mean'}. Best is trial 15 with value: 5816.547000242607.
[I 2024-04-01 19:05:37,175] Trial 143 finished with value: 5816.547000242607 and parameters: {'model_name': 'SimpleImputer', 'strategy': 'mean'}. Best is trial 15 with value: 5816.547000242607.
[I 2024-04-01 19:05:37,450] Trial 138 finished with value: 5816.547000242607 and parameters: {'model_name': 'SimpleImputer', 'strategy': 'mean'}. Best is trial 15 with value: 5816.547000242607.
[I 2024-04-01 19:05:37,966] Trial 150 finished with value: 5816.547000242607 and parameters: {'model_name': 'SimpleImputer', 'strategy': 'mean'}. Best is trial 15 with value: 5816.547000242607.
[I 2024-04-01 19:05:38,260] Trial 141 finished with value: 5816.547000242607 and parameters: {'model_name': 'SimpleImputer', 'strategy': 'mean'}. Best is trial 15 with value: 5816.547000242607.
[I 2024-04-01 19:05:38,661] Trial 158 finished with value: 5816.547000242607 and parameters: {'model_name': 'SimpleImputer', 'strategy': 'mean'}. Best is trial 15 with value: 5816.547000242607.
[I 2024-04-01 19:05:38,896] Trial 148 finished with value: 5816.547000242607 and parameters: {'model_name': 'SimpleImputer', 'strategy': 'mean'}. Best is trial 15 with value: 5816.547000242607.
[I 2024-04-01 19:05:39,122] Trial 149 finished with value: 5816.547000242607 and parameters: {'model_name': 'SimpleImputer', 'strategy': 'mean'}. Best is trial 15 with value: 5816.547000242607.
[I 2024-04-01 19:05:39,341] Trial 89 finished with value: 6053.876996385362 and parameters: {'model_name': 'SimpleImputer', 'strategy': 'most_frequent'}. Best is trial 15 with value: 5816.547000242607.
[I 2024-04-01 19:05:39,789] Trial 157 finished with value: 5816.547000242607 and parameters: {'model_name': 'SimpleImputer', 'strategy': 'mean'}. Best is trial 15 with value: 5816.547000242607.
[I 2024-04-01 19:05:40,005] Trial 154 finished with value: 5816.547000242607 and parameters: {'model_name': 'SimpleImputer', 'strategy': 'mean'}. Best is trial 15 with value: 5816.547000242607.
[I 2024-04-01 19:05:40,263] Trial 163 finished with value: 5816.547000242607 and parameters: {'model_name': 'SimpleImputer', 'strategy': 'mean'}. Best is trial 15 with value: 5816.547000242607.
[I 2024-04-01 19:05:40,541] Trial 162 finished with value: 5816.547000242607 and parameters: {'model_name': 'SimpleImputer', 'strategy': 'mean'}. Best is trial 15 with value: 5816.547000242607.
[I 2024-04-01 19:05:40,845] Trial 152 finished with value: 5816.547000242607 and parameters: {'model_name': 'SimpleImputer', 'strategy': 'mean'}. Best is trial 15 with value: 5816.547000242607.
[I 2024-04-01 19:05:41,080] Trial 153 finished with value: 5816.547000242607 and parameters: {'model_name': 'SimpleImputer', 'strategy': 'mean'}. Best is trial 15 with value: 5816.547000242607.
[I 2024-04-01 19:05:41,290] Trial 175 finished with value: 6053.877005088034 and parameters: {'model_name': 'SimpleImputer', 'strategy': 'constant'}. Best is trial 15 with value: 5816.547000242607.
[I 2024-04-01 19:05:41,501] Trial 164 finished with value: 5816.547000242607 and parameters: {'model_name': 'SimpleImputer', 'strategy': 'mean'}. Best is trial 15 with value: 5816.547000242607.
[I 2024-04-01 19:05:41,717] Trial 160 finished with value: 5816.547000242607 and parameters: {'model_name': 'SimpleImputer', 'strategy': 'mean'}. Best is trial 15 with value: 5816.547000242607.
[I 2024-04-01 19:05:41,919] Trial 156 finished with value: 5816.547000242607 and parameters: {'model_name': 'SimpleImputer', 'strategy': 'mean'}. Best is trial 15 with value: 5816.547000242607.
[I 2024-04-01 19:05:42,139] Trial 172 finished with value: 6053.877005088034 and parameters: {'model_name': 'SimpleImputer', 'strategy': 'constant'}. Best is trial 15 with value: 5816.547000242607.
[I 2024-04-01 19:05:42,344] Trial 155 finished with value: 5816.547000242607 and parameters: {'model_name': 'SimpleImputer', 'strategy': 'mean'}. Best is trial 15 with value: 5816.547000242607.
[I 2024-04-01 19:05:42,547] Trial 161 finished with value: 5816.547000242607 and parameters: {'model_name': 'SimpleImputer', 'strategy': 'mean'}. Best is trial 15 with value: 5816.547000242607.
[I 2024-04-01 19:05:42,753] Trial 171 finished with value: 6053.877005088034 and parameters: {'model_name': 'SimpleImputer', 'strategy': 'constant'}. Best is trial 15 with value: 5816.547000242607.
[I 2024-04-01 19:05:43,063] Trial 159 finished with value: 5816.547000242607 and parameters: {'model_name': 'SimpleImputer', 'strategy': 'mean'}. Best is trial 15 with value: 5816.547000242607.
[I 2024-04-01 19:05:43,325] Trial 169 finished with value: 5816.547000242607 and parameters: {'model_name': 'SimpleImputer', 'strategy': 'mean'}. Best is trial 15 with value: 5816.547000242607.
[I 2024-04-01 19:05:43,545] Trial 177 finished with value: 6053.877005088034 and parameters: {'model_name': 'SimpleImputer', 'strategy': 'constant'}. Best is trial 15 with value: 5816.547000242607.
[I 2024-04-01 19:05:43,758] Trial 173 finished with value: 6053.877005088034 and parameters: {'model_name': 'SimpleImputer', 'strategy': 'constant'}. Best is trial 15 with value: 5816.547000242607.
[I 2024-04-01 19:05:43,975] Trial 166 finished with value: 5816.547000242607 and parameters: {'model_name': 'SimpleImputer', 'strategy': 'mean'}. Best is trial 15 with value: 5816.547000242607.
[I 2024-04-01 19:05:44,240] Trial 179 finished with value: 6053.877005088034 and parameters: {'model_name': 'SimpleImputer', 'strategy': 'constant'}. Best is trial 15 with value: 5816.547000242607.
[I 2024-04-01 19:05:44,470] Trial 181 finished with value: 6053.877005088034 and parameters: {'model_name': 'SimpleImputer', 'strategy': 'constant'}. Best is trial 15 with value: 5816.547000242607.
[I 2024-04-01 19:05:44,739] Trial 174 finished with value: 6053.877005088034 and parameters: {'model_name': 'SimpleImputer', 'strategy': 'constant'}. Best is trial 15 with value: 5816.547000242607.
[I 2024-04-01 19:05:44,953] Trial 176 finished with value: 6053.877005088034 and parameters: {'model_name': 'SimpleImputer', 'strategy': 'constant'}. Best is trial 15 with value: 5816.547000242607.
[I 2024-04-01 19:05:45,160] Trial 170 finished with value: 5816.547000242607 and parameters: {'model_name': 'SimpleImputer', 'strategy': 'mean'}. Best is trial 15 with value: 5816.547000242607.
[I 2024-04-01 19:05:45,503] Trial 168 finished with value: 5816.547000242607 and parameters: {'model_name': 'SimpleImputer', 'strategy': 'mean'}. Best is trial 15 with value: 5816.547000242607.
[I 2024-04-01 19:05:45,730] Trial 165 finished with value: 5816.547000242607 and parameters: {'model_name': 'SimpleImputer', 'strategy': 'mean'}. Best is trial 15 with value: 5816.547000242607.
[I 2024-04-01 19:05:45,939] Trial 187 finished with value: 6053.877005088034 and parameters: {'model_name': 'SimpleImputer', 'strategy': 'constant'}. Best is trial 15 with value: 5816.547000242607.
[I 2024-04-01 19:05:46,155] Trial 167 finished with value: 5816.547000242607 and parameters: {'model_name': 'SimpleImputer', 'strategy': 'mean'}. Best is trial 15 with value: 5816.547000242607.
[I 2024-04-01 19:05:46,381] Trial 185 finished with value: 6053.877005088034 and parameters: {'model_name': 'SimpleImputer', 'strategy': 'constant'}. Best is trial 15 with value: 5816.547000242607.
[I 2024-04-01 19:05:46,586] Trial 182 finished with value: 6053.877005088034 and parameters: {'model_name': 'SimpleImputer', 'strategy': 'constant'}. Best is trial 15 with value: 5816.547000242607.
[I 2024-04-01 19:05:46,822] Trial 186 finished with value: 6053.877005088034 and parameters: {'model_name': 'SimpleImputer', 'strategy': 'constant'}. Best is trial 15 with value: 5816.547000242607.
[I 2024-04-01 19:05:47,040] Trial 178 finished with value: 6053.877005088034 and parameters: {'model_name': 'SimpleImputer', 'strategy': 'constant'}. Best is trial 15 with value: 5816.547000242607.
[I 2024-04-01 19:05:47,277] Trial 188 finished with value: 6053.877005088034 and parameters: {'model_name': 'SimpleImputer', 'strategy': 'constant'}. Best is trial 15 with value: 5816.547000242607.
[I 2024-04-01 19:05:47,529] Trial 195 finished with value: 6053.877005088034 and parameters: {'model_name': 'SimpleImputer', 'strategy': 'constant'}. Best is trial 15 with value: 5816.547000242607.
[I 2024-04-01 19:05:47,749] Trial 183 finished with value: 6053.877005088034 and parameters: {'model_name': 'SimpleImputer', 'strategy': 'constant'}. Best is trial 15 with value: 5816.547000242607.
[I 2024-04-01 19:05:47,971] Trial 184 finished with value: 6053.877005088034 and parameters: {'model_name': 'SimpleImputer', 'strategy': 'constant'}. Best is trial 15 with value: 5816.547000242607.
[I 2024-04-01 19:05:48,185] Trial 191 finished with value: 6053.877005088034 and parameters: {'model_name': 'SimpleImputer', 'strategy': 'constant'}. Best is trial 15 with value: 5816.547000242607.
[I 2024-04-01 19:05:48,436] Trial 189 finished with value: 6053.877005088034 and parameters: {'model_name': 'SimpleImputer', 'strategy': 'constant'}. Best is trial 15 with value: 5816.547000242607.
[I 2024-04-01 19:05:48,654] Trial 180 finished with value: 5816.547000242607 and parameters: {'model_name': 'SimpleImputer', 'strategy': 'mean'}. Best is trial 15 with value: 5816.547000242607.
[I 2024-04-01 19:05:48,859] Trial 194 finished with value: 6053.877005088034 and parameters: {'model_name': 'SimpleImputer', 'strategy': 'constant'}. Best is trial 15 with value: 5816.547000242607.
[I 2024-04-01 19:05:49,066] Trial 190 finished with value: 6053.877005088034 and parameters: {'model_name': 'SimpleImputer', 'strategy': 'constant'}. Best is trial 15 with value: 5816.547000242607.
[I 2024-04-01 19:05:49,311] Trial 197 finished with value: 6053.877005088034 and parameters: {'model_name': 'SimpleImputer', 'strategy': 'constant'}. Best is trial 15 with value: 5816.547000242607.
[I 2024-04-01 19:05:49,524] Trial 199 finished with value: 6053.877005088034 and parameters: {'model_name': 'SimpleImputer', 'strategy': 'constant'}. Best is trial 15 with value: 5816.547000242607.
[I 2024-04-01 19:05:49,757] Trial 196 finished with value: 5816.547000242607 and parameters: {'model_name': 'SimpleImputer', 'strategy': 'mean'}. Best is trial 15 with value: 5816.547000242607.
[I 2024-04-01 19:05:49,964] Trial 198 finished with value: 6053.877005088034 and parameters: {'model_name': 'SimpleImputer', 'strategy': 'constant'}. Best is trial 15 with value: 5816.547000242607.
[I 2024-04-01 19:05:50,170] Trial 192 finished with value: 5816.547000242607 and parameters: {'model_name': 'SimpleImputer', 'strategy': 'mean'}. Best is trial 15 with value: 5816.547000242607.
[I 2024-04-01 19:05:50,367] Trial 193 finished with value: 5816.547000242607 and parameters: {'model_name': 'SimpleImputer', 'strategy': 'mean'}. Best is trial 15 with value: 5816.547000242607.
