[I 2024-01-06 18:19:22,954] Trial 55 finished with value: 1658.331655790352 and parameters: {'model_name': 'IterativeImputer', 'sample_posterior': True, 'initial_strategy': 'mean', 'imputation_order': 'roman'}. Best is trial 67 with value: 1308.4125163406825.
[I 2024-01-06 18:19:26,508] Trial 61 finished with value: 1678.5408599935 and parameters: {'model_name': 'IterativeImputer', 'sample_posterior': True, 'initial_strategy': 'constant', 'imputation_order': 'roman'}. Best is trial 67 with value: 1308.4125163406825.
[I 2024-01-06 18:19:33,179] Trial 66 finished with value: 1687.975698192057 and parameters: {'model_name': 'IterativeImputer', 'sample_posterior': True, 'initial_strategy': 'most_frequent', 'imputation_order': 'roman'}. Best is trial 67 with value: 1308.4125163406825.
[I 2024-01-06 18:20:02,861] Trial 19 finished with value: 1345.5751331733468 and parameters: {'model_name': 'GAIN', 'batch_size': 71, 'hint_rate': 0.61, 'alpha': 48, 'iterations': 331}. Best is trial 67 with value: 1308.4125163406825.
[I 2024-01-06 18:20:35,555] Trial 63 finished with value: 1310.7083310996381 and parameters: {'model_name': 'RandomForestImputer', 'max_iter': 7, 'decreasing': True, 'min_samples_split': 0.9, 'min_samples_leaf': 0.7000000000000001, 'max_features': 0.4, 'warm_start': False}. Best is trial 67 with value: 1308.4125163406825.
[I 2024-01-06 18:21:01,609] Trial 75 finished with value: 1678.2317301116195 and parameters: {'model_name': 'IterativeImputer', 'sample_posterior': True, 'initial_strategy': 'mean', 'imputation_order': 'descending'}. Best is trial 67 with value: 1308.4125163406825.
[I 2024-01-06 18:21:04,831] Trial 74 finished with value: 1683.9326511350398 and parameters: {'model_name': 'IterativeImputer', 'sample_posterior': True, 'initial_strategy': 'median', 'imputation_order': 'descending'}. Best is trial 67 with value: 1308.4125163406825.
[I 2024-01-06 18:21:14,356] Trial 62 finished with value: 1310.5844536215377 and parameters: {'model_name': 'RandomForestImputer', 'max_iter': 9, 'decreasing': False, 'min_samples_split': 0.1, 'min_samples_leaf': 0.5, 'max_features': 0.5, 'warm_start': False}. Best is trial 67 with value: 1308.4125163406825.
[I 2024-01-06 18:21:19,538] Trial 76 finished with value: 1689.6801397785032 and parameters: {'model_name': 'IterativeImputer', 'sample_posterior': True, 'initial_strategy': 'constant', 'imputation_order': 'arabic'}. Best is trial 67 with value: 1308.4125163406825.
[I 2024-01-06 18:21:27,702] Trial 77 finished with value: 1687.096181386599 and parameters: {'model_name': 'IterativeImputer', 'sample_posterior': True, 'initial_strategy': 'constant', 'imputation_order': 'descending'}. Best is trial 67 with value: 1308.4125163406825.
[I 2024-01-06 18:21:33,401] Trial 79 finished with value: 1681.713581409523 and parameters: {'model_name': 'IterativeImputer', 'sample_posterior': True, 'initial_strategy': 'median', 'imputation_order': 'descending'}. Best is trial 67 with value: 1308.4125163406825.
[I 2024-01-06 18:22:07,800] Trial 128 finished with value: 1309.2346159064166 and parameters: {'model_name': 'IterativeImputer', 'sample_posterior': False, 'initial_strategy': 'most_frequent', 'imputation_order': 'random'}. Best is trial 67 with value: 1308.4125163406825.
[I 2024-01-06 18:22:09,670] Trial 129 finished with value: 1309.234787484151 and parameters: {'model_name': 'IterativeImputer', 'sample_posterior': False, 'initial_strategy': 'most_frequent', 'imputation_order': 'random'}. Best is trial 67 with value: 1308.4125163406825.
[I 2024-01-06 18:22:14,229] Trial 130 finished with value: 1309.2347094286615 and parameters: {'model_name': 'IterativeImputer', 'sample_posterior': False, 'initial_strategy': 'most_frequent', 'imputation_order': 'random'}. Best is trial 67 with value: 1308.4125163406825.
[I 2024-01-06 18:22:16,626] Trial 131 finished with value: 1309.234646061493 and parameters: {'model_name': 'IterativeImputer', 'sample_posterior': False, 'initial_strategy': 'most_frequent', 'imputation_order': 'random'}. Best is trial 67 with value: 1308.4125163406825.
[I 2024-01-06 18:22:23,178] Trial 132 finished with value: 1309.2348363475103 and parameters: {'model_name': 'IterativeImputer', 'sample_posterior': False, 'initial_strategy': 'most_frequent', 'imputation_order': 'random'}. Best is trial 67 with value: 1308.4125163406825.
[I 2024-01-06 18:22:32,006] Trial 145 finished with value: 1318.737490769386 and parameters: {'model_name': 'SimpleImputer', 'strategy': 'most_frequent'}. Best is trial 67 with value: 1308.4125163406825.
[I 2024-01-06 18:22:54,919] Trial 133 finished with value: 1309.2345705262626 and parameters: {'model_name': 'IterativeImputer', 'sample_posterior': False, 'initial_strategy': 'most_frequent', 'imputation_order': 'random'}. Best is trial 67 with value: 1308.4125163406825.
[I 2024-01-06 18:23:34,221] Trial 134 finished with value: 1309.2347453971704 and parameters: {'model_name': 'IterativeImputer', 'sample_posterior': False, 'initial_strategy': 'most_frequent', 'imputation_order': 'random'}. Best is trial 67 with value: 1308.4125163406825.
[I 2024-01-06 18:23:43,791] Trial 146 finished with value: 2416.012199710599 and parameters: {'model_name': 'GAIN', 'batch_size': 6, 'hint_rate': 0.06999999999999999, 'alpha': 61, 'iterations': 1}. Best is trial 67 with value: 1308.4125163406825.
[I 2024-01-06 18:24:05,706] Trial 135 finished with value: 1309.2347682042484 and parameters: {'model_name': 'IterativeImputer', 'sample_posterior': False, 'initial_strategy': 'most_frequent', 'imputation_order': 'random'}. Best is trial 67 with value: 1308.4125163406825.
[I 2024-01-06 18:24:09,658] Trial 136 finished with value: 1309.234700893896 and parameters: {'model_name': 'IterativeImputer', 'sample_posterior': False, 'initial_strategy': 'most_frequent', 'imputation_order': 'random'}. Best is trial 67 with value: 1308.4125163406825.
[I 2024-01-06 18:24:23,518] Trial 137 finished with value: 1309.2346730409836 and parameters: {'model_name': 'IterativeImputer', 'sample_posterior': False, 'initial_strategy': 'most_frequent', 'imputation_order': 'random'}. Best is trial 67 with value: 1308.4125163406825.
[I 2024-01-06 18:24:28,013] Trial 138 finished with value: 1309.2347332624531 and parameters: {'model_name': 'IterativeImputer', 'sample_posterior': False, 'initial_strategy': 'most_frequent', 'imputation_order': 'random'}. Best is trial 67 with value: 1308.4125163406825.
[I 2024-01-06 18:24:29,580] Trial 147 finished with value: 2303.993099813403 and parameters: {'model_name': 'GAIN', 'batch_size': 5, 'hint_rate': 0.05, 'alpha': 63, 'iterations': 1}. Best is trial 67 with value: 1308.4125163406825.
[I 2024-01-06 18:24:35,964] Trial 139 finished with value: 1309.2346325347885 and parameters: {'model_name': 'IterativeImputer', 'sample_posterior': False, 'initial_strategy': 'most_frequent', 'imputation_order': 'random'}. Best is trial 67 with value: 1308.4125163406825.
[I 2024-01-06 18:24:44,360] Trial 140 finished with value: 1309.2346422821543 and parameters: {'model_name': 'IterativeImputer', 'sample_posterior': False, 'initial_strategy': 'most_frequent', 'imputation_order': 'random'}. Best is trial 67 with value: 1308.4125163406825.
[I 2024-01-06 18:25:13,333] Trial 141 finished with value: 1309.234635221322 and parameters: {'model_name': 'IterativeImputer', 'sample_posterior': False, 'initial_strategy': 'most_frequent', 'imputation_order': 'random'}. Best is trial 67 with value: 1308.4125163406825.
[I 2024-01-06 18:25:14,976] Trial 142 finished with value: 1309.2346794358573 and parameters: {'model_name': 'IterativeImputer', 'sample_posterior': False, 'initial_strategy': 'most_frequent', 'imputation_order': 'random'}. Best is trial 67 with value: 1308.4125163406825.
[I 2024-01-06 18:25:21,957] Trial 144 finished with value: 1309.2346668208236 and parameters: {'model_name': 'IterativeImputer', 'sample_posterior': False, 'initial_strategy': 'most_frequent', 'imputation_order': 'random'}. Best is trial 67 with value: 1308.4125163406825.
[I 2024-01-06 18:25:24,107] Trial 143 finished with value: 1309.2346848591728 and parameters: {'model_name': 'IterativeImputer', 'sample_posterior': False, 'initial_strategy': 'most_frequent', 'imputation_order': 'random'}. Best is trial 67 with value: 1308.4125163406825.
[I 2024-01-06 18:25:52,718] Trial 100 finished with value: 1705.433243419807 and parameters: {'model_name': 'IterativeImputer', 'sample_posterior': True, 'initial_strategy': 'most_frequent', 'imputation_order': 'random'}. Best is trial 67 with value: 1308.4125163406825.
[I 2024-01-06 18:25:58,128] Trial 53 finished with value: 1310.8483179563034 and parameters: {'model_name': 'RandomForestImputer', 'max_iter': 11, 'decreasing': True, 'min_samples_split': 0.0, 'min_samples_leaf': 0.8, 'max_features': 0.7000000000000001, 'warm_start': False}. Best is trial 67 with value: 1308.4125163406825.
[I 2024-01-06 18:26:05,811] Trial 101 finished with value: 1684.866822619438 and parameters: {'model_name': 'IterativeImputer', 'sample_posterior': True, 'initial_strategy': 'most_frequent', 'imputation_order': 'random'}. Best is trial 67 with value: 1308.4125163406825.
[I 2024-01-06 18:26:09,780] Trial 103 finished with value: 1694.12216989326 and parameters: {'model_name': 'IterativeImputer', 'sample_posterior': True, 'initial_strategy': 'most_frequent', 'imputation_order': 'random'}. Best is trial 67 with value: 1308.4125163406825.
[I 2024-01-06 18:26:12,414] Trial 164 finished with value: 1318.737490769386 and parameters: {'model_name': 'SimpleImputer', 'strategy': 'median'}. Best is trial 67 with value: 1308.4125163406825.
[I 2024-01-06 18:26:13,761] Trial 102 finished with value: 1690.6085818990032 and parameters: {'model_name': 'IterativeImputer', 'sample_posterior': True, 'initial_strategy': 'most_frequent', 'imputation_order': 'random'}. Best is trial 67 with value: 1308.4125163406825.
[I 2024-01-06 18:26:18,667] Trial 104 finished with value: 1669.476510712042 and parameters: {'model_name': 'IterativeImputer', 'sample_posterior': True, 'initial_strategy': 'most_frequent', 'imputation_order': 'random'}. Best is trial 67 with value: 1308.4125163406825.
[I 2024-01-06 18:26:20,569] Trial 106 finished with value: 1687.2730797774555 and parameters: {'model_name': 'IterativeImputer', 'sample_posterior': True, 'initial_strategy': 'mean', 'imputation_order': 'random'}. Best is trial 67 with value: 1308.4125163406825.
[I 2024-01-06 18:26:26,350] Trial 105 finished with value: 1659.8225899534232 and parameters: {'model_name': 'IterativeImputer', 'sample_posterior': True, 'initial_strategy': 'most_frequent', 'imputation_order': 'random'}. Best is trial 67 with value: 1308.4125163406825.
[I 2024-01-06 18:26:34,037] Trial 107 finished with value: 1674.8283313938718 and parameters: {'model_name': 'IterativeImputer', 'sample_posterior': True, 'initial_strategy': 'mean', 'imputation_order': 'random'}. Best is trial 67 with value: 1308.4125163406825.
[I 2024-01-06 18:26:47,241] Trial 108 finished with value: 1681.9832578380178 and parameters: {'model_name': 'IterativeImputer', 'sample_posterior': True, 'initial_strategy': 'most_frequent', 'imputation_order': 'random'}. Best is trial 67 with value: 1308.4125163406825.
[I 2024-01-06 18:26:54,874] Trial 148 finished with value: 1309.2346296167239 and parameters: {'model_name': 'IterativeImputer', 'sample_posterior': False, 'initial_strategy': 'most_frequent', 'imputation_order': 'random'}. Best is trial 67 with value: 1308.4125163406825.
[I 2024-01-06 18:27:01,938] Trial 149 finished with value: 1309.2346893321107 and parameters: {'model_name': 'IterativeImputer', 'sample_posterior': False, 'initial_strategy': 'most_frequent', 'imputation_order': 'random'}. Best is trial 67 with value: 1308.4125163406825.
[I 2024-01-06 18:27:03,251] Trial 109 finished with value: 1695.1226669901753 and parameters: {'model_name': 'IterativeImputer', 'sample_posterior': True, 'initial_strategy': 'most_frequent', 'imputation_order': 'random'}. Best is trial 67 with value: 1308.4125163406825.
[I 2024-01-06 18:27:10,963] Trial 112 finished with value: 1683.4077248820454 and parameters: {'model_name': 'IterativeImputer', 'sample_posterior': True, 'initial_strategy': 'mean', 'imputation_order': 'random'}. Best is trial 67 with value: 1308.4125163406825.
[I 2024-01-06 18:27:12,786] Trial 110 finished with value: 1669.0677536277933 and parameters: {'model_name': 'IterativeImputer', 'sample_posterior': True, 'initial_strategy': 'most_frequent', 'imputation_order': 'random'}. Best is trial 67 with value: 1308.4125163406825.
[I 2024-01-06 18:27:13,781] Trial 111 finished with value: 1683.7291270951678 and parameters: {'model_name': 'IterativeImputer', 'sample_posterior': True, 'initial_strategy': 'mean', 'imputation_order': 'random'}. Best is trial 67 with value: 1308.4125163406825.
[I 2024-01-06 18:27:25,798] Trial 114 finished with value: 1686.5112783901277 and parameters: {'model_name': 'IterativeImputer', 'sample_posterior': True, 'initial_strategy': 'most_frequent', 'imputation_order': 'random'}. Best is trial 67 with value: 1308.4125163406825.
[I 2024-01-06 18:27:31,706] Trial 176 finished with value: 1363.2811338199656 and parameters: {'model_name': 'KNNImputer', 'weights': 'distance', 'keep_empty_features': False}. Best is trial 67 with value: 1308.4125163406825.
[I 2024-01-06 18:27:32,707] Trial 113 finished with value: 1640.702188637952 and parameters: {'model_name': 'IterativeImputer', 'sample_posterior': True, 'initial_strategy': 'most_frequent', 'imputation_order': 'random'}. Best is trial 67 with value: 1308.4125163406825.
[I 2024-01-06 18:27:34,853] Trial 150 finished with value: 1309.2347052365985 and parameters: {'model_name': 'IterativeImputer', 'sample_posterior': False, 'initial_strategy': 'most_frequent', 'imputation_order': 'random'}. Best is trial 67 with value: 1308.4125163406825.
[I 2024-01-06 18:27:38,071] Trial 115 finished with value: 1680.8796702990062 and parameters: {'model_name': 'IterativeImputer', 'sample_posterior': True, 'initial_strategy': 'most_frequent', 'imputation_order': 'random'}. Best is trial 67 with value: 1308.4125163406825.
[I 2024-01-06 18:27:41,392] Trial 151 finished with value: 1309.234679620678 and parameters: {'model_name': 'IterativeImputer', 'sample_posterior': False, 'initial_strategy': 'most_frequent', 'imputation_order': 'random'}. Best is trial 67 with value: 1308.4125163406825.
[I 2024-01-06 18:27:46,886] Trial 116 finished with value: 1669.5975920247652 and parameters: {'model_name': 'IterativeImputer', 'sample_posterior': True, 'initial_strategy': 'most_frequent', 'imputation_order': 'random'}. Best is trial 67 with value: 1308.4125163406825.
[I 2024-01-06 18:27:55,069] Trial 152 finished with value: 1309.2346725362609 and parameters: {'model_name': 'IterativeImputer', 'sample_posterior': False, 'initial_strategy': 'most_frequent', 'imputation_order': 'random'}. Best is trial 67 with value: 1308.4125163406825.
[I 2024-01-06 18:28:01,983] Trial 153 finished with value: 1309.2347667554566 and parameters: {'model_name': 'IterativeImputer', 'sample_posterior': False, 'initial_strategy': 'most_frequent', 'imputation_order': 'random'}. Best is trial 67 with value: 1308.4125163406825.
[I 2024-01-06 18:28:03,225] Trial 117 finished with value: 1688.3816550291267 and parameters: {'model_name': 'IterativeImputer', 'sample_posterior': True, 'initial_strategy': 'most_frequent', 'imputation_order': 'random'}. Best is trial 67 with value: 1308.4125163406825.
[I 2024-01-06 18:28:08,694] Trial 154 finished with value: 1309.2347052355865 and parameters: {'model_name': 'IterativeImputer', 'sample_posterior': False, 'initial_strategy': 'most_frequent', 'imputation_order': 'random'}. Best is trial 67 with value: 1308.4125163406825.
[I 2024-01-06 18:28:11,872] Trial 187 finished with value: inf and parameters: {'model_name': 'GAIN', 'batch_size': 773, 'hint_rate': 0.36000000000000004, 'alpha': 100, 'iterations': 33017}. Best is trial 67 with value: 1308.4125163406825.
[I 2024-01-06 18:28:14,968] Trial 186 finished with value: inf and parameters: {'model_name': 'GAIN', 'batch_size': 713, 'hint_rate': 0.34, 'alpha': 1, 'iterations': 57438}. Best is trial 67 with value: 1308.4125163406825.
[I 2024-01-06 18:28:17,601] Trial 155 finished with value: 1309.2346941802348 and parameters: {'model_name': 'IterativeImputer', 'sample_posterior': False, 'initial_strategy': 'most_frequent', 'imputation_order': 'random'}. Best is trial 67 with value: 1308.4125163406825.
[I 2024-01-06 18:28:27,330] Trial 156 finished with value: 1309.2346569598244 and parameters: {'model_name': 'IterativeImputer', 'sample_posterior': False, 'initial_strategy': 'most_frequent', 'imputation_order': 'random'}. Best is trial 67 with value: 1308.4125163406825.
[I 2024-01-06 18:28:43,713] Trial 119 finished with value: 1669.3621960848627 and parameters: {'model_name': 'IterativeImputer', 'sample_posterior': True, 'initial_strategy': 'most_frequent', 'imputation_order': 'random'}. Best is trial 67 with value: 1308.4125163406825.
[I 2024-01-06 18:28:44,994] Trial 118 finished with value: 1679.0338426760761 and parameters: {'model_name': 'IterativeImputer', 'sample_posterior': True, 'initial_strategy': 'most_frequent', 'imputation_order': 'random'}. Best is trial 67 with value: 1308.4125163406825.
[I 2024-01-06 18:29:04,332] Trial 120 finished with value: 1656.988456347822 and parameters: {'model_name': 'IterativeImputer', 'sample_posterior': True, 'initial_strategy': 'most_frequent', 'imputation_order': 'random'}. Best is trial 67 with value: 1308.4125163406825.
[I 2024-01-06 18:29:09,630] Trial 157 finished with value: 1309.2345157787404 and parameters: {'model_name': 'IterativeImputer', 'sample_posterior': False, 'initial_strategy': 'most_frequent', 'imputation_order': 'random'}. Best is trial 67 with value: 1308.4125163406825.
[I 2024-01-06 18:29:12,130] Trial 121 finished with value: 1686.9902302299142 and parameters: {'model_name': 'IterativeImputer', 'sample_posterior': True, 'initial_strategy': 'most_frequent', 'imputation_order': 'random'}. Best is trial 67 with value: 1308.4125163406825.
[I 2024-01-06 18:29:13,254] Trial 196 finished with value: 1309.5662779773697 and parameters: {'model_name': 'SimpleImputer', 'strategy': 'mean'}. Best is trial 67 with value: 1308.4125163406825.
[I 2024-01-06 18:29:15,192] Trial 158 finished with value: 1309.2346745362388 and parameters: {'model_name': 'IterativeImputer', 'sample_posterior': False, 'initial_strategy': 'most_frequent', 'imputation_order': 'random'}. Best is trial 67 with value: 1308.4125163406825.
[I 2024-01-06 18:29:19,064] Trial 195 finished with value: 1318.737490769386 and parameters: {'model_name': 'SimpleImputer', 'strategy': 'most_frequent'}. Best is trial 67 with value: 1308.4125163406825.
[I 2024-01-06 18:29:20,236] Trial 159 finished with value: 1309.2345579580474 and parameters: {'model_name': 'IterativeImputer', 'sample_posterior': False, 'initial_strategy': 'most_frequent', 'imputation_order': 'random'}. Best is trial 67 with value: 1308.4125163406825.
[I 2024-01-06 18:29:26,632] Trial 160 finished with value: 1309.234698288386 and parameters: {'model_name': 'IterativeImputer', 'sample_posterior': False, 'initial_strategy': 'most_frequent', 'imputation_order': 'random'}. Best is trial 67 with value: 1308.4125163406825.
[I 2024-01-06 18:30:03,176] Trial 161 finished with value: 1309.2347220565925 and parameters: {'model_name': 'IterativeImputer', 'sample_posterior': False, 'initial_strategy': 'most_frequent', 'imputation_order': 'ascending'}. Best is trial 67 with value: 1308.4125163406825.
[I 2024-01-06 18:30:05,048] Trial 122 finished with value: 1662.2556083082989 and parameters: {'model_name': 'IterativeImputer', 'sample_posterior': True, 'initial_strategy': 'most_frequent', 'imputation_order': 'random'}. Best is trial 67 with value: 1308.4125163406825.
[I 2024-01-06 18:30:08,911] Trial 162 finished with value: 1309.2347220565925 and parameters: {'model_name': 'IterativeImputer', 'sample_posterior': False, 'initial_strategy': 'most_frequent', 'imputation_order': 'ascending'}. Best is trial 67 with value: 1308.4125163406825.
[I 2024-01-06 18:30:15,943] Trial 166 finished with value: 1309.2347220565925 and parameters: {'model_name': 'IterativeImputer', 'sample_posterior': False, 'initial_strategy': 'constant', 'imputation_order': 'ascending'}. Best is trial 67 with value: 1308.4125163406825.
[I 2024-01-06 18:30:19,714] Trial 163 finished with value: 1309.2347220565925 and parameters: {'model_name': 'IterativeImputer', 'sample_posterior': False, 'initial_strategy': 'most_frequent', 'imputation_order': 'ascending'}. Best is trial 67 with value: 1308.4125163406825.
[I 2024-01-06 18:30:21,625] Trial 167 finished with value: 1309.2347220565925 and parameters: {'model_name': 'IterativeImputer', 'sample_posterior': False, 'initial_strategy': 'constant', 'imputation_order': 'ascending'}. Best is trial 67 with value: 1308.4125163406825.
[I 2024-01-06 18:30:27,700] Trial 165 finished with value: 1309.2347220565925 and parameters: {'model_name': 'IterativeImputer', 'sample_posterior': False, 'initial_strategy': 'most_frequent', 'imputation_order': 'ascending'}. Best is trial 67 with value: 1308.4125163406825.
[I 2024-01-06 18:30:31,746] Trial 169 finished with value: 1309.2347220565925 and parameters: {'model_name': 'IterativeImputer', 'sample_posterior': False, 'initial_strategy': 'constant', 'imputation_order': 'ascending'}. Best is trial 67 with value: 1308.4125163406825.
[I 2024-01-06 18:30:34,480] Trial 168 finished with value: 1309.2346750684233 and parameters: {'model_name': 'IterativeImputer', 'sample_posterior': False, 'initial_strategy': 'most_frequent', 'imputation_order': 'random'}. Best is trial 67 with value: 1308.4125163406825.
