[I 2023-12-12 14:47:18,352] Trial 79 finished with value: 1624.6243890981327 and parameters: {'model_name': 'SimpleImputer', 'strategy': 'most_frequent'}. Best is trial 26 with value: 1455.356306763598.
[I 2023-12-12 14:47:18,568] Trial 88 finished with value: 1624.6243890981327 and parameters: {'model_name': 'SimpleImputer', 'strategy': 'most_frequent'}. Best is trial 26 with value: 1455.356306763598.
[I 2023-12-12 14:47:18,773] Trial 116 finished with value: 1455.356306763598 and parameters: {'model_name': 'SimpleImputer', 'strategy': 'mean'}. Best is trial 26 with value: 1455.356306763598.
[I 2023-12-12 14:47:19,009] Trial 72 finished with value: 1624.6243890981327 and parameters: {'model_name': 'SimpleImputer', 'strategy': 'most_frequent'}. Best is trial 26 with value: 1455.356306763598.
[I 2023-12-12 14:47:19,312] Trial 82 finished with value: 1624.6243890981327 and parameters: {'model_name': 'SimpleImputer', 'strategy': 'most_frequent'}. Best is trial 26 with value: 1455.356306763598.
[I 2023-12-12 14:47:19,580] Trial 83 finished with value: 1624.6243890981327 and parameters: {'model_name': 'SimpleImputer', 'strategy': 'most_frequent'}. Best is trial 26 with value: 1455.356306763598.
[I 2023-12-12 14:47:19,844] Trial 117 finished with value: 1455.356306763598 and parameters: {'model_name': 'SimpleImputer', 'strategy': 'mean'}. Best is trial 26 with value: 1455.356306763598.
[I 2023-12-12 14:47:20,123] Trial 119 finished with value: 1455.356306763598 and parameters: {'model_name': 'SimpleImputer', 'strategy': 'mean'}. Best is trial 26 with value: 1455.356306763598.
[I 2023-12-12 14:47:20,383] Trial 122 finished with value: 1455.356306763598 and parameters: {'model_name': 'SimpleImputer', 'strategy': 'mean'}. Best is trial 26 with value: 1455.356306763598.
[I 2023-12-12 14:47:20,607] Trial 91 finished with value: 1624.6243890981327 and parameters: {'model_name': 'SimpleImputer', 'strategy': 'most_frequent'}. Best is trial 26 with value: 1455.356306763598.
[I 2023-12-12 14:47:20,950] Trial 77 finished with value: 1624.6243890981327 and parameters: {'model_name': 'SimpleImputer', 'strategy': 'most_frequent'}. Best is trial 26 with value: 1455.356306763598.
[I 2023-12-12 14:47:21,158] Trial 87 finished with value: 1624.6243890981327 and parameters: {'model_name': 'SimpleImputer', 'strategy': 'most_frequent'}. Best is trial 26 with value: 1455.356306763598.
[I 2023-12-12 14:47:21,380] Trial 92 finished with value: 1624.6243890981327 and parameters: {'model_name': 'SimpleImputer', 'strategy': 'most_frequent'}. Best is trial 26 with value: 1455.356306763598.
[I 2023-12-12 14:47:21,581] Trial 90 finished with value: 1624.6243890981327 and parameters: {'model_name': 'SimpleImputer', 'strategy': 'most_frequent'}. Best is trial 26 with value: 1455.356306763598.
[I 2023-12-12 14:47:21,806] Trial 89 finished with value: 1624.6243890981327 and parameters: {'model_name': 'SimpleImputer', 'strategy': 'most_frequent'}. Best is trial 26 with value: 1455.356306763598.
[I 2023-12-12 14:47:22,026] Trial 123 finished with value: 1455.356306763598 and parameters: {'model_name': 'SimpleImputer', 'strategy': 'mean'}. Best is trial 26 with value: 1455.356306763598.
[I 2023-12-12 14:47:22,321] Trial 81 finished with value: 1624.6243890981327 and parameters: {'model_name': 'SimpleImputer', 'strategy': 'most_frequent'}. Best is trial 26 with value: 1455.356306763598.
[I 2023-12-12 14:47:22,547] Trial 125 finished with value: 1455.356306763598 and parameters: {'model_name': 'SimpleImputer', 'strategy': 'mean'}. Best is trial 26 with value: 1455.356306763598.
[I 2023-12-12 14:47:22,877] Trial 120 finished with value: 1455.356306763598 and parameters: {'model_name': 'SimpleImputer', 'strategy': 'mean'}. Best is trial 26 with value: 1455.356306763598.
[I 2023-12-12 14:47:23,109] Trial 128 finished with value: 1455.356306763598 and parameters: {'model_name': 'SimpleImputer', 'strategy': 'mean'}. Best is trial 26 with value: 1455.356306763598.
[I 2023-12-12 14:47:23,362] Trial 131 finished with value: 1455.356306763598 and parameters: {'model_name': 'SimpleImputer', 'strategy': 'mean'}. Best is trial 26 with value: 1455.356306763598.
[I 2023-12-12 14:47:23,570] Trial 126 finished with value: 1455.356306763598 and parameters: {'model_name': 'SimpleImputer', 'strategy': 'mean'}. Best is trial 26 with value: 1455.356306763598.
[I 2023-12-12 14:47:23,803] Trial 137 finished with value: 1455.356306763598 and parameters: {'model_name': 'SimpleImputer', 'strategy': 'mean'}. Best is trial 26 with value: 1455.356306763598.
[I 2023-12-12 14:47:24,060] Trial 132 finished with value: 1455.356306763598 and parameters: {'model_name': 'SimpleImputer', 'strategy': 'mean'}. Best is trial 26 with value: 1455.356306763598.
[I 2023-12-12 14:47:24,321] Trial 121 finished with value: 1455.356306763598 and parameters: {'model_name': 'SimpleImputer', 'strategy': 'mean'}. Best is trial 26 with value: 1455.356306763598.
[I 2023-12-12 14:47:24,532] Trial 134 finished with value: 1455.356306763598 and parameters: {'model_name': 'SimpleImputer', 'strategy': 'mean'}. Best is trial 26 with value: 1455.356306763598.
[I 2023-12-12 14:47:24,733] Trial 124 finished with value: 1455.356306763598 and parameters: {'model_name': 'SimpleImputer', 'strategy': 'mean'}. Best is trial 26 with value: 1455.356306763598.
[I 2023-12-12 14:47:24,941] Trial 130 finished with value: 1455.356306763598 and parameters: {'model_name': 'SimpleImputer', 'strategy': 'mean'}. Best is trial 26 with value: 1455.356306763598.
[I 2023-12-12 14:47:25,263] Trial 129 finished with value: 1455.356306763598 and parameters: {'model_name': 'SimpleImputer', 'strategy': 'mean'}. Best is trial 26 with value: 1455.356306763598.
[I 2023-12-12 14:47:25,482] Trial 136 finished with value: 1455.356306763598 and parameters: {'model_name': 'SimpleImputer', 'strategy': 'mean'}. Best is trial 26 with value: 1455.356306763598.
[I 2023-12-12 14:47:25,699] Trial 127 finished with value: 1455.356306763598 and parameters: {'model_name': 'SimpleImputer', 'strategy': 'mean'}. Best is trial 26 with value: 1455.356306763598.
[I 2023-12-12 14:47:25,920] Trial 135 finished with value: 1455.356306763598 and parameters: {'model_name': 'SimpleImputer', 'strategy': 'mean'}. Best is trial 26 with value: 1455.356306763598.
[I 2023-12-12 14:47:26,129] Trial 133 finished with value: 1455.356306763598 and parameters: {'model_name': 'SimpleImputer', 'strategy': 'mean'}. Best is trial 26 with value: 1455.356306763598.
[I 2023-12-12 14:47:26,420] Trial 142 finished with value: 1455.356306763598 and parameters: {'model_name': 'SimpleImputer', 'strategy': 'mean'}. Best is trial 26 with value: 1455.356306763598.
[I 2023-12-12 14:47:26,682] Trial 141 finished with value: 1455.356306763598 and parameters: {'model_name': 'SimpleImputer', 'strategy': 'mean'}. Best is trial 26 with value: 1455.356306763598.
[I 2023-12-12 14:47:26,950] Trial 147 finished with value: 1455.356306763598 and parameters: {'model_name': 'SimpleImputer', 'strategy': 'mean'}. Best is trial 26 with value: 1455.356306763598.
[I 2023-12-12 14:47:27,203] Trial 138 finished with value: 1455.356306763598 and parameters: {'model_name': 'SimpleImputer', 'strategy': 'mean'}. Best is trial 26 with value: 1455.356306763598.
[I 2023-12-12 14:47:27,421] Trial 148 finished with value: 1455.356306763598 and parameters: {'model_name': 'SimpleImputer', 'strategy': 'mean'}. Best is trial 26 with value: 1455.356306763598.
[I 2023-12-12 14:47:27,623] Trial 139 finished with value: 1455.356306763598 and parameters: {'model_name': 'SimpleImputer', 'strategy': 'mean'}. Best is trial 26 with value: 1455.356306763598.
[I 2023-12-12 14:47:27,842] Trial 140 finished with value: 1455.356306763598 and parameters: {'model_name': 'SimpleImputer', 'strategy': 'mean'}. Best is trial 26 with value: 1455.356306763598.
[I 2023-12-12 14:47:28,060] Trial 144 finished with value: 1455.356306763598 and parameters: {'model_name': 'SimpleImputer', 'strategy': 'mean'}. Best is trial 26 with value: 1455.356306763598.
[I 2023-12-12 14:47:28,268] Trial 145 finished with value: 1455.356306763598 and parameters: {'model_name': 'SimpleImputer', 'strategy': 'mean'}. Best is trial 26 with value: 1455.356306763598.
[I 2023-12-12 14:47:28,450] Trial 149 finished with value: 1455.356306763598 and parameters: {'model_name': 'SimpleImputer', 'strategy': 'mean'}. Best is trial 26 with value: 1455.356306763598.
[I 2023-12-12 14:47:28,648] Trial 146 finished with value: 1455.356306763598 and parameters: {'model_name': 'SimpleImputer', 'strategy': 'mean'}. Best is trial 26 with value: 1455.356306763598.
[I 2023-12-12 14:47:28,962] Trial 143 finished with value: 1455.356306763598 and parameters: {'model_name': 'SimpleImputer', 'strategy': 'mean'}. Best is trial 26 with value: 1455.356306763598.
[I 2023-12-12 14:47:29,326] Trial 150 finished with value: 1455.356306763598 and parameters: {'model_name': 'SimpleImputer', 'strategy': 'mean'}. Best is trial 26 with value: 1455.356306763598.
[I 2023-12-12 14:47:29,574] Trial 94 finished with value: 1624.6243890981327 and parameters: {'model_name': 'SimpleImputer', 'strategy': 'most_frequent'}. Best is trial 26 with value: 1455.356306763598.
[I 2023-12-12 14:47:29,787] Trial 95 finished with value: 1624.6243890981327 and parameters: {'model_name': 'SimpleImputer', 'strategy': 'most_frequent'}. Best is trial 26 with value: 1455.356306763598.
[I 2023-12-12 14:47:29,959] Trial 93 finished with value: 1624.6243890981327 and parameters: {'model_name': 'SimpleImputer', 'strategy': 'most_frequent'}. Best is trial 26 with value: 1455.356306763598.
[I 2023-12-12 14:47:30,309] Trial 98 finished with value: 1624.6243890981327 and parameters: {'model_name': 'SimpleImputer', 'strategy': 'most_frequent'}. Best is trial 26 with value: 1455.356306763598.
[I 2023-12-12 14:47:30,600] Trial 153 finished with value: 1455.356306763598 and parameters: {'model_name': 'SimpleImputer', 'strategy': 'mean'}. Best is trial 26 with value: 1455.356306763598.
[I 2023-12-12 14:47:30,832] Trial 97 finished with value: 1624.6243890981327 and parameters: {'model_name': 'SimpleImputer', 'strategy': 'most_frequent'}. Best is trial 26 with value: 1455.356306763598.
[I 2023-12-12 14:47:31,069] Trial 152 finished with value: 1455.356306763598 and parameters: {'model_name': 'SimpleImputer', 'strategy': 'mean'}. Best is trial 26 with value: 1455.356306763598.
[I 2023-12-12 14:47:31,311] Trial 151 finished with value: 1455.356306763598 and parameters: {'model_name': 'SimpleImputer', 'strategy': 'mean'}. Best is trial 26 with value: 1455.356306763598.
[I 2023-12-12 14:47:31,569] Trial 154 finished with value: 1455.356306763598 and parameters: {'model_name': 'SimpleImputer', 'strategy': 'mean'}. Best is trial 26 with value: 1455.356306763598.
[I 2023-12-12 14:47:31,877] Trial 163 finished with value: 1455.356306763598 and parameters: {'model_name': 'SimpleImputer', 'strategy': 'mean'}. Best is trial 26 with value: 1455.356306763598.
[I 2023-12-12 14:47:32,077] Trial 161 finished with value: 1455.356306763598 and parameters: {'model_name': 'SimpleImputer', 'strategy': 'mean'}. Best is trial 26 with value: 1455.356306763598.
[I 2023-12-12 14:47:32,340] Trial 165 finished with value: 1455.356306763598 and parameters: {'model_name': 'SimpleImputer', 'strategy': 'mean'}. Best is trial 26 with value: 1455.356306763598.
[I 2023-12-12 14:47:32,573] Trial 160 finished with value: 1455.356306763598 and parameters: {'model_name': 'SimpleImputer', 'strategy': 'mean'}. Best is trial 26 with value: 1455.356306763598.
[I 2023-12-12 14:47:32,845] Trial 166 finished with value: 1455.356306763598 and parameters: {'model_name': 'SimpleImputer', 'strategy': 'mean'}. Best is trial 26 with value: 1455.356306763598.
[I 2023-12-12 14:47:33,028] Trial 158 finished with value: 1455.356306763598 and parameters: {'model_name': 'SimpleImputer', 'strategy': 'mean'}. Best is trial 26 with value: 1455.356306763598.
[I 2023-12-12 14:47:33,284] Trial 99 finished with value: 1624.6243890981327 and parameters: {'model_name': 'SimpleImputer', 'strategy': 'most_frequent'}. Best is trial 26 with value: 1455.356306763598.
[I 2023-12-12 14:47:33,472] Trial 157 finished with value: 1455.356306763598 and parameters: {'model_name': 'SimpleImputer', 'strategy': 'mean'}. Best is trial 26 with value: 1455.356306763598.
[I 2023-12-12 14:47:33,639] Trial 155 finished with value: 1455.356306763598 and parameters: {'model_name': 'SimpleImputer', 'strategy': 'mean'}. Best is trial 26 with value: 1455.356306763598.
[I 2023-12-12 14:47:33,890] Trial 156 finished with value: 1455.356306763598 and parameters: {'model_name': 'SimpleImputer', 'strategy': 'mean'}. Best is trial 26 with value: 1455.356306763598.
[I 2023-12-12 14:47:34,073] Trial 159 finished with value: 1455.356306763598 and parameters: {'model_name': 'SimpleImputer', 'strategy': 'mean'}. Best is trial 26 with value: 1455.356306763598.
[I 2023-12-12 14:47:34,375] Trial 170 finished with value: 1455.356306763598 and parameters: {'model_name': 'SimpleImputer', 'strategy': 'mean'}. Best is trial 26 with value: 1455.356306763598.
[I 2023-12-12 14:47:34,643] Trial 162 finished with value: 1455.356306763598 and parameters: {'model_name': 'SimpleImputer', 'strategy': 'mean'}. Best is trial 26 with value: 1455.356306763598.
[I 2023-12-12 14:47:34,865] Trial 167 finished with value: 1455.356306763598 and parameters: {'model_name': 'SimpleImputer', 'strategy': 'mean'}. Best is trial 26 with value: 1455.356306763598.
[I 2023-12-12 14:47:35,111] Trial 172 finished with value: 1455.356306763598 and parameters: {'model_name': 'SimpleImputer', 'strategy': 'mean'}. Best is trial 26 with value: 1455.356306763598.
[I 2023-12-12 14:47:35,358] Trial 96 finished with value: 1624.6243890981327 and parameters: {'model_name': 'SimpleImputer', 'strategy': 'most_frequent'}. Best is trial 26 with value: 1455.356306763598.
[I 2023-12-12 14:47:35,807] Trial 169 finished with value: 1455.356306763598 and parameters: {'model_name': 'SimpleImputer', 'strategy': 'mean'}. Best is trial 26 with value: 1455.356306763598.
[I 2023-12-12 14:47:35,995] Trial 168 finished with value: 1455.356306763598 and parameters: {'model_name': 'SimpleImputer', 'strategy': 'mean'}. Best is trial 26 with value: 1455.356306763598.
[I 2023-12-12 14:47:36,281] Trial 180 finished with value: 1632.0338652899106 and parameters: {'model_name': 'SimpleImputer', 'strategy': 'constant'}. Best is trial 26 with value: 1455.356306763598.
[I 2023-12-12 14:47:36,456] Trial 179 finished with value: 1632.0338652899106 and parameters: {'model_name': 'SimpleImputer', 'strategy': 'constant'}. Best is trial 26 with value: 1455.356306763598.
[I 2023-12-12 14:47:36,692] Trial 173 finished with value: 1455.356306763598 and parameters: {'model_name': 'SimpleImputer', 'strategy': 'mean'}. Best is trial 26 with value: 1455.356306763598.
[I 2023-12-12 14:47:36,925] Trial 186 finished with value: 1632.0338652899106 and parameters: {'model_name': 'SimpleImputer', 'strategy': 'constant'}. Best is trial 26 with value: 1455.356306763598.
[I 2023-12-12 14:47:37,139] Trial 177 finished with value: 1632.0338652899106 and parameters: {'model_name': 'SimpleImputer', 'strategy': 'constant'}. Best is trial 26 with value: 1455.356306763598.
[I 2023-12-12 14:47:37,376] Trial 178 finished with value: 1632.0338652899106 and parameters: {'model_name': 'SimpleImputer', 'strategy': 'constant'}. Best is trial 26 with value: 1455.356306763598.
[I 2023-12-12 14:47:37,684] Trial 192 finished with value: 1632.0338652899106 and parameters: {'model_name': 'SimpleImputer', 'strategy': 'constant'}. Best is trial 26 with value: 1455.356306763598.
[I 2023-12-12 14:47:37,957] Trial 181 finished with value: 1632.0338652899106 and parameters: {'model_name': 'SimpleImputer', 'strategy': 'constant'}. Best is trial 26 with value: 1455.356306763598.
[I 2023-12-12 14:47:38,250] Trial 164 finished with value: 1455.356306763598 and parameters: {'model_name': 'SimpleImputer', 'strategy': 'mean'}. Best is trial 26 with value: 1455.356306763598.
[I 2023-12-12 14:47:38,619] Trial 185 finished with value: 1632.0338652899106 and parameters: {'model_name': 'SimpleImputer', 'strategy': 'constant'}. Best is trial 26 with value: 1455.356306763598.
[I 2023-12-12 14:47:38,840] Trial 184 finished with value: 1455.356306763598 and parameters: {'model_name': 'SimpleImputer', 'strategy': 'mean'}. Best is trial 26 with value: 1455.356306763598.
[I 2023-12-12 14:47:39,044] Trial 182 finished with value: 1632.0338652899106 and parameters: {'model_name': 'SimpleImputer', 'strategy': 'constant'}. Best is trial 26 with value: 1455.356306763598.
[I 2023-12-12 14:47:39,309] Trial 191 finished with value: 1632.0338652899106 and parameters: {'model_name': 'SimpleImputer', 'strategy': 'constant'}. Best is trial 26 with value: 1455.356306763598.
[I 2023-12-12 14:47:39,566] Trial 195 finished with value: 1632.0338652899106 and parameters: {'model_name': 'SimpleImputer', 'strategy': 'constant'}. Best is trial 26 with value: 1455.356306763598.
[I 2023-12-12 14:47:39,794] Trial 190 finished with value: 1632.0338652899106 and parameters: {'model_name': 'SimpleImputer', 'strategy': 'constant'}. Best is trial 26 with value: 1455.356306763598.
[I 2023-12-12 14:47:40,026] Trial 187 finished with value: 1632.0338652899106 and parameters: {'model_name': 'SimpleImputer', 'strategy': 'constant'}. Best is trial 26 with value: 1455.356306763598.
[I 2023-12-12 14:47:40,212] Trial 183 finished with value: 1632.0338652899106 and parameters: {'model_name': 'SimpleImputer', 'strategy': 'constant'}. Best is trial 26 with value: 1455.356306763598.
[I 2023-12-12 14:47:40,512] Trial 171 finished with value: 1455.356306763598 and parameters: {'model_name': 'SimpleImputer', 'strategy': 'mean'}. Best is trial 26 with value: 1455.356306763598.
[I 2023-12-12 14:47:40,738] Trial 174 finished with value: 1455.356306763598 and parameters: {'model_name': 'SimpleImputer', 'strategy': 'mean'}. Best is trial 26 with value: 1455.356306763598.
[I 2023-12-12 14:47:40,960] Trial 198 finished with value: 1632.0338652899106 and parameters: {'model_name': 'SimpleImputer', 'strategy': 'constant'}. Best is trial 26 with value: 1455.356306763598.
[I 2023-12-12 14:47:41,204] Trial 197 finished with value: 1632.0338652899106 and parameters: {'model_name': 'SimpleImputer', 'strategy': 'constant'}. Best is trial 26 with value: 1455.356306763598.
[I 2023-12-12 14:47:41,387] Trial 189 finished with value: 1632.0338652899106 and parameters: {'model_name': 'SimpleImputer', 'strategy': 'constant'}. Best is trial 26 with value: 1455.356306763598.
[I 2023-12-12 14:47:41,626] Trial 196 finished with value: 1632.0338652899106 and parameters: {'model_name': 'SimpleImputer', 'strategy': 'constant'}. Best is trial 26 with value: 1455.356306763598.
[I 2023-12-12 14:47:41,856] Trial 188 finished with value: 1632.0338652899106 and parameters: {'model_name': 'SimpleImputer', 'strategy': 'constant'}. Best is trial 26 with value: 1455.356306763598.
[I 2023-12-12 14:47:42,083] Trial 199 finished with value: 1632.0338652899106 and parameters: {'model_name': 'SimpleImputer', 'strategy': 'constant'}. Best is trial 26 with value: 1455.356306763598.
[I 2023-12-12 14:47:42,269] Trial 175 finished with value: 1455.356306763598 and parameters: {'model_name': 'SimpleImputer', 'strategy': 'mean'}. Best is trial 26 with value: 1455.356306763598.
[I 2023-12-12 14:47:42,439] Trial 176 finished with value: 1632.0338652899106 and parameters: {'model_name': 'SimpleImputer', 'strategy': 'constant'}. Best is trial 26 with value: 1455.356306763598.
[I 2023-12-12 14:47:42,675] Trial 194 finished with value: 1632.0338652899106 and parameters: {'model_name': 'SimpleImputer', 'strategy': 'constant'}. Best is trial 26 with value: 1455.356306763598.
