[I 2024-03-01 10:45:10,171] Trial 43 finished with value: 5.5414133554512475 and parameters: {'model_name': 'RandomForestImputer', 'max_iter': 5, 'decreasing': False, 'min_samples_split': 0.30000000000000004, 'min_samples_leaf': 0.9, 'max_features': 0.6, 'warm_start': False}. Best is trial 48 with value: 2.2837654513333328.
[I 2024-03-01 10:45:18,583] Trial 123 finished with value: 2.6962894695399156 and parameters: {'model_name': 'GAIN', 'batch_size': 14, 'hint_rate': 0.81, 'alpha': 49, 'iterations': 7}. Best is trial 48 with value: 2.2837654513333328.
[I 2024-03-01 10:45:23,049] Trial 102 finished with value: 3.396776052543602 and parameters: {'model_name': 'GAIN', 'batch_size': 180, 'hint_rate': 0.6900000000000001, 'alpha': 56, 'iterations': 69}. Best is trial 48 with value: 2.2837654513333328.
[I 2024-03-01 10:45:32,191] Trial 29 finished with value: 5.54853366922473 and parameters: {'model_name': 'RandomForestImputer', 'max_iter': 5, 'decreasing': True, 'min_samples_split': 0.2, 'min_samples_leaf': 0.6, 'max_features': 0.9, 'warm_start': False}. Best is trial 48 with value: 2.2837654513333328.
[I 2024-03-01 10:45:44,006] Trial 124 finished with value: 2.776522066679798 and parameters: {'model_name': 'GAIN', 'batch_size': 13, 'hint_rate': 0.86, 'alpha': 0, 'iterations': 8}. Best is trial 48 with value: 2.2837654513333328.
[I 2024-03-01 10:45:47,091] Trial 106 finished with value: 2.8742990857090502 and parameters: {'model_name': 'GAIN', 'batch_size': 125, 'hint_rate': 0.75, 'alpha': 6, 'iterations': 69}. Best is trial 48 with value: 2.2837654513333328.
[I 2024-03-01 10:45:57,457] Trial 15 finished with value: 5.5515616592743315 and parameters: {'model_name': 'RandomForestImputer', 'max_iter': 6, 'decreasing': True, 'min_samples_split': 1.0, 'min_samples_leaf': 0.5, 'max_features': 0.9, 'warm_start': False}. Best is trial 48 with value: 2.2837654513333328.
[I 2024-03-01 10:46:12,129] Trial 130 finished with value: 3.405352349810171 and parameters: {'model_name': 'GAIN', 'batch_size': 16, 'hint_rate': 0.4, 'alpha': 45, 'iterations': 8}. Best is trial 48 with value: 2.2837654513333328.
[I 2024-03-01 10:46:30,542] Trial 136 finished with value: 2.892549657747299 and parameters: {'model_name': 'GAIN', 'batch_size': 428, 'hint_rate': 0.8200000000000001, 'alpha': 43, 'iterations': 8}. Best is trial 48 with value: 2.2837654513333328.
[I 2024-03-01 10:46:45,906] Trial 121 finished with value: 2.8615777811324596 and parameters: {'model_name': 'GAIN', 'batch_size': 16, 'hint_rate': 0.8200000000000001, 'alpha': 56, 'iterations': 42}. Best is trial 48 with value: 2.2837654513333328.
[I 2024-03-01 10:47:04,373] Trial 135 finished with value: 2.4205511030083953 and parameters: {'model_name': 'GAIN', 'batch_size': 943, 'hint_rate': 0.41000000000000003, 'alpha': 45, 'iterations': 7}. Best is trial 48 with value: 2.2837654513333328.
[I 2024-03-01 10:47:21,380] Trial 120 finished with value: 3.1465687144991557 and parameters: {'model_name': 'GAIN', 'batch_size': 990, 'hint_rate': 0.4, 'alpha': 53, 'iterations': 39}. Best is trial 48 with value: 2.2837654513333328.
[I 2024-03-01 10:47:30,186] Trial 137 finished with value: 2.683217149502426 and parameters: {'model_name': 'GAIN', 'batch_size': 913, 'hint_rate': 0.42000000000000004, 'alpha': 43, 'iterations': 8}. Best is trial 48 with value: 2.2837654513333328.
[I 2024-03-01 10:47:35,303] Trial 122 finished with value: 3.211462950617532 and parameters: {'model_name': 'GAIN', 'batch_size': 17, 'hint_rate': 0.8200000000000001, 'alpha': 50, 'iterations': 49}. Best is trial 48 with value: 2.2837654513333328.
[I 2024-03-01 10:48:59,210] Trial 57 finished with value: 5.553117738550151 and parameters: {'model_name': 'RandomForestImputer', 'max_iter': 14, 'decreasing': False, 'min_samples_split': 0.30000000000000004, 'min_samples_leaf': 0.2, 'max_features': 0.9, 'warm_start': False}. Best is trial 48 with value: 2.2837654513333328.
[I 2024-03-01 10:49:18,494] Trial 21 finished with value: 5.643632256820508 and parameters: {'model_name': 'IterativeImputer', 'sample_posterior': True, 'initial_strategy': 'mean', 'imputation_order': 'descending'}. Best is trial 48 with value: 2.2837654513333328.
[I 2024-03-01 10:49:22,079] Trial 51 finished with value: 5.997922523707649 and parameters: {'model_name': 'IterativeImputer', 'sample_posterior': True, 'initial_strategy': 'most_frequent', 'imputation_order': 'descending'}. Best is trial 48 with value: 2.2837654513333328.
[I 2024-03-01 10:49:23,824] Trial 23 finished with value: 5.872099077254051 and parameters: {'model_name': 'IterativeImputer', 'sample_posterior': True, 'initial_strategy': 'median', 'imputation_order': 'arabic'}. Best is trial 48 with value: 2.2837654513333328.
[I 2024-03-01 10:49:28,579] Trial 20 finished with value: 5.6257271745954105 and parameters: {'model_name': 'IterativeImputer', 'sample_posterior': True, 'initial_strategy': 'most_frequent', 'imputation_order': 'arabic'}. Best is trial 48 with value: 2.2837654513333328.
[I 2024-03-01 10:49:30,242] Trial 46 finished with value: 5.885091856792145 and parameters: {'model_name': 'IterativeImputer', 'sample_posterior': True, 'initial_strategy': 'most_frequent', 'imputation_order': 'random'}. Best is trial 48 with value: 2.2837654513333328.
[I 2024-03-01 10:49:41,484] Trial 72 finished with value: 6.010411950548059 and parameters: {'model_name': 'IterativeImputer', 'sample_posterior': True, 'initial_strategy': 'constant', 'imputation_order': 'roman'}. Best is trial 48 with value: 2.2837654513333328.
[I 2024-03-01 10:49:55,188] Trial 119 finished with value: 4.5724260599936395 and parameters: {'model_name': 'GAIN', 'batch_size': 62, 'hint_rate': 0.8, 'alpha': 55, 'iterations': 106}. Best is trial 48 with value: 2.2837654513333328.
[I 2024-03-01 10:50:19,928] Trial 154 finished with value: 2.535238729812871 and parameters: {'model_name': 'GAIN', 'batch_size': 451, 'hint_rate': 0.46, 'alpha': 36, 'iterations': 4}. Best is trial 48 with value: 2.2837654513333328.
[I 2024-03-01 10:50:25,409] Trial 155 finished with value: 2.5089226476537556 and parameters: {'model_name': 'GAIN', 'batch_size': 503, 'hint_rate': 0.34, 'alpha': 38, 'iterations': 5}. Best is trial 48 with value: 2.2837654513333328.
[I 2024-03-01 10:50:38,787] Trial 156 finished with value: 2.3311618938747225 and parameters: {'model_name': 'GAIN', 'batch_size': 445, 'hint_rate': 0.31, 'alpha': 37, 'iterations': 5}. Best is trial 48 with value: 2.2837654513333328.
[I 2024-03-01 10:51:23,071] Trial 0 finished with value: 5.543604888270517 and parameters: {'model_name': 'RandomForestImputer', 'max_iter': 16, 'decreasing': False, 'min_samples_split': 0.7000000000000001, 'min_samples_leaf': 0.5, 'max_features': 0.4, 'warm_start': False}. Best is trial 48 with value: 2.2837654513333328.
[I 2024-03-01 10:51:35,061] Trial 158 finished with value: 2.558333988824666 and parameters: {'model_name': 'GAIN', 'batch_size': 459, 'hint_rate': 0.45, 'alpha': 37, 'iterations': 5}. Best is trial 48 with value: 2.2837654513333328.
[I 2024-03-01 10:51:43,790] Trial 159 finished with value: 2.6930626762104604 and parameters: {'model_name': 'GAIN', 'batch_size': 437, 'hint_rate': 0.3, 'alpha': 37, 'iterations': 5}. Best is trial 48 with value: 2.2837654513333328.
[I 2024-03-01 10:51:54,325] Trial 157 finished with value: 3.1265088923739706 and parameters: {'model_name': 'GAIN', 'batch_size': 451, 'hint_rate': 0.29000000000000004, 'alpha': 37, 'iterations': 4}. Best is trial 48 with value: 2.2837654513333328.
[I 2024-03-01 10:51:59,859] Trial 160 finished with value: 2.7129104670057362 and parameters: {'model_name': 'GAIN', 'batch_size': 448, 'hint_rate': 0.29000000000000004, 'alpha': 39, 'iterations': 5}. Best is trial 48 with value: 2.2837654513333328.
[I 2024-03-01 10:52:03,272] Trial 165 finished with value: 6.148972038878128 and parameters: {'model_name': 'SimpleImputer', 'strategy': 'median'}. Best is trial 48 with value: 2.2837654513333328.
[I 2024-03-01 10:52:33,552] Trial 161 finished with value: 2.8728202974134645 and parameters: {'model_name': 'GAIN', 'batch_size': 401, 'hint_rate': 0.28, 'alpha': 39, 'iterations': 5}. Best is trial 48 with value: 2.2837654513333328.
[I 2024-03-01 10:53:12,337] Trial 163 finished with value: 2.633985306507471 and parameters: {'model_name': 'GAIN', 'batch_size': 365, 'hint_rate': 0.29000000000000004, 'alpha': 41, 'iterations': 2}. Best is trial 48 with value: 2.2837654513333328.
[I 2024-03-01 10:53:16,152] Trial 162 finished with value: 2.4209673091020685 and parameters: {'model_name': 'GAIN', 'batch_size': 407, 'hint_rate': 0.35000000000000003, 'alpha': 40, 'iterations': 5}. Best is trial 48 with value: 2.2837654513333328.
[I 2024-03-01 10:53:19,106] Trial 3 finished with value: 5.546816257252039 and parameters: {'model_name': 'RandomForestImputer', 'max_iter': 22, 'decreasing': False, 'min_samples_split': 0.9, 'min_samples_leaf': 0.6, 'max_features': 0.6, 'warm_start': False}. Best is trial 48 with value: 2.2837654513333328.
[I 2024-03-01 10:53:29,244] Trial 166 finished with value: 2.5535974055991852 and parameters: {'model_name': 'GAIN', 'batch_size': 305, 'hint_rate': 0.36000000000000004, 'alpha': 19, 'iterations': 2}. Best is trial 48 with value: 2.2837654513333328.
[I 2024-03-01 10:53:43,763] Trial 167 finished with value: 3.0552911008992325 and parameters: {'model_name': 'GAIN', 'batch_size': 295, 'hint_rate': 0.35000000000000003, 'alpha': 20, 'iterations': 2}. Best is trial 48 with value: 2.2837654513333328.
[I 2024-03-01 10:53:52,040] Trial 101 finished with value: 5.414799333848197 and parameters: {'model_name': 'GAIN', 'batch_size': 133, 'hint_rate': 0.68, 'alpha': 10, 'iterations': 231}. Best is trial 48 with value: 2.2837654513333328.
[I 2024-03-01 10:54:03,713] Trial 164 finished with value: 2.5617886212066763 and parameters: {'model_name': 'GAIN', 'batch_size': 967, 'hint_rate': 0.3, 'alpha': 20, 'iterations': 2}. Best is trial 48 with value: 2.2837654513333328.
[I 2024-03-01 10:54:17,195] Trial 170 finished with value: 2.8232193790590774 and parameters: {'model_name': 'GAIN', 'batch_size': 299, 'hint_rate': 0.36000000000000004, 'alpha': 46, 'iterations': 2}. Best is trial 48 with value: 2.2837654513333328.
[I 2024-03-01 10:54:39,652] Trial 126 finished with value: 5.937778460786744 and parameters: {'model_name': 'IterativeImputer', 'sample_posterior': True, 'initial_strategy': 'constant', 'imputation_order': 'descending'}. Best is trial 48 with value: 2.2837654513333328.
[I 2024-03-01 10:54:52,857] Trial 125 finished with value: 5.820009558158733 and parameters: {'model_name': 'IterativeImputer', 'sample_posterior': True, 'initial_strategy': 'constant', 'imputation_order': 'descending'}. Best is trial 48 with value: 2.2837654513333328.
[I 2024-03-01 10:54:57,651] Trial 129 finished with value: 6.070206064935369 and parameters: {'model_name': 'IterativeImputer', 'sample_posterior': True, 'initial_strategy': 'constant', 'imputation_order': 'descending'}. Best is trial 48 with value: 2.2837654513333328.
[I 2024-03-01 10:55:02,814] Trial 127 finished with value: 5.930557142700498 and parameters: {'model_name': 'IterativeImputer', 'sample_posterior': True, 'initial_strategy': 'constant', 'imputation_order': 'descending'}. Best is trial 48 with value: 2.2837654513333328.
[I 2024-03-01 10:55:12,414] Trial 128 finished with value: 5.6031482643971895 and parameters: {'model_name': 'IterativeImputer', 'sample_posterior': True, 'initial_strategy': 'constant', 'imputation_order': 'descending'}. Best is trial 48 with value: 2.2837654513333328.
[I 2024-03-01 10:55:16,430] Trial 131 finished with value: 5.837626796930787 and parameters: {'model_name': 'IterativeImputer', 'sample_posterior': True, 'initial_strategy': 'constant', 'imputation_order': 'descending'}. Best is trial 48 with value: 2.2837654513333328.
[I 2024-03-01 10:55:18,529] Trial 132 finished with value: 5.716335660617997 and parameters: {'model_name': 'IterativeImputer', 'sample_posterior': True, 'initial_strategy': 'constant', 'imputation_order': 'descending'}. Best is trial 48 with value: 2.2837654513333328.
[I 2024-03-01 10:55:39,147] Trial 169 finished with value: 2.4714689669264294 and parameters: {'model_name': 'GAIN', 'batch_size': 859, 'hint_rate': 0.34, 'alpha': 33, 'iterations': 12}. Best is trial 48 with value: 2.2837654513333328.
[I 2024-03-01 10:55:43,627] Trial 168 finished with value: 2.5872948552304176 and parameters: {'model_name': 'GAIN', 'batch_size': 868, 'hint_rate': 0.36000000000000004, 'alpha': 72, 'iterations': 11}. Best is trial 48 with value: 2.2837654513333328.
[I 2024-03-01 10:55:58,654] Trial 171 finished with value: 2.7039989640103235 and parameters: {'model_name': 'GAIN', 'batch_size': 971, 'hint_rate': 0.35000000000000003, 'alpha': 34, 'iterations': 11}. Best is trial 48 with value: 2.2837654513333328.
[I 2024-03-01 10:56:01,953] Trial 134 finished with value: 6.028672211027805 and parameters: {'model_name': 'IterativeImputer', 'sample_posterior': True, 'initial_strategy': 'constant', 'imputation_order': 'descending'}. Best is trial 48 with value: 2.2837654513333328.
[I 2024-03-01 10:56:04,865] Trial 133 finished with value: 5.4522720990680025 and parameters: {'model_name': 'IterativeImputer', 'sample_posterior': True, 'initial_strategy': 'constant', 'imputation_order': 'descending'}. Best is trial 48 with value: 2.2837654513333328.
[I 2024-03-01 10:56:08,079] Trial 172 finished with value: 2.752407130796228 and parameters: {'model_name': 'GAIN', 'batch_size': 840, 'hint_rate': 0.46, 'alpha': 34, 'iterations': 11}. Best is trial 48 with value: 2.2837654513333328.
[I 2024-03-01 10:56:13,945] Trial 173 finished with value: 2.6065256075085594 and parameters: {'model_name': 'GAIN', 'batch_size': 829, 'hint_rate': 0.47000000000000003, 'alpha': 34, 'iterations': 12}. Best is trial 48 with value: 2.2837654513333328.
[I 2024-03-01 10:56:26,156] Trial 179 finished with value: 2.924925264456452 and parameters: {'model_name': 'GAIN', 'batch_size': 576, 'hint_rate': 0.46, 'alpha': 76, 'iterations': 3}. Best is trial 48 with value: 2.2837654513333328.
[I 2024-03-01 10:56:30,176] Trial 175 finished with value: 2.693828402834564 and parameters: {'model_name': 'GAIN', 'batch_size': 560, 'hint_rate': 0.47000000000000003, 'alpha': 33, 'iterations': 12}. Best is trial 48 with value: 2.2837654513333328.
[I 2024-03-01 10:56:39,530] Trial 138 finished with value: 6.033274507265903 and parameters: {'model_name': 'IterativeImputer', 'sample_posterior': True, 'initial_strategy': 'constant', 'imputation_order': 'descending'}. Best is trial 48 with value: 2.2837654513333328.
[I 2024-03-01 10:56:44,485] Trial 177 finished with value: 2.6178077909693114 and parameters: {'model_name': 'GAIN', 'batch_size': 567, 'hint_rate': 0.45, 'alpha': 33, 'iterations': 3}. Best is trial 48 with value: 2.2837654513333328.
[I 2024-03-01 10:57:10,217] Trial 139 finished with value: 5.615988418579428 and parameters: {'model_name': 'IterativeImputer', 'sample_posterior': True, 'initial_strategy': 'constant', 'imputation_order': 'descending'}. Best is trial 48 with value: 2.2837654513333328.
[I 2024-03-01 10:57:14,464] Trial 140 finished with value: 5.906267876752328 and parameters: {'model_name': 'IterativeImputer', 'sample_posterior': True, 'initial_strategy': 'constant', 'imputation_order': 'descending'}. Best is trial 48 with value: 2.2837654513333328.
[I 2024-03-01 10:57:18,630] Trial 176 finished with value: 2.9120066320260967 and parameters: {'model_name': 'GAIN', 'batch_size': 591, 'hint_rate': 0.47000000000000003, 'alpha': 34, 'iterations': 3}. Best is trial 48 with value: 2.2837654513333328.
[I 2024-03-01 10:57:22,102] Trial 141 finished with value: 6.1342375926768495 and parameters: {'model_name': 'IterativeImputer', 'sample_posterior': True, 'initial_strategy': 'constant', 'imputation_order': 'descending'}. Best is trial 48 with value: 2.2837654513333328.
[I 2024-03-01 10:57:37,650] Trial 186 finished with value: 2.1104248027758565 and parameters: {'model_name': 'GAIN', 'batch_size': 584, 'hint_rate': 0.47000000000000003, 'alpha': 28, 'iterations': 3}. Best is trial 186 with value: 2.1104248027758565.
[I 2024-03-01 10:57:42,235] Trial 142 finished with value: 5.918422381523478 and parameters: {'model_name': 'IterativeImputer', 'sample_posterior': True, 'initial_strategy': 'constant', 'imputation_order': 'descending'}. Best is trial 186 with value: 2.1104248027758565.
[I 2024-03-01 10:57:50,236] Trial 143 finished with value: 6.045493667748092 and parameters: {'model_name': 'IterativeImputer', 'sample_posterior': True, 'initial_strategy': 'constant', 'imputation_order': 'descending'}. Best is trial 186 with value: 2.1104248027758565.
[I 2024-03-01 10:57:58,662] Trial 174 finished with value: 2.674858130320812 and parameters: {'model_name': 'GAIN', 'batch_size': 568, 'hint_rate': 0.45, 'alpha': 34, 'iterations': 11}. Best is trial 186 with value: 2.1104248027758565.
[I 2024-03-01 10:58:11,309] Trial 187 finished with value: 2.566205662471769 and parameters: {'model_name': 'GAIN', 'batch_size': 537, 'hint_rate': 0.47000000000000003, 'alpha': 34, 'iterations': 4}. Best is trial 186 with value: 2.1104248027758565.
[I 2024-03-01 10:58:22,941] Trial 190 finished with value: 2.5022687314437264 and parameters: {'model_name': 'GAIN', 'batch_size': 648, 'hint_rate': 0.51, 'alpha': 100, 'iterations': 3}. Best is trial 186 with value: 2.1104248027758565.
[I 2024-03-01 10:58:28,599] Trial 144 finished with value: 5.808248378802249 and parameters: {'model_name': 'IterativeImputer', 'sample_posterior': True, 'initial_strategy': 'constant', 'imputation_order': 'descending'}. Best is trial 186 with value: 2.1104248027758565.
[I 2024-03-01 10:58:33,422] Trial 178 finished with value: 2.936187421303474 and parameters: {'model_name': 'GAIN', 'batch_size': 551, 'hint_rate': 0.46, 'alpha': 74, 'iterations': 12}. Best is trial 186 with value: 2.1104248027758565.
[I 2024-03-01 10:58:41,336] Trial 182 finished with value: 2.7050288355598258 and parameters: {'model_name': 'GAIN', 'batch_size': 572, 'hint_rate': 0.63, 'alpha': 69, 'iterations': 11}. Best is trial 186 with value: 2.1104248027758565.
[I 2024-03-01 10:58:46,379] Trial 188 finished with value: 2.6635249542082216 and parameters: {'model_name': 'GAIN', 'batch_size': 683, 'hint_rate': 0.5, 'alpha': 27, 'iterations': 3}. Best is trial 186 with value: 2.1104248027758565.
[I 2024-03-01 10:58:51,812] Trial 191 finished with value: 2.387401938839074 and parameters: {'model_name': 'GAIN', 'batch_size': 687, 'hint_rate': 0.63, 'alpha': 28, 'iterations': 3}. Best is trial 186 with value: 2.1104248027758565.
[I 2024-03-01 10:58:55,404] Trial 180 finished with value: 2.6557865116628983 and parameters: {'model_name': 'GAIN', 'batch_size': 622, 'hint_rate': 0.46, 'alpha': 67, 'iterations': 10}. Best is trial 186 with value: 2.1104248027758565.
[I 2024-03-01 10:58:59,287] Trial 189 finished with value: 2.4206227837336067 and parameters: {'model_name': 'GAIN', 'batch_size': 633, 'hint_rate': 0.63, 'alpha': 28, 'iterations': 3}. Best is trial 186 with value: 2.1104248027758565.
[I 2024-03-01 10:59:02,069] Trial 185 finished with value: 2.9484193762400617 and parameters: {'model_name': 'GAIN', 'batch_size': 589, 'hint_rate': 0.46, 'alpha': 28, 'iterations': 3}. Best is trial 186 with value: 2.1104248027758565.
[I 2024-03-01 10:59:05,668] Trial 192 finished with value: 2.535185695921701 and parameters: {'model_name': 'GAIN', 'batch_size': 691, 'hint_rate': 0.62, 'alpha': 26, 'iterations': 3}. Best is trial 186 with value: 2.1104248027758565.
[I 2024-03-01 10:59:09,718] Trial 181 finished with value: 3.555174054847086 and parameters: {'model_name': 'GAIN', 'batch_size': 571, 'hint_rate': 0.48000000000000004, 'alpha': 77, 'iterations': 10}. Best is trial 186 with value: 2.1104248027758565.
[I 2024-03-01 10:59:16,200] Trial 194 finished with value: 2.4685274966963053 and parameters: {'model_name': 'GAIN', 'batch_size': 714, 'hint_rate': 0.23, 'alpha': 29, 'iterations': 4}. Best is trial 186 with value: 2.1104248027758565.
[I 2024-03-01 10:59:19,792] Trial 145 finished with value: 6.07738105077032 and parameters: {'model_name': 'IterativeImputer', 'sample_posterior': True, 'initial_strategy': 'constant', 'imputation_order': 'descending'}. Best is trial 186 with value: 2.1104248027758565.
[I 2024-03-01 10:59:23,273] Trial 193 finished with value: 2.538265863958576 and parameters: {'model_name': 'GAIN', 'batch_size': 722, 'hint_rate': 0.64, 'alpha': 28, 'iterations': 4}. Best is trial 186 with value: 2.1104248027758565.
[I 2024-03-01 10:59:28,018] Trial 184 finished with value: 2.611652465875843 and parameters: {'model_name': 'GAIN', 'batch_size': 575, 'hint_rate': 0.46, 'alpha': 35, 'iterations': 12}. Best is trial 186 with value: 2.1104248027758565.
[I 2024-03-01 10:59:30,488] Trial 146 finished with value: 5.908722761773784 and parameters: {'model_name': 'IterativeImputer', 'sample_posterior': True, 'initial_strategy': 'constant', 'imputation_order': 'descending'}. Best is trial 186 with value: 2.1104248027758565.
[I 2024-03-01 10:59:32,663] Trial 199 finished with value: 2.606678665803219 and parameters: {'model_name': 'GAIN', 'batch_size': 708, 'hint_rate': 0.51, 'alpha': 27, 'iterations': 4}. Best is trial 186 with value: 2.1104248027758565.
[I 2024-03-01 10:59:40,740] Trial 147 finished with value: 5.712048360021214 and parameters: {'model_name': 'IterativeImputer', 'sample_posterior': True, 'initial_strategy': 'constant', 'imputation_order': 'descending'}. Best is trial 186 with value: 2.1104248027758565.
[I 2024-03-01 10:59:43,146] Trial 198 finished with value: 2.1879573022756067 and parameters: {'model_name': 'GAIN', 'batch_size': 698, 'hint_rate': 0.5, 'alpha': 28, 'iterations': 4}. Best is trial 186 with value: 2.1104248027758565.
