[I 2024-03-01 04:27:36,490] Trial 90 finished with value: 22.220038657497085 and parameters: {'model_name': 'SimpleImputer', 'strategy': 'most_frequent'}. Best is trial 6 with value: 4.1717799707322785.
[I 2024-03-01 04:27:36,723] Trial 87 finished with value: 22.220038657497085 and parameters: {'model_name': 'SimpleImputer', 'strategy': 'most_frequent'}. Best is trial 6 with value: 4.1717799707322785.
[I 2024-03-01 04:27:37,049] Trial 86 finished with value: 22.220038657497085 and parameters: {'model_name': 'SimpleImputer', 'strategy': 'most_frequent'}. Best is trial 6 with value: 4.1717799707322785.
[I 2024-03-01 04:27:37,353] Trial 92 finished with value: 22.220038657497085 and parameters: {'model_name': 'SimpleImputer', 'strategy': 'most_frequent'}. Best is trial 6 with value: 4.1717799707322785.
[I 2024-03-01 04:27:37,653] Trial 124 finished with value: 4.1717799707322785 and parameters: {'model_name': 'SimpleImputer', 'strategy': 'median'}. Best is trial 6 with value: 4.1717799707322785.
[I 2024-03-01 04:27:38,009] Trial 126 finished with value: 4.1717799707322785 and parameters: {'model_name': 'SimpleImputer', 'strategy': 'median'}. Best is trial 6 with value: 4.1717799707322785.
[I 2024-03-01 04:27:38,225] Trial 84 finished with value: 22.220038657497085 and parameters: {'model_name': 'SimpleImputer', 'strategy': 'most_frequent'}. Best is trial 6 with value: 4.1717799707322785.
[I 2024-03-01 04:27:38,479] Trial 85 finished with value: 22.220038657497085 and parameters: {'model_name': 'SimpleImputer', 'strategy': 'most_frequent'}. Best is trial 6 with value: 4.1717799707322785.
[I 2024-03-01 04:27:38,979] Trial 97 finished with value: 22.220038657497085 and parameters: {'model_name': 'SimpleImputer', 'strategy': 'most_frequent'}. Best is trial 6 with value: 4.1717799707322785.
[I 2024-03-01 04:27:39,217] Trial 125 finished with value: 4.1717799707322785 and parameters: {'model_name': 'SimpleImputer', 'strategy': 'median'}. Best is trial 6 with value: 4.1717799707322785.
[I 2024-03-01 04:27:39,479] Trial 95 finished with value: 22.220038657497085 and parameters: {'model_name': 'SimpleImputer', 'strategy': 'most_frequent'}. Best is trial 6 with value: 4.1717799707322785.
[I 2024-03-01 04:27:40,008] Trial 94 finished with value: 22.220038657497085 and parameters: {'model_name': 'SimpleImputer', 'strategy': 'most_frequent'}. Best is trial 6 with value: 4.1717799707322785.
[I 2024-03-01 04:27:40,391] Trial 127 finished with value: 4.1717799707322785 and parameters: {'model_name': 'SimpleImputer', 'strategy': 'median'}. Best is trial 6 with value: 4.1717799707322785.
[I 2024-03-01 04:27:40,614] Trial 96 finished with value: 22.220038657497085 and parameters: {'model_name': 'SimpleImputer', 'strategy': 'most_frequent'}. Best is trial 6 with value: 4.1717799707322785.
[I 2024-03-01 04:27:40,964] Trial 103 finished with value: 22.220038657497085 and parameters: {'model_name': 'SimpleImputer', 'strategy': 'most_frequent'}. Best is trial 6 with value: 4.1717799707322785.
[I 2024-03-01 04:27:41,171] Trial 128 finished with value: 4.1717799707322785 and parameters: {'model_name': 'SimpleImputer', 'strategy': 'median'}. Best is trial 6 with value: 4.1717799707322785.
[I 2024-03-01 04:27:41,436] Trial 99 finished with value: 22.220038657497085 and parameters: {'model_name': 'SimpleImputer', 'strategy': 'most_frequent'}. Best is trial 6 with value: 4.1717799707322785.
[I 2024-03-01 04:27:41,753] Trial 129 finished with value: 4.1717799707322785 and parameters: {'model_name': 'SimpleImputer', 'strategy': 'median'}. Best is trial 6 with value: 4.1717799707322785.
[I 2024-03-01 04:27:42,037] Trial 105 finished with value: 22.220038657497085 and parameters: {'model_name': 'SimpleImputer', 'strategy': 'most_frequent'}. Best is trial 6 with value: 4.1717799707322785.
[I 2024-03-01 04:27:42,441] Trial 106 finished with value: 22.220038657497085 and parameters: {'model_name': 'SimpleImputer', 'strategy': 'most_frequent'}. Best is trial 6 with value: 4.1717799707322785.
[I 2024-03-01 04:27:42,677] Trial 130 finished with value: 4.1717799707322785 and parameters: {'model_name': 'SimpleImputer', 'strategy': 'median'}. Best is trial 6 with value: 4.1717799707322785.
[I 2024-03-01 04:27:42,897] Trial 131 finished with value: 4.1717799707322785 and parameters: {'model_name': 'SimpleImputer', 'strategy': 'median'}. Best is trial 6 with value: 4.1717799707322785.
[I 2024-03-01 04:27:43,148] Trial 98 finished with value: 22.220038657497085 and parameters: {'model_name': 'SimpleImputer', 'strategy': 'most_frequent'}. Best is trial 6 with value: 4.1717799707322785.
[I 2024-03-01 04:27:43,407] Trial 132 finished with value: 4.1717799707322785 and parameters: {'model_name': 'SimpleImputer', 'strategy': 'median'}. Best is trial 6 with value: 4.1717799707322785.
[I 2024-03-01 04:27:43,712] Trial 101 finished with value: 22.220038657497085 and parameters: {'model_name': 'SimpleImputer', 'strategy': 'most_frequent'}. Best is trial 6 with value: 4.1717799707322785.
[I 2024-03-01 04:27:43,970] Trial 107 finished with value: 22.220038657497085 and parameters: {'model_name': 'SimpleImputer', 'strategy': 'most_frequent'}. Best is trial 6 with value: 4.1717799707322785.
[I 2024-03-01 04:27:44,224] Trial 102 finished with value: 22.220038657497085 and parameters: {'model_name': 'SimpleImputer', 'strategy': 'most_frequent'}. Best is trial 6 with value: 4.1717799707322785.
[I 2024-03-01 04:27:44,524] Trial 113 finished with value: 22.220038657497085 and parameters: {'model_name': 'SimpleImputer', 'strategy': 'most_frequent'}. Best is trial 6 with value: 4.1717799707322785.
[I 2024-03-01 04:27:44,745] Trial 133 finished with value: 4.1717799707322785 and parameters: {'model_name': 'SimpleImputer', 'strategy': 'median'}. Best is trial 6 with value: 4.1717799707322785.
[I 2024-03-01 04:27:45,030] Trial 112 finished with value: 22.220038657497085 and parameters: {'model_name': 'SimpleImputer', 'strategy': 'most_frequent'}. Best is trial 6 with value: 4.1717799707322785.
[I 2024-03-01 04:27:45,464] Trial 110 finished with value: 22.220038657497085 and parameters: {'model_name': 'SimpleImputer', 'strategy': 'most_frequent'}. Best is trial 6 with value: 4.1717799707322785.
[I 2024-03-01 04:27:45,732] Trial 111 finished with value: 22.220038657497085 and parameters: {'model_name': 'SimpleImputer', 'strategy': 'most_frequent'}. Best is trial 6 with value: 4.1717799707322785.
[I 2024-03-01 04:27:45,950] Trial 134 finished with value: 4.1717799707322785 and parameters: {'model_name': 'SimpleImputer', 'strategy': 'median'}. Best is trial 6 with value: 4.1717799707322785.
[I 2024-03-01 04:27:46,247] Trial 114 finished with value: 22.220038657497085 and parameters: {'model_name': 'SimpleImputer', 'strategy': 'most_frequent'}. Best is trial 6 with value: 4.1717799707322785.
[I 2024-03-01 04:27:46,479] Trial 104 finished with value: 22.220038657497085 and parameters: {'model_name': 'SimpleImputer', 'strategy': 'most_frequent'}. Best is trial 6 with value: 4.1717799707322785.
[I 2024-03-01 04:27:46,724] Trial 108 finished with value: 22.220038657497085 and parameters: {'model_name': 'SimpleImputer', 'strategy': 'most_frequent'}. Best is trial 6 with value: 4.1717799707322785.
[I 2024-03-01 04:27:46,949] Trial 138 finished with value: 4.1717799707322785 and parameters: {'model_name': 'SimpleImputer', 'strategy': 'median'}. Best is trial 6 with value: 4.1717799707322785.
[I 2024-03-01 04:27:47,187] Trial 141 finished with value: 4.1717799707322785 and parameters: {'model_name': 'SimpleImputer', 'strategy': 'median'}. Best is trial 6 with value: 4.1717799707322785.
[I 2024-03-01 04:27:47,436] Trial 135 finished with value: 4.1717799707322785 and parameters: {'model_name': 'SimpleImputer', 'strategy': 'median'}. Best is trial 6 with value: 4.1717799707322785.
[I 2024-03-01 04:27:47,670] Trial 137 finished with value: 4.1717799707322785 and parameters: {'model_name': 'SimpleImputer', 'strategy': 'median'}. Best is trial 6 with value: 4.1717799707322785.
[I 2024-03-01 04:27:47,917] Trial 116 finished with value: 22.220038657497085 and parameters: {'model_name': 'SimpleImputer', 'strategy': 'most_frequent'}. Best is trial 6 with value: 4.1717799707322785.
[I 2024-03-01 04:27:48,148] Trial 145 finished with value: 4.1717799707322785 and parameters: {'model_name': 'SimpleImputer', 'strategy': 'median'}. Best is trial 6 with value: 4.1717799707322785.
[I 2024-03-01 04:27:48,407] Trial 146 finished with value: 4.1717799707322785 and parameters: {'model_name': 'SimpleImputer', 'strategy': 'median'}. Best is trial 6 with value: 4.1717799707322785.
[I 2024-03-01 04:27:48,702] Trial 109 finished with value: 22.220038657497085 and parameters: {'model_name': 'SimpleImputer', 'strategy': 'most_frequent'}. Best is trial 6 with value: 4.1717799707322785.
[I 2024-03-01 04:27:48,927] Trial 136 finished with value: 4.1717799707322785 and parameters: {'model_name': 'SimpleImputer', 'strategy': 'median'}. Best is trial 6 with value: 4.1717799707322785.
[I 2024-03-01 04:27:49,160] Trial 120 finished with value: 22.220038657497085 and parameters: {'model_name': 'SimpleImputer', 'strategy': 'most_frequent'}. Best is trial 6 with value: 4.1717799707322785.
[I 2024-03-01 04:27:49,369] Trial 142 finished with value: 4.1717799707322785 and parameters: {'model_name': 'SimpleImputer', 'strategy': 'median'}. Best is trial 6 with value: 4.1717799707322785.
[I 2024-03-01 04:27:49,592] Trial 143 finished with value: 4.1717799707322785 and parameters: {'model_name': 'SimpleImputer', 'strategy': 'median'}. Best is trial 6 with value: 4.1717799707322785.
[I 2024-03-01 04:27:49,807] Trial 115 finished with value: 22.220038657497085 and parameters: {'model_name': 'SimpleImputer', 'strategy': 'most_frequent'}. Best is trial 6 with value: 4.1717799707322785.
[I 2024-03-01 04:27:50,080] Trial 139 finished with value: 4.1717799707322785 and parameters: {'model_name': 'SimpleImputer', 'strategy': 'median'}. Best is trial 6 with value: 4.1717799707322785.
[I 2024-03-01 04:27:50,266] Trial 140 finished with value: 4.1717799707322785 and parameters: {'model_name': 'SimpleImputer', 'strategy': 'median'}. Best is trial 6 with value: 4.1717799707322785.
[I 2024-03-01 04:27:50,491] Trial 148 finished with value: 4.1717799707322785 and parameters: {'model_name': 'SimpleImputer', 'strategy': 'median'}. Best is trial 6 with value: 4.1717799707322785.
[I 2024-03-01 04:27:50,724] Trial 152 finished with value: 4.1717799707322785 and parameters: {'model_name': 'SimpleImputer', 'strategy': 'median'}. Best is trial 6 with value: 4.1717799707322785.
[I 2024-03-01 04:27:51,111] Trial 149 finished with value: 4.1717799707322785 and parameters: {'model_name': 'SimpleImputer', 'strategy': 'median'}. Best is trial 6 with value: 4.1717799707322785.
[I 2024-03-01 04:27:51,318] Trial 117 finished with value: 22.220038657497085 and parameters: {'model_name': 'SimpleImputer', 'strategy': 'most_frequent'}. Best is trial 6 with value: 4.1717799707322785.
[I 2024-03-01 04:27:51,622] Trial 151 finished with value: 4.1717799707322785 and parameters: {'model_name': 'SimpleImputer', 'strategy': 'median'}. Best is trial 6 with value: 4.1717799707322785.
[I 2024-03-01 04:27:51,942] Trial 147 finished with value: 4.1717799707322785 and parameters: {'model_name': 'SimpleImputer', 'strategy': 'median'}. Best is trial 6 with value: 4.1717799707322785.
[I 2024-03-01 04:27:52,149] Trial 144 finished with value: 4.1717799707322785 and parameters: {'model_name': 'SimpleImputer', 'strategy': 'median'}. Best is trial 6 with value: 4.1717799707322785.
[I 2024-03-01 04:27:52,641] Trial 150 finished with value: 4.1717799707322785 and parameters: {'model_name': 'SimpleImputer', 'strategy': 'median'}. Best is trial 6 with value: 4.1717799707322785.
[I 2024-03-01 04:27:53,093] Trial 154 finished with value: 4.1717799707322785 and parameters: {'model_name': 'SimpleImputer', 'strategy': 'median'}. Best is trial 6 with value: 4.1717799707322785.
[I 2024-03-01 04:27:53,307] Trial 153 finished with value: 4.1717799707322785 and parameters: {'model_name': 'SimpleImputer', 'strategy': 'median'}. Best is trial 6 with value: 4.1717799707322785.
[I 2024-03-01 04:27:53,592] Trial 156 finished with value: 4.1717799707322785 and parameters: {'model_name': 'SimpleImputer', 'strategy': 'median'}. Best is trial 6 with value: 4.1717799707322785.
[I 2024-03-01 04:27:53,823] Trial 158 finished with value: 4.1717799707322785 and parameters: {'model_name': 'SimpleImputer', 'strategy': 'median'}. Best is trial 6 with value: 4.1717799707322785.
[I 2024-03-01 04:27:54,048] Trial 155 finished with value: 4.1717799707322785 and parameters: {'model_name': 'SimpleImputer', 'strategy': 'median'}. Best is trial 6 with value: 4.1717799707322785.
[I 2024-03-01 04:27:54,338] Trial 160 finished with value: 4.1717799707322785 and parameters: {'model_name': 'SimpleImputer', 'strategy': 'median'}. Best is trial 6 with value: 4.1717799707322785.
[I 2024-03-01 04:27:54,640] Trial 162 finished with value: 4.1717799707322785 and parameters: {'model_name': 'SimpleImputer', 'strategy': 'median'}. Best is trial 6 with value: 4.1717799707322785.
[I 2024-03-01 04:27:54,858] Trial 157 finished with value: 4.1717799707322785 and parameters: {'model_name': 'SimpleImputer', 'strategy': 'median'}. Best is trial 6 with value: 4.1717799707322785.
[I 2024-03-01 04:27:55,102] Trial 161 finished with value: 4.1717799707322785 and parameters: {'model_name': 'SimpleImputer', 'strategy': 'median'}. Best is trial 6 with value: 4.1717799707322785.
[I 2024-03-01 04:27:55,335] Trial 163 finished with value: 4.1717799707322785 and parameters: {'model_name': 'SimpleImputer', 'strategy': 'median'}. Best is trial 6 with value: 4.1717799707322785.
[I 2024-03-01 04:27:55,642] Trial 196 finished with value: 22.230146692711365 and parameters: {'model_name': 'SimpleImputer', 'strategy': 'constant'}. Best is trial 6 with value: 4.1717799707322785.
[I 2024-03-01 04:27:55,877] Trial 165 finished with value: 4.1717799707322785 and parameters: {'model_name': 'SimpleImputer', 'strategy': 'median'}. Best is trial 6 with value: 4.1717799707322785.
[I 2024-03-01 04:27:56,063] Trial 159 finished with value: 4.1717799707322785 and parameters: {'model_name': 'SimpleImputer', 'strategy': 'median'}. Best is trial 6 with value: 4.1717799707322785.
[I 2024-03-01 04:27:56,261] Trial 197 finished with value: 22.230146692711365 and parameters: {'model_name': 'SimpleImputer', 'strategy': 'constant'}. Best is trial 6 with value: 4.1717799707322785.
[I 2024-03-01 04:27:56,520] Trial 164 finished with value: 4.1717799707322785 and parameters: {'model_name': 'SimpleImputer', 'strategy': 'median'}. Best is trial 6 with value: 4.1717799707322785.
[I 2024-03-01 04:27:56,760] Trial 195 finished with value: 22.230146692711365 and parameters: {'model_name': 'SimpleImputer', 'strategy': 'constant'}. Best is trial 6 with value: 4.1717799707322785.
[I 2024-03-01 04:27:56,982] Trial 166 finished with value: 4.1717799707322785 and parameters: {'model_name': 'SimpleImputer', 'strategy': 'median'}. Best is trial 6 with value: 4.1717799707322785.
[I 2024-03-01 04:27:57,248] Trial 170 finished with value: 4.1717799707322785 and parameters: {'model_name': 'SimpleImputer', 'strategy': 'median'}. Best is trial 6 with value: 4.1717799707322785.
[I 2024-03-01 04:27:57,475] Trial 167 finished with value: 4.1717799707322785 and parameters: {'model_name': 'SimpleImputer', 'strategy': 'median'}. Best is trial 6 with value: 4.1717799707322785.
[I 2024-03-01 04:27:57,766] Trial 168 finished with value: 4.1717799707322785 and parameters: {'model_name': 'SimpleImputer', 'strategy': 'median'}. Best is trial 6 with value: 4.1717799707322785.
[I 2024-03-01 04:27:58,092] Trial 172 finished with value: 4.1717799707322785 and parameters: {'model_name': 'SimpleImputer', 'strategy': 'median'}. Best is trial 6 with value: 4.1717799707322785.
[I 2024-03-01 04:27:58,294] Trial 169 finished with value: 4.1717799707322785 and parameters: {'model_name': 'SimpleImputer', 'strategy': 'median'}. Best is trial 6 with value: 4.1717799707322785.
[I 2024-03-01 04:27:58,511] Trial 171 finished with value: 4.1717799707322785 and parameters: {'model_name': 'SimpleImputer', 'strategy': 'median'}. Best is trial 6 with value: 4.1717799707322785.
[I 2024-03-01 04:27:58,732] Trial 198 finished with value: 22.230146692711365 and parameters: {'model_name': 'SimpleImputer', 'strategy': 'constant'}. Best is trial 6 with value: 4.1717799707322785.
[I 2024-03-01 04:27:58,964] Trial 199 finished with value: 22.230146692711365 and parameters: {'model_name': 'SimpleImputer', 'strategy': 'constant'}. Best is trial 6 with value: 4.1717799707322785.
[I 2024-03-01 04:27:59,161] Trial 176 finished with value: 4.1717799707322785 and parameters: {'model_name': 'SimpleImputer', 'strategy': 'median'}. Best is trial 6 with value: 4.1717799707322785.
[I 2024-03-01 04:27:59,444] Trial 175 finished with value: 4.1717799707322785 and parameters: {'model_name': 'SimpleImputer', 'strategy': 'median'}. Best is trial 6 with value: 4.1717799707322785.
[I 2024-03-01 04:27:59,719] Trial 182 finished with value: 4.1717799707322785 and parameters: {'model_name': 'SimpleImputer', 'strategy': 'median'}. Best is trial 6 with value: 4.1717799707322785.
[I 2024-03-01 04:27:59,979] Trial 177 finished with value: 4.1717799707322785 and parameters: {'model_name': 'SimpleImputer', 'strategy': 'median'}. Best is trial 6 with value: 4.1717799707322785.
[I 2024-03-01 04:28:00,186] Trial 174 finished with value: 4.1717799707322785 and parameters: {'model_name': 'SimpleImputer', 'strategy': 'median'}. Best is trial 6 with value: 4.1717799707322785.
[I 2024-03-01 04:28:00,363] Trial 181 finished with value: 4.1717799707322785 and parameters: {'model_name': 'SimpleImputer', 'strategy': 'median'}. Best is trial 6 with value: 4.1717799707322785.
[I 2024-03-01 04:28:00,545] Trial 178 finished with value: 4.1717799707322785 and parameters: {'model_name': 'SimpleImputer', 'strategy': 'median'}. Best is trial 6 with value: 4.1717799707322785.
[I 2024-03-01 04:28:00,772] Trial 189 finished with value: 4.1717799707322785 and parameters: {'model_name': 'SimpleImputer', 'strategy': 'median'}. Best is trial 6 with value: 4.1717799707322785.
[I 2024-03-01 04:28:00,970] Trial 186 finished with value: 4.1717799707322785 and parameters: {'model_name': 'SimpleImputer', 'strategy': 'median'}. Best is trial 6 with value: 4.1717799707322785.
[I 2024-03-01 04:28:01,151] Trial 183 finished with value: 4.1717799707322785 and parameters: {'model_name': 'SimpleImputer', 'strategy': 'median'}. Best is trial 6 with value: 4.1717799707322785.
[I 2024-03-01 04:28:01,329] Trial 179 finished with value: 4.1717799707322785 and parameters: {'model_name': 'SimpleImputer', 'strategy': 'median'}. Best is trial 6 with value: 4.1717799707322785.
[I 2024-03-01 04:28:01,551] Trial 180 finished with value: 4.1717799707322785 and parameters: {'model_name': 'SimpleImputer', 'strategy': 'median'}. Best is trial 6 with value: 4.1717799707322785.
[I 2024-03-01 04:28:01,771] Trial 188 finished with value: 4.1717799707322785 and parameters: {'model_name': 'SimpleImputer', 'strategy': 'median'}. Best is trial 6 with value: 4.1717799707322785.
[I 2024-03-01 04:28:01,970] Trial 173 finished with value: 4.1717799707322785 and parameters: {'model_name': 'SimpleImputer', 'strategy': 'median'}. Best is trial 6 with value: 4.1717799707322785.
[I 2024-03-01 04:28:02,152] Trial 187 finished with value: 4.1717799707322785 and parameters: {'model_name': 'SimpleImputer', 'strategy': 'median'}. Best is trial 6 with value: 4.1717799707322785.
[I 2024-03-01 04:28:02,372] Trial 184 finished with value: 4.1717799707322785 and parameters: {'model_name': 'SimpleImputer', 'strategy': 'median'}. Best is trial 6 with value: 4.1717799707322785.
[I 2024-03-01 04:28:02,544] Trial 185 finished with value: 4.1717799707322785 and parameters: {'model_name': 'SimpleImputer', 'strategy': 'median'}. Best is trial 6 with value: 4.1717799707322785.
[I 2024-03-01 04:28:02,702] Trial 192 finished with value: 4.1717799707322785 and parameters: {'model_name': 'SimpleImputer', 'strategy': 'median'}. Best is trial 6 with value: 4.1717799707322785.
[I 2024-03-01 04:28:02,946] Trial 190 finished with value: 4.1717799707322785 and parameters: {'model_name': 'SimpleImputer', 'strategy': 'median'}. Best is trial 6 with value: 4.1717799707322785.
[I 2024-03-01 04:28:03,124] Trial 194 finished with value: 4.1717799707322785 and parameters: {'model_name': 'SimpleImputer', 'strategy': 'median'}. Best is trial 6 with value: 4.1717799707322785.
[I 2024-03-01 04:28:03,359] Trial 193 finished with value: 4.1717799707322785 and parameters: {'model_name': 'SimpleImputer', 'strategy': 'median'}. Best is trial 6 with value: 4.1717799707322785.
