[I 2024-02-23 07:07:15,189] Trial 108 finished with value: 20.009629735591854 and parameters: {'model_name': 'SimpleImputer', 'strategy': 'mean'}. Best is trial 2 with value: 20.009629735591854.
[I 2024-02-23 07:07:15,456] Trial 72 finished with value: 20.019466627212218 and parameters: {'model_name': 'SimpleImputer', 'strategy': 'most_frequent'}. Best is trial 2 with value: 20.009629735591854.
[I 2024-02-23 07:07:15,756] Trial 77 finished with value: 20.019466627212218 and parameters: {'model_name': 'SimpleImputer', 'strategy': 'most_frequent'}. Best is trial 2 with value: 20.009629735591854.
[I 2024-02-23 07:07:15,999] Trial 65 finished with value: 20.019466627212218 and parameters: {'model_name': 'SimpleImputer', 'strategy': 'most_frequent'}. Best is trial 2 with value: 20.009629735591854.
[I 2024-02-23 07:07:16,240] Trial 107 finished with value: 20.009629735591854 and parameters: {'model_name': 'SimpleImputer', 'strategy': 'mean'}. Best is trial 2 with value: 20.009629735591854.
[I 2024-02-23 07:07:16,772] Trial 113 finished with value: 20.009629735591854 and parameters: {'model_name': 'SimpleImputer', 'strategy': 'mean'}. Best is trial 2 with value: 20.009629735591854.
[I 2024-02-23 07:07:17,124] Trial 109 finished with value: 20.009629735591854 and parameters: {'model_name': 'SimpleImputer', 'strategy': 'mean'}. Best is trial 2 with value: 20.009629735591854.
[I 2024-02-23 07:07:17,428] Trial 115 finished with value: 20.009629735591854 and parameters: {'model_name': 'SimpleImputer', 'strategy': 'mean'}. Best is trial 2 with value: 20.009629735591854.
[I 2024-02-23 07:07:17,640] Trial 110 finished with value: 20.009629735591854 and parameters: {'model_name': 'SimpleImputer', 'strategy': 'mean'}. Best is trial 2 with value: 20.009629735591854.
[I 2024-02-23 07:07:18,057] Trial 112 finished with value: 20.009629735591854 and parameters: {'model_name': 'SimpleImputer', 'strategy': 'mean'}. Best is trial 2 with value: 20.009629735591854.
[I 2024-02-23 07:07:18,235] Trial 120 finished with value: 20.009629735591854 and parameters: {'model_name': 'SimpleImputer', 'strategy': 'mean'}. Best is trial 2 with value: 20.009629735591854.
[I 2024-02-23 07:07:18,561] Trial 111 finished with value: 20.009629735591854 and parameters: {'model_name': 'SimpleImputer', 'strategy': 'mean'}. Best is trial 2 with value: 20.009629735591854.
[I 2024-02-23 07:07:18,758] Trial 114 finished with value: 20.009629735591854 and parameters: {'model_name': 'SimpleImputer', 'strategy': 'mean'}. Best is trial 2 with value: 20.009629735591854.
[I 2024-02-23 07:07:19,145] Trial 118 finished with value: 20.009629735591854 and parameters: {'model_name': 'SimpleImputer', 'strategy': 'mean'}. Best is trial 2 with value: 20.009629735591854.
[I 2024-02-23 07:07:19,395] Trial 123 finished with value: 20.009629735591854 and parameters: {'model_name': 'SimpleImputer', 'strategy': 'mean'}. Best is trial 2 with value: 20.009629735591854.
[I 2024-02-23 07:07:19,690] Trial 116 finished with value: 20.009629735591854 and parameters: {'model_name': 'SimpleImputer', 'strategy': 'mean'}. Best is trial 2 with value: 20.009629735591854.
[I 2024-02-23 07:07:20,036] Trial 121 finished with value: 20.009629735591854 and parameters: {'model_name': 'SimpleImputer', 'strategy': 'mean'}. Best is trial 2 with value: 20.009629735591854.
[I 2024-02-23 07:07:20,268] Trial 124 finished with value: 20.009629735591854 and parameters: {'model_name': 'SimpleImputer', 'strategy': 'mean'}. Best is trial 2 with value: 20.009629735591854.
[I 2024-02-23 07:07:20,576] Trial 122 finished with value: 20.009629735591854 and parameters: {'model_name': 'SimpleImputer', 'strategy': 'mean'}. Best is trial 2 with value: 20.009629735591854.
[I 2024-02-23 07:07:20,850] Trial 127 finished with value: 20.009629735591854 and parameters: {'model_name': 'SimpleImputer', 'strategy': 'mean'}. Best is trial 2 with value: 20.009629735591854.
[I 2024-02-23 07:07:21,030] Trial 126 finished with value: 20.009629735591854 and parameters: {'model_name': 'SimpleImputer', 'strategy': 'mean'}. Best is trial 2 with value: 20.009629735591854.
[I 2024-02-23 07:07:21,231] Trial 119 finished with value: 20.009629735591854 and parameters: {'model_name': 'SimpleImputer', 'strategy': 'mean'}. Best is trial 2 with value: 20.009629735591854.
[I 2024-02-23 07:07:21,524] Trial 129 finished with value: 20.009629735591854 and parameters: {'model_name': 'SimpleImputer', 'strategy': 'mean'}. Best is trial 2 with value: 20.009629735591854.
[I 2024-02-23 07:07:21,820] Trial 87 finished with value: 20.019466627212218 and parameters: {'model_name': 'SimpleImputer', 'strategy': 'most_frequent'}. Best is trial 2 with value: 20.009629735591854.
[I 2024-02-23 07:07:21,992] Trial 117 finished with value: 20.009629735591854 and parameters: {'model_name': 'SimpleImputer', 'strategy': 'mean'}. Best is trial 2 with value: 20.009629735591854.
[I 2024-02-23 07:07:22,184] Trial 125 finished with value: 20.009629735591854 and parameters: {'model_name': 'SimpleImputer', 'strategy': 'mean'}. Best is trial 2 with value: 20.009629735591854.
[I 2024-02-23 07:07:22,495] Trial 84 finished with value: 20.019466627212218 and parameters: {'model_name': 'SimpleImputer', 'strategy': 'most_frequent'}. Best is trial 2 with value: 20.009629735591854.
[I 2024-02-23 07:07:22,740] Trial 83 finished with value: 20.019466627212218 and parameters: {'model_name': 'SimpleImputer', 'strategy': 'most_frequent'}. Best is trial 2 with value: 20.009629735591854.
[I 2024-02-23 07:07:22,921] Trial 134 finished with value: 20.009629735591854 and parameters: {'model_name': 'SimpleImputer', 'strategy': 'mean'}. Best is trial 2 with value: 20.009629735591854.
[I 2024-02-23 07:07:23,255] Trial 128 finished with value: 20.009629735591854 and parameters: {'model_name': 'SimpleImputer', 'strategy': 'mean'}. Best is trial 2 with value: 20.009629735591854.
[I 2024-02-23 07:07:23,503] Trial 86 finished with value: 20.019466627212218 and parameters: {'model_name': 'SimpleImputer', 'strategy': 'most_frequent'}. Best is trial 2 with value: 20.009629735591854.
[I 2024-02-23 07:07:23,772] Trial 130 finished with value: 20.009629735591854 and parameters: {'model_name': 'SimpleImputer', 'strategy': 'mean'}. Best is trial 2 with value: 20.009629735591854.
[I 2024-02-23 07:07:24,091] Trial 131 finished with value: 20.009629735591854 and parameters: {'model_name': 'SimpleImputer', 'strategy': 'mean'}. Best is trial 2 with value: 20.009629735591854.
[I 2024-02-23 07:07:24,297] Trial 138 finished with value: 20.009629735591854 and parameters: {'model_name': 'SimpleImputer', 'strategy': 'mean'}. Best is trial 2 with value: 20.009629735591854.
[I 2024-02-23 07:07:24,507] Trial 132 finished with value: 20.009629735591854 and parameters: {'model_name': 'SimpleImputer', 'strategy': 'mean'}. Best is trial 2 with value: 20.009629735591854.
[I 2024-02-23 07:07:24,718] Trial 133 finished with value: 20.009629735591854 and parameters: {'model_name': 'SimpleImputer', 'strategy': 'mean'}. Best is trial 2 with value: 20.009629735591854.
[I 2024-02-23 07:07:25,078] Trial 82 finished with value: 20.019466627212218 and parameters: {'model_name': 'SimpleImputer', 'strategy': 'most_frequent'}. Best is trial 2 with value: 20.009629735591854.
[I 2024-02-23 07:07:25,339] Trial 136 finished with value: 20.009629735591854 and parameters: {'model_name': 'SimpleImputer', 'strategy': 'mean'}. Best is trial 2 with value: 20.009629735591854.
[I 2024-02-23 07:07:25,677] Trial 144 finished with value: 20.009629735591854 and parameters: {'model_name': 'SimpleImputer', 'strategy': 'mean'}. Best is trial 2 with value: 20.009629735591854.
[I 2024-02-23 07:07:25,942] Trial 85 finished with value: 20.019466627212218 and parameters: {'model_name': 'SimpleImputer', 'strategy': 'most_frequent'}. Best is trial 2 with value: 20.009629735591854.
[I 2024-02-23 07:07:26,412] Trial 137 finished with value: 20.009629735591854 and parameters: {'model_name': 'SimpleImputer', 'strategy': 'mean'}. Best is trial 2 with value: 20.009629735591854.
[I 2024-02-23 07:07:26,624] Trial 139 finished with value: 20.009629735591854 and parameters: {'model_name': 'SimpleImputer', 'strategy': 'mean'}. Best is trial 2 with value: 20.009629735591854.
[I 2024-02-23 07:07:26,868] Trial 135 finished with value: 20.009629735591854 and parameters: {'model_name': 'SimpleImputer', 'strategy': 'mean'}. Best is trial 2 with value: 20.009629735591854.
[I 2024-02-23 07:07:27,140] Trial 140 finished with value: 20.009629735591854 and parameters: {'model_name': 'SimpleImputer', 'strategy': 'mean'}. Best is trial 2 with value: 20.009629735591854.
[I 2024-02-23 07:07:27,483] Trial 143 finished with value: 20.009629735591854 and parameters: {'model_name': 'SimpleImputer', 'strategy': 'mean'}. Best is trial 2 with value: 20.009629735591854.
[I 2024-02-23 07:07:27,727] Trial 88 finished with value: 20.019466627212218 and parameters: {'model_name': 'SimpleImputer', 'strategy': 'most_frequent'}. Best is trial 2 with value: 20.009629735591854.
[I 2024-02-23 07:07:27,979] Trial 145 finished with value: 20.009629735591854 and parameters: {'model_name': 'SimpleImputer', 'strategy': 'mean'}. Best is trial 2 with value: 20.009629735591854.
[I 2024-02-23 07:07:28,247] Trial 141 finished with value: 20.009629735591854 and parameters: {'model_name': 'SimpleImputer', 'strategy': 'mean'}. Best is trial 2 with value: 20.009629735591854.
[I 2024-02-23 07:07:28,432] Trial 147 finished with value: 20.009629735591854 and parameters: {'model_name': 'SimpleImputer', 'strategy': 'mean'}. Best is trial 2 with value: 20.009629735591854.
[I 2024-02-23 07:07:28,599] Trial 146 finished with value: 20.009629735591854 and parameters: {'model_name': 'SimpleImputer', 'strategy': 'mean'}. Best is trial 2 with value: 20.009629735591854.
[I 2024-02-23 07:07:28,918] Trial 142 finished with value: 20.009629735591854 and parameters: {'model_name': 'SimpleImputer', 'strategy': 'mean'}. Best is trial 2 with value: 20.009629735591854.
[I 2024-02-23 07:07:29,173] Trial 148 finished with value: 20.009629735591854 and parameters: {'model_name': 'SimpleImputer', 'strategy': 'mean'}. Best is trial 2 with value: 20.009629735591854.
[I 2024-02-23 07:07:29,622] Trial 89 finished with value: 20.019466627212218 and parameters: {'model_name': 'SimpleImputer', 'strategy': 'most_frequent'}. Best is trial 2 with value: 20.009629735591854.
[I 2024-02-23 07:07:29,896] Trial 150 finished with value: 20.009629735591854 and parameters: {'model_name': 'SimpleImputer', 'strategy': 'mean'}. Best is trial 2 with value: 20.009629735591854.
[I 2024-02-23 07:07:30,261] Trial 149 finished with value: 20.009629735591854 and parameters: {'model_name': 'SimpleImputer', 'strategy': 'mean'}. Best is trial 2 with value: 20.009629735591854.
[I 2024-02-23 07:07:30,659] Trial 152 finished with value: 20.009629735591854 and parameters: {'model_name': 'SimpleImputer', 'strategy': 'mean'}. Best is trial 2 with value: 20.009629735591854.
[I 2024-02-23 07:07:30,856] Trial 154 finished with value: 20.009629735591854 and parameters: {'model_name': 'SimpleImputer', 'strategy': 'mean'}. Best is trial 2 with value: 20.009629735591854.
[I 2024-02-23 07:07:31,020] Trial 157 finished with value: 20.009629735591854 and parameters: {'model_name': 'SimpleImputer', 'strategy': 'mean'}. Best is trial 2 with value: 20.009629735591854.
[I 2024-02-23 07:07:31,334] Trial 155 finished with value: 20.009629735591854 and parameters: {'model_name': 'SimpleImputer', 'strategy': 'mean'}. Best is trial 2 with value: 20.009629735591854.
[I 2024-02-23 07:07:31,555] Trial 158 finished with value: 20.009629735591854 and parameters: {'model_name': 'SimpleImputer', 'strategy': 'mean'}. Best is trial 2 with value: 20.009629735591854.
[I 2024-02-23 07:07:31,767] Trial 153 finished with value: 20.009629735591854 and parameters: {'model_name': 'SimpleImputer', 'strategy': 'mean'}. Best is trial 2 with value: 20.009629735591854.
[I 2024-02-23 07:07:32,022] Trial 90 finished with value: 20.019466627212218 and parameters: {'model_name': 'SimpleImputer', 'strategy': 'most_frequent'}. Best is trial 2 with value: 20.009629735591854.
[I 2024-02-23 07:07:32,254] Trial 151 finished with value: 20.009629735591854 and parameters: {'model_name': 'SimpleImputer', 'strategy': 'mean'}. Best is trial 2 with value: 20.009629735591854.
[I 2024-02-23 07:07:32,504] Trial 156 finished with value: 20.009629735591854 and parameters: {'model_name': 'SimpleImputer', 'strategy': 'mean'}. Best is trial 2 with value: 20.009629735591854.
[I 2024-02-23 07:07:32,903] Trial 165 finished with value: 20.009629735591854 and parameters: {'model_name': 'SimpleImputer', 'strategy': 'mean'}. Best is trial 2 with value: 20.009629735591854.
[I 2024-02-23 07:07:33,185] Trial 168 finished with value: 20.009629735591854 and parameters: {'model_name': 'SimpleImputer', 'strategy': 'mean'}. Best is trial 2 with value: 20.009629735591854.
[I 2024-02-23 07:07:33,368] Trial 166 finished with value: 20.009629735591854 and parameters: {'model_name': 'SimpleImputer', 'strategy': 'mean'}. Best is trial 2 with value: 20.009629735591854.
[I 2024-02-23 07:07:33,554] Trial 159 finished with value: 20.009629735591854 and parameters: {'model_name': 'SimpleImputer', 'strategy': 'mean'}. Best is trial 2 with value: 20.009629735591854.
[I 2024-02-23 07:07:33,745] Trial 160 finished with value: 20.009629735591854 and parameters: {'model_name': 'SimpleImputer', 'strategy': 'mean'}. Best is trial 2 with value: 20.009629735591854.
[I 2024-02-23 07:07:33,926] Trial 92 finished with value: 20.019466627212218 and parameters: {'model_name': 'SimpleImputer', 'strategy': 'most_frequent'}. Best is trial 2 with value: 20.009629735591854.
[I 2024-02-23 07:07:34,179] Trial 162 finished with value: 20.009629735591854 and parameters: {'model_name': 'SimpleImputer', 'strategy': 'mean'}. Best is trial 2 with value: 20.009629735591854.
[I 2024-02-23 07:07:34,482] Trial 171 finished with value: 20.009629735591854 and parameters: {'model_name': 'SimpleImputer', 'strategy': 'mean'}. Best is trial 2 with value: 20.009629735591854.
[I 2024-02-23 07:07:34,736] Trial 170 finished with value: 20.009629735591854 and parameters: {'model_name': 'SimpleImputer', 'strategy': 'mean'}. Best is trial 2 with value: 20.009629735591854.
[I 2024-02-23 07:07:35,064] Trial 164 finished with value: 20.009629735591854 and parameters: {'model_name': 'SimpleImputer', 'strategy': 'mean'}. Best is trial 2 with value: 20.009629735591854.
[I 2024-02-23 07:07:35,237] Trial 169 finished with value: 20.009629735591854 and parameters: {'model_name': 'SimpleImputer', 'strategy': 'mean'}. Best is trial 2 with value: 20.009629735591854.
[I 2024-02-23 07:07:35,507] Trial 163 finished with value: 20.009629735591854 and parameters: {'model_name': 'SimpleImputer', 'strategy': 'mean'}. Best is trial 2 with value: 20.009629735591854.
[I 2024-02-23 07:07:35,706] Trial 167 finished with value: 20.009629735591854 and parameters: {'model_name': 'SimpleImputer', 'strategy': 'mean'}. Best is trial 2 with value: 20.009629735591854.
[I 2024-02-23 07:07:35,919] Trial 184 finished with value: 20.019466627212218 and parameters: {'model_name': 'SimpleImputer', 'strategy': 'constant'}. Best is trial 2 with value: 20.009629735591854.
[I 2024-02-23 07:07:36,177] Trial 183 finished with value: 20.019466627212218 and parameters: {'model_name': 'SimpleImputer', 'strategy': 'constant'}. Best is trial 2 with value: 20.009629735591854.
[I 2024-02-23 07:07:36,349] Trial 172 finished with value: 20.009629735591854 and parameters: {'model_name': 'SimpleImputer', 'strategy': 'mean'}. Best is trial 2 with value: 20.009629735591854.
[I 2024-02-23 07:07:36,587] Trial 174 finished with value: 20.009629735591854 and parameters: {'model_name': 'SimpleImputer', 'strategy': 'mean'}. Best is trial 2 with value: 20.009629735591854.
[I 2024-02-23 07:07:36,799] Trial 91 finished with value: 20.019466627212218 and parameters: {'model_name': 'SimpleImputer', 'strategy': 'most_frequent'}. Best is trial 2 with value: 20.009629735591854.
[I 2024-02-23 07:07:36,993] Trial 173 finished with value: 20.009629735591854 and parameters: {'model_name': 'SimpleImputer', 'strategy': 'mean'}. Best is trial 2 with value: 20.009629735591854.
[I 2024-02-23 07:07:37,243] Trial 179 finished with value: 20.009629735591854 and parameters: {'model_name': 'SimpleImputer', 'strategy': 'mean'}. Best is trial 2 with value: 20.009629735591854.
[I 2024-02-23 07:07:37,493] Trial 161 finished with value: 20.009629735591854 and parameters: {'model_name': 'SimpleImputer', 'strategy': 'mean'}. Best is trial 2 with value: 20.009629735591854.
[I 2024-02-23 07:07:37,678] Trial 175 finished with value: 20.009629735591854 and parameters: {'model_name': 'SimpleImputer', 'strategy': 'mean'}. Best is trial 2 with value: 20.009629735591854.
[I 2024-02-23 07:07:37,939] Trial 180 finished with value: 20.009629735591854 and parameters: {'model_name': 'SimpleImputer', 'strategy': 'mean'}. Best is trial 2 with value: 20.009629735591854.
[I 2024-02-23 07:07:38,171] Trial 177 finished with value: 20.009629735591854 and parameters: {'model_name': 'SimpleImputer', 'strategy': 'mean'}. Best is trial 2 with value: 20.009629735591854.
[I 2024-02-23 07:07:38,344] Trial 185 finished with value: 20.019466627212218 and parameters: {'model_name': 'SimpleImputer', 'strategy': 'constant'}. Best is trial 2 with value: 20.009629735591854.
[I 2024-02-23 07:07:38,533] Trial 176 finished with value: 20.009629735591854 and parameters: {'model_name': 'SimpleImputer', 'strategy': 'mean'}. Best is trial 2 with value: 20.009629735591854.
[I 2024-02-23 07:07:38,775] Trial 188 finished with value: 20.019466627212218 and parameters: {'model_name': 'SimpleImputer', 'strategy': 'constant'}. Best is trial 2 with value: 20.009629735591854.
[I 2024-02-23 07:07:38,951] Trial 189 finished with value: 20.019466627212218 and parameters: {'model_name': 'SimpleImputer', 'strategy': 'constant'}. Best is trial 2 with value: 20.009629735591854.
[I 2024-02-23 07:07:39,124] Trial 178 finished with value: 20.009629735591854 and parameters: {'model_name': 'SimpleImputer', 'strategy': 'mean'}. Best is trial 2 with value: 20.009629735591854.
[I 2024-02-23 07:07:39,369] Trial 181 finished with value: 20.009629735591854 and parameters: {'model_name': 'SimpleImputer', 'strategy': 'mean'}. Best is trial 2 with value: 20.009629735591854.
[I 2024-02-23 07:07:39,555] Trial 187 finished with value: 20.019466627212218 and parameters: {'model_name': 'SimpleImputer', 'strategy': 'constant'}. Best is trial 2 with value: 20.009629735591854.
[I 2024-02-23 07:07:39,726] Trial 191 finished with value: 20.019466627212218 and parameters: {'model_name': 'SimpleImputer', 'strategy': 'constant'}. Best is trial 2 with value: 20.009629735591854.
[I 2024-02-23 07:07:39,970] Trial 186 finished with value: 20.019466627212218 and parameters: {'model_name': 'SimpleImputer', 'strategy': 'constant'}. Best is trial 2 with value: 20.009629735591854.
[I 2024-02-23 07:07:40,146] Trial 182 finished with value: 20.009629735591854 and parameters: {'model_name': 'SimpleImputer', 'strategy': 'mean'}. Best is trial 2 with value: 20.009629735591854.
[I 2024-02-23 07:07:40,410] Trial 190 finished with value: 20.019466627212218 and parameters: {'model_name': 'SimpleImputer', 'strategy': 'constant'}. Best is trial 2 with value: 20.009629735591854.
[I 2024-02-23 07:07:40,597] Trial 196 finished with value: 20.019466627212218 and parameters: {'model_name': 'SimpleImputer', 'strategy': 'constant'}. Best is trial 2 with value: 20.009629735591854.
[I 2024-02-23 07:07:40,789] Trial 195 finished with value: 20.019466627212218 and parameters: {'model_name': 'SimpleImputer', 'strategy': 'constant'}. Best is trial 2 with value: 20.009629735591854.
[I 2024-02-23 07:07:40,955] Trial 194 finished with value: 20.019466627212218 and parameters: {'model_name': 'SimpleImputer', 'strategy': 'constant'}. Best is trial 2 with value: 20.009629735591854.
[I 2024-02-23 07:07:41,195] Trial 193 finished with value: 20.019466627212218 and parameters: {'model_name': 'SimpleImputer', 'strategy': 'constant'}. Best is trial 2 with value: 20.009629735591854.
[I 2024-02-23 07:07:41,444] Trial 192 finished with value: 20.009629735591854 and parameters: {'model_name': 'SimpleImputer', 'strategy': 'mean'}. Best is trial 2 with value: 20.009629735591854.
[I 2024-02-23 07:07:41,670] Trial 199 finished with value: 20.019466627212218 and parameters: {'model_name': 'SimpleImputer', 'strategy': 'constant'}. Best is trial 2 with value: 20.009629735591854.
[I 2024-02-23 07:07:41,844] Trial 198 finished with value: 20.019466627212218 and parameters: {'model_name': 'SimpleImputer', 'strategy': 'constant'}. Best is trial 2 with value: 20.009629735591854.
