[I 2023-12-22 00:34:13,126] Trial 20 finished with value: 0.271760559386524 and parameters: {'model_name': 'RandomForestImputer', 'max_iter': 15, 'decreasing': False, 'min_samples_split': 0.9, 'min_samples_leaf': 0.4, 'max_features': 0.6, 'warm_start': False}. Best is trial 25 with value: 0.15813713564186543.
[I 2023-12-22 00:37:50,915] Trial 84 finished with value: 0.23006386818017224 and parameters: {'model_name': 'IterativeImputer', 'sample_posterior': True, 'initial_strategy': 'most_frequent', 'imputation_order': 'descending'}. Best is trial 25 with value: 0.15813713564186543.
[I 2023-12-22 00:39:05,154] Trial 116 finished with value: 0.15813713564186543 and parameters: {'model_name': 'IterativeImputer', 'sample_posterior': False, 'initial_strategy': 'median', 'imputation_order': 'arabic'}. Best is trial 25 with value: 0.15813713564186543.
[I 2023-12-22 00:39:08,143] Trial 117 finished with value: 0.15813713564186543 and parameters: {'model_name': 'IterativeImputer', 'sample_posterior': False, 'initial_strategy': 'median', 'imputation_order': 'arabic'}. Best is trial 25 with value: 0.15813713564186543.
[I 2023-12-22 00:39:10,162] Trial 118 finished with value: 0.15813713564186543 and parameters: {'model_name': 'IterativeImputer', 'sample_posterior': False, 'initial_strategy': 'median', 'imputation_order': 'arabic'}. Best is trial 25 with value: 0.15813713564186543.
[I 2023-12-22 00:39:19,426] Trial 119 finished with value: 0.15813713564186543 and parameters: {'model_name': 'IterativeImputer', 'sample_posterior': False, 'initial_strategy': 'median', 'imputation_order': 'arabic'}. Best is trial 25 with value: 0.15813713564186543.
[I 2023-12-22 00:39:23,970] Trial 121 finished with value: 0.15813713564186543 and parameters: {'model_name': 'IterativeImputer', 'sample_posterior': False, 'initial_strategy': 'median', 'imputation_order': 'arabic'}. Best is trial 25 with value: 0.15813713564186543.
[I 2023-12-22 00:39:26,280] Trial 120 finished with value: 0.15813713564186543 and parameters: {'model_name': 'IterativeImputer', 'sample_posterior': False, 'initial_strategy': 'median', 'imputation_order': 'arabic'}. Best is trial 25 with value: 0.15813713564186543.
[I 2023-12-22 00:39:29,408] Trial 122 finished with value: 0.15813713564186543 and parameters: {'model_name': 'IterativeImputer', 'sample_posterior': False, 'initial_strategy': 'median', 'imputation_order': 'arabic'}. Best is trial 25 with value: 0.15813713564186543.
[I 2023-12-22 00:39:34,187] Trial 124 finished with value: 0.15813713564186543 and parameters: {'model_name': 'IterativeImputer', 'sample_posterior': False, 'initial_strategy': 'median', 'imputation_order': 'arabic'}. Best is trial 25 with value: 0.15813713564186543.
[I 2023-12-22 00:39:35,061] Trial 123 finished with value: 0.15813713564186543 and parameters: {'model_name': 'IterativeImputer', 'sample_posterior': False, 'initial_strategy': 'median', 'imputation_order': 'arabic'}. Best is trial 25 with value: 0.15813713564186543.
[I 2023-12-22 00:39:43,319] Trial 125 finished with value: 0.15813713564186543 and parameters: {'model_name': 'IterativeImputer', 'sample_posterior': False, 'initial_strategy': 'median', 'imputation_order': 'arabic'}. Best is trial 25 with value: 0.15813713564186543.
[I 2023-12-22 00:41:09,419] Trial 126 finished with value: 0.15813713564186543 and parameters: {'model_name': 'IterativeImputer', 'sample_posterior': False, 'initial_strategy': 'median', 'imputation_order': 'arabic'}. Best is trial 25 with value: 0.15813713564186543.
[I 2023-12-22 00:41:14,171] Trial 127 finished with value: 0.15813713564186543 and parameters: {'model_name': 'IterativeImputer', 'sample_posterior': False, 'initial_strategy': 'median', 'imputation_order': 'arabic'}. Best is trial 25 with value: 0.15813713564186543.
[I 2023-12-22 00:41:26,542] Trial 95 finished with value: 0.22603036142891267 and parameters: {'model_name': 'IterativeImputer', 'sample_posterior': True, 'initial_strategy': 'mean', 'imputation_order': 'arabic'}. Best is trial 25 with value: 0.15813713564186543.
[I 2023-12-22 00:41:39,798] Trial 97 finished with value: 0.22726384947772055 and parameters: {'model_name': 'IterativeImputer', 'sample_posterior': True, 'initial_strategy': 'mean', 'imputation_order': 'arabic'}. Best is trial 25 with value: 0.15813713564186543.
[I 2023-12-22 00:41:41,004] Trial 96 finished with value: 0.22543219050376484 and parameters: {'model_name': 'IterativeImputer', 'sample_posterior': True, 'initial_strategy': 'mean', 'imputation_order': 'arabic'}. Best is trial 25 with value: 0.15813713564186543.
[I 2023-12-22 00:41:42,591] Trial 128 finished with value: 0.15813713564186543 and parameters: {'model_name': 'IterativeImputer', 'sample_posterior': False, 'initial_strategy': 'median', 'imputation_order': 'arabic'}. Best is trial 25 with value: 0.15813713564186543.
[I 2023-12-22 00:42:00,074] Trial 98 finished with value: 0.2284464577275187 and parameters: {'model_name': 'IterativeImputer', 'sample_posterior': True, 'initial_strategy': 'mean', 'imputation_order': 'arabic'}. Best is trial 25 with value: 0.15813713564186543.
[I 2023-12-22 00:42:08,075] Trial 129 finished with value: 0.15813713564186543 and parameters: {'model_name': 'IterativeImputer', 'sample_posterior': False, 'initial_strategy': 'median', 'imputation_order': 'arabic'}. Best is trial 25 with value: 0.15813713564186543.
[I 2023-12-22 00:42:09,388] Trial 99 finished with value: 0.22691380480259124 and parameters: {'model_name': 'IterativeImputer', 'sample_posterior': True, 'initial_strategy': 'mean', 'imputation_order': 'arabic'}. Best is trial 25 with value: 0.15813713564186543.
[I 2023-12-22 00:42:10,283] Trial 130 finished with value: 0.15813713564186543 and parameters: {'model_name': 'IterativeImputer', 'sample_posterior': False, 'initial_strategy': 'median', 'imputation_order': 'arabic'}. Best is trial 25 with value: 0.15813713564186543.
[I 2023-12-22 00:42:28,509] Trial 100 finished with value: 0.22894540836887475 and parameters: {'model_name': 'IterativeImputer', 'sample_posterior': True, 'initial_strategy': 'mean', 'imputation_order': 'arabic'}. Best is trial 25 with value: 0.15813713564186543.
[I 2023-12-22 00:42:32,782] Trial 131 finished with value: 0.15813713564186543 and parameters: {'model_name': 'IterativeImputer', 'sample_posterior': False, 'initial_strategy': 'median', 'imputation_order': 'arabic'}. Best is trial 25 with value: 0.15813713564186543.
[I 2023-12-22 00:42:55,364] Trial 132 finished with value: 0.15813713564186543 and parameters: {'model_name': 'IterativeImputer', 'sample_posterior': False, 'initial_strategy': 'median', 'imputation_order': 'arabic'}. Best is trial 25 with value: 0.15813713564186543.
[I 2023-12-22 00:43:00,311] Trial 101 finished with value: 0.22744078415511598 and parameters: {'model_name': 'IterativeImputer', 'sample_posterior': True, 'initial_strategy': 'mean', 'imputation_order': 'arabic'}. Best is trial 25 with value: 0.15813713564186543.
[I 2023-12-22 00:43:36,467] Trial 102 finished with value: 0.2283594673926971 and parameters: {'model_name': 'IterativeImputer', 'sample_posterior': True, 'initial_strategy': 'mean', 'imputation_order': 'arabic'}. Best is trial 25 with value: 0.15813713564186543.
[I 2023-12-22 00:43:40,445] Trial 103 finished with value: 0.22687373055406615 and parameters: {'model_name': 'IterativeImputer', 'sample_posterior': True, 'initial_strategy': 'mean', 'imputation_order': 'arabic'}. Best is trial 25 with value: 0.15813713564186543.
[I 2023-12-22 00:45:38,581] Trial 133 finished with value: 0.15813713564186543 and parameters: {'model_name': 'IterativeImputer', 'sample_posterior': False, 'initial_strategy': 'median', 'imputation_order': 'arabic'}. Best is trial 25 with value: 0.15813713564186543.
[I 2023-12-22 00:46:29,522] Trial 135 finished with value: 0.15813713564186543 and parameters: {'model_name': 'IterativeImputer', 'sample_posterior': False, 'initial_strategy': 'median', 'imputation_order': 'arabic'}. Best is trial 25 with value: 0.15813713564186543.
[I 2023-12-22 00:46:30,506] Trial 134 finished with value: 0.15813713564186543 and parameters: {'model_name': 'IterativeImputer', 'sample_posterior': False, 'initial_strategy': 'median', 'imputation_order': 'arabic'}. Best is trial 25 with value: 0.15813713564186543.
[I 2023-12-22 00:46:34,304] Trial 136 finished with value: 0.15813713564186543 and parameters: {'model_name': 'IterativeImputer', 'sample_posterior': False, 'initial_strategy': 'median', 'imputation_order': 'arabic'}. Best is trial 25 with value: 0.15813713564186543.
[I 2023-12-22 00:46:37,547] Trial 137 finished with value: 0.15813713564186543 and parameters: {'model_name': 'IterativeImputer', 'sample_posterior': False, 'initial_strategy': 'median', 'imputation_order': 'arabic'}. Best is trial 25 with value: 0.15813713564186543.
[I 2023-12-22 00:46:43,956] Trial 138 finished with value: 0.15813713564186543 and parameters: {'model_name': 'IterativeImputer', 'sample_posterior': False, 'initial_strategy': 'median', 'imputation_order': 'arabic'}. Best is trial 25 with value: 0.15813713564186543.
[I 2023-12-22 00:46:44,954] Trial 139 finished with value: 0.15813713564186543 and parameters: {'model_name': 'IterativeImputer', 'sample_posterior': False, 'initial_strategy': 'median', 'imputation_order': 'arabic'}. Best is trial 25 with value: 0.15813713564186543.
[I 2023-12-22 00:46:47,575] Trial 140 finished with value: 0.15813713564186543 and parameters: {'model_name': 'IterativeImputer', 'sample_posterior': False, 'initial_strategy': 'median', 'imputation_order': 'arabic'}. Best is trial 25 with value: 0.15813713564186543.
[I 2023-12-22 00:46:49,536] Trial 141 finished with value: 0.15813713564186543 and parameters: {'model_name': 'IterativeImputer', 'sample_posterior': False, 'initial_strategy': 'median', 'imputation_order': 'arabic'}. Best is trial 25 with value: 0.15813713564186543.
[I 2023-12-22 00:46:54,046] Trial 142 finished with value: 0.15813713564186543 and parameters: {'model_name': 'IterativeImputer', 'sample_posterior': False, 'initial_strategy': 'median', 'imputation_order': 'arabic'}. Best is trial 25 with value: 0.15813713564186543.
[I 2023-12-22 00:46:55,120] Trial 143 finished with value: 0.15813713564186543 and parameters: {'model_name': 'IterativeImputer', 'sample_posterior': False, 'initial_strategy': 'median', 'imputation_order': 'arabic'}. Best is trial 25 with value: 0.15813713564186543.
[I 2023-12-22 00:46:58,012] Trial 104 finished with value: 0.22582070364844706 and parameters: {'model_name': 'IterativeImputer', 'sample_posterior': True, 'initial_strategy': 'constant', 'imputation_order': 'arabic'}. Best is trial 25 with value: 0.15813713564186543.
[I 2023-12-22 00:47:02,476] Trial 171 finished with value: 0.3574979774583832 and parameters: {'model_name': 'SimpleImputer', 'strategy': 'most_frequent'}. Best is trial 25 with value: 0.15813713564186543.
[I 2023-12-22 00:47:08,014] Trial 105 finished with value: 0.22744717126967803 and parameters: {'model_name': 'IterativeImputer', 'sample_posterior': True, 'initial_strategy': 'constant', 'imputation_order': 'arabic'}. Best is trial 25 with value: 0.15813713564186543.
[I 2023-12-22 00:47:09,413] Trial 109 finished with value: 0.2262172141937286 and parameters: {'model_name': 'IterativeImputer', 'sample_posterior': True, 'initial_strategy': 'median', 'imputation_order': 'arabic'}. Best is trial 25 with value: 0.15813713564186543.
[I 2023-12-22 00:47:13,952] Trial 108 finished with value: 0.22554520948736229 and parameters: {'model_name': 'IterativeImputer', 'sample_posterior': True, 'initial_strategy': 'median', 'imputation_order': 'arabic'}. Best is trial 25 with value: 0.15813713564186543.
[I 2023-12-22 00:47:15,787] Trial 106 finished with value: 0.22520622629924433 and parameters: {'model_name': 'IterativeImputer', 'sample_posterior': True, 'initial_strategy': 'median', 'imputation_order': 'arabic'}. Best is trial 25 with value: 0.15813713564186543.
[I 2023-12-22 00:47:17,007] Trial 112 finished with value: 0.2305950425834178 and parameters: {'model_name': 'IterativeImputer', 'sample_posterior': True, 'initial_strategy': 'median', 'imputation_order': 'arabic'}. Best is trial 25 with value: 0.15813713564186543.
[I 2023-12-22 00:47:18,216] Trial 110 finished with value: 0.228311503046373 and parameters: {'model_name': 'IterativeImputer', 'sample_posterior': True, 'initial_strategy': 'median', 'imputation_order': 'arabic'}. Best is trial 25 with value: 0.15813713564186543.
[I 2023-12-22 00:47:19,929] Trial 111 finished with value: 0.22605873220267178 and parameters: {'model_name': 'IterativeImputer', 'sample_posterior': True, 'initial_strategy': 'median', 'imputation_order': 'arabic'}. Best is trial 25 with value: 0.15813713564186543.
[I 2023-12-22 00:47:22,903] Trial 107 finished with value: 0.22763574998576983 and parameters: {'model_name': 'IterativeImputer', 'sample_posterior': True, 'initial_strategy': 'median', 'imputation_order': 'arabic'}. Best is trial 25 with value: 0.15813713564186543.
[I 2023-12-22 00:47:30,197] Trial 113 finished with value: 0.22564518001249584 and parameters: {'model_name': 'IterativeImputer', 'sample_posterior': True, 'initial_strategy': 'median', 'imputation_order': 'arabic'}. Best is trial 25 with value: 0.15813713564186543.
[I 2023-12-22 00:47:47,437] Trial 66 finished with value: 0.29269791898863523 and parameters: {'model_name': 'GAIN', 'batch_size': 3, 'hint_rate': 0.49, 'alpha': 44, 'iterations': 517}. Best is trial 25 with value: 0.15813713564186543.
[I 2023-12-22 00:47:51,467] Trial 147 finished with value: 0.15813713564186543 and parameters: {'model_name': 'IterativeImputer', 'sample_posterior': False, 'initial_strategy': 'median', 'imputation_order': 'arabic'}. Best is trial 25 with value: 0.15813713564186543.
[I 2023-12-22 00:48:18,791] Trial 154 finished with value: 0.16155156106759533 and parameters: {'model_name': 'IterativeImputer', 'sample_posterior': False, 'initial_strategy': 'median', 'imputation_order': 'random'}. Best is trial 25 with value: 0.15813713564186543.
[I 2023-12-22 00:48:32,593] Trial 157 finished with value: 0.16311726477479802 and parameters: {'model_name': 'IterativeImputer', 'sample_posterior': False, 'initial_strategy': 'median', 'imputation_order': 'random'}. Best is trial 25 with value: 0.15813713564186543.
[I 2023-12-22 00:48:51,872] Trial 180 finished with value: 0.27177919624044605 and parameters: {'model_name': 'RandomForestImputer', 'max_iter': 1, 'decreasing': True, 'min_samples_split': 0.0, 'min_samples_leaf': 0.9, 'max_features': 0.1, 'warm_start': False}. Best is trial 25 with value: 0.15813713564186543.
[I 2023-12-22 00:49:10,664] Trial 114 finished with value: 0.22647193466791551 and parameters: {'model_name': 'IterativeImputer', 'sample_posterior': True, 'initial_strategy': 'median', 'imputation_order': 'arabic'}. Best is trial 25 with value: 0.15813713564186543.
[I 2023-12-22 00:49:14,089] Trial 183 finished with value: 0.27177919624044605 and parameters: {'model_name': 'RandomForestImputer', 'max_iter': 1, 'decreasing': True, 'min_samples_split': 0.1, 'min_samples_leaf': 0.9, 'max_features': 0.1, 'warm_start': False}. Best is trial 25 with value: 0.15813713564186543.
[I 2023-12-22 00:49:20,987] Trial 115 finished with value: 0.22903481416497865 and parameters: {'model_name': 'IterativeImputer', 'sample_posterior': True, 'initial_strategy': 'median', 'imputation_order': 'arabic'}. Best is trial 25 with value: 0.15813713564186543.
[I 2023-12-22 00:49:37,975] Trial 160 finished with value: 0.16218456569893744 and parameters: {'model_name': 'IterativeImputer', 'sample_posterior': False, 'initial_strategy': 'median', 'imputation_order': 'random'}. Best is trial 25 with value: 0.15813713564186543.
[I 2023-12-22 00:49:53,993] Trial 165 finished with value: 0.15813713564186543 and parameters: {'model_name': 'IterativeImputer', 'sample_posterior': False, 'initial_strategy': 'median', 'imputation_order': 'arabic'}. Best is trial 25 with value: 0.15813713564186543.
[I 2023-12-22 00:49:56,127] Trial 168 finished with value: 0.15813713564186543 and parameters: {'model_name': 'IterativeImputer', 'sample_posterior': False, 'initial_strategy': 'median', 'imputation_order': 'arabic'}. Best is trial 25 with value: 0.15813713564186543.
[I 2023-12-22 00:49:57,943] Trial 162 finished with value: 0.16144404926243722 and parameters: {'model_name': 'IterativeImputer', 'sample_posterior': False, 'initial_strategy': 'median', 'imputation_order': 'random'}. Best is trial 25 with value: 0.15813713564186543.
[I 2023-12-22 00:50:09,522] Trial 177 finished with value: 0.161041486007056 and parameters: {'model_name': 'IterativeImputer', 'sample_posterior': False, 'initial_strategy': 'median', 'imputation_order': 'random'}. Best is trial 25 with value: 0.15813713564186543.
[I 2023-12-22 00:51:06,860] Trial 51 finished with value: 0.2951187535714346 and parameters: {'model_name': 'GAIN', 'batch_size': 2, 'hint_rate': 0.6, 'alpha': 94, 'iterations': 700}. Best is trial 25 with value: 0.15813713564186543.
[I 2023-12-22 00:51:23,083] Trial 192 finished with value: 0.15889117947824655 and parameters: {'model_name': 'IterativeImputer', 'sample_posterior': False, 'initial_strategy': 'most_frequent', 'imputation_order': 'ascending'}. Best is trial 25 with value: 0.15813713564186543.
[I 2023-12-22 00:51:33,522] Trial 194 finished with value: 0.15813713564186543 and parameters: {'model_name': 'IterativeImputer', 'sample_posterior': False, 'initial_strategy': 'median', 'imputation_order': 'arabic'}. Best is trial 25 with value: 0.15813713564186543.
[I 2023-12-22 00:58:01,595] Trial 71 finished with value: 0.29873088083057847 and parameters: {'model_name': 'GAIN', 'batch_size': 482, 'hint_rate': 0.73, 'alpha': 86, 'iterations': 942}. Best is trial 25 with value: 0.15813713564186543.
[I 2023-12-22 00:59:06,285] Trial 198 finished with value: 0.1631614253789881 and parameters: {'model_name': 'IterativeImputer', 'sample_posterior': False, 'initial_strategy': 'median', 'imputation_order': 'roman'}. Best is trial 25 with value: 0.15813713564186543.
[I 2023-12-22 01:01:24,459] Trial 37 finished with value: inf and parameters: {'model_name': 'GAIN', 'batch_size': 3, 'hint_rate': 0.9500000000000001, 'alpha': 27, 'iterations': 14783}. Best is trial 25 with value: 0.15813713564186543.
[I 2023-12-22 01:04:00,865] Trial 70 finished with value: 0.29781197577151064 and parameters: {'model_name': 'GAIN', 'batch_size': 7, 'hint_rate': 0.77, 'alpha': 53, 'iterations': 1608}. Best is trial 25 with value: 0.15813713564186543.
[I 2023-12-22 01:09:23,701] Trial 151 finished with value: inf and parameters: {'model_name': 'GAIN', 'batch_size': 793, 'hint_rate': 0.06999999999999999, 'alpha': 82, 'iterations': 12144}. Best is trial 25 with value: 0.15813713564186543.
[I 2023-12-22 01:09:46,986] Trial 49 finished with value: 0.27176879401553145 and parameters: {'model_name': 'RandomForestImputer', 'max_iter': 84, 'decreasing': False, 'min_samples_split': 0.7000000000000001, 'min_samples_leaf': 0.7000000000000001, 'max_features': 0.8, 'warm_start': False}. Best is trial 25 with value: 0.15813713564186543.
[I 2023-12-22 01:11:45,794] Trial 40 finished with value: 0.2582638505537818 and parameters: {'model_name': 'RandomForestImputer', 'max_iter': 70, 'decreasing': True, 'min_samples_split': 0.8, 'min_samples_leaf': 0.2, 'max_features': 0.7000000000000001, 'warm_start': False}. Best is trial 25 with value: 0.15813713564186543.
[I 2023-12-22 01:15:40,362] Trial 190 finished with value: inf and parameters: {'model_name': 'GAIN', 'batch_size': 893, 'hint_rate': 0.01, 'alpha': 94, 'iterations': 14658}. Best is trial 25 with value: 0.15813713564186543.
[I 2023-12-22 01:17:55,085] Trial 159 finished with value: inf and parameters: {'model_name': 'GAIN', 'batch_size': 702, 'hint_rate': 0.01, 'alpha': 90, 'iterations': 17191}. Best is trial 25 with value: 0.15813713564186543.
[I 2023-12-22 01:20:34,104] Trial 153 finished with value: inf and parameters: {'model_name': 'GAIN', 'batch_size': 802, 'hint_rate': 0.01, 'alpha': 97, 'iterations': 18932}. Best is trial 25 with value: 0.15813713564186543.
[I 2023-12-22 01:23:03,010] Trial 185 finished with value: 0.25945369282810543 and parameters: {'model_name': 'RandomForestImputer', 'max_iter': 78, 'decreasing': True, 'min_samples_split': 0.0, 'min_samples_leaf': 0.1, 'max_features': 0.1, 'warm_start': False}. Best is trial 25 with value: 0.15813713564186543.
[I 2023-12-22 01:24:14,041] Trial 30 finished with value: 0.30447038800416665 and parameters: {'model_name': 'GAIN', 'batch_size': 29, 'hint_rate': 0.93, 'alpha': 71, 'iterations': 3088}. Best is trial 25 with value: 0.15813713564186543.
[I 2023-12-22 01:29:43,955] Trial 178 finished with value: inf and parameters: {'model_name': 'GAIN', 'batch_size': 929, 'hint_rate': 0.03, 'alpha': 95, 'iterations': 24789}. Best is trial 25 with value: 0.15813713564186543.
[I 2023-12-22 01:37:09,025] Trial 155 finished with value: inf and parameters: {'model_name': 'GAIN', 'batch_size': 996, 'hint_rate': 0.04, 'alpha': 98, 'iterations': 30850}. Best is trial 25 with value: 0.15813713564186543.
[I 2023-12-22 01:42:18,369] Trial 191 finished with value: inf and parameters: {'model_name': 'GAIN', 'batch_size': 931, 'hint_rate': 0.05, 'alpha': 98, 'iterations': 33496}. Best is trial 25 with value: 0.15813713564186543.
[I 2023-12-22 01:43:16,237] Trial 158 finished with value: inf and parameters: {'model_name': 'GAIN', 'batch_size': 674, 'hint_rate': 0.01, 'alpha': 97, 'iterations': 36219}. Best is trial 25 with value: 0.15813713564186543.
[I 2023-12-22 01:58:48,831] Trial 179 finished with value: inf and parameters: {'model_name': 'GAIN', 'batch_size': 798, 'hint_rate': 0.01, 'alpha': 100, 'iterations': 47779}. Best is trial 25 with value: 0.15813713564186543.
