[I 2024-04-01 16:45:20,947] Trial 88 finished with value: 101.2912232335881 and parameters: {'model_name': 'SimpleImputer', 'strategy': 'most_frequent'}. Best is trial 0 with value: 91.40968706709549.
[I 2024-04-01 16:45:21,155] Trial 89 finished with value: 101.2912232335881 and parameters: {'model_name': 'SimpleImputer', 'strategy': 'most_frequent'}. Best is trial 0 with value: 91.40968706709549.
[I 2024-04-01 16:45:21,508] Trial 91 finished with value: 101.2912232335881 and parameters: {'model_name': 'SimpleImputer', 'strategy': 'most_frequent'}. Best is trial 0 with value: 91.40968706709549.
[I 2024-04-01 16:45:21,847] Trial 90 finished with value: 101.2912232335881 and parameters: {'model_name': 'SimpleImputer', 'strategy': 'most_frequent'}. Best is trial 0 with value: 91.40968706709549.
[I 2024-04-01 16:45:22,322] Trial 85 finished with value: 101.2912232335881 and parameters: {'model_name': 'SimpleImputer', 'strategy': 'most_frequent'}. Best is trial 0 with value: 91.40968706709549.
[I 2024-04-01 16:45:22,646] Trial 118 finished with value: 91.40968706709549 and parameters: {'model_name': 'SimpleImputer', 'strategy': 'mean'}. Best is trial 0 with value: 91.40968706709549.
[I 2024-04-01 16:45:22,933] Trial 115 finished with value: 91.40968706709549 and parameters: {'model_name': 'SimpleImputer', 'strategy': 'mean'}. Best is trial 0 with value: 91.40968706709549.
[I 2024-04-01 16:45:23,152] Trial 113 finished with value: 91.40968706709549 and parameters: {'model_name': 'SimpleImputer', 'strategy': 'mean'}. Best is trial 0 with value: 91.40968706709549.
[I 2024-04-01 16:45:23,434] Trial 92 finished with value: 101.2912232335881 and parameters: {'model_name': 'SimpleImputer', 'strategy': 'most_frequent'}. Best is trial 0 with value: 91.40968706709549.
[I 2024-04-01 16:45:23,722] Trial 93 finished with value: 101.2912232335881 and parameters: {'model_name': 'SimpleImputer', 'strategy': 'most_frequent'}. Best is trial 0 with value: 91.40968706709549.
[I 2024-04-01 16:45:24,107] Trial 120 finished with value: 91.40968706709549 and parameters: {'model_name': 'SimpleImputer', 'strategy': 'mean'}. Best is trial 0 with value: 91.40968706709549.
[I 2024-04-01 16:45:24,367] Trial 123 finished with value: 91.40968706709549 and parameters: {'model_name': 'SimpleImputer', 'strategy': 'mean'}. Best is trial 0 with value: 91.40968706709549.
[I 2024-04-01 16:45:24,552] Trial 114 finished with value: 91.40968706709549 and parameters: {'model_name': 'SimpleImputer', 'strategy': 'mean'}. Best is trial 0 with value: 91.40968706709549.
[I 2024-04-01 16:45:24,786] Trial 116 finished with value: 91.40968706709549 and parameters: {'model_name': 'SimpleImputer', 'strategy': 'mean'}. Best is trial 0 with value: 91.40968706709549.
[I 2024-04-01 16:45:25,284] Trial 96 finished with value: 101.2912232335881 and parameters: {'model_name': 'SimpleImputer', 'strategy': 'most_frequent'}. Best is trial 0 with value: 91.40968706709549.
[I 2024-04-01 16:45:25,534] Trial 122 finished with value: 91.40968706709549 and parameters: {'model_name': 'SimpleImputer', 'strategy': 'mean'}. Best is trial 0 with value: 91.40968706709549.
[I 2024-04-01 16:45:25,896] Trial 117 finished with value: 91.40968706709549 and parameters: {'model_name': 'SimpleImputer', 'strategy': 'mean'}. Best is trial 0 with value: 91.40968706709549.
[I 2024-04-01 16:45:26,187] Trial 121 finished with value: 91.40968706709549 and parameters: {'model_name': 'SimpleImputer', 'strategy': 'mean'}. Best is trial 0 with value: 91.40968706709549.
[I 2024-04-01 16:45:26,455] Trial 119 finished with value: 91.40968706709549 and parameters: {'model_name': 'SimpleImputer', 'strategy': 'mean'}. Best is trial 0 with value: 91.40968706709549.
[I 2024-04-01 16:45:26,688] Trial 95 finished with value: 101.2912232335881 and parameters: {'model_name': 'SimpleImputer', 'strategy': 'most_frequent'}. Best is trial 0 with value: 91.40968706709549.
[I 2024-04-01 16:45:26,920] Trial 125 finished with value: 91.40968706709549 and parameters: {'model_name': 'SimpleImputer', 'strategy': 'mean'}. Best is trial 0 with value: 91.40968706709549.
[I 2024-04-01 16:45:27,102] Trial 126 finished with value: 91.40968706709549 and parameters: {'model_name': 'SimpleImputer', 'strategy': 'mean'}. Best is trial 0 with value: 91.40968706709549.
[I 2024-04-01 16:45:27,389] Trial 127 finished with value: 91.40968706709549 and parameters: {'model_name': 'SimpleImputer', 'strategy': 'mean'}. Best is trial 0 with value: 91.40968706709549.
[I 2024-04-01 16:45:27,577] Trial 124 finished with value: 91.40968706709549 and parameters: {'model_name': 'SimpleImputer', 'strategy': 'mean'}. Best is trial 0 with value: 91.40968706709549.
[I 2024-04-01 16:45:27,885] Trial 132 finished with value: 91.40968706709549 and parameters: {'model_name': 'SimpleImputer', 'strategy': 'mean'}. Best is trial 0 with value: 91.40968706709549.
[I 2024-04-01 16:45:28,102] Trial 130 finished with value: 91.40968706709549 and parameters: {'model_name': 'SimpleImputer', 'strategy': 'mean'}. Best is trial 0 with value: 91.40968706709549.
[I 2024-04-01 16:45:28,356] Trial 94 finished with value: 101.2912232335881 and parameters: {'model_name': 'SimpleImputer', 'strategy': 'most_frequent'}. Best is trial 0 with value: 91.40968706709549.
[I 2024-04-01 16:45:28,664] Trial 131 finished with value: 91.40968706709549 and parameters: {'model_name': 'SimpleImputer', 'strategy': 'mean'}. Best is trial 0 with value: 91.40968706709549.
[I 2024-04-01 16:45:28,910] Trial 128 finished with value: 91.40968706709549 and parameters: {'model_name': 'SimpleImputer', 'strategy': 'mean'}. Best is trial 0 with value: 91.40968706709549.
[I 2024-04-01 16:45:29,230] Trial 133 finished with value: 91.40968706709549 and parameters: {'model_name': 'SimpleImputer', 'strategy': 'mean'}. Best is trial 0 with value: 91.40968706709549.
[I 2024-04-01 16:45:29,454] Trial 129 finished with value: 91.40968706709549 and parameters: {'model_name': 'SimpleImputer', 'strategy': 'mean'}. Best is trial 0 with value: 91.40968706709549.
[I 2024-04-01 16:45:29,887] Trial 135 finished with value: 91.40968706709549 and parameters: {'model_name': 'SimpleImputer', 'strategy': 'mean'}. Best is trial 0 with value: 91.40968706709549.
[I 2024-04-01 16:45:30,131] Trial 100 finished with value: 101.2912232335881 and parameters: {'model_name': 'SimpleImputer', 'strategy': 'most_frequent'}. Best is trial 0 with value: 91.40968706709549.
[I 2024-04-01 16:45:30,503] Trial 134 finished with value: 91.40968706709549 and parameters: {'model_name': 'SimpleImputer', 'strategy': 'mean'}. Best is trial 0 with value: 91.40968706709549.
[I 2024-04-01 16:45:30,699] Trial 99 finished with value: 101.2912232335881 and parameters: {'model_name': 'SimpleImputer', 'strategy': 'most_frequent'}. Best is trial 0 with value: 91.40968706709549.
[I 2024-04-01 16:45:30,895] Trial 101 finished with value: 101.2912232335881 and parameters: {'model_name': 'SimpleImputer', 'strategy': 'most_frequent'}. Best is trial 0 with value: 91.40968706709549.
[I 2024-04-01 16:45:31,159] Trial 136 finished with value: 91.40968706709549 and parameters: {'model_name': 'SimpleImputer', 'strategy': 'mean'}. Best is trial 0 with value: 91.40968706709549.
[I 2024-04-01 16:45:31,362] Trial 138 finished with value: 91.40968706709549 and parameters: {'model_name': 'SimpleImputer', 'strategy': 'mean'}. Best is trial 0 with value: 91.40968706709549.
[I 2024-04-01 16:45:31,633] Trial 97 finished with value: 101.2912232335881 and parameters: {'model_name': 'SimpleImputer', 'strategy': 'most_frequent'}. Best is trial 0 with value: 91.40968706709549.
[I 2024-04-01 16:45:31,876] Trial 137 finished with value: 91.40968706709549 and parameters: {'model_name': 'SimpleImputer', 'strategy': 'mean'}. Best is trial 0 with value: 91.40968706709549.
[I 2024-04-01 16:45:32,267] Trial 98 finished with value: 101.2912232335881 and parameters: {'model_name': 'SimpleImputer', 'strategy': 'most_frequent'}. Best is trial 0 with value: 91.40968706709549.
[I 2024-04-01 16:45:32,678] Trial 102 finished with value: 101.2912232335881 and parameters: {'model_name': 'SimpleImputer', 'strategy': 'most_frequent'}. Best is trial 0 with value: 91.40968706709549.
[I 2024-04-01 16:45:32,900] Trial 140 finished with value: 91.40968706709549 and parameters: {'model_name': 'SimpleImputer', 'strategy': 'mean'}. Best is trial 0 with value: 91.40968706709549.
[I 2024-04-01 16:45:33,310] Trial 142 finished with value: 91.40968706709549 and parameters: {'model_name': 'SimpleImputer', 'strategy': 'mean'}. Best is trial 0 with value: 91.40968706709549.
[I 2024-04-01 16:45:33,644] Trial 141 finished with value: 91.40968706709549 and parameters: {'model_name': 'SimpleImputer', 'strategy': 'mean'}. Best is trial 0 with value: 91.40968706709549.
[I 2024-04-01 16:45:33,951] Trial 143 finished with value: 91.40968706709549 and parameters: {'model_name': 'SimpleImputer', 'strategy': 'mean'}. Best is trial 0 with value: 91.40968706709549.
[I 2024-04-01 16:45:34,486] Trial 150 finished with value: 91.40968706709549 and parameters: {'model_name': 'SimpleImputer', 'strategy': 'mean'}. Best is trial 0 with value: 91.40968706709549.
[I 2024-04-01 16:45:34,805] Trial 145 finished with value: 91.40968706709549 and parameters: {'model_name': 'SimpleImputer', 'strategy': 'mean'}. Best is trial 0 with value: 91.40968706709549.
[I 2024-04-01 16:45:35,044] Trial 139 finished with value: 91.40968706709549 and parameters: {'model_name': 'SimpleImputer', 'strategy': 'mean'}. Best is trial 0 with value: 91.40968706709549.
[I 2024-04-01 16:45:35,232] Trial 151 finished with value: 91.40968706709549 and parameters: {'model_name': 'SimpleImputer', 'strategy': 'mean'}. Best is trial 0 with value: 91.40968706709549.
[I 2024-04-01 16:45:35,535] Trial 146 finished with value: 91.40968706709549 and parameters: {'model_name': 'SimpleImputer', 'strategy': 'mean'}. Best is trial 0 with value: 91.40968706709549.
[I 2024-04-01 16:45:35,788] Trial 152 finished with value: 91.40968706709549 and parameters: {'model_name': 'SimpleImputer', 'strategy': 'mean'}. Best is trial 0 with value: 91.40968706709549.
[I 2024-04-01 16:45:36,064] Trial 144 finished with value: 91.40968706709549 and parameters: {'model_name': 'SimpleImputer', 'strategy': 'mean'}. Best is trial 0 with value: 91.40968706709549.
[I 2024-04-01 16:45:36,301] Trial 147 finished with value: 91.40968706709549 and parameters: {'model_name': 'SimpleImputer', 'strategy': 'mean'}. Best is trial 0 with value: 91.40968706709549.
[I 2024-04-01 16:45:36,711] Trial 103 finished with value: 101.2912232335881 and parameters: {'model_name': 'SimpleImputer', 'strategy': 'most_frequent'}. Best is trial 0 with value: 91.40968706709549.
[I 2024-04-01 16:45:36,974] Trial 149 finished with value: 91.40968706709549 and parameters: {'model_name': 'SimpleImputer', 'strategy': 'mean'}. Best is trial 0 with value: 91.40968706709549.
[I 2024-04-01 16:45:37,208] Trial 154 finished with value: 91.40968706709549 and parameters: {'model_name': 'SimpleImputer', 'strategy': 'mean'}. Best is trial 0 with value: 91.40968706709549.
[I 2024-04-01 16:45:37,516] Trial 148 finished with value: 91.40968706709549 and parameters: {'model_name': 'SimpleImputer', 'strategy': 'mean'}. Best is trial 0 with value: 91.40968706709549.
[I 2024-04-01 16:45:37,720] Trial 104 finished with value: 101.2912232335881 and parameters: {'model_name': 'SimpleImputer', 'strategy': 'most_frequent'}. Best is trial 0 with value: 91.40968706709549.
[I 2024-04-01 16:45:37,963] Trial 105 finished with value: 101.2912232335881 and parameters: {'model_name': 'SimpleImputer', 'strategy': 'most_frequent'}. Best is trial 0 with value: 91.40968706709549.
[I 2024-04-01 16:45:38,170] Trial 159 finished with value: 91.40968706709549 and parameters: {'model_name': 'SimpleImputer', 'strategy': 'mean'}. Best is trial 0 with value: 91.40968706709549.
[I 2024-04-01 16:45:38,341] Trial 156 finished with value: 91.40968706709549 and parameters: {'model_name': 'SimpleImputer', 'strategy': 'mean'}. Best is trial 0 with value: 91.40968706709549.
[I 2024-04-01 16:45:38,608] Trial 161 finished with value: 91.40968706709549 and parameters: {'model_name': 'SimpleImputer', 'strategy': 'mean'}. Best is trial 0 with value: 91.40968706709549.
[I 2024-04-01 16:45:38,973] Trial 153 finished with value: 91.40968706709549 and parameters: {'model_name': 'SimpleImputer', 'strategy': 'mean'}. Best is trial 0 with value: 91.40968706709549.
[I 2024-04-01 16:45:39,167] Trial 162 finished with value: 91.40968706709549 and parameters: {'model_name': 'SimpleImputer', 'strategy': 'mean'}. Best is trial 0 with value: 91.40968706709549.
[I 2024-04-01 16:45:39,408] Trial 166 finished with value: 91.40968706709549 and parameters: {'model_name': 'SimpleImputer', 'strategy': 'mean'}. Best is trial 0 with value: 91.40968706709549.
[I 2024-04-01 16:45:39,594] Trial 155 finished with value: 91.40968706709549 and parameters: {'model_name': 'SimpleImputer', 'strategy': 'mean'}. Best is trial 0 with value: 91.40968706709549.
[I 2024-04-01 16:45:39,759] Trial 158 finished with value: 91.40968706709549 and parameters: {'model_name': 'SimpleImputer', 'strategy': 'mean'}. Best is trial 0 with value: 91.40968706709549.
[I 2024-04-01 16:45:39,950] Trial 164 finished with value: 91.40968706709549 and parameters: {'model_name': 'SimpleImputer', 'strategy': 'mean'}. Best is trial 0 with value: 91.40968706709549.
[I 2024-04-01 16:45:40,161] Trial 160 finished with value: 91.40968706709549 and parameters: {'model_name': 'SimpleImputer', 'strategy': 'mean'}. Best is trial 0 with value: 91.40968706709549.
[I 2024-04-01 16:45:40,453] Trial 167 finished with value: 91.40968706709549 and parameters: {'model_name': 'SimpleImputer', 'strategy': 'mean'}. Best is trial 0 with value: 91.40968706709549.
[I 2024-04-01 16:45:40,761] Trial 169 finished with value: 91.40968706709549 and parameters: {'model_name': 'SimpleImputer', 'strategy': 'mean'}. Best is trial 0 with value: 91.40968706709549.
[I 2024-04-01 16:45:41,001] Trial 165 finished with value: 91.40968706709549 and parameters: {'model_name': 'SimpleImputer', 'strategy': 'mean'}. Best is trial 0 with value: 91.40968706709549.
[I 2024-04-01 16:45:41,297] Trial 157 finished with value: 91.40968706709549 and parameters: {'model_name': 'SimpleImputer', 'strategy': 'mean'}. Best is trial 0 with value: 91.40968706709549.
[I 2024-04-01 16:45:41,547] Trial 163 finished with value: 91.40968706709549 and parameters: {'model_name': 'SimpleImputer', 'strategy': 'mean'}. Best is trial 0 with value: 91.40968706709549.
[I 2024-04-01 16:45:41,845] Trial 170 finished with value: 91.40968706709549 and parameters: {'model_name': 'SimpleImputer', 'strategy': 'mean'}. Best is trial 0 with value: 91.40968706709549.
[I 2024-04-01 16:45:42,088] Trial 168 finished with value: 91.40968706709549 and parameters: {'model_name': 'SimpleImputer', 'strategy': 'mean'}. Best is trial 0 with value: 91.40968706709549.
[I 2024-04-01 16:45:42,527] Trial 179 finished with value: 91.40968706709549 and parameters: {'model_name': 'SimpleImputer', 'strategy': 'mean'}. Best is trial 0 with value: 91.40968706709549.
[I 2024-04-01 16:45:42,702] Trial 174 finished with value: 91.40968706709549 and parameters: {'model_name': 'SimpleImputer', 'strategy': 'mean'}. Best is trial 0 with value: 91.40968706709549.
[I 2024-04-01 16:45:42,978] Trial 173 finished with value: 91.40968706709549 and parameters: {'model_name': 'SimpleImputer', 'strategy': 'mean'}. Best is trial 0 with value: 91.40968706709549.
[I 2024-04-01 16:45:43,240] Trial 172 finished with value: 91.40968706709549 and parameters: {'model_name': 'SimpleImputer', 'strategy': 'mean'}. Best is trial 0 with value: 91.40968706709549.
[I 2024-04-01 16:45:43,499] Trial 183 finished with value: 91.40968706709549 and parameters: {'model_name': 'SimpleImputer', 'strategy': 'mean'}. Best is trial 0 with value: 91.40968706709549.
[I 2024-04-01 16:45:43,706] Trial 175 finished with value: 91.40968706709549 and parameters: {'model_name': 'SimpleImputer', 'strategy': 'mean'}. Best is trial 0 with value: 91.40968706709549.
[I 2024-04-01 16:45:44,000] Trial 171 finished with value: 91.40968706709549 and parameters: {'model_name': 'SimpleImputer', 'strategy': 'mean'}. Best is trial 0 with value: 91.40968706709549.
[I 2024-04-01 16:45:44,202] Trial 181 finished with value: 91.40968706709549 and parameters: {'model_name': 'SimpleImputer', 'strategy': 'mean'}. Best is trial 0 with value: 91.40968706709549.
[I 2024-04-01 16:45:44,376] Trial 184 finished with value: 91.40968706709549 and parameters: {'model_name': 'SimpleImputer', 'strategy': 'mean'}. Best is trial 0 with value: 91.40968706709549.
[I 2024-04-01 16:45:44,677] Trial 176 finished with value: 91.40968706709549 and parameters: {'model_name': 'SimpleImputer', 'strategy': 'mean'}. Best is trial 0 with value: 91.40968706709549.
[I 2024-04-01 16:45:44,969] Trial 180 finished with value: 91.40968706709549 and parameters: {'model_name': 'SimpleImputer', 'strategy': 'mean'}. Best is trial 0 with value: 91.40968706709549.
[I 2024-04-01 16:45:45,169] Trial 178 finished with value: 91.40968706709549 and parameters: {'model_name': 'SimpleImputer', 'strategy': 'mean'}. Best is trial 0 with value: 91.40968706709549.
[I 2024-04-01 16:45:45,374] Trial 177 finished with value: 91.40968706709549 and parameters: {'model_name': 'SimpleImputer', 'strategy': 'mean'}. Best is trial 0 with value: 91.40968706709549.
[I 2024-04-01 16:45:45,585] Trial 182 finished with value: 91.40968706709549 and parameters: {'model_name': 'SimpleImputer', 'strategy': 'mean'}. Best is trial 0 with value: 91.40968706709549.
[I 2024-04-01 16:45:45,831] Trial 185 finished with value: 91.40968706709549 and parameters: {'model_name': 'SimpleImputer', 'strategy': 'mean'}. Best is trial 0 with value: 91.40968706709549.
[I 2024-04-01 16:45:46,023] Trial 187 finished with value: 91.40968706709549 and parameters: {'model_name': 'SimpleImputer', 'strategy': 'mean'}. Best is trial 0 with value: 91.40968706709549.
[I 2024-04-01 16:45:46,197] Trial 195 finished with value: 101.2912232335881 and parameters: {'model_name': 'SimpleImputer', 'strategy': 'constant'}. Best is trial 0 with value: 91.40968706709549.
[I 2024-04-01 16:45:46,447] Trial 186 finished with value: 91.40968706709549 and parameters: {'model_name': 'SimpleImputer', 'strategy': 'mean'}. Best is trial 0 with value: 91.40968706709549.
[I 2024-04-01 16:45:46,686] Trial 197 finished with value: 101.2912232335881 and parameters: {'model_name': 'SimpleImputer', 'strategy': 'constant'}. Best is trial 0 with value: 91.40968706709549.
[I 2024-04-01 16:45:46,911] Trial 194 finished with value: 101.2912232335881 and parameters: {'model_name': 'SimpleImputer', 'strategy': 'constant'}. Best is trial 0 with value: 91.40968706709549.
[I 2024-04-01 16:45:47,110] Trial 190 finished with value: 91.40968706709549 and parameters: {'model_name': 'SimpleImputer', 'strategy': 'mean'}. Best is trial 0 with value: 91.40968706709549.
[I 2024-04-01 16:45:47,362] Trial 196 finished with value: 101.2912232335881 and parameters: {'model_name': 'SimpleImputer', 'strategy': 'constant'}. Best is trial 0 with value: 91.40968706709549.
[I 2024-04-01 16:45:47,550] Trial 188 finished with value: 91.40968706709549 and parameters: {'model_name': 'SimpleImputer', 'strategy': 'mean'}. Best is trial 0 with value: 91.40968706709549.
[I 2024-04-01 16:45:47,794] Trial 193 finished with value: 101.2912232335881 and parameters: {'model_name': 'SimpleImputer', 'strategy': 'constant'}. Best is trial 0 with value: 91.40968706709549.
[I 2024-04-01 16:45:48,034] Trial 199 finished with value: 101.2912232335881 and parameters: {'model_name': 'SimpleImputer', 'strategy': 'constant'}. Best is trial 0 with value: 91.40968706709549.
[I 2024-04-01 16:45:48,216] Trial 189 finished with value: 91.40968706709549 and parameters: {'model_name': 'SimpleImputer', 'strategy': 'mean'}. Best is trial 0 with value: 91.40968706709549.
[I 2024-04-01 16:45:48,386] Trial 198 finished with value: 101.2912232335881 and parameters: {'model_name': 'SimpleImputer', 'strategy': 'constant'}. Best is trial 0 with value: 91.40968706709549.
[I 2024-04-01 16:45:48,616] Trial 192 finished with value: 91.40968706709549 and parameters: {'model_name': 'SimpleImputer', 'strategy': 'mean'}. Best is trial 0 with value: 91.40968706709549.
