[I 2024-01-04 05:29:59,094] Trial 11 finished with value: 6050886.0827872995 and parameters: {'model_name': 'SimpleImputer', 'strategy': 'constant'}. Best is trial 11 with value: 6050886.0827872995.
[I 2024-01-04 05:30:00,512] Trial 25 finished with value: 2974321.5458215834 and parameters: {'model_name': 'SimpleImputer', 'strategy': 'mean'}. Best is trial 25 with value: 2974321.5458215834.
[I 2024-01-04 05:30:01,178] Trial 30 finished with value: 6050886.0827872995 and parameters: {'model_name': 'SimpleImputer', 'strategy': 'constant'}. Best is trial 25 with value: 2974321.5458215834.
[I 2024-01-04 05:30:01,868] Trial 6 finished with value: 3351494.4724445743 and parameters: {'model_name': 'SimpleImputer', 'strategy': 'median'}. Best is trial 25 with value: 2974321.5458215834.
[I 2024-01-04 05:30:02,864] Trial 19 finished with value: 3351494.4724445743 and parameters: {'model_name': 'SimpleImputer', 'strategy': 'median'}. Best is trial 25 with value: 2974321.5458215834.
[I 2024-01-04 05:30:04,207] Trial 46 finished with value: 6050886.0827872995 and parameters: {'model_name': 'SimpleImputer', 'strategy': 'constant'}. Best is trial 25 with value: 2974321.5458215834.
[I 2024-01-04 05:30:04,679] Trial 14 finished with value: 3351494.4724445743 and parameters: {'model_name': 'SimpleImputer', 'strategy': 'median'}. Best is trial 25 with value: 2974321.5458215834.
[I 2024-01-04 05:30:07,509] Trial 28 finished with value: 3351494.4724445743 and parameters: {'model_name': 'SimpleImputer', 'strategy': 'median'}. Best is trial 25 with value: 2974321.5458215834.
[I 2024-01-04 05:30:08,404] Trial 38 finished with value: 3351494.4724445743 and parameters: {'model_name': 'SimpleImputer', 'strategy': 'median'}. Best is trial 25 with value: 2974321.5458215834.
[I 2024-01-04 05:30:10,337] Trial 44 finished with value: 3351494.4724445743 and parameters: {'model_name': 'SimpleImputer', 'strategy': 'median'}. Best is trial 25 with value: 2974321.5458215834.
2024-01-04 05:30:11.345146: E external/local_xla/xla/stream_executor/cuda/cuda_driver.cc:274] failed call to cuInit: CUDA_ERROR_NO_DEVICE: no CUDA-capable device is detected
2024-01-04 05:30:12.154083: I tensorflow/compiler/mlir/mlir_graph_optimization_pass.cc:388] MLIR V1 optimization pass is not enabled
[I 2024-01-04 05:30:14,506] Trial 52 finished with value: 3351494.4724445743 and parameters: {'model_name': 'SimpleImputer', 'strategy': 'median'}. Best is trial 25 with value: 2974321.5458215834.
[I 2024-01-04 05:30:15,754] Trial 54 finished with value: 2974321.5458215834 and parameters: {'model_name': 'SimpleImputer', 'strategy': 'mean'}. Best is trial 25 with value: 2974321.5458215834.
[I 2024-01-04 05:30:20,397] Trial 36 finished with value: 6050886.082787235 and parameters: {'model_name': 'SimpleImputer', 'strategy': 'most_frequent'}. Best is trial 25 with value: 2974321.5458215834.
[I 2024-01-04 05:31:20,664] Trial 7 finished with value: 3090438.6023262762 and parameters: {'model_name': 'KNNImputer', 'weights': 'uniform', 'keep_empty_features': False}. Best is trial 25 with value: 2974321.5458215834.
[I 2024-01-04 05:31:21,347] Trial 22 finished with value: 3090438.6023262762 and parameters: {'model_name': 'KNNImputer', 'weights': 'uniform', 'keep_empty_features': False}. Best is trial 25 with value: 2974321.5458215834.
[I 2024-01-04 05:31:22,347] Trial 5 finished with value: 3090438.6023262762 and parameters: {'model_name': 'KNNImputer', 'weights': 'uniform', 'keep_empty_features': False}. Best is trial 25 with value: 2974321.5458215834.
[I 2024-01-04 05:31:23,294] Trial 12 finished with value: 3090438.6023262762 and parameters: {'model_name': 'KNNImputer', 'weights': 'uniform', 'keep_empty_features': False}. Best is trial 25 with value: 2974321.5458215834.
[I 2024-01-04 05:31:24,745] Trial 3 finished with value: 3090438.6023262762 and parameters: {'model_name': 'KNNImputer', 'weights': 'uniform', 'keep_empty_features': False}. Best is trial 25 with value: 2974321.5458215834.
[I 2024-01-04 05:31:25,725] Trial 35 finished with value: 3090438.6023262762 and parameters: {'model_name': 'KNNImputer', 'weights': 'uniform', 'keep_empty_features': False}. Best is trial 25 with value: 2974321.5458215834.
[I 2024-01-04 05:31:28,152] Trial 33 finished with value: 3090438.6023262762 and parameters: {'model_name': 'KNNImputer', 'weights': 'uniform', 'keep_empty_features': False}. Best is trial 25 with value: 2974321.5458215834.
[I 2024-01-04 05:31:29,238] Trial 50 finished with value: 3238678.2928885138 and parameters: {'model_name': 'KNNImputer', 'weights': 'distance', 'keep_empty_features': False}. Best is trial 25 with value: 2974321.5458215834.
[I 2024-01-04 05:31:31,998] Trial 45 finished with value: 3238678.2928885138 and parameters: {'model_name': 'KNNImputer', 'weights': 'distance', 'keep_empty_features': False}. Best is trial 25 with value: 2974321.5458215834.
[I 2024-01-04 05:31:34,818] Trial 55 finished with value: 3238678.2928885138 and parameters: {'model_name': 'KNNImputer', 'weights': 'distance', 'keep_empty_features': False}. Best is trial 25 with value: 2974321.5458215834.
[I 2024-01-04 05:32:01,362] Trial 8 finished with value: 7245206.04894411 and parameters: {'model_name': 'RandomForestImputer', 'max_iter': 2, 'decreasing': True, 'min_samples_split': 1.0, 'min_samples_leaf': 0.9, 'max_features': 0.8, 'warm_start': True}. Best is trial 25 with value: 2974321.5458215834.
[I 2024-01-04 05:32:27,997] Trial 21 finished with value: 4737975.079509241 and parameters: {'model_name': 'GAIN', 'batch_size': 246, 'hint_rate': 0.73, 'alpha': 39, 'iterations': 2}. Best is trial 25 with value: 2974321.5458215834.
[I 2024-01-04 05:32:29,220] Trial 29 finished with value: 4631528.4513940485 and parameters: {'model_name': 'GAIN', 'batch_size': 12, 'hint_rate': 0.66, 'alpha': 87, 'iterations': 2}. Best is trial 25 with value: 2974321.5458215834.
[I 2024-01-04 05:32:31,335] Trial 41 finished with value: 4293081.754397795 and parameters: {'model_name': 'GAIN', 'batch_size': 13, 'hint_rate': 0.45, 'alpha': 19, 'iterations': 1}. Best is trial 25 with value: 2974321.5458215834.
[I 2024-01-04 05:32:33,294] Trial 43 finished with value: 4740177.166386996 and parameters: {'model_name': 'GAIN', 'batch_size': 2, 'hint_rate': 0.79, 'alpha': 4, 'iterations': 2}. Best is trial 25 with value: 2974321.5458215834.
[I 2024-01-04 05:32:34,731] Trial 53 finished with value: 4413045.720937913 and parameters: {'model_name': 'GAIN', 'batch_size': 205, 'hint_rate': 0.8, 'alpha': 43, 'iterations': 2}. Best is trial 25 with value: 2974321.5458215834.
[I 2024-01-04 05:32:36,863] Trial 57 finished with value: 7234580.258508263 and parameters: {'model_name': 'RandomForestImputer', 'max_iter': 3, 'decreasing': True, 'min_samples_split': 0.0, 'min_samples_leaf': 0.5, 'max_features': 0.9, 'warm_start': True}. Best is trial 25 with value: 2974321.5458215834.
[I 2024-01-04 05:32:56,985] Trial 24 finished with value: 2974321.5458215834 and parameters: {'model_name': 'RandomForestImputer', 'max_iter': 1, 'decreasing': True, 'min_samples_split': 0.4, 'min_samples_leaf': 0.9, 'max_features': 0.6, 'warm_start': False}. Best is trial 25 with value: 2974321.5458215834.
[I 2024-01-04 05:33:06,089] Trial 70 finished with value: 4240303.600486404 and parameters: {'model_name': 'GAIN', 'batch_size': 10, 'hint_rate': 0.6900000000000001, 'alpha': 12, 'iterations': 1}. Best is trial 25 with value: 2974321.5458215834.
[I 2024-01-04 05:33:14,088] Trial 59 finished with value: 3892743.681347632 and parameters: {'model_name': 'GAIN', 'batch_size': 1, 'hint_rate': 0.54, 'alpha': 27, 'iterations': 15}. Best is trial 25 with value: 2974321.5458215834.
[I 2024-01-04 05:33:28,919] Trial 64 finished with value: 2974321.5458215834 and parameters: {'model_name': 'RandomForestImputer', 'max_iter': 1, 'decreasing': False, 'min_samples_split': 1.0, 'min_samples_leaf': 0.2, 'max_features': 0.8, 'warm_start': False}. Best is trial 25 with value: 2974321.5458215834.
[I 2024-01-04 05:33:39,966] Trial 10 finished with value: 7278213.194168655 and parameters: {'model_name': 'RandomForestImputer', 'max_iter': 7, 'decreasing': True, 'min_samples_split': 1.0, 'min_samples_leaf': 0.30000000000000004, 'max_features': 0.2, 'warm_start': True}. Best is trial 25 with value: 2974321.5458215834.
[I 2024-01-04 05:33:42,478] Trial 0 finished with value: 3789026.3827413754 and parameters: {'model_name': 'GAIN', 'batch_size': 62, 'hint_rate': 0.12, 'alpha': 48, 'iterations': 22}. Best is trial 25 with value: 2974321.5458215834.
[I 2024-01-04 05:34:02,306] Trial 40 finished with value: 4347438.130754814 and parameters: {'model_name': 'GAIN', 'batch_size': 98, 'hint_rate': 0.05, 'alpha': 93, 'iterations': 25}. Best is trial 25 with value: 2974321.5458215834.
[I 2024-01-04 05:34:12,346] Trial 58 finished with value: 7244014.401287024 and parameters: {'model_name': 'RandomForestImputer', 'max_iter': 18, 'decreasing': True, 'min_samples_split': 1.0, 'min_samples_leaf': 0.5, 'max_features': 0.9, 'warm_start': True}. Best is trial 25 with value: 2974321.5458215834.
[I 2024-01-04 05:34:16,151] Trial 42 finished with value: 2886281.7457074737 and parameters: {'model_name': 'IterativeImputer', 'sample_posterior': False, 'initial_strategy': 'constant', 'imputation_order': 'ascending'}. Best is trial 42 with value: 2886281.7457074737.
[I 2024-01-04 05:34:17,385] Trial 37 finished with value: 2886281.552368863 and parameters: {'model_name': 'IterativeImputer', 'sample_posterior': False, 'initial_strategy': 'mean', 'imputation_order': 'descending'}. Best is trial 37 with value: 2886281.552368863.
[I 2024-01-04 05:34:18,839] Trial 48 finished with value: 2886281.534197254 and parameters: {'model_name': 'IterativeImputer', 'sample_posterior': False, 'initial_strategy': 'mean', 'imputation_order': 'roman'}. Best is trial 48 with value: 2886281.534197254.
[I 2024-01-04 05:34:22,160] Trial 39 finished with value: 2886281.4570111125 and parameters: {'model_name': 'IterativeImputer', 'sample_posterior': False, 'initial_strategy': 'median', 'imputation_order': 'descending'}. Best is trial 39 with value: 2886281.4570111125.
[I 2024-01-04 05:34:25,019] Trial 20 finished with value: 2886281.7457074905 and parameters: {'model_name': 'IterativeImputer', 'sample_posterior': False, 'initial_strategy': 'most_frequent', 'imputation_order': 'ascending'}. Best is trial 39 with value: 2886281.4570111125.
[I 2024-01-04 05:34:27,226] Trial 47 finished with value: 2886281.648615609 and parameters: {'model_name': 'IterativeImputer', 'sample_posterior': False, 'initial_strategy': 'most_frequent', 'imputation_order': 'roman'}. Best is trial 39 with value: 2886281.4570111125.
[I 2024-01-04 05:34:30,274] Trial 49 finished with value: 2886281.648615609 and parameters: {'model_name': 'IterativeImputer', 'sample_posterior': False, 'initial_strategy': 'most_frequent', 'imputation_order': 'roman'}. Best is trial 39 with value: 2886281.4570111125.
[I 2024-01-04 05:34:45,731] Trial 34 finished with value: 4298797.722750052 and parameters: {'model_name': 'GAIN', 'batch_size': 24, 'hint_rate': 0.68, 'alpha': 3, 'iterations': 43}. Best is trial 39 with value: 2886281.4570111125.
[I 2024-01-04 05:34:48,081] Trial 51 finished with value: 7419840.666421232 and parameters: {'model_name': 'RandomForestImputer', 'max_iter': 16, 'decreasing': False, 'min_samples_split': 0.6000000000000001, 'min_samples_leaf': 0.4, 'max_features': 0.8, 'warm_start': True}. Best is trial 39 with value: 2886281.4570111125.
[I 2024-01-04 05:34:51,246] Trial 65 finished with value: 2886281.552368863 and parameters: {'model_name': 'IterativeImputer', 'sample_posterior': False, 'initial_strategy': 'mean', 'imputation_order': 'descending'}. Best is trial 39 with value: 2886281.4570111125.
[I 2024-01-04 05:35:03,075] Trial 69 finished with value: 4615470.846209533 and parameters: {'model_name': 'GAIN', 'batch_size': 9, 'hint_rate': 0.97, 'alpha': 99, 'iterations': 36}. Best is trial 39 with value: 2886281.4570111125.
[I 2024-01-04 05:35:35,477] Trial 27 finished with value: 2973636.01663443 and parameters: {'model_name': 'RandomForestImputer', 'max_iter': 2, 'decreasing': True, 'min_samples_split': 0.30000000000000004, 'min_samples_leaf': 0.4, 'max_features': 0.7000000000000001, 'warm_start': False}. Best is trial 39 with value: 2886281.4570111125.
[I 2024-01-04 05:35:48,155] Trial 74 finished with value: 2886281.648615607 and parameters: {'model_name': 'IterativeImputer', 'sample_posterior': False, 'initial_strategy': 'constant', 'imputation_order': 'roman'}. Best is trial 39 with value: 2886281.4570111125.
[I 2024-01-04 05:35:55,662] Trial 72 finished with value: 2886281.590724795 and parameters: {'model_name': 'IterativeImputer', 'sample_posterior': False, 'initial_strategy': 'most_frequent', 'imputation_order': 'arabic'}. Best is trial 39 with value: 2886281.4570111125.
[I 2024-01-04 05:35:56,703] Trial 73 finished with value: 2886281.4639369147 and parameters: {'model_name': 'IterativeImputer', 'sample_posterior': False, 'initial_strategy': 'most_frequent', 'imputation_order': 'descending'}. Best is trial 39 with value: 2886281.4570111125.
[I 2024-01-04 05:36:16,872] Trial 78 finished with value: 2886281.552368863 and parameters: {'model_name': 'IterativeImputer', 'sample_posterior': False, 'initial_strategy': 'mean', 'imputation_order': 'descending'}. Best is trial 39 with value: 2886281.4570111125.
[I 2024-01-04 05:36:32,779] Trial 71 finished with value: 4442202.092261411 and parameters: {'model_name': 'GAIN', 'batch_size': 2, 'hint_rate': 0.8, 'alpha': 60, 'iterations': 61}. Best is trial 39 with value: 2886281.4570111125.
[I 2024-01-04 05:36:55,911] Trial 81 finished with value: 2886281.4570111125 and parameters: {'model_name': 'IterativeImputer', 'sample_posterior': False, 'initial_strategy': 'median', 'imputation_order': 'descending'}. Best is trial 39 with value: 2886281.4570111125.
[I 2024-01-04 05:37:03,261] Trial 83 finished with value: 2886281.648615607 and parameters: {'model_name': 'IterativeImputer', 'sample_posterior': False, 'initial_strategy': 'constant', 'imputation_order': 'roman'}. Best is trial 39 with value: 2886281.4570111125.
[I 2024-01-04 05:37:17,878] Trial 82 finished with value: 2886281.1610404705 and parameters: {'model_name': 'IterativeImputer', 'sample_posterior': False, 'initial_strategy': 'mean', 'imputation_order': 'random'}. Best is trial 82 with value: 2886281.1610404705.
[I 2024-01-04 05:37:24,588] Trial 84 finished with value: 2886281.6426797123 and parameters: {'model_name': 'IterativeImputer', 'sample_posterior': False, 'initial_strategy': 'median', 'imputation_order': 'roman'}. Best is trial 82 with value: 2886281.1610404705.
[I 2024-01-04 05:37:31,173] Trial 85 finished with value: 2886281.7457074737 and parameters: {'model_name': 'IterativeImputer', 'sample_posterior': False, 'initial_strategy': 'constant', 'imputation_order': 'ascending'}. Best is trial 82 with value: 2886281.1610404705.
[I 2024-01-04 05:37:35,799] Trial 87 finished with value: 2886281.552368863 and parameters: {'model_name': 'IterativeImputer', 'sample_posterior': False, 'initial_strategy': 'mean', 'imputation_order': 'descending'}. Best is trial 82 with value: 2886281.1610404705.
[I 2024-01-04 05:37:37,161] Trial 88 finished with value: 2886281.5946681276 and parameters: {'model_name': 'IterativeImputer', 'sample_posterior': False, 'initial_strategy': 'mean', 'imputation_order': 'ascending'}. Best is trial 82 with value: 2886281.1610404705.
[I 2024-01-04 05:37:38,097] Trial 86 finished with value: 2886281.7457074737 and parameters: {'model_name': 'IterativeImputer', 'sample_posterior': False, 'initial_strategy': 'constant', 'imputation_order': 'ascending'}. Best is trial 82 with value: 2886281.1610404705.
[I 2024-01-04 05:37:41,105] Trial 90 finished with value: 2886281.552368863 and parameters: {'model_name': 'IterativeImputer', 'sample_posterior': False, 'initial_strategy': 'mean', 'imputation_order': 'descending'}. Best is trial 82 with value: 2886281.1610404705.
[I 2024-01-04 05:37:43,990] Trial 91 finished with value: 2886281.534197254 and parameters: {'model_name': 'IterativeImputer', 'sample_posterior': False, 'initial_strategy': 'mean', 'imputation_order': 'roman'}. Best is trial 82 with value: 2886281.1610404705.
[I 2024-01-04 05:37:45,288] Trial 89 finished with value: 2886281.552368863 and parameters: {'model_name': 'IterativeImputer', 'sample_posterior': False, 'initial_strategy': 'mean', 'imputation_order': 'descending'}. Best is trial 82 with value: 2886281.1610404705.
[I 2024-01-04 05:37:50,901] Trial 92 finished with value: 2886281.534197254 and parameters: {'model_name': 'IterativeImputer', 'sample_posterior': False, 'initial_strategy': 'mean', 'imputation_order': 'roman'}. Best is trial 82 with value: 2886281.1610404705.
[I 2024-01-04 05:38:02,702] Trial 93 finished with value: 2886281.534197254 and parameters: {'model_name': 'IterativeImputer', 'sample_posterior': False, 'initial_strategy': 'mean', 'imputation_order': 'roman'}. Best is trial 82 with value: 2886281.1610404705.
[I 2024-01-04 05:38:03,920] Trial 95 finished with value: 2886281.552368863 and parameters: {'model_name': 'IterativeImputer', 'sample_posterior': False, 'initial_strategy': 'mean', 'imputation_order': 'descending'}. Best is trial 82 with value: 2886281.1610404705.
[I 2024-01-04 05:38:05,251] Trial 94 finished with value: 2886281.534197254 and parameters: {'model_name': 'IterativeImputer', 'sample_posterior': False, 'initial_strategy': 'mean', 'imputation_order': 'roman'}. Best is trial 82 with value: 2886281.1610404705.
[I 2024-01-04 05:38:17,789] Trial 96 finished with value: 2886281.552368863 and parameters: {'model_name': 'IterativeImputer', 'sample_posterior': False, 'initial_strategy': 'mean', 'imputation_order': 'descending'}. Best is trial 82 with value: 2886281.1610404705.
[I 2024-01-04 05:38:38,285] Trial 97 finished with value: 2886281.552368863 and parameters: {'model_name': 'IterativeImputer', 'sample_posterior': False, 'initial_strategy': 'mean', 'imputation_order': 'descending'}. Best is trial 82 with value: 2886281.1610404705.
[I 2024-01-04 05:38:42,854] Trial 98 finished with value: 2886281.552368863 and parameters: {'model_name': 'IterativeImputer', 'sample_posterior': False, 'initial_strategy': 'mean', 'imputation_order': 'descending'}. Best is trial 82 with value: 2886281.1610404705.
[I 2024-01-04 05:38:48,247] Trial 100 finished with value: 2886281.552368863 and parameters: {'model_name': 'IterativeImputer', 'sample_posterior': False, 'initial_strategy': 'mean', 'imputation_order': 'descending'}. Best is trial 82 with value: 2886281.1610404705.
[I 2024-01-04 05:38:52,365] Trial 99 finished with value: 2886281.552368863 and parameters: {'model_name': 'IterativeImputer', 'sample_posterior': False, 'initial_strategy': 'mean', 'imputation_order': 'descending'}. Best is trial 82 with value: 2886281.1610404705.
[I 2024-01-04 05:39:15,411] Trial 102 finished with value: 2886281.552368863 and parameters: {'model_name': 'IterativeImputer', 'sample_posterior': False, 'initial_strategy': 'mean', 'imputation_order': 'descending'}. Best is trial 82 with value: 2886281.1610404705.
[I 2024-01-04 05:39:26,907] Trial 62 finished with value: 2923018.022330977 and parameters: {'model_name': 'RandomForestImputer', 'max_iter': 4, 'decreasing': False, 'min_samples_split': 0.6000000000000001, 'min_samples_leaf': 0.1, 'max_features': 0.1, 'warm_start': False}. Best is trial 82 with value: 2886281.1610404705.
[I 2024-01-04 05:40:21,981] Trial 111 finished with value: 2886282.1235927385 and parameters: {'model_name': 'IterativeImputer', 'sample_posterior': False, 'initial_strategy': 'median', 'imputation_order': 'random'}. Best is trial 82 with value: 2886281.1610404705.
[I 2024-01-04 05:41:13,136] Trial 1 finished with value: 2974262.075193067 and parameters: {'model_name': 'RandomForestImputer', 'max_iter': 8, 'decreasing': False, 'min_samples_split': 1.0, 'min_samples_leaf': 0.4, 'max_features': 0.2, 'warm_start': False}. Best is trial 82 with value: 2886281.1610404705.
[I 2024-01-04 05:41:41,578] Trial 16 finished with value: 4198187.002864727 and parameters: {'model_name': 'IterativeImputer', 'sample_posterior': True, 'initial_strategy': 'median', 'imputation_order': 'descending'}. Best is trial 82 with value: 2886281.1610404705.
[I 2024-01-04 05:41:43,064] Trial 23 finished with value: 4279897.140886071 and parameters: {'model_name': 'IterativeImputer', 'sample_posterior': True, 'initial_strategy': 'median', 'imputation_order': 'arabic'}. Best is trial 82 with value: 2886281.1610404705.
[I 2024-01-04 05:41:44,858] Trial 13 finished with value: 4274933.932259966 and parameters: {'model_name': 'IterativeImputer', 'sample_posterior': True, 'initial_strategy': 'most_frequent', 'imputation_order': 'roman'}. Best is trial 82 with value: 2886281.1610404705.
[I 2024-01-04 05:41:46,469] Trial 17 finished with value: 4235346.075374033 and parameters: {'model_name': 'IterativeImputer', 'sample_posterior': True, 'initial_strategy': 'median', 'imputation_order': 'descending'}. Best is trial 82 with value: 2886281.1610404705.
[I 2024-01-04 05:41:49,763] Trial 2 finished with value: 4176316.2211153815 and parameters: {'model_name': 'IterativeImputer', 'sample_posterior': True, 'initial_strategy': 'most_frequent', 'imputation_order': 'arabic'}. Best is trial 82 with value: 2886281.1610404705.
[I 2024-01-04 05:41:51,913] Trial 60 finished with value: 4285659.398869498 and parameters: {'model_name': 'IterativeImputer', 'sample_posterior': True, 'initial_strategy': 'constant', 'imputation_order': 'roman'}. Best is trial 82 with value: 2886281.1610404705.
[I 2024-01-04 05:42:05,966] Trial 31 finished with value: 4224763.004458215 and parameters: {'model_name': 'IterativeImputer', 'sample_posterior': True, 'initial_strategy': 'median', 'imputation_order': 'random'}. Best is trial 82 with value: 2886281.1610404705.
