[I 2023-12-26 13:25:30,659] Trial 112 finished with value: 0.3295559011403175 and parameters: {'model_name': 'SimpleImputer', 'strategy': 'mean'}. Best is trial 1 with value: 0.3295559011403175.
[I 2023-12-26 13:25:31,029] Trial 80 finished with value: 0.3670456054654515 and parameters: {'model_name': 'SimpleImputer', 'strategy': 'most_frequent'}. Best is trial 1 with value: 0.3295559011403175.
[I 2023-12-26 13:25:31,363] Trial 84 finished with value: 0.3670456054654515 and parameters: {'model_name': 'SimpleImputer', 'strategy': 'most_frequent'}. Best is trial 1 with value: 0.3295559011403175.
[I 2023-12-26 13:25:31,692] Trial 117 finished with value: 0.3295559011403175 and parameters: {'model_name': 'SimpleImputer', 'strategy': 'mean'}. Best is trial 1 with value: 0.3295559011403175.
[I 2023-12-26 13:25:31,930] Trial 87 finished with value: 0.3670456054654515 and parameters: {'model_name': 'SimpleImputer', 'strategy': 'most_frequent'}. Best is trial 1 with value: 0.3295559011403175.
[I 2023-12-26 13:25:32,119] Trial 118 finished with value: 0.3295559011403175 and parameters: {'model_name': 'SimpleImputer', 'strategy': 'mean'}. Best is trial 1 with value: 0.3295559011403175.
[I 2023-12-26 13:25:32,496] Trial 120 finished with value: 0.3295559011403175 and parameters: {'model_name': 'SimpleImputer', 'strategy': 'mean'}. Best is trial 1 with value: 0.3295559011403175.
[I 2023-12-26 13:25:32,759] Trial 115 finished with value: 0.3295559011403175 and parameters: {'model_name': 'SimpleImputer', 'strategy': 'mean'}. Best is trial 1 with value: 0.3295559011403175.
[I 2023-12-26 13:25:33,090] Trial 119 finished with value: 0.3295559011403175 and parameters: {'model_name': 'SimpleImputer', 'strategy': 'mean'}. Best is trial 1 with value: 0.3295559011403175.
[I 2023-12-26 13:25:33,492] Trial 116 finished with value: 0.3295559011403175 and parameters: {'model_name': 'SimpleImputer', 'strategy': 'mean'}. Best is trial 1 with value: 0.3295559011403175.
[I 2023-12-26 13:25:33,990] Trial 121 finished with value: 0.3295559011403175 and parameters: {'model_name': 'SimpleImputer', 'strategy': 'mean'}. Best is trial 1 with value: 0.3295559011403175.
[I 2023-12-26 13:25:34,390] Trial 81 finished with value: 0.3670456054654515 and parameters: {'model_name': 'SimpleImputer', 'strategy': 'most_frequent'}. Best is trial 1 with value: 0.3295559011403175.
[I 2023-12-26 13:25:34,817] Trial 93 finished with value: 0.3670456054654515 and parameters: {'model_name': 'SimpleImputer', 'strategy': 'most_frequent'}. Best is trial 1 with value: 0.3295559011403175.
[I 2023-12-26 13:25:35,054] Trial 92 finished with value: 0.3670456054654515 and parameters: {'model_name': 'SimpleImputer', 'strategy': 'most_frequent'}. Best is trial 1 with value: 0.3295559011403175.
[I 2023-12-26 13:25:35,234] Trial 123 finished with value: 0.3295559011403175 and parameters: {'model_name': 'SimpleImputer', 'strategy': 'mean'}. Best is trial 1 with value: 0.3295559011403175.
[I 2023-12-26 13:25:35,445] Trial 122 finished with value: 0.3295559011403175 and parameters: {'model_name': 'SimpleImputer', 'strategy': 'mean'}. Best is trial 1 with value: 0.3295559011403175.
[I 2023-12-26 13:25:35,715] Trial 128 finished with value: 0.3295559011403175 and parameters: {'model_name': 'SimpleImputer', 'strategy': 'mean'}. Best is trial 1 with value: 0.3295559011403175.
[I 2023-12-26 13:25:35,899] Trial 125 finished with value: 0.3295559011403175 and parameters: {'model_name': 'SimpleImputer', 'strategy': 'mean'}. Best is trial 1 with value: 0.3295559011403175.
[I 2023-12-26 13:25:36,057] Trial 126 finished with value: 0.3295559011403175 and parameters: {'model_name': 'SimpleImputer', 'strategy': 'mean'}. Best is trial 1 with value: 0.3295559011403175.
[I 2023-12-26 13:25:36,319] Trial 132 finished with value: 0.3295559011403175 and parameters: {'model_name': 'SimpleImputer', 'strategy': 'mean'}. Best is trial 1 with value: 0.3295559011403175.
[I 2023-12-26 13:25:36,677] Trial 130 finished with value: 0.3295559011403175 and parameters: {'model_name': 'SimpleImputer', 'strategy': 'mean'}. Best is trial 1 with value: 0.3295559011403175.
[I 2023-12-26 13:25:36,972] Trial 124 finished with value: 0.3295559011403175 and parameters: {'model_name': 'SimpleImputer', 'strategy': 'mean'}. Best is trial 1 with value: 0.3295559011403175.
[I 2023-12-26 13:25:37,249] Trial 82 finished with value: 0.3670456054654515 and parameters: {'model_name': 'SimpleImputer', 'strategy': 'most_frequent'}. Best is trial 1 with value: 0.3295559011403175.
[I 2023-12-26 13:25:37,493] Trial 134 finished with value: 0.3295559011403175 and parameters: {'model_name': 'SimpleImputer', 'strategy': 'mean'}. Best is trial 1 with value: 0.3295559011403175.
[I 2023-12-26 13:25:37,827] Trial 91 finished with value: 0.3670456054654515 and parameters: {'model_name': 'SimpleImputer', 'strategy': 'most_frequent'}. Best is trial 1 with value: 0.3295559011403175.
[I 2023-12-26 13:25:38,079] Trial 129 finished with value: 0.3295559011403175 and parameters: {'model_name': 'SimpleImputer', 'strategy': 'mean'}. Best is trial 1 with value: 0.3295559011403175.
[I 2023-12-26 13:25:38,340] Trial 127 finished with value: 0.3295559011403175 and parameters: {'model_name': 'SimpleImputer', 'strategy': 'mean'}. Best is trial 1 with value: 0.3295559011403175.
[I 2023-12-26 13:25:38,620] Trial 133 finished with value: 0.3295559011403175 and parameters: {'model_name': 'SimpleImputer', 'strategy': 'mean'}. Best is trial 1 with value: 0.3295559011403175.
[I 2023-12-26 13:25:38,904] Trial 131 finished with value: 0.3295559011403175 and parameters: {'model_name': 'SimpleImputer', 'strategy': 'mean'}. Best is trial 1 with value: 0.3295559011403175.
[I 2023-12-26 13:25:39,166] Trial 139 finished with value: 0.3295559011403175 and parameters: {'model_name': 'SimpleImputer', 'strategy': 'mean'}. Best is trial 1 with value: 0.3295559011403175.
[I 2023-12-26 13:25:39,424] Trial 97 finished with value: 0.3670456054654515 and parameters: {'model_name': 'SimpleImputer', 'strategy': 'most_frequent'}. Best is trial 1 with value: 0.3295559011403175.
[I 2023-12-26 13:25:39,681] Trial 138 finished with value: 0.3295559011403175 and parameters: {'model_name': 'SimpleImputer', 'strategy': 'mean'}. Best is trial 1 with value: 0.3295559011403175.
[I 2023-12-26 13:25:40,009] Trial 88 finished with value: 0.3670456054654515 and parameters: {'model_name': 'SimpleImputer', 'strategy': 'most_frequent'}. Best is trial 1 with value: 0.3295559011403175.
[I 2023-12-26 13:25:40,330] Trial 135 finished with value: 0.3295559011403175 and parameters: {'model_name': 'SimpleImputer', 'strategy': 'mean'}. Best is trial 1 with value: 0.3295559011403175.
[I 2023-12-26 13:25:40,580] Trial 136 finished with value: 0.3295559011403175 and parameters: {'model_name': 'SimpleImputer', 'strategy': 'mean'}. Best is trial 1 with value: 0.3295559011403175.
[I 2023-12-26 13:25:40,950] Trial 95 finished with value: 0.3670456054654515 and parameters: {'model_name': 'SimpleImputer', 'strategy': 'most_frequent'}. Best is trial 1 with value: 0.3295559011403175.
[I 2023-12-26 13:25:41,203] Trial 137 finished with value: 0.3295559011403175 and parameters: {'model_name': 'SimpleImputer', 'strategy': 'mean'}. Best is trial 1 with value: 0.3295559011403175.
[I 2023-12-26 13:25:41,542] Trial 141 finished with value: 0.3295559011403175 and parameters: {'model_name': 'SimpleImputer', 'strategy': 'mean'}. Best is trial 1 with value: 0.3295559011403175.
[I 2023-12-26 13:25:41,723] Trial 140 finished with value: 0.3295559011403175 and parameters: {'model_name': 'SimpleImputer', 'strategy': 'mean'}. Best is trial 1 with value: 0.3295559011403175.
[I 2023-12-26 13:25:42,294] Trial 142 finished with value: 0.3295559011403175 and parameters: {'model_name': 'SimpleImputer', 'strategy': 'mean'}. Best is trial 1 with value: 0.3295559011403175.
[I 2023-12-26 13:25:42,673] Trial 143 finished with value: 0.3295559011403175 and parameters: {'model_name': 'SimpleImputer', 'strategy': 'mean'}. Best is trial 1 with value: 0.3295559011403175.
[I 2023-12-26 13:25:42,892] Trial 96 finished with value: 0.3670456054654515 and parameters: {'model_name': 'SimpleImputer', 'strategy': 'most_frequent'}. Best is trial 1 with value: 0.3295559011403175.
[I 2023-12-26 13:25:43,077] Trial 146 finished with value: 0.3295559011403175 and parameters: {'model_name': 'SimpleImputer', 'strategy': 'mean'}. Best is trial 1 with value: 0.3295559011403175.
[I 2023-12-26 13:25:43,366] Trial 145 finished with value: 0.3295559011403175 and parameters: {'model_name': 'SimpleImputer', 'strategy': 'mean'}. Best is trial 1 with value: 0.3295559011403175.
[I 2023-12-26 13:25:44,333] Trial 149 finished with value: 0.3295559011403175 and parameters: {'model_name': 'SimpleImputer', 'strategy': 'mean'}. Best is trial 1 with value: 0.3295559011403175.
[I 2023-12-26 13:25:44,630] Trial 154 finished with value: 0.3295559011403175 and parameters: {'model_name': 'SimpleImputer', 'strategy': 'mean'}. Best is trial 1 with value: 0.3295559011403175.
[I 2023-12-26 13:25:44,840] Trial 147 finished with value: 0.3295559011403175 and parameters: {'model_name': 'SimpleImputer', 'strategy': 'mean'}. Best is trial 1 with value: 0.3295559011403175.
[I 2023-12-26 13:25:45,033] Trial 150 finished with value: 0.3295559011403175 and parameters: {'model_name': 'SimpleImputer', 'strategy': 'mean'}. Best is trial 1 with value: 0.3295559011403175.
[I 2023-12-26 13:25:45,243] Trial 153 finished with value: 0.3295559011403175 and parameters: {'model_name': 'SimpleImputer', 'strategy': 'mean'}. Best is trial 1 with value: 0.3295559011403175.
[I 2023-12-26 13:25:45,523] Trial 151 finished with value: 0.3295559011403175 and parameters: {'model_name': 'SimpleImputer', 'strategy': 'mean'}. Best is trial 1 with value: 0.3295559011403175.
[I 2023-12-26 13:25:45,802] Trial 144 finished with value: 0.3295559011403175 and parameters: {'model_name': 'SimpleImputer', 'strategy': 'mean'}. Best is trial 1 with value: 0.3295559011403175.
[I 2023-12-26 13:25:46,021] Trial 152 finished with value: 0.3295559011403175 and parameters: {'model_name': 'SimpleImputer', 'strategy': 'mean'}. Best is trial 1 with value: 0.3295559011403175.
[I 2023-12-26 13:25:46,265] Trial 156 finished with value: 0.3295559011403175 and parameters: {'model_name': 'SimpleImputer', 'strategy': 'mean'}. Best is trial 1 with value: 0.3295559011403175.
[I 2023-12-26 13:25:46,658] Trial 148 finished with value: 0.3295559011403175 and parameters: {'model_name': 'SimpleImputer', 'strategy': 'mean'}. Best is trial 1 with value: 0.3295559011403175.
[I 2023-12-26 13:25:46,928] Trial 155 finished with value: 0.3295559011403175 and parameters: {'model_name': 'SimpleImputer', 'strategy': 'mean'}. Best is trial 1 with value: 0.3295559011403175.
[I 2023-12-26 13:25:47,370] Trial 159 finished with value: 0.3295559011403175 and parameters: {'model_name': 'SimpleImputer', 'strategy': 'mean'}. Best is trial 1 with value: 0.3295559011403175.
[I 2023-12-26 13:25:47,865] Trial 98 finished with value: 0.3670456054654515 and parameters: {'model_name': 'SimpleImputer', 'strategy': 'most_frequent'}. Best is trial 1 with value: 0.3295559011403175.
[I 2023-12-26 13:25:48,165] Trial 160 finished with value: 0.3295559011403175 and parameters: {'model_name': 'SimpleImputer', 'strategy': 'mean'}. Best is trial 1 with value: 0.3295559011403175.
[I 2023-12-26 13:25:48,355] Trial 165 finished with value: 0.3295559011403175 and parameters: {'model_name': 'SimpleImputer', 'strategy': 'mean'}. Best is trial 1 with value: 0.3295559011403175.
[I 2023-12-26 13:25:48,597] Trial 157 finished with value: 0.3295559011403175 and parameters: {'model_name': 'SimpleImputer', 'strategy': 'mean'}. Best is trial 1 with value: 0.3295559011403175.
[I 2023-12-26 13:25:48,901] Trial 163 finished with value: 0.3295559011403175 and parameters: {'model_name': 'SimpleImputer', 'strategy': 'mean'}. Best is trial 1 with value: 0.3295559011403175.
[I 2023-12-26 13:25:49,129] Trial 161 finished with value: 0.3295559011403175 and parameters: {'model_name': 'SimpleImputer', 'strategy': 'mean'}. Best is trial 1 with value: 0.3295559011403175.
[I 2023-12-26 13:25:49,554] Trial 168 finished with value: 0.3295559011403175 and parameters: {'model_name': 'SimpleImputer', 'strategy': 'mean'}. Best is trial 1 with value: 0.3295559011403175.
[I 2023-12-26 13:25:49,824] Trial 162 finished with value: 0.3295559011403175 and parameters: {'model_name': 'SimpleImputer', 'strategy': 'mean'}. Best is trial 1 with value: 0.3295559011403175.
[I 2023-12-26 13:25:50,017] Trial 169 finished with value: 0.3295559011403175 and parameters: {'model_name': 'SimpleImputer', 'strategy': 'mean'}. Best is trial 1 with value: 0.3295559011403175.
[I 2023-12-26 13:25:50,284] Trial 166 finished with value: 0.3295559011403175 and parameters: {'model_name': 'SimpleImputer', 'strategy': 'mean'}. Best is trial 1 with value: 0.3295559011403175.
[I 2023-12-26 13:25:50,539] Trial 177 finished with value: 0.3295559011403175 and parameters: {'model_name': 'SimpleImputer', 'strategy': 'mean'}. Best is trial 1 with value: 0.3295559011403175.
[I 2023-12-26 13:25:50,782] Trial 171 finished with value: 0.3295559011403175 and parameters: {'model_name': 'SimpleImputer', 'strategy': 'mean'}. Best is trial 1 with value: 0.3295559011403175.
[I 2023-12-26 13:25:51,037] Trial 167 finished with value: 0.3295559011403175 and parameters: {'model_name': 'SimpleImputer', 'strategy': 'mean'}. Best is trial 1 with value: 0.3295559011403175.
[I 2023-12-26 13:25:51,268] Trial 164 finished with value: 0.3295559011403175 and parameters: {'model_name': 'SimpleImputer', 'strategy': 'mean'}. Best is trial 1 with value: 0.3295559011403175.
[I 2023-12-26 13:25:51,539] Trial 172 finished with value: 0.3295559011403175 and parameters: {'model_name': 'SimpleImputer', 'strategy': 'mean'}. Best is trial 1 with value: 0.3295559011403175.
[I 2023-12-26 13:25:51,736] Trial 174 finished with value: 0.3295559011403175 and parameters: {'model_name': 'SimpleImputer', 'strategy': 'mean'}. Best is trial 1 with value: 0.3295559011403175.
[I 2023-12-26 13:25:51,984] Trial 173 finished with value: 0.3295559011403175 and parameters: {'model_name': 'SimpleImputer', 'strategy': 'mean'}. Best is trial 1 with value: 0.3295559011403175.
[I 2023-12-26 13:25:52,371] Trial 158 finished with value: 0.3295559011403175 and parameters: {'model_name': 'SimpleImputer', 'strategy': 'mean'}. Best is trial 1 with value: 0.3295559011403175.
[I 2023-12-26 13:25:52,660] Trial 178 finished with value: 0.3295559011403175 and parameters: {'model_name': 'SimpleImputer', 'strategy': 'mean'}. Best is trial 1 with value: 0.3295559011403175.
[I 2023-12-26 13:25:52,901] Trial 170 finished with value: 0.3295559011403175 and parameters: {'model_name': 'SimpleImputer', 'strategy': 'mean'}. Best is trial 1 with value: 0.3295559011403175.
[I 2023-12-26 13:25:53,136] Trial 179 finished with value: 0.3295559011403175 and parameters: {'model_name': 'SimpleImputer', 'strategy': 'mean'}. Best is trial 1 with value: 0.3295559011403175.
[I 2023-12-26 13:25:53,318] Trial 176 finished with value: 0.3295559011403175 and parameters: {'model_name': 'SimpleImputer', 'strategy': 'mean'}. Best is trial 1 with value: 0.3295559011403175.
[I 2023-12-26 13:25:53,597] Trial 185 finished with value: 0.3670456054654515 and parameters: {'model_name': 'SimpleImputer', 'strategy': 'constant'}. Best is trial 1 with value: 0.3295559011403175.
[I 2023-12-26 13:25:53,943] Trial 181 finished with value: 0.3295559011403175 and parameters: {'model_name': 'SimpleImputer', 'strategy': 'mean'}. Best is trial 1 with value: 0.3295559011403175.
[I 2023-12-26 13:25:54,163] Trial 175 finished with value: 0.3295559011403175 and parameters: {'model_name': 'SimpleImputer', 'strategy': 'mean'}. Best is trial 1 with value: 0.3295559011403175.
[I 2023-12-26 13:25:54,436] Trial 182 finished with value: 0.3295559011403175 and parameters: {'model_name': 'SimpleImputer', 'strategy': 'mean'}. Best is trial 1 with value: 0.3295559011403175.
[I 2023-12-26 13:25:54,799] Trial 187 finished with value: 0.3670456054654515 and parameters: {'model_name': 'SimpleImputer', 'strategy': 'constant'}. Best is trial 1 with value: 0.3295559011403175.
[I 2023-12-26 13:25:55,013] Trial 180 finished with value: 0.3295559011403175 and parameters: {'model_name': 'SimpleImputer', 'strategy': 'mean'}. Best is trial 1 with value: 0.3295559011403175.
[I 2023-12-26 13:25:55,278] Trial 199 finished with value: 0.3670456054654515 and parameters: {'model_name': 'SimpleImputer', 'strategy': 'constant'}. Best is trial 1 with value: 0.3295559011403175.
[I 2023-12-26 13:25:55,527] Trial 198 finished with value: 0.3670456054654515 and parameters: {'model_name': 'SimpleImputer', 'strategy': 'constant'}. Best is trial 1 with value: 0.3295559011403175.
[I 2023-12-26 13:25:55,779] Trial 194 finished with value: 0.3670456054654515 and parameters: {'model_name': 'SimpleImputer', 'strategy': 'constant'}. Best is trial 1 with value: 0.3295559011403175.
[I 2023-12-26 13:25:55,995] Trial 184 finished with value: 0.3295559011403175 and parameters: {'model_name': 'SimpleImputer', 'strategy': 'mean'}. Best is trial 1 with value: 0.3295559011403175.
[I 2023-12-26 13:25:56,184] Trial 195 finished with value: 0.3670456054654515 and parameters: {'model_name': 'SimpleImputer', 'strategy': 'constant'}. Best is trial 1 with value: 0.3295559011403175.
[I 2023-12-26 13:25:56,453] Trial 183 finished with value: 0.3295559011403175 and parameters: {'model_name': 'SimpleImputer', 'strategy': 'mean'}. Best is trial 1 with value: 0.3295559011403175.
[I 2023-12-26 13:25:56,646] Trial 193 finished with value: 0.3670456054654515 and parameters: {'model_name': 'SimpleImputer', 'strategy': 'constant'}. Best is trial 1 with value: 0.3295559011403175.
[I 2023-12-26 13:25:56,904] Trial 191 finished with value: 0.3670456054654515 and parameters: {'model_name': 'SimpleImputer', 'strategy': 'constant'}. Best is trial 1 with value: 0.3295559011403175.
[I 2023-12-26 13:25:57,131] Trial 188 finished with value: 0.3295559011403175 and parameters: {'model_name': 'SimpleImputer', 'strategy': 'mean'}. Best is trial 1 with value: 0.3295559011403175.
[I 2023-12-26 13:25:57,347] Trial 192 finished with value: 0.3670456054654515 and parameters: {'model_name': 'SimpleImputer', 'strategy': 'constant'}. Best is trial 1 with value: 0.3295559011403175.
[I 2023-12-26 13:25:57,561] Trial 190 finished with value: 0.3670456054654515 and parameters: {'model_name': 'SimpleImputer', 'strategy': 'constant'}. Best is trial 1 with value: 0.3295559011403175.
[I 2023-12-26 13:25:57,785] Trial 186 finished with value: 0.3295559011403175 and parameters: {'model_name': 'SimpleImputer', 'strategy': 'mean'}. Best is trial 1 with value: 0.3295559011403175.
[I 2023-12-26 13:25:57,985] Trial 189 finished with value: 0.3295559011403175 and parameters: {'model_name': 'SimpleImputer', 'strategy': 'mean'}. Best is trial 1 with value: 0.3295559011403175.
[I 2023-12-26 13:25:58,218] Trial 197 finished with value: 0.3670456054654515 and parameters: {'model_name': 'SimpleImputer', 'strategy': 'constant'}. Best is trial 1 with value: 0.3295559011403175.
[I 2023-12-26 13:25:58,417] Trial 196 finished with value: 0.3295559011403175 and parameters: {'model_name': 'SimpleImputer', 'strategy': 'mean'}. Best is trial 1 with value: 0.3295559011403175.
[I 2023-12-26 13:25:58,699] Trial 99 finished with value: 0.3670456054654515 and parameters: {'model_name': 'SimpleImputer', 'strategy': 'most_frequent'}. Best is trial 1 with value: 0.3295559011403175.
[I 2023-12-26 13:25:58,941] Trial 101 finished with value: 0.3670456054654515 and parameters: {'model_name': 'SimpleImputer', 'strategy': 'most_frequent'}. Best is trial 1 with value: 0.3295559011403175.
