[I 2024-04-01 21:15:41,030] Trial 176 finished with value: 79.0525998800226 and parameters: {'model_name': 'RandomForestImputer', 'max_iter': 76, 'decreasing': False, 'min_samples_split': 0.5, 'min_samples_leaf': 0.5, 'max_features': 0.1, 'warm_start': False}. Best is trial 112 with value: 31.799285554427126.
[I 2024-04-01 21:16:17,928] Trial 173 finished with value: 79.05375654675495 and parameters: {'model_name': 'RandomForestImputer', 'max_iter': 79, 'decreasing': False, 'min_samples_split': 0.5, 'min_samples_leaf': 0.5, 'max_features': 0.1, 'warm_start': False}. Best is trial 112 with value: 31.799285554427126.
[I 2024-04-01 21:16:21,274] Trial 158 finished with value: 79.03323954915872 and parameters: {'model_name': 'RandomForestImputer', 'max_iter': 83, 'decreasing': False, 'min_samples_split': 0.6000000000000001, 'min_samples_leaf': 0.5, 'max_features': 0.1, 'warm_start': False}. Best is trial 112 with value: 31.799285554427126.
[I 2024-04-01 21:16:36,590] Trial 154 finished with value: 79.06059590431612 and parameters: {'model_name': 'RandomForestImputer', 'max_iter': 98, 'decreasing': True, 'min_samples_split': 0.6000000000000001, 'min_samples_leaf': 0.5, 'max_features': 0.1, 'warm_start': False}. Best is trial 112 with value: 31.799285554427126.
[I 2024-04-01 21:17:13,126] Trial 148 finished with value: 79.0288084773957 and parameters: {'model_name': 'RandomForestImputer', 'max_iter': 90, 'decreasing': True, 'min_samples_split': 0.6000000000000001, 'min_samples_leaf': 0.5, 'max_features': 0.1, 'warm_start': False}. Best is trial 112 with value: 31.799285554427126.
[I 2024-04-01 21:18:31,925] Trial 153 finished with value: 79.06504967752488 and parameters: {'model_name': 'RandomForestImputer', 'max_iter': 91, 'decreasing': False, 'min_samples_split': 0.6000000000000001, 'min_samples_leaf': 0.5, 'max_features': 0.1, 'warm_start': False}. Best is trial 112 with value: 31.799285554427126.
[I 2024-04-01 21:19:06,310] Trial 169 finished with value: 79.04518016088313 and parameters: {'model_name': 'RandomForestImputer', 'max_iter': 94, 'decreasing': False, 'min_samples_split': 0.5, 'min_samples_leaf': 0.5, 'max_features': 0.1, 'warm_start': False}. Best is trial 112 with value: 31.799285554427126.
[I 2024-04-01 21:19:32,166] Trial 178 finished with value: 79.08432298626255 and parameters: {'model_name': 'RandomForestImputer', 'max_iter': 64, 'decreasing': True, 'min_samples_split': 0.5, 'min_samples_leaf': 0.5, 'max_features': 0.7000000000000001, 'warm_start': False}. Best is trial 112 with value: 31.799285554427126.
[I 2024-04-01 21:19:51,211] Trial 172 finished with value: 79.04349573269636 and parameters: {'model_name': 'RandomForestImputer', 'max_iter': 82, 'decreasing': False, 'min_samples_split': 0.5, 'min_samples_leaf': 0.5, 'max_features': 0.1, 'warm_start': False}. Best is trial 112 with value: 31.799285554427126.
[I 2024-04-01 21:19:53,194] Trial 156 finished with value: 79.10029722257164 and parameters: {'model_name': 'RandomForestImputer', 'max_iter': 72, 'decreasing': False, 'min_samples_split': 0.6000000000000001, 'min_samples_leaf': 0.5, 'max_features': 0.1, 'warm_start': False}. Best is trial 112 with value: 31.799285554427126.
[I 2024-04-01 21:20:00,627] Trial 157 finished with value: 79.06196366953523 and parameters: {'model_name': 'RandomForestImputer', 'max_iter': 93, 'decreasing': False, 'min_samples_split': 0.6000000000000001, 'min_samples_leaf': 0.5, 'max_features': 0.1, 'warm_start': False}. Best is trial 112 with value: 31.799285554427126.
[I 2024-04-01 21:21:17,166] Trial 191 finished with value: 79.0470653697815 and parameters: {'model_name': 'RandomForestImputer', 'max_iter': 61, 'decreasing': True, 'min_samples_split': 0.5, 'min_samples_leaf': 0.5, 'max_features': 0.7000000000000001, 'warm_start': False}. Best is trial 112 with value: 31.799285554427126.
[I 2024-04-01 21:21:22,114] Trial 166 finished with value: 79.0339392270759 and parameters: {'model_name': 'RandomForestImputer', 'max_iter': 91, 'decreasing': False, 'min_samples_split': 0.5, 'min_samples_leaf': 0.5, 'max_features': 0.1, 'warm_start': False}. Best is trial 112 with value: 31.799285554427126.
[I 2024-04-01 21:21:54,687] Trial 177 finished with value: 79.06727120020471 and parameters: {'model_name': 'RandomForestImputer', 'max_iter': 93, 'decreasing': False, 'min_samples_split': 0.5, 'min_samples_leaf': 0.5, 'max_features': 0.7000000000000001, 'warm_start': False}. Best is trial 112 with value: 31.799285554427126.
[I 2024-04-01 21:22:03,816] Trial 190 finished with value: 79.07722732195433 and parameters: {'model_name': 'RandomForestImputer', 'max_iter': 82, 'decreasing': False, 'min_samples_split': 0.5, 'min_samples_leaf': 0.5, 'max_features': 0.7000000000000001, 'warm_start': False}. Best is trial 112 with value: 31.799285554427126.
[I 2024-04-01 21:22:06,700] Trial 175 finished with value: 79.0492347339161 and parameters: {'model_name': 'RandomForestImputer', 'max_iter': 98, 'decreasing': False, 'min_samples_split': 0.5, 'min_samples_leaf': 0.5, 'max_features': 0.1, 'warm_start': False}. Best is trial 112 with value: 31.799285554427126.
[I 2024-04-01 21:22:50,326] Trial 8 finished with value: 84.68739659284354 and parameters: {'model_name': 'GAIN', 'batch_size': 39, 'hint_rate': 0.92, 'alpha': 47, 'iterations': 3039}. Best is trial 112 with value: 31.799285554427126.
[I 2024-04-01 21:23:03,679] Trial 159 finished with value: 79.05460755717355 and parameters: {'model_name': 'RandomForestImputer', 'max_iter': 94, 'decreasing': False, 'min_samples_split': 0.6000000000000001, 'min_samples_leaf': 0.5, 'max_features': 0.1, 'warm_start': False}. Best is trial 112 with value: 31.799285554427126.
[I 2024-04-01 21:23:17,565] Trial 179 finished with value: 79.04398859341433 and parameters: {'model_name': 'RandomForestImputer', 'max_iter': 100, 'decreasing': True, 'min_samples_split': 0.5, 'min_samples_leaf': 0.5, 'max_features': 0.7000000000000001, 'warm_start': False}. Best is trial 112 with value: 31.799285554427126.
[I 2024-04-01 21:23:21,349] Trial 183 finished with value: 79.040364810378 and parameters: {'model_name': 'RandomForestImputer', 'max_iter': 86, 'decreasing': False, 'min_samples_split': 0.5, 'min_samples_leaf': 0.5, 'max_features': 0.7000000000000001, 'warm_start': False}. Best is trial 112 with value: 31.799285554427126.
[I 2024-04-01 21:23:35,121] Trial 186 finished with value: 79.06668149000706 and parameters: {'model_name': 'RandomForestImputer', 'max_iter': 87, 'decreasing': True, 'min_samples_split': 0.5, 'min_samples_leaf': 0.5, 'max_features': 0.7000000000000001, 'warm_start': False}. Best is trial 112 with value: 31.799285554427126.
[I 2024-04-01 21:24:23,479] Trial 164 finished with value: 79.0666560805707 and parameters: {'model_name': 'RandomForestImputer', 'max_iter': 93, 'decreasing': False, 'min_samples_split': 0.5, 'min_samples_leaf': 0.5, 'max_features': 0.1, 'warm_start': False}. Best is trial 112 with value: 31.799285554427126.
[I 2024-04-01 21:24:28,542] Trial 185 finished with value: 79.0693918759307 and parameters: {'model_name': 'RandomForestImputer', 'max_iter': 91, 'decreasing': True, 'min_samples_split': 0.5, 'min_samples_leaf': 0.5, 'max_features': 0.7000000000000001, 'warm_start': False}. Best is trial 112 with value: 31.799285554427126.
[I 2024-04-01 21:24:39,632] Trial 180 finished with value: 79.06502325817719 and parameters: {'model_name': 'RandomForestImputer', 'max_iter': 94, 'decreasing': False, 'min_samples_split': 0.5, 'min_samples_leaf': 0.5, 'max_features': 0.7000000000000001, 'warm_start': False}. Best is trial 112 with value: 31.799285554427126.
[I 2024-04-01 21:24:47,166] Trial 5 finished with value: 85.02530094125437 and parameters: {'model_name': 'GAIN', 'batch_size': 106, 'hint_rate': 0.17, 'alpha': 83, 'iterations': 3614}. Best is trial 112 with value: 31.799285554427126.
[I 2024-04-01 21:25:22,274] Trial 26 finished with value: inf and parameters: {'model_name': 'GAIN', 'batch_size': 3, 'hint_rate': 0.91, 'alpha': 86, 'iterations': 57926}. Best is trial 112 with value: 31.799285554427126.
