[I 2024-01-05 00:27:34,163] Trial 9 finished with value: inf and parameters: {'model_name': 'GAIN', 'batch_size': 93, 'hint_rate': 0.21000000000000002, 'alpha': 22, 'iterations': 20442}. Best is trial 157 with value: 3007.837814071319.
[I 2024-01-05 00:27:39,188] Trial 40 finished with value: 3335.1032207913786 and parameters: {'model_name': 'GAIN', 'batch_size': 2, 'hint_rate': 0.31, 'alpha': 34, 'iterations': 2413}. Best is trial 157 with value: 3007.837814071319.
[I 2024-01-05 00:31:39,317] Trial 22 finished with value: inf and parameters: {'model_name': 'GAIN', 'batch_size': 43, 'hint_rate': 0.31, 'alpha': 13, 'iterations': 33835}. Best is trial 157 with value: 3007.837814071319.
[I 2024-01-05 00:33:36,987] Trial 182 finished with value: inf and parameters: {'model_name': 'GAIN', 'batch_size': 3, 'hint_rate': 0.43, 'alpha': 43, 'iterations': 42937}. Best is trial 157 with value: 3007.837814071319.
[I 2024-01-05 00:34:37,554] Trial 192 finished with value: inf and parameters: {'model_name': 'GAIN', 'batch_size': 4, 'hint_rate': 0.01, 'alpha': 36, 'iterations': 46335}. Best is trial 157 with value: 3007.837814071319.
[I 2024-01-05 00:34:41,743] Trial 154 finished with value: inf and parameters: {'model_name': 'GAIN', 'batch_size': 7, 'hint_rate': 0.01, 'alpha': 39, 'iterations': 47446}. Best is trial 157 with value: 3007.837814071319.
[I 2024-01-05 00:35:42,832] Trial 185 finished with value: inf and parameters: {'model_name': 'GAIN', 'batch_size': 5, 'hint_rate': 0.01, 'alpha': 40, 'iterations': 51450}. Best is trial 157 with value: 3007.837814071319.
[I 2024-01-05 00:36:22,691] Trial 175 finished with value: inf and parameters: {'model_name': 'GAIN', 'batch_size': 6, 'hint_rate': 0.01, 'alpha': 42, 'iterations': 55582}. Best is trial 157 with value: 3007.837814071319.
[I 2024-01-05 00:37:42,523] Trial 173 finished with value: inf and parameters: {'model_name': 'GAIN', 'batch_size': 6, 'hint_rate': 0.37, 'alpha': 44, 'iterations': 64338}. Best is trial 157 with value: 3007.837814071319.
[I 2024-01-05 00:39:22,152] Trial 181 finished with value: inf and parameters: {'model_name': 'GAIN', 'batch_size': 6, 'hint_rate': 0.34, 'alpha': 42, 'iterations': 78257}. Best is trial 157 with value: 3007.837814071319.
[I 2024-01-05 00:39:48,669] Trial 174 finished with value: inf and parameters: {'model_name': 'GAIN', 'batch_size': 5, 'hint_rate': 0.02, 'alpha': 41, 'iterations': 84856}. Best is trial 157 with value: 3007.837814071319.
[I 2024-01-05 00:39:51,005] Trial 177 finished with value: inf and parameters: {'model_name': 'GAIN', 'batch_size': 4, 'hint_rate': 0.01, 'alpha': 43, 'iterations': 85476}. Best is trial 157 with value: 3007.837814071319.
[I 2024-01-05 00:39:59,520] Trial 180 finished with value: inf and parameters: {'model_name': 'GAIN', 'batch_size': 5, 'hint_rate': 0.01, 'alpha': 44, 'iterations': 88543}. Best is trial 157 with value: 3007.837814071319.
