Run: 10
/cm/local/apps/slurm/var/spool/job565663/slurm_script: line 23: /common/ketrong/minconda3/etc/profile.d/conda.sh: No such file or directory
/cm/local/apps/slurm/var/spool/job565663/slurm_script: line 26: $'\nconda create --name tpot2devenv -c conda-forge python=3.10\n': command not found
/cm/local/apps/slurm/var/spool/job565663/slurm_script: line 31: $'\npip install -r requirements.txt\n': command not found
RunStart
2023-12-19 14:16:27.520935: I tensorflow/core/util/port.cc:113] oneDNN custom operations are on. You may see slightly different numerical results due to floating-point round-off errors from different computation orders. To turn them off, set the environment variable `TF_ENABLE_ONEDNN_OPTS=0`.
2023-12-19 14:16:27.557677: E external/local_xla/xla/stream_executor/cuda/cuda_dnn.cc:9261] Unable to register cuDNN factory: Attempting to register factory for plugin cuDNN when one has already been registered
2023-12-19 14:16:27.557703: E external/local_xla/xla/stream_executor/cuda/cuda_fft.cc:607] Unable to register cuFFT factory: Attempting to register factory for plugin cuFFT when one has already been registered
2023-12-19 14:16:27.559074: E external/local_xla/xla/stream_executor/cuda/cuda_blas.cc:1515] Unable to register cuBLAS factory: Attempting to register factory for plugin cuBLAS when one has already been registered
2023-12-19 14:16:27.565135: I tensorflow/core/platform/cpu_feature_guard.cc:182] This TensorFlow binary is optimized to use available CPU instructions in performance-critical operations.
To enable the following instructions: AVX2 AVX512F AVX512_VNNI FMA, in other operations, rebuild TensorFlow with the appropriate compiler flags.
2023-12-19 14:16:30.246226: W tensorflow/compiler/tf2tensorrt/utils/py_utils.cc:38] TF-TRT Warning: Could not find TensorRT
WARNING:tensorflow:From /home/ketrong/miniconda3/envs/tpot2devenv/lib/python3.10/site-packages/tensorflow/python/compat/v2_compat.py:108: disable_resource_variables (from tensorflow.python.ops.variable_scope) is deprecated and will be removed in a future version.
Instructions for updating:
non-resource variables are not supported in the long term
starting loops
working on 
logs/26/tpot2_base_normal_MAR_0.9
1.1307401657104492
loading data
logs/26/tpot2_base_normal_MAR_0.9/data/26_True.pkl
running experiment 1/3 - Does large hyperparameter space improve reconstruction accuracy over simple
[I 2023-12-19 14:16:49,212] A new study created in memory with name: no-name-0d7ee319-9483-4350-8db9-053c2e7a67f0
[I 2023-12-19 14:16:50,718] Trial 5 finished with value: 0.3007224316517857 and parameters: {'model_name': 'SimpleImputer', 'strategy': 'constant'}. Best is trial 5 with value: 0.3007224316517857.
[I 2023-12-19 14:16:51,143] Trial 2 finished with value: 0.3007224316517857 and parameters: {'model_name': 'SimpleImputer', 'strategy': 'constant'}. Best is trial 5 with value: 0.3007224316517857.
[I 2023-12-19 14:16:51,365] Trial 9 finished with value: 0.3007224316517857 and parameters: {'model_name': 'SimpleImputer', 'strategy': 'constant'}. Best is trial 5 with value: 0.3007224316517857.
[I 2023-12-19 14:16:51,573] Trial 11 finished with value: 0.3007224316517857 and parameters: {'model_name': 'SimpleImputer', 'strategy': 'constant'}. Best is trial 5 with value: 0.3007224316517857.
[I 2023-12-19 14:16:51,934] Trial 13 finished with value: 0.3007224316517857 and parameters: {'model_name': 'SimpleImputer', 'strategy': 'constant'}. Best is trial 5 with value: 0.3007224316517857.
[I 2023-12-19 14:16:52,310] Trial 20 finished with value: 0.3007224316517857 and parameters: {'model_name': 'SimpleImputer', 'strategy': 'constant'}. Best is trial 5 with value: 0.3007224316517857.
[I 2023-12-19 14:16:52,723] Trial 12 finished with value: 0.2790821731842267 and parameters: {'model_name': 'SimpleImputer', 'strategy': 'mean'}. Best is trial 12 with value: 0.2790821731842267.
[I 2023-12-19 14:16:53,040] Trial 3 finished with value: 0.2790821731842267 and parameters: {'model_name': 'SimpleImputer', 'strategy': 'mean'}. Best is trial 12 with value: 0.2790821731842267.
[I 2023-12-19 14:16:53,251] Trial 10 finished with value: 0.2790821731842267 and parameters: {'model_name': 'SimpleImputer', 'strategy': 'mean'}. Best is trial 12 with value: 0.2790821731842267.
[I 2023-12-19 14:16:53,452] Trial 16 finished with value: 0.3007224316517857 and parameters: {'model_name': 'SimpleImputer', 'strategy': 'constant'}. Best is trial 12 with value: 0.2790821731842267.
[I 2023-12-19 14:16:53,898] Trial 14 finished with value: 0.2790821731842267 and parameters: {'model_name': 'SimpleImputer', 'strategy': 'mean'}. Best is trial 12 with value: 0.2790821731842267.
[I 2023-12-19 14:16:54,091] Trial 28 finished with value: 0.3007224316517857 and parameters: {'model_name': 'SimpleImputer', 'strategy': 'constant'}. Best is trial 12 with value: 0.2790821731842267.
[I 2023-12-19 14:16:54,538] Trial 21 finished with value: 0.2790821731842267 and parameters: {'model_name': 'SimpleImputer', 'strategy': 'mean'}. Best is trial 12 with value: 0.2790821731842267.
[I 2023-12-19 14:16:54,833] Trial 44 finished with value: 0.3007224316517857 and parameters: {'model_name': 'SimpleImputer', 'strategy': 'constant'}. Best is trial 12 with value: 0.2790821731842267.
[I 2023-12-19 14:16:55,114] Trial 19 finished with value: 0.2790821731842267 and parameters: {'model_name': 'SimpleImputer', 'strategy': 'mean'}. Best is trial 12 with value: 0.2790821731842267.
[I 2023-12-19 14:16:55,349] Trial 43 finished with value: 0.3007224316517857 and parameters: {'model_name': 'SimpleImputer', 'strategy': 'constant'}. Best is trial 12 with value: 0.2790821731842267.
[I 2023-12-19 14:16:55,546] Trial 38 finished with value: 0.3007224316517857 and parameters: {'model_name': 'SimpleImputer', 'strategy': 'constant'}. Best is trial 12 with value: 0.2790821731842267.
[I 2023-12-19 14:16:55,818] Trial 22 finished with value: 0.2790821731842267 and parameters: {'model_name': 'SimpleImputer', 'strategy': 'mean'}. Best is trial 12 with value: 0.2790821731842267.
[I 2023-12-19 14:16:56,163] Trial 4 finished with value: 0.3469649433415743 and parameters: {'model_name': 'SimpleImputer', 'strategy': 'median'}. Best is trial 12 with value: 0.2790821731842267.
[I 2023-12-19 14:16:56,590] Trial 46 finished with value: 0.3007224316517857 and parameters: {'model_name': 'SimpleImputer', 'strategy': 'constant'}. Best is trial 12 with value: 0.2790821731842267.
[I 2023-12-19 14:16:56,994] Trial 40 finished with value: 0.2790821731842267 and parameters: {'model_name': 'SimpleImputer', 'strategy': 'mean'}. Best is trial 12 with value: 0.2790821731842267.
[I 2023-12-19 14:16:57,320] Trial 1 finished with value: 0.3469649433415743 and parameters: {'model_name': 'SimpleImputer', 'strategy': 'median'}. Best is trial 12 with value: 0.2790821731842267.
[I 2023-12-19 14:16:57,559] Trial 30 finished with value: 0.2790821731842267 and parameters: {'model_name': 'SimpleImputer', 'strategy': 'mean'}. Best is trial 12 with value: 0.2790821731842267.
[I 2023-12-19 14:16:57,836] Trial 42 finished with value: 0.2790821731842267 and parameters: {'model_name': 'SimpleImputer', 'strategy': 'mean'}. Best is trial 12 with value: 0.2790821731842267.
[I 2023-12-19 14:16:58,037] Trial 23 finished with value: 0.3469649433415743 and parameters: {'model_name': 'SimpleImputer', 'strategy': 'median'}. Best is trial 12 with value: 0.2790821731842267.
[I 2023-12-19 14:16:58,337] Trial 47 finished with value: 0.2790821731842267 and parameters: {'model_name': 'SimpleImputer', 'strategy': 'mean'}. Best is trial 12 with value: 0.2790821731842267.
[I 2023-12-19 14:16:58,567] Trial 24 finished with value: 0.3469649433415743 and parameters: {'model_name': 'SimpleImputer', 'strategy': 'median'}. Best is trial 12 with value: 0.2790821731842267.
[I 2023-12-19 14:16:58,832] Trial 17 finished with value: 0.3469649433415743 and parameters: {'model_name': 'SimpleImputer', 'strategy': 'median'}. Best is trial 12 with value: 0.2790821731842267.
[I 2023-12-19 14:16:59,074] Trial 49 finished with value: 0.3007224316517857 and parameters: {'model_name': 'SimpleImputer', 'strategy': 'constant'}. Best is trial 12 with value: 0.2790821731842267.
[I 2023-12-19 14:16:59,294] Trial 27 finished with value: 0.3469649433415743 and parameters: {'model_name': 'SimpleImputer', 'strategy': 'median'}. Best is trial 12 with value: 0.2790821731842267.
[I 2023-12-19 14:16:59,539] Trial 52 finished with value: 0.3007224316517857 and parameters: {'model_name': 'SimpleImputer', 'strategy': 'constant'}. Best is trial 12 with value: 0.2790821731842267.
[I 2023-12-19 14:16:59,944] Trial 26 finished with value: 0.3469649433415743 and parameters: {'model_name': 'SimpleImputer', 'strategy': 'median'}. Best is trial 12 with value: 0.2790821731842267.
[I 2023-12-19 14:17:00,197] Trial 8 finished with value: 0.3469649433415743 and parameters: {'model_name': 'SimpleImputer', 'strategy': 'median'}. Best is trial 12 with value: 0.2790821731842267.
[I 2023-12-19 14:17:00,444] Trial 50 finished with value: 0.2790821731842267 and parameters: {'model_name': 'SimpleImputer', 'strategy': 'mean'}. Best is trial 12 with value: 0.2790821731842267.
[I 2023-12-19 14:17:00,646] Trial 35 finished with value: 0.3469649433415743 and parameters: {'model_name': 'SimpleImputer', 'strategy': 'median'}. Best is trial 12 with value: 0.2790821731842267.
[I 2023-12-19 14:17:00,875] Trial 18 finished with value: 0.3469649433415743 and parameters: {'model_name': 'SimpleImputer', 'strategy': 'median'}. Best is trial 12 with value: 0.2790821731842267.
[I 2023-12-19 14:17:01,409] Trial 34 finished with value: 0.3469649433415743 and parameters: {'model_name': 'SimpleImputer', 'strategy': 'median'}. Best is trial 12 with value: 0.2790821731842267.
[I 2023-12-19 14:17:01,837] Trial 39 finished with value: 0.3469649433415743 and parameters: {'model_name': 'SimpleImputer', 'strategy': 'median'}. Best is trial 12 with value: 0.2790821731842267.
[I 2023-12-19 14:17:02,162] Trial 45 finished with value: 0.3469649433415743 and parameters: {'model_name': 'SimpleImputer', 'strategy': 'median'}. Best is trial 12 with value: 0.2790821731842267.
[I 2023-12-19 14:17:02,693] Trial 53 finished with value: 0.2790821731842267 and parameters: {'model_name': 'SimpleImputer', 'strategy': 'mean'}. Best is trial 12 with value: 0.2790821731842267.
[I 2023-12-19 14:17:02,938] Trial 36 finished with value: 0.3469649433415743 and parameters: {'model_name': 'SimpleImputer', 'strategy': 'median'}. Best is trial 12 with value: 0.2790821731842267.
[I 2023-12-19 14:17:03,218] Trial 51 finished with value: 0.3469649433415743 and parameters: {'model_name': 'SimpleImputer', 'strategy': 'median'}. Best is trial 12 with value: 0.2790821731842267.
[I 2023-12-19 14:17:03,798] Trial 48 finished with value: 0.3469649433415743 and parameters: {'model_name': 'SimpleImputer', 'strategy': 'median'}. Best is trial 12 with value: 0.2790821731842267.
[I 2023-12-19 14:17:04,671] Trial 56 finished with value: 0.3469649433415743 and parameters: {'model_name': 'SimpleImputer', 'strategy': 'median'}. Best is trial 12 with value: 0.2790821731842267.
[I 2023-12-19 14:17:05,566] Trial 60 finished with value: 0.3469649433415743 and parameters: {'model_name': 'SimpleImputer', 'strategy': 'median'}. Best is trial 12 with value: 0.2790821731842267.
[I 2023-12-19 14:17:05,929] Trial 61 finished with value: 0.3469649433415743 and parameters: {'model_name': 'SimpleImputer', 'strategy': 'median'}. Best is trial 12 with value: 0.2790821731842267.
[I 2023-12-19 14:17:06,482] Trial 63 finished with value: 0.3469649433415743 and parameters: {'model_name': 'SimpleImputer', 'strategy': 'median'}. Best is trial 12 with value: 0.2790821731842267.
[I 2023-12-19 14:17:07,572] Trial 88 finished with value: 0.2790821731842267 and parameters: {'model_name': 'SimpleImputer', 'strategy': 'mean'}. Best is trial 12 with value: 0.2790821731842267.
[I 2023-12-19 14:17:10,142] Trial 6 finished with value: 0.3469649433415743 and parameters: {'model_name': 'SimpleImputer', 'strategy': 'most_frequent'}. Best is trial 12 with value: 0.2790821731842267.
[I 2023-12-19 14:17:11,343] Trial 0 finished with value: 0.3469649433415743 and parameters: {'model_name': 'SimpleImputer', 'strategy': 'most_frequent'}. Best is trial 12 with value: 0.2790821731842267.
[I 2023-12-19 14:17:12,718] Trial 15 finished with value: 0.3469649433415743 and parameters: {'model_name': 'SimpleImputer', 'strategy': 'most_frequent'}. Best is trial 12 with value: 0.2790821731842267.
[I 2023-12-19 14:17:13,218] Trial 33 finished with value: 0.3469649433415743 and parameters: {'model_name': 'SimpleImputer', 'strategy': 'most_frequent'}. Best is trial 12 with value: 0.2790821731842267.
[I 2023-12-19 14:17:13,880] Trial 37 finished with value: 0.3469649433415743 and parameters: {'model_name': 'SimpleImputer', 'strategy': 'most_frequent'}. Best is trial 12 with value: 0.2790821731842267.
[I 2023-12-19 14:17:14,265] Trial 7 finished with value: 0.3469649433415743 and parameters: {'model_name': 'SimpleImputer', 'strategy': 'most_frequent'}. Best is trial 12 with value: 0.2790821731842267.
[I 2023-12-19 14:17:14,570] Trial 25 finished with value: 0.3469649433415743 and parameters: {'model_name': 'SimpleImputer', 'strategy': 'most_frequent'}. Best is trial 12 with value: 0.2790821731842267.
[I 2023-12-19 14:17:15,497] Trial 29 finished with value: 0.3469649433415743 and parameters: {'model_name': 'SimpleImputer', 'strategy': 'most_frequent'}. Best is trial 12 with value: 0.2790821731842267.
[I 2023-12-19 14:17:15,775] Trial 32 finished with value: 0.3469649433415743 and parameters: {'model_name': 'SimpleImputer', 'strategy': 'most_frequent'}. Best is trial 12 with value: 0.2790821731842267.
[I 2023-12-19 14:17:16,056] Trial 41 finished with value: 0.3469649433415743 and parameters: {'model_name': 'SimpleImputer', 'strategy': 'most_frequent'}. Best is trial 12 with value: 0.2790821731842267.
[I 2023-12-19 14:17:16,308] Trial 31 finished with value: 0.3469649433415743 and parameters: {'model_name': 'SimpleImputer', 'strategy': 'most_frequent'}. Best is trial 12 with value: 0.2790821731842267.
[I 2023-12-19 14:17:17,141] Trial 82 finished with value: 0.3469649433415743 and parameters: {'model_name': 'SimpleImputer', 'strategy': 'most_frequent'}. Best is trial 12 with value: 0.2790821731842267.
[I 2023-12-19 14:17:17,431] Trial 57 finished with value: 0.3469649433415743 and parameters: {'model_name': 'SimpleImputer', 'strategy': 'most_frequent'}. Best is trial 12 with value: 0.2790821731842267.
[I 2023-12-19 14:17:17,775] Trial 59 finished with value: 0.3469649433415743 and parameters: {'model_name': 'SimpleImputer', 'strategy': 'most_frequent'}. Best is trial 12 with value: 0.2790821731842267.
[I 2023-12-19 14:17:18,192] Trial 58 finished with value: 0.3469649433415743 and parameters: {'model_name': 'SimpleImputer', 'strategy': 'most_frequent'}. Best is trial 12 with value: 0.2790821731842267.
[I 2023-12-19 14:17:18,545] Trial 65 finished with value: 0.3469649433415743 and parameters: {'model_name': 'SimpleImputer', 'strategy': 'most_frequent'}. Best is trial 12 with value: 0.2790821731842267.
[I 2023-12-19 14:17:18,742] Trial 98 finished with value: 0.2790821731842267 and parameters: {'model_name': 'SimpleImputer', 'strategy': 'mean'}. Best is trial 12 with value: 0.2790821731842267.
[I 2023-12-19 14:17:19,019] Trial 64 finished with value: 0.3469649433415743 and parameters: {'model_name': 'SimpleImputer', 'strategy': 'most_frequent'}. Best is trial 12 with value: 0.2790821731842267.
[I 2023-12-19 14:17:19,375] Trial 66 finished with value: 0.3469649433415743 and parameters: {'model_name': 'SimpleImputer', 'strategy': 'most_frequent'}. Best is trial 12 with value: 0.2790821731842267.
[I 2023-12-19 14:17:19,599] Trial 71 finished with value: 0.3469649433415743 and parameters: {'model_name': 'SimpleImputer', 'strategy': 'most_frequent'}. Best is trial 12 with value: 0.2790821731842267.
[I 2023-12-19 14:17:19,813] Trial 79 finished with value: 0.3469649433415743 and parameters: {'model_name': 'SimpleImputer', 'strategy': 'most_frequent'}. Best is trial 12 with value: 0.2790821731842267.
[I 2023-12-19 14:17:20,134] Trial 55 finished with value: 0.3469649433415743 and parameters: {'model_name': 'SimpleImputer', 'strategy': 'most_frequent'}. Best is trial 12 with value: 0.2790821731842267.
[I 2023-12-19 14:17:20,529] Trial 99 finished with value: 0.2790821731842267 and parameters: {'model_name': 'SimpleImputer', 'strategy': 'mean'}. Best is trial 12 with value: 0.2790821731842267.
[I 2023-12-19 14:17:20,894] Trial 80 finished with value: 0.3469649433415743 and parameters: {'model_name': 'SimpleImputer', 'strategy': 'most_frequent'}. Best is trial 12 with value: 0.2790821731842267.
[I 2023-12-19 14:17:21,073] Trial 70 finished with value: 0.3469649433415743 and parameters: {'model_name': 'SimpleImputer', 'strategy': 'most_frequent'}. Best is trial 12 with value: 0.2790821731842267.
[I 2023-12-19 14:17:21,431] Trial 54 finished with value: 0.3469649433415743 and parameters: {'model_name': 'SimpleImputer', 'strategy': 'most_frequent'}. Best is trial 12 with value: 0.2790821731842267.
[I 2023-12-19 14:17:21,671] Trial 100 finished with value: 0.2790821731842267 and parameters: {'model_name': 'SimpleImputer', 'strategy': 'mean'}. Best is trial 12 with value: 0.2790821731842267.
[I 2023-12-19 14:17:21,904] Trial 102 finished with value: 0.2790821731842267 and parameters: {'model_name': 'SimpleImputer', 'strategy': 'mean'}. Best is trial 12 with value: 0.2790821731842267.
[I 2023-12-19 14:17:22,228] Trial 68 finished with value: 0.3469649433415743 and parameters: {'model_name': 'SimpleImputer', 'strategy': 'most_frequent'}. Best is trial 12 with value: 0.2790821731842267.
[I 2023-12-19 14:17:22,401] Trial 101 finished with value: 0.2790821731842267 and parameters: {'model_name': 'SimpleImputer', 'strategy': 'mean'}. Best is trial 12 with value: 0.2790821731842267.
[I 2023-12-19 14:17:22,614] Trial 74 finished with value: 0.3469649433415743 and parameters: {'model_name': 'SimpleImputer', 'strategy': 'most_frequent'}. Best is trial 12 with value: 0.2790821731842267.
[I 2023-12-19 14:17:22,856] Trial 77 finished with value: 0.3469649433415743 and parameters: {'model_name': 'SimpleImputer', 'strategy': 'most_frequent'}. Best is trial 12 with value: 0.2790821731842267.
[I 2023-12-19 14:17:23,132] Trial 67 finished with value: 0.3469649433415743 and parameters: {'model_name': 'SimpleImputer', 'strategy': 'most_frequent'}. Best is trial 12 with value: 0.2790821731842267.
[I 2023-12-19 14:17:23,406] Trial 84 finished with value: 0.3469649433415743 and parameters: {'model_name': 'SimpleImputer', 'strategy': 'most_frequent'}. Best is trial 12 with value: 0.2790821731842267.
[I 2023-12-19 14:17:23,733] Trial 69 finished with value: 0.3469649433415743 and parameters: {'model_name': 'SimpleImputer', 'strategy': 'most_frequent'}. Best is trial 12 with value: 0.2790821731842267.
[I 2023-12-19 14:17:23,956] Trial 76 finished with value: 0.3469649433415743 and parameters: {'model_name': 'SimpleImputer', 'strategy': 'most_frequent'}. Best is trial 12 with value: 0.2790821731842267.
[I 2023-12-19 14:17:24,353] Trial 85 finished with value: 0.3469649433415743 and parameters: {'model_name': 'SimpleImputer', 'strategy': 'most_frequent'}. Best is trial 12 with value: 0.2790821731842267.
[I 2023-12-19 14:17:24,539] Trial 89 finished with value: 0.3469649433415743 and parameters: {'model_name': 'SimpleImputer', 'strategy': 'most_frequent'}. Best is trial 12 with value: 0.2790821731842267.
[I 2023-12-19 14:17:24,863] Trial 86 finished with value: 0.3469649433415743 and parameters: {'model_name': 'SimpleImputer', 'strategy': 'most_frequent'}. Best is trial 12 with value: 0.2790821731842267.
[I 2023-12-19 14:17:25,123] Trial 106 finished with value: 0.2790821731842267 and parameters: {'model_name': 'SimpleImputer', 'strategy': 'mean'}. Best is trial 12 with value: 0.2790821731842267.
[I 2023-12-19 14:17:25,355] Trial 103 finished with value: 0.2790821731842267 and parameters: {'model_name': 'SimpleImputer', 'strategy': 'mean'}. Best is trial 12 with value: 0.2790821731842267.
[I 2023-12-19 14:17:25,595] Trial 104 finished with value: 0.2790821731842267 and parameters: {'model_name': 'SimpleImputer', 'strategy': 'mean'}. Best is trial 12 with value: 0.2790821731842267.
[I 2023-12-19 14:17:25,800] Trial 75 finished with value: 0.3469649433415743 and parameters: {'model_name': 'SimpleImputer', 'strategy': 'most_frequent'}. Best is trial 12 with value: 0.2790821731842267.
[I 2023-12-19 14:17:26,060] Trial 83 finished with value: 0.3469649433415743 and parameters: {'model_name': 'SimpleImputer', 'strategy': 'most_frequent'}. Best is trial 12 with value: 0.2790821731842267.
[I 2023-12-19 14:17:26,296] Trial 81 finished with value: 0.3469649433415743 and parameters: {'model_name': 'SimpleImputer', 'strategy': 'most_frequent'}. Best is trial 12 with value: 0.2790821731842267.
[I 2023-12-19 14:17:26,611] Trial 107 finished with value: 0.2790821731842267 and parameters: {'model_name': 'SimpleImputer', 'strategy': 'mean'}. Best is trial 12 with value: 0.2790821731842267.
[I 2023-12-19 14:17:26,848] Trial 62 finished with value: 0.3469649433415743 and parameters: {'model_name': 'SimpleImputer', 'strategy': 'most_frequent'}. Best is trial 12 with value: 0.2790821731842267.
[I 2023-12-19 14:17:27,276] Trial 105 finished with value: 0.2790821731842267 and parameters: {'model_name': 'SimpleImputer', 'strategy': 'mean'}. Best is trial 12 with value: 0.2790821731842267.
[I 2023-12-19 14:17:27,739] Trial 108 finished with value: 0.2790821731842267 and parameters: {'model_name': 'SimpleImputer', 'strategy': 'mean'}. Best is trial 12 with value: 0.2790821731842267.
