[I 2023-12-27 13:00:03,282] Trial 110 finished with value: 0.7781151119789689 and parameters: {'model_name': 'SimpleImputer', 'strategy': 'constant'}. Best is trial 9 with value: 0.7781151119789689.
[I 2023-12-27 13:00:03,300] Trial 75 finished with value: 0.8898970093218349 and parameters: {'model_name': 'SimpleImputer', 'strategy': 'most_frequent'}. Best is trial 9 with value: 0.7781151119789689.
[I 2023-12-27 13:00:03,307] Trial 76 finished with value: 0.8898970093218349 and parameters: {'model_name': 'SimpleImputer', 'strategy': 'most_frequent'}. Best is trial 9 with value: 0.7781151119789689.
[I 2023-12-27 13:00:04,675] Trial 62 finished with value: 0.8898970093218349 and parameters: {'model_name': 'SimpleImputer', 'strategy': 'most_frequent'}. Best is trial 9 with value: 0.7781151119789689.
[I 2023-12-27 13:00:04,873] Trial 83 finished with value: 0.8898970093218349 and parameters: {'model_name': 'SimpleImputer', 'strategy': 'most_frequent'}. Best is trial 9 with value: 0.7781151119789689.
[I 2023-12-27 13:00:05,075] Trial 80 finished with value: 0.8898970093218349 and parameters: {'model_name': 'SimpleImputer', 'strategy': 'most_frequent'}. Best is trial 9 with value: 0.7781151119789689.
[I 2023-12-27 13:00:05,258] Trial 71 finished with value: 0.8898970093218349 and parameters: {'model_name': 'SimpleImputer', 'strategy': 'most_frequent'}. Best is trial 9 with value: 0.7781151119789689.
[I 2023-12-27 13:00:05,455] Trial 121 finished with value: 0.7781151119789689 and parameters: {'model_name': 'SimpleImputer', 'strategy': 'constant'}. Best is trial 9 with value: 0.7781151119789689.
[I 2023-12-27 13:00:05,646] Trial 122 finished with value: 0.7781151119789689 and parameters: {'model_name': 'SimpleImputer', 'strategy': 'constant'}. Best is trial 9 with value: 0.7781151119789689.
[I 2023-12-27 13:00:05,842] Trial 82 finished with value: 0.8898970093218349 and parameters: {'model_name': 'SimpleImputer', 'strategy': 'most_frequent'}. Best is trial 9 with value: 0.7781151119789689.
[I 2023-12-27 13:00:06,077] Trial 118 finished with value: 0.7781151119789689 and parameters: {'model_name': 'SimpleImputer', 'strategy': 'constant'}. Best is trial 9 with value: 0.7781151119789689.
[I 2023-12-27 13:00:06,324] Trial 119 finished with value: 0.7781151119789689 and parameters: {'model_name': 'SimpleImputer', 'strategy': 'constant'}. Best is trial 9 with value: 0.7781151119789689.
[I 2023-12-27 13:00:06,509] Trial 85 finished with value: 0.8898970093218349 and parameters: {'model_name': 'SimpleImputer', 'strategy': 'most_frequent'}. Best is trial 9 with value: 0.7781151119789689.
[I 2023-12-27 13:00:06,691] Trial 123 finished with value: 0.7781151119789689 and parameters: {'model_name': 'SimpleImputer', 'strategy': 'constant'}. Best is trial 9 with value: 0.7781151119789689.
[I 2023-12-27 13:00:06,862] Trial 78 finished with value: 0.8898970093218349 and parameters: {'model_name': 'SimpleImputer', 'strategy': 'most_frequent'}. Best is trial 9 with value: 0.7781151119789689.
[I 2023-12-27 13:00:07,138] Trial 108 finished with value: 0.7781151119789689 and parameters: {'model_name': 'SimpleImputer', 'strategy': 'constant'}. Best is trial 9 with value: 0.7781151119789689.
[I 2023-12-27 13:00:07,362] Trial 64 finished with value: 0.8898970093218349 and parameters: {'model_name': 'SimpleImputer', 'strategy': 'most_frequent'}. Best is trial 9 with value: 0.7781151119789689.
[I 2023-12-27 13:00:07,564] Trial 77 finished with value: 0.8898970093218349 and parameters: {'model_name': 'SimpleImputer', 'strategy': 'most_frequent'}. Best is trial 9 with value: 0.7781151119789689.
[I 2023-12-27 13:00:07,815] Trial 79 finished with value: 0.8898970093218349 and parameters: {'model_name': 'SimpleImputer', 'strategy': 'most_frequent'}. Best is trial 9 with value: 0.7781151119789689.
[I 2023-12-27 13:00:08,050] Trial 124 finished with value: 0.7781151119789689 and parameters: {'model_name': 'SimpleImputer', 'strategy': 'constant'}. Best is trial 9 with value: 0.7781151119789689.
[I 2023-12-27 13:00:08,294] Trial 81 finished with value: 0.8898970093218349 and parameters: {'model_name': 'SimpleImputer', 'strategy': 'most_frequent'}. Best is trial 9 with value: 0.7781151119789689.
[I 2023-12-27 13:00:08,537] Trial 72 finished with value: 0.8898970093218349 and parameters: {'model_name': 'SimpleImputer', 'strategy': 'most_frequent'}. Best is trial 9 with value: 0.7781151119789689.
[I 2023-12-27 13:00:08,768] Trial 68 finished with value: 0.8898970093218349 and parameters: {'model_name': 'SimpleImputer', 'strategy': 'most_frequent'}. Best is trial 9 with value: 0.7781151119789689.
[I 2023-12-27 13:00:08,985] Trial 115 finished with value: 0.7781151119789689 and parameters: {'model_name': 'SimpleImputer', 'strategy': 'constant'}. Best is trial 9 with value: 0.7781151119789689.
[I 2023-12-27 13:00:09,207] Trial 130 finished with value: 0.7781151119789689 and parameters: {'model_name': 'SimpleImputer', 'strategy': 'constant'}. Best is trial 9 with value: 0.7781151119789689.
[I 2023-12-27 13:00:09,463] Trial 127 finished with value: 0.7781151119789689 and parameters: {'model_name': 'SimpleImputer', 'strategy': 'constant'}. Best is trial 9 with value: 0.7781151119789689.
[I 2023-12-27 13:00:09,733] Trial 137 finished with value: 0.7781151119789689 and parameters: {'model_name': 'SimpleImputer', 'strategy': 'constant'}. Best is trial 9 with value: 0.7781151119789689.
[I 2023-12-27 13:00:09,935] Trial 133 finished with value: 0.7781151119789689 and parameters: {'model_name': 'SimpleImputer', 'strategy': 'constant'}. Best is trial 9 with value: 0.7781151119789689.
[I 2023-12-27 13:00:10,149] Trial 86 finished with value: 0.8898970093218349 and parameters: {'model_name': 'SimpleImputer', 'strategy': 'most_frequent'}. Best is trial 9 with value: 0.7781151119789689.
[I 2023-12-27 13:00:10,370] Trial 73 finished with value: 0.8898970093218349 and parameters: {'model_name': 'SimpleImputer', 'strategy': 'most_frequent'}. Best is trial 9 with value: 0.7781151119789689.
[I 2023-12-27 13:00:10,609] Trial 125 finished with value: 0.7781151119789689 and parameters: {'model_name': 'SimpleImputer', 'strategy': 'constant'}. Best is trial 9 with value: 0.7781151119789689.
[I 2023-12-27 13:00:10,939] Trial 126 finished with value: 0.7781151119789689 and parameters: {'model_name': 'SimpleImputer', 'strategy': 'constant'}. Best is trial 9 with value: 0.7781151119789689.
[I 2023-12-27 13:00:11,122] Trial 129 finished with value: 0.7781151119789689 and parameters: {'model_name': 'SimpleImputer', 'strategy': 'constant'}. Best is trial 9 with value: 0.7781151119789689.
[I 2023-12-27 13:00:11,399] Trial 84 finished with value: 0.8898970093218349 and parameters: {'model_name': 'SimpleImputer', 'strategy': 'most_frequent'}. Best is trial 9 with value: 0.7781151119789689.
[I 2023-12-27 13:00:11,629] Trial 128 finished with value: 0.7781151119789689 and parameters: {'model_name': 'SimpleImputer', 'strategy': 'constant'}. Best is trial 9 with value: 0.7781151119789689.
[I 2023-12-27 13:00:11,859] Trial 136 finished with value: 0.7781151119789689 and parameters: {'model_name': 'SimpleImputer', 'strategy': 'constant'}. Best is trial 9 with value: 0.7781151119789689.
[I 2023-12-27 13:00:12,089] Trial 138 finished with value: 0.7781151119789689 and parameters: {'model_name': 'SimpleImputer', 'strategy': 'constant'}. Best is trial 9 with value: 0.7781151119789689.
[I 2023-12-27 13:00:12,340] Trial 132 finished with value: 0.7781151119789689 and parameters: {'model_name': 'SimpleImputer', 'strategy': 'constant'}. Best is trial 9 with value: 0.7781151119789689.
[I 2023-12-27 13:00:12,637] Trial 134 finished with value: 0.7781151119789689 and parameters: {'model_name': 'SimpleImputer', 'strategy': 'constant'}. Best is trial 9 with value: 0.7781151119789689.
[I 2023-12-27 13:00:12,932] Trial 131 finished with value: 0.7781151119789689 and parameters: {'model_name': 'SimpleImputer', 'strategy': 'constant'}. Best is trial 9 with value: 0.7781151119789689.
[I 2023-12-27 13:00:13,192] Trial 135 finished with value: 0.7781151119789689 and parameters: {'model_name': 'SimpleImputer', 'strategy': 'constant'}. Best is trial 9 with value: 0.7781151119789689.
[I 2023-12-27 13:00:13,451] Trial 142 finished with value: 0.7781151119789689 and parameters: {'model_name': 'SimpleImputer', 'strategy': 'constant'}. Best is trial 9 with value: 0.7781151119789689.
[I 2023-12-27 13:00:13,873] Trial 145 finished with value: 0.7781151119789689 and parameters: {'model_name': 'SimpleImputer', 'strategy': 'constant'}. Best is trial 9 with value: 0.7781151119789689.
[I 2023-12-27 13:00:14,054] Trial 148 finished with value: 0.7781151119789689 and parameters: {'model_name': 'SimpleImputer', 'strategy': 'constant'}. Best is trial 9 with value: 0.7781151119789689.
[I 2023-12-27 13:00:14,393] Trial 151 finished with value: 0.7781151119789689 and parameters: {'model_name': 'SimpleImputer', 'strategy': 'constant'}. Best is trial 9 with value: 0.7781151119789689.
[I 2023-12-27 13:00:14,563] Trial 152 finished with value: 0.7781151119789689 and parameters: {'model_name': 'SimpleImputer', 'strategy': 'constant'}. Best is trial 9 with value: 0.7781151119789689.
[I 2023-12-27 13:00:14,817] Trial 139 finished with value: 0.7781151119789689 and parameters: {'model_name': 'SimpleImputer', 'strategy': 'constant'}. Best is trial 9 with value: 0.7781151119789689.
[I 2023-12-27 13:00:15,055] Trial 141 finished with value: 0.7781151119789689 and parameters: {'model_name': 'SimpleImputer', 'strategy': 'constant'}. Best is trial 9 with value: 0.7781151119789689.
[I 2023-12-27 13:00:15,242] Trial 155 finished with value: 0.7781151119789689 and parameters: {'model_name': 'SimpleImputer', 'strategy': 'constant'}. Best is trial 9 with value: 0.7781151119789689.
[I 2023-12-27 13:00:15,490] Trial 144 finished with value: 0.7781151119789689 and parameters: {'model_name': 'SimpleImputer', 'strategy': 'constant'}. Best is trial 9 with value: 0.7781151119789689.
[I 2023-12-27 13:00:15,821] Trial 162 finished with value: 0.7781151119789689 and parameters: {'model_name': 'SimpleImputer', 'strategy': 'constant'}. Best is trial 9 with value: 0.7781151119789689.
[I 2023-12-27 13:00:16,108] Trial 156 finished with value: 0.7781151119789689 and parameters: {'model_name': 'SimpleImputer', 'strategy': 'constant'}. Best is trial 9 with value: 0.7781151119789689.
[I 2023-12-27 13:00:16,285] Trial 147 finished with value: 0.7781151119789689 and parameters: {'model_name': 'SimpleImputer', 'strategy': 'constant'}. Best is trial 9 with value: 0.7781151119789689.
[I 2023-12-27 13:00:16,477] Trial 158 finished with value: 0.7781151119789689 and parameters: {'model_name': 'SimpleImputer', 'strategy': 'constant'}. Best is trial 9 with value: 0.7781151119789689.
[I 2023-12-27 13:00:16,970] Trial 140 finished with value: 0.7781151119789689 and parameters: {'model_name': 'SimpleImputer', 'strategy': 'constant'}. Best is trial 9 with value: 0.7781151119789689.
[I 2023-12-27 13:00:17,254] Trial 161 finished with value: 0.7781151119789689 and parameters: {'model_name': 'SimpleImputer', 'strategy': 'constant'}. Best is trial 9 with value: 0.7781151119789689.
[I 2023-12-27 13:00:17,653] Trial 149 finished with value: 0.7781151119789689 and parameters: {'model_name': 'SimpleImputer', 'strategy': 'constant'}. Best is trial 9 with value: 0.7781151119789689.
[I 2023-12-27 13:00:17,829] Trial 163 finished with value: 0.7781151119789689 and parameters: {'model_name': 'SimpleImputer', 'strategy': 'constant'}. Best is trial 9 with value: 0.7781151119789689.
[I 2023-12-27 13:00:18,108] Trial 160 finished with value: 0.7781151119789689 and parameters: {'model_name': 'SimpleImputer', 'strategy': 'constant'}. Best is trial 9 with value: 0.7781151119789689.
[I 2023-12-27 13:00:18,357] Trial 153 finished with value: 0.7781151119789689 and parameters: {'model_name': 'SimpleImputer', 'strategy': 'constant'}. Best is trial 9 with value: 0.7781151119789689.
[I 2023-12-27 13:00:18,619] Trial 146 finished with value: 0.7781151119789689 and parameters: {'model_name': 'SimpleImputer', 'strategy': 'constant'}. Best is trial 9 with value: 0.7781151119789689.
[I 2023-12-27 13:00:18,896] Trial 157 finished with value: 0.7781151119789689 and parameters: {'model_name': 'SimpleImputer', 'strategy': 'constant'}. Best is trial 9 with value: 0.7781151119789689.
[I 2023-12-27 13:00:19,252] Trial 169 finished with value: 0.7781151119789689 and parameters: {'model_name': 'SimpleImputer', 'strategy': 'constant'}. Best is trial 9 with value: 0.7781151119789689.
[I 2023-12-27 13:00:19,542] Trial 171 finished with value: 0.7781151119789689 and parameters: {'model_name': 'SimpleImputer', 'strategy': 'constant'}. Best is trial 9 with value: 0.7781151119789689.
[I 2023-12-27 13:00:19,818] Trial 165 finished with value: 0.7781151119789689 and parameters: {'model_name': 'SimpleImputer', 'strategy': 'constant'}. Best is trial 9 with value: 0.7781151119789689.
[I 2023-12-27 13:00:20,098] Trial 159 finished with value: 0.7781151119789689 and parameters: {'model_name': 'SimpleImputer', 'strategy': 'constant'}. Best is trial 9 with value: 0.7781151119789689.
[I 2023-12-27 13:00:20,285] Trial 166 finished with value: 0.7781151119789689 and parameters: {'model_name': 'SimpleImputer', 'strategy': 'constant'}. Best is trial 9 with value: 0.7781151119789689.
[I 2023-12-27 13:00:20,588] Trial 168 finished with value: 0.7781151119789689 and parameters: {'model_name': 'SimpleImputer', 'strategy': 'constant'}. Best is trial 9 with value: 0.7781151119789689.
[I 2023-12-27 13:00:20,822] Trial 176 finished with value: 0.7781151119789689 and parameters: {'model_name': 'SimpleImputer', 'strategy': 'constant'}. Best is trial 9 with value: 0.7781151119789689.
[I 2023-12-27 13:00:21,060] Trial 179 finished with value: 0.7781151119789689 and parameters: {'model_name': 'SimpleImputer', 'strategy': 'constant'}. Best is trial 9 with value: 0.7781151119789689.
[I 2023-12-27 13:00:21,258] Trial 173 finished with value: 0.7781151119789689 and parameters: {'model_name': 'SimpleImputer', 'strategy': 'constant'}. Best is trial 9 with value: 0.7781151119789689.
[I 2023-12-27 13:00:21,439] Trial 143 finished with value: 0.7781151119789689 and parameters: {'model_name': 'SimpleImputer', 'strategy': 'constant'}. Best is trial 9 with value: 0.7781151119789689.
[I 2023-12-27 13:00:21,684] Trial 177 finished with value: 0.7781151119789689 and parameters: {'model_name': 'SimpleImputer', 'strategy': 'constant'}. Best is trial 9 with value: 0.7781151119789689.
[I 2023-12-27 13:00:21,911] Trial 182 finished with value: 0.7781151119789689 and parameters: {'model_name': 'SimpleImputer', 'strategy': 'constant'}. Best is trial 9 with value: 0.7781151119789689.
[I 2023-12-27 13:00:22,232] Trial 154 finished with value: 0.7781151119789689 and parameters: {'model_name': 'SimpleImputer', 'strategy': 'constant'}. Best is trial 9 with value: 0.7781151119789689.
[I 2023-12-27 13:00:22,445] Trial 170 finished with value: 0.7781151119789689 and parameters: {'model_name': 'SimpleImputer', 'strategy': 'constant'}. Best is trial 9 with value: 0.7781151119789689.
[I 2023-12-27 13:00:22,756] Trial 164 finished with value: 0.7781151119789689 and parameters: {'model_name': 'SimpleImputer', 'strategy': 'constant'}. Best is trial 9 with value: 0.7781151119789689.
[I 2023-12-27 13:00:22,970] Trial 188 finished with value: 0.7781151119789689 and parameters: {'model_name': 'SimpleImputer', 'strategy': 'constant'}. Best is trial 9 with value: 0.7781151119789689.
[I 2023-12-27 13:00:23,263] Trial 178 finished with value: 0.7781151119789689 and parameters: {'model_name': 'SimpleImputer', 'strategy': 'constant'}. Best is trial 9 with value: 0.7781151119789689.
[I 2023-12-27 13:00:23,469] Trial 175 finished with value: 0.7781151119789689 and parameters: {'model_name': 'SimpleImputer', 'strategy': 'constant'}. Best is trial 9 with value: 0.7781151119789689.
[I 2023-12-27 13:00:23,709] Trial 180 finished with value: 0.7781151119789689 and parameters: {'model_name': 'SimpleImputer', 'strategy': 'constant'}. Best is trial 9 with value: 0.7781151119789689.
[I 2023-12-27 13:00:23,974] Trial 150 finished with value: 0.7781151119789689 and parameters: {'model_name': 'SimpleImputer', 'strategy': 'constant'}. Best is trial 9 with value: 0.7781151119789689.
[I 2023-12-27 13:00:24,171] Trial 183 finished with value: 0.7781151119789689 and parameters: {'model_name': 'SimpleImputer', 'strategy': 'constant'}. Best is trial 9 with value: 0.7781151119789689.
[I 2023-12-27 13:00:24,404] Trial 187 finished with value: 0.7788100826710467 and parameters: {'model_name': 'SimpleImputer', 'strategy': 'mean'}. Best is trial 9 with value: 0.7781151119789689.
[I 2023-12-27 13:00:24,641] Trial 181 finished with value: 0.7781151119789689 and parameters: {'model_name': 'SimpleImputer', 'strategy': 'constant'}. Best is trial 9 with value: 0.7781151119789689.
[I 2023-12-27 13:00:24,825] Trial 174 finished with value: 0.7781151119789689 and parameters: {'model_name': 'SimpleImputer', 'strategy': 'constant'}. Best is trial 9 with value: 0.7781151119789689.
[I 2023-12-27 13:00:25,062] Trial 185 finished with value: 0.7788100826710467 and parameters: {'model_name': 'SimpleImputer', 'strategy': 'mean'}. Best is trial 9 with value: 0.7781151119789689.
[I 2023-12-27 13:00:25,297] Trial 167 finished with value: 0.7781151119789689 and parameters: {'model_name': 'SimpleImputer', 'strategy': 'constant'}. Best is trial 9 with value: 0.7781151119789689.
[I 2023-12-27 13:00:25,482] Trial 184 finished with value: 0.7781151119789689 and parameters: {'model_name': 'SimpleImputer', 'strategy': 'constant'}. Best is trial 9 with value: 0.7781151119789689.
[I 2023-12-27 13:00:25,692] Trial 193 finished with value: 0.7781151119789689 and parameters: {'model_name': 'SimpleImputer', 'strategy': 'constant'}. Best is trial 9 with value: 0.7781151119789689.
[I 2023-12-27 13:00:25,871] Trial 195 finished with value: 0.7788100826710467 and parameters: {'model_name': 'SimpleImputer', 'strategy': 'mean'}. Best is trial 9 with value: 0.7781151119789689.
[I 2023-12-27 13:00:26,111] Trial 194 finished with value: 0.7788100826710467 and parameters: {'model_name': 'SimpleImputer', 'strategy': 'mean'}. Best is trial 9 with value: 0.7781151119789689.
[I 2023-12-27 13:00:26,335] Trial 197 finished with value: 0.7788100826710467 and parameters: {'model_name': 'SimpleImputer', 'strategy': 'mean'}. Best is trial 9 with value: 0.7781151119789689.
[I 2023-12-27 13:00:26,556] Trial 196 finished with value: 0.7788100826710467 and parameters: {'model_name': 'SimpleImputer', 'strategy': 'mean'}. Best is trial 9 with value: 0.7781151119789689.
[I 2023-12-27 13:00:26,816] Trial 172 finished with value: 0.7781151119789689 and parameters: {'model_name': 'SimpleImputer', 'strategy': 'constant'}. Best is trial 9 with value: 0.7781151119789689.
[I 2023-12-27 13:00:27,087] Trial 186 finished with value: 0.7788100826710467 and parameters: {'model_name': 'SimpleImputer', 'strategy': 'mean'}. Best is trial 9 with value: 0.7781151119789689.
[I 2023-12-27 13:00:27,264] Trial 192 finished with value: 0.7788100826710467 and parameters: {'model_name': 'SimpleImputer', 'strategy': 'mean'}. Best is trial 9 with value: 0.7781151119789689.
[I 2023-12-27 13:00:27,433] Trial 189 finished with value: 0.7788100826710467 and parameters: {'model_name': 'SimpleImputer', 'strategy': 'mean'}. Best is trial 9 with value: 0.7781151119789689.
[I 2023-12-27 13:00:27,434] Trial 191 finished with value: 0.7788100826710467 and parameters: {'model_name': 'SimpleImputer', 'strategy': 'mean'}. Best is trial 9 with value: 0.7781151119789689.
[I 2023-12-27 13:00:27,671] Trial 198 finished with value: 0.7788100826710467 and parameters: {'model_name': 'SimpleImputer', 'strategy': 'mean'}. Best is trial 9 with value: 0.7781151119789689.
[I 2023-12-27 13:00:28,019] Trial 190 finished with value: 0.7788100826710467 and parameters: {'model_name': 'SimpleImputer', 'strategy': 'mean'}. Best is trial 9 with value: 0.7781151119789689.
