[I 2024-02-29 07:54:30,588] Trial 6 finished with value: 12.317067352561567 and parameters: {'model_name': 'SimpleImputer', 'strategy': 'constant'}. Best is trial 6 with value: 12.317067352561567.
[I 2024-02-29 07:54:32,256] Trial 19 finished with value: 12.317067352561567 and parameters: {'model_name': 'SimpleImputer', 'strategy': 'constant'}. Best is trial 6 with value: 12.317067352561567.
[I 2024-02-29 07:54:33,026] Trial 27 finished with value: 12.317067352561567 and parameters: {'model_name': 'SimpleImputer', 'strategy': 'constant'}. Best is trial 6 with value: 12.317067352561567.
[I 2024-02-29 07:54:34,655] Trial 32 finished with value: 11.34669407285159 and parameters: {'model_name': 'SimpleImputer', 'strategy': 'mean'}. Best is trial 32 with value: 11.34669407285159.
[I 2024-02-29 07:54:35,571] Trial 37 finished with value: 11.34669407285159 and parameters: {'model_name': 'SimpleImputer', 'strategy': 'mean'}. Best is trial 32 with value: 11.34669407285159.
[I 2024-02-29 07:54:37,160] Trial 0 finished with value: 12.317067352561567 and parameters: {'model_name': 'SimpleImputer', 'strategy': 'most_frequent'}. Best is trial 32 with value: 11.34669407285159.
2024-02-29 07:54:38.919678: E external/local_xla/xla/stream_executor/cuda/cuda_driver.cc:274] failed call to cuInit: CUDA_ERROR_NO_DEVICE: no CUDA-capable device is detected
2024-02-29 07:54:39.347852: I tensorflow/compiler/mlir/mlir_graph_optimization_pass.cc:388] MLIR V1 optimization pass is not enabled
[I 2024-02-29 07:54:39,510] Trial 7 finished with value: 12.317067352561567 and parameters: {'model_name': 'SimpleImputer', 'strategy': 'most_frequent'}. Best is trial 32 with value: 11.34669407285159.
[I 2024-02-29 07:54:40,406] Trial 4 finished with value: 12.317067352561567 and parameters: {'model_name': 'SimpleImputer', 'strategy': 'most_frequent'}. Best is trial 32 with value: 11.34669407285159.
[I 2024-02-29 07:54:40,969] Trial 24 finished with value: 12.317067352561567 and parameters: {'model_name': 'SimpleImputer', 'strategy': 'most_frequent'}. Best is trial 32 with value: 11.34669407285159.
[I 2024-02-29 07:54:42,465] Trial 38 finished with value: 12.317067352561567 and parameters: {'model_name': 'SimpleImputer', 'strategy': 'most_frequent'}. Best is trial 32 with value: 11.34669407285159.
[I 2024-02-29 07:54:43,307] Trial 43 finished with value: 12.317067352561567 and parameters: {'model_name': 'SimpleImputer', 'strategy': 'most_frequent'}. Best is trial 32 with value: 11.34669407285159.
[I 2024-02-29 07:54:44,709] Trial 39 finished with value: 12.317067352561567 and parameters: {'model_name': 'SimpleImputer', 'strategy': 'most_frequent'}. Best is trial 32 with value: 11.34669407285159.
[I 2024-02-29 07:54:47,320] Trial 35 finished with value: inf and parameters: {'model_name': 'GAIN', 'batch_size': 731, 'hint_rate': 0.55, 'alpha': 49, 'iterations': 261}. Best is trial 32 with value: 11.34669407285159.
[I 2024-02-29 07:54:48,453] Trial 8 finished with value: 11.60381497246307 and parameters: {'model_name': 'KNNImputer', 'weights': 'uniform', 'keep_empty_features': False}. Best is trial 32 with value: 11.34669407285159.
[I 2024-02-29 07:54:48,946] Trial 3 finished with value: 11.60381497246307 and parameters: {'model_name': 'KNNImputer', 'weights': 'uniform', 'keep_empty_features': False}. Best is trial 32 with value: 11.34669407285159.
[I 2024-02-29 07:54:50,235] Trial 12 finished with value: 11.605941369701927 and parameters: {'model_name': 'KNNImputer', 'weights': 'distance', 'keep_empty_features': False}. Best is trial 32 with value: 11.34669407285159.
[I 2024-02-29 07:54:50,742] Trial 16 finished with value: 11.60381497246307 and parameters: {'model_name': 'KNNImputer', 'weights': 'uniform', 'keep_empty_features': False}. Best is trial 32 with value: 11.34669407285159.
[I 2024-02-29 07:54:51,524] Trial 13 finished with value: 11.60381497246307 and parameters: {'model_name': 'KNNImputer', 'weights': 'uniform', 'keep_empty_features': False}. Best is trial 32 with value: 11.34669407285159.
[I 2024-02-29 07:54:52,035] Trial 10 finished with value: 11.60381497246307 and parameters: {'model_name': 'KNNImputer', 'weights': 'uniform', 'keep_empty_features': False}. Best is trial 32 with value: 11.34669407285159.
[I 2024-02-29 07:54:52,875] Trial 22 finished with value: 11.60381497246307 and parameters: {'model_name': 'KNNImputer', 'weights': 'uniform', 'keep_empty_features': False}. Best is trial 32 with value: 11.34669407285159.
[I 2024-02-29 07:54:53,634] Trial 9 finished with value: 11.60381497246307 and parameters: {'model_name': 'KNNImputer', 'weights': 'uniform', 'keep_empty_features': False}. Best is trial 32 with value: 11.34669407285159.
[I 2024-02-29 07:54:53,636] Trial 17 finished with value: 11.60381497246307 and parameters: {'model_name': 'KNNImputer', 'weights': 'uniform', 'keep_empty_features': False}. Best is trial 32 with value: 11.34669407285159.
[I 2024-02-29 07:54:54,810] Trial 20 finished with value: 11.605941369701927 and parameters: {'model_name': 'KNNImputer', 'weights': 'distance', 'keep_empty_features': False}. Best is trial 32 with value: 11.34669407285159.
[I 2024-02-29 07:54:55,485] Trial 46 finished with value: 11.60381497246307 and parameters: {'model_name': 'KNNImputer', 'weights': 'uniform', 'keep_empty_features': False}. Best is trial 32 with value: 11.34669407285159.
[I 2024-02-29 07:54:56,282] Trial 50 finished with value: 11.60381497246307 and parameters: {'model_name': 'KNNImputer', 'weights': 'uniform', 'keep_empty_features': False}. Best is trial 32 with value: 11.34669407285159.
[I 2024-02-29 07:54:57,090] Trial 36 finished with value: 11.605941369701927 and parameters: {'model_name': 'KNNImputer', 'weights': 'distance', 'keep_empty_features': False}. Best is trial 32 with value: 11.34669407285159.
[I 2024-02-29 07:54:57,668] Trial 44 finished with value: 11.605941369701927 and parameters: {'model_name': 'KNNImputer', 'weights': 'distance', 'keep_empty_features': False}. Best is trial 32 with value: 11.34669407285159.
[I 2024-02-29 07:54:58,637] Trial 45 finished with value: 11.605941369701927 and parameters: {'model_name': 'KNNImputer', 'weights': 'distance', 'keep_empty_features': False}. Best is trial 32 with value: 11.34669407285159.
[I 2024-02-29 07:55:02,357] Trial 57 finished with value: 11.60381497246307 and parameters: {'model_name': 'KNNImputer', 'weights': 'uniform', 'keep_empty_features': False}. Best is trial 32 with value: 11.34669407285159.
[I 2024-02-29 07:55:04,222] Trial 59 finished with value: 11.605941369701927 and parameters: {'model_name': 'KNNImputer', 'weights': 'distance', 'keep_empty_features': False}. Best is trial 32 with value: 11.34669407285159.
[I 2024-02-29 07:55:06,092] Trial 60 finished with value: 11.60381497246307 and parameters: {'model_name': 'KNNImputer', 'weights': 'uniform', 'keep_empty_features': False}. Best is trial 32 with value: 11.34669407285159.
[I 2024-02-29 07:55:13,930] Trial 74 finished with value: 11.34669407285159 and parameters: {'model_name': 'RandomForestImputer', 'max_iter': 1, 'decreasing': True, 'min_samples_split': 0.0, 'min_samples_leaf': 0.7000000000000001, 'max_features': 0.8, 'warm_start': True}. Best is trial 32 with value: 11.34669407285159.
[I 2024-02-29 07:55:29,549] Trial 79 finished with value: 11.34669407285159 and parameters: {'model_name': 'RandomForestImputer', 'max_iter': 1, 'decreasing': True, 'min_samples_split': 0.1, 'min_samples_leaf': 0.7000000000000001, 'max_features': 0.8, 'warm_start': True}. Best is trial 32 with value: 11.34669407285159.
[I 2024-02-29 07:55:40,422] Trial 54 finished with value: 12.216720654242632 and parameters: {'model_name': 'RandomForestImputer', 'max_iter': 2, 'decreasing': True, 'min_samples_split': 0.9, 'min_samples_leaf': 0.2, 'max_features': 0.6, 'warm_start': True}. Best is trial 32 with value: 11.34669407285159.
[I 2024-02-29 07:55:44,608] Trial 80 finished with value: 11.34669407285159 and parameters: {'model_name': 'RandomForestImputer', 'max_iter': 1, 'decreasing': True, 'min_samples_split': 0.0, 'min_samples_leaf': 0.7000000000000001, 'max_features': 0.8, 'warm_start': True}. Best is trial 32 with value: 11.34669407285159.
[I 2024-02-29 07:55:52,082] Trial 33 finished with value: 11.342420443763285 and parameters: {'model_name': 'IterativeImputer', 'sample_posterior': False, 'initial_strategy': 'mean', 'imputation_order': 'ascending'}. Best is trial 33 with value: 11.342420443763285.
[I 2024-02-29 07:55:57,169] Trial 81 finished with value: 11.34669407285159 and parameters: {'model_name': 'RandomForestImputer', 'max_iter': 1, 'decreasing': True, 'min_samples_split': 0.0, 'min_samples_leaf': 0.8, 'max_features': 0.8, 'warm_start': True}. Best is trial 33 with value: 11.342420443763285.
[I 2024-02-29 07:55:59,462] Trial 66 finished with value: 11.342432966422908 and parameters: {'model_name': 'IterativeImputer', 'sample_posterior': False, 'initial_strategy': 'constant', 'imputation_order': 'roman'}. Best is trial 33 with value: 11.342420443763285.
[I 2024-02-29 07:56:02,513] Trial 42 finished with value: 7.022834711397621 and parameters: {'model_name': 'GAIN', 'batch_size': 1, 'hint_rate': 0.64, 'alpha': 93, 'iterations': 3}. Best is trial 42 with value: 7.022834711397621.
[I 2024-02-29 07:56:03,624] Trial 75 finished with value: 11.342420443763285 and parameters: {'model_name': 'IterativeImputer', 'sample_posterior': False, 'initial_strategy': 'mean', 'imputation_order': 'ascending'}. Best is trial 42 with value: 7.022834711397621.
[I 2024-02-29 07:56:06,004] Trial 53 finished with value: 7.665923232553209 and parameters: {'model_name': 'GAIN', 'batch_size': 126, 'hint_rate': 0.23, 'alpha': 2, 'iterations': 2}. Best is trial 42 with value: 7.022834711397621.
[I 2024-02-29 07:56:08,660] Trial 65 finished with value: 12.254543313293093 and parameters: {'model_name': 'RandomForestImputer', 'max_iter': 3, 'decreasing': False, 'min_samples_split': 0.1, 'min_samples_leaf': 0.7000000000000001, 'max_features': 0.5, 'warm_start': True}. Best is trial 42 with value: 7.022834711397621.
[I 2024-02-29 07:56:10,426] Trial 15 finished with value: 11.342432280740798 and parameters: {'model_name': 'IterativeImputer', 'sample_posterior': False, 'initial_strategy': 'most_frequent', 'imputation_order': 'descending'}. Best is trial 42 with value: 7.022834711397621.
[I 2024-02-29 07:56:13,751] Trial 31 finished with value: 8.72827981484335 and parameters: {'model_name': 'GAIN', 'batch_size': 17, 'hint_rate': 0.6, 'alpha': 21, 'iterations': 10}. Best is trial 42 with value: 7.022834711397621.
[I 2024-02-29 07:56:15,166] Trial 14 finished with value: 12.212308851637601 and parameters: {'model_name': 'RandomForestImputer', 'max_iter': 4, 'decreasing': True, 'min_samples_split': 0.0, 'min_samples_leaf': 0.8, 'max_features': 0.7000000000000001, 'warm_start': True}. Best is trial 42 with value: 7.022834711397621.
[I 2024-02-29 07:56:16,798] Trial 41 finished with value: 12.211136474765862 and parameters: {'model_name': 'RandomForestImputer', 'max_iter': 5, 'decreasing': True, 'min_samples_split': 1.0, 'min_samples_leaf': 0.5, 'max_features': 0.6, 'warm_start': True}. Best is trial 42 with value: 7.022834711397621.
[I 2024-02-29 07:56:17,829] Trial 69 finished with value: 11.342437772471872 and parameters: {'model_name': 'IterativeImputer', 'sample_posterior': False, 'initial_strategy': 'constant', 'imputation_order': 'random'}. Best is trial 42 with value: 7.022834711397621.
[I 2024-02-29 07:56:20,322] Trial 49 finished with value: 6.232746113234294 and parameters: {'model_name': 'GAIN', 'batch_size': 6, 'hint_rate': 0.16, 'alpha': 42, 'iterations': 11}. Best is trial 49 with value: 6.232746113234294.
[I 2024-02-29 07:56:22,524] Trial 58 finished with value: 11.342455314336997 and parameters: {'model_name': 'IterativeImputer', 'sample_posterior': False, 'initial_strategy': 'constant', 'imputation_order': 'arabic'}. Best is trial 49 with value: 6.232746113234294.
[I 2024-02-29 07:56:26,492] Trial 23 finished with value: 11.34669407285159 and parameters: {'model_name': 'RandomForestImputer', 'max_iter': 1, 'decreasing': True, 'min_samples_split': 0.5, 'min_samples_leaf': 0.5, 'max_features': 0.1, 'warm_start': False}. Best is trial 49 with value: 6.232746113234294.
[I 2024-02-29 07:56:28,591] Trial 18 finished with value: 11.34669407285159 and parameters: {'model_name': 'RandomForestImputer', 'max_iter': 1, 'decreasing': False, 'min_samples_split': 0.5, 'min_samples_leaf': 0.1, 'max_features': 0.30000000000000004, 'warm_start': False}. Best is trial 49 with value: 6.232746113234294.
[I 2024-02-29 07:56:29,476] Trial 78 finished with value: 11.342432697909063 and parameters: {'model_name': 'IterativeImputer', 'sample_posterior': False, 'initial_strategy': 'constant', 'imputation_order': 'ascending'}. Best is trial 49 with value: 6.232746113234294.
[I 2024-02-29 07:56:31,571] Trial 68 finished with value: 11.342455314336997 and parameters: {'model_name': 'IterativeImputer', 'sample_posterior': False, 'initial_strategy': 'constant', 'imputation_order': 'arabic'}. Best is trial 49 with value: 6.232746113234294.
[I 2024-02-29 07:56:33,148] Trial 73 finished with value: 11.342455314336997 and parameters: {'model_name': 'IterativeImputer', 'sample_posterior': False, 'initial_strategy': 'median', 'imputation_order': 'arabic'}. Best is trial 49 with value: 6.232746113234294.
[I 2024-02-29 07:56:38,370] Trial 62 finished with value: 11.34669407285159 and parameters: {'model_name': 'RandomForestImputer', 'max_iter': 1, 'decreasing': False, 'min_samples_split': 0.2, 'min_samples_leaf': 0.9, 'max_features': 0.1, 'warm_start': False}. Best is trial 49 with value: 6.232746113234294.
[I 2024-02-29 07:56:39,445] Trial 71 finished with value: 12.209045339151192 and parameters: {'model_name': 'RandomForestImputer', 'max_iter': 5, 'decreasing': True, 'min_samples_split': 0.0, 'min_samples_leaf': 0.30000000000000004, 'max_features': 0.30000000000000004, 'warm_start': True}. Best is trial 49 with value: 6.232746113234294.
[I 2024-02-29 07:56:44,689] Trial 76 finished with value: 11.34669407285159 and parameters: {'model_name': 'RandomForestImputer', 'max_iter': 1, 'decreasing': False, 'min_samples_split': 1.0, 'min_samples_leaf': 0.2, 'max_features': 0.2, 'warm_start': False}. Best is trial 49 with value: 6.232746113234294.
[I 2024-02-29 07:56:55,933] Trial 55 finished with value: 6.526429795660834 and parameters: {'model_name': 'GAIN', 'batch_size': 54, 'hint_rate': 0.8400000000000001, 'alpha': 97, 'iterations': 18}. Best is trial 49 with value: 6.232746113234294.
[I 2024-02-29 07:57:15,635] Trial 83 finished with value: 11.342420443763285 and parameters: {'model_name': 'IterativeImputer', 'sample_posterior': False, 'initial_strategy': 'mean', 'imputation_order': 'ascending'}. Best is trial 49 with value: 6.232746113234294.
[I 2024-02-29 07:57:23,582] Trial 86 finished with value: 11.342430503448629 and parameters: {'model_name': 'IterativeImputer', 'sample_posterior': False, 'initial_strategy': 'mean', 'imputation_order': 'roman'}. Best is trial 49 with value: 6.232746113234294.
[I 2024-02-29 07:57:24,718] Trial 84 finished with value: 11.342420443763285 and parameters: {'model_name': 'IterativeImputer', 'sample_posterior': False, 'initial_strategy': 'mean', 'imputation_order': 'ascending'}. Best is trial 49 with value: 6.232746113234294.
[I 2024-02-29 07:57:27,137] Trial 82 finished with value: 11.342432280740798 and parameters: {'model_name': 'IterativeImputer', 'sample_posterior': False, 'initial_strategy': 'constant', 'imputation_order': 'descending'}. Best is trial 49 with value: 6.232746113234294.
[I 2024-02-29 07:57:31,734] Trial 85 finished with value: 11.342432966422908 and parameters: {'model_name': 'IterativeImputer', 'sample_posterior': False, 'initial_strategy': 'constant', 'imputation_order': 'roman'}. Best is trial 49 with value: 6.232746113234294.
[I 2024-02-29 07:57:36,563] Trial 87 finished with value: 11.342420443763285 and parameters: {'model_name': 'IterativeImputer', 'sample_posterior': False, 'initial_strategy': 'mean', 'imputation_order': 'ascending'}. Best is trial 49 with value: 6.232746113234294.
[I 2024-02-29 07:57:39,302] Trial 88 finished with value: 11.342420443763285 and parameters: {'model_name': 'IterativeImputer', 'sample_posterior': False, 'initial_strategy': 'mean', 'imputation_order': 'ascending'}. Best is trial 49 with value: 6.232746113234294.
[I 2024-02-29 07:57:43,833] Trial 89 finished with value: 11.342420443763285 and parameters: {'model_name': 'IterativeImputer', 'sample_posterior': False, 'initial_strategy': 'mean', 'imputation_order': 'ascending'}. Best is trial 49 with value: 6.232746113234294.
[I 2024-02-29 07:57:47,648] Trial 90 finished with value: 11.342420443763285 and parameters: {'model_name': 'IterativeImputer', 'sample_posterior': False, 'initial_strategy': 'mean', 'imputation_order': 'ascending'}. Best is trial 49 with value: 6.232746113234294.
[I 2024-02-29 07:57:57,137] Trial 92 finished with value: 6.8517312751036075 and parameters: {'model_name': 'GAIN', 'batch_size': 1, 'hint_rate': 0.6, 'alpha': 1, 'iterations': 2}. Best is trial 49 with value: 6.232746113234294.
[I 2024-02-29 07:57:59,141] Trial 94 finished with value: 6.831742712404281 and parameters: {'model_name': 'GAIN', 'batch_size': 1, 'hint_rate': 0.6, 'alpha': 4, 'iterations': 2}. Best is trial 49 with value: 6.232746113234294.
[I 2024-02-29 07:58:06,496] Trial 96 finished with value: 6.917031257868359 and parameters: {'model_name': 'GAIN', 'batch_size': 2, 'hint_rate': 0.13, 'alpha': 2, 'iterations': 2}. Best is trial 49 with value: 6.232746113234294.
[I 2024-02-29 07:58:08,317] Trial 93 finished with value: 8.040223672150614 and parameters: {'model_name': 'GAIN', 'batch_size': 1, 'hint_rate': 0.6, 'alpha': 3, 'iterations': 2}. Best is trial 49 with value: 6.232746113234294.
[I 2024-02-29 07:58:09,565] Trial 97 finished with value: 7.756252326052649 and parameters: {'model_name': 'GAIN', 'batch_size': 2, 'hint_rate': 0.12, 'alpha': 1, 'iterations': 2}. Best is trial 49 with value: 6.232746113234294.
[I 2024-02-29 07:58:13,442] Trial 98 finished with value: 6.610136139030409 and parameters: {'model_name': 'GAIN', 'batch_size': 2, 'hint_rate': 0.27, 'alpha': 2, 'iterations': 2}. Best is trial 49 with value: 6.232746113234294.
[I 2024-02-29 07:58:16,981] Trial 99 finished with value: 7.179443073288931 and parameters: {'model_name': 'GAIN', 'batch_size': 2, 'hint_rate': 0.06999999999999999, 'alpha': 7, 'iterations': 2}. Best is trial 49 with value: 6.232746113234294.
[I 2024-02-29 07:58:19,318] Trial 100 finished with value: 6.449854159764112 and parameters: {'model_name': 'GAIN', 'batch_size': 2, 'hint_rate': 0.11, 'alpha': 1, 'iterations': 2}. Best is trial 49 with value: 6.232746113234294.
[I 2024-02-29 07:58:22,557] Trial 103 finished with value: 8.178799033756082 and parameters: {'model_name': 'GAIN', 'batch_size': 2, 'hint_rate': 0.11, 'alpha': 4, 'iterations': 2}. Best is trial 49 with value: 6.232746113234294.
[I 2024-02-29 07:58:24,116] Trial 102 finished with value: 7.583912109905695 and parameters: {'model_name': 'GAIN', 'batch_size': 2, 'hint_rate': 0.12, 'alpha': 1, 'iterations': 2}. Best is trial 49 with value: 6.232746113234294.
[I 2024-02-29 07:58:26,966] Trial 101 finished with value: 7.83592165677035 and parameters: {'model_name': 'GAIN', 'batch_size': 1, 'hint_rate': 0.11, 'alpha': 0, 'iterations': 4}. Best is trial 49 with value: 6.232746113234294.
[I 2024-02-29 07:58:28,741] Trial 91 finished with value: 6.632993026735545 and parameters: {'model_name': 'GAIN', 'batch_size': 1, 'hint_rate': 0.6, 'alpha': 0, 'iterations': 1}. Best is trial 49 with value: 6.232746113234294.
[I 2024-02-29 07:58:33,136] Trial 104 finished with value: 7.667353814222044 and parameters: {'model_name': 'GAIN', 'batch_size': 1, 'hint_rate': 0.15000000000000002, 'alpha': 0, 'iterations': 2}. Best is trial 49 with value: 6.232746113234294.
[I 2024-02-29 07:58:37,313] Trial 95 finished with value: 7.170806856942138 and parameters: {'model_name': 'GAIN', 'batch_size': 1, 'hint_rate': 0.06999999999999999, 'alpha': 6, 'iterations': 2}. Best is trial 49 with value: 6.232746113234294.
[I 2024-02-29 07:58:58,666] Trial 56 finished with value: 7.494602651327307 and parameters: {'model_name': 'GAIN', 'batch_size': 4, 'hint_rate': 0.31, 'alpha': 99, 'iterations': 59}. Best is trial 49 with value: 6.232746113234294.
[I 2024-02-29 07:59:13,247] Trial 105 finished with value: 6.005065678267085 and parameters: {'model_name': 'GAIN', 'batch_size': 1, 'hint_rate': 0.09, 'alpha': 2, 'iterations': 4}. Best is trial 105 with value: 6.005065678267085.
[I 2024-02-29 07:59:20,084] Trial 106 finished with value: 6.73100099381031 and parameters: {'model_name': 'GAIN', 'batch_size': 1, 'hint_rate': 0.13, 'alpha': 98, 'iterations': 4}. Best is trial 105 with value: 6.005065678267085.
[I 2024-02-29 07:59:25,028] Trial 109 finished with value: 8.183405803327766 and parameters: {'model_name': 'GAIN', 'batch_size': 1, 'hint_rate': 0.09999999999999999, 'alpha': 99, 'iterations': 3}. Best is trial 105 with value: 6.005065678267085.
[I 2024-02-29 07:59:29,498] Trial 108 finished with value: 8.278626289195547 and parameters: {'model_name': 'GAIN', 'batch_size': 1, 'hint_rate': 0.11, 'alpha': 100, 'iterations': 4}. Best is trial 105 with value: 6.005065678267085.
[I 2024-02-29 07:59:32,778] Trial 110 finished with value: 6.830678378820934 and parameters: {'model_name': 'GAIN', 'batch_size': 1, 'hint_rate': 0.17, 'alpha': 98, 'iterations': 4}. Best is trial 105 with value: 6.005065678267085.
[I 2024-02-29 07:59:41,629] Trial 113 finished with value: 7.079332827234905 and parameters: {'model_name': 'GAIN', 'batch_size': 1, 'hint_rate': 0.11, 'alpha': 1, 'iterations': 4}. Best is trial 105 with value: 6.005065678267085.
