Run: 5
/cm/local/apps/slurm/var/spool/job675312/slurm_script: line 23: /common/ketrong/minconda3/etc/profile.d/conda.sh: No such file or directory
/cm/local/apps/slurm/var/spool/job675312/slurm_script: line 26: $'\nconda create --name tpot2devenv -c conda-forge python=3.10\n': command not found
/cm/local/apps/slurm/var/spool/job675312/slurm_script: line 31: $'\npip install -r requirements.txt\n': command not found
RunStart
2024-02-23 07:06:26.772620: I tensorflow/core/util/port.cc:113] oneDNN custom operations are on. You may see slightly different numerical results due to floating-point round-off errors from different computation orders. To turn them off, set the environment variable `TF_ENABLE_ONEDNN_OPTS=0`.
2024-02-23 07:06:26.806569: E external/local_xla/xla/stream_executor/cuda/cuda_dnn.cc:9261] Unable to register cuDNN factory: Attempting to register factory for plugin cuDNN when one has already been registered
2024-02-23 07:06:26.806589: E external/local_xla/xla/stream_executor/cuda/cuda_fft.cc:607] Unable to register cuFFT factory: Attempting to register factory for plugin cuFFT when one has already been registered
2024-02-23 07:06:26.807698: E external/local_xla/xla/stream_executor/cuda/cuda_blas.cc:1515] Unable to register cuBLAS factory: Attempting to register factory for plugin cuBLAS when one has already been registered
2024-02-23 07:06:26.813093: I tensorflow/core/platform/cpu_feature_guard.cc:182] This TensorFlow binary is optimized to use available CPU instructions in performance-critical operations.
To enable the following instructions: AVX2 AVX512F AVX512_VNNI FMA, in other operations, rebuild TensorFlow with the appropriate compiler flags.
2024-02-23 07:06:28.588159: W tensorflow/compiler/tf2tensorrt/utils/py_utils.cc:38] TF-TRT Warning: Could not find TensorRT
WARNING:tensorflow:From /home/ketrong/miniconda3/envs/tpot2devenv/lib/python3.10/site-packages/tensorflow/python/compat/v2_compat.py:108: disable_resource_variables (from tensorflow.python.ops.variable_scope) is deprecated and will be removed in a future version.
Instructions for updating:
non-resource variables are not supported in the long term
starting loops
working on 
logs/2307/tpot2_base_normal_MCAR_0.9
2.5735721588134766
loading data
logs/2307/tpot2_base_normal_MCAR_0.9/data/2307_True.pkl
6856     0.017
7671     0.027
2579     0.017
6768     0.017
9881     0.017
         ...  
4940     0.017
10883    0.018
16195    0.016
9294     0.023
7128     0.018
Name: Goal, Length: 14939, dtype: float64
          0   ...      17
0      -46.0  ... -0.0006
1      -96.0  ... -0.0009
2     -474.0  ... -0.0010
3      180.0  ... -0.0004
4      207.0  ... -0.0002
...      ...  ...     ...
14934 -378.0  ... -0.0006
14935  116.0  ... -0.0004
14936  -71.0  ... -0.0005
14937 -479.0  ... -0.0007
14938   44.0  ... -0.0005

[14939 rows x 18 columns]
         0   ...      17
0      57.0  ... -0.0003
1    -252.0  ... -0.0008
2     349.0  ... -0.0004
3    -123.0  ... -0.0003
4      27.0  ... -0.0004
...     ...  ...     ...
1655 -311.0  ... -0.0010
1656   32.0  ... -0.0010
1657 -711.0  ... -0.0012
1658 -121.0  ... -0.0011
1659  477.0  ... -0.0010

[1660 rows x 18 columns]
running experiment 1/3 - Does large hyperparameter space improve reconstruction accuracy over simple
[I 2024-02-23 07:06:41,271] A new study created in memory with name: no-name-b56fb468-c020-43c7-8d81-7b6d021fff6b
[I 2024-02-23 07:06:42,886] Trial 0 finished with value: 20.019466627212218 and parameters: {'model_name': 'SimpleImputer', 'strategy': 'constant'}. Best is trial 0 with value: 20.019466627212218.
[I 2024-02-23 07:06:43,555] Trial 2 finished with value: 20.009629735591854 and parameters: {'model_name': 'SimpleImputer', 'strategy': 'mean'}. Best is trial 2 with value: 20.009629735591854.
[I 2024-02-23 07:06:43,909] Trial 24 finished with value: 20.019466627212218 and parameters: {'model_name': 'SimpleImputer', 'strategy': 'constant'}. Best is trial 2 with value: 20.009629735591854.
[I 2024-02-23 07:06:44,397] Trial 25 finished with value: 20.019466627212218 and parameters: {'model_name': 'SimpleImputer', 'strategy': 'constant'}. Best is trial 2 with value: 20.009629735591854.
[I 2024-02-23 07:06:44,607] Trial 29 finished with value: 20.019466627212218 and parameters: {'model_name': 'SimpleImputer', 'strategy': 'constant'}. Best is trial 2 with value: 20.009629735591854.
[I 2024-02-23 07:06:44,782] Trial 31 finished with value: 20.019466627212218 and parameters: {'model_name': 'SimpleImputer', 'strategy': 'constant'}. Best is trial 2 with value: 20.009629735591854.
[I 2024-02-23 07:06:45,019] Trial 28 finished with value: 20.019466627212218 and parameters: {'model_name': 'SimpleImputer', 'strategy': 'constant'}. Best is trial 2 with value: 20.009629735591854.
[I 2024-02-23 07:06:45,248] Trial 20 finished with value: 20.019466627212218 and parameters: {'model_name': 'SimpleImputer', 'strategy': 'constant'}. Best is trial 2 with value: 20.009629735591854.
[I 2024-02-23 07:06:45,478] Trial 15 finished with value: 20.009629735591854 and parameters: {'model_name': 'SimpleImputer', 'strategy': 'mean'}. Best is trial 2 with value: 20.009629735591854.
[I 2024-02-23 07:06:45,792] Trial 11 finished with value: 20.009629735591854 and parameters: {'model_name': 'SimpleImputer', 'strategy': 'mean'}. Best is trial 2 with value: 20.009629735591854.
[I 2024-02-23 07:06:46,241] Trial 7 finished with value: 20.009629735591854 and parameters: {'model_name': 'SimpleImputer', 'strategy': 'mean'}. Best is trial 2 with value: 20.009629735591854.
[I 2024-02-23 07:06:46,479] Trial 37 finished with value: 20.019466627212218 and parameters: {'model_name': 'SimpleImputer', 'strategy': 'constant'}. Best is trial 2 with value: 20.009629735591854.
[I 2024-02-23 07:06:46,713] Trial 44 finished with value: 20.019466627212218 and parameters: {'model_name': 'SimpleImputer', 'strategy': 'constant'}. Best is trial 2 with value: 20.009629735591854.
[I 2024-02-23 07:06:47,030] Trial 5 finished with value: 20.009629735591854 and parameters: {'model_name': 'SimpleImputer', 'strategy': 'mean'}. Best is trial 2 with value: 20.009629735591854.
[I 2024-02-23 07:06:47,274] Trial 39 finished with value: 20.019466627212218 and parameters: {'model_name': 'SimpleImputer', 'strategy': 'constant'}. Best is trial 2 with value: 20.009629735591854.
[I 2024-02-23 07:06:47,533] Trial 35 finished with value: 20.009629735591854 and parameters: {'model_name': 'SimpleImputer', 'strategy': 'mean'}. Best is trial 2 with value: 20.009629735591854.
[I 2024-02-23 07:06:47,767] Trial 36 finished with value: 20.009629735591854 and parameters: {'model_name': 'SimpleImputer', 'strategy': 'mean'}. Best is trial 2 with value: 20.009629735591854.
[I 2024-02-23 07:06:48,017] Trial 19 finished with value: 20.009629735591854 and parameters: {'model_name': 'SimpleImputer', 'strategy': 'mean'}. Best is trial 2 with value: 20.009629735591854.
[I 2024-02-23 07:06:48,206] Trial 42 finished with value: 20.009629735591854 and parameters: {'model_name': 'SimpleImputer', 'strategy': 'mean'}. Best is trial 2 with value: 20.009629735591854.
[I 2024-02-23 07:06:48,479] Trial 34 finished with value: 20.009629735591854 and parameters: {'model_name': 'SimpleImputer', 'strategy': 'mean'}. Best is trial 2 with value: 20.009629735591854.
[I 2024-02-23 07:06:48,773] Trial 47 finished with value: 20.009629735591854 and parameters: {'model_name': 'SimpleImputer', 'strategy': 'mean'}. Best is trial 2 with value: 20.009629735591854.
[I 2024-02-23 07:06:48,982] Trial 45 finished with value: 20.009629735591854 and parameters: {'model_name': 'SimpleImputer', 'strategy': 'mean'}. Best is trial 2 with value: 20.009629735591854.
[I 2024-02-23 07:06:49,251] Trial 43 finished with value: 20.009629735591854 and parameters: {'model_name': 'SimpleImputer', 'strategy': 'mean'}. Best is trial 2 with value: 20.009629735591854.
[I 2024-02-23 07:06:49,487] Trial 40 finished with value: 20.009629735591854 and parameters: {'model_name': 'SimpleImputer', 'strategy': 'mean'}. Best is trial 2 with value: 20.009629735591854.
[I 2024-02-23 07:06:49,681] Trial 30 finished with value: 20.009629735591854 and parameters: {'model_name': 'SimpleImputer', 'strategy': 'mean'}. Best is trial 2 with value: 20.009629735591854.
[I 2024-02-23 07:06:50,089] Trial 6 finished with value: 20.019466627212218 and parameters: {'model_name': 'SimpleImputer', 'strategy': 'median'}. Best is trial 2 with value: 20.009629735591854.
[I 2024-02-23 07:06:50,434] Trial 12 finished with value: 20.019466627212218 and parameters: {'model_name': 'SimpleImputer', 'strategy': 'median'}. Best is trial 2 with value: 20.009629735591854.
[I 2024-02-23 07:06:50,739] Trial 23 finished with value: 20.019466627212218 and parameters: {'model_name': 'SimpleImputer', 'strategy': 'median'}. Best is trial 2 with value: 20.009629735591854.
[I 2024-02-23 07:06:51,076] Trial 10 finished with value: 20.019466627212218 and parameters: {'model_name': 'SimpleImputer', 'strategy': 'median'}. Best is trial 2 with value: 20.009629735591854.
[I 2024-02-23 07:06:51,389] Trial 8 finished with value: 20.019466627212218 and parameters: {'model_name': 'SimpleImputer', 'strategy': 'median'}. Best is trial 2 with value: 20.009629735591854.
[I 2024-02-23 07:06:51,928] Trial 27 finished with value: 20.019466627212218 and parameters: {'model_name': 'SimpleImputer', 'strategy': 'median'}. Best is trial 2 with value: 20.009629735591854.
[I 2024-02-23 07:06:52,165] Trial 49 finished with value: 20.019466627212218 and parameters: {'model_name': 'SimpleImputer', 'strategy': 'constant'}. Best is trial 2 with value: 20.009629735591854.
[I 2024-02-23 07:06:52,404] Trial 54 finished with value: 20.019466627212218 and parameters: {'model_name': 'SimpleImputer', 'strategy': 'constant'}. Best is trial 2 with value: 20.009629735591854.
[I 2024-02-23 07:06:53,112] Trial 46 finished with value: 20.019466627212218 and parameters: {'model_name': 'SimpleImputer', 'strategy': 'median'}. Best is trial 2 with value: 20.009629735591854.
[I 2024-02-23 07:06:54,307] Trial 48 finished with value: 20.019466627212218 and parameters: {'model_name': 'SimpleImputer', 'strategy': 'median'}. Best is trial 2 with value: 20.009629735591854.
[I 2024-02-23 07:06:54,936] Trial 55 finished with value: 20.019466627212218 and parameters: {'model_name': 'SimpleImputer', 'strategy': 'median'}. Best is trial 2 with value: 20.009629735591854.
[I 2024-02-23 07:06:55,306] Trial 53 finished with value: 20.019466627212218 and parameters: {'model_name': 'SimpleImputer', 'strategy': 'median'}. Best is trial 2 with value: 20.009629735591854.
[I 2024-02-23 07:06:55,791] Trial 58 finished with value: 20.019466627212218 and parameters: {'model_name': 'SimpleImputer', 'strategy': 'median'}. Best is trial 2 with value: 20.009629735591854.
[I 2024-02-23 07:06:55,965] Trial 56 finished with value: 20.019466627212218 and parameters: {'model_name': 'SimpleImputer', 'strategy': 'median'}. Best is trial 2 with value: 20.009629735591854.
[I 2024-02-23 07:06:56,578] Trial 60 finished with value: 20.019466627212218 and parameters: {'model_name': 'SimpleImputer', 'strategy': 'median'}. Best is trial 2 with value: 20.009629735591854.
[I 2024-02-23 07:06:57,043] Trial 66 finished with value: 20.019466627212218 and parameters: {'model_name': 'SimpleImputer', 'strategy': 'median'}. Best is trial 2 with value: 20.009629735591854.
[I 2024-02-23 07:06:57,550] Trial 71 finished with value: 20.019466627212218 and parameters: {'model_name': 'SimpleImputer', 'strategy': 'median'}. Best is trial 2 with value: 20.009629735591854.
[I 2024-02-23 07:06:58,011] Trial 69 finished with value: 20.019466627212218 and parameters: {'model_name': 'SimpleImputer', 'strategy': 'median'}. Best is trial 2 with value: 20.009629735591854.
[I 2024-02-23 07:06:59,630] Trial 16 finished with value: 20.019466627212218 and parameters: {'model_name': 'SimpleImputer', 'strategy': 'most_frequent'}. Best is trial 2 with value: 20.009629735591854.
[I 2024-02-23 07:06:59,854] Trial 1 finished with value: 20.019466627212218 and parameters: {'model_name': 'SimpleImputer', 'strategy': 'most_frequent'}. Best is trial 2 with value: 20.009629735591854.
[I 2024-02-23 07:07:00,281] Trial 33 finished with value: 20.019466627212218 and parameters: {'model_name': 'SimpleImputer', 'strategy': 'most_frequent'}. Best is trial 2 with value: 20.009629735591854.
[I 2024-02-23 07:07:00,540] Trial 13 finished with value: 20.019466627212218 and parameters: {'model_name': 'SimpleImputer', 'strategy': 'most_frequent'}. Best is trial 2 with value: 20.009629735591854.
[I 2024-02-23 07:07:00,749] Trial 21 finished with value: 20.019466627212218 and parameters: {'model_name': 'SimpleImputer', 'strategy': 'most_frequent'}. Best is trial 2 with value: 20.009629735591854.
[I 2024-02-23 07:07:01,183] Trial 17 finished with value: 20.019466627212218 and parameters: {'model_name': 'SimpleImputer', 'strategy': 'most_frequent'}. Best is trial 2 with value: 20.009629735591854.
[I 2024-02-23 07:07:01,393] Trial 32 finished with value: 20.019466627212218 and parameters: {'model_name': 'SimpleImputer', 'strategy': 'most_frequent'}. Best is trial 2 with value: 20.009629735591854.
[I 2024-02-23 07:07:01,730] Trial 4 finished with value: 20.019466627212218 and parameters: {'model_name': 'SimpleImputer', 'strategy': 'most_frequent'}. Best is trial 2 with value: 20.009629735591854.
[I 2024-02-23 07:07:02,121] Trial 9 finished with value: 20.019466627212218 and parameters: {'model_name': 'SimpleImputer', 'strategy': 'most_frequent'}. Best is trial 2 with value: 20.009629735591854.
[I 2024-02-23 07:07:02,375] Trial 14 finished with value: 20.019466627212218 and parameters: {'model_name': 'SimpleImputer', 'strategy': 'most_frequent'}. Best is trial 2 with value: 20.009629735591854.
[I 2024-02-23 07:07:02,704] Trial 22 finished with value: 20.019466627212218 and parameters: {'model_name': 'SimpleImputer', 'strategy': 'most_frequent'}. Best is trial 2 with value: 20.009629735591854.
[I 2024-02-23 07:07:03,116] Trial 3 finished with value: 20.019466627212218 and parameters: {'model_name': 'SimpleImputer', 'strategy': 'most_frequent'}. Best is trial 2 with value: 20.009629735591854.
[I 2024-02-23 07:07:03,481] Trial 41 finished with value: 20.019466627212218 and parameters: {'model_name': 'SimpleImputer', 'strategy': 'most_frequent'}. Best is trial 2 with value: 20.009629735591854.
[I 2024-02-23 07:07:03,777] Trial 26 finished with value: 20.019466627212218 and parameters: {'model_name': 'SimpleImputer', 'strategy': 'most_frequent'}. Best is trial 2 with value: 20.009629735591854.
[I 2024-02-23 07:07:04,059] Trial 18 finished with value: 20.019466627212218 and parameters: {'model_name': 'SimpleImputer', 'strategy': 'most_frequent'}. Best is trial 2 with value: 20.009629735591854.
[I 2024-02-23 07:07:04,872] Trial 38 finished with value: 20.019466627212218 and parameters: {'model_name': 'SimpleImputer', 'strategy': 'most_frequent'}. Best is trial 2 with value: 20.009629735591854.
[I 2024-02-23 07:07:05,678] Trial 50 finished with value: 20.019466627212218 and parameters: {'model_name': 'SimpleImputer', 'strategy': 'most_frequent'}. Best is trial 2 with value: 20.009629735591854.
[I 2024-02-23 07:07:05,865] Trial 52 finished with value: 20.019466627212218 and parameters: {'model_name': 'SimpleImputer', 'strategy': 'most_frequent'}. Best is trial 2 with value: 20.009629735591854.
[I 2024-02-23 07:07:06,112] Trial 62 finished with value: 20.019466627212218 and parameters: {'model_name': 'SimpleImputer', 'strategy': 'most_frequent'}. Best is trial 2 with value: 20.009629735591854.
[I 2024-02-23 07:07:06,638] Trial 51 finished with value: 20.019466627212218 and parameters: {'model_name': 'SimpleImputer', 'strategy': 'most_frequent'}. Best is trial 2 with value: 20.009629735591854.
[I 2024-02-23 07:07:06,851] Trial 93 finished with value: 20.009629735591854 and parameters: {'model_name': 'SimpleImputer', 'strategy': 'mean'}. Best is trial 2 with value: 20.009629735591854.
[I 2024-02-23 07:07:07,228] Trial 94 finished with value: 20.009629735591854 and parameters: {'model_name': 'SimpleImputer', 'strategy': 'mean'}. Best is trial 2 with value: 20.009629735591854.
[I 2024-02-23 07:07:07,536] Trial 61 finished with value: 20.019466627212218 and parameters: {'model_name': 'SimpleImputer', 'strategy': 'most_frequent'}. Best is trial 2 with value: 20.009629735591854.
[I 2024-02-23 07:07:07,731] Trial 95 finished with value: 20.009629735591854 and parameters: {'model_name': 'SimpleImputer', 'strategy': 'mean'}. Best is trial 2 with value: 20.009629735591854.
[I 2024-02-23 07:07:07,755] Trial 96 finished with value: 20.009629735591854 and parameters: {'model_name': 'SimpleImputer', 'strategy': 'mean'}. Best is trial 2 with value: 20.009629735591854.
[I 2024-02-23 07:07:08,483] Trial 63 finished with value: 20.019466627212218 and parameters: {'model_name': 'SimpleImputer', 'strategy': 'most_frequent'}. Best is trial 2 with value: 20.009629735591854.
[I 2024-02-23 07:07:08,656] Trial 98 finished with value: 20.009629735591854 and parameters: {'model_name': 'SimpleImputer', 'strategy': 'mean'}. Best is trial 2 with value: 20.009629735591854.
[I 2024-02-23 07:07:08,911] Trial 97 finished with value: 20.009629735591854 and parameters: {'model_name': 'SimpleImputer', 'strategy': 'mean'}. Best is trial 2 with value: 20.009629735591854.
[I 2024-02-23 07:07:09,156] Trial 99 finished with value: 20.009629735591854 and parameters: {'model_name': 'SimpleImputer', 'strategy': 'mean'}. Best is trial 2 with value: 20.009629735591854.
[I 2024-02-23 07:07:09,446] Trial 102 finished with value: 20.009629735591854 and parameters: {'model_name': 'SimpleImputer', 'strategy': 'mean'}. Best is trial 2 with value: 20.009629735591854.
[I 2024-02-23 07:07:09,729] Trial 100 finished with value: 20.009629735591854 and parameters: {'model_name': 'SimpleImputer', 'strategy': 'mean'}. Best is trial 2 with value: 20.009629735591854.
[I 2024-02-23 07:07:10,071] Trial 80 finished with value: 20.019466627212218 and parameters: {'model_name': 'SimpleImputer', 'strategy': 'most_frequent'}. Best is trial 2 with value: 20.009629735591854.
[I 2024-02-23 07:07:10,276] Trial 101 finished with value: 20.009629735591854 and parameters: {'model_name': 'SimpleImputer', 'strategy': 'mean'}. Best is trial 2 with value: 20.009629735591854.
[I 2024-02-23 07:07:10,703] Trial 104 finished with value: 20.009629735591854 and parameters: {'model_name': 'SimpleImputer', 'strategy': 'mean'}. Best is trial 2 with value: 20.009629735591854.
[I 2024-02-23 07:07:11,013] Trial 79 finished with value: 20.019466627212218 and parameters: {'model_name': 'SimpleImputer', 'strategy': 'most_frequent'}. Best is trial 2 with value: 20.009629735591854.
[I 2024-02-23 07:07:11,200] Trial 76 finished with value: 20.019466627212218 and parameters: {'model_name': 'SimpleImputer', 'strategy': 'most_frequent'}. Best is trial 2 with value: 20.009629735591854.
[I 2024-02-23 07:07:11,452] Trial 70 finished with value: 20.019466627212218 and parameters: {'model_name': 'SimpleImputer', 'strategy': 'most_frequent'}. Best is trial 2 with value: 20.009629735591854.
[I 2024-02-23 07:07:11,621] Trial 105 finished with value: 20.009629735591854 and parameters: {'model_name': 'SimpleImputer', 'strategy': 'mean'}. Best is trial 2 with value: 20.009629735591854.
[I 2024-02-23 07:07:11,864] Trial 64 finished with value: 20.019466627212218 and parameters: {'model_name': 'SimpleImputer', 'strategy': 'most_frequent'}. Best is trial 2 with value: 20.009629735591854.
[I 2024-02-23 07:07:12,062] Trial 57 finished with value: 20.019466627212218 and parameters: {'model_name': 'SimpleImputer', 'strategy': 'most_frequent'}. Best is trial 2 with value: 20.009629735591854.
[I 2024-02-23 07:07:12,387] Trial 75 finished with value: 20.019466627212218 and parameters: {'model_name': 'SimpleImputer', 'strategy': 'most_frequent'}. Best is trial 2 with value: 20.009629735591854.
[I 2024-02-23 07:07:12,670] Trial 103 finished with value: 20.009629735591854 and parameters: {'model_name': 'SimpleImputer', 'strategy': 'mean'}. Best is trial 2 with value: 20.009629735591854.
[I 2024-02-23 07:07:13,010] Trial 68 finished with value: 20.019466627212218 and parameters: {'model_name': 'SimpleImputer', 'strategy': 'most_frequent'}. Best is trial 2 with value: 20.009629735591854.
[I 2024-02-23 07:07:13,180] Trial 59 finished with value: 20.019466627212218 and parameters: {'model_name': 'SimpleImputer', 'strategy': 'most_frequent'}. Best is trial 2 with value: 20.009629735591854.
[I 2024-02-23 07:07:13,420] Trial 106 finished with value: 20.009629735591854 and parameters: {'model_name': 'SimpleImputer', 'strategy': 'mean'}. Best is trial 2 with value: 20.009629735591854.
[I 2024-02-23 07:07:13,818] Trial 73 finished with value: 20.019466627212218 and parameters: {'model_name': 'SimpleImputer', 'strategy': 'most_frequent'}. Best is trial 2 with value: 20.009629735591854.
[I 2024-02-23 07:07:14,134] Trial 81 finished with value: 20.019466627212218 and parameters: {'model_name': 'SimpleImputer', 'strategy': 'most_frequent'}. Best is trial 2 with value: 20.009629735591854.
[I 2024-02-23 07:07:14,341] Trial 74 finished with value: 20.019466627212218 and parameters: {'model_name': 'SimpleImputer', 'strategy': 'most_frequent'}. Best is trial 2 with value: 20.009629735591854.
[I 2024-02-23 07:07:14,716] Trial 67 finished with value: 20.019466627212218 and parameters: {'model_name': 'SimpleImputer', 'strategy': 'most_frequent'}. Best is trial 2 with value: 20.009629735591854.
[I 2024-02-23 07:07:14,912] Trial 78 finished with value: 20.019466627212218 and parameters: {'model_name': 'SimpleImputer', 'strategy': 'most_frequent'}. Best is trial 2 with value: 20.009629735591854.
