[I 2024-02-11 05:15:37,135] Trial 2 finished with value: 6.378425071156134 and parameters: {'model_name': 'SimpleImputer', 'strategy': 'constant'}. Best is trial 2 with value: 6.378425071156134.
[I 2024-02-11 05:15:37,738] Trial 7 finished with value: 6.378425071156134 and parameters: {'model_name': 'SimpleImputer', 'strategy': 'constant'}. Best is trial 2 with value: 6.378425071156134.
[I 2024-02-11 05:15:38,480] Trial 4 finished with value: 6.378425071156134 and parameters: {'model_name': 'SimpleImputer', 'strategy': 'constant'}. Best is trial 2 with value: 6.378425071156134.
[I 2024-02-11 05:15:39,469] Trial 16 finished with value: 5.120528438465917 and parameters: {'model_name': 'SimpleImputer', 'strategy': 'mean'}. Best is trial 16 with value: 5.120528438465917.
[I 2024-02-11 05:15:41,380] Trial 3 finished with value: 5.453480590643743 and parameters: {'model_name': 'SimpleImputer', 'strategy': 'median'}. Best is trial 16 with value: 5.120528438465917.
[I 2024-02-11 05:15:42,122] Trial 14 finished with value: 5.453480590643743 and parameters: {'model_name': 'SimpleImputer', 'strategy': 'median'}. Best is trial 16 with value: 5.120528438465917.
[I 2024-02-11 05:15:43,169] Trial 36 finished with value: 6.378425071156134 and parameters: {'model_name': 'SimpleImputer', 'strategy': 'constant'}. Best is trial 16 with value: 5.120528438465917.
[I 2024-02-11 05:15:46,581] Trial 50 finished with value: 5.120528438465917 and parameters: {'model_name': 'SimpleImputer', 'strategy': 'mean'}. Best is trial 16 with value: 5.120528438465917.
2024-02-11 05:15:47.282861: E external/local_xla/xla/stream_executor/cuda/cuda_driver.cc:274] failed call to cuInit: CUDA_ERROR_NO_DEVICE: no CUDA-capable device is detected
2024-02-11 05:15:47.446141: I tensorflow/compiler/mlir/mlir_graph_optimization_pass.cc:388] MLIR V1 optimization pass is not enabled
[I 2024-02-11 05:15:47,803] Trial 38 finished with value: 5.453480590643743 and parameters: {'model_name': 'SimpleImputer', 'strategy': 'median'}. Best is trial 16 with value: 5.120528438465917.
[I 2024-02-11 05:15:48,405] Trial 33 finished with value: 5.453480590643743 and parameters: {'model_name': 'SimpleImputer', 'strategy': 'median'}. Best is trial 16 with value: 5.120528438465917.
[I 2024-02-11 05:15:54,711] Trial 55 finished with value: 5.453480590643743 and parameters: {'model_name': 'SimpleImputer', 'strategy': 'median'}. Best is trial 16 with value: 5.120528438465917.
[I 2024-02-11 05:15:59,652] Trial 15 finished with value: 5.790050433540201 and parameters: {'model_name': 'SimpleImputer', 'strategy': 'most_frequent'}. Best is trial 16 with value: 5.120528438465917.
[I 2024-02-11 05:16:06,387] Trial 13 finished with value: 5.790050433540201 and parameters: {'model_name': 'SimpleImputer', 'strategy': 'most_frequent'}. Best is trial 16 with value: 5.120528438465917.
[I 2024-02-11 05:16:07,565] Trial 46 finished with value: 5.790050433540201 and parameters: {'model_name': 'SimpleImputer', 'strategy': 'most_frequent'}. Best is trial 16 with value: 5.120528438465917.
[I 2024-02-11 05:16:09,269] Trial 29 finished with value: 5.790050433540201 and parameters: {'model_name': 'SimpleImputer', 'strategy': 'most_frequent'}. Best is trial 16 with value: 5.120528438465917.
[I 2024-02-11 05:16:10,701] Trial 51 finished with value: 5.790050433540201 and parameters: {'model_name': 'SimpleImputer', 'strategy': 'most_frequent'}. Best is trial 16 with value: 5.120528438465917.
[I 2024-02-11 05:16:18,622] Trial 11 finished with value: 1.6840743081493854 and parameters: {'model_name': 'KNNImputer', 'weights': 'distance', 'keep_empty_features': False}. Best is trial 11 with value: 1.6840743081493854.
[I 2024-02-11 05:16:20,168] Trial 8 finished with value: 1.6840743081493854 and parameters: {'model_name': 'KNNImputer', 'weights': 'distance', 'keep_empty_features': False}. Best is trial 11 with value: 1.6840743081493854.
[I 2024-02-11 05:16:21,912] Trial 19 finished with value: 1.7189776048236596 and parameters: {'model_name': 'KNNImputer', 'weights': 'uniform', 'keep_empty_features': False}. Best is trial 11 with value: 1.6840743081493854.
[I 2024-02-11 05:16:22,730] Trial 23 finished with value: 1.7189776048236596 and parameters: {'model_name': 'KNNImputer', 'weights': 'uniform', 'keep_empty_features': False}. Best is trial 11 with value: 1.6840743081493854.
[I 2024-02-11 05:16:23,354] Trial 20 finished with value: 1.7189776048236596 and parameters: {'model_name': 'KNNImputer', 'weights': 'uniform', 'keep_empty_features': False}. Best is trial 11 with value: 1.6840743081493854.
[I 2024-02-11 05:16:24,221] Trial 27 finished with value: 1.7189776048236596 and parameters: {'model_name': 'KNNImputer', 'weights': 'uniform', 'keep_empty_features': False}. Best is trial 11 with value: 1.6840743081493854.
[I 2024-02-11 05:16:24,786] Trial 12 finished with value: 1.7189776048236596 and parameters: {'model_name': 'KNNImputer', 'weights': 'uniform', 'keep_empty_features': False}. Best is trial 11 with value: 1.6840743081493854.
[I 2024-02-11 05:16:25,633] Trial 34 finished with value: 1.6840743081493854 and parameters: {'model_name': 'KNNImputer', 'weights': 'distance', 'keep_empty_features': False}. Best is trial 11 with value: 1.6840743081493854.
[I 2024-02-11 05:16:27,474] Trial 45 finished with value: 1.6840743081493854 and parameters: {'model_name': 'KNNImputer', 'weights': 'distance', 'keep_empty_features': False}. Best is trial 11 with value: 1.6840743081493854.
[I 2024-02-11 05:16:29,207] Trial 35 finished with value: 1.6840743081493854 and parameters: {'model_name': 'KNNImputer', 'weights': 'distance', 'keep_empty_features': False}. Best is trial 11 with value: 1.6840743081493854.
[I 2024-02-11 05:16:30,947] Trial 53 finished with value: 1.6840743081493854 and parameters: {'model_name': 'KNNImputer', 'weights': 'distance', 'keep_empty_features': False}. Best is trial 11 with value: 1.6840743081493854.
[I 2024-02-11 05:16:37,678] Trial 52 finished with value: 5.120528438465917 and parameters: {'model_name': 'RandomForestImputer', 'max_iter': 1, 'decreasing': False, 'min_samples_split': 0.2, 'min_samples_leaf': 0.6, 'max_features': 0.9, 'warm_start': True}. Best is trial 11 with value: 1.6840743081493854.
[I 2024-02-11 05:16:38,309] Trial 58 finished with value: 1.6840743081493854 and parameters: {'model_name': 'KNNImputer', 'weights': 'distance', 'keep_empty_features': False}. Best is trial 11 with value: 1.6840743081493854.
[I 2024-02-11 05:16:49,260] Trial 63 finished with value: 1.7189776048236596 and parameters: {'model_name': 'KNNImputer', 'weights': 'uniform', 'keep_empty_features': False}. Best is trial 11 with value: 1.6840743081493854.
[I 2024-02-11 05:16:55,602] Trial 65 finished with value: 1.6840743081493854 and parameters: {'model_name': 'KNNImputer', 'weights': 'distance', 'keep_empty_features': False}. Best is trial 11 with value: 1.6840743081493854.
[I 2024-02-11 05:16:56,608] Trial 64 finished with value: 1.6840743081493854 and parameters: {'model_name': 'KNNImputer', 'weights': 'distance', 'keep_empty_features': False}. Best is trial 11 with value: 1.6840743081493854.
[I 2024-02-11 05:16:57,231] Trial 68 finished with value: 1.6840743081493854 and parameters: {'model_name': 'KNNImputer', 'weights': 'distance', 'keep_empty_features': False}. Best is trial 11 with value: 1.6840743081493854.
[I 2024-02-11 05:16:58,842] Trial 66 finished with value: 1.6840743081493854 and parameters: {'model_name': 'KNNImputer', 'weights': 'distance', 'keep_empty_features': False}. Best is trial 11 with value: 1.6840743081493854.
[I 2024-02-11 05:16:59,412] Trial 67 finished with value: 1.6840743081493854 and parameters: {'model_name': 'KNNImputer', 'weights': 'distance', 'keep_empty_features': False}. Best is trial 11 with value: 1.6840743081493854.
[I 2024-02-11 05:17:32,440] Trial 70 finished with value: 5.58054900283391 and parameters: {'model_name': 'RandomForestImputer', 'max_iter': 2, 'decreasing': False, 'min_samples_split': 0.8, 'min_samples_leaf': 0.6, 'max_features': 0.7000000000000001, 'warm_start': True}. Best is trial 11 with value: 1.6840743081493854.
[I 2024-02-11 05:17:42,006] Trial 22 finished with value: 5.71014239676962 and parameters: {'model_name': 'RandomForestImputer', 'max_iter': 3, 'decreasing': True, 'min_samples_split': 0.0, 'min_samples_leaf': 0.7000000000000001, 'max_features': 0.9, 'warm_start': True}. Best is trial 11 with value: 1.6840743081493854.
[I 2024-02-11 05:17:45,513] Trial 47 finished with value: 12.593137099753342 and parameters: {'model_name': 'GAIN', 'batch_size': 48, 'hint_rate': 0.18000000000000002, 'alpha': 78, 'iterations': 1}. Best is trial 11 with value: 1.6840743081493854.
[I 2024-02-11 05:17:49,966] Trial 0 finished with value: 13.006593333149656 and parameters: {'model_name': 'GAIN', 'batch_size': 80, 'hint_rate': 0.8300000000000001, 'alpha': 50, 'iterations': 4}. Best is trial 11 with value: 1.6840743081493854.
[I 2024-02-11 05:17:54,158] Trial 62 finished with value: 13.579565394451302 and parameters: {'model_name': 'GAIN', 'batch_size': 10, 'hint_rate': 0.02, 'alpha': 37, 'iterations': 1}. Best is trial 11 with value: 1.6840743081493854.
[I 2024-02-11 05:17:56,842] Trial 18 finished with value: 12.592086548944675 and parameters: {'model_name': 'GAIN', 'batch_size': 9, 'hint_rate': 0.51, 'alpha': 6, 'iterations': 5}. Best is trial 11 with value: 1.6840743081493854.
[I 2024-02-11 05:18:08,960] Trial 48 finished with value: 5.120528438465917 and parameters: {'model_name': 'RandomForestImputer', 'max_iter': 1, 'decreasing': True, 'min_samples_split': 0.0, 'min_samples_leaf': 0.5, 'max_features': 0.8, 'warm_start': False}. Best is trial 11 with value: 1.6840743081493854.
[I 2024-02-11 05:18:10,376] Trial 54 finished with value: 5.120528438465917 and parameters: {'model_name': 'RandomForestImputer', 'max_iter': 1, 'decreasing': False, 'min_samples_split': 0.2, 'min_samples_leaf': 0.9, 'max_features': 0.9, 'warm_start': False}. Best is trial 11 with value: 1.6840743081493854.
[I 2024-02-11 05:18:13,478] Trial 39 finished with value: 5.120528438465917 and parameters: {'model_name': 'RandomForestImputer', 'max_iter': 1, 'decreasing': False, 'min_samples_split': 0.6000000000000001, 'min_samples_leaf': 0.1, 'max_features': 0.9, 'warm_start': False}. Best is trial 11 with value: 1.6840743081493854.
[I 2024-02-11 05:18:14,771] Trial 49 finished with value: 5.120528438465917 and parameters: {'model_name': 'RandomForestImputer', 'max_iter': 1, 'decreasing': False, 'min_samples_split': 0.6000000000000001, 'min_samples_leaf': 0.1, 'max_features': 0.30000000000000004, 'warm_start': False}. Best is trial 11 with value: 1.6840743081493854.
[I 2024-02-11 05:18:34,602] Trial 90 finished with value: 1.6840743081493854 and parameters: {'model_name': 'KNNImputer', 'weights': 'distance', 'keep_empty_features': False}. Best is trial 11 with value: 1.6840743081493854.
[I 2024-02-11 05:18:37,770] Trial 91 finished with value: 1.6840743081493854 and parameters: {'model_name': 'KNNImputer', 'weights': 'distance', 'keep_empty_features': False}. Best is trial 11 with value: 1.6840743081493854.
[I 2024-02-11 05:18:54,430] Trial 57 finished with value: 5.424722787343532 and parameters: {'model_name': 'RandomForestImputer', 'max_iter': 7, 'decreasing': False, 'min_samples_split': 0.1, 'min_samples_leaf': 0.1, 'max_features': 0.2, 'warm_start': True}. Best is trial 11 with value: 1.6840743081493854.
[I 2024-02-11 05:19:04,103] Trial 84 finished with value: 13.709620391783954 and parameters: {'model_name': 'GAIN', 'batch_size': 102, 'hint_rate': 0.9400000000000001, 'alpha': 12, 'iterations': 1}. Best is trial 11 with value: 1.6840743081493854.
[I 2024-02-11 05:19:18,933] Trial 32 finished with value: 10.856637024042342 and parameters: {'model_name': 'GAIN', 'batch_size': 99, 'hint_rate': 0.61, 'alpha': 82, 'iterations': 24}. Best is trial 11 with value: 1.6840743081493854.
[I 2024-02-11 05:19:51,865] Trial 28 finished with value: 5.5411908611512946 and parameters: {'model_name': 'RandomForestImputer', 'max_iter': 14, 'decreasing': False, 'min_samples_split': 0.5, 'min_samples_leaf': 0.2, 'max_features': 0.1, 'warm_start': True}. Best is trial 11 with value: 1.6840743081493854.
[I 2024-02-11 05:21:01,917] Trial 60 finished with value: 4.794808761128198 and parameters: {'model_name': 'RandomForestImputer', 'max_iter': 2, 'decreasing': False, 'min_samples_split': 0.4, 'min_samples_leaf': 0.2, 'max_features': 0.30000000000000004, 'warm_start': False}. Best is trial 11 with value: 1.6840743081493854.
[I 2024-02-11 05:22:02,218] Trial 24 finished with value: 7.85453259848788 and parameters: {'model_name': 'GAIN', 'batch_size': 17, 'hint_rate': 0.43, 'alpha': 88, 'iterations': 67}. Best is trial 11 with value: 1.6840743081493854.
[I 2024-02-11 05:22:08,839] Trial 43 finished with value: 5.703960816036544 and parameters: {'model_name': 'RandomForestImputer', 'max_iter': 36, 'decreasing': True, 'min_samples_split': 0.7000000000000001, 'min_samples_leaf': 0.9, 'max_features': 0.2, 'warm_start': True}. Best is trial 11 with value: 1.6840743081493854.
[I 2024-02-11 05:22:53,311] Trial 40 finished with value: inf and parameters: {'model_name': 'GAIN', 'batch_size': 75, 'hint_rate': 0.55, 'alpha': 56, 'iterations': 918}. Best is trial 11 with value: 1.6840743081493854.
[I 2024-02-11 05:23:19,083] Trial 17 finished with value: 7.086631896528796 and parameters: {'model_name': 'GAIN', 'batch_size': 1, 'hint_rate': 0.5700000000000001, 'alpha': 59, 'iterations': 90}. Best is trial 11 with value: 1.6840743081493854.
[I 2024-02-11 05:24:29,906] Trial 44 finished with value: 1.88957522153452 and parameters: {'model_name': 'IterativeImputer', 'sample_posterior': False, 'initial_strategy': 'most_frequent', 'imputation_order': 'ascending'}. Best is trial 11 with value: 1.6840743081493854.
[I 2024-02-11 05:24:50,738] Trial 5 finished with value: 1.8895782154609795 and parameters: {'model_name': 'IterativeImputer', 'sample_posterior': False, 'initial_strategy': 'most_frequent', 'imputation_order': 'descending'}. Best is trial 11 with value: 1.6840743081493854.
[I 2024-02-11 05:25:09,473] Trial 76 finished with value: 1.8895860956125123 and parameters: {'model_name': 'IterativeImputer', 'sample_posterior': False, 'initial_strategy': 'constant', 'imputation_order': 'random'}. Best is trial 11 with value: 1.6840743081493854.
[I 2024-02-11 05:25:15,288] Trial 105 finished with value: 1.6840743081493854 and parameters: {'model_name': 'KNNImputer', 'weights': 'distance', 'keep_empty_features': False}. Best is trial 11 with value: 1.6840743081493854.
[I 2024-02-11 05:25:30,194] Trial 88 finished with value: 1.889574301847981 and parameters: {'model_name': 'IterativeImputer', 'sample_posterior': False, 'initial_strategy': 'constant', 'imputation_order': 'ascending'}. Best is trial 11 with value: 1.6840743081493854.
[I 2024-02-11 05:25:34,474] Trial 106 finished with value: 1.6840743081493854 and parameters: {'model_name': 'KNNImputer', 'weights': 'distance', 'keep_empty_features': False}. Best is trial 11 with value: 1.6840743081493854.
[I 2024-02-11 05:25:42,093] Trial 107 finished with value: 1.6840743081493854 and parameters: {'model_name': 'KNNImputer', 'weights': 'distance', 'keep_empty_features': False}. Best is trial 11 with value: 1.6840743081493854.
[I 2024-02-11 05:25:56,234] Trial 108 finished with value: 1.6840743081493854 and parameters: {'model_name': 'KNNImputer', 'weights': 'distance', 'keep_empty_features': False}. Best is trial 11 with value: 1.6840743081493854.
[I 2024-02-11 05:26:01,885] Trial 109 finished with value: 1.6840743081493854 and parameters: {'model_name': 'KNNImputer', 'weights': 'distance', 'keep_empty_features': False}. Best is trial 11 with value: 1.6840743081493854.
[I 2024-02-11 05:26:07,851] Trial 110 finished with value: 1.6840743081493854 and parameters: {'model_name': 'KNNImputer', 'weights': 'distance', 'keep_empty_features': False}. Best is trial 11 with value: 1.6840743081493854.
[I 2024-02-11 05:26:21,047] Trial 111 finished with value: 1.6840743081493854 and parameters: {'model_name': 'KNNImputer', 'weights': 'distance', 'keep_empty_features': False}. Best is trial 11 with value: 1.6840743081493854.
[I 2024-02-11 05:26:27,404] Trial 112 finished with value: 1.6840743081493854 and parameters: {'model_name': 'KNNImputer', 'weights': 'distance', 'keep_empty_features': False}. Best is trial 11 with value: 1.6840743081493854.
[I 2024-02-11 05:26:31,338] Trial 87 finished with value: 1.889577590416883 and parameters: {'model_name': 'IterativeImputer', 'sample_posterior': False, 'initial_strategy': 'mean', 'imputation_order': 'roman'}. Best is trial 11 with value: 1.6840743081493854.
[I 2024-02-11 05:26:32,979] Trial 113 finished with value: 1.6840743081493854 and parameters: {'model_name': 'KNNImputer', 'weights': 'distance', 'keep_empty_features': False}. Best is trial 11 with value: 1.6840743081493854.
[I 2024-02-11 05:26:41,805] Trial 85 finished with value: 1.889585428569935 and parameters: {'model_name': 'IterativeImputer', 'sample_posterior': False, 'initial_strategy': 'constant', 'imputation_order': 'random'}. Best is trial 11 with value: 1.6840743081493854.
[I 2024-02-11 05:26:48,917] Trial 114 finished with value: 1.6840743081493854 and parameters: {'model_name': 'KNNImputer', 'weights': 'distance', 'keep_empty_features': False}. Best is trial 11 with value: 1.6840743081493854.
[I 2024-02-11 05:26:57,188] Trial 115 finished with value: 1.6840743081493854 and parameters: {'model_name': 'KNNImputer', 'weights': 'distance', 'keep_empty_features': False}. Best is trial 11 with value: 1.6840743081493854.
[I 2024-02-11 05:27:01,294] Trial 116 finished with value: 1.6840743081493854 and parameters: {'model_name': 'KNNImputer', 'weights': 'distance', 'keep_empty_features': False}. Best is trial 11 with value: 1.6840743081493854.
[I 2024-02-11 05:27:03,064] Trial 93 finished with value: 1.88957522153452 and parameters: {'model_name': 'IterativeImputer', 'sample_posterior': False, 'initial_strategy': 'most_frequent', 'imputation_order': 'ascending'}. Best is trial 11 with value: 1.6840743081493854.
[I 2024-02-11 05:27:03,067] Trial 117 finished with value: 1.6840743081493854 and parameters: {'model_name': 'KNNImputer', 'weights': 'distance', 'keep_empty_features': False}. Best is trial 11 with value: 1.6840743081493854.
[I 2024-02-11 05:27:10,047] Trial 89 finished with value: 1.8895799962806685 and parameters: {'model_name': 'IterativeImputer', 'sample_posterior': False, 'initial_strategy': 'most_frequent', 'imputation_order': 'arabic'}. Best is trial 11 with value: 1.6840743081493854.
[I 2024-02-11 05:27:13,558] Trial 118 finished with value: 1.6840743081493854 and parameters: {'model_name': 'KNNImputer', 'weights': 'distance', 'keep_empty_features': False}. Best is trial 11 with value: 1.6840743081493854.
[I 2024-02-11 05:27:15,337] Trial 92 finished with value: 1.8895876024404743 and parameters: {'model_name': 'IterativeImputer', 'sample_posterior': False, 'initial_strategy': 'constant', 'imputation_order': 'roman'}. Best is trial 11 with value: 1.6840743081493854.
[I 2024-02-11 05:27:22,587] Trial 119 finished with value: 1.6840743081493854 and parameters: {'model_name': 'KNNImputer', 'weights': 'distance', 'keep_empty_features': False}. Best is trial 11 with value: 1.6840743081493854.
[I 2024-02-11 05:27:31,209] Trial 120 finished with value: 1.6840743081493854 and parameters: {'model_name': 'KNNImputer', 'weights': 'distance', 'keep_empty_features': False}. Best is trial 11 with value: 1.6840743081493854.
[I 2024-02-11 05:27:35,043] Trial 121 finished with value: 1.6840743081493854 and parameters: {'model_name': 'KNNImputer', 'weights': 'distance', 'keep_empty_features': False}. Best is trial 11 with value: 1.6840743081493854.
[I 2024-02-11 05:27:37,799] Trial 122 finished with value: 1.6840743081493854 and parameters: {'model_name': 'KNNImputer', 'weights': 'distance', 'keep_empty_features': False}. Best is trial 11 with value: 1.6840743081493854.
[I 2024-02-11 05:27:39,714] Trial 123 finished with value: 1.6840743081493854 and parameters: {'model_name': 'KNNImputer', 'weights': 'distance', 'keep_empty_features': False}. Best is trial 11 with value: 1.6840743081493854.
[I 2024-02-11 05:27:44,672] Trial 124 finished with value: 1.6840743081493854 and parameters: {'model_name': 'KNNImputer', 'weights': 'distance', 'keep_empty_features': False}. Best is trial 11 with value: 1.6840743081493854.
[I 2024-02-11 05:27:47,967] Trial 94 finished with value: 1.8895876024404743 and parameters: {'model_name': 'IterativeImputer', 'sample_posterior': False, 'initial_strategy': 'constant', 'imputation_order': 'roman'}. Best is trial 11 with value: 1.6840743081493854.
[I 2024-02-11 05:27:51,080] Trial 125 finished with value: 1.6840743081493854 and parameters: {'model_name': 'KNNImputer', 'weights': 'distance', 'keep_empty_features': False}. Best is trial 11 with value: 1.6840743081493854.
[I 2024-02-11 05:27:52,573] Trial 126 finished with value: 1.6840743081493854 and parameters: {'model_name': 'KNNImputer', 'weights': 'distance', 'keep_empty_features': False}. Best is trial 11 with value: 1.6840743081493854.
[I 2024-02-11 05:28:01,221] Trial 127 finished with value: 1.6840743081493854 and parameters: {'model_name': 'KNNImputer', 'weights': 'distance', 'keep_empty_features': False}. Best is trial 11 with value: 1.6840743081493854.
[I 2024-02-11 05:28:10,836] Trial 128 finished with value: 1.6840743081493854 and parameters: {'model_name': 'KNNImputer', 'weights': 'distance', 'keep_empty_features': False}. Best is trial 11 with value: 1.6840743081493854.
[I 2024-02-11 05:28:12,952] Trial 129 finished with value: 1.6840743081493854 and parameters: {'model_name': 'KNNImputer', 'weights': 'distance', 'keep_empty_features': False}. Best is trial 11 with value: 1.6840743081493854.
