[I 2024-03-01 07:11:23,477] Trial 3 finished with value: 22.814197108057588 and parameters: {'model_name': 'SimpleImputer', 'strategy': 'constant'}. Best is trial 3 with value: 22.814197108057588.
2024-03-01 07:11:26.374037: E external/local_xla/xla/stream_executor/cuda/cuda_driver.cc:274] failed call to cuInit: CUDA_ERROR_NO_DEVICE: no CUDA-capable device is detected
[I 2024-03-01 07:11:26,534] Trial 18 finished with value: 22.814197108057588 and parameters: {'model_name': 'SimpleImputer', 'strategy': 'constant'}. Best is trial 3 with value: 22.814197108057588.
2024-03-01 07:11:27.370107: I tensorflow/compiler/mlir/mlir_graph_optimization_pass.cc:388] MLIR V1 optimization pass is not enabled
[I 2024-03-01 07:11:27,824] Trial 26 finished with value: 7.7198746616678475 and parameters: {'model_name': 'SimpleImputer', 'strategy': 'mean'}. Best is trial 26 with value: 7.7198746616678475.
[I 2024-03-01 07:11:29,307] Trial 48 finished with value: 22.814197108057588 and parameters: {'model_name': 'SimpleImputer', 'strategy': 'constant'}. Best is trial 26 with value: 7.7198746616678475.
[I 2024-03-01 07:11:30,244] Trial 40 finished with value: 22.814197108057588 and parameters: {'model_name': 'SimpleImputer', 'strategy': 'constant'}. Best is trial 26 with value: 7.7198746616678475.
[I 2024-03-01 07:11:31,236] Trial 25 finished with value: 7.7198746616678475 and parameters: {'model_name': 'SimpleImputer', 'strategy': 'mean'}. Best is trial 26 with value: 7.7198746616678475.
[I 2024-03-01 07:11:32,041] Trial 17 finished with value: 4.15507044270351 and parameters: {'model_name': 'SimpleImputer', 'strategy': 'median'}. Best is trial 17 with value: 4.15507044270351.
[I 2024-03-01 07:11:32,545] Trial 45 finished with value: 22.814197108057588 and parameters: {'model_name': 'SimpleImputer', 'strategy': 'constant'}. Best is trial 17 with value: 4.15507044270351.
[I 2024-03-01 07:11:33,017] Trial 39 finished with value: 7.7198746616678475 and parameters: {'model_name': 'SimpleImputer', 'strategy': 'mean'}. Best is trial 17 with value: 4.15507044270351.
[I 2024-03-01 07:11:34,823] Trial 44 finished with value: 4.15507044270351 and parameters: {'model_name': 'SimpleImputer', 'strategy': 'median'}. Best is trial 17 with value: 4.15507044270351.
[I 2024-03-01 07:11:36,562] Trial 52 finished with value: 22.814197108057588 and parameters: {'model_name': 'SimpleImputer', 'strategy': 'constant'}. Best is trial 17 with value: 4.15507044270351.
[I 2024-03-01 07:11:37,648] Trial 53 finished with value: 22.814197108057588 and parameters: {'model_name': 'SimpleImputer', 'strategy': 'constant'}. Best is trial 17 with value: 4.15507044270351.
[I 2024-03-01 07:11:43,548] Trial 6 finished with value: 21.936194553989335 and parameters: {'model_name': 'SimpleImputer', 'strategy': 'most_frequent'}. Best is trial 17 with value: 4.15507044270351.
[I 2024-03-01 07:11:48,801] Trial 47 finished with value: 21.936194553989335 and parameters: {'model_name': 'SimpleImputer', 'strategy': 'most_frequent'}. Best is trial 17 with value: 4.15507044270351.
[I 2024-03-01 07:11:50,906] Trial 9 finished with value: 7.946767203729467 and parameters: {'model_name': 'KNNImputer', 'weights': 'uniform', 'keep_empty_features': False}. Best is trial 17 with value: 4.15507044270351.
[I 2024-03-01 07:11:51,543] Trial 1 finished with value: 8.062776969344647 and parameters: {'model_name': 'KNNImputer', 'weights': 'distance', 'keep_empty_features': False}. Best is trial 17 with value: 4.15507044270351.
[I 2024-03-01 07:11:52,190] Trial 2 finished with value: 7.946767203729467 and parameters: {'model_name': 'KNNImputer', 'weights': 'uniform', 'keep_empty_features': False}. Best is trial 17 with value: 4.15507044270351.
[I 2024-03-01 07:11:52,666] Trial 12 finished with value: 8.062776969344647 and parameters: {'model_name': 'KNNImputer', 'weights': 'distance', 'keep_empty_features': False}. Best is trial 17 with value: 4.15507044270351.
[I 2024-03-01 07:11:53,702] Trial 14 finished with value: 8.062776969344647 and parameters: {'model_name': 'KNNImputer', 'weights': 'distance', 'keep_empty_features': False}. Best is trial 17 with value: 4.15507044270351.
[I 2024-03-01 07:11:55,339] Trial 46 finished with value: 8.062776969344647 and parameters: {'model_name': 'KNNImputer', 'weights': 'distance', 'keep_empty_features': False}. Best is trial 17 with value: 4.15507044270351.
[I 2024-03-01 07:11:55,896] Trial 41 finished with value: 7.946767203729467 and parameters: {'model_name': 'KNNImputer', 'weights': 'uniform', 'keep_empty_features': False}. Best is trial 17 with value: 4.15507044270351.
[I 2024-03-01 07:11:57,046] Trial 30 finished with value: 7.946767203729467 and parameters: {'model_name': 'KNNImputer', 'weights': 'uniform', 'keep_empty_features': False}. Best is trial 17 with value: 4.15507044270351.
[I 2024-03-01 07:11:58,371] Trial 35 finished with value: 7.946767203729467 and parameters: {'model_name': 'KNNImputer', 'weights': 'uniform', 'keep_empty_features': False}. Best is trial 17 with value: 4.15507044270351.
[I 2024-03-01 07:11:59,507] Trial 49 finished with value: 7.946767203729467 and parameters: {'model_name': 'KNNImputer', 'weights': 'uniform', 'keep_empty_features': False}. Best is trial 17 with value: 4.15507044270351.
[I 2024-03-01 07:12:00,788] Trial 51 finished with value: 8.062776969344647 and parameters: {'model_name': 'KNNImputer', 'weights': 'distance', 'keep_empty_features': False}. Best is trial 17 with value: 4.15507044270351.
[I 2024-03-01 07:12:09,478] Trial 61 finished with value: 7.946767203729467 and parameters: {'model_name': 'KNNImputer', 'weights': 'uniform', 'keep_empty_features': False}. Best is trial 17 with value: 4.15507044270351.
[I 2024-03-01 07:12:10,579] Trial 56 finished with value: 7.7198746616678475 and parameters: {'model_name': 'RandomForestImputer', 'max_iter': 1, 'decreasing': True, 'min_samples_split': 0.9, 'min_samples_leaf': 0.8, 'max_features': 0.6, 'warm_start': True}. Best is trial 17 with value: 4.15507044270351.
[I 2024-03-01 07:12:33,056] Trial 37 finished with value: 22.285567070950187 and parameters: {'model_name': 'RandomForestImputer', 'max_iter': 2, 'decreasing': True, 'min_samples_split': 0.9, 'min_samples_leaf': 0.2, 'max_features': 0.2, 'warm_start': True}. Best is trial 17 with value: 4.15507044270351.
[I 2024-03-01 07:12:35,713] Trial 57 finished with value: 24.505338621642046 and parameters: {'model_name': 'RandomForestImputer', 'max_iter': 2, 'decreasing': False, 'min_samples_split': 0.2, 'min_samples_leaf': 0.6, 'max_features': 0.5, 'warm_start': True}. Best is trial 17 with value: 4.15507044270351.
[I 2024-03-01 07:12:50,745] Trial 34 finished with value: 24.412612194229123 and parameters: {'model_name': 'RandomForestImputer', 'max_iter': 4, 'decreasing': False, 'min_samples_split': 0.0, 'min_samples_leaf': 0.7000000000000001, 'max_features': 0.6, 'warm_start': True}. Best is trial 17 with value: 4.15507044270351.
[I 2024-03-01 07:12:58,619] Trial 55 finished with value: 7.7198746616678475 and parameters: {'model_name': 'RandomForestImputer', 'max_iter': 1, 'decreasing': True, 'min_samples_split': 0.4, 'min_samples_leaf': 0.6, 'max_features': 0.9, 'warm_start': False}. Best is trial 17 with value: 4.15507044270351.
[I 2024-03-01 07:12:59,914] Trial 19 finished with value: 7.7198746616678475 and parameters: {'model_name': 'RandomForestImputer', 'max_iter': 1, 'decreasing': False, 'min_samples_split': 0.2, 'min_samples_leaf': 0.7000000000000001, 'max_features': 0.9, 'warm_start': False}. Best is trial 17 with value: 4.15507044270351.
[I 2024-03-01 07:13:09,719] Trial 8 finished with value: 24.47895762486765 and parameters: {'model_name': 'RandomForestImputer', 'max_iter': 7, 'decreasing': False, 'min_samples_split': 0.30000000000000004, 'min_samples_leaf': 0.5, 'max_features': 0.7000000000000001, 'warm_start': True}. Best is trial 17 with value: 4.15507044270351.
[I 2024-03-01 07:13:13,933] Trial 0 finished with value: 9.8533257551424 and parameters: {'model_name': 'GAIN', 'batch_size': 199, 'hint_rate': 0.47000000000000003, 'alpha': 49, 'iterations': 3}. Best is trial 17 with value: 4.15507044270351.
[I 2024-03-01 07:13:31,205] Trial 67 finished with value: 9.625782463490461 and parameters: {'model_name': 'GAIN', 'batch_size': 25, 'hint_rate': 0.27, 'alpha': 64, 'iterations': 5}. Best is trial 17 with value: 4.15507044270351.
[I 2024-03-01 07:13:35,236] Trial 58 finished with value: 9.905605810354501 and parameters: {'model_name': 'GAIN', 'batch_size': 1, 'hint_rate': 0.46, 'alpha': 100, 'iterations': 9}. Best is trial 17 with value: 4.15507044270351.
[I 2024-03-01 07:13:38,099] Trial 29 finished with value: 24.424611393131418 and parameters: {'model_name': 'RandomForestImputer', 'max_iter': 9, 'decreasing': False, 'min_samples_split': 0.30000000000000004, 'min_samples_leaf': 0.30000000000000004, 'max_features': 0.1, 'warm_start': True}. Best is trial 17 with value: 4.15507044270351.
[I 2024-03-01 07:13:43,224] Trial 16 finished with value: 24.444446259273054 and parameters: {'model_name': 'RandomForestImputer', 'max_iter': 13, 'decreasing': False, 'min_samples_split': 0.0, 'min_samples_leaf': 0.9, 'max_features': 0.4, 'warm_start': True}. Best is trial 17 with value: 4.15507044270351.
[I 2024-03-01 07:13:44,320] Trial 21 finished with value: 8.782500435092743 and parameters: {'model_name': 'GAIN', 'batch_size': 810, 'hint_rate': 0.81, 'alpha': 40, 'iterations': 11}. Best is trial 17 with value: 4.15507044270351.
[I 2024-03-01 07:13:52,619] Trial 76 finished with value: 11.431068045068606 and parameters: {'model_name': 'GAIN', 'batch_size': 50, 'hint_rate': 0.99, 'alpha': 18, 'iterations': 1}. Best is trial 17 with value: 4.15507044270351.
[I 2024-03-01 07:13:54,368] Trial 13 finished with value: 8.758674229139029 and parameters: {'model_name': 'GAIN', 'batch_size': 4, 'hint_rate': 0.73, 'alpha': 78, 'iterations': 22}. Best is trial 17 with value: 4.15507044270351.
[I 2024-03-01 07:13:58,190] Trial 63 finished with value: 22.2638391846935 and parameters: {'model_name': 'RandomForestImputer', 'max_iter': 19, 'decreasing': True, 'min_samples_split': 0.0, 'min_samples_leaf': 0.9, 'max_features': 0.9, 'warm_start': True}. Best is trial 17 with value: 4.15507044270351.
[I 2024-03-01 07:14:26,509] Trial 50 finished with value: 6.810126888466629 and parameters: {'model_name': 'IterativeImputer', 'sample_posterior': False, 'initial_strategy': 'mean', 'imputation_order': 'descending'}. Best is trial 17 with value: 4.15507044270351.
[I 2024-03-01 07:14:38,992] Trial 65 finished with value: 6.8101692220714485 and parameters: {'model_name': 'IterativeImputer', 'sample_posterior': False, 'initial_strategy': 'most_frequent', 'imputation_order': 'arabic'}. Best is trial 17 with value: 4.15507044270351.
[I 2024-03-01 07:14:58,464] Trial 10 finished with value: 6.8101150857518205 and parameters: {'model_name': 'IterativeImputer', 'sample_posterior': False, 'initial_strategy': 'constant', 'imputation_order': 'ascending'}. Best is trial 17 with value: 4.15507044270351.
[I 2024-03-01 07:15:08,539] Trial 20 finished with value: 6.810025050072189 and parameters: {'model_name': 'IterativeImputer', 'sample_posterior': False, 'initial_strategy': 'constant', 'imputation_order': 'random'}. Best is trial 17 with value: 4.15507044270351.
[I 2024-03-01 07:15:10,558] Trial 31 finished with value: 9.281345145096001 and parameters: {'model_name': 'GAIN', 'batch_size': 332, 'hint_rate': 0.16, 'alpha': 66, 'iterations': 37}. Best is trial 17 with value: 4.15507044270351.
[I 2024-03-01 07:15:20,755] Trial 36 finished with value: 22.26479909412933 and parameters: {'model_name': 'RandomForestImputer', 'max_iter': 42, 'decreasing': True, 'min_samples_split': 0.0, 'min_samples_leaf': 0.7000000000000001, 'max_features': 0.2, 'warm_start': True}. Best is trial 17 with value: 4.15507044270351.
[I 2024-03-01 07:15:31,808] Trial 42 finished with value: 6.810133900098814 and parameters: {'model_name': 'IterativeImputer', 'sample_posterior': False, 'initial_strategy': 'constant', 'imputation_order': 'roman'}. Best is trial 17 with value: 4.15507044270351.
[I 2024-03-01 07:15:34,436] Trial 71 finished with value: 6.810182303124902 and parameters: {'model_name': 'IterativeImputer', 'sample_posterior': False, 'initial_strategy': 'most_frequent', 'imputation_order': 'random'}. Best is trial 17 with value: 4.15507044270351.
[I 2024-03-01 07:15:35,659] Trial 78 finished with value: 6.810126888466629 and parameters: {'model_name': 'IterativeImputer', 'sample_posterior': False, 'initial_strategy': 'mean', 'imputation_order': 'descending'}. Best is trial 17 with value: 4.15507044270351.
[I 2024-03-01 07:15:39,453] Trial 75 finished with value: 6.810160908193072 and parameters: {'model_name': 'IterativeImputer', 'sample_posterior': False, 'initial_strategy': 'constant', 'imputation_order': 'arabic'}. Best is trial 17 with value: 4.15507044270351.
[I 2024-03-01 07:15:41,274] Trial 27 finished with value: 6.8101764361480575 and parameters: {'model_name': 'IterativeImputer', 'sample_posterior': False, 'initial_strategy': 'constant', 'imputation_order': 'random'}. Best is trial 17 with value: 4.15507044270351.
[I 2024-03-01 07:16:10,854] Trial 60 finished with value: 7.440653112589783 and parameters: {'model_name': 'RandomForestImputer', 'max_iter': 3, 'decreasing': False, 'min_samples_split': 0.7000000000000001, 'min_samples_leaf': 0.30000000000000004, 'max_features': 0.4, 'warm_start': False}. Best is trial 17 with value: 4.15507044270351.
[I 2024-03-01 07:16:12,085] Trial 43 finished with value: 7.526737133331181 and parameters: {'model_name': 'RandomForestImputer', 'max_iter': 4, 'decreasing': False, 'min_samples_split': 1.0, 'min_samples_leaf': 0.30000000000000004, 'max_features': 0.2, 'warm_start': False}. Best is trial 17 with value: 4.15507044270351.
[I 2024-03-01 07:16:14,405] Trial 79 finished with value: 6.810139756356489 and parameters: {'model_name': 'IterativeImputer', 'sample_posterior': False, 'initial_strategy': 'mean', 'imputation_order': 'roman'}. Best is trial 17 with value: 4.15507044270351.
[I 2024-03-01 07:16:26,278] Trial 83 finished with value: 6.810167430042353 and parameters: {'model_name': 'IterativeImputer', 'sample_posterior': False, 'initial_strategy': 'most_frequent', 'imputation_order': 'descending'}. Best is trial 17 with value: 4.15507044270351.
[I 2024-03-01 07:16:27,717] Trial 81 finished with value: 6.810125193544932 and parameters: {'model_name': 'IterativeImputer', 'sample_posterior': False, 'initial_strategy': 'median', 'imputation_order': 'arabic'}. Best is trial 17 with value: 4.15507044270351.
[I 2024-03-01 07:16:53,470] Trial 86 finished with value: 6.8101572489100946 and parameters: {'model_name': 'IterativeImputer', 'sample_posterior': False, 'initial_strategy': 'mean', 'imputation_order': 'ascending'}. Best is trial 17 with value: 4.15507044270351.
[I 2024-03-01 07:17:01,227] Trial 15 finished with value: 24.471022660255183 and parameters: {'model_name': 'RandomForestImputer', 'max_iter': 84, 'decreasing': False, 'min_samples_split': 0.0, 'min_samples_leaf': 0.5, 'max_features': 0.6, 'warm_start': True}. Best is trial 17 with value: 4.15507044270351.
[I 2024-03-01 07:17:02,442] Trial 85 finished with value: 6.810167562101583 and parameters: {'model_name': 'IterativeImputer', 'sample_posterior': False, 'initial_strategy': 'median', 'imputation_order': 'roman'}. Best is trial 17 with value: 4.15507044270351.
[I 2024-03-01 07:17:05,405] Trial 87 finished with value: 6.810160908193072 and parameters: {'model_name': 'IterativeImputer', 'sample_posterior': False, 'initial_strategy': 'constant', 'imputation_order': 'arabic'}. Best is trial 17 with value: 4.15507044270351.
[I 2024-03-01 07:17:10,765] Trial 90 finished with value: 6.810126888466629 and parameters: {'model_name': 'IterativeImputer', 'sample_posterior': False, 'initial_strategy': 'mean', 'imputation_order': 'descending'}. Best is trial 17 with value: 4.15507044270351.
[I 2024-03-01 07:17:21,011] Trial 82 finished with value: 6.810175028403933 and parameters: {'model_name': 'IterativeImputer', 'sample_posterior': False, 'initial_strategy': 'most_frequent', 'imputation_order': 'random'}. Best is trial 17 with value: 4.15507044270351.
[I 2024-03-01 07:17:22,519] Trial 5 finished with value: 7.590361422284343 and parameters: {'model_name': 'RandomForestImputer', 'max_iter': 9, 'decreasing': False, 'min_samples_split': 0.1, 'min_samples_leaf': 0.30000000000000004, 'max_features': 0.1, 'warm_start': False}. Best is trial 17 with value: 4.15507044270351.
[I 2024-03-01 07:17:26,209] Trial 91 finished with value: 6.810143297828084 and parameters: {'model_name': 'IterativeImputer', 'sample_posterior': False, 'initial_strategy': 'mean', 'imputation_order': 'arabic'}. Best is trial 17 with value: 4.15507044270351.
[I 2024-03-01 07:17:51,841] Trial 94 finished with value: 6.810163218634541 and parameters: {'model_name': 'IterativeImputer', 'sample_posterior': False, 'initial_strategy': 'constant', 'imputation_order': 'descending'}. Best is trial 17 with value: 4.15507044270351.
[I 2024-03-01 07:17:53,316] Trial 93 finished with value: 6.810163218634541 and parameters: {'model_name': 'IterativeImputer', 'sample_posterior': False, 'initial_strategy': 'constant', 'imputation_order': 'descending'}. Best is trial 17 with value: 4.15507044270351.
[I 2024-03-01 07:18:01,406] Trial 95 finished with value: 6.810163218634541 and parameters: {'model_name': 'IterativeImputer', 'sample_posterior': False, 'initial_strategy': 'constant', 'imputation_order': 'descending'}. Best is trial 17 with value: 4.15507044270351.
[I 2024-03-01 07:18:08,813] Trial 92 finished with value: 6.8101572489100946 and parameters: {'model_name': 'IterativeImputer', 'sample_posterior': False, 'initial_strategy': 'mean', 'imputation_order': 'ascending'}. Best is trial 17 with value: 4.15507044270351.
[I 2024-03-01 07:18:12,068] Trial 117 finished with value: 4.15507044270351 and parameters: {'model_name': 'SimpleImputer', 'strategy': 'median'}. Best is trial 17 with value: 4.15507044270351.
[I 2024-03-01 07:18:12,969] Trial 98 finished with value: 6.810126888466629 and parameters: {'model_name': 'IterativeImputer', 'sample_posterior': False, 'initial_strategy': 'mean', 'imputation_order': 'descending'}. Best is trial 17 with value: 4.15507044270351.
[I 2024-03-01 07:18:15,079] Trial 99 finished with value: 6.810126888466629 and parameters: {'model_name': 'IterativeImputer', 'sample_posterior': False, 'initial_strategy': 'mean', 'imputation_order': 'descending'}. Best is trial 17 with value: 4.15507044270351.
[I 2024-03-01 07:18:16,905] Trial 119 finished with value: 4.15507044270351 and parameters: {'model_name': 'SimpleImputer', 'strategy': 'median'}. Best is trial 17 with value: 4.15507044270351.
[I 2024-03-01 07:18:17,677] Trial 118 finished with value: 4.15507044270351 and parameters: {'model_name': 'SimpleImputer', 'strategy': 'median'}. Best is trial 17 with value: 4.15507044270351.
[I 2024-03-01 07:18:19,117] Trial 97 finished with value: 6.810126888466629 and parameters: {'model_name': 'IterativeImputer', 'sample_posterior': False, 'initial_strategy': 'mean', 'imputation_order': 'descending'}. Best is trial 17 with value: 4.15507044270351.
[I 2024-03-01 07:18:20,210] Trial 120 finished with value: 4.15507044270351 and parameters: {'model_name': 'SimpleImputer', 'strategy': 'median'}. Best is trial 17 with value: 4.15507044270351.
[I 2024-03-01 07:18:21,620] Trial 122 finished with value: 4.15507044270351 and parameters: {'model_name': 'SimpleImputer', 'strategy': 'median'}. Best is trial 17 with value: 4.15507044270351.
[I 2024-03-01 07:18:22,404] Trial 121 finished with value: 4.15507044270351 and parameters: {'model_name': 'SimpleImputer', 'strategy': 'median'}. Best is trial 17 with value: 4.15507044270351.
[I 2024-03-01 07:18:23,817] Trial 123 finished with value: 4.15507044270351 and parameters: {'model_name': 'SimpleImputer', 'strategy': 'median'}. Best is trial 17 with value: 4.15507044270351.
[I 2024-03-01 07:18:25,085] Trial 124 finished with value: 4.15507044270351 and parameters: {'model_name': 'SimpleImputer', 'strategy': 'median'}. Best is trial 17 with value: 4.15507044270351.
[I 2024-03-01 07:18:26,719] Trial 126 finished with value: 4.15507044270351 and parameters: {'model_name': 'SimpleImputer', 'strategy': 'median'}. Best is trial 17 with value: 4.15507044270351.
[I 2024-03-01 07:18:27,629] Trial 125 finished with value: 4.15507044270351 and parameters: {'model_name': 'SimpleImputer', 'strategy': 'median'}. Best is trial 17 with value: 4.15507044270351.
[I 2024-03-01 07:18:28,728] Trial 127 finished with value: 4.15507044270351 and parameters: {'model_name': 'SimpleImputer', 'strategy': 'median'}. Best is trial 17 with value: 4.15507044270351.
[I 2024-03-01 07:18:29,902] Trial 128 finished with value: 4.15507044270351 and parameters: {'model_name': 'SimpleImputer', 'strategy': 'median'}. Best is trial 17 with value: 4.15507044270351.
[I 2024-03-01 07:18:31,504] Trial 129 finished with value: 4.15507044270351 and parameters: {'model_name': 'SimpleImputer', 'strategy': 'median'}. Best is trial 17 with value: 4.15507044270351.
[I 2024-03-01 07:18:32,658] Trial 130 finished with value: 4.15507044270351 and parameters: {'model_name': 'SimpleImputer', 'strategy': 'median'}. Best is trial 17 with value: 4.15507044270351.
[I 2024-03-01 07:18:33,624] Trial 131 finished with value: 4.15507044270351 and parameters: {'model_name': 'SimpleImputer', 'strategy': 'median'}. Best is trial 17 with value: 4.15507044270351.
[I 2024-03-01 07:18:34,932] Trial 132 finished with value: 4.15507044270351 and parameters: {'model_name': 'SimpleImputer', 'strategy': 'median'}. Best is trial 17 with value: 4.15507044270351.
