[I 2024-04-02 11:20:20,612] Trial 2 finished with value: 4820.1012538053765 and parameters: {'model_name': 'SimpleImputer', 'strategy': 'constant'}. Best is trial 2 with value: 4820.1012538053765.
[I 2024-04-02 11:20:21,569] Trial 11 finished with value: 4820.1012538053765 and parameters: {'model_name': 'SimpleImputer', 'strategy': 'constant'}. Best is trial 2 with value: 4820.1012538053765.
[I 2024-04-02 11:20:22,526] Trial 21 finished with value: 4820.1012538053765 and parameters: {'model_name': 'SimpleImputer', 'strategy': 'constant'}. Best is trial 2 with value: 4820.1012538053765.
[I 2024-04-02 11:20:23,738] Trial 29 finished with value: 4820.1012538053765 and parameters: {'model_name': 'SimpleImputer', 'strategy': 'constant'}. Best is trial 2 with value: 4820.1012538053765.
[I 2024-04-02 11:20:24,642] Trial 22 finished with value: 4555.63787003968 and parameters: {'model_name': 'SimpleImputer', 'strategy': 'mean'}. Best is trial 22 with value: 4555.63787003968.
[I 2024-04-02 11:20:26,164] Trial 39 finished with value: 4820.1012538053765 and parameters: {'model_name': 'SimpleImputer', 'strategy': 'constant'}. Best is trial 22 with value: 4555.63787003968.
[I 2024-04-02 11:20:26,810] Trial 35 finished with value: 4555.63787003968 and parameters: {'model_name': 'SimpleImputer', 'strategy': 'mean'}. Best is trial 22 with value: 4555.63787003968.
[I 2024-04-02 11:20:27,808] Trial 46 finished with value: 4820.1012538053765 and parameters: {'model_name': 'SimpleImputer', 'strategy': 'constant'}. Best is trial 22 with value: 4555.63787003968.
[I 2024-04-02 11:20:29,625] Trial 31 finished with value: 4731.375647856553 and parameters: {'model_name': 'SimpleImputer', 'strategy': 'median'}. Best is trial 22 with value: 4555.63787003968.
[I 2024-04-02 11:20:30,775] Trial 34 finished with value: 4731.375647856553 and parameters: {'model_name': 'SimpleImputer', 'strategy': 'median'}. Best is trial 22 with value: 4555.63787003968.
[I 2024-04-02 11:20:32,280] Trial 37 finished with value: 4731.375647856553 and parameters: {'model_name': 'SimpleImputer', 'strategy': 'median'}. Best is trial 22 with value: 4555.63787003968.
[I 2024-04-02 11:20:34,272] Trial 52 finished with value: 4555.63787003968 and parameters: {'model_name': 'SimpleImputer', 'strategy': 'mean'}. Best is trial 22 with value: 4555.63787003968.
2024-04-02 11:20:36.732148: E external/local_xla/xla/stream_executor/cuda/cuda_driver.cc:274] failed call to cuInit: CUDA_ERROR_NO_DEVICE: no CUDA-capable device is detected
2024-04-02 11:20:37.022117: I tensorflow/compiler/mlir/mlir_graph_optimization_pass.cc:388] MLIR V1 optimization pass is not enabled
[I 2024-04-02 11:20:38,551] Trial 56 finished with value: 4555.63787003968 and parameters: {'model_name': 'SimpleImputer', 'strategy': 'mean'}. Best is trial 22 with value: 4555.63787003968.
[I 2024-04-02 11:21:20,285] Trial 5 finished with value: 7482.054388034984 and parameters: {'model_name': 'KNNImputer', 'weights': 'uniform', 'keep_empty_features': False}. Best is trial 22 with value: 4555.63787003968.
[I 2024-04-02 11:21:22,348] Trial 41 finished with value: 7482.054388034984 and parameters: {'model_name': 'KNNImputer', 'weights': 'uniform', 'keep_empty_features': False}. Best is trial 22 with value: 4555.63787003968.
[I 2024-04-02 11:21:24,056] Trial 4 finished with value: 7482.054388034984 and parameters: {'model_name': 'KNNImputer', 'weights': 'uniform', 'keep_empty_features': False}. Best is trial 22 with value: 4555.63787003968.
[I 2024-04-02 11:21:25,291] Trial 47 finished with value: 7482.054388034984 and parameters: {'model_name': 'KNNImputer', 'weights': 'uniform', 'keep_empty_features': False}. Best is trial 22 with value: 4555.63787003968.
[I 2024-04-02 11:21:26,224] Trial 48 finished with value: 7299.063376835836 and parameters: {'model_name': 'KNNImputer', 'weights': 'distance', 'keep_empty_features': False}. Best is trial 22 with value: 4555.63787003968.
[I 2024-04-02 11:21:27,137] Trial 26 finished with value: 7299.063376835836 and parameters: {'model_name': 'KNNImputer', 'weights': 'distance', 'keep_empty_features': False}. Best is trial 22 with value: 4555.63787003968.
[I 2024-04-02 11:21:29,424] Trial 51 finished with value: 7482.054388034984 and parameters: {'model_name': 'KNNImputer', 'weights': 'uniform', 'keep_empty_features': False}. Best is trial 22 with value: 4555.63787003968.
[I 2024-04-02 11:21:33,926] Trial 58 finished with value: 7299.063376835836 and parameters: {'model_name': 'KNNImputer', 'weights': 'distance', 'keep_empty_features': False}. Best is trial 22 with value: 4555.63787003968.
[I 2024-04-02 11:21:35,205] Trial 60 finished with value: 7482.054388034984 and parameters: {'model_name': 'KNNImputer', 'weights': 'uniform', 'keep_empty_features': False}. Best is trial 22 with value: 4555.63787003968.
[I 2024-04-02 11:22:31,552] Trial 33 finished with value: 220439.1563882506 and parameters: {'model_name': 'GAIN', 'batch_size': 5, 'hint_rate': 0.48000000000000004, 'alpha': 59, 'iterations': 1}. Best is trial 22 with value: 4555.63787003968.
[I 2024-04-02 11:22:34,913] Trial 30 finished with value: 160720.67877601035 and parameters: {'model_name': 'GAIN', 'batch_size': 15, 'hint_rate': 0.04, 'alpha': 53, 'iterations': 2}. Best is trial 22 with value: 4555.63787003968.
[I 2024-04-02 11:22:55,517] Trial 64 finished with value: 192403.11145311585 and parameters: {'model_name': 'GAIN', 'batch_size': 644, 'hint_rate': 0.8200000000000001, 'alpha': 96, 'iterations': 1}. Best is trial 22 with value: 4555.63787003968.
[I 2024-04-02 11:22:59,076] Trial 68 finished with value: 167936.69510715193 and parameters: {'model_name': 'GAIN', 'batch_size': 4, 'hint_rate': 0.93, 'alpha': 62, 'iterations': 1}. Best is trial 22 with value: 4555.63787003968.
[I 2024-04-02 11:23:13,268] Trial 67 finished with value: 174666.8983642214 and parameters: {'model_name': 'GAIN', 'batch_size': 1, 'hint_rate': 0.7100000000000001, 'alpha': 56, 'iterations': 7}. Best is trial 22 with value: 4555.63787003968.
[I 2024-04-02 11:23:20,523] Trial 13 finished with value: 163482.19788441405 and parameters: {'model_name': 'GAIN', 'batch_size': 39, 'hint_rate': 0.72, 'alpha': 44, 'iterations': 16}. Best is trial 22 with value: 4555.63787003968.
[I 2024-04-02 11:23:41,012] Trial 3 finished with value: 165532.0441538336 and parameters: {'model_name': 'GAIN', 'batch_size': 75, 'hint_rate': 0.91, 'alpha': 89, 'iterations': 21}. Best is trial 22 with value: 4555.63787003968.
[I 2024-04-02 11:23:43,472] Trial 25 finished with value: 5197.14116548959 and parameters: {'model_name': 'RandomForestImputer', 'max_iter': 7, 'decreasing': False, 'min_samples_split': 0.6000000000000001, 'min_samples_leaf': 0.4, 'max_features': 0.7000000000000001, 'warm_start': True}. Best is trial 22 with value: 4555.63787003968.
[I 2024-04-02 11:23:50,747] Trial 45 finished with value: 171897.2580682381 and parameters: {'model_name': 'GAIN', 'batch_size': 142, 'hint_rate': 0.19, 'alpha': 40, 'iterations': 22}. Best is trial 22 with value: 4555.63787003968.
[I 2024-04-02 11:23:53,180] Trial 0 finished with value: 5189.329322956689 and parameters: {'model_name': 'RandomForestImputer', 'max_iter': 8, 'decreasing': False, 'min_samples_split': 0.5, 'min_samples_leaf': 0.4, 'max_features': 0.2, 'warm_start': True}. Best is trial 22 with value: 4555.63787003968.
[I 2024-04-02 11:23:59,863] Trial 27 finished with value: 4555.63787003968 and parameters: {'model_name': 'RandomForestImputer', 'max_iter': 1, 'decreasing': False, 'min_samples_split': 0.7000000000000001, 'min_samples_leaf': 0.4, 'max_features': 0.7000000000000001, 'warm_start': False}. Best is trial 22 with value: 4555.63787003968.
[I 2024-04-02 11:24:05,492] Trial 7 finished with value: 8358.402673896902 and parameters: {'model_name': 'IterativeImputer', 'sample_posterior': False, 'initial_strategy': 'median', 'imputation_order': 'arabic'}. Best is trial 22 with value: 4555.63787003968.
[I 2024-04-02 11:24:08,459] Trial 18 finished with value: 8355.61387306119 and parameters: {'model_name': 'IterativeImputer', 'sample_posterior': False, 'initial_strategy': 'mean', 'imputation_order': 'arabic'}. Best is trial 22 with value: 4555.63787003968.
[I 2024-04-02 11:24:09,963] Trial 54 finished with value: 8355.61387306119 and parameters: {'model_name': 'IterativeImputer', 'sample_posterior': False, 'initial_strategy': 'mean', 'imputation_order': 'arabic'}. Best is trial 22 with value: 4555.63787003968.
[I 2024-04-02 11:24:18,219] Trial 6 finished with value: 4820.0775329164935 and parameters: {'model_name': 'RandomForestImputer', 'max_iter': 7, 'decreasing': True, 'min_samples_split': 1.0, 'min_samples_leaf': 0.7000000000000001, 'max_features': 0.30000000000000004, 'warm_start': True}. Best is trial 22 with value: 4555.63787003968.
[I 2024-04-02 11:24:26,370] Trial 28 finished with value: 190664.5265524132 and parameters: {'model_name': 'GAIN', 'batch_size': 191, 'hint_rate': 0.62, 'alpha': 46, 'iterations': 28}. Best is trial 22 with value: 4555.63787003968.
[I 2024-04-02 11:24:30,221] Trial 66 finished with value: 4555.63787003968 and parameters: {'model_name': 'RandomForestImputer', 'max_iter': 1, 'decreasing': False, 'min_samples_split': 0.1, 'min_samples_leaf': 0.30000000000000004, 'max_features': 0.9, 'warm_start': False}. Best is trial 22 with value: 4555.63787003968.
[I 2024-04-02 11:24:38,789] Trial 24 finished with value: 4820.077471578034 and parameters: {'model_name': 'RandomForestImputer', 'max_iter': 12, 'decreasing': True, 'min_samples_split': 0.5, 'min_samples_leaf': 0.8, 'max_features': 0.7000000000000001, 'warm_start': True}. Best is trial 22 with value: 4555.63787003968.
[I 2024-04-02 11:24:40,732] Trial 69 finished with value: 8355.61387306119 and parameters: {'model_name': 'IterativeImputer', 'sample_posterior': False, 'initial_strategy': 'mean', 'imputation_order': 'arabic'}. Best is trial 22 with value: 4555.63787003968.
[I 2024-04-02 11:24:43,372] Trial 88 finished with value: 4555.63787003968 and parameters: {'model_name': 'SimpleImputer', 'strategy': 'mean'}. Best is trial 22 with value: 4555.63787003968.
[I 2024-04-02 11:24:45,927] Trial 89 finished with value: 4555.63787003968 and parameters: {'model_name': 'SimpleImputer', 'strategy': 'mean'}. Best is trial 22 with value: 4555.63787003968.
[I 2024-04-02 11:25:16,902] Trial 71 finished with value: 4820.077328296747 and parameters: {'model_name': 'RandomForestImputer', 'max_iter': 4, 'decreasing': True, 'min_samples_split': 0.5, 'min_samples_leaf': 0.2, 'max_features': 0.7000000000000001, 'warm_start': True}. Best is trial 22 with value: 4555.63787003968.
[I 2024-04-02 11:25:19,618] Trial 91 finished with value: 4555.63787003968 and parameters: {'model_name': 'SimpleImputer', 'strategy': 'mean'}. Best is trial 22 with value: 4555.63787003968.
[I 2024-04-02 11:25:22,182] Trial 92 finished with value: 4555.63787003968 and parameters: {'model_name': 'SimpleImputer', 'strategy': 'mean'}. Best is trial 22 with value: 4555.63787003968.
[I 2024-04-02 11:25:26,171] Trial 16 finished with value: 148379.34693132353 and parameters: {'model_name': 'GAIN', 'batch_size': 49, 'hint_rate': 0.7000000000000001, 'alpha': 6, 'iterations': 49}. Best is trial 22 with value: 4555.63787003968.
[I 2024-04-02 11:26:15,639] Trial 75 finished with value: 4555.63787003968 and parameters: {'model_name': 'RandomForestImputer', 'max_iter': 1, 'decreasing': True, 'min_samples_split': 0.4, 'min_samples_leaf': 0.30000000000000004, 'max_features': 0.7000000000000001, 'warm_start': False}. Best is trial 22 with value: 4555.63787003968.
[I 2024-04-02 11:26:18,304] Trial 95 finished with value: 4555.63787003968 and parameters: {'model_name': 'SimpleImputer', 'strategy': 'mean'}. Best is trial 22 with value: 4555.63787003968.
[I 2024-04-02 11:26:21,437] Trial 15 finished with value: 8356.61271595671 and parameters: {'model_name': 'IterativeImputer', 'sample_posterior': False, 'initial_strategy': 'constant', 'imputation_order': 'random'}. Best is trial 22 with value: 4555.63787003968.
[I 2024-04-02 11:26:28,128] Trial 96 finished with value: 4820.101246075593 and parameters: {'model_name': 'SimpleImputer', 'strategy': 'most_frequent'}. Best is trial 22 with value: 4555.63787003968.
[I 2024-04-02 11:26:32,002] Trial 97 finished with value: 4820.101246075593 and parameters: {'model_name': 'SimpleImputer', 'strategy': 'most_frequent'}. Best is trial 22 with value: 4555.63787003968.
[I 2024-04-02 11:26:47,704] Trial 72 finished with value: 8343.51757184722 and parameters: {'model_name': 'IterativeImputer', 'sample_posterior': False, 'initial_strategy': 'most_frequent', 'imputation_order': 'descending'}. Best is trial 22 with value: 4555.63787003968.
[I 2024-04-02 11:26:50,904] Trial 81 finished with value: 4555.63787003968 and parameters: {'model_name': 'RandomForestImputer', 'max_iter': 1, 'decreasing': True, 'min_samples_split': 1.0, 'min_samples_leaf': 0.9, 'max_features': 0.9, 'warm_start': False}. Best is trial 22 with value: 4555.63787003968.
[I 2024-04-02 11:26:52,874] Trial 82 finished with value: 4555.63787003968 and parameters: {'model_name': 'RandomForestImputer', 'max_iter': 1, 'decreasing': True, 'min_samples_split': 1.0, 'min_samples_leaf': 0.9, 'max_features': 0.9, 'warm_start': False}. Best is trial 22 with value: 4555.63787003968.
[I 2024-04-02 11:26:57,152] Trial 83 finished with value: 4555.63787003968 and parameters: {'model_name': 'RandomForestImputer', 'max_iter': 1, 'decreasing': True, 'min_samples_split': 1.0, 'min_samples_leaf': 0.9, 'max_features': 0.9, 'warm_start': False}. Best is trial 22 with value: 4555.63787003968.
[I 2024-04-02 11:27:03,788] Trial 84 finished with value: 4555.63787003968 and parameters: {'model_name': 'RandomForestImputer', 'max_iter': 1, 'decreasing': False, 'min_samples_split': 0.0, 'min_samples_leaf': 0.1, 'max_features': 0.9, 'warm_start': False}. Best is trial 22 with value: 4555.63787003968.
[I 2024-04-02 11:27:07,811] Trial 59 finished with value: 5382.372979239228 and parameters: {'model_name': 'RandomForestImputer', 'max_iter': 14, 'decreasing': False, 'min_samples_split': 0.5, 'min_samples_leaf': 0.1, 'max_features': 0.2, 'warm_start': True}. Best is trial 22 with value: 4555.63787003968.
[I 2024-04-02 11:27:08,779] Trial 80 finished with value: 8350.539148311918 and parameters: {'model_name': 'IterativeImputer', 'sample_posterior': False, 'initial_strategy': 'most_frequent', 'imputation_order': 'arabic'}. Best is trial 22 with value: 4555.63787003968.
[I 2024-04-02 11:27:10,487] Trial 106 finished with value: 4555.63787003968 and parameters: {'model_name': 'SimpleImputer', 'strategy': 'mean'}. Best is trial 22 with value: 4555.63787003968.
[I 2024-04-02 11:27:11,549] Trial 105 finished with value: 4555.63787003968 and parameters: {'model_name': 'SimpleImputer', 'strategy': 'mean'}. Best is trial 22 with value: 4555.63787003968.
[I 2024-04-02 11:27:13,433] Trial 85 finished with value: 4555.63787003968 and parameters: {'model_name': 'RandomForestImputer', 'max_iter': 1, 'decreasing': False, 'min_samples_split': 0.0, 'min_samples_leaf': 0.1, 'max_features': 0.8, 'warm_start': False}. Best is trial 22 with value: 4555.63787003968.
[I 2024-04-02 11:27:18,451] Trial 86 finished with value: 4555.63787003968 and parameters: {'model_name': 'RandomForestImputer', 'max_iter': 1, 'decreasing': True, 'min_samples_split': 0.8, 'min_samples_leaf': 0.1, 'max_features': 0.6, 'warm_start': False}. Best is trial 22 with value: 4555.63787003968.
[I 2024-04-02 11:27:26,423] Trial 87 finished with value: 4555.63787003968 and parameters: {'model_name': 'RandomForestImputer', 'max_iter': 1, 'decreasing': False, 'min_samples_split': 0.9, 'min_samples_leaf': 0.1, 'max_features': 0.5, 'warm_start': False}. Best is trial 22 with value: 4555.63787003968.
[I 2024-04-02 11:27:29,389] Trial 90 finished with value: 4555.63787003968 and parameters: {'model_name': 'RandomForestImputer', 'max_iter': 1, 'decreasing': False, 'min_samples_split': 0.9, 'min_samples_leaf': 0.1, 'max_features': 0.5, 'warm_start': False}. Best is trial 22 with value: 4555.63787003968.
[I 2024-04-02 11:27:31,744] Trial 112 finished with value: 4555.63787003968 and parameters: {'model_name': 'SimpleImputer', 'strategy': 'mean'}. Best is trial 22 with value: 4555.63787003968.
[I 2024-04-02 11:29:02,719] Trial 98 finished with value: 4555.63787003968 and parameters: {'model_name': 'RandomForestImputer', 'max_iter': 1, 'decreasing': False, 'min_samples_split': 0.0, 'min_samples_leaf': 0.1, 'max_features': 0.9, 'warm_start': False}. Best is trial 22 with value: 4555.63787003968.
[I 2024-04-02 11:29:04,389] Trial 78 finished with value: 8338.626810131453 and parameters: {'model_name': 'IterativeImputer', 'sample_posterior': False, 'initial_strategy': 'median', 'imputation_order': 'ascending'}. Best is trial 22 with value: 4555.63787003968.
[I 2024-04-02 11:29:05,582] Trial 114 finished with value: 4555.63787003968 and parameters: {'model_name': 'SimpleImputer', 'strategy': 'mean'}. Best is trial 22 with value: 4555.63787003968.
[I 2024-04-02 11:29:07,382] Trial 115 finished with value: 4555.63787003968 and parameters: {'model_name': 'SimpleImputer', 'strategy': 'mean'}. Best is trial 22 with value: 4555.63787003968.
[I 2024-04-02 11:29:09,496] Trial 99 finished with value: 4555.63787003968 and parameters: {'model_name': 'RandomForestImputer', 'max_iter': 1, 'decreasing': False, 'min_samples_split': 0.0, 'min_samples_leaf': 0.1, 'max_features': 0.9, 'warm_start': False}. Best is trial 22 with value: 4555.63787003968.
[I 2024-04-02 11:29:26,359] Trial 100 finished with value: 4555.63787003968 and parameters: {'model_name': 'RandomForestImputer', 'max_iter': 1, 'decreasing': False, 'min_samples_split': 0.0, 'min_samples_leaf': 0.1, 'max_features': 0.9, 'warm_start': False}. Best is trial 22 with value: 4555.63787003968.
[I 2024-04-02 11:29:59,635] Trial 40 finished with value: 4820.077476330239 and parameters: {'model_name': 'RandomForestImputer', 'max_iter': 95, 'decreasing': True, 'min_samples_split': 0.7000000000000001, 'min_samples_leaf': 0.4, 'max_features': 0.5, 'warm_start': True}. Best is trial 22 with value: 4555.63787003968.
[I 2024-04-02 11:32:25,143] Trial 17 finished with value: 4820.076433193513 and parameters: {'model_name': 'RandomForestImputer', 'max_iter': 97, 'decreasing': True, 'min_samples_split': 0.6000000000000001, 'min_samples_leaf': 0.1, 'max_features': 0.5, 'warm_start': True}. Best is trial 22 with value: 4555.63787003968.
[I 2024-04-02 11:32:44,498] Trial 42 finished with value: 4436.0154059604165 and parameters: {'model_name': 'RandomForestImputer', 'max_iter': 4, 'decreasing': True, 'min_samples_split': 0.4, 'min_samples_leaf': 0.30000000000000004, 'max_features': 0.7000000000000001, 'warm_start': False}. Best is trial 42 with value: 4436.0154059604165.
[I 2024-04-02 11:32:59,650] Trial 108 finished with value: 4410.817029611346 and parameters: {'model_name': 'RandomForestImputer', 'max_iter': 2, 'decreasing': False, 'min_samples_split': 0.1, 'min_samples_leaf': 0.30000000000000004, 'max_features': 0.5, 'warm_start': False}. Best is trial 108 with value: 4410.817029611346.
[I 2024-04-02 11:33:07,203] Trial 110 finished with value: 4401.986436122968 and parameters: {'model_name': 'RandomForestImputer', 'max_iter': 2, 'decreasing': False, 'min_samples_split': 0.30000000000000004, 'min_samples_leaf': 0.30000000000000004, 'max_features': 0.5, 'warm_start': False}. Best is trial 110 with value: 4401.986436122968.
[I 2024-04-02 11:33:08,457] Trial 109 finished with value: 4389.287688497761 and parameters: {'model_name': 'RandomForestImputer', 'max_iter': 2, 'decreasing': False, 'min_samples_split': 0.2, 'min_samples_leaf': 0.30000000000000004, 'max_features': 0.5, 'warm_start': False}. Best is trial 109 with value: 4389.287688497761.
[I 2024-04-02 11:33:10,725] Trial 124 finished with value: 4555.63787003968 and parameters: {'model_name': 'SimpleImputer', 'strategy': 'mean'}. Best is trial 109 with value: 4389.287688497761.
[I 2024-04-02 11:33:13,810] Trial 107 finished with value: 4394.97693068833 and parameters: {'model_name': 'RandomForestImputer', 'max_iter': 2, 'decreasing': False, 'min_samples_split': 0.1, 'min_samples_leaf': 0.30000000000000004, 'max_features': 0.5, 'warm_start': False}. Best is trial 109 with value: 4389.287688497761.
[I 2024-04-02 11:33:24,331] Trial 111 finished with value: 4385.920630348768 and parameters: {'model_name': 'RandomForestImputer', 'max_iter': 2, 'decreasing': False, 'min_samples_split': 0.2, 'min_samples_leaf': 0.30000000000000004, 'max_features': 0.5, 'warm_start': False}. Best is trial 111 with value: 4385.920630348768.
[I 2024-04-02 11:33:31,458] Trial 113 finished with value: 4474.79930738577 and parameters: {'model_name': 'RandomForestImputer', 'max_iter': 2, 'decreasing': False, 'min_samples_split': 0.30000000000000004, 'min_samples_leaf': 0.30000000000000004, 'max_features': 0.5, 'warm_start': False}. Best is trial 111 with value: 4385.920630348768.
[I 2024-04-02 11:34:49,384] Trial 117 finished with value: 4399.822648819997 and parameters: {'model_name': 'RandomForestImputer', 'max_iter': 2, 'decreasing': False, 'min_samples_split': 0.2, 'min_samples_leaf': 0.30000000000000004, 'max_features': 0.6, 'warm_start': False}. Best is trial 111 with value: 4385.920630348768.
[I 2024-04-02 11:34:52,851] Trial 76 finished with value: 5431.639479690262 and parameters: {'model_name': 'RandomForestImputer', 'max_iter': 68, 'decreasing': False, 'min_samples_split': 0.0, 'min_samples_leaf': 0.2, 'max_features': 0.7000000000000001, 'warm_start': True}. Best is trial 111 with value: 4385.920630348768.
