[I 2023-12-22 00:08:17,831] Trial 5 finished with value: 0.27177919624044605 and parameters: {'model_name': 'SimpleImputer', 'strategy': 'mean'}. Best is trial 5 with value: 0.27177919624044605.
[I 2023-12-22 00:08:20,558] Trial 29 finished with value: 0.3927820734337226 and parameters: {'model_name': 'SimpleImputer', 'strategy': 'constant'}. Best is trial 5 with value: 0.27177919624044605.
[I 2023-12-22 00:08:21,157] Trial 31 finished with value: 0.27177919624044605 and parameters: {'model_name': 'SimpleImputer', 'strategy': 'mean'}. Best is trial 5 with value: 0.27177919624044605.
[I 2023-12-22 00:08:21,709] Trial 14 finished with value: 0.27177919624044605 and parameters: {'model_name': 'SimpleImputer', 'strategy': 'mean'}. Best is trial 5 with value: 0.27177919624044605.
[I 2023-12-22 00:08:22,825] Trial 43 finished with value: 0.3927820734337226 and parameters: {'model_name': 'SimpleImputer', 'strategy': 'constant'}. Best is trial 5 with value: 0.27177919624044605.
[I 2023-12-22 00:08:23,943] Trial 38 finished with value: 0.3927820734337226 and parameters: {'model_name': 'SimpleImputer', 'strategy': 'constant'}. Best is trial 5 with value: 0.27177919624044605.
[I 2023-12-22 00:08:27,003] Trial 22 finished with value: 0.28605066916917327 and parameters: {'model_name': 'SimpleImputer', 'strategy': 'median'}. Best is trial 5 with value: 0.27177919624044605.
[I 2023-12-22 00:08:27,845] Trial 28 finished with value: 0.28605066916917327 and parameters: {'model_name': 'SimpleImputer', 'strategy': 'median'}. Best is trial 5 with value: 0.27177919624044605.
[I 2023-12-22 00:08:39,087] Trial 55 finished with value: 0.28605066916917327 and parameters: {'model_name': 'SimpleImputer', 'strategy': 'median'}. Best is trial 5 with value: 0.27177919624044605.
2023-12-22 00:08:40.731562: E external/local_xla/xla/stream_executor/cuda/cuda_driver.cc:274] failed call to cuInit: CUDA_ERROR_NO_DEVICE: no CUDA-capable device is detected
2023-12-22 00:08:41.652040: I tensorflow/compiler/mlir/mlir_graph_optimization_pass.cc:388] MLIR V1 optimization pass is not enabled
[I 2023-12-22 00:08:52,560] Trial 35 finished with value: 0.3574979774583832 and parameters: {'model_name': 'SimpleImputer', 'strategy': 'most_frequent'}. Best is trial 5 with value: 0.27177919624044605.
[I 2023-12-22 00:08:57,014] Trial 48 finished with value: 0.3574979774583832 and parameters: {'model_name': 'SimpleImputer', 'strategy': 'most_frequent'}. Best is trial 5 with value: 0.27177919624044605.
[I 2023-12-22 00:10:46,405] Trial 34 finished with value: 0.1617775517356774 and parameters: {'model_name': 'KNNImputer', 'weights': 'uniform', 'keep_empty_features': False}. Best is trial 34 with value: 0.1617775517356774.
[I 2023-12-22 00:10:49,458] Trial 27 finished with value: 0.1617775517356774 and parameters: {'model_name': 'KNNImputer', 'weights': 'uniform', 'keep_empty_features': False}. Best is trial 34 with value: 0.1617775517356774.
[I 2023-12-22 00:10:54,014] Trial 42 finished with value: 0.1617775517356774 and parameters: {'model_name': 'KNNImputer', 'weights': 'uniform', 'keep_empty_features': False}. Best is trial 34 with value: 0.1617775517356774.
[I 2023-12-22 00:10:55,114] Trial 7 finished with value: 0.17203333400384374 and parameters: {'model_name': 'KNNImputer', 'weights': 'distance', 'keep_empty_features': False}. Best is trial 34 with value: 0.1617775517356774.
[I 2023-12-22 00:10:55,607] Trial 23 finished with value: 0.17203333400384374 and parameters: {'model_name': 'KNNImputer', 'weights': 'distance', 'keep_empty_features': False}. Best is trial 34 with value: 0.1617775517356774.
[I 2023-12-22 00:10:59,371] Trial 8 finished with value: 0.17203333400384374 and parameters: {'model_name': 'KNNImputer', 'weights': 'distance', 'keep_empty_features': False}. Best is trial 34 with value: 0.1617775517356774.
[I 2023-12-22 00:11:00,181] Trial 47 finished with value: 0.17203333400384374 and parameters: {'model_name': 'KNNImputer', 'weights': 'distance', 'keep_empty_features': False}. Best is trial 34 with value: 0.1617775517356774.
[I 2023-12-22 00:11:01,439] Trial 18 finished with value: 0.17203333400384374 and parameters: {'model_name': 'KNNImputer', 'weights': 'distance', 'keep_empty_features': False}. Best is trial 34 with value: 0.1617775517356774.
[I 2023-12-22 00:11:03,337] Trial 33 finished with value: 0.17203333400384374 and parameters: {'model_name': 'KNNImputer', 'weights': 'distance', 'keep_empty_features': False}. Best is trial 34 with value: 0.1617775517356774.
[I 2023-12-22 00:11:08,070] Trial 52 finished with value: 0.17203333400384374 and parameters: {'model_name': 'KNNImputer', 'weights': 'distance', 'keep_empty_features': False}. Best is trial 34 with value: 0.1617775517356774.
[I 2023-12-22 00:11:26,695] Trial 57 finished with value: 0.1617775517356774 and parameters: {'model_name': 'KNNImputer', 'weights': 'uniform', 'keep_empty_features': False}. Best is trial 34 with value: 0.1617775517356774.
[I 2023-12-22 00:11:31,429] Trial 58 finished with value: 0.17203333400384374 and parameters: {'model_name': 'KNNImputer', 'weights': 'distance', 'keep_empty_features': False}. Best is trial 34 with value: 0.1617775517356774.
[I 2023-12-22 00:11:54,013] Trial 67 finished with value: 0.27177919624044605 and parameters: {'model_name': 'RandomForestImputer', 'max_iter': 1, 'decreasing': False, 'min_samples_split': 0.6000000000000001, 'min_samples_leaf': 0.30000000000000004, 'max_features': 0.8, 'warm_start': True}. Best is trial 34 with value: 0.1617775517356774.
[I 2023-12-22 00:12:15,391] Trial 45 finished with value: 0.5482920974765196 and parameters: {'model_name': 'GAIN', 'batch_size': 5, 'hint_rate': 0.75, 'alpha': 4, 'iterations': 1}. Best is trial 34 with value: 0.1617775517356774.
[I 2023-12-22 00:12:16,748] Trial 41 finished with value: 0.5523169698475818 and parameters: {'model_name': 'GAIN', 'batch_size': 44, 'hint_rate': 0.48000000000000004, 'alpha': 77, 'iterations': 1}. Best is trial 34 with value: 0.1617775517356774.
[I 2023-12-22 00:12:19,711] Trial 3 finished with value: 0.5138126762086619 and parameters: {'model_name': 'GAIN', 'batch_size': 3, 'hint_rate': 0.5800000000000001, 'alpha': 38, 'iterations': 3}. Best is trial 34 with value: 0.1617775517356774.
[I 2023-12-22 00:12:32,359] Trial 10 finished with value: 0.5401376638734912 and parameters: {'model_name': 'GAIN', 'batch_size': 74, 'hint_rate': 0.93, 'alpha': 59, 'iterations': 6}. Best is trial 34 with value: 0.1617775517356774.
[I 2023-12-22 00:12:34,728] Trial 26 finished with value: 0.531890844221062 and parameters: {'model_name': 'GAIN', 'batch_size': 20, 'hint_rate': 0.91, 'alpha': 33, 'iterations': 7}. Best is trial 34 with value: 0.1617775517356774.
[I 2023-12-22 00:12:46,603] Trial 59 finished with value: 0.1617775517356774 and parameters: {'model_name': 'KNNImputer', 'weights': 'uniform', 'keep_empty_features': False}. Best is trial 34 with value: 0.1617775517356774.
[I 2023-12-22 00:12:51,015] Trial 60 finished with value: 0.1617775517356774 and parameters: {'model_name': 'KNNImputer', 'weights': 'uniform', 'keep_empty_features': False}. Best is trial 34 with value: 0.1617775517356774.
[I 2023-12-22 00:12:54,756] Trial 61 finished with value: 0.1617775517356774 and parameters: {'model_name': 'KNNImputer', 'weights': 'uniform', 'keep_empty_features': False}. Best is trial 34 with value: 0.1617775517356774.
[I 2023-12-22 00:13:15,684] Trial 54 finished with value: 0.3712110027270311 and parameters: {'model_name': 'RandomForestImputer', 'max_iter': 3, 'decreasing': False, 'min_samples_split': 0.7000000000000001, 'min_samples_leaf': 0.5, 'max_features': 0.9, 'warm_start': True}. Best is trial 34 with value: 0.1617775517356774.
[I 2023-12-22 00:13:38,892] Trial 69 finished with value: 0.5438508765330801 and parameters: {'model_name': 'GAIN', 'batch_size': 249, 'hint_rate': 0.38, 'alpha': 0, 'iterations': 1}. Best is trial 34 with value: 0.1617775517356774.
[I 2023-12-22 00:13:53,352] Trial 46 finished with value: 0.37140695220618625 and parameters: {'model_name': 'RandomForestImputer', 'max_iter': 5, 'decreasing': False, 'min_samples_split': 1.0, 'min_samples_leaf': 0.7000000000000001, 'max_features': 0.30000000000000004, 'warm_start': True}. Best is trial 34 with value: 0.1617775517356774.
[I 2023-12-22 00:14:12,323] Trial 24 finished with value: 0.3715326697592911 and parameters: {'model_name': 'RandomForestImputer', 'max_iter': 5, 'decreasing': False, 'min_samples_split': 1.0, 'min_samples_leaf': 0.6, 'max_features': 0.8, 'warm_start': True}. Best is trial 34 with value: 0.1617775517356774.
[I 2023-12-22 00:17:39,941] Trial 0 finished with value: 0.369047743250429 and parameters: {'model_name': 'RandomForestImputer', 'max_iter': 16, 'decreasing': False, 'min_samples_split': 0.7000000000000001, 'min_samples_leaf': 0.30000000000000004, 'max_features': 0.5, 'warm_start': True}. Best is trial 34 with value: 0.1617775517356774.
[I 2023-12-22 00:19:16,140] Trial 25 finished with value: 0.15813713564186543 and parameters: {'model_name': 'IterativeImputer', 'sample_posterior': False, 'initial_strategy': 'median', 'imputation_order': 'arabic'}. Best is trial 25 with value: 0.15813713564186543.
[I 2023-12-22 00:19:18,301] Trial 6 finished with value: 0.16177528811281597 and parameters: {'model_name': 'IterativeImputer', 'sample_posterior': False, 'initial_strategy': 'mean', 'imputation_order': 'roman'}. Best is trial 25 with value: 0.15813713564186543.
[I 2023-12-22 00:19:19,461] Trial 53 finished with value: 0.15887379396246887 and parameters: {'model_name': 'IterativeImputer', 'sample_posterior': False, 'initial_strategy': 'constant', 'imputation_order': 'ascending'}. Best is trial 25 with value: 0.15813713564186543.
[I 2023-12-22 00:19:20,153] Trial 11 finished with value: 0.1631588024082818 and parameters: {'model_name': 'IterativeImputer', 'sample_posterior': False, 'initial_strategy': 'constant', 'imputation_order': 'roman'}. Best is trial 25 with value: 0.15813713564186543.
[I 2023-12-22 00:19:22,617] Trial 36 finished with value: 0.15813713564186543 and parameters: {'model_name': 'IterativeImputer', 'sample_posterior': False, 'initial_strategy': 'median', 'imputation_order': 'arabic'}. Best is trial 25 with value: 0.15813713564186543.
[I 2023-12-22 00:19:24,176] Trial 32 finished with value: 0.15813713564186543 and parameters: {'model_name': 'IterativeImputer', 'sample_posterior': False, 'initial_strategy': 'median', 'imputation_order': 'arabic'}. Best is trial 25 with value: 0.15813713564186543.
[I 2023-12-22 00:19:25,455] Trial 56 finished with value: 0.16201548525962925 and parameters: {'model_name': 'IterativeImputer', 'sample_posterior': False, 'initial_strategy': 'median', 'imputation_order': 'descending'}. Best is trial 25 with value: 0.15813713564186543.
[I 2023-12-22 00:19:32,063] Trial 19 finished with value: 0.16316010812566376 and parameters: {'model_name': 'IterativeImputer', 'sample_posterior': False, 'initial_strategy': 'most_frequent', 'imputation_order': 'roman'}. Best is trial 25 with value: 0.15813713564186543.
[I 2023-12-22 00:19:37,520] Trial 1 finished with value: 0.16184410900557922 and parameters: {'model_name': 'IterativeImputer', 'sample_posterior': False, 'initial_strategy': 'median', 'imputation_order': 'random'}. Best is trial 25 with value: 0.15813713564186543.
[I 2023-12-22 00:20:16,652] Trial 65 finished with value: 0.16201548525962925 and parameters: {'model_name': 'IterativeImputer', 'sample_posterior': False, 'initial_strategy': 'median', 'imputation_order': 'descending'}. Best is trial 25 with value: 0.15813713564186543.
[I 2023-12-22 00:21:16,100] Trial 72 finished with value: 0.16201743184337963 and parameters: {'model_name': 'IterativeImputer', 'sample_posterior': False, 'initial_strategy': 'most_frequent', 'imputation_order': 'descending'}. Best is trial 25 with value: 0.15813713564186543.
[I 2023-12-22 00:21:21,462] Trial 75 finished with value: 0.16201548525962925 and parameters: {'model_name': 'IterativeImputer', 'sample_posterior': False, 'initial_strategy': 'median', 'imputation_order': 'descending'}. Best is trial 25 with value: 0.15813713564186543.
[I 2023-12-22 00:21:35,620] Trial 77 finished with value: 0.1631614253789881 and parameters: {'model_name': 'IterativeImputer', 'sample_posterior': False, 'initial_strategy': 'median', 'imputation_order': 'roman'}. Best is trial 25 with value: 0.15813713564186543.
[I 2023-12-22 00:21:38,597] Trial 78 finished with value: 0.16201548525962925 and parameters: {'model_name': 'IterativeImputer', 'sample_posterior': False, 'initial_strategy': 'median', 'imputation_order': 'descending'}. Best is trial 25 with value: 0.15813713564186543.
[I 2023-12-22 00:21:57,206] Trial 62 finished with value: 0.36633021135041055 and parameters: {'model_name': 'RandomForestImputer', 'max_iter': 31, 'decreasing': False, 'min_samples_split': 1.0, 'min_samples_leaf': 0.30000000000000004, 'max_features': 0.7000000000000001, 'warm_start': True}. Best is trial 25 with value: 0.15813713564186543.
[I 2023-12-22 00:22:10,075] Trial 81 finished with value: 0.1609831459284992 and parameters: {'model_name': 'IterativeImputer', 'sample_posterior': False, 'initial_strategy': 'mean', 'imputation_order': 'descending'}. Best is trial 25 with value: 0.15813713564186543.
[I 2023-12-22 00:22:40,482] Trial 83 finished with value: 0.1588958586552823 and parameters: {'model_name': 'IterativeImputer', 'sample_posterior': False, 'initial_strategy': 'median', 'imputation_order': 'ascending'}. Best is trial 25 with value: 0.15813713564186543.
[I 2023-12-22 00:23:22,135] Trial 50 finished with value: 0.3697366657611849 and parameters: {'model_name': 'RandomForestImputer', 'max_iter': 43, 'decreasing': False, 'min_samples_split': 0.7000000000000001, 'min_samples_leaf': 0.2, 'max_features': 0.2, 'warm_start': True}. Best is trial 25 with value: 0.15813713564186543.
[I 2023-12-22 00:23:25,788] Trial 68 finished with value: 0.3576663050847473 and parameters: {'model_name': 'RandomForestImputer', 'max_iter': 55, 'decreasing': True, 'min_samples_split': 0.8, 'min_samples_leaf': 0.8, 'max_features': 0.4, 'warm_start': True}. Best is trial 25 with value: 0.15813713564186543.
[I 2023-12-22 00:26:50,070] Trial 85 finished with value: 0.15813713564186543 and parameters: {'model_name': 'IterativeImputer', 'sample_posterior': False, 'initial_strategy': 'median', 'imputation_order': 'arabic'}. Best is trial 25 with value: 0.15813713564186543.
[I 2023-12-22 00:26:54,522] Trial 88 finished with value: 0.15813713564186543 and parameters: {'model_name': 'IterativeImputer', 'sample_posterior': False, 'initial_strategy': 'median', 'imputation_order': 'arabic'}. Best is trial 25 with value: 0.15813713564186543.
[I 2023-12-22 00:26:55,580] Trial 87 finished with value: 0.15813713564186543 and parameters: {'model_name': 'IterativeImputer', 'sample_posterior': False, 'initial_strategy': 'median', 'imputation_order': 'arabic'}. Best is trial 25 with value: 0.15813713564186543.
[I 2023-12-22 00:26:57,853] Trial 86 finished with value: 0.15813713564186543 and parameters: {'model_name': 'IterativeImputer', 'sample_posterior': False, 'initial_strategy': 'median', 'imputation_order': 'arabic'}. Best is trial 25 with value: 0.15813713564186543.
[I 2023-12-22 00:26:58,540] Trial 91 finished with value: 0.15813713564186543 and parameters: {'model_name': 'IterativeImputer', 'sample_posterior': False, 'initial_strategy': 'median', 'imputation_order': 'arabic'}. Best is trial 25 with value: 0.15813713564186543.
[I 2023-12-22 00:27:00,246] Trial 90 finished with value: 0.15813713564186543 and parameters: {'model_name': 'IterativeImputer', 'sample_posterior': False, 'initial_strategy': 'median', 'imputation_order': 'arabic'}. Best is trial 25 with value: 0.15813713564186543.
[I 2023-12-22 00:27:03,603] Trial 89 finished with value: 0.15813713564186543 and parameters: {'model_name': 'IterativeImputer', 'sample_posterior': False, 'initial_strategy': 'median', 'imputation_order': 'arabic'}. Best is trial 25 with value: 0.15813713564186543.
[I 2023-12-22 00:27:07,697] Trial 92 finished with value: 0.15813713564186543 and parameters: {'model_name': 'IterativeImputer', 'sample_posterior': False, 'initial_strategy': 'median', 'imputation_order': 'arabic'}. Best is trial 25 with value: 0.15813713564186543.
[I 2023-12-22 00:27:13,955] Trial 93 finished with value: 0.15825999740855914 and parameters: {'model_name': 'IterativeImputer', 'sample_posterior': False, 'initial_strategy': 'mean', 'imputation_order': 'arabic'}. Best is trial 25 with value: 0.15813713564186543.
[I 2023-12-22 00:27:40,528] Trial 94 finished with value: 0.15825999740855914 and parameters: {'model_name': 'IterativeImputer', 'sample_posterior': False, 'initial_strategy': 'mean', 'imputation_order': 'arabic'}. Best is trial 25 with value: 0.15813713564186543.
[I 2023-12-22 00:30:48,737] Trial 2 finished with value: 0.22745661030889117 and parameters: {'model_name': 'IterativeImputer', 'sample_posterior': True, 'initial_strategy': 'median', 'imputation_order': 'arabic'}. Best is trial 25 with value: 0.15813713564186543.
[I 2023-12-22 00:31:02,010] Trial 21 finished with value: 0.22887712804099508 and parameters: {'model_name': 'IterativeImputer', 'sample_posterior': True, 'initial_strategy': 'median', 'imputation_order': 'roman'}. Best is trial 25 with value: 0.15813713564186543.
[I 2023-12-22 00:31:07,673] Trial 12 finished with value: 0.22953256233200495 and parameters: {'model_name': 'IterativeImputer', 'sample_posterior': True, 'initial_strategy': 'median', 'imputation_order': 'roman'}. Best is trial 25 with value: 0.15813713564186543.
[I 2023-12-22 00:31:09,104] Trial 44 finished with value: 0.22824357985961696 and parameters: {'model_name': 'IterativeImputer', 'sample_posterior': True, 'initial_strategy': 'constant', 'imputation_order': 'roman'}. Best is trial 25 with value: 0.15813713564186543.
[I 2023-12-22 00:31:10,083] Trial 9 finished with value: 0.22658112091518484 and parameters: {'model_name': 'IterativeImputer', 'sample_posterior': True, 'initial_strategy': 'median', 'imputation_order': 'roman'}. Best is trial 25 with value: 0.15813713564186543.
[I 2023-12-22 00:31:13,123] Trial 39 finished with value: 0.22678119621562778 and parameters: {'model_name': 'IterativeImputer', 'sample_posterior': True, 'initial_strategy': 'most_frequent', 'imputation_order': 'ascending'}. Best is trial 25 with value: 0.15813713564186543.
[I 2023-12-22 00:31:19,272] Trial 4 finished with value: 0.2302211703302254 and parameters: {'model_name': 'IterativeImputer', 'sample_posterior': True, 'initial_strategy': 'median', 'imputation_order': 'descending'}. Best is trial 25 with value: 0.15813713564186543.
[I 2023-12-22 00:31:21,794] Trial 13 finished with value: 0.22766377837083987 and parameters: {'model_name': 'IterativeImputer', 'sample_posterior': True, 'initial_strategy': 'most_frequent', 'imputation_order': 'random'}. Best is trial 25 with value: 0.15813713564186543.
[I 2023-12-22 00:31:23,409] Trial 17 finished with value: 0.22892071920698548 and parameters: {'model_name': 'IterativeImputer', 'sample_posterior': True, 'initial_strategy': 'constant', 'imputation_order': 'random'}. Best is trial 25 with value: 0.15813713564186543.
[I 2023-12-22 00:31:25,145] Trial 16 finished with value: 0.22781117981615595 and parameters: {'model_name': 'IterativeImputer', 'sample_posterior': True, 'initial_strategy': 'most_frequent', 'imputation_order': 'random'}. Best is trial 25 with value: 0.15813713564186543.
[I 2023-12-22 00:31:26,529] Trial 63 finished with value: 0.22763776935370092 and parameters: {'model_name': 'IterativeImputer', 'sample_posterior': True, 'initial_strategy': 'mean', 'imputation_order': 'ascending'}. Best is trial 25 with value: 0.15813713564186543.
[I 2023-12-22 00:31:32,671] Trial 64 finished with value: 0.22953978214788648 and parameters: {'model_name': 'IterativeImputer', 'sample_posterior': True, 'initial_strategy': 'median', 'imputation_order': 'roman'}. Best is trial 25 with value: 0.15813713564186543.
[I 2023-12-22 00:32:29,480] Trial 74 finished with value: 0.22728821767745208 and parameters: {'model_name': 'IterativeImputer', 'sample_posterior': True, 'initial_strategy': 'most_frequent', 'imputation_order': 'ascending'}. Best is trial 25 with value: 0.15813713564186543.
[I 2023-12-22 00:32:40,083] Trial 73 finished with value: 0.22862271750696445 and parameters: {'model_name': 'IterativeImputer', 'sample_posterior': True, 'initial_strategy': 'median', 'imputation_order': 'random'}. Best is trial 25 with value: 0.15813713564186543.
[I 2023-12-22 00:33:06,693] Trial 76 finished with value: 0.22732468055816316 and parameters: {'model_name': 'IterativeImputer', 'sample_posterior': True, 'initial_strategy': 'mean', 'imputation_order': 'arabic'}. Best is trial 25 with value: 0.15813713564186543.
[I 2023-12-22 00:33:29,146] Trial 80 finished with value: 0.22956105189179193 and parameters: {'model_name': 'IterativeImputer', 'sample_posterior': True, 'initial_strategy': 'constant', 'imputation_order': 'roman'}. Best is trial 25 with value: 0.15813713564186543.
[I 2023-12-22 00:33:30,956] Trial 79 finished with value: 0.22626137863800683 and parameters: {'model_name': 'IterativeImputer', 'sample_posterior': True, 'initial_strategy': 'most_frequent', 'imputation_order': 'arabic'}. Best is trial 25 with value: 0.15813713564186543.
[I 2023-12-22 00:33:47,497] Trial 82 finished with value: 0.22775709173212627 and parameters: {'model_name': 'IterativeImputer', 'sample_posterior': True, 'initial_strategy': 'constant', 'imputation_order': 'arabic'}. Best is trial 25 with value: 0.15813713564186543.
