[I 2023-12-26 14:18:35,837] Trial 111 finished with value: 0.34377440611189525 and parameters: {'model_name': 'SimpleImputer', 'strategy': 'mean'}. Best is trial 11 with value: 0.34377440611189525.
[I 2023-12-26 14:18:36,340] Trial 114 finished with value: 0.34377440611189525 and parameters: {'model_name': 'SimpleImputer', 'strategy': 'mean'}. Best is trial 11 with value: 0.34377440611189525.
[I 2023-12-26 14:18:36,777] Trial 112 finished with value: 0.34377440611189525 and parameters: {'model_name': 'SimpleImputer', 'strategy': 'mean'}. Best is trial 11 with value: 0.34377440611189525.
[I 2023-12-26 14:18:37,302] Trial 85 finished with value: 0.394221832884478 and parameters: {'model_name': 'SimpleImputer', 'strategy': 'most_frequent'}. Best is trial 11 with value: 0.34377440611189525.
[I 2023-12-26 14:18:37,817] Trial 93 finished with value: 0.394221832884478 and parameters: {'model_name': 'SimpleImputer', 'strategy': 'most_frequent'}. Best is trial 11 with value: 0.34377440611189525.
[I 2023-12-26 14:18:38,395] Trial 91 finished with value: 0.394221832884478 and parameters: {'model_name': 'SimpleImputer', 'strategy': 'most_frequent'}. Best is trial 11 with value: 0.34377440611189525.
[I 2023-12-26 14:18:38,798] Trial 117 finished with value: 0.34377440611189525 and parameters: {'model_name': 'SimpleImputer', 'strategy': 'mean'}. Best is trial 11 with value: 0.34377440611189525.
[I 2023-12-26 14:18:39,012] Trial 115 finished with value: 0.34377440611189525 and parameters: {'model_name': 'SimpleImputer', 'strategy': 'mean'}. Best is trial 11 with value: 0.34377440611189525.
[I 2023-12-26 14:18:39,246] Trial 116 finished with value: 0.34377440611189525 and parameters: {'model_name': 'SimpleImputer', 'strategy': 'mean'}. Best is trial 11 with value: 0.34377440611189525.
[I 2023-12-26 14:18:39,509] Trial 118 finished with value: 0.34377440611189525 and parameters: {'model_name': 'SimpleImputer', 'strategy': 'mean'}. Best is trial 11 with value: 0.34377440611189525.
[I 2023-12-26 14:18:39,725] Trial 119 finished with value: 0.34377440611189525 and parameters: {'model_name': 'SimpleImputer', 'strategy': 'mean'}. Best is trial 11 with value: 0.34377440611189525.
[I 2023-12-26 14:18:40,028] Trial 90 finished with value: 0.394221832884478 and parameters: {'model_name': 'SimpleImputer', 'strategy': 'most_frequent'}. Best is trial 11 with value: 0.34377440611189525.
[I 2023-12-26 14:18:40,363] Trial 121 finished with value: 0.34377440611189525 and parameters: {'model_name': 'SimpleImputer', 'strategy': 'mean'}. Best is trial 11 with value: 0.34377440611189525.
[I 2023-12-26 14:18:40,678] Trial 120 finished with value: 0.34377440611189525 and parameters: {'model_name': 'SimpleImputer', 'strategy': 'mean'}. Best is trial 11 with value: 0.34377440611189525.
[I 2023-12-26 14:18:40,873] Trial 94 finished with value: 0.394221832884478 and parameters: {'model_name': 'SimpleImputer', 'strategy': 'most_frequent'}. Best is trial 11 with value: 0.34377440611189525.
[I 2023-12-26 14:18:41,123] Trial 124 finished with value: 0.34377440611189525 and parameters: {'model_name': 'SimpleImputer', 'strategy': 'mean'}. Best is trial 11 with value: 0.34377440611189525.
[I 2023-12-26 14:18:41,647] Trial 130 finished with value: 0.34377440611189525 and parameters: {'model_name': 'SimpleImputer', 'strategy': 'mean'}. Best is trial 11 with value: 0.34377440611189525.
[I 2023-12-26 14:18:41,857] Trial 125 finished with value: 0.34377440611189525 and parameters: {'model_name': 'SimpleImputer', 'strategy': 'mean'}. Best is trial 11 with value: 0.34377440611189525.
[I 2023-12-26 14:18:42,185] Trial 123 finished with value: 0.34377440611189525 and parameters: {'model_name': 'SimpleImputer', 'strategy': 'mean'}. Best is trial 11 with value: 0.34377440611189525.
[I 2023-12-26 14:18:42,422] Trial 127 finished with value: 0.34377440611189525 and parameters: {'model_name': 'SimpleImputer', 'strategy': 'mean'}. Best is trial 11 with value: 0.34377440611189525.
[I 2023-12-26 14:18:42,679] Trial 129 finished with value: 0.34377440611189525 and parameters: {'model_name': 'SimpleImputer', 'strategy': 'mean'}. Best is trial 11 with value: 0.34377440611189525.
[I 2023-12-26 14:18:42,965] Trial 134 finished with value: 0.34377440611189525 and parameters: {'model_name': 'SimpleImputer', 'strategy': 'mean'}. Best is trial 11 with value: 0.34377440611189525.
[I 2023-12-26 14:18:43,175] Trial 92 finished with value: 0.394221832884478 and parameters: {'model_name': 'SimpleImputer', 'strategy': 'most_frequent'}. Best is trial 11 with value: 0.34377440611189525.
[I 2023-12-26 14:18:43,365] Trial 122 finished with value: 0.34377440611189525 and parameters: {'model_name': 'SimpleImputer', 'strategy': 'mean'}. Best is trial 11 with value: 0.34377440611189525.
[I 2023-12-26 14:18:43,589] Trial 132 finished with value: 0.34377440611189525 and parameters: {'model_name': 'SimpleImputer', 'strategy': 'mean'}. Best is trial 11 with value: 0.34377440611189525.
[I 2023-12-26 14:18:43,796] Trial 128 finished with value: 0.34377440611189525 and parameters: {'model_name': 'SimpleImputer', 'strategy': 'mean'}. Best is trial 11 with value: 0.34377440611189525.
[I 2023-12-26 14:18:44,027] Trial 99 finished with value: 0.394221832884478 and parameters: {'model_name': 'SimpleImputer', 'strategy': 'most_frequent'}. Best is trial 11 with value: 0.34377440611189525.
[I 2023-12-26 14:18:44,240] Trial 100 finished with value: 0.394221832884478 and parameters: {'model_name': 'SimpleImputer', 'strategy': 'most_frequent'}. Best is trial 11 with value: 0.34377440611189525.
[I 2023-12-26 14:18:44,521] Trial 126 finished with value: 0.34377440611189525 and parameters: {'model_name': 'SimpleImputer', 'strategy': 'mean'}. Best is trial 11 with value: 0.34377440611189525.
[I 2023-12-26 14:18:44,855] Trial 97 finished with value: 0.394221832884478 and parameters: {'model_name': 'SimpleImputer', 'strategy': 'most_frequent'}. Best is trial 11 with value: 0.34377440611189525.
[I 2023-12-26 14:18:44,863] Trial 133 finished with value: 0.34377440611189525 and parameters: {'model_name': 'SimpleImputer', 'strategy': 'mean'}. Best is trial 11 with value: 0.34377440611189525.
[I 2023-12-26 14:18:45,398] Trial 96 finished with value: 0.394221832884478 and parameters: {'model_name': 'SimpleImputer', 'strategy': 'most_frequent'}. Best is trial 11 with value: 0.34377440611189525.
[I 2023-12-26 14:18:45,692] Trial 101 finished with value: 0.394221832884478 and parameters: {'model_name': 'SimpleImputer', 'strategy': 'most_frequent'}. Best is trial 11 with value: 0.34377440611189525.
[I 2023-12-26 14:18:46,043] Trial 136 finished with value: 0.34377440611189525 and parameters: {'model_name': 'SimpleImputer', 'strategy': 'mean'}. Best is trial 11 with value: 0.34377440611189525.
[I 2023-12-26 14:18:46,307] Trial 131 finished with value: 0.34377440611189525 and parameters: {'model_name': 'SimpleImputer', 'strategy': 'mean'}. Best is trial 11 with value: 0.34377440611189525.
[I 2023-12-26 14:18:46,583] Trial 137 finished with value: 0.34377440611189525 and parameters: {'model_name': 'SimpleImputer', 'strategy': 'mean'}. Best is trial 11 with value: 0.34377440611189525.
[I 2023-12-26 14:18:46,790] Trial 135 finished with value: 0.34377440611189525 and parameters: {'model_name': 'SimpleImputer', 'strategy': 'mean'}. Best is trial 11 with value: 0.34377440611189525.
[I 2023-12-26 14:18:47,052] Trial 139 finished with value: 0.34377440611189525 and parameters: {'model_name': 'SimpleImputer', 'strategy': 'mean'}. Best is trial 11 with value: 0.34377440611189525.
[I 2023-12-26 14:18:47,487] Trial 138 finished with value: 0.34377440611189525 and parameters: {'model_name': 'SimpleImputer', 'strategy': 'mean'}. Best is trial 11 with value: 0.34377440611189525.
[I 2023-12-26 14:18:47,841] Trial 102 finished with value: 0.394221832884478 and parameters: {'model_name': 'SimpleImputer', 'strategy': 'most_frequent'}. Best is trial 11 with value: 0.34377440611189525.
[I 2023-12-26 14:18:48,101] Trial 141 finished with value: 0.34377440611189525 and parameters: {'model_name': 'SimpleImputer', 'strategy': 'mean'}. Best is trial 11 with value: 0.34377440611189525.
[I 2023-12-26 14:18:48,325] Trial 142 finished with value: 0.34377440611189525 and parameters: {'model_name': 'SimpleImputer', 'strategy': 'mean'}. Best is trial 11 with value: 0.34377440611189525.
[I 2023-12-26 14:18:48,574] Trial 140 finished with value: 0.34377440611189525 and parameters: {'model_name': 'SimpleImputer', 'strategy': 'mean'}. Best is trial 11 with value: 0.34377440611189525.
[I 2023-12-26 14:18:48,819] Trial 146 finished with value: 0.34377440611189525 and parameters: {'model_name': 'SimpleImputer', 'strategy': 'mean'}. Best is trial 11 with value: 0.34377440611189525.
[I 2023-12-26 14:18:49,093] Trial 144 finished with value: 0.34377440611189525 and parameters: {'model_name': 'SimpleImputer', 'strategy': 'mean'}. Best is trial 11 with value: 0.34377440611189525.
[I 2023-12-26 14:18:49,357] Trial 145 finished with value: 0.34377440611189525 and parameters: {'model_name': 'SimpleImputer', 'strategy': 'mean'}. Best is trial 11 with value: 0.34377440611189525.
[I 2023-12-26 14:18:49,869] Trial 98 finished with value: 0.394221832884478 and parameters: {'model_name': 'SimpleImputer', 'strategy': 'most_frequent'}. Best is trial 11 with value: 0.34377440611189525.
[I 2023-12-26 14:18:50,353] Trial 143 finished with value: 0.34377440611189525 and parameters: {'model_name': 'SimpleImputer', 'strategy': 'mean'}. Best is trial 11 with value: 0.34377440611189525.
[I 2023-12-26 14:18:50,592] Trial 148 finished with value: 0.34377440611189525 and parameters: {'model_name': 'SimpleImputer', 'strategy': 'mean'}. Best is trial 11 with value: 0.34377440611189525.
[I 2023-12-26 14:18:50,899] Trial 95 finished with value: 0.394221832884478 and parameters: {'model_name': 'SimpleImputer', 'strategy': 'most_frequent'}. Best is trial 11 with value: 0.34377440611189525.
[I 2023-12-26 14:18:51,734] Trial 147 finished with value: 0.34377440611189525 and parameters: {'model_name': 'SimpleImputer', 'strategy': 'mean'}. Best is trial 11 with value: 0.34377440611189525.
[I 2023-12-26 14:18:52,075] Trial 149 finished with value: 0.34377440611189525 and parameters: {'model_name': 'SimpleImputer', 'strategy': 'mean'}. Best is trial 11 with value: 0.34377440611189525.
[I 2023-12-26 14:18:52,311] Trial 151 finished with value: 0.34377440611189525 and parameters: {'model_name': 'SimpleImputer', 'strategy': 'mean'}. Best is trial 11 with value: 0.34377440611189525.
[I 2023-12-26 14:18:52,553] Trial 159 finished with value: 0.34377440611189525 and parameters: {'model_name': 'SimpleImputer', 'strategy': 'mean'}. Best is trial 11 with value: 0.34377440611189525.
[I 2023-12-26 14:18:53,159] Trial 153 finished with value: 0.34377440611189525 and parameters: {'model_name': 'SimpleImputer', 'strategy': 'mean'}. Best is trial 11 with value: 0.34377440611189525.
[I 2023-12-26 14:18:53,486] Trial 150 finished with value: 0.34377440611189525 and parameters: {'model_name': 'SimpleImputer', 'strategy': 'mean'}. Best is trial 11 with value: 0.34377440611189525.
[I 2023-12-26 14:18:53,716] Trial 152 finished with value: 0.34377440611189525 and parameters: {'model_name': 'SimpleImputer', 'strategy': 'mean'}. Best is trial 11 with value: 0.34377440611189525.
[I 2023-12-26 14:18:53,946] Trial 155 finished with value: 0.34377440611189525 and parameters: {'model_name': 'SimpleImputer', 'strategy': 'mean'}. Best is trial 11 with value: 0.34377440611189525.
[I 2023-12-26 14:18:54,174] Trial 154 finished with value: 0.34377440611189525 and parameters: {'model_name': 'SimpleImputer', 'strategy': 'mean'}. Best is trial 11 with value: 0.34377440611189525.
[I 2023-12-26 14:18:54,519] Trial 156 finished with value: 0.34377440611189525 and parameters: {'model_name': 'SimpleImputer', 'strategy': 'mean'}. Best is trial 11 with value: 0.34377440611189525.
[I 2023-12-26 14:18:54,838] Trial 161 finished with value: 0.34377440611189525 and parameters: {'model_name': 'SimpleImputer', 'strategy': 'mean'}. Best is trial 11 with value: 0.34377440611189525.
[I 2023-12-26 14:18:55,064] Trial 160 finished with value: 0.34377440611189525 and parameters: {'model_name': 'SimpleImputer', 'strategy': 'mean'}. Best is trial 11 with value: 0.34377440611189525.
[I 2023-12-26 14:18:55,322] Trial 168 finished with value: 0.34377440611189525 and parameters: {'model_name': 'SimpleImputer', 'strategy': 'mean'}. Best is trial 11 with value: 0.34377440611189525.
[I 2023-12-26 14:18:55,558] Trial 162 finished with value: 0.34377440611189525 and parameters: {'model_name': 'SimpleImputer', 'strategy': 'mean'}. Best is trial 11 with value: 0.34377440611189525.
[I 2023-12-26 14:18:55,868] Trial 157 finished with value: 0.34377440611189525 and parameters: {'model_name': 'SimpleImputer', 'strategy': 'mean'}. Best is trial 11 with value: 0.34377440611189525.
[I 2023-12-26 14:18:56,097] Trial 158 finished with value: 0.34377440611189525 and parameters: {'model_name': 'SimpleImputer', 'strategy': 'mean'}. Best is trial 11 with value: 0.34377440611189525.
[I 2023-12-26 14:18:56,329] Trial 165 finished with value: 0.34377440611189525 and parameters: {'model_name': 'SimpleImputer', 'strategy': 'mean'}. Best is trial 11 with value: 0.34377440611189525.
[I 2023-12-26 14:18:56,630] Trial 173 finished with value: 0.34377440611189525 and parameters: {'model_name': 'SimpleImputer', 'strategy': 'mean'}. Best is trial 11 with value: 0.34377440611189525.
[I 2023-12-26 14:18:56,902] Trial 164 finished with value: 0.34377440611189525 and parameters: {'model_name': 'SimpleImputer', 'strategy': 'mean'}. Best is trial 11 with value: 0.34377440611189525.
[I 2023-12-26 14:18:57,136] Trial 172 finished with value: 0.34377440611189525 and parameters: {'model_name': 'SimpleImputer', 'strategy': 'mean'}. Best is trial 11 with value: 0.34377440611189525.
[I 2023-12-26 14:18:57,367] Trial 167 finished with value: 0.34377440611189525 and parameters: {'model_name': 'SimpleImputer', 'strategy': 'mean'}. Best is trial 11 with value: 0.34377440611189525.
[I 2023-12-26 14:18:57,589] Trial 176 finished with value: 0.34377440611189525 and parameters: {'model_name': 'SimpleImputer', 'strategy': 'mean'}. Best is trial 11 with value: 0.34377440611189525.
[I 2023-12-26 14:18:57,807] Trial 174 finished with value: 0.34377440611189525 and parameters: {'model_name': 'SimpleImputer', 'strategy': 'mean'}. Best is trial 11 with value: 0.34377440611189525.
[I 2023-12-26 14:18:58,020] Trial 163 finished with value: 0.34377440611189525 and parameters: {'model_name': 'SimpleImputer', 'strategy': 'mean'}. Best is trial 11 with value: 0.34377440611189525.
[I 2023-12-26 14:18:58,227] Trial 175 finished with value: 0.34377440611189525 and parameters: {'model_name': 'SimpleImputer', 'strategy': 'mean'}. Best is trial 11 with value: 0.34377440611189525.
[I 2023-12-26 14:18:58,441] Trial 171 finished with value: 0.34377440611189525 and parameters: {'model_name': 'SimpleImputer', 'strategy': 'mean'}. Best is trial 11 with value: 0.34377440611189525.
[I 2023-12-26 14:18:58,682] Trial 182 finished with value: 0.34377440611189525 and parameters: {'model_name': 'SimpleImputer', 'strategy': 'mean'}. Best is trial 11 with value: 0.34377440611189525.
[I 2023-12-26 14:18:58,888] Trial 169 finished with value: 0.34377440611189525 and parameters: {'model_name': 'SimpleImputer', 'strategy': 'mean'}. Best is trial 11 with value: 0.34377440611189525.
[I 2023-12-26 14:18:59,142] Trial 180 finished with value: 0.34377440611189525 and parameters: {'model_name': 'SimpleImputer', 'strategy': 'mean'}. Best is trial 11 with value: 0.34377440611189525.
[I 2023-12-26 14:18:59,403] Trial 178 finished with value: 0.34377440611189525 and parameters: {'model_name': 'SimpleImputer', 'strategy': 'mean'}. Best is trial 11 with value: 0.34377440611189525.
[I 2023-12-26 14:18:59,608] Trial 177 finished with value: 0.34377440611189525 and parameters: {'model_name': 'SimpleImputer', 'strategy': 'mean'}. Best is trial 11 with value: 0.34377440611189525.
[I 2023-12-26 14:18:59,877] Trial 179 finished with value: 0.34377440611189525 and parameters: {'model_name': 'SimpleImputer', 'strategy': 'mean'}. Best is trial 11 with value: 0.34377440611189525.
[I 2023-12-26 14:19:00,136] Trial 181 finished with value: 0.34377440611189525 and parameters: {'model_name': 'SimpleImputer', 'strategy': 'mean'}. Best is trial 11 with value: 0.34377440611189525.
[I 2023-12-26 14:19:00,384] Trial 170 finished with value: 0.34377440611189525 and parameters: {'model_name': 'SimpleImputer', 'strategy': 'mean'}. Best is trial 11 with value: 0.34377440611189525.
[I 2023-12-26 14:19:00,600] Trial 186 finished with value: 0.34377440611189525 and parameters: {'model_name': 'SimpleImputer', 'strategy': 'mean'}. Best is trial 11 with value: 0.34377440611189525.
[I 2023-12-26 14:19:00,836] Trial 183 finished with value: 0.34377440611189525 and parameters: {'model_name': 'SimpleImputer', 'strategy': 'mean'}. Best is trial 11 with value: 0.34377440611189525.
[I 2023-12-26 14:19:01,048] Trial 184 finished with value: 0.34377440611189525 and parameters: {'model_name': 'SimpleImputer', 'strategy': 'mean'}. Best is trial 11 with value: 0.34377440611189525.
[I 2023-12-26 14:19:01,258] Trial 166 finished with value: 0.34377440611189525 and parameters: {'model_name': 'SimpleImputer', 'strategy': 'mean'}. Best is trial 11 with value: 0.34377440611189525.
[I 2023-12-26 14:19:01,512] Trial 187 finished with value: 0.34377440611189525 and parameters: {'model_name': 'SimpleImputer', 'strategy': 'mean'}. Best is trial 11 with value: 0.34377440611189525.
[I 2023-12-26 14:19:01,731] Trial 189 finished with value: 0.34377440611189525 and parameters: {'model_name': 'SimpleImputer', 'strategy': 'mean'}. Best is trial 11 with value: 0.34377440611189525.
[I 2023-12-26 14:19:01,977] Trial 190 finished with value: 0.34377440611189525 and parameters: {'model_name': 'SimpleImputer', 'strategy': 'mean'}. Best is trial 11 with value: 0.34377440611189525.
[I 2023-12-26 14:19:02,276] Trial 185 finished with value: 0.34377440611189525 and parameters: {'model_name': 'SimpleImputer', 'strategy': 'mean'}. Best is trial 11 with value: 0.34377440611189525.
[I 2023-12-26 14:19:02,624] Trial 191 finished with value: 0.34377440611189525 and parameters: {'model_name': 'SimpleImputer', 'strategy': 'mean'}. Best is trial 11 with value: 0.34377440611189525.
[I 2023-12-26 14:19:02,790] Trial 197 finished with value: 0.394221832884478 and parameters: {'model_name': 'SimpleImputer', 'strategy': 'constant'}. Best is trial 11 with value: 0.34377440611189525.
[I 2023-12-26 14:19:02,955] Trial 192 finished with value: 0.34377440611189525 and parameters: {'model_name': 'SimpleImputer', 'strategy': 'mean'}. Best is trial 11 with value: 0.34377440611189525.
[I 2023-12-26 14:19:03,218] Trial 188 finished with value: 0.34377440611189525 and parameters: {'model_name': 'SimpleImputer', 'strategy': 'mean'}. Best is trial 11 with value: 0.34377440611189525.
[I 2023-12-26 14:19:03,505] Trial 194 finished with value: 0.34377440611189525 and parameters: {'model_name': 'SimpleImputer', 'strategy': 'mean'}. Best is trial 11 with value: 0.34377440611189525.
[I 2023-12-26 14:19:03,697] Trial 193 finished with value: 0.34377440611189525 and parameters: {'model_name': 'SimpleImputer', 'strategy': 'mean'}. Best is trial 11 with value: 0.34377440611189525.
[I 2023-12-26 14:19:04,045] Trial 195 finished with value: 0.34377440611189525 and parameters: {'model_name': 'SimpleImputer', 'strategy': 'mean'}. Best is trial 11 with value: 0.34377440611189525.
[I 2023-12-26 14:19:04,318] Trial 199 finished with value: 0.34377440611189525 and parameters: {'model_name': 'SimpleImputer', 'strategy': 'mean'}. Best is trial 11 with value: 0.34377440611189525.
[I 2023-12-26 14:19:04,493] Trial 196 finished with value: 0.34377440611189525 and parameters: {'model_name': 'SimpleImputer', 'strategy': 'mean'}. Best is trial 11 with value: 0.34377440611189525.
[I 2023-12-26 14:19:04,743] Trial 198 finished with value: 0.34377440611189525 and parameters: {'model_name': 'SimpleImputer', 'strategy': 'mean'}. Best is trial 11 with value: 0.34377440611189525.
