[I 2023-12-12 14:51:44,321] Trial 96 finished with value: 7601.564978055251 and parameters: {'model_name': 'SimpleImputer', 'strategy': 'most_frequent'}. Best is trial 2 with value: 7430.862593009512.
[I 2023-12-12 14:51:44,497] Trial 74 finished with value: 7601.564978055251 and parameters: {'model_name': 'SimpleImputer', 'strategy': 'most_frequent'}. Best is trial 2 with value: 7430.862593009512.
[I 2023-12-12 14:51:44,760] Trial 79 finished with value: 7601.564978055251 and parameters: {'model_name': 'SimpleImputer', 'strategy': 'most_frequent'}. Best is trial 2 with value: 7430.862593009512.
[I 2023-12-12 14:51:45,003] Trial 120 finished with value: 7430.862593009512 and parameters: {'model_name': 'SimpleImputer', 'strategy': 'mean'}. Best is trial 2 with value: 7430.862593009512.
[I 2023-12-12 14:51:45,385] Trial 116 finished with value: 7430.862593009512 and parameters: {'model_name': 'SimpleImputer', 'strategy': 'mean'}. Best is trial 2 with value: 7430.862593009512.
[I 2023-12-12 14:51:45,640] Trial 94 finished with value: 7601.564978055251 and parameters: {'model_name': 'SimpleImputer', 'strategy': 'most_frequent'}. Best is trial 2 with value: 7430.862593009512.
[I 2023-12-12 14:51:45,877] Trial 85 finished with value: 7601.564978055251 and parameters: {'model_name': 'SimpleImputer', 'strategy': 'most_frequent'}. Best is trial 2 with value: 7430.862593009512.
[I 2023-12-12 14:51:46,152] Trial 126 finished with value: 7430.862593009512 and parameters: {'model_name': 'SimpleImputer', 'strategy': 'mean'}. Best is trial 2 with value: 7430.862593009512.
[I 2023-12-12 14:51:46,453] Trial 95 finished with value: 7601.564978055251 and parameters: {'model_name': 'SimpleImputer', 'strategy': 'most_frequent'}. Best is trial 2 with value: 7430.862593009512.
[I 2023-12-12 14:51:46,667] Trial 118 finished with value: 7430.862593009512 and parameters: {'model_name': 'SimpleImputer', 'strategy': 'mean'}. Best is trial 2 with value: 7430.862593009512.
[I 2023-12-12 14:51:47,040] Trial 117 finished with value: 7430.862593009512 and parameters: {'model_name': 'SimpleImputer', 'strategy': 'mean'}. Best is trial 2 with value: 7430.862593009512.
[I 2023-12-12 14:51:47,285] Trial 121 finished with value: 7430.862593009512 and parameters: {'model_name': 'SimpleImputer', 'strategy': 'mean'}. Best is trial 2 with value: 7430.862593009512.
[I 2023-12-12 14:51:47,516] Trial 122 finished with value: 7430.862593009512 and parameters: {'model_name': 'SimpleImputer', 'strategy': 'mean'}. Best is trial 2 with value: 7430.862593009512.
[I 2023-12-12 14:51:47,769] Trial 128 finished with value: 7430.862593009512 and parameters: {'model_name': 'SimpleImputer', 'strategy': 'mean'}. Best is trial 2 with value: 7430.862593009512.
[I 2023-12-12 14:51:47,957] Trial 115 finished with value: 7430.862593009512 and parameters: {'model_name': 'SimpleImputer', 'strategy': 'mean'}. Best is trial 2 with value: 7430.862593009512.
[I 2023-12-12 14:51:48,246] Trial 124 finished with value: 7430.862593009512 and parameters: {'model_name': 'SimpleImputer', 'strategy': 'mean'}. Best is trial 2 with value: 7430.862593009512.
[I 2023-12-12 14:51:48,443] Trial 88 finished with value: 7601.564978055251 and parameters: {'model_name': 'SimpleImputer', 'strategy': 'most_frequent'}. Best is trial 2 with value: 7430.862593009512.
[I 2023-12-12 14:51:48,667] Trial 125 finished with value: 7430.862593009512 and parameters: {'model_name': 'SimpleImputer', 'strategy': 'mean'}. Best is trial 2 with value: 7430.862593009512.
[I 2023-12-12 14:51:48,985] Trial 134 finished with value: 7430.862593009512 and parameters: {'model_name': 'SimpleImputer', 'strategy': 'mean'}. Best is trial 2 with value: 7430.862593009512.
[I 2023-12-12 14:51:49,222] Trial 93 finished with value: 7601.564978055251 and parameters: {'model_name': 'SimpleImputer', 'strategy': 'most_frequent'}. Best is trial 2 with value: 7430.862593009512.
[I 2023-12-12 14:51:49,408] Trial 97 finished with value: 7601.564978055251 and parameters: {'model_name': 'SimpleImputer', 'strategy': 'most_frequent'}. Best is trial 2 with value: 7430.862593009512.
[I 2023-12-12 14:51:49,661] Trial 129 finished with value: 7430.862593009512 and parameters: {'model_name': 'SimpleImputer', 'strategy': 'mean'}. Best is trial 2 with value: 7430.862593009512.
[I 2023-12-12 14:51:49,875] Trial 123 finished with value: 7430.862593009512 and parameters: {'model_name': 'SimpleImputer', 'strategy': 'mean'}. Best is trial 2 with value: 7430.862593009512.
[I 2023-12-12 14:51:50,151] Trial 137 finished with value: 7430.862593009512 and parameters: {'model_name': 'SimpleImputer', 'strategy': 'mean'}. Best is trial 2 with value: 7430.862593009512.
[I 2023-12-12 14:51:50,385] Trial 127 finished with value: 7430.862593009512 and parameters: {'model_name': 'SimpleImputer', 'strategy': 'mean'}. Best is trial 2 with value: 7430.862593009512.
[I 2023-12-12 14:51:50,561] Trial 98 finished with value: 7601.564978055251 and parameters: {'model_name': 'SimpleImputer', 'strategy': 'most_frequent'}. Best is trial 2 with value: 7430.862593009512.
[I 2023-12-12 14:51:50,847] Trial 130 finished with value: 7430.862593009512 and parameters: {'model_name': 'SimpleImputer', 'strategy': 'mean'}. Best is trial 2 with value: 7430.862593009512.
[I 2023-12-12 14:51:51,159] Trial 102 finished with value: 7601.564978055251 and parameters: {'model_name': 'SimpleImputer', 'strategy': 'most_frequent'}. Best is trial 2 with value: 7430.862593009512.
[I 2023-12-12 14:51:51,414] Trial 99 finished with value: 7601.564978055251 and parameters: {'model_name': 'SimpleImputer', 'strategy': 'most_frequent'}. Best is trial 2 with value: 7430.862593009512.
[I 2023-12-12 14:51:51,716] Trial 136 finished with value: 7430.862593009512 and parameters: {'model_name': 'SimpleImputer', 'strategy': 'mean'}. Best is trial 2 with value: 7430.862593009512.
[I 2023-12-12 14:51:51,896] Trial 139 finished with value: 7430.862593009512 and parameters: {'model_name': 'SimpleImputer', 'strategy': 'mean'}. Best is trial 2 with value: 7430.862593009512.
[I 2023-12-12 14:51:52,147] Trial 101 finished with value: 7601.564978055251 and parameters: {'model_name': 'SimpleImputer', 'strategy': 'most_frequent'}. Best is trial 2 with value: 7430.862593009512.
[I 2023-12-12 14:51:52,417] Trial 131 finished with value: 7430.862593009512 and parameters: {'model_name': 'SimpleImputer', 'strategy': 'mean'}. Best is trial 2 with value: 7430.862593009512.
[I 2023-12-12 14:51:52,657] Trial 132 finished with value: 7430.862593009512 and parameters: {'model_name': 'SimpleImputer', 'strategy': 'mean'}. Best is trial 2 with value: 7430.862593009512.
[I 2023-12-12 14:51:52,834] Trial 138 finished with value: 7430.862593009512 and parameters: {'model_name': 'SimpleImputer', 'strategy': 'mean'}. Best is trial 2 with value: 7430.862593009512.
[I 2023-12-12 14:51:53,148] Trial 104 finished with value: 7601.564978055251 and parameters: {'model_name': 'SimpleImputer', 'strategy': 'most_frequent'}. Best is trial 2 with value: 7430.862593009512.
[I 2023-12-12 14:51:53,326] Trial 143 finished with value: 7430.862593009512 and parameters: {'model_name': 'SimpleImputer', 'strategy': 'mean'}. Best is trial 2 with value: 7430.862593009512.
[I 2023-12-12 14:51:53,605] Trial 140 finished with value: 7430.862593009512 and parameters: {'model_name': 'SimpleImputer', 'strategy': 'mean'}. Best is trial 2 with value: 7430.862593009512.
[I 2023-12-12 14:51:53,813] Trial 100 finished with value: 7601.564978055251 and parameters: {'model_name': 'SimpleImputer', 'strategy': 'most_frequent'}. Best is trial 2 with value: 7430.862593009512.
[I 2023-12-12 14:51:54,007] Trial 141 finished with value: 7430.862593009512 and parameters: {'model_name': 'SimpleImputer', 'strategy': 'mean'}. Best is trial 2 with value: 7430.862593009512.
[I 2023-12-12 14:51:54,239] Trial 135 finished with value: 7430.862593009512 and parameters: {'model_name': 'SimpleImputer', 'strategy': 'mean'}. Best is trial 2 with value: 7430.862593009512.
[I 2023-12-12 14:51:54,482] Trial 133 finished with value: 7430.862593009512 and parameters: {'model_name': 'SimpleImputer', 'strategy': 'mean'}. Best is trial 2 with value: 7430.862593009512.
[I 2023-12-12 14:51:54,684] Trial 155 finished with value: 7430.862593009512 and parameters: {'model_name': 'SimpleImputer', 'strategy': 'mean'}. Best is trial 2 with value: 7430.862593009512.
[I 2023-12-12 14:51:54,870] Trial 145 finished with value: 7430.862593009512 and parameters: {'model_name': 'SimpleImputer', 'strategy': 'mean'}. Best is trial 2 with value: 7430.862593009512.
[I 2023-12-12 14:51:55,046] Trial 142 finished with value: 7430.862593009512 and parameters: {'model_name': 'SimpleImputer', 'strategy': 'mean'}. Best is trial 2 with value: 7430.862593009512.
[I 2023-12-12 14:51:55,284] Trial 152 finished with value: 7430.862593009512 and parameters: {'model_name': 'SimpleImputer', 'strategy': 'mean'}. Best is trial 2 with value: 7430.862593009512.
[I 2023-12-12 14:51:55,589] Trial 146 finished with value: 7430.862593009512 and parameters: {'model_name': 'SimpleImputer', 'strategy': 'mean'}. Best is trial 2 with value: 7430.862593009512.
[I 2023-12-12 14:51:55,806] Trial 147 finished with value: 7430.862593009512 and parameters: {'model_name': 'SimpleImputer', 'strategy': 'mean'}. Best is trial 2 with value: 7430.862593009512.
[I 2023-12-12 14:51:56,019] Trial 103 finished with value: 7601.564978055251 and parameters: {'model_name': 'SimpleImputer', 'strategy': 'most_frequent'}. Best is trial 2 with value: 7430.862593009512.
[I 2023-12-12 14:51:56,285] Trial 144 finished with value: 7430.862593009512 and parameters: {'model_name': 'SimpleImputer', 'strategy': 'mean'}. Best is trial 2 with value: 7430.862593009512.
[I 2023-12-12 14:51:56,547] Trial 166 finished with value: 7430.862593009512 and parameters: {'model_name': 'SimpleImputer', 'strategy': 'mean'}. Best is trial 2 with value: 7430.862593009512.
[I 2023-12-12 14:51:56,730] Trial 157 finished with value: 7430.862593009512 and parameters: {'model_name': 'SimpleImputer', 'strategy': 'mean'}. Best is trial 2 with value: 7430.862593009512.
[I 2023-12-12 14:51:56,903] Trial 148 finished with value: 7430.862593009512 and parameters: {'model_name': 'SimpleImputer', 'strategy': 'mean'}. Best is trial 2 with value: 7430.862593009512.
[I 2023-12-12 14:51:57,191] Trial 162 finished with value: 7430.862593009512 and parameters: {'model_name': 'SimpleImputer', 'strategy': 'mean'}. Best is trial 2 with value: 7430.862593009512.
[I 2023-12-12 14:51:57,376] Trial 150 finished with value: 7430.862593009512 and parameters: {'model_name': 'SimpleImputer', 'strategy': 'mean'}. Best is trial 2 with value: 7430.862593009512.
[I 2023-12-12 14:51:57,619] Trial 163 finished with value: 7430.862593009512 and parameters: {'model_name': 'SimpleImputer', 'strategy': 'mean'}. Best is trial 2 with value: 7430.862593009512.
[I 2023-12-12 14:51:57,812] Trial 149 finished with value: 7430.862593009512 and parameters: {'model_name': 'SimpleImputer', 'strategy': 'mean'}. Best is trial 2 with value: 7430.862593009512.
[I 2023-12-12 14:51:58,070] Trial 160 finished with value: 7430.862593009512 and parameters: {'model_name': 'SimpleImputer', 'strategy': 'mean'}. Best is trial 2 with value: 7430.862593009512.
[I 2023-12-12 14:51:58,436] Trial 154 finished with value: 7430.862593009512 and parameters: {'model_name': 'SimpleImputer', 'strategy': 'mean'}. Best is trial 2 with value: 7430.862593009512.
[I 2023-12-12 14:51:58,695] Trial 161 finished with value: 7430.862593009512 and parameters: {'model_name': 'SimpleImputer', 'strategy': 'mean'}. Best is trial 2 with value: 7430.862593009512.
[I 2023-12-12 14:51:58,963] Trial 158 finished with value: 7430.862593009512 and parameters: {'model_name': 'SimpleImputer', 'strategy': 'mean'}. Best is trial 2 with value: 7430.862593009512.
[I 2023-12-12 14:51:59,180] Trial 151 finished with value: 7430.862593009512 and parameters: {'model_name': 'SimpleImputer', 'strategy': 'mean'}. Best is trial 2 with value: 7430.862593009512.
[I 2023-12-12 14:51:59,473] Trial 165 finished with value: 7430.862593009512 and parameters: {'model_name': 'SimpleImputer', 'strategy': 'mean'}. Best is trial 2 with value: 7430.862593009512.
[I 2023-12-12 14:51:59,648] Trial 168 finished with value: 7430.862593009512 and parameters: {'model_name': 'SimpleImputer', 'strategy': 'mean'}. Best is trial 2 with value: 7430.862593009512.
[I 2023-12-12 14:51:59,887] Trial 172 finished with value: 7430.862593009512 and parameters: {'model_name': 'SimpleImputer', 'strategy': 'mean'}. Best is trial 2 with value: 7430.862593009512.
[I 2023-12-12 14:52:00,091] Trial 167 finished with value: 7430.862593009512 and parameters: {'model_name': 'SimpleImputer', 'strategy': 'mean'}. Best is trial 2 with value: 7430.862593009512.
[I 2023-12-12 14:52:00,346] Trial 169 finished with value: 7430.862593009512 and parameters: {'model_name': 'SimpleImputer', 'strategy': 'mean'}. Best is trial 2 with value: 7430.862593009512.
[I 2023-12-12 14:52:00,514] Trial 164 finished with value: 7430.862593009512 and parameters: {'model_name': 'SimpleImputer', 'strategy': 'mean'}. Best is trial 2 with value: 7430.862593009512.
[I 2023-12-12 14:52:00,753] Trial 105 finished with value: 7601.564978055251 and parameters: {'model_name': 'SimpleImputer', 'strategy': 'most_frequent'}. Best is trial 2 with value: 7430.862593009512.
[I 2023-12-12 14:52:00,993] Trial 153 finished with value: 7430.862593009512 and parameters: {'model_name': 'SimpleImputer', 'strategy': 'mean'}. Best is trial 2 with value: 7430.862593009512.
[I 2023-12-12 14:52:01,243] Trial 159 finished with value: 7430.862593009512 and parameters: {'model_name': 'SimpleImputer', 'strategy': 'mean'}. Best is trial 2 with value: 7430.862593009512.
[I 2023-12-12 14:52:01,495] Trial 170 finished with value: 7430.862593009512 and parameters: {'model_name': 'SimpleImputer', 'strategy': 'mean'}. Best is trial 2 with value: 7430.862593009512.
[I 2023-12-12 14:52:01,847] Trial 178 finished with value: 7430.862593009512 and parameters: {'model_name': 'SimpleImputer', 'strategy': 'mean'}. Best is trial 2 with value: 7430.862593009512.
[I 2023-12-12 14:52:02,059] Trial 173 finished with value: 7430.862593009512 and parameters: {'model_name': 'SimpleImputer', 'strategy': 'mean'}. Best is trial 2 with value: 7430.862593009512.
[I 2023-12-12 14:52:02,325] Trial 174 finished with value: 7430.862593009512 and parameters: {'model_name': 'SimpleImputer', 'strategy': 'mean'}. Best is trial 2 with value: 7430.862593009512.
[I 2023-12-12 14:52:02,606] Trial 156 finished with value: 7430.862593009512 and parameters: {'model_name': 'SimpleImputer', 'strategy': 'mean'}. Best is trial 2 with value: 7430.862593009512.
[I 2023-12-12 14:52:02,898] Trial 171 finished with value: 7430.862593009512 and parameters: {'model_name': 'SimpleImputer', 'strategy': 'mean'}. Best is trial 2 with value: 7430.862593009512.
[I 2023-12-12 14:52:03,211] Trial 177 finished with value: 7430.862593009512 and parameters: {'model_name': 'SimpleImputer', 'strategy': 'mean'}. Best is trial 2 with value: 7430.862593009512.
[I 2023-12-12 14:52:03,396] Trial 175 finished with value: 7430.862593009512 and parameters: {'model_name': 'SimpleImputer', 'strategy': 'mean'}. Best is trial 2 with value: 7430.862593009512.
[I 2023-12-12 14:52:03,645] Trial 179 finished with value: 7430.862593009512 and parameters: {'model_name': 'SimpleImputer', 'strategy': 'mean'}. Best is trial 2 with value: 7430.862593009512.
[I 2023-12-12 14:52:03,845] Trial 176 finished with value: 7430.862593009512 and parameters: {'model_name': 'SimpleImputer', 'strategy': 'mean'}. Best is trial 2 with value: 7430.862593009512.
[I 2023-12-12 14:52:04,276] Trial 198 finished with value: 7602.121809036444 and parameters: {'model_name': 'SimpleImputer', 'strategy': 'constant'}. Best is trial 2 with value: 7430.862593009512.
[I 2023-12-12 14:52:04,490] Trial 181 finished with value: 7430.862593009512 and parameters: {'model_name': 'SimpleImputer', 'strategy': 'mean'}. Best is trial 2 with value: 7430.862593009512.
[I 2023-12-12 14:52:04,699] Trial 185 finished with value: 7430.862593009512 and parameters: {'model_name': 'SimpleImputer', 'strategy': 'mean'}. Best is trial 2 with value: 7430.862593009512.
[I 2023-12-12 14:52:04,891] Trial 183 finished with value: 7430.862593009512 and parameters: {'model_name': 'SimpleImputer', 'strategy': 'mean'}. Best is trial 2 with value: 7430.862593009512.
[I 2023-12-12 14:52:05,107] Trial 188 finished with value: 7430.862593009512 and parameters: {'model_name': 'SimpleImputer', 'strategy': 'mean'}. Best is trial 2 with value: 7430.862593009512.
[I 2023-12-12 14:52:05,391] Trial 196 finished with value: 7602.121809036444 and parameters: {'model_name': 'SimpleImputer', 'strategy': 'constant'}. Best is trial 2 with value: 7430.862593009512.
[I 2023-12-12 14:52:05,613] Trial 197 finished with value: 7602.121809036444 and parameters: {'model_name': 'SimpleImputer', 'strategy': 'constant'}. Best is trial 2 with value: 7430.862593009512.
[I 2023-12-12 14:52:05,826] Trial 186 finished with value: 7430.862593009512 and parameters: {'model_name': 'SimpleImputer', 'strategy': 'mean'}. Best is trial 2 with value: 7430.862593009512.
[I 2023-12-12 14:52:06,049] Trial 182 finished with value: 7430.862593009512 and parameters: {'model_name': 'SimpleImputer', 'strategy': 'mean'}. Best is trial 2 with value: 7430.862593009512.
[I 2023-12-12 14:52:06,235] Trial 184 finished with value: 7430.862593009512 and parameters: {'model_name': 'SimpleImputer', 'strategy': 'mean'}. Best is trial 2 with value: 7430.862593009512.
[I 2023-12-12 14:52:06,419] Trial 195 finished with value: 7430.862593009512 and parameters: {'model_name': 'SimpleImputer', 'strategy': 'mean'}. Best is trial 2 with value: 7430.862593009512.
[I 2023-12-12 14:52:06,650] Trial 187 finished with value: 7430.862593009512 and parameters: {'model_name': 'SimpleImputer', 'strategy': 'mean'}. Best is trial 2 with value: 7430.862593009512.
[I 2023-12-12 14:52:06,886] Trial 199 finished with value: 7602.121809036444 and parameters: {'model_name': 'SimpleImputer', 'strategy': 'constant'}. Best is trial 2 with value: 7430.862593009512.
[I 2023-12-12 14:52:07,082] Trial 191 finished with value: 7430.862593009512 and parameters: {'model_name': 'SimpleImputer', 'strategy': 'mean'}. Best is trial 2 with value: 7430.862593009512.
[I 2023-12-12 14:52:07,354] Trial 194 finished with value: 7430.862593009512 and parameters: {'model_name': 'SimpleImputer', 'strategy': 'mean'}. Best is trial 2 with value: 7430.862593009512.
[I 2023-12-12 14:52:07,576] Trial 192 finished with value: 7430.862593009512 and parameters: {'model_name': 'SimpleImputer', 'strategy': 'mean'}. Best is trial 2 with value: 7430.862593009512.
[I 2023-12-12 14:52:07,808] Trial 180 finished with value: 7430.862593009512 and parameters: {'model_name': 'SimpleImputer', 'strategy': 'mean'}. Best is trial 2 with value: 7430.862593009512.
[I 2023-12-12 14:52:08,028] Trial 193 finished with value: 7430.862593009512 and parameters: {'model_name': 'SimpleImputer', 'strategy': 'mean'}. Best is trial 2 with value: 7430.862593009512.
[I 2023-12-12 14:52:08,221] Trial 190 finished with value: 7430.862593009512 and parameters: {'model_name': 'SimpleImputer', 'strategy': 'mean'}. Best is trial 2 with value: 7430.862593009512.
