[I 2024-04-02 11:34:56,706] Trial 116 finished with value: 4407.778069367689 and parameters: {'model_name': 'RandomForestImputer', 'max_iter': 2, 'decreasing': False, 'min_samples_split': 0.30000000000000004, 'min_samples_leaf': 0.30000000000000004, 'max_features': 0.6, 'warm_start': False}. Best is trial 111 with value: 4385.920630348768.
[I 2024-04-02 11:35:05,528] Trial 118 finished with value: 4431.638610643223 and parameters: {'model_name': 'RandomForestImputer', 'max_iter': 2, 'decreasing': True, 'min_samples_split': 0.30000000000000004, 'min_samples_leaf': 0.30000000000000004, 'max_features': 0.8, 'warm_start': False}. Best is trial 111 with value: 4385.920630348768.
[I 2024-04-02 11:35:16,679] Trial 119 finished with value: 4467.370436735499 and parameters: {'model_name': 'RandomForestImputer', 'max_iter': 2, 'decreasing': True, 'min_samples_split': 0.2, 'min_samples_leaf': 0.30000000000000004, 'max_features': 0.8, 'warm_start': False}. Best is trial 111 with value: 4385.920630348768.
[I 2024-04-02 11:35:52,434] Trial 120 finished with value: 4575.579362039746 and parameters: {'model_name': 'RandomForestImputer', 'max_iter': 2, 'decreasing': True, 'min_samples_split': 0.2, 'min_samples_leaf': 0.30000000000000004, 'max_features': 0.8, 'warm_start': False}. Best is trial 111 with value: 4385.920630348768.
[I 2024-04-02 11:35:53,358] Trial 44 finished with value: 11837.864883900516 and parameters: {'model_name': 'GAIN', 'batch_size': 355, 'hint_rate': 0.63, 'alpha': 63, 'iterations': 218}. Best is trial 111 with value: 4385.920630348768.
[I 2024-04-02 11:38:14,934] Trial 121 finished with value: 4402.384411596189 and parameters: {'model_name': 'RandomForestImputer', 'max_iter': 2, 'decreasing': True, 'min_samples_split': 0.30000000000000004, 'min_samples_leaf': 0.30000000000000004, 'max_features': 0.8, 'warm_start': False}. Best is trial 111 with value: 4385.920630348768.
[I 2024-04-02 11:38:30,709] Trial 122 finished with value: 4434.888405668399 and parameters: {'model_name': 'RandomForestImputer', 'max_iter': 2, 'decreasing': True, 'min_samples_split': 0.2, 'min_samples_leaf': 0.30000000000000004, 'max_features': 0.6, 'warm_start': False}. Best is trial 111 with value: 4385.920630348768.
[I 2024-04-02 11:38:51,797] Trial 123 finished with value: 4442.170982791462 and parameters: {'model_name': 'RandomForestImputer', 'max_iter': 2, 'decreasing': False, 'min_samples_split': 0.2, 'min_samples_leaf': 0.30000000000000004, 'max_features': 0.4, 'warm_start': False}. Best is trial 111 with value: 4385.920630348768.
[I 2024-04-02 11:38:58,839] Trial 127 finished with value: 4452.0309821476385 and parameters: {'model_name': 'RandomForestImputer', 'max_iter': 2, 'decreasing': False, 'min_samples_split': 0.2, 'min_samples_leaf': 0.30000000000000004, 'max_features': 0.4, 'warm_start': False}. Best is trial 111 with value: 4385.920630348768.
[I 2024-04-02 11:39:00,783] Trial 125 finished with value: 4583.000600317703 and parameters: {'model_name': 'RandomForestImputer', 'max_iter': 2, 'decreasing': False, 'min_samples_split': 0.2, 'min_samples_leaf': 0.30000000000000004, 'max_features': 0.4, 'warm_start': False}. Best is trial 111 with value: 4385.920630348768.
[I 2024-04-02 11:39:04,741] Trial 126 finished with value: 4470.2676872395605 and parameters: {'model_name': 'RandomForestImputer', 'max_iter': 2, 'decreasing': False, 'min_samples_split': 0.2, 'min_samples_leaf': 0.30000000000000004, 'max_features': 0.4, 'warm_start': False}. Best is trial 111 with value: 4385.920630348768.
[I 2024-04-02 11:39:18,547] Trial 129 finished with value: 4436.029752535365 and parameters: {'model_name': 'RandomForestImputer', 'max_iter': 2, 'decreasing': False, 'min_samples_split': 0.2, 'min_samples_leaf': 0.30000000000000004, 'max_features': 0.4, 'warm_start': False}. Best is trial 111 with value: 4385.920630348768.
[I 2024-04-02 11:39:31,972] Trial 9 finished with value: 26595.110568196622 and parameters: {'model_name': 'GAIN', 'batch_size': 67, 'hint_rate': 0.54, 'alpha': 15, 'iterations': 297}. Best is trial 111 with value: 4385.920630348768.
[I 2024-04-02 11:39:43,438] Trial 8 finished with value: 14833.02743875927 and parameters: {'model_name': 'IterativeImputer', 'sample_posterior': True, 'initial_strategy': 'mean', 'imputation_order': 'random'}. Best is trial 111 with value: 4385.920630348768.
[I 2024-04-02 11:39:45,245] Trial 57 finished with value: 15171.20294956765 and parameters: {'model_name': 'IterativeImputer', 'sample_posterior': True, 'initial_strategy': 'constant', 'imputation_order': 'arabic'}. Best is trial 111 with value: 4385.920630348768.
[I 2024-04-02 11:39:46,533] Trial 12 finished with value: 14975.889322923913 and parameters: {'model_name': 'IterativeImputer', 'sample_posterior': True, 'initial_strategy': 'most_frequent', 'imputation_order': 'ascending'}. Best is trial 111 with value: 4385.920630348768.
[I 2024-04-02 11:39:47,436] Trial 14 finished with value: 14678.532471257644 and parameters: {'model_name': 'IterativeImputer', 'sample_posterior': True, 'initial_strategy': 'constant', 'imputation_order': 'random'}. Best is trial 111 with value: 4385.920630348768.
[I 2024-04-02 11:39:49,093] Trial 65 finished with value: 14962.340031532261 and parameters: {'model_name': 'IterativeImputer', 'sample_posterior': True, 'initial_strategy': 'mean', 'imputation_order': 'descending'}. Best is trial 111 with value: 4385.920630348768.
[I 2024-04-02 11:39:51,608] Trial 1 finished with value: 14688.84447158479 and parameters: {'model_name': 'IterativeImputer', 'sample_posterior': True, 'initial_strategy': 'most_frequent', 'imputation_order': 'random'}. Best is trial 111 with value: 4385.920630348768.
[I 2024-04-02 11:39:54,780] Trial 32 finished with value: 15236.665527322946 and parameters: {'model_name': 'IterativeImputer', 'sample_posterior': True, 'initial_strategy': 'most_frequent', 'imputation_order': 'roman'}. Best is trial 111 with value: 4385.920630348768.
[I 2024-04-02 11:40:01,220] Trial 62 finished with value: 14835.726062232765 and parameters: {'model_name': 'IterativeImputer', 'sample_posterior': True, 'initial_strategy': 'mean', 'imputation_order': 'descending'}. Best is trial 111 with value: 4385.920630348768.
[I 2024-04-02 11:40:02,599] Trial 36 finished with value: 14629.912359758498 and parameters: {'model_name': 'IterativeImputer', 'sample_posterior': True, 'initial_strategy': 'most_frequent', 'imputation_order': 'random'}. Best is trial 111 with value: 4385.920630348768.
[I 2024-04-02 11:40:04,346] Trial 23 finished with value: 15161.888155354847 and parameters: {'model_name': 'IterativeImputer', 'sample_posterior': True, 'initial_strategy': 'most_frequent', 'imputation_order': 'ascending'}. Best is trial 111 with value: 4385.920630348768.
[I 2024-04-02 11:40:22,458] Trial 70 finished with value: 15056.744234078466 and parameters: {'model_name': 'IterativeImputer', 'sample_posterior': True, 'initial_strategy': 'mean', 'imputation_order': 'arabic'}. Best is trial 111 with value: 4385.920630348768.
[I 2024-04-02 11:40:40,698] Trial 131 finished with value: 4413.843476388716 and parameters: {'model_name': 'RandomForestImputer', 'max_iter': 2, 'decreasing': False, 'min_samples_split': 0.2, 'min_samples_leaf': 0.30000000000000004, 'max_features': 0.4, 'warm_start': False}. Best is trial 111 with value: 4385.920630348768.
[I 2024-04-02 11:40:42,995] Trial 130 finished with value: 4490.012762138123 and parameters: {'model_name': 'RandomForestImputer', 'max_iter': 2, 'decreasing': False, 'min_samples_split': 0.2, 'min_samples_leaf': 0.30000000000000004, 'max_features': 0.4, 'warm_start': False}. Best is trial 111 with value: 4385.920630348768.
[I 2024-04-02 11:40:44,205] Trial 132 finished with value: 4405.105969767386 and parameters: {'model_name': 'RandomForestImputer', 'max_iter': 2, 'decreasing': False, 'min_samples_split': 0.2, 'min_samples_leaf': 0.30000000000000004, 'max_features': 0.4, 'warm_start': False}. Best is trial 111 with value: 4385.920630348768.
[I 2024-04-02 11:40:54,865] Trial 133 finished with value: 4427.426360617044 and parameters: {'model_name': 'RandomForestImputer', 'max_iter': 2, 'decreasing': False, 'min_samples_split': 0.2, 'min_samples_leaf': 0.30000000000000004, 'max_features': 0.4, 'warm_start': False}. Best is trial 111 with value: 4385.920630348768.
[I 2024-04-02 11:41:04,819] Trial 134 finished with value: 4419.918836520903 and parameters: {'model_name': 'RandomForestImputer', 'max_iter': 2, 'decreasing': False, 'min_samples_split': 0.2, 'min_samples_leaf': 0.30000000000000004, 'max_features': 0.4, 'warm_start': False}. Best is trial 111 with value: 4385.920630348768.
[I 2024-04-02 11:41:09,040] Trial 128 finished with value: 4416.966833788852 and parameters: {'model_name': 'RandomForestImputer', 'max_iter': 3, 'decreasing': False, 'min_samples_split': 0.2, 'min_samples_leaf': 0.30000000000000004, 'max_features': 0.4, 'warm_start': False}. Best is trial 111 with value: 4385.920630348768.
[I 2024-04-02 11:41:39,396] Trial 135 finished with value: 4528.694349408256 and parameters: {'model_name': 'RandomForestImputer', 'max_iter': 2, 'decreasing': False, 'min_samples_split': 0.30000000000000004, 'min_samples_leaf': 0.30000000000000004, 'max_features': 0.4, 'warm_start': False}. Best is trial 111 with value: 4385.920630348768.
[I 2024-04-02 11:41:40,584] Trial 73 finished with value: 14556.736295873488 and parameters: {'model_name': 'IterativeImputer', 'sample_posterior': True, 'initial_strategy': 'most_frequent', 'imputation_order': 'random'}. Best is trial 111 with value: 4385.920630348768.
[I 2024-04-02 11:41:47,764] Trial 136 finished with value: 4411.576832278675 and parameters: {'model_name': 'RandomForestImputer', 'max_iter': 2, 'decreasing': False, 'min_samples_split': 0.30000000000000004, 'min_samples_leaf': 0.30000000000000004, 'max_features': 0.4, 'warm_start': False}. Best is trial 111 with value: 4385.920630348768.
[I 2024-04-02 11:41:51,451] Trial 74 finished with value: 14662.188165029327 and parameters: {'model_name': 'IterativeImputer', 'sample_posterior': True, 'initial_strategy': 'median', 'imputation_order': 'random'}. Best is trial 111 with value: 4385.920630348768.
[I 2024-04-02 11:42:05,333] Trial 77 finished with value: 15024.915485134206 and parameters: {'model_name': 'IterativeImputer', 'sample_posterior': True, 'initial_strategy': 'most_frequent', 'imputation_order': 'roman'}. Best is trial 111 with value: 4385.920630348768.
[I 2024-04-02 11:42:12,969] Trial 79 finished with value: 14839.829799684801 and parameters: {'model_name': 'IterativeImputer', 'sample_posterior': True, 'initial_strategy': 'mean', 'imputation_order': 'roman'}. Best is trial 111 with value: 4385.920630348768.
[I 2024-04-02 11:43:56,534] Trial 137 finished with value: 4421.3502579906835 and parameters: {'model_name': 'RandomForestImputer', 'max_iter': 2, 'decreasing': False, 'min_samples_split': 0.2, 'min_samples_leaf': 0.2, 'max_features': 0.4, 'warm_start': False}. Best is trial 111 with value: 4385.920630348768.
[I 2024-04-02 11:44:03,520] Trial 138 finished with value: 4484.8240378023565 and parameters: {'model_name': 'RandomForestImputer', 'max_iter': 2, 'decreasing': False, 'min_samples_split': 0.2, 'min_samples_leaf': 0.2, 'max_features': 0.4, 'warm_start': False}. Best is trial 111 with value: 4385.920630348768.
[I 2024-04-02 11:44:25,645] Trial 139 finished with value: 4302.206726662424 and parameters: {'model_name': 'RandomForestImputer', 'max_iter': 2, 'decreasing': False, 'min_samples_split': 0.30000000000000004, 'min_samples_leaf': 0.2, 'max_features': 0.6, 'warm_start': False}. Best is trial 139 with value: 4302.206726662424.
[I 2024-04-02 11:44:34,980] Trial 140 finished with value: 4468.009763777291 and parameters: {'model_name': 'RandomForestImputer', 'max_iter': 2, 'decreasing': False, 'min_samples_split': 0.30000000000000004, 'min_samples_leaf': 0.2, 'max_features': 0.6, 'warm_start': False}. Best is trial 139 with value: 4302.206726662424.
[I 2024-04-02 11:47:10,556] Trial 143 finished with value: 4335.566299926048 and parameters: {'model_name': 'RandomForestImputer', 'max_iter': 3, 'decreasing': False, 'min_samples_split': 0.30000000000000004, 'min_samples_leaf': 0.2, 'max_features': 0.6, 'warm_start': False}. Best is trial 139 with value: 4302.206726662424.
[I 2024-04-02 11:47:39,006] Trial 141 finished with value: 4439.071029686058 and parameters: {'model_name': 'RandomForestImputer', 'max_iter': 3, 'decreasing': False, 'min_samples_split': 0.30000000000000004, 'min_samples_leaf': 0.2, 'max_features': 0.6, 'warm_start': False}. Best is trial 139 with value: 4302.206726662424.
[I 2024-04-02 11:48:19,508] Trial 144 finished with value: 4336.412332246346 and parameters: {'model_name': 'RandomForestImputer', 'max_iter': 3, 'decreasing': False, 'min_samples_split': 0.30000000000000004, 'min_samples_leaf': 0.2, 'max_features': 0.6, 'warm_start': False}. Best is trial 139 with value: 4302.206726662424.
[I 2024-04-02 11:48:37,152] Trial 142 finished with value: 4357.052862968973 and parameters: {'model_name': 'RandomForestImputer', 'max_iter': 3, 'decreasing': False, 'min_samples_split': 0.30000000000000004, 'min_samples_leaf': 0.2, 'max_features': 0.6, 'warm_start': False}. Best is trial 139 with value: 4302.206726662424.
[I 2024-04-02 11:48:39,153] Trial 152 finished with value: 4299.406510968777 and parameters: {'model_name': 'RandomForestImputer', 'max_iter': 3, 'decreasing': True, 'min_samples_split': 0.30000000000000004, 'min_samples_leaf': 0.2, 'max_features': 0.6, 'warm_start': False}. Best is trial 152 with value: 4299.406510968777.
[I 2024-04-02 11:48:42,861] Trial 154 finished with value: 4441.546319904728 and parameters: {'model_name': 'RandomForestImputer', 'max_iter': 3, 'decreasing': True, 'min_samples_split': 0.30000000000000004, 'min_samples_leaf': 0.2, 'max_features': 0.6, 'warm_start': False}. Best is trial 152 with value: 4299.406510968777.
[I 2024-04-02 11:48:44,672] Trial 149 finished with value: 4345.643405558045 and parameters: {'model_name': 'RandomForestImputer', 'max_iter': 3, 'decreasing': True, 'min_samples_split': 0.30000000000000004, 'min_samples_leaf': 0.2, 'max_features': 0.6, 'warm_start': False}. Best is trial 152 with value: 4299.406510968777.
[I 2024-04-02 11:48:55,154] Trial 155 finished with value: 4335.332937127467 and parameters: {'model_name': 'RandomForestImputer', 'max_iter': 3, 'decreasing': True, 'min_samples_split': 0.30000000000000004, 'min_samples_leaf': 0.2, 'max_features': 0.6, 'warm_start': False}. Best is trial 152 with value: 4299.406510968777.
[I 2024-04-02 11:48:57,754] Trial 147 finished with value: 4376.131918302275 and parameters: {'model_name': 'RandomForestImputer', 'max_iter': 3, 'decreasing': False, 'min_samples_split': 0.30000000000000004, 'min_samples_leaf': 0.2, 'max_features': 0.6, 'warm_start': False}. Best is trial 152 with value: 4299.406510968777.
[I 2024-04-02 11:49:04,686] Trial 145 finished with value: 4323.705553345973 and parameters: {'model_name': 'RandomForestImputer', 'max_iter': 3, 'decreasing': False, 'min_samples_split': 0.30000000000000004, 'min_samples_leaf': 0.2, 'max_features': 0.6, 'warm_start': False}. Best is trial 152 with value: 4299.406510968777.
[I 2024-04-02 11:49:15,305] Trial 151 finished with value: 4341.254912919227 and parameters: {'model_name': 'RandomForestImputer', 'max_iter': 3, 'decreasing': True, 'min_samples_split': 0.30000000000000004, 'min_samples_leaf': 0.2, 'max_features': 0.6, 'warm_start': False}. Best is trial 152 with value: 4299.406510968777.
[I 2024-04-02 11:49:16,773] Trial 153 finished with value: 4363.841861461105 and parameters: {'model_name': 'RandomForestImputer', 'max_iter': 3, 'decreasing': True, 'min_samples_split': 0.30000000000000004, 'min_samples_leaf': 0.2, 'max_features': 0.6, 'warm_start': False}. Best is trial 152 with value: 4299.406510968777.
[I 2024-04-02 11:49:24,377] Trial 157 finished with value: 4341.766377146419 and parameters: {'model_name': 'RandomForestImputer', 'max_iter': 3, 'decreasing': False, 'min_samples_split': 0.30000000000000004, 'min_samples_leaf': 0.2, 'max_features': 0.6, 'warm_start': False}. Best is trial 152 with value: 4299.406510968777.
[I 2024-04-02 11:49:29,932] Trial 146 finished with value: 4343.747685177656 and parameters: {'model_name': 'RandomForestImputer', 'max_iter': 3, 'decreasing': False, 'min_samples_split': 0.30000000000000004, 'min_samples_leaf': 0.2, 'max_features': 0.6, 'warm_start': False}. Best is trial 152 with value: 4299.406510968777.
[I 2024-04-02 11:49:33,759] Trial 148 finished with value: 4307.681711853924 and parameters: {'model_name': 'RandomForestImputer', 'max_iter': 3, 'decreasing': True, 'min_samples_split': 0.30000000000000004, 'min_samples_leaf': 0.2, 'max_features': 0.6, 'warm_start': False}. Best is trial 152 with value: 4299.406510968777.
[I 2024-04-02 11:49:37,730] Trial 150 finished with value: 4375.040651068171 and parameters: {'model_name': 'RandomForestImputer', 'max_iter': 3, 'decreasing': True, 'min_samples_split': 0.30000000000000004, 'min_samples_leaf': 0.2, 'max_features': 0.6, 'warm_start': False}. Best is trial 152 with value: 4299.406510968777.
[I 2024-04-02 11:49:54,926] Trial 161 finished with value: 4374.988853164515 and parameters: {'model_name': 'RandomForestImputer', 'max_iter': 3, 'decreasing': False, 'min_samples_split': 0.1, 'min_samples_leaf': 0.2, 'max_features': 0.30000000000000004, 'warm_start': False}. Best is trial 152 with value: 4299.406510968777.
[I 2024-04-02 11:49:59,534] Trial 163 finished with value: 4542.041678608983 and parameters: {'model_name': 'RandomForestImputer', 'max_iter': 3, 'decreasing': False, 'min_samples_split': 0.1, 'min_samples_leaf': 0.4, 'max_features': 0.6, 'warm_start': False}. Best is trial 152 with value: 4299.406510968777.
[I 2024-04-02 11:50:02,690] Trial 160 finished with value: 4531.943390687082 and parameters: {'model_name': 'RandomForestImputer', 'max_iter': 3, 'decreasing': False, 'min_samples_split': 0.30000000000000004, 'min_samples_leaf': 0.4, 'max_features': 0.30000000000000004, 'warm_start': False}. Best is trial 152 with value: 4299.406510968777.
[I 2024-04-02 11:50:08,683] Trial 177 finished with value: 5203.439732806981 and parameters: {'model_name': 'RandomForestImputer', 'max_iter': 3, 'decreasing': False, 'min_samples_split': 0.4, 'min_samples_leaf': 0.4, 'max_features': 0.6, 'warm_start': True}. Best is trial 152 with value: 4299.406510968777.
[I 2024-04-02 11:50:09,983] Trial 158 finished with value: 4324.446771987503 and parameters: {'model_name': 'RandomForestImputer', 'max_iter': 3, 'decreasing': False, 'min_samples_split': 0.30000000000000004, 'min_samples_leaf': 0.2, 'max_features': 0.6, 'warm_start': False}. Best is trial 152 with value: 4299.406510968777.
[I 2024-04-02 11:50:12,964] Trial 164 finished with value: 4552.721516365932 and parameters: {'model_name': 'RandomForestImputer', 'max_iter': 3, 'decreasing': False, 'min_samples_split': 0.1, 'min_samples_leaf': 0.4, 'max_features': 0.30000000000000004, 'warm_start': False}. Best is trial 152 with value: 4299.406510968777.
[I 2024-04-02 11:50:21,376] Trial 165 finished with value: 4564.308834466263 and parameters: {'model_name': 'RandomForestImputer', 'max_iter': 3, 'decreasing': False, 'min_samples_split': 0.1, 'min_samples_leaf': 0.4, 'max_features': 0.6, 'warm_start': False}. Best is trial 152 with value: 4299.406510968777.
[I 2024-04-02 11:50:26,528] Trial 180 finished with value: 4820.077438986418 and parameters: {'model_name': 'RandomForestImputer', 'max_iter': 3, 'decreasing': True, 'min_samples_split': 0.4, 'min_samples_leaf': 0.4, 'max_features': 0.6, 'warm_start': True}. Best is trial 152 with value: 4299.406510968777.
[I 2024-04-02 11:50:29,655] Trial 159 finished with value: 4309.563399241384 and parameters: {'model_name': 'RandomForestImputer', 'max_iter': 3, 'decreasing': False, 'min_samples_split': 0.30000000000000004, 'min_samples_leaf': 0.2, 'max_features': 0.6, 'warm_start': False}. Best is trial 152 with value: 4299.406510968777.
[I 2024-04-02 11:50:34,573] Trial 181 finished with value: 5237.315896335978 and parameters: {'model_name': 'RandomForestImputer', 'max_iter': 3, 'decreasing': False, 'min_samples_split': 0.4, 'min_samples_leaf': 0.6, 'max_features': 0.6, 'warm_start': True}. Best is trial 152 with value: 4299.406510968777.
[I 2024-04-02 11:50:38,010] Trial 156 finished with value: 4343.915983094726 and parameters: {'model_name': 'RandomForestImputer', 'max_iter': 3, 'decreasing': False, 'min_samples_split': 0.30000000000000004, 'min_samples_leaf': 0.2, 'max_features': 0.6, 'warm_start': False}. Best is trial 152 with value: 4299.406510968777.
[I 2024-04-02 11:50:45,663] Trial 162 finished with value: 4563.037221681428 and parameters: {'model_name': 'RandomForestImputer', 'max_iter': 3, 'decreasing': False, 'min_samples_split': 0.1, 'min_samples_leaf': 0.4, 'max_features': 0.30000000000000004, 'warm_start': False}. Best is trial 152 with value: 4299.406510968777.
[I 2024-04-02 11:50:53,448] Trial 182 finished with value: 4820.077437511733 and parameters: {'model_name': 'RandomForestImputer', 'max_iter': 3, 'decreasing': True, 'min_samples_split': 0.4, 'min_samples_leaf': 0.2, 'max_features': 0.6, 'warm_start': True}. Best is trial 152 with value: 4299.406510968777.
[I 2024-04-02 11:50:54,400] Trial 194 finished with value: 7299.063376835836 and parameters: {'model_name': 'KNNImputer', 'weights': 'distance', 'keep_empty_features': False}. Best is trial 152 with value: 4299.406510968777.
[I 2024-04-02 11:50:57,416] Trial 183 finished with value: 4820.077082689496 and parameters: {'model_name': 'RandomForestImputer', 'max_iter': 3, 'decreasing': True, 'min_samples_split': 0.4, 'min_samples_leaf': 0.2, 'max_features': 0.6, 'warm_start': True}. Best is trial 152 with value: 4299.406510968777.
