Run: 5
/cm/local/apps/slurm/var/spool/job832888/slurm_script: line 23: /common/ketrong/minconda3/etc/profile.d/conda.sh: No such file or directory
/cm/local/apps/slurm/var/spool/job832888/slurm_script: line 26: $'\nconda create --name tpot2devenv -c conda-forge python=3.10\n': command not found
/cm/local/apps/slurm/var/spool/job832888/slurm_script: line 31: $'\npip install -r requirements.txt\n': command not found
RunStart
2024-04-21 19:33:27.478421: I tensorflow/core/util/port.cc:113] oneDNN custom operations are on. You may see slightly different numerical results due to floating-point round-off errors from different computation orders. To turn them off, set the environment variable `TF_ENABLE_ONEDNN_OPTS=0`.
2024-04-21 19:33:27.515705: E external/local_xla/xla/stream_executor/cuda/cuda_dnn.cc:9261] Unable to register cuDNN factory: Attempting to register factory for plugin cuDNN when one has already been registered
2024-04-21 19:33:27.515726: E external/local_xla/xla/stream_executor/cuda/cuda_fft.cc:607] Unable to register cuFFT factory: Attempting to register factory for plugin cuFFT when one has already been registered
2024-04-21 19:33:27.517122: E external/local_xla/xla/stream_executor/cuda/cuda_blas.cc:1515] Unable to register cuBLAS factory: Attempting to register factory for plugin cuBLAS when one has already been registered
2024-04-21 19:33:27.523268: I tensorflow/core/platform/cpu_feature_guard.cc:182] This TensorFlow binary is optimized to use available CPU instructions in performance-critical operations.
To enable the following instructions: AVX2 AVX512F AVX512_VNNI FMA, in other operations, rebuild TensorFlow with the appropriate compiler flags.
2024-04-21 19:33:29.165680: W tensorflow/compiler/tf2tensorrt/utils/py_utils.cc:38] TF-TRT Warning: Could not find TensorRT
WARNING:tensorflow:From /home/ketrong/miniconda3/envs/tpot2devenv/lib/python3.10/site-packages/tensorflow/python/compat/v2_compat.py:108: disable_resource_variables (from tensorflow.python.ops.variable_scope) is deprecated and will be removed in a future version.
Instructions for updating:
non-resource variables are not supported in the long term
starting loops
working on 
logs/146806/tpot2_base_normal_MCAR_0.9
2.929509401321411
loading data
logs/146806/tpot2_base_normal_MCAR_0.9/data/146806_True.pkl
[0 0 0 ... 0 0 0]
           0  ...           3
0      180.0  ...    0.000000
1      179.0  ...    0.000000
2      176.0  ...    0.000000
3      172.0  ...    0.000000
4      183.0  ...    0.000000
...      ...  ...         ...
60054  172.0  ...    0.000000
60055  181.0  ...  738.037995
60056  182.0  ...    0.000000
60057  187.0  ...    0.000000
60058  182.0  ...    0.000000

[60059 rows x 4 columns]
           0  ...          3
0      185.0  ...    0.00000
1      180.0  ...    0.00000
2      174.0  ...    0.00000
3      171.0  ...    0.00000
4      178.0  ...  621.25082
...      ...  ...        ...
29576  177.0  ...    0.00000
29577  176.0  ...    0.00000
29578  170.0  ...    0.00000
29579  175.0  ...    0.00000
29580  180.0  ...    0.00000

[29581 rows x 4 columns]
running experiment 1/3 - Does large hyperparameter space improve reconstruction accuracy over simple
[I 2024-04-21 19:33:40,133] A new study created in memory with name: no-name-5595c4f2-54e6-4a58-ac55-ae2d5031285d
[I 2024-04-21 19:33:41,700] Trial 5 finished with value: 421.2410312506362 and parameters: {'model_name': 'SimpleImputer', 'strategy': 'constant'}. Best is trial 5 with value: 421.2410312506362.
[I 2024-04-21 19:33:42,006] Trial 3 finished with value: 421.2410312506362 and parameters: {'model_name': 'SimpleImputer', 'strategy': 'constant'}. Best is trial 5 with value: 421.2410312506362.
[I 2024-04-21 19:33:42,450] Trial 6 finished with value: 421.2410312506362 and parameters: {'model_name': 'SimpleImputer', 'strategy': 'constant'}. Best is trial 5 with value: 421.2410312506362.
[I 2024-04-21 19:33:43,023] Trial 0 finished with value: 421.2410312506362 and parameters: {'model_name': 'SimpleImputer', 'strategy': 'constant'}. Best is trial 5 with value: 421.2410312506362.
[I 2024-04-21 19:33:43,346] Trial 38 finished with value: 421.2410312506362 and parameters: {'model_name': 'SimpleImputer', 'strategy': 'constant'}. Best is trial 5 with value: 421.2410312506362.
[I 2024-04-21 19:33:43,687] Trial 21 finished with value: 421.2410312506362 and parameters: {'model_name': 'SimpleImputer', 'strategy': 'constant'}. Best is trial 5 with value: 421.2410312506362.
[I 2024-04-21 19:33:43,969] Trial 26 finished with value: 421.2410312506362 and parameters: {'model_name': 'SimpleImputer', 'strategy': 'constant'}. Best is trial 5 with value: 421.2410312506362.
[I 2024-04-21 19:33:44,174] Trial 24 finished with value: 421.2410312506362 and parameters: {'model_name': 'SimpleImputer', 'strategy': 'constant'}. Best is trial 5 with value: 421.2410312506362.
[I 2024-04-21 19:33:44,378] Trial 28 finished with value: 421.2410312506362 and parameters: {'model_name': 'SimpleImputer', 'strategy': 'constant'}. Best is trial 5 with value: 421.2410312506362.
[I 2024-04-21 19:33:44,633] Trial 8 finished with value: 389.7848474564851 and parameters: {'model_name': 'SimpleImputer', 'strategy': 'mean'}. Best is trial 8 with value: 389.7848474564851.
[I 2024-04-21 19:33:44,867] Trial 19 finished with value: 421.2410312506362 and parameters: {'model_name': 'SimpleImputer', 'strategy': 'constant'}. Best is trial 8 with value: 389.7848474564851.
[I 2024-04-21 19:33:45,078] Trial 30 finished with value: 421.2410312506362 and parameters: {'model_name': 'SimpleImputer', 'strategy': 'constant'}. Best is trial 8 with value: 389.7848474564851.
[I 2024-04-21 19:33:45,308] Trial 1 finished with value: 389.7848474564851 and parameters: {'model_name': 'SimpleImputer', 'strategy': 'mean'}. Best is trial 8 with value: 389.7848474564851.
[I 2024-04-21 19:33:45,795] Trial 17 finished with value: 389.7848474564851 and parameters: {'model_name': 'SimpleImputer', 'strategy': 'mean'}. Best is trial 8 with value: 389.7848474564851.
[I 2024-04-21 19:33:46,030] Trial 42 finished with value: 421.2410312506362 and parameters: {'model_name': 'SimpleImputer', 'strategy': 'constant'}. Best is trial 8 with value: 389.7848474564851.
[I 2024-04-21 19:33:46,358] Trial 41 finished with value: 421.2410312506362 and parameters: {'model_name': 'SimpleImputer', 'strategy': 'constant'}. Best is trial 8 with value: 389.7848474564851.
[I 2024-04-21 19:33:46,578] Trial 25 finished with value: 389.7848474564851 and parameters: {'model_name': 'SimpleImputer', 'strategy': 'mean'}. Best is trial 8 with value: 389.7848474564851.
[I 2024-04-21 19:33:46,806] Trial 31 finished with value: 421.2410312506362 and parameters: {'model_name': 'SimpleImputer', 'strategy': 'constant'}. Best is trial 8 with value: 389.7848474564851.
[I 2024-04-21 19:33:47,232] Trial 45 finished with value: 389.7848474564851 and parameters: {'model_name': 'SimpleImputer', 'strategy': 'mean'}. Best is trial 8 with value: 389.7848474564851.
[I 2024-04-21 19:33:47,485] Trial 33 finished with value: 421.2410312506362 and parameters: {'model_name': 'SimpleImputer', 'strategy': 'constant'}. Best is trial 8 with value: 389.7848474564851.
[I 2024-04-21 19:33:47,756] Trial 32 finished with value: 389.7848474564851 and parameters: {'model_name': 'SimpleImputer', 'strategy': 'mean'}. Best is trial 8 with value: 389.7848474564851.
[I 2024-04-21 19:33:47,983] Trial 37 finished with value: 389.7848474564851 and parameters: {'model_name': 'SimpleImputer', 'strategy': 'mean'}. Best is trial 8 with value: 389.7848474564851.
[I 2024-04-21 19:33:48,215] Trial 46 finished with value: 389.7848474564851 and parameters: {'model_name': 'SimpleImputer', 'strategy': 'mean'}. Best is trial 8 with value: 389.7848474564851.
[I 2024-04-21 19:33:48,494] Trial 39 finished with value: 389.7848474564851 and parameters: {'model_name': 'SimpleImputer', 'strategy': 'mean'}. Best is trial 8 with value: 389.7848474564851.
[I 2024-04-21 19:33:48,734] Trial 35 finished with value: 389.7848474564851 and parameters: {'model_name': 'SimpleImputer', 'strategy': 'mean'}. Best is trial 8 with value: 389.7848474564851.
[I 2024-04-21 19:33:49,119] Trial 11 finished with value: 421.2410312506362 and parameters: {'model_name': 'SimpleImputer', 'strategy': 'median'}. Best is trial 8 with value: 389.7848474564851.
[I 2024-04-21 19:33:49,423] Trial 13 finished with value: 421.2410312506362 and parameters: {'model_name': 'SimpleImputer', 'strategy': 'median'}. Best is trial 8 with value: 389.7848474564851.
[I 2024-04-21 19:33:49,651] Trial 15 finished with value: 421.2410312506362 and parameters: {'model_name': 'SimpleImputer', 'strategy': 'median'}. Best is trial 8 with value: 389.7848474564851.
[I 2024-04-21 19:33:49,840] Trial 18 finished with value: 421.2410312506362 and parameters: {'model_name': 'SimpleImputer', 'strategy': 'median'}. Best is trial 8 with value: 389.7848474564851.
[I 2024-04-21 19:33:50,190] Trial 7 finished with value: 421.2410312506362 and parameters: {'model_name': 'SimpleImputer', 'strategy': 'median'}. Best is trial 8 with value: 389.7848474564851.
[I 2024-04-21 19:33:50,431] Trial 20 finished with value: 421.2410312506362 and parameters: {'model_name': 'SimpleImputer', 'strategy': 'median'}. Best is trial 8 with value: 389.7848474564851.
[I 2024-04-21 19:33:50,648] Trial 10 finished with value: 421.2410312506362 and parameters: {'model_name': 'SimpleImputer', 'strategy': 'median'}. Best is trial 8 with value: 389.7848474564851.
[I 2024-04-21 19:33:50,929] Trial 29 finished with value: 421.2410312506362 and parameters: {'model_name': 'SimpleImputer', 'strategy': 'median'}. Best is trial 8 with value: 389.7848474564851.
[I 2024-04-21 19:33:51,129] Trial 4 finished with value: 421.2410312506362 and parameters: {'model_name': 'SimpleImputer', 'strategy': 'most_frequent'}. Best is trial 8 with value: 389.7848474564851.
[I 2024-04-21 19:33:51,400] Trial 12 finished with value: 421.2410312506362 and parameters: {'model_name': 'SimpleImputer', 'strategy': 'most_frequent'}. Best is trial 8 with value: 389.7848474564851.
[I 2024-04-21 19:33:51,848] Trial 47 finished with value: 421.2410312506362 and parameters: {'model_name': 'SimpleImputer', 'strategy': 'median'}. Best is trial 8 with value: 389.7848474564851.
[I 2024-04-21 19:33:52,129] Trial 48 finished with value: 389.7848474564851 and parameters: {'model_name': 'SimpleImputer', 'strategy': 'mean'}. Best is trial 8 with value: 389.7848474564851.
[I 2024-04-21 19:33:52,372] Trial 2 finished with value: 421.2410312506362 and parameters: {'model_name': 'SimpleImputer', 'strategy': 'most_frequent'}. Best is trial 8 with value: 389.7848474564851.
[I 2024-04-21 19:33:52,859] Trial 50 finished with value: 389.7848474564851 and parameters: {'model_name': 'SimpleImputer', 'strategy': 'mean'}. Best is trial 8 with value: 389.7848474564851.
[I 2024-04-21 19:33:53,255] Trial 44 finished with value: 421.2410312506362 and parameters: {'model_name': 'SimpleImputer', 'strategy': 'median'}. Best is trial 8 with value: 389.7848474564851.
[I 2024-04-21 19:33:53,564] Trial 55 finished with value: 421.2410312506362 and parameters: {'model_name': 'SimpleImputer', 'strategy': 'constant'}. Best is trial 8 with value: 389.7848474564851.
[I 2024-04-21 19:33:53,736] Trial 16 finished with value: 421.2410312506362 and parameters: {'model_name': 'SimpleImputer', 'strategy': 'most_frequent'}. Best is trial 8 with value: 389.7848474564851.
[I 2024-04-21 19:33:53,920] Trial 14 finished with value: 421.2410312506362 and parameters: {'model_name': 'SimpleImputer', 'strategy': 'most_frequent'}. Best is trial 8 with value: 389.7848474564851.
[I 2024-04-21 19:33:54,095] Trial 9 finished with value: 421.2410312506362 and parameters: {'model_name': 'SimpleImputer', 'strategy': 'most_frequent'}. Best is trial 8 with value: 389.7848474564851.
[I 2024-04-21 19:33:54,314] Trial 59 finished with value: 389.7848474564851 and parameters: {'model_name': 'SimpleImputer', 'strategy': 'mean'}. Best is trial 8 with value: 389.7848474564851.
[I 2024-04-21 19:33:54,752] Trial 23 finished with value: 421.2410312506362 and parameters: {'model_name': 'SimpleImputer', 'strategy': 'most_frequent'}. Best is trial 8 with value: 389.7848474564851.
[I 2024-04-21 19:33:55,105] Trial 52 finished with value: 389.7848474564851 and parameters: {'model_name': 'SimpleImputer', 'strategy': 'mean'}. Best is trial 8 with value: 389.7848474564851.
[I 2024-04-21 19:33:55,334] Trial 57 finished with value: 389.7848474564851 and parameters: {'model_name': 'SimpleImputer', 'strategy': 'mean'}. Best is trial 8 with value: 389.7848474564851.
[I 2024-04-21 19:33:55,624] Trial 22 finished with value: 421.2410312506362 and parameters: {'model_name': 'SimpleImputer', 'strategy': 'most_frequent'}. Best is trial 8 with value: 389.7848474564851.
[I 2024-04-21 19:33:55,951] Trial 54 finished with value: 389.7848474564851 and parameters: {'model_name': 'SimpleImputer', 'strategy': 'mean'}. Best is trial 8 with value: 389.7848474564851.
[I 2024-04-21 19:33:56,144] Trial 62 finished with value: 389.7848474564851 and parameters: {'model_name': 'SimpleImputer', 'strategy': 'mean'}. Best is trial 8 with value: 389.7848474564851.
[I 2024-04-21 19:33:56,429] Trial 61 finished with value: 389.7848474564851 and parameters: {'model_name': 'SimpleImputer', 'strategy': 'mean'}. Best is trial 8 with value: 389.7848474564851.
[I 2024-04-21 19:33:56,702] Trial 60 finished with value: 389.7848474564851 and parameters: {'model_name': 'SimpleImputer', 'strategy': 'mean'}. Best is trial 8 with value: 389.7848474564851.
[I 2024-04-21 19:33:57,002] Trial 58 finished with value: 389.7848474564851 and parameters: {'model_name': 'SimpleImputer', 'strategy': 'mean'}. Best is trial 8 with value: 389.7848474564851.
[I 2024-04-21 19:33:57,263] Trial 36 finished with value: 421.2410312506362 and parameters: {'model_name': 'SimpleImputer', 'strategy': 'most_frequent'}. Best is trial 8 with value: 389.7848474564851.
[I 2024-04-21 19:33:57,504] Trial 27 finished with value: 421.2410312506362 and parameters: {'model_name': 'SimpleImputer', 'strategy': 'most_frequent'}. Best is trial 8 with value: 389.7848474564851.
[I 2024-04-21 19:33:57,705] Trial 43 finished with value: 421.2410312506362 and parameters: {'model_name': 'SimpleImputer', 'strategy': 'most_frequent'}. Best is trial 8 with value: 389.7848474564851.
[I 2024-04-21 19:33:57,968] Trial 63 finished with value: 389.7848474564851 and parameters: {'model_name': 'SimpleImputer', 'strategy': 'mean'}. Best is trial 8 with value: 389.7848474564851.
[I 2024-04-21 19:33:58,159] Trial 34 finished with value: 421.2410312506362 and parameters: {'model_name': 'SimpleImputer', 'strategy': 'most_frequent'}. Best is trial 8 with value: 389.7848474564851.
[I 2024-04-21 19:33:58,463] Trial 40 finished with value: 421.2410312506362 and parameters: {'model_name': 'SimpleImputer', 'strategy': 'most_frequent'}. Best is trial 8 with value: 389.7848474564851.
[I 2024-04-21 19:33:58,761] Trial 64 finished with value: 389.7848474564851 and parameters: {'model_name': 'SimpleImputer', 'strategy': 'mean'}. Best is trial 8 with value: 389.7848474564851.
[I 2024-04-21 19:33:59,330] Trial 51 finished with value: 421.2410312506362 and parameters: {'model_name': 'SimpleImputer', 'strategy': 'median'}. Best is trial 8 with value: 389.7848474564851.
[I 2024-04-21 19:33:59,882] Trial 49 finished with value: 421.2410312506362 and parameters: {'model_name': 'SimpleImputer', 'strategy': 'most_frequent'}. Best is trial 8 with value: 389.7848474564851.
[I 2024-04-21 19:34:00,122] Trial 66 finished with value: 421.2410312506362 and parameters: {'model_name': 'SimpleImputer', 'strategy': 'median'}. Best is trial 8 with value: 389.7848474564851.
[I 2024-04-21 19:34:00,435] Trial 81 finished with value: 389.7848474564851 and parameters: {'model_name': 'SimpleImputer', 'strategy': 'mean'}. Best is trial 8 with value: 389.7848474564851.
[I 2024-04-21 19:34:00,713] Trial 84 finished with value: 389.7848474564851 and parameters: {'model_name': 'SimpleImputer', 'strategy': 'mean'}. Best is trial 8 with value: 389.7848474564851.
[I 2024-04-21 19:34:01,092] Trial 56 finished with value: 421.2410312506362 and parameters: {'model_name': 'SimpleImputer', 'strategy': 'most_frequent'}. Best is trial 8 with value: 389.7848474564851.
[I 2024-04-21 19:34:01,428] Trial 82 finished with value: 389.7848474564851 and parameters: {'model_name': 'SimpleImputer', 'strategy': 'mean'}. Best is trial 8 with value: 389.7848474564851.
[I 2024-04-21 19:34:01,660] Trial 83 finished with value: 389.7848474564851 and parameters: {'model_name': 'SimpleImputer', 'strategy': 'mean'}. Best is trial 8 with value: 389.7848474564851.
[I 2024-04-21 19:34:01,907] Trial 71 finished with value: 421.2410312506362 and parameters: {'model_name': 'SimpleImputer', 'strategy': 'median'}. Best is trial 8 with value: 389.7848474564851.
[I 2024-04-21 19:34:02,203] Trial 67 finished with value: 421.2410312506362 and parameters: {'model_name': 'SimpleImputer', 'strategy': 'median'}. Best is trial 8 with value: 389.7848474564851.
[I 2024-04-21 19:34:02,459] Trial 85 finished with value: 389.7848474564851 and parameters: {'model_name': 'SimpleImputer', 'strategy': 'mean'}. Best is trial 8 with value: 389.7848474564851.
[I 2024-04-21 19:34:02,936] Trial 86 finished with value: 389.7848474564851 and parameters: {'model_name': 'SimpleImputer', 'strategy': 'mean'}. Best is trial 8 with value: 389.7848474564851.
[I 2024-04-21 19:34:03,230] Trial 53 finished with value: 421.2410312506362 and parameters: {'model_name': 'SimpleImputer', 'strategy': 'most_frequent'}. Best is trial 8 with value: 389.7848474564851.
[I 2024-04-21 19:34:03,455] Trial 88 finished with value: 389.7848474564851 and parameters: {'model_name': 'SimpleImputer', 'strategy': 'mean'}. Best is trial 8 with value: 389.7848474564851.
[I 2024-04-21 19:34:03,709] Trial 94 finished with value: 389.7848474564851 and parameters: {'model_name': 'SimpleImputer', 'strategy': 'mean'}. Best is trial 8 with value: 389.7848474564851.
[I 2024-04-21 19:34:03,913] Trial 93 finished with value: 389.7848474564851 and parameters: {'model_name': 'SimpleImputer', 'strategy': 'mean'}. Best is trial 8 with value: 389.7848474564851.
[I 2024-04-21 19:34:04,160] Trial 90 finished with value: 389.7848474564851 and parameters: {'model_name': 'SimpleImputer', 'strategy': 'mean'}. Best is trial 8 with value: 389.7848474564851.
[I 2024-04-21 19:34:04,332] Trial 91 finished with value: 389.7848474564851 and parameters: {'model_name': 'SimpleImputer', 'strategy': 'mean'}. Best is trial 8 with value: 389.7848474564851.
[I 2024-04-21 19:34:04,605] Trial 92 finished with value: 389.7848474564851 and parameters: {'model_name': 'SimpleImputer', 'strategy': 'mean'}. Best is trial 8 with value: 389.7848474564851.
[I 2024-04-21 19:34:04,882] Trial 65 finished with value: 421.2410312506362 and parameters: {'model_name': 'SimpleImputer', 'strategy': 'most_frequent'}. Best is trial 8 with value: 389.7848474564851.
[I 2024-04-21 19:34:05,129] Trial 68 finished with value: 421.2410312506362 and parameters: {'model_name': 'SimpleImputer', 'strategy': 'most_frequent'}. Best is trial 8 with value: 389.7848474564851.
[I 2024-04-21 19:34:05,358] Trial 89 finished with value: 389.7848474564851 and parameters: {'model_name': 'SimpleImputer', 'strategy': 'mean'}. Best is trial 8 with value: 389.7848474564851.
[I 2024-04-21 19:34:05,549] Trial 96 finished with value: 389.7848474564851 and parameters: {'model_name': 'SimpleImputer', 'strategy': 'mean'}. Best is trial 8 with value: 389.7848474564851.
[I 2024-04-21 19:34:05,864] Trial 72 finished with value: 421.2410312506362 and parameters: {'model_name': 'SimpleImputer', 'strategy': 'median'}. Best is trial 8 with value: 389.7848474564851.
[I 2024-04-21 19:34:06,282] Trial 103 finished with value: 389.7848474564851 and parameters: {'model_name': 'SimpleImputer', 'strategy': 'mean'}. Best is trial 8 with value: 389.7848474564851.
[I 2024-04-21 19:34:06,538] Trial 105 finished with value: 389.7848474564851 and parameters: {'model_name': 'SimpleImputer', 'strategy': 'mean'}. Best is trial 8 with value: 389.7848474564851.
[I 2024-04-21 19:34:06,806] Trial 99 finished with value: 389.7848474564851 and parameters: {'model_name': 'SimpleImputer', 'strategy': 'mean'}. Best is trial 8 with value: 389.7848474564851.
[I 2024-04-21 19:34:07,098] Trial 102 finished with value: 389.7848474564851 and parameters: {'model_name': 'SimpleImputer', 'strategy': 'mean'}. Best is trial 8 with value: 389.7848474564851.
[I 2024-04-21 19:34:07,357] Trial 97 finished with value: 389.7848474564851 and parameters: {'model_name': 'SimpleImputer', 'strategy': 'mean'}. Best is trial 8 with value: 389.7848474564851.
[I 2024-04-21 19:34:07,594] Trial 87 finished with value: 389.7848474564851 and parameters: {'model_name': 'SimpleImputer', 'strategy': 'mean'}. Best is trial 8 with value: 389.7848474564851.
[I 2024-04-21 19:34:07,781] Trial 100 finished with value: 389.7848474564851 and parameters: {'model_name': 'SimpleImputer', 'strategy': 'mean'}. Best is trial 8 with value: 389.7848474564851.
[I 2024-04-21 19:34:08,072] Trial 69 finished with value: 421.2410312506362 and parameters: {'model_name': 'SimpleImputer', 'strategy': 'most_frequent'}. Best is trial 8 with value: 389.7848474564851.
[I 2024-04-21 19:34:08,371] Trial 98 finished with value: 389.7848474564851 and parameters: {'model_name': 'SimpleImputer', 'strategy': 'mean'}. Best is trial 8 with value: 389.7848474564851.
[I 2024-04-21 19:34:08,721] Trial 75 finished with value: 421.2410312506362 and parameters: {'model_name': 'SimpleImputer', 'strategy': 'most_frequent'}. Best is trial 8 with value: 389.7848474564851.
