[I 2024-04-21 19:34:09,047] Trial 107 finished with value: 389.7848474564851 and parameters: {'model_name': 'SimpleImputer', 'strategy': 'mean'}. Best is trial 8 with value: 389.7848474564851.
[I 2024-04-21 19:34:09,278] Trial 77 finished with value: 421.2410312506362 and parameters: {'model_name': 'SimpleImputer', 'strategy': 'most_frequent'}. Best is trial 8 with value: 389.7848474564851.
[I 2024-04-21 19:34:09,566] Trial 70 finished with value: 421.2410312506362 and parameters: {'model_name': 'SimpleImputer', 'strategy': 'most_frequent'}. Best is trial 8 with value: 389.7848474564851.
[I 2024-04-21 19:34:09,823] Trial 95 finished with value: 389.7848474564851 and parameters: {'model_name': 'SimpleImputer', 'strategy': 'mean'}. Best is trial 8 with value: 389.7848474564851.
[I 2024-04-21 19:34:10,081] Trial 79 finished with value: 421.2410312506362 and parameters: {'model_name': 'SimpleImputer', 'strategy': 'most_frequent'}. Best is trial 8 with value: 389.7848474564851.
[I 2024-04-21 19:34:10,388] Trial 104 finished with value: 389.7848474564851 and parameters: {'model_name': 'SimpleImputer', 'strategy': 'mean'}. Best is trial 8 with value: 389.7848474564851.
[I 2024-04-21 19:34:10,551] Trial 76 finished with value: 421.2410312506362 and parameters: {'model_name': 'SimpleImputer', 'strategy': 'most_frequent'}. Best is trial 8 with value: 389.7848474564851.
[I 2024-04-21 19:34:10,710] Trial 73 finished with value: 421.2410312506362 and parameters: {'model_name': 'SimpleImputer', 'strategy': 'most_frequent'}. Best is trial 8 with value: 389.7848474564851.
[I 2024-04-21 19:34:10,933] Trial 106 finished with value: 389.7848474564851 and parameters: {'model_name': 'SimpleImputer', 'strategy': 'mean'}. Best is trial 8 with value: 389.7848474564851.
[I 2024-04-21 19:34:11,148] Trial 101 finished with value: 389.7848474564851 and parameters: {'model_name': 'SimpleImputer', 'strategy': 'mean'}. Best is trial 8 with value: 389.7848474564851.
[I 2024-04-21 19:34:11,425] Trial 74 finished with value: 421.2410312506362 and parameters: {'model_name': 'SimpleImputer', 'strategy': 'most_frequent'}. Best is trial 8 with value: 389.7848474564851.
[I 2024-04-21 19:34:11,647] Trial 108 finished with value: 389.7848474564851 and parameters: {'model_name': 'SimpleImputer', 'strategy': 'mean'}. Best is trial 8 with value: 389.7848474564851.
[I 2024-04-21 19:34:11,906] Trial 78 finished with value: 421.2410312506362 and parameters: {'model_name': 'SimpleImputer', 'strategy': 'most_frequent'}. Best is trial 8 with value: 389.7848474564851.
[I 2024-04-21 19:34:12,258] Trial 112 finished with value: 389.7848474564851 and parameters: {'model_name': 'SimpleImputer', 'strategy': 'mean'}. Best is trial 8 with value: 389.7848474564851.
[I 2024-04-21 19:34:12,550] Trial 80 finished with value: 421.2410312506362 and parameters: {'model_name': 'SimpleImputer', 'strategy': 'most_frequent'}. Best is trial 8 with value: 389.7848474564851.
[I 2024-04-21 19:34:12,807] Trial 109 finished with value: 389.7848474564851 and parameters: {'model_name': 'SimpleImputer', 'strategy': 'mean'}. Best is trial 8 with value: 389.7848474564851.
[I 2024-04-21 19:34:13,115] Trial 111 finished with value: 389.7848474564851 and parameters: {'model_name': 'SimpleImputer', 'strategy': 'mean'}. Best is trial 8 with value: 389.7848474564851.
[I 2024-04-21 19:34:13,533] Trial 110 finished with value: 389.7848474564851 and parameters: {'model_name': 'SimpleImputer', 'strategy': 'mean'}. Best is trial 8 with value: 389.7848474564851.
[I 2024-04-21 19:34:13,827] Trial 115 finished with value: 389.7848474564851 and parameters: {'model_name': 'SimpleImputer', 'strategy': 'mean'}. Best is trial 8 with value: 389.7848474564851.
[I 2024-04-21 19:34:14,138] Trial 119 finished with value: 389.7848474564851 and parameters: {'model_name': 'SimpleImputer', 'strategy': 'mean'}. Best is trial 8 with value: 389.7848474564851.
[I 2024-04-21 19:34:14,443] Trial 117 finished with value: 389.7848474564851 and parameters: {'model_name': 'SimpleImputer', 'strategy': 'mean'}. Best is trial 8 with value: 389.7848474564851.
[I 2024-04-21 19:34:14,694] Trial 114 finished with value: 389.7848474564851 and parameters: {'model_name': 'SimpleImputer', 'strategy': 'mean'}. Best is trial 8 with value: 389.7848474564851.
[I 2024-04-21 19:34:15,003] Trial 113 finished with value: 389.7848474564851 and parameters: {'model_name': 'SimpleImputer', 'strategy': 'mean'}. Best is trial 8 with value: 389.7848474564851.
[I 2024-04-21 19:34:15,547] Trial 121 finished with value: 389.7848474564851 and parameters: {'model_name': 'SimpleImputer', 'strategy': 'mean'}. Best is trial 8 with value: 389.7848474564851.
[I 2024-04-21 19:34:15,806] Trial 116 finished with value: 389.7848474564851 and parameters: {'model_name': 'SimpleImputer', 'strategy': 'mean'}. Best is trial 8 with value: 389.7848474564851.
[I 2024-04-21 19:34:16,021] Trial 122 finished with value: 389.7848474564851 and parameters: {'model_name': 'SimpleImputer', 'strategy': 'mean'}. Best is trial 8 with value: 389.7848474564851.
[I 2024-04-21 19:34:16,431] Trial 118 finished with value: 389.7848474564851 and parameters: {'model_name': 'SimpleImputer', 'strategy': 'mean'}. Best is trial 8 with value: 389.7848474564851.
[I 2024-04-21 19:34:16,643] Trial 127 finished with value: 389.7848474564851 and parameters: {'model_name': 'SimpleImputer', 'strategy': 'mean'}. Best is trial 8 with value: 389.7848474564851.
[I 2024-04-21 19:34:16,926] Trial 128 finished with value: 389.7848474564851 and parameters: {'model_name': 'SimpleImputer', 'strategy': 'mean'}. Best is trial 8 with value: 389.7848474564851.
[I 2024-04-21 19:34:17,343] Trial 125 finished with value: 389.7848474564851 and parameters: {'model_name': 'SimpleImputer', 'strategy': 'mean'}. Best is trial 8 with value: 389.7848474564851.
[I 2024-04-21 19:34:17,653] Trial 126 finished with value: 389.7848474564851 and parameters: {'model_name': 'SimpleImputer', 'strategy': 'mean'}. Best is trial 8 with value: 389.7848474564851.
[I 2024-04-21 19:34:17,896] Trial 123 finished with value: 389.7848474564851 and parameters: {'model_name': 'SimpleImputer', 'strategy': 'mean'}. Best is trial 8 with value: 389.7848474564851.
[I 2024-04-21 19:34:18,088] Trial 131 finished with value: 389.7848474564851 and parameters: {'model_name': 'SimpleImputer', 'strategy': 'mean'}. Best is trial 8 with value: 389.7848474564851.
[I 2024-04-21 19:34:18,514] Trial 129 finished with value: 389.7848474564851 and parameters: {'model_name': 'SimpleImputer', 'strategy': 'mean'}. Best is trial 8 with value: 389.7848474564851.
[I 2024-04-21 19:34:18,761] Trial 132 finished with value: 389.7848474564851 and parameters: {'model_name': 'SimpleImputer', 'strategy': 'mean'}. Best is trial 8 with value: 389.7848474564851.
[I 2024-04-21 19:34:18,953] Trial 136 finished with value: 389.7848474564851 and parameters: {'model_name': 'SimpleImputer', 'strategy': 'mean'}. Best is trial 8 with value: 389.7848474564851.
[I 2024-04-21 19:34:19,231] Trial 134 finished with value: 389.7848474564851 and parameters: {'model_name': 'SimpleImputer', 'strategy': 'mean'}. Best is trial 8 with value: 389.7848474564851.
[I 2024-04-21 19:34:19,472] Trial 124 finished with value: 389.7848474564851 and parameters: {'model_name': 'SimpleImputer', 'strategy': 'mean'}. Best is trial 8 with value: 389.7848474564851.
[I 2024-04-21 19:34:19,665] Trial 144 finished with value: 389.7848474564851 and parameters: {'model_name': 'SimpleImputer', 'strategy': 'mean'}. Best is trial 8 with value: 389.7848474564851.
[I 2024-04-21 19:34:19,906] Trial 141 finished with value: 389.7848474564851 and parameters: {'model_name': 'SimpleImputer', 'strategy': 'mean'}. Best is trial 8 with value: 389.7848474564851.
[I 2024-04-21 19:34:20,183] Trial 120 finished with value: 389.7848474564851 and parameters: {'model_name': 'SimpleImputer', 'strategy': 'mean'}. Best is trial 8 with value: 389.7848474564851.
[I 2024-04-21 19:34:20,357] Trial 139 finished with value: 389.7848474564851 and parameters: {'model_name': 'SimpleImputer', 'strategy': 'mean'}. Best is trial 8 with value: 389.7848474564851.
[I 2024-04-21 19:34:20,619] Trial 140 finished with value: 389.7848474564851 and parameters: {'model_name': 'SimpleImputer', 'strategy': 'mean'}. Best is trial 8 with value: 389.7848474564851.
[I 2024-04-21 19:34:20,815] Trial 143 finished with value: 389.7848474564851 and parameters: {'model_name': 'SimpleImputer', 'strategy': 'mean'}. Best is trial 8 with value: 389.7848474564851.
[I 2024-04-21 19:34:21,012] Trial 133 finished with value: 389.7848474564851 and parameters: {'model_name': 'SimpleImputer', 'strategy': 'mean'}. Best is trial 8 with value: 389.7848474564851.
[I 2024-04-21 19:34:21,210] Trial 138 finished with value: 389.7848474564851 and parameters: {'model_name': 'SimpleImputer', 'strategy': 'mean'}. Best is trial 8 with value: 389.7848474564851.
[I 2024-04-21 19:34:21,544] Trial 145 finished with value: 389.7848474564851 and parameters: {'model_name': 'SimpleImputer', 'strategy': 'mean'}. Best is trial 8 with value: 389.7848474564851.
[I 2024-04-21 19:34:21,954] Trial 146 finished with value: 389.7848474564851 and parameters: {'model_name': 'SimpleImputer', 'strategy': 'mean'}. Best is trial 8 with value: 389.7848474564851.
[I 2024-04-21 19:34:22,240] Trial 130 finished with value: 389.7848474564851 and parameters: {'model_name': 'SimpleImputer', 'strategy': 'mean'}. Best is trial 8 with value: 389.7848474564851.
[I 2024-04-21 19:34:22,450] Trial 147 finished with value: 389.7848474564851 and parameters: {'model_name': 'SimpleImputer', 'strategy': 'mean'}. Best is trial 8 with value: 389.7848474564851.
[I 2024-04-21 19:34:22,646] Trial 137 finished with value: 389.7848474564851 and parameters: {'model_name': 'SimpleImputer', 'strategy': 'mean'}. Best is trial 8 with value: 389.7848474564851.
[I 2024-04-21 19:34:22,903] Trial 135 finished with value: 389.7848474564851 and parameters: {'model_name': 'SimpleImputer', 'strategy': 'mean'}. Best is trial 8 with value: 389.7848474564851.
[I 2024-04-21 19:34:23,107] Trial 153 finished with value: 389.7848474564851 and parameters: {'model_name': 'SimpleImputer', 'strategy': 'mean'}. Best is trial 8 with value: 389.7848474564851.
[I 2024-04-21 19:34:23,349] Trial 142 finished with value: 389.7848474564851 and parameters: {'model_name': 'SimpleImputer', 'strategy': 'mean'}. Best is trial 8 with value: 389.7848474564851.
[I 2024-04-21 19:34:23,560] Trial 148 finished with value: 389.7848474564851 and parameters: {'model_name': 'SimpleImputer', 'strategy': 'mean'}. Best is trial 8 with value: 389.7848474564851.
[I 2024-04-21 19:34:23,767] Trial 149 finished with value: 389.7848474564851 and parameters: {'model_name': 'SimpleImputer', 'strategy': 'mean'}. Best is trial 8 with value: 389.7848474564851.
[I 2024-04-21 19:34:24,052] Trial 154 finished with value: 389.7848474564851 and parameters: {'model_name': 'SimpleImputer', 'strategy': 'mean'}. Best is trial 8 with value: 389.7848474564851.
[I 2024-04-21 19:34:24,225] Trial 152 finished with value: 389.7848474564851 and parameters: {'model_name': 'SimpleImputer', 'strategy': 'mean'}. Best is trial 8 with value: 389.7848474564851.
[I 2024-04-21 19:34:24,503] Trial 157 finished with value: 389.7848474564851 and parameters: {'model_name': 'SimpleImputer', 'strategy': 'mean'}. Best is trial 8 with value: 389.7848474564851.
[I 2024-04-21 19:34:24,755] Trial 150 finished with value: 389.7848474564851 and parameters: {'model_name': 'SimpleImputer', 'strategy': 'mean'}. Best is trial 8 with value: 389.7848474564851.
[I 2024-04-21 19:34:24,942] Trial 151 finished with value: 389.7848474564851 and parameters: {'model_name': 'SimpleImputer', 'strategy': 'mean'}. Best is trial 8 with value: 389.7848474564851.
[I 2024-04-21 19:34:25,198] Trial 159 finished with value: 389.7848474564851 and parameters: {'model_name': 'SimpleImputer', 'strategy': 'mean'}. Best is trial 8 with value: 389.7848474564851.
[I 2024-04-21 19:34:25,483] Trial 155 finished with value: 389.7848474564851 and parameters: {'model_name': 'SimpleImputer', 'strategy': 'mean'}. Best is trial 8 with value: 389.7848474564851.
[I 2024-04-21 19:34:25,672] Trial 158 finished with value: 389.7848474564851 and parameters: {'model_name': 'SimpleImputer', 'strategy': 'mean'}. Best is trial 8 with value: 389.7848474564851.
[I 2024-04-21 19:34:25,916] Trial 165 finished with value: 389.7848474564851 and parameters: {'model_name': 'SimpleImputer', 'strategy': 'mean'}. Best is trial 8 with value: 389.7848474564851.
[I 2024-04-21 19:34:26,141] Trial 156 finished with value: 389.7848474564851 and parameters: {'model_name': 'SimpleImputer', 'strategy': 'mean'}. Best is trial 8 with value: 389.7848474564851.
[I 2024-04-21 19:34:26,592] Trial 162 finished with value: 389.7848474564851 and parameters: {'model_name': 'SimpleImputer', 'strategy': 'mean'}. Best is trial 8 with value: 389.7848474564851.
[I 2024-04-21 19:34:26,879] Trial 164 finished with value: 389.7848474564851 and parameters: {'model_name': 'SimpleImputer', 'strategy': 'mean'}. Best is trial 8 with value: 389.7848474564851.
[I 2024-04-21 19:34:27,226] Trial 163 finished with value: 389.7848474564851 and parameters: {'model_name': 'SimpleImputer', 'strategy': 'mean'}. Best is trial 8 with value: 389.7848474564851.
[I 2024-04-21 19:34:27,562] Trial 160 finished with value: 389.7848474564851 and parameters: {'model_name': 'SimpleImputer', 'strategy': 'mean'}. Best is trial 8 with value: 389.7848474564851.
[I 2024-04-21 19:34:27,866] Trial 161 finished with value: 389.7848474564851 and parameters: {'model_name': 'SimpleImputer', 'strategy': 'mean'}. Best is trial 8 with value: 389.7848474564851.
[I 2024-04-21 19:34:28,152] Trial 166 finished with value: 389.7848474564851 and parameters: {'model_name': 'SimpleImputer', 'strategy': 'mean'}. Best is trial 8 with value: 389.7848474564851.
[I 2024-04-21 19:34:28,481] Trial 167 finished with value: 389.7848474564851 and parameters: {'model_name': 'SimpleImputer', 'strategy': 'mean'}. Best is trial 8 with value: 389.7848474564851.
[I 2024-04-21 19:34:28,668] Trial 168 finished with value: 389.7848474564851 and parameters: {'model_name': 'SimpleImputer', 'strategy': 'mean'}. Best is trial 8 with value: 389.7848474564851.
[I 2024-04-21 19:34:28,920] Trial 169 finished with value: 389.7848474564851 and parameters: {'model_name': 'SimpleImputer', 'strategy': 'mean'}. Best is trial 8 with value: 389.7848474564851.
[I 2024-04-21 19:34:29,125] Trial 183 finished with value: 421.2410312506362 and parameters: {'model_name': 'SimpleImputer', 'strategy': 'constant'}. Best is trial 8 with value: 389.7848474564851.
[I 2024-04-21 19:34:29,412] Trial 181 finished with value: 421.2410312506362 and parameters: {'model_name': 'SimpleImputer', 'strategy': 'constant'}. Best is trial 8 with value: 389.7848474564851.
[I 2024-04-21 19:34:29,653] Trial 172 finished with value: 389.7848474564851 and parameters: {'model_name': 'SimpleImputer', 'strategy': 'mean'}. Best is trial 8 with value: 389.7848474564851.
[I 2024-04-21 19:34:29,823] Trial 171 finished with value: 389.7848474564851 and parameters: {'model_name': 'SimpleImputer', 'strategy': 'mean'}. Best is trial 8 with value: 389.7848474564851.
[I 2024-04-21 19:34:30,074] Trial 188 finished with value: 421.2410312506362 and parameters: {'model_name': 'SimpleImputer', 'strategy': 'constant'}. Best is trial 8 with value: 389.7848474564851.
[I 2024-04-21 19:34:30,274] Trial 182 finished with value: 421.2410312506362 and parameters: {'model_name': 'SimpleImputer', 'strategy': 'constant'}. Best is trial 8 with value: 389.7848474564851.
[I 2024-04-21 19:34:30,437] Trial 187 finished with value: 421.2410312506362 and parameters: {'model_name': 'SimpleImputer', 'strategy': 'constant'}. Best is trial 8 with value: 389.7848474564851.
[I 2024-04-21 19:34:30,610] Trial 170 finished with value: 389.7848474564851 and parameters: {'model_name': 'SimpleImputer', 'strategy': 'mean'}. Best is trial 8 with value: 389.7848474564851.
[I 2024-04-21 19:34:30,910] Trial 175 finished with value: 389.7848474564851 and parameters: {'model_name': 'SimpleImputer', 'strategy': 'mean'}. Best is trial 8 with value: 389.7848474564851.
[I 2024-04-21 19:34:31,191] Trial 180 finished with value: 421.2410312506362 and parameters: {'model_name': 'SimpleImputer', 'strategy': 'constant'}. Best is trial 8 with value: 389.7848474564851.
[I 2024-04-21 19:34:31,400] Trial 174 finished with value: 389.7848474564851 and parameters: {'model_name': 'SimpleImputer', 'strategy': 'mean'}. Best is trial 8 with value: 389.7848474564851.
[I 2024-04-21 19:34:31,628] Trial 176 finished with value: 389.7848474564851 and parameters: {'model_name': 'SimpleImputer', 'strategy': 'mean'}. Best is trial 8 with value: 389.7848474564851.
[I 2024-04-21 19:34:31,808] Trial 185 finished with value: 389.7848474564851 and parameters: {'model_name': 'SimpleImputer', 'strategy': 'mean'}. Best is trial 8 with value: 389.7848474564851.
[I 2024-04-21 19:34:31,986] Trial 192 finished with value: 421.2410312506362 and parameters: {'model_name': 'SimpleImputer', 'strategy': 'constant'}. Best is trial 8 with value: 389.7848474564851.
[I 2024-04-21 19:34:32,147] Trial 184 finished with value: 421.2410312506362 and parameters: {'model_name': 'SimpleImputer', 'strategy': 'constant'}. Best is trial 8 with value: 389.7848474564851.
[I 2024-04-21 19:34:32,387] Trial 186 finished with value: 421.2410312506362 and parameters: {'model_name': 'SimpleImputer', 'strategy': 'constant'}. Best is trial 8 with value: 389.7848474564851.
[I 2024-04-21 19:34:32,659] Trial 189 finished with value: 389.7848474564851 and parameters: {'model_name': 'SimpleImputer', 'strategy': 'mean'}. Best is trial 8 with value: 389.7848474564851.
[I 2024-04-21 19:34:32,913] Trial 179 finished with value: 389.7848474564851 and parameters: {'model_name': 'SimpleImputer', 'strategy': 'mean'}. Best is trial 8 with value: 389.7848474564851.
[I 2024-04-21 19:34:33,171] Trial 193 finished with value: 421.2410312506362 and parameters: {'model_name': 'SimpleImputer', 'strategy': 'constant'}. Best is trial 8 with value: 389.7848474564851.
[I 2024-04-21 19:34:33,353] Trial 177 finished with value: 389.7848474564851 and parameters: {'model_name': 'SimpleImputer', 'strategy': 'mean'}. Best is trial 8 with value: 389.7848474564851.
[I 2024-04-21 19:34:33,589] Trial 195 finished with value: 421.2410312506362 and parameters: {'model_name': 'SimpleImputer', 'strategy': 'constant'}. Best is trial 8 with value: 389.7848474564851.
[I 2024-04-21 19:34:33,823] Trial 194 finished with value: 421.2410312506362 and parameters: {'model_name': 'SimpleImputer', 'strategy': 'constant'}. Best is trial 8 with value: 389.7848474564851.
[I 2024-04-21 19:34:34,048] Trial 191 finished with value: 421.2410312506362 and parameters: {'model_name': 'SimpleImputer', 'strategy': 'constant'}. Best is trial 8 with value: 389.7848474564851.
[I 2024-04-21 19:34:34,220] Trial 173 finished with value: 389.7848474564851 and parameters: {'model_name': 'SimpleImputer', 'strategy': 'mean'}. Best is trial 8 with value: 389.7848474564851.
[I 2024-04-21 19:34:34,463] Trial 190 finished with value: 421.2410312506362 and parameters: {'model_name': 'SimpleImputer', 'strategy': 'constant'}. Best is trial 8 with value: 389.7848474564851.
[I 2024-04-21 19:34:34,698] Trial 178 finished with value: 389.7848474564851 and parameters: {'model_name': 'SimpleImputer', 'strategy': 'mean'}. Best is trial 8 with value: 389.7848474564851.
[I 2024-04-21 19:34:34,890] Trial 196 finished with value: 421.2410312506362 and parameters: {'model_name': 'SimpleImputer', 'strategy': 'constant'}. Best is trial 8 with value: 389.7848474564851.
[I 2024-04-21 19:34:35,051] Trial 198 finished with value: 421.2410312506362 and parameters: {'model_name': 'SimpleImputer', 'strategy': 'constant'}. Best is trial 8 with value: 389.7848474564851.
[I 2024-04-21 19:34:35,297] Trial 199 finished with value: 421.2410312506362 and parameters: {'model_name': 'SimpleImputer', 'strategy': 'constant'}. Best is trial 8 with value: 389.7848474564851.
