[I 2024-02-28 01:31:27,278] Trial 48 finished with value: 2611.4865787409003 and parameters: {'model_name': 'RandomForestImputer', 'max_iter': 4, 'decreasing': False, 'min_samples_split': 0.1, 'min_samples_leaf': 0.6, 'max_features': 0.8, 'warm_start': False}. Best is trial 4 with value: 2414.4818445410287.
[I 2024-02-28 01:31:42,224] Trial 35 finished with value: 2578.7329450823104 and parameters: {'model_name': 'RandomForestImputer', 'max_iter': 6, 'decreasing': True, 'min_samples_split': 0.9, 'min_samples_leaf': 0.2, 'max_features': 0.8, 'warm_start': False}. Best is trial 4 with value: 2414.4818445410287.
[I 2024-02-28 01:31:45,647] Trial 72 finished with value: 48573.124331259605 and parameters: {'model_name': 'GAIN', 'batch_size': 71, 'hint_rate': 0.55, 'alpha': 96, 'iterations': 77}. Best is trial 4 with value: 2414.4818445410287.
[I 2024-02-28 01:31:56,936] Trial 138 finished with value: 2466.7741358079916 and parameters: {'model_name': 'KNNImputer', 'weights': 'distance', 'keep_empty_features': False}. Best is trial 4 with value: 2414.4818445410287.
[I 2024-02-28 01:32:08,295] Trial 139 finished with value: 2466.7741358079916 and parameters: {'model_name': 'KNNImputer', 'weights': 'distance', 'keep_empty_features': False}. Best is trial 4 with value: 2414.4818445410287.
[I 2024-02-28 01:32:19,712] Trial 140 finished with value: 2414.4818445410287 and parameters: {'model_name': 'KNNImputer', 'weights': 'uniform', 'keep_empty_features': False}. Best is trial 4 with value: 2414.4818445410287.
[I 2024-02-28 01:32:31,320] Trial 141 finished with value: 2414.4818445410287 and parameters: {'model_name': 'KNNImputer', 'weights': 'uniform', 'keep_empty_features': False}. Best is trial 4 with value: 2414.4818445410287.
[I 2024-02-28 01:32:34,431] Trial 25 finished with value: 2595.795365076245 and parameters: {'model_name': 'RandomForestImputer', 'max_iter': 13, 'decreasing': False, 'min_samples_split': 0.5, 'min_samples_leaf': 0.30000000000000004, 'max_features': 0.4, 'warm_start': False}. Best is trial 4 with value: 2414.4818445410287.
[I 2024-02-28 01:32:44,151] Trial 142 finished with value: 2414.4818445410287 and parameters: {'model_name': 'KNNImputer', 'weights': 'uniform', 'keep_empty_features': False}. Best is trial 4 with value: 2414.4818445410287.
[I 2024-02-28 01:32:48,075] Trial 143 finished with value: 2414.4818445410287 and parameters: {'model_name': 'KNNImputer', 'weights': 'uniform', 'keep_empty_features': False}. Best is trial 4 with value: 2414.4818445410287.
[I 2024-02-28 01:32:49,130] Trial 145 finished with value: 2610.9209837037047 and parameters: {'model_name': 'SimpleImputer', 'strategy': 'mean'}. Best is trial 4 with value: 2414.4818445410287.
[I 2024-02-28 01:32:57,500] Trial 50 finished with value: 5218.912999164745 and parameters: {'model_name': 'IterativeImputer', 'sample_posterior': True, 'initial_strategy': 'most_frequent', 'imputation_order': 'ascending'}. Best is trial 4 with value: 2414.4818445410287.
[I 2024-02-28 01:32:59,876] Trial 144 finished with value: 2414.4818445410287 and parameters: {'model_name': 'KNNImputer', 'weights': 'uniform', 'keep_empty_features': False}. Best is trial 4 with value: 2414.4818445410287.
[I 2024-02-28 01:33:02,344] Trial 55 finished with value: 5441.539789504801 and parameters: {'model_name': 'IterativeImputer', 'sample_posterior': True, 'initial_strategy': 'most_frequent', 'imputation_order': 'roman'}. Best is trial 4 with value: 2414.4818445410287.
[I 2024-02-28 01:33:04,806] Trial 146 finished with value: 2414.4818445410287 and parameters: {'model_name': 'KNNImputer', 'weights': 'uniform', 'keep_empty_features': False}. Best is trial 4 with value: 2414.4818445410287.
[I 2024-02-28 01:33:06,042] Trial 64 finished with value: 5349.033844817457 and parameters: {'model_name': 'IterativeImputer', 'sample_posterior': True, 'initial_strategy': 'mean', 'imputation_order': 'descending'}. Best is trial 4 with value: 2414.4818445410287.
[I 2024-02-28 01:33:10,128] Trial 49 finished with value: 5310.906933708314 and parameters: {'model_name': 'IterativeImputer', 'sample_posterior': True, 'initial_strategy': 'mean', 'imputation_order': 'arabic'}. Best is trial 4 with value: 2414.4818445410287.
[I 2024-02-28 01:33:11,796] Trial 51 finished with value: 5369.595465654168 and parameters: {'model_name': 'IterativeImputer', 'sample_posterior': True, 'initial_strategy': 'most_frequent', 'imputation_order': 'arabic'}. Best is trial 4 with value: 2414.4818445410287.
[I 2024-02-28 01:33:16,825] Trial 147 finished with value: 2414.4818445410287 and parameters: {'model_name': 'KNNImputer', 'weights': 'uniform', 'keep_empty_features': False}. Best is trial 4 with value: 2414.4818445410287.
[I 2024-02-28 01:33:18,695] Trial 148 finished with value: 2414.4818445410287 and parameters: {'model_name': 'KNNImputer', 'weights': 'uniform', 'keep_empty_features': False}. Best is trial 4 with value: 2414.4818445410287.
[I 2024-02-28 01:33:21,327] Trial 149 finished with value: 2414.4818445410287 and parameters: {'model_name': 'KNNImputer', 'weights': 'uniform', 'keep_empty_features': False}. Best is trial 4 with value: 2414.4818445410287.
[I 2024-02-28 01:33:24,391] Trial 150 finished with value: 2414.4818445410287 and parameters: {'model_name': 'KNNImputer', 'weights': 'uniform', 'keep_empty_features': False}. Best is trial 4 with value: 2414.4818445410287.
[I 2024-02-28 01:33:25,920] Trial 151 finished with value: 2414.4818445410287 and parameters: {'model_name': 'KNNImputer', 'weights': 'uniform', 'keep_empty_features': False}. Best is trial 4 with value: 2414.4818445410287.
[I 2024-02-28 01:33:31,113] Trial 152 finished with value: 2414.4818445410287 and parameters: {'model_name': 'KNNImputer', 'weights': 'uniform', 'keep_empty_features': False}. Best is trial 4 with value: 2414.4818445410287.
[I 2024-02-28 01:33:32,170] Trial 153 finished with value: 2414.4818445410287 and parameters: {'model_name': 'KNNImputer', 'weights': 'uniform', 'keep_empty_features': False}. Best is trial 4 with value: 2414.4818445410287.
[I 2024-02-28 01:33:35,865] Trial 154 finished with value: 2414.4818445410287 and parameters: {'model_name': 'KNNImputer', 'weights': 'uniform', 'keep_empty_features': False}. Best is trial 4 with value: 2414.4818445410287.
[I 2024-02-28 01:33:38,507] Trial 155 finished with value: 2414.4818445410287 and parameters: {'model_name': 'KNNImputer', 'weights': 'uniform', 'keep_empty_features': False}. Best is trial 4 with value: 2414.4818445410287.
[I 2024-02-28 01:33:40,666] Trial 156 finished with value: 2414.4818445410287 and parameters: {'model_name': 'KNNImputer', 'weights': 'uniform', 'keep_empty_features': False}. Best is trial 4 with value: 2414.4818445410287.
[I 2024-02-28 01:33:43,660] Trial 158 finished with value: 2414.4818445410287 and parameters: {'model_name': 'KNNImputer', 'weights': 'uniform', 'keep_empty_features': False}. Best is trial 4 with value: 2414.4818445410287.
[I 2024-02-28 01:33:48,165] Trial 159 finished with value: 2414.4818445410287 and parameters: {'model_name': 'KNNImputer', 'weights': 'uniform', 'keep_empty_features': False}. Best is trial 4 with value: 2414.4818445410287.
[I 2024-02-28 01:33:49,300] Trial 160 finished with value: 2414.4818445410287 and parameters: {'model_name': 'KNNImputer', 'weights': 'uniform', 'keep_empty_features': False}. Best is trial 4 with value: 2414.4818445410287.
[I 2024-02-28 01:33:52,121] Trial 161 finished with value: 2414.4818445410287 and parameters: {'model_name': 'KNNImputer', 'weights': 'uniform', 'keep_empty_features': False}. Best is trial 4 with value: 2414.4818445410287.
[I 2024-02-28 01:33:56,971] Trial 164 finished with value: 2414.4818445410287 and parameters: {'model_name': 'KNNImputer', 'weights': 'uniform', 'keep_empty_features': False}. Best is trial 4 with value: 2414.4818445410287.
[I 2024-02-28 01:34:35,119] Trial 57 finished with value: 19958.413663363976 and parameters: {'model_name': 'GAIN', 'batch_size': 1, 'hint_rate': 0.65, 'alpha': 22, 'iterations': 295}. Best is trial 4 with value: 2414.4818445410287.
[I 2024-02-28 01:34:43,390] Trial 169 finished with value: 2414.4818445410287 and parameters: {'model_name': 'KNNImputer', 'weights': 'uniform', 'keep_empty_features': False}. Best is trial 4 with value: 2414.4818445410287.
[I 2024-02-28 01:34:52,151] Trial 170 finished with value: 2414.4818445410287 and parameters: {'model_name': 'KNNImputer', 'weights': 'uniform', 'keep_empty_features': False}. Best is trial 4 with value: 2414.4818445410287.
[I 2024-02-28 01:34:55,442] Trial 1 finished with value: 2611.4691489774827 and parameters: {'model_name': 'RandomForestImputer', 'max_iter': 22, 'decreasing': False, 'min_samples_split': 0.4, 'min_samples_leaf': 0.7000000000000001, 'max_features': 0.9, 'warm_start': False}. Best is trial 4 with value: 2414.4818445410287.
[I 2024-02-28 01:38:14,975] Trial 73 finished with value: 7381.068421265261 and parameters: {'model_name': 'GAIN', 'batch_size': 20, 'hint_rate': 0.62, 'alpha': 61, 'iterations': 567}. Best is trial 4 with value: 2414.4818445410287.
[I 2024-02-28 01:38:23,391] Trial 173 finished with value: 2414.4818445410287 and parameters: {'model_name': 'KNNImputer', 'weights': 'uniform', 'keep_empty_features': False}. Best is trial 4 with value: 2414.4818445410287.
[I 2024-02-28 01:38:31,776] Trial 174 finished with value: 2414.4818445410287 and parameters: {'model_name': 'KNNImputer', 'weights': 'uniform', 'keep_empty_features': False}. Best is trial 4 with value: 2414.4818445410287.
[I 2024-02-28 01:38:35,971] Trial 32 finished with value: 6373.619977552906 and parameters: {'model_name': 'GAIN', 'batch_size': 11, 'hint_rate': 0.46, 'alpha': 92, 'iterations': 652}. Best is trial 4 with value: 2414.4818445410287.
[I 2024-02-28 01:38:41,826] Trial 175 finished with value: 2414.4818445410287 and parameters: {'model_name': 'KNNImputer', 'weights': 'uniform', 'keep_empty_features': False}. Best is trial 4 with value: 2414.4818445410287.
[I 2024-02-28 01:38:46,279] Trial 176 finished with value: 2414.4818445410287 and parameters: {'model_name': 'KNNImputer', 'weights': 'uniform', 'keep_empty_features': False}. Best is trial 4 with value: 2414.4818445410287.
[I 2024-02-28 01:38:52,519] Trial 177 finished with value: 2466.7741358079916 and parameters: {'model_name': 'KNNImputer', 'weights': 'distance', 'keep_empty_features': False}. Best is trial 4 with value: 2414.4818445410287.
[I 2024-02-28 01:38:56,843] Trial 178 finished with value: 2414.4818445410287 and parameters: {'model_name': 'KNNImputer', 'weights': 'uniform', 'keep_empty_features': False}. Best is trial 4 with value: 2414.4818445410287.
[I 2024-02-28 01:39:03,248] Trial 179 finished with value: 2414.4818445410287 and parameters: {'model_name': 'KNNImputer', 'weights': 'uniform', 'keep_empty_features': False}. Best is trial 4 with value: 2414.4818445410287.
[I 2024-02-28 01:39:07,196] Trial 180 finished with value: 2414.4818445410287 and parameters: {'model_name': 'KNNImputer', 'weights': 'uniform', 'keep_empty_features': False}. Best is trial 4 with value: 2414.4818445410287.
[I 2024-02-28 01:39:13,643] Trial 181 finished with value: 2414.4818445410287 and parameters: {'model_name': 'KNNImputer', 'weights': 'uniform', 'keep_empty_features': False}. Best is trial 4 with value: 2414.4818445410287.
[I 2024-02-28 01:39:14,629] Trial 183 finished with value: 2726.5289275663476 and parameters: {'model_name': 'SimpleImputer', 'strategy': 'constant'}. Best is trial 4 with value: 2414.4818445410287.
[I 2024-02-28 01:39:17,760] Trial 182 finished with value: 2414.4818445410287 and parameters: {'model_name': 'KNNImputer', 'weights': 'uniform', 'keep_empty_features': False}. Best is trial 4 with value: 2414.4818445410287.
[I 2024-02-28 01:39:24,431] Trial 184 finished with value: 2414.4818445410287 and parameters: {'model_name': 'KNNImputer', 'weights': 'uniform', 'keep_empty_features': False}. Best is trial 4 with value: 2414.4818445410287.
[I 2024-02-28 01:39:28,346] Trial 185 finished with value: 2414.4818445410287 and parameters: {'model_name': 'KNNImputer', 'weights': 'uniform', 'keep_empty_features': False}. Best is trial 4 with value: 2414.4818445410287.
[I 2024-02-28 01:39:34,662] Trial 186 finished with value: 2414.4818445410287 and parameters: {'model_name': 'KNNImputer', 'weights': 'uniform', 'keep_empty_features': False}. Best is trial 4 with value: 2414.4818445410287.
[I 2024-02-28 01:39:38,691] Trial 187 finished with value: 2414.4818445410287 and parameters: {'model_name': 'KNNImputer', 'weights': 'uniform', 'keep_empty_features': False}. Best is trial 4 with value: 2414.4818445410287.
[I 2024-02-28 01:39:45,305] Trial 188 finished with value: 2414.4818445410287 and parameters: {'model_name': 'KNNImputer', 'weights': 'uniform', 'keep_empty_features': False}. Best is trial 4 with value: 2414.4818445410287.
[I 2024-02-28 01:39:49,661] Trial 189 finished with value: 2414.4818445410287 and parameters: {'model_name': 'KNNImputer', 'weights': 'uniform', 'keep_empty_features': False}. Best is trial 4 with value: 2414.4818445410287.
[I 2024-02-28 01:39:52,533] Trial 40 finished with value: 2611.2892015804173 and parameters: {'model_name': 'RandomForestImputer', 'max_iter': 54, 'decreasing': True, 'min_samples_split': 0.1, 'min_samples_leaf': 0.8, 'max_features': 0.6, 'warm_start': False}. Best is trial 4 with value: 2414.4818445410287.
[I 2024-02-28 01:39:57,893] Trial 190 finished with value: 2414.4818445410287 and parameters: {'model_name': 'KNNImputer', 'weights': 'uniform', 'keep_empty_features': False}. Best is trial 4 with value: 2414.4818445410287.
[I 2024-02-28 01:40:02,528] Trial 191 finished with value: 2414.4818445410287 and parameters: {'model_name': 'KNNImputer', 'weights': 'uniform', 'keep_empty_features': False}. Best is trial 4 with value: 2414.4818445410287.
[I 2024-02-28 01:40:04,992] Trial 192 finished with value: 2414.4818445410287 and parameters: {'model_name': 'KNNImputer', 'weights': 'uniform', 'keep_empty_features': False}. Best is trial 4 with value: 2414.4818445410287.
[I 2024-02-28 01:40:09,849] Trial 193 finished with value: 2414.4818445410287 and parameters: {'model_name': 'KNNImputer', 'weights': 'uniform', 'keep_empty_features': False}. Best is trial 4 with value: 2414.4818445410287.
[I 2024-02-28 01:40:14,506] Trial 195 finished with value: 2466.7741358079916 and parameters: {'model_name': 'KNNImputer', 'weights': 'distance', 'keep_empty_features': False}. Best is trial 4 with value: 2414.4818445410287.
[I 2024-02-28 01:40:51,713] Trial 23 finished with value: 8787.52818819504 and parameters: {'model_name': 'GAIN', 'batch_size': 4, 'hint_rate': 0.88, 'alpha': 24, 'iterations': 852}. Best is trial 4 with value: 2414.4818445410287.
[I 2024-02-28 01:40:58,627] Trial 62 finished with value: 10387.098703116138 and parameters: {'model_name': 'GAIN', 'batch_size': 1, 'hint_rate': 0.98, 'alpha': 22, 'iterations': 871}. Best is trial 4 with value: 2414.4818445410287.
[I 2024-02-28 01:41:01,087] Trial 198 finished with value: 2414.4818445410287 and parameters: {'model_name': 'KNNImputer', 'weights': 'uniform', 'keep_empty_features': False}. Best is trial 4 with value: 2414.4818445410287.
[I 2024-02-28 01:41:08,112] Trial 199 finished with value: 2414.4818445410287 and parameters: {'model_name': 'KNNImputer', 'weights': 'uniform', 'keep_empty_features': False}. Best is trial 4 with value: 2414.4818445410287.
[I 2024-02-28 01:42:22,040] Trial 41 finished with value: inf and parameters: {'model_name': 'GAIN', 'batch_size': 60, 'hint_rate': 0.9400000000000001, 'alpha': 87, 'iterations': 9096}. Best is trial 4 with value: 2414.4818445410287.
[I 2024-02-28 01:43:46,754] Trial 70 finished with value: 4596.584550975886 and parameters: {'model_name': 'GAIN', 'batch_size': 5, 'hint_rate': 0.44, 'alpha': 14, 'iterations': 1132}. Best is trial 4 with value: 2414.4818445410287.
[I 2024-02-28 01:49:04,543] Trial 69 finished with value: inf and parameters: {'model_name': 'GAIN', 'batch_size': 850, 'hint_rate': 0.66, 'alpha': 4, 'iterations': 12496}. Best is trial 4 with value: 2414.4818445410287.
[I 2024-02-28 01:49:09,610] Trial 66 finished with value: 2974.806838581709 and parameters: {'model_name': 'GAIN', 'batch_size': 10, 'hint_rate': 0.23, 'alpha': 82, 'iterations': 1690}. Best is trial 4 with value: 2414.4818445410287.
[I 2024-02-28 01:53:58,930] Trial 61 finished with value: inf and parameters: {'model_name': 'GAIN', 'batch_size': 660, 'hint_rate': 0.25, 'alpha': 86, 'iterations': 17281}. Best is trial 4 with value: 2414.4818445410287.
[I 2024-02-28 02:00:10,876] Trial 68 finished with value: 3407.0002038247794 and parameters: {'model_name': 'GAIN', 'batch_size': 1, 'hint_rate': 0.41000000000000003, 'alpha': 69, 'iterations': 2945}. Best is trial 4 with value: 2414.4818445410287.
[I 2024-02-28 02:08:27,871] Trial 71 finished with value: 2857.9931136503355 and parameters: {'model_name': 'GAIN', 'batch_size': 6, 'hint_rate': 0.87, 'alpha': 97, 'iterations': 3921}. Best is trial 4 with value: 2414.4818445410287.
[I 2024-02-28 02:13:53,120] Trial 168 finished with value: inf and parameters: {'model_name': 'GAIN', 'batch_size': 1, 'hint_rate': 0.09, 'alpha': 73, 'iterations': 43908}. Best is trial 4 with value: 2414.4818445410287.
[I 2024-02-28 02:20:55,186] Trial 134 finished with value: inf and parameters: {'model_name': 'GAIN', 'batch_size': 1, 'hint_rate': 0.01, 'alpha': 87, 'iterations': 54690}. Best is trial 4 with value: 2414.4818445410287.
[I 2024-02-28 02:25:30,326] Trial 157 finished with value: inf and parameters: {'model_name': 'GAIN', 'batch_size': 1, 'hint_rate': 0.05, 'alpha': 71, 'iterations': 58555}. Best is trial 4 with value: 2414.4818445410287.
[I 2024-02-28 02:25:41,711] Trial 197 finished with value: inf and parameters: {'model_name': 'GAIN', 'batch_size': 797, 'hint_rate': 0.02, 'alpha': 69, 'iterations': 38691}. Best is trial 4 with value: 2414.4818445410287.
[I 2024-02-28 02:28:15,847] Trial 129 finished with value: inf and parameters: {'model_name': 'GAIN', 'batch_size': 1, 'hint_rate': 0.01, 'alpha': 100, 'iterations': 64216}. Best is trial 4 with value: 2414.4818445410287.
[I 2024-02-28 02:28:36,038] Trial 136 finished with value: inf and parameters: {'model_name': 'GAIN', 'batch_size': 1, 'hint_rate': 0.06999999999999999, 'alpha': 89, 'iterations': 64190}. Best is trial 4 with value: 2414.4818445410287.
[I 2024-02-28 02:29:09,028] Trial 172 finished with value: inf and parameters: {'model_name': 'GAIN', 'batch_size': 7, 'hint_rate': 0.02, 'alpha': 75, 'iterations': 62404}. Best is trial 4 with value: 2414.4818445410287.
[I 2024-02-28 02:29:36,510] Trial 165 finished with value: inf and parameters: {'model_name': 'GAIN', 'batch_size': 1, 'hint_rate': 0.03, 'alpha': 70, 'iterations': 64067}. Best is trial 4 with value: 2414.4818445410287.
[I 2024-02-28 02:30:11,291] Trial 122 finished with value: inf and parameters: {'model_name': 'GAIN', 'batch_size': 1, 'hint_rate': 0.05, 'alpha': 92, 'iterations': 67650}. Best is trial 4 with value: 2414.4818445410287.
[I 2024-02-28 02:30:30,720] Trial 118 finished with value: inf and parameters: {'model_name': 'GAIN', 'batch_size': 1, 'hint_rate': 0.03, 'alpha': 100, 'iterations': 67376}. Best is trial 4 with value: 2414.4818445410287.
[I 2024-02-28 02:30:34,579] Trial 120 finished with value: inf and parameters: {'model_name': 'GAIN', 'batch_size': 1, 'hint_rate': 0.08, 'alpha': 100, 'iterations': 67732}. Best is trial 4 with value: 2414.4818445410287.
[I 2024-02-28 02:31:47,673] Trial 124 finished with value: inf and parameters: {'model_name': 'GAIN', 'batch_size': 1, 'hint_rate': 0.02, 'alpha': 97, 'iterations': 69759}. Best is trial 4 with value: 2414.4818445410287.
[I 2024-02-28 02:32:58,874] Trial 75 finished with value: inf and parameters: {'model_name': 'GAIN', 'batch_size': 1, 'hint_rate': 0.9400000000000001, 'alpha': 92, 'iterations': 72897}. Best is trial 4 with value: 2414.4818445410287.
[I 2024-02-28 02:33:12,093] Trial 38 finished with value: inf and parameters: {'model_name': 'GAIN', 'batch_size': 17, 'hint_rate': 0.33, 'alpha': 7, 'iterations': 72540}. Best is trial 4 with value: 2414.4818445410287.
[I 2024-02-28 02:36:34,556] Trial 167 finished with value: inf and parameters: {'model_name': 'GAIN', 'batch_size': 1, 'hint_rate': 0.01, 'alpha': 69, 'iterations': 76268}. Best is trial 4 with value: 2414.4818445410287.
[I 2024-02-28 02:36:50,516] Trial 121 finished with value: inf and parameters: {'model_name': 'GAIN', 'batch_size': 1, 'hint_rate': 0.09999999999999999, 'alpha': 94, 'iterations': 78111}. Best is trial 4 with value: 2414.4818445410287.
[I 2024-02-28 02:37:14,892] Trial 123 finished with value: inf and parameters: {'model_name': 'GAIN', 'batch_size': 1, 'hint_rate': 0.08, 'alpha': 99, 'iterations': 81214}. Best is trial 4 with value: 2414.4818445410287.
[I 2024-02-28 02:37:25,367] Trial 117 finished with value: inf and parameters: {'model_name': 'GAIN', 'batch_size': 1, 'hint_rate': 0.01, 'alpha': 94, 'iterations': 80613}. Best is trial 4 with value: 2414.4818445410287.
[I 2024-02-28 02:39:11,604] Trial 127 finished with value: inf and parameters: {'model_name': 'GAIN', 'batch_size': 1, 'hint_rate': 0.03, 'alpha': 99, 'iterations': 85009}. Best is trial 4 with value: 2414.4818445410287.
[I 2024-02-28 02:39:50,361] Trial 125 finished with value: inf and parameters: {'model_name': 'GAIN', 'batch_size': 1, 'hint_rate': 0.05, 'alpha': 99, 'iterations': 43484}. Best is trial 4 with value: 2414.4818445410287.
[I 2024-02-28 02:39:57,761] Trial 126 finished with value: inf and parameters: {'model_name': 'GAIN', 'batch_size': 1, 'hint_rate': 0.09999999999999999, 'alpha': 99, 'iterations': 86483}. Best is trial 4 with value: 2414.4818445410287.
