[I 2023-12-12 15:26:45,567] Trial 120 finished with value: 230.9308254977362 and parameters: {'model_name': 'SimpleImputer', 'strategy': 'mean'}. Best is trial 1 with value: 230.9308254977362.
[I 2023-12-12 15:26:45,796] Trial 84 finished with value: 273.584196709168 and parameters: {'model_name': 'SimpleImputer', 'strategy': 'most_frequent'}. Best is trial 1 with value: 230.9308254977362.
[I 2023-12-12 15:26:46,030] Trial 79 finished with value: 273.584196709168 and parameters: {'model_name': 'SimpleImputer', 'strategy': 'most_frequent'}. Best is trial 1 with value: 230.9308254977362.
[I 2023-12-12 15:26:46,281] Trial 81 finished with value: 273.584196709168 and parameters: {'model_name': 'SimpleImputer', 'strategy': 'most_frequent'}. Best is trial 1 with value: 230.9308254977362.
[I 2023-12-12 15:26:46,493] Trial 91 finished with value: 273.584196709168 and parameters: {'model_name': 'SimpleImputer', 'strategy': 'most_frequent'}. Best is trial 1 with value: 230.9308254977362.
[I 2023-12-12 15:26:46,690] Trial 116 finished with value: 230.9308254977362 and parameters: {'model_name': 'SimpleImputer', 'strategy': 'mean'}. Best is trial 1 with value: 230.9308254977362.
[I 2023-12-12 15:26:46,936] Trial 123 finished with value: 230.9308254977362 and parameters: {'model_name': 'SimpleImputer', 'strategy': 'mean'}. Best is trial 1 with value: 230.9308254977362.
[I 2023-12-12 15:26:47,190] Trial 124 finished with value: 230.9308254977362 and parameters: {'model_name': 'SimpleImputer', 'strategy': 'mean'}. Best is trial 1 with value: 230.9308254977362.
[I 2023-12-12 15:26:47,417] Trial 78 finished with value: 273.584196709168 and parameters: {'model_name': 'SimpleImputer', 'strategy': 'most_frequent'}. Best is trial 1 with value: 230.9308254977362.
[I 2023-12-12 15:26:47,648] Trial 89 finished with value: 273.584196709168 and parameters: {'model_name': 'SimpleImputer', 'strategy': 'most_frequent'}. Best is trial 1 with value: 230.9308254977362.
[I 2023-12-12 15:26:47,904] Trial 94 finished with value: 273.584196709168 and parameters: {'model_name': 'SimpleImputer', 'strategy': 'most_frequent'}. Best is trial 1 with value: 230.9308254977362.
[I 2023-12-12 15:26:48,210] Trial 128 finished with value: 230.9308254977362 and parameters: {'model_name': 'SimpleImputer', 'strategy': 'mean'}. Best is trial 1 with value: 230.9308254977362.
[I 2023-12-12 15:26:48,403] Trial 121 finished with value: 230.9308254977362 and parameters: {'model_name': 'SimpleImputer', 'strategy': 'mean'}. Best is trial 1 with value: 230.9308254977362.
[I 2023-12-12 15:26:48,644] Trial 122 finished with value: 230.9308254977362 and parameters: {'model_name': 'SimpleImputer', 'strategy': 'mean'}. Best is trial 1 with value: 230.9308254977362.
[I 2023-12-12 15:26:48,858] Trial 125 finished with value: 230.9308254977362 and parameters: {'model_name': 'SimpleImputer', 'strategy': 'mean'}. Best is trial 1 with value: 230.9308254977362.
[I 2023-12-12 15:26:49,314] Trial 126 finished with value: 230.9308254977362 and parameters: {'model_name': 'SimpleImputer', 'strategy': 'mean'}. Best is trial 1 with value: 230.9308254977362.
[I 2023-12-12 15:26:49,623] Trial 88 finished with value: 273.584196709168 and parameters: {'model_name': 'SimpleImputer', 'strategy': 'most_frequent'}. Best is trial 1 with value: 230.9308254977362.
[I 2023-12-12 15:26:49,848] Trial 93 finished with value: 273.584196709168 and parameters: {'model_name': 'SimpleImputer', 'strategy': 'most_frequent'}. Best is trial 1 with value: 230.9308254977362.
[I 2023-12-12 15:26:50,072] Trial 130 finished with value: 230.9308254977362 and parameters: {'model_name': 'SimpleImputer', 'strategy': 'mean'}. Best is trial 1 with value: 230.9308254977362.
[I 2023-12-12 15:26:50,340] Trial 96 finished with value: 273.584196709168 and parameters: {'model_name': 'SimpleImputer', 'strategy': 'most_frequent'}. Best is trial 1 with value: 230.9308254977362.
[I 2023-12-12 15:26:50,600] Trial 127 finished with value: 230.9308254977362 and parameters: {'model_name': 'SimpleImputer', 'strategy': 'mean'}. Best is trial 1 with value: 230.9308254977362.
[I 2023-12-12 15:26:50,824] Trial 134 finished with value: 230.9308254977362 and parameters: {'model_name': 'SimpleImputer', 'strategy': 'mean'}. Best is trial 1 with value: 230.9308254977362.
[I 2023-12-12 15:26:51,072] Trial 136 finished with value: 230.9308254977362 and parameters: {'model_name': 'SimpleImputer', 'strategy': 'mean'}. Best is trial 1 with value: 230.9308254977362.
[I 2023-12-12 15:26:51,283] Trial 129 finished with value: 230.9308254977362 and parameters: {'model_name': 'SimpleImputer', 'strategy': 'mean'}. Best is trial 1 with value: 230.9308254977362.
[I 2023-12-12 15:26:51,698] Trial 132 finished with value: 230.9308254977362 and parameters: {'model_name': 'SimpleImputer', 'strategy': 'mean'}. Best is trial 1 with value: 230.9308254977362.
[I 2023-12-12 15:26:51,907] Trial 131 finished with value: 230.9308254977362 and parameters: {'model_name': 'SimpleImputer', 'strategy': 'mean'}. Best is trial 1 with value: 230.9308254977362.
[I 2023-12-12 15:26:52,153] Trial 138 finished with value: 230.9308254977362 and parameters: {'model_name': 'SimpleImputer', 'strategy': 'mean'}. Best is trial 1 with value: 230.9308254977362.
[I 2023-12-12 15:26:52,456] Trial 133 finished with value: 230.9308254977362 and parameters: {'model_name': 'SimpleImputer', 'strategy': 'mean'}. Best is trial 1 with value: 230.9308254977362.
[I 2023-12-12 15:26:52,815] Trial 137 finished with value: 230.9308254977362 and parameters: {'model_name': 'SimpleImputer', 'strategy': 'mean'}. Best is trial 1 with value: 230.9308254977362.
[I 2023-12-12 15:26:53,029] Trial 95 finished with value: 273.584196709168 and parameters: {'model_name': 'SimpleImputer', 'strategy': 'most_frequent'}. Best is trial 1 with value: 230.9308254977362.
[I 2023-12-12 15:26:53,293] Trial 143 finished with value: 230.9308254977362 and parameters: {'model_name': 'SimpleImputer', 'strategy': 'mean'}. Best is trial 1 with value: 230.9308254977362.
[I 2023-12-12 15:26:53,501] Trial 139 finished with value: 230.9308254977362 and parameters: {'model_name': 'SimpleImputer', 'strategy': 'mean'}. Best is trial 1 with value: 230.9308254977362.
[I 2023-12-12 15:26:53,760] Trial 142 finished with value: 230.9308254977362 and parameters: {'model_name': 'SimpleImputer', 'strategy': 'mean'}. Best is trial 1 with value: 230.9308254977362.
[I 2023-12-12 15:26:53,952] Trial 135 finished with value: 230.9308254977362 and parameters: {'model_name': 'SimpleImputer', 'strategy': 'mean'}. Best is trial 1 with value: 230.9308254977362.
[I 2023-12-12 15:26:54,238] Trial 141 finished with value: 230.9308254977362 and parameters: {'model_name': 'SimpleImputer', 'strategy': 'mean'}. Best is trial 1 with value: 230.9308254977362.
[I 2023-12-12 15:26:54,457] Trial 150 finished with value: 230.9308254977362 and parameters: {'model_name': 'SimpleImputer', 'strategy': 'mean'}. Best is trial 1 with value: 230.9308254977362.
[I 2023-12-12 15:26:54,736] Trial 101 finished with value: 273.584196709168 and parameters: {'model_name': 'SimpleImputer', 'strategy': 'most_frequent'}. Best is trial 1 with value: 230.9308254977362.
[I 2023-12-12 15:26:54,936] Trial 100 finished with value: 273.584196709168 and parameters: {'model_name': 'SimpleImputer', 'strategy': 'most_frequent'}. Best is trial 1 with value: 230.9308254977362.
[I 2023-12-12 15:26:55,165] Trial 144 finished with value: 230.9308254977362 and parameters: {'model_name': 'SimpleImputer', 'strategy': 'mean'}. Best is trial 1 with value: 230.9308254977362.
[I 2023-12-12 15:26:55,398] Trial 153 finished with value: 230.9308254977362 and parameters: {'model_name': 'SimpleImputer', 'strategy': 'mean'}. Best is trial 1 with value: 230.9308254977362.
[I 2023-12-12 15:26:55,712] Trial 147 finished with value: 230.9308254977362 and parameters: {'model_name': 'SimpleImputer', 'strategy': 'mean'}. Best is trial 1 with value: 230.9308254977362.
[I 2023-12-12 15:26:55,978] Trial 146 finished with value: 230.9308254977362 and parameters: {'model_name': 'SimpleImputer', 'strategy': 'mean'}. Best is trial 1 with value: 230.9308254977362.
[I 2023-12-12 15:26:56,208] Trial 97 finished with value: 273.584196709168 and parameters: {'model_name': 'SimpleImputer', 'strategy': 'most_frequent'}. Best is trial 1 with value: 230.9308254977362.
[I 2023-12-12 15:26:56,464] Trial 151 finished with value: 230.9308254977362 and parameters: {'model_name': 'SimpleImputer', 'strategy': 'mean'}. Best is trial 1 with value: 230.9308254977362.
[I 2023-12-12 15:26:56,802] Trial 155 finished with value: 230.9308254977362 and parameters: {'model_name': 'SimpleImputer', 'strategy': 'mean'}. Best is trial 1 with value: 230.9308254977362.
[I 2023-12-12 15:26:57,012] Trial 149 finished with value: 230.9308254977362 and parameters: {'model_name': 'SimpleImputer', 'strategy': 'mean'}. Best is trial 1 with value: 230.9308254977362.
[I 2023-12-12 15:26:57,223] Trial 140 finished with value: 230.9308254977362 and parameters: {'model_name': 'SimpleImputer', 'strategy': 'mean'}. Best is trial 1 with value: 230.9308254977362.
[I 2023-12-12 15:26:57,508] Trial 99 finished with value: 273.584196709168 and parameters: {'model_name': 'SimpleImputer', 'strategy': 'most_frequent'}. Best is trial 1 with value: 230.9308254977362.
[I 2023-12-12 15:26:57,754] Trial 152 finished with value: 230.9308254977362 and parameters: {'model_name': 'SimpleImputer', 'strategy': 'mean'}. Best is trial 1 with value: 230.9308254977362.
[I 2023-12-12 15:26:58,025] Trial 145 finished with value: 230.9308254977362 and parameters: {'model_name': 'SimpleImputer', 'strategy': 'mean'}. Best is trial 1 with value: 230.9308254977362.
[I 2023-12-12 15:26:58,239] Trial 148 finished with value: 230.9308254977362 and parameters: {'model_name': 'SimpleImputer', 'strategy': 'mean'}. Best is trial 1 with value: 230.9308254977362.
[I 2023-12-12 15:26:58,602] Trial 104 finished with value: 273.584196709168 and parameters: {'model_name': 'SimpleImputer', 'strategy': 'most_frequent'}. Best is trial 1 with value: 230.9308254977362.
[I 2023-12-12 15:26:58,827] Trial 98 finished with value: 273.584196709168 and parameters: {'model_name': 'SimpleImputer', 'strategy': 'most_frequent'}. Best is trial 1 with value: 230.9308254977362.
[I 2023-12-12 15:26:59,062] Trial 154 finished with value: 230.9308254977362 and parameters: {'model_name': 'SimpleImputer', 'strategy': 'mean'}. Best is trial 1 with value: 230.9308254977362.
[I 2023-12-12 15:26:59,337] Trial 160 finished with value: 230.9308254977362 and parameters: {'model_name': 'SimpleImputer', 'strategy': 'mean'}. Best is trial 1 with value: 230.9308254977362.
[I 2023-12-12 15:26:59,615] Trial 157 finished with value: 230.9308254977362 and parameters: {'model_name': 'SimpleImputer', 'strategy': 'mean'}. Best is trial 1 with value: 230.9308254977362.
[I 2023-12-12 15:26:59,874] Trial 156 finished with value: 230.9308254977362 and parameters: {'model_name': 'SimpleImputer', 'strategy': 'mean'}. Best is trial 1 with value: 230.9308254977362.
[I 2023-12-12 15:27:00,118] Trial 163 finished with value: 230.9308254977362 and parameters: {'model_name': 'SimpleImputer', 'strategy': 'mean'}. Best is trial 1 with value: 230.9308254977362.
[I 2023-12-12 15:27:00,319] Trial 159 finished with value: 230.9308254977362 and parameters: {'model_name': 'SimpleImputer', 'strategy': 'mean'}. Best is trial 1 with value: 230.9308254977362.
[I 2023-12-12 15:27:00,715] Trial 176 finished with value: 275.1181796808113 and parameters: {'model_name': 'SimpleImputer', 'strategy': 'constant'}. Best is trial 1 with value: 230.9308254977362.
[I 2023-12-12 15:27:01,047] Trial 165 finished with value: 230.9308254977362 and parameters: {'model_name': 'SimpleImputer', 'strategy': 'mean'}. Best is trial 1 with value: 230.9308254977362.
[I 2023-12-12 15:27:01,216] Trial 102 finished with value: 273.584196709168 and parameters: {'model_name': 'SimpleImputer', 'strategy': 'most_frequent'}. Best is trial 1 with value: 230.9308254977362.
[I 2023-12-12 15:27:01,502] Trial 158 finished with value: 230.9308254977362 and parameters: {'model_name': 'SimpleImputer', 'strategy': 'mean'}. Best is trial 1 with value: 230.9308254977362.
[I 2023-12-12 15:27:01,678] Trial 161 finished with value: 230.9308254977362 and parameters: {'model_name': 'SimpleImputer', 'strategy': 'mean'}. Best is trial 1 with value: 230.9308254977362.
[I 2023-12-12 15:27:01,836] Trial 103 finished with value: 273.584196709168 and parameters: {'model_name': 'SimpleImputer', 'strategy': 'most_frequent'}. Best is trial 1 with value: 230.9308254977362.
[I 2023-12-12 15:27:02,149] Trial 164 finished with value: 230.9308254977362 and parameters: {'model_name': 'SimpleImputer', 'strategy': 'mean'}. Best is trial 1 with value: 230.9308254977362.
[I 2023-12-12 15:27:02,319] Trial 170 finished with value: 230.9308254977362 and parameters: {'model_name': 'SimpleImputer', 'strategy': 'mean'}. Best is trial 1 with value: 230.9308254977362.
[I 2023-12-12 15:27:02,572] Trial 180 finished with value: 275.1181796808113 and parameters: {'model_name': 'SimpleImputer', 'strategy': 'constant'}. Best is trial 1 with value: 230.9308254977362.
[I 2023-12-12 15:27:02,913] Trial 172 finished with value: 230.9308254977362 and parameters: {'model_name': 'SimpleImputer', 'strategy': 'mean'}. Best is trial 1 with value: 230.9308254977362.
[I 2023-12-12 15:27:03,148] Trial 177 finished with value: 275.1181796808113 and parameters: {'model_name': 'SimpleImputer', 'strategy': 'constant'}. Best is trial 1 with value: 230.9308254977362.
[I 2023-12-12 15:27:03,388] Trial 105 finished with value: 273.584196709168 and parameters: {'model_name': 'SimpleImputer', 'strategy': 'most_frequent'}. Best is trial 1 with value: 230.9308254977362.
[I 2023-12-12 15:27:03,562] Trial 169 finished with value: 230.9308254977362 and parameters: {'model_name': 'SimpleImputer', 'strategy': 'mean'}. Best is trial 1 with value: 230.9308254977362.
[I 2023-12-12 15:27:03,828] Trial 189 finished with value: 275.1181796808113 and parameters: {'model_name': 'SimpleImputer', 'strategy': 'constant'}. Best is trial 1 with value: 230.9308254977362.
[I 2023-12-12 15:27:04,087] Trial 167 finished with value: 230.9308254977362 and parameters: {'model_name': 'SimpleImputer', 'strategy': 'mean'}. Best is trial 1 with value: 230.9308254977362.
[I 2023-12-12 15:27:04,259] Trial 168 finished with value: 230.9308254977362 and parameters: {'model_name': 'SimpleImputer', 'strategy': 'mean'}. Best is trial 1 with value: 230.9308254977362.
[I 2023-12-12 15:27:04,420] Trial 175 finished with value: 275.1181796808113 and parameters: {'model_name': 'SimpleImputer', 'strategy': 'constant'}. Best is trial 1 with value: 230.9308254977362.
[I 2023-12-12 15:27:04,571] Trial 173 finished with value: 230.9308254977362 and parameters: {'model_name': 'SimpleImputer', 'strategy': 'mean'}. Best is trial 1 with value: 230.9308254977362.
[I 2023-12-12 15:27:04,831] Trial 182 finished with value: 275.1181796808113 and parameters: {'model_name': 'SimpleImputer', 'strategy': 'constant'}. Best is trial 1 with value: 230.9308254977362.
[I 2023-12-12 15:27:05,039] Trial 166 finished with value: 230.9308254977362 and parameters: {'model_name': 'SimpleImputer', 'strategy': 'mean'}. Best is trial 1 with value: 230.9308254977362.
[I 2023-12-12 15:27:05,354] Trial 162 finished with value: 230.9308254977362 and parameters: {'model_name': 'SimpleImputer', 'strategy': 'mean'}. Best is trial 1 with value: 230.9308254977362.
[I 2023-12-12 15:27:05,575] Trial 171 finished with value: 230.9308254977362 and parameters: {'model_name': 'SimpleImputer', 'strategy': 'mean'}. Best is trial 1 with value: 230.9308254977362.
[I 2023-12-12 15:27:05,765] Trial 193 finished with value: 275.1181796808113 and parameters: {'model_name': 'SimpleImputer', 'strategy': 'constant'}. Best is trial 1 with value: 230.9308254977362.
[I 2023-12-12 15:27:05,918] Trial 183 finished with value: 275.1181796808113 and parameters: {'model_name': 'SimpleImputer', 'strategy': 'constant'}. Best is trial 1 with value: 230.9308254977362.
[I 2023-12-12 15:27:06,115] Trial 192 finished with value: 275.1181796808113 and parameters: {'model_name': 'SimpleImputer', 'strategy': 'constant'}. Best is trial 1 with value: 230.9308254977362.
[I 2023-12-12 15:27:06,386] Trial 185 finished with value: 275.1181796808113 and parameters: {'model_name': 'SimpleImputer', 'strategy': 'constant'}. Best is trial 1 with value: 230.9308254977362.
[I 2023-12-12 15:27:06,578] Trial 191 finished with value: 275.1181796808113 and parameters: {'model_name': 'SimpleImputer', 'strategy': 'constant'}. Best is trial 1 with value: 230.9308254977362.
[I 2023-12-12 15:27:06,829] Trial 199 finished with value: 275.1181796808113 and parameters: {'model_name': 'SimpleImputer', 'strategy': 'constant'}. Best is trial 1 with value: 230.9308254977362.
[I 2023-12-12 15:27:07,000] Trial 195 finished with value: 275.1181796808113 and parameters: {'model_name': 'SimpleImputer', 'strategy': 'constant'}. Best is trial 1 with value: 230.9308254977362.
[I 2023-12-12 15:27:07,176] Trial 190 finished with value: 275.1181796808113 and parameters: {'model_name': 'SimpleImputer', 'strategy': 'constant'}. Best is trial 1 with value: 230.9308254977362.
[I 2023-12-12 15:27:07,427] Trial 188 finished with value: 275.1181796808113 and parameters: {'model_name': 'SimpleImputer', 'strategy': 'constant'}. Best is trial 1 with value: 230.9308254977362.
[I 2023-12-12 15:27:07,608] Trial 181 finished with value: 275.1181796808113 and parameters: {'model_name': 'SimpleImputer', 'strategy': 'constant'}. Best is trial 1 with value: 230.9308254977362.
[I 2023-12-12 15:27:07,770] Trial 178 finished with value: 230.9308254977362 and parameters: {'model_name': 'SimpleImputer', 'strategy': 'mean'}. Best is trial 1 with value: 230.9308254977362.
[I 2023-12-12 15:27:08,010] Trial 186 finished with value: 275.1181796808113 and parameters: {'model_name': 'SimpleImputer', 'strategy': 'constant'}. Best is trial 1 with value: 230.9308254977362.
[I 2023-12-12 15:27:08,177] Trial 194 finished with value: 275.1181796808113 and parameters: {'model_name': 'SimpleImputer', 'strategy': 'constant'}. Best is trial 1 with value: 230.9308254977362.
[I 2023-12-12 15:27:08,361] Trial 184 finished with value: 275.1181796808113 and parameters: {'model_name': 'SimpleImputer', 'strategy': 'constant'}. Best is trial 1 with value: 230.9308254977362.
[I 2023-12-12 15:27:08,525] Trial 174 finished with value: 230.9308254977362 and parameters: {'model_name': 'SimpleImputer', 'strategy': 'mean'}. Best is trial 1 with value: 230.9308254977362.
[I 2023-12-12 15:27:08,773] Trial 198 finished with value: 275.1181796808113 and parameters: {'model_name': 'SimpleImputer', 'strategy': 'constant'}. Best is trial 1 with value: 230.9308254977362.
[I 2023-12-12 15:27:08,939] Trial 197 finished with value: 275.1181796808113 and parameters: {'model_name': 'SimpleImputer', 'strategy': 'constant'}. Best is trial 1 with value: 230.9308254977362.
[I 2023-12-12 15:27:09,098] Trial 179 finished with value: 230.9308254977362 and parameters: {'model_name': 'SimpleImputer', 'strategy': 'mean'}. Best is trial 1 with value: 230.9308254977362.
[I 2023-12-12 15:27:09,255] Trial 196 finished with value: 275.1181796808113 and parameters: {'model_name': 'SimpleImputer', 'strategy': 'constant'}. Best is trial 1 with value: 230.9308254977362.
