[I 2024-04-02 07:53:52,898] Trial 94 finished with value: 6672.228128510523 and parameters: {'model_name': 'SimpleImputer', 'strategy': 'most_frequent'}. Best is trial 9 with value: 6388.823491131825.
[I 2024-04-02 07:53:53,227] Trial 92 finished with value: 6672.228128510523 and parameters: {'model_name': 'SimpleImputer', 'strategy': 'most_frequent'}. Best is trial 9 with value: 6388.823491131825.
[I 2024-04-02 07:53:53,485] Trial 93 finished with value: 6672.228128510523 and parameters: {'model_name': 'SimpleImputer', 'strategy': 'most_frequent'}. Best is trial 9 with value: 6388.823491131825.
[I 2024-04-02 07:53:53,793] Trial 117 finished with value: 6388.823491131825 and parameters: {'model_name': 'SimpleImputer', 'strategy': 'mean'}. Best is trial 9 with value: 6388.823491131825.
[I 2024-04-02 07:53:54,072] Trial 89 finished with value: 6672.228128510523 and parameters: {'model_name': 'SimpleImputer', 'strategy': 'most_frequent'}. Best is trial 9 with value: 6388.823491131825.
[I 2024-04-02 07:53:54,295] Trial 87 finished with value: 6672.228128510523 and parameters: {'model_name': 'SimpleImputer', 'strategy': 'most_frequent'}. Best is trial 9 with value: 6388.823491131825.
[I 2024-04-02 07:53:54,512] Trial 96 finished with value: 6672.228128510523 and parameters: {'model_name': 'SimpleImputer', 'strategy': 'most_frequent'}. Best is trial 9 with value: 6388.823491131825.
[I 2024-04-02 07:53:54,745] Trial 84 finished with value: 6672.228128510523 and parameters: {'model_name': 'SimpleImputer', 'strategy': 'most_frequent'}. Best is trial 9 with value: 6388.823491131825.
[I 2024-04-02 07:53:55,016] Trial 85 finished with value: 6672.228128510523 and parameters: {'model_name': 'SimpleImputer', 'strategy': 'most_frequent'}. Best is trial 9 with value: 6388.823491131825.
[I 2024-04-02 07:53:55,246] Trial 118 finished with value: 6388.823491131825 and parameters: {'model_name': 'SimpleImputer', 'strategy': 'mean'}. Best is trial 9 with value: 6388.823491131825.
[I 2024-04-02 07:53:55,448] Trial 100 finished with value: 6672.228128510523 and parameters: {'model_name': 'SimpleImputer', 'strategy': 'most_frequent'}. Best is trial 9 with value: 6388.823491131825.
[I 2024-04-02 07:53:55,718] Trial 90 finished with value: 6672.228128510523 and parameters: {'model_name': 'SimpleImputer', 'strategy': 'most_frequent'}. Best is trial 9 with value: 6388.823491131825.
[I 2024-04-02 07:53:56,055] Trial 120 finished with value: 6388.823491131825 and parameters: {'model_name': 'SimpleImputer', 'strategy': 'mean'}. Best is trial 9 with value: 6388.823491131825.
[I 2024-04-02 07:53:56,352] Trial 122 finished with value: 6388.823491131825 and parameters: {'model_name': 'SimpleImputer', 'strategy': 'mean'}. Best is trial 9 with value: 6388.823491131825.
[I 2024-04-02 07:53:56,620] Trial 97 finished with value: 6672.228128510523 and parameters: {'model_name': 'SimpleImputer', 'strategy': 'most_frequent'}. Best is trial 9 with value: 6388.823491131825.
[I 2024-04-02 07:53:56,864] Trial 125 finished with value: 6388.823491131825 and parameters: {'model_name': 'SimpleImputer', 'strategy': 'mean'}. Best is trial 9 with value: 6388.823491131825.
[I 2024-04-02 07:53:57,094] Trial 119 finished with value: 6388.823491131825 and parameters: {'model_name': 'SimpleImputer', 'strategy': 'mean'}. Best is trial 9 with value: 6388.823491131825.
[I 2024-04-02 07:53:57,521] Trial 121 finished with value: 6388.823491131825 and parameters: {'model_name': 'SimpleImputer', 'strategy': 'mean'}. Best is trial 9 with value: 6388.823491131825.
[I 2024-04-02 07:53:57,741] Trial 124 finished with value: 6388.823491131825 and parameters: {'model_name': 'SimpleImputer', 'strategy': 'mean'}. Best is trial 9 with value: 6388.823491131825.
[I 2024-04-02 07:53:58,085] Trial 98 finished with value: 6672.228128510523 and parameters: {'model_name': 'SimpleImputer', 'strategy': 'most_frequent'}. Best is trial 9 with value: 6388.823491131825.
[I 2024-04-02 07:53:58,388] Trial 123 finished with value: 6388.823491131825 and parameters: {'model_name': 'SimpleImputer', 'strategy': 'mean'}. Best is trial 9 with value: 6388.823491131825.
[I 2024-04-02 07:53:58,688] Trial 91 finished with value: 6672.228128510523 and parameters: {'model_name': 'SimpleImputer', 'strategy': 'most_frequent'}. Best is trial 9 with value: 6388.823491131825.
[I 2024-04-02 07:53:58,972] Trial 128 finished with value: 6388.823491131825 and parameters: {'model_name': 'SimpleImputer', 'strategy': 'mean'}. Best is trial 9 with value: 6388.823491131825.
[I 2024-04-02 07:53:59,197] Trial 126 finished with value: 6388.823491131825 and parameters: {'model_name': 'SimpleImputer', 'strategy': 'mean'}. Best is trial 9 with value: 6388.823491131825.
[I 2024-04-02 07:53:59,421] Trial 127 finished with value: 6388.823491131825 and parameters: {'model_name': 'SimpleImputer', 'strategy': 'mean'}. Best is trial 9 with value: 6388.823491131825.
[I 2024-04-02 07:53:59,759] Trial 132 finished with value: 6388.823491131825 and parameters: {'model_name': 'SimpleImputer', 'strategy': 'mean'}. Best is trial 9 with value: 6388.823491131825.
[I 2024-04-02 07:53:59,985] Trial 129 finished with value: 6388.823491131825 and parameters: {'model_name': 'SimpleImputer', 'strategy': 'mean'}. Best is trial 9 with value: 6388.823491131825.
[I 2024-04-02 07:54:00,282] Trial 137 finished with value: 6388.823491131825 and parameters: {'model_name': 'SimpleImputer', 'strategy': 'mean'}. Best is trial 9 with value: 6388.823491131825.
[I 2024-04-02 07:54:00,512] Trial 134 finished with value: 6388.823491131825 and parameters: {'model_name': 'SimpleImputer', 'strategy': 'mean'}. Best is trial 9 with value: 6388.823491131825.
[I 2024-04-02 07:54:00,786] Trial 130 finished with value: 6388.823491131825 and parameters: {'model_name': 'SimpleImputer', 'strategy': 'mean'}. Best is trial 9 with value: 6388.823491131825.
[I 2024-04-02 07:54:01,039] Trial 131 finished with value: 6388.823491131825 and parameters: {'model_name': 'SimpleImputer', 'strategy': 'mean'}. Best is trial 9 with value: 6388.823491131825.
[I 2024-04-02 07:54:01,299] Trial 81 finished with value: 6672.228128510523 and parameters: {'model_name': 'SimpleImputer', 'strategy': 'most_frequent'}. Best is trial 9 with value: 6388.823491131825.
[I 2024-04-02 07:54:01,756] Trial 136 finished with value: 6388.823491131825 and parameters: {'model_name': 'SimpleImputer', 'strategy': 'mean'}. Best is trial 9 with value: 6388.823491131825.
[I 2024-04-02 07:54:02,043] Trial 133 finished with value: 6388.823491131825 and parameters: {'model_name': 'SimpleImputer', 'strategy': 'mean'}. Best is trial 9 with value: 6388.823491131825.
[I 2024-04-02 07:54:02,320] Trial 88 finished with value: 6672.228128510523 and parameters: {'model_name': 'SimpleImputer', 'strategy': 'most_frequent'}. Best is trial 9 with value: 6388.823491131825.
[I 2024-04-02 07:54:02,530] Trial 138 finished with value: 6388.823491131825 and parameters: {'model_name': 'SimpleImputer', 'strategy': 'mean'}. Best is trial 9 with value: 6388.823491131825.
[I 2024-04-02 07:54:02,955] Trial 135 finished with value: 6388.823491131825 and parameters: {'model_name': 'SimpleImputer', 'strategy': 'mean'}. Best is trial 9 with value: 6388.823491131825.
[I 2024-04-02 07:54:03,295] Trial 143 finished with value: 6388.823491131825 and parameters: {'model_name': 'SimpleImputer', 'strategy': 'mean'}. Best is trial 9 with value: 6388.823491131825.
[I 2024-04-02 07:54:03,560] Trial 102 finished with value: 6672.228128510523 and parameters: {'model_name': 'SimpleImputer', 'strategy': 'most_frequent'}. Best is trial 9 with value: 6388.823491131825.
[I 2024-04-02 07:54:03,756] Trial 99 finished with value: 6672.228128510523 and parameters: {'model_name': 'SimpleImputer', 'strategy': 'most_frequent'}. Best is trial 9 with value: 6388.823491131825.
[I 2024-04-02 07:54:04,021] Trial 140 finished with value: 6388.823491131825 and parameters: {'model_name': 'SimpleImputer', 'strategy': 'mean'}. Best is trial 9 with value: 6388.823491131825.
[I 2024-04-02 07:54:04,305] Trial 142 finished with value: 6388.823491131825 and parameters: {'model_name': 'SimpleImputer', 'strategy': 'mean'}. Best is trial 9 with value: 6388.823491131825.
[I 2024-04-02 07:54:04,580] Trial 141 finished with value: 6388.823491131825 and parameters: {'model_name': 'SimpleImputer', 'strategy': 'mean'}. Best is trial 9 with value: 6388.823491131825.
[I 2024-04-02 07:54:04,799] Trial 139 finished with value: 6388.823491131825 and parameters: {'model_name': 'SimpleImputer', 'strategy': 'mean'}. Best is trial 9 with value: 6388.823491131825.
[I 2024-04-02 07:54:05,060] Trial 152 finished with value: 6388.823491131825 and parameters: {'model_name': 'SimpleImputer', 'strategy': 'mean'}. Best is trial 9 with value: 6388.823491131825.
[I 2024-04-02 07:54:05,342] Trial 144 finished with value: 6388.823491131825 and parameters: {'model_name': 'SimpleImputer', 'strategy': 'mean'}. Best is trial 9 with value: 6388.823491131825.
[I 2024-04-02 07:54:05,659] Trial 145 finished with value: 6388.823491131825 and parameters: {'model_name': 'SimpleImputer', 'strategy': 'mean'}. Best is trial 9 with value: 6388.823491131825.
[I 2024-04-02 07:54:05,955] Trial 146 finished with value: 6388.823491131825 and parameters: {'model_name': 'SimpleImputer', 'strategy': 'mean'}. Best is trial 9 with value: 6388.823491131825.
[I 2024-04-02 07:54:06,261] Trial 149 finished with value: 6388.823491131825 and parameters: {'model_name': 'SimpleImputer', 'strategy': 'mean'}. Best is trial 9 with value: 6388.823491131825.
[I 2024-04-02 07:54:06,561] Trial 148 finished with value: 6388.823491131825 and parameters: {'model_name': 'SimpleImputer', 'strategy': 'mean'}. Best is trial 9 with value: 6388.823491131825.
[I 2024-04-02 07:54:06,826] Trial 151 finished with value: 6388.823491131825 and parameters: {'model_name': 'SimpleImputer', 'strategy': 'mean'}. Best is trial 9 with value: 6388.823491131825.
[I 2024-04-02 07:54:07,007] Trial 147 finished with value: 6388.823491131825 and parameters: {'model_name': 'SimpleImputer', 'strategy': 'mean'}. Best is trial 9 with value: 6388.823491131825.
[I 2024-04-02 07:54:07,192] Trial 154 finished with value: 6388.823491131825 and parameters: {'model_name': 'SimpleImputer', 'strategy': 'mean'}. Best is trial 9 with value: 6388.823491131825.
[I 2024-04-02 07:54:07,395] Trial 106 finished with value: 6672.228128510523 and parameters: {'model_name': 'SimpleImputer', 'strategy': 'most_frequent'}. Best is trial 9 with value: 6388.823491131825.
[I 2024-04-02 07:54:07,701] Trial 101 finished with value: 6672.228128510523 and parameters: {'model_name': 'SimpleImputer', 'strategy': 'most_frequent'}. Best is trial 9 with value: 6388.823491131825.
[I 2024-04-02 07:54:07,944] Trial 150 finished with value: 6388.823491131825 and parameters: {'model_name': 'SimpleImputer', 'strategy': 'mean'}. Best is trial 9 with value: 6388.823491131825.
[I 2024-04-02 07:54:08,156] Trial 103 finished with value: 6672.228128510523 and parameters: {'model_name': 'SimpleImputer', 'strategy': 'most_frequent'}. Best is trial 9 with value: 6388.823491131825.
[I 2024-04-02 07:54:08,477] Trial 158 finished with value: 6388.823491131825 and parameters: {'model_name': 'SimpleImputer', 'strategy': 'mean'}. Best is trial 9 with value: 6388.823491131825.
[I 2024-04-02 07:54:08,676] Trial 153 finished with value: 6388.823491131825 and parameters: {'model_name': 'SimpleImputer', 'strategy': 'mean'}. Best is trial 9 with value: 6388.823491131825.
[I 2024-04-02 07:54:08,861] Trial 156 finished with value: 6388.823491131825 and parameters: {'model_name': 'SimpleImputer', 'strategy': 'mean'}. Best is trial 9 with value: 6388.823491131825.
[I 2024-04-02 07:54:09,062] Trial 155 finished with value: 6388.823491131825 and parameters: {'model_name': 'SimpleImputer', 'strategy': 'mean'}. Best is trial 9 with value: 6388.823491131825.
[I 2024-04-02 07:54:09,257] Trial 160 finished with value: 6388.823491131825 and parameters: {'model_name': 'SimpleImputer', 'strategy': 'mean'}. Best is trial 9 with value: 6388.823491131825.
[I 2024-04-02 07:54:09,622] Trial 157 finished with value: 6388.823491131825 and parameters: {'model_name': 'SimpleImputer', 'strategy': 'mean'}. Best is trial 9 with value: 6388.823491131825.
[I 2024-04-02 07:54:09,892] Trial 105 finished with value: 6672.228128510523 and parameters: {'model_name': 'SimpleImputer', 'strategy': 'most_frequent'}. Best is trial 9 with value: 6388.823491131825.
[I 2024-04-02 07:54:10,140] Trial 169 finished with value: 6388.823491131825 and parameters: {'model_name': 'SimpleImputer', 'strategy': 'mean'}. Best is trial 9 with value: 6388.823491131825.
[I 2024-04-02 07:54:10,389] Trial 162 finished with value: 6388.823491131825 and parameters: {'model_name': 'SimpleImputer', 'strategy': 'mean'}. Best is trial 9 with value: 6388.823491131825.
[I 2024-04-02 07:54:10,640] Trial 166 finished with value: 6388.823491131825 and parameters: {'model_name': 'SimpleImputer', 'strategy': 'mean'}. Best is trial 9 with value: 6388.823491131825.
[I 2024-04-02 07:54:10,898] Trial 161 finished with value: 6388.823491131825 and parameters: {'model_name': 'SimpleImputer', 'strategy': 'mean'}. Best is trial 9 with value: 6388.823491131825.
[I 2024-04-02 07:54:11,250] Trial 159 finished with value: 6388.823491131825 and parameters: {'model_name': 'SimpleImputer', 'strategy': 'mean'}. Best is trial 9 with value: 6388.823491131825.
[I 2024-04-02 07:54:11,483] Trial 171 finished with value: 6388.823491131825 and parameters: {'model_name': 'SimpleImputer', 'strategy': 'mean'}. Best is trial 9 with value: 6388.823491131825.
[I 2024-04-02 07:54:11,742] Trial 163 finished with value: 6388.823491131825 and parameters: {'model_name': 'SimpleImputer', 'strategy': 'mean'}. Best is trial 9 with value: 6388.823491131825.
[I 2024-04-02 07:54:12,106] Trial 165 finished with value: 6388.823491131825 and parameters: {'model_name': 'SimpleImputer', 'strategy': 'mean'}. Best is trial 9 with value: 6388.823491131825.
[I 2024-04-02 07:54:12,443] Trial 168 finished with value: 6388.823491131825 and parameters: {'model_name': 'SimpleImputer', 'strategy': 'mean'}. Best is trial 9 with value: 6388.823491131825.
[I 2024-04-02 07:54:12,642] Trial 170 finished with value: 6388.823491131825 and parameters: {'model_name': 'SimpleImputer', 'strategy': 'mean'}. Best is trial 9 with value: 6388.823491131825.
[I 2024-04-02 07:54:12,962] Trial 164 finished with value: 6388.823491131825 and parameters: {'model_name': 'SimpleImputer', 'strategy': 'mean'}. Best is trial 9 with value: 6388.823491131825.
[I 2024-04-02 07:54:13,211] Trial 175 finished with value: 6388.823491131825 and parameters: {'model_name': 'SimpleImputer', 'strategy': 'mean'}. Best is trial 9 with value: 6388.823491131825.
[I 2024-04-02 07:54:13,434] Trial 172 finished with value: 6388.823491131825 and parameters: {'model_name': 'SimpleImputer', 'strategy': 'mean'}. Best is trial 9 with value: 6388.823491131825.
[I 2024-04-02 07:54:13,611] Trial 174 finished with value: 6388.823491131825 and parameters: {'model_name': 'SimpleImputer', 'strategy': 'mean'}. Best is trial 9 with value: 6388.823491131825.
[I 2024-04-02 07:54:13,932] Trial 178 finished with value: 6388.823491131825 and parameters: {'model_name': 'SimpleImputer', 'strategy': 'mean'}. Best is trial 9 with value: 6388.823491131825.
[I 2024-04-02 07:54:14,188] Trial 176 finished with value: 6388.823491131825 and parameters: {'model_name': 'SimpleImputer', 'strategy': 'mean'}. Best is trial 9 with value: 6388.823491131825.
[I 2024-04-02 07:54:14,365] Trial 177 finished with value: 6388.823491131825 and parameters: {'model_name': 'SimpleImputer', 'strategy': 'mean'}. Best is trial 9 with value: 6388.823491131825.
[I 2024-04-02 07:54:14,607] Trial 186 finished with value: 6388.823491131825 and parameters: {'model_name': 'SimpleImputer', 'strategy': 'mean'}. Best is trial 9 with value: 6388.823491131825.
[I 2024-04-02 07:54:14,864] Trial 181 finished with value: 6388.823491131825 and parameters: {'model_name': 'SimpleImputer', 'strategy': 'mean'}. Best is trial 9 with value: 6388.823491131825.
[I 2024-04-02 07:54:15,042] Trial 167 finished with value: 6388.823491131825 and parameters: {'model_name': 'SimpleImputer', 'strategy': 'mean'}. Best is trial 9 with value: 6388.823491131825.
[I 2024-04-02 07:54:15,248] Trial 180 finished with value: 6388.823491131825 and parameters: {'model_name': 'SimpleImputer', 'strategy': 'mean'}. Best is trial 9 with value: 6388.823491131825.
[I 2024-04-02 07:54:15,421] Trial 173 finished with value: 6388.823491131825 and parameters: {'model_name': 'SimpleImputer', 'strategy': 'mean'}. Best is trial 9 with value: 6388.823491131825.
[I 2024-04-02 07:54:15,787] Trial 179 finished with value: 6388.823491131825 and parameters: {'model_name': 'SimpleImputer', 'strategy': 'mean'}. Best is trial 9 with value: 6388.823491131825.
[I 2024-04-02 07:54:16,056] Trial 182 finished with value: 6388.823491131825 and parameters: {'model_name': 'SimpleImputer', 'strategy': 'mean'}. Best is trial 9 with value: 6388.823491131825.
[I 2024-04-02 07:54:16,305] Trial 191 finished with value: 6388.823491131825 and parameters: {'model_name': 'SimpleImputer', 'strategy': 'mean'}. Best is trial 9 with value: 6388.823491131825.
[I 2024-04-02 07:54:16,562] Trial 183 finished with value: 6388.823491131825 and parameters: {'model_name': 'SimpleImputer', 'strategy': 'mean'}. Best is trial 9 with value: 6388.823491131825.
[I 2024-04-02 07:54:16,790] Trial 187 finished with value: 6388.823491131825 and parameters: {'model_name': 'SimpleImputer', 'strategy': 'mean'}. Best is trial 9 with value: 6388.823491131825.
[I 2024-04-02 07:54:16,963] Trial 188 finished with value: 6388.823491131825 and parameters: {'model_name': 'SimpleImputer', 'strategy': 'mean'}. Best is trial 9 with value: 6388.823491131825.
[I 2024-04-02 07:54:17,159] Trial 189 finished with value: 6388.823491131825 and parameters: {'model_name': 'SimpleImputer', 'strategy': 'mean'}. Best is trial 9 with value: 6388.823491131825.
[I 2024-04-02 07:54:17,384] Trial 184 finished with value: 6388.823491131825 and parameters: {'model_name': 'SimpleImputer', 'strategy': 'mean'}. Best is trial 9 with value: 6388.823491131825.
[I 2024-04-02 07:54:17,581] Trial 185 finished with value: 6388.823491131825 and parameters: {'model_name': 'SimpleImputer', 'strategy': 'mean'}. Best is trial 9 with value: 6388.823491131825.
[I 2024-04-02 07:54:17,800] Trial 195 finished with value: 6388.823491131825 and parameters: {'model_name': 'SimpleImputer', 'strategy': 'mean'}. Best is trial 9 with value: 6388.823491131825.
[I 2024-04-02 07:54:17,971] Trial 190 finished with value: 6388.823491131825 and parameters: {'model_name': 'SimpleImputer', 'strategy': 'mean'}. Best is trial 9 with value: 6388.823491131825.
[I 2024-04-02 07:54:18,219] Trial 198 finished with value: 6388.823491131825 and parameters: {'model_name': 'SimpleImputer', 'strategy': 'mean'}. Best is trial 9 with value: 6388.823491131825.
[I 2024-04-02 07:54:18,419] Trial 196 finished with value: 6388.823491131825 and parameters: {'model_name': 'SimpleImputer', 'strategy': 'mean'}. Best is trial 9 with value: 6388.823491131825.
[I 2024-04-02 07:54:18,586] Trial 194 finished with value: 6388.823491131825 and parameters: {'model_name': 'SimpleImputer', 'strategy': 'mean'}. Best is trial 9 with value: 6388.823491131825.
[I 2024-04-02 07:54:18,836] Trial 193 finished with value: 6388.823491131825 and parameters: {'model_name': 'SimpleImputer', 'strategy': 'mean'}. Best is trial 9 with value: 6388.823491131825.
[I 2024-04-02 07:54:19,016] Trial 199 finished with value: 6388.823491131825 and parameters: {'model_name': 'SimpleImputer', 'strategy': 'mean'}. Best is trial 9 with value: 6388.823491131825.
[I 2024-04-02 07:54:19,178] Trial 197 finished with value: 6388.823491131825 and parameters: {'model_name': 'SimpleImputer', 'strategy': 'mean'}. Best is trial 9 with value: 6388.823491131825.
[I 2024-04-02 07:54:19,337] Trial 192 finished with value: 6388.823491131825 and parameters: {'model_name': 'SimpleImputer', 'strategy': 'mean'}. Best is trial 9 with value: 6388.823491131825.
[I 2024-04-02 07:54:19,508] Trial 108 finished with value: 6672.228128510523 and parameters: {'model_name': 'SimpleImputer', 'strategy': 'most_frequent'}. Best is trial 9 with value: 6388.823491131825.
