Run: 9
/cm/local/apps/slurm/var/spool/job549357/slurm_script: line 23: /common/ketrong/minconda3/etc/profile.d/conda.sh: No such file or directory
/cm/local/apps/slurm/var/spool/job549357/slurm_script: line 26: $'\nconda create --name tpot2devenv -c conda-forge python=3.10\n': command not found
/cm/local/apps/slurm/var/spool/job549357/slurm_script: line 31: $'\npip install -r requirements.txt\n': command not found
RunStart
2023-12-12 14:46:26.993917: I tensorflow/core/util/port.cc:113] oneDNN custom operations are on. You may see slightly different numerical results due to floating-point round-off errors from different computation orders. To turn them off, set the environment variable `TF_ENABLE_ONEDNN_OPTS=0`.
2023-12-12 14:46:27.030791: E external/local_xla/xla/stream_executor/cuda/cuda_dnn.cc:9261] Unable to register cuDNN factory: Attempting to register factory for plugin cuDNN when one has already been registered
2023-12-12 14:46:27.030817: E external/local_xla/xla/stream_executor/cuda/cuda_fft.cc:607] Unable to register cuFFT factory: Attempting to register factory for plugin cuFFT when one has already been registered
2023-12-12 14:46:27.032203: E external/local_xla/xla/stream_executor/cuda/cuda_blas.cc:1515] Unable to register cuBLAS factory: Attempting to register factory for plugin cuBLAS when one has already been registered
2023-12-12 14:46:27.038304: I tensorflow/core/platform/cpu_feature_guard.cc:182] This TensorFlow binary is optimized to use available CPU instructions in performance-critical operations.
To enable the following instructions: AVX2 AVX512F AVX512_VNNI FMA, in other operations, rebuild TensorFlow with the appropriate compiler flags.
2023-12-12 14:46:29.750527: W tensorflow/compiler/tf2tensorrt/utils/py_utils.cc:38] TF-TRT Warning: Could not find TensorRT
WARNING:tensorflow:From /home/ketrong/miniconda3/envs/tpot2devenv/lib/python3.10/site-packages/tensorflow/python/compat/v2_compat.py:108: disable_resource_variables (from tensorflow.python.ops.variable_scope) is deprecated and will be removed in a future version.
Instructions for updating:
non-resource variables are not supported in the long term
starting loops
working on 
logs/30/tpot2_base_normal_MAR_0.5
4.521343469619751
loading data
data/30_True.pkl
running experiment 1/3 - Does large hyperparameter space improve reconstruction accuracy over simple
[I 2023-12-12 14:46:49,969] A new study created in memory with name: no-name-bc38ca14-ec14-4f0d-a702-6edf540a101e
[I 2023-12-12 14:46:50,311] Trial 1 finished with value: 1632.0338652899106 and parameters: {'model_name': 'SimpleImputer', 'strategy': 'constant'}. Best is trial 1 with value: 1632.0338652899106.
[I 2023-12-12 14:46:50,535] Trial 2 finished with value: 1632.0338652899106 and parameters: {'model_name': 'SimpleImputer', 'strategy': 'constant'}. Best is trial 1 with value: 1632.0338652899106.
[I 2023-12-12 14:46:50,683] Trial 7 finished with value: 1632.0338652899106 and parameters: {'model_name': 'SimpleImputer', 'strategy': 'constant'}. Best is trial 1 with value: 1632.0338652899106.
[I 2023-12-12 14:46:51,104] Trial 4 finished with value: 1632.0338652899106 and parameters: {'model_name': 'SimpleImputer', 'strategy': 'constant'}. Best is trial 1 with value: 1632.0338652899106.
[I 2023-12-12 14:46:51,420] Trial 21 finished with value: 1632.0338652899106 and parameters: {'model_name': 'SimpleImputer', 'strategy': 'constant'}. Best is trial 1 with value: 1632.0338652899106.
[I 2023-12-12 14:46:51,656] Trial 14 finished with value: 1632.0338652899106 and parameters: {'model_name': 'SimpleImputer', 'strategy': 'constant'}. Best is trial 1 with value: 1632.0338652899106.
[I 2023-12-12 14:46:51,855] Trial 11 finished with value: 1632.0338652899106 and parameters: {'model_name': 'SimpleImputer', 'strategy': 'constant'}. Best is trial 1 with value: 1632.0338652899106.
[I 2023-12-12 14:46:52,129] Trial 12 finished with value: 1632.0338652899106 and parameters: {'model_name': 'SimpleImputer', 'strategy': 'constant'}. Best is trial 1 with value: 1632.0338652899106.
[I 2023-12-12 14:46:52,592] Trial 27 finished with value: 1632.0338652899106 and parameters: {'model_name': 'SimpleImputer', 'strategy': 'constant'}. Best is trial 1 with value: 1632.0338652899106.
[I 2023-12-12 14:46:52,809] Trial 18 finished with value: 1632.0338652899106 and parameters: {'model_name': 'SimpleImputer', 'strategy': 'constant'}. Best is trial 1 with value: 1632.0338652899106.
[I 2023-12-12 14:46:53,005] Trial 25 finished with value: 1632.0338652899106 and parameters: {'model_name': 'SimpleImputer', 'strategy': 'constant'}. Best is trial 1 with value: 1632.0338652899106.
[I 2023-12-12 14:46:53,217] Trial 26 finished with value: 1455.356306763598 and parameters: {'model_name': 'SimpleImputer', 'strategy': 'mean'}. Best is trial 26 with value: 1455.356306763598.
[I 2023-12-12 14:46:53,396] Trial 24 finished with value: 1632.0338652899106 and parameters: {'model_name': 'SimpleImputer', 'strategy': 'constant'}. Best is trial 26 with value: 1455.356306763598.
[I 2023-12-12 14:46:53,598] Trial 41 finished with value: 1632.0338652899106 and parameters: {'model_name': 'SimpleImputer', 'strategy': 'constant'}. Best is trial 26 with value: 1455.356306763598.
[I 2023-12-12 14:46:53,859] Trial 28 finished with value: 1455.356306763598 and parameters: {'model_name': 'SimpleImputer', 'strategy': 'mean'}. Best is trial 26 with value: 1455.356306763598.
[I 2023-12-12 14:46:54,018] Trial 29 finished with value: 1455.356306763598 and parameters: {'model_name': 'SimpleImputer', 'strategy': 'mean'}. Best is trial 26 with value: 1455.356306763598.
[I 2023-12-12 14:46:54,167] Trial 45 finished with value: 1632.0338652899106 and parameters: {'model_name': 'SimpleImputer', 'strategy': 'constant'}. Best is trial 26 with value: 1455.356306763598.
[I 2023-12-12 14:46:54,555] Trial 49 finished with value: 1632.0338652899106 and parameters: {'model_name': 'SimpleImputer', 'strategy': 'constant'}. Best is trial 26 with value: 1455.356306763598.
[I 2023-12-12 14:46:54,748] Trial 30 finished with value: 1455.356306763598 and parameters: {'model_name': 'SimpleImputer', 'strategy': 'mean'}. Best is trial 26 with value: 1455.356306763598.
[I 2023-12-12 14:46:54,900] Trial 35 finished with value: 1455.356306763598 and parameters: {'model_name': 'SimpleImputer', 'strategy': 'mean'}. Best is trial 26 with value: 1455.356306763598.
[I 2023-12-12 14:46:55,047] Trial 36 finished with value: 1455.356306763598 and parameters: {'model_name': 'SimpleImputer', 'strategy': 'mean'}. Best is trial 26 with value: 1455.356306763598.
[I 2023-12-12 14:46:55,199] Trial 39 finished with value: 1455.356306763598 and parameters: {'model_name': 'SimpleImputer', 'strategy': 'mean'}. Best is trial 26 with value: 1455.356306763598.
[I 2023-12-12 14:46:55,476] Trial 38 finished with value: 1455.356306763598 and parameters: {'model_name': 'SimpleImputer', 'strategy': 'mean'}. Best is trial 26 with value: 1455.356306763598.
[I 2023-12-12 14:46:55,731] Trial 9 finished with value: 1609.7077302332216 and parameters: {'model_name': 'SimpleImputer', 'strategy': 'median'}. Best is trial 26 with value: 1455.356306763598.
[I 2023-12-12 14:46:55,987] Trial 6 finished with value: 1609.7077302332216 and parameters: {'model_name': 'SimpleImputer', 'strategy': 'median'}. Best is trial 26 with value: 1455.356306763598.
[I 2023-12-12 14:46:56,241] Trial 50 finished with value: 1455.356306763598 and parameters: {'model_name': 'SimpleImputer', 'strategy': 'mean'}. Best is trial 26 with value: 1455.356306763598.
[I 2023-12-12 14:46:56,481] Trial 54 finished with value: 1455.356306763598 and parameters: {'model_name': 'SimpleImputer', 'strategy': 'mean'}. Best is trial 26 with value: 1455.356306763598.
[I 2023-12-12 14:46:56,780] Trial 47 finished with value: 1455.356306763598 and parameters: {'model_name': 'SimpleImputer', 'strategy': 'mean'}. Best is trial 26 with value: 1455.356306763598.
[I 2023-12-12 14:46:56,971] Trial 53 finished with value: 1455.356306763598 and parameters: {'model_name': 'SimpleImputer', 'strategy': 'mean'}. Best is trial 26 with value: 1455.356306763598.
[I 2023-12-12 14:46:57,179] Trial 55 finished with value: 1455.356306763598 and parameters: {'model_name': 'SimpleImputer', 'strategy': 'mean'}. Best is trial 26 with value: 1455.356306763598.
[I 2023-12-12 14:46:57,426] Trial 17 finished with value: 1609.7077302332216 and parameters: {'model_name': 'SimpleImputer', 'strategy': 'median'}. Best is trial 26 with value: 1455.356306763598.
[I 2023-12-12 14:46:57,811] Trial 58 finished with value: 1455.356306763598 and parameters: {'model_name': 'SimpleImputer', 'strategy': 'mean'}. Best is trial 26 with value: 1455.356306763598.
[I 2023-12-12 14:46:58,043] Trial 59 finished with value: 1455.356306763598 and parameters: {'model_name': 'SimpleImputer', 'strategy': 'mean'}. Best is trial 26 with value: 1455.356306763598.
[I 2023-12-12 14:46:58,224] Trial 0 finished with value: 1609.7077302332216 and parameters: {'model_name': 'SimpleImputer', 'strategy': 'median'}. Best is trial 26 with value: 1455.356306763598.
[I 2023-12-12 14:46:58,471] Trial 23 finished with value: 1609.7077302332216 and parameters: {'model_name': 'SimpleImputer', 'strategy': 'median'}. Best is trial 26 with value: 1455.356306763598.
[I 2023-12-12 14:46:58,652] Trial 19 finished with value: 1609.7077302332216 and parameters: {'model_name': 'SimpleImputer', 'strategy': 'median'}. Best is trial 26 with value: 1455.356306763598.
[I 2023-12-12 14:46:59,132] Trial 62 finished with value: 1455.356306763598 and parameters: {'model_name': 'SimpleImputer', 'strategy': 'mean'}. Best is trial 26 with value: 1455.356306763598.
[I 2023-12-12 14:46:59,355] Trial 34 finished with value: 1609.7077302332216 and parameters: {'model_name': 'SimpleImputer', 'strategy': 'median'}. Best is trial 26 with value: 1455.356306763598.
[I 2023-12-12 14:46:59,695] Trial 22 finished with value: 1609.7077302332216 and parameters: {'model_name': 'SimpleImputer', 'strategy': 'median'}. Best is trial 26 with value: 1455.356306763598.
[I 2023-12-12 14:47:00,113] Trial 61 finished with value: 1455.356306763598 and parameters: {'model_name': 'SimpleImputer', 'strategy': 'mean'}. Best is trial 26 with value: 1455.356306763598.
[I 2023-12-12 14:47:00,347] Trial 64 finished with value: 1455.356306763598 and parameters: {'model_name': 'SimpleImputer', 'strategy': 'mean'}. Best is trial 26 with value: 1455.356306763598.
[I 2023-12-12 14:47:00,651] Trial 42 finished with value: 1609.7077302332216 and parameters: {'model_name': 'SimpleImputer', 'strategy': 'median'}. Best is trial 26 with value: 1455.356306763598.
[I 2023-12-12 14:47:00,891] Trial 60 finished with value: 1455.356306763598 and parameters: {'model_name': 'SimpleImputer', 'strategy': 'mean'}. Best is trial 26 with value: 1455.356306763598.
[I 2023-12-12 14:47:01,305] Trial 63 finished with value: 1455.356306763598 and parameters: {'model_name': 'SimpleImputer', 'strategy': 'mean'}. Best is trial 26 with value: 1455.356306763598.
[I 2023-12-12 14:47:01,680] Trial 52 finished with value: 1609.7077302332216 and parameters: {'model_name': 'SimpleImputer', 'strategy': 'median'}. Best is trial 26 with value: 1455.356306763598.
[I 2023-12-12 14:47:02,520] Trial 68 finished with value: 1609.7077302332216 and parameters: {'model_name': 'SimpleImputer', 'strategy': 'median'}. Best is trial 26 with value: 1455.356306763598.
[I 2023-12-12 14:47:02,972] Trial 5 finished with value: 1624.6243890981327 and parameters: {'model_name': 'SimpleImputer', 'strategy': 'most_frequent'}. Best is trial 26 with value: 1455.356306763598.
[I 2023-12-12 14:47:03,373] Trial 69 finished with value: 1609.7077302332216 and parameters: {'model_name': 'SimpleImputer', 'strategy': 'median'}. Best is trial 26 with value: 1455.356306763598.
[I 2023-12-12 14:47:03,797] Trial 67 finished with value: 1609.7077302332216 and parameters: {'model_name': 'SimpleImputer', 'strategy': 'median'}. Best is trial 26 with value: 1455.356306763598.
[I 2023-12-12 14:47:04,204] Trial 3 finished with value: 1624.6243890981327 and parameters: {'model_name': 'SimpleImputer', 'strategy': 'most_frequent'}. Best is trial 26 with value: 1455.356306763598.
[I 2023-12-12 14:47:04,537] Trial 10 finished with value: 1624.6243890981327 and parameters: {'model_name': 'SimpleImputer', 'strategy': 'most_frequent'}. Best is trial 26 with value: 1455.356306763598.
[I 2023-12-12 14:47:04,769] Trial 8 finished with value: 1624.6243890981327 and parameters: {'model_name': 'SimpleImputer', 'strategy': 'most_frequent'}. Best is trial 26 with value: 1455.356306763598.
[I 2023-12-12 14:47:05,310] Trial 32 finished with value: 1624.6243890981327 and parameters: {'model_name': 'SimpleImputer', 'strategy': 'most_frequent'}. Best is trial 26 with value: 1455.356306763598.
[I 2023-12-12 14:47:05,494] Trial 15 finished with value: 1624.6243890981327 and parameters: {'model_name': 'SimpleImputer', 'strategy': 'most_frequent'}. Best is trial 26 with value: 1455.356306763598.
[I 2023-12-12 14:47:06,047] Trial 20 finished with value: 1624.6243890981327 and parameters: {'model_name': 'SimpleImputer', 'strategy': 'most_frequent'}. Best is trial 26 with value: 1455.356306763598.
[I 2023-12-12 14:47:06,448] Trial 13 finished with value: 1624.6243890981327 and parameters: {'model_name': 'SimpleImputer', 'strategy': 'most_frequent'}. Best is trial 26 with value: 1455.356306763598.
[I 2023-12-12 14:47:06,636] Trial 46 finished with value: 1624.6243890981327 and parameters: {'model_name': 'SimpleImputer', 'strategy': 'most_frequent'}. Best is trial 26 with value: 1455.356306763598.
[I 2023-12-12 14:47:07,021] Trial 37 finished with value: 1624.6243890981327 and parameters: {'model_name': 'SimpleImputer', 'strategy': 'most_frequent'}. Best is trial 26 with value: 1455.356306763598.
[I 2023-12-12 14:47:07,310] Trial 31 finished with value: 1624.6243890981327 and parameters: {'model_name': 'SimpleImputer', 'strategy': 'most_frequent'}. Best is trial 26 with value: 1455.356306763598.
[I 2023-12-12 14:47:07,557] Trial 44 finished with value: 1624.6243890981327 and parameters: {'model_name': 'SimpleImputer', 'strategy': 'most_frequent'}. Best is trial 26 with value: 1455.356306763598.
[I 2023-12-12 14:47:07,765] Trial 40 finished with value: 1624.6243890981327 and parameters: {'model_name': 'SimpleImputer', 'strategy': 'most_frequent'}. Best is trial 26 with value: 1455.356306763598.
[I 2023-12-12 14:47:08,052] Trial 16 finished with value: 1624.6243890981327 and parameters: {'model_name': 'SimpleImputer', 'strategy': 'most_frequent'}. Best is trial 26 with value: 1455.356306763598.
[I 2023-12-12 14:47:08,557] Trial 33 finished with value: 1624.6243890981327 and parameters: {'model_name': 'SimpleImputer', 'strategy': 'most_frequent'}. Best is trial 26 with value: 1455.356306763598.
[I 2023-12-12 14:47:08,920] Trial 51 finished with value: 1624.6243890981327 and parameters: {'model_name': 'SimpleImputer', 'strategy': 'most_frequent'}. Best is trial 26 with value: 1455.356306763598.
[I 2023-12-12 14:47:09,207] Trial 48 finished with value: 1624.6243890981327 and parameters: {'model_name': 'SimpleImputer', 'strategy': 'most_frequent'}. Best is trial 26 with value: 1455.356306763598.
[I 2023-12-12 14:47:09,718] Trial 57 finished with value: 1624.6243890981327 and parameters: {'model_name': 'SimpleImputer', 'strategy': 'most_frequent'}. Best is trial 26 with value: 1455.356306763598.
[I 2023-12-12 14:47:09,897] Trial 43 finished with value: 1624.6243890981327 and parameters: {'model_name': 'SimpleImputer', 'strategy': 'most_frequent'}. Best is trial 26 with value: 1455.356306763598.
[I 2023-12-12 14:47:10,185] Trial 100 finished with value: 1455.356306763598 and parameters: {'model_name': 'SimpleImputer', 'strategy': 'mean'}. Best is trial 26 with value: 1455.356306763598.
[I 2023-12-12 14:47:10,443] Trial 56 finished with value: 1624.6243890981327 and parameters: {'model_name': 'SimpleImputer', 'strategy': 'most_frequent'}. Best is trial 26 with value: 1455.356306763598.
[I 2023-12-12 14:47:10,759] Trial 102 finished with value: 1455.356306763598 and parameters: {'model_name': 'SimpleImputer', 'strategy': 'mean'}. Best is trial 26 with value: 1455.356306763598.
[I 2023-12-12 14:47:11,034] Trial 104 finished with value: 1455.356306763598 and parameters: {'model_name': 'SimpleImputer', 'strategy': 'mean'}. Best is trial 26 with value: 1455.356306763598.
[I 2023-12-12 14:47:11,315] Trial 74 finished with value: 1624.6243890981327 and parameters: {'model_name': 'SimpleImputer', 'strategy': 'most_frequent'}. Best is trial 26 with value: 1455.356306763598.
[I 2023-12-12 14:47:11,563] Trial 70 finished with value: 1624.6243890981327 and parameters: {'model_name': 'SimpleImputer', 'strategy': 'most_frequent'}. Best is trial 26 with value: 1455.356306763598.
[I 2023-12-12 14:47:11,594] Trial 66 finished with value: 1624.6243890981327 and parameters: {'model_name': 'SimpleImputer', 'strategy': 'most_frequent'}. Best is trial 26 with value: 1455.356306763598.
[I 2023-12-12 14:47:11,597] Trial 71 finished with value: 1624.6243890981327 and parameters: {'model_name': 'SimpleImputer', 'strategy': 'most_frequent'}. Best is trial 26 with value: 1455.356306763598.
[I 2023-12-12 14:47:11,886] Trial 105 finished with value: 1455.356306763598 and parameters: {'model_name': 'SimpleImputer', 'strategy': 'mean'}. Best is trial 26 with value: 1455.356306763598.
[I 2023-12-12 14:47:12,342] Trial 101 finished with value: 1455.356306763598 and parameters: {'model_name': 'SimpleImputer', 'strategy': 'mean'}. Best is trial 26 with value: 1455.356306763598.
[I 2023-12-12 14:47:12,841] Trial 76 finished with value: 1624.6243890981327 and parameters: {'model_name': 'SimpleImputer', 'strategy': 'most_frequent'}. Best is trial 26 with value: 1455.356306763598.
[I 2023-12-12 14:47:13,208] Trial 103 finished with value: 1455.356306763598 and parameters: {'model_name': 'SimpleImputer', 'strategy': 'mean'}. Best is trial 26 with value: 1455.356306763598.
[I 2023-12-12 14:47:13,453] Trial 107 finished with value: 1455.356306763598 and parameters: {'model_name': 'SimpleImputer', 'strategy': 'mean'}. Best is trial 26 with value: 1455.356306763598.
[I 2023-12-12 14:47:13,633] Trial 106 finished with value: 1455.356306763598 and parameters: {'model_name': 'SimpleImputer', 'strategy': 'mean'}. Best is trial 26 with value: 1455.356306763598.
[I 2023-12-12 14:47:13,922] Trial 108 finished with value: 1455.356306763598 and parameters: {'model_name': 'SimpleImputer', 'strategy': 'mean'}. Best is trial 26 with value: 1455.356306763598.
[I 2023-12-12 14:47:14,175] Trial 110 finished with value: 1455.356306763598 and parameters: {'model_name': 'SimpleImputer', 'strategy': 'mean'}. Best is trial 26 with value: 1455.356306763598.
[I 2023-12-12 14:47:14,443] Trial 78 finished with value: 1624.6243890981327 and parameters: {'model_name': 'SimpleImputer', 'strategy': 'most_frequent'}. Best is trial 26 with value: 1455.356306763598.
[I 2023-12-12 14:47:14,831] Trial 65 finished with value: 1624.6243890981327 and parameters: {'model_name': 'SimpleImputer', 'strategy': 'most_frequent'}. Best is trial 26 with value: 1455.356306763598.
[I 2023-12-12 14:47:15,182] Trial 75 finished with value: 1624.6243890981327 and parameters: {'model_name': 'SimpleImputer', 'strategy': 'most_frequent'}. Best is trial 26 with value: 1455.356306763598.
[I 2023-12-12 14:47:15,454] Trial 85 finished with value: 1624.6243890981327 and parameters: {'model_name': 'SimpleImputer', 'strategy': 'most_frequent'}. Best is trial 26 with value: 1455.356306763598.
[I 2023-12-12 14:47:15,696] Trial 111 finished with value: 1455.356306763598 and parameters: {'model_name': 'SimpleImputer', 'strategy': 'mean'}. Best is trial 26 with value: 1455.356306763598.
[I 2023-12-12 14:47:15,897] Trial 113 finished with value: 1455.356306763598 and parameters: {'model_name': 'SimpleImputer', 'strategy': 'mean'}. Best is trial 26 with value: 1455.356306763598.
[I 2023-12-12 14:47:16,146] Trial 73 finished with value: 1624.6243890981327 and parameters: {'model_name': 'SimpleImputer', 'strategy': 'most_frequent'}. Best is trial 26 with value: 1455.356306763598.
[I 2023-12-12 14:47:16,390] Trial 84 finished with value: 1624.6243890981327 and parameters: {'model_name': 'SimpleImputer', 'strategy': 'most_frequent'}. Best is trial 26 with value: 1455.356306763598.
[I 2023-12-12 14:47:16,607] Trial 109 finished with value: 1455.356306763598 and parameters: {'model_name': 'SimpleImputer', 'strategy': 'mean'}. Best is trial 26 with value: 1455.356306763598.
[I 2023-12-12 14:47:16,898] Trial 115 finished with value: 1455.356306763598 and parameters: {'model_name': 'SimpleImputer', 'strategy': 'mean'}. Best is trial 26 with value: 1455.356306763598.
[I 2023-12-12 14:47:17,145] Trial 112 finished with value: 1455.356306763598 and parameters: {'model_name': 'SimpleImputer', 'strategy': 'mean'}. Best is trial 26 with value: 1455.356306763598.
[I 2023-12-12 14:47:17,382] Trial 80 finished with value: 1624.6243890981327 and parameters: {'model_name': 'SimpleImputer', 'strategy': 'most_frequent'}. Best is trial 26 with value: 1455.356306763598.
[I 2023-12-12 14:47:17,609] Trial 114 finished with value: 1455.356306763598 and parameters: {'model_name': 'SimpleImputer', 'strategy': 'mean'}. Best is trial 26 with value: 1455.356306763598.
[I 2023-12-12 14:47:17,970] Trial 118 finished with value: 1455.356306763598 and parameters: {'model_name': 'SimpleImputer', 'strategy': 'mean'}. Best is trial 26 with value: 1455.356306763598.
[I 2023-12-12 14:47:18,173] Trial 86 finished with value: 1624.6243890981327 and parameters: {'model_name': 'SimpleImputer', 'strategy': 'most_frequent'}. Best is trial 26 with value: 1455.356306763598.
