[I 2024-03-02 13:42:10,396] Trial 125 finished with value: 941.717432671417 and parameters: {'model_name': 'RandomForestImputer', 'max_iter': 64, 'decreasing': True, 'min_samples_split': 0.9, 'min_samples_leaf': 0.1, 'max_features': 0.1, 'warm_start': False}. Best is trial 2 with value: 907.2753632256799.
[I 2024-03-02 13:44:38,327] Trial 16 finished with value: inf and parameters: {'model_name': 'GAIN', 'batch_size': 55, 'hint_rate': 0.09999999999999999, 'alpha': 48, 'iterations': 28365}. Best is trial 2 with value: 907.2753632256799.
[I 2024-03-02 13:44:44,838] Trial 135 finished with value: 963.1710698971434 and parameters: {'model_name': 'RandomForestImputer', 'max_iter': 75, 'decreasing': True, 'min_samples_split': 1.0, 'min_samples_leaf': 0.30000000000000004, 'max_features': 0.1, 'warm_start': False}. Best is trial 2 with value: 907.2753632256799.
[I 2024-03-02 13:48:00,213] Trial 128 finished with value: 940.9121853705858 and parameters: {'model_name': 'RandomForestImputer', 'max_iter': 78, 'decreasing': True, 'min_samples_split': 1.0, 'min_samples_leaf': 0.1, 'max_features': 0.1, 'warm_start': False}. Best is trial 2 with value: 907.2753632256799.
[I 2024-03-02 13:48:34,872] Trial 124 finished with value: 941.4081237214732 and parameters: {'model_name': 'RandomForestImputer', 'max_iter': 90, 'decreasing': True, 'min_samples_split': 1.0, 'min_samples_leaf': 0.1, 'max_features': 0.1, 'warm_start': False}. Best is trial 2 with value: 907.2753632256799.
[I 2024-03-02 13:49:37,837] Trial 132 finished with value: 944.4091924956587 and parameters: {'model_name': 'RandomForestImputer', 'max_iter': 84, 'decreasing': True, 'min_samples_split': 1.0, 'min_samples_leaf': 0.1, 'max_features': 0.1, 'warm_start': False}. Best is trial 2 with value: 907.2753632256799.
[I 2024-03-02 13:49:40,560] Trial 127 finished with value: 947.5403521347795 and parameters: {'model_name': 'RandomForestImputer', 'max_iter': 83, 'decreasing': True, 'min_samples_split': 1.0, 'min_samples_leaf': 0.1, 'max_features': 0.1, 'warm_start': False}. Best is trial 2 with value: 907.2753632256799.
[I 2024-03-02 13:50:46,239] Trial 133 finished with value: 945.922066256561 and parameters: {'model_name': 'RandomForestImputer', 'max_iter': 94, 'decreasing': True, 'min_samples_split': 1.0, 'min_samples_leaf': 0.1, 'max_features': 0.1, 'warm_start': False}. Best is trial 2 with value: 907.2753632256799.
[I 2024-03-02 13:51:08,757] Trial 134 finished with value: 944.354485910449 and parameters: {'model_name': 'RandomForestImputer', 'max_iter': 92, 'decreasing': True, 'min_samples_split': 1.0, 'min_samples_leaf': 0.1, 'max_features': 0.1, 'warm_start': False}. Best is trial 2 with value: 907.2753632256799.
[I 2024-03-02 13:51:29,762] Trial 130 finished with value: 937.4794265494689 and parameters: {'model_name': 'RandomForestImputer', 'max_iter': 75, 'decreasing': True, 'min_samples_split': 0.9, 'min_samples_leaf': 0.1, 'max_features': 0.2, 'warm_start': False}. Best is trial 2 with value: 907.2753632256799.
[I 2024-03-02 13:51:47,965] Trial 126 finished with value: 945.7762323565024 and parameters: {'model_name': 'RandomForestImputer', 'max_iter': 98, 'decreasing': True, 'min_samples_split': 1.0, 'min_samples_leaf': 0.1, 'max_features': 0.1, 'warm_start': False}. Best is trial 2 with value: 907.2753632256799.
[I 2024-03-02 13:52:52,606] Trial 137 finished with value: 961.9580303797666 and parameters: {'model_name': 'RandomForestImputer', 'max_iter': 97, 'decreasing': True, 'min_samples_split': 0.9, 'min_samples_leaf': 0.30000000000000004, 'max_features': 0.1, 'warm_start': False}. Best is trial 2 with value: 907.2753632256799.
[I 2024-03-02 13:52:56,149] Trial 131 finished with value: 941.063965421202 and parameters: {'model_name': 'RandomForestImputer', 'max_iter': 100, 'decreasing': True, 'min_samples_split': 1.0, 'min_samples_leaf': 0.1, 'max_features': 0.1, 'warm_start': False}. Best is trial 2 with value: 907.2753632256799.
[I 2024-03-02 13:53:06,176] Trial 129 finished with value: 945.0017393725705 and parameters: {'model_name': 'RandomForestImputer', 'max_iter': 88, 'decreasing': True, 'min_samples_split': 1.0, 'min_samples_leaf': 0.1, 'max_features': 0.1, 'warm_start': False}. Best is trial 2 with value: 907.2753632256799.
[I 2024-03-02 13:53:19,960] Trial 122 finished with value: 939.36409912493 and parameters: {'model_name': 'RandomForestImputer', 'max_iter': 98, 'decreasing': True, 'min_samples_split': 1.0, 'min_samples_leaf': 0.1, 'max_features': 0.1, 'warm_start': False}. Best is trial 2 with value: 907.2753632256799.
[I 2024-03-02 13:53:43,692] Trial 34 finished with value: inf and parameters: {'model_name': 'GAIN', 'batch_size': 2, 'hint_rate': 0.81, 'alpha': 44, 'iterations': 59206}. Best is trial 2 with value: 907.2753632256799.
[I 2024-03-02 13:54:35,064] Trial 24 finished with value: inf and parameters: {'model_name': 'GAIN', 'batch_size': 569, 'hint_rate': 0.9600000000000001, 'alpha': 19, 'iterations': 45193}. Best is trial 2 with value: 907.2753632256799.
