[I 2024-02-27 21:49:16,758] Trial 75 finished with value: 2541.9945877854916 and parameters: {'model_name': 'SimpleImputer', 'strategy': 'most_frequent'}. Best is trial 6 with value: 2406.7086271118064.
[I 2024-02-27 21:49:17,256] Trial 85 finished with value: 2541.9945877854916 and parameters: {'model_name': 'SimpleImputer', 'strategy': 'most_frequent'}. Best is trial 6 with value: 2406.7086271118064.
[I 2024-02-27 21:49:17,570] Trial 86 finished with value: 2541.9945877854916 and parameters: {'model_name': 'SimpleImputer', 'strategy': 'most_frequent'}. Best is trial 6 with value: 2406.7086271118064.
[I 2024-02-27 21:49:17,822] Trial 87 finished with value: 2541.9945877854916 and parameters: {'model_name': 'SimpleImputer', 'strategy': 'most_frequent'}. Best is trial 6 with value: 2406.7086271118064.
[I 2024-02-27 21:49:18,082] Trial 88 finished with value: 2541.9945877854916 and parameters: {'model_name': 'SimpleImputer', 'strategy': 'most_frequent'}. Best is trial 6 with value: 2406.7086271118064.
[I 2024-02-27 21:49:18,322] Trial 118 finished with value: 2406.7086271118064 and parameters: {'model_name': 'SimpleImputer', 'strategy': 'mean'}. Best is trial 6 with value: 2406.7086271118064.
[I 2024-02-27 21:49:18,554] Trial 93 finished with value: 2541.9945877854916 and parameters: {'model_name': 'SimpleImputer', 'strategy': 'most_frequent'}. Best is trial 6 with value: 2406.7086271118064.
[I 2024-02-27 21:49:18,782] Trial 84 finished with value: 2541.9945877854916 and parameters: {'model_name': 'SimpleImputer', 'strategy': 'most_frequent'}. Best is trial 6 with value: 2406.7086271118064.
[I 2024-02-27 21:49:18,996] Trial 82 finished with value: 2541.9945877854916 and parameters: {'model_name': 'SimpleImputer', 'strategy': 'most_frequent'}. Best is trial 6 with value: 2406.7086271118064.
[I 2024-02-27 21:49:19,272] Trial 120 finished with value: 2406.7086271118064 and parameters: {'model_name': 'SimpleImputer', 'strategy': 'mean'}. Best is trial 6 with value: 2406.7086271118064.
[I 2024-02-27 21:49:19,494] Trial 119 finished with value: 2406.7086271118064 and parameters: {'model_name': 'SimpleImputer', 'strategy': 'mean'}. Best is trial 6 with value: 2406.7086271118064.
[I 2024-02-27 21:49:19,748] Trial 94 finished with value: 2541.9945877854916 and parameters: {'model_name': 'SimpleImputer', 'strategy': 'most_frequent'}. Best is trial 6 with value: 2406.7086271118064.
[I 2024-02-27 21:49:20,021] Trial 95 finished with value: 2541.9945877854916 and parameters: {'model_name': 'SimpleImputer', 'strategy': 'most_frequent'}. Best is trial 6 with value: 2406.7086271118064.
[I 2024-02-27 21:49:20,306] Trial 91 finished with value: 2541.9945877854916 and parameters: {'model_name': 'SimpleImputer', 'strategy': 'most_frequent'}. Best is trial 6 with value: 2406.7086271118064.
[I 2024-02-27 21:49:20,560] Trial 92 finished with value: 2541.9945877854916 and parameters: {'model_name': 'SimpleImputer', 'strategy': 'most_frequent'}. Best is trial 6 with value: 2406.7086271118064.
[I 2024-02-27 21:49:20,776] Trial 121 finished with value: 2406.7086271118064 and parameters: {'model_name': 'SimpleImputer', 'strategy': 'mean'}. Best is trial 6 with value: 2406.7086271118064.
[I 2024-02-27 21:49:21,093] Trial 90 finished with value: 2541.9945877854916 and parameters: {'model_name': 'SimpleImputer', 'strategy': 'most_frequent'}. Best is trial 6 with value: 2406.7086271118064.
[I 2024-02-27 21:49:21,389] Trial 122 finished with value: 2406.7086271118064 and parameters: {'model_name': 'SimpleImputer', 'strategy': 'mean'}. Best is trial 6 with value: 2406.7086271118064.
[I 2024-02-27 21:49:21,684] Trial 80 finished with value: 2541.9945877854916 and parameters: {'model_name': 'SimpleImputer', 'strategy': 'most_frequent'}. Best is trial 6 with value: 2406.7086271118064.
[I 2024-02-27 21:49:21,920] Trial 124 finished with value: 2406.7086271118064 and parameters: {'model_name': 'SimpleImputer', 'strategy': 'mean'}. Best is trial 6 with value: 2406.7086271118064.
[I 2024-02-27 21:49:22,204] Trial 123 finished with value: 2406.7086271118064 and parameters: {'model_name': 'SimpleImputer', 'strategy': 'mean'}. Best is trial 6 with value: 2406.7086271118064.
[I 2024-02-27 21:49:22,474] Trial 89 finished with value: 2541.9945877854916 and parameters: {'model_name': 'SimpleImputer', 'strategy': 'most_frequent'}. Best is trial 6 with value: 2406.7086271118064.
[I 2024-02-27 21:49:22,736] Trial 129 finished with value: 2406.7086271118064 and parameters: {'model_name': 'SimpleImputer', 'strategy': 'mean'}. Best is trial 6 with value: 2406.7086271118064.
[I 2024-02-27 21:49:22,971] Trial 128 finished with value: 2406.7086271118064 and parameters: {'model_name': 'SimpleImputer', 'strategy': 'mean'}. Best is trial 6 with value: 2406.7086271118064.
[I 2024-02-27 21:49:23,205] Trial 97 finished with value: 2541.9945877854916 and parameters: {'model_name': 'SimpleImputer', 'strategy': 'most_frequent'}. Best is trial 6 with value: 2406.7086271118064.
[I 2024-02-27 21:49:23,413] Trial 125 finished with value: 2406.7086271118064 and parameters: {'model_name': 'SimpleImputer', 'strategy': 'mean'}. Best is trial 6 with value: 2406.7086271118064.
[I 2024-02-27 21:49:23,743] Trial 126 finished with value: 2406.7086271118064 and parameters: {'model_name': 'SimpleImputer', 'strategy': 'mean'}. Best is trial 6 with value: 2406.7086271118064.
[I 2024-02-27 21:49:23,949] Trial 127 finished with value: 2406.7086271118064 and parameters: {'model_name': 'SimpleImputer', 'strategy': 'mean'}. Best is trial 6 with value: 2406.7086271118064.
[I 2024-02-27 21:49:24,161] Trial 103 finished with value: 2541.9945877854916 and parameters: {'model_name': 'SimpleImputer', 'strategy': 'most_frequent'}. Best is trial 6 with value: 2406.7086271118064.
[I 2024-02-27 21:49:24,355] Trial 131 finished with value: 2406.7086271118064 and parameters: {'model_name': 'SimpleImputer', 'strategy': 'mean'}. Best is trial 6 with value: 2406.7086271118064.
[I 2024-02-27 21:49:24,566] Trial 98 finished with value: 2541.9945877854916 and parameters: {'model_name': 'SimpleImputer', 'strategy': 'most_frequent'}. Best is trial 6 with value: 2406.7086271118064.
[I 2024-02-27 21:49:24,863] Trial 130 finished with value: 2406.7086271118064 and parameters: {'model_name': 'SimpleImputer', 'strategy': 'mean'}. Best is trial 6 with value: 2406.7086271118064.
[I 2024-02-27 21:49:25,068] Trial 101 finished with value: 2541.9945877854916 and parameters: {'model_name': 'SimpleImputer', 'strategy': 'most_frequent'}. Best is trial 6 with value: 2406.7086271118064.
[I 2024-02-27 21:49:25,274] Trial 138 finished with value: 2406.7086271118064 and parameters: {'model_name': 'SimpleImputer', 'strategy': 'mean'}. Best is trial 6 with value: 2406.7086271118064.
[I 2024-02-27 21:49:25,483] Trial 132 finished with value: 2406.7086271118064 and parameters: {'model_name': 'SimpleImputer', 'strategy': 'mean'}. Best is trial 6 with value: 2406.7086271118064.
[I 2024-02-27 21:49:25,699] Trial 137 finished with value: 2406.7086271118064 and parameters: {'model_name': 'SimpleImputer', 'strategy': 'mean'}. Best is trial 6 with value: 2406.7086271118064.
[I 2024-02-27 21:49:25,963] Trial 96 finished with value: 2541.9945877854916 and parameters: {'model_name': 'SimpleImputer', 'strategy': 'most_frequent'}. Best is trial 6 with value: 2406.7086271118064.
[I 2024-02-27 21:49:26,222] Trial 99 finished with value: 2541.9945877854916 and parameters: {'model_name': 'SimpleImputer', 'strategy': 'most_frequent'}. Best is trial 6 with value: 2406.7086271118064.
[I 2024-02-27 21:49:26,469] Trial 135 finished with value: 2406.7086271118064 and parameters: {'model_name': 'SimpleImputer', 'strategy': 'mean'}. Best is trial 6 with value: 2406.7086271118064.
[I 2024-02-27 21:49:26,672] Trial 136 finished with value: 2406.7086271118064 and parameters: {'model_name': 'SimpleImputer', 'strategy': 'mean'}. Best is trial 6 with value: 2406.7086271118064.
[I 2024-02-27 21:49:26,959] Trial 133 finished with value: 2406.7086271118064 and parameters: {'model_name': 'SimpleImputer', 'strategy': 'mean'}. Best is trial 6 with value: 2406.7086271118064.
[I 2024-02-27 21:49:27,181] Trial 134 finished with value: 2406.7086271118064 and parameters: {'model_name': 'SimpleImputer', 'strategy': 'mean'}. Best is trial 6 with value: 2406.7086271118064.
[I 2024-02-27 21:49:27,478] Trial 102 finished with value: 2541.9945877854916 and parameters: {'model_name': 'SimpleImputer', 'strategy': 'most_frequent'}. Best is trial 6 with value: 2406.7086271118064.
[I 2024-02-27 21:49:27,893] Trial 140 finished with value: 2406.7086271118064 and parameters: {'model_name': 'SimpleImputer', 'strategy': 'mean'}. Best is trial 6 with value: 2406.7086271118064.
[I 2024-02-27 21:49:28,172] Trial 100 finished with value: 2541.9945877854916 and parameters: {'model_name': 'SimpleImputer', 'strategy': 'most_frequent'}. Best is trial 6 with value: 2406.7086271118064.
[I 2024-02-27 21:49:28,448] Trial 139 finished with value: 2406.7086271118064 and parameters: {'model_name': 'SimpleImputer', 'strategy': 'mean'}. Best is trial 6 with value: 2406.7086271118064.
[I 2024-02-27 21:49:28,668] Trial 145 finished with value: 2406.7086271118064 and parameters: {'model_name': 'SimpleImputer', 'strategy': 'mean'}. Best is trial 6 with value: 2406.7086271118064.
[I 2024-02-27 21:49:28,878] Trial 144 finished with value: 2406.7086271118064 and parameters: {'model_name': 'SimpleImputer', 'strategy': 'mean'}. Best is trial 6 with value: 2406.7086271118064.
[I 2024-02-27 21:49:29,175] Trial 141 finished with value: 2406.7086271118064 and parameters: {'model_name': 'SimpleImputer', 'strategy': 'mean'}. Best is trial 6 with value: 2406.7086271118064.
[I 2024-02-27 21:49:29,545] Trial 104 finished with value: 2541.9945877854916 and parameters: {'model_name': 'SimpleImputer', 'strategy': 'most_frequent'}. Best is trial 6 with value: 2406.7086271118064.
[I 2024-02-27 21:49:29,911] Trial 146 finished with value: 2406.7086271118064 and parameters: {'model_name': 'SimpleImputer', 'strategy': 'mean'}. Best is trial 6 with value: 2406.7086271118064.
[I 2024-02-27 21:49:30,264] Trial 143 finished with value: 2406.7086271118064 and parameters: {'model_name': 'SimpleImputer', 'strategy': 'mean'}. Best is trial 6 with value: 2406.7086271118064.
[I 2024-02-27 21:49:30,557] Trial 148 finished with value: 2406.7086271118064 and parameters: {'model_name': 'SimpleImputer', 'strategy': 'mean'}. Best is trial 6 with value: 2406.7086271118064.
[I 2024-02-27 21:49:30,765] Trial 142 finished with value: 2406.7086271118064 and parameters: {'model_name': 'SimpleImputer', 'strategy': 'mean'}. Best is trial 6 with value: 2406.7086271118064.
[I 2024-02-27 21:49:31,062] Trial 105 finished with value: 2541.9945877854916 and parameters: {'model_name': 'SimpleImputer', 'strategy': 'most_frequent'}. Best is trial 6 with value: 2406.7086271118064.
[I 2024-02-27 21:49:31,281] Trial 150 finished with value: 2406.7086271118064 and parameters: {'model_name': 'SimpleImputer', 'strategy': 'mean'}. Best is trial 6 with value: 2406.7086271118064.
[I 2024-02-27 21:49:31,483] Trial 151 finished with value: 2406.7086271118064 and parameters: {'model_name': 'SimpleImputer', 'strategy': 'mean'}. Best is trial 6 with value: 2406.7086271118064.
[I 2024-02-27 21:49:31,722] Trial 153 finished with value: 2406.7086271118064 and parameters: {'model_name': 'SimpleImputer', 'strategy': 'mean'}. Best is trial 6 with value: 2406.7086271118064.
[I 2024-02-27 21:49:31,951] Trial 147 finished with value: 2406.7086271118064 and parameters: {'model_name': 'SimpleImputer', 'strategy': 'mean'}. Best is trial 6 with value: 2406.7086271118064.
[I 2024-02-27 21:49:32,158] Trial 156 finished with value: 2406.7086271118064 and parameters: {'model_name': 'SimpleImputer', 'strategy': 'mean'}. Best is trial 6 with value: 2406.7086271118064.
[I 2024-02-27 21:49:32,561] Trial 160 finished with value: 2406.7086271118064 and parameters: {'model_name': 'SimpleImputer', 'strategy': 'mean'}. Best is trial 6 with value: 2406.7086271118064.
[I 2024-02-27 21:49:32,851] Trial 157 finished with value: 2406.7086271118064 and parameters: {'model_name': 'SimpleImputer', 'strategy': 'mean'}. Best is trial 6 with value: 2406.7086271118064.
[I 2024-02-27 21:49:33,102] Trial 154 finished with value: 2406.7086271118064 and parameters: {'model_name': 'SimpleImputer', 'strategy': 'mean'}. Best is trial 6 with value: 2406.7086271118064.
[I 2024-02-27 21:49:33,366] Trial 152 finished with value: 2406.7086271118064 and parameters: {'model_name': 'SimpleImputer', 'strategy': 'mean'}. Best is trial 6 with value: 2406.7086271118064.
[I 2024-02-27 21:49:33,599] Trial 155 finished with value: 2406.7086271118064 and parameters: {'model_name': 'SimpleImputer', 'strategy': 'mean'}. Best is trial 6 with value: 2406.7086271118064.
[I 2024-02-27 21:49:33,813] Trial 149 finished with value: 2406.7086271118064 and parameters: {'model_name': 'SimpleImputer', 'strategy': 'mean'}. Best is trial 6 with value: 2406.7086271118064.
[I 2024-02-27 21:49:34,049] Trial 158 finished with value: 2406.7086271118064 and parameters: {'model_name': 'SimpleImputer', 'strategy': 'mean'}. Best is trial 6 with value: 2406.7086271118064.
[I 2024-02-27 21:49:34,368] Trial 167 finished with value: 2406.7086271118064 and parameters: {'model_name': 'SimpleImputer', 'strategy': 'mean'}. Best is trial 6 with value: 2406.7086271118064.
[I 2024-02-27 21:49:34,595] Trial 166 finished with value: 2406.7086271118064 and parameters: {'model_name': 'SimpleImputer', 'strategy': 'mean'}. Best is trial 6 with value: 2406.7086271118064.
[I 2024-02-27 21:49:34,815] Trial 161 finished with value: 2406.7086271118064 and parameters: {'model_name': 'SimpleImputer', 'strategy': 'mean'}. Best is trial 6 with value: 2406.7086271118064.
[I 2024-02-27 21:49:35,053] Trial 172 finished with value: 2406.7086271118064 and parameters: {'model_name': 'SimpleImputer', 'strategy': 'mean'}. Best is trial 6 with value: 2406.7086271118064.
[I 2024-02-27 21:49:35,272] Trial 163 finished with value: 2406.7086271118064 and parameters: {'model_name': 'SimpleImputer', 'strategy': 'mean'}. Best is trial 6 with value: 2406.7086271118064.
[I 2024-02-27 21:49:35,486] Trial 170 finished with value: 2406.7086271118064 and parameters: {'model_name': 'SimpleImputer', 'strategy': 'mean'}. Best is trial 6 with value: 2406.7086271118064.
[I 2024-02-27 21:49:35,683] Trial 162 finished with value: 2406.7086271118064 and parameters: {'model_name': 'SimpleImputer', 'strategy': 'mean'}. Best is trial 6 with value: 2406.7086271118064.
[I 2024-02-27 21:49:35,877] Trial 159 finished with value: 2406.7086271118064 and parameters: {'model_name': 'SimpleImputer', 'strategy': 'mean'}. Best is trial 6 with value: 2406.7086271118064.
[I 2024-02-27 21:49:36,137] Trial 165 finished with value: 2406.7086271118064 and parameters: {'model_name': 'SimpleImputer', 'strategy': 'mean'}. Best is trial 6 with value: 2406.7086271118064.
[I 2024-02-27 21:49:36,344] Trial 173 finished with value: 2406.7086271118064 and parameters: {'model_name': 'SimpleImputer', 'strategy': 'mean'}. Best is trial 6 with value: 2406.7086271118064.
[I 2024-02-27 21:49:36,350] Trial 168 finished with value: 2406.7086271118064 and parameters: {'model_name': 'SimpleImputer', 'strategy': 'mean'}. Best is trial 6 with value: 2406.7086271118064.
[I 2024-02-27 21:49:36,585] Trial 164 finished with value: 2406.7086271118064 and parameters: {'model_name': 'SimpleImputer', 'strategy': 'mean'}. Best is trial 6 with value: 2406.7086271118064.
[I 2024-02-27 21:49:37,031] Trial 175 finished with value: 2406.7086271118064 and parameters: {'model_name': 'SimpleImputer', 'strategy': 'mean'}. Best is trial 6 with value: 2406.7086271118064.
[I 2024-02-27 21:49:37,268] Trial 169 finished with value: 2406.7086271118064 and parameters: {'model_name': 'SimpleImputer', 'strategy': 'mean'}. Best is trial 6 with value: 2406.7086271118064.
[I 2024-02-27 21:49:37,550] Trial 177 finished with value: 2406.7086271118064 and parameters: {'model_name': 'SimpleImputer', 'strategy': 'mean'}. Best is trial 6 with value: 2406.7086271118064.
[I 2024-02-27 21:49:37,865] Trial 171 finished with value: 2406.7086271118064 and parameters: {'model_name': 'SimpleImputer', 'strategy': 'mean'}. Best is trial 6 with value: 2406.7086271118064.
[I 2024-02-27 21:49:38,129] Trial 176 finished with value: 2406.7086271118064 and parameters: {'model_name': 'SimpleImputer', 'strategy': 'mean'}. Best is trial 6 with value: 2406.7086271118064.
[I 2024-02-27 21:49:38,378] Trial 174 finished with value: 2406.7086271118064 and parameters: {'model_name': 'SimpleImputer', 'strategy': 'mean'}. Best is trial 6 with value: 2406.7086271118064.
[I 2024-02-27 21:49:38,626] Trial 178 finished with value: 2406.7086271118064 and parameters: {'model_name': 'SimpleImputer', 'strategy': 'mean'}. Best is trial 6 with value: 2406.7086271118064.
[I 2024-02-27 21:49:38,826] Trial 181 finished with value: 2406.7086271118064 and parameters: {'model_name': 'SimpleImputer', 'strategy': 'mean'}. Best is trial 6 with value: 2406.7086271118064.
[I 2024-02-27 21:49:39,036] Trial 182 finished with value: 2406.7086271118064 and parameters: {'model_name': 'SimpleImputer', 'strategy': 'mean'}. Best is trial 6 with value: 2406.7086271118064.
[I 2024-02-27 21:49:39,254] Trial 185 finished with value: 2406.7086271118064 and parameters: {'model_name': 'SimpleImputer', 'strategy': 'mean'}. Best is trial 6 with value: 2406.7086271118064.
[I 2024-02-27 21:49:39,481] Trial 179 finished with value: 2406.7086271118064 and parameters: {'model_name': 'SimpleImputer', 'strategy': 'mean'}. Best is trial 6 with value: 2406.7086271118064.
[I 2024-02-27 21:49:39,759] Trial 183 finished with value: 2406.7086271118064 and parameters: {'model_name': 'SimpleImputer', 'strategy': 'mean'}. Best is trial 6 with value: 2406.7086271118064.
[I 2024-02-27 21:49:40,024] Trial 180 finished with value: 2406.7086271118064 and parameters: {'model_name': 'SimpleImputer', 'strategy': 'mean'}. Best is trial 6 with value: 2406.7086271118064.
[I 2024-02-27 21:49:40,198] Trial 188 finished with value: 2406.7086271118064 and parameters: {'model_name': 'SimpleImputer', 'strategy': 'mean'}. Best is trial 6 with value: 2406.7086271118064.
[I 2024-02-27 21:49:40,356] Trial 187 finished with value: 2406.7086271118064 and parameters: {'model_name': 'SimpleImputer', 'strategy': 'mean'}. Best is trial 6 with value: 2406.7086271118064.
[I 2024-02-27 21:49:40,615] Trial 199 finished with value: 2541.9945877854916 and parameters: {'model_name': 'SimpleImputer', 'strategy': 'constant'}. Best is trial 6 with value: 2406.7086271118064.
[I 2024-02-27 21:49:40,793] Trial 186 finished with value: 2406.7086271118064 and parameters: {'model_name': 'SimpleImputer', 'strategy': 'mean'}. Best is trial 6 with value: 2406.7086271118064.
[I 2024-02-27 21:49:41,029] Trial 196 finished with value: 2541.9945877854916 and parameters: {'model_name': 'SimpleImputer', 'strategy': 'constant'}. Best is trial 6 with value: 2406.7086271118064.
[I 2024-02-27 21:49:41,271] Trial 184 finished with value: 2406.7086271118064 and parameters: {'model_name': 'SimpleImputer', 'strategy': 'mean'}. Best is trial 6 with value: 2406.7086271118064.
[I 2024-02-27 21:49:41,502] Trial 190 finished with value: 2406.7086271118064 and parameters: {'model_name': 'SimpleImputer', 'strategy': 'mean'}. Best is trial 6 with value: 2406.7086271118064.
[I 2024-02-27 21:49:41,703] Trial 189 finished with value: 2406.7086271118064 and parameters: {'model_name': 'SimpleImputer', 'strategy': 'mean'}. Best is trial 6 with value: 2406.7086271118064.
[I 2024-02-27 21:49:41,938] Trial 191 finished with value: 2406.7086271118064 and parameters: {'model_name': 'SimpleImputer', 'strategy': 'mean'}. Best is trial 6 with value: 2406.7086271118064.
[I 2024-02-27 21:49:42,122] Trial 192 finished with value: 2406.7086271118064 and parameters: {'model_name': 'SimpleImputer', 'strategy': 'mean'}. Best is trial 6 with value: 2406.7086271118064.
[I 2024-02-27 21:49:42,353] Trial 197 finished with value: 2541.9945877854916 and parameters: {'model_name': 'SimpleImputer', 'strategy': 'constant'}. Best is trial 6 with value: 2406.7086271118064.
[I 2024-02-27 21:49:42,593] Trial 193 finished with value: 2406.7086271118064 and parameters: {'model_name': 'SimpleImputer', 'strategy': 'mean'}. Best is trial 6 with value: 2406.7086271118064.
[I 2024-02-27 21:49:42,818] Trial 195 finished with value: 2406.7086271118064 and parameters: {'model_name': 'SimpleImputer', 'strategy': 'mean'}. Best is trial 6 with value: 2406.7086271118064.
[I 2024-02-27 21:49:42,992] Trial 194 finished with value: 2406.7086271118064 and parameters: {'model_name': 'SimpleImputer', 'strategy': 'mean'}. Best is trial 6 with value: 2406.7086271118064.
