Run: 8
/cm/local/apps/slurm/var/spool/job693816/slurm_script: line 23: /common/ketrong/minconda3/etc/profile.d/conda.sh: No such file or directory
/cm/local/apps/slurm/var/spool/job693816/slurm_script: line 26: $'\nconda create --name tpot2devenv -c conda-forge python=3.10\n': command not found
/cm/local/apps/slurm/var/spool/job693816/slurm_script: line 31: $'\npip install -r requirements.txt\n': command not found
RunStart
2024-03-01 04:26:47.306865: I tensorflow/core/util/port.cc:113] oneDNN custom operations are on. You may see slightly different numerical results due to floating-point round-off errors from different computation orders. To turn them off, set the environment variable `TF_ENABLE_ONEDNN_OPTS=0`.
2024-03-01 04:26:47.341027: E external/local_xla/xla/stream_executor/cuda/cuda_dnn.cc:9261] Unable to register cuDNN factory: Attempting to register factory for plugin cuDNN when one has already been registered
2024-03-01 04:26:47.341048: E external/local_xla/xla/stream_executor/cuda/cuda_fft.cc:607] Unable to register cuFFT factory: Attempting to register factory for plugin cuFFT when one has already been registered
2024-03-01 04:26:47.342179: E external/local_xla/xla/stream_executor/cuda/cuda_blas.cc:1515] Unable to register cuBLAS factory: Attempting to register factory for plugin cuBLAS when one has already been registered
2024-03-01 04:26:47.347612: I tensorflow/core/platform/cpu_feature_guard.cc:182] This TensorFlow binary is optimized to use available CPU instructions in performance-critical operations.
To enable the following instructions: AVX2 AVX512F AVX512_VNNI FMA, in other operations, rebuild TensorFlow with the appropriate compiler flags.
2024-03-01 04:26:49.361936: W tensorflow/compiler/tf2tensorrt/utils/py_utils.cc:38] TF-TRT Warning: Could not find TensorRT
WARNING:tensorflow:From /home/ketrong/miniconda3/envs/tpot2devenv/lib/python3.10/site-packages/tensorflow/python/compat/v2_compat.py:108: disable_resource_variables (from tensorflow.python.ops.variable_scope) is deprecated and will be removed in a future version.
Instructions for updating:
non-resource variables are not supported in the long term
starting loops
working on 
logs/7323/tpot2_base_normal_MAR_0.3
0.9377710819244385
loading data
logs/7323/tpot2_base_normal_MAR_0.3/data/7323_True.pkl
8331      0.718133
3288     28.456525
7078     28.705247
13016    29.355557
9368     38.330217
           ...    
7055      1.345474
7499     35.510055
2691      1.908352
1238      0.798811
240      54.993151
Name: class, Length: 15746, dtype: float64
              0   ...   11
0      64.383854  ...  1.0
1      47.011862  ...  0.0
2      62.974394  ...  0.0
3      49.599056  ...  0.0
4      59.742924  ...  0.0
...          ...  ...  ...
15741  62.212419  ...  1.0
15742  56.708329  ...  0.0
15743  61.490196  ...  1.0
15744  72.473776  ...  0.0
15745  65.042925  ...  0.0

[15746 rows x 12 columns]
             0   ...   11
0     48.772991  ...  0.0
1     68.777309  ...  0.0
2     68.137039  ...  1.0
3     50.450310  ...  0.0
4     52.918604  ...  0.0
...         ...  ...  ...
1745  59.548575  ...  0.0
1746  81.648665  ...  0.0
1747  63.717192  ...  0.0
1748  62.440365  ...  0.0
1749  60.794579  ...  0.0

[1750 rows x 12 columns]
running experiment 1/3 - Does large hyperparameter space improve reconstruction accuracy over simple
[I 2024-03-01 04:27:03,417] A new study created in memory with name: no-name-2d1cd7f8-416e-431d-b9f0-c5cf8bc2407b
[I 2024-03-01 04:27:04,769] Trial 9 finished with value: 22.230146692711365 and parameters: {'model_name': 'SimpleImputer', 'strategy': 'constant'}. Best is trial 9 with value: 22.230146692711365.
[I 2024-03-01 04:27:05,133] Trial 4 finished with value: 22.230146692711365 and parameters: {'model_name': 'SimpleImputer', 'strategy': 'constant'}. Best is trial 9 with value: 22.230146692711365.
[I 2024-03-01 04:27:05,388] Trial 7 finished with value: 22.230146692711365 and parameters: {'model_name': 'SimpleImputer', 'strategy': 'constant'}. Best is trial 9 with value: 22.230146692711365.
[I 2024-03-01 04:27:05,728] Trial 12 finished with value: 22.230146692711365 and parameters: {'model_name': 'SimpleImputer', 'strategy': 'constant'}. Best is trial 9 with value: 22.230146692711365.
[I 2024-03-01 04:27:06,050] Trial 8 finished with value: 22.230146692711365 and parameters: {'model_name': 'SimpleImputer', 'strategy': 'constant'}. Best is trial 9 with value: 22.230146692711365.
[I 2024-03-01 04:27:06,446] Trial 23 finished with value: 22.230146692711365 and parameters: {'model_name': 'SimpleImputer', 'strategy': 'constant'}. Best is trial 9 with value: 22.230146692711365.
[I 2024-03-01 04:27:06,759] Trial 22 finished with value: 22.230146692711365 and parameters: {'model_name': 'SimpleImputer', 'strategy': 'constant'}. Best is trial 9 with value: 22.230146692711365.
[I 2024-03-01 04:27:07,017] Trial 36 finished with value: 22.230146692711365 and parameters: {'model_name': 'SimpleImputer', 'strategy': 'constant'}. Best is trial 9 with value: 22.230146692711365.
[I 2024-03-01 04:27:07,324] Trial 37 finished with value: 22.230146692711365 and parameters: {'model_name': 'SimpleImputer', 'strategy': 'constant'}. Best is trial 9 with value: 22.230146692711365.
[I 2024-03-01 04:27:07,649] Trial 3 finished with value: 7.551551802523621 and parameters: {'model_name': 'SimpleImputer', 'strategy': 'mean'}. Best is trial 3 with value: 7.551551802523621.
[I 2024-03-01 04:27:07,916] Trial 21 finished with value: 7.551551802523621 and parameters: {'model_name': 'SimpleImputer', 'strategy': 'mean'}. Best is trial 3 with value: 7.551551802523621.
[I 2024-03-01 04:27:08,265] Trial 18 finished with value: 7.551551802523621 and parameters: {'model_name': 'SimpleImputer', 'strategy': 'mean'}. Best is trial 3 with value: 7.551551802523621.
[I 2024-03-01 04:27:08,551] Trial 33 finished with value: 22.230146692711365 and parameters: {'model_name': 'SimpleImputer', 'strategy': 'constant'}. Best is trial 3 with value: 7.551551802523621.
[I 2024-03-01 04:27:08,729] Trial 1 finished with value: 7.551551802523621 and parameters: {'model_name': 'SimpleImputer', 'strategy': 'mean'}. Best is trial 3 with value: 7.551551802523621.
[I 2024-03-01 04:27:08,986] Trial 17 finished with value: 7.551551802523621 and parameters: {'model_name': 'SimpleImputer', 'strategy': 'mean'}. Best is trial 3 with value: 7.551551802523621.
[I 2024-03-01 04:27:09,357] Trial 10 finished with value: 7.551551802523621 and parameters: {'model_name': 'SimpleImputer', 'strategy': 'mean'}. Best is trial 3 with value: 7.551551802523621.
[I 2024-03-01 04:27:09,855] Trial 40 finished with value: 7.551551802523621 and parameters: {'model_name': 'SimpleImputer', 'strategy': 'mean'}. Best is trial 3 with value: 7.551551802523621.
[I 2024-03-01 04:27:10,183] Trial 13 finished with value: 7.551551802523621 and parameters: {'model_name': 'SimpleImputer', 'strategy': 'mean'}. Best is trial 3 with value: 7.551551802523621.
[I 2024-03-01 04:27:10,575] Trial 38 finished with value: 7.551551802523621 and parameters: {'model_name': 'SimpleImputer', 'strategy': 'mean'}. Best is trial 3 with value: 7.551551802523621.
[I 2024-03-01 04:27:10,864] Trial 28 finished with value: 7.551551802523621 and parameters: {'model_name': 'SimpleImputer', 'strategy': 'mean'}. Best is trial 3 with value: 7.551551802523621.
[I 2024-03-01 04:27:11,234] Trial 6 finished with value: 4.1717799707322785 and parameters: {'model_name': 'SimpleImputer', 'strategy': 'median'}. Best is trial 6 with value: 4.1717799707322785.
[I 2024-03-01 04:27:11,592] Trial 31 finished with value: 7.551551802523621 and parameters: {'model_name': 'SimpleImputer', 'strategy': 'mean'}. Best is trial 6 with value: 4.1717799707322785.
[I 2024-03-01 04:27:11,871] Trial 0 finished with value: 4.1717799707322785 and parameters: {'model_name': 'SimpleImputer', 'strategy': 'median'}. Best is trial 6 with value: 4.1717799707322785.
[I 2024-03-01 04:27:12,165] Trial 46 finished with value: 7.551551802523621 and parameters: {'model_name': 'SimpleImputer', 'strategy': 'mean'}. Best is trial 6 with value: 4.1717799707322785.
[I 2024-03-01 04:27:12,336] Trial 32 finished with value: 7.551551802523621 and parameters: {'model_name': 'SimpleImputer', 'strategy': 'mean'}. Best is trial 6 with value: 4.1717799707322785.
[I 2024-03-01 04:27:12,891] Trial 49 finished with value: 22.230146692711365 and parameters: {'model_name': 'SimpleImputer', 'strategy': 'constant'}. Best is trial 6 with value: 4.1717799707322785.
[I 2024-03-01 04:27:13,066] Trial 44 finished with value: 7.551551802523621 and parameters: {'model_name': 'SimpleImputer', 'strategy': 'mean'}. Best is trial 6 with value: 4.1717799707322785.
[I 2024-03-01 04:27:13,232] Trial 27 finished with value: 4.1717799707322785 and parameters: {'model_name': 'SimpleImputer', 'strategy': 'median'}. Best is trial 6 with value: 4.1717799707322785.
[I 2024-03-01 04:27:13,453] Trial 15 finished with value: 4.1717799707322785 and parameters: {'model_name': 'SimpleImputer', 'strategy': 'median'}. Best is trial 6 with value: 4.1717799707322785.
[I 2024-03-01 04:27:13,730] Trial 20 finished with value: 4.1717799707322785 and parameters: {'model_name': 'SimpleImputer', 'strategy': 'median'}. Best is trial 6 with value: 4.1717799707322785.
[I 2024-03-01 04:27:13,929] Trial 26 finished with value: 4.1717799707322785 and parameters: {'model_name': 'SimpleImputer', 'strategy': 'median'}. Best is trial 6 with value: 4.1717799707322785.
[I 2024-03-01 04:27:14,155] Trial 14 finished with value: 4.1717799707322785 and parameters: {'model_name': 'SimpleImputer', 'strategy': 'median'}. Best is trial 6 with value: 4.1717799707322785.
[I 2024-03-01 04:27:14,348] Trial 48 finished with value: 22.230146692711365 and parameters: {'model_name': 'SimpleImputer', 'strategy': 'constant'}. Best is trial 6 with value: 4.1717799707322785.
[I 2024-03-01 04:27:14,750] Trial 55 finished with value: 22.230146692711365 and parameters: {'model_name': 'SimpleImputer', 'strategy': 'constant'}. Best is trial 6 with value: 4.1717799707322785.
[I 2024-03-01 04:27:15,020] Trial 35 finished with value: 4.1717799707322785 and parameters: {'model_name': 'SimpleImputer', 'strategy': 'median'}. Best is trial 6 with value: 4.1717799707322785.
[I 2024-03-01 04:27:15,315] Trial 34 finished with value: 4.1717799707322785 and parameters: {'model_name': 'SimpleImputer', 'strategy': 'median'}. Best is trial 6 with value: 4.1717799707322785.
[I 2024-03-01 04:27:15,638] Trial 43 finished with value: 4.1717799707322785 and parameters: {'model_name': 'SimpleImputer', 'strategy': 'median'}. Best is trial 6 with value: 4.1717799707322785.
[I 2024-03-01 04:27:16,014] Trial 29 finished with value: 4.1717799707322785 and parameters: {'model_name': 'SimpleImputer', 'strategy': 'median'}. Best is trial 6 with value: 4.1717799707322785.
[I 2024-03-01 04:27:16,320] Trial 19 finished with value: 4.1717799707322785 and parameters: {'model_name': 'SimpleImputer', 'strategy': 'median'}. Best is trial 6 with value: 4.1717799707322785.
[I 2024-03-01 04:27:16,619] Trial 56 finished with value: 7.551551802523621 and parameters: {'model_name': 'SimpleImputer', 'strategy': 'mean'}. Best is trial 6 with value: 4.1717799707322785.
[I 2024-03-01 04:27:16,911] Trial 45 finished with value: 4.1717799707322785 and parameters: {'model_name': 'SimpleImputer', 'strategy': 'median'}. Best is trial 6 with value: 4.1717799707322785.
[I 2024-03-01 04:27:17,200] Trial 51 finished with value: 7.551551802523621 and parameters: {'model_name': 'SimpleImputer', 'strategy': 'mean'}. Best is trial 6 with value: 4.1717799707322785.
[I 2024-03-01 04:27:17,411] Trial 42 finished with value: 4.1717799707322785 and parameters: {'model_name': 'SimpleImputer', 'strategy': 'median'}. Best is trial 6 with value: 4.1717799707322785.
[I 2024-03-01 04:27:17,683] Trial 59 finished with value: 7.551551802523621 and parameters: {'model_name': 'SimpleImputer', 'strategy': 'mean'}. Best is trial 6 with value: 4.1717799707322785.
[I 2024-03-01 04:27:17,965] Trial 58 finished with value: 7.551551802523621 and parameters: {'model_name': 'SimpleImputer', 'strategy': 'mean'}. Best is trial 6 with value: 4.1717799707322785.
[I 2024-03-01 04:27:18,249] Trial 57 finished with value: 7.551551802523621 and parameters: {'model_name': 'SimpleImputer', 'strategy': 'mean'}. Best is trial 6 with value: 4.1717799707322785.
[I 2024-03-01 04:27:19,320] Trial 52 finished with value: 4.1717799707322785 and parameters: {'model_name': 'SimpleImputer', 'strategy': 'median'}. Best is trial 6 with value: 4.1717799707322785.
[I 2024-03-01 04:27:20,147] Trial 63 finished with value: 4.1717799707322785 and parameters: {'model_name': 'SimpleImputer', 'strategy': 'median'}. Best is trial 6 with value: 4.1717799707322785.
[I 2024-03-01 04:27:20,338] Trial 62 finished with value: 4.1717799707322785 and parameters: {'model_name': 'SimpleImputer', 'strategy': 'median'}. Best is trial 6 with value: 4.1717799707322785.
[I 2024-03-01 04:27:20,693] Trial 66 finished with value: 4.1717799707322785 and parameters: {'model_name': 'SimpleImputer', 'strategy': 'median'}. Best is trial 6 with value: 4.1717799707322785.
[I 2024-03-01 04:27:20,993] Trial 65 finished with value: 4.1717799707322785 and parameters: {'model_name': 'SimpleImputer', 'strategy': 'median'}. Best is trial 6 with value: 4.1717799707322785.
[I 2024-03-01 04:27:21,253] Trial 67 finished with value: 4.1717799707322785 and parameters: {'model_name': 'SimpleImputer', 'strategy': 'median'}. Best is trial 6 with value: 4.1717799707322785.
[I 2024-03-01 04:27:21,646] Trial 71 finished with value: 4.1717799707322785 and parameters: {'model_name': 'SimpleImputer', 'strategy': 'median'}. Best is trial 6 with value: 4.1717799707322785.
[I 2024-03-01 04:27:22,169] Trial 68 finished with value: 4.1717799707322785 and parameters: {'model_name': 'SimpleImputer', 'strategy': 'median'}. Best is trial 6 with value: 4.1717799707322785.
[I 2024-03-01 04:27:22,440] Trial 69 finished with value: 4.1717799707322785 and parameters: {'model_name': 'SimpleImputer', 'strategy': 'median'}. Best is trial 6 with value: 4.1717799707322785.
[I 2024-03-01 04:27:22,778] Trial 72 finished with value: 4.1717799707322785 and parameters: {'model_name': 'SimpleImputer', 'strategy': 'median'}. Best is trial 6 with value: 4.1717799707322785.
[I 2024-03-01 04:27:23,076] Trial 77 finished with value: 4.1717799707322785 and parameters: {'model_name': 'SimpleImputer', 'strategy': 'median'}. Best is trial 6 with value: 4.1717799707322785.
[I 2024-03-01 04:27:23,375] Trial 75 finished with value: 4.1717799707322785 and parameters: {'model_name': 'SimpleImputer', 'strategy': 'median'}. Best is trial 6 with value: 4.1717799707322785.
[I 2024-03-01 04:27:23,607] Trial 73 finished with value: 4.1717799707322785 and parameters: {'model_name': 'SimpleImputer', 'strategy': 'median'}. Best is trial 6 with value: 4.1717799707322785.
[I 2024-03-01 04:27:23,859] Trial 78 finished with value: 4.1717799707322785 and parameters: {'model_name': 'SimpleImputer', 'strategy': 'median'}. Best is trial 6 with value: 4.1717799707322785.
[I 2024-03-01 04:27:24,146] Trial 70 finished with value: 4.1717799707322785 and parameters: {'model_name': 'SimpleImputer', 'strategy': 'median'}. Best is trial 6 with value: 4.1717799707322785.
[I 2024-03-01 04:27:24,491] Trial 74 finished with value: 4.1717799707322785 and parameters: {'model_name': 'SimpleImputer', 'strategy': 'median'}. Best is trial 6 with value: 4.1717799707322785.
[I 2024-03-01 04:27:24,697] Trial 80 finished with value: 4.1717799707322785 and parameters: {'model_name': 'SimpleImputer', 'strategy': 'median'}. Best is trial 6 with value: 4.1717799707322785.
[I 2024-03-01 04:27:24,880] Trial 16 finished with value: 22.220038657497085 and parameters: {'model_name': 'SimpleImputer', 'strategy': 'most_frequent'}. Best is trial 6 with value: 4.1717799707322785.
[I 2024-03-01 04:27:25,062] Trial 76 finished with value: 4.1717799707322785 and parameters: {'model_name': 'SimpleImputer', 'strategy': 'median'}. Best is trial 6 with value: 4.1717799707322785.
[I 2024-03-01 04:27:25,349] Trial 11 finished with value: 22.220038657497085 and parameters: {'model_name': 'SimpleImputer', 'strategy': 'most_frequent'}. Best is trial 6 with value: 4.1717799707322785.
[I 2024-03-01 04:27:25,606] Trial 79 finished with value: 4.1717799707322785 and parameters: {'model_name': 'SimpleImputer', 'strategy': 'median'}. Best is trial 6 with value: 4.1717799707322785.
[I 2024-03-01 04:27:26,016] Trial 2 finished with value: 22.220038657497085 and parameters: {'model_name': 'SimpleImputer', 'strategy': 'most_frequent'}. Best is trial 6 with value: 4.1717799707322785.
[I 2024-03-01 04:27:26,444] Trial 41 finished with value: 22.220038657497085 and parameters: {'model_name': 'SimpleImputer', 'strategy': 'most_frequent'}. Best is trial 6 with value: 4.1717799707322785.
[I 2024-03-01 04:27:26,635] Trial 5 finished with value: 22.220038657497085 and parameters: {'model_name': 'SimpleImputer', 'strategy': 'most_frequent'}. Best is trial 6 with value: 4.1717799707322785.
[I 2024-03-01 04:27:26,965] Trial 25 finished with value: 22.220038657497085 and parameters: {'model_name': 'SimpleImputer', 'strategy': 'most_frequent'}. Best is trial 6 with value: 4.1717799707322785.
[I 2024-03-01 04:27:27,278] Trial 81 finished with value: 4.1717799707322785 and parameters: {'model_name': 'SimpleImputer', 'strategy': 'median'}. Best is trial 6 with value: 4.1717799707322785.
[I 2024-03-01 04:27:27,562] Trial 91 finished with value: 4.1717799707322785 and parameters: {'model_name': 'SimpleImputer', 'strategy': 'median'}. Best is trial 6 with value: 4.1717799707322785.
[I 2024-03-01 04:27:28,100] Trial 47 finished with value: 22.220038657497085 and parameters: {'model_name': 'SimpleImputer', 'strategy': 'most_frequent'}. Best is trial 6 with value: 4.1717799707322785.
[I 2024-03-01 04:27:28,354] Trial 24 finished with value: 22.220038657497085 and parameters: {'model_name': 'SimpleImputer', 'strategy': 'most_frequent'}. Best is trial 6 with value: 4.1717799707322785.
[I 2024-03-01 04:27:28,656] Trial 39 finished with value: 22.220038657497085 and parameters: {'model_name': 'SimpleImputer', 'strategy': 'most_frequent'}. Best is trial 6 with value: 4.1717799707322785.
[I 2024-03-01 04:27:29,165] Trial 30 finished with value: 22.220038657497085 and parameters: {'model_name': 'SimpleImputer', 'strategy': 'most_frequent'}. Best is trial 6 with value: 4.1717799707322785.
[I 2024-03-01 04:27:30,166] Trial 60 finished with value: 22.220038657497085 and parameters: {'model_name': 'SimpleImputer', 'strategy': 'most_frequent'}. Best is trial 6 with value: 4.1717799707322785.
[I 2024-03-01 04:27:30,568] Trial 53 finished with value: 22.220038657497085 and parameters: {'model_name': 'SimpleImputer', 'strategy': 'most_frequent'}. Best is trial 6 with value: 4.1717799707322785.
[I 2024-03-01 04:27:30,805] Trial 54 finished with value: 22.220038657497085 and parameters: {'model_name': 'SimpleImputer', 'strategy': 'most_frequent'}. Best is trial 6 with value: 4.1717799707322785.
[I 2024-03-01 04:27:31,044] Trial 100 finished with value: 4.1717799707322785 and parameters: {'model_name': 'SimpleImputer', 'strategy': 'median'}. Best is trial 6 with value: 4.1717799707322785.
[I 2024-03-01 04:27:31,262] Trial 61 finished with value: 22.220038657497085 and parameters: {'model_name': 'SimpleImputer', 'strategy': 'most_frequent'}. Best is trial 6 with value: 4.1717799707322785.
[I 2024-03-01 04:27:32,073] Trial 64 finished with value: 22.220038657497085 and parameters: {'model_name': 'SimpleImputer', 'strategy': 'most_frequent'}. Best is trial 6 with value: 4.1717799707322785.
[I 2024-03-01 04:27:32,641] Trial 89 finished with value: 22.220038657497085 and parameters: {'model_name': 'SimpleImputer', 'strategy': 'most_frequent'}. Best is trial 6 with value: 4.1717799707322785.
[I 2024-03-01 04:27:33,063] Trial 118 finished with value: 4.1717799707322785 and parameters: {'model_name': 'SimpleImputer', 'strategy': 'median'}. Best is trial 6 with value: 4.1717799707322785.
[I 2024-03-01 04:27:33,338] Trial 50 finished with value: 22.220038657497085 and parameters: {'model_name': 'SimpleImputer', 'strategy': 'most_frequent'}. Best is trial 6 with value: 4.1717799707322785.
[I 2024-03-01 04:27:33,916] Trial 83 finished with value: 22.220038657497085 and parameters: {'model_name': 'SimpleImputer', 'strategy': 'most_frequent'}. Best is trial 6 with value: 4.1717799707322785.
[I 2024-03-01 04:27:34,588] Trial 88 finished with value: 22.220038657497085 and parameters: {'model_name': 'SimpleImputer', 'strategy': 'most_frequent'}. Best is trial 6 with value: 4.1717799707322785.
[I 2024-03-01 04:27:34,902] Trial 119 finished with value: 4.1717799707322785 and parameters: {'model_name': 'SimpleImputer', 'strategy': 'median'}. Best is trial 6 with value: 4.1717799707322785.
[I 2024-03-01 04:27:35,176] Trial 93 finished with value: 22.220038657497085 and parameters: {'model_name': 'SimpleImputer', 'strategy': 'most_frequent'}. Best is trial 6 with value: 4.1717799707322785.
[I 2024-03-01 04:27:35,426] Trial 82 finished with value: 22.220038657497085 and parameters: {'model_name': 'SimpleImputer', 'strategy': 'most_frequent'}. Best is trial 6 with value: 4.1717799707322785.
[I 2024-03-01 04:27:35,623] Trial 122 finished with value: 4.1717799707322785 and parameters: {'model_name': 'SimpleImputer', 'strategy': 'median'}. Best is trial 6 with value: 4.1717799707322785.
[I 2024-03-01 04:27:35,925] Trial 121 finished with value: 4.1717799707322785 and parameters: {'model_name': 'SimpleImputer', 'strategy': 'median'}. Best is trial 6 with value: 4.1717799707322785.
[I 2024-03-01 04:27:36,260] Trial 123 finished with value: 4.1717799707322785 and parameters: {'model_name': 'SimpleImputer', 'strategy': 'median'}. Best is trial 6 with value: 4.1717799707322785.
