Run: 3
/cm/local/apps/slurm/var/spool/job692169/slurm_script: line 23: /common/ketrong/minconda3/etc/profile.d/conda.sh: No such file or directory
/cm/local/apps/slurm/var/spool/job692169/slurm_script: line 26: $'\nconda create --name tpot2devenv -c conda-forge python=3.10\n': command not found
/cm/local/apps/slurm/var/spool/job692169/slurm_script: line 31: $'\npip install -r requirements.txt\n': command not found
RunStart
2024-02-29 11:46:17.927470: I tensorflow/core/util/port.cc:113] oneDNN custom operations are on. You may see slightly different numerical results due to floating-point round-off errors from different computation orders. To turn them off, set the environment variable `TF_ENABLE_ONEDNN_OPTS=0`.
2024-02-29 11:46:17.962307: E external/local_xla/xla/stream_executor/cuda/cuda_dnn.cc:9261] Unable to register cuDNN factory: Attempting to register factory for plugin cuDNN when one has already been registered
2024-02-29 11:46:17.962329: E external/local_xla/xla/stream_executor/cuda/cuda_fft.cc:607] Unable to register cuFFT factory: Attempting to register factory for plugin cuFFT when one has already been registered
2024-02-29 11:46:17.963458: E external/local_xla/xla/stream_executor/cuda/cuda_blas.cc:1515] Unable to register cuBLAS factory: Attempting to register factory for plugin cuBLAS when one has already been registered
2024-02-29 11:46:17.968891: I tensorflow/core/platform/cpu_feature_guard.cc:182] This TensorFlow binary is optimized to use available CPU instructions in performance-critical operations.
To enable the following instructions: AVX2 AVX512F AVX512_VNNI FMA, in other operations, rebuild TensorFlow with the appropriate compiler flags.
2024-02-29 11:46:19.962113: W tensorflow/compiler/tf2tensorrt/utils/py_utils.cc:38] TF-TRT Warning: Could not find TensorRT
WARNING:tensorflow:From /home/ketrong/miniconda3/envs/tpot2devenv/lib/python3.10/site-packages/tensorflow/python/compat/v2_compat.py:108: disable_resource_variables (from tensorflow.python.ops.variable_scope) is deprecated and will be removed in a future version.
Instructions for updating:
non-resource variables are not supported in the long term
starting loops
working on 
logs/7320/tpot2_base_normal_MCAR_0.3
0.8243772983551025
loading data
logs/7320/tpot2_base_normal_MCAR_0.3/data/7320_True.pkl
23184    3183.577755
12153    3491.023257
15241    3442.861790
25405    3038.209937
9061     2396.275542
            ...     
8115     2704.214817
10880    1631.511533
6013     3177.954146
7130     2019.041123
15792    2893.909249
Name: class, Length: 27993, dtype: float64
              0   ...   22
0      19.479052  ...  0.0
1      17.049215  ...  0.0
2      30.918546  ...  0.0
3      26.781630  ...  0.0
4      19.249913  ...  0.0
...          ...  ...  ...
27988  17.479747  ...  0.0
27989  20.138694  ...  0.0
27990  22.398782  ...  0.0
27991  20.378255  ...  0.0
27992  31.043061  ...  0.0

[27993 rows x 23 columns]
             0   ...   22
0     21.370901  ...  0.0
1     19.273567  ...  0.0
2     19.984778  ...  1.0
3     32.125706  ...  0.0
4     17.874533  ...  0.0
...         ...  ...  ...
3106  27.464962  ...  0.0
3107  21.173686  ...  0.0
3108  17.548754  ...  0.0
3109  21.066971  ...  0.0
3110  19.569906  ...  0.0

[3111 rows x 23 columns]
running experiment 1/3 - Does large hyperparameter space improve reconstruction accuracy over simple
[I 2024-02-29 11:46:26,654] A new study created in memory with name: no-name-4395fd25-9330-4713-a4dc-bd1cde4f2c4c
[I 2024-02-29 11:46:29,238] Trial 10 finished with value: 23.64724339271243 and parameters: {'model_name': 'SimpleImputer', 'strategy': 'constant'}. Best is trial 10 with value: 23.64724339271243.
[I 2024-02-29 11:46:29,579] Trial 20 finished with value: 23.64724339271243 and parameters: {'model_name': 'SimpleImputer', 'strategy': 'constant'}. Best is trial 10 with value: 23.64724339271243.
[I 2024-02-29 11:46:29,856] Trial 29 finished with value: 23.64724339271243 and parameters: {'model_name': 'SimpleImputer', 'strategy': 'constant'}. Best is trial 10 with value: 23.64724339271243.
[I 2024-02-29 11:46:30,017] Trial 23 finished with value: 23.64724339271243 and parameters: {'model_name': 'SimpleImputer', 'strategy': 'constant'}. Best is trial 10 with value: 23.64724339271243.
[I 2024-02-29 11:46:30,277] Trial 1 finished with value: 8.611631446315494 and parameters: {'model_name': 'SimpleImputer', 'strategy': 'mean'}. Best is trial 1 with value: 8.611631446315494.
[I 2024-02-29 11:46:30,496] Trial 30 finished with value: 23.64724339271243 and parameters: {'model_name': 'SimpleImputer', 'strategy': 'constant'}. Best is trial 1 with value: 8.611631446315494.
[I 2024-02-29 11:46:30,823] Trial 15 finished with value: 8.611631446315494 and parameters: {'model_name': 'SimpleImputer', 'strategy': 'mean'}. Best is trial 1 with value: 8.611631446315494.
[I 2024-02-29 11:46:31,032] Trial 6 finished with value: 8.611631446315494 and parameters: {'model_name': 'SimpleImputer', 'strategy': 'mean'}. Best is trial 1 with value: 8.611631446315494.
[I 2024-02-29 11:46:31,308] Trial 32 finished with value: 8.611631446315494 and parameters: {'model_name': 'SimpleImputer', 'strategy': 'mean'}. Best is trial 1 with value: 8.611631446315494.
[I 2024-02-29 11:46:31,662] Trial 43 finished with value: 23.64724339271243 and parameters: {'model_name': 'SimpleImputer', 'strategy': 'constant'}. Best is trial 1 with value: 8.611631446315494.
[I 2024-02-29 11:46:31,940] Trial 25 finished with value: 8.611631446315494 and parameters: {'model_name': 'SimpleImputer', 'strategy': 'mean'}. Best is trial 1 with value: 8.611631446315494.
[I 2024-02-29 11:46:32,166] Trial 36 finished with value: 8.611631446315494 and parameters: {'model_name': 'SimpleImputer', 'strategy': 'mean'}. Best is trial 1 with value: 8.611631446315494.
[I 2024-02-29 11:46:32,359] Trial 33 finished with value: 8.611631446315494 and parameters: {'model_name': 'SimpleImputer', 'strategy': 'mean'}. Best is trial 1 with value: 8.611631446315494.
[I 2024-02-29 11:46:32,700] Trial 34 finished with value: 8.611631446315494 and parameters: {'model_name': 'SimpleImputer', 'strategy': 'mean'}. Best is trial 1 with value: 8.611631446315494.
[I 2024-02-29 11:46:32,970] Trial 3 finished with value: 8.611631446315494 and parameters: {'model_name': 'SimpleImputer', 'strategy': 'mean'}. Best is trial 1 with value: 8.611631446315494.
[I 2024-02-29 11:46:33,491] Trial 47 finished with value: 8.611631446315494 and parameters: {'model_name': 'SimpleImputer', 'strategy': 'mean'}. Best is trial 1 with value: 8.611631446315494.
[I 2024-02-29 11:46:33,732] Trial 13 finished with value: 6.028764025243425 and parameters: {'model_name': 'SimpleImputer', 'strategy': 'median'}. Best is trial 13 with value: 6.028764025243425.
[I 2024-02-29 11:46:34,009] Trial 7 finished with value: 6.028764025243425 and parameters: {'model_name': 'SimpleImputer', 'strategy': 'median'}. Best is trial 13 with value: 6.028764025243425.
[I 2024-02-29 11:46:34,394] Trial 0 finished with value: 6.028764025243425 and parameters: {'model_name': 'SimpleImputer', 'strategy': 'median'}. Best is trial 13 with value: 6.028764025243425.
[I 2024-02-29 11:46:34,614] Trial 46 finished with value: 8.611631446315494 and parameters: {'model_name': 'SimpleImputer', 'strategy': 'mean'}. Best is trial 13 with value: 6.028764025243425.
[I 2024-02-29 11:46:34,985] Trial 9 finished with value: 6.028764025243425 and parameters: {'model_name': 'SimpleImputer', 'strategy': 'median'}. Best is trial 13 with value: 6.028764025243425.
[I 2024-02-29 11:46:35,160] Trial 16 finished with value: 6.028764025243425 and parameters: {'model_name': 'SimpleImputer', 'strategy': 'median'}. Best is trial 13 with value: 6.028764025243425.
[I 2024-02-29 11:46:35,350] Trial 19 finished with value: 6.028764025243425 and parameters: {'model_name': 'SimpleImputer', 'strategy': 'median'}. Best is trial 13 with value: 6.028764025243425.
[I 2024-02-29 11:46:35,565] Trial 31 finished with value: 6.028764025243425 and parameters: {'model_name': 'SimpleImputer', 'strategy': 'median'}. Best is trial 13 with value: 6.028764025243425.
[I 2024-02-29 11:46:35,780] Trial 21 finished with value: 6.028764025243425 and parameters: {'model_name': 'SimpleImputer', 'strategy': 'median'}. Best is trial 13 with value: 6.028764025243425.
[I 2024-02-29 11:46:35,943] Trial 18 finished with value: 6.028764025243425 and parameters: {'model_name': 'SimpleImputer', 'strategy': 'median'}. Best is trial 13 with value: 6.028764025243425.
[I 2024-02-29 11:46:36,380] Trial 12 finished with value: 6.028764025243425 and parameters: {'model_name': 'SimpleImputer', 'strategy': 'median'}. Best is trial 13 with value: 6.028764025243425.
[I 2024-02-29 11:46:36,765] Trial 5 finished with value: 6.028764025243425 and parameters: {'model_name': 'SimpleImputer', 'strategy': 'median'}. Best is trial 13 with value: 6.028764025243425.
[I 2024-02-29 11:46:37,136] Trial 38 finished with value: 6.028764025243425 and parameters: {'model_name': 'SimpleImputer', 'strategy': 'median'}. Best is trial 13 with value: 6.028764025243425.
[I 2024-02-29 11:46:37,417] Trial 49 finished with value: 23.64724339271243 and parameters: {'model_name': 'SimpleImputer', 'strategy': 'constant'}. Best is trial 13 with value: 6.028764025243425.
[I 2024-02-29 11:46:37,639] Trial 45 finished with value: 6.028764025243425 and parameters: {'model_name': 'SimpleImputer', 'strategy': 'median'}. Best is trial 13 with value: 6.028764025243425.
[I 2024-02-29 11:46:37,896] Trial 48 finished with value: 23.64724339271243 and parameters: {'model_name': 'SimpleImputer', 'strategy': 'constant'}. Best is trial 13 with value: 6.028764025243425.
[I 2024-02-29 11:46:38,110] Trial 41 finished with value: 6.028764025243425 and parameters: {'model_name': 'SimpleImputer', 'strategy': 'median'}. Best is trial 13 with value: 6.028764025243425.
[I 2024-02-29 11:46:38,426] Trial 35 finished with value: 6.028764025243425 and parameters: {'model_name': 'SimpleImputer', 'strategy': 'median'}. Best is trial 13 with value: 6.028764025243425.
[I 2024-02-29 11:46:38,726] Trial 39 finished with value: 6.028764025243425 and parameters: {'model_name': 'SimpleImputer', 'strategy': 'median'}. Best is trial 13 with value: 6.028764025243425.
[I 2024-02-29 11:46:39,014] Trial 50 finished with value: 23.64724339271243 and parameters: {'model_name': 'SimpleImputer', 'strategy': 'constant'}. Best is trial 13 with value: 6.028764025243425.
[I 2024-02-29 11:46:39,296] Trial 37 finished with value: 6.028764025243425 and parameters: {'model_name': 'SimpleImputer', 'strategy': 'median'}. Best is trial 13 with value: 6.028764025243425.
[I 2024-02-29 11:46:39,615] Trial 55 finished with value: 23.64724339271243 and parameters: {'model_name': 'SimpleImputer', 'strategy': 'constant'}. Best is trial 13 with value: 6.028764025243425.
[I 2024-02-29 11:46:40,179] Trial 53 finished with value: 8.611631446315494 and parameters: {'model_name': 'SimpleImputer', 'strategy': 'mean'}. Best is trial 13 with value: 6.028764025243425.
[I 2024-02-29 11:46:40,582] Trial 54 finished with value: 8.611631446315494 and parameters: {'model_name': 'SimpleImputer', 'strategy': 'mean'}. Best is trial 13 with value: 6.028764025243425.
[I 2024-02-29 11:46:40,787] Trial 51 finished with value: 8.611631446315494 and parameters: {'model_name': 'SimpleImputer', 'strategy': 'mean'}. Best is trial 13 with value: 6.028764025243425.
[I 2024-02-29 11:46:42,549] Trial 61 finished with value: 6.028764025243425 and parameters: {'model_name': 'SimpleImputer', 'strategy': 'median'}. Best is trial 13 with value: 6.028764025243425.
[I 2024-02-29 11:46:42,990] Trial 60 finished with value: 6.028764025243425 and parameters: {'model_name': 'SimpleImputer', 'strategy': 'median'}. Best is trial 13 with value: 6.028764025243425.
[I 2024-02-29 11:46:43,228] Trial 58 finished with value: 6.028764025243425 and parameters: {'model_name': 'SimpleImputer', 'strategy': 'median'}. Best is trial 13 with value: 6.028764025243425.
[I 2024-02-29 11:46:43,488] Trial 57 finished with value: 6.028764025243425 and parameters: {'model_name': 'SimpleImputer', 'strategy': 'median'}. Best is trial 13 with value: 6.028764025243425.
[I 2024-02-29 11:46:43,947] Trial 64 finished with value: 6.028764025243425 and parameters: {'model_name': 'SimpleImputer', 'strategy': 'median'}. Best is trial 13 with value: 6.028764025243425.
[I 2024-02-29 11:46:44,219] Trial 59 finished with value: 6.028764025243425 and parameters: {'model_name': 'SimpleImputer', 'strategy': 'median'}. Best is trial 13 with value: 6.028764025243425.
[I 2024-02-29 11:46:44,619] Trial 65 finished with value: 6.028764025243425 and parameters: {'model_name': 'SimpleImputer', 'strategy': 'median'}. Best is trial 13 with value: 6.028764025243425.
[I 2024-02-29 11:46:44,905] Trial 68 finished with value: 6.028764025243425 and parameters: {'model_name': 'SimpleImputer', 'strategy': 'median'}. Best is trial 13 with value: 6.028764025243425.
[I 2024-02-29 11:46:45,233] Trial 62 finished with value: 6.028764025243425 and parameters: {'model_name': 'SimpleImputer', 'strategy': 'median'}. Best is trial 13 with value: 6.028764025243425.
[I 2024-02-29 11:46:45,600] Trial 67 finished with value: 6.028764025243425 and parameters: {'model_name': 'SimpleImputer', 'strategy': 'median'}. Best is trial 13 with value: 6.028764025243425.
[I 2024-02-29 11:46:45,808] Trial 63 finished with value: 6.028764025243425 and parameters: {'model_name': 'SimpleImputer', 'strategy': 'median'}. Best is trial 13 with value: 6.028764025243425.
[I 2024-02-29 11:46:46,160] Trial 69 finished with value: 6.028764025243425 and parameters: {'model_name': 'SimpleImputer', 'strategy': 'median'}. Best is trial 13 with value: 6.028764025243425.
[I 2024-02-29 11:46:46,379] Trial 66 finished with value: 6.028764025243425 and parameters: {'model_name': 'SimpleImputer', 'strategy': 'median'}. Best is trial 13 with value: 6.028764025243425.
[I 2024-02-29 11:46:50,264] Trial 22 finished with value: 23.645870844555127 and parameters: {'model_name': 'SimpleImputer', 'strategy': 'most_frequent'}. Best is trial 13 with value: 6.028764025243425.
[I 2024-02-29 11:46:50,664] Trial 17 finished with value: 23.645870844555127 and parameters: {'model_name': 'SimpleImputer', 'strategy': 'most_frequent'}. Best is trial 13 with value: 6.028764025243425.
[I 2024-02-29 11:46:51,131] Trial 8 finished with value: 23.645870844555127 and parameters: {'model_name': 'SimpleImputer', 'strategy': 'most_frequent'}. Best is trial 13 with value: 6.028764025243425.
[I 2024-02-29 11:46:51,686] Trial 11 finished with value: 23.645870844555127 and parameters: {'model_name': 'SimpleImputer', 'strategy': 'most_frequent'}. Best is trial 13 with value: 6.028764025243425.
[I 2024-02-29 11:46:52,019] Trial 4 finished with value: 23.645870844555127 and parameters: {'model_name': 'SimpleImputer', 'strategy': 'most_frequent'}. Best is trial 13 with value: 6.028764025243425.
[I 2024-02-29 11:46:52,355] Trial 14 finished with value: 23.645870844555127 and parameters: {'model_name': 'SimpleImputer', 'strategy': 'most_frequent'}. Best is trial 13 with value: 6.028764025243425.
[I 2024-02-29 11:46:52,749] Trial 27 finished with value: 23.645870844555127 and parameters: {'model_name': 'SimpleImputer', 'strategy': 'most_frequent'}. Best is trial 13 with value: 6.028764025243425.
[I 2024-02-29 11:46:53,239] Trial 24 finished with value: 23.645870844555127 and parameters: {'model_name': 'SimpleImputer', 'strategy': 'most_frequent'}. Best is trial 13 with value: 6.028764025243425.
[I 2024-02-29 11:46:53,459] Trial 28 finished with value: 23.645870844555127 and parameters: {'model_name': 'SimpleImputer', 'strategy': 'most_frequent'}. Best is trial 13 with value: 6.028764025243425.
[I 2024-02-29 11:46:53,721] Trial 42 finished with value: 23.645870844555127 and parameters: {'model_name': 'SimpleImputer', 'strategy': 'most_frequent'}. Best is trial 13 with value: 6.028764025243425.
[I 2024-02-29 11:46:53,998] Trial 2 finished with value: 23.645870844555127 and parameters: {'model_name': 'SimpleImputer', 'strategy': 'most_frequent'}. Best is trial 13 with value: 6.028764025243425.
[I 2024-02-29 11:46:54,224] Trial 26 finished with value: 23.645870844555127 and parameters: {'model_name': 'SimpleImputer', 'strategy': 'most_frequent'}. Best is trial 13 with value: 6.028764025243425.
[I 2024-02-29 11:46:54,504] Trial 44 finished with value: 23.645870844555127 and parameters: {'model_name': 'SimpleImputer', 'strategy': 'most_frequent'}. Best is trial 13 with value: 6.028764025243425.
[I 2024-02-29 11:46:55,048] Trial 40 finished with value: 23.645870844555127 and parameters: {'model_name': 'SimpleImputer', 'strategy': 'most_frequent'}. Best is trial 13 with value: 6.028764025243425.
[I 2024-02-29 11:46:56,014] Trial 52 finished with value: 23.645870844555127 and parameters: {'model_name': 'SimpleImputer', 'strategy': 'most_frequent'}. Best is trial 13 with value: 6.028764025243425.
[I 2024-02-29 11:46:58,347] Trial 70 finished with value: 23.645870844555127 and parameters: {'model_name': 'SimpleImputer', 'strategy': 'most_frequent'}. Best is trial 13 with value: 6.028764025243425.
[I 2024-02-29 11:46:58,691] Trial 79 finished with value: 23.645870844555127 and parameters: {'model_name': 'SimpleImputer', 'strategy': 'most_frequent'}. Best is trial 13 with value: 6.028764025243425.
[I 2024-02-29 11:46:59,056] Trial 56 finished with value: 23.645870844555127 and parameters: {'model_name': 'SimpleImputer', 'strategy': 'most_frequent'}. Best is trial 13 with value: 6.028764025243425.
[I 2024-02-29 11:46:59,399] Trial 80 finished with value: 23.645870844555127 and parameters: {'model_name': 'SimpleImputer', 'strategy': 'most_frequent'}. Best is trial 13 with value: 6.028764025243425.
[I 2024-02-29 11:46:59,825] Trial 73 finished with value: 23.645870844555127 and parameters: {'model_name': 'SimpleImputer', 'strategy': 'most_frequent'}. Best is trial 13 with value: 6.028764025243425.
[I 2024-02-29 11:47:00,064] Trial 74 finished with value: 23.645870844555127 and parameters: {'model_name': 'SimpleImputer', 'strategy': 'most_frequent'}. Best is trial 13 with value: 6.028764025243425.
[I 2024-02-29 11:47:00,302] Trial 75 finished with value: 23.645870844555127 and parameters: {'model_name': 'SimpleImputer', 'strategy': 'most_frequent'}. Best is trial 13 with value: 6.028764025243425.
[I 2024-02-29 11:47:00,594] Trial 71 finished with value: 23.645870844555127 and parameters: {'model_name': 'SimpleImputer', 'strategy': 'most_frequent'}. Best is trial 13 with value: 6.028764025243425.
[I 2024-02-29 11:47:00,895] Trial 78 finished with value: 23.645870844555127 and parameters: {'model_name': 'SimpleImputer', 'strategy': 'most_frequent'}. Best is trial 13 with value: 6.028764025243425.
[I 2024-02-29 11:47:01,203] Trial 72 finished with value: 23.645870844555127 and parameters: {'model_name': 'SimpleImputer', 'strategy': 'most_frequent'}. Best is trial 13 with value: 6.028764025243425.
[I 2024-02-29 11:47:01,472] Trial 109 finished with value: 6.028764025243425 and parameters: {'model_name': 'SimpleImputer', 'strategy': 'median'}. Best is trial 13 with value: 6.028764025243425.
[I 2024-02-29 11:47:01,705] Trial 86 finished with value: 23.645870844555127 and parameters: {'model_name': 'SimpleImputer', 'strategy': 'most_frequent'}. Best is trial 13 with value: 6.028764025243425.
[I 2024-02-29 11:47:01,920] Trial 83 finished with value: 23.645870844555127 and parameters: {'model_name': 'SimpleImputer', 'strategy': 'most_frequent'}. Best is trial 13 with value: 6.028764025243425.
[I 2024-02-29 11:47:02,340] Trial 111 finished with value: 6.028764025243425 and parameters: {'model_name': 'SimpleImputer', 'strategy': 'median'}. Best is trial 13 with value: 6.028764025243425.
[I 2024-02-29 11:47:02,626] Trial 85 finished with value: 23.645870844555127 and parameters: {'model_name': 'SimpleImputer', 'strategy': 'most_frequent'}. Best is trial 13 with value: 6.028764025243425.
[I 2024-02-29 11:47:02,817] Trial 84 finished with value: 23.645870844555127 and parameters: {'model_name': 'SimpleImputer', 'strategy': 'most_frequent'}. Best is trial 13 with value: 6.028764025243425.
[I 2024-02-29 11:47:03,132] Trial 113 finished with value: 6.028764025243425 and parameters: {'model_name': 'SimpleImputer', 'strategy': 'median'}. Best is trial 13 with value: 6.028764025243425.
[I 2024-02-29 11:47:03,371] Trial 114 finished with value: 6.028764025243425 and parameters: {'model_name': 'SimpleImputer', 'strategy': 'median'}. Best is trial 13 with value: 6.028764025243425.
[I 2024-02-29 11:47:03,584] Trial 115 finished with value: 6.028764025243425 and parameters: {'model_name': 'SimpleImputer', 'strategy': 'median'}. Best is trial 13 with value: 6.028764025243425.
[I 2024-02-29 11:47:03,843] Trial 88 finished with value: 23.645870844555127 and parameters: {'model_name': 'SimpleImputer', 'strategy': 'most_frequent'}. Best is trial 13 with value: 6.028764025243425.
[I 2024-02-29 11:47:04,134] Trial 110 finished with value: 6.028764025243425 and parameters: {'model_name': 'SimpleImputer', 'strategy': 'median'}. Best is trial 13 with value: 6.028764025243425.
[I 2024-02-29 11:47:04,357] Trial 112 finished with value: 6.028764025243425 and parameters: {'model_name': 'SimpleImputer', 'strategy': 'median'}. Best is trial 13 with value: 6.028764025243425.
[I 2024-02-29 11:47:04,674] Trial 77 finished with value: 23.645870844555127 and parameters: {'model_name': 'SimpleImputer', 'strategy': 'most_frequent'}. Best is trial 13 with value: 6.028764025243425.
[I 2024-02-29 11:47:05,017] Trial 81 finished with value: 23.645870844555127 and parameters: {'model_name': 'SimpleImputer', 'strategy': 'most_frequent'}. Best is trial 13 with value: 6.028764025243425.
