[I 2024-02-21 11:24:00,100] Trial 106 finished with value: 15.091139551681518 and parameters: {'model_name': 'SimpleImputer', 'strategy': 'mean'}. Best is trial 0 with value: 15.091139551681518.
[I 2024-02-21 11:24:00,302] Trial 108 finished with value: 15.091139551681518 and parameters: {'model_name': 'SimpleImputer', 'strategy': 'mean'}. Best is trial 0 with value: 15.091139551681518.
[I 2024-02-21 11:24:00,537] Trial 77 finished with value: 15.178555530624598 and parameters: {'model_name': 'SimpleImputer', 'strategy': 'most_frequent'}. Best is trial 0 with value: 15.091139551681518.
[I 2024-02-21 11:24:00,730] Trial 103 finished with value: 15.091139551681518 and parameters: {'model_name': 'SimpleImputer', 'strategy': 'mean'}. Best is trial 0 with value: 15.091139551681518.
[I 2024-02-21 11:24:01,038] Trial 87 finished with value: 15.178555530624598 and parameters: {'model_name': 'SimpleImputer', 'strategy': 'most_frequent'}. Best is trial 0 with value: 15.091139551681518.
[I 2024-02-21 11:24:01,240] Trial 109 finished with value: 15.091139551681518 and parameters: {'model_name': 'SimpleImputer', 'strategy': 'mean'}. Best is trial 0 with value: 15.091139551681518.
[I 2024-02-21 11:24:01,436] Trial 82 finished with value: 15.178555530624598 and parameters: {'model_name': 'SimpleImputer', 'strategy': 'most_frequent'}. Best is trial 0 with value: 15.091139551681518.
[I 2024-02-21 11:24:01,670] Trial 112 finished with value: 15.091139551681518 and parameters: {'model_name': 'SimpleImputer', 'strategy': 'mean'}. Best is trial 0 with value: 15.091139551681518.
[I 2024-02-21 11:24:01,873] Trial 86 finished with value: 15.178555530624598 and parameters: {'model_name': 'SimpleImputer', 'strategy': 'most_frequent'}. Best is trial 0 with value: 15.091139551681518.
[I 2024-02-21 11:24:02,115] Trial 116 finished with value: 15.091139551681518 and parameters: {'model_name': 'SimpleImputer', 'strategy': 'mean'}. Best is trial 0 with value: 15.091139551681518.
[I 2024-02-21 11:24:02,334] Trial 81 finished with value: 15.178555530624598 and parameters: {'model_name': 'SimpleImputer', 'strategy': 'most_frequent'}. Best is trial 0 with value: 15.091139551681518.
[I 2024-02-21 11:24:02,597] Trial 79 finished with value: 15.178555530624598 and parameters: {'model_name': 'SimpleImputer', 'strategy': 'most_frequent'}. Best is trial 0 with value: 15.091139551681518.
[I 2024-02-21 11:24:02,819] Trial 113 finished with value: 15.091139551681518 and parameters: {'model_name': 'SimpleImputer', 'strategy': 'mean'}. Best is trial 0 with value: 15.091139551681518.
[I 2024-02-21 11:24:03,044] Trial 115 finished with value: 15.091139551681518 and parameters: {'model_name': 'SimpleImputer', 'strategy': 'mean'}. Best is trial 0 with value: 15.091139551681518.
[I 2024-02-21 11:24:03,256] Trial 78 finished with value: 15.178555530624598 and parameters: {'model_name': 'SimpleImputer', 'strategy': 'most_frequent'}. Best is trial 0 with value: 15.091139551681518.
[I 2024-02-21 11:24:03,522] Trial 80 finished with value: 15.178555530624598 and parameters: {'model_name': 'SimpleImputer', 'strategy': 'most_frequent'}. Best is trial 0 with value: 15.091139551681518.
[I 2024-02-21 11:24:03,768] Trial 124 finished with value: 15.091139551681518 and parameters: {'model_name': 'SimpleImputer', 'strategy': 'mean'}. Best is trial 0 with value: 15.091139551681518.
[I 2024-02-21 11:24:04,047] Trial 119 finished with value: 15.091139551681518 and parameters: {'model_name': 'SimpleImputer', 'strategy': 'mean'}. Best is trial 0 with value: 15.091139551681518.
[I 2024-02-21 11:24:04,269] Trial 117 finished with value: 15.091139551681518 and parameters: {'model_name': 'SimpleImputer', 'strategy': 'mean'}. Best is trial 0 with value: 15.091139551681518.
[I 2024-02-21 11:24:04,486] Trial 111 finished with value: 15.091139551681518 and parameters: {'model_name': 'SimpleImputer', 'strategy': 'mean'}. Best is trial 0 with value: 15.091139551681518.
[I 2024-02-21 11:24:04,669] Trial 74 finished with value: 15.178555530624598 and parameters: {'model_name': 'SimpleImputer', 'strategy': 'most_frequent'}. Best is trial 0 with value: 15.091139551681518.
[I 2024-02-21 11:24:04,978] Trial 127 finished with value: 15.091139551681518 and parameters: {'model_name': 'SimpleImputer', 'strategy': 'mean'}. Best is trial 0 with value: 15.091139551681518.
[I 2024-02-21 11:24:05,200] Trial 122 finished with value: 15.091139551681518 and parameters: {'model_name': 'SimpleImputer', 'strategy': 'mean'}. Best is trial 0 with value: 15.091139551681518.
[I 2024-02-21 11:24:05,419] Trial 121 finished with value: 15.091139551681518 and parameters: {'model_name': 'SimpleImputer', 'strategy': 'mean'}. Best is trial 0 with value: 15.091139551681518.
[I 2024-02-21 11:24:05,694] Trial 125 finished with value: 15.091139551681518 and parameters: {'model_name': 'SimpleImputer', 'strategy': 'mean'}. Best is trial 0 with value: 15.091139551681518.
[I 2024-02-21 11:24:05,912] Trial 120 finished with value: 15.091139551681518 and parameters: {'model_name': 'SimpleImputer', 'strategy': 'mean'}. Best is trial 0 with value: 15.091139551681518.
[I 2024-02-21 11:24:06,163] Trial 126 finished with value: 15.091139551681518 and parameters: {'model_name': 'SimpleImputer', 'strategy': 'mean'}. Best is trial 0 with value: 15.091139551681518.
[I 2024-02-21 11:24:06,419] Trial 129 finished with value: 15.091139551681518 and parameters: {'model_name': 'SimpleImputer', 'strategy': 'mean'}. Best is trial 0 with value: 15.091139551681518.
[I 2024-02-21 11:24:06,625] Trial 118 finished with value: 15.091139551681518 and parameters: {'model_name': 'SimpleImputer', 'strategy': 'mean'}. Best is trial 0 with value: 15.091139551681518.
[I 2024-02-21 11:24:06,875] Trial 128 finished with value: 15.091139551681518 and parameters: {'model_name': 'SimpleImputer', 'strategy': 'mean'}. Best is trial 0 with value: 15.091139551681518.
[I 2024-02-21 11:24:07,069] Trial 114 finished with value: 15.091139551681518 and parameters: {'model_name': 'SimpleImputer', 'strategy': 'mean'}. Best is trial 0 with value: 15.091139551681518.
[I 2024-02-21 11:24:07,364] Trial 123 finished with value: 15.091139551681518 and parameters: {'model_name': 'SimpleImputer', 'strategy': 'mean'}. Best is trial 0 with value: 15.091139551681518.
[I 2024-02-21 11:24:07,612] Trial 136 finished with value: 15.091139551681518 and parameters: {'model_name': 'SimpleImputer', 'strategy': 'mean'}. Best is trial 0 with value: 15.091139551681518.
[I 2024-02-21 11:24:07,886] Trial 132 finished with value: 15.091139551681518 and parameters: {'model_name': 'SimpleImputer', 'strategy': 'mean'}. Best is trial 0 with value: 15.091139551681518.
[I 2024-02-21 11:24:08,108] Trial 141 finished with value: 15.091139551681518 and parameters: {'model_name': 'SimpleImputer', 'strategy': 'mean'}. Best is trial 0 with value: 15.091139551681518.
[I 2024-02-21 11:24:08,328] Trial 138 finished with value: 15.091139551681518 and parameters: {'model_name': 'SimpleImputer', 'strategy': 'mean'}. Best is trial 0 with value: 15.091139551681518.
[I 2024-02-21 11:24:08,605] Trial 137 finished with value: 15.091139551681518 and parameters: {'model_name': 'SimpleImputer', 'strategy': 'mean'}. Best is trial 0 with value: 15.091139551681518.
[I 2024-02-21 11:24:08,808] Trial 131 finished with value: 15.091139551681518 and parameters: {'model_name': 'SimpleImputer', 'strategy': 'mean'}. Best is trial 0 with value: 15.091139551681518.
[I 2024-02-21 11:24:09,028] Trial 130 finished with value: 15.091139551681518 and parameters: {'model_name': 'SimpleImputer', 'strategy': 'mean'}. Best is trial 0 with value: 15.091139551681518.
[I 2024-02-21 11:24:09,279] Trial 140 finished with value: 15.091139551681518 and parameters: {'model_name': 'SimpleImputer', 'strategy': 'mean'}. Best is trial 0 with value: 15.091139551681518.
[I 2024-02-21 11:24:09,504] Trial 142 finished with value: 15.091139551681518 and parameters: {'model_name': 'SimpleImputer', 'strategy': 'mean'}. Best is trial 0 with value: 15.091139551681518.
[I 2024-02-21 11:24:09,718] Trial 135 finished with value: 15.091139551681518 and parameters: {'model_name': 'SimpleImputer', 'strategy': 'mean'}. Best is trial 0 with value: 15.091139551681518.
[I 2024-02-21 11:24:09,934] Trial 133 finished with value: 15.091139551681518 and parameters: {'model_name': 'SimpleImputer', 'strategy': 'mean'}. Best is trial 0 with value: 15.091139551681518.
[I 2024-02-21 11:24:10,386] Trial 144 finished with value: 15.091139551681518 and parameters: {'model_name': 'SimpleImputer', 'strategy': 'mean'}. Best is trial 0 with value: 15.091139551681518.
[I 2024-02-21 11:24:10,734] Trial 134 finished with value: 15.091139551681518 and parameters: {'model_name': 'SimpleImputer', 'strategy': 'mean'}. Best is trial 0 with value: 15.091139551681518.
[I 2024-02-21 11:24:10,958] Trial 147 finished with value: 15.091139551681518 and parameters: {'model_name': 'SimpleImputer', 'strategy': 'mean'}. Best is trial 0 with value: 15.091139551681518.
[I 2024-02-21 11:24:11,150] Trial 139 finished with value: 15.091139551681518 and parameters: {'model_name': 'SimpleImputer', 'strategy': 'mean'}. Best is trial 0 with value: 15.091139551681518.
[I 2024-02-21 11:24:11,592] Trial 143 finished with value: 15.091139551681518 and parameters: {'model_name': 'SimpleImputer', 'strategy': 'mean'}. Best is trial 0 with value: 15.091139551681518.
[I 2024-02-21 11:24:11,810] Trial 150 finished with value: 15.091139551681518 and parameters: {'model_name': 'SimpleImputer', 'strategy': 'mean'}. Best is trial 0 with value: 15.091139551681518.
[I 2024-02-21 11:24:12,085] Trial 145 finished with value: 15.091139551681518 and parameters: {'model_name': 'SimpleImputer', 'strategy': 'mean'}. Best is trial 0 with value: 15.091139551681518.
[I 2024-02-21 11:24:12,287] Trial 165 finished with value: 16.80540838563573 and parameters: {'model_name': 'SimpleImputer', 'strategy': 'constant'}. Best is trial 0 with value: 15.091139551681518.
[I 2024-02-21 11:24:12,523] Trial 148 finished with value: 15.091139551681518 and parameters: {'model_name': 'SimpleImputer', 'strategy': 'mean'}. Best is trial 0 with value: 15.091139551681518.
[I 2024-02-21 11:24:12,820] Trial 152 finished with value: 15.091139551681518 and parameters: {'model_name': 'SimpleImputer', 'strategy': 'mean'}. Best is trial 0 with value: 15.091139551681518.
[I 2024-02-21 11:24:13,123] Trial 164 finished with value: 16.80540838563573 and parameters: {'model_name': 'SimpleImputer', 'strategy': 'constant'}. Best is trial 0 with value: 15.091139551681518.
[I 2024-02-21 11:24:13,331] Trial 149 finished with value: 15.091139551681518 and parameters: {'model_name': 'SimpleImputer', 'strategy': 'mean'}. Best is trial 0 with value: 15.091139551681518.
[I 2024-02-21 11:24:13,569] Trial 167 finished with value: 16.80540838563573 and parameters: {'model_name': 'SimpleImputer', 'strategy': 'constant'}. Best is trial 0 with value: 15.091139551681518.
[I 2024-02-21 11:24:13,823] Trial 166 finished with value: 16.80540838563573 and parameters: {'model_name': 'SimpleImputer', 'strategy': 'constant'}. Best is trial 0 with value: 15.091139551681518.
[I 2024-02-21 11:24:14,017] Trial 155 finished with value: 15.091139551681518 and parameters: {'model_name': 'SimpleImputer', 'strategy': 'mean'}. Best is trial 0 with value: 15.091139551681518.
[I 2024-02-21 11:24:14,385] Trial 157 finished with value: 15.091139551681518 and parameters: {'model_name': 'SimpleImputer', 'strategy': 'mean'}. Best is trial 0 with value: 15.091139551681518.
[I 2024-02-21 11:24:14,644] Trial 151 finished with value: 15.091139551681518 and parameters: {'model_name': 'SimpleImputer', 'strategy': 'mean'}. Best is trial 0 with value: 15.091139551681518.
[I 2024-02-21 11:24:14,896] Trial 161 finished with value: 15.091139551681518 and parameters: {'model_name': 'SimpleImputer', 'strategy': 'mean'}. Best is trial 0 with value: 15.091139551681518.
[I 2024-02-21 11:24:15,062] Trial 160 finished with value: 15.091139551681518 and parameters: {'model_name': 'SimpleImputer', 'strategy': 'mean'}. Best is trial 0 with value: 15.091139551681518.
[I 2024-02-21 11:24:15,291] Trial 154 finished with value: 15.091139551681518 and parameters: {'model_name': 'SimpleImputer', 'strategy': 'mean'}. Best is trial 0 with value: 15.091139551681518.
[I 2024-02-21 11:24:15,604] Trial 170 finished with value: 16.80540838563573 and parameters: {'model_name': 'SimpleImputer', 'strategy': 'constant'}. Best is trial 0 with value: 15.091139551681518.
[I 2024-02-21 11:24:15,994] Trial 158 finished with value: 15.091139551681518 and parameters: {'model_name': 'SimpleImputer', 'strategy': 'mean'}. Best is trial 0 with value: 15.091139551681518.
[I 2024-02-21 11:24:16,337] Trial 176 finished with value: 16.80540838563573 and parameters: {'model_name': 'SimpleImputer', 'strategy': 'constant'}. Best is trial 0 with value: 15.091139551681518.
[I 2024-02-21 11:24:16,639] Trial 163 finished with value: 15.091139551681518 and parameters: {'model_name': 'SimpleImputer', 'strategy': 'mean'}. Best is trial 0 with value: 15.091139551681518.
[I 2024-02-21 11:24:16,861] Trial 146 finished with value: 15.091139551681518 and parameters: {'model_name': 'SimpleImputer', 'strategy': 'mean'}. Best is trial 0 with value: 15.091139551681518.
[I 2024-02-21 11:24:17,105] Trial 174 finished with value: 16.80540838563573 and parameters: {'model_name': 'SimpleImputer', 'strategy': 'constant'}. Best is trial 0 with value: 15.091139551681518.
[I 2024-02-21 11:24:17,319] Trial 169 finished with value: 16.80540838563573 and parameters: {'model_name': 'SimpleImputer', 'strategy': 'constant'}. Best is trial 0 with value: 15.091139551681518.
[I 2024-02-21 11:24:17,509] Trial 179 finished with value: 16.80540838563573 and parameters: {'model_name': 'SimpleImputer', 'strategy': 'constant'}. Best is trial 0 with value: 15.091139551681518.
[I 2024-02-21 11:24:17,682] Trial 182 finished with value: 16.80540838563573 and parameters: {'model_name': 'SimpleImputer', 'strategy': 'constant'}. Best is trial 0 with value: 15.091139551681518.
[I 2024-02-21 11:24:17,888] Trial 156 finished with value: 15.091139551681518 and parameters: {'model_name': 'SimpleImputer', 'strategy': 'mean'}. Best is trial 0 with value: 15.091139551681518.
[I 2024-02-21 11:24:18,129] Trial 188 finished with value: 16.80540838563573 and parameters: {'model_name': 'SimpleImputer', 'strategy': 'constant'}. Best is trial 0 with value: 15.091139551681518.
[I 2024-02-21 11:24:18,393] Trial 171 finished with value: 16.80540838563573 and parameters: {'model_name': 'SimpleImputer', 'strategy': 'constant'}. Best is trial 0 with value: 15.091139551681518.
[I 2024-02-21 11:24:18,602] Trial 180 finished with value: 16.80540838563573 and parameters: {'model_name': 'SimpleImputer', 'strategy': 'constant'}. Best is trial 0 with value: 15.091139551681518.
[I 2024-02-21 11:24:18,782] Trial 159 finished with value: 15.091139551681518 and parameters: {'model_name': 'SimpleImputer', 'strategy': 'mean'}. Best is trial 0 with value: 15.091139551681518.
[I 2024-02-21 11:24:19,077] Trial 178 finished with value: 16.80540838563573 and parameters: {'model_name': 'SimpleImputer', 'strategy': 'constant'}. Best is trial 0 with value: 15.091139551681518.
[I 2024-02-21 11:24:19,320] Trial 184 finished with value: 16.80540838563573 and parameters: {'model_name': 'SimpleImputer', 'strategy': 'constant'}. Best is trial 0 with value: 15.091139551681518.
[I 2024-02-21 11:24:19,540] Trial 172 finished with value: 16.80540838563573 and parameters: {'model_name': 'SimpleImputer', 'strategy': 'constant'}. Best is trial 0 with value: 15.091139551681518.
[I 2024-02-21 11:24:19,729] Trial 153 finished with value: 15.091139551681518 and parameters: {'model_name': 'SimpleImputer', 'strategy': 'mean'}. Best is trial 0 with value: 15.091139551681518.
[I 2024-02-21 11:24:20,001] Trial 181 finished with value: 16.80540838563573 and parameters: {'model_name': 'SimpleImputer', 'strategy': 'constant'}. Best is trial 0 with value: 15.091139551681518.
[I 2024-02-21 11:24:20,282] Trial 191 finished with value: 16.80540838563573 and parameters: {'model_name': 'SimpleImputer', 'strategy': 'constant'}. Best is trial 0 with value: 15.091139551681518.
[I 2024-02-21 11:24:20,506] Trial 193 finished with value: 16.80540838563573 and parameters: {'model_name': 'SimpleImputer', 'strategy': 'constant'}. Best is trial 0 with value: 15.091139551681518.
[I 2024-02-21 11:24:20,758] Trial 189 finished with value: 16.80540838563573 and parameters: {'model_name': 'SimpleImputer', 'strategy': 'constant'}. Best is trial 0 with value: 15.091139551681518.
[I 2024-02-21 11:24:20,940] Trial 185 finished with value: 16.80540838563573 and parameters: {'model_name': 'SimpleImputer', 'strategy': 'constant'}. Best is trial 0 with value: 15.091139551681518.
[I 2024-02-21 11:24:21,179] Trial 177 finished with value: 16.80540838563573 and parameters: {'model_name': 'SimpleImputer', 'strategy': 'constant'}. Best is trial 0 with value: 15.091139551681518.
[I 2024-02-21 11:24:21,361] Trial 175 finished with value: 16.80540838563573 and parameters: {'model_name': 'SimpleImputer', 'strategy': 'constant'}. Best is trial 0 with value: 15.091139551681518.
[I 2024-02-21 11:24:21,526] Trial 162 finished with value: 15.091139551681518 and parameters: {'model_name': 'SimpleImputer', 'strategy': 'mean'}. Best is trial 0 with value: 15.091139551681518.
[I 2024-02-21 11:24:21,714] Trial 186 finished with value: 16.80540838563573 and parameters: {'model_name': 'SimpleImputer', 'strategy': 'constant'}. Best is trial 0 with value: 15.091139551681518.
[I 2024-02-21 11:24:21,897] Trial 173 finished with value: 16.80540838563573 and parameters: {'model_name': 'SimpleImputer', 'strategy': 'constant'}. Best is trial 0 with value: 15.091139551681518.
[I 2024-02-21 11:24:22,069] Trial 192 finished with value: 16.80540838563573 and parameters: {'model_name': 'SimpleImputer', 'strategy': 'constant'}. Best is trial 0 with value: 15.091139551681518.
[I 2024-02-21 11:24:22,236] Trial 183 finished with value: 15.091139551681518 and parameters: {'model_name': 'SimpleImputer', 'strategy': 'mean'}. Best is trial 0 with value: 15.091139551681518.
[I 2024-02-21 11:24:22,549] Trial 168 finished with value: 15.091139551681518 and parameters: {'model_name': 'SimpleImputer', 'strategy': 'mean'}. Best is trial 0 with value: 15.091139551681518.
[I 2024-02-21 11:24:22,748] Trial 195 finished with value: 15.091139551681518 and parameters: {'model_name': 'SimpleImputer', 'strategy': 'mean'}. Best is trial 0 with value: 15.091139551681518.
[I 2024-02-21 11:24:22,970] Trial 187 finished with value: 15.091139551681518 and parameters: {'model_name': 'SimpleImputer', 'strategy': 'mean'}. Best is trial 0 with value: 15.091139551681518.
[I 2024-02-21 11:24:23,213] Trial 198 finished with value: 15.091139551681518 and parameters: {'model_name': 'SimpleImputer', 'strategy': 'mean'}. Best is trial 0 with value: 15.091139551681518.
[I 2024-02-21 11:24:23,461] Trial 199 finished with value: 15.091139551681518 and parameters: {'model_name': 'SimpleImputer', 'strategy': 'mean'}. Best is trial 0 with value: 15.091139551681518.
[I 2024-02-21 11:24:23,672] Trial 194 finished with value: 15.091139551681518 and parameters: {'model_name': 'SimpleImputer', 'strategy': 'mean'}. Best is trial 0 with value: 15.091139551681518.
[I 2024-02-21 11:24:23,885] Trial 190 finished with value: 15.091139551681518 and parameters: {'model_name': 'SimpleImputer', 'strategy': 'mean'}. Best is trial 0 with value: 15.091139551681518.
[I 2024-02-21 11:24:24,129] Trial 196 finished with value: 15.091139551681518 and parameters: {'model_name': 'SimpleImputer', 'strategy': 'mean'}. Best is trial 0 with value: 15.091139551681518.
