[I 2024-02-27 20:11:40,841] Trial 76 finished with value: 0.8882597746840377 and parameters: {'model_name': 'GAIN', 'batch_size': 3, 'hint_rate': 0.85, 'alpha': 44, 'iterations': 29}. Best is trial 7 with value: 0.8331656159922487.
[I 2024-02-27 20:12:20,304] Trial 35 finished with value: 0.8332741491779527 and parameters: {'model_name': 'RandomForestImputer', 'max_iter': 29, 'decreasing': False, 'min_samples_split': 0.8, 'min_samples_leaf': 0.2, 'max_features': 0.8, 'warm_start': True}. Best is trial 7 with value: 0.8331656159922487.
[I 2024-02-27 20:13:14,129] Trial 33 finished with value: 0.8335012093838156 and parameters: {'model_name': 'RandomForestImputer', 'max_iter': 66, 'decreasing': True, 'min_samples_split': 0.4, 'min_samples_leaf': 0.30000000000000004, 'max_features': 0.2, 'warm_start': True}. Best is trial 7 with value: 0.8331656159922487.
[I 2024-02-27 20:14:38,577] Trial 103 finished with value: 0.8332479613997872 and parameters: {'model_name': 'RandomForestImputer', 'max_iter': 90, 'decreasing': False, 'min_samples_split': 0.0, 'min_samples_leaf': 0.8, 'max_features': 0.1, 'warm_start': True}. Best is trial 7 with value: 0.8331656159922487.
[I 2024-02-27 20:14:40,300] Trial 148 finished with value: 0.8331656159922487 and parameters: {'model_name': 'SimpleImputer', 'strategy': 'constant'}. Best is trial 7 with value: 0.8331656159922487.
[I 2024-02-27 20:14:41,933] Trial 149 finished with value: 0.8331656159922487 and parameters: {'model_name': 'SimpleImputer', 'strategy': 'constant'}. Best is trial 7 with value: 0.8331656159922487.
[I 2024-02-27 20:15:19,957] Trial 9 finished with value: 0.8344368582333299 and parameters: {'model_name': 'RandomForestImputer', 'max_iter': 8, 'decreasing': False, 'min_samples_split': 0.1, 'min_samples_leaf': 0.2, 'max_features': 0.9, 'warm_start': False}. Best is trial 7 with value: 0.8331656159922487.
[I 2024-02-27 20:15:21,277] Trial 151 finished with value: 0.8331656159922487 and parameters: {'model_name': 'SimpleImputer', 'strategy': 'constant'}. Best is trial 7 with value: 0.8331656159922487.
[I 2024-02-27 20:16:01,141] Trial 32 finished with value: 0.8339626686122041 and parameters: {'model_name': 'RandomForestImputer', 'max_iter': 11, 'decreasing': False, 'min_samples_split': 0.30000000000000004, 'min_samples_leaf': 0.1, 'max_features': 0.4, 'warm_start': False}. Best is trial 7 with value: 0.8331656159922487.
[I 2024-02-27 20:16:35,707] Trial 13 finished with value: 0.8332191336798808 and parameters: {'model_name': 'RandomForestImputer', 'max_iter': 9, 'decreasing': False, 'min_samples_split': 0.1, 'min_samples_leaf': 0.4, 'max_features': 0.8, 'warm_start': False}. Best is trial 7 with value: 0.8331656159922487.
[I 2024-02-27 20:16:42,269] Trial 70 finished with value: 0.8373211812653263 and parameters: {'model_name': 'GAIN', 'batch_size': 3, 'hint_rate': 0.65, 'alpha': 41, 'iterations': 173}. Best is trial 7 with value: 0.8331656159922487.
[I 2024-02-27 20:16:54,721] Trial 30 finished with value: 1.1703475095859286 and parameters: {'model_name': 'IterativeImputer', 'sample_posterior': True, 'initial_strategy': 'constant', 'imputation_order': 'roman'}. Best is trial 7 with value: 0.8331656159922487.
[I 2024-02-27 20:16:56,554] Trial 156 finished with value: 0.8331656159922487 and parameters: {'model_name': 'SimpleImputer', 'strategy': 'constant'}. Best is trial 7 with value: 0.8331656159922487.
[I 2024-02-27 20:16:58,491] Trial 80 finished with value: 0.8332996200960172 and parameters: {'model_name': 'RandomForestImputer', 'max_iter': 11, 'decreasing': False, 'min_samples_split': 0.1, 'min_samples_leaf': 0.5, 'max_features': 0.1, 'warm_start': False}. Best is trial 7 with value: 0.8331656159922487.
[I 2024-02-27 20:17:00,333] Trial 157 finished with value: 0.8331656159922487 and parameters: {'model_name': 'SimpleImputer', 'strategy': 'median'}. Best is trial 7 with value: 0.8331656159922487.
[I 2024-02-27 20:17:01,599] Trial 158 finished with value: 0.8331656159922487 and parameters: {'model_name': 'SimpleImputer', 'strategy': 'median'}. Best is trial 7 with value: 0.8331656159922487.
[I 2024-02-27 20:17:03,077] Trial 43 finished with value: 1.1676552181629027 and parameters: {'model_name': 'IterativeImputer', 'sample_posterior': True, 'initial_strategy': 'most_frequent', 'imputation_order': 'roman'}. Best is trial 7 with value: 0.8331656159922487.
[I 2024-02-27 20:17:04,648] Trial 159 finished with value: 0.8331656159922487 and parameters: {'model_name': 'SimpleImputer', 'strategy': 'median'}. Best is trial 7 with value: 0.8331656159922487.
[I 2024-02-27 20:17:06,107] Trial 53 finished with value: 1.1792347033363262 and parameters: {'model_name': 'IterativeImputer', 'sample_posterior': True, 'initial_strategy': 'median', 'imputation_order': 'arabic'}. Best is trial 7 with value: 0.8331656159922487.
[I 2024-02-27 20:17:07,286] Trial 160 finished with value: 0.8331656159922487 and parameters: {'model_name': 'SimpleImputer', 'strategy': 'median'}. Best is trial 7 with value: 0.8331656159922487.
[I 2024-02-27 20:17:08,883] Trial 161 finished with value: 0.8331656159922487 and parameters: {'model_name': 'SimpleImputer', 'strategy': 'median'}. Best is trial 7 with value: 0.8331656159922487.
[I 2024-02-27 20:17:10,113] Trial 164 finished with value: 0.8331656159922487 and parameters: {'model_name': 'SimpleImputer', 'strategy': 'constant'}. Best is trial 7 with value: 0.8331656159922487.
[I 2024-02-27 20:17:11,440] Trial 162 finished with value: 0.8331656159922487 and parameters: {'model_name': 'SimpleImputer', 'strategy': 'median'}. Best is trial 7 with value: 0.8331656159922487.
[I 2024-02-27 20:17:12,853] Trial 163 finished with value: 0.8331656159922487 and parameters: {'model_name': 'SimpleImputer', 'strategy': 'median'}. Best is trial 7 with value: 0.8331656159922487.
[I 2024-02-27 20:17:13,890] Trial 165 finished with value: 0.8331656159922487 and parameters: {'model_name': 'SimpleImputer', 'strategy': 'constant'}. Best is trial 7 with value: 0.8331656159922487.
[I 2024-02-27 20:17:15,498] Trial 166 finished with value: 0.8331656159922487 and parameters: {'model_name': 'SimpleImputer', 'strategy': 'constant'}. Best is trial 7 with value: 0.8331656159922487.
[I 2024-02-27 20:17:16,780] Trial 168 finished with value: 0.8331656159922487 and parameters: {'model_name': 'SimpleImputer', 'strategy': 'constant'}. Best is trial 7 with value: 0.8331656159922487.
[I 2024-02-27 20:17:18,463] Trial 23 finished with value: 1.1737158481241285 and parameters: {'model_name': 'IterativeImputer', 'sample_posterior': True, 'initial_strategy': 'constant', 'imputation_order': 'descending'}. Best is trial 7 with value: 0.8331656159922487.
[I 2024-02-27 20:17:25,429] Trial 19 finished with value: 1.174475689959586 and parameters: {'model_name': 'IterativeImputer', 'sample_posterior': True, 'initial_strategy': 'mean', 'imputation_order': 'random'}. Best is trial 7 with value: 0.8331656159922487.
[I 2024-02-27 20:17:30,283] Trial 173 finished with value: 0.8893017234080496 and parameters: {'model_name': 'SimpleImputer', 'strategy': 'most_frequent'}. Best is trial 7 with value: 0.8331656159922487.
[I 2024-02-27 20:17:35,132] Trial 57 finished with value: 1.1853162501156098 and parameters: {'model_name': 'IterativeImputer', 'sample_posterior': True, 'initial_strategy': 'most_frequent', 'imputation_order': 'arabic'}. Best is trial 7 with value: 0.8331656159922487.
[I 2024-02-27 20:17:37,019] Trial 58 finished with value: 1.1703349308979423 and parameters: {'model_name': 'IterativeImputer', 'sample_posterior': True, 'initial_strategy': 'constant', 'imputation_order': 'ascending'}. Best is trial 7 with value: 0.8331656159922487.
[I 2024-02-27 20:17:42,269] Trial 63 finished with value: 1.1851993280525677 and parameters: {'model_name': 'IterativeImputer', 'sample_posterior': True, 'initial_strategy': 'mean', 'imputation_order': 'descending'}. Best is trial 7 with value: 0.8331656159922487.
[I 2024-02-27 20:18:24,755] Trial 167 finished with value: 0.9380700676355993 and parameters: {'model_name': 'KNNImputer', 'weights': 'distance', 'keep_empty_features': False}. Best is trial 7 with value: 0.8331656159922487.
[I 2024-02-27 20:18:26,985] Trial 169 finished with value: 0.9380700676355993 and parameters: {'model_name': 'KNNImputer', 'weights': 'distance', 'keep_empty_features': False}. Best is trial 7 with value: 0.8331656159922487.
[I 2024-02-27 20:18:28,734] Trial 178 finished with value: 0.8331656159922487 and parameters: {'model_name': 'SimpleImputer', 'strategy': 'constant'}. Best is trial 7 with value: 0.8331656159922487.
[I 2024-02-27 20:18:29,995] Trial 170 finished with value: 0.9380700676355993 and parameters: {'model_name': 'KNNImputer', 'weights': 'distance', 'keep_empty_features': False}. Best is trial 7 with value: 0.8331656159922487.
[I 2024-02-27 20:18:32,227] Trial 179 finished with value: 0.8331656159922487 and parameters: {'model_name': 'SimpleImputer', 'strategy': 'constant'}. Best is trial 7 with value: 0.8331656159922487.
[I 2024-02-27 20:18:33,254] Trial 171 finished with value: 0.9380700676355993 and parameters: {'model_name': 'KNNImputer', 'weights': 'distance', 'keep_empty_features': False}. Best is trial 7 with value: 0.8331656159922487.
[I 2024-02-27 20:18:34,788] Trial 172 finished with value: 0.9380700676355993 and parameters: {'model_name': 'KNNImputer', 'weights': 'distance', 'keep_empty_features': False}. Best is trial 7 with value: 0.8331656159922487.
[I 2024-02-27 20:18:36,251] Trial 180 finished with value: 0.8331656159922487 and parameters: {'model_name': 'SimpleImputer', 'strategy': 'constant'}. Best is trial 7 with value: 0.8331656159922487.
[I 2024-02-27 20:18:37,604] Trial 181 finished with value: 0.8331751761172604 and parameters: {'model_name': 'SimpleImputer', 'strategy': 'mean'}. Best is trial 7 with value: 0.8331656159922487.
[I 2024-02-27 20:18:39,704] Trial 183 finished with value: 0.8331751761172604 and parameters: {'model_name': 'SimpleImputer', 'strategy': 'mean'}. Best is trial 7 with value: 0.8331656159922487.
[I 2024-02-27 20:18:41,045] Trial 182 finished with value: 0.8331751761172604 and parameters: {'model_name': 'SimpleImputer', 'strategy': 'mean'}. Best is trial 7 with value: 0.8331656159922487.
[I 2024-02-27 20:18:42,901] Trial 185 finished with value: 0.8331751761172604 and parameters: {'model_name': 'SimpleImputer', 'strategy': 'mean'}. Best is trial 7 with value: 0.8331656159922487.
[I 2024-02-27 20:18:44,675] Trial 184 finished with value: 0.8331656159922487 and parameters: {'model_name': 'SimpleImputer', 'strategy': 'median'}. Best is trial 7 with value: 0.8331656159922487.
[I 2024-02-27 20:18:46,224] Trial 188 finished with value: 0.8331656159922487 and parameters: {'model_name': 'SimpleImputer', 'strategy': 'constant'}. Best is trial 7 with value: 0.8331656159922487.
[I 2024-02-27 20:18:47,593] Trial 186 finished with value: 0.8331656159922487 and parameters: {'model_name': 'SimpleImputer', 'strategy': 'median'}. Best is trial 7 with value: 0.8331656159922487.
[I 2024-02-27 20:18:48,484] Trial 187 finished with value: 0.8331656159922487 and parameters: {'model_name': 'SimpleImputer', 'strategy': 'constant'}. Best is trial 7 with value: 0.8331656159922487.
[I 2024-02-27 20:18:49,950] Trial 189 finished with value: 0.8331656159922487 and parameters: {'model_name': 'SimpleImputer', 'strategy': 'constant'}. Best is trial 7 with value: 0.8331656159922487.
[I 2024-02-27 20:18:51,256] Trial 190 finished with value: 0.8331656159922487 and parameters: {'model_name': 'SimpleImputer', 'strategy': 'constant'}. Best is trial 7 with value: 0.8331656159922487.
[I 2024-02-27 20:18:52,689] Trial 193 finished with value: 0.8331656159922487 and parameters: {'model_name': 'SimpleImputer', 'strategy': 'constant'}. Best is trial 7 with value: 0.8331656159922487.
[I 2024-02-27 20:18:53,876] Trial 191 finished with value: 0.8331656159922487 and parameters: {'model_name': 'SimpleImputer', 'strategy': 'constant'}. Best is trial 7 with value: 0.8331656159922487.
[I 2024-02-27 20:18:55,147] Trial 192 finished with value: 0.8331656159922487 and parameters: {'model_name': 'SimpleImputer', 'strategy': 'constant'}. Best is trial 7 with value: 0.8331656159922487.
[I 2024-02-27 20:18:56,603] Trial 194 finished with value: 0.8331656159922487 and parameters: {'model_name': 'SimpleImputer', 'strategy': 'constant'}. Best is trial 7 with value: 0.8331656159922487.
[I 2024-02-27 20:18:58,251] Trial 195 finished with value: 0.8331656159922487 and parameters: {'model_name': 'SimpleImputer', 'strategy': 'constant'}. Best is trial 7 with value: 0.8331656159922487.
[I 2024-02-27 20:18:59,829] Trial 197 finished with value: 0.8331656159922487 and parameters: {'model_name': 'SimpleImputer', 'strategy': 'constant'}. Best is trial 7 with value: 0.8331656159922487.
[I 2024-02-27 20:19:00,999] Trial 198 finished with value: 0.8331656159922487 and parameters: {'model_name': 'SimpleImputer', 'strategy': 'constant'}. Best is trial 7 with value: 0.8331656159922487.
[I 2024-02-27 20:19:01,935] Trial 196 finished with value: 0.8331656159922487 and parameters: {'model_name': 'SimpleImputer', 'strategy': 'constant'}. Best is trial 7 with value: 0.8331656159922487.
[I 2024-02-27 20:19:03,361] Trial 199 finished with value: 0.8331656159922487 and parameters: {'model_name': 'SimpleImputer', 'strategy': 'constant'}. Best is trial 7 with value: 0.8331656159922487.
[I 2024-02-27 20:19:05,580] Trial 174 finished with value: 0.9380700676355993 and parameters: {'model_name': 'KNNImputer', 'weights': 'distance', 'keep_empty_features': False}. Best is trial 7 with value: 0.8331656159922487.
[I 2024-02-27 20:19:08,226] Trial 175 finished with value: 0.9380700676355993 and parameters: {'model_name': 'KNNImputer', 'weights': 'distance', 'keep_empty_features': False}. Best is trial 7 with value: 0.8331656159922487.
[I 2024-02-27 20:19:12,333] Trial 176 finished with value: 0.9380700676355993 and parameters: {'model_name': 'KNNImputer', 'weights': 'distance', 'keep_empty_features': False}. Best is trial 7 with value: 0.8331656159922487.
[I 2024-02-27 20:19:14,731] Trial 177 finished with value: 0.9380700676355993 and parameters: {'model_name': 'KNNImputer', 'weights': 'distance', 'keep_empty_features': False}. Best is trial 7 with value: 0.8331656159922487.
[I 2024-02-27 20:19:15,953] Trial 40 finished with value: 0.8744361990214516 and parameters: {'model_name': 'GAIN', 'batch_size': 942, 'hint_rate': 0.16, 'alpha': 67, 'iterations': 186}. Best is trial 7 with value: 0.8331656159922487.
[I 2024-02-27 20:19:24,381] Trial 15 finished with value: 0.833197533180466 and parameters: {'model_name': 'RandomForestImputer', 'max_iter': 15, 'decreasing': True, 'min_samples_split': 0.0, 'min_samples_leaf': 0.5, 'max_features': 0.5, 'warm_start': False}. Best is trial 7 with value: 0.8331656159922487.
[I 2024-02-27 20:20:08,167] Trial 31 finished with value: 0.8332354610937017 and parameters: {'model_name': 'RandomForestImputer', 'max_iter': 14, 'decreasing': True, 'min_samples_split': 0.7000000000000001, 'min_samples_leaf': 0.30000000000000004, 'max_features': 0.7000000000000001, 'warm_start': False}. Best is trial 7 with value: 0.8331656159922487.
[I 2024-02-27 20:20:54,369] Trial 146 finished with value: 1.1711868552316784 and parameters: {'model_name': 'IterativeImputer', 'sample_posterior': True, 'initial_strategy': 'constant', 'imputation_order': 'roman'}. Best is trial 7 with value: 0.8331656159922487.
[I 2024-02-27 20:21:06,086] Trial 68 finished with value: 0.9194601436162643 and parameters: {'model_name': 'GAIN', 'batch_size': 430, 'hint_rate': 0.87, 'alpha': 63, 'iterations': 242}. Best is trial 7 with value: 0.8331656159922487.
[I 2024-02-27 20:21:18,098] Trial 52 finished with value: 0.839887460038795 and parameters: {'model_name': 'GAIN', 'batch_size': 1, 'hint_rate': 0.72, 'alpha': 52, 'iterations': 325}. Best is trial 7 with value: 0.8331656159922487.
[I 2024-02-27 20:21:29,439] Trial 147 finished with value: 1.1735461350342509 and parameters: {'model_name': 'IterativeImputer', 'sample_posterior': True, 'initial_strategy': 'constant', 'imputation_order': 'roman'}. Best is trial 7 with value: 0.8331656159922487.
[I 2024-02-27 20:22:23,791] Trial 150 finished with value: 1.1769154671606172 and parameters: {'model_name': 'IterativeImputer', 'sample_posterior': True, 'initial_strategy': 'constant', 'imputation_order': 'roman'}. Best is trial 7 with value: 0.8331656159922487.
[I 2024-02-27 20:22:52,527] Trial 152 finished with value: 1.1740123438852486 and parameters: {'model_name': 'IterativeImputer', 'sample_posterior': True, 'initial_strategy': 'constant', 'imputation_order': 'roman'}. Best is trial 7 with value: 0.8331656159922487.
[I 2024-02-27 20:23:02,481] Trial 67 finished with value: 0.8640675404245617 and parameters: {'model_name': 'GAIN', 'batch_size': 8, 'hint_rate': 0.72, 'alpha': 64, 'iterations': 389}. Best is trial 7 with value: 0.8331656159922487.
[I 2024-02-27 20:23:14,123] Trial 10 finished with value: 0.8349475455638224 and parameters: {'model_name': 'RandomForestImputer', 'max_iter': 21, 'decreasing': True, 'min_samples_split': 0.0, 'min_samples_leaf': 0.1, 'max_features': 0.7000000000000001, 'warm_start': False}. Best is trial 7 with value: 0.8331656159922487.
[I 2024-02-27 20:23:18,376] Trial 153 finished with value: 1.1733230365174325 and parameters: {'model_name': 'IterativeImputer', 'sample_posterior': True, 'initial_strategy': 'constant', 'imputation_order': 'roman'}. Best is trial 7 with value: 0.8331656159922487.
[I 2024-02-27 20:23:43,009] Trial 154 finished with value: 1.1762297369815462 and parameters: {'model_name': 'IterativeImputer', 'sample_posterior': True, 'initial_strategy': 'constant', 'imputation_order': 'roman'}. Best is trial 7 with value: 0.8331656159922487.
[I 2024-02-27 20:23:47,076] Trial 155 finished with value: 1.1754203447699476 and parameters: {'model_name': 'IterativeImputer', 'sample_posterior': True, 'initial_strategy': 'constant', 'imputation_order': 'roman'}. Best is trial 7 with value: 0.8331656159922487.
[I 2024-02-27 20:25:02,380] Trial 47 finished with value: 1.0249817730231636 and parameters: {'model_name': 'GAIN', 'batch_size': 427, 'hint_rate': 0.23, 'alpha': 43, 'iterations': 486}. Best is trial 7 with value: 0.8331656159922487.
[I 2024-02-27 20:25:39,331] Trial 77 finished with value: 1.0245022875113965 and parameters: {'model_name': 'GAIN', 'batch_size': 249, 'hint_rate': 0.5800000000000001, 'alpha': 71, 'iterations': 514}. Best is trial 7 with value: 0.8331656159922487.
[I 2024-02-27 20:26:22,881] Trial 20 finished with value: 0.9355262315961774 and parameters: {'model_name': 'GAIN', 'batch_size': 10, 'hint_rate': 0.59, 'alpha': 31, 'iterations': 734}. Best is trial 7 with value: 0.8331656159922487.
[I 2024-02-27 20:27:12,811] Trial 79 finished with value: 0.8537224392601332 and parameters: {'model_name': 'GAIN', 'batch_size': 1, 'hint_rate': 0.7100000000000001, 'alpha': 1, 'iterations': 809}. Best is trial 7 with value: 0.8331656159922487.
[I 2024-02-27 20:28:15,353] Trial 124 finished with value: 0.8331887627390057 and parameters: {'model_name': 'RandomForestImputer', 'max_iter': 53, 'decreasing': False, 'min_samples_split': 0.0, 'min_samples_leaf': 0.9, 'max_features': 0.1, 'warm_start': False}. Best is trial 7 with value: 0.8331656159922487.
[I 2024-02-27 20:28:16,737] Trial 82 finished with value: 0.8332137481174133 and parameters: {'model_name': 'RandomForestImputer', 'max_iter': 71, 'decreasing': False, 'min_samples_split': 0.1, 'min_samples_leaf': 0.7000000000000001, 'max_features': 0.1, 'warm_start': False}. Best is trial 7 with value: 0.8331656159922487.
[I 2024-02-27 20:30:19,678] Trial 134 finished with value: 0.8331808552594664 and parameters: {'model_name': 'RandomForestImputer', 'max_iter': 59, 'decreasing': False, 'min_samples_split': 0.0, 'min_samples_leaf': 0.9, 'max_features': 0.1, 'warm_start': False}. Best is trial 7 with value: 0.8331656159922487.
[I 2024-02-27 20:31:01,151] Trial 117 finished with value: 0.8332387730148421 and parameters: {'model_name': 'RandomForestImputer', 'max_iter': 81, 'decreasing': False, 'min_samples_split': 0.0, 'min_samples_leaf': 0.9, 'max_features': 0.9, 'warm_start': False}. Best is trial 7 with value: 0.8331656159922487.
[I 2024-02-27 20:31:38,786] Trial 83 finished with value: 0.833214516763497 and parameters: {'model_name': 'RandomForestImputer', 'max_iter': 77, 'decreasing': False, 'min_samples_split': 0.1, 'min_samples_leaf': 0.8, 'max_features': 0.1, 'warm_start': False}. Best is trial 7 with value: 0.8331656159922487.
[I 2024-02-27 20:31:43,557] Trial 125 finished with value: 0.8332092625197369 and parameters: {'model_name': 'RandomForestImputer', 'max_iter': 77, 'decreasing': False, 'min_samples_split': 0.0, 'min_samples_leaf': 0.9, 'max_features': 0.1, 'warm_start': False}. Best is trial 7 with value: 0.8331656159922487.
[I 2024-02-27 20:32:35,512] Trial 133 finished with value: 0.833185889068061 and parameters: {'model_name': 'RandomForestImputer', 'max_iter': 84, 'decreasing': False, 'min_samples_split': 1.0, 'min_samples_leaf': 0.9, 'max_features': 0.1, 'warm_start': False}. Best is trial 7 with value: 0.8331656159922487.
[I 2024-02-27 20:33:05,086] Trial 142 finished with value: 0.833222817565737 and parameters: {'model_name': 'RandomForestImputer', 'max_iter': 99, 'decreasing': False, 'min_samples_split': 1.0, 'min_samples_leaf': 0.9, 'max_features': 0.7000000000000001, 'warm_start': False}. Best is trial 7 with value: 0.8331656159922487.
[I 2024-02-27 20:33:12,261] Trial 116 finished with value: 0.8332035968738 and parameters: {'model_name': 'RandomForestImputer', 'max_iter': 89, 'decreasing': False, 'min_samples_split': 0.1, 'min_samples_leaf': 0.9, 'max_features': 0.9, 'warm_start': False}. Best is trial 7 with value: 0.8331656159922487.
