[I 2024-01-16 02:37:54,933] Trial 18 finished with value: 0.5082445839682396 and parameters: {'model_name': 'SimpleImputer', 'strategy': 'constant'}. Best is trial 18 with value: 0.5082445839682396.
[I 2024-01-16 02:37:56,132] Trial 14 finished with value: 0.3959025856691411 and parameters: {'model_name': 'SimpleImputer', 'strategy': 'mean'}. Best is trial 14 with value: 0.3959025856691411.
[I 2024-01-16 02:37:57,395] Trial 34 finished with value: 0.5082445839682396 and parameters: {'model_name': 'SimpleImputer', 'strategy': 'constant'}. Best is trial 14 with value: 0.3959025856691411.
[I 2024-01-16 02:37:58,065] Trial 15 finished with value: 0.5082445839682396 and parameters: {'model_name': 'SimpleImputer', 'strategy': 'median'}. Best is trial 14 with value: 0.3959025856691411.
[I 2024-01-16 02:37:59,451] Trial 27 finished with value: 0.5082445839682396 and parameters: {'model_name': 'SimpleImputer', 'strategy': 'median'}. Best is trial 14 with value: 0.3959025856691411.
[I 2024-01-16 02:38:00,048] Trial 36 finished with value: 0.3959025856691411 and parameters: {'model_name': 'SimpleImputer', 'strategy': 'mean'}. Best is trial 14 with value: 0.3959025856691411.
[I 2024-01-16 02:38:00,821] Trial 31 finished with value: 0.5082445839682396 and parameters: {'model_name': 'SimpleImputer', 'strategy': 'median'}. Best is trial 14 with value: 0.3959025856691411.
[I 2024-01-16 02:38:01,537] Trial 37 finished with value: 0.5082445839682396 and parameters: {'model_name': 'SimpleImputer', 'strategy': 'median'}. Best is trial 14 with value: 0.3959025856691411.
[I 2024-01-16 02:38:02,117] Trial 46 finished with value: 0.5082445839682396 and parameters: {'model_name': 'SimpleImputer', 'strategy': 'median'}. Best is trial 14 with value: 0.3959025856691411.
[I 2024-01-16 02:38:02,969] Trial 35 finished with value: 0.5082445839682396 and parameters: {'model_name': 'SimpleImputer', 'strategy': 'median'}. Best is trial 14 with value: 0.3959025856691411.
2024-01-16 02:38:06.342741: E external/local_xla/xla/stream_executor/cuda/cuda_driver.cc:274] failed call to cuInit: CUDA_ERROR_NO_DEVICE: no CUDA-capable device is detected
2024-01-16 02:38:06.618080: I tensorflow/compiler/mlir/mlir_graph_optimization_pass.cc:388] MLIR V1 optimization pass is not enabled
[I 2024-01-16 02:38:10,422] Trial 21 finished with value: inf and parameters: {'model_name': 'GAIN', 'batch_size': 498, 'hint_rate': 0.43, 'alpha': 52, 'iterations': 3}. Best is trial 14 with value: 0.3959025856691411.
[I 2024-01-16 02:38:22,432] Trial 29 finished with value: 0.5082445839682396 and parameters: {'model_name': 'SimpleImputer', 'strategy': 'most_frequent'}. Best is trial 14 with value: 0.3959025856691411.
[I 2024-01-16 02:38:29,768] Trial 7 finished with value: 0.3963461084312868 and parameters: {'model_name': 'KNNImputer', 'weights': 'uniform', 'keep_empty_features': False}. Best is trial 14 with value: 0.3959025856691411.
[I 2024-01-16 02:38:30,681] Trial 26 finished with value: 0.3962277541895495 and parameters: {'model_name': 'KNNImputer', 'weights': 'distance', 'keep_empty_features': False}. Best is trial 14 with value: 0.3959025856691411.
[I 2024-01-16 02:38:31,481] Trial 45 finished with value: 0.3962277541895495 and parameters: {'model_name': 'KNNImputer', 'weights': 'distance', 'keep_empty_features': False}. Best is trial 14 with value: 0.3959025856691411.
[I 2024-01-16 02:38:33,654] Trial 6 finished with value: 0.3963461084312868 and parameters: {'model_name': 'KNNImputer', 'weights': 'uniform', 'keep_empty_features': False}. Best is trial 14 with value: 0.3959025856691411.
[I 2024-01-16 02:38:34,267] Trial 3 finished with value: 0.3962277541895495 and parameters: {'model_name': 'KNNImputer', 'weights': 'distance', 'keep_empty_features': False}. Best is trial 14 with value: 0.3959025856691411.
[I 2024-01-16 02:38:35,406] Trial 39 finished with value: 0.3962277541895495 and parameters: {'model_name': 'KNNImputer', 'weights': 'distance', 'keep_empty_features': False}. Best is trial 14 with value: 0.3959025856691411.
[I 2024-01-16 02:38:36,695] Trial 43 finished with value: 0.3963461084312868 and parameters: {'model_name': 'KNNImputer', 'weights': 'uniform', 'keep_empty_features': False}. Best is trial 14 with value: 0.3959025856691411.
[I 2024-01-16 02:38:39,082] Trial 55 finished with value: 0.3962277541895495 and parameters: {'model_name': 'KNNImputer', 'weights': 'distance', 'keep_empty_features': False}. Best is trial 14 with value: 0.3959025856691411.
[I 2024-01-16 02:38:44,890] Trial 58 finished with value: 0.3962277541895495 and parameters: {'model_name': 'KNNImputer', 'weights': 'distance', 'keep_empty_features': False}. Best is trial 14 with value: 0.3959025856691411.
[I 2024-01-16 02:39:03,457] Trial 24 finished with value: 0.3959025856691411 and parameters: {'model_name': 'RandomForestImputer', 'max_iter': 1, 'decreasing': True, 'min_samples_split': 0.2, 'min_samples_leaf': 0.1, 'max_features': 0.7000000000000001, 'warm_start': True}. Best is trial 14 with value: 0.3959025856691411.
[I 2024-01-16 02:39:09,272] Trial 53 finished with value: 0.3959025856691411 and parameters: {'model_name': 'RandomForestImputer', 'max_iter': 1, 'decreasing': True, 'min_samples_split': 0.2, 'min_samples_leaf': 0.2, 'max_features': 0.7000000000000001, 'warm_start': True}. Best is trial 14 with value: 0.3959025856691411.
[I 2024-01-16 02:39:31,494] Trial 60 finished with value: 0.3959025856691411 and parameters: {'model_name': 'RandomForestImputer', 'max_iter': 1, 'decreasing': False, 'min_samples_split': 0.1, 'min_samples_leaf': 0.8, 'max_features': 0.9, 'warm_start': True}. Best is trial 14 with value: 0.3959025856691411.
[I 2024-01-16 02:39:52,790] Trial 4 finished with value: 0.4945050400245677 and parameters: {'model_name': 'GAIN', 'batch_size': 1, 'hint_rate': 0.78, 'alpha': 36, 'iterations': 3}. Best is trial 14 with value: 0.3959025856691411.
[I 2024-01-16 02:39:57,737] Trial 47 finished with value: 0.49072340903695755 and parameters: {'model_name': 'GAIN', 'batch_size': 61, 'hint_rate': 0.42000000000000004, 'alpha': 63, 'iterations': 1}. Best is trial 14 with value: 0.3959025856691411.
[I 2024-01-16 02:39:59,507] Trial 41 finished with value: 0.5064556702307831 and parameters: {'model_name': 'GAIN', 'batch_size': 1, 'hint_rate': 0.2, 'alpha': 30, 'iterations': 2}. Best is trial 14 with value: 0.3959025856691411.
[I 2024-01-16 02:40:03,867] Trial 69 finished with value: 0.3959025856691411 and parameters: {'model_name': 'RandomForestImputer', 'max_iter': 1, 'decreasing': True, 'min_samples_split': 0.2, 'min_samples_leaf': 0.1, 'max_features': 0.7000000000000001, 'warm_start': True}. Best is trial 14 with value: 0.3959025856691411.
[I 2024-01-16 02:40:17,179] Trial 25 finished with value: 0.4937738222040842 and parameters: {'model_name': 'GAIN', 'batch_size': 1, 'hint_rate': 0.18000000000000002, 'alpha': 53, 'iterations': 9}. Best is trial 14 with value: 0.3959025856691411.
[I 2024-01-16 02:46:32,801] Trial 30 finished with value: inf and parameters: {'model_name': 'GAIN', 'batch_size': 40, 'hint_rate': 0.2, 'alpha': 8, 'iterations': 1481}. Best is trial 14 with value: 0.3959025856691411.
[I 2024-01-16 02:46:53,485] Trial 54 finished with value: inf and parameters: {'model_name': 'GAIN', 'batch_size': 97, 'hint_rate': 0.26, 'alpha': 23, 'iterations': 1462}. Best is trial 14 with value: 0.3959025856691411.
[I 2024-01-16 02:48:26,997] Trial 63 finished with value: 0.3959025856691411 and parameters: {'model_name': 'RandomForestImputer', 'max_iter': 1, 'decreasing': False, 'min_samples_split': 0.0, 'min_samples_leaf': 0.4, 'max_features': 0.6, 'warm_start': False}. Best is trial 14 with value: 0.3959025856691411.
[I 2024-01-16 02:48:40,301] Trial 17 finished with value: 0.40131286953802403 and parameters: {'model_name': 'RandomForestImputer', 'max_iter': 9, 'decreasing': True, 'min_samples_split': 0.2, 'min_samples_leaf': 0.8, 'max_features': 0.2, 'warm_start': True}. Best is trial 14 with value: 0.3959025856691411.
[I 2024-01-16 02:49:51,322] Trial 13 finished with value: 0.36122545125348793 and parameters: {'model_name': 'IterativeImputer', 'sample_posterior': False, 'initial_strategy': 'mean', 'imputation_order': 'roman'}. Best is trial 13 with value: 0.36122545125348793.
[I 2024-01-16 02:50:34,701] Trial 44 finished with value: 0.36122542429115745 and parameters: {'model_name': 'IterativeImputer', 'sample_posterior': False, 'initial_strategy': 'mean', 'imputation_order': 'arabic'}. Best is trial 44 with value: 0.36122542429115745.
[I 2024-01-16 02:50:59,559] Trial 76 finished with value: 0.36122541771879135 and parameters: {'model_name': 'IterativeImputer', 'sample_posterior': False, 'initial_strategy': 'mean', 'imputation_order': 'ascending'}. Best is trial 76 with value: 0.36122541771879135.
[I 2024-01-16 02:51:25,930] Trial 5 finished with value: 0.36122543286820663 and parameters: {'model_name': 'IterativeImputer', 'sample_posterior': False, 'initial_strategy': 'constant', 'imputation_order': 'roman'}. Best is trial 76 with value: 0.36122541771879135.
[I 2024-01-16 02:51:29,153] Trial 16 finished with value: 0.36122543286820663 and parameters: {'model_name': 'IterativeImputer', 'sample_posterior': False, 'initial_strategy': 'constant', 'imputation_order': 'roman'}. Best is trial 76 with value: 0.36122541771879135.
[I 2024-01-16 02:51:38,197] Trial 10 finished with value: 0.361225433682097 and parameters: {'model_name': 'IterativeImputer', 'sample_posterior': False, 'initial_strategy': 'median', 'imputation_order': 'arabic'}. Best is trial 76 with value: 0.36122541771879135.
[I 2024-01-16 02:51:47,829] Trial 59 finished with value: 0.36122543286820663 and parameters: {'model_name': 'IterativeImputer', 'sample_posterior': False, 'initial_strategy': 'median', 'imputation_order': 'roman'}. Best is trial 76 with value: 0.36122541771879135.
[I 2024-01-16 02:51:57,476] Trial 61 finished with value: 0.390928717168066 and parameters: {'model_name': 'RandomForestImputer', 'max_iter': 13, 'decreasing': False, 'min_samples_split': 0.5, 'min_samples_leaf': 0.5, 'max_features': 0.4, 'warm_start': True}. Best is trial 76 with value: 0.36122541771879135.
[I 2024-01-16 02:52:01,570] Trial 67 finished with value: 0.36122543347603675 and parameters: {'model_name': 'IterativeImputer', 'sample_posterior': False, 'initial_strategy': 'constant', 'imputation_order': 'ascending'}. Best is trial 76 with value: 0.36122541771879135.
[I 2024-01-16 02:52:04,714] Trial 66 finished with value: 0.361225433682097 and parameters: {'model_name': 'IterativeImputer', 'sample_posterior': False, 'initial_strategy': 'median', 'imputation_order': 'arabic'}. Best is trial 76 with value: 0.36122541771879135.
[I 2024-01-16 02:52:30,366] Trial 68 finished with value: 0.39182273385333555 and parameters: {'model_name': 'RandomForestImputer', 'max_iter': 12, 'decreasing': False, 'min_samples_split': 1.0, 'min_samples_leaf': 0.5, 'max_features': 0.7000000000000001, 'warm_start': True}. Best is trial 76 with value: 0.36122541771879135.
[I 2024-01-16 02:53:04,577] Trial 49 finished with value: 0.3612253604613292 and parameters: {'model_name': 'IterativeImputer', 'sample_posterior': False, 'initial_strategy': 'mean', 'imputation_order': 'random'}. Best is trial 49 with value: 0.3612253604613292.
[I 2024-01-16 02:53:07,189] Trial 73 finished with value: 0.361225433682097 and parameters: {'model_name': 'IterativeImputer', 'sample_posterior': False, 'initial_strategy': 'median', 'imputation_order': 'arabic'}. Best is trial 49 with value: 0.3612253604613292.
[I 2024-01-16 02:53:33,692] Trial 75 finished with value: 0.36122543286820663 and parameters: {'model_name': 'IterativeImputer', 'sample_posterior': False, 'initial_strategy': 'most_frequent', 'imputation_order': 'roman'}. Best is trial 49 with value: 0.3612253604613292.
[I 2024-01-16 02:53:51,750] Trial 40 finished with value: 0.40115062138436447 and parameters: {'model_name': 'RandomForestImputer', 'max_iter': 16, 'decreasing': True, 'min_samples_split': 0.8, 'min_samples_leaf': 0.9, 'max_features': 0.9, 'warm_start': True}. Best is trial 49 with value: 0.3612253604613292.
[I 2024-01-16 02:55:06,549] Trial 50 finished with value: 0.3612253972885978 and parameters: {'model_name': 'IterativeImputer', 'sample_posterior': False, 'initial_strategy': 'most_frequent', 'imputation_order': 'random'}. Best is trial 49 with value: 0.3612253604613292.
[I 2024-01-16 02:55:44,951] Trial 52 finished with value: 0.36122556878619866 and parameters: {'model_name': 'IterativeImputer', 'sample_posterior': False, 'initial_strategy': 'constant', 'imputation_order': 'random'}. Best is trial 49 with value: 0.3612253604613292.
[I 2024-01-16 02:55:54,852] Trial 65 finished with value: 0.3612253528044419 and parameters: {'model_name': 'IterativeImputer', 'sample_posterior': False, 'initial_strategy': 'most_frequent', 'imputation_order': 'random'}. Best is trial 65 with value: 0.3612253528044419.
[I 2024-01-16 02:56:11,046] Trial 71 finished with value: 0.36122547095657587 and parameters: {'model_name': 'IterativeImputer', 'sample_posterior': False, 'initial_strategy': 'median', 'imputation_order': 'random'}. Best is trial 65 with value: 0.3612253528044419.
[I 2024-01-16 02:56:31,730] Trial 72 finished with value: 0.3612254638172925 and parameters: {'model_name': 'IterativeImputer', 'sample_posterior': False, 'initial_strategy': 'most_frequent', 'imputation_order': 'random'}. Best is trial 65 with value: 0.3612253528044419.
[I 2024-01-16 02:59:48,195] Trial 79 finished with value: 0.3612254937432523 and parameters: {'model_name': 'IterativeImputer', 'sample_posterior': False, 'initial_strategy': 'mean', 'imputation_order': 'descending'}. Best is trial 65 with value: 0.3612253528044419.
[I 2024-01-16 02:59:56,504] Trial 23 finished with value: 0.40025833981219777 and parameters: {'model_name': 'RandomForestImputer', 'max_iter': 25, 'decreasing': True, 'min_samples_split': 0.0, 'min_samples_leaf': 0.5, 'max_features': 0.2, 'warm_start': True}. Best is trial 65 with value: 0.3612253528044419.
[I 2024-01-16 03:00:12,403] Trial 80 finished with value: 0.36122545125348793 and parameters: {'model_name': 'IterativeImputer', 'sample_posterior': False, 'initial_strategy': 'mean', 'imputation_order': 'roman'}. Best is trial 65 with value: 0.3612253528044419.
[I 2024-01-16 03:01:13,711] Trial 81 finished with value: 0.36122545125348793 and parameters: {'model_name': 'IterativeImputer', 'sample_posterior': False, 'initial_strategy': 'mean', 'imputation_order': 'roman'}. Best is trial 65 with value: 0.3612253528044419.
[I 2024-01-16 03:01:47,046] Trial 82 finished with value: 0.36122545125348793 and parameters: {'model_name': 'IterativeImputer', 'sample_posterior': False, 'initial_strategy': 'mean', 'imputation_order': 'roman'}. Best is trial 65 with value: 0.3612253528044419.
[I 2024-01-16 03:01:57,898] Trial 83 finished with value: 0.36122545125348793 and parameters: {'model_name': 'IterativeImputer', 'sample_posterior': False, 'initial_strategy': 'mean', 'imputation_order': 'roman'}. Best is trial 65 with value: 0.3612253528044419.
[I 2024-01-16 03:02:18,519] Trial 84 finished with value: 0.36122545125348793 and parameters: {'model_name': 'IterativeImputer', 'sample_posterior': False, 'initial_strategy': 'mean', 'imputation_order': 'roman'}. Best is trial 65 with value: 0.3612253528044419.
[I 2024-01-16 03:02:36,786] Trial 89 finished with value: 0.36122545125348793 and parameters: {'model_name': 'IterativeImputer', 'sample_posterior': False, 'initial_strategy': 'mean', 'imputation_order': 'roman'}. Best is trial 65 with value: 0.3612253528044419.
[I 2024-01-16 03:03:24,433] Trial 85 finished with value: 0.36122543347603675 and parameters: {'model_name': 'IterativeImputer', 'sample_posterior': False, 'initial_strategy': 'constant', 'imputation_order': 'ascending'}. Best is trial 65 with value: 0.3612253528044419.
[I 2024-01-16 03:03:31,967] Trial 86 finished with value: 0.36122543347603675 and parameters: {'model_name': 'IterativeImputer', 'sample_posterior': False, 'initial_strategy': 'constant', 'imputation_order': 'ascending'}. Best is trial 65 with value: 0.3612253528044419.
[I 2024-01-16 03:03:34,233] Trial 87 finished with value: 0.36122543347603675 and parameters: {'model_name': 'IterativeImputer', 'sample_posterior': False, 'initial_strategy': 'constant', 'imputation_order': 'ascending'}. Best is trial 65 with value: 0.3612253528044419.
[I 2024-01-16 03:03:43,327] Trial 88 finished with value: 0.36122543286820663 and parameters: {'model_name': 'IterativeImputer', 'sample_posterior': False, 'initial_strategy': 'constant', 'imputation_order': 'roman'}. Best is trial 65 with value: 0.3612253528044419.
[I 2024-01-16 03:03:50,535] Trial 90 finished with value: 0.36122543286820663 and parameters: {'model_name': 'IterativeImputer', 'sample_posterior': False, 'initial_strategy': 'constant', 'imputation_order': 'roman'}. Best is trial 65 with value: 0.3612253528044419.
[I 2024-01-16 03:04:12,320] Trial 91 finished with value: 0.36122543286820663 and parameters: {'model_name': 'IterativeImputer', 'sample_posterior': False, 'initial_strategy': 'constant', 'imputation_order': 'roman'}. Best is trial 65 with value: 0.3612253528044419.
[I 2024-01-16 03:05:24,332] Trial 92 finished with value: 0.3612255741791909 and parameters: {'model_name': 'IterativeImputer', 'sample_posterior': False, 'initial_strategy': 'mean', 'imputation_order': 'random'}. Best is trial 65 with value: 0.3612253528044419.
[I 2024-01-16 03:06:55,754] Trial 57 finished with value: 0.40081569329653305 and parameters: {'model_name': 'RandomForestImputer', 'max_iter': 36, 'decreasing': True, 'min_samples_split': 0.4, 'min_samples_leaf': 0.2, 'max_features': 0.9, 'warm_start': True}. Best is trial 65 with value: 0.3612253528044419.
[I 2024-01-16 03:08:21,485] Trial 0 finished with value: 0.40088311983987734 and parameters: {'model_name': 'RandomForestImputer', 'max_iter': 73, 'decreasing': True, 'min_samples_split': 0.8, 'min_samples_leaf': 0.9, 'max_features': 0.6, 'warm_start': True}. Best is trial 65 with value: 0.3612253528044419.
[I 2024-01-16 03:08:29,287] Trial 1 finished with value: 0.3909458856463365 and parameters: {'model_name': 'RandomForestImputer', 'max_iter': 84, 'decreasing': False, 'min_samples_split': 1.0, 'min_samples_leaf': 0.8, 'max_features': 0.6, 'warm_start': True}. Best is trial 65 with value: 0.3612253528044419.
[I 2024-01-16 03:12:57,999] Trial 2 finished with value: 0.39644912517342223 and parameters: {'model_name': 'RandomForestImputer', 'max_iter': 3, 'decreasing': True, 'min_samples_split': 0.8, 'min_samples_leaf': 0.9, 'max_features': 0.8, 'warm_start': False}. Best is trial 65 with value: 0.3612253528044419.
[I 2024-01-16 03:15:24,601] Trial 64 finished with value: 0.38923184355162616 and parameters: {'model_name': 'RandomForestImputer', 'max_iter': 69, 'decreasing': False, 'min_samples_split': 0.30000000000000004, 'min_samples_leaf': 0.2, 'max_features': 0.9, 'warm_start': True}. Best is trial 65 with value: 0.3612253528044419.
[I 2024-01-16 03:16:55,293] Trial 42 finished with value: 0.499821753193606 and parameters: {'model_name': 'GAIN', 'batch_size': 121, 'hint_rate': 0.5700000000000001, 'alpha': 0, 'iterations': 583}. Best is trial 65 with value: 0.3612253528044419.
[I 2024-01-16 03:21:59,233] Trial 22 finished with value: 0.4668638917844398 and parameters: {'model_name': 'IterativeImputer', 'sample_posterior': True, 'initial_strategy': 'median', 'imputation_order': 'descending'}. Best is trial 65 with value: 0.3612253528044419.
[I 2024-01-16 03:22:03,509] Trial 33 finished with value: 0.4677059443655057 and parameters: {'model_name': 'IterativeImputer', 'sample_posterior': True, 'initial_strategy': 'mean', 'imputation_order': 'roman'}. Best is trial 65 with value: 0.3612253528044419.
[I 2024-01-16 03:22:11,338] Trial 8 finished with value: 0.4635017533287774 and parameters: {'model_name': 'IterativeImputer', 'sample_posterior': True, 'initial_strategy': 'constant', 'imputation_order': 'arabic'}. Best is trial 65 with value: 0.3612253528044419.
[I 2024-01-16 03:22:15,748] Trial 48 finished with value: 0.4660008629000781 and parameters: {'model_name': 'IterativeImputer', 'sample_posterior': True, 'initial_strategy': 'constant', 'imputation_order': 'arabic'}. Best is trial 65 with value: 0.3612253528044419.
[I 2024-01-16 03:22:17,780] Trial 9 finished with value: 0.4531839034634852 and parameters: {'model_name': 'IterativeImputer', 'sample_posterior': True, 'initial_strategy': 'constant', 'imputation_order': 'arabic'}. Best is trial 65 with value: 0.3612253528044419.
[I 2024-01-16 03:22:18,465] Trial 11 finished with value: 0.463969753195259 and parameters: {'model_name': 'IterativeImputer', 'sample_posterior': True, 'initial_strategy': 'most_frequent', 'imputation_order': 'ascending'}. Best is trial 65 with value: 0.3612253528044419.
[I 2024-01-16 03:22:21,742] Trial 20 finished with value: 0.4651159419586171 and parameters: {'model_name': 'IterativeImputer', 'sample_posterior': True, 'initial_strategy': 'most_frequent', 'imputation_order': 'roman'}. Best is trial 65 with value: 0.3612253528044419.
[I 2024-01-16 03:22:26,632] Trial 62 finished with value: 0.46774242069812627 and parameters: {'model_name': 'IterativeImputer', 'sample_posterior': True, 'initial_strategy': 'median', 'imputation_order': 'descending'}. Best is trial 65 with value: 0.3612253528044419.
[I 2024-01-16 03:22:28,531] Trial 51 finished with value: 0.46252593928971664 and parameters: {'model_name': 'IterativeImputer', 'sample_posterior': True, 'initial_strategy': 'most_frequent', 'imputation_order': 'descending'}. Best is trial 65 with value: 0.3612253528044419.
