Run: 5
/cm/local/apps/slurm/var/spool/job691965/slurm_script: line 23: /common/ketrong/minconda3/etc/profile.d/conda.sh: No such file or directory
/cm/local/apps/slurm/var/spool/job691965/slurm_script: line 26: $'\nconda create --name tpot2devenv -c conda-forge python=3.10\n': command not found
/cm/local/apps/slurm/var/spool/job691965/slurm_script: line 31: $'\npip install -r requirements.txt\n': command not found
RunStart
2024-02-29 07:18:53.935198: I tensorflow/core/util/port.cc:113] oneDNN custom operations are on. You may see slightly different numerical results due to floating-point round-off errors from different computation orders. To turn them off, set the environment variable `TF_ENABLE_ONEDNN_OPTS=0`.
2024-02-29 07:18:53.970113: E external/local_xla/xla/stream_executor/cuda/cuda_dnn.cc:9261] Unable to register cuDNN factory: Attempting to register factory for plugin cuDNN when one has already been registered
2024-02-29 07:18:53.970134: E external/local_xla/xla/stream_executor/cuda/cuda_fft.cc:607] Unable to register cuFFT factory: Attempting to register factory for plugin cuFFT when one has already been registered
2024-02-29 07:18:53.971264: E external/local_xla/xla/stream_executor/cuda/cuda_blas.cc:1515] Unable to register cuBLAS factory: Attempting to register factory for plugin cuBLAS when one has already been registered
2024-02-29 07:18:53.976932: I tensorflow/core/platform/cpu_feature_guard.cc:182] This TensorFlow binary is optimized to use available CPU instructions in performance-critical operations.
To enable the following instructions: AVX2 AVX512F AVX512_VNNI FMA, in other operations, rebuild TensorFlow with the appropriate compiler flags.
2024-02-29 07:18:56.684376: W tensorflow/compiler/tf2tensorrt/utils/py_utils.cc:38] TF-TRT Warning: Could not find TensorRT
WARNING:tensorflow:From /home/ketrong/miniconda3/envs/tpot2devenv/lib/python3.10/site-packages/tensorflow/python/compat/v2_compat.py:108: disable_resource_variables (from tensorflow.python.ops.variable_scope) is deprecated and will be removed in a future version.
Instructions for updating:
non-resource variables are not supported in the long term
starting loops
working on 
logs/359935/tpot2_base_normal_MCAR_0.9
2.541018009185791
loading data
logs/359935/tpot2_base_normal_MCAR_0.9/data/359935_True.pkl
[3 2 2 ... 2 3 3]
        0   ...    10
0      8.3  ...  11.0
1      6.4  ...  10.0
2      6.6  ...   9.3
3      6.2  ...   9.4
4      6.6  ...   9.8
...    ...  ...   ...
5842   6.3  ...  10.4
5843   6.2  ...  11.3
5844  10.8  ...   9.6
5845   6.9  ...   9.6
5846   9.1  ...  12.5

[5847 rows x 11 columns]
      0   ...    10
0    6.6  ...  10.3
1    6.8  ...  10.6
2    8.4  ...   8.9
3    8.3  ...   9.5
4    6.3  ...  10.0
..   ...  ...   ...
645  6.7  ...  11.4
646  6.6  ...   9.2
647  6.3  ...  11.3
648  7.0  ...  11.2
649  6.8  ...   9.5

[650 rows x 11 columns]
running experiment 1/3 - Does large hyperparameter space improve reconstruction accuracy over simple
[I 2024-02-29 07:19:08,263] A new study created in memory with name: no-name-f9bfed7b-eee0-4005-a0fa-77923633bd19
[I 2024-02-29 07:19:08,588] Trial 3 finished with value: 11.847415887932225 and parameters: {'model_name': 'SimpleImputer', 'strategy': 'constant'}. Best is trial 3 with value: 11.847415887932225.
[I 2024-02-29 07:19:08,775] Trial 2 finished with value: 11.847415887932225 and parameters: {'model_name': 'SimpleImputer', 'strategy': 'constant'}. Best is trial 3 with value: 11.847415887932225.
[I 2024-02-29 07:19:09,239] Trial 9 finished with value: 11.847415887932225 and parameters: {'model_name': 'SimpleImputer', 'strategy': 'constant'}. Best is trial 3 with value: 11.847415887932225.
[I 2024-02-29 07:19:09,453] Trial 6 finished with value: 11.847415887932225 and parameters: {'model_name': 'SimpleImputer', 'strategy': 'constant'}. Best is trial 3 with value: 11.847415887932225.
[I 2024-02-29 07:19:09,646] Trial 5 finished with value: 11.847415887932225 and parameters: {'model_name': 'SimpleImputer', 'strategy': 'constant'}. Best is trial 3 with value: 11.847415887932225.
[I 2024-02-29 07:19:10,162] Trial 25 finished with value: 11.847415887932225 and parameters: {'model_name': 'SimpleImputer', 'strategy': 'constant'}. Best is trial 3 with value: 11.847415887932225.
[I 2024-02-29 07:19:10,403] Trial 21 finished with value: 10.891915699654898 and parameters: {'model_name': 'SimpleImputer', 'strategy': 'mean'}. Best is trial 21 with value: 10.891915699654898.
[I 2024-02-29 07:19:10,607] Trial 11 finished with value: 10.891915699654898 and parameters: {'model_name': 'SimpleImputer', 'strategy': 'mean'}. Best is trial 21 with value: 10.891915699654898.
[I 2024-02-29 07:19:10,902] Trial 19 finished with value: 11.847415887932225 and parameters: {'model_name': 'SimpleImputer', 'strategy': 'constant'}. Best is trial 21 with value: 10.891915699654898.
[I 2024-02-29 07:19:11,117] Trial 23 finished with value: 10.891915699654898 and parameters: {'model_name': 'SimpleImputer', 'strategy': 'mean'}. Best is trial 21 with value: 10.891915699654898.
[I 2024-02-29 07:19:11,437] Trial 14 finished with value: 10.891915699654898 and parameters: {'model_name': 'SimpleImputer', 'strategy': 'mean'}. Best is trial 21 with value: 10.891915699654898.
[I 2024-02-29 07:19:11,686] Trial 18 finished with value: 10.891915699654898 and parameters: {'model_name': 'SimpleImputer', 'strategy': 'mean'}. Best is trial 21 with value: 10.891915699654898.
[I 2024-02-29 07:19:11,842] Trial 0 finished with value: 11.847415887932225 and parameters: {'model_name': 'SimpleImputer', 'strategy': 'median'}. Best is trial 21 with value: 10.891915699654898.
[I 2024-02-29 07:19:12,067] Trial 13 finished with value: 10.891915699654898 and parameters: {'model_name': 'SimpleImputer', 'strategy': 'mean'}. Best is trial 21 with value: 10.891915699654898.
[I 2024-02-29 07:19:12,291] Trial 31 finished with value: 10.891915699654898 and parameters: {'model_name': 'SimpleImputer', 'strategy': 'mean'}. Best is trial 21 with value: 10.891915699654898.
[I 2024-02-29 07:19:12,480] Trial 17 finished with value: 10.891915699654898 and parameters: {'model_name': 'SimpleImputer', 'strategy': 'mean'}. Best is trial 21 with value: 10.891915699654898.
[I 2024-02-29 07:19:12,829] Trial 27 finished with value: 10.891915699654898 and parameters: {'model_name': 'SimpleImputer', 'strategy': 'mean'}. Best is trial 21 with value: 10.891915699654898.
[I 2024-02-29 07:19:13,048] Trial 54 finished with value: 11.847415887932225 and parameters: {'model_name': 'SimpleImputer', 'strategy': 'constant'}. Best is trial 21 with value: 10.891915699654898.
[I 2024-02-29 07:19:13,372] Trial 34 finished with value: 11.847415887932225 and parameters: {'model_name': 'SimpleImputer', 'strategy': 'constant'}. Best is trial 21 with value: 10.891915699654898.
[I 2024-02-29 07:19:13,626] Trial 53 finished with value: 11.847415887932225 and parameters: {'model_name': 'SimpleImputer', 'strategy': 'constant'}. Best is trial 21 with value: 10.891915699654898.
[I 2024-02-29 07:19:13,798] Trial 30 finished with value: 10.891915699654898 and parameters: {'model_name': 'SimpleImputer', 'strategy': 'mean'}. Best is trial 21 with value: 10.891915699654898.
[I 2024-02-29 07:19:13,951] Trial 29 finished with value: 10.891915699654898 and parameters: {'model_name': 'SimpleImputer', 'strategy': 'mean'}. Best is trial 21 with value: 10.891915699654898.
[I 2024-02-29 07:19:14,114] Trial 51 finished with value: 11.847415887932225 and parameters: {'model_name': 'SimpleImputer', 'strategy': 'constant'}. Best is trial 21 with value: 10.891915699654898.
[I 2024-02-29 07:19:14,275] Trial 52 finished with value: 11.847415887932225 and parameters: {'model_name': 'SimpleImputer', 'strategy': 'constant'}. Best is trial 21 with value: 10.891915699654898.
[I 2024-02-29 07:19:14,489] Trial 48 finished with value: 10.891915699654898 and parameters: {'model_name': 'SimpleImputer', 'strategy': 'mean'}. Best is trial 21 with value: 10.891915699654898.
[I 2024-02-29 07:19:14,885] Trial 4 finished with value: 11.847415887932225 and parameters: {'model_name': 'SimpleImputer', 'strategy': 'median'}. Best is trial 21 with value: 10.891915699654898.
[I 2024-02-29 07:19:15,058] Trial 39 finished with value: 10.891915699654898 and parameters: {'model_name': 'SimpleImputer', 'strategy': 'mean'}. Best is trial 21 with value: 10.891915699654898.
[I 2024-02-29 07:19:15,225] Trial 22 finished with value: 11.847415887932225 and parameters: {'model_name': 'SimpleImputer', 'strategy': 'median'}. Best is trial 21 with value: 10.891915699654898.
[I 2024-02-29 07:19:15,385] Trial 12 finished with value: 11.847415887932225 and parameters: {'model_name': 'SimpleImputer', 'strategy': 'median'}. Best is trial 21 with value: 10.891915699654898.
[I 2024-02-29 07:19:15,589] Trial 24 finished with value: 11.847415887932225 and parameters: {'model_name': 'SimpleImputer', 'strategy': 'median'}. Best is trial 21 with value: 10.891915699654898.
[I 2024-02-29 07:19:15,759] Trial 37 finished with value: 10.891915699654898 and parameters: {'model_name': 'SimpleImputer', 'strategy': 'mean'}. Best is trial 21 with value: 10.891915699654898.
[I 2024-02-29 07:19:15,983] Trial 15 finished with value: 11.847415887932225 and parameters: {'model_name': 'SimpleImputer', 'strategy': 'median'}. Best is trial 21 with value: 10.891915699654898.
[I 2024-02-29 07:19:16,151] Trial 26 finished with value: 11.847415887932225 and parameters: {'model_name': 'SimpleImputer', 'strategy': 'median'}. Best is trial 21 with value: 10.891915699654898.
[I 2024-02-29 07:19:16,326] Trial 58 finished with value: 10.891915699654898 and parameters: {'model_name': 'SimpleImputer', 'strategy': 'mean'}. Best is trial 21 with value: 10.891915699654898.
[I 2024-02-29 07:19:16,485] Trial 46 finished with value: 10.891915699654898 and parameters: {'model_name': 'SimpleImputer', 'strategy': 'mean'}. Best is trial 21 with value: 10.891915699654898.
[I 2024-02-29 07:19:16,679] Trial 20 finished with value: 11.847415887932225 and parameters: {'model_name': 'SimpleImputer', 'strategy': 'median'}. Best is trial 21 with value: 10.891915699654898.
[I 2024-02-29 07:19:17,511] Trial 47 finished with value: 11.847415887932225 and parameters: {'model_name': 'SimpleImputer', 'strategy': 'median'}. Best is trial 21 with value: 10.891915699654898.
[I 2024-02-29 07:19:17,765] Trial 57 finished with value: 11.847415887932225 and parameters: {'model_name': 'SimpleImputer', 'strategy': 'median'}. Best is trial 21 with value: 10.891915699654898.
[I 2024-02-29 07:19:17,919] Trial 49 finished with value: 11.847415887932225 and parameters: {'model_name': 'SimpleImputer', 'strategy': 'median'}. Best is trial 21 with value: 10.891915699654898.
[I 2024-02-29 07:19:18,095] Trial 45 finished with value: 11.847415887932225 and parameters: {'model_name': 'SimpleImputer', 'strategy': 'median'}. Best is trial 21 with value: 10.891915699654898.
[I 2024-02-29 07:19:18,503] Trial 36 finished with value: 11.847415887932225 and parameters: {'model_name': 'SimpleImputer', 'strategy': 'median'}. Best is trial 21 with value: 10.891915699654898.
[I 2024-02-29 07:19:18,830] Trial 56 finished with value: 11.847415887932225 and parameters: {'model_name': 'SimpleImputer', 'strategy': 'median'}. Best is trial 21 with value: 10.891915699654898.
[I 2024-02-29 07:19:19,169] Trial 16 finished with value: 11.847415887932225 and parameters: {'model_name': 'SimpleImputer', 'strategy': 'most_frequent'}. Best is trial 21 with value: 10.891915699654898.
[I 2024-02-29 07:19:19,675] Trial 7 finished with value: 11.847415887932225 and parameters: {'model_name': 'SimpleImputer', 'strategy': 'most_frequent'}. Best is trial 21 with value: 10.891915699654898.
[I 2024-02-29 07:19:20,241] Trial 8 finished with value: 11.847415887932225 and parameters: {'model_name': 'SimpleImputer', 'strategy': 'most_frequent'}. Best is trial 21 with value: 10.891915699654898.
[I 2024-02-29 07:19:20,576] Trial 1 finished with value: 11.847415887932225 and parameters: {'model_name': 'SimpleImputer', 'strategy': 'most_frequent'}. Best is trial 21 with value: 10.891915699654898.
[I 2024-02-29 07:19:20,820] Trial 10 finished with value: 11.847415887932225 and parameters: {'model_name': 'SimpleImputer', 'strategy': 'most_frequent'}. Best is trial 21 with value: 10.891915699654898.
[I 2024-02-29 07:19:21,450] Trial 40 finished with value: 11.847415887932225 and parameters: {'model_name': 'SimpleImputer', 'strategy': 'most_frequent'}. Best is trial 21 with value: 10.891915699654898.
[I 2024-02-29 07:19:22,077] Trial 28 finished with value: 11.847415887932225 and parameters: {'model_name': 'SimpleImputer', 'strategy': 'most_frequent'}. Best is trial 21 with value: 10.891915699654898.
[I 2024-02-29 07:19:22,558] Trial 38 finished with value: 11.847415887932225 and parameters: {'model_name': 'SimpleImputer', 'strategy': 'most_frequent'}. Best is trial 21 with value: 10.891915699654898.
[I 2024-02-29 07:19:22,799] Trial 55 finished with value: 11.847415887932225 and parameters: {'model_name': 'SimpleImputer', 'strategy': 'most_frequent'}. Best is trial 21 with value: 10.891915699654898.
[I 2024-02-29 07:19:22,999] Trial 43 finished with value: 11.847415887932225 and parameters: {'model_name': 'SimpleImputer', 'strategy': 'most_frequent'}. Best is trial 21 with value: 10.891915699654898.
[I 2024-02-29 07:19:23,234] Trial 50 finished with value: 11.847415887932225 and parameters: {'model_name': 'SimpleImputer', 'strategy': 'most_frequent'}. Best is trial 21 with value: 10.891915699654898.
[I 2024-02-29 07:19:23,494] Trial 32 finished with value: 11.847415887932225 and parameters: {'model_name': 'SimpleImputer', 'strategy': 'most_frequent'}. Best is trial 21 with value: 10.891915699654898.
[I 2024-02-29 07:19:23,833] Trial 61 finished with value: 11.847415887932225 and parameters: {'model_name': 'SimpleImputer', 'strategy': 'most_frequent'}. Best is trial 21 with value: 10.891915699654898.
[I 2024-02-29 07:19:24,174] Trial 59 finished with value: 11.847415887932225 and parameters: {'model_name': 'SimpleImputer', 'strategy': 'most_frequent'}. Best is trial 21 with value: 10.891915699654898.
[I 2024-02-29 07:19:24,371] Trial 33 finished with value: 11.847415887932225 and parameters: {'model_name': 'SimpleImputer', 'strategy': 'most_frequent'}. Best is trial 21 with value: 10.891915699654898.
[I 2024-02-29 07:19:24,698] Trial 92 finished with value: 10.891915699654898 and parameters: {'model_name': 'SimpleImputer', 'strategy': 'mean'}. Best is trial 21 with value: 10.891915699654898.
[I 2024-02-29 07:19:24,911] Trial 64 finished with value: 11.847415887932225 and parameters: {'model_name': 'SimpleImputer', 'strategy': 'most_frequent'}. Best is trial 21 with value: 10.891915699654898.
[I 2024-02-29 07:19:25,110] Trial 63 finished with value: 11.847415887932225 and parameters: {'model_name': 'SimpleImputer', 'strategy': 'most_frequent'}. Best is trial 21 with value: 10.891915699654898.
[I 2024-02-29 07:19:25,284] Trial 41 finished with value: 11.847415887932225 and parameters: {'model_name': 'SimpleImputer', 'strategy': 'most_frequent'}. Best is trial 21 with value: 10.891915699654898.
[I 2024-02-29 07:19:25,306] Trial 62 finished with value: 11.847415887932225 and parameters: {'model_name': 'SimpleImputer', 'strategy': 'most_frequent'}. Best is trial 21 with value: 10.891915699654898.
[I 2024-02-29 07:19:25,315] Trial 42 finished with value: 11.847415887932225 and parameters: {'model_name': 'SimpleImputer', 'strategy': 'most_frequent'}. Best is trial 21 with value: 10.891915699654898.
[I 2024-02-29 07:19:25,959] Trial 93 finished with value: 10.891915699654898 and parameters: {'model_name': 'SimpleImputer', 'strategy': 'mean'}. Best is trial 21 with value: 10.891915699654898.
[I 2024-02-29 07:19:26,263] Trial 94 finished with value: 10.891915699654898 and parameters: {'model_name': 'SimpleImputer', 'strategy': 'mean'}. Best is trial 21 with value: 10.891915699654898.
[I 2024-02-29 07:19:26,445] Trial 65 finished with value: 11.847415887932225 and parameters: {'model_name': 'SimpleImputer', 'strategy': 'most_frequent'}. Best is trial 21 with value: 10.891915699654898.
[I 2024-02-29 07:19:26,707] Trial 66 finished with value: 11.847415887932225 and parameters: {'model_name': 'SimpleImputer', 'strategy': 'most_frequent'}. Best is trial 21 with value: 10.891915699654898.
[I 2024-02-29 07:19:26,938] Trial 35 finished with value: 11.847415887932225 and parameters: {'model_name': 'SimpleImputer', 'strategy': 'most_frequent'}. Best is trial 21 with value: 10.891915699654898.
[I 2024-02-29 07:19:27,244] Trial 44 finished with value: 11.847415887932225 and parameters: {'model_name': 'SimpleImputer', 'strategy': 'most_frequent'}. Best is trial 21 with value: 10.891915699654898.
[I 2024-02-29 07:19:27,687] Trial 96 finished with value: 10.891915699654898 and parameters: {'model_name': 'SimpleImputer', 'strategy': 'mean'}. Best is trial 21 with value: 10.891915699654898.
[I 2024-02-29 07:19:27,968] Trial 60 finished with value: 11.847415887932225 and parameters: {'model_name': 'SimpleImputer', 'strategy': 'most_frequent'}. Best is trial 21 with value: 10.891915699654898.
[I 2024-02-29 07:19:28,163] Trial 67 finished with value: 11.847415887932225 and parameters: {'model_name': 'SimpleImputer', 'strategy': 'most_frequent'}. Best is trial 21 with value: 10.891915699654898.
[I 2024-02-29 07:19:28,486] Trial 95 finished with value: 10.891915699654898 and parameters: {'model_name': 'SimpleImputer', 'strategy': 'mean'}. Best is trial 21 with value: 10.891915699654898.
[I 2024-02-29 07:19:28,707] Trial 72 finished with value: 11.847415887932225 and parameters: {'model_name': 'SimpleImputer', 'strategy': 'most_frequent'}. Best is trial 21 with value: 10.891915699654898.
[I 2024-02-29 07:19:28,912] Trial 70 finished with value: 11.847415887932225 and parameters: {'model_name': 'SimpleImputer', 'strategy': 'most_frequent'}. Best is trial 21 with value: 10.891915699654898.
[I 2024-02-29 07:19:29,240] Trial 73 finished with value: 11.847415887932225 and parameters: {'model_name': 'SimpleImputer', 'strategy': 'most_frequent'}. Best is trial 21 with value: 10.891915699654898.
[I 2024-02-29 07:19:29,660] Trial 83 finished with value: 11.847415887932225 and parameters: {'model_name': 'SimpleImputer', 'strategy': 'most_frequent'}. Best is trial 21 with value: 10.891915699654898.
[I 2024-02-29 07:19:29,924] Trial 100 finished with value: 10.891915699654898 and parameters: {'model_name': 'SimpleImputer', 'strategy': 'mean'}. Best is trial 21 with value: 10.891915699654898.
[I 2024-02-29 07:19:30,190] Trial 79 finished with value: 11.847415887932225 and parameters: {'model_name': 'SimpleImputer', 'strategy': 'most_frequent'}. Best is trial 21 with value: 10.891915699654898.
[I 2024-02-29 07:19:30,556] Trial 98 finished with value: 10.891915699654898 and parameters: {'model_name': 'SimpleImputer', 'strategy': 'mean'}. Best is trial 21 with value: 10.891915699654898.
[I 2024-02-29 07:19:30,728] Trial 74 finished with value: 11.847415887932225 and parameters: {'model_name': 'SimpleImputer', 'strategy': 'most_frequent'}. Best is trial 21 with value: 10.891915699654898.
[I 2024-02-29 07:19:30,890] Trial 99 finished with value: 10.891915699654898 and parameters: {'model_name': 'SimpleImputer', 'strategy': 'mean'}. Best is trial 21 with value: 10.891915699654898.
[I 2024-02-29 07:19:31,109] Trial 80 finished with value: 11.847415887932225 and parameters: {'model_name': 'SimpleImputer', 'strategy': 'most_frequent'}. Best is trial 21 with value: 10.891915699654898.
[I 2024-02-29 07:19:31,341] Trial 102 finished with value: 10.891915699654898 and parameters: {'model_name': 'SimpleImputer', 'strategy': 'mean'}. Best is trial 21 with value: 10.891915699654898.
[I 2024-02-29 07:19:31,621] Trial 101 finished with value: 10.891915699654898 and parameters: {'model_name': 'SimpleImputer', 'strategy': 'mean'}. Best is trial 21 with value: 10.891915699654898.
[I 2024-02-29 07:19:31,937] Trial 68 finished with value: 11.847415887932225 and parameters: {'model_name': 'SimpleImputer', 'strategy': 'most_frequent'}. Best is trial 21 with value: 10.891915699654898.
[I 2024-02-29 07:19:32,204] Trial 106 finished with value: 10.891915699654898 and parameters: {'model_name': 'SimpleImputer', 'strategy': 'mean'}. Best is trial 21 with value: 10.891915699654898.
[I 2024-02-29 07:19:32,436] Trial 97 finished with value: 10.891915699654898 and parameters: {'model_name': 'SimpleImputer', 'strategy': 'mean'}. Best is trial 21 with value: 10.891915699654898.
[I 2024-02-29 07:19:32,681] Trial 82 finished with value: 11.847415887932225 and parameters: {'model_name': 'SimpleImputer', 'strategy': 'most_frequent'}. Best is trial 21 with value: 10.891915699654898.
[I 2024-02-29 07:19:33,010] Trial 104 finished with value: 10.891915699654898 and parameters: {'model_name': 'SimpleImputer', 'strategy': 'mean'}. Best is trial 21 with value: 10.891915699654898.
[I 2024-02-29 07:19:33,218] Trial 105 finished with value: 10.891915699654898 and parameters: {'model_name': 'SimpleImputer', 'strategy': 'mean'}. Best is trial 21 with value: 10.891915699654898.
[I 2024-02-29 07:19:33,521] Trial 103 finished with value: 10.891915699654898 and parameters: {'model_name': 'SimpleImputer', 'strategy': 'mean'}. Best is trial 21 with value: 10.891915699654898.
[I 2024-02-29 07:19:33,770] Trial 107 finished with value: 10.891915699654898 and parameters: {'model_name': 'SimpleImputer', 'strategy': 'mean'}. Best is trial 21 with value: 10.891915699654898.
[I 2024-02-29 07:19:33,952] Trial 76 finished with value: 11.847415887932225 and parameters: {'model_name': 'SimpleImputer', 'strategy': 'most_frequent'}. Best is trial 21 with value: 10.891915699654898.
