[I 2024-02-28 20:26:33,536] Trial 167 finished with value: 4.35013051439204 and parameters: {'model_name': 'GAIN', 'batch_size': 8, 'hint_rate': 0.46, 'alpha': 14, 'iterations': 678}. Best is trial 121 with value: 4.042831244100165.
[I 2024-02-28 20:26:55,329] Trial 166 finished with value: 4.415682872918444 and parameters: {'model_name': 'GAIN', 'batch_size': 14, 'hint_rate': 0.9, 'alpha': 15, 'iterations': 734}. Best is trial 121 with value: 4.042831244100165.
[I 2024-02-28 20:27:31,710] Trial 196 finished with value: 4.434910486739634 and parameters: {'model_name': 'GAIN', 'batch_size': 3, 'hint_rate': 0.91, 'alpha': 86, 'iterations': 559}. Best is trial 121 with value: 4.042831244100165.
[I 2024-02-28 20:27:34,465] Trial 50 finished with value: 4.338324928079368 and parameters: {'model_name': 'GAIN', 'batch_size': 6, 'hint_rate': 0.49, 'alpha': 8, 'iterations': 1522}. Best is trial 121 with value: 4.042831244100165.
[I 2024-02-28 20:27:42,473] Trial 194 finished with value: 4.458595772448703 and parameters: {'model_name': 'GAIN', 'batch_size': 3, 'hint_rate': 0.9, 'alpha': 7, 'iterations': 568}. Best is trial 121 with value: 4.042831244100165.
[I 2024-02-28 20:27:45,096] Trial 198 finished with value: 4.542991026272353 and parameters: {'model_name': 'GAIN', 'batch_size': 7, 'hint_rate': 0.78, 'alpha': 7, 'iterations': 567}. Best is trial 121 with value: 4.042831244100165.
[I 2024-02-28 20:27:58,440] Trial 197 finished with value: 4.389891054610706 and parameters: {'model_name': 'GAIN', 'batch_size': 7, 'hint_rate': 0.9, 'alpha': 85, 'iterations': 624}. Best is trial 121 with value: 4.042831244100165.
[I 2024-02-28 20:28:02,318] Trial 199 finished with value: 4.460042535128979 and parameters: {'model_name': 'GAIN', 'batch_size': 3, 'hint_rate': 0.78, 'alpha': 85, 'iterations': 623}. Best is trial 121 with value: 4.042831244100165.
[I 2024-02-28 20:28:14,848] Trial 188 finished with value: 4.508332031000867 and parameters: {'model_name': 'GAIN', 'batch_size': 3, 'hint_rate': 0.89, 'alpha': 83, 'iterations': 695}. Best is trial 121 with value: 4.042831244100165.
[I 2024-02-28 20:28:18,331] Trial 195 finished with value: 4.411550886793718 and parameters: {'model_name': 'GAIN', 'batch_size': 6, 'hint_rate': 0.34, 'alpha': 7, 'iterations': 673}. Best is trial 121 with value: 4.042831244100165.
[I 2024-02-28 20:28:32,567] Trial 189 finished with value: 4.453870344733246 and parameters: {'model_name': 'GAIN', 'batch_size': 6, 'hint_rate': 0.91, 'alpha': 5, 'iterations': 720}. Best is trial 121 with value: 4.042831244100165.
[I 2024-02-28 20:28:35,843] Trial 193 finished with value: 4.3921530057645635 and parameters: {'model_name': 'GAIN', 'batch_size': 3, 'hint_rate': 0.91, 'alpha': 89, 'iterations': 717}. Best is trial 121 with value: 4.042831244100165.
[I 2024-02-28 20:28:52,287] Trial 54 finished with value: 4.560921523839006 and parameters: {'model_name': 'GAIN', 'batch_size': 36, 'hint_rate': 0.73, 'alpha': 61, 'iterations': 1645}. Best is trial 121 with value: 4.042831244100165.
[I 2024-02-28 20:29:56,039] Trial 21 finished with value: 4.385228762469443 and parameters: {'model_name': 'GAIN', 'batch_size': 609, 'hint_rate': 0.8300000000000001, 'alpha': 46, 'iterations': 1604}. Best is trial 121 with value: 4.042831244100165.
[I 2024-02-28 20:30:53,884] Trial 7 finished with value: 4.498308599059132 and parameters: {'model_name': 'GAIN', 'batch_size': 1, 'hint_rate': 0.46, 'alpha': 96, 'iterations': 2578}. Best is trial 121 with value: 4.042831244100165.
[I 2024-02-28 20:34:00,568] Trial 88 finished with value: 4.334185165891862 and parameters: {'model_name': 'GAIN', 'batch_size': 20, 'hint_rate': 0.6, 'alpha': 57, 'iterations': 3831}. Best is trial 121 with value: 4.042831244100165.
[I 2024-02-28 20:34:15,855] Trial 51 finished with value: 4.430968887283315 and parameters: {'model_name': 'GAIN', 'batch_size': 3, 'hint_rate': 0.02, 'alpha': 59, 'iterations': 4076}. Best is trial 121 with value: 4.042831244100165.
[I 2024-02-28 20:35:09,980] Trial 2 finished with value: inf and parameters: {'model_name': 'GAIN', 'batch_size': 4, 'hint_rate': 0.8300000000000001, 'alpha': 90, 'iterations': 46121}. Best is trial 121 with value: 4.042831244100165.
[I 2024-02-28 20:38:10,979] Trial 36 finished with value: inf and parameters: {'model_name': 'GAIN', 'batch_size': 15, 'hint_rate': 0.64, 'alpha': 85, 'iterations': 62078}. Best is trial 121 with value: 4.042831244100165.
[I 2024-02-28 20:39:00,175] Trial 85 finished with value: inf and parameters: {'model_name': 'GAIN', 'batch_size': 1, 'hint_rate': 0.9600000000000001, 'alpha': 21, 'iterations': 68779}. Best is trial 121 with value: 4.042831244100165.
[I 2024-02-28 20:39:08,685] Trial 67 finished with value: 4.569835050663387 and parameters: {'model_name': 'GAIN', 'batch_size': 3, 'hint_rate': 0.66, 'alpha': 40, 'iterations': 6852}. Best is trial 121 with value: 4.042831244100165.
[I 2024-02-28 20:41:10,238] Trial 70 finished with value: inf and parameters: {'model_name': 'GAIN', 'batch_size': 6, 'hint_rate': 0.5, 'alpha': 34, 'iterations': 44502}. Best is trial 121 with value: 4.042831244100165.
[I 2024-02-28 20:41:57,125] Trial 83 finished with value: inf and parameters: {'model_name': 'GAIN', 'batch_size': 7, 'hint_rate': 0.39, 'alpha': 95, 'iterations': 49396}. Best is trial 121 with value: 4.042831244100165.
[I 2024-02-28 20:43:55,101] Trial 84 finished with value: 4.499656642728416 and parameters: {'model_name': 'GAIN', 'batch_size': 1, 'hint_rate': 0.14, 'alpha': 8, 'iterations': 15758}. Best is trial 121 with value: 4.042831244100165.
[I 2024-02-28 20:44:56,440] Trial 1 finished with value: 4.323443823263103 and parameters: {'model_name': 'GAIN', 'batch_size': 1, 'hint_rate': 0.27, 'alpha': 41, 'iterations': 19606}. Best is trial 121 with value: 4.042831244100165.
