[I 2024-02-27 15:05:42,150] Trial 114 finished with value: 0.7941569974204129 and parameters: {'model_name': 'RandomForestImputer', 'max_iter': 96, 'decreasing': True, 'min_samples_split': 0.0, 'min_samples_leaf': 0.9, 'max_features': 0.4, 'warm_start': False}. Best is trial 2 with value: 0.7940648831696957.
[I 2024-02-27 15:06:03,277] Trial 181 finished with value: 0.7941518957465394 and parameters: {'model_name': 'RandomForestImputer', 'max_iter': 85, 'decreasing': True, 'min_samples_split': 0.0, 'min_samples_leaf': 0.6, 'max_features': 0.30000000000000004, 'warm_start': False}. Best is trial 2 with value: 0.7940648831696957.
[I 2024-02-27 15:06:11,521] Trial 164 finished with value: 0.7941475999197662 and parameters: {'model_name': 'RandomForestImputer', 'max_iter': 91, 'decreasing': True, 'min_samples_split': 0.0, 'min_samples_leaf': 0.6, 'max_features': 0.30000000000000004, 'warm_start': False}. Best is trial 2 with value: 0.7940648831696957.
[I 2024-02-27 15:06:13,160] Trial 184 finished with value: 0.7941230970539834 and parameters: {'model_name': 'RandomForestImputer', 'max_iter': 75, 'decreasing': True, 'min_samples_split': 0.0, 'min_samples_leaf': 0.6, 'max_features': 0.30000000000000004, 'warm_start': False}. Best is trial 2 with value: 0.7940648831696957.
[I 2024-02-27 15:06:30,917] Trial 132 finished with value: 0.7941428770971155 and parameters: {'model_name': 'RandomForestImputer', 'max_iter': 97, 'decreasing': True, 'min_samples_split': 0.0, 'min_samples_leaf': 0.6, 'max_features': 0.4, 'warm_start': False}. Best is trial 2 with value: 0.7940648831696957.
[I 2024-02-27 15:06:54,641] Trial 172 finished with value: 0.7941414130919386 and parameters: {'model_name': 'RandomForestImputer', 'max_iter': 98, 'decreasing': True, 'min_samples_split': 0.1, 'min_samples_leaf': 0.6, 'max_features': 0.30000000000000004, 'warm_start': False}. Best is trial 2 with value: 0.7940648831696957.
[I 2024-02-27 15:07:18,508] Trial 163 finished with value: 0.7941452718134163 and parameters: {'model_name': 'RandomForestImputer', 'max_iter': 98, 'decreasing': True, 'min_samples_split': 0.0, 'min_samples_leaf': 0.6, 'max_features': 0.30000000000000004, 'warm_start': False}. Best is trial 2 with value: 0.7940648831696957.
[I 2024-02-27 15:07:20,895] Trial 29 finished with value: inf and parameters: {'model_name': 'GAIN', 'batch_size': 79, 'hint_rate': 0.5, 'alpha': 47, 'iterations': 7416}. Best is trial 2 with value: 0.7940648831696957.
[I 2024-02-27 15:07:43,161] Trial 195 finished with value: 0.7941508671027667 and parameters: {'model_name': 'RandomForestImputer', 'max_iter': 83, 'decreasing': False, 'min_samples_split': 0.2, 'min_samples_leaf': 0.6, 'max_features': 0.30000000000000004, 'warm_start': False}. Best is trial 2 with value: 0.7940648831696957.
[I 2024-02-27 15:08:05,773] Trial 84 finished with value: 1.144277607845266 and parameters: {'model_name': 'GAIN', 'batch_size': 24, 'hint_rate': 0.75, 'alpha': 0, 'iterations': 2592}. Best is trial 2 with value: 0.7940648831696957.
[I 2024-02-27 15:08:14,693] Trial 30 finished with value: inf and parameters: {'model_name': 'GAIN', 'batch_size': 822, 'hint_rate': 0.18000000000000002, 'alpha': 6, 'iterations': 21019}. Best is trial 2 with value: 0.7940648831696957.
[I 2024-02-27 15:08:17,712] Trial 185 finished with value: 0.7941577232713579 and parameters: {'model_name': 'RandomForestImputer', 'max_iter': 89, 'decreasing': True, 'min_samples_split': 0.0, 'min_samples_leaf': 0.6, 'max_features': 0.4, 'warm_start': False}. Best is trial 2 with value: 0.7940648831696957.
[I 2024-02-27 15:09:19,614] Trial 81 finished with value: inf and parameters: {'model_name': 'GAIN', 'batch_size': 3, 'hint_rate': 0.25, 'alpha': 19, 'iterations': 38095}. Best is trial 2 with value: 0.7940648831696957.
[I 2024-02-27 15:10:19,507] Trial 23 finished with value: 1.0015619139716372 and parameters: {'model_name': 'GAIN', 'batch_size': 132, 'hint_rate': 0.68, 'alpha': 46, 'iterations': 4140}. Best is trial 2 with value: 0.7940648831696957.
[I 2024-02-27 15:11:18,414] Trial 11 finished with value: 0.99645819336565 and parameters: {'model_name': 'GAIN', 'batch_size': 1, 'hint_rate': 0.04, 'alpha': 50, 'iterations': 7411}. Best is trial 2 with value: 0.7940648831696957.
[I 2024-02-27 15:12:36,529] Trial 64 finished with value: inf and parameters: {'model_name': 'GAIN', 'batch_size': 110, 'hint_rate': 0.61, 'alpha': 4, 'iterations': 11288}. Best is trial 2 with value: 0.7940648831696957.
