[I 2024-04-28 15:47:29,420] Trial 86 finished with value: 16.734622944436655 and parameters: {'model_name': 'IterativeImputer', 'sample_posterior': True, 'initial_strategy': 'mean', 'imputation_order': 'roman'}. Best is trial 29 with value: 13.165073069554925.
[I 2024-04-28 15:47:30,530] Trial 122 finished with value: 13.16790833017887 and parameters: {'model_name': 'IterativeImputer', 'sample_posterior': False, 'initial_strategy': 'mean', 'imputation_order': 'roman'}. Best is trial 29 with value: 13.165073069554925.
[I 2024-04-28 15:47:32,638] Trial 123 finished with value: 13.16790833017887 and parameters: {'model_name': 'IterativeImputer', 'sample_posterior': False, 'initial_strategy': 'mean', 'imputation_order': 'roman'}. Best is trial 29 with value: 13.165073069554925.
[I 2024-04-28 15:47:33,466] Trial 90 finished with value: 17.930247359289456 and parameters: {'model_name': 'IterativeImputer', 'sample_posterior': True, 'initial_strategy': 'mean', 'imputation_order': 'roman'}. Best is trial 29 with value: 13.165073069554925.
[I 2024-04-28 15:47:34,597] Trial 91 finished with value: 17.978849823241806 and parameters: {'model_name': 'IterativeImputer', 'sample_posterior': True, 'initial_strategy': 'mean', 'imputation_order': 'roman'}. Best is trial 29 with value: 13.165073069554925.
[I 2024-04-28 15:47:36,250] Trial 124 finished with value: 13.16790833017887 and parameters: {'model_name': 'IterativeImputer', 'sample_posterior': False, 'initial_strategy': 'mean', 'imputation_order': 'roman'}. Best is trial 29 with value: 13.165073069554925.
[I 2024-04-28 15:47:37,608] Trial 89 finished with value: 18.38793726620562 and parameters: {'model_name': 'IterativeImputer', 'sample_posterior': True, 'initial_strategy': 'mean', 'imputation_order': 'roman'}. Best is trial 29 with value: 13.165073069554925.
[I 2024-04-28 15:47:38,433] Trial 125 finished with value: 13.16790833017887 and parameters: {'model_name': 'IterativeImputer', 'sample_posterior': False, 'initial_strategy': 'mean', 'imputation_order': 'roman'}. Best is trial 29 with value: 13.165073069554925.
[I 2024-04-28 15:47:39,583] Trial 88 finished with value: 18.03020605764891 and parameters: {'model_name': 'IterativeImputer', 'sample_posterior': True, 'initial_strategy': 'mean', 'imputation_order': 'roman'}. Best is trial 29 with value: 13.165073069554925.
[I 2024-04-28 15:47:43,973] Trial 126 finished with value: 13.16790833017887 and parameters: {'model_name': 'IterativeImputer', 'sample_posterior': False, 'initial_strategy': 'mean', 'imputation_order': 'roman'}. Best is trial 29 with value: 13.165073069554925.
[I 2024-04-28 15:47:45,005] Trial 92 finished with value: 18.379872698181405 and parameters: {'model_name': 'IterativeImputer', 'sample_posterior': True, 'initial_strategy': 'constant', 'imputation_order': 'random'}. Best is trial 29 with value: 13.165073069554925.
[I 2024-04-28 15:47:46,967] Trial 95 finished with value: 18.710165798000176 and parameters: {'model_name': 'IterativeImputer', 'sample_posterior': True, 'initial_strategy': 'constant', 'imputation_order': 'random'}. Best is trial 29 with value: 13.165073069554925.
[I 2024-04-28 15:47:49,326] Trial 93 finished with value: 17.49687062727941 and parameters: {'model_name': 'IterativeImputer', 'sample_posterior': True, 'initial_strategy': 'constant', 'imputation_order': 'random'}. Best is trial 29 with value: 13.165073069554925.
[I 2024-04-28 15:47:50,190] Trial 94 finished with value: 17.918057674680174 and parameters: {'model_name': 'IterativeImputer', 'sample_posterior': True, 'initial_strategy': 'constant', 'imputation_order': 'random'}. Best is trial 29 with value: 13.165073069554925.
[I 2024-04-28 15:47:51,375] Trial 142 finished with value: 15.971906421600824 and parameters: {'model_name': 'KNNImputer', 'weights': 'distance', 'keep_empty_features': False}. Best is trial 29 with value: 13.165073069554925.
[I 2024-04-28 15:47:52,733] Trial 128 finished with value: 13.16790833017887 and parameters: {'model_name': 'IterativeImputer', 'sample_posterior': False, 'initial_strategy': 'mean', 'imputation_order': 'roman'}. Best is trial 29 with value: 13.165073069554925.
[I 2024-04-28 15:47:54,174] Trial 96 finished with value: 17.72995196061197 and parameters: {'model_name': 'IterativeImputer', 'sample_posterior': True, 'initial_strategy': 'constant', 'imputation_order': 'random'}. Best is trial 29 with value: 13.165073069554925.
[I 2024-04-28 15:47:56,349] Trial 129 finished with value: 13.16790833017887 and parameters: {'model_name': 'IterativeImputer', 'sample_posterior': False, 'initial_strategy': 'mean', 'imputation_order': 'roman'}. Best is trial 29 with value: 13.165073069554925.
[I 2024-04-28 15:47:57,612] Trial 100 finished with value: 17.60717384666676 and parameters: {'model_name': 'IterativeImputer', 'sample_posterior': True, 'initial_strategy': 'constant', 'imputation_order': 'random'}. Best is trial 29 with value: 13.165073069554925.
[I 2024-04-28 15:47:58,683] Trial 143 finished with value: 15.971906421600824 and parameters: {'model_name': 'KNNImputer', 'weights': 'distance', 'keep_empty_features': False}. Best is trial 29 with value: 13.165073069554925.
[I 2024-04-28 15:48:00,322] Trial 145 finished with value: 15.971906421600824 and parameters: {'model_name': 'KNNImputer', 'weights': 'distance', 'keep_empty_features': False}. Best is trial 29 with value: 13.165073069554925.
[I 2024-04-28 15:48:01,660] Trial 97 finished with value: 18.6657041018428 and parameters: {'model_name': 'IterativeImputer', 'sample_posterior': True, 'initial_strategy': 'constant', 'imputation_order': 'random'}. Best is trial 29 with value: 13.165073069554925.
[I 2024-04-28 15:48:03,001] Trial 98 finished with value: 17.036022450865925 and parameters: {'model_name': 'IterativeImputer', 'sample_posterior': True, 'initial_strategy': 'constant', 'imputation_order': 'random'}. Best is trial 29 with value: 13.165073069554925.
[I 2024-04-28 15:48:04,796] Trial 146 finished with value: 15.971906421600824 and parameters: {'model_name': 'KNNImputer', 'weights': 'distance', 'keep_empty_features': False}. Best is trial 29 with value: 13.165073069554925.
[I 2024-04-28 15:48:06,261] Trial 99 finished with value: 17.83908496491835 and parameters: {'model_name': 'IterativeImputer', 'sample_posterior': True, 'initial_strategy': 'constant', 'imputation_order': 'random'}. Best is trial 29 with value: 13.165073069554925.
[I 2024-04-28 15:48:08,000] Trial 130 finished with value: 13.16790833017887 and parameters: {'model_name': 'IterativeImputer', 'sample_posterior': False, 'initial_strategy': 'mean', 'imputation_order': 'roman'}. Best is trial 29 with value: 13.165073069554925.
[I 2024-04-28 15:48:09,454] Trial 131 finished with value: 13.16790833017887 and parameters: {'model_name': 'IterativeImputer', 'sample_posterior': False, 'initial_strategy': 'mean', 'imputation_order': 'roman'}. Best is trial 29 with value: 13.165073069554925.
[I 2024-04-28 15:48:10,602] Trial 101 finished with value: 18.4250861059592 and parameters: {'model_name': 'IterativeImputer', 'sample_posterior': True, 'initial_strategy': 'constant', 'imputation_order': 'random'}. Best is trial 29 with value: 13.165073069554925.
[I 2024-04-28 15:48:12,496] Trial 102 finished with value: 18.232209440290603 and parameters: {'model_name': 'IterativeImputer', 'sample_posterior': True, 'initial_strategy': 'constant', 'imputation_order': 'random'}. Best is trial 29 with value: 13.165073069554925.
[I 2024-04-28 15:48:14,435] Trial 133 finished with value: 13.167931931474651 and parameters: {'model_name': 'IterativeImputer', 'sample_posterior': False, 'initial_strategy': 'mean', 'imputation_order': 'random'}. Best is trial 29 with value: 13.165073069554925.
[I 2024-04-28 15:48:15,651] Trial 105 finished with value: 18.0628731263536 and parameters: {'model_name': 'IterativeImputer', 'sample_posterior': True, 'initial_strategy': 'mean', 'imputation_order': 'random'}. Best is trial 29 with value: 13.165073069554925.
[I 2024-04-28 15:48:17,280] Trial 132 finished with value: 13.16790833017887 and parameters: {'model_name': 'IterativeImputer', 'sample_posterior': False, 'initial_strategy': 'mean', 'imputation_order': 'roman'}. Best is trial 29 with value: 13.165073069554925.
[I 2024-04-28 15:48:18,506] Trial 104 finished with value: 18.634878929362976 and parameters: {'model_name': 'IterativeImputer', 'sample_posterior': True, 'initial_strategy': 'mean', 'imputation_order': 'random'}. Best is trial 29 with value: 13.165073069554925.
[I 2024-04-28 15:48:19,448] Trial 103 finished with value: 18.771926577764923 and parameters: {'model_name': 'IterativeImputer', 'sample_posterior': True, 'initial_strategy': 'constant', 'imputation_order': 'random'}. Best is trial 29 with value: 13.165073069554925.
[I 2024-04-28 15:48:22,417] Trial 167 finished with value: 27.627074604253192 and parameters: {'model_name': 'SimpleImputer', 'strategy': 'most_frequent'}. Best is trial 29 with value: 13.165073069554925.
[I 2024-04-28 15:48:24,418] Trial 135 finished with value: 13.168090391993506 and parameters: {'model_name': 'IterativeImputer', 'sample_posterior': False, 'initial_strategy': 'mean', 'imputation_order': 'random'}. Best is trial 29 with value: 13.165073069554925.
[I 2024-04-28 15:48:25,998] Trial 134 finished with value: 13.167879941906076 and parameters: {'model_name': 'IterativeImputer', 'sample_posterior': False, 'initial_strategy': 'mean', 'imputation_order': 'random'}. Best is trial 29 with value: 13.165073069554925.
[I 2024-04-28 15:48:28,184] Trial 138 finished with value: 13.16769366171097 and parameters: {'model_name': 'IterativeImputer', 'sample_posterior': False, 'initial_strategy': 'mean', 'imputation_order': 'random'}. Best is trial 29 with value: 13.165073069554925.
[I 2024-04-28 15:48:32,406] Trial 106 finished with value: 18.249086442340218 and parameters: {'model_name': 'IterativeImputer', 'sample_posterior': True, 'initial_strategy': 'mean', 'imputation_order': 'random'}. Best is trial 29 with value: 13.165073069554925.
[I 2024-04-28 15:48:33,900] Trial 107 finished with value: 18.140765492387608 and parameters: {'model_name': 'IterativeImputer', 'sample_posterior': True, 'initial_strategy': 'mean', 'imputation_order': 'random'}. Best is trial 29 with value: 13.165073069554925.
[I 2024-04-28 15:48:38,236] Trial 108 finished with value: 19.119843730520472 and parameters: {'model_name': 'IterativeImputer', 'sample_posterior': True, 'initial_strategy': 'mean', 'imputation_order': 'random'}. Best is trial 29 with value: 13.165073069554925.
[I 2024-04-28 15:48:39,286] Trial 149 finished with value: 13.167912413842592 and parameters: {'model_name': 'IterativeImputer', 'sample_posterior': False, 'initial_strategy': 'mean', 'imputation_order': 'descending'}. Best is trial 29 with value: 13.165073069554925.
[I 2024-04-28 15:48:40,422] Trial 148 finished with value: 13.167912413842592 and parameters: {'model_name': 'IterativeImputer', 'sample_posterior': False, 'initial_strategy': 'mean', 'imputation_order': 'descending'}. Best is trial 29 with value: 13.165073069554925.
[I 2024-04-28 15:48:41,376] Trial 109 finished with value: 17.681044379534594 and parameters: {'model_name': 'IterativeImputer', 'sample_posterior': True, 'initial_strategy': 'mean', 'imputation_order': 'random'}. Best is trial 29 with value: 13.165073069554925.
[I 2024-04-28 15:48:43,018] Trial 136 finished with value: 13.16657845105336 and parameters: {'model_name': 'IterativeImputer', 'sample_posterior': False, 'initial_strategy': 'constant', 'imputation_order': 'random'}. Best is trial 29 with value: 13.165073069554925.
[I 2024-04-28 15:48:44,294] Trial 137 finished with value: 13.168184282507713 and parameters: {'model_name': 'IterativeImputer', 'sample_posterior': False, 'initial_strategy': 'constant', 'imputation_order': 'random'}. Best is trial 29 with value: 13.165073069554925.
[I 2024-04-28 15:48:46,322] Trial 152 finished with value: 13.167912413842592 and parameters: {'model_name': 'IterativeImputer', 'sample_posterior': False, 'initial_strategy': 'mean', 'imputation_order': 'descending'}. Best is trial 29 with value: 13.165073069554925.
[I 2024-04-28 15:48:49,067] Trial 141 finished with value: 13.16915658184771 and parameters: {'model_name': 'IterativeImputer', 'sample_posterior': False, 'initial_strategy': 'constant', 'imputation_order': 'random'}. Best is trial 29 with value: 13.165073069554925.
[I 2024-04-28 15:48:51,340] Trial 139 finished with value: 13.165553347664561 and parameters: {'model_name': 'IterativeImputer', 'sample_posterior': False, 'initial_strategy': 'constant', 'imputation_order': 'random'}. Best is trial 29 with value: 13.165073069554925.
[I 2024-04-28 15:48:52,994] Trial 140 finished with value: 13.165642697664975 and parameters: {'model_name': 'IterativeImputer', 'sample_posterior': False, 'initial_strategy': 'constant', 'imputation_order': 'random'}. Best is trial 29 with value: 13.165073069554925.
[I 2024-04-28 15:48:55,008] Trial 161 finished with value: 13.167912413842592 and parameters: {'model_name': 'IterativeImputer', 'sample_posterior': False, 'initial_strategy': 'mean', 'imputation_order': 'descending'}. Best is trial 29 with value: 13.165073069554925.
[I 2024-04-28 15:48:57,461] Trial 144 finished with value: 13.168977502773782 and parameters: {'model_name': 'IterativeImputer', 'sample_posterior': False, 'initial_strategy': 'constant', 'imputation_order': 'random'}. Best is trial 29 with value: 13.165073069554925.
[I 2024-04-28 15:49:00,105] Trial 166 finished with value: 13.167912413842592 and parameters: {'model_name': 'IterativeImputer', 'sample_posterior': False, 'initial_strategy': 'mean', 'imputation_order': 'descending'}. Best is trial 29 with value: 13.165073069554925.
[I 2024-04-28 15:49:02,811] Trial 147 finished with value: 13.16807480340861 and parameters: {'model_name': 'IterativeImputer', 'sample_posterior': False, 'initial_strategy': 'most_frequent', 'imputation_order': 'descending'}. Best is trial 29 with value: 13.165073069554925.
[I 2024-04-28 15:49:04,666] Trial 150 finished with value: 13.16807480340861 and parameters: {'model_name': 'IterativeImputer', 'sample_posterior': False, 'initial_strategy': 'most_frequent', 'imputation_order': 'descending'}. Best is trial 29 with value: 13.165073069554925.
[I 2024-04-28 15:49:06,877] Trial 151 finished with value: 13.16807480340861 and parameters: {'model_name': 'IterativeImputer', 'sample_posterior': False, 'initial_strategy': 'most_frequent', 'imputation_order': 'descending'}. Best is trial 29 with value: 13.165073069554925.
[I 2024-04-28 15:49:08,079] Trial 159 finished with value: 13.167942322123462 and parameters: {'model_name': 'IterativeImputer', 'sample_posterior': False, 'initial_strategy': 'most_frequent', 'imputation_order': 'ascending'}. Best is trial 29 with value: 13.165073069554925.
[I 2024-04-28 15:49:09,441] Trial 171 finished with value: 13.167912413842592 and parameters: {'model_name': 'IterativeImputer', 'sample_posterior': False, 'initial_strategy': 'mean', 'imputation_order': 'descending'}. Best is trial 29 with value: 13.165073069554925.
[I 2024-04-28 15:49:10,942] Trial 155 finished with value: 13.16807480340861 and parameters: {'model_name': 'IterativeImputer', 'sample_posterior': False, 'initial_strategy': 'most_frequent', 'imputation_order': 'descending'}. Best is trial 29 with value: 13.165073069554925.
[I 2024-04-28 15:49:12,384] Trial 153 finished with value: 13.16807480340861 and parameters: {'model_name': 'IterativeImputer', 'sample_posterior': False, 'initial_strategy': 'most_frequent', 'imputation_order': 'descending'}. Best is trial 29 with value: 13.165073069554925.
[I 2024-04-28 15:49:13,442] Trial 110 finished with value: 17.720568894792077 and parameters: {'model_name': 'IterativeImputer', 'sample_posterior': True, 'initial_strategy': 'mean', 'imputation_order': 'random'}. Best is trial 29 with value: 13.165073069554925.
[I 2024-04-28 15:49:14,824] Trial 170 finished with value: 13.167912413842592 and parameters: {'model_name': 'IterativeImputer', 'sample_posterior': False, 'initial_strategy': 'mean', 'imputation_order': 'descending'}. Best is trial 29 with value: 13.165073069554925.
[I 2024-04-28 15:49:16,090] Trial 154 finished with value: 13.16807480340861 and parameters: {'model_name': 'IterativeImputer', 'sample_posterior': False, 'initial_strategy': 'most_frequent', 'imputation_order': 'descending'}. Best is trial 29 with value: 13.165073069554925.
[I 2024-04-28 15:49:17,481] Trial 156 finished with value: 13.16807480340861 and parameters: {'model_name': 'IterativeImputer', 'sample_posterior': False, 'initial_strategy': 'most_frequent', 'imputation_order': 'descending'}. Best is trial 29 with value: 13.165073069554925.
[I 2024-04-28 15:49:19,395] Trial 157 finished with value: 13.16807480340861 and parameters: {'model_name': 'IterativeImputer', 'sample_posterior': False, 'initial_strategy': 'most_frequent', 'imputation_order': 'descending'}. Best is trial 29 with value: 13.165073069554925.
[I 2024-04-28 15:49:20,383] Trial 194 finished with value: 27.627074604253192 and parameters: {'model_name': 'SimpleImputer', 'strategy': 'most_frequent'}. Best is trial 29 with value: 13.165073069554925.
[I 2024-04-28 15:49:21,739] Trial 158 finished with value: 13.16807480340861 and parameters: {'model_name': 'IterativeImputer', 'sample_posterior': False, 'initial_strategy': 'most_frequent', 'imputation_order': 'descending'}. Best is trial 29 with value: 13.165073069554925.
[I 2024-04-28 15:49:23,174] Trial 196 finished with value: 27.627074604253192 and parameters: {'model_name': 'SimpleImputer', 'strategy': 'most_frequent'}. Best is trial 29 with value: 13.165073069554925.
[I 2024-04-28 15:49:26,737] Trial 160 finished with value: 13.16807480340861 and parameters: {'model_name': 'IterativeImputer', 'sample_posterior': False, 'initial_strategy': 'most_frequent', 'imputation_order': 'descending'}. Best is trial 29 with value: 13.165073069554925.
[I 2024-04-28 15:49:28,606] Trial 111 finished with value: 18.680244152427782 and parameters: {'model_name': 'IterativeImputer', 'sample_posterior': True, 'initial_strategy': 'mean', 'imputation_order': 'random'}. Best is trial 29 with value: 13.165073069554925.
[I 2024-04-28 15:49:29,621] Trial 169 finished with value: 13.167942322123462 and parameters: {'model_name': 'IterativeImputer', 'sample_posterior': False, 'initial_strategy': 'most_frequent', 'imputation_order': 'ascending'}. Best is trial 29 with value: 13.165073069554925.
[I 2024-04-28 15:49:30,565] Trial 162 finished with value: 13.16807480340861 and parameters: {'model_name': 'IterativeImputer', 'sample_posterior': False, 'initial_strategy': 'most_frequent', 'imputation_order': 'descending'}. Best is trial 29 with value: 13.165073069554925.
[I 2024-04-28 15:49:31,483] Trial 175 finished with value: 13.167916064348287 and parameters: {'model_name': 'IterativeImputer', 'sample_posterior': False, 'initial_strategy': 'mean', 'imputation_order': 'ascending'}. Best is trial 29 with value: 13.165073069554925.
[I 2024-04-28 15:49:34,038] Trial 165 finished with value: 13.16807480340861 and parameters: {'model_name': 'IterativeImputer', 'sample_posterior': False, 'initial_strategy': 'most_frequent', 'imputation_order': 'descending'}. Best is trial 29 with value: 13.165073069554925.
[I 2024-04-28 15:49:35,024] Trial 164 finished with value: 13.16807480340861 and parameters: {'model_name': 'IterativeImputer', 'sample_posterior': False, 'initial_strategy': 'most_frequent', 'imputation_order': 'descending'}. Best is trial 29 with value: 13.165073069554925.
[I 2024-04-28 15:49:36,380] Trial 179 finished with value: 13.167983522633211 and parameters: {'model_name': 'IterativeImputer', 'sample_posterior': False, 'initial_strategy': 'median', 'imputation_order': 'ascending'}. Best is trial 29 with value: 13.165073069554925.
[I 2024-04-28 15:49:37,143] Trial 174 finished with value: 13.16807257704075 and parameters: {'model_name': 'IterativeImputer', 'sample_posterior': False, 'initial_strategy': 'median', 'imputation_order': 'descending'}. Best is trial 29 with value: 13.165073069554925.
[I 2024-04-28 15:49:38,272] Trial 163 finished with value: 13.16807480340861 and parameters: {'model_name': 'IterativeImputer', 'sample_posterior': False, 'initial_strategy': 'most_frequent', 'imputation_order': 'descending'}. Best is trial 29 with value: 13.165073069554925.
[I 2024-04-28 15:49:40,589] Trial 168 finished with value: 13.16807480340861 and parameters: {'model_name': 'IterativeImputer', 'sample_posterior': False, 'initial_strategy': 'most_frequent', 'imputation_order': 'descending'}. Best is trial 29 with value: 13.165073069554925.
[I 2024-04-28 15:49:45,027] Trial 22 finished with value: 16.703307817920432 and parameters: {'model_name': 'GAIN', 'batch_size': 97, 'hint_rate': 0.26, 'alpha': 92, 'iterations': 114}. Best is trial 29 with value: 13.165073069554925.
[I 2024-04-28 15:49:47,198] Trial 172 finished with value: 13.16807480340861 and parameters: {'model_name': 'IterativeImputer', 'sample_posterior': False, 'initial_strategy': 'most_frequent', 'imputation_order': 'descending'}. Best is trial 29 with value: 13.165073069554925.
[I 2024-04-28 15:49:48,291] Trial 178 finished with value: 13.167942322123462 and parameters: {'model_name': 'IterativeImputer', 'sample_posterior': False, 'initial_strategy': 'most_frequent', 'imputation_order': 'ascending'}. Best is trial 29 with value: 13.165073069554925.
[I 2024-04-28 15:49:49,501] Trial 173 finished with value: 13.16807480340861 and parameters: {'model_name': 'IterativeImputer', 'sample_posterior': False, 'initial_strategy': 'most_frequent', 'imputation_order': 'descending'}. Best is trial 29 with value: 13.165073069554925.
