[I 2023-12-12 15:39:09,285] Trial 117 finished with value: 3178.516833518257 and parameters: {'model_name': 'IterativeImputer', 'estimator': 'Bayesian', 'sample_posterior': False, 'initial_strategy': 'median', 'imputation_order': 'descending'}. Best is trial 7 with value: 1318.834857175494.
[I 2023-12-12 15:39:10,234] Trial 120 finished with value: 3178.517382075559 and parameters: {'model_name': 'IterativeImputer', 'estimator': 'Bayesian', 'sample_posterior': False, 'initial_strategy': 'median', 'imputation_order': 'roman'}. Best is trial 7 with value: 1318.834857175494.
[I 2023-12-12 15:39:12,058] Trial 116 finished with value: 3178.516833518257 and parameters: {'model_name': 'IterativeImputer', 'estimator': 'Bayesian', 'sample_posterior': False, 'initial_strategy': 'median', 'imputation_order': 'descending'}. Best is trial 7 with value: 1318.834857175494.
[I 2023-12-12 15:39:15,430] Trial 138 finished with value: 1318.834857175494 and parameters: {'model_name': 'KNNImputer', 'weights': 'uniform', 'keep_empty_features': False}. Best is trial 7 with value: 1318.834857175494.
[I 2023-12-12 15:39:16,656] Trial 139 finished with value: 1318.834857175494 and parameters: {'model_name': 'KNNImputer', 'weights': 'uniform', 'keep_empty_features': False}. Best is trial 7 with value: 1318.834857175494.
[I 2023-12-12 15:39:17,773] Trial 140 finished with value: 1318.834857175494 and parameters: {'model_name': 'KNNImputer', 'weights': 'uniform', 'keep_empty_features': False}. Best is trial 7 with value: 1318.834857175494.
[I 2023-12-12 15:39:21,434] Trial 141 finished with value: 1318.834857175494 and parameters: {'model_name': 'KNNImputer', 'weights': 'uniform', 'keep_empty_features': False}. Best is trial 7 with value: 1318.834857175494.
[I 2023-12-12 15:39:22,093] Trial 142 finished with value: 1318.834857175494 and parameters: {'model_name': 'KNNImputer', 'weights': 'uniform', 'keep_empty_features': False}. Best is trial 7 with value: 1318.834857175494.
[I 2023-12-12 15:39:23,371] Trial 143 finished with value: 1318.834857175494 and parameters: {'model_name': 'KNNImputer', 'weights': 'uniform', 'keep_empty_features': False}. Best is trial 7 with value: 1318.834857175494.
[I 2023-12-12 15:39:27,065] Trial 144 finished with value: 1318.834857175494 and parameters: {'model_name': 'KNNImputer', 'weights': 'uniform', 'keep_empty_features': False}. Best is trial 7 with value: 1318.834857175494.
[I 2023-12-12 15:39:27,749] Trial 145 finished with value: 1318.834857175494 and parameters: {'model_name': 'KNNImputer', 'weights': 'uniform', 'keep_empty_features': False}. Best is trial 7 with value: 1318.834857175494.
[I 2023-12-12 15:39:29,168] Trial 146 finished with value: 1318.834857175494 and parameters: {'model_name': 'KNNImputer', 'weights': 'uniform', 'keep_empty_features': False}. Best is trial 7 with value: 1318.834857175494.
[I 2023-12-12 15:39:32,347] Trial 147 finished with value: 1318.834857175494 and parameters: {'model_name': 'KNNImputer', 'weights': 'uniform', 'keep_empty_features': False}. Best is trial 7 with value: 1318.834857175494.
[I 2023-12-12 15:39:32,979] Trial 148 finished with value: 1318.834857175494 and parameters: {'model_name': 'KNNImputer', 'weights': 'uniform', 'keep_empty_features': False}. Best is trial 7 with value: 1318.834857175494.
[I 2023-12-12 15:39:34,811] Trial 149 finished with value: 1318.834857175494 and parameters: {'model_name': 'KNNImputer', 'weights': 'uniform', 'keep_empty_features': False}. Best is trial 7 with value: 1318.834857175494.
[I 2023-12-12 15:39:38,006] Trial 151 finished with value: 1341.8961467367287 and parameters: {'model_name': 'KNNImputer', 'weights': 'distance', 'keep_empty_features': False}. Best is trial 7 with value: 1318.834857175494.
[I 2023-12-12 15:39:38,825] Trial 150 finished with value: 1318.834857175494 and parameters: {'model_name': 'KNNImputer', 'weights': 'uniform', 'keep_empty_features': False}. Best is trial 7 with value: 1318.834857175494.
[I 2023-12-12 15:39:40,207] Trial 152 finished with value: 1341.8961467367287 and parameters: {'model_name': 'KNNImputer', 'weights': 'distance', 'keep_empty_features': False}. Best is trial 7 with value: 1318.834857175494.
[I 2023-12-12 15:39:43,955] Trial 154 finished with value: 1318.834857175494 and parameters: {'model_name': 'KNNImputer', 'weights': 'uniform', 'keep_empty_features': False}. Best is trial 7 with value: 1318.834857175494.
[I 2023-12-12 15:39:45,000] Trial 153 finished with value: 1318.834857175494 and parameters: {'model_name': 'KNNImputer', 'weights': 'uniform', 'keep_empty_features': False}. Best is trial 7 with value: 1318.834857175494.
[I 2023-12-12 15:39:46,242] Trial 155 finished with value: 1318.834857175494 and parameters: {'model_name': 'KNNImputer', 'weights': 'uniform', 'keep_empty_features': False}. Best is trial 7 with value: 1318.834857175494.
[I 2023-12-12 15:39:48,429] Trial 156 finished with value: 2733.6058814436155 and parameters: {'model_name': 'SimpleImputer', 'strategy': 'most_frequent'}. Best is trial 7 with value: 1318.834857175494.
[I 2023-12-12 15:39:51,052] Trial 157 finished with value: 1318.834857175494 and parameters: {'model_name': 'KNNImputer', 'weights': 'uniform', 'keep_empty_features': False}. Best is trial 7 with value: 1318.834857175494.
[I 2023-12-12 15:39:52,861] Trial 158 finished with value: 1318.834857175494 and parameters: {'model_name': 'KNNImputer', 'weights': 'uniform', 'keep_empty_features': False}. Best is trial 7 with value: 1318.834857175494.
[I 2023-12-12 15:39:55,165] Trial 159 finished with value: 1318.834857175494 and parameters: {'model_name': 'KNNImputer', 'weights': 'uniform', 'keep_empty_features': False}. Best is trial 7 with value: 1318.834857175494.
[I 2023-12-12 15:39:57,905] Trial 160 finished with value: 1318.834857175494 and parameters: {'model_name': 'KNNImputer', 'weights': 'uniform', 'keep_empty_features': False}. Best is trial 7 with value: 1318.834857175494.
[I 2023-12-12 15:40:00,220] Trial 161 finished with value: 1318.834857175494 and parameters: {'model_name': 'KNNImputer', 'weights': 'uniform', 'keep_empty_features': False}. Best is trial 7 with value: 1318.834857175494.
[I 2023-12-12 15:40:01,638] Trial 162 finished with value: 1318.834857175494 and parameters: {'model_name': 'KNNImputer', 'weights': 'uniform', 'keep_empty_features': False}. Best is trial 7 with value: 1318.834857175494.
[I 2023-12-12 15:40:04,354] Trial 163 finished with value: 1318.834857175494 and parameters: {'model_name': 'KNNImputer', 'weights': 'uniform', 'keep_empty_features': False}. Best is trial 7 with value: 1318.834857175494.
[I 2023-12-12 15:40:06,080] Trial 164 finished with value: 1318.834857175494 and parameters: {'model_name': 'KNNImputer', 'weights': 'uniform', 'keep_empty_features': False}. Best is trial 7 with value: 1318.834857175494.
[I 2023-12-12 15:40:07,135] Trial 165 finished with value: 1318.834857175494 and parameters: {'model_name': 'KNNImputer', 'weights': 'uniform', 'keep_empty_features': False}. Best is trial 7 with value: 1318.834857175494.
[I 2023-12-12 15:40:09,263] Trial 166 finished with value: 1318.834857175494 and parameters: {'model_name': 'KNNImputer', 'weights': 'uniform', 'keep_empty_features': False}. Best is trial 7 with value: 1318.834857175494.
[I 2023-12-12 15:40:10,851] Trial 167 finished with value: 1318.834857175494 and parameters: {'model_name': 'KNNImputer', 'weights': 'uniform', 'keep_empty_features': False}. Best is trial 7 with value: 1318.834857175494.
[I 2023-12-12 15:40:12,316] Trial 168 finished with value: 1318.834857175494 and parameters: {'model_name': 'KNNImputer', 'weights': 'uniform', 'keep_empty_features': False}. Best is trial 7 with value: 1318.834857175494.
[I 2023-12-12 15:40:14,370] Trial 169 finished with value: 1318.834857175494 and parameters: {'model_name': 'KNNImputer', 'weights': 'uniform', 'keep_empty_features': False}. Best is trial 7 with value: 1318.834857175494.
[I 2023-12-12 15:40:15,774] Trial 170 finished with value: 1318.834857175494 and parameters: {'model_name': 'KNNImputer', 'weights': 'uniform', 'keep_empty_features': False}. Best is trial 7 with value: 1318.834857175494.
[I 2023-12-12 15:40:17,957] Trial 171 finished with value: 1318.834857175494 and parameters: {'model_name': 'KNNImputer', 'weights': 'uniform', 'keep_empty_features': False}. Best is trial 7 with value: 1318.834857175494.
[I 2023-12-12 15:40:20,520] Trial 172 finished with value: 1318.834857175494 and parameters: {'model_name': 'KNNImputer', 'weights': 'uniform', 'keep_empty_features': False}. Best is trial 7 with value: 1318.834857175494.
[I 2023-12-12 15:40:21,143] Trial 173 finished with value: 1318.834857175494 and parameters: {'model_name': 'KNNImputer', 'weights': 'uniform', 'keep_empty_features': False}. Best is trial 7 with value: 1318.834857175494.
[I 2023-12-12 15:40:23,506] Trial 174 finished with value: 2733.6058814436155 and parameters: {'model_name': 'SimpleImputer', 'strategy': 'most_frequent'}. Best is trial 7 with value: 1318.834857175494.
[I 2023-12-12 15:40:25,770] Trial 175 finished with value: 2733.6058814436155 and parameters: {'model_name': 'SimpleImputer', 'strategy': 'most_frequent'}. Best is trial 7 with value: 1318.834857175494.
[I 2023-12-12 15:40:30,760] Trial 178 finished with value: 1318.834857175494 and parameters: {'model_name': 'KNNImputer', 'weights': 'uniform', 'keep_empty_features': False}. Best is trial 7 with value: 1318.834857175494.
[I 2023-12-12 15:40:36,196] Trial 179 finished with value: 1318.834857175494 and parameters: {'model_name': 'KNNImputer', 'weights': 'uniform', 'keep_empty_features': False}. Best is trial 7 with value: 1318.834857175494.
[I 2023-12-12 15:41:05,635] Trial 0 finished with value: 2479.4281826402375 and parameters: {'model_name': 'RandomForestImputer', 'max_iter': 5, 'decreasing': False, 'min_samples_split': 0.8, 'min_samples_leaf': 0.1, 'max_features': 0.1, 'warm_start': False}. Best is trial 7 with value: 1318.834857175494.
[I 2023-12-12 15:41:10,397] Trial 181 finished with value: 1318.834857175494 and parameters: {'model_name': 'KNNImputer', 'weights': 'uniform', 'keep_empty_features': False}. Best is trial 7 with value: 1318.834857175494.
[I 2023-12-12 15:41:51,936] Trial 8 finished with value: 2468.1118176247137 and parameters: {'model_name': 'RandomForestImputer', 'max_iter': 5, 'decreasing': True, 'min_samples_split': 1.0, 'min_samples_leaf': 0.2, 'max_features': 0.8, 'warm_start': False}. Best is trial 7 with value: 1318.834857175494.
[I 2023-12-12 15:41:56,152] Trial 183 finished with value: 1318.834857175494 and parameters: {'model_name': 'KNNImputer', 'weights': 'uniform', 'keep_empty_features': False}. Best is trial 7 with value: 1318.834857175494.
[I 2023-12-12 15:42:09,387] Trial 176 finished with value: inf and parameters: {'model_name': 'IterativeImputer', 'estimator': 'RFR', 'sample_posterior': True, 'initial_strategy': 'most_frequent', 'imputation_order': 'roman'}. Best is trial 7 with value: 1318.834857175494.
[I 2023-12-12 15:42:14,196] Trial 180 finished with value: inf and parameters: {'model_name': 'IterativeImputer', 'estimator': 'RFR', 'sample_posterior': True, 'initial_strategy': 'most_frequent', 'imputation_order': 'roman'}. Best is trial 7 with value: 1318.834857175494.
[I 2023-12-12 15:42:15,173] Trial 185 finished with value: 1341.8961467367287 and parameters: {'model_name': 'KNNImputer', 'weights': 'distance', 'keep_empty_features': False}. Best is trial 7 with value: 1318.834857175494.
[I 2023-12-12 15:42:18,250] Trial 186 finished with value: 1318.834857175494 and parameters: {'model_name': 'KNNImputer', 'weights': 'uniform', 'keep_empty_features': False}. Best is trial 7 with value: 1318.834857175494.
[I 2023-12-12 15:42:19,344] Trial 187 finished with value: 1318.834857175494 and parameters: {'model_name': 'KNNImputer', 'weights': 'uniform', 'keep_empty_features': False}. Best is trial 7 with value: 1318.834857175494.
[I 2023-12-12 15:42:22,162] Trial 188 finished with value: 1318.834857175494 and parameters: {'model_name': 'KNNImputer', 'weights': 'uniform', 'keep_empty_features': False}. Best is trial 7 with value: 1318.834857175494.
[I 2023-12-12 15:42:23,261] Trial 83 finished with value: 2629.6395167070773 and parameters: {'model_name': 'RandomForestImputer', 'max_iter': 6, 'decreasing': False, 'min_samples_split': 0.0, 'min_samples_leaf': 0.4, 'max_features': 0.2, 'warm_start': False}. Best is trial 7 with value: 1318.834857175494.
[I 2023-12-12 15:42:24,263] Trial 189 finished with value: 1318.834857175494 and parameters: {'model_name': 'KNNImputer', 'weights': 'uniform', 'keep_empty_features': False}. Best is trial 7 with value: 1318.834857175494.
[I 2023-12-12 15:42:27,220] Trial 190 finished with value: 1318.834857175494 and parameters: {'model_name': 'KNNImputer', 'weights': 'uniform', 'keep_empty_features': False}. Best is trial 7 with value: 1318.834857175494.
[I 2023-12-12 15:42:28,462] Trial 191 finished with value: 1318.834857175494 and parameters: {'model_name': 'KNNImputer', 'weights': 'uniform', 'keep_empty_features': False}. Best is trial 7 with value: 1318.834857175494.
[I 2023-12-12 15:42:29,260] Trial 192 finished with value: 1318.834857175494 and parameters: {'model_name': 'KNNImputer', 'weights': 'uniform', 'keep_empty_features': False}. Best is trial 7 with value: 1318.834857175494.
[I 2023-12-12 15:42:33,780] Trial 193 finished with value: 1318.834857175494 and parameters: {'model_name': 'KNNImputer', 'weights': 'uniform', 'keep_empty_features': False}. Best is trial 7 with value: 1318.834857175494.
[I 2023-12-12 15:42:34,368] Trial 194 finished with value: 1318.834857175494 and parameters: {'model_name': 'KNNImputer', 'weights': 'uniform', 'keep_empty_features': False}. Best is trial 7 with value: 1318.834857175494.
[I 2023-12-12 15:42:35,832] Trial 195 finished with value: 1318.834857175494 and parameters: {'model_name': 'KNNImputer', 'weights': 'uniform', 'keep_empty_features': False}. Best is trial 7 with value: 1318.834857175494.
[I 2023-12-12 15:42:41,301] Trial 198 finished with value: 1318.834857175494 and parameters: {'model_name': 'KNNImputer', 'weights': 'uniform', 'keep_empty_features': False}. Best is trial 7 with value: 1318.834857175494.
[I 2023-12-12 15:42:45,415] Trial 199 finished with value: 1318.834857175494 and parameters: {'model_name': 'KNNImputer', 'weights': 'uniform', 'keep_empty_features': False}. Best is trial 7 with value: 1318.834857175494.
[I 2023-12-12 15:43:07,943] Trial 177 finished with value: inf and parameters: {'model_name': 'IterativeImputer', 'estimator': 'RFR', 'sample_posterior': True, 'initial_strategy': 'most_frequent', 'imputation_order': 'ascending'}. Best is trial 7 with value: 1318.834857175494.
[I 2023-12-12 15:43:46,498] Trial 80 finished with value: 2348.4731505227765 and parameters: {'model_name': 'RandomForestImputer', 'max_iter': 10, 'decreasing': False, 'min_samples_split': 0.7000000000000001, 'min_samples_leaf': 0.1, 'max_features': 0.9, 'warm_start': False}. Best is trial 7 with value: 1318.834857175494.
[I 2023-12-12 15:43:50,709] Trial 6 finished with value: 3183.211993133524 and parameters: {'model_name': 'IterativeImputer', 'estimator': 'Bayesian', 'sample_posterior': True, 'initial_strategy': 'constant', 'imputation_order': 'descending'}. Best is trial 7 with value: 1318.834857175494.
[I 2023-12-12 15:43:52,384] Trial 182 finished with value: inf and parameters: {'model_name': 'IterativeImputer', 'estimator': 'RFR', 'sample_posterior': True, 'initial_strategy': 'most_frequent', 'imputation_order': 'ascending'}. Best is trial 7 with value: 1318.834857175494.
[I 2023-12-12 15:43:53,145] Trial 46 finished with value: 3190.6793859044 and parameters: {'model_name': 'IterativeImputer', 'estimator': 'Bayesian', 'sample_posterior': True, 'initial_strategy': 'constant', 'imputation_order': 'arabic'}. Best is trial 7 with value: 1318.834857175494.
[I 2023-12-12 15:43:54,331] Trial 12 finished with value: 3148.6924947110156 and parameters: {'model_name': 'IterativeImputer', 'estimator': 'Bayesian', 'sample_posterior': True, 'initial_strategy': 'mean', 'imputation_order': 'descending'}. Best is trial 7 with value: 1318.834857175494.
[I 2023-12-12 15:44:06,492] Trial 184 finished with value: inf and parameters: {'model_name': 'IterativeImputer', 'estimator': 'RFR', 'sample_posterior': True, 'initial_strategy': 'most_frequent', 'imputation_order': 'ascending'}. Best is trial 7 with value: 1318.834857175494.
[I 2023-12-12 15:44:08,080] Trial 88 finished with value: 2629.2713709977797 and parameters: {'model_name': 'RandomForestImputer', 'max_iter': 14, 'decreasing': False, 'min_samples_split': 0.9, 'min_samples_leaf': 0.9, 'max_features': 0.7000000000000001, 'warm_start': False}. Best is trial 7 with value: 1318.834857175494.
[I 2023-12-12 15:44:12,969] Trial 60 finished with value: 2441.3721227210362 and parameters: {'model_name': 'RandomForestImputer', 'max_iter': 10, 'decreasing': True, 'min_samples_split': 0.8, 'min_samples_leaf': 0.1, 'max_features': 0.30000000000000004, 'warm_start': False}. Best is trial 7 with value: 1318.834857175494.
[I 2023-12-12 15:44:29,600] Trial 20 finished with value: 2829.483293147978 and parameters: {'model_name': 'GAIN', 'batch_size': 62, 'hint_rate': 0.64, 'alpha': 64, 'iterations': 127}. Best is trial 7 with value: 1318.834857175494.
[I 2023-12-12 15:45:28,873] Trial 25 finished with value: inf and parameters: {'model_name': 'GAIN', 'batch_size': 148, 'hint_rate': 0.56, 'alpha': 33, 'iterations': 675}. Best is trial 7 with value: 1318.834857175494.
[I 2023-12-12 15:45:46,485] Trial 77 finished with value: 2824.4481061923343 and parameters: {'model_name': 'GAIN', 'batch_size': 1, 'hint_rate': 0.53, 'alpha': 76, 'iterations': 245}. Best is trial 7 with value: 1318.834857175494.
[I 2023-12-12 15:46:55,149] Trial 72 finished with value: 2630.12974111627 and parameters: {'model_name': 'RandomForestImputer', 'max_iter': 33, 'decreasing': False, 'min_samples_split': 0.7000000000000001, 'min_samples_leaf': 0.4, 'max_features': 0.9, 'warm_start': False}. Best is trial 7 with value: 1318.834857175494.
[I 2023-12-12 15:47:21,612] Trial 19 finished with value: inf and parameters: {'model_name': 'GAIN', 'batch_size': 294, 'hint_rate': 0.35000000000000003, 'alpha': 64, 'iterations': 3377}. Best is trial 7 with value: 1318.834857175494.
[I 2023-12-12 15:48:01,528] Trial 85 finished with value: 2548.3214823620774 and parameters: {'model_name': 'RandomForestImputer', 'max_iter': 47, 'decreasing': False, 'min_samples_split': 0.7000000000000001, 'min_samples_leaf': 0.30000000000000004, 'max_features': 0.5, 'warm_start': False}. Best is trial 7 with value: 1318.834857175494.
[I 2023-12-12 15:48:38,021] Trial 38 finished with value: 2630.6612384913687 and parameters: {'model_name': 'RandomForestImputer', 'max_iter': 46, 'decreasing': False, 'min_samples_split': 0.0, 'min_samples_leaf': 0.5, 'max_features': 0.9, 'warm_start': False}. Best is trial 7 with value: 1318.834857175494.
[I 2023-12-12 15:49:15,238] Trial 30 finished with value: inf and parameters: {'model_name': 'GAIN', 'batch_size': 3, 'hint_rate': 0.05, 'alpha': 70, 'iterations': 5927}. Best is trial 7 with value: 1318.834857175494.
[I 2023-12-12 15:52:24,990] Trial 11 finished with value: 2336.2645067872095 and parameters: {'model_name': 'GAIN', 'batch_size': 8, 'hint_rate': 0.03, 'alpha': 60, 'iterations': 952}. Best is trial 7 with value: 1318.834857175494.
[I 2023-12-12 15:54:55,254] Trial 81 finished with value: 2357.7937169143443 and parameters: {'model_name': 'RandomForestImputer', 'max_iter': 87, 'decreasing': True, 'min_samples_split': 0.8, 'min_samples_leaf': 0.1, 'max_features': 0.8, 'warm_start': False}. Best is trial 7 with value: 1318.834857175494.
[I 2023-12-12 15:56:03,400] Trial 24 finished with value: inf and parameters: {'model_name': 'GAIN', 'batch_size': 45, 'hint_rate': 0.54, 'alpha': 22, 'iterations': 13433}. Best is trial 7 with value: 1318.834857175494.
[I 2023-12-12 15:58:03,868] Trial 45 finished with value: 2268.092451457536 and parameters: {'model_name': 'GAIN', 'batch_size': 1, 'hint_rate': 0.04, 'alpha': 9, 'iterations': 1690}. Best is trial 7 with value: 1318.834857175494.
[I 2023-12-12 15:59:21,784] Trial 100 finished with value: inf and parameters: {'model_name': 'GAIN', 'batch_size': 1, 'hint_rate': 0.98, 'alpha': 97, 'iterations': 18742}. Best is trial 7 with value: 1318.834857175494.
[I 2023-12-12 16:01:37,306] Trial 197 finished with value: inf and parameters: {'model_name': 'GAIN', 'batch_size': 1, 'hint_rate': 0.03, 'alpha': 100, 'iterations': 21958}. Best is trial 7 with value: 1318.834857175494.
[I 2023-12-12 16:05:50,504] Trial 98 finished with value: inf and parameters: {'model_name': 'GAIN', 'batch_size': 1, 'hint_rate': 0.92, 'alpha': 2, 'iterations': 30360}. Best is trial 7 with value: 1318.834857175494.
[I 2023-12-12 16:14:25,521] Trial 97 finished with value: inf and parameters: {'model_name': 'GAIN', 'batch_size': 1, 'hint_rate': 0.98, 'alpha': 0, 'iterations': 46072}. Best is trial 7 with value: 1318.834857175494.
[I 2023-12-12 16:15:46,283] Trial 91 finished with value: inf and parameters: {'model_name': 'GAIN', 'batch_size': 1, 'hint_rate': 0.9400000000000001, 'alpha': 100, 'iterations': 48977}. Best is trial 7 with value: 1318.834857175494.
[I 2023-12-12 16:18:15,682] Trial 95 finished with value: inf and parameters: {'model_name': 'GAIN', 'batch_size': 1, 'hint_rate': 0.93, 'alpha': 98, 'iterations': 55014}. Best is trial 7 with value: 1318.834857175494.
[I 2023-12-12 16:23:48,927] Trial 93 finished with value: inf and parameters: {'model_name': 'GAIN', 'batch_size': 1, 'hint_rate': 0.97, 'alpha': 95, 'iterations': 72440}. Best is trial 7 with value: 1318.834857175494.
