Run: 2
/cm/local/apps/slurm/var/spool/job567829/slurm_script: line 23: /common/ketrong/minconda3/etc/profile.d/conda.sh: No such file or directory
/cm/local/apps/slurm/var/spool/job567829/slurm_script: line 26: $'\nconda create --name tpot2devenv -c conda-forge python=3.10\n': command not found
/cm/local/apps/slurm/var/spool/job567829/slurm_script: line 31: $'\npip install -r requirements.txt\n': command not found
RunStart
2023-12-28 08:09:28.397355: I tensorflow/core/util/port.cc:113] oneDNN custom operations are on. You may see slightly different numerical results due to floating-point round-off errors from different computation orders. To turn them off, set the environment variable `TF_ENABLE_ONEDNN_OPTS=0`.
2023-12-28 08:09:28.432164: E external/local_xla/xla/stream_executor/cuda/cuda_dnn.cc:9261] Unable to register cuDNN factory: Attempting to register factory for plugin cuDNN when one has already been registered
2023-12-28 08:09:28.432187: E external/local_xla/xla/stream_executor/cuda/cuda_fft.cc:607] Unable to register cuFFT factory: Attempting to register factory for plugin cuFFT when one has already been registered
2023-12-28 08:09:28.433314: E external/local_xla/xla/stream_executor/cuda/cuda_blas.cc:1515] Unable to register cuBLAS factory: Attempting to register factory for plugin cuBLAS when one has already been registered
2023-12-28 08:09:28.438932: I tensorflow/core/platform/cpu_feature_guard.cc:182] This TensorFlow binary is optimized to use available CPU instructions in performance-critical operations.
To enable the following instructions: AVX2 AVX512F AVX512_VNNI FMA, in other operations, rebuild TensorFlow with the appropriate compiler flags.
2023-12-28 08:09:31.664081: W tensorflow/compiler/tf2tensorrt/utils/py_utils.cc:38] TF-TRT Warning: Could not find TensorRT
WARNING:tensorflow:From /home/ketrong/miniconda3/envs/tpot2devenv/lib/python3.10/site-packages/tensorflow/python/compat/v2_compat.py:108: disable_resource_variables (from tensorflow.python.ops.variable_scope) is deprecated and will be removed in a future version.
Instructions for updating:
non-resource variables are not supported in the long term
starting loops
working on 
logs/3591/tpot2_base_normal_MCAR_0.1
4.641479969024658
loading data
logs/3591/tpot2_base_normal_MCAR_0.1/data/3591_True.pkl
running experiment 1/3 - Does large hyperparameter space improve reconstruction accuracy over simple
[I 2023-12-28 08:09:47,019] A new study created in memory with name: no-name-2a6fed0a-729a-4766-b477-41a99ca509f6
[I 2023-12-28 08:09:47,489] Trial 0 finished with value: 2.9732354120222957 and parameters: {'model_name': 'SimpleImputer', 'strategy': 'constant'}. Best is trial 0 with value: 2.9732354120222957.
[I 2023-12-28 08:09:47,835] Trial 1 finished with value: 1.4660878408546245 and parameters: {'model_name': 'SimpleImputer', 'strategy': 'mean'}. Best is trial 1 with value: 1.4660878408546245.
[I 2023-12-28 08:09:48,007] Trial 2 finished with value: 1.4660878408546245 and parameters: {'model_name': 'SimpleImputer', 'strategy': 'mean'}. Best is trial 1 with value: 1.4660878408546245.
[I 2023-12-28 08:09:48,216] Trial 6 finished with value: 2.9732354120222957 and parameters: {'model_name': 'SimpleImputer', 'strategy': 'constant'}. Best is trial 1 with value: 1.4660878408546245.
[I 2023-12-28 08:09:48,439] Trial 11 finished with value: 2.9732354120222957 and parameters: {'model_name': 'SimpleImputer', 'strategy': 'constant'}. Best is trial 1 with value: 1.4660878408546245.
[I 2023-12-28 08:09:48,916] Trial 16 finished with value: 2.9732354120222957 and parameters: {'model_name': 'SimpleImputer', 'strategy': 'constant'}. Best is trial 1 with value: 1.4660878408546245.
[I 2023-12-28 08:09:49,098] Trial 8 finished with value: 1.4660878408546245 and parameters: {'model_name': 'SimpleImputer', 'strategy': 'mean'}. Best is trial 1 with value: 1.4660878408546245.
[I 2023-12-28 08:09:49,335] Trial 21 finished with value: 2.9732354120222957 and parameters: {'model_name': 'SimpleImputer', 'strategy': 'constant'}. Best is trial 1 with value: 1.4660878408546245.
[I 2023-12-28 08:09:49,534] Trial 4 finished with value: 1.4660878408546245 and parameters: {'model_name': 'SimpleImputer', 'strategy': 'mean'}. Best is trial 1 with value: 1.4660878408546245.
[I 2023-12-28 08:09:49,816] Trial 19 finished with value: 2.9732354120222957 and parameters: {'model_name': 'SimpleImputer', 'strategy': 'constant'}. Best is trial 1 with value: 1.4660878408546245.
[I 2023-12-28 08:09:50,072] Trial 18 finished with value: 1.4660878408546245 and parameters: {'model_name': 'SimpleImputer', 'strategy': 'mean'}. Best is trial 1 with value: 1.4660878408546245.
[I 2023-12-28 08:09:50,323] Trial 10 finished with value: 1.4660878408546245 and parameters: {'model_name': 'SimpleImputer', 'strategy': 'mean'}. Best is trial 1 with value: 1.4660878408546245.
[I 2023-12-28 08:09:50,580] Trial 24 finished with value: 2.9732354120222957 and parameters: {'model_name': 'SimpleImputer', 'strategy': 'constant'}. Best is trial 1 with value: 1.4660878408546245.
[I 2023-12-28 08:09:50,756] Trial 12 finished with value: 1.4660878408546245 and parameters: {'model_name': 'SimpleImputer', 'strategy': 'mean'}. Best is trial 1 with value: 1.4660878408546245.
[I 2023-12-28 08:09:51,023] Trial 25 finished with value: 2.9732354120222957 and parameters: {'model_name': 'SimpleImputer', 'strategy': 'constant'}. Best is trial 1 with value: 1.4660878408546245.
[I 2023-12-28 08:09:51,375] Trial 43 finished with value: 2.9732354120222957 and parameters: {'model_name': 'SimpleImputer', 'strategy': 'constant'}. Best is trial 1 with value: 1.4660878408546245.
[I 2023-12-28 08:09:51,569] Trial 13 finished with value: 1.4660878408546245 and parameters: {'model_name': 'SimpleImputer', 'strategy': 'mean'}. Best is trial 1 with value: 1.4660878408546245.
[I 2023-12-28 08:09:51,802] Trial 29 finished with value: 1.4660878408546245 and parameters: {'model_name': 'SimpleImputer', 'strategy': 'mean'}. Best is trial 1 with value: 1.4660878408546245.
[I 2023-12-28 08:09:52,040] Trial 34 finished with value: 2.9732354120222957 and parameters: {'model_name': 'SimpleImputer', 'strategy': 'constant'}. Best is trial 1 with value: 1.4660878408546245.
[I 2023-12-28 08:09:52,235] Trial 3 finished with value: 1.568917835504817 and parameters: {'model_name': 'SimpleImputer', 'strategy': 'median'}. Best is trial 1 with value: 1.4660878408546245.
[I 2023-12-28 08:09:52,394] Trial 37 finished with value: 2.9732354120222957 and parameters: {'model_name': 'SimpleImputer', 'strategy': 'constant'}. Best is trial 1 with value: 1.4660878408546245.
[I 2023-12-28 08:09:52,584] Trial 5 finished with value: 1.568917835504817 and parameters: {'model_name': 'SimpleImputer', 'strategy': 'median'}. Best is trial 1 with value: 1.4660878408546245.
[I 2023-12-28 08:09:52,991] Trial 36 finished with value: 2.9732354120222957 and parameters: {'model_name': 'SimpleImputer', 'strategy': 'constant'}. Best is trial 1 with value: 1.4660878408546245.
[I 2023-12-28 08:09:53,159] Trial 9 finished with value: 1.568917835504817 and parameters: {'model_name': 'SimpleImputer', 'strategy': 'median'}. Best is trial 1 with value: 1.4660878408546245.
[I 2023-12-28 08:09:53,343] Trial 50 finished with value: 2.9732354120222957 and parameters: {'model_name': 'SimpleImputer', 'strategy': 'constant'}. Best is trial 1 with value: 1.4660878408546245.
[I 2023-12-28 08:09:53,546] Trial 30 finished with value: 1.4660878408546245 and parameters: {'model_name': 'SimpleImputer', 'strategy': 'mean'}. Best is trial 1 with value: 1.4660878408546245.
[I 2023-12-28 08:09:53,796] Trial 41 finished with value: 1.4660878408546245 and parameters: {'model_name': 'SimpleImputer', 'strategy': 'mean'}. Best is trial 1 with value: 1.4660878408546245.
[I 2023-12-28 08:09:54,041] Trial 40 finished with value: 1.4660878408546245 and parameters: {'model_name': 'SimpleImputer', 'strategy': 'mean'}. Best is trial 1 with value: 1.4660878408546245.
[I 2023-12-28 08:09:54,282] Trial 33 finished with value: 1.4660878408546245 and parameters: {'model_name': 'SimpleImputer', 'strategy': 'mean'}. Best is trial 1 with value: 1.4660878408546245.
[I 2023-12-28 08:09:54,662] Trial 38 finished with value: 1.4660878408546245 and parameters: {'model_name': 'SimpleImputer', 'strategy': 'mean'}. Best is trial 1 with value: 1.4660878408546245.
[I 2023-12-28 08:09:54,849] Trial 32 finished with value: 1.4660878408546245 and parameters: {'model_name': 'SimpleImputer', 'strategy': 'mean'}. Best is trial 1 with value: 1.4660878408546245.
[I 2023-12-28 08:09:55,122] Trial 17 finished with value: 1.568917835504817 and parameters: {'model_name': 'SimpleImputer', 'strategy': 'median'}. Best is trial 1 with value: 1.4660878408546245.
[I 2023-12-28 08:09:55,372] Trial 35 finished with value: 1.4660878408546245 and parameters: {'model_name': 'SimpleImputer', 'strategy': 'mean'}. Best is trial 1 with value: 1.4660878408546245.
[I 2023-12-28 08:09:55,652] Trial 44 finished with value: 1.4660878408546245 and parameters: {'model_name': 'SimpleImputer', 'strategy': 'mean'}. Best is trial 1 with value: 1.4660878408546245.
[I 2023-12-28 08:09:55,845] Trial 53 finished with value: 1.4660878408546245 and parameters: {'model_name': 'SimpleImputer', 'strategy': 'mean'}. Best is trial 1 with value: 1.4660878408546245.
[I 2023-12-28 08:09:56,026] Trial 45 finished with value: 1.4660878408546245 and parameters: {'model_name': 'SimpleImputer', 'strategy': 'mean'}. Best is trial 1 with value: 1.4660878408546245.
[I 2023-12-28 08:09:56,199] Trial 15 finished with value: 1.568917835504817 and parameters: {'model_name': 'SimpleImputer', 'strategy': 'median'}. Best is trial 1 with value: 1.4660878408546245.
[I 2023-12-28 08:09:56,507] Trial 23 finished with value: 1.568917835504817 and parameters: {'model_name': 'SimpleImputer', 'strategy': 'median'}. Best is trial 1 with value: 1.4660878408546245.
[I 2023-12-28 08:09:56,696] Trial 31 finished with value: 1.4660878408546245 and parameters: {'model_name': 'SimpleImputer', 'strategy': 'mean'}. Best is trial 1 with value: 1.4660878408546245.
[I 2023-12-28 08:09:56,907] Trial 48 finished with value: 1.4660878408546245 and parameters: {'model_name': 'SimpleImputer', 'strategy': 'mean'}. Best is trial 1 with value: 1.4660878408546245.
[I 2023-12-28 08:09:57,204] Trial 14 finished with value: 1.568917835504817 and parameters: {'model_name': 'SimpleImputer', 'strategy': 'median'}. Best is trial 1 with value: 1.4660878408546245.
[I 2023-12-28 08:09:57,647] Trial 20 finished with value: 1.568917835504817 and parameters: {'model_name': 'SimpleImputer', 'strategy': 'median'}. Best is trial 1 with value: 1.4660878408546245.
[I 2023-12-28 08:09:57,944] Trial 55 finished with value: 1.4660878408546245 and parameters: {'model_name': 'SimpleImputer', 'strategy': 'mean'}. Best is trial 1 with value: 1.4660878408546245.
[I 2023-12-28 08:09:58,424] Trial 49 finished with value: 1.568917835504817 and parameters: {'model_name': 'SimpleImputer', 'strategy': 'median'}. Best is trial 1 with value: 1.4660878408546245.
[I 2023-12-28 08:09:58,730] Trial 42 finished with value: 1.568917835504817 and parameters: {'model_name': 'SimpleImputer', 'strategy': 'median'}. Best is trial 1 with value: 1.4660878408546245.
[I 2023-12-28 08:09:59,154] Trial 52 finished with value: 1.568917835504817 and parameters: {'model_name': 'SimpleImputer', 'strategy': 'median'}. Best is trial 1 with value: 1.4660878408546245.
[I 2023-12-28 08:09:59,455] Trial 28 finished with value: 1.568917835504817 and parameters: {'model_name': 'SimpleImputer', 'strategy': 'median'}. Best is trial 1 with value: 1.4660878408546245.
[I 2023-12-28 08:09:59,934] Trial 51 finished with value: 1.568917835504817 and parameters: {'model_name': 'SimpleImputer', 'strategy': 'median'}. Best is trial 1 with value: 1.4660878408546245.
[I 2023-12-28 08:10:00,233] Trial 54 finished with value: 1.568917835504817 and parameters: {'model_name': 'SimpleImputer', 'strategy': 'median'}. Best is trial 1 with value: 1.4660878408546245.
[I 2023-12-28 08:10:00,770] Trial 60 finished with value: 1.568917835504817 and parameters: {'model_name': 'SimpleImputer', 'strategy': 'median'}. Best is trial 1 with value: 1.4660878408546245.
[I 2023-12-28 08:10:01,023] Trial 79 finished with value: 1.4660878408546245 and parameters: {'model_name': 'SimpleImputer', 'strategy': 'mean'}. Best is trial 1 with value: 1.4660878408546245.
[I 2023-12-28 08:10:01,213] Trial 83 finished with value: 1.4660878408546245 and parameters: {'model_name': 'SimpleImputer', 'strategy': 'mean'}. Best is trial 1 with value: 1.4660878408546245.
[I 2023-12-28 08:10:01,812] Trial 59 finished with value: 1.568917835504817 and parameters: {'model_name': 'SimpleImputer', 'strategy': 'median'}. Best is trial 1 with value: 1.4660878408546245.
[I 2023-12-28 08:10:02,196] Trial 63 finished with value: 1.568917835504817 and parameters: {'model_name': 'SimpleImputer', 'strategy': 'median'}. Best is trial 1 with value: 1.4660878408546245.
[I 2023-12-28 08:10:02,654] Trial 66 finished with value: 1.568917835504817 and parameters: {'model_name': 'SimpleImputer', 'strategy': 'median'}. Best is trial 1 with value: 1.4660878408546245.
[I 2023-12-28 08:10:02,997] Trial 7 finished with value: 2.1239659557680666 and parameters: {'model_name': 'SimpleImputer', 'strategy': 'most_frequent'}. Best is trial 1 with value: 1.4660878408546245.
[I 2023-12-28 08:10:03,255] Trial 27 finished with value: 2.1239659557680666 and parameters: {'model_name': 'SimpleImputer', 'strategy': 'most_frequent'}. Best is trial 1 with value: 1.4660878408546245.
[I 2023-12-28 08:10:03,536] Trial 39 finished with value: 2.1239659557680666 and parameters: {'model_name': 'SimpleImputer', 'strategy': 'most_frequent'}. Best is trial 1 with value: 1.4660878408546245.
[I 2023-12-28 08:10:03,800] Trial 22 finished with value: 2.1239659557680666 and parameters: {'model_name': 'SimpleImputer', 'strategy': 'most_frequent'}. Best is trial 1 with value: 1.4660878408546245.
[I 2023-12-28 08:10:04,307] Trial 26 finished with value: 2.1239659557680666 and parameters: {'model_name': 'SimpleImputer', 'strategy': 'most_frequent'}. Best is trial 1 with value: 1.4660878408546245.
[I 2023-12-28 08:10:04,611] Trial 47 finished with value: 2.1239659557680666 and parameters: {'model_name': 'SimpleImputer', 'strategy': 'most_frequent'}. Best is trial 1 with value: 1.4660878408546245.
[I 2023-12-28 08:10:04,916] Trial 57 finished with value: 2.1239659557680666 and parameters: {'model_name': 'SimpleImputer', 'strategy': 'most_frequent'}. Best is trial 1 with value: 1.4660878408546245.
[I 2023-12-28 08:10:05,474] Trial 46 finished with value: 2.1239659557680666 and parameters: {'model_name': 'SimpleImputer', 'strategy': 'most_frequent'}. Best is trial 1 with value: 1.4660878408546245.
[I 2023-12-28 08:10:05,864] Trial 56 finished with value: 2.1239659557680666 and parameters: {'model_name': 'SimpleImputer', 'strategy': 'most_frequent'}. Best is trial 1 with value: 1.4660878408546245.
[I 2023-12-28 08:10:06,094] Trial 102 finished with value: 1.4660878408546245 and parameters: {'model_name': 'SimpleImputer', 'strategy': 'mean'}. Best is trial 1 with value: 1.4660878408546245.
[I 2023-12-28 08:10:06,273] Trial 61 finished with value: 2.1239659557680666 and parameters: {'model_name': 'SimpleImputer', 'strategy': 'most_frequent'}. Best is trial 1 with value: 1.4660878408546245.
[I 2023-12-28 08:10:06,718] Trial 68 finished with value: 2.1239659557680666 and parameters: {'model_name': 'SimpleImputer', 'strategy': 'most_frequent'}. Best is trial 1 with value: 1.4660878408546245.
[I 2023-12-28 08:10:06,969] Trial 64 finished with value: 2.1239659557680666 and parameters: {'model_name': 'SimpleImputer', 'strategy': 'most_frequent'}. Best is trial 1 with value: 1.4660878408546245.
[I 2023-12-28 08:10:07,427] Trial 69 finished with value: 2.1239659557680666 and parameters: {'model_name': 'SimpleImputer', 'strategy': 'most_frequent'}. Best is trial 1 with value: 1.4660878408546245.
[I 2023-12-28 08:10:07,623] Trial 88 finished with value: 2.1239659557680666 and parameters: {'model_name': 'SimpleImputer', 'strategy': 'most_frequent'}. Best is trial 1 with value: 1.4660878408546245.
[I 2023-12-28 08:10:08,002] Trial 62 finished with value: 2.1239659557680666 and parameters: {'model_name': 'SimpleImputer', 'strategy': 'most_frequent'}. Best is trial 1 with value: 1.4660878408546245.
[I 2023-12-28 08:10:08,190] Trial 73 finished with value: 2.1239659557680666 and parameters: {'model_name': 'SimpleImputer', 'strategy': 'most_frequent'}. Best is trial 1 with value: 1.4660878408546245.
[I 2023-12-28 08:10:08,440] Trial 67 finished with value: 2.1239659557680666 and parameters: {'model_name': 'SimpleImputer', 'strategy': 'most_frequent'}. Best is trial 1 with value: 1.4660878408546245.
[I 2023-12-28 08:10:08,659] Trial 70 finished with value: 2.1239659557680666 and parameters: {'model_name': 'SimpleImputer', 'strategy': 'most_frequent'}. Best is trial 1 with value: 1.4660878408546245.
[I 2023-12-28 08:10:08,875] Trial 80 finished with value: 2.1239659557680666 and parameters: {'model_name': 'SimpleImputer', 'strategy': 'most_frequent'}. Best is trial 1 with value: 1.4660878408546245.
[I 2023-12-28 08:10:09,098] Trial 107 finished with value: 1.4660878408546245 and parameters: {'model_name': 'SimpleImputer', 'strategy': 'mean'}. Best is trial 1 with value: 1.4660878408546245.
[I 2023-12-28 08:10:09,299] Trial 106 finished with value: 1.4660878408546245 and parameters: {'model_name': 'SimpleImputer', 'strategy': 'mean'}. Best is trial 1 with value: 1.4660878408546245.
[I 2023-12-28 08:10:09,547] Trial 65 finished with value: 2.1239659557680666 and parameters: {'model_name': 'SimpleImputer', 'strategy': 'most_frequent'}. Best is trial 1 with value: 1.4660878408546245.
[I 2023-12-28 08:10:09,853] Trial 105 finished with value: 1.4660878408546245 and parameters: {'model_name': 'SimpleImputer', 'strategy': 'mean'}. Best is trial 1 with value: 1.4660878408546245.
[I 2023-12-28 08:10:10,197] Trial 109 finished with value: 1.4660878408546245 and parameters: {'model_name': 'SimpleImputer', 'strategy': 'mean'}. Best is trial 1 with value: 1.4660878408546245.
[I 2023-12-28 08:10:10,554] Trial 76 finished with value: 2.1239659557680666 and parameters: {'model_name': 'SimpleImputer', 'strategy': 'most_frequent'}. Best is trial 1 with value: 1.4660878408546245.
[I 2023-12-28 08:10:10,778] Trial 71 finished with value: 2.1239659557680666 and parameters: {'model_name': 'SimpleImputer', 'strategy': 'most_frequent'}. Best is trial 1 with value: 1.4660878408546245.
[I 2023-12-28 08:10:10,968] Trial 58 finished with value: 2.1239659557680666 and parameters: {'model_name': 'SimpleImputer', 'strategy': 'most_frequent'}. Best is trial 1 with value: 1.4660878408546245.
[I 2023-12-28 08:10:11,217] Trial 110 finished with value: 1.4660878408546245 and parameters: {'model_name': 'SimpleImputer', 'strategy': 'mean'}. Best is trial 1 with value: 1.4660878408546245.
[I 2023-12-28 08:10:11,416] Trial 89 finished with value: 2.1239659557680666 and parameters: {'model_name': 'SimpleImputer', 'strategy': 'most_frequent'}. Best is trial 1 with value: 1.4660878408546245.
[I 2023-12-28 08:10:11,644] Trial 72 finished with value: 2.1239659557680666 and parameters: {'model_name': 'SimpleImputer', 'strategy': 'most_frequent'}. Best is trial 1 with value: 1.4660878408546245.
[I 2023-12-28 08:10:11,960] Trial 108 finished with value: 1.4660878408546245 and parameters: {'model_name': 'SimpleImputer', 'strategy': 'mean'}. Best is trial 1 with value: 1.4660878408546245.
[I 2023-12-28 08:10:12,381] Trial 86 finished with value: 2.1239659557680666 and parameters: {'model_name': 'SimpleImputer', 'strategy': 'most_frequent'}. Best is trial 1 with value: 1.4660878408546245.
[I 2023-12-28 08:10:12,620] Trial 75 finished with value: 2.1239659557680666 and parameters: {'model_name': 'SimpleImputer', 'strategy': 'most_frequent'}. Best is trial 1 with value: 1.4660878408546245.
[I 2023-12-28 08:10:12,898] Trial 111 finished with value: 1.4660878408546245 and parameters: {'model_name': 'SimpleImputer', 'strategy': 'mean'}. Best is trial 1 with value: 1.4660878408546245.
[I 2023-12-28 08:10:13,113] Trial 91 finished with value: 2.1239659557680666 and parameters: {'model_name': 'SimpleImputer', 'strategy': 'most_frequent'}. Best is trial 1 with value: 1.4660878408546245.
[I 2023-12-28 08:10:13,424] Trial 77 finished with value: 2.1239659557680666 and parameters: {'model_name': 'SimpleImputer', 'strategy': 'most_frequent'}. Best is trial 1 with value: 1.4660878408546245.
[I 2023-12-28 08:10:13,698] Trial 114 finished with value: 1.4660878408546245 and parameters: {'model_name': 'SimpleImputer', 'strategy': 'mean'}. Best is trial 1 with value: 1.4660878408546245.
[I 2023-12-28 08:10:13,991] Trial 81 finished with value: 2.1239659557680666 and parameters: {'model_name': 'SimpleImputer', 'strategy': 'most_frequent'}. Best is trial 1 with value: 1.4660878408546245.
[I 2023-12-28 08:10:14,195] Trial 74 finished with value: 2.1239659557680666 and parameters: {'model_name': 'SimpleImputer', 'strategy': 'most_frequent'}. Best is trial 1 with value: 1.4660878408546245.
[I 2023-12-28 08:10:14,361] Trial 113 finished with value: 1.4660878408546245 and parameters: {'model_name': 'SimpleImputer', 'strategy': 'mean'}. Best is trial 1 with value: 1.4660878408546245.
[I 2023-12-28 08:10:14,627] Trial 87 finished with value: 2.1239659557680666 and parameters: {'model_name': 'SimpleImputer', 'strategy': 'most_frequent'}. Best is trial 1 with value: 1.4660878408546245.
[I 2023-12-28 08:10:14,828] Trial 85 finished with value: 2.1239659557680666 and parameters: {'model_name': 'SimpleImputer', 'strategy': 'most_frequent'}. Best is trial 1 with value: 1.4660878408546245.
