[I 2024-04-15 00:48:01,426] Trial 99 finished with value: 0.2285702000115084 and parameters: {'model_name': 'IterativeImputer', 'sample_posterior': False, 'initial_strategy': 'mean', 'imputation_order': 'arabic'}. Best is trial 21 with value: 0.22709666808728138.
[I 2024-04-15 00:48:05,070] Trial 96 finished with value: 0.2285702000115084 and parameters: {'model_name': 'IterativeImputer', 'sample_posterior': False, 'initial_strategy': 'mean', 'imputation_order': 'arabic'}. Best is trial 21 with value: 0.22709666808728138.
[I 2024-04-15 00:48:11,556] Trial 97 finished with value: 0.22822820015142353 and parameters: {'model_name': 'IterativeImputer', 'sample_posterior': False, 'initial_strategy': 'mean', 'imputation_order': 'descending'}. Best is trial 21 with value: 0.22709666808728138.
[I 2024-04-15 00:48:14,568] Trial 100 finished with value: 0.2285702000115084 and parameters: {'model_name': 'IterativeImputer', 'sample_posterior': False, 'initial_strategy': 'mean', 'imputation_order': 'arabic'}. Best is trial 21 with value: 0.22709666808728138.
[I 2024-04-15 00:48:19,046] Trial 98 finished with value: 0.2285702000115084 and parameters: {'model_name': 'IterativeImputer', 'sample_posterior': False, 'initial_strategy': 'mean', 'imputation_order': 'arabic'}. Best is trial 21 with value: 0.22709666808728138.
[I 2024-04-15 00:48:25,983] Trial 103 finished with value: 0.22827448542665968 and parameters: {'model_name': 'IterativeImputer', 'sample_posterior': False, 'initial_strategy': 'mean', 'imputation_order': 'ascending'}. Best is trial 21 with value: 0.22709666808728138.
[I 2024-04-15 00:48:30,337] Trial 102 finished with value: 0.2285702000115084 and parameters: {'model_name': 'IterativeImputer', 'sample_posterior': False, 'initial_strategy': 'mean', 'imputation_order': 'arabic'}. Best is trial 21 with value: 0.22709666808728138.
[I 2024-04-15 00:48:31,804] Trial 101 finished with value: 0.2285702000115084 and parameters: {'model_name': 'IterativeImputer', 'sample_posterior': False, 'initial_strategy': 'mean', 'imputation_order': 'arabic'}. Best is trial 21 with value: 0.22709666808728138.
[I 2024-04-15 00:48:40,882] Trial 104 finished with value: 0.22827448542665968 and parameters: {'model_name': 'IterativeImputer', 'sample_posterior': False, 'initial_strategy': 'mean', 'imputation_order': 'ascending'}. Best is trial 21 with value: 0.22709666808728138.
[I 2024-04-15 00:48:42,658] Trial 88 finished with value: 0.34510914397806247 and parameters: {'model_name': 'IterativeImputer', 'sample_posterior': True, 'initial_strategy': 'most_frequent', 'imputation_order': 'arabic'}. Best is trial 21 with value: 0.22709666808728138.
[I 2024-04-15 00:48:49,706] Trial 105 finished with value: 0.22827448542665968 and parameters: {'model_name': 'IterativeImputer', 'sample_posterior': False, 'initial_strategy': 'mean', 'imputation_order': 'ascending'}. Best is trial 21 with value: 0.22709666808728138.
[I 2024-04-15 00:48:51,672] Trial 106 finished with value: 0.22793185665036128 and parameters: {'model_name': 'IterativeImputer', 'sample_posterior': False, 'initial_strategy': 'mean', 'imputation_order': 'roman'}. Best is trial 21 with value: 0.22709666808728138.
[I 2024-04-15 00:48:55,353] Trial 107 finished with value: 0.22827448542665968 and parameters: {'model_name': 'IterativeImputer', 'sample_posterior': False, 'initial_strategy': 'mean', 'imputation_order': 'ascending'}. Best is trial 21 with value: 0.22709666808728138.
[I 2024-04-15 00:49:08,686] Trial 108 finished with value: 0.2285702000115084 and parameters: {'model_name': 'IterativeImputer', 'sample_posterior': False, 'initial_strategy': 'mean', 'imputation_order': 'arabic'}. Best is trial 21 with value: 0.22709666808728138.
[I 2024-04-15 00:49:24,018] Trial 109 finished with value: 0.2285702000115084 and parameters: {'model_name': 'IterativeImputer', 'sample_posterior': False, 'initial_strategy': 'mean', 'imputation_order': 'arabic'}. Best is trial 21 with value: 0.22709666808728138.
[I 2024-04-15 00:50:04,314] Trial 89 finished with value: 0.3468545499275313 and parameters: {'model_name': 'IterativeImputer', 'sample_posterior': True, 'initial_strategy': 'constant', 'imputation_order': 'random'}. Best is trial 21 with value: 0.22709666808728138.
[I 2024-04-15 00:50:45,253] Trial 91 finished with value: 0.34626823581539706 and parameters: {'model_name': 'IterativeImputer', 'sample_posterior': True, 'initial_strategy': 'mean', 'imputation_order': 'arabic'}. Best is trial 21 with value: 0.22709666808728138.
[I 2024-04-15 00:51:00,736] Trial 110 finished with value: 0.22827448542665968 and parameters: {'model_name': 'IterativeImputer', 'sample_posterior': False, 'initial_strategy': 'mean', 'imputation_order': 'ascending'}. Best is trial 21 with value: 0.22709666808728138.
[I 2024-04-15 00:51:02,748] Trial 111 finished with value: 0.22827448542665968 and parameters: {'model_name': 'IterativeImputer', 'sample_posterior': False, 'initial_strategy': 'mean', 'imputation_order': 'ascending'}. Best is trial 21 with value: 0.22709666808728138.
[I 2024-04-15 00:52:38,869] Trial 22 finished with value: inf and parameters: {'model_name': 'GAIN', 'batch_size': 116, 'hint_rate': 0.05, 'alpha': 16, 'iterations': 5631}. Best is trial 21 with value: 0.22709666808728138.
[I 2024-04-15 00:53:22,974] Trial 19 finished with value: inf and parameters: {'model_name': 'GAIN', 'batch_size': 18, 'hint_rate': 0.09999999999999999, 'alpha': 71, 'iterations': 7026}. Best is trial 21 with value: 0.22709666808728138.
[I 2024-04-15 00:53:56,863] Trial 112 finished with value: 0.22827448542665968 and parameters: {'model_name': 'IterativeImputer', 'sample_posterior': False, 'initial_strategy': 'mean', 'imputation_order': 'ascending'}. Best is trial 21 with value: 0.22709666808728138.
[I 2024-04-15 00:55:44,397] Trial 8 finished with value: inf and parameters: {'model_name': 'GAIN', 'batch_size': 1, 'hint_rate': 0.67, 'alpha': 89, 'iterations': 11268}. Best is trial 21 with value: 0.22709666808728138.
[I 2024-04-15 00:55:57,130] Trial 95 finished with value: 0.34706900879541813 and parameters: {'model_name': 'IterativeImputer', 'sample_posterior': True, 'initial_strategy': 'mean', 'imputation_order': 'roman'}. Best is trial 21 with value: 0.22709666808728138.
[I 2024-04-15 00:56:13,054] Trial 94 finished with value: 0.3523562963202259 and parameters: {'model_name': 'IterativeImputer', 'sample_posterior': True, 'initial_strategy': 'most_frequent', 'imputation_order': 'random'}. Best is trial 21 with value: 0.22709666808728138.
[I 2024-04-15 00:58:10,507] Trial 65 finished with value: inf and parameters: {'model_name': 'GAIN', 'batch_size': 2, 'hint_rate': 0.29000000000000004, 'alpha': 28, 'iterations': 14556}. Best is trial 21 with value: 0.22709666808728138.
[I 2024-04-15 01:02:44,599] Trial 117 finished with value: 0.22827448542665968 and parameters: {'model_name': 'IterativeImputer', 'sample_posterior': False, 'initial_strategy': 'mean', 'imputation_order': 'ascending'}. Best is trial 21 with value: 0.22709666808728138.
[I 2024-04-15 01:03:00,403] Trial 119 finished with value: 0.22793185665036128 and parameters: {'model_name': 'IterativeImputer', 'sample_posterior': False, 'initial_strategy': 'mean', 'imputation_order': 'roman'}. Best is trial 21 with value: 0.22709666808728138.
[I 2024-04-15 01:03:04,110] Trial 118 finished with value: 0.22822820015142353 and parameters: {'model_name': 'IterativeImputer', 'sample_posterior': False, 'initial_strategy': 'mean', 'imputation_order': 'descending'}. Best is trial 21 with value: 0.22709666808728138.
[I 2024-04-15 01:03:22,567] Trial 121 finished with value: 0.22827448542665968 and parameters: {'model_name': 'IterativeImputer', 'sample_posterior': False, 'initial_strategy': 'mean', 'imputation_order': 'ascending'}. Best is trial 21 with value: 0.22709666808728138.
[I 2024-04-15 01:03:30,233] Trial 120 finished with value: 0.22793185665036128 and parameters: {'model_name': 'IterativeImputer', 'sample_posterior': False, 'initial_strategy': 'mean', 'imputation_order': 'roman'}. Best is trial 21 with value: 0.22709666808728138.
[I 2024-04-15 01:03:54,996] Trial 122 finished with value: 0.22793185665036128 and parameters: {'model_name': 'IterativeImputer', 'sample_posterior': False, 'initial_strategy': 'mean', 'imputation_order': 'roman'}. Best is trial 21 with value: 0.22709666808728138.
[I 2024-04-15 01:03:58,812] Trial 123 finished with value: 0.22827448542665968 and parameters: {'model_name': 'IterativeImputer', 'sample_posterior': False, 'initial_strategy': 'mean', 'imputation_order': 'ascending'}. Best is trial 21 with value: 0.22709666808728138.
[I 2024-04-15 01:04:07,294] Trial 124 finished with value: 0.22793185665036128 and parameters: {'model_name': 'IterativeImputer', 'sample_posterior': False, 'initial_strategy': 'mean', 'imputation_order': 'roman'}. Best is trial 21 with value: 0.22709666808728138.
[I 2024-04-15 01:04:30,131] Trial 126 finished with value: 0.22793185665036128 and parameters: {'model_name': 'IterativeImputer', 'sample_posterior': False, 'initial_strategy': 'mean', 'imputation_order': 'roman'}. Best is trial 21 with value: 0.22709666808728138.
[I 2024-04-15 01:04:32,506] Trial 125 finished with value: 0.22793185665036128 and parameters: {'model_name': 'IterativeImputer', 'sample_posterior': False, 'initial_strategy': 'mean', 'imputation_order': 'roman'}. Best is trial 21 with value: 0.22709666808728138.
[I 2024-04-15 01:04:44,651] Trial 113 finished with value: 0.3474468575568384 and parameters: {'model_name': 'IterativeImputer', 'sample_posterior': True, 'initial_strategy': 'mean', 'imputation_order': 'ascending'}. Best is trial 21 with value: 0.22709666808728138.
[I 2024-04-15 01:04:52,140] Trial 127 finished with value: 0.22793185665036128 and parameters: {'model_name': 'IterativeImputer', 'sample_posterior': False, 'initial_strategy': 'mean', 'imputation_order': 'roman'}. Best is trial 21 with value: 0.22709666808728138.
[I 2024-04-15 01:05:00,469] Trial 128 finished with value: 0.22793185665036128 and parameters: {'model_name': 'IterativeImputer', 'sample_posterior': False, 'initial_strategy': 'mean', 'imputation_order': 'roman'}. Best is trial 21 with value: 0.22709666808728138.
[I 2024-04-15 01:06:59,415] Trial 114 finished with value: 0.34387224600386745 and parameters: {'model_name': 'IterativeImputer', 'sample_posterior': True, 'initial_strategy': 'mean', 'imputation_order': 'ascending'}. Best is trial 21 with value: 0.22709666808728138.
[I 2024-04-15 01:07:15,740] Trial 129 finished with value: 0.22793185665036128 and parameters: {'model_name': 'IterativeImputer', 'sample_posterior': False, 'initial_strategy': 'mean', 'imputation_order': 'roman'}. Best is trial 21 with value: 0.22709666808728138.
[I 2024-04-15 01:07:41,384] Trial 115 finished with value: 0.34685391381982644 and parameters: {'model_name': 'IterativeImputer', 'sample_posterior': True, 'initial_strategy': 'mean', 'imputation_order': 'descending'}. Best is trial 21 with value: 0.22709666808728138.
[I 2024-04-15 01:08:00,300] Trial 131 finished with value: 0.22793185665036128 and parameters: {'model_name': 'IterativeImputer', 'sample_posterior': False, 'initial_strategy': 'mean', 'imputation_order': 'roman'}. Best is trial 21 with value: 0.22709666808728138.
[I 2024-04-15 01:08:11,939] Trial 130 finished with value: 0.22793185665036128 and parameters: {'model_name': 'IterativeImputer', 'sample_posterior': False, 'initial_strategy': 'mean', 'imputation_order': 'roman'}. Best is trial 21 with value: 0.22709666808728138.
[I 2024-04-15 01:08:16,615] Trial 132 finished with value: 0.22793185665036128 and parameters: {'model_name': 'IterativeImputer', 'sample_posterior': False, 'initial_strategy': 'mean', 'imputation_order': 'roman'}. Best is trial 21 with value: 0.22709666808728138.
[I 2024-04-15 01:08:29,449] Trial 134 finished with value: 0.22793185665036128 and parameters: {'model_name': 'IterativeImputer', 'sample_posterior': False, 'initial_strategy': 'mean', 'imputation_order': 'roman'}. Best is trial 21 with value: 0.22709666808728138.
[I 2024-04-15 01:08:33,403] Trial 133 finished with value: 0.22793185665036128 and parameters: {'model_name': 'IterativeImputer', 'sample_posterior': False, 'initial_strategy': 'mean', 'imputation_order': 'roman'}. Best is trial 21 with value: 0.22709666808728138.
[I 2024-04-15 01:08:43,721] Trial 137 finished with value: 0.22822820015142353 and parameters: {'model_name': 'IterativeImputer', 'sample_posterior': False, 'initial_strategy': 'mean', 'imputation_order': 'descending'}. Best is trial 21 with value: 0.22709666808728138.
[I 2024-04-15 01:08:45,212] Trial 116 finished with value: 0.3432719592441688 and parameters: {'model_name': 'IterativeImputer', 'sample_posterior': True, 'initial_strategy': 'mean', 'imputation_order': 'roman'}. Best is trial 21 with value: 0.22709666808728138.
[I 2024-04-15 01:08:47,949] Trial 135 finished with value: 0.22793185665036128 and parameters: {'model_name': 'IterativeImputer', 'sample_posterior': False, 'initial_strategy': 'mean', 'imputation_order': 'roman'}. Best is trial 21 with value: 0.22709666808728138.
[I 2024-04-15 01:08:59,347] Trial 136 finished with value: 0.22822820015142353 and parameters: {'model_name': 'IterativeImputer', 'sample_posterior': False, 'initial_strategy': 'mean', 'imputation_order': 'descending'}. Best is trial 21 with value: 0.22709666808728138.
[I 2024-04-15 01:09:08,604] Trial 138 finished with value: 0.22822820015142353 and parameters: {'model_name': 'IterativeImputer', 'sample_posterior': False, 'initial_strategy': 'mean', 'imputation_order': 'descending'}. Best is trial 21 with value: 0.22709666808728138.
[I 2024-04-15 01:09:10,339] Trial 140 finished with value: 0.22822820015142353 and parameters: {'model_name': 'IterativeImputer', 'sample_posterior': False, 'initial_strategy': 'mean', 'imputation_order': 'descending'}. Best is trial 21 with value: 0.22709666808728138.
[I 2024-04-15 01:09:14,763] Trial 139 finished with value: 0.22822820015142353 and parameters: {'model_name': 'IterativeImputer', 'sample_posterior': False, 'initial_strategy': 'mean', 'imputation_order': 'descending'}. Best is trial 21 with value: 0.22709666808728138.
[I 2024-04-15 01:09:17,364] Trial 141 finished with value: 0.22822820015142353 and parameters: {'model_name': 'IterativeImputer', 'sample_posterior': False, 'initial_strategy': 'mean', 'imputation_order': 'descending'}. Best is trial 21 with value: 0.22709666808728138.
[I 2024-04-15 01:09:26,497] Trial 143 finished with value: 0.22822820015142353 and parameters: {'model_name': 'IterativeImputer', 'sample_posterior': False, 'initial_strategy': 'mean', 'imputation_order': 'descending'}. Best is trial 21 with value: 0.22709666808728138.
[I 2024-04-15 01:09:32,392] Trial 142 finished with value: 0.22822820015142353 and parameters: {'model_name': 'IterativeImputer', 'sample_posterior': False, 'initial_strategy': 'mean', 'imputation_order': 'descending'}. Best is trial 21 with value: 0.22709666808728138.
[I 2024-04-15 01:09:37,806] Trial 145 finished with value: 0.22822820015142353 and parameters: {'model_name': 'IterativeImputer', 'sample_posterior': False, 'initial_strategy': 'mean', 'imputation_order': 'descending'}. Best is trial 21 with value: 0.22709666808728138.
[I 2024-04-15 01:09:46,025] Trial 146 finished with value: 0.22822820015142353 and parameters: {'model_name': 'IterativeImputer', 'sample_posterior': False, 'initial_strategy': 'mean', 'imputation_order': 'descending'}. Best is trial 21 with value: 0.22709666808728138.
[I 2024-04-15 01:09:50,329] Trial 144 finished with value: 0.22822820015142353 and parameters: {'model_name': 'IterativeImputer', 'sample_posterior': False, 'initial_strategy': 'mean', 'imputation_order': 'descending'}. Best is trial 21 with value: 0.22709666808728138.
[I 2024-04-15 01:10:08,312] Trial 147 finished with value: 0.22822820015142353 and parameters: {'model_name': 'IterativeImputer', 'sample_posterior': False, 'initial_strategy': 'mean', 'imputation_order': 'descending'}. Best is trial 21 with value: 0.22709666808728138.
[I 2024-04-15 01:10:31,226] Trial 148 finished with value: 0.22822820015142353 and parameters: {'model_name': 'IterativeImputer', 'sample_posterior': False, 'initial_strategy': 'mean', 'imputation_order': 'descending'}. Best is trial 21 with value: 0.22709666808728138.
[I 2024-04-15 01:11:06,175] Trial 149 finished with value: 0.22822820015142353 and parameters: {'model_name': 'IterativeImputer', 'sample_posterior': False, 'initial_strategy': 'mean', 'imputation_order': 'descending'}. Best is trial 21 with value: 0.22709666808728138.
[I 2024-04-15 01:11:11,527] Trial 196 finished with value: 0.4803321266400915 and parameters: {'model_name': 'SimpleImputer', 'strategy': 'constant'}. Best is trial 21 with value: 0.22709666808728138.
[I 2024-04-15 01:11:49,041] Trial 150 finished with value: 0.22822820015142353 and parameters: {'model_name': 'IterativeImputer', 'sample_posterior': False, 'initial_strategy': 'mean', 'imputation_order': 'descending'}. Best is trial 21 with value: 0.22709666808728138.
[I 2024-04-15 01:12:16,789] Trial 151 finished with value: 0.22822820015142353 and parameters: {'model_name': 'IterativeImputer', 'sample_posterior': False, 'initial_strategy': 'mean', 'imputation_order': 'descending'}. Best is trial 21 with value: 0.22709666808728138.
[I 2024-04-15 01:12:17,900] Trial 152 finished with value: 0.22822820015142353 and parameters: {'model_name': 'IterativeImputer', 'sample_posterior': False, 'initial_strategy': 'mean', 'imputation_order': 'descending'}. Best is trial 21 with value: 0.22709666808728138.
[I 2024-04-15 01:14:15,876] Trial 153 finished with value: 0.22822820015142353 and parameters: {'model_name': 'IterativeImputer', 'sample_posterior': False, 'initial_strategy': 'mean', 'imputation_order': 'descending'}. Best is trial 21 with value: 0.22709666808728138.
[I 2024-04-15 01:15:05,655] Trial 154 finished with value: 0.22822820015142353 and parameters: {'model_name': 'IterativeImputer', 'sample_posterior': False, 'initial_strategy': 'mean', 'imputation_order': 'descending'}. Best is trial 21 with value: 0.22709666808728138.
[I 2024-04-15 01:15:49,304] Trial 155 finished with value: 0.22822820015142353 and parameters: {'model_name': 'IterativeImputer', 'sample_posterior': False, 'initial_strategy': 'mean', 'imputation_order': 'descending'}. Best is trial 21 with value: 0.22709666808728138.
[I 2024-04-15 01:17:25,809] Trial 156 finished with value: 0.22822820015142353 and parameters: {'model_name': 'IterativeImputer', 'sample_posterior': False, 'initial_strategy': 'mean', 'imputation_order': 'descending'}. Best is trial 21 with value: 0.22709666808728138.
[I 2024-04-15 01:17:29,877] Trial 157 finished with value: 0.22822820015142353 and parameters: {'model_name': 'IterativeImputer', 'sample_posterior': False, 'initial_strategy': 'mean', 'imputation_order': 'descending'}. Best is trial 21 with value: 0.22709666808728138.
[I 2024-04-15 01:17:50,585] Trial 158 finished with value: 0.22822820015142353 and parameters: {'model_name': 'IterativeImputer', 'sample_posterior': False, 'initial_strategy': 'mean', 'imputation_order': 'descending'}. Best is trial 21 with value: 0.22709666808728138.
[I 2024-04-15 01:19:24,750] Trial 159 finished with value: 0.22822820015142353 and parameters: {'model_name': 'IterativeImputer', 'sample_posterior': False, 'initial_strategy': 'mean', 'imputation_order': 'descending'}. Best is trial 21 with value: 0.22709666808728138.
[I 2024-04-15 01:23:37,508] Trial 160 finished with value: 0.22822820015142353 and parameters: {'model_name': 'IterativeImputer', 'sample_posterior': False, 'initial_strategy': 'mean', 'imputation_order': 'descending'}. Best is trial 21 with value: 0.22709666808728138.
[I 2024-04-15 01:23:39,038] Trial 161 finished with value: 0.22822820015142353 and parameters: {'model_name': 'IterativeImputer', 'sample_posterior': False, 'initial_strategy': 'mean', 'imputation_order': 'descending'}. Best is trial 21 with value: 0.22709666808728138.
[I 2024-04-15 01:23:43,470] Trial 162 finished with value: 0.22822820015142353 and parameters: {'model_name': 'IterativeImputer', 'sample_posterior': False, 'initial_strategy': 'mean', 'imputation_order': 'descending'}. Best is trial 21 with value: 0.22709666808728138.
[I 2024-04-15 01:24:09,283] Trial 164 finished with value: 0.22822820015142353 and parameters: {'model_name': 'IterativeImputer', 'sample_posterior': False, 'initial_strategy': 'mean', 'imputation_order': 'descending'}. Best is trial 21 with value: 0.22709666808728138.
[I 2024-04-15 01:24:13,200] Trial 163 finished with value: 0.22822820015142353 and parameters: {'model_name': 'IterativeImputer', 'sample_posterior': False, 'initial_strategy': 'mean', 'imputation_order': 'descending'}. Best is trial 21 with value: 0.22709666808728138.
[I 2024-04-15 01:24:22,030] Trial 165 finished with value: 0.22822820015142353 and parameters: {'model_name': 'IterativeImputer', 'sample_posterior': False, 'initial_strategy': 'mean', 'imputation_order': 'descending'}. Best is trial 21 with value: 0.22709666808728138.
[I 2024-04-15 01:24:34,140] Trial 166 finished with value: 0.22822820015142353 and parameters: {'model_name': 'IterativeImputer', 'sample_posterior': False, 'initial_strategy': 'mean', 'imputation_order': 'descending'}. Best is trial 21 with value: 0.22709666808728138.
[I 2024-04-15 01:24:43,844] Trial 167 finished with value: 0.22822820015142353 and parameters: {'model_name': 'IterativeImputer', 'sample_posterior': False, 'initial_strategy': 'mean', 'imputation_order': 'descending'}. Best is trial 21 with value: 0.22709666808728138.
