[I 2023-12-26 22:11:02,384] Trial 173 finished with value: 0.23092759240829114 and parameters: {'model_name': 'IterativeImputer', 'sample_posterior': False, 'initial_strategy': 'constant', 'imputation_order': 'arabic'}. Best is trial 84 with value: 0.23092156937785976.
[I 2023-12-26 22:11:49,440] Trial 174 finished with value: 0.23092759240829114 and parameters: {'model_name': 'IterativeImputer', 'sample_posterior': False, 'initial_strategy': 'constant', 'imputation_order': 'arabic'}. Best is trial 84 with value: 0.23092156937785976.
[I 2023-12-26 22:12:01,977] Trial 176 finished with value: 0.23092759240829114 and parameters: {'model_name': 'IterativeImputer', 'sample_posterior': False, 'initial_strategy': 'constant', 'imputation_order': 'arabic'}. Best is trial 84 with value: 0.23092156937785976.
[I 2023-12-26 22:12:21,141] Trial 178 finished with value: 0.23092759240829114 and parameters: {'model_name': 'IterativeImputer', 'sample_posterior': False, 'initial_strategy': 'constant', 'imputation_order': 'arabic'}. Best is trial 84 with value: 0.23092156937785976.
[I 2023-12-26 22:15:01,933] Trial 185 finished with value: 0.23092759240829114 and parameters: {'model_name': 'IterativeImputer', 'sample_posterior': False, 'initial_strategy': 'constant', 'imputation_order': 'arabic'}. Best is trial 84 with value: 0.23092156937785976.
[I 2023-12-26 22:15:05,523] Trial 189 finished with value: 0.23092759240829114 and parameters: {'model_name': 'IterativeImputer', 'sample_posterior': False, 'initial_strategy': 'constant', 'imputation_order': 'arabic'}. Best is trial 84 with value: 0.23092156937785976.
[I 2023-12-26 22:15:07,406] Trial 188 finished with value: 0.23092759240829114 and parameters: {'model_name': 'IterativeImputer', 'sample_posterior': False, 'initial_strategy': 'constant', 'imputation_order': 'arabic'}. Best is trial 84 with value: 0.23092156937785976.
[I 2023-12-26 22:15:13,179] Trial 187 finished with value: 0.23093070154272638 and parameters: {'model_name': 'IterativeImputer', 'sample_posterior': False, 'initial_strategy': 'constant', 'imputation_order': 'random'}. Best is trial 84 with value: 0.23092156937785976.
[I 2023-12-26 22:15:29,326] Trial 190 finished with value: 0.23091953180910427 and parameters: {'model_name': 'IterativeImputer', 'sample_posterior': False, 'initial_strategy': 'constant', 'imputation_order': 'random'}. Best is trial 190 with value: 0.23091953180910427.
[I 2023-12-26 22:15:44,585] Trial 63 finished with value: 0.3677532867982986 and parameters: {'model_name': 'GAIN', 'batch_size': 15, 'hint_rate': 0.41000000000000003, 'alpha': 32, 'iterations': 1752}. Best is trial 190 with value: 0.23091953180910427.
[I 2023-12-26 22:16:13,658] Trial 197 finished with value: 0.23092575815211655 and parameters: {'model_name': 'IterativeImputer', 'sample_posterior': False, 'initial_strategy': 'constant', 'imputation_order': 'random'}. Best is trial 190 with value: 0.23091953180910427.
[I 2023-12-26 22:25:29,091] Trial 31 finished with value: 0.3290635780297416 and parameters: {'model_name': 'RandomForestImputer', 'max_iter': 49, 'decreasing': False, 'min_samples_split': 0.8, 'min_samples_leaf': 0.5, 'max_features': 0.7000000000000001, 'warm_start': False}. Best is trial 190 with value: 0.23091953180910427.
[I 2023-12-26 22:27:36,186] Trial 177 finished with value: inf and parameters: {'model_name': 'GAIN', 'batch_size': 942, 'hint_rate': 0.5, 'alpha': 0, 'iterations': 11787}. Best is trial 190 with value: 0.23091953180910427.
[I 2023-12-26 22:35:25,366] Trial 50 finished with value: 0.32765790528526745 and parameters: {'model_name': 'RandomForestImputer', 'max_iter': 67, 'decreasing': False, 'min_samples_split': 0.30000000000000004, 'min_samples_leaf': 0.2, 'max_features': 0.1, 'warm_start': False}. Best is trial 190 with value: 0.23091953180910427.
[I 2023-12-26 22:37:04,703] Trial 175 finished with value: inf and parameters: {'model_name': 'GAIN', 'batch_size': 970, 'hint_rate': 0.5, 'alpha': 5, 'iterations': 18958}. Best is trial 190 with value: 0.23091953180910427.
[I 2023-12-26 22:50:29,921] Trial 181 finished with value: inf and parameters: {'model_name': 'GAIN', 'batch_size': 643, 'hint_rate': 0.52, 'alpha': 99, 'iterations': 31101}. Best is trial 190 with value: 0.23091953180910427.
[I 2023-12-26 22:50:31,511] Trial 194 finished with value: 0.32906968105331147 and parameters: {'model_name': 'RandomForestImputer', 'max_iter': 57, 'decreasing': False, 'min_samples_split': 1.0, 'min_samples_leaf': 0.6, 'max_features': 0.1, 'warm_start': False}. Best is trial 190 with value: 0.23091953180910427.
[I 2023-12-26 22:50:36,198] Trial 182 finished with value: inf and parameters: {'model_name': 'GAIN', 'batch_size': 808, 'hint_rate': 0.5, 'alpha': 100, 'iterations': 29739}. Best is trial 190 with value: 0.23091953180910427.
[I 2023-12-26 22:54:12,869] Trial 198 finished with value: 0.32907640684706213 and parameters: {'model_name': 'RandomForestImputer', 'max_iter': 64, 'decreasing': False, 'min_samples_split': 1.0, 'min_samples_leaf': 0.6, 'max_features': 0.9, 'warm_start': False}. Best is trial 190 with value: 0.23091953180910427.
[I 2023-12-26 23:04:42,980] Trial 192 finished with value: 0.3290770987722696 and parameters: {'model_name': 'RandomForestImputer', 'max_iter': 87, 'decreasing': False, 'min_samples_split': 1.0, 'min_samples_leaf': 0.6, 'max_features': 0.8, 'warm_start': False}. Best is trial 190 with value: 0.23091953180910427.
[I 2023-12-26 23:05:43,098] Trial 186 finished with value: 0.3290736792911479 and parameters: {'model_name': 'RandomForestImputer', 'max_iter': 90, 'decreasing': False, 'min_samples_split': 1.0, 'min_samples_leaf': 0.6, 'max_features': 0.9, 'warm_start': False}. Best is trial 190 with value: 0.23091953180910427.
[I 2023-12-26 23:06:03,217] Trial 183 finished with value: inf and parameters: {'model_name': 'GAIN', 'batch_size': 959, 'hint_rate': 0.54, 'alpha': 7, 'iterations': 44384}. Best is trial 190 with value: 0.23091953180910427.
[I 2023-12-26 23:06:51,348] Trial 199 finished with value: 0.3290693160300155 and parameters: {'model_name': 'RandomForestImputer', 'max_iter': 79, 'decreasing': False, 'min_samples_split': 0.0, 'min_samples_leaf': 0.6, 'max_features': 0.9, 'warm_start': False}. Best is trial 190 with value: 0.23091953180910427.
[I 2023-12-26 23:06:55,922] Trial 195 finished with value: 0.32906848525676147 and parameters: {'model_name': 'RandomForestImputer', 'max_iter': 80, 'decreasing': False, 'min_samples_split': 1.0, 'min_samples_leaf': 0.6, 'max_features': 0.9, 'warm_start': False}. Best is trial 190 with value: 0.23091953180910427.
[I 2023-12-26 23:11:02,861] Trial 191 finished with value: 0.329073722092458 and parameters: {'model_name': 'RandomForestImputer', 'max_iter': 97, 'decreasing': False, 'min_samples_split': 1.0, 'min_samples_leaf': 0.6, 'max_features': 0.9, 'warm_start': False}. Best is trial 190 with value: 0.23091953180910427.
[I 2023-12-26 23:12:05,038] Trial 196 finished with value: 0.3290710258160049 and parameters: {'model_name': 'RandomForestImputer', 'max_iter': 99, 'decreasing': False, 'min_samples_split': 1.0, 'min_samples_leaf': 0.6, 'max_features': 0.9, 'warm_start': False}. Best is trial 190 with value: 0.23091953180910427.
[I 2023-12-26 23:12:15,044] Trial 33 finished with value: 0.3467887302984084 and parameters: {'model_name': 'GAIN', 'batch_size': 165, 'hint_rate': 0.6900000000000001, 'alpha': 43, 'iterations': 8507}. Best is trial 190 with value: 0.23091953180910427.
[I 2023-12-26 23:14:17,778] Trial 8 finished with value: 0.3630282818187488 and parameters: {'model_name': 'GAIN', 'batch_size': 10, 'hint_rate': 0.060000000000000005, 'alpha': 25, 'iterations': 11798}. Best is trial 190 with value: 0.23091953180910427.
[I 2023-12-26 23:15:17,022] Trial 179 finished with value: inf and parameters: {'model_name': 'GAIN', 'batch_size': 979, 'hint_rate': 0.51, 'alpha': 100, 'iterations': 63394}. Best is trial 190 with value: 0.23091953180910427.
[I 2023-12-26 23:16:55,278] Trial 180 finished with value: inf and parameters: {'model_name': 'GAIN', 'batch_size': 650, 'hint_rate': 0.54, 'alpha': 2, 'iterations': 78044}. Best is trial 190 with value: 0.23091953180910427.
[I 2023-12-26 23:17:21,542] Trial 193 finished with value: inf and parameters: {'model_name': 'GAIN', 'batch_size': 926, 'hint_rate': 0.47000000000000003, 'alpha': 100, 'iterations': 71061}. Best is trial 190 with value: 0.23091953180910427.
[I 2023-12-26 23:20:03,507] Trial 23 finished with value: inf and parameters: {'model_name': 'GAIN', 'batch_size': 87, 'hint_rate': 0.85, 'alpha': 34, 'iterations': 18973}. Best is trial 190 with value: 0.23091953180910427.
[I 2023-12-26 23:23:58,635] Trial 64 finished with value: 0.36553349346572517 and parameters: {'model_name': 'GAIN', 'batch_size': 1, 'hint_rate': 0.89, 'alpha': 99, 'iterations': 31513}. Best is trial 190 with value: 0.23091953180910427.
