[I 2024-03-01 10:59:44,982] Trial 183 finished with value: 3.0798375684721297 and parameters: {'model_name': 'GAIN', 'batch_size': 543, 'hint_rate': 0.44, 'alpha': 34, 'iterations': 12}. Best is trial 186 with value: 2.1104248027758565.
[I 2024-03-01 10:59:50,295] Trial 149 finished with value: 5.99597173168537 and parameters: {'model_name': 'IterativeImputer', 'sample_posterior': True, 'initial_strategy': 'constant', 'imputation_order': 'descending'}. Best is trial 186 with value: 2.1104248027758565.
[I 2024-03-01 10:59:55,105] Trial 148 finished with value: 6.0889092878604325 and parameters: {'model_name': 'IterativeImputer', 'sample_posterior': True, 'initial_strategy': 'constant', 'imputation_order': 'descending'}. Best is trial 186 with value: 2.1104248027758565.
[I 2024-03-01 11:00:09,555] Trial 197 finished with value: 2.6484174011704846 and parameters: {'model_name': 'GAIN', 'batch_size': 701, 'hint_rate': 0.63, 'alpha': 28, 'iterations': 19}. Best is trial 186 with value: 2.1104248027758565.
[I 2024-03-01 11:00:11,595] Trial 196 finished with value: 2.942383510932838 and parameters: {'model_name': 'GAIN', 'batch_size': 736, 'hint_rate': 0.5, 'alpha': 29, 'iterations': 6}. Best is trial 186 with value: 2.1104248027758565.
[I 2024-03-01 11:00:12,653] Trial 195 finished with value: 2.3129667641326828 and parameters: {'model_name': 'GAIN', 'batch_size': 682, 'hint_rate': 0.63, 'alpha': 28, 'iterations': 4}. Best is trial 186 with value: 2.1104248027758565.
[I 2024-03-01 11:00:28,172] Trial 150 finished with value: 5.819888372593503 and parameters: {'model_name': 'IterativeImputer', 'sample_posterior': True, 'initial_strategy': 'constant', 'imputation_order': 'descending'}. Best is trial 186 with value: 2.1104248027758565.
[I 2024-03-01 11:00:32,524] Trial 152 finished with value: 5.393230767735226 and parameters: {'model_name': 'IterativeImputer', 'sample_posterior': True, 'initial_strategy': 'constant', 'imputation_order': 'arabic'}. Best is trial 186 with value: 2.1104248027758565.
[I 2024-03-01 11:00:33,914] Trial 151 finished with value: 6.381952152787411 and parameters: {'model_name': 'IterativeImputer', 'sample_posterior': True, 'initial_strategy': 'constant', 'imputation_order': 'arabic'}. Best is trial 186 with value: 2.1104248027758565.
[I 2024-03-01 11:00:37,368] Trial 153 finished with value: 5.927056261544965 and parameters: {'model_name': 'IterativeImputer', 'sample_posterior': True, 'initial_strategy': 'constant', 'imputation_order': 'random'}. Best is trial 186 with value: 2.1104248027758565.
[I 2024-03-01 11:00:40,305] Trial 96 finished with value: 5.304996522488649 and parameters: {'model_name': 'GAIN', 'batch_size': 31, 'hint_rate': 0.6, 'alpha': 8, 'iterations': 471}. Best is trial 186 with value: 2.1104248027758565.
[I 2024-03-01 11:01:38,272] Trial 16 finished with value: 5.548086733598751 and parameters: {'model_name': 'RandomForestImputer', 'max_iter': 49, 'decreasing': True, 'min_samples_split': 0.0, 'min_samples_leaf': 0.30000000000000004, 'max_features': 0.9, 'warm_start': False}. Best is trial 186 with value: 2.1104248027758565.
[I 2024-03-01 11:01:40,799] Trial 2 finished with value: 5.509730922915457 and parameters: {'model_name': 'GAIN', 'batch_size': 1, 'hint_rate': 0.45, 'alpha': 87, 'iterations': 850}. Best is trial 186 with value: 2.1104248027758565.
[I 2024-03-01 11:02:58,264] Trial 41 finished with value: 5.590958875871934 and parameters: {'model_name': 'GAIN', 'batch_size': 390, 'hint_rate': 0.28, 'alpha': 48, 'iterations': 969}. Best is trial 186 with value: 2.1104248027758565.
[I 2024-03-01 11:03:02,863] Trial 28 finished with value: 5.550123962294343 and parameters: {'model_name': 'RandomForestImputer', 'max_iter': 69, 'decreasing': True, 'min_samples_split': 0.2, 'min_samples_leaf': 0.6, 'max_features': 0.1, 'warm_start': False}. Best is trial 186 with value: 2.1104248027758565.
[I 2024-03-01 11:03:37,959] Trial 66 finished with value: inf and parameters: {'model_name': 'GAIN', 'batch_size': 583, 'hint_rate': 0.81, 'alpha': 31, 'iterations': 11540}. Best is trial 186 with value: 2.1104248027758565.
[I 2024-03-01 11:04:02,431] Trial 52 finished with value: 5.384659950544156 and parameters: {'model_name': 'GAIN', 'batch_size': 2, 'hint_rate': 0.63, 'alpha': 22, 'iterations': 1766}. Best is trial 186 with value: 2.1104248027758565.
[I 2024-03-01 11:04:21,496] Trial 77 finished with value: inf and parameters: {'model_name': 'GAIN', 'batch_size': 64, 'hint_rate': 0.73, 'alpha': 48, 'iterations': 8204}. Best is trial 186 with value: 2.1104248027758565.
[I 2024-03-01 11:05:32,481] Trial 71 finished with value: inf and parameters: {'model_name': 'GAIN', 'batch_size': 152, 'hint_rate': 0.36000000000000004, 'alpha': 96, 'iterations': 21724}. Best is trial 186 with value: 2.1104248027758565.
[I 2024-03-01 11:05:55,091] Trial 97 finished with value: 5.788668023673115 and parameters: {'model_name': 'GAIN', 'batch_size': 29, 'hint_rate': 0.6, 'alpha': 11, 'iterations': 2654}. Best is trial 186 with value: 2.1104248027758565.
[I 2024-03-01 11:06:29,936] Trial 74 finished with value: inf and parameters: {'model_name': 'GAIN', 'batch_size': 7, 'hint_rate': 0.23, 'alpha': 10, 'iterations': 35176}. Best is trial 186 with value: 2.1104248027758565.
[I 2024-03-01 11:06:52,629] Trial 33 finished with value: inf and parameters: {'model_name': 'GAIN', 'batch_size': 86, 'hint_rate': 0.8400000000000001, 'alpha': 23, 'iterations': 32626}. Best is trial 186 with value: 2.1104248027758565.
[I 2024-03-01 11:07:14,759] Trial 65 finished with value: 5.95121866490991 and parameters: {'model_name': 'GAIN', 'batch_size': 187, 'hint_rate': 0.19, 'alpha': 78, 'iterations': 3449}. Best is trial 186 with value: 2.1104248027758565.
[I 2024-03-01 11:07:16,601] Trial 73 finished with value: inf and parameters: {'model_name': 'GAIN', 'batch_size': 42, 'hint_rate': 0.6, 'alpha': 8, 'iterations': 10422}. Best is trial 186 with value: 2.1104248027758565.
[I 2024-03-01 11:10:26,944] Trial 30 finished with value: inf and parameters: {'model_name': 'GAIN', 'batch_size': 639, 'hint_rate': 0.8, 'alpha': 16, 'iterations': 93823}. Best is trial 186 with value: 2.1104248027758565.
