[I 2024-02-29 17:28:40,764] Trial 165 finished with value: inf and parameters: {'model_name': 'GAIN', 'batch_size': 842, 'hint_rate': 0.01, 'alpha': 97, 'iterations': 81625}. Best is trial 7 with value: 6.105847551979725.
[I 2024-02-29 17:28:56,414] Trial 182 finished with value: inf and parameters: {'model_name': 'GAIN', 'batch_size': 679, 'hint_rate': 0.06999999999999999, 'alpha': 100, 'iterations': 82032}. Best is trial 7 with value: 6.105847551979725.
[I 2024-02-29 17:29:18,708] Trial 184 finished with value: inf and parameters: {'model_name': 'GAIN', 'batch_size': 620, 'hint_rate': 0.01, 'alpha': 97, 'iterations': 78572}. Best is trial 7 with value: 6.105847551979725.
[I 2024-02-29 17:29:40,656] Trial 151 finished with value: inf and parameters: {'model_name': 'GAIN', 'batch_size': 437, 'hint_rate': 0.02, 'alpha': 98, 'iterations': 86579}. Best is trial 7 with value: 6.105847551979725.
[I 2024-02-29 17:29:55,605] Trial 156 finished with value: inf and parameters: {'model_name': 'GAIN', 'batch_size': 807, 'hint_rate': 0.05, 'alpha': 95, 'iterations': 84230}. Best is trial 7 with value: 6.105847551979725.
[I 2024-02-29 17:30:41,887] Trial 173 finished with value: inf and parameters: {'model_name': 'GAIN', 'batch_size': 954, 'hint_rate': 0.06999999999999999, 'alpha': 99, 'iterations': 85403}. Best is trial 7 with value: 6.105847551979725.
[I 2024-02-29 17:30:58,184] Trial 163 finished with value: inf and parameters: {'model_name': 'GAIN', 'batch_size': 683, 'hint_rate': 0.01, 'alpha': 98, 'iterations': 88024}. Best is trial 7 with value: 6.105847551979725.
[I 2024-02-29 17:31:07,352] Trial 137 finished with value: inf and parameters: {'model_name': 'GAIN', 'batch_size': 547, 'hint_rate': 0.05, 'alpha': 98, 'iterations': 91255}. Best is trial 7 with value: 6.105847551979725.
[I 2024-02-29 17:31:17,969] Trial 166 finished with value: inf and parameters: {'model_name': 'GAIN', 'batch_size': 824, 'hint_rate': 0.03, 'alpha': 97, 'iterations': 88181}. Best is trial 7 with value: 6.105847551979725.
[I 2024-02-29 17:31:19,509] Trial 135 finished with value: inf and parameters: {'model_name': 'GAIN', 'batch_size': 464, 'hint_rate': 0.04, 'alpha': 97, 'iterations': 93037}. Best is trial 7 with value: 6.105847551979725.
[I 2024-02-29 17:32:19,470] Trial 145 finished with value: inf and parameters: {'model_name': 'GAIN', 'batch_size': 715, 'hint_rate': 0.02, 'alpha': 37, 'iterations': 95438}. Best is trial 7 with value: 6.105847551979725.
[I 2024-02-29 17:32:45,892] Trial 64 finished with value: inf and parameters: {'model_name': 'GAIN', 'batch_size': 94, 'hint_rate': 0.55, 'alpha': 48, 'iterations': 20925}. Best is trial 7 with value: 6.105847551979725.
[I 2024-02-29 17:32:53,197] Trial 186 finished with value: inf and parameters: {'model_name': 'GAIN', 'batch_size': 823, 'hint_rate': 0.02, 'alpha': 99, 'iterations': 89373}. Best is trial 7 with value: 6.105847551979725.
[I 2024-02-29 17:32:56,160] Trial 161 finished with value: inf and parameters: {'model_name': 'GAIN', 'batch_size': 878, 'hint_rate': 0.060000000000000005, 'alpha': 100, 'iterations': 98211}. Best is trial 7 with value: 6.105847551979725.
