[I 2024-01-16 01:48:16,069] Trial 83 finished with value: 0.497699821965148 and parameters: {'model_name': 'SimpleImputer', 'strategy': 'most_frequent'}. Best is trial 1 with value: 0.3886297388727028.
[I 2024-01-16 01:48:16,468] Trial 111 finished with value: 0.3886297388727028 and parameters: {'model_name': 'SimpleImputer', 'strategy': 'mean'}. Best is trial 1 with value: 0.3886297388727028.
[I 2024-01-16 01:48:16,711] Trial 115 finished with value: 0.3886297388727028 and parameters: {'model_name': 'SimpleImputer', 'strategy': 'mean'}. Best is trial 1 with value: 0.3886297388727028.
[I 2024-01-16 01:48:16,949] Trial 112 finished with value: 0.3886297388727028 and parameters: {'model_name': 'SimpleImputer', 'strategy': 'mean'}. Best is trial 1 with value: 0.3886297388727028.
[I 2024-01-16 01:48:17,184] Trial 117 finished with value: 0.3886297388727028 and parameters: {'model_name': 'SimpleImputer', 'strategy': 'mean'}. Best is trial 1 with value: 0.3886297388727028.
[I 2024-01-16 01:48:17,418] Trial 85 finished with value: 0.497699821965148 and parameters: {'model_name': 'SimpleImputer', 'strategy': 'most_frequent'}. Best is trial 1 with value: 0.3886297388727028.
[I 2024-01-16 01:48:17,672] Trial 121 finished with value: 0.3886297388727028 and parameters: {'model_name': 'SimpleImputer', 'strategy': 'mean'}. Best is trial 1 with value: 0.3886297388727028.
[I 2024-01-16 01:48:17,961] Trial 116 finished with value: 0.3886297388727028 and parameters: {'model_name': 'SimpleImputer', 'strategy': 'mean'}. Best is trial 1 with value: 0.3886297388727028.
[I 2024-01-16 01:48:18,256] Trial 113 finished with value: 0.3886297388727028 and parameters: {'model_name': 'SimpleImputer', 'strategy': 'mean'}. Best is trial 1 with value: 0.3886297388727028.
[I 2024-01-16 01:48:18,696] Trial 81 finished with value: 0.497699821965148 and parameters: {'model_name': 'SimpleImputer', 'strategy': 'most_frequent'}. Best is trial 1 with value: 0.3886297388727028.
[I 2024-01-16 01:48:18,938] Trial 114 finished with value: 0.3886297388727028 and parameters: {'model_name': 'SimpleImputer', 'strategy': 'mean'}. Best is trial 1 with value: 0.3886297388727028.
[I 2024-01-16 01:48:19,135] Trial 120 finished with value: 0.3886297388727028 and parameters: {'model_name': 'SimpleImputer', 'strategy': 'mean'}. Best is trial 1 with value: 0.3886297388727028.
[I 2024-01-16 01:48:19,367] Trial 125 finished with value: 0.3886297388727028 and parameters: {'model_name': 'SimpleImputer', 'strategy': 'mean'}. Best is trial 1 with value: 0.3886297388727028.
[I 2024-01-16 01:48:19,582] Trial 124 finished with value: 0.3886297388727028 and parameters: {'model_name': 'SimpleImputer', 'strategy': 'mean'}. Best is trial 1 with value: 0.3886297388727028.
[I 2024-01-16 01:48:19,797] Trial 118 finished with value: 0.3886297388727028 and parameters: {'model_name': 'SimpleImputer', 'strategy': 'mean'}. Best is trial 1 with value: 0.3886297388727028.
[I 2024-01-16 01:48:20,028] Trial 123 finished with value: 0.3886297388727028 and parameters: {'model_name': 'SimpleImputer', 'strategy': 'mean'}. Best is trial 1 with value: 0.3886297388727028.
[I 2024-01-16 01:48:20,282] Trial 122 finished with value: 0.3886297388727028 and parameters: {'model_name': 'SimpleImputer', 'strategy': 'mean'}. Best is trial 1 with value: 0.3886297388727028.
[I 2024-01-16 01:48:20,588] Trial 75 finished with value: 0.497699821965148 and parameters: {'model_name': 'SimpleImputer', 'strategy': 'most_frequent'}. Best is trial 1 with value: 0.3886297388727028.
[I 2024-01-16 01:48:21,027] Trial 119 finished with value: 0.3886297388727028 and parameters: {'model_name': 'SimpleImputer', 'strategy': 'mean'}. Best is trial 1 with value: 0.3886297388727028.
[I 2024-01-16 01:48:21,301] Trial 131 finished with value: 0.3886297388727028 and parameters: {'model_name': 'SimpleImputer', 'strategy': 'mean'}. Best is trial 1 with value: 0.3886297388727028.
[I 2024-01-16 01:48:21,525] Trial 127 finished with value: 0.3886297388727028 and parameters: {'model_name': 'SimpleImputer', 'strategy': 'mean'}. Best is trial 1 with value: 0.3886297388727028.
[I 2024-01-16 01:48:21,749] Trial 126 finished with value: 0.3886297388727028 and parameters: {'model_name': 'SimpleImputer', 'strategy': 'mean'}. Best is trial 1 with value: 0.3886297388727028.
[I 2024-01-16 01:48:21,962] Trial 128 finished with value: 0.3886297388727028 and parameters: {'model_name': 'SimpleImputer', 'strategy': 'mean'}. Best is trial 1 with value: 0.3886297388727028.
[I 2024-01-16 01:48:22,155] Trial 78 finished with value: 0.497699821965148 and parameters: {'model_name': 'SimpleImputer', 'strategy': 'most_frequent'}. Best is trial 1 with value: 0.3886297388727028.
[I 2024-01-16 01:48:22,378] Trial 134 finished with value: 0.3886297388727028 and parameters: {'model_name': 'SimpleImputer', 'strategy': 'mean'}. Best is trial 1 with value: 0.3886297388727028.
[I 2024-01-16 01:48:22,689] Trial 135 finished with value: 0.3886297388727028 and parameters: {'model_name': 'SimpleImputer', 'strategy': 'mean'}. Best is trial 1 with value: 0.3886297388727028.
[I 2024-01-16 01:48:22,954] Trial 132 finished with value: 0.3886297388727028 and parameters: {'model_name': 'SimpleImputer', 'strategy': 'mean'}. Best is trial 1 with value: 0.3886297388727028.
[I 2024-01-16 01:48:23,211] Trial 79 finished with value: 0.497699821965148 and parameters: {'model_name': 'SimpleImputer', 'strategy': 'most_frequent'}. Best is trial 1 with value: 0.3886297388727028.
[I 2024-01-16 01:48:23,496] Trial 133 finished with value: 0.3886297388727028 and parameters: {'model_name': 'SimpleImputer', 'strategy': 'mean'}. Best is trial 1 with value: 0.3886297388727028.
[I 2024-01-16 01:48:23,758] Trial 130 finished with value: 0.3886297388727028 and parameters: {'model_name': 'SimpleImputer', 'strategy': 'mean'}. Best is trial 1 with value: 0.3886297388727028.
[I 2024-01-16 01:48:24,026] Trial 93 finished with value: 0.497699821965148 and parameters: {'model_name': 'SimpleImputer', 'strategy': 'most_frequent'}. Best is trial 1 with value: 0.3886297388727028.
[I 2024-01-16 01:48:24,256] Trial 137 finished with value: 0.3886297388727028 and parameters: {'model_name': 'SimpleImputer', 'strategy': 'mean'}. Best is trial 1 with value: 0.3886297388727028.
[I 2024-01-16 01:48:24,623] Trial 141 finished with value: 0.3886297388727028 and parameters: {'model_name': 'SimpleImputer', 'strategy': 'mean'}. Best is trial 1 with value: 0.3886297388727028.
[I 2024-01-16 01:48:24,844] Trial 129 finished with value: 0.3886297388727028 and parameters: {'model_name': 'SimpleImputer', 'strategy': 'mean'}. Best is trial 1 with value: 0.3886297388727028.
[I 2024-01-16 01:48:25,072] Trial 86 finished with value: 0.497699821965148 and parameters: {'model_name': 'SimpleImputer', 'strategy': 'most_frequent'}. Best is trial 1 with value: 0.3886297388727028.
[I 2024-01-16 01:48:25,345] Trial 140 finished with value: 0.3886297388727028 and parameters: {'model_name': 'SimpleImputer', 'strategy': 'mean'}. Best is trial 1 with value: 0.3886297388727028.
[I 2024-01-16 01:48:25,542] Trial 143 finished with value: 0.3886297388727028 and parameters: {'model_name': 'SimpleImputer', 'strategy': 'mean'}. Best is trial 1 with value: 0.3886297388727028.
[I 2024-01-16 01:48:25,752] Trial 139 finished with value: 0.3886297388727028 and parameters: {'model_name': 'SimpleImputer', 'strategy': 'mean'}. Best is trial 1 with value: 0.3886297388727028.
[I 2024-01-16 01:48:26,124] Trial 136 finished with value: 0.3886297388727028 and parameters: {'model_name': 'SimpleImputer', 'strategy': 'mean'}. Best is trial 1 with value: 0.3886297388727028.
[I 2024-01-16 01:48:26,379] Trial 146 finished with value: 0.3886297388727028 and parameters: {'model_name': 'SimpleImputer', 'strategy': 'mean'}. Best is trial 1 with value: 0.3886297388727028.
[I 2024-01-16 01:48:26,637] Trial 91 finished with value: 0.497699821965148 and parameters: {'model_name': 'SimpleImputer', 'strategy': 'most_frequent'}. Best is trial 1 with value: 0.3886297388727028.
[I 2024-01-16 01:48:26,891] Trial 142 finished with value: 0.3886297388727028 and parameters: {'model_name': 'SimpleImputer', 'strategy': 'mean'}. Best is trial 1 with value: 0.3886297388727028.
[I 2024-01-16 01:48:27,220] Trial 87 finished with value: 0.497699821965148 and parameters: {'model_name': 'SimpleImputer', 'strategy': 'most_frequent'}. Best is trial 1 with value: 0.3886297388727028.
[I 2024-01-16 01:48:27,481] Trial 145 finished with value: 0.3886297388727028 and parameters: {'model_name': 'SimpleImputer', 'strategy': 'mean'}. Best is trial 1 with value: 0.3886297388727028.
[I 2024-01-16 01:48:27,891] Trial 144 finished with value: 0.3886297388727028 and parameters: {'model_name': 'SimpleImputer', 'strategy': 'mean'}. Best is trial 1 with value: 0.3886297388727028.
[I 2024-01-16 01:48:28,136] Trial 138 finished with value: 0.3886297388727028 and parameters: {'model_name': 'SimpleImputer', 'strategy': 'mean'}. Best is trial 1 with value: 0.3886297388727028.
[I 2024-01-16 01:48:28,365] Trial 90 finished with value: 0.497699821965148 and parameters: {'model_name': 'SimpleImputer', 'strategy': 'most_frequent'}. Best is trial 1 with value: 0.3886297388727028.
[I 2024-01-16 01:48:28,541] Trial 148 finished with value: 0.3886297388727028 and parameters: {'model_name': 'SimpleImputer', 'strategy': 'mean'}. Best is trial 1 with value: 0.3886297388727028.
[I 2024-01-16 01:48:28,793] Trial 89 finished with value: 0.497699821965148 and parameters: {'model_name': 'SimpleImputer', 'strategy': 'most_frequent'}. Best is trial 1 with value: 0.3886297388727028.
[I 2024-01-16 01:48:28,962] Trial 152 finished with value: 0.3886297388727028 and parameters: {'model_name': 'SimpleImputer', 'strategy': 'mean'}. Best is trial 1 with value: 0.3886297388727028.
[I 2024-01-16 01:48:29,164] Trial 147 finished with value: 0.3886297388727028 and parameters: {'model_name': 'SimpleImputer', 'strategy': 'mean'}. Best is trial 1 with value: 0.3886297388727028.
[I 2024-01-16 01:48:29,638] Trial 150 finished with value: 0.3886297388727028 and parameters: {'model_name': 'SimpleImputer', 'strategy': 'mean'}. Best is trial 1 with value: 0.3886297388727028.
[I 2024-01-16 01:48:29,833] Trial 154 finished with value: 0.3886297388727028 and parameters: {'model_name': 'SimpleImputer', 'strategy': 'mean'}. Best is trial 1 with value: 0.3886297388727028.
[I 2024-01-16 01:48:30,101] Trial 149 finished with value: 0.3886297388727028 and parameters: {'model_name': 'SimpleImputer', 'strategy': 'mean'}. Best is trial 1 with value: 0.3886297388727028.
[I 2024-01-16 01:48:30,358] Trial 155 finished with value: 0.3886297388727028 and parameters: {'model_name': 'SimpleImputer', 'strategy': 'mean'}. Best is trial 1 with value: 0.3886297388727028.
[I 2024-01-16 01:48:30,645] Trial 163 finished with value: 0.3886297388727028 and parameters: {'model_name': 'SimpleImputer', 'strategy': 'mean'}. Best is trial 1 with value: 0.3886297388727028.
[I 2024-01-16 01:48:30,813] Trial 151 finished with value: 0.3886297388727028 and parameters: {'model_name': 'SimpleImputer', 'strategy': 'mean'}. Best is trial 1 with value: 0.3886297388727028.
[I 2024-01-16 01:48:31,129] Trial 157 finished with value: 0.3886297388727028 and parameters: {'model_name': 'SimpleImputer', 'strategy': 'mean'}. Best is trial 1 with value: 0.3886297388727028.
[I 2024-01-16 01:48:31,380] Trial 153 finished with value: 0.3886297388727028 and parameters: {'model_name': 'SimpleImputer', 'strategy': 'mean'}. Best is trial 1 with value: 0.3886297388727028.
[I 2024-01-16 01:48:31,599] Trial 156 finished with value: 0.3886297388727028 and parameters: {'model_name': 'SimpleImputer', 'strategy': 'mean'}. Best is trial 1 with value: 0.3886297388727028.
[I 2024-01-16 01:48:31,878] Trial 158 finished with value: 0.3886297388727028 and parameters: {'model_name': 'SimpleImputer', 'strategy': 'mean'}. Best is trial 1 with value: 0.3886297388727028.
[I 2024-01-16 01:48:32,070] Trial 162 finished with value: 0.3886297388727028 and parameters: {'model_name': 'SimpleImputer', 'strategy': 'mean'}. Best is trial 1 with value: 0.3886297388727028.
[I 2024-01-16 01:48:32,337] Trial 159 finished with value: 0.3886297388727028 and parameters: {'model_name': 'SimpleImputer', 'strategy': 'mean'}. Best is trial 1 with value: 0.3886297388727028.
[I 2024-01-16 01:48:32,617] Trial 171 finished with value: 0.3886297388727028 and parameters: {'model_name': 'SimpleImputer', 'strategy': 'mean'}. Best is trial 1 with value: 0.3886297388727028.
[I 2024-01-16 01:48:32,887] Trial 160 finished with value: 0.3886297388727028 and parameters: {'model_name': 'SimpleImputer', 'strategy': 'mean'}. Best is trial 1 with value: 0.3886297388727028.
[I 2024-01-16 01:48:33,218] Trial 164 finished with value: 0.3886297388727028 and parameters: {'model_name': 'SimpleImputer', 'strategy': 'mean'}. Best is trial 1 with value: 0.3886297388727028.
[I 2024-01-16 01:48:33,477] Trial 174 finished with value: 0.3886297388727028 and parameters: {'model_name': 'SimpleImputer', 'strategy': 'mean'}. Best is trial 1 with value: 0.3886297388727028.
[I 2024-01-16 01:48:33,739] Trial 92 finished with value: 0.497699821965148 and parameters: {'model_name': 'SimpleImputer', 'strategy': 'most_frequent'}. Best is trial 1 with value: 0.3886297388727028.
[I 2024-01-16 01:48:33,982] Trial 170 finished with value: 0.3886297388727028 and parameters: {'model_name': 'SimpleImputer', 'strategy': 'mean'}. Best is trial 1 with value: 0.3886297388727028.
[I 2024-01-16 01:48:34,159] Trial 169 finished with value: 0.3886297388727028 and parameters: {'model_name': 'SimpleImputer', 'strategy': 'mean'}. Best is trial 1 with value: 0.3886297388727028.
[I 2024-01-16 01:48:34,404] Trial 175 finished with value: 0.3886297388727028 and parameters: {'model_name': 'SimpleImputer', 'strategy': 'mean'}. Best is trial 1 with value: 0.3886297388727028.
[I 2024-01-16 01:48:34,670] Trial 173 finished with value: 0.3886297388727028 and parameters: {'model_name': 'SimpleImputer', 'strategy': 'mean'}. Best is trial 1 with value: 0.3886297388727028.
[I 2024-01-16 01:48:34,851] Trial 161 finished with value: 0.3886297388727028 and parameters: {'model_name': 'SimpleImputer', 'strategy': 'mean'}. Best is trial 1 with value: 0.3886297388727028.
[I 2024-01-16 01:48:35,095] Trial 165 finished with value: 0.3886297388727028 and parameters: {'model_name': 'SimpleImputer', 'strategy': 'mean'}. Best is trial 1 with value: 0.3886297388727028.
[I 2024-01-16 01:48:35,405] Trial 172 finished with value: 0.3886297388727028 and parameters: {'model_name': 'SimpleImputer', 'strategy': 'mean'}. Best is trial 1 with value: 0.3886297388727028.
[I 2024-01-16 01:48:35,585] Trial 168 finished with value: 0.3886297388727028 and parameters: {'model_name': 'SimpleImputer', 'strategy': 'mean'}. Best is trial 1 with value: 0.3886297388727028.
[I 2024-01-16 01:48:35,907] Trial 186 finished with value: 0.3886297388727028 and parameters: {'model_name': 'SimpleImputer', 'strategy': 'mean'}. Best is trial 1 with value: 0.3886297388727028.
[I 2024-01-16 01:48:36,220] Trial 177 finished with value: 0.3886297388727028 and parameters: {'model_name': 'SimpleImputer', 'strategy': 'mean'}. Best is trial 1 with value: 0.3886297388727028.
[I 2024-01-16 01:48:36,486] Trial 185 finished with value: 0.3886297388727028 and parameters: {'model_name': 'SimpleImputer', 'strategy': 'mean'}. Best is trial 1 with value: 0.3886297388727028.
[I 2024-01-16 01:48:36,668] Trial 187 finished with value: 0.3886297388727028 and parameters: {'model_name': 'SimpleImputer', 'strategy': 'mean'}. Best is trial 1 with value: 0.3886297388727028.
[I 2024-01-16 01:48:36,907] Trial 166 finished with value: 0.3886297388727028 and parameters: {'model_name': 'SimpleImputer', 'strategy': 'mean'}. Best is trial 1 with value: 0.3886297388727028.
[I 2024-01-16 01:48:37,086] Trial 182 finished with value: 0.3886297388727028 and parameters: {'model_name': 'SimpleImputer', 'strategy': 'mean'}. Best is trial 1 with value: 0.3886297388727028.
[I 2024-01-16 01:48:37,332] Trial 178 finished with value: 0.3886297388727028 and parameters: {'model_name': 'SimpleImputer', 'strategy': 'mean'}. Best is trial 1 with value: 0.3886297388727028.
[I 2024-01-16 01:48:37,526] Trial 179 finished with value: 0.3886297388727028 and parameters: {'model_name': 'SimpleImputer', 'strategy': 'mean'}. Best is trial 1 with value: 0.3886297388727028.
[I 2024-01-16 01:48:37,689] Trial 184 finished with value: 0.3886297388727028 and parameters: {'model_name': 'SimpleImputer', 'strategy': 'mean'}. Best is trial 1 with value: 0.3886297388727028.
[I 2024-01-16 01:48:37,931] Trial 176 finished with value: 0.3886297388727028 and parameters: {'model_name': 'SimpleImputer', 'strategy': 'mean'}. Best is trial 1 with value: 0.3886297388727028.
[I 2024-01-16 01:48:38,100] Trial 167 finished with value: 0.3886297388727028 and parameters: {'model_name': 'SimpleImputer', 'strategy': 'mean'}. Best is trial 1 with value: 0.3886297388727028.
[I 2024-01-16 01:48:38,376] Trial 180 finished with value: 0.3886297388727028 and parameters: {'model_name': 'SimpleImputer', 'strategy': 'mean'}. Best is trial 1 with value: 0.3886297388727028.
[I 2024-01-16 01:48:38,620] Trial 183 finished with value: 0.3886297388727028 and parameters: {'model_name': 'SimpleImputer', 'strategy': 'mean'}. Best is trial 1 with value: 0.3886297388727028.
[I 2024-01-16 01:48:38,837] Trial 181 finished with value: 0.3886297388727028 and parameters: {'model_name': 'SimpleImputer', 'strategy': 'mean'}. Best is trial 1 with value: 0.3886297388727028.
[I 2024-01-16 01:48:39,023] Trial 195 finished with value: 0.3886297388727028 and parameters: {'model_name': 'SimpleImputer', 'strategy': 'mean'}. Best is trial 1 with value: 0.3886297388727028.
[I 2024-01-16 01:48:39,261] Trial 199 finished with value: 0.3886297388727028 and parameters: {'model_name': 'SimpleImputer', 'strategy': 'mean'}. Best is trial 1 with value: 0.3886297388727028.
[I 2024-01-16 01:48:39,446] Trial 192 finished with value: 0.3886297388727028 and parameters: {'model_name': 'SimpleImputer', 'strategy': 'mean'}. Best is trial 1 with value: 0.3886297388727028.
[I 2024-01-16 01:48:39,692] Trial 190 finished with value: 0.3886297388727028 and parameters: {'model_name': 'SimpleImputer', 'strategy': 'mean'}. Best is trial 1 with value: 0.3886297388727028.
[I 2024-01-16 01:48:39,871] Trial 188 finished with value: 0.3886297388727028 and parameters: {'model_name': 'SimpleImputer', 'strategy': 'mean'}. Best is trial 1 with value: 0.3886297388727028.
[I 2024-01-16 01:48:40,030] Trial 194 finished with value: 0.3886297388727028 and parameters: {'model_name': 'SimpleImputer', 'strategy': 'mean'}. Best is trial 1 with value: 0.3886297388727028.
[I 2024-01-16 01:48:40,194] Trial 189 finished with value: 0.3886297388727028 and parameters: {'model_name': 'SimpleImputer', 'strategy': 'mean'}. Best is trial 1 with value: 0.3886297388727028.
[I 2024-01-16 01:48:40,352] Trial 196 finished with value: 0.3886297388727028 and parameters: {'model_name': 'SimpleImputer', 'strategy': 'mean'}. Best is trial 1 with value: 0.3886297388727028.
[I 2024-01-16 01:48:40,593] Trial 198 finished with value: 0.3886297388727028 and parameters: {'model_name': 'SimpleImputer', 'strategy': 'mean'}. Best is trial 1 with value: 0.3886297388727028.
[I 2024-01-16 01:48:40,766] Trial 197 finished with value: 0.3886297388727028 and parameters: {'model_name': 'SimpleImputer', 'strategy': 'mean'}. Best is trial 1 with value: 0.3886297388727028.
[I 2024-01-16 01:48:40,999] Trial 191 finished with value: 0.3886297388727028 and parameters: {'model_name': 'SimpleImputer', 'strategy': 'mean'}. Best is trial 1 with value: 0.3886297388727028.
