[I 2024-04-23 02:37:06,416] Trial 176 finished with value: 662.1924921335827 and parameters: {'model_name': 'IterativeImputer', 'sample_posterior': False, 'initial_strategy': 'mean', 'imputation_order': 'random'}. Best is trial 142 with value: 662.1879915826296.
[I 2024-04-23 02:37:08,721] Trial 187 finished with value: 662.1890388605069 and parameters: {'model_name': 'IterativeImputer', 'sample_posterior': False, 'initial_strategy': 'mean', 'imputation_order': 'random'}. Best is trial 142 with value: 662.1879915826296.
[I 2024-04-23 02:37:09,588] Trial 186 finished with value: 662.1929112039347 and parameters: {'model_name': 'IterativeImputer', 'sample_posterior': False, 'initial_strategy': 'mean', 'imputation_order': 'random'}. Best is trial 142 with value: 662.1879915826296.
[I 2024-04-23 02:37:14,547] Trial 191 finished with value: 662.1934996637767 and parameters: {'model_name': 'IterativeImputer', 'sample_posterior': False, 'initial_strategy': 'mean', 'imputation_order': 'random'}. Best is trial 142 with value: 662.1879915826296.
[I 2024-04-23 02:37:16,620] Trial 190 finished with value: 662.1910436555464 and parameters: {'model_name': 'IterativeImputer', 'sample_posterior': False, 'initial_strategy': 'mean', 'imputation_order': 'random'}. Best is trial 142 with value: 662.1879915826296.
[I 2024-04-23 02:37:21,344] Trial 23 finished with value: inf and parameters: {'model_name': 'GAIN', 'batch_size': 8, 'hint_rate': 0.14, 'alpha': 11, 'iterations': 15536}. Best is trial 142 with value: 662.1879915826296.
[I 2024-04-23 02:37:27,214] Trial 198 finished with value: 662.1959559835125 and parameters: {'model_name': 'IterativeImputer', 'sample_posterior': False, 'initial_strategy': 'mean', 'imputation_order': 'random'}. Best is trial 142 with value: 662.1879915826296.
[I 2024-04-23 02:42:42,618] Trial 19 finished with value: 812.4979447818508 and parameters: {'model_name': 'GAIN', 'batch_size': 1, 'hint_rate': 0.53, 'alpha': 44, 'iterations': 2427}. Best is trial 142 with value: 662.1879915826296.
[I 2024-04-23 02:44:58,967] Trial 175 finished with value: inf and parameters: {'model_name': 'GAIN', 'batch_size': 1, 'hint_rate': 0.38, 'alpha': 98, 'iterations': 15380}. Best is trial 142 with value: 662.1879915826296.
[I 2024-04-23 02:45:51,181] Trial 177 finished with value: inf and parameters: {'model_name': 'GAIN', 'batch_size': 1, 'hint_rate': 0.32, 'alpha': 74, 'iterations': 16592}. Best is trial 142 with value: 662.1879915826296.
[I 2024-04-23 02:50:44,951] Trial 183 finished with value: inf and parameters: {'model_name': 'GAIN', 'batch_size': 1, 'hint_rate': 0.29000000000000004, 'alpha': 89, 'iterations': 25939}. Best is trial 142 with value: 662.1879915826296.
[I 2024-04-23 02:56:38,583] Trial 197 finished with value: inf and parameters: {'model_name': 'GAIN', 'batch_size': 1, 'hint_rate': 0.36000000000000004, 'alpha': 98, 'iterations': 36442}. Best is trial 142 with value: 662.1879915826296.
[I 2024-04-23 02:57:10,915] Trial 173 finished with value: inf and parameters: {'model_name': 'GAIN', 'batch_size': 1, 'hint_rate': 0.35000000000000003, 'alpha': 100, 'iterations': 38317}. Best is trial 142 with value: 662.1879915826296.
[I 2024-04-23 02:58:12,366] Trial 178 finished with value: inf and parameters: {'model_name': 'GAIN', 'batch_size': 1, 'hint_rate': 0.35000000000000003, 'alpha': 99, 'iterations': 40189}. Best is trial 142 with value: 662.1879915826296.
[I 2024-04-23 03:00:04,801] Trial 181 finished with value: inf and parameters: {'model_name': 'GAIN', 'batch_size': 1, 'hint_rate': 0.31, 'alpha': 92, 'iterations': 43993}. Best is trial 142 with value: 662.1879915826296.
[I 2024-04-23 03:00:25,518] Trial 192 finished with value: inf and parameters: {'model_name': 'GAIN', 'batch_size': 1, 'hint_rate': 0.36000000000000004, 'alpha': 99, 'iterations': 44383}. Best is trial 142 with value: 662.1879915826296.
[I 2024-04-23 03:00:36,903] Trial 179 finished with value: inf and parameters: {'model_name': 'GAIN', 'batch_size': 2, 'hint_rate': 0.32, 'alpha': 99, 'iterations': 45312}. Best is trial 142 with value: 662.1879915826296.
[I 2024-04-23 03:01:18,141] Trial 172 finished with value: inf and parameters: {'model_name': 'GAIN', 'batch_size': 2, 'hint_rate': 0.33, 'alpha': 96, 'iterations': 47397}. Best is trial 142 with value: 662.1879915826296.
[I 2024-04-23 03:04:40,990] Trial 188 finished with value: inf and parameters: {'model_name': 'GAIN', 'batch_size': 1, 'hint_rate': 0.37, 'alpha': 98, 'iterations': 56334}. Best is trial 142 with value: 662.1879915826296.
[I 2024-04-23 03:04:55,696] Trial 184 finished with value: inf and parameters: {'model_name': 'GAIN', 'batch_size': 1, 'hint_rate': 0.43, 'alpha': 93, 'iterations': 57194}. Best is trial 142 with value: 662.1879915826296.
[I 2024-04-23 03:07:01,508] Trial 171 finished with value: inf and parameters: {'model_name': 'GAIN', 'batch_size': 1, 'hint_rate': 0.35000000000000003, 'alpha': 92, 'iterations': 65016}. Best is trial 142 with value: 662.1879915826296.
[I 2024-04-23 03:07:25,959] Trial 194 finished with value: inf and parameters: {'model_name': 'GAIN', 'batch_size': 1, 'hint_rate': 0.25, 'alpha': 95, 'iterations': 64516}. Best is trial 142 with value: 662.1879915826296.
[I 2024-04-23 03:08:14,739] Trial 166 finished with value: inf and parameters: {'model_name': 'GAIN', 'batch_size': 1, 'hint_rate': 0.36000000000000004, 'alpha': 99, 'iterations': 68724}. Best is trial 142 with value: 662.1879915826296.
[I 2024-04-23 03:10:31,078] Trial 195 finished with value: inf and parameters: {'model_name': 'GAIN', 'batch_size': 1, 'hint_rate': 0.33, 'alpha': 99, 'iterations': 77170}. Best is trial 142 with value: 662.1879915826296.
[I 2024-04-23 03:11:00,297] Trial 174 finished with value: inf and parameters: {'model_name': 'GAIN', 'batch_size': 2, 'hint_rate': 0.31, 'alpha': 100, 'iterations': 79943}. Best is trial 142 with value: 662.1879915826296.
[I 2024-04-23 03:11:14,017] Trial 199 finished with value: inf and parameters: {'model_name': 'GAIN', 'batch_size': 1, 'hint_rate': 0.36000000000000004, 'alpha': 96, 'iterations': 80020}. Best is trial 142 with value: 662.1879915826296.
[I 2024-04-23 03:11:22,578] Trial 193 finished with value: inf and parameters: {'model_name': 'GAIN', 'batch_size': 1, 'hint_rate': 0.35000000000000003, 'alpha': 90, 'iterations': 82100}. Best is trial 142 with value: 662.1879915826296.
[I 2024-04-23 03:12:00,855] Trial 196 finished with value: inf and parameters: {'model_name': 'GAIN', 'batch_size': 1, 'hint_rate': 0.35000000000000003, 'alpha': 100, 'iterations': 84272}. Best is trial 142 with value: 662.1879915826296.
[I 2024-04-23 03:12:53,447] Trial 189 finished with value: inf and parameters: {'model_name': 'GAIN', 'batch_size': 1, 'hint_rate': 0.34, 'alpha': 98, 'iterations': 90321}. Best is trial 142 with value: 662.1879915826296.
[I 2024-04-23 03:12:57,419] Trial 169 finished with value: inf and parameters: {'model_name': 'GAIN', 'batch_size': 1, 'hint_rate': 0.33, 'alpha': 98, 'iterations': 92179}. Best is trial 142 with value: 662.1879915826296.
[I 2024-04-23 03:13:04,144] Trial 185 finished with value: inf and parameters: {'model_name': 'GAIN', 'batch_size': 1, 'hint_rate': 0.34, 'alpha': 97, 'iterations': 93819}. Best is trial 142 with value: 662.1879915826296.
[I 2024-04-23 03:13:07,868] Trial 163 finished with value: inf and parameters: {'model_name': 'GAIN', 'batch_size': 1, 'hint_rate': 0.3, 'alpha': 99, 'iterations': 95167}. Best is trial 142 with value: 662.1879915826296.
[I 2024-04-23 03:13:12,050] Trial 167 finished with value: inf and parameters: {'model_name': 'GAIN', 'batch_size': 1, 'hint_rate': 0.29000000000000004, 'alpha': 100, 'iterations': 98145}. Best is trial 142 with value: 662.1879915826296.
