[I 2024-04-15 01:25:00,838] Trial 169 finished with value: 0.22793185665036128 and parameters: {'model_name': 'IterativeImputer', 'sample_posterior': False, 'initial_strategy': 'mean', 'imputation_order': 'roman'}. Best is trial 21 with value: 0.22709666808728138.
[I 2024-04-15 01:25:12,262] Trial 168 finished with value: 0.22793185665036128 and parameters: {'model_name': 'IterativeImputer', 'sample_posterior': False, 'initial_strategy': 'mean', 'imputation_order': 'roman'}. Best is trial 21 with value: 0.22709666808728138.
[I 2024-04-15 01:25:18,518] Trial 170 finished with value: 0.22793185665036128 and parameters: {'model_name': 'IterativeImputer', 'sample_posterior': False, 'initial_strategy': 'mean', 'imputation_order': 'roman'}. Best is trial 21 with value: 0.22709666808728138.
[I 2024-04-15 01:25:19,586] Trial 171 finished with value: 0.22793185665036128 and parameters: {'model_name': 'IterativeImputer', 'sample_posterior': False, 'initial_strategy': 'mean', 'imputation_order': 'roman'}. Best is trial 21 with value: 0.22709666808728138.
[I 2024-04-15 01:25:25,005] Trial 172 finished with value: 0.22793185665036128 and parameters: {'model_name': 'IterativeImputer', 'sample_posterior': False, 'initial_strategy': 'mean', 'imputation_order': 'roman'}. Best is trial 21 with value: 0.22709666808728138.
[I 2024-04-15 01:26:35,300] Trial 173 finished with value: 0.22793185665036128 and parameters: {'model_name': 'IterativeImputer', 'sample_posterior': False, 'initial_strategy': 'mean', 'imputation_order': 'roman'}. Best is trial 21 with value: 0.22709666808728138.
[I 2024-04-15 01:26:47,018] Trial 174 finished with value: 0.22793185665036128 and parameters: {'model_name': 'IterativeImputer', 'sample_posterior': False, 'initial_strategy': 'mean', 'imputation_order': 'roman'}. Best is trial 21 with value: 0.22709666808728138.
[I 2024-04-15 01:26:51,806] Trial 175 finished with value: 0.22793185665036128 and parameters: {'model_name': 'IterativeImputer', 'sample_posterior': False, 'initial_strategy': 'mean', 'imputation_order': 'roman'}. Best is trial 21 with value: 0.22709666808728138.
[I 2024-04-15 01:26:58,820] Trial 176 finished with value: 0.22793185665036128 and parameters: {'model_name': 'IterativeImputer', 'sample_posterior': False, 'initial_strategy': 'mean', 'imputation_order': 'roman'}. Best is trial 21 with value: 0.22709666808728138.
[I 2024-04-15 01:27:09,813] Trial 178 finished with value: 0.22793185665036128 and parameters: {'model_name': 'IterativeImputer', 'sample_posterior': False, 'initial_strategy': 'mean', 'imputation_order': 'roman'}. Best is trial 21 with value: 0.22709666808728138.
[I 2024-04-15 01:27:19,251] Trial 177 finished with value: 0.22793185665036128 and parameters: {'model_name': 'IterativeImputer', 'sample_posterior': False, 'initial_strategy': 'mean', 'imputation_order': 'roman'}. Best is trial 21 with value: 0.22709666808728138.
[I 2024-04-15 01:27:21,206] Trial 179 finished with value: 0.22793185665036128 and parameters: {'model_name': 'IterativeImputer', 'sample_posterior': False, 'initial_strategy': 'mean', 'imputation_order': 'roman'}. Best is trial 21 with value: 0.22709666808728138.
[I 2024-04-15 01:27:22,997] Trial 181 finished with value: 0.22793185665036128 and parameters: {'model_name': 'IterativeImputer', 'sample_posterior': False, 'initial_strategy': 'mean', 'imputation_order': 'roman'}. Best is trial 21 with value: 0.22709666808728138.
[I 2024-04-15 01:27:25,163] Trial 180 finished with value: 0.22793185665036128 and parameters: {'model_name': 'IterativeImputer', 'sample_posterior': False, 'initial_strategy': 'mean', 'imputation_order': 'roman'}. Best is trial 21 with value: 0.22709666808728138.
[I 2024-04-15 01:27:31,818] Trial 183 finished with value: 0.22793185665036128 and parameters: {'model_name': 'IterativeImputer', 'sample_posterior': False, 'initial_strategy': 'mean', 'imputation_order': 'roman'}. Best is trial 21 with value: 0.22709666808728138.
[I 2024-04-15 01:27:34,452] Trial 184 finished with value: 0.22793185665036128 and parameters: {'model_name': 'IterativeImputer', 'sample_posterior': False, 'initial_strategy': 'mean', 'imputation_order': 'roman'}. Best is trial 21 with value: 0.22709666808728138.
[I 2024-04-15 01:27:37,398] Trial 186 finished with value: 0.22793185665036128 and parameters: {'model_name': 'IterativeImputer', 'sample_posterior': False, 'initial_strategy': 'mean', 'imputation_order': 'roman'}. Best is trial 21 with value: 0.22709666808728138.
[I 2024-04-15 01:27:38,094] Trial 182 finished with value: 0.22793185665036128 and parameters: {'model_name': 'IterativeImputer', 'sample_posterior': False, 'initial_strategy': 'mean', 'imputation_order': 'roman'}. Best is trial 21 with value: 0.22709666808728138.
[I 2024-04-15 01:27:40,667] Trial 187 finished with value: 0.22793185665036128 and parameters: {'model_name': 'IterativeImputer', 'sample_posterior': False, 'initial_strategy': 'mean', 'imputation_order': 'roman'}. Best is trial 21 with value: 0.22709666808728138.
[I 2024-04-15 01:27:42,572] Trial 185 finished with value: 0.22793185665036128 and parameters: {'model_name': 'IterativeImputer', 'sample_posterior': False, 'initial_strategy': 'mean', 'imputation_order': 'roman'}. Best is trial 21 with value: 0.22709666808728138.
[I 2024-04-15 01:27:43,340] Trial 191 finished with value: 0.22793185665036128 and parameters: {'model_name': 'IterativeImputer', 'sample_posterior': False, 'initial_strategy': 'mean', 'imputation_order': 'roman'}. Best is trial 21 with value: 0.22709666808728138.
[I 2024-04-15 01:27:43,894] Trial 188 finished with value: 0.22793185665036128 and parameters: {'model_name': 'IterativeImputer', 'sample_posterior': False, 'initial_strategy': 'mean', 'imputation_order': 'roman'}. Best is trial 21 with value: 0.22709666808728138.
[I 2024-04-15 01:27:44,572] Trial 189 finished with value: 0.22793185665036128 and parameters: {'model_name': 'IterativeImputer', 'sample_posterior': False, 'initial_strategy': 'mean', 'imputation_order': 'roman'}. Best is trial 21 with value: 0.22709666808728138.
[I 2024-04-15 01:27:45,832] Trial 190 finished with value: 0.22793185665036128 and parameters: {'model_name': 'IterativeImputer', 'sample_posterior': False, 'initial_strategy': 'mean', 'imputation_order': 'roman'}. Best is trial 21 with value: 0.22709666808728138.
[I 2024-04-15 01:27:47,199] Trial 192 finished with value: 0.22793185665036128 and parameters: {'model_name': 'IterativeImputer', 'sample_posterior': False, 'initial_strategy': 'mean', 'imputation_order': 'roman'}. Best is trial 21 with value: 0.22709666808728138.
[I 2024-04-15 01:27:49,275] Trial 193 finished with value: 0.22793185665036128 and parameters: {'model_name': 'IterativeImputer', 'sample_posterior': False, 'initial_strategy': 'mean', 'imputation_order': 'roman'}. Best is trial 21 with value: 0.22709666808728138.
[I 2024-04-15 01:27:50,152] Trial 194 finished with value: 0.22793185665036128 and parameters: {'model_name': 'IterativeImputer', 'sample_posterior': False, 'initial_strategy': 'mean', 'imputation_order': 'roman'}. Best is trial 21 with value: 0.22709666808728138.
[I 2024-04-15 01:27:51,802] Trial 195 finished with value: 0.22793185665036128 and parameters: {'model_name': 'IterativeImputer', 'sample_posterior': False, 'initial_strategy': 'mean', 'imputation_order': 'roman'}. Best is trial 21 with value: 0.22709666808728138.
[I 2024-04-15 01:27:58,171] Trial 197 finished with value: 0.23112685639350664 and parameters: {'model_name': 'IterativeImputer', 'sample_posterior': False, 'initial_strategy': 'constant', 'imputation_order': 'roman'}. Best is trial 21 with value: 0.22709666808728138.
[I 2024-04-15 01:27:58,900] Trial 198 finished with value: 0.22793185665036128 and parameters: {'model_name': 'IterativeImputer', 'sample_posterior': False, 'initial_strategy': 'mean', 'imputation_order': 'roman'}. Best is trial 21 with value: 0.22709666808728138.
[I 2024-04-15 01:28:02,078] Trial 199 finished with value: 0.23112685639350664 and parameters: {'model_name': 'IterativeImputer', 'sample_posterior': False, 'initial_strategy': 'constant', 'imputation_order': 'roman'}. Best is trial 21 with value: 0.22709666808728138.
