Run: 9
/cm/local/apps/slurm/var/spool/job549711/slurm_script: line 23: /common/ketrong/minconda3/etc/profile.d/conda.sh: No such file or directory
/cm/local/apps/slurm/var/spool/job549711/slurm_script: line 26: $'\nconda create --name tpot2devenv -c conda-forge python=3.10\n': command not found
/cm/local/apps/slurm/var/spool/job549711/slurm_script: line 31: $'\npip install -r requirements.txt\n': command not found
RunStart
2023-12-12 15:25:57.601724: I tensorflow/core/util/port.cc:113] oneDNN custom operations are on. You may see slightly different numerical results due to floating-point round-off errors from different computation orders. To turn them off, set the environment variable `TF_ENABLE_ONEDNN_OPTS=0`.
2023-12-12 15:25:57.637789: E external/local_xla/xla/stream_executor/cuda/cuda_dnn.cc:9261] Unable to register cuDNN factory: Attempting to register factory for plugin cuDNN when one has already been registered
2023-12-12 15:25:57.637814: E external/local_xla/xla/stream_executor/cuda/cuda_fft.cc:607] Unable to register cuFFT factory: Attempting to register factory for plugin cuFFT when one has already been registered
2023-12-12 15:25:57.639190: E external/local_xla/xla/stream_executor/cuda/cuda_blas.cc:1515] Unable to register cuBLAS factory: Attempting to register factory for plugin cuBLAS when one has already been registered
2023-12-12 15:25:57.645322: I tensorflow/core/platform/cpu_feature_guard.cc:182] This TensorFlow binary is optimized to use available CPU instructions in performance-critical operations.
To enable the following instructions: AVX2 AVX512F AVX512_VNNI FMA, in other operations, rebuild TensorFlow with the appropriate compiler flags.
2023-12-12 15:25:59.289216: W tensorflow/compiler/tf2tensorrt/utils/py_utils.cc:38] TF-TRT Warning: Could not find TensorRT
WARNING:tensorflow:From /home/ketrong/miniconda3/envs/tpot2devenv/lib/python3.10/site-packages/tensorflow/python/compat/v2_compat.py:108: disable_resource_variables (from tensorflow.python.ops.variable_scope) is deprecated and will be removed in a future version.
Instructions for updating:
non-resource variables are not supported in the long term
starting loops
working on 
logs/30/tpot2_base_normal_MAR_0.5
3.8541605472564697
loading data
data/30_True.pkl
running experiment 1/3 - Does large hyperparameter space improve reconstruction accuracy over simple
[I 2023-12-12 15:26:16,900] A new study created in memory with name: no-name-f25b0eb9-cabc-41f1-9875-7331361de040
[I 2023-12-12 15:26:17,211] Trial 5 finished with value: 275.1181796808113 and parameters: {'model_name': 'SimpleImputer', 'strategy': 'constant'}. Best is trial 5 with value: 275.1181796808113.
[I 2023-12-12 15:26:17,530] Trial 7 finished with value: 275.1181796808113 and parameters: {'model_name': 'SimpleImputer', 'strategy': 'constant'}. Best is trial 5 with value: 275.1181796808113.
[I 2023-12-12 15:26:17,857] Trial 2 finished with value: 275.1181796808113 and parameters: {'model_name': 'SimpleImputer', 'strategy': 'constant'}. Best is trial 5 with value: 275.1181796808113.
[I 2023-12-12 15:26:18,048] Trial 13 finished with value: 275.1181796808113 and parameters: {'model_name': 'SimpleImputer', 'strategy': 'constant'}. Best is trial 5 with value: 275.1181796808113.
[I 2023-12-12 15:26:18,247] Trial 10 finished with value: 275.1181796808113 and parameters: {'model_name': 'SimpleImputer', 'strategy': 'constant'}. Best is trial 5 with value: 275.1181796808113.
[I 2023-12-12 15:26:18,532] Trial 1 finished with value: 230.9308254977362 and parameters: {'model_name': 'SimpleImputer', 'strategy': 'mean'}. Best is trial 1 with value: 230.9308254977362.
[I 2023-12-12 15:26:18,697] Trial 6 finished with value: 275.1181796808113 and parameters: {'model_name': 'SimpleImputer', 'strategy': 'constant'}. Best is trial 1 with value: 230.9308254977362.
[I 2023-12-12 15:26:19,031] Trial 23 finished with value: 275.1181796808113 and parameters: {'model_name': 'SimpleImputer', 'strategy': 'constant'}. Best is trial 1 with value: 230.9308254977362.
[I 2023-12-12 15:26:19,218] Trial 4 finished with value: 230.9308254977362 and parameters: {'model_name': 'SimpleImputer', 'strategy': 'mean'}. Best is trial 1 with value: 230.9308254977362.
[I 2023-12-12 15:26:19,391] Trial 16 finished with value: 275.1181796808113 and parameters: {'model_name': 'SimpleImputer', 'strategy': 'constant'}. Best is trial 1 with value: 230.9308254977362.
[I 2023-12-12 15:26:19,674] Trial 21 finished with value: 275.1181796808113 and parameters: {'model_name': 'SimpleImputer', 'strategy': 'constant'}. Best is trial 1 with value: 230.9308254977362.
[I 2023-12-12 15:26:19,884] Trial 26 finished with value: 275.1181796808113 and parameters: {'model_name': 'SimpleImputer', 'strategy': 'constant'}. Best is trial 1 with value: 230.9308254977362.
[I 2023-12-12 15:26:20,162] Trial 19 finished with value: 275.1181796808113 and parameters: {'model_name': 'SimpleImputer', 'strategy': 'constant'}. Best is trial 1 with value: 230.9308254977362.
[I 2023-12-12 15:26:20,361] Trial 40 finished with value: 275.1181796808113 and parameters: {'model_name': 'SimpleImputer', 'strategy': 'constant'}. Best is trial 1 with value: 230.9308254977362.
[I 2023-12-12 15:26:20,509] Trial 37 finished with value: 275.1181796808113 and parameters: {'model_name': 'SimpleImputer', 'strategy': 'constant'}. Best is trial 1 with value: 230.9308254977362.
[I 2023-12-12 15:26:20,726] Trial 3 finished with value: 230.9308254977362 and parameters: {'model_name': 'SimpleImputer', 'strategy': 'mean'}. Best is trial 1 with value: 230.9308254977362.
[I 2023-12-12 15:26:20,914] Trial 20 finished with value: 230.9308254977362 and parameters: {'model_name': 'SimpleImputer', 'strategy': 'mean'}. Best is trial 1 with value: 230.9308254977362.
[I 2023-12-12 15:26:21,143] Trial 15 finished with value: 230.9308254977362 and parameters: {'model_name': 'SimpleImputer', 'strategy': 'mean'}. Best is trial 1 with value: 230.9308254977362.
[I 2023-12-12 15:26:21,440] Trial 32 finished with value: 275.1181796808113 and parameters: {'model_name': 'SimpleImputer', 'strategy': 'constant'}. Best is trial 1 with value: 230.9308254977362.
[I 2023-12-12 15:26:21,635] Trial 36 finished with value: 275.1181796808113 and parameters: {'model_name': 'SimpleImputer', 'strategy': 'constant'}. Best is trial 1 with value: 230.9308254977362.
[I 2023-12-12 15:26:21,809] Trial 28 finished with value: 230.9308254977362 and parameters: {'model_name': 'SimpleImputer', 'strategy': 'mean'}. Best is trial 1 with value: 230.9308254977362.
[I 2023-12-12 15:26:22,027] Trial 41 finished with value: 230.9308254977362 and parameters: {'model_name': 'SimpleImputer', 'strategy': 'mean'}. Best is trial 1 with value: 230.9308254977362.
[I 2023-12-12 15:26:22,310] Trial 31 finished with value: 230.9308254977362 and parameters: {'model_name': 'SimpleImputer', 'strategy': 'mean'}. Best is trial 1 with value: 230.9308254977362.
[I 2023-12-12 15:26:22,480] Trial 29 finished with value: 230.9308254977362 and parameters: {'model_name': 'SimpleImputer', 'strategy': 'mean'}. Best is trial 1 with value: 230.9308254977362.
[I 2023-12-12 15:26:22,687] Trial 34 finished with value: 230.9308254977362 and parameters: {'model_name': 'SimpleImputer', 'strategy': 'mean'}. Best is trial 1 with value: 230.9308254977362.
[I 2023-12-12 15:26:22,956] Trial 38 finished with value: 275.1181796808113 and parameters: {'model_name': 'SimpleImputer', 'strategy': 'constant'}. Best is trial 1 with value: 230.9308254977362.
[I 2023-12-12 15:26:23,245] Trial 45 finished with value: 230.9308254977362 and parameters: {'model_name': 'SimpleImputer', 'strategy': 'mean'}. Best is trial 1 with value: 230.9308254977362.
[I 2023-12-12 15:26:23,520] Trial 47 finished with value: 230.9308254977362 and parameters: {'model_name': 'SimpleImputer', 'strategy': 'mean'}. Best is trial 1 with value: 230.9308254977362.
[I 2023-12-12 15:26:23,815] Trial 30 finished with value: 230.9308254977362 and parameters: {'model_name': 'SimpleImputer', 'strategy': 'mean'}. Best is trial 1 with value: 230.9308254977362.
[I 2023-12-12 15:26:24,102] Trial 57 finished with value: 230.9308254977362 and parameters: {'model_name': 'SimpleImputer', 'strategy': 'mean'}. Best is trial 1 with value: 230.9308254977362.
[I 2023-12-12 15:26:24,378] Trial 11 finished with value: 270.7496044088721 and parameters: {'model_name': 'SimpleImputer', 'strategy': 'median'}. Best is trial 1 with value: 230.9308254977362.
[I 2023-12-12 15:26:24,580] Trial 49 finished with value: 230.9308254977362 and parameters: {'model_name': 'SimpleImputer', 'strategy': 'mean'}. Best is trial 1 with value: 230.9308254977362.
[I 2023-12-12 15:26:24,834] Trial 8 finished with value: 270.7496044088721 and parameters: {'model_name': 'SimpleImputer', 'strategy': 'median'}. Best is trial 1 with value: 230.9308254977362.
[I 2023-12-12 15:26:25,063] Trial 48 finished with value: 230.9308254977362 and parameters: {'model_name': 'SimpleImputer', 'strategy': 'mean'}. Best is trial 1 with value: 230.9308254977362.
[I 2023-12-12 15:26:25,226] Trial 35 finished with value: 230.9308254977362 and parameters: {'model_name': 'SimpleImputer', 'strategy': 'mean'}. Best is trial 1 with value: 230.9308254977362.
[I 2023-12-12 15:26:25,409] Trial 50 finished with value: 230.9308254977362 and parameters: {'model_name': 'SimpleImputer', 'strategy': 'mean'}. Best is trial 1 with value: 230.9308254977362.
[I 2023-12-12 15:26:25,704] Trial 52 finished with value: 230.9308254977362 and parameters: {'model_name': 'SimpleImputer', 'strategy': 'mean'}. Best is trial 1 with value: 230.9308254977362.
[I 2023-12-12 15:26:25,915] Trial 54 finished with value: 230.9308254977362 and parameters: {'model_name': 'SimpleImputer', 'strategy': 'mean'}. Best is trial 1 with value: 230.9308254977362.
[I 2023-12-12 15:26:26,313] Trial 58 finished with value: 230.9308254977362 and parameters: {'model_name': 'SimpleImputer', 'strategy': 'mean'}. Best is trial 1 with value: 230.9308254977362.
[I 2023-12-12 15:26:26,515] Trial 17 finished with value: 270.7496044088721 and parameters: {'model_name': 'SimpleImputer', 'strategy': 'median'}. Best is trial 1 with value: 230.9308254977362.
[I 2023-12-12 15:26:26,772] Trial 55 finished with value: 230.9308254977362 and parameters: {'model_name': 'SimpleImputer', 'strategy': 'mean'}. Best is trial 1 with value: 230.9308254977362.
[I 2023-12-12 15:26:26,958] Trial 53 finished with value: 230.9308254977362 and parameters: {'model_name': 'SimpleImputer', 'strategy': 'mean'}. Best is trial 1 with value: 230.9308254977362.
[I 2023-12-12 15:26:27,142] Trial 51 finished with value: 230.9308254977362 and parameters: {'model_name': 'SimpleImputer', 'strategy': 'mean'}. Best is trial 1 with value: 230.9308254977362.
[I 2023-12-12 15:26:27,383] Trial 59 finished with value: 230.9308254977362 and parameters: {'model_name': 'SimpleImputer', 'strategy': 'mean'}. Best is trial 1 with value: 230.9308254977362.
[I 2023-12-12 15:26:27,732] Trial 60 finished with value: 230.9308254977362 and parameters: {'model_name': 'SimpleImputer', 'strategy': 'mean'}. Best is trial 1 with value: 230.9308254977362.
[I 2023-12-12 15:26:27,980] Trial 56 finished with value: 230.9308254977362 and parameters: {'model_name': 'SimpleImputer', 'strategy': 'mean'}. Best is trial 1 with value: 230.9308254977362.
[I 2023-12-12 15:26:28,350] Trial 27 finished with value: 270.7496044088721 and parameters: {'model_name': 'SimpleImputer', 'strategy': 'median'}. Best is trial 1 with value: 230.9308254977362.
[I 2023-12-12 15:26:29,844] Trial 67 finished with value: 270.7496044088721 and parameters: {'model_name': 'SimpleImputer', 'strategy': 'median'}. Best is trial 1 with value: 230.9308254977362.
[I 2023-12-12 15:26:30,129] Trial 65 finished with value: 270.7496044088721 and parameters: {'model_name': 'SimpleImputer', 'strategy': 'median'}. Best is trial 1 with value: 230.9308254977362.
[I 2023-12-12 15:26:30,598] Trial 71 finished with value: 270.7496044088721 and parameters: {'model_name': 'SimpleImputer', 'strategy': 'median'}. Best is trial 1 with value: 230.9308254977362.
[I 2023-12-12 15:26:30,887] Trial 68 finished with value: 270.7496044088721 and parameters: {'model_name': 'SimpleImputer', 'strategy': 'median'}. Best is trial 1 with value: 230.9308254977362.
[I 2023-12-12 15:26:31,217] Trial 9 finished with value: 273.584196709168 and parameters: {'model_name': 'SimpleImputer', 'strategy': 'most_frequent'}. Best is trial 1 with value: 230.9308254977362.
[I 2023-12-12 15:26:31,533] Trial 74 finished with value: 270.7496044088721 and parameters: {'model_name': 'SimpleImputer', 'strategy': 'median'}. Best is trial 1 with value: 230.9308254977362.
[I 2023-12-12 15:26:31,862] Trial 14 finished with value: 273.584196709168 and parameters: {'model_name': 'SimpleImputer', 'strategy': 'most_frequent'}. Best is trial 1 with value: 230.9308254977362.
[I 2023-12-12 15:26:32,136] Trial 12 finished with value: 273.584196709168 and parameters: {'model_name': 'SimpleImputer', 'strategy': 'most_frequent'}. Best is trial 1 with value: 230.9308254977362.
[I 2023-12-12 15:26:32,410] Trial 25 finished with value: 273.584196709168 and parameters: {'model_name': 'SimpleImputer', 'strategy': 'most_frequent'}. Best is trial 1 with value: 230.9308254977362.
[I 2023-12-12 15:26:32,683] Trial 22 finished with value: 273.584196709168 and parameters: {'model_name': 'SimpleImputer', 'strategy': 'most_frequent'}. Best is trial 1 with value: 230.9308254977362.
[I 2023-12-12 15:26:32,927] Trial 0 finished with value: 273.584196709168 and parameters: {'model_name': 'SimpleImputer', 'strategy': 'most_frequent'}. Best is trial 1 with value: 230.9308254977362.
[I 2023-12-12 15:26:33,329] Trial 39 finished with value: 273.584196709168 and parameters: {'model_name': 'SimpleImputer', 'strategy': 'most_frequent'}. Best is trial 1 with value: 230.9308254977362.
[I 2023-12-12 15:26:33,675] Trial 18 finished with value: 273.584196709168 and parameters: {'model_name': 'SimpleImputer', 'strategy': 'most_frequent'}. Best is trial 1 with value: 230.9308254977362.
[I 2023-12-12 15:26:34,189] Trial 24 finished with value: 273.584196709168 and parameters: {'model_name': 'SimpleImputer', 'strategy': 'most_frequent'}. Best is trial 1 with value: 230.9308254977362.
[I 2023-12-12 15:26:34,437] Trial 42 finished with value: 273.584196709168 and parameters: {'model_name': 'SimpleImputer', 'strategy': 'most_frequent'}. Best is trial 1 with value: 230.9308254977362.
[I 2023-12-12 15:26:34,989] Trial 46 finished with value: 273.584196709168 and parameters: {'model_name': 'SimpleImputer', 'strategy': 'most_frequent'}. Best is trial 1 with value: 230.9308254977362.
[I 2023-12-12 15:26:35,428] Trial 43 finished with value: 273.584196709168 and parameters: {'model_name': 'SimpleImputer', 'strategy': 'most_frequent'}. Best is trial 1 with value: 230.9308254977362.
[I 2023-12-12 15:26:35,844] Trial 44 finished with value: 273.584196709168 and parameters: {'model_name': 'SimpleImputer', 'strategy': 'most_frequent'}. Best is trial 1 with value: 230.9308254977362.
[I 2023-12-12 15:26:36,366] Trial 106 finished with value: 230.9308254977362 and parameters: {'model_name': 'SimpleImputer', 'strategy': 'mean'}. Best is trial 1 with value: 230.9308254977362.
[I 2023-12-12 15:26:36,933] Trial 61 finished with value: 273.584196709168 and parameters: {'model_name': 'SimpleImputer', 'strategy': 'most_frequent'}. Best is trial 1 with value: 230.9308254977362.
[I 2023-12-12 15:26:37,233] Trial 33 finished with value: 273.584196709168 and parameters: {'model_name': 'SimpleImputer', 'strategy': 'most_frequent'}. Best is trial 1 with value: 230.9308254977362.
[I 2023-12-12 15:26:37,596] Trial 108 finished with value: 230.9308254977362 and parameters: {'model_name': 'SimpleImputer', 'strategy': 'mean'}. Best is trial 1 with value: 230.9308254977362.
[I 2023-12-12 15:26:37,817] Trial 107 finished with value: 230.9308254977362 and parameters: {'model_name': 'SimpleImputer', 'strategy': 'mean'}. Best is trial 1 with value: 230.9308254977362.
[I 2023-12-12 15:26:38,072] Trial 66 finished with value: 273.584196709168 and parameters: {'model_name': 'SimpleImputer', 'strategy': 'most_frequent'}. Best is trial 1 with value: 230.9308254977362.
[I 2023-12-12 15:26:38,413] Trial 109 finished with value: 230.9308254977362 and parameters: {'model_name': 'SimpleImputer', 'strategy': 'mean'}. Best is trial 1 with value: 230.9308254977362.
[I 2023-12-12 15:26:38,885] Trial 62 finished with value: 273.584196709168 and parameters: {'model_name': 'SimpleImputer', 'strategy': 'most_frequent'}. Best is trial 1 with value: 230.9308254977362.
[I 2023-12-12 15:26:39,144] Trial 64 finished with value: 273.584196709168 and parameters: {'model_name': 'SimpleImputer', 'strategy': 'most_frequent'}. Best is trial 1 with value: 230.9308254977362.
[I 2023-12-12 15:26:39,351] Trial 110 finished with value: 230.9308254977362 and parameters: {'model_name': 'SimpleImputer', 'strategy': 'mean'}. Best is trial 1 with value: 230.9308254977362.
[I 2023-12-12 15:26:39,572] Trial 63 finished with value: 273.584196709168 and parameters: {'model_name': 'SimpleImputer', 'strategy': 'most_frequent'}. Best is trial 1 with value: 230.9308254977362.
[I 2023-12-12 15:26:39,824] Trial 80 finished with value: 273.584196709168 and parameters: {'model_name': 'SimpleImputer', 'strategy': 'most_frequent'}. Best is trial 1 with value: 230.9308254977362.
[I 2023-12-12 15:26:40,116] Trial 92 finished with value: 273.584196709168 and parameters: {'model_name': 'SimpleImputer', 'strategy': 'most_frequent'}. Best is trial 1 with value: 230.9308254977362.
[I 2023-12-12 15:26:40,433] Trial 70 finished with value: 273.584196709168 and parameters: {'model_name': 'SimpleImputer', 'strategy': 'most_frequent'}. Best is trial 1 with value: 230.9308254977362.
[I 2023-12-12 15:26:40,649] Trial 69 finished with value: 273.584196709168 and parameters: {'model_name': 'SimpleImputer', 'strategy': 'most_frequent'}. Best is trial 1 with value: 230.9308254977362.
[I 2023-12-12 15:26:40,875] Trial 73 finished with value: 273.584196709168 and parameters: {'model_name': 'SimpleImputer', 'strategy': 'most_frequent'}. Best is trial 1 with value: 230.9308254977362.
[I 2023-12-12 15:26:41,094] Trial 112 finished with value: 230.9308254977362 and parameters: {'model_name': 'SimpleImputer', 'strategy': 'mean'}. Best is trial 1 with value: 230.9308254977362.
[I 2023-12-12 15:26:41,300] Trial 75 finished with value: 273.584196709168 and parameters: {'model_name': 'SimpleImputer', 'strategy': 'most_frequent'}. Best is trial 1 with value: 230.9308254977362.
[I 2023-12-12 15:26:41,539] Trial 77 finished with value: 273.584196709168 and parameters: {'model_name': 'SimpleImputer', 'strategy': 'most_frequent'}. Best is trial 1 with value: 230.9308254977362.
[I 2023-12-12 15:26:41,796] Trial 111 finished with value: 230.9308254977362 and parameters: {'model_name': 'SimpleImputer', 'strategy': 'mean'}. Best is trial 1 with value: 230.9308254977362.
[I 2023-12-12 15:26:42,147] Trial 72 finished with value: 273.584196709168 and parameters: {'model_name': 'SimpleImputer', 'strategy': 'most_frequent'}. Best is trial 1 with value: 230.9308254977362.
[I 2023-12-12 15:26:42,369] Trial 113 finished with value: 230.9308254977362 and parameters: {'model_name': 'SimpleImputer', 'strategy': 'mean'}. Best is trial 1 with value: 230.9308254977362.
[I 2023-12-12 15:26:42,570] Trial 90 finished with value: 273.584196709168 and parameters: {'model_name': 'SimpleImputer', 'strategy': 'most_frequent'}. Best is trial 1 with value: 230.9308254977362.
[I 2023-12-12 15:26:42,746] Trial 86 finished with value: 273.584196709168 and parameters: {'model_name': 'SimpleImputer', 'strategy': 'most_frequent'}. Best is trial 1 with value: 230.9308254977362.
[I 2023-12-12 15:26:43,042] Trial 114 finished with value: 230.9308254977362 and parameters: {'model_name': 'SimpleImputer', 'strategy': 'mean'}. Best is trial 1 with value: 230.9308254977362.
[I 2023-12-12 15:26:43,466] Trial 87 finished with value: 273.584196709168 and parameters: {'model_name': 'SimpleImputer', 'strategy': 'most_frequent'}. Best is trial 1 with value: 230.9308254977362.
[I 2023-12-12 15:26:43,674] Trial 115 finished with value: 230.9308254977362 and parameters: {'model_name': 'SimpleImputer', 'strategy': 'mean'}. Best is trial 1 with value: 230.9308254977362.
[I 2023-12-12 15:26:43,893] Trial 117 finished with value: 230.9308254977362 and parameters: {'model_name': 'SimpleImputer', 'strategy': 'mean'}. Best is trial 1 with value: 230.9308254977362.
[I 2023-12-12 15:26:44,122] Trial 118 finished with value: 230.9308254977362 and parameters: {'model_name': 'SimpleImputer', 'strategy': 'mean'}. Best is trial 1 with value: 230.9308254977362.
[I 2023-12-12 15:26:44,460] Trial 83 finished with value: 273.584196709168 and parameters: {'model_name': 'SimpleImputer', 'strategy': 'most_frequent'}. Best is trial 1 with value: 230.9308254977362.
[I 2023-12-12 15:26:44,667] Trial 82 finished with value: 273.584196709168 and parameters: {'model_name': 'SimpleImputer', 'strategy': 'most_frequent'}. Best is trial 1 with value: 230.9308254977362.
[I 2023-12-12 15:26:44,877] Trial 76 finished with value: 273.584196709168 and parameters: {'model_name': 'SimpleImputer', 'strategy': 'most_frequent'}. Best is trial 1 with value: 230.9308254977362.
[I 2023-12-12 15:26:45,108] Trial 85 finished with value: 273.584196709168 and parameters: {'model_name': 'SimpleImputer', 'strategy': 'most_frequent'}. Best is trial 1 with value: 230.9308254977362.
[I 2023-12-12 15:26:45,339] Trial 119 finished with value: 230.9308254977362 and parameters: {'model_name': 'SimpleImputer', 'strategy': 'mean'}. Best is trial 1 with value: 230.9308254977362.
