Run: 1
/cm/local/apps/slurm/var/spool/job549703/slurm_script: line 23: /common/ketrong/minconda3/etc/profile.d/conda.sh: No such file or directory
/cm/local/apps/slurm/var/spool/job549703/slurm_script: line 26: $'\nconda create --name tpot2devenv -c conda-forge python=3.10\n': command not found
/cm/local/apps/slurm/var/spool/job549703/slurm_script: line 31: $'\npip install -r requirements.txt\n': command not found
RunStart
2023-12-12 15:25:55.814686: I tensorflow/core/util/port.cc:113] oneDNN custom operations are on. You may see slightly different numerical results due to floating-point round-off errors from different computation orders. To turn them off, set the environment variable `TF_ENABLE_ONEDNN_OPTS=0`.
2023-12-12 15:25:55.848129: E external/local_xla/xla/stream_executor/cuda/cuda_dnn.cc:9261] Unable to register cuDNN factory: Attempting to register factory for plugin cuDNN when one has already been registered
2023-12-12 15:25:55.848153: E external/local_xla/xla/stream_executor/cuda/cuda_fft.cc:607] Unable to register cuFFT factory: Attempting to register factory for plugin cuFFT when one has already been registered
2023-12-12 15:25:55.848970: E external/local_xla/xla/stream_executor/cuda/cuda_blas.cc:1515] Unable to register cuBLAS factory: Attempting to register factory for plugin cuBLAS when one has already been registered
2023-12-12 15:25:55.853891: I tensorflow/core/platform/cpu_feature_guard.cc:182] This TensorFlow binary is optimized to use available CPU instructions in performance-critical operations.
To enable the following instructions: AVX2 AVX512F AVX512_VNNI FMA, in other operations, rebuild TensorFlow with the appropriate compiler flags.
2023-12-12 15:25:57.217256: W tensorflow/compiler/tf2tensorrt/utils/py_utils.cc:38] TF-TRT Warning: Could not find TensorRT
WARNING:tensorflow:From /home/ketrong/miniconda3/envs/tpot2devenv/lib/python3.10/site-packages/tensorflow/python/compat/v2_compat.py:108: disable_resource_variables (from tensorflow.python.ops.variable_scope) is deprecated and will be removed in a future version.
Instructions for updating:
non-resource variables are not supported in the long term
starting loops
working on 
logs/30/tpot2_base_normal_MCAR_0.01
4.662143707275391
loading data
data/30_True.pkl
running experiment 1/3 - Does large hyperparameter space improve reconstruction accuracy over simple
[I 2023-12-12 15:26:09,409] A new study created in memory with name: no-name-940c7101-e085-4a33-9a57-af2c25fc3e0d
[I 2023-12-12 15:26:09,787] Trial 3 finished with value: 1898.6831307490568 and parameters: {'model_name': 'SimpleImputer', 'strategy': 'constant'}. Best is trial 3 with value: 1898.6831307490568.
[I 2023-12-12 15:26:09,964] Trial 10 finished with value: 1898.6831307490568 and parameters: {'model_name': 'SimpleImputer', 'strategy': 'constant'}. Best is trial 3 with value: 1898.6831307490568.
[I 2023-12-12 15:26:10,138] Trial 1 finished with value: 1898.6831307490568 and parameters: {'model_name': 'SimpleImputer', 'strategy': 'constant'}. Best is trial 3 with value: 1898.6831307490568.
[I 2023-12-12 15:26:10,337] Trial 4 finished with value: 1898.6831307490568 and parameters: {'model_name': 'SimpleImputer', 'strategy': 'constant'}. Best is trial 3 with value: 1898.6831307490568.
[I 2023-12-12 15:26:10,520] Trial 5 finished with value: 1898.6831307490568 and parameters: {'model_name': 'SimpleImputer', 'strategy': 'constant'}. Best is trial 3 with value: 1898.6831307490568.
[I 2023-12-12 15:26:10,806] Trial 7 finished with value: 1898.6831307490568 and parameters: {'model_name': 'SimpleImputer', 'strategy': 'constant'}. Best is trial 3 with value: 1898.6831307490568.
[I 2023-12-12 15:26:11,043] Trial 14 finished with value: 1898.6831307490568 and parameters: {'model_name': 'SimpleImputer', 'strategy': 'constant'}. Best is trial 3 with value: 1898.6831307490568.
[I 2023-12-12 15:26:11,511] Trial 9 finished with value: 1785.3704913527722 and parameters: {'model_name': 'SimpleImputer', 'strategy': 'mean'}. Best is trial 9 with value: 1785.3704913527722.
[I 2023-12-12 15:26:11,685] Trial 8 finished with value: 1785.3704913527722 and parameters: {'model_name': 'SimpleImputer', 'strategy': 'mean'}. Best is trial 9 with value: 1785.3704913527722.
[I 2023-12-12 15:26:11,872] Trial 24 finished with value: 1898.6831307490568 and parameters: {'model_name': 'SimpleImputer', 'strategy': 'constant'}. Best is trial 9 with value: 1785.3704913527722.
[I 2023-12-12 15:26:12,134] Trial 30 finished with value: 1898.6831307490568 and parameters: {'model_name': 'SimpleImputer', 'strategy': 'constant'}. Best is trial 9 with value: 1785.3704913527722.
[I 2023-12-12 15:26:12,326] Trial 27 finished with value: 1785.3704913527722 and parameters: {'model_name': 'SimpleImputer', 'strategy': 'mean'}. Best is trial 9 with value: 1785.3704913527722.
[I 2023-12-12 15:26:12,481] Trial 18 finished with value: 1785.3704913527722 and parameters: {'model_name': 'SimpleImputer', 'strategy': 'mean'}. Best is trial 9 with value: 1785.3704913527722.
[I 2023-12-12 15:26:12,765] Trial 22 finished with value: 1785.3704913527722 and parameters: {'model_name': 'SimpleImputer', 'strategy': 'mean'}. Best is trial 9 with value: 1785.3704913527722.
[I 2023-12-12 15:26:13,148] Trial 31 finished with value: 1898.6831307490568 and parameters: {'model_name': 'SimpleImputer', 'strategy': 'constant'}. Best is trial 9 with value: 1785.3704913527722.
[I 2023-12-12 15:26:13,349] Trial 35 finished with value: 1898.6831307490568 and parameters: {'model_name': 'SimpleImputer', 'strategy': 'constant'}. Best is trial 9 with value: 1785.3704913527722.
[I 2023-12-12 15:26:13,610] Trial 39 finished with value: 1898.6831307490568 and parameters: {'model_name': 'SimpleImputer', 'strategy': 'constant'}. Best is trial 9 with value: 1785.3704913527722.
[I 2023-12-12 15:26:13,829] Trial 32 finished with value: 1898.6831307490568 and parameters: {'model_name': 'SimpleImputer', 'strategy': 'constant'}. Best is trial 9 with value: 1785.3704913527722.
[I 2023-12-12 15:26:14,001] Trial 11 finished with value: 1844.0239222934547 and parameters: {'model_name': 'SimpleImputer', 'strategy': 'median'}. Best is trial 9 with value: 1785.3704913527722.
[I 2023-12-12 15:26:14,199] Trial 37 finished with value: 1898.6831307490568 and parameters: {'model_name': 'SimpleImputer', 'strategy': 'constant'}. Best is trial 9 with value: 1785.3704913527722.
[I 2023-12-12 15:26:14,476] Trial 36 finished with value: 1898.6831307490568 and parameters: {'model_name': 'SimpleImputer', 'strategy': 'constant'}. Best is trial 9 with value: 1785.3704913527722.
[I 2023-12-12 15:26:14,503] Trial 12 finished with value: 1844.0239222934547 and parameters: {'model_name': 'SimpleImputer', 'strategy': 'median'}. Best is trial 9 with value: 1785.3704913527722.
[I 2023-12-12 15:26:14,684] Trial 15 finished with value: 1844.0239222934547 and parameters: {'model_name': 'SimpleImputer', 'strategy': 'median'}. Best is trial 9 with value: 1785.3704913527722.
[I 2023-12-12 15:26:14,865] Trial 42 finished with value: 1785.3704913527722 and parameters: {'model_name': 'SimpleImputer', 'strategy': 'mean'}. Best is trial 9 with value: 1785.3704913527722.
[I 2023-12-12 15:26:15,263] Trial 6 finished with value: 1844.0239222934547 and parameters: {'model_name': 'SimpleImputer', 'strategy': 'median'}. Best is trial 9 with value: 1785.3704913527722.
[I 2023-12-12 15:26:15,440] Trial 43 finished with value: 1785.3704913527722 and parameters: {'model_name': 'SimpleImputer', 'strategy': 'mean'}. Best is trial 9 with value: 1785.3704913527722.
[I 2023-12-12 15:26:15,819] Trial 23 finished with value: 1844.0239222934547 and parameters: {'model_name': 'SimpleImputer', 'strategy': 'median'}. Best is trial 9 with value: 1785.3704913527722.
[I 2023-12-12 15:26:15,982] Trial 44 finished with value: 1785.3704913527722 and parameters: {'model_name': 'SimpleImputer', 'strategy': 'mean'}. Best is trial 9 with value: 1785.3704913527722.
[I 2023-12-12 15:26:16,156] Trial 29 finished with value: 1844.0239222934547 and parameters: {'model_name': 'SimpleImputer', 'strategy': 'median'}. Best is trial 9 with value: 1785.3704913527722.
[I 2023-12-12 15:26:16,307] Trial 48 finished with value: 1785.3704913527722 and parameters: {'model_name': 'SimpleImputer', 'strategy': 'mean'}. Best is trial 9 with value: 1785.3704913527722.
[I 2023-12-12 15:26:16,516] Trial 46 finished with value: 1785.3704913527722 and parameters: {'model_name': 'SimpleImputer', 'strategy': 'mean'}. Best is trial 9 with value: 1785.3704913527722.
[I 2023-12-12 15:26:16,668] Trial 47 finished with value: 1785.3704913527722 and parameters: {'model_name': 'SimpleImputer', 'strategy': 'mean'}. Best is trial 9 with value: 1785.3704913527722.
[I 2023-12-12 15:26:16,882] Trial 45 finished with value: 1785.3704913527722 and parameters: {'model_name': 'SimpleImputer', 'strategy': 'mean'}. Best is trial 9 with value: 1785.3704913527722.
[I 2023-12-12 15:26:17,096] Trial 49 finished with value: 1785.3704913527722 and parameters: {'model_name': 'SimpleImputer', 'strategy': 'mean'}. Best is trial 9 with value: 1785.3704913527722.
[I 2023-12-12 15:26:17,483] Trial 20 finished with value: 1844.0239222934547 and parameters: {'model_name': 'SimpleImputer', 'strategy': 'median'}. Best is trial 9 with value: 1785.3704913527722.
[I 2023-12-12 15:26:17,848] Trial 33 finished with value: 1844.0239222934547 and parameters: {'model_name': 'SimpleImputer', 'strategy': 'median'}. Best is trial 9 with value: 1785.3704913527722.
[I 2023-12-12 15:26:18,385] Trial 52 finished with value: 1844.0239222934547 and parameters: {'model_name': 'SimpleImputer', 'strategy': 'median'}. Best is trial 9 with value: 1785.3704913527722.
[I 2023-12-12 15:26:18,697] Trial 50 finished with value: 1844.0239222934547 and parameters: {'model_name': 'SimpleImputer', 'strategy': 'median'}. Best is trial 9 with value: 1785.3704913527722.
[I 2023-12-12 15:26:18,865] Trial 56 finished with value: 1844.0239222934547 and parameters: {'model_name': 'SimpleImputer', 'strategy': 'median'}. Best is trial 9 with value: 1785.3704913527722.
[I 2023-12-12 15:26:19,056] Trial 62 finished with value: 1844.0239222934547 and parameters: {'model_name': 'SimpleImputer', 'strategy': 'median'}. Best is trial 9 with value: 1785.3704913527722.
[I 2023-12-12 15:26:19,357] Trial 59 finished with value: 1844.0239222934547 and parameters: {'model_name': 'SimpleImputer', 'strategy': 'median'}. Best is trial 9 with value: 1785.3704913527722.
[I 2023-12-12 15:26:19,550] Trial 63 finished with value: 1844.0239222934547 and parameters: {'model_name': 'SimpleImputer', 'strategy': 'median'}. Best is trial 9 with value: 1785.3704913527722.
[I 2023-12-12 15:26:19,790] Trial 58 finished with value: 1844.0239222934547 and parameters: {'model_name': 'SimpleImputer', 'strategy': 'median'}. Best is trial 9 with value: 1785.3704913527722.
[I 2023-12-12 15:26:20,047] Trial 61 finished with value: 1844.0239222934547 and parameters: {'model_name': 'SimpleImputer', 'strategy': 'median'}. Best is trial 9 with value: 1785.3704913527722.
[I 2023-12-12 15:26:20,307] Trial 13 finished with value: 1890.7950712192014 and parameters: {'model_name': 'SimpleImputer', 'strategy': 'most_frequent'}. Best is trial 9 with value: 1785.3704913527722.
[I 2023-12-12 15:26:20,661] Trial 60 finished with value: 1844.0239222934547 and parameters: {'model_name': 'SimpleImputer', 'strategy': 'median'}. Best is trial 9 with value: 1785.3704913527722.
[I 2023-12-12 15:26:21,089] Trial 0 finished with value: 1890.7950712192014 and parameters: {'model_name': 'SimpleImputer', 'strategy': 'most_frequent'}. Best is trial 9 with value: 1785.3704913527722.
[I 2023-12-12 15:26:21,500] Trial 2 finished with value: 1890.7950712192014 and parameters: {'model_name': 'SimpleImputer', 'strategy': 'most_frequent'}. Best is trial 9 with value: 1785.3704913527722.
[I 2023-12-12 15:26:21,795] Trial 28 finished with value: 1890.7950712192014 and parameters: {'model_name': 'SimpleImputer', 'strategy': 'most_frequent'}. Best is trial 9 with value: 1785.3704913527722.
[I 2023-12-12 15:26:22,075] Trial 16 finished with value: 1890.7950712192014 and parameters: {'model_name': 'SimpleImputer', 'strategy': 'most_frequent'}. Best is trial 9 with value: 1785.3704913527722.
[I 2023-12-12 15:26:22,246] Trial 17 finished with value: 1890.7950712192014 and parameters: {'model_name': 'SimpleImputer', 'strategy': 'most_frequent'}. Best is trial 9 with value: 1785.3704913527722.
[I 2023-12-12 15:26:22,247] Trial 25 finished with value: 1890.7950712192014 and parameters: {'model_name': 'SimpleImputer', 'strategy': 'most_frequent'}. Best is trial 9 with value: 1785.3704913527722.
[I 2023-12-12 15:26:22,547] Trial 26 finished with value: 1890.7950712192014 and parameters: {'model_name': 'SimpleImputer', 'strategy': 'most_frequent'}. Best is trial 9 with value: 1785.3704913527722.
[I 2023-12-12 15:26:23,139] Trial 19 finished with value: 1890.7950712192014 and parameters: {'model_name': 'SimpleImputer', 'strategy': 'most_frequent'}. Best is trial 9 with value: 1785.3704913527722.
[I 2023-12-12 15:26:23,708] Trial 34 finished with value: 1890.7950712192014 and parameters: {'model_name': 'SimpleImputer', 'strategy': 'most_frequent'}. Best is trial 9 with value: 1785.3704913527722.
[I 2023-12-12 15:26:24,008] Trial 21 finished with value: 1890.7950712192014 and parameters: {'model_name': 'SimpleImputer', 'strategy': 'most_frequent'}. Best is trial 9 with value: 1785.3704913527722.
[I 2023-12-12 15:26:24,295] Trial 54 finished with value: 1890.7950712192014 and parameters: {'model_name': 'SimpleImputer', 'strategy': 'most_frequent'}. Best is trial 9 with value: 1785.3704913527722.
[I 2023-12-12 15:26:24,839] Trial 51 finished with value: 1890.7950712192014 and parameters: {'model_name': 'SimpleImputer', 'strategy': 'most_frequent'}. Best is trial 9 with value: 1785.3704913527722.
[I 2023-12-12 15:26:25,102] Trial 97 finished with value: 1785.3704913527722 and parameters: {'model_name': 'SimpleImputer', 'strategy': 'mean'}. Best is trial 9 with value: 1785.3704913527722.
[I 2023-12-12 15:26:25,277] Trial 95 finished with value: 1785.3704913527722 and parameters: {'model_name': 'SimpleImputer', 'strategy': 'mean'}. Best is trial 9 with value: 1785.3704913527722.
[I 2023-12-12 15:26:25,500] Trial 41 finished with value: 1890.7950712192014 and parameters: {'model_name': 'SimpleImputer', 'strategy': 'most_frequent'}. Best is trial 9 with value: 1785.3704913527722.
[I 2023-12-12 15:26:25,660] Trial 40 finished with value: 1890.7950712192014 and parameters: {'model_name': 'SimpleImputer', 'strategy': 'most_frequent'}. Best is trial 9 with value: 1785.3704913527722.
[I 2023-12-12 15:26:25,963] Trial 53 finished with value: 1890.7950712192014 and parameters: {'model_name': 'SimpleImputer', 'strategy': 'most_frequent'}. Best is trial 9 with value: 1785.3704913527722.
[I 2023-12-12 15:26:26,223] Trial 99 finished with value: 1785.3704913527722 and parameters: {'model_name': 'SimpleImputer', 'strategy': 'mean'}. Best is trial 9 with value: 1785.3704913527722.
[I 2023-12-12 15:26:26,479] Trial 100 finished with value: 1785.3704913527722 and parameters: {'model_name': 'SimpleImputer', 'strategy': 'mean'}. Best is trial 9 with value: 1785.3704913527722.
[I 2023-12-12 15:26:26,723] Trial 96 finished with value: 1785.3704913527722 and parameters: {'model_name': 'SimpleImputer', 'strategy': 'mean'}. Best is trial 9 with value: 1785.3704913527722.
[I 2023-12-12 15:26:26,990] Trial 98 finished with value: 1785.3704913527722 and parameters: {'model_name': 'SimpleImputer', 'strategy': 'mean'}. Best is trial 9 with value: 1785.3704913527722.
[I 2023-12-12 15:26:27,233] Trial 55 finished with value: 1890.7950712192014 and parameters: {'model_name': 'SimpleImputer', 'strategy': 'most_frequent'}. Best is trial 9 with value: 1785.3704913527722.
[I 2023-12-12 15:26:27,537] Trial 66 finished with value: 1890.7950712192014 and parameters: {'model_name': 'SimpleImputer', 'strategy': 'most_frequent'}. Best is trial 9 with value: 1785.3704913527722.
[I 2023-12-12 15:26:27,829] Trial 64 finished with value: 1890.7950712192014 and parameters: {'model_name': 'SimpleImputer', 'strategy': 'most_frequent'}. Best is trial 9 with value: 1785.3704913527722.
[I 2023-12-12 15:26:28,144] Trial 57 finished with value: 1890.7950712192014 and parameters: {'model_name': 'SimpleImputer', 'strategy': 'most_frequent'}. Best is trial 9 with value: 1785.3704913527722.
[I 2023-12-12 15:26:28,598] Trial 67 finished with value: 1890.7950712192014 and parameters: {'model_name': 'SimpleImputer', 'strategy': 'most_frequent'}. Best is trial 9 with value: 1785.3704913527722.
[I 2023-12-12 15:26:29,030] Trial 104 finished with value: 1785.3704913527722 and parameters: {'model_name': 'SimpleImputer', 'strategy': 'mean'}. Best is trial 9 with value: 1785.3704913527722.
[I 2023-12-12 15:26:29,219] Trial 38 finished with value: 1890.7950712192014 and parameters: {'model_name': 'SimpleImputer', 'strategy': 'most_frequent'}. Best is trial 9 with value: 1785.3704913527722.
[I 2023-12-12 15:26:29,521] Trial 103 finished with value: 1785.3704913527722 and parameters: {'model_name': 'SimpleImputer', 'strategy': 'mean'}. Best is trial 9 with value: 1785.3704913527722.
[I 2023-12-12 15:26:29,862] Trial 101 finished with value: 1785.3704913527722 and parameters: {'model_name': 'SimpleImputer', 'strategy': 'mean'}. Best is trial 9 with value: 1785.3704913527722.
[I 2023-12-12 15:26:30,113] Trial 77 finished with value: 1890.7950712192014 and parameters: {'model_name': 'SimpleImputer', 'strategy': 'most_frequent'}. Best is trial 9 with value: 1785.3704913527722.
[I 2023-12-12 15:26:30,359] Trial 68 finished with value: 1890.7950712192014 and parameters: {'model_name': 'SimpleImputer', 'strategy': 'most_frequent'}. Best is trial 9 with value: 1785.3704913527722.
[I 2023-12-12 15:26:30,599] Trial 72 finished with value: 1890.7950712192014 and parameters: {'model_name': 'SimpleImputer', 'strategy': 'most_frequent'}. Best is trial 9 with value: 1785.3704913527722.
[I 2023-12-12 15:26:30,783] Trial 65 finished with value: 1890.7950712192014 and parameters: {'model_name': 'SimpleImputer', 'strategy': 'most_frequent'}. Best is trial 9 with value: 1785.3704913527722.
[I 2023-12-12 15:26:31,057] Trial 102 finished with value: 1785.3704913527722 and parameters: {'model_name': 'SimpleImputer', 'strategy': 'mean'}. Best is trial 9 with value: 1785.3704913527722.
[I 2023-12-12 15:26:31,273] Trial 71 finished with value: 1890.7950712192014 and parameters: {'model_name': 'SimpleImputer', 'strategy': 'most_frequent'}. Best is trial 9 with value: 1785.3704913527722.
[I 2023-12-12 15:26:31,531] Trial 73 finished with value: 1890.7950712192014 and parameters: {'model_name': 'SimpleImputer', 'strategy': 'most_frequent'}. Best is trial 9 with value: 1785.3704913527722.
[I 2023-12-12 15:26:31,832] Trial 110 finished with value: 1785.3704913527722 and parameters: {'model_name': 'SimpleImputer', 'strategy': 'mean'}. Best is trial 9 with value: 1785.3704913527722.
[I 2023-12-12 15:26:32,045] Trial 106 finished with value: 1785.3704913527722 and parameters: {'model_name': 'SimpleImputer', 'strategy': 'mean'}. Best is trial 9 with value: 1785.3704913527722.
[I 2023-12-12 15:26:32,219] Trial 69 finished with value: 1890.7950712192014 and parameters: {'model_name': 'SimpleImputer', 'strategy': 'most_frequent'}. Best is trial 9 with value: 1785.3704913527722.
[I 2023-12-12 15:26:32,472] Trial 105 finished with value: 1785.3704913527722 and parameters: {'model_name': 'SimpleImputer', 'strategy': 'mean'}. Best is trial 9 with value: 1785.3704913527722.
[I 2023-12-12 15:26:32,689] Trial 107 finished with value: 1785.3704913527722 and parameters: {'model_name': 'SimpleImputer', 'strategy': 'mean'}. Best is trial 9 with value: 1785.3704913527722.
[I 2023-12-12 15:26:32,870] Trial 109 finished with value: 1785.3704913527722 and parameters: {'model_name': 'SimpleImputer', 'strategy': 'mean'}. Best is trial 9 with value: 1785.3704913527722.
[I 2023-12-12 15:26:33,068] Trial 79 finished with value: 1890.7950712192014 and parameters: {'model_name': 'SimpleImputer', 'strategy': 'most_frequent'}. Best is trial 9 with value: 1785.3704913527722.
[I 2023-12-12 15:26:33,312] Trial 74 finished with value: 1890.7950712192014 and parameters: {'model_name': 'SimpleImputer', 'strategy': 'most_frequent'}. Best is trial 9 with value: 1785.3704913527722.
[I 2023-12-12 15:26:33,568] Trial 111 finished with value: 1785.3704913527722 and parameters: {'model_name': 'SimpleImputer', 'strategy': 'mean'}. Best is trial 9 with value: 1785.3704913527722.
[I 2023-12-12 15:26:33,859] Trial 70 finished with value: 1890.7950712192014 and parameters: {'model_name': 'SimpleImputer', 'strategy': 'most_frequent'}. Best is trial 9 with value: 1785.3704913527722.
[I 2023-12-12 15:26:34,073] Trial 113 finished with value: 1785.3704913527722 and parameters: {'model_name': 'SimpleImputer', 'strategy': 'mean'}. Best is trial 9 with value: 1785.3704913527722.
[I 2023-12-12 15:26:34,304] Trial 115 finished with value: 1785.3704913527722 and parameters: {'model_name': 'SimpleImputer', 'strategy': 'mean'}. Best is trial 9 with value: 1785.3704913527722.
[I 2023-12-12 15:26:34,589] Trial 108 finished with value: 1785.3704913527722 and parameters: {'model_name': 'SimpleImputer', 'strategy': 'mean'}. Best is trial 9 with value: 1785.3704913527722.
[I 2023-12-12 15:26:34,798] Trial 112 finished with value: 1785.3704913527722 and parameters: {'model_name': 'SimpleImputer', 'strategy': 'mean'}. Best is trial 9 with value: 1785.3704913527722.
[I 2023-12-12 15:26:35,149] Trial 78 finished with value: 1890.7950712192014 and parameters: {'model_name': 'SimpleImputer', 'strategy': 'most_frequent'}. Best is trial 9 with value: 1785.3704913527722.
