[I 2024-03-01 07:45:41,672] Trial 196 finished with value: inf and parameters: {'model_name': 'GAIN', 'batch_size': 7, 'hint_rate': 0.01, 'alpha': 10, 'iterations': 50548}. Best is trial 17 with value: 4.15507044270351.
[I 2024-03-01 07:46:01,092] Trial 66 finished with value: inf and parameters: {'model_name': 'GAIN', 'batch_size': 19, 'hint_rate': 0.9400000000000001, 'alpha': 27, 'iterations': 52743}. Best is trial 17 with value: 4.15507044270351.
[I 2024-03-01 07:46:47,067] Trial 193 finished with value: inf and parameters: {'model_name': 'GAIN', 'batch_size': 7, 'hint_rate': 0.09, 'alpha': 16, 'iterations': 54197}. Best is trial 17 with value: 4.15507044270351.
[I 2024-03-01 07:47:13,121] Trial 174 finished with value: inf and parameters: {'model_name': 'GAIN', 'batch_size': 5, 'hint_rate': 0.09999999999999999, 'alpha': 1, 'iterations': 56170}. Best is trial 17 with value: 4.15507044270351.
[I 2024-03-01 07:49:06,699] Trial 192 finished with value: inf and parameters: {'model_name': 'GAIN', 'batch_size': 10, 'hint_rate': 0.01, 'alpha': 7, 'iterations': 65386}. Best is trial 17 with value: 4.15507044270351.
[I 2024-03-01 07:49:24,813] Trial 164 finished with value: inf and parameters: {'model_name': 'GAIN', 'batch_size': 6, 'hint_rate': 0.08, 'alpha': 4, 'iterations': 66772}. Best is trial 17 with value: 4.15507044270351.
[I 2024-03-01 07:49:55,477] Trial 169 finished with value: inf and parameters: {'model_name': 'GAIN', 'batch_size': 7, 'hint_rate': 0.05, 'alpha': 13, 'iterations': 69617}. Best is trial 17 with value: 4.15507044270351.
[I 2024-03-01 07:51:36,777] Trial 186 finished with value: inf and parameters: {'model_name': 'GAIN', 'batch_size': 73, 'hint_rate': 0.04, 'alpha': 2, 'iterations': 67333}. Best is trial 17 with value: 4.15507044270351.
[I 2024-03-01 07:51:42,287] Trial 194 finished with value: inf and parameters: {'model_name': 'GAIN', 'batch_size': 10, 'hint_rate': 0.09999999999999999, 'alpha': 0, 'iterations': 81562}. Best is trial 17 with value: 4.15507044270351.
[I 2024-03-01 07:52:00,072] Trial 191 finished with value: inf and parameters: {'model_name': 'GAIN', 'batch_size': 59, 'hint_rate': 0.02, 'alpha': 2, 'iterations': 72847}. Best is trial 17 with value: 4.15507044270351.
[I 2024-03-01 07:52:09,833] Trial 195 finished with value: inf and parameters: {'model_name': 'GAIN', 'batch_size': 8, 'hint_rate': 0.06999999999999999, 'alpha': 4, 'iterations': 85102}. Best is trial 17 with value: 4.15507044270351.
[I 2024-03-01 07:52:24,931] Trial 185 finished with value: inf and parameters: {'model_name': 'GAIN', 'batch_size': 10, 'hint_rate': 0.09, 'alpha': 13, 'iterations': 88833}. Best is trial 17 with value: 4.15507044270351.
[I 2024-03-01 07:52:40,118] Trial 177 finished with value: inf and parameters: {'model_name': 'GAIN', 'batch_size': 8, 'hint_rate': 0.02, 'alpha': 4, 'iterations': 99116}. Best is trial 17 with value: 4.15507044270351.
[I 2024-03-01 07:52:40,930] Trial 173 finished with value: inf and parameters: {'model_name': 'GAIN', 'batch_size': 5, 'hint_rate': 0.09999999999999999, 'alpha': 1, 'iterations': 98337}. Best is trial 17 with value: 4.15507044270351.
