[I 2024-02-11 05:25:38,139] Trial 179 finished with value: 1.8352694185708014 and parameters: {'model_name': 'IterativeImputer', 'sample_posterior': False, 'initial_strategy': 'mean', 'imputation_order': 'arabic'}. Best is trial 39 with value: 1.8352694185708014.
[I 2024-02-11 05:25:41,581] Trial 180 finished with value: 1.8352694185708014 and parameters: {'model_name': 'IterativeImputer', 'sample_posterior': False, 'initial_strategy': 'mean', 'imputation_order': 'arabic'}. Best is trial 39 with value: 1.8352694185708014.
[I 2024-02-11 05:25:48,963] Trial 183 finished with value: 1.8352710238711385 and parameters: {'model_name': 'IterativeImputer', 'sample_posterior': False, 'initial_strategy': 'constant', 'imputation_order': 'roman'}. Best is trial 39 with value: 1.8352694185708014.
[I 2024-02-11 05:25:50,489] Trial 182 finished with value: 1.8352694185708014 and parameters: {'model_name': 'IterativeImputer', 'sample_posterior': False, 'initial_strategy': 'mean', 'imputation_order': 'arabic'}. Best is trial 39 with value: 1.8352694185708014.
[I 2024-02-11 05:26:13,392] Trial 188 finished with value: 1.8352710238711385 and parameters: {'model_name': 'IterativeImputer', 'sample_posterior': False, 'initial_strategy': 'constant', 'imputation_order': 'roman'}. Best is trial 39 with value: 1.8352694185708014.
[I 2024-02-11 05:26:19,969] Trial 181 finished with value: 1.835270422600717 and parameters: {'model_name': 'IterativeImputer', 'sample_posterior': False, 'initial_strategy': 'mean', 'imputation_order': 'descending'}. Best is trial 39 with value: 1.8352694185708014.
[I 2024-02-11 05:26:33,949] Trial 185 finished with value: 1.8352705742115618 and parameters: {'model_name': 'IterativeImputer', 'sample_posterior': False, 'initial_strategy': 'constant', 'imputation_order': 'descending'}. Best is trial 39 with value: 1.8352694185708014.
[I 2024-02-11 05:27:12,511] Trial 126 finished with value: 2.5588497893376045 and parameters: {'model_name': 'IterativeImputer', 'sample_posterior': True, 'initial_strategy': 'mean', 'imputation_order': 'arabic'}. Best is trial 39 with value: 1.8352694185708014.
[I 2024-02-11 05:28:07,110] Trial 127 finished with value: 2.4994616343876497 and parameters: {'model_name': 'IterativeImputer', 'sample_posterior': True, 'initial_strategy': 'mean', 'imputation_order': 'arabic'}. Best is trial 39 with value: 1.8352694185708014.
[I 2024-02-11 05:28:19,147] Trial 128 finished with value: 2.4884061386905816 and parameters: {'model_name': 'IterativeImputer', 'sample_posterior': True, 'initial_strategy': 'mean', 'imputation_order': 'arabic'}. Best is trial 39 with value: 1.8352694185708014.
[I 2024-02-11 05:28:38,060] Trial 68 finished with value: 6.683184752252137 and parameters: {'model_name': 'RandomForestImputer', 'max_iter': 46, 'decreasing': False, 'min_samples_split': 0.1, 'min_samples_leaf': 0.8, 'max_features': 0.6, 'warm_start': False}. Best is trial 39 with value: 1.8352694185708014.
[I 2024-02-11 05:30:54,267] Trial 46 finished with value: inf and parameters: {'model_name': 'GAIN', 'batch_size': 2, 'hint_rate': 0.14, 'alpha': 64, 'iterations': 8498}. Best is trial 39 with value: 1.8352694185708014.
[I 2024-02-11 05:32:09,796] Trial 13 finished with value: 6.530974535132652 and parameters: {'model_name': 'RandomForestImputer', 'max_iter': 63, 'decreasing': True, 'min_samples_split': 0.8, 'min_samples_leaf': 0.30000000000000004, 'max_features': 0.2, 'warm_start': False}. Best is trial 39 with value: 1.8352694185708014.
[I 2024-02-11 05:33:13,675] Trial 44 finished with value: 5.84351874260884 and parameters: {'model_name': 'RandomForestImputer', 'max_iter': 50, 'decreasing': True, 'min_samples_split': 1.0, 'min_samples_leaf': 0.1, 'max_features': 0.5, 'warm_start': False}. Best is trial 39 with value: 1.8352694185708014.
[I 2024-02-11 05:40:13,800] Trial 199 finished with value: 6.683027324821535 and parameters: {'model_name': 'RandomForestImputer', 'max_iter': 53, 'decreasing': True, 'min_samples_split': 1.0, 'min_samples_leaf': 0.6, 'max_features': 0.9, 'warm_start': False}. Best is trial 39 with value: 1.8352694185708014.
[I 2024-02-11 05:40:27,383] Trial 193 finished with value: 5.915123530476409 and parameters: {'model_name': 'RandomForestImputer', 'max_iter': 45, 'decreasing': True, 'min_samples_split': 1.0, 'min_samples_leaf': 0.1, 'max_features': 0.4, 'warm_start': False}. Best is trial 39 with value: 1.8352694185708014.
[I 2024-02-11 05:41:43,264] Trial 77 finished with value: 6.181302481858464 and parameters: {'model_name': 'GAIN', 'batch_size': 1, 'hint_rate': 0.73, 'alpha': 77, 'iterations': 1827}. Best is trial 39 with value: 1.8352694185708014.
[I 2024-02-11 05:42:28,820] Trial 184 finished with value: 5.9063180435006615 and parameters: {'model_name': 'RandomForestImputer', 'max_iter': 48, 'decreasing': True, 'min_samples_split': 1.0, 'min_samples_leaf': 0.1, 'max_features': 0.4, 'warm_start': False}. Best is trial 39 with value: 1.8352694185708014.
[I 2024-02-11 05:43:37,723] Trial 196 finished with value: 5.92391676508601 and parameters: {'model_name': 'RandomForestImputer', 'max_iter': 51, 'decreasing': True, 'min_samples_split': 1.0, 'min_samples_leaf': 0.1, 'max_features': 0.4, 'warm_start': False}. Best is trial 39 with value: 1.8352694185708014.
[I 2024-02-11 05:43:55,252] Trial 55 finished with value: inf and parameters: {'model_name': 'GAIN', 'batch_size': 5, 'hint_rate': 0.3, 'alpha': 45, 'iterations': 21501}. Best is trial 39 with value: 1.8352694185708014.
[I 2024-02-11 05:44:26,515] Trial 192 finished with value: 5.909187606627434 and parameters: {'model_name': 'RandomForestImputer', 'max_iter': 70, 'decreasing': True, 'min_samples_split': 1.0, 'min_samples_leaf': 0.1, 'max_features': 0.4, 'warm_start': False}. Best is trial 39 with value: 1.8352694185708014.
[I 2024-02-11 05:44:28,663] Trial 195 finished with value: 5.913605661653969 and parameters: {'model_name': 'RandomForestImputer', 'max_iter': 58, 'decreasing': True, 'min_samples_split': 1.0, 'min_samples_leaf': 0.1, 'max_features': 0.4, 'warm_start': False}. Best is trial 39 with value: 1.8352694185708014.
[I 2024-02-11 05:46:03,294] Trial 197 finished with value: 5.694084423228582 and parameters: {'model_name': 'RandomForestImputer', 'max_iter': 54, 'decreasing': True, 'min_samples_split': 1.0, 'min_samples_leaf': 0.1, 'max_features': 0.9, 'warm_start': False}. Best is trial 39 with value: 1.8352694185708014.
[I 2024-02-11 05:47:51,243] Trial 194 finished with value: 5.919490812836882 and parameters: {'model_name': 'RandomForestImputer', 'max_iter': 90, 'decreasing': True, 'min_samples_split': 1.0, 'min_samples_leaf': 0.1, 'max_features': 0.4, 'warm_start': False}. Best is trial 39 with value: 1.8352694185708014.
[I 2024-02-11 05:48:22,133] Trial 187 finished with value: 5.914520660690803 and parameters: {'model_name': 'RandomForestImputer', 'max_iter': 98, 'decreasing': True, 'min_samples_split': 1.0, 'min_samples_leaf': 0.1, 'max_features': 0.4, 'warm_start': False}. Best is trial 39 with value: 1.8352694185708014.
[I 2024-02-11 05:48:25,416] Trial 190 finished with value: 5.909499343827916 and parameters: {'model_name': 'RandomForestImputer', 'max_iter': 94, 'decreasing': True, 'min_samples_split': 1.0, 'min_samples_leaf': 0.1, 'max_features': 0.4, 'warm_start': False}. Best is trial 39 with value: 1.8352694185708014.
[I 2024-02-11 05:48:35,915] Trial 186 finished with value: 5.906389034716012 and parameters: {'model_name': 'RandomForestImputer', 'max_iter': 88, 'decreasing': True, 'min_samples_split': 0.9, 'min_samples_leaf': 0.1, 'max_features': 0.4, 'warm_start': False}. Best is trial 39 with value: 1.8352694185708014.
[I 2024-02-11 05:48:37,380] Trial 191 finished with value: 5.90688306264516 and parameters: {'model_name': 'RandomForestImputer', 'max_iter': 86, 'decreasing': True, 'min_samples_split': 1.0, 'min_samples_leaf': 0.1, 'max_features': 0.4, 'warm_start': False}. Best is trial 39 with value: 1.8352694185708014.
[I 2024-02-11 05:49:08,222] Trial 189 finished with value: 5.906739308118524 and parameters: {'model_name': 'RandomForestImputer', 'max_iter': 100, 'decreasing': True, 'min_samples_split': 0.9, 'min_samples_leaf': 0.1, 'max_features': 0.4, 'warm_start': False}. Best is trial 39 with value: 1.8352694185708014.
[I 2024-02-11 05:49:16,784] Trial 198 finished with value: 5.915114795970001 and parameters: {'model_name': 'RandomForestImputer', 'max_iter': 91, 'decreasing': True, 'min_samples_split': 1.0, 'min_samples_leaf': 0.1, 'max_features': 0.4, 'warm_start': False}. Best is trial 39 with value: 1.8352694185708014.
[I 2024-02-11 05:49:22,990] Trial 43 finished with value: inf and parameters: {'model_name': 'GAIN', 'batch_size': 10, 'hint_rate': 0.37, 'alpha': 84, 'iterations': 36304}. Best is trial 39 with value: 1.8352694185708014.
