Run: 3
/cm/local/apps/slurm/var/spool/job691193/slurm_script: line 23: /common/ketrong/minconda3/etc/profile.d/conda.sh: No such file or directory
/cm/local/apps/slurm/var/spool/job691193/slurm_script: line 26: $'\nconda create --name tpot2devenv -c conda-forge python=3.10\n': command not found
/cm/local/apps/slurm/var/spool/job691193/slurm_script: line 31: $'\npip install -r requirements.txt\n': command not found
RunStart
2024-02-27 21:48:33.114383: I tensorflow/core/util/port.cc:113] oneDNN custom operations are on. You may see slightly different numerical results due to floating-point round-off errors from different computation orders. To turn them off, set the environment variable `TF_ENABLE_ONEDNN_OPTS=0`.
2024-02-27 21:48:33.149508: E external/local_xla/xla/stream_executor/cuda/cuda_dnn.cc:9261] Unable to register cuDNN factory: Attempting to register factory for plugin cuDNN when one has already been registered
2024-02-27 21:48:33.149530: E external/local_xla/xla/stream_executor/cuda/cuda_fft.cc:607] Unable to register cuFFT factory: Attempting to register factory for plugin cuFFT when one has already been registered
2024-02-27 21:48:33.150671: E external/local_xla/xla/stream_executor/cuda/cuda_blas.cc:1515] Unable to register cuBLAS factory: Attempting to register factory for plugin cuBLAS when one has already been registered
2024-02-27 21:48:33.156130: I tensorflow/core/platform/cpu_feature_guard.cc:182] This TensorFlow binary is optimized to use available CPU instructions in performance-critical operations.
To enable the following instructions: AVX2 AVX512F AVX512_VNNI FMA, in other operations, rebuild TensorFlow with the appropriate compiler flags.
2024-02-27 21:48:35.896557: W tensorflow/compiler/tf2tensorrt/utils/py_utils.cc:38] TF-TRT Warning: Could not find TensorRT
WARNING:tensorflow:From /home/ketrong/miniconda3/envs/tpot2devenv/lib/python3.10/site-packages/tensorflow/python/compat/v2_compat.py:108: disable_resource_variables (from tensorflow.python.ops.variable_scope) is deprecated and will be removed in a future version.
Instructions for updating:
non-resource variables are not supported in the long term
starting loops
working on 
logs/2309/tpot2_base_normal_MCAR_0.3
0.6043319702148438
loading data
logs/2309/tpot2_base_normal_MCAR_0.3/data/2309_True.pkl
12783     16100.0
20118     42800.0
20745     15000.0
8610      28300.0
12579    194200.0
           ...   
16095     26400.0
49       169500.0
11743    142200.0
2238     500001.0
14896     74800.0
Name: price, Length: 20505, dtype: float64
            0  ...         7
0       146.0  ...  0.666667
1       137.0  ...  1.000000
2        38.0  ...  1.000000
3      4805.0  ...  0.596491
4      2047.0  ...  0.500000
...       ...  ...       ...
20500    86.0  ...  0.000000
20501   670.0  ...  0.222222
20502   408.0  ...  0.812500
20503  2606.0  ...  0.282051
20504  6580.0  ...  0.285714

[20505 rows x 8 columns]
           0  ...         7
0      161.0  ...  1.000000
1       87.0  ...  0.500000
2      123.0  ...  1.000000
3     1775.0  ...  0.428571
4      478.0  ...  0.250000
...      ...  ...       ...
2274  1017.0  ...  0.538462
2275   182.0  ...  0.875000
2276  1058.0  ...  1.000000
2277    74.0  ...  0.000000
2278   509.0  ...  0.777778

[2279 rows x 8 columns]
running experiment 1/3 - Does large hyperparameter space improve reconstruction accuracy over simple
[I 2024-02-27 21:48:46,438] A new study created in memory with name: no-name-ca4624c9-088a-41e2-8681-34241a701a29
[I 2024-02-27 21:48:47,449] Trial 3 finished with value: 2541.9945877854916 and parameters: {'model_name': 'SimpleImputer', 'strategy': 'constant'}. Best is trial 3 with value: 2541.9945877854916.
[I 2024-02-27 21:48:47,759] Trial 1 finished with value: 2541.9945877854916 and parameters: {'model_name': 'SimpleImputer', 'strategy': 'constant'}. Best is trial 3 with value: 2541.9945877854916.
[I 2024-02-27 21:48:48,239] Trial 0 finished with value: 2541.9945877854916 and parameters: {'model_name': 'SimpleImputer', 'strategy': 'constant'}. Best is trial 3 with value: 2541.9945877854916.
[I 2024-02-27 21:48:48,497] Trial 4 finished with value: 2541.9945877854916 and parameters: {'model_name': 'SimpleImputer', 'strategy': 'constant'}. Best is trial 3 with value: 2541.9945877854916.
[I 2024-02-27 21:48:48,842] Trial 14 finished with value: 2541.9945877854916 and parameters: {'model_name': 'SimpleImputer', 'strategy': 'constant'}. Best is trial 3 with value: 2541.9945877854916.
[I 2024-02-27 21:48:49,154] Trial 18 finished with value: 2541.9945877854916 and parameters: {'model_name': 'SimpleImputer', 'strategy': 'constant'}. Best is trial 3 with value: 2541.9945877854916.
[I 2024-02-27 21:48:49,440] Trial 9 finished with value: 2541.9945877854916 and parameters: {'model_name': 'SimpleImputer', 'strategy': 'constant'}. Best is trial 3 with value: 2541.9945877854916.
[I 2024-02-27 21:48:49,752] Trial 19 finished with value: 2541.9945877854916 and parameters: {'model_name': 'SimpleImputer', 'strategy': 'constant'}. Best is trial 3 with value: 2541.9945877854916.
[I 2024-02-27 21:48:50,036] Trial 15 finished with value: 2541.9945877854916 and parameters: {'model_name': 'SimpleImputer', 'strategy': 'constant'}. Best is trial 3 with value: 2541.9945877854916.
[I 2024-02-27 21:48:50,285] Trial 16 finished with value: 2541.9945877854916 and parameters: {'model_name': 'SimpleImputer', 'strategy': 'constant'}. Best is trial 3 with value: 2541.9945877854916.
[I 2024-02-27 21:48:50,651] Trial 20 finished with value: 2541.9945877854916 and parameters: {'model_name': 'SimpleImputer', 'strategy': 'constant'}. Best is trial 3 with value: 2541.9945877854916.
[I 2024-02-27 21:48:50,901] Trial 6 finished with value: 2406.7086271118064 and parameters: {'model_name': 'SimpleImputer', 'strategy': 'mean'}. Best is trial 6 with value: 2406.7086271118064.
[I 2024-02-27 21:48:51,252] Trial 10 finished with value: 2406.7086271118064 and parameters: {'model_name': 'SimpleImputer', 'strategy': 'mean'}. Best is trial 6 with value: 2406.7086271118064.
[I 2024-02-27 21:48:51,644] Trial 26 finished with value: 2541.9945877854916 and parameters: {'model_name': 'SimpleImputer', 'strategy': 'constant'}. Best is trial 6 with value: 2406.7086271118064.
[I 2024-02-27 21:48:51,877] Trial 29 finished with value: 2541.9945877854916 and parameters: {'model_name': 'SimpleImputer', 'strategy': 'constant'}. Best is trial 6 with value: 2406.7086271118064.
[I 2024-02-27 21:48:52,086] Trial 34 finished with value: 2541.9945877854916 and parameters: {'model_name': 'SimpleImputer', 'strategy': 'constant'}. Best is trial 6 with value: 2406.7086271118064.
[I 2024-02-27 21:48:52,565] Trial 24 finished with value: 2406.7086271118064 and parameters: {'model_name': 'SimpleImputer', 'strategy': 'mean'}. Best is trial 6 with value: 2406.7086271118064.
[I 2024-02-27 21:48:53,054] Trial 48 finished with value: 2541.9945877854916 and parameters: {'model_name': 'SimpleImputer', 'strategy': 'constant'}. Best is trial 6 with value: 2406.7086271118064.
[I 2024-02-27 21:48:53,271] Trial 40 finished with value: 2406.7086271118064 and parameters: {'model_name': 'SimpleImputer', 'strategy': 'mean'}. Best is trial 6 with value: 2406.7086271118064.
[I 2024-02-27 21:48:53,550] Trial 30 finished with value: 2406.7086271118064 and parameters: {'model_name': 'SimpleImputer', 'strategy': 'mean'}. Best is trial 6 with value: 2406.7086271118064.
[I 2024-02-27 21:48:53,815] Trial 28 finished with value: 2406.7086271118064 and parameters: {'model_name': 'SimpleImputer', 'strategy': 'mean'}. Best is trial 6 with value: 2406.7086271118064.
[I 2024-02-27 21:48:54,102] Trial 45 finished with value: 2406.7086271118064 and parameters: {'model_name': 'SimpleImputer', 'strategy': 'mean'}. Best is trial 6 with value: 2406.7086271118064.
[I 2024-02-27 21:48:54,533] Trial 31 finished with value: 2406.7086271118064 and parameters: {'model_name': 'SimpleImputer', 'strategy': 'mean'}. Best is trial 6 with value: 2406.7086271118064.
[I 2024-02-27 21:48:54,885] Trial 32 finished with value: 2406.7086271118064 and parameters: {'model_name': 'SimpleImputer', 'strategy': 'mean'}. Best is trial 6 with value: 2406.7086271118064.
[I 2024-02-27 21:48:55,351] Trial 53 finished with value: 2541.9945877854916 and parameters: {'model_name': 'SimpleImputer', 'strategy': 'constant'}. Best is trial 6 with value: 2406.7086271118064.
[I 2024-02-27 21:48:55,611] Trial 11 finished with value: 2520.0960273541223 and parameters: {'model_name': 'SimpleImputer', 'strategy': 'median'}. Best is trial 6 with value: 2406.7086271118064.
[I 2024-02-27 21:48:55,999] Trial 33 finished with value: 2520.0960273541223 and parameters: {'model_name': 'SimpleImputer', 'strategy': 'median'}. Best is trial 6 with value: 2406.7086271118064.
[I 2024-02-27 21:48:56,228] Trial 7 finished with value: 2520.0960273541223 and parameters: {'model_name': 'SimpleImputer', 'strategy': 'median'}. Best is trial 6 with value: 2406.7086271118064.
[I 2024-02-27 21:48:56,439] Trial 8 finished with value: 2520.0960273541223 and parameters: {'model_name': 'SimpleImputer', 'strategy': 'median'}. Best is trial 6 with value: 2406.7086271118064.
[I 2024-02-27 21:48:56,906] Trial 25 finished with value: 2520.0960273541223 and parameters: {'model_name': 'SimpleImputer', 'strategy': 'median'}. Best is trial 6 with value: 2406.7086271118064.
[I 2024-02-27 21:48:57,100] Trial 50 finished with value: 2406.7086271118064 and parameters: {'model_name': 'SimpleImputer', 'strategy': 'mean'}. Best is trial 6 with value: 2406.7086271118064.
[I 2024-02-27 21:48:57,330] Trial 23 finished with value: 2520.0960273541223 and parameters: {'model_name': 'SimpleImputer', 'strategy': 'median'}. Best is trial 6 with value: 2406.7086271118064.
[I 2024-02-27 21:48:57,561] Trial 54 finished with value: 2406.7086271118064 and parameters: {'model_name': 'SimpleImputer', 'strategy': 'mean'}. Best is trial 6 with value: 2406.7086271118064.
[I 2024-02-27 21:48:57,857] Trial 60 finished with value: 2406.7086271118064 and parameters: {'model_name': 'SimpleImputer', 'strategy': 'mean'}. Best is trial 6 with value: 2406.7086271118064.
[I 2024-02-27 21:48:58,096] Trial 47 finished with value: 2520.0960273541223 and parameters: {'model_name': 'SimpleImputer', 'strategy': 'median'}. Best is trial 6 with value: 2406.7086271118064.
[I 2024-02-27 21:48:58,309] Trial 17 finished with value: 2520.0960273541223 and parameters: {'model_name': 'SimpleImputer', 'strategy': 'median'}. Best is trial 6 with value: 2406.7086271118064.
[I 2024-02-27 21:48:58,478] Trial 51 finished with value: 2406.7086271118064 and parameters: {'model_name': 'SimpleImputer', 'strategy': 'mean'}. Best is trial 6 with value: 2406.7086271118064.
[I 2024-02-27 21:48:58,735] Trial 39 finished with value: 2520.0960273541223 and parameters: {'model_name': 'SimpleImputer', 'strategy': 'median'}. Best is trial 6 with value: 2406.7086271118064.
[I 2024-02-27 21:48:59,027] Trial 36 finished with value: 2520.0960273541223 and parameters: {'model_name': 'SimpleImputer', 'strategy': 'median'}. Best is trial 6 with value: 2406.7086271118064.
[I 2024-02-27 21:48:59,246] Trial 58 finished with value: 2406.7086271118064 and parameters: {'model_name': 'SimpleImputer', 'strategy': 'mean'}. Best is trial 6 with value: 2406.7086271118064.
[I 2024-02-27 21:48:59,502] Trial 35 finished with value: 2520.0960273541223 and parameters: {'model_name': 'SimpleImputer', 'strategy': 'median'}. Best is trial 6 with value: 2406.7086271118064.
[I 2024-02-27 21:48:59,950] Trial 63 finished with value: 2406.7086271118064 and parameters: {'model_name': 'SimpleImputer', 'strategy': 'mean'}. Best is trial 6 with value: 2406.7086271118064.
[I 2024-02-27 21:49:00,256] Trial 49 finished with value: 2520.0960273541223 and parameters: {'model_name': 'SimpleImputer', 'strategy': 'median'}. Best is trial 6 with value: 2406.7086271118064.
[I 2024-02-27 21:49:00,612] Trial 61 finished with value: 2406.7086271118064 and parameters: {'model_name': 'SimpleImputer', 'strategy': 'mean'}. Best is trial 6 with value: 2406.7086271118064.
[I 2024-02-27 21:49:00,885] Trial 59 finished with value: 2406.7086271118064 and parameters: {'model_name': 'SimpleImputer', 'strategy': 'mean'}. Best is trial 6 with value: 2406.7086271118064.
[I 2024-02-27 21:49:01,243] Trial 64 finished with value: 2406.7086271118064 and parameters: {'model_name': 'SimpleImputer', 'strategy': 'mean'}. Best is trial 6 with value: 2406.7086271118064.
[I 2024-02-27 21:49:01,569] Trial 62 finished with value: 2406.7086271118064 and parameters: {'model_name': 'SimpleImputer', 'strategy': 'mean'}. Best is trial 6 with value: 2406.7086271118064.
[I 2024-02-27 21:49:01,774] Trial 55 finished with value: 2520.0960273541223 and parameters: {'model_name': 'SimpleImputer', 'strategy': 'median'}. Best is trial 6 with value: 2406.7086271118064.
[I 2024-02-27 21:49:01,953] Trial 52 finished with value: 2520.0960273541223 and parameters: {'model_name': 'SimpleImputer', 'strategy': 'median'}. Best is trial 6 with value: 2406.7086271118064.
[I 2024-02-27 21:49:02,290] Trial 56 finished with value: 2520.0960273541223 and parameters: {'model_name': 'SimpleImputer', 'strategy': 'median'}. Best is trial 6 with value: 2406.7086271118064.
[I 2024-02-27 21:49:02,621] Trial 65 finished with value: 2406.7086271118064 and parameters: {'model_name': 'SimpleImputer', 'strategy': 'mean'}. Best is trial 6 with value: 2406.7086271118064.
[I 2024-02-27 21:49:03,450] Trial 66 finished with value: 2520.0960273541223 and parameters: {'model_name': 'SimpleImputer', 'strategy': 'median'}. Best is trial 6 with value: 2406.7086271118064.
[I 2024-02-27 21:49:03,669] Trial 78 finished with value: 2406.7086271118064 and parameters: {'model_name': 'SimpleImputer', 'strategy': 'mean'}. Best is trial 6 with value: 2406.7086271118064.
[I 2024-02-27 21:49:03,963] Trial 67 finished with value: 2520.0960273541223 and parameters: {'model_name': 'SimpleImputer', 'strategy': 'median'}. Best is trial 6 with value: 2406.7086271118064.
[I 2024-02-27 21:49:04,210] Trial 21 finished with value: 2541.9945877854916 and parameters: {'model_name': 'SimpleImputer', 'strategy': 'most_frequent'}. Best is trial 6 with value: 2406.7086271118064.
[I 2024-02-27 21:49:04,379] Trial 5 finished with value: 2541.9945877854916 and parameters: {'model_name': 'SimpleImputer', 'strategy': 'most_frequent'}. Best is trial 6 with value: 2406.7086271118064.
[I 2024-02-27 21:49:04,805] Trial 13 finished with value: 2541.9945877854916 and parameters: {'model_name': 'SimpleImputer', 'strategy': 'most_frequent'}. Best is trial 6 with value: 2406.7086271118064.
[I 2024-02-27 21:49:05,157] Trial 71 finished with value: 2520.0960273541223 and parameters: {'model_name': 'SimpleImputer', 'strategy': 'median'}. Best is trial 6 with value: 2406.7086271118064.
[I 2024-02-27 21:49:05,525] Trial 22 finished with value: 2541.9945877854916 and parameters: {'model_name': 'SimpleImputer', 'strategy': 'most_frequent'}. Best is trial 6 with value: 2406.7086271118064.
[I 2024-02-27 21:49:05,875] Trial 12 finished with value: 2541.9945877854916 and parameters: {'model_name': 'SimpleImputer', 'strategy': 'most_frequent'}. Best is trial 6 with value: 2406.7086271118064.
[I 2024-02-27 21:49:06,335] Trial 2 finished with value: 2541.9945877854916 and parameters: {'model_name': 'SimpleImputer', 'strategy': 'most_frequent'}. Best is trial 6 with value: 2406.7086271118064.
[I 2024-02-27 21:49:06,652] Trial 38 finished with value: 2541.9945877854916 and parameters: {'model_name': 'SimpleImputer', 'strategy': 'most_frequent'}. Best is trial 6 with value: 2406.7086271118064.
[I 2024-02-27 21:49:07,102] Trial 46 finished with value: 2541.9945877854916 and parameters: {'model_name': 'SimpleImputer', 'strategy': 'most_frequent'}. Best is trial 6 with value: 2406.7086271118064.
[I 2024-02-27 21:49:07,426] Trial 57 finished with value: 2541.9945877854916 and parameters: {'model_name': 'SimpleImputer', 'strategy': 'most_frequent'}. Best is trial 6 with value: 2406.7086271118064.
[I 2024-02-27 21:49:07,850] Trial 37 finished with value: 2541.9945877854916 and parameters: {'model_name': 'SimpleImputer', 'strategy': 'most_frequent'}. Best is trial 6 with value: 2406.7086271118064.
[I 2024-02-27 21:49:08,123] Trial 41 finished with value: 2541.9945877854916 and parameters: {'model_name': 'SimpleImputer', 'strategy': 'most_frequent'}. Best is trial 6 with value: 2406.7086271118064.
[I 2024-02-27 21:49:08,495] Trial 44 finished with value: 2541.9945877854916 and parameters: {'model_name': 'SimpleImputer', 'strategy': 'most_frequent'}. Best is trial 6 with value: 2406.7086271118064.
[I 2024-02-27 21:49:08,781] Trial 27 finished with value: 2541.9945877854916 and parameters: {'model_name': 'SimpleImputer', 'strategy': 'most_frequent'}. Best is trial 6 with value: 2406.7086271118064.
[I 2024-02-27 21:49:09,126] Trial 42 finished with value: 2541.9945877854916 and parameters: {'model_name': 'SimpleImputer', 'strategy': 'most_frequent'}. Best is trial 6 with value: 2406.7086271118064.
[I 2024-02-27 21:49:09,379] Trial 43 finished with value: 2541.9945877854916 and parameters: {'model_name': 'SimpleImputer', 'strategy': 'most_frequent'}. Best is trial 6 with value: 2406.7086271118064.
[I 2024-02-27 21:49:10,072] Trial 107 finished with value: 2406.7086271118064 and parameters: {'model_name': 'SimpleImputer', 'strategy': 'mean'}. Best is trial 6 with value: 2406.7086271118064.
[I 2024-02-27 21:49:10,524] Trial 106 finished with value: 2406.7086271118064 and parameters: {'model_name': 'SimpleImputer', 'strategy': 'mean'}. Best is trial 6 with value: 2406.7086271118064.
[I 2024-02-27 21:49:11,133] Trial 108 finished with value: 2406.7086271118064 and parameters: {'model_name': 'SimpleImputer', 'strategy': 'mean'}. Best is trial 6 with value: 2406.7086271118064.
[I 2024-02-27 21:49:11,462] Trial 68 finished with value: 2541.9945877854916 and parameters: {'model_name': 'SimpleImputer', 'strategy': 'most_frequent'}. Best is trial 6 with value: 2406.7086271118064.
[I 2024-02-27 21:49:11,709] Trial 109 finished with value: 2406.7086271118064 and parameters: {'model_name': 'SimpleImputer', 'strategy': 'mean'}. Best is trial 6 with value: 2406.7086271118064.
[I 2024-02-27 21:49:12,004] Trial 70 finished with value: 2541.9945877854916 and parameters: {'model_name': 'SimpleImputer', 'strategy': 'most_frequent'}. Best is trial 6 with value: 2406.7086271118064.
[I 2024-02-27 21:49:12,365] Trial 74 finished with value: 2541.9945877854916 and parameters: {'model_name': 'SimpleImputer', 'strategy': 'most_frequent'}. Best is trial 6 with value: 2406.7086271118064.
[I 2024-02-27 21:49:12,603] Trial 114 finished with value: 2406.7086271118064 and parameters: {'model_name': 'SimpleImputer', 'strategy': 'mean'}. Best is trial 6 with value: 2406.7086271118064.
[I 2024-02-27 21:49:12,797] Trial 79 finished with value: 2541.9945877854916 and parameters: {'model_name': 'SimpleImputer', 'strategy': 'most_frequent'}. Best is trial 6 with value: 2406.7086271118064.
[I 2024-02-27 21:49:13,002] Trial 115 finished with value: 2406.7086271118064 and parameters: {'model_name': 'SimpleImputer', 'strategy': 'mean'}. Best is trial 6 with value: 2406.7086271118064.
[I 2024-02-27 21:49:13,206] Trial 77 finished with value: 2541.9945877854916 and parameters: {'model_name': 'SimpleImputer', 'strategy': 'most_frequent'}. Best is trial 6 with value: 2406.7086271118064.
[I 2024-02-27 21:49:13,421] Trial 111 finished with value: 2406.7086271118064 and parameters: {'model_name': 'SimpleImputer', 'strategy': 'mean'}. Best is trial 6 with value: 2406.7086271118064.
[I 2024-02-27 21:49:13,641] Trial 73 finished with value: 2541.9945877854916 and parameters: {'model_name': 'SimpleImputer', 'strategy': 'most_frequent'}. Best is trial 6 with value: 2406.7086271118064.
[I 2024-02-27 21:49:13,841] Trial 69 finished with value: 2541.9945877854916 and parameters: {'model_name': 'SimpleImputer', 'strategy': 'most_frequent'}. Best is trial 6 with value: 2406.7086271118064.
[I 2024-02-27 21:49:14,093] Trial 81 finished with value: 2541.9945877854916 and parameters: {'model_name': 'SimpleImputer', 'strategy': 'most_frequent'}. Best is trial 6 with value: 2406.7086271118064.
[I 2024-02-27 21:49:14,325] Trial 113 finished with value: 2406.7086271118064 and parameters: {'model_name': 'SimpleImputer', 'strategy': 'mean'}. Best is trial 6 with value: 2406.7086271118064.
[I 2024-02-27 21:49:14,648] Trial 76 finished with value: 2541.9945877854916 and parameters: {'model_name': 'SimpleImputer', 'strategy': 'most_frequent'}. Best is trial 6 with value: 2406.7086271118064.
[I 2024-02-27 21:49:14,984] Trial 83 finished with value: 2541.9945877854916 and parameters: {'model_name': 'SimpleImputer', 'strategy': 'most_frequent'}. Best is trial 6 with value: 2406.7086271118064.
[I 2024-02-27 21:49:15,237] Trial 110 finished with value: 2406.7086271118064 and parameters: {'model_name': 'SimpleImputer', 'strategy': 'mean'}. Best is trial 6 with value: 2406.7086271118064.
[I 2024-02-27 21:49:15,507] Trial 117 finished with value: 2406.7086271118064 and parameters: {'model_name': 'SimpleImputer', 'strategy': 'mean'}. Best is trial 6 with value: 2406.7086271118064.
[I 2024-02-27 21:49:15,713] Trial 116 finished with value: 2406.7086271118064 and parameters: {'model_name': 'SimpleImputer', 'strategy': 'mean'}. Best is trial 6 with value: 2406.7086271118064.
[I 2024-02-27 21:49:16,058] Trial 112 finished with value: 2406.7086271118064 and parameters: {'model_name': 'SimpleImputer', 'strategy': 'mean'}. Best is trial 6 with value: 2406.7086271118064.
[I 2024-02-27 21:49:16,385] Trial 72 finished with value: 2541.9945877854916 and parameters: {'model_name': 'SimpleImputer', 'strategy': 'most_frequent'}. Best is trial 6 with value: 2406.7086271118064.
