[I 2024-02-29 07:19:34,114] Trial 108 finished with value: 10.891915699654898 and parameters: {'model_name': 'SimpleImputer', 'strategy': 'mean'}. Best is trial 21 with value: 10.891915699654898.
[I 2024-02-29 07:19:34,370] Trial 109 finished with value: 10.891915699654898 and parameters: {'model_name': 'SimpleImputer', 'strategy': 'mean'}. Best is trial 21 with value: 10.891915699654898.
[I 2024-02-29 07:19:34,633] Trial 77 finished with value: 11.847415887932225 and parameters: {'model_name': 'SimpleImputer', 'strategy': 'most_frequent'}. Best is trial 21 with value: 10.891915699654898.
[I 2024-02-29 07:19:34,808] Trial 81 finished with value: 11.847415887932225 and parameters: {'model_name': 'SimpleImputer', 'strategy': 'most_frequent'}. Best is trial 21 with value: 10.891915699654898.
[I 2024-02-29 07:19:35,207] Trial 85 finished with value: 11.847415887932225 and parameters: {'model_name': 'SimpleImputer', 'strategy': 'most_frequent'}. Best is trial 21 with value: 10.891915699654898.
[I 2024-02-29 07:19:35,476] Trial 84 finished with value: 11.847415887932225 and parameters: {'model_name': 'SimpleImputer', 'strategy': 'most_frequent'}. Best is trial 21 with value: 10.891915699654898.
[I 2024-02-29 07:19:35,674] Trial 71 finished with value: 11.847415887932225 and parameters: {'model_name': 'SimpleImputer', 'strategy': 'most_frequent'}. Best is trial 21 with value: 10.891915699654898.
[I 2024-02-29 07:19:35,920] Trial 75 finished with value: 11.847415887932225 and parameters: {'model_name': 'SimpleImputer', 'strategy': 'most_frequent'}. Best is trial 21 with value: 10.891915699654898.
[I 2024-02-29 07:19:36,244] Trial 118 finished with value: 10.891915699654898 and parameters: {'model_name': 'SimpleImputer', 'strategy': 'mean'}. Best is trial 21 with value: 10.891915699654898.
[I 2024-02-29 07:19:36,483] Trial 110 finished with value: 10.891915699654898 and parameters: {'model_name': 'SimpleImputer', 'strategy': 'mean'}. Best is trial 21 with value: 10.891915699654898.
[I 2024-02-29 07:19:36,705] Trial 113 finished with value: 10.891915699654898 and parameters: {'model_name': 'SimpleImputer', 'strategy': 'mean'}. Best is trial 21 with value: 10.891915699654898.
[I 2024-02-29 07:19:36,955] Trial 111 finished with value: 10.891915699654898 and parameters: {'model_name': 'SimpleImputer', 'strategy': 'mean'}. Best is trial 21 with value: 10.891915699654898.
[I 2024-02-29 07:19:37,176] Trial 112 finished with value: 10.891915699654898 and parameters: {'model_name': 'SimpleImputer', 'strategy': 'mean'}. Best is trial 21 with value: 10.891915699654898.
[I 2024-02-29 07:19:37,448] Trial 116 finished with value: 10.891915699654898 and parameters: {'model_name': 'SimpleImputer', 'strategy': 'mean'}. Best is trial 21 with value: 10.891915699654898.
[I 2024-02-29 07:19:37,807] Trial 78 finished with value: 11.847415887932225 and parameters: {'model_name': 'SimpleImputer', 'strategy': 'most_frequent'}. Best is trial 21 with value: 10.891915699654898.
[I 2024-02-29 07:19:38,124] Trial 119 finished with value: 10.891915699654898 and parameters: {'model_name': 'SimpleImputer', 'strategy': 'mean'}. Best is trial 21 with value: 10.891915699654898.
[I 2024-02-29 07:19:38,341] Trial 114 finished with value: 10.891915699654898 and parameters: {'model_name': 'SimpleImputer', 'strategy': 'mean'}. Best is trial 21 with value: 10.891915699654898.
[I 2024-02-29 07:19:38,615] Trial 122 finished with value: 10.891915699654898 and parameters: {'model_name': 'SimpleImputer', 'strategy': 'mean'}. Best is trial 21 with value: 10.891915699654898.
[I 2024-02-29 07:19:38,815] Trial 120 finished with value: 10.891915699654898 and parameters: {'model_name': 'SimpleImputer', 'strategy': 'mean'}. Best is trial 21 with value: 10.891915699654898.
[I 2024-02-29 07:19:39,042] Trial 121 finished with value: 10.891915699654898 and parameters: {'model_name': 'SimpleImputer', 'strategy': 'mean'}. Best is trial 21 with value: 10.891915699654898.
[I 2024-02-29 07:19:39,309] Trial 115 finished with value: 10.891915699654898 and parameters: {'model_name': 'SimpleImputer', 'strategy': 'mean'}. Best is trial 21 with value: 10.891915699654898.
[I 2024-02-29 07:19:39,579] Trial 117 finished with value: 10.891915699654898 and parameters: {'model_name': 'SimpleImputer', 'strategy': 'mean'}. Best is trial 21 with value: 10.891915699654898.
[I 2024-02-29 07:19:39,818] Trial 87 finished with value: 11.847415887932225 and parameters: {'model_name': 'SimpleImputer', 'strategy': 'most_frequent'}. Best is trial 21 with value: 10.891915699654898.
[I 2024-02-29 07:19:40,007] Trial 69 finished with value: 11.847415887932225 and parameters: {'model_name': 'SimpleImputer', 'strategy': 'most_frequent'}. Best is trial 21 with value: 10.891915699654898.
[I 2024-02-29 07:19:40,383] Trial 86 finished with value: 11.847415887932225 and parameters: {'model_name': 'SimpleImputer', 'strategy': 'most_frequent'}. Best is trial 21 with value: 10.891915699654898.
[I 2024-02-29 07:19:40,709] Trial 123 finished with value: 10.891915699654898 and parameters: {'model_name': 'SimpleImputer', 'strategy': 'mean'}. Best is trial 21 with value: 10.891915699654898.
[I 2024-02-29 07:19:41,028] Trial 125 finished with value: 10.891915699654898 and parameters: {'model_name': 'SimpleImputer', 'strategy': 'mean'}. Best is trial 21 with value: 10.891915699654898.
[I 2024-02-29 07:19:41,321] Trial 89 finished with value: 11.847415887932225 and parameters: {'model_name': 'SimpleImputer', 'strategy': 'most_frequent'}. Best is trial 21 with value: 10.891915699654898.
[I 2024-02-29 07:19:41,602] Trial 129 finished with value: 10.891915699654898 and parameters: {'model_name': 'SimpleImputer', 'strategy': 'mean'}. Best is trial 21 with value: 10.891915699654898.
[I 2024-02-29 07:19:41,782] Trial 88 finished with value: 11.847415887932225 and parameters: {'model_name': 'SimpleImputer', 'strategy': 'most_frequent'}. Best is trial 21 with value: 10.891915699654898.
[I 2024-02-29 07:19:41,954] Trial 90 finished with value: 11.847415887932225 and parameters: {'model_name': 'SimpleImputer', 'strategy': 'most_frequent'}. Best is trial 21 with value: 10.891915699654898.
[I 2024-02-29 07:19:42,239] Trial 131 finished with value: 10.891915699654898 and parameters: {'model_name': 'SimpleImputer', 'strategy': 'mean'}. Best is trial 21 with value: 10.891915699654898.
[I 2024-02-29 07:19:42,520] Trial 124 finished with value: 10.891915699654898 and parameters: {'model_name': 'SimpleImputer', 'strategy': 'mean'}. Best is trial 21 with value: 10.891915699654898.
[I 2024-02-29 07:19:42,783] Trial 127 finished with value: 10.891915699654898 and parameters: {'model_name': 'SimpleImputer', 'strategy': 'mean'}. Best is trial 21 with value: 10.891915699654898.
[I 2024-02-29 07:19:43,027] Trial 130 finished with value: 10.891915699654898 and parameters: {'model_name': 'SimpleImputer', 'strategy': 'mean'}. Best is trial 21 with value: 10.891915699654898.
[I 2024-02-29 07:19:43,353] Trial 128 finished with value: 10.891915699654898 and parameters: {'model_name': 'SimpleImputer', 'strategy': 'mean'}. Best is trial 21 with value: 10.891915699654898.
[I 2024-02-29 07:19:43,617] Trial 126 finished with value: 10.891915699654898 and parameters: {'model_name': 'SimpleImputer', 'strategy': 'mean'}. Best is trial 21 with value: 10.891915699654898.
[I 2024-02-29 07:19:43,961] Trial 140 finished with value: 10.891915699654898 and parameters: {'model_name': 'SimpleImputer', 'strategy': 'mean'}. Best is trial 21 with value: 10.891915699654898.
[I 2024-02-29 07:19:44,343] Trial 135 finished with value: 10.891915699654898 and parameters: {'model_name': 'SimpleImputer', 'strategy': 'mean'}. Best is trial 21 with value: 10.891915699654898.
[I 2024-02-29 07:19:44,537] Trial 133 finished with value: 10.891915699654898 and parameters: {'model_name': 'SimpleImputer', 'strategy': 'mean'}. Best is trial 21 with value: 10.891915699654898.
[I 2024-02-29 07:19:44,806] Trial 142 finished with value: 10.891915699654898 and parameters: {'model_name': 'SimpleImputer', 'strategy': 'mean'}. Best is trial 21 with value: 10.891915699654898.
[I 2024-02-29 07:19:45,104] Trial 144 finished with value: 10.891915699654898 and parameters: {'model_name': 'SimpleImputer', 'strategy': 'mean'}. Best is trial 21 with value: 10.891915699654898.
[I 2024-02-29 07:19:45,379] Trial 139 finished with value: 10.891915699654898 and parameters: {'model_name': 'SimpleImputer', 'strategy': 'mean'}. Best is trial 21 with value: 10.891915699654898.
[I 2024-02-29 07:19:45,612] Trial 145 finished with value: 10.891915699654898 and parameters: {'model_name': 'SimpleImputer', 'strategy': 'mean'}. Best is trial 21 with value: 10.891915699654898.
[I 2024-02-29 07:19:45,824] Trial 146 finished with value: 10.891915699654898 and parameters: {'model_name': 'SimpleImputer', 'strategy': 'mean'}. Best is trial 21 with value: 10.891915699654898.
[I 2024-02-29 07:19:46,076] Trial 141 finished with value: 10.891915699654898 and parameters: {'model_name': 'SimpleImputer', 'strategy': 'mean'}. Best is trial 21 with value: 10.891915699654898.
[I 2024-02-29 07:19:46,086] Trial 132 finished with value: 10.891915699654898 and parameters: {'model_name': 'SimpleImputer', 'strategy': 'mean'}. Best is trial 21 with value: 10.891915699654898.
[I 2024-02-29 07:19:46,091] Trial 138 finished with value: 10.891915699654898 and parameters: {'model_name': 'SimpleImputer', 'strategy': 'mean'}. Best is trial 21 with value: 10.891915699654898.
[I 2024-02-29 07:19:46,654] Trial 149 finished with value: 10.891915699654898 and parameters: {'model_name': 'SimpleImputer', 'strategy': 'mean'}. Best is trial 21 with value: 10.891915699654898.
[I 2024-02-29 07:19:46,889] Trial 136 finished with value: 10.891915699654898 and parameters: {'model_name': 'SimpleImputer', 'strategy': 'mean'}. Best is trial 21 with value: 10.891915699654898.
[I 2024-02-29 07:19:47,132] Trial 134 finished with value: 10.891915699654898 and parameters: {'model_name': 'SimpleImputer', 'strategy': 'mean'}. Best is trial 21 with value: 10.891915699654898.
[I 2024-02-29 07:19:47,378] Trial 150 finished with value: 10.891915699654898 and parameters: {'model_name': 'SimpleImputer', 'strategy': 'mean'}. Best is trial 21 with value: 10.891915699654898.
[I 2024-02-29 07:19:47,577] Trial 154 finished with value: 10.891915699654898 and parameters: {'model_name': 'SimpleImputer', 'strategy': 'mean'}. Best is trial 21 with value: 10.891915699654898.
[I 2024-02-29 07:19:47,842] Trial 91 finished with value: 11.847415887932225 and parameters: {'model_name': 'SimpleImputer', 'strategy': 'most_frequent'}. Best is trial 21 with value: 10.891915699654898.
[I 2024-02-29 07:19:48,077] Trial 137 finished with value: 10.891915699654898 and parameters: {'model_name': 'SimpleImputer', 'strategy': 'mean'}. Best is trial 21 with value: 10.891915699654898.
[I 2024-02-29 07:19:48,262] Trial 143 finished with value: 10.891915699654898 and parameters: {'model_name': 'SimpleImputer', 'strategy': 'mean'}. Best is trial 21 with value: 10.891915699654898.
[I 2024-02-29 07:19:48,439] Trial 157 finished with value: 10.891915699654898 and parameters: {'model_name': 'SimpleImputer', 'strategy': 'mean'}. Best is trial 21 with value: 10.891915699654898.
[I 2024-02-29 07:19:48,630] Trial 159 finished with value: 10.891915699654898 and parameters: {'model_name': 'SimpleImputer', 'strategy': 'mean'}. Best is trial 21 with value: 10.891915699654898.
[I 2024-02-29 07:19:48,869] Trial 147 finished with value: 10.891915699654898 and parameters: {'model_name': 'SimpleImputer', 'strategy': 'mean'}. Best is trial 21 with value: 10.891915699654898.
[I 2024-02-29 07:19:49,115] Trial 148 finished with value: 10.891915699654898 and parameters: {'model_name': 'SimpleImputer', 'strategy': 'mean'}. Best is trial 21 with value: 10.891915699654898.
[I 2024-02-29 07:19:49,337] Trial 153 finished with value: 10.891915699654898 and parameters: {'model_name': 'SimpleImputer', 'strategy': 'mean'}. Best is trial 21 with value: 10.891915699654898.
[I 2024-02-29 07:19:49,576] Trial 152 finished with value: 10.891915699654898 and parameters: {'model_name': 'SimpleImputer', 'strategy': 'mean'}. Best is trial 21 with value: 10.891915699654898.
[I 2024-02-29 07:19:49,787] Trial 161 finished with value: 10.891915699654898 and parameters: {'model_name': 'SimpleImputer', 'strategy': 'mean'}. Best is trial 21 with value: 10.891915699654898.
[I 2024-02-29 07:19:49,976] Trial 156 finished with value: 10.891915699654898 and parameters: {'model_name': 'SimpleImputer', 'strategy': 'mean'}. Best is trial 21 with value: 10.891915699654898.
[I 2024-02-29 07:19:50,222] Trial 167 finished with value: 10.891915699654898 and parameters: {'model_name': 'SimpleImputer', 'strategy': 'mean'}. Best is trial 21 with value: 10.891915699654898.
[I 2024-02-29 07:19:50,479] Trial 163 finished with value: 10.891915699654898 and parameters: {'model_name': 'SimpleImputer', 'strategy': 'mean'}. Best is trial 21 with value: 10.891915699654898.
[I 2024-02-29 07:19:50,710] Trial 169 finished with value: 10.891915699654898 and parameters: {'model_name': 'SimpleImputer', 'strategy': 'mean'}. Best is trial 21 with value: 10.891915699654898.
[I 2024-02-29 07:19:50,894] Trial 162 finished with value: 10.891915699654898 and parameters: {'model_name': 'SimpleImputer', 'strategy': 'mean'}. Best is trial 21 with value: 10.891915699654898.
[I 2024-02-29 07:19:51,143] Trial 160 finished with value: 10.891915699654898 and parameters: {'model_name': 'SimpleImputer', 'strategy': 'mean'}. Best is trial 21 with value: 10.891915699654898.
[I 2024-02-29 07:19:51,459] Trial 151 finished with value: 10.891915699654898 and parameters: {'model_name': 'SimpleImputer', 'strategy': 'mean'}. Best is trial 21 with value: 10.891915699654898.
[I 2024-02-29 07:19:51,708] Trial 158 finished with value: 10.891915699654898 and parameters: {'model_name': 'SimpleImputer', 'strategy': 'mean'}. Best is trial 21 with value: 10.891915699654898.
[I 2024-02-29 07:19:51,935] Trial 168 finished with value: 10.891915699654898 and parameters: {'model_name': 'SimpleImputer', 'strategy': 'mean'}. Best is trial 21 with value: 10.891915699654898.
[I 2024-02-29 07:19:52,186] Trial 172 finished with value: 10.891915699654898 and parameters: {'model_name': 'SimpleImputer', 'strategy': 'mean'}. Best is trial 21 with value: 10.891915699654898.
[I 2024-02-29 07:19:52,417] Trial 171 finished with value: 10.891915699654898 and parameters: {'model_name': 'SimpleImputer', 'strategy': 'mean'}. Best is trial 21 with value: 10.891915699654898.
[I 2024-02-29 07:19:52,592] Trial 165 finished with value: 10.891915699654898 and parameters: {'model_name': 'SimpleImputer', 'strategy': 'mean'}. Best is trial 21 with value: 10.891915699654898.
[I 2024-02-29 07:19:52,861] Trial 155 finished with value: 10.891915699654898 and parameters: {'model_name': 'SimpleImputer', 'strategy': 'mean'}. Best is trial 21 with value: 10.891915699654898.
[I 2024-02-29 07:19:53,111] Trial 164 finished with value: 10.891915699654898 and parameters: {'model_name': 'SimpleImputer', 'strategy': 'mean'}. Best is trial 21 with value: 10.891915699654898.
[I 2024-02-29 07:19:53,424] Trial 166 finished with value: 10.891915699654898 and parameters: {'model_name': 'SimpleImputer', 'strategy': 'mean'}. Best is trial 21 with value: 10.891915699654898.
[I 2024-02-29 07:19:53,694] Trial 174 finished with value: 10.891915699654898 and parameters: {'model_name': 'SimpleImputer', 'strategy': 'mean'}. Best is trial 21 with value: 10.891915699654898.
[I 2024-02-29 07:19:53,883] Trial 173 finished with value: 10.891915699654898 and parameters: {'model_name': 'SimpleImputer', 'strategy': 'mean'}. Best is trial 21 with value: 10.891915699654898.
[I 2024-02-29 07:19:54,338] Trial 170 finished with value: 10.891915699654898 and parameters: {'model_name': 'SimpleImputer', 'strategy': 'mean'}. Best is trial 21 with value: 10.891915699654898.
[I 2024-02-29 07:19:54,584] Trial 177 finished with value: 10.891915699654898 and parameters: {'model_name': 'SimpleImputer', 'strategy': 'mean'}. Best is trial 21 with value: 10.891915699654898.
[I 2024-02-29 07:19:54,822] Trial 182 finished with value: 11.847415887932225 and parameters: {'model_name': 'SimpleImputer', 'strategy': 'constant'}. Best is trial 21 with value: 10.891915699654898.
[I 2024-02-29 07:19:55,021] Trial 178 finished with value: 10.891915699654898 and parameters: {'model_name': 'SimpleImputer', 'strategy': 'mean'}. Best is trial 21 with value: 10.891915699654898.
[I 2024-02-29 07:19:55,191] Trial 176 finished with value: 10.891915699654898 and parameters: {'model_name': 'SimpleImputer', 'strategy': 'mean'}. Best is trial 21 with value: 10.891915699654898.
[I 2024-02-29 07:19:55,363] Trial 175 finished with value: 10.891915699654898 and parameters: {'model_name': 'SimpleImputer', 'strategy': 'mean'}. Best is trial 21 with value: 10.891915699654898.
[I 2024-02-29 07:19:55,534] Trial 185 finished with value: 11.847415887932225 and parameters: {'model_name': 'SimpleImputer', 'strategy': 'constant'}. Best is trial 21 with value: 10.891915699654898.
[I 2024-02-29 07:19:55,704] Trial 181 finished with value: 11.847415887932225 and parameters: {'model_name': 'SimpleImputer', 'strategy': 'constant'}. Best is trial 21 with value: 10.891915699654898.
[I 2024-02-29 07:19:56,012] Trial 179 finished with value: 10.891915699654898 and parameters: {'model_name': 'SimpleImputer', 'strategy': 'mean'}. Best is trial 21 with value: 10.891915699654898.
[I 2024-02-29 07:19:56,192] Trial 186 finished with value: 11.847415887932225 and parameters: {'model_name': 'SimpleImputer', 'strategy': 'constant'}. Best is trial 21 with value: 10.891915699654898.
[I 2024-02-29 07:19:56,497] Trial 183 finished with value: 11.847415887932225 and parameters: {'model_name': 'SimpleImputer', 'strategy': 'constant'}. Best is trial 21 with value: 10.891915699654898.
[I 2024-02-29 07:19:56,684] Trial 194 finished with value: 11.847415887932225 and parameters: {'model_name': 'SimpleImputer', 'strategy': 'constant'}. Best is trial 21 with value: 10.891915699654898.
[I 2024-02-29 07:19:56,838] Trial 190 finished with value: 11.847415887932225 and parameters: {'model_name': 'SimpleImputer', 'strategy': 'constant'}. Best is trial 21 with value: 10.891915699654898.
[I 2024-02-29 07:19:57,015] Trial 180 finished with value: 11.847415887932225 and parameters: {'model_name': 'SimpleImputer', 'strategy': 'constant'}. Best is trial 21 with value: 10.891915699654898.
[I 2024-02-29 07:19:57,200] Trial 193 finished with value: 11.847415887932225 and parameters: {'model_name': 'SimpleImputer', 'strategy': 'constant'}. Best is trial 21 with value: 10.891915699654898.
[I 2024-02-29 07:19:57,457] Trial 189 finished with value: 11.847415887932225 and parameters: {'model_name': 'SimpleImputer', 'strategy': 'constant'}. Best is trial 21 with value: 10.891915699654898.
[I 2024-02-29 07:19:57,627] Trial 191 finished with value: 11.847415887932225 and parameters: {'model_name': 'SimpleImputer', 'strategy': 'constant'}. Best is trial 21 with value: 10.891915699654898.
[I 2024-02-29 07:19:57,807] Trial 199 finished with value: 11.847415887932225 and parameters: {'model_name': 'SimpleImputer', 'strategy': 'constant'}. Best is trial 21 with value: 10.891915699654898.
[I 2024-02-29 07:19:58,095] Trial 184 finished with value: 11.847415887932225 and parameters: {'model_name': 'SimpleImputer', 'strategy': 'constant'}. Best is trial 21 with value: 10.891915699654898.
[I 2024-02-29 07:19:58,380] Trial 196 finished with value: 11.847415887932225 and parameters: {'model_name': 'SimpleImputer', 'strategy': 'constant'}. Best is trial 21 with value: 10.891915699654898.
[I 2024-02-29 07:19:58,569] Trial 188 finished with value: 10.891915699654898 and parameters: {'model_name': 'SimpleImputer', 'strategy': 'mean'}. Best is trial 21 with value: 10.891915699654898.
[I 2024-02-29 07:19:58,799] Trial 195 finished with value: 11.847415887932225 and parameters: {'model_name': 'SimpleImputer', 'strategy': 'constant'}. Best is trial 21 with value: 10.891915699654898.
[I 2024-02-29 07:19:59,026] Trial 197 finished with value: 11.847415887932225 and parameters: {'model_name': 'SimpleImputer', 'strategy': 'constant'}. Best is trial 21 with value: 10.891915699654898.
[I 2024-02-29 07:19:59,240] Trial 187 finished with value: 11.847415887932225 and parameters: {'model_name': 'SimpleImputer', 'strategy': 'median'}. Best is trial 21 with value: 10.891915699654898.
[I 2024-02-29 07:19:59,408] Trial 198 finished with value: 11.847415887932225 and parameters: {'model_name': 'SimpleImputer', 'strategy': 'median'}. Best is trial 21 with value: 10.891915699654898.
