[I 2023-12-26 22:03:01,217] Trial 163 finished with value: 0.16753998470228798 and parameters: {'model_name': 'IterativeImputer', 'sample_posterior': False, 'initial_strategy': 'constant', 'imputation_order': 'roman'}. Best is trial 0 with value: 0.16753998470228798.
[I 2023-12-26 22:03:06,726] Trial 164 finished with value: 0.16753998470228798 and parameters: {'model_name': 'IterativeImputer', 'sample_posterior': False, 'initial_strategy': 'constant', 'imputation_order': 'roman'}. Best is trial 0 with value: 0.16753998470228798.
[I 2023-12-26 22:04:09,161] Trial 165 finished with value: 0.16753998470228798 and parameters: {'model_name': 'IterativeImputer', 'sample_posterior': False, 'initial_strategy': 'constant', 'imputation_order': 'roman'}. Best is trial 0 with value: 0.16753998470228798.
[I 2023-12-26 22:04:12,514] Trial 166 finished with value: 0.16753998470228798 and parameters: {'model_name': 'IterativeImputer', 'sample_posterior': False, 'initial_strategy': 'constant', 'imputation_order': 'roman'}. Best is trial 0 with value: 0.16753998470228798.
[I 2023-12-26 22:04:20,695] Trial 167 finished with value: 0.16753998470228798 and parameters: {'model_name': 'IterativeImputer', 'sample_posterior': False, 'initial_strategy': 'constant', 'imputation_order': 'roman'}. Best is trial 0 with value: 0.16753998470228798.
[I 2023-12-26 22:05:38,503] Trial 168 finished with value: 0.16753998470228798 and parameters: {'model_name': 'IterativeImputer', 'sample_posterior': False, 'initial_strategy': 'constant', 'imputation_order': 'roman'}. Best is trial 0 with value: 0.16753998470228798.
[I 2023-12-26 22:05:58,246] Trial 170 finished with value: 0.16753998470228798 and parameters: {'model_name': 'IterativeImputer', 'sample_posterior': False, 'initial_strategy': 'constant', 'imputation_order': 'roman'}. Best is trial 0 with value: 0.16753998470228798.
[I 2023-12-26 22:06:30,975] Trial 169 finished with value: 0.16753998470228798 and parameters: {'model_name': 'IterativeImputer', 'sample_posterior': False, 'initial_strategy': 'constant', 'imputation_order': 'roman'}. Best is trial 0 with value: 0.16753998470228798.
[I 2023-12-26 22:07:10,348] Trial 171 finished with value: 0.16753998470228798 and parameters: {'model_name': 'IterativeImputer', 'sample_posterior': False, 'initial_strategy': 'constant', 'imputation_order': 'roman'}. Best is trial 0 with value: 0.16753998470228798.
[I 2023-12-26 22:09:38,731] Trial 172 finished with value: 0.16753998470228798 and parameters: {'model_name': 'IterativeImputer', 'sample_posterior': False, 'initial_strategy': 'constant', 'imputation_order': 'roman'}. Best is trial 0 with value: 0.16753998470228798.
[I 2023-12-26 22:09:52,134] Trial 173 finished with value: 0.16753998470228798 and parameters: {'model_name': 'IterativeImputer', 'sample_posterior': False, 'initial_strategy': 'constant', 'imputation_order': 'roman'}. Best is trial 0 with value: 0.16753998470228798.
[I 2023-12-26 22:12:45,071] Trial 174 finished with value: 0.16753998470228798 and parameters: {'model_name': 'IterativeImputer', 'sample_posterior': False, 'initial_strategy': 'constant', 'imputation_order': 'roman'}. Best is trial 0 with value: 0.16753998470228798.
[I 2023-12-26 22:13:09,019] Trial 175 finished with value: 0.16753998470228798 and parameters: {'model_name': 'IterativeImputer', 'sample_posterior': False, 'initial_strategy': 'constant', 'imputation_order': 'roman'}. Best is trial 0 with value: 0.16753998470228798.
[I 2023-12-26 22:13:16,989] Trial 176 finished with value: 0.16753998470228798 and parameters: {'model_name': 'IterativeImputer', 'sample_posterior': False, 'initial_strategy': 'constant', 'imputation_order': 'roman'}. Best is trial 0 with value: 0.16753998470228798.
[I 2023-12-26 22:13:21,800] Trial 179 finished with value: 0.16753998470228798 and parameters: {'model_name': 'IterativeImputer', 'sample_posterior': False, 'initial_strategy': 'constant', 'imputation_order': 'roman'}. Best is trial 0 with value: 0.16753998470228798.
[I 2023-12-26 22:13:24,763] Trial 178 finished with value: 0.16753998470228798 and parameters: {'model_name': 'IterativeImputer', 'sample_posterior': False, 'initial_strategy': 'constant', 'imputation_order': 'roman'}. Best is trial 0 with value: 0.16753998470228798.
[I 2023-12-26 22:13:34,811] Trial 177 finished with value: 0.16753998470228798 and parameters: {'model_name': 'IterativeImputer', 'sample_posterior': False, 'initial_strategy': 'constant', 'imputation_order': 'roman'}. Best is trial 0 with value: 0.16753998470228798.
[I 2023-12-26 22:13:38,914] Trial 181 finished with value: 0.16753998470228798 and parameters: {'model_name': 'IterativeImputer', 'sample_posterior': False, 'initial_strategy': 'constant', 'imputation_order': 'roman'}. Best is trial 0 with value: 0.16753998470228798.
[I 2023-12-26 22:13:41,339] Trial 182 finished with value: 0.16753998470228798 and parameters: {'model_name': 'IterativeImputer', 'sample_posterior': False, 'initial_strategy': 'constant', 'imputation_order': 'roman'}. Best is trial 0 with value: 0.16753998470228798.
[I 2023-12-26 22:13:46,733] Trial 180 finished with value: 0.16753998470228798 and parameters: {'model_name': 'IterativeImputer', 'sample_posterior': False, 'initial_strategy': 'constant', 'imputation_order': 'roman'}. Best is trial 0 with value: 0.16753998470228798.
[I 2023-12-26 22:13:50,564] Trial 184 finished with value: 0.16753998470228798 and parameters: {'model_name': 'IterativeImputer', 'sample_posterior': False, 'initial_strategy': 'constant', 'imputation_order': 'roman'}. Best is trial 0 with value: 0.16753998470228798.
[I 2023-12-26 22:13:52,308] Trial 185 finished with value: 0.16753998470228798 and parameters: {'model_name': 'IterativeImputer', 'sample_posterior': False, 'initial_strategy': 'constant', 'imputation_order': 'roman'}. Best is trial 0 with value: 0.16753998470228798.
[I 2023-12-26 22:13:54,088] Trial 186 finished with value: 0.16753998470228798 and parameters: {'model_name': 'IterativeImputer', 'sample_posterior': False, 'initial_strategy': 'constant', 'imputation_order': 'roman'}. Best is trial 0 with value: 0.16753998470228798.
[I 2023-12-26 22:14:06,732] Trial 188 finished with value: 0.16753998470228798 and parameters: {'model_name': 'IterativeImputer', 'sample_posterior': False, 'initial_strategy': 'constant', 'imputation_order': 'roman'}. Best is trial 0 with value: 0.16753998470228798.
[I 2023-12-26 22:14:17,021] Trial 190 finished with value: 0.16753998470228798 and parameters: {'model_name': 'IterativeImputer', 'sample_posterior': False, 'initial_strategy': 'constant', 'imputation_order': 'roman'}. Best is trial 0 with value: 0.16753998470228798.
[I 2023-12-26 22:14:21,358] Trial 189 finished with value: 0.16753998470228798 and parameters: {'model_name': 'IterativeImputer', 'sample_posterior': False, 'initial_strategy': 'constant', 'imputation_order': 'roman'}. Best is trial 0 with value: 0.16753998470228798.
[I 2023-12-26 22:14:24,370] Trial 187 finished with value: 0.16753998470228798 and parameters: {'model_name': 'IterativeImputer', 'sample_posterior': False, 'initial_strategy': 'constant', 'imputation_order': 'roman'}. Best is trial 0 with value: 0.16753998470228798.
[I 2023-12-26 22:14:25,718] Trial 191 finished with value: 0.16753998470228798 and parameters: {'model_name': 'IterativeImputer', 'sample_posterior': False, 'initial_strategy': 'constant', 'imputation_order': 'roman'}. Best is trial 0 with value: 0.16753998470228798.
[I 2023-12-26 22:14:42,378] Trial 192 finished with value: 0.16753998470228798 and parameters: {'model_name': 'IterativeImputer', 'sample_posterior': False, 'initial_strategy': 'constant', 'imputation_order': 'roman'}. Best is trial 0 with value: 0.16753998470228798.
[I 2023-12-26 22:14:46,086] Trial 194 finished with value: 0.16753998470228798 and parameters: {'model_name': 'IterativeImputer', 'sample_posterior': False, 'initial_strategy': 'constant', 'imputation_order': 'roman'}. Best is trial 0 with value: 0.16753998470228798.
[I 2023-12-26 22:14:48,985] Trial 193 finished with value: 0.16753998470228798 and parameters: {'model_name': 'IterativeImputer', 'sample_posterior': False, 'initial_strategy': 'constant', 'imputation_order': 'roman'}. Best is trial 0 with value: 0.16753998470228798.
[I 2023-12-26 22:14:57,372] Trial 196 finished with value: 0.16774362418633065 and parameters: {'model_name': 'IterativeImputer', 'sample_posterior': False, 'initial_strategy': 'most_frequent', 'imputation_order': 'arabic'}. Best is trial 0 with value: 0.16753998470228798.
[I 2023-12-26 22:15:15,049] Trial 198 finished with value: 0.16753998470228798 and parameters: {'model_name': 'IterativeImputer', 'sample_posterior': False, 'initial_strategy': 'most_frequent', 'imputation_order': 'roman'}. Best is trial 0 with value: 0.16753998470228798.
[I 2023-12-26 22:15:16,212] Trial 199 finished with value: 0.16753998470228798 and parameters: {'model_name': 'IterativeImputer', 'sample_posterior': False, 'initial_strategy': 'most_frequent', 'imputation_order': 'roman'}. Best is trial 0 with value: 0.16753998470228798.
