[I 2024-01-16 03:22:30,087] Trial 70 finished with value: 0.4638632874317404 and parameters: {'model_name': 'IterativeImputer', 'sample_posterior': True, 'initial_strategy': 'constant', 'imputation_order': 'descending'}. Best is trial 65 with value: 0.3612253528044419.
[I 2024-01-16 03:22:32,311] Trial 32 finished with value: 0.4648285999728382 and parameters: {'model_name': 'IterativeImputer', 'sample_posterior': True, 'initial_strategy': 'mean', 'imputation_order': 'random'}. Best is trial 65 with value: 0.3612253528044419.
[I 2024-01-16 03:22:57,549] Trial 74 finished with value: 0.4558493171802974 and parameters: {'model_name': 'IterativeImputer', 'sample_posterior': True, 'initial_strategy': 'most_frequent', 'imputation_order': 'roman'}. Best is trial 65 with value: 0.3612253528044419.
[I 2024-01-16 03:24:28,230] Trial 19 finished with value: 0.49376819056817756 and parameters: {'model_name': 'GAIN', 'batch_size': 25, 'hint_rate': 0.55, 'alpha': 57, 'iterations': 738}. Best is trial 65 with value: 0.3612253528044419.
[I 2024-01-16 03:29:03,727] Trial 77 finished with value: 0.4648149160841151 and parameters: {'model_name': 'IterativeImputer', 'sample_posterior': True, 'initial_strategy': 'mean', 'imputation_order': 'roman'}. Best is trial 65 with value: 0.3612253528044419.
[I 2024-01-16 03:30:16,934] Trial 78 finished with value: 0.4630634014417234 and parameters: {'model_name': 'IterativeImputer', 'sample_posterior': True, 'initial_strategy': 'median', 'imputation_order': 'random'}. Best is trial 65 with value: 0.3612253528044419.
[I 2024-01-16 03:34:04,879] Trial 131 finished with value: 0.3612254386920611 and parameters: {'model_name': 'IterativeImputer', 'sample_posterior': False, 'initial_strategy': 'most_frequent', 'imputation_order': 'random'}. Best is trial 65 with value: 0.3612253528044419.
[I 2024-01-16 03:34:13,555] Trial 130 finished with value: 0.3612254303160891 and parameters: {'model_name': 'IterativeImputer', 'sample_posterior': False, 'initial_strategy': 'most_frequent', 'imputation_order': 'random'}. Best is trial 65 with value: 0.3612253528044419.
[I 2024-01-16 03:34:31,974] Trial 129 finished with value: 0.3612254369323554 and parameters: {'model_name': 'IterativeImputer', 'sample_posterior': False, 'initial_strategy': 'most_frequent', 'imputation_order': 'random'}. Best is trial 65 with value: 0.3612253528044419.
[I 2024-01-16 03:34:34,132] Trial 128 finished with value: 0.36122529342171705 and parameters: {'model_name': 'IterativeImputer', 'sample_posterior': False, 'initial_strategy': 'most_frequent', 'imputation_order': 'random'}. Best is trial 128 with value: 0.36122529342171705.
[I 2024-01-16 03:34:40,414] Trial 127 finished with value: 0.3612255202773898 and parameters: {'model_name': 'IterativeImputer', 'sample_posterior': False, 'initial_strategy': 'most_frequent', 'imputation_order': 'random'}. Best is trial 128 with value: 0.36122529342171705.
[I 2024-01-16 03:34:42,947] Trial 125 finished with value: 0.3612255965486238 and parameters: {'model_name': 'IterativeImputer', 'sample_posterior': False, 'initial_strategy': 'most_frequent', 'imputation_order': 'random'}. Best is trial 128 with value: 0.36122529342171705.
[I 2024-01-16 03:34:43,880] Trial 126 finished with value: 0.36122550233558454 and parameters: {'model_name': 'IterativeImputer', 'sample_posterior': False, 'initial_strategy': 'most_frequent', 'imputation_order': 'random'}. Best is trial 128 with value: 0.36122529342171705.
[I 2024-01-16 03:34:51,656] Trial 132 finished with value: 0.3612254932223552 and parameters: {'model_name': 'IterativeImputer', 'sample_posterior': False, 'initial_strategy': 'most_frequent', 'imputation_order': 'random'}. Best is trial 128 with value: 0.36122529342171705.
[I 2024-01-16 03:35:23,302] Trial 133 finished with value: 0.36122545259217886 and parameters: {'model_name': 'IterativeImputer', 'sample_posterior': False, 'initial_strategy': 'most_frequent', 'imputation_order': 'random'}. Best is trial 128 with value: 0.36122529342171705.
[I 2024-01-16 03:36:19,401] Trial 93 finished with value: 0.4667090943863177 and parameters: {'model_name': 'IterativeImputer', 'sample_posterior': True, 'initial_strategy': 'mean', 'imputation_order': 'random'}. Best is trial 128 with value: 0.36122529342171705.
[I 2024-01-16 03:37:10,566] Trial 94 finished with value: 0.4695895000448715 and parameters: {'model_name': 'IterativeImputer', 'sample_posterior': True, 'initial_strategy': 'mean', 'imputation_order': 'random'}. Best is trial 128 with value: 0.36122529342171705.
[I 2024-01-16 03:37:16,512] Trial 134 finished with value: 0.361225613509527 and parameters: {'model_name': 'IterativeImputer', 'sample_posterior': False, 'initial_strategy': 'most_frequent', 'imputation_order': 'random'}. Best is trial 128 with value: 0.36122529342171705.
[I 2024-01-16 03:37:17,268] Trial 95 finished with value: 0.46219461214617275 and parameters: {'model_name': 'IterativeImputer', 'sample_posterior': True, 'initial_strategy': 'mean', 'imputation_order': 'random'}. Best is trial 128 with value: 0.36122529342171705.
[I 2024-01-16 03:37:52,068] Trial 96 finished with value: 0.46923448617983404 and parameters: {'model_name': 'IterativeImputer', 'sample_posterior': True, 'initial_strategy': 'mean', 'imputation_order': 'random'}. Best is trial 128 with value: 0.36122529342171705.
[I 2024-01-16 03:38:29,390] Trial 99 finished with value: 0.4613175035465046 and parameters: {'model_name': 'IterativeImputer', 'sample_posterior': True, 'initial_strategy': 'mean', 'imputation_order': 'random'}. Best is trial 128 with value: 0.36122529342171705.
[I 2024-01-16 03:38:32,780] Trial 97 finished with value: 0.46330231125242005 and parameters: {'model_name': 'IterativeImputer', 'sample_posterior': True, 'initial_strategy': 'mean', 'imputation_order': 'random'}. Best is trial 128 with value: 0.36122529342171705.
[I 2024-01-16 03:38:36,109] Trial 98 finished with value: 0.4620838061831927 and parameters: {'model_name': 'IterativeImputer', 'sample_posterior': True, 'initial_strategy': 'mean', 'imputation_order': 'random'}. Best is trial 128 with value: 0.36122529342171705.
[I 2024-01-16 03:39:01,125] Trial 100 finished with value: 0.4760139927226784 and parameters: {'model_name': 'IterativeImputer', 'sample_posterior': True, 'initial_strategy': 'mean', 'imputation_order': 'random'}. Best is trial 128 with value: 0.36122529342171705.
[I 2024-01-16 03:42:16,118] Trial 101 finished with value: 0.4644953319701771 and parameters: {'model_name': 'IterativeImputer', 'sample_posterior': True, 'initial_strategy': 'mean', 'imputation_order': 'ascending'}. Best is trial 128 with value: 0.36122529342171705.
[I 2024-01-16 03:42:26,485] Trial 102 finished with value: 0.4719090405889729 and parameters: {'model_name': 'IterativeImputer', 'sample_posterior': True, 'initial_strategy': 'mean', 'imputation_order': 'ascending'}. Best is trial 128 with value: 0.36122529342171705.
[I 2024-01-16 03:42:39,952] Trial 135 finished with value: 0.36122537660179577 and parameters: {'model_name': 'IterativeImputer', 'sample_posterior': False, 'initial_strategy': 'most_frequent', 'imputation_order': 'random'}. Best is trial 128 with value: 0.36122529342171705.
[I 2024-01-16 03:42:48,281] Trial 103 finished with value: 0.46010612807047196 and parameters: {'model_name': 'IterativeImputer', 'sample_posterior': True, 'initial_strategy': 'mean', 'imputation_order': 'random'}. Best is trial 128 with value: 0.36122529342171705.
[I 2024-01-16 03:42:53,172] Trial 156 finished with value: 0.3963461084312868 and parameters: {'model_name': 'KNNImputer', 'weights': 'uniform', 'keep_empty_features': False}. Best is trial 128 with value: 0.36122529342171705.
[I 2024-01-16 03:43:06,552] Trial 157 finished with value: 0.3963461084312868 and parameters: {'model_name': 'KNNImputer', 'weights': 'uniform', 'keep_empty_features': False}. Best is trial 128 with value: 0.36122529342171705.
[I 2024-01-16 03:44:03,783] Trial 104 finished with value: 0.46938757852858987 and parameters: {'model_name': 'IterativeImputer', 'sample_posterior': True, 'initial_strategy': 'most_frequent', 'imputation_order': 'random'}. Best is trial 128 with value: 0.36122529342171705.
[I 2024-01-16 03:44:14,296] Trial 106 finished with value: 0.4700987427973667 and parameters: {'model_name': 'IterativeImputer', 'sample_posterior': True, 'initial_strategy': 'most_frequent', 'imputation_order': 'ascending'}. Best is trial 128 with value: 0.36122529342171705.
[I 2024-01-16 03:44:36,011] Trial 105 finished with value: 0.4480377319340788 and parameters: {'model_name': 'IterativeImputer', 'sample_posterior': True, 'initial_strategy': 'most_frequent', 'imputation_order': 'random'}. Best is trial 128 with value: 0.36122529342171705.
[I 2024-01-16 03:44:38,785] Trial 136 finished with value: 0.36122547787571385 and parameters: {'model_name': 'IterativeImputer', 'sample_posterior': False, 'initial_strategy': 'most_frequent', 'imputation_order': 'random'}. Best is trial 128 with value: 0.36122529342171705.
[I 2024-01-16 03:44:50,431] Trial 107 finished with value: 0.46512597749459106 and parameters: {'model_name': 'IterativeImputer', 'sample_posterior': True, 'initial_strategy': 'most_frequent', 'imputation_order': 'ascending'}. Best is trial 128 with value: 0.36122529342171705.
[I 2024-01-16 03:45:09,169] Trial 108 finished with value: 0.457282962777661 and parameters: {'model_name': 'IterativeImputer', 'sample_posterior': True, 'initial_strategy': 'most_frequent', 'imputation_order': 'ascending'}. Best is trial 128 with value: 0.36122529342171705.
[I 2024-01-16 03:45:24,204] Trial 166 finished with value: 0.5082445839682396 and parameters: {'model_name': 'SimpleImputer', 'strategy': 'most_frequent'}. Best is trial 128 with value: 0.36122529342171705.
[I 2024-01-16 03:46:06,574] Trial 143 finished with value: 0.361225433682097 and parameters: {'model_name': 'IterativeImputer', 'sample_posterior': False, 'initial_strategy': 'most_frequent', 'imputation_order': 'arabic'}. Best is trial 128 with value: 0.36122529342171705.
[I 2024-01-16 03:46:10,478] Trial 109 finished with value: 0.46163116855163083 and parameters: {'model_name': 'IterativeImputer', 'sample_posterior': True, 'initial_strategy': 'most_frequent', 'imputation_order': 'random'}. Best is trial 128 with value: 0.36122529342171705.
[I 2024-01-16 03:46:11,781] Trial 144 finished with value: 0.361225433682097 and parameters: {'model_name': 'IterativeImputer', 'sample_posterior': False, 'initial_strategy': 'most_frequent', 'imputation_order': 'arabic'}. Best is trial 128 with value: 0.36122529342171705.
[I 2024-01-16 03:46:42,188] Trial 145 finished with value: 0.361225433682097 and parameters: {'model_name': 'IterativeImputer', 'sample_posterior': False, 'initial_strategy': 'most_frequent', 'imputation_order': 'arabic'}. Best is trial 128 with value: 0.36122529342171705.
[I 2024-01-16 03:46:43,639] Trial 111 finished with value: 0.46091164901448944 and parameters: {'model_name': 'IterativeImputer', 'sample_posterior': True, 'initial_strategy': 'most_frequent', 'imputation_order': 'random'}. Best is trial 128 with value: 0.36122529342171705.
[I 2024-01-16 03:46:46,916] Trial 110 finished with value: 0.47076934047150765 and parameters: {'model_name': 'IterativeImputer', 'sample_posterior': True, 'initial_strategy': 'most_frequent', 'imputation_order': 'random'}. Best is trial 128 with value: 0.36122529342171705.
[I 2024-01-16 03:46:51,294] Trial 113 finished with value: 0.4638823288531258 and parameters: {'model_name': 'IterativeImputer', 'sample_posterior': True, 'initial_strategy': 'most_frequent', 'imputation_order': 'random'}. Best is trial 128 with value: 0.36122529342171705.
[I 2024-01-16 03:46:53,768] Trial 112 finished with value: 0.46194748304769206 and parameters: {'model_name': 'IterativeImputer', 'sample_posterior': True, 'initial_strategy': 'most_frequent', 'imputation_order': 'random'}. Best is trial 128 with value: 0.36122529342171705.
[I 2024-01-16 03:47:10,332] Trial 114 finished with value: 0.46125479479961695 and parameters: {'model_name': 'IterativeImputer', 'sample_posterior': True, 'initial_strategy': 'most_frequent', 'imputation_order': 'random'}. Best is trial 128 with value: 0.36122529342171705.
[I 2024-01-16 03:47:34,020] Trial 146 finished with value: 0.361225433682097 and parameters: {'model_name': 'IterativeImputer', 'sample_posterior': False, 'initial_strategy': 'most_frequent', 'imputation_order': 'arabic'}. Best is trial 128 with value: 0.36122529342171705.
[I 2024-01-16 03:47:49,544] Trial 115 finished with value: 0.468455475459258 and parameters: {'model_name': 'IterativeImputer', 'sample_posterior': True, 'initial_strategy': 'most_frequent', 'imputation_order': 'random'}. Best is trial 128 with value: 0.36122529342171705.
[I 2024-01-16 03:48:13,999] Trial 139 finished with value: 0.36122554241734467 and parameters: {'model_name': 'IterativeImputer', 'sample_posterior': False, 'initial_strategy': 'most_frequent', 'imputation_order': 'random'}. Best is trial 128 with value: 0.36122529342171705.
[I 2024-01-16 03:48:18,209] Trial 140 finished with value: 0.36122548700156243 and parameters: {'model_name': 'IterativeImputer', 'sample_posterior': False, 'initial_strategy': 'most_frequent', 'imputation_order': 'random'}. Best is trial 128 with value: 0.36122529342171705.
[I 2024-01-16 03:48:29,861] Trial 147 finished with value: 0.361225433682097 and parameters: {'model_name': 'IterativeImputer', 'sample_posterior': False, 'initial_strategy': 'most_frequent', 'imputation_order': 'arabic'}. Best is trial 128 with value: 0.36122529342171705.
[I 2024-01-16 03:48:32,129] Trial 138 finished with value: 0.36122547787893755 and parameters: {'model_name': 'IterativeImputer', 'sample_posterior': False, 'initial_strategy': 'most_frequent', 'imputation_order': 'random'}. Best is trial 128 with value: 0.36122529342171705.
[I 2024-01-16 03:48:34,471] Trial 148 finished with value: 0.361225433682097 and parameters: {'model_name': 'IterativeImputer', 'sample_posterior': False, 'initial_strategy': 'most_frequent', 'imputation_order': 'arabic'}. Best is trial 128 with value: 0.36122529342171705.
[I 2024-01-16 03:48:37,428] Trial 137 finished with value: 0.3612254404931311 and parameters: {'model_name': 'IterativeImputer', 'sample_posterior': False, 'initial_strategy': 'most_frequent', 'imputation_order': 'random'}. Best is trial 128 with value: 0.36122529342171705.
[I 2024-01-16 03:48:39,490] Trial 142 finished with value: 0.3612255183557755 and parameters: {'model_name': 'IterativeImputer', 'sample_posterior': False, 'initial_strategy': 'most_frequent', 'imputation_order': 'random'}. Best is trial 128 with value: 0.36122529342171705.
[I 2024-01-16 03:48:41,483] Trial 149 finished with value: 0.361225433682097 and parameters: {'model_name': 'IterativeImputer', 'sample_posterior': False, 'initial_strategy': 'most_frequent', 'imputation_order': 'arabic'}. Best is trial 128 with value: 0.36122529342171705.
[I 2024-01-16 03:48:56,563] Trial 141 finished with value: 0.3612255253039528 and parameters: {'model_name': 'IterativeImputer', 'sample_posterior': False, 'initial_strategy': 'most_frequent', 'imputation_order': 'random'}. Best is trial 128 with value: 0.36122529342171705.
[I 2024-01-16 03:48:58,193] Trial 187 finished with value: 0.5082445839682396 and parameters: {'model_name': 'SimpleImputer', 'strategy': 'constant'}. Best is trial 128 with value: 0.36122529342171705.
[I 2024-01-16 03:49:08,796] Trial 150 finished with value: 0.361225433682097 and parameters: {'model_name': 'IterativeImputer', 'sample_posterior': False, 'initial_strategy': 'most_frequent', 'imputation_order': 'arabic'}. Best is trial 128 with value: 0.36122529342171705.
[I 2024-01-16 03:49:33,477] Trial 152 finished with value: 0.361225433682097 and parameters: {'model_name': 'IterativeImputer', 'sample_posterior': False, 'initial_strategy': 'most_frequent', 'imputation_order': 'arabic'}. Best is trial 128 with value: 0.36122529342171705.
[I 2024-01-16 03:49:35,096] Trial 151 finished with value: 0.361225433682097 and parameters: {'model_name': 'IterativeImputer', 'sample_posterior': False, 'initial_strategy': 'most_frequent', 'imputation_order': 'arabic'}. Best is trial 128 with value: 0.36122529342171705.
[I 2024-01-16 03:49:40,371] Trial 153 finished with value: 0.361225433682097 and parameters: {'model_name': 'IterativeImputer', 'sample_posterior': False, 'initial_strategy': 'most_frequent', 'imputation_order': 'arabic'}. Best is trial 128 with value: 0.36122529342171705.
[I 2024-01-16 03:49:51,595] Trial 154 finished with value: 0.361225433682097 and parameters: {'model_name': 'IterativeImputer', 'sample_posterior': False, 'initial_strategy': 'most_frequent', 'imputation_order': 'arabic'}. Best is trial 128 with value: 0.36122529342171705.
[I 2024-01-16 03:49:59,996] Trial 116 finished with value: 0.4611183506462496 and parameters: {'model_name': 'IterativeImputer', 'sample_posterior': True, 'initial_strategy': 'most_frequent', 'imputation_order': 'random'}. Best is trial 128 with value: 0.36122529342171705.
[I 2024-01-16 03:51:17,451] Trial 117 finished with value: 0.46271543126950093 and parameters: {'model_name': 'IterativeImputer', 'sample_posterior': True, 'initial_strategy': 'most_frequent', 'imputation_order': 'random'}. Best is trial 128 with value: 0.36122529342171705.
[I 2024-01-16 03:51:19,267] Trial 118 finished with value: 0.461777495500606 and parameters: {'model_name': 'IterativeImputer', 'sample_posterior': True, 'initial_strategy': 'most_frequent', 'imputation_order': 'random'}. Best is trial 128 with value: 0.36122529342171705.
[I 2024-01-16 03:51:22,673] Trial 195 finished with value: inf and parameters: {'model_name': 'GAIN', 'batch_size': 899, 'hint_rate': 0.92, 'alpha': 96, 'iterations': 41499}. Best is trial 128 with value: 0.36122529342171705.
[I 2024-01-16 03:51:23,768] Trial 155 finished with value: 0.361225433682097 and parameters: {'model_name': 'IterativeImputer', 'sample_posterior': False, 'initial_strategy': 'most_frequent', 'imputation_order': 'arabic'}. Best is trial 128 with value: 0.36122529342171705.
[I 2024-01-16 03:51:38,491] Trial 158 finished with value: 0.361225433682097 and parameters: {'model_name': 'IterativeImputer', 'sample_posterior': False, 'initial_strategy': 'most_frequent', 'imputation_order': 'arabic'}. Best is trial 128 with value: 0.36122529342171705.
[I 2024-01-16 03:51:39,621] Trial 159 finished with value: 0.361225433682097 and parameters: {'model_name': 'IterativeImputer', 'sample_posterior': False, 'initial_strategy': 'most_frequent', 'imputation_order': 'arabic'}. Best is trial 128 with value: 0.36122529342171705.
[I 2024-01-16 03:51:46,385] Trial 160 finished with value: 0.361225433682097 and parameters: {'model_name': 'IterativeImputer', 'sample_posterior': False, 'initial_strategy': 'most_frequent', 'imputation_order': 'arabic'}. Best is trial 128 with value: 0.36122529342171705.
[I 2024-01-16 03:52:50,953] Trial 169 finished with value: 0.36122543286820663 and parameters: {'model_name': 'IterativeImputer', 'sample_posterior': False, 'initial_strategy': 'median', 'imputation_order': 'roman'}. Best is trial 128 with value: 0.36122529342171705.
[I 2024-01-16 03:53:05,983] Trial 171 finished with value: 0.36122543286820663 and parameters: {'model_name': 'IterativeImputer', 'sample_posterior': False, 'initial_strategy': 'median', 'imputation_order': 'roman'}. Best is trial 128 with value: 0.36122529342171705.
[I 2024-01-16 03:53:07,317] Trial 174 finished with value: 0.36122543286820663 and parameters: {'model_name': 'IterativeImputer', 'sample_posterior': False, 'initial_strategy': 'constant', 'imputation_order': 'roman'}. Best is trial 128 with value: 0.36122529342171705.
[I 2024-01-16 03:53:14,307] Trial 28 finished with value: inf and parameters: {'model_name': 'GAIN', 'batch_size': 25, 'hint_rate': 0.5800000000000001, 'alpha': 63, 'iterations': 12202}. Best is trial 128 with value: 0.36122529342171705.
[I 2024-01-16 03:53:17,814] Trial 199 finished with value: 0.5025423872773891 and parameters: {'model_name': 'GAIN', 'batch_size': 5, 'hint_rate': 0.03, 'alpha': 93, 'iterations': 34}. Best is trial 128 with value: 0.36122529342171705.
[I 2024-01-16 03:53:20,856] Trial 197 finished with value: 0.4990247478932231 and parameters: {'model_name': 'GAIN', 'batch_size': 6, 'hint_rate': 0.02, 'alpha': 97, 'iterations': 42}. Best is trial 128 with value: 0.36122529342171705.
[I 2024-01-16 03:53:36,041] Trial 119 finished with value: 0.4637250606763904 and parameters: {'model_name': 'IterativeImputer', 'sample_posterior': True, 'initial_strategy': 'most_frequent', 'imputation_order': 'random'}. Best is trial 128 with value: 0.36122529342171705.
[I 2024-01-16 03:53:37,914] Trial 198 finished with value: 0.5063264035473461 and parameters: {'model_name': 'GAIN', 'batch_size': 9, 'hint_rate': 0.03, 'alpha': 100, 'iterations': 55}. Best is trial 128 with value: 0.36122529342171705.
[I 2024-01-16 03:53:44,132] Trial 181 finished with value: 0.36122543286820663 and parameters: {'model_name': 'IterativeImputer', 'sample_posterior': False, 'initial_strategy': 'constant', 'imputation_order': 'roman'}. Best is trial 128 with value: 0.36122529342171705.
[I 2024-01-16 03:53:48,318] Trial 184 finished with value: 0.36122543286820663 and parameters: {'model_name': 'IterativeImputer', 'sample_posterior': False, 'initial_strategy': 'constant', 'imputation_order': 'roman'}. Best is trial 128 with value: 0.36122529342171705.
[I 2024-01-16 03:53:58,901] Trial 189 finished with value: 0.36122543286820663 and parameters: {'model_name': 'IterativeImputer', 'sample_posterior': False, 'initial_strategy': 'constant', 'imputation_order': 'roman'}. Best is trial 128 with value: 0.36122529342171705.
