[I 2024-04-15 17:04:40,295] Trial 183 finished with value: 13.702207695392058 and parameters: {'model_name': 'GAIN', 'batch_size': 3, 'hint_rate': 0.77, 'alpha': 82, 'iterations': 117}. Best is trial 68 with value: 11.864780781668479.
[I 2024-04-15 17:04:49,367] Trial 181 finished with value: 13.90981208648338 and parameters: {'model_name': 'GAIN', 'batch_size': 3, 'hint_rate': 0.72, 'alpha': 37, 'iterations': 117}. Best is trial 68 with value: 11.864780781668479.
[I 2024-04-15 17:04:52,357] Trial 189 finished with value: 14.873556865317255 and parameters: {'model_name': 'GAIN', 'batch_size': 3, 'hint_rate': 0.76, 'alpha': 81, 'iterations': 117}. Best is trial 68 with value: 11.864780781668479.
[I 2024-04-15 17:04:55,804] Trial 174 finished with value: 16.770802576806947 and parameters: {'model_name': 'GAIN', 'batch_size': 10, 'hint_rate': 0.75, 'alpha': 82, 'iterations': 127}. Best is trial 68 with value: 11.864780781668479.
[I 2024-04-15 17:04:59,896] Trial 186 finished with value: 14.995924554744835 and parameters: {'model_name': 'GAIN', 'batch_size': 3, 'hint_rate': 0.7100000000000001, 'alpha': 81, 'iterations': 117}. Best is trial 68 with value: 11.864780781668479.
[I 2024-04-15 17:05:04,520] Trial 164 finished with value: 16.459967250344164 and parameters: {'model_name': 'GAIN', 'batch_size': 9, 'hint_rate': 0.88, 'alpha': 12, 'iterations': 162}. Best is trial 68 with value: 11.864780781668479.
[I 2024-04-15 17:05:07,376] Trial 188 finished with value: 15.71352935770921 and parameters: {'model_name': 'GAIN', 'batch_size': 3, 'hint_rate': 0.72, 'alpha': 82, 'iterations': 119}. Best is trial 68 with value: 11.864780781668479.
[I 2024-04-15 17:05:09,925] Trial 193 finished with value: 14.456425499610148 and parameters: {'model_name': 'GAIN', 'batch_size': 4, 'hint_rate': 0.65, 'alpha': 57, 'iterations': 93}. Best is trial 68 with value: 11.864780781668479.
[I 2024-04-15 17:05:12,892] Trial 152 finished with value: 19.25655601623576 and parameters: {'model_name': 'RandomForestImputer', 'max_iter': 5, 'decreasing': True, 'min_samples_split': 0.5, 'min_samples_leaf': 0.1, 'max_features': 0.9, 'warm_start': False}. Best is trial 68 with value: 11.864780781668479.
[I 2024-04-15 17:05:14,856] Trial 191 finished with value: 17.289646021300292 and parameters: {'model_name': 'GAIN', 'batch_size': 3, 'hint_rate': 0.7100000000000001, 'alpha': 86, 'iterations': 99}. Best is trial 68 with value: 11.864780781668479.
[I 2024-04-15 17:05:19,603] Trial 190 finished with value: 16.95138497937045 and parameters: {'model_name': 'GAIN', 'batch_size': 3, 'hint_rate': 0.7100000000000001, 'alpha': 87, 'iterations': 118}. Best is trial 68 with value: 11.864780781668479.
[I 2024-04-15 17:05:22,955] Trial 162 finished with value: 16.742884464646774 and parameters: {'model_name': 'GAIN', 'batch_size': 12, 'hint_rate': 0.88, 'alpha': 80, 'iterations': 175}. Best is trial 68 with value: 11.864780781668479.
[I 2024-04-15 17:05:24,606] Trial 192 finished with value: 16.32714462900143 and parameters: {'model_name': 'GAIN', 'batch_size': 3, 'hint_rate': 0.79, 'alpha': 56, 'iterations': 114}. Best is trial 68 with value: 11.864780781668479.
[I 2024-04-15 17:05:31,264] Trial 180 finished with value: 16.141594341664742 and parameters: {'model_name': 'GAIN', 'batch_size': 10, 'hint_rate': 0.73, 'alpha': 76, 'iterations': 154}. Best is trial 68 with value: 11.864780781668479.
[I 2024-04-15 17:05:37,035] Trial 195 finished with value: 15.15503414290345 and parameters: {'model_name': 'GAIN', 'batch_size': 4, 'hint_rate': 0.78, 'alpha': 56, 'iterations': 137}. Best is trial 68 with value: 11.864780781668479.
[I 2024-04-15 17:05:38,447] Trial 194 finished with value: 14.928705612655131 and parameters: {'model_name': 'GAIN', 'batch_size': 4, 'hint_rate': 0.78, 'alpha': 5, 'iterations': 141}. Best is trial 68 with value: 11.864780781668479.
[I 2024-04-15 17:05:47,213] Trial 197 finished with value: 14.989331202856624 and parameters: {'model_name': 'GAIN', 'batch_size': 2, 'hint_rate': 0.85, 'alpha': 5, 'iterations': 157}. Best is trial 68 with value: 11.864780781668479.
[I 2024-04-15 17:05:49,375] Trial 41 finished with value: 19.162772632583863 and parameters: {'model_name': 'RandomForestImputer', 'max_iter': 19, 'decreasing': False, 'min_samples_split': 0.7000000000000001, 'min_samples_leaf': 0.8, 'max_features': 0.30000000000000004, 'warm_start': False}. Best is trial 68 with value: 11.864780781668479.
[I 2024-04-15 17:05:54,660] Trial 27 finished with value: 19.28436964352893 and parameters: {'model_name': 'RandomForestImputer', 'max_iter': 22, 'decreasing': True, 'min_samples_split': 0.8, 'min_samples_leaf': 0.1, 'max_features': 0.4, 'warm_start': False}. Best is trial 68 with value: 11.864780781668479.
[I 2024-04-15 17:06:39,788] Trial 22 finished with value: 19.10013455547784 and parameters: {'model_name': 'RandomForestImputer', 'max_iter': 36, 'decreasing': True, 'min_samples_split': 0.7000000000000001, 'min_samples_leaf': 0.5, 'max_features': 0.5, 'warm_start': False}. Best is trial 68 with value: 11.864780781668479.
[I 2024-04-15 17:07:06,285] Trial 62 finished with value: 19.13790488954104 and parameters: {'model_name': 'RandomForestImputer', 'max_iter': 44, 'decreasing': False, 'min_samples_split': 0.2, 'min_samples_leaf': 0.9, 'max_features': 0.6, 'warm_start': False}. Best is trial 68 with value: 11.864780781668479.
[I 2024-04-15 17:07:35,701] Trial 18 finished with value: 19.12029679153664 and parameters: {'model_name': 'RandomForestImputer', 'max_iter': 99, 'decreasing': True, 'min_samples_split': 0.8, 'min_samples_leaf': 0.9, 'max_features': 0.30000000000000004, 'warm_start': False}. Best is trial 68 with value: 11.864780781668479.
[I 2024-04-15 17:13:32,916] Trial 29 finished with value: 21.020407305422527 and parameters: {'model_name': 'GAIN', 'batch_size': 3, 'hint_rate': 0.59, 'alpha': 10, 'iterations': 16115}. Best is trial 68 with value: 11.864780781668479.
