[I 2024-02-27 13:11:28,490] Trial 78 finished with value: 0.8499937091954006 and parameters: {'model_name': 'SimpleImputer', 'strategy': 'most_frequent'}. Best is trial 6 with value: 0.7948219008558837.
[I 2024-02-27 13:11:28,720] Trial 114 finished with value: 0.7948219008558837 and parameters: {'model_name': 'SimpleImputer', 'strategy': 'constant'}. Best is trial 6 with value: 0.7948219008558837.
[I 2024-02-27 13:11:29,085] Trial 115 finished with value: 0.7948219008558837 and parameters: {'model_name': 'SimpleImputer', 'strategy': 'constant'}. Best is trial 6 with value: 0.7948219008558837.
[I 2024-02-27 13:11:29,389] Trial 119 finished with value: 0.7948219008558837 and parameters: {'model_name': 'SimpleImputer', 'strategy': 'constant'}. Best is trial 6 with value: 0.7948219008558837.
[I 2024-02-27 13:11:29,597] Trial 118 finished with value: 0.7948219008558837 and parameters: {'model_name': 'SimpleImputer', 'strategy': 'constant'}. Best is trial 6 with value: 0.7948219008558837.
[I 2024-02-27 13:11:29,824] Trial 83 finished with value: 0.8499937091954006 and parameters: {'model_name': 'SimpleImputer', 'strategy': 'most_frequent'}. Best is trial 6 with value: 0.7948219008558837.
[I 2024-02-27 13:11:30,059] Trial 81 finished with value: 0.8499937091954006 and parameters: {'model_name': 'SimpleImputer', 'strategy': 'most_frequent'}. Best is trial 6 with value: 0.7948219008558837.
[I 2024-02-27 13:11:30,242] Trial 116 finished with value: 0.7948219008558837 and parameters: {'model_name': 'SimpleImputer', 'strategy': 'constant'}. Best is trial 6 with value: 0.7948219008558837.
[I 2024-02-27 13:11:30,497] Trial 122 finished with value: 0.7948219008558837 and parameters: {'model_name': 'SimpleImputer', 'strategy': 'constant'}. Best is trial 6 with value: 0.7948219008558837.
[I 2024-02-27 13:11:30,706] Trial 123 finished with value: 0.7948219008558837 and parameters: {'model_name': 'SimpleImputer', 'strategy': 'constant'}. Best is trial 6 with value: 0.7948219008558837.
[I 2024-02-27 13:11:31,040] Trial 124 finished with value: 0.7948219008558837 and parameters: {'model_name': 'SimpleImputer', 'strategy': 'constant'}. Best is trial 6 with value: 0.7948219008558837.
[I 2024-02-27 13:11:31,413] Trial 121 finished with value: 0.7948219008558837 and parameters: {'model_name': 'SimpleImputer', 'strategy': 'constant'}. Best is trial 6 with value: 0.7948219008558837.
[I 2024-02-27 13:11:31,739] Trial 129 finished with value: 0.7948219008558837 and parameters: {'model_name': 'SimpleImputer', 'strategy': 'constant'}. Best is trial 6 with value: 0.7948219008558837.
[I 2024-02-27 13:11:32,037] Trial 125 finished with value: 0.7948219008558837 and parameters: {'model_name': 'SimpleImputer', 'strategy': 'constant'}. Best is trial 6 with value: 0.7948219008558837.
[I 2024-02-27 13:11:32,325] Trial 127 finished with value: 0.7948219008558837 and parameters: {'model_name': 'SimpleImputer', 'strategy': 'constant'}. Best is trial 6 with value: 0.7948219008558837.
[I 2024-02-27 13:11:32,648] Trial 128 finished with value: 0.7948219008558837 and parameters: {'model_name': 'SimpleImputer', 'strategy': 'constant'}. Best is trial 6 with value: 0.7948219008558837.
[I 2024-02-27 13:11:32,827] Trial 130 finished with value: 0.7948219008558837 and parameters: {'model_name': 'SimpleImputer', 'strategy': 'constant'}. Best is trial 6 with value: 0.7948219008558837.
[I 2024-02-27 13:11:33,077] Trial 131 finished with value: 0.7948219008558837 and parameters: {'model_name': 'SimpleImputer', 'strategy': 'constant'}. Best is trial 6 with value: 0.7948219008558837.
[I 2024-02-27 13:11:33,286] Trial 126 finished with value: 0.7948219008558837 and parameters: {'model_name': 'SimpleImputer', 'strategy': 'constant'}. Best is trial 6 with value: 0.7948219008558837.
[I 2024-02-27 13:11:33,467] Trial 85 finished with value: 0.8499937091954006 and parameters: {'model_name': 'SimpleImputer', 'strategy': 'most_frequent'}. Best is trial 6 with value: 0.7948219008558837.
[I 2024-02-27 13:11:33,724] Trial 120 finished with value: 0.7948219008558837 and parameters: {'model_name': 'SimpleImputer', 'strategy': 'constant'}. Best is trial 6 with value: 0.7948219008558837.
[I 2024-02-27 13:11:33,914] Trial 132 finished with value: 0.7948219008558837 and parameters: {'model_name': 'SimpleImputer', 'strategy': 'constant'}. Best is trial 6 with value: 0.7948219008558837.
[I 2024-02-27 13:11:34,329] Trial 91 finished with value: 0.8499937091954006 and parameters: {'model_name': 'SimpleImputer', 'strategy': 'most_frequent'}. Best is trial 6 with value: 0.7948219008558837.
[I 2024-02-27 13:11:34,576] Trial 86 finished with value: 0.8499937091954006 and parameters: {'model_name': 'SimpleImputer', 'strategy': 'most_frequent'}. Best is trial 6 with value: 0.7948219008558837.
[I 2024-02-27 13:11:34,870] Trial 94 finished with value: 0.8499937091954006 and parameters: {'model_name': 'SimpleImputer', 'strategy': 'most_frequent'}. Best is trial 6 with value: 0.7948219008558837.
[I 2024-02-27 13:11:35,140] Trial 133 finished with value: 0.7948219008558837 and parameters: {'model_name': 'SimpleImputer', 'strategy': 'constant'}. Best is trial 6 with value: 0.7948219008558837.
[I 2024-02-27 13:11:35,367] Trial 88 finished with value: 0.8499937091954006 and parameters: {'model_name': 'SimpleImputer', 'strategy': 'most_frequent'}. Best is trial 6 with value: 0.7948219008558837.
[I 2024-02-27 13:11:35,560] Trial 93 finished with value: 0.8499937091954006 and parameters: {'model_name': 'SimpleImputer', 'strategy': 'most_frequent'}. Best is trial 6 with value: 0.7948219008558837.
[I 2024-02-27 13:11:35,805] Trial 134 finished with value: 0.7948219008558837 and parameters: {'model_name': 'SimpleImputer', 'strategy': 'constant'}. Best is trial 6 with value: 0.7948219008558837.
[I 2024-02-27 13:11:35,973] Trial 92 finished with value: 0.8499937091954006 and parameters: {'model_name': 'SimpleImputer', 'strategy': 'most_frequent'}. Best is trial 6 with value: 0.7948219008558837.
[I 2024-02-27 13:11:36,206] Trial 96 finished with value: 0.8499937091954006 and parameters: {'model_name': 'SimpleImputer', 'strategy': 'most_frequent'}. Best is trial 6 with value: 0.7948219008558837.
[I 2024-02-27 13:11:36,378] Trial 97 finished with value: 0.8499937091954006 and parameters: {'model_name': 'SimpleImputer', 'strategy': 'most_frequent'}. Best is trial 6 with value: 0.7948219008558837.
[I 2024-02-27 13:11:36,656] Trial 84 finished with value: 0.8499937091954006 and parameters: {'model_name': 'SimpleImputer', 'strategy': 'most_frequent'}. Best is trial 6 with value: 0.7948219008558837.
[I 2024-02-27 13:11:36,866] Trial 87 finished with value: 0.8499937091954006 and parameters: {'model_name': 'SimpleImputer', 'strategy': 'most_frequent'}. Best is trial 6 with value: 0.7948219008558837.
[I 2024-02-27 13:11:37,138] Trial 137 finished with value: 0.7948219008558837 and parameters: {'model_name': 'SimpleImputer', 'strategy': 'constant'}. Best is trial 6 with value: 0.7948219008558837.
[I 2024-02-27 13:11:37,388] Trial 90 finished with value: 0.8499937091954006 and parameters: {'model_name': 'SimpleImputer', 'strategy': 'most_frequent'}. Best is trial 6 with value: 0.7948219008558837.
[I 2024-02-27 13:11:37,726] Trial 136 finished with value: 0.7948219008558837 and parameters: {'model_name': 'SimpleImputer', 'strategy': 'constant'}. Best is trial 6 with value: 0.7948219008558837.
[I 2024-02-27 13:11:37,955] Trial 89 finished with value: 0.8499937091954006 and parameters: {'model_name': 'SimpleImputer', 'strategy': 'most_frequent'}. Best is trial 6 with value: 0.7948219008558837.
[I 2024-02-27 13:11:38,297] Trial 141 finished with value: 0.7948219008558837 and parameters: {'model_name': 'SimpleImputer', 'strategy': 'constant'}. Best is trial 6 with value: 0.7948219008558837.
[I 2024-02-27 13:11:38,604] Trial 135 finished with value: 0.7948219008558837 and parameters: {'model_name': 'SimpleImputer', 'strategy': 'constant'}. Best is trial 6 with value: 0.7948219008558837.
[I 2024-02-27 13:11:38,955] Trial 139 finished with value: 0.7948219008558837 and parameters: {'model_name': 'SimpleImputer', 'strategy': 'constant'}. Best is trial 6 with value: 0.7948219008558837.
[I 2024-02-27 13:11:39,225] Trial 142 finished with value: 0.7948219008558837 and parameters: {'model_name': 'SimpleImputer', 'strategy': 'constant'}. Best is trial 6 with value: 0.7948219008558837.
[I 2024-02-27 13:11:39,441] Trial 140 finished with value: 0.7948219008558837 and parameters: {'model_name': 'SimpleImputer', 'strategy': 'constant'}. Best is trial 6 with value: 0.7948219008558837.
[I 2024-02-27 13:11:39,824] Trial 101 finished with value: 0.8499937091954006 and parameters: {'model_name': 'SimpleImputer', 'strategy': 'most_frequent'}. Best is trial 6 with value: 0.7948219008558837.
[I 2024-02-27 13:11:40,094] Trial 99 finished with value: 0.8499937091954006 and parameters: {'model_name': 'SimpleImputer', 'strategy': 'most_frequent'}. Best is trial 6 with value: 0.7948219008558837.
[I 2024-02-27 13:11:40,301] Trial 143 finished with value: 0.7948219008558837 and parameters: {'model_name': 'SimpleImputer', 'strategy': 'constant'}. Best is trial 6 with value: 0.7948219008558837.
[I 2024-02-27 13:11:40,558] Trial 95 finished with value: 0.8499937091954006 and parameters: {'model_name': 'SimpleImputer', 'strategy': 'most_frequent'}. Best is trial 6 with value: 0.7948219008558837.
[I 2024-02-27 13:11:40,867] Trial 138 finished with value: 0.7948219008558837 and parameters: {'model_name': 'SimpleImputer', 'strategy': 'constant'}. Best is trial 6 with value: 0.7948219008558837.
[I 2024-02-27 13:11:41,488] Trial 100 finished with value: 0.8499937091954006 and parameters: {'model_name': 'SimpleImputer', 'strategy': 'most_frequent'}. Best is trial 6 with value: 0.7948219008558837.
[I 2024-02-27 13:11:41,928] Trial 98 finished with value: 0.8499937091954006 and parameters: {'model_name': 'SimpleImputer', 'strategy': 'most_frequent'}. Best is trial 6 with value: 0.7948219008558837.
[I 2024-02-27 13:11:43,092] Trial 149 finished with value: 0.7948219008558837 and parameters: {'model_name': 'SimpleImputer', 'strategy': 'median'}. Best is trial 6 with value: 0.7948219008558837.
[I 2024-02-27 13:11:43,406] Trial 145 finished with value: 0.7948219008558837 and parameters: {'model_name': 'SimpleImputer', 'strategy': 'median'}. Best is trial 6 with value: 0.7948219008558837.
[I 2024-02-27 13:11:43,720] Trial 148 finished with value: 0.7948219008558837 and parameters: {'model_name': 'SimpleImputer', 'strategy': 'median'}. Best is trial 6 with value: 0.7948219008558837.
[I 2024-02-27 13:11:43,957] Trial 144 finished with value: 0.7948219008558837 and parameters: {'model_name': 'SimpleImputer', 'strategy': 'median'}. Best is trial 6 with value: 0.7948219008558837.
[I 2024-02-27 13:11:44,283] Trial 147 finished with value: 0.7948219008558837 and parameters: {'model_name': 'SimpleImputer', 'strategy': 'median'}. Best is trial 6 with value: 0.7948219008558837.
[I 2024-02-27 13:11:44,563] Trial 150 finished with value: 0.7948219008558837 and parameters: {'model_name': 'SimpleImputer', 'strategy': 'median'}. Best is trial 6 with value: 0.7948219008558837.
[I 2024-02-27 13:11:44,815] Trial 151 finished with value: 0.7948219008558837 and parameters: {'model_name': 'SimpleImputer', 'strategy': 'median'}. Best is trial 6 with value: 0.7948219008558837.
[I 2024-02-27 13:11:45,170] Trial 146 finished with value: 0.7948219008558837 and parameters: {'model_name': 'SimpleImputer', 'strategy': 'median'}. Best is trial 6 with value: 0.7948219008558837.
[I 2024-02-27 13:11:45,443] Trial 153 finished with value: 0.7948219008558837 and parameters: {'model_name': 'SimpleImputer', 'strategy': 'median'}. Best is trial 6 with value: 0.7948219008558837.
[I 2024-02-27 13:11:45,719] Trial 154 finished with value: 0.7948219008558837 and parameters: {'model_name': 'SimpleImputer', 'strategy': 'median'}. Best is trial 6 with value: 0.7948219008558837.
[I 2024-02-27 13:11:46,020] Trial 160 finished with value: 0.7948219008558837 and parameters: {'model_name': 'SimpleImputer', 'strategy': 'median'}. Best is trial 6 with value: 0.7948219008558837.
[I 2024-02-27 13:11:46,228] Trial 161 finished with value: 0.7948219008558837 and parameters: {'model_name': 'SimpleImputer', 'strategy': 'median'}. Best is trial 6 with value: 0.7948219008558837.
[I 2024-02-27 13:11:46,501] Trial 159 finished with value: 0.7948219008558837 and parameters: {'model_name': 'SimpleImputer', 'strategy': 'median'}. Best is trial 6 with value: 0.7948219008558837.
[I 2024-02-27 13:11:46,798] Trial 155 finished with value: 0.7948219008558837 and parameters: {'model_name': 'SimpleImputer', 'strategy': 'median'}. Best is trial 6 with value: 0.7948219008558837.
[I 2024-02-27 13:11:47,015] Trial 152 finished with value: 0.7948219008558837 and parameters: {'model_name': 'SimpleImputer', 'strategy': 'median'}. Best is trial 6 with value: 0.7948219008558837.
[I 2024-02-27 13:11:47,235] Trial 156 finished with value: 0.7948219008558837 and parameters: {'model_name': 'SimpleImputer', 'strategy': 'median'}. Best is trial 6 with value: 0.7948219008558837.
[I 2024-02-27 13:11:47,446] Trial 158 finished with value: 0.7948219008558837 and parameters: {'model_name': 'SimpleImputer', 'strategy': 'median'}. Best is trial 6 with value: 0.7948219008558837.
[I 2024-02-27 13:11:47,657] Trial 164 finished with value: 0.7948219008558837 and parameters: {'model_name': 'SimpleImputer', 'strategy': 'median'}. Best is trial 6 with value: 0.7948219008558837.
[I 2024-02-27 13:11:48,060] Trial 163 finished with value: 0.7948219008558837 and parameters: {'model_name': 'SimpleImputer', 'strategy': 'median'}. Best is trial 6 with value: 0.7948219008558837.
[I 2024-02-27 13:11:48,272] Trial 157 finished with value: 0.7948219008558837 and parameters: {'model_name': 'SimpleImputer', 'strategy': 'median'}. Best is trial 6 with value: 0.7948219008558837.
[I 2024-02-27 13:11:48,537] Trial 176 finished with value: 0.7948219008558837 and parameters: {'model_name': 'SimpleImputer', 'strategy': 'median'}. Best is trial 6 with value: 0.7948219008558837.
[I 2024-02-27 13:11:48,817] Trial 162 finished with value: 0.7948219008558837 and parameters: {'model_name': 'SimpleImputer', 'strategy': 'median'}. Best is trial 6 with value: 0.7948219008558837.
[I 2024-02-27 13:11:49,040] Trial 169 finished with value: 0.7948219008558837 and parameters: {'model_name': 'SimpleImputer', 'strategy': 'median'}. Best is trial 6 with value: 0.7948219008558837.
[I 2024-02-27 13:11:49,241] Trial 167 finished with value: 0.7948219008558837 and parameters: {'model_name': 'SimpleImputer', 'strategy': 'median'}. Best is trial 6 with value: 0.7948219008558837.
[I 2024-02-27 13:11:49,520] Trial 171 finished with value: 0.7948219008558837 and parameters: {'model_name': 'SimpleImputer', 'strategy': 'median'}. Best is trial 6 with value: 0.7948219008558837.
[I 2024-02-27 13:11:49,733] Trial 165 finished with value: 0.7948219008558837 and parameters: {'model_name': 'SimpleImputer', 'strategy': 'median'}. Best is trial 6 with value: 0.7948219008558837.
[I 2024-02-27 13:11:49,954] Trial 166 finished with value: 0.7948219008558837 and parameters: {'model_name': 'SimpleImputer', 'strategy': 'median'}. Best is trial 6 with value: 0.7948219008558837.
[I 2024-02-27 13:11:50,181] Trial 168 finished with value: 0.7948219008558837 and parameters: {'model_name': 'SimpleImputer', 'strategy': 'median'}. Best is trial 6 with value: 0.7948219008558837.
[I 2024-02-27 13:11:50,410] Trial 170 finished with value: 0.7948219008558837 and parameters: {'model_name': 'SimpleImputer', 'strategy': 'median'}. Best is trial 6 with value: 0.7948219008558837.
[I 2024-02-27 13:11:50,633] Trial 172 finished with value: 0.7948219008558837 and parameters: {'model_name': 'SimpleImputer', 'strategy': 'median'}. Best is trial 6 with value: 0.7948219008558837.
[I 2024-02-27 13:11:50,978] Trial 175 finished with value: 0.7948219008558837 and parameters: {'model_name': 'SimpleImputer', 'strategy': 'median'}. Best is trial 6 with value: 0.7948219008558837.
[I 2024-02-27 13:11:51,223] Trial 177 finished with value: 0.7948219008558837 and parameters: {'model_name': 'SimpleImputer', 'strategy': 'median'}. Best is trial 6 with value: 0.7948219008558837.
[I 2024-02-27 13:11:51,453] Trial 179 finished with value: 0.7948219008558837 and parameters: {'model_name': 'SimpleImputer', 'strategy': 'median'}. Best is trial 6 with value: 0.7948219008558837.
[I 2024-02-27 13:11:51,684] Trial 182 finished with value: 0.7948219008558837 and parameters: {'model_name': 'SimpleImputer', 'strategy': 'median'}. Best is trial 6 with value: 0.7948219008558837.
[I 2024-02-27 13:11:51,917] Trial 173 finished with value: 0.7948219008558837 and parameters: {'model_name': 'SimpleImputer', 'strategy': 'median'}. Best is trial 6 with value: 0.7948219008558837.
[I 2024-02-27 13:11:52,166] Trial 180 finished with value: 0.7948219008558837 and parameters: {'model_name': 'SimpleImputer', 'strategy': 'median'}. Best is trial 6 with value: 0.7948219008558837.
[I 2024-02-27 13:11:52,431] Trial 178 finished with value: 0.7948219008558837 and parameters: {'model_name': 'SimpleImputer', 'strategy': 'median'}. Best is trial 6 with value: 0.7948219008558837.
[I 2024-02-27 13:11:52,663] Trial 174 finished with value: 0.7948219008558837 and parameters: {'model_name': 'SimpleImputer', 'strategy': 'median'}. Best is trial 6 with value: 0.7948219008558837.
[I 2024-02-27 13:11:52,877] Trial 183 finished with value: 0.7948219008558837 and parameters: {'model_name': 'SimpleImputer', 'strategy': 'median'}. Best is trial 6 with value: 0.7948219008558837.
[I 2024-02-27 13:11:53,086] Trial 181 finished with value: 0.7948219008558837 and parameters: {'model_name': 'SimpleImputer', 'strategy': 'median'}. Best is trial 6 with value: 0.7948219008558837.
[I 2024-02-27 13:11:53,345] Trial 189 finished with value: 0.7948219008558837 and parameters: {'model_name': 'SimpleImputer', 'strategy': 'median'}. Best is trial 6 with value: 0.7948219008558837.
[I 2024-02-27 13:11:53,566] Trial 186 finished with value: 0.7948219008558837 and parameters: {'model_name': 'SimpleImputer', 'strategy': 'median'}. Best is trial 6 with value: 0.7948219008558837.
[I 2024-02-27 13:11:53,800] Trial 185 finished with value: 0.7948219008558837 and parameters: {'model_name': 'SimpleImputer', 'strategy': 'median'}. Best is trial 6 with value: 0.7948219008558837.
[I 2024-02-27 13:11:54,007] Trial 184 finished with value: 0.7948219008558837 and parameters: {'model_name': 'SimpleImputer', 'strategy': 'median'}. Best is trial 6 with value: 0.7948219008558837.
[I 2024-02-27 13:11:54,217] Trial 188 finished with value: 0.7948219008558837 and parameters: {'model_name': 'SimpleImputer', 'strategy': 'median'}. Best is trial 6 with value: 0.7948219008558837.
[I 2024-02-27 13:11:54,526] Trial 191 finished with value: 0.7948219008558837 and parameters: {'model_name': 'SimpleImputer', 'strategy': 'median'}. Best is trial 6 with value: 0.7948219008558837.
[I 2024-02-27 13:11:54,734] Trial 190 finished with value: 0.7948219008558837 and parameters: {'model_name': 'SimpleImputer', 'strategy': 'median'}. Best is trial 6 with value: 0.7948219008558837.
[I 2024-02-27 13:11:54,965] Trial 187 finished with value: 0.7948219008558837 and parameters: {'model_name': 'SimpleImputer', 'strategy': 'median'}. Best is trial 6 with value: 0.7948219008558837.
[I 2024-02-27 13:11:55,290] Trial 193 finished with value: 0.7948219008558837 and parameters: {'model_name': 'SimpleImputer', 'strategy': 'median'}. Best is trial 6 with value: 0.7948219008558837.
[I 2024-02-27 13:11:55,498] Trial 192 finished with value: 0.7948219008558837 and parameters: {'model_name': 'SimpleImputer', 'strategy': 'median'}. Best is trial 6 with value: 0.7948219008558837.
[I 2024-02-27 13:11:55,750] Trial 198 finished with value: 0.7948219008558837 and parameters: {'model_name': 'SimpleImputer', 'strategy': 'median'}. Best is trial 6 with value: 0.7948219008558837.
[I 2024-02-27 13:11:55,955] Trial 194 finished with value: 0.7948219008558837 and parameters: {'model_name': 'SimpleImputer', 'strategy': 'median'}. Best is trial 6 with value: 0.7948219008558837.
[I 2024-02-27 13:11:56,143] Trial 195 finished with value: 0.7948219008558837 and parameters: {'model_name': 'SimpleImputer', 'strategy': 'median'}. Best is trial 6 with value: 0.7948219008558837.
[I 2024-02-27 13:11:56,348] Trial 196 finished with value: 0.7948219008558837 and parameters: {'model_name': 'SimpleImputer', 'strategy': 'median'}. Best is trial 6 with value: 0.7948219008558837.
[I 2024-02-27 13:11:56,548] Trial 199 finished with value: 0.7948219008558837 and parameters: {'model_name': 'SimpleImputer', 'strategy': 'median'}. Best is trial 6 with value: 0.7948219008558837.
