[I 2023-12-28 12:08:55,640] Trial 107 finished with value: 1.4942222553581073 and parameters: {'model_name': 'SimpleImputer', 'strategy': 'mean'}. Best is trial 7 with value: 1.4942222553581073.
[I 2023-12-28 12:08:55,941] Trial 80 finished with value: 2.070904045797603 and parameters: {'model_name': 'SimpleImputer', 'strategy': 'most_frequent'}. Best is trial 7 with value: 1.4942222553581073.
[I 2023-12-28 12:08:56,180] Trial 110 finished with value: 1.4942222553581073 and parameters: {'model_name': 'SimpleImputer', 'strategy': 'mean'}. Best is trial 7 with value: 1.4942222553581073.
[I 2023-12-28 12:08:56,440] Trial 78 finished with value: 2.070904045797603 and parameters: {'model_name': 'SimpleImputer', 'strategy': 'most_frequent'}. Best is trial 7 with value: 1.4942222553581073.
[I 2023-12-28 12:08:56,646] Trial 114 finished with value: 1.4942222553581073 and parameters: {'model_name': 'SimpleImputer', 'strategy': 'mean'}. Best is trial 7 with value: 1.4942222553581073.
[I 2023-12-28 12:08:57,083] Trial 117 finished with value: 1.4942222553581073 and parameters: {'model_name': 'SimpleImputer', 'strategy': 'mean'}. Best is trial 7 with value: 1.4942222553581073.
[I 2023-12-28 12:08:57,333] Trial 83 finished with value: 2.070904045797603 and parameters: {'model_name': 'SimpleImputer', 'strategy': 'most_frequent'}. Best is trial 7 with value: 1.4942222553581073.
[I 2023-12-28 12:08:57,553] Trial 120 finished with value: 1.4942222553581073 and parameters: {'model_name': 'SimpleImputer', 'strategy': 'mean'}. Best is trial 7 with value: 1.4942222553581073.
[I 2023-12-28 12:08:57,770] Trial 84 finished with value: 2.070904045797603 and parameters: {'model_name': 'SimpleImputer', 'strategy': 'most_frequent'}. Best is trial 7 with value: 1.4942222553581073.
[I 2023-12-28 12:08:57,985] Trial 79 finished with value: 2.070904045797603 and parameters: {'model_name': 'SimpleImputer', 'strategy': 'most_frequent'}. Best is trial 7 with value: 1.4942222553581073.
[I 2023-12-28 12:08:58,184] Trial 122 finished with value: 1.4942222553581073 and parameters: {'model_name': 'SimpleImputer', 'strategy': 'mean'}. Best is trial 7 with value: 1.4942222553581073.
[I 2023-12-28 12:08:58,395] Trial 77 finished with value: 2.070904045797603 and parameters: {'model_name': 'SimpleImputer', 'strategy': 'most_frequent'}. Best is trial 7 with value: 1.4942222553581073.
[I 2023-12-28 12:08:58,618] Trial 113 finished with value: 1.4942222553581073 and parameters: {'model_name': 'SimpleImputer', 'strategy': 'mean'}. Best is trial 7 with value: 1.4942222553581073.
[I 2023-12-28 12:08:58,844] Trial 112 finished with value: 1.4942222553581073 and parameters: {'model_name': 'SimpleImputer', 'strategy': 'mean'}. Best is trial 7 with value: 1.4942222553581073.
[I 2023-12-28 12:08:59,081] Trial 70 finished with value: 2.070904045797603 and parameters: {'model_name': 'SimpleImputer', 'strategy': 'most_frequent'}. Best is trial 7 with value: 1.4942222553581073.
[I 2023-12-28 12:08:59,297] Trial 123 finished with value: 1.4942222553581073 and parameters: {'model_name': 'SimpleImputer', 'strategy': 'mean'}. Best is trial 7 with value: 1.4942222553581073.
[I 2023-12-28 12:08:59,548] Trial 72 finished with value: 2.070904045797603 and parameters: {'model_name': 'SimpleImputer', 'strategy': 'most_frequent'}. Best is trial 7 with value: 1.4942222553581073.
[I 2023-12-28 12:08:59,806] Trial 115 finished with value: 1.4942222553581073 and parameters: {'model_name': 'SimpleImputer', 'strategy': 'mean'}. Best is trial 7 with value: 1.4942222553581073.
[I 2023-12-28 12:09:00,031] Trial 116 finished with value: 1.4942222553581073 and parameters: {'model_name': 'SimpleImputer', 'strategy': 'mean'}. Best is trial 7 with value: 1.4942222553581073.
[I 2023-12-28 12:09:00,344] Trial 85 finished with value: 2.070904045797603 and parameters: {'model_name': 'SimpleImputer', 'strategy': 'most_frequent'}. Best is trial 7 with value: 1.4942222553581073.
[I 2023-12-28 12:09:00,589] Trial 119 finished with value: 1.4942222553581073 and parameters: {'model_name': 'SimpleImputer', 'strategy': 'mean'}. Best is trial 7 with value: 1.4942222553581073.
[I 2023-12-28 12:09:00,841] Trial 118 finished with value: 1.4942222553581073 and parameters: {'model_name': 'SimpleImputer', 'strategy': 'mean'}. Best is trial 7 with value: 1.4942222553581073.
[I 2023-12-28 12:09:01,160] Trial 126 finished with value: 1.4942222553581073 and parameters: {'model_name': 'SimpleImputer', 'strategy': 'mean'}. Best is trial 7 with value: 1.4942222553581073.
[I 2023-12-28 12:09:01,468] Trial 121 finished with value: 1.4942222553581073 and parameters: {'model_name': 'SimpleImputer', 'strategy': 'mean'}. Best is trial 7 with value: 1.4942222553581073.
[I 2023-12-28 12:09:01,691] Trial 88 finished with value: 2.070904045797603 and parameters: {'model_name': 'SimpleImputer', 'strategy': 'most_frequent'}. Best is trial 7 with value: 1.4942222553581073.
[I 2023-12-28 12:09:02,014] Trial 129 finished with value: 1.4942222553581073 and parameters: {'model_name': 'SimpleImputer', 'strategy': 'mean'}. Best is trial 7 with value: 1.4942222553581073.
[I 2023-12-28 12:09:02,245] Trial 128 finished with value: 1.4942222553581073 and parameters: {'model_name': 'SimpleImputer', 'strategy': 'mean'}. Best is trial 7 with value: 1.4942222553581073.
[I 2023-12-28 12:09:02,449] Trial 125 finished with value: 1.4942222553581073 and parameters: {'model_name': 'SimpleImputer', 'strategy': 'mean'}. Best is trial 7 with value: 1.4942222553581073.
[I 2023-12-28 12:09:02,710] Trial 124 finished with value: 1.4942222553581073 and parameters: {'model_name': 'SimpleImputer', 'strategy': 'mean'}. Best is trial 7 with value: 1.4942222553581073.
[I 2023-12-28 12:09:02,982] Trial 135 finished with value: 1.4942222553581073 and parameters: {'model_name': 'SimpleImputer', 'strategy': 'mean'}. Best is trial 7 with value: 1.4942222553581073.
[I 2023-12-28 12:09:03,193] Trial 127 finished with value: 1.4942222553581073 and parameters: {'model_name': 'SimpleImputer', 'strategy': 'mean'}. Best is trial 7 with value: 1.4942222553581073.
[I 2023-12-28 12:09:03,390] Trial 138 finished with value: 1.4942222553581073 and parameters: {'model_name': 'SimpleImputer', 'strategy': 'mean'}. Best is trial 7 with value: 1.4942222553581073.
[I 2023-12-28 12:09:03,406] Trial 87 finished with value: 2.070904045797603 and parameters: {'model_name': 'SimpleImputer', 'strategy': 'most_frequent'}. Best is trial 7 with value: 1.4942222553581073.
[I 2023-12-28 12:09:03,411] Trial 130 finished with value: 1.4942222553581073 and parameters: {'model_name': 'SimpleImputer', 'strategy': 'mean'}. Best is trial 7 with value: 1.4942222553581073.
[I 2023-12-28 12:09:03,418] Trial 136 finished with value: 1.4942222553581073 and parameters: {'model_name': 'SimpleImputer', 'strategy': 'mean'}. Best is trial 7 with value: 1.4942222553581073.
[I 2023-12-28 12:09:03,694] Trial 86 finished with value: 2.070904045797603 and parameters: {'model_name': 'SimpleImputer', 'strategy': 'most_frequent'}. Best is trial 7 with value: 1.4942222553581073.
[I 2023-12-28 12:09:04,672] Trial 131 finished with value: 1.4942222553581073 and parameters: {'model_name': 'SimpleImputer', 'strategy': 'mean'}. Best is trial 7 with value: 1.4942222553581073.
[I 2023-12-28 12:09:04,917] Trial 146 finished with value: 1.4942222553581073 and parameters: {'model_name': 'SimpleImputer', 'strategy': 'mean'}. Best is trial 7 with value: 1.4942222553581073.
[I 2023-12-28 12:09:05,181] Trial 132 finished with value: 1.4942222553581073 and parameters: {'model_name': 'SimpleImputer', 'strategy': 'mean'}. Best is trial 7 with value: 1.4942222553581073.
[I 2023-12-28 12:09:05,421] Trial 141 finished with value: 1.4942222553581073 and parameters: {'model_name': 'SimpleImputer', 'strategy': 'mean'}. Best is trial 7 with value: 1.4942222553581073.
[I 2023-12-28 12:09:05,640] Trial 134 finished with value: 1.4942222553581073 and parameters: {'model_name': 'SimpleImputer', 'strategy': 'mean'}. Best is trial 7 with value: 1.4942222553581073.
[I 2023-12-28 12:09:05,833] Trial 139 finished with value: 1.4942222553581073 and parameters: {'model_name': 'SimpleImputer', 'strategy': 'mean'}. Best is trial 7 with value: 1.4942222553581073.
[I 2023-12-28 12:09:06,021] Trial 145 finished with value: 1.4942222553581073 and parameters: {'model_name': 'SimpleImputer', 'strategy': 'mean'}. Best is trial 7 with value: 1.4942222553581073.
[I 2023-12-28 12:09:06,223] Trial 144 finished with value: 1.4942222553581073 and parameters: {'model_name': 'SimpleImputer', 'strategy': 'mean'}. Best is trial 7 with value: 1.4942222553581073.
[I 2023-12-28 12:09:06,509] Trial 137 finished with value: 1.4942222553581073 and parameters: {'model_name': 'SimpleImputer', 'strategy': 'mean'}. Best is trial 7 with value: 1.4942222553581073.
[I 2023-12-28 12:09:06,757] Trial 133 finished with value: 1.4942222553581073 and parameters: {'model_name': 'SimpleImputer', 'strategy': 'mean'}. Best is trial 7 with value: 1.4942222553581073.
[I 2023-12-28 12:09:07,031] Trial 148 finished with value: 1.4942222553581073 and parameters: {'model_name': 'SimpleImputer', 'strategy': 'mean'}. Best is trial 7 with value: 1.4942222553581073.
[I 2023-12-28 12:09:07,257] Trial 142 finished with value: 1.4942222553581073 and parameters: {'model_name': 'SimpleImputer', 'strategy': 'mean'}. Best is trial 7 with value: 1.4942222553581073.
[I 2023-12-28 12:09:07,522] Trial 140 finished with value: 1.4942222553581073 and parameters: {'model_name': 'SimpleImputer', 'strategy': 'mean'}. Best is trial 7 with value: 1.4942222553581073.
[I 2023-12-28 12:09:07,727] Trial 147 finished with value: 1.4942222553581073 and parameters: {'model_name': 'SimpleImputer', 'strategy': 'mean'}. Best is trial 7 with value: 1.4942222553581073.
[I 2023-12-28 12:09:08,037] Trial 143 finished with value: 1.4942222553581073 and parameters: {'model_name': 'SimpleImputer', 'strategy': 'mean'}. Best is trial 7 with value: 1.4942222553581073.
[I 2023-12-28 12:09:08,355] Trial 151 finished with value: 1.4942222553581073 and parameters: {'model_name': 'SimpleImputer', 'strategy': 'mean'}. Best is trial 7 with value: 1.4942222553581073.
[I 2023-12-28 12:09:08,613] Trial 150 finished with value: 1.4942222553581073 and parameters: {'model_name': 'SimpleImputer', 'strategy': 'mean'}. Best is trial 7 with value: 1.4942222553581073.
[I 2023-12-28 12:09:09,026] Trial 156 finished with value: 1.4942222553581073 and parameters: {'model_name': 'SimpleImputer', 'strategy': 'mean'}. Best is trial 7 with value: 1.4942222553581073.
[I 2023-12-28 12:09:09,273] Trial 149 finished with value: 1.4942222553581073 and parameters: {'model_name': 'SimpleImputer', 'strategy': 'mean'}. Best is trial 7 with value: 1.4942222553581073.
[I 2023-12-28 12:09:09,569] Trial 155 finished with value: 1.4942222553581073 and parameters: {'model_name': 'SimpleImputer', 'strategy': 'mean'}. Best is trial 7 with value: 1.4942222553581073.
[I 2023-12-28 12:09:09,820] Trial 152 finished with value: 1.4942222553581073 and parameters: {'model_name': 'SimpleImputer', 'strategy': 'mean'}. Best is trial 7 with value: 1.4942222553581073.
[I 2023-12-28 12:09:10,071] Trial 154 finished with value: 1.4942222553581073 and parameters: {'model_name': 'SimpleImputer', 'strategy': 'mean'}. Best is trial 7 with value: 1.4942222553581073.
[I 2023-12-28 12:09:10,315] Trial 159 finished with value: 1.4942222553581073 and parameters: {'model_name': 'SimpleImputer', 'strategy': 'mean'}. Best is trial 7 with value: 1.4942222553581073.
[I 2023-12-28 12:09:10,615] Trial 158 finished with value: 1.4942222553581073 and parameters: {'model_name': 'SimpleImputer', 'strategy': 'mean'}. Best is trial 7 with value: 1.4942222553581073.
[I 2023-12-28 12:09:10,884] Trial 171 finished with value: 2.086836406374532 and parameters: {'model_name': 'SimpleImputer', 'strategy': 'constant'}. Best is trial 7 with value: 1.4942222553581073.
[I 2023-12-28 12:09:11,108] Trial 153 finished with value: 1.4942222553581073 and parameters: {'model_name': 'SimpleImputer', 'strategy': 'mean'}. Best is trial 7 with value: 1.4942222553581073.
[I 2023-12-28 12:09:11,455] Trial 160 finished with value: 1.4942222553581073 and parameters: {'model_name': 'SimpleImputer', 'strategy': 'mean'}. Best is trial 7 with value: 1.4942222553581073.
[I 2023-12-28 12:09:11,664] Trial 169 finished with value: 2.086836406374532 and parameters: {'model_name': 'SimpleImputer', 'strategy': 'constant'}. Best is trial 7 with value: 1.4942222553581073.
[I 2023-12-28 12:09:12,023] Trial 157 finished with value: 1.4942222553581073 and parameters: {'model_name': 'SimpleImputer', 'strategy': 'mean'}. Best is trial 7 with value: 1.4942222553581073.
[I 2023-12-28 12:09:12,305] Trial 163 finished with value: 1.4942222553581073 and parameters: {'model_name': 'SimpleImputer', 'strategy': 'mean'}. Best is trial 7 with value: 1.4942222553581073.
[I 2023-12-28 12:09:12,501] Trial 161 finished with value: 1.4942222553581073 and parameters: {'model_name': 'SimpleImputer', 'strategy': 'mean'}. Best is trial 7 with value: 1.4942222553581073.
[I 2023-12-28 12:09:12,739] Trial 162 finished with value: 1.4942222553581073 and parameters: {'model_name': 'SimpleImputer', 'strategy': 'mean'}. Best is trial 7 with value: 1.4942222553581073.
[I 2023-12-28 12:09:12,982] Trial 173 finished with value: 2.086836406374532 and parameters: {'model_name': 'SimpleImputer', 'strategy': 'constant'}. Best is trial 7 with value: 1.4942222553581073.
[I 2023-12-28 12:09:13,156] Trial 176 finished with value: 2.086836406374532 and parameters: {'model_name': 'SimpleImputer', 'strategy': 'constant'}. Best is trial 7 with value: 1.4942222553581073.
[I 2023-12-28 12:09:13,426] Trial 172 finished with value: 2.086836406374532 and parameters: {'model_name': 'SimpleImputer', 'strategy': 'constant'}. Best is trial 7 with value: 1.4942222553581073.
[I 2023-12-28 12:09:13,603] Trial 174 finished with value: 2.086836406374532 and parameters: {'model_name': 'SimpleImputer', 'strategy': 'constant'}. Best is trial 7 with value: 1.4942222553581073.
[I 2023-12-28 12:09:13,850] Trial 170 finished with value: 2.086836406374532 and parameters: {'model_name': 'SimpleImputer', 'strategy': 'constant'}. Best is trial 7 with value: 1.4942222553581073.
[I 2023-12-28 12:09:14,116] Trial 164 finished with value: 1.4942222553581073 and parameters: {'model_name': 'SimpleImputer', 'strategy': 'mean'}. Best is trial 7 with value: 1.4942222553581073.
[I 2023-12-28 12:09:14,322] Trial 182 finished with value: 2.086836406374532 and parameters: {'model_name': 'SimpleImputer', 'strategy': 'constant'}. Best is trial 7 with value: 1.4942222553581073.
[I 2023-12-28 12:09:14,537] Trial 166 finished with value: 1.4942222553581073 and parameters: {'model_name': 'SimpleImputer', 'strategy': 'mean'}. Best is trial 7 with value: 1.4942222553581073.
[I 2023-12-28 12:09:14,723] Trial 192 finished with value: 2.086836406374532 and parameters: {'model_name': 'SimpleImputer', 'strategy': 'constant'}. Best is trial 7 with value: 1.4942222553581073.
[I 2023-12-28 12:09:14,952] Trial 177 finished with value: 2.086836406374532 and parameters: {'model_name': 'SimpleImputer', 'strategy': 'constant'}. Best is trial 7 with value: 1.4942222553581073.
[I 2023-12-28 12:09:15,172] Trial 167 finished with value: 1.4942222553581073 and parameters: {'model_name': 'SimpleImputer', 'strategy': 'mean'}. Best is trial 7 with value: 1.4942222553581073.
[I 2023-12-28 12:09:15,363] Trial 165 finished with value: 1.4942222553581073 and parameters: {'model_name': 'SimpleImputer', 'strategy': 'mean'}. Best is trial 7 with value: 1.4942222553581073.
[I 2023-12-28 12:09:15,633] Trial 181 finished with value: 2.086836406374532 and parameters: {'model_name': 'SimpleImputer', 'strategy': 'constant'}. Best is trial 7 with value: 1.4942222553581073.
[I 2023-12-28 12:09:15,898] Trial 188 finished with value: 2.086836406374532 and parameters: {'model_name': 'SimpleImputer', 'strategy': 'constant'}. Best is trial 7 with value: 1.4942222553581073.
[I 2023-12-28 12:09:16,158] Trial 186 finished with value: 2.086836406374532 and parameters: {'model_name': 'SimpleImputer', 'strategy': 'constant'}. Best is trial 7 with value: 1.4942222553581073.
[I 2023-12-28 12:09:16,441] Trial 168 finished with value: 1.4942222553581073 and parameters: {'model_name': 'SimpleImputer', 'strategy': 'mean'}. Best is trial 7 with value: 1.4942222553581073.
[I 2023-12-28 12:09:16,684] Trial 191 finished with value: 2.086836406374532 and parameters: {'model_name': 'SimpleImputer', 'strategy': 'constant'}. Best is trial 7 with value: 1.4942222553581073.
[I 2023-12-28 12:09:16,875] Trial 193 finished with value: 2.086836406374532 and parameters: {'model_name': 'SimpleImputer', 'strategy': 'constant'}. Best is trial 7 with value: 1.4942222553581073.
[I 2023-12-28 12:09:17,039] Trial 198 finished with value: 2.086836406374532 and parameters: {'model_name': 'SimpleImputer', 'strategy': 'constant'}. Best is trial 7 with value: 1.4942222553581073.
[I 2023-12-28 12:09:17,285] Trial 199 finished with value: 2.086836406374532 and parameters: {'model_name': 'SimpleImputer', 'strategy': 'constant'}. Best is trial 7 with value: 1.4942222553581073.
[I 2023-12-28 12:09:17,481] Trial 179 finished with value: 1.4942222553581073 and parameters: {'model_name': 'SimpleImputer', 'strategy': 'mean'}. Best is trial 7 with value: 1.4942222553581073.
[I 2023-12-28 12:09:17,746] Trial 187 finished with value: 2.086836406374532 and parameters: {'model_name': 'SimpleImputer', 'strategy': 'constant'}. Best is trial 7 with value: 1.4942222553581073.
[I 2023-12-28 12:09:17,920] Trial 178 finished with value: 1.4942222553581073 and parameters: {'model_name': 'SimpleImputer', 'strategy': 'mean'}. Best is trial 7 with value: 1.4942222553581073.
[I 2023-12-28 12:09:18,166] Trial 180 finished with value: 2.086836406374532 and parameters: {'model_name': 'SimpleImputer', 'strategy': 'constant'}. Best is trial 7 with value: 1.4942222553581073.
[I 2023-12-28 12:09:18,331] Trial 189 finished with value: 1.4942222553581073 and parameters: {'model_name': 'SimpleImputer', 'strategy': 'mean'}. Best is trial 7 with value: 1.4942222553581073.
[I 2023-12-28 12:09:18,520] Trial 196 finished with value: 2.086836406374532 and parameters: {'model_name': 'SimpleImputer', 'strategy': 'constant'}. Best is trial 7 with value: 1.4942222553581073.
[I 2023-12-28 12:09:18,697] Trial 195 finished with value: 1.4942222553581073 and parameters: {'model_name': 'SimpleImputer', 'strategy': 'mean'}. Best is trial 7 with value: 1.4942222553581073.
[I 2023-12-28 12:09:18,858] Trial 197 finished with value: 2.086836406374532 and parameters: {'model_name': 'SimpleImputer', 'strategy': 'constant'}. Best is trial 7 with value: 1.4942222553581073.
[I 2023-12-28 12:09:19,098] Trial 184 finished with value: 1.4942222553581073 and parameters: {'model_name': 'SimpleImputer', 'strategy': 'mean'}. Best is trial 7 with value: 1.4942222553581073.
[I 2023-12-28 12:09:19,340] Trial 175 finished with value: 1.4942222553581073 and parameters: {'model_name': 'SimpleImputer', 'strategy': 'mean'}. Best is trial 7 with value: 1.4942222553581073.
[I 2023-12-28 12:09:19,568] Trial 185 finished with value: 1.4942222553581073 and parameters: {'model_name': 'SimpleImputer', 'strategy': 'mean'}. Best is trial 7 with value: 1.4942222553581073.
[I 2023-12-28 12:09:19,802] Trial 190 finished with value: 2.086836406374532 and parameters: {'model_name': 'SimpleImputer', 'strategy': 'constant'}. Best is trial 7 with value: 1.4942222553581073.
[I 2023-12-28 12:09:20,039] Trial 194 finished with value: 1.4942222553581073 and parameters: {'model_name': 'SimpleImputer', 'strategy': 'mean'}. Best is trial 7 with value: 1.4942222553581073.
