[I 2024-02-28 01:26:36,377] Trial 5 finished with value: 2726.5289275663476 and parameters: {'model_name': 'SimpleImputer', 'strategy': 'constant'}. Best is trial 5 with value: 2726.5289275663476.
[I 2024-02-28 01:26:37,537] Trial 20 finished with value: 2726.5289275663476 and parameters: {'model_name': 'SimpleImputer', 'strategy': 'constant'}. Best is trial 5 with value: 2726.5289275663476.
[I 2024-02-28 01:26:39,625] Trial 18 finished with value: 2708.235610028992 and parameters: {'model_name': 'SimpleImputer', 'strategy': 'median'}. Best is trial 18 with value: 2708.235610028992.
[I 2024-02-28 01:26:40,764] Trial 21 finished with value: 2708.235610028992 and parameters: {'model_name': 'SimpleImputer', 'strategy': 'median'}. Best is trial 18 with value: 2708.235610028992.
[I 2024-02-28 01:26:46,017] Trial 10 finished with value: 2726.5289275663476 and parameters: {'model_name': 'SimpleImputer', 'strategy': 'most_frequent'}. Best is trial 18 with value: 2708.235610028992.
2024-02-28 01:26:48.779472: E external/local_xla/xla/stream_executor/cuda/cuda_driver.cc:274] failed call to cuInit: CUDA_ERROR_NO_DEVICE: no CUDA-capable device is detected
2024-02-28 01:26:49.283407: I tensorflow/compiler/mlir/mlir_graph_optimization_pass.cc:388] MLIR V1 optimization pass is not enabled
[I 2024-02-28 01:26:49,316] Trial 33 finished with value: 2726.5289275663476 and parameters: {'model_name': 'SimpleImputer', 'strategy': 'most_frequent'}. Best is trial 18 with value: 2708.235610028992.
[I 2024-02-28 01:26:52,526] Trial 28 finished with value: 2726.5289275663476 and parameters: {'model_name': 'SimpleImputer', 'strategy': 'most_frequent'}. Best is trial 18 with value: 2708.235610028992.
[I 2024-02-28 01:27:02,739] Trial 54 finished with value: 2726.5289275663476 and parameters: {'model_name': 'SimpleImputer', 'strategy': 'most_frequent'}. Best is trial 18 with value: 2708.235610028992.
[I 2024-02-28 01:27:05,571] Trial 4 finished with value: 2414.4818445410287 and parameters: {'model_name': 'KNNImputer', 'weights': 'uniform', 'keep_empty_features': False}. Best is trial 4 with value: 2414.4818445410287.
[I 2024-02-28 01:27:06,663] Trial 8 finished with value: 2414.4818445410287 and parameters: {'model_name': 'KNNImputer', 'weights': 'uniform', 'keep_empty_features': False}. Best is trial 4 with value: 2414.4818445410287.
[I 2024-02-28 01:27:07,323] Trial 17 finished with value: 2414.4818445410287 and parameters: {'model_name': 'KNNImputer', 'weights': 'uniform', 'keep_empty_features': False}. Best is trial 4 with value: 2414.4818445410287.
[I 2024-02-28 01:27:08,558] Trial 14 finished with value: 2466.7741358079916 and parameters: {'model_name': 'KNNImputer', 'weights': 'distance', 'keep_empty_features': False}. Best is trial 4 with value: 2414.4818445410287.
[I 2024-02-28 01:27:09,276] Trial 37 finished with value: 2414.4818445410287 and parameters: {'model_name': 'KNNImputer', 'weights': 'uniform', 'keep_empty_features': False}. Best is trial 4 with value: 2414.4818445410287.
[I 2024-02-28 01:27:10,138] Trial 16 finished with value: 2466.7741358079916 and parameters: {'model_name': 'KNNImputer', 'weights': 'distance', 'keep_empty_features': False}. Best is trial 4 with value: 2414.4818445410287.
[I 2024-02-28 01:27:10,158] Trial 29 finished with value: 2414.4818445410287 and parameters: {'model_name': 'KNNImputer', 'weights': 'uniform', 'keep_empty_features': False}. Best is trial 4 with value: 2414.4818445410287.
[I 2024-02-28 01:27:11,853] Trial 27 finished with value: 2414.4818445410287 and parameters: {'model_name': 'KNNImputer', 'weights': 'uniform', 'keep_empty_features': False}. Best is trial 4 with value: 2414.4818445410287.
[I 2024-02-28 01:27:12,954] Trial 45 finished with value: 2466.7741358079916 and parameters: {'model_name': 'KNNImputer', 'weights': 'distance', 'keep_empty_features': False}. Best is trial 4 with value: 2414.4818445410287.
[I 2024-02-28 01:27:13,842] Trial 31 finished with value: 2466.7741358079916 and parameters: {'model_name': 'KNNImputer', 'weights': 'distance', 'keep_empty_features': False}. Best is trial 4 with value: 2414.4818445410287.
[I 2024-02-28 01:27:17,340] Trial 12 finished with value: 2610.9209837037047 and parameters: {'model_name': 'RandomForestImputer', 'max_iter': 1, 'decreasing': False, 'min_samples_split': 0.5, 'min_samples_leaf': 0.30000000000000004, 'max_features': 0.1, 'warm_start': True}. Best is trial 4 with value: 2414.4818445410287.
[I 2024-02-28 01:27:18,915] Trial 26 finished with value: 2610.9209837037047 and parameters: {'model_name': 'RandomForestImputer', 'max_iter': 1, 'decreasing': True, 'min_samples_split': 1.0, 'min_samples_leaf': 0.30000000000000004, 'max_features': 0.9, 'warm_start': True}. Best is trial 4 with value: 2414.4818445410287.
[I 2024-02-28 01:27:32,485] Trial 58 finished with value: 2414.4818445410287 and parameters: {'model_name': 'KNNImputer', 'weights': 'uniform', 'keep_empty_features': False}. Best is trial 4 with value: 2414.4818445410287.
[I 2024-02-28 01:27:50,652] Trial 39 finished with value: 2593.6333260183155 and parameters: {'model_name': 'IterativeImputer', 'sample_posterior': False, 'initial_strategy': 'mean', 'imputation_order': 'ascending'}. Best is trial 4 with value: 2414.4818445410287.
[I 2024-02-28 01:27:51,634] Trial 34 finished with value: 2593.8034095290086 and parameters: {'model_name': 'IterativeImputer', 'sample_posterior': False, 'initial_strategy': 'mean', 'imputation_order': 'descending'}. Best is trial 4 with value: 2414.4818445410287.
[I 2024-02-28 01:28:05,953] Trial 22 finished with value: 2610.9209837037047 and parameters: {'model_name': 'RandomForestImputer', 'max_iter': 1, 'decreasing': False, 'min_samples_split': 0.8, 'min_samples_leaf': 0.30000000000000004, 'max_features': 0.5, 'warm_start': False}. Best is trial 4 with value: 2414.4818445410287.
[I 2024-02-28 01:28:06,919] Trial 0 finished with value: 2610.9209837037047 and parameters: {'model_name': 'RandomForestImputer', 'max_iter': 1, 'decreasing': False, 'min_samples_split': 0.1, 'min_samples_leaf': 0.1, 'max_features': 0.30000000000000004, 'warm_start': False}. Best is trial 4 with value: 2414.4818445410287.
[I 2024-02-28 01:28:07,689] Trial 36 finished with value: 2610.9209837037047 and parameters: {'model_name': 'RandomForestImputer', 'max_iter': 1, 'decreasing': True, 'min_samples_split': 1.0, 'min_samples_leaf': 0.4, 'max_features': 0.5, 'warm_start': False}. Best is trial 4 with value: 2414.4818445410287.
[I 2024-02-28 01:28:08,597] Trial 7 finished with value: 2610.9209837037047 and parameters: {'model_name': 'RandomForestImputer', 'max_iter': 1, 'decreasing': False, 'min_samples_split': 0.8, 'min_samples_leaf': 0.30000000000000004, 'max_features': 0.5, 'warm_start': False}. Best is trial 4 with value: 2414.4818445410287.
[I 2024-02-28 01:28:09,994] Trial 13 finished with value: 38592.118248593164 and parameters: {'model_name': 'GAIN', 'batch_size': 208, 'hint_rate': 0.41000000000000003, 'alpha': 12, 'iterations': 2}. Best is trial 4 with value: 2414.4818445410287.
[I 2024-02-28 01:28:13,726] Trial 15 finished with value: 70786.4025393263 and parameters: {'model_name': 'GAIN', 'batch_size': 296, 'hint_rate': 0.74, 'alpha': 44, 'iterations': 4}. Best is trial 4 with value: 2414.4818445410287.
[I 2024-02-28 01:28:14,929] Trial 52 finished with value: 2610.9209837037047 and parameters: {'model_name': 'RandomForestImputer', 'max_iter': 1, 'decreasing': True, 'min_samples_split': 0.7000000000000001, 'min_samples_leaf': 0.30000000000000004, 'max_features': 0.9, 'warm_start': False}. Best is trial 4 with value: 2414.4818445410287.
[I 2024-02-28 01:28:19,161] Trial 19 finished with value: 2815.6886661102076 and parameters: {'model_name': 'RandomForestImputer', 'max_iter': 9, 'decreasing': False, 'min_samples_split': 0.9, 'min_samples_leaf': 0.8, 'max_features': 0.4, 'warm_start': True}. Best is trial 4 with value: 2414.4818445410287.
[I 2024-02-28 01:28:22,104] Trial 46 finished with value: 59239.795967679915 and parameters: {'model_name': 'GAIN', 'batch_size': 40, 'hint_rate': 0.8200000000000001, 'alpha': 9, 'iterations': 5}. Best is trial 4 with value: 2414.4818445410287.
[I 2024-02-28 01:28:23,096] Trial 59 finished with value: 58104.27816128106 and parameters: {'model_name': 'GAIN', 'batch_size': 5, 'hint_rate': 0.49, 'alpha': 34, 'iterations': 1}. Best is trial 4 with value: 2414.4818445410287.
[I 2024-02-28 01:28:25,239] Trial 9 finished with value: 2593.7028082222623 and parameters: {'model_name': 'IterativeImputer', 'sample_posterior': False, 'initial_strategy': 'median', 'imputation_order': 'arabic'}. Best is trial 4 with value: 2414.4818445410287.
[I 2024-02-28 01:28:27,558] Trial 63 finished with value: 2610.9209837037047 and parameters: {'model_name': 'RandomForestImputer', 'max_iter': 1, 'decreasing': False, 'min_samples_split': 0.9, 'min_samples_leaf': 0.1, 'max_features': 0.7000000000000001, 'warm_start': False}. Best is trial 4 with value: 2414.4818445410287.
[I 2024-02-28 01:28:29,109] Trial 6 finished with value: 2593.70282281721 and parameters: {'model_name': 'IterativeImputer', 'sample_posterior': False, 'initial_strategy': 'constant', 'imputation_order': 'arabic'}. Best is trial 4 with value: 2414.4818445410287.
[I 2024-02-28 01:28:32,571] Trial 3 finished with value: 2593.70282281721 and parameters: {'model_name': 'IterativeImputer', 'sample_posterior': False, 'initial_strategy': 'most_frequent', 'imputation_order': 'arabic'}. Best is trial 4 with value: 2414.4818445410287.
[I 2024-02-28 01:28:35,554] Trial 30 finished with value: 2593.702147493809 and parameters: {'model_name': 'IterativeImputer', 'sample_posterior': False, 'initial_strategy': 'most_frequent', 'imputation_order': 'roman'}. Best is trial 4 with value: 2414.4818445410287.
[I 2024-02-28 01:28:38,441] Trial 76 finished with value: 2414.4818445410287 and parameters: {'model_name': 'KNNImputer', 'weights': 'uniform', 'keep_empty_features': False}. Best is trial 4 with value: 2414.4818445410287.
[I 2024-02-28 01:28:39,453] Trial 77 finished with value: 2414.4818445410287 and parameters: {'model_name': 'KNNImputer', 'weights': 'uniform', 'keep_empty_features': False}. Best is trial 4 with value: 2414.4818445410287.
[I 2024-02-28 01:28:46,918] Trial 78 finished with value: 2414.4818445410287 and parameters: {'model_name': 'KNNImputer', 'weights': 'uniform', 'keep_empty_features': False}. Best is trial 4 with value: 2414.4818445410287.
[I 2024-02-28 01:28:50,523] Trial 79 finished with value: 2414.4818445410287 and parameters: {'model_name': 'KNNImputer', 'weights': 'uniform', 'keep_empty_features': False}. Best is trial 4 with value: 2414.4818445410287.
[I 2024-02-28 01:28:53,165] Trial 80 finished with value: 2414.4818445410287 and parameters: {'model_name': 'KNNImputer', 'weights': 'uniform', 'keep_empty_features': False}. Best is trial 4 with value: 2414.4818445410287.
[I 2024-02-28 01:28:56,034] Trial 81 finished with value: 2414.4818445410287 and parameters: {'model_name': 'KNNImputer', 'weights': 'uniform', 'keep_empty_features': False}. Best is trial 4 with value: 2414.4818445410287.
[I 2024-02-28 01:28:58,082] Trial 82 finished with value: 2414.4818445410287 and parameters: {'model_name': 'KNNImputer', 'weights': 'uniform', 'keep_empty_features': False}. Best is trial 4 with value: 2414.4818445410287.
[I 2024-02-28 01:29:00,971] Trial 83 finished with value: 2414.4818445410287 and parameters: {'model_name': 'KNNImputer', 'weights': 'uniform', 'keep_empty_features': False}. Best is trial 4 with value: 2414.4818445410287.
[I 2024-02-28 01:29:02,913] Trial 84 finished with value: 2414.4818445410287 and parameters: {'model_name': 'KNNImputer', 'weights': 'uniform', 'keep_empty_features': False}. Best is trial 4 with value: 2414.4818445410287.
[I 2024-02-28 01:29:06,800] Trial 86 finished with value: 2414.4818445410287 and parameters: {'model_name': 'KNNImputer', 'weights': 'uniform', 'keep_empty_features': False}. Best is trial 4 with value: 2414.4818445410287.
[I 2024-02-28 01:29:07,857] Trial 85 finished with value: 2414.4818445410287 and parameters: {'model_name': 'KNNImputer', 'weights': 'uniform', 'keep_empty_features': False}. Best is trial 4 with value: 2414.4818445410287.
[I 2024-02-28 01:29:10,222] Trial 87 finished with value: 2414.4818445410287 and parameters: {'model_name': 'KNNImputer', 'weights': 'uniform', 'keep_empty_features': False}. Best is trial 4 with value: 2414.4818445410287.
[I 2024-02-28 01:29:13,647] Trial 44 finished with value: 2922.3427993488335 and parameters: {'model_name': 'RandomForestImputer', 'max_iter': 7, 'decreasing': True, 'min_samples_split': 0.8, 'min_samples_leaf': 0.2, 'max_features': 0.6, 'warm_start': True}. Best is trial 4 with value: 2414.4818445410287.
[I 2024-02-28 01:29:14,648] Trial 67 finished with value: 2593.70282281721 and parameters: {'model_name': 'IterativeImputer', 'sample_posterior': False, 'initial_strategy': 'most_frequent', 'imputation_order': 'arabic'}. Best is trial 4 with value: 2414.4818445410287.
[I 2024-02-28 01:29:17,132] Trial 65 finished with value: 2593.6962222024968 and parameters: {'model_name': 'IterativeImputer', 'sample_posterior': False, 'initial_strategy': 'constant', 'imputation_order': 'ascending'}. Best is trial 4 with value: 2414.4818445410287.
[I 2024-02-28 01:29:18,682] Trial 88 finished with value: 2414.4818445410287 and parameters: {'model_name': 'KNNImputer', 'weights': 'uniform', 'keep_empty_features': False}. Best is trial 4 with value: 2414.4818445410287.
[I 2024-02-28 01:29:20,870] Trial 60 finished with value: 2593.6962222024968 and parameters: {'model_name': 'IterativeImputer', 'sample_posterior': False, 'initial_strategy': 'constant', 'imputation_order': 'ascending'}. Best is trial 4 with value: 2414.4818445410287.
[I 2024-02-28 01:29:24,085] Trial 89 finished with value: 2414.4818445410287 and parameters: {'model_name': 'KNNImputer', 'weights': 'uniform', 'keep_empty_features': False}. Best is trial 4 with value: 2414.4818445410287.
[I 2024-02-28 01:29:27,727] Trial 90 finished with value: 2414.4818445410287 and parameters: {'model_name': 'KNNImputer', 'weights': 'uniform', 'keep_empty_features': False}. Best is trial 4 with value: 2414.4818445410287.
[I 2024-02-28 01:29:30,742] Trial 91 finished with value: 2414.4818445410287 and parameters: {'model_name': 'KNNImputer', 'weights': 'uniform', 'keep_empty_features': False}. Best is trial 4 with value: 2414.4818445410287.
[I 2024-02-28 01:29:32,824] Trial 92 finished with value: 2414.4818445410287 and parameters: {'model_name': 'KNNImputer', 'weights': 'uniform', 'keep_empty_features': False}. Best is trial 4 with value: 2414.4818445410287.
[I 2024-02-28 01:29:35,497] Trial 11 finished with value: 2818.341889716153 and parameters: {'model_name': 'RandomForestImputer', 'max_iter': 13, 'decreasing': False, 'min_samples_split': 0.1, 'min_samples_leaf': 0.7000000000000001, 'max_features': 0.8, 'warm_start': True}. Best is trial 4 with value: 2414.4818445410287.
[I 2024-02-28 01:29:37,605] Trial 93 finished with value: 2414.4818445410287 and parameters: {'model_name': 'KNNImputer', 'weights': 'uniform', 'keep_empty_features': False}. Best is trial 4 with value: 2414.4818445410287.
[I 2024-02-28 01:29:39,114] Trial 94 finished with value: 2414.4818445410287 and parameters: {'model_name': 'KNNImputer', 'weights': 'uniform', 'keep_empty_features': False}. Best is trial 4 with value: 2414.4818445410287.
[I 2024-02-28 01:29:43,938] Trial 95 finished with value: 2414.4818445410287 and parameters: {'model_name': 'KNNImputer', 'weights': 'uniform', 'keep_empty_features': False}. Best is trial 4 with value: 2414.4818445410287.
[I 2024-02-28 01:29:46,236] Trial 96 finished with value: 2414.4818445410287 and parameters: {'model_name': 'KNNImputer', 'weights': 'uniform', 'keep_empty_features': False}. Best is trial 4 with value: 2414.4818445410287.
[I 2024-02-28 01:29:49,257] Trial 97 finished with value: 2414.4818445410287 and parameters: {'model_name': 'KNNImputer', 'weights': 'uniform', 'keep_empty_features': False}. Best is trial 4 with value: 2414.4818445410287.
[I 2024-02-28 01:29:53,556] Trial 98 finished with value: 2414.4818445410287 and parameters: {'model_name': 'KNNImputer', 'weights': 'uniform', 'keep_empty_features': False}. Best is trial 4 with value: 2414.4818445410287.
[I 2024-02-28 01:29:55,054] Trial 99 finished with value: 2414.4818445410287 and parameters: {'model_name': 'KNNImputer', 'weights': 'uniform', 'keep_empty_features': False}. Best is trial 4 with value: 2414.4818445410287.
[I 2024-02-28 01:29:56,944] Trial 100 finished with value: 2414.4818445410287 and parameters: {'model_name': 'KNNImputer', 'weights': 'uniform', 'keep_empty_features': False}. Best is trial 4 with value: 2414.4818445410287.
[I 2024-02-28 01:29:58,149] Trial 101 finished with value: 2414.4818445410287 and parameters: {'model_name': 'KNNImputer', 'weights': 'uniform', 'keep_empty_features': False}. Best is trial 4 with value: 2414.4818445410287.
[I 2024-02-28 01:30:01,776] Trial 102 finished with value: 2414.4818445410287 and parameters: {'model_name': 'KNNImputer', 'weights': 'uniform', 'keep_empty_features': False}. Best is trial 4 with value: 2414.4818445410287.
[I 2024-02-28 01:30:04,484] Trial 103 finished with value: 2414.4818445410287 and parameters: {'model_name': 'KNNImputer', 'weights': 'uniform', 'keep_empty_features': False}. Best is trial 4 with value: 2414.4818445410287.
[I 2024-02-28 01:30:07,135] Trial 104 finished with value: 2414.4818445410287 and parameters: {'model_name': 'KNNImputer', 'weights': 'uniform', 'keep_empty_features': False}. Best is trial 4 with value: 2414.4818445410287.
[I 2024-02-28 01:30:08,298] Trial 2 finished with value: 2879.651145285149 and parameters: {'model_name': 'RandomForestImputer', 'max_iter': 10, 'decreasing': False, 'min_samples_split': 0.0, 'min_samples_leaf': 0.2, 'max_features': 0.5, 'warm_start': True}. Best is trial 4 with value: 2414.4818445410287.
[I 2024-02-28 01:30:09,723] Trial 105 finished with value: 2414.4818445410287 and parameters: {'model_name': 'KNNImputer', 'weights': 'uniform', 'keep_empty_features': False}. Best is trial 4 with value: 2414.4818445410287.
[I 2024-02-28 01:30:11,068] Trial 106 finished with value: 2414.4818445410287 and parameters: {'model_name': 'KNNImputer', 'weights': 'uniform', 'keep_empty_features': False}. Best is trial 4 with value: 2414.4818445410287.
[I 2024-02-28 01:30:14,231] Trial 107 finished with value: 2414.4818445410287 and parameters: {'model_name': 'KNNImputer', 'weights': 'uniform', 'keep_empty_features': False}. Best is trial 4 with value: 2414.4818445410287.
[I 2024-02-28 01:30:15,410] Trial 108 finished with value: 2414.4818445410287 and parameters: {'model_name': 'KNNImputer', 'weights': 'uniform', 'keep_empty_features': False}. Best is trial 4 with value: 2414.4818445410287.
[I 2024-02-28 01:30:16,221] Trial 109 finished with value: 2414.4818445410287 and parameters: {'model_name': 'KNNImputer', 'weights': 'uniform', 'keep_empty_features': False}. Best is trial 4 with value: 2414.4818445410287.
[I 2024-02-28 01:30:18,391] Trial 110 finished with value: 2414.4818445410287 and parameters: {'model_name': 'KNNImputer', 'weights': 'uniform', 'keep_empty_features': False}. Best is trial 4 with value: 2414.4818445410287.
[I 2024-02-28 01:30:23,036] Trial 74 finished with value: 63418.57612103338 and parameters: {'model_name': 'GAIN', 'batch_size': 49, 'hint_rate': 0.38, 'alpha': 36, 'iterations': 1}. Best is trial 4 with value: 2414.4818445410287.
[I 2024-02-28 01:30:25,812] Trial 43 finished with value: 2817.568372482939 and parameters: {'model_name': 'RandomForestImputer', 'max_iter': 18, 'decreasing': False, 'min_samples_split': 0.30000000000000004, 'min_samples_leaf': 0.8, 'max_features': 0.9, 'warm_start': True}. Best is trial 4 with value: 2414.4818445410287.
[I 2024-02-28 01:30:28,712] Trial 53 finished with value: 2841.295776420313 and parameters: {'model_name': 'RandomForestImputer', 'max_iter': 22, 'decreasing': True, 'min_samples_split': 1.0, 'min_samples_leaf': 0.5, 'max_features': 0.7000000000000001, 'warm_start': True}. Best is trial 4 with value: 2414.4818445410287.
[I 2024-02-28 01:30:30,198] Trial 42 finished with value: 2819.6545672434827 and parameters: {'model_name': 'RandomForestImputer', 'max_iter': 23, 'decreasing': False, 'min_samples_split': 0.2, 'min_samples_leaf': 0.6, 'max_features': 0.30000000000000004, 'warm_start': True}. Best is trial 4 with value: 2414.4818445410287.
[I 2024-02-28 01:30:31,333] Trial 130 finished with value: 2610.9209837037047 and parameters: {'model_name': 'SimpleImputer', 'strategy': 'mean'}. Best is trial 4 with value: 2414.4818445410287.
[I 2024-02-28 01:30:35,384] Trial 56 finished with value: 2835.879074901781 and parameters: {'model_name': 'RandomForestImputer', 'max_iter': 16, 'decreasing': True, 'min_samples_split': 0.2, 'min_samples_leaf': 0.30000000000000004, 'max_features': 0.2, 'warm_start': True}. Best is trial 4 with value: 2414.4818445410287.
[I 2024-02-28 01:30:47,387] Trial 132 finished with value: 2466.7741358079916 and parameters: {'model_name': 'KNNImputer', 'weights': 'distance', 'keep_empty_features': False}. Best is trial 4 with value: 2414.4818445410287.
[I 2024-02-28 01:31:02,148] Trial 47 finished with value: 55277.666764633424 and parameters: {'model_name': 'GAIN', 'batch_size': 247, 'hint_rate': 0.8300000000000001, 'alpha': 99, 'iterations': 54}. Best is trial 4 with value: 2414.4818445410287.
[I 2024-02-28 01:31:08,910] Trial 24 finished with value: 2818.6202468884744 and parameters: {'model_name': 'RandomForestImputer', 'max_iter': 68, 'decreasing': False, 'min_samples_split': 0.6000000000000001, 'min_samples_leaf': 0.7000000000000001, 'max_features': 0.2, 'warm_start': True}. Best is trial 4 with value: 2414.4818445410287.
