[I 2024-04-15 16:44:54,251] Trial 37 finished with value: 33.17603096677966 and parameters: {'model_name': 'SimpleImputer', 'strategy': 'median'}. Best is trial 37 with value: 33.17603096677966.
[I 2024-04-15 16:44:55,268] Trial 47 finished with value: 33.17603096677966 and parameters: {'model_name': 'SimpleImputer', 'strategy': 'median'}. Best is trial 37 with value: 33.17603096677966.
2024-04-15 16:44:57.774768: E external/local_xla/xla/stream_executor/cuda/cuda_driver.cc:274] failed call to cuInit: CUDA_ERROR_NO_DEVICE: no CUDA-capable device is detected
2024-04-15 16:44:57.936345: I tensorflow/compiler/mlir/mlir_graph_optimization_pass.cc:388] MLIR V1 optimization pass is not enabled
[I 2024-04-15 16:44:58,855] Trial 10 finished with value: 33.32040274660817 and parameters: {'model_name': 'SimpleImputer', 'strategy': 'most_frequent'}. Best is trial 37 with value: 33.17603096677966.
[I 2024-04-15 16:45:00,470] Trial 40 finished with value: 33.32040274660817 and parameters: {'model_name': 'SimpleImputer', 'strategy': 'most_frequent'}. Best is trial 37 with value: 33.17603096677966.
[I 2024-04-15 16:45:01,276] Trial 30 finished with value: 33.32040274660817 and parameters: {'model_name': 'SimpleImputer', 'strategy': 'most_frequent'}. Best is trial 37 with value: 33.17603096677966.
[I 2024-04-15 16:45:02,700] Trial 6 finished with value: inf and parameters: {'model_name': 'GAIN', 'batch_size': 967, 'hint_rate': 0.01, 'alpha': 76, 'iterations': 2429}. Best is trial 37 with value: 33.17603096677966.
[I 2024-04-15 16:45:04,554] Trial 24 finished with value: inf and parameters: {'model_name': 'GAIN', 'batch_size': 607, 'hint_rate': 0.23, 'alpha': 48, 'iterations': 45}. Best is trial 37 with value: 33.17603096677966.
[I 2024-04-15 16:45:06,303] Trial 8 finished with value: 20.651044415989794 and parameters: {'model_name': 'KNNImputer', 'weights': 'distance', 'keep_empty_features': False}. Best is trial 8 with value: 20.651044415989794.
[I 2024-04-15 16:45:07,380] Trial 19 finished with value: 20.651044415989794 and parameters: {'model_name': 'KNNImputer', 'weights': 'distance', 'keep_empty_features': False}. Best is trial 8 with value: 20.651044415989794.
[I 2024-04-15 16:45:08,241] Trial 28 finished with value: 20.50033201344364 and parameters: {'model_name': 'KNNImputer', 'weights': 'uniform', 'keep_empty_features': False}. Best is trial 28 with value: 20.50033201344364.
[I 2024-04-15 16:45:08,988] Trial 26 finished with value: 20.50033201344364 and parameters: {'model_name': 'KNNImputer', 'weights': 'uniform', 'keep_empty_features': False}. Best is trial 28 with value: 20.50033201344364.
[I 2024-04-15 16:45:09,929] Trial 44 finished with value: 20.651044415989794 and parameters: {'model_name': 'KNNImputer', 'weights': 'distance', 'keep_empty_features': False}. Best is trial 28 with value: 20.50033201344364.
[I 2024-04-15 16:45:11,562] Trial 34 finished with value: 20.50033201344364 and parameters: {'model_name': 'KNNImputer', 'weights': 'uniform', 'keep_empty_features': False}. Best is trial 28 with value: 20.50033201344364.
[I 2024-04-15 16:45:12,364] Trial 52 finished with value: 33.32040274660817 and parameters: {'model_name': 'SimpleImputer', 'strategy': 'most_frequent'}. Best is trial 28 with value: 20.50033201344364.
[I 2024-04-15 16:45:15,875] Trial 51 finished with value: 20.651044415989794 and parameters: {'model_name': 'KNNImputer', 'weights': 'distance', 'keep_empty_features': False}. Best is trial 28 with value: 20.50033201344364.
[I 2024-04-15 16:45:18,428] Trial 54 finished with value: 20.50033201344364 and parameters: {'model_name': 'KNNImputer', 'weights': 'uniform', 'keep_empty_features': False}. Best is trial 28 with value: 20.50033201344364.
[I 2024-04-15 16:45:50,301] Trial 9 finished with value: 32.774778702984335 and parameters: {'model_name': 'RandomForestImputer', 'max_iter': 2, 'decreasing': True, 'min_samples_split': 0.8, 'min_samples_leaf': 0.9, 'max_features': 0.2, 'warm_start': True}. Best is trial 28 with value: 20.50033201344364.
[I 2024-04-15 16:46:06,114] Trial 23 finished with value: 13.729320617056587 and parameters: {'model_name': 'GAIN', 'batch_size': 4, 'hint_rate': 0.7100000000000001, 'alpha': 55, 'iterations': 1}. Best is trial 23 with value: 13.729320617056587.
[I 2024-04-15 16:46:07,356] Trial 39 finished with value: 16.84162682390302 and parameters: {'model_name': 'GAIN', 'batch_size': 221, 'hint_rate': 0.74, 'alpha': 8, 'iterations': 1}. Best is trial 23 with value: 13.729320617056587.
[I 2024-04-15 16:46:08,775] Trial 45 finished with value: 16.913718526040245 and parameters: {'model_name': 'GAIN', 'batch_size': 434, 'hint_rate': 0.8200000000000001, 'alpha': 55, 'iterations': 1}. Best is trial 23 with value: 13.729320617056587.
[I 2024-04-15 16:46:22,939] Trial 1 finished with value: 19.162244177190942 and parameters: {'model_name': 'IterativeImputer', 'sample_posterior': False, 'initial_strategy': 'median', 'imputation_order': 'descending'}. Best is trial 23 with value: 13.729320617056587.
[I 2024-04-15 16:46:24,037] Trial 14 finished with value: 19.162302137446613 and parameters: {'model_name': 'IterativeImputer', 'sample_posterior': False, 'initial_strategy': 'mean', 'imputation_order': 'random'}. Best is trial 23 with value: 13.729320617056587.
[I 2024-04-15 16:46:24,804] Trial 4 finished with value: 19.16224132573298 and parameters: {'model_name': 'IterativeImputer', 'sample_posterior': False, 'initial_strategy': 'mean', 'imputation_order': 'ascending'}. Best is trial 23 with value: 13.729320617056587.
[I 2024-04-15 16:46:26,346] Trial 5 finished with value: 19.16224162547667 and parameters: {'model_name': 'IterativeImputer', 'sample_posterior': False, 'initial_strategy': 'median', 'imputation_order': 'arabic'}. Best is trial 23 with value: 13.729320617056587.
[I 2024-04-15 16:46:28,351] Trial 33 finished with value: 19.162241845837073 and parameters: {'model_name': 'IterativeImputer', 'sample_posterior': False, 'initial_strategy': 'median', 'imputation_order': 'ascending'}. Best is trial 23 with value: 13.729320617056587.
[I 2024-04-15 16:46:29,563] Trial 16 finished with value: 19.1622439662553 and parameters: {'model_name': 'IterativeImputer', 'sample_posterior': False, 'initial_strategy': 'mean', 'imputation_order': 'random'}. Best is trial 23 with value: 13.729320617056587.
[I 2024-04-15 16:46:31,903] Trial 2 finished with value: 14.233784262183855 and parameters: {'model_name': 'GAIN', 'batch_size': 2, 'hint_rate': 0.48000000000000004, 'alpha': 29, 'iterations': 12}. Best is trial 23 with value: 13.729320617056587.
[I 2024-04-15 16:46:37,026] Trial 61 finished with value: 19.162241337947087 and parameters: {'model_name': 'IterativeImputer', 'sample_posterior': False, 'initial_strategy': 'mean', 'imputation_order': 'descending'}. Best is trial 23 with value: 13.729320617056587.
[I 2024-04-15 16:46:39,696] Trial 60 finished with value: 19.16224182774817 and parameters: {'model_name': 'IterativeImputer', 'sample_posterior': False, 'initial_strategy': 'constant', 'imputation_order': 'arabic'}. Best is trial 23 with value: 13.729320617056587.
[I 2024-04-15 16:46:41,604] Trial 25 finished with value: 19.175264105596675 and parameters: {'model_name': 'RandomForestImputer', 'max_iter': 1, 'decreasing': False, 'min_samples_split': 0.1, 'min_samples_leaf': 0.7000000000000001, 'max_features': 0.2, 'warm_start': False}. Best is trial 23 with value: 13.729320617056587.
[I 2024-04-15 16:46:43,259] Trial 43 finished with value: 19.175264105596675 and parameters: {'model_name': 'RandomForestImputer', 'max_iter': 1, 'decreasing': False, 'min_samples_split': 0.1, 'min_samples_leaf': 0.9, 'max_features': 0.6, 'warm_start': False}. Best is trial 23 with value: 13.729320617056587.
[I 2024-04-15 16:46:46,481] Trial 48 finished with value: 19.175264105596675 and parameters: {'model_name': 'RandomForestImputer', 'max_iter': 1, 'decreasing': True, 'min_samples_split': 0.5, 'min_samples_leaf': 0.7000000000000001, 'max_features': 0.7000000000000001, 'warm_start': False}. Best is trial 23 with value: 13.729320617056587.
[I 2024-04-15 16:46:48,850] Trial 7 finished with value: 19.16230140866733 and parameters: {'model_name': 'IterativeImputer', 'sample_posterior': False, 'initial_strategy': 'most_frequent', 'imputation_order': 'random'}. Best is trial 23 with value: 13.729320617056587.
[I 2024-04-15 16:46:55,171] Trial 56 finished with value: 19.175264105596675 and parameters: {'model_name': 'RandomForestImputer', 'max_iter': 1, 'decreasing': False, 'min_samples_split': 0.0, 'min_samples_leaf': 0.4, 'max_features': 0.4, 'warm_start': False}. Best is trial 23 with value: 13.729320617056587.
[I 2024-04-15 16:46:59,304] Trial 31 finished with value: 15.58158664450952 and parameters: {'model_name': 'GAIN', 'batch_size': 21, 'hint_rate': 0.5, 'alpha': 46, 'iterations': 17}. Best is trial 23 with value: 13.729320617056587.
[I 2024-04-15 16:47:01,957] Trial 59 finished with value: 19.175264105596675 and parameters: {'model_name': 'RandomForestImputer', 'max_iter': 1, 'decreasing': True, 'min_samples_split': 0.30000000000000004, 'min_samples_leaf': 0.2, 'max_features': 0.1, 'warm_start': False}. Best is trial 23 with value: 13.729320617056587.
[I 2024-04-15 16:47:04,251] Trial 63 finished with value: 19.16228995331458 and parameters: {'model_name': 'IterativeImputer', 'sample_posterior': False, 'initial_strategy': 'median', 'imputation_order': 'random'}. Best is trial 23 with value: 13.729320617056587.
[I 2024-04-15 16:47:13,530] Trial 55 finished with value: 15.086832562332512 and parameters: {'model_name': 'GAIN', 'batch_size': 9, 'hint_rate': 0.08, 'alpha': 53, 'iterations': 22}. Best is trial 23 with value: 13.729320617056587.
[I 2024-04-15 16:47:24,603] Trial 0 finished with value: 13.701314486367645 and parameters: {'model_name': 'GAIN', 'batch_size': 1, 'hint_rate': 0.51, 'alpha': 63, 'iterations': 29}. Best is trial 0 with value: 13.701314486367645.
[I 2024-04-15 16:47:42,258] Trial 42 finished with value: 35.362360598940505 and parameters: {'model_name': 'RandomForestImputer', 'max_iter': 14, 'decreasing': False, 'min_samples_split': 0.2, 'min_samples_leaf': 0.9, 'max_features': 0.2, 'warm_start': True}. Best is trial 0 with value: 13.701314486367645.
[I 2024-04-15 16:47:53,244] Trial 70 finished with value: 17.106519973607398 and parameters: {'model_name': 'GAIN', 'batch_size': 3, 'hint_rate': 0.8300000000000001, 'alpha': 6, 'iterations': 1}. Best is trial 0 with value: 13.701314486367645.
[I 2024-04-15 16:47:56,041] Trial 69 finished with value: 14.694341474319112 and parameters: {'model_name': 'GAIN', 'batch_size': 2, 'hint_rate': 0.8300000000000001, 'alpha': 10, 'iterations': 1}. Best is trial 0 with value: 13.701314486367645.
[I 2024-04-15 16:47:57,963] Trial 71 finished with value: 19.318661576453728 and parameters: {'model_name': 'GAIN', 'batch_size': 2, 'hint_rate': 0.8300000000000001, 'alpha': 2, 'iterations': 1}. Best is trial 0 with value: 13.701314486367645.
[I 2024-04-15 16:48:00,309] Trial 73 finished with value: 14.715038249144328 and parameters: {'model_name': 'GAIN', 'batch_size': 3, 'hint_rate': 0.8300000000000001, 'alpha': 2, 'iterations': 1}. Best is trial 0 with value: 13.701314486367645.
[I 2024-04-15 16:48:02,155] Trial 68 finished with value: 11.864780781668479 and parameters: {'model_name': 'GAIN', 'batch_size': 3, 'hint_rate': 0.8200000000000001, 'alpha': 3, 'iterations': 1}. Best is trial 68 with value: 11.864780781668479.
[I 2024-04-15 16:48:05,537] Trial 72 finished with value: 13.616642327409457 and parameters: {'model_name': 'GAIN', 'batch_size': 2, 'hint_rate': 0.8300000000000001, 'alpha': 3, 'iterations': 1}. Best is trial 68 with value: 11.864780781668479.
[I 2024-04-15 16:48:09,412] Trial 67 finished with value: 19.16224162547667 and parameters: {'model_name': 'IterativeImputer', 'sample_posterior': False, 'initial_strategy': 'median', 'imputation_order': 'arabic'}. Best is trial 68 with value: 11.864780781668479.
[I 2024-04-15 16:48:12,507] Trial 75 finished with value: 18.011281427020652 and parameters: {'model_name': 'GAIN', 'batch_size': 2, 'hint_rate': 0.68, 'alpha': 1, 'iterations': 1}. Best is trial 68 with value: 11.864780781668479.
[I 2024-04-15 16:48:13,949] Trial 66 finished with value: 19.16224244805161 and parameters: {'model_name': 'IterativeImputer', 'sample_posterior': False, 'initial_strategy': 'most_frequent', 'imputation_order': 'roman'}. Best is trial 68 with value: 11.864780781668479.
[I 2024-04-15 16:48:17,902] Trial 77 finished with value: 16.624956121429108 and parameters: {'model_name': 'GAIN', 'batch_size': 2, 'hint_rate': 0.68, 'alpha': 0, 'iterations': 1}. Best is trial 68 with value: 11.864780781668479.
[I 2024-04-15 16:48:19,824] Trial 76 finished with value: 18.047285452274537 and parameters: {'model_name': 'GAIN', 'batch_size': 2, 'hint_rate': 0.6900000000000001, 'alpha': 8, 'iterations': 1}. Best is trial 68 with value: 11.864780781668479.
[I 2024-04-15 16:48:24,110] Trial 78 finished with value: 15.207736543947561 and parameters: {'model_name': 'GAIN', 'batch_size': 2, 'hint_rate': 0.8200000000000001, 'alpha': 0, 'iterations': 1}. Best is trial 68 with value: 11.864780781668479.
[I 2024-04-15 16:48:26,117] Trial 79 finished with value: 16.477052749689406 and parameters: {'model_name': 'GAIN', 'batch_size': 2, 'hint_rate': 0.8, 'alpha': 1, 'iterations': 1}. Best is trial 68 with value: 11.864780781668479.
[I 2024-04-15 16:48:28,065] Trial 74 finished with value: 13.033267255570806 and parameters: {'model_name': 'GAIN', 'batch_size': 2, 'hint_rate': 0.68, 'alpha': 1, 'iterations': 1}. Best is trial 68 with value: 11.864780781668479.
[I 2024-04-15 16:48:29,961] Trial 80 finished with value: 16.567555695719342 and parameters: {'model_name': 'GAIN', 'batch_size': 2, 'hint_rate': 0.8200000000000001, 'alpha': 2, 'iterations': 1}. Best is trial 68 with value: 11.864780781668479.
[I 2024-04-15 16:48:36,734] Trial 81 finished with value: 16.837151317159183 and parameters: {'model_name': 'GAIN', 'batch_size': 2, 'hint_rate': 0.81, 'alpha': 1, 'iterations': 1}. Best is trial 68 with value: 11.864780781668479.
[I 2024-04-15 16:48:43,306] Trial 83 finished with value: 19.25657898735728 and parameters: {'model_name': 'GAIN', 'batch_size': 3, 'hint_rate': 0.6, 'alpha': 0, 'iterations': 2}. Best is trial 68 with value: 11.864780781668479.
[I 2024-04-15 16:48:47,982] Trial 84 finished with value: 15.109196574029479 and parameters: {'model_name': 'GAIN', 'batch_size': 3, 'hint_rate': 0.62, 'alpha': 7, 'iterations': 2}. Best is trial 68 with value: 11.864780781668479.
[I 2024-04-15 16:49:01,004] Trial 82 finished with value: 15.70193384171086 and parameters: {'model_name': 'GAIN', 'batch_size': 2, 'hint_rate': 0.63, 'alpha': 1, 'iterations': 2}. Best is trial 68 with value: 11.864780781668479.
[I 2024-04-15 16:50:08,436] Trial 100 finished with value: 15.611125492983197 and parameters: {'model_name': 'GAIN', 'batch_size': 1, 'hint_rate': 0.9600000000000001, 'alpha': 23, 'iterations': 4}. Best is trial 68 with value: 11.864780781668479.
[I 2024-04-15 16:50:10,447] Trial 93 finished with value: 15.862781192103181 and parameters: {'model_name': 'GAIN', 'batch_size': 1, 'hint_rate': 0.55, 'alpha': 28, 'iterations': 6}. Best is trial 68 with value: 11.864780781668479.
[I 2024-04-15 16:50:15,028] Trial 92 finished with value: 14.923063037182592 and parameters: {'model_name': 'GAIN', 'batch_size': 1, 'hint_rate': 0.53, 'alpha': 23, 'iterations': 7}. Best is trial 68 with value: 11.864780781668479.
[I 2024-04-15 16:50:18,183] Trial 91 finished with value: 14.003360344048199 and parameters: {'model_name': 'GAIN', 'batch_size': 1, 'hint_rate': 0.53, 'alpha': 24, 'iterations': 9}. Best is trial 68 with value: 11.864780781668479.
[I 2024-04-15 16:50:20,371] Trial 96 finished with value: 19.988447834395533 and parameters: {'model_name': 'GAIN', 'batch_size': 1, 'hint_rate': 0.52, 'alpha': 28, 'iterations': 9}. Best is trial 68 with value: 11.864780781668479.
[I 2024-04-15 16:50:23,596] Trial 98 finished with value: 16.02200358780654 and parameters: {'model_name': 'GAIN', 'batch_size': 1, 'hint_rate': 0.47000000000000003, 'alpha': 23, 'iterations': 6}. Best is trial 68 with value: 11.864780781668479.
[I 2024-04-15 16:50:25,714] Trial 94 finished with value: 15.108783725453474 and parameters: {'model_name': 'GAIN', 'batch_size': 1, 'hint_rate': 0.56, 'alpha': 31, 'iterations': 8}. Best is trial 68 with value: 11.864780781668479.
[I 2024-04-15 16:50:27,660] Trial 102 finished with value: 14.443632514212055 and parameters: {'model_name': 'GAIN', 'batch_size': 1, 'hint_rate': 0.98, 'alpha': 31, 'iterations': 5}. Best is trial 68 with value: 11.864780781668479.
[I 2024-04-15 16:50:32,252] Trial 95 finished with value: 16.203468073837335 and parameters: {'model_name': 'GAIN', 'batch_size': 1, 'hint_rate': 0.53, 'alpha': 28, 'iterations': 8}. Best is trial 68 with value: 11.864780781668479.
[I 2024-04-15 16:50:34,598] Trial 99 finished with value: 14.773609133494045 and parameters: {'model_name': 'GAIN', 'batch_size': 1, 'hint_rate': 0.99, 'alpha': 22, 'iterations': 7}. Best is trial 68 with value: 11.864780781668479.
[I 2024-04-15 16:50:37,792] Trial 87 finished with value: 14.280577535903737 and parameters: {'model_name': 'GAIN', 'batch_size': 2, 'hint_rate': 0.48000000000000004, 'alpha': 62, 'iterations': 19}. Best is trial 68 with value: 11.864780781668479.
[I 2024-04-15 16:50:39,885] Trial 97 finished with value: 14.85206385324688 and parameters: {'model_name': 'GAIN', 'batch_size': 1, 'hint_rate': 0.51, 'alpha': 25, 'iterations': 8}. Best is trial 68 with value: 11.864780781668479.
[I 2024-04-15 16:50:43,622] Trial 104 finished with value: 14.99451457768124 and parameters: {'model_name': 'GAIN', 'batch_size': 1, 'hint_rate': 0.99, 'alpha': 21, 'iterations': 5}. Best is trial 68 with value: 11.864780781668479.
[I 2024-04-15 16:50:50,283] Trial 103 finished with value: 16.382151445368912 and parameters: {'model_name': 'GAIN', 'batch_size': 1, 'hint_rate': 0.49, 'alpha': 22, 'iterations': 7}. Best is trial 68 with value: 11.864780781668479.
[I 2024-04-15 16:50:57,204] Trial 86 finished with value: 13.97233686165051 and parameters: {'model_name': 'GAIN', 'batch_size': 2, 'hint_rate': 0.52, 'alpha': 60, 'iterations': 23}. Best is trial 68 with value: 11.864780781668479.
[I 2024-04-15 16:50:59,789] Trial 121 finished with value: 19.175264105596675 and parameters: {'model_name': 'SimpleImputer', 'strategy': 'mean'}. Best is trial 68 with value: 11.864780781668479.
[I 2024-04-15 16:51:04,408] Trial 105 finished with value: 15.583528904733289 and parameters: {'model_name': 'GAIN', 'batch_size': 1, 'hint_rate': 0.9600000000000001, 'alpha': 21, 'iterations': 6}. Best is trial 68 with value: 11.864780781668479.
[I 2024-04-15 16:51:06,754] Trial 101 finished with value: 14.075786184369289 and parameters: {'model_name': 'GAIN', 'batch_size': 1, 'hint_rate': 0.52, 'alpha': 26, 'iterations': 7}. Best is trial 68 with value: 11.864780781668479.
[I 2024-04-15 16:51:13,098] Trial 89 finished with value: 19.309578208617744 and parameters: {'model_name': 'GAIN', 'batch_size': 2, 'hint_rate': 0.5, 'alpha': 59, 'iterations': 18}. Best is trial 68 with value: 11.864780781668479.
[I 2024-04-15 16:51:19,450] Trial 85 finished with value: 14.795073608044436 and parameters: {'model_name': 'GAIN', 'batch_size': 3, 'hint_rate': 0.49, 'alpha': 42, 'iterations': 28}. Best is trial 68 with value: 11.864780781668479.
[I 2024-04-15 16:51:25,284] Trial 15 finished with value: 35.30546063699522 and parameters: {'model_name': 'RandomForestImputer', 'max_iter': 26, 'decreasing': False, 'min_samples_split': 0.8, 'min_samples_leaf': 0.30000000000000004, 'max_features': 0.1, 'warm_start': True}. Best is trial 68 with value: 11.864780781668479.
[I 2024-04-15 16:51:30,529] Trial 106 finished with value: 15.470375139353461 and parameters: {'model_name': 'GAIN', 'batch_size': 1, 'hint_rate': 0.99, 'alpha': 23, 'iterations': 6}. Best is trial 68 with value: 11.864780781668479.
[I 2024-04-15 16:51:33,379] Trial 90 finished with value: 15.951814866317127 and parameters: {'model_name': 'GAIN', 'batch_size': 1, 'hint_rate': 0.54, 'alpha': 61, 'iterations': 23}. Best is trial 68 with value: 11.864780781668479.
[I 2024-04-15 16:51:44,518] Trial 88 finished with value: 18.562261980154517 and parameters: {'model_name': 'GAIN', 'batch_size': 2, 'hint_rate': 0.46, 'alpha': 51, 'iterations': 25}. Best is trial 68 with value: 11.864780781668479.
[I 2024-04-15 16:51:51,102] Trial 130 finished with value: 20.651044415989794 and parameters: {'model_name': 'KNNImputer', 'weights': 'distance', 'keep_empty_features': False}. Best is trial 68 with value: 11.864780781668479.
[I 2024-04-15 16:51:56,260] Trial 20 finished with value: 16.605320294933286 and parameters: {'model_name': 'GAIN', 'batch_size': 51, 'hint_rate': 0.97, 'alpha': 33, 'iterations': 80}. Best is trial 68 with value: 11.864780781668479.
[I 2024-04-15 16:52:22,286] Trial 111 finished with value: 16.25954012596432 and parameters: {'model_name': 'GAIN', 'batch_size': 6, 'hint_rate': 0.42000000000000004, 'alpha': 61, 'iterations': 4}. Best is trial 68 with value: 11.864780781668479.
[I 2024-04-15 16:52:25,502] Trial 107 finished with value: 17.501590554561666 and parameters: {'model_name': 'GAIN', 'batch_size': 1, 'hint_rate': 0.45, 'alpha': 62, 'iterations': 5}. Best is trial 68 with value: 11.864780781668479.
[I 2024-04-15 16:52:28,420] Trial 57 finished with value: 35.31524899674302 and parameters: {'model_name': 'RandomForestImputer', 'max_iter': 58, 'decreasing': False, 'min_samples_split': 1.0, 'min_samples_leaf': 0.5, 'max_features': 0.30000000000000004, 'warm_start': True}. Best is trial 68 with value: 11.864780781668479.
