Run: 2
/cm/local/apps/slurm/var/spool/job566987/slurm_script: line 23: /common/ketrong/minconda3/etc/profile.d/conda.sh: No such file or directory
/cm/local/apps/slurm/var/spool/job566987/slurm_script: line 26: $'\nconda create --name tpot2devenv -c conda-forge python=3.10\n': command not found
/cm/local/apps/slurm/var/spool/job566987/slurm_script: line 31: $'\npip install -r requirements.txt\n': command not found
RunStart
2023-12-26 13:24:29.739688: I tensorflow/core/util/port.cc:113] oneDNN custom operations are on. You may see slightly different numerical results due to floating-point round-off errors from different computation orders. To turn them off, set the environment variable `TF_ENABLE_ONEDNN_OPTS=0`.
2023-12-26 13:24:29.775565: E external/local_xla/xla/stream_executor/cuda/cuda_dnn.cc:9261] Unable to register cuDNN factory: Attempting to register factory for plugin cuDNN when one has already been registered
2023-12-26 13:24:29.775588: E external/local_xla/xla/stream_executor/cuda/cuda_fft.cc:607] Unable to register cuFFT factory: Attempting to register factory for plugin cuFFT when one has already been registered
2023-12-26 13:24:29.776699: E external/local_xla/xla/stream_executor/cuda/cuda_blas.cc:1515] Unable to register cuBLAS factory: Attempting to register factory for plugin cuBLAS when one has already been registered
2023-12-26 13:24:29.782315: I tensorflow/core/platform/cpu_feature_guard.cc:182] This TensorFlow binary is optimized to use available CPU instructions in performance-critical operations.
To enable the following instructions: AVX2 AVX512F AVX512_VNNI FMA, in other operations, rebuild TensorFlow with the appropriate compiler flags.
2023-12-26 13:24:31.783220: W tensorflow/compiler/tf2tensorrt/utils/py_utils.cc:38] TF-TRT Warning: Could not find TensorRT
WARNING:tensorflow:From /home/ketrong/miniconda3/envs/tpot2devenv/lib/python3.10/site-packages/tensorflow/python/compat/v2_compat.py:108: disable_resource_variables (from tensorflow.python.ops.variable_scope) is deprecated and will be removed in a future version.
Instructions for updating:
non-resource variables are not supported in the long term
starting loops
working on 
logs/2076/tpot2_base_normal_MCAR_0.1
0.6753861904144287
loading data
logs/2076/tpot2_base_normal_MCAR_0.1/data/2076_True.pkl
running experiment 1/3 - Does large hyperparameter space improve reconstruction accuracy over simple
[I 2023-12-26 13:24:40,859] A new study created in memory with name: no-name-3df440b7-9cce-43a2-934b-f369444ace07
[I 2023-12-26 13:24:43,657] Trial 5 finished with value: 0.3670456054654515 and parameters: {'model_name': 'SimpleImputer', 'strategy': 'constant'}. Best is trial 5 with value: 0.3670456054654515.
[I 2023-12-26 13:24:43,984] Trial 4 finished with value: 0.3670456054654515 and parameters: {'model_name': 'SimpleImputer', 'strategy': 'constant'}. Best is trial 5 with value: 0.3670456054654515.
[I 2023-12-26 13:24:44,171] Trial 8 finished with value: 0.3670456054654515 and parameters: {'model_name': 'SimpleImputer', 'strategy': 'constant'}. Best is trial 5 with value: 0.3670456054654515.
[I 2023-12-26 13:24:44,775] Trial 11 finished with value: 0.3670456054654515 and parameters: {'model_name': 'SimpleImputer', 'strategy': 'constant'}. Best is trial 5 with value: 0.3670456054654515.
[I 2023-12-26 13:24:45,105] Trial 1 finished with value: 0.3295559011403175 and parameters: {'model_name': 'SimpleImputer', 'strategy': 'mean'}. Best is trial 1 with value: 0.3295559011403175.
[I 2023-12-26 13:24:45,524] Trial 3 finished with value: 0.3295559011403175 and parameters: {'model_name': 'SimpleImputer', 'strategy': 'mean'}. Best is trial 1 with value: 0.3295559011403175.
[I 2023-12-26 13:24:45,759] Trial 6 finished with value: 0.3295559011403175 and parameters: {'model_name': 'SimpleImputer', 'strategy': 'mean'}. Best is trial 1 with value: 0.3295559011403175.
[I 2023-12-26 13:24:45,951] Trial 22 finished with value: 0.3670456054654515 and parameters: {'model_name': 'SimpleImputer', 'strategy': 'constant'}. Best is trial 1 with value: 0.3295559011403175.
[I 2023-12-26 13:24:46,124] Trial 19 finished with value: 0.3670456054654515 and parameters: {'model_name': 'SimpleImputer', 'strategy': 'constant'}. Best is trial 1 with value: 0.3295559011403175.
[I 2023-12-26 13:24:46,430] Trial 31 finished with value: 0.3670456054654515 and parameters: {'model_name': 'SimpleImputer', 'strategy': 'constant'}. Best is trial 1 with value: 0.3295559011403175.
[I 2023-12-26 13:24:46,606] Trial 32 finished with value: 0.3670456054654515 and parameters: {'model_name': 'SimpleImputer', 'strategy': 'constant'}. Best is trial 1 with value: 0.3295559011403175.
[I 2023-12-26 13:24:46,935] Trial 2 finished with value: 0.3295559011403175 and parameters: {'model_name': 'SimpleImputer', 'strategy': 'mean'}. Best is trial 1 with value: 0.3295559011403175.
[I 2023-12-26 13:24:47,128] Trial 23 finished with value: 0.3670456054654515 and parameters: {'model_name': 'SimpleImputer', 'strategy': 'constant'}. Best is trial 1 with value: 0.3295559011403175.
[I 2023-12-26 13:24:47,334] Trial 0 finished with value: 0.3295559011403175 and parameters: {'model_name': 'SimpleImputer', 'strategy': 'mean'}. Best is trial 1 with value: 0.3295559011403175.
[I 2023-12-26 13:24:47,679] Trial 21 finished with value: 0.3295559011403175 and parameters: {'model_name': 'SimpleImputer', 'strategy': 'mean'}. Best is trial 1 with value: 0.3295559011403175.
[I 2023-12-26 13:24:47,905] Trial 33 finished with value: 0.3670456054654515 and parameters: {'model_name': 'SimpleImputer', 'strategy': 'constant'}. Best is trial 1 with value: 0.3295559011403175.
[I 2023-12-26 13:24:48,217] Trial 40 finished with value: 0.3670456054654515 and parameters: {'model_name': 'SimpleImputer', 'strategy': 'constant'}. Best is trial 1 with value: 0.3295559011403175.
[I 2023-12-26 13:24:48,738] Trial 29 finished with value: 0.3295559011403175 and parameters: {'model_name': 'SimpleImputer', 'strategy': 'mean'}. Best is trial 1 with value: 0.3295559011403175.
[I 2023-12-26 13:24:49,144] Trial 20 finished with value: 0.3295559011403175 and parameters: {'model_name': 'SimpleImputer', 'strategy': 'mean'}. Best is trial 1 with value: 0.3295559011403175.
[I 2023-12-26 13:24:49,373] Trial 9 finished with value: 0.3295559011403175 and parameters: {'model_name': 'SimpleImputer', 'strategy': 'mean'}. Best is trial 1 with value: 0.3295559011403175.
[I 2023-12-26 13:24:49,617] Trial 39 finished with value: 0.3670456054654515 and parameters: {'model_name': 'SimpleImputer', 'strategy': 'constant'}. Best is trial 1 with value: 0.3295559011403175.
[I 2023-12-26 13:24:49,953] Trial 27 finished with value: 0.3670456054654515 and parameters: {'model_name': 'SimpleImputer', 'strategy': 'constant'}. Best is trial 1 with value: 0.3295559011403175.
[I 2023-12-26 13:24:50,149] Trial 16 finished with value: 0.3295559011403175 and parameters: {'model_name': 'SimpleImputer', 'strategy': 'mean'}. Best is trial 1 with value: 0.3295559011403175.
[I 2023-12-26 13:24:50,358] Trial 26 finished with value: 0.3295559011403175 and parameters: {'model_name': 'SimpleImputer', 'strategy': 'mean'}. Best is trial 1 with value: 0.3295559011403175.
[I 2023-12-26 13:24:50,825] Trial 42 finished with value: 0.3670456054654515 and parameters: {'model_name': 'SimpleImputer', 'strategy': 'constant'}. Best is trial 1 with value: 0.3295559011403175.
[I 2023-12-26 13:24:51,181] Trial 34 finished with value: 0.3295559011403175 and parameters: {'model_name': 'SimpleImputer', 'strategy': 'mean'}. Best is trial 1 with value: 0.3295559011403175.
[I 2023-12-26 13:24:51,518] Trial 38 finished with value: 0.3295559011403175 and parameters: {'model_name': 'SimpleImputer', 'strategy': 'mean'}. Best is trial 1 with value: 0.3295559011403175.
[I 2023-12-26 13:24:51,817] Trial 7 finished with value: 0.3670456054654515 and parameters: {'model_name': 'SimpleImputer', 'strategy': 'median'}. Best is trial 1 with value: 0.3295559011403175.
[I 2023-12-26 13:24:52,047] Trial 45 finished with value: 0.3295559011403175 and parameters: {'model_name': 'SimpleImputer', 'strategy': 'mean'}. Best is trial 1 with value: 0.3295559011403175.
[I 2023-12-26 13:24:52,401] Trial 41 finished with value: 0.3295559011403175 and parameters: {'model_name': 'SimpleImputer', 'strategy': 'mean'}. Best is trial 1 with value: 0.3295559011403175.
[I 2023-12-26 13:24:52,624] Trial 35 finished with value: 0.3295559011403175 and parameters: {'model_name': 'SimpleImputer', 'strategy': 'mean'}. Best is trial 1 with value: 0.3295559011403175.
[I 2023-12-26 13:24:52,969] Trial 17 finished with value: 0.3670456054654515 and parameters: {'model_name': 'SimpleImputer', 'strategy': 'median'}. Best is trial 1 with value: 0.3295559011403175.
[I 2023-12-26 13:24:54,048] Trial 50 finished with value: 0.3670456054654515 and parameters: {'model_name': 'SimpleImputer', 'strategy': 'constant'}. Best is trial 1 with value: 0.3295559011403175.
[I 2023-12-26 13:24:54,372] Trial 28 finished with value: 0.3670456054654515 and parameters: {'model_name': 'SimpleImputer', 'strategy': 'median'}. Best is trial 1 with value: 0.3295559011403175.
[I 2023-12-26 13:24:54,622] Trial 36 finished with value: 0.3670456054654515 and parameters: {'model_name': 'SimpleImputer', 'strategy': 'median'}. Best is trial 1 with value: 0.3295559011403175.
[I 2023-12-26 13:24:54,937] Trial 25 finished with value: 0.3670456054654515 and parameters: {'model_name': 'SimpleImputer', 'strategy': 'median'}. Best is trial 1 with value: 0.3295559011403175.
[I 2023-12-26 13:24:55,274] Trial 47 finished with value: 0.3670456054654515 and parameters: {'model_name': 'SimpleImputer', 'strategy': 'median'}. Best is trial 1 with value: 0.3295559011403175.
[I 2023-12-26 13:24:55,536] Trial 44 finished with value: 0.3670456054654515 and parameters: {'model_name': 'SimpleImputer', 'strategy': 'median'}. Best is trial 1 with value: 0.3295559011403175.
[I 2023-12-26 13:24:55,739] Trial 24 finished with value: 0.3670456054654515 and parameters: {'model_name': 'SimpleImputer', 'strategy': 'median'}. Best is trial 1 with value: 0.3295559011403175.
[I 2023-12-26 13:24:56,184] Trial 43 finished with value: 0.3670456054654515 and parameters: {'model_name': 'SimpleImputer', 'strategy': 'median'}. Best is trial 1 with value: 0.3295559011403175.
[I 2023-12-26 13:24:56,975] Trial 51 finished with value: 0.3295559011403175 and parameters: {'model_name': 'SimpleImputer', 'strategy': 'mean'}. Best is trial 1 with value: 0.3295559011403175.
[I 2023-12-26 13:24:57,145] Trial 55 finished with value: 0.3295559011403175 and parameters: {'model_name': 'SimpleImputer', 'strategy': 'mean'}. Best is trial 1 with value: 0.3295559011403175.
[I 2023-12-26 13:24:57,500] Trial 58 finished with value: 0.3295559011403175 and parameters: {'model_name': 'SimpleImputer', 'strategy': 'mean'}. Best is trial 1 with value: 0.3295559011403175.
[I 2023-12-26 13:24:57,673] Trial 57 finished with value: 0.3295559011403175 and parameters: {'model_name': 'SimpleImputer', 'strategy': 'mean'}. Best is trial 1 with value: 0.3295559011403175.
[I 2023-12-26 13:24:58,217] Trial 49 finished with value: 0.3670456054654515 and parameters: {'model_name': 'SimpleImputer', 'strategy': 'median'}. Best is trial 1 with value: 0.3295559011403175.
[I 2023-12-26 13:24:58,543] Trial 52 finished with value: 0.3670456054654515 and parameters: {'model_name': 'SimpleImputer', 'strategy': 'median'}. Best is trial 1 with value: 0.3295559011403175.
[I 2023-12-26 13:24:59,571] Trial 60 finished with value: 0.3670456054654515 and parameters: {'model_name': 'SimpleImputer', 'strategy': 'median'}. Best is trial 1 with value: 0.3295559011403175.
[I 2023-12-26 13:25:00,221] Trial 53 finished with value: 0.3670456054654515 and parameters: {'model_name': 'SimpleImputer', 'strategy': 'median'}. Best is trial 1 with value: 0.3295559011403175.
[I 2023-12-26 13:25:00,648] Trial 63 finished with value: 0.3670456054654515 and parameters: {'model_name': 'SimpleImputer', 'strategy': 'median'}. Best is trial 1 with value: 0.3295559011403175.
[I 2023-12-26 13:25:01,227] Trial 72 finished with value: 0.3670456054654515 and parameters: {'model_name': 'SimpleImputer', 'strategy': 'median'}. Best is trial 1 with value: 0.3295559011403175.
[I 2023-12-26 13:25:01,596] Trial 71 finished with value: 0.3670456054654515 and parameters: {'model_name': 'SimpleImputer', 'strategy': 'median'}. Best is trial 1 with value: 0.3295559011403175.
[I 2023-12-26 13:25:11,623] Trial 14 finished with value: 0.3670456054654515 and parameters: {'model_name': 'SimpleImputer', 'strategy': 'most_frequent'}. Best is trial 1 with value: 0.3295559011403175.
[I 2023-12-26 13:25:12,187] Trial 13 finished with value: 0.3670456054654515 and parameters: {'model_name': 'SimpleImputer', 'strategy': 'most_frequent'}. Best is trial 1 with value: 0.3295559011403175.
[I 2023-12-26 13:25:12,927] Trial 18 finished with value: 0.3670456054654515 and parameters: {'model_name': 'SimpleImputer', 'strategy': 'most_frequent'}. Best is trial 1 with value: 0.3295559011403175.
[I 2023-12-26 13:25:13,176] Trial 37 finished with value: 0.3670456054654515 and parameters: {'model_name': 'SimpleImputer', 'strategy': 'most_frequent'}. Best is trial 1 with value: 0.3295559011403175.
[I 2023-12-26 13:25:13,569] Trial 12 finished with value: 0.3670456054654515 and parameters: {'model_name': 'SimpleImputer', 'strategy': 'most_frequent'}. Best is trial 1 with value: 0.3295559011403175.
[I 2023-12-26 13:25:14,253] Trial 46 finished with value: 0.3670456054654515 and parameters: {'model_name': 'SimpleImputer', 'strategy': 'most_frequent'}. Best is trial 1 with value: 0.3295559011403175.
[I 2023-12-26 13:25:14,627] Trial 10 finished with value: 0.3670456054654515 and parameters: {'model_name': 'SimpleImputer', 'strategy': 'most_frequent'}. Best is trial 1 with value: 0.3295559011403175.
[I 2023-12-26 13:25:15,103] Trial 15 finished with value: 0.3670456054654515 and parameters: {'model_name': 'SimpleImputer', 'strategy': 'most_frequent'}. Best is trial 1 with value: 0.3295559011403175.
[I 2023-12-26 13:25:16,268] Trial 30 finished with value: 0.3670456054654515 and parameters: {'model_name': 'SimpleImputer', 'strategy': 'most_frequent'}. Best is trial 1 with value: 0.3295559011403175.
[I 2023-12-26 13:25:17,164] Trial 54 finished with value: 0.3670456054654515 and parameters: {'model_name': 'SimpleImputer', 'strategy': 'most_frequent'}. Best is trial 1 with value: 0.3295559011403175.
[I 2023-12-26 13:25:17,639] Trial 48 finished with value: 0.3670456054654515 and parameters: {'model_name': 'SimpleImputer', 'strategy': 'most_frequent'}. Best is trial 1 with value: 0.3295559011403175.
[I 2023-12-26 13:25:18,181] Trial 102 finished with value: 0.3295559011403175 and parameters: {'model_name': 'SimpleImputer', 'strategy': 'mean'}. Best is trial 1 with value: 0.3295559011403175.
[I 2023-12-26 13:25:18,458] Trial 103 finished with value: 0.3295559011403175 and parameters: {'model_name': 'SimpleImputer', 'strategy': 'mean'}. Best is trial 1 with value: 0.3295559011403175.
[I 2023-12-26 13:25:18,698] Trial 67 finished with value: 0.3670456054654515 and parameters: {'model_name': 'SimpleImputer', 'strategy': 'most_frequent'}. Best is trial 1 with value: 0.3295559011403175.
[I 2023-12-26 13:25:19,096] Trial 64 finished with value: 0.3670456054654515 and parameters: {'model_name': 'SimpleImputer', 'strategy': 'most_frequent'}. Best is trial 1 with value: 0.3295559011403175.
[I 2023-12-26 13:25:19,651] Trial 104 finished with value: 0.3295559011403175 and parameters: {'model_name': 'SimpleImputer', 'strategy': 'mean'}. Best is trial 1 with value: 0.3295559011403175.
[I 2023-12-26 13:25:20,268] Trial 70 finished with value: 0.3670456054654515 and parameters: {'model_name': 'SimpleImputer', 'strategy': 'most_frequent'}. Best is trial 1 with value: 0.3295559011403175.
[I 2023-12-26 13:25:20,775] Trial 106 finished with value: 0.3295559011403175 and parameters: {'model_name': 'SimpleImputer', 'strategy': 'mean'}. Best is trial 1 with value: 0.3295559011403175.
[I 2023-12-26 13:25:21,005] Trial 83 finished with value: 0.3670456054654515 and parameters: {'model_name': 'SimpleImputer', 'strategy': 'most_frequent'}. Best is trial 1 with value: 0.3295559011403175.
[I 2023-12-26 13:25:21,277] Trial 62 finished with value: 0.3670456054654515 and parameters: {'model_name': 'SimpleImputer', 'strategy': 'most_frequent'}. Best is trial 1 with value: 0.3295559011403175.
[I 2023-12-26 13:25:21,451] Trial 56 finished with value: 0.3670456054654515 and parameters: {'model_name': 'SimpleImputer', 'strategy': 'most_frequent'}. Best is trial 1 with value: 0.3295559011403175.
[I 2023-12-26 13:25:21,632] Trial 73 finished with value: 0.3670456054654515 and parameters: {'model_name': 'SimpleImputer', 'strategy': 'most_frequent'}. Best is trial 1 with value: 0.3295559011403175.
[I 2023-12-26 13:25:21,814] Trial 61 finished with value: 0.3670456054654515 and parameters: {'model_name': 'SimpleImputer', 'strategy': 'most_frequent'}. Best is trial 1 with value: 0.3295559011403175.
[I 2023-12-26 13:25:22,023] Trial 105 finished with value: 0.3295559011403175 and parameters: {'model_name': 'SimpleImputer', 'strategy': 'mean'}. Best is trial 1 with value: 0.3295559011403175.
[I 2023-12-26 13:25:22,409] Trial 85 finished with value: 0.3670456054654515 and parameters: {'model_name': 'SimpleImputer', 'strategy': 'most_frequent'}. Best is trial 1 with value: 0.3295559011403175.
[I 2023-12-26 13:25:22,867] Trial 68 finished with value: 0.3670456054654515 and parameters: {'model_name': 'SimpleImputer', 'strategy': 'most_frequent'}. Best is trial 1 with value: 0.3295559011403175.
[I 2023-12-26 13:25:23,125] Trial 75 finished with value: 0.3670456054654515 and parameters: {'model_name': 'SimpleImputer', 'strategy': 'most_frequent'}. Best is trial 1 with value: 0.3295559011403175.
[I 2023-12-26 13:25:23,377] Trial 76 finished with value: 0.3670456054654515 and parameters: {'model_name': 'SimpleImputer', 'strategy': 'most_frequent'}. Best is trial 1 with value: 0.3295559011403175.
[I 2023-12-26 13:25:23,665] Trial 77 finished with value: 0.3670456054654515 and parameters: {'model_name': 'SimpleImputer', 'strategy': 'most_frequent'}. Best is trial 1 with value: 0.3295559011403175.
[I 2023-12-26 13:25:23,897] Trial 59 finished with value: 0.3670456054654515 and parameters: {'model_name': 'SimpleImputer', 'strategy': 'most_frequent'}. Best is trial 1 with value: 0.3295559011403175.
[I 2023-12-26 13:25:24,369] Trial 107 finished with value: 0.3295559011403175 and parameters: {'model_name': 'SimpleImputer', 'strategy': 'mean'}. Best is trial 1 with value: 0.3295559011403175.
[I 2023-12-26 13:25:24,583] Trial 65 finished with value: 0.3670456054654515 and parameters: {'model_name': 'SimpleImputer', 'strategy': 'most_frequent'}. Best is trial 1 with value: 0.3295559011403175.
[I 2023-12-26 13:25:24,976] Trial 74 finished with value: 0.3670456054654515 and parameters: {'model_name': 'SimpleImputer', 'strategy': 'most_frequent'}. Best is trial 1 with value: 0.3295559011403175.
[I 2023-12-26 13:25:25,291] Trial 108 finished with value: 0.3295559011403175 and parameters: {'model_name': 'SimpleImputer', 'strategy': 'mean'}. Best is trial 1 with value: 0.3295559011403175.
[I 2023-12-26 13:25:25,694] Trial 78 finished with value: 0.3670456054654515 and parameters: {'model_name': 'SimpleImputer', 'strategy': 'most_frequent'}. Best is trial 1 with value: 0.3295559011403175.
[I 2023-12-26 13:25:26,094] Trial 66 finished with value: 0.3670456054654515 and parameters: {'model_name': 'SimpleImputer', 'strategy': 'most_frequent'}. Best is trial 1 with value: 0.3295559011403175.
[I 2023-12-26 13:25:26,459] Trial 109 finished with value: 0.3295559011403175 and parameters: {'model_name': 'SimpleImputer', 'strategy': 'mean'}. Best is trial 1 with value: 0.3295559011403175.
[I 2023-12-26 13:25:26,950] Trial 69 finished with value: 0.3670456054654515 and parameters: {'model_name': 'SimpleImputer', 'strategy': 'most_frequent'}. Best is trial 1 with value: 0.3295559011403175.
[I 2023-12-26 13:25:27,254] Trial 90 finished with value: 0.3670456054654515 and parameters: {'model_name': 'SimpleImputer', 'strategy': 'most_frequent'}. Best is trial 1 with value: 0.3295559011403175.
[I 2023-12-26 13:25:27,552] Trial 79 finished with value: 0.3670456054654515 and parameters: {'model_name': 'SimpleImputer', 'strategy': 'most_frequent'}. Best is trial 1 with value: 0.3295559011403175.
[I 2023-12-26 13:25:27,851] Trial 86 finished with value: 0.3670456054654515 and parameters: {'model_name': 'SimpleImputer', 'strategy': 'most_frequent'}. Best is trial 1 with value: 0.3295559011403175.
[I 2023-12-26 13:25:28,257] Trial 113 finished with value: 0.3295559011403175 and parameters: {'model_name': 'SimpleImputer', 'strategy': 'mean'}. Best is trial 1 with value: 0.3295559011403175.
[I 2023-12-26 13:25:28,773] Trial 89 finished with value: 0.3670456054654515 and parameters: {'model_name': 'SimpleImputer', 'strategy': 'most_frequent'}. Best is trial 1 with value: 0.3295559011403175.
[I 2023-12-26 13:25:29,125] Trial 110 finished with value: 0.3295559011403175 and parameters: {'model_name': 'SimpleImputer', 'strategy': 'mean'}. Best is trial 1 with value: 0.3295559011403175.
[I 2023-12-26 13:25:29,543] Trial 111 finished with value: 0.3295559011403175 and parameters: {'model_name': 'SimpleImputer', 'strategy': 'mean'}. Best is trial 1 with value: 0.3295559011403175.
[I 2023-12-26 13:25:30,127] Trial 114 finished with value: 0.3295559011403175 and parameters: {'model_name': 'SimpleImputer', 'strategy': 'mean'}. Best is trial 1 with value: 0.3295559011403175.
[I 2023-12-26 13:25:30,393] Trial 94 finished with value: 0.3670456054654515 and parameters: {'model_name': 'SimpleImputer', 'strategy': 'most_frequent'}. Best is trial 1 with value: 0.3295559011403175.
