Run: 8
/cm/local/apps/slurm/var/spool/job825103/slurm_script: line 23: /common/ketrong/minconda3/etc/profile.d/conda.sh: No such file or directory
/cm/local/apps/slurm/var/spool/job825103/slurm_script: line 26: $'\nconda create --name tpot2devenv -c conda-forge python=3.10\n': command not found
/cm/local/apps/slurm/var/spool/job825103/slurm_script: line 31: $'\npip install -r requirements.txt\n': command not found
RunStart
2024-04-14 23:46:44.128075: I tensorflow/core/util/port.cc:113] oneDNN custom operations are on. You may see slightly different numerical results due to floating-point round-off errors from different computation orders. To turn them off, set the environment variable `TF_ENABLE_ONEDNN_OPTS=0`.
2024-04-14 23:46:51.004382: E external/local_xla/xla/stream_executor/cuda/cuda_dnn.cc:9261] Unable to register cuDNN factory: Attempting to register factory for plugin cuDNN when one has already been registered
2024-04-14 23:46:51.004539: E external/local_xla/xla/stream_executor/cuda/cuda_fft.cc:607] Unable to register cuFFT factory: Attempting to register factory for plugin cuFFT when one has already been registered
2024-04-14 23:46:51.790790: E external/local_xla/xla/stream_executor/cuda/cuda_blas.cc:1515] Unable to register cuBLAS factory: Attempting to register factory for plugin cuBLAS when one has already been registered
2024-04-14 23:46:53.620190: I tensorflow/core/platform/cpu_feature_guard.cc:182] This TensorFlow binary is optimized to use available CPU instructions in performance-critical operations.
To enable the following instructions: AVX2 AVX512F AVX512_VNNI FMA, in other operations, rebuild TensorFlow with the appropriate compiler flags.
2024-04-14 23:47:17.196108: W tensorflow/compiler/tf2tensorrt/utils/py_utils.cc:38] TF-TRT Warning: Could not find TensorRT
WARNING:tensorflow:From /home/ketrong/miniconda3/envs/tpot2devenv/lib/python3.10/site-packages/tensorflow/python/compat/v2_compat.py:108: disable_resource_variables (from tensorflow.python.ops.variable_scope) is deprecated and will be removed in a future version.
Instructions for updating:
non-resource variables are not supported in the long term
starting loops
working on 
logs/26/tpot2_base_normal_MAR_0.3
4.853289365768433
loading data
logs/26/tpot2_base_normal_MAR_0.3/data/26_True.pkl
[1 1 1 ... 4 4 2]
        0   ...   26
0      0.0  ...  0.0
1      0.0  ...  1.0
2      1.0  ...  1.0
3      1.0  ...  1.0
4      1.0  ...  1.0
...    ...  ...  ...
11659  0.0  ...  1.0
11660  0.0  ...  1.0
11661  0.0  ...  1.0
11662  0.0  ...  1.0
11663  0.0  ...  1.0

[11664 rows x 27 columns]
       0   ...   26
0     0.0  ...  1.0
1     0.0  ...  1.0
2     0.0  ...  1.0
3     0.0  ...  1.0
4     1.0  ...  1.0
...   ...  ...  ...
1291  0.0  ...  1.0
1292  0.0  ...  1.0
1293  0.0  ...  1.0
1294  0.0  ...  1.0
1295  0.0  ...  1.0

[1296 rows x 27 columns]
running experiment 1/3 - Does large hyperparameter space improve reconstruction accuracy over simple
[I 2024-04-14 23:48:05,928] A new study created in memory with name: no-name-63cb8fdb-dcbe-4854-86f3-76f77ac81c6b
[I 2024-04-14 23:48:07,113] Trial 7 finished with value: 0.5096994433352348 and parameters: {'model_name': 'SimpleImputer', 'strategy': 'constant'}. Best is trial 7 with value: 0.5096994433352348.
[I 2024-04-14 23:48:07,856] Trial 8 finished with value: 0.5096994433352348 and parameters: {'model_name': 'SimpleImputer', 'strategy': 'constant'}. Best is trial 7 with value: 0.5096994433352348.
[I 2024-04-14 23:48:08,362] Trial 17 finished with value: 0.5096994433352348 and parameters: {'model_name': 'SimpleImputer', 'strategy': 'constant'}. Best is trial 7 with value: 0.5096994433352348.
[I 2024-04-14 23:48:08,669] Trial 0 finished with value: 0.4162577240416847 and parameters: {'model_name': 'SimpleImputer', 'strategy': 'mean'}. Best is trial 0 with value: 0.4162577240416847.
[I 2024-04-14 23:48:08,840] Trial 12 finished with value: 0.5096994433352348 and parameters: {'model_name': 'SimpleImputer', 'strategy': 'constant'}. Best is trial 0 with value: 0.4162577240416847.
[I 2024-04-14 23:48:09,634] Trial 22 finished with value: 0.5096994433352348 and parameters: {'model_name': 'SimpleImputer', 'strategy': 'constant'}. Best is trial 0 with value: 0.4162577240416847.
[I 2024-04-14 23:48:10,071] Trial 11 finished with value: 0.4162577240416847 and parameters: {'model_name': 'SimpleImputer', 'strategy': 'mean'}. Best is trial 0 with value: 0.4162577240416847.
[I 2024-04-14 23:48:10,298] Trial 37 finished with value: 0.5096994433352348 and parameters: {'model_name': 'SimpleImputer', 'strategy': 'constant'}. Best is trial 0 with value: 0.4162577240416847.
[I 2024-04-14 23:48:10,507] Trial 13 finished with value: 0.4162577240416847 and parameters: {'model_name': 'SimpleImputer', 'strategy': 'mean'}. Best is trial 0 with value: 0.4162577240416847.
[I 2024-04-14 23:48:10,722] Trial 33 finished with value: 0.5096994433352348 and parameters: {'model_name': 'SimpleImputer', 'strategy': 'constant'}. Best is trial 0 with value: 0.4162577240416847.
[I 2024-04-14 23:48:11,049] Trial 21 finished with value: 0.4162577240416847 and parameters: {'model_name': 'SimpleImputer', 'strategy': 'mean'}. Best is trial 0 with value: 0.4162577240416847.
[I 2024-04-14 23:48:11,320] Trial 16 finished with value: 0.4162577240416847 and parameters: {'model_name': 'SimpleImputer', 'strategy': 'mean'}. Best is trial 0 with value: 0.4162577240416847.
[I 2024-04-14 23:48:11,619] Trial 18 finished with value: 0.4162577240416847 and parameters: {'model_name': 'SimpleImputer', 'strategy': 'mean'}. Best is trial 0 with value: 0.4162577240416847.
[I 2024-04-14 23:48:11,881] Trial 9 finished with value: 0.4162577240416847 and parameters: {'model_name': 'SimpleImputer', 'strategy': 'mean'}. Best is trial 0 with value: 0.4162577240416847.
[I 2024-04-14 23:48:12,110] Trial 24 finished with value: 0.4162577240416847 and parameters: {'model_name': 'SimpleImputer', 'strategy': 'mean'}. Best is trial 0 with value: 0.4162577240416847.
[I 2024-04-14 23:48:12,360] Trial 26 finished with value: 0.5096994433352348 and parameters: {'model_name': 'SimpleImputer', 'strategy': 'constant'}. Best is trial 0 with value: 0.4162577240416847.
[I 2024-04-14 23:48:12,700] Trial 43 finished with value: 0.5096994433352348 and parameters: {'model_name': 'SimpleImputer', 'strategy': 'constant'}. Best is trial 0 with value: 0.4162577240416847.
[I 2024-04-14 23:48:12,877] Trial 2 finished with value: 0.4162577240416847 and parameters: {'model_name': 'SimpleImputer', 'strategy': 'mean'}. Best is trial 0 with value: 0.4162577240416847.
[I 2024-04-14 23:48:13,054] Trial 28 finished with value: 0.4162577240416847 and parameters: {'model_name': 'SimpleImputer', 'strategy': 'mean'}. Best is trial 0 with value: 0.4162577240416847.
[I 2024-04-14 23:48:13,546] Trial 30 finished with value: 0.4162577240416847 and parameters: {'model_name': 'SimpleImputer', 'strategy': 'mean'}. Best is trial 0 with value: 0.4162577240416847.
[I 2024-04-14 23:48:13,823] Trial 47 finished with value: 0.5096994433352348 and parameters: {'model_name': 'SimpleImputer', 'strategy': 'constant'}. Best is trial 0 with value: 0.4162577240416847.
[I 2024-04-14 23:48:14,022] Trial 31 finished with value: 0.4162577240416847 and parameters: {'model_name': 'SimpleImputer', 'strategy': 'mean'}. Best is trial 0 with value: 0.4162577240416847.
[I 2024-04-14 23:48:14,300] Trial 34 finished with value: 0.4162577240416847 and parameters: {'model_name': 'SimpleImputer', 'strategy': 'mean'}. Best is trial 0 with value: 0.4162577240416847.
[I 2024-04-14 23:48:14,645] Trial 3 finished with value: 0.5089812918549482 and parameters: {'model_name': 'SimpleImputer', 'strategy': 'median'}. Best is trial 0 with value: 0.4162577240416847.
[I 2024-04-14 23:48:14,969] Trial 48 finished with value: 0.5096994433352348 and parameters: {'model_name': 'SimpleImputer', 'strategy': 'constant'}. Best is trial 0 with value: 0.4162577240416847.
[I 2024-04-14 23:48:15,189] Trial 4 finished with value: 0.5089812918549482 and parameters: {'model_name': 'SimpleImputer', 'strategy': 'median'}. Best is trial 0 with value: 0.4162577240416847.
[I 2024-04-14 23:48:15,424] Trial 39 finished with value: 0.4162577240416847 and parameters: {'model_name': 'SimpleImputer', 'strategy': 'mean'}. Best is trial 0 with value: 0.4162577240416847.
[I 2024-04-14 23:48:15,695] Trial 45 finished with value: 0.5096994433352348 and parameters: {'model_name': 'SimpleImputer', 'strategy': 'constant'}. Best is trial 0 with value: 0.4162577240416847.
[I 2024-04-14 23:48:16,158] Trial 19 finished with value: 0.5089812918549482 and parameters: {'model_name': 'SimpleImputer', 'strategy': 'median'}. Best is trial 0 with value: 0.4162577240416847.
[I 2024-04-14 23:48:16,367] Trial 44 finished with value: 0.4162577240416847 and parameters: {'model_name': 'SimpleImputer', 'strategy': 'mean'}. Best is trial 0 with value: 0.4162577240416847.
[I 2024-04-14 23:48:16,745] Trial 6 finished with value: 0.5089812918549482 and parameters: {'model_name': 'SimpleImputer', 'strategy': 'median'}. Best is trial 0 with value: 0.4162577240416847.
[I 2024-04-14 23:48:17,158] Trial 20 finished with value: 0.5089812918549482 and parameters: {'model_name': 'SimpleImputer', 'strategy': 'median'}. Best is trial 0 with value: 0.4162577240416847.
[I 2024-04-14 23:48:17,378] Trial 49 finished with value: 0.4162577240416847 and parameters: {'model_name': 'SimpleImputer', 'strategy': 'mean'}. Best is trial 0 with value: 0.4162577240416847.
[I 2024-04-14 23:48:17,723] Trial 53 finished with value: 0.5096994433352348 and parameters: {'model_name': 'SimpleImputer', 'strategy': 'constant'}. Best is trial 0 with value: 0.4162577240416847.
[I 2024-04-14 23:48:17,986] Trial 29 finished with value: 0.5089812918549482 and parameters: {'model_name': 'SimpleImputer', 'strategy': 'median'}. Best is trial 0 with value: 0.4162577240416847.
[I 2024-04-14 23:48:18,455] Trial 38 finished with value: 0.5089812918549482 and parameters: {'model_name': 'SimpleImputer', 'strategy': 'median'}. Best is trial 0 with value: 0.4162577240416847.
[I 2024-04-14 23:48:18,813] Trial 52 finished with value: 0.4162577240416847 and parameters: {'model_name': 'SimpleImputer', 'strategy': 'mean'}. Best is trial 0 with value: 0.4162577240416847.
[I 2024-04-14 23:48:19,088] Trial 54 finished with value: 0.4162577240416847 and parameters: {'model_name': 'SimpleImputer', 'strategy': 'mean'}. Best is trial 0 with value: 0.4162577240416847.
[I 2024-04-14 23:48:19,503] Trial 42 finished with value: 0.5089812918549482 and parameters: {'model_name': 'SimpleImputer', 'strategy': 'median'}. Best is trial 0 with value: 0.4162577240416847.
[I 2024-04-14 23:48:19,741] Trial 41 finished with value: 0.5089812918549482 and parameters: {'model_name': 'SimpleImputer', 'strategy': 'median'}. Best is trial 0 with value: 0.4162577240416847.
[I 2024-04-14 23:48:20,415] Trial 50 finished with value: 0.5089812918549482 and parameters: {'model_name': 'SimpleImputer', 'strategy': 'median'}. Best is trial 0 with value: 0.4162577240416847.
[I 2024-04-14 23:48:21,365] Trial 57 finished with value: 0.5089812918549482 and parameters: {'model_name': 'SimpleImputer', 'strategy': 'median'}. Best is trial 0 with value: 0.4162577240416847.
[I 2024-04-14 23:48:21,732] Trial 51 finished with value: 0.5089812918549482 and parameters: {'model_name': 'SimpleImputer', 'strategy': 'median'}. Best is trial 0 with value: 0.4162577240416847.
[I 2024-04-14 23:48:22,150] Trial 59 finished with value: 0.5089812918549482 and parameters: {'model_name': 'SimpleImputer', 'strategy': 'median'}. Best is trial 0 with value: 0.4162577240416847.
[I 2024-04-14 23:48:22,515] Trial 58 finished with value: 0.5089812918549482 and parameters: {'model_name': 'SimpleImputer', 'strategy': 'median'}. Best is trial 0 with value: 0.4162577240416847.
[I 2024-04-14 23:48:22,834] Trial 64 finished with value: 0.5089812918549482 and parameters: {'model_name': 'SimpleImputer', 'strategy': 'median'}. Best is trial 0 with value: 0.4162577240416847.
[I 2024-04-14 23:48:23,070] Trial 61 finished with value: 0.5089812918549482 and parameters: {'model_name': 'SimpleImputer', 'strategy': 'median'}. Best is trial 0 with value: 0.4162577240416847.
[I 2024-04-14 23:48:23,539] Trial 66 finished with value: 0.5089812918549482 and parameters: {'model_name': 'SimpleImputer', 'strategy': 'median'}. Best is trial 0 with value: 0.4162577240416847.
[I 2024-04-14 23:48:23,951] Trial 67 finished with value: 0.5089812918549482 and parameters: {'model_name': 'SimpleImputer', 'strategy': 'median'}. Best is trial 0 with value: 0.4162577240416847.
[I 2024-04-14 23:48:24,495] Trial 69 finished with value: 0.5089812918549482 and parameters: {'model_name': 'SimpleImputer', 'strategy': 'median'}. Best is trial 0 with value: 0.4162577240416847.
[I 2024-04-14 23:48:28,643] Trial 10 finished with value: 0.5089812918549482 and parameters: {'model_name': 'SimpleImputer', 'strategy': 'most_frequent'}. Best is trial 0 with value: 0.4162577240416847.
[I 2024-04-14 23:48:29,643] Trial 14 finished with value: 0.5089812918549482 and parameters: {'model_name': 'SimpleImputer', 'strategy': 'most_frequent'}. Best is trial 0 with value: 0.4162577240416847.
[I 2024-04-14 23:48:29,883] Trial 15 finished with value: 0.5089812918549482 and parameters: {'model_name': 'SimpleImputer', 'strategy': 'most_frequent'}. Best is trial 0 with value: 0.4162577240416847.
[I 2024-04-14 23:48:30,345] Trial 1 finished with value: 0.5089812918549482 and parameters: {'model_name': 'SimpleImputer', 'strategy': 'most_frequent'}. Best is trial 0 with value: 0.4162577240416847.
[I 2024-04-14 23:48:30,622] Trial 5 finished with value: 0.5089812918549482 and parameters: {'model_name': 'SimpleImputer', 'strategy': 'most_frequent'}. Best is trial 0 with value: 0.4162577240416847.
[I 2024-04-14 23:48:30,834] Trial 27 finished with value: 0.5089812918549482 and parameters: {'model_name': 'SimpleImputer', 'strategy': 'most_frequent'}. Best is trial 0 with value: 0.4162577240416847.
[I 2024-04-14 23:48:31,568] Trial 35 finished with value: 0.5089812918549482 and parameters: {'model_name': 'SimpleImputer', 'strategy': 'most_frequent'}. Best is trial 0 with value: 0.4162577240416847.
[I 2024-04-14 23:48:31,809] Trial 23 finished with value: 0.5089812918549482 and parameters: {'model_name': 'SimpleImputer', 'strategy': 'most_frequent'}. Best is trial 0 with value: 0.4162577240416847.
[I 2024-04-14 23:48:31,970] Trial 46 finished with value: 0.5089812918549482 and parameters: {'model_name': 'SimpleImputer', 'strategy': 'most_frequent'}. Best is trial 0 with value: 0.4162577240416847.
[I 2024-04-14 23:48:32,254] Trial 36 finished with value: 0.5089812918549482 and parameters: {'model_name': 'SimpleImputer', 'strategy': 'most_frequent'}. Best is trial 0 with value: 0.4162577240416847.
[I 2024-04-14 23:48:32,681] Trial 25 finished with value: 0.5089812918549482 and parameters: {'model_name': 'SimpleImputer', 'strategy': 'most_frequent'}. Best is trial 0 with value: 0.4162577240416847.
[I 2024-04-14 23:48:34,162] Trial 62 finished with value: 0.5089812918549482 and parameters: {'model_name': 'SimpleImputer', 'strategy': 'most_frequent'}. Best is trial 0 with value: 0.4162577240416847.
[I 2024-04-14 23:48:34,409] Trial 40 finished with value: 0.5089812918549482 and parameters: {'model_name': 'SimpleImputer', 'strategy': 'most_frequent'}. Best is trial 0 with value: 0.4162577240416847.
[I 2024-04-14 23:48:35,069] Trial 72 finished with value: 0.5089812918549482 and parameters: {'model_name': 'SimpleImputer', 'strategy': 'most_frequent'}. Best is trial 0 with value: 0.4162577240416847.
[I 2024-04-14 23:48:35,260] Trial 32 finished with value: 0.5089812918549482 and parameters: {'model_name': 'SimpleImputer', 'strategy': 'most_frequent'}. Best is trial 0 with value: 0.4162577240416847.
[I 2024-04-14 23:48:35,683] Trial 55 finished with value: 0.5089812918549482 and parameters: {'model_name': 'SimpleImputer', 'strategy': 'most_frequent'}. Best is trial 0 with value: 0.4162577240416847.
[I 2024-04-14 23:48:36,019] Trial 56 finished with value: 0.5089812918549482 and parameters: {'model_name': 'SimpleImputer', 'strategy': 'most_frequent'}. Best is trial 0 with value: 0.4162577240416847.
[I 2024-04-14 23:48:36,348] Trial 101 finished with value: 0.4162577240416847 and parameters: {'model_name': 'SimpleImputer', 'strategy': 'mean'}. Best is trial 0 with value: 0.4162577240416847.
[I 2024-04-14 23:48:36,598] Trial 100 finished with value: 0.4162577240416847 and parameters: {'model_name': 'SimpleImputer', 'strategy': 'mean'}. Best is trial 0 with value: 0.4162577240416847.
[I 2024-04-14 23:48:36,864] Trial 60 finished with value: 0.5089812918549482 and parameters: {'model_name': 'SimpleImputer', 'strategy': 'most_frequent'}. Best is trial 0 with value: 0.4162577240416847.
[I 2024-04-14 23:48:37,229] Trial 65 finished with value: 0.5089812918549482 and parameters: {'model_name': 'SimpleImputer', 'strategy': 'most_frequent'}. Best is trial 0 with value: 0.4162577240416847.
[I 2024-04-14 23:48:37,482] Trial 103 finished with value: 0.4162577240416847 and parameters: {'model_name': 'SimpleImputer', 'strategy': 'mean'}. Best is trial 0 with value: 0.4162577240416847.
[I 2024-04-14 23:48:37,949] Trial 68 finished with value: 0.5089812918549482 and parameters: {'model_name': 'SimpleImputer', 'strategy': 'most_frequent'}. Best is trial 0 with value: 0.4162577240416847.
[I 2024-04-14 23:48:38,259] Trial 102 finished with value: 0.4162577240416847 and parameters: {'model_name': 'SimpleImputer', 'strategy': 'mean'}. Best is trial 0 with value: 0.4162577240416847.
[I 2024-04-14 23:48:38,486] Trial 104 finished with value: 0.4162577240416847 and parameters: {'model_name': 'SimpleImputer', 'strategy': 'mean'}. Best is trial 0 with value: 0.4162577240416847.
[I 2024-04-14 23:48:38,701] Trial 105 finished with value: 0.4162577240416847 and parameters: {'model_name': 'SimpleImputer', 'strategy': 'mean'}. Best is trial 0 with value: 0.4162577240416847.
[I 2024-04-14 23:48:38,931] Trial 107 finished with value: 0.4162577240416847 and parameters: {'model_name': 'SimpleImputer', 'strategy': 'mean'}. Best is trial 0 with value: 0.4162577240416847.
[I 2024-04-14 23:48:39,243] Trial 75 finished with value: 0.5089812918549482 and parameters: {'model_name': 'SimpleImputer', 'strategy': 'most_frequent'}. Best is trial 0 with value: 0.4162577240416847.
[I 2024-04-14 23:48:39,514] Trial 106 finished with value: 0.4162577240416847 and parameters: {'model_name': 'SimpleImputer', 'strategy': 'mean'}. Best is trial 0 with value: 0.4162577240416847.
[I 2024-04-14 23:48:39,752] Trial 73 finished with value: 0.5089812918549482 and parameters: {'model_name': 'SimpleImputer', 'strategy': 'most_frequent'}. Best is trial 0 with value: 0.4162577240416847.
[I 2024-04-14 23:48:40,012] Trial 71 finished with value: 0.5089812918549482 and parameters: {'model_name': 'SimpleImputer', 'strategy': 'most_frequent'}. Best is trial 0 with value: 0.4162577240416847.
[I 2024-04-14 23:48:40,215] Trial 108 finished with value: 0.4162577240416847 and parameters: {'model_name': 'SimpleImputer', 'strategy': 'mean'}. Best is trial 0 with value: 0.4162577240416847.
[I 2024-04-14 23:48:40,500] Trial 76 finished with value: 0.5089812918549482 and parameters: {'model_name': 'SimpleImputer', 'strategy': 'most_frequent'}. Best is trial 0 with value: 0.4162577240416847.
[I 2024-04-14 23:48:40,762] Trial 82 finished with value: 0.5089812918549482 and parameters: {'model_name': 'SimpleImputer', 'strategy': 'most_frequent'}. Best is trial 0 with value: 0.4162577240416847.
[I 2024-04-14 23:48:41,017] Trial 70 finished with value: 0.5089812918549482 and parameters: {'model_name': 'SimpleImputer', 'strategy': 'most_frequent'}. Best is trial 0 with value: 0.4162577240416847.
[I 2024-04-14 23:48:41,503] Trial 77 finished with value: 0.5089812918549482 and parameters: {'model_name': 'SimpleImputer', 'strategy': 'most_frequent'}. Best is trial 0 with value: 0.4162577240416847.
[I 2024-04-14 23:48:41,898] Trial 74 finished with value: 0.5089812918549482 and parameters: {'model_name': 'SimpleImputer', 'strategy': 'most_frequent'}. Best is trial 0 with value: 0.4162577240416847.
[I 2024-04-14 23:48:42,250] Trial 81 finished with value: 0.5089812918549482 and parameters: {'model_name': 'SimpleImputer', 'strategy': 'most_frequent'}. Best is trial 0 with value: 0.4162577240416847.
[I 2024-04-14 23:48:42,667] Trial 80 finished with value: 0.5089812918549482 and parameters: {'model_name': 'SimpleImputer', 'strategy': 'most_frequent'}. Best is trial 0 with value: 0.4162577240416847.
[I 2024-04-14 23:48:42,895] Trial 109 finished with value: 0.4162577240416847 and parameters: {'model_name': 'SimpleImputer', 'strategy': 'mean'}. Best is trial 0 with value: 0.4162577240416847.
[I 2024-04-14 23:48:43,124] Trial 84 finished with value: 0.5089812918549482 and parameters: {'model_name': 'SimpleImputer', 'strategy': 'most_frequent'}. Best is trial 0 with value: 0.4162577240416847.
[I 2024-04-14 23:48:43,490] Trial 85 finished with value: 0.5089812918549482 and parameters: {'model_name': 'SimpleImputer', 'strategy': 'most_frequent'}. Best is trial 0 with value: 0.4162577240416847.
[I 2024-04-14 23:48:43,694] Trial 63 finished with value: 0.5089812918549482 and parameters: {'model_name': 'SimpleImputer', 'strategy': 'most_frequent'}. Best is trial 0 with value: 0.4162577240416847.
[I 2024-04-14 23:48:43,967] Trial 111 finished with value: 0.4162577240416847 and parameters: {'model_name': 'SimpleImputer', 'strategy': 'mean'}. Best is trial 0 with value: 0.4162577240416847.
[I 2024-04-14 23:48:44,256] Trial 86 finished with value: 0.5089812918549482 and parameters: {'model_name': 'SimpleImputer', 'strategy': 'most_frequent'}. Best is trial 0 with value: 0.4162577240416847.
