Run: 6
/cm/local/apps/slurm/var/spool/job577179/slurm_script: line 23: /common/ketrong/minconda3/etc/profile.d/conda.sh: No such file or directory
/cm/local/apps/slurm/var/spool/job577179/slurm_script: line 26: $'\nconda create --name tpot2devenv -c conda-forge python=3.10\n': command not found
/cm/local/apps/slurm/var/spool/job577179/slurm_script: line 31: $'\npip install -r requirements.txt\n': command not found
RunStart
2024-01-04 22:53:50.019660: I tensorflow/core/util/port.cc:113] oneDNN custom operations are on. You may see slightly different numerical results due to floating-point round-off errors from different computation orders. To turn them off, set the environment variable `TF_ENABLE_ONEDNN_OPTS=0`.
2024-01-04 22:53:50.056828: E external/local_xla/xla/stream_executor/cuda/cuda_dnn.cc:9261] Unable to register cuDNN factory: Attempting to register factory for plugin cuDNN when one has already been registered
2024-01-04 22:53:50.056853: E external/local_xla/xla/stream_executor/cuda/cuda_fft.cc:607] Unable to register cuFFT factory: Attempting to register factory for plugin cuFFT when one has already been registered
2024-01-04 22:53:50.058238: E external/local_xla/xla/stream_executor/cuda/cuda_blas.cc:1515] Unable to register cuBLAS factory: Attempting to register factory for plugin cuBLAS when one has already been registered
2024-01-04 22:53:50.064386: I tensorflow/core/platform/cpu_feature_guard.cc:182] This TensorFlow binary is optimized to use available CPU instructions in performance-critical operations.
To enable the following instructions: AVX2 AVX512F AVX512_VNNI FMA, in other operations, rebuild TensorFlow with the appropriate compiler flags.
2024-01-04 22:53:53.222766: W tensorflow/compiler/tf2tensorrt/utils/py_utils.cc:38] TF-TRT Warning: Could not find TensorRT
WARNING:tensorflow:From /home/ketrong/miniconda3/envs/tpot2devenv/lib/python3.10/site-packages/tensorflow/python/compat/v2_compat.py:108: disable_resource_variables (from tensorflow.python.ops.variable_scope) is deprecated and will be removed in a future version.
Instructions for updating:
non-resource variables are not supported in the long term
starting loops
working on 
logs/9983/tpot2_base_normal_MAR_0.01
3.910780429840088
loading data
logs/9983/tpot2_base_normal_MAR_0.01/data/9983_True.pkl
running experiment 1/3 - Does large hyperparameter space improve reconstruction accuracy over simple
[I 2024-01-04 22:54:10,946] A new study created in memory with name: no-name-db6ad294-cff4-4f62-a229-98ff0b2d5e3a
[I 2024-01-04 22:54:12,079] Trial 10 finished with value: 4351.102398221441 and parameters: {'model_name': 'SimpleImputer', 'strategy': 'constant'}. Best is trial 10 with value: 4351.102398221441.
[I 2024-01-04 22:54:12,376] Trial 6 finished with value: 4351.102398221441 and parameters: {'model_name': 'SimpleImputer', 'strategy': 'constant'}. Best is trial 10 with value: 4351.102398221441.
[I 2024-01-04 22:54:12,845] Trial 11 finished with value: 4351.102398221441 and parameters: {'model_name': 'SimpleImputer', 'strategy': 'constant'}. Best is trial 10 with value: 4351.102398221441.
[I 2024-01-04 22:54:13,057] Trial 18 finished with value: 4351.102398221441 and parameters: {'model_name': 'SimpleImputer', 'strategy': 'constant'}. Best is trial 10 with value: 4351.102398221441.
[I 2024-01-04 22:54:13,333] Trial 19 finished with value: 4351.102398221441 and parameters: {'model_name': 'SimpleImputer', 'strategy': 'constant'}. Best is trial 10 with value: 4351.102398221441.
[I 2024-01-04 22:54:13,549] Trial 2 finished with value: 63.376948276324015 and parameters: {'model_name': 'SimpleImputer', 'strategy': 'mean'}. Best is trial 2 with value: 63.376948276324015.
[I 2024-01-04 22:54:13,867] Trial 21 finished with value: 4351.102398221441 and parameters: {'model_name': 'SimpleImputer', 'strategy': 'constant'}. Best is trial 2 with value: 63.376948276324015.
[I 2024-01-04 22:54:14,124] Trial 3 finished with value: 63.376948276324015 and parameters: {'model_name': 'SimpleImputer', 'strategy': 'mean'}. Best is trial 2 with value: 63.376948276324015.
[I 2024-01-04 22:54:14,643] Trial 43 finished with value: 4351.102398221441 and parameters: {'model_name': 'SimpleImputer', 'strategy': 'constant'}. Best is trial 2 with value: 63.376948276324015.
[I 2024-01-04 22:54:15,010] Trial 4 finished with value: 50.82902870259025 and parameters: {'model_name': 'SimpleImputer', 'strategy': 'median'}. Best is trial 4 with value: 50.82902870259025.
[I 2024-01-04 22:54:15,258] Trial 34 finished with value: 63.376948276324015 and parameters: {'model_name': 'SimpleImputer', 'strategy': 'mean'}. Best is trial 4 with value: 50.82902870259025.
[I 2024-01-04 22:54:15,521] Trial 26 finished with value: 63.376948276324015 and parameters: {'model_name': 'SimpleImputer', 'strategy': 'mean'}. Best is trial 4 with value: 50.82902870259025.
[I 2024-01-04 22:54:15,884] Trial 23 finished with value: 63.376948276324015 and parameters: {'model_name': 'SimpleImputer', 'strategy': 'mean'}. Best is trial 4 with value: 50.82902870259025.
[I 2024-01-04 22:54:16,151] Trial 28 finished with value: 63.376948276324015 and parameters: {'model_name': 'SimpleImputer', 'strategy': 'mean'}. Best is trial 4 with value: 50.82902870259025.
[I 2024-01-04 22:54:16,413] Trial 31 finished with value: 63.376948276324015 and parameters: {'model_name': 'SimpleImputer', 'strategy': 'mean'}. Best is trial 4 with value: 50.82902870259025.
[I 2024-01-04 22:54:16,637] Trial 47 finished with value: 63.376948276324015 and parameters: {'model_name': 'SimpleImputer', 'strategy': 'mean'}. Best is trial 4 with value: 50.82902870259025.
[I 2024-01-04 22:54:16,921] Trial 0 finished with value: 50.82902870259025 and parameters: {'model_name': 'SimpleImputer', 'strategy': 'median'}. Best is trial 4 with value: 50.82902870259025.
[I 2024-01-04 22:54:17,237] Trial 5 finished with value: 50.82902870259025 and parameters: {'model_name': 'SimpleImputer', 'strategy': 'median'}. Best is trial 4 with value: 50.82902870259025.
[I 2024-01-04 22:54:17,469] Trial 39 finished with value: 63.376948276324015 and parameters: {'model_name': 'SimpleImputer', 'strategy': 'mean'}. Best is trial 4 with value: 50.82902870259025.
[I 2024-01-04 22:54:17,787] Trial 20 finished with value: 50.82902870259025 and parameters: {'model_name': 'SimpleImputer', 'strategy': 'median'}. Best is trial 4 with value: 50.82902870259025.
[I 2024-01-04 22:54:18,078] Trial 46 finished with value: 63.376948276324015 and parameters: {'model_name': 'SimpleImputer', 'strategy': 'mean'}. Best is trial 4 with value: 50.82902870259025.
[I 2024-01-04 22:54:18,339] Trial 29 finished with value: 63.376948276324015 and parameters: {'model_name': 'SimpleImputer', 'strategy': 'mean'}. Best is trial 4 with value: 50.82902870259025.
[I 2024-01-04 22:54:18,640] Trial 9 finished with value: 50.82902870259025 and parameters: {'model_name': 'SimpleImputer', 'strategy': 'median'}. Best is trial 4 with value: 50.82902870259025.
[I 2024-01-04 22:54:18,918] Trial 14 finished with value: 50.82902870259025 and parameters: {'model_name': 'SimpleImputer', 'strategy': 'median'}. Best is trial 4 with value: 50.82902870259025.
[I 2024-01-04 22:54:19,141] Trial 52 finished with value: 4351.102398221441 and parameters: {'model_name': 'SimpleImputer', 'strategy': 'constant'}. Best is trial 4 with value: 50.82902870259025.
[I 2024-01-04 22:54:19,334] Trial 8 finished with value: 50.82902870259025 and parameters: {'model_name': 'SimpleImputer', 'strategy': 'median'}. Best is trial 4 with value: 50.82902870259025.
[I 2024-01-04 22:54:19,544] Trial 49 finished with value: 4351.102398221441 and parameters: {'model_name': 'SimpleImputer', 'strategy': 'constant'}. Best is trial 4 with value: 50.82902870259025.
[I 2024-01-04 22:54:19,910] Trial 7 finished with value: 50.82902870259025 and parameters: {'model_name': 'SimpleImputer', 'strategy': 'median'}. Best is trial 4 with value: 50.82902870259025.
[I 2024-01-04 22:54:20,242] Trial 48 finished with value: 63.376948276324015 and parameters: {'model_name': 'SimpleImputer', 'strategy': 'mean'}. Best is trial 4 with value: 50.82902870259025.
[I 2024-01-04 22:54:20,595] Trial 13 finished with value: 50.82902870259025 and parameters: {'model_name': 'SimpleImputer', 'strategy': 'median'}. Best is trial 4 with value: 50.82902870259025.
[I 2024-01-04 22:54:20,862] Trial 37 finished with value: 50.82902870259025 and parameters: {'model_name': 'SimpleImputer', 'strategy': 'median'}. Best is trial 4 with value: 50.82902870259025.
[I 2024-01-04 22:54:21,171] Trial 15 finished with value: 50.82902870259025 and parameters: {'model_name': 'SimpleImputer', 'strategy': 'median'}. Best is trial 4 with value: 50.82902870259025.
[I 2024-01-04 22:54:21,438] Trial 53 finished with value: 63.376948276324015 and parameters: {'model_name': 'SimpleImputer', 'strategy': 'mean'}. Best is trial 4 with value: 50.82902870259025.
[I 2024-01-04 22:54:21,811] Trial 16 finished with value: 50.82902870259025 and parameters: {'model_name': 'SimpleImputer', 'strategy': 'median'}. Best is trial 4 with value: 50.82902870259025.
[I 2024-01-04 22:54:22,033] Trial 44 finished with value: 50.82902870259025 and parameters: {'model_name': 'SimpleImputer', 'strategy': 'median'}. Best is trial 4 with value: 50.82902870259025.
[I 2024-01-04 22:54:22,303] Trial 30 finished with value: 50.82902870259025 and parameters: {'model_name': 'SimpleImputer', 'strategy': 'median'}. Best is trial 4 with value: 50.82902870259025.
[I 2024-01-04 22:54:22,531] Trial 45 finished with value: 50.82902870259025 and parameters: {'model_name': 'SimpleImputer', 'strategy': 'median'}. Best is trial 4 with value: 50.82902870259025.
[I 2024-01-04 22:54:22,785] Trial 40 finished with value: 50.82902870259025 and parameters: {'model_name': 'SimpleImputer', 'strategy': 'median'}. Best is trial 4 with value: 50.82902870259025.
[I 2024-01-04 22:54:23,071] Trial 36 finished with value: 50.82902870259025 and parameters: {'model_name': 'SimpleImputer', 'strategy': 'median'}. Best is trial 4 with value: 50.82902870259025.
[I 2024-01-04 22:54:24,300] Trial 50 finished with value: 50.82902870259025 and parameters: {'model_name': 'SimpleImputer', 'strategy': 'median'}. Best is trial 4 with value: 50.82902870259025.
[I 2024-01-04 22:54:24,801] Trial 59 finished with value: 50.82902870259025 and parameters: {'model_name': 'SimpleImputer', 'strategy': 'median'}. Best is trial 4 with value: 50.82902870259025.
[I 2024-01-04 22:54:25,383] Trial 62 finished with value: 50.82902870259025 and parameters: {'model_name': 'SimpleImputer', 'strategy': 'median'}. Best is trial 4 with value: 50.82902870259025.
[I 2024-01-04 22:54:25,620] Trial 57 finished with value: 50.82902870259025 and parameters: {'model_name': 'SimpleImputer', 'strategy': 'median'}. Best is trial 4 with value: 50.82902870259025.
[I 2024-01-04 22:54:25,824] Trial 64 finished with value: 50.82902870259025 and parameters: {'model_name': 'SimpleImputer', 'strategy': 'median'}. Best is trial 4 with value: 50.82902870259025.
[I 2024-01-04 22:54:26,027] Trial 66 finished with value: 50.82902870259025 and parameters: {'model_name': 'SimpleImputer', 'strategy': 'median'}. Best is trial 4 with value: 50.82902870259025.
[I 2024-01-04 22:54:26,233] Trial 61 finished with value: 50.82902870259025 and parameters: {'model_name': 'SimpleImputer', 'strategy': 'median'}. Best is trial 4 with value: 50.82902870259025.
[I 2024-01-04 22:54:26,478] Trial 58 finished with value: 50.82902870259025 and parameters: {'model_name': 'SimpleImputer', 'strategy': 'median'}. Best is trial 4 with value: 50.82902870259025.
[I 2024-01-04 22:54:26,803] Trial 56 finished with value: 50.82902870259025 and parameters: {'model_name': 'SimpleImputer', 'strategy': 'median'}. Best is trial 4 with value: 50.82902870259025.
[I 2024-01-04 22:54:27,101] Trial 63 finished with value: 50.82902870259025 and parameters: {'model_name': 'SimpleImputer', 'strategy': 'median'}. Best is trial 4 with value: 50.82902870259025.
[I 2024-01-04 22:54:27,423] Trial 60 finished with value: 50.82902870259025 and parameters: {'model_name': 'SimpleImputer', 'strategy': 'median'}. Best is trial 4 with value: 50.82902870259025.
[I 2024-01-04 22:54:27,637] Trial 65 finished with value: 50.82902870259025 and parameters: {'model_name': 'SimpleImputer', 'strategy': 'median'}. Best is trial 4 with value: 50.82902870259025.
[I 2024-01-04 22:54:27,858] Trial 12 finished with value: 51.12108757968804 and parameters: {'model_name': 'SimpleImputer', 'strategy': 'most_frequent'}. Best is trial 4 with value: 50.82902870259025.
[I 2024-01-04 22:54:28,260] Trial 68 finished with value: 50.82902870259025 and parameters: {'model_name': 'SimpleImputer', 'strategy': 'median'}. Best is trial 4 with value: 50.82902870259025.
[I 2024-01-04 22:54:28,607] Trial 69 finished with value: 50.82902870259025 and parameters: {'model_name': 'SimpleImputer', 'strategy': 'median'}. Best is trial 4 with value: 50.82902870259025.
[I 2024-01-04 22:54:29,006] Trial 17 finished with value: 51.12108757968804 and parameters: {'model_name': 'SimpleImputer', 'strategy': 'most_frequent'}. Best is trial 4 with value: 50.82902870259025.
[I 2024-01-04 22:54:29,213] Trial 70 finished with value: 50.82902870259025 and parameters: {'model_name': 'SimpleImputer', 'strategy': 'median'}. Best is trial 4 with value: 50.82902870259025.
[I 2024-01-04 22:54:29,889] Trial 82 finished with value: 50.82902870259025 and parameters: {'model_name': 'SimpleImputer', 'strategy': 'median'}. Best is trial 4 with value: 50.82902870259025.
[I 2024-01-04 22:54:30,147] Trial 79 finished with value: 50.82902870259025 and parameters: {'model_name': 'SimpleImputer', 'strategy': 'median'}. Best is trial 4 with value: 50.82902870259025.
[I 2024-01-04 22:54:30,628] Trial 22 finished with value: 51.12108757968804 and parameters: {'model_name': 'SimpleImputer', 'strategy': 'most_frequent'}. Best is trial 4 with value: 50.82902870259025.
[I 2024-01-04 22:54:31,110] Trial 1 finished with value: 51.12108757968804 and parameters: {'model_name': 'SimpleImputer', 'strategy': 'most_frequent'}. Best is trial 4 with value: 50.82902870259025.
[I 2024-01-04 22:54:31,423] Trial 27 finished with value: 51.12108757968804 and parameters: {'model_name': 'SimpleImputer', 'strategy': 'most_frequent'}. Best is trial 4 with value: 50.82902870259025.
[I 2024-01-04 22:54:31,702] Trial 38 finished with value: 51.12108757968804 and parameters: {'model_name': 'SimpleImputer', 'strategy': 'most_frequent'}. Best is trial 4 with value: 50.82902870259025.
[I 2024-01-04 22:54:31,911] Trial 24 finished with value: 51.12108757968804 and parameters: {'model_name': 'SimpleImputer', 'strategy': 'most_frequent'}. Best is trial 4 with value: 50.82902870259025.
[I 2024-01-04 22:54:32,240] Trial 42 finished with value: 51.12108757968804 and parameters: {'model_name': 'SimpleImputer', 'strategy': 'most_frequent'}. Best is trial 4 with value: 50.82902870259025.
[I 2024-01-04 22:54:32,490] Trial 33 finished with value: 51.12108757968804 and parameters: {'model_name': 'SimpleImputer', 'strategy': 'most_frequent'}. Best is trial 4 with value: 50.82902870259025.
[I 2024-01-04 22:54:32,719] Trial 41 finished with value: 51.12108757968804 and parameters: {'model_name': 'SimpleImputer', 'strategy': 'most_frequent'}. Best is trial 4 with value: 50.82902870259025.
[I 2024-01-04 22:54:33,049] Trial 32 finished with value: 51.12108757968804 and parameters: {'model_name': 'SimpleImputer', 'strategy': 'most_frequent'}. Best is trial 4 with value: 50.82902870259025.
[I 2024-01-04 22:54:33,323] Trial 25 finished with value: 51.12108757968804 and parameters: {'model_name': 'SimpleImputer', 'strategy': 'most_frequent'}. Best is trial 4 with value: 50.82902870259025.
[I 2024-01-04 22:54:34,187] Trial 35 finished with value: 51.12108757968804 and parameters: {'model_name': 'SimpleImputer', 'strategy': 'most_frequent'}. Best is trial 4 with value: 50.82902870259025.
[I 2024-01-04 22:54:35,027] Trial 55 finished with value: 51.12108757968804 and parameters: {'model_name': 'SimpleImputer', 'strategy': 'most_frequent'}. Best is trial 4 with value: 50.82902870259025.
[I 2024-01-04 22:54:35,353] Trial 51 finished with value: 51.12108757968804 and parameters: {'model_name': 'SimpleImputer', 'strategy': 'most_frequent'}. Best is trial 4 with value: 50.82902870259025.
[I 2024-01-04 22:54:36,093] Trial 71 finished with value: 51.12108757968804 and parameters: {'model_name': 'SimpleImputer', 'strategy': 'most_frequent'}. Best is trial 4 with value: 50.82902870259025.
[I 2024-01-04 22:54:36,458] Trial 54 finished with value: 51.12108757968804 and parameters: {'model_name': 'SimpleImputer', 'strategy': 'most_frequent'}. Best is trial 4 with value: 50.82902870259025.
[I 2024-01-04 22:54:36,762] Trial 105 finished with value: 50.82902870259025 and parameters: {'model_name': 'SimpleImputer', 'strategy': 'median'}. Best is trial 4 with value: 50.82902870259025.
[I 2024-01-04 22:54:37,005] Trial 75 finished with value: 51.12108757968804 and parameters: {'model_name': 'SimpleImputer', 'strategy': 'most_frequent'}. Best is trial 4 with value: 50.82902870259025.
[I 2024-01-04 22:54:37,675] Trial 104 finished with value: 50.82902870259025 and parameters: {'model_name': 'SimpleImputer', 'strategy': 'median'}. Best is trial 4 with value: 50.82902870259025.
[I 2024-01-04 22:54:37,902] Trial 74 finished with value: 51.12108757968804 and parameters: {'model_name': 'SimpleImputer', 'strategy': 'most_frequent'}. Best is trial 4 with value: 50.82902870259025.
[I 2024-01-04 22:54:38,177] Trial 72 finished with value: 51.12108757968804 and parameters: {'model_name': 'SimpleImputer', 'strategy': 'most_frequent'}. Best is trial 4 with value: 50.82902870259025.
[I 2024-01-04 22:54:38,495] Trial 111 finished with value: 50.82902870259025 and parameters: {'model_name': 'SimpleImputer', 'strategy': 'median'}. Best is trial 4 with value: 50.82902870259025.
[I 2024-01-04 22:54:38,779] Trial 76 finished with value: 51.12108757968804 and parameters: {'model_name': 'SimpleImputer', 'strategy': 'most_frequent'}. Best is trial 4 with value: 50.82902870259025.
[I 2024-01-04 22:54:39,102] Trial 115 finished with value: 50.82902870259025 and parameters: {'model_name': 'SimpleImputer', 'strategy': 'median'}. Best is trial 4 with value: 50.82902870259025.
[I 2024-01-04 22:54:39,343] Trial 109 finished with value: 50.82902870259025 and parameters: {'model_name': 'SimpleImputer', 'strategy': 'median'}. Best is trial 4 with value: 50.82902870259025.
[I 2024-01-04 22:54:39,678] Trial 73 finished with value: 51.12108757968804 and parameters: {'model_name': 'SimpleImputer', 'strategy': 'most_frequent'}. Best is trial 4 with value: 50.82902870259025.
[I 2024-01-04 22:54:39,884] Trial 80 finished with value: 51.12108757968804 and parameters: {'model_name': 'SimpleImputer', 'strategy': 'most_frequent'}. Best is trial 4 with value: 50.82902870259025.
[I 2024-01-04 22:54:40,129] Trial 110 finished with value: 50.82902870259025 and parameters: {'model_name': 'SimpleImputer', 'strategy': 'median'}. Best is trial 4 with value: 50.82902870259025.
[I 2024-01-04 22:54:40,450] Trial 67 finished with value: 51.12108757968804 and parameters: {'model_name': 'SimpleImputer', 'strategy': 'most_frequent'}. Best is trial 4 with value: 50.82902870259025.
[I 2024-01-04 22:54:40,668] Trial 112 finished with value: 50.82902870259025 and parameters: {'model_name': 'SimpleImputer', 'strategy': 'median'}. Best is trial 4 with value: 50.82902870259025.
[I 2024-01-04 22:54:40,860] Trial 113 finished with value: 50.82902870259025 and parameters: {'model_name': 'SimpleImputer', 'strategy': 'median'}. Best is trial 4 with value: 50.82902870259025.
[I 2024-01-04 22:54:41,162] Trial 114 finished with value: 50.82902870259025 and parameters: {'model_name': 'SimpleImputer', 'strategy': 'median'}. Best is trial 4 with value: 50.82902870259025.
[I 2024-01-04 22:54:41,362] Trial 78 finished with value: 51.12108757968804 and parameters: {'model_name': 'SimpleImputer', 'strategy': 'most_frequent'}. Best is trial 4 with value: 50.82902870259025.
[I 2024-01-04 22:54:41,655] Trial 77 finished with value: 51.12108757968804 and parameters: {'model_name': 'SimpleImputer', 'strategy': 'most_frequent'}. Best is trial 4 with value: 50.82902870259025.
[I 2024-01-04 22:54:41,888] Trial 86 finished with value: 51.12108757968804 and parameters: {'model_name': 'SimpleImputer', 'strategy': 'most_frequent'}. Best is trial 4 with value: 50.82902870259025.
[I 2024-01-04 22:54:42,251] Trial 84 finished with value: 51.12108757968804 and parameters: {'model_name': 'SimpleImputer', 'strategy': 'most_frequent'}. Best is trial 4 with value: 50.82902870259025.
[I 2024-01-04 22:54:42,542] Trial 81 finished with value: 51.12108757968804 and parameters: {'model_name': 'SimpleImputer', 'strategy': 'most_frequent'}. Best is trial 4 with value: 50.82902870259025.
[I 2024-01-04 22:54:42,853] Trial 85 finished with value: 51.12108757968804 and parameters: {'model_name': 'SimpleImputer', 'strategy': 'most_frequent'}. Best is trial 4 with value: 50.82902870259025.
[I 2024-01-04 22:54:43,206] Trial 83 finished with value: 51.12108757968804 and parameters: {'model_name': 'SimpleImputer', 'strategy': 'most_frequent'}. Best is trial 4 with value: 50.82902870259025.
[I 2024-01-04 22:54:43,560] Trial 87 finished with value: 51.12108757968804 and parameters: {'model_name': 'SimpleImputer', 'strategy': 'most_frequent'}. Best is trial 4 with value: 50.82902870259025.
[I 2024-01-04 22:54:43,840] Trial 88 finished with value: 51.12108757968804 and parameters: {'model_name': 'SimpleImputer', 'strategy': 'most_frequent'}. Best is trial 4 with value: 50.82902870259025.
[I 2024-01-04 22:54:44,076] Trial 116 finished with value: 50.82902870259025 and parameters: {'model_name': 'SimpleImputer', 'strategy': 'median'}. Best is trial 4 with value: 50.82902870259025.
