[I 2024-02-11 01:01:00,236] Trial 122 finished with value: 2.8672043732237347 and parameters: {'model_name': 'SimpleImputer', 'strategy': 'mean'}. Best is trial 2 with value: 2.8672043732237347.
[I 2024-02-11 01:01:00,681] Trial 70 finished with value: 3.3359084948113016 and parameters: {'model_name': 'SimpleImputer', 'strategy': 'most_frequent'}. Best is trial 2 with value: 2.8672043732237347.
[I 2024-02-11 01:01:00,921] Trial 72 finished with value: 3.3359084948113016 and parameters: {'model_name': 'SimpleImputer', 'strategy': 'most_frequent'}. Best is trial 2 with value: 2.8672043732237347.
[I 2024-02-11 01:01:01,283] Trial 126 finished with value: 2.8672043732237347 and parameters: {'model_name': 'SimpleImputer', 'strategy': 'mean'}. Best is trial 2 with value: 2.8672043732237347.
[I 2024-02-11 01:01:01,668] Trial 123 finished with value: 2.8672043732237347 and parameters: {'model_name': 'SimpleImputer', 'strategy': 'mean'}. Best is trial 2 with value: 2.8672043732237347.
[I 2024-02-11 01:01:01,939] Trial 71 finished with value: 3.3359084948113016 and parameters: {'model_name': 'SimpleImputer', 'strategy': 'most_frequent'}. Best is trial 2 with value: 2.8672043732237347.
[I 2024-02-11 01:01:02,126] Trial 121 finished with value: 2.8672043732237347 and parameters: {'model_name': 'SimpleImputer', 'strategy': 'mean'}. Best is trial 2 with value: 2.8672043732237347.
[I 2024-02-11 01:01:02,494] Trial 66 finished with value: 3.3359084948113016 and parameters: {'model_name': 'SimpleImputer', 'strategy': 'most_frequent'}. Best is trial 2 with value: 2.8672043732237347.
[I 2024-02-11 01:01:02,681] Trial 124 finished with value: 2.8672043732237347 and parameters: {'model_name': 'SimpleImputer', 'strategy': 'mean'}. Best is trial 2 with value: 2.8672043732237347.
[I 2024-02-11 01:01:02,940] Trial 125 finished with value: 2.8672043732237347 and parameters: {'model_name': 'SimpleImputer', 'strategy': 'mean'}. Best is trial 2 with value: 2.8672043732237347.
[I 2024-02-11 01:01:03,247] Trial 86 finished with value: 3.3359084948113016 and parameters: {'model_name': 'SimpleImputer', 'strategy': 'most_frequent'}. Best is trial 2 with value: 2.8672043732237347.
[I 2024-02-11 01:01:03,663] Trial 127 finished with value: 2.8672043732237347 and parameters: {'model_name': 'SimpleImputer', 'strategy': 'mean'}. Best is trial 2 with value: 2.8672043732237347.
[I 2024-02-11 01:01:04,209] Trial 77 finished with value: 3.3359084948113016 and parameters: {'model_name': 'SimpleImputer', 'strategy': 'most_frequent'}. Best is trial 2 with value: 2.8672043732237347.
[I 2024-02-11 01:01:04,570] Trial 134 finished with value: 2.8672043732237347 and parameters: {'model_name': 'SimpleImputer', 'strategy': 'mean'}. Best is trial 2 with value: 2.8672043732237347.
[I 2024-02-11 01:01:04,816] Trial 96 finished with value: 3.3359084948113016 and parameters: {'model_name': 'SimpleImputer', 'strategy': 'most_frequent'}. Best is trial 2 with value: 2.8672043732237347.
[I 2024-02-11 01:01:04,997] Trial 129 finished with value: 2.8672043732237347 and parameters: {'model_name': 'SimpleImputer', 'strategy': 'mean'}. Best is trial 2 with value: 2.8672043732237347.
[I 2024-02-11 01:01:05,270] Trial 128 finished with value: 2.8672043732237347 and parameters: {'model_name': 'SimpleImputer', 'strategy': 'mean'}. Best is trial 2 with value: 2.8672043732237347.
[I 2024-02-11 01:01:05,448] Trial 132 finished with value: 2.8672043732237347 and parameters: {'model_name': 'SimpleImputer', 'strategy': 'mean'}. Best is trial 2 with value: 2.8672043732237347.
[I 2024-02-11 01:01:05,711] Trial 131 finished with value: 2.8672043732237347 and parameters: {'model_name': 'SimpleImputer', 'strategy': 'mean'}. Best is trial 2 with value: 2.8672043732237347.
[I 2024-02-11 01:01:05,941] Trial 130 finished with value: 2.8672043732237347 and parameters: {'model_name': 'SimpleImputer', 'strategy': 'mean'}. Best is trial 2 with value: 2.8672043732237347.
[I 2024-02-11 01:01:06,182] Trial 133 finished with value: 2.8672043732237347 and parameters: {'model_name': 'SimpleImputer', 'strategy': 'mean'}. Best is trial 2 with value: 2.8672043732237347.
[I 2024-02-11 01:01:06,423] Trial 85 finished with value: 3.3359084948113016 and parameters: {'model_name': 'SimpleImputer', 'strategy': 'most_frequent'}. Best is trial 2 with value: 2.8672043732237347.
[I 2024-02-11 01:01:06,698] Trial 75 finished with value: 3.3359084948113016 and parameters: {'model_name': 'SimpleImputer', 'strategy': 'most_frequent'}. Best is trial 2 with value: 2.8672043732237347.
[I 2024-02-11 01:01:06,950] Trial 94 finished with value: 3.3359084948113016 and parameters: {'model_name': 'SimpleImputer', 'strategy': 'most_frequent'}. Best is trial 2 with value: 2.8672043732237347.
[I 2024-02-11 01:01:07,299] Trial 135 finished with value: 2.8672043732237347 and parameters: {'model_name': 'SimpleImputer', 'strategy': 'mean'}. Best is trial 2 with value: 2.8672043732237347.
[I 2024-02-11 01:01:07,515] Trial 136 finished with value: 2.8672043732237347 and parameters: {'model_name': 'SimpleImputer', 'strategy': 'mean'}. Best is trial 2 with value: 2.8672043732237347.
[I 2024-02-11 01:01:07,794] Trial 95 finished with value: 3.3359084948113016 and parameters: {'model_name': 'SimpleImputer', 'strategy': 'most_frequent'}. Best is trial 2 with value: 2.8672043732237347.
[I 2024-02-11 01:01:07,999] Trial 138 finished with value: 2.8672043732237347 and parameters: {'model_name': 'SimpleImputer', 'strategy': 'mean'}. Best is trial 2 with value: 2.8672043732237347.
[I 2024-02-11 01:01:08,348] Trial 87 finished with value: 3.3359084948113016 and parameters: {'model_name': 'SimpleImputer', 'strategy': 'most_frequent'}. Best is trial 2 with value: 2.8672043732237347.
[I 2024-02-11 01:01:08,640] Trial 137 finished with value: 2.8672043732237347 and parameters: {'model_name': 'SimpleImputer', 'strategy': 'mean'}. Best is trial 2 with value: 2.8672043732237347.
[I 2024-02-11 01:01:09,062] Trial 139 finished with value: 2.8672043732237347 and parameters: {'model_name': 'SimpleImputer', 'strategy': 'mean'}. Best is trial 2 with value: 2.8672043732237347.
[I 2024-02-11 01:01:09,462] Trial 140 finished with value: 2.8672043732237347 and parameters: {'model_name': 'SimpleImputer', 'strategy': 'mean'}. Best is trial 2 with value: 2.8672043732237347.
[I 2024-02-11 01:01:09,774] Trial 146 finished with value: 2.8672043732237347 and parameters: {'model_name': 'SimpleImputer', 'strategy': 'mean'}. Best is trial 2 with value: 2.8672043732237347.
[I 2024-02-11 01:01:10,010] Trial 144 finished with value: 2.8672043732237347 and parameters: {'model_name': 'SimpleImputer', 'strategy': 'mean'}. Best is trial 2 with value: 2.8672043732237347.
[I 2024-02-11 01:01:10,210] Trial 143 finished with value: 2.8672043732237347 and parameters: {'model_name': 'SimpleImputer', 'strategy': 'mean'}. Best is trial 2 with value: 2.8672043732237347.
[I 2024-02-11 01:01:10,471] Trial 142 finished with value: 2.8672043732237347 and parameters: {'model_name': 'SimpleImputer', 'strategy': 'mean'}. Best is trial 2 with value: 2.8672043732237347.
[I 2024-02-11 01:01:10,797] Trial 98 finished with value: 3.3359084948113016 and parameters: {'model_name': 'SimpleImputer', 'strategy': 'most_frequent'}. Best is trial 2 with value: 2.8672043732237347.
[I 2024-02-11 01:01:10,986] Trial 145 finished with value: 2.8672043732237347 and parameters: {'model_name': 'SimpleImputer', 'strategy': 'mean'}. Best is trial 2 with value: 2.8672043732237347.
[I 2024-02-11 01:01:11,414] Trial 97 finished with value: 3.3359084948113016 and parameters: {'model_name': 'SimpleImputer', 'strategy': 'most_frequent'}. Best is trial 2 with value: 2.8672043732237347.
[I 2024-02-11 01:01:11,664] Trial 141 finished with value: 2.8672043732237347 and parameters: {'model_name': 'SimpleImputer', 'strategy': 'mean'}. Best is trial 2 with value: 2.8672043732237347.
[I 2024-02-11 01:01:12,141] Trial 148 finished with value: 2.8672043732237347 and parameters: {'model_name': 'SimpleImputer', 'strategy': 'mean'}. Best is trial 2 with value: 2.8672043732237347.
[I 2024-02-11 01:01:12,362] Trial 149 finished with value: 2.8672043732237347 and parameters: {'model_name': 'SimpleImputer', 'strategy': 'mean'}. Best is trial 2 with value: 2.8672043732237347.
[I 2024-02-11 01:01:12,563] Trial 155 finished with value: 2.8672043732237347 and parameters: {'model_name': 'SimpleImputer', 'strategy': 'mean'}. Best is trial 2 with value: 2.8672043732237347.
[I 2024-02-11 01:01:12,729] Trial 156 finished with value: 2.8672043732237347 and parameters: {'model_name': 'SimpleImputer', 'strategy': 'mean'}. Best is trial 2 with value: 2.8672043732237347.
[I 2024-02-11 01:01:12,974] Trial 147 finished with value: 2.8672043732237347 and parameters: {'model_name': 'SimpleImputer', 'strategy': 'mean'}. Best is trial 2 with value: 2.8672043732237347.
[I 2024-02-11 01:01:13,173] Trial 150 finished with value: 2.8672043732237347 and parameters: {'model_name': 'SimpleImputer', 'strategy': 'mean'}. Best is trial 2 with value: 2.8672043732237347.
[I 2024-02-11 01:01:13,400] Trial 151 finished with value: 2.8672043732237347 and parameters: {'model_name': 'SimpleImputer', 'strategy': 'mean'}. Best is trial 2 with value: 2.8672043732237347.
[I 2024-02-11 01:01:13,575] Trial 161 finished with value: 2.8672043732237347 and parameters: {'model_name': 'SimpleImputer', 'strategy': 'mean'}. Best is trial 2 with value: 2.8672043732237347.
[I 2024-02-11 01:01:13,819] Trial 153 finished with value: 2.8672043732237347 and parameters: {'model_name': 'SimpleImputer', 'strategy': 'mean'}. Best is trial 2 with value: 2.8672043732237347.
[I 2024-02-11 01:01:14,205] Trial 100 finished with value: 3.3359084948113016 and parameters: {'model_name': 'SimpleImputer', 'strategy': 'most_frequent'}. Best is trial 2 with value: 2.8672043732237347.
[I 2024-02-11 01:01:14,443] Trial 93 finished with value: 3.3359084948113016 and parameters: {'model_name': 'SimpleImputer', 'strategy': 'most_frequent'}. Best is trial 2 with value: 2.8672043732237347.
[I 2024-02-11 01:01:14,760] Trial 154 finished with value: 2.8672043732237347 and parameters: {'model_name': 'SimpleImputer', 'strategy': 'mean'}. Best is trial 2 with value: 2.8672043732237347.
[I 2024-02-11 01:01:15,113] Trial 162 finished with value: 2.8672043732237347 and parameters: {'model_name': 'SimpleImputer', 'strategy': 'mean'}. Best is trial 2 with value: 2.8672043732237347.
[I 2024-02-11 01:01:15,348] Trial 164 finished with value: 2.8672043732237347 and parameters: {'model_name': 'SimpleImputer', 'strategy': 'mean'}. Best is trial 2 with value: 2.8672043732237347.
[I 2024-02-11 01:01:15,606] Trial 157 finished with value: 2.8672043732237347 and parameters: {'model_name': 'SimpleImputer', 'strategy': 'mean'}. Best is trial 2 with value: 2.8672043732237347.
[I 2024-02-11 01:01:15,847] Trial 152 finished with value: 2.8672043732237347 and parameters: {'model_name': 'SimpleImputer', 'strategy': 'mean'}. Best is trial 2 with value: 2.8672043732237347.
[I 2024-02-11 01:01:16,120] Trial 160 finished with value: 2.8672043732237347 and parameters: {'model_name': 'SimpleImputer', 'strategy': 'mean'}. Best is trial 2 with value: 2.8672043732237347.
[I 2024-02-11 01:01:16,323] Trial 169 finished with value: 2.8672043732237347 and parameters: {'model_name': 'SimpleImputer', 'strategy': 'mean'}. Best is trial 2 with value: 2.8672043732237347.
[I 2024-02-11 01:01:16,526] Trial 163 finished with value: 2.8672043732237347 and parameters: {'model_name': 'SimpleImputer', 'strategy': 'mean'}. Best is trial 2 with value: 2.8672043732237347.
[I 2024-02-11 01:01:16,796] Trial 167 finished with value: 2.8672043732237347 and parameters: {'model_name': 'SimpleImputer', 'strategy': 'mean'}. Best is trial 2 with value: 2.8672043732237347.
[I 2024-02-11 01:01:17,100] Trial 158 finished with value: 2.8672043732237347 and parameters: {'model_name': 'SimpleImputer', 'strategy': 'mean'}. Best is trial 2 with value: 2.8672043732237347.
[I 2024-02-11 01:01:17,296] Trial 166 finished with value: 2.8672043732237347 and parameters: {'model_name': 'SimpleImputer', 'strategy': 'mean'}. Best is trial 2 with value: 2.8672043732237347.
[I 2024-02-11 01:01:17,586] Trial 159 finished with value: 2.8672043732237347 and parameters: {'model_name': 'SimpleImputer', 'strategy': 'mean'}. Best is trial 2 with value: 2.8672043732237347.
[I 2024-02-11 01:01:17,832] Trial 165 finished with value: 2.8672043732237347 and parameters: {'model_name': 'SimpleImputer', 'strategy': 'mean'}. Best is trial 2 with value: 2.8672043732237347.
[I 2024-02-11 01:01:18,059] Trial 99 finished with value: 3.3359084948113016 and parameters: {'model_name': 'SimpleImputer', 'strategy': 'most_frequent'}. Best is trial 2 with value: 2.8672043732237347.
[I 2024-02-11 01:01:18,535] Trial 170 finished with value: 2.8672043732237347 and parameters: {'model_name': 'SimpleImputer', 'strategy': 'mean'}. Best is trial 2 with value: 2.8672043732237347.
[I 2024-02-11 01:01:18,791] Trial 173 finished with value: 2.8672043732237347 and parameters: {'model_name': 'SimpleImputer', 'strategy': 'mean'}. Best is trial 2 with value: 2.8672043732237347.
[I 2024-02-11 01:01:19,054] Trial 168 finished with value: 2.8672043732237347 and parameters: {'model_name': 'SimpleImputer', 'strategy': 'mean'}. Best is trial 2 with value: 2.8672043732237347.
[I 2024-02-11 01:01:19,348] Trial 174 finished with value: 2.8672043732237347 and parameters: {'model_name': 'SimpleImputer', 'strategy': 'mean'}. Best is trial 2 with value: 2.8672043732237347.
[I 2024-02-11 01:01:19,588] Trial 175 finished with value: 2.8672043732237347 and parameters: {'model_name': 'SimpleImputer', 'strategy': 'mean'}. Best is trial 2 with value: 2.8672043732237347.
[I 2024-02-11 01:01:19,810] Trial 172 finished with value: 2.8672043732237347 and parameters: {'model_name': 'SimpleImputer', 'strategy': 'mean'}. Best is trial 2 with value: 2.8672043732237347.
[I 2024-02-11 01:01:20,009] Trial 171 finished with value: 2.8672043732237347 and parameters: {'model_name': 'SimpleImputer', 'strategy': 'mean'}. Best is trial 2 with value: 2.8672043732237347.
[I 2024-02-11 01:01:20,237] Trial 176 finished with value: 2.8672043732237347 and parameters: {'model_name': 'SimpleImputer', 'strategy': 'mean'}. Best is trial 2 with value: 2.8672043732237347.
[I 2024-02-11 01:01:20,534] Trial 179 finished with value: 2.8672043732237347 and parameters: {'model_name': 'SimpleImputer', 'strategy': 'mean'}. Best is trial 2 with value: 2.8672043732237347.
[I 2024-02-11 01:01:20,737] Trial 178 finished with value: 2.8672043732237347 and parameters: {'model_name': 'SimpleImputer', 'strategy': 'mean'}. Best is trial 2 with value: 2.8672043732237347.
[I 2024-02-11 01:01:20,941] Trial 183 finished with value: 2.8672043732237347 and parameters: {'model_name': 'SimpleImputer', 'strategy': 'mean'}. Best is trial 2 with value: 2.8672043732237347.
[I 2024-02-11 01:01:21,124] Trial 182 finished with value: 2.8672043732237347 and parameters: {'model_name': 'SimpleImputer', 'strategy': 'mean'}. Best is trial 2 with value: 2.8672043732237347.
[I 2024-02-11 01:01:21,300] Trial 180 finished with value: 2.8672043732237347 and parameters: {'model_name': 'SimpleImputer', 'strategy': 'mean'}. Best is trial 2 with value: 2.8672043732237347.
[I 2024-02-11 01:01:21,467] Trial 177 finished with value: 2.8672043732237347 and parameters: {'model_name': 'SimpleImputer', 'strategy': 'mean'}. Best is trial 2 with value: 2.8672043732237347.
[I 2024-02-11 01:01:21,733] Trial 181 finished with value: 2.8672043732237347 and parameters: {'model_name': 'SimpleImputer', 'strategy': 'mean'}. Best is trial 2 with value: 2.8672043732237347.
[I 2024-02-11 01:01:21,975] Trial 101 finished with value: 3.3359084948113016 and parameters: {'model_name': 'SimpleImputer', 'strategy': 'most_frequent'}. Best is trial 2 with value: 2.8672043732237347.
[I 2024-02-11 01:01:22,326] Trial 102 finished with value: 3.3359084948113016 and parameters: {'model_name': 'SimpleImputer', 'strategy': 'most_frequent'}. Best is trial 2 with value: 2.8672043732237347.
[I 2024-02-11 01:01:22,621] Trial 193 finished with value: 2.8672043732237347 and parameters: {'model_name': 'SimpleImputer', 'strategy': 'mean'}. Best is trial 2 with value: 2.8672043732237347.
[I 2024-02-11 01:01:22,829] Trial 103 finished with value: 3.3359084948113016 and parameters: {'model_name': 'SimpleImputer', 'strategy': 'most_frequent'}. Best is trial 2 with value: 2.8672043732237347.
[I 2024-02-11 01:01:23,085] Trial 188 finished with value: 2.8672043732237347 and parameters: {'model_name': 'SimpleImputer', 'strategy': 'mean'}. Best is trial 2 with value: 2.8672043732237347.
[I 2024-02-11 01:01:23,265] Trial 190 finished with value: 2.8672043732237347 and parameters: {'model_name': 'SimpleImputer', 'strategy': 'mean'}. Best is trial 2 with value: 2.8672043732237347.
[I 2024-02-11 01:01:23,493] Trial 185 finished with value: 2.8672043732237347 and parameters: {'model_name': 'SimpleImputer', 'strategy': 'mean'}. Best is trial 2 with value: 2.8672043732237347.
[I 2024-02-11 01:01:23,721] Trial 186 finished with value: 2.8672043732237347 and parameters: {'model_name': 'SimpleImputer', 'strategy': 'mean'}. Best is trial 2 with value: 2.8672043732237347.
[I 2024-02-11 01:01:23,963] Trial 184 finished with value: 2.8672043732237347 and parameters: {'model_name': 'SimpleImputer', 'strategy': 'mean'}. Best is trial 2 with value: 2.8672043732237347.
[I 2024-02-11 01:01:24,201] Trial 189 finished with value: 2.8672043732237347 and parameters: {'model_name': 'SimpleImputer', 'strategy': 'mean'}. Best is trial 2 with value: 2.8672043732237347.
[I 2024-02-11 01:01:24,466] Trial 197 finished with value: 2.8672043732237347 and parameters: {'model_name': 'SimpleImputer', 'strategy': 'mean'}. Best is trial 2 with value: 2.8672043732237347.
[I 2024-02-11 01:01:24,644] Trial 191 finished with value: 2.8672043732237347 and parameters: {'model_name': 'SimpleImputer', 'strategy': 'mean'}. Best is trial 2 with value: 2.8672043732237347.
[I 2024-02-11 01:01:24,827] Trial 187 finished with value: 2.8672043732237347 and parameters: {'model_name': 'SimpleImputer', 'strategy': 'mean'}. Best is trial 2 with value: 2.8672043732237347.
[I 2024-02-11 01:01:25,125] Trial 196 finished with value: 2.8672043732237347 and parameters: {'model_name': 'SimpleImputer', 'strategy': 'mean'}. Best is trial 2 with value: 2.8672043732237347.
[I 2024-02-11 01:01:25,312] Trial 195 finished with value: 2.8672043732237347 and parameters: {'model_name': 'SimpleImputer', 'strategy': 'mean'}. Best is trial 2 with value: 2.8672043732237347.
[I 2024-02-11 01:01:25,495] Trial 199 finished with value: 2.8672043732237347 and parameters: {'model_name': 'SimpleImputer', 'strategy': 'mean'}. Best is trial 2 with value: 2.8672043732237347.
[I 2024-02-11 01:01:25,733] Trial 198 finished with value: 2.8672043732237347 and parameters: {'model_name': 'SimpleImputer', 'strategy': 'mean'}. Best is trial 2 with value: 2.8672043732237347.
[I 2024-02-11 01:01:25,915] Trial 192 finished with value: 2.8672043732237347 and parameters: {'model_name': 'SimpleImputer', 'strategy': 'mean'}. Best is trial 2 with value: 2.8672043732237347.
[I 2024-02-11 01:01:26,092] Trial 194 finished with value: 2.8672043732237347 and parameters: {'model_name': 'SimpleImputer', 'strategy': 'mean'}. Best is trial 2 with value: 2.8672043732237347.
[I 2024-02-11 01:01:26,327] Trial 105 finished with value: 3.3359084948113016 and parameters: {'model_name': 'SimpleImputer', 'strategy': 'most_frequent'}. Best is trial 2 with value: 2.8672043732237347.
[I 2024-02-11 01:01:26,563] Trial 106 finished with value: 3.3359084948113016 and parameters: {'model_name': 'SimpleImputer', 'strategy': 'most_frequent'}. Best is trial 2 with value: 2.8672043732237347.
