[I 2024-04-23 02:09:11,575] Trial 10 finished with value: 1657.0756440533758 and parameters: {'model_name': 'SimpleImputer', 'strategy': 'constant'}. Best is trial 10 with value: 1657.0756440533758.
[I 2024-04-23 02:09:12,951] Trial 11 finished with value: 729.8380426332379 and parameters: {'model_name': 'SimpleImputer', 'strategy': 'mean'}. Best is trial 11 with value: 729.8380426332379.
[I 2024-04-23 02:09:13,562] Trial 18 finished with value: 729.8380426332379 and parameters: {'model_name': 'SimpleImputer', 'strategy': 'mean'}. Best is trial 11 with value: 729.8380426332379.
[I 2024-04-23 02:09:14,642] Trial 1 finished with value: 737.974345925633 and parameters: {'model_name': 'SimpleImputer', 'strategy': 'median'}. Best is trial 11 with value: 729.8380426332379.
[I 2024-04-23 02:09:15,996] Trial 45 finished with value: 1657.0756440533758 and parameters: {'model_name': 'SimpleImputer', 'strategy': 'constant'}. Best is trial 11 with value: 729.8380426332379.
[I 2024-04-23 02:09:17,216] Trial 25 finished with value: 737.974345925633 and parameters: {'model_name': 'SimpleImputer', 'strategy': 'median'}. Best is trial 11 with value: 729.8380426332379.
[I 2024-04-23 02:09:17,956] Trial 39 finished with value: 737.974345925633 and parameters: {'model_name': 'SimpleImputer', 'strategy': 'median'}. Best is trial 11 with value: 729.8380426332379.
2024-04-23 02:09:22.679694: E external/local_xla/xla/stream_executor/cuda/cuda_driver.cc:274] failed call to cuInit: CUDA_ERROR_NO_DEVICE: no CUDA-capable device is detected
2024-04-23 02:09:22.984209: I tensorflow/compiler/mlir/mlir_graph_optimization_pass.cc:388] MLIR V1 optimization pass is not enabled
[I 2024-04-23 02:09:23,169] Trial 13 finished with value: inf and parameters: {'model_name': 'GAIN', 'batch_size': 666, 'hint_rate': 0.9600000000000001, 'alpha': 97, 'iterations': 1168}. Best is trial 11 with value: 729.8380426332379.
[I 2024-04-23 02:09:25,495] Trial 5 finished with value: 751.9092357098632 and parameters: {'model_name': 'KNNImputer', 'weights': 'uniform', 'keep_empty_features': False}. Best is trial 11 with value: 729.8380426332379.
[I 2024-04-23 02:09:26,960] Trial 0 finished with value: 751.9092357098632 and parameters: {'model_name': 'KNNImputer', 'weights': 'uniform', 'keep_empty_features': False}. Best is trial 11 with value: 729.8380426332379.
[I 2024-04-23 02:09:27,691] Trial 7 finished with value: 1119.0058309840485 and parameters: {'model_name': 'SimpleImputer', 'strategy': 'most_frequent'}. Best is trial 11 with value: 729.8380426332379.
[I 2024-04-23 02:09:28,758] Trial 30 finished with value: 751.9092357098632 and parameters: {'model_name': 'KNNImputer', 'weights': 'uniform', 'keep_empty_features': False}. Best is trial 11 with value: 729.8380426332379.
[I 2024-04-23 02:09:29,383] Trial 17 finished with value: 751.9092357098632 and parameters: {'model_name': 'KNNImputer', 'weights': 'uniform', 'keep_empty_features': False}. Best is trial 11 with value: 729.8380426332379.
[I 2024-04-23 02:09:29,963] Trial 35 finished with value: 751.9092357098632 and parameters: {'model_name': 'KNNImputer', 'weights': 'uniform', 'keep_empty_features': False}. Best is trial 11 with value: 729.8380426332379.
[I 2024-04-23 02:09:30,495] Trial 56 finished with value: 729.8380426332379 and parameters: {'model_name': 'SimpleImputer', 'strategy': 'mean'}. Best is trial 11 with value: 729.8380426332379.
[I 2024-04-23 02:09:31,474] Trial 22 finished with value: 1119.0058309840485 and parameters: {'model_name': 'SimpleImputer', 'strategy': 'most_frequent'}. Best is trial 11 with value: 729.8380426332379.
[I 2024-04-23 02:09:32,707] Trial 37 finished with value: 757.3268170237646 and parameters: {'model_name': 'KNNImputer', 'weights': 'distance', 'keep_empty_features': False}. Best is trial 11 with value: 729.8380426332379.
[I 2024-04-23 02:09:34,253] Trial 40 finished with value: 1119.0058309840485 and parameters: {'model_name': 'SimpleImputer', 'strategy': 'most_frequent'}. Best is trial 11 with value: 729.8380426332379.
[I 2024-04-23 02:09:54,980] Trial 60 finished with value: 729.8380426332379 and parameters: {'model_name': 'RandomForestImputer', 'max_iter': 1, 'decreasing': False, 'min_samples_split': 1.0, 'min_samples_leaf': 0.9, 'max_features': 0.6, 'warm_start': True}. Best is trial 11 with value: 729.8380426332379.
[I 2024-04-23 02:10:31,655] Trial 47 finished with value: 1739.2889482133492 and parameters: {'model_name': 'RandomForestImputer', 'max_iter': 2, 'decreasing': True, 'min_samples_split': 0.30000000000000004, 'min_samples_leaf': 0.7000000000000001, 'max_features': 0.1, 'warm_start': True}. Best is trial 11 with value: 729.8380426332379.
[I 2024-04-23 02:10:40,306] Trial 58 finished with value: 1705.374455934693 and parameters: {'model_name': 'RandomForestImputer', 'max_iter': 2, 'decreasing': True, 'min_samples_split': 0.30000000000000004, 'min_samples_leaf': 0.1, 'max_features': 0.4, 'warm_start': True}. Best is trial 11 with value: 729.8380426332379.
[I 2024-04-23 02:10:41,881] Trial 62 finished with value: 1743.4120211996492 and parameters: {'model_name': 'RandomForestImputer', 'max_iter': 2, 'decreasing': True, 'min_samples_split': 0.1, 'min_samples_leaf': 0.8, 'max_features': 0.6, 'warm_start': True}. Best is trial 11 with value: 729.8380426332379.
[I 2024-04-23 02:11:00,398] Trial 48 finished with value: 931.1076514956633 and parameters: {'model_name': 'GAIN', 'batch_size': 15, 'hint_rate': 0.14, 'alpha': 1, 'iterations': 1}. Best is trial 11 with value: 729.8380426332379.
[I 2024-04-23 02:11:04,176] Trial 29 finished with value: 1006.273750075017 and parameters: {'model_name': 'GAIN', 'batch_size': 1, 'hint_rate': 0.01, 'alpha': 53, 'iterations': 3}. Best is trial 11 with value: 729.8380426332379.
[I 2024-04-23 02:11:10,581] Trial 21 finished with value: 1730.0950465774872 and parameters: {'model_name': 'RandomForestImputer', 'max_iter': 4, 'decreasing': True, 'min_samples_split': 0.7000000000000001, 'min_samples_leaf': 0.7000000000000001, 'max_features': 0.2, 'warm_start': True}. Best is trial 11 with value: 729.8380426332379.
[I 2024-04-23 02:11:12,848] Trial 72 finished with value: 729.8380426332379 and parameters: {'model_name': 'SimpleImputer', 'strategy': 'mean'}. Best is trial 11 with value: 729.8380426332379.
[I 2024-04-23 02:11:17,450] Trial 4 finished with value: 938.7942759333428 and parameters: {'model_name': 'GAIN', 'batch_size': 21, 'hint_rate': 0.9500000000000001, 'alpha': 11, 'iterations': 9}. Best is trial 11 with value: 729.8380426332379.
[I 2024-04-23 02:11:31,519] Trial 26 finished with value: 729.8380426332379 and parameters: {'model_name': 'RandomForestImputer', 'max_iter': 1, 'decreasing': True, 'min_samples_split': 0.2, 'min_samples_leaf': 0.6, 'max_features': 0.9, 'warm_start': False}. Best is trial 11 with value: 729.8380426332379.
[I 2024-04-23 02:11:33,095] Trial 14 finished with value: 729.8380426332379 and parameters: {'model_name': 'RandomForestImputer', 'max_iter': 1, 'decreasing': False, 'min_samples_split': 0.2, 'min_samples_leaf': 0.8, 'max_features': 0.6, 'warm_start': False}. Best is trial 11 with value: 729.8380426332379.
[I 2024-04-23 02:11:40,613] Trial 57 finished with value: 729.8380426332379 and parameters: {'model_name': 'RandomForestImputer', 'max_iter': 1, 'decreasing': True, 'min_samples_split': 0.5, 'min_samples_leaf': 0.4, 'max_features': 0.30000000000000004, 'warm_start': False}. Best is trial 11 with value: 729.8380426332379.
[I 2024-04-23 02:11:47,275] Trial 51 finished with value: 796.2735703760787 and parameters: {'model_name': 'GAIN', 'batch_size': 6, 'hint_rate': 0.79, 'alpha': 15, 'iterations': 25}. Best is trial 11 with value: 729.8380426332379.
[I 2024-04-23 02:12:34,684] Trial 12 finished with value: 1733.995833817728 and parameters: {'model_name': 'RandomForestImputer', 'max_iter': 13, 'decreasing': True, 'min_samples_split': 0.6000000000000001, 'min_samples_leaf': 0.4, 'max_features': 0.4, 'warm_start': True}. Best is trial 11 with value: 729.8380426332379.
[I 2024-04-23 02:13:43,385] Trial 38 finished with value: 1731.4522241705338 and parameters: {'model_name': 'RandomForestImputer', 'max_iter': 20, 'decreasing': True, 'min_samples_split': 0.4, 'min_samples_leaf': 0.6, 'max_features': 0.7000000000000001, 'warm_start': True}. Best is trial 11 with value: 729.8380426332379.
[I 2024-04-23 02:13:57,908] Trial 44 finished with value: 1738.9869056948733 and parameters: {'model_name': 'RandomForestImputer', 'max_iter': 28, 'decreasing': False, 'min_samples_split': 0.0, 'min_samples_leaf': 0.5, 'max_features': 0.30000000000000004, 'warm_start': True}. Best is trial 11 with value: 729.8380426332379.
[I 2024-04-23 02:14:25,182] Trial 3 finished with value: 730.1592824275609 and parameters: {'model_name': 'RandomForestImputer', 'max_iter': 2, 'decreasing': True, 'min_samples_split': 0.7000000000000001, 'min_samples_leaf': 0.1, 'max_features': 0.1, 'warm_start': False}. Best is trial 11 with value: 729.8380426332379.
[I 2024-04-23 02:15:56,538] Trial 2 finished with value: 662.2000566749514 and parameters: {'model_name': 'IterativeImputer', 'sample_posterior': False, 'initial_strategy': 'median', 'imputation_order': 'roman'}. Best is trial 2 with value: 662.2000566749514.
[I 2024-04-23 02:15:58,396] Trial 32 finished with value: 662.1965665182171 and parameters: {'model_name': 'IterativeImputer', 'sample_posterior': False, 'initial_strategy': 'median', 'imputation_order': 'ascending'}. Best is trial 32 with value: 662.1965665182171.
[I 2024-04-23 02:16:02,562] Trial 36 finished with value: 662.1942450749209 and parameters: {'model_name': 'IterativeImputer', 'sample_posterior': False, 'initial_strategy': 'mean', 'imputation_order': 'ascending'}. Best is trial 36 with value: 662.1942450749209.
[I 2024-04-23 02:16:04,192] Trial 16 finished with value: 662.1948912025243 and parameters: {'model_name': 'IterativeImputer', 'sample_posterior': False, 'initial_strategy': 'median', 'imputation_order': 'random'}. Best is trial 36 with value: 662.1942450749209.
[I 2024-04-23 02:16:07,749] Trial 43 finished with value: 662.1949439398053 and parameters: {'model_name': 'IterativeImputer', 'sample_posterior': False, 'initial_strategy': 'mean', 'imputation_order': 'descending'}. Best is trial 36 with value: 662.1942450749209.
[I 2024-04-23 02:16:09,664] Trial 28 finished with value: 713.005871186118 and parameters: {'model_name': 'RandomForestImputer', 'max_iter': 3, 'decreasing': True, 'min_samples_split': 0.2, 'min_samples_leaf': 0.2, 'max_features': 0.4, 'warm_start': False}. Best is trial 36 with value: 662.1942450749209.
[I 2024-04-23 02:16:12,474] Trial 46 finished with value: 662.1949439398053 and parameters: {'model_name': 'IterativeImputer', 'sample_posterior': False, 'initial_strategy': 'mean', 'imputation_order': 'descending'}. Best is trial 36 with value: 662.1942450749209.
[I 2024-04-23 02:16:13,465] Trial 20 finished with value: 662.1954427070089 and parameters: {'model_name': 'IterativeImputer', 'sample_posterior': False, 'initial_strategy': 'median', 'imputation_order': 'arabic'}. Best is trial 36 with value: 662.1942450749209.
[I 2024-04-23 02:16:14,478] Trial 61 finished with value: 662.1942450749209 and parameters: {'model_name': 'IterativeImputer', 'sample_posterior': False, 'initial_strategy': 'mean', 'imputation_order': 'ascending'}. Best is trial 36 with value: 662.1942450749209.
[I 2024-04-23 02:16:18,453] Trial 41 finished with value: 1729.3805671088837 and parameters: {'model_name': 'RandomForestImputer', 'max_iter': 33, 'decreasing': True, 'min_samples_split': 0.8, 'min_samples_leaf': 0.30000000000000004, 'max_features': 0.7000000000000001, 'warm_start': True}. Best is trial 36 with value: 662.1942450749209.
[I 2024-04-23 02:16:32,497] Trial 52 finished with value: 662.1936991452613 and parameters: {'model_name': 'IterativeImputer', 'sample_posterior': False, 'initial_strategy': 'median', 'imputation_order': 'random'}. Best is trial 52 with value: 662.1936991452613.
[I 2024-04-23 02:17:04,916] Trial 69 finished with value: 662.1991475825711 and parameters: {'model_name': 'IterativeImputer', 'sample_posterior': False, 'initial_strategy': 'median', 'imputation_order': 'descending'}. Best is trial 52 with value: 662.1936991452613.
[I 2024-04-23 02:17:21,692] Trial 24 finished with value: 662.1979951658403 and parameters: {'model_name': 'IterativeImputer', 'sample_posterior': False, 'initial_strategy': 'most_frequent', 'imputation_order': 'arabic'}. Best is trial 52 with value: 662.1936991452613.
[I 2024-04-23 02:17:43,314] Trial 64 finished with value: 662.2025743712662 and parameters: {'model_name': 'IterativeImputer', 'sample_posterior': False, 'initial_strategy': 'most_frequent', 'imputation_order': 'roman'}. Best is trial 52 with value: 662.1936991452613.
[I 2024-04-23 02:17:51,570] Trial 33 finished with value: 662.2016126043612 and parameters: {'model_name': 'IterativeImputer', 'sample_posterior': False, 'initial_strategy': 'most_frequent', 'imputation_order': 'random'}. Best is trial 52 with value: 662.1936991452613.
[I 2024-04-23 02:18:18,186] Trial 63 finished with value: 662.2009808249043 and parameters: {'model_name': 'IterativeImputer', 'sample_posterior': False, 'initial_strategy': 'most_frequent', 'imputation_order': 'random'}. Best is trial 52 with value: 662.1936991452613.
[I 2024-04-23 02:18:53,903] Trial 54 finished with value: 772.4570861666871 and parameters: {'model_name': 'GAIN', 'batch_size': 162, 'hint_rate': 0.59, 'alpha': 36, 'iterations': 196}. Best is trial 52 with value: 662.1936991452613.
[I 2024-04-23 02:18:57,115] Trial 66 finished with value: 662.2032881331435 and parameters: {'model_name': 'IterativeImputer', 'sample_posterior': False, 'initial_strategy': 'most_frequent', 'imputation_order': 'random'}. Best is trial 52 with value: 662.1936991452613.
[I 2024-04-23 02:19:12,308] Trial 49 finished with value: 1714.4873033901251 and parameters: {'model_name': 'RandomForestImputer', 'max_iter': 87, 'decreasing': False, 'min_samples_split': 0.30000000000000004, 'min_samples_leaf': 0.1, 'max_features': 0.8, 'warm_start': True}. Best is trial 52 with value: 662.1936991452613.
[I 2024-04-23 02:19:21,125] Trial 50 finished with value: 754.6802221974768 and parameters: {'model_name': 'GAIN', 'batch_size': 105, 'hint_rate': 0.78, 'alpha': 58, 'iterations': 213}. Best is trial 52 with value: 662.1936991452613.
[I 2024-04-23 02:19:50,325] Trial 55 finished with value: 1742.4438852088956 and parameters: {'model_name': 'RandomForestImputer', 'max_iter': 50, 'decreasing': False, 'min_samples_split': 0.0, 'min_samples_leaf': 0.2, 'max_features': 0.9, 'warm_start': True}. Best is trial 52 with value: 662.1936991452613.
[I 2024-04-23 02:20:09,795] Trial 79 finished with value: 662.1979951658403 and parameters: {'model_name': 'IterativeImputer', 'sample_posterior': False, 'initial_strategy': 'most_frequent', 'imputation_order': 'arabic'}. Best is trial 52 with value: 662.1936991452613.
[I 2024-04-23 02:21:57,371] Trial 83 finished with value: 662.2000566749514 and parameters: {'model_name': 'IterativeImputer', 'sample_posterior': False, 'initial_strategy': 'median', 'imputation_order': 'roman'}. Best is trial 52 with value: 662.1936991452613.
[I 2024-04-23 02:22:00,979] Trial 84 finished with value: 662.1965665182171 and parameters: {'model_name': 'IterativeImputer', 'sample_posterior': False, 'initial_strategy': 'median', 'imputation_order': 'ascending'}. Best is trial 52 with value: 662.1936991452613.
[I 2024-04-23 02:22:02,835] Trial 85 finished with value: 662.1965665182171 and parameters: {'model_name': 'IterativeImputer', 'sample_posterior': False, 'initial_strategy': 'median', 'imputation_order': 'ascending'}. Best is trial 52 with value: 662.1936991452613.
[I 2024-04-23 02:22:04,227] Trial 86 finished with value: 662.1965665182171 and parameters: {'model_name': 'IterativeImputer', 'sample_posterior': False, 'initial_strategy': 'median', 'imputation_order': 'ascending'}. Best is trial 52 with value: 662.1936991452613.
[I 2024-04-23 02:22:07,992] Trial 87 finished with value: 662.1942450749209 and parameters: {'model_name': 'IterativeImputer', 'sample_posterior': False, 'initial_strategy': 'mean', 'imputation_order': 'ascending'}. Best is trial 52 with value: 662.1936991452613.
[I 2024-04-23 02:22:10,934] Trial 88 finished with value: 662.1965665182171 and parameters: {'model_name': 'IterativeImputer', 'sample_posterior': False, 'initial_strategy': 'median', 'imputation_order': 'ascending'}. Best is trial 52 with value: 662.1936991452613.
[I 2024-04-23 02:22:12,420] Trial 89 finished with value: 662.1942450749209 and parameters: {'model_name': 'IterativeImputer', 'sample_posterior': False, 'initial_strategy': 'mean', 'imputation_order': 'ascending'}. Best is trial 52 with value: 662.1936991452613.
[I 2024-04-23 02:22:16,067] Trial 91 finished with value: 662.1949439398053 and parameters: {'model_name': 'IterativeImputer', 'sample_posterior': False, 'initial_strategy': 'mean', 'imputation_order': 'descending'}. Best is trial 52 with value: 662.1936991452613.
[I 2024-04-23 02:22:17,679] Trial 90 finished with value: 662.1949439398053 and parameters: {'model_name': 'IterativeImputer', 'sample_posterior': False, 'initial_strategy': 'mean', 'imputation_order': 'descending'}. Best is trial 52 with value: 662.1936991452613.
[I 2024-04-23 02:22:21,066] Trial 92 finished with value: 662.1949439398053 and parameters: {'model_name': 'IterativeImputer', 'sample_posterior': False, 'initial_strategy': 'mean', 'imputation_order': 'descending'}. Best is trial 52 with value: 662.1936991452613.
[I 2024-04-23 02:22:43,457] Trial 93 finished with value: 662.1944578402533 and parameters: {'model_name': 'IterativeImputer', 'sample_posterior': False, 'initial_strategy': 'mean', 'imputation_order': 'random'}. Best is trial 52 with value: 662.1936991452613.
[I 2024-04-23 02:22:55,253] Trial 94 finished with value: 662.1937417199144 and parameters: {'model_name': 'IterativeImputer', 'sample_posterior': False, 'initial_strategy': 'mean', 'imputation_order': 'random'}. Best is trial 52 with value: 662.1936991452613.
[I 2024-04-23 02:23:01,549] Trial 8 finished with value: 944.7719006919949 and parameters: {'model_name': 'IterativeImputer', 'sample_posterior': True, 'initial_strategy': 'mean', 'imputation_order': 'roman'}. Best is trial 52 with value: 662.1936991452613.
[I 2024-04-23 02:23:07,175] Trial 9 finished with value: 924.5767404053789 and parameters: {'model_name': 'IterativeImputer', 'sample_posterior': True, 'initial_strategy': 'most_frequent', 'imputation_order': 'arabic'}. Best is trial 52 with value: 662.1936991452613.
[I 2024-04-23 02:23:13,760] Trial 42 finished with value: 908.6459921855461 and parameters: {'model_name': 'IterativeImputer', 'sample_posterior': True, 'initial_strategy': 'most_frequent', 'imputation_order': 'arabic'}. Best is trial 52 with value: 662.1936991452613.
[I 2024-04-23 02:23:23,631] Trial 34 finished with value: 971.3159171528772 and parameters: {'model_name': 'IterativeImputer', 'sample_posterior': True, 'initial_strategy': 'mean', 'imputation_order': 'arabic'}. Best is trial 52 with value: 662.1936991452613.
[I 2024-04-23 02:23:30,265] Trial 6 finished with value: 930.3899866362323 and parameters: {'model_name': 'IterativeImputer', 'sample_posterior': True, 'initial_strategy': 'median', 'imputation_order': 'roman'}. Best is trial 52 with value: 662.1936991452613.
[I 2024-04-23 02:23:32,728] Trial 53 finished with value: 939.9042267454527 and parameters: {'model_name': 'IterativeImputer', 'sample_posterior': True, 'initial_strategy': 'most_frequent', 'imputation_order': 'roman'}. Best is trial 52 with value: 662.1936991452613.
[I 2024-04-23 02:23:33,850] Trial 27 finished with value: 893.1475685177463 and parameters: {'model_name': 'IterativeImputer', 'sample_posterior': True, 'initial_strategy': 'most_frequent', 'imputation_order': 'arabic'}. Best is trial 52 with value: 662.1936991452613.
[I 2024-04-23 02:23:56,225] Trial 68 finished with value: 868.0146012274148 and parameters: {'model_name': 'IterativeImputer', 'sample_posterior': True, 'initial_strategy': 'median', 'imputation_order': 'ascending'}. Best is trial 52 with value: 662.1936991452613.
[I 2024-04-23 02:24:03,378] Trial 67 finished with value: 918.4487320991539 and parameters: {'model_name': 'IterativeImputer', 'sample_posterior': True, 'initial_strategy': 'most_frequent', 'imputation_order': 'ascending'}. Best is trial 52 with value: 662.1936991452613.
[I 2024-04-23 02:24:46,936] Trial 59 finished with value: 730.8814894949753 and parameters: {'model_name': 'RandomForestImputer', 'max_iter': 26, 'decreasing': False, 'min_samples_split': 0.1, 'min_samples_leaf': 0.5, 'max_features': 0.9, 'warm_start': False}. Best is trial 52 with value: 662.1936991452613.
[I 2024-04-23 02:24:52,690] Trial 70 finished with value: 951.9570756875925 and parameters: {'model_name': 'IterativeImputer', 'sample_posterior': True, 'initial_strategy': 'constant', 'imputation_order': 'ascending'}. Best is trial 52 with value: 662.1936991452613.
[I 2024-04-23 02:24:56,022] Trial 73 finished with value: 954.4766868361423 and parameters: {'model_name': 'IterativeImputer', 'sample_posterior': True, 'initial_strategy': 'most_frequent', 'imputation_order': 'descending'}. Best is trial 52 with value: 662.1936991452613.
[I 2024-04-23 02:25:00,547] Trial 77 finished with value: 930.9110540361062 and parameters: {'model_name': 'IterativeImputer', 'sample_posterior': True, 'initial_strategy': 'mean', 'imputation_order': 'ascending'}. Best is trial 52 with value: 662.1936991452613.
[I 2024-04-23 02:25:02,988] Trial 76 finished with value: 972.451199738853 and parameters: {'model_name': 'IterativeImputer', 'sample_posterior': True, 'initial_strategy': 'constant', 'imputation_order': 'ascending'}. Best is trial 52 with value: 662.1936991452613.
