[I 2023-12-12 15:26:35,359] Trial 117 finished with value: 1785.3704913527722 and parameters: {'model_name': 'SimpleImputer', 'strategy': 'mean'}. Best is trial 9 with value: 1785.3704913527722.
[I 2023-12-12 15:26:35,639] Trial 118 finished with value: 1785.3704913527722 and parameters: {'model_name': 'SimpleImputer', 'strategy': 'mean'}. Best is trial 9 with value: 1785.3704913527722.
[I 2023-12-12 15:26:35,821] Trial 116 finished with value: 1785.3704913527722 and parameters: {'model_name': 'SimpleImputer', 'strategy': 'mean'}. Best is trial 9 with value: 1785.3704913527722.
[I 2023-12-12 15:26:36,070] Trial 75 finished with value: 1890.7950712192014 and parameters: {'model_name': 'SimpleImputer', 'strategy': 'most_frequent'}. Best is trial 9 with value: 1785.3704913527722.
[I 2023-12-12 15:26:36,328] Trial 114 finished with value: 1785.3704913527722 and parameters: {'model_name': 'SimpleImputer', 'strategy': 'mean'}. Best is trial 9 with value: 1785.3704913527722.
[I 2023-12-12 15:26:36,515] Trial 82 finished with value: 1890.7950712192014 and parameters: {'model_name': 'SimpleImputer', 'strategy': 'most_frequent'}. Best is trial 9 with value: 1785.3704913527722.
[I 2023-12-12 15:26:36,749] Trial 81 finished with value: 1890.7950712192014 and parameters: {'model_name': 'SimpleImputer', 'strategy': 'most_frequent'}. Best is trial 9 with value: 1785.3704913527722.
[I 2023-12-12 15:26:36,978] Trial 128 finished with value: 1785.3704913527722 and parameters: {'model_name': 'SimpleImputer', 'strategy': 'mean'}. Best is trial 9 with value: 1785.3704913527722.
[I 2023-12-12 15:26:37,187] Trial 124 finished with value: 1785.3704913527722 and parameters: {'model_name': 'SimpleImputer', 'strategy': 'mean'}. Best is trial 9 with value: 1785.3704913527722.
[I 2023-12-12 15:26:37,453] Trial 76 finished with value: 1890.7950712192014 and parameters: {'model_name': 'SimpleImputer', 'strategy': 'most_frequent'}. Best is trial 9 with value: 1785.3704913527722.
[I 2023-12-12 15:26:37,801] Trial 83 finished with value: 1890.7950712192014 and parameters: {'model_name': 'SimpleImputer', 'strategy': 'most_frequent'}. Best is trial 9 with value: 1785.3704913527722.
[I 2023-12-12 15:26:38,041] Trial 125 finished with value: 1785.3704913527722 and parameters: {'model_name': 'SimpleImputer', 'strategy': 'mean'}. Best is trial 9 with value: 1785.3704913527722.
[I 2023-12-12 15:26:38,254] Trial 119 finished with value: 1785.3704913527722 and parameters: {'model_name': 'SimpleImputer', 'strategy': 'mean'}. Best is trial 9 with value: 1785.3704913527722.
[I 2023-12-12 15:26:38,557] Trial 85 finished with value: 1890.7950712192014 and parameters: {'model_name': 'SimpleImputer', 'strategy': 'most_frequent'}. Best is trial 9 with value: 1785.3704913527722.
[I 2023-12-12 15:26:38,775] Trial 120 finished with value: 1785.3704913527722 and parameters: {'model_name': 'SimpleImputer', 'strategy': 'mean'}. Best is trial 9 with value: 1785.3704913527722.
[I 2023-12-12 15:26:39,013] Trial 122 finished with value: 1785.3704913527722 and parameters: {'model_name': 'SimpleImputer', 'strategy': 'mean'}. Best is trial 9 with value: 1785.3704913527722.
[I 2023-12-12 15:26:39,250] Trial 89 finished with value: 1890.7950712192014 and parameters: {'model_name': 'SimpleImputer', 'strategy': 'most_frequent'}. Best is trial 9 with value: 1785.3704913527722.
[I 2023-12-12 15:26:39,442] Trial 127 finished with value: 1785.3704913527722 and parameters: {'model_name': 'SimpleImputer', 'strategy': 'mean'}. Best is trial 9 with value: 1785.3704913527722.
[I 2023-12-12 15:26:39,673] Trial 121 finished with value: 1785.3704913527722 and parameters: {'model_name': 'SimpleImputer', 'strategy': 'mean'}. Best is trial 9 with value: 1785.3704913527722.
[I 2023-12-12 15:26:39,891] Trial 80 finished with value: 1890.7950712192014 and parameters: {'model_name': 'SimpleImputer', 'strategy': 'most_frequent'}. Best is trial 9 with value: 1785.3704913527722.
[I 2023-12-12 15:26:40,110] Trial 126 finished with value: 1785.3704913527722 and parameters: {'model_name': 'SimpleImputer', 'strategy': 'mean'}. Best is trial 9 with value: 1785.3704913527722.
[I 2023-12-12 15:26:40,308] Trial 90 finished with value: 1890.7950712192014 and parameters: {'model_name': 'SimpleImputer', 'strategy': 'most_frequent'}. Best is trial 9 with value: 1785.3704913527722.
[I 2023-12-12 15:26:40,611] Trial 87 finished with value: 1890.7950712192014 and parameters: {'model_name': 'SimpleImputer', 'strategy': 'most_frequent'}. Best is trial 9 with value: 1785.3704913527722.
[I 2023-12-12 15:26:40,863] Trial 123 finished with value: 1785.3704913527722 and parameters: {'model_name': 'SimpleImputer', 'strategy': 'mean'}. Best is trial 9 with value: 1785.3704913527722.
[I 2023-12-12 15:26:41,062] Trial 86 finished with value: 1890.7950712192014 and parameters: {'model_name': 'SimpleImputer', 'strategy': 'most_frequent'}. Best is trial 9 with value: 1785.3704913527722.
[I 2023-12-12 15:26:41,447] Trial 91 finished with value: 1890.7950712192014 and parameters: {'model_name': 'SimpleImputer', 'strategy': 'most_frequent'}. Best is trial 9 with value: 1785.3704913527722.
[I 2023-12-12 15:26:41,732] Trial 92 finished with value: 1890.7950712192014 and parameters: {'model_name': 'SimpleImputer', 'strategy': 'most_frequent'}. Best is trial 9 with value: 1785.3704913527722.
[I 2023-12-12 15:26:41,938] Trial 129 finished with value: 1785.3704913527722 and parameters: {'model_name': 'SimpleImputer', 'strategy': 'mean'}. Best is trial 9 with value: 1785.3704913527722.
[I 2023-12-12 15:26:42,184] Trial 131 finished with value: 1785.3704913527722 and parameters: {'model_name': 'SimpleImputer', 'strategy': 'mean'}. Best is trial 9 with value: 1785.3704913527722.
[I 2023-12-12 15:26:42,385] Trial 93 finished with value: 1890.7950712192014 and parameters: {'model_name': 'SimpleImputer', 'strategy': 'most_frequent'}. Best is trial 9 with value: 1785.3704913527722.
[I 2023-12-12 15:26:42,559] Trial 134 finished with value: 1785.3704913527722 and parameters: {'model_name': 'SimpleImputer', 'strategy': 'mean'}. Best is trial 9 with value: 1785.3704913527722.
[I 2023-12-12 15:26:42,794] Trial 130 finished with value: 1785.3704913527722 and parameters: {'model_name': 'SimpleImputer', 'strategy': 'mean'}. Best is trial 9 with value: 1785.3704913527722.
[I 2023-12-12 15:26:43,041] Trial 84 finished with value: 1890.7950712192014 and parameters: {'model_name': 'SimpleImputer', 'strategy': 'most_frequent'}. Best is trial 9 with value: 1785.3704913527722.
[I 2023-12-12 15:26:43,227] Trial 88 finished with value: 1890.7950712192014 and parameters: {'model_name': 'SimpleImputer', 'strategy': 'most_frequent'}. Best is trial 9 with value: 1785.3704913527722.
[I 2023-12-12 15:26:43,454] Trial 133 finished with value: 1785.3704913527722 and parameters: {'model_name': 'SimpleImputer', 'strategy': 'mean'}. Best is trial 9 with value: 1785.3704913527722.
[I 2023-12-12 15:26:43,747] Trial 135 finished with value: 1785.3704913527722 and parameters: {'model_name': 'SimpleImputer', 'strategy': 'mean'}. Best is trial 9 with value: 1785.3704913527722.
[I 2023-12-12 15:26:43,950] Trial 136 finished with value: 1785.3704913527722 and parameters: {'model_name': 'SimpleImputer', 'strategy': 'mean'}. Best is trial 9 with value: 1785.3704913527722.
[I 2023-12-12 15:26:44,205] Trial 132 finished with value: 1785.3704913527722 and parameters: {'model_name': 'SimpleImputer', 'strategy': 'mean'}. Best is trial 9 with value: 1785.3704913527722.
[I 2023-12-12 15:26:44,444] Trial 140 finished with value: 1785.3704913527722 and parameters: {'model_name': 'SimpleImputer', 'strategy': 'mean'}. Best is trial 9 with value: 1785.3704913527722.
[I 2023-12-12 15:26:44,729] Trial 145 finished with value: 1785.3704913527722 and parameters: {'model_name': 'SimpleImputer', 'strategy': 'mean'}. Best is trial 9 with value: 1785.3704913527722.
[I 2023-12-12 15:26:44,934] Trial 138 finished with value: 1785.3704913527722 and parameters: {'model_name': 'SimpleImputer', 'strategy': 'mean'}. Best is trial 9 with value: 1785.3704913527722.
[I 2023-12-12 15:26:45,173] Trial 137 finished with value: 1785.3704913527722 and parameters: {'model_name': 'SimpleImputer', 'strategy': 'mean'}. Best is trial 9 with value: 1785.3704913527722.
[I 2023-12-12 15:26:45,641] Trial 94 finished with value: 1890.7950712192014 and parameters: {'model_name': 'SimpleImputer', 'strategy': 'most_frequent'}. Best is trial 9 with value: 1785.3704913527722.
[I 2023-12-12 15:26:45,864] Trial 143 finished with value: 1785.3704913527722 and parameters: {'model_name': 'SimpleImputer', 'strategy': 'mean'}. Best is trial 9 with value: 1785.3704913527722.
[I 2023-12-12 15:26:46,064] Trial 139 finished with value: 1785.3704913527722 and parameters: {'model_name': 'SimpleImputer', 'strategy': 'mean'}. Best is trial 9 with value: 1785.3704913527722.
[I 2023-12-12 15:26:46,386] Trial 142 finished with value: 1785.3704913527722 and parameters: {'model_name': 'SimpleImputer', 'strategy': 'mean'}. Best is trial 9 with value: 1785.3704913527722.
[I 2023-12-12 15:26:46,621] Trial 146 finished with value: 1785.3704913527722 and parameters: {'model_name': 'SimpleImputer', 'strategy': 'mean'}. Best is trial 9 with value: 1785.3704913527722.
[I 2023-12-12 15:26:46,890] Trial 148 finished with value: 1785.3704913527722 and parameters: {'model_name': 'SimpleImputer', 'strategy': 'mean'}. Best is trial 9 with value: 1785.3704913527722.
[I 2023-12-12 15:26:47,102] Trial 147 finished with value: 1785.3704913527722 and parameters: {'model_name': 'SimpleImputer', 'strategy': 'mean'}. Best is trial 9 with value: 1785.3704913527722.
[I 2023-12-12 15:26:47,450] Trial 159 finished with value: 1785.3704913527722 and parameters: {'model_name': 'SimpleImputer', 'strategy': 'mean'}. Best is trial 9 with value: 1785.3704913527722.
[I 2023-12-12 15:26:47,698] Trial 165 finished with value: 1785.3704913527722 and parameters: {'model_name': 'SimpleImputer', 'strategy': 'mean'}. Best is trial 9 with value: 1785.3704913527722.
[I 2023-12-12 15:26:47,987] Trial 152 finished with value: 1785.3704913527722 and parameters: {'model_name': 'SimpleImputer', 'strategy': 'mean'}. Best is trial 9 with value: 1785.3704913527722.
[I 2023-12-12 15:26:48,217] Trial 141 finished with value: 1785.3704913527722 and parameters: {'model_name': 'SimpleImputer', 'strategy': 'mean'}. Best is trial 9 with value: 1785.3704913527722.
[I 2023-12-12 15:26:48,432] Trial 153 finished with value: 1785.3704913527722 and parameters: {'model_name': 'SimpleImputer', 'strategy': 'mean'}. Best is trial 9 with value: 1785.3704913527722.
[I 2023-12-12 15:26:48,682] Trial 144 finished with value: 1785.3704913527722 and parameters: {'model_name': 'SimpleImputer', 'strategy': 'mean'}. Best is trial 9 with value: 1785.3704913527722.
[I 2023-12-12 15:26:49,019] Trial 164 finished with value: 1785.3704913527722 and parameters: {'model_name': 'SimpleImputer', 'strategy': 'mean'}. Best is trial 9 with value: 1785.3704913527722.
[I 2023-12-12 15:26:49,236] Trial 150 finished with value: 1785.3704913527722 and parameters: {'model_name': 'SimpleImputer', 'strategy': 'mean'}. Best is trial 9 with value: 1785.3704913527722.
[I 2023-12-12 15:26:49,488] Trial 155 finished with value: 1785.3704913527722 and parameters: {'model_name': 'SimpleImputer', 'strategy': 'mean'}. Best is trial 9 with value: 1785.3704913527722.
[I 2023-12-12 15:26:49,738] Trial 154 finished with value: 1785.3704913527722 and parameters: {'model_name': 'SimpleImputer', 'strategy': 'mean'}. Best is trial 9 with value: 1785.3704913527722.
[I 2023-12-12 15:26:49,973] Trial 156 finished with value: 1785.3704913527722 and parameters: {'model_name': 'SimpleImputer', 'strategy': 'mean'}. Best is trial 9 with value: 1785.3704913527722.
[I 2023-12-12 15:26:50,188] Trial 160 finished with value: 1785.3704913527722 and parameters: {'model_name': 'SimpleImputer', 'strategy': 'mean'}. Best is trial 9 with value: 1785.3704913527722.
[I 2023-12-12 15:26:50,376] Trial 162 finished with value: 1785.3704913527722 and parameters: {'model_name': 'SimpleImputer', 'strategy': 'mean'}. Best is trial 9 with value: 1785.3704913527722.
[I 2023-12-12 15:26:50,602] Trial 166 finished with value: 1785.3704913527722 and parameters: {'model_name': 'SimpleImputer', 'strategy': 'mean'}. Best is trial 9 with value: 1785.3704913527722.
[I 2023-12-12 15:26:50,799] Trial 157 finished with value: 1785.3704913527722 and parameters: {'model_name': 'SimpleImputer', 'strategy': 'mean'}. Best is trial 9 with value: 1785.3704913527722.
[I 2023-12-12 15:26:51,092] Trial 151 finished with value: 1785.3704913527722 and parameters: {'model_name': 'SimpleImputer', 'strategy': 'mean'}. Best is trial 9 with value: 1785.3704913527722.
[I 2023-12-12 15:26:51,349] Trial 158 finished with value: 1785.3704913527722 and parameters: {'model_name': 'SimpleImputer', 'strategy': 'mean'}. Best is trial 9 with value: 1785.3704913527722.
[I 2023-12-12 15:26:51,627] Trial 177 finished with value: 1898.6831307490568 and parameters: {'model_name': 'SimpleImputer', 'strategy': 'constant'}. Best is trial 9 with value: 1785.3704913527722.
[I 2023-12-12 15:26:51,868] Trial 161 finished with value: 1785.3704913527722 and parameters: {'model_name': 'SimpleImputer', 'strategy': 'mean'}. Best is trial 9 with value: 1785.3704913527722.
[I 2023-12-12 15:26:52,117] Trial 176 finished with value: 1898.6831307490568 and parameters: {'model_name': 'SimpleImputer', 'strategy': 'constant'}. Best is trial 9 with value: 1785.3704913527722.
[I 2023-12-12 15:26:52,381] Trial 179 finished with value: 1785.3704913527722 and parameters: {'model_name': 'SimpleImputer', 'strategy': 'mean'}. Best is trial 9 with value: 1785.3704913527722.
[I 2023-12-12 15:26:52,583] Trial 149 finished with value: 1785.3704913527722 and parameters: {'model_name': 'SimpleImputer', 'strategy': 'mean'}. Best is trial 9 with value: 1785.3704913527722.
[I 2023-12-12 15:26:52,769] Trial 168 finished with value: 1785.3704913527722 and parameters: {'model_name': 'SimpleImputer', 'strategy': 'mean'}. Best is trial 9 with value: 1785.3704913527722.
[I 2023-12-12 15:26:52,963] Trial 171 finished with value: 1785.3704913527722 and parameters: {'model_name': 'SimpleImputer', 'strategy': 'mean'}. Best is trial 9 with value: 1785.3704913527722.
[I 2023-12-12 15:26:53,243] Trial 172 finished with value: 1785.3704913527722 and parameters: {'model_name': 'SimpleImputer', 'strategy': 'mean'}. Best is trial 9 with value: 1785.3704913527722.
[I 2023-12-12 15:26:53,515] Trial 187 finished with value: 1898.6831307490568 and parameters: {'model_name': 'SimpleImputer', 'strategy': 'constant'}. Best is trial 9 with value: 1785.3704913527722.
[I 2023-12-12 15:26:53,791] Trial 175 finished with value: 1898.6831307490568 and parameters: {'model_name': 'SimpleImputer', 'strategy': 'constant'}. Best is trial 9 with value: 1785.3704913527722.
[I 2023-12-12 15:26:54,077] Trial 163 finished with value: 1785.3704913527722 and parameters: {'model_name': 'SimpleImputer', 'strategy': 'mean'}. Best is trial 9 with value: 1785.3704913527722.
[I 2023-12-12 15:26:54,365] Trial 190 finished with value: 1898.6831307490568 and parameters: {'model_name': 'SimpleImputer', 'strategy': 'constant'}. Best is trial 9 with value: 1785.3704913527722.
[I 2023-12-12 15:26:54,546] Trial 188 finished with value: 1898.6831307490568 and parameters: {'model_name': 'SimpleImputer', 'strategy': 'constant'}. Best is trial 9 with value: 1785.3704913527722.
[I 2023-12-12 15:26:54,836] Trial 194 finished with value: 1898.6831307490568 and parameters: {'model_name': 'SimpleImputer', 'strategy': 'constant'}. Best is trial 9 with value: 1785.3704913527722.
[I 2023-12-12 15:26:55,069] Trial 181 finished with value: 1785.3704913527722 and parameters: {'model_name': 'SimpleImputer', 'strategy': 'mean'}. Best is trial 9 with value: 1785.3704913527722.
[I 2023-12-12 15:26:55,269] Trial 174 finished with value: 1785.3704913527722 and parameters: {'model_name': 'SimpleImputer', 'strategy': 'mean'}. Best is trial 9 with value: 1785.3704913527722.
[I 2023-12-12 15:26:55,532] Trial 170 finished with value: 1785.3704913527722 and parameters: {'model_name': 'SimpleImputer', 'strategy': 'mean'}. Best is trial 9 with value: 1785.3704913527722.
[I 2023-12-12 15:26:55,779] Trial 178 finished with value: 1898.6831307490568 and parameters: {'model_name': 'SimpleImputer', 'strategy': 'constant'}. Best is trial 9 with value: 1785.3704913527722.
[I 2023-12-12 15:26:55,958] Trial 185 finished with value: 1898.6831307490568 and parameters: {'model_name': 'SimpleImputer', 'strategy': 'constant'}. Best is trial 9 with value: 1785.3704913527722.
[I 2023-12-12 15:26:56,187] Trial 191 finished with value: 1785.3704913527722 and parameters: {'model_name': 'SimpleImputer', 'strategy': 'mean'}. Best is trial 9 with value: 1785.3704913527722.
[I 2023-12-12 15:26:56,391] Trial 180 finished with value: 1785.3704913527722 and parameters: {'model_name': 'SimpleImputer', 'strategy': 'mean'}. Best is trial 9 with value: 1785.3704913527722.
[I 2023-12-12 15:26:56,589] Trial 193 finished with value: 1898.6831307490568 and parameters: {'model_name': 'SimpleImputer', 'strategy': 'constant'}. Best is trial 9 with value: 1785.3704913527722.
[I 2023-12-12 15:26:56,816] Trial 197 finished with value: 1898.6831307490568 and parameters: {'model_name': 'SimpleImputer', 'strategy': 'constant'}. Best is trial 9 with value: 1785.3704913527722.
[I 2023-12-12 15:26:57,043] Trial 169 finished with value: 1785.3704913527722 and parameters: {'model_name': 'SimpleImputer', 'strategy': 'mean'}. Best is trial 9 with value: 1785.3704913527722.
[I 2023-12-12 15:26:57,261] Trial 195 finished with value: 1898.6831307490568 and parameters: {'model_name': 'SimpleImputer', 'strategy': 'constant'}. Best is trial 9 with value: 1785.3704913527722.
[I 2023-12-12 15:26:57,262] Trial 182 finished with value: 1785.3704913527722 and parameters: {'model_name': 'SimpleImputer', 'strategy': 'mean'}. Best is trial 9 with value: 1785.3704913527722.
[I 2023-12-12 15:26:57,681] Trial 184 finished with value: 1785.3704913527722 and parameters: {'model_name': 'SimpleImputer', 'strategy': 'mean'}. Best is trial 9 with value: 1785.3704913527722.
[I 2023-12-12 15:26:57,895] Trial 196 finished with value: 1898.6831307490568 and parameters: {'model_name': 'SimpleImputer', 'strategy': 'constant'}. Best is trial 9 with value: 1785.3704913527722.
[I 2023-12-12 15:26:58,084] Trial 183 finished with value: 1785.3704913527722 and parameters: {'model_name': 'SimpleImputer', 'strategy': 'mean'}. Best is trial 9 with value: 1785.3704913527722.
[I 2023-12-12 15:26:58,266] Trial 199 finished with value: 1898.6831307490568 and parameters: {'model_name': 'SimpleImputer', 'strategy': 'constant'}. Best is trial 9 with value: 1785.3704913527722.
[I 2023-12-12 15:26:58,502] Trial 186 finished with value: 1785.3704913527722 and parameters: {'model_name': 'SimpleImputer', 'strategy': 'mean'}. Best is trial 9 with value: 1785.3704913527722.
[I 2023-12-12 15:26:58,707] Trial 198 finished with value: 1785.3704913527722 and parameters: {'model_name': 'SimpleImputer', 'strategy': 'mean'}. Best is trial 9 with value: 1785.3704913527722.
[I 2023-12-12 15:26:58,943] Trial 167 finished with value: 1785.3704913527722 and parameters: {'model_name': 'SimpleImputer', 'strategy': 'mean'}. Best is trial 9 with value: 1785.3704913527722.
[I 2023-12-12 15:26:59,154] Trial 192 finished with value: 1785.3704913527722 and parameters: {'model_name': 'SimpleImputer', 'strategy': 'mean'}. Best is trial 9 with value: 1785.3704913527722.
[I 2023-12-12 15:26:59,347] Trial 189 finished with value: 1785.3704913527722 and parameters: {'model_name': 'SimpleImputer', 'strategy': 'mean'}. Best is trial 9 with value: 1785.3704913527722.
