Run: 15
/cm/local/apps/slurm/var/spool/job796125/slurm_script: line 23: /common/ketrong/minconda3/etc/profile.d/conda.sh: No such file or directory
/cm/local/apps/slurm/var/spool/job796125/slurm_script: line 26: $'\nconda create --name tpot2devenv -c conda-forge python=3.10\n': command not found
/cm/local/apps/slurm/var/spool/job796125/slurm_script: line 31: $'\npip install -r requirements.txt\n': command not found
RunStart
2024-04-01 16:44:24.855696: I tensorflow/core/util/port.cc:113] oneDNN custom operations are on. You may see slightly different numerical results due to floating-point round-off errors from different computation orders. To turn them off, set the environment variable `TF_ENABLE_ONEDNN_OPTS=0`.
2024-04-01 16:44:24.891039: E external/local_xla/xla/stream_executor/cuda/cuda_dnn.cc:9261] Unable to register cuDNN factory: Attempting to register factory for plugin cuDNN when one has already been registered
2024-04-01 16:44:24.891060: E external/local_xla/xla/stream_executor/cuda/cuda_fft.cc:607] Unable to register cuFFT factory: Attempting to register factory for plugin cuFFT when one has already been registered
2024-04-01 16:44:24.892181: E external/local_xla/xla/stream_executor/cuda/cuda_blas.cc:1515] Unable to register cuBLAS factory: Attempting to register factory for plugin cuBLAS when one has already been registered
2024-04-01 16:44:24.897669: I tensorflow/core/platform/cpu_feature_guard.cc:182] This TensorFlow binary is optimized to use available CPU instructions in performance-critical operations.
To enable the following instructions: AVX2 AVX512F AVX512_VNNI FMA, in other operations, rebuild TensorFlow with the appropriate compiler flags.
2024-04-01 16:44:27.641924: W tensorflow/compiler/tf2tensorrt/utils/py_utils.cc:38] TF-TRT Warning: Could not find TensorRT
WARNING:tensorflow:From /home/ketrong/miniconda3/envs/tpot2devenv/lib/python3.10/site-packages/tensorflow/python/compat/v2_compat.py:108: disable_resource_variables (from tensorflow.python.ops.variable_scope) is deprecated and will be removed in a future version.
Instructions for updating:
non-resource variables are not supported in the long term
starting loops
working on 
logs/4774/tpot2_base_normal_MNAR_0.9
4.815859794616699
loading data
logs/4774/tpot2_base_normal_MNAR_0.9/data/4774_True.pkl
1023    -13.60770
23445   -24.02530
19181     1.00000
12770    -5.44762
1153     -1.10189
           ...   
29159    -2.44089
817      -2.10280
2043    -23.37550
33649     2.39603
10288     1.99463
Name: y, Length: 36691, dtype: float64
             0   ...   13
0      3.101980  ...  1.0
1      1.632220  ...  1.0
2      3.664120  ...  0.0
3      3.394880  ...  1.0
4     -0.399273  ...  1.0
...         ...  ...  ...
36686 -0.671727  ...  1.0
36687 -4.205610  ...  0.0
36688 -0.265748  ...  1.0
36689  4.792060  ...  0.0
36690  3.989270  ...  1.0

[36691 rows x 14 columns]
            0   ...   13
0     0.208604  ...  1.0
1     3.628990  ...  1.0
2    -2.024360  ...  0.0
3     4.962550  ...  1.0
4     4.190870  ...  0.0
...        ...  ...  ...
4072 -4.408450  ...  0.0
4073  4.660160  ...  1.0
4074 -1.546510  ...  1.0
4075 -3.241630  ...  1.0
4076 -1.836690  ...  1.0

[4077 rows x 14 columns]
running experiment 1/3 - Does large hyperparameter space improve reconstruction accuracy over simple
[I 2024-04-01 16:44:45,938] A new study created in memory with name: no-name-7b445032-1def-4d41-aefe-d1acc33f0dda
[I 2024-04-01 16:44:47,977] Trial 3 finished with value: 101.2912232335881 and parameters: {'model_name': 'SimpleImputer', 'strategy': 'constant'}. Best is trial 3 with value: 101.2912232335881.
[I 2024-04-01 16:44:48,496] Trial 14 finished with value: 101.2912232335881 and parameters: {'model_name': 'SimpleImputer', 'strategy': 'constant'}. Best is trial 3 with value: 101.2912232335881.
[I 2024-04-01 16:44:48,812] Trial 7 finished with value: 101.2912232335881 and parameters: {'model_name': 'SimpleImputer', 'strategy': 'constant'}. Best is trial 3 with value: 101.2912232335881.
[I 2024-04-01 16:44:48,997] Trial 0 finished with value: 91.40968706709549 and parameters: {'model_name': 'SimpleImputer', 'strategy': 'mean'}. Best is trial 0 with value: 91.40968706709549.
[I 2024-04-01 16:44:49,278] Trial 15 finished with value: 101.2912232335881 and parameters: {'model_name': 'SimpleImputer', 'strategy': 'constant'}. Best is trial 0 with value: 91.40968706709549.
[I 2024-04-01 16:44:49,557] Trial 23 finished with value: 101.2912232335881 and parameters: {'model_name': 'SimpleImputer', 'strategy': 'constant'}. Best is trial 0 with value: 91.40968706709549.
[I 2024-04-01 16:44:49,721] Trial 2 finished with value: 91.40968706709549 and parameters: {'model_name': 'SimpleImputer', 'strategy': 'mean'}. Best is trial 0 with value: 91.40968706709549.
[I 2024-04-01 16:44:50,436] Trial 8 finished with value: 91.40968706709549 and parameters: {'model_name': 'SimpleImputer', 'strategy': 'mean'}. Best is trial 0 with value: 91.40968706709549.
[I 2024-04-01 16:44:50,615] Trial 27 finished with value: 101.2912232335881 and parameters: {'model_name': 'SimpleImputer', 'strategy': 'constant'}. Best is trial 0 with value: 91.40968706709549.
[I 2024-04-01 16:44:50,933] Trial 17 finished with value: 91.40968706709549 and parameters: {'model_name': 'SimpleImputer', 'strategy': 'mean'}. Best is trial 0 with value: 91.40968706709549.
[I 2024-04-01 16:44:51,229] Trial 25 finished with value: 91.40968706709549 and parameters: {'model_name': 'SimpleImputer', 'strategy': 'mean'}. Best is trial 0 with value: 91.40968706709549.
[I 2024-04-01 16:44:51,388] Trial 20 finished with value: 91.40968706709549 and parameters: {'model_name': 'SimpleImputer', 'strategy': 'mean'}. Best is trial 0 with value: 91.40968706709549.
[I 2024-04-01 16:44:51,536] Trial 30 finished with value: 101.2912232335881 and parameters: {'model_name': 'SimpleImputer', 'strategy': 'constant'}. Best is trial 0 with value: 91.40968706709549.
[I 2024-04-01 16:44:51,797] Trial 26 finished with value: 91.40968706709549 and parameters: {'model_name': 'SimpleImputer', 'strategy': 'mean'}. Best is trial 0 with value: 91.40968706709549.
[I 2024-04-01 16:44:52,127] Trial 33 finished with value: 101.2912232335881 and parameters: {'model_name': 'SimpleImputer', 'strategy': 'constant'}. Best is trial 0 with value: 91.40968706709549.
[I 2024-04-01 16:44:52,343] Trial 36 finished with value: 101.2912232335881 and parameters: {'model_name': 'SimpleImputer', 'strategy': 'constant'}. Best is trial 0 with value: 91.40968706709549.
[I 2024-04-01 16:44:52,590] Trial 31 finished with value: 91.40968706709549 and parameters: {'model_name': 'SimpleImputer', 'strategy': 'mean'}. Best is trial 0 with value: 91.40968706709549.
[I 2024-04-01 16:44:52,837] Trial 37 finished with value: 91.40968706709549 and parameters: {'model_name': 'SimpleImputer', 'strategy': 'mean'}. Best is trial 0 with value: 91.40968706709549.
[I 2024-04-01 16:44:53,183] Trial 44 finished with value: 101.2912232335881 and parameters: {'model_name': 'SimpleImputer', 'strategy': 'constant'}. Best is trial 0 with value: 91.40968706709549.
[I 2024-04-01 16:44:53,532] Trial 38 finished with value: 91.40968706709549 and parameters: {'model_name': 'SimpleImputer', 'strategy': 'mean'}. Best is trial 0 with value: 91.40968706709549.
[I 2024-04-01 16:44:53,743] Trial 41 finished with value: 91.40968706709549 and parameters: {'model_name': 'SimpleImputer', 'strategy': 'mean'}. Best is trial 0 with value: 91.40968706709549.
[I 2024-04-01 16:44:54,062] Trial 28 finished with value: 91.40968706709549 and parameters: {'model_name': 'SimpleImputer', 'strategy': 'mean'}. Best is trial 0 with value: 91.40968706709549.
[I 2024-04-01 16:44:54,308] Trial 4 finished with value: 101.2912232335881 and parameters: {'model_name': 'SimpleImputer', 'strategy': 'median'}. Best is trial 0 with value: 91.40968706709549.
[I 2024-04-01 16:44:54,682] Trial 35 finished with value: 91.40968706709549 and parameters: {'model_name': 'SimpleImputer', 'strategy': 'mean'}. Best is trial 0 with value: 91.40968706709549.
[I 2024-04-01 16:44:54,944] Trial 42 finished with value: 91.40968706709549 and parameters: {'model_name': 'SimpleImputer', 'strategy': 'mean'}. Best is trial 0 with value: 91.40968706709549.
[I 2024-04-01 16:44:55,133] Trial 18 finished with value: 101.2912232335881 and parameters: {'model_name': 'SimpleImputer', 'strategy': 'median'}. Best is trial 0 with value: 91.40968706709549.
[I 2024-04-01 16:44:55,363] Trial 46 finished with value: 91.40968706709549 and parameters: {'model_name': 'SimpleImputer', 'strategy': 'mean'}. Best is trial 0 with value: 91.40968706709549.
[I 2024-04-01 16:44:55,750] Trial 6 finished with value: 101.2912232335881 and parameters: {'model_name': 'SimpleImputer', 'strategy': 'median'}. Best is trial 0 with value: 91.40968706709549.
[I 2024-04-01 16:44:56,052] Trial 48 finished with value: 101.2912232335881 and parameters: {'model_name': 'SimpleImputer', 'strategy': 'constant'}. Best is trial 0 with value: 91.40968706709549.
[I 2024-04-01 16:44:56,239] Trial 24 finished with value: 101.2912232335881 and parameters: {'model_name': 'SimpleImputer', 'strategy': 'median'}. Best is trial 0 with value: 91.40968706709549.
[I 2024-04-01 16:44:56,461] Trial 16 finished with value: 101.2912232335881 and parameters: {'model_name': 'SimpleImputer', 'strategy': 'median'}. Best is trial 0 with value: 91.40968706709549.
[I 2024-04-01 16:44:56,688] Trial 21 finished with value: 101.2912232335881 and parameters: {'model_name': 'SimpleImputer', 'strategy': 'median'}. Best is trial 0 with value: 91.40968706709549.
[I 2024-04-01 16:44:56,994] Trial 13 finished with value: 101.2912232335881 and parameters: {'model_name': 'SimpleImputer', 'strategy': 'median'}. Best is trial 0 with value: 91.40968706709549.
[I 2024-04-01 16:44:57,509] Trial 29 finished with value: 101.2912232335881 and parameters: {'model_name': 'SimpleImputer', 'strategy': 'median'}. Best is trial 0 with value: 91.40968706709549.
[I 2024-04-01 16:44:57,765] Trial 52 finished with value: 101.2912232335881 and parameters: {'model_name': 'SimpleImputer', 'strategy': 'constant'}. Best is trial 0 with value: 91.40968706709549.
[I 2024-04-01 16:44:58,061] Trial 19 finished with value: 101.2912232335881 and parameters: {'model_name': 'SimpleImputer', 'strategy': 'median'}. Best is trial 0 with value: 91.40968706709549.
[I 2024-04-01 16:44:58,320] Trial 39 finished with value: 101.2912232335881 and parameters: {'model_name': 'SimpleImputer', 'strategy': 'median'}. Best is trial 0 with value: 91.40968706709549.
[I 2024-04-01 16:44:58,539] Trial 32 finished with value: 101.2912232335881 and parameters: {'model_name': 'SimpleImputer', 'strategy': 'median'}. Best is trial 0 with value: 91.40968706709549.
[I 2024-04-01 16:44:58,849] Trial 50 finished with value: 91.40968706709549 and parameters: {'model_name': 'SimpleImputer', 'strategy': 'mean'}. Best is trial 0 with value: 91.40968706709549.
[I 2024-04-01 16:44:59,017] Trial 45 finished with value: 101.2912232335881 and parameters: {'model_name': 'SimpleImputer', 'strategy': 'median'}. Best is trial 0 with value: 91.40968706709549.
[I 2024-04-01 16:44:59,346] Trial 47 finished with value: 101.2912232335881 and parameters: {'model_name': 'SimpleImputer', 'strategy': 'median'}. Best is trial 0 with value: 91.40968706709549.
[I 2024-04-01 16:44:59,676] Trial 34 finished with value: 101.2912232335881 and parameters: {'model_name': 'SimpleImputer', 'strategy': 'median'}. Best is trial 0 with value: 91.40968706709549.
[I 2024-04-01 16:44:59,992] Trial 43 finished with value: 101.2912232335881 and parameters: {'model_name': 'SimpleImputer', 'strategy': 'median'}. Best is trial 0 with value: 91.40968706709549.
[I 2024-04-01 16:45:01,584] Trial 53 finished with value: 101.2912232335881 and parameters: {'model_name': 'SimpleImputer', 'strategy': 'median'}. Best is trial 0 with value: 91.40968706709549.
[I 2024-04-01 16:45:01,882] Trial 51 finished with value: 101.2912232335881 and parameters: {'model_name': 'SimpleImputer', 'strategy': 'median'}. Best is trial 0 with value: 91.40968706709549.
[I 2024-04-01 16:45:02,458] Trial 56 finished with value: 101.2912232335881 and parameters: {'model_name': 'SimpleImputer', 'strategy': 'median'}. Best is trial 0 with value: 91.40968706709549.
[I 2024-04-01 16:45:03,044] Trial 64 finished with value: 101.2912232335881 and parameters: {'model_name': 'SimpleImputer', 'strategy': 'median'}. Best is trial 0 with value: 91.40968706709549.
[I 2024-04-01 16:45:03,288] Trial 61 finished with value: 101.2912232335881 and parameters: {'model_name': 'SimpleImputer', 'strategy': 'median'}. Best is trial 0 with value: 91.40968706709549.
[I 2024-04-01 16:45:03,538] Trial 58 finished with value: 101.2912232335881 and parameters: {'model_name': 'SimpleImputer', 'strategy': 'median'}. Best is trial 0 with value: 91.40968706709549.
[I 2024-04-01 16:45:03,808] Trial 62 finished with value: 101.2912232335881 and parameters: {'model_name': 'SimpleImputer', 'strategy': 'median'}. Best is trial 0 with value: 91.40968706709549.
[I 2024-04-01 16:45:04,072] Trial 60 finished with value: 101.2912232335881 and parameters: {'model_name': 'SimpleImputer', 'strategy': 'median'}. Best is trial 0 with value: 91.40968706709549.
[I 2024-04-01 16:45:04,467] Trial 59 finished with value: 101.2912232335881 and parameters: {'model_name': 'SimpleImputer', 'strategy': 'median'}. Best is trial 0 with value: 91.40968706709549.
[I 2024-04-01 16:45:04,814] Trial 69 finished with value: 101.2912232335881 and parameters: {'model_name': 'SimpleImputer', 'strategy': 'median'}. Best is trial 0 with value: 91.40968706709549.
[I 2024-04-01 16:45:05,120] Trial 68 finished with value: 101.2912232335881 and parameters: {'model_name': 'SimpleImputer', 'strategy': 'median'}. Best is trial 0 with value: 91.40968706709549.
[I 2024-04-01 16:45:05,769] Trial 1 finished with value: 101.2912232335881 and parameters: {'model_name': 'SimpleImputer', 'strategy': 'most_frequent'}. Best is trial 0 with value: 91.40968706709549.
[I 2024-04-01 16:45:06,466] Trial 10 finished with value: 101.2912232335881 and parameters: {'model_name': 'SimpleImputer', 'strategy': 'most_frequent'}. Best is trial 0 with value: 91.40968706709549.
[I 2024-04-01 16:45:07,205] Trial 5 finished with value: 101.2912232335881 and parameters: {'model_name': 'SimpleImputer', 'strategy': 'most_frequent'}. Best is trial 0 with value: 91.40968706709549.
[I 2024-04-01 16:45:07,406] Trial 9 finished with value: 101.2912232335881 and parameters: {'model_name': 'SimpleImputer', 'strategy': 'most_frequent'}. Best is trial 0 with value: 91.40968706709549.
[I 2024-04-01 16:45:07,737] Trial 11 finished with value: 101.2912232335881 and parameters: {'model_name': 'SimpleImputer', 'strategy': 'most_frequent'}. Best is trial 0 with value: 91.40968706709549.
[I 2024-04-01 16:45:08,050] Trial 12 finished with value: 101.2912232335881 and parameters: {'model_name': 'SimpleImputer', 'strategy': 'most_frequent'}. Best is trial 0 with value: 91.40968706709549.
[I 2024-04-01 16:45:08,609] Trial 40 finished with value: 101.2912232335881 and parameters: {'model_name': 'SimpleImputer', 'strategy': 'most_frequent'}. Best is trial 0 with value: 91.40968706709549.
[I 2024-04-01 16:45:09,328] Trial 22 finished with value: 101.2912232335881 and parameters: {'model_name': 'SimpleImputer', 'strategy': 'most_frequent'}. Best is trial 0 with value: 91.40968706709549.
[I 2024-04-01 16:45:10,144] Trial 54 finished with value: 101.2912232335881 and parameters: {'model_name': 'SimpleImputer', 'strategy': 'most_frequent'}. Best is trial 0 with value: 91.40968706709549.
[I 2024-04-01 16:45:11,290] Trial 49 finished with value: 101.2912232335881 and parameters: {'model_name': 'SimpleImputer', 'strategy': 'most_frequent'}. Best is trial 0 with value: 91.40968706709549.
[I 2024-04-01 16:45:11,764] Trial 106 finished with value: 91.40968706709549 and parameters: {'model_name': 'SimpleImputer', 'strategy': 'mean'}. Best is trial 0 with value: 91.40968706709549.
[I 2024-04-01 16:45:12,332] Trial 108 finished with value: 91.40968706709549 and parameters: {'model_name': 'SimpleImputer', 'strategy': 'mean'}. Best is trial 0 with value: 91.40968706709549.
[I 2024-04-01 16:45:12,669] Trial 71 finished with value: 101.2912232335881 and parameters: {'model_name': 'SimpleImputer', 'strategy': 'most_frequent'}. Best is trial 0 with value: 91.40968706709549.
[I 2024-04-01 16:45:12,864] Trial 55 finished with value: 101.2912232335881 and parameters: {'model_name': 'SimpleImputer', 'strategy': 'most_frequent'}. Best is trial 0 with value: 91.40968706709549.
[I 2024-04-01 16:45:13,158] Trial 107 finished with value: 91.40968706709549 and parameters: {'model_name': 'SimpleImputer', 'strategy': 'mean'}. Best is trial 0 with value: 91.40968706709549.
[I 2024-04-01 16:45:13,500] Trial 66 finished with value: 101.2912232335881 and parameters: {'model_name': 'SimpleImputer', 'strategy': 'most_frequent'}. Best is trial 0 with value: 91.40968706709549.
[I 2024-04-01 16:45:13,747] Trial 70 finished with value: 101.2912232335881 and parameters: {'model_name': 'SimpleImputer', 'strategy': 'most_frequent'}. Best is trial 0 with value: 91.40968706709549.
[I 2024-04-01 16:45:13,990] Trial 109 finished with value: 91.40968706709549 and parameters: {'model_name': 'SimpleImputer', 'strategy': 'mean'}. Best is trial 0 with value: 91.40968706709549.
[I 2024-04-01 16:45:14,284] Trial 72 finished with value: 101.2912232335881 and parameters: {'model_name': 'SimpleImputer', 'strategy': 'most_frequent'}. Best is trial 0 with value: 91.40968706709549.
[I 2024-04-01 16:45:14,477] Trial 57 finished with value: 101.2912232335881 and parameters: {'model_name': 'SimpleImputer', 'strategy': 'most_frequent'}. Best is trial 0 with value: 91.40968706709549.
[I 2024-04-01 16:45:14,637] Trial 65 finished with value: 101.2912232335881 and parameters: {'model_name': 'SimpleImputer', 'strategy': 'most_frequent'}. Best is trial 0 with value: 91.40968706709549.
[I 2024-04-01 16:45:14,853] Trial 73 finished with value: 101.2912232335881 and parameters: {'model_name': 'SimpleImputer', 'strategy': 'most_frequent'}. Best is trial 0 with value: 91.40968706709549.
[I 2024-04-01 16:45:15,506] Trial 76 finished with value: 101.2912232335881 and parameters: {'model_name': 'SimpleImputer', 'strategy': 'most_frequent'}. Best is trial 0 with value: 91.40968706709549.
[I 2024-04-01 16:45:15,856] Trial 78 finished with value: 101.2912232335881 and parameters: {'model_name': 'SimpleImputer', 'strategy': 'most_frequent'}. Best is trial 0 with value: 91.40968706709549.
[I 2024-04-01 16:45:16,186] Trial 77 finished with value: 101.2912232335881 and parameters: {'model_name': 'SimpleImputer', 'strategy': 'most_frequent'}. Best is trial 0 with value: 91.40968706709549.
[I 2024-04-01 16:45:16,393] Trial 80 finished with value: 101.2912232335881 and parameters: {'model_name': 'SimpleImputer', 'strategy': 'most_frequent'}. Best is trial 0 with value: 91.40968706709549.
[I 2024-04-01 16:45:16,563] Trial 63 finished with value: 101.2912232335881 and parameters: {'model_name': 'SimpleImputer', 'strategy': 'most_frequent'}. Best is trial 0 with value: 91.40968706709549.
[I 2024-04-01 16:45:16,822] Trial 67 finished with value: 101.2912232335881 and parameters: {'model_name': 'SimpleImputer', 'strategy': 'most_frequent'}. Best is trial 0 with value: 91.40968706709549.
[I 2024-04-01 16:45:17,123] Trial 75 finished with value: 101.2912232335881 and parameters: {'model_name': 'SimpleImputer', 'strategy': 'most_frequent'}. Best is trial 0 with value: 91.40968706709549.
[I 2024-04-01 16:45:17,305] Trial 82 finished with value: 101.2912232335881 and parameters: {'model_name': 'SimpleImputer', 'strategy': 'most_frequent'}. Best is trial 0 with value: 91.40968706709549.
[I 2024-04-01 16:45:17,471] Trial 110 finished with value: 91.40968706709549 and parameters: {'model_name': 'SimpleImputer', 'strategy': 'mean'}. Best is trial 0 with value: 91.40968706709549.
[I 2024-04-01 16:45:17,715] Trial 79 finished with value: 101.2912232335881 and parameters: {'model_name': 'SimpleImputer', 'strategy': 'most_frequent'}. Best is trial 0 with value: 91.40968706709549.
[I 2024-04-01 16:45:18,261] Trial 74 finished with value: 101.2912232335881 and parameters: {'model_name': 'SimpleImputer', 'strategy': 'most_frequent'}. Best is trial 0 with value: 91.40968706709549.
[I 2024-04-01 16:45:18,718] Trial 87 finished with value: 101.2912232335881 and parameters: {'model_name': 'SimpleImputer', 'strategy': 'most_frequent'}. Best is trial 0 with value: 91.40968706709549.
[I 2024-04-01 16:45:18,995] Trial 86 finished with value: 101.2912232335881 and parameters: {'model_name': 'SimpleImputer', 'strategy': 'most_frequent'}. Best is trial 0 with value: 91.40968706709549.
[I 2024-04-01 16:45:19,179] Trial 83 finished with value: 101.2912232335881 and parameters: {'model_name': 'SimpleImputer', 'strategy': 'most_frequent'}. Best is trial 0 with value: 91.40968706709549.
[I 2024-04-01 16:45:19,690] Trial 81 finished with value: 101.2912232335881 and parameters: {'model_name': 'SimpleImputer', 'strategy': 'most_frequent'}. Best is trial 0 with value: 91.40968706709549.
[I 2024-04-01 16:45:19,910] Trial 84 finished with value: 101.2912232335881 and parameters: {'model_name': 'SimpleImputer', 'strategy': 'most_frequent'}. Best is trial 0 with value: 91.40968706709549.
[I 2024-04-01 16:45:20,178] Trial 111 finished with value: 91.40968706709549 and parameters: {'model_name': 'SimpleImputer', 'strategy': 'mean'}. Best is trial 0 with value: 91.40968706709549.
[I 2024-04-01 16:45:20,681] Trial 112 finished with value: 91.40968706709549 and parameters: {'model_name': 'SimpleImputer', 'strategy': 'mean'}. Best is trial 0 with value: 91.40968706709549.
