[I 2024-02-29 15:29:43,821] Trial 94 finished with value: 28.46328138754428 and parameters: {'model_name': 'RandomForestImputer', 'max_iter': 95, 'decreasing': False, 'min_samples_split': 0.9, 'min_samples_leaf': 0.9, 'max_features': 0.1, 'warm_start': True}. Best is trial 7 with value: 6.105847551979725.
[I 2024-02-29 15:29:57,025] Trial 46 finished with value: 8.615763259593376 and parameters: {'model_name': 'RandomForestImputer', 'max_iter': 8, 'decreasing': True, 'min_samples_split': 0.1, 'min_samples_leaf': 0.9, 'max_features': 0.4, 'warm_start': False}. Best is trial 7 with value: 6.105847551979725.
[I 2024-02-29 15:29:59,725] Trial 102 finished with value: 28.449555255272294 and parameters: {'model_name': 'RandomForestImputer', 'max_iter': 85, 'decreasing': False, 'min_samples_split': 1.0, 'min_samples_leaf': 0.9, 'max_features': 0.1, 'warm_start': True}. Best is trial 7 with value: 6.105847551979725.
[I 2024-02-29 15:30:23,609] Trial 95 finished with value: 28.445665219475803 and parameters: {'model_name': 'RandomForestImputer', 'max_iter': 98, 'decreasing': False, 'min_samples_split': 1.0, 'min_samples_leaf': 0.9, 'max_features': 0.1, 'warm_start': True}. Best is trial 7 with value: 6.105847551979725.
[I 2024-02-29 15:30:29,212] Trial 83 finished with value: 28.446113679525666 and parameters: {'model_name': 'RandomForestImputer', 'max_iter': 98, 'decreasing': False, 'min_samples_split': 1.0, 'min_samples_leaf': 0.9, 'max_features': 0.1, 'warm_start': True}. Best is trial 7 with value: 6.105847551979725.
[I 2024-02-29 15:30:42,600] Trial 87 finished with value: 28.434239055214995 and parameters: {'model_name': 'RandomForestImputer', 'max_iter': 92, 'decreasing': False, 'min_samples_split': 1.0, 'min_samples_leaf': 0.9, 'max_features': 0.1, 'warm_start': True}. Best is trial 7 with value: 6.105847551979725.
[I 2024-02-29 15:30:45,079] Trial 148 finished with value: 6.105847551979725 and parameters: {'model_name': 'SimpleImputer', 'strategy': 'median'}. Best is trial 7 with value: 6.105847551979725.
[I 2024-02-29 15:36:17,811] Trial 6 finished with value: 13.739023465679256 and parameters: {'model_name': 'IterativeImputer', 'sample_posterior': True, 'initial_strategy': 'most_frequent', 'imputation_order': 'ascending'}. Best is trial 7 with value: 6.105847551979725.
[I 2024-02-29 15:36:19,984] Trial 150 finished with value: 6.105847551979725 and parameters: {'model_name': 'SimpleImputer', 'strategy': 'median'}. Best is trial 7 with value: 6.105847551979725.
[I 2024-02-29 15:36:21,052] Trial 37 finished with value: 14.054501337139698 and parameters: {'model_name': 'IterativeImputer', 'sample_posterior': True, 'initial_strategy': 'mean', 'imputation_order': 'ascending'}. Best is trial 7 with value: 6.105847551979725.
[I 2024-02-29 15:36:23,307] Trial 40 finished with value: 13.537887210909371 and parameters: {'model_name': 'IterativeImputer', 'sample_posterior': True, 'initial_strategy': 'constant', 'imputation_order': 'roman'}. Best is trial 7 with value: 6.105847551979725.
[I 2024-02-29 15:36:26,371] Trial 153 finished with value: 6.105847551979725 and parameters: {'model_name': 'SimpleImputer', 'strategy': 'median'}. Best is trial 7 with value: 6.105847551979725.
[I 2024-02-29 15:36:27,827] Trial 3 finished with value: 14.036934917415277 and parameters: {'model_name': 'IterativeImputer', 'sample_posterior': True, 'initial_strategy': 'mean', 'imputation_order': 'random'}. Best is trial 7 with value: 6.105847551979725.
[I 2024-02-29 15:36:30,156] Trial 154 finished with value: 6.105847551979725 and parameters: {'model_name': 'SimpleImputer', 'strategy': 'median'}. Best is trial 7 with value: 6.105847551979725.
[I 2024-02-29 15:36:31,265] Trial 22 finished with value: 13.832473646494819 and parameters: {'model_name': 'IterativeImputer', 'sample_posterior': True, 'initial_strategy': 'constant', 'imputation_order': 'ascending'}. Best is trial 7 with value: 6.105847551979725.
[I 2024-02-29 15:36:33,527] Trial 157 finished with value: 6.105847551979725 and parameters: {'model_name': 'SimpleImputer', 'strategy': 'median'}. Best is trial 7 with value: 6.105847551979725.
[I 2024-02-29 15:36:35,381] Trial 9 finished with value: 14.018328901201235 and parameters: {'model_name': 'IterativeImputer', 'sample_posterior': True, 'initial_strategy': 'constant', 'imputation_order': 'arabic'}. Best is trial 7 with value: 6.105847551979725.
[I 2024-02-29 15:36:37,103] Trial 158 finished with value: 6.105847551979725 and parameters: {'model_name': 'SimpleImputer', 'strategy': 'median'}. Best is trial 7 with value: 6.105847551979725.
[I 2024-02-29 15:36:38,618] Trial 159 finished with value: 6.105847551979725 and parameters: {'model_name': 'SimpleImputer', 'strategy': 'median'}. Best is trial 7 with value: 6.105847551979725.
[I 2024-02-29 15:36:43,595] Trial 27 finished with value: 14.149197577245554 and parameters: {'model_name': 'IterativeImputer', 'sample_posterior': True, 'initial_strategy': 'mean', 'imputation_order': 'random'}. Best is trial 7 with value: 6.105847551979725.
[I 2024-02-29 15:36:45,966] Trial 11 finished with value: 14.148351747768151 and parameters: {'model_name': 'IterativeImputer', 'sample_posterior': True, 'initial_strategy': 'median', 'imputation_order': 'descending'}. Best is trial 7 with value: 6.105847551979725.
[I 2024-02-29 15:36:47,818] Trial 41 finished with value: 14.33824363530841 and parameters: {'model_name': 'IterativeImputer', 'sample_posterior': True, 'initial_strategy': 'constant', 'imputation_order': 'random'}. Best is trial 7 with value: 6.105847551979725.
[I 2024-02-29 15:36:56,640] Trial 65 finished with value: 14.215107531590117 and parameters: {'model_name': 'IterativeImputer', 'sample_posterior': True, 'initial_strategy': 'most_frequent', 'imputation_order': 'ascending'}. Best is trial 7 with value: 6.105847551979725.
[I 2024-02-29 15:36:58,439] Trial 63 finished with value: 14.169560850247715 and parameters: {'model_name': 'IterativeImputer', 'sample_posterior': True, 'initial_strategy': 'constant', 'imputation_order': 'random'}. Best is trial 7 with value: 6.105847551979725.
[I 2024-02-29 15:37:01,165] Trial 68 finished with value: 13.955134039823296 and parameters: {'model_name': 'IterativeImputer', 'sample_posterior': True, 'initial_strategy': 'most_frequent', 'imputation_order': 'roman'}. Best is trial 7 with value: 6.105847551979725.
[I 2024-02-29 15:37:03,260] Trial 167 finished with value: 6.105847551979725 and parameters: {'model_name': 'SimpleImputer', 'strategy': 'median'}. Best is trial 7 with value: 6.105847551979725.
[I 2024-02-29 15:37:05,261] Trial 168 finished with value: 6.105847551979725 and parameters: {'model_name': 'SimpleImputer', 'strategy': 'median'}. Best is trial 7 with value: 6.105847551979725.
[I 2024-02-29 15:37:07,302] Trial 169 finished with value: 6.105847551979725 and parameters: {'model_name': 'SimpleImputer', 'strategy': 'median'}. Best is trial 7 with value: 6.105847551979725.
[I 2024-02-29 15:37:08,730] Trial 170 finished with value: 6.105847551979725 and parameters: {'model_name': 'SimpleImputer', 'strategy': 'median'}. Best is trial 7 with value: 6.105847551979725.
[I 2024-02-29 15:37:10,610] Trial 171 finished with value: 6.105847551979725 and parameters: {'model_name': 'SimpleImputer', 'strategy': 'median'}. Best is trial 7 with value: 6.105847551979725.
[I 2024-02-29 15:37:12,447] Trial 172 finished with value: 6.105847551979725 and parameters: {'model_name': 'SimpleImputer', 'strategy': 'median'}. Best is trial 7 with value: 6.105847551979725.
[I 2024-02-29 15:37:13,830] Trial 67 finished with value: 14.101121358315941 and parameters: {'model_name': 'IterativeImputer', 'sample_posterior': True, 'initial_strategy': 'mean', 'imputation_order': 'random'}. Best is trial 7 with value: 6.105847551979725.
[I 2024-02-29 15:37:17,728] Trial 73 finished with value: 13.877361835693605 and parameters: {'model_name': 'IterativeImputer', 'sample_posterior': True, 'initial_strategy': 'constant', 'imputation_order': 'descending'}. Best is trial 7 with value: 6.105847551979725.
[I 2024-02-29 15:37:19,771] Trial 71 finished with value: 14.788094587154191 and parameters: {'model_name': 'IterativeImputer', 'sample_posterior': True, 'initial_strategy': 'most_frequent', 'imputation_order': 'ascending'}. Best is trial 7 with value: 6.105847551979725.
[I 2024-02-29 15:37:39,632] Trial 4 finished with value: 8.594534335582509 and parameters: {'model_name': 'RandomForestImputer', 'max_iter': 13, 'decreasing': True, 'min_samples_split': 0.6000000000000001, 'min_samples_leaf': 0.5, 'max_features': 0.2, 'warm_start': False}. Best is trial 7 with value: 6.105847551979725.
[I 2024-02-29 15:37:58,644] Trial 175 finished with value: 9.979182623997636 and parameters: {'model_name': 'KNNImputer', 'weights': 'uniform', 'keep_empty_features': False}. Best is trial 7 with value: 6.105847551979725.
[I 2024-02-29 15:38:01,285] Trial 176 finished with value: 9.979182623997636 and parameters: {'model_name': 'KNNImputer', 'weights': 'uniform', 'keep_empty_features': False}. Best is trial 7 with value: 6.105847551979725.
[I 2024-02-29 15:38:03,107] Trial 179 finished with value: 6.105847551979725 and parameters: {'model_name': 'SimpleImputer', 'strategy': 'median'}. Best is trial 7 with value: 6.105847551979725.
[I 2024-02-29 15:38:15,886] Trial 78 finished with value: 8.619402254715894 and parameters: {'model_name': 'RandomForestImputer', 'max_iter': 12, 'decreasing': True, 'min_samples_split': 0.8, 'min_samples_leaf': 0.8, 'max_features': 0.30000000000000004, 'warm_start': False}. Best is trial 7 with value: 6.105847551979725.
[I 2024-02-29 15:39:45,350] Trial 62 finished with value: 8.600903244745776 and parameters: {'model_name': 'RandomForestImputer', 'max_iter': 20, 'decreasing': False, 'min_samples_split': 0.30000000000000004, 'min_samples_leaf': 0.6, 'max_features': 0.2, 'warm_start': False}. Best is trial 7 with value: 6.105847551979725.
[I 2024-02-29 15:41:49,300] Trial 0 finished with value: 8.614509308183688 and parameters: {'model_name': 'RandomForestImputer', 'max_iter': 16, 'decreasing': True, 'min_samples_split': 0.2, 'min_samples_leaf': 0.1, 'max_features': 0.2, 'warm_start': False}. Best is trial 7 with value: 6.105847551979725.
[I 2024-02-29 15:50:12,133] Trial 133 finished with value: 8.625760186845456 and parameters: {'model_name': 'RandomForestImputer', 'max_iter': 18, 'decreasing': False, 'min_samples_split': 1.0, 'min_samples_leaf': 0.6, 'max_features': 0.9, 'warm_start': False}. Best is trial 7 with value: 6.105847551979725.
[I 2024-02-29 15:51:18,889] Trial 34 finished with value: 8.62051095700765 and parameters: {'model_name': 'RandomForestImputer', 'max_iter': 26, 'decreasing': True, 'min_samples_split': 0.6000000000000001, 'min_samples_leaf': 0.1, 'max_features': 0.9, 'warm_start': False}. Best is trial 7 with value: 6.105847551979725.
[I 2024-02-29 15:57:32,957] Trial 76 finished with value: 8.624329630844851 and parameters: {'model_name': 'RandomForestImputer', 'max_iter': 43, 'decreasing': False, 'min_samples_split': 0.8, 'min_samples_leaf': 0.30000000000000004, 'max_features': 0.6, 'warm_start': False}. Best is trial 7 with value: 6.105847551979725.
[I 2024-02-29 15:59:57,558] Trial 162 finished with value: inf and parameters: {'model_name': 'GAIN', 'batch_size': 848, 'hint_rate': 0.05, 'alpha': 99, 'iterations': 10041}. Best is trial 7 with value: 6.105847551979725.
[I 2024-02-29 15:59:59,249] Trial 187 finished with value: 6.105847551979725 and parameters: {'model_name': 'SimpleImputer', 'strategy': 'median'}. Best is trial 7 with value: 6.105847551979725.
[I 2024-02-29 16:00:00,690] Trial 188 finished with value: 6.105847551979725 and parameters: {'model_name': 'SimpleImputer', 'strategy': 'median'}. Best is trial 7 with value: 6.105847551979725.
[I 2024-02-29 16:00:02,413] Trial 189 finished with value: 6.105847551979725 and parameters: {'model_name': 'SimpleImputer', 'strategy': 'median'}. Best is trial 7 with value: 6.105847551979725.
[I 2024-02-29 16:00:03,996] Trial 190 finished with value: 6.105847551979725 and parameters: {'model_name': 'SimpleImputer', 'strategy': 'median'}. Best is trial 7 with value: 6.105847551979725.
[I 2024-02-29 16:00:05,041] Trial 191 finished with value: 8.605524315720954 and parameters: {'model_name': 'SimpleImputer', 'strategy': 'mean'}. Best is trial 7 with value: 6.105847551979725.
[I 2024-02-29 16:00:06,384] Trial 192 finished with value: 6.105847551979725 and parameters: {'model_name': 'SimpleImputer', 'strategy': 'median'}. Best is trial 7 with value: 6.105847551979725.
[I 2024-02-29 16:00:08,198] Trial 193 finished with value: 6.105847551979725 and parameters: {'model_name': 'SimpleImputer', 'strategy': 'median'}. Best is trial 7 with value: 6.105847551979725.
[I 2024-02-29 16:00:09,606] Trial 194 finished with value: 6.105847551979725 and parameters: {'model_name': 'SimpleImputer', 'strategy': 'median'}. Best is trial 7 with value: 6.105847551979725.
[I 2024-02-29 16:00:11,433] Trial 195 finished with value: 23.03195297873517 and parameters: {'model_name': 'SimpleImputer', 'strategy': 'most_frequent'}. Best is trial 7 with value: 6.105847551979725.
[I 2024-02-29 16:00:13,006] Trial 196 finished with value: 6.105847551979725 and parameters: {'model_name': 'SimpleImputer', 'strategy': 'median'}. Best is trial 7 with value: 6.105847551979725.
[I 2024-02-29 16:00:14,730] Trial 197 finished with value: 6.105847551979725 and parameters: {'model_name': 'SimpleImputer', 'strategy': 'median'}. Best is trial 7 with value: 6.105847551979725.
[I 2024-02-29 16:00:16,541] Trial 198 finished with value: 6.105847551979725 and parameters: {'model_name': 'SimpleImputer', 'strategy': 'median'}. Best is trial 7 with value: 6.105847551979725.
[I 2024-02-29 16:00:17,943] Trial 199 finished with value: 6.105847551979725 and parameters: {'model_name': 'SimpleImputer', 'strategy': 'median'}. Best is trial 7 with value: 6.105847551979725.
[I 2024-02-29 16:15:21,470] Trial 100 finished with value: 8.612466727249366 and parameters: {'model_name': 'RandomForestImputer', 'max_iter': 61, 'decreasing': False, 'min_samples_split': 1.0, 'min_samples_leaf': 0.9, 'max_features': 0.1, 'warm_start': False}. Best is trial 7 with value: 6.105847551979725.
[I 2024-02-29 16:19:52,849] Trial 97 finished with value: 8.606363937041479 and parameters: {'model_name': 'RandomForestImputer', 'max_iter': 70, 'decreasing': False, 'min_samples_split': 1.0, 'min_samples_leaf': 0.9, 'max_features': 0.1, 'warm_start': False}. Best is trial 7 with value: 6.105847551979725.
[I 2024-02-29 16:24:01,983] Trial 105 finished with value: 8.61385419332696 and parameters: {'model_name': 'RandomForestImputer', 'max_iter': 80, 'decreasing': False, 'min_samples_split': 1.0, 'min_samples_leaf': 0.9, 'max_features': 0.1, 'warm_start': False}. Best is trial 7 with value: 6.105847551979725.
[I 2024-02-29 16:24:50,705] Trial 53 finished with value: 8.614328486080355 and parameters: {'model_name': 'RandomForestImputer', 'max_iter': 83, 'decreasing': False, 'min_samples_split': 0.6000000000000001, 'min_samples_leaf': 0.5, 'max_features': 0.6, 'warm_start': False}. Best is trial 7 with value: 6.105847551979725.
[I 2024-02-29 16:25:16,937] Trial 178 finished with value: inf and parameters: {'model_name': 'GAIN', 'batch_size': 859, 'hint_rate': 0.02, 'alpha': 97, 'iterations': 22016}. Best is trial 7 with value: 6.105847551979725.
[I 2024-02-29 16:27:18,583] Trial 66 finished with value: 13.579475417952285 and parameters: {'model_name': 'GAIN', 'batch_size': 2, 'hint_rate': 0.44, 'alpha': 30, 'iterations': 3755}. Best is trial 7 with value: 6.105847551979725.
[I 2024-02-29 16:29:25,819] Trial 107 finished with value: 8.61164687076919 and parameters: {'model_name': 'RandomForestImputer', 'max_iter': 77, 'decreasing': False, 'min_samples_split': 0.9, 'min_samples_leaf': 0.9, 'max_features': 0.1, 'warm_start': False}. Best is trial 7 with value: 6.105847551979725.
[I 2024-02-29 16:32:18,460] Trial 180 finished with value: inf and parameters: {'model_name': 'GAIN', 'batch_size': 631, 'hint_rate': 0.01, 'alpha': 99, 'iterations': 26844}. Best is trial 7 with value: 6.105847551979725.
[I 2024-02-29 16:33:05,740] Trial 38 finished with value: 12.571882680261364 and parameters: {'model_name': 'GAIN', 'batch_size': 1, 'hint_rate': 0.48000000000000004, 'alpha': 70, 'iterations': 4258}. Best is trial 7 with value: 6.105847551979725.
[I 2024-02-29 16:34:37,065] Trial 155 finished with value: inf and parameters: {'model_name': 'GAIN', 'batch_size': 803, 'hint_rate': 0.03, 'alpha': 97, 'iterations': 28702}. Best is trial 7 with value: 6.105847551979725.
[I 2024-02-29 16:37:22,532] Trial 116 finished with value: 8.614737888588191 and parameters: {'model_name': 'RandomForestImputer', 'max_iter': 92, 'decreasing': False, 'min_samples_split': 1.0, 'min_samples_leaf': 0.8, 'max_features': 0.1, 'warm_start': False}. Best is trial 7 with value: 6.105847551979725.
[I 2024-02-29 16:40:40,333] Trial 144 finished with value: inf and parameters: {'model_name': 'GAIN', 'batch_size': 927, 'hint_rate': 0.060000000000000005, 'alpha': 99, 'iterations': 33865}. Best is trial 7 with value: 6.105847551979725.
[I 2024-02-29 16:41:36,464] Trial 106 finished with value: 8.609509576586719 and parameters: {'model_name': 'RandomForestImputer', 'max_iter': 96, 'decreasing': False, 'min_samples_split': 0.9, 'min_samples_leaf': 0.9, 'max_features': 0.1, 'warm_start': False}. Best is trial 7 with value: 6.105847551979725.
[I 2024-02-29 16:44:30,418] Trial 125 finished with value: 8.60653607285995 and parameters: {'model_name': 'RandomForestImputer', 'max_iter': 95, 'decreasing': False, 'min_samples_split': 1.0, 'min_samples_leaf': 0.8, 'max_features': 0.1, 'warm_start': False}. Best is trial 7 with value: 6.105847551979725.
[I 2024-02-29 16:47:34,315] Trial 36 finished with value: inf and parameters: {'model_name': 'GAIN', 'batch_size': 517, 'hint_rate': 0.23, 'alpha': 34, 'iterations': 43296}. Best is trial 7 with value: 6.105847551979725.
[I 2024-02-29 16:57:49,430] Trial 146 finished with value: inf and parameters: {'model_name': 'GAIN', 'batch_size': 846, 'hint_rate': 0.01, 'alpha': 98, 'iterations': 48363}. Best is trial 7 with value: 6.105847551979725.
[I 2024-02-29 17:03:58,127] Trial 142 finished with value: inf and parameters: {'model_name': 'GAIN', 'batch_size': 237, 'hint_rate': 0.060000000000000005, 'alpha': 100, 'iterations': 58635}. Best is trial 7 with value: 6.105847551979725.
[I 2024-02-29 17:07:57,393] Trial 47 finished with value: inf and parameters: {'model_name': 'GAIN', 'batch_size': 56, 'hint_rate': 0.76, 'alpha': 44, 'iterations': 36386}. Best is trial 7 with value: 6.105847551979725.
[I 2024-02-29 17:10:41,512] Trial 177 finished with value: inf and parameters: {'model_name': 'GAIN', 'batch_size': 460, 'hint_rate': 0.01, 'alpha': 100, 'iterations': 60709}. Best is trial 7 with value: 6.105847551979725.
[I 2024-02-29 17:12:40,524] Trial 164 finished with value: inf and parameters: {'model_name': 'GAIN', 'batch_size': 556, 'hint_rate': 0.68, 'alpha': 100, 'iterations': 62295}. Best is trial 7 with value: 6.105847551979725.
[I 2024-02-29 17:16:18,452] Trial 174 finished with value: inf and parameters: {'model_name': 'GAIN', 'batch_size': 144, 'hint_rate': 0.01, 'alpha': 96, 'iterations': 74567}. Best is trial 7 with value: 6.105847551979725.
[I 2024-02-29 17:18:29,782] Trial 136 finished with value: inf and parameters: {'model_name': 'GAIN', 'batch_size': 907, 'hint_rate': 0.02, 'alpha': 94, 'iterations': 68442}. Best is trial 7 with value: 6.105847551979725.
[I 2024-02-29 17:19:14,299] Trial 181 finished with value: inf and parameters: {'model_name': 'GAIN', 'batch_size': 762, 'hint_rate': 0.09, 'alpha': 100, 'iterations': 67988}. Best is trial 7 with value: 6.105847551979725.
[I 2024-02-29 17:20:06,224] Trial 152 finished with value: inf and parameters: {'model_name': 'GAIN', 'batch_size': 841, 'hint_rate': 0.05, 'alpha': 99, 'iterations': 69269}. Best is trial 7 with value: 6.105847551979725.
[I 2024-02-29 17:20:37,530] Trial 185 finished with value: inf and parameters: {'model_name': 'GAIN', 'batch_size': 889, 'hint_rate': 0.03, 'alpha': 98, 'iterations': 63496}. Best is trial 7 with value: 6.105847551979725.
[I 2024-02-29 17:23:23,680] Trial 143 finished with value: inf and parameters: {'model_name': 'GAIN', 'batch_size': 776, 'hint_rate': 0.04, 'alpha': 99, 'iterations': 74589}. Best is trial 7 with value: 6.105847551979725.
[I 2024-02-29 17:24:23,805] Trial 160 finished with value: inf and parameters: {'model_name': 'GAIN', 'batch_size': 504, 'hint_rate': 0.11, 'alpha': 99, 'iterations': 76663}. Best is trial 7 with value: 6.105847551979725.
[I 2024-02-29 17:24:47,786] Trial 183 finished with value: inf and parameters: {'model_name': 'GAIN', 'batch_size': 912, 'hint_rate': 0.05, 'alpha': 100, 'iterations': 72544}. Best is trial 7 with value: 6.105847551979725.
[I 2024-02-29 17:25:26,632] Trial 141 finished with value: inf and parameters: {'model_name': 'GAIN', 'batch_size': 957, 'hint_rate': 0.03, 'alpha': 97, 'iterations': 76379}. Best is trial 7 with value: 6.105847551979725.
[I 2024-02-29 17:26:49,003] Trial 149 finished with value: inf and parameters: {'model_name': 'GAIN', 'batch_size': 951, 'hint_rate': 0.05, 'alpha': 99, 'iterations': 78657}. Best is trial 7 with value: 6.105847551979725.
[I 2024-02-29 17:27:49,170] Trial 147 finished with value: inf and parameters: {'model_name': 'GAIN', 'batch_size': 702, 'hint_rate': 0.03, 'alpha': 96, 'iterations': 81913}. Best is trial 7 with value: 6.105847551979725.
[I 2024-02-29 17:27:53,103] Trial 140 finished with value: inf and parameters: {'model_name': 'GAIN', 'batch_size': 907, 'hint_rate': 0.02, 'alpha': 98, 'iterations': 80593}. Best is trial 7 with value: 6.105847551979725.
