[I 2024-01-10 14:34:36,768] Trial 56 finished with value: 0.08818808926959634 and parameters: {'model_name': 'SimpleImputer', 'strategy': 'most_frequent'}. Best is trial 20 with value: 0.08376317521793836.
[I 2024-01-10 14:34:37,953] Trial 122 finished with value: 0.08376317521793836 and parameters: {'model_name': 'SimpleImputer', 'strategy': 'mean'}. Best is trial 20 with value: 0.08376317521793836.
[I 2024-01-10 14:34:38,218] Trial 92 finished with value: 0.08818808926959634 and parameters: {'model_name': 'SimpleImputer', 'strategy': 'most_frequent'}. Best is trial 20 with value: 0.08376317521793836.
[I 2024-01-10 14:34:38,548] Trial 121 finished with value: 0.08376317521793836 and parameters: {'model_name': 'SimpleImputer', 'strategy': 'mean'}. Best is trial 20 with value: 0.08376317521793836.
[I 2024-01-10 14:34:39,646] Trial 123 finished with value: 0.08376317521793836 and parameters: {'model_name': 'SimpleImputer', 'strategy': 'mean'}. Best is trial 20 with value: 0.08376317521793836.
[I 2024-01-10 14:34:41,984] Trial 124 finished with value: 0.08376317521793836 and parameters: {'model_name': 'SimpleImputer', 'strategy': 'mean'}. Best is trial 20 with value: 0.08376317521793836.
[I 2024-01-10 14:34:42,362] Trial 129 finished with value: 0.08376317521793836 and parameters: {'model_name': 'SimpleImputer', 'strategy': 'mean'}. Best is trial 20 with value: 0.08376317521793836.
[I 2024-01-10 14:34:45,268] Trial 127 finished with value: 0.08376317521793836 and parameters: {'model_name': 'SimpleImputer', 'strategy': 'mean'}. Best is trial 20 with value: 0.08376317521793836.
[I 2024-01-10 14:34:45,475] Trial 125 finished with value: 0.08376317521793836 and parameters: {'model_name': 'SimpleImputer', 'strategy': 'mean'}. Best is trial 20 with value: 0.08376317521793836.
[I 2024-01-10 14:34:47,188] Trial 73 finished with value: 0.08818808926959634 and parameters: {'model_name': 'SimpleImputer', 'strategy': 'most_frequent'}. Best is trial 20 with value: 0.08376317521793836.
[I 2024-01-10 14:34:48,125] Trial 128 finished with value: 0.08376317521793836 and parameters: {'model_name': 'SimpleImputer', 'strategy': 'mean'}. Best is trial 20 with value: 0.08376317521793836.
[I 2024-01-10 14:34:48,888] Trial 126 finished with value: 0.08376317521793836 and parameters: {'model_name': 'SimpleImputer', 'strategy': 'mean'}. Best is trial 20 with value: 0.08376317521793836.
[I 2024-01-10 14:34:52,197] Trial 132 finished with value: 0.08376317521793836 and parameters: {'model_name': 'SimpleImputer', 'strategy': 'mean'}. Best is trial 20 with value: 0.08376317521793836.
[I 2024-01-10 14:34:52,435] Trial 19 finished with value: 0.08818808926959634 and parameters: {'model_name': 'SimpleImputer', 'strategy': 'most_frequent'}. Best is trial 20 with value: 0.08376317521793836.
[I 2024-01-10 14:34:52,764] Trial 130 finished with value: 0.08376317521793836 and parameters: {'model_name': 'SimpleImputer', 'strategy': 'mean'}. Best is trial 20 with value: 0.08376317521793836.
[I 2024-01-10 14:34:57,263] Trial 131 finished with value: 0.08376317521793836 and parameters: {'model_name': 'SimpleImputer', 'strategy': 'mean'}. Best is trial 20 with value: 0.08376317521793836.
[I 2024-01-10 14:34:59,945] Trial 134 finished with value: 0.08376317521793836 and parameters: {'model_name': 'SimpleImputer', 'strategy': 'mean'}. Best is trial 20 with value: 0.08376317521793836.
[I 2024-01-10 14:35:00,502] Trial 133 finished with value: 0.08376317521793836 and parameters: {'model_name': 'SimpleImputer', 'strategy': 'mean'}. Best is trial 20 with value: 0.08376317521793836.
[I 2024-01-10 14:35:01,293] Trial 135 finished with value: 0.08376317521793836 and parameters: {'model_name': 'SimpleImputer', 'strategy': 'mean'}. Best is trial 20 with value: 0.08376317521793836.
[I 2024-01-10 14:35:04,718] Trial 136 finished with value: 0.08376317521793836 and parameters: {'model_name': 'SimpleImputer', 'strategy': 'mean'}. Best is trial 20 with value: 0.08376317521793836.
[I 2024-01-10 14:35:06,441] Trial 7 finished with value: 0.08818808926959634 and parameters: {'model_name': 'SimpleImputer', 'strategy': 'most_frequent'}. Best is trial 20 with value: 0.08376317521793836.
[I 2024-01-10 14:35:06,814] Trial 139 finished with value: 0.08376317521793836 and parameters: {'model_name': 'SimpleImputer', 'strategy': 'mean'}. Best is trial 20 with value: 0.08376317521793836.
[I 2024-01-10 14:35:08,169] Trial 137 finished with value: 0.08376317521793836 and parameters: {'model_name': 'SimpleImputer', 'strategy': 'mean'}. Best is trial 20 with value: 0.08376317521793836.
[I 2024-01-10 14:35:08,354] Trial 138 finished with value: 0.08376317521793836 and parameters: {'model_name': 'SimpleImputer', 'strategy': 'mean'}. Best is trial 20 with value: 0.08376317521793836.
[I 2024-01-10 14:35:09,939] Trial 141 finished with value: 0.08376317521793836 and parameters: {'model_name': 'SimpleImputer', 'strategy': 'mean'}. Best is trial 20 with value: 0.08376317521793836.
[I 2024-01-10 14:35:10,442] Trial 140 finished with value: 0.08376317521793836 and parameters: {'model_name': 'SimpleImputer', 'strategy': 'mean'}. Best is trial 20 with value: 0.08376317521793836.
[I 2024-01-10 14:35:14,519] Trial 142 finished with value: 0.08376317521793836 and parameters: {'model_name': 'SimpleImputer', 'strategy': 'mean'}. Best is trial 20 with value: 0.08376317521793836.
[I 2024-01-10 14:35:15,748] Trial 94 finished with value: 0.08818808926959634 and parameters: {'model_name': 'SimpleImputer', 'strategy': 'most_frequent'}. Best is trial 20 with value: 0.08376317521793836.
[I 2024-01-10 14:35:19,548] Trial 143 finished with value: 0.08376317521793836 and parameters: {'model_name': 'SimpleImputer', 'strategy': 'mean'}. Best is trial 20 with value: 0.08376317521793836.
[I 2024-01-10 14:35:22,411] Trial 147 finished with value: 0.08376317521793836 and parameters: {'model_name': 'SimpleImputer', 'strategy': 'mean'}. Best is trial 20 with value: 0.08376317521793836.
[I 2024-01-10 14:35:22,671] Trial 146 finished with value: 0.08376317521793836 and parameters: {'model_name': 'SimpleImputer', 'strategy': 'mean'}. Best is trial 20 with value: 0.08376317521793836.
[I 2024-01-10 14:35:23,179] Trial 145 finished with value: 0.08376317521793836 and parameters: {'model_name': 'SimpleImputer', 'strategy': 'mean'}. Best is trial 20 with value: 0.08376317521793836.
[I 2024-01-10 14:35:25,019] Trial 144 finished with value: 0.08376317521793836 and parameters: {'model_name': 'SimpleImputer', 'strategy': 'mean'}. Best is trial 20 with value: 0.08376317521793836.
[I 2024-01-10 14:35:25,813] Trial 149 finished with value: 0.08376317521793836 and parameters: {'model_name': 'SimpleImputer', 'strategy': 'mean'}. Best is trial 20 with value: 0.08376317521793836.
[I 2024-01-10 14:35:28,313] Trial 150 finished with value: 0.08376317521793836 and parameters: {'model_name': 'SimpleImputer', 'strategy': 'mean'}. Best is trial 20 with value: 0.08376317521793836.
[I 2024-01-10 14:35:28,778] Trial 148 finished with value: 0.08376317521793836 and parameters: {'model_name': 'SimpleImputer', 'strategy': 'mean'}. Best is trial 20 with value: 0.08376317521793836.
[I 2024-01-10 14:35:30,828] Trial 76 finished with value: 0.08818808926959634 and parameters: {'model_name': 'SimpleImputer', 'strategy': 'most_frequent'}. Best is trial 20 with value: 0.08376317521793836.
[I 2024-01-10 14:35:31,840] Trial 152 finished with value: 0.08376317521793836 and parameters: {'model_name': 'SimpleImputer', 'strategy': 'mean'}. Best is trial 20 with value: 0.08376317521793836.
[I 2024-01-10 14:35:32,230] Trial 153 finished with value: 0.08376317521793836 and parameters: {'model_name': 'SimpleImputer', 'strategy': 'mean'}. Best is trial 20 with value: 0.08376317521793836.
[I 2024-01-10 14:35:32,619] Trial 151 finished with value: 0.08376317521793836 and parameters: {'model_name': 'SimpleImputer', 'strategy': 'mean'}. Best is trial 20 with value: 0.08376317521793836.
[I 2024-01-10 14:35:37,804] Trial 156 finished with value: 0.08376317521793836 and parameters: {'model_name': 'SimpleImputer', 'strategy': 'mean'}. Best is trial 20 with value: 0.08376317521793836.
[I 2024-01-10 14:35:38,477] Trial 155 finished with value: 0.08376317521793836 and parameters: {'model_name': 'SimpleImputer', 'strategy': 'mean'}. Best is trial 20 with value: 0.08376317521793836.
[I 2024-01-10 14:35:39,005] Trial 162 finished with value: 0.0958683975035266 and parameters: {'model_name': 'SimpleImputer', 'strategy': 'constant'}. Best is trial 20 with value: 0.08376317521793836.
[I 2024-01-10 14:35:41,194] Trial 159 finished with value: 0.08376317521793836 and parameters: {'model_name': 'SimpleImputer', 'strategy': 'mean'}. Best is trial 20 with value: 0.08376317521793836.
[I 2024-01-10 14:35:42,662] Trial 80 finished with value: 0.08818808926959634 and parameters: {'model_name': 'SimpleImputer', 'strategy': 'most_frequent'}. Best is trial 20 with value: 0.08376317521793836.
[I 2024-01-10 14:35:42,934] Trial 154 finished with value: 0.08376317521793836 and parameters: {'model_name': 'SimpleImputer', 'strategy': 'mean'}. Best is trial 20 with value: 0.08376317521793836.
[I 2024-01-10 14:35:44,839] Trial 158 finished with value: 0.08376317521793836 and parameters: {'model_name': 'SimpleImputer', 'strategy': 'mean'}. Best is trial 20 with value: 0.08376317521793836.
[I 2024-01-10 14:35:45,281] Trial 164 finished with value: 0.0958683975035266 and parameters: {'model_name': 'SimpleImputer', 'strategy': 'constant'}. Best is trial 20 with value: 0.08376317521793836.
[I 2024-01-10 14:35:45,975] Trial 163 finished with value: 0.0958683975035266 and parameters: {'model_name': 'SimpleImputer', 'strategy': 'constant'}. Best is trial 20 with value: 0.08376317521793836.
[I 2024-01-10 14:35:47,585] Trial 169 finished with value: 0.0958683975035266 and parameters: {'model_name': 'SimpleImputer', 'strategy': 'constant'}. Best is trial 20 with value: 0.08376317521793836.
[I 2024-01-10 14:35:48,098] Trial 157 finished with value: 0.08376317521793836 and parameters: {'model_name': 'SimpleImputer', 'strategy': 'mean'}. Best is trial 20 with value: 0.08376317521793836.
[I 2024-01-10 14:35:48,339] Trial 168 finished with value: 0.0958683975035266 and parameters: {'model_name': 'SimpleImputer', 'strategy': 'constant'}. Best is trial 20 with value: 0.08376317521793836.
[I 2024-01-10 14:35:48,797] Trial 170 finished with value: 0.0958683975035266 and parameters: {'model_name': 'SimpleImputer', 'strategy': 'constant'}. Best is trial 20 with value: 0.08376317521793836.
[I 2024-01-10 14:35:51,604] Trial 160 finished with value: 0.08376317521793836 and parameters: {'model_name': 'SimpleImputer', 'strategy': 'mean'}. Best is trial 20 with value: 0.08376317521793836.
[I 2024-01-10 14:35:53,191] Trial 165 finished with value: 0.0958683975035266 and parameters: {'model_name': 'SimpleImputer', 'strategy': 'constant'}. Best is trial 20 with value: 0.08376317521793836.
[I 2024-01-10 14:35:54,260] Trial 167 finished with value: 0.0958683975035266 and parameters: {'model_name': 'SimpleImputer', 'strategy': 'constant'}. Best is trial 20 with value: 0.08376317521793836.
[I 2024-01-10 14:35:56,052] Trial 171 finished with value: 0.0958683975035266 and parameters: {'model_name': 'SimpleImputer', 'strategy': 'constant'}. Best is trial 20 with value: 0.08376317521793836.
[I 2024-01-10 14:35:57,933] Trial 161 finished with value: 0.08376317521793836 and parameters: {'model_name': 'SimpleImputer', 'strategy': 'mean'}. Best is trial 20 with value: 0.08376317521793836.
[I 2024-01-10 14:35:59,504] Trial 79 finished with value: 0.08818808926959634 and parameters: {'model_name': 'SimpleImputer', 'strategy': 'most_frequent'}. Best is trial 20 with value: 0.08376317521793836.
[I 2024-01-10 14:36:00,600] Trial 172 finished with value: 0.0958683975035266 and parameters: {'model_name': 'SimpleImputer', 'strategy': 'constant'}. Best is trial 20 with value: 0.08376317521793836.
[I 2024-01-10 14:36:01,607] Trial 166 finished with value: 0.08376317521793836 and parameters: {'model_name': 'SimpleImputer', 'strategy': 'mean'}. Best is trial 20 with value: 0.08376317521793836.
[I 2024-01-10 14:36:04,681] Trial 177 finished with value: 0.0958683975035266 and parameters: {'model_name': 'SimpleImputer', 'strategy': 'constant'}. Best is trial 20 with value: 0.08376317521793836.
[I 2024-01-10 14:36:05,372] Trial 89 finished with value: 0.08818808926959634 and parameters: {'model_name': 'SimpleImputer', 'strategy': 'most_frequent'}. Best is trial 20 with value: 0.08376317521793836.
[I 2024-01-10 14:36:06,491] Trial 173 finished with value: 0.0958683975035266 and parameters: {'model_name': 'SimpleImputer', 'strategy': 'constant'}. Best is trial 20 with value: 0.08376317521793836.
[I 2024-01-10 14:36:08,521] Trial 174 finished with value: 0.0958683975035266 and parameters: {'model_name': 'SimpleImputer', 'strategy': 'constant'}. Best is trial 20 with value: 0.08376317521793836.
[I 2024-01-10 14:36:11,954] Trial 183 finished with value: 0.0958683975035266 and parameters: {'model_name': 'SimpleImputer', 'strategy': 'constant'}. Best is trial 20 with value: 0.08376317521793836.
[I 2024-01-10 14:36:12,262] Trial 14 finished with value: 0.08818808926959634 and parameters: {'model_name': 'SimpleImputer', 'strategy': 'most_frequent'}. Best is trial 20 with value: 0.08376317521793836.
[I 2024-01-10 14:36:12,638] Trial 179 finished with value: 0.0958683975035266 and parameters: {'model_name': 'SimpleImputer', 'strategy': 'constant'}. Best is trial 20 with value: 0.08376317521793836.
[I 2024-01-10 14:36:12,977] Trial 184 finished with value: 0.0958683975035266 and parameters: {'model_name': 'SimpleImputer', 'strategy': 'constant'}. Best is trial 20 with value: 0.08376317521793836.
[I 2024-01-10 14:36:13,155] Trial 180 finished with value: 0.0958683975035266 and parameters: {'model_name': 'SimpleImputer', 'strategy': 'constant'}. Best is trial 20 with value: 0.08376317521793836.
[I 2024-01-10 14:36:13,604] Trial 181 finished with value: 0.0958683975035266 and parameters: {'model_name': 'SimpleImputer', 'strategy': 'constant'}. Best is trial 20 with value: 0.08376317521793836.
[I 2024-01-10 14:36:15,410] Trial 175 finished with value: 0.08376317521793836 and parameters: {'model_name': 'SimpleImputer', 'strategy': 'mean'}. Best is trial 20 with value: 0.08376317521793836.
[I 2024-01-10 14:36:15,957] Trial 176 finished with value: 0.08376317521793836 and parameters: {'model_name': 'SimpleImputer', 'strategy': 'mean'}. Best is trial 20 with value: 0.08376317521793836.
[I 2024-01-10 14:36:16,662] Trial 99 finished with value: 0.08818808926959634 and parameters: {'model_name': 'SimpleImputer', 'strategy': 'most_frequent'}. Best is trial 20 with value: 0.08376317521793836.
[I 2024-01-10 14:36:17,191] Trial 185 finished with value: 0.0958683975035266 and parameters: {'model_name': 'SimpleImputer', 'strategy': 'constant'}. Best is trial 20 with value: 0.08376317521793836.
[I 2024-01-10 14:36:18,317] Trial 178 finished with value: 0.08376317521793836 and parameters: {'model_name': 'SimpleImputer', 'strategy': 'mean'}. Best is trial 20 with value: 0.08376317521793836.
[I 2024-01-10 14:36:18,777] Trial 186 finished with value: 0.0958683975035266 and parameters: {'model_name': 'SimpleImputer', 'strategy': 'constant'}. Best is trial 20 with value: 0.08376317521793836.
[I 2024-01-10 14:36:19,973] Trial 188 finished with value: 0.0958683975035266 and parameters: {'model_name': 'SimpleImputer', 'strategy': 'constant'}. Best is trial 20 with value: 0.08376317521793836.
[I 2024-01-10 14:36:20,458] Trial 182 finished with value: 0.08376317521793836 and parameters: {'model_name': 'SimpleImputer', 'strategy': 'mean'}. Best is trial 20 with value: 0.08376317521793836.
[I 2024-01-10 14:36:20,649] Trial 189 finished with value: 0.0958683975035266 and parameters: {'model_name': 'SimpleImputer', 'strategy': 'constant'}. Best is trial 20 with value: 0.08376317521793836.
[I 2024-01-10 14:36:20,873] Trial 96 finished with value: 0.08818808926959634 and parameters: {'model_name': 'SimpleImputer', 'strategy': 'most_frequent'}. Best is trial 20 with value: 0.08376317521793836.
[I 2024-01-10 14:36:21,362] Trial 191 finished with value: 0.0958683975035266 and parameters: {'model_name': 'SimpleImputer', 'strategy': 'constant'}. Best is trial 20 with value: 0.08376317521793836.
[I 2024-01-10 14:36:22,937] Trial 90 finished with value: 0.08818808926959634 and parameters: {'model_name': 'SimpleImputer', 'strategy': 'most_frequent'}. Best is trial 20 with value: 0.08376317521793836.
[I 2024-01-10 14:36:23,710] Trial 190 finished with value: 0.08376317521793836 and parameters: {'model_name': 'SimpleImputer', 'strategy': 'mean'}. Best is trial 20 with value: 0.08376317521793836.
[I 2024-01-10 14:36:23,964] Trial 187 finished with value: 0.08376317521793836 and parameters: {'model_name': 'SimpleImputer', 'strategy': 'mean'}. Best is trial 20 with value: 0.08376317521793836.
[I 2024-01-10 14:36:24,995] Trial 192 finished with value: 0.08376317521793836 and parameters: {'model_name': 'SimpleImputer', 'strategy': 'mean'}. Best is trial 20 with value: 0.08376317521793836.
[I 2024-01-10 14:36:25,186] Trial 196 finished with value: 0.08376317521793836 and parameters: {'model_name': 'SimpleImputer', 'strategy': 'mean'}. Best is trial 20 with value: 0.08376317521793836.
[I 2024-01-10 14:36:25,364] Trial 67 finished with value: 0.08818808926959634 and parameters: {'model_name': 'SimpleImputer', 'strategy': 'most_frequent'}. Best is trial 20 with value: 0.08376317521793836.
[I 2024-01-10 14:36:25,655] Trial 85 finished with value: 0.08818808926959634 and parameters: {'model_name': 'SimpleImputer', 'strategy': 'most_frequent'}. Best is trial 20 with value: 0.08376317521793836.
[I 2024-01-10 14:36:25,901] Trial 195 finished with value: 0.08376317521793836 and parameters: {'model_name': 'SimpleImputer', 'strategy': 'mean'}. Best is trial 20 with value: 0.08376317521793836.
[I 2024-01-10 14:36:26,197] Trial 100 finished with value: 0.08818808926959634 and parameters: {'model_name': 'SimpleImputer', 'strategy': 'most_frequent'}. Best is trial 20 with value: 0.08376317521793836.
[I 2024-01-10 14:36:26,408] Trial 197 finished with value: 0.08376317521793836 and parameters: {'model_name': 'SimpleImputer', 'strategy': 'mean'}. Best is trial 20 with value: 0.08376317521793836.
[I 2024-01-10 14:36:26,731] Trial 194 finished with value: 0.08376317521793836 and parameters: {'model_name': 'SimpleImputer', 'strategy': 'mean'}. Best is trial 20 with value: 0.08376317521793836.
[I 2024-01-10 14:36:27,296] Trial 193 finished with value: 0.08376317521793836 and parameters: {'model_name': 'SimpleImputer', 'strategy': 'mean'}. Best is trial 20 with value: 0.08376317521793836.
[I 2024-01-10 14:36:27,535] Trial 63 finished with value: 0.08818808926959634 and parameters: {'model_name': 'SimpleImputer', 'strategy': 'most_frequent'}. Best is trial 20 with value: 0.08376317521793836.
[I 2024-01-10 14:36:27,900] Trial 198 finished with value: 0.08376317521793836 and parameters: {'model_name': 'SimpleImputer', 'strategy': 'mean'}. Best is trial 20 with value: 0.08376317521793836.
[I 2024-01-10 14:36:28,227] Trial 199 finished with value: 0.08376317521793836 and parameters: {'model_name': 'SimpleImputer', 'strategy': 'mean'}. Best is trial 20 with value: 0.08376317521793836.
[I 2024-01-10 14:36:28,454] Trial 77 finished with value: 0.08818808926959634 and parameters: {'model_name': 'SimpleImputer', 'strategy': 'most_frequent'}. Best is trial 20 with value: 0.08376317521793836.
[I 2024-01-10 14:36:28,837] Trial 101 finished with value: 0.08818808926959634 and parameters: {'model_name': 'SimpleImputer', 'strategy': 'most_frequent'}. Best is trial 20 with value: 0.08376317521793836.
[I 2024-01-10 14:36:29,102] Trial 82 finished with value: 0.08818808926959634 and parameters: {'model_name': 'SimpleImputer', 'strategy': 'most_frequent'}. Best is trial 20 with value: 0.08376317521793836.
[I 2024-01-10 14:36:29,297] Trial 84 finished with value: 0.08818808926959634 and parameters: {'model_name': 'SimpleImputer', 'strategy': 'most_frequent'}. Best is trial 20 with value: 0.08376317521793836.
[I 2024-01-10 14:36:29,739] Trial 98 finished with value: 0.08818808926959634 and parameters: {'model_name': 'SimpleImputer', 'strategy': 'most_frequent'}. Best is trial 20 with value: 0.08376317521793836.
