Run: 13
/cm/local/apps/slurm/var/spool/job579994/slurm_script: line 23: /common/ketrong/minconda3/etc/profile.d/conda.sh: No such file or directory
/cm/local/apps/slurm/var/spool/job579994/slurm_script: line 26: $'\nconda create --name tpot2devenv -c conda-forge python=3.10\n': command not found
/cm/local/apps/slurm/var/spool/job579994/slurm_script: line 31: $'\npip install -r requirements.txt\n': command not found
RunStart
2024-01-06 16:02:57.885728: I tensorflow/core/util/port.cc:113] oneDNN custom operations are on. You may see slightly different numerical results due to floating-point round-off errors from different computation orders. To turn them off, set the environment variable `TF_ENABLE_ONEDNN_OPTS=0`.
2024-01-06 16:02:57.920319: E external/local_xla/xla/stream_executor/cuda/cuda_dnn.cc:9261] Unable to register cuDNN factory: Attempting to register factory for plugin cuDNN when one has already been registered
2024-01-06 16:02:57.920342: E external/local_xla/xla/stream_executor/cuda/cuda_fft.cc:607] Unable to register cuFFT factory: Attempting to register factory for plugin cuFFT when one has already been registered
2024-01-06 16:02:57.921392: E external/local_xla/xla/stream_executor/cuda/cuda_blas.cc:1515] Unable to register cuBLAS factory: Attempting to register factory for plugin cuBLAS when one has already been registered
2024-01-06 16:02:57.926859: I tensorflow/core/platform/cpu_feature_guard.cc:182] This TensorFlow binary is optimized to use available CPU instructions in performance-critical operations.
To enable the following instructions: AVX2 AVX512F AVX512_VNNI FMA, in other operations, rebuild TensorFlow with the appropriate compiler flags.
2024-01-06 16:02:59.320560: W tensorflow/compiler/tf2tensorrt/utils/py_utils.cc:38] TF-TRT Warning: Could not find TensorRT
WARNING:tensorflow:From /home/ketrong/miniconda3/envs/tpot2devenv/lib/python3.10/site-packages/tensorflow/python/compat/v2_compat.py:108: disable_resource_variables (from tensorflow.python.ops.variable_scope) is deprecated and will be removed in a future version.
Instructions for updating:
non-resource variables are not supported in the long term
starting loops
working on 
logs/9959/tpot2_base_normal_MNAR_0.3
1.748194694519043
loading data
logs/9959/tpot2_base_normal_MNAR_0.3/data/9959_True.pkl
running experiment 1/3 - Does large hyperparameter space improve reconstruction accuracy over simple
[I 2024-01-06 16:03:24,068] A new study created in memory with name: no-name-e54fe40e-95ae-4e97-90ec-f885a4cda8d6
[I 2024-01-06 16:03:24,637] Trial 2 finished with value: 1281.9749525443335 and parameters: {'model_name': 'SimpleImputer', 'strategy': 'constant'}. Best is trial 2 with value: 1281.9749525443335.
[I 2024-01-06 16:03:25,104] Trial 9 finished with value: 1281.9749525443335 and parameters: {'model_name': 'SimpleImputer', 'strategy': 'constant'}. Best is trial 2 with value: 1281.9749525443335.
[I 2024-01-06 16:03:25,387] Trial 13 finished with value: 1281.9749525443335 and parameters: {'model_name': 'SimpleImputer', 'strategy': 'constant'}. Best is trial 2 with value: 1281.9749525443335.
[I 2024-01-06 16:03:25,722] Trial 1 finished with value: 1281.9749525443335 and parameters: {'model_name': 'SimpleImputer', 'strategy': 'constant'}. Best is trial 2 with value: 1281.9749525443335.
[I 2024-01-06 16:03:25,955] Trial 10 finished with value: 1281.9749525443335 and parameters: {'model_name': 'SimpleImputer', 'strategy': 'constant'}. Best is trial 2 with value: 1281.9749525443335.
[I 2024-01-06 16:03:26,213] Trial 15 finished with value: 1281.9749525443335 and parameters: {'model_name': 'SimpleImputer', 'strategy': 'constant'}. Best is trial 2 with value: 1281.9749525443335.
[I 2024-01-06 16:03:26,410] Trial 0 finished with value: 1273.86068013344 and parameters: {'model_name': 'SimpleImputer', 'strategy': 'mean'}. Best is trial 0 with value: 1273.86068013344.
[I 2024-01-06 16:03:26,858] Trial 8 finished with value: 1273.86068013344 and parameters: {'model_name': 'SimpleImputer', 'strategy': 'mean'}. Best is trial 0 with value: 1273.86068013344.
[I 2024-01-06 16:03:27,178] Trial 19 finished with value: 1281.9749525443335 and parameters: {'model_name': 'SimpleImputer', 'strategy': 'constant'}. Best is trial 0 with value: 1273.86068013344.
[I 2024-01-06 16:03:27,702] Trial 14 finished with value: 1273.86068013344 and parameters: {'model_name': 'SimpleImputer', 'strategy': 'mean'}. Best is trial 0 with value: 1273.86068013344.
[I 2024-01-06 16:03:27,975] Trial 11 finished with value: 1281.9749525443335 and parameters: {'model_name': 'SimpleImputer', 'strategy': 'constant'}. Best is trial 0 with value: 1273.86068013344.
[I 2024-01-06 16:03:28,306] Trial 26 finished with value: 1281.9749525443335 and parameters: {'model_name': 'SimpleImputer', 'strategy': 'constant'}. Best is trial 0 with value: 1273.86068013344.
[I 2024-01-06 16:03:28,547] Trial 30 finished with value: 1281.9749525443335 and parameters: {'model_name': 'SimpleImputer', 'strategy': 'constant'}. Best is trial 0 with value: 1273.86068013344.
[I 2024-01-06 16:03:28,735] Trial 22 finished with value: 1281.9749525443335 and parameters: {'model_name': 'SimpleImputer', 'strategy': 'constant'}. Best is trial 0 with value: 1273.86068013344.
[I 2024-01-06 16:03:29,011] Trial 31 finished with value: 1273.86068013344 and parameters: {'model_name': 'SimpleImputer', 'strategy': 'mean'}. Best is trial 0 with value: 1273.86068013344.
[I 2024-01-06 16:03:29,281] Trial 29 finished with value: 1273.86068013344 and parameters: {'model_name': 'SimpleImputer', 'strategy': 'mean'}. Best is trial 0 with value: 1273.86068013344.
[I 2024-01-06 16:03:29,442] Trial 3 finished with value: 1273.86068013344 and parameters: {'model_name': 'SimpleImputer', 'strategy': 'mean'}. Best is trial 0 with value: 1273.86068013344.
[I 2024-01-06 16:03:29,692] Trial 6 finished with value: 1273.86068013344 and parameters: {'model_name': 'SimpleImputer', 'strategy': 'mean'}. Best is trial 0 with value: 1273.86068013344.
[I 2024-01-06 16:03:30,196] Trial 40 finished with value: 1281.9749525443335 and parameters: {'model_name': 'SimpleImputer', 'strategy': 'constant'}. Best is trial 0 with value: 1273.86068013344.
[I 2024-01-06 16:03:30,446] Trial 48 finished with value: 1281.9749525443335 and parameters: {'model_name': 'SimpleImputer', 'strategy': 'constant'}. Best is trial 0 with value: 1273.86068013344.
[I 2024-01-06 16:03:30,635] Trial 42 finished with value: 1281.9749525443335 and parameters: {'model_name': 'SimpleImputer', 'strategy': 'constant'}. Best is trial 0 with value: 1273.86068013344.
[I 2024-01-06 16:03:30,790] Trial 20 finished with value: 1273.86068013344 and parameters: {'model_name': 'SimpleImputer', 'strategy': 'mean'}. Best is trial 0 with value: 1273.86068013344.
[I 2024-01-06 16:03:31,067] Trial 32 finished with value: 1281.9749525443335 and parameters: {'model_name': 'SimpleImputer', 'strategy': 'constant'}. Best is trial 0 with value: 1273.86068013344.
[I 2024-01-06 16:03:31,309] Trial 25 finished with value: 1273.86068013344 and parameters: {'model_name': 'SimpleImputer', 'strategy': 'mean'}. Best is trial 0 with value: 1273.86068013344.
[I 2024-01-06 16:03:31,557] Trial 50 finished with value: 1281.9749525443335 and parameters: {'model_name': 'SimpleImputer', 'strategy': 'constant'}. Best is trial 0 with value: 1273.86068013344.
[I 2024-01-06 16:03:31,953] Trial 43 finished with value: 1273.86068013344 and parameters: {'model_name': 'SimpleImputer', 'strategy': 'mean'}. Best is trial 0 with value: 1273.86068013344.
[I 2024-01-06 16:03:32,174] Trial 39 finished with value: 1281.9749525443335 and parameters: {'model_name': 'SimpleImputer', 'strategy': 'constant'}. Best is trial 0 with value: 1273.86068013344.
[I 2024-01-06 16:03:32,444] Trial 54 finished with value: 1281.9749525443335 and parameters: {'model_name': 'SimpleImputer', 'strategy': 'constant'}. Best is trial 0 with value: 1273.86068013344.
[I 2024-01-06 16:03:32,693] Trial 4 finished with value: 1281.9749525443335 and parameters: {'model_name': 'SimpleImputer', 'strategy': 'median'}. Best is trial 0 with value: 1273.86068013344.
[I 2024-01-06 16:03:32,852] Trial 36 finished with value: 1273.86068013344 and parameters: {'model_name': 'SimpleImputer', 'strategy': 'mean'}. Best is trial 0 with value: 1273.86068013344.
[I 2024-01-06 16:03:33,116] Trial 27 finished with value: 1273.86068013344 and parameters: {'model_name': 'SimpleImputer', 'strategy': 'mean'}. Best is trial 0 with value: 1273.86068013344.
[I 2024-01-06 16:03:33,320] Trial 49 finished with value: 1273.86068013344 and parameters: {'model_name': 'SimpleImputer', 'strategy': 'mean'}. Best is trial 0 with value: 1273.86068013344.
[I 2024-01-06 16:03:33,689] Trial 53 finished with value: 1273.86068013344 and parameters: {'model_name': 'SimpleImputer', 'strategy': 'mean'}. Best is trial 0 with value: 1273.86068013344.
[I 2024-01-06 16:03:33,958] Trial 18 finished with value: 1281.9749525443335 and parameters: {'model_name': 'SimpleImputer', 'strategy': 'median'}. Best is trial 0 with value: 1273.86068013344.
[I 2024-01-06 16:03:34,442] Trial 16 finished with value: 1281.9749525443335 and parameters: {'model_name': 'SimpleImputer', 'strategy': 'median'}. Best is trial 0 with value: 1273.86068013344.
[I 2024-01-06 16:03:34,769] Trial 44 finished with value: 1273.86068013344 and parameters: {'model_name': 'SimpleImputer', 'strategy': 'mean'}. Best is trial 0 with value: 1273.86068013344.
[I 2024-01-06 16:03:34,965] Trial 55 finished with value: 1281.9749525443335 and parameters: {'model_name': 'SimpleImputer', 'strategy': 'constant'}. Best is trial 0 with value: 1273.86068013344.
[I 2024-01-06 16:03:35,382] Trial 59 finished with value: 1273.86068013344 and parameters: {'model_name': 'SimpleImputer', 'strategy': 'mean'}. Best is trial 0 with value: 1273.86068013344.
[I 2024-01-06 16:03:35,564] Trial 56 finished with value: 1273.86068013344 and parameters: {'model_name': 'SimpleImputer', 'strategy': 'mean'}. Best is trial 0 with value: 1273.86068013344.
[I 2024-01-06 16:03:35,871] Trial 58 finished with value: 1273.86068013344 and parameters: {'model_name': 'SimpleImputer', 'strategy': 'mean'}. Best is trial 0 with value: 1273.86068013344.
[I 2024-01-06 16:03:36,174] Trial 62 finished with value: 1273.86068013344 and parameters: {'model_name': 'SimpleImputer', 'strategy': 'mean'}. Best is trial 0 with value: 1273.86068013344.
[I 2024-01-06 16:03:36,462] Trial 33 finished with value: 1281.9749525443335 and parameters: {'model_name': 'SimpleImputer', 'strategy': 'median'}. Best is trial 0 with value: 1273.86068013344.
[I 2024-01-06 16:03:36,715] Trial 24 finished with value: 1281.9749525443335 and parameters: {'model_name': 'SimpleImputer', 'strategy': 'median'}. Best is trial 0 with value: 1273.86068013344.
[I 2024-01-06 16:03:37,039] Trial 60 finished with value: 1273.86068013344 and parameters: {'model_name': 'SimpleImputer', 'strategy': 'mean'}. Best is trial 0 with value: 1273.86068013344.
[I 2024-01-06 16:03:37,314] Trial 34 finished with value: 1281.9749525443335 and parameters: {'model_name': 'SimpleImputer', 'strategy': 'median'}. Best is trial 0 with value: 1273.86068013344.
[I 2024-01-06 16:03:37,549] Trial 38 finished with value: 1281.9749525443335 and parameters: {'model_name': 'SimpleImputer', 'strategy': 'median'}. Best is trial 0 with value: 1273.86068013344.
[I 2024-01-06 16:03:37,928] Trial 51 finished with value: 1281.9749525443335 and parameters: {'model_name': 'SimpleImputer', 'strategy': 'median'}. Best is trial 0 with value: 1273.86068013344.
[I 2024-01-06 16:03:38,246] Trial 46 finished with value: 1281.9749525443335 and parameters: {'model_name': 'SimpleImputer', 'strategy': 'median'}. Best is trial 0 with value: 1273.86068013344.
[I 2024-01-06 16:03:38,570] Trial 57 finished with value: 1281.9749525443335 and parameters: {'model_name': 'SimpleImputer', 'strategy': 'median'}. Best is trial 0 with value: 1273.86068013344.
[I 2024-01-06 16:03:38,919] Trial 61 finished with value: 1273.86068013344 and parameters: {'model_name': 'SimpleImputer', 'strategy': 'mean'}. Best is trial 0 with value: 1273.86068013344.
[I 2024-01-06 16:03:39,455] Trial 65 finished with value: 1281.9749525443335 and parameters: {'model_name': 'SimpleImputer', 'strategy': 'median'}. Best is trial 0 with value: 1273.86068013344.
[I 2024-01-06 16:03:39,867] Trial 64 finished with value: 1281.9749525443335 and parameters: {'model_name': 'SimpleImputer', 'strategy': 'median'}. Best is trial 0 with value: 1273.86068013344.
[I 2024-01-06 16:03:40,276] Trial 71 finished with value: 1281.9749525443335 and parameters: {'model_name': 'SimpleImputer', 'strategy': 'median'}. Best is trial 0 with value: 1273.86068013344.
[I 2024-01-06 16:03:40,894] Trial 67 finished with value: 1281.9749525443335 and parameters: {'model_name': 'SimpleImputer', 'strategy': 'median'}. Best is trial 0 with value: 1273.86068013344.
[I 2024-01-06 16:03:41,115] Trial 68 finished with value: 1281.9749525443335 and parameters: {'model_name': 'SimpleImputer', 'strategy': 'median'}. Best is trial 0 with value: 1273.86068013344.
[I 2024-01-06 16:03:41,608] Trial 73 finished with value: 1281.9749525443335 and parameters: {'model_name': 'SimpleImputer', 'strategy': 'median'}. Best is trial 0 with value: 1273.86068013344.
[I 2024-01-06 16:03:42,489] Trial 94 finished with value: 1273.86068013344 and parameters: {'model_name': 'SimpleImputer', 'strategy': 'mean'}. Best is trial 0 with value: 1273.86068013344.
[I 2024-01-06 16:03:42,795] Trial 99 finished with value: 1273.86068013344 and parameters: {'model_name': 'SimpleImputer', 'strategy': 'mean'}. Best is trial 0 with value: 1273.86068013344.
[I 2024-01-06 16:03:45,107] Trial 7 finished with value: 1281.9749525443335 and parameters: {'model_name': 'SimpleImputer', 'strategy': 'most_frequent'}. Best is trial 0 with value: 1273.86068013344.
[I 2024-01-06 16:03:47,055] Trial 5 finished with value: 1281.9749525443335 and parameters: {'model_name': 'SimpleImputer', 'strategy': 'most_frequent'}. Best is trial 0 with value: 1273.86068013344.
[I 2024-01-06 16:03:47,332] Trial 12 finished with value: 1281.9749525443335 and parameters: {'model_name': 'SimpleImputer', 'strategy': 'most_frequent'}. Best is trial 0 with value: 1273.86068013344.
[I 2024-01-06 16:03:47,794] Trial 21 finished with value: 1281.9749525443335 and parameters: {'model_name': 'SimpleImputer', 'strategy': 'most_frequent'}. Best is trial 0 with value: 1273.86068013344.
[I 2024-01-06 16:03:48,204] Trial 17 finished with value: 1281.9749525443335 and parameters: {'model_name': 'SimpleImputer', 'strategy': 'most_frequent'}. Best is trial 0 with value: 1273.86068013344.
[I 2024-01-06 16:03:49,062] Trial 23 finished with value: 1281.9749525443335 and parameters: {'model_name': 'SimpleImputer', 'strategy': 'most_frequent'}. Best is trial 0 with value: 1273.86068013344.
[I 2024-01-06 16:03:49,531] Trial 28 finished with value: 1281.9749525443335 and parameters: {'model_name': 'SimpleImputer', 'strategy': 'most_frequent'}. Best is trial 0 with value: 1273.86068013344.
[I 2024-01-06 16:03:49,755] Trial 37 finished with value: 1281.9749525443335 and parameters: {'model_name': 'SimpleImputer', 'strategy': 'most_frequent'}. Best is trial 0 with value: 1273.86068013344.
[I 2024-01-06 16:03:50,112] Trial 52 finished with value: 1281.9749525443335 and parameters: {'model_name': 'SimpleImputer', 'strategy': 'most_frequent'}. Best is trial 0 with value: 1273.86068013344.
[I 2024-01-06 16:03:50,551] Trial 45 finished with value: 1281.9749525443335 and parameters: {'model_name': 'SimpleImputer', 'strategy': 'most_frequent'}. Best is trial 0 with value: 1273.86068013344.
[I 2024-01-06 16:03:50,859] Trial 41 finished with value: 1281.9749525443335 and parameters: {'model_name': 'SimpleImputer', 'strategy': 'most_frequent'}. Best is trial 0 with value: 1273.86068013344.
[I 2024-01-06 16:03:51,089] Trial 35 finished with value: 1281.9749525443335 and parameters: {'model_name': 'SimpleImputer', 'strategy': 'most_frequent'}. Best is trial 0 with value: 1273.86068013344.
[I 2024-01-06 16:03:51,640] Trial 47 finished with value: 1281.9749525443335 and parameters: {'model_name': 'SimpleImputer', 'strategy': 'most_frequent'}. Best is trial 0 with value: 1273.86068013344.
[I 2024-01-06 16:03:51,967] Trial 81 finished with value: 1281.9749525443335 and parameters: {'model_name': 'SimpleImputer', 'strategy': 'most_frequent'}. Best is trial 0 with value: 1273.86068013344.
[I 2024-01-06 16:03:52,251] Trial 66 finished with value: 1281.9749525443335 and parameters: {'model_name': 'SimpleImputer', 'strategy': 'most_frequent'}. Best is trial 0 with value: 1273.86068013344.
[I 2024-01-06 16:03:52,497] Trial 76 finished with value: 1281.9749525443335 and parameters: {'model_name': 'SimpleImputer', 'strategy': 'most_frequent'}. Best is trial 0 with value: 1273.86068013344.
[I 2024-01-06 16:03:52,810] Trial 69 finished with value: 1281.9749525443335 and parameters: {'model_name': 'SimpleImputer', 'strategy': 'most_frequent'}. Best is trial 0 with value: 1273.86068013344.
[I 2024-01-06 16:03:53,045] Trial 85 finished with value: 1281.9749525443335 and parameters: {'model_name': 'SimpleImputer', 'strategy': 'most_frequent'}. Best is trial 0 with value: 1273.86068013344.
[I 2024-01-06 16:03:53,283] Trial 63 finished with value: 1281.9749525443335 and parameters: {'model_name': 'SimpleImputer', 'strategy': 'most_frequent'}. Best is trial 0 with value: 1273.86068013344.
[I 2024-01-06 16:03:53,535] Trial 110 finished with value: 1273.86068013344 and parameters: {'model_name': 'SimpleImputer', 'strategy': 'mean'}. Best is trial 0 with value: 1273.86068013344.
[I 2024-01-06 16:03:53,791] Trial 77 finished with value: 1281.9749525443335 and parameters: {'model_name': 'SimpleImputer', 'strategy': 'most_frequent'}. Best is trial 0 with value: 1273.86068013344.
[I 2024-01-06 16:03:54,220] Trial 70 finished with value: 1281.9749525443335 and parameters: {'model_name': 'SimpleImputer', 'strategy': 'most_frequent'}. Best is trial 0 with value: 1273.86068013344.
[I 2024-01-06 16:03:54,707] Trial 112 finished with value: 1273.86068013344 and parameters: {'model_name': 'SimpleImputer', 'strategy': 'mean'}. Best is trial 0 with value: 1273.86068013344.
[I 2024-01-06 16:03:54,927] Trial 111 finished with value: 1273.86068013344 and parameters: {'model_name': 'SimpleImputer', 'strategy': 'mean'}. Best is trial 0 with value: 1273.86068013344.
[I 2024-01-06 16:03:55,285] Trial 80 finished with value: 1281.9749525443335 and parameters: {'model_name': 'SimpleImputer', 'strategy': 'most_frequent'}. Best is trial 0 with value: 1273.86068013344.
[I 2024-01-06 16:03:55,471] Trial 113 finished with value: 1273.86068013344 and parameters: {'model_name': 'SimpleImputer', 'strategy': 'mean'}. Best is trial 0 with value: 1273.86068013344.
[I 2024-01-06 16:03:55,715] Trial 74 finished with value: 1281.9749525443335 and parameters: {'model_name': 'SimpleImputer', 'strategy': 'most_frequent'}. Best is trial 0 with value: 1273.86068013344.
[I 2024-01-06 16:03:55,940] Trial 87 finished with value: 1281.9749525443335 and parameters: {'model_name': 'SimpleImputer', 'strategy': 'most_frequent'}. Best is trial 0 with value: 1273.86068013344.
[I 2024-01-06 16:03:56,161] Trial 75 finished with value: 1281.9749525443335 and parameters: {'model_name': 'SimpleImputer', 'strategy': 'most_frequent'}. Best is trial 0 with value: 1273.86068013344.
[I 2024-01-06 16:03:56,435] Trial 86 finished with value: 1281.9749525443335 and parameters: {'model_name': 'SimpleImputer', 'strategy': 'most_frequent'}. Best is trial 0 with value: 1273.86068013344.
[I 2024-01-06 16:03:56,699] Trial 114 finished with value: 1273.86068013344 and parameters: {'model_name': 'SimpleImputer', 'strategy': 'mean'}. Best is trial 0 with value: 1273.86068013344.
[I 2024-01-06 16:03:57,083] Trial 115 finished with value: 1273.86068013344 and parameters: {'model_name': 'SimpleImputer', 'strategy': 'mean'}. Best is trial 0 with value: 1273.86068013344.
[I 2024-01-06 16:03:57,317] Trial 117 finished with value: 1273.86068013344 and parameters: {'model_name': 'SimpleImputer', 'strategy': 'mean'}. Best is trial 0 with value: 1273.86068013344.
[I 2024-01-06 16:03:57,535] Trial 78 finished with value: 1281.9749525443335 and parameters: {'model_name': 'SimpleImputer', 'strategy': 'most_frequent'}. Best is trial 0 with value: 1273.86068013344.
[I 2024-01-06 16:03:57,786] Trial 84 finished with value: 1281.9749525443335 and parameters: {'model_name': 'SimpleImputer', 'strategy': 'most_frequent'}. Best is trial 0 with value: 1273.86068013344.
[I 2024-01-06 16:03:58,074] Trial 118 finished with value: 1273.86068013344 and parameters: {'model_name': 'SimpleImputer', 'strategy': 'mean'}. Best is trial 0 with value: 1273.86068013344.
[I 2024-01-06 16:03:58,272] Trial 72 finished with value: 1281.9749525443335 and parameters: {'model_name': 'SimpleImputer', 'strategy': 'most_frequent'}. Best is trial 0 with value: 1273.86068013344.
[I 2024-01-06 16:03:58,448] Trial 116 finished with value: 1273.86068013344 and parameters: {'model_name': 'SimpleImputer', 'strategy': 'mean'}. Best is trial 0 with value: 1273.86068013344.
[I 2024-01-06 16:03:58,740] Trial 91 finished with value: 1281.9749525443335 and parameters: {'model_name': 'SimpleImputer', 'strategy': 'most_frequent'}. Best is trial 0 with value: 1273.86068013344.
[I 2024-01-06 16:03:59,056] Trial 79 finished with value: 1281.9749525443335 and parameters: {'model_name': 'SimpleImputer', 'strategy': 'most_frequent'}. Best is trial 0 with value: 1273.86068013344.
[I 2024-01-06 16:03:59,299] Trial 88 finished with value: 1281.9749525443335 and parameters: {'model_name': 'SimpleImputer', 'strategy': 'most_frequent'}. Best is trial 0 with value: 1273.86068013344.
