Run: 1
/cm/local/apps/slurm/var/spool/job797083/slurm_script: line 23: /common/ketrong/minconda3/etc/profile.d/conda.sh: No such file or directory
/cm/local/apps/slurm/var/spool/job797083/slurm_script: line 26: $'\nconda create --name tpot2devenv -c conda-forge python=3.10\n': command not found
/cm/local/apps/slurm/var/spool/job797083/slurm_script: line 31: $'\npip install -r requirements.txt\n': command not found
RunStart
2024-04-01 19:04:23.409464: I tensorflow/core/util/port.cc:113] oneDNN custom operations are on. You may see slightly different numerical results due to floating-point round-off errors from different computation orders. To turn them off, set the environment variable `TF_ENABLE_ONEDNN_OPTS=0`.
2024-04-01 19:04:23.443632: E external/local_xla/xla/stream_executor/cuda/cuda_dnn.cc:9261] Unable to register cuDNN factory: Attempting to register factory for plugin cuDNN when one has already been registered
2024-04-01 19:04:23.443654: E external/local_xla/xla/stream_executor/cuda/cuda_fft.cc:607] Unable to register cuFFT factory: Attempting to register factory for plugin cuFFT when one has already been registered
2024-04-01 19:04:23.444677: E external/local_xla/xla/stream_executor/cuda/cuda_blas.cc:1515] Unable to register cuBLAS factory: Attempting to register factory for plugin cuBLAS when one has already been registered
2024-04-01 19:04:23.449976: I tensorflow/core/platform/cpu_feature_guard.cc:182] This TensorFlow binary is optimized to use available CPU instructions in performance-critical operations.
To enable the following instructions: AVX2 AVX512F AVX512_VNNI FMA, in other operations, rebuild TensorFlow with the appropriate compiler flags.
2024-04-01 19:04:26.229059: W tensorflow/compiler/tf2tensorrt/utils/py_utils.cc:38] TF-TRT Warning: Could not find TensorRT
WARNING:tensorflow:From /home/ketrong/miniconda3/envs/tpot2devenv/lib/python3.10/site-packages/tensorflow/python/compat/v2_compat.py:108: disable_resource_variables (from tensorflow.python.ops.variable_scope) is deprecated and will be removed in a future version.
Instructions for updating:
non-resource variables are not supported in the long term
starting loops
working on 
logs/359952/tpot2_base_normal_MCAR_0.01
1.2127084732055664
loading data
logs/359952/tpot2_base_normal_MCAR_0.01/data/359952_True.pkl
12783     16100.0
20118     42800.0
20745     15000.0
8610      28300.0
12579    194200.0
           ...   
16095     26400.0
49       169500.0
11743    142200.0
2238     500001.0
14896     74800.0
Name: price, Length: 20505, dtype: float64
            0   ...        15
0        384.0  ...  0.666667
1        397.0  ...  1.000000
2         96.0  ...  1.000000
3      11859.0  ...  0.596491
4       6193.0  ...  0.500000
...        ...  ...       ...
20500    264.0  ...  0.000000
20501   1825.0  ...  0.222222
20502   1094.0  ...  0.812500
20503   7514.0  ...  0.282051
20504  15982.0  ...  0.285714

[20505 rows x 16 columns]
          0   ...        15
0      410.0  ...  1.000000
1      236.0  ...  0.500000
2      330.0  ...  1.000000
3     4861.0  ...  0.428571
4     1251.0  ...  0.250000
...      ...  ...       ...
2274  2676.0  ...  0.538462
2275   454.0  ...  0.875000
2276  2490.0  ...  1.000000
2277   358.0  ...  0.000000
2278  1136.0  ...  0.777778

[2279 rows x 16 columns]
running experiment 1/3 - Does large hyperparameter space improve reconstruction accuracy over simple
[I 2024-04-01 19:04:48,737] A new study created in memory with name: no-name-f4a7748d-29a1-4241-87d2-4ece55c5a683
[I 2024-04-01 19:04:50,208] Trial 4 finished with value: 6053.877005088034 and parameters: {'model_name': 'SimpleImputer', 'strategy': 'constant'}. Best is trial 4 with value: 6053.877005088034.
[I 2024-04-01 19:04:50,761] Trial 10 finished with value: 6053.877005088034 and parameters: {'model_name': 'SimpleImputer', 'strategy': 'constant'}. Best is trial 4 with value: 6053.877005088034.
[I 2024-04-01 19:04:51,000] Trial 5 finished with value: 6053.877005088034 and parameters: {'model_name': 'SimpleImputer', 'strategy': 'constant'}. Best is trial 4 with value: 6053.877005088034.
[I 2024-04-01 19:04:51,403] Trial 20 finished with value: 6053.877005088034 and parameters: {'model_name': 'SimpleImputer', 'strategy': 'constant'}. Best is trial 4 with value: 6053.877005088034.
[I 2024-04-01 19:04:51,648] Trial 22 finished with value: 6053.877005088034 and parameters: {'model_name': 'SimpleImputer', 'strategy': 'constant'}. Best is trial 4 with value: 6053.877005088034.
[I 2024-04-01 19:04:51,845] Trial 13 finished with value: 6053.877005088034 and parameters: {'model_name': 'SimpleImputer', 'strategy': 'constant'}. Best is trial 4 with value: 6053.877005088034.
[I 2024-04-01 19:04:52,211] Trial 15 finished with value: 5816.547000242607 and parameters: {'model_name': 'SimpleImputer', 'strategy': 'mean'}. Best is trial 15 with value: 5816.547000242607.
[I 2024-04-01 19:04:52,396] Trial 18 finished with value: 5816.547000242607 and parameters: {'model_name': 'SimpleImputer', 'strategy': 'mean'}. Best is trial 15 with value: 5816.547000242607.
[I 2024-04-01 19:04:52,593] Trial 0 finished with value: 5816.547000242607 and parameters: {'model_name': 'SimpleImputer', 'strategy': 'mean'}. Best is trial 15 with value: 5816.547000242607.
[I 2024-04-01 19:04:52,971] Trial 17 finished with value: 5816.547000242607 and parameters: {'model_name': 'SimpleImputer', 'strategy': 'mean'}. Best is trial 15 with value: 5816.547000242607.
[I 2024-04-01 19:04:53,213] Trial 36 finished with value: 6053.877005088034 and parameters: {'model_name': 'SimpleImputer', 'strategy': 'constant'}. Best is trial 15 with value: 5816.547000242607.
[I 2024-04-01 19:04:53,563] Trial 25 finished with value: 5816.547000242607 and parameters: {'model_name': 'SimpleImputer', 'strategy': 'mean'}. Best is trial 15 with value: 5816.547000242607.
[I 2024-04-01 19:04:53,825] Trial 21 finished with value: 5816.547000242607 and parameters: {'model_name': 'SimpleImputer', 'strategy': 'mean'}. Best is trial 15 with value: 5816.547000242607.
[I 2024-04-01 19:04:54,200] Trial 34 finished with value: 6053.877005088034 and parameters: {'model_name': 'SimpleImputer', 'strategy': 'constant'}. Best is trial 15 with value: 5816.547000242607.
[I 2024-04-01 19:04:54,421] Trial 33 finished with value: 5816.547000242607 and parameters: {'model_name': 'SimpleImputer', 'strategy': 'mean'}. Best is trial 15 with value: 5816.547000242607.
[I 2024-04-01 19:04:54,746] Trial 46 finished with value: 6053.877005088034 and parameters: {'model_name': 'SimpleImputer', 'strategy': 'constant'}. Best is trial 15 with value: 5816.547000242607.
[I 2024-04-01 19:04:54,966] Trial 35 finished with value: 5816.547000242607 and parameters: {'model_name': 'SimpleImputer', 'strategy': 'mean'}. Best is trial 15 with value: 5816.547000242607.
[I 2024-04-01 19:04:55,234] Trial 44 finished with value: 6053.877005088034 and parameters: {'model_name': 'SimpleImputer', 'strategy': 'constant'}. Best is trial 15 with value: 5816.547000242607.
[I 2024-04-01 19:04:55,653] Trial 31 finished with value: 5816.547000242607 and parameters: {'model_name': 'SimpleImputer', 'strategy': 'mean'}. Best is trial 15 with value: 5816.547000242607.
[I 2024-04-01 19:04:56,041] Trial 27 finished with value: 5816.547000242607 and parameters: {'model_name': 'SimpleImputer', 'strategy': 'mean'}. Best is trial 15 with value: 5816.547000242607.
[I 2024-04-01 19:04:56,350] Trial 9 finished with value: 5945.099901515345 and parameters: {'model_name': 'SimpleImputer', 'strategy': 'median'}. Best is trial 15 with value: 5816.547000242607.
[I 2024-04-01 19:04:56,605] Trial 39 finished with value: 5816.547000242607 and parameters: {'model_name': 'SimpleImputer', 'strategy': 'mean'}. Best is trial 15 with value: 5816.547000242607.
[I 2024-04-01 19:04:56,929] Trial 42 finished with value: 5816.547000242607 and parameters: {'model_name': 'SimpleImputer', 'strategy': 'mean'}. Best is trial 15 with value: 5816.547000242607.
[I 2024-04-01 19:04:57,172] Trial 6 finished with value: 5945.099901515345 and parameters: {'model_name': 'SimpleImputer', 'strategy': 'median'}. Best is trial 15 with value: 5816.547000242607.
[I 2024-04-01 19:04:57,436] Trial 43 finished with value: 5816.547000242607 and parameters: {'model_name': 'SimpleImputer', 'strategy': 'mean'}. Best is trial 15 with value: 5816.547000242607.
[I 2024-04-01 19:04:57,714] Trial 7 finished with value: 5945.099901515345 and parameters: {'model_name': 'SimpleImputer', 'strategy': 'median'}. Best is trial 15 with value: 5816.547000242607.
[I 2024-04-01 19:04:58,057] Trial 32 finished with value: 5945.099901515345 and parameters: {'model_name': 'SimpleImputer', 'strategy': 'median'}. Best is trial 15 with value: 5816.547000242607.
[I 2024-04-01 19:04:58,279] Trial 52 finished with value: 6053.877005088034 and parameters: {'model_name': 'SimpleImputer', 'strategy': 'constant'}. Best is trial 15 with value: 5816.547000242607.
[I 2024-04-01 19:04:58,657] Trial 19 finished with value: 5945.099901515345 and parameters: {'model_name': 'SimpleImputer', 'strategy': 'median'}. Best is trial 15 with value: 5816.547000242607.
[I 2024-04-01 19:04:59,001] Trial 24 finished with value: 5945.099901515345 and parameters: {'model_name': 'SimpleImputer', 'strategy': 'median'}. Best is trial 15 with value: 5816.547000242607.
[I 2024-04-01 19:04:59,311] Trial 30 finished with value: 5945.099901515345 and parameters: {'model_name': 'SimpleImputer', 'strategy': 'median'}. Best is trial 15 with value: 5816.547000242607.
[I 2024-04-01 19:04:59,566] Trial 48 finished with value: 5816.547000242607 and parameters: {'model_name': 'SimpleImputer', 'strategy': 'mean'}. Best is trial 15 with value: 5816.547000242607.
[I 2024-04-01 19:04:59,805] Trial 45 finished with value: 5945.099901515345 and parameters: {'model_name': 'SimpleImputer', 'strategy': 'median'}. Best is trial 15 with value: 5816.547000242607.
[I 2024-04-01 19:05:00,360] Trial 41 finished with value: 5945.099901515345 and parameters: {'model_name': 'SimpleImputer', 'strategy': 'median'}. Best is trial 15 with value: 5816.547000242607.
[I 2024-04-01 19:05:00,575] Trial 58 finished with value: 5816.547000242607 and parameters: {'model_name': 'SimpleImputer', 'strategy': 'mean'}. Best is trial 15 with value: 5816.547000242607.
[I 2024-04-01 19:05:01,093] Trial 55 finished with value: 5816.547000242607 and parameters: {'model_name': 'SimpleImputer', 'strategy': 'mean'}. Best is trial 15 with value: 5816.547000242607.
[I 2024-04-01 19:05:01,467] Trial 50 finished with value: 5945.099901515345 and parameters: {'model_name': 'SimpleImputer', 'strategy': 'median'}. Best is trial 15 with value: 5816.547000242607.
[I 2024-04-01 19:05:02,119] Trial 60 finished with value: 5945.099901515345 and parameters: {'model_name': 'SimpleImputer', 'strategy': 'median'}. Best is trial 15 with value: 5816.547000242607.
[I 2024-04-01 19:05:02,611] Trial 61 finished with value: 5945.099901515345 and parameters: {'model_name': 'SimpleImputer', 'strategy': 'median'}. Best is trial 15 with value: 5816.547000242607.
[I 2024-04-01 19:05:02,840] Trial 62 finished with value: 5945.099901515345 and parameters: {'model_name': 'SimpleImputer', 'strategy': 'median'}. Best is trial 15 with value: 5816.547000242607.
[I 2024-04-01 19:05:03,235] Trial 63 finished with value: 5945.099901515345 and parameters: {'model_name': 'SimpleImputer', 'strategy': 'median'}. Best is trial 15 with value: 5816.547000242607.
[I 2024-04-01 19:05:03,576] Trial 64 finished with value: 5945.099901515345 and parameters: {'model_name': 'SimpleImputer', 'strategy': 'median'}. Best is trial 15 with value: 5816.547000242607.
[I 2024-04-01 19:05:04,093] Trial 67 finished with value: 5945.099901515345 and parameters: {'model_name': 'SimpleImputer', 'strategy': 'median'}. Best is trial 15 with value: 5816.547000242607.
[I 2024-04-01 19:05:07,655] Trial 16 finished with value: 6053.876996385362 and parameters: {'model_name': 'SimpleImputer', 'strategy': 'most_frequent'}. Best is trial 15 with value: 5816.547000242607.
[I 2024-04-01 19:05:08,092] Trial 37 finished with value: 6053.876996385362 and parameters: {'model_name': 'SimpleImputer', 'strategy': 'most_frequent'}. Best is trial 15 with value: 5816.547000242607.
[I 2024-04-01 19:05:08,327] Trial 3 finished with value: 6053.876996385362 and parameters: {'model_name': 'SimpleImputer', 'strategy': 'most_frequent'}. Best is trial 15 with value: 5816.547000242607.
[I 2024-04-01 19:05:08,675] Trial 1 finished with value: 6053.876996385362 and parameters: {'model_name': 'SimpleImputer', 'strategy': 'most_frequent'}. Best is trial 15 with value: 5816.547000242607.
[I 2024-04-01 19:05:08,973] Trial 11 finished with value: 6053.876996385362 and parameters: {'model_name': 'SimpleImputer', 'strategy': 'most_frequent'}. Best is trial 15 with value: 5816.547000242607.
[I 2024-04-01 19:05:09,357] Trial 26 finished with value: 6053.876996385362 and parameters: {'model_name': 'SimpleImputer', 'strategy': 'most_frequent'}. Best is trial 15 with value: 5816.547000242607.
[I 2024-04-01 19:05:09,647] Trial 2 finished with value: 6053.876996385362 and parameters: {'model_name': 'SimpleImputer', 'strategy': 'most_frequent'}. Best is trial 15 with value: 5816.547000242607.
[I 2024-04-01 19:05:09,879] Trial 14 finished with value: 6053.876996385362 and parameters: {'model_name': 'SimpleImputer', 'strategy': 'most_frequent'}. Best is trial 15 with value: 5816.547000242607.
[I 2024-04-01 19:05:10,203] Trial 12 finished with value: 6053.876996385362 and parameters: {'model_name': 'SimpleImputer', 'strategy': 'most_frequent'}. Best is trial 15 with value: 5816.547000242607.
[I 2024-04-01 19:05:10,767] Trial 28 finished with value: 6053.876996385362 and parameters: {'model_name': 'SimpleImputer', 'strategy': 'most_frequent'}. Best is trial 15 with value: 5816.547000242607.
[I 2024-04-01 19:05:11,015] Trial 8 finished with value: 6053.876996385362 and parameters: {'model_name': 'SimpleImputer', 'strategy': 'most_frequent'}. Best is trial 15 with value: 5816.547000242607.
[I 2024-04-01 19:05:11,433] Trial 23 finished with value: 6053.876996385362 and parameters: {'model_name': 'SimpleImputer', 'strategy': 'most_frequent'}. Best is trial 15 with value: 5816.547000242607.
[I 2024-04-01 19:05:11,815] Trial 29 finished with value: 6053.876996385362 and parameters: {'model_name': 'SimpleImputer', 'strategy': 'most_frequent'}. Best is trial 15 with value: 5816.547000242607.
[I 2024-04-01 19:05:12,079] Trial 47 finished with value: 6053.876996385362 and parameters: {'model_name': 'SimpleImputer', 'strategy': 'most_frequent'}. Best is trial 15 with value: 5816.547000242607.
[I 2024-04-01 19:05:12,504] Trial 40 finished with value: 6053.876996385362 and parameters: {'model_name': 'SimpleImputer', 'strategy': 'most_frequent'}. Best is trial 15 with value: 5816.547000242607.
[I 2024-04-01 19:05:12,947] Trial 92 finished with value: 5816.547000242607 and parameters: {'model_name': 'SimpleImputer', 'strategy': 'mean'}. Best is trial 15 with value: 5816.547000242607.
[I 2024-04-01 19:05:13,231] Trial 93 finished with value: 5816.547000242607 and parameters: {'model_name': 'SimpleImputer', 'strategy': 'mean'}. Best is trial 15 with value: 5816.547000242607.
[I 2024-04-01 19:05:13,494] Trial 38 finished with value: 6053.876996385362 and parameters: {'model_name': 'SimpleImputer', 'strategy': 'most_frequent'}. Best is trial 15 with value: 5816.547000242607.
[I 2024-04-01 19:05:14,131] Trial 54 finished with value: 6053.876996385362 and parameters: {'model_name': 'SimpleImputer', 'strategy': 'most_frequent'}. Best is trial 15 with value: 5816.547000242607.
[I 2024-04-01 19:05:14,403] Trial 94 finished with value: 5816.547000242607 and parameters: {'model_name': 'SimpleImputer', 'strategy': 'mean'}. Best is trial 15 with value: 5816.547000242607.
[I 2024-04-01 19:05:14,715] Trial 57 finished with value: 6053.876996385362 and parameters: {'model_name': 'SimpleImputer', 'strategy': 'most_frequent'}. Best is trial 15 with value: 5816.547000242607.
[I 2024-04-01 19:05:15,053] Trial 96 finished with value: 5816.547000242607 and parameters: {'model_name': 'SimpleImputer', 'strategy': 'mean'}. Best is trial 15 with value: 5816.547000242607.
[I 2024-04-01 19:05:15,406] Trial 97 finished with value: 5816.547000242607 and parameters: {'model_name': 'SimpleImputer', 'strategy': 'mean'}. Best is trial 15 with value: 5816.547000242607.
[I 2024-04-01 19:05:15,656] Trial 95 finished with value: 5816.547000242607 and parameters: {'model_name': 'SimpleImputer', 'strategy': 'mean'}. Best is trial 15 with value: 5816.547000242607.
[I 2024-04-01 19:05:15,856] Trial 98 finished with value: 5816.547000242607 and parameters: {'model_name': 'SimpleImputer', 'strategy': 'mean'}. Best is trial 15 with value: 5816.547000242607.
[I 2024-04-01 19:05:16,093] Trial 49 finished with value: 6053.876996385362 and parameters: {'model_name': 'SimpleImputer', 'strategy': 'most_frequent'}. Best is trial 15 with value: 5816.547000242607.
[I 2024-04-01 19:05:16,400] Trial 71 finished with value: 6053.876996385362 and parameters: {'model_name': 'SimpleImputer', 'strategy': 'most_frequent'}. Best is trial 15 with value: 5816.547000242607.
[I 2024-04-01 19:05:16,873] Trial 51 finished with value: 6053.876996385362 and parameters: {'model_name': 'SimpleImputer', 'strategy': 'most_frequent'}. Best is trial 15 with value: 5816.547000242607.
[I 2024-04-01 19:05:17,142] Trial 59 finished with value: 6053.876996385362 and parameters: {'model_name': 'SimpleImputer', 'strategy': 'most_frequent'}. Best is trial 15 with value: 5816.547000242607.
[I 2024-04-01 19:05:17,417] Trial 53 finished with value: 6053.876996385362 and parameters: {'model_name': 'SimpleImputer', 'strategy': 'most_frequent'}. Best is trial 15 with value: 5816.547000242607.
[I 2024-04-01 19:05:17,588] Trial 99 finished with value: 5816.547000242607 and parameters: {'model_name': 'SimpleImputer', 'strategy': 'mean'}. Best is trial 15 with value: 5816.547000242607.
[I 2024-04-01 19:05:17,877] Trial 100 finished with value: 5816.547000242607 and parameters: {'model_name': 'SimpleImputer', 'strategy': 'mean'}. Best is trial 15 with value: 5816.547000242607.
[I 2024-04-01 19:05:18,138] Trial 101 finished with value: 5816.547000242607 and parameters: {'model_name': 'SimpleImputer', 'strategy': 'mean'}. Best is trial 15 with value: 5816.547000242607.
[I 2024-04-01 19:05:18,365] Trial 76 finished with value: 6053.876996385362 and parameters: {'model_name': 'SimpleImputer', 'strategy': 'most_frequent'}. Best is trial 15 with value: 5816.547000242607.
[I 2024-04-01 19:05:18,627] Trial 66 finished with value: 6053.876996385362 and parameters: {'model_name': 'SimpleImputer', 'strategy': 'most_frequent'}. Best is trial 15 with value: 5816.547000242607.
[I 2024-04-01 19:05:19,031] Trial 65 finished with value: 6053.876996385362 and parameters: {'model_name': 'SimpleImputer', 'strategy': 'most_frequent'}. Best is trial 15 with value: 5816.547000242607.
[I 2024-04-01 19:05:19,222] Trial 104 finished with value: 5816.547000242607 and parameters: {'model_name': 'SimpleImputer', 'strategy': 'mean'}. Best is trial 15 with value: 5816.547000242607.
[I 2024-04-01 19:05:19,409] Trial 80 finished with value: 6053.876996385362 and parameters: {'model_name': 'SimpleImputer', 'strategy': 'most_frequent'}. Best is trial 15 with value: 5816.547000242607.
[I 2024-04-01 19:05:19,753] Trial 68 finished with value: 6053.876996385362 and parameters: {'model_name': 'SimpleImputer', 'strategy': 'most_frequent'}. Best is trial 15 with value: 5816.547000242607.
[I 2024-04-01 19:05:20,053] Trial 102 finished with value: 5816.547000242607 and parameters: {'model_name': 'SimpleImputer', 'strategy': 'mean'}. Best is trial 15 with value: 5816.547000242607.
[I 2024-04-01 19:05:20,494] Trial 74 finished with value: 6053.876996385362 and parameters: {'model_name': 'SimpleImputer', 'strategy': 'most_frequent'}. Best is trial 15 with value: 5816.547000242607.
[I 2024-04-01 19:05:21,066] Trial 107 finished with value: 5816.547000242607 and parameters: {'model_name': 'SimpleImputer', 'strategy': 'mean'}. Best is trial 15 with value: 5816.547000242607.
[I 2024-04-01 19:05:21,479] Trial 103 finished with value: 5816.547000242607 and parameters: {'model_name': 'SimpleImputer', 'strategy': 'mean'}. Best is trial 15 with value: 5816.547000242607.
[I 2024-04-01 19:05:21,808] Trial 105 finished with value: 5816.547000242607 and parameters: {'model_name': 'SimpleImputer', 'strategy': 'mean'}. Best is trial 15 with value: 5816.547000242607.
[I 2024-04-01 19:05:22,052] Trial 73 finished with value: 6053.876996385362 and parameters: {'model_name': 'SimpleImputer', 'strategy': 'most_frequent'}. Best is trial 15 with value: 5816.547000242607.
[I 2024-04-01 19:05:22,425] Trial 56 finished with value: 6053.876996385362 and parameters: {'model_name': 'SimpleImputer', 'strategy': 'most_frequent'}. Best is trial 15 with value: 5816.547000242607.
[I 2024-04-01 19:05:22,632] Trial 78 finished with value: 6053.876996385362 and parameters: {'model_name': 'SimpleImputer', 'strategy': 'most_frequent'}. Best is trial 15 with value: 5816.547000242607.
[I 2024-04-01 19:05:22,836] Trial 70 finished with value: 6053.876996385362 and parameters: {'model_name': 'SimpleImputer', 'strategy': 'most_frequent'}. Best is trial 15 with value: 5816.547000242607.
[I 2024-04-01 19:05:23,062] Trial 72 finished with value: 6053.876996385362 and parameters: {'model_name': 'SimpleImputer', 'strategy': 'most_frequent'}. Best is trial 15 with value: 5816.547000242607.
[I 2024-04-01 19:05:23,255] Trial 106 finished with value: 5816.547000242607 and parameters: {'model_name': 'SimpleImputer', 'strategy': 'mean'}. Best is trial 15 with value: 5816.547000242607.
