Run: 15
/cm/local/apps/slurm/var/spool/job796130/slurm_script: line 23: /common/ketrong/minconda3/etc/profile.d/conda.sh: No such file or directory
/cm/local/apps/slurm/var/spool/job796130/slurm_script: line 26: $'\nconda create --name tpot2devenv -c conda-forge python=3.10\n': command not found
/cm/local/apps/slurm/var/spool/job796130/slurm_script: line 31: $'\npip install -r requirements.txt\n': command not found
RunStart
2024-04-04 08:49:45.998853: I tensorflow/core/util/port.cc:113] oneDNN custom operations are on. You may see slightly different numerical results due to floating-point round-off errors from different computation orders. To turn them off, set the environment variable `TF_ENABLE_ONEDNN_OPTS=0`.
2024-04-04 08:49:46.034580: E external/local_xla/xla/stream_executor/cuda/cuda_dnn.cc:9261] Unable to register cuDNN factory: Attempting to register factory for plugin cuDNN when one has already been registered
2024-04-04 08:49:46.034602: E external/local_xla/xla/stream_executor/cuda/cuda_fft.cc:607] Unable to register cuFFT factory: Attempting to register factory for plugin cuFFT when one has already been registered
2024-04-04 08:49:46.035742: E external/local_xla/xla/stream_executor/cuda/cuda_blas.cc:1515] Unable to register cuBLAS factory: Attempting to register factory for plugin cuBLAS when one has already been registered
2024-04-04 08:49:46.041235: I tensorflow/core/platform/cpu_feature_guard.cc:182] This TensorFlow binary is optimized to use available CPU instructions in performance-critical operations.
To enable the following instructions: AVX2 AVX512F AVX512_VNNI FMA, in other operations, rebuild TensorFlow with the appropriate compiler flags.
2024-04-04 08:49:48.968379: W tensorflow/compiler/tf2tensorrt/utils/py_utils.cc:38] TF-TRT Warning: Could not find TensorRT
WARNING:tensorflow:From /home/ketrong/miniconda3/envs/tpot2devenv/lib/python3.10/site-packages/tensorflow/python/compat/v2_compat.py:108: disable_resource_variables (from tensorflow.python.ops.variable_scope) is deprecated and will be removed in a future version.
Instructions for updating:
non-resource variables are not supported in the long term
starting loops
working on 
logs/190419/tpot2_base_normal_MNAR_0.9
4.071717023849487
loading data
logs/190419/tpot2_base_normal_MNAR_0.9/data/190419_True.pkl
5983     4
5823     4
6827    10
1346     3
3898     4
        ..
899      4
3887     5
6861    24
7270     7
6830     8
Name: sales, Length: 5369, dtype: uint8
            0   ...   13
0     0.322581  ...  1.0
1     0.290323  ...  1.0
2     0.354839  ...  1.0
3     0.000000  ...  0.0
4     0.870968  ...  1.0
...        ...  ...  ...
5364  0.645161  ...  1.0
5365  0.258065  ...  1.0
5366  0.483871  ...  1.0
5367  0.548387  ...  1.0
5368  0.645161  ...  2.0

[5369 rows x 14 columns]
            0   ...   13
0     0.387097  ...  3.0
1     0.129032  ...  1.0
2     0.000000  ...  1.0
3     0.580645  ...  1.0
4     0.419355  ...  2.0
...        ...  ...  ...
5364  0.290323  ...  0.0
5365  0.419355  ...  1.0
5366  1.000000  ...  1.0
5367  0.387097  ...  1.0
5368  0.870968  ...  1.0

[5369 rows x 14 columns]
running experiment 1/3 - Does large hyperparameter space improve reconstruction accuracy over simple
[I 2024-04-04 08:50:14,083] A new study created in memory with name: no-name-1e08caef-0e0d-44cc-a5d9-71a8b0e3e3a7
[I 2024-04-04 08:50:14,487] Trial 0 finished with value: 0.2747250734744102 and parameters: {'model_name': 'SimpleImputer', 'strategy': 'constant'}. Best is trial 0 with value: 0.2747250734744102.
[I 2024-04-04 08:50:14,918] Trial 1 finished with value: 0.2747250734744102 and parameters: {'model_name': 'SimpleImputer', 'strategy': 'constant'}. Best is trial 0 with value: 0.2747250734744102.
[I 2024-04-04 08:50:15,104] Trial 4 finished with value: 0.2747250734744102 and parameters: {'model_name': 'SimpleImputer', 'strategy': 'constant'}. Best is trial 0 with value: 0.2747250734744102.
[I 2024-04-04 08:50:15,302] Trial 6 finished with value: 0.2747250734744102 and parameters: {'model_name': 'SimpleImputer', 'strategy': 'constant'}. Best is trial 0 with value: 0.2747250734744102.
[I 2024-04-04 08:50:15,774] Trial 9 finished with value: 0.2548182287003252 and parameters: {'model_name': 'SimpleImputer', 'strategy': 'mean'}. Best is trial 9 with value: 0.2548182287003252.
[I 2024-04-04 08:50:16,050] Trial 5 finished with value: 0.2548182287003252 and parameters: {'model_name': 'SimpleImputer', 'strategy': 'mean'}. Best is trial 9 with value: 0.2548182287003252.
[I 2024-04-04 08:50:16,367] Trial 11 finished with value: 0.2747250734744102 and parameters: {'model_name': 'SimpleImputer', 'strategy': 'constant'}. Best is trial 9 with value: 0.2548182287003252.
[I 2024-04-04 08:50:16,679] Trial 12 finished with value: 0.2548182287003252 and parameters: {'model_name': 'SimpleImputer', 'strategy': 'mean'}. Best is trial 9 with value: 0.2548182287003252.
[I 2024-04-04 08:50:17,336] Trial 13 finished with value: 0.2548182287003252 and parameters: {'model_name': 'SimpleImputer', 'strategy': 'mean'}. Best is trial 9 with value: 0.2548182287003252.
[I 2024-04-04 08:50:17,570] Trial 43 finished with value: 0.2747250734744102 and parameters: {'model_name': 'SimpleImputer', 'strategy': 'constant'}. Best is trial 9 with value: 0.2548182287003252.
[I 2024-04-04 08:50:17,931] Trial 23 finished with value: 0.2548182287003252 and parameters: {'model_name': 'SimpleImputer', 'strategy': 'mean'}. Best is trial 9 with value: 0.2548182287003252.
[I 2024-04-04 08:50:18,214] Trial 22 finished with value: 0.2747250734744102 and parameters: {'model_name': 'SimpleImputer', 'strategy': 'constant'}. Best is trial 9 with value: 0.2548182287003252.
[I 2024-04-04 08:50:18,770] Trial 31 finished with value: 0.2747250734744102 and parameters: {'model_name': 'SimpleImputer', 'strategy': 'constant'}. Best is trial 9 with value: 0.2548182287003252.
[I 2024-04-04 08:50:19,082] Trial 16 finished with value: 0.2548182287003252 and parameters: {'model_name': 'SimpleImputer', 'strategy': 'mean'}. Best is trial 9 with value: 0.2548182287003252.
[I 2024-04-04 08:50:19,463] Trial 28 finished with value: 0.2548182287003252 and parameters: {'model_name': 'SimpleImputer', 'strategy': 'mean'}. Best is trial 9 with value: 0.2548182287003252.
[I 2024-04-04 08:50:19,771] Trial 47 finished with value: 0.2747250734744102 and parameters: {'model_name': 'SimpleImputer', 'strategy': 'constant'}. Best is trial 9 with value: 0.2548182287003252.
[I 2024-04-04 08:50:19,945] Trial 15 finished with value: 0.2747250734744102 and parameters: {'model_name': 'SimpleImputer', 'strategy': 'median'}. Best is trial 9 with value: 0.2548182287003252.
[I 2024-04-04 08:50:20,277] Trial 3 finished with value: 0.2747250734744102 and parameters: {'model_name': 'SimpleImputer', 'strategy': 'median'}. Best is trial 9 with value: 0.2548182287003252.
[I 2024-04-04 08:50:20,510] Trial 44 finished with value: 0.2747250734744102 and parameters: {'model_name': 'SimpleImputer', 'strategy': 'constant'}. Best is trial 9 with value: 0.2548182287003252.
[I 2024-04-04 08:50:20,739] Trial 49 finished with value: 0.2747250734744102 and parameters: {'model_name': 'SimpleImputer', 'strategy': 'constant'}. Best is trial 9 with value: 0.2548182287003252.
[I 2024-04-04 08:50:20,966] Trial 8 finished with value: 0.2747250734744102 and parameters: {'model_name': 'SimpleImputer', 'strategy': 'median'}. Best is trial 9 with value: 0.2548182287003252.
[I 2024-04-04 08:50:21,147] Trial 36 finished with value: 0.2548182287003252 and parameters: {'model_name': 'SimpleImputer', 'strategy': 'mean'}. Best is trial 9 with value: 0.2548182287003252.
[I 2024-04-04 08:50:21,660] Trial 7 finished with value: 0.2747250734744102 and parameters: {'model_name': 'SimpleImputer', 'strategy': 'median'}. Best is trial 9 with value: 0.2548182287003252.
[I 2024-04-04 08:50:21,961] Trial 40 finished with value: 0.2548182287003252 and parameters: {'model_name': 'SimpleImputer', 'strategy': 'mean'}. Best is trial 9 with value: 0.2548182287003252.
[I 2024-04-04 08:50:22,209] Trial 54 finished with value: 0.2548182287003252 and parameters: {'model_name': 'SimpleImputer', 'strategy': 'mean'}. Best is trial 9 with value: 0.2548182287003252.
[I 2024-04-04 08:50:22,416] Trial 37 finished with value: 0.2548182287003252 and parameters: {'model_name': 'SimpleImputer', 'strategy': 'mean'}. Best is trial 9 with value: 0.2548182287003252.
[I 2024-04-04 08:50:22,651] Trial 55 finished with value: 0.2747250734744102 and parameters: {'model_name': 'SimpleImputer', 'strategy': 'constant'}. Best is trial 9 with value: 0.2548182287003252.
[I 2024-04-04 08:50:22,820] Trial 41 finished with value: 0.2548182287003252 and parameters: {'model_name': 'SimpleImputer', 'strategy': 'mean'}. Best is trial 9 with value: 0.2548182287003252.
[I 2024-04-04 08:50:23,157] Trial 10 finished with value: 0.2747250734744102 and parameters: {'model_name': 'SimpleImputer', 'strategy': 'median'}. Best is trial 9 with value: 0.2548182287003252.
[I 2024-04-04 08:50:23,424] Trial 51 finished with value: 0.2548182287003252 and parameters: {'model_name': 'SimpleImputer', 'strategy': 'mean'}. Best is trial 9 with value: 0.2548182287003252.
[I 2024-04-04 08:50:23,797] Trial 19 finished with value: 0.2747250734744102 and parameters: {'model_name': 'SimpleImputer', 'strategy': 'median'}. Best is trial 9 with value: 0.2548182287003252.
[I 2024-04-04 08:50:24,048] Trial 50 finished with value: 0.2548182287003252 and parameters: {'model_name': 'SimpleImputer', 'strategy': 'mean'}. Best is trial 9 with value: 0.2548182287003252.
[I 2024-04-04 08:50:24,231] Trial 25 finished with value: 0.2747250734744102 and parameters: {'model_name': 'SimpleImputer', 'strategy': 'median'}. Best is trial 9 with value: 0.2548182287003252.
[I 2024-04-04 08:50:24,594] Trial 29 finished with value: 0.2747250734744102 and parameters: {'model_name': 'SimpleImputer', 'strategy': 'median'}. Best is trial 9 with value: 0.2548182287003252.
[I 2024-04-04 08:50:25,143] Trial 34 finished with value: 0.2747250734744102 and parameters: {'model_name': 'SimpleImputer', 'strategy': 'median'}. Best is trial 9 with value: 0.2548182287003252.
[I 2024-04-04 08:50:25,507] Trial 32 finished with value: 0.2747250734744102 and parameters: {'model_name': 'SimpleImputer', 'strategy': 'median'}. Best is trial 9 with value: 0.2548182287003252.
[I 2024-04-04 08:50:25,721] Trial 20 finished with value: 0.2747250734744102 and parameters: {'model_name': 'SimpleImputer', 'strategy': 'median'}. Best is trial 9 with value: 0.2548182287003252.
[I 2024-04-04 08:50:25,945] Trial 30 finished with value: 0.2747250734744102 and parameters: {'model_name': 'SimpleImputer', 'strategy': 'median'}. Best is trial 9 with value: 0.2548182287003252.
[I 2024-04-04 08:50:26,498] Trial 42 finished with value: 0.2747250734744102 and parameters: {'model_name': 'SimpleImputer', 'strategy': 'median'}. Best is trial 9 with value: 0.2548182287003252.
[I 2024-04-04 08:50:26,839] Trial 46 finished with value: 0.2747250734744102 and parameters: {'model_name': 'SimpleImputer', 'strategy': 'median'}. Best is trial 9 with value: 0.2548182287003252.
[I 2024-04-04 08:50:27,158] Trial 57 finished with value: 0.2747250734744102 and parameters: {'model_name': 'SimpleImputer', 'strategy': 'median'}. Best is trial 9 with value: 0.2548182287003252.
[I 2024-04-04 08:50:27,452] Trial 56 finished with value: 0.2747250734744102 and parameters: {'model_name': 'SimpleImputer', 'strategy': 'median'}. Best is trial 9 with value: 0.2548182287003252.
[I 2024-04-04 08:50:28,156] Trial 58 finished with value: 0.2747250734744102 and parameters: {'model_name': 'SimpleImputer', 'strategy': 'median'}. Best is trial 9 with value: 0.2548182287003252.
[I 2024-04-04 08:50:28,482] Trial 62 finished with value: 0.2747250734744102 and parameters: {'model_name': 'SimpleImputer', 'strategy': 'median'}. Best is trial 9 with value: 0.2548182287003252.
[I 2024-04-04 08:50:28,949] Trial 59 finished with value: 0.2747250734744102 and parameters: {'model_name': 'SimpleImputer', 'strategy': 'median'}. Best is trial 9 with value: 0.2548182287003252.
[I 2024-04-04 08:50:29,215] Trial 2 finished with value: 0.2747250734744102 and parameters: {'model_name': 'SimpleImputer', 'strategy': 'most_frequent'}. Best is trial 9 with value: 0.2548182287003252.
[I 2024-04-04 08:50:29,951] Trial 17 finished with value: 0.2747250734744102 and parameters: {'model_name': 'SimpleImputer', 'strategy': 'most_frequent'}. Best is trial 9 with value: 0.2548182287003252.
[I 2024-04-04 08:50:30,521] Trial 14 finished with value: 0.2747250734744102 and parameters: {'model_name': 'SimpleImputer', 'strategy': 'most_frequent'}. Best is trial 9 with value: 0.2548182287003252.
[I 2024-04-04 08:50:31,401] Trial 26 finished with value: 0.2747250734744102 and parameters: {'model_name': 'SimpleImputer', 'strategy': 'most_frequent'}. Best is trial 9 with value: 0.2548182287003252.
[I 2024-04-04 08:50:31,805] Trial 33 finished with value: 0.2747250734744102 and parameters: {'model_name': 'SimpleImputer', 'strategy': 'most_frequent'}. Best is trial 9 with value: 0.2548182287003252.
[I 2024-04-04 08:50:31,981] Trial 27 finished with value: 0.2747250734744102 and parameters: {'model_name': 'SimpleImputer', 'strategy': 'most_frequent'}. Best is trial 9 with value: 0.2548182287003252.
[I 2024-04-04 08:50:32,297] Trial 18 finished with value: 0.2747250734744102 and parameters: {'model_name': 'SimpleImputer', 'strategy': 'most_frequent'}. Best is trial 9 with value: 0.2548182287003252.
[I 2024-04-04 08:50:32,595] Trial 21 finished with value: 0.2747250734744102 and parameters: {'model_name': 'SimpleImputer', 'strategy': 'most_frequent'}. Best is trial 9 with value: 0.2548182287003252.
[I 2024-04-04 08:50:32,965] Trial 38 finished with value: 0.2747250734744102 and parameters: {'model_name': 'SimpleImputer', 'strategy': 'most_frequent'}. Best is trial 9 with value: 0.2548182287003252.
[I 2024-04-04 08:50:33,311] Trial 24 finished with value: 0.2747250734744102 and parameters: {'model_name': 'SimpleImputer', 'strategy': 'most_frequent'}. Best is trial 9 with value: 0.2548182287003252.
[I 2024-04-04 08:50:33,746] Trial 39 finished with value: 0.2747250734744102 and parameters: {'model_name': 'SimpleImputer', 'strategy': 'most_frequent'}. Best is trial 9 with value: 0.2548182287003252.
[I 2024-04-04 08:50:33,922] Trial 52 finished with value: 0.2747250734744102 and parameters: {'model_name': 'SimpleImputer', 'strategy': 'most_frequent'}. Best is trial 9 with value: 0.2548182287003252.
[I 2024-04-04 08:50:34,337] Trial 48 finished with value: 0.2747250734744102 and parameters: {'model_name': 'SimpleImputer', 'strategy': 'most_frequent'}. Best is trial 9 with value: 0.2548182287003252.
[I 2024-04-04 08:50:34,553] Trial 53 finished with value: 0.2747250734744102 and parameters: {'model_name': 'SimpleImputer', 'strategy': 'most_frequent'}. Best is trial 9 with value: 0.2548182287003252.
[I 2024-04-04 08:50:34,812] Trial 64 finished with value: 0.2747250734744102 and parameters: {'model_name': 'SimpleImputer', 'strategy': 'most_frequent'}. Best is trial 9 with value: 0.2548182287003252.
[I 2024-04-04 08:50:35,053] Trial 95 finished with value: 0.2548182287003252 and parameters: {'model_name': 'SimpleImputer', 'strategy': 'mean'}. Best is trial 9 with value: 0.2548182287003252.
[I 2024-04-04 08:50:35,273] Trial 45 finished with value: 0.2747250734744102 and parameters: {'model_name': 'SimpleImputer', 'strategy': 'most_frequent'}. Best is trial 9 with value: 0.2548182287003252.
[I 2024-04-04 08:50:35,734] Trial 60 finished with value: 0.2747250734744102 and parameters: {'model_name': 'SimpleImputer', 'strategy': 'most_frequent'}. Best is trial 9 with value: 0.2548182287003252.
[I 2024-04-04 08:50:36,057] Trial 35 finished with value: 0.2747250734744102 and parameters: {'model_name': 'SimpleImputer', 'strategy': 'most_frequent'}. Best is trial 9 with value: 0.2548182287003252.
[I 2024-04-04 08:50:36,582] Trial 68 finished with value: 0.2747250734744102 and parameters: {'model_name': 'SimpleImputer', 'strategy': 'most_frequent'}. Best is trial 9 with value: 0.2548182287003252.
[I 2024-04-04 08:50:36,861] Trial 99 finished with value: 0.2548182287003252 and parameters: {'model_name': 'SimpleImputer', 'strategy': 'mean'}. Best is trial 9 with value: 0.2548182287003252.
[I 2024-04-04 08:50:37,206] Trial 97 finished with value: 0.2548182287003252 and parameters: {'model_name': 'SimpleImputer', 'strategy': 'mean'}. Best is trial 9 with value: 0.2548182287003252.
[I 2024-04-04 08:50:37,442] Trial 72 finished with value: 0.2747250734744102 and parameters: {'model_name': 'SimpleImputer', 'strategy': 'most_frequent'}. Best is trial 9 with value: 0.2548182287003252.
[I 2024-04-04 08:50:37,683] Trial 61 finished with value: 0.2747250734744102 and parameters: {'model_name': 'SimpleImputer', 'strategy': 'most_frequent'}. Best is trial 9 with value: 0.2548182287003252.
[I 2024-04-04 08:50:38,054] Trial 66 finished with value: 0.2747250734744102 and parameters: {'model_name': 'SimpleImputer', 'strategy': 'most_frequent'}. Best is trial 9 with value: 0.2548182287003252.
[I 2024-04-04 08:50:38,255] Trial 101 finished with value: 0.2548182287003252 and parameters: {'model_name': 'SimpleImputer', 'strategy': 'mean'}. Best is trial 9 with value: 0.2548182287003252.
[I 2024-04-04 08:50:38,535] Trial 98 finished with value: 0.2548182287003252 and parameters: {'model_name': 'SimpleImputer', 'strategy': 'mean'}. Best is trial 9 with value: 0.2548182287003252.
[I 2024-04-04 08:50:38,777] Trial 67 finished with value: 0.2747250734744102 and parameters: {'model_name': 'SimpleImputer', 'strategy': 'most_frequent'}. Best is trial 9 with value: 0.2548182287003252.
[I 2024-04-04 08:50:39,021] Trial 96 finished with value: 0.2548182287003252 and parameters: {'model_name': 'SimpleImputer', 'strategy': 'mean'}. Best is trial 9 with value: 0.2548182287003252.
[I 2024-04-04 08:50:39,334] Trial 100 finished with value: 0.2548182287003252 and parameters: {'model_name': 'SimpleImputer', 'strategy': 'mean'}. Best is trial 9 with value: 0.2548182287003252.
[I 2024-04-04 08:50:39,549] Trial 63 finished with value: 0.2747250734744102 and parameters: {'model_name': 'SimpleImputer', 'strategy': 'most_frequent'}. Best is trial 9 with value: 0.2548182287003252.
[I 2024-04-04 08:50:39,738] Trial 69 finished with value: 0.2747250734744102 and parameters: {'model_name': 'SimpleImputer', 'strategy': 'most_frequent'}. Best is trial 9 with value: 0.2548182287003252.
[I 2024-04-04 08:50:40,018] Trial 71 finished with value: 0.2747250734744102 and parameters: {'model_name': 'SimpleImputer', 'strategy': 'most_frequent'}. Best is trial 9 with value: 0.2548182287003252.
[I 2024-04-04 08:50:40,246] Trial 103 finished with value: 0.2548182287003252 and parameters: {'model_name': 'SimpleImputer', 'strategy': 'mean'}. Best is trial 9 with value: 0.2548182287003252.
[I 2024-04-04 08:50:40,523] Trial 65 finished with value: 0.2747250734744102 and parameters: {'model_name': 'SimpleImputer', 'strategy': 'most_frequent'}. Best is trial 9 with value: 0.2548182287003252.
[I 2024-04-04 08:50:40,815] Trial 77 finished with value: 0.2747250734744102 and parameters: {'model_name': 'SimpleImputer', 'strategy': 'most_frequent'}. Best is trial 9 with value: 0.2548182287003252.
[I 2024-04-04 08:50:41,080] Trial 108 finished with value: 0.2548182287003252 and parameters: {'model_name': 'SimpleImputer', 'strategy': 'mean'}. Best is trial 9 with value: 0.2548182287003252.
[I 2024-04-04 08:50:41,290] Trial 102 finished with value: 0.2548182287003252 and parameters: {'model_name': 'SimpleImputer', 'strategy': 'mean'}. Best is trial 9 with value: 0.2548182287003252.
[I 2024-04-04 08:50:41,556] Trial 78 finished with value: 0.2747250734744102 and parameters: {'model_name': 'SimpleImputer', 'strategy': 'most_frequent'}. Best is trial 9 with value: 0.2548182287003252.
[I 2024-04-04 08:50:41,860] Trial 110 finished with value: 0.2548182287003252 and parameters: {'model_name': 'SimpleImputer', 'strategy': 'mean'}. Best is trial 9 with value: 0.2548182287003252.
[I 2024-04-04 08:50:42,071] Trial 79 finished with value: 0.2747250734744102 and parameters: {'model_name': 'SimpleImputer', 'strategy': 'most_frequent'}. Best is trial 9 with value: 0.2548182287003252.
[I 2024-04-04 08:50:42,322] Trial 106 finished with value: 0.2548182287003252 and parameters: {'model_name': 'SimpleImputer', 'strategy': 'mean'}. Best is trial 9 with value: 0.2548182287003252.
[I 2024-04-04 08:50:42,643] Trial 104 finished with value: 0.2548182287003252 and parameters: {'model_name': 'SimpleImputer', 'strategy': 'mean'}. Best is trial 9 with value: 0.2548182287003252.
[I 2024-04-04 08:50:42,913] Trial 105 finished with value: 0.2548182287003252 and parameters: {'model_name': 'SimpleImputer', 'strategy': 'mean'}. Best is trial 9 with value: 0.2548182287003252.
[I 2024-04-04 08:50:43,106] Trial 107 finished with value: 0.2548182287003252 and parameters: {'model_name': 'SimpleImputer', 'strategy': 'mean'}. Best is trial 9 with value: 0.2548182287003252.
[I 2024-04-04 08:50:43,445] Trial 80 finished with value: 0.2747250734744102 and parameters: {'model_name': 'SimpleImputer', 'strategy': 'most_frequent'}. Best is trial 9 with value: 0.2548182287003252.
[I 2024-04-04 08:50:43,937] Trial 75 finished with value: 0.2747250734744102 and parameters: {'model_name': 'SimpleImputer', 'strategy': 'most_frequent'}. Best is trial 9 with value: 0.2548182287003252.
[I 2024-04-04 08:50:44,215] Trial 109 finished with value: 0.2548182287003252 and parameters: {'model_name': 'SimpleImputer', 'strategy': 'mean'}. Best is trial 9 with value: 0.2548182287003252.
[I 2024-04-04 08:50:44,406] Trial 74 finished with value: 0.2747250734744102 and parameters: {'model_name': 'SimpleImputer', 'strategy': 'most_frequent'}. Best is trial 9 with value: 0.2548182287003252.
