[I 2024-03-02 12:32:05,041] Trial 8 finished with value: 1060.3241540227564 and parameters: {'model_name': 'SimpleImputer', 'strategy': 'constant'}. Best is trial 8 with value: 1060.3241540227564.
[I 2024-03-02 12:32:06,678] Trial 11 finished with value: 960.444142850132 and parameters: {'model_name': 'SimpleImputer', 'strategy': 'mean'}. Best is trial 11 with value: 960.444142850132.
[I 2024-03-02 12:32:07,319] Trial 21 finished with value: 960.444142850132 and parameters: {'model_name': 'SimpleImputer', 'strategy': 'mean'}. Best is trial 11 with value: 960.444142850132.
[I 2024-03-02 12:32:08,208] Trial 33 finished with value: 1060.3241540227564 and parameters: {'model_name': 'SimpleImputer', 'strategy': 'constant'}. Best is trial 11 with value: 960.444142850132.
[I 2024-03-02 12:32:08,993] Trial 30 finished with value: 1060.3241540227564 and parameters: {'model_name': 'SimpleImputer', 'strategy': 'constant'}. Best is trial 11 with value: 960.444142850132.
[I 2024-03-02 12:32:09,794] Trial 13 finished with value: 1005.6525646299804 and parameters: {'model_name': 'SimpleImputer', 'strategy': 'median'}. Best is trial 11 with value: 960.444142850132.
[I 2024-03-02 12:32:10,949] Trial 18 finished with value: 1005.6525646299804 and parameters: {'model_name': 'SimpleImputer', 'strategy': 'median'}. Best is trial 11 with value: 960.444142850132.
[I 2024-03-02 12:32:11,636] Trial 39 finished with value: 960.444142850132 and parameters: {'model_name': 'SimpleImputer', 'strategy': 'mean'}. Best is trial 11 with value: 960.444142850132.
[I 2024-03-02 12:32:12,766] Trial 36 finished with value: 1005.6525646299804 and parameters: {'model_name': 'SimpleImputer', 'strategy': 'median'}. Best is trial 11 with value: 960.444142850132.
[I 2024-03-02 12:32:14,227] Trial 48 finished with value: 1005.6525646299804 and parameters: {'model_name': 'SimpleImputer', 'strategy': 'median'}. Best is trial 11 with value: 960.444142850132.
[I 2024-03-02 12:32:15,718] Trial 52 finished with value: 960.444142850132 and parameters: {'model_name': 'SimpleImputer', 'strategy': 'mean'}. Best is trial 11 with value: 960.444142850132.
2024-03-02 12:32:21.257219: E external/local_xla/xla/stream_executor/cuda/cuda_driver.cc:274] failed call to cuInit: CUDA_ERROR_NO_DEVICE: no CUDA-capable device is detected
2024-03-02 12:32:21.646705: I tensorflow/compiler/mlir/mlir_graph_optimization_pass.cc:388] MLIR V1 optimization pass is not enabled
[I 2024-03-02 12:32:42,314] Trial 19 finished with value: 1060.293551440942 and parameters: {'model_name': 'SimpleImputer', 'strategy': 'most_frequent'}. Best is trial 11 with value: 960.444142850132.
[I 2024-03-02 12:32:44,332] Trial 4 finished with value: 1060.293551440942 and parameters: {'model_name': 'SimpleImputer', 'strategy': 'most_frequent'}. Best is trial 11 with value: 960.444142850132.
[I 2024-03-02 12:32:49,215] Trial 56 finished with value: 1060.293551440942 and parameters: {'model_name': 'SimpleImputer', 'strategy': 'most_frequent'}. Best is trial 11 with value: 960.444142850132.
[I 2024-03-02 12:32:51,552] Trial 54 finished with value: 1060.293551440942 and parameters: {'model_name': 'SimpleImputer', 'strategy': 'most_frequent'}. Best is trial 11 with value: 960.444142850132.
[I 2024-03-02 12:32:52,248] Trial 2 finished with value: 907.2753632256799 and parameters: {'model_name': 'KNNImputer', 'weights': 'distance', 'keep_empty_features': False}. Best is trial 2 with value: 907.2753632256799.
[I 2024-03-02 12:32:52,963] Trial 6 finished with value: 911.8818524959719 and parameters: {'model_name': 'KNNImputer', 'weights': 'uniform', 'keep_empty_features': False}. Best is trial 2 with value: 907.2753632256799.
[I 2024-03-02 12:32:54,045] Trial 5 finished with value: 907.2753632256799 and parameters: {'model_name': 'KNNImputer', 'weights': 'distance', 'keep_empty_features': False}. Best is trial 2 with value: 907.2753632256799.
[I 2024-03-02 12:32:54,883] Trial 38 finished with value: 911.8818524959719 and parameters: {'model_name': 'KNNImputer', 'weights': 'uniform', 'keep_empty_features': False}. Best is trial 2 with value: 907.2753632256799.
[I 2024-03-02 12:32:55,856] Trial 46 finished with value: 907.2753632256799 and parameters: {'model_name': 'KNNImputer', 'weights': 'distance', 'keep_empty_features': False}. Best is trial 2 with value: 907.2753632256799.
[I 2024-03-02 12:32:57,093] Trial 14 finished with value: 907.2753632256799 and parameters: {'model_name': 'KNNImputer', 'weights': 'distance', 'keep_empty_features': False}. Best is trial 2 with value: 907.2753632256799.
[I 2024-03-02 12:32:57,560] Trial 41 finished with value: 911.8818524959719 and parameters: {'model_name': 'KNNImputer', 'weights': 'uniform', 'keep_empty_features': False}. Best is trial 2 with value: 907.2753632256799.
[I 2024-03-02 12:32:58,261] Trial 28 finished with value: 907.2753632256799 and parameters: {'model_name': 'KNNImputer', 'weights': 'distance', 'keep_empty_features': False}. Best is trial 2 with value: 907.2753632256799.
[I 2024-03-02 12:32:58,782] Trial 23 finished with value: 911.8818524959719 and parameters: {'model_name': 'KNNImputer', 'weights': 'uniform', 'keep_empty_features': False}. Best is trial 2 with value: 907.2753632256799.
[I 2024-03-02 12:32:59,336] Trial 27 finished with value: 911.8818524959719 and parameters: {'model_name': 'KNNImputer', 'weights': 'uniform', 'keep_empty_features': False}. Best is trial 2 with value: 907.2753632256799.
[I 2024-03-02 12:33:00,187] Trial 32 finished with value: 907.2753632256799 and parameters: {'model_name': 'KNNImputer', 'weights': 'distance', 'keep_empty_features': False}. Best is trial 2 with value: 907.2753632256799.
[I 2024-03-02 12:33:01,382] Trial 44 finished with value: 911.8818524959719 and parameters: {'model_name': 'KNNImputer', 'weights': 'uniform', 'keep_empty_features': False}. Best is trial 2 with value: 907.2753632256799.
[I 2024-03-02 12:33:01,813] Trial 47 finished with value: 907.2753632256799 and parameters: {'model_name': 'KNNImputer', 'weights': 'distance', 'keep_empty_features': False}. Best is trial 2 with value: 907.2753632256799.
[I 2024-03-02 12:33:02,600] Trial 51 finished with value: 911.8818524959719 and parameters: {'model_name': 'KNNImputer', 'weights': 'uniform', 'keep_empty_features': False}. Best is trial 2 with value: 907.2753632256799.
[I 2024-03-02 12:33:05,409] Trial 53 finished with value: 911.8818524959719 and parameters: {'model_name': 'KNNImputer', 'weights': 'uniform', 'keep_empty_features': False}. Best is trial 2 with value: 907.2753632256799.
[I 2024-03-02 12:33:28,705] Trial 60 finished with value: 907.2753632256799 and parameters: {'model_name': 'KNNImputer', 'weights': 'distance', 'keep_empty_features': False}. Best is trial 2 with value: 907.2753632256799.
[I 2024-03-02 12:33:33,489] Trial 64 finished with value: 911.8818524959719 and parameters: {'model_name': 'KNNImputer', 'weights': 'uniform', 'keep_empty_features': False}. Best is trial 2 with value: 907.2753632256799.
[I 2024-03-02 12:33:35,288] Trial 66 finished with value: 907.2753632256799 and parameters: {'model_name': 'KNNImputer', 'weights': 'distance', 'keep_empty_features': False}. Best is trial 2 with value: 907.2753632256799.
[I 2024-03-02 12:33:36,105] Trial 63 finished with value: 907.2753632256799 and parameters: {'model_name': 'KNNImputer', 'weights': 'distance', 'keep_empty_features': False}. Best is trial 2 with value: 907.2753632256799.
[I 2024-03-02 12:33:37,323] Trial 65 finished with value: 907.2753632256799 and parameters: {'model_name': 'KNNImputer', 'weights': 'distance', 'keep_empty_features': False}. Best is trial 2 with value: 907.2753632256799.
[I 2024-03-02 12:35:07,036] Trial 35 finished with value: 1059.9050396521004 and parameters: {'model_name': 'RandomForestImputer', 'max_iter': 2, 'decreasing': False, 'min_samples_split': 0.0, 'min_samples_leaf': 0.7000000000000001, 'max_features': 0.2, 'warm_start': True}. Best is trial 2 with value: 907.2753632256799.
[I 2024-03-02 12:35:21,668] Trial 72 finished with value: 20487.755607186213 and parameters: {'model_name': 'GAIN', 'batch_size': 2, 'hint_rate': 0.77, 'alpha': 46, 'iterations': 2}. Best is trial 2 with value: 907.2753632256799.
[I 2024-03-02 12:35:22,594] Trial 29 finished with value: 19839.61349123761 and parameters: {'model_name': 'GAIN', 'batch_size': 11, 'hint_rate': 0.77, 'alpha': 10, 'iterations': 9}. Best is trial 2 with value: 907.2753632256799.
[I 2024-03-02 12:35:26,656] Trial 70 finished with value: 26594.505328054413 and parameters: {'model_name': 'GAIN', 'batch_size': 243, 'hint_rate': 0.65, 'alpha': 30, 'iterations': 2}. Best is trial 2 with value: 907.2753632256799.
[I 2024-03-02 12:35:39,931] Trial 55 finished with value: 13692.276077932245 and parameters: {'model_name': 'GAIN', 'batch_size': 67, 'hint_rate': 0.28, 'alpha': 80, 'iterations': 10}. Best is trial 2 with value: 907.2753632256799.
[I 2024-03-02 12:35:57,177] Trial 81 finished with value: 22689.196775448818 and parameters: {'model_name': 'GAIN', 'batch_size': 8, 'hint_rate': 0.53, 'alpha': 12, 'iterations': 3}. Best is trial 2 with value: 907.2753632256799.
[I 2024-03-02 12:36:26,790] Trial 7 finished with value: 1060.0963525957288 and parameters: {'model_name': 'RandomForestImputer', 'max_iter': 3, 'decreasing': True, 'min_samples_split': 0.0, 'min_samples_leaf': 0.2, 'max_features': 0.6, 'warm_start': True}. Best is trial 2 with value: 907.2753632256799.
[I 2024-03-02 12:36:28,722] Trial 20 finished with value: 1059.9041716822676 and parameters: {'model_name': 'RandomForestImputer', 'max_iter': 3, 'decreasing': False, 'min_samples_split': 0.30000000000000004, 'min_samples_leaf': 0.6, 'max_features': 0.8, 'warm_start': True}. Best is trial 2 with value: 907.2753632256799.
[I 2024-03-02 12:36:39,633] Trial 80 finished with value: 17696.588367433615 and parameters: {'model_name': 'GAIN', 'batch_size': 182, 'hint_rate': 0.98, 'alpha': 50, 'iterations': 12}. Best is trial 2 with value: 907.2753632256799.
[I 2024-03-02 12:36:56,165] Trial 37 finished with value: 1059.6342658407216 and parameters: {'model_name': 'RandomForestImputer', 'max_iter': 4, 'decreasing': True, 'min_samples_split': 0.0, 'min_samples_leaf': 0.6, 'max_features': 0.8, 'warm_start': True}. Best is trial 2 with value: 907.2753632256799.
[I 2024-03-02 12:37:18,492] Trial 68 finished with value: 1059.903642359831 and parameters: {'model_name': 'RandomForestImputer', 'max_iter': 4, 'decreasing': False, 'min_samples_split': 1.0, 'min_samples_leaf': 0.8, 'max_features': 0.6, 'warm_start': True}. Best is trial 2 with value: 907.2753632256799.
[I 2024-03-02 12:39:29,568] Trial 43 finished with value: 1133.1249113845624 and parameters: {'model_name': 'IterativeImputer', 'sample_posterior': False, 'initial_strategy': 'mean', 'imputation_order': 'arabic'}. Best is trial 2 with value: 907.2753632256799.
[I 2024-03-02 12:39:35,319] Trial 45 finished with value: 1133.1249113845624 and parameters: {'model_name': 'IterativeImputer', 'sample_posterior': False, 'initial_strategy': 'mean', 'imputation_order': 'arabic'}. Best is trial 2 with value: 907.2753632256799.
[I 2024-03-02 12:40:04,774] Trial 95 finished with value: 907.2753632256799 and parameters: {'model_name': 'KNNImputer', 'weights': 'distance', 'keep_empty_features': False}. Best is trial 2 with value: 907.2753632256799.
[I 2024-03-02 12:40:35,256] Trial 96 finished with value: 907.2753632256799 and parameters: {'model_name': 'KNNImputer', 'weights': 'distance', 'keep_empty_features': False}. Best is trial 2 with value: 907.2753632256799.
[I 2024-03-02 12:41:11,610] Trial 40 finished with value: inf and parameters: {'model_name': 'GAIN', 'batch_size': 36, 'hint_rate': 0.34, 'alpha': 27, 'iterations': 134}. Best is trial 2 with value: 907.2753632256799.
[I 2024-03-02 12:41:28,354] Trial 82 finished with value: 4063.7178942176097 and parameters: {'model_name': 'GAIN', 'batch_size': 6, 'hint_rate': 0.4, 'alpha': 57, 'iterations': 82}. Best is trial 2 with value: 907.2753632256799.
[I 2024-03-02 12:41:37,383] Trial 0 finished with value: 1133.19927112578 and parameters: {'model_name': 'IterativeImputer', 'sample_posterior': False, 'initial_strategy': 'median', 'imputation_order': 'descending'}. Best is trial 2 with value: 907.2753632256799.
[I 2024-03-02 12:41:43,443] Trial 98 finished with value: 907.2753632256799 and parameters: {'model_name': 'KNNImputer', 'weights': 'distance', 'keep_empty_features': False}. Best is trial 2 with value: 907.2753632256799.
[I 2024-03-02 12:41:58,122] Trial 99 finished with value: 907.2753632256799 and parameters: {'model_name': 'KNNImputer', 'weights': 'distance', 'keep_empty_features': False}. Best is trial 2 with value: 907.2753632256799.
[I 2024-03-02 12:41:59,527] Trial 62 finished with value: 1133.19927112578 and parameters: {'model_name': 'IterativeImputer', 'sample_posterior': False, 'initial_strategy': 'median', 'imputation_order': 'descending'}. Best is trial 2 with value: 907.2753632256799.
[I 2024-03-02 12:42:08,610] Trial 100 finished with value: 907.2753632256799 and parameters: {'model_name': 'KNNImputer', 'weights': 'distance', 'keep_empty_features': False}. Best is trial 2 with value: 907.2753632256799.
[I 2024-03-02 12:42:13,914] Trial 101 finished with value: 907.2753632256799 and parameters: {'model_name': 'KNNImputer', 'weights': 'distance', 'keep_empty_features': False}. Best is trial 2 with value: 907.2753632256799.
[I 2024-03-02 12:42:24,058] Trial 61 finished with value: 1132.426909609024 and parameters: {'model_name': 'IterativeImputer', 'sample_posterior': False, 'initial_strategy': 'constant', 'imputation_order': 'random'}. Best is trial 2 with value: 907.2753632256799.
[I 2024-03-02 12:42:29,551] Trial 49 finished with value: 1133.1797565896272 and parameters: {'model_name': 'IterativeImputer', 'sample_posterior': False, 'initial_strategy': 'median', 'imputation_order': 'ascending'}. Best is trial 2 with value: 907.2753632256799.
[I 2024-03-02 12:42:31,021] Trial 102 finished with value: 907.2753632256799 and parameters: {'model_name': 'KNNImputer', 'weights': 'distance', 'keep_empty_features': False}. Best is trial 2 with value: 907.2753632256799.
[I 2024-03-02 12:42:33,482] Trial 103 finished with value: 907.2753632256799 and parameters: {'model_name': 'KNNImputer', 'weights': 'distance', 'keep_empty_features': False}. Best is trial 2 with value: 907.2753632256799.
[I 2024-03-02 12:42:43,456] Trial 104 finished with value: 907.2753632256799 and parameters: {'model_name': 'KNNImputer', 'weights': 'distance', 'keep_empty_features': False}. Best is trial 2 with value: 907.2753632256799.
[I 2024-03-02 12:42:44,425] Trial 50 finished with value: 1133.1498775758123 and parameters: {'model_name': 'IterativeImputer', 'sample_posterior': False, 'initial_strategy': 'median', 'imputation_order': 'roman'}. Best is trial 2 with value: 907.2753632256799.
[I 2024-03-02 12:42:49,275] Trial 105 finished with value: 907.2753632256799 and parameters: {'model_name': 'KNNImputer', 'weights': 'distance', 'keep_empty_features': False}. Best is trial 2 with value: 907.2753632256799.
[I 2024-03-02 12:42:51,394] Trial 57 finished with value: 1133.1716362279751 and parameters: {'model_name': 'IterativeImputer', 'sample_posterior': False, 'initial_strategy': 'constant', 'imputation_order': 'ascending'}. Best is trial 2 with value: 907.2753632256799.
[I 2024-03-02 12:43:00,648] Trial 15 finished with value: 1977.8035326790668 and parameters: {'model_name': 'GAIN', 'batch_size': 1, 'hint_rate': 0.09, 'alpha': 14, 'iterations': 125}. Best is trial 2 with value: 907.2753632256799.
[I 2024-03-02 12:43:01,803] Trial 79 finished with value: 1133.1963926884496 and parameters: {'model_name': 'IterativeImputer', 'sample_posterior': False, 'initial_strategy': 'most_frequent', 'imputation_order': 'descending'}. Best is trial 2 with value: 907.2753632256799.
[I 2024-03-02 12:43:04,700] Trial 106 finished with value: 907.2753632256799 and parameters: {'model_name': 'KNNImputer', 'weights': 'distance', 'keep_empty_features': False}. Best is trial 2 with value: 907.2753632256799.
[I 2024-03-02 12:43:11,730] Trial 107 finished with value: 907.2753632256799 and parameters: {'model_name': 'KNNImputer', 'weights': 'distance', 'keep_empty_features': False}. Best is trial 2 with value: 907.2753632256799.
[I 2024-03-02 12:43:13,173] Trial 108 finished with value: 907.2753632256799 and parameters: {'model_name': 'KNNImputer', 'weights': 'distance', 'keep_empty_features': False}. Best is trial 2 with value: 907.2753632256799.
[I 2024-03-02 12:43:14,877] Trial 109 finished with value: 907.2753632256799 and parameters: {'model_name': 'KNNImputer', 'weights': 'distance', 'keep_empty_features': False}. Best is trial 2 with value: 907.2753632256799.
[I 2024-03-02 12:43:26,789] Trial 111 finished with value: 907.2753632256799 and parameters: {'model_name': 'KNNImputer', 'weights': 'distance', 'keep_empty_features': False}. Best is trial 2 with value: 907.2753632256799.
[I 2024-03-02 12:43:28,433] Trial 110 finished with value: 907.2753632256799 and parameters: {'model_name': 'KNNImputer', 'weights': 'distance', 'keep_empty_features': False}. Best is trial 2 with value: 907.2753632256799.
[I 2024-03-02 12:43:34,456] Trial 112 finished with value: 907.2753632256799 and parameters: {'model_name': 'KNNImputer', 'weights': 'distance', 'keep_empty_features': False}. Best is trial 2 with value: 907.2753632256799.
[I 2024-03-02 12:43:36,285] Trial 113 finished with value: 907.2753632256799 and parameters: {'model_name': 'KNNImputer', 'weights': 'distance', 'keep_empty_features': False}. Best is trial 2 with value: 907.2753632256799.
[I 2024-03-02 12:43:46,059] Trial 114 finished with value: 907.2753632256799 and parameters: {'model_name': 'KNNImputer', 'weights': 'distance', 'keep_empty_features': False}. Best is trial 2 with value: 907.2753632256799.
[I 2024-03-02 12:43:47,315] Trial 115 finished with value: 907.2753632256799 and parameters: {'model_name': 'KNNImputer', 'weights': 'distance', 'keep_empty_features': False}. Best is trial 2 with value: 907.2753632256799.
[I 2024-03-02 12:43:48,732] Trial 116 finished with value: 907.2753632256799 and parameters: {'model_name': 'KNNImputer', 'weights': 'distance', 'keep_empty_features': False}. Best is trial 2 with value: 907.2753632256799.
[I 2024-03-02 12:43:55,714] Trial 118 finished with value: 907.2753632256799 and parameters: {'model_name': 'KNNImputer', 'weights': 'distance', 'keep_empty_features': False}. Best is trial 2 with value: 907.2753632256799.
[I 2024-03-02 12:43:56,655] Trial 117 finished with value: 907.2753632256799 and parameters: {'model_name': 'KNNImputer', 'weights': 'distance', 'keep_empty_features': False}. Best is trial 2 with value: 907.2753632256799.
[I 2024-03-02 12:43:58,871] Trial 119 finished with value: 907.2753632256799 and parameters: {'model_name': 'KNNImputer', 'weights': 'distance', 'keep_empty_features': False}. Best is trial 2 with value: 907.2753632256799.
[I 2024-03-02 12:44:07,696] Trial 121 finished with value: 907.2753632256799 and parameters: {'model_name': 'KNNImputer', 'weights': 'distance', 'keep_empty_features': False}. Best is trial 2 with value: 907.2753632256799.
[I 2024-03-02 12:44:08,815] Trial 120 finished with value: 907.2753632256799 and parameters: {'model_name': 'KNNImputer', 'weights': 'distance', 'keep_empty_features': False}. Best is trial 2 with value: 907.2753632256799.
[I 2024-03-02 12:45:22,903] Trial 1 finished with value: 1059.9042229994711 and parameters: {'model_name': 'RandomForestImputer', 'max_iter': 33, 'decreasing': False, 'min_samples_split': 0.0, 'min_samples_leaf': 0.8, 'max_features': 0.30000000000000004, 'warm_start': True}. Best is trial 2 with value: 907.2753632256799.
[I 2024-03-02 12:45:39,939] Trial 87 finished with value: 1133.1716362279751 and parameters: {'model_name': 'IterativeImputer', 'sample_posterior': False, 'initial_strategy': 'constant', 'imputation_order': 'ascending'}. Best is trial 2 with value: 907.2753632256799.
[I 2024-03-02 12:45:43,832] Trial 91 finished with value: 1133.0577027360985 and parameters: {'model_name': 'IterativeImputer', 'sample_posterior': False, 'initial_strategy': 'mean', 'imputation_order': 'descending'}. Best is trial 2 with value: 907.2753632256799.
[I 2024-03-02 12:46:30,338] Trial 74 finished with value: 958.9669230294954 and parameters: {'model_name': 'RandomForestImputer', 'max_iter': 2, 'decreasing': False, 'min_samples_split': 0.0, 'min_samples_leaf': 0.1, 'max_features': 0.5, 'warm_start': False}. Best is trial 2 with value: 907.2753632256799.
[I 2024-03-02 12:46:36,816] Trial 89 finished with value: 1132.8758808153852 and parameters: {'model_name': 'IterativeImputer', 'sample_posterior': False, 'initial_strategy': 'constant', 'imputation_order': 'roman'}. Best is trial 2 with value: 907.2753632256799.
[I 2024-03-02 12:46:59,465] Trial 136 finished with value: 907.2753632256799 and parameters: {'model_name': 'KNNImputer', 'weights': 'distance', 'keep_empty_features': False}. Best is trial 2 with value: 907.2753632256799.
[I 2024-03-02 12:49:17,848] Trial 10 finished with value: inf and parameters: {'model_name': 'GAIN', 'batch_size': 49, 'hint_rate': 0.9600000000000001, 'alpha': 91, 'iterations': 2037}. Best is trial 2 with value: 907.2753632256799.
[I 2024-03-02 12:49:20,936] Trial 67 finished with value: 1059.903983294434 and parameters: {'model_name': 'RandomForestImputer', 'max_iter': 48, 'decreasing': False, 'min_samples_split': 0.7000000000000001, 'min_samples_leaf': 0.6, 'max_features': 0.8, 'warm_start': True}. Best is trial 2 with value: 907.2753632256799.
[I 2024-03-02 12:49:43,166] Trial 138 finished with value: 907.2753632256799 and parameters: {'model_name': 'KNNImputer', 'weights': 'distance', 'keep_empty_features': False}. Best is trial 2 with value: 907.2753632256799.
