[I 2024-02-11 01:01:02,022] Trial 114 finished with value: 4.018858933540362 and parameters: {'model_name': 'SimpleImputer', 'strategy': 'mean'}. Best is trial 4 with value: 4.018858933540362.
[I 2024-02-11 01:01:02,361] Trial 83 finished with value: 4.551095295035358 and parameters: {'model_name': 'SimpleImputer', 'strategy': 'most_frequent'}. Best is trial 4 with value: 4.018858933540362.
[I 2024-02-11 01:01:02,587] Trial 80 finished with value: 4.551095295035358 and parameters: {'model_name': 'SimpleImputer', 'strategy': 'most_frequent'}. Best is trial 4 with value: 4.018858933540362.
[I 2024-02-11 01:01:02,889] Trial 76 finished with value: 4.551095295035358 and parameters: {'model_name': 'SimpleImputer', 'strategy': 'most_frequent'}. Best is trial 4 with value: 4.018858933540362.
[I 2024-02-11 01:01:03,161] Trial 84 finished with value: 4.551095295035358 and parameters: {'model_name': 'SimpleImputer', 'strategy': 'most_frequent'}. Best is trial 4 with value: 4.018858933540362.
[I 2024-02-11 01:01:03,381] Trial 79 finished with value: 4.551095295035358 and parameters: {'model_name': 'SimpleImputer', 'strategy': 'most_frequent'}. Best is trial 4 with value: 4.018858933540362.
[I 2024-02-11 01:01:04,066] Trial 115 finished with value: 4.018858933540362 and parameters: {'model_name': 'SimpleImputer', 'strategy': 'mean'}. Best is trial 4 with value: 4.018858933540362.
[I 2024-02-11 01:01:04,319] Trial 91 finished with value: 4.551095295035358 and parameters: {'model_name': 'SimpleImputer', 'strategy': 'most_frequent'}. Best is trial 4 with value: 4.018858933540362.
[I 2024-02-11 01:01:04,636] Trial 125 finished with value: 4.018858933540362 and parameters: {'model_name': 'SimpleImputer', 'strategy': 'mean'}. Best is trial 4 with value: 4.018858933540362.
[I 2024-02-11 01:01:04,869] Trial 88 finished with value: 4.551095295035358 and parameters: {'model_name': 'SimpleImputer', 'strategy': 'most_frequent'}. Best is trial 4 with value: 4.018858933540362.
[I 2024-02-11 01:01:05,105] Trial 121 finished with value: 4.018858933540362 and parameters: {'model_name': 'SimpleImputer', 'strategy': 'mean'}. Best is trial 4 with value: 4.018858933540362.
[I 2024-02-11 01:01:05,321] Trial 123 finished with value: 4.018858933540362 and parameters: {'model_name': 'SimpleImputer', 'strategy': 'mean'}. Best is trial 4 with value: 4.018858933540362.
[I 2024-02-11 01:01:05,536] Trial 116 finished with value: 4.018858933540362 and parameters: {'model_name': 'SimpleImputer', 'strategy': 'mean'}. Best is trial 4 with value: 4.018858933540362.
[I 2024-02-11 01:01:05,807] Trial 119 finished with value: 4.018858933540362 and parameters: {'model_name': 'SimpleImputer', 'strategy': 'mean'}. Best is trial 4 with value: 4.018858933540362.
[I 2024-02-11 01:01:06,034] Trial 87 finished with value: 4.551095295035358 and parameters: {'model_name': 'SimpleImputer', 'strategy': 'most_frequent'}. Best is trial 4 with value: 4.018858933540362.
[I 2024-02-11 01:01:06,386] Trial 122 finished with value: 4.018858933540362 and parameters: {'model_name': 'SimpleImputer', 'strategy': 'mean'}. Best is trial 4 with value: 4.018858933540362.
[I 2024-02-11 01:01:06,600] Trial 117 finished with value: 4.018858933540362 and parameters: {'model_name': 'SimpleImputer', 'strategy': 'mean'}. Best is trial 4 with value: 4.018858933540362.
[I 2024-02-11 01:01:06,806] Trial 124 finished with value: 4.018858933540362 and parameters: {'model_name': 'SimpleImputer', 'strategy': 'mean'}. Best is trial 4 with value: 4.018858933540362.
[I 2024-02-11 01:01:07,009] Trial 120 finished with value: 4.018858933540362 and parameters: {'model_name': 'SimpleImputer', 'strategy': 'mean'}. Best is trial 4 with value: 4.018858933540362.
[I 2024-02-11 01:01:07,225] Trial 89 finished with value: 4.551095295035358 and parameters: {'model_name': 'SimpleImputer', 'strategy': 'most_frequent'}. Best is trial 4 with value: 4.018858933540362.
[I 2024-02-11 01:01:07,515] Trial 126 finished with value: 4.018858933540362 and parameters: {'model_name': 'SimpleImputer', 'strategy': 'mean'}. Best is trial 4 with value: 4.018858933540362.
[I 2024-02-11 01:01:07,770] Trial 129 finished with value: 4.018858933540362 and parameters: {'model_name': 'SimpleImputer', 'strategy': 'mean'}. Best is trial 4 with value: 4.018858933540362.
[I 2024-02-11 01:01:08,108] Trial 94 finished with value: 4.551095295035358 and parameters: {'model_name': 'SimpleImputer', 'strategy': 'most_frequent'}. Best is trial 4 with value: 4.018858933540362.
[I 2024-02-11 01:01:08,631] Trial 128 finished with value: 4.018858933540362 and parameters: {'model_name': 'SimpleImputer', 'strategy': 'mean'}. Best is trial 4 with value: 4.018858933540362.
[I 2024-02-11 01:01:08,876] Trial 118 finished with value: 4.018858933540362 and parameters: {'model_name': 'SimpleImputer', 'strategy': 'mean'}. Best is trial 4 with value: 4.018858933540362.
[I 2024-02-11 01:01:09,176] Trial 133 finished with value: 4.018858933540362 and parameters: {'model_name': 'SimpleImputer', 'strategy': 'mean'}. Best is trial 4 with value: 4.018858933540362.
[I 2024-02-11 01:01:09,405] Trial 130 finished with value: 4.018858933540362 and parameters: {'model_name': 'SimpleImputer', 'strategy': 'mean'}. Best is trial 4 with value: 4.018858933540362.
[I 2024-02-11 01:01:09,609] Trial 137 finished with value: 4.018858933540362 and parameters: {'model_name': 'SimpleImputer', 'strategy': 'mean'}. Best is trial 4 with value: 4.018858933540362.
[I 2024-02-11 01:01:09,916] Trial 142 finished with value: 4.018858933540362 and parameters: {'model_name': 'SimpleImputer', 'strategy': 'mean'}. Best is trial 4 with value: 4.018858933540362.
[I 2024-02-11 01:01:10,239] Trial 136 finished with value: 4.018858933540362 and parameters: {'model_name': 'SimpleImputer', 'strategy': 'mean'}. Best is trial 4 with value: 4.018858933540362.
[I 2024-02-11 01:01:10,508] Trial 134 finished with value: 4.018858933540362 and parameters: {'model_name': 'SimpleImputer', 'strategy': 'mean'}. Best is trial 4 with value: 4.018858933540362.
[I 2024-02-11 01:01:10,742] Trial 132 finished with value: 4.018858933540362 and parameters: {'model_name': 'SimpleImputer', 'strategy': 'mean'}. Best is trial 4 with value: 4.018858933540362.
[I 2024-02-11 01:01:10,953] Trial 127 finished with value: 4.018858933540362 and parameters: {'model_name': 'SimpleImputer', 'strategy': 'mean'}. Best is trial 4 with value: 4.018858933540362.
[I 2024-02-11 01:01:11,280] Trial 93 finished with value: 4.551095295035358 and parameters: {'model_name': 'SimpleImputer', 'strategy': 'most_frequent'}. Best is trial 4 with value: 4.018858933540362.
[I 2024-02-11 01:01:11,542] Trial 135 finished with value: 4.018858933540362 and parameters: {'model_name': 'SimpleImputer', 'strategy': 'mean'}. Best is trial 4 with value: 4.018858933540362.
[I 2024-02-11 01:01:11,791] Trial 131 finished with value: 4.018858933540362 and parameters: {'model_name': 'SimpleImputer', 'strategy': 'mean'}. Best is trial 4 with value: 4.018858933540362.
[I 2024-02-11 01:01:12,074] Trial 145 finished with value: 4.018858933540362 and parameters: {'model_name': 'SimpleImputer', 'strategy': 'mean'}. Best is trial 4 with value: 4.018858933540362.
[I 2024-02-11 01:01:12,294] Trial 143 finished with value: 4.018858933540362 and parameters: {'model_name': 'SimpleImputer', 'strategy': 'mean'}. Best is trial 4 with value: 4.018858933540362.
[I 2024-02-11 01:01:12,538] Trial 92 finished with value: 4.551095295035358 and parameters: {'model_name': 'SimpleImputer', 'strategy': 'most_frequent'}. Best is trial 4 with value: 4.018858933540362.
[I 2024-02-11 01:01:12,755] Trial 140 finished with value: 4.018858933540362 and parameters: {'model_name': 'SimpleImputer', 'strategy': 'mean'}. Best is trial 4 with value: 4.018858933540362.
[I 2024-02-11 01:01:13,022] Trial 139 finished with value: 4.018858933540362 and parameters: {'model_name': 'SimpleImputer', 'strategy': 'mean'}. Best is trial 4 with value: 4.018858933540362.
[I 2024-02-11 01:01:13,251] Trial 144 finished with value: 4.018858933540362 and parameters: {'model_name': 'SimpleImputer', 'strategy': 'mean'}. Best is trial 4 with value: 4.018858933540362.
[I 2024-02-11 01:01:13,626] Trial 138 finished with value: 4.018858933540362 and parameters: {'model_name': 'SimpleImputer', 'strategy': 'mean'}. Best is trial 4 with value: 4.018858933540362.
[I 2024-02-11 01:01:13,867] Trial 141 finished with value: 4.018858933540362 and parameters: {'model_name': 'SimpleImputer', 'strategy': 'mean'}. Best is trial 4 with value: 4.018858933540362.
[I 2024-02-11 01:01:14,157] Trial 147 finished with value: 4.018858933540362 and parameters: {'model_name': 'SimpleImputer', 'strategy': 'mean'}. Best is trial 4 with value: 4.018858933540362.
[I 2024-02-11 01:01:14,376] Trial 146 finished with value: 4.018858933540362 and parameters: {'model_name': 'SimpleImputer', 'strategy': 'mean'}. Best is trial 4 with value: 4.018858933540362.
[I 2024-02-11 01:01:14,622] Trial 150 finished with value: 4.018858933540362 and parameters: {'model_name': 'SimpleImputer', 'strategy': 'mean'}. Best is trial 4 with value: 4.018858933540362.
[I 2024-02-11 01:01:14,865] Trial 148 finished with value: 4.018858933540362 and parameters: {'model_name': 'SimpleImputer', 'strategy': 'mean'}. Best is trial 4 with value: 4.018858933540362.
[I 2024-02-11 01:01:15,187] Trial 151 finished with value: 4.018858933540362 and parameters: {'model_name': 'SimpleImputer', 'strategy': 'mean'}. Best is trial 4 with value: 4.018858933540362.
[I 2024-02-11 01:01:15,574] Trial 152 finished with value: 4.018858933540362 and parameters: {'model_name': 'SimpleImputer', 'strategy': 'mean'}. Best is trial 4 with value: 4.018858933540362.
[I 2024-02-11 01:01:15,840] Trial 149 finished with value: 4.018858933540362 and parameters: {'model_name': 'SimpleImputer', 'strategy': 'mean'}. Best is trial 4 with value: 4.018858933540362.
[I 2024-02-11 01:01:16,302] Trial 155 finished with value: 4.018858933540362 and parameters: {'model_name': 'SimpleImputer', 'strategy': 'mean'}. Best is trial 4 with value: 4.018858933540362.
[I 2024-02-11 01:01:16,663] Trial 156 finished with value: 4.018858933540362 and parameters: {'model_name': 'SimpleImputer', 'strategy': 'mean'}. Best is trial 4 with value: 4.018858933540362.
[I 2024-02-11 01:01:16,929] Trial 160 finished with value: 4.018858933540362 and parameters: {'model_name': 'SimpleImputer', 'strategy': 'mean'}. Best is trial 4 with value: 4.018858933540362.
[I 2024-02-11 01:01:17,199] Trial 158 finished with value: 4.018858933540362 and parameters: {'model_name': 'SimpleImputer', 'strategy': 'mean'}. Best is trial 4 with value: 4.018858933540362.
[I 2024-02-11 01:01:17,433] Trial 154 finished with value: 4.018858933540362 and parameters: {'model_name': 'SimpleImputer', 'strategy': 'mean'}. Best is trial 4 with value: 4.018858933540362.
[I 2024-02-11 01:01:17,673] Trial 164 finished with value: 4.018858933540362 and parameters: {'model_name': 'SimpleImputer', 'strategy': 'mean'}. Best is trial 4 with value: 4.018858933540362.
[I 2024-02-11 01:01:17,917] Trial 157 finished with value: 4.018858933540362 and parameters: {'model_name': 'SimpleImputer', 'strategy': 'mean'}. Best is trial 4 with value: 4.018858933540362.
[I 2024-02-11 01:01:18,157] Trial 159 finished with value: 4.018858933540362 and parameters: {'model_name': 'SimpleImputer', 'strategy': 'mean'}. Best is trial 4 with value: 4.018858933540362.
[I 2024-02-11 01:01:18,407] Trial 168 finished with value: 4.018858933540362 and parameters: {'model_name': 'SimpleImputer', 'strategy': 'mean'}. Best is trial 4 with value: 4.018858933540362.
[I 2024-02-11 01:01:18,687] Trial 153 finished with value: 4.018858933540362 and parameters: {'model_name': 'SimpleImputer', 'strategy': 'mean'}. Best is trial 4 with value: 4.018858933540362.
[I 2024-02-11 01:01:18,918] Trial 162 finished with value: 4.018858933540362 and parameters: {'model_name': 'SimpleImputer', 'strategy': 'mean'}. Best is trial 4 with value: 4.018858933540362.
[I 2024-02-11 01:01:19,224] Trial 174 finished with value: 4.018858933540362 and parameters: {'model_name': 'SimpleImputer', 'strategy': 'mean'}. Best is trial 4 with value: 4.018858933540362.
[I 2024-02-11 01:01:19,434] Trial 166 finished with value: 4.018858933540362 and parameters: {'model_name': 'SimpleImputer', 'strategy': 'mean'}. Best is trial 4 with value: 4.018858933540362.
[I 2024-02-11 01:01:19,647] Trial 163 finished with value: 4.018858933540362 and parameters: {'model_name': 'SimpleImputer', 'strategy': 'mean'}. Best is trial 4 with value: 4.018858933540362.
[I 2024-02-11 01:01:19,880] Trial 161 finished with value: 4.018858933540362 and parameters: {'model_name': 'SimpleImputer', 'strategy': 'mean'}. Best is trial 4 with value: 4.018858933540362.
[I 2024-02-11 01:01:20,139] Trial 171 finished with value: 4.018858933540362 and parameters: {'model_name': 'SimpleImputer', 'strategy': 'mean'}. Best is trial 4 with value: 4.018858933540362.
[I 2024-02-11 01:01:20,472] Trial 170 finished with value: 4.018858933540362 and parameters: {'model_name': 'SimpleImputer', 'strategy': 'mean'}. Best is trial 4 with value: 4.018858933540362.
[I 2024-02-11 01:01:20,769] Trial 165 finished with value: 4.018858933540362 and parameters: {'model_name': 'SimpleImputer', 'strategy': 'mean'}. Best is trial 4 with value: 4.018858933540362.
[I 2024-02-11 01:01:20,992] Trial 169 finished with value: 4.018858933540362 and parameters: {'model_name': 'SimpleImputer', 'strategy': 'mean'}. Best is trial 4 with value: 4.018858933540362.
[I 2024-02-11 01:01:21,233] Trial 173 finished with value: 4.018858933540362 and parameters: {'model_name': 'SimpleImputer', 'strategy': 'mean'}. Best is trial 4 with value: 4.018858933540362.
[I 2024-02-11 01:01:21,495] Trial 167 finished with value: 4.018858933540362 and parameters: {'model_name': 'SimpleImputer', 'strategy': 'mean'}. Best is trial 4 with value: 4.018858933540362.
[I 2024-02-11 01:01:21,738] Trial 175 finished with value: 4.018858933540362 and parameters: {'model_name': 'SimpleImputer', 'strategy': 'mean'}. Best is trial 4 with value: 4.018858933540362.
[I 2024-02-11 01:01:22,025] Trial 178 finished with value: 4.018858933540362 and parameters: {'model_name': 'SimpleImputer', 'strategy': 'mean'}. Best is trial 4 with value: 4.018858933540362.
[I 2024-02-11 01:01:22,296] Trial 172 finished with value: 4.018858933540362 and parameters: {'model_name': 'SimpleImputer', 'strategy': 'mean'}. Best is trial 4 with value: 4.018858933540362.
[I 2024-02-11 01:01:22,493] Trial 179 finished with value: 4.018858933540362 and parameters: {'model_name': 'SimpleImputer', 'strategy': 'mean'}. Best is trial 4 with value: 4.018858933540362.
[I 2024-02-11 01:01:22,733] Trial 180 finished with value: 4.018858933540362 and parameters: {'model_name': 'SimpleImputer', 'strategy': 'mean'}. Best is trial 4 with value: 4.018858933540362.
[I 2024-02-11 01:01:22,922] Trial 182 finished with value: 4.018858933540362 and parameters: {'model_name': 'SimpleImputer', 'strategy': 'mean'}. Best is trial 4 with value: 4.018858933540362.
[I 2024-02-11 01:01:23,125] Trial 177 finished with value: 4.018858933540362 and parameters: {'model_name': 'SimpleImputer', 'strategy': 'mean'}. Best is trial 4 with value: 4.018858933540362.
[I 2024-02-11 01:01:23,450] Trial 181 finished with value: 4.018858933540362 and parameters: {'model_name': 'SimpleImputer', 'strategy': 'mean'}. Best is trial 4 with value: 4.018858933540362.
[I 2024-02-11 01:01:23,705] Trial 176 finished with value: 4.018858933540362 and parameters: {'model_name': 'SimpleImputer', 'strategy': 'mean'}. Best is trial 4 with value: 4.018858933540362.
[I 2024-02-11 01:01:24,052] Trial 95 finished with value: 4.551095295035358 and parameters: {'model_name': 'SimpleImputer', 'strategy': 'most_frequent'}. Best is trial 4 with value: 4.018858933540362.
[I 2024-02-11 01:01:24,242] Trial 96 finished with value: 4.551095295035358 and parameters: {'model_name': 'SimpleImputer', 'strategy': 'most_frequent'}. Best is trial 4 with value: 4.018858933540362.
[I 2024-02-11 01:01:24,486] Trial 193 finished with value: 4.018858933540362 and parameters: {'model_name': 'SimpleImputer', 'strategy': 'mean'}. Best is trial 4 with value: 4.018858933540362.
[I 2024-02-11 01:01:24,906] Trial 184 finished with value: 4.337778051235877 and parameters: {'model_name': 'SimpleImputer', 'strategy': 'median'}. Best is trial 4 with value: 4.018858933540362.
[I 2024-02-11 01:01:25,131] Trial 191 finished with value: 4.337778051235877 and parameters: {'model_name': 'SimpleImputer', 'strategy': 'median'}. Best is trial 4 with value: 4.018858933540362.
[I 2024-02-11 01:01:25,351] Trial 185 finished with value: 4.337778051235877 and parameters: {'model_name': 'SimpleImputer', 'strategy': 'median'}. Best is trial 4 with value: 4.018858933540362.
[I 2024-02-11 01:01:25,600] Trial 189 finished with value: 4.337778051235877 and parameters: {'model_name': 'SimpleImputer', 'strategy': 'median'}. Best is trial 4 with value: 4.018858933540362.
[I 2024-02-11 01:01:25,794] Trial 190 finished with value: 4.337778051235877 and parameters: {'model_name': 'SimpleImputer', 'strategy': 'median'}. Best is trial 4 with value: 4.018858933540362.
[I 2024-02-11 01:01:26,135] Trial 195 finished with value: 4.337778051235877 and parameters: {'model_name': 'SimpleImputer', 'strategy': 'median'}. Best is trial 4 with value: 4.018858933540362.
[I 2024-02-11 01:01:26,361] Trial 196 finished with value: 4.337778051235877 and parameters: {'model_name': 'SimpleImputer', 'strategy': 'median'}. Best is trial 4 with value: 4.018858933540362.
[I 2024-02-11 01:01:26,550] Trial 194 finished with value: 4.337778051235877 and parameters: {'model_name': 'SimpleImputer', 'strategy': 'median'}. Best is trial 4 with value: 4.018858933540362.
[I 2024-02-11 01:01:26,782] Trial 186 finished with value: 4.337778051235877 and parameters: {'model_name': 'SimpleImputer', 'strategy': 'median'}. Best is trial 4 with value: 4.018858933540362.
[I 2024-02-11 01:01:26,965] Trial 183 finished with value: 4.337778051235877 and parameters: {'model_name': 'SimpleImputer', 'strategy': 'median'}. Best is trial 4 with value: 4.018858933540362.
[I 2024-02-11 01:01:27,139] Trial 188 finished with value: 4.337778051235877 and parameters: {'model_name': 'SimpleImputer', 'strategy': 'median'}. Best is trial 4 with value: 4.018858933540362.
[I 2024-02-11 01:01:27,313] Trial 192 finished with value: 4.337778051235877 and parameters: {'model_name': 'SimpleImputer', 'strategy': 'median'}. Best is trial 4 with value: 4.018858933540362.
[I 2024-02-11 01:01:27,494] Trial 187 finished with value: 4.337778051235877 and parameters: {'model_name': 'SimpleImputer', 'strategy': 'median'}. Best is trial 4 with value: 4.018858933540362.
[I 2024-02-11 01:01:27,494] Trial 97 finished with value: 4.551095295035358 and parameters: {'model_name': 'SimpleImputer', 'strategy': 'most_frequent'}. Best is trial 4 with value: 4.018858933540362.
[I 2024-02-11 01:01:27,844] Trial 199 finished with value: 4.337778051235877 and parameters: {'model_name': 'SimpleImputer', 'strategy': 'median'}. Best is trial 4 with value: 4.018858933540362.
[I 2024-02-11 01:01:28,066] Trial 198 finished with value: 4.337778051235877 and parameters: {'model_name': 'SimpleImputer', 'strategy': 'median'}. Best is trial 4 with value: 4.018858933540362.
