Run: 15
/cm/local/apps/slurm/var/spool/job692122/slurm_script: line 23: /common/ketrong/minconda3/etc/profile.d/conda.sh: No such file or directory
/cm/local/apps/slurm/var/spool/job692122/slurm_script: line 26: $'\nconda create --name tpot2devenv -c conda-forge python=3.10\n': command not found
/cm/local/apps/slurm/var/spool/job692122/slurm_script: line 31: $'\npip install -r requirements.txt\n': command not found
RunStart
2024-03-01 08:50:09.342169: I tensorflow/core/util/port.cc:113] oneDNN custom operations are on. You may see slightly different numerical results due to floating-point round-off errors from different computation orders. To turn them off, set the environment variable `TF_ENABLE_ONEDNN_OPTS=0`.
2024-03-01 08:50:09.378396: E external/local_xla/xla/stream_executor/cuda/cuda_dnn.cc:9261] Unable to register cuDNN factory: Attempting to register factory for plugin cuDNN when one has already been registered
2024-03-01 08:50:09.378417: E external/local_xla/xla/stream_executor/cuda/cuda_fft.cc:607] Unable to register cuFFT factory: Attempting to register factory for plugin cuFFT when one has already been registered
2024-03-01 08:50:09.379826: E external/local_xla/xla/stream_executor/cuda/cuda_blas.cc:1515] Unable to register cuBLAS factory: Attempting to register factory for plugin cuBLAS when one has already been registered
2024-03-01 08:50:09.386001: I tensorflow/core/platform/cpu_feature_guard.cc:182] This TensorFlow binary is optimized to use available CPU instructions in performance-critical operations.
To enable the following instructions: AVX2 AVX512F AVX512_VNNI FMA, in other operations, rebuild TensorFlow with the appropriate compiler flags.
2024-03-01 08:50:11.392052: W tensorflow/compiler/tf2tensorrt/utils/py_utils.cc:38] TF-TRT Warning: Could not find TensorRT
WARNING:tensorflow:From /home/ketrong/miniconda3/envs/tpot2devenv/lib/python3.10/site-packages/tensorflow/python/compat/v2_compat.py:108: disable_resource_variables (from tensorflow.python.ops.variable_scope) is deprecated and will be removed in a future version.
Instructions for updating:
non-resource variables are not supported in the long term
starting loops
working on 
logs/7323/tpot2_base_normal_MNAR_0.9
4.615884780883789
loading data
logs/7323/tpot2_base_normal_MNAR_0.9/data/7323_True.pkl
8331      0.718133
3288     28.456525
7078     28.705247
13016    29.355557
9368     38.330217
           ...    
7055      1.345474
7499     35.510055
2691      1.908352
1238      0.798811
240      54.993151
Name: class, Length: 15746, dtype: float64
              0   ...   11
0      64.383854  ...  1.0
1      47.011862  ...  0.0
2      62.974394  ...  0.0
3      49.599056  ...  0.0
4      59.742924  ...  0.0
...          ...  ...  ...
15741  62.212419  ...  1.0
15742  56.708329  ...  0.0
15743  61.490196  ...  1.0
15744  72.473776  ...  0.0
15745  65.042925  ...  0.0

[15746 rows x 12 columns]
             0   ...   11
0     48.772991  ...  0.0
1     68.777309  ...  0.0
2     68.137039  ...  1.0
3     50.450310  ...  0.0
4     52.918604  ...  0.0
...         ...  ...  ...
1745  59.548575  ...  0.0
1746  81.648665  ...  0.0
1747  63.717192  ...  0.0
1748  62.440365  ...  0.0
1749  60.794579  ...  0.0

[1750 rows x 12 columns]
running experiment 1/3 - Does large hyperparameter space improve reconstruction accuracy over simple
[I 2024-03-01 08:50:33,270] A new study created in memory with name: no-name-5ec864c4-fad0-4112-9e2f-6f29178a294b
[I 2024-03-01 08:50:34,973] Trial 16 finished with value: 6.258536136518293 and parameters: {'model_name': 'SimpleImputer', 'strategy': 'constant'}. Best is trial 16 with value: 6.258536136518293.
[I 2024-03-01 08:50:35,334] Trial 19 finished with value: 6.258536136518293 and parameters: {'model_name': 'SimpleImputer', 'strategy': 'constant'}. Best is trial 16 with value: 6.258536136518293.
[I 2024-03-01 08:50:35,544] Trial 3 finished with value: 5.635667338061099 and parameters: {'model_name': 'SimpleImputer', 'strategy': 'mean'}. Best is trial 3 with value: 5.635667338061099.
[I 2024-03-01 08:50:35,694] Trial 8 finished with value: 5.635667338061099 and parameters: {'model_name': 'SimpleImputer', 'strategy': 'mean'}. Best is trial 3 with value: 5.635667338061099.
[I 2024-03-01 08:50:35,859] Trial 5 finished with value: 5.635667338061099 and parameters: {'model_name': 'SimpleImputer', 'strategy': 'mean'}. Best is trial 3 with value: 5.635667338061099.
[I 2024-03-01 08:50:36,284] Trial 15 finished with value: 6.258536136518293 and parameters: {'model_name': 'SimpleImputer', 'strategy': 'constant'}. Best is trial 3 with value: 5.635667338061099.
[I 2024-03-01 08:50:36,599] Trial 20 finished with value: 6.258536136518293 and parameters: {'model_name': 'SimpleImputer', 'strategy': 'constant'}. Best is trial 3 with value: 5.635667338061099.
[I 2024-03-01 08:50:36,844] Trial 22 finished with value: 6.258536136518293 and parameters: {'model_name': 'SimpleImputer', 'strategy': 'constant'}. Best is trial 3 with value: 5.635667338061099.
[I 2024-03-01 08:50:37,139] Trial 18 finished with value: 6.258536136518293 and parameters: {'model_name': 'SimpleImputer', 'strategy': 'constant'}. Best is trial 3 with value: 5.635667338061099.
[I 2024-03-01 08:50:37,351] Trial 26 finished with value: 6.258536136518293 and parameters: {'model_name': 'SimpleImputer', 'strategy': 'constant'}. Best is trial 3 with value: 5.635667338061099.
[I 2024-03-01 08:50:37,633] Trial 28 finished with value: 5.635667338061099 and parameters: {'model_name': 'SimpleImputer', 'strategy': 'mean'}. Best is trial 3 with value: 5.635667338061099.
[I 2024-03-01 08:50:37,956] Trial 27 finished with value: 5.635667338061099 and parameters: {'model_name': 'SimpleImputer', 'strategy': 'mean'}. Best is trial 3 with value: 5.635667338061099.
[I 2024-03-01 08:50:38,306] Trial 9 finished with value: 5.635667338061099 and parameters: {'model_name': 'SimpleImputer', 'strategy': 'mean'}. Best is trial 3 with value: 5.635667338061099.
[I 2024-03-01 08:50:38,516] Trial 39 finished with value: 6.258536136518293 and parameters: {'model_name': 'SimpleImputer', 'strategy': 'constant'}. Best is trial 3 with value: 5.635667338061099.
[I 2024-03-01 08:50:38,727] Trial 14 finished with value: 5.635667338061099 and parameters: {'model_name': 'SimpleImputer', 'strategy': 'mean'}. Best is trial 3 with value: 5.635667338061099.
[I 2024-03-01 08:50:39,013] Trial 17 finished with value: 5.635667338061099 and parameters: {'model_name': 'SimpleImputer', 'strategy': 'mean'}. Best is trial 3 with value: 5.635667338061099.
[I 2024-03-01 08:50:39,281] Trial 25 finished with value: 5.635667338061099 and parameters: {'model_name': 'SimpleImputer', 'strategy': 'mean'}. Best is trial 3 with value: 5.635667338061099.
[I 2024-03-01 08:50:39,608] Trial 46 finished with value: 6.258536136518293 and parameters: {'model_name': 'SimpleImputer', 'strategy': 'constant'}. Best is trial 3 with value: 5.635667338061099.
[I 2024-03-01 08:50:39,930] Trial 2 finished with value: 6.258536136518293 and parameters: {'model_name': 'SimpleImputer', 'strategy': 'median'}. Best is trial 3 with value: 5.635667338061099.
[I 2024-03-01 08:50:40,181] Trial 38 finished with value: 5.635667338061099 and parameters: {'model_name': 'SimpleImputer', 'strategy': 'mean'}. Best is trial 3 with value: 5.635667338061099.
[I 2024-03-01 08:50:40,520] Trial 47 finished with value: 6.258536136518293 and parameters: {'model_name': 'SimpleImputer', 'strategy': 'constant'}. Best is trial 3 with value: 5.635667338061099.
[I 2024-03-01 08:50:40,734] Trial 35 finished with value: 5.635667338061099 and parameters: {'model_name': 'SimpleImputer', 'strategy': 'mean'}. Best is trial 3 with value: 5.635667338061099.
[I 2024-03-01 08:50:40,924] Trial 11 finished with value: 6.258536136518293 and parameters: {'model_name': 'SimpleImputer', 'strategy': 'median'}. Best is trial 3 with value: 5.635667338061099.
[I 2024-03-01 08:50:41,224] Trial 31 finished with value: 5.635667338061099 and parameters: {'model_name': 'SimpleImputer', 'strategy': 'mean'}. Best is trial 3 with value: 5.635667338061099.
[I 2024-03-01 08:50:41,499] Trial 43 finished with value: 5.635667338061099 and parameters: {'model_name': 'SimpleImputer', 'strategy': 'mean'}. Best is trial 3 with value: 5.635667338061099.
[I 2024-03-01 08:50:41,749] Trial 7 finished with value: 6.258536136518293 and parameters: {'model_name': 'SimpleImputer', 'strategy': 'median'}. Best is trial 3 with value: 5.635667338061099.
[I 2024-03-01 08:50:41,936] Trial 29 finished with value: 5.635667338061099 and parameters: {'model_name': 'SimpleImputer', 'strategy': 'mean'}. Best is trial 3 with value: 5.635667338061099.
[I 2024-03-01 08:50:42,232] Trial 41 finished with value: 5.635667338061099 and parameters: {'model_name': 'SimpleImputer', 'strategy': 'mean'}. Best is trial 3 with value: 5.635667338061099.
[I 2024-03-01 08:50:42,455] Trial 10 finished with value: 6.258536136518293 and parameters: {'model_name': 'SimpleImputer', 'strategy': 'median'}. Best is trial 3 with value: 5.635667338061099.
[I 2024-03-01 08:50:42,752] Trial 55 finished with value: 6.258536136518293 and parameters: {'model_name': 'SimpleImputer', 'strategy': 'constant'}. Best is trial 3 with value: 5.635667338061099.
[I 2024-03-01 08:50:43,046] Trial 34 finished with value: 5.635667338061099 and parameters: {'model_name': 'SimpleImputer', 'strategy': 'mean'}. Best is trial 3 with value: 5.635667338061099.
[I 2024-03-01 08:50:43,272] Trial 6 finished with value: 6.258536136518293 and parameters: {'model_name': 'SimpleImputer', 'strategy': 'median'}. Best is trial 3 with value: 5.635667338061099.
[I 2024-03-01 08:50:43,551] Trial 4 finished with value: 6.258536136518293 and parameters: {'model_name': 'SimpleImputer', 'strategy': 'median'}. Best is trial 3 with value: 5.635667338061099.
[I 2024-03-01 08:50:44,074] Trial 23 finished with value: 6.258536136518293 and parameters: {'model_name': 'SimpleImputer', 'strategy': 'median'}. Best is trial 3 with value: 5.635667338061099.
[I 2024-03-01 08:50:44,354] Trial 51 finished with value: 5.635667338061099 and parameters: {'model_name': 'SimpleImputer', 'strategy': 'mean'}. Best is trial 3 with value: 5.635667338061099.
[I 2024-03-01 08:50:44,574] Trial 32 finished with value: 6.258536136518293 and parameters: {'model_name': 'SimpleImputer', 'strategy': 'median'}. Best is trial 3 with value: 5.635667338061099.
[I 2024-03-01 08:50:44,830] Trial 30 finished with value: 6.258536136518293 and parameters: {'model_name': 'SimpleImputer', 'strategy': 'median'}. Best is trial 3 with value: 5.635667338061099.
[I 2024-03-01 08:50:45,064] Trial 40 finished with value: 6.258536136518293 and parameters: {'model_name': 'SimpleImputer', 'strategy': 'median'}. Best is trial 3 with value: 5.635667338061099.
[I 2024-03-01 08:50:45,322] Trial 24 finished with value: 6.258536136518293 and parameters: {'model_name': 'SimpleImputer', 'strategy': 'median'}. Best is trial 3 with value: 5.635667338061099.
[I 2024-03-01 08:50:45,545] Trial 36 finished with value: 6.258536136518293 and parameters: {'model_name': 'SimpleImputer', 'strategy': 'median'}. Best is trial 3 with value: 5.635667338061099.
[I 2024-03-01 08:50:45,799] Trial 42 finished with value: 6.258536136518293 and parameters: {'model_name': 'SimpleImputer', 'strategy': 'median'}. Best is trial 3 with value: 5.635667338061099.
[I 2024-03-01 08:50:46,099] Trial 52 finished with value: 5.635667338061099 and parameters: {'model_name': 'SimpleImputer', 'strategy': 'mean'}. Best is trial 3 with value: 5.635667338061099.
[I 2024-03-01 08:50:46,522] Trial 33 finished with value: 6.258536136518293 and parameters: {'model_name': 'SimpleImputer', 'strategy': 'median'}. Best is trial 3 with value: 5.635667338061099.
[I 2024-03-01 08:50:46,897] Trial 45 finished with value: 6.258536136518293 and parameters: {'model_name': 'SimpleImputer', 'strategy': 'median'}. Best is trial 3 with value: 5.635667338061099.
[I 2024-03-01 08:50:47,290] Trial 56 finished with value: 5.635667338061099 and parameters: {'model_name': 'SimpleImputer', 'strategy': 'mean'}. Best is trial 3 with value: 5.635667338061099.
[I 2024-03-01 08:50:48,026] Trial 49 finished with value: 6.258536136518293 and parameters: {'model_name': 'SimpleImputer', 'strategy': 'median'}. Best is trial 3 with value: 5.635667338061099.
[I 2024-03-01 08:50:48,342] Trial 50 finished with value: 6.258536136518293 and parameters: {'model_name': 'SimpleImputer', 'strategy': 'median'}. Best is trial 3 with value: 5.635667338061099.
[I 2024-03-01 08:50:48,604] Trial 48 finished with value: 6.258536136518293 and parameters: {'model_name': 'SimpleImputer', 'strategy': 'median'}. Best is trial 3 with value: 5.635667338061099.
[I 2024-03-01 08:50:49,074] Trial 53 finished with value: 6.258536136518293 and parameters: {'model_name': 'SimpleImputer', 'strategy': 'median'}. Best is trial 3 with value: 5.635667338061099.
[I 2024-03-01 08:50:49,383] Trial 57 finished with value: 6.258536136518293 and parameters: {'model_name': 'SimpleImputer', 'strategy': 'median'}. Best is trial 3 with value: 5.635667338061099.
[I 2024-03-01 08:50:50,071] Trial 64 finished with value: 6.258536136518293 and parameters: {'model_name': 'SimpleImputer', 'strategy': 'median'}. Best is trial 3 with value: 5.635667338061099.
[I 2024-03-01 08:50:50,293] Trial 59 finished with value: 6.258536136518293 and parameters: {'model_name': 'SimpleImputer', 'strategy': 'median'}. Best is trial 3 with value: 5.635667338061099.
[I 2024-03-01 08:50:50,699] Trial 0 finished with value: 6.258536136518293 and parameters: {'model_name': 'SimpleImputer', 'strategy': 'most_frequent'}. Best is trial 3 with value: 5.635667338061099.
[I 2024-03-01 08:50:50,890] Trial 1 finished with value: 6.258536136518293 and parameters: {'model_name': 'SimpleImputer', 'strategy': 'most_frequent'}. Best is trial 3 with value: 5.635667338061099.
[I 2024-03-01 08:50:51,113] Trial 62 finished with value: 6.258536136518293 and parameters: {'model_name': 'SimpleImputer', 'strategy': 'median'}. Best is trial 3 with value: 5.635667338061099.
[I 2024-03-01 08:50:51,353] Trial 65 finished with value: 6.258536136518293 and parameters: {'model_name': 'SimpleImputer', 'strategy': 'median'}. Best is trial 3 with value: 5.635667338061099.
[I 2024-03-01 08:50:52,145] Trial 13 finished with value: 6.258536136518293 and parameters: {'model_name': 'SimpleImputer', 'strategy': 'most_frequent'}. Best is trial 3 with value: 5.635667338061099.
[I 2024-03-01 08:50:52,422] Trial 12 finished with value: 6.258536136518293 and parameters: {'model_name': 'SimpleImputer', 'strategy': 'most_frequent'}. Best is trial 3 with value: 5.635667338061099.
[I 2024-03-01 08:50:52,792] Trial 21 finished with value: 6.258536136518293 and parameters: {'model_name': 'SimpleImputer', 'strategy': 'most_frequent'}. Best is trial 3 with value: 5.635667338061099.
[I 2024-03-01 08:50:53,133] Trial 37 finished with value: 6.258536136518293 and parameters: {'model_name': 'SimpleImputer', 'strategy': 'most_frequent'}. Best is trial 3 with value: 5.635667338061099.
[I 2024-03-01 08:50:53,895] Trial 44 finished with value: 6.258536136518293 and parameters: {'model_name': 'SimpleImputer', 'strategy': 'most_frequent'}. Best is trial 3 with value: 5.635667338061099.
[I 2024-03-01 08:50:55,197] Trial 54 finished with value: 6.258536136518293 and parameters: {'model_name': 'SimpleImputer', 'strategy': 'most_frequent'}. Best is trial 3 with value: 5.635667338061099.
[I 2024-03-01 08:50:55,649] Trial 60 finished with value: 6.258536136518293 and parameters: {'model_name': 'SimpleImputer', 'strategy': 'most_frequent'}. Best is trial 3 with value: 5.635667338061099.
[I 2024-03-01 08:50:56,265] Trial 107 finished with value: 5.635667338061099 and parameters: {'model_name': 'SimpleImputer', 'strategy': 'mean'}. Best is trial 3 with value: 5.635667338061099.
[I 2024-03-01 08:50:56,630] Trial 61 finished with value: 6.258536136518293 and parameters: {'model_name': 'SimpleImputer', 'strategy': 'most_frequent'}. Best is trial 3 with value: 5.635667338061099.
[I 2024-03-01 08:50:56,851] Trial 67 finished with value: 6.258536136518293 and parameters: {'model_name': 'SimpleImputer', 'strategy': 'most_frequent'}. Best is trial 3 with value: 5.635667338061099.
[I 2024-03-01 08:50:57,101] Trial 63 finished with value: 6.258536136518293 and parameters: {'model_name': 'SimpleImputer', 'strategy': 'most_frequent'}. Best is trial 3 with value: 5.635667338061099.
[I 2024-03-01 08:50:57,294] Trial 71 finished with value: 6.258536136518293 and parameters: {'model_name': 'SimpleImputer', 'strategy': 'most_frequent'}. Best is trial 3 with value: 5.635667338061099.
[I 2024-03-01 08:50:57,499] Trial 68 finished with value: 6.258536136518293 and parameters: {'model_name': 'SimpleImputer', 'strategy': 'most_frequent'}. Best is trial 3 with value: 5.635667338061099.
[I 2024-03-01 08:50:57,747] Trial 106 finished with value: 5.635667338061099 and parameters: {'model_name': 'SimpleImputer', 'strategy': 'mean'}. Best is trial 3 with value: 5.635667338061099.
[I 2024-03-01 08:50:58,098] Trial 70 finished with value: 6.258536136518293 and parameters: {'model_name': 'SimpleImputer', 'strategy': 'most_frequent'}. Best is trial 3 with value: 5.635667338061099.
[I 2024-03-01 08:50:58,379] Trial 58 finished with value: 6.258536136518293 and parameters: {'model_name': 'SimpleImputer', 'strategy': 'most_frequent'}. Best is trial 3 with value: 5.635667338061099.
[I 2024-03-01 08:50:58,667] Trial 74 finished with value: 6.258536136518293 and parameters: {'model_name': 'SimpleImputer', 'strategy': 'most_frequent'}. Best is trial 3 with value: 5.635667338061099.
[I 2024-03-01 08:50:58,895] Trial 73 finished with value: 6.258536136518293 and parameters: {'model_name': 'SimpleImputer', 'strategy': 'most_frequent'}. Best is trial 3 with value: 5.635667338061099.
[I 2024-03-01 08:50:59,209] Trial 108 finished with value: 5.635667338061099 and parameters: {'model_name': 'SimpleImputer', 'strategy': 'mean'}. Best is trial 3 with value: 5.635667338061099.
[I 2024-03-01 08:50:59,444] Trial 79 finished with value: 6.258536136518293 and parameters: {'model_name': 'SimpleImputer', 'strategy': 'most_frequent'}. Best is trial 3 with value: 5.635667338061099.
[I 2024-03-01 08:50:59,772] Trial 77 finished with value: 6.258536136518293 and parameters: {'model_name': 'SimpleImputer', 'strategy': 'most_frequent'}. Best is trial 3 with value: 5.635667338061099.
[I 2024-03-01 08:51:00,090] Trial 76 finished with value: 6.258536136518293 and parameters: {'model_name': 'SimpleImputer', 'strategy': 'most_frequent'}. Best is trial 3 with value: 5.635667338061099.
[I 2024-03-01 08:51:00,509] Trial 81 finished with value: 6.258536136518293 and parameters: {'model_name': 'SimpleImputer', 'strategy': 'most_frequent'}. Best is trial 3 with value: 5.635667338061099.
[I 2024-03-01 08:51:00,761] Trial 86 finished with value: 6.258536136518293 and parameters: {'model_name': 'SimpleImputer', 'strategy': 'most_frequent'}. Best is trial 3 with value: 5.635667338061099.
[I 2024-03-01 08:51:01,007] Trial 66 finished with value: 6.258536136518293 and parameters: {'model_name': 'SimpleImputer', 'strategy': 'most_frequent'}. Best is trial 3 with value: 5.635667338061099.
[I 2024-03-01 08:51:01,301] Trial 75 finished with value: 6.258536136518293 and parameters: {'model_name': 'SimpleImputer', 'strategy': 'most_frequent'}. Best is trial 3 with value: 5.635667338061099.
[I 2024-03-01 08:51:01,700] Trial 89 finished with value: 6.258536136518293 and parameters: {'model_name': 'SimpleImputer', 'strategy': 'most_frequent'}. Best is trial 3 with value: 5.635667338061099.
[I 2024-03-01 08:51:01,916] Trial 80 finished with value: 6.258536136518293 and parameters: {'model_name': 'SimpleImputer', 'strategy': 'most_frequent'}. Best is trial 3 with value: 5.635667338061099.
[I 2024-03-01 08:51:02,157] Trial 84 finished with value: 6.258536136518293 and parameters: {'model_name': 'SimpleImputer', 'strategy': 'most_frequent'}. Best is trial 3 with value: 5.635667338061099.
[I 2024-03-01 08:51:02,355] Trial 72 finished with value: 6.258536136518293 and parameters: {'model_name': 'SimpleImputer', 'strategy': 'most_frequent'}. Best is trial 3 with value: 5.635667338061099.
[I 2024-03-01 08:51:02,577] Trial 78 finished with value: 6.258536136518293 and parameters: {'model_name': 'SimpleImputer', 'strategy': 'most_frequent'}. Best is trial 3 with value: 5.635667338061099.
[I 2024-03-01 08:51:02,808] Trial 109 finished with value: 5.635667338061099 and parameters: {'model_name': 'SimpleImputer', 'strategy': 'mean'}. Best is trial 3 with value: 5.635667338061099.
[I 2024-03-01 08:51:03,064] Trial 69 finished with value: 6.258536136518293 and parameters: {'model_name': 'SimpleImputer', 'strategy': 'most_frequent'}. Best is trial 3 with value: 5.635667338061099.
[I 2024-03-01 08:51:03,335] Trial 83 finished with value: 6.258536136518293 and parameters: {'model_name': 'SimpleImputer', 'strategy': 'most_frequent'}. Best is trial 3 with value: 5.635667338061099.
[I 2024-03-01 08:51:03,573] Trial 91 finished with value: 6.258536136518293 and parameters: {'model_name': 'SimpleImputer', 'strategy': 'most_frequent'}. Best is trial 3 with value: 5.635667338061099.
[I 2024-03-01 08:51:03,798] Trial 82 finished with value: 6.258536136518293 and parameters: {'model_name': 'SimpleImputer', 'strategy': 'most_frequent'}. Best is trial 3 with value: 5.635667338061099.
[I 2024-03-01 08:51:03,991] Trial 87 finished with value: 6.258536136518293 and parameters: {'model_name': 'SimpleImputer', 'strategy': 'most_frequent'}. Best is trial 3 with value: 5.635667338061099.
[I 2024-03-01 08:51:04,194] Trial 110 finished with value: 5.635667338061099 and parameters: {'model_name': 'SimpleImputer', 'strategy': 'mean'}. Best is trial 3 with value: 5.635667338061099.
