[I 2024-02-11 06:12:34,511] Trial 161 finished with value: inf and parameters: {'model_name': 'GAIN', 'batch_size': 808, 'hint_rate': 0.27, 'alpha': 100, 'iterations': 43978}. Best is trial 11 with value: 1.6840743081493854.
[I 2024-02-11 06:26:25,200] Trial 166 finished with value: inf and parameters: {'model_name': 'GAIN', 'batch_size': 743, 'hint_rate': 0.31, 'alpha': 26, 'iterations': 71416}. Best is trial 11 with value: 1.6840743081493854.
[I 2024-02-11 06:26:37,800] Trial 174 finished with value: inf and parameters: {'model_name': 'GAIN', 'batch_size': 886, 'hint_rate': 0.27, 'alpha': 96, 'iterations': 70857}. Best is trial 11 with value: 1.6840743081493854.
[I 2024-02-11 06:27:53,138] Trial 177 finished with value: inf and parameters: {'model_name': 'GAIN', 'batch_size': 914, 'hint_rate': 0.28, 'alpha': 23, 'iterations': 73219}. Best is trial 11 with value: 1.6840743081493854.
[I 2024-02-11 06:30:44,273] Trial 167 finished with value: inf and parameters: {'model_name': 'GAIN', 'batch_size': 934, 'hint_rate': 0.27, 'alpha': 100, 'iterations': 80159}. Best is trial 11 with value: 1.6840743081493854.
[I 2024-02-11 06:31:14,417] Trial 186 finished with value: inf and parameters: {'model_name': 'GAIN', 'batch_size': 955, 'hint_rate': 0.33, 'alpha': 99, 'iterations': 80899}. Best is trial 11 with value: 1.6840743081493854.
[I 2024-02-11 06:31:41,428] Trial 164 finished with value: inf and parameters: {'model_name': 'GAIN', 'batch_size': 978, 'hint_rate': 0.25, 'alpha': 26, 'iterations': 82657}. Best is trial 11 with value: 1.6840743081493854.
[I 2024-02-11 06:32:06,531] Trial 187 finished with value: inf and parameters: {'model_name': 'GAIN', 'batch_size': 932, 'hint_rate': 0.29000000000000004, 'alpha': 97, 'iterations': 83560}. Best is trial 11 with value: 1.6840743081493854.
[I 2024-02-11 06:32:21,868] Trial 168 finished with value: inf and parameters: {'model_name': 'GAIN', 'batch_size': 542, 'hint_rate': 0.29000000000000004, 'alpha': 100, 'iterations': 89062}. Best is trial 11 with value: 1.6840743081493854.
[I 2024-02-11 06:33:14,603] Trial 157 finished with value: inf and parameters: {'model_name': 'GAIN', 'batch_size': 931, 'hint_rate': 0.27, 'alpha': 28, 'iterations': 88696}. Best is trial 11 with value: 1.6840743081493854.
[I 2024-02-11 06:33:35,776] Trial 175 finished with value: inf and parameters: {'model_name': 'GAIN', 'batch_size': 745, 'hint_rate': 0.31, 'alpha': 96, 'iterations': 91532}. Best is trial 11 with value: 1.6840743081493854.
[I 2024-02-11 06:34:05,130] Trial 156 finished with value: inf and parameters: {'model_name': 'GAIN', 'batch_size': 936, 'hint_rate': 0.28, 'alpha': 27, 'iterations': 92485}. Best is trial 11 with value: 1.6840743081493854.
[I 2024-02-11 06:34:06,732] Trial 160 finished with value: inf and parameters: {'model_name': 'GAIN', 'batch_size': 647, 'hint_rate': 0.19, 'alpha': 28, 'iterations': 95974}. Best is trial 11 with value: 1.6840743081493854.
[I 2024-02-11 06:34:14,865] Trial 153 finished with value: inf and parameters: {'model_name': 'GAIN', 'batch_size': 703, 'hint_rate': 0.23, 'alpha': 27, 'iterations': 96962}. Best is trial 11 with value: 1.6840743081493854.
[I 2024-02-11 06:34:20,512] Trial 163 finished with value: inf and parameters: {'model_name': 'GAIN', 'batch_size': 989, 'hint_rate': 0.18000000000000002, 'alpha': 24, 'iterations': 94183}. Best is trial 11 with value: 1.6840743081493854.
[I 2024-02-11 06:34:30,627] Trial 155 finished with value: inf and parameters: {'model_name': 'GAIN', 'batch_size': 991, 'hint_rate': 0.27, 'alpha': 27, 'iterations': 96988}. Best is trial 11 with value: 1.6840743081493854.
