[I 2023-12-28 08:46:30,433] Trial 3 finished with value: 2.9518637296026733 and parameters: {'model_name': 'SimpleImputer', 'strategy': 'constant'}. Best is trial 3 with value: 2.9518637296026733.
[I 2023-12-28 08:46:31,735] Trial 13 finished with value: 2.9518637296026733 and parameters: {'model_name': 'SimpleImputer', 'strategy': 'constant'}. Best is trial 3 with value: 2.9518637296026733.
[I 2023-12-28 08:46:32,206] Trial 6 finished with value: 1.4919735494422892 and parameters: {'model_name': 'SimpleImputer', 'strategy': 'median'}. Best is trial 6 with value: 1.4919735494422892.
[I 2023-12-28 08:46:33,256] Trial 20 finished with value: 1.4057019541263696 and parameters: {'model_name': 'SimpleImputer', 'strategy': 'mean'}. Best is trial 20 with value: 1.4057019541263696.
[I 2023-12-28 08:46:33,813] Trial 5 finished with value: 1.4919735494422892 and parameters: {'model_name': 'SimpleImputer', 'strategy': 'median'}. Best is trial 20 with value: 1.4057019541263696.
[I 2023-12-28 08:46:34,294] Trial 15 finished with value: 1.4057019541263696 and parameters: {'model_name': 'SimpleImputer', 'strategy': 'mean'}. Best is trial 20 with value: 1.4057019541263696.
[I 2023-12-28 08:46:35,114] Trial 8 finished with value: 1.4919735494422892 and parameters: {'model_name': 'SimpleImputer', 'strategy': 'median'}. Best is trial 20 with value: 1.4057019541263696.
[I 2023-12-28 08:46:35,759] Trial 42 finished with value: 1.4057019541263696 and parameters: {'model_name': 'SimpleImputer', 'strategy': 'mean'}. Best is trial 20 with value: 1.4057019541263696.
[I 2023-12-28 08:46:36,442] Trial 27 finished with value: 1.4057019541263696 and parameters: {'model_name': 'SimpleImputer', 'strategy': 'mean'}. Best is trial 20 with value: 1.4057019541263696.
[I 2023-12-28 08:46:37,183] Trial 30 finished with value: 1.4057019541263696 and parameters: {'model_name': 'SimpleImputer', 'strategy': 'mean'}. Best is trial 20 with value: 1.4057019541263696.
[I 2023-12-28 08:46:37,958] Trial 41 finished with value: 1.4057019541263696 and parameters: {'model_name': 'SimpleImputer', 'strategy': 'mean'}. Best is trial 20 with value: 1.4057019541263696.
[I 2023-12-28 08:46:38,419] Trial 28 finished with value: 1.4919735494422892 and parameters: {'model_name': 'SimpleImputer', 'strategy': 'median'}. Best is trial 20 with value: 1.4057019541263696.
[I 2023-12-28 08:46:39,320] Trial 21 finished with value: 1.4919735494422892 and parameters: {'model_name': 'SimpleImputer', 'strategy': 'median'}. Best is trial 20 with value: 1.4057019541263696.
[I 2023-12-28 08:46:39,911] Trial 47 finished with value: 1.4057019541263696 and parameters: {'model_name': 'SimpleImputer', 'strategy': 'mean'}. Best is trial 20 with value: 1.4057019541263696.
[I 2023-12-28 08:46:40,826] Trial 50 finished with value: 1.4057019541263696 and parameters: {'model_name': 'SimpleImputer', 'strategy': 'mean'}. Best is trial 20 with value: 1.4057019541263696.
[I 2023-12-28 08:46:46,168] Trial 44 finished with value: 2.053250656068472 and parameters: {'model_name': 'SimpleImputer', 'strategy': 'most_frequent'}. Best is trial 20 with value: 1.4057019541263696.
2023-12-28 08:46:47.390059: E external/local_xla/xla/stream_executor/cuda/cuda_driver.cc:274] failed call to cuInit: CUDA_ERROR_NO_DEVICE: no CUDA-capable device is detected
2023-12-28 08:46:47.707719: I tensorflow/compiler/mlir/mlir_graph_optimization_pass.cc:388] MLIR V1 optimization pass is not enabled
[I 2023-12-28 08:46:48,351] Trial 1 finished with value: 1.5801794497859658 and parameters: {'model_name': 'KNNImputer', 'weights': 'uniform', 'keep_empty_features': False}. Best is trial 20 with value: 1.4057019541263696.
[I 2023-12-28 08:46:49,161] Trial 12 finished with value: 1.5801794497859658 and parameters: {'model_name': 'KNNImputer', 'weights': 'uniform', 'keep_empty_features': False}. Best is trial 20 with value: 1.4057019541263696.
[I 2023-12-28 08:46:49,962] Trial 2 finished with value: 1.5801794497859658 and parameters: {'model_name': 'KNNImputer', 'weights': 'uniform', 'keep_empty_features': False}. Best is trial 20 with value: 1.4057019541263696.
[I 2023-12-28 08:46:50,706] Trial 9 finished with value: 1.5801794497859658 and parameters: {'model_name': 'KNNImputer', 'weights': 'uniform', 'keep_empty_features': False}. Best is trial 20 with value: 1.4057019541263696.
[I 2023-12-28 08:46:51,431] Trial 40 finished with value: 1.6006426557351414 and parameters: {'model_name': 'KNNImputer', 'weights': 'distance', 'keep_empty_features': False}. Best is trial 20 with value: 1.4057019541263696.
[I 2023-12-28 08:46:51,991] Trial 23 finished with value: 1.5801794497859658 and parameters: {'model_name': 'KNNImputer', 'weights': 'uniform', 'keep_empty_features': False}. Best is trial 20 with value: 1.4057019541263696.
[I 2023-12-28 08:46:52,790] Trial 18 finished with value: 1.6006426557351414 and parameters: {'model_name': 'KNNImputer', 'weights': 'distance', 'keep_empty_features': False}. Best is trial 20 with value: 1.4057019541263696.
[I 2023-12-28 08:46:53,491] Trial 43 finished with value: 1.5801794497859658 and parameters: {'model_name': 'KNNImputer', 'weights': 'uniform', 'keep_empty_features': False}. Best is trial 20 with value: 1.4057019541263696.
[I 2023-12-28 08:46:54,999] Trial 49 finished with value: 1.6006426557351414 and parameters: {'model_name': 'KNNImputer', 'weights': 'distance', 'keep_empty_features': False}. Best is trial 20 with value: 1.4057019541263696.
[I 2023-12-28 08:46:55,922] Trial 48 finished with value: 1.6006426557351414 and parameters: {'model_name': 'KNNImputer', 'weights': 'distance', 'keep_empty_features': False}. Best is trial 20 with value: 1.4057019541263696.
[I 2023-12-28 08:46:56,590] Trial 51 finished with value: 1.5801794497859658 and parameters: {'model_name': 'KNNImputer', 'weights': 'uniform', 'keep_empty_features': False}. Best is trial 20 with value: 1.4057019541263696.
[I 2023-12-28 08:46:57,333] Trial 52 finished with value: 1.5801794497859658 and parameters: {'model_name': 'KNNImputer', 'weights': 'uniform', 'keep_empty_features': False}. Best is trial 20 with value: 1.4057019541263696.
[I 2023-12-28 08:46:58,529] Trial 58 finished with value: 1.6006426557351414 and parameters: {'model_name': 'KNNImputer', 'weights': 'distance', 'keep_empty_features': False}. Best is trial 20 with value: 1.4057019541263696.
[I 2023-12-28 08:46:59,003] Trial 55 finished with value: 1.5801794497859658 and parameters: {'model_name': 'KNNImputer', 'weights': 'uniform', 'keep_empty_features': False}. Best is trial 20 with value: 1.4057019541263696.
[I 2023-12-28 08:47:00,070] Trial 60 finished with value: 1.5801794497859658 and parameters: {'model_name': 'KNNImputer', 'weights': 'uniform', 'keep_empty_features': False}. Best is trial 20 with value: 1.4057019541263696.
[I 2023-12-28 08:47:06,534] Trial 16 finished with value: 1.4057019541263696 and parameters: {'model_name': 'RandomForestImputer', 'max_iter': 1, 'decreasing': False, 'min_samples_split': 0.7000000000000001, 'min_samples_leaf': 0.2, 'max_features': 0.9, 'warm_start': True}. Best is trial 20 with value: 1.4057019541263696.
[I 2023-12-28 08:47:07,147] Trial 22 finished with value: 1.4057019541263696 and parameters: {'model_name': 'RandomForestImputer', 'max_iter': 1, 'decreasing': False, 'min_samples_split': 0.0, 'min_samples_leaf': 0.30000000000000004, 'max_features': 0.5, 'warm_start': True}. Best is trial 20 with value: 1.4057019541263696.
[I 2023-12-28 08:47:07,701] Trial 39 finished with value: 1.4057019541263696 and parameters: {'model_name': 'RandomForestImputer', 'max_iter': 1, 'decreasing': True, 'min_samples_split': 0.0, 'min_samples_leaf': 0.8, 'max_features': 0.1, 'warm_start': True}. Best is trial 20 with value: 1.4057019541263696.
[I 2023-12-28 08:47:08,306] Trial 46 finished with value: 1.4057019541263696 and parameters: {'model_name': 'RandomForestImputer', 'max_iter': 1, 'decreasing': False, 'min_samples_split': 0.4, 'min_samples_leaf': 0.1, 'max_features': 0.9, 'warm_start': True}. Best is trial 20 with value: 1.4057019541263696.
[I 2023-12-28 08:47:08,921] Trial 17 finished with value: 1.4057019541263696 and parameters: {'model_name': 'RandomForestImputer', 'max_iter': 1, 'decreasing': False, 'min_samples_split': 0.1, 'min_samples_leaf': 0.2, 'max_features': 0.7000000000000001, 'warm_start': True}. Best is trial 20 with value: 1.4057019541263696.
[I 2023-12-28 08:47:09,420] Trial 45 finished with value: 1.4057019541263696 and parameters: {'model_name': 'RandomForestImputer', 'max_iter': 1, 'decreasing': True, 'min_samples_split': 0.6000000000000001, 'min_samples_leaf': 0.9, 'max_features': 0.5, 'warm_start': True}. Best is trial 20 with value: 1.4057019541263696.
[I 2023-12-28 08:47:21,635] Trial 80 finished with value: 1.4057019541263696 and parameters: {'model_name': 'RandomForestImputer', 'max_iter': 1, 'decreasing': False, 'min_samples_split': 0.6000000000000001, 'min_samples_leaf': 0.2, 'max_features': 0.6, 'warm_start': True}. Best is trial 20 with value: 1.4057019541263696.
[I 2023-12-28 08:47:22,296] Trial 79 finished with value: 1.4057019541263696 and parameters: {'model_name': 'RandomForestImputer', 'max_iter': 1, 'decreasing': False, 'min_samples_split': 0.7000000000000001, 'min_samples_leaf': 0.2, 'max_features': 0.9, 'warm_start': True}. Best is trial 20 with value: 1.4057019541263696.
[I 2023-12-28 08:47:23,318] Trial 81 finished with value: 1.4057019541263696 and parameters: {'model_name': 'RandomForestImputer', 'max_iter': 1, 'decreasing': False, 'min_samples_split': 0.8, 'min_samples_leaf': 0.2, 'max_features': 0.9, 'warm_start': True}. Best is trial 20 with value: 1.4057019541263696.
[I 2023-12-28 08:47:30,562] Trial 37 finished with value: 3.1756216076893855 and parameters: {'model_name': 'RandomForestImputer', 'max_iter': 2, 'decreasing': True, 'min_samples_split': 0.1, 'min_samples_leaf': 0.30000000000000004, 'max_features': 0.30000000000000004, 'warm_start': True}. Best is trial 20 with value: 1.4057019541263696.
[I 2023-12-28 08:47:31,809] Trial 57 finished with value: 3.140686709203862 and parameters: {'model_name': 'RandomForestImputer', 'max_iter': 2, 'decreasing': False, 'min_samples_split': 0.2, 'min_samples_leaf': 0.2, 'max_features': 0.30000000000000004, 'warm_start': True}. Best is trial 20 with value: 1.4057019541263696.
[I 2023-12-28 08:47:37,244] Trial 11 finished with value: 1.4056536237222927 and parameters: {'model_name': 'IterativeImputer', 'sample_posterior': False, 'initial_strategy': 'median', 'imputation_order': 'descending'}. Best is trial 11 with value: 1.4056536237222927.
[I 2023-12-28 08:47:40,590] Trial 7 finished with value: 1.4056536306257579 and parameters: {'model_name': 'IterativeImputer', 'sample_posterior': False, 'initial_strategy': 'median', 'imputation_order': 'random'}. Best is trial 11 with value: 1.4056536237222927.
[I 2023-12-28 08:47:41,610] Trial 19 finished with value: 1.4056518446594208 and parameters: {'model_name': 'IterativeImputer', 'sample_posterior': False, 'initial_strategy': 'most_frequent', 'imputation_order': 'roman'}. Best is trial 19 with value: 1.4056518446594208.
[I 2023-12-28 08:47:42,633] Trial 53 finished with value: 1.4056518446594208 and parameters: {'model_name': 'IterativeImputer', 'sample_posterior': False, 'initial_strategy': 'most_frequent', 'imputation_order': 'roman'}. Best is trial 19 with value: 1.4056518446594208.
[I 2023-12-28 08:47:45,174] Trial 67 finished with value: 1.4056536237222927 and parameters: {'model_name': 'IterativeImputer', 'sample_posterior': False, 'initial_strategy': 'median', 'imputation_order': 'descending'}. Best is trial 19 with value: 1.4056518446594208.
[I 2023-12-28 08:47:50,185] Trial 0 finished with value: 1.4056535911481522 and parameters: {'model_name': 'IterativeImputer', 'sample_posterior': False, 'initial_strategy': 'constant', 'imputation_order': 'arabic'}. Best is trial 19 with value: 1.4056518446594208.
[I 2023-12-28 08:47:52,239] Trial 25 finished with value: 1.4056536112460796 and parameters: {'model_name': 'IterativeImputer', 'sample_posterior': False, 'initial_strategy': 'constant', 'imputation_order': 'ascending'}. Best is trial 19 with value: 1.4056518446594208.
[I 2023-12-28 08:47:59,919] Trial 29 finished with value: 5.369322476068592 and parameters: {'model_name': 'GAIN', 'batch_size': 1, 'hint_rate': 0.74, 'alpha': 68, 'iterations': 2}. Best is trial 19 with value: 1.4056518446594208.
[I 2023-12-28 08:48:04,645] Trial 31 finished with value: 1.4057019541263696 and parameters: {'model_name': 'RandomForestImputer', 'max_iter': 1, 'decreasing': True, 'min_samples_split': 1.0, 'min_samples_leaf': 0.7000000000000001, 'max_features': 0.2, 'warm_start': False}. Best is trial 19 with value: 1.4056518446594208.
[I 2023-12-28 08:48:06,820] Trial 76 finished with value: 4.098130800599275 and parameters: {'model_name': 'GAIN', 'batch_size': 1, 'hint_rate': 0.9600000000000001, 'alpha': 67, 'iterations': 1}. Best is trial 19 with value: 1.4056518446594208.
[I 2023-12-28 08:48:12,908] Trial 84 finished with value: 5.573568928991456 and parameters: {'model_name': 'GAIN', 'batch_size': 84, 'hint_rate': 0.65, 'alpha': 72, 'iterations': 1}. Best is trial 19 with value: 1.4056518446594208.
[I 2023-12-28 08:48:16,419] Trial 78 finished with value: 1.4057019541263696 and parameters: {'model_name': 'RandomForestImputer', 'max_iter': 1, 'decreasing': True, 'min_samples_split': 0.5, 'min_samples_leaf': 0.4, 'max_features': 0.8, 'warm_start': False}. Best is trial 19 with value: 1.4056518446594208.
[I 2023-12-28 08:48:25,052] Trial 90 finished with value: 1.4056536237222927 and parameters: {'model_name': 'IterativeImputer', 'sample_posterior': False, 'initial_strategy': 'median', 'imputation_order': 'descending'}. Best is trial 19 with value: 1.4056518446594208.
[I 2023-12-28 08:48:27,109] Trial 86 finished with value: 4.589064091744003 and parameters: {'model_name': 'GAIN', 'batch_size': 1, 'hint_rate': 0.05, 'alpha': 45, 'iterations': 1}. Best is trial 19 with value: 1.4056518446594208.
[I 2023-12-28 08:48:29,506] Trial 92 finished with value: 1.4056536237222927 and parameters: {'model_name': 'IterativeImputer', 'sample_posterior': False, 'initial_strategy': 'median', 'imputation_order': 'descending'}. Best is trial 19 with value: 1.4056518446594208.
[I 2023-12-28 08:48:30,879] Trial 35 finished with value: 4.433831303894275 and parameters: {'model_name': 'GAIN', 'batch_size': 1, 'hint_rate': 0.63, 'alpha': 89, 'iterations': 14}. Best is trial 19 with value: 1.4056518446594208.
[I 2023-12-28 08:48:32,676] Trial 93 finished with value: 1.4056518446594208 and parameters: {'model_name': 'IterativeImputer', 'sample_posterior': False, 'initial_strategy': 'most_frequent', 'imputation_order': 'roman'}. Best is trial 19 with value: 1.4056518446594208.
[I 2023-12-28 08:48:33,928] Trial 94 finished with value: 1.405653628377882 and parameters: {'model_name': 'IterativeImputer', 'sample_posterior': False, 'initial_strategy': 'median', 'imputation_order': 'roman'}. Best is trial 19 with value: 1.4056518446594208.
[I 2023-12-28 08:48:34,836] Trial 91 finished with value: 1.4056531550817983 and parameters: {'model_name': 'IterativeImputer', 'sample_posterior': False, 'initial_strategy': 'median', 'imputation_order': 'random'}. Best is trial 19 with value: 1.4056518446594208.
[I 2023-12-28 08:48:38,830] Trial 4 finished with value: 3.1754058425571587 and parameters: {'model_name': 'RandomForestImputer', 'max_iter': 12, 'decreasing': True, 'min_samples_split': 1.0, 'min_samples_leaf': 0.5, 'max_features': 0.4, 'warm_start': True}. Best is trial 19 with value: 1.4056518446594208.
[I 2023-12-28 08:48:40,752] Trial 89 finished with value: 4.954917126088445 and parameters: {'model_name': 'GAIN', 'batch_size': 449, 'hint_rate': 0.49, 'alpha': 79, 'iterations': 2}. Best is trial 19 with value: 1.4056518446594208.
[I 2023-12-28 08:48:41,694] Trial 95 finished with value: 1.4056518446594208 and parameters: {'model_name': 'IterativeImputer', 'sample_posterior': False, 'initial_strategy': 'most_frequent', 'imputation_order': 'roman'}. Best is trial 19 with value: 1.4056518446594208.
[I 2023-12-28 08:48:44,817] Trial 62 finished with value: 4.077106016825438 and parameters: {'model_name': 'GAIN', 'batch_size': 1, 'hint_rate': 0.36000000000000004, 'alpha': 59, 'iterations': 19}. Best is trial 19 with value: 1.4056518446594208.
[I 2023-12-28 08:48:50,206] Trial 75 finished with value: 3.155472182601665 and parameters: {'model_name': 'RandomForestImputer', 'max_iter': 13, 'decreasing': False, 'min_samples_split': 0.4, 'min_samples_leaf': 0.4, 'max_features': 0.4, 'warm_start': True}. Best is trial 19 with value: 1.4056518446594208.
[I 2023-12-28 08:48:53,750] Trial 96 finished with value: 1.4056535769551632 and parameters: {'model_name': 'IterativeImputer', 'sample_posterior': False, 'initial_strategy': 'constant', 'imputation_order': 'roman'}. Best is trial 19 with value: 1.4056518446594208.
[I 2023-12-28 08:48:55,060] Trial 98 finished with value: 1.4056518446594208 and parameters: {'model_name': 'IterativeImputer', 'sample_posterior': False, 'initial_strategy': 'most_frequent', 'imputation_order': 'roman'}. Best is trial 19 with value: 1.4056518446594208.
[I 2023-12-28 08:48:56,597] Trial 99 finished with value: 1.405653757339364 and parameters: {'model_name': 'IterativeImputer', 'sample_posterior': False, 'initial_strategy': 'most_frequent', 'imputation_order': 'descending'}. Best is trial 19 with value: 1.4056518446594208.
[I 2023-12-28 08:49:01,120] Trial 97 finished with value: 1.4056535769551632 and parameters: {'model_name': 'IterativeImputer', 'sample_posterior': False, 'initial_strategy': 'constant', 'imputation_order': 'roman'}. Best is trial 19 with value: 1.4056518446594208.
[I 2023-12-28 08:49:02,234] Trial 100 finished with value: 1.4056518446594208 and parameters: {'model_name': 'IterativeImputer', 'sample_posterior': False, 'initial_strategy': 'most_frequent', 'imputation_order': 'roman'}. Best is trial 19 with value: 1.4056518446594208.
[I 2023-12-28 08:49:03,811] Trial 101 finished with value: 1.4056518446594208 and parameters: {'model_name': 'IterativeImputer', 'sample_posterior': False, 'initial_strategy': 'most_frequent', 'imputation_order': 'roman'}. Best is trial 19 with value: 1.4056518446594208.
[I 2023-12-28 08:49:10,669] Trial 102 finished with value: 1.4056518446594208 and parameters: {'model_name': 'IterativeImputer', 'sample_posterior': False, 'initial_strategy': 'most_frequent', 'imputation_order': 'roman'}. Best is trial 19 with value: 1.4056518446594208.
[I 2023-12-28 08:49:13,815] Trial 103 finished with value: 1.4056518446594208 and parameters: {'model_name': 'IterativeImputer', 'sample_posterior': False, 'initial_strategy': 'most_frequent', 'imputation_order': 'roman'}. Best is trial 19 with value: 1.4056518446594208.
[I 2023-12-28 08:49:14,747] Trial 105 finished with value: 1.4056518446594208 and parameters: {'model_name': 'IterativeImputer', 'sample_posterior': False, 'initial_strategy': 'most_frequent', 'imputation_order': 'roman'}. Best is trial 19 with value: 1.4056518446594208.
[I 2023-12-28 08:49:16,575] Trial 104 finished with value: 1.4056518446594208 and parameters: {'model_name': 'IterativeImputer', 'sample_posterior': False, 'initial_strategy': 'most_frequent', 'imputation_order': 'roman'}. Best is trial 19 with value: 1.4056518446594208.
[I 2023-12-28 08:49:18,347] Trial 106 finished with value: 1.4056518446594208 and parameters: {'model_name': 'IterativeImputer', 'sample_posterior': False, 'initial_strategy': 'most_frequent', 'imputation_order': 'roman'}. Best is trial 19 with value: 1.4056518446594208.
[I 2023-12-28 08:49:19,544] Trial 108 finished with value: 1.4056518446594208 and parameters: {'model_name': 'IterativeImputer', 'sample_posterior': False, 'initial_strategy': 'most_frequent', 'imputation_order': 'roman'}. Best is trial 19 with value: 1.4056518446594208.
[I 2023-12-28 08:49:20,392] Trial 107 finished with value: 1.4056518446594208 and parameters: {'model_name': 'IterativeImputer', 'sample_posterior': False, 'initial_strategy': 'most_frequent', 'imputation_order': 'roman'}. Best is trial 19 with value: 1.4056518446594208.
[I 2023-12-28 08:49:21,728] Trial 61 finished with value: 4.070103188408765 and parameters: {'model_name': 'GAIN', 'batch_size': 40, 'hint_rate': 0.6, 'alpha': 44, 'iterations': 30}. Best is trial 19 with value: 1.4056518446594208.
[I 2023-12-28 08:49:25,176] Trial 109 finished with value: 1.4056518446594208 and parameters: {'model_name': 'IterativeImputer', 'sample_posterior': False, 'initial_strategy': 'most_frequent', 'imputation_order': 'roman'}. Best is trial 19 with value: 1.4056518446594208.
[I 2023-12-28 08:49:25,933] Trial 110 finished with value: 1.4056518446594208 and parameters: {'model_name': 'IterativeImputer', 'sample_posterior': False, 'initial_strategy': 'most_frequent', 'imputation_order': 'roman'}. Best is trial 19 with value: 1.4056518446594208.
[I 2023-12-28 08:49:27,225] Trial 111 finished with value: 1.4056518446594208 and parameters: {'model_name': 'IterativeImputer', 'sample_posterior': False, 'initial_strategy': 'most_frequent', 'imputation_order': 'roman'}. Best is trial 19 with value: 1.4056518446594208.
[I 2023-12-28 08:49:30,425] Trial 112 finished with value: 1.4056518446594208 and parameters: {'model_name': 'IterativeImputer', 'sample_posterior': False, 'initial_strategy': 'most_frequent', 'imputation_order': 'roman'}. Best is trial 19 with value: 1.4056518446594208.
[I 2023-12-28 08:49:34,114] Trial 113 finished with value: 1.4056518446594208 and parameters: {'model_name': 'IterativeImputer', 'sample_posterior': False, 'initial_strategy': 'most_frequent', 'imputation_order': 'roman'}. Best is trial 19 with value: 1.4056518446594208.
