[I 2023-12-28 12:42:42,924] Trial 2 finished with value: 2.987648131662668 and parameters: {'model_name': 'SimpleImputer', 'strategy': 'constant'}. Best is trial 2 with value: 2.987648131662668.
[I 2023-12-28 12:42:44,342] Trial 8 finished with value: 2.0571795589257134 and parameters: {'model_name': 'SimpleImputer', 'strategy': 'mean'}. Best is trial 8 with value: 2.0571795589257134.
[I 2023-12-28 12:42:45,780] Trial 23 finished with value: 2.2080327340817387 and parameters: {'model_name': 'SimpleImputer', 'strategy': 'median'}. Best is trial 8 with value: 2.0571795589257134.
[I 2023-12-28 12:42:46,650] Trial 37 finished with value: 2.2080327340817387 and parameters: {'model_name': 'SimpleImputer', 'strategy': 'median'}. Best is trial 8 with value: 2.0571795589257134.
[I 2023-12-28 12:42:47,361] Trial 39 finished with value: 2.2080327340817387 and parameters: {'model_name': 'SimpleImputer', 'strategy': 'median'}. Best is trial 8 with value: 2.0571795589257134.
[I 2023-12-28 12:42:48,580] Trial 38 finished with value: 2.2080327340817387 and parameters: {'model_name': 'SimpleImputer', 'strategy': 'median'}. Best is trial 8 with value: 2.0571795589257134.
[I 2023-12-28 12:42:49,267] Trial 32 finished with value: 2.2080327340817387 and parameters: {'model_name': 'SimpleImputer', 'strategy': 'median'}. Best is trial 8 with value: 2.0571795589257134.
[I 2023-12-28 12:42:50,729] Trial 45 finished with value: 2.2080327340817387 and parameters: {'model_name': 'SimpleImputer', 'strategy': 'median'}. Best is trial 8 with value: 2.0571795589257134.
2023-12-28 12:42:53.775190: E external/local_xla/xla/stream_executor/cuda/cuda_driver.cc:274] failed call to cuInit: CUDA_ERROR_NO_DEVICE: no CUDA-capable device is detected
[I 2023-12-28 12:42:53,874] Trial 1 finished with value: 2.2621947337526542 and parameters: {'model_name': 'KNNImputer', 'weights': 'distance', 'keep_empty_features': False}. Best is trial 8 with value: 2.0571795589257134.
2023-12-28 12:42:54.416046: I tensorflow/compiler/mlir/mlir_graph_optimization_pass.cc:388] MLIR V1 optimization pass is not enabled
[I 2023-12-28 12:42:55,461] Trial 11 finished with value: 2.2621947337526542 and parameters: {'model_name': 'KNNImputer', 'weights': 'distance', 'keep_empty_features': False}. Best is trial 8 with value: 2.0571795589257134.
[I 2023-12-28 12:42:55,927] Trial 0 finished with value: 2.2621947337526542 and parameters: {'model_name': 'KNNImputer', 'weights': 'distance', 'keep_empty_features': False}. Best is trial 8 with value: 2.0571795589257134.
[I 2023-12-28 12:42:56,476] Trial 4 finished with value: 2.2516326068273322 and parameters: {'model_name': 'KNNImputer', 'weights': 'uniform', 'keep_empty_features': False}. Best is trial 8 with value: 2.0571795589257134.
[I 2023-12-28 12:42:56,973] Trial 22 finished with value: 2.2621947337526542 and parameters: {'model_name': 'KNNImputer', 'weights': 'distance', 'keep_empty_features': False}. Best is trial 8 with value: 2.0571795589257134.
[I 2023-12-28 12:42:57,410] Trial 13 finished with value: 2.2516326068273322 and parameters: {'model_name': 'KNNImputer', 'weights': 'uniform', 'keep_empty_features': False}. Best is trial 8 with value: 2.0571795589257134.
[I 2023-12-28 12:42:57,842] Trial 35 finished with value: 2.908476244236307 and parameters: {'model_name': 'SimpleImputer', 'strategy': 'most_frequent'}. Best is trial 8 with value: 2.0571795589257134.
[I 2023-12-28 12:42:58,308] Trial 18 finished with value: 2.2516326068273322 and parameters: {'model_name': 'KNNImputer', 'weights': 'uniform', 'keep_empty_features': False}. Best is trial 8 with value: 2.0571795589257134.
[I 2023-12-28 12:42:58,856] Trial 25 finished with value: 2.2516326068273322 and parameters: {'model_name': 'KNNImputer', 'weights': 'uniform', 'keep_empty_features': False}. Best is trial 8 with value: 2.0571795589257134.
[I 2023-12-28 12:42:59,349] Trial 27 finished with value: 2.2516326068273322 and parameters: {'model_name': 'KNNImputer', 'weights': 'uniform', 'keep_empty_features': False}. Best is trial 8 with value: 2.0571795589257134.
[I 2023-12-28 12:43:00,061] Trial 56 finished with value: 2.987648131662668 and parameters: {'model_name': 'SimpleImputer', 'strategy': 'constant'}. Best is trial 8 with value: 2.0571795589257134.
[I 2023-12-28 12:43:00,517] Trial 36 finished with value: 2.2621947337526542 and parameters: {'model_name': 'KNNImputer', 'weights': 'distance', 'keep_empty_features': False}. Best is trial 8 with value: 2.0571795589257134.
[I 2023-12-28 12:43:00,990] Trial 29 finished with value: 2.2516326068273322 and parameters: {'model_name': 'KNNImputer', 'weights': 'uniform', 'keep_empty_features': False}. Best is trial 8 with value: 2.0571795589257134.
[I 2023-12-28 12:43:01,527] Trial 30 finished with value: 2.2621947337526542 and parameters: {'model_name': 'KNNImputer', 'weights': 'distance', 'keep_empty_features': False}. Best is trial 8 with value: 2.0571795589257134.
[I 2023-12-28 12:43:02,002] Trial 41 finished with value: 2.2621947337526542 and parameters: {'model_name': 'KNNImputer', 'weights': 'distance', 'keep_empty_features': False}. Best is trial 8 with value: 2.0571795589257134.
[I 2023-12-28 12:43:02,517] Trial 43 finished with value: 2.2516326068273322 and parameters: {'model_name': 'KNNImputer', 'weights': 'uniform', 'keep_empty_features': False}. Best is trial 8 with value: 2.0571795589257134.
[I 2023-12-28 12:43:03,218] Trial 44 finished with value: 2.2516326068273322 and parameters: {'model_name': 'KNNImputer', 'weights': 'uniform', 'keep_empty_features': False}. Best is trial 8 with value: 2.0571795589257134.
[I 2023-12-28 12:43:04,680] Trial 21 finished with value: inf and parameters: {'model_name': 'GAIN', 'batch_size': 926, 'hint_rate': 0.66, 'alpha': 44, 'iterations': 444}. Best is trial 8 with value: 2.0571795589257134.
[I 2023-12-28 12:43:05,473] Trial 52 finished with value: 2.2516326068273322 and parameters: {'model_name': 'KNNImputer', 'weights': 'uniform', 'keep_empty_features': False}. Best is trial 8 with value: 2.0571795589257134.
[I 2023-12-28 12:43:10,683] Trial 5 finished with value: 2.0571795589257134 and parameters: {'model_name': 'RandomForestImputer', 'max_iter': 1, 'decreasing': True, 'min_samples_split': 0.2, 'min_samples_leaf': 0.7000000000000001, 'max_features': 0.7000000000000001, 'warm_start': True}. Best is trial 8 with value: 2.0571795589257134.
[I 2023-12-28 12:43:17,193] Trial 74 finished with value: 2.0571795589257134 and parameters: {'model_name': 'RandomForestImputer', 'max_iter': 1, 'decreasing': True, 'min_samples_split': 0.0, 'min_samples_leaf': 0.5, 'max_features': 0.2, 'warm_start': True}. Best is trial 8 with value: 2.0571795589257134.
[I 2023-12-28 12:43:22,382] Trial 75 finished with value: 2.0571795589257134 and parameters: {'model_name': 'RandomForestImputer', 'max_iter': 1, 'decreasing': True, 'min_samples_split': 0.2, 'min_samples_leaf': 0.7000000000000001, 'max_features': 0.8, 'warm_start': True}. Best is trial 8 with value: 2.0571795589257134.
[I 2023-12-28 12:43:24,274] Trial 26 finished with value: 2.806614635771438 and parameters: {'model_name': 'RandomForestImputer', 'max_iter': 2, 'decreasing': False, 'min_samples_split': 0.4, 'min_samples_leaf': 0.4, 'max_features': 0.5, 'warm_start': True}. Best is trial 8 with value: 2.0571795589257134.
[I 2023-12-28 12:43:27,927] Trial 76 finished with value: 2.0571795589257134 and parameters: {'model_name': 'RandomForestImputer', 'max_iter': 1, 'decreasing': True, 'min_samples_split': 0.0, 'min_samples_leaf': 0.6, 'max_features': 0.6, 'warm_start': True}. Best is trial 8 with value: 2.0571795589257134.
[I 2023-12-28 12:43:32,953] Trial 77 finished with value: 2.0571795589257134 and parameters: {'model_name': 'RandomForestImputer', 'max_iter': 1, 'decreasing': True, 'min_samples_split': 0.0, 'min_samples_leaf': 0.5, 'max_features': 0.1, 'warm_start': True}. Best is trial 8 with value: 2.0571795589257134.
[I 2023-12-28 12:43:35,746] Trial 78 finished with value: 2.0571795589257134 and parameters: {'model_name': 'RandomForestImputer', 'max_iter': 1, 'decreasing': True, 'min_samples_split': 0.0, 'min_samples_leaf': 0.7000000000000001, 'max_features': 0.8, 'warm_start': True}. Best is trial 8 with value: 2.0571795589257134.
[I 2023-12-28 12:43:40,212] Trial 79 finished with value: 2.0571795589257134 and parameters: {'model_name': 'RandomForestImputer', 'max_iter': 1, 'decreasing': True, 'min_samples_split': 0.1, 'min_samples_leaf': 0.8, 'max_features': 0.9, 'warm_start': True}. Best is trial 8 with value: 2.0571795589257134.
[I 2023-12-28 12:43:49,802] Trial 31 finished with value: 2.0588053456739583 and parameters: {'model_name': 'IterativeImputer', 'sample_posterior': False, 'initial_strategy': 'mean', 'imputation_order': 'arabic'}. Best is trial 8 with value: 2.0571795589257134.
[I 2023-12-28 12:43:51,626] Trial 19 finished with value: 2.0588053456739583 and parameters: {'model_name': 'IterativeImputer', 'sample_posterior': False, 'initial_strategy': 'mean', 'imputation_order': 'arabic'}. Best is trial 8 with value: 2.0571795589257134.
[I 2023-12-28 12:43:53,836] Trial 3 finished with value: 2.058805544941286 and parameters: {'model_name': 'IterativeImputer', 'sample_posterior': False, 'initial_strategy': 'median', 'imputation_order': 'ascending'}. Best is trial 8 with value: 2.0571795589257134.
[I 2023-12-28 12:43:54,684] Trial 17 finished with value: 2.05880556340534 and parameters: {'model_name': 'IterativeImputer', 'sample_posterior': False, 'initial_strategy': 'constant', 'imputation_order': 'arabic'}. Best is trial 8 with value: 2.0571795589257134.
[I 2023-12-28 12:43:56,343] Trial 48 finished with value: 2.058805544941286 and parameters: {'model_name': 'IterativeImputer', 'sample_posterior': False, 'initial_strategy': 'median', 'imputation_order': 'ascending'}. Best is trial 8 with value: 2.0571795589257134.
[I 2023-12-28 12:43:58,949] Trial 46 finished with value: 2.0588002144961157 and parameters: {'model_name': 'IterativeImputer', 'sample_posterior': False, 'initial_strategy': 'mean', 'imputation_order': 'random'}. Best is trial 8 with value: 2.0571795589257134.
[I 2023-12-28 12:43:59,693] Trial 14 finished with value: 2.0588053933727153 and parameters: {'model_name': 'IterativeImputer', 'sample_posterior': False, 'initial_strategy': 'median', 'imputation_order': 'random'}. Best is trial 8 with value: 2.0571795589257134.
[I 2023-12-28 12:44:00,764] Trial 60 finished with value: 2.0588053456739583 and parameters: {'model_name': 'IterativeImputer', 'sample_posterior': False, 'initial_strategy': 'mean', 'imputation_order': 'arabic'}. Best is trial 8 with value: 2.0571795589257134.
[I 2023-12-28 12:44:05,993] Trial 59 finished with value: 2.058805804152427 and parameters: {'model_name': 'IterativeImputer', 'sample_posterior': False, 'initial_strategy': 'most_frequent', 'imputation_order': 'roman'}. Best is trial 8 with value: 2.0571795589257134.
[I 2023-12-28 12:44:08,785] Trial 40 finished with value: 6.395152426325349 and parameters: {'model_name': 'GAIN', 'batch_size': 85, 'hint_rate': 0.04, 'alpha': 21, 'iterations': 2}. Best is trial 8 with value: 2.0571795589257134.
[I 2023-12-28 12:44:10,138] Trial 63 finished with value: 6.874039893526209 and parameters: {'model_name': 'GAIN', 'batch_size': 283, 'hint_rate': 0.060000000000000005, 'alpha': 82, 'iterations': 1}. Best is trial 8 with value: 2.0571795589257134.
[I 2023-12-28 12:44:13,186] Trial 68 finished with value: 2.731062450263553 and parameters: {'model_name': 'RandomForestImputer', 'max_iter': 16, 'decreasing': True, 'min_samples_split': 0.0, 'min_samples_leaf': 0.4, 'max_features': 0.30000000000000004, 'warm_start': True}. Best is trial 8 with value: 2.0571795589257134.
[I 2023-12-28 12:44:18,261] Trial 57 finished with value: 6.167143040913379 and parameters: {'model_name': 'GAIN', 'batch_size': 61, 'hint_rate': 0.77, 'alpha': 82, 'iterations': 4}. Best is trial 8 with value: 2.0571795589257134.
[I 2023-12-28 12:44:19,475] Trial 51 finished with value: 7.0270862837431185 and parameters: {'model_name': 'GAIN', 'batch_size': 149, 'hint_rate': 0.68, 'alpha': 33, 'iterations': 4}. Best is trial 8 with value: 2.0571795589257134.
[I 2023-12-28 12:44:31,394] Trial 58 finished with value: 5.651413805150354 and parameters: {'model_name': 'GAIN', 'batch_size': 11, 'hint_rate': 0.8200000000000001, 'alpha': 29, 'iterations': 9}. Best is trial 8 with value: 2.0571795589257134.
[I 2023-12-28 12:44:32,706] Trial 80 finished with value: 2.05880556340534 and parameters: {'model_name': 'IterativeImputer', 'sample_posterior': False, 'initial_strategy': 'constant', 'imputation_order': 'arabic'}. Best is trial 8 with value: 2.0571795589257134.
[I 2023-12-28 12:44:38,097] Trial 81 finished with value: 2.0588023104786424 and parameters: {'model_name': 'IterativeImputer', 'sample_posterior': False, 'initial_strategy': 'mean', 'imputation_order': 'random'}. Best is trial 8 with value: 2.0571795589257134.
[I 2023-12-28 12:44:40,249] Trial 89 finished with value: 2.735583676567526 and parameters: {'model_name': 'RandomForestImputer', 'max_iter': 10, 'decreasing': True, 'min_samples_split': 0.30000000000000004, 'min_samples_leaf': 0.6, 'max_features': 0.6, 'warm_start': True}. Best is trial 8 with value: 2.0571795589257134.
[I 2023-12-28 12:44:41,936] Trial 98 finished with value: 2.0571795589257134 and parameters: {'model_name': 'RandomForestImputer', 'max_iter': 1, 'decreasing': True, 'min_samples_split': 0.0, 'min_samples_leaf': 0.6, 'max_features': 0.1, 'warm_start': True}. Best is trial 8 with value: 2.0571795589257134.
[I 2023-12-28 12:44:45,002] Trial 67 finished with value: 5.97256974378353 and parameters: {'model_name': 'GAIN', 'batch_size': 1, 'hint_rate': 0.23, 'alpha': 11, 'iterations': 14}. Best is trial 8 with value: 2.0571795589257134.
[I 2023-12-28 12:44:48,824] Trial 91 finished with value: 2.7308018566969414 and parameters: {'model_name': 'RandomForestImputer', 'max_iter': 12, 'decreasing': True, 'min_samples_split': 0.30000000000000004, 'min_samples_leaf': 0.7000000000000001, 'max_features': 0.6, 'warm_start': True}. Best is trial 8 with value: 2.0571795589257134.
[I 2023-12-28 12:44:49,876] Trial 99 finished with value: 2.0571795589257134 and parameters: {'model_name': 'RandomForestImputer', 'max_iter': 1, 'decreasing': True, 'min_samples_split': 0.0, 'min_samples_leaf': 0.6, 'max_features': 0.1, 'warm_start': True}. Best is trial 8 with value: 2.0571795589257134.
[I 2023-12-28 12:44:51,295] Trial 88 finished with value: 2.734829199834745 and parameters: {'model_name': 'RandomForestImputer', 'max_iter': 16, 'decreasing': True, 'min_samples_split': 0.30000000000000004, 'min_samples_leaf': 0.6, 'max_features': 0.6, 'warm_start': True}. Best is trial 8 with value: 2.0571795589257134.
[I 2023-12-28 12:44:52,725] Trial 90 finished with value: 2.7323298874587225 and parameters: {'model_name': 'RandomForestImputer', 'max_iter': 16, 'decreasing': True, 'min_samples_split': 0.30000000000000004, 'min_samples_leaf': 0.6, 'max_features': 0.6, 'warm_start': True}. Best is trial 8 with value: 2.0571795589257134.
[I 2023-12-28 12:44:54,722] Trial 61 finished with value: 2.0565719377069147 and parameters: {'model_name': 'RandomForestImputer', 'max_iter': 3, 'decreasing': True, 'min_samples_split': 0.7000000000000001, 'min_samples_leaf': 0.8, 'max_features': 0.6, 'warm_start': False}. Best is trial 61 with value: 2.0565719377069147.
[I 2023-12-28 12:44:59,177] Trial 93 finished with value: 2.729786691155504 and parameters: {'model_name': 'RandomForestImputer', 'max_iter': 16, 'decreasing': True, 'min_samples_split': 0.30000000000000004, 'min_samples_leaf': 0.6, 'max_features': 0.6, 'warm_start': True}. Best is trial 61 with value: 2.0565719377069147.
[I 2023-12-28 12:45:05,966] Trial 100 finished with value: 2.0571795589257134 and parameters: {'model_name': 'RandomForestImputer', 'max_iter': 1, 'decreasing': True, 'min_samples_split': 0.0, 'min_samples_leaf': 0.6, 'max_features': 0.1, 'warm_start': False}. Best is trial 61 with value: 2.0565719377069147.
[I 2023-12-28 12:45:08,839] Trial 101 finished with value: 2.0571795589257134 and parameters: {'model_name': 'RandomForestImputer', 'max_iter': 1, 'decreasing': True, 'min_samples_split': 0.2, 'min_samples_leaf': 0.6, 'max_features': 0.1, 'warm_start': False}. Best is trial 61 with value: 2.0565719377069147.
[I 2023-12-28 12:45:11,006] Trial 102 finished with value: 2.0571795589257134 and parameters: {'model_name': 'RandomForestImputer', 'max_iter': 1, 'decreasing': True, 'min_samples_split': 0.8, 'min_samples_leaf': 0.6, 'max_features': 0.1, 'warm_start': False}. Best is trial 61 with value: 2.0565719377069147.
[I 2023-12-28 12:45:20,589] Trial 96 finished with value: 2.0567644393497657 and parameters: {'model_name': 'RandomForestImputer', 'max_iter': 2, 'decreasing': True, 'min_samples_split': 0.30000000000000004, 'min_samples_leaf': 0.7000000000000001, 'max_features': 0.7000000000000001, 'warm_start': False}. Best is trial 61 with value: 2.0565719377069147.
[I 2023-12-28 12:45:24,774] Trial 72 finished with value: 2.8053693657534478 and parameters: {'model_name': 'RandomForestImputer', 'max_iter': 54, 'decreasing': False, 'min_samples_split': 0.7000000000000001, 'min_samples_leaf': 0.5, 'max_features': 0.7000000000000001, 'warm_start': True}. Best is trial 61 with value: 2.0565719377069147.
[I 2023-12-28 12:45:31,586] Trial 66 finished with value: 2.731813657783308 and parameters: {'model_name': 'RandomForestImputer', 'max_iter': 86, 'decreasing': True, 'min_samples_split': 0.30000000000000004, 'min_samples_leaf': 0.9, 'max_features': 0.9, 'warm_start': True}. Best is trial 61 with value: 2.0565719377069147.
[I 2023-12-28 12:45:32,917] Trial 71 finished with value: 2.742902591171881 and parameters: {'model_name': 'RandomForestImputer', 'max_iter': 77, 'decreasing': True, 'min_samples_split': 0.2, 'min_samples_leaf': 0.30000000000000004, 'max_features': 0.9, 'warm_start': True}. Best is trial 61 with value: 2.0565719377069147.
[I 2023-12-28 12:45:34,125] Trial 70 finished with value: 2.731303836014967 and parameters: {'model_name': 'RandomForestImputer', 'max_iter': 60, 'decreasing': True, 'min_samples_split': 0.6000000000000001, 'min_samples_leaf': 0.30000000000000004, 'max_features': 0.5, 'warm_start': True}. Best is trial 61 with value: 2.0565719377069147.
[I 2023-12-28 12:45:49,365] Trial 94 finished with value: 2.0564644960793443 and parameters: {'model_name': 'RandomForestImputer', 'max_iter': 3, 'decreasing': True, 'min_samples_split': 0.30000000000000004, 'min_samples_leaf': 0.7000000000000001, 'max_features': 0.7000000000000001, 'warm_start': False}. Best is trial 94 with value: 2.0564644960793443.
[I 2023-12-28 12:45:51,020] Trial 117 finished with value: 2.0571795589257134 and parameters: {'model_name': 'SimpleImputer', 'strategy': 'mean'}. Best is trial 94 with value: 2.0564644960793443.
[I 2023-12-28 12:45:52,346] Trial 106 finished with value: 2.0598171732388204 and parameters: {'model_name': 'RandomForestImputer', 'max_iter': 2, 'decreasing': True, 'min_samples_split': 0.8, 'min_samples_leaf': 0.9, 'max_features': 0.8, 'warm_start': False}. Best is trial 94 with value: 2.0564644960793443.
[I 2023-12-28 12:45:54,257] Trial 103 finished with value: 2.0611701655041053 and parameters: {'model_name': 'RandomForestImputer', 'max_iter': 2, 'decreasing': True, 'min_samples_split': 0.8, 'min_samples_leaf': 0.1, 'max_features': 0.1, 'warm_start': False}. Best is trial 94 with value: 2.0564644960793443.
[I 2023-12-28 12:45:55,183] Trial 95 finished with value: 2.0585206259467936 and parameters: {'model_name': 'RandomForestImputer', 'max_iter': 3, 'decreasing': True, 'min_samples_split': 0.30000000000000004, 'min_samples_leaf': 0.7000000000000001, 'max_features': 0.7000000000000001, 'warm_start': False}. Best is trial 94 with value: 2.0564644960793443.
[I 2023-12-28 12:45:56,755] Trial 16 finished with value: 2.0587969860294684 and parameters: {'model_name': 'RandomForestImputer', 'max_iter': 6, 'decreasing': True, 'min_samples_split': 0.6000000000000001, 'min_samples_leaf': 0.7000000000000001, 'max_features': 0.8, 'warm_start': False}. Best is trial 94 with value: 2.0564644960793443.
[I 2023-12-28 12:46:00,145] Trial 108 finished with value: 2.05678790012012 and parameters: {'model_name': 'RandomForestImputer', 'max_iter': 2, 'decreasing': True, 'min_samples_split': 0.8, 'min_samples_leaf': 0.9, 'max_features': 0.8, 'warm_start': False}. Best is trial 94 with value: 2.0564644960793443.
[I 2023-12-28 12:46:03,382] Trial 97 finished with value: 2.0558319838055903 and parameters: {'model_name': 'RandomForestImputer', 'max_iter': 3, 'decreasing': True, 'min_samples_split': 0.30000000000000004, 'min_samples_leaf': 0.7000000000000001, 'max_features': 0.7000000000000001, 'warm_start': False}. Best is trial 97 with value: 2.0558319838055903.
[I 2023-12-28 12:46:05,520] Trial 12 finished with value: 2.0585687932253895 and parameters: {'model_name': 'RandomForestImputer', 'max_iter': 10, 'decreasing': True, 'min_samples_split': 0.30000000000000004, 'min_samples_leaf': 0.5, 'max_features': 0.2, 'warm_start': False}. Best is trial 97 with value: 2.0558319838055903.
[I 2023-12-28 12:46:10,461] Trial 109 finished with value: 2.0587773136493612 and parameters: {'model_name': 'RandomForestImputer', 'max_iter': 2, 'decreasing': False, 'min_samples_split': 0.7000000000000001, 'min_samples_leaf': 0.8, 'max_features': 0.8, 'warm_start': False}. Best is trial 97 with value: 2.0558319838055903.
[I 2023-12-28 12:46:12,095] Trial 126 finished with value: 2.0571795589257134 and parameters: {'model_name': 'SimpleImputer', 'strategy': 'mean'}. Best is trial 97 with value: 2.0558319838055903.
