[I 2024-02-11 05:28:15,107] Trial 131 finished with value: 1.6840743081493854 and parameters: {'model_name': 'KNNImputer', 'weights': 'distance', 'keep_empty_features': False}. Best is trial 11 with value: 1.6840743081493854.
[I 2024-02-11 05:28:15,915] Trial 130 finished with value: 1.6840743081493854 and parameters: {'model_name': 'KNNImputer', 'weights': 'distance', 'keep_empty_features': False}. Best is trial 11 with value: 1.6840743081493854.
[I 2024-02-11 05:28:18,099] Trial 96 finished with value: 1.889575735249963 and parameters: {'model_name': 'IterativeImputer', 'sample_posterior': False, 'initial_strategy': 'mean', 'imputation_order': 'descending'}. Best is trial 11 with value: 1.6840743081493854.
[I 2024-02-11 05:28:24,348] Trial 132 finished with value: 1.6840743081493854 and parameters: {'model_name': 'KNNImputer', 'weights': 'distance', 'keep_empty_features': False}. Best is trial 11 with value: 1.6840743081493854.
[I 2024-02-11 05:28:27,237] Trial 133 finished with value: 1.6840743081493854 and parameters: {'model_name': 'KNNImputer', 'weights': 'distance', 'keep_empty_features': False}. Best is trial 11 with value: 1.6840743081493854.
[I 2024-02-11 05:28:29,971] Trial 134 finished with value: 1.6840743081493854 and parameters: {'model_name': 'KNNImputer', 'weights': 'distance', 'keep_empty_features': False}. Best is trial 11 with value: 1.6840743081493854.
[I 2024-02-11 05:28:31,448] Trial 135 finished with value: 1.7189776048236596 and parameters: {'model_name': 'KNNImputer', 'weights': 'uniform', 'keep_empty_features': False}. Best is trial 11 with value: 1.6840743081493854.
[I 2024-02-11 05:28:39,412] Trial 95 finished with value: 1.8895807066801247 and parameters: {'model_name': 'IterativeImputer', 'sample_posterior': False, 'initial_strategy': 'median', 'imputation_order': 'roman'}. Best is trial 11 with value: 1.6840743081493854.
[I 2024-02-11 05:28:40,564] Trial 136 finished with value: 1.7189776048236596 and parameters: {'model_name': 'KNNImputer', 'weights': 'uniform', 'keep_empty_features': False}. Best is trial 11 with value: 1.6840743081493854.
[I 2024-02-11 05:28:49,342] Trial 137 finished with value: 1.7189776048236596 and parameters: {'model_name': 'KNNImputer', 'weights': 'uniform', 'keep_empty_features': False}. Best is trial 11 with value: 1.6840743081493854.
[I 2024-02-11 05:28:54,080] Trial 138 finished with value: 1.7189776048236596 and parameters: {'model_name': 'KNNImputer', 'weights': 'uniform', 'keep_empty_features': False}. Best is trial 11 with value: 1.6840743081493854.
[I 2024-02-11 05:28:56,301] Trial 140 finished with value: 1.7189776048236596 and parameters: {'model_name': 'KNNImputer', 'weights': 'uniform', 'keep_empty_features': False}. Best is trial 11 with value: 1.6840743081493854.
[I 2024-02-11 05:28:57,043] Trial 139 finished with value: 1.7189776048236596 and parameters: {'model_name': 'KNNImputer', 'weights': 'uniform', 'keep_empty_features': False}. Best is trial 11 with value: 1.6840743081493854.
[I 2024-02-11 05:28:58,355] Trial 141 finished with value: 1.7189776048236596 and parameters: {'model_name': 'KNNImputer', 'weights': 'uniform', 'keep_empty_features': False}. Best is trial 11 with value: 1.6840743081493854.
[I 2024-02-11 05:29:06,147] Trial 142 finished with value: 1.7189776048236596 and parameters: {'model_name': 'KNNImputer', 'weights': 'uniform', 'keep_empty_features': False}. Best is trial 11 with value: 1.6840743081493854.
[I 2024-02-11 05:29:08,298] Trial 143 finished with value: 1.7189776048236596 and parameters: {'model_name': 'KNNImputer', 'weights': 'uniform', 'keep_empty_features': False}. Best is trial 11 with value: 1.6840743081493854.
[I 2024-02-11 05:29:10,443] Trial 145 finished with value: 1.7189776048236596 and parameters: {'model_name': 'KNNImputer', 'weights': 'uniform', 'keep_empty_features': False}. Best is trial 11 with value: 1.6840743081493854.
[I 2024-02-11 05:29:12,400] Trial 144 finished with value: 1.6840743081493854 and parameters: {'model_name': 'KNNImputer', 'weights': 'distance', 'keep_empty_features': False}. Best is trial 11 with value: 1.6840743081493854.
[I 2024-02-11 05:29:18,726] Trial 146 finished with value: 1.7189776048236596 and parameters: {'model_name': 'KNNImputer', 'weights': 'uniform', 'keep_empty_features': False}. Best is trial 11 with value: 1.6840743081493854.
[I 2024-02-11 05:29:21,145] Trial 147 finished with value: 1.6840743081493854 and parameters: {'model_name': 'KNNImputer', 'weights': 'distance', 'keep_empty_features': False}. Best is trial 11 with value: 1.6840743081493854.
[I 2024-02-11 05:29:25,948] Trial 148 finished with value: 1.6840743081493854 and parameters: {'model_name': 'KNNImputer', 'weights': 'distance', 'keep_empty_features': False}. Best is trial 11 with value: 1.6840743081493854.
[I 2024-02-11 05:29:28,233] Trial 149 finished with value: 1.6840743081493854 and parameters: {'model_name': 'KNNImputer', 'weights': 'distance', 'keep_empty_features': False}. Best is trial 11 with value: 1.6840743081493854.
[I 2024-02-11 05:29:29,416] Trial 150 finished with value: 1.6840743081493854 and parameters: {'model_name': 'KNNImputer', 'weights': 'distance', 'keep_empty_features': False}. Best is trial 11 with value: 1.6840743081493854.
[I 2024-02-11 05:29:30,695] Trial 151 finished with value: 1.6840743081493854 and parameters: {'model_name': 'KNNImputer', 'weights': 'distance', 'keep_empty_features': False}. Best is trial 11 with value: 1.6840743081493854.
[I 2024-02-11 05:29:38,602] Trial 97 finished with value: 1.8895743290535194 and parameters: {'model_name': 'IterativeImputer', 'sample_posterior': False, 'initial_strategy': 'constant', 'imputation_order': 'random'}. Best is trial 11 with value: 1.6840743081493854.
[I 2024-02-11 05:30:29,142] Trial 99 finished with value: 1.8895849046121995 and parameters: {'model_name': 'IterativeImputer', 'sample_posterior': False, 'initial_strategy': 'mean', 'imputation_order': 'arabic'}. Best is trial 11 with value: 1.6840743081493854.
[I 2024-02-11 05:30:46,086] Trial 41 finished with value: 5.121779186821607 and parameters: {'model_name': 'RandomForestImputer', 'max_iter': 9, 'decreasing': True, 'min_samples_split': 0.1, 'min_samples_leaf': 0.8, 'max_features': 0.9, 'warm_start': False}. Best is trial 11 with value: 1.6840743081493854.
[I 2024-02-11 05:30:59,811] Trial 100 finished with value: 1.889578826496745 and parameters: {'model_name': 'IterativeImputer', 'sample_posterior': False, 'initial_strategy': 'mean', 'imputation_order': 'ascending'}. Best is trial 11 with value: 1.6840743081493854.
[I 2024-02-11 05:31:10,606] Trial 101 finished with value: 1.889542274617503 and parameters: {'model_name': 'IterativeImputer', 'sample_posterior': False, 'initial_strategy': 'mean', 'imputation_order': 'random'}. Best is trial 11 with value: 1.6840743081493854.
[I 2024-02-11 05:31:21,164] Trial 69 finished with value: 5.205716086657796 and parameters: {'model_name': 'GAIN', 'batch_size': 1, 'hint_rate': 0.5700000000000001, 'alpha': 35, 'iterations': 202}. Best is trial 11 with value: 1.6840743081493854.
[I 2024-02-11 05:31:30,704] Trial 102 finished with value: 1.8895817207862908 and parameters: {'model_name': 'IterativeImputer', 'sample_posterior': False, 'initial_strategy': 'most_frequent', 'imputation_order': 'roman'}. Best is trial 11 with value: 1.6840743081493854.
[I 2024-02-11 05:31:48,298] Trial 169 finished with value: 1.6840743081493854 and parameters: {'model_name': 'KNNImputer', 'weights': 'distance', 'keep_empty_features': False}. Best is trial 11 with value: 1.6840743081493854.
[I 2024-02-11 05:31:58,010] Trial 56 finished with value: 2.638015285912435 and parameters: {'model_name': 'IterativeImputer', 'sample_posterior': True, 'initial_strategy': 'mean', 'imputation_order': 'arabic'}. Best is trial 11 with value: 1.6840743081493854.
[I 2024-02-11 05:32:05,352] Trial 30 finished with value: 2.70332964336092 and parameters: {'model_name': 'IterativeImputer', 'sample_posterior': True, 'initial_strategy': 'most_frequent', 'imputation_order': 'descending'}. Best is trial 11 with value: 1.6840743081493854.
[I 2024-02-11 05:32:06,996] Trial 72 finished with value: 2.727994747019051 and parameters: {'model_name': 'IterativeImputer', 'sample_posterior': True, 'initial_strategy': 'mean', 'imputation_order': 'roman'}. Best is trial 11 with value: 1.6840743081493854.
[I 2024-02-11 05:32:09,255] Trial 75 finished with value: 2.6323392901652185 and parameters: {'model_name': 'IterativeImputer', 'sample_posterior': True, 'initial_strategy': 'mean', 'imputation_order': 'roman'}. Best is trial 11 with value: 1.6840743081493854.
[I 2024-02-11 05:32:11,308] Trial 9 finished with value: 2.69070511008152 and parameters: {'model_name': 'IterativeImputer', 'sample_posterior': True, 'initial_strategy': 'mean', 'imputation_order': 'random'}. Best is trial 11 with value: 1.6840743081493854.
[I 2024-02-11 05:32:12,670] Trial 74 finished with value: 2.687256978451315 and parameters: {'model_name': 'IterativeImputer', 'sample_posterior': True, 'initial_strategy': 'mean', 'imputation_order': 'ascending'}. Best is trial 11 with value: 1.6840743081493854.
[I 2024-02-11 05:32:13,761] Trial 26 finished with value: 2.651166906546063 and parameters: {'model_name': 'IterativeImputer', 'sample_posterior': True, 'initial_strategy': 'constant', 'imputation_order': 'random'}. Best is trial 11 with value: 1.6840743081493854.
[I 2024-02-11 05:32:16,629] Trial 80 finished with value: 2.629664612984382 and parameters: {'model_name': 'IterativeImputer', 'sample_posterior': True, 'initial_strategy': 'median', 'imputation_order': 'roman'}. Best is trial 11 with value: 1.6840743081493854.
[I 2024-02-11 05:32:17,741] Trial 21 finished with value: inf and parameters: {'model_name': 'GAIN', 'batch_size': 9, 'hint_rate': 0.67, 'alpha': 40, 'iterations': 1188}. Best is trial 11 with value: 1.6840743081493854.
[I 2024-02-11 05:32:20,594] Trial 59 finished with value: 2.6132621609243256 and parameters: {'model_name': 'IterativeImputer', 'sample_posterior': True, 'initial_strategy': 'most_frequent', 'imputation_order': 'random'}. Best is trial 11 with value: 1.6840743081493854.
[I 2024-02-11 05:32:25,707] Trial 83 finished with value: 2.6612765803327774 and parameters: {'model_name': 'IterativeImputer', 'sample_posterior': True, 'initial_strategy': 'constant', 'imputation_order': 'arabic'}. Best is trial 11 with value: 1.6840743081493854.
[I 2024-02-11 05:32:34,571] Trial 86 finished with value: 2.633349020303185 and parameters: {'model_name': 'IterativeImputer', 'sample_posterior': True, 'initial_strategy': 'median', 'imputation_order': 'roman'}. Best is trial 11 with value: 1.6840743081493854.
[I 2024-02-11 05:32:36,294] Trial 178 finished with value: 1.6840743081493854 and parameters: {'model_name': 'KNNImputer', 'weights': 'distance', 'keep_empty_features': False}. Best is trial 11 with value: 1.6840743081493854.
[I 2024-02-11 05:32:37,032] Trial 179 finished with value: 1.6840743081493854 and parameters: {'model_name': 'KNNImputer', 'weights': 'distance', 'keep_empty_features': False}. Best is trial 11 with value: 1.6840743081493854.
[I 2024-02-11 05:32:40,745] Trial 180 finished with value: 1.6840743081493854 and parameters: {'model_name': 'KNNImputer', 'weights': 'distance', 'keep_empty_features': False}. Best is trial 11 with value: 1.6840743081493854.
[I 2024-02-11 05:32:46,207] Trial 181 finished with value: 1.6840743081493854 and parameters: {'model_name': 'KNNImputer', 'weights': 'distance', 'keep_empty_features': False}. Best is trial 11 with value: 1.6840743081493854.
[I 2024-02-11 05:32:55,501] Trial 182 finished with value: 1.6840743081493854 and parameters: {'model_name': 'KNNImputer', 'weights': 'distance', 'keep_empty_features': False}. Best is trial 11 with value: 1.6840743081493854.
[I 2024-02-11 05:32:57,035] Trial 184 finished with value: 1.6840743081493854 and parameters: {'model_name': 'KNNImputer', 'weights': 'distance', 'keep_empty_features': False}. Best is trial 11 with value: 1.6840743081493854.
[I 2024-02-11 05:32:57,980] Trial 183 finished with value: 1.6840743081493854 and parameters: {'model_name': 'KNNImputer', 'weights': 'distance', 'keep_empty_features': False}. Best is trial 11 with value: 1.6840743081493854.
[I 2024-02-11 05:33:00,373] Trial 78 finished with value: inf and parameters: {'model_name': 'GAIN', 'batch_size': 4, 'hint_rate': 0.22, 'alpha': 87, 'iterations': 2639}. Best is trial 11 with value: 1.6840743081493854.
[I 2024-02-11 05:33:02,353] Trial 185 finished with value: 1.6840743081493854 and parameters: {'model_name': 'KNNImputer', 'weights': 'distance', 'keep_empty_features': False}. Best is trial 11 with value: 1.6840743081493854.
[I 2024-02-11 05:33:04,045] Trial 191 finished with value: 5.120528438465917 and parameters: {'model_name': 'SimpleImputer', 'strategy': 'mean'}. Best is trial 11 with value: 1.6840743081493854.
[I 2024-02-11 05:33:17,532] Trial 188 finished with value: 1.6840743081493854 and parameters: {'model_name': 'KNNImputer', 'weights': 'distance', 'keep_empty_features': False}. Best is trial 11 with value: 1.6840743081493854.
[I 2024-02-11 05:33:19,224] Trial 189 finished with value: 1.6840743081493854 and parameters: {'model_name': 'KNNImputer', 'weights': 'distance', 'keep_empty_features': False}. Best is trial 11 with value: 1.6840743081493854.
[I 2024-02-11 05:33:20,812] Trial 190 finished with value: 1.6840743081493854 and parameters: {'model_name': 'KNNImputer', 'weights': 'distance', 'keep_empty_features': False}. Best is trial 11 with value: 1.6840743081493854.
[I 2024-02-11 05:33:23,762] Trial 192 finished with value: 1.6840743081493854 and parameters: {'model_name': 'KNNImputer', 'weights': 'distance', 'keep_empty_features': False}. Best is trial 11 with value: 1.6840743081493854.
[I 2024-02-11 05:33:37,995] Trial 194 finished with value: 1.6840743081493854 and parameters: {'model_name': 'KNNImputer', 'weights': 'distance', 'keep_empty_features': False}. Best is trial 11 with value: 1.6840743081493854.
[I 2024-02-11 05:33:38,896] Trial 193 finished with value: 1.6840743081493854 and parameters: {'model_name': 'KNNImputer', 'weights': 'distance', 'keep_empty_features': False}. Best is trial 11 with value: 1.6840743081493854.
[I 2024-02-11 05:33:40,733] Trial 195 finished with value: 1.6840743081493854 and parameters: {'model_name': 'KNNImputer', 'weights': 'distance', 'keep_empty_features': False}. Best is trial 11 with value: 1.6840743081493854.
[I 2024-02-11 05:33:42,721] Trial 196 finished with value: 1.6840743081493854 and parameters: {'model_name': 'KNNImputer', 'weights': 'distance', 'keep_empty_features': False}. Best is trial 11 with value: 1.6840743081493854.
[I 2024-02-11 05:33:51,402] Trial 98 finished with value: 2.6935719132798726 and parameters: {'model_name': 'IterativeImputer', 'sample_posterior': True, 'initial_strategy': 'constant', 'imputation_order': 'random'}. Best is trial 11 with value: 1.6840743081493854.
[I 2024-02-11 05:33:57,210] Trial 198 finished with value: 1.6840743081493854 and parameters: {'model_name': 'KNNImputer', 'weights': 'distance', 'keep_empty_features': False}. Best is trial 11 with value: 1.6840743081493854.
[I 2024-02-11 05:33:58,028] Trial 199 finished with value: 1.6840743081493854 and parameters: {'model_name': 'KNNImputer', 'weights': 'distance', 'keep_empty_features': False}. Best is trial 11 with value: 1.6840743081493854.
[I 2024-02-11 05:34:20,347] Trial 103 finished with value: 2.687369608801217 and parameters: {'model_name': 'IterativeImputer', 'sample_posterior': True, 'initial_strategy': 'mean', 'imputation_order': 'roman'}. Best is trial 11 with value: 1.6840743081493854.
[I 2024-02-11 05:34:31,551] Trial 104 finished with value: 2.608540862037444 and parameters: {'model_name': 'IterativeImputer', 'sample_posterior': True, 'initial_strategy': 'constant', 'imputation_order': 'arabic'}. Best is trial 11 with value: 1.6840743081493854.
[I 2024-02-11 05:35:40,060] Trial 10 finished with value: inf and parameters: {'model_name': 'GAIN', 'batch_size': 26, 'hint_rate': 0.9400000000000001, 'alpha': 88, 'iterations': 4230}. Best is trial 11 with value: 1.6840743081493854.
[I 2024-02-11 05:38:14,330] Trial 37 finished with value: inf and parameters: {'model_name': 'GAIN', 'batch_size': 967, 'hint_rate': 0.42000000000000004, 'alpha': 57, 'iterations': 5575}. Best is trial 11 with value: 1.6840743081493854.
[I 2024-02-11 05:38:15,745] Trial 79 finished with value: inf and parameters: {'model_name': 'GAIN', 'batch_size': 19, 'hint_rate': 0.68, 'alpha': 82, 'iterations': 6388}. Best is trial 11 with value: 1.6840743081493854.
[I 2024-02-11 05:39:20,424] Trial 42 finished with value: inf and parameters: {'model_name': 'GAIN', 'batch_size': 11, 'hint_rate': 0.7000000000000001, 'alpha': 68, 'iterations': 7770}. Best is trial 11 with value: 1.6840743081493854.
[I 2024-02-11 05:40:45,917] Trial 1 finished with value: inf and parameters: {'model_name': 'GAIN', 'batch_size': 1, 'hint_rate': 0.45, 'alpha': 85, 'iterations': 3233}. Best is trial 11 with value: 1.6840743081493854.
[I 2024-02-11 05:42:31,749] Trial 25 finished with value: 5.120714590403317 and parameters: {'model_name': 'RandomForestImputer', 'max_iter': 64, 'decreasing': True, 'min_samples_split': 0.9, 'min_samples_leaf': 0.4, 'max_features': 0.1, 'warm_start': False}. Best is trial 11 with value: 1.6840743081493854.
[I 2024-02-11 05:43:17,601] Trial 73 finished with value: 5.1209348259275895 and parameters: {'model_name': 'RandomForestImputer', 'max_iter': 62, 'decreasing': True, 'min_samples_split': 0.7000000000000001, 'min_samples_leaf': 0.7000000000000001, 'max_features': 0.30000000000000004, 'warm_start': False}. Best is trial 11 with value: 1.6840743081493854.
[I 2024-02-11 05:44:36,848] Trial 81 finished with value: 4.565328119477378 and parameters: {'model_name': 'GAIN', 'batch_size': 2, 'hint_rate': 0.86, 'alpha': 5, 'iterations': 1387}. Best is trial 11 with value: 1.6840743081493854.
[I 2024-02-11 05:46:30,960] Trial 61 finished with value: inf and parameters: {'model_name': 'GAIN', 'batch_size': 11, 'hint_rate': 0.8200000000000001, 'alpha': 58, 'iterations': 15405}. Best is trial 11 with value: 1.6840743081493854.
[I 2024-02-11 05:46:59,871] Trial 77 finished with value: inf and parameters: {'model_name': 'GAIN', 'batch_size': 146, 'hint_rate': 0.4, 'alpha': 30, 'iterations': 13988}. Best is trial 11 with value: 1.6840743081493854.
[I 2024-02-11 05:48:38,640] Trial 82 finished with value: inf and parameters: {'model_name': 'GAIN', 'batch_size': 5, 'hint_rate': 0.72, 'alpha': 91, 'iterations': 18797}. Best is trial 11 with value: 1.6840743081493854.
[I 2024-02-11 05:51:09,525] Trial 31 finished with value: inf and parameters: {'model_name': 'GAIN', 'batch_size': 2, 'hint_rate': 0.39, 'alpha': 66, 'iterations': 22608}. Best is trial 11 with value: 1.6840743081493854.
[I 2024-02-11 05:55:37,223] Trial 159 finished with value: inf and parameters: {'model_name': 'GAIN', 'batch_size': 466, 'hint_rate': 0.28, 'alpha': 28, 'iterations': 20256}. Best is trial 11 with value: 1.6840743081493854.
[I 2024-02-11 05:55:49,937] Trial 71 finished with value: 4.0161861790548175 and parameters: {'model_name': 'GAIN', 'batch_size': 2, 'hint_rate': 0.01, 'alpha': 16, 'iterations': 2929}. Best is trial 11 with value: 1.6840743081493854.
[I 2024-02-11 05:57:04,012] Trial 170 finished with value: inf and parameters: {'model_name': 'GAIN', 'batch_size': 825, 'hint_rate': 0.32, 'alpha': 97, 'iterations': 20425}. Best is trial 11 with value: 1.6840743081493854.
[I 2024-02-11 05:58:54,102] Trial 197 finished with value: inf and parameters: {'model_name': 'GAIN', 'batch_size': 999, 'hint_rate': 0.35000000000000003, 'alpha': 17, 'iterations': 21783}. Best is trial 11 with value: 1.6840743081493854.
[I 2024-02-11 05:59:28,289] Trial 171 finished with value: inf and parameters: {'model_name': 'GAIN', 'batch_size': 825, 'hint_rate': 0.3, 'alpha': 22, 'iterations': 23064}. Best is trial 11 with value: 1.6840743081493854.
[I 2024-02-11 05:59:56,233] Trial 154 finished with value: inf and parameters: {'model_name': 'GAIN', 'batch_size': 436, 'hint_rate': 0.27, 'alpha': 27, 'iterations': 25400}. Best is trial 11 with value: 1.6840743081493854.
[I 2024-02-11 06:01:50,423] Trial 173 finished with value: inf and parameters: {'model_name': 'GAIN', 'batch_size': 563, 'hint_rate': 0.29000000000000004, 'alpha': 99, 'iterations': 26709}. Best is trial 11 with value: 1.6840743081493854.
[I 2024-02-11 06:02:09,290] Trial 6 finished with value: inf and parameters: {'model_name': 'GAIN', 'batch_size': 15, 'hint_rate': 0.3, 'alpha': 27, 'iterations': 36795}. Best is trial 11 with value: 1.6840743081493854.
[I 2024-02-11 06:03:36,153] Trial 162 finished with value: inf and parameters: {'model_name': 'GAIN', 'batch_size': 692, 'hint_rate': 0.29000000000000004, 'alpha': 100, 'iterations': 29263}. Best is trial 11 with value: 1.6840743081493854.
[I 2024-02-11 06:05:07,215] Trial 165 finished with value: inf and parameters: {'model_name': 'GAIN', 'batch_size': 486, 'hint_rate': 0.29000000000000004, 'alpha': 27, 'iterations': 32262}. Best is trial 11 with value: 1.6840743081493854.
[I 2024-02-11 06:08:41,838] Trial 152 finished with value: inf and parameters: {'model_name': 'GAIN', 'batch_size': 731, 'hint_rate': 0.36000000000000004, 'alpha': 100, 'iterations': 36865}. Best is trial 11 with value: 1.6840743081493854.
[I 2024-02-11 06:08:45,699] Trial 176 finished with value: inf and parameters: {'model_name': 'GAIN', 'batch_size': 686, 'hint_rate': 0.26, 'alpha': 28, 'iterations': 36946}. Best is trial 11 with value: 1.6840743081493854.
[I 2024-02-11 06:09:17,067] Trial 158 finished with value: inf and parameters: {'model_name': 'GAIN', 'batch_size': 638, 'hint_rate': 0.28, 'alpha': 23, 'iterations': 38439}. Best is trial 11 with value: 1.6840743081493854.
