[I 2023-12-28 08:10:15,080] Trial 78 finished with value: 2.1239659557680666 and parameters: {'model_name': 'SimpleImputer', 'strategy': 'most_frequent'}. Best is trial 1 with value: 1.4660878408546245.
[I 2023-12-28 08:10:15,427] Trial 93 finished with value: 2.1239659557680666 and parameters: {'model_name': 'SimpleImputer', 'strategy': 'most_frequent'}. Best is trial 1 with value: 1.4660878408546245.
[I 2023-12-28 08:10:15,680] Trial 116 finished with value: 1.4660878408546245 and parameters: {'model_name': 'SimpleImputer', 'strategy': 'mean'}. Best is trial 1 with value: 1.4660878408546245.
[I 2023-12-28 08:10:15,866] Trial 112 finished with value: 1.4660878408546245 and parameters: {'model_name': 'SimpleImputer', 'strategy': 'mean'}. Best is trial 1 with value: 1.4660878408546245.
[I 2023-12-28 08:10:16,272] Trial 92 finished with value: 2.1239659557680666 and parameters: {'model_name': 'SimpleImputer', 'strategy': 'most_frequent'}. Best is trial 1 with value: 1.4660878408546245.
[I 2023-12-28 08:10:16,632] Trial 84 finished with value: 2.1239659557680666 and parameters: {'model_name': 'SimpleImputer', 'strategy': 'most_frequent'}. Best is trial 1 with value: 1.4660878408546245.
[I 2023-12-28 08:10:16,828] Trial 94 finished with value: 2.1239659557680666 and parameters: {'model_name': 'SimpleImputer', 'strategy': 'most_frequent'}. Best is trial 1 with value: 1.4660878408546245.
[I 2023-12-28 08:10:17,092] Trial 90 finished with value: 2.1239659557680666 and parameters: {'model_name': 'SimpleImputer', 'strategy': 'most_frequent'}. Best is trial 1 with value: 1.4660878408546245.
[I 2023-12-28 08:10:17,424] Trial 115 finished with value: 1.4660878408546245 and parameters: {'model_name': 'SimpleImputer', 'strategy': 'mean'}. Best is trial 1 with value: 1.4660878408546245.
[I 2023-12-28 08:10:17,717] Trial 118 finished with value: 1.4660878408546245 and parameters: {'model_name': 'SimpleImputer', 'strategy': 'mean'}. Best is trial 1 with value: 1.4660878408546245.
[I 2023-12-28 08:10:18,074] Trial 95 finished with value: 2.1239659557680666 and parameters: {'model_name': 'SimpleImputer', 'strategy': 'most_frequent'}. Best is trial 1 with value: 1.4660878408546245.
[I 2023-12-28 08:10:18,338] Trial 130 finished with value: 1.4660878408546245 and parameters: {'model_name': 'SimpleImputer', 'strategy': 'mean'}. Best is trial 1 with value: 1.4660878408546245.
[I 2023-12-28 08:10:18,559] Trial 82 finished with value: 2.1239659557680666 and parameters: {'model_name': 'SimpleImputer', 'strategy': 'most_frequent'}. Best is trial 1 with value: 1.4660878408546245.
[I 2023-12-28 08:10:18,754] Trial 122 finished with value: 1.4660878408546245 and parameters: {'model_name': 'SimpleImputer', 'strategy': 'mean'}. Best is trial 1 with value: 1.4660878408546245.
[I 2023-12-28 08:10:19,068] Trial 125 finished with value: 1.4660878408546245 and parameters: {'model_name': 'SimpleImputer', 'strategy': 'mean'}. Best is trial 1 with value: 1.4660878408546245.
[I 2023-12-28 08:10:19,310] Trial 117 finished with value: 1.4660878408546245 and parameters: {'model_name': 'SimpleImputer', 'strategy': 'mean'}. Best is trial 1 with value: 1.4660878408546245.
[I 2023-12-28 08:10:19,564] Trial 123 finished with value: 1.4660878408546245 and parameters: {'model_name': 'SimpleImputer', 'strategy': 'mean'}. Best is trial 1 with value: 1.4660878408546245.
[I 2023-12-28 08:10:19,926] Trial 120 finished with value: 1.4660878408546245 and parameters: {'model_name': 'SimpleImputer', 'strategy': 'mean'}. Best is trial 1 with value: 1.4660878408546245.
[I 2023-12-28 08:10:20,181] Trial 119 finished with value: 1.4660878408546245 and parameters: {'model_name': 'SimpleImputer', 'strategy': 'mean'}. Best is trial 1 with value: 1.4660878408546245.
[I 2023-12-28 08:10:20,432] Trial 127 finished with value: 1.4660878408546245 and parameters: {'model_name': 'SimpleImputer', 'strategy': 'mean'}. Best is trial 1 with value: 1.4660878408546245.
[I 2023-12-28 08:10:20,618] Trial 129 finished with value: 1.4660878408546245 and parameters: {'model_name': 'SimpleImputer', 'strategy': 'mean'}. Best is trial 1 with value: 1.4660878408546245.
[I 2023-12-28 08:10:20,824] Trial 133 finished with value: 1.4660878408546245 and parameters: {'model_name': 'SimpleImputer', 'strategy': 'mean'}. Best is trial 1 with value: 1.4660878408546245.
[I 2023-12-28 08:10:21,088] Trial 100 finished with value: 2.1239659557680666 and parameters: {'model_name': 'SimpleImputer', 'strategy': 'most_frequent'}. Best is trial 1 with value: 1.4660878408546245.
[I 2023-12-28 08:10:21,343] Trial 121 finished with value: 1.4660878408546245 and parameters: {'model_name': 'SimpleImputer', 'strategy': 'mean'}. Best is trial 1 with value: 1.4660878408546245.
[I 2023-12-28 08:10:21,608] Trial 132 finished with value: 1.4660878408546245 and parameters: {'model_name': 'SimpleImputer', 'strategy': 'mean'}. Best is trial 1 with value: 1.4660878408546245.
[I 2023-12-28 08:10:21,847] Trial 126 finished with value: 1.4660878408546245 and parameters: {'model_name': 'SimpleImputer', 'strategy': 'mean'}. Best is trial 1 with value: 1.4660878408546245.
[I 2023-12-28 08:10:22,103] Trial 96 finished with value: 2.1239659557680666 and parameters: {'model_name': 'SimpleImputer', 'strategy': 'most_frequent'}. Best is trial 1 with value: 1.4660878408546245.
[I 2023-12-28 08:10:22,306] Trial 136 finished with value: 1.4660878408546245 and parameters: {'model_name': 'SimpleImputer', 'strategy': 'mean'}. Best is trial 1 with value: 1.4660878408546245.
[I 2023-12-28 08:10:22,606] Trial 128 finished with value: 1.4660878408546245 and parameters: {'model_name': 'SimpleImputer', 'strategy': 'mean'}. Best is trial 1 with value: 1.4660878408546245.
[I 2023-12-28 08:10:22,847] Trial 124 finished with value: 1.4660878408546245 and parameters: {'model_name': 'SimpleImputer', 'strategy': 'mean'}. Best is trial 1 with value: 1.4660878408546245.
[I 2023-12-28 08:10:23,116] Trial 138 finished with value: 1.4660878408546245 and parameters: {'model_name': 'SimpleImputer', 'strategy': 'mean'}. Best is trial 1 with value: 1.4660878408546245.
[I 2023-12-28 08:10:23,343] Trial 131 finished with value: 1.4660878408546245 and parameters: {'model_name': 'SimpleImputer', 'strategy': 'mean'}. Best is trial 1 with value: 1.4660878408546245.
[I 2023-12-28 08:10:23,715] Trial 97 finished with value: 2.1239659557680666 and parameters: {'model_name': 'SimpleImputer', 'strategy': 'most_frequent'}. Best is trial 1 with value: 1.4660878408546245.
[I 2023-12-28 08:10:23,903] Trial 99 finished with value: 2.1239659557680666 and parameters: {'model_name': 'SimpleImputer', 'strategy': 'most_frequent'}. Best is trial 1 with value: 1.4660878408546245.
[I 2023-12-28 08:10:24,217] Trial 147 finished with value: 1.4660878408546245 and parameters: {'model_name': 'SimpleImputer', 'strategy': 'mean'}. Best is trial 1 with value: 1.4660878408546245.
[I 2023-12-28 08:10:24,447] Trial 143 finished with value: 1.4660878408546245 and parameters: {'model_name': 'SimpleImputer', 'strategy': 'mean'}. Best is trial 1 with value: 1.4660878408546245.
[I 2023-12-28 08:10:24,655] Trial 145 finished with value: 1.4660878408546245 and parameters: {'model_name': 'SimpleImputer', 'strategy': 'mean'}. Best is trial 1 with value: 1.4660878408546245.
[I 2023-12-28 08:10:24,867] Trial 142 finished with value: 1.4660878408546245 and parameters: {'model_name': 'SimpleImputer', 'strategy': 'mean'}. Best is trial 1 with value: 1.4660878408546245.
[I 2023-12-28 08:10:25,060] Trial 98 finished with value: 2.1239659557680666 and parameters: {'model_name': 'SimpleImputer', 'strategy': 'most_frequent'}. Best is trial 1 with value: 1.4660878408546245.
[I 2023-12-28 08:10:25,300] Trial 140 finished with value: 1.4660878408546245 and parameters: {'model_name': 'SimpleImputer', 'strategy': 'mean'}. Best is trial 1 with value: 1.4660878408546245.
[I 2023-12-28 08:10:25,488] Trial 137 finished with value: 1.4660878408546245 and parameters: {'model_name': 'SimpleImputer', 'strategy': 'mean'}. Best is trial 1 with value: 1.4660878408546245.
[I 2023-12-28 08:10:25,721] Trial 146 finished with value: 1.4660878408546245 and parameters: {'model_name': 'SimpleImputer', 'strategy': 'mean'}. Best is trial 1 with value: 1.4660878408546245.
[I 2023-12-28 08:10:25,889] Trial 135 finished with value: 1.4660878408546245 and parameters: {'model_name': 'SimpleImputer', 'strategy': 'mean'}. Best is trial 1 with value: 1.4660878408546245.
[I 2023-12-28 08:10:26,091] Trial 144 finished with value: 1.4660878408546245 and parameters: {'model_name': 'SimpleImputer', 'strategy': 'mean'}. Best is trial 1 with value: 1.4660878408546245.
[I 2023-12-28 08:10:26,402] Trial 134 finished with value: 1.4660878408546245 and parameters: {'model_name': 'SimpleImputer', 'strategy': 'mean'}. Best is trial 1 with value: 1.4660878408546245.
[I 2023-12-28 08:10:26,729] Trial 149 finished with value: 1.4660878408546245 and parameters: {'model_name': 'SimpleImputer', 'strategy': 'mean'}. Best is trial 1 with value: 1.4660878408546245.
[I 2023-12-28 08:10:26,985] Trial 141 finished with value: 1.4660878408546245 and parameters: {'model_name': 'SimpleImputer', 'strategy': 'mean'}. Best is trial 1 with value: 1.4660878408546245.
[I 2023-12-28 08:10:27,192] Trial 155 finished with value: 1.4660878408546245 and parameters: {'model_name': 'SimpleImputer', 'strategy': 'mean'}. Best is trial 1 with value: 1.4660878408546245.
[I 2023-12-28 08:10:27,353] Trial 104 finished with value: 2.1239659557680666 and parameters: {'model_name': 'SimpleImputer', 'strategy': 'most_frequent'}. Best is trial 1 with value: 1.4660878408546245.
[I 2023-12-28 08:10:27,612] Trial 139 finished with value: 1.4660878408546245 and parameters: {'model_name': 'SimpleImputer', 'strategy': 'mean'}. Best is trial 1 with value: 1.4660878408546245.
[I 2023-12-28 08:10:27,832] Trial 154 finished with value: 1.4660878408546245 and parameters: {'model_name': 'SimpleImputer', 'strategy': 'mean'}. Best is trial 1 with value: 1.4660878408546245.
[I 2023-12-28 08:10:28,131] Trial 156 finished with value: 1.4660878408546245 and parameters: {'model_name': 'SimpleImputer', 'strategy': 'mean'}. Best is trial 1 with value: 1.4660878408546245.
[I 2023-12-28 08:10:28,321] Trial 157 finished with value: 1.4660878408546245 and parameters: {'model_name': 'SimpleImputer', 'strategy': 'mean'}. Best is trial 1 with value: 1.4660878408546245.
[I 2023-12-28 08:10:28,584] Trial 101 finished with value: 2.1239659557680666 and parameters: {'model_name': 'SimpleImputer', 'strategy': 'most_frequent'}. Best is trial 1 with value: 1.4660878408546245.
[I 2023-12-28 08:10:28,901] Trial 151 finished with value: 1.4660878408546245 and parameters: {'model_name': 'SimpleImputer', 'strategy': 'mean'}. Best is trial 1 with value: 1.4660878408546245.
[I 2023-12-28 08:10:29,182] Trial 159 finished with value: 1.4660878408546245 and parameters: {'model_name': 'SimpleImputer', 'strategy': 'mean'}. Best is trial 1 with value: 1.4660878408546245.
[I 2023-12-28 08:10:29,487] Trial 153 finished with value: 1.4660878408546245 and parameters: {'model_name': 'SimpleImputer', 'strategy': 'mean'}. Best is trial 1 with value: 1.4660878408546245.
[I 2023-12-28 08:10:29,674] Trial 163 finished with value: 1.4660878408546245 and parameters: {'model_name': 'SimpleImputer', 'strategy': 'mean'}. Best is trial 1 with value: 1.4660878408546245.
[I 2023-12-28 08:10:29,928] Trial 148 finished with value: 1.4660878408546245 and parameters: {'model_name': 'SimpleImputer', 'strategy': 'mean'}. Best is trial 1 with value: 1.4660878408546245.
[I 2023-12-28 08:10:30,114] Trial 160 finished with value: 1.4660878408546245 and parameters: {'model_name': 'SimpleImputer', 'strategy': 'mean'}. Best is trial 1 with value: 1.4660878408546245.
[I 2023-12-28 08:10:30,297] Trial 161 finished with value: 1.4660878408546245 and parameters: {'model_name': 'SimpleImputer', 'strategy': 'mean'}. Best is trial 1 with value: 1.4660878408546245.
[I 2023-12-28 08:10:30,569] Trial 150 finished with value: 1.4660878408546245 and parameters: {'model_name': 'SimpleImputer', 'strategy': 'mean'}. Best is trial 1 with value: 1.4660878408546245.
[I 2023-12-28 08:10:30,803] Trial 152 finished with value: 1.4660878408546245 and parameters: {'model_name': 'SimpleImputer', 'strategy': 'mean'}. Best is trial 1 with value: 1.4660878408546245.
[I 2023-12-28 08:10:30,977] Trial 165 finished with value: 1.4660878408546245 and parameters: {'model_name': 'SimpleImputer', 'strategy': 'mean'}. Best is trial 1 with value: 1.4660878408546245.
[I 2023-12-28 08:10:31,190] Trial 158 finished with value: 1.4660878408546245 and parameters: {'model_name': 'SimpleImputer', 'strategy': 'mean'}. Best is trial 1 with value: 1.4660878408546245.
[I 2023-12-28 08:10:31,442] Trial 169 finished with value: 1.4660878408546245 and parameters: {'model_name': 'SimpleImputer', 'strategy': 'mean'}. Best is trial 1 with value: 1.4660878408546245.
[I 2023-12-28 08:10:31,687] Trial 171 finished with value: 2.9732354120222957 and parameters: {'model_name': 'SimpleImputer', 'strategy': 'constant'}. Best is trial 1 with value: 1.4660878408546245.
[I 2023-12-28 08:10:31,970] Trial 162 finished with value: 1.4660878408546245 and parameters: {'model_name': 'SimpleImputer', 'strategy': 'mean'}. Best is trial 1 with value: 1.4660878408546245.
[I 2023-12-28 08:10:32,219] Trial 166 finished with value: 1.4660878408546245 and parameters: {'model_name': 'SimpleImputer', 'strategy': 'mean'}. Best is trial 1 with value: 1.4660878408546245.
[I 2023-12-28 08:10:32,404] Trial 170 finished with value: 2.9732354120222957 and parameters: {'model_name': 'SimpleImputer', 'strategy': 'constant'}. Best is trial 1 with value: 1.4660878408546245.
[I 2023-12-28 08:10:32,744] Trial 172 finished with value: 2.9732354120222957 and parameters: {'model_name': 'SimpleImputer', 'strategy': 'constant'}. Best is trial 1 with value: 1.4660878408546245.
[I 2023-12-28 08:10:32,983] Trial 164 finished with value: 1.4660878408546245 and parameters: {'model_name': 'SimpleImputer', 'strategy': 'mean'}. Best is trial 1 with value: 1.4660878408546245.
[I 2023-12-28 08:10:33,272] Trial 178 finished with value: 2.9732354120222957 and parameters: {'model_name': 'SimpleImputer', 'strategy': 'constant'}. Best is trial 1 with value: 1.4660878408546245.
[I 2023-12-28 08:10:33,522] Trial 103 finished with value: 2.1239659557680666 and parameters: {'model_name': 'SimpleImputer', 'strategy': 'most_frequent'}. Best is trial 1 with value: 1.4660878408546245.
[I 2023-12-28 08:10:33,788] Trial 167 finished with value: 1.4660878408546245 and parameters: {'model_name': 'SimpleImputer', 'strategy': 'mean'}. Best is trial 1 with value: 1.4660878408546245.
[I 2023-12-28 08:10:34,042] Trial 175 finished with value: 2.9732354120222957 and parameters: {'model_name': 'SimpleImputer', 'strategy': 'constant'}. Best is trial 1 with value: 1.4660878408546245.
[I 2023-12-28 08:10:34,408] Trial 168 finished with value: 1.4660878408546245 and parameters: {'model_name': 'SimpleImputer', 'strategy': 'mean'}. Best is trial 1 with value: 1.4660878408546245.
[I 2023-12-28 08:10:34,687] Trial 185 finished with value: 2.9732354120222957 and parameters: {'model_name': 'SimpleImputer', 'strategy': 'constant'}. Best is trial 1 with value: 1.4660878408546245.
[I 2023-12-28 08:10:34,939] Trial 176 finished with value: 2.9732354120222957 and parameters: {'model_name': 'SimpleImputer', 'strategy': 'constant'}. Best is trial 1 with value: 1.4660878408546245.
[I 2023-12-28 08:10:35,209] Trial 174 finished with value: 1.4660878408546245 and parameters: {'model_name': 'SimpleImputer', 'strategy': 'mean'}. Best is trial 1 with value: 1.4660878408546245.
[I 2023-12-28 08:10:35,517] Trial 181 finished with value: 2.9732354120222957 and parameters: {'model_name': 'SimpleImputer', 'strategy': 'constant'}. Best is trial 1 with value: 1.4660878408546245.
[I 2023-12-28 08:10:35,689] Trial 173 finished with value: 1.4660878408546245 and parameters: {'model_name': 'SimpleImputer', 'strategy': 'mean'}. Best is trial 1 with value: 1.4660878408546245.
[I 2023-12-28 08:10:35,890] Trial 198 finished with value: 2.9732354120222957 and parameters: {'model_name': 'SimpleImputer', 'strategy': 'constant'}. Best is trial 1 with value: 1.4660878408546245.
[I 2023-12-28 08:10:36,173] Trial 180 finished with value: 2.9732354120222957 and parameters: {'model_name': 'SimpleImputer', 'strategy': 'constant'}. Best is trial 1 with value: 1.4660878408546245.
[I 2023-12-28 08:10:36,351] Trial 188 finished with value: 1.4660878408546245 and parameters: {'model_name': 'SimpleImputer', 'strategy': 'mean'}. Best is trial 1 with value: 1.4660878408546245.
[I 2023-12-28 08:10:36,600] Trial 183 finished with value: 2.9732354120222957 and parameters: {'model_name': 'SimpleImputer', 'strategy': 'constant'}. Best is trial 1 with value: 1.4660878408546245.
[I 2023-12-28 08:10:36,831] Trial 191 finished with value: 2.9732354120222957 and parameters: {'model_name': 'SimpleImputer', 'strategy': 'constant'}. Best is trial 1 with value: 1.4660878408546245.
[I 2023-12-28 08:10:37,104] Trial 193 finished with value: 2.9732354120222957 and parameters: {'model_name': 'SimpleImputer', 'strategy': 'constant'}. Best is trial 1 with value: 1.4660878408546245.
[I 2023-12-28 08:10:37,355] Trial 196 finished with value: 2.9732354120222957 and parameters: {'model_name': 'SimpleImputer', 'strategy': 'constant'}. Best is trial 1 with value: 1.4660878408546245.
[I 2023-12-28 08:10:37,593] Trial 199 finished with value: 2.9732354120222957 and parameters: {'model_name': 'SimpleImputer', 'strategy': 'constant'}. Best is trial 1 with value: 1.4660878408546245.
[I 2023-12-28 08:10:37,846] Trial 187 finished with value: 2.9732354120222957 and parameters: {'model_name': 'SimpleImputer', 'strategy': 'constant'}. Best is trial 1 with value: 1.4660878408546245.
[I 2023-12-28 08:10:38,019] Trial 197 finished with value: 2.9732354120222957 and parameters: {'model_name': 'SimpleImputer', 'strategy': 'constant'}. Best is trial 1 with value: 1.4660878408546245.
[I 2023-12-28 08:10:38,030] Trial 194 finished with value: 2.9732354120222957 and parameters: {'model_name': 'SimpleImputer', 'strategy': 'constant'}. Best is trial 1 with value: 1.4660878408546245.
[I 2023-12-28 08:10:38,034] Trial 186 finished with value: 2.9732354120222957 and parameters: {'model_name': 'SimpleImputer', 'strategy': 'constant'}. Best is trial 1 with value: 1.4660878408546245.
[I 2023-12-28 08:10:38,514] Trial 195 finished with value: 2.9732354120222957 and parameters: {'model_name': 'SimpleImputer', 'strategy': 'constant'}. Best is trial 1 with value: 1.4660878408546245.
[I 2023-12-28 08:10:38,684] Trial 182 finished with value: 1.4660878408546245 and parameters: {'model_name': 'SimpleImputer', 'strategy': 'mean'}. Best is trial 1 with value: 1.4660878408546245.
[I 2023-12-28 08:10:38,858] Trial 184 finished with value: 1.4660878408546245 and parameters: {'model_name': 'SimpleImputer', 'strategy': 'mean'}. Best is trial 1 with value: 1.4660878408546245.
[I 2023-12-28 08:10:39,109] Trial 179 finished with value: 1.4660878408546245 and parameters: {'model_name': 'SimpleImputer', 'strategy': 'mean'}. Best is trial 1 with value: 1.4660878408546245.
[I 2023-12-28 08:10:39,288] Trial 189 finished with value: 2.9732354120222957 and parameters: {'model_name': 'SimpleImputer', 'strategy': 'constant'}. Best is trial 1 with value: 1.4660878408546245.
[I 2023-12-28 08:10:39,449] Trial 192 finished with value: 2.9732354120222957 and parameters: {'model_name': 'SimpleImputer', 'strategy': 'constant'}. Best is trial 1 with value: 1.4660878408546245.
[I 2023-12-28 08:10:39,613] Trial 190 finished with value: 1.4660878408546245 and parameters: {'model_name': 'SimpleImputer', 'strategy': 'mean'}. Best is trial 1 with value: 1.4660878408546245.
