[I 2024-04-28 15:43:14,637] Trial 11 finished with value: 27.63580595617953 and parameters: {'model_name': 'SimpleImputer', 'strategy': 'constant'}. Best is trial 11 with value: 27.63580595617953.
[I 2024-04-28 15:43:15,619] Trial 4 finished with value: 14.081982611624905 and parameters: {'model_name': 'SimpleImputer', 'strategy': 'median'}. Best is trial 4 with value: 14.081982611624905.
[I 2024-04-28 15:43:16,121] Trial 33 finished with value: 27.63580595617953 and parameters: {'model_name': 'SimpleImputer', 'strategy': 'constant'}. Best is trial 4 with value: 14.081982611624905.
[I 2024-04-28 15:43:17,187] Trial 7 finished with value: 14.081982611624905 and parameters: {'model_name': 'SimpleImputer', 'strategy': 'median'}. Best is trial 4 with value: 14.081982611624905.
[I 2024-04-28 15:43:17,715] Trial 31 finished with value: 13.962322793488369 and parameters: {'model_name': 'SimpleImputer', 'strategy': 'mean'}. Best is trial 31 with value: 13.962322793488369.
[I 2024-04-28 15:43:18,165] Trial 17 finished with value: 14.081982611624905 and parameters: {'model_name': 'SimpleImputer', 'strategy': 'median'}. Best is trial 31 with value: 13.962322793488369.
[I 2024-04-28 15:43:18,818] Trial 24 finished with value: 13.962322793488369 and parameters: {'model_name': 'SimpleImputer', 'strategy': 'mean'}. Best is trial 31 with value: 13.962322793488369.
[I 2024-04-28 15:43:19,453] Trial 13 finished with value: 14.081982611624905 and parameters: {'model_name': 'SimpleImputer', 'strategy': 'median'}. Best is trial 31 with value: 13.962322793488369.
[I 2024-04-28 15:43:19,992] Trial 45 finished with value: 13.962322793488369 and parameters: {'model_name': 'SimpleImputer', 'strategy': 'mean'}. Best is trial 31 with value: 13.962322793488369.
[I 2024-04-28 15:43:20,707] Trial 18 finished with value: 13.962322793488369 and parameters: {'model_name': 'SimpleImputer', 'strategy': 'mean'}. Best is trial 31 with value: 13.962322793488369.
[I 2024-04-28 15:43:21,193] Trial 16 finished with value: 14.081982611624905 and parameters: {'model_name': 'SimpleImputer', 'strategy': 'median'}. Best is trial 31 with value: 13.962322793488369.
[I 2024-04-28 15:43:21,790] Trial 40 finished with value: 27.63580595617953 and parameters: {'model_name': 'SimpleImputer', 'strategy': 'constant'}. Best is trial 31 with value: 13.962322793488369.
[I 2024-04-28 15:43:22,875] Trial 2 finished with value: 27.627074604253192 and parameters: {'model_name': 'SimpleImputer', 'strategy': 'most_frequent'}. Best is trial 31 with value: 13.962322793488369.
[I 2024-04-28 15:43:24,136] Trial 8 finished with value: 27.627074604253192 and parameters: {'model_name': 'SimpleImputer', 'strategy': 'most_frequent'}. Best is trial 31 with value: 13.962322793488369.
[I 2024-04-28 15:43:25,374] Trial 56 finished with value: 13.962322793488369 and parameters: {'model_name': 'SimpleImputer', 'strategy': 'mean'}. Best is trial 31 with value: 13.962322793488369.
2024-04-28 15:43:27.321241: E external/local_xla/xla/stream_executor/cuda/cuda_driver.cc:274] failed call to cuInit: CUDA_ERROR_NO_DEVICE: no CUDA-capable device is detected
2024-04-28 15:43:27.555767: I tensorflow/compiler/mlir/mlir_graph_optimization_pass.cc:388] MLIR V1 optimization pass is not enabled
[I 2024-04-28 15:43:30,116] Trial 0 finished with value: 15.925377271605308 and parameters: {'model_name': 'KNNImputer', 'weights': 'uniform', 'keep_empty_features': False}. Best is trial 31 with value: 13.962322793488369.
[I 2024-04-28 15:43:31,131] Trial 3 finished with value: 15.925377271605308 and parameters: {'model_name': 'KNNImputer', 'weights': 'uniform', 'keep_empty_features': False}. Best is trial 31 with value: 13.962322793488369.
[I 2024-04-28 15:43:31,654] Trial 21 finished with value: 15.925377271605308 and parameters: {'model_name': 'KNNImputer', 'weights': 'uniform', 'keep_empty_features': False}. Best is trial 31 with value: 13.962322793488369.
[I 2024-04-28 15:43:32,412] Trial 14 finished with value: 15.925377271605308 and parameters: {'model_name': 'KNNImputer', 'weights': 'uniform', 'keep_empty_features': False}. Best is trial 31 with value: 13.962322793488369.
[I 2024-04-28 15:43:33,690] Trial 37 finished with value: 15.925377271605308 and parameters: {'model_name': 'KNNImputer', 'weights': 'uniform', 'keep_empty_features': False}. Best is trial 31 with value: 13.962322793488369.
[I 2024-04-28 15:43:34,494] Trial 49 finished with value: 15.925377271605308 and parameters: {'model_name': 'KNNImputer', 'weights': 'uniform', 'keep_empty_features': False}. Best is trial 31 with value: 13.962322793488369.
[I 2024-04-28 15:43:54,777] Trial 23 finished with value: 32.559185130881914 and parameters: {'model_name': 'RandomForestImputer', 'max_iter': 2, 'decreasing': True, 'min_samples_split': 0.7000000000000001, 'min_samples_leaf': 0.4, 'max_features': 0.1, 'warm_start': True}. Best is trial 31 with value: 13.962322793488369.
[I 2024-04-28 15:43:55,767] Trial 34 finished with value: 27.133099560210944 and parameters: {'model_name': 'RandomForestImputer', 'max_iter': 2, 'decreasing': False, 'min_samples_split': 0.0, 'min_samples_leaf': 0.1, 'max_features': 0.4, 'warm_start': True}. Best is trial 31 with value: 13.962322793488369.
[I 2024-04-28 15:44:03,259] Trial 12 finished with value: 13.16790833017887 and parameters: {'model_name': 'IterativeImputer', 'sample_posterior': False, 'initial_strategy': 'mean', 'imputation_order': 'roman'}. Best is trial 12 with value: 13.16790833017887.
[I 2024-04-28 15:44:03,883] Trial 39 finished with value: 13.168245831364056 and parameters: {'model_name': 'IterativeImputer', 'sample_posterior': False, 'initial_strategy': 'mean', 'imputation_order': 'random'}. Best is trial 12 with value: 13.16790833017887.
[I 2024-04-28 15:44:04,554] Trial 47 finished with value: 13.167983522633211 and parameters: {'model_name': 'IterativeImputer', 'sample_posterior': False, 'initial_strategy': 'median', 'imputation_order': 'ascending'}. Best is trial 12 with value: 13.16790833017887.
[I 2024-04-28 15:44:06,261] Trial 36 finished with value: 13.16790833017887 and parameters: {'model_name': 'IterativeImputer', 'sample_posterior': False, 'initial_strategy': 'mean', 'imputation_order': 'roman'}. Best is trial 12 with value: 13.16790833017887.
[I 2024-04-28 15:44:08,129] Trial 53 finished with value: 13.168057342098924 and parameters: {'model_name': 'IterativeImputer', 'sample_posterior': False, 'initial_strategy': 'median', 'imputation_order': 'arabic'}. Best is trial 12 with value: 13.16790833017887.
[I 2024-04-28 15:44:10,806] Trial 26 finished with value: 27.177709169689543 and parameters: {'model_name': 'RandomForestImputer', 'max_iter': 4, 'decreasing': False, 'min_samples_split': 0.0, 'min_samples_leaf': 0.8, 'max_features': 0.30000000000000004, 'warm_start': True}. Best is trial 12 with value: 13.16790833017887.
[I 2024-04-28 15:44:12,491] Trial 6 finished with value: 13.962322793488369 and parameters: {'model_name': 'RandomForestImputer', 'max_iter': 1, 'decreasing': False, 'min_samples_split': 0.6000000000000001, 'min_samples_leaf': 0.9, 'max_features': 0.6, 'warm_start': False}. Best is trial 12 with value: 13.16790833017887.
[I 2024-04-28 15:44:15,417] Trial 58 finished with value: 13.962322793488369 and parameters: {'model_name': 'RandomForestImputer', 'max_iter': 1, 'decreasing': False, 'min_samples_split': 0.9, 'min_samples_leaf': 0.9, 'max_features': 0.6, 'warm_start': False}. Best is trial 12 with value: 13.16790833017887.
[I 2024-04-28 15:44:17,051] Trial 42 finished with value: 13.962322793488369 and parameters: {'model_name': 'RandomForestImputer', 'max_iter': 1, 'decreasing': False, 'min_samples_split': 0.5, 'min_samples_leaf': 0.1, 'max_features': 0.9, 'warm_start': False}. Best is trial 12 with value: 13.16790833017887.
[I 2024-04-28 15:44:24,416] Trial 29 finished with value: 13.165073069554925 and parameters: {'model_name': 'IterativeImputer', 'sample_posterior': False, 'initial_strategy': 'constant', 'imputation_order': 'random'}. Best is trial 29 with value: 13.165073069554925.
[I 2024-04-28 15:44:27,035] Trial 65 finished with value: 13.167940839213347 and parameters: {'model_name': 'IterativeImputer', 'sample_posterior': False, 'initial_strategy': 'constant', 'imputation_order': 'ascending'}. Best is trial 29 with value: 13.165073069554925.
[I 2024-04-28 15:44:28,781] Trial 25 finished with value: 13.173297592820953 and parameters: {'model_name': 'IterativeImputer', 'sample_posterior': False, 'initial_strategy': 'constant', 'imputation_order': 'random'}. Best is trial 29 with value: 13.165073069554925.
[I 2024-04-28 15:44:32,053] Trial 60 finished with value: 13.16630605590106 and parameters: {'model_name': 'IterativeImputer', 'sample_posterior': False, 'initial_strategy': 'constant', 'imputation_order': 'random'}. Best is trial 29 with value: 13.165073069554925.
[I 2024-04-28 15:44:37,121] Trial 51 finished with value: 20.56370790035735 and parameters: {'model_name': 'GAIN', 'batch_size': 3, 'hint_rate': 0.22, 'alpha': 54, 'iterations': 1}. Best is trial 29 with value: 13.165073069554925.
[I 2024-04-28 15:44:38,341] Trial 64 finished with value: 13.16807480340861 and parameters: {'model_name': 'IterativeImputer', 'sample_posterior': False, 'initial_strategy': 'most_frequent', 'imputation_order': 'descending'}. Best is trial 29 with value: 13.165073069554925.
[I 2024-04-28 15:44:42,274] Trial 52 finished with value: 21.04334785621989 and parameters: {'model_name': 'GAIN', 'batch_size': 92, 'hint_rate': 0.35000000000000003, 'alpha': 86, 'iterations': 2}. Best is trial 29 with value: 13.165073069554925.
[I 2024-04-28 15:44:43,701] Trial 19 finished with value: 20.23188791312904 and parameters: {'model_name': 'GAIN', 'batch_size': 6, 'hint_rate': 0.44, 'alpha': 42, 'iterations': 4}. Best is trial 29 with value: 13.165073069554925.
[I 2024-04-28 15:44:46,640] Trial 73 finished with value: 13.167916064348287 and parameters: {'model_name': 'IterativeImputer', 'sample_posterior': False, 'initial_strategy': 'mean', 'imputation_order': 'ascending'}. Best is trial 29 with value: 13.165073069554925.
[I 2024-04-28 15:44:48,610] Trial 71 finished with value: 13.16790833017887 and parameters: {'model_name': 'IterativeImputer', 'sample_posterior': False, 'initial_strategy': 'mean', 'imputation_order': 'roman'}. Best is trial 29 with value: 13.165073069554925.
[I 2024-04-28 15:44:49,991] Trial 72 finished with value: 13.16790833017887 and parameters: {'model_name': 'IterativeImputer', 'sample_posterior': False, 'initial_strategy': 'mean', 'imputation_order': 'roman'}. Best is trial 29 with value: 13.165073069554925.
[I 2024-04-28 15:44:51,142] Trial 74 finished with value: 13.168012541995415 and parameters: {'model_name': 'IterativeImputer', 'sample_posterior': False, 'initial_strategy': 'median', 'imputation_order': 'roman'}. Best is trial 29 with value: 13.165073069554925.
[I 2024-04-28 15:44:53,255] Trial 75 finished with value: 13.16790833017887 and parameters: {'model_name': 'IterativeImputer', 'sample_posterior': False, 'initial_strategy': 'mean', 'imputation_order': 'roman'}. Best is trial 29 with value: 13.165073069554925.
[I 2024-04-28 15:44:56,130] Trial 27 finished with value: 19.153240680549928 and parameters: {'model_name': 'GAIN', 'batch_size': 2, 'hint_rate': 0.8400000000000001, 'alpha': 54, 'iterations': 6}. Best is trial 29 with value: 13.165073069554925.
[I 2024-04-28 15:44:57,817] Trial 76 finished with value: 13.16790833017887 and parameters: {'model_name': 'IterativeImputer', 'sample_posterior': False, 'initial_strategy': 'mean', 'imputation_order': 'roman'}. Best is trial 29 with value: 13.165073069554925.
[I 2024-04-28 15:44:58,888] Trial 77 finished with value: 13.16790833017887 and parameters: {'model_name': 'IterativeImputer', 'sample_posterior': False, 'initial_strategy': 'mean', 'imputation_order': 'roman'}. Best is trial 29 with value: 13.165073069554925.
[I 2024-04-28 15:44:59,908] Trial 66 finished with value: 17.72868365536204 and parameters: {'model_name': 'GAIN', 'batch_size': 39, 'hint_rate': 0.6900000000000001, 'alpha': 35, 'iterations': 6}. Best is trial 29 with value: 13.165073069554925.
[I 2024-04-28 15:45:03,489] Trial 43 finished with value: 17.54313759200768 and parameters: {'model_name': 'GAIN', 'batch_size': 9, 'hint_rate': 0.34, 'alpha': 6, 'iterations': 8}. Best is trial 29 with value: 13.165073069554925.
[I 2024-04-28 15:45:04,399] Trial 78 finished with value: 13.168012541995415 and parameters: {'model_name': 'IterativeImputer', 'sample_posterior': False, 'initial_strategy': 'median', 'imputation_order': 'roman'}. Best is trial 29 with value: 13.165073069554925.
[I 2024-04-28 15:45:05,242] Trial 63 finished with value: 30.34189993876513 and parameters: {'model_name': 'RandomForestImputer', 'max_iter': 9, 'decreasing': True, 'min_samples_split': 1.0, 'min_samples_leaf': 0.1, 'max_features': 0.9, 'warm_start': True}. Best is trial 29 with value: 13.165073069554925.
[I 2024-04-28 15:45:06,012] Trial 79 finished with value: 13.168012541995415 and parameters: {'model_name': 'IterativeImputer', 'sample_posterior': False, 'initial_strategy': 'median', 'imputation_order': 'roman'}. Best is trial 29 with value: 13.165073069554925.
[I 2024-04-28 15:45:08,670] Trial 5 finished with value: 18.317545281086435 and parameters: {'model_name': 'GAIN', 'batch_size': 31, 'hint_rate': 0.98, 'alpha': 72, 'iterations': 10}. Best is trial 29 with value: 13.165073069554925.
[I 2024-04-28 15:45:15,389] Trial 28 finished with value: 17.608669436180126 and parameters: {'model_name': 'GAIN', 'batch_size': 3, 'hint_rate': 0.52, 'alpha': 7, 'iterations': 12}. Best is trial 29 with value: 13.165073069554925.
[I 2024-04-28 15:45:17,130] Trial 67 finished with value: 16.694230308701954 and parameters: {'model_name': 'GAIN', 'batch_size': 1, 'hint_rate': 0.12, 'alpha': 8, 'iterations': 12}. Best is trial 29 with value: 13.165073069554925.
[I 2024-04-28 15:45:18,415] Trial 80 finished with value: 13.167977462887862 and parameters: {'model_name': 'IterativeImputer', 'sample_posterior': False, 'initial_strategy': 'constant', 'imputation_order': 'roman'}. Best is trial 29 with value: 13.165073069554925.
[I 2024-04-28 15:45:20,595] Trial 81 finished with value: 13.167977462887862 and parameters: {'model_name': 'IterativeImputer', 'sample_posterior': False, 'initial_strategy': 'constant', 'imputation_order': 'roman'}. Best is trial 29 with value: 13.165073069554925.
[I 2024-04-28 15:45:31,301] Trial 48 finished with value: 27.18128012671973 and parameters: {'model_name': 'RandomForestImputer', 'max_iter': 31, 'decreasing': False, 'min_samples_split': 0.30000000000000004, 'min_samples_leaf': 0.5, 'max_features': 0.30000000000000004, 'warm_start': True}. Best is trial 29 with value: 13.165073069554925.
[I 2024-04-28 15:45:32,400] Trial 83 finished with value: 22.058586991060398 and parameters: {'model_name': 'GAIN', 'batch_size': 57, 'hint_rate': 0.12, 'alpha': 41, 'iterations': 1}. Best is trial 29 with value: 13.165073069554925.
[I 2024-04-28 15:45:37,675] Trial 62 finished with value: 21.911295017575355 and parameters: {'model_name': 'GAIN', 'batch_size': 118, 'hint_rate': 0.16, 'alpha': 32, 'iterations': 18}. Best is trial 29 with value: 13.165073069554925.
[I 2024-04-28 15:45:39,902] Trial 32 finished with value: 27.182178806822208 and parameters: {'model_name': 'RandomForestImputer', 'max_iter': 38, 'decreasing': False, 'min_samples_split': 1.0, 'min_samples_leaf': 0.6, 'max_features': 0.5, 'warm_start': True}. Best is trial 29 with value: 13.165073069554925.
[I 2024-04-28 15:45:55,528] Trial 68 finished with value: 27.18188918226238 and parameters: {'model_name': 'RandomForestImputer', 'max_iter': 44, 'decreasing': False, 'min_samples_split': 1.0, 'min_samples_leaf': 0.4, 'max_features': 0.5, 'warm_start': True}. Best is trial 29 with value: 13.165073069554925.
[I 2024-04-28 15:46:01,174] Trial 82 finished with value: 21.180261091604983 and parameters: {'model_name': 'GAIN', 'batch_size': 3, 'hint_rate': 0.68, 'alpha': 38, 'iterations': 18}. Best is trial 29 with value: 13.165073069554925.
[I 2024-04-28 15:46:16,380] Trial 9 finished with value: 27.181294620161673 and parameters: {'model_name': 'RandomForestImputer', 'max_iter': 70, 'decreasing': False, 'min_samples_split': 0.1, 'min_samples_leaf': 0.5, 'max_features': 0.4, 'warm_start': True}. Best is trial 29 with value: 13.165073069554925.
[I 2024-04-28 15:46:35,906] Trial 1 finished with value: 17.959230943739605 and parameters: {'model_name': 'IterativeImputer', 'sample_posterior': True, 'initial_strategy': 'constant', 'imputation_order': 'descending'}. Best is trial 29 with value: 13.165073069554925.
[I 2024-04-28 15:46:38,632] Trial 30 finished with value: 18.08596475506307 and parameters: {'model_name': 'IterativeImputer', 'sample_posterior': True, 'initial_strategy': 'constant', 'imputation_order': 'roman'}. Best is trial 29 with value: 13.165073069554925.
[I 2024-04-28 15:46:40,324] Trial 15 finished with value: 17.65038789135433 and parameters: {'model_name': 'IterativeImputer', 'sample_posterior': True, 'initial_strategy': 'median', 'imputation_order': 'ascending'}. Best is trial 29 with value: 13.165073069554925.
[I 2024-04-28 15:46:41,659] Trial 41 finished with value: 17.64159334419191 and parameters: {'model_name': 'IterativeImputer', 'sample_posterior': True, 'initial_strategy': 'median', 'imputation_order': 'arabic'}. Best is trial 29 with value: 13.165073069554925.
[I 2024-04-28 15:46:42,934] Trial 46 finished with value: 18.067646644673356 and parameters: {'model_name': 'IterativeImputer', 'sample_posterior': True, 'initial_strategy': 'constant', 'imputation_order': 'arabic'}. Best is trial 29 with value: 13.165073069554925.
[I 2024-04-28 15:46:45,367] Trial 50 finished with value: 17.507171395860112 and parameters: {'model_name': 'IterativeImputer', 'sample_posterior': True, 'initial_strategy': 'most_frequent', 'imputation_order': 'arabic'}. Best is trial 29 with value: 13.165073069554925.
[I 2024-04-28 15:46:48,021] Trial 44 finished with value: 17.821729617283573 and parameters: {'model_name': 'IterativeImputer', 'sample_posterior': True, 'initial_strategy': 'mean', 'imputation_order': 'arabic'}. Best is trial 29 with value: 13.165073069554925.
[I 2024-04-28 15:46:56,718] Trial 69 finished with value: 18.053686905373716 and parameters: {'model_name': 'IterativeImputer', 'sample_posterior': True, 'initial_strategy': 'most_frequent', 'imputation_order': 'roman'}. Best is trial 29 with value: 13.165073069554925.
[I 2024-04-28 15:46:57,705] Trial 70 finished with value: 18.266171783922324 and parameters: {'model_name': 'IterativeImputer', 'sample_posterior': True, 'initial_strategy': 'constant', 'imputation_order': 'descending'}. Best is trial 29 with value: 13.165073069554925.
[I 2024-04-28 15:47:02,899] Trial 117 finished with value: 13.16837678383746 and parameters: {'model_name': 'IterativeImputer', 'sample_posterior': False, 'initial_strategy': 'mean', 'imputation_order': 'random'}. Best is trial 29 with value: 13.165073069554925.
[I 2024-04-28 15:47:04,201] Trial 116 finished with value: 13.168147624989675 and parameters: {'model_name': 'IterativeImputer', 'sample_posterior': False, 'initial_strategy': 'mean', 'imputation_order': 'random'}. Best is trial 29 with value: 13.165073069554925.
[I 2024-04-28 15:47:05,606] Trial 114 finished with value: 13.168044984703238 and parameters: {'model_name': 'IterativeImputer', 'sample_posterior': False, 'initial_strategy': 'mean', 'imputation_order': 'random'}. Best is trial 29 with value: 13.165073069554925.
[I 2024-04-28 15:47:07,639] Trial 115 finished with value: 13.168045892992438 and parameters: {'model_name': 'IterativeImputer', 'sample_posterior': False, 'initial_strategy': 'mean', 'imputation_order': 'random'}. Best is trial 29 with value: 13.165073069554925.
[I 2024-04-28 15:47:11,745] Trial 118 finished with value: 13.167968814835678 and parameters: {'model_name': 'IterativeImputer', 'sample_posterior': False, 'initial_strategy': 'mean', 'imputation_order': 'random'}. Best is trial 29 with value: 13.165073069554925.
[I 2024-04-28 15:47:12,970] Trial 119 finished with value: 13.168043648381763 and parameters: {'model_name': 'IterativeImputer', 'sample_posterior': False, 'initial_strategy': 'mean', 'imputation_order': 'random'}. Best is trial 29 with value: 13.165073069554925.
[I 2024-04-28 15:47:17,051] Trial 84 finished with value: 19.147631502856843 and parameters: {'model_name': 'IterativeImputer', 'sample_posterior': True, 'initial_strategy': 'mean', 'imputation_order': 'roman'}. Best is trial 29 with value: 13.165073069554925.
[I 2024-04-28 15:47:18,966] Trial 127 finished with value: 15.971906421600824 and parameters: {'model_name': 'KNNImputer', 'weights': 'distance', 'keep_empty_features': False}. Best is trial 29 with value: 13.165073069554925.
[I 2024-04-28 15:47:23,432] Trial 87 finished with value: 17.991719236946285 and parameters: {'model_name': 'IterativeImputer', 'sample_posterior': True, 'initial_strategy': 'mean', 'imputation_order': 'roman'}. Best is trial 29 with value: 13.165073069554925.
[I 2024-04-28 15:47:24,371] Trial 85 finished with value: 18.013288917297494 and parameters: {'model_name': 'IterativeImputer', 'sample_posterior': True, 'initial_strategy': 'mean', 'imputation_order': 'roman'}. Best is trial 29 with value: 13.165073069554925.
[I 2024-04-28 15:47:27,625] Trial 120 finished with value: 13.167904670812101 and parameters: {'model_name': 'IterativeImputer', 'sample_posterior': False, 'initial_strategy': 'mean', 'imputation_order': 'random'}. Best is trial 29 with value: 13.165073069554925.
[I 2024-04-28 15:47:28,579] Trial 121 finished with value: 13.16785375578998 and parameters: {'model_name': 'IterativeImputer', 'sample_posterior': False, 'initial_strategy': 'mean', 'imputation_order': 'random'}. Best is trial 29 with value: 13.165073069554925.
