Run: 8
/cm/local/apps/slurm/var/spool/job653821/slurm_script: line 23: /common/ketrong/minconda3/etc/profile.d/conda.sh: No such file or directory
/cm/local/apps/slurm/var/spool/job653821/slurm_script: line 26: $'\nconda create --name tpot2devenv -c conda-forge python=3.10\n': command not found
/cm/local/apps/slurm/var/spool/job653821/slurm_script: line 31: $'\npip install -r requirements.txt\n': command not found
RunStart
2024-02-11 01:00:08.626740: I tensorflow/core/util/port.cc:113] oneDNN custom operations are on. You may see slightly different numerical results due to floating-point round-off errors from different computation orders. To turn them off, set the environment variable `TF_ENABLE_ONEDNN_OPTS=0`.
2024-02-11 01:00:08.661151: E external/local_xla/xla/stream_executor/cuda/cuda_dnn.cc:9261] Unable to register cuDNN factory: Attempting to register factory for plugin cuDNN when one has already been registered
2024-02-11 01:00:08.661172: E external/local_xla/xla/stream_executor/cuda/cuda_fft.cc:607] Unable to register cuFFT factory: Attempting to register factory for plugin cuFFT when one has already been registered
2024-02-11 01:00:08.662312: E external/local_xla/xla/stream_executor/cuda/cuda_blas.cc:1515] Unable to register cuBLAS factory: Attempting to register factory for plugin cuBLAS when one has already been registered
2024-02-11 01:00:08.667860: I tensorflow/core/platform/cpu_feature_guard.cc:182] This TensorFlow binary is optimized to use available CPU instructions in performance-critical operations.
To enable the following instructions: AVX2 AVX512F AVX512_VNNI FMA, in other operations, rebuild TensorFlow with the appropriate compiler flags.
2024-02-11 01:00:09.600962: W tensorflow/compiler/tf2tensorrt/utils/py_utils.cc:38] TF-TRT Warning: Could not find TensorRT
WARNING:tensorflow:From /home/ketrong/miniconda3/envs/tpot2devenv/lib/python3.10/site-packages/tensorflow/python/compat/v2_compat.py:108: disable_resource_variables (from tensorflow.python.ops.variable_scope) is deprecated and will be removed in a future version.
Instructions for updating:
non-resource variables are not supported in the long term
starting loops
working on 
logs/189773/tpot2_base_normal_MAR_0.3
0.7433485984802246
loading data
logs/189773/tpot2_base_normal_MAR_0.3/data/189773_True.pkl
running experiment 1/3 - Does large hyperparameter space improve reconstruction accuracy over simple
[I 2024-02-11 01:00:22,385] A new study created in memory with name: no-name-02b903b3-3a47-4959-8553-1a71f95ce580
[I 2024-02-11 01:00:24,141] Trial 2 finished with value: 2.8672043732237347 and parameters: {'model_name': 'SimpleImputer', 'strategy': 'mean'}. Best is trial 2 with value: 2.8672043732237347.
[I 2024-02-11 01:00:24,826] Trial 17 finished with value: 4.060436303586111 and parameters: {'model_name': 'SimpleImputer', 'strategy': 'constant'}. Best is trial 2 with value: 2.8672043732237347.
[I 2024-02-11 01:00:25,066] Trial 14 finished with value: 4.060436303586111 and parameters: {'model_name': 'SimpleImputer', 'strategy': 'constant'}. Best is trial 2 with value: 2.8672043732237347.
[I 2024-02-11 01:00:25,328] Trial 22 finished with value: 4.060436303586111 and parameters: {'model_name': 'SimpleImputer', 'strategy': 'constant'}. Best is trial 2 with value: 2.8672043732237347.
[I 2024-02-11 01:00:25,745] Trial 23 finished with value: 4.060436303586111 and parameters: {'model_name': 'SimpleImputer', 'strategy': 'constant'}. Best is trial 2 with value: 2.8672043732237347.
[I 2024-02-11 01:00:26,123] Trial 27 finished with value: 4.060436303586111 and parameters: {'model_name': 'SimpleImputer', 'strategy': 'constant'}. Best is trial 2 with value: 2.8672043732237347.
[I 2024-02-11 01:00:26,370] Trial 16 finished with value: 2.8672043732237347 and parameters: {'model_name': 'SimpleImputer', 'strategy': 'mean'}. Best is trial 2 with value: 2.8672043732237347.
[I 2024-02-11 01:00:26,629] Trial 36 finished with value: 4.060436303586111 and parameters: {'model_name': 'SimpleImputer', 'strategy': 'constant'}. Best is trial 2 with value: 2.8672043732237347.
[I 2024-02-11 01:00:27,110] Trial 15 finished with value: 2.8672043732237347 and parameters: {'model_name': 'SimpleImputer', 'strategy': 'mean'}. Best is trial 2 with value: 2.8672043732237347.
[I 2024-02-11 01:00:27,369] Trial 44 finished with value: 4.060436303586111 and parameters: {'model_name': 'SimpleImputer', 'strategy': 'constant'}. Best is trial 2 with value: 2.8672043732237347.
[I 2024-02-11 01:00:27,738] Trial 43 finished with value: 4.060436303586111 and parameters: {'model_name': 'SimpleImputer', 'strategy': 'constant'}. Best is trial 2 with value: 2.8672043732237347.
[I 2024-02-11 01:00:28,163] Trial 26 finished with value: 2.8672043732237347 and parameters: {'model_name': 'SimpleImputer', 'strategy': 'mean'}. Best is trial 2 with value: 2.8672043732237347.
[I 2024-02-11 01:00:28,349] Trial 34 finished with value: 2.8672043732237347 and parameters: {'model_name': 'SimpleImputer', 'strategy': 'mean'}. Best is trial 2 with value: 2.8672043732237347.
[I 2024-02-11 01:00:28,616] Trial 6 finished with value: 3.0286810429574365 and parameters: {'model_name': 'SimpleImputer', 'strategy': 'median'}. Best is trial 2 with value: 2.8672043732237347.
[I 2024-02-11 01:00:28,924] Trial 29 finished with value: 2.8672043732237347 and parameters: {'model_name': 'SimpleImputer', 'strategy': 'mean'}. Best is trial 2 with value: 2.8672043732237347.
[I 2024-02-11 01:00:29,177] Trial 47 finished with value: 2.8672043732237347 and parameters: {'model_name': 'SimpleImputer', 'strategy': 'mean'}. Best is trial 2 with value: 2.8672043732237347.
[I 2024-02-11 01:00:29,363] Trial 13 finished with value: 3.0286810429574365 and parameters: {'model_name': 'SimpleImputer', 'strategy': 'median'}. Best is trial 2 with value: 2.8672043732237347.
[I 2024-02-11 01:00:29,713] Trial 0 finished with value: 3.0286810429574365 and parameters: {'model_name': 'SimpleImputer', 'strategy': 'median'}. Best is trial 2 with value: 2.8672043732237347.
[I 2024-02-11 01:00:30,016] Trial 7 finished with value: 3.0286810429574365 and parameters: {'model_name': 'SimpleImputer', 'strategy': 'median'}. Best is trial 2 with value: 2.8672043732237347.
[I 2024-02-11 01:00:30,397] Trial 12 finished with value: 3.0286810429574365 and parameters: {'model_name': 'SimpleImputer', 'strategy': 'median'}. Best is trial 2 with value: 2.8672043732237347.
[I 2024-02-11 01:00:30,624] Trial 9 finished with value: 3.0286810429574365 and parameters: {'model_name': 'SimpleImputer', 'strategy': 'median'}. Best is trial 2 with value: 2.8672043732237347.
[I 2024-02-11 01:00:30,923] Trial 10 finished with value: 3.0286810429574365 and parameters: {'model_name': 'SimpleImputer', 'strategy': 'median'}. Best is trial 2 with value: 2.8672043732237347.
[I 2024-02-11 01:00:31,199] Trial 5 finished with value: 3.0286810429574365 and parameters: {'model_name': 'SimpleImputer', 'strategy': 'median'}. Best is trial 2 with value: 2.8672043732237347.
[I 2024-02-11 01:00:31,622] Trial 48 finished with value: 4.060436303586111 and parameters: {'model_name': 'SimpleImputer', 'strategy': 'constant'}. Best is trial 2 with value: 2.8672043732237347.
[I 2024-02-11 01:00:31,965] Trial 50 finished with value: 4.060436303586111 and parameters: {'model_name': 'SimpleImputer', 'strategy': 'constant'}. Best is trial 2 with value: 2.8672043732237347.
[I 2024-02-11 01:00:32,224] Trial 25 finished with value: 3.0286810429574365 and parameters: {'model_name': 'SimpleImputer', 'strategy': 'median'}. Best is trial 2 with value: 2.8672043732237347.
[I 2024-02-11 01:00:32,556] Trial 37 finished with value: 3.0286810429574365 and parameters: {'model_name': 'SimpleImputer', 'strategy': 'median'}. Best is trial 2 with value: 2.8672043732237347.
[I 2024-02-11 01:00:32,813] Trial 21 finished with value: 3.0286810429574365 and parameters: {'model_name': 'SimpleImputer', 'strategy': 'median'}. Best is trial 2 with value: 2.8672043732237347.
[I 2024-02-11 01:00:33,053] Trial 20 finished with value: 3.0286810429574365 and parameters: {'model_name': 'SimpleImputer', 'strategy': 'median'}. Best is trial 2 with value: 2.8672043732237347.
[I 2024-02-11 01:00:33,430] Trial 55 finished with value: 4.060436303586111 and parameters: {'model_name': 'SimpleImputer', 'strategy': 'constant'}. Best is trial 2 with value: 2.8672043732237347.
[I 2024-02-11 01:00:33,755] Trial 39 finished with value: 3.0286810429574365 and parameters: {'model_name': 'SimpleImputer', 'strategy': 'median'}. Best is trial 2 with value: 2.8672043732237347.
[I 2024-02-11 01:00:33,976] Trial 30 finished with value: 3.0286810429574365 and parameters: {'model_name': 'SimpleImputer', 'strategy': 'median'}. Best is trial 2 with value: 2.8672043732237347.
[I 2024-02-11 01:00:34,239] Trial 42 finished with value: 3.0286810429574365 and parameters: {'model_name': 'SimpleImputer', 'strategy': 'median'}. Best is trial 2 with value: 2.8672043732237347.
[I 2024-02-11 01:00:34,481] Trial 19 finished with value: 3.0286810429574365 and parameters: {'model_name': 'SimpleImputer', 'strategy': 'median'}. Best is trial 2 with value: 2.8672043732237347.
[I 2024-02-11 01:00:34,863] Trial 53 finished with value: 4.060436303586111 and parameters: {'model_name': 'SimpleImputer', 'strategy': 'constant'}. Best is trial 2 with value: 2.8672043732237347.
[I 2024-02-11 01:00:35,115] Trial 35 finished with value: 3.0286810429574365 and parameters: {'model_name': 'SimpleImputer', 'strategy': 'median'}. Best is trial 2 with value: 2.8672043732237347.
[I 2024-02-11 01:00:35,438] Trial 45 finished with value: 3.0286810429574365 and parameters: {'model_name': 'SimpleImputer', 'strategy': 'median'}. Best is trial 2 with value: 2.8672043732237347.
[I 2024-02-11 01:00:36,533] Trial 58 finished with value: 2.8672043732237347 and parameters: {'model_name': 'SimpleImputer', 'strategy': 'mean'}. Best is trial 2 with value: 2.8672043732237347.
[I 2024-02-11 01:00:36,968] Trial 54 finished with value: 3.0286810429574365 and parameters: {'model_name': 'SimpleImputer', 'strategy': 'median'}. Best is trial 2 with value: 2.8672043732237347.
[I 2024-02-11 01:00:37,319] Trial 51 finished with value: 3.0286810429574365 and parameters: {'model_name': 'SimpleImputer', 'strategy': 'median'}. Best is trial 2 with value: 2.8672043732237347.
[I 2024-02-11 01:00:38,051] Trial 59 finished with value: 3.0286810429574365 and parameters: {'model_name': 'SimpleImputer', 'strategy': 'median'}. Best is trial 2 with value: 2.8672043732237347.
[I 2024-02-11 01:00:38,338] Trial 60 finished with value: 3.0286810429574365 and parameters: {'model_name': 'SimpleImputer', 'strategy': 'median'}. Best is trial 2 with value: 2.8672043732237347.
[I 2024-02-11 01:00:38,698] Trial 56 finished with value: 3.0286810429574365 and parameters: {'model_name': 'SimpleImputer', 'strategy': 'median'}. Best is trial 2 with value: 2.8672043732237347.
[I 2024-02-11 01:00:38,944] Trial 57 finished with value: 3.0286810429574365 and parameters: {'model_name': 'SimpleImputer', 'strategy': 'median'}. Best is trial 2 with value: 2.8672043732237347.
[I 2024-02-11 01:00:39,151] Trial 78 finished with value: 2.8672043732237347 and parameters: {'model_name': 'SimpleImputer', 'strategy': 'mean'}. Best is trial 2 with value: 2.8672043732237347.
[I 2024-02-11 01:00:39,457] Trial 80 finished with value: 2.8672043732237347 and parameters: {'model_name': 'SimpleImputer', 'strategy': 'mean'}. Best is trial 2 with value: 2.8672043732237347.
[I 2024-02-11 01:00:39,755] Trial 79 finished with value: 2.8672043732237347 and parameters: {'model_name': 'SimpleImputer', 'strategy': 'mean'}. Best is trial 2 with value: 2.8672043732237347.
[I 2024-02-11 01:00:40,081] Trial 84 finished with value: 2.8672043732237347 and parameters: {'model_name': 'SimpleImputer', 'strategy': 'mean'}. Best is trial 2 with value: 2.8672043732237347.
[I 2024-02-11 01:00:40,308] Trial 81 finished with value: 2.8672043732237347 and parameters: {'model_name': 'SimpleImputer', 'strategy': 'mean'}. Best is trial 2 with value: 2.8672043732237347.
[I 2024-02-11 01:00:40,723] Trial 83 finished with value: 2.8672043732237347 and parameters: {'model_name': 'SimpleImputer', 'strategy': 'mean'}. Best is trial 2 with value: 2.8672043732237347.
[I 2024-02-11 01:00:40,953] Trial 82 finished with value: 2.8672043732237347 and parameters: {'model_name': 'SimpleImputer', 'strategy': 'mean'}. Best is trial 2 with value: 2.8672043732237347.
[I 2024-02-11 01:00:42,446] Trial 89 finished with value: 2.8672043732237347 and parameters: {'model_name': 'SimpleImputer', 'strategy': 'mean'}. Best is trial 2 with value: 2.8672043732237347.
[I 2024-02-11 01:00:42,903] Trial 88 finished with value: 2.8672043732237347 and parameters: {'model_name': 'SimpleImputer', 'strategy': 'mean'}. Best is trial 2 with value: 2.8672043732237347.
[I 2024-02-11 01:00:43,309] Trial 92 finished with value: 2.8672043732237347 and parameters: {'model_name': 'SimpleImputer', 'strategy': 'mean'}. Best is trial 2 with value: 2.8672043732237347.
[I 2024-02-11 01:00:43,777] Trial 90 finished with value: 2.8672043732237347 and parameters: {'model_name': 'SimpleImputer', 'strategy': 'mean'}. Best is trial 2 with value: 2.8672043732237347.
[I 2024-02-11 01:00:44,201] Trial 91 finished with value: 2.8672043732237347 and parameters: {'model_name': 'SimpleImputer', 'strategy': 'mean'}. Best is trial 2 with value: 2.8672043732237347.
[I 2024-02-11 01:00:45,591] Trial 3 finished with value: 3.3359084948113016 and parameters: {'model_name': 'SimpleImputer', 'strategy': 'most_frequent'}. Best is trial 2 with value: 2.8672043732237347.
[I 2024-02-11 01:00:46,109] Trial 8 finished with value: 3.3359084948113016 and parameters: {'model_name': 'SimpleImputer', 'strategy': 'most_frequent'}. Best is trial 2 with value: 2.8672043732237347.
[I 2024-02-11 01:00:46,412] Trial 4 finished with value: 3.3359084948113016 and parameters: {'model_name': 'SimpleImputer', 'strategy': 'most_frequent'}. Best is trial 2 with value: 2.8672043732237347.
[I 2024-02-11 01:00:46,697] Trial 1 finished with value: 3.3359084948113016 and parameters: {'model_name': 'SimpleImputer', 'strategy': 'most_frequent'}. Best is trial 2 with value: 2.8672043732237347.
[I 2024-02-11 01:00:47,348] Trial 41 finished with value: 3.3359084948113016 and parameters: {'model_name': 'SimpleImputer', 'strategy': 'most_frequent'}. Best is trial 2 with value: 2.8672043732237347.
[I 2024-02-11 01:00:47,760] Trial 28 finished with value: 3.3359084948113016 and parameters: {'model_name': 'SimpleImputer', 'strategy': 'most_frequent'}. Best is trial 2 with value: 2.8672043732237347.
[I 2024-02-11 01:00:48,313] Trial 31 finished with value: 3.3359084948113016 and parameters: {'model_name': 'SimpleImputer', 'strategy': 'most_frequent'}. Best is trial 2 with value: 2.8672043732237347.
[I 2024-02-11 01:00:48,595] Trial 11 finished with value: 3.3359084948113016 and parameters: {'model_name': 'SimpleImputer', 'strategy': 'most_frequent'}. Best is trial 2 with value: 2.8672043732237347.
[I 2024-02-11 01:00:48,776] Trial 38 finished with value: 3.3359084948113016 and parameters: {'model_name': 'SimpleImputer', 'strategy': 'most_frequent'}. Best is trial 2 with value: 2.8672043732237347.
[I 2024-02-11 01:00:48,978] Trial 33 finished with value: 3.3359084948113016 and parameters: {'model_name': 'SimpleImputer', 'strategy': 'most_frequent'}. Best is trial 2 with value: 2.8672043732237347.
[I 2024-02-11 01:00:49,289] Trial 18 finished with value: 3.3359084948113016 and parameters: {'model_name': 'SimpleImputer', 'strategy': 'most_frequent'}. Best is trial 2 with value: 2.8672043732237347.
[I 2024-02-11 01:00:49,538] Trial 46 finished with value: 3.3359084948113016 and parameters: {'model_name': 'SimpleImputer', 'strategy': 'most_frequent'}. Best is trial 2 with value: 2.8672043732237347.
[I 2024-02-11 01:00:49,964] Trial 40 finished with value: 3.3359084948113016 and parameters: {'model_name': 'SimpleImputer', 'strategy': 'most_frequent'}. Best is trial 2 with value: 2.8672043732237347.
[I 2024-02-11 01:00:50,344] Trial 32 finished with value: 3.3359084948113016 and parameters: {'model_name': 'SimpleImputer', 'strategy': 'most_frequent'}. Best is trial 2 with value: 2.8672043732237347.
[I 2024-02-11 01:00:50,561] Trial 24 finished with value: 3.3359084948113016 and parameters: {'model_name': 'SimpleImputer', 'strategy': 'most_frequent'}. Best is trial 2 with value: 2.8672043732237347.
[I 2024-02-11 01:00:50,928] Trial 104 finished with value: 2.8672043732237347 and parameters: {'model_name': 'SimpleImputer', 'strategy': 'mean'}. Best is trial 2 with value: 2.8672043732237347.
[I 2024-02-11 01:00:51,887] Trial 52 finished with value: 3.3359084948113016 and parameters: {'model_name': 'SimpleImputer', 'strategy': 'most_frequent'}. Best is trial 2 with value: 2.8672043732237347.
[I 2024-02-11 01:00:52,578] Trial 109 finished with value: 2.8672043732237347 and parameters: {'model_name': 'SimpleImputer', 'strategy': 'mean'}. Best is trial 2 with value: 2.8672043732237347.
[I 2024-02-11 01:00:52,875] Trial 49 finished with value: 3.3359084948113016 and parameters: {'model_name': 'SimpleImputer', 'strategy': 'most_frequent'}. Best is trial 2 with value: 2.8672043732237347.
[I 2024-02-11 01:00:53,122] Trial 108 finished with value: 2.8672043732237347 and parameters: {'model_name': 'SimpleImputer', 'strategy': 'mean'}. Best is trial 2 with value: 2.8672043732237347.
[I 2024-02-11 01:00:53,607] Trial 110 finished with value: 2.8672043732237347 and parameters: {'model_name': 'SimpleImputer', 'strategy': 'mean'}. Best is trial 2 with value: 2.8672043732237347.
[I 2024-02-11 01:00:53,900] Trial 115 finished with value: 2.8672043732237347 and parameters: {'model_name': 'SimpleImputer', 'strategy': 'mean'}. Best is trial 2 with value: 2.8672043732237347.
[I 2024-02-11 01:00:54,250] Trial 114 finished with value: 2.8672043732237347 and parameters: {'model_name': 'SimpleImputer', 'strategy': 'mean'}. Best is trial 2 with value: 2.8672043732237347.
[I 2024-02-11 01:00:54,534] Trial 67 finished with value: 3.3359084948113016 and parameters: {'model_name': 'SimpleImputer', 'strategy': 'most_frequent'}. Best is trial 2 with value: 2.8672043732237347.
[I 2024-02-11 01:00:54,825] Trial 112 finished with value: 2.8672043732237347 and parameters: {'model_name': 'SimpleImputer', 'strategy': 'mean'}. Best is trial 2 with value: 2.8672043732237347.
[I 2024-02-11 01:00:55,150] Trial 63 finished with value: 3.3359084948113016 and parameters: {'model_name': 'SimpleImputer', 'strategy': 'most_frequent'}. Best is trial 2 with value: 2.8672043732237347.
[I 2024-02-11 01:00:55,645] Trial 116 finished with value: 2.8672043732237347 and parameters: {'model_name': 'SimpleImputer', 'strategy': 'mean'}. Best is trial 2 with value: 2.8672043732237347.
[I 2024-02-11 01:00:55,905] Trial 117 finished with value: 2.8672043732237347 and parameters: {'model_name': 'SimpleImputer', 'strategy': 'mean'}. Best is trial 2 with value: 2.8672043732237347.
[I 2024-02-11 01:00:56,152] Trial 113 finished with value: 2.8672043732237347 and parameters: {'model_name': 'SimpleImputer', 'strategy': 'mean'}. Best is trial 2 with value: 2.8672043732237347.
[I 2024-02-11 01:00:56,396] Trial 74 finished with value: 3.3359084948113016 and parameters: {'model_name': 'SimpleImputer', 'strategy': 'most_frequent'}. Best is trial 2 with value: 2.8672043732237347.
[I 2024-02-11 01:00:56,676] Trial 111 finished with value: 2.8672043732237347 and parameters: {'model_name': 'SimpleImputer', 'strategy': 'mean'}. Best is trial 2 with value: 2.8672043732237347.
[I 2024-02-11 01:00:56,863] Trial 62 finished with value: 3.3359084948113016 and parameters: {'model_name': 'SimpleImputer', 'strategy': 'most_frequent'}. Best is trial 2 with value: 2.8672043732237347.
[I 2024-02-11 01:00:57,359] Trial 118 finished with value: 2.8672043732237347 and parameters: {'model_name': 'SimpleImputer', 'strategy': 'mean'}. Best is trial 2 with value: 2.8672043732237347.
[I 2024-02-11 01:00:57,621] Trial 65 finished with value: 3.3359084948113016 and parameters: {'model_name': 'SimpleImputer', 'strategy': 'most_frequent'}. Best is trial 2 with value: 2.8672043732237347.
[I 2024-02-11 01:00:57,884] Trial 119 finished with value: 2.8672043732237347 and parameters: {'model_name': 'SimpleImputer', 'strategy': 'mean'}. Best is trial 2 with value: 2.8672043732237347.
[I 2024-02-11 01:00:58,084] Trial 69 finished with value: 3.3359084948113016 and parameters: {'model_name': 'SimpleImputer', 'strategy': 'most_frequent'}. Best is trial 2 with value: 2.8672043732237347.
[I 2024-02-11 01:00:58,533] Trial 73 finished with value: 3.3359084948113016 and parameters: {'model_name': 'SimpleImputer', 'strategy': 'most_frequent'}. Best is trial 2 with value: 2.8672043732237347.
[I 2024-02-11 01:00:58,874] Trial 61 finished with value: 3.3359084948113016 and parameters: {'model_name': 'SimpleImputer', 'strategy': 'most_frequent'}. Best is trial 2 with value: 2.8672043732237347.
[I 2024-02-11 01:00:59,109] Trial 68 finished with value: 3.3359084948113016 and parameters: {'model_name': 'SimpleImputer', 'strategy': 'most_frequent'}. Best is trial 2 with value: 2.8672043732237347.
[I 2024-02-11 01:00:59,277] Trial 76 finished with value: 3.3359084948113016 and parameters: {'model_name': 'SimpleImputer', 'strategy': 'most_frequent'}. Best is trial 2 with value: 2.8672043732237347.
[I 2024-02-11 01:00:59,526] Trial 64 finished with value: 3.3359084948113016 and parameters: {'model_name': 'SimpleImputer', 'strategy': 'most_frequent'}. Best is trial 2 with value: 2.8672043732237347.
[I 2024-02-11 01:00:59,823] Trial 120 finished with value: 2.8672043732237347 and parameters: {'model_name': 'SimpleImputer', 'strategy': 'mean'}. Best is trial 2 with value: 2.8672043732237347.
