[I 2024-04-01 23:13:03,964] Trial 74 finished with value: 6920.627421381881 and parameters: {'model_name': 'RandomForestImputer', 'max_iter': 9, 'decreasing': False, 'min_samples_split': 0.6000000000000001, 'min_samples_leaf': 0.4, 'max_features': 0.30000000000000004, 'warm_start': False}. Best is trial 4 with value: 6240.367438135623.
[I 2024-04-01 23:13:36,093] Trial 41 finished with value: 18666.375169696254 and parameters: {'model_name': 'IterativeImputer', 'sample_posterior': True, 'initial_strategy': 'constant', 'imputation_order': 'descending'}. Best is trial 4 with value: 6240.367438135623.
[I 2024-04-01 23:13:40,509] Trial 18 finished with value: 18412.305681668055 and parameters: {'model_name': 'IterativeImputer', 'sample_posterior': True, 'initial_strategy': 'most_frequent', 'imputation_order': 'arabic'}. Best is trial 4 with value: 6240.367438135623.
[I 2024-04-01 23:13:42,780] Trial 44 finished with value: 18883.26281751891 and parameters: {'model_name': 'IterativeImputer', 'sample_posterior': True, 'initial_strategy': 'mean', 'imputation_order': 'ascending'}. Best is trial 4 with value: 6240.367438135623.
[I 2024-04-01 23:13:43,957] Trial 47 finished with value: 18472.074781276868 and parameters: {'model_name': 'IterativeImputer', 'sample_posterior': True, 'initial_strategy': 'most_frequent', 'imputation_order': 'descending'}. Best is trial 4 with value: 6240.367438135623.
[I 2024-04-01 23:13:46,365] Trial 32 finished with value: 18106.925593588006 and parameters: {'model_name': 'IterativeImputer', 'sample_posterior': True, 'initial_strategy': 'most_frequent', 'imputation_order': 'arabic'}. Best is trial 4 with value: 6240.367438135623.
[I 2024-04-01 23:13:47,676] Trial 6 finished with value: 19157.759005984182 and parameters: {'model_name': 'IterativeImputer', 'sample_posterior': True, 'initial_strategy': 'most_frequent', 'imputation_order': 'roman'}. Best is trial 4 with value: 6240.367438135623.
[I 2024-04-01 23:13:50,356] Trial 56 finished with value: 19173.639687512616 and parameters: {'model_name': 'IterativeImputer', 'sample_posterior': True, 'initial_strategy': 'constant', 'imputation_order': 'ascending'}. Best is trial 4 with value: 6240.367438135623.
[I 2024-04-01 23:13:52,266] Trial 23 finished with value: 19305.143442131077 and parameters: {'model_name': 'IterativeImputer', 'sample_posterior': True, 'initial_strategy': 'constant', 'imputation_order': 'random'}. Best is trial 4 with value: 6240.367438135623.
[I 2024-04-01 23:14:01,185] Trial 77 finished with value: 19757.518256436837 and parameters: {'model_name': 'IterativeImputer', 'sample_posterior': True, 'initial_strategy': 'mean', 'imputation_order': 'descending'}. Best is trial 4 with value: 6240.367438135623.
[I 2024-04-01 23:14:09,492] Trial 78 finished with value: 17847.50113012369 and parameters: {'model_name': 'IterativeImputer', 'sample_posterior': True, 'initial_strategy': 'median', 'imputation_order': 'roman'}. Best is trial 4 with value: 6240.367438135623.
[I 2024-04-01 23:14:11,015] Trial 79 finished with value: 19458.859343731914 and parameters: {'model_name': 'IterativeImputer', 'sample_posterior': True, 'initial_strategy': 'median', 'imputation_order': 'ascending'}. Best is trial 4 with value: 6240.367438135623.
[I 2024-04-01 23:14:12,512] Trial 80 finished with value: 19179.367822142583 and parameters: {'model_name': 'IterativeImputer', 'sample_posterior': True, 'initial_strategy': 'mean', 'imputation_order': 'descending'}. Best is trial 4 with value: 6240.367438135623.
[I 2024-04-01 23:14:14,698] Trial 81 finished with value: 18986.3164972129 and parameters: {'model_name': 'IterativeImputer', 'sample_posterior': True, 'initial_strategy': 'constant', 'imputation_order': 'roman'}. Best is trial 4 with value: 6240.367438135623.
[I 2024-04-01 23:14:22,549] Trial 83 finished with value: 19341.316450429927 and parameters: {'model_name': 'IterativeImputer', 'sample_posterior': True, 'initial_strategy': 'constant', 'imputation_order': 'arabic'}. Best is trial 4 with value: 6240.367438135623.
[I 2024-04-01 23:14:28,097] Trial 84 finished with value: 18729.099822794702 and parameters: {'model_name': 'IterativeImputer', 'sample_posterior': True, 'initial_strategy': 'mean', 'imputation_order': 'ascending'}. Best is trial 4 with value: 6240.367438135623.
[I 2024-04-01 23:14:32,823] Trial 88 finished with value: 19189.737061463566 and parameters: {'model_name': 'IterativeImputer', 'sample_posterior': True, 'initial_strategy': 'constant', 'imputation_order': 'roman'}. Best is trial 4 with value: 6240.367438135623.
[I 2024-04-01 23:14:35,037] Trial 87 finished with value: 19529.297269573228 and parameters: {'model_name': 'IterativeImputer', 'sample_posterior': True, 'initial_strategy': 'most_frequent', 'imputation_order': 'roman'}. Best is trial 4 with value: 6240.367438135623.
[I 2024-04-01 23:15:47,413] Trial 14 finished with value: inf and parameters: {'model_name': 'GAIN', 'batch_size': 257, 'hint_rate': 0.9600000000000001, 'alpha': 79, 'iterations': 4001}. Best is trial 4 with value: 6240.367438135623.
[I 2024-04-01 23:16:01,628] Trial 157 finished with value: 6240.367438135623 and parameters: {'model_name': 'KNNImputer', 'weights': 'uniform', 'keep_empty_features': False}. Best is trial 4 with value: 6240.367438135623.
[I 2024-04-01 23:17:15,271] Trial 5 finished with value: 17926.91651378815 and parameters: {'model_name': 'GAIN', 'batch_size': 8, 'hint_rate': 0.77, 'alpha': 9, 'iterations': 579}. Best is trial 4 with value: 6240.367438135623.
[I 2024-04-01 23:26:35,780] Trial 55 finished with value: 10232.983473114107 and parameters: {'model_name': 'GAIN', 'batch_size': 23, 'hint_rate': 0.46, 'alpha': 21, 'iterations': 1304}. Best is trial 4 with value: 6240.367438135623.
[I 2024-04-01 23:26:49,778] Trial 160 finished with value: 6240.367438135623 and parameters: {'model_name': 'KNNImputer', 'weights': 'uniform', 'keep_empty_features': False}. Best is trial 4 with value: 6240.367438135623.
[I 2024-04-01 23:27:03,647] Trial 161 finished with value: 6240.367438135623 and parameters: {'model_name': 'KNNImputer', 'weights': 'uniform', 'keep_empty_features': False}. Best is trial 4 with value: 6240.367438135623.
[I 2024-04-01 23:27:18,270] Trial 162 finished with value: 6240.367438135623 and parameters: {'model_name': 'KNNImputer', 'weights': 'uniform', 'keep_empty_features': False}. Best is trial 4 with value: 6240.367438135623.
[I 2024-04-01 23:27:32,366] Trial 163 finished with value: 6240.367438135623 and parameters: {'model_name': 'KNNImputer', 'weights': 'uniform', 'keep_empty_features': False}. Best is trial 4 with value: 6240.367438135623.
[I 2024-04-01 23:29:19,969] Trial 71 finished with value: 6918.89523514861 and parameters: {'model_name': 'RandomForestImputer', 'max_iter': 51, 'decreasing': True, 'min_samples_split': 0.8, 'min_samples_leaf': 0.5, 'max_features': 0.7000000000000001, 'warm_start': False}. Best is trial 4 with value: 6240.367438135623.
[I 2024-04-01 23:30:20,771] Trial 17 finished with value: 10789.967642554144 and parameters: {'model_name': 'GAIN', 'batch_size': 634, 'hint_rate': 0.37, 'alpha': 94, 'iterations': 1356}. Best is trial 4 with value: 6240.367438135623.
[I 2024-04-01 23:30:34,609] Trial 166 finished with value: 6240.367438135623 and parameters: {'model_name': 'KNNImputer', 'weights': 'uniform', 'keep_empty_features': False}. Best is trial 4 with value: 6240.367438135623.
[I 2024-04-01 23:30:48,876] Trial 167 finished with value: 6240.367438135623 and parameters: {'model_name': 'KNNImputer', 'weights': 'uniform', 'keep_empty_features': False}. Best is trial 4 with value: 6240.367438135623.
[I 2024-04-01 23:31:02,251] Trial 168 finished with value: 6240.367438135623 and parameters: {'model_name': 'KNNImputer', 'weights': 'uniform', 'keep_empty_features': False}. Best is trial 4 with value: 6240.367438135623.
[I 2024-04-01 23:31:15,510] Trial 169 finished with value: 6240.367438135623 and parameters: {'model_name': 'KNNImputer', 'weights': 'uniform', 'keep_empty_features': False}. Best is trial 4 with value: 6240.367438135623.
[I 2024-04-01 23:31:18,066] Trial 50 finished with value: 9564.34593713145 and parameters: {'model_name': 'GAIN', 'batch_size': 244, 'hint_rate': 0.72, 'alpha': 80, 'iterations': 1546}. Best is trial 4 with value: 6240.367438135623.
[I 2024-04-01 23:31:31,548] Trial 171 finished with value: 6240.367438135623 and parameters: {'model_name': 'KNNImputer', 'weights': 'uniform', 'keep_empty_features': False}. Best is trial 4 with value: 6240.367438135623.
[I 2024-04-01 23:31:33,606] Trial 172 finished with value: 7116.895240271873 and parameters: {'model_name': 'SimpleImputer', 'strategy': 'most_frequent'}. Best is trial 4 with value: 6240.367438135623.
[I 2024-04-01 23:31:47,099] Trial 173 finished with value: 6240.367438135623 and parameters: {'model_name': 'KNNImputer', 'weights': 'uniform', 'keep_empty_features': False}. Best is trial 4 with value: 6240.367438135623.
[I 2024-04-01 23:32:00,515] Trial 174 finished with value: 6240.367438135623 and parameters: {'model_name': 'KNNImputer', 'weights': 'uniform', 'keep_empty_features': False}. Best is trial 4 with value: 6240.367438135623.
[I 2024-04-01 23:32:14,194] Trial 175 finished with value: 6240.367438135623 and parameters: {'model_name': 'KNNImputer', 'weights': 'uniform', 'keep_empty_features': False}. Best is trial 4 with value: 6240.367438135623.
[I 2024-04-01 23:32:27,780] Trial 176 finished with value: 6240.367438135623 and parameters: {'model_name': 'KNNImputer', 'weights': 'uniform', 'keep_empty_features': False}. Best is trial 4 with value: 6240.367438135623.
[I 2024-04-01 23:50:41,187] Trial 72 finished with value: inf and parameters: {'model_name': 'GAIN', 'batch_size': 69, 'hint_rate': 0.060000000000000005, 'alpha': 98, 'iterations': 32921}. Best is trial 4 with value: 6240.367438135623.
[I 2024-04-01 23:50:54,934] Trial 178 finished with value: 6240.367438135623 and parameters: {'model_name': 'KNNImputer', 'weights': 'uniform', 'keep_empty_features': False}. Best is trial 4 with value: 6240.367438135623.
[I 2024-04-01 23:51:09,503] Trial 179 finished with value: 6240.367438135623 and parameters: {'model_name': 'KNNImputer', 'weights': 'uniform', 'keep_empty_features': False}. Best is trial 4 with value: 6240.367438135623.
[I 2024-04-01 23:51:23,679] Trial 180 finished with value: 6240.367438135623 and parameters: {'model_name': 'KNNImputer', 'weights': 'uniform', 'keep_empty_features': False}. Best is trial 4 with value: 6240.367438135623.
[I 2024-04-01 23:51:37,788] Trial 181 finished with value: 6240.367438135623 and parameters: {'model_name': 'KNNImputer', 'weights': 'uniform', 'keep_empty_features': False}. Best is trial 4 with value: 6240.367438135623.
[I 2024-04-01 23:51:51,436] Trial 182 finished with value: 6240.367438135623 and parameters: {'model_name': 'KNNImputer', 'weights': 'uniform', 'keep_empty_features': False}. Best is trial 4 with value: 6240.367438135623.
[I 2024-04-01 23:52:05,415] Trial 183 finished with value: 6240.367438135623 and parameters: {'model_name': 'KNNImputer', 'weights': 'uniform', 'keep_empty_features': False}. Best is trial 4 with value: 6240.367438135623.
[I 2024-04-01 23:52:19,201] Trial 184 finished with value: 6240.367438135623 and parameters: {'model_name': 'KNNImputer', 'weights': 'uniform', 'keep_empty_features': False}. Best is trial 4 with value: 6240.367438135623.
[I 2024-04-01 23:52:33,088] Trial 185 finished with value: 6240.367438135623 and parameters: {'model_name': 'KNNImputer', 'weights': 'uniform', 'keep_empty_features': False}. Best is trial 4 with value: 6240.367438135623.
[I 2024-04-01 23:52:47,004] Trial 186 finished with value: 6240.367438135623 and parameters: {'model_name': 'KNNImputer', 'weights': 'uniform', 'keep_empty_features': False}. Best is trial 4 with value: 6240.367438135623.
[I 2024-04-01 23:53:36,225] Trial 187 finished with value: 225595.35693489347 and parameters: {'model_name': 'GAIN', 'batch_size': 1, 'hint_rate': 0.24000000000000002, 'alpha': 39, 'iterations': 56}. Best is trial 4 with value: 6240.367438135623.
[I 2024-04-01 23:53:50,027] Trial 188 finished with value: 6240.367438135623 and parameters: {'model_name': 'KNNImputer', 'weights': 'uniform', 'keep_empty_features': False}. Best is trial 4 with value: 6240.367438135623.
[I 2024-04-01 23:54:04,069] Trial 189 finished with value: 6240.367438135623 and parameters: {'model_name': 'KNNImputer', 'weights': 'uniform', 'keep_empty_features': False}. Best is trial 4 with value: 6240.367438135623.
[I 2024-04-01 23:54:18,272] Trial 190 finished with value: 6240.367438135623 and parameters: {'model_name': 'KNNImputer', 'weights': 'uniform', 'keep_empty_features': False}. Best is trial 4 with value: 6240.367438135623.
[I 2024-04-01 23:54:32,436] Trial 191 finished with value: 6240.367438135623 and parameters: {'model_name': 'KNNImputer', 'weights': 'uniform', 'keep_empty_features': False}. Best is trial 4 with value: 6240.367438135623.
[I 2024-04-01 23:54:46,272] Trial 192 finished with value: 6240.367438135623 and parameters: {'model_name': 'KNNImputer', 'weights': 'uniform', 'keep_empty_features': False}. Best is trial 4 with value: 6240.367438135623.
[I 2024-04-01 23:55:00,219] Trial 193 finished with value: 6240.367438135623 and parameters: {'model_name': 'KNNImputer', 'weights': 'uniform', 'keep_empty_features': False}. Best is trial 4 with value: 6240.367438135623.
[I 2024-04-01 23:55:01,591] Trial 194 finished with value: 7116.895248504645 and parameters: {'model_name': 'SimpleImputer', 'strategy': 'constant'}. Best is trial 4 with value: 6240.367438135623.
[I 2024-04-01 23:55:15,656] Trial 195 finished with value: 6240.367438135623 and parameters: {'model_name': 'KNNImputer', 'weights': 'uniform', 'keep_empty_features': False}. Best is trial 4 with value: 6240.367438135623.
[I 2024-04-01 23:55:29,775] Trial 196 finished with value: 6240.367438135623 and parameters: {'model_name': 'KNNImputer', 'weights': 'uniform', 'keep_empty_features': False}. Best is trial 4 with value: 6240.367438135623.
[I 2024-04-01 23:55:43,552] Trial 197 finished with value: 6240.367438135623 and parameters: {'model_name': 'KNNImputer', 'weights': 'uniform', 'keep_empty_features': False}. Best is trial 4 with value: 6240.367438135623.
[I 2024-04-01 23:55:57,593] Trial 198 finished with value: 6240.367438135623 and parameters: {'model_name': 'KNNImputer', 'weights': 'uniform', 'keep_empty_features': False}. Best is trial 4 with value: 6240.367438135623.
[I 2024-04-01 23:56:11,510] Trial 199 finished with value: 6240.367438135623 and parameters: {'model_name': 'KNNImputer', 'weights': 'uniform', 'keep_empty_features': False}. Best is trial 4 with value: 6240.367438135623.
[I 2024-04-02 00:13:52,812] Trial 53 finished with value: 7220.262875234623 and parameters: {'model_name': 'GAIN', 'batch_size': 22, 'hint_rate': 0.89, 'alpha': 41, 'iterations': 5522}. Best is trial 4 with value: 6240.367438135623.
[I 2024-04-02 00:17:49,695] Trial 10 finished with value: inf and parameters: {'model_name': 'GAIN', 'batch_size': 728, 'hint_rate': 0.99, 'alpha': 42, 'iterations': 47040}. Best is trial 4 with value: 6240.367438135623.
[I 2024-04-02 00:20:23,399] Trial 25 finished with value: 8148.342672665164 and parameters: {'model_name': 'GAIN', 'batch_size': 172, 'hint_rate': 0.39, 'alpha': 23, 'iterations': 5535}. Best is trial 4 with value: 6240.367438135623.
[I 2024-04-02 00:42:20,653] Trial 7 finished with value: inf and parameters: {'model_name': 'GAIN', 'batch_size': 3, 'hint_rate': 0.42000000000000004, 'alpha': 94, 'iterations': 92077}. Best is trial 4 with value: 6240.367438135623.
[I 2024-04-02 00:43:04,626] Trial 165 finished with value: inf and parameters: {'model_name': 'GAIN', 'batch_size': 1, 'hint_rate': 0.23, 'alpha': 34, 'iterations': 75933}. Best is trial 4 with value: 6240.367438135623.
[I 2024-04-02 00:46:43,030] Trial 67 finished with value: inf and parameters: {'model_name': 'GAIN', 'batch_size': 84, 'hint_rate': 0.78, 'alpha': 92, 'iterations': 82202}. Best is trial 4 with value: 6240.367438135623.
[I 2024-04-02 00:49:28,591] Trial 159 finished with value: inf and parameters: {'model_name': 'GAIN', 'batch_size': 1, 'hint_rate': 0.29000000000000004, 'alpha': 32, 'iterations': 94339}. Best is trial 4 with value: 6240.367438135623.
[I 2024-04-02 01:12:29,909] Trial 132 finished with value: 7374.423148552433 and parameters: {'model_name': 'GAIN', 'batch_size': 1, 'hint_rate': 0.24000000000000002, 'alpha': 6, 'iterations': 12689}. Best is trial 4 with value: 6240.367438135623.
[I 2024-04-02 01:19:48,152] Trial 148 finished with value: 7198.728325423843 and parameters: {'model_name': 'GAIN', 'batch_size': 1, 'hint_rate': 0.23, 'alpha': 3, 'iterations': 13264}. Best is trial 4 with value: 6240.367438135623.
[I 2024-04-02 01:25:42,467] Trial 147 finished with value: inf and parameters: {'model_name': 'GAIN', 'batch_size': 1, 'hint_rate': 0.24000000000000002, 'alpha': 5, 'iterations': 47110}. Best is trial 4 with value: 6240.367438135623.
[I 2024-04-02 01:33:38,462] Trial 156 finished with value: inf and parameters: {'model_name': 'GAIN', 'batch_size': 1, 'hint_rate': 0.25, 'alpha': 1, 'iterations': 75000}. Best is trial 4 with value: 6240.367438135623.
[I 2024-04-02 01:47:58,090] Trial 152 finished with value: 7160.934978506397 and parameters: {'model_name': 'GAIN', 'batch_size': 1, 'hint_rate': 0.28, 'alpha': 1, 'iterations': 17041}. Best is trial 4 with value: 6240.367438135623.
[I 2024-04-02 01:56:11,486] Trial 124 finished with value: inf and parameters: {'model_name': 'GAIN', 'batch_size': 1, 'hint_rate': 0.26, 'alpha': 12, 'iterations': 90724}. Best is trial 4 with value: 6240.367438135623.
[I 2024-04-02 01:58:44,498] Trial 131 finished with value: inf and parameters: {'model_name': 'GAIN', 'batch_size': 1, 'hint_rate': 0.24000000000000002, 'alpha': 4, 'iterations': 92888}. Best is trial 4 with value: 6240.367438135623.
[I 2024-04-02 02:00:20,905] Trial 164 finished with value: inf and parameters: {'model_name': 'GAIN', 'batch_size': 1, 'hint_rate': 0.22, 'alpha': 37, 'iterations': 86316}. Best is trial 4 with value: 6240.367438135623.
[I 2024-04-02 02:01:27,829] Trial 146 finished with value: inf and parameters: {'model_name': 'GAIN', 'batch_size': 1, 'hint_rate': 0.25, 'alpha': 2, 'iterations': 95632}. Best is trial 4 with value: 6240.367438135623.
[I 2024-04-02 02:06:04,866] Trial 139 finished with value: inf and parameters: {'model_name': 'GAIN', 'batch_size': 1, 'hint_rate': 0.25, 'alpha': 6, 'iterations': 96764}. Best is trial 4 with value: 6240.367438135623.
[I 2024-04-02 02:18:40,710] Trial 153 finished with value: inf and parameters: {'model_name': 'GAIN', 'batch_size': 1, 'hint_rate': 0.22, 'alpha': 3, 'iterations': 72460}. Best is trial 4 with value: 6240.367438135623.
[I 2024-04-02 03:35:35,987] Trial 0 finished with value: inf and parameters: {'model_name': 'GAIN', 'batch_size': 1, 'hint_rate': 0.92, 'alpha': 46, 'iterations': 49113}. Best is trial 4 with value: 6240.367438135623.
[I 2024-04-02 03:39:21,327] Trial 130 finished with value: inf and parameters: {'model_name': 'GAIN', 'batch_size': 1, 'hint_rate': 0.22, 'alpha': 2, 'iterations': 87736}. Best is trial 4 with value: 6240.367438135623.
[I 2024-04-02 03:46:51,477] Trial 150 finished with value: 6859.235109146012 and parameters: {'model_name': 'GAIN', 'batch_size': 1, 'hint_rate': 0.23, 'alpha': 2, 'iterations': 35547}. Best is trial 4 with value: 6240.367438135623.
[I 2024-04-02 03:48:11,681] Trial 140 finished with value: 7845.4758654132875 and parameters: {'model_name': 'GAIN', 'batch_size': 1, 'hint_rate': 0.24000000000000002, 'alpha': 19, 'iterations': 36309}. Best is trial 4 with value: 6240.367438135623.
[I 2024-04-02 03:55:11,932] Trial 158 finished with value: inf and parameters: {'model_name': 'GAIN', 'batch_size': 1, 'hint_rate': 0.27, 'alpha': 23, 'iterations': 61825}. Best is trial 4 with value: 6240.367438135623.
[I 2024-04-02 03:57:29,335] Trial 170 finished with value: 6807.909274009488 and parameters: {'model_name': 'GAIN', 'batch_size': 1, 'hint_rate': 0.17, 'alpha': 36, 'iterations': 35997}. Best is trial 4 with value: 6240.367438135623.
[I 2024-04-02 04:13:15,286] Trial 128 finished with value: inf and parameters: {'model_name': 'GAIN', 'batch_size': 1, 'hint_rate': 0.22, 'alpha': 0, 'iterations': 83634}. Best is trial 4 with value: 6240.367438135623.
[I 2024-04-02 04:37:49,411] Trial 144 finished with value: 7376.272264305934 and parameters: {'model_name': 'GAIN', 'batch_size': 1, 'hint_rate': 0.26, 'alpha': 4, 'iterations': 47223}. Best is trial 4 with value: 6240.367438135623.
[I 2024-04-02 04:43:47,658] Trial 143 finished with value: inf and parameters: {'model_name': 'GAIN', 'batch_size': 2, 'hint_rate': 0.23, 'alpha': 3, 'iterations': 59221}. Best is trial 4 with value: 6240.367438135623.
[I 2024-04-02 04:50:09,008] Trial 136 finished with value: 7464.30611590497 and parameters: {'model_name': 'GAIN', 'batch_size': 1, 'hint_rate': 0.26, 'alpha': 1, 'iterations': 48979}. Best is trial 4 with value: 6240.367438135623.
[I 2024-04-02 04:51:07,500] Trial 135 finished with value: inf and parameters: {'model_name': 'GAIN', 'batch_size': 1, 'hint_rate': 0.22, 'alpha': 5, 'iterations': 82203}. Best is trial 4 with value: 6240.367438135623.
[I 2024-04-02 04:52:59,035] Trial 142 finished with value: inf and parameters: {'model_name': 'GAIN', 'batch_size': 1, 'hint_rate': 0.23, 'alpha': 9, 'iterations': 71135}. Best is trial 4 with value: 6240.367438135623.
[I 2024-04-02 04:53:40,455] Trial 177 finished with value: 6954.481125203298 and parameters: {'model_name': 'GAIN', 'batch_size': 1, 'hint_rate': 0.19, 'alpha': 35, 'iterations': 48561}. Best is trial 4 with value: 6240.367438135623.
