[I 2024-04-15 00:16:52,444] Trial 37 finished with value: 0.4803321266400915 and parameters: {'model_name': 'SimpleImputer', 'strategy': 'constant'}. Best is trial 37 with value: 0.4803321266400915.
[I 2024-04-15 00:16:53,398] Trial 31 finished with value: 0.4053068284753105 and parameters: {'model_name': 'SimpleImputer', 'strategy': 'mean'}. Best is trial 31 with value: 0.4053068284753105.
[I 2024-04-15 00:16:54,021] Trial 34 finished with value: 0.4803321266400915 and parameters: {'model_name': 'SimpleImputer', 'strategy': 'constant'}. Best is trial 31 with value: 0.4053068284753105.
[I 2024-04-15 00:16:55,010] Trial 5 finished with value: 0.4803321266400915 and parameters: {'model_name': 'SimpleImputer', 'strategy': 'median'}. Best is trial 31 with value: 0.4053068284753105.
[I 2024-04-15 00:16:55,981] Trial 25 finished with value: 0.4053068284753105 and parameters: {'model_name': 'SimpleImputer', 'strategy': 'mean'}. Best is trial 31 with value: 0.4053068284753105.
[I 2024-04-15 00:16:56,007] Trial 46 finished with value: 0.4053068284753105 and parameters: {'model_name': 'SimpleImputer', 'strategy': 'mean'}. Best is trial 31 with value: 0.4053068284753105.
[I 2024-04-15 00:16:57,359] Trial 2 finished with value: 0.4803321266400915 and parameters: {'model_name': 'SimpleImputer', 'strategy': 'median'}. Best is trial 31 with value: 0.4053068284753105.
[I 2024-04-15 00:16:59,382] Trial 38 finished with value: 0.4803321266400915 and parameters: {'model_name': 'SimpleImputer', 'strategy': 'median'}. Best is trial 31 with value: 0.4053068284753105.
[I 2024-04-15 00:17:00,370] Trial 39 finished with value: 0.4803321266400915 and parameters: {'model_name': 'SimpleImputer', 'strategy': 'median'}. Best is trial 31 with value: 0.4053068284753105.
[I 2024-04-15 00:17:04,189] Trial 53 finished with value: 0.4053068284753105 and parameters: {'model_name': 'SimpleImputer', 'strategy': 'mean'}. Best is trial 31 with value: 0.4053068284753105.
2024-04-15 00:17:05.263377: E external/local_xla/xla/stream_executor/cuda/cuda_driver.cc:274] failed call to cuInit: CUDA_ERROR_NO_DEVICE: no CUDA-capable device is detected
2024-04-15 00:17:05.890855: I tensorflow/compiler/mlir/mlir_graph_optimization_pass.cc:388] MLIR V1 optimization pass is not enabled
[I 2024-04-15 00:17:16,474] Trial 1 finished with value: 0.4803321266400915 and parameters: {'model_name': 'SimpleImputer', 'strategy': 'most_frequent'}. Best is trial 31 with value: 0.4053068284753105.
[I 2024-04-15 00:17:18,367] Trial 33 finished with value: 0.4803321266400915 and parameters: {'model_name': 'SimpleImputer', 'strategy': 'most_frequent'}. Best is trial 31 with value: 0.4053068284753105.
[I 2024-04-15 00:17:21,068] Trial 24 finished with value: 0.4803321266400915 and parameters: {'model_name': 'SimpleImputer', 'strategy': 'most_frequent'}. Best is trial 31 with value: 0.4053068284753105.
[I 2024-04-15 00:17:22,713] Trial 41 finished with value: 0.4803321266400915 and parameters: {'model_name': 'SimpleImputer', 'strategy': 'most_frequent'}. Best is trial 31 with value: 0.4053068284753105.
[I 2024-04-15 00:17:30,371] Trial 3 finished with value: 0.35023001573835144 and parameters: {'model_name': 'KNNImputer', 'weights': 'distance', 'keep_empty_features': False}. Best is trial 3 with value: 0.35023001573835144.
[I 2024-04-15 00:17:30,964] Trial 23 finished with value: 0.35023001573835144 and parameters: {'model_name': 'KNNImputer', 'weights': 'distance', 'keep_empty_features': False}. Best is trial 3 with value: 0.35023001573835144.
[I 2024-04-15 00:17:31,666] Trial 28 finished with value: 0.3209914729059632 and parameters: {'model_name': 'KNNImputer', 'weights': 'uniform', 'keep_empty_features': False}. Best is trial 28 with value: 0.3209914729059632.
[I 2024-04-15 00:17:33,244] Trial 18 finished with value: 0.3209914729059632 and parameters: {'model_name': 'KNNImputer', 'weights': 'uniform', 'keep_empty_features': False}. Best is trial 28 with value: 0.3209914729059632.
[I 2024-04-15 00:17:34,387] Trial 16 finished with value: 0.35023001573835144 and parameters: {'model_name': 'KNNImputer', 'weights': 'distance', 'keep_empty_features': False}. Best is trial 28 with value: 0.3209914729059632.
[I 2024-04-15 00:17:35,677] Trial 40 finished with value: 0.35023001573835144 and parameters: {'model_name': 'KNNImputer', 'weights': 'distance', 'keep_empty_features': False}. Best is trial 28 with value: 0.3209914729059632.
[I 2024-04-15 00:17:36,403] Trial 9 finished with value: 0.3209914729059632 and parameters: {'model_name': 'KNNImputer', 'weights': 'uniform', 'keep_empty_features': False}. Best is trial 28 with value: 0.3209914729059632.
[I 2024-04-15 00:17:37,477] Trial 44 finished with value: 0.35023001573835144 and parameters: {'model_name': 'KNNImputer', 'weights': 'distance', 'keep_empty_features': False}. Best is trial 28 with value: 0.3209914729059632.
[I 2024-04-15 00:17:40,898] Trial 49 finished with value: 0.35023001573835144 and parameters: {'model_name': 'KNNImputer', 'weights': 'distance', 'keep_empty_features': False}. Best is trial 28 with value: 0.3209914729059632.
[I 2024-04-15 00:17:53,131] Trial 58 finished with value: 0.3209914729059632 and parameters: {'model_name': 'KNNImputer', 'weights': 'uniform', 'keep_empty_features': False}. Best is trial 28 with value: 0.3209914729059632.
[I 2024-04-15 00:17:56,763] Trial 60 finished with value: 0.35023001573835144 and parameters: {'model_name': 'KNNImputer', 'weights': 'distance', 'keep_empty_features': False}. Best is trial 28 with value: 0.3209914729059632.
[I 2024-04-15 00:18:03,225] Trial 64 finished with value: 0.3209914729059632 and parameters: {'model_name': 'KNNImputer', 'weights': 'uniform', 'keep_empty_features': False}. Best is trial 28 with value: 0.3209914729059632.
[I 2024-04-15 00:18:04,739] Trial 62 finished with value: 0.35023001573835144 and parameters: {'model_name': 'KNNImputer', 'weights': 'distance', 'keep_empty_features': False}. Best is trial 28 with value: 0.3209914729059632.
[I 2024-04-15 00:18:05,710] Trial 63 finished with value: 0.35023001573835144 and parameters: {'model_name': 'KNNImputer', 'weights': 'distance', 'keep_empty_features': False}. Best is trial 28 with value: 0.3209914729059632.
[I 2024-04-15 00:18:19,576] Trial 70 finished with value: 0.4053068284753105 and parameters: {'model_name': 'RandomForestImputer', 'max_iter': 1, 'decreasing': True, 'min_samples_split': 0.30000000000000004, 'min_samples_leaf': 0.30000000000000004, 'max_features': 0.6, 'warm_start': True}. Best is trial 28 with value: 0.3209914729059632.
[I 2024-04-15 00:19:19,786] Trial 0 finished with value: 0.6277245930285675 and parameters: {'model_name': 'GAIN', 'batch_size': 11, 'hint_rate': 0.99, 'alpha': 18, 'iterations': 3}. Best is trial 28 with value: 0.3209914729059632.
[I 2024-04-15 00:19:21,218] Trial 48 finished with value: 0.6454563439022142 and parameters: {'model_name': 'GAIN', 'batch_size': 99, 'hint_rate': 0.61, 'alpha': 45, 'iterations': 1}. Best is trial 28 with value: 0.3209914729059632.
[I 2024-04-15 00:19:22,007] Trial 45 finished with value: 0.6380614410928532 and parameters: {'model_name': 'GAIN', 'batch_size': 2, 'hint_rate': 0.05, 'alpha': 93, 'iterations': 1}. Best is trial 28 with value: 0.3209914729059632.
[I 2024-04-15 00:19:24,849] Trial 10 finished with value: 0.6240914691283111 and parameters: {'model_name': 'GAIN', 'batch_size': 2, 'hint_rate': 0.98, 'alpha': 38, 'iterations': 3}. Best is trial 28 with value: 0.3209914729059632.
[I 2024-04-15 00:20:02,581] Trial 6 finished with value: 0.4164810940893001 and parameters: {'model_name': 'RandomForestImputer', 'max_iter': 4, 'decreasing': False, 'min_samples_split': 0.9, 'min_samples_leaf': 0.8, 'max_features': 0.9, 'warm_start': True}. Best is trial 28 with value: 0.3209914729059632.
[I 2024-04-15 00:20:45,018] Trial 11 finished with value: 0.5548528311792298 and parameters: {'model_name': 'GAIN', 'batch_size': 607, 'hint_rate': 0.49, 'alpha': 57, 'iterations': 22}. Best is trial 28 with value: 0.3209914729059632.
[I 2024-04-15 00:20:47,569] Trial 67 finished with value: 0.4053068284753105 and parameters: {'model_name': 'RandomForestImputer', 'max_iter': 1, 'decreasing': True, 'min_samples_split': 0.30000000000000004, 'min_samples_leaf': 0.5, 'max_features': 0.9, 'warm_start': False}. Best is trial 28 with value: 0.3209914729059632.
[I 2024-04-15 00:20:56,014] Trial 73 finished with value: 0.4170234507112724 and parameters: {'model_name': 'RandomForestImputer', 'max_iter': 5, 'decreasing': True, 'min_samples_split': 0.8, 'min_samples_leaf': 0.30000000000000004, 'max_features': 0.5, 'warm_start': True}. Best is trial 28 with value: 0.3209914729059632.
[I 2024-04-15 00:21:11,822] Trial 54 finished with value: 0.4187830309765636 and parameters: {'model_name': 'RandomForestImputer', 'max_iter': 7, 'decreasing': True, 'min_samples_split': 0.1, 'min_samples_leaf': 0.2, 'max_features': 0.4, 'warm_start': True}. Best is trial 28 with value: 0.3209914729059632.
[I 2024-04-15 00:21:12,669] Trial 69 finished with value: 0.5649986756860921 and parameters: {'model_name': 'GAIN', 'batch_size': 249, 'hint_rate': 0.8400000000000001, 'alpha': 5, 'iterations': 23}. Best is trial 28 with value: 0.3209914729059632.
[I 2024-04-15 00:21:49,846] Trial 35 finished with value: 0.5452946068933502 and parameters: {'model_name': 'GAIN', 'batch_size': 480, 'hint_rate': 0.85, 'alpha': 98, 'iterations': 38}. Best is trial 28 with value: 0.3209914729059632.
[I 2024-04-15 00:22:11,433] Trial 87 finished with value: 0.3209914729059632 and parameters: {'model_name': 'KNNImputer', 'weights': 'uniform', 'keep_empty_features': False}. Best is trial 28 with value: 0.3209914729059632.
[I 2024-04-15 00:22:36,611] Trial 30 finished with value: 0.416557922134747 and parameters: {'model_name': 'RandomForestImputer', 'max_iter': 16, 'decreasing': True, 'min_samples_split': 0.9, 'min_samples_leaf': 0.7000000000000001, 'max_features': 0.9, 'warm_start': True}. Best is trial 28 with value: 0.3209914729059632.
[I 2024-04-15 00:23:32,433] Trial 13 finished with value: 0.41682223501291904 and parameters: {'model_name': 'RandomForestImputer', 'max_iter': 22, 'decreasing': False, 'min_samples_split': 0.1, 'min_samples_leaf': 0.9, 'max_features': 0.1, 'warm_start': True}. Best is trial 28 with value: 0.3209914729059632.
[I 2024-04-15 00:23:37,587] Trial 20 finished with value: 0.5475083740354444 and parameters: {'model_name': 'GAIN', 'batch_size': 1, 'hint_rate': 0.33, 'alpha': 69, 'iterations': 78}. Best is trial 28 with value: 0.3209914729059632.
[I 2024-04-15 00:23:40,332] Trial 68 finished with value: 0.41674206982051165 and parameters: {'model_name': 'RandomForestImputer', 'max_iter': 20, 'decreasing': False, 'min_samples_split': 0.2, 'min_samples_leaf': 0.9, 'max_features': 0.30000000000000004, 'warm_start': True}. Best is trial 28 with value: 0.3209914729059632.
[I 2024-04-15 00:25:16,982] Trial 42 finished with value: inf and parameters: {'model_name': 'GAIN', 'batch_size': 152, 'hint_rate': 0.02, 'alpha': 88, 'iterations': 1150}. Best is trial 28 with value: 0.3209914729059632.
[I 2024-04-15 00:27:41,667] Trial 4 finished with value: 0.41672021127823095 and parameters: {'model_name': 'RandomForestImputer', 'max_iter': 96, 'decreasing': False, 'min_samples_split': 0.7000000000000001, 'min_samples_leaf': 0.6, 'max_features': 0.4, 'warm_start': True}. Best is trial 28 with value: 0.3209914729059632.
[I 2024-04-15 00:28:28,847] Trial 59 finished with value: 0.47866940490867355 and parameters: {'model_name': 'GAIN', 'batch_size': 10, 'hint_rate': 0.35000000000000003, 'alpha': 77, 'iterations': 149}. Best is trial 28 with value: 0.3209914729059632.
[I 2024-04-15 00:31:24,162] Trial 32 finished with value: 0.2285702000115084 and parameters: {'model_name': 'IterativeImputer', 'sample_posterior': False, 'initial_strategy': 'mean', 'imputation_order': 'arabic'}. Best is trial 32 with value: 0.2285702000115084.
[I 2024-04-15 00:31:30,674] Trial 52 finished with value: 0.22822820015142353 and parameters: {'model_name': 'IterativeImputer', 'sample_posterior': False, 'initial_strategy': 'mean', 'imputation_order': 'descending'}. Best is trial 52 with value: 0.22822820015142353.
[I 2024-04-15 00:31:36,293] Trial 17 finished with value: 0.2285702000115084 and parameters: {'model_name': 'IterativeImputer', 'sample_posterior': False, 'initial_strategy': 'mean', 'imputation_order': 'arabic'}. Best is trial 52 with value: 0.22822820015142353.
[I 2024-04-15 00:31:37,481] Trial 14 finished with value: 0.48009585812815886 and parameters: {'model_name': 'GAIN', 'batch_size': 14, 'hint_rate': 0.99, 'alpha': 18, 'iterations': 206}. Best is trial 52 with value: 0.22822820015142353.
[I 2024-04-15 00:31:41,213] Trial 7 finished with value: 0.22827448542665968 and parameters: {'model_name': 'IterativeImputer', 'sample_posterior': False, 'initial_strategy': 'mean', 'imputation_order': 'ascending'}. Best is trial 52 with value: 0.22822820015142353.
[I 2024-04-15 00:31:52,735] Trial 21 finished with value: 0.22709666808728138 and parameters: {'model_name': 'IterativeImputer', 'sample_posterior': False, 'initial_strategy': 'mean', 'imputation_order': 'random'}. Best is trial 21 with value: 0.22709666808728138.
[I 2024-04-15 00:31:53,484] Trial 61 finished with value: 0.22827448542665968 and parameters: {'model_name': 'IterativeImputer', 'sample_posterior': False, 'initial_strategy': 'mean', 'imputation_order': 'ascending'}. Best is trial 21 with value: 0.22709666808728138.
[I 2024-04-15 00:31:54,786] Trial 50 finished with value: 0.23102872759045184 and parameters: {'model_name': 'IterativeImputer', 'sample_posterior': False, 'initial_strategy': 'median', 'imputation_order': 'descending'}. Best is trial 21 with value: 0.22709666808728138.
[I 2024-04-15 00:32:11,620] Trial 71 finished with value: 0.22793185665036128 and parameters: {'model_name': 'IterativeImputer', 'sample_posterior': False, 'initial_strategy': 'mean', 'imputation_order': 'roman'}. Best is trial 21 with value: 0.22709666808728138.
[I 2024-04-15 00:32:12,849] Trial 15 finished with value: 0.2324566799336075 and parameters: {'model_name': 'IterativeImputer', 'sample_posterior': False, 'initial_strategy': 'constant', 'imputation_order': 'random'}. Best is trial 21 with value: 0.22709666808728138.
[I 2024-04-15 00:32:14,892] Trial 55 finished with value: 0.2312391350175754 and parameters: {'model_name': 'IterativeImputer', 'sample_posterior': False, 'initial_strategy': 'most_frequent', 'imputation_order': 'ascending'}. Best is trial 21 with value: 0.22709666808728138.
[I 2024-04-15 00:32:17,655] Trial 56 finished with value: 0.23112685639350664 and parameters: {'model_name': 'IterativeImputer', 'sample_posterior': False, 'initial_strategy': 'most_frequent', 'imputation_order': 'roman'}. Best is trial 21 with value: 0.22709666808728138.
[I 2024-04-15 00:32:30,413] Trial 47 finished with value: 0.23113389086146072 and parameters: {'model_name': 'IterativeImputer', 'sample_posterior': False, 'initial_strategy': 'most_frequent', 'imputation_order': 'arabic'}. Best is trial 21 with value: 0.22709666808728138.
[I 2024-04-15 00:32:46,900] Trial 12 finished with value: 0.47658277217165884 and parameters: {'model_name': 'GAIN', 'batch_size': 155, 'hint_rate': 0.9400000000000001, 'alpha': 7, 'iterations': 192}. Best is trial 21 with value: 0.22709666808728138.
[I 2024-04-15 00:34:02,332] Trial 80 finished with value: 0.23113389086146072 and parameters: {'model_name': 'IterativeImputer', 'sample_posterior': False, 'initial_strategy': 'constant', 'imputation_order': 'arabic'}. Best is trial 21 with value: 0.22709666808728138.
[I 2024-04-15 00:34:06,275] Trial 77 finished with value: 0.23113389086146072 and parameters: {'model_name': 'IterativeImputer', 'sample_posterior': False, 'initial_strategy': 'median', 'imputation_order': 'arabic'}. Best is trial 21 with value: 0.22709666808728138.
[I 2024-04-15 00:36:19,107] Trial 43 finished with value: 0.3979143639960544 and parameters: {'model_name': 'RandomForestImputer', 'max_iter': 7, 'decreasing': True, 'min_samples_split': 0.1, 'min_samples_leaf': 0.30000000000000004, 'max_features': 0.5, 'warm_start': False}. Best is trial 21 with value: 0.22709666808728138.
[I 2024-04-15 00:36:50,712] Trial 85 finished with value: 0.22961920006003544 and parameters: {'model_name': 'IterativeImputer', 'sample_posterior': False, 'initial_strategy': 'most_frequent', 'imputation_order': 'random'}. Best is trial 21 with value: 0.22709666808728138.
[I 2024-04-15 00:39:00,334] Trial 90 finished with value: 0.2312391350175754 and parameters: {'model_name': 'IterativeImputer', 'sample_posterior': False, 'initial_strategy': 'median', 'imputation_order': 'ascending'}. Best is trial 21 with value: 0.22709666808728138.
[I 2024-04-15 00:39:49,897] Trial 92 finished with value: 0.2325658048445375 and parameters: {'model_name': 'IterativeImputer', 'sample_posterior': False, 'initial_strategy': 'most_frequent', 'imputation_order': 'random'}. Best is trial 21 with value: 0.22709666808728138.
[I 2024-04-15 00:40:51,102] Trial 93 finished with value: 0.22793185665036128 and parameters: {'model_name': 'IterativeImputer', 'sample_posterior': False, 'initial_strategy': 'mean', 'imputation_order': 'roman'}. Best is trial 21 with value: 0.22709666808728138.
[I 2024-04-15 00:43:04,199] Trial 26 finished with value: 0.35092873661312673 and parameters: {'model_name': 'IterativeImputer', 'sample_posterior': True, 'initial_strategy': 'mean', 'imputation_order': 'roman'}. Best is trial 21 with value: 0.22709666808728138.
[I 2024-04-15 00:43:16,341] Trial 27 finished with value: 0.3484500744408946 and parameters: {'model_name': 'IterativeImputer', 'sample_posterior': True, 'initial_strategy': 'mean', 'imputation_order': 'arabic'}. Best is trial 21 with value: 0.22709666808728138.
[I 2024-04-15 00:43:20,329] Trial 36 finished with value: 0.35288133569922847 and parameters: {'model_name': 'IterativeImputer', 'sample_posterior': True, 'initial_strategy': 'mean', 'imputation_order': 'descending'}. Best is trial 21 with value: 0.22709666808728138.
[I 2024-04-15 00:43:35,192] Trial 51 finished with value: 0.34246089906386473 and parameters: {'model_name': 'IterativeImputer', 'sample_posterior': True, 'initial_strategy': 'mean', 'imputation_order': 'arabic'}. Best is trial 21 with value: 0.22709666808728138.
[I 2024-04-15 00:43:38,562] Trial 29 finished with value: 0.3452880125195042 and parameters: {'model_name': 'IterativeImputer', 'sample_posterior': True, 'initial_strategy': 'constant', 'imputation_order': 'random'}. Best is trial 21 with value: 0.22709666808728138.
[I 2024-04-15 00:43:52,845] Trial 66 finished with value: 0.3441393916575898 and parameters: {'model_name': 'IterativeImputer', 'sample_posterior': True, 'initial_strategy': 'constant', 'imputation_order': 'arabic'}. Best is trial 21 with value: 0.22709666808728138.
[I 2024-04-15 00:43:59,156] Trial 57 finished with value: 0.3483688499501152 and parameters: {'model_name': 'IterativeImputer', 'sample_posterior': True, 'initial_strategy': 'mean', 'imputation_order': 'random'}. Best is trial 21 with value: 0.22709666808728138.
[I 2024-04-15 00:44:09,617] Trial 72 finished with value: 0.3500025433130399 and parameters: {'model_name': 'IterativeImputer', 'sample_posterior': True, 'initial_strategy': 'constant', 'imputation_order': 'ascending'}. Best is trial 21 with value: 0.22709666808728138.
[I 2024-04-15 00:44:18,340] Trial 74 finished with value: 0.3496800581956485 and parameters: {'model_name': 'IterativeImputer', 'sample_posterior': True, 'initial_strategy': 'most_frequent', 'imputation_order': 'ascending'}. Best is trial 21 with value: 0.22709666808728138.
[I 2024-04-15 00:44:26,325] Trial 76 finished with value: 0.3453812827320699 and parameters: {'model_name': 'IterativeImputer', 'sample_posterior': True, 'initial_strategy': 'mean', 'imputation_order': 'arabic'}. Best is trial 21 with value: 0.22709666808728138.
[I 2024-04-15 00:44:51,882] Trial 78 finished with value: 0.3530499779888015 and parameters: {'model_name': 'IterativeImputer', 'sample_posterior': True, 'initial_strategy': 'mean', 'imputation_order': 'roman'}. Best is trial 21 with value: 0.22709666808728138.
[I 2024-04-15 00:44:58,433] Trial 79 finished with value: 0.3500246986633129 and parameters: {'model_name': 'IterativeImputer', 'sample_posterior': True, 'initial_strategy': 'median', 'imputation_order': 'arabic'}. Best is trial 21 with value: 0.22709666808728138.
[I 2024-04-15 00:46:42,931] Trial 81 finished with value: 0.3483429129018181 and parameters: {'model_name': 'IterativeImputer', 'sample_posterior': True, 'initial_strategy': 'constant', 'imputation_order': 'ascending'}. Best is trial 21 with value: 0.22709666808728138.
[I 2024-04-15 00:47:30,735] Trial 83 finished with value: 0.3488019778728202 and parameters: {'model_name': 'IterativeImputer', 'sample_posterior': True, 'initial_strategy': 'median', 'imputation_order': 'arabic'}. Best is trial 21 with value: 0.22709666808728138.
[I 2024-04-15 00:47:33,815] Trial 82 finished with value: 0.34724672034372084 and parameters: {'model_name': 'IterativeImputer', 'sample_posterior': True, 'initial_strategy': 'median', 'imputation_order': 'random'}. Best is trial 21 with value: 0.22709666808728138.
[I 2024-04-15 00:47:50,826] Trial 86 finished with value: 0.34782141585736215 and parameters: {'model_name': 'IterativeImputer', 'sample_posterior': True, 'initial_strategy': 'median', 'imputation_order': 'random'}. Best is trial 21 with value: 0.22709666808728138.
[I 2024-04-15 00:47:52,974] Trial 84 finished with value: 0.34666119697654996 and parameters: {'model_name': 'IterativeImputer', 'sample_posterior': True, 'initial_strategy': 'median', 'imputation_order': 'random'}. Best is trial 21 with value: 0.22709666808728138.
