[I 2024-04-04 09:01:59,719] Trial 3 finished with value: 0.22522324968274013 and parameters: {'model_name': 'SimpleImputer', 'strategy': 'mean'}. Best is trial 3 with value: 0.22522324968274013.
[I 2024-04-04 09:02:00,313] Trial 9 finished with value: 0.24498001849606782 and parameters: {'model_name': 'SimpleImputer', 'strategy': 'constant'}. Best is trial 3 with value: 0.22522324968274013.
[I 2024-04-04 09:02:01,584] Trial 12 finished with value: 0.24498001849606782 and parameters: {'model_name': 'SimpleImputer', 'strategy': 'constant'}. Best is trial 3 with value: 0.22522324968274013.
[I 2024-04-04 09:02:02,226] Trial 14 finished with value: 0.24498001849606782 and parameters: {'model_name': 'SimpleImputer', 'strategy': 'constant'}. Best is trial 3 with value: 0.22522324968274013.
[I 2024-04-04 09:02:03,093] Trial 21 finished with value: 0.24498001849606782 and parameters: {'model_name': 'SimpleImputer', 'strategy': 'median'}. Best is trial 3 with value: 0.22522324968274013.
[I 2024-04-04 09:02:04,098] Trial 16 finished with value: 0.24498001849606782 and parameters: {'model_name': 'SimpleImputer', 'strategy': 'constant'}. Best is trial 3 with value: 0.22522324968274013.
[I 2024-04-04 09:02:06,271] Trial 51 finished with value: 0.22522324968274013 and parameters: {'model_name': 'SimpleImputer', 'strategy': 'mean'}. Best is trial 3 with value: 0.22522324968274013.
[I 2024-04-04 09:02:06,914] Trial 52 finished with value: 0.24498001849606782 and parameters: {'model_name': 'SimpleImputer', 'strategy': 'constant'}. Best is trial 3 with value: 0.22522324968274013.
[I 2024-04-04 09:02:07,682] Trial 50 finished with value: 0.24498001849606782 and parameters: {'model_name': 'SimpleImputer', 'strategy': 'median'}. Best is trial 3 with value: 0.22522324968274013.
[I 2024-04-04 09:02:10,093] Trial 5 finished with value: 0.24498001849606782 and parameters: {'model_name': 'SimpleImputer', 'strategy': 'most_frequent'}. Best is trial 3 with value: 0.22522324968274013.
2024-04-04 09:02:11.034245: E external/local_xla/xla/stream_executor/cuda/cuda_driver.cc:274] failed call to cuInit: CUDA_ERROR_NO_DEVICE: no CUDA-capable device is detected
2024-04-04 09:02:11.309520: I tensorflow/compiler/mlir/mlir_graph_optimization_pass.cc:388] MLIR V1 optimization pass is not enabled
[I 2024-04-04 09:02:12,380] Trial 24 finished with value: 0.24498001849606782 and parameters: {'model_name': 'SimpleImputer', 'strategy': 'most_frequent'}. Best is trial 3 with value: 0.22522324968274013.
[I 2024-04-04 09:02:13,975] Trial 44 finished with value: 0.24498001849606782 and parameters: {'model_name': 'SimpleImputer', 'strategy': 'most_frequent'}. Best is trial 3 with value: 0.22522324968274013.
[I 2024-04-04 09:02:18,301] Trial 35 finished with value: 0.22491250208941788 and parameters: {'model_name': 'KNNImputer', 'weights': 'distance', 'keep_empty_features': False}. Best is trial 35 with value: 0.22491250208941788.
[I 2024-04-04 09:02:19,177] Trial 28 finished with value: 0.22491250208941788 and parameters: {'model_name': 'KNNImputer', 'weights': 'distance', 'keep_empty_features': False}. Best is trial 35 with value: 0.22491250208941788.
[I 2024-04-04 09:02:19,663] Trial 34 finished with value: 0.22491250208941788 and parameters: {'model_name': 'KNNImputer', 'weights': 'distance', 'keep_empty_features': False}. Best is trial 35 with value: 0.22491250208941788.
[I 2024-04-04 09:02:20,113] Trial 39 finished with value: 0.22491250208941788 and parameters: {'model_name': 'KNNImputer', 'weights': 'distance', 'keep_empty_features': False}. Best is trial 35 with value: 0.22491250208941788.
[I 2024-04-04 09:02:21,290] Trial 53 finished with value: 0.22512536381793186 and parameters: {'model_name': 'KNNImputer', 'weights': 'uniform', 'keep_empty_features': False}. Best is trial 35 with value: 0.22491250208941788.
[I 2024-04-04 09:02:22,246] Trial 38 finished with value: 0.22491250208941788 and parameters: {'model_name': 'KNNImputer', 'weights': 'distance', 'keep_empty_features': False}. Best is trial 35 with value: 0.22491250208941788.
[I 2024-04-04 09:02:23,488] Trial 55 finished with value: 0.22512536381793186 and parameters: {'model_name': 'KNNImputer', 'weights': 'uniform', 'keep_empty_features': False}. Best is trial 35 with value: 0.22491250208941788.
[I 2024-04-04 09:02:24,978] Trial 57 finished with value: 0.22512536381793186 and parameters: {'model_name': 'KNNImputer', 'weights': 'uniform', 'keep_empty_features': False}. Best is trial 35 with value: 0.22491250208941788.
[I 2024-04-04 09:02:27,333] Trial 59 finished with value: 0.22512536381793186 and parameters: {'model_name': 'KNNImputer', 'weights': 'uniform', 'keep_empty_features': False}. Best is trial 35 with value: 0.22491250208941788.
[I 2024-04-04 09:02:29,712] Trial 4 finished with value: 0.22522324968274013 and parameters: {'model_name': 'RandomForestImputer', 'max_iter': 1, 'decreasing': False, 'min_samples_split': 0.2, 'min_samples_leaf': 0.7000000000000001, 'max_features': 0.7000000000000001, 'warm_start': True}. Best is trial 35 with value: 0.22491250208941788.
[I 2024-04-04 09:02:31,415] Trial 43 finished with value: 0.22522324968274013 and parameters: {'model_name': 'RandomForestImputer', 'max_iter': 1, 'decreasing': True, 'min_samples_split': 0.5, 'min_samples_leaf': 0.30000000000000004, 'max_features': 0.6, 'warm_start': True}. Best is trial 35 with value: 0.22491250208941788.
[I 2024-04-04 09:02:32,157] Trial 60 finished with value: 0.22491250208941788 and parameters: {'model_name': 'KNNImputer', 'weights': 'distance', 'keep_empty_features': False}. Best is trial 35 with value: 0.22491250208941788.
[I 2024-04-04 09:02:32,870] Trial 62 finished with value: 0.22491250208941788 and parameters: {'model_name': 'KNNImputer', 'weights': 'distance', 'keep_empty_features': False}. Best is trial 35 with value: 0.22491250208941788.
[I 2024-04-04 09:02:33,837] Trial 61 finished with value: 0.22491250208941788 and parameters: {'model_name': 'KNNImputer', 'weights': 'distance', 'keep_empty_features': False}. Best is trial 35 with value: 0.22491250208941788.
[I 2024-04-04 09:02:34,642] Trial 18 finished with value: 0.22522324968274013 and parameters: {'model_name': 'RandomForestImputer', 'max_iter': 1, 'decreasing': True, 'min_samples_split': 0.9, 'min_samples_leaf': 0.4, 'max_features': 0.1, 'warm_start': True}. Best is trial 35 with value: 0.22491250208941788.
[I 2024-04-04 09:02:35,738] Trial 63 finished with value: 0.22491250208941788 and parameters: {'model_name': 'KNNImputer', 'weights': 'distance', 'keep_empty_features': False}. Best is trial 35 with value: 0.22491250208941788.
[I 2024-04-04 09:02:40,671] Trial 73 finished with value: inf and parameters: {'model_name': 'GAIN', 'batch_size': 807, 'hint_rate': 0.33, 'alpha': 75, 'iterations': 119}. Best is trial 35 with value: 0.22491250208941788.
[I 2024-04-04 09:03:17,568] Trial 66 finished with value: 0.3139966468825942 and parameters: {'model_name': 'GAIN', 'batch_size': 24, 'hint_rate': 0.44, 'alpha': 11, 'iterations': 1}. Best is trial 35 with value: 0.22491250208941788.
[I 2024-04-04 09:03:22,253] Trial 48 finished with value: 0.2973335841238964 and parameters: {'model_name': 'GAIN', 'batch_size': 430, 'hint_rate': 0.67, 'alpha': 77, 'iterations': 6}. Best is trial 35 with value: 0.22491250208941788.
[I 2024-04-04 09:03:25,532] Trial 58 finished with value: 0.2326711289246001 and parameters: {'model_name': 'RandomForestImputer', 'max_iter': 3, 'decreasing': True, 'min_samples_split': 0.4, 'min_samples_leaf': 0.2, 'max_features': 0.4, 'warm_start': True}. Best is trial 35 with value: 0.22491250208941788.
[I 2024-04-04 09:03:27,893] Trial 42 finished with value: 0.2326888622973525 and parameters: {'model_name': 'RandomForestImputer', 'max_iter': 4, 'decreasing': True, 'min_samples_split': 0.1, 'min_samples_leaf': 0.2, 'max_features': 0.7000000000000001, 'warm_start': True}. Best is trial 35 with value: 0.22491250208941788.
[I 2024-04-04 09:03:31,102] Trial 30 finished with value: 0.23275203727191282 and parameters: {'model_name': 'RandomForestImputer', 'max_iter': 5, 'decreasing': True, 'min_samples_split': 0.0, 'min_samples_leaf': 0.30000000000000004, 'max_features': 0.7000000000000001, 'warm_start': True}. Best is trial 35 with value: 0.22491250208941788.
[I 2024-04-04 09:03:34,943] Trial 1 finished with value: 0.23270300146668924 and parameters: {'model_name': 'RandomForestImputer', 'max_iter': 5, 'decreasing': True, 'min_samples_split': 0.30000000000000004, 'min_samples_leaf': 0.5, 'max_features': 0.9, 'warm_start': True}. Best is trial 35 with value: 0.22491250208941788.
[I 2024-04-04 09:03:51,920] Trial 2 finished with value: 0.23251529686581676 and parameters: {'model_name': 'RandomForestImputer', 'max_iter': 10, 'decreasing': True, 'min_samples_split': 0.1, 'min_samples_leaf': 0.6, 'max_features': 0.1, 'warm_start': True}. Best is trial 35 with value: 0.22491250208941788.
[I 2024-04-04 09:03:55,554] Trial 68 finished with value: 0.22522324968274013 and parameters: {'model_name': 'RandomForestImputer', 'max_iter': 1, 'decreasing': True, 'min_samples_split': 0.9, 'min_samples_leaf': 0.4, 'max_features': 0.9, 'warm_start': False}. Best is trial 35 with value: 0.22491250208941788.
[I 2024-04-04 09:03:57,936] Trial 6 finished with value: 0.22497043860390614 and parameters: {'model_name': 'IterativeImputer', 'sample_posterior': False, 'initial_strategy': 'median', 'imputation_order': 'roman'}. Best is trial 35 with value: 0.22491250208941788.
[I 2024-04-04 09:03:59,442] Trial 13 finished with value: 0.22497091691065804 and parameters: {'model_name': 'IterativeImputer', 'sample_posterior': False, 'initial_strategy': 'constant', 'imputation_order': 'ascending'}. Best is trial 35 with value: 0.22491250208941788.
[I 2024-04-04 09:04:01,564] Trial 54 finished with value: 0.22497091691065804 and parameters: {'model_name': 'IterativeImputer', 'sample_posterior': False, 'initial_strategy': 'median', 'imputation_order': 'ascending'}. Best is trial 35 with value: 0.22491250208941788.
[I 2024-04-04 09:04:03,540] Trial 47 finished with value: 0.22497067232026396 and parameters: {'model_name': 'IterativeImputer', 'sample_posterior': False, 'initial_strategy': 'mean', 'imputation_order': 'ascending'}. Best is trial 35 with value: 0.22491250208941788.
[I 2024-04-04 09:04:07,113] Trial 85 finished with value: 0.22491250208941788 and parameters: {'model_name': 'KNNImputer', 'weights': 'distance', 'keep_empty_features': False}. Best is trial 35 with value: 0.22491250208941788.
[I 2024-04-04 09:04:08,903] Trial 86 finished with value: 0.22491250208941788 and parameters: {'model_name': 'KNNImputer', 'weights': 'distance', 'keep_empty_features': False}. Best is trial 35 with value: 0.22491250208941788.
[I 2024-04-04 09:04:10,838] Trial 87 finished with value: 0.22491250208941788 and parameters: {'model_name': 'KNNImputer', 'weights': 'distance', 'keep_empty_features': False}. Best is trial 35 with value: 0.22491250208941788.
[I 2024-04-04 09:04:12,602] Trial 88 finished with value: 0.22491250208941788 and parameters: {'model_name': 'KNNImputer', 'weights': 'distance', 'keep_empty_features': False}. Best is trial 35 with value: 0.22491250208941788.
[I 2024-04-04 09:04:13,567] Trial 46 finished with value: 0.2249709365285323 and parameters: {'model_name': 'IterativeImputer', 'sample_posterior': False, 'initial_strategy': 'mean', 'imputation_order': 'random'}. Best is trial 35 with value: 0.22491250208941788.
[I 2024-04-04 09:04:16,918] Trial 89 finished with value: 0.22491250208941788 and parameters: {'model_name': 'KNNImputer', 'weights': 'distance', 'keep_empty_features': False}. Best is trial 35 with value: 0.22491250208941788.
[I 2024-04-04 09:04:19,023] Trial 90 finished with value: 0.22491250208941788 and parameters: {'model_name': 'KNNImputer', 'weights': 'distance', 'keep_empty_features': False}. Best is trial 35 with value: 0.22491250208941788.
[I 2024-04-04 09:04:20,605] Trial 91 finished with value: 0.22491250208941788 and parameters: {'model_name': 'KNNImputer', 'weights': 'distance', 'keep_empty_features': False}. Best is trial 35 with value: 0.22491250208941788.
[I 2024-04-04 09:04:22,230] Trial 65 finished with value: 0.22497346924834805 and parameters: {'model_name': 'IterativeImputer', 'sample_posterior': False, 'initial_strategy': 'most_frequent', 'imputation_order': 'random'}. Best is trial 35 with value: 0.22491250208941788.
[I 2024-04-04 09:04:23,276] Trial 92 finished with value: 0.22491250208941788 and parameters: {'model_name': 'KNNImputer', 'weights': 'distance', 'keep_empty_features': False}. Best is trial 35 with value: 0.22491250208941788.
[I 2024-04-04 09:04:24,275] Trial 93 finished with value: 0.22491250208941788 and parameters: {'model_name': 'KNNImputer', 'weights': 'distance', 'keep_empty_features': False}. Best is trial 35 with value: 0.22491250208941788.
[I 2024-04-04 09:04:27,490] Trial 94 finished with value: 0.22491250208941788 and parameters: {'model_name': 'KNNImputer', 'weights': 'distance', 'keep_empty_features': False}. Best is trial 35 with value: 0.22491250208941788.
[I 2024-04-04 09:04:29,365] Trial 95 finished with value: 0.22491250208941788 and parameters: {'model_name': 'KNNImputer', 'weights': 'distance', 'keep_empty_features': False}. Best is trial 35 with value: 0.22491250208941788.
[I 2024-04-04 09:04:31,226] Trial 96 finished with value: 0.22491250208941788 and parameters: {'model_name': 'KNNImputer', 'weights': 'distance', 'keep_empty_features': False}. Best is trial 35 with value: 0.22491250208941788.
[I 2024-04-04 09:04:32,009] Trial 76 finished with value: 0.22497091691065804 and parameters: {'model_name': 'IterativeImputer', 'sample_posterior': False, 'initial_strategy': 'constant', 'imputation_order': 'ascending'}. Best is trial 35 with value: 0.22491250208941788.
[I 2024-04-04 09:04:33,611] Trial 98 finished with value: 0.22491250208941788 and parameters: {'model_name': 'KNNImputer', 'weights': 'distance', 'keep_empty_features': False}. Best is trial 35 with value: 0.22491250208941788.
[I 2024-04-04 09:04:34,239] Trial 97 finished with value: 0.22491250208941788 and parameters: {'model_name': 'KNNImputer', 'weights': 'distance', 'keep_empty_features': False}. Best is trial 35 with value: 0.22491250208941788.
[I 2024-04-04 09:04:35,724] Trial 99 finished with value: 0.22491250208941788 and parameters: {'model_name': 'KNNImputer', 'weights': 'distance', 'keep_empty_features': False}. Best is trial 35 with value: 0.22491250208941788.
[I 2024-04-04 09:04:39,066] Trial 100 finished with value: 0.22491250208941788 and parameters: {'model_name': 'KNNImputer', 'weights': 'distance', 'keep_empty_features': False}. Best is trial 35 with value: 0.22491250208941788.
[I 2024-04-04 09:04:41,387] Trial 101 finished with value: 0.22491250208941788 and parameters: {'model_name': 'KNNImputer', 'weights': 'distance', 'keep_empty_features': False}. Best is trial 35 with value: 0.22491250208941788.
[I 2024-04-04 09:04:42,383] Trial 102 finished with value: 0.22491250208941788 and parameters: {'model_name': 'KNNImputer', 'weights': 'distance', 'keep_empty_features': False}. Best is trial 35 with value: 0.22491250208941788.
[I 2024-04-04 09:04:43,600] Trial 103 finished with value: 0.22491250208941788 and parameters: {'model_name': 'KNNImputer', 'weights': 'distance', 'keep_empty_features': False}. Best is trial 35 with value: 0.22491250208941788.
[I 2024-04-04 09:04:45,320] Trial 104 finished with value: 0.22491250208941788 and parameters: {'model_name': 'KNNImputer', 'weights': 'distance', 'keep_empty_features': False}. Best is trial 35 with value: 0.22491250208941788.
[I 2024-04-04 09:04:46,190] Trial 105 finished with value: 0.22491250208941788 and parameters: {'model_name': 'KNNImputer', 'weights': 'distance', 'keep_empty_features': False}. Best is trial 35 with value: 0.22491250208941788.
[I 2024-04-04 09:04:50,667] Trial 109 finished with value: 0.22491250208941788 and parameters: {'model_name': 'KNNImputer', 'weights': 'distance', 'keep_empty_features': False}. Best is trial 35 with value: 0.22491250208941788.
[I 2024-04-04 09:04:51,572] Trial 108 finished with value: 0.22491250208941788 and parameters: {'model_name': 'KNNImputer', 'weights': 'distance', 'keep_empty_features': False}. Best is trial 35 with value: 0.22491250208941788.
[I 2024-04-04 09:04:57,578] Trial 72 finished with value: 0.22861257436785087 and parameters: {'model_name': 'GAIN', 'batch_size': 26, 'hint_rate': 0.51, 'alpha': 41, 'iterations': 36}. Best is trial 35 with value: 0.22491250208941788.
[I 2024-04-04 09:05:02,665] Trial 115 finished with value: 0.22512536381793186 and parameters: {'model_name': 'KNNImputer', 'weights': 'uniform', 'keep_empty_features': False}. Best is trial 35 with value: 0.22491250208941788.
[I 2024-04-04 09:05:08,048] Trial 22 finished with value: 0.23240046001481604 and parameters: {'model_name': 'RandomForestImputer', 'max_iter': 17, 'decreasing': True, 'min_samples_split': 0.0, 'min_samples_leaf': 0.4, 'max_features': 0.5, 'warm_start': True}. Best is trial 35 with value: 0.22491250208941788.
[I 2024-04-04 09:05:09,079] Trial 116 finished with value: 0.22512536381793186 and parameters: {'model_name': 'KNNImputer', 'weights': 'uniform', 'keep_empty_features': False}. Best is trial 35 with value: 0.22491250208941788.
[I 2024-04-04 09:05:14,489] Trial 117 finished with value: 0.22512536381793186 and parameters: {'model_name': 'KNNImputer', 'weights': 'uniform', 'keep_empty_features': False}. Best is trial 35 with value: 0.22491250208941788.
[I 2024-04-04 09:05:15,413] Trial 118 finished with value: 0.22491250208941788 and parameters: {'model_name': 'KNNImputer', 'weights': 'distance', 'keep_empty_features': False}. Best is trial 35 with value: 0.22491250208941788.
[I 2024-04-04 09:05:20,897] Trial 119 finished with value: 0.22491250208941788 and parameters: {'model_name': 'KNNImputer', 'weights': 'distance', 'keep_empty_features': False}. Best is trial 35 with value: 0.22491250208941788.
[I 2024-04-04 09:05:21,828] Trial 120 finished with value: 0.22491250208941788 and parameters: {'model_name': 'KNNImputer', 'weights': 'distance', 'keep_empty_features': False}. Best is trial 35 with value: 0.22491250208941788.
[I 2024-04-04 09:05:26,295] Trial 78 finished with value: 0.22497041661147194 and parameters: {'model_name': 'IterativeImputer', 'sample_posterior': False, 'initial_strategy': 'constant', 'imputation_order': 'descending'}. Best is trial 35 with value: 0.22491250208941788.
[I 2024-04-04 09:06:00,158] Trial 64 finished with value: 0.22505245766276363 and parameters: {'model_name': 'RandomForestImputer', 'max_iter': 2, 'decreasing': True, 'min_samples_split': 0.4, 'min_samples_leaf': 0.6, 'max_features': 0.5, 'warm_start': False}. Best is trial 35 with value: 0.22491250208941788.
[I 2024-04-04 09:06:03,443] Trial 29 finished with value: 0.23283286100089642 and parameters: {'model_name': 'RandomForestImputer', 'max_iter': 34, 'decreasing': True, 'min_samples_split': 0.6000000000000001, 'min_samples_leaf': 0.30000000000000004, 'max_features': 0.9, 'warm_start': True}. Best is trial 35 with value: 0.22491250208941788.
[I 2024-04-04 09:07:28,141] Trial 32 finished with value: 0.23638528216926963 and parameters: {'model_name': 'GAIN', 'batch_size': 40, 'hint_rate': 0.45, 'alpha': 64, 'iterations': 146}. Best is trial 35 with value: 0.22491250208941788.
[I 2024-04-04 09:07:43,264] Trial 36 finished with value: 0.23235551657196432 and parameters: {'model_name': 'GAIN', 'batch_size': 4, 'hint_rate': 0.27, 'alpha': 51, 'iterations': 179}. Best is trial 35 with value: 0.22491250208941788.
[I 2024-04-04 09:07:48,010] Trial 127 finished with value: 0.22491250208941788 and parameters: {'model_name': 'KNNImputer', 'weights': 'distance', 'keep_empty_features': False}. Best is trial 35 with value: 0.22491250208941788.
[I 2024-04-04 09:07:52,353] Trial 128 finished with value: 0.22491250208941788 and parameters: {'model_name': 'KNNImputer', 'weights': 'distance', 'keep_empty_features': False}. Best is trial 35 with value: 0.22491250208941788.
[I 2024-04-04 09:07:56,404] Trial 129 finished with value: 0.22491250208941788 and parameters: {'model_name': 'KNNImputer', 'weights': 'distance', 'keep_empty_features': False}. Best is trial 35 with value: 0.22491250208941788.
[I 2024-04-04 09:08:00,507] Trial 130 finished with value: 0.22491250208941788 and parameters: {'model_name': 'KNNImputer', 'weights': 'distance', 'keep_empty_features': False}. Best is trial 35 with value: 0.22491250208941788.
[I 2024-04-04 09:08:05,445] Trial 131 finished with value: 0.22491250208941788 and parameters: {'model_name': 'KNNImputer', 'weights': 'distance', 'keep_empty_features': False}. Best is trial 35 with value: 0.22491250208941788.
[I 2024-04-04 09:08:06,804] Trial 132 finished with value: 0.24498001849606782 and parameters: {'model_name': 'SimpleImputer', 'strategy': 'median'}. Best is trial 35 with value: 0.22491250208941788.
[I 2024-04-04 09:08:07,609] Trial 0 finished with value: 0.22432439804144194 and parameters: {'model_name': 'RandomForestImputer', 'max_iter': 5, 'decreasing': True, 'min_samples_split': 0.9, 'min_samples_leaf': 0.6, 'max_features': 0.30000000000000004, 'warm_start': False}. Best is trial 0 with value: 0.22432439804144194.
[I 2024-04-04 09:08:12,626] Trial 49 finished with value: 0.2250294270035663 and parameters: {'model_name': 'RandomForestImputer', 'max_iter': 4, 'decreasing': False, 'min_samples_split': 0.9, 'min_samples_leaf': 0.7000000000000001, 'max_features': 0.9, 'warm_start': False}. Best is trial 0 with value: 0.22432439804144194.
[I 2024-04-04 09:08:46,323] Trial 25 finished with value: 0.22493533857023343 and parameters: {'model_name': 'RandomForestImputer', 'max_iter': 5, 'decreasing': True, 'min_samples_split': 0.2, 'min_samples_leaf': 0.4, 'max_features': 0.8, 'warm_start': False}. Best is trial 0 with value: 0.22432439804144194.
