[I 2023-12-19 14:17:28,095] Trial 112 finished with value: 0.2790821731842267 and parameters: {'model_name': 'SimpleImputer', 'strategy': 'mean'}. Best is trial 12 with value: 0.2790821731842267.
[I 2023-12-19 14:17:28,269] Trial 109 finished with value: 0.2790821731842267 and parameters: {'model_name': 'SimpleImputer', 'strategy': 'mean'}. Best is trial 12 with value: 0.2790821731842267.
[I 2023-12-19 14:17:28,580] Trial 78 finished with value: 0.3469649433415743 and parameters: {'model_name': 'SimpleImputer', 'strategy': 'most_frequent'}. Best is trial 12 with value: 0.2790821731842267.
[I 2023-12-19 14:17:28,783] Trial 72 finished with value: 0.3469649433415743 and parameters: {'model_name': 'SimpleImputer', 'strategy': 'most_frequent'}. Best is trial 12 with value: 0.2790821731842267.
[I 2023-12-19 14:17:29,320] Trial 110 finished with value: 0.2790821731842267 and parameters: {'model_name': 'SimpleImputer', 'strategy': 'mean'}. Best is trial 12 with value: 0.2790821731842267.
[I 2023-12-19 14:17:29,806] Trial 115 finished with value: 0.2790821731842267 and parameters: {'model_name': 'SimpleImputer', 'strategy': 'mean'}. Best is trial 12 with value: 0.2790821731842267.
[I 2023-12-19 14:17:30,000] Trial 113 finished with value: 0.2790821731842267 and parameters: {'model_name': 'SimpleImputer', 'strategy': 'mean'}. Best is trial 12 with value: 0.2790821731842267.
[I 2023-12-19 14:17:30,173] Trial 87 finished with value: 0.3469649433415743 and parameters: {'model_name': 'SimpleImputer', 'strategy': 'most_frequent'}. Best is trial 12 with value: 0.2790821731842267.
[I 2023-12-19 14:17:30,444] Trial 111 finished with value: 0.2790821731842267 and parameters: {'model_name': 'SimpleImputer', 'strategy': 'mean'}. Best is trial 12 with value: 0.2790821731842267.
[I 2023-12-19 14:17:30,668] Trial 114 finished with value: 0.2790821731842267 and parameters: {'model_name': 'SimpleImputer', 'strategy': 'mean'}. Best is trial 12 with value: 0.2790821731842267.
[I 2023-12-19 14:17:30,907] Trial 119 finished with value: 0.2790821731842267 and parameters: {'model_name': 'SimpleImputer', 'strategy': 'mean'}. Best is trial 12 with value: 0.2790821731842267.
[I 2023-12-19 14:17:31,077] Trial 73 finished with value: 0.3469649433415743 and parameters: {'model_name': 'SimpleImputer', 'strategy': 'most_frequent'}. Best is trial 12 with value: 0.2790821731842267.
[I 2023-12-19 14:17:31,316] Trial 118 finished with value: 0.2790821731842267 and parameters: {'model_name': 'SimpleImputer', 'strategy': 'mean'}. Best is trial 12 with value: 0.2790821731842267.
[I 2023-12-19 14:17:31,783] Trial 116 finished with value: 0.2790821731842267 and parameters: {'model_name': 'SimpleImputer', 'strategy': 'mean'}. Best is trial 12 with value: 0.2790821731842267.
[I 2023-12-19 14:17:32,032] Trial 120 finished with value: 0.2790821731842267 and parameters: {'model_name': 'SimpleImputer', 'strategy': 'mean'}. Best is trial 12 with value: 0.2790821731842267.
[I 2023-12-19 14:17:32,345] Trial 117 finished with value: 0.2790821731842267 and parameters: {'model_name': 'SimpleImputer', 'strategy': 'mean'}. Best is trial 12 with value: 0.2790821731842267.
[I 2023-12-19 14:17:32,768] Trial 90 finished with value: 0.3469649433415743 and parameters: {'model_name': 'SimpleImputer', 'strategy': 'most_frequent'}. Best is trial 12 with value: 0.2790821731842267.
[I 2023-12-19 14:17:33,014] Trial 122 finished with value: 0.2790821731842267 and parameters: {'model_name': 'SimpleImputer', 'strategy': 'mean'}. Best is trial 12 with value: 0.2790821731842267.
[I 2023-12-19 14:17:33,262] Trial 126 finished with value: 0.2790821731842267 and parameters: {'model_name': 'SimpleImputer', 'strategy': 'mean'}. Best is trial 12 with value: 0.2790821731842267.
[I 2023-12-19 14:17:33,571] Trial 123 finished with value: 0.2790821731842267 and parameters: {'model_name': 'SimpleImputer', 'strategy': 'mean'}. Best is trial 12 with value: 0.2790821731842267.
[I 2023-12-19 14:17:33,809] Trial 125 finished with value: 0.2790821731842267 and parameters: {'model_name': 'SimpleImputer', 'strategy': 'mean'}. Best is trial 12 with value: 0.2790821731842267.
[I 2023-12-19 14:17:34,051] Trial 121 finished with value: 0.2790821731842267 and parameters: {'model_name': 'SimpleImputer', 'strategy': 'mean'}. Best is trial 12 with value: 0.2790821731842267.
[I 2023-12-19 14:17:34,323] Trial 129 finished with value: 0.2790821731842267 and parameters: {'model_name': 'SimpleImputer', 'strategy': 'mean'}. Best is trial 12 with value: 0.2790821731842267.
[I 2023-12-19 14:17:34,729] Trial 124 finished with value: 0.2790821731842267 and parameters: {'model_name': 'SimpleImputer', 'strategy': 'mean'}. Best is trial 12 with value: 0.2790821731842267.
[I 2023-12-19 14:17:35,120] Trial 132 finished with value: 0.2790821731842267 and parameters: {'model_name': 'SimpleImputer', 'strategy': 'mean'}. Best is trial 12 with value: 0.2790821731842267.
[I 2023-12-19 14:17:35,378] Trial 93 finished with value: 0.3469649433415743 and parameters: {'model_name': 'SimpleImputer', 'strategy': 'most_frequent'}. Best is trial 12 with value: 0.2790821731842267.
[I 2023-12-19 14:17:35,578] Trial 130 finished with value: 0.2790821731842267 and parameters: {'model_name': 'SimpleImputer', 'strategy': 'mean'}. Best is trial 12 with value: 0.2790821731842267.
[I 2023-12-19 14:17:35,827] Trial 133 finished with value: 0.2790821731842267 and parameters: {'model_name': 'SimpleImputer', 'strategy': 'mean'}. Best is trial 12 with value: 0.2790821731842267.
[I 2023-12-19 14:17:36,193] Trial 139 finished with value: 0.2790821731842267 and parameters: {'model_name': 'SimpleImputer', 'strategy': 'mean'}. Best is trial 12 with value: 0.2790821731842267.
[I 2023-12-19 14:17:36,400] Trial 127 finished with value: 0.2790821731842267 and parameters: {'model_name': 'SimpleImputer', 'strategy': 'mean'}. Best is trial 12 with value: 0.2790821731842267.
[I 2023-12-19 14:17:36,609] Trial 128 finished with value: 0.2790821731842267 and parameters: {'model_name': 'SimpleImputer', 'strategy': 'mean'}. Best is trial 12 with value: 0.2790821731842267.
[I 2023-12-19 14:17:36,811] Trial 131 finished with value: 0.2790821731842267 and parameters: {'model_name': 'SimpleImputer', 'strategy': 'mean'}. Best is trial 12 with value: 0.2790821731842267.
[I 2023-12-19 14:17:37,095] Trial 140 finished with value: 0.2790821731842267 and parameters: {'model_name': 'SimpleImputer', 'strategy': 'mean'}. Best is trial 12 with value: 0.2790821731842267.
[I 2023-12-19 14:17:37,330] Trial 138 finished with value: 0.2790821731842267 and parameters: {'model_name': 'SimpleImputer', 'strategy': 'mean'}. Best is trial 12 with value: 0.2790821731842267.
[I 2023-12-19 14:17:37,565] Trial 91 finished with value: 0.3469649433415743 and parameters: {'model_name': 'SimpleImputer', 'strategy': 'most_frequent'}. Best is trial 12 with value: 0.2790821731842267.
[I 2023-12-19 14:17:37,770] Trial 136 finished with value: 0.2790821731842267 and parameters: {'model_name': 'SimpleImputer', 'strategy': 'mean'}. Best is trial 12 with value: 0.2790821731842267.
[I 2023-12-19 14:17:38,015] Trial 137 finished with value: 0.2790821731842267 and parameters: {'model_name': 'SimpleImputer', 'strategy': 'mean'}. Best is trial 12 with value: 0.2790821731842267.
[I 2023-12-19 14:17:38,286] Trial 134 finished with value: 0.2790821731842267 and parameters: {'model_name': 'SimpleImputer', 'strategy': 'mean'}. Best is trial 12 with value: 0.2790821731842267.
[I 2023-12-19 14:17:38,508] Trial 135 finished with value: 0.2790821731842267 and parameters: {'model_name': 'SimpleImputer', 'strategy': 'mean'}. Best is trial 12 with value: 0.2790821731842267.
[I 2023-12-19 14:17:38,772] Trial 141 finished with value: 0.2790821731842267 and parameters: {'model_name': 'SimpleImputer', 'strategy': 'mean'}. Best is trial 12 with value: 0.2790821731842267.
[I 2023-12-19 14:17:39,010] Trial 143 finished with value: 0.2790821731842267 and parameters: {'model_name': 'SimpleImputer', 'strategy': 'mean'}. Best is trial 12 with value: 0.2790821731842267.
[I 2023-12-19 14:17:39,238] Trial 144 finished with value: 0.2790821731842267 and parameters: {'model_name': 'SimpleImputer', 'strategy': 'mean'}. Best is trial 12 with value: 0.2790821731842267.
[I 2023-12-19 14:17:39,486] Trial 92 finished with value: 0.3469649433415743 and parameters: {'model_name': 'SimpleImputer', 'strategy': 'most_frequent'}. Best is trial 12 with value: 0.2790821731842267.
[I 2023-12-19 14:17:39,737] Trial 142 finished with value: 0.2790821731842267 and parameters: {'model_name': 'SimpleImputer', 'strategy': 'mean'}. Best is trial 12 with value: 0.2790821731842267.
[I 2023-12-19 14:17:40,054] Trial 95 finished with value: 0.3469649433415743 and parameters: {'model_name': 'SimpleImputer', 'strategy': 'most_frequent'}. Best is trial 12 with value: 0.2790821731842267.
[I 2023-12-19 14:17:40,494] Trial 94 finished with value: 0.3469649433415743 and parameters: {'model_name': 'SimpleImputer', 'strategy': 'most_frequent'}. Best is trial 12 with value: 0.2790821731842267.
[I 2023-12-19 14:17:40,763] Trial 147 finished with value: 0.2790821731842267 and parameters: {'model_name': 'SimpleImputer', 'strategy': 'mean'}. Best is trial 12 with value: 0.2790821731842267.
[I 2023-12-19 14:17:40,977] Trial 148 finished with value: 0.2790821731842267 and parameters: {'model_name': 'SimpleImputer', 'strategy': 'mean'}. Best is trial 12 with value: 0.2790821731842267.
[I 2023-12-19 14:17:41,233] Trial 146 finished with value: 0.2790821731842267 and parameters: {'model_name': 'SimpleImputer', 'strategy': 'mean'}. Best is trial 12 with value: 0.2790821731842267.
[I 2023-12-19 14:17:41,543] Trial 149 finished with value: 0.2790821731842267 and parameters: {'model_name': 'SimpleImputer', 'strategy': 'mean'}. Best is trial 12 with value: 0.2790821731842267.
[I 2023-12-19 14:17:41,846] Trial 150 finished with value: 0.2790821731842267 and parameters: {'model_name': 'SimpleImputer', 'strategy': 'mean'}. Best is trial 12 with value: 0.2790821731842267.
[I 2023-12-19 14:17:42,131] Trial 145 finished with value: 0.2790821731842267 and parameters: {'model_name': 'SimpleImputer', 'strategy': 'mean'}. Best is trial 12 with value: 0.2790821731842267.
[I 2023-12-19 14:17:42,365] Trial 151 finished with value: 0.2790821731842267 and parameters: {'model_name': 'SimpleImputer', 'strategy': 'mean'}. Best is trial 12 with value: 0.2790821731842267.
[I 2023-12-19 14:17:42,592] Trial 154 finished with value: 0.2790821731842267 and parameters: {'model_name': 'SimpleImputer', 'strategy': 'mean'}. Best is trial 12 with value: 0.2790821731842267.
[I 2023-12-19 14:17:42,862] Trial 155 finished with value: 0.2790821731842267 and parameters: {'model_name': 'SimpleImputer', 'strategy': 'mean'}. Best is trial 12 with value: 0.2790821731842267.
[I 2023-12-19 14:17:43,319] Trial 153 finished with value: 0.2790821731842267 and parameters: {'model_name': 'SimpleImputer', 'strategy': 'mean'}. Best is trial 12 with value: 0.2790821731842267.
[I 2023-12-19 14:17:43,550] Trial 157 finished with value: 0.2790821731842267 and parameters: {'model_name': 'SimpleImputer', 'strategy': 'mean'}. Best is trial 12 with value: 0.2790821731842267.
[I 2023-12-19 14:17:43,766] Trial 159 finished with value: 0.2790821731842267 and parameters: {'model_name': 'SimpleImputer', 'strategy': 'mean'}. Best is trial 12 with value: 0.2790821731842267.
[I 2023-12-19 14:17:43,973] Trial 156 finished with value: 0.2790821731842267 and parameters: {'model_name': 'SimpleImputer', 'strategy': 'mean'}. Best is trial 12 with value: 0.2790821731842267.
[I 2023-12-19 14:17:44,183] Trial 160 finished with value: 0.2790821731842267 and parameters: {'model_name': 'SimpleImputer', 'strategy': 'mean'}. Best is trial 12 with value: 0.2790821731842267.
[I 2023-12-19 14:17:44,196] Trial 152 finished with value: 0.2790821731842267 and parameters: {'model_name': 'SimpleImputer', 'strategy': 'mean'}. Best is trial 12 with value: 0.2790821731842267.
[I 2023-12-19 14:17:44,862] Trial 158 finished with value: 0.2790821731842267 and parameters: {'model_name': 'SimpleImputer', 'strategy': 'mean'}. Best is trial 12 with value: 0.2790821731842267.
[I 2023-12-19 14:17:45,105] Trial 161 finished with value: 0.2790821731842267 and parameters: {'model_name': 'SimpleImputer', 'strategy': 'mean'}. Best is trial 12 with value: 0.2790821731842267.
[I 2023-12-19 14:17:45,414] Trial 162 finished with value: 0.2790821731842267 and parameters: {'model_name': 'SimpleImputer', 'strategy': 'mean'}. Best is trial 12 with value: 0.2790821731842267.
[I 2023-12-19 14:17:45,746] Trial 166 finished with value: 0.2790821731842267 and parameters: {'model_name': 'SimpleImputer', 'strategy': 'mean'}. Best is trial 12 with value: 0.2790821731842267.
[I 2023-12-19 14:17:46,075] Trial 167 finished with value: 0.2790821731842267 and parameters: {'model_name': 'SimpleImputer', 'strategy': 'mean'}. Best is trial 12 with value: 0.2790821731842267.
[I 2023-12-19 14:17:46,336] Trial 165 finished with value: 0.2790821731842267 and parameters: {'model_name': 'SimpleImputer', 'strategy': 'mean'}. Best is trial 12 with value: 0.2790821731842267.
[I 2023-12-19 14:17:46,603] Trial 164 finished with value: 0.2790821731842267 and parameters: {'model_name': 'SimpleImputer', 'strategy': 'mean'}. Best is trial 12 with value: 0.2790821731842267.
[I 2023-12-19 14:17:46,842] Trial 172 finished with value: 0.2790821731842267 and parameters: {'model_name': 'SimpleImputer', 'strategy': 'mean'}. Best is trial 12 with value: 0.2790821731842267.
[I 2023-12-19 14:17:47,062] Trial 170 finished with value: 0.2790821731842267 and parameters: {'model_name': 'SimpleImputer', 'strategy': 'mean'}. Best is trial 12 with value: 0.2790821731842267.
[I 2023-12-19 14:17:47,366] Trial 175 finished with value: 0.2790821731842267 and parameters: {'model_name': 'SimpleImputer', 'strategy': 'mean'}. Best is trial 12 with value: 0.2790821731842267.
[I 2023-12-19 14:17:47,599] Trial 169 finished with value: 0.2790821731842267 and parameters: {'model_name': 'SimpleImputer', 'strategy': 'mean'}. Best is trial 12 with value: 0.2790821731842267.
[I 2023-12-19 14:17:47,808] Trial 174 finished with value: 0.2790821731842267 and parameters: {'model_name': 'SimpleImputer', 'strategy': 'mean'}. Best is trial 12 with value: 0.2790821731842267.
[I 2023-12-19 14:17:48,029] Trial 171 finished with value: 0.2790821731842267 and parameters: {'model_name': 'SimpleImputer', 'strategy': 'mean'}. Best is trial 12 with value: 0.2790821731842267.
[I 2023-12-19 14:17:48,247] Trial 163 finished with value: 0.2790821731842267 and parameters: {'model_name': 'SimpleImputer', 'strategy': 'mean'}. Best is trial 12 with value: 0.2790821731842267.
[I 2023-12-19 14:17:48,470] Trial 188 finished with value: 0.2790821731842267 and parameters: {'model_name': 'SimpleImputer', 'strategy': 'mean'}. Best is trial 12 with value: 0.2790821731842267.
[I 2023-12-19 14:17:48,663] Trial 179 finished with value: 0.2790821731842267 and parameters: {'model_name': 'SimpleImputer', 'strategy': 'mean'}. Best is trial 12 with value: 0.2790821731842267.
[I 2023-12-19 14:17:48,927] Trial 177 finished with value: 0.2790821731842267 and parameters: {'model_name': 'SimpleImputer', 'strategy': 'mean'}. Best is trial 12 with value: 0.2790821731842267.
[I 2023-12-19 14:17:49,139] Trial 196 finished with value: 0.3007224316517857 and parameters: {'model_name': 'SimpleImputer', 'strategy': 'constant'}. Best is trial 12 with value: 0.2790821731842267.
[I 2023-12-19 14:17:49,342] Trial 183 finished with value: 0.2790821731842267 and parameters: {'model_name': 'SimpleImputer', 'strategy': 'mean'}. Best is trial 12 with value: 0.2790821731842267.
[I 2023-12-19 14:17:49,568] Trial 168 finished with value: 0.2790821731842267 and parameters: {'model_name': 'SimpleImputer', 'strategy': 'mean'}. Best is trial 12 with value: 0.2790821731842267.
[I 2023-12-19 14:17:49,799] Trial 181 finished with value: 0.2790821731842267 and parameters: {'model_name': 'SimpleImputer', 'strategy': 'mean'}. Best is trial 12 with value: 0.2790821731842267.
[I 2023-12-19 14:17:50,022] Trial 176 finished with value: 0.2790821731842267 and parameters: {'model_name': 'SimpleImputer', 'strategy': 'mean'}. Best is trial 12 with value: 0.2790821731842267.
[I 2023-12-19 14:17:50,234] Trial 195 finished with value: 0.3007224316517857 and parameters: {'model_name': 'SimpleImputer', 'strategy': 'constant'}. Best is trial 12 with value: 0.2790821731842267.
[I 2023-12-19 14:17:50,476] Trial 178 finished with value: 0.2790821731842267 and parameters: {'model_name': 'SimpleImputer', 'strategy': 'mean'}. Best is trial 12 with value: 0.2790821731842267.
[I 2023-12-19 14:17:50,700] Trial 180 finished with value: 0.2790821731842267 and parameters: {'model_name': 'SimpleImputer', 'strategy': 'mean'}. Best is trial 12 with value: 0.2790821731842267.
[I 2023-12-19 14:17:50,896] Trial 173 finished with value: 0.2790821731842267 and parameters: {'model_name': 'SimpleImputer', 'strategy': 'mean'}. Best is trial 12 with value: 0.2790821731842267.
[I 2023-12-19 14:17:51,170] Trial 184 finished with value: 0.2790821731842267 and parameters: {'model_name': 'SimpleImputer', 'strategy': 'mean'}. Best is trial 12 with value: 0.2790821731842267.
[I 2023-12-19 14:17:51,400] Trial 182 finished with value: 0.2790821731842267 and parameters: {'model_name': 'SimpleImputer', 'strategy': 'mean'}. Best is trial 12 with value: 0.2790821731842267.
[I 2023-12-19 14:17:51,652] Trial 185 finished with value: 0.2790821731842267 and parameters: {'model_name': 'SimpleImputer', 'strategy': 'mean'}. Best is trial 12 with value: 0.2790821731842267.
[I 2023-12-19 14:17:51,874] Trial 194 finished with value: 0.2790821731842267 and parameters: {'model_name': 'SimpleImputer', 'strategy': 'mean'}. Best is trial 12 with value: 0.2790821731842267.
[I 2023-12-19 14:17:52,072] Trial 191 finished with value: 0.2790821731842267 and parameters: {'model_name': 'SimpleImputer', 'strategy': 'mean'}. Best is trial 12 with value: 0.2790821731842267.
[I 2023-12-19 14:17:52,288] Trial 187 finished with value: 0.2790821731842267 and parameters: {'model_name': 'SimpleImputer', 'strategy': 'mean'}. Best is trial 12 with value: 0.2790821731842267.
[I 2023-12-19 14:17:52,484] Trial 197 finished with value: 0.2790821731842267 and parameters: {'model_name': 'SimpleImputer', 'strategy': 'mean'}. Best is trial 12 with value: 0.2790821731842267.
[I 2023-12-19 14:17:52,671] Trial 186 finished with value: 0.2790821731842267 and parameters: {'model_name': 'SimpleImputer', 'strategy': 'mean'}. Best is trial 12 with value: 0.2790821731842267.
[I 2023-12-19 14:17:52,880] Trial 199 finished with value: 0.2790821731842267 and parameters: {'model_name': 'SimpleImputer', 'strategy': 'mean'}. Best is trial 12 with value: 0.2790821731842267.
[I 2023-12-19 14:17:53,109] Trial 198 finished with value: 0.2790821731842267 and parameters: {'model_name': 'SimpleImputer', 'strategy': 'mean'}. Best is trial 12 with value: 0.2790821731842267.
[I 2023-12-19 14:17:53,310] Trial 190 finished with value: 0.2790821731842267 and parameters: {'model_name': 'SimpleImputer', 'strategy': 'mean'}. Best is trial 12 with value: 0.2790821731842267.
[I 2023-12-19 14:17:53,522] Trial 193 finished with value: 0.2790821731842267 and parameters: {'model_name': 'SimpleImputer', 'strategy': 'mean'}. Best is trial 12 with value: 0.2790821731842267.
[I 2023-12-19 14:17:53,717] Trial 189 finished with value: 0.2790821731842267 and parameters: {'model_name': 'SimpleImputer', 'strategy': 'mean'}. Best is trial 12 with value: 0.2790821731842267.
[I 2023-12-19 14:17:53,908] Trial 192 finished with value: 0.2790821731842267 and parameters: {'model_name': 'SimpleImputer', 'strategy': 'mean'}. Best is trial 12 with value: 0.2790821731842267.
[I 2023-12-19 14:17:54,115] Trial 96 finished with value: 0.3469649433415743 and parameters: {'model_name': 'SimpleImputer', 'strategy': 'most_frequent'}. Best is trial 12 with value: 0.2790821731842267.
