[I 2024-04-04 09:08:55,824] Trial 11 finished with value: 0.22477474261808145 and parameters: {'model_name': 'RandomForestImputer', 'max_iter': 5, 'decreasing': True, 'min_samples_split': 0.6000000000000001, 'min_samples_leaf': 0.6, 'max_features': 0.5, 'warm_start': False}. Best is trial 0 with value: 0.22432439804144194.
[I 2024-04-04 09:09:35,892] Trial 26 finished with value: 0.24158293382348472 and parameters: {'model_name': 'IterativeImputer', 'sample_posterior': True, 'initial_strategy': 'most_frequent', 'imputation_order': 'arabic'}. Best is trial 0 with value: 0.22432439804144194.
[I 2024-04-04 09:09:37,316] Trial 40 finished with value: 0.24107176554942064 and parameters: {'model_name': 'IterativeImputer', 'sample_posterior': True, 'initial_strategy': 'constant', 'imputation_order': 'roman'}. Best is trial 0 with value: 0.22432439804144194.
[I 2024-04-04 09:09:38,267] Trial 23 finished with value: 0.2378459296320267 and parameters: {'model_name': 'IterativeImputer', 'sample_posterior': True, 'initial_strategy': 'constant', 'imputation_order': 'roman'}. Best is trial 0 with value: 0.22432439804144194.
[I 2024-04-04 09:09:39,316] Trial 27 finished with value: 0.23266376234988995 and parameters: {'model_name': 'IterativeImputer', 'sample_posterior': True, 'initial_strategy': 'constant', 'imputation_order': 'descending'}. Best is trial 0 with value: 0.22432439804144194.
[I 2024-04-04 09:09:41,065] Trial 67 finished with value: 0.2430584028677519 and parameters: {'model_name': 'IterativeImputer', 'sample_posterior': True, 'initial_strategy': 'median', 'imputation_order': 'roman'}. Best is trial 0 with value: 0.22432439804144194.
[I 2024-04-04 09:09:44,009] Trial 69 finished with value: 0.24373202798179325 and parameters: {'model_name': 'IterativeImputer', 'sample_posterior': True, 'initial_strategy': 'mean', 'imputation_order': 'arabic'}. Best is trial 0 with value: 0.22432439804144194.
[I 2024-04-04 09:09:44,716] Trial 56 finished with value: 0.2513937547955153 and parameters: {'model_name': 'IterativeImputer', 'sample_posterior': True, 'initial_strategy': 'most_frequent', 'imputation_order': 'descending'}. Best is trial 0 with value: 0.22432439804144194.
[I 2024-04-04 09:09:45,923] Trial 8 finished with value: 0.2392414402302976 and parameters: {'model_name': 'IterativeImputer', 'sample_posterior': True, 'initial_strategy': 'most_frequent', 'imputation_order': 'roman'}. Best is trial 0 with value: 0.22432439804144194.
[I 2024-04-04 09:09:48,149] Trial 41 finished with value: 0.23836023203258536 and parameters: {'model_name': 'IterativeImputer', 'sample_posterior': True, 'initial_strategy': 'constant', 'imputation_order': 'random'}. Best is trial 0 with value: 0.22432439804144194.
[I 2024-04-04 09:09:50,093] Trial 71 finished with value: 0.24074582801096991 and parameters: {'model_name': 'IterativeImputer', 'sample_posterior': True, 'initial_strategy': 'constant', 'imputation_order': 'roman'}. Best is trial 0 with value: 0.22432439804144194.
[I 2024-04-04 09:09:55,133] Trial 45 finished with value: 0.23467571621028466 and parameters: {'model_name': 'IterativeImputer', 'sample_posterior': True, 'initial_strategy': 'most_frequent', 'imputation_order': 'random'}. Best is trial 0 with value: 0.22432439804144194.
[I 2024-04-04 09:09:58,887] Trial 75 finished with value: 0.24429678468034174 and parameters: {'model_name': 'IterativeImputer', 'sample_posterior': True, 'initial_strategy': 'most_frequent', 'imputation_order': 'random'}. Best is trial 0 with value: 0.22432439804144194.
[I 2024-04-04 09:10:23,022] Trial 77 finished with value: 0.23771742603124052 and parameters: {'model_name': 'IterativeImputer', 'sample_posterior': True, 'initial_strategy': 'constant', 'imputation_order': 'roman'}. Best is trial 0 with value: 0.22432439804144194.
[I 2024-04-04 09:10:27,032] Trial 80 finished with value: 0.23919294576812683 and parameters: {'model_name': 'IterativeImputer', 'sample_posterior': True, 'initial_strategy': 'mean', 'imputation_order': 'roman'}. Best is trial 0 with value: 0.22432439804144194.
[I 2024-04-04 09:10:28,844] Trial 79 finished with value: 0.23782516669547715 and parameters: {'model_name': 'IterativeImputer', 'sample_posterior': True, 'initial_strategy': 'constant', 'imputation_order': 'roman'}. Best is trial 0 with value: 0.22432439804144194.
[I 2024-04-04 09:10:31,137] Trial 81 finished with value: 0.24414387057438738 and parameters: {'model_name': 'IterativeImputer', 'sample_posterior': True, 'initial_strategy': 'constant', 'imputation_order': 'ascending'}. Best is trial 0 with value: 0.22432439804144194.
[I 2024-04-04 09:10:35,969] Trial 82 finished with value: 0.24576497322737967 and parameters: {'model_name': 'IterativeImputer', 'sample_posterior': True, 'initial_strategy': 'median', 'imputation_order': 'roman'}. Best is trial 0 with value: 0.22432439804144194.
[I 2024-04-04 09:10:49,474] Trial 84 finished with value: 0.23341379693602887 and parameters: {'model_name': 'IterativeImputer', 'sample_posterior': True, 'initial_strategy': 'median', 'imputation_order': 'descending'}. Best is trial 0 with value: 0.22432439804144194.
[I 2024-04-04 09:10:50,478] Trial 83 finished with value: 0.23649397796218255 and parameters: {'model_name': 'IterativeImputer', 'sample_posterior': True, 'initial_strategy': 'median', 'imputation_order': 'arabic'}. Best is trial 0 with value: 0.22432439804144194.
[I 2024-04-04 09:14:14,853] Trial 7 finished with value: 0.23719349126057035 and parameters: {'model_name': 'GAIN', 'batch_size': 63, 'hint_rate': 0.9400000000000001, 'alpha': 22, 'iterations': 394}. Best is trial 0 with value: 0.22432439804144194.
[I 2024-04-04 09:16:02,112] Trial 74 finished with value: 0.23867962547658986 and parameters: {'model_name': 'GAIN', 'batch_size': 19, 'hint_rate': 0.25, 'alpha': 60, 'iterations': 476}. Best is trial 0 with value: 0.22432439804144194.
[I 2024-04-04 09:16:43,393] Trial 15 finished with value: 0.23348216347949063 and parameters: {'model_name': 'GAIN', 'batch_size': 4, 'hint_rate': 0.4, 'alpha': 27, 'iterations': 537}. Best is trial 0 with value: 0.22432439804144194.
[I 2024-04-04 09:19:40,763] Trial 153 finished with value: 0.22486155059121896 and parameters: {'model_name': 'RandomForestImputer', 'max_iter': 10, 'decreasing': False, 'min_samples_split': 0.7000000000000001, 'min_samples_leaf': 0.9, 'max_features': 0.30000000000000004, 'warm_start': False}. Best is trial 0 with value: 0.22432439804144194.
[I 2024-04-04 09:20:00,615] Trial 142 finished with value: 0.22481664701432397 and parameters: {'model_name': 'RandomForestImputer', 'max_iter': 11, 'decreasing': False, 'min_samples_split': 0.7000000000000001, 'min_samples_leaf': 0.9, 'max_features': 0.30000000000000004, 'warm_start': False}. Best is trial 0 with value: 0.22432439804144194.
[I 2024-04-04 09:20:23,601] Trial 156 finished with value: 0.22504136146086712 and parameters: {'model_name': 'RandomForestImputer', 'max_iter': 10, 'decreasing': False, 'min_samples_split': 0.7000000000000001, 'min_samples_leaf': 0.9, 'max_features': 0.30000000000000004, 'warm_start': False}. Best is trial 0 with value: 0.22432439804144194.
[I 2024-04-04 09:20:35,662] Trial 145 finished with value: 0.22475775829364492 and parameters: {'model_name': 'RandomForestImputer', 'max_iter': 10, 'decreasing': False, 'min_samples_split': 0.7000000000000001, 'min_samples_leaf': 0.9, 'max_features': 0.30000000000000004, 'warm_start': False}. Best is trial 0 with value: 0.22432439804144194.
[I 2024-04-04 09:20:51,544] Trial 140 finished with value: 0.22479940646243707 and parameters: {'model_name': 'RandomForestImputer', 'max_iter': 10, 'decreasing': False, 'min_samples_split': 0.7000000000000001, 'min_samples_leaf': 0.9, 'max_features': 0.30000000000000004, 'warm_start': False}. Best is trial 0 with value: 0.22432439804144194.
[I 2024-04-04 09:20:56,867] Trial 141 finished with value: 0.22466826161579578 and parameters: {'model_name': 'RandomForestImputer', 'max_iter': 10, 'decreasing': False, 'min_samples_split': 0.7000000000000001, 'min_samples_leaf': 0.9, 'max_features': 0.30000000000000004, 'warm_start': False}. Best is trial 0 with value: 0.22432439804144194.
[I 2024-04-04 09:21:10,170] Trial 149 finished with value: 0.22508903731232605 and parameters: {'model_name': 'RandomForestImputer', 'max_iter': 11, 'decreasing': False, 'min_samples_split': 0.7000000000000001, 'min_samples_leaf': 0.9, 'max_features': 0.30000000000000004, 'warm_start': False}. Best is trial 0 with value: 0.22432439804144194.
[I 2024-04-04 09:21:22,561] Trial 150 finished with value: 0.22488498958848652 and parameters: {'model_name': 'RandomForestImputer', 'max_iter': 11, 'decreasing': False, 'min_samples_split': 0.7000000000000001, 'min_samples_leaf': 0.9, 'max_features': 0.30000000000000004, 'warm_start': False}. Best is trial 0 with value: 0.22432439804144194.
[I 2024-04-04 09:21:25,767] Trial 152 finished with value: 0.22500816650564884 and parameters: {'model_name': 'RandomForestImputer', 'max_iter': 10, 'decreasing': False, 'min_samples_split': 0.7000000000000001, 'min_samples_leaf': 0.9, 'max_features': 0.30000000000000004, 'warm_start': False}. Best is trial 0 with value: 0.22432439804144194.
[I 2024-04-04 09:21:48,706] Trial 148 finished with value: 0.22470948539591373 and parameters: {'model_name': 'RandomForestImputer', 'max_iter': 11, 'decreasing': False, 'min_samples_split': 0.7000000000000001, 'min_samples_leaf': 0.9, 'max_features': 0.30000000000000004, 'warm_start': False}. Best is trial 0 with value: 0.22432439804144194.
[I 2024-04-04 09:22:19,132] Trial 146 finished with value: 0.22480257366225903 and parameters: {'model_name': 'RandomForestImputer', 'max_iter': 13, 'decreasing': False, 'min_samples_split': 0.7000000000000001, 'min_samples_leaf': 0.9, 'max_features': 0.30000000000000004, 'warm_start': False}. Best is trial 0 with value: 0.22432439804144194.
[I 2024-04-04 09:22:53,945] Trial 155 finished with value: 0.22463934711444428 and parameters: {'model_name': 'RandomForestImputer', 'max_iter': 11, 'decreasing': False, 'min_samples_split': 0.7000000000000001, 'min_samples_leaf': 0.9, 'max_features': 0.30000000000000004, 'warm_start': False}. Best is trial 0 with value: 0.22432439804144194.
[I 2024-04-04 09:23:25,489] Trial 147 finished with value: 0.22478905856508766 and parameters: {'model_name': 'RandomForestImputer', 'max_iter': 11, 'decreasing': False, 'min_samples_split': 0.7000000000000001, 'min_samples_leaf': 0.8, 'max_features': 0.30000000000000004, 'warm_start': False}. Best is trial 0 with value: 0.22432439804144194.
[I 2024-04-04 09:26:04,002] Trial 157 finished with value: 0.224961870948587 and parameters: {'model_name': 'RandomForestImputer', 'max_iter': 12, 'decreasing': False, 'min_samples_split': 0.7000000000000001, 'min_samples_leaf': 0.8, 'max_features': 0.30000000000000004, 'warm_start': False}. Best is trial 0 with value: 0.22432439804144194.
[I 2024-04-04 09:29:29,989] Trial 159 finished with value: 0.2247810418442505 and parameters: {'model_name': 'RandomForestImputer', 'max_iter': 11, 'decreasing': False, 'min_samples_split': 0.7000000000000001, 'min_samples_leaf': 0.9, 'max_features': 0.30000000000000004, 'warm_start': False}. Best is trial 0 with value: 0.22432439804144194.
[I 2024-04-04 09:29:37,870] Trial 158 finished with value: 0.22495846048787396 and parameters: {'model_name': 'RandomForestImputer', 'max_iter': 12, 'decreasing': False, 'min_samples_split': 0.7000000000000001, 'min_samples_leaf': 0.9, 'max_features': 0.30000000000000004, 'warm_start': False}. Best is trial 0 with value: 0.22432439804144194.
[I 2024-04-04 09:30:58,553] Trial 167 finished with value: 0.2247261405108693 and parameters: {'model_name': 'RandomForestImputer', 'max_iter': 9, 'decreasing': False, 'min_samples_split': 0.7000000000000001, 'min_samples_leaf': 0.9, 'max_features': 0.30000000000000004, 'warm_start': False}. Best is trial 0 with value: 0.22432439804144194.
[I 2024-04-04 09:31:10,564] Trial 166 finished with value: 0.2248286251552206 and parameters: {'model_name': 'RandomForestImputer', 'max_iter': 9, 'decreasing': False, 'min_samples_split': 0.7000000000000001, 'min_samples_leaf': 0.9, 'max_features': 0.30000000000000004, 'warm_start': False}. Best is trial 0 with value: 0.22432439804144194.
[I 2024-04-04 09:31:30,142] Trial 162 finished with value: 0.22495441454531945 and parameters: {'model_name': 'RandomForestImputer', 'max_iter': 10, 'decreasing': False, 'min_samples_split': 0.7000000000000001, 'min_samples_leaf': 0.9, 'max_features': 0.30000000000000004, 'warm_start': False}. Best is trial 0 with value: 0.22432439804144194.
[I 2024-04-04 09:32:19,976] Trial 164 finished with value: 0.22476131047479306 and parameters: {'model_name': 'RandomForestImputer', 'max_iter': 10, 'decreasing': False, 'min_samples_split': 0.7000000000000001, 'min_samples_leaf': 0.9, 'max_features': 0.30000000000000004, 'warm_start': False}. Best is trial 0 with value: 0.22432439804144194.
[I 2024-04-04 09:32:38,014] Trial 160 finished with value: 0.22458996081549137 and parameters: {'model_name': 'RandomForestImputer', 'max_iter': 10, 'decreasing': False, 'min_samples_split': 0.7000000000000001, 'min_samples_leaf': 0.9, 'max_features': 0.30000000000000004, 'warm_start': False}. Best is trial 0 with value: 0.22432439804144194.
[I 2024-04-04 09:33:22,206] Trial 10 finished with value: 0.224807059727436 and parameters: {'model_name': 'RandomForestImputer', 'max_iter': 47, 'decreasing': True, 'min_samples_split': 0.4, 'min_samples_leaf': 0.30000000000000004, 'max_features': 0.4, 'warm_start': False}. Best is trial 0 with value: 0.22432439804144194.
[I 2024-04-04 09:33:24,808] Trial 20 finished with value: 0.2248610901174029 and parameters: {'model_name': 'RandomForestImputer', 'max_iter': 44, 'decreasing': False, 'min_samples_split': 0.9, 'min_samples_leaf': 0.6, 'max_features': 0.30000000000000004, 'warm_start': False}. Best is trial 0 with value: 0.22432439804144194.
[I 2024-04-04 09:33:32,782] Trial 161 finished with value: 0.22513152283604043 and parameters: {'model_name': 'RandomForestImputer', 'max_iter': 10, 'decreasing': False, 'min_samples_split': 0.7000000000000001, 'min_samples_leaf': 0.9, 'max_features': 0.30000000000000004, 'warm_start': False}. Best is trial 0 with value: 0.22432439804144194.
[I 2024-04-04 09:33:46,545] Trial 168 finished with value: 0.22472080718477588 and parameters: {'model_name': 'RandomForestImputer', 'max_iter': 13, 'decreasing': False, 'min_samples_split': 0.7000000000000001, 'min_samples_leaf': 0.8, 'max_features': 0.30000000000000004, 'warm_start': False}. Best is trial 0 with value: 0.22432439804144194.
[I 2024-04-04 09:34:00,006] Trial 165 finished with value: 0.2248207432245815 and parameters: {'model_name': 'RandomForestImputer', 'max_iter': 11, 'decreasing': False, 'min_samples_split': 0.7000000000000001, 'min_samples_leaf': 0.9, 'max_features': 0.30000000000000004, 'warm_start': False}. Best is trial 0 with value: 0.22432439804144194.
[I 2024-04-04 09:34:17,822] Trial 163 finished with value: 0.22479821494274846 and parameters: {'model_name': 'RandomForestImputer', 'max_iter': 12, 'decreasing': False, 'min_samples_split': 0.7000000000000001, 'min_samples_leaf': 0.9, 'max_features': 0.30000000000000004, 'warm_start': False}. Best is trial 0 with value: 0.22432439804144194.
[I 2024-04-04 09:36:29,634] Trial 169 finished with value: 0.22484985290320658 and parameters: {'model_name': 'RandomForestImputer', 'max_iter': 13, 'decreasing': False, 'min_samples_split': 0.7000000000000001, 'min_samples_leaf': 0.8, 'max_features': 0.30000000000000004, 'warm_start': False}. Best is trial 0 with value: 0.22432439804144194.
[I 2024-04-04 09:36:43,411] Trial 172 finished with value: 0.2248485978523668 and parameters: {'model_name': 'RandomForestImputer', 'max_iter': 13, 'decreasing': False, 'min_samples_split': 0.7000000000000001, 'min_samples_leaf': 0.9, 'max_features': 0.30000000000000004, 'warm_start': False}. Best is trial 0 with value: 0.22432439804144194.
[I 2024-04-04 09:37:47,020] Trial 171 finished with value: 0.224785886349067 and parameters: {'model_name': 'RandomForestImputer', 'max_iter': 13, 'decreasing': False, 'min_samples_split': 0.7000000000000001, 'min_samples_leaf': 0.9, 'max_features': 0.30000000000000004, 'warm_start': False}. Best is trial 0 with value: 0.22432439804144194.
[I 2024-04-04 09:38:42,084] Trial 170 finished with value: 0.22479841091599337 and parameters: {'model_name': 'RandomForestImputer', 'max_iter': 14, 'decreasing': False, 'min_samples_split': 0.7000000000000001, 'min_samples_leaf': 0.9, 'max_features': 0.30000000000000004, 'warm_start': False}. Best is trial 0 with value: 0.22432439804144194.
[I 2024-04-04 09:40:52,953] Trial 178 finished with value: 0.22460749480446146 and parameters: {'model_name': 'RandomForestImputer', 'max_iter': 8, 'decreasing': False, 'min_samples_split': 0.8, 'min_samples_leaf': 0.9, 'max_features': 0.2, 'warm_start': False}. Best is trial 0 with value: 0.22432439804144194.
[I 2024-04-04 09:41:18,875] Trial 173 finished with value: 0.22487259277060584 and parameters: {'model_name': 'RandomForestImputer', 'max_iter': 12, 'decreasing': False, 'min_samples_split': 0.7000000000000001, 'min_samples_leaf': 0.9, 'max_features': 0.30000000000000004, 'warm_start': False}. Best is trial 0 with value: 0.22432439804144194.
[I 2024-04-04 09:41:45,824] Trial 174 finished with value: 0.22482060162459377 and parameters: {'model_name': 'RandomForestImputer', 'max_iter': 11, 'decreasing': False, 'min_samples_split': 0.7000000000000001, 'min_samples_leaf': 0.9, 'max_features': 0.30000000000000004, 'warm_start': False}. Best is trial 0 with value: 0.22432439804144194.
[I 2024-04-04 09:41:50,708] Trial 175 finished with value: 0.22476715396171545 and parameters: {'model_name': 'RandomForestImputer', 'max_iter': 9, 'decreasing': False, 'min_samples_split': 0.7000000000000001, 'min_samples_leaf': 0.9, 'max_features': 0.30000000000000004, 'warm_start': False}. Best is trial 0 with value: 0.22432439804144194.
[I 2024-04-04 09:41:54,551] Trial 17 finished with value: inf and parameters: {'model_name': 'GAIN', 'batch_size': 50, 'hint_rate': 0.42000000000000004, 'alpha': 87, 'iterations': 12859}. Best is trial 0 with value: 0.22432439804144194.
[I 2024-04-04 09:41:56,960] Trial 176 finished with value: 0.22452631423531125 and parameters: {'model_name': 'RandomForestImputer', 'max_iter': 8, 'decreasing': False, 'min_samples_split': 0.8, 'min_samples_leaf': 0.9, 'max_features': 0.2, 'warm_start': False}. Best is trial 0 with value: 0.22432439804144194.
[I 2024-04-04 09:41:59,962] Trial 179 finished with value: 0.22499856826599288 and parameters: {'model_name': 'RandomForestImputer', 'max_iter': 8, 'decreasing': False, 'min_samples_split': 0.8, 'min_samples_leaf': 0.8, 'max_features': 0.2, 'warm_start': False}. Best is trial 0 with value: 0.22432439804144194.
[I 2024-04-04 09:42:06,381] Trial 177 finished with value: 0.2248330664184471 and parameters: {'model_name': 'RandomForestImputer', 'max_iter': 8, 'decreasing': False, 'min_samples_split': 0.8, 'min_samples_leaf': 0.8, 'max_features': 0.2, 'warm_start': False}. Best is trial 0 with value: 0.22432439804144194.
[I 2024-04-04 09:42:14,584] Trial 183 finished with value: 0.22479789777965103 and parameters: {'model_name': 'RandomForestImputer', 'max_iter': 7, 'decreasing': False, 'min_samples_split': 0.8, 'min_samples_leaf': 0.8, 'max_features': 0.2, 'warm_start': False}. Best is trial 0 with value: 0.22432439804144194.
[I 2024-04-04 09:42:30,407] Trial 182 finished with value: 0.22487757594770388 and parameters: {'model_name': 'RandomForestImputer', 'max_iter': 7, 'decreasing': False, 'min_samples_split': 0.8, 'min_samples_leaf': 0.8, 'max_features': 0.2, 'warm_start': False}. Best is trial 0 with value: 0.22432439804144194.
[I 2024-04-04 09:42:48,414] Trial 185 finished with value: 0.22480504679551175 and parameters: {'model_name': 'RandomForestImputer', 'max_iter': 7, 'decreasing': False, 'min_samples_split': 0.8, 'min_samples_leaf': 0.8, 'max_features': 0.2, 'warm_start': False}. Best is trial 0 with value: 0.22432439804144194.
[I 2024-04-04 09:43:58,437] Trial 184 finished with value: 0.22493914478374077 and parameters: {'model_name': 'RandomForestImputer', 'max_iter': 7, 'decreasing': False, 'min_samples_split': 0.8, 'min_samples_leaf': 0.8, 'max_features': 0.2, 'warm_start': False}. Best is trial 0 with value: 0.22432439804144194.
[I 2024-04-04 09:44:07,684] Trial 186 finished with value: 0.22476369130916937 and parameters: {'model_name': 'RandomForestImputer', 'max_iter': 7, 'decreasing': False, 'min_samples_split': 0.8, 'min_samples_leaf': 0.8, 'max_features': 0.2, 'warm_start': False}. Best is trial 0 with value: 0.22432439804144194.
[I 2024-04-04 09:45:28,317] Trial 188 finished with value: 0.22488631714086 and parameters: {'model_name': 'RandomForestImputer', 'max_iter': 7, 'decreasing': False, 'min_samples_split': 0.8, 'min_samples_leaf': 0.8, 'max_features': 0.2, 'warm_start': False}. Best is trial 0 with value: 0.22432439804144194.
[I 2024-04-04 09:45:30,665] Trial 187 finished with value: 0.22480418332865354 and parameters: {'model_name': 'RandomForestImputer', 'max_iter': 7, 'decreasing': False, 'min_samples_split': 0.8, 'min_samples_leaf': 0.8, 'max_features': 0.2, 'warm_start': False}. Best is trial 0 with value: 0.22432439804144194.
[I 2024-04-04 09:46:11,998] Trial 189 finished with value: 0.22489270984436605 and parameters: {'model_name': 'RandomForestImputer', 'max_iter': 7, 'decreasing': False, 'min_samples_split': 0.8, 'min_samples_leaf': 0.8, 'max_features': 0.2, 'warm_start': False}. Best is trial 0 with value: 0.22432439804144194.
