[I 2023-12-26 20:16:11,596] Trial 108 finished with value: 0.23092759240829114 and parameters: {'model_name': 'IterativeImputer', 'sample_posterior': False, 'initial_strategy': 'constant', 'imputation_order': 'arabic'}. Best is trial 84 with value: 0.23092156937785976.
[I 2023-12-26 20:16:45,065] Trial 79 finished with value: 0.3314412419850691 and parameters: {'model_name': 'IterativeImputer', 'sample_posterior': True, 'initial_strategy': 'constant', 'imputation_order': 'roman'}. Best is trial 84 with value: 0.23092156937785976.
[I 2023-12-26 20:16:50,695] Trial 80 finished with value: 0.33008135610951533 and parameters: {'model_name': 'IterativeImputer', 'sample_posterior': True, 'initial_strategy': 'mean', 'imputation_order': 'descending'}. Best is trial 84 with value: 0.23092156937785976.
[I 2023-12-26 20:21:08,419] Trial 81 finished with value: 0.3307440383357622 and parameters: {'model_name': 'IterativeImputer', 'sample_posterior': True, 'initial_strategy': 'most_frequent', 'imputation_order': 'arabic'}. Best is trial 84 with value: 0.23092156937785976.
[I 2023-12-26 20:24:55,424] Trial 83 finished with value: 0.33157610126598935 and parameters: {'model_name': 'IterativeImputer', 'sample_posterior': True, 'initial_strategy': 'median', 'imputation_order': 'descending'}. Best is trial 84 with value: 0.23092156937785976.
[I 2023-12-26 20:25:22,418] Trial 82 finished with value: 0.3305143030713194 and parameters: {'model_name': 'IterativeImputer', 'sample_posterior': True, 'initial_strategy': 'most_frequent', 'imputation_order': 'random'}. Best is trial 84 with value: 0.23092156937785976.
[I 2023-12-26 20:30:57,303] Trial 85 finished with value: 0.32939745542628945 and parameters: {'model_name': 'IterativeImputer', 'sample_posterior': True, 'initial_strategy': 'median', 'imputation_order': 'arabic'}. Best is trial 84 with value: 0.23092156937785976.
[I 2023-12-26 20:36:32,458] Trial 88 finished with value: 0.32741783508004674 and parameters: {'model_name': 'IterativeImputer', 'sample_posterior': True, 'initial_strategy': 'median', 'imputation_order': 'arabic'}. Best is trial 84 with value: 0.23092156937785976.
[I 2023-12-26 20:36:39,282] Trial 67 finished with value: 0.3639203260388046 and parameters: {'model_name': 'GAIN', 'batch_size': 299, 'hint_rate': 0.12, 'alpha': 50, 'iterations': 819}. Best is trial 84 with value: 0.23092156937785976.
[I 2023-12-26 20:37:10,881] Trial 87 finished with value: 0.33042206382391637 and parameters: {'model_name': 'IterativeImputer', 'sample_posterior': True, 'initial_strategy': 'median', 'imputation_order': 'descending'}. Best is trial 84 with value: 0.23092156937785976.
[I 2023-12-26 20:38:17,816] Trial 89 finished with value: 0.329099964296838 and parameters: {'model_name': 'IterativeImputer', 'sample_posterior': True, 'initial_strategy': 'mean', 'imputation_order': 'random'}. Best is trial 84 with value: 0.23092156937785976.
[I 2023-12-26 20:49:14,443] Trial 90 finished with value: 0.331328930317864 and parameters: {'model_name': 'IterativeImputer', 'sample_posterior': True, 'initial_strategy': 'most_frequent', 'imputation_order': 'descending'}. Best is trial 84 with value: 0.23092156937785976.
[I 2023-12-26 20:55:30,511] Trial 116 finished with value: 0.23092759240829114 and parameters: {'model_name': 'IterativeImputer', 'sample_posterior': False, 'initial_strategy': 'constant', 'imputation_order': 'arabic'}. Best is trial 84 with value: 0.23092156937785976.
[I 2023-12-26 20:55:35,409] Trial 144 finished with value: 0.3661633671023722 and parameters: {'model_name': 'SimpleImputer', 'strategy': 'constant'}. Best is trial 84 with value: 0.23092156937785976.
[I 2023-12-26 20:55:42,833] Trial 117 finished with value: 0.23092759240829114 and parameters: {'model_name': 'IterativeImputer', 'sample_posterior': False, 'initial_strategy': 'constant', 'imputation_order': 'arabic'}. Best is trial 84 with value: 0.23092156937785976.
[I 2023-12-26 20:56:17,178] Trial 118 finished with value: 0.23092759240829114 and parameters: {'model_name': 'IterativeImputer', 'sample_posterior': False, 'initial_strategy': 'constant', 'imputation_order': 'arabic'}. Best is trial 84 with value: 0.23092156937785976.
[I 2023-12-26 20:56:47,504] Trial 119 finished with value: 0.23092759240829114 and parameters: {'model_name': 'IterativeImputer', 'sample_posterior': False, 'initial_strategy': 'constant', 'imputation_order': 'arabic'}. Best is trial 84 with value: 0.23092156937785976.
[I 2023-12-26 20:56:52,757] Trial 120 finished with value: 0.23092759240829114 and parameters: {'model_name': 'IterativeImputer', 'sample_posterior': False, 'initial_strategy': 'constant', 'imputation_order': 'arabic'}. Best is trial 84 with value: 0.23092156937785976.
[I 2023-12-26 20:56:59,866] Trial 121 finished with value: 0.23092759240829114 and parameters: {'model_name': 'IterativeImputer', 'sample_posterior': False, 'initial_strategy': 'constant', 'imputation_order': 'arabic'}. Best is trial 84 with value: 0.23092156937785976.
[I 2023-12-26 20:57:03,193] Trial 122 finished with value: 0.23092759240829114 and parameters: {'model_name': 'IterativeImputer', 'sample_posterior': False, 'initial_strategy': 'constant', 'imputation_order': 'arabic'}. Best is trial 84 with value: 0.23092156937785976.
[I 2023-12-26 20:57:24,842] Trial 123 finished with value: 0.23092759240829114 and parameters: {'model_name': 'IterativeImputer', 'sample_posterior': False, 'initial_strategy': 'constant', 'imputation_order': 'arabic'}. Best is trial 84 with value: 0.23092156937785976.
[I 2023-12-26 20:58:00,044] Trial 125 finished with value: 0.23092759240829114 and parameters: {'model_name': 'IterativeImputer', 'sample_posterior': False, 'initial_strategy': 'constant', 'imputation_order': 'arabic'}. Best is trial 84 with value: 0.23092156937785976.
[I 2023-12-26 20:58:37,128] Trial 126 finished with value: 0.23092759240829114 and parameters: {'model_name': 'IterativeImputer', 'sample_posterior': False, 'initial_strategy': 'constant', 'imputation_order': 'arabic'}. Best is trial 84 with value: 0.23092156937785976.
[I 2023-12-26 20:58:42,366] Trial 124 finished with value: 0.23092759240829114 and parameters: {'model_name': 'IterativeImputer', 'sample_posterior': False, 'initial_strategy': 'constant', 'imputation_order': 'arabic'}. Best is trial 84 with value: 0.23092156937785976.
[I 2023-12-26 21:00:24,254] Trial 127 finished with value: 0.23092759240829114 and parameters: {'model_name': 'IterativeImputer', 'sample_posterior': False, 'initial_strategy': 'constant', 'imputation_order': 'arabic'}. Best is trial 84 with value: 0.23092156937785976.
[I 2023-12-26 21:00:30,333] Trial 156 finished with value: 0.32900208348770965 and parameters: {'model_name': 'SimpleImputer', 'strategy': 'mean'}. Best is trial 84 with value: 0.23092156937785976.
[I 2023-12-26 21:01:33,799] Trial 128 finished with value: 0.23092759240829114 and parameters: {'model_name': 'IterativeImputer', 'sample_posterior': False, 'initial_strategy': 'constant', 'imputation_order': 'arabic'}. Best is trial 84 with value: 0.23092156937785976.
[I 2023-12-26 21:02:22,646] Trial 129 finished with value: 0.23092759240829114 and parameters: {'model_name': 'IterativeImputer', 'sample_posterior': False, 'initial_strategy': 'constant', 'imputation_order': 'arabic'}. Best is trial 84 with value: 0.23092156937785976.
[I 2023-12-26 21:02:57,089] Trial 131 finished with value: 0.23092759240829114 and parameters: {'model_name': 'IterativeImputer', 'sample_posterior': False, 'initial_strategy': 'constant', 'imputation_order': 'arabic'}. Best is trial 84 with value: 0.23092156937785976.
[I 2023-12-26 21:02:59,676] Trial 130 finished with value: 0.23092759240829114 and parameters: {'model_name': 'IterativeImputer', 'sample_posterior': False, 'initial_strategy': 'constant', 'imputation_order': 'arabic'}. Best is trial 84 with value: 0.23092156937785976.
[I 2023-12-26 21:04:27,177] Trial 132 finished with value: 0.23092759240829114 and parameters: {'model_name': 'IterativeImputer', 'sample_posterior': False, 'initial_strategy': 'constant', 'imputation_order': 'arabic'}. Best is trial 84 with value: 0.23092156937785976.
[I 2023-12-26 21:04:47,575] Trial 134 finished with value: 0.23092759240829114 and parameters: {'model_name': 'IterativeImputer', 'sample_posterior': False, 'initial_strategy': 'constant', 'imputation_order': 'arabic'}. Best is trial 84 with value: 0.23092156937785976.
[I 2023-12-26 21:05:02,863] Trial 133 finished with value: 0.23092759240829114 and parameters: {'model_name': 'IterativeImputer', 'sample_posterior': False, 'initial_strategy': 'constant', 'imputation_order': 'arabic'}. Best is trial 84 with value: 0.23092156937785976.
[I 2023-12-26 21:10:26,377] Trial 135 finished with value: 0.23092759240829114 and parameters: {'model_name': 'IterativeImputer', 'sample_posterior': False, 'initial_strategy': 'constant', 'imputation_order': 'arabic'}. Best is trial 84 with value: 0.23092156937785976.
[I 2023-12-26 21:14:20,575] Trial 136 finished with value: 0.23092759240829114 and parameters: {'model_name': 'IterativeImputer', 'sample_posterior': False, 'initial_strategy': 'constant', 'imputation_order': 'arabic'}. Best is trial 84 with value: 0.23092156937785976.
[I 2023-12-26 21:15:12,953] Trial 137 finished with value: 0.23092759240829114 and parameters: {'model_name': 'IterativeImputer', 'sample_posterior': False, 'initial_strategy': 'constant', 'imputation_order': 'arabic'}. Best is trial 84 with value: 0.23092156937785976.
[I 2023-12-26 21:21:46,805] Trial 138 finished with value: 0.23092759240829114 and parameters: {'model_name': 'IterativeImputer', 'sample_posterior': False, 'initial_strategy': 'constant', 'imputation_order': 'arabic'}. Best is trial 84 with value: 0.23092156937785976.
[I 2023-12-26 21:27:21,752] Trial 139 finished with value: 0.23092759240829114 and parameters: {'model_name': 'IterativeImputer', 'sample_posterior': False, 'initial_strategy': 'constant', 'imputation_order': 'arabic'}. Best is trial 84 with value: 0.23092156937785976.
[I 2023-12-26 21:27:33,518] Trial 140 finished with value: 0.23092759240829114 and parameters: {'model_name': 'IterativeImputer', 'sample_posterior': False, 'initial_strategy': 'constant', 'imputation_order': 'arabic'}. Best is trial 84 with value: 0.23092156937785976.
[I 2023-12-26 21:28:14,648] Trial 141 finished with value: 0.23092759240829114 and parameters: {'model_name': 'IterativeImputer', 'sample_posterior': False, 'initial_strategy': 'constant', 'imputation_order': 'arabic'}. Best is trial 84 with value: 0.23092156937785976.
[I 2023-12-26 21:29:59,226] Trial 142 finished with value: 0.23092759240829114 and parameters: {'model_name': 'IterativeImputer', 'sample_posterior': False, 'initial_strategy': 'constant', 'imputation_order': 'arabic'}. Best is trial 84 with value: 0.23092156937785976.
[I 2023-12-26 21:35:09,465] Trial 105 finished with value: 0.3298120477027618 and parameters: {'model_name': 'IterativeImputer', 'sample_posterior': True, 'initial_strategy': 'most_frequent', 'imputation_order': 'arabic'}. Best is trial 84 with value: 0.23092156937785976.
[I 2023-12-26 21:36:21,933] Trial 107 finished with value: 0.3298682249214528 and parameters: {'model_name': 'IterativeImputer', 'sample_posterior': True, 'initial_strategy': 'constant', 'imputation_order': 'arabic'}. Best is trial 84 with value: 0.23092156937785976.
[I 2023-12-26 21:36:45,815] Trial 106 finished with value: 0.32999791828433067 and parameters: {'model_name': 'IterativeImputer', 'sample_posterior': True, 'initial_strategy': 'most_frequent', 'imputation_order': 'random'}. Best is trial 84 with value: 0.23092156937785976.
[I 2023-12-26 21:37:18,085] Trial 109 finished with value: 0.32859989141172263 and parameters: {'model_name': 'IterativeImputer', 'sample_posterior': True, 'initial_strategy': 'constant', 'imputation_order': 'arabic'}. Best is trial 84 with value: 0.23092156937785976.
[I 2023-12-26 21:38:13,648] Trial 110 finished with value: 0.3277451546265817 and parameters: {'model_name': 'IterativeImputer', 'sample_posterior': True, 'initial_strategy': 'constant', 'imputation_order': 'arabic'}. Best is trial 84 with value: 0.23092156937785976.
[I 2023-12-26 21:38:29,454] Trial 111 finished with value: 0.3305903934739571 and parameters: {'model_name': 'IterativeImputer', 'sample_posterior': True, 'initial_strategy': 'constant', 'imputation_order': 'arabic'}. Best is trial 84 with value: 0.23092156937785976.
[I 2023-12-26 21:39:19,193] Trial 112 finished with value: 0.32839824016597624 and parameters: {'model_name': 'IterativeImputer', 'sample_posterior': True, 'initial_strategy': 'constant', 'imputation_order': 'arabic'}. Best is trial 84 with value: 0.23092156937785976.
[I 2023-12-26 21:40:39,988] Trial 143 finished with value: 0.23092759240829114 and parameters: {'model_name': 'IterativeImputer', 'sample_posterior': False, 'initial_strategy': 'constant', 'imputation_order': 'arabic'}. Best is trial 84 with value: 0.23092156937785976.
[I 2023-12-26 21:46:52,787] Trial 145 finished with value: 0.23092759240829114 and parameters: {'model_name': 'IterativeImputer', 'sample_posterior': False, 'initial_strategy': 'constant', 'imputation_order': 'arabic'}. Best is trial 84 with value: 0.23092156937785976.
[I 2023-12-26 21:46:56,594] Trial 146 finished with value: 0.23092759240829114 and parameters: {'model_name': 'IterativeImputer', 'sample_posterior': False, 'initial_strategy': 'constant', 'imputation_order': 'arabic'}. Best is trial 84 with value: 0.23092156937785976.
[I 2023-12-26 21:47:29,659] Trial 147 finished with value: 0.23092759240829114 and parameters: {'model_name': 'IterativeImputer', 'sample_posterior': False, 'initial_strategy': 'constant', 'imputation_order': 'arabic'}. Best is trial 84 with value: 0.23092156937785976.
[I 2023-12-26 21:47:38,870] Trial 56 finished with value: inf and parameters: {'model_name': 'GAIN', 'batch_size': 292, 'hint_rate': 0.19, 'alpha': 22, 'iterations': 13798}. Best is trial 84 with value: 0.23092156937785976.
[I 2023-12-26 21:47:44,149] Trial 184 finished with value: 0.3661633671023722 and parameters: {'model_name': 'SimpleImputer', 'strategy': 'constant'}. Best is trial 84 with value: 0.23092156937785976.
[I 2023-12-26 21:47:50,949] Trial 148 finished with value: 0.23092759240829114 and parameters: {'model_name': 'IterativeImputer', 'sample_posterior': False, 'initial_strategy': 'constant', 'imputation_order': 'arabic'}. Best is trial 84 with value: 0.23092156937785976.
[I 2023-12-26 21:48:01,680] Trial 149 finished with value: 0.23092759240829114 and parameters: {'model_name': 'IterativeImputer', 'sample_posterior': False, 'initial_strategy': 'constant', 'imputation_order': 'arabic'}. Best is trial 84 with value: 0.23092156937785976.
[I 2023-12-26 21:48:06,964] Trial 151 finished with value: 0.23092759240829114 and parameters: {'model_name': 'IterativeImputer', 'sample_posterior': False, 'initial_strategy': 'constant', 'imputation_order': 'arabic'}. Best is trial 84 with value: 0.23092156937785976.
[I 2023-12-26 21:48:16,461] Trial 150 finished with value: 0.23092759240829114 and parameters: {'model_name': 'IterativeImputer', 'sample_posterior': False, 'initial_strategy': 'constant', 'imputation_order': 'arabic'}. Best is trial 84 with value: 0.23092156937785976.
[I 2023-12-26 21:48:53,495] Trial 152 finished with value: 0.23092759240829114 and parameters: {'model_name': 'IterativeImputer', 'sample_posterior': False, 'initial_strategy': 'constant', 'imputation_order': 'arabic'}. Best is trial 84 with value: 0.23092156937785976.
[I 2023-12-26 21:48:58,171] Trial 153 finished with value: 0.23092759240829114 and parameters: {'model_name': 'IterativeImputer', 'sample_posterior': False, 'initial_strategy': 'constant', 'imputation_order': 'arabic'}. Best is trial 84 with value: 0.23092156937785976.
[I 2023-12-26 21:49:53,423] Trial 154 finished with value: 0.23092759240829114 and parameters: {'model_name': 'IterativeImputer', 'sample_posterior': False, 'initial_strategy': 'constant', 'imputation_order': 'arabic'}. Best is trial 84 with value: 0.23092156937785976.
[I 2023-12-26 21:49:56,737] Trial 155 finished with value: 0.23092759240829114 and parameters: {'model_name': 'IterativeImputer', 'sample_posterior': False, 'initial_strategy': 'constant', 'imputation_order': 'arabic'}. Best is trial 84 with value: 0.23092156937785976.
[I 2023-12-26 21:51:18,959] Trial 157 finished with value: 0.23092759240829114 and parameters: {'model_name': 'IterativeImputer', 'sample_posterior': False, 'initial_strategy': 'constant', 'imputation_order': 'arabic'}. Best is trial 84 with value: 0.23092156937785976.
[I 2023-12-26 21:51:30,794] Trial 113 finished with value: 0.32958205957913755 and parameters: {'model_name': 'IterativeImputer', 'sample_posterior': True, 'initial_strategy': 'constant', 'imputation_order': 'arabic'}. Best is trial 84 with value: 0.23092156937785976.
[I 2023-12-26 21:52:18,531] Trial 158 finished with value: 0.23092759240829114 and parameters: {'model_name': 'IterativeImputer', 'sample_posterior': False, 'initial_strategy': 'constant', 'imputation_order': 'arabic'}. Best is trial 84 with value: 0.23092156937785976.
[I 2023-12-26 21:52:50,542] Trial 159 finished with value: 0.23092759240829114 and parameters: {'model_name': 'IterativeImputer', 'sample_posterior': False, 'initial_strategy': 'constant', 'imputation_order': 'arabic'}. Best is trial 84 with value: 0.23092156937785976.
[I 2023-12-26 21:53:07,220] Trial 160 finished with value: 0.23092759240829114 and parameters: {'model_name': 'IterativeImputer', 'sample_posterior': False, 'initial_strategy': 'constant', 'imputation_order': 'arabic'}. Best is trial 84 with value: 0.23092156937785976.
[I 2023-12-26 21:53:11,623] Trial 161 finished with value: 0.23092759240829114 and parameters: {'model_name': 'IterativeImputer', 'sample_posterior': False, 'initial_strategy': 'constant', 'imputation_order': 'arabic'}. Best is trial 84 with value: 0.23092156937785976.
[I 2023-12-26 21:54:17,931] Trial 163 finished with value: 0.23092759240829114 and parameters: {'model_name': 'IterativeImputer', 'sample_posterior': False, 'initial_strategy': 'constant', 'imputation_order': 'arabic'}. Best is trial 84 with value: 0.23092156937785976.
[I 2023-12-26 21:54:24,014] Trial 162 finished with value: 0.23092759240829114 and parameters: {'model_name': 'IterativeImputer', 'sample_posterior': False, 'initial_strategy': 'constant', 'imputation_order': 'arabic'}. Best is trial 84 with value: 0.23092156937785976.
[I 2023-12-26 21:54:45,097] Trial 114 finished with value: 0.32967361342804324 and parameters: {'model_name': 'IterativeImputer', 'sample_posterior': True, 'initial_strategy': 'constant', 'imputation_order': 'arabic'}. Best is trial 84 with value: 0.23092156937785976.
[I 2023-12-26 21:54:52,993] Trial 164 finished with value: 0.23092759240829114 and parameters: {'model_name': 'IterativeImputer', 'sample_posterior': False, 'initial_strategy': 'constant', 'imputation_order': 'arabic'}. Best is trial 84 with value: 0.23092156937785976.
[I 2023-12-26 21:58:24,791] Trial 165 finished with value: 0.23092759240829114 and parameters: {'model_name': 'IterativeImputer', 'sample_posterior': False, 'initial_strategy': 'constant', 'imputation_order': 'arabic'}. Best is trial 84 with value: 0.23092156937785976.
[I 2023-12-26 21:59:03,258] Trial 70 finished with value: inf and parameters: {'model_name': 'GAIN', 'batch_size': 521, 'hint_rate': 0.11, 'alpha': 66, 'iterations': 14318}. Best is trial 84 with value: 0.23092156937785976.
[I 2023-12-26 22:00:48,435] Trial 166 finished with value: 0.23092759240829114 and parameters: {'model_name': 'IterativeImputer', 'sample_posterior': False, 'initial_strategy': 'constant', 'imputation_order': 'arabic'}. Best is trial 84 with value: 0.23092156937785976.
[I 2023-12-26 22:01:18,459] Trial 167 finished with value: 0.23092759240829114 and parameters: {'model_name': 'IterativeImputer', 'sample_posterior': False, 'initial_strategy': 'constant', 'imputation_order': 'arabic'}. Best is trial 84 with value: 0.23092156937785976.
[I 2023-12-26 22:02:29,809] Trial 115 finished with value: 0.3286012933321904 and parameters: {'model_name': 'IterativeImputer', 'sample_posterior': True, 'initial_strategy': 'constant', 'imputation_order': 'arabic'}. Best is trial 84 with value: 0.23092156937785976.
[I 2023-12-26 22:05:03,619] Trial 168 finished with value: 0.23092759240829114 and parameters: {'model_name': 'IterativeImputer', 'sample_posterior': False, 'initial_strategy': 'constant', 'imputation_order': 'arabic'}. Best is trial 84 with value: 0.23092156937785976.
[I 2023-12-26 22:07:49,937] Trial 169 finished with value: 0.23092759240829114 and parameters: {'model_name': 'IterativeImputer', 'sample_posterior': False, 'initial_strategy': 'constant', 'imputation_order': 'arabic'}. Best is trial 84 with value: 0.23092156937785976.
[I 2023-12-26 22:07:56,631] Trial 170 finished with value: 0.23092759240829114 and parameters: {'model_name': 'IterativeImputer', 'sample_posterior': False, 'initial_strategy': 'constant', 'imputation_order': 'arabic'}. Best is trial 84 with value: 0.23092156937785976.
[I 2023-12-26 22:08:15,543] Trial 171 finished with value: 0.23092759240829114 and parameters: {'model_name': 'IterativeImputer', 'sample_posterior': False, 'initial_strategy': 'constant', 'imputation_order': 'arabic'}. Best is trial 84 with value: 0.23092156937785976.
[I 2023-12-26 22:09:04,689] Trial 172 finished with value: 0.23092759240829114 and parameters: {'model_name': 'IterativeImputer', 'sample_posterior': False, 'initial_strategy': 'constant', 'imputation_order': 'arabic'}. Best is trial 84 with value: 0.23092156937785976.
