[I 2024-01-06 16:03:59,590] Trial 119 finished with value: 1273.86068013344 and parameters: {'model_name': 'SimpleImputer', 'strategy': 'mean'}. Best is trial 0 with value: 1273.86068013344.
[I 2024-01-06 16:03:59,954] Trial 82 finished with value: 1281.9749525443335 and parameters: {'model_name': 'SimpleImputer', 'strategy': 'most_frequent'}. Best is trial 0 with value: 1273.86068013344.
[I 2024-01-06 16:04:00,361] Trial 92 finished with value: 1281.9749525443335 and parameters: {'model_name': 'SimpleImputer', 'strategy': 'most_frequent'}. Best is trial 0 with value: 1273.86068013344.
[I 2024-01-06 16:04:00,599] Trial 120 finished with value: 1273.86068013344 and parameters: {'model_name': 'SimpleImputer', 'strategy': 'mean'}. Best is trial 0 with value: 1273.86068013344.
[I 2024-01-06 16:04:00,845] Trial 83 finished with value: 1281.9749525443335 and parameters: {'model_name': 'SimpleImputer', 'strategy': 'most_frequent'}. Best is trial 0 with value: 1273.86068013344.
[I 2024-01-06 16:04:01,042] Trial 122 finished with value: 1273.86068013344 and parameters: {'model_name': 'SimpleImputer', 'strategy': 'mean'}. Best is trial 0 with value: 1273.86068013344.
[I 2024-01-06 16:04:01,352] Trial 123 finished with value: 1273.86068013344 and parameters: {'model_name': 'SimpleImputer', 'strategy': 'mean'}. Best is trial 0 with value: 1273.86068013344.
[I 2024-01-06 16:04:01,627] Trial 97 finished with value: 1281.9749525443335 and parameters: {'model_name': 'SimpleImputer', 'strategy': 'most_frequent'}. Best is trial 0 with value: 1273.86068013344.
[I 2024-01-06 16:04:01,857] Trial 125 finished with value: 1273.86068013344 and parameters: {'model_name': 'SimpleImputer', 'strategy': 'mean'}. Best is trial 0 with value: 1273.86068013344.
[I 2024-01-06 16:04:02,063] Trial 124 finished with value: 1273.86068013344 and parameters: {'model_name': 'SimpleImputer', 'strategy': 'mean'}. Best is trial 0 with value: 1273.86068013344.
[I 2024-01-06 16:04:02,427] Trial 89 finished with value: 1281.9749525443335 and parameters: {'model_name': 'SimpleImputer', 'strategy': 'most_frequent'}. Best is trial 0 with value: 1273.86068013344.
[I 2024-01-06 16:04:02,647] Trial 98 finished with value: 1281.9749525443335 and parameters: {'model_name': 'SimpleImputer', 'strategy': 'most_frequent'}. Best is trial 0 with value: 1273.86068013344.
[I 2024-01-06 16:04:02,858] Trial 90 finished with value: 1281.9749525443335 and parameters: {'model_name': 'SimpleImputer', 'strategy': 'most_frequent'}. Best is trial 0 with value: 1273.86068013344.
[I 2024-01-06 16:04:03,047] Trial 102 finished with value: 1281.9749525443335 and parameters: {'model_name': 'SimpleImputer', 'strategy': 'most_frequent'}. Best is trial 0 with value: 1273.86068013344.
[I 2024-01-06 16:04:03,376] Trial 121 finished with value: 1273.86068013344 and parameters: {'model_name': 'SimpleImputer', 'strategy': 'mean'}. Best is trial 0 with value: 1273.86068013344.
[I 2024-01-06 16:04:03,605] Trial 95 finished with value: 1281.9749525443335 and parameters: {'model_name': 'SimpleImputer', 'strategy': 'most_frequent'}. Best is trial 0 with value: 1273.86068013344.
[I 2024-01-06 16:04:03,789] Trial 126 finished with value: 1273.86068013344 and parameters: {'model_name': 'SimpleImputer', 'strategy': 'mean'}. Best is trial 0 with value: 1273.86068013344.
[I 2024-01-06 16:04:04,098] Trial 127 finished with value: 1273.86068013344 and parameters: {'model_name': 'SimpleImputer', 'strategy': 'mean'}. Best is trial 0 with value: 1273.86068013344.
[I 2024-01-06 16:04:04,293] Trial 129 finished with value: 1273.86068013344 and parameters: {'model_name': 'SimpleImputer', 'strategy': 'mean'}. Best is trial 0 with value: 1273.86068013344.
[I 2024-01-06 16:04:04,530] Trial 93 finished with value: 1281.9749525443335 and parameters: {'model_name': 'SimpleImputer', 'strategy': 'most_frequent'}. Best is trial 0 with value: 1273.86068013344.
[I 2024-01-06 16:04:04,809] Trial 128 finished with value: 1273.86068013344 and parameters: {'model_name': 'SimpleImputer', 'strategy': 'mean'}. Best is trial 0 with value: 1273.86068013344.
[I 2024-01-06 16:04:05,152] Trial 130 finished with value: 1273.86068013344 and parameters: {'model_name': 'SimpleImputer', 'strategy': 'mean'}. Best is trial 0 with value: 1273.86068013344.
[I 2024-01-06 16:04:05,466] Trial 133 finished with value: 1273.86068013344 and parameters: {'model_name': 'SimpleImputer', 'strategy': 'mean'}. Best is trial 0 with value: 1273.86068013344.
[I 2024-01-06 16:04:05,718] Trial 134 finished with value: 1273.86068013344 and parameters: {'model_name': 'SimpleImputer', 'strategy': 'mean'}. Best is trial 0 with value: 1273.86068013344.
[I 2024-01-06 16:04:05,955] Trial 132 finished with value: 1273.86068013344 and parameters: {'model_name': 'SimpleImputer', 'strategy': 'mean'}. Best is trial 0 with value: 1273.86068013344.
[I 2024-01-06 16:04:06,245] Trial 139 finished with value: 1273.86068013344 and parameters: {'model_name': 'SimpleImputer', 'strategy': 'mean'}. Best is trial 0 with value: 1273.86068013344.
[I 2024-01-06 16:04:06,492] Trial 131 finished with value: 1273.86068013344 and parameters: {'model_name': 'SimpleImputer', 'strategy': 'mean'}. Best is trial 0 with value: 1273.86068013344.
[I 2024-01-06 16:04:06,759] Trial 135 finished with value: 1273.86068013344 and parameters: {'model_name': 'SimpleImputer', 'strategy': 'mean'}. Best is trial 0 with value: 1273.86068013344.
[I 2024-01-06 16:04:07,242] Trial 143 finished with value: 1273.86068013344 and parameters: {'model_name': 'SimpleImputer', 'strategy': 'mean'}. Best is trial 0 with value: 1273.86068013344.
[I 2024-01-06 16:04:07,486] Trial 103 finished with value: 1281.9749525443335 and parameters: {'model_name': 'SimpleImputer', 'strategy': 'most_frequent'}. Best is trial 0 with value: 1273.86068013344.
[I 2024-01-06 16:04:07,780] Trial 138 finished with value: 1273.86068013344 and parameters: {'model_name': 'SimpleImputer', 'strategy': 'mean'}. Best is trial 0 with value: 1273.86068013344.
[I 2024-01-06 16:04:08,108] Trial 137 finished with value: 1273.86068013344 and parameters: {'model_name': 'SimpleImputer', 'strategy': 'mean'}. Best is trial 0 with value: 1273.86068013344.
[I 2024-01-06 16:04:08,362] Trial 144 finished with value: 1273.86068013344 and parameters: {'model_name': 'SimpleImputer', 'strategy': 'mean'}. Best is trial 0 with value: 1273.86068013344.
[I 2024-01-06 16:04:08,604] Trial 96 finished with value: 1281.9749525443335 and parameters: {'model_name': 'SimpleImputer', 'strategy': 'most_frequent'}. Best is trial 0 with value: 1273.86068013344.
[I 2024-01-06 16:04:08,853] Trial 146 finished with value: 1273.86068013344 and parameters: {'model_name': 'SimpleImputer', 'strategy': 'mean'}. Best is trial 0 with value: 1273.86068013344.
[I 2024-01-06 16:04:09,095] Trial 140 finished with value: 1273.86068013344 and parameters: {'model_name': 'SimpleImputer', 'strategy': 'mean'}. Best is trial 0 with value: 1273.86068013344.
[I 2024-01-06 16:04:09,299] Trial 142 finished with value: 1273.86068013344 and parameters: {'model_name': 'SimpleImputer', 'strategy': 'mean'}. Best is trial 0 with value: 1273.86068013344.
[I 2024-01-06 16:04:09,591] Trial 141 finished with value: 1273.86068013344 and parameters: {'model_name': 'SimpleImputer', 'strategy': 'mean'}. Best is trial 0 with value: 1273.86068013344.
[I 2024-01-06 16:04:09,885] Trial 145 finished with value: 1273.86068013344 and parameters: {'model_name': 'SimpleImputer', 'strategy': 'mean'}. Best is trial 0 with value: 1273.86068013344.
[I 2024-01-06 16:04:10,156] Trial 136 finished with value: 1273.86068013344 and parameters: {'model_name': 'SimpleImputer', 'strategy': 'mean'}. Best is trial 0 with value: 1273.86068013344.
[I 2024-01-06 16:04:10,352] Trial 100 finished with value: 1281.9749525443335 and parameters: {'model_name': 'SimpleImputer', 'strategy': 'most_frequent'}. Best is trial 0 with value: 1273.86068013344.
[I 2024-01-06 16:04:10,528] Trial 150 finished with value: 1273.86068013344 and parameters: {'model_name': 'SimpleImputer', 'strategy': 'mean'}. Best is trial 0 with value: 1273.86068013344.
[I 2024-01-06 16:04:10,875] Trial 147 finished with value: 1273.86068013344 and parameters: {'model_name': 'SimpleImputer', 'strategy': 'mean'}. Best is trial 0 with value: 1273.86068013344.
[I 2024-01-06 16:04:11,161] Trial 149 finished with value: 1273.86068013344 and parameters: {'model_name': 'SimpleImputer', 'strategy': 'mean'}. Best is trial 0 with value: 1273.86068013344.
[I 2024-01-06 16:04:11,404] Trial 155 finished with value: 1273.86068013344 and parameters: {'model_name': 'SimpleImputer', 'strategy': 'mean'}. Best is trial 0 with value: 1273.86068013344.
[I 2024-01-06 16:04:11,626] Trial 153 finished with value: 1273.86068013344 and parameters: {'model_name': 'SimpleImputer', 'strategy': 'mean'}. Best is trial 0 with value: 1273.86068013344.
[I 2024-01-06 16:04:11,871] Trial 148 finished with value: 1273.86068013344 and parameters: {'model_name': 'SimpleImputer', 'strategy': 'mean'}. Best is trial 0 with value: 1273.86068013344.
[I 2024-01-06 16:04:12,070] Trial 160 finished with value: 1273.86068013344 and parameters: {'model_name': 'SimpleImputer', 'strategy': 'mean'}. Best is trial 0 with value: 1273.86068013344.
[I 2024-01-06 16:04:12,475] Trial 158 finished with value: 1273.86068013344 and parameters: {'model_name': 'SimpleImputer', 'strategy': 'mean'}. Best is trial 0 with value: 1273.86068013344.
[I 2024-01-06 16:04:12,659] Trial 154 finished with value: 1273.86068013344 and parameters: {'model_name': 'SimpleImputer', 'strategy': 'mean'}. Best is trial 0 with value: 1273.86068013344.
[I 2024-01-06 16:04:12,895] Trial 101 finished with value: 1281.9749525443335 and parameters: {'model_name': 'SimpleImputer', 'strategy': 'most_frequent'}. Best is trial 0 with value: 1273.86068013344.
[I 2024-01-06 16:04:13,162] Trial 161 finished with value: 1273.86068013344 and parameters: {'model_name': 'SimpleImputer', 'strategy': 'mean'}. Best is trial 0 with value: 1273.86068013344.
[I 2024-01-06 16:04:13,409] Trial 151 finished with value: 1273.86068013344 and parameters: {'model_name': 'SimpleImputer', 'strategy': 'mean'}. Best is trial 0 with value: 1273.86068013344.
[I 2024-01-06 16:04:13,693] Trial 156 finished with value: 1273.86068013344 and parameters: {'model_name': 'SimpleImputer', 'strategy': 'mean'}. Best is trial 0 with value: 1273.86068013344.
[I 2024-01-06 16:04:13,955] Trial 167 finished with value: 1273.86068013344 and parameters: {'model_name': 'SimpleImputer', 'strategy': 'mean'}. Best is trial 0 with value: 1273.86068013344.
[I 2024-01-06 16:04:14,231] Trial 157 finished with value: 1273.86068013344 and parameters: {'model_name': 'SimpleImputer', 'strategy': 'mean'}. Best is trial 0 with value: 1273.86068013344.
[I 2024-01-06 16:04:14,518] Trial 152 finished with value: 1273.86068013344 and parameters: {'model_name': 'SimpleImputer', 'strategy': 'mean'}. Best is trial 0 with value: 1273.86068013344.
[I 2024-01-06 16:04:14,791] Trial 164 finished with value: 1273.86068013344 and parameters: {'model_name': 'SimpleImputer', 'strategy': 'mean'}. Best is trial 0 with value: 1273.86068013344.
[I 2024-01-06 16:04:15,055] Trial 168 finished with value: 1273.86068013344 and parameters: {'model_name': 'SimpleImputer', 'strategy': 'mean'}. Best is trial 0 with value: 1273.86068013344.
[I 2024-01-06 16:04:15,368] Trial 165 finished with value: 1273.86068013344 and parameters: {'model_name': 'SimpleImputer', 'strategy': 'mean'}. Best is trial 0 with value: 1273.86068013344.
[I 2024-01-06 16:04:15,555] Trial 104 finished with value: 1281.9749525443335 and parameters: {'model_name': 'SimpleImputer', 'strategy': 'most_frequent'}. Best is trial 0 with value: 1273.86068013344.
[I 2024-01-06 16:04:15,765] Trial 169 finished with value: 1273.86068013344 and parameters: {'model_name': 'SimpleImputer', 'strategy': 'mean'}. Best is trial 0 with value: 1273.86068013344.
[I 2024-01-06 16:04:15,955] Trial 159 finished with value: 1273.86068013344 and parameters: {'model_name': 'SimpleImputer', 'strategy': 'mean'}. Best is trial 0 with value: 1273.86068013344.
[I 2024-01-06 16:04:16,148] Trial 166 finished with value: 1273.86068013344 and parameters: {'model_name': 'SimpleImputer', 'strategy': 'mean'}. Best is trial 0 with value: 1273.86068013344.
[I 2024-01-06 16:04:16,377] Trial 171 finished with value: 1273.86068013344 and parameters: {'model_name': 'SimpleImputer', 'strategy': 'mean'}. Best is trial 0 with value: 1273.86068013344.
[I 2024-01-06 16:04:16,604] Trial 163 finished with value: 1273.86068013344 and parameters: {'model_name': 'SimpleImputer', 'strategy': 'mean'}. Best is trial 0 with value: 1273.86068013344.
[I 2024-01-06 16:04:16,886] Trial 162 finished with value: 1273.86068013344 and parameters: {'model_name': 'SimpleImputer', 'strategy': 'mean'}. Best is trial 0 with value: 1273.86068013344.
[I 2024-01-06 16:04:17,177] Trial 174 finished with value: 1273.86068013344 and parameters: {'model_name': 'SimpleImputer', 'strategy': 'mean'}. Best is trial 0 with value: 1273.86068013344.
[I 2024-01-06 16:04:17,400] Trial 173 finished with value: 1273.86068013344 and parameters: {'model_name': 'SimpleImputer', 'strategy': 'mean'}. Best is trial 0 with value: 1273.86068013344.
[I 2024-01-06 16:04:17,642] Trial 170 finished with value: 1273.86068013344 and parameters: {'model_name': 'SimpleImputer', 'strategy': 'mean'}. Best is trial 0 with value: 1273.86068013344.
[I 2024-01-06 16:04:17,899] Trial 172 finished with value: 1273.86068013344 and parameters: {'model_name': 'SimpleImputer', 'strategy': 'mean'}. Best is trial 0 with value: 1273.86068013344.
[I 2024-01-06 16:04:18,160] Trial 176 finished with value: 1273.86068013344 and parameters: {'model_name': 'SimpleImputer', 'strategy': 'mean'}. Best is trial 0 with value: 1273.86068013344.
[I 2024-01-06 16:04:18,398] Trial 105 finished with value: 1281.9749525443335 and parameters: {'model_name': 'SimpleImputer', 'strategy': 'most_frequent'}. Best is trial 0 with value: 1273.86068013344.
[I 2024-01-06 16:04:18,679] Trial 177 finished with value: 1273.86068013344 and parameters: {'model_name': 'SimpleImputer', 'strategy': 'mean'}. Best is trial 0 with value: 1273.86068013344.
[I 2024-01-06 16:04:18,997] Trial 175 finished with value: 1273.86068013344 and parameters: {'model_name': 'SimpleImputer', 'strategy': 'mean'}. Best is trial 0 with value: 1273.86068013344.
[I 2024-01-06 16:04:19,191] Trial 179 finished with value: 1273.86068013344 and parameters: {'model_name': 'SimpleImputer', 'strategy': 'mean'}. Best is trial 0 with value: 1273.86068013344.
[I 2024-01-06 16:04:19,427] Trial 178 finished with value: 1273.86068013344 and parameters: {'model_name': 'SimpleImputer', 'strategy': 'mean'}. Best is trial 0 with value: 1273.86068013344.
[I 2024-01-06 16:04:19,615] Trial 180 finished with value: 1273.86068013344 and parameters: {'model_name': 'SimpleImputer', 'strategy': 'mean'}. Best is trial 0 with value: 1273.86068013344.
[I 2024-01-06 16:04:19,863] Trial 183 finished with value: 1273.86068013344 and parameters: {'model_name': 'SimpleImputer', 'strategy': 'mean'}. Best is trial 0 with value: 1273.86068013344.
[I 2024-01-06 16:04:20,050] Trial 185 finished with value: 1273.86068013344 and parameters: {'model_name': 'SimpleImputer', 'strategy': 'mean'}. Best is trial 0 with value: 1273.86068013344.
[I 2024-01-06 16:04:20,299] Trial 184 finished with value: 1273.86068013344 and parameters: {'model_name': 'SimpleImputer', 'strategy': 'mean'}. Best is trial 0 with value: 1273.86068013344.
[I 2024-01-06 16:04:20,553] Trial 182 finished with value: 1273.86068013344 and parameters: {'model_name': 'SimpleImputer', 'strategy': 'mean'}. Best is trial 0 with value: 1273.86068013344.
[I 2024-01-06 16:04:20,753] Trial 193 finished with value: 1273.86068013344 and parameters: {'model_name': 'SimpleImputer', 'strategy': 'mean'}. Best is trial 0 with value: 1273.86068013344.
[I 2024-01-06 16:04:20,988] Trial 187 finished with value: 1273.86068013344 and parameters: {'model_name': 'SimpleImputer', 'strategy': 'mean'}. Best is trial 0 with value: 1273.86068013344.
[I 2024-01-06 16:04:21,258] Trial 186 finished with value: 1273.86068013344 and parameters: {'model_name': 'SimpleImputer', 'strategy': 'mean'}. Best is trial 0 with value: 1273.86068013344.
[I 2024-01-06 16:04:21,461] Trial 192 finished with value: 1273.86068013344 and parameters: {'model_name': 'SimpleImputer', 'strategy': 'mean'}. Best is trial 0 with value: 1273.86068013344.
[I 2024-01-06 16:04:21,654] Trial 189 finished with value: 1273.86068013344 and parameters: {'model_name': 'SimpleImputer', 'strategy': 'mean'}. Best is trial 0 with value: 1273.86068013344.
[I 2024-01-06 16:04:21,835] Trial 188 finished with value: 1273.86068013344 and parameters: {'model_name': 'SimpleImputer', 'strategy': 'mean'}. Best is trial 0 with value: 1273.86068013344.
[I 2024-01-06 16:04:22,062] Trial 181 finished with value: 1273.86068013344 and parameters: {'model_name': 'SimpleImputer', 'strategy': 'mean'}. Best is trial 0 with value: 1273.86068013344.
[I 2024-01-06 16:04:22,279] Trial 190 finished with value: 1273.86068013344 and parameters: {'model_name': 'SimpleImputer', 'strategy': 'mean'}. Best is trial 0 with value: 1273.86068013344.
[I 2024-01-06 16:04:22,499] Trial 196 finished with value: 1273.86068013344 and parameters: {'model_name': 'SimpleImputer', 'strategy': 'mean'}. Best is trial 0 with value: 1273.86068013344.
[I 2024-01-06 16:04:22,692] Trial 195 finished with value: 1273.86068013344 and parameters: {'model_name': 'SimpleImputer', 'strategy': 'mean'}. Best is trial 0 with value: 1273.86068013344.
[I 2024-01-06 16:04:22,883] Trial 194 finished with value: 1273.86068013344 and parameters: {'model_name': 'SimpleImputer', 'strategy': 'mean'}. Best is trial 0 with value: 1273.86068013344.
[I 2024-01-06 16:04:23,110] Trial 191 finished with value: 1273.86068013344 and parameters: {'model_name': 'SimpleImputer', 'strategy': 'mean'}. Best is trial 0 with value: 1273.86068013344.
[I 2024-01-06 16:04:23,325] Trial 106 finished with value: 1281.9749525443335 and parameters: {'model_name': 'SimpleImputer', 'strategy': 'most_frequent'}. Best is trial 0 with value: 1273.86068013344.
[I 2024-01-06 16:04:23,327] Trial 198 finished with value: 1273.86068013344 and parameters: {'model_name': 'SimpleImputer', 'strategy': 'mean'}. Best is trial 0 with value: 1273.86068013344.
[I 2024-01-06 16:04:23,789] Trial 199 finished with value: 1273.86068013344 and parameters: {'model_name': 'SimpleImputer', 'strategy': 'mean'}. Best is trial 0 with value: 1273.86068013344.
[I 2024-01-06 16:04:23,992] Trial 109 finished with value: 1281.9749525443335 and parameters: {'model_name': 'SimpleImputer', 'strategy': 'most_frequent'}. Best is trial 0 with value: 1273.86068013344.
[I 2024-01-06 16:04:24,221] Trial 197 finished with value: 1273.86068013344 and parameters: {'model_name': 'SimpleImputer', 'strategy': 'mean'}. Best is trial 0 with value: 1273.86068013344.
[I 2024-01-06 16:04:24,421] Trial 107 finished with value: 1281.9749525443335 and parameters: {'model_name': 'SimpleImputer', 'strategy': 'most_frequent'}. Best is trial 0 with value: 1273.86068013344.
