[I 2023-12-21 20:30:18,159] Trial 114 finished with value: 0.27178497952509645 and parameters: {'model_name': 'SimpleImputer', 'strategy': 'mean'}. Best is trial 8 with value: 0.27178497952509645.
[I 2023-12-21 20:30:18,706] Trial 117 finished with value: 0.27178497952509645 and parameters: {'model_name': 'SimpleImputer', 'strategy': 'mean'}. Best is trial 8 with value: 0.27178497952509645.
[I 2023-12-21 20:30:18,708] Trial 90 finished with value: 0.36235917245763943 and parameters: {'model_name': 'SimpleImputer', 'strategy': 'most_frequent'}. Best is trial 8 with value: 0.27178497952509645.
[I 2023-12-21 20:30:19,324] Trial 93 finished with value: 0.36235917245763943 and parameters: {'model_name': 'SimpleImputer', 'strategy': 'most_frequent'}. Best is trial 8 with value: 0.27178497952509645.
[I 2023-12-21 20:30:19,822] Trial 95 finished with value: 0.36235917245763943 and parameters: {'model_name': 'SimpleImputer', 'strategy': 'most_frequent'}. Best is trial 8 with value: 0.27178497952509645.
[I 2023-12-21 20:30:20,109] Trial 94 finished with value: 0.36235917245763943 and parameters: {'model_name': 'SimpleImputer', 'strategy': 'most_frequent'}. Best is trial 8 with value: 0.27178497952509645.
[I 2023-12-21 20:30:20,355] Trial 91 finished with value: 0.36235917245763943 and parameters: {'model_name': 'SimpleImputer', 'strategy': 'most_frequent'}. Best is trial 8 with value: 0.27178497952509645.
[I 2023-12-21 20:30:20,672] Trial 124 finished with value: 0.27178497952509645 and parameters: {'model_name': 'SimpleImputer', 'strategy': 'mean'}. Best is trial 8 with value: 0.27178497952509645.
[I 2023-12-21 20:30:20,941] Trial 121 finished with value: 0.27178497952509645 and parameters: {'model_name': 'SimpleImputer', 'strategy': 'mean'}. Best is trial 8 with value: 0.27178497952509645.
[I 2023-12-21 20:30:21,115] Trial 118 finished with value: 0.27178497952509645 and parameters: {'model_name': 'SimpleImputer', 'strategy': 'mean'}. Best is trial 8 with value: 0.27178497952509645.
[I 2023-12-21 20:30:21,270] Trial 92 finished with value: 0.36235917245763943 and parameters: {'model_name': 'SimpleImputer', 'strategy': 'most_frequent'}. Best is trial 8 with value: 0.27178497952509645.
[I 2023-12-21 20:30:21,510] Trial 120 finished with value: 0.27178497952509645 and parameters: {'model_name': 'SimpleImputer', 'strategy': 'mean'}. Best is trial 8 with value: 0.27178497952509645.
[I 2023-12-21 20:30:21,747] Trial 122 finished with value: 0.27178497952509645 and parameters: {'model_name': 'SimpleImputer', 'strategy': 'mean'}. Best is trial 8 with value: 0.27178497952509645.
[I 2023-12-21 20:30:21,968] Trial 126 finished with value: 0.27178497952509645 and parameters: {'model_name': 'SimpleImputer', 'strategy': 'mean'}. Best is trial 8 with value: 0.27178497952509645.
[I 2023-12-21 20:30:22,147] Trial 119 finished with value: 0.27178497952509645 and parameters: {'model_name': 'SimpleImputer', 'strategy': 'mean'}. Best is trial 8 with value: 0.27178497952509645.
[I 2023-12-21 20:30:22,484] Trial 133 finished with value: 0.27178497952509645 and parameters: {'model_name': 'SimpleImputer', 'strategy': 'mean'}. Best is trial 8 with value: 0.27178497952509645.
[I 2023-12-21 20:30:22,738] Trial 129 finished with value: 0.27178497952509645 and parameters: {'model_name': 'SimpleImputer', 'strategy': 'mean'}. Best is trial 8 with value: 0.27178497952509645.
[I 2023-12-21 20:30:23,008] Trial 130 finished with value: 0.27178497952509645 and parameters: {'model_name': 'SimpleImputer', 'strategy': 'mean'}. Best is trial 8 with value: 0.27178497952509645.
[I 2023-12-21 20:30:23,296] Trial 137 finished with value: 0.27178497952509645 and parameters: {'model_name': 'SimpleImputer', 'strategy': 'mean'}. Best is trial 8 with value: 0.27178497952509645.
[I 2023-12-21 20:30:23,497] Trial 99 finished with value: 0.36235917245763943 and parameters: {'model_name': 'SimpleImputer', 'strategy': 'most_frequent'}. Best is trial 8 with value: 0.27178497952509645.
[I 2023-12-21 20:30:23,826] Trial 128 finished with value: 0.27178497952509645 and parameters: {'model_name': 'SimpleImputer', 'strategy': 'mean'}. Best is trial 8 with value: 0.27178497952509645.
[I 2023-12-21 20:30:24,096] Trial 123 finished with value: 0.27178497952509645 and parameters: {'model_name': 'SimpleImputer', 'strategy': 'mean'}. Best is trial 8 with value: 0.27178497952509645.
[I 2023-12-21 20:30:24,382] Trial 131 finished with value: 0.27178497952509645 and parameters: {'model_name': 'SimpleImputer', 'strategy': 'mean'}. Best is trial 8 with value: 0.27178497952509645.
[I 2023-12-21 20:30:24,554] Trial 125 finished with value: 0.27178497952509645 and parameters: {'model_name': 'SimpleImputer', 'strategy': 'mean'}. Best is trial 8 with value: 0.27178497952509645.
[I 2023-12-21 20:30:24,813] Trial 97 finished with value: 0.36235917245763943 and parameters: {'model_name': 'SimpleImputer', 'strategy': 'most_frequent'}. Best is trial 8 with value: 0.27178497952509645.
[I 2023-12-21 20:30:24,997] Trial 132 finished with value: 0.27178497952509645 and parameters: {'model_name': 'SimpleImputer', 'strategy': 'mean'}. Best is trial 8 with value: 0.27178497952509645.
[I 2023-12-21 20:30:25,198] Trial 127 finished with value: 0.27178497952509645 and parameters: {'model_name': 'SimpleImputer', 'strategy': 'mean'}. Best is trial 8 with value: 0.27178497952509645.
[I 2023-12-21 20:30:25,463] Trial 134 finished with value: 0.27178497952509645 and parameters: {'model_name': 'SimpleImputer', 'strategy': 'mean'}. Best is trial 8 with value: 0.27178497952509645.
[I 2023-12-21 20:30:25,715] Trial 136 finished with value: 0.27178497952509645 and parameters: {'model_name': 'SimpleImputer', 'strategy': 'mean'}. Best is trial 8 with value: 0.27178497952509645.
[I 2023-12-21 20:30:25,974] Trial 103 finished with value: 0.36235917245763943 and parameters: {'model_name': 'SimpleImputer', 'strategy': 'most_frequent'}. Best is trial 8 with value: 0.27178497952509645.
[I 2023-12-21 20:30:26,194] Trial 135 finished with value: 0.27178497952509645 and parameters: {'model_name': 'SimpleImputer', 'strategy': 'mean'}. Best is trial 8 with value: 0.27178497952509645.
[I 2023-12-21 20:30:26,421] Trial 101 finished with value: 0.36235917245763943 and parameters: {'model_name': 'SimpleImputer', 'strategy': 'most_frequent'}. Best is trial 8 with value: 0.27178497952509645.
[I 2023-12-21 20:30:26,763] Trial 100 finished with value: 0.36235917245763943 and parameters: {'model_name': 'SimpleImputer', 'strategy': 'most_frequent'}. Best is trial 8 with value: 0.27178497952509645.
[I 2023-12-21 20:30:27,116] Trial 102 finished with value: 0.36235917245763943 and parameters: {'model_name': 'SimpleImputer', 'strategy': 'most_frequent'}. Best is trial 8 with value: 0.27178497952509645.
[I 2023-12-21 20:30:27,444] Trial 138 finished with value: 0.27178497952509645 and parameters: {'model_name': 'SimpleImputer', 'strategy': 'mean'}. Best is trial 8 with value: 0.27178497952509645.
[I 2023-12-21 20:30:27,908] Trial 141 finished with value: 0.27178497952509645 and parameters: {'model_name': 'SimpleImputer', 'strategy': 'mean'}. Best is trial 8 with value: 0.27178497952509645.
[I 2023-12-21 20:30:28,140] Trial 139 finished with value: 0.27178497952509645 and parameters: {'model_name': 'SimpleImputer', 'strategy': 'mean'}. Best is trial 8 with value: 0.27178497952509645.
[I 2023-12-21 20:30:28,458] Trial 142 finished with value: 0.27178497952509645 and parameters: {'model_name': 'SimpleImputer', 'strategy': 'mean'}. Best is trial 8 with value: 0.27178497952509645.
[I 2023-12-21 20:30:28,720] Trial 140 finished with value: 0.27178497952509645 and parameters: {'model_name': 'SimpleImputer', 'strategy': 'mean'}. Best is trial 8 with value: 0.27178497952509645.
[I 2023-12-21 20:30:29,007] Trial 143 finished with value: 0.27178497952509645 and parameters: {'model_name': 'SimpleImputer', 'strategy': 'mean'}. Best is trial 8 with value: 0.27178497952509645.
[I 2023-12-21 20:30:29,220] Trial 96 finished with value: 0.36235917245763943 and parameters: {'model_name': 'SimpleImputer', 'strategy': 'most_frequent'}. Best is trial 8 with value: 0.27178497952509645.
[I 2023-12-21 20:30:29,711] Trial 98 finished with value: 0.36235917245763943 and parameters: {'model_name': 'SimpleImputer', 'strategy': 'most_frequent'}. Best is trial 8 with value: 0.27178497952509645.
[I 2023-12-21 20:30:30,022] Trial 145 finished with value: 0.27178497952509645 and parameters: {'model_name': 'SimpleImputer', 'strategy': 'mean'}. Best is trial 8 with value: 0.27178497952509645.
[I 2023-12-21 20:30:30,558] Trial 146 finished with value: 0.27178497952509645 and parameters: {'model_name': 'SimpleImputer', 'strategy': 'mean'}. Best is trial 8 with value: 0.27178497952509645.
[I 2023-12-21 20:30:30,854] Trial 104 finished with value: 0.36235917245763943 and parameters: {'model_name': 'SimpleImputer', 'strategy': 'most_frequent'}. Best is trial 8 with value: 0.27178497952509645.
[I 2023-12-21 20:30:31,222] Trial 144 finished with value: 0.27178497952509645 and parameters: {'model_name': 'SimpleImputer', 'strategy': 'mean'}. Best is trial 8 with value: 0.27178497952509645.
[I 2023-12-21 20:30:31,650] Trial 148 finished with value: 0.27178497952509645 and parameters: {'model_name': 'SimpleImputer', 'strategy': 'mean'}. Best is trial 8 with value: 0.27178497952509645.
[I 2023-12-21 20:30:31,891] Trial 106 finished with value: 0.36235917245763943 and parameters: {'model_name': 'SimpleImputer', 'strategy': 'most_frequent'}. Best is trial 8 with value: 0.27178497952509645.
[I 2023-12-21 20:30:32,078] Trial 147 finished with value: 0.27178497952509645 and parameters: {'model_name': 'SimpleImputer', 'strategy': 'mean'}. Best is trial 8 with value: 0.27178497952509645.
[I 2023-12-21 20:30:32,300] Trial 154 finished with value: 0.27178497952509645 and parameters: {'model_name': 'SimpleImputer', 'strategy': 'mean'}. Best is trial 8 with value: 0.27178497952509645.
[I 2023-12-21 20:30:32,484] Trial 105 finished with value: 0.36235917245763943 and parameters: {'model_name': 'SimpleImputer', 'strategy': 'most_frequent'}. Best is trial 8 with value: 0.27178497952509645.
[I 2023-12-21 20:30:32,733] Trial 150 finished with value: 0.27178497952509645 and parameters: {'model_name': 'SimpleImputer', 'strategy': 'mean'}. Best is trial 8 with value: 0.27178497952509645.
[I 2023-12-21 20:30:32,930] Trial 149 finished with value: 0.27178497952509645 and parameters: {'model_name': 'SimpleImputer', 'strategy': 'mean'}. Best is trial 8 with value: 0.27178497952509645.
[I 2023-12-21 20:30:33,472] Trial 151 finished with value: 0.27178497952509645 and parameters: {'model_name': 'SimpleImputer', 'strategy': 'mean'}. Best is trial 8 with value: 0.27178497952509645.
[I 2023-12-21 20:30:33,657] Trial 152 finished with value: 0.27178497952509645 and parameters: {'model_name': 'SimpleImputer', 'strategy': 'mean'}. Best is trial 8 with value: 0.27178497952509645.
[I 2023-12-21 20:30:33,978] Trial 158 finished with value: 0.27178497952509645 and parameters: {'model_name': 'SimpleImputer', 'strategy': 'mean'}. Best is trial 8 with value: 0.27178497952509645.
[I 2023-12-21 20:30:34,283] Trial 156 finished with value: 0.27178497952509645 and parameters: {'model_name': 'SimpleImputer', 'strategy': 'mean'}. Best is trial 8 with value: 0.27178497952509645.
[I 2023-12-21 20:30:34,466] Trial 153 finished with value: 0.27178497952509645 and parameters: {'model_name': 'SimpleImputer', 'strategy': 'mean'}. Best is trial 8 with value: 0.27178497952509645.
[I 2023-12-21 20:30:34,787] Trial 159 finished with value: 0.27178497952509645 and parameters: {'model_name': 'SimpleImputer', 'strategy': 'mean'}. Best is trial 8 with value: 0.27178497952509645.
[I 2023-12-21 20:30:35,054] Trial 157 finished with value: 0.27178497952509645 and parameters: {'model_name': 'SimpleImputer', 'strategy': 'mean'}. Best is trial 8 with value: 0.27178497952509645.
[I 2023-12-21 20:30:35,242] Trial 160 finished with value: 0.27178497952509645 and parameters: {'model_name': 'SimpleImputer', 'strategy': 'mean'}. Best is trial 8 with value: 0.27178497952509645.
[I 2023-12-21 20:30:35,490] Trial 161 finished with value: 0.27178497952509645 and parameters: {'model_name': 'SimpleImputer', 'strategy': 'mean'}. Best is trial 8 with value: 0.27178497952509645.
[I 2023-12-21 20:30:35,785] Trial 155 finished with value: 0.27178497952509645 and parameters: {'model_name': 'SimpleImputer', 'strategy': 'mean'}. Best is trial 8 with value: 0.27178497952509645.
[I 2023-12-21 20:30:36,108] Trial 174 finished with value: 0.27178497952509645 and parameters: {'model_name': 'SimpleImputer', 'strategy': 'mean'}. Best is trial 8 with value: 0.27178497952509645.
[I 2023-12-21 20:30:36,347] Trial 171 finished with value: 0.27178497952509645 and parameters: {'model_name': 'SimpleImputer', 'strategy': 'mean'}. Best is trial 8 with value: 0.27178497952509645.
[I 2023-12-21 20:30:36,594] Trial 166 finished with value: 0.27178497952509645 and parameters: {'model_name': 'SimpleImputer', 'strategy': 'mean'}. Best is trial 8 with value: 0.27178497952509645.
[I 2023-12-21 20:30:36,820] Trial 172 finished with value: 0.27178497952509645 and parameters: {'model_name': 'SimpleImputer', 'strategy': 'mean'}. Best is trial 8 with value: 0.27178497952509645.
[I 2023-12-21 20:30:37,081] Trial 162 finished with value: 0.27178497952509645 and parameters: {'model_name': 'SimpleImputer', 'strategy': 'mean'}. Best is trial 8 with value: 0.27178497952509645.
[I 2023-12-21 20:30:37,336] Trial 165 finished with value: 0.27178497952509645 and parameters: {'model_name': 'SimpleImputer', 'strategy': 'mean'}. Best is trial 8 with value: 0.27178497952509645.
[I 2023-12-21 20:30:37,557] Trial 164 finished with value: 0.27178497952509645 and parameters: {'model_name': 'SimpleImputer', 'strategy': 'mean'}. Best is trial 8 with value: 0.27178497952509645.
[I 2023-12-21 20:30:37,757] Trial 169 finished with value: 0.27178497952509645 and parameters: {'model_name': 'SimpleImputer', 'strategy': 'mean'}. Best is trial 8 with value: 0.27178497952509645.
[I 2023-12-21 20:30:37,992] Trial 167 finished with value: 0.27178497952509645 and parameters: {'model_name': 'SimpleImputer', 'strategy': 'mean'}. Best is trial 8 with value: 0.27178497952509645.
[I 2023-12-21 20:30:38,206] Trial 107 finished with value: 0.36235917245763943 and parameters: {'model_name': 'SimpleImputer', 'strategy': 'most_frequent'}. Best is trial 8 with value: 0.27178497952509645.
[I 2023-12-21 20:30:38,489] Trial 108 finished with value: 0.36235917245763943 and parameters: {'model_name': 'SimpleImputer', 'strategy': 'most_frequent'}. Best is trial 8 with value: 0.27178497952509645.
[I 2023-12-21 20:30:38,696] Trial 163 finished with value: 0.27178497952509645 and parameters: {'model_name': 'SimpleImputer', 'strategy': 'mean'}. Best is trial 8 with value: 0.27178497952509645.
[I 2023-12-21 20:30:38,932] Trial 170 finished with value: 0.27178497952509645 and parameters: {'model_name': 'SimpleImputer', 'strategy': 'mean'}. Best is trial 8 with value: 0.27178497952509645.
[I 2023-12-21 20:30:39,178] Trial 178 finished with value: 0.27178497952509645 and parameters: {'model_name': 'SimpleImputer', 'strategy': 'mean'}. Best is trial 8 with value: 0.27178497952509645.
[I 2023-12-21 20:30:39,428] Trial 168 finished with value: 0.27178497952509645 and parameters: {'model_name': 'SimpleImputer', 'strategy': 'mean'}. Best is trial 8 with value: 0.27178497952509645.
[I 2023-12-21 20:30:39,688] Trial 175 finished with value: 0.27178497952509645 and parameters: {'model_name': 'SimpleImputer', 'strategy': 'mean'}. Best is trial 8 with value: 0.27178497952509645.
[I 2023-12-21 20:30:39,899] Trial 173 finished with value: 0.27178497952509645 and parameters: {'model_name': 'SimpleImputer', 'strategy': 'mean'}. Best is trial 8 with value: 0.27178497952509645.
[I 2023-12-21 20:30:40,116] Trial 179 finished with value: 0.27178497952509645 and parameters: {'model_name': 'SimpleImputer', 'strategy': 'mean'}. Best is trial 8 with value: 0.27178497952509645.
[I 2023-12-21 20:30:40,362] Trial 176 finished with value: 0.27178497952509645 and parameters: {'model_name': 'SimpleImputer', 'strategy': 'mean'}. Best is trial 8 with value: 0.27178497952509645.
[I 2023-12-21 20:30:40,650] Trial 177 finished with value: 0.27178497952509645 and parameters: {'model_name': 'SimpleImputer', 'strategy': 'mean'}. Best is trial 8 with value: 0.27178497952509645.
[I 2023-12-21 20:30:40,869] Trial 180 finished with value: 0.27178497952509645 and parameters: {'model_name': 'SimpleImputer', 'strategy': 'mean'}. Best is trial 8 with value: 0.27178497952509645.
[I 2023-12-21 20:30:41,106] Trial 184 finished with value: 0.27178497952509645 and parameters: {'model_name': 'SimpleImputer', 'strategy': 'mean'}. Best is trial 8 with value: 0.27178497952509645.
[I 2023-12-21 20:30:41,378] Trial 181 finished with value: 0.27178497952509645 and parameters: {'model_name': 'SimpleImputer', 'strategy': 'mean'}. Best is trial 8 with value: 0.27178497952509645.
[I 2023-12-21 20:30:41,591] Trial 182 finished with value: 0.27178497952509645 and parameters: {'model_name': 'SimpleImputer', 'strategy': 'mean'}. Best is trial 8 with value: 0.27178497952509645.
[I 2023-12-21 20:30:41,847] Trial 183 finished with value: 0.27178497952509645 and parameters: {'model_name': 'SimpleImputer', 'strategy': 'mean'}. Best is trial 8 with value: 0.27178497952509645.
[I 2023-12-21 20:30:42,128] Trial 194 finished with value: 0.40380440999919526 and parameters: {'model_name': 'SimpleImputer', 'strategy': 'constant'}. Best is trial 8 with value: 0.27178497952509645.
[I 2023-12-21 20:30:42,351] Trial 185 finished with value: 0.27178497952509645 and parameters: {'model_name': 'SimpleImputer', 'strategy': 'mean'}. Best is trial 8 with value: 0.27178497952509645.
[I 2023-12-21 20:30:42,555] Trial 186 finished with value: 0.27178497952509645 and parameters: {'model_name': 'SimpleImputer', 'strategy': 'mean'}. Best is trial 8 with value: 0.27178497952509645.
[I 2023-12-21 20:30:42,790] Trial 187 finished with value: 0.27178497952509645 and parameters: {'model_name': 'SimpleImputer', 'strategy': 'mean'}. Best is trial 8 with value: 0.27178497952509645.
[I 2023-12-21 20:30:43,036] Trial 198 finished with value: 0.40380440999919526 and parameters: {'model_name': 'SimpleImputer', 'strategy': 'constant'}. Best is trial 8 with value: 0.27178497952509645.
[I 2023-12-21 20:30:43,247] Trial 197 finished with value: 0.40380440999919526 and parameters: {'model_name': 'SimpleImputer', 'strategy': 'constant'}. Best is trial 8 with value: 0.27178497952509645.
[I 2023-12-21 20:30:43,459] Trial 191 finished with value: 0.27178497952509645 and parameters: {'model_name': 'SimpleImputer', 'strategy': 'mean'}. Best is trial 8 with value: 0.27178497952509645.
[I 2023-12-21 20:30:43,698] Trial 195 finished with value: 0.27178497952509645 and parameters: {'model_name': 'SimpleImputer', 'strategy': 'mean'}. Best is trial 8 with value: 0.27178497952509645.
[I 2023-12-21 20:30:43,911] Trial 188 finished with value: 0.27178497952509645 and parameters: {'model_name': 'SimpleImputer', 'strategy': 'mean'}. Best is trial 8 with value: 0.27178497952509645.
[I 2023-12-21 20:30:44,106] Trial 192 finished with value: 0.27178497952509645 and parameters: {'model_name': 'SimpleImputer', 'strategy': 'mean'}. Best is trial 8 with value: 0.27178497952509645.
[I 2023-12-21 20:30:44,299] Trial 199 finished with value: 0.40380440999919526 and parameters: {'model_name': 'SimpleImputer', 'strategy': 'constant'}. Best is trial 8 with value: 0.27178497952509645.
[I 2023-12-21 20:30:44,511] Trial 190 finished with value: 0.27178497952509645 and parameters: {'model_name': 'SimpleImputer', 'strategy': 'mean'}. Best is trial 8 with value: 0.27178497952509645.
[I 2023-12-21 20:30:44,714] Trial 189 finished with value: 0.27178497952509645 and parameters: {'model_name': 'SimpleImputer', 'strategy': 'mean'}. Best is trial 8 with value: 0.27178497952509645.
[I 2023-12-21 20:30:44,919] Trial 193 finished with value: 0.27178497952509645 and parameters: {'model_name': 'SimpleImputer', 'strategy': 'mean'}. Best is trial 8 with value: 0.27178497952509645.
