[I 2023-12-28 08:49:36,625] Trial 114 finished with value: 1.4056518446594208 and parameters: {'model_name': 'IterativeImputer', 'sample_posterior': False, 'initial_strategy': 'most_frequent', 'imputation_order': 'roman'}. Best is trial 19 with value: 1.4056518446594208.
[I 2023-12-28 08:49:52,953] Trial 73 finished with value: 1.4111905085628649 and parameters: {'model_name': 'RandomForestImputer', 'max_iter': 2, 'decreasing': False, 'min_samples_split': 0.8, 'min_samples_leaf': 0.8, 'max_features': 0.7000000000000001, 'warm_start': False}. Best is trial 19 with value: 1.4056518446594208.
[I 2023-12-28 08:50:05,320] Trial 33 finished with value: 3.1554127438111963 and parameters: {'model_name': 'RandomForestImputer', 'max_iter': 37, 'decreasing': False, 'min_samples_split': 0.5, 'min_samples_leaf': 0.9, 'max_features': 0.7000000000000001, 'warm_start': True}. Best is trial 19 with value: 1.4056518446594208.
[I 2023-12-28 08:50:19,452] Trial 66 finished with value: 3.18102596615202 and parameters: {'model_name': 'RandomForestImputer', 'max_iter': 32, 'decreasing': True, 'min_samples_split': 0.5, 'min_samples_leaf': 0.8, 'max_features': 0.2, 'warm_start': True}. Best is trial 19 with value: 1.4056518446594208.
[I 2023-12-28 08:51:34,912] Trial 65 finished with value: 3.197338622544824 and parameters: {'model_name': 'GAIN', 'batch_size': 26, 'hint_rate': 0.61, 'alpha': 20, 'iterations': 102}. Best is trial 19 with value: 1.4056518446594208.
[I 2023-12-28 08:51:43,658] Trial 24 finished with value: 1.4114868096002404 and parameters: {'model_name': 'RandomForestImputer', 'max_iter': 4, 'decreasing': True, 'min_samples_split': 0.7000000000000001, 'min_samples_leaf': 0.7000000000000001, 'max_features': 0.6, 'warm_start': False}. Best is trial 19 with value: 1.4056518446594208.
[I 2023-12-28 08:51:55,126] Trial 71 finished with value: 3.2016338404656715 and parameters: {'model_name': 'GAIN', 'batch_size': 1, 'hint_rate': 0.11, 'alpha': 31, 'iterations': 122}. Best is trial 19 with value: 1.4056518446594208.
[I 2023-12-28 08:51:59,112] Trial 38 finished with value: 2.1304406554227624 and parameters: {'model_name': 'IterativeImputer', 'sample_posterior': True, 'initial_strategy': 'most_frequent', 'imputation_order': 'descending'}. Best is trial 19 with value: 1.4056518446594208.
[I 2023-12-28 08:52:01,120] Trial 10 finished with value: 2.248865793598328 and parameters: {'model_name': 'IterativeImputer', 'sample_posterior': True, 'initial_strategy': 'median', 'imputation_order': 'descending'}. Best is trial 19 with value: 1.4056518446594208.
[I 2023-12-28 08:52:01,977] Trial 14 finished with value: 2.2068715232205096 and parameters: {'model_name': 'IterativeImputer', 'sample_posterior': True, 'initial_strategy': 'most_frequent', 'imputation_order': 'roman'}. Best is trial 19 with value: 1.4056518446594208.
[I 2023-12-28 08:52:03,490] Trial 56 finished with value: 2.2226774734665478 and parameters: {'model_name': 'IterativeImputer', 'sample_posterior': True, 'initial_strategy': 'constant', 'imputation_order': 'roman'}. Best is trial 19 with value: 1.4056518446594208.
[I 2023-12-28 08:52:06,289] Trial 77 finished with value: 2.1364644272993853 and parameters: {'model_name': 'IterativeImputer', 'sample_posterior': True, 'initial_strategy': 'median', 'imputation_order': 'descending'}. Best is trial 19 with value: 1.4056518446594208.
[I 2023-12-28 08:52:09,586] Trial 82 finished with value: 2.224810823706792 and parameters: {'model_name': 'IterativeImputer', 'sample_posterior': True, 'initial_strategy': 'mean', 'imputation_order': 'ascending'}. Best is trial 19 with value: 1.4056518446594208.
[I 2023-12-28 08:52:10,426] Trial 83 finished with value: 2.1950953554517842 and parameters: {'model_name': 'IterativeImputer', 'sample_posterior': True, 'initial_strategy': 'mean', 'imputation_order': 'arabic'}. Best is trial 19 with value: 1.4056518446594208.
[I 2023-12-28 08:52:11,485] Trial 74 finished with value: 2.1653781691037612 and parameters: {'model_name': 'IterativeImputer', 'sample_posterior': True, 'initial_strategy': 'most_frequent', 'imputation_order': 'arabic'}. Best is trial 19 with value: 1.4056518446594208.
[I 2023-12-28 08:52:13,565] Trial 36 finished with value: 2.2246073453784545 and parameters: {'model_name': 'IterativeImputer', 'sample_posterior': True, 'initial_strategy': 'most_frequent', 'imputation_order': 'random'}. Best is trial 19 with value: 1.4056518446594208.
[I 2023-12-28 08:52:21,948] Trial 85 finished with value: 2.2183793136707326 and parameters: {'model_name': 'IterativeImputer', 'sample_posterior': True, 'initial_strategy': 'constant', 'imputation_order': 'descending'}. Best is trial 19 with value: 1.4056518446594208.
[I 2023-12-28 08:52:24,600] Trial 141 finished with value: 1.4056534929341584 and parameters: {'model_name': 'IterativeImputer', 'sample_posterior': False, 'initial_strategy': 'mean', 'imputation_order': 'roman'}. Best is trial 19 with value: 1.4056518446594208.
[I 2023-12-28 08:52:25,793] Trial 142 finished with value: 1.4056534929341584 and parameters: {'model_name': 'IterativeImputer', 'sample_posterior': False, 'initial_strategy': 'mean', 'imputation_order': 'roman'}. Best is trial 19 with value: 1.4056518446594208.
[I 2023-12-28 08:52:26,908] Trial 88 finished with value: 2.2744046081104363 and parameters: {'model_name': 'IterativeImputer', 'sample_posterior': True, 'initial_strategy': 'mean', 'imputation_order': 'arabic'}. Best is trial 19 with value: 1.4056518446594208.
[I 2023-12-28 08:52:28,043] Trial 143 finished with value: 1.4056526457704952 and parameters: {'model_name': 'IterativeImputer', 'sample_posterior': False, 'initial_strategy': 'mean', 'imputation_order': 'arabic'}. Best is trial 19 with value: 1.4056518446594208.
[I 2023-12-28 08:52:29,450] Trial 144 finished with value: 1.4056526457704952 and parameters: {'model_name': 'IterativeImputer', 'sample_posterior': False, 'initial_strategy': 'mean', 'imputation_order': 'arabic'}. Best is trial 19 with value: 1.4056518446594208.
[I 2023-12-28 08:52:35,889] Trial 87 finished with value: 2.2150989757100925 and parameters: {'model_name': 'IterativeImputer', 'sample_posterior': True, 'initial_strategy': 'constant', 'imputation_order': 'random'}. Best is trial 19 with value: 1.4056518446594208.
[I 2023-12-28 08:52:38,987] Trial 147 finished with value: 1.4056518446594208 and parameters: {'model_name': 'IterativeImputer', 'sample_posterior': False, 'initial_strategy': 'most_frequent', 'imputation_order': 'roman'}. Best is trial 19 with value: 1.4056518446594208.
[I 2023-12-28 08:52:41,722] Trial 146 finished with value: 1.4056518446594208 and parameters: {'model_name': 'IterativeImputer', 'sample_posterior': False, 'initial_strategy': 'most_frequent', 'imputation_order': 'roman'}. Best is trial 19 with value: 1.4056518446594208.
[I 2023-12-28 08:52:43,991] Trial 148 finished with value: 1.4056518446594208 and parameters: {'model_name': 'IterativeImputer', 'sample_posterior': False, 'initial_strategy': 'most_frequent', 'imputation_order': 'roman'}. Best is trial 19 with value: 1.4056518446594208.
[I 2023-12-28 08:52:49,795] Trial 145 finished with value: 1.4056535911481522 and parameters: {'model_name': 'IterativeImputer', 'sample_posterior': False, 'initial_strategy': 'most_frequent', 'imputation_order': 'arabic'}. Best is trial 19 with value: 1.4056518446594208.
[I 2023-12-28 08:52:57,274] Trial 149 finished with value: 1.4056518446594208 and parameters: {'model_name': 'IterativeImputer', 'sample_posterior': False, 'initial_strategy': 'most_frequent', 'imputation_order': 'roman'}. Best is trial 19 with value: 1.4056518446594208.
[I 2023-12-28 08:53:00,598] Trial 150 finished with value: 1.4056518446594208 and parameters: {'model_name': 'IterativeImputer', 'sample_posterior': False, 'initial_strategy': 'most_frequent', 'imputation_order': 'roman'}. Best is trial 19 with value: 1.4056518446594208.
[I 2023-12-28 08:53:01,365] Trial 151 finished with value: 1.4056518446594208 and parameters: {'model_name': 'IterativeImputer', 'sample_posterior': False, 'initial_strategy': 'most_frequent', 'imputation_order': 'roman'}. Best is trial 19 with value: 1.4056518446594208.
[I 2023-12-28 08:53:02,467] Trial 152 finished with value: 1.4056518446594208 and parameters: {'model_name': 'IterativeImputer', 'sample_posterior': False, 'initial_strategy': 'most_frequent', 'imputation_order': 'roman'}. Best is trial 19 with value: 1.4056518446594208.
[I 2023-12-28 08:53:04,588] Trial 153 finished with value: 1.4056518446594208 and parameters: {'model_name': 'IterativeImputer', 'sample_posterior': False, 'initial_strategy': 'most_frequent', 'imputation_order': 'roman'}. Best is trial 19 with value: 1.4056518446594208.
[I 2023-12-28 08:53:05,943] Trial 26 finished with value: 1.41263516031021 and parameters: {'model_name': 'RandomForestImputer', 'max_iter': 10, 'decreasing': False, 'min_samples_split': 0.4, 'min_samples_leaf': 0.9, 'max_features': 0.6, 'warm_start': False}. Best is trial 19 with value: 1.4056518446594208.
[I 2023-12-28 08:53:07,136] Trial 154 finished with value: 1.4056518446594208 and parameters: {'model_name': 'IterativeImputer', 'sample_posterior': False, 'initial_strategy': 'most_frequent', 'imputation_order': 'roman'}. Best is trial 19 with value: 1.4056518446594208.
[I 2023-12-28 08:53:14,924] Trial 155 finished with value: 1.4056518446594208 and parameters: {'model_name': 'IterativeImputer', 'sample_posterior': False, 'initial_strategy': 'most_frequent', 'imputation_order': 'roman'}. Best is trial 19 with value: 1.4056518446594208.
[I 2023-12-28 08:53:16,786] Trial 156 finished with value: 1.4056518446594208 and parameters: {'model_name': 'IterativeImputer', 'sample_posterior': False, 'initial_strategy': 'most_frequent', 'imputation_order': 'roman'}. Best is trial 19 with value: 1.4056518446594208.
[I 2023-12-28 08:53:18,987] Trial 157 finished with value: 1.4056518446594208 and parameters: {'model_name': 'IterativeImputer', 'sample_posterior': False, 'initial_strategy': 'most_frequent', 'imputation_order': 'roman'}. Best is trial 19 with value: 1.4056518446594208.
[I 2023-12-28 08:53:20,712] Trial 158 finished with value: 1.4056518446594208 and parameters: {'model_name': 'IterativeImputer', 'sample_posterior': False, 'initial_strategy': 'most_frequent', 'imputation_order': 'roman'}. Best is trial 19 with value: 1.4056518446594208.
[I 2023-12-28 08:53:27,116] Trial 159 finished with value: 1.4056518446594208 and parameters: {'model_name': 'IterativeImputer', 'sample_posterior': False, 'initial_strategy': 'most_frequent', 'imputation_order': 'roman'}. Best is trial 19 with value: 1.4056518446594208.
[I 2023-12-28 08:53:33,906] Trial 160 finished with value: 1.4056518446594208 and parameters: {'model_name': 'IterativeImputer', 'sample_posterior': False, 'initial_strategy': 'most_frequent', 'imputation_order': 'roman'}. Best is trial 19 with value: 1.4056518446594208.
[I 2023-12-28 08:53:35,363] Trial 115 finished with value: 2.1753016590970073 and parameters: {'model_name': 'IterativeImputer', 'sample_posterior': True, 'initial_strategy': 'most_frequent', 'imputation_order': 'roman'}. Best is trial 19 with value: 1.4056518446594208.
[I 2023-12-28 08:53:38,335] Trial 162 finished with value: 1.4056518446594208 and parameters: {'model_name': 'IterativeImputer', 'sample_posterior': False, 'initial_strategy': 'most_frequent', 'imputation_order': 'roman'}. Best is trial 19 with value: 1.4056518446594208.
[I 2023-12-28 08:53:39,438] Trial 161 finished with value: 1.4056518446594208 and parameters: {'model_name': 'IterativeImputer', 'sample_posterior': False, 'initial_strategy': 'most_frequent', 'imputation_order': 'roman'}. Best is trial 19 with value: 1.4056518446594208.
[I 2023-12-28 08:53:41,181] Trial 116 finished with value: 2.2248630078481026 and parameters: {'model_name': 'IterativeImputer', 'sample_posterior': True, 'initial_strategy': 'most_frequent', 'imputation_order': 'roman'}. Best is trial 19 with value: 1.4056518446594208.
[I 2023-12-28 08:53:42,300] Trial 118 finished with value: 2.1106399647719334 and parameters: {'model_name': 'IterativeImputer', 'sample_posterior': True, 'initial_strategy': 'most_frequent', 'imputation_order': 'roman'}. Best is trial 19 with value: 1.4056518446594208.
[I 2023-12-28 08:53:43,625] Trial 117 finished with value: 2.197668341956722 and parameters: {'model_name': 'IterativeImputer', 'sample_posterior': True, 'initial_strategy': 'most_frequent', 'imputation_order': 'roman'}. Best is trial 19 with value: 1.4056518446594208.
[I 2023-12-28 08:53:45,102] Trial 166 finished with value: 1.4056518446594208 and parameters: {'model_name': 'IterativeImputer', 'sample_posterior': False, 'initial_strategy': 'most_frequent', 'imputation_order': 'roman'}. Best is trial 19 with value: 1.4056518446594208.
[I 2023-12-28 08:53:46,087] Trial 119 finished with value: 2.20517924493081 and parameters: {'model_name': 'IterativeImputer', 'sample_posterior': True, 'initial_strategy': 'most_frequent', 'imputation_order': 'roman'}. Best is trial 19 with value: 1.4056518446594208.
[I 2023-12-28 08:53:50,406] Trial 163 finished with value: 1.4056536068679288 and parameters: {'model_name': 'IterativeImputer', 'sample_posterior': False, 'initial_strategy': 'most_frequent', 'imputation_order': 'ascending'}. Best is trial 19 with value: 1.4056518446594208.
[I 2023-12-28 08:53:52,567] Trial 120 finished with value: 2.1026385242615526 and parameters: {'model_name': 'IterativeImputer', 'sample_posterior': True, 'initial_strategy': 'most_frequent', 'imputation_order': 'roman'}. Best is trial 19 with value: 1.4056518446594208.
[I 2023-12-28 08:53:54,882] Trial 164 finished with value: 1.4056536068679288 and parameters: {'model_name': 'IterativeImputer', 'sample_posterior': False, 'initial_strategy': 'most_frequent', 'imputation_order': 'ascending'}. Best is trial 19 with value: 1.4056518446594208.
[I 2023-12-28 08:53:56,234] Trial 165 finished with value: 1.4056536068679288 and parameters: {'model_name': 'IterativeImputer', 'sample_posterior': False, 'initial_strategy': 'most_frequent', 'imputation_order': 'ascending'}. Best is trial 19 with value: 1.4056518446594208.
[I 2023-12-28 08:53:59,434] Trial 121 finished with value: 2.220516461941247 and parameters: {'model_name': 'IterativeImputer', 'sample_posterior': True, 'initial_strategy': 'most_frequent', 'imputation_order': 'roman'}. Best is trial 19 with value: 1.4056518446594208.
[I 2023-12-28 08:54:00,327] Trial 122 finished with value: 2.125294631419583 and parameters: {'model_name': 'IterativeImputer', 'sample_posterior': True, 'initial_strategy': 'most_frequent', 'imputation_order': 'roman'}. Best is trial 19 with value: 1.4056518446594208.
[I 2023-12-28 08:54:01,551] Trial 126 finished with value: 2.2524519525851208 and parameters: {'model_name': 'IterativeImputer', 'sample_posterior': True, 'initial_strategy': 'most_frequent', 'imputation_order': 'roman'}. Best is trial 19 with value: 1.4056518446594208.
[I 2023-12-28 08:54:02,443] Trial 125 finished with value: 2.203604395957555 and parameters: {'model_name': 'IterativeImputer', 'sample_posterior': True, 'initial_strategy': 'most_frequent', 'imputation_order': 'roman'}. Best is trial 19 with value: 1.4056518446594208.
[I 2023-12-28 08:54:04,428] Trial 123 finished with value: 2.2026649929658157 and parameters: {'model_name': 'IterativeImputer', 'sample_posterior': True, 'initial_strategy': 'most_frequent', 'imputation_order': 'roman'}. Best is trial 19 with value: 1.4056518446594208.
[I 2023-12-28 08:54:05,281] Trial 127 finished with value: 2.223501132761023 and parameters: {'model_name': 'IterativeImputer', 'sample_posterior': True, 'initial_strategy': 'most_frequent', 'imputation_order': 'roman'}. Best is trial 19 with value: 1.4056518446594208.
[I 2023-12-28 08:54:07,904] Trial 167 finished with value: 1.4056536068679288 and parameters: {'model_name': 'IterativeImputer', 'sample_posterior': False, 'initial_strategy': 'most_frequent', 'imputation_order': 'ascending'}. Best is trial 19 with value: 1.4056518446594208.
[I 2023-12-28 08:54:09,940] Trial 168 finished with value: 1.4056536068679288 and parameters: {'model_name': 'IterativeImputer', 'sample_posterior': False, 'initial_strategy': 'most_frequent', 'imputation_order': 'ascending'}. Best is trial 19 with value: 1.4056518446594208.
[I 2023-12-28 08:54:10,766] Trial 124 finished with value: 2.0937270578810554 and parameters: {'model_name': 'IterativeImputer', 'sample_posterior': True, 'initial_strategy': 'most_frequent', 'imputation_order': 'roman'}. Best is trial 19 with value: 1.4056518446594208.
[I 2023-12-28 08:54:11,679] Trial 131 finished with value: 2.182423638108614 and parameters: {'model_name': 'IterativeImputer', 'sample_posterior': True, 'initial_strategy': 'mean', 'imputation_order': 'roman'}. Best is trial 19 with value: 1.4056518446594208.
[I 2023-12-28 08:54:13,119] Trial 129 finished with value: 2.1655348647557875 and parameters: {'model_name': 'IterativeImputer', 'sample_posterior': True, 'initial_strategy': 'most_frequent', 'imputation_order': 'roman'}. Best is trial 19 with value: 1.4056518446594208.
[I 2023-12-28 08:54:14,250] Trial 169 finished with value: 1.4056536068679288 and parameters: {'model_name': 'IterativeImputer', 'sample_posterior': False, 'initial_strategy': 'most_frequent', 'imputation_order': 'ascending'}. Best is trial 19 with value: 1.4056518446594208.
[I 2023-12-28 08:54:15,048] Trial 128 finished with value: 2.184107594315404 and parameters: {'model_name': 'IterativeImputer', 'sample_posterior': True, 'initial_strategy': 'most_frequent', 'imputation_order': 'roman'}. Best is trial 19 with value: 1.4056518446594208.
[I 2023-12-28 08:54:17,220] Trial 130 finished with value: 2.243010455471302 and parameters: {'model_name': 'IterativeImputer', 'sample_posterior': True, 'initial_strategy': 'mean', 'imputation_order': 'roman'}. Best is trial 19 with value: 1.4056518446594208.
[I 2023-12-28 08:54:17,229] Trial 170 finished with value: 1.4056536068679288 and parameters: {'model_name': 'IterativeImputer', 'sample_posterior': False, 'initial_strategy': 'most_frequent', 'imputation_order': 'ascending'}. Best is trial 19 with value: 1.4056518446594208.
[I 2023-12-28 08:54:20,464] Trial 197 finished with value: 2.053250656068472 and parameters: {'model_name': 'SimpleImputer', 'strategy': 'most_frequent'}. Best is trial 19 with value: 1.4056518446594208.
[I 2023-12-28 08:54:21,197] Trial 132 finished with value: 2.2328986358580396 and parameters: {'model_name': 'IterativeImputer', 'sample_posterior': True, 'initial_strategy': 'mean', 'imputation_order': 'roman'}. Best is trial 19 with value: 1.4056518446594208.
[I 2023-12-28 08:54:23,150] Trial 133 finished with value: 2.2140294228504827 and parameters: {'model_name': 'IterativeImputer', 'sample_posterior': True, 'initial_strategy': 'mean', 'imputation_order': 'roman'}. Best is trial 19 with value: 1.4056518446594208.
[I 2023-12-28 08:54:28,228] Trial 171 finished with value: 1.4056536068679288 and parameters: {'model_name': 'IterativeImputer', 'sample_posterior': False, 'initial_strategy': 'most_frequent', 'imputation_order': 'ascending'}. Best is trial 19 with value: 1.4056518446594208.
[I 2023-12-28 08:54:29,480] Trial 32 finished with value: 1.41216731228582 and parameters: {'model_name': 'RandomForestImputer', 'max_iter': 13, 'decreasing': False, 'min_samples_split': 0.1, 'min_samples_leaf': 0.6, 'max_features': 0.8, 'warm_start': False}. Best is trial 19 with value: 1.4056518446594208.
[I 2023-12-28 08:54:32,677] Trial 174 finished with value: 1.4056518446594208 and parameters: {'model_name': 'IterativeImputer', 'sample_posterior': False, 'initial_strategy': 'most_frequent', 'imputation_order': 'roman'}. Best is trial 19 with value: 1.4056518446594208.
[I 2023-12-28 08:54:36,058] Trial 172 finished with value: 1.4056536068679288 and parameters: {'model_name': 'IterativeImputer', 'sample_posterior': False, 'initial_strategy': 'most_frequent', 'imputation_order': 'ascending'}. Best is trial 19 with value: 1.4056518446594208.
[I 2023-12-28 08:54:37,787] Trial 72 finished with value: 2.6254159182555865 and parameters: {'model_name': 'GAIN', 'batch_size': 23, 'hint_rate': 0.87, 'alpha': 12, 'iterations': 180}. Best is trial 19 with value: 1.4056518446594208.
[I 2023-12-28 08:54:38,519] Trial 173 finished with value: 1.4056536068679288 and parameters: {'model_name': 'IterativeImputer', 'sample_posterior': False, 'initial_strategy': 'most_frequent', 'imputation_order': 'ascending'}. Best is trial 19 with value: 1.4056518446594208.
[I 2023-12-28 08:54:42,121] Trial 175 finished with value: 1.4056536068679288 and parameters: {'model_name': 'IterativeImputer', 'sample_posterior': False, 'initial_strategy': 'most_frequent', 'imputation_order': 'ascending'}. Best is trial 19 with value: 1.4056518446594208.
[I 2023-12-28 08:54:43,713] Trial 177 finished with value: 1.4056536068679288 and parameters: {'model_name': 'IterativeImputer', 'sample_posterior': False, 'initial_strategy': 'most_frequent', 'imputation_order': 'ascending'}. Best is trial 19 with value: 1.4056518446594208.
[I 2023-12-28 08:54:44,464] Trial 176 finished with value: 1.4056536068679288 and parameters: {'model_name': 'IterativeImputer', 'sample_posterior': False, 'initial_strategy': 'most_frequent', 'imputation_order': 'ascending'}. Best is trial 19 with value: 1.4056518446594208.
[I 2023-12-28 08:54:45,308] Trial 178 finished with value: 1.4056536068679288 and parameters: {'model_name': 'IterativeImputer', 'sample_posterior': False, 'initial_strategy': 'most_frequent', 'imputation_order': 'ascending'}. Best is trial 19 with value: 1.4056518446594208.
