Run: 7
/cm/local/apps/slurm/var/spool/job568590/slurm_script: line 23: /common/ketrong/minconda3/etc/profile.d/conda.sh: No such file or directory
/cm/local/apps/slurm/var/spool/job568590/slurm_script: line 26: $'\nconda create --name tpot2devenv -c conda-forge python=3.10\n': command not found
/cm/local/apps/slurm/var/spool/job568590/slurm_script: line 31: $'\npip install -r requirements.txt\n': command not found
RunStart
2023-12-28 12:08:08.548558: I tensorflow/core/util/port.cc:113] oneDNN custom operations are on. You may see slightly different numerical results due to floating-point round-off errors from different computation orders. To turn them off, set the environment variable `TF_ENABLE_ONEDNN_OPTS=0`.
2023-12-28 12:08:08.582854: E external/local_xla/xla/stream_executor/cuda/cuda_dnn.cc:9261] Unable to register cuDNN factory: Attempting to register factory for plugin cuDNN when one has already been registered
2023-12-28 12:08:08.582876: E external/local_xla/xla/stream_executor/cuda/cuda_fft.cc:607] Unable to register cuFFT factory: Attempting to register factory for plugin cuFFT when one has already been registered
2023-12-28 12:08:08.583807: E external/local_xla/xla/stream_executor/cuda/cuda_blas.cc:1515] Unable to register cuBLAS factory: Attempting to register factory for plugin cuBLAS when one has already been registered
2023-12-28 12:08:08.589076: I tensorflow/core/platform/cpu_feature_guard.cc:182] This TensorFlow binary is optimized to use available CPU instructions in performance-critical operations.
To enable the following instructions: AVX2 AVX512F AVX512_VNNI FMA, in other operations, rebuild TensorFlow with the appropriate compiler flags.
2023-12-28 12:08:11.490811: W tensorflow/compiler/tf2tensorrt/utils/py_utils.cc:38] TF-TRT Warning: Could not find TensorRT
WARNING:tensorflow:From /home/ketrong/miniconda3/envs/tpot2devenv/lib/python3.10/site-packages/tensorflow/python/compat/v2_compat.py:108: disable_resource_variables (from tensorflow.python.ops.variable_scope) is deprecated and will be removed in a future version.
Instructions for updating:
non-resource variables are not supported in the long term
starting loops
working on 
logs/3591/tpot2_base_normal_MAR_0.1
3.054596424102783
loading data
logs/3591/tpot2_base_normal_MAR_0.1/data/3591_True.pkl
running experiment 1/3 - Does large hyperparameter space improve reconstruction accuracy over simple
[I 2023-12-28 12:08:27,122] A new study created in memory with name: no-name-61c24199-4208-4f63-b85c-ad47defc4ead
[I 2023-12-28 12:08:27,909] Trial 18 finished with value: 2.086836406374532 and parameters: {'model_name': 'SimpleImputer', 'strategy': 'constant'}. Best is trial 18 with value: 2.086836406374532.
[I 2023-12-28 12:08:28,262] Trial 7 finished with value: 1.4942222553581073 and parameters: {'model_name': 'SimpleImputer', 'strategy': 'mean'}. Best is trial 7 with value: 1.4942222553581073.
[I 2023-12-28 12:08:28,447] Trial 13 finished with value: 2.086836406374532 and parameters: {'model_name': 'SimpleImputer', 'strategy': 'constant'}. Best is trial 7 with value: 1.4942222553581073.
[I 2023-12-28 12:08:28,893] Trial 17 finished with value: 1.4942222553581073 and parameters: {'model_name': 'SimpleImputer', 'strategy': 'mean'}. Best is trial 7 with value: 1.4942222553581073.
[I 2023-12-28 12:08:29,067] Trial 23 finished with value: 2.086836406374532 and parameters: {'model_name': 'SimpleImputer', 'strategy': 'constant'}. Best is trial 7 with value: 1.4942222553581073.
[I 2023-12-28 12:08:29,243] Trial 19 finished with value: 1.4942222553581073 and parameters: {'model_name': 'SimpleImputer', 'strategy': 'mean'}. Best is trial 7 with value: 1.4942222553581073.
[I 2023-12-28 12:08:29,418] Trial 24 finished with value: 2.086836406374532 and parameters: {'model_name': 'SimpleImputer', 'strategy': 'constant'}. Best is trial 7 with value: 1.4942222553581073.
[I 2023-12-28 12:08:29,593] Trial 8 finished with value: 1.4942222553581073 and parameters: {'model_name': 'SimpleImputer', 'strategy': 'mean'}. Best is trial 7 with value: 1.4942222553581073.
[I 2023-12-28 12:08:29,796] Trial 15 finished with value: 1.4942222553581073 and parameters: {'model_name': 'SimpleImputer', 'strategy': 'mean'}. Best is trial 7 with value: 1.4942222553581073.
[I 2023-12-28 12:08:30,136] Trial 21 finished with value: 1.4942222553581073 and parameters: {'model_name': 'SimpleImputer', 'strategy': 'mean'}. Best is trial 7 with value: 1.4942222553581073.
[I 2023-12-28 12:08:30,388] Trial 25 finished with value: 1.4942222553581073 and parameters: {'model_name': 'SimpleImputer', 'strategy': 'mean'}. Best is trial 7 with value: 1.4942222553581073.
[I 2023-12-28 12:08:30,596] Trial 33 finished with value: 2.086836406374532 and parameters: {'model_name': 'SimpleImputer', 'strategy': 'constant'}. Best is trial 7 with value: 1.4942222553581073.
[I 2023-12-28 12:08:30,767] Trial 29 finished with value: 1.4942222553581073 and parameters: {'model_name': 'SimpleImputer', 'strategy': 'mean'}. Best is trial 7 with value: 1.4942222553581073.
[I 2023-12-28 12:08:31,190] Trial 5 finished with value: 1.5908745880525161 and parameters: {'model_name': 'SimpleImputer', 'strategy': 'median'}. Best is trial 7 with value: 1.4942222553581073.
[I 2023-12-28 12:08:31,395] Trial 0 finished with value: 1.5908745880525161 and parameters: {'model_name': 'SimpleImputer', 'strategy': 'median'}. Best is trial 7 with value: 1.4942222553581073.
[I 2023-12-28 12:08:31,579] Trial 3 finished with value: 1.5908745880525161 and parameters: {'model_name': 'SimpleImputer', 'strategy': 'median'}. Best is trial 7 with value: 1.4942222553581073.
[I 2023-12-28 12:08:31,825] Trial 32 finished with value: 1.4942222553581073 and parameters: {'model_name': 'SimpleImputer', 'strategy': 'mean'}. Best is trial 7 with value: 1.4942222553581073.
[I 2023-12-28 12:08:32,142] Trial 39 finished with value: 2.086836406374532 and parameters: {'model_name': 'SimpleImputer', 'strategy': 'constant'}. Best is trial 7 with value: 1.4942222553581073.
[I 2023-12-28 12:08:32,373] Trial 6 finished with value: 1.5908745880525161 and parameters: {'model_name': 'SimpleImputer', 'strategy': 'median'}. Best is trial 7 with value: 1.4942222553581073.
[I 2023-12-28 12:08:32,648] Trial 2 finished with value: 1.5908745880525161 and parameters: {'model_name': 'SimpleImputer', 'strategy': 'median'}. Best is trial 7 with value: 1.4942222553581073.
[I 2023-12-28 12:08:32,922] Trial 35 finished with value: 1.4942222553581073 and parameters: {'model_name': 'SimpleImputer', 'strategy': 'mean'}. Best is trial 7 with value: 1.4942222553581073.
[I 2023-12-28 12:08:33,293] Trial 11 finished with value: 1.5908745880525161 and parameters: {'model_name': 'SimpleImputer', 'strategy': 'median'}. Best is trial 7 with value: 1.4942222553581073.
[I 2023-12-28 12:08:33,456] Trial 10 finished with value: 1.5908745880525161 and parameters: {'model_name': 'SimpleImputer', 'strategy': 'median'}. Best is trial 7 with value: 1.4942222553581073.
[I 2023-12-28 12:08:33,615] Trial 42 finished with value: 2.086836406374532 and parameters: {'model_name': 'SimpleImputer', 'strategy': 'constant'}. Best is trial 7 with value: 1.4942222553581073.
[I 2023-12-28 12:08:33,815] Trial 16 finished with value: 1.5908745880525161 and parameters: {'model_name': 'SimpleImputer', 'strategy': 'median'}. Best is trial 7 with value: 1.4942222553581073.
[I 2023-12-28 12:08:34,000] Trial 36 finished with value: 2.086836406374532 and parameters: {'model_name': 'SimpleImputer', 'strategy': 'constant'}. Best is trial 7 with value: 1.4942222553581073.
[I 2023-12-28 12:08:34,215] Trial 34 finished with value: 1.4942222553581073 and parameters: {'model_name': 'SimpleImputer', 'strategy': 'mean'}. Best is trial 7 with value: 1.4942222553581073.
[I 2023-12-28 12:08:34,566] Trial 14 finished with value: 1.5908745880525161 and parameters: {'model_name': 'SimpleImputer', 'strategy': 'median'}. Best is trial 7 with value: 1.4942222553581073.
[I 2023-12-28 12:08:34,785] Trial 44 finished with value: 2.086836406374532 and parameters: {'model_name': 'SimpleImputer', 'strategy': 'constant'}. Best is trial 7 with value: 1.4942222553581073.
[I 2023-12-28 12:08:35,059] Trial 26 finished with value: 1.5908745880525161 and parameters: {'model_name': 'SimpleImputer', 'strategy': 'median'}. Best is trial 7 with value: 1.4942222553581073.
[I 2023-12-28 12:08:35,392] Trial 43 finished with value: 2.086836406374532 and parameters: {'model_name': 'SimpleImputer', 'strategy': 'constant'}. Best is trial 7 with value: 1.4942222553581073.
[I 2023-12-28 12:08:35,812] Trial 22 finished with value: 1.5908745880525161 and parameters: {'model_name': 'SimpleImputer', 'strategy': 'median'}. Best is trial 7 with value: 1.4942222553581073.
[I 2023-12-28 12:08:36,274] Trial 45 finished with value: 1.4942222553581073 and parameters: {'model_name': 'SimpleImputer', 'strategy': 'mean'}. Best is trial 7 with value: 1.4942222553581073.
[I 2023-12-28 12:08:36,579] Trial 47 finished with value: 1.4942222553581073 and parameters: {'model_name': 'SimpleImputer', 'strategy': 'mean'}. Best is trial 7 with value: 1.4942222553581073.
[I 2023-12-28 12:08:36,882] Trial 4 finished with value: 2.070904045797603 and parameters: {'model_name': 'SimpleImputer', 'strategy': 'most_frequent'}. Best is trial 7 with value: 1.4942222553581073.
[I 2023-12-28 12:08:37,117] Trial 37 finished with value: 1.5908745880525161 and parameters: {'model_name': 'SimpleImputer', 'strategy': 'median'}. Best is trial 7 with value: 1.4942222553581073.
[I 2023-12-28 12:08:37,464] Trial 49 finished with value: 1.4942222553581073 and parameters: {'model_name': 'SimpleImputer', 'strategy': 'mean'}. Best is trial 7 with value: 1.4942222553581073.
[I 2023-12-28 12:08:37,914] Trial 41 finished with value: 1.5908745880525161 and parameters: {'model_name': 'SimpleImputer', 'strategy': 'median'}. Best is trial 7 with value: 1.4942222553581073.
[I 2023-12-28 12:08:38,424] Trial 52 finished with value: 1.5908745880525161 and parameters: {'model_name': 'SimpleImputer', 'strategy': 'median'}. Best is trial 7 with value: 1.4942222553581073.
[I 2023-12-28 12:08:38,698] Trial 51 finished with value: 1.5908745880525161 and parameters: {'model_name': 'SimpleImputer', 'strategy': 'median'}. Best is trial 7 with value: 1.4942222553581073.
[I 2023-12-28 12:08:39,046] Trial 1 finished with value: 2.070904045797603 and parameters: {'model_name': 'SimpleImputer', 'strategy': 'most_frequent'}. Best is trial 7 with value: 1.4942222553581073.
[I 2023-12-28 12:08:39,398] Trial 12 finished with value: 2.070904045797603 and parameters: {'model_name': 'SimpleImputer', 'strategy': 'most_frequent'}. Best is trial 7 with value: 1.4942222553581073.
[I 2023-12-28 12:08:39,710] Trial 55 finished with value: 1.5908745880525161 and parameters: {'model_name': 'SimpleImputer', 'strategy': 'median'}. Best is trial 7 with value: 1.4942222553581073.
[I 2023-12-28 12:08:39,928] Trial 50 finished with value: 1.5908745880525161 and parameters: {'model_name': 'SimpleImputer', 'strategy': 'median'}. Best is trial 7 with value: 1.4942222553581073.
[I 2023-12-28 12:08:40,120] Trial 53 finished with value: 1.5908745880525161 and parameters: {'model_name': 'SimpleImputer', 'strategy': 'median'}. Best is trial 7 with value: 1.4942222553581073.
[I 2023-12-28 12:08:40,496] Trial 9 finished with value: 2.070904045797603 and parameters: {'model_name': 'SimpleImputer', 'strategy': 'most_frequent'}. Best is trial 7 with value: 1.4942222553581073.
[I 2023-12-28 12:08:40,739] Trial 58 finished with value: 1.5908745880525161 and parameters: {'model_name': 'SimpleImputer', 'strategy': 'median'}. Best is trial 7 with value: 1.4942222553581073.
[I 2023-12-28 12:08:41,221] Trial 48 finished with value: 1.5908745880525161 and parameters: {'model_name': 'SimpleImputer', 'strategy': 'median'}. Best is trial 7 with value: 1.4942222553581073.
[I 2023-12-28 12:08:41,640] Trial 20 finished with value: 2.070904045797603 and parameters: {'model_name': 'SimpleImputer', 'strategy': 'most_frequent'}. Best is trial 7 with value: 1.4942222553581073.
[I 2023-12-28 12:08:41,863] Trial 28 finished with value: 2.070904045797603 and parameters: {'model_name': 'SimpleImputer', 'strategy': 'most_frequent'}. Best is trial 7 with value: 1.4942222553581073.
[I 2023-12-28 12:08:42,155] Trial 30 finished with value: 2.070904045797603 and parameters: {'model_name': 'SimpleImputer', 'strategy': 'most_frequent'}. Best is trial 7 with value: 1.4942222553581073.
[I 2023-12-28 12:08:42,814] Trial 27 finished with value: 2.070904045797603 and parameters: {'model_name': 'SimpleImputer', 'strategy': 'most_frequent'}. Best is trial 7 with value: 1.4942222553581073.
[I 2023-12-28 12:08:43,212] Trial 90 finished with value: 1.4942222553581073 and parameters: {'model_name': 'SimpleImputer', 'strategy': 'mean'}. Best is trial 7 with value: 1.4942222553581073.
[I 2023-12-28 12:08:43,575] Trial 38 finished with value: 2.070904045797603 and parameters: {'model_name': 'SimpleImputer', 'strategy': 'most_frequent'}. Best is trial 7 with value: 1.4942222553581073.
[I 2023-12-28 12:08:43,867] Trial 40 finished with value: 2.070904045797603 and parameters: {'model_name': 'SimpleImputer', 'strategy': 'most_frequent'}. Best is trial 7 with value: 1.4942222553581073.
[I 2023-12-28 12:08:44,144] Trial 92 finished with value: 1.4942222553581073 and parameters: {'model_name': 'SimpleImputer', 'strategy': 'mean'}. Best is trial 7 with value: 1.4942222553581073.
[I 2023-12-28 12:08:44,415] Trial 91 finished with value: 1.4942222553581073 and parameters: {'model_name': 'SimpleImputer', 'strategy': 'mean'}. Best is trial 7 with value: 1.4942222553581073.
[I 2023-12-28 12:08:44,760] Trial 89 finished with value: 1.4942222553581073 and parameters: {'model_name': 'SimpleImputer', 'strategy': 'mean'}. Best is trial 7 with value: 1.4942222553581073.
[I 2023-12-28 12:08:44,971] Trial 94 finished with value: 1.4942222553581073 and parameters: {'model_name': 'SimpleImputer', 'strategy': 'mean'}. Best is trial 7 with value: 1.4942222553581073.
[I 2023-12-28 12:08:45,359] Trial 31 finished with value: 2.070904045797603 and parameters: {'model_name': 'SimpleImputer', 'strategy': 'most_frequent'}. Best is trial 7 with value: 1.4942222553581073.
[I 2023-12-28 12:08:45,750] Trial 93 finished with value: 1.4942222553581073 and parameters: {'model_name': 'SimpleImputer', 'strategy': 'mean'}. Best is trial 7 with value: 1.4942222553581073.
[I 2023-12-28 12:08:46,070] Trial 95 finished with value: 1.4942222553581073 and parameters: {'model_name': 'SimpleImputer', 'strategy': 'mean'}. Best is trial 7 with value: 1.4942222553581073.
[I 2023-12-28 12:08:46,377] Trial 98 finished with value: 1.4942222553581073 and parameters: {'model_name': 'SimpleImputer', 'strategy': 'mean'}. Best is trial 7 with value: 1.4942222553581073.
[I 2023-12-28 12:08:46,653] Trial 54 finished with value: 2.070904045797603 and parameters: {'model_name': 'SimpleImputer', 'strategy': 'most_frequent'}. Best is trial 7 with value: 1.4942222553581073.
[I 2023-12-28 12:08:46,945] Trial 97 finished with value: 1.4942222553581073 and parameters: {'model_name': 'SimpleImputer', 'strategy': 'mean'}. Best is trial 7 with value: 1.4942222553581073.
[I 2023-12-28 12:08:47,239] Trial 99 finished with value: 1.4942222553581073 and parameters: {'model_name': 'SimpleImputer', 'strategy': 'mean'}. Best is trial 7 with value: 1.4942222553581073.
[I 2023-12-28 12:08:47,547] Trial 57 finished with value: 2.070904045797603 and parameters: {'model_name': 'SimpleImputer', 'strategy': 'most_frequent'}. Best is trial 7 with value: 1.4942222553581073.
[I 2023-12-28 12:08:47,822] Trial 59 finished with value: 2.070904045797603 and parameters: {'model_name': 'SimpleImputer', 'strategy': 'most_frequent'}. Best is trial 7 with value: 1.4942222553581073.
[I 2023-12-28 12:08:48,165] Trial 46 finished with value: 2.070904045797603 and parameters: {'model_name': 'SimpleImputer', 'strategy': 'most_frequent'}. Best is trial 7 with value: 1.4942222553581073.
[I 2023-12-28 12:08:48,465] Trial 60 finished with value: 2.070904045797603 and parameters: {'model_name': 'SimpleImputer', 'strategy': 'most_frequent'}. Best is trial 7 with value: 1.4942222553581073.
[I 2023-12-28 12:08:48,698] Trial 62 finished with value: 2.070904045797603 and parameters: {'model_name': 'SimpleImputer', 'strategy': 'most_frequent'}. Best is trial 7 with value: 1.4942222553581073.
[I 2023-12-28 12:08:48,925] Trial 69 finished with value: 2.070904045797603 and parameters: {'model_name': 'SimpleImputer', 'strategy': 'most_frequent'}. Best is trial 7 with value: 1.4942222553581073.
[I 2023-12-28 12:08:49,260] Trial 76 finished with value: 2.070904045797603 and parameters: {'model_name': 'SimpleImputer', 'strategy': 'most_frequent'}. Best is trial 7 with value: 1.4942222553581073.
[I 2023-12-28 12:08:49,489] Trial 61 finished with value: 2.070904045797603 and parameters: {'model_name': 'SimpleImputer', 'strategy': 'most_frequent'}. Best is trial 7 with value: 1.4942222553581073.
[I 2023-12-28 12:08:49,777] Trial 96 finished with value: 1.4942222553581073 and parameters: {'model_name': 'SimpleImputer', 'strategy': 'mean'}. Best is trial 7 with value: 1.4942222553581073.
[I 2023-12-28 12:08:49,993] Trial 71 finished with value: 2.070904045797603 and parameters: {'model_name': 'SimpleImputer', 'strategy': 'most_frequent'}. Best is trial 7 with value: 1.4942222553581073.
[I 2023-12-28 12:08:50,276] Trial 102 finished with value: 1.4942222553581073 and parameters: {'model_name': 'SimpleImputer', 'strategy': 'mean'}. Best is trial 7 with value: 1.4942222553581073.
[I 2023-12-28 12:08:50,555] Trial 100 finished with value: 1.4942222553581073 and parameters: {'model_name': 'SimpleImputer', 'strategy': 'mean'}. Best is trial 7 with value: 1.4942222553581073.
[I 2023-12-28 12:08:50,823] Trial 64 finished with value: 2.070904045797603 and parameters: {'model_name': 'SimpleImputer', 'strategy': 'most_frequent'}. Best is trial 7 with value: 1.4942222553581073.
[I 2023-12-28 12:08:51,059] Trial 68 finished with value: 2.070904045797603 and parameters: {'model_name': 'SimpleImputer', 'strategy': 'most_frequent'}. Best is trial 7 with value: 1.4942222553581073.
[I 2023-12-28 12:08:51,273] Trial 101 finished with value: 1.4942222553581073 and parameters: {'model_name': 'SimpleImputer', 'strategy': 'mean'}. Best is trial 7 with value: 1.4942222553581073.
[I 2023-12-28 12:08:51,484] Trial 67 finished with value: 2.070904045797603 and parameters: {'model_name': 'SimpleImputer', 'strategy': 'most_frequent'}. Best is trial 7 with value: 1.4942222553581073.
[I 2023-12-28 12:08:51,733] Trial 74 finished with value: 2.070904045797603 and parameters: {'model_name': 'SimpleImputer', 'strategy': 'most_frequent'}. Best is trial 7 with value: 1.4942222553581073.
[I 2023-12-28 12:08:51,962] Trial 65 finished with value: 2.070904045797603 and parameters: {'model_name': 'SimpleImputer', 'strategy': 'most_frequent'}. Best is trial 7 with value: 1.4942222553581073.
[I 2023-12-28 12:08:52,183] Trial 66 finished with value: 2.070904045797603 and parameters: {'model_name': 'SimpleImputer', 'strategy': 'most_frequent'}. Best is trial 7 with value: 1.4942222553581073.
[I 2023-12-28 12:08:52,392] Trial 105 finished with value: 1.4942222553581073 and parameters: {'model_name': 'SimpleImputer', 'strategy': 'mean'}. Best is trial 7 with value: 1.4942222553581073.
[I 2023-12-28 12:08:52,617] Trial 56 finished with value: 2.070904045797603 and parameters: {'model_name': 'SimpleImputer', 'strategy': 'most_frequent'}. Best is trial 7 with value: 1.4942222553581073.
[I 2023-12-28 12:08:52,865] Trial 103 finished with value: 1.4942222553581073 and parameters: {'model_name': 'SimpleImputer', 'strategy': 'mean'}. Best is trial 7 with value: 1.4942222553581073.
[I 2023-12-28 12:08:53,086] Trial 108 finished with value: 1.4942222553581073 and parameters: {'model_name': 'SimpleImputer', 'strategy': 'mean'}. Best is trial 7 with value: 1.4942222553581073.
[I 2023-12-28 12:08:53,313] Trial 104 finished with value: 1.4942222553581073 and parameters: {'model_name': 'SimpleImputer', 'strategy': 'mean'}. Best is trial 7 with value: 1.4942222553581073.
[I 2023-12-28 12:08:53,564] Trial 106 finished with value: 1.4942222553581073 and parameters: {'model_name': 'SimpleImputer', 'strategy': 'mean'}. Best is trial 7 with value: 1.4942222553581073.
[I 2023-12-28 12:08:53,770] Trial 63 finished with value: 2.070904045797603 and parameters: {'model_name': 'SimpleImputer', 'strategy': 'most_frequent'}. Best is trial 7 with value: 1.4942222553581073.
[I 2023-12-28 12:08:53,985] Trial 75 finished with value: 2.070904045797603 and parameters: {'model_name': 'SimpleImputer', 'strategy': 'most_frequent'}. Best is trial 7 with value: 1.4942222553581073.
[I 2023-12-28 12:08:54,306] Trial 73 finished with value: 2.070904045797603 and parameters: {'model_name': 'SimpleImputer', 'strategy': 'most_frequent'}. Best is trial 7 with value: 1.4942222553581073.
[I 2023-12-28 12:08:54,511] Trial 82 finished with value: 2.070904045797603 and parameters: {'model_name': 'SimpleImputer', 'strategy': 'most_frequent'}. Best is trial 7 with value: 1.4942222553581073.
[I 2023-12-28 12:08:54,815] Trial 109 finished with value: 1.4942222553581073 and parameters: {'model_name': 'SimpleImputer', 'strategy': 'mean'}. Best is trial 7 with value: 1.4942222553581073.
[I 2023-12-28 12:08:55,103] Trial 111 finished with value: 1.4942222553581073 and parameters: {'model_name': 'SimpleImputer', 'strategy': 'mean'}. Best is trial 7 with value: 1.4942222553581073.
[I 2023-12-28 12:08:55,403] Trial 81 finished with value: 2.070904045797603 and parameters: {'model_name': 'SimpleImputer', 'strategy': 'most_frequent'}. Best is trial 7 with value: 1.4942222553581073.
