[I 2023-12-28 12:50:51,799] Trial 164 finished with value: 2.055195181611494 and parameters: {'model_name': 'RandomForestImputer', 'max_iter': 4, 'decreasing': True, 'min_samples_split': 0.4, 'min_samples_leaf': 0.2, 'max_features': 0.2, 'warm_start': False}. Best is trial 165 with value: 2.048734215142962.
[I 2023-12-28 12:50:56,423] Trial 159 finished with value: 2.0592183731516682 and parameters: {'model_name': 'RandomForestImputer', 'max_iter': 5, 'decreasing': True, 'min_samples_split': 0.4, 'min_samples_leaf': 0.2, 'max_features': 0.2, 'warm_start': False}. Best is trial 165 with value: 2.048734215142962.
[I 2023-12-28 12:50:58,287] Trial 156 finished with value: 2.057225450957058 and parameters: {'model_name': 'RandomForestImputer', 'max_iter': 5, 'decreasing': True, 'min_samples_split': 0.4, 'min_samples_leaf': 0.2, 'max_features': 0.2, 'warm_start': False}. Best is trial 165 with value: 2.048734215142962.
[I 2023-12-28 12:51:03,609] Trial 145 finished with value: 2.057605275102522 and parameters: {'model_name': 'RandomForestImputer', 'max_iter': 5, 'decreasing': True, 'min_samples_split': 0.4, 'min_samples_leaf': 0.7000000000000001, 'max_features': 0.2, 'warm_start': False}. Best is trial 165 with value: 2.048734215142962.
[I 2023-12-28 12:51:05,766] Trial 167 finished with value: 2.0544644436549993 and parameters: {'model_name': 'RandomForestImputer', 'max_iter': 4, 'decreasing': True, 'min_samples_split': 0.4, 'min_samples_leaf': 0.2, 'max_features': 0.2, 'warm_start': False}. Best is trial 165 with value: 2.048734215142962.
[I 2023-12-28 12:51:07,790] Trial 168 finished with value: 2.058398696641494 and parameters: {'model_name': 'RandomForestImputer', 'max_iter': 4, 'decreasing': True, 'min_samples_split': 0.4, 'min_samples_leaf': 0.2, 'max_features': 0.2, 'warm_start': False}. Best is trial 165 with value: 2.048734215142962.
[I 2023-12-28 12:51:11,989] Trial 53 finished with value: 2.055528145962896 and parameters: {'model_name': 'RandomForestImputer', 'max_iter': 27, 'decreasing': True, 'min_samples_split': 0.7000000000000001, 'min_samples_leaf': 0.2, 'max_features': 0.5, 'warm_start': False}. Best is trial 165 with value: 2.048734215142962.
[I 2023-12-28 12:51:14,557] Trial 7 finished with value: 2.058092169872822 and parameters: {'model_name': 'RandomForestImputer', 'max_iter': 26, 'decreasing': True, 'min_samples_split': 0.4, 'min_samples_leaf': 0.4, 'max_features': 0.1, 'warm_start': False}. Best is trial 165 with value: 2.048734215142962.
[I 2023-12-28 12:51:17,087] Trial 161 finished with value: 2.055296583917042 and parameters: {'model_name': 'RandomForestImputer', 'max_iter': 5, 'decreasing': False, 'min_samples_split': 0.4, 'min_samples_leaf': 0.2, 'max_features': 0.2, 'warm_start': False}. Best is trial 165 with value: 2.048734215142962.
[I 2023-12-28 12:51:20,536] Trial 158 finished with value: 2.0568620883549023 and parameters: {'model_name': 'RandomForestImputer', 'max_iter': 5, 'decreasing': True, 'min_samples_split': 0.4, 'min_samples_leaf': 0.7000000000000001, 'max_features': 0.2, 'warm_start': False}. Best is trial 165 with value: 2.048734215142962.
[I 2023-12-28 12:51:25,199] Trial 157 finished with value: 2.0580664715210086 and parameters: {'model_name': 'RandomForestImputer', 'max_iter': 5, 'decreasing': True, 'min_samples_split': 0.4, 'min_samples_leaf': 0.7000000000000001, 'max_features': 0.2, 'warm_start': False}. Best is trial 165 with value: 2.048734215142962.
[I 2023-12-28 12:51:26,895] Trial 170 finished with value: 2.0593750549984877 and parameters: {'model_name': 'RandomForestImputer', 'max_iter': 4, 'decreasing': True, 'min_samples_split': 0.4, 'min_samples_leaf': 0.2, 'max_features': 0.2, 'warm_start': False}. Best is trial 165 with value: 2.048734215142962.
[I 2023-12-28 12:51:41,004] Trial 169 finished with value: 2.057112895643366 and parameters: {'model_name': 'RandomForestImputer', 'max_iter': 4, 'decreasing': True, 'min_samples_split': 0.4, 'min_samples_leaf': 0.7000000000000001, 'max_features': 0.5, 'warm_start': False}. Best is trial 165 with value: 2.048734215142962.
[I 2023-12-28 12:51:47,363] Trial 171 finished with value: 2.0597361118052175 and parameters: {'model_name': 'RandomForestImputer', 'max_iter': 4, 'decreasing': True, 'min_samples_split': 0.4, 'min_samples_leaf': 0.2, 'max_features': 0.4, 'warm_start': False}. Best is trial 165 with value: 2.048734215142962.
[I 2023-12-28 12:51:52,958] Trial 172 finished with value: 2.0498051851380836 and parameters: {'model_name': 'RandomForestImputer', 'max_iter': 4, 'decreasing': True, 'min_samples_split': 0.4, 'min_samples_leaf': 0.2, 'max_features': 0.5, 'warm_start': False}. Best is trial 165 with value: 2.048734215142962.
[I 2023-12-28 12:52:11,393] Trial 174 finished with value: 2.0527106024949187 and parameters: {'model_name': 'RandomForestImputer', 'max_iter': 5, 'decreasing': True, 'min_samples_split': 0.4, 'min_samples_leaf': 0.2, 'max_features': 0.4, 'warm_start': False}. Best is trial 165 with value: 2.048734215142962.
[I 2023-12-28 12:52:18,371] Trial 180 finished with value: 2.054136982769491 and parameters: {'model_name': 'RandomForestImputer', 'max_iter': 5, 'decreasing': True, 'min_samples_split': 0.30000000000000004, 'min_samples_leaf': 0.2, 'max_features': 0.2, 'warm_start': False}. Best is trial 165 with value: 2.048734215142962.
[I 2023-12-28 12:52:22,271] Trial 176 finished with value: 2.0527783049967256 and parameters: {'model_name': 'RandomForestImputer', 'max_iter': 5, 'decreasing': True, 'min_samples_split': 0.30000000000000004, 'min_samples_leaf': 0.2, 'max_features': 0.2, 'warm_start': False}. Best is trial 165 with value: 2.048734215142962.
[I 2023-12-28 12:52:28,238] Trial 175 finished with value: 2.0569907036931694 and parameters: {'model_name': 'RandomForestImputer', 'max_iter': 5, 'decreasing': True, 'min_samples_split': 0.30000000000000004, 'min_samples_leaf': 0.7000000000000001, 'max_features': 0.30000000000000004, 'warm_start': False}. Best is trial 165 with value: 2.048734215142962.
[I 2023-12-28 12:52:34,263] Trial 178 finished with value: 2.0589885863649546 and parameters: {'model_name': 'RandomForestImputer', 'max_iter': 6, 'decreasing': True, 'min_samples_split': 0.30000000000000004, 'min_samples_leaf': 0.30000000000000004, 'max_features': 0.2, 'warm_start': False}. Best is trial 165 with value: 2.048734215142962.
[I 2023-12-28 12:52:36,366] Trial 179 finished with value: 2.057810242315795 and parameters: {'model_name': 'RandomForestImputer', 'max_iter': 5, 'decreasing': True, 'min_samples_split': 0.30000000000000004, 'min_samples_leaf': 0.2, 'max_features': 0.2, 'warm_start': False}. Best is trial 165 with value: 2.048734215142962.
[I 2023-12-28 12:52:39,864] Trial 194 finished with value: 2.054300691900246 and parameters: {'model_name': 'RandomForestImputer', 'max_iter': 6, 'decreasing': True, 'min_samples_split': 0.30000000000000004, 'min_samples_leaf': 0.2, 'max_features': 0.2, 'warm_start': False}. Best is trial 165 with value: 2.048734215142962.
[I 2023-12-28 12:52:43,174] Trial 173 finished with value: 2.0591725500019833 and parameters: {'model_name': 'RandomForestImputer', 'max_iter': 6, 'decreasing': True, 'min_samples_split': 0.4, 'min_samples_leaf': 0.7000000000000001, 'max_features': 0.2, 'warm_start': False}. Best is trial 165 with value: 2.048734215142962.
[I 2023-12-28 12:52:52,712] Trial 177 finished with value: 2.0587082606532454 and parameters: {'model_name': 'RandomForestImputer', 'max_iter': 6, 'decreasing': True, 'min_samples_split': 0.30000000000000004, 'min_samples_leaf': 0.30000000000000004, 'max_features': 0.2, 'warm_start': False}. Best is trial 165 with value: 2.048734215142962.
[I 2023-12-28 12:52:54,203] Trial 181 finished with value: 2.0586904401811514 and parameters: {'model_name': 'RandomForestImputer', 'max_iter': 7, 'decreasing': True, 'min_samples_split': 0.30000000000000004, 'min_samples_leaf': 0.2, 'max_features': 0.2, 'warm_start': False}. Best is trial 165 with value: 2.048734215142962.
[I 2023-12-28 12:52:57,237] Trial 198 finished with value: 2.0517186360377244 and parameters: {'model_name': 'RandomForestImputer', 'max_iter': 6, 'decreasing': True, 'min_samples_split': 0.30000000000000004, 'min_samples_leaf': 0.2, 'max_features': 0.30000000000000004, 'warm_start': False}. Best is trial 165 with value: 2.048734215142962.
[I 2023-12-28 12:52:58,252] Trial 199 finished with value: 2.0540122554056843 and parameters: {'model_name': 'RandomForestImputer', 'max_iter': 6, 'decreasing': True, 'min_samples_split': 0.30000000000000004, 'min_samples_leaf': 0.2, 'max_features': 0.30000000000000004, 'warm_start': False}. Best is trial 165 with value: 2.048734215142962.
[I 2023-12-28 12:52:59,538] Trial 197 finished with value: 2.05798898700551 and parameters: {'model_name': 'RandomForestImputer', 'max_iter': 6, 'decreasing': True, 'min_samples_split': 0.30000000000000004, 'min_samples_leaf': 0.2, 'max_features': 0.30000000000000004, 'warm_start': False}. Best is trial 165 with value: 2.048734215142962.
[I 2023-12-28 12:53:02,322] Trial 195 finished with value: 2.054498893999833 and parameters: {'model_name': 'RandomForestImputer', 'max_iter': 6, 'decreasing': True, 'min_samples_split': 0.30000000000000004, 'min_samples_leaf': 0.2, 'max_features': 0.2, 'warm_start': False}. Best is trial 165 with value: 2.048734215142962.
[I 2023-12-28 12:53:03,511] Trial 183 finished with value: 2.055603005314286 and parameters: {'model_name': 'RandomForestImputer', 'max_iter': 6, 'decreasing': True, 'min_samples_split': 0.30000000000000004, 'min_samples_leaf': 0.2, 'max_features': 0.30000000000000004, 'warm_start': False}. Best is trial 165 with value: 2.048734215142962.
[I 2023-12-28 12:53:04,531] Trial 187 finished with value: 2.053631015357368 and parameters: {'model_name': 'RandomForestImputer', 'max_iter': 7, 'decreasing': True, 'min_samples_split': 0.2, 'min_samples_leaf': 0.2, 'max_features': 0.2, 'warm_start': False}. Best is trial 165 with value: 2.048734215142962.
[I 2023-12-28 12:53:13,998] Trial 189 finished with value: 2.057551915653714 and parameters: {'model_name': 'RandomForestImputer', 'max_iter': 7, 'decreasing': True, 'min_samples_split': 0.2, 'min_samples_leaf': 0.2, 'max_features': 0.2, 'warm_start': False}. Best is trial 165 with value: 2.048734215142962.
[I 2023-12-28 12:53:17,121] Trial 192 finished with value: 2.0566919477395564 and parameters: {'model_name': 'RandomForestImputer', 'max_iter': 7, 'decreasing': True, 'min_samples_split': 0.30000000000000004, 'min_samples_leaf': 0.2, 'max_features': 0.2, 'warm_start': False}. Best is trial 165 with value: 2.048734215142962.
[I 2023-12-28 12:53:18,819] Trial 196 finished with value: 2.05523450053324 and parameters: {'model_name': 'RandomForestImputer', 'max_iter': 7, 'decreasing': True, 'min_samples_split': 0.2, 'min_samples_leaf': 0.2, 'max_features': 0.30000000000000004, 'warm_start': False}. Best is trial 165 with value: 2.048734215142962.
[I 2023-12-28 12:53:20,134] Trial 184 finished with value: 2.050880150544402 and parameters: {'model_name': 'RandomForestImputer', 'max_iter': 9, 'decreasing': True, 'min_samples_split': 0.2, 'min_samples_leaf': 0.2, 'max_features': 0.30000000000000004, 'warm_start': False}. Best is trial 165 with value: 2.048734215142962.
[I 2023-12-28 12:53:21,153] Trial 191 finished with value: 2.053459197564271 and parameters: {'model_name': 'RandomForestImputer', 'max_iter': 9, 'decreasing': True, 'min_samples_split': 0.30000000000000004, 'min_samples_leaf': 0.2, 'max_features': 0.2, 'warm_start': False}. Best is trial 165 with value: 2.048734215142962.
[I 2023-12-28 12:53:22,232] Trial 6 finished with value: 3.489420282449161 and parameters: {'model_name': 'GAIN', 'batch_size': 8, 'hint_rate': 0.81, 'alpha': 50, 'iterations': 271}. Best is trial 165 with value: 2.048734215142962.
[I 2023-12-28 12:53:23,564] Trial 92 finished with value: 2.0580152321882066 and parameters: {'model_name': 'RandomForestImputer', 'max_iter': 36, 'decreasing': True, 'min_samples_split': 0.30000000000000004, 'min_samples_leaf': 0.6, 'max_features': 0.6, 'warm_start': False}. Best is trial 165 with value: 2.048734215142962.
[I 2023-12-28 12:53:32,519] Trial 190 finished with value: 2.053275841673975 and parameters: {'model_name': 'RandomForestImputer', 'max_iter': 11, 'decreasing': True, 'min_samples_split': 0.2, 'min_samples_leaf': 0.2, 'max_features': 0.2, 'warm_start': False}. Best is trial 165 with value: 2.048734215142962.
[I 2023-12-28 12:53:35,260] Trial 193 finished with value: 2.0572269116118878 and parameters: {'model_name': 'RandomForestImputer', 'max_iter': 9, 'decreasing': True, 'min_samples_split': 0.30000000000000004, 'min_samples_leaf': 0.2, 'max_features': 0.30000000000000004, 'warm_start': False}. Best is trial 165 with value: 2.048734215142962.
[I 2023-12-28 12:53:45,075] Trial 20 finished with value: 2.6479773479791793 and parameters: {'model_name': 'GAIN', 'batch_size': 17, 'hint_rate': 0.99, 'alpha': 42, 'iterations': 361}. Best is trial 165 with value: 2.048734215142962.
[I 2023-12-28 12:53:59,182] Trial 188 finished with value: 2.0559933842109372 and parameters: {'model_name': 'RandomForestImputer', 'max_iter': 22, 'decreasing': True, 'min_samples_split': 0.30000000000000004, 'min_samples_leaf': 0.2, 'max_features': 0.2, 'warm_start': False}. Best is trial 165 with value: 2.048734215142962.
[I 2023-12-28 12:54:00,228] Trial 182 finished with value: 2.0558554896549435 and parameters: {'model_name': 'RandomForestImputer', 'max_iter': 22, 'decreasing': True, 'min_samples_split': 0.30000000000000004, 'min_samples_leaf': 0.2, 'max_features': 0.30000000000000004, 'warm_start': False}. Best is trial 165 with value: 2.048734215142962.
[I 2023-12-28 12:54:05,127] Trial 24 finished with value: 2.057857565485749 and parameters: {'model_name': 'RandomForestImputer', 'max_iter': 82, 'decreasing': False, 'min_samples_split': 0.1, 'min_samples_leaf': 0.6, 'max_features': 0.6, 'warm_start': False}. Best is trial 165 with value: 2.048734215142962.
[I 2023-12-28 12:54:09,543] Trial 69 finished with value: inf and parameters: {'model_name': 'GAIN', 'batch_size': 42, 'hint_rate': 0.5800000000000001, 'alpha': 2, 'iterations': 5801}. Best is trial 165 with value: 2.048734215142962.
[I 2023-12-28 12:54:11,972] Trial 15 finished with value: 2.0578005769156897 and parameters: {'model_name': 'RandomForestImputer', 'max_iter': 79, 'decreasing': False, 'min_samples_split': 0.5, 'min_samples_leaf': 0.9, 'max_features': 0.5, 'warm_start': False}. Best is trial 165 with value: 2.048734215142962.
[I 2023-12-28 12:54:24,628] Trial 47 finished with value: inf and parameters: {'model_name': 'GAIN', 'batch_size': 15, 'hint_rate': 0.48000000000000004, 'alpha': 85, 'iterations': 14240}. Best is trial 165 with value: 2.048734215142962.
