Run: 10
/cm/local/apps/slurm/var/spool/job567308/slurm_script: line 23: /common/ketrong/minconda3/etc/profile.d/conda.sh: No such file or directory
/cm/local/apps/slurm/var/spool/job567308/slurm_script: line 26: $'\nconda create --name tpot2devenv -c conda-forge python=3.10\n': command not found
/cm/local/apps/slurm/var/spool/job567308/slurm_script: line 31: $'\npip install -r requirements.txt\n': command not found
RunStart
2023-12-27 12:59:21.678293: I tensorflow/core/util/port.cc:113] oneDNN custom operations are on. You may see slightly different numerical results due to floating-point round-off errors from different computation orders. To turn them off, set the environment variable `TF_ENABLE_ONEDNN_OPTS=0`.
2023-12-27 12:59:21.711735: E external/local_xla/xla/stream_executor/cuda/cuda_dnn.cc:9261] Unable to register cuDNN factory: Attempting to register factory for plugin cuDNN when one has already been registered
2023-12-27 12:59:21.711758: E external/local_xla/xla/stream_executor/cuda/cuda_fft.cc:607] Unable to register cuFFT factory: Attempting to register factory for plugin cuFFT when one has already been registered
2023-12-27 12:59:21.712663: E external/local_xla/xla/stream_executor/cuda/cuda_blas.cc:1515] Unable to register cuBLAS factory: Attempting to register factory for plugin cuBLAS when one has already been registered
2023-12-27 12:59:21.717768: I tensorflow/core/platform/cpu_feature_guard.cc:182] This TensorFlow binary is optimized to use available CPU instructions in performance-critical operations.
To enable the following instructions: AVX2 AVX512F AVX512_VNNI FMA, in other operations, rebuild TensorFlow with the appropriate compiler flags.
2023-12-27 12:59:24.264232: W tensorflow/compiler/tf2tensorrt/utils/py_utils.cc:38] TF-TRT Warning: Could not find TensorRT
WARNING:tensorflow:From /home/ketrong/miniconda3/envs/tpot2devenv/lib/python3.10/site-packages/tensorflow/python/compat/v2_compat.py:108: disable_resource_variables (from tensorflow.python.ops.variable_scope) is deprecated and will be removed in a future version.
Instructions for updating:
non-resource variables are not supported in the long term
starting loops
working on 
logs/3483/tpot2_base_normal_MAR_0.9
2.00290584564209
loading data
logs/3483/tpot2_base_normal_MAR_0.9/data/3483_True.pkl
running experiment 1/3 - Does large hyperparameter space improve reconstruction accuracy over simple
[I 2023-12-27 12:59:36,244] A new study created in memory with name: no-name-3d4761e1-f664-4897-a9ef-c5264214208c
[I 2023-12-27 12:59:36,781] Trial 9 finished with value: 0.7781151119789689 and parameters: {'model_name': 'SimpleImputer', 'strategy': 'constant'}. Best is trial 9 with value: 0.7781151119789689.
[I 2023-12-27 12:59:37,154] Trial 6 finished with value: 0.7781151119789689 and parameters: {'model_name': 'SimpleImputer', 'strategy': 'constant'}. Best is trial 9 with value: 0.7781151119789689.
[I 2023-12-27 12:59:37,420] Trial 2 finished with value: 0.7781151119789689 and parameters: {'model_name': 'SimpleImputer', 'strategy': 'constant'}. Best is trial 9 with value: 0.7781151119789689.
[I 2023-12-27 12:59:37,706] Trial 13 finished with value: 0.7781151119789689 and parameters: {'model_name': 'SimpleImputer', 'strategy': 'constant'}. Best is trial 9 with value: 0.7781151119789689.
[I 2023-12-27 12:59:37,913] Trial 1 finished with value: 0.7788100826710467 and parameters: {'model_name': 'SimpleImputer', 'strategy': 'mean'}. Best is trial 9 with value: 0.7781151119789689.
[I 2023-12-27 12:59:38,288] Trial 18 finished with value: 0.7781151119789689 and parameters: {'model_name': 'SimpleImputer', 'strategy': 'constant'}. Best is trial 9 with value: 0.7781151119789689.
[I 2023-12-27 12:59:38,643] Trial 10 finished with value: 0.7788100826710467 and parameters: {'model_name': 'SimpleImputer', 'strategy': 'mean'}. Best is trial 9 with value: 0.7781151119789689.
[I 2023-12-27 12:59:38,844] Trial 14 finished with value: 0.7781151119789689 and parameters: {'model_name': 'SimpleImputer', 'strategy': 'constant'}. Best is trial 9 with value: 0.7781151119789689.
[I 2023-12-27 12:59:39,050] Trial 19 finished with value: 0.7781151119789689 and parameters: {'model_name': 'SimpleImputer', 'strategy': 'constant'}. Best is trial 9 with value: 0.7781151119789689.
[I 2023-12-27 12:59:39,922] Trial 26 finished with value: 0.7788100826710467 and parameters: {'model_name': 'SimpleImputer', 'strategy': 'mean'}. Best is trial 9 with value: 0.7781151119789689.
[I 2023-12-27 12:59:40,180] Trial 33 finished with value: 0.7781151119789689 and parameters: {'model_name': 'SimpleImputer', 'strategy': 'constant'}. Best is trial 9 with value: 0.7781151119789689.
[I 2023-12-27 12:59:40,185] Trial 28 finished with value: 0.7788100826710467 and parameters: {'model_name': 'SimpleImputer', 'strategy': 'mean'}. Best is trial 9 with value: 0.7781151119789689.
[I 2023-12-27 12:59:40,708] Trial 29 finished with value: 0.7781151119789689 and parameters: {'model_name': 'SimpleImputer', 'strategy': 'constant'}. Best is trial 9 with value: 0.7781151119789689.
[I 2023-12-27 12:59:41,083] Trial 34 finished with value: 0.7788100826710467 and parameters: {'model_name': 'SimpleImputer', 'strategy': 'mean'}. Best is trial 9 with value: 0.7781151119789689.
[I 2023-12-27 12:59:41,349] Trial 5 finished with value: 0.8898970093218349 and parameters: {'model_name': 'SimpleImputer', 'strategy': 'median'}. Best is trial 9 with value: 0.7781151119789689.
[I 2023-12-27 12:59:41,602] Trial 3 finished with value: 0.8898970093218349 and parameters: {'model_name': 'SimpleImputer', 'strategy': 'median'}. Best is trial 9 with value: 0.7781151119789689.
[I 2023-12-27 12:59:41,869] Trial 48 finished with value: 0.7781151119789689 and parameters: {'model_name': 'SimpleImputer', 'strategy': 'constant'}. Best is trial 9 with value: 0.7781151119789689.
[I 2023-12-27 12:59:42,124] Trial 32 finished with value: 0.7788100826710467 and parameters: {'model_name': 'SimpleImputer', 'strategy': 'mean'}. Best is trial 9 with value: 0.7781151119789689.
[I 2023-12-27 12:59:42,383] Trial 45 finished with value: 0.7781151119789689 and parameters: {'model_name': 'SimpleImputer', 'strategy': 'constant'}. Best is trial 9 with value: 0.7781151119789689.
[I 2023-12-27 12:59:42,638] Trial 42 finished with value: 0.7781151119789689 and parameters: {'model_name': 'SimpleImputer', 'strategy': 'constant'}. Best is trial 9 with value: 0.7781151119789689.
[I 2023-12-27 12:59:42,827] Trial 0 finished with value: 0.8898970093218349 and parameters: {'model_name': 'SimpleImputer', 'strategy': 'median'}. Best is trial 9 with value: 0.7781151119789689.
[I 2023-12-27 12:59:43,042] Trial 39 finished with value: 0.7788100826710467 and parameters: {'model_name': 'SimpleImputer', 'strategy': 'mean'}. Best is trial 9 with value: 0.7781151119789689.
[I 2023-12-27 12:59:43,382] Trial 17 finished with value: 0.8898970093218349 and parameters: {'model_name': 'SimpleImputer', 'strategy': 'median'}. Best is trial 9 with value: 0.7781151119789689.
[I 2023-12-27 12:59:43,645] Trial 41 finished with value: 0.7788100826710467 and parameters: {'model_name': 'SimpleImputer', 'strategy': 'mean'}. Best is trial 9 with value: 0.7781151119789689.
[I 2023-12-27 12:59:43,881] Trial 25 finished with value: 0.8898970093218349 and parameters: {'model_name': 'SimpleImputer', 'strategy': 'median'}. Best is trial 9 with value: 0.7781151119789689.
[I 2023-12-27 12:59:44,199] Trial 38 finished with value: 0.7788100826710467 and parameters: {'model_name': 'SimpleImputer', 'strategy': 'mean'}. Best is trial 9 with value: 0.7781151119789689.
[I 2023-12-27 12:59:44,392] Trial 12 finished with value: 0.8898970093218349 and parameters: {'model_name': 'SimpleImputer', 'strategy': 'median'}. Best is trial 9 with value: 0.7781151119789689.
[I 2023-12-27 12:59:44,599] Trial 22 finished with value: 0.8898970093218349 and parameters: {'model_name': 'SimpleImputer', 'strategy': 'median'}. Best is trial 9 with value: 0.7781151119789689.
[I 2023-12-27 12:59:44,769] Trial 23 finished with value: 0.8898970093218349 and parameters: {'model_name': 'SimpleImputer', 'strategy': 'median'}. Best is trial 9 with value: 0.7781151119789689.
[I 2023-12-27 12:59:45,078] Trial 49 finished with value: 0.7788100826710467 and parameters: {'model_name': 'SimpleImputer', 'strategy': 'mean'}. Best is trial 9 with value: 0.7781151119789689.
[I 2023-12-27 12:59:45,256] Trial 53 finished with value: 0.7788100826710467 and parameters: {'model_name': 'SimpleImputer', 'strategy': 'mean'}. Best is trial 9 with value: 0.7781151119789689.
[I 2023-12-27 12:59:45,507] Trial 20 finished with value: 0.8898970093218349 and parameters: {'model_name': 'SimpleImputer', 'strategy': 'median'}. Best is trial 9 with value: 0.7781151119789689.
[I 2023-12-27 12:59:45,791] Trial 11 finished with value: 0.8898970093218349 and parameters: {'model_name': 'SimpleImputer', 'strategy': 'median'}. Best is trial 9 with value: 0.7781151119789689.
[I 2023-12-27 12:59:46,104] Trial 30 finished with value: 0.8898970093218349 and parameters: {'model_name': 'SimpleImputer', 'strategy': 'median'}. Best is trial 9 with value: 0.7781151119789689.
[I 2023-12-27 12:59:46,294] Trial 27 finished with value: 0.8898970093218349 and parameters: {'model_name': 'SimpleImputer', 'strategy': 'median'}. Best is trial 9 with value: 0.7781151119789689.
[I 2023-12-27 12:59:46,639] Trial 50 finished with value: 0.7788100826710467 and parameters: {'model_name': 'SimpleImputer', 'strategy': 'mean'}. Best is trial 9 with value: 0.7781151119789689.
[I 2023-12-27 12:59:46,902] Trial 51 finished with value: 0.7788100826710467 and parameters: {'model_name': 'SimpleImputer', 'strategy': 'mean'}. Best is trial 9 with value: 0.7781151119789689.
[I 2023-12-27 12:59:47,191] Trial 8 finished with value: 0.8898970093218349 and parameters: {'model_name': 'SimpleImputer', 'strategy': 'most_frequent'}. Best is trial 9 with value: 0.7781151119789689.
[I 2023-12-27 12:59:47,568] Trial 4 finished with value: 0.8898970093218349 and parameters: {'model_name': 'SimpleImputer', 'strategy': 'most_frequent'}. Best is trial 9 with value: 0.7781151119789689.
[I 2023-12-27 12:59:48,005] Trial 15 finished with value: 0.8898970093218349 and parameters: {'model_name': 'SimpleImputer', 'strategy': 'most_frequent'}. Best is trial 9 with value: 0.7781151119789689.
[I 2023-12-27 12:59:48,324] Trial 43 finished with value: 0.8898970093218349 and parameters: {'model_name': 'SimpleImputer', 'strategy': 'median'}. Best is trial 9 with value: 0.7781151119789689.
[I 2023-12-27 12:59:48,723] Trial 37 finished with value: 0.8898970093218349 and parameters: {'model_name': 'SimpleImputer', 'strategy': 'median'}. Best is trial 9 with value: 0.7781151119789689.
[I 2023-12-27 12:59:48,929] Trial 7 finished with value: 0.8898970093218349 and parameters: {'model_name': 'SimpleImputer', 'strategy': 'most_frequent'}. Best is trial 9 with value: 0.7781151119789689.
[I 2023-12-27 12:59:49,201] Trial 55 finished with value: 0.8898970093218349 and parameters: {'model_name': 'SimpleImputer', 'strategy': 'median'}. Best is trial 9 with value: 0.7781151119789689.
[I 2023-12-27 12:59:49,380] Trial 74 finished with value: 0.7781151119789689 and parameters: {'model_name': 'SimpleImputer', 'strategy': 'constant'}. Best is trial 9 with value: 0.7781151119789689.
[I 2023-12-27 12:59:49,547] Trial 24 finished with value: 0.8898970093218349 and parameters: {'model_name': 'SimpleImputer', 'strategy': 'most_frequent'}. Best is trial 9 with value: 0.7781151119789689.
[I 2023-12-27 12:59:49,793] Trial 47 finished with value: 0.8898970093218349 and parameters: {'model_name': 'SimpleImputer', 'strategy': 'median'}. Best is trial 9 with value: 0.7781151119789689.
[I 2023-12-27 12:59:50,196] Trial 21 finished with value: 0.8898970093218349 and parameters: {'model_name': 'SimpleImputer', 'strategy': 'most_frequent'}. Best is trial 9 with value: 0.7781151119789689.
[I 2023-12-27 12:59:50,598] Trial 44 finished with value: 0.8898970093218349 and parameters: {'model_name': 'SimpleImputer', 'strategy': 'median'}. Best is trial 9 with value: 0.7781151119789689.
[I 2023-12-27 12:59:50,899] Trial 16 finished with value: 0.8898970093218349 and parameters: {'model_name': 'SimpleImputer', 'strategy': 'most_frequent'}. Best is trial 9 with value: 0.7781151119789689.
[I 2023-12-27 12:59:51,396] Trial 88 finished with value: 0.7781151119789689 and parameters: {'model_name': 'SimpleImputer', 'strategy': 'constant'}. Best is trial 9 with value: 0.7781151119789689.
[I 2023-12-27 12:59:51,757] Trial 92 finished with value: 0.7781151119789689 and parameters: {'model_name': 'SimpleImputer', 'strategy': 'constant'}. Best is trial 9 with value: 0.7781151119789689.
[I 2023-12-27 12:59:52,048] Trial 89 finished with value: 0.7781151119789689 and parameters: {'model_name': 'SimpleImputer', 'strategy': 'constant'}. Best is trial 9 with value: 0.7781151119789689.
[I 2023-12-27 12:59:52,317] Trial 57 finished with value: 0.8898970093218349 and parameters: {'model_name': 'SimpleImputer', 'strategy': 'median'}. Best is trial 9 with value: 0.7781151119789689.
[I 2023-12-27 12:59:52,518] Trial 58 finished with value: 0.8898970093218349 and parameters: {'model_name': 'SimpleImputer', 'strategy': 'median'}. Best is trial 9 with value: 0.7781151119789689.
[I 2023-12-27 12:59:52,757] Trial 60 finished with value: 0.8898970093218349 and parameters: {'model_name': 'SimpleImputer', 'strategy': 'median'}. Best is trial 9 with value: 0.7781151119789689.
[I 2023-12-27 12:59:53,044] Trial 52 finished with value: 0.8898970093218349 and parameters: {'model_name': 'SimpleImputer', 'strategy': 'most_frequent'}. Best is trial 9 with value: 0.7781151119789689.
[I 2023-12-27 12:59:53,297] Trial 54 finished with value: 0.8898970093218349 and parameters: {'model_name': 'SimpleImputer', 'strategy': 'median'}. Best is trial 9 with value: 0.7781151119789689.
[I 2023-12-27 12:59:53,551] Trial 31 finished with value: 0.8898970093218349 and parameters: {'model_name': 'SimpleImputer', 'strategy': 'most_frequent'}. Best is trial 9 with value: 0.7781151119789689.
[I 2023-12-27 12:59:53,775] Trial 87 finished with value: 0.7781151119789689 and parameters: {'model_name': 'SimpleImputer', 'strategy': 'constant'}. Best is trial 9 with value: 0.7781151119789689.
[I 2023-12-27 12:59:54,086] Trial 91 finished with value: 0.7781151119789689 and parameters: {'model_name': 'SimpleImputer', 'strategy': 'constant'}. Best is trial 9 with value: 0.7781151119789689.
[I 2023-12-27 12:59:54,329] Trial 40 finished with value: 0.8898970093218349 and parameters: {'model_name': 'SimpleImputer', 'strategy': 'most_frequent'}. Best is trial 9 with value: 0.7781151119789689.
[I 2023-12-27 12:59:54,509] Trial 35 finished with value: 0.8898970093218349 and parameters: {'model_name': 'SimpleImputer', 'strategy': 'most_frequent'}. Best is trial 9 with value: 0.7781151119789689.
[I 2023-12-27 12:59:54,690] Trial 46 finished with value: 0.8898970093218349 and parameters: {'model_name': 'SimpleImputer', 'strategy': 'most_frequent'}. Best is trial 9 with value: 0.7781151119789689.
[I 2023-12-27 12:59:54,945] Trial 36 finished with value: 0.8898970093218349 and parameters: {'model_name': 'SimpleImputer', 'strategy': 'most_frequent'}. Best is trial 9 with value: 0.7781151119789689.
[I 2023-12-27 12:59:55,148] Trial 90 finished with value: 0.7781151119789689 and parameters: {'model_name': 'SimpleImputer', 'strategy': 'constant'}. Best is trial 9 with value: 0.7781151119789689.
[I 2023-12-27 12:59:55,352] Trial 94 finished with value: 0.7781151119789689 and parameters: {'model_name': 'SimpleImputer', 'strategy': 'constant'}. Best is trial 9 with value: 0.7781151119789689.
[I 2023-12-27 12:59:55,624] Trial 96 finished with value: 0.7781151119789689 and parameters: {'model_name': 'SimpleImputer', 'strategy': 'constant'}. Best is trial 9 with value: 0.7781151119789689.
[I 2023-12-27 12:59:55,907] Trial 56 finished with value: 0.8898970093218349 and parameters: {'model_name': 'SimpleImputer', 'strategy': 'most_frequent'}. Best is trial 9 with value: 0.7781151119789689.
[I 2023-12-27 12:59:56,152] Trial 97 finished with value: 0.7781151119789689 and parameters: {'model_name': 'SimpleImputer', 'strategy': 'constant'}. Best is trial 9 with value: 0.7781151119789689.
[I 2023-12-27 12:59:56,578] Trial 93 finished with value: 0.7781151119789689 and parameters: {'model_name': 'SimpleImputer', 'strategy': 'constant'}. Best is trial 9 with value: 0.7781151119789689.
[I 2023-12-27 12:59:57,007] Trial 101 finished with value: 0.7781151119789689 and parameters: {'model_name': 'SimpleImputer', 'strategy': 'constant'}. Best is trial 9 with value: 0.7781151119789689.
[I 2023-12-27 12:59:57,316] Trial 99 finished with value: 0.7781151119789689 and parameters: {'model_name': 'SimpleImputer', 'strategy': 'constant'}. Best is trial 9 with value: 0.7781151119789689.
[I 2023-12-27 12:59:57,511] Trial 95 finished with value: 0.7781151119789689 and parameters: {'model_name': 'SimpleImputer', 'strategy': 'constant'}. Best is trial 9 with value: 0.7781151119789689.
[I 2023-12-27 12:59:57,777] Trial 65 finished with value: 0.8898970093218349 and parameters: {'model_name': 'SimpleImputer', 'strategy': 'most_frequent'}. Best is trial 9 with value: 0.7781151119789689.
[I 2023-12-27 12:59:58,133] Trial 103 finished with value: 0.7781151119789689 and parameters: {'model_name': 'SimpleImputer', 'strategy': 'constant'}. Best is trial 9 with value: 0.7781151119789689.
[I 2023-12-27 12:59:58,400] Trial 98 finished with value: 0.7781151119789689 and parameters: {'model_name': 'SimpleImputer', 'strategy': 'constant'}. Best is trial 9 with value: 0.7781151119789689.
[I 2023-12-27 12:59:58,795] Trial 100 finished with value: 0.7781151119789689 and parameters: {'model_name': 'SimpleImputer', 'strategy': 'constant'}. Best is trial 9 with value: 0.7781151119789689.
[I 2023-12-27 12:59:59,081] Trial 61 finished with value: 0.8898970093218349 and parameters: {'model_name': 'SimpleImputer', 'strategy': 'most_frequent'}. Best is trial 9 with value: 0.7781151119789689.
[I 2023-12-27 12:59:59,272] Trial 102 finished with value: 0.7781151119789689 and parameters: {'model_name': 'SimpleImputer', 'strategy': 'constant'}. Best is trial 9 with value: 0.7781151119789689.
[I 2023-12-27 12:59:59,584] Trial 105 finished with value: 0.7781151119789689 and parameters: {'model_name': 'SimpleImputer', 'strategy': 'constant'}. Best is trial 9 with value: 0.7781151119789689.
[I 2023-12-27 12:59:59,851] Trial 59 finished with value: 0.8898970093218349 and parameters: {'model_name': 'SimpleImputer', 'strategy': 'most_frequent'}. Best is trial 9 with value: 0.7781151119789689.
[I 2023-12-27 13:00:00,166] Trial 106 finished with value: 0.7781151119789689 and parameters: {'model_name': 'SimpleImputer', 'strategy': 'constant'}. Best is trial 9 with value: 0.7781151119789689.
[I 2023-12-27 13:00:00,417] Trial 67 finished with value: 0.8898970093218349 and parameters: {'model_name': 'SimpleImputer', 'strategy': 'most_frequent'}. Best is trial 9 with value: 0.7781151119789689.
[I 2023-12-27 13:00:00,655] Trial 70 finished with value: 0.8898970093218349 and parameters: {'model_name': 'SimpleImputer', 'strategy': 'most_frequent'}. Best is trial 9 with value: 0.7781151119789689.
[I 2023-12-27 13:00:00,837] Trial 66 finished with value: 0.8898970093218349 and parameters: {'model_name': 'SimpleImputer', 'strategy': 'most_frequent'}. Best is trial 9 with value: 0.7781151119789689.
[I 2023-12-27 13:00:01,045] Trial 63 finished with value: 0.8898970093218349 and parameters: {'model_name': 'SimpleImputer', 'strategy': 'most_frequent'}. Best is trial 9 with value: 0.7781151119789689.
[I 2023-12-27 13:00:01,345] Trial 107 finished with value: 0.7781151119789689 and parameters: {'model_name': 'SimpleImputer', 'strategy': 'constant'}. Best is trial 9 with value: 0.7781151119789689.
[I 2023-12-27 13:00:01,588] Trial 111 finished with value: 0.7781151119789689 and parameters: {'model_name': 'SimpleImputer', 'strategy': 'constant'}. Best is trial 9 with value: 0.7781151119789689.
[I 2023-12-27 13:00:01,894] Trial 117 finished with value: 0.7781151119789689 and parameters: {'model_name': 'SimpleImputer', 'strategy': 'constant'}. Best is trial 9 with value: 0.7781151119789689.
[I 2023-12-27 13:00:02,076] Trial 104 finished with value: 0.7781151119789689 and parameters: {'model_name': 'SimpleImputer', 'strategy': 'constant'}. Best is trial 9 with value: 0.7781151119789689.
[I 2023-12-27 13:00:02,087] Trial 120 finished with value: 0.7781151119789689 and parameters: {'model_name': 'SimpleImputer', 'strategy': 'constant'}. Best is trial 9 with value: 0.7781151119789689.
[I 2023-12-27 13:00:02,132] Trial 69 finished with value: 0.8898970093218349 and parameters: {'model_name': 'SimpleImputer', 'strategy': 'most_frequent'}. Best is trial 9 with value: 0.7781151119789689.
[I 2023-12-27 13:00:02,136] Trial 109 finished with value: 0.7781151119789689 and parameters: {'model_name': 'SimpleImputer', 'strategy': 'constant'}. Best is trial 9 with value: 0.7781151119789689.
[I 2023-12-27 13:00:02,176] Trial 114 finished with value: 0.7781151119789689 and parameters: {'model_name': 'SimpleImputer', 'strategy': 'constant'}. Best is trial 9 with value: 0.7781151119789689.
[I 2023-12-27 13:00:02,353] Trial 116 finished with value: 0.7781151119789689 and parameters: {'model_name': 'SimpleImputer', 'strategy': 'constant'}. Best is trial 9 with value: 0.7781151119789689.
[I 2023-12-27 13:00:02,644] Trial 113 finished with value: 0.7781151119789689 and parameters: {'model_name': 'SimpleImputer', 'strategy': 'constant'}. Best is trial 9 with value: 0.7781151119789689.
[I 2023-12-27 13:00:02,884] Trial 112 finished with value: 0.7781151119789689 and parameters: {'model_name': 'SimpleImputer', 'strategy': 'constant'}. Best is trial 9 with value: 0.7781151119789689.
