[I 2024-04-23 02:25:03,827] Trial 78 finished with value: 1024.5307462254152 and parameters: {'model_name': 'IterativeImputer', 'sample_posterior': True, 'initial_strategy': 'mean', 'imputation_order': 'roman'}. Best is trial 52 with value: 662.1936991452613.
[I 2024-04-23 02:25:04,674] Trial 71 finished with value: 900.8342099935896 and parameters: {'model_name': 'IterativeImputer', 'sample_posterior': True, 'initial_strategy': 'constant', 'imputation_order': 'arabic'}. Best is trial 52 with value: 662.1936991452613.
[I 2024-04-23 02:25:06,216] Trial 74 finished with value: 967.5039883507868 and parameters: {'model_name': 'IterativeImputer', 'sample_posterior': True, 'initial_strategy': 'most_frequent', 'imputation_order': 'arabic'}. Best is trial 52 with value: 662.1936991452613.
[I 2024-04-23 02:25:08,042] Trial 31 finished with value: 730.058083887626 and parameters: {'model_name': 'RandomForestImputer', 'max_iter': 22, 'decreasing': True, 'min_samples_split': 0.4, 'min_samples_leaf': 0.8, 'max_features': 0.6, 'warm_start': False}. Best is trial 52 with value: 662.1936991452613.
[I 2024-04-23 02:25:10,084] Trial 75 finished with value: 900.2928964991397 and parameters: {'model_name': 'IterativeImputer', 'sample_posterior': True, 'initial_strategy': 'most_frequent', 'imputation_order': 'arabic'}. Best is trial 52 with value: 662.1936991452613.
[I 2024-04-23 02:25:15,918] Trial 132 finished with value: 757.3268170237646 and parameters: {'model_name': 'KNNImputer', 'weights': 'distance', 'keep_empty_features': False}. Best is trial 52 with value: 662.1936991452613.
[I 2024-04-23 02:25:16,966] Trial 131 finished with value: 757.3268170237646 and parameters: {'model_name': 'KNNImputer', 'weights': 'distance', 'keep_empty_features': False}. Best is trial 52 with value: 662.1936991452613.
[I 2024-04-23 02:25:20,927] Trial 134 finished with value: 757.3268170237646 and parameters: {'model_name': 'KNNImputer', 'weights': 'distance', 'keep_empty_features': False}. Best is trial 52 with value: 662.1936991452613.
[I 2024-04-23 02:25:23,900] Trial 135 finished with value: 757.3268170237646 and parameters: {'model_name': 'KNNImputer', 'weights': 'distance', 'keep_empty_features': False}. Best is trial 52 with value: 662.1936991452613.
[I 2024-04-23 02:26:44,474] Trial 80 finished with value: 993.3164989220761 and parameters: {'model_name': 'IterativeImputer', 'sample_posterior': True, 'initial_strategy': 'median', 'imputation_order': 'random'}. Best is trial 52 with value: 662.1936991452613.
[I 2024-04-23 02:27:07,399] Trial 81 finished with value: 927.293045173428 and parameters: {'model_name': 'IterativeImputer', 'sample_posterior': True, 'initial_strategy': 'mean', 'imputation_order': 'ascending'}. Best is trial 52 with value: 662.1936991452613.
[I 2024-04-23 02:27:15,130] Trial 82 finished with value: 946.0676843459854 and parameters: {'model_name': 'IterativeImputer', 'sample_posterior': True, 'initial_strategy': 'mean', 'imputation_order': 'arabic'}. Best is trial 52 with value: 662.1936991452613.
[I 2024-04-23 02:27:54,936] Trial 65 finished with value: 730.5880534185069 and parameters: {'model_name': 'RandomForestImputer', 'max_iter': 29, 'decreasing': True, 'min_samples_split': 1.0, 'min_samples_leaf': 0.4, 'max_features': 0.1, 'warm_start': False}. Best is trial 52 with value: 662.1936991452613.
[I 2024-04-23 02:28:39,547] Trial 118 finished with value: 662.1930716584354 and parameters: {'model_name': 'IterativeImputer', 'sample_posterior': False, 'initial_strategy': 'mean', 'imputation_order': 'random'}. Best is trial 118 with value: 662.1930716584354.
[I 2024-04-23 02:28:57,307] Trial 15 finished with value: 730.4560625402091 and parameters: {'model_name': 'RandomForestImputer', 'max_iter': 33, 'decreasing': True, 'min_samples_split': 0.0, 'min_samples_leaf': 0.6, 'max_features': 0.2, 'warm_start': False}. Best is trial 118 with value: 662.1930716584354.
[I 2024-04-23 02:29:42,065] Trial 95 finished with value: 935.6231127530989 and parameters: {'model_name': 'IterativeImputer', 'sample_posterior': True, 'initial_strategy': 'mean', 'imputation_order': 'random'}. Best is trial 118 with value: 662.1930716584354.
[I 2024-04-23 02:29:51,030] Trial 96 finished with value: 932.6085080969563 and parameters: {'model_name': 'IterativeImputer', 'sample_posterior': True, 'initial_strategy': 'mean', 'imputation_order': 'random'}. Best is trial 118 with value: 662.1930716584354.
[I 2024-04-23 02:29:54,832] Trial 97 finished with value: 946.4508612466559 and parameters: {'model_name': 'IterativeImputer', 'sample_posterior': True, 'initial_strategy': 'mean', 'imputation_order': 'random'}. Best is trial 118 with value: 662.1930716584354.
[I 2024-04-23 02:30:34,996] Trial 98 finished with value: 962.1657875663213 and parameters: {'model_name': 'IterativeImputer', 'sample_posterior': True, 'initial_strategy': 'mean', 'imputation_order': 'ascending'}. Best is trial 118 with value: 662.1930716584354.
[I 2024-04-23 02:30:47,304] Trial 100 finished with value: 936.5219441458242 and parameters: {'model_name': 'IterativeImputer', 'sample_posterior': True, 'initial_strategy': 'mean', 'imputation_order': 'ascending'}. Best is trial 118 with value: 662.1930716584354.
[I 2024-04-23 02:30:48,478] Trial 99 finished with value: 921.5074924089542 and parameters: {'model_name': 'IterativeImputer', 'sample_posterior': True, 'initial_strategy': 'mean', 'imputation_order': 'descending'}. Best is trial 118 with value: 662.1930716584354.
[I 2024-04-23 02:30:51,414] Trial 130 finished with value: 662.1885903461559 and parameters: {'model_name': 'IterativeImputer', 'sample_posterior': False, 'initial_strategy': 'mean', 'imputation_order': 'random'}. Best is trial 130 with value: 662.1885903461559.
[I 2024-04-23 02:31:00,587] Trial 129 finished with value: 662.1943177728054 and parameters: {'model_name': 'IterativeImputer', 'sample_posterior': False, 'initial_strategy': 'mean', 'imputation_order': 'random'}. Best is trial 130 with value: 662.1885903461559.
[I 2024-04-23 02:31:01,946] Trial 101 finished with value: 910.2312706629875 and parameters: {'model_name': 'IterativeImputer', 'sample_posterior': True, 'initial_strategy': 'mean', 'imputation_order': 'descending'}. Best is trial 130 with value: 662.1885903461559.
[I 2024-04-23 02:31:05,531] Trial 128 finished with value: 662.1955415397094 and parameters: {'model_name': 'IterativeImputer', 'sample_posterior': False, 'initial_strategy': 'mean', 'imputation_order': 'random'}. Best is trial 130 with value: 662.1885903461559.
[I 2024-04-23 02:31:07,046] Trial 137 finished with value: 662.1952144811028 and parameters: {'model_name': 'IterativeImputer', 'sample_posterior': False, 'initial_strategy': 'mean', 'imputation_order': 'random'}. Best is trial 130 with value: 662.1885903461559.
[I 2024-04-23 02:31:10,528] Trial 127 finished with value: 662.1919870022707 and parameters: {'model_name': 'IterativeImputer', 'sample_posterior': False, 'initial_strategy': 'mean', 'imputation_order': 'random'}. Best is trial 130 with value: 662.1885903461559.
[I 2024-04-23 02:31:11,151] Trial 119 finished with value: 662.2032573154222 and parameters: {'model_name': 'IterativeImputer', 'sample_posterior': False, 'initial_strategy': 'constant', 'imputation_order': 'random'}. Best is trial 130 with value: 662.1885903461559.
[I 2024-04-23 02:31:12,086] Trial 139 finished with value: 662.1914691660538 and parameters: {'model_name': 'IterativeImputer', 'sample_posterior': False, 'initial_strategy': 'mean', 'imputation_order': 'random'}. Best is trial 130 with value: 662.1885903461559.
[I 2024-04-23 02:31:13,405] Trial 133 finished with value: 662.1966494737928 and parameters: {'model_name': 'IterativeImputer', 'sample_posterior': False, 'initial_strategy': 'mean', 'imputation_order': 'random'}. Best is trial 130 with value: 662.1885903461559.
[I 2024-04-23 02:31:17,328] Trial 102 finished with value: 984.9698980252117 and parameters: {'model_name': 'IterativeImputer', 'sample_posterior': True, 'initial_strategy': 'mean', 'imputation_order': 'ascending'}. Best is trial 130 with value: 662.1885903461559.
[I 2024-04-23 02:31:19,805] Trial 120 finished with value: 662.2036937483387 and parameters: {'model_name': 'IterativeImputer', 'sample_posterior': False, 'initial_strategy': 'constant', 'imputation_order': 'random'}. Best is trial 130 with value: 662.1885903461559.
[I 2024-04-23 02:31:24,806] Trial 122 finished with value: 662.2013381295466 and parameters: {'model_name': 'IterativeImputer', 'sample_posterior': False, 'initial_strategy': 'constant', 'imputation_order': 'random'}. Best is trial 130 with value: 662.1885903461559.
[I 2024-04-23 02:31:33,148] Trial 136 finished with value: 662.1904779784506 and parameters: {'model_name': 'IterativeImputer', 'sample_posterior': False, 'initial_strategy': 'mean', 'imputation_order': 'random'}. Best is trial 130 with value: 662.1885903461559.
[I 2024-04-23 02:31:40,872] Trial 121 finished with value: 662.2015173214943 and parameters: {'model_name': 'IterativeImputer', 'sample_posterior': False, 'initial_strategy': 'constant', 'imputation_order': 'random'}. Best is trial 130 with value: 662.1885903461559.
[I 2024-04-23 02:31:43,252] Trial 123 finished with value: 662.2004229924275 and parameters: {'model_name': 'IterativeImputer', 'sample_posterior': False, 'initial_strategy': 'constant', 'imputation_order': 'random'}. Best is trial 130 with value: 662.1885903461559.
[I 2024-04-23 02:31:47,106] Trial 138 finished with value: 662.1951435536813 and parameters: {'model_name': 'IterativeImputer', 'sample_posterior': False, 'initial_strategy': 'mean', 'imputation_order': 'random'}. Best is trial 130 with value: 662.1885903461559.
[I 2024-04-23 02:32:06,616] Trial 125 finished with value: 662.2034478571109 and parameters: {'model_name': 'IterativeImputer', 'sample_posterior': False, 'initial_strategy': 'constant', 'imputation_order': 'random'}. Best is trial 130 with value: 662.1885903461559.
[I 2024-04-23 02:32:10,750] Trial 104 finished with value: 907.3399269027165 and parameters: {'model_name': 'IterativeImputer', 'sample_posterior': True, 'initial_strategy': 'mean', 'imputation_order': 'descending'}. Best is trial 130 with value: 662.1885903461559.
[I 2024-04-23 02:32:11,706] Trial 103 finished with value: 948.4999830371871 and parameters: {'model_name': 'IterativeImputer', 'sample_posterior': True, 'initial_strategy': 'mean', 'imputation_order': 'descending'}. Best is trial 130 with value: 662.1885903461559.
[I 2024-04-23 02:32:21,901] Trial 124 finished with value: 662.2073665975646 and parameters: {'model_name': 'IterativeImputer', 'sample_posterior': False, 'initial_strategy': 'constant', 'imputation_order': 'random'}. Best is trial 130 with value: 662.1885903461559.
[I 2024-04-23 02:32:50,216] Trial 140 finished with value: 662.1976656412231 and parameters: {'model_name': 'IterativeImputer', 'sample_posterior': False, 'initial_strategy': 'mean', 'imputation_order': 'random'}. Best is trial 130 with value: 662.1885903461559.
[I 2024-04-23 02:33:24,547] Trial 142 finished with value: 662.1879915826296 and parameters: {'model_name': 'IterativeImputer', 'sample_posterior': False, 'initial_strategy': 'mean', 'imputation_order': 'random'}. Best is trial 142 with value: 662.1879915826296.
[I 2024-04-23 02:33:29,754] Trial 126 finished with value: 662.2038982230587 and parameters: {'model_name': 'IterativeImputer', 'sample_posterior': False, 'initial_strategy': 'constant', 'imputation_order': 'random'}. Best is trial 142 with value: 662.1879915826296.
[I 2024-04-23 02:33:41,131] Trial 141 finished with value: 662.1938553316173 and parameters: {'model_name': 'IterativeImputer', 'sample_posterior': False, 'initial_strategy': 'mean', 'imputation_order': 'random'}. Best is trial 142 with value: 662.1879915826296.
[I 2024-04-23 02:34:00,412] Trial 107 finished with value: 966.371384367127 and parameters: {'model_name': 'IterativeImputer', 'sample_posterior': True, 'initial_strategy': 'mean', 'imputation_order': 'descending'}. Best is trial 142 with value: 662.1879915826296.
[I 2024-04-23 02:34:05,456] Trial 106 finished with value: 925.7891238806966 and parameters: {'model_name': 'IterativeImputer', 'sample_posterior': True, 'initial_strategy': 'mean', 'imputation_order': 'descending'}. Best is trial 142 with value: 662.1879915826296.
[I 2024-04-23 02:34:06,293] Trial 105 finished with value: 935.7672217143236 and parameters: {'model_name': 'IterativeImputer', 'sample_posterior': True, 'initial_strategy': 'mean', 'imputation_order': 'ascending'}. Best is trial 142 with value: 662.1879915826296.
[I 2024-04-23 02:34:09,297] Trial 143 finished with value: 662.1922429842815 and parameters: {'model_name': 'IterativeImputer', 'sample_posterior': False, 'initial_strategy': 'mean', 'imputation_order': 'random'}. Best is trial 142 with value: 662.1879915826296.
[I 2024-04-23 02:34:18,077] Trial 109 finished with value: 940.6955238939981 and parameters: {'model_name': 'IterativeImputer', 'sample_posterior': True, 'initial_strategy': 'mean', 'imputation_order': 'descending'}. Best is trial 142 with value: 662.1879915826296.
[I 2024-04-23 02:34:18,692] Trial 111 finished with value: 893.8115232263033 and parameters: {'model_name': 'IterativeImputer', 'sample_posterior': True, 'initial_strategy': 'mean', 'imputation_order': 'ascending'}. Best is trial 142 with value: 662.1879915826296.
[I 2024-04-23 02:34:22,736] Trial 108 finished with value: 986.1146820475209 and parameters: {'model_name': 'IterativeImputer', 'sample_posterior': True, 'initial_strategy': 'mean', 'imputation_order': 'descending'}. Best is trial 142 with value: 662.1879915826296.
[I 2024-04-23 02:34:24,069] Trial 110 finished with value: 939.0987286404863 and parameters: {'model_name': 'IterativeImputer', 'sample_posterior': True, 'initial_strategy': 'mean', 'imputation_order': 'descending'}. Best is trial 142 with value: 662.1879915826296.
[I 2024-04-23 02:34:25,018] Trial 182 finished with value: 1657.0756440533758 and parameters: {'model_name': 'SimpleImputer', 'strategy': 'constant'}. Best is trial 142 with value: 662.1879915826296.
[I 2024-04-23 02:34:28,357] Trial 113 finished with value: 928.0309835107604 and parameters: {'model_name': 'IterativeImputer', 'sample_posterior': True, 'initial_strategy': 'mean', 'imputation_order': 'ascending'}. Best is trial 142 with value: 662.1879915826296.
[I 2024-04-23 02:34:34,099] Trial 114 finished with value: 937.1399326468721 and parameters: {'model_name': 'IterativeImputer', 'sample_posterior': True, 'initial_strategy': 'mean', 'imputation_order': 'ascending'}. Best is trial 142 with value: 662.1879915826296.
[I 2024-04-23 02:34:34,970] Trial 112 finished with value: 945.7210487838296 and parameters: {'model_name': 'IterativeImputer', 'sample_posterior': True, 'initial_strategy': 'mean', 'imputation_order': 'ascending'}. Best is trial 142 with value: 662.1879915826296.
[I 2024-04-23 02:34:54,188] Trial 144 finished with value: 662.1931750447358 and parameters: {'model_name': 'IterativeImputer', 'sample_posterior': False, 'initial_strategy': 'mean', 'imputation_order': 'random'}. Best is trial 142 with value: 662.1879915826296.
[I 2024-04-23 02:34:57,640] Trial 116 finished with value: 883.3286549434199 and parameters: {'model_name': 'IterativeImputer', 'sample_posterior': True, 'initial_strategy': 'mean', 'imputation_order': 'ascending'}. Best is trial 142 with value: 662.1879915826296.
[I 2024-04-23 02:34:58,377] Trial 117 finished with value: 865.1358213172018 and parameters: {'model_name': 'IterativeImputer', 'sample_posterior': True, 'initial_strategy': 'mean', 'imputation_order': 'ascending'}. Best is trial 142 with value: 662.1879915826296.
[I 2024-04-23 02:35:07,071] Trial 115 finished with value: 922.9343618534771 and parameters: {'model_name': 'IterativeImputer', 'sample_posterior': True, 'initial_strategy': 'mean', 'imputation_order': 'random'}. Best is trial 142 with value: 662.1879915826296.
[I 2024-04-23 02:35:12,170] Trial 145 finished with value: 662.1922460366525 and parameters: {'model_name': 'IterativeImputer', 'sample_posterior': False, 'initial_strategy': 'mean', 'imputation_order': 'random'}. Best is trial 142 with value: 662.1879915826296.
[I 2024-04-23 02:35:17,417] Trial 147 finished with value: 662.1947766410336 and parameters: {'model_name': 'IterativeImputer', 'sample_posterior': False, 'initial_strategy': 'mean', 'imputation_order': 'random'}. Best is trial 142 with value: 662.1879915826296.
[I 2024-04-23 02:35:36,250] Trial 146 finished with value: 662.1942418159564 and parameters: {'model_name': 'IterativeImputer', 'sample_posterior': False, 'initial_strategy': 'mean', 'imputation_order': 'random'}. Best is trial 142 with value: 662.1879915826296.
[I 2024-04-23 02:35:41,062] Trial 148 finished with value: 662.1965004399628 and parameters: {'model_name': 'IterativeImputer', 'sample_posterior': False, 'initial_strategy': 'mean', 'imputation_order': 'random'}. Best is trial 142 with value: 662.1879915826296.
[I 2024-04-23 02:35:45,282] Trial 153 finished with value: 662.1910470678151 and parameters: {'model_name': 'IterativeImputer', 'sample_posterior': False, 'initial_strategy': 'mean', 'imputation_order': 'random'}. Best is trial 142 with value: 662.1879915826296.
[I 2024-04-23 02:35:46,848] Trial 152 finished with value: 662.1971321357244 and parameters: {'model_name': 'IterativeImputer', 'sample_posterior': False, 'initial_strategy': 'mean', 'imputation_order': 'random'}. Best is trial 142 with value: 662.1879915826296.
[I 2024-04-23 02:35:57,154] Trial 149 finished with value: 662.1929660463677 and parameters: {'model_name': 'IterativeImputer', 'sample_posterior': False, 'initial_strategy': 'mean', 'imputation_order': 'random'}. Best is trial 142 with value: 662.1879915826296.
[I 2024-04-23 02:36:08,800] Trial 162 finished with value: 662.1892543409584 and parameters: {'model_name': 'IterativeImputer', 'sample_posterior': False, 'initial_strategy': 'mean', 'imputation_order': 'random'}. Best is trial 142 with value: 662.1879915826296.
[I 2024-04-23 02:36:10,695] Trial 151 finished with value: 662.1941859364498 and parameters: {'model_name': 'IterativeImputer', 'sample_posterior': False, 'initial_strategy': 'mean', 'imputation_order': 'random'}. Best is trial 142 with value: 662.1879915826296.
[I 2024-04-23 02:36:13,111] Trial 154 finished with value: 662.1914051454823 and parameters: {'model_name': 'IterativeImputer', 'sample_posterior': False, 'initial_strategy': 'mean', 'imputation_order': 'random'}. Best is trial 142 with value: 662.1879915826296.
[I 2024-04-23 02:36:13,821] Trial 160 finished with value: 662.1915487586033 and parameters: {'model_name': 'IterativeImputer', 'sample_posterior': False, 'initial_strategy': 'mean', 'imputation_order': 'random'}. Best is trial 142 with value: 662.1879915826296.
[I 2024-04-23 02:36:16,325] Trial 161 finished with value: 662.1943057736951 and parameters: {'model_name': 'IterativeImputer', 'sample_posterior': False, 'initial_strategy': 'mean', 'imputation_order': 'random'}. Best is trial 142 with value: 662.1879915826296.
[I 2024-04-23 02:36:21,680] Trial 156 finished with value: 662.1913067070095 and parameters: {'model_name': 'IterativeImputer', 'sample_posterior': False, 'initial_strategy': 'mean', 'imputation_order': 'random'}. Best is trial 142 with value: 662.1879915826296.
[I 2024-04-23 02:36:23,374] Trial 164 finished with value: 662.1915130807189 and parameters: {'model_name': 'IterativeImputer', 'sample_posterior': False, 'initial_strategy': 'mean', 'imputation_order': 'random'}. Best is trial 142 with value: 662.1879915826296.
[I 2024-04-23 02:36:24,343] Trial 158 finished with value: 662.1940973328952 and parameters: {'model_name': 'IterativeImputer', 'sample_posterior': False, 'initial_strategy': 'mean', 'imputation_order': 'random'}. Best is trial 142 with value: 662.1879915826296.
[I 2024-04-23 02:36:25,464] Trial 150 finished with value: 662.1960750085784 and parameters: {'model_name': 'IterativeImputer', 'sample_posterior': False, 'initial_strategy': 'mean', 'imputation_order': 'random'}. Best is trial 142 with value: 662.1879915826296.
[I 2024-04-23 02:36:26,004] Trial 157 finished with value: 662.1929285515287 and parameters: {'model_name': 'IterativeImputer', 'sample_posterior': False, 'initial_strategy': 'mean', 'imputation_order': 'random'}. Best is trial 142 with value: 662.1879915826296.
[I 2024-04-23 02:36:29,547] Trial 159 finished with value: 662.1943807355982 and parameters: {'model_name': 'IterativeImputer', 'sample_posterior': False, 'initial_strategy': 'mean', 'imputation_order': 'random'}. Best is trial 142 with value: 662.1879915826296.
[I 2024-04-23 02:36:32,429] Trial 170 finished with value: 662.1924694602471 and parameters: {'model_name': 'IterativeImputer', 'sample_posterior': False, 'initial_strategy': 'mean', 'imputation_order': 'random'}. Best is trial 142 with value: 662.1879915826296.
[I 2024-04-23 02:36:33,752] Trial 155 finished with value: 662.195957238793 and parameters: {'model_name': 'IterativeImputer', 'sample_posterior': False, 'initial_strategy': 'mean', 'imputation_order': 'random'}. Best is trial 142 with value: 662.1879915826296.
[I 2024-04-23 02:36:34,684] Trial 165 finished with value: 662.1905202897237 and parameters: {'model_name': 'IterativeImputer', 'sample_posterior': False, 'initial_strategy': 'mean', 'imputation_order': 'random'}. Best is trial 142 with value: 662.1879915826296.
[I 2024-04-23 02:36:40,466] Trial 168 finished with value: 662.1922390074825 and parameters: {'model_name': 'IterativeImputer', 'sample_posterior': False, 'initial_strategy': 'mean', 'imputation_order': 'random'}. Best is trial 142 with value: 662.1879915826296.
