[I 2024-04-04 08:50:44,620] Trial 76 finished with value: 0.2747250734744102 and parameters: {'model_name': 'SimpleImputer', 'strategy': 'most_frequent'}. Best is trial 9 with value: 0.2548182287003252.
[I 2024-04-04 08:50:44,785] Trial 70 finished with value: 0.2747250734744102 and parameters: {'model_name': 'SimpleImputer', 'strategy': 'most_frequent'}. Best is trial 9 with value: 0.2548182287003252.
[I 2024-04-04 08:50:45,002] Trial 73 finished with value: 0.2747250734744102 and parameters: {'model_name': 'SimpleImputer', 'strategy': 'most_frequent'}. Best is trial 9 with value: 0.2548182287003252.
[I 2024-04-04 08:50:45,375] Trial 113 finished with value: 0.2548182287003252 and parameters: {'model_name': 'SimpleImputer', 'strategy': 'mean'}. Best is trial 9 with value: 0.2548182287003252.
[I 2024-04-04 08:50:45,685] Trial 83 finished with value: 0.2747250734744102 and parameters: {'model_name': 'SimpleImputer', 'strategy': 'most_frequent'}. Best is trial 9 with value: 0.2548182287003252.
[I 2024-04-04 08:50:45,935] Trial 112 finished with value: 0.2548182287003252 and parameters: {'model_name': 'SimpleImputer', 'strategy': 'mean'}. Best is trial 9 with value: 0.2548182287003252.
[I 2024-04-04 08:50:46,201] Trial 81 finished with value: 0.2747250734744102 and parameters: {'model_name': 'SimpleImputer', 'strategy': 'most_frequent'}. Best is trial 9 with value: 0.2548182287003252.
[I 2024-04-04 08:50:46,463] Trial 84 finished with value: 0.2747250734744102 and parameters: {'model_name': 'SimpleImputer', 'strategy': 'most_frequent'}. Best is trial 9 with value: 0.2548182287003252.
[I 2024-04-04 08:50:46,660] Trial 111 finished with value: 0.2548182287003252 and parameters: {'model_name': 'SimpleImputer', 'strategy': 'mean'}. Best is trial 9 with value: 0.2548182287003252.
[I 2024-04-04 08:50:46,920] Trial 82 finished with value: 0.2747250734744102 and parameters: {'model_name': 'SimpleImputer', 'strategy': 'most_frequent'}. Best is trial 9 with value: 0.2548182287003252.
[I 2024-04-04 08:50:47,194] Trial 120 finished with value: 0.2548182287003252 and parameters: {'model_name': 'SimpleImputer', 'strategy': 'mean'}. Best is trial 9 with value: 0.2548182287003252.
[I 2024-04-04 08:50:47,537] Trial 85 finished with value: 0.2747250734744102 and parameters: {'model_name': 'SimpleImputer', 'strategy': 'most_frequent'}. Best is trial 9 with value: 0.2548182287003252.
[I 2024-04-04 08:50:47,785] Trial 119 finished with value: 0.2548182287003252 and parameters: {'model_name': 'SimpleImputer', 'strategy': 'mean'}. Best is trial 9 with value: 0.2548182287003252.
[I 2024-04-04 08:50:48,117] Trial 89 finished with value: 0.2747250734744102 and parameters: {'model_name': 'SimpleImputer', 'strategy': 'most_frequent'}. Best is trial 9 with value: 0.2548182287003252.
[I 2024-04-04 08:50:48,360] Trial 117 finished with value: 0.2548182287003252 and parameters: {'model_name': 'SimpleImputer', 'strategy': 'mean'}. Best is trial 9 with value: 0.2548182287003252.
[I 2024-04-04 08:50:48,610] Trial 115 finished with value: 0.2548182287003252 and parameters: {'model_name': 'SimpleImputer', 'strategy': 'mean'}. Best is trial 9 with value: 0.2548182287003252.
[I 2024-04-04 08:50:48,864] Trial 114 finished with value: 0.2548182287003252 and parameters: {'model_name': 'SimpleImputer', 'strategy': 'mean'}. Best is trial 9 with value: 0.2548182287003252.
[I 2024-04-04 08:50:49,235] Trial 116 finished with value: 0.2548182287003252 and parameters: {'model_name': 'SimpleImputer', 'strategy': 'mean'}. Best is trial 9 with value: 0.2548182287003252.
[I 2024-04-04 08:50:49,594] Trial 127 finished with value: 0.2548182287003252 and parameters: {'model_name': 'SimpleImputer', 'strategy': 'mean'}. Best is trial 9 with value: 0.2548182287003252.
[I 2024-04-04 08:50:49,779] Trial 128 finished with value: 0.2548182287003252 and parameters: {'model_name': 'SimpleImputer', 'strategy': 'mean'}. Best is trial 9 with value: 0.2548182287003252.
[I 2024-04-04 08:50:50,052] Trial 121 finished with value: 0.2548182287003252 and parameters: {'model_name': 'SimpleImputer', 'strategy': 'mean'}. Best is trial 9 with value: 0.2548182287003252.
[I 2024-04-04 08:50:50,225] Trial 123 finished with value: 0.2548182287003252 and parameters: {'model_name': 'SimpleImputer', 'strategy': 'mean'}. Best is trial 9 with value: 0.2548182287003252.
[I 2024-04-04 08:50:50,392] Trial 118 finished with value: 0.2548182287003252 and parameters: {'model_name': 'SimpleImputer', 'strategy': 'mean'}. Best is trial 9 with value: 0.2548182287003252.
[I 2024-04-04 08:50:50,640] Trial 125 finished with value: 0.2548182287003252 and parameters: {'model_name': 'SimpleImputer', 'strategy': 'mean'}. Best is trial 9 with value: 0.2548182287003252.
[I 2024-04-04 08:50:50,812] Trial 87 finished with value: 0.2747250734744102 and parameters: {'model_name': 'SimpleImputer', 'strategy': 'most_frequent'}. Best is trial 9 with value: 0.2548182287003252.
[I 2024-04-04 08:50:50,985] Trial 130 finished with value: 0.2548182287003252 and parameters: {'model_name': 'SimpleImputer', 'strategy': 'mean'}. Best is trial 9 with value: 0.2548182287003252.
[I 2024-04-04 08:50:51,197] Trial 122 finished with value: 0.2548182287003252 and parameters: {'model_name': 'SimpleImputer', 'strategy': 'mean'}. Best is trial 9 with value: 0.2548182287003252.
[I 2024-04-04 08:50:51,450] Trial 126 finished with value: 0.2548182287003252 and parameters: {'model_name': 'SimpleImputer', 'strategy': 'mean'}. Best is trial 9 with value: 0.2548182287003252.
[I 2024-04-04 08:50:51,724] Trial 88 finished with value: 0.2747250734744102 and parameters: {'model_name': 'SimpleImputer', 'strategy': 'most_frequent'}. Best is trial 9 with value: 0.2548182287003252.
[I 2024-04-04 08:50:51,971] Trial 132 finished with value: 0.2548182287003252 and parameters: {'model_name': 'SimpleImputer', 'strategy': 'mean'}. Best is trial 9 with value: 0.2548182287003252.
[I 2024-04-04 08:50:52,227] Trial 133 finished with value: 0.2548182287003252 and parameters: {'model_name': 'SimpleImputer', 'strategy': 'mean'}. Best is trial 9 with value: 0.2548182287003252.
[I 2024-04-04 08:50:52,461] Trial 124 finished with value: 0.2548182287003252 and parameters: {'model_name': 'SimpleImputer', 'strategy': 'mean'}. Best is trial 9 with value: 0.2548182287003252.
[I 2024-04-04 08:50:52,742] Trial 129 finished with value: 0.2548182287003252 and parameters: {'model_name': 'SimpleImputer', 'strategy': 'mean'}. Best is trial 9 with value: 0.2548182287003252.
[I 2024-04-04 08:50:52,924] Trial 138 finished with value: 0.2548182287003252 and parameters: {'model_name': 'SimpleImputer', 'strategy': 'mean'}. Best is trial 9 with value: 0.2548182287003252.
[I 2024-04-04 08:50:53,349] Trial 131 finished with value: 0.2548182287003252 and parameters: {'model_name': 'SimpleImputer', 'strategy': 'mean'}. Best is trial 9 with value: 0.2548182287003252.
[I 2024-04-04 08:50:53,605] Trial 137 finished with value: 0.2548182287003252 and parameters: {'model_name': 'SimpleImputer', 'strategy': 'mean'}. Best is trial 9 with value: 0.2548182287003252.
[I 2024-04-04 08:50:53,895] Trial 135 finished with value: 0.2548182287003252 and parameters: {'model_name': 'SimpleImputer', 'strategy': 'mean'}. Best is trial 9 with value: 0.2548182287003252.
[I 2024-04-04 08:50:54,167] Trial 92 finished with value: 0.2747250734744102 and parameters: {'model_name': 'SimpleImputer', 'strategy': 'most_frequent'}. Best is trial 9 with value: 0.2548182287003252.
[I 2024-04-04 08:50:54,612] Trial 143 finished with value: 0.2548182287003252 and parameters: {'model_name': 'SimpleImputer', 'strategy': 'mean'}. Best is trial 9 with value: 0.2548182287003252.
[I 2024-04-04 08:50:54,870] Trial 136 finished with value: 0.2548182287003252 and parameters: {'model_name': 'SimpleImputer', 'strategy': 'mean'}. Best is trial 9 with value: 0.2548182287003252.
[I 2024-04-04 08:50:55,063] Trial 134 finished with value: 0.2548182287003252 and parameters: {'model_name': 'SimpleImputer', 'strategy': 'mean'}. Best is trial 9 with value: 0.2548182287003252.
[I 2024-04-04 08:50:55,290] Trial 140 finished with value: 0.2548182287003252 and parameters: {'model_name': 'SimpleImputer', 'strategy': 'mean'}. Best is trial 9 with value: 0.2548182287003252.
[I 2024-04-04 08:50:55,456] Trial 144 finished with value: 0.2548182287003252 and parameters: {'model_name': 'SimpleImputer', 'strategy': 'mean'}. Best is trial 9 with value: 0.2548182287003252.
[I 2024-04-04 08:50:55,638] Trial 141 finished with value: 0.2548182287003252 and parameters: {'model_name': 'SimpleImputer', 'strategy': 'mean'}. Best is trial 9 with value: 0.2548182287003252.
[I 2024-04-04 08:50:55,798] Trial 86 finished with value: 0.2747250734744102 and parameters: {'model_name': 'SimpleImputer', 'strategy': 'most_frequent'}. Best is trial 9 with value: 0.2548182287003252.
[I 2024-04-04 08:50:55,956] Trial 91 finished with value: 0.2747250734744102 and parameters: {'model_name': 'SimpleImputer', 'strategy': 'most_frequent'}. Best is trial 9 with value: 0.2548182287003252.
[I 2024-04-04 08:50:56,162] Trial 139 finished with value: 0.2548182287003252 and parameters: {'model_name': 'SimpleImputer', 'strategy': 'mean'}. Best is trial 9 with value: 0.2548182287003252.
[I 2024-04-04 08:50:56,622] Trial 152 finished with value: 0.2548182287003252 and parameters: {'model_name': 'SimpleImputer', 'strategy': 'mean'}. Best is trial 9 with value: 0.2548182287003252.
[I 2024-04-04 08:50:56,893] Trial 142 finished with value: 0.2548182287003252 and parameters: {'model_name': 'SimpleImputer', 'strategy': 'mean'}. Best is trial 9 with value: 0.2548182287003252.
[I 2024-04-04 08:50:57,128] Trial 153 finished with value: 0.2548182287003252 and parameters: {'model_name': 'SimpleImputer', 'strategy': 'mean'}. Best is trial 9 with value: 0.2548182287003252.
[I 2024-04-04 08:50:57,371] Trial 145 finished with value: 0.2548182287003252 and parameters: {'model_name': 'SimpleImputer', 'strategy': 'mean'}. Best is trial 9 with value: 0.2548182287003252.
[I 2024-04-04 08:50:57,558] Trial 93 finished with value: 0.2747250734744102 and parameters: {'model_name': 'SimpleImputer', 'strategy': 'most_frequent'}. Best is trial 9 with value: 0.2548182287003252.
[I 2024-04-04 08:50:57,752] Trial 146 finished with value: 0.2548182287003252 and parameters: {'model_name': 'SimpleImputer', 'strategy': 'mean'}. Best is trial 9 with value: 0.2548182287003252.
[I 2024-04-04 08:50:58,147] Trial 155 finished with value: 0.2548182287003252 and parameters: {'model_name': 'SimpleImputer', 'strategy': 'mean'}. Best is trial 9 with value: 0.2548182287003252.
[I 2024-04-04 08:50:58,397] Trial 148 finished with value: 0.2548182287003252 and parameters: {'model_name': 'SimpleImputer', 'strategy': 'mean'}. Best is trial 9 with value: 0.2548182287003252.
[I 2024-04-04 08:50:58,706] Trial 157 finished with value: 0.2548182287003252 and parameters: {'model_name': 'SimpleImputer', 'strategy': 'mean'}. Best is trial 9 with value: 0.2548182287003252.
[I 2024-04-04 08:50:58,976] Trial 154 finished with value: 0.2548182287003252 and parameters: {'model_name': 'SimpleImputer', 'strategy': 'mean'}. Best is trial 9 with value: 0.2548182287003252.
[I 2024-04-04 08:50:59,256] Trial 90 finished with value: 0.2747250734744102 and parameters: {'model_name': 'SimpleImputer', 'strategy': 'most_frequent'}. Best is trial 9 with value: 0.2548182287003252.
[I 2024-04-04 08:50:59,451] Trial 158 finished with value: 0.2548182287003252 and parameters: {'model_name': 'SimpleImputer', 'strategy': 'mean'}. Best is trial 9 with value: 0.2548182287003252.
[I 2024-04-04 08:50:59,759] Trial 156 finished with value: 0.2548182287003252 and parameters: {'model_name': 'SimpleImputer', 'strategy': 'mean'}. Best is trial 9 with value: 0.2548182287003252.
[I 2024-04-04 08:50:59,930] Trial 151 finished with value: 0.2548182287003252 and parameters: {'model_name': 'SimpleImputer', 'strategy': 'mean'}. Best is trial 9 with value: 0.2548182287003252.
[I 2024-04-04 08:51:00,205] Trial 147 finished with value: 0.2548182287003252 and parameters: {'model_name': 'SimpleImputer', 'strategy': 'mean'}. Best is trial 9 with value: 0.2548182287003252.
[I 2024-04-04 08:51:00,496] Trial 149 finished with value: 0.2548182287003252 and parameters: {'model_name': 'SimpleImputer', 'strategy': 'mean'}. Best is trial 9 with value: 0.2548182287003252.
[I 2024-04-04 08:51:00,766] Trial 150 finished with value: 0.2548182287003252 and parameters: {'model_name': 'SimpleImputer', 'strategy': 'mean'}. Best is trial 9 with value: 0.2548182287003252.
[I 2024-04-04 08:51:00,960] Trial 159 finished with value: 0.2548182287003252 and parameters: {'model_name': 'SimpleImputer', 'strategy': 'mean'}. Best is trial 9 with value: 0.2548182287003252.
[I 2024-04-04 08:51:01,145] Trial 161 finished with value: 0.2548182287003252 and parameters: {'model_name': 'SimpleImputer', 'strategy': 'mean'}. Best is trial 9 with value: 0.2548182287003252.
[I 2024-04-04 08:51:01,496] Trial 94 finished with value: 0.2747250734744102 and parameters: {'model_name': 'SimpleImputer', 'strategy': 'most_frequent'}. Best is trial 9 with value: 0.2548182287003252.
[I 2024-04-04 08:51:01,821] Trial 165 finished with value: 0.2548182287003252 and parameters: {'model_name': 'SimpleImputer', 'strategy': 'mean'}. Best is trial 9 with value: 0.2548182287003252.
[I 2024-04-04 08:51:02,061] Trial 169 finished with value: 0.2548182287003252 and parameters: {'model_name': 'SimpleImputer', 'strategy': 'mean'}. Best is trial 9 with value: 0.2548182287003252.
[I 2024-04-04 08:51:02,328] Trial 175 finished with value: 0.2747250734744102 and parameters: {'model_name': 'SimpleImputer', 'strategy': 'constant'}. Best is trial 9 with value: 0.2548182287003252.
[I 2024-04-04 08:51:02,556] Trial 160 finished with value: 0.2548182287003252 and parameters: {'model_name': 'SimpleImputer', 'strategy': 'mean'}. Best is trial 9 with value: 0.2548182287003252.
[I 2024-04-04 08:51:02,730] Trial 173 finished with value: 0.2548182287003252 and parameters: {'model_name': 'SimpleImputer', 'strategy': 'mean'}. Best is trial 9 with value: 0.2548182287003252.
[I 2024-04-04 08:51:03,091] Trial 193 finished with value: 0.2747250734744102 and parameters: {'model_name': 'SimpleImputer', 'strategy': 'constant'}. Best is trial 9 with value: 0.2548182287003252.
[I 2024-04-04 08:51:03,389] Trial 183 finished with value: 0.2747250734744102 and parameters: {'model_name': 'SimpleImputer', 'strategy': 'constant'}. Best is trial 9 with value: 0.2548182287003252.
[I 2024-04-04 08:51:03,624] Trial 164 finished with value: 0.2548182287003252 and parameters: {'model_name': 'SimpleImputer', 'strategy': 'mean'}. Best is trial 9 with value: 0.2548182287003252.
[I 2024-04-04 08:51:03,797] Trial 181 finished with value: 0.2747250734744102 and parameters: {'model_name': 'SimpleImputer', 'strategy': 'constant'}. Best is trial 9 with value: 0.2548182287003252.
[I 2024-04-04 08:51:03,962] Trial 184 finished with value: 0.2747250734744102 and parameters: {'model_name': 'SimpleImputer', 'strategy': 'constant'}. Best is trial 9 with value: 0.2548182287003252.
[I 2024-04-04 08:51:04,126] Trial 168 finished with value: 0.2548182287003252 and parameters: {'model_name': 'SimpleImputer', 'strategy': 'mean'}. Best is trial 9 with value: 0.2548182287003252.
[I 2024-04-04 08:51:04,382] Trial 167 finished with value: 0.2548182287003252 and parameters: {'model_name': 'SimpleImputer', 'strategy': 'mean'}. Best is trial 9 with value: 0.2548182287003252.
[I 2024-04-04 08:51:04,657] Trial 180 finished with value: 0.2747250734744102 and parameters: {'model_name': 'SimpleImputer', 'strategy': 'constant'}. Best is trial 9 with value: 0.2548182287003252.
[I 2024-04-04 08:51:04,949] Trial 178 finished with value: 0.2548182287003252 and parameters: {'model_name': 'SimpleImputer', 'strategy': 'mean'}. Best is trial 9 with value: 0.2548182287003252.
[I 2024-04-04 08:51:05,173] Trial 162 finished with value: 0.2548182287003252 and parameters: {'model_name': 'SimpleImputer', 'strategy': 'mean'}. Best is trial 9 with value: 0.2548182287003252.
[I 2024-04-04 08:51:05,381] Trial 189 finished with value: 0.2747250734744102 and parameters: {'model_name': 'SimpleImputer', 'strategy': 'constant'}. Best is trial 9 with value: 0.2548182287003252.
[I 2024-04-04 08:51:05,562] Trial 172 finished with value: 0.2548182287003252 and parameters: {'model_name': 'SimpleImputer', 'strategy': 'mean'}. Best is trial 9 with value: 0.2548182287003252.
[I 2024-04-04 08:51:05,805] Trial 163 finished with value: 0.2548182287003252 and parameters: {'model_name': 'SimpleImputer', 'strategy': 'mean'}. Best is trial 9 with value: 0.2548182287003252.
[I 2024-04-04 08:51:06,055] Trial 182 finished with value: 0.2747250734744102 and parameters: {'model_name': 'SimpleImputer', 'strategy': 'constant'}. Best is trial 9 with value: 0.2548182287003252.
[I 2024-04-04 08:51:06,231] Trial 192 finished with value: 0.2747250734744102 and parameters: {'model_name': 'SimpleImputer', 'strategy': 'constant'}. Best is trial 9 with value: 0.2548182287003252.
[I 2024-04-04 08:51:06,402] Trial 171 finished with value: 0.2548182287003252 and parameters: {'model_name': 'SimpleImputer', 'strategy': 'mean'}. Best is trial 9 with value: 0.2548182287003252.
[I 2024-04-04 08:51:06,567] Trial 166 finished with value: 0.2548182287003252 and parameters: {'model_name': 'SimpleImputer', 'strategy': 'mean'}. Best is trial 9 with value: 0.2548182287003252.
[I 2024-04-04 08:51:06,804] Trial 196 finished with value: 0.2747250734744102 and parameters: {'model_name': 'SimpleImputer', 'strategy': 'constant'}. Best is trial 9 with value: 0.2548182287003252.
[I 2024-04-04 08:51:07,058] Trial 174 finished with value: 0.2548182287003252 and parameters: {'model_name': 'SimpleImputer', 'strategy': 'mean'}. Best is trial 9 with value: 0.2548182287003252.
[I 2024-04-04 08:51:07,231] Trial 179 finished with value: 0.2548182287003252 and parameters: {'model_name': 'SimpleImputer', 'strategy': 'mean'}. Best is trial 9 with value: 0.2548182287003252.
[I 2024-04-04 08:51:07,406] Trial 170 finished with value: 0.2548182287003252 and parameters: {'model_name': 'SimpleImputer', 'strategy': 'mean'}. Best is trial 9 with value: 0.2548182287003252.
[I 2024-04-04 08:51:07,565] Trial 176 finished with value: 0.2548182287003252 and parameters: {'model_name': 'SimpleImputer', 'strategy': 'mean'}. Best is trial 9 with value: 0.2548182287003252.
[I 2024-04-04 08:51:07,806] Trial 187 finished with value: 0.2747250734744102 and parameters: {'model_name': 'SimpleImputer', 'strategy': 'constant'}. Best is trial 9 with value: 0.2548182287003252.
[I 2024-04-04 08:51:07,976] Trial 190 finished with value: 0.2747250734744102 and parameters: {'model_name': 'SimpleImputer', 'strategy': 'constant'}. Best is trial 9 with value: 0.2548182287003252.
[I 2024-04-04 08:51:08,218] Trial 186 finished with value: 0.2747250734744102 and parameters: {'model_name': 'SimpleImputer', 'strategy': 'constant'}. Best is trial 9 with value: 0.2548182287003252.
[I 2024-04-04 08:51:08,451] Trial 199 finished with value: 0.2747250734744102 and parameters: {'model_name': 'SimpleImputer', 'strategy': 'constant'}. Best is trial 9 with value: 0.2548182287003252.
[I 2024-04-04 08:51:08,625] Trial 194 finished with value: 0.2747250734744102 and parameters: {'model_name': 'SimpleImputer', 'strategy': 'constant'}. Best is trial 9 with value: 0.2548182287003252.
[I 2024-04-04 08:51:08,793] Trial 177 finished with value: 0.2548182287003252 and parameters: {'model_name': 'SimpleImputer', 'strategy': 'mean'}. Best is trial 9 with value: 0.2548182287003252.
[I 2024-04-04 08:51:09,046] Trial 188 finished with value: 0.2747250734744102 and parameters: {'model_name': 'SimpleImputer', 'strategy': 'constant'}. Best is trial 9 with value: 0.2548182287003252.
[I 2024-04-04 08:51:09,236] Trial 195 finished with value: 0.2747250734744102 and parameters: {'model_name': 'SimpleImputer', 'strategy': 'constant'}. Best is trial 9 with value: 0.2548182287003252.
[I 2024-04-04 08:51:09,471] Trial 198 finished with value: 0.2747250734744102 and parameters: {'model_name': 'SimpleImputer', 'strategy': 'constant'}. Best is trial 9 with value: 0.2548182287003252.
[I 2024-04-04 08:51:09,715] Trial 185 finished with value: 0.2747250734744102 and parameters: {'model_name': 'SimpleImputer', 'strategy': 'constant'}. Best is trial 9 with value: 0.2548182287003252.
[I 2024-04-04 08:51:09,950] Trial 191 finished with value: 0.2747250734744102 and parameters: {'model_name': 'SimpleImputer', 'strategy': 'constant'}. Best is trial 9 with value: 0.2548182287003252.
