[I 2024-04-02 11:51:03,407] Trial 196 finished with value: 7299.063376835836 and parameters: {'model_name': 'KNNImputer', 'weights': 'distance', 'keep_empty_features': False}. Best is trial 152 with value: 4299.406510968777.
[I 2024-04-02 11:51:06,592] Trial 184 finished with value: 4820.077035355111 and parameters: {'model_name': 'RandomForestImputer', 'max_iter': 3, 'decreasing': True, 'min_samples_split': 0.4, 'min_samples_leaf': 0.2, 'max_features': 0.6, 'warm_start': True}. Best is trial 152 with value: 4299.406510968777.
[I 2024-04-02 11:51:08,141] Trial 167 finished with value: 4547.602929985468 and parameters: {'model_name': 'RandomForestImputer', 'max_iter': 3, 'decreasing': False, 'min_samples_split': 0.1, 'min_samples_leaf': 0.4, 'max_features': 0.30000000000000004, 'warm_start': False}. Best is trial 152 with value: 4299.406510968777.
[I 2024-04-02 11:51:09,389] Trial 197 finished with value: 7299.063376835836 and parameters: {'model_name': 'KNNImputer', 'weights': 'distance', 'keep_empty_features': False}. Best is trial 152 with value: 4299.406510968777.
[I 2024-04-02 11:51:12,784] Trial 198 finished with value: 7299.063376835836 and parameters: {'model_name': 'KNNImputer', 'weights': 'distance', 'keep_empty_features': False}. Best is trial 152 with value: 4299.406510968777.
[I 2024-04-02 11:51:14,475] Trial 185 finished with value: 4820.07640472744 and parameters: {'model_name': 'RandomForestImputer', 'max_iter': 3, 'decreasing': True, 'min_samples_split': 0.4, 'min_samples_leaf': 0.2, 'max_features': 0.6, 'warm_start': True}. Best is trial 152 with value: 4299.406510968777.
[I 2024-04-02 11:51:19,776] Trial 199 finished with value: 7299.063376835836 and parameters: {'model_name': 'KNNImputer', 'weights': 'distance', 'keep_empty_features': False}. Best is trial 152 with value: 4299.406510968777.
[I 2024-04-02 11:51:22,559] Trial 166 finished with value: 4549.922077026547 and parameters: {'model_name': 'RandomForestImputer', 'max_iter': 3, 'decreasing': False, 'min_samples_split': 0.1, 'min_samples_leaf': 0.4, 'max_features': 0.30000000000000004, 'warm_start': False}. Best is trial 152 with value: 4299.406510968777.
[I 2024-04-02 11:51:37,873] Trial 186 finished with value: 4820.0764015552295 and parameters: {'model_name': 'RandomForestImputer', 'max_iter': 4, 'decreasing': True, 'min_samples_split': 0.4, 'min_samples_leaf': 0.2, 'max_features': 0.6, 'warm_start': True}. Best is trial 152 with value: 4299.406510968777.
[I 2024-04-02 11:51:53,178] Trial 188 finished with value: 4820.076981327674 and parameters: {'model_name': 'RandomForestImputer', 'max_iter': 4, 'decreasing': True, 'min_samples_split': 0.4, 'min_samples_leaf': 0.2, 'max_features': 0.6, 'warm_start': True}. Best is trial 152 with value: 4299.406510968777.
[I 2024-04-02 11:51:54,840] Trial 189 finished with value: 4820.076805719774 and parameters: {'model_name': 'RandomForestImputer', 'max_iter': 4, 'decreasing': True, 'min_samples_split': 0.4, 'min_samples_leaf': 0.2, 'max_features': 0.6, 'warm_start': True}. Best is trial 152 with value: 4299.406510968777.
[I 2024-04-02 11:52:02,658] Trial 192 finished with value: 4820.077115197901 and parameters: {'model_name': 'RandomForestImputer', 'max_iter': 4, 'decreasing': True, 'min_samples_split': 0.4, 'min_samples_leaf': 0.2, 'max_features': 0.7000000000000001, 'warm_start': True}. Best is trial 152 with value: 4299.406510968777.
[I 2024-04-02 11:52:16,007] Trial 168 finished with value: 4569.311474280327 and parameters: {'model_name': 'RandomForestImputer', 'max_iter': 3, 'decreasing': False, 'min_samples_split': 0.1, 'min_samples_leaf': 0.4, 'max_features': 0.30000000000000004, 'warm_start': False}. Best is trial 152 with value: 4299.406510968777.
[I 2024-04-02 11:52:42,535] Trial 169 finished with value: 4545.699153368294 and parameters: {'model_name': 'RandomForestImputer', 'max_iter': 3, 'decreasing': False, 'min_samples_split': 0.1, 'min_samples_leaf': 0.4, 'max_features': 0.30000000000000004, 'warm_start': False}. Best is trial 152 with value: 4299.406510968777.
[I 2024-04-02 11:52:46,744] Trial 171 finished with value: 4550.855886683717 and parameters: {'model_name': 'RandomForestImputer', 'max_iter': 3, 'decreasing': False, 'min_samples_split': 0.1, 'min_samples_leaf': 0.4, 'max_features': 0.30000000000000004, 'warm_start': False}. Best is trial 152 with value: 4299.406510968777.
[I 2024-04-02 11:53:05,358] Trial 170 finished with value: 4550.570919471951 and parameters: {'model_name': 'RandomForestImputer', 'max_iter': 3, 'decreasing': False, 'min_samples_split': 0.1, 'min_samples_leaf': 0.4, 'max_features': 0.6, 'warm_start': False}. Best is trial 152 with value: 4299.406510968777.
[I 2024-04-02 11:54:05,875] Trial 10 finished with value: 4547.57273746943 and parameters: {'model_name': 'RandomForestImputer', 'max_iter': 25, 'decreasing': False, 'min_samples_split': 0.5, 'min_samples_leaf': 0.5, 'max_features': 0.9, 'warm_start': False}. Best is trial 152 with value: 4299.406510968777.
[I 2024-04-02 11:54:08,920] Trial 172 finished with value: 4541.491391407618 and parameters: {'model_name': 'RandomForestImputer', 'max_iter': 3, 'decreasing': False, 'min_samples_split': 0.1, 'min_samples_leaf': 0.4, 'max_features': 0.6, 'warm_start': False}. Best is trial 152 with value: 4299.406510968777.
[I 2024-04-02 11:54:23,300] Trial 173 finished with value: 4558.321685045537 and parameters: {'model_name': 'RandomForestImputer', 'max_iter': 3, 'decreasing': False, 'min_samples_split': 0.1, 'min_samples_leaf': 0.4, 'max_features': 0.5, 'warm_start': False}. Best is trial 152 with value: 4299.406510968777.
[I 2024-04-02 11:54:35,089] Trial 174 finished with value: 4540.653751577339 and parameters: {'model_name': 'RandomForestImputer', 'max_iter': 3, 'decreasing': False, 'min_samples_split': 0.1, 'min_samples_leaf': 0.4, 'max_features': 0.6, 'warm_start': False}. Best is trial 152 with value: 4299.406510968777.
[I 2024-04-02 11:54:42,295] Trial 176 finished with value: 4535.952663416357 and parameters: {'model_name': 'RandomForestImputer', 'max_iter': 3, 'decreasing': False, 'min_samples_split': 0.4, 'min_samples_leaf': 0.4, 'max_features': 0.6, 'warm_start': False}. Best is trial 152 with value: 4299.406510968777.
[I 2024-04-02 11:54:46,735] Trial 178 finished with value: 4561.797861048088 and parameters: {'model_name': 'RandomForestImputer', 'max_iter': 3, 'decreasing': False, 'min_samples_split': 0.4, 'min_samples_leaf': 0.4, 'max_features': 0.6, 'warm_start': False}. Best is trial 152 with value: 4299.406510968777.
[I 2024-04-02 11:54:52,731] Trial 175 finished with value: 4539.4392664991665 and parameters: {'model_name': 'RandomForestImputer', 'max_iter': 3, 'decreasing': False, 'min_samples_split': 0.1, 'min_samples_leaf': 0.4, 'max_features': 0.6, 'warm_start': False}. Best is trial 152 with value: 4299.406510968777.
[I 2024-04-02 11:55:03,334] Trial 179 finished with value: 4532.624967317866 and parameters: {'model_name': 'RandomForestImputer', 'max_iter': 3, 'decreasing': True, 'min_samples_split': 0.4, 'min_samples_leaf': 0.4, 'max_features': 0.6, 'warm_start': False}. Best is trial 152 with value: 4299.406510968777.
[I 2024-04-02 11:56:21,739] Trial 187 finished with value: 4421.065909798955 and parameters: {'model_name': 'RandomForestImputer', 'max_iter': 4, 'decreasing': True, 'min_samples_split': 0.4, 'min_samples_leaf': 0.2, 'max_features': 0.6, 'warm_start': False}. Best is trial 152 with value: 4299.406510968777.
[I 2024-04-02 11:56:32,521] Trial 193 finished with value: 4397.244831041774 and parameters: {'model_name': 'RandomForestImputer', 'max_iter': 4, 'decreasing': True, 'min_samples_split': 0.4, 'min_samples_leaf': 0.2, 'max_features': 0.7000000000000001, 'warm_start': False}. Best is trial 152 with value: 4299.406510968777.
[I 2024-04-02 11:56:38,232] Trial 191 finished with value: 4344.238252506923 and parameters: {'model_name': 'RandomForestImputer', 'max_iter': 4, 'decreasing': True, 'min_samples_split': 0.4, 'min_samples_leaf': 0.2, 'max_features': 0.7000000000000001, 'warm_start': False}. Best is trial 152 with value: 4299.406510968777.
[I 2024-04-02 11:56:44,959] Trial 50 finished with value: 4322.373811688382 and parameters: {'model_name': 'RandomForestImputer', 'max_iter': 31, 'decreasing': True, 'min_samples_split': 0.4, 'min_samples_leaf': 0.2, 'max_features': 0.8, 'warm_start': False}. Best is trial 152 with value: 4299.406510968777.
[I 2024-04-02 11:56:48,153] Trial 190 finished with value: 4298.268766256637 and parameters: {'model_name': 'RandomForestImputer', 'max_iter': 4, 'decreasing': True, 'min_samples_split': 0.4, 'min_samples_leaf': 0.2, 'max_features': 0.6, 'warm_start': False}. Best is trial 190 with value: 4298.268766256637.
[I 2024-04-02 11:56:55,797] Trial 195 finished with value: 4337.346050837762 and parameters: {'model_name': 'RandomForestImputer', 'max_iter': 4, 'decreasing': True, 'min_samples_split': 0.4, 'min_samples_leaf': 0.2, 'max_features': 0.7000000000000001, 'warm_start': False}. Best is trial 190 with value: 4298.268766256637.
[I 2024-04-02 11:56:58,430] Trial 20 finished with value: 4316.667450269298 and parameters: {'model_name': 'RandomForestImputer', 'max_iter': 32, 'decreasing': False, 'min_samples_split': 0.30000000000000004, 'min_samples_leaf': 0.2, 'max_features': 0.8, 'warm_start': False}. Best is trial 190 with value: 4298.268766256637.
[I 2024-04-02 11:57:45,411] Trial 43 finished with value: 8235.607378397941 and parameters: {'model_name': 'GAIN', 'batch_size': 5, 'hint_rate': 0.85, 'alpha': 8, 'iterations': 1038}. Best is trial 190 with value: 4298.268766256637.
[I 2024-04-02 11:58:12,555] Trial 38 finished with value: 8002.99466722465 and parameters: {'model_name': 'GAIN', 'batch_size': 5, 'hint_rate': 0.41000000000000003, 'alpha': 8, 'iterations': 1100}. Best is trial 190 with value: 4298.268766256637.
[I 2024-04-02 11:58:20,106] Trial 19 finished with value: inf and parameters: {'model_name': 'GAIN', 'batch_size': 280, 'hint_rate': 0.93, 'alpha': 2, 'iterations': 4454}. Best is trial 190 with value: 4298.268766256637.
[I 2024-04-02 11:59:11,094] Trial 61 finished with value: 4376.031464318983 and parameters: {'model_name': 'RandomForestImputer', 'max_iter': 38, 'decreasing': False, 'min_samples_split': 0.2, 'min_samples_leaf': 0.30000000000000004, 'max_features': 0.6, 'warm_start': False}. Best is trial 190 with value: 4298.268766256637.
[I 2024-04-02 11:59:30,872] Trial 55 finished with value: 7504.745875748779 and parameters: {'model_name': 'GAIN', 'batch_size': 22, 'hint_rate': 0.7000000000000001, 'alpha': 39, 'iterations': 1255}. Best is trial 190 with value: 4298.268766256637.
[I 2024-04-02 12:03:49,622] Trial 103 finished with value: 4214.207014362284 and parameters: {'model_name': 'RandomForestImputer', 'max_iter': 54, 'decreasing': False, 'min_samples_split': 0.0, 'min_samples_leaf': 0.1, 'max_features': 0.5, 'warm_start': False}. Best is trial 103 with value: 4214.207014362284.
[I 2024-04-02 12:03:52,904] Trial 94 finished with value: 4547.539161696424 and parameters: {'model_name': 'RandomForestImputer', 'max_iter': 74, 'decreasing': False, 'min_samples_split': 0.9, 'min_samples_leaf': 0.6, 'max_features': 0.4, 'warm_start': False}. Best is trial 103 with value: 4214.207014362284.
[I 2024-04-02 12:04:00,738] Trial 104 finished with value: 4557.479631861388 and parameters: {'model_name': 'RandomForestImputer', 'max_iter': 62, 'decreasing': False, 'min_samples_split': 0.1, 'min_samples_leaf': 0.6, 'max_features': 0.5, 'warm_start': False}. Best is trial 103 with value: 4214.207014362284.
[I 2024-04-02 12:04:37,526] Trial 49 finished with value: inf and parameters: {'model_name': 'GAIN', 'batch_size': 10, 'hint_rate': 0.21000000000000002, 'alpha': 74, 'iterations': 28436}. Best is trial 103 with value: 4214.207014362284.
[I 2024-04-02 12:05:35,848] Trial 63 finished with value: 4550.546271087949 and parameters: {'model_name': 'RandomForestImputer', 'max_iter': 90, 'decreasing': False, 'min_samples_split': 0.6000000000000001, 'min_samples_leaf': 0.7000000000000001, 'max_features': 0.2, 'warm_start': False}. Best is trial 103 with value: 4214.207014362284.
[I 2024-04-02 12:05:40,458] Trial 93 finished with value: 4555.052871666259 and parameters: {'model_name': 'RandomForestImputer', 'max_iter': 86, 'decreasing': False, 'min_samples_split': 0.9, 'min_samples_leaf': 0.6, 'max_features': 0.4, 'warm_start': False}. Best is trial 103 with value: 4214.207014362284.
[I 2024-04-02 12:06:27,334] Trial 101 finished with value: 4260.255930812238 and parameters: {'model_name': 'RandomForestImputer', 'max_iter': 74, 'decreasing': False, 'min_samples_split': 0.0, 'min_samples_leaf': 0.1, 'max_features': 0.9, 'warm_start': False}. Best is trial 103 with value: 4214.207014362284.
[I 2024-04-02 12:06:33,112] Trial 102 finished with value: 4209.7187882387 and parameters: {'model_name': 'RandomForestImputer', 'max_iter': 85, 'decreasing': False, 'min_samples_split': 0.0, 'min_samples_leaf': 0.1, 'max_features': 0.5, 'warm_start': False}. Best is trial 102 with value: 4209.7187882387.
